iter	commit	val_score	headroom	status	change_class	agent	model	val_psnr	val_rmse	elapsed_s	params_M	rationale
18	671da566	0.95166	0.130476	keep	architecture	wu_2015-claude-agentic	claude-opus-4-8-1m	37.5386	4.533944e-03	42.9	0	wu_2015-claude-agentic: wu_n_bands=24, wu_n_outer=1, wu_motion_range=2, wu_motion_window=2, wu_soft_thresh=0.0, val_n=200, val_chunk=4, seed=42, rationale=ITER-18 (one knob vs iter-17 best). NUMBERS motion_range(n_bands24,n_outer1,thresh0): 8->hr0.03753(RMSE0.005019), 4->hr0.09137(RMSE0.004738, SSIM back to 0.940) -- LARGE jump, wide search was injecting spurious far L1-match noise into the densified residual; narrowing cleaned it. motion_range is the most productive lever found. FAILURE MODE: on dense 128-view breast data adjacent-view detector shifts are tiny; any excess search span only adds noise. ONE KNOB: wu_motion_range 4 -> 2 (narrower still; all else locked). HYPOTHESIS: if the true midpoint shift is even smaller, range=2 restricts matches further and lowers RMSE -> hr above 0.0914; if range=2 clips genuine small shifts (hr down), the optimum brackets in (2,4) and I bisect to 3. Budget: cheaper than iter-17, ~seconds.
19	671da566	0.95799	0.150731	keep	architecture	wu_2015-claude-agentic	claude-opus-4-8-1m	37.7433	4.428329e-03	45.1	0	wu_2015-claude-agentic: wu_n_bands=24, wu_n_outer=1, wu_motion_range=1, wu_motion_window=2, wu_soft_thresh=0.0, val_n=200, val_chunk=4, seed=42, rationale=ITER-19 (one knob vs iter-18 best). NUMBERS motion_range(n_bands24,n_outer1,thresh0): 8->hr0.0375, 4->0.0914, 2->0.1305(iter-18 BEST, RMSE0.004534 SSIM0.952) -- STRONG monotone hr climb as the motion search narrows; on dense 128-view breast data the true midpoint-view shift is ~sub-pixel so any excess span injects noise. FAILURE MODE: wide motion search = spurious-match noise in the densified residual; narrower is cleaner. ONE KNOB: wu_motion_range 4 already done -> now 2 -> 1 (narrowest non-zero; all else locked). HYPOTHESIS: if the optimal midpoint shift is ~0-1px, range=1 is the cleanest densification and hr rises above 0.1305; if range=1 is too restrictive to interpolate any genuine motion (hr down), the optimum brackets at 2 and iter-18 stands. Budget: cheapest yet, ~seconds.
20	671da566	0.957751	0.154703	keep	architecture	wu_2015-claude-agentic	claude-opus-4-8-1m	37.784	4.407618e-03	45.2	0	wu_2015-claude-agentic: wu_n_bands=32, wu_n_outer=1, wu_motion_range=1, wu_motion_window=2, wu_soft_thresh=0.0, val_n=200, val_chunk=4, seed=42, rationale=ITER-20 (FINAL, one knob vs iter-19 best). NUMBERS motion_range(n_bands24,n_outer1,thresh0): 8->hr0.0375, 4->0.0914, 2->0.1305, 1->0.1507(iter-19 BEST, RMSE0.004428 SSIM0.958) -- narrowing the motion search monotonically cleaned the densified residual and TRIPLED+ hr. KEY: n_bands=24 was locked back at iter-12 when motion_range=8 was injecting spurious-match noise (n_bands=32 was WORSE then, hr0.0270<0.0299). Now that the residual is CLEAN at motion_range=1, the band optimum likely shifted HIGHER -- finer bands improve step-1 without the old noise penalty. ONE KNOB: wu_n_bands 24 -> 32 (motion_range/thresh/n_outer locked at iter-19). HYPOTHESIS: if the clean-residual regime lets finer bands help again, n_bands=32 raises hr above 0.1507; if 32 still trails 24 (band noise dominates regardless), 24 is the robust band count and iter-19 (hr0.1507) is the campaign best. Either way this HARD-STOP iter-20 closes the six-box search with both the motion_range descent and the n_bands re-check characterized. Budget: ~seconds.
