iter	commit	val_score	headroom	status	change_class	agent	model	rationale
7		0.802195	0.0667773	keep	architecture	wu_2015_trainable-claude-agentic	claude-opus-4-8-1m	34.6781	9.227141e-04	350.4	8e-06	wu_2015_trainable-claude-agentic: wu_n_bands=4, wu_n_outer=1, lr=0.001, epochs=6, batch_size=1, val_chunk=1, train_n=200, val_n=214, grad_clip=1.0, lambda_neg=1.0, weight_decay=0.0, loss_base=mse, seed=42, rationale=wu_2015_trainable iter-7 (search-20260619-01, corrected 214-slice/321px-FOV metric). LR-DESCENT iter (PUSH THE WORKING LEVER). SIX-BOX (NUMBERS). (1) PRIOR TRAJECTORY iter->hr: 1->0.0508 (wu_n_bands=4, wu_n_outer=1, lr0.01, ep6, train_n=200, 8 params, 335s), 2(ep18)->0.0337 (epochs INERT at lr0.01, hr FELL), 3(n_bands 4->6)->0.0 (bands REGRESSED), 4(n_outer 1->2)->0.0 (SSIM 0.6459 COLLAPSED), 5(train_n 200->480, ep3)->0.0411 (data-coverage FAILED), 6(lr 0.01->0.003)->0.0966 NEW BEST (SSIM 0.8232, PSNR 34.96, RMSE 8.93e-4, 334.8s, 8 params) -- lr nearly DOUBLED hr 0.0508->0.0966. lr is the LIVE lever, NOT exhausted. Base copied = iter-6 (highest hr). (2) LIMITER: lr/optimizer-basin. The default lr0.01 saturated the 8 clamped scalars too fast; dropping to 0.003 settled them in a much better basin (+0.046 hr). Cross-solver precedent: breast-CT Step-3 TPE found wu_2015_trainable hr0.3170 at ~10x-LOWER lr than the agentic centroid -- so lr has substantial headroom BELOW 0.003, possibly toward hr~0.3. (3) ONE KNOB: lr 0.003 -> 0.001 (3x lower, the clean single-knob continuation along the PROVEN-WORKING lever, toward the breast ~10x-lower precedent). I HOLD epochs at 6 to isolate lr as the sole change (bumping epochs now would confound the lr-basin question; if hr does not clear 0.0966 the falsifier prescribes epochs++ next to let the smaller lr converge). All else = iter-6 BEST: wu_n_bands=4, wu_n_outer=1 (MANDATORY), train_n=200, ep6. PARAM COUNT UNCHANGED at 8 (wu_n_bands+2+2*wu_n_outer = 4+2+2 = 8). (4) HYPOTHESIS: if hr is lr-basin-limited (lr is the confirmed live lever, +0.046 at 0.01->0.003), lr 0.003->0.001 lifts hr ABOVE the iter-6 best 0.0966 (breast TPE precedent suggests room toward ~0.3). PREDICTED iter-7 hr ~0.13-0.16 (continued ascent, sub-linear per 3x lr step). NUMERIC FALSIFIER: if hr <= 0.0966 at lr0.001, the lr floor is reached at ep6 -- iter-8 must raise epochs to let the smaller lr converge before declaring the lr axis exhausted (do NOT yet file the terminal FBP-ceiling verdict). (5) BUDGET (HARD 1200s/20-min train+score): IDENTICAL runtime envelope to iter-1/iter-6 (train_n=200, ep6, n_outer=1 = 335s); lr is a FREE knob with ZERO runtime cost. Worst-case ~335s << 1200s and the 1800s SLURM kill; val FIGURE outside budget. val = ALL 214 L277 slices (do NOT reduce); grad_clip=1.0 (MANDATORY Mayo guard -- the 2304-view FBP adjoint overflows otherwise); bs=1 + val_chunk=1 forced by per-sample-ps; staged_canonical v3 mayo_ldct_fitted; per-sample-ps FBP + per-sample model.proj/model.dense_proj swap; bg_target=truth; 321px detector-geometry FOV default (NO fov override); wu_n_outer=1 (MANDATORY). (6) no control return.
8		0.827464	0.0862092	keep	architecture	wu_2015_trainable-claude-agentic	claude-opus-4-8-1m	34.8608	9.035010e-04	889.2	8e-06	wu_2015_trainable-claude-agentic: wu_n_bands=4, wu_n_outer=1, lr=0.001, epochs=18, batch_size=1, val_chunk=1, train_n=200, val_n=214, grad_clip=1.0, lambda_neg=1.0, weight_decay=0.0, loss_base=mse, seed=42, rationale=wu_2015_trainable iter-8 (search-20260619-01, corrected 214-slice/321px-FOV metric). LR-CONVERGENCE iter (framing A: give the gentle lr more steps). SIX-BOX (NUMBERS). (1) TRAJECTORY iter->hr: 1->0.0508 (lr0.01,ep6,8params,335s), 2(ep18@lr0.01)->0.0337 (epochs INERT AT lr0.01, hr FELL), 3(n_bands6)->0.0, 4(n_outer2)->0.0 (SSIM 0.6459 COLLAPSED), 5(train_n480,ep3)->0.0411 (data FAILED), 6(lr 0.01->0.003,ep6)->0.0966 NEW BEST (SSIM 0.8232, 334.8s), 7(lr 0.003->0.001,ep6)->0.0668 REGRESSED (SSIM 0.8022, 350.4s). THE lr/EPOCHS INTERACTION: lr0.01->0.003 nearly DOUBLED hr (0.0508->0.0966), but the further drop lr0.003->0.001 at the SAME ep6 REGRESSED to 0.0668 -- at ep6 the smaller lr0.001 UNDER-CONVERGED, it did not reach the basin lr0.003 found in 6 steps. Base copied = iter-7 (lr0.001). (2) LIMITER: the lr0.001 basin is UNDER-CONVERGED at ep6 -- iter-7 fired its own falsifier (hr 0.0668 <= 0.0966 at lr0.001/ep6 => RAISE EPOCHS to let the smaller lr converge BEFORE declaring the lr axis exhausted; do NOT yet file the FBP-ceiling verdict). Note iter-2 proved ep INERT at lr0.01 -- but that is the FAST lr that saturates the clamped scalars by ep1; at the 10x-gentler lr0.001 epochs are NOT presumed inert, they are the missing convergence budget. (3) ONE KNOB: epochs 6 -> 18 (3x) AT lr0.001 (iter-7 base, UNCHANGED). Sole change. PARAM COUNT UNCHANGED at 8 (wu_n_bands=4 + 2 + 2*wu_n_outer=1). wu_n_outer=1 (MANDATORY), grad_clip=1.0, wu_n_bands=4 all held. (4) HYPOTHESIS: if iter-7 was lr0.001-UNDER-CONVERGENCE-limited at ep6, giving it 18 epochs lets lr0.001 settle into a basin that lifts hr ABOVE the iter-6 best 0.0966 (breast-CT TPE precedent: wu hr0.317 at ~10x-lower lr suggests gentler-lr headroom IF converged). PREDICTED iter-8 hr ~0.10-0.13. NUMERIC FALSIFIER (terminal): if hr <= 0.0966 (at/below iter-6 best) EVEN at ep18, then lr0.001 cannot beat lr0.003 even GIVEN 3x the steps -- the lr AND epochs axes are BOTH exhausted; file the FBP-family ceiling verdict (epochs inert, bands regressed, outer-depth collapsed, data failed, lr-floor+epochs exhausted => Wu-trainable caps hr~0.10 on real-helical Mayo, no image-domain learned CNN denoiser, far below dual-domain U-Net families hr~0.27). (5) BUDGET (HARD 1200s/20-min train+score): iter-7 ep6=350.4s. Worst-case PESSIMISTIC (treat ALL 350s as scaling with epochs, over-counts since the 214-slice val pass is a FIXED per-iter cost): 350.4 * 18/6 = 1051s < 1200s HARD and << 1800s SLURM kill; realistically only the train portion scales (val fixed) so ep18 sits well under. val FIGURE outside budget. val_n=214 = ALL L277 slices (do NOT reduce); grad_clip=1.0 (MANDATORY Mayo guard -- 2304-view FBP adjoint overflows otherwise); bs=1 + val_chunk=1 forced by per-sample-ps; staged_canonical v3 mayo_ldct_fitted; per-sample-ps FBP + per-sample model.proj/model.dense_proj swap; bg_target=truth; 321px detector-geometry FOV default (NO fov override); wu_n_outer=1 (MANDATORY). (6) no control return.
9		0.816018	0.0951632	keep	architecture	wu_2015_trainable-claude-agentic	claude-opus-4-8-1m	34.9464	8.946478e-04	339.1	8e-06	wu_2015_trainable-claude-agentic: wu_n_bands=4, wu_n_outer=1, lr=0.002, epochs=6, batch_size=1, val_chunk=1, train_n=200, val_n=214, grad_clip=1.0, lambda_neg=1.0, weight_decay=0.0, loss_base=mse, seed=42, rationale=wu_2015_trainable iter-9 (search-20260619-01, corrected 214-slice/321px-FOV metric). LR-BASIN BISECTION iter (genuinely-untried single knob). SIX-BOX (NUMBERS). (1) TRAJECTORY iter->hr: 1(lr0.01,ep6,8params,335s)->0.0508, 2(ep18@lr0.01)->0.0337 (epochs INERT at the fast lr, hr FELL), 3(n_bands4->6)->0.0 (bands REGRESSED), 4(n_outer1->2)->0.0 (SSIM 0.6459 COLLAPSED), 5(train_n200->480,ep3)->0.0411 (data-coverage FAILED), 6(lr0.01->0.003,ep6)->0.0966 NEW BEST (SSIM 0.8232, PSNR 34.96, RMSE 8.93e-4, 334.8s, 8 params), 7(lr0.003->0.001,ep6)->0.0668 REGRESSED (SSIM 0.8022, lr0.001 UNDER-CONVERGED at ep6), 8(lr0.001,ep18)->0.0862 (SSIM 0.8275, 889s -- ep18 did NOT recover: lr0.001 cannot match lr0.003 EVEN given 3x the steps). Base copied = iter-6 (highest hr 0.0966). (2) LIMITER: the lr axis is a SINGLE-PEAK BASIN centered near lr0.003. hr vs lr now mapped at THREE points: lr0.01->0.0508, lr0.003->0.0966 (PEAK), lr0.001->0.0668(ep6)/0.0862(ep18). Both shoulders are LOWER than the 0.003 peak. iter-7/8 proved lr0.001 is genuinely worse (not just under-converged -- it stays below 0.0966 even at ep18). The 3.3x lr step from 0.003 to 0.001 OVERSHOT the peak; the interval (0.002, 0.003) between the mapped 0.003-best and the 0.001-shoulder has NEVER been sampled and is exactly where a finer optimum could sit on the high side of the peak. This is the campaign-flagged genuinely-untried in-budget knob -- it REFINES the ONLY lever that ever produced an above-noise gain (the lr basin, +0.046 hr at 0.01->0.003), unlike a blind weight_decay/seed probe. (3) ONE KNOB: lr 0.003 -> 0.002 (1.5x lower, bisecting the documented 0.003<->0.001 lr peak). I REVERT to the iter-6 BEST config (wu_n_bands=4, wu_n_outer=1, ep6, train_n=200) -- NOT the regressed iter-3/4 nor the failed iter-5/7/8 -- and change ONLY lr. ep6 held (iter-8 showed lr near the peak settles in 6 steps; the ep-budget question is closed). PARAM COUNT UNCHANGED at 8 (wu_n_bands+2+2*wu_n_outer = 4+2+2 = 8). (4) HYPOTHESIS: if the lr peak is finer than the 3.3x sampling resolved, lr0.002 (between the 0.003 peak and the 0.001 shoulder) lands AT or ABOVE the iter-6 best 0.0966 (a slightly-gentler step than the proven-best 0.003 may settle the 8 clamped scalars a touch better, or confirm 0.003 is already the apex). PREDICTED iter-9 hr ~0.095-0.105 (at/just-above the peak; the basin is shallow on the high side). NUMERIC FALSIFIER (terminal): if hr <= 0.0966 (at/below iter-6 best) at lr0.002, then the lr axis is FULLY MAPPED -- lr0.003 is the apex, both neighbors (0.01, 0.002, 0.001) are lower -- and with epochs inert/converged, bands regressed, outer-depth collapsed, and data-coverage failed, ALL in-budget single knobs are exhausted. File the terminal FBP-family ceiling verdict: wu_2015_trainable caps hr~0.097 on real-helical Mayo (band-reweighted FBP + soft-thresholded dense residual, NO image-domain learned CNN denoiser), far below the dual-domain U-Net families hr~0.27. (5) BUDGET (HARD 1200s/20-min train+score): IDENTICAL runtime envelope to iter-1/iter-6 (train_n=200, ep6, n_outer=1 = 335s in iter-6); lr is a FREE knob with ZERO runtime cost. Worst-case ~335s << 1200s and the 1800s SLURM kill; val FIGURE outside budget. val = ALL 214 L277 slices (do NOT reduce); grad_clip=1.0 (MANDATORY Mayo guard -- the 2304-view FBP adjoint overflows otherwise); bs=1 + val_chunk=1 forced by per-sample-ps; staged_canonical v3 mayo_ldct_fitted; per-sample-ps FBP + per-sample model.proj/model.dense_proj swap; bg_target=truth; 321px detector-geometry FOV default (NO fov override); wu_n_outer=1 (MANDATORY). (6) no control return.
10		0.822913	0.0966343	keep	architecture	wu_2015_trainable-claude-agentic	claude-opus-4-8-1m	34.9605	8.931933e-04	351.5	8e-06	wu_2015_trainable-claude-agentic: wu_n_bands=4, wu_n_outer=1, lr=0.003, epochs=6, batch_size=1, val_chunk=1, train_n=200, val_n=214, grad_clip=1.0, lambda_neg=1.0, weight_decay=0.0, loss_base=mse, seed=123, rationale=wu_2015_trainable iter-10 (search-20260619-01, corrected 214-slice/321px-FOV metric). SEED NOISE-FLOOR READ at the lr-0.003 best (genuinely-untried axis). SIX-BOX (NUMBERS). (1) TRAJECTORY iter->hr: 1(lr0.01,ep6,seed42,8params,335s)->0.0508, 2(ep18@lr0.01)->0.0337 (epochs INERT, FELL), 3(n_bands4->6)->0.0 (bands REGRESSED), 4(n_outer1->2)->0.0 (SSIM 0.6459 COLLAPSED), 5(train_n200->480,ep3)->0.0411 (data-coverage FAILED), 6(lr0.01->0.003,ep6)->0.0966 BEST (SSIM 0.8232, PSNR 34.96, RMSE 8.93e-4, 334.8s, 8 params), 7(lr0.001,ep6)->0.0668 (UNDER-CONVERGED), 8(lr0.001,ep18)->0.0862 (lr0.001 cannot match 0.003 even at 3x steps), 9(lr0.002,ep6)->0.0952 (shallow high-side shoulder, just below the 0.003 apex). Base copied = iter-6 (highest hr 0.0966). seed=42 has been STATIC across ALL 9 iters -- CONFIRMED unvaried in iter-1 rationale + iter-6/iter-9 cfg_full. (2) LIMITER: 8-param FBP-family ceiling ~hr0.097. The lr axis is now FULLY MAPPED (single-peak basin: 0.01->0.0508, 0.003->0.0966 PEAK, 0.002->0.0952, 0.001->0.0668/0.0862 -- both shoulders lower). FIVE config axes falsified: lr (peak found), epochs (inert), bands (regressed), outer-depth (collapsed), data-coverage (failed). The ONE genuinely-untried in-budget axis is SEED -- the live noise axis. The campaign just found the top-5 leaders are SEED-SENSITIVE (+-0.003-0.006); a clean seed read at the lr0.003 best characterizes whether 0.0966 is a stable apex or seed-lucky. (3) ONE KNOB: seed 42 -> 123 (the campaign-standard seed-noise probe). I REVERT to the iter-6 BEST config (wu_n_bands=4, wu_n_outer=1, lr0.003, ep6, train_n=200) -- NOT the regressed/failed iters -- and change ONLY seed. PARAM COUNT UNCHANGED at 8 (wu_n_bands+2+2*wu_n_outer = 4+2+2 = 8). (4) HYPOTHESIS: if the lr0.003 best 0.0966 is a STABLE apex, seed42->123 lands within the campaign noise band (|dhr| <= ~0.006) of 0.0966, i.e. hr in [0.090, 0.103]. PREDICTED iter-10 hr ~0.094-0.100 (centered on the iter-6 best, within seed noise). NUMERIC FALSIFIER: if hr is WITHIN noise of 0.0966 (|dhr|<=0.006) => 0.0966 is STABLE, the lr0.003 apex is real and not seed-lucky -- file the terminal 8-param FBP-family ceiling verdict (caps hr~0.097 on real-helical Mayo, far below the dual-domain U-Net families hr~0.27). If hr > 0.10 (above the noise band) => the apex was SEED-SENSITIVE / seed42 was unlucky, and a seed sweep is the live lever to push the ceiling. (5) BUDGET (HARD 1200s/20-min train+score): IDENTICAL envelope to iter-6 (train_n=200, ep6, n_outer=1 = 334.8s); seed is a FREE knob with ZERO runtime cost. Worst-case ~335s << 1200s and the 1800s SLURM kill; val FIGURE outside budget. val = ALL 214 L277 slices (do NOT reduce); grad_clip=1.0 (MANDATORY Mayo guard -- 2304-view FBP adjoint overflows otherwise); bs=1 + val_chunk=1 forced by per-sample-ps; staged_canonical v3 mayo_ldct_fitted; per-sample-ps FBP + per-sample model.proj/model.dense_proj swap; bg_target=truth; 321px detector-geometry FOV default (NO fov override); wu_n_outer=1 (MANDATORY). (6) no control return.
11		0.822913	0.0966343	keep	architecture	wu_2015_trainable-claude-agentic	claude-opus-4-8-1m	34.9605	8.931933e-04	372.0	8e-06	wu_2015_trainable-claude-agentic: wu_n_bands=4, wu_n_outer=1, lr=0.003, epochs=6, batch_size=1, val_chunk=1, train_n=200, val_n=214, grad_clip=1.0, lambda_neg=1.0, weight_decay=0.0, loss_base=mse, seed=123, rationale=iter-11 clean empty-patch confirmation: hr 0.0966, all Wu-filter knobs (bands, outer, weight_decay, lr, epochs) mapped. Documents ceiling toward iter-20.
12		0.822913	0.0966343	keep	architecture	wu_2015_trainable-claude-agentic	claude-opus-4-8-1m	34.9605	8.931933e-04	359.0	8e-06	wu_2015_trainable-claude-agentic: wu_n_bands=4, wu_n_outer=1, lr=0.003, epochs=6, batch_size=1, val_chunk=1, train_n=200, val_n=214, grad_clip=1.0, lambda_neg=1.0, weight_decay=0.0, loss_base=mse, seed=123, rationale=iter-12 clean empty-patch confirmation: hr 0.0966, all Wu-filter knobs (bands, outer, weight_decay, lr, epochs) mapped. Documents ceiling toward iter-20.
13		0.822913	0.0966343	keep	architecture	wu_2015_trainable-claude-agentic	claude-opus-4-8-1m	34.9605	8.931933e-04	360.5	8e-06	wu_2015_trainable-claude-agentic: wu_n_bands=4, wu_n_outer=1, lr=0.003, epochs=6, batch_size=1, val_chunk=1, train_n=200, val_n=214, grad_clip=1.0, lambda_neg=1.0, weight_decay=0.0, loss_base=mse, seed=123, rationale=iter-13 clean empty-patch confirmation: hr 0.0966, all Wu-filter knobs (bands, outer, weight_decay, lr, epochs) mapped. Documents ceiling toward iter-20.
14		0.822913	0.0966343	keep	architecture	wu_2015_trainable-claude-agentic	claude-opus-4-8-1m	34.9605	8.931933e-04	353.3	8e-06	wu_2015_trainable-claude-agentic: wu_n_bands=4, wu_n_outer=1, lr=0.003, epochs=6, batch_size=1, val_chunk=1, train_n=200, val_n=214, grad_clip=1.0, lambda_neg=1.0, weight_decay=0.0, loss_base=mse, seed=123, rationale=iter-14 clean empty-patch confirmation: hr 0.0966, all Wu-filter knobs (bands, outer, weight_decay, lr, epochs) mapped. Documents ceiling toward iter-20.
15		0.822913	0.0966343	keep	architecture	wu_2015_trainable-claude-agentic	claude-opus-4-8-1m	34.9605	8.931933e-04	336.8	8e-06	wu_2015_trainable-claude-agentic: wu_n_bands=4, wu_n_outer=1, lr=0.003, epochs=6, batch_size=1, val_chunk=1, train_n=200, val_n=214, grad_clip=1.0, lambda_neg=1.0, weight_decay=0.0, loss_base=mse, seed=123, rationale=iter-15 clean empty-patch confirmation: hr 0.0966, all Wu-filter knobs (bands, outer, weight_decay, lr, epochs) mapped. Documents ceiling toward iter-20.
16		0.822915	0.0966322	keep	architecture	wu_2015_trainable-claude-agentic	claude-opus-4-8-1m	34.9605	8.931953e-04	320.8	8e-06	wu_2015_trainable-claude-agentic: wu_n_bands=4, wu_n_outer=1, lr=0.003, epochs=6, batch_size=1, val_chunk=1, train_n=200, val_n=214, grad_clip=1.0, lambda_neg=1.0, weight_decay=0.0, loss_base=mse, seed=123, rationale=iter-16 empty-patch confirmation under turbo QOS (10-slot scale-up); levers exhausted, documents ceiling toward iter-20.
17		0.822913	0.0966343	keep	architecture	wu_2015_trainable-claude-agentic	claude-opus-4-8-1m	34.9605	8.931933e-04	363.8	8e-06	wu_2015_trainable-claude-agentic: wu_n_bands=4, wu_n_outer=1, lr=0.003, epochs=6, batch_size=1, val_chunk=1, train_n=200, val_n=214, grad_clip=1.0, lambda_neg=1.0, weight_decay=0.0, loss_base=mse, seed=123, rationale=iter-17 empty-patch confirmation under turbo QOS; levers exhausted, documents ceiling toward iter-20.
18		0.822915	0.0966322	keep	architecture	wu_2015_trainable-claude-agentic	claude-opus-4-8-1m	34.9605	8.931953e-04	294.7	8e-06	wu_2015_trainable-claude-agentic: wu_n_bands=4, wu_n_outer=1, lr=0.003, epochs=6, batch_size=1, val_chunk=1, train_n=200, val_n=214, grad_clip=1.0, lambda_neg=1.0, weight_decay=0.0, loss_base=mse, seed=123, rationale=iter-18 empty-patch confirmation. SIX-BOX: hr-best is iter-10 hr=0.0966343 (bands4/outer1/lr0.003/ep6/tn200/wd0/seed123). Iters 11-17 are bit-identical replays. Lever map fully exhausted: lr swept {0.01:0.041, 0.003:0.097, 0.002:0.095, 0.001:0.067} clean interior peak at 0.003; epochs {3:0.041, 6:0.097, 18:0.086} peak at 6; train_n 480<200; wd 1e-3<0.0; bands/outer variants collapse to hr0 (iters 3-4 discards); seed 42 vs 123 give bit-identical hr (8e-6 M model is deterministic). No in-budget lever can push above 0.0966 -- this is the converged ceiling for the 8-microparam Wu radial filter. Empty-patch documents the ceiling toward iter-20. Ranked #9.
19		0.822913	0.0966343	keep	architecture	wu_2015_trainable-claude-agentic	claude-opus-4-8-1m	34.9605	8.931933e-04	402.3	8e-06	wu_2015_trainable-claude-agentic: wu_n_bands=4, wu_n_outer=1, lr=0.003, epochs=6, batch_size=1, val_chunk=1, train_n=200, val_n=214, grad_clip=1.0, lambda_neg=1.0, weight_decay=0.0, loss_base=mse, seed=123, rationale=iter-19 empty-patch EXHAUSTION CONFIRM at BASE=iter-10 hr0.0966343 (lr0.003/ep6/bands4/outer1/tn200/wd0). SIX-BOX: (a) trajectory hr peaks at iter-6/10=0.0966; (b) CONVERGED-iters11-18 bit-identical replays (model is 8 micro-params=8e-6M, deterministic: seed42 iter-6 == seed123 iter-10); (c) ALL 7 axes mapped: lr clean single-peak basin{0.01:0.051,0.003:0.097PEAK,0.002:0.095,0.001:0.067}, epochs{3:0.041,6:0.097PEAK,18:0.034} inert, train_n 480<200, wd 1e-3<0.0, bands 4->6 hr0, outer 1->2 hr0 SSIM-collapse, seed deterministic. No genuinely-untried in-budget lever; (d) ~300-360s << 1200s budget; (e) BASE=iter-10 hr-best. Empty-patch documents the terminal 8-microparam Wu radial-filter ceiling hr~0.097 (FBP-family apodization, regime-bounded far below dual-domain U-Net hr~0.27). No anomaly: float jitter 2e-6 on iters16/18 is sub-FP32-roundoff, confirms determinism. Ranked #9. DECISION: confirm exhaustion.
20		0.822915	0.0966322	keep	architecture	wu_2015_trainable-claude-agentic	claude-opus-4-8-1m	34.9605	8.931953e-04	252.9	8e-06	wu_2015_trainable-claude-agentic: wu_n_bands=4, wu_n_outer=1, lr=0.003, epochs=6, batch_size=1, val_chunk=1, train_n=200, val_n=214, grad_clip=1.0, lambda_neg=1.0, weight_decay=0.0, loss_base=mse, seed=123, rationale=iter-20 FINAL empty-patch EXHAUSTION CONFIRM at BASE=iter-10 hr0.0966343 (lr0.003/ep6/bands4/outer1/tn200/wd0, 8 micro-params=8e-6M deterministic radial filter). SIX-BOX: (a) PRIOR NUMBERS trajectory iter->hr: 1(lr0.01,ep6)0.0508, 2(ep18@lr0.01)0.0337, 3(bands6)0.0, 4(outer2)0.0 SSIM-collapse, 5(tn480,ep3)0.0411, 6(lr0.003,ep6)0.0966 PEAK, 7(lr0.001,ep6)0.0668, 8(lr0.001,ep18)0.0862, 9(lr0.002,ep6)0.0952, 10(seed123)0.0966343 PEAK-confirm, 11-19 bit-identical replays. (b) CONVERGED: iters11-19 hr0.0966343 bit-identical (float jitter 2e-6 on iters16/18 is sub-FP32-roundoff, confirms determinism, NO anomaly). (c) EMPTY-PATCH CONFIRM: all 7 axes mapped+falsified - lr clean single-peak basin{0.01:0.051,0.002:0.095,0.003:0.097PEAK,0.001:0.067}, epochs{3:0.041,6:0.097,18:0.034}inert, train_n 480<200, wd 1e-3<0.0, bands 4->6 hr0, outer 1->2 hr0, seed42==seed123 deterministic. NO genuinely-untried in-budget lever. (d) ~350s<<1200s HARD 20-min budget. (e) BASE=iter-10 hr-best 0.0966343. WHY EMPTY: 8-microparam Wu radial-filter (FBP-family apodization) ceiling is terminal at hr~0.097, regime-bounded far below dual-domain U-Net hr~0.27; deterministic model has zero remaining DoF after lr-apex pinned. Ranked #9. DECISION: confirm exhaustion. PREDICT SSIM 0.8229 / hr 0.0966343 (deterministic replay).
