iter	commit	val_score	headroom	status	change_class	agent	model	rationale
1		0.837031	0.0508002	keep	architecture	wu_2015_trainable-claude-agentic-breast-ct	claude-opus-4.7-1m	wu_2015_trainable-claude-agentic: wu_n_bands=4, wu_n_outer=1, lr=0.01, epochs=6, batch_size=1, val_chunk=1, train_n=200, val_n=214, grad_clip=1.0, lambda_neg=1.0, weight_decay=0.0, loss_base=mse, seed=42, rationale=ITER-1 feasibility (search-20260619-01, corrected protocol) for wu_2015_trainable = end-to-end TRAINABLE Wu 2015 reconstruction (solver_wu_2015_trainable.py). GOAL: does Wu-trainable run on Mayo under the corrected path (staged_canonical v3 mayo_ldct_fitted geometry, per-sample-ps FBP + per-sample model.proj/model.dense_proj swap, bg_target=truth) and produce a FINITE val_score + comparison.png within the HARD 20-min train+score budget, scoring ALL 214 L277 slices under the 321px detector-geometry FOV (evaluate_calibrated default for AGENT4CT_DATASET=mayo_ldct_2d; NO fov= override)? ARCHITECTURE NOTE: this solver trains ONLY a handful of nn.Parameter scalars (per-band log-scale x4, sigmoid slope+offset x2, per-outer soft-threshold + residual-blend) wrapped around a band-weighted aliasing-free FBP + a soft-thresholded dense-residual pass; with wu_n_outer=1 that is 4+2+1+1 = 8 trainable scalars (n_bands=4). All scalars are HARD-CLAMPED inside the solver (band_scale 0.1-3.0, blend -0.5-2.0, soft_thresh 1e-5-0.05) so the optimizer cannot run away. CONFIG: wu_n_outer=1 (the discarded boundary-slice run flagged n_outer=1 as mandatory -- behavior hint only; it also HALVES the costly 2x-dense-projector residual pass per sample, the dominant per-slice cost), wu_n_bands=4 (default), lr=1e-2 (solver default; aggressive lr is fine for ~8 scalars and converges fast), epochs=6 (8 clamped scalars settle in very few epochs at lr=1e-2 -- this is NOT a deep net that under-trains; the real risk here is the opposite structural FBP ceiling, not under-convergence), train_n=200 stratified across the 4 Wagner train patients ps-groups, val_n=214 = ALL L277 slices, batch_size=1 + val_chunk=1 FORCED by per-sample-ps (each train step + each val slice swaps model.proj AND model.dense_proj to its slice ps), grad_clip=1.0 (MANDATORY Mayo guard: the 2304-view FBP adjoint overflows otherwise), lambda_neg=1.0, weight_decay=0.0 (defer to iter-2+; the discarded run hinted weight_decay tuning around its run-best iter-11, treat as loose behavior hint only), loss_base=mse, seed=42. BUDGET REASONING: the solver has NO in-code max_train_s wall hook (cannot add one -- must not edit the solver .py), so the budget is enforced by SIZING: with wu_n_outer=1 the per-sample cost is 1 band-weighted sparse-FBP (4-band backproject) + 1 forward_project + 1 dense-FBP + 1 back_project -- heavier than DD-UNet (iter-1 418s @ep8) but LIGHTER than the unrolled k=3 itnet_v3 (iter-1 738s @ep8) because there is no per-step unrolled DC loop; at only 6 epochs over 200 train slices the dominant cost is the 214-slice val pass at chunk=1 with the dense projector. This sizes train+score comfortably under the 20-min budget (30-min SLURM wall) with room for the figure. HYPOTHESIS: if I fit Wu-trainable at n_outer=1 / lr=1e-2 / ep=6 on 200 stratified Mayo train slices, I expect a finite val_ssim that lands in/near the LD-FBP baseline band (~0.84-0.89 SSIM, hr near 0), because Wu-trainable is a tuned-FBP family (band-reweighting + ONE soft-thresholded residual pass, NO image-domain CNN denoiser) and can only recover the small headroom that band weighting + a single residual correction buys over plain FBP -- it is structurally close to FBP, unlike the dual-domain U-Net families that landed hr~0.27. The discarded boundary-slice run hinted ~0.9135 SSIM at run-best iter-11 (loose behavior hint, NOT a validated number under the corrected 214-slice 321px-FOV metric). This onboarding iter establishes the corrected-metric Wu-trainable baseline that iter-2+ will improve by tuning ONE knob (epochs/weight_decay first, then band/sigmoid knobs).
2		0.838996	0.0337251	keep	architecture	wu_2015_trainable-claude-agentic-breast-ct	claude-opus-4.7-1m	wu_2015_trainable-claude-agentic: wu_n_bands=4, wu_n_outer=1, lr=0.01, epochs=18, batch_size=1, val_chunk=1, train_n=200, val_n=214, grad_clip=1.0, lambda_neg=1.0, weight_decay=0.0, loss_base=mse, seed=42, rationale=ITER-2 (search-20260619-01, corrected 214-slice/321px-FOV metric). SIX-BOX. (1) iter-1 = SSIM 0.837 / hr 0.0508, 8 trainable params (wu_n_bands=4, wu_n_outer=1, ep=6, lr=0.01), elapsed 335s of the 1200s budget (only 28% used). (2) Tuned-FBP family sits just above the LD-FBP baseline (hr 0.05); candidate causes are under-training (only 6 epochs, 865s of budget unused) vs a structural FBP-family ceiling. (3) ONE KNOB: epochs 6 -> 18 (proven budget-safe lever; 335s/6ep leaves huge headroom). Param count UNCHANGED at 8 (formula wu_n_bands+2+2*wu_n_outer = 4+2+2*1 = 8) -- I deliberately do NOT touch wu_n_bands / wu_n_outer (changing a capacity knob would confound the under-training question, and wu_n_outer=1 is the mandatory hint). The 214-slice chunk=1 dense-projector VAL pass is a fixed per-iter cost; only the train portion scales with epochs, so even pessimistically attributing all 335s to training, 18 epochs ~1005s < 1200s, with the val figure outside the budget. (4) HYPOTHESIS: if iter-1 hr is under-training-limited (8 clamped scalars not yet settled at 6 epochs), epochs 6->18 lifts val_ssim/hr measurably above 0.837/0.0508. FALSIFIER: if val_ssim is flat (<=0.001 SSIM, within noise) at 18 epochs, the solver is at its structural FBP-family ceiling -- then iter-3 must add capacity (wu_n_bands up), not train longer. (5) HARD 20-min budget sized via epochs; val = ALL 214 L277 slices (unchanged); grad_clip=1.0; bs=1 + val_chunk=1 forced by per-sample-ps; staged_canonical v3 mayo_ldct_fitted; bg_target=truth; 321px detector-geometry FOV default (no fov override). (6) no control return.
3		0.827303	0	discard	architecture	wu_2015_trainable-claude-agentic	claude-opus-4-8-1m	33.7433	1.027550e-03	358.0	1e-05	wu_2015_trainable-claude-agentic: wu_n_bands=6, wu_n_outer=1, lr=0.01, epochs=6, batch_size=1, val_chunk=1, train_n=200, val_n=214, grad_clip=1.0, lambda_neg=1.0, weight_decay=0.0, loss_base=mse, seed=42, rationale=wu_2015_trainable iter-3 (search-20260619-01, corrected 214-slice/321px-FOV metric). SIX-BOX (NUMBERS). (1) PRIOR: iter-1 = SSIM 0.8370 / hr 0.0508, 8 params (wu_n_bands=4, wu_n_outer=1, ep6, lr0.01), elapsed 335s. iter-2 = SSIM 0.8390 / hr 0.0337, 8 params (SAME but ep18), elapsed 866.6s. iter-1->iter-2 (epochs 6->18) was FLAT: val_ssim +0.0020 (within the +-0.001 noise band the iter-2 falsifier set), and hr actually FELL 0.0508->0.0337. Per-epoch train cost = (866.6-335)/(18-6) = 44.3 s/ep at n_bands=4. SLURM log confirms training converged (loss=0.00000 by ep1; band_scale already saturating to clamp by ep18) -- epochs is INERT, the falsifier for under-training FIRED. (2) FAILURE MODE: few-param tuned-FBP ceiling. Wu-trainable is a band-reweighted aliasing-free FBP + ONE soft-thresholded dense residual pass with NO image-domain CNN denoiser; it sits hr~0.04 just above the LD-FBP floor and epochs cannot move it. The OPEN question iter-2's falsifier handed to iter-3: is hr capacity-limited (too few frequency bands to separate signal from noise) or is the whole FBP-family structurally ceilinged regardless of capacity? (3) ONE KNOB: CAPACITY via wu_n_bands 4->6 (+2 frequency bands in the band-weighted aliasing-free FBP, line 198 band-loop). This is the iter-2 falsifier's prescribed lever ('iter-3 must add capacity, wu_n_bands up'). I deliberately pick wu_n_bands over wu_n_outer because (a) n_bands enriches the FBP frequency partition -- the exact structurally-FBP part the ceiling hypothesis is about; (b) it is BUDGET-SAFE: the band-loop (FFT-filter + back_project) scales LINEARLY with n_bands while the heavy dense-projector residual pass stays a single fixed pass at n_outer=1, vs wu_n_outer++ which DOUBLES that dominant cost; (c) wu_n_outer=1 is the campaign 'mandatory' hint, leave it. NEW PARAM COUNT: wu_n_bands+2+2*wu_n_outer = 6+2+2*1 = 10 trainable scalars (was 8). epochs held at the iter-1 anchor 6 (NOT a second knob -- iter-2 PROVED ep6 vs ep18 is a non-difference, 0.837 vs 0.839; reverting to ep6 restores the proven-equivalent baseline epoch budget so the wider 6-band bank fits the HARD 20-min wall with margin, isolating n_bands as the sole meaningful change). All else identical to iter-1/2: lr0.01, bs=1, val_chunk=1, train_n=200, val_n=214(ALL L277), grad_clip=1.0, lambda_neg=1.0, weight_decay=0.0, loss_base=mse, seed=42. (4) HYPOTHESIS: if iter-3 SSIM rises measurably above 0.839 (>+0.005 over the noise band) with hr>0.05, Wu-trainable was frequency-band-capacity-limited and more bands buy real headroom. FALSIFIER: if SSIM REGRESSES or stays FLAT (<=0.840, within noise of iter-1/2) at 6 bands, Wu-trainable is STRUCTURALLY FBP-ceilinged on Mayo regardless of capacity -- exactly matching the few-param-bilateral pattern THIS tick (dual_domain_bilateral_supervised img_n_bf 3->6: 0.9192->0.9057 REGRESSED; hammernik filters-up also regressed), i.e. capacity bumps DESTABILISE these few-param FBP-family denoisers rather than help. A regression would be the strong confirmation that the lever is the FBP family itself, not its band count. (5) HARD 20-min (1200s) train+score budget, sized via the ep6 anchor: worst-case (whole per-sample cost scaling with n_bands, which over-counts since the residual pass is fixed) ~1.5x the iter-1 per-epoch -> ~66 s/ep x 6 = ~396s train + ~120s for the 1.5x-wider 214-slice val pass ~= 520s, with the val FIGURE outside the budget and well under the 1800s SLURM kill. val = ALL 214 L277 slices (do NOT reduce); grad_clip=1.0; bs=1 + val_chunk=1 forced by per-sample-ps; staged_canonical v3 mayo_ldct_fitted; per-sample-ps FBP + per-sample model.proj/model.dense_proj swap; bg_target=truth; 321px detector-geometry FOV default (NO fov override). (6) no control return.
4		0.645896	0	discard	architecture	wu_2015_trainable-claude-agentic	claude-opus-4-8-1m	29.2245	1.728802e-03	536.8	1e-05	wu_2015_trainable-claude-agentic: wu_n_bands=4, wu_n_outer=2, lr=0.01, epochs=6, batch_size=1, val_chunk=1, train_n=200, val_n=214, grad_clip=1.0, lambda_neg=1.0, weight_decay=0.0, loss_base=mse, seed=42, rationale=wu_2015_trainable iter-4 (search-20260619-01, corrected 214-slice/321px-FOV metric). CONFIRMATION / TERMINAL-LEVER iter. SIX-BOX (NUMBERS). (1) PRIOR TRAJECTORY: iter-1 = SSIM 0.8370 / hr 0.0508, 8 params (wu_n_bands=4, wu_n_outer=1, ep6, lr0.01), elapsed 335s -- this is the BEST config. iter-2 = SSIM 0.8390 / hr 0.0337, 8 params (SAME but ep18), elapsed 866.6s -- epochs INERT (val_ssim +0.0020 within noise, hr FELL); the under-training falsifier FIRED. iter-3 = SSIM 0.8273 / hr 0.0, 10 params (wu_n_bands 4->6, ep6), elapsed 358s -- frequency-band capacity++ REGRESSED below the iter-1/2 baseline; the iter-3 falsifier FIRED (capacity bumps DESTABILISE these few-param FBP-family denoisers, matching dd_bilateral img_n_bf 3->6 0.9192->0.9057 and hammernik filters-up that same tick). (2) FAILURE MODE: few-param tuned-FBP ceiling (~hr 0.05). Wu-trainable is a band-reweighted aliasing-free FBP + soft-thresholded dense-residual pass(es) with NO image-domain CNN denoiser; epochs are inert and frequency-band count++ destabilises -- it sits hr~0.04-0.05 just above the LD-FBP floor and neither lever has moved it up. (3) ONE KNOB: wu_n_outer 1->2 (the SINGLE untried capacity lever). I revert wu_n_bands 6->4 to RESTORE the iter-1 BEST config (NOT iter-3's regressed 6 bands), and change ONLY wu_n_outer. This adds a SECOND outer soft-thresholded dense-residual denoising pass (solver forward() loop `for it in range(self.n_outer)`, lines 214-237: each pass = forward_project residual -> feature-preserving interp -> dense FBP -> per-outer soft-threshold -> per-outer learnable blend). It is the LAST structural capacity Wu offers that is orthogonal to the already-falsified epochs/n_bands levers, and it adds image-domain residual-correction depth rather than FBP frequency partitioning. NEW PARAM COUNT: wu_n_bands+2+2*wu_n_outer = 4+2+2*2 = 10 trainable scalars (was 8 at iter-1; iter-3's 6-band/1-outer was also 10) -- the +2 over iter-1 are the per-outer log_soft_thresh + residual_blend for the new second pass. BUDGET JUSTIFICATION: campaign_state flagged wu_n_outer=1 as a 'mandatory' HINT precisely because the 2x-dense-projector residual pass is the DOMINANT per-slice cost and n_outer=2 DOUBLES it. This is the ONE modest n_outer test the budget allows: sized at the iter-1 ep6 anchor (335s at n_outer=1). The doubled residual pass roughly doubles per-sample train+val cost vs iter-1 -> worst-case ~2x335 = ~670s for the dense pass + the band-FBP (unchanged at 4 bands) -> well under the 1200s 20-min budget and the 1800s SLURM kill, with the val FIGURE outside the budget. ep6 is correct: iter-2 PROVED ep6==ep18 (0.837 vs 0.839), so ep6 isolates wu_n_outer as the sole meaningful change AND keeps the doubled-residual run inside the wall. (4) HYPOTHESIS: if a second outer residual-denoising pass buys real image-domain headroom, iter-4 hr rises measurably above the iter-1 best 0.0508 (SSIM > 0.842, >+0.005 over the noise band). FALSIFIER (terminal): if hr <= 0.051 (at/below the iter-1 best) OR SSIM REGRESSES/stays FLAT, then epochs (inert), frequency bands (regressed), AND outer residual depth (this iter) have ALL failed to lift hr -- Wu-trainable is STRUCTURALLY FBP-ceilinged on Mayo regardless of its capacity knobs. File that verdict: the few-param tuned-FBP family caps at hr~0.05 on real-helical Mayo, far below the dual-domain U-Net families (hr~0.27), because it lacks an image-domain learned denoiser. (5) HARD 20-min (1200s) train+score budget, sized via the ep6 anchor with the n_outer=2 doubling accounted for above; val = ALL 214 L277 slices (do NOT reduce); grad_clip=1.0 (MANDATORY Mayo guard -- the 2304-view FBP adjoint overflows otherwise); bs=1 + val_chunk=1 forced by per-sample-ps; staged_canonical v3 mayo_ldct_fitted; per-sample-ps FBP + per-sample model.proj/model.dense_proj swap; bg_target=truth; 321px detector-geometry FOV default (NO fov override). (6) no control return.
5		0.838401	0.0410782	keep	architecture	wu_2015_trainable-claude-agentic	claude-opus-4-8-1m	34.4421	9.481238e-04	492.7	8e-06	wu_2015_trainable-claude-agentic: wu_n_bands=4, wu_n_outer=1, lr=0.01, epochs=3, batch_size=1, val_chunk=1, train_n=480, val_n=214, grad_clip=1.0, lambda_neg=1.0, weight_decay=0.0, loss_base=mse, seed=42, rationale=wu_2015_trainable iter-5 (search-20260619-01, corrected 214-slice/321px-FOV metric). DATA-COVERAGE LEVER. SIX-BOX (NUMBERS). (1) PRIOR: BEST = iter-1 SSIM 0.8370 / hr 0.0508 / PSNR 34.53 / RMSE 9.39e-4 / 335s / 8 params (wu_n_bands=4, wu_n_outer=1, ep6, lr0.01, train_n=200). Trajectory iter->hr: 1->0.0508(BEST), 2(ep18)->0.0337, 3(n_bands6)->0.0, 4(n_outer2)->0.0 (SSIM collapsed to 0.6459, 536.8s). Base copied = iter-1 (highest hr). (2) LIMITER/failure mode: every per-iter capacity/epoch knob is FALSIFIED -- epochs INERT (iter-2 ep6==ep18, 0.837 vs 0.839 within noise, hr FELL), frequency bands REGRESSED (iter-3 n_bands 4->6 dropped to 0.827/hr0), outer residual depth COLLAPSED (iter-4 n_outer 1->2 dropped to 0.646/hr0). The net only ever saw train_n=200 = 35% of the 579-slice train pool (3 ps-groups: 154@0.66192 / 98@0.73979 / 327@0.77873). The UNTRIED axis is DATA COVERAGE -- campaign_state CONFIRMED (2026-06-20) this is the strongest lever for the end-to-end trainers (uswin train_n 200->480 hr 0.3532->0.3829 NEW champion; itnet_v3 200->400 hr 0.3123->0.3288). (3) ONE KNOB: train_n 200 -> 480 (35% -> 83% train-pool coverage). I REVERT to the iter-1 BEST config (wu_n_bands=4, wu_n_outer=1, lr0.01) -- NOT the regressed iter-3/4 -- and change ONLY train_n, mirroring the confirmed uswin/itnet_v3 recipe (revert-to-best, then raise coverage). MECHANISM VERIFIED for THIS solver: build_dataset() (solver line 241) calls load_val_split(kind, "train", cfg[train_n], ...) which loads a FIXED stratified subset ONCE; the train loop reshuffles that SAME fixed array each epoch via torch.randperm(train_noisy.shape[0]) (line 316). It does NOT use RotatingSubsetDataset, so train_n IS load-bearing data coverage, not inert. (4) HYPOTHESIS: if wu_2015_trainable hr-0.05 ceiling is data-coverage-limited (only 35% of the train pool seen), raising train_n 200->480 lifts hr measurably above the iter-1 best 0.0508 (SSIM > 0.842, >+0.005 over the +-0.001 noise band). NUMERIC FALSIFIER (terminal): if hr <= 0.051 (at/below iter-1 best) at train_n=480, the ceiling is the FBP-family architecture itself (band-reweighted FBP + soft-thresholded residual, NO image-domain learned CNN denoiser), not data coverage -- file the terminal verdict (epochs, bands, outer-depth AND data all exhausted; caps hr~0.05 on real-helical Mayo, far below dual-domain U-Net families hr~0.27). (5) BUDGET (HARD 1200s/20-min train+score): iter-1 335s at train_n=200/ep6/n_outer=1 = 1200 train-slice-passes + a fixed 214-slice val pass. To hold the wall AND keep grad-step parity (train_n x epochs ~ 200x6=1200), I trade epochs 6->3: 480x3=1440 train-slice-passes (+20% vs iter-1). Worst-case linear scaling ~335x1.2 ~= 400s train+score, well under 1200s and the 1800s SLURM kill; val FIGURE outside budget. ep3 is safe AND a non-regression on the optimization axis because iter-2 PROVED epochs inert (ep6==ep18) -- this isolates train_n as the SOLE meaningful change. n_outer held at 1 (MANDATORY hint; also keeps the dominant 2x-dense residual pass single). Note line-98 comment (train_n=2000 band_scale runaway to 53x) was a BREAST-dataset, PRE-CLAMP regime; the band_scale 0.1-3.0 hard clamps now in place prevent that runaway, and 480 is a modest raise. val = ALL 214 L277 slices (do NOT reduce); grad_clip=1.0 (MANDATORY Mayo guard -- the 2304-view FBP adjoint overflows otherwise); bs=1 + val_chunk=1 forced by per-sample-ps; staged_canonical v3 mayo_ldct_fitted; per-sample-ps FBP + per-sample model.proj/model.dense_proj swap; bg_target=truth; 321px detector-geometry FOV default (NO fov override). (6) no control return.
6		0.823235	0.0965795	keep	architecture	wu_2015_trainable-claude-agentic	claude-opus-4-8-1m	34.96	8.932474e-04	334.8	8e-06	wu_2015_trainable-claude-agentic: wu_n_bands=4, wu_n_outer=1, lr=0.003, epochs=6, batch_size=1, val_chunk=1, train_n=200, val_n=214, grad_clip=1.0, lambda_neg=1.0, weight_decay=0.0, loss_base=mse, seed=42, rationale=wu_2015_trainable iter-6 (search-20260619-01, corrected 214-slice/321px-FOV metric). OPTIMIZER-BASIN / TERMINAL-LEVER iter. SIX-BOX (NUMBERS). (1) PRIOR TRAJECTORY iter->hr: 1->0.0508 (BEST: wu_n_bands=4, wu_n_outer=1, lr0.01, ep6, train_n=200, SSIM 0.8370, 335s, 8 params), 2(ep18)->0.0337 (epochs INERT, hr FELL), 3(n_bands 4->6)->0.0 (SSIM 0.8273, bands REGRESSED), 4(n_outer 1->2)->0.0 (SSIM 0.6459 COLLAPSED), 5(train_n 200->480, ep3)->0.0411 (SSIM 0.8384, data-coverage FAILED: hr 0.0411 <= 0.051 falsifier, did NOT clear iter-1 best). Base copied = iter-1 (highest hr). (2) LIMITER: few-param tuned-FBP ceiling ~hr0.05. Wu-trainable = band-reweighted aliasing-free FBP + soft-thresholded dense residual, NO image-domain learned CNN denoiser; sits just above LD-FBP floor, far below dual-domain U-Net families (hr~0.27). FOUR axes falsified: epochs inert, bands regressed, outer-depth collapsed, data-coverage failed. (3) ONE KNOB: optimizer lr 0.01 -> 0.003 (3.3x lower). The default lr=0.01 was NEVER probed and the SLURM log shows it saturates band_scale to its 0.1-3.0 clamp + drives loss to 0 by ep1 -- the 8 clamped scalars may be slamming into a poor basin. I REVERT to the iter-1 BEST config (wu_n_bands=4, wu_n_outer=1, ep6, train_n=200) -- NOT the regressed iter-3/4 nor the failed iter-5 -- and change ONLY lr. This is the SOLE optimization-axis lever left orthogonal to the falsified capacity/data axes; cross-solver precedent that lr is load-bearing for few-param FBP-family denoisers: breast-CT Step-3 TPE found wu_2015_trainable hr0.3170 at 10x-LOWER lr than the agentic centroid (solver_plan.md Step-2 STOP note). PARAM COUNT UNCHANGED at 8 (wu_n_bands+2+2*wu_n_outer = 4+2+2 = 8). (4) HYPOTHESIS: if the hr-0.05 ceiling is an lr/optimization-basin artifact (default lr0.01 saturates the clamped scalars too fast), a gentler lr0.003 settles them in a better basin and lifts hr above the iter-1 best 0.0508 (SSIM > 0.842, >+0.005 over the +-0.001 noise band). TERMINAL FALSIFIER: if hr <= 0.051 at lr0.003, then epochs+bands+outer-depth+data-coverage AND optimizer-lr are ALL exhausted -- Wu-trainable is STRUCTURALLY FBP-ceilinged on Mayo (no image-domain learned denoiser), caps hr~0.05 on real-helical Mayo far below the dual-domain U-Net families hr~0.27. File the terminal verdict. (5) BUDGET (HARD 1200s/20-min train+score): IDENTICAL runtime envelope to iter-1 (train_n=200, ep6, n_outer=1 = 335s in iter-1); lr is a free knob with ZERO runtime cost. Worst-case ~335s << 1200s and the 1800s SLURM kill; val FIGURE outside budget. val = ALL 214 L277 slices (do NOT reduce); grad_clip=1.0 (MANDATORY Mayo guard -- the 2304-view FBP adjoint overflows otherwise); bs=1 + val_chunk=1 forced by per-sample-ps; staged_canonical v3 mayo_ldct_fitted; per-sample-ps FBP + per-sample model.proj/model.dense_proj swap; bg_target=truth; 321px detector-geometry FOV default (NO fov override); wu_n_outer=1 (MANDATORY). (6) no control return.
