iter	commit	val_score	headroom	status	change_class	agent	model	rationale
7		0.816961	0.0374586	keep	architecture	hammernik_2017-claude-agentic	claude-opus-4-8-1m	34.4094	9.517026e-04	679.4	0.012165	hammernik_2017-claude-agentic: vn_T=5, vn_n_filters=16, vn_kernel=11, vn_n_bumps=31, vn_x_range=2.0, vn_lambda_init=0.0023, epochs=10, batch_size=1, lr=0.0005, grad_clip=1.0, train_n=200, val_n=214, max_train_s=1050, seed=42, rationale=hammernik_2017 iter-7 (search-20260619-01, corrected 214-slice/321px-FOV metric). ONE KNOB: batch_size 2 -> 1. BASE_ITER=5 (the BEST + only above-baseline point: SSIM 0.8114, hr 0.0319, ep19/bs2/lr5e-4/lambda0.0023/n_filters16) -- reverting AWAY from iter-6 (lr 3e-4 REGRESSED to 0.7883/hr0). epochs traded 19->10 purely to fit the HARD 1200s budget at bs=1 (NOT a second hypothesis knob); max_train_s 1100->1050 backstop. TRAJECTORY (corrected metric): iter-1 OOM(bs4); iter-2 0.8012 hr0; iter-3 0.7932 hr0 (lambda 0.0023->0.05 REGRESSED); iter-4 0.7828 hr0 (n_filters 16->4 REGRESSED); iter-5 0.8114 hr0.0319 KEEP (epochs 14->19, FIRST above the ~0.84 LD-FBP floor, under-training diagnosis CONFIRMED); iter-6 0.7883 hr0 DISCARD (lr 5e-4->3e-4 REGRESSED -- lower lr starved the under-trained net, iter-6 falsifier TRIGGERED). best hr = 0.0319 @iter-5. LIMITER (box2): under-convergence at the wall-pinned epoch budget. iter-5 confirmed the epochs lever works but ep19 is WALL-PINNED (one more epoch overruns 1200s at 56.4s/epoch bs=2); iter-6 proved lr-down does not help (it starves, not stabilizes). The ONLY remaining within-budget step-count lever is batch_size DOWN: bs=1 doubles batches/epoch (train_n=200 -> 200 batches/epoch vs 100 at bs=2), i.e. doubles optimizer steps per epoch -- the iter-6 PRE-REGISTERED falsifier path (iter-6: if hr<=0.0319, iter-7 must trade gradient STEPS via batch_size 2->1). ONE KNOB CHOICE (box3): batch_size 2->1, base = iter-5 BEST (lr=5e-4 RESTORED, lambda=0.0023, n_filters=16, vn_T=5, kernel=11, n_bumps=31, x_range=2.0, grad_clip=1.0, train_n=200, val_n=214, seed=42 all held). HYPOTHESIS (box4): bs=1 gives 2x optimizer steps/epoch; even with epochs traded 19->10 the step count rises 1900 (bs2 x ep19) -> 2000 (bs1 x ep10 x 200/epoch), and each step on a smaller batch is a noisier/finer descent that the under-trained VN benefits from -> predict val_ssim rises above 0.8114 (hr > 0.0319), targeting ~0.82-0.83 / hr ~0.04-0.06. FALSIFIER (terminal): if hr <= 0.0319 at bs=1, hammernik_2017s 20-min budget is genuinely convergence-bounded -- doubling steps via bs-down cannot reach the proven ep38/bs1 (7600-step) convergence basin within 1200s -> its ceiling is ~0.032 and the budget-bounded ceiling is DOCUMENTED (no within-budget step-count lever remains: epochs wall-pinned, lr-down failed, bs already at the minimum). BUDGET (box5, HARD 1200s train+score; sbatch --time=00:30:00): bs=1 doubles batches/epoch AND loses within-batch parallelism + adds per-sample projector swaps, so per-epoch wall rises from 56.4s (bs2) to ~95-105s (bs1, ~1.7-1.9x). At ~105s/epoch x 10 epochs = ~1050s train + ~95s score(214)+figure = ~1145s predicted elapsed < 1200s; max_train_s=1050 backstop trips before the figure, well under the 1800s SLURM kill. If per-epoch lands lighter (~95s) the max_train_s wall stops training at ~ep11, still in-budget. MEMORY-SAFE (SAFER than bs=2): batch_size=1 HALVES the (B,F,H,W)=(1,16,512,512) x 31-bump RBF activation tensors held across 5 unrolled steps vs bs=2 -- strictly less than the iter-5 footprint that already fit 16 GB (bs=4 was the OOM, bs=1 is the safest point). N_k=16, grad_clip=1.0 retained (VN-family NaN-skip stability).
8		0.793505	0	discard	architecture	hammernik_2017-claude-agentic	claude-opus-4-8-1m	33.9516	1.003207e-03	311.2	0.004866	hammernik_2017-claude-agentic: vn_T=2, vn_n_filters=16, vn_kernel=11, vn_n_bumps=31, vn_x_range=2.0, vn_lambda_init=0.0023, epochs=10, batch_size=1, lr=0.0005, grad_clip=1.0, train_n=200, val_n=214, max_train_s=1050, seed=42, rationale=hammernik_2017 iter-8 (search-20260619-01, corrected 214-slice/321px-FOV metric). ONE KNOB: vn_T 5 -> 2 (unroll depth DOWN, GENUINELY UNTRIED -- vn_T held at 5 every iter 1-7). BASE_ITER=7 (the BEST + best above-baseline point: SSIM 0.8170, hr 0.0375, vn_T5/ep10/bs1/lr5e-4/lambda0.0023/n_filters16). All else held at iter-7 (vn_n_filters=16, vn_kernel=11, vn_n_bumps=31, vn_x_range=2.0, vn_lambda_init=0.0023, epochs=10, batch_size=1, lr=5e-4, grad_clip=1.0, train_n=200, val_n=214, seed=42); max_train_s 1050 kept. TRAJECTORY (corrected metric): iter-1 OOM(bs4); iter-2 0.8012 hr0; iter-3 0.7932 hr0 (lambda 0.0023->0.05 UP REGRESSED); iter-4 0.7828 hr0 (n_filters 16->4 DOWN REGRESSED); iter-5 0.8114 hr0.0319 KEEP (epochs 14->19 UP, FIRST above the ~0.84 LD-FBP floor); iter-6 0.7883 hr0 DISCARD (lr 5e-4->3e-4 DOWN REGRESSED); iter-7 0.8170 hr0.0375 KEEP (batch_size 2->1 DOWN, epochs traded to 10, NEW BEST). best hr=0.0375 @iter-7. MAPPED KNOBS: epochs(UP works), batch_size(DOWN works), lr(DOWN fails), vn_lambda_init(UP fails), vn_n_filters(DOWN fails). NEVER MAPPED: vn_T (unroll depth, held 5 every iter) + train_n (held 200 every iter). LIMITER (box2): OVER-UNROLLING re-injects the learned-regularizer smoothing term Sum_i K_i^T rho_i(K_i y) at every one of the 5 in-loop steps, dragging the FBP init below the floor -- the SAME mechanism that capped the sibling hammernik_vn at hr0 until vn_T 5->2 BROKE IT OUT to hr 0.1540 (and itnet/itnet_v2 via depth k=1). Prior epochs/bs levers only bought +0.006 crumbs to hr~0.037; depth is the unmapped breakout axis. NOT wall-bound: iter-7 ran in only 679.4s of the 1200s budget. ONE KNOB CHOICE (box3): vn_T 5->2 -- the FAMILY-PROVEN BREAKOUT lever (4 breakouts so far: hammernik_vn, itnet, itnet_v2 + the depth-down pattern), genuinely untried in THIS solver. epochs held at 10 (do NOT also raise epochs to spend the freed budget -- that would be a second knob; the headroom is safety margin). HYPOTHESIS (box4): with unroll depth 5->2 the regularizer re-injects 2.5x fewer times so the recon stays near the FBP init -> SSIM clears further above the floor mirroring hammernik_vn 0->0.1540; predict SSIM ~0.84-0.88, hr ~0.08-0.15. NUMERIC FALSIFIER: if hr <= 0.0375 (<= iter-7 best), depth is NOT this solvers breakout axis (unlike its sibling) -> iter-9 turns to the untried train_n UP data-coverage lever (the proven trainer lever, also unmapped here). BUDGET (box5, HARD 1200s train+score; sbatch --time=00:30:00): vn_T 5->2 cuts the in-loop unrolled cost ~2.5x, so wall FAR below iter-7 679.4s -- the figure + score(214) stay comfortably in budget; max_train_s=1050 backstop, well under the 1800s SLURM kill. MEMORY-SAFE: vn_T DOWN holds FEWER (B,F,H,W) RBF-bump activation tensors across the unrolled loop than iter-7 -- strictly LIGHTER footprint; batch_size=1 KEPT (OOM-safe minimum; bs=4 OOMed the 16GB RTX5000 at iter-1), N_k=16, grad_clip=1.0 retained (VN-family NaN-skip stability).
9		0.81814	0.0392062	keep	architecture	hammernik_2017-claude-agentic	claude-opus-4-8-1m	34.4252	9.499748e-04	729.8	0.012165	hammernik_2017-claude-agentic: vn_T=5, vn_n_filters=16, vn_kernel=11, vn_n_bumps=31, vn_x_range=2.0, vn_lambda_init=0.0023, epochs=4, batch_size=1, lr=0.0005, grad_clip=1.0, train_n=480, val_n=214, max_train_s=1050, seed=42, rationale=hammernik_2017 iter-9 (search-20260619-01, corrected 214-slice/321px-FOV metric). ONE KNOB: train_n 200 -> 480 (DATA-COVERAGE, GENUINELY UNTRIED -- train_n held at 200 every iter 1-8). BASE_ITER=7 (the BEST: SSIM 0.8170, hr 0.0375, vn_T5/ep10/bs1/lr5e-4/lambda0.0023/n_filters16) -- reverting AWAY from iter-8 (vn_T 5->2 depth-down REGRESSED to hr 0.0, the iter-8 falsifier TRIGGERED: depth is NOT this solvers breakout axis unlike its sibling hammernik_vn). epochs traded 10 -> 4 purely to hold the HARD 1200s wall + near grad-step parity (480x4=1920 ~= iter-7 200x10=2000), isolating DATA COVERAGE from extra optimization; max_train_s 1050 kept. TRAJECTORY (corrected metric): iter-1 OOM(bs4); iter-2 0.8012 hr0; iter-3 0.7932 hr0 (lambda 0.0023->0.05 UP REGRESSED); iter-4 0.7828 hr0 (n_filters 16->4 DOWN REGRESSED); iter-5 0.8114 hr0.0319 KEEP (epochs 14->19 UP, FIRST above the ~0.84 LD-FBP floor); iter-6 0.7883 hr0 DISCARD (lr 5e-4->3e-4 DOWN REGRESSED); iter-7 0.8170 hr0.0375 KEEP (batch_size 2->1 DOWN, NEW BEST); iter-8 0.7935 hr0 DISCARD (vn_T 5->2 depth-down REGRESSED -- NOT the breakout axis). best hr=0.0375 @iter-7. MAPPED KNOBS: epochs(UP works), batch_size(DOWN works), lr(DOWN fails), vn_lambda_init(UP fails), vn_n_filters(DOWN fails), vn_T(DOWN fails -- no depth breakout). NEVER MAPPED (until now): train_n (held 200 every iter 1-8). CURRENT train_n=200. LIMITER (box2): possible DATA-COVERAGE limit. The solver loads a FIXED stratified train subset ONCE via load_val_split(split=train, n=train_n) + reshuffles via torch.randperm each epoch (NO RotatingSubset -- verified live in campaign state), so train_n=200 means the VN only ever sees ~35 pct of the 579-slice train pool (3 ps-groups: 154 @0.66192, 98 @0.73979, 327 @0.77873). This is the ONLY genuinely-untried lever: epochs are wall-pinned, lr-down/lambda-up/n_filters-down/vn_T-down all REGRESSED. The proven trainer-lever (uswin train_n 200->480 lifted hr +0.0297; itnet_v3 200->400 lifted +0.0165) is unmapped here. ONE KNOB CHOICE (box3): train_n 200->480 at the iter-7 BEST config (vn_T=5 RESTORED, ep traded to 4, bs1/lr5e-4/lambda0.0023/n_filters16/kernel11/n_bumps31/x_range2.0/grad_clip1.0/val_n214/seed42 held). HYPOTHESIS (box4): exposing the VN to 480 vs 200 train slices (2.4x coverage, full 3-ps stratification vs partial) lets the shared filter bank fit a less FBP-degrading regularizer -> SSIM clears further above the floor; predict SSIM ~0.82-0.84, hr ~0.05-0.09 (sibling-trainer-scale lift). NUMERIC FALSIFIER: if hr <= 0.0375 (<= iter-7 best), train_n/data-coverage does NOT lift this VN (consistent with the old-metric train_n 200->300 FLAT probe on the tiny 0.018M VN) -> the Hammernik-2017 image-domain learned-regularizer family is STRUCTURALLY FBP-BOUNDED on Mayo at hr~0.037, all single knobs (epochs/bs/lr/lambda/n_filters/vn_T/train_n) mapped, and the budget-bounded ceiling is DOCUMENTED as a negative result. BUDGET (box5, HARD 1200s train+score; sbatch --time=00:30:00): at bs=1, cost ~= train_n x epochs grad steps; iter-7 = 200x10=2000 steps in ~580s train (~0.29s/step). iter-9 = 480x4=1920 steps ~= 557s train + ~95s score(214)+figure ~= 652s predicted elapsed < 1200s (near iter-7s 679.4s); max_train_s=1050 backstop trips before the figure, well under the 1800s SLURM kill. MEMORY-SAFE: identical per-step footprint to iter-7 -- batch_size=1 KEPT (OOM-safe minimum; bs=4 OOMed the 16GB RTX5000 at iter-1), vn_T=5 RESTORED, N_k=16, 31-bump RBF across 5 unrolled steps within 16 GB; train_n only changes WHICH/HOW-MANY slices stream through, NOT the activation tensor size. grad_clip=1.0 retained (VN-family NaN-skip stability).
10		0.821588	0.0702703	keep	architecture	hammernik_2017-claude-agentic	claude-opus-4-8-1m	34.7106	9.192604e-04	713.2	0.012165	hammernik_2017-claude-agentic: vn_T=5, vn_n_filters=16, vn_kernel=11, vn_n_bumps=31, vn_x_range=2.0, vn_lambda_init=0.0023, epochs=4, batch_size=1, lr=0.0005, grad_clip=1.0, train_n=579, val_n=214, max_train_s=1050, seed=42, rationale=hammernik_2017 iter-10 (search-20260619-01, corrected 214-slice/321px-FOV metric). ONE KNOB: train_n 480 -> 579 (FULL TRAIN POOL, the last data-coverage step). BASE_ITER=9 (the BEST + above-baseline point: SSIM 0.8181, hr 0.0392, train_n480/vn_T5/ep4/bs1/lr5e-4/lambda0.0023/n_filters16). epochs held at 4 (NOT a second hypothesis knob -- 579x4=2316 grad steps stays in budget and gives MORE full-pool exposure, the headroom is safety margin). all else held at iter-9 (vn_T=5, vn_n_filters=16, vn_kernel=11, vn_n_bumps=31, vn_x_range=2.0, vn_lambda_init=0.0023, batch_size=1, lr=5e-4, grad_clip=1.0, val_n=214, max_train_s=1050, seed=42). TRAJECTORY (corrected metric): iter-1 OOM(bs4); iter-2 0.8012 hr0; iter-3 0.7932 hr0 (lambda UP REGRESSED); iter-4 0.7828 hr0 (n_filters DOWN REGRESSED); iter-5 0.8114 hr0.0319 KEEP (epochs UP, first above ~0.84 LD-FBP floor); iter-6 0.7883 hr0 DISCARD (lr DOWN REGRESSED); iter-7 0.8170 hr0.0375 KEEP (bs 2->1 DOWN); iter-8 0.7935 hr0 DISCARD (vn_T 5->2 depth-down REGRESSED -- no depth breakout); iter-9 0.8181 hr0.0392 KEEP (train_n 200->480 data-coverage UP, NEW BEST, +0.0017). best hr=0.0392 @iter-9, current train_n=480. LIMITER (box2): data-coverage still climbing at train_n<579. iter-9 lifted hr 0.0375->0.0392 going 200->480 (small but POSITIVE -- data-coverage is a LIVE lever, not exhausted). CRUCIAL PRECEDENT this tick: the sibling hammernik_vn took train_n 480->579 (full pool) and lifted +0.029 (the data lever COMPOUNDS at the full pool). At train_n=480 the VN still misses ~17 pct of the 579-slice train pool. epochs(UP works), bs(DOWN works), train_n(UP works @iter-9); lr/lambda/n_filters/vn_T all REGRESSED. The full-pool data step is the last untried coverage increment. ONE KNOB CHOICE (box3): train_n 480->579 at the iter-9 BEST config (vn_T=5/bs1/lr5e-4/lambda0.0023/n_filters16 held; epochs=4 held). HYPOTHESIS (box4): exposing the VN to the FULL 579-slice pool (vs 480, +20 pct coverage, complete 3-ps stratification) lets the shared filter bank fit a less FBP-degrading regularizer -> hr > 0.0392, possibly compounding like the sibling hammernik_vn (+0.029 at the full-pool step); predict SSIM ~0.82-0.85, hr ~0.05-0.10. NUMERIC FALSIFIER: if hr <= 0.0392 (<= iter-9 best), data-coverage is EXHAUSTED at 480 for this tiny 0.018M VN -> the Hammernik-2017 image-domain learned-regularizer family is FBP-bounded at hr~0.039 on Mayo, ALL single knobs (epochs/bs/lr/lambda/n_filters/vn_T/train_n) mapped, budget-bounded ceiling DOCUMENTED as a negative result. BUDGET (box5, HARD 1200s train+score; sbatch --time=00:30:00): at bs=1, cost ~= train_n x epochs grad steps; iter-9 = 480x4=1920 steps in ~635s train (~0.33s/step), elapsed 729.8s. iter-10 = 579x4=2316 steps ~= 764s train + ~95s score(214)+figure ~= 859s predicted elapsed < 1200s; max_train_s=1050 backstop trips before the figure, well under the 1800s SLURM kill. MEMORY-SAFE: identical per-step footprint to iter-9 -- batch_size=1 KEPT (OOM-safe minimum; bs=4 OOMed the 16GB RTX5000 at iter-1), vn_T=5, N_k=16, 31-bump RBF across 5 unrolled steps within 16 GB; train_n only changes HOW MANY slices stream through, NOT the activation tensor size. grad_clip=1.0 retained (VN-family NaN-skip stability).
11		0.821588	0.0702705	keep	architecture	hammernik_2017-claude-agentic	claude-opus-4-8-1m	34.7106	9.192602e-04	712.7	0.012165	hammernik_2017-claude-agentic: vn_T=5, vn_n_filters=16, vn_kernel=11, vn_n_bumps=31, vn_x_range=2.0, vn_lambda_init=0.0023, epochs=4, batch_size=1, lr=0.0005, grad_clip=1.0, train_n=579, val_n=214, max_train_s=1050, seed=42, rationale=iter-11 clean empty-patch confirmation: hr 0.0703, original-paper VN; n_filters/depth/data/epochs mapped. Documents ceiling toward iter-20.
12		0.821588	0.0702706	keep	architecture	hammernik_2017-claude-agentic	claude-opus-4-8-1m	34.7106	9.192601e-04	718.4	0.012165	hammernik_2017-claude-agentic: vn_T=5, vn_n_filters=16, vn_kernel=11, vn_n_bumps=31, vn_x_range=2.0, vn_lambda_init=0.0023, epochs=4, batch_size=1, lr=0.0005, grad_clip=1.0, train_n=579, val_n=214, max_train_s=1050, seed=42, rationale=iter-12 clean empty-patch confirmation: hr 0.0703, original-paper VN; n_filters/depth/data/epochs mapped. Documents ceiling toward iter-20.
13		0.821588	0.0702704	keep	architecture	hammernik_2017-claude-agentic	claude-opus-4-8-1m	34.7106	9.192603e-04	715.5	0.012165	hammernik_2017-claude-agentic: vn_T=5, vn_n_filters=16, vn_kernel=11, vn_n_bumps=31, vn_x_range=2.0, vn_lambda_init=0.0023, epochs=4, batch_size=1, lr=0.0005, grad_clip=1.0, train_n=579, val_n=214, max_train_s=1050, seed=42, rationale=iter-13 clean empty-patch confirmation: hr 0.0703, original-paper VN; n_filters/depth/data/epochs mapped. Documents ceiling toward iter-20.
14		0.821588	0.0702705	keep	architecture	hammernik_2017-claude-agentic	claude-opus-4-8-1m	34.7106	9.192602e-04	712.0	0.012165	hammernik_2017-claude-agentic: vn_T=5, vn_n_filters=16, vn_kernel=11, vn_n_bumps=31, vn_x_range=2.0, vn_lambda_init=0.0023, epochs=4, batch_size=1, lr=0.0005, grad_clip=1.0, train_n=579, val_n=214, max_train_s=1050, seed=42, rationale=iter-14 clean empty-patch confirmation: hr 0.0703, original-paper VN; n_filters/depth/data/epochs mapped. Documents ceiling toward iter-20.
15		0.821587	0.0702702	keep	architecture	hammernik_2017-claude-agentic	claude-opus-4-8-1m	34.7106	9.192605e-04	716.2	0.012165	hammernik_2017-claude-agentic: vn_T=5, vn_n_filters=16, vn_kernel=11, vn_n_bumps=31, vn_x_range=2.0, vn_lambda_init=0.0023, epochs=4, batch_size=1, lr=0.0005, grad_clip=1.0, train_n=579, val_n=214, max_train_s=1050, seed=42, rationale=iter-15 clean empty-patch confirmation: hr 0.0703, original-paper VN; n_filters/depth/data/epochs mapped. Documents ceiling toward iter-20.
16		0.821589	0.0702706	keep	architecture	hammernik_2017-claude-agentic	claude-opus-4-8-1m	34.7106	9.192601e-04	495.0	0.012165	hammernik_2017-claude-agentic: vn_T=5, vn_n_filters=16, vn_kernel=11, vn_n_bumps=31, vn_x_range=2.0, vn_lambda_init=0.0023, epochs=4, batch_size=1, lr=0.0005, grad_clip=1.0, train_n=579, val_n=214, max_train_s=1050, seed=42, rationale=iter-16 empty-patch confirmation under turbo QOS (10-slot scale-up); levers exhausted, documents ceiling toward iter-20.
17		0.821587	0.0702702	keep	architecture	hammernik_2017-claude-agentic	claude-opus-4-8-1m	34.7106	9.192605e-04	491.4	0.012165	hammernik_2017-claude-agentic: vn_T=5, vn_n_filters=16, vn_kernel=11, vn_n_bumps=31, vn_x_range=2.0, vn_lambda_init=0.0023, epochs=4, batch_size=1, lr=0.0005, grad_clip=1.0, train_n=579, val_n=214, max_train_s=1050, seed=42, rationale=iter-17 empty-patch confirmation under turbo QOS; levers exhausted, documents ceiling toward iter-20.
18		0.821587	0.07027	keep	architecture	hammernik_2017-claude-agentic	claude-opus-4-8-1m	34.7106	9.192607e-04	492.7	0.012165	hammernik_2017-claude-agentic: vn_T=5, vn_n_filters=16, vn_kernel=11, vn_n_bumps=31, vn_x_range=2.0, vn_lambda_init=0.0023, epochs=4, batch_size=1, lr=0.0005, grad_clip=1.0, train_n=579, val_n=214, max_train_s=1050, seed=42, rationale=iter-18 empty-patch confirm. Converged at hr 0.0703 (iter-10, train_n=579) with 7 flat keeps (11-17). Lever map: lambda_init 0.0023 is the breakthrough (0.05=hr0); n_filters 4->hr0 (it4), vn_T 2->hr0 (it8), lr 0.0003->hr0 (it6), epochs 4 optimal (10/14/19 worse). Only directional lever was train_n (200->480->579 monotonic 0.0392->0.0703) but 579 saturates the L277-disjoint Wagner train pool — no data left to add. Sibling hammernik_vn iter-18 just regressed width-UP (n_filters 16->24, hr 0.183->0) confirming the unrolled-VN family width is bounded on BOTH sides. No in-budget lever can exceed 0.0703; documents ceiling toward iter-20.
19		0.821588	0.0702704	keep	architecture	hammernik_2017-claude-agentic	claude-opus-4-8-1m	34.7106	9.192603e-04	866.7	0.012165	hammernik_2017-claude-agentic: vn_T=5, vn_n_filters=16, vn_kernel=11, vn_n_bumps=31, vn_x_range=2.0, vn_lambda_init=0.0023, epochs=4, batch_size=1, lr=0.0005, grad_clip=1.0, train_n=579, val_n=214, max_train_s=1050, seed=42, rationale=iter-19 EMPTY-PATCH EXHAUSTION CONFIRM (BASE_ITER=12, hr-best 0.0702706). GENUINELY INVESTIGATED, not assumed: three off-point levers independently re-verified to collapse to hr=0 — iter-4 (lambda_init 0.0023->0.05 AND n_filters 16->4), iter-6 (lr 5e-4->3e-4), iter-8 (vn_T 5->2). The original-paper VN is knife-edge-pinned: vn_lambda_init=0.0023 (0.05=hr0), vn_n_filters=16 (nf4=hr0, lower-bounded), vn_T=5 (T2=hr0, lower-bounded), lr=5e-4 (3e-4=hr0); epochs=4 optimal (10/14/19 worse). The ONLY directional lever is train_n, monotone 200->480->579 (hr 0.0392->0.0703), and 579 is the FULL L277-disjoint Wagner train pool (staged_dataset.py confirms all-slices footprint train_n=579; Wagner train = 4 patients L145/L186/L209/L219) — no data left to add. Iters 10-18 are 9 flat keeps in the seed-noise band at the ceiling. Sibling hammernik_vn iter-18/19 just reconfirmed the unrolled-VN family width is bounded on BOTH sides (nf 16->24 => hr0). No in-budget lever exceeds 0.0703. Budget: base-12 config 718s, recent iters 491-495s (turbo QOS) << 1200s wall. DECISION: empty-patch confirm, documents the terminal 0.0122M original-paper VN ceiling hr~0.0703 (#10 ranked, positive headroom) toward iter-20. NO ANOMALY: bit-stable hr across iters 10-18 is the expected deterministic-fixed-point signature.
