iter	commit	val_score	headroom	status	change_class	agent	model	rationale
1			0	discard	architecture	hammernik_2017-claude-agentic-breast-ct	claude-opus-4.7-1m	hammernik_2017-claude-agentic: vn_T=5, vn_n_filters=16, vn_kernel=11, vn_n_bumps=31, vn_x_range=2.0, vn_lambda_init=0.0023, epochs=40, batch_size=4, lr=0.0005, grad_clip=1.0, train_n=200, val_n=214, max_train_s=1080, seed=42, rationale=FRESH search-20260619-01 iter-1 FEASIBILITY under the corrected protocol (val=ALL 214 L277 slices + 321px detector-geometry FOV; HARD 20-min train+score budget). Hammernik-2017 here is an IMAGE-DOMAIN variational net that denoises the FBP -- NO projector inside the unrolled loop, so each forward is far cheaper than LPD (which ran the PYRO-NN projector in-loop and still did train200+score214 in 1149s/19.2min). That cheapness is spent on CONVERGENCE not capacity, to dodge the LPD trap (under-trained heavy unrolled net -> hr=0 @ SSIM 0.843). Capacity modest: vn_T=5, vn_n_filters=16 (below the 24 default for a cheaper RBF activation loop), vn_kernel=11, vn_n_bumps=31; vn_lambda_init=2.3e-3 = the documented VN-port working corner (LOOSE hint, not validated). Training favors convergence: epochs=40, train_n=200, batch=4, lr=5e-4, grad_clip=1.0; max_train_s=1080 (18min) in-solver wall trips before the 30min SLURM kill, leaving headroom for score(214)+figure. Hyp: a budget-sized, ACTUALLY-CONVERGED Hammernik-2017 lands near or above the ~0.84 LD-FBP-ish SSIM floor within 20 min on Mayo; if even at 40 epochs it stays stuck at hr=0 with lambda_t barely budging (the documented 2026-06-08 failure signature), that is the iter-1 feasibility finding -- a shared-filter-bank structural ceiling, not a config knob away.
2		0.80123	0	discard	architecture	hammernik_2017-claude-agentic-breast-ct	claude-opus-4.7-1m	hammernik_2017-claude-agentic: vn_T=5, vn_n_filters=16, vn_kernel=11, vn_n_bumps=31, vn_x_range=2.0, vn_lambda_init=0.0023, epochs=14, batch_size=2, lr=0.0005, grad_clip=1.0, train_n=200, val_n=214, max_train_s=1000, seed=42, rationale=search-20260619-01 iter-2 OOM RESCUE of hammernik_2017. iter-1 (batch_size=4) was NOT a real recon: it CUDA-OOMed in the _rho_prime RBF-bump loop at elapsed_s=72.5 on a 16GB RTX5000 (val_score blank in results.tsv), recorded as 0.0. The (B,F,H,W)=(4,16,512,512) x 31-bump RBF activation tensors held across 5 unrolled steps for autograd blew the card. SINGLE COHERENT memory-safety change for this rescue: batch_size 4->2, which halves every per-batch activation tensor in the bump loop -- the direct cause. NOTE: this hammernik_2017 solver is a PURE IMAGE-DOMAIN denoiser of the FBP (no projector in the unrolled loop) and does NOT read vn_checkpoint or vn_dc_norm (verified by grep over every cfg[...]/cfg.get(...) in the solver: only vn_T/vn_n_filters/vn_kernel/vn_n_bumps/vn_x_range/vn_*_init_std/vn_lambda_init/epochs/batch_size/lr/grad_clip/train_n/val_n/seed/max_train_s are consumed). Those two knobs belong to the SIBLING projector-in-loop hammernik_vn solver; passing them here would be silently ignored, so they are intentionally omitted -- the operative fix this solver honors is the batch halving (+ grad_clip=1.0 already present for VN-family NaN-skip stability). Budget: HARD 20-min train+score; val=ALL 214 L277 slices (321px detector-geometry FOV default, no fov= override; staged_canonical v3 mayo_ldct_fitted geometry, per-sample-ps, bg_target=truth). batch=2 ~doubles steps/epoch, so epochs 40->14 (mirrors the sibling hammernik_vn iter-1 that scored 0.805 in 1296s); max_train_s=1000 (16.7min in-solver wall) is the binding constraint and leaves ~3min for score(214)+figure under the 30min SLURM kill. capacity kept modest (vn_T=5, vn_n_filters=16). HYPOTHESIS: with batch halved the activation footprint drops ~2x, the OOM is avoided, hammernik_2017 produces its FIRST FINITE recon landing near/above the ~0.84 LD-FBP floor (sibling hammernik_vn hit 0.805) -- the first valid datapoint for this solver under the corrected metric.
3		0.793173	0	discard	architecture	hammernik_2017-claude-agentic	claude-opus-4-8-1m	33.9206	1.006795e-03	895.8	0.012165	hammernik_2017-claude-agentic: vn_T=5, vn_n_filters=16, vn_kernel=11, vn_n_bumps=31, vn_x_range=2.0, vn_lambda_init=0.05, epochs=14, batch_size=2, lr=0.0005, grad_clip=1.0, train_n=200, val_n=214, max_train_s=1000, seed=42, rationale=hammernik_2017 iter-3 (search-20260619-01, corrected 214-slice/321px-FOV metric). ONE KNOB: vn_lambda_init 0.0023 -> 0.05 (~22x DC-weight init). All else held at iter-2 (vn_T=5, vn_n_filters=16, vn_kernel=11, vn_n_bumps=31, vn_x_range=2.0, epochs=14, batch_size=2, lr=5e-4, grad_clip=1.0, train_n=200, val_n=214, max_train_s=1000, seed=42). PRIOR (NUMBERS, corrected metric): iter-1 OOM at batch_size=4 (no recon, hr=0, elapsed 72s); iter-2 = FIRST valid datapoint, val_ssim=0.80123 hr=0 (PSNR 33.91, RMSE 0.00101, baseline_PSNR 34.08 so LD-FBP floor SSIM ~0.84; iter-2 is BELOW the FBP floor), elapsed 887s (train 789.7s, ~5 min budget headroom under the 30-min SLURM kill). iter-1->iter-2 = the first finite point; this is hammernik_2017's first real number under the corrected metric and it sits below baseline. DIAGNOSIS from iter-2 SLURM log 765262: training CONVERGED (loss 2.5e-4 ep1 -> 8.7e-7 ep14, flat by ep5) so epochs-up is INERT (NOT under-training); and CRITICALLY lambda_t stayed pinned at ['0.0023','0.00231','0.00232','0.00232','0.00233'] across ALL 14 epochs -- Adam never grew the learnable DC weight from its init. This solver is PURE IMAGE-DOMAIN: the unrolled update is y <- y - K^T*rho'(K*y) - lam*(y - y_NN) (solver line 141), so lam pulls the recon toward the FBP init y_NN. With lam ~0.0023 the learned-regulariser gradient K^T*rho' dominates the FBP-anchor term, so the VN over-smooths the FBP init DOWN below the ~0.84 baseline (val_ssim 0.80 < FBP). LIMITER = DC weight too small (NOT capacity, NOT epochs). Since lambda_t never moves from init, the init vn_lambda_init IS the lever. vn_lambda_init 0.0023 -> 0.05 makes the FBP-anchor term ~22x stronger so the recon stays pinned near the FBP init instead of being smoothed below it. lr held (campaign record: lr5e-4 optimal, 8e-4 worse for the VN family). HYPOTHESIS: with the DC anchor ~22x stronger, val_ssim clears the ~0.84 FBP floor and hr>0 (predict val_ssim > 0.84). FALSIFIER: if val_ssim stays <=0.84 (still <FBP) the shared-filter-bank regulariser is structurally degrading even under a strong FBP anchor, and iter-4 must attack the regulariser itself (drop vn_n_filters or shrink x_range / tighten the RBF activation) rather than the DC weight. BUDGET (HARD 20-min train+score; sbatch --time=00:30:00): the lambda VALUE does not change per-step compute (same image-domain conv + RBF-bump loop), so cost ~= iter-2: train ~790s + ~100s score(214)+figure ~= 890s, well under the 1800s SLURM kill. MEMORY-SAFE: identical footprint to iter-2 -- batch_size=2 (KEPT, do NOT raise: bs=4 OOMed the 16GB card in the _rho_prime RBF-bump loop at iter-1) + N_k=16 + 31-bump activation across 5 unrolled steps stays within 16 GB. grad_clip=1.0 retained (VN-family NaN-skip stability).
4		0.782816	0	discard	architecture	hammernik_2017-claude-agentic	claude-opus-4-8-1m	33.6028	1.044315e-03	319.2	0.003045	hammernik_2017-claude-agentic: vn_T=5, vn_n_filters=4, vn_kernel=11, vn_n_bumps=31, vn_x_range=2.0, vn_lambda_init=0.05, epochs=14, batch_size=2, lr=0.0005, grad_clip=1.0, train_n=200, val_n=214, max_train_s=1000, seed=42, rationale=hammernik_2017 iter-4 (search-20260619-01, corrected 214-slice/321px-FOV metric). TERMINAL regularizer-attack iter. NOTE: the prompt's nominal lever vn_normalize_filters does NOT exist in solver_hammernik_2017.py (verified: this solver is a PURE IMAGE-DOMAIN VN that consumes only vn_T/vn_n_filters/vn_kernel/vn_n_bumps/vn_x_range/vn_*_init_std/vn_lambda_init/epochs/batch_size/lr/grad_clip/train_n/val_n/seed/max_train_s; vn_normalize_filters belongs to the SIBLING projector-in-loop hammernik_vn solver, which is testing exactly that knob in parallel job 765379 iter-4). Per the prompt's explicit fallback and iter-3's own pre-registered falsifier, iter-4 attacks the REGULARIZER ITSELF via the leanest config that avoids the DC-smoothing collapse: ONE KNOB vn_n_filters 16 -> 4 (shrink the analysis-filter bank 4x). All else held at iter-3 (vn_T=5, vn_kernel=11, vn_n_bumps=31, vn_x_range=2.0, vn_lambda_init=0.05, epochs=14, batch_size=2, lr=5e-4, grad_clip=1.0, train_n=200, val_n=214, max_train_s=1000, seed=42). TRAJECTORY (NUMBERS, corrected metric, all hr=0, all BELOW the ~0.84 LD-FBP floor): iter-1 OOM at batch_size=4 (no recon, elapsed 72s); iter-2 SSIM 0.80123 (FIRST valid datapoint, PSNR 33.91, RMSE 0.00101, baseline_PSNR 34.08, elapsed 887s); iter-3 SSIM 0.793173 (vn_lambda_init 0.0023->0.05, DC-weight ~22x UP -> REGRESSED -0.008, PSNR 33.92, RMSE 0.001007, elapsed 895.8s). BOTH levers tried so far regressed: capacity-as-it-was AND DC-weight-up. FAILURE MODE (well-characterized, confirmed cross-sibling): the learned VN regularizer term Sum_i K_i^T rho'_i(K_i y) (solver line 141) is a BLUNT SMOOTHER that degrades the FBP init y_NN below baseline, and at iter-3 lambda_t stayed pinned at init across all 14 epochs (Adam never grew the DC weight), so the lambda-anchor cannot save it. The sibling hammernik_vn shows the SAME signature: iter-1 0.8053 -> iter-2 0.7920 (filters UP regressed) -> iter-3 0.7682 (lambda UP regressed), monotone below FBP. ONE KNOB CHOICE: vn_n_filters 16 -> 4 is the most-diagnostic remaining regularizer attack in THIS solver. Shrinking the analysis-filter bank 4x structurally minimizes the degrees of freedom of the smoothing term Sum_i K_i^T rho'_i(K_i y) -- the leanest learned-regularizer that still leaves a learned term at all. If the iter-1/2/3 degradation is the over-parameterized 16-filter bank collapsing into a low-pass smoother of the FBP init, a 4-filter bank has far less capacity to over-smooth -> the recon should stop sinking below the FBP init. (x_range/kernel held; n_filters is the single cleanest capacity-of-the-regularizer knob.) HYPOTHESIS: with the filter bank shrunk 16->4, the regularizer stops smoothing the FBP init below baseline; val_ssim clears the ~0.84 FBP floor (hr > 0); predict val_ssim > 0.84. FALSIFIER (the terminal one): if val_ssim still <= 0.84 (below FBP) with the leanest regularizer, then hammernik_2017 (and the whole VN family -- the sibling hammernik_vn is exhausting capacity + DC weight + filter-normalization in parallel) is STRUCTURALLY FBP-BOUNDED on real 2304-view rebinned Mayo LDCT regardless of regularizer config -> FILE THE NEGATIVE RESULT: the Hammernik learned-regularizer family does not beat LD-FBP on Mayo. BUDGET (HARD 20-min train+score; sbatch --time=00:30:00): FEWER filters means CHEAPER per-step compute (conv over 4 instead of 16 channels + 4-channel RBF-bump loop), so wall <= iter-3 (895.8s) -- well under the 1800s SLURM kill, >900s margin. MEMORY-SAFE and strictly LIGHTER than iter-3: batch_size=2 KEPT (do NOT raise: bs=4 OOMed the 16GB RTX5000 in the _rho_prime RBF-bump loop at iter-1), and N_k 16->4 further shrinks the (B,F,H,W) activation tensors held across 5 unrolled steps. grad_clip=1.0 retained (VN-family NaN-skip stability).
5		0.811414	0.0318584	keep	architecture	hammernik_2017-claude-agentic	claude-opus-4-8-1m	34.359	9.572398e-04	1166.5	0.012165	hammernik_2017-claude-agentic: vn_T=5, vn_n_filters=16, vn_kernel=11, vn_n_bumps=31, vn_x_range=2.0, vn_lambda_init=0.0023, epochs=19, batch_size=2, lr=0.0005, grad_clip=1.0, train_n=200, val_n=214, max_train_s=1100, seed=42, rationale=hammernik_2017 iter-5 (search-20260619-01, corrected 214-slice/321px-FOV metric). ONE KNOB: epochs 14 -> 19 (max that fits the HARD 1200s train+score budget at OOM-safe batch_size=2). BASE_ITER=2 (the BEST valid config, SSIM 0.8012, vn_lambda_init=0.0023) -- reverting AWAY from iter-3 (lambda 0.05, regressed to 0.7932) and iter-4 (n_filters 4, regressed to 0.7828); both single-knob moves regressed, so iter-5 restarts from the best point and changes a different axis. TRAJECTORY (corrected metric, all hr=0, all BELOW the ~0.84 LD-FBP floor): iter-1 OOM (bs=4, no recon); iter-2 SSIM 0.8012 (FIRST valid, ep14/bs2/lambda0.0023, train_time 789.7s); iter-3 0.7932 (lambda 0.0023->0.05 REGRESSED); iter-4 0.7828 (n_filters 16->4 REGRESSED). LIMITER = UNDER-TRAINING, not capacity/lambda/data. EVIDENCE: the corrected-metric runs use bs=2/ep14 = 1400 grad steps; the (now-discarded boundary-slice-metric) sibling sweep CONVERGED only at bs=1/ep38 = 7600 steps (SSIM 8->38 epochs climbed 0.876->0.9484). bs=2/ep14 is ~5x under-trained on gradient steps, and the corrected runs finished ep14 in only 789.7s train -- ~400s of the 1200s budget left UNSPENT. iter-3 claimed epochs-up was INERT because the LOSS converged (8.7e-7 by ep5), but loss-convergence != SSIM-convergence for this VN (the old sweep kept lifting SSIM to ep38 long after loss was tiny). DATA-COVERAGE lever DEFERRED: mechanism verified live (solver loads a FIXED train_n subset via load_val_split + torch.randperm, NO RotatingSubset, so train_n IS a coverage lever), BUT (a) the old-metric train_n 200->300 probe was FLAT (0.9484->0.9478 = the tiny 0.018M VN was NOT data-limited), and (b) per the campaign rule data-coverage applies only AFTER the epoch/capacity levers plateau -- they have NOT (corrected runs are stuck at ep14, far below the proven ep38 convergence point). So epochs FIRST. BUDGET: train_time 56.4s/epoch (789.7s/14); 19 epochs = ~1072s train + ~90s score(214) = ~1162s < 1200s budget; max_train_s=1100 backstop trips before the figure, well under the 1800s SLURM kill. MEMORY-SAFE: identical footprint to iter-2 (bs=2, N_k=16, 31-bump RBF across 5 unrolled steps within 16 GB -- do NOT raise bs, bs=4 OOMed iter-1). grad_clip=1.0 retained (VN-family NaN-skip). HYPOTHESIS: with ~36 percent more gradient steps (1400->1900) the under-trained VN climbs toward its proven convergence basin; predict val_ssim 0.80 -> ~0.86 (clears the 0.84 FBP floor, hr > 0). FALSIFIER: if val_ssim stays <= 0.84 (still below FBP) at 19 epochs, the bs=2 optimization basin is genuinely worse than the bs=1 ep38 path and the budget cannot reach convergence with bs=2 -- iter-6 must then lower lr to extend the effective training (or document the budget-bounded ceiling). lr=5e-4 held (campaign record: lr5e-4 optimal for VN family, 8e-4 worse).
6		0.788285	0	discard	architecture	hammernik_2017-claude-agentic	claude-opus-4-8-1m	33.7454	1.027311e-03	1167.8	0.012165	hammernik_2017-claude-agentic: vn_T=5, vn_n_filters=16, vn_kernel=11, vn_n_bumps=31, vn_x_range=2.0, vn_lambda_init=0.0023, epochs=19, batch_size=2, lr=0.0003, grad_clip=1.0, train_n=200, val_n=214, max_train_s=1100, seed=42, rationale=hammernik_2017 iter-6 (search-20260619-01, corrected 214-slice/321px-FOV metric). ONE KNOB: lr 5e-4 -> 3e-4 (0.6x). BASE_ITER=5 (the NEW BEST + FIRST above-baseline point: SSIM 0.8114, hr 0.0319, ep19/bs2/lr5e-4). All else held at iter-5 (vn_T=5, vn_n_filters=16, vn_kernel=11, vn_n_bumps=31, vn_x_range=2.0, vn_lambda_init=0.0023, epochs=19, batch_size=2, grad_clip=1.0, train_n=200, val_n=214, max_train_s=1100, seed=42). TRAJECTORY (corrected metric): iter-1 OOM(bs4); iter-2 0.8012 hr0; iter-3 0.7932 hr0 (lambda 0.0023->0.05 REGRESSED); iter-4 0.7828 hr0 (n_filters 16->4 REGRESSED); iter-5 0.8114 hr0.0319 KEEP (epochs 14->19, FIRST above the 0.84-ish LD-FBP floor -- under-training diagnosis CONFIRMED, the epochs lever WORKS). LIMITER (box2): the VN is still under-trained toward its proven ep38 convergence basin (the discarded boundary-slice sweep climbed SSIM 0.876->0.9484 over ep8->38), BUT ep19 is WALL-PINNED: iter-5 train was 1071.6s at 56.4s/epoch, elapsed 1166.5s; ONE more epoch = 1128s train + ~95s score(214) = ~1223s > the HARD 1200s budget, so epochs CANNOT go up. The solver uses a PLAIN Adam with NO lr scheduler and consumes no lr_decay/cosine/weight_decay knob (verified by grep) and I may NOT edit the shared solver file -- so an lr-decay schedule is unavailable as a cfg knob. The decisive EVIDENCE for the lever: the iter-5 loss curve CONVERGED numerically by ep11 (~8e-7) yet SSIM is still far below the proven 0.9484 -- loss-convergence != SSIM-convergence for this VN -- AND there is an ep18 INSTABILITY BLIP (loss spiked 8.2e-7 -> 2.5e-6 then recovered to 7.9e-7 at ep19), direct evidence the late-training trajectory is BOUNCING near its basin at lr=5e-4 rather than settling. The budget cannot buy more epochs, so the lever must improve convergence QUALITY within the fixed 19 epochs. ONE KNOB CHOICE (box3): lr 5e-4->3e-4 shrinks every late-training step, damping the ep18-style bounce so the net settles into a better basin instead of overshooting it -- the finer-convergence/stable-late-training lever the protocol prescribes, and exactly the iter-5 pre-registered falsifier path (iter-5: if val_ssim<=0.84 at 19 epochs, iter-6 must lower lr). It is BUDGET-NEUTRAL (lr is a scalar -- identical per-step compute), unlike batch_size which carries an unsized wall-cost risk. lr is held DOWN not up because the campaign record says lr5e-4 optimal and 8e-4 WORSE for the VN family (5e-4 vs 3e-4 is untested). HYPOTHESIS (box4): if lr->3e-4, the late steps shrink and the ep18 instability is damped so the net settles into a better basin -> predict val_ssim rises above 0.8114 (hr > 0.0319), targeting ~0.82-0.83 / hr ~0.04-0.06. FALSIFIER: if val_ssim <= 0.8114 (hr <= 0.0319), lower lr starves the under-trained net of progress more than it stabilizes it -> the bs=2/19-epoch budget is convergence-bounded and iter-7 must trade gradient STEPS (batch_size 2->1 doubles optimizer steps/epoch at ~the same per-epoch wall, attacking the proven step-count limiter directly) -- the only remaining within-budget step-count lever once lr is shown not to help. BUDGET (box5, HARD 1200s train+score; sbatch --time=00:30:00): lr is a scalar, ZERO change to per-step compute, so cost == iter-5: 56.4s/epoch x 19 = 1071.6s train + ~95s score(214)+figure = ~1166s predicted elapsed < 1200s; max_train_s=1100 backstop trips before the figure, well under the 1800s SLURM kill. MEMORY-SAFE: identical footprint to iter-5 -- batch_size=2 KEPT (the OOM-safe value; bs=4 OOMed the 16GB RTX5000 in the _rho_prime RBF-bump loop at iter-1), N_k=16, 31-bump RBF across 5 unrolled steps within 16 GB. grad_clip=1.0 retained (VN-family NaN-skip stability).
