iter	commit	val_score	headroom	status	change_class	agent	model	rationale
20		0.821588	0.0702705	keep	architecture	hammernik_2017-claude-agentic	claude-opus-4-8-1m	34.7106	9.192602e-04	495.9	0.012165	hammernik_2017-claude-agentic: vn_T=5, vn_n_filters=16, vn_kernel=11, vn_n_bumps=31, vn_x_range=2.0, vn_lambda_init=0.0023, epochs=4, batch_size=1, lr=0.0005, grad_clip=1.0, train_n=579, val_n=214, max_train_s=1050, seed=42, rationale=iter-20 FINAL empty-patch terminal ceiling confirm (BASE_ITER=12, hr-best 0.0702706, epochs=4 proven in-budget @718s). GENUINELY INVESTIGATED across full iter-1..19 trajectory: the original-paper Hammernik 2017 VN is knife-edge-pinned at every lever — vn_lambda_init=0.0023 (0.05=>hr0 iter-4), vn_n_filters=16 (nf4=>hr0 iter-4, lower-bounded), vn_T=5 (T2=>hr0 iter-8, lower-bounded), lr=5e-4 (3e-4=>hr0 iter-6); epochs=4 optimal (10/14/19 worse). The ONLY directional lever was train_n, monotone 200->480->579 (hr 0.0392->0.0703), and 579 is the FULL L277-disjoint Wagner train pool (4 patients L145/L186/L209/L219) — no data left to add. Iters 10-18 are 9 bit-stable flat keeps in the deterministic-fixed-point band (hr 0.07027). Sibling hammernik_vn family reconfirmed unrolled-VN width bounded on BOTH sides. No in-budget lever exceeds 0.0703. DECISION: empty-patch — this is the terminal record of the 0.0122M original-paper VN, #10 ranked with positive headroom. Dispatched from EXPLICIT BASE_ITER=12 (NOT default) to load the proven epochs=4/train_n=579/vn_T=5/nf=16 config and avoid the hammernik_vn BASE=default (epochs=12) time-limit-cancel mistake. NO ANOMALY.
