iter	commit	val_score	headroom	status	change_class	agent	model	val_psnr	val_rmse	elapsed_s	params_M	rationale
17	671da566	0.974633	0.208853	keep	architecture	fastdiff_flow_pixel_unconstrained-claude-agentic	claude-opus-4-8-1m	38.3591	4.125263e-03	146.9	3.82279	fastdiff_flow_pixel_unconstrained-claude-agentic: image_size=512, pixel_spacing=0.3516, n_angles=128, n_det=1024, det_spacing=0.35754, sod=500.0, sdd=1000.0, display_min=0.0, display_max=0.5, train_n=400, val_n=200, noise_i0=100000.0, noise_sigma_e=10.0, seed=123, fd_recon_ckpt=/cluster/maier/Agent4CT/checkpoints/fast_diffusion_pixel_breast.pt, fd_recon_steps=8, fd_recon_init=fbp, fd_recon_init_t=0.02, fd_recon_eta=0.1, fd_recon_dc=0, fd_recon_dc_n_cg=5, fd_recon_dc_relax=0.5, rationale=iter-17: DC-off breast-prior. ROBUSTNESS check of the champion (iter-14: init_t0.02/eta0.1/steps8, hr0.2085). ONE KNOB seed 42->123 (different val-slice draw + sampler noise). PRIOR: hr peak firmly at init_t~0.02 (3 KEEPs 14/15/16). README caveat: don't over-trust a single hr number - confirm the cross is seed-robust, not val-draw luck. HYPOTHESIS: hr stays ~0.20 at seed=123 => the DC-off breast prior's baseline-clearing is REAL and reproducible, not a favourable-draw artefact. If hr collapses, the cross was seed-fragile (would qualify the finding).
18	671da566	0.976076	0.260741	keep	architecture	fastdiff_flow_pixel_unconstrained-claude-agentic	claude-opus-4-8-1m	38.9483	3.854705e-03	155.8	3.82279	fastdiff_flow_pixel_unconstrained-claude-agentic: image_size=512, pixel_spacing=0.3516, n_angles=128, n_det=1024, det_spacing=0.35754, sod=500.0, sdd=1000.0, display_min=0.0, display_max=0.5, train_n=400, val_n=200, noise_i0=100000.0, noise_sigma_e=10.0, seed=42, fd_recon_ckpt=/cluster/maier/Agent4CT/checkpoints/fast_diffusion_pixel_breast.pt, fd_recon_steps=8, fd_recon_init=fbp, fd_recon_init_t=0.02, fd_recon_eta=0.05, fd_recon_dc=0, fd_recon_dc_n_cg=5, fd_recon_dc_relax=0.5, rationale=iter-18: DC-off breast-prior. At the hr-peak init_t=0.02, fine-tune eta. ONE KNOB eta 0.1->0.05 (seed 42). PRIOR: champion init_t0.02/eta0.1 = hr0.2085 (seed42) / 0.2089 (seed123, robust). Earlier eta sweep at HIGH init_t0.4 found lower eta = better up to ~0.05-0.1. HYPOTHESIS: at the low-init_t peak, eta=0.05 (even gentler DPS) may edge hr slightly above 0.209 by denoising with minimal measurement overshoot; if flat/lower, eta~0.1 is the joint optimum. Fine 2-lever refinement (init_t x eta) around the champion.
19	671da566	0.975824	0.270858	keep	architecture	fastdiff_flow_pixel_unconstrained-claude-agentic	claude-opus-4-8-1m	39.068	3.801954e-03	167.8	3.82279	fastdiff_flow_pixel_unconstrained-claude-agentic: image_size=512, pixel_spacing=0.3516, n_angles=128, n_det=1024, det_spacing=0.35754, sod=500.0, sdd=1000.0, display_min=0.0, display_max=0.5, train_n=400, val_n=200, noise_i0=100000.0, noise_sigma_e=10.0, seed=42, fd_recon_ckpt=/cluster/maier/Agent4CT/checkpoints/fast_diffusion_pixel_breast.pt, fd_recon_steps=8, fd_recon_init=fbp, fd_recon_init_t=0.02, fd_recon_eta=0.02, fd_recon_dc=0, fd_recon_dc_n_cg=5, fd_recon_dc_relax=0.5, rationale=iter-19: DC-off breast-prior. At hr-peak init_t=0.02, continue eta fine-tune. ONE KNOB eta 0.05->0.02. PRIOR: at init_t0.02, eta0.1->hr0.209, eta0.05->hr0.261(best) - gentler DPS = better denoise, less overshoot. HYPOTHESIS: eta=0.02 (near-minimal guidance) edges hr higher still, OR flattens => eta~0.02-0.05 is the joint optimum with init_t0.02. As eta->0 the recon becomes pure prior-denoise of the FBP-init with ~no measurement pull; the question is whether the whisper of DPS still adds value at the peak. Locates the eta floor at the champion init_t.
20	671da566	0.355788	0	discard	architecture	fastdiff_flow_pixel_unconstrained-claude-agentic	claude-opus-4-8-1m	6.86738	1.548944e-01	268.8	3.82279	fastdiff_flow_pixel_unconstrained-claude-agentic: image_size=512, pixel_spacing=0.3516, n_angles=128, n_det=1024, det_spacing=0.35754, sod=500.0, sdd=1000.0, display_min=0.0, display_max=0.5, train_n=400, val_n=200, noise_i0=100000.0, noise_sigma_e=10.0, seed=42, fd_recon_ckpt=/cluster/maier/Agent4CT/checkpoints/fast_diffusion_pixel_breast.pt, fd_recon_steps=16, fd_recon_init=noise, fd_recon_init_t=0.7, fd_recon_eta=1.0, fd_recon_dc=0, fd_recon_dc_n_cg=5, fd_recon_dc_relax=0.5, rationale=iter-20 (FINAL): DC-off breast-prior. Architecturally-DISTINCT family for STOP-protocol edge coverage. ONE KNOB init fbp->noise (pure unconditional generation from the prior, ZERO FBP anchor; init_t ignored when init=noise so t starts at 1.0; eta back to 1.0 and steps=16 since full-trajectory generation needs guidance+NFE). PRIOR: the FBP-anchored regime peaks at hr0.271 (init_t0.02) - the entire gain came from lightly denoising the FBP init. HYPOTHESIS: with NO FBP init, the DC-off sampler must reconstruct ENTIRELY from the prior + soft DPS on 128-view sparse data -> hr~0 (cannot match FBP), quantifying that the FBP INIT (not the generative prior per se) is what carries the DC-off variant. This is the honest lower bound: the breast prior as a pure generator (no measurement warm-start) does NOT reconstruct sparse-view breast CT. Completes 20 iters + >=3 distinct families (init_t sweep, eta sweep, NFE, seed-robustness, noise-init).
