iter	commit	val_score	headroom	status	change_class	agent	model	val_psnr	val_rmse	elapsed_s	params_M	rationale
1	671da566	0.689663	0	discard	architecture	fastdiff_flow_pixel_unconstrained-claude-agentic	claude-opus-4-8-1m	18.9951	3.833994e-02	130.5	3.82279	fastdiff_flow_pixel_unconstrained-claude-agentic: image_size=512, pixel_spacing=0.3516, n_angles=128, n_det=1024, det_spacing=0.35754, sod=500.0, sdd=1000.0, display_min=0.0, display_max=0.5, train_n=400, val_n=200, noise_i0=100000.0, noise_sigma_e=10.0, seed=42, fd_recon_ckpt=/cluster/maier/Agent4CT/checkpoints/fast_diffusion_pixel_breast.pt, fd_recon_steps=8, fd_recon_init=fbp, fd_recon_init_t=0.7, fd_recon_eta=1.0, fd_recon_dc=0, fd_recon_dc_n_cg=5, fd_recon_dc_relax=0.5, rationale=iter-1 RE-RUN fastdiff_flow_pixel_unconstrained with the BREAST-NATIVE prior (fast_diffusion_pixel_breast.pt, out_scale=0.5, n_train=3600) and DC-PROJECTION OFF (fd_recon_dc=0) = genuine UNCONSTRAINED variant (pure DPS-guided generative sampling from the prior, NO hard CG data-consistency projection). This is the FAIR test: the campaign's 4 fastdiff solvers all scored hr=0 using the OUT-OF-DOMAIN Mayo prior (out_scale 0.05 vs breast 0.5). SIX-BOX: (1) PRIOR: same-slug Mayo-prior run (hr=0 all 20 iters, val_ssim plateaued ~0.895, DC ON) + constrained-sibling breast-prior run (contrast). (2) FAILURE MODE observed in the Mayo-prior run: out_scale mismatch pinned recon intensity 10x too low -> RMSE never beat sparse FBP baseline (hr=0). Breast prior fixes the intensity scale. (3) ONE KNOB vs constrained sibling: fd_recon_dc 1->0 (DC projection OFF); vs Mayo-prior run: ckpt swapped to breast-native. (4) HYPOTHESIS: the breast-native prior alone (DC off) may partially clear the 128-view sparse FBP baseline via the learned prior filling the null space, but is EXPECTED to UNDERPERFORM the DC-on constrained sibling because without the CG projection there is no hard sinogram fidelity anchor - that gap IS the finding (how much the breast prior contributes vs the DC step). (5) BUDGET: 200 slices x 8-step Euler (no CG since DC off) at 512^2, single shared breast PYRO-NN projector; fits the HARD 20-min budget (30-min sbatch wall). (6) Loop continues; iter-2 self-dispatched on landing, tuning sampler knobs (steps, init_t, eta). out_scale auto-reads from ckpt (0.5); pixel domain auto-detected.
2	671da566	0.590418	0	discard	architecture	fastdiff_flow_pixel_unconstrained-claude-agentic	claude-opus-4-8-1m	24.6429	2.001065e-02	130.8	3.82279	fastdiff_flow_pixel_unconstrained-claude-agentic: image_size=512, pixel_spacing=0.3516, n_angles=128, n_det=1024, det_spacing=0.35754, sod=500.0, sdd=1000.0, display_min=0.0, display_max=0.5, train_n=400, val_n=200, noise_i0=100000.0, noise_sigma_e=10.0, seed=42, fd_recon_ckpt=/cluster/maier/Agent4CT/checkpoints/fast_diffusion_pixel_breast.pt, fd_recon_steps=8, fd_recon_init=fbp, fd_recon_init_t=0.4, fd_recon_eta=1.0, fd_recon_dc=0, fd_recon_dc_n_cg=5, fd_recon_dc_relax=0.5, rationale=iter-2: DC-off breast-prior. ONE KNOB init_t 0.7->0.4. PRIOR iter-1: hr=0, PSNR 19.0 vs sparse-FBP baseline PSNR 36.3 (RMSE 3.8e-2 vs 5.2e-3) - the DC-free sampler drifted far from measurement. FAILURE MODE: init_t=0.7 injects 70% noise into the FBP embedding; with NO hard DC anchor and only soft DPS guidance the generative prior hallucinates plausible breast texture and loses fidelity. HYPOTHESIS: lowering init_t to 0.4 injects less noise so the DC-free sampler stays anchored near the measured FBP -> PSNR/RMSE improve toward baseline. init_t is the dominant fidelity lever when DC is off.
3	671da566	0.572429	0	discard	architecture	fastdiff_flow_pixel_unconstrained-claude-agentic	claude-opus-4-8-1m	24.1763	2.111495e-02	150.3	3.82279	fastdiff_flow_pixel_unconstrained-claude-agentic: image_size=512, pixel_spacing=0.3516, n_angles=128, n_det=1024, det_spacing=0.35754, sod=500.0, sdd=1000.0, display_min=0.0, display_max=0.5, train_n=400, val_n=200, noise_i0=100000.0, noise_sigma_e=10.0, seed=42, fd_recon_ckpt=/cluster/maier/Agent4CT/checkpoints/fast_diffusion_pixel_breast.pt, fd_recon_steps=8, fd_recon_init=fbp, fd_recon_init_t=0.2, fd_recon_eta=1.0, fd_recon_dc=0, fd_recon_dc_n_cg=5, fd_recon_dc_relax=0.5, rationale=iter-3: DC-off breast-prior. ONE KNOB init_t 0.4->0.2. TREND: iter-1 (init_t0.7) PSNR19.0/RMSE3.8e-2; iter-2 (init_t0.4) PSNR24.6/RMSE2.0e-2 - monotonic fidelity gain as init_t drops (less injected noise, sampler stays nearer the measured FBP). Both hr=0 (sparse-FBP baseline PSNR36.3/RMSE5.2e-3 is a very strong bar for a DC-free prior sampler). HYPOTHESIS: init_t=0.2 pushes PSNR further toward the FBP baseline because the DC-free sampler reduces to a light prior-denoise of the FBP init; tests whether the breast prior ALONE can approach (not just trail) the baseline. If PSNR keeps rising monotonically, the prior contributes fidelity only insofar as it preserves the FBP - the DC step (absent here) is what would let it EXCEED baseline.
4	671da566	0.406058	0	discard	architecture	fastdiff_flow_pixel_unconstrained-claude-agentic	claude-opus-4-8-1m	12.7579	7.861562e-02	127.6	3.82279	fastdiff_flow_pixel_unconstrained-claude-agentic: image_size=512, pixel_spacing=0.3516, n_angles=128, n_det=1024, det_spacing=0.35754, sod=500.0, sdd=1000.0, display_min=0.0, display_max=0.5, train_n=400, val_n=200, noise_i0=100000.0, noise_sigma_e=10.0, seed=42, fd_recon_ckpt=/cluster/maier/Agent4CT/checkpoints/fast_diffusion_pixel_breast.pt, fd_recon_steps=8, fd_recon_init=fbp, fd_recon_init_t=0.4, fd_recon_eta=3.0, fd_recon_dc=0, fd_recon_dc_n_cg=5, fd_recon_dc_relax=0.5, rationale=iter-4: DC-off breast-prior. Fix init_t=0.4 (iter-2 sweet spot: PSNR24.6, best so far). ONE KNOB eta 1.0->3.0 (DPS guidance scale). TREND: init_t sweep plateaued - iter-2 init_t0.4 PSNR24.6 > iter-3 init_t0.2 PSNR24.2, so ~0.4 is the init_t optimum. FAILURE MODE: with DC off, the ONLY data-fidelity term is the soft DPS gradient (eta/||r||)*grad; at eta=1.0 it under-corrects, leaving the recon 11.7dB below the FBP baseline. HYPOTHESIS: raising eta to 3.0 strengthens the sinogram-consistency pull each Euler step -> PSNR/RMSE improve toward baseline. This directly tests whether cranking the SOFT guidance can substitute for the absent HARD CG DC projection (the constrained sibling's anchor). Expect partial recovery but NOT reaching baseline - that residual gap = the value of the DC step.
5	671da566	0.72172	0	discard	architecture	fastdiff_flow_pixel_unconstrained-claude-agentic	claude-opus-4-8-1m	26.9504	1.534217e-02	130.7	3.82279	fastdiff_flow_pixel_unconstrained-claude-agentic: image_size=512, pixel_spacing=0.3516, n_angles=128, n_det=1024, det_spacing=0.35754, sod=500.0, sdd=1000.0, display_min=0.0, display_max=0.5, train_n=400, val_n=200, noise_i0=100000.0, noise_sigma_e=10.0, seed=42, fd_recon_ckpt=/cluster/maier/Agent4CT/checkpoints/fast_diffusion_pixel_breast.pt, fd_recon_steps=8, fd_recon_init=fbp, fd_recon_init_t=0.4, fd_recon_eta=0.5, fd_recon_dc=0, fd_recon_dc_n_cg=5, fd_recon_dc_relax=0.5, rationale=iter-5: DC-off breast-prior. Fix init_t=0.4 (best). ONE KNOB eta 1.0->0.5. FAILURE MODE at iter-4: eta=3.0 DESTABILIZED the sampler (PSNR crashed 24.6->12.8, RMSE 2.0e-2->7.9e-2) - the adaptive DPS step (eta/||r||)*grad OVERSHOOTS at large eta with no hard-DC to re-anchor => divergence. So cranking soft guidance does NOT substitute for the hard CG DC projection. HYPOTHESIS: a GENTLER eta=0.5 is more stable and may edge past the eta=1.0 result (PSNR24.6) by taking smaller, non-overshooting fidelity steps. Brackets the eta optimum around 1.0 (1.0 vs 0.5 vs the failed 3.0).
6	671da566	0.796754	0	discard	architecture	fastdiff_flow_pixel_unconstrained-claude-agentic	claude-opus-4-8-1m	28.1204	1.340858e-02	131.2	3.82279	fastdiff_flow_pixel_unconstrained-claude-agentic: image_size=512, pixel_spacing=0.3516, n_angles=128, n_det=1024, det_spacing=0.35754, sod=500.0, sdd=1000.0, display_min=0.0, display_max=0.5, train_n=400, val_n=200, noise_i0=100000.0, noise_sigma_e=10.0, seed=42, fd_recon_ckpt=/cluster/maier/Agent4CT/checkpoints/fast_diffusion_pixel_breast.pt, fd_recon_steps=8, fd_recon_init=fbp, fd_recon_init_t=0.4, fd_recon_eta=0.2, fd_recon_dc=0, fd_recon_dc_n_cg=5, fd_recon_dc_relax=0.5, rationale=iter-6: DC-off breast-prior. Fix init_t=0.4. ONE KNOB eta 0.5->0.2. TREND (eta at init_t0.4): eta3.0 PSNR12.8 (diverged) > eta1.0 PSNR24.6 > eta0.5 PSNR27.0 (BEST) - monotonic: LOWER eta = more stable = better, because the soft DPS step overshoots when large and there is no hard DC to re-anchor. HYPOTHESIS: eta=0.2 continues the gain (even gentler guidance, FBP-init+prior dominate) -> PSNR edges higher toward the FBP baseline (36.3). Tests whether eta->0 (near pure prior-denoise of the FBP init, minimal measurement pull) is optimal for the DC-free variant.
7	671da566	0.822086	0	discard	architecture	fastdiff_flow_pixel_unconstrained-claude-agentic	claude-opus-4-8-1m	28.5119	1.281770e-02	136.5	3.82279	fastdiff_flow_pixel_unconstrained-claude-agentic: image_size=512, pixel_spacing=0.3516, n_angles=128, n_det=1024, det_spacing=0.35754, sod=500.0, sdd=1000.0, display_min=0.0, display_max=0.5, train_n=400, val_n=200, noise_i0=100000.0, noise_sigma_e=10.0, seed=42, fd_recon_ckpt=/cluster/maier/Agent4CT/checkpoints/fast_diffusion_pixel_breast.pt, fd_recon_steps=8, fd_recon_init=fbp, fd_recon_init_t=0.4, fd_recon_eta=0.05, fd_recon_dc=0, fd_recon_dc_n_cg=5, fd_recon_dc_relax=0.5, rationale=iter-7: DC-off breast-prior. Fix init_t=0.4. ONE KNOB eta 0.2->0.05. MONOTONIC eta trend (init_t0.4): eta1.0 PSNR24.6, eta0.5 PSNR27.0, eta0.2 PSNR28.1 (best) - lower eta = better because less overshooting measurement pull, recon converges to the prior-denoised FBP init. HYPOTHESIS: eta=0.05 (near-zero guidance) approaches pure prior-denoise of the FBP init -> PSNR edges further toward baseline, locating the eta floor. Since removing measurement guidance ENTIRELY would make it pure unconditional generation from FBP-noised init, a tiny eta is the DC-free sweet spot: it keeps a whisper of sinogram consistency without the overshoot instability. Then switch lever to steps.
8	671da566	0.829801	0	discard	architecture	fastdiff_flow_pixel_unconstrained-claude-agentic	claude-opus-4-8-1m	28.2818	1.316175e-02	250.9	3.82279	fastdiff_flow_pixel_unconstrained-claude-agentic: image_size=512, pixel_spacing=0.3516, n_angles=128, n_det=1024, det_spacing=0.35754, sod=500.0, sdd=1000.0, display_min=0.0, display_max=0.5, train_n=400, val_n=200, noise_i0=100000.0, noise_sigma_e=10.0, seed=42, fd_recon_ckpt=/cluster/maier/Agent4CT/checkpoints/fast_diffusion_pixel_breast.pt, fd_recon_steps=16, fd_recon_init=fbp, fd_recon_init_t=0.4, fd_recon_eta=0.1, fd_recon_dc=0, fd_recon_dc_n_cg=5, fd_recon_dc_relax=0.5, rationale=iter-8: DC-off breast-prior. Switch lever to STEPS (NFE). Hold near-best init_t=0.4, eta=0.1 (eta plateaued: iter-6 eta0.2 PSNR28.1, iter-7 eta0.05 PSNR28.5 - diminishing, so eta~0.1 is the practical floor). ONE KNOB steps 8->16. PRIOR: eta sweep found lower=better but flattening; init_t optimum ~0.4. HYPOTHESIS: doubling Euler steps 8->16 gives finer flow-ODE integration -> the prior denoises the FBP-init more accurately -> PSNR edges up. NOTE eta=0.1 is a small config move vs iter-7's 0.05 but the PRIMARY knob is steps; eta 0.05->0.1 is within the plateaued flat region (rounding to a stable midpoint), so steps remains the interpretable single lever. Best PSNR so far 28.5 is still 7.8dB under the 128-view FBP baseline (36.3) - hr=0 firmly, as expected for DC-off.
9	671da566	0.784436	0	discard	architecture	fastdiff_flow_pixel_unconstrained-claude-agentic	claude-opus-4-8-1m	28.977	1.214941e-02	143.9	3.82279	fastdiff_flow_pixel_unconstrained-claude-agentic: image_size=512, pixel_spacing=0.3516, n_angles=128, n_det=1024, det_spacing=0.35754, sod=500.0, sdd=1000.0, display_min=0.0, display_max=0.5, train_n=400, val_n=200, noise_i0=100000.0, noise_sigma_e=10.0, seed=42, fd_recon_ckpt=/cluster/maier/Agent4CT/checkpoints/fast_diffusion_pixel_breast.pt, fd_recon_steps=8, fd_recon_init=fbp, fd_recon_init_t=0.3, fd_recon_eta=0.1, fd_recon_dc=0, fd_recon_dc_n_cg=5, fd_recon_dc_relax=0.5, rationale=iter-9: DC-off breast-prior. Back to steps=8 (iter-8 steps=16 gave NO PSNR gain, 28.3 vs 28.5, 2x slower => NFE saturated at 8). Fine-tune the DOMINANT lever init_t. ONE KNOB init_t 0.4->0.3 (eta=0.1, steps=8). PRIOR coarse init_t sweep: 0.7->19.0, 0.4->24.6(eta1.0)/best-region, 0.2->24.2 - optimum bracketed near 0.3-0.4. HYPOTHESIS: init_t=0.3 (between the 0.2 and 0.4 coarse points, at the now-tuned low eta=0.1) may edge past the 0.4/eta0.1 PSNR (~28.5) by injecting slightly less noise while retaining enough flow-time for the prior to denoise. Fine-grid refinement of the init_t peak.
10	671da566	0.770477	0	discard	architecture	fastdiff_flow_pixel_unconstrained-claude-agentic	claude-opus-4-8-1m	29.1969	1.184569e-02	124.3	3.82279	fastdiff_flow_pixel_unconstrained-claude-agentic: image_size=512, pixel_spacing=0.3516, n_angles=128, n_det=1024, det_spacing=0.35754, sod=500.0, sdd=1000.0, display_min=0.0, display_max=0.5, train_n=400, val_n=200, noise_i0=100000.0, noise_sigma_e=10.0, seed=42, fd_recon_ckpt=/cluster/maier/Agent4CT/checkpoints/fast_diffusion_pixel_breast.pt, fd_recon_steps=8, fd_recon_init=fbp, fd_recon_init_t=0.25, fd_recon_eta=0.1, fd_recon_dc=0, fd_recon_dc_n_cg=5, fd_recon_dc_relax=0.5, rationale=iter-10: DC-off breast-prior. Fine init_t sweep at low eta=0.1, steps=8. ONE KNOB init_t 0.3->0.25. PRIOR: iter-9 init_t0.3 PSNR28.98 (best) > iter-7 init_t0.4 PSNR28.51 - the init_t peak at low eta is BELOW 0.4. HYPOTHESIS: init_t=0.25 edges the PSNR up further toward its peak (less injected noise, prior still has enough flow-time to denoise); if it turns DOWN, the peak is ~0.3 and I stop lowering. Brackets the init_t optimum at the tuned low-eta operating point.
11	671da566	0.766552	0	discard	architecture	fastdiff_flow_pixel_unconstrained-claude-agentic	claude-opus-4-8-1m	29.5767	1.133881e-02	141.5	3.82279	fastdiff_flow_pixel_unconstrained-claude-agentic: image_size=512, pixel_spacing=0.3516, n_angles=128, n_det=1024, det_spacing=0.35754, sod=500.0, sdd=1000.0, display_min=0.0, display_max=0.5, train_n=400, val_n=200, noise_i0=100000.0, noise_sigma_e=10.0, seed=42, fd_recon_ckpt=/cluster/maier/Agent4CT/checkpoints/fast_diffusion_pixel_breast.pt, fd_recon_steps=8, fd_recon_init=fbp, fd_recon_init_t=0.2, fd_recon_eta=0.1, fd_recon_dc=0, fd_recon_dc_n_cg=5, fd_recon_dc_relax=0.5, rationale=iter-11: DC-off breast-prior. Fine init_t sweep at low eta=0.1, steps=8. ONE KNOB init_t 0.25->0.2. PRIOR: iter-10 init_t0.25 PSNR29.20 (best) > iter-9 init_t0.3 PSNR28.98 - init_t peak still descending at low eta. HYPOTHESIS: init_t=0.2 continues toward the peak (at eta=0.1 the low-init_t degradation seen at eta=1.0/iter-3 does NOT apply since guidance is gentle); if PSNR turns down, peak is ~0.25. Completes the init_t fine-grid at the tuned operating point.
12	671da566	0.824138	0	discard	architecture	fastdiff_flow_pixel_unconstrained-claude-agentic	claude-opus-4-8-1m	31.8766	8.701109e-03	151.1	3.82279	fastdiff_flow_pixel_unconstrained-claude-agentic: image_size=512, pixel_spacing=0.3516, n_angles=128, n_det=1024, det_spacing=0.35754, sod=500.0, sdd=1000.0, display_min=0.0, display_max=0.5, train_n=400, val_n=200, noise_i0=100000.0, noise_sigma_e=10.0, seed=42, fd_recon_ckpt=/cluster/maier/Agent4CT/checkpoints/fast_diffusion_pixel_breast.pt, fd_recon_steps=8, fd_recon_init=fbp, fd_recon_init_t=0.1, fd_recon_eta=0.1, fd_recon_dc=0, fd_recon_dc_n_cg=5, fd_recon_dc_relax=0.5, rationale=iter-12: DC-off breast-prior. Fine init_t sweep at low eta=0.1. ONE KNOB init_t 0.2->0.1. PRIOR (low-eta init_t): 0.3->28.98, 0.25->29.20, 0.2->29.58 - monotonically rising as init_t drops (at gentle eta the recon -> light prior-denoise of the FBP init). HYPOTHESIS: init_t=0.1 approaches pure minimal-noise prior-denoise of the FBP -> PSNR near its ceiling; if it saturates/turns, ~0.1-0.2 is the floor. Tests the extreme low-init_t end: as init_t->0 the sampler reduces to FBP passed through ~0 flow-time (identity-ish), so PSNR should approach but not exceed the FBP baseline (the prior can only lightly denoise, never add the missing sparse-view null-space info the DC step would).
13	671da566	0.91315	0	discard	architecture	fastdiff_flow_pixel_unconstrained-claude-agentic	claude-opus-4-8-1m	35.4342	5.776922e-03	154.2	3.82279	fastdiff_flow_pixel_unconstrained-claude-agentic: image_size=512, pixel_spacing=0.3516, n_angles=128, n_det=1024, det_spacing=0.35754, sod=500.0, sdd=1000.0, display_min=0.0, display_max=0.5, train_n=400, val_n=200, noise_i0=100000.0, noise_sigma_e=10.0, seed=42, fd_recon_ckpt=/cluster/maier/Agent4CT/checkpoints/fast_diffusion_pixel_breast.pt, fd_recon_steps=8, fd_recon_init=fbp, fd_recon_init_t=0.05, fd_recon_eta=0.1, fd_recon_dc=0, fd_recon_dc_n_cg=5, fd_recon_dc_relax=0.5, rationale=iter-13: DC-off breast-prior. ONE KNOB init_t 0.1->0.05. PRIOR (low-eta): init_t0.2->PSNR29.58, init_t0.1->PSNR31.88 (big jump). MECHANISM CONFIRMED: as init_t->0 the DC-off sampler converges to the FBP init (minimal generative perturbation) + light prior denoise => PSNR rises toward the FBP baseline (36.32). HYPOTHESIS: init_t=0.05 pushes PSNR further toward baseline (recon ~= lightly-denoised FBP). This is the KEY finding: the breast prior alone (no DC) can only APPROACH the FBP asymptotically by trusting it - it cannot EXCEED it, because without the CG data-consistency projection there is no mechanism to inject the missing sparse-view null-space information. hr stays 0 (RMSE never beats the FBP's 5.2e-3).
14	671da566	0.974536	0.208544	keep	architecture	fastdiff_flow_pixel_unconstrained-claude-agentic	claude-opus-4-8-1m	38.3557	4.126878e-03	140.7	3.82279	fastdiff_flow_pixel_unconstrained-claude-agentic: image_size=512, pixel_spacing=0.3516, n_angles=128, n_det=1024, det_spacing=0.35754, sod=500.0, sdd=1000.0, display_min=0.0, display_max=0.5, train_n=400, val_n=200, noise_i0=100000.0, noise_sigma_e=10.0, seed=42, fd_recon_ckpt=/cluster/maier/Agent4CT/checkpoints/fast_diffusion_pixel_breast.pt, fd_recon_steps=8, fd_recon_init=fbp, fd_recon_init_t=0.02, fd_recon_eta=0.1, fd_recon_dc=0, fd_recon_dc_n_cg=5, fd_recon_dc_relax=0.5, rationale=iter-14: DC-off breast-prior. ONE KNOB init_t 0.05->0.02. PRIOR: init_t0.1->PSNR31.9/RMSE8.7e-3, init_t0.05->PSNR35.4/RMSE5.78e-3 - approaching the FBP baseline (PSNR36.3/RMSE5.21e-3) from BELOW. hr still 0 because recon RMSE (5.78e-3) > baseline RMSE (5.21e-3) by a hair: the prior's light denoise slightly HURTS vs raw FBP on this well-conditioned 128-view breast data. HYPOTHESIS: init_t=0.02 gets even closer to the FBP (recon ~= FBP + minimal prior touch) -> RMSE approaches but stays just above 5.21e-3 => hr=0 asymptote CONFIRMED. This is the definitive finding: the DC-off breast prior can at best RECOVER the FBP, never EXCEED it (no null-space injection without DC). Edge coverage of the init_t lever (its low end).
15	671da566	0.975076	0.138413	keep	architecture	fastdiff_flow_pixel_unconstrained-claude-agentic	claude-opus-4-8-1m	37.6182	4.492558e-03	152.5	3.82279	fastdiff_flow_pixel_unconstrained-claude-agentic: image_size=512, pixel_spacing=0.3516, n_angles=128, n_det=1024, det_spacing=0.35754, sod=500.0, sdd=1000.0, display_min=0.0, display_max=0.5, train_n=400, val_n=200, noise_i0=100000.0, noise_sigma_e=10.0, seed=42, fd_recon_ckpt=/cluster/maier/Agent4CT/checkpoints/fast_diffusion_pixel_breast.pt, fd_recon_steps=8, fd_recon_init=fbp, fd_recon_init_t=0.01, fd_recon_eta=0.1, fd_recon_dc=0, fd_recon_dc_n_cg=5, fd_recon_dc_relax=0.5, rationale=iter-15: DC-off breast-prior. ONE KNOB init_t 0.02->0.01. BREAKTHROUGH at iter-14: init_t0.02 gave hr=0.2085 (PSNR38.36 > FBP baseline 36.32; RMSE4.13e-3 < baseline 5.21e-3) - the breast prior CLEARED the baseline! MECHANISM: at init_t~0.02 the FBP is embedded at ~2% noise and the prior acts as a learned FBP-DENOISER (well-conditioned 128-view breast: FBP has removable noise; the prior's light denoise + whisper of DPS drops RMSE below raw FBP). So the DC-off prior DOES contribute (21% headroom recovered) as a denoiser, NOT just recovering FBP. HYPOTHESIS: init_t=0.01 - is hr still rising (even lighter touch) or did the peak pass at 0.02? Brackets the hr peak. Also a robustness check that iter-14's cross was not a fluke.
16	671da566	0.964447	0.181099	keep	architecture	fastdiff_flow_pixel_unconstrained-claude-agentic	claude-opus-4-8-1m	38.0596	4.269984e-03	155.7	3.82279	fastdiff_flow_pixel_unconstrained-claude-agentic: image_size=512, pixel_spacing=0.3516, n_angles=128, n_det=1024, det_spacing=0.35754, sod=500.0, sdd=1000.0, display_min=0.0, display_max=0.5, train_n=400, val_n=200, noise_i0=100000.0, noise_sigma_e=10.0, seed=42, fd_recon_ckpt=/cluster/maier/Agent4CT/checkpoints/fast_diffusion_pixel_breast.pt, fd_recon_steps=8, fd_recon_init=fbp, fd_recon_init_t=0.03, fd_recon_eta=0.1, fd_recon_dc=0, fd_recon_dc_n_cg=5, fd_recon_dc_relax=0.5, rationale=iter-16: DC-off breast-prior. ONE KNOB init_t 0.02->0.03 (upper bracket of the hr peak). PRIOR: hr vs init_t: 0.05->0(RMSE5.78e-3), 0.02->0.2085(RMSE4.13e-3 BEST), 0.01->0.1384(RMSE4.49e-3). The hr PEAK is at init_t~0.02 - a sweet spot where the prior optimally denoises the FBP. Below 0.02 (0.01) the prior has too little noise-room; above (0.05) too much generative drift re-raises RMSE. HYPOTHESIS: init_t=0.03 sits between the 0.02 peak and the 0.05 zero - hr should be positive but likely below the 0.02 peak, confirming 0.02 is near-optimal. Fine-grid confirmation of the peak location.
