iter	commit	val_score	headroom	status	change_class	agent	model	val_psnr	val_rmse	elapsed_s	params_M	rationale
13			0	discard	architecture	itnet_v2-claude-agentic	claude-opus-4-8-1m			17.1		itnet_v2-claude-agentic: itnet_k=1, unet_c=48, itnet_alpha_init=0.0026, residual_learning=False, pretrain_lr=0.00025, pretrain_epochs=15, pretrain_patience=15, grad_clip=1.0, train_n=3600, val_n=200, seed=42, rationale=ITER-13 slot (RECOVERY, breast itnet_v2, strict serial, 20-min, --qos=turbo). SIX-BOX (VERIFIED): i6 c32/n2400 0.8768; i12 c32/n3600 0.8828=BEST (full data at stable c=32 lifted +0.006). Data now MAXED (full 3600 used). Width history: c48/n1200 0.8607(i7); c64/n1200 UNSTABLE 0.6035(i8)/0.8618(i10)/0.8034(i11) -- c=64 has training instability. c=48 was more stable than c=64 and untested at full data. (2) FAILURE MODE: c=32 is stable but may be capacity-limited now that data is maxed; c=64 is too unstable. c=48 is the intermediate stable width to test with full data. (3) ONE KNOB vs iter-12 (c32/n3600 champion): unet_c 32 -> 48. Hold n=3600, k=1, ep=15, grad_clip=1.0, seed=42, all else champion. (4) HYPOTHESIS: if c 32->48 at full n=3600, hr rises above 0.8828 because c=48 adds stable capacity (unlike unstable c=64) that full data can now exploit. FALSIFIER: hr <= ~0.883 or unstable/low => c=48 does not beat c=32 at full data; next slot reverts to c=32 and tries a stability-fixed c=64 (lower grad_clip) or accepts the c32/n3600 champion. (5) BUDGET: c48/n3600 ~2.25x c32 conv at full data -- heaviest stable config; --qos=turbo + gate catches TIMEOUT and retries the slot. (6) STRICT one-at-a-time; gate on q=[] AND numeric-hr obs.
14			0	discard	architecture	itnet_v2-claude-agentic	claude-opus-4-8-1m			18.5		itnet_v2-claude-agentic: itnet_k=1, unet_c=64, itnet_alpha_init=0.0026, residual_learning=False, pretrain_lr=0.00025, pretrain_epochs=15, pretrain_patience=15, grad_clip=1.0, train_n=3600, val_n=200, seed=42, rationale=ITER-14 slot (RECOVERY, breast itnet_v2, strict serial via iter_wait.sh, 20-min, --qos=turbo). SIX-BOX (VERIFIED via iter_wait): i12 c32/n3600 0.8828; i13 c48/n3600 0.8841=BEST (c=48 stable+productive at full data, +0.0013). Stable-width capacity lever still positive at full data. c=64 was UNSTABLE at n1200 (0.6035/0.8618/0.8034 across i8/i10/i11) -- but that may be a DATA-STARVATION instability (big net, too few scenes). At full n=3600 the wide net may stabilize. (2) FAILURE MODE / open question: is c=64's instability intrinsic or data-dependent? Full data is the test. (3) ONE KNOB vs iter-13 (c48/n3600): unet_c 48 -> 64. Hold n=3600, k=1, ep=15, grad_clip=1.0, seed=42. (4) HYPOTHESIS: if c 48->64 at full n=3600, hr rises above 0.8841 AND is stable, because full data regularizes the wider net (data-starvation was the i8/i11 instability cause). FALSIFIER: hr << 0.88 or wildly off => c=64 is intrinsically unstable regardless of data; iter-15 reverts to c=48 (champion) and pushes a different lever. (5) BUDGET: c64/n3600 heaviest stable-candidate; --qos=turbo + iter_wait catches TIMEOUT for cheaper retry. (6) STRICT one-at-a-time via iter_wait.sh.
15			0	discard	architecture	itnet_v2-claude-agentic	claude-opus-4-8-1m			18.5		itnet_v2-claude-agentic: itnet_k=1, unet_c=96, itnet_alpha_init=0.0026, residual_learning=False, pretrain_lr=0.00025, pretrain_epochs=12, pretrain_patience=12, grad_clip=1.0, train_n=3600, val_n=200, seed=42, rationale=ITER-15 slot (RECOVERY, breast itnet_v2, strict serial via iter_wait.sh, 20-min, --qos=turbo). SIX-BOX (VERIFIED via iter_wait): c-at-full-data curve: c32/n3600 0.8828(i12), c48/n3600 0.8841(i13), c64/n3600 0.8848(i14)=BEST -- and c=64 is now STABLE at full data (earlier i8/i11 instability was DATA-STARVATION, confirmed). Capacity keeps paying with full data (diminishing: +0.0013, +0.0007). (2) Open question: is there stable capacity headroom beyond c=64 at full data? (3) ONE KNOB vs iter-14 (c64/n3600): unet_c 64 -> 96. pretrain_epochs 15->12 ONLY as budget-fit for the 2.25x-heavier c=96 (epochs proven dead: loss floors ~ep4-6; 12 fully converges -- not a real 2nd knob). Hold n=3600, k=1, grad_clip=1.0, seed=42. (4) HYPOTHESIS: if c 64->96 at full n=3600, hr rises above 0.8848 (capacity still positive at full data, and full data keeps the wide net stable). FALSIFIER: hr <= ~0.885 (flat) or unstable => c=64 is the capacity ceiling at this data; iter-16 locks c64/n3600 champion + seed replicates. (5) BUDGET: c96/n3600 heaviest; ep=12 keeps it in budget; --qos=turbo + iter_wait catches TIMEOUT for retry. (6) STRICT one-at-a-time via iter_wait.sh.
12	671da566	0.998473	0.850377	keep	architecture	itnet_v2-claude-agentic	claude-opus-4-8-1m	52.8242	7.801769e-04	1455.1	0.928098	itnet_v2-claude-agentic: itnet_k=1, unet_c=32, itnet_alpha_init=0.0026, residual_learning=False, pretrain_lr=0.0005, pretrain_epochs=15, pretrain_patience=15, grad_clip=1.0, train_n=2400, val_n=200, seed=42, rationale=ITER-12 slot (v3 sentinel gate, strict serial, 20-min, --qos=turbo). SIX-BOX (VERIFIED, real hr>0): best=iter-6 c32/n2400 hr0.8768. LEARNED THIS ROUND: c48/n2400 does NOT fit the 30-min wall -- BOTH attempts (771871, 771918) TIMEOUT'd at 30min. So capacity-scaling above c=32 is budget-infeasible at n=2400; I must tune TRAINING knobs at the fast, budget-safe c=32/n2400 champion instead. (2) FAILURE MODE: heavier nets time out; the recon IS the pretrained denoiser (single k=1 DC step), so denoiser training quality dominates and pretrain_lr (fixed at 2.5e-4 all along) is the untested cheap lever. (3) ONE KNOB vs iter-6 (c32/n2400): pretrain_lr 0.00025 -> 0.0005 (2x). Hold c=32, n=2400, k=1, ep=15, grad_clip=1.0, seed=42. (4) HYPOTHESIS: if pretrain_lr 2.5e-4->5e-4, hr rises above 0.8768 because a higher lr may reach a better denoiser minimum in 15 epochs (loss floored ~1e-6 by ep4-6 at 2.5e-4, suggesting room to move faster); grad_clip=1.0 guards instability. FALSIFIER: hr <= ~0.877 (flat) or unstable => lr near-optimal; iter-13 tries itnet_alpha_init instead. (5) BUDGET: identical cost to iter-6 (c32/n2400, fits easily) -- only lr changes. (6) STRICT one-at-a-time via v3 sentinel; rm DONE.* before dispatch.
13	671da566	0.998954	0.880383	keep	architecture	itnet_v2-claude-agentic	claude-opus-4-8-1m	54.7683	6.237164e-04	1466.9	0.928098	itnet_v2-claude-agentic: itnet_k=1, unet_c=32, itnet_alpha_init=0.001, residual_learning=False, pretrain_lr=0.00025, pretrain_epochs=15, pretrain_patience=15, grad_clip=1.0, train_n=2400, val_n=200, seed=42, rationale=ITER-13 (v3 sentinel gate, normal QOS, strict serial, 20-min). SIX-BOX (VERIFIED via DONE.<jobid> sentinel + obs): iter-6 c32/n2400/lr2.5e-4/alpha0.0026 hr0.8768=BEST; iter-12 c32/n2400/lr5e-4 hr0.8504 (lr 2x HURT -0.026 -> lr=2.5e-4 is better, reverted). (2) FAILURE MODE: lr-up degraded the denoiser; capacity>c32 times out at n2400; data capped at 2400. Remaining cheap training knob at the c32/n2400 champion: itnet_alpha_init (the single k=1 DC-step strength), fixed at 0.0026 all along and untested. The learned alpha settled tiny (~0.0014) so the DC step is near-vestigial; a smaller alpha_init tests whether an even-milder DC step (closer to pure denoiser) helps. (3) ONE KNOB vs iter-6 (c32/n2400/lr2.5e-4): itnet_alpha_init 0.0026 -> 0.001. Hold c=32, n=2400, k=1, lr=2.5e-4, ep=15, grad_clip=1.0, seed=42. (4) HYPOTHESIS: if alpha_init 0.0026->0.001, hr rises above 0.8768 because a milder DC step corrupts the strong pretrained denoiser recon less (k=2/k=4 collapse showed DC hurts on sparse breast; smaller alpha = gentler). FALSIFIER: hr <= ~0.877 => alpha near-optimal/vestigial; iter-14 does seed replicates of the iter-6 champion for mean+/-std. (5) BUDGET: identical to iter-6 (c32/n2400, fits) -- only alpha changes. (6) STRICT one-at-a-time; rm DONE.* before dispatch; confirm via ssh cat DONE.<jobid>.
14	671da566	0.999013	0.885264	keep	architecture	itnet_v2-claude-agentic	claude-opus-4-8-1m	55.1302	5.982656e-04	1463.8	0.928098	itnet_v2-claude-agentic: itnet_k=1, unet_c=32, itnet_alpha_init=0.0004, residual_learning=False, pretrain_lr=0.00025, pretrain_epochs=15, pretrain_patience=15, grad_clip=1.0, train_n=2400, val_n=200, seed=42, rationale=ITER-14 (v3 sentinel, normal QOS, strict serial). SIX-BOX (sentinel-verified): iter-6 c32/n2400/alpha0.0026 0.8768; iter-13 c32/n2400/alpha0.001 0.8804=BEST (smaller DC-step alpha HELPED +0.0036 -- the k=1 DC step was slightly over-strong; a milder step lets the strong pretrained denoiser recon dominate, consistent with k>=2 collapse). (2) OPEN QUESTION: is alpha monotonic-better as it shrinks toward 0 (pure denoiser)? iter-13 (0.001) beat iter-6 (0.0026); test even smaller. (3) ONE KNOB vs iter-13 (c32/n2400/alpha0.001): itnet_alpha_init 0.001 -> 0.0004. Hold c=32, n=2400, k=1, lr=2.5e-4, ep=15, grad_clip=1.0, seed=42. (4) HYPOTHESIS: if alpha 0.001->0.0004, hr rises above 0.8804 because an even milder DC step corrupts the denoiser recon even less (approaching pure-denoiser). FALSIFIER: hr <= ~0.880 => alpha optimum is near 0.001 (or the DC step's tiny residual consistency has some value); then iter-15 locks alpha=0.001 champion and does seed replicates. (5) BUDGET: identical to iter-6 (c32/n2400) -- only alpha changes. (6) STRICT one-at-a-time; rm DONE.* before dispatch; confirm via ssh cat DONE.<jobid>.
15	671da566	0.998904	0.876732	keep	architecture	itnet_v2-claude-agentic	claude-opus-4-8-1m	54.5072	6.427545e-04	1488.2	0.928098	itnet_v2-claude-agentic: itnet_k=1, unet_c=32, itnet_alpha_init=0.0001, residual_learning=False, pretrain_lr=0.00025, pretrain_epochs=15, pretrain_patience=15, grad_clip=1.0, train_n=2400, val_n=200, seed=42, rationale=ITER-15 (v3 sentinel, normal QOS, strict serial). SIX-BOX (sentinel-verified): alpha trend MONOTONIC-better as it shrinks: alpha0.0026 hr0.8768(i6), alpha0.001 0.8804(i13), alpha0.0004 0.8853(i14)=BEST (+0.0049). The k=1 DC step is best VERY WEAK (approaching pure pretrained denoiser). (2) OPEN QUESTION: does hr keep rising toward alpha->0? Test one more step down. (3) ONE KNOB vs iter-14 (c32/n2400/alpha0.0004): itnet_alpha_init 0.0004 -> 0.0001. Hold c=32, n=2400, k=1, lr=2.5e-4, ep=15, grad_clip=1.0, seed=42. (4) HYPOTHESIS: if alpha 0.0004->0.0001, hr rises above 0.8853 because an even weaker DC step corrupts the strong denoiser recon even less (the learned alpha is softplus(log_alpha) so alpha_init sets the starting DC strength). FALSIFIER: hr <= ~0.885 (flat/down) => alpha optimum reached ~0.0004; iter-16 LOCKS the best-alpha champion and begins seed replicates for mean+/-std. (5) BUDGET: identical to iter-6 (c32/n2400) -- only alpha changes. (6) STRICT one-at-a-time; rm DONE.* first; confirm via ssh cat DONE.<jobid>.
16	671da566	0.998744	0.87046	keep	architecture	itnet_v2-claude-agentic	claude-opus-4-8-1m	54.0761	6.754579e-04	817.8	0.928098	itnet_v2-claude-agentic: itnet_k=1, unet_c=32, itnet_alpha_init=0.0004, residual_learning=False, pretrain_lr=0.00025, pretrain_epochs=10, pretrain_patience=10, grad_clip=1.0, train_n=2400, val_n=200, seed=43, rationale=ITER-16 champion seed replicate (seed 43), ep=10 budget-safe. Champion c32/n2400/lr2.5e-4/alpha0.0004 hr0.8853. pretrain_epochs 15->10 (epochs proven dead: iter-14 ep15==ep30, loss floors ep~6; ep10 fully converges + fits budget on slow lme222 node where ep15 TIMEOUT'd twice). Seed replicate for mean+/-std.
17	671da566	0.998881	0.875418	keep	architecture	itnet_v2-claude-agentic	claude-opus-4-8-1m	54.4151	6.496051e-04	993.1	0.928098	itnet_v2-claude-agentic: itnet_k=1, unet_c=32, itnet_alpha_init=0.0004, residual_learning=False, pretrain_lr=0.00025, pretrain_epochs=10, pretrain_patience=10, grad_clip=1.0, train_n=2400, val_n=200, seed=44, rationale=ITER-17 champion seed replicate (seed 44). Champion c32/n2400/lr2.5e-4/alpha0.0004 hr0.8853. pretrain_epochs 15->10 for BUDGET-SAFETY on slow nodes (epochs proven dead: iter-14 showed ep15==ep30, loss floors by ep~6, so ep10 fully converges the denoiser -- scientifically equivalent for seed-variance). Seed replicate for mean+/-std.
18	671da566	0.998781	0.868909	keep	architecture	itnet_v2-claude-agentic	claude-opus-4-8-1m	53.9727	6.835453e-04	987.8	0.928098	itnet_v2-claude-agentic: itnet_k=1, unet_c=32, itnet_alpha_init=0.0004, residual_learning=False, pretrain_lr=0.00025, pretrain_epochs=10, pretrain_patience=10, grad_clip=1.0, train_n=2400, val_n=200, seed=45, rationale=ITER-18 champion seed replicate (seed 45), ep=10 budget-safe. Champion c32/n2400/alpha0.0004 hr0.8853. Seed replicate for mean+/-std.
19	671da566	0.998746	0.867249	keep	architecture	itnet_v2-claude-agentic	claude-opus-4-8-1m	53.8635	6.922001e-04	816.2	0.928098	itnet_v2-claude-agentic: itnet_k=1, unet_c=32, itnet_alpha_init=0.0004, residual_learning=False, pretrain_lr=0.00025, pretrain_epochs=10, pretrain_patience=10, grad_clip=1.0, train_n=2400, val_n=200, seed=46, rationale=ITER-19 champion seed replicate (seed 46), ep=10 budget-safe. Champion c32/n2400/alpha0.0004 hr0.8853. Seed replicate for mean+/-std.
20	671da566	0.99823	0.836803	keep	architecture	itnet_v2-claude-agentic	claude-opus-4-8-1m	52.0699	8.509577e-04	993.9	0.928098	itnet_v2-claude-agentic: itnet_k=1, unet_c=32, itnet_alpha_init=0.0004, residual_learning=False, pretrain_lr=0.00025, pretrain_epochs=10, pretrain_patience=10, grad_clip=1.0, train_n=2400, val_n=200, seed=47, rationale=ITER-20 champion seed replicate (seed 47), FINAL, ep=10 budget-safe. Champion c32/n2400/alpha0.0004 hr0.8853. 5th seed replicate -> 20 valid iters + mean+/-std.
