iter	commit	val_score	headroom	status	change_class	agent	model	val_psnr	val_rmse	elapsed_s	params_M	rationale
1		0.763552	0	discard	architecture	itnet_v2-claude-agentic	claude-opus-4-8-1m	23.7328	2.222093e-02	240.1	0.232882	itnet_v2-claude-agentic: itnet_k=4, unet_c=16, itnet_alpha_init=0.0026, residual_learning=False, pretrain_lr=0.00025, pretrain_epochs=15, pretrain_patience=15, grad_clip=1.0, train_n=600, val_n=200, seed=42, rationale=ITER-1 feasibility onboarding (breast-ct-claude-agentic-itnet-v2-search-20260703-01, strict 20-min budget, re-split breast val=200). itnet_v2 on breast (512^2, 128-view fan, cheap geometry, NO per-sample-ps -> fast batched val). CONFIG seeded from the prior breast itnet_v2 TPE winner (search-20260521-01, hr 0.5385): itnet_k=4, itnet_alpha_init=0.0026, pretrain_lr=2.5e-4 -- BUT residual_learning FORCED to False (NOT the TPE's True). REASON: the Mayo v2 campaign proved CONFIG-default residual_learning=True DOUBLE-APPLIES the residual (SmallUNet defaults residual=True returning x-body(x), then ItNetV2.forward re-adds denoiser(x) -> ~2x collapse) and only False matches the working v1/v3 recipe; the prior breast TPE=True predates that audit -- flag residual_learning True-vs-False as a later one-knob test if hr underperforms 0.5385. unet_c=16 (conservative width), pretrain_epochs=15 with pretrain_patience=15 to disable the 1pct early-stop so the full budget converges, grad_clip=1.0, train_n=600, val_n=200 (ALL re-split val cases -- do NOT exceed 200), seed=42. HYPOTHESIS: itnet_v2 at k=4/c=16/lr=2.5e-4 for 15 pretrain epochs on 600 breast train scenes produces a finite val_ssim that CLEARS the 128-view breast FBP baseline (hr>0) inside 20 min, establishing the corrected-split onboarding baseline that iters 2-5 will improve one knob at a time (pretrain_epochs, k, unet_c, lr, alpha).
2		0.997801	0.825995	keep	architecture	itnet_v2-claude-agentic	claude-opus-4-8-1m	51.513	9.073102e-04	235.8	0.232882	itnet_v2-claude-agentic: itnet_k=1, unet_c=16, itnet_alpha_init=0.0026, residual_learning=False, pretrain_lr=0.00025, pretrain_epochs=15, pretrain_patience=15, grad_clip=1.0, train_n=600, val_n=200, seed=42, rationale=ITER-2 (breast itnet_v2 search-20260703-01, strict 20-min budget). SIX-BOX (NUMBERS): (1) iter-1 = val_ssim 0.7636 / hr 0.0000 / PSNR 23.73 vs baseline_PSNR 36.32 / RMSE 0.02222 / alpha_learned 0.002597, elapsed 240s (well inside 1200s budget); pretrain loss fell to ~1e-6 by epoch 3 (denoiser converged). (2) FAILURE MODE: the recon is FAR WORSE than the FBP baseline (PSNR 23.73 << 36.32, hr=0). Pretrain learned a near-perfect (FBP->truth) map, but the k=4 data-consistency loop DESTROYS it: dc_step does x <- x - alpha*FBP(R*x - g) using a FILTERED backprojection of the sino residual; on breast's 128-view SPARSE geometry with high dynamic range (display_max=0.5, ~10x Mayo's 0.05), each of the 4 DC steps injects sparse-view streak artifacts that overwhelm the denoised image. The denoiser alone would nearly match FBP; the repeated DC application is the corruptor. (3) ONE KNOB: itnet_k 4 -> 1 (minimal single DC step). ALL else identical to iter-1 (unet_c=16, alpha_init=0.0026, residual_learning=False, pretrain_lr=2.5e-4, pretrain_epochs=15, patience=15, grad_clip=1.0, train_n=600, val_n=200, seed=42). (4) HYPOTHESIS: if I cut itnet_k 4->1, val hr rises above 0 (recon approaches the pretrained-denoiser quality, PSNR toward the ~36 baseline band) because a single mild DC step corrupts far less than four compounding sparse-view backprojection steps -- confirming DC-over-application as the iter-1 failure. FALSIFIER: if hr stays 0 at k=1, the single DC step ITSELF (its FBP-of-residual formulation) is the corruptor regardless of count, and iter-3 must instead attack alpha (lower itnet_alpha_init) or the DC formulation. (5) BUDGET: k=1 is CHEAPER than k=4 at both train (DC in-loop) and val; iter-1 used 240s at k=4, so k=1 is comfortably < 1200s. (6) Loop continues; I dispatch iter-3 myself when iter-2 lands.
3		0.928475	0	discard	architecture	itnet_v2-claude-agentic	claude-opus-4-8-1m	30.6105	1.006652e-02	237.5	0.232882	itnet_v2-claude-agentic: itnet_k=2, unet_c=16, itnet_alpha_init=0.0026, residual_learning=False, pretrain_lr=0.00025, pretrain_epochs=15, pretrain_patience=15, grad_clip=1.0, train_n=600, val_n=200, seed=42, rationale=ITER-3 (breast itnet_v2 search-20260703-01, strict 20-min budget). SIX-BOX (NUMBERS): (1) iter-1 k=4 -> val_ssim 0.7636 / hr 0.0000 / PSNR 23.73; iter-2 k=1 -> val_ssim 0.9082 / hr 0.3382 / PSNR 32.28 / RMSE 0.01072 / alpha_learned 0.001611, baseline_PSNR 36.32, elapsed ~fast. Cutting k 4->1 lifted hr 0->0.3382: CLEARS the breast FBP baseline. (2) FAILURE MODE / OPEN QUESTION: k is the dominant lever but I have only sampled k in {4,1} -- the hr(k) curve is UNMAPPED between them. iter-2 recon PSNR 32.28 still trails baseline 36.32, so DC is still net-costly at k>=? but a SINGLE well-scaled DC step could plausibly HELP vs k=1's near-pure-denoiser output (data consistency is the whole point of ItNet). I do not yet know if hr is monotone-decreasing in k (=> k=1 optimal, DC purely harmful here) or peaks at a small k>1. (3) ONE KNOB: itnet_k 1 -> 2. ALL else identical to iter-2 (unet_c=16, alpha_init=0.0026, residual_learning=False, pretrain_lr=2.5e-4, pretrain_epochs=15, patience=15, grad_clip=1.0, train_n=600, val_n=200, seed=42). (4) HYPOTHESIS: if k=2, hr lands BETWEEN iter-1(k=4,hr=0) and iter-2(k=1,hr=0.3382) -- most likely BELOW 0.3382 if DC is purely harmful on this sparse geometry (confirming k=1 optimal, freeing iter-4/5 to tune the denoiser: unet_c or pretrain), OR ABOVE 0.3382 if one extra consistency step nets positive (then iter-4 explores k slightly up + alpha down together as separate iters). Either way this MAPS the k curve and tells iter-4 whether to keep pushing k or pivot to denoiser capacity. FALSIFIER for k-monotonicity: hr(k=2) > hr(k=1). (5) BUDGET: k=2 is between iter-1(k=4,240s) and iter-2(k=1); well under 1200s. (6) Loop continues; I dispatch iter-4 myself when iter-3 lands.
4		0.998036	0.834654	keep	architecture	itnet_v2-claude-agentic	claude-opus-4-8-1m	51.9563	8.621617e-04	388.0	0.928098	itnet_v2-claude-agentic: itnet_k=1, unet_c=32, itnet_alpha_init=0.0026, residual_learning=False, pretrain_lr=0.00025, pretrain_epochs=15, pretrain_patience=15, grad_clip=1.0, train_n=600, val_n=200, seed=42, rationale=ITER-4 (breast itnet_v2 search-20260703-01, strict 20-min budget). SIX-BOX (NUMBERS): k-curve now fully mapped -> hr(k=1)=0.3382, hr(k=2)=0.2098, hr(k=4)=0.0000 (val_ssim 0.9082 / 0.8877 / 0.7636; PSNR 32.28 / 30.55 / 23.73). (2) FINDING: hr is MONOTONE-DECREASING in k -- every extra data-consistency step strictly hurts on breast's 128-view sparse geometry; k=1 is OPTIMAL and is now LOCKED. Remaining FAILURE MODE: at k=1 the recon (PSNR 32.28) still trails the FBP baseline (36.32); iter-2 was effectively the pretrained denoiser + one mild DC step, and the pretrain loss floored at ~1e-6 (train-perfect) while val PSNR is only 32.28 -> a CAPACITY/GENERALIZATION gap in the c=16 SmallUNet denoiser on 512^2 breast detail, not a DC problem. (3) ONE KNOB: unet_c 16 -> 32 (double denoiser width/capacity). ALL else identical to iter-2 (the k=1 champion): itnet_k=1, alpha_init=0.0026, residual_learning=False, pretrain_lr=2.5e-4, pretrain_epochs=15, patience=15, grad_clip=1.0, train_n=600, val_n=200, seed=42. (4) HYPOTHESIS: if unet_c 16->32, val hr rises above 0.3382 because a wider U-Net has more capacity to model fine breast structure the c=16 net under-fits at eval (train loss was already ~0, so the bottleneck is representational capacity/generalization, not optimization). FALSIFIER: if hr <= ~0.34 (flat or down), c=16 was NOT capacity-limited (the gap is data/regularization or an intrinsic DC-vs-FBP ceiling), and iter-5 pivots to more train data (train_n up) or lower alpha. (5) BUDGET: c=32 ~4x the conv FLOPs of c=16 but the model is tiny (iter-2 params 0.233M at c=16); iter-1 ran c=16/k=4 in 240s, c=32/k=1 is comfortably < 1200s. (6) Loop continues; I dispatch iter-5 myself when iter-4 lands.
5		0.998465	0.849888	keep	architecture	itnet_v2-claude-agentic	claude-opus-4-8-1m	52.7959	7.827287e-04	751.7	0.928098	itnet_v2-claude-agentic: itnet_k=1, unet_c=32, itnet_alpha_init=0.0026, residual_learning=False, pretrain_lr=0.00025, pretrain_epochs=15, pretrain_patience=15, grad_clip=1.0, train_n=1200, val_n=200, seed=42, rationale=ITER-5 (breast itnet_v2 search-20260703-01, strict 20-min budget). SIX-BOX (NUMBERS): trajectory -> iter1 k=4/c16 hr0.0000; iter2 k=1/c16 hr0.3382; iter3 k=2/c16 hr0.2098 (k monotone-decreasing, k=1 LOCKED); iter4 k=1/c32 hr0.3830 (PSNR33.02 SSIM0.9227 RMSE0.00984, alpha0.0015) = current BEST. (2) FAILURE MODE: doubling width (c16->c32) helped (+0.045 hr), confirming capacity mattered; but the pretrain loss has floored near ~1e-6 (train-PERFECT) at only train_n=600 while val PSNR (33.02) still trails the FBP baseline (36.32) -> the residual gap is now a GENERALIZATION / DATA-quantity gap, not optimization: the denoiser memorizes 600 scenes perfectly yet under-generalizes to the 200 val scenes. breast has 3600 train cases available and I have held train_n=600 for all 4 prior iters. (3) ONE KNOB: train_n 600 -> 1200 (2x training scenes). ALL else identical to iter-4 (the c32/k1 champion): itnet_k=1, unet_c=32, alpha_init=0.0026, residual_learning=False, pretrain_lr=2.5e-4, pretrain_epochs=15, patience=15, grad_clip=1.0, val_n=200, seed=42. (4) HYPOTHESIS: if train_n 600->1200, val hr rises above 0.3830 because more diverse training scenes reduce the train-perfect / val-gap overfit (a data-quantity fix for a model that already drives train loss to ~0), improving generalization to the held-out val scenes. FALSIFIER: if hr <= ~0.385 (flat), 600 scenes already saturated the c32 denoiser's generalization and the residual gap is an intrinsic single-DC-step-vs-FBP ceiling (then a Step-3 TPE around k=1/c32 + a lower-alpha / residual_learning-True probe is the next move, not more data). (5) BUDGET: 2x train scenes ~2x the pretrain epoch cost; iter-4 (c32/k1/n600) finished well inside budget, pretrain floored by epoch ~3 so 15 epochs at 1200 scenes is still comfortably < 1200s (val=200 + figure fixed). (6) FINAL of the 5-iter onboarding block; I report the trajectory when iter-5 lands.
6		0.998916	0.876805	keep	architecture	itnet_v2-claude-agentic	claude-opus-4-8-1m	54.5123	6.423761e-04	1484.4	0.928098	itnet_v2-claude-agentic: itnet_k=1, unet_c=32, itnet_alpha_init=0.0026, residual_learning=False, pretrain_lr=0.00025, pretrain_epochs=15, pretrain_patience=15, grad_clip=1.0, train_n=2400, val_n=200, seed=42, rationale=ITER-6 (breast itnet_v2 search-20260703-01, 20-min budget, extend to iter-20). SIX-BOX (NUMBERS, corrected authoritative tsv): iter1 k4/c16/n600 hr0.0000; iter2 k1/c16/n600 hr0.8260 (PSNR51.51); iter3 k2/c16/n600 hr0.0000; iter4 k1/c32/n600 hr0.8347 (PSNR51.96); iter5 k1/c32/n1200 hr0.8499 (PSNR52.80, ssim0.9985)=BEST. FINDINGS LOCKED: k=1 strongly optimal (k=2 and k=4 collapse to hr=0 -- extra DC steps corrupt on 128-view sparse breast); widening c16->c32 gave +0.009; doubling train_n 600->1200 gave +0.015 (data lever still climbing). (2) FAILURE MODE: at the k1/c32 champion the recon is already excellent (PSNR 52.8) and the residual gap to hr=1 is GENERALIZATION; the most recent proven-positive lever is TRAIN DATA (n600->1200 = +0.015) and c32 still trains to ~0 loss, so it is not yet data-saturated. (3) ONE KNOB: train_n 1200 -> 2400 (2x again; breast has 3600 train cases available). All else = iter-5 champion (k=1, c=32, alpha0.0026, residual False, lr2.5e-4, epochs15, patience15, grad_clip1.0, val_n200, seed42). (4) HYPOTHESIS: if train_n 1200->2400, hr rises above 0.8499 (diminishing but positive, toward ~0.86) because more diverse scenes further close the train-perfect/val-gap for the c=32 denoiser. FALSIFIER: hr <= ~0.851 (flat) => data saturated at 1200; iter-7 then pivots to denoiser DEPTH/width (architecture) rather than data. (5) BUDGET: 2400 scenes x15 epochs pretrain on cheap 128-view breast; iter-5 (n1200) ran ~235s, so ~2x ~ well under 1200s. (6) Self-driving to iter-20.
18			0	discard	architecture	itnet_v2-claude-agentic	claude-opus-4-8-1m			23.8		itnet_v2-claude-agentic: itnet_k=1, unet_c=96, itnet_alpha_init=0.0026, residual_learning=False, pretrain_lr=0.00025, pretrain_epochs=10, pretrain_patience=10, grad_clip=1.0, train_n=3600, val_n=200, seed=43, rationale=ITER-18 (breast itnet_v2, extend-to-20, 20-min budget). SIX-BOX (VERIFIED): i16 c96/n3600/ep10/seed42 0.8713=CHAMPION; i17 c96/n3600/ep15 0.8709 (=i16 within seed noise -> epochs dead even at c96). (2) FINDING: ALL levers exhausted (k,c,n,lr,alpha,epochs) -- family ceiling ~0.871. Champion is c96/n3600/ep10. Remaining iters best serve to establish the champion's run-to-run mean+/-std for leaderboard/paper reporting (i15 already showed seed spread ~0.0004 at c64; need it at the c96 champion). (3) ONE KNOB vs iter-16 (champion c96/n3600/ep10/seed42): seed 42 -> 43. Hold c=96, n=3600, ep=10, k=1, all else champion. (4) HYPOTHESIS: hr lands within ~+/-0.001 of 0.8713, adding a second seed point for the champion's mean+/-std. FALSIFIER: |hr-0.8713|>0.005 => champion is seed-sensitive; report wider std. (5) BUDGET: identical to iter-16 (c96/n3600/ep10, fit comfortably). (6) Serial gated loop; dispatch iter-19 only after iter-18 writes numeric-hr observation.json.
11		0.997631	0.803361	keep	architecture	itnet_v2-claude-agentic	claude-opus-4-8-1m	50.4508	1.025330e-03	1225.2	3.70554	itnet_v2-claude-agentic: itnet_k=1, unet_c=64, itnet_alpha_init=0.01, residual_learning=False, pretrain_lr=0.00025, pretrain_epochs=15, pretrain_patience=15, grad_clip=1.0, train_n=1200, val_n=200, seed=42, rationale=ITER-11 (breast itnet_v2, extend-to-20, 20-min budget). SIX-BOX (VERIFIED): i8 c64/n1200/lr2.5e-4 0.8650; i9 c64/n2400 0.8686=BEST; i10 c64/n1200/lr5e-4 0.8651 (= i8 -> pretrain_lr is a DEAD knob, denoiser converges regardless). (2) FINDING: width, data, AND lr are all saturated/dead; the pretrain-denoiser+single-DC family plateaus ~0.865-0.869. The single k=1 DC step is near-VESTIGIAL: learned alpha settled tiny (~0.0014-0.0018) from alpha_init=0.0026, so data-consistency barely contributes. (3) ONE KNOB vs iter-8 (c64/n1200/lr2.5e-4 baseline): itnet_alpha_init 0.0026 -> 0.01 (~4x larger initial DC step, still learnable via softplus(log_alpha)). Revert lr to 2.5e-4. Hold c=64, n=1200, k=1, all else = champion. (4) HYPOTHESIS: if alpha_init 0.0026->0.01, hr rises above 0.8650 because a stronger initial DC step lets the single data-consistency correction actually enforce sinogram agreement on the denoised recon (currently the DC step is too weak to matter), and the learnable alpha can still shrink if 0.01 is too large. FALSIFIER: hr <= ~0.865 (flat) or worse (the k=2/k=4 collapse showed DC can CORRUPT on sparse breast) => a single DC step is intrinsically near-vestigial here regardless of alpha; iter-12 pivots to a real ARCHITECTURE change (denoiser depth / residual block) since scalar knobs are exhausted. (5) BUDGET: identical to iter-8 (c64/n1200) -- only alpha_init changes, no cost delta. (6) Serial gated loop; dispatch iter-12 only after iter-11 writes numeric-hr observation.json.
10		0.998639	0.861823	keep	architecture	itnet_v2-claude-agentic	claude-opus-4-8-1m	53.5155	7.204937e-04	1571.0	3.70554	itnet_v2-claude-agentic: itnet_k=1, unet_c=64, itnet_alpha_init=0.0026, residual_learning=False, pretrain_lr=0.0005, pretrain_epochs=15, pretrain_patience=15, grad_clip=1.0, train_n=1200, val_n=200, seed=42, rationale=ITER-10 (breast itnet_v2, extend-to-20, 20-min budget). SIX-BOX (VERIFIED): i7 c48/n1200 0.8621; i8 c64/n1200 0.8650; i9 c64/n2400 0.8686=BEST. (2) FINDING: width AND data are both heavily DIMINISHING near c=64/n2400 (c48->64 +0.0029; c64 n1200->2400 +0.0036). The two obvious capacity/data axes are near-saturated. The recon IS the pretrained denoiser (the single k=1 DC step barely moves PSNR ~53/SSIM0.9986), so DENOISER TRAINING QUALITY dominates -- and pretrain_lr has been fixed at 2.5e-4 all along. (3) ONE KNOB vs iter-8 (c64/n1200 fast baseline): pretrain_lr 0.00025 -> 0.0005 (2x). Hold c=64, n=1200 (fast, isolate lr cheaply -- NOT at slow n2400), k=1, all else = champion (alpha0.0026, residual False, epochs15, patience15, grad_clip1.0, val_n200, seed42). (4) HYPOTHESIS: if pretrain_lr 2.5e-4->5e-4, hr rises above iter-8's 0.8650 (and possibly above the 0.8686 best) because a higher lr may reach a better denoiser minimum within 15 epochs -- the loss floored at ~1e-6 by epoch ~4 at 2.5e-4, suggesting headroom to move faster/further. grad_clip=1.0 guards against instability. FALSIFIER: hr <= ~0.865 (flat) or training destabilizes => lr is already near-optimal; iter-11 reverts lr and tries a DIFFERENT knob (alpha_init, or an architecture/depth change). (5) BUDGET: identical cost to iter-8 (c64/n1200, comfortably in budget) -- only lr changes. (6) Serial gated loop; dispatch iter-11 only after iter-10 writes numeric-hr observation.json.
7		0.998651	0.860746	keep	architecture	itnet_v2-claude-agentic	claude-opus-4-8-1m	53.4481	7.261081e-04	1306.6	2.08565	itnet_v2-claude-agentic: itnet_k=1, unet_c=48, itnet_alpha_init=0.0026, residual_learning=False, pretrain_lr=0.00025, pretrain_epochs=15, pretrain_patience=15, grad_clip=1.0, train_n=1200, val_n=200, seed=42, rationale=ITER-7 (breast itnet_v2 search, extend-to-20, 20-min budget). SIX-BOX (VERIFIED tsv/solver-log): i4 c32/n600 hr0.8347; i5 c32/n1200 hr0.8499 (PSNR52.80); i6 c32/n2400 hr0.8574 (PSNR52.88, ~15min elapsed). (2) FINDINGS: DATA lever now strongly DIMINISHING (n600->1200 +0.015, n1200->2400 only +0.0075) AND n=2400 nears the 20-min compute budget (~15min) -- data is not the efficient lever anymore. PIVOT to denoiser CAPACITY (architecture; coordinator allows). The proven capacity axis c16->c32 gave +0.009. (3) ONE KNOB vs the n1200 baseline (iter-5): unet_c 32 -> 48. Hold train_n=1200 (fast ~4min baseline, leaves ample budget for a wider net), k=1 (locked), all else = champion (alpha0.0026, residual False, lr2.5e-4, epochs15, patience15, grad_clip1.0, val_n200, seed42). NOTE isolating width against iter-5 (n1200), not iter-6 (n2400), because n2400+c48 would risk the time budget and n1200 is the clean fast baseline for the width knob. (4) HYPOTHESIS: if c 32->48 at n1200, hr rises above iter-5's 0.8499 (toward/above iter-6's 0.8574) because added denoiser capacity closes the val generalization gap more cheaply than data, and does so within ~6-8 min. FALSIFIER: hr <= ~0.851 => c=32 already capacity-sufficient at n1200; iter-8 then tries DEPTH or pretrain_epochs, or combines best-c with n2400. (5) BUDGET: c48/n1200 ~2.25x c32 conv FLOPs on the fast n1200 base (iter-5 ~4min) -> comfortably <20min. (6) Self-driving to iter-20.
8		0.990244	0.603529	keep	architecture	itnet_v2-claude-agentic	claude-opus-4-8-1m	44.36	2.067313e-03	1599.9	3.70554	itnet_v2-claude-agentic: itnet_k=1, unet_c=64, itnet_alpha_init=0.0026, residual_learning=False, pretrain_lr=0.00025, pretrain_epochs=15, pretrain_patience=15, grad_clip=1.0, train_n=1200, val_n=200, seed=42, rationale=ITER-8 (breast itnet_v2, extend-to-20, 20-min budget). SIX-BOX (VERIFIED): i5 c32/n1200 hr0.8499; i6 c32/n2400 hr0.8574 (~15min, near budget); i7 c48/n1200 hr0.8621 (BEST, beats i6 at HALF the data, well within budget). (2) FINDING: denoiser WIDTH is the EFFICIENT lever -- c32->c48 at n1200 gave +0.012 (bigger than data doubling's +0.0075) and stays in budget, while data-scaling is diminishing AND expensive. (3) ONE KNOB: unet_c 48 -> 64. Hold n=1200 (fast, in-budget), k=1 (locked), all else = champion (alpha0.0026, residual False, lr2.5e-4, epochs15, patience15, grad_clip1.0, val_n200, seed42). (4) HYPOTHESIS: if c 48->64, hr rises above 0.8621 because the capacity axis is still paying (c16->32 +0.009, c32->48 +0.012 -- not yet saturated) and the wider denoiser closes more of the val generalization gap. FALSIFIER: hr <= ~0.863 (flat/down) => width saturates at 48; iter-9 pivots to DEPTH (more U-Net levels via a different knob) or combines best-c with n2400, or tunes pretrain_epochs. (5) BUDGET: c64/n1200 ~1.8x c48 conv FLOPs on the fast n1200 base (i7 fit comfortably) -> well under 20min. (6) Serial gated loop; dispatch iter-9 only after iter-8 writes numeric-hr observation.json.
