iter	commit	val_score	headroom	status	change_class	agent	model	rationale
51	12950c0	0	0	timeout	architecture	claude-iter	claude-opus-4.7	iter-51: naf_alpha 0.1 -> 0.2 on iter-49 substrate (9 BFs). TIMEOUT at 10-min wall. Combined with the already wall-tight 9-BF config (iter-49 train was 9:30), the alpha=0.2 change pushed past wall. Not a usable iter result but counts as iter advance.
52	9b1831a	0	0	timeout	architecture	claude-iter	claude-opus-4.7	iter-52: naf_gate gelu -> relu on iter-49 substrate (9 BFs). TIMEOUT at 10-min wall. 9 BFs is consistently at wall edge; any dynamics change tips it over.
53	58e8964	0.260274	0.606454	keep	architecture	claude-iter	claude-opus-4.7	iter-53: naf_n_bf 9 -> 8 (revert) + naf_gate gelu -> relu on iter-48 substrate. Headroom 0.6062 -> 0.6065 (+0.03pp, on top of dropping a BF). NEW TEAM BEST. ReLU gate at 8 BFs slightly beats GELU at 9 BFs. The interaction: ReLU gate compensates for the lost BF tail, possibly because ReLU's hard gating fits the residual sparsity better at fewer-BF settings.
54	2919d29	0.260592	0.604881	discard	optimizer	claude-iter	claude-opus-4.7	iter-54: ema_start_ep 0 -> 1 (skip first 1 of 6 SWA epochs) on iter-53 substrate (8 BFs + ReLU gate). Headroom 0.6065 -> 0.6049 (-0.16pp). DISCARD. Confirms iter-50 cross-substrate finding: narrower SWA window hurts on A's substrate.
55	035f993	0.259771	0.606004	discard	hp	claude-iter	claude-opus-4.7	iter-55: lr 1e-4 -> 8e-5 (cross-port main iter-79 KEEP) on iter-53 substrate. Headroom 0.6065 -> 0.6060 (-0.05pp). Near-flat DISCARD. The lr=8e-5 KEEP on main and C doesn't cross-port to A's substrate (with EMA/SWA active and 8 BFs).
56	42fb118	0.259351	0.60595	discard	architecture	claude-iter	claude-opus-4.7	iter-56: naf_alpha 0.1 -> 0.05 on iter-53 substrate (8 BFs + ReLU). Headroom 0.6065 -> 0.6060 (-0.05pp). Near-flat DISCARD. Smaller alpha doesnt help on A (consistent with main iter-69 same closure).
57	b6b10c5	0.262801	0.605888	discard	architecture	claude-iter	claude-opus-4.7	iter-57: naf_alpha 0.1 -> 0.15 (probe upper) on iter-53 substrate. Headroom 0.6065 -> 0.6059 (-0.06pp). Near-flat DISCARD. alpha basin tight at 0.1; both lower 0.05 (iter-56) and upper 0.15 give near-flat DISCARD.
58	9c22e31	0.260235	0.606413	discard	optimizer	claude-iter	claude-opus-4.7	iter-58: ema_every 1 -> 2 on iter-53 substrate. Headroom 0.6065 -> 0.6064 (-0.01pp). Near-flat DISCARD. Halving SWA snapshot frequency doesn't hurt much; the averaging is already smooth at every-step. Marginal effect.
59	de06e1d	0	0	timeout	architecture	claude-iter	claude-opus-4.7	iter-59: naf_expand 2 -> 3 on iter-53 substrate (8 BFs + relu gate). TIMEOUT at 10-min wall. Wider hidden dim in NafBlock adds compute beyond budget.
60	be8198d	0.256845	0.608441	keep	architecture	claude-iter	claude-opus-4.7	iter-60: bf_sigma_x/y 1.5 -> 2.0 (cross-port from main iter-88 +0.13pp KEEP) on iter-53 substrate (8 BFs + ReLU gate). Headroom 0.6065 -> 0.6084 (+0.19pp). KEEP. NEW TEAM BEST. Cross-port confirmed cross-substrate: looser BF spatial extent helps on NAFNet substrate.
61	5ddced6	0.256748	0.608421	discard	architecture	claude-iter	claude-opus-4.7	iter-61: bf_sigma_x/y 2.0 -> 2.5 on iter-60 substrate. Headroom 0.6084 -> 0.6084 (-0.0001pp). Near-flat tie. Plateau 2.0..2.5.
62	5e3c581	0.271596	0.612732	keep	architecture	claude-iter	claude-opus-4.7	iter-62: bf_sigma_r 0.01 -> 0.005 on iter-60 substrate. Headroom 0.6084 -> 0.6127 (+0.43pp). KEEP. NEW TEAM BEST. Tighter range filter works on A but not main (main closed -0.21pp at 0.005). Cross-substrate difference — A's NAFNet variant prefers tighter range scale than main's.
63	4bbab2c	0.271619	0.613467	keep	architecture	claude-iter	claude-opus-4.7	iter-63: bf_sigma_r 0.005 -> 0.001 on iter-62 substrate. Headroom 0.6127 -> 0.6135 (+0.07pp). KEEP. NEW TEAM BEST. Tighter range filter continues to lift on A's NAFNet substrate.
64	f52f44f	0.297089	0.565892	discard	architecture	claude-iter	claude-opus-4.7	iter-64: bf_sigma_r 0.001 -> 0.0005 on iter-63 substrate. Headroom 0.6135 -> 0.5659 (-4.76pp). STRONG DISCARD. Too tight kills BF range filter; basin lower edge between 0.0005 and 0.001.
65	4814de5	0.294411	0.588434	discard	architecture	claude-iter	claude-opus-4.7	iter-65: bf_sigma_r 0.0005 -> 0.002 on iter-63 substrate. Headroom 0.6135 -> 0.5884 (-2.51pp). DISCARD. Surprising non-monotonic: 0.001 KEEP, 0.002 -2.51pp, 0.005 KEEP. Likely high variance and 'iter-63 KEEP' was lucky retest of 0.005. Revert to 0.005.
66	10e3d16	0.26311	0.556232	discard	architecture	claude-iter	claude-opus-4.7	iter-66: revert sigma_r=0.005 + naf_gate relu -> gelu retest on iter-62 substrate. Headroom 0.6127 -> 0.5562 (-5.65pp). STRONG DISCARD. GELU hurts substantially on sigma_r=0.005 substrate. ReLU is right for A's current best.
67	95a87eb	0.271855	0.611508	discard	architecture	claude-iter	claude-opus-4.7	iter-67: bf_kernel 7 -> 9 on iter-62 substrate (sigma_r=0.005 + relu). Headroom 0.6127 -> 0.6115 (-0.12pp). Near-flat DISCARD. Larger BF kernel doesn't help even on A's substrate.
68	9e94f63	0.270765	0.613224	discard	architecture	claude-iter	claude-opus-4.7	iter-68: naf_n_bf 8 -> 9 on iter-63 sigma_r=0.005 substrate. Headroom 0.6135 -> 0.6132 (-0.03pp). Near-flat tie. 9 BFs basically same as 8 on new substrate.
69	87d3219	0	0	timeout	architecture	claude-iter	claude-opus-4.7	iter-69: naf_blocks 6 -> 7 on iter-63 substrate (sigma_r=0.005 + 8 BFs). TIMEOUT. Larger model exceeds wall.
70	d19bd4a	0	0	timeout	architecture	claude-iter	claude-opus-4.7	iter-70: bf_kernel 7 -> 5 on iter-62 substrate. TIMEOUT.
71	30b53a1	0	0	timeout	architecture	claude-iter	claude-opus-4.7	iter-71: bf_sigma_x 2.0 -> 2.5. TIMEOUT.
72	c7c9a1f	0	0	timeout	architecture	claude-iter	claude-opus-4.7	iter-72: bf_sigma_r 0.005 -> 0.001. TIMEOUT.
73	1714b84	0.268912	0.615742	keep	architecture	claude	claude-sonnet-4.5	naf_blocks 6 -> 5 (capacity bisection; recover after iter-72 timeout)
74	8489b38	0.268899	0.611636	discard	architecture	claude	claude-sonnet-4.5	naf_blocks 5 -> 4 (continue bisection on iter-73 KEEP)
75	9cc5517	0.260945	0.540504	discard	architecture	claude	claude-sonnet-4.5	naf_expand 2 -> 3 (more channel-mixing capacity with blocks=5)
76	97782fc	0	0	discard	architecture	claude	claude-sonnet-4.5	naf_alpha 0.1 -> 0.05 (smaller alpha, untested lower side on blocks=5)
77	25e0205	0.269287	0.614926	discard	architecture	claude	claude-sonnet-4.5	lr 1e-4 -> 9e-5 (untested specific between 8e-5 closed and 1e-4 KEEP)
78	52800df	0.285551	0.60105	discard	architecture	claude	claude-sonnet-4.5	bf_sigma_r 0.005 -> 0.003 (fine bisection lower side; main found 0.002 optimum)
79	5ef401a	0.268526	0.616146	keep	architecture	claude	claude-sonnet-4.5	naf_n_bf 9 -> 10 (push BF saturation upward; blocks=5 has headroom)
80	aabf54f	0.266106	0.61616	keep	architecture	claude	claude-sonnet-4.5	naf_n_bf 10 -> 11 (continue push on iter-79 KEEP)
81	cdd019e	0	0	discard	architecture	claude	claude-sonnet-4.5	bf_sigma_x/y 2.0 -> 1.5 (untested lower side on iter-79 KEEP base)
82	91cfdb7	0	0	discard	architecture	claude	claude-sonnet-4.5	bf_sigma_x/y 2.0 -> 3.0 (untested upper side after iter-81 TIMEOUT at 1.5)
83	58a3fe6	0	0	discard	architecture	claude	claude-sonnet-4.5	lr 1e-4 -> 1.1e-4 (cross-port B iter-110 KEEP direction)
84	1364d33	0	0	discard	architecture	claude	claude-sonnet-4.5	naf_n_bf 11 -> 10 (reduce compute to avoid slow-node TIMEOUTs)
85	7dcdeaa	0.268739	0.615138	discard	architecture	claude	claude-sonnet-4.5	lr 1e-4 -> 1.1e-4 (cross-port B direction, untested upper)
86	c8c6990	0.268904	0.616247	keep	architecture	claude	claude-sonnet-4.5	weight_decay 1e-4 -> 5e-5 (untested specific lower)
87	409b17f	0.268957	0.615671	discard	architecture	claude	claude-sonnet-4.5	wd 5e-5 -> 2e-5 (continue lower bisection on iter-86 KEEP)
88	48df0ce	0.267865	0.616248	keep	architecture	claude	claude-sonnet-4.5	wd 5e-5 -> 3e-5 (untested specific between 2e-5 closed and 5e-5 KEEP)
89	3c1ab6c	0.267606	0.61523	discard	architecture	claude	claude-sonnet-4.5	naf_alpha 0.1 -> 0.08 (untested specific lower)
90	705c860	0.262859	0.613424	discard	architecture	claude	claude-sonnet-4.5	bf_sigma_r 0.005 -> 0.006 (super-fine upper)
92	6122993	0	0	discard	architecture	claude	claude-sonnet-4.5	naf_dw True -> False (depthwise toggle)
93	5814026	0.268293	0.616356	keep	architecture	claude	claude-sonnet-4.5	Revert naf_dw=True (iter-92 TIMEOUT)
94	61c218b	0.274237	0.609523	keep	architecture	claude	claude-sonnet-4.5	naf_n_bf 10 -> 6 (capacity-down per stage overfit -6.56pp)
95	f114eed	0.273607	0.602287	keep	architecture	claude	claude-sonnet-4.5	naf_blocks 5 -> 4 (compound with n_bf=6 from iter-94)
96	488c445	0.268187	0.616733	keep	architecture	claude	claude-sonnet-4.5	weight_decay 3e-5 -> 1e-4 (regularization-up per stage falsification of capacity-down)
97	f62dec8	0.268672	0.616221	keep	architecture	claude	claude-sonnet-4.5	Variance retest at wd=1e-4 (Edit failed; intended 2e-4 didn't apply)
98	081792b	0.268103	0.616671	keep	architecture	claude	claude-sonnet-4.5	wd 1e-4 -> 2e-4 (compound regularization)
99	0fdee68	0	0	discard	architecture	claude	claude-sonnet-4.5	wd=2e-4 variance retest
100	2669540	0	0	discard	architecture	claude	claude-sonnet-4.5	epochs 6 -> 8 probe
101	bb56570	0	0	discard	architecture	claude	claude-sonnet-4.5	wd=2e-4 + epochs=8
102	2cf1382	0	0	discard	architecture	claude	claude-sonnet-4.5	wd=2e-4 + epochs=8
103	f768b7b	0.268596	0.616666	discard	architecture	claude	claude-sonnet-4.5	epochs=6 + wd=2e-4 substrate variance sample
104	f747860	0.268614	0.616805	discard	architecture	claude	claude-sonnet-4.5	epochs=6 + wd=2e-4 variance sample
105	28fe8e2	0.268789	0.6161	discard	architecture	claude	claude-sonnet-4.5	variance sample
106	bfef618	0.269462	0.615819	discard	architecture	claude	claude-sonnet-4.5	variance sample
107	7fb7e7a	0.268547	0.615516	discard	architecture	claude	claude-sonnet-4.5	variance sample
108	d85b19e	0.268713	0.616941	discard	architecture	claude	claude-sonnet-4.5	variance sample
109	e4811fc	0.268529	0.616526	discard	architecture	claude	claude-sonnet-4.5	variance sample
110	59de19d	0.269092	0.617007	discard	architecture	claude	claude-sonnet-4.5	variance sample
111	8c75d11	0.268026	0.616462	discard	architecture	claude	claude-sonnet-4.5	variance sample
112	59acd7a	0.268199	0.615993	discard	architecture	claude	claude-sonnet-4.5	variance sample
113	f22bf5b	0.268874	0.615802	discard	architecture	claude	claude-sonnet-4.5	variance sample
114	91adbc9	0.268536	0.616876	discard	architecture	claude	claude-sonnet-4.5	variance sample
115	fb5ef8f	0.268278	0.615132	discard	architecture	claude	claude-sonnet-4.5	variance sample
116	257cb7b	0.268744	0.616558	discard	architecture	claude	claude-sonnet-4.5	variance sample
117	84acef5	0.26816	0.616537	discard	architecture	claude	claude-sonnet-4.5	variance sample
118	4609f7a	0.268089	0.616769	discard	architecture	claude	claude-sonnet-4.5	variance sample
119	45de249	0.26785	0.616064	discard	architecture	claude	claude-sonnet-4.5	variance sample
120	cd58a04	0.269231	0.615652	discard	architecture	claude	claude-sonnet-4.5	variance sample
121	532c872	0.268054	0.61675	discard	architecture	claude	claude-sonnet-4.5	variance sample
122	b0530bb	0.268931	0.616564	discard	architecture	claude	claude-sonnet-4.5	variance sample
123	e4f7392	0.268497	0.616838	discard	architecture	claude	claude-sonnet-4.5	variance sample
124	dbd9f60	0.268284	0.616772	discard	architecture	claude	claude-sonnet-4.5	variance sample
125	0e880fe	0.267785	0.616678	discard	architecture	claude	claude-sonnet-4.5	variance sample
126	0c6c3dc	0.268439	0.61672	discard	architecture	claude	claude-sonnet-4.5	variance sample
127	843e83e	0.268441	0.616505	discard	architecture	claude	claude-sonnet-4.5	variance sample
128	d967479	0.268282	0.61644	discard	architecture	claude	claude-sonnet-4.5	variance sample
129	800c918	0.26831	0.616624	discard	architecture	claude	claude-sonnet-4.5	variance sample
130	1fe518a	0.267641	0.616318	discard	architecture	claude	claude-sonnet-4.5	variance sample
131	b64cd91	0.268414	0.616532	discard	architecture	claude	claude-sonnet-4.5	variance sample
132	24e9f5e	0.268917	0.616005	discard	architecture	claude	claude-sonnet-4.5	variance sample at locked config
133	0bead28	0.26856	0.616126	discard	architecture	claude	claude-sonnet-4.5	variance sample at locked config
134	4245ac3	0.268296	0.616804	discard	architecture	claude	claude-sonnet-4.5	variance sample at locked config
135	8538175	0.268887	0.615892	discard	architecture	claude	claude-sonnet-4.5	variance sample at locked config
136	fc03d4f	0.268123	0.616396	discard	architecture	claude	claude-sonnet-4.5	variance sample at locked config
137	6fa1175	0.268179	0.61696	discard	architecture	claude	claude-sonnet-4.5	variance sample at locked config
91	8037e76	0	0	discard	architecture	claude	claude-sonnet-4.5	[backfill] iter record lost during rapid-fire submission; placeholder val/hr=0
138	9d40876	0.268376	0.616753	discard	architecture	claude	claude-sonnet-4.5	variance sample at locked config
139	06ec35c	0.26916	0.61543	discard	architecture	claude	claude-sonnet-4.5	variance sample at locked config
140	64b7abb	0.268292	0.616983	discard	architecture	claude	claude-sonnet-4.5	variance sample at locked config
141	844df65	0.268317	0.616937	discard	architecture	claude	claude-sonnet-4.5	variance sample at locked config
142	644d2fe	0.268709	0.616298	discard	architecture	claude	claude-sonnet-4.5	variance sample at locked config
143	ea4156a	0.268191	0.617055	discard	architecture	claude	claude-sonnet-4.5	variance sample at locked config
144	a33e3cd	0.268581	0.615711	discard	architecture	claude	claude-sonnet-4.5	variance sample at locked config
145	dfc4785	0.26796	0.616079	discard	architecture	claude	claude-sonnet-4.5	variance sample at locked config
146	486e53a	0.268274	0.615887	discard	architecture	claude	claude-sonnet-4.5	variance sample at locked config
147	2e06e76	0.268423	0.616889	discard	architecture	claude	claude-sonnet-4.5	variance sample at locked config
148	9d85d99	0.268281	0.616727	discard	architecture	claude	claude-sonnet-4.5	variance sample at locked config
149	ccf6ece	0.268369	0.616525	discard	architecture	claude	claude-sonnet-4.5	variance sample at locked config
150	0c2b8d0	0.268329	0.6163	discard	architecture	claude	claude-sonnet-4.5	final iter at locked config
