iter	commit	val_score	headroom	status	change_class	agent	model	val_psnr	val_rmse	elapsed_s	params_M	rationale
11	671da566	0.973086	0.434474	keep	architecture	param_efficient-claude-agentic	claude-opus-4-8-1m	41.2751	2.948813e-03	1230.8	1.3e-05	param_efficient-claude-agentic: reg_type=bilateral, bilateral_on_top=False, proj_filter_on=False, n_iter=30, learnable_alpha=True, alpha_init=0.1, foe_n_filters=24, foe_kernel=7, foe_n_bumps=31, n_bf=3, bf_multiscale=True, bf_sigmas=[0.8, 1.6, 3.2], bf_kernel=7, bf_sigma_r=0.02, bf_gain_init=0.0, epochs=16, cosine_lr=True, lr=0.005, max_train_s=1080, batch_size=4, train_n=200, val_n=200, display_min=0.0, display_max=0.05, seed=42, rationale=iter-11 param_efficient breast -- FILTERED-DC DEPTH SWEEP to saturation. SIX-BOX: (1) PRIOR: filtered-DC depth is MONOTONIC: K10 hr 0.3352 (16 epochs) -> K20 hr 0.3774 (only 9 epochs, wall-cut). So depth climbed +0.042 DESPITE fewer epochs -- depth's benefit OUTWEIGHS the undertraining cost. 13 params throughout. (2) FAILURE MODE: none yet; find where filtered-DC depth saturates vs the epochs-vs-wall tradeoff (K20 already down to 9 epochs; K30 will be ~6). (3) ONE KNOB: n_iter 20 -> 30. Still 13 params (weight-tied). All else byte-for-byte iter-10. (4) HYPOTHESIS: if filtered depth still dominates, K=30 climbs past 0.377 even at ~6 epochs -> keep pushing; if it FLATTENS or DROPS, K~20-30 is the practical saturation under the 1080s wall and the next lever is STACKING capacity (FoE / streak-reg) on the best-K filtered-DC unroll, NOT more depth. Either outcome maps the frontier. (5) BUDGET: K=30 filtered (1 fbp/step), train_n=200, 1080s backstop + 200-val -> <20min (backstop guarantees). (6) SERIAL; iter-12 self-dispatches (next: if saturated, re-fix best-K and STACK FoE capacity on the filtered-DC unroll -- reg_type foe + bilateral_on_top -- to climb toward VN 0.63 at minimal added params)., dc_mode=filtered, per_step_alpha=False
12	671da566	0.968927	0.367801	keep	architecture	param_efficient-claude-agentic	claude-opus-4-8-1m	40.3071	3.296466e-03	2670.7	1.3e-05	param_efficient-claude-agentic: reg_type=bilateral, bilateral_on_top=False, proj_filter_on=False, n_iter=40, learnable_alpha=True, alpha_init=0.1, foe_n_filters=24, foe_kernel=7, foe_n_bumps=31, n_bf=3, bf_multiscale=True, bf_sigmas=[0.8, 1.6, 3.2], bf_kernel=7, bf_sigma_r=0.02, bf_gain_init=0.0, epochs=16, cosine_lr=True, lr=0.005, max_train_s=2400, batch_size=4, train_n=200, val_n=200, display_min=0.0, display_max=0.05, seed=42, rationale=iter-12 param_efficient breast -- DEEP-K FRONTIER PROBE (decouple depth from undertraining). SIX-BOX: (1) PRIOR: filtered-DC depth is STILL climbing, NOT saturated: K10 0.3352(16ep) -> K20 0.3774(9ep) -> K30 0.4345(6ep), 13 params throughout. But the 1080s wall now cuts K30 at only 6 epochs, so the epochs-vs-wall confound is SEVERE -- each deeper K trains LESS, muddying whether hr would be even higher if trained fully. (2) FAILURE MODE: undertraining masks the true deep-K hr. (3) ONE KNOB (intent = depth at FULL training): n_iter 30->40 AND max_train_s 1080->2400 so the run reaches all 16 epochs -- this DECOUPLES depth from the wall confound. Coordinator explicitly authorized a higher --time for the deep-K frontier probes (this is the finale, not a routine search iter). sbatch --time raised to 00:50:00 to match. Still 13 params. (4) HYPOTHESIS: at K=40 trained to FULL 16 epochs, hr climbs clearly past K30's 0.4345 -- and this run also tells me the TRUE achievable hr of the filtered-DC compact when NOT undertrained, so I can then re-baseline the K-sweep. If K=40-fully-trained only matches K30-undertrained, depth has saturated ~K30 and the next lever is STACKING capacity. (5) BUDGET: DELIBERATE EXCEPTION -- K=40 x 16 epochs, max_train_s=2400 (~40min train) + 200-val, sbatch --time=00:50:00. Justified: frontier finale, decouples the depth signal. (6) SERIAL; iter-13 self-dispatches (next: re-fix the epochs-normalised best-K, then STACK FoE capacity + directional streak-reg on the filtered-DC unroll toward VN 0.63)., dc_mode=filtered, per_step_alpha=False
13	671da566	0.961807	0	discard	architecture	param_efficient-claude-agentic	claude-opus-4-8-1m	34.2863	6.593113e-03	1437.0	0.000301	param_efficient-claude-agentic: reg_type=foe, bilateral_on_top=True, proj_filter_on=False, n_iter=30, learnable_alpha=True, alpha_init=0.1, foe_n_filters=8, foe_kernel=5, foe_n_bumps=11, n_bf=3, bf_multiscale=True, bf_sigmas=[0.8, 1.6, 3.2], bf_kernel=7, bf_sigma_r=0.02, bf_gain_init=0.0, epochs=16, cosine_lr=True, lr=0.005, max_train_s=1080, batch_size=4, train_n=200, val_n=200, display_min=0.0, display_max=0.05, seed=42, rationale=iter-13 param_efficient breast -- CAPACITY-STACK #1: small FoE prox on the filtered-DC K=30 unroll (20-min budget). SIX-BOX: (1) PRIOR: filtered-DC (fbp(Rx-g)) is the sparse-view lever; 20-min K-sweep saturated at K=30 -> hr 0.4345 @ 13 params (CHAMPION). iter-12 diagnostic (K=40, 50-min, 10ep) gave only 0.368 -- CONFIRMS depth saturated ~K30 (alpha collapsed to 0.006). So depth is done; the climb toward VN 0.63 now needs CAPACITY. (2) FAILURE MODE: the 13-param bilateral gate lacks the learned-filter capacity VN uses to reach 0.63; it can preserve edges but not learn rich streak-removing priors. (3) ONE KNOB: reg_type bilateral->foe with bilateral_on_top=True at a SMALL FoE geometry (nf8/k5/nb11 = 300 reg params; total ~312 with alpha). All else byte-for-byte iter-11 (filtered-DC K=30, 20-min wall). FoE zero-init RBF => FoE(x)=0 at init AND bilateral gains zero-init => pipeline == the 0.4345 champion BYTE-FOR-BYTE at init (worst case == 0.4345, NO regression). (4) HYPOTHESIS: a small learned FoE filter bank (the mechanism that gets VN to 0.63) added to the filtered-DC unroll gives the prox genuine streak-removing capacity -> hr climbs past 0.4345 toward the VN regime, at ~312 params (still ~30x fewer than VN's 9k). Kept SMALL (300p) so it trains within the ~6 epochs K=30 allows in 20 min. (5) BUDGET: K=30 filtered + small FoE (nf8/k5 is CHEAP per step), train_n=200, max_train_s=1080, --time=00:30:00, 200-val -> 20-min budget, comparable to all solvers. (6) SERIAL; iter-14 self-dispatches (next: if FoE capacity helps, GROW nf/nb along the params-vs-hr frontier; if not, directional streak-reg instead)., dc_mode=filtered, per_step_alpha=False, foe_rbf_init_std=0.0
14	671da566	0.827063	0	discard	architecture	param_efficient-claude-agentic	claude-opus-4-8-1m	24.6091	2.008861e-02	1268.3	1.6e-05	param_efficient-claude-agentic: reg_type=bilateral, bilateral_on_top=False, proj_filter_on=False, n_iter=30, learnable_alpha=True, alpha_init=0.1, foe_n_filters=24, foe_kernel=7, foe_n_bumps=31, n_bf=3, bf_multiscale=True, bf_sigmas=[0.8, 1.6, 3.2], bf_kernel=7, bf_sigma_r=0.02, bf_gain_init=0.0, epochs=16, cosine_lr=True, lr=0.005, max_train_s=1080, batch_size=4, train_n=200, val_n=200, display_min=0.0, display_max=0.05, seed=42, rationale=iter-14 param_efficient breast -- CAPACITY-STACK #2: DIRECTIONAL STREAK REG on the lean filtered-DC unroll (solver edit, 20-min budget). SIX-BOX: (1) PRIOR: iter-13 (+300-param FoE prox) gave hr 0.0 -- PSNR 34.3 < baseline. NOT undertrained (loss converged 3.8e-3->4.4e-5 by ep5, gains engaged ~0.28). READ: a learned FoE ISOTROPIC smoother FIGHTS filtered-DC -- fbp(Rx-g) already produces a complete ramp-filtered reconstruction each step, so an added smoothing prior just OVER-SMOOTHS the recon the DC just made (the FoE solves the streak-smearing problem filtered-DC ALREADY solved -> pure drag). So on filtered-DC, isotropic prox capacity is a LIABILITY. (2) FAILURE MODE (iter-13): isotropic prox over-smooths the filtered-DC reconstruction. (3) ONE KNOB: add a DIRECTIONAL (oriented) streak reg on the LEAN bilateral path (I edited build_reg to compose ComposedBilateralAnisotropicReg -- bilateral gate + AnisotropicOrientedReg, NO FoE). +3 params (2 sigma along/across + 1 zero-init gain over 4 fixed orientations) -> 16 total. Zero-init gain => reg==bilateral==champion BYTE-FOR-BYTE at init (worst case == 0.4345, no regression). (4) HYPOTHESIS: unlike the isotropic FoE, the oriented reg smooths ALONG residual streak directions while PRESERVING across them, so it removes the specific directional streaks filtered-DC leaves WITHOUT the isotropic over-smoothing that killed iter-13 -> hr climbs past 0.4345. This is the sparse-view-NATIVE prox form (streaks are directional). (5) BUDGET: K=30 filtered + lean bilat + aniso (analytic oriented kernels, cheap), train_n=200, max_train_s=1080, --time=00:30:00, 200-val -> 20-min comparable. (6) SERIAL; iter-15 self-dispatches (next: if directional helps, tune orientations/sigmas; if not, LPD dual-update block or accept 0.4345 @ 13p as the honest ceiling)., dc_mode=filtered, per_step_alpha=False, anisotropic_on_top=True, aniso_n_orient=4, aniso_kernel=7, aniso_sigma_along=2.0, aniso_sigma_across=0.6, aniso_gain_init=0.0
15	671da566	0.972651	0.504677	keep	architecture	param_efficient-claude-agentic	claude-opus-4-8-1m	42.4264	2.582754e-03	1079.0	0.000183	param_efficient-claude-agentic: reg_type=bilateral, bilateral_on_top=False, proj_filter_on=False, n_iter=30, learnable_alpha=True, alpha_init=0.1, foe_n_filters=24, foe_kernel=7, foe_n_bumps=31, n_bf=1, bf_multiscale=True, bf_sigmas=[0.8, 1.6, 3.2], bf_kernel=7, bf_sigma_r=0.02, bf_gain_init=0.0, epochs=16, cosine_lr=True, lr=0.005, max_train_s=1080, batch_size=4, train_n=200, val_n=200, display_min=0.0, display_max=0.05, seed=42, rationale=iter-15 param_efficient breast -- LPD-STYLE LEARNED DUAL/COMBINATION block (last distinct arch lever, solver edit, 20-min budget). SIX-BOX: (1) PRIOR: filtered-DC K=30 = 20-min CHAMPION 0.4345 @ 13p. Added PROX capacity does NOT help it: iter-13 (isotropic FoE +300p) hr 0.0, iter-14 (directional aniso +3p) hr 0.0 -- both FIGHT the filtered gradient because fbp(Rx-g) already does the reconstruction, leaving nothing for a prox to add. So the remaining lever is not a better PROX but a better way to COMBINE the DC correction across steps -- LPD's mechanism (0.68 on breast). (2) FAILURE MODE: the fixed x<-x-alpha*fbp(resid) update applies the SAME correction rule every step; it cannot learn to weight/route the correction using image context or cross-step memory. (3) ONE KNOB (architectural): lpd_on=True -- I added a minimal LPDCombine block: a weight-tied 2-layer 3x3 conv g(x, fbp_dc, mem)->update (3->W=4->1, 149 params) with a 1-ch primal MEMORY carried across the 30 steps; final layer ZERO-INIT => update==0 at init => x stays at the FBP init (safe seed, already clears baseline). per_step_alpha=True (the K alphas now scale the LEARNED update per step -- a real role, not the collapsed scalars of iter-7). Total ~= 149 (conv) + 30 (per-step alpha) + 12 (bilateral, UNUSED in LPD path) ~= 190 trainable. (4) HYPOTHESIS: a tiny learned operator that COMBINES the filtered-DC correction with image context + cross-step memory (LPD's mechanism) breaks past 0.4345 toward the LPD/VN regime, because it learns HOW to apply consistency (route/attenuate per-pixel + accumulate) rather than a fixed step -- the capacity that helps DC, unlike a prox smoother. (5) BUDGET: K=30 filtered + 1 tiny conv/step + 1 fbp/step, train_n=200, max_train_s=1080, --time=00:30:00, 200-val -> 20-min comparable. (6) SERIAL; iter-16: if LPD beats 0.4345, grow W / tune; if not, 0.4345 @ 13p is the honest comparable champion -> CONSOLIDATE the final report (Pareto + filtered-vs-adjoint-DC + capacity-doesnt-help-filtered-DC findings)., dc_mode=filtered, per_step_alpha=True, lpd_on=True, lpd_width=4, lpd_kernel=3, anisotropic_on_top=False
16	671da566	0.973426	0.47543	keep	architecture	param_efficient-claude-agentic	claude-opus-4-8-1m	41.9281	2.735259e-03	1098.1	0.000331	param_efficient-claude-agentic: reg_type=bilateral, bilateral_on_top=False, proj_filter_on=False, n_iter=30, learnable_alpha=True, alpha_init=0.1, foe_n_filters=24, foe_kernel=7, foe_n_bumps=31, n_bf=1, bf_multiscale=True, bf_sigmas=[0.8, 1.6, 3.2], bf_kernel=7, bf_sigma_r=0.02, bf_gain_init=0.0, epochs=16, cosine_lr=True, lr=0.005, max_train_s=1080, batch_size=4, train_n=200, val_n=200, display_min=0.0, display_max=0.05, seed=42, rationale=iter-16 param_efficient breast -- GROW the LPD combination block (W 4->8). SIX-BOX: (1) PRIOR: iter-15 BREAKTHROUGH -- LPDCombine (tied conv g(x,fbp_dc,mem)->update, W=4, 183 params) hit hr 0.5047 (PSNR 42.43), beating filtered-DC's 0.4345. Ran FULL 16 epochs, loss converged 6.6e-6, per-step alpha ~0.099. Confirms: LEARNING to combine/accumulate the DC correction is the capacity that HELPS DC (unlike a prox, which fought it in iters 13-14). This is the winning direction. (2) FAILURE MODE: none at iter-15; W=4 (4 hidden channels) may bottleneck the learned-combination operator's capacity. (3) ONE KNOB: lpd_width 4 -> 8 (double the conv hidden channels). W=8 conv = 3*8*9+8 + 8*9+1 = 297 params + 30 per-step alpha + 4 unused bilat = ~331 total. All else byte-for-byte iter-15. (4) HYPOTHESIS: more channels in the learned-combination operator give it richer capacity to ROUTE/ATTENUATE the filtered-DC correction per-pixel and ACCUMULATE across the 30 steps -> hr climbs past 0.5047 toward VN 0.63, at ~331 params (still ~27x fewer than VN's 9k, ~750x fewer than LPD's 0.25M). (5) BUDGET: W=8 conv is still tiny (1 conv/step); iter-15 W=4 finished 16ep in 1020s, W=8 ~similar -> fits 16ep in the 1080s wall; train_n=200, --time=00:30:00, 200-val -> 20-min comparable. (6) SERIAL; iter-17: if W=8 helps, keep growing W or add a sinogram-space dual term; map the LPD params-vs-hr frontier., dc_mode=filtered, per_step_alpha=True, lpd_on=True, lpd_width=8, lpd_kernel=3, anisotropic_on_top=False
17	671da566	0.967096	0.352345	keep	architecture	param_efficient-claude-agentic	claude-opus-4-8-1m	40.0973	3.377057e-03	1155.7	0.000296	param_efficient-claude-agentic: reg_type=bilateral, bilateral_on_top=False, proj_filter_on=False, n_iter=30, learnable_alpha=True, alpha_init=0.1, foe_n_filters=24, foe_kernel=7, foe_n_bumps=31, n_bf=1, bf_multiscale=True, bf_sigmas=[0.8, 1.6, 3.2], bf_kernel=7, bf_sigma_r=0.02, bf_gain_init=0.0, epochs=16, cosine_lr=True, lr=0.005, max_train_s=1080, batch_size=4, train_n=200, val_n=200, display_min=0.0, display_max=0.05, seed=42, rationale=iter-17 param_efficient breast -- ADD SINOGRAM-SPACE DUAL term (true primal-dual, last distinct lever). SIX-BOX: (1) PRIOR: LPD learned-combination W=4 = 0.5047 @ 183p CHAMPION; W=8 (iter-16) REGRESSED to 0.4754 -> conv width saturated at W=4. The image-space LPD-combine learns the PRIMAL update but has NO dual half -- it back-projects the RAW residual (Rx-g). LPD's 0.68 uses BOTH a primal AND a learned DUAL operating in measurement space. (2) FAILURE MODE: pure image-space combination can't learn to precondition/route the residual in SINOGRAM space where sparse-view inconsistency lives. (3) ONE KNOB (architectural): lpd_dual=True -- I added a minimal DualUpdate block: a tied 2-layer 3x3 conv f(resid,h_dual)->h_dual (2->Wd=4->1, 113 params) with a persistent SINOGRAM-space dual memory h, applied to resid=Rx-g BEFORE the filtered back-projection (dc=fbp(h) uses the LEARNED dual residual). Final layer zero-init => h==resid at init => dc==fbp(resid)==iter-15 BYTE-FOR-BYTE (worst case == 0.5047, no regression). Total ~= 149(primal) + 113(dual) + 30(alpha) + 4(unused) ~= 296 params. (4) HYPOTHESIS: a learned dual that preconditions the residual in measurement space (the true primal-dual structure) lets the unroll route sparse-view inconsistency where it lives -> hr climbs past 0.5047 toward VN 0.63 / LPD 0.68, at ~296 params. (5) BUDGET: +1 tiny sinogram conv/step (sinogram is A*D ~ 128*736, similar cost to the image conv); iter-15 finished 16ep in 1020s -> expect ~14-16ep in the 1080s wall; train_n=200, --time=00:30:00, 200-val -> 20-min comparable. (6) SERIAL; iter-18: if dual helps, tune Wd / grow; if not, 0.5047 @ 183p is the honest champion -> begin final report + seed replicates for mean+-std., dc_mode=filtered, per_step_alpha=True, lpd_on=True, lpd_width=4, lpd_kernel=3, anisotropic_on_top=False, lpd_dual=True, lpd_dual_width=4
18	671da566	0.972567	0.454346	keep	architecture	param_efficient-claude-agentic	claude-opus-4-8-1m	41.5859	2.845193e-03	1103.0	0.000183	param_efficient-claude-agentic: reg_type=bilateral, bilateral_on_top=False, proj_filter_on=False, n_iter=30, learnable_alpha=True, alpha_init=0.1, foe_n_filters=24, foe_kernel=7, foe_n_bumps=31, n_bf=1, bf_multiscale=True, bf_sigmas=[0.8, 1.6, 3.2], bf_kernel=7, bf_sigma_r=0.02, bf_gain_init=0.0, epochs=16, cosine_lr=True, lr=0.005, max_train_s=1080, batch_size=4, train_n=200, val_n=200, display_min=0.0, display_max=0.05, seed=43, rationale=iter-18 param_efficient breast -- SEED REPLICATE 1/4 of the CHAMPION (LPD-combine W=4, filtered-DC K=30, 183 params). SIX-BOX: (1) PRIOR: architecture search COMPLETE; champion = iter-15 (seed 42) hr 0.5047 @ 183p. Adjoint/config capped ~0.26; filtered-DC broke it (0.4345 @ 13p); prox capacity fought it (0.0); LPD learned-combination WON (0.5047); W=8 and sinogram-dual both regressed -> W=4 primal-only is the optimum. (2) FAILURE MODE: single-seed hr is noise-confounded (breast seed variance is large, ~+-0.05 per the DL-tier solvers) -- need mean+-std. (3) ONE KNOB: seed 42 -> 43 (replicate 1/4). ALL else byte-for-byte the champion. (4) HYPOTHESIS: hr lands near 0.5047 +- seed noise; the 5-seed (42-46) mean+-std is the REPORTED headline number @ 183 params. (5) BUDGET: identical to iter-15 (16ep in ~1020s), max_train_s=1080, --time=00:30:00, 200-val -> 20-min comparable. (6) SERIAL; next replicate self-dispatches; recon_raw.npz (pred/truth/baseline) saved to the iter dir for test-scorability., dc_mode=filtered, per_step_alpha=True, lpd_on=True, lpd_width=4, lpd_kernel=3, anisotropic_on_top=False
22	671da566	0.968933	0.476767	keep	architecture	param_efficient-claude-agentic	claude-opus-4-8-1m	41.9503	2.728283e-03	1114.5	0.00019	param_efficient-claude-agentic: reg_type=bilateral, bilateral_on_top=False, proj_filter_on=False, n_iter=30, learnable_alpha=True, alpha_init=0.1, foe_n_filters=24, foe_kernel=7, foe_n_bumps=31, n_bf=1, bf_multiscale=True, bf_sigmas=[0.8, 1.6, 3.2], bf_kernel=7, bf_sigma_r=0.02, bf_gain_init=0.0, epochs=16, cosine_lr=True, lr=0.005, max_train_s=1080, batch_size=4, train_n=200, val_n=200, display_min=0.0, display_max=0.05, seed=42, rationale=iter-22 param_efficient breast -- WU-2015 LEARNED DE-ALIASED INITIALIZER, end-to-end (solver edit). SIX-BOX: (1) PRIOR: architecture search reached champion LPD-combine W=4 = 0.5047 @ 183p (seed42). But the unroll STILL initializes x0 from the raw Hann FBP -- the STREAKY starting point (the sparse-view problem itself). Wu-2015-trainable STANDALONE reaches hr 0.31 -> it produces a DE-ALIASED x0 that already beats raw FBP. (2) FAILURE MODE: raw-FBP x0 injects coherent streaks the K=30 unroll must then undo; a cleaner init could let the unroll climb higher. (3) ONE KNOB (architectural): wu_init_on=True -- I added a WuInit front-end (Wu aliasing-free band-decomposition FBP: 4 band scales + sigmoid slope + offset + 1 gain = 7 params) as a RESIDUAL on the plain FBP: x0 = fbp + gain*(wu_aliasfree - fbp), gain ZERO-INIT => x0 == plain FBP == the 0.5047 champion BYTE-FOR-BYTE at init (no regression). Trained END-TO-END with the DC+LPD unroll (init + LPD block + per-step alpha co-adapt). Total ~= 183 + 7 = 190 params. seed 42 to compare directly vs iter-15's 0.5047. (4) HYPOTHESIS: a learned de-streaked band-decomposition init feeds the DC+LPD unroll a cleaner starting image, so end-to-end training lifts hr past 0.5047 (the init and unroll co-adapt) -- OR the gain trains toward 0 (raw FBP already optimal for this unroll), a clean null. Either way maps the init lever. (5) BUDGET: WuInit = n_bands extra back-projections at x0 ONCE per forward (cheap vs K=30 unroll); iter-15 finished 16ep in 1020s -> expect ~14-16ep; train_n=200, max_train_s=1080, --time=00:30:00, 200-val -> 20-min comparable. (6) SERIAL; iter-23: if Wu-init helps, tune n_bands/gain; then resume seed replicates of whichever config is champion for mean+-std., dc_mode=filtered, per_step_alpha=True, lpd_on=True, lpd_width=4, lpd_kernel=3, anisotropic_on_top=False, wu_init_on=True, wu_n_bands=4, wu_sigmoid_slope=10.0, wu_sigmoid_offset=1.0, wu_gain_init=0.0
