iter	commit	val_score	headroom	status	change_class	agent	model	val_psnr	val_rmse	elapsed_s	params_M	rationale
19	671da566	0.975502	0.462652	keep	architecture	param_efficient-claude-agentic	claude-opus-4-8-1m	41.7191	2.801886e-03	1131.4	0.000183	param_efficient-claude-agentic: reg_type=bilateral, bilateral_on_top=False, proj_filter_on=False, n_iter=30, learnable_alpha=True, alpha_init=0.1, foe_n_filters=24, foe_kernel=7, foe_n_bumps=31, n_bf=1, bf_multiscale=True, bf_sigmas=[0.8, 1.6, 3.2], bf_kernel=7, bf_sigma_r=0.02, bf_gain_init=0.0, epochs=16, cosine_lr=True, lr=0.005, max_train_s=1080, batch_size=4, train_n=200, val_n=200, display_min=0.0, display_max=0.05, seed=44, rationale=iter-19 param_efficient breast -- SEED REPLICATE 2/4 of the CHAMPION (LPD-combine W=4, filtered-DC K=30, 183 params). SIX-BOX: (1) PRIOR: architecture search COMPLETE; champion = iter-15 (seed 42) hr 0.5047 @ 183p. Adjoint/config capped ~0.26; filtered-DC broke it (0.4345 @ 13p); prox capacity fought it (0.0); LPD learned-combination WON (0.5047); W=8 and sinogram-dual both regressed -> W=4 primal-only is the optimum. (2) FAILURE MODE: single-seed hr is noise-confounded (breast seed variance is large, ~+-0.05 per the DL-tier solvers) -- need mean+-std. (3) ONE KNOB: seed 42 -> 44 (replicate 2/4). ALL else byte-for-byte the champion. (4) HYPOTHESIS: hr lands near 0.5047 +- seed noise; the 5-seed (42-46) mean+-std is the REPORTED headline number @ 183 params. (5) BUDGET: identical to iter-15 (16ep in ~1020s), max_train_s=1080, --time=00:30:00, 200-val -> 20-min comparable. (6) SERIAL; next replicate self-dispatches; recon_raw.npz (pred/truth/baseline) saved to the iter dir for test-scorability., dc_mode=filtered, per_step_alpha=True, lpd_on=True, lpd_width=4, lpd_kernel=3, anisotropic_on_top=False
23	671da566	0.967799	0.320168	keep	architecture	param_efficient-claude-agentic	claude-opus-4-8-1m	39.6762	3.544838e-03	1141.3	0.000189	param_efficient-claude-agentic: reg_type=bilateral, bilateral_on_top=False, proj_filter_on=False, n_iter=30, learnable_alpha=True, alpha_init=0.1, foe_n_filters=24, foe_kernel=7, foe_n_bumps=31, n_bf=1, bf_multiscale=True, bf_sigmas=[0.8, 1.6, 3.2], bf_kernel=7, bf_sigma_r=0.02, bf_gain_init=0.0, epochs=16, cosine_lr=True, lr=0.005, max_train_s=1080, batch_size=4, train_n=200, val_n=200, display_min=0.0, display_max=0.05, seed=42, rationale=iter-23 param_efficient breast -- WU-COMBINATION #1: BAND-WEIGHTED filtered-DC (frequency-selective DC, solver edit). SIX-BOX: (1) PRIOR: champion = LPD-combine W=4 filtered-DC K=30 = 0.5047 @ 183p (seed42). The filtered-DC applies a UNIFORM ramp/Hann filter fbp(Rx-g) EVERY step; but sparse-view streaks have a characteristic spectral signature a learned per-band weighting could target. Wu-init (iter-22) was a null for INITIALIZATION, but Wu's distinctive value is FREQUENCY-BAND SELECTIVITY, which the uniform ramp lacks. (2) FAILURE MODE: uniform ramp-filtered DC cannot down-weight streak-frequency components while preserving detail-frequency. (3) ONE KNOB (architectural): dc_mode 'filtered'->'band' -- I added a BandWeightedDC module: it reweights the residual spectrum by Sum_i s_i*tri_i(f) (tri_i = triangular partition-of-unity band windows, Sum tri_i=1) BEFORE the projector's fbp. s_i init 1.0 => reweight == identity => dc == fbp(resid) == the 0.5047 champion BYTE-FOR-BYTE at init (no regression). +6 band-scale params -> 189 total. All else byte-for-byte iter-15 (LPD W=4, K=30, seed42). (4) HYPOTHESIS: a learned per-band DC filter lets each of the K=30 DC corrections down-weight the streak-frequency band while preserving fibroglandular detail frequencies -> hr climbs past 0.5047, because frequency-selectivity is a lever uniform filtered-DC lacks. OR the s_i train back toward 1.0 (uniform ramp already captures the useful spectrum) -> clean null. (5) BUDGET: band reweight = 1 FFT/iFFT per step (cheap); iter-15 finished 16ep in 1020s -> expect ~14-16ep; train_n=200, max_train_s=1080, --time=00:30:00, 200-val -> 20-min comparable. (6) SERIAL; iter-24: if band-DC helps, tune n_bands; else try Wu band-selective PROX (#2) or report the null; then finish champion seed replicates., dc_mode=band, per_step_alpha=True, lpd_on=True, lpd_width=4, lpd_kernel=3, anisotropic_on_top=False, band_dc_n_bands=6
24	671da566	0.960031	0.243431	keep	architecture	param_efficient-claude-agentic	claude-opus-4-8-1m	38.7472	3.944966e-03	1214.7	0.000187	param_efficient-claude-agentic: reg_type=bilateral, bilateral_on_top=False, proj_filter_on=False, n_iter=30, learnable_alpha=True, alpha_init=0.1, foe_n_filters=24, foe_kernel=7, foe_n_bumps=31, n_bf=1, bf_multiscale=True, bf_sigmas=[0.8, 1.6, 3.2], bf_kernel=7, bf_sigma_r=0.02, bf_gain_init=0.0, epochs=16, cosine_lr=True, lr=0.005, max_train_s=1080, batch_size=4, train_n=200, val_n=200, display_min=0.0, display_max=0.05, seed=42, rationale=iter-24 param_efficient breast -- WU-COMBINATION #2 (LAST): BAND-SELECTIVE PROX on x between DC steps (frequency-selective regularizer, solver edit). SIX-BOX: (1) PRIOR: champion LPD-combine W=4 filtered-DC K=30 = 0.5047 @ 183p. Wu combos so far: init NULL (iter-22, 0.4768), band-weighted DC REGRESSED (iter-23, 0.3202 -- reshaping the ramp breaks the projector inverse). Prox capacity also fought filtered-DC (iters13-14, hr 0.0) BUT those were ISOTROPIC (FoE/bilateral); a FREQUENCY-SELECTIVE prox is a genuinely distinct test. (2) FAILURE MODE (to test): can a per-band spectral gain on the ITERATE (not the DC filter) suppress streak-band energy in x without breaking the DC inverse? (3) ONE KNOB (architectural): band_prox=True -- I added a BandProx: decompose x into 4 radial 2D-freq bands, add Sum_b g_b*band_b(x) AFTER each DC step, g_b ZERO-INIT => x_out==x at init => pipeline == the 0.5047 champion BYTE-FOR-BYTE. +4 params -> 187 total. All else byte-for-byte iter-15 (LPD W=4, filtered-DC K=30, seed42). (4) HYPOTHESIS: a frequency-selective gain on the reconstruction can boost/suppress specific spectral bands (e.g. attenuate the streak band, boost detail band) WITHOUT touching the DC filter's projector inverse -> hr climbs past 0.5047. OR (likely, given iters13-14) any prox between DC steps fights the filtered-DC -> null/regress, completing the Wu exploration. (5) BUDGET: band prox = 1 fft2/ifft2 per step (moderate at 512^2); iter-15 finished 16ep in 1020s -> expect ~10-14ep; train_n=200, max_train_s=1080, --time=00:30:00, 200-val -> 20-min comparable. (6) SERIAL; iter-25: Wu exploration COMPLETE after this -> finish champion seed replicates 45/46 -> mean+-std -> FINAL REPORT., dc_mode=filtered, per_step_alpha=True, lpd_on=True, lpd_width=4, lpd_kernel=3, anisotropic_on_top=False, band_prox=True, band_prox_n_bands=4
20	671da566	0.968178	0.423627	keep	architecture	param_efficient-claude-agentic	claude-opus-4-8-1m	41.1101	3.005372e-03	1137.8	0.000183	param_efficient-claude-agentic: reg_type=bilateral, bilateral_on_top=False, proj_filter_on=False, n_iter=30, learnable_alpha=True, alpha_init=0.1, foe_n_filters=24, foe_kernel=7, foe_n_bumps=31, n_bf=1, bf_multiscale=True, bf_sigmas=[0.8, 1.6, 3.2], bf_kernel=7, bf_sigma_r=0.02, bf_gain_init=0.0, epochs=16, cosine_lr=True, lr=0.005, max_train_s=1080, batch_size=4, train_n=200, val_n=200, display_min=0.0, display_max=0.05, seed=45, rationale=iter-20 param_efficient breast -- SEED REPLICATE 3/4 of the CHAMPION (LPD-combine W=4, filtered-DC K=30, 183 params). SIX-BOX: (1) PRIOR: architecture search COMPLETE; champion = iter-15 (seed 42) hr 0.5047 @ 183p. Adjoint/config capped ~0.26; filtered-DC broke it (0.4345 @ 13p); prox capacity fought it (0.0); LPD learned-combination WON (0.5047); W=8 and sinogram-dual both regressed -> W=4 primal-only is the optimum. (2) FAILURE MODE: single-seed hr is noise-confounded (breast seed variance is large, ~+-0.05 per the DL-tier solvers) -- need mean+-std. (3) ONE KNOB: seed 42 -> 45 (replicate 3/4). ALL else byte-for-byte the champion. (4) HYPOTHESIS: hr lands near 0.5047 +- seed noise; the 5-seed (42-46) mean+-std is the REPORTED headline number @ 183 params. (5) BUDGET: identical to iter-15 (16ep in ~1020s), max_train_s=1080, --time=00:30:00, 200-val -> 20-min comparable. (6) SERIAL; next replicate self-dispatches; recon_raw.npz (pred/truth/baseline) saved to the iter dir for test-scorability., dc_mode=filtered, per_step_alpha=True, lpd_on=True, lpd_width=4, lpd_kernel=3, anisotropic_on_top=False
21	671da566	0.973997	0.449706	keep	architecture	param_efficient-claude-agentic	claude-opus-4-8-1m	41.5123	2.869388e-03	1147.2	0.000183	param_efficient-claude-agentic: reg_type=bilateral, bilateral_on_top=False, proj_filter_on=False, n_iter=30, learnable_alpha=True, alpha_init=0.1, foe_n_filters=24, foe_kernel=7, foe_n_bumps=31, n_bf=1, bf_multiscale=True, bf_sigmas=[0.8, 1.6, 3.2], bf_kernel=7, bf_sigma_r=0.02, bf_gain_init=0.0, epochs=16, cosine_lr=True, lr=0.005, max_train_s=1080, batch_size=4, train_n=200, val_n=200, display_min=0.0, display_max=0.05, seed=46, rationale=iter-21 param_efficient breast -- SEED REPLICATE 4/4 of the CHAMPION (LPD-combine W=4, filtered-DC K=30, 183 params). SIX-BOX: (1) PRIOR: architecture search COMPLETE; champion = iter-15 (seed 42) hr 0.5047 @ 183p. Adjoint/config capped ~0.26; filtered-DC broke it (0.4345 @ 13p); prox capacity fought it (0.0); LPD learned-combination WON (0.5047); W=8 and sinogram-dual both regressed -> W=4 primal-only is the optimum. (2) FAILURE MODE: single-seed hr is noise-confounded (breast seed variance is large, ~+-0.05 per the DL-tier solvers) -- need mean+-std. (3) ONE KNOB: seed 42 -> 46 (replicate 4/4). ALL else byte-for-byte the champion. (4) HYPOTHESIS: hr lands near 0.5047 +- seed noise; the 5-seed (42-46) mean+-std is the REPORTED headline number @ 183 params. (5) BUDGET: identical to iter-15 (16ep in ~1020s), max_train_s=1080, --time=00:30:00, 200-val -> 20-min comparable. (6) SERIAL; next replicate self-dispatches; recon_raw.npz (pred/truth/baseline) saved to the iter dir for test-scorability., dc_mode=filtered, per_step_alpha=True, lpd_on=True, lpd_width=4, lpd_kernel=3, anisotropic_on_top=False
25	671da566	0.962738	0.236182	keep	architecture	param_efficient-claude-agentic	claude-opus-4-8-1m	38.6644	3.982765e-03	1418.1	0.000184	param_efficient-claude-agentic: reg_type=bilateral, bilateral_on_top=False, proj_filter_on=False, n_iter=30, learnable_alpha=True, alpha_init=0.1, foe_n_filters=24, foe_kernel=7, foe_n_bumps=31, n_bf=1, bf_multiscale=True, bf_sigmas=[0.8, 1.6, 3.2], bf_kernel=7, bf_sigma_r=0.02, bf_gain_init=0.0, epochs=16, cosine_lr=True, lr=0.005, max_train_s=1080, batch_size=4, train_n=200, val_n=200, display_min=0.0, display_max=0.05, seed=42, rationale=iter-25 param_efficient breast -- CONJUGATE-GRADIENT DATA-CONSISTENCY (highest-upside untested lever). SIX-BOX: (1) PRIOR: champion = LPD-combine W=4 + FILTERED-DC (single fbp(Rx-g)) K=30, 5-seed mean 0.4590+-0.0294 @ 183p (best 0.5047). Filtered-DC uses ONE filtered gradient per step; a proper CG solve of the normal equations is a MUCH stronger DC solver -- CG-DC is the mechanism that got fastdiff-pixel-DC-on to 0.52 and wavelet-DC-on to 0.28. UNTESTED in this unroll. (2) FAILURE MODE: a single filtered gradient only partially enforces Rx=g each step; 30 of them approximate consistency but a per-step CG solve nails it far better. (3) ONE KNOB (architectural): dc_mode 'filtered'->'cg' -- I added CGDataConsistency: n_cg=5 matrix-free CG iterations solving (R^T R + lam I)d = R^T(g - Rx) for the DC update d (lam = softplus(learnable), damps the ill-conditioned 128-view normal operator), fed to the SAME LPD-combine block. +1 param (lam) -> 184 total. NOT byte-for-byte the champion (CG is a different, stronger DC operator) -- it is a genuine architectural swap of the DC solver. (4) HYPOTHESIS: a per-step CG least-squares DC solve enforces Rx=g much more completely than one filtered gradient, so the LPD-combine routes a cleaner, more consistent correction -> hr climbs past 0.5047 toward the 0.52-0.63 regime (fastdiff CG-DC reached 0.52). Risk: CG on the ill-conditioned 128-view operator can amplify streaks if underdamped -> lam is learnable to control this. (5) BUDGET: 5 CG iters = 5 fwd+back-proj PAIRS per unroll step x K=30 -> ~10x the projector calls of filtered-DC; may only fit a few epochs in 1080s -- if hr promising but undertrained, iter-26 reduces cg_n or K. train_n=200, --time=00:30:00, 200-val, 20-min budget. (6) SERIAL; iter-26: tune cg_n/lam if it helps, then multi-scale-bilateral POST-filter., dc_mode=cg, per_step_alpha=True, lpd_on=True, lpd_width=4, lpd_kernel=3, anisotropic_on_top=False, cg_n=5, cg_lam_init=0.01
26	671da566	0.963414	0.242683	keep	architecture	param_efficient-claude-agentic	claude-opus-4-8-1m	38.7386	3.948868e-03	1292.8	0.000184	param_efficient-claude-agentic: reg_type=bilateral, bilateral_on_top=False, proj_filter_on=False, n_iter=30, learnable_alpha=True, alpha_init=0.1, foe_n_filters=24, foe_kernel=7, foe_n_bumps=31, n_bf=1, bf_multiscale=True, bf_sigmas=[0.8, 1.6, 3.2], bf_kernel=7, bf_sigma_r=0.02, bf_gain_init=0.0, epochs=16, cosine_lr=True, lr=0.005, max_train_s=1080, batch_size=4, train_n=200, val_n=200, display_min=0.0, display_max=0.05, seed=42, rationale=iter-26 param_efficient breast -- CG-DC budget-fitted (n_cg 5->2). SIX-BOX: (1) PRIOR: iter-25 CG-DC n_cg=5 gave hr 0.2362 but was EPOCH-STARVED -- only 3/16 epochs (vs champion filtered-DC's ~6-16), loss STILL DESCENDING at cutoff (1.07e-3->2.5e-5->1.84e-5 dropping ep2->3). Not a genuine null; 5 CG iters ~ 10x projector calls halved epochs. (2) FAILURE MODE: CG cost too high to train in the 20-min wall. (3) ONE KNOB: cg_n 5->2 (a LIGHTLY-solved CG-DC, ~2.5x the projector calls of filtered-DC instead of ~10x) so it trains a COMPARABLE number of epochs to the champion. Still a stronger DC than one filtered gradient. All else byte-for-byte iter-25 (K=30, LPD W=4, seed42). (4) HYPOTHESIS: at n_cg=2 the run reaches ~6-8 epochs (comparable to the champion) and a lightly-solved CG-DC -- if CG's extra consistency-completeness is worth anything per projector-call -- beats the filtered-DC champion 0.5047. If a budget-fitted CG-DC STILL underperforms filtered-DC, that's a CLEAN FINDING: the single filtered gradient + LPD-combine is already near-optimal per projector-call and CG's extra completeness isn't worth the epochs it costs under a fixed wall. (5) BUDGET: n_cg=2 x K=30 = 2 fwd+back pairs/step x30; expect ~6-8 epochs; train_n=200, max_train_s=1080, --time=00:30:00, 200-val -> 20-min comparable. (6) SERIAL; iter-27: if CG-DC helps, tune cg_n/lam/K; else record the finding and continue the menu (multi-scale bilateral POST-filter, learned per-step DC schedule, 2-step LPD)., dc_mode=cg, per_step_alpha=True, lpd_on=True, lpd_width=4, lpd_kernel=3, anisotropic_on_top=False, cg_n=2, cg_lam_init=0.01
27	671da566	0.845854	0	discard	architecture	param_efficient-claude-agentic	claude-opus-4-8-1m	29.2794	1.173362e-02	1254.1	1.4e-05	param_efficient-claude-agentic: reg_type=bilateral, bilateral_on_top=False, proj_filter_on=False, n_iter=30, learnable_alpha=True, alpha_init=0.1, foe_n_filters=24, foe_kernel=7, foe_n_bumps=31, n_bf=3, bf_multiscale=True, bf_sigmas=[0.8, 1.6, 3.2], bf_kernel=7, bf_sigma_r=0.02, bf_gain_init=0.0, epochs=16, cosine_lr=True, lr=0.005, max_train_s=1080, batch_size=4, train_n=200, val_n=200, display_min=0.0, display_max=0.05, seed=42, rationale=iter-27 param_efficient breast -- DIAGNOSTIC: CG-DC WITHOUT LPD-combine (isolate the mismatch). SIX-BOX: (1) PRIOR: CG-DC + LPD-combine gave 0.2362 (n_cg5) / 0.2427 (n_cg2, 5ep) -- far below filtered-DC+LPD 0.5047 AND below filtered-DC+bilateral 0.4345 (iter-11). iter-26 reached 5 epochs (not just starved), so the pattern = INTEGRATION MISMATCH: the CG least-squares solution doesn't compose with the LPD-combine, which learned to route the SINGLE filtered-gradient correction. (2) FAILURE MODE (to isolate): is CG-DC bad vs filtered-DC in general, or only bad WITH the LPD-combine? (3) ONE KNOB: lpd_on True->False on the CG-DC config (raw CG-DC prox-grad unroll + 3-scale bilateral gate, the iter-11 structure but with dc_mode=cg instead of filtered). n_cg=2, K=30, seed42, ~15 params. (4) HYPOTHESIS: if raw CG-DC + bilateral reaches ~0.4345 (filtered-DC+bilateral's level), the problem is specifically CG-DC-vs-LPD-combine (CG doesn't compose with the learned router) -> filtered-gradient is the right DC for the LPD-combine. If raw CG-DC + bilateral ALSO underperforms filtered-DC+bilateral, then CG-DC is just worse per-projector-call under the wall regardless of the combiner. Either way isolates the finding. (5) BUDGET: n_cg=2 x K=30 + bilateral, train_n=200, max_train_s=1080, --time=00:30:00, 200-val -> 20-min comparable. (6) SERIAL; iter-28: CONCLUDE CG-DC, then continue menu (multi-scale bilateral POST-filter, learned per-step DC schedule, 2-step LPD)., dc_mode=cg, per_step_alpha=False, cg_n=2, cg_lam_init=0.01, lpd_on=False
28	671da566	0.990695	0.620078	keep	architecture	param_efficient-claude-agentic	claude-opus-4-8-1m	44.7303	1.981020e-03	1180.3	0.000195	param_efficient-claude-agentic: reg_type=bilateral, bilateral_on_top=False, proj_filter_on=False, n_iter=30, learnable_alpha=True, alpha_init=0.1, foe_n_filters=24, foe_kernel=7, foe_n_bumps=31, n_bf=1, bf_multiscale=True, bf_sigmas=[0.8, 1.6, 3.2], bf_kernel=7, bf_sigma_r=0.02, bf_gain_init=0.0, epochs=16, cosine_lr=True, lr=0.005, max_train_s=1080, batch_size=4, train_n=200, val_n=200, display_min=0.0, display_max=0.05, seed=42, rationale=iter-28 param_efficient breast -- MULTI-SCALE BILATERAL POST-FILTER (output denoiser, highest remaining upside). SIX-BOX: (1) PRIOR: champion LPD-combine W=4 filtered-DC K=30 = 0.4590+-0.0294 (best 0.5047) @ 183p. In-loop prox FAILED (iters13-14/24, hr 0.0) -- but that was INSIDE the DC step. fastdiff finding: an edge-preserving denoiser helps at the OUTPUT, not in-loop. UNTESTED here. (2) FAILURE MODE: the data-consistent recon still carries residual streak-noise the DC+LPD leaves; a light output bilateral could clean it WITHOUT disturbing the DC (it is post-hoc, not in the consistency loop). (3) ONE KNOB: post_bilateral=True -- a 3-scale edge-preserving bilateral bank on the FINAL x: x_out = x + Sum_i g_i*(BF_i(x)-x), g_i ZERO-INIT => identity at init => pipeline == the 0.5047 champion BYTE-FOR-BYTE. +12 params (3 filters x (3 sigma + 1 gain)) -> 195 total. sigma_r=0.02 tight range kernel (edge-preserving, cannot over-smooth fibroglandular detail). All else byte-for-byte iter-15. (4) HYPOTHESIS: a light multi-scale edge-preserving denoiser on the OUTPUT removes residual streak-noise the unroll leaves -> hr climbs past 0.5047, because the denoiser role (output) is productive where the in-loop prox role was not. (5) BUDGET: 3 bilaterals applied ONCE at output (cheap vs K=30 unroll); iter-15 finished 16ep in 1020s -> ~14-16ep; train_n=200, max_train_s=1080, --time=00:30:00, 200-val -> 20-min. (6) SERIAL; iter-29: if post-BF helps, tune scales/sigma_r; else record + continue menu (learned per-step DC schedule, 2-step LPD, grad-clip variance reduction)., dc_mode=filtered, per_step_alpha=True, lpd_on=True, lpd_width=4, lpd_kernel=3, anisotropic_on_top=False, post_bilateral=True, post_n_bf=3, post_bf_kernel=7, post_bf_sigma_r=0.02
29	671da566	0.990506	0.616989	keep	architecture	param_efficient-claude-agentic	claude-opus-4-8-1m	44.66	1.997128e-03	1176.3	0.000203	param_efficient-claude-agentic: reg_type=bilateral, bilateral_on_top=False, proj_filter_on=False, n_iter=30, learnable_alpha=True, alpha_init=0.1, foe_n_filters=24, foe_kernel=7, foe_n_bumps=31, n_bf=1, bf_multiscale=True, bf_sigmas=[0.8, 1.6, 3.2], bf_kernel=7, bf_sigma_r=0.02, bf_gain_init=0.0, epochs=16, cosine_lr=True, lr=0.005, max_train_s=1080, batch_size=4, train_n=200, val_n=200, display_min=0.0, display_max=0.05, seed=42, rationale=iter-29 param_efficient breast -- TUNE post-filter: n_bf 3->5 scales. SIX-BOX: (1) PRIOR: iter-28 BREAKTHROUGH -- multi-scale bilateral POST-filter (3 scales, output denoiser) jumped hr 0.5047->0.6201 @ 195p, PSNR 44.73, full 16ep. VN-tier hr (~0.62) at ~46x fewer params than VN 9k. The +0.12 jump suggests more post-filter headroom. (2) FAILURE MODE: 3 scales may under-cover the streak-noise spectrum the output carries. (3) ONE KNOB: post_n_bf 3->5 (more edge-preserving scales in the output bilateral bank). g_i zero-init => identity at init => starts == the 0.6201 champion byte-for-byte (worst case 0.6201, no regression). +8 params (2 more filters x 4) -> 203 total. All else byte-for-byte iter-28. (4) HYPOTHESIS: more output-denoiser scales clean residual streak-noise across more spatial bandwidths -> hr climbs past 0.6201 toward 0.68. OR it saturates at ~0.62 (3 scales already cover it) -> peak found. (5) BUDGET: 5 bilaterals applied ONCE at output (cheap); iter-28 finished 16ep in 1120s -> ~16ep; train_n=200, max_train_s=1080, --time=00:30:00, 200-val -> 20-min comparable. (6) SERIAL; iter-30: tune sigma_r or a 2nd post-pass if 5 helps; then SEED REPLICATES of the peak post-filter champion for mean+-std., dc_mode=filtered, per_step_alpha=True, lpd_on=True, lpd_width=4, lpd_kernel=3, anisotropic_on_top=False, post_bilateral=True, post_n_bf=5, post_bf_kernel=7, post_bf_sigma_r=0.02
