iter	commit	val_score	headroom	status	change_class	agent	model	rationale
107	7d13bed	0.676333	0.605373	discard	architecture	claude	claude-sonnet-4.5	adamw_beta1 0.9 -> 0.85 (faster momentum, untested lower side; iter-96 closed 0.95)
108	93bc29c	0.672025	0.603322	discard	architecture	claude	claude-sonnet-4.5	REVERT lr 9e-5 -> 1e-4 (substrate-drift fix; iter-101 DISCARD was never reverted)
109	acf916c	0.643873	0.556338	discard	architecture	claude	claude-sonnet-4.5	input_dropout 0.0 -> 0.02 retest (iter-88 KEEP exact config; testing variance hypothesis)
110	d8c8215	0.679166	0.610598	keep	architecture	claude	claude-sonnet-4.5	lr 1e-4 -> 1.1e-4 (upper side bisection on restored lr base)
111	1de6395	0.636917	0.518053	discard	architecture	claude	claude-sonnet-4.5	lr 1.1e-4 -> 1.2e-4 (continue upper bisection on iter-110 KEEP)
112	bb6585a	0.665683	0.599553	discard	architecture	claude	claude-sonnet-4.5	lr_schedule constant -> cosine retest on iter-110 KEEP substrate
113	3a9a84e	0.669428	0.606892	discard	architecture	claude	claude-sonnet-4.5	lr_schedule cosine -> step7 (decay at epoch 7)
114	c1a134d	0.652543	0.588033	discard	architecture	claude	claude-sonnet-4.5	res_channels 32 -> 40 (capacity bump, untested specific)
115	74d5893	0.663518	0.598138	discard	architecture	claude	claude-sonnet-4.5	res_channels 32 -> 24 (capacity reduction; might be more stable on noisy substrate)
116	177acd6	0.648461	0.543612	discard	architecture	claude	claude-sonnet-4.5	swa_last_n 0 -> 2 (short SWA retest on lr=1.1e-4 substrate)
117	2e81fad	0.623959	0.513628	discard	architecture	claude	claude-sonnet-4.5	lr_warmup_epochs 1 -> 2 retest on lr=1.1e-4 substrate
118	68fd77c	0.642549	0.54626	discard	architecture	claude	claude-sonnet-4.5	input_dropout 0.0 -> 0.01 (untested specific small dropout)
119	327e2ad	0.672463	0.607702	discard	architecture	claude	claude-sonnet-4.5	lr 1.1e-4 -> 1.05e-4 (super-fine lower bisection on iter-110 KEEP)
120	016cc04	0.453233	0.0410577	discard	architecture	claude	claude-sonnet-4.5	residual True -> False retest on batch+lr=1.1e-4 substrate (iter-33 was -2.43pp on group)
121	73fbc94	0.673485	0.592539	discard	architecture	claude	claude-sonnet-4.5	weight_decay 5e-5 -> 4e-5 (super-fine bisection lower side)
122	b03009f	0.676843	0.605457	discard	architecture	claude	claude-sonnet-4.5	weight_decay 5e-5 -> 6e-5 (super-fine upper bisection)
123	d8483bd	0.667468	0.594819	discard	architecture	claude	claude-sonnet-4.5	adamw_eps 1e-10 -> 5e-10 (super-fine between 1e-10 KEEP and iter-92 closed 1e-9)
124	282c61f	0.673171	0.601867	discard	architecture	claude	claude-sonnet-4.5	lr_warmup_epochs 1 -> 0 (no warmup; iter-117 closed 2; warmup=0 untested on lr=1.1e-4)
125	6698fd2	0.642947	0.530809	discard	architecture	claude	claude-sonnet-4.5	res_n_bf 0 -> 1 retest (iter-63 closed BF on batch substrate)
126	b0c8713	0.624636	0.512476	discard	architecture	claude	claude-sonnet-4.5	res_bias True -> False retest on fully-fixed substrate
127	7d18524	0.668154	0.599229	discard	architecture	claude	claude-sonnet-4.5	lr 1.1e-4 -> 1.075e-4 (super-fine bisection)
128	be6c072	0.65669	0.568388	discard	architecture	claude	claude-sonnet-4.5	adamw_beta2 0.999 -> 0.995 (untested specific lower; iter-97 closed 0.99)
129	fb942c8	0.671373	0.599154	discard	architecture	claude	claude-sonnet-4.5	adamw_beta2 0.999 -> 0.9995 (untested specific upper)
130	fd9bbf9	0.670471	0.603687	discard	architecture	claude	claude-sonnet-4.5	adamw_beta1 0.9 -> 0.92 (super-fine upper)
131	bdbf0df	0.645484	0.545933	discard	architecture	claude	claude-sonnet-4.5	res_scale 0.1 -> 0.08 (super-fine between 0.05 closed and 0.1 KEEP)
132	106e926	0.680023	0.610445	discard	architecture	claude	claude-sonnet-4.5	res_scale 0.08 -> 0.12 (upper super-fine; iter-131 closed 0.08)
133	54540a8	0.676334	0.607834	discard	architecture	claude	claude-sonnet-4.5	adamw_eps 1e-10 -> 2e-10 (super-super-fine bisection)
134	27341ce	0.678538	0.608036	discard	architecture	claude	claude-sonnet-4.5	lr 1.1e-4 -> 1.15e-4 (super-fine upper)
135	2474573	0.669678	0.611967	keep	architecture	claude	claude-sonnet-4.5	lr 1.15e-4 -> 1.125e-4 (super-super-fine between 1.1 KEEP and 1.15 DISCARD)
136	68bd510	0.662252	0.575955	discard	architecture	claude	claude-sonnet-4.5	lr 1.125e-4 -> 1.14e-4 (continue bisection)
137	8b0765a	0.667674	0.596543	discard	architecture	claude	claude-sonnet-4.5	lr 1.14e-4 -> 1.115e-4 (super-fine between 1.1 KEEP and 1.125 KEEP)
138	1a23c2e	0.657509	0.566576	discard	architecture	claude	claude-sonnet-4.5	input_dropout 0.0 -> 0.005 (super-small untested)
139	a2c1ea3	0.674532	0.603236	discard	architecture	claude	claude-sonnet-4.5	wd 5e-5 -> 4.5e-5 (super-super-fine lower)
140	8454fe4	0.676467	0.609675	discard	architecture	claude	claude-sonnet-4.5	wd=4.5e-5 retest (Edit failed before iter-139 submit; same config submitted twice)
141	1cd22b4	0.663327	0.577373	discard	architecture	claude	claude-sonnet-4.5	wd 4.5e-5 -> 5e-5 + lr=1.125e-4 (same as iter-135 KEEP config)
142	859ddc2	0.666062	0.592951	discard	architecture	claude	claude-sonnet-4.5	Same config as iter-141/135 (Edit failed before submit)
143	36d08e8	0.670158	0.605046	discard	architecture	claude	claude-sonnet-4.5	wd 5e-5 -> 5.5e-5 (super-fine upper)
144	bb78f31	0.67998	0.610968	discard	architecture	claude	claude-sonnet-4.5	5th same-config sample (Edit failed again before submit; effectively lr=1.125e-4 + wd=5.5e-5)
145	01273c4	0.676628	0.601747	discard	architecture	claude	claude-sonnet-4.5	wd 5.5e-5 -> 5e-5 (variance-window sample)
146	702eae7	0.675149	0.607363	keep	architecture	claude	claude-sonnet-4.5	epochs 8 -> 10 (B stage said +0.82pp underfit; more training)
147	ee28abe	0.659057	0.586363	discard	architecture	claude	claude-sonnet-4.5	epochs 10 -> 12 (push further; B stage said underfit at epochs=16)
148	b301e8c	0.668869	0.604019	discard	architecture	claude	claude-sonnet-4.5	epochs=10 substrate variance sample
149	ccb31fd	0.671715	0.607623	discard	architecture	claude	claude-sonnet-4.5	epochs=10 substrate variance sample
150	8308c9e	0.674242	0.605491	discard	architecture	claude	claude-sonnet-4.5	Final iter for B (target reached). epochs=10 substrate.
28	8037e76	0	0	discard	architecture	claude	claude-sonnet-4.5	[backfill] iter record lost during rapid-fire submission; placeholder val/hr=0
29	8037e76	0	0	discard	architecture	claude	claude-sonnet-4.5	[backfill] iter record lost during rapid-fire submission; placeholder val/hr=0
30	8037e76	0	0	discard	architecture	claude	claude-sonnet-4.5	[backfill] iter record lost during rapid-fire submission; placeholder val/hr=0
