iter	commit	val_score	headroom	status	change_class	agent	model	rationale
1		0.984715	0.203711	keep	architecture	ram-zeroshot-v2-search-tpe-calibrated-breast-ct	random-search	ram-zeroshot-v2-search-tpe-calibrated-breast-ct: ram_ckpt_path=/cluster/maier/Agent4CT/checkpoints/ram.pth.tar, ram_input_norm=adjoint_max, ram_clamp_output=True, ram_finetune=False, ram_finetune_epochs=0, ram_finetune_lr=0.0001, ram_disable_multiscale=False, ram_disable_cudnn=False, ram_use_deepinv_tomo=False, ram_sigma=0.02, ram_factor=0.5, ram_post_fbp_blend=0.6
2		0.983204	0.0979399	keep	architecture	ram-zeroshot-v2-search-tpe-calibrated-breast-ct	random-search	ram-zeroshot-v2-search-tpe-calibrated-breast-ct: ram_ckpt_path=/cluster/maier/Agent4CT/checkpoints/ram.pth.tar, ram_input_norm=adjoint_max, ram_clamp_output=True, ram_finetune=False, ram_finetune_epochs=0, ram_finetune_lr=0.0001, ram_disable_multiscale=False, ram_disable_cudnn=False, ram_use_deepinv_tomo=False, ram_sigma=0.031814, ram_factor=0.35913, ram_post_fbp_blend=0.53463
3		0.977036	0	discard	architecture	ram-zeroshot-v2-search-tpe-calibrated-breast-ct	random-search	ram-zeroshot-v2-search-tpe-calibrated-breast-ct: ram_ckpt_path=/cluster/maier/Agent4CT/checkpoints/ram.pth.tar, ram_input_norm=adjoint_max, ram_clamp_output=True, ram_finetune=False, ram_finetune_epochs=0, ram_finetune_lr=0.0001, ram_disable_multiscale=False, ram_disable_cudnn=False, ram_use_deepinv_tomo=False, ram_sigma=0.033764, ram_factor=0.73269, ram_post_fbp_blend=0.31739
4		0.987932	0.273125	keep	architecture	ram-zeroshot-v2-search-tpe-calibrated-breast-ct	random-search	ram-zeroshot-v2-search-tpe-calibrated-breast-ct: ram_ckpt_path=/cluster/maier/Agent4CT/checkpoints/ram.pth.tar, ram_input_norm=adjoint_max, ram_clamp_output=True, ram_finetune=False, ram_finetune_epochs=0, ram_finetune_lr=0.0001, ram_disable_multiscale=False, ram_disable_cudnn=False, ram_use_deepinv_tomo=False, ram_sigma=0.009943, ram_factor=0.4834, ram_post_fbp_blend=0.4255
5		0.986906	0.270824	keep	architecture	ram-zeroshot-v2-search-tpe-calibrated-breast-ct	random-search	ram-zeroshot-v2-search-tpe-calibrated-breast-ct: ram_ckpt_path=/cluster/maier/Agent4CT/checkpoints/ram.pth.tar, ram_input_norm=adjoint_max, ram_clamp_output=True, ram_finetune=False, ram_finetune_epochs=0, ram_finetune_lr=0.0001, ram_disable_multiscale=False, ram_disable_cudnn=False, ram_use_deepinv_tomo=False, ram_sigma=0.0084685, ram_factor=0.341, ram_post_fbp_blend=0.42405
6		0.972055	0	discard	architecture	ram-zeroshot-v2-search-tpe-calibrated-breast-ct	random-search	ram-zeroshot-v2-search-tpe-calibrated-breast-ct: ram_ckpt_path=/cluster/maier/Agent4CT/checkpoints/ram.pth.tar, ram_input_norm=adjoint_max, ram_clamp_output=True, ram_finetune=False, ram_finetune_epochs=0, ram_finetune_lr=0.0001, ram_disable_multiscale=True, ram_disable_cudnn=False, ram_use_deepinv_tomo=False, ram_sigma=0.0059094, ram_factor=0.61706, ram_post_fbp_blend=0.86703
7		0.978634	0.106492	keep	architecture	ram-zeroshot-v2-search-tpe-calibrated-breast-ct	random-search	ram-zeroshot-v2-search-tpe-calibrated-breast-ct: ram_ckpt_path=/cluster/maier/Agent4CT/checkpoints/ram.pth.tar, ram_input_norm=adjoint_max, ram_clamp_output=True, ram_finetune=False, ram_finetune_epochs=0, ram_finetune_lr=0.0001, ram_disable_multiscale=True, ram_disable_cudnn=False, ram_use_deepinv_tomo=False, ram_sigma=0.011697, ram_factor=0.51392, ram_post_fbp_blend=0.78113
8		0.98575	0.115601	keep	architecture	ram-zeroshot-v2-search-tpe-calibrated-breast-ct	random-search	ram-zeroshot-v2-search-tpe-calibrated-breast-ct: ram_ckpt_path=/cluster/maier/Agent4CT/checkpoints/ram.pth.tar, ram_input_norm=adjoint_max, ram_clamp_output=True, ram_finetune=False, ram_finetune_epochs=0, ram_finetune_lr=0.0001, ram_disable_multiscale=False, ram_disable_cudnn=False, ram_use_deepinv_tomo=False, ram_sigma=0.016239, ram_factor=0.63056, ram_post_fbp_blend=0.4331
9		0.981937	0.187111	keep	architecture	ram-zeroshot-v2-search-tpe-calibrated-breast-ct	random-search	ram-zeroshot-v2-search-tpe-calibrated-breast-ct: ram_ckpt_path=/cluster/maier/Agent4CT/checkpoints/ram.pth.tar, ram_input_norm=adjoint_max, ram_clamp_output=True, ram_finetune=False, ram_finetune_epochs=0, ram_finetune_lr=0.0001, ram_disable_multiscale=True, ram_disable_cudnn=False, ram_use_deepinv_tomo=False, ram_sigma=0.0062975, ram_factor=0.44252, ram_post_fbp_blend=0.72503
10		0.986547	0.0690374	keep	architecture	ram-zeroshot-v2-search-tpe-calibrated-breast-ct	random-search	ram-zeroshot-v2-search-tpe-calibrated-breast-ct: ram_ckpt_path=/cluster/maier/Agent4CT/checkpoints/ram.pth.tar, ram_input_norm=adjoint_max, ram_clamp_output=True, ram_finetune=False, ram_finetune_epochs=0, ram_finetune_lr=0.0001, ram_disable_multiscale=False, ram_disable_cudnn=False, ram_use_deepinv_tomo=False, ram_sigma=0.010446, ram_factor=0.79603, ram_post_fbp_blend=0.30656
11		0.984666	0.191167	keep	architecture	ram-zeroshot-v2-search-tpe-calibrated-breast-ct	random-search	ram-zeroshot-v2-search-tpe-calibrated-breast-ct: ram_ckpt_path=/cluster/maier/Agent4CT/checkpoints/ram.pth.tar, ram_input_norm=adjoint_max, ram_clamp_output=True, ram_finetune=False, ram_finetune_epochs=0, ram_finetune_lr=0.0001, ram_disable_multiscale=True, ram_disable_cudnn=False, ram_use_deepinv_tomo=False, ram_sigma=0.022449, ram_factor=0.42769, ram_post_fbp_blend=0.47737
12		0.985372	0.216514	keep	architecture	ram-zeroshot-v2-search-tpe-calibrated-breast-ct	random-search	ram-zeroshot-v2-search-tpe-calibrated-breast-ct: ram_ckpt_path=/cluster/maier/Agent4CT/checkpoints/ram.pth.tar, ram_input_norm=adjoint_max, ram_clamp_output=True, ram_finetune=False, ram_finetune_epochs=0, ram_finetune_lr=0.0001, ram_disable_multiscale=False, ram_disable_cudnn=False, ram_use_deepinv_tomo=False, ram_sigma=0.0095275, ram_factor=0.3179, ram_post_fbp_blend=0.41218
13		0.986956	0.295037	keep	architecture	ram-zeroshot-v2-search-tpe-calibrated-breast-ct	random-search	ram-zeroshot-v2-search-tpe-calibrated-breast-ct: ram_ckpt_path=/cluster/maier/Agent4CT/checkpoints/ram.pth.tar, ram_input_norm=adjoint_max, ram_clamp_output=True, ram_finetune=False, ram_finetune_epochs=0, ram_finetune_lr=0.0001, ram_disable_multiscale=False, ram_disable_cudnn=False, ram_use_deepinv_tomo=False, ram_sigma=0.0077991, ram_factor=0.38905, ram_post_fbp_blend=0.57525
14		0.984083	0.219476	keep	architecture	ram-zeroshot-v2-search-tpe-calibrated-breast-ct	random-search	ram-zeroshot-v2-search-tpe-calibrated-breast-ct: ram_ckpt_path=/cluster/maier/Agent4CT/checkpoints/ram.pth.tar, ram_input_norm=adjoint_max, ram_clamp_output=True, ram_finetune=False, ram_finetune_epochs=0, ram_finetune_lr=0.0001, ram_disable_multiscale=False, ram_disable_cudnn=False, ram_use_deepinv_tomo=False, ram_sigma=0.0050007, ram_factor=0.41271, ram_post_fbp_blend=0.66244
15		0.982071	0.0452973	keep	architecture	ram-zeroshot-v2-search-tpe-calibrated-breast-ct	random-search	ram-zeroshot-v2-search-tpe-calibrated-breast-ct: ram_ckpt_path=/cluster/maier/Agent4CT/checkpoints/ram.pth.tar, ram_input_norm=adjoint_max, ram_clamp_output=True, ram_finetune=False, ram_finetune_epochs=0, ram_finetune_lr=0.0001, ram_disable_multiscale=False, ram_disable_cudnn=False, ram_use_deepinv_tomo=False, ram_sigma=0.049402, ram_factor=0.58301, ram_post_fbp_blend=0.57309
16		0.987787	0.291856	keep	architecture	ram-zeroshot-v2-search-tpe-calibrated-breast-ct	random-search	ram-zeroshot-v2-search-tpe-calibrated-breast-ct: ram_ckpt_path=/cluster/maier/Agent4CT/checkpoints/ram.pth.tar, ram_input_norm=adjoint_max, ram_clamp_output=True, ram_finetune=False, ram_finetune_epochs=0, ram_finetune_lr=0.0001, ram_disable_multiscale=False, ram_disable_cudnn=False, ram_use_deepinv_tomo=False, ram_sigma=0.0077829, ram_factor=0.47559, ram_post_fbp_blend=0.52479
17		0.985654	0.270918	keep	architecture	ram-zeroshot-v2-search-tpe-calibrated-breast-ct	random-search	ram-zeroshot-v2-search-tpe-calibrated-breast-ct: ram_ckpt_path=/cluster/maier/Agent4CT/checkpoints/ram.pth.tar, ram_input_norm=adjoint_max, ram_clamp_output=True, ram_finetune=False, ram_finetune_epochs=0, ram_finetune_lr=0.0001, ram_disable_multiscale=False, ram_disable_cudnn=False, ram_use_deepinv_tomo=False, ram_sigma=0.0073402, ram_factor=0.38617, ram_post_fbp_blend=0.63126
18		0.98667	0.215723	keep	architecture	ram-zeroshot-v2-search-tpe-calibrated-breast-ct	random-search	ram-zeroshot-v2-search-tpe-calibrated-breast-ct: ram_ckpt_path=/cluster/maier/Agent4CT/checkpoints/ram.pth.tar, ram_input_norm=adjoint_max, ram_clamp_output=True, ram_finetune=False, ram_finetune_epochs=0, ram_finetune_lr=0.0001, ram_disable_multiscale=False, ram_disable_cudnn=False, ram_use_deepinv_tomo=False, ram_sigma=0.01344, ram_factor=0.55101, ram_post_fbp_blend=0.51249
19		0.982359	0.159045	keep	architecture	ram-zeroshot-v2-search-tpe-calibrated-breast-ct	random-search	ram-zeroshot-v2-search-tpe-calibrated-breast-ct: ram_ckpt_path=/cluster/maier/Agent4CT/checkpoints/ram.pth.tar, ram_input_norm=adjoint_max, ram_clamp_output=True, ram_finetune=False, ram_finetune_epochs=0, ram_finetune_lr=0.0001, ram_disable_multiscale=True, ram_disable_cudnn=False, ram_use_deepinv_tomo=False, ram_sigma=0.0075228, ram_factor=0.68024, ram_post_fbp_blend=0.70848
20		0.984858	0.166542	keep	architecture	ram-zeroshot-v2-search-tpe-calibrated-breast-ct	random-search	ram-zeroshot-v2-search-tpe-calibrated-breast-ct: ram_ckpt_path=/cluster/maier/Agent4CT/checkpoints/ram.pth.tar, ram_input_norm=adjoint_max, ram_clamp_output=True, ram_finetune=False, ram_finetune_epochs=0, ram_finetune_lr=0.0001, ram_disable_multiscale=False, ram_disable_cudnn=False, ram_use_deepinv_tomo=False, ram_sigma=0.014019, ram_factor=0.30361, ram_post_fbp_blend=0.55438
