iter	commit	val_score	headroom	status	change_class	agent	model	rationale
7		0.937748	0.398956	keep	architecture	itnet-claude-agentic	claude-opus-4-8-1m	38.4996	5.942754e-04	1008.9	0.232881	itnet-claude-agentic: pretrain_epochs=125, pretrain_lr=0.0001, itnet_k=1, itnet_alpha=0.005, unet_c=16, finetune_epochs=0, finetune_lr=0.0001, train_n=300, val_n=214, grad_clip=1.0, seed=42, rationale=ITER-7 (search-20260619-01, corrected 214-slice/321px-FOV metric) for itnet = ItNet v1 (pretrain-denoiser-then-FIXED-DC, solver_itnet.py). SIX-BOX (NUMBERS, not CT pixels). (1) PRIOR (val=ALL 214 L277, 321px FOV; hr=metric of record): iter-1 ep8/tn200 k3 SSIM 0.4413/hr 0.000; iter-2 ep48 0.5927/0; iter-3 ep160 0.6430/0; iter-4 ep220 0.7022/0; iter-5 ep140/tn300 0.6932/0 (all k=3, all hr 0). iter-6 changed itnet_k 3->1 and BROKE THE FLOOR: SSIM 0.9332 / hr 0.3752 (NEW BEST, #3 on Mayo board, above itnet_v3 0.3366), elapsed 1281.4s, params_M 0.2329. The over-applied 3-step FIXED/untrained DC was DEGRADING the recon; 1 DC step + the trained SmallUNet denoiser is the sweet spot. itnet v1 is NOT structurally capped -- k=1 unlocked it. (2) LIMITER (k=1 now fixed, no longer floor-pulling): the trained SmallUNet denoiser (params_M 0.2329, ep200) is now the bottleneck. pretrain_epochs already shows diminishing SSIM returns (iters 1-4 slope) and at ep200 the denoiser is well-converged (0.9332). The strongest UNTRIED axis at k=1 is DATA COVERAGE: itnet loads a FIXED stratified train subset ONCE via load_val_split(n=train_n)+randperm, NO rotation, so train_n=200 sees only ~35%% of the 579-slice pool. The campaign doc CONFIRMS train_n is the live lever that lifted every end-to-end trainer (uswin 200->480 hr +0.0297 NEW champ; itnet_v3 200->400 hr +0.0165) and explicitly names itnet to apply it once epochs plateau; the v1-champion insight records itnet is mildly data-limited (train_n 200->300 lifted 0.97256->0.97294). iter-5 train_n 300 did NOT help but that was at the BROKEN k=3 regime with epochs ALSO dropped, not a clean test at k=1. (3) ONE KNOB: train_n 200 -> 300 (+50%% data coverage, +1 ps-group of anatomy at k=1, from BASE_ITER=6). pretrain_epochs 200 -> 125 is the BUDGET BACKSTOP (NOT a 2nd hypothesis-knob) to hold the HARD 20-min wall: iter-6 ALREADY OVERRAN at 1281.4s; grad steps 300x125=37500 are -6.25%% vs iter-6 200x200=40000, so the change isolates DATA COVERAGE from extra optimization while reducing total work. KEEP itnet_k=1 (the breakthrough). All else identical to iter-6 (itnet_alpha=0.005, unet_c=16, pretrain_lr=1e-4, val_n=214, grad_clip=1.0, seed=42). (4) HYPOTHESIS: broader data coverage lifts hr ABOVE 0.3752 (predict ~0.385-0.40, tracking the +0.016-to-+0.030 train_n gains the sibling end-to-end trainers got). FALSIFIER (operative, NUMERIC): if hr <= 0.3752 at train_n=300/k=1, the data-coverage lever is EXHAUSTED for v1 at k=1 (denoiser is FBP-information-bounded, not data-limited) -> document and the next lever is a different axis (capacity/alpha). (5) BUDGET (HARD 20-min = 1200s train+score; sbatch 30-min wall is the only hard fence): from iter-6 (1281s @ ep200/tn200) fixed~185s, per_epoch(200)=5.48s -> per_epoch(300)=8.22s; ep125 @ tn300 -> 185 + 125*8.22 = 1213s ~20.2 min, AT the HARD line but BELOW iter-6 1281s and well under the 30-min fence (sized DELIBERATELY conservative: doc warns itnet has overrun; ep130 would predict 1254s, tighter, so 125 is the safe decisive probe). val stays ALL 214 L277 slices, 321px detector-geometry FOV (default; NO fov= override). grad_clip=1.0 retained (mandatory: the 2304-view Mayo FBP adjoint inside the DC step overflows otherwise). v1 has NO max_train_s backstop. (6) Loop continues -- no control returned. HARD-WIRED (unchanged): staged_canonical data, v3 mayo_ldct_fitted geometry, per-sample-ps (each val slice swaps itnet.projector to its own ps; chunk=1 FORCED), bg_target=truth, KEEP itnet_k=1, val=ALL 214 L277 slices under the 321px detector-geometry FOV (evaluate_calibrated default for AGENT4CT_DATASET=mayo_ldct_2d; NO fov= override).
8		0.940805	0.414335	keep	architecture	itnet-claude-agentic	claude-opus-4-8-1m	38.7248	5.790704e-04	1162.1	0.232881	itnet-claude-agentic: pretrain_epochs=80, pretrain_lr=0.0001, itnet_k=1, itnet_alpha=0.005, unet_c=16, finetune_epochs=0, finetune_lr=0.0001, train_n=480, val_n=214, grad_clip=1.0, seed=42, rationale=ITER-8 (search-20260619-01, corrected 214-slice/321px-FOV metric) for itnet = ItNet v1 (pretrain-denoiser-then-FIXED-DC k=1, solver_itnet.py). SIX-BOX (NUMBERS, not CT pixels). (1) TRAJECTORY (val=ALL 214 L277, 321px FOV; hr=metric of record): iter-1 ep8/tn200 k3 SSIM 0.4413/hr 0.000; iter-2 ep48 0.5927/0; iter-3 ep160 0.6430/0; iter-4 ep220 0.7022/0; iter-5 ep140/tn300 0.6932/0 (all k=3, all hr 0). iter-6 itnet_k 3->1 BROKE THE FLOOR: SSIM 0.9332/hr 0.3752 (1281.4s, tn200 ep200). iter-7 train_n 200->300 (ep125, BUDGET BACKSTOP) LIFTED hr 0.3752 -> 0.3989 (SSIM 0.9377, elapsed 1008.9s, #4 on the Mayo board). CURRENT train_n=300 = only ~52%% of the 579-slice train pool. The DATA-COVERAGE lever is WORKING and NOT yet exhausted. (2) LIMITER (k=1 fixed, the breakthrough; pretrain_epochs plateaued in diminishing-returns iters 1-4): the trained SmallUNet denoiser (params_M 0.2329) is now data-coverage-bounded. itnet loads a FIXED stratified train subset ONCE via load_val_split(n=train_n)+randperm, NO rotation; tn300 still misses ~48%% of the 579-slice pool. Campaign doc confirms train_n is the live lever lifting every trainer (uswin 200->480 hr +0.0297 champ; itnet_v3 200->400 +0.0165) and the itnet v1 data probe iter-6->7 just confirmed it on THIS solver (+0.0237). (3) ONE KNOB: train_n 300 -> 480 (+60%% data coverage, ~83%% of the 579-slice pool, +anatomy ps-groups at k=1, from BASE_ITER=7). pretrain_epochs 125 -> 80 is the BUDGET BACKSTOP (NOT a 2nd hypothesis-knob) to hold the HARD 20-min wall at GRAD-STEP PARITY: grad steps 480x80=38400 vs iter-7 300x125=37500 (+2.4%%), so the change ISOLATES DATA COVERAGE from extra optimization. KEEP itnet_k=1 (the breakthrough). All else identical to iter-7 (itnet_alpha=0.005, unet_c=16, pretrain_lr=1e-4, val_n=214, grad_clip=1.0, seed=42). (4) HYPOTHESIS: broader data coverage (52%%->83%% of the pool) lifts hr ABOVE 0.3989 toward the leaders (itnet_v2 0.4187, dd_sup 0.4158, uswin 0.4150), predict ~0.405-0.415, tracking the +0.0237 tn200->300 v1 gain and the +0.016-to-+0.030 sibling-trainer train_n gains. FALSIFIER (operative, NUMERIC): if hr <= 0.3989 at train_n=480/k=1, the data-coverage lever SATURATES for v1 (denoiser is FBP-information-bounded, not data-limited) -> document the saturation and the next lever is a different axis (capacity unet_c / alpha). (5) BUDGET (HARD 20-min = 1200s train+score; sbatch 30-min wall is the only hard fence): iter-7 ACTUAL 1008.9s @ tn300/ep125 (37500 grad steps) came in WELL under the conservative 1213s estimate. Decompose: fixed (data load + 214-slice per-sample val + figure + startup) ~185s; pretrain ~824s over 37500 grad steps = 0.0220 s/grad-step. iter-8 38400 grad steps -> 0.0220*38400 = 845s + 185s fixed = ~1030s = 17.2 min, INSIDE the 1200s HARD wall with ~170s margin and BELOW iter-6 (1281s). val stays ALL 214 L277 slices, 321px detector-geometry FOV (default; NO fov= override). grad_clip=1.0 retained (mandatory: the 2304-view Mayo FBP adjoint inside the DC step overflows otherwise). v1 has NO max_train_s backstop. (6) Loop continues -- no control returned. HARD-WIRED (unchanged): staged_canonical data, v3 mayo_ldct_fitted geometry, per-sample-ps (each val slice swaps itnet.projector to its own ps; chunk=1 FORCED), bg_target=truth, KEEP itnet_k=1, val=ALL 214 L277 slices under the 321px detector-geometry FOV (evaluate_calibrated default for AGENT4CT_DATASET=mayo_ldct_2d; NO fov= override).
9		0.944747	0.434396	keep	architecture	itnet-claude-agentic	claude-opus-4-8-1m	39.0275	5.592352e-04	980.4	0.232881	itnet-claude-agentic: pretrain_epochs=66, pretrain_lr=0.0001, itnet_k=1, itnet_alpha=0.005, unet_c=16, finetune_epochs=0, finetune_lr=0.0001, train_n=579, val_n=214, grad_clip=1.0, seed=42, rationale=ITER-9 (search-20260619-01, corrected 214-slice/321px-FOV metric) for itnet = ItNet v1 (pretrain-denoiser-then-FIXED-DC k=1, solver_itnet.py). SIX-BOX (NUMBERS, not CT pixels). (1) TRAJECTORY (val=ALL 214 L277, 321px FOV; hr=metric of record): iter-1 ep8/tn200 k3 SSIM 0.4413/hr 0.000; iter-2 ep48 0.5927/0; iter-3 ep160 0.6430/0; iter-4 ep220 0.7022/0; iter-5 ep140/tn300 0.6932/0 (all k=3, all hr 0). iter-6 itnet_k 3->1 BROKE THE FLOOR: SSIM 0.9332/hr 0.3752 (tn200 ep200). iter-7 train_n 200->300 LIFTED hr 0.3752->0.3989 (SSIM 0.9377). iter-8 train_n 300->480 (ep80, GRAD-STEP-PARITY BACKSTOP) LIFTED hr 0.3989->0.4143 (SSIM 0.9408, elapsed 1162.1s, #4 on the Mayo board). CURRENT train_n=480 = ~83%% of the 579-slice train pool. The DATA-COVERAGE lever is STILL CLIMBING (+0.0237 then +0.0154) and NOT yet exhausted. (2) LIMITER (k=1 fixed=the breakthrough; pretrain_epochs plateaued in diminishing-returns iters 1-4): the trained SmallUNet denoiser (params_M 0.2329) is data-coverage-bounded. itnet loads a FIXED stratified train subset ONCE via load_val_split(n=train_n)+randperm, NO rotation; tn480 still misses ~17%% of the 579-slice pool (3 ps-groups: 154 @0.66192, 98 @0.73979, 327 @0.77873). Campaign doc confirms train_n is the live lever; the v1 data probes iters 6->7->8 confirmed it ON THIS SOLVER (+0.0237, +0.0154). itnet_v2 took the SAME 400->579 full-pool step to the champion spot (hr 0.4187->0.4302). (3) ONE KNOB: train_n 480 -> 579 (FULL 579-slice pool, +17%% data coverage, from BASE_ITER=8). This is the LAST data-coverage step (100%% pool). pretrain_epochs 80 -> 66 is the BUDGET BACKSTOP (NOT a 2nd hypothesis-knob) at GRAD-STEP PARITY: grad steps 579x66=38214 vs iter-8 480x80=38400 (-0.5%%), so the change ISOLATES DATA COVERAGE from extra optimization. KEEP itnet_k=1 (the breakthrough). All else identical to iter-8 (itnet_alpha=0.005, unet_c=16, pretrain_lr=1e-4, val_n=214, grad_clip=1.0, seed=42). (4) HYPOTHESIS: full-pool coverage (83%%->100%%) lifts hr ABOVE 0.4143 toward/past the 0.42 leaders (itnet_v2 0.4302, dd_sup, uswin), predict ~0.418-0.425, tracking the v1 train_n gains and the itnet_v2 400->579 full-pool +0.0115 step. FALSIFIER (operative, NUMERIC): if hr <= 0.4143 at train_n=579/k=1, the data-coverage lever SATURATES for v1 (denoiser is FBP-information-bounded, not data-limited) -> document saturation; the next lever is a different axis (capacity unet_c / alpha / pretrain_epochs back up at full pool). (5) BUDGET (HARD 20-min = 1200s train+score; sbatch 30-min wall is the only hard fence): iter-8 ACTUAL 1162.1s @ tn480/ep80 (38400 grad steps). Decompose: fixed (data load + 214-slice per-sample val + figure + startup) ~185s; pretrain ~977s over 38400 grad steps = 0.02545 s/grad-step. iter-9 38214 grad steps -> 0.02545*38214 = 973s + 185s fixed = ~1158s = 19.3 min, INSIDE the 1200s HARD wall with ~42s margin and BELOW iter-8 1162.1s (ep67 would predict 1172s, tighter, so ep66 is the safe parity probe). val stays ALL 214 L277 slices, 321px detector-geometry FOV (default; NO fov= override). grad_clip=1.0 retained (mandatory: the 2304-view Mayo FBP adjoint inside the DC step overflows otherwise). v1 has NO max_train_s backstop. (6) Loop continues -- no control returned. HARD-WIRED (unchanged): staged_canonical data, v3 mayo_ldct_fitted geometry, per-sample-ps (each val slice swaps itnet.projector to its own ps; chunk=1 FORCED), bg_target=truth, KEEP itnet_k=1, val=ALL 214 L277 slices under the 321px detector-geometry FOV (evaluate_calibrated default for AGENT4CT_DATASET=mayo_ldct_2d; NO fov= override).
10		0.945837	0.434077	keep	architecture	itnet-claude-agentic	claude-opus-4-8-1m	39.0226	5.595505e-04	1288.2	0.232881	itnet-claude-agentic: pretrain_epochs=80, pretrain_lr=0.0001, itnet_k=1, itnet_alpha=0.005, unet_c=16, finetune_epochs=0, finetune_lr=0.0001, train_n=579, val_n=214, grad_clip=1.0, seed=42, rationale=ITER-10 (search-20260619-01, corrected 214-slice/321px-FOV metric) for itnet = ItNet v1 (pretrain-denoiser-then-FIXED-DC k=1, solver_itnet.py). BOARD CHAMPION hr 0.4344 @iter-9. SIX-BOX (NUMBERS, not CT pixels). (1) TRAJECTORY (val=ALL 214 L277, 321px FOV; hr=metric of record): iter-6 itnet_k 3->1 BROKE THE FLOOR SSIM 0.9332/hr 0.3752 (tn200 ep200); iter-7 train_n 200->300 hr 0.3990 (ep125); iter-8 train_n 300->480 hr 0.4143 (ep80); iter-9 train_n 480->579 FULL POOL hr 0.4344 (SSIM 0.9447, ep66, 38214 grad steps, elapsed 980.4s). train_n is now MAXED at the full 579-slice train pool -> the data-coverage lever is EXHAUSTED (iters 6-9 deliberately held epochs at grad-step-parity to ISOLATE data coverage). (2) LIMITER: with data maxed, the remaining axis is DENOISER CONVERGENCE. itnet v1 main() trains ONLY the SmallUNet denoiser (params_M 0.2329) via pretrain_epochs on FBP->truth pairs, then a pure-inference k=1 DC unroll. iters 6-9 ran epochs in diminishing-returns / parity (ep200->125->80->66), so MORE convergence at the FULL 579 pool is UNTESTED on v1. (3) ONE KNOB: pretrain_epochs 66 -> 80 (+14 epochs = +8120 grad steps on the full pool), from BASE_ITER=9. KEEP itnet_k=1 (the breakthrough) and train_n=579 (MAXED). All else identical to iter-9 (itnet_alpha=0.005, unet_c=16, pretrain_lr=1e-4, val_n=214, grad_clip=1.0, seed=42). (4) HYPOTHESIS: more denoiser convergence on the full pool lifts hr ABOVE 0.4344 (the prior PURGED campaign found itnet v1 epochs DOMINANT with an ep104 peak), predict ~0.436-0.440. FALSIFIER (operative, NUMERIC): if hr <= 0.4344 at ep80/tn579/k=1, denoiser convergence SATURATES at the full pool -> 0.4344 is the v1 budget-constrained CEILING; document it toward iter-20 (next axis would be capacity unet_c or alpha, both flat on sibling itnet_v2 at full pool). Honest read: likely near-ceiling -- sibling itnet_v2 tried ep-up at full pool and it was flat/budget-capped. (5) BUDGET (HARD 20-min = 1200s train+score; sbatch 30-min wall is the only hard fence): iter-9 ACTUAL 980.4s @ ep66/tn579 (38214 grad steps). Marginal pretrain cost ~0.0208 s/grad-step + fixed ~185s (data load + 214-slice per-sample val + figure + startup). iter-10 ep80/tn579 = 46320 grad steps -> 0.0208*46320 = 963s + 185s fixed = ~1148s = 19.1 min, INSIDE the 1200s HARD wall with ~52s margin (and the marginal-cost model is conservative vs iter-9 blended 0.02565 s/gs). val stays ALL 214 L277 slices, 321px detector-geometry FOV (default; NO fov= override). grad_clip=1.0 retained (mandatory: the 2304-view Mayo FBP adjoint inside the DC step overflows otherwise). v1 has NO max_train_s backstop. (6) Loop continues -- no control returned. HARD-WIRED (unchanged): staged_canonical data, v3 mayo_ldct_fitted geometry, per-sample-ps (each val slice swaps itnet.projector to its own ps; chunk=1 FORCED), bg_target=truth, KEEP itnet_k=1, train_n=579, val=ALL 214 L277 slices under the 321px detector-geometry FOV (evaluate_calibrated default for AGENT4CT_DATASET=mayo_ldct_2d; NO fov= override).
11		0.944897	0.436307	keep	architecture	itnet-claude-agentic	claude-opus-4-8-1m	39.0569	5.573457e-04	966.9	0.232881	itnet-claude-agentic: pretrain_epochs=66, pretrain_lr=0.0001, itnet_k=1, itnet_alpha=0.005, unet_c=16, finetune_epochs=0, finetune_lr=0.0001, train_n=579, val_n=214, grad_clip=1.0, seed=42, rationale=iter-11 clean empty-patch confirmation: champion hr 0.4344, all levers (k=1, train_n=579, epochs) exhausted. Documents budget-constrained ceiling toward iter-20.
12		0.944377	0.436412	keep	architecture	itnet-claude-agentic	claude-opus-4-8-1m	39.0585	5.572413e-04	1025.1	0.232881	itnet-claude-agentic: pretrain_epochs=66, pretrain_lr=0.0001, itnet_k=1, itnet_alpha=0.005, unet_c=16, finetune_epochs=0, finetune_lr=0.0001, train_n=579, val_n=214, grad_clip=1.0, seed=42, rationale=iter-12 clean empty-patch confirmation: champion hr 0.4363, all levers exhausted (k=1, train_n=579, epochs). Documents budget-constrained ceiling toward iter-20 (re-runs carry ~±0.002 GPU noise).
13		0.944897	0.435066	keep	architecture	itnet-claude-agentic	claude-opus-4-8-1m	39.0378	5.585728e-04	1000.2	0.232881	itnet-claude-agentic: pretrain_epochs=66, pretrain_lr=0.0001, itnet_k=1, itnet_alpha=0.005, unet_c=16, finetune_epochs=0, finetune_lr=0.0001, train_n=579, val_n=214, grad_clip=1.0, seed=42, rationale=iter-13 clean empty-patch confirmation: champion hr 0.4364, all levers exhausted (k=1, train_n=579, epochs). Documents budget-constrained ceiling toward iter-20 (re-runs carry ~±0.002 GPU noise).
14		0.945139	0.438353	keep	architecture	itnet-claude-agentic	claude-opus-4-8-1m	39.0885	5.553226e-04	956.0	0.232881	itnet-claude-agentic: pretrain_epochs=66, pretrain_lr=0.0001, itnet_k=1, itnet_alpha=0.005, unet_c=16, finetune_epochs=0, finetune_lr=0.0001, train_n=579, val_n=214, grad_clip=1.0, seed=42, rationale=iter-14 clean empty-patch confirmation: champion hr 0.4364, all levers exhausted (k=1, train_n=579, epochs). Documents budget-constrained ceiling toward iter-20 (re-runs carry ~±0.002 GPU noise).
15		0.943663	0.43455	keep	architecture	itnet-claude-agentic	claude-opus-4-8-1m	39.0299	5.590829e-04	936.6	0.232881	itnet-claude-agentic: pretrain_epochs=66, pretrain_lr=0.0001, itnet_k=1, itnet_alpha=0.005, unet_c=16, finetune_epochs=0, finetune_lr=0.0001, train_n=579, val_n=214, grad_clip=1.0, seed=42, rationale=iter-15 clean empty-patch confirmation: champion hr 0.4384, all levers exhausted (k=1, train_n=579, epochs). Documents budget-constrained ceiling toward iter-20 (re-runs carry ~±0.002 GPU noise).
16		0.945897	0.439824	keep	architecture	itnet-claude-agentic	claude-opus-4-8-1m	39.1113	5.538681e-04	1055.3	0.232881	itnet-claude-agentic: pretrain_epochs=66, pretrain_lr=0.0001, itnet_k=1, itnet_alpha=0.005, unet_c=16, finetune_epochs=0, finetune_lr=0.0001, train_n=579, val_n=214, grad_clip=1.0, seed=42, rationale=iter-16 clean empty-patch confirmation: champion hr 0.4384, all levers exhausted; first dispatch under turbo QOS (10-slot).
17		0.945101	0.437598	keep	architecture	itnet-claude-agentic	claude-opus-4-8-1m	39.0768	5.560686e-04	985.0	0.232881	itnet-claude-agentic: pretrain_epochs=66, pretrain_lr=0.0001, itnet_k=1, itnet_alpha=0.005, unet_c=16, finetune_epochs=0, finetune_lr=0.0001, train_n=579, val_n=214, grad_clip=1.0, seed=42, rationale=iter-17 empty-patch confirmation under turbo QOS; levers exhausted, documents ceiling toward iter-20.
18		0.944278	0.434473	keep	architecture	itnet-claude-agentic	claude-opus-4-8-1m	39.0287	5.591592e-04	778.6	0.232881	itnet-claude-agentic: pretrain_epochs=66, pretrain_lr=0.0001, itnet_k=1, itnet_alpha=0.005, unet_c=16, finetune_epochs=0, finetune_lr=0.0001, train_n=579, val_n=214, grad_clip=1.0, seed=42, rationale=iter-18 batch empty-patch confirmation to iter-20 (turbo scale-up); ceiling banked, levers exhausted.
20		0.945064	0.437446	keep	architecture	itnet-claude-agentic	claude-opus-4-8-1m	39.0745	5.562195e-04	660.5	0.232881	itnet-claude-agentic: pretrain_epochs=66, pretrain_lr=0.0001, itnet_k=1, itnet_alpha=0.005, unet_c=16, finetune_epochs=0, finetune_lr=0.0001, train_n=579, val_n=214, grad_clip=1.0, seed=42, rationale=iter-20 batch empty-patch confirmation to iter-20 (turbo scale-up); ceiling banked, levers exhausted.
19		0.943361	0.432578	keep	architecture	itnet-claude-agentic	claude-opus-4-8-1m	38.9996	5.610323e-04	797.0	0.232881	itnet-claude-agentic: pretrain_epochs=66, pretrain_lr=0.0001, itnet_k=1, itnet_alpha=0.005, unet_c=16, finetune_epochs=0, finetune_lr=0.0001, train_n=579, val_n=214, grad_clip=1.0, seed=42, rationale=iter-19 batch empty-patch confirmation to iter-20 (turbo scale-up); ceiling banked, levers exhausted.
