iter	commit	val_score	headroom	status	change_class	agent	model	rationale
1		0.441305	0	discard	architecture	itnet-claude-agentic-breast-ct	claude-opus-4.7-1m	itnet-claude-agentic: pretrain_epochs=8, pretrain_lr=0.0001, itnet_k=3, itnet_alpha=0.005, unet_c=16, finetune_epochs=0, finetune_lr=0.0001, train_n=200, val_n=214, grad_clip=1.0, seed=42, rationale=ITER-1 feasibility (search-20260619-01, corrected protocol) for itnet = ItNet v1 (the ORIGINAL Genzel-Hauptmann-Schaller recipe, solver_itnet.py). GOAL: does ItNet v1 run on Mayo under the corrected path (staged_canonical v3 mayo_ldct_fitted geometry, per-sample-ps FBP init + per-sample itnet.projector swap for the k DC steps, bg_target=truth) and produce a FINITE val_score + comparison.png within the HARD 20-min train+score budget, scoring ALL 214 L277 slices under the 321px detector-geometry FOV (evaluate_calibrated default for AGENT4CT_DATASET=mayo_ldct_2d; NO fov= override)? ARCHITECTURE NOTE: v1 main() runs ONLY pretrain_denoiser (SmallUNet on FBP->truth pairs) then a pure-inference ItNet DC unroll at eval; finetune_itnet() is defined but NOT called, so the only TRAINING knobs are pretrain_epochs/pretrain_lr (finetune_* kept inert at 0). v1 has NO max_train_s backstop -> sized conservatively below v3 iter-1s 738s wall. CONFIG: modest capacity that fits 24GB at lr~1e-4 (per brief): SmallUNet c=16, k=3 inference DC steps (Mayo 2304-angle wants >demo-DL k=2; matches v3 iter-1s stable k=3), itnet_alpha=5e-3 DC step size, pretrain_lr=1e-4 (v-series is lr-sensitive; high lr collapsed v3), grad_clip=1.0 (mandatory: the 2304-view Mayo FBP adjoint in the DC step overflows otherwise), pretrain_epochs=8 on train_n=200 (200 UNet-only steps/epoch, cheaper than v3 per epoch). per-sample-ps forces val chunk=1 (each slice swaps itnet.projector to its own ps). Reference timings (same val path, same dataset): uswin iter-1 329s, itnet_v3 iter-1 (k=3, per-ps, 214-slice val, ep8) 738s -> v1 (UNet-only train, shallower SmallUNet) lands UNDER 738s, well inside the 20-min budget. HYPOTHESIS: if I run ItNet v1 at k=3/c=16/pretrain_lr=1e-4 for 8 epochs on 200 stratified Mayo train slices, I expect a finite val_ssim that CLEARS the LD-FBP baseline (hr>0), because an FBP-denoiser + DC unroll is a sound Mayo recon family and the sibling v-variants just landed in range under this exact corrected metric (itnet_v3 hr=0.268, uswin hr=0.173). v1 should be in that range. This onboarding iter establishes the corrected-metric v1 baseline that iter-2+ will improve by tuning ONE knob (pretrain_epochs first -- epochs were the lever for the whole v-family).
2		0.592711	0	discard	architecture	itnet-claude-agentic-breast-ct	claude-opus-4.7-1m	itnet-claude-agentic: pretrain_epochs=48, pretrain_lr=0.0001, itnet_k=3, itnet_alpha=0.005, unet_c=16, finetune_epochs=0, finetune_lr=0.0001, train_n=200, val_n=214, grad_clip=1.0, seed=42, rationale=ITER-2 (search-20260619-01, corrected protocol) for itnet = ItNet v1 (pretrain-denoiser-then-DC, solver_itnet.py). SIX-BOX. (1) PRIOR RESULT: iter-1 SSIM 0.4413 / hr 0.000, elapsed_s=191 of the HARD 1200s (20-min) budget -> ~1009s UNUSED. NOT budget-limited. (2) FAILURE MODE: the pretrain-denoiser-then-DC path UNDER-CONVERGES -- v1 0.441 sits far below the sibling itnet_v3 END-TO-END recipe (0.896, hr 0.268) at the same ep8/k=3/c=16 seed. v1 only trained the SmallUNet denoiser for 8 epochs (200 steps/epoch = 1600 UNet steps) then ran a pure-inference k=3 DC unroll; finetune_itnet() is NOT called so pretrain_epochs is the ONLY training lever. (3) ONE KNOB: pretrain_epochs 8 -> 48 (6x). Justification by the unused-budget NUMBERS: 8 epochs cost ~191s total wall (incl. the ~one-time 214-slice per-sample val pass + figure); scaling pretrain 6x should land ~700-900s, comfortably inside 1200s given ~1009s headroom. grad_clip=1.0 and val_n=214 UNCHANGED. (4) HYPOTHESIS: more pretraining lifts v1 toward the v3 band (hr>0, SSIM climbing toward ~0.9) because a better-converged FBP denoiser feeds the DC unroll a cleaner init. FALSIFIER: if val stays flat ~0.44, the pretrain-then-DC ARCHITECTURE is structurally capped (not epochs-limited) -> note for iter-3 that v1 must move to END-TO-END training like v3 (call finetune_itnet / unroll the denoiser through the DC steps). (5) BUDGET: HARD 20-min, val_n=214 (NOT reduced), grad_clip=1.0. (6) No control return. HARD-WIRED: staged_canonical, v3 mayo_ldct_fitted geometry, per-sample-ps (val chunk=1, itnet.projector swap per slice), bg_target=truth, 321px detector-geometry FOV (evaluate_calibrated default for AGENT4CT_DATASET=mayo_ldct_2d; NO fov= override).
3		0.64303	0	discard	architecture	itnet-claude-agentic	claude-opus-4-8-1m	24.6668	2.921654e-03	858.9	0.232881	itnet-claude-agentic: pretrain_epochs=160, pretrain_lr=0.0001, itnet_k=3, itnet_alpha=0.005, unet_c=16, finetune_epochs=0, finetune_lr=0.0001, train_n=200, val_n=214, grad_clip=1.0, seed=42, rationale=ITER-3 (search-20260619-01, corrected 214-slice/321px-FOV metric) for itnet = ItNet v1 (pretrain-denoiser-then-FIXED-DC, solver_itnet.py). SIX-BOX (NUMBERS). (1) PRIOR RESULTS: iter-1 ep8 -> SSIM 0.4413 / hr 0.000 / PSNR 20.44 / RMSE 0.004756, elapsed 191.1s; iter-2 ep48 -> SSIM 0.5927 / hr 0.000 / PSNR 24.77 / RMSE 0.002886, elapsed 387.4s. The pretrain_epochs lever moves SSIM (0.4413->0.5927, +0.151 over 8->48 ep) but hr stays PINNED at 0.000 -- v1 is still BELOW the ~0.81 LD-FBP floor after a 6x pretrain increase. CONTRAST: the lever-twin itnet_v2 (same pretrain-then-DC family) climbed ep48 0.5888 -> ep144 0.6230 (3x epochs for only +0.034 SSIM, hr still 0.000 -- severe diminishing returns), while the END-TO-END-trained sibling itnet_v3 sits at 0.905 / hr 0.312 at iter-3. v1 (0.44->0.59) and v2 (0.59->0.62) trace the SAME under-0.81 curve; v3 (0.91) is on a different curve entirely. (2) LIMITER = the pretrain-then-FIXED-DC CEILING (structural, confirmed by reading solver_itnet.py): finetune_itnet() is DEFINED (lines 114-135) but NEVER called in main(); the k=3 ItNet DC unroll (forward, lines 76-90) has ZERO trainable parameters of its own (self.alpha is a plain float, self.projector is fixed analytic PYRO-NN); itnet.eval()+torch.no_grad() (lines 208-209) run the unroll as pure INFERENCE. The ONLY trainable component is the standalone SmallUNet denoiser (params_M=0.2329, exactly the UNet), pretrained as an FBP->truth denoiser that NEVER sees the DC steps during training. So pretrain_epochs is the sole lever and the fixed untrained DC post-processor caps v1 far below the end-to-end v3. (3) ONE KNOB: pretrain_epochs 48 -> 160 (3.3x), mirroring v2's 48->144 ceiling-probe escalation. All else identical to iter-2 (k=3, itnet_alpha=0.005, unet_c=16, pretrain_lr=1e-4, train_n=200, val_n=214, grad_clip=1.0, seed=42). (4) HYPOTHESIS + FALSIFIER: a final hard push of the only trainable component. FALSIFIER (the operative one): if SSIM stays well below the ~0.81 LD-FBP floor and far below v3's 0.91 (predicted ~0.63-0.66, tracking v2's flattening 0.62 at comparable epochs), itnet v1 is STRUCTURALLY pretrain-then-fixed-DC-capped -- NOT under-trained -- and the campaign should document this ceiling and direct future Mayo recon to itnet_v3 (end-to-end unrolled, 0.91) rather than spend more iters on v1's epochs lever. The counter-hypothesis (v1 suddenly clears 0.81 at 160 ep) is implausible given the +0.151 then +0.034-class diminishing slope already measured. (5) BUDGET (HARD 20-min = 1200s train+score): from the two measured points the per-epoch pretrain cost is (387.4-191.1)/(48-8) = 4.91 s/epoch and the fixed cost (data load + 214-slice per-sample val + figure + startup) is 191.1 - 8*4.91 = 151.8 s. pretrain_epochs=160 predicts 151.8 + 160*4.91 = 937 s = 15.6 min, comfortably inside the 1200s budget with margin for val-pass variance; pretrain_epochs=200 would predict 1134s (18.9 min, too tight), so 160 is a safe decisive push. val stays ALL 214 L277 slices, 321px detector-geometry FOV (default; no fov= override). grad_clip=1.0 retained (mandatory: the 2304-view Mayo FBP adjoint inside the DC step overflows otherwise). v1 has NO max_train_s backstop (not in the solver), so the 30-min sbatch wall is the only hard fence -- 15.6 min predicted leaves ample headroom. (6) Loop continues -- no control returned. HARD-WIRED (unchanged): staged_canonical data, v3 mayo_ldct_fitted geometry, per-sample-ps (each val slice swaps itnet.projector to its own ps; chunk=1 FORCED), bg_target=truth, val=ALL 214 L277 slices under the 321px detector-geometry FOV (evaluate_calibrated default for AGENT4CT_DATASET=mayo_ldct_2d; NO fov= override).
4		0.702188	0	discard	architecture	itnet-claude-agentic	claude-opus-4-8-1m	25.4261	2.677115e-03	1156.9	0.232881	itnet-claude-agentic: pretrain_epochs=220, pretrain_lr=0.0001, itnet_k=3, itnet_alpha=0.005, unet_c=16, finetune_epochs=0, finetune_lr=0.0001, train_n=200, val_n=214, grad_clip=1.0, seed=42, rationale=ITER-4 (search-20260619-01, corrected 214-slice/321px-FOV metric) for itnet = ItNet v1 (pretrain-denoiser-then-FIXED-DC, solver_itnet.py). This is a CONFIRMATION iter -- the solver is well-characterized; the goal is to confirm the asymptote of the only trainable lever, not to find a breakthrough. SIX-BOX (NUMBERS, not CT pixels). (1) PRIOR RESULTS (val=ALL 214 L277 slices, 321px detector-geometry FOV): iter-1 ep8 -> SSIM 0.4413 / hr 0.000, elapsed 191.1s; iter-2 ep48 -> SSIM 0.5927 / hr 0.000, elapsed 387.4s; iter-3 ep160 -> SSIM 0.6430 / hr 0.000, PSNR 24.67, RMSE 0.002922, elapsed 858.9s, params_M 0.2329. The pretrain_epochs lever is in clear diminishing returns: SSIM deltas are +0.151 (8->48), then +0.050 (48->160); hr has stayed PINNED at 0.000 across ALL three iters -- v1 remains BELOW the ~0.81 LD-FBP floor (and far below the END-TO-END sibling itnet_v3's ~0.91 / hr ~0.31). v1 (0.44->0.59->0.64) and its lever-twin itnet_v2 (0.59->0.62) trace the SAME under-0.81 curve; v3 is on a different curve entirely. (2) LIMITER = the pretrain-then-FIXED-DC CEILING (structural, confirmed by reading solver_itnet.py): finetune_itnet() is DEFINED (lines 114-135) but NEVER called in main(); the k=3 ItNet DC unroll (forward, lines 76-90) has ZERO trainable params (self.alpha is a plain float, self.projector is fixed analytic PYRO-NN); itnet.eval()+torch.no_grad() (lines 208-209) run the unroll as pure INFERENCE. The ONLY trainable component is the standalone SmallUNet denoiser (params_M=0.2329), pretrained as an FBP->truth denoiser that NEVER sees the DC steps. pretrain_epochs is the sole lever and the fixed untrained DC post-processor caps v1 far below v3. (3) ONE KNOB: pretrain_epochs 160 -> 220 (1.375x). All else identical to iter-3 (k=3, itnet_alpha=0.005, unet_c=16, pretrain_lr=1e-4, train_n=200, val_n=214, grad_clip=1.0, seed=42). (4) HYPOTHESIS + FALSIFIER: a final confirmation push of the only trainable component to nail the asymptote. HYPOTHESIS: SSIM lands ~0.65 (asymptoting -- the diminishing +0.151 -> +0.050 slope predicts roughly +0.01-class for 160->220), hr STAYS 0.000. FALSIFIER (the operative one): if hr is STILL 0.000 (SSIM ~0.65, well below the ~0.81 LD-FBP floor and far below v3's 0.91), the pretrain-then-FIXED-DC architecture is STRUCTURALLY capped -- NOT under-trained -- and the campaign should FILE THE STRUCTURAL VERDICT for itnet v1 (epochs lever exhausted; future Mayo recon goes to the end-to-end itnet_v3, ~0.91) rather than spend more iters on v1's epochs. The counter-hypothesis (v1 suddenly clears 0.81 at 220 ep) is implausible given the measured +0.151 -> +0.050 slope. (5) BUDGET (HARD 20-min = 1200s train+score): from the two latest measured points the per-epoch pretrain cost is (858.9-387.4)/(160-48) = 4.21 s/epoch and the fixed cost (data load + 214-slice per-sample val + figure + startup) is 858.9 - 160*4.21 = 185.3 s (this exactly reproduces iter-3: 185.3 + 160*4.21 = 858.9). pretrain_epochs=220 predicts 185.3 + 220*4.21 = 1111 s = 18.5 min, inside the 1200s budget with ~1.5 min margin; ep240 would predict 1196s (too tight), so 220 is the largest safe confirmation push. The sbatch wall is 30 min, so the 18.5-min prediction leaves ample fence headroom. val stays ALL 214 L277 slices, 321px detector-geometry FOV (default; NO fov= override). grad_clip=1.0 retained (mandatory: the 2304-view Mayo FBP adjoint inside the DC step overflows otherwise). v1 has NO max_train_s backstop, so the 30-min sbatch wall is the only hard fence. (6) Loop continues -- no control returned. HARD-WIRED (unchanged): staged_canonical data, v3 mayo_ldct_fitted geometry, per-sample-ps (each val slice swaps itnet.projector to its own ps; chunk=1 FORCED), bg_target=truth, val=ALL 214 L277 slices under the 321px detector-geometry FOV (evaluate_calibrated default for AGENT4CT_DATASET=mayo_ldct_2d; NO fov= override).
5		0.693224	0	discard	architecture	itnet-claude-agentic	claude-opus-4-8-1m	25.1395	2.766901e-03	1193.7	0.232881	itnet-claude-agentic: pretrain_epochs=140, pretrain_lr=0.0001, itnet_k=3, itnet_alpha=0.005, unet_c=16, finetune_epochs=0, finetune_lr=0.0001, train_n=300, val_n=214, grad_clip=1.0, seed=42, rationale=ITER-5 (search-20260619-01, corrected 214-slice/321px-FOV metric) for itnet = ItNet v1 (pretrain-denoiser-then-FIXED-DC, solver_itnet.py). SIX-BOX (NUMBERS, not CT pixels). (1) PRIOR (val=ALL 214 L277, 321px FOV): iter-1 ep8/train_n200 -> SSIM 0.4413 / hr 0.000; iter-2 ep48 -> 0.5927 / hr 0.000; iter-3 ep160 -> 0.6430 / hr 0.000; iter-4 ep220 -> 0.7022 / hr 0.000, elapsed 1156.9s, params_M 0.2329, train_n=200. HEADROOM (metric of record) PINNED at 0.000 across ALL 4 iters; the pretrain_epochs lever moves SSIM (0.44->0.70, diminishing +0.151->+0.050->+0.059) but never clears the ~0.81 LD-FBP floor. ALL 4 iters held train_n=200 -> train_n is the ONLY untried axis. (2) LIMITER = pretrain-then-FIXED-DC ceiling (structural, CONFIRMED from solver_itnet.py): main() lines 207-216 run itnet.eval()+torch.no_grad() = pure INFERENCE; finetune_itnet() (line 114) is DEFINED but NEVER called; the k=3 DC unroll (forward, lines 76-90) has ZERO trainable params (self.alpha is a plain float line 73, self.projector is fixed analytic PYRO-NN line 74). The ONLY trainable component is the standalone SmallUNet denoiser (params_M 0.2329) pretrained FBP->truth (lines 197-200) that NEVER sees the DC steps. v1 is the STRUCTURAL TWIN of itnet_v2 (same pretrain-then-fixed-DC); the doc records v2 just tested train_n 200->400 and its denoiser SSIM climbed (0.7039->0.7294) but the untrained-DC capped hr at 0. (3) ONE KNOB: train_n 200 -> 300 (+50% data coverage; the FIXED-stratified subset via load_val_split n=train_n + randperm only ever sees 35% of the 579-slice pool at n=200). pretrain_epochs 220 -> 140 is NOT a second hypothesis-knob, it is the budget backstop to hold the HARD 20-min wall at near GRAD-STEP PARITY (200x220=44000 vs 300x140=42000, only -4.5% optimization) so the change isolates DATA COVERAGE, per the campaign train_n-lever protocol. All else identical to iter-4 (itnet_k=3, itnet_alpha=0.005, unet_c=16, pretrain_lr=1e-4, val_n=214, grad_clip=1.0, seed=42). (4) HYPOTHESIS: more data coverage lifts SSIM modestly (~0.70->~0.72) but hr STAYS 0.000 because the fixed untrained DC operator caps the recon below the LD-FBP floor regardless of denoiser quality (exact itnet_v2 train_n 200->400 signature). FALSIFIER (operative): if hr > 0 at train_n=300 (v1 clears the ~0.81 FBP floor), v1 is DATA-LIMITED not structurally capped, and train_n is the live lever toward 20; implausible given v2 twin but the clean discriminator. PREDICTED iter-5 hr = 0.000 (SSIM ~0.71-0.72). (5) BUDGET (HARD 20-min = 1200s train+score): per-epoch cost scales with train_n; from the conservative iter2->4 fit per_epoch(200)=4.474 s, fixed=172.7 s, so at train_n=300 per_epoch=6.71 s -> pred = 172.7 + 140*6.71 = 1112 s = 18.5 min, inside 1200s with ~88s margin (sized DELIBERATELY conservative: the doc warns itnet_v2 iter-4 OVERRAN at 1237s; the 30-min sbatch wall is the only hard fence and 18.5 min leaves ample headroom; ep150 would predict 1179s, too tight, so 140 is the safe decisive probe). grad_clip=1.0 retained (mandatory: the 2304-view Mayo FBP adjoint inside the DC step overflows otherwise). v1 has NO max_train_s backstop. (6) Loop continues -- no control returned. HARD-WIRED (unchanged): staged_canonical data, v3 mayo_ldct_fitted geometry, per-sample-ps (each val slice swaps itnet.projector to its own ps; chunk=1 FORCED), bg_target=truth, val=ALL 214 L277 slices under the 321px detector-geometry FOV (evaluate_calibrated default for AGENT4CT_DATASET=mayo_ldct_2d; NO fov= override).
6		0.933214	0.375214	keep	architecture	itnet-claude-agentic	claude-opus-4-8-1m	38.1631	6.177505e-04	1281.4	0.232881	itnet-claude-agentic: pretrain_epochs=200, pretrain_lr=0.0001, itnet_k=1, itnet_alpha=0.005, unet_c=16, finetune_epochs=0, finetune_lr=0.0001, train_n=200, val_n=214, grad_clip=1.0, seed=42, rationale=ITER-6 (search-20260619-01, corrected 214-slice/321px-FOV metric) for itnet = ItNet v1 (pretrain-denoiser-then-FIXED-DC, solver_itnet.py). SIX-BOX (NUMBERS, not CT pixels). (1) PRIOR (val=ALL 214 L277, 321px FOV; hr=metric of record): iter-1 ep8/train_n200 -> SSIM 0.4413 / hr 0.000; iter-2 ep48 -> 0.5927 / hr 0.000; iter-3 ep160 -> 0.6430 / hr 0.000; iter-4 ep220 -> 0.7022 / hr 0.000 (1156.9s, BEST SSIM); iter-5 ep140/train_n300 -> 0.6932 / hr 0.000 (1193.7s). HEADROOM PINNED at 0.000 across ALL 5 iters. iter-5 train_n 200->300 data probe did NOT lift SSIM (0.6932<0.7022, epochs dropped 220->140) and hr stayed 0 -> DATA-COVERAGE is NOT the missing lever. Levers tested: pretrain_epochs (iters 1-4), train_n (iter-5). UNTESTED axis: itnet_k (held =3 every iter). (2) LIMITER = pretrain-then-FIXED-DC ceiling (structural, CONFIRMED from solver_itnet.py read this turn): ItNet.forward lines 76-90 run k DC steps where self.alpha is a PLAIN FLOAT (line 73) and self.projector is FIXED analytic PYRO-NN (line 74) -> ZERO trainable params in the DC unroll; finetune_itnet() (line 114) is DEFINED but NEVER called; main() runs itnet.eval()+torch.no_grad() = pure INFERENCE. The ONLY trainable component is the standalone SmallUNet denoiser (params_M 0.2329) pretrained FBP->truth that NEVER sees the DC steps. The fixed UNTRAINED DC operator drags the recon below the ~0.81 LD-FBP floor regardless of denoiser quality. (3) ONE KNOB: itnet_k 3 -> 1 (fewer FIXED-DC steps). Rationale: itnets OWN documented champion insight is k=1 wins on noisy LDCT (fewer DC steps); since the DC operator here is UNTRAINED and floor-pulling, k=1 passes the well-trained denoiser output through the LEAST harmful fixed-DC correction. This is the clean diagnostic of whether the fixed-DC STEP-COUNT (vs the trainable-param absence) is the floor-puller. Reverts to the iter-4 BEST config (train_n=200) NOT the iter-5 regressed data-trade. pretrain_epochs 220->200 is the budget backstop (NOT a 2nd hypothesis-knob) to hold the HARD 20-min wall conservatively. All else identical to iter-4 (itnet_alpha=0.005, unet_c=16, pretrain_lr=1e-4, train_n=200, val_n=214, grad_clip=1.0, seed=42). (4) HYPOTHESIS: k=3->1 keeps the recon closer to the well-trained denoiser, SSIM rises modestly above 0.7022 (predict ~0.72-0.78) but hr STAYS 0.000 -- a single fixed-DC step still cannot credit above the ~0.81 floor (denoiser is FBP->truth, FBP-information-capped; the untrained DC adds no params). FALSIFIER (operative): if hr > 0 at k=1, the fixed-DC STEP-COUNT was the floor-puller and itnet_k is the live lever toward 20 (implausible given zero DC params, but the clean discriminator). PREDICTED iter-6 hr = 0.000, SSIM ~0.74. (5) BUDGET (HARD 20-min = 1200s train+score): pretrain epochs cost is UNCHANGED by k (DC steps run only at eval, not in pretrain_denoiser); k=3->1 makes the 214-slice val pass CHEAPER (1 DC step/slice vs 3). iter-4 fit: per_epoch(200)=4.21s, fixed=185s. ep200 at train_n=200 -> pred = 185 + 200*4.21 = 1027s = 17.1 min, inside 1200s with ~170s margin (sized DELIBERATELY conservative: doc warns the v2 sibling overran at 1237s; real wall will be BELOW 1027s since val DC is now cheaper; the 30-min sbatch wall is the only hard fence). grad_clip=1.0 retained (mandatory: the 2304-view Mayo FBP adjoint inside the DC step overflows otherwise). v1 has NO max_train_s backstop. val stays ALL 214 L277 slices, 321px detector-geometry FOV (default; NO fov= override). (6) Loop continues -- no control returned. HARD-WIRED (unchanged): staged_canonical data, v3 mayo_ldct_fitted geometry, per-sample-ps (each val slice swaps itnet.projector to its own ps; chunk=1 FORCED), bg_target=truth, val=ALL 214 L277 slices under the 321px detector-geometry FOV (evaluate_calibrated default for AGENT4CT_DATASET=mayo_ldct_2d; NO fov= override).
