iter	commit	val_score	headroom	status	change_class	agent	model	val_psnr	val_rmse	elapsed_s	params_M	rationale
15	671da566	0.919922	0	discard	architecture	tv_iterative_supervised-claude-agentic	claude-opus-4-8-1m	36.3231	5.214964e-03	725.4	2e-05	tv_iterative_supervised-claude-agentic: val_n=200, val_chunk=5, train_n=400, epochs=20, batch_size=1, lr=0.005, tv_K=10, tv_step_init=0.003, tv_lambda_init=1.0, tv_share_steps=False, tv_eps=1e-06, lambda_neg=1.0, loss_base=mse, grad_clip=1.0, rationale=tv_iterative_supervised iter-15 (breast_ct). STEP x active-lambda interaction. With lambda now ACTIVE (the productive lever), re-test a larger step to see if ANY data-consistency update survives alongside the TV denoising. Earlier step probes (iters 2/3) were at DEAD lambda=1e-3 where step->0; now lambda=1.0 carries denoising and a larger step MIGHT add data-consistency instead of collapsing. ONE KNOB vs iter-12 (K=10, lambda=1.0, epochs=20, step=1e-3, hr=0.1495): tv_step_init 1e-3->3e-3. HYPOTHESIS: at 3e-3 the per-iter data-gradient update is large enough to refine data-consistency (not just TV-smooth) so hr rises above 0.1495; iter-1 showed 1e-2 diverges, so 3e-3 is the untested middle. FALSIFIER: if step still collapses to ~0 (hr~0.15) OR diverges (hr drops), data-consistency is structurally unavailable and TV-denoising ~0.15 is the ceiling. BUDGET: iter-12 epochs=20 under wall.
16	671da566	0.957617	0.149455	keep	architecture	tv_iterative_supervised-claude-agentic	claude-opus-4-8-1m	37.7303	4.434981e-03	722.8	2e-05	tv_iterative_supervised-claude-agentic: val_n=200, val_chunk=5, train_n=400, epochs=20, batch_size=1, lr=0.005, tv_K=10, tv_step_init=0.001, tv_lambda_init=1.0, tv_share_steps=False, tv_eps=1e-06, lambda_neg=1.0, loss_base=mse, grad_clip=10.0, rationale=tv_iterative_supervised iter-16 (breast_ct). GRAD_CLIP loosen. The 20 log-scalars are trained under grad_clip=1.0 which may throttle the lambda schedule's growth (lambda climbs to ~3400 -- large log-space moves that clipping could slow). ONE KNOB vs iter-12 (hr=0.1495): grad_clip 1.0->10.0. HYPOTHESIS: looser clipping lets the lambda schedule reach its operating point faster/further within the epoch budget so hr rises above 0.1495. FALSIFIER: hr ~0.15 -> clipping wasn't the limiter, ceiling confirmed. BUDGET: iter-12 under wall.
17	671da566	0.955909	0.13509	keep	architecture	tv_iterative_supervised-claude-agentic	claude-opus-4-8-1m	37.5848	4.509887e-03	1281.2	2e-05	tv_iterative_supervised-claude-agentic: val_n=200, val_chunk=5, train_n=400, epochs=20, batch_size=1, lr=0.001, tv_K=10, tv_step_init=0.001, tv_lambda_init=1.0, tv_share_steps=False, tv_eps=1e-06, lambda_neg=1.0, loss_base=mse, grad_clip=1.0, rationale=tv_iterative_supervised iter-17 (breast_ct). OUTER-LR lower (finer convergence). iter-7 (lr=5e-2) drove step->0 faster (hr0 at dead lambda); now with active lambda=1.0, a LOWER lr may let the scalars settle into a finer lambda schedule minimum. ONE KNOB vs iter-12 (lr=5e-3, hr=0.1495): lr 5e-3->1e-3 (epochs=20 gives room to converge at the lower lr). HYPOTHESIS: finer optimisation steps find a slightly better per-iter lambda profile so hr edges above 0.1495. FALSIFIER: hr <=0.15 -> optimisation-converged, ceiling confirmed. BUDGET: iter-12 under wall.
18	671da566	0.957762	0.150095	keep	architecture	tv_iterative_supervised-claude-agentic	claude-opus-4-8-1m	37.7368	4.431645e-03	823.7	2e-05	tv_iterative_supervised-claude-agentic: val_n=200, val_chunk=5, train_n=400, epochs=20, batch_size=1, lr=0.005, tv_K=10, tv_step_init=0.001, tv_lambda_init=0.5, tv_share_steps=False, tv_eps=1e-06, lambda_neg=1.0, loss_base=mse, grad_clip=1.0, rationale=tv_iterative_supervised iter-18 (breast_ct). LAMBDA peak bisection (low side). Lambda axis mapped: 0.05->0.1195, 0.2->0.1462, 1.0->0.1495(ep20 best), 5.0->0.0015(over-smooth collapse). Peak bracketed between 0.2 and 5.0, near 1.0. ONE KNOB vs iter-12 (lambda=1.0, ep20, hr=0.1495): tv_lambda_init 1.0->0.5. HYPOTHESIS: if hr>0.1495 the peak is below 1.0 (test 0.7 next); if hr<0.1495 the peak is at/above 1.0. Refines the plateau location. FALSIFIER: hr~0.15 either way -> plateau flat, ceiling confirmed. BUDGET: iter-12 under wall.
19	671da566	0.957526	0.149262	keep	architecture	tv_iterative_supervised-claude-agentic	claude-opus-4-8-1m	37.7283	4.435991e-03	1582.3	2e-05	tv_iterative_supervised-claude-agentic: val_n=200, val_chunk=5, train_n=400, epochs=30, batch_size=1, lr=0.005, tv_K=10, tv_step_init=0.001, tv_lambda_init=1.0, tv_share_steps=False, tv_eps=1e-06, lambda_neg=1.0, loss_base=mse, grad_clip=1.0, rationale=tv_iterative_supervised iter-19 (breast_ct). EPOCHS edge (deeper convergence). epochs 10->20 lifted hr 0.1471->0.1495 (tiny). Test whether more epochs keep helping. ONE KNOB vs iter-12 (epochs=20): epochs 20->30. HYPOTHESIS: if hr keeps rising the schedule is still under-converged; if it saturates ~0.15 the plateau/ceiling is confirmed converged. BUDGET: epochs=30 at K=10 ~ 1.5x iter-12 train; iter-12 ran comfortably under wall so ~1100-1150s, watch the wall (fallback val_n cut if needed).
20	671da566	0.9576	0.149368	keep	architecture	tv_iterative_supervised-claude-agentic	claude-opus-4-8-1m	37.7294	4.435437e-03	597.3	1.2e-05	tv_iterative_supervised-claude-agentic: val_n=200, val_chunk=5, train_n=400, epochs=20, batch_size=1, lr=0.005, tv_K=6, tv_step_init=0.001, tv_lambda_init=1.0, tv_share_steps=False, tv_eps=1e-06, lambda_neg=1.0, loss_base=mse, grad_clip=1.0, rationale=tv_iterative_supervised iter-20 (breast_ct). K LOW edge (final). Depth UP falsified twice (K30/K50 collapse). Test K DOWN: fewer TV passes = less smoothing, may retain more fine breast structure. ONE KNOB vs iter-12 (K=10, ep20, hr=0.1495): tv_K 10->6. HYPOTHESIS: if hr>0.1495 the K=10 smoothing was slightly too much and fewer passes preserve structure; if hr<0.1495 K=10 was optimal. Closes the K axis low edge. This is the HARD-STOP iter-20. BUDGET: K=6 < K=10 -> faster, under wall.
