{"advice_for_others": "fastdiff_wdm_wavelet_unconstrained-claude-agentic: val_n=200, seed=43, fd_recon_ckpt=/cluster/maier/Agent4CT/checkpoints/fast_diffusion_wavelet_breast.pt, fd_recon_steps=8, fd_recon_init=fbp, fd_recon_init_t=0.45, fd_recon_eta=0.0, fd_recon_dc=0, fd_recon_dc_n_cg=5, fd_recon_dc_relax=0.5, dataset_kind=breast_ct, rationale=iter-15 SEED VARIANCE #1 at converged best (t0.45 eta0 steps8 DC-off); seed 43 for final mean+/-std. hr expected 0.", "agent": "fastdiff_wdm_wavelet_unconstrained-claude-agentic", "campaign": "search-20260703-01", "cfg_full": {"dataset_kind": "breast_ct", "fd_recon_ckpt": "/cluster/maier/Agent4CT/checkpoints/fast_diffusion_wavelet_breast.pt", "fd_recon_dc": 0, "fd_recon_dc_n_cg": 5, "fd_recon_dc_relax": 0.5, "fd_recon_eta": 0.0, "fd_recon_init": "fbp", "fd_recon_init_t": 0.45, "fd_recon_steps": 8, "rationale": "iter-15 SEED VARIANCE #1 at converged best (t0.45 eta0 steps8 DC-off); seed 43 for final mean+/-std. hr expected 0.", "seed": 43, "val_n": 200}, "challenge": "breast_ct", "change_class": "architecture", "git_commit": "671da566", "images": {"comparison": "runs/breast-ct-claude-agentic-fastdiff-wdm-wavelet-unconstrained-search-20260703-01/iterations/iter-0015/comparison.png", "test_showcase": null, "valtest_showcase": null}, "iter": 15, "kept": false, "metrics": {"headroom": 0.0, "headroom_std": 0.0, "val_psnr": 29.620014190673828, "val_psnr_std": 0.9936608575475615, "val_rmse": 0.011282459832727909, "val_rmse_std": 0.0012016790498991542, "val_ssim": 0.936936616897583, "val_ssim_std": 0.012595480648860773}, "model": "claude-opus-4-8-1m", "obs_path": "breast-ct-claude-agentic-fastdiff-wdm-wavelet-unconstrained-search-20260703-01/iterations/iter-0015/observation.json", "obs_sha1": "e67c15218f99f939b9629e714ffd511c76fd0c0d", "params_M": 3.824908, "params_source": "observation", "rationale": "fastdiff_wdm_wavelet_unconstrained-claude-agentic: val_n=200, seed=43, fd_recon_ckpt=/cluster/maier/Agent4CT/checkpoints/fast_diffusion_wavelet_breast.pt, fd_recon_steps=8, fd_recon_init=fbp, fd_recon_init_t=0.45, fd_recon_eta=0.0, fd_recon_dc=0, fd_recon_dc_n_cg=5, fd_recon_dc_relax=0.5, dataset_kind=breast_ct, rationale=iter-15 SEED VARIANCE #1 at converged best (t0.45 eta0 steps8 DC-off); seed 43 for final mean+/-std. hr expected 0.", "run_id": "breast-ct-claude-agentic-fastdiff-wdm-wavelet-unconstrained-search-20260703-01", "runtime": {"elapsed_s": 77.4469382762909}, "schema_version": 3, "solver_key": "fastdiff-wdm-wavelet-unconstrained", "solver_name": "Fast-diffusion WDM (wavelet, unconstrained)", "split": {"train_n": 3600, "val_n": 200}, "status": "discard", "ts": "2026-07-07T04:18:14Z"}
{"advice_for_others": "fastdiff_wdm_wavelet_unconstrained-claude-agentic: val_n=200, seed=44, fd_recon_ckpt=/cluster/maier/Agent4CT/checkpoints/fast_diffusion_wavelet_breast.pt, fd_recon_steps=8, fd_recon_init=fbp, fd_recon_init_t=0.45, fd_recon_eta=0.0, fd_recon_dc=0, fd_recon_dc_n_cg=5, fd_recon_dc_relax=0.5, dataset_kind=breast_ct, rationale=iter-16 SEED VARIANCE #2 seed 44 at best config. DC OFF. hr expected 0.", "agent": "fastdiff_wdm_wavelet_unconstrained-claude-agentic", "campaign": "search-20260703-01", "cfg_full": {"dataset_kind": "breast_ct", "fd_recon_ckpt": "/cluster/maier/Agent4CT/checkpoints/fast_diffusion_wavelet_breast.pt", "fd_recon_dc": 0, "fd_recon_dc_n_cg": 5, "fd_recon_dc_relax": 0.5, "fd_recon_eta": 0.0, "fd_recon_init": "fbp", "fd_recon_init_t": 0.45, "fd_recon_steps": 8, "rationale": "iter-16 SEED VARIANCE #2 seed 44 at best config. DC OFF. hr expected 0.", "seed": 44, "val_n": 200}, "challenge": "breast_ct", "change_class": "architecture", "git_commit": "671da566", "images": {"comparison": "runs/breast-ct-claude-agentic-fastdiff-wdm-wavelet-unconstrained-search-20260703-01/iterations/iter-0016/comparison.png", "test_showcase": null, "valtest_showcase": null}, "iter": 16, "kept": false, "metrics": {"headroom": 0.0, "headroom_std": 0.0, "val_psnr": 29.623565673828125, "val_psnr_std": 0.9952547279999302, "val_rmse": 0.011277846060693264, "val_rmse_std": 0.0012045479801567544, "val_ssim": 0.9370037913322449, "val_ssim_std": 0.012470292369379367}, "model": "claude-opus-4-8-1m", "obs_path": "breast-ct-claude-agentic-fastdiff-wdm-wavelet-unconstrained-search-20260703-01/iterations/iter-0016/observation.json", "obs_sha1": "cf6a716f9222163258c42b7799e161c55467f6e7", "params_M": 3.824908, "params_source": "observation", "rationale": "fastdiff_wdm_wavelet_unconstrained-claude-agentic: val_n=200, seed=44, fd_recon_ckpt=/cluster/maier/Agent4CT/checkpoints/fast_diffusion_wavelet_breast.pt, fd_recon_steps=8, fd_recon_init=fbp, fd_recon_init_t=0.45, fd_recon_eta=0.0, fd_recon_dc=0, fd_recon_dc_n_cg=5, fd_recon_dc_relax=0.5, dataset_kind=breast_ct, rationale=iter-16 SEED VARIANCE #2 seed 44 at best config. DC OFF. hr expected 0.", "run_id": "breast-ct-claude-agentic-fastdiff-wdm-wavelet-unconstrained-search-20260703-01", "runtime": {"elapsed_s": 77.41047358512878}, "schema_version": 3, "solver_key": "fastdiff-wdm-wavelet-unconstrained", "solver_name": "Fast-diffusion WDM (wavelet, unconstrained)", "split": {"train_n": 3600, "val_n": 200}, "status": "discard", "ts": "2026-07-07T04:19:47Z"}
{"advice_for_others": "fastdiff_wdm_wavelet_unconstrained-claude-agentic: val_n=200, seed=45, fd_recon_ckpt=/cluster/maier/Agent4CT/checkpoints/fast_diffusion_wavelet_breast.pt, fd_recon_steps=8, fd_recon_init=fbp, fd_recon_init_t=0.45, fd_recon_eta=0.0, fd_recon_dc=0, fd_recon_dc_n_cg=5, fd_recon_dc_relax=0.5, dataset_kind=breast_ct, rationale=iter-17 SEED VARIANCE #3 seed 45 at best config. DC OFF. hr expected 0.", "agent": "fastdiff_wdm_wavelet_unconstrained-claude-agentic", "campaign": "search-20260703-01", "cfg_full": {"dataset_kind": "breast_ct", "fd_recon_ckpt": "/cluster/maier/Agent4CT/checkpoints/fast_diffusion_wavelet_breast.pt", "fd_recon_dc": 0, "fd_recon_dc_n_cg": 5, "fd_recon_dc_relax": 0.5, "fd_recon_eta": 0.0, "fd_recon_init": "fbp", "fd_recon_init_t": 0.45, "fd_recon_steps": 8, "rationale": "iter-17 SEED VARIANCE #3 seed 45 at best config. DC OFF. hr expected 0.", "seed": 45, "val_n": 200}, "challenge": "breast_ct", "change_class": "architecture", "git_commit": "671da566", "images": {"comparison": "runs/breast-ct-claude-agentic-fastdiff-wdm-wavelet-unconstrained-search-20260703-01/iterations/iter-0017/comparison.png", "test_showcase": null, "valtest_showcase": null}, "iter": 17, "kept": false, "metrics": {"headroom": 0.0, "headroom_std": 0.0, "val_psnr": 29.628204345703125, "val_psnr_std": 0.9916176321123131, "val_rmse": 0.0112718241289258, "val_rmse_std": 0.0012006893858860586, "val_ssim": 0.9370124340057373, "val_ssim_std": 0.012451566471070647}, "model": "claude-opus-4-8-1m", "obs_path": "breast-ct-claude-agentic-fastdiff-wdm-wavelet-unconstrained-search-20260703-01/iterations/iter-0017/observation.json", "obs_sha1": "b471ae9402e91c05809107ef04aa8d4ecc90bb4f", "params_M": 3.824908, "params_source": "observation", "rationale": "fastdiff_wdm_wavelet_unconstrained-claude-agentic: val_n=200, seed=45, fd_recon_ckpt=/cluster/maier/Agent4CT/checkpoints/fast_diffusion_wavelet_breast.pt, fd_recon_steps=8, fd_recon_init=fbp, fd_recon_init_t=0.45, fd_recon_eta=0.0, fd_recon_dc=0, fd_recon_dc_n_cg=5, fd_recon_dc_relax=0.5, dataset_kind=breast_ct, rationale=iter-17 SEED VARIANCE #3 seed 45 at best config. DC OFF. hr expected 0.", "run_id": "breast-ct-claude-agentic-fastdiff-wdm-wavelet-unconstrained-search-20260703-01", "runtime": {"elapsed_s": 83.08565616607666}, "schema_version": 3, "solver_key": "fastdiff-wdm-wavelet-unconstrained", "solver_name": "Fast-diffusion WDM (wavelet, unconstrained)", "split": {"train_n": 3600, "val_n": 200}, "status": "discard", "ts": "2026-07-07T04:21:26Z"}
{"advice_for_others": "fastdiff_wdm_wavelet_unconstrained-claude-agentic: val_n=200, seed=46, fd_recon_ckpt=/cluster/maier/Agent4CT/checkpoints/fast_diffusion_wavelet_breast.pt, fd_recon_steps=8, fd_recon_init=fbp, fd_recon_init_t=0.45, fd_recon_eta=0.0, fd_recon_dc=0, fd_recon_dc_n_cg=5, fd_recon_dc_relax=0.5, dataset_kind=breast_ct, rationale=iter-18 SEED VARIANCE #4 seed 46 at best config. DC OFF. hr expected 0.", "agent": "fastdiff_wdm_wavelet_unconstrained-claude-agentic", "campaign": "search-20260703-01", "cfg_full": {"dataset_kind": "breast_ct", "fd_recon_ckpt": "/cluster/maier/Agent4CT/checkpoints/fast_diffusion_wavelet_breast.pt", "fd_recon_dc": 0, "fd_recon_dc_n_cg": 5, "fd_recon_dc_relax": 0.5, "fd_recon_eta": 0.0, "fd_recon_init": "fbp", "fd_recon_init_t": 0.45, "fd_recon_steps": 8, "rationale": "iter-18 SEED VARIANCE #4 seed 46 at best config. DC OFF. hr expected 0.", "seed": 46, "val_n": 200}, "challenge": "breast_ct", "change_class": "architecture", "git_commit": "671da566", "images": {"comparison": "runs/breast-ct-claude-agentic-fastdiff-wdm-wavelet-unconstrained-search-20260703-01/iterations/iter-0018/comparison.png", "test_showcase": null, "valtest_showcase": null}, "iter": 18, "kept": false, "metrics": {"headroom": 0.0, "headroom_std": 0.0, "val_psnr": 29.626312255859375, "val_psnr_std": 0.9912581346234113, "val_rmse": 0.01127428375184536, "val_rmse_std": 0.0011988709267886323, "val_ssim": 0.9370551109313965, "val_ssim_std": 0.012711568539501353}, "model": "claude-opus-4-8-1m", "obs_path": "breast-ct-claude-agentic-fastdiff-wdm-wavelet-unconstrained-search-20260703-01/iterations/iter-0018/observation.json", "obs_sha1": "dc2c2adcb8245608e5b860296075dfa80b09cd1d", "params_M": 3.824908, "params_source": "observation", "rationale": "fastdiff_wdm_wavelet_unconstrained-claude-agentic: val_n=200, seed=46, fd_recon_ckpt=/cluster/maier/Agent4CT/checkpoints/fast_diffusion_wavelet_breast.pt, fd_recon_steps=8, fd_recon_init=fbp, fd_recon_init_t=0.45, fd_recon_eta=0.0, fd_recon_dc=0, fd_recon_dc_n_cg=5, fd_recon_dc_relax=0.5, dataset_kind=breast_ct, rationale=iter-18 SEED VARIANCE #4 seed 46 at best config. DC OFF. hr expected 0.", "run_id": "breast-ct-claude-agentic-fastdiff-wdm-wavelet-unconstrained-search-20260703-01", "runtime": {"elapsed_s": 81.88735508918762}, "schema_version": 3, "solver_key": "fastdiff-wdm-wavelet-unconstrained", "solver_name": "Fast-diffusion WDM (wavelet, unconstrained)", "split": {"train_n": 3600, "val_n": 200}, "status": "discard", "ts": "2026-07-07T04:23:08Z"}
{"advice_for_others": "fastdiff_wdm_wavelet_unconstrained-claude-agentic: val_n=200, seed=47, fd_recon_ckpt=/cluster/maier/Agent4CT/checkpoints/fast_diffusion_wavelet_breast.pt, fd_recon_steps=8, fd_recon_init=fbp, fd_recon_init_t=0.45, fd_recon_eta=0.0, fd_recon_dc=0, fd_recon_dc_n_cg=5, fd_recon_dc_relax=0.5, dataset_kind=breast_ct, rationale=iter-19 SEED VARIANCE #5 seed 47 at best config. DC OFF. hr expected 0.", "agent": "fastdiff_wdm_wavelet_unconstrained-claude-agentic", "campaign": "search-20260703-01", "cfg_full": {"dataset_kind": "breast_ct", "fd_recon_ckpt": "/cluster/maier/Agent4CT/checkpoints/fast_diffusion_wavelet_breast.pt", "fd_recon_dc": 0, "fd_recon_dc_n_cg": 5, "fd_recon_dc_relax": 0.5, "fd_recon_eta": 0.0, "fd_recon_init": "fbp", "fd_recon_init_t": 0.45, "fd_recon_steps": 8, "rationale": "iter-19 SEED VARIANCE #5 seed 47 at best config. DC OFF. hr expected 0.", "seed": 47, "val_n": 200}, "challenge": "breast_ct", "change_class": "architecture", "git_commit": "671da566", "images": {"comparison": "runs/breast-ct-claude-agentic-fastdiff-wdm-wavelet-unconstrained-search-20260703-01/iterations/iter-0019/comparison.png", "test_showcase": null, "valtest_showcase": null}, "iter": 19, "kept": false, "metrics": {"headroom": 0.0, "headroom_std": 0.0, "val_psnr": 29.621166229248047, "val_psnr_std": 0.9959548384677369, "val_rmse": 0.011280961334705353, "val_rmse_std": 0.001202823439259709, "val_ssim": 0.9373195171356201, "val_ssim_std": 0.012483621359690037}, "model": "claude-opus-4-8-1m", "obs_path": "breast-ct-claude-agentic-fastdiff-wdm-wavelet-unconstrained-search-20260703-01/iterations/iter-0019/observation.json", "obs_sha1": "18495c25e2d380807057cf3ccb99308598c835be", "params_M": 3.824908, "params_source": "observation", "rationale": "fastdiff_wdm_wavelet_unconstrained-claude-agentic: val_n=200, seed=47, fd_recon_ckpt=/cluster/maier/Agent4CT/checkpoints/fast_diffusion_wavelet_breast.pt, fd_recon_steps=8, fd_recon_init=fbp, fd_recon_init_t=0.45, fd_recon_eta=0.0, fd_recon_dc=0, fd_recon_dc_n_cg=5, fd_recon_dc_relax=0.5, dataset_kind=breast_ct, rationale=iter-19 SEED VARIANCE #5 seed 47 at best config. DC OFF. hr expected 0.", "run_id": "breast-ct-claude-agentic-fastdiff-wdm-wavelet-unconstrained-search-20260703-01", "runtime": {"elapsed_s": 81.18145322799683}, "schema_version": 3, "solver_key": "fastdiff-wdm-wavelet-unconstrained", "solver_name": "Fast-diffusion WDM (wavelet, unconstrained)", "split": {"train_n": 3600, "val_n": 200}, "status": "discard", "ts": "2026-07-07T04:24:39Z"}
{"advice_for_others": "fastdiff_wdm_wavelet_unconstrained-claude-agentic: val_n=200, seed=48, fd_recon_ckpt=/cluster/maier/Agent4CT/checkpoints/fast_diffusion_wavelet_breast.pt, fd_recon_steps=8, fd_recon_init=fbp, fd_recon_init_t=0.45, fd_recon_eta=0.0, fd_recon_dc=0, fd_recon_dc_n_cg=5, fd_recon_dc_relax=0.5, dataset_kind=breast_ct, rationale=iter-20 FINAL seed 48 at converged best config (t0.45 eta0 steps8 DC-off); closes the 20-iter search. hr expected 0 -- prior WITHOUT DC cannot clear the sparse-view calibrated FBP baseline.", "agent": "fastdiff_wdm_wavelet_unconstrained-claude-agentic", "campaign": "search-20260703-01", "cfg_full": {"dataset_kind": "breast_ct", "fd_recon_ckpt": "/cluster/maier/Agent4CT/checkpoints/fast_diffusion_wavelet_breast.pt", "fd_recon_dc": 0, "fd_recon_dc_n_cg": 5, "fd_recon_dc_relax": 0.5, "fd_recon_eta": 0.0, "fd_recon_init": "fbp", "fd_recon_init_t": 0.45, "fd_recon_steps": 8, "rationale": "iter-20 FINAL seed 48 at converged best config (t0.45 eta0 steps8 DC-off); closes the 20-iter search. hr expected 0 -- prior WITHOUT DC cannot clear the sparse-view calibrated FBP baseline.", "seed": 48, "val_n": 200}, "challenge": "breast_ct", "change_class": "architecture", "git_commit": "671da566", "images": {"comparison": "runs/breast-ct-claude-agentic-fastdiff-wdm-wavelet-unconstrained-search-20260703-01/iterations/iter-0020/comparison.png", "test_showcase": null, "valtest_showcase": null}, "iter": 20, "kept": false, "metrics": {"headroom": 0.0, "headroom_std": 0.0, "val_psnr": 29.627578735351562, "val_psnr_std": 1.003913530690114, "val_rmse": 0.01127263717353344, "val_rmse_std": 0.0012113966408817244, "val_ssim": 0.9372475743293762, "val_ssim_std": 0.012362279258288726}, "model": "claude-opus-4-8-1m", "obs_path": "breast-ct-claude-agentic-fastdiff-wdm-wavelet-unconstrained-search-20260703-01/iterations/iter-0020/observation.json", "obs_sha1": "f921b35f95293f072ee6f1ede89fadca7160d2c3", "params_M": 3.824908, "params_source": "observation", "rationale": "fastdiff_wdm_wavelet_unconstrained-claude-agentic: val_n=200, seed=48, fd_recon_ckpt=/cluster/maier/Agent4CT/checkpoints/fast_diffusion_wavelet_breast.pt, fd_recon_steps=8, fd_recon_init=fbp, fd_recon_init_t=0.45, fd_recon_eta=0.0, fd_recon_dc=0, fd_recon_dc_n_cg=5, fd_recon_dc_relax=0.5, dataset_kind=breast_ct, rationale=iter-20 FINAL seed 48 at converged best config (t0.45 eta0 steps8 DC-off); closes the 20-iter search. hr expected 0 -- prior WITHOUT DC cannot clear the sparse-view calibrated FBP baseline.", "run_id": "breast-ct-claude-agentic-fastdiff-wdm-wavelet-unconstrained-search-20260703-01", "runtime": {"elapsed_s": 81.65150737762451}, "schema_version": 3, "solver_key": "fastdiff-wdm-wavelet-unconstrained", "solver_name": "Fast-diffusion WDM (wavelet, unconstrained)", "split": {"train_n": 3600, "val_n": 200}, "status": "discard", "ts": "2026-07-07T04:26:12Z"}
{"advice_for_others": "hammernik_2017-claude-agentic: vn_T=3, vn_n_filters=16, vn_kernel=9, vn_n_bumps=31, vn_x_range=2.0, vn_filter_init_std=0.05, vn_rbf_init_std=0.01, vn_lambda_init=0.0097, epochs=30, batch_size=2, lr=0.00096, grad_clip=1.0, train_n=400, val_n=200, seed=42, max_train_s=1000, rationale=iter-1 FEASIBILITY seed for Hammernik-2017 on the REDONE Breast-CT split (train3600/val200/test200). Seeded from the prior breast TPE optimum (search-20260521-01 iter-15: hr=0.4549 val-only, ep=30 lr=9.6e-4 T=3 filters=16 kernel=9 lambda_init=9.7e-3 batch=2). HYPOTHESIS: this known-good VN config clears the ~0.84 breast LD-FBP floor and reproduces hr~0.45 on the new val200 split. If I re-use the strongest known config I expect hr>0 (recon beats FBP) because this architecture already cleared baseline on breast. train_n=400 for agentic signal, val_n=200 full held-out val, batch_size=2 conservative to avoid 512px OOM in the RBF-bump loop. max_train_s=1000 keeps train+score under the 20-min budget.", "agent": "hammernik_2017-claude-agentic", "campaign": "search-20260703-01", "cfg_full": {"batch_size": 2, "epochs": 30, "grad_clip": 1.0, "lr": 0.00096, "max_train_s": 1000, "rationale": "iter-1 FEASIBILITY seed for Hammernik-2017 on the REDONE Breast-CT split (train3600/val200/test200). Seeded from the prior breast TPE optimum (search-20260521-01 iter-15: hr=0.4549 val-only, ep=30 lr=9.6e-4 T=3 filters=16 kernel=9 lambda_init=9.7e-3 batch=2). HYPOTHESIS: this known-good VN config clears the ~0.84 breast LD-FBP floor and reproduces hr~0.45 on the new val200 split. If I re-use the strongest known config I expect hr>0 (recon beats FBP) because this architecture already cleared baseline on breast. train_n=400 for agentic signal, val_n=200 full held-out val, batch_size=2 conservative to avoid 512px OOM in the RBF-bump loop. max_train_s=1000 keeps train+score under the 20-min budget.", "seed": 42, "train_n": 400, "val_n": 200, "vn_T": 3, "vn_filter_init_std": 0.05, "vn_kernel": 9, "vn_lambda_init": 0.0097, "vn_n_bumps": 31, "vn_n_filters": 16, "vn_rbf_init_std": 0.01, "vn_x_range": 2.0}, "challenge": "breast_ct", "change_class": "architecture", "git_commit": null, "images": {"comparison": "runs/breast-ct-claude-agentic-hammernik-2017-search-20260703-01/iterations/iter-0001/comparison.png", "test_showcase": null, "valtest_showcase": null}, "iter": 1, "kept": true, "metrics": {"headroom": 0.5776874925095516, "headroom_std": 0.012071133039414707, "val_psnr": 43.8115119934082, "val_psnr_std": 0.7528529712848439, "val_rmse": 0.0022020582109689713, "val_rmse_std": 0.00018966966067437857, "val_ssim": 0.9848971962928772, "val_ssim_std": 0.002346270448582568}, "model": "claude-opus-4-8-1m", "obs_path": "breast-ct-claude-agentic-hammernik-2017-search-20260703-01/iterations/iter-0001/observation.json", "obs_sha1": "fa900402ab7fc71e9516cd53f09a263bfdd373a7", "params_M": 0.005379, "params_source": "observation", "rationale": "hammernik_2017-claude-agentic: vn_T=3, vn_n_filters=16, vn_kernel=9, vn_n_bumps=31, vn_x_range=2.0, vn_filter_init_std=0.05, vn_rbf_init_std=0.01, vn_lambda_init=0.0097, epochs=30, batch_size=2, lr=0.00096, grad_clip=1.0, train_n=400, val_n=200, seed=42, max_train_s=1000, rationale=iter-1 FEASIBILITY seed for Hammernik-2017 on the REDONE Breast-CT split (train3600/val200/test200). Seeded from the prior breast TPE optimum (search-20260521-01 iter-15: hr=0.4549 val-only, ep=30 lr=9.6e-4 T=3 filters=16 kernel=9 lambda_init=9.7e-3 batch=2). HYPOTHESIS: this known-good VN config clears the ~0.84 breast LD-FBP floor and reproduces hr~0.45 on the new val200 split. If I re-use the strongest known config I expect hr>0 (recon beats FBP) because this architecture already cleared baseline on breast. train_n=400 for agentic signal, val_n=200 full held-out val, batch_size=2 conservative to avoid 512px OOM in the RBF-bump loop. max_train_s=1000 keeps train+score under the 20-min budget.", "run_id": "breast-ct-claude-agentic-hammernik-2017-search-20260703-01", "runtime": {"elapsed_s": 1084.4773497581482}, "schema_version": 3, "solver_key": "hammernik-2017", "solver_name": "Hammernik VN (2017)", "split": {"train_n": 400, "val_n": 200}, "status": "keep", "ts": "2026-07-03T22:54:17Z"}
