{"advice_for_others": "fastdiff_flow_pixel_unconstrained-claude-agentic: image_size=512, pixel_spacing=0.3516, n_angles=128, n_det=1024, det_spacing=0.35754, sod=500.0, sdd=1000.0, display_min=0.0, display_max=0.5, train_n=400, val_n=200, noise_i0=100000.0, noise_sigma_e=10.0, seed=42, fd_recon_ckpt=/cluster/maier/Agent4CT/checkpoints/fast_diffusion_pixel_breast.pt, fd_recon_steps=8, fd_recon_init=fbp, fd_recon_init_t=0.4, fd_recon_eta=0.05, fd_recon_dc=0, fd_recon_dc_n_cg=5, fd_recon_dc_relax=0.5, rationale=iter-7: DC-off breast-prior. Fix init_t=0.4. ONE KNOB eta 0.2->0.05. MONOTONIC eta trend (init_t0.4): eta1.0 PSNR24.6, eta0.5 PSNR27.0, eta0.2 PSNR28.1 (best) - lower eta = better because less overshooting measurement pull, recon converges to the prior-denoised FBP init. HYPOTHESIS: eta=0.05 (near-zero guidance) approaches pure prior-denoise of the FBP init -> PSNR edges further toward baseline, locating the eta floor. Since removing measurement guidance ENTIRELY would make it pure unconditional generation from FBP-noised init, a tiny eta is the DC-free sweet spot: it keeps a whisper of sinogram consistency without the overshoot instability. Then switch lever to steps.", "agent": "fastdiff_flow_pixel_unconstrained-claude-agentic", "campaign": "search-20260703-01", "cfg_full": {"det_spacing": 0.35754, "display_max": 0.5, "display_min": 0.0, "fd_recon_ckpt": "/cluster/maier/Agent4CT/checkpoints/fast_diffusion_pixel_breast.pt", "fd_recon_dc": 0, "fd_recon_dc_n_cg": 5, "fd_recon_dc_relax": 0.5, "fd_recon_eta": 0.05, "fd_recon_init": "fbp", "fd_recon_init_t": 0.4, "fd_recon_steps": 8, "image_size": 512, "n_angles": 128, "n_det": 1024, "noise_i0": 100000.0, "noise_sigma_e": 10.0, "pixel_spacing": 0.3516, "rationale": "iter-7: DC-off breast-prior. Fix init_t=0.4. ONE KNOB eta 0.2->0.05. MONOTONIC eta trend (init_t0.4): eta1.0 PSNR24.6, eta0.5 PSNR27.0, eta0.2 PSNR28.1 (best) - lower eta = better because less overshooting measurement pull, recon converges to the prior-denoised FBP init. HYPOTHESIS: eta=0.05 (near-zero guidance) approaches pure prior-denoise of the FBP init -> PSNR edges further toward baseline, locating the eta floor. Since removing measurement guidance ENTIRELY would make it pure unconditional generation from FBP-noised init, a tiny eta is the DC-free sweet spot: it keeps a whisper of sinogram consistency without the overshoot instability. Then switch lever to steps.", "sdd": 1000.0, "seed": 42, "sod": 500.0, "train_n": 400, "val_n": 200}, "challenge": "breast_ct", "change_class": "architecture", "git_commit": "671da566", "images": {"comparison": "runs/breast-ct-claude-agentic-fastdiff-flow-pixel-unconstrained-search-20260703-01/iterations/iter-0007/comparison.png", "test_showcase": null, "valtest_showcase": null}, "iter": 7, "kept": false, "metrics": {"headroom": 0.0, "headroom_std": 0.0, "val_psnr": 28.511886596679688, "val_psnr_std": 0.8003544987751579, "val_rmse": 0.01281769946217537, "val_rmse_std": 0.0011770518297119453, "val_ssim": 0.8220860362052917, "val_ssim_std": 0.01157279006743089}, "model": "claude-opus-4-8-1m", "obs_path": "breast-ct-claude-agentic-fastdiff-flow-pixel-unconstrained-search-20260703-01/iterations/iter-0007/observation.json", "obs_sha1": "5800b6a41b1da5fef8d430840fa3467a06eb80e8", "params_M": 3.822787, "params_source": "observation", "rationale": "fastdiff_flow_pixel_unconstrained-claude-agentic: image_size=512, pixel_spacing=0.3516, n_angles=128, n_det=1024, det_spacing=0.35754, sod=500.0, sdd=1000.0, display_min=0.0, display_max=0.5, train_n=400, val_n=200, noise_i0=100000.0, noise_sigma_e=10.0, seed=42, fd_recon_ckpt=/cluster/maier/Agent4CT/checkpoints/fast_diffusion_pixel_breast.pt, fd_recon_steps=8, fd_recon_init=fbp, fd_recon_init_t=0.4, fd_recon_eta=0.05, fd_recon_dc=0, fd_recon_dc_n_cg=5, fd_recon_dc_relax=0.5, rationale=iter-7: DC-off breast-prior. Fix init_t=0.4. ONE KNOB eta 0.2->0.05. MONOTONIC eta trend (init_t0.4): eta1.0 PSNR24.6, eta0.5 PSNR27.0, eta0.2 PSNR28.1 (best) - lower eta = better because less overshooting measurement pull, recon converges to the prior-denoised FBP init. HYPOTHESIS: eta=0.05 (near-zero guidance) approaches pure prior-denoise of the FBP init -> PSNR edges further toward baseline, locating the eta floor. Since removing measurement guidance ENTIRELY would make it pure unconditional generation from FBP-noised init, a tiny eta is the DC-free sweet spot: it keeps a whisper of sinogram consistency without the overshoot instability. Then switch lever to steps.", "run_id": "breast-ct-claude-agentic-fastdiff-flow-pixel-unconstrained-search-20260703-01", "runtime": {"elapsed_s": 136.54525709152222}, "schema_version": 3, "solver_key": "fastdiff-flow-pixel-unconstrained", "solver_name": "Fast-diffusion flow (pixel, unconstrained)", "split": {"train_n": 3600, "val_n": 200}, "status": "discard", "ts": "2026-07-06T20:38:54Z"}
{"advice_for_others": "fastdiff_flow_pixel_unconstrained-claude-agentic: image_size=512, pixel_spacing=0.3516, n_angles=128, n_det=1024, det_spacing=0.35754, sod=500.0, sdd=1000.0, display_min=0.0, display_max=0.5, train_n=400, val_n=200, noise_i0=100000.0, noise_sigma_e=10.0, seed=42, fd_recon_ckpt=/cluster/maier/Agent4CT/checkpoints/fast_diffusion_pixel_breast.pt, fd_recon_steps=16, fd_recon_init=fbp, fd_recon_init_t=0.4, fd_recon_eta=0.1, fd_recon_dc=0, fd_recon_dc_n_cg=5, fd_recon_dc_relax=0.5, rationale=iter-8: DC-off breast-prior. Switch lever to STEPS (NFE). Hold near-best init_t=0.4, eta=0.1 (eta plateaued: iter-6 eta0.2 PSNR28.1, iter-7 eta0.05 PSNR28.5 - diminishing, so eta~0.1 is the practical floor). ONE KNOB steps 8->16. PRIOR: eta sweep found lower=better but flattening; init_t optimum ~0.4. HYPOTHESIS: doubling Euler steps 8->16 gives finer flow-ODE integration -> the prior denoises the FBP-init more accurately -> PSNR edges up. NOTE eta=0.1 is a small config move vs iter-7's 0.05 but the PRIMARY knob is steps; eta 0.05->0.1 is within the plateaued flat region (rounding to a stable midpoint), so steps remains the interpretable single lever. Best PSNR so far 28.5 is still 7.8dB under the 128-view FBP baseline (36.3) - hr=0 firmly, as expected for DC-off.", "agent": "fastdiff_flow_pixel_unconstrained-claude-agentic", "campaign": "search-20260703-01", "cfg_full": {"det_spacing": 0.35754, "display_max": 0.5, "display_min": 0.0, "fd_recon_ckpt": "/cluster/maier/Agent4CT/checkpoints/fast_diffusion_pixel_breast.pt", "fd_recon_dc": 0, "fd_recon_dc_n_cg": 5, "fd_recon_dc_relax": 0.5, "fd_recon_eta": 0.1, "fd_recon_init": "fbp", "fd_recon_init_t": 0.4, "fd_recon_steps": 16, "image_size": 512, "n_angles": 128, "n_det": 1024, "noise_i0": 100000.0, "noise_sigma_e": 10.0, "pixel_spacing": 0.3516, "rationale": "iter-8: DC-off breast-prior. Switch lever to STEPS (NFE). Hold near-best init_t=0.4, eta=0.1 (eta plateaued: iter-6 eta0.2 PSNR28.1, iter-7 eta0.05 PSNR28.5 - diminishing, so eta~0.1 is the practical floor). ONE KNOB steps 8->16. PRIOR: eta sweep found lower=better but flattening; init_t optimum ~0.4. HYPOTHESIS: doubling Euler steps 8->16 gives finer flow-ODE integration -> the prior denoises the FBP-init more accurately -> PSNR edges up. NOTE eta=0.1 is a small config move vs iter-7's 0.05 but the PRIMARY knob is steps; eta 0.05->0.1 is within the plateaued flat region (rounding to a stable midpoint), so steps remains the interpretable single lever. Best PSNR so far 28.5 is still 7.8dB under the 128-view FBP baseline (36.3) - hr=0 firmly, as expected for DC-off.", "sdd": 1000.0, "seed": 42, "sod": 500.0, "train_n": 400, "val_n": 200}, "challenge": "breast_ct", "change_class": "architecture", "git_commit": "671da566", "images": {"comparison": "runs/breast-ct-claude-agentic-fastdiff-flow-pixel-unconstrained-search-20260703-01/iterations/iter-0008/comparison.png", "test_showcase": null, "valtest_showcase": null}, "iter": 8, "kept": false, "metrics": {"headroom": 0.0, "headroom_std": 0.0, "val_psnr": 28.281818389892578, "val_psnr_std": 0.9101134795651007, "val_rmse": 0.013161749579012394, "val_rmse_std": 0.001352547747370835, "val_ssim": 0.8298014402389526, "val_ssim_std": 0.011313467349782159}, "model": "claude-opus-4-8-1m", "obs_path": "breast-ct-claude-agentic-fastdiff-flow-pixel-unconstrained-search-20260703-01/iterations/iter-0008/observation.json", "obs_sha1": "bf260a4a8d3984379aeacfb8ba19018a3eeb92fe", "params_M": 3.822787, "params_source": "observation", "rationale": "fastdiff_flow_pixel_unconstrained-claude-agentic: image_size=512, pixel_spacing=0.3516, n_angles=128, n_det=1024, det_spacing=0.35754, sod=500.0, sdd=1000.0, display_min=0.0, display_max=0.5, train_n=400, val_n=200, noise_i0=100000.0, noise_sigma_e=10.0, seed=42, fd_recon_ckpt=/cluster/maier/Agent4CT/checkpoints/fast_diffusion_pixel_breast.pt, fd_recon_steps=16, fd_recon_init=fbp, fd_recon_init_t=0.4, fd_recon_eta=0.1, fd_recon_dc=0, fd_recon_dc_n_cg=5, fd_recon_dc_relax=0.5, rationale=iter-8: DC-off breast-prior. Switch lever to STEPS (NFE). Hold near-best init_t=0.4, eta=0.1 (eta plateaued: iter-6 eta0.2 PSNR28.1, iter-7 eta0.05 PSNR28.5 - diminishing, so eta~0.1 is the practical floor). ONE KNOB steps 8->16. PRIOR: eta sweep found lower=better but flattening; init_t optimum ~0.4. HYPOTHESIS: doubling Euler steps 8->16 gives finer flow-ODE integration -> the prior denoises the FBP-init more accurately -> PSNR edges up. NOTE eta=0.1 is a small config move vs iter-7's 0.05 but the PRIMARY knob is steps; eta 0.05->0.1 is within the plateaued flat region (rounding to a stable midpoint), so steps remains the interpretable single lever. Best PSNR so far 28.5 is still 7.8dB under the 128-view FBP baseline (36.3) - hr=0 firmly, as expected for DC-off.", "run_id": "breast-ct-claude-agentic-fastdiff-flow-pixel-unconstrained-search-20260703-01", "runtime": {"elapsed_s": 250.88120245933533}, "schema_version": 3, "solver_key": "fastdiff-flow-pixel-unconstrained", "solver_name": "Fast-diffusion flow (pixel, unconstrained)", "split": {"train_n": 3600, "val_n": 200}, "status": "discard", "ts": "2026-07-06T20:43:51Z"}
{"advice_for_others": "fastdiff_flow_pixel_unconstrained-claude-agentic: image_size=512, pixel_spacing=0.3516, n_angles=128, n_det=1024, det_spacing=0.35754, sod=500.0, sdd=1000.0, display_min=0.0, display_max=0.5, train_n=400, val_n=200, noise_i0=100000.0, noise_sigma_e=10.0, seed=42, fd_recon_ckpt=/cluster/maier/Agent4CT/checkpoints/fast_diffusion_pixel_breast.pt, fd_recon_steps=8, fd_recon_init=fbp, fd_recon_init_t=0.3, fd_recon_eta=0.1, fd_recon_dc=0, fd_recon_dc_n_cg=5, fd_recon_dc_relax=0.5, rationale=iter-9: DC-off breast-prior. Back to steps=8 (iter-8 steps=16 gave NO PSNR gain, 28.3 vs 28.5, 2x slower => NFE saturated at 8). Fine-tune the DOMINANT lever init_t. ONE KNOB init_t 0.4->0.3 (eta=0.1, steps=8). PRIOR coarse init_t sweep: 0.7->19.0, 0.4->24.6(eta1.0)/best-region, 0.2->24.2 - optimum bracketed near 0.3-0.4. HYPOTHESIS: init_t=0.3 (between the 0.2 and 0.4 coarse points, at the now-tuned low eta=0.1) may edge past the 0.4/eta0.1 PSNR (~28.5) by injecting slightly less noise while retaining enough flow-time for the prior to denoise. Fine-grid refinement of the init_t peak.", "agent": "fastdiff_flow_pixel_unconstrained-claude-agentic", "campaign": "search-20260703-01", "cfg_full": {"det_spacing": 0.35754, "display_max": 0.5, "display_min": 0.0, "fd_recon_ckpt": "/cluster/maier/Agent4CT/checkpoints/fast_diffusion_pixel_breast.pt", "fd_recon_dc": 0, "fd_recon_dc_n_cg": 5, "fd_recon_dc_relax": 0.5, "fd_recon_eta": 0.1, "fd_recon_init": "fbp", "fd_recon_init_t": 0.3, "fd_recon_steps": 8, "image_size": 512, "n_angles": 128, "n_det": 1024, "noise_i0": 100000.0, "noise_sigma_e": 10.0, "pixel_spacing": 0.3516, "rationale": "iter-9: DC-off breast-prior. Back to steps=8 (iter-8 steps=16 gave NO PSNR gain, 28.3 vs 28.5, 2x slower => NFE saturated at 8). Fine-tune the DOMINANT lever init_t. ONE KNOB init_t 0.4->0.3 (eta=0.1, steps=8). PRIOR coarse init_t sweep: 0.7->19.0, 0.4->24.6(eta1.0)/best-region, 0.2->24.2 - optimum bracketed near 0.3-0.4. HYPOTHESIS: init_t=0.3 (between the 0.2 and 0.4 coarse points, at the now-tuned low eta=0.1) may edge past the 0.4/eta0.1 PSNR (~28.5) by injecting slightly less noise while retaining enough flow-time for the prior to denoise. Fine-grid refinement of the init_t peak.", "sdd": 1000.0, "seed": 42, "sod": 500.0, "train_n": 400, "val_n": 200}, "challenge": "breast_ct", "change_class": "architecture", "git_commit": "671da566", "images": {"comparison": "runs/breast-ct-claude-agentic-fastdiff-flow-pixel-unconstrained-search-20260703-01/iterations/iter-0009/comparison.png", "test_showcase": null, "valtest_showcase": null}, "iter": 9, "kept": false, "metrics": {"headroom": 0.0, "headroom_std": 0.0, "val_psnr": 28.976985931396484, "val_psnr_std": 0.7623415327246312, "val_rmse": 0.01214941032230854, "val_rmse_std": 0.0010402878156404462, "val_ssim": 0.7844355702400208, "val_ssim_std": 0.010007875285035685}, "model": "claude-opus-4-8-1m", "obs_path": "breast-ct-claude-agentic-fastdiff-flow-pixel-unconstrained-search-20260703-01/iterations/iter-0009/observation.json", "obs_sha1": "e56576915fd82339fa0ec3e6df9a72f37e5f769f", "params_M": 3.822787, "params_source": "observation", "rationale": "fastdiff_flow_pixel_unconstrained-claude-agentic: image_size=512, pixel_spacing=0.3516, n_angles=128, n_det=1024, det_spacing=0.35754, sod=500.0, sdd=1000.0, display_min=0.0, display_max=0.5, train_n=400, val_n=200, noise_i0=100000.0, noise_sigma_e=10.0, seed=42, fd_recon_ckpt=/cluster/maier/Agent4CT/checkpoints/fast_diffusion_pixel_breast.pt, fd_recon_steps=8, fd_recon_init=fbp, fd_recon_init_t=0.3, fd_recon_eta=0.1, fd_recon_dc=0, fd_recon_dc_n_cg=5, fd_recon_dc_relax=0.5, rationale=iter-9: DC-off breast-prior. Back to steps=8 (iter-8 steps=16 gave NO PSNR gain, 28.3 vs 28.5, 2x slower => NFE saturated at 8). Fine-tune the DOMINANT lever init_t. ONE KNOB init_t 0.4->0.3 (eta=0.1, steps=8). PRIOR coarse init_t sweep: 0.7->19.0, 0.4->24.6(eta1.0)/best-region, 0.2->24.2 - optimum bracketed near 0.3-0.4. HYPOTHESIS: init_t=0.3 (between the 0.2 and 0.4 coarse points, at the now-tuned low eta=0.1) may edge past the 0.4/eta0.1 PSNR (~28.5) by injecting slightly less noise while retaining enough flow-time for the prior to denoise. Fine-grid refinement of the init_t peak.", "run_id": "breast-ct-claude-agentic-fastdiff-flow-pixel-unconstrained-search-20260703-01", "runtime": {"elapsed_s": 143.9140214920044}, "schema_version": 3, "solver_key": "fastdiff-flow-pixel-unconstrained", "solver_name": "Fast-diffusion flow (pixel, unconstrained)", "split": {"train_n": 3600, "val_n": 200}, "status": "discard", "ts": "2026-07-06T20:47:05Z"}
{"advice_for_others": "fastdiff_flow_pixel_unconstrained-claude-agentic: image_size=512, pixel_spacing=0.3516, n_angles=128, n_det=1024, det_spacing=0.35754, sod=500.0, sdd=1000.0, display_min=0.0, display_max=0.5, train_n=400, val_n=200, noise_i0=100000.0, noise_sigma_e=10.0, seed=42, fd_recon_ckpt=/cluster/maier/Agent4CT/checkpoints/fast_diffusion_pixel_breast.pt, fd_recon_steps=8, fd_recon_init=fbp, fd_recon_init_t=0.25, fd_recon_eta=0.1, fd_recon_dc=0, fd_recon_dc_n_cg=5, fd_recon_dc_relax=0.5, rationale=iter-10: DC-off breast-prior. Fine init_t sweep at low eta=0.1, steps=8. ONE KNOB init_t 0.3->0.25. PRIOR: iter-9 init_t0.3 PSNR28.98 (best) > iter-7 init_t0.4 PSNR28.51 - the init_t peak at low eta is BELOW 0.4. HYPOTHESIS: init_t=0.25 edges the PSNR up further toward its peak (less injected noise, prior still has enough flow-time to denoise); if it turns DOWN, the peak is ~0.3 and I stop lowering. Brackets the init_t optimum at the tuned low-eta operating point.", "agent": "fastdiff_flow_pixel_unconstrained-claude-agentic", "campaign": "search-20260703-01", "cfg_full": {"det_spacing": 0.35754, "display_max": 0.5, "display_min": 0.0, "fd_recon_ckpt": "/cluster/maier/Agent4CT/checkpoints/fast_diffusion_pixel_breast.pt", "fd_recon_dc": 0, "fd_recon_dc_n_cg": 5, "fd_recon_dc_relax": 0.5, "fd_recon_eta": 0.1, "fd_recon_init": "fbp", "fd_recon_init_t": 0.25, "fd_recon_steps": 8, "image_size": 512, "n_angles": 128, "n_det": 1024, "noise_i0": 100000.0, "noise_sigma_e": 10.0, "pixel_spacing": 0.3516, "rationale": "iter-10: DC-off breast-prior. Fine init_t sweep at low eta=0.1, steps=8. ONE KNOB init_t 0.3->0.25. PRIOR: iter-9 init_t0.3 PSNR28.98 (best) > iter-7 init_t0.4 PSNR28.51 - the init_t peak at low eta is BELOW 0.4. HYPOTHESIS: init_t=0.25 edges the PSNR up further toward its peak (less injected noise, prior still has enough flow-time to denoise); if it turns DOWN, the peak is ~0.3 and I stop lowering. Brackets the init_t optimum at the tuned low-eta operating point.", "sdd": 1000.0, "seed": 42, "sod": 500.0, "train_n": 400, "val_n": 200}, "challenge": "breast_ct", "change_class": "architecture", "git_commit": "671da566", "images": {"comparison": "runs/breast-ct-claude-agentic-fastdiff-flow-pixel-unconstrained-search-20260703-01/iterations/iter-0010/comparison.png", "test_showcase": null, "valtest_showcase": null}, "iter": 10, "kept": false, "metrics": {"headroom": 0.0, "headroom_std": 0.0, "val_psnr": 29.196880340576172, "val_psnr_std": 0.7374689399436112, "val_rmse": 0.011845692992210388, "val_rmse_std": 0.0009780590394683965, "val_ssim": 0.7704774141311646, "val_ssim_std": 0.009596887660012427}, "model": "claude-opus-4-8-1m", "obs_path": "breast-ct-claude-agentic-fastdiff-flow-pixel-unconstrained-search-20260703-01/iterations/iter-0010/observation.json", "obs_sha1": "a470f6955b51c2916d883a1ee1a3a5e1652c496a", "params_M": 3.822787, "params_source": "observation", "rationale": "fastdiff_flow_pixel_unconstrained-claude-agentic: image_size=512, pixel_spacing=0.3516, n_angles=128, n_det=1024, det_spacing=0.35754, sod=500.0, sdd=1000.0, display_min=0.0, display_max=0.5, train_n=400, val_n=200, noise_i0=100000.0, noise_sigma_e=10.0, seed=42, fd_recon_ckpt=/cluster/maier/Agent4CT/checkpoints/fast_diffusion_pixel_breast.pt, fd_recon_steps=8, fd_recon_init=fbp, fd_recon_init_t=0.25, fd_recon_eta=0.1, fd_recon_dc=0, fd_recon_dc_n_cg=5, fd_recon_dc_relax=0.5, rationale=iter-10: DC-off breast-prior. Fine init_t sweep at low eta=0.1, steps=8. ONE KNOB init_t 0.3->0.25. PRIOR: iter-9 init_t0.3 PSNR28.98 (best) > iter-7 init_t0.4 PSNR28.51 - the init_t peak at low eta is BELOW 0.4. HYPOTHESIS: init_t=0.25 edges the PSNR up further toward its peak (less injected noise, prior still has enough flow-time to denoise); if it turns DOWN, the peak is ~0.3 and I stop lowering. Brackets the init_t optimum at the tuned low-eta operating point.", "run_id": "breast-ct-claude-agentic-fastdiff-flow-pixel-unconstrained-search-20260703-01", "runtime": {"elapsed_s": 124.28788375854492}, "schema_version": 3, "solver_key": "fastdiff-flow-pixel-unconstrained", "solver_name": "Fast-diffusion flow (pixel, unconstrained)", "split": {"train_n": 3600, "val_n": 200}, "status": "discard", "ts": "2026-07-06T20:50:01Z"}
