{"advice_for_others": "param_efficient-claude-agentic: reg_type=bilateral, bilateral_on_top=False, proj_filter_on=False, n_iter=10, learnable_alpha=True, alpha_init=0.1, foe_n_filters=24, foe_kernel=7, foe_n_bumps=31, n_bf=3, bf_multiscale=True, bf_sigmas=[0.8, 1.6, 3.2], bf_kernel=7, bf_sigma_r=0.02, bf_gain_init=0.0, epochs=16, cosine_lr=True, lr=0.005, max_train_s=1080, batch_size=4, train_n=200, val_n=200, display_min=0.0, display_max=0.05, seed=42, rationale=iter-9 param_efficient breast -- ARCHITECTURAL CHANGE: FILTERED-GRADIENT DC (I edited the solver, per coordinator: everything is changeable). SIX-BOX: (1) PRIOR: 8 iters prove the ADJOINT GD-unroll caps at image-domain ~0.26 on sparse-view; the diagnosis (iter-6) is that R^T(Rx-g) back-projects a STREAKY residual -> re-injects coherent streaks -> deeper adjoint DC LOWERED hr. That is an ARCHITECTURAL ceiling, not a config one. (2) FAILURE MODE: the raw adjoint DC operator smears sparse-view streaks. (3) ONE KNOB (architectural): dc_mode 'adjoint'->'filtered' -- I added a config-gated branch in ParamEfficientUnrolled._grad so the DC direction is fbp(Rx-g) (ramp/Hann-filtered residual back-projection = a PROPER reconstruction correction, the SART/FBP-gradient trick) instead of R^T(Rx-g)/dc_norm. ZERO extra params; touches only my solver, not the projector/metrics. Applied on the LEAN prox (bilateral 3-scale, 13 params) at K=10 depth -- because a filtered gradient should make DEPTH help (the exact lever the adjoint poisoned in iter-6). (4) HYPOTHESIS: because the ramp-filtered residual correction does NOT smear streaks, 10 filtered-DC steps drive Rx->g while actually REMOVING the coherent streaks (each step reconstructs the residual properly) -> hr breaks past 0.264 toward the VN/LPD regime, at ~13-22 params. This is the minimal architectural fix my own evidence points to. (5) BUDGET: filtered DC = 1 extra fbp per step vs adjoint's back_project (similar cost); K=10 bilateral, train_n=200, 1080s backstop + 200-val -> <20min. (6) SERIAL; iter-10 self-dispatches (next: if filtered-DC helps, sweep K / add the FoE or proj-filter on top; if not, LPD dual)., dc_mode=filtered, per_step_alpha=False", "agent": "param_efficient-claude-agentic", "campaign": "search-20260703-01", "cfg_full": {"alpha_init": 0.1, "batch_size": 4, "bf_gain_init": 0.0, "bf_kernel": 7, "bf_multiscale": true, "bf_sigma_r": 0.02, "bf_sigmas": [0.8, 1.6, 3.2], "bilateral_on_top": false, "cosine_lr": true, "dc_mode": "filtered", "display_max": 0.05, "display_min": 0.0, "epochs": 16, "foe_kernel": 7, "foe_n_bumps": 31, "foe_n_filters": 24, "learnable_alpha": true, "lr": 0.005, "max_train_s": 1080, "n_bf": 3, "n_iter": 10, "per_step_alpha": false, "proj_filter_on": false, "rationale": "iter-9 param_efficient breast -- ARCHITECTURAL CHANGE: FILTERED-GRADIENT DC (I edited the solver, per coordinator: everything is changeable). SIX-BOX: (1) PRIOR: 8 iters prove the ADJOINT GD-unroll caps at image-domain ~0.26 on sparse-view; the diagnosis (iter-6) is that R^T(Rx-g) back-projects a STREAKY residual -> re-injects coherent streaks -> deeper adjoint DC LOWERED hr. That is an ARCHITECTURAL ceiling, not a config one. (2) FAILURE MODE: the raw adjoint DC operator smears sparse-view streaks. (3) ONE KNOB (architectural): dc_mode 'adjoint'->'filtered' -- I added a config-gated branch in ParamEfficientUnrolled._grad so the DC direction is fbp(Rx-g) (ramp/Hann-filtered residual back-projection = a PROPER reconstruction correction, the SART/FBP-gradient trick) instead of R^T(Rx-g)/dc_norm. ZERO extra params; touches only my solver, not the projector/metrics. Applied on the LEAN prox (bilateral 3-scale, 13 params) at K=10 depth -- because a filtered gradient should make DEPTH help (the exact lever the adjoint poisoned in iter-6). (4) HYPOTHESIS: because the ramp-filtered residual correction does NOT smear streaks, 10 filtered-DC steps drive Rx->g while actually REMOVING the coherent streaks (each step reconstructs the residual properly) -> hr breaks past 0.264 toward the VN/LPD regime, at ~13-22 params. This is the minimal architectural fix my own evidence points to. (5) BUDGET: filtered DC = 1 extra fbp per step vs adjoint's back_project (similar cost); K=10 bilateral, train_n=200, 1080s backstop + 200-val -> <20min. (6) SERIAL; iter-10 self-dispatches (next: if filtered-DC helps, sweep K / add the FoE or proj-filter on top; if not, LPD dual).", "reg_type": "bilateral", "seed": 42, "train_n": 200, "val_n": 200}, "challenge": "breast_ct", "change_class": "architecture", "git_commit": "671da566", "images": {"comparison": "runs/breast-ct-claude-agentic-param-efficient-search-20260703-01/iterations/iter-0009/comparison.png", "test_showcase": null, "valtest_showcase": null}, "iter": 9, "kept": true, "metrics": {"headroom": 0.3352416310332519, "headroom_std": 0.007075449965718759, "val_psnr": 39.87091827392578, "val_psnr_std": 0.5285213234751927, "val_rmse": 0.003466238733381033, "val_rmse_std": 0.0002045914883858948, "val_ssim": 0.9710379838943481, "val_ssim_std": 0.00314364082458696}, "model": "claude-opus-4-8-1m", "obs_path": "breast-ct-claude-agentic-param-efficient-search-20260703-01/iterations/iter-0009/observation.json", "obs_sha1": "f7f4d7aeea70039439b7ed4d4f9284deec8be664", "params_M": 1.3e-05, "params_source": "observation", "rationale": "param_efficient-claude-agentic: reg_type=bilateral, bilateral_on_top=False, proj_filter_on=False, n_iter=10, learnable_alpha=True, alpha_init=0.1, foe_n_filters=24, foe_kernel=7, foe_n_bumps=31, n_bf=3, bf_multiscale=True, bf_sigmas=[0.8, 1.6, 3.2], bf_kernel=7, bf_sigma_r=0.02, bf_gain_init=0.0, epochs=16, cosine_lr=True, lr=0.005, max_train_s=1080, batch_size=4, train_n=200, val_n=200, display_min=0.0, display_max=0.05, seed=42, rationale=iter-9 param_efficient breast -- ARCHITECTURAL CHANGE: FILTERED-GRADIENT DC (I edited the solver, per coordinator: everything is changeable). SIX-BOX: (1) PRIOR: 8 iters prove the ADJOINT GD-unroll caps at image-domain ~0.26 on sparse-view; the diagnosis (iter-6) is that R^T(Rx-g) back-projects a STREAKY residual -> re-injects coherent streaks -> deeper adjoint DC LOWERED hr. That is an ARCHITECTURAL ceiling, not a config one. (2) FAILURE MODE: the raw adjoint DC operator smears sparse-view streaks. (3) ONE KNOB (architectural): dc_mode 'adjoint'->'filtered' -- I added a config-gated branch in ParamEfficientUnrolled._grad so the DC direction is fbp(Rx-g) (ramp/Hann-filtered residual back-projection = a PROPER reconstruction correction, the SART/FBP-gradient trick) instead of R^T(Rx-g)/dc_norm. ZERO extra params; touches only my solver, not the projector/metrics. Applied on the LEAN prox (bilateral 3-scale, 13 params) at K=10 depth -- because a filtered gradient should make DEPTH help (the exact lever the adjoint poisoned in iter-6). (4) HYPOTHESIS: because the ramp-filtered residual correction does NOT smear streaks, 10 filtered-DC steps drive Rx->g while actually REMOVING the coherent streaks (each step reconstructs the residual properly) -> hr breaks past 0.264 toward the VN/LPD regime, at ~13-22 params. This is the minimal architectural fix my own evidence points to. (5) BUDGET: filtered DC = 1 extra fbp per step vs adjoint's back_project (similar cost); K=10 bilateral, train_n=200, 1080s backstop + 200-val -> <20min. (6) SERIAL; iter-10 self-dispatches (next: if filtered-DC helps, sweep K / add the FoE or proj-filter on top; if not, LPD dual)., dc_mode=filtered, per_step_alpha=False", "run_id": "breast-ct-claude-agentic-param-efficient-search-20260703-01", "runtime": {"elapsed_s": 1049.4690194129944}, "schema_version": 3, "solver_key": "param-efficient", "solver_name": "Param-efficient (evolved)", "split": {"train_n": 200, "val_n": 200}, "status": "keep", "ts": "2026-07-07T01:03:34Z"}
{"advice_for_others": "param_efficient-claude-agentic: reg_type=bilateral, bilateral_on_top=False, proj_filter_on=False, n_iter=20, learnable_alpha=True, alpha_init=0.1, foe_n_filters=24, foe_kernel=7, foe_n_bumps=31, n_bf=3, bf_multiscale=True, bf_sigmas=[0.8, 1.6, 3.2], bf_kernel=7, bf_sigma_r=0.02, bf_gain_init=0.0, epochs=16, cosine_lr=True, lr=0.005, max_train_s=1080, batch_size=4, train_n=200, val_n=200, display_min=0.0, display_max=0.05, seed=42, rationale=iter-10 param_efficient breast -- FILTERED-DC DEPTH SWEEP. SIX-BOX: (1) PRIOR: iter-9 BREAKTHROUGH -- dc_mode=filtered (fbp(Rx-g)) at K=10 on the 13-param bilateral prox gave hr 0.3352 (PSNR 39.87), SHATTERING the ~0.26 image-domain ceiling that 8 adjoint iters couldn't pass. Confirms the raw-adjoint streak-smearing WAS the architectural ceiling. iter-6 (ADJOINT K=20) gave hr 0.0 -- depth HURT. (2) FAILURE MODE addressed: none at iter-9; goal is to find where filtered-DC depth saturates. (3) ONE KNOB: n_iter 10 -> 20 (double the filtered-DC depth). Still 13 params (weight-tied). All else byte-for-byte iter-9. (4) HYPOTHESIS: because the ramp-filtered correction reconstructs the residual properly (no streak smearing), MORE filtered-DC steps drive Rx->g further and REMOVE more streaks -> hr climbs past 0.335 (the OPPOSITE of iter-6's adjoint K=20 collapse). This directly tests whether filtered depth is monotonic. Risk: K=20 halves epochs in the 1080s wall (iter-9 K10 finished 16ep in 990s; K20 ~ 8-9ep), so undertraining could cap the gain -- if hr>0.335 but epochs<10, iter-11 will re-run best-K at higher train budget. (5) BUDGET: K=20 filtered (1 fbp/step), train_n=200, 1080s backstop + 200-val -> <20min. (6) SERIAL; iter-11 self-dispatches (next: if depth helps, push K further or add FoE capacity on the filtered-DC unroll to trace params-vs-hr toward VN 0.63)., dc_mode=filtered, per_step_alpha=False", "agent": "param_efficient-claude-agentic", "campaign": "search-20260703-01", "cfg_full": {"alpha_init": 0.1, "batch_size": 4, "bf_gain_init": 0.0, "bf_kernel": 7, "bf_multiscale": true, "bf_sigma_r": 0.02, "bf_sigmas": [0.8, 1.6, 3.2], "bilateral_on_top": false, "cosine_lr": true, "dc_mode": "filtered", "display_max": 0.05, "display_min": 0.0, "epochs": 16, "foe_kernel": 7, "foe_n_bumps": 31, "foe_n_filters": 24, "learnable_alpha": true, "lr": 0.005, "max_train_s": 1080, "n_bf": 3, "n_iter": 20, "per_step_alpha": false, "proj_filter_on": false, "rationale": "iter-10 param_efficient breast -- FILTERED-DC DEPTH SWEEP. SIX-BOX: (1) PRIOR: iter-9 BREAKTHROUGH -- dc_mode=filtered (fbp(Rx-g)) at K=10 on the 13-param bilateral prox gave hr 0.3352 (PSNR 39.87), SHATTERING the ~0.26 image-domain ceiling that 8 adjoint iters couldn't pass. Confirms the raw-adjoint streak-smearing WAS the architectural ceiling. iter-6 (ADJOINT K=20) gave hr 0.0 -- depth HURT. (2) FAILURE MODE addressed: none at iter-9; goal is to find where filtered-DC depth saturates. (3) ONE KNOB: n_iter 10 -> 20 (double the filtered-DC depth). Still 13 params (weight-tied). All else byte-for-byte iter-9. (4) HYPOTHESIS: because the ramp-filtered correction reconstructs the residual properly (no streak smearing), MORE filtered-DC steps drive Rx->g further and REMOVE more streaks -> hr climbs past 0.335 (the OPPOSITE of iter-6's adjoint K=20 collapse). This directly tests whether filtered depth is monotonic. Risk: K=20 halves epochs in the 1080s wall (iter-9 K10 finished 16ep in 990s; K20 ~ 8-9ep), so undertraining could cap the gain -- if hr>0.335 but epochs<10, iter-11 will re-run best-K at higher train budget. (5) BUDGET: K=20 filtered (1 fbp/step), train_n=200, 1080s backstop + 200-val -> <20min. (6) SERIAL; iter-11 self-dispatches (next: if depth helps, push K further or add FoE capacity on the filtered-DC unroll to trace params-vs-hr toward VN 0.63).", "reg_type": "bilateral", "seed": 42, "train_n": 200, "val_n": 200}, "challenge": "breast_ct", "change_class": "architecture", "git_commit": "671da566", "images": {"comparison": "runs/breast-ct-claude-agentic-param-efficient-search-20260703-01/iterations/iter-0010/comparison.png", "test_showcase": null, "valtest_showcase": null}, "iter": 10, "kept": true, "metrics": {"headroom": 0.37736087652440187, "headroom_std": 0.0085612734886111, "val_psnr": 40.43947219848633, "val_psnr_std": 0.4920791912936203, "val_rmse": 0.0032466170378029346, "val_rmse_std": 0.00017783502440860382, "val_ssim": 0.9710058569908142, "val_ssim_std": 0.002739556173486224}, "model": "claude-opus-4-8-1m", "obs_path": "breast-ct-claude-agentic-param-efficient-search-20260703-01/iterations/iter-0010/observation.json", "obs_sha1": "dba273260a4ca43ea25299017f6f7539ad0a7c0f", "params_M": 1.3e-05, "params_source": "observation", "rationale": "param_efficient-claude-agentic: reg_type=bilateral, bilateral_on_top=False, proj_filter_on=False, n_iter=20, learnable_alpha=True, alpha_init=0.1, foe_n_filters=24, foe_kernel=7, foe_n_bumps=31, n_bf=3, bf_multiscale=True, bf_sigmas=[0.8, 1.6, 3.2], bf_kernel=7, bf_sigma_r=0.02, bf_gain_init=0.0, epochs=16, cosine_lr=True, lr=0.005, max_train_s=1080, batch_size=4, train_n=200, val_n=200, display_min=0.0, display_max=0.05, seed=42, rationale=iter-10 param_efficient breast -- FILTERED-DC DEPTH SWEEP. SIX-BOX: (1) PRIOR: iter-9 BREAKTHROUGH -- dc_mode=filtered (fbp(Rx-g)) at K=10 on the 13-param bilateral prox gave hr 0.3352 (PSNR 39.87), SHATTERING the ~0.26 image-domain ceiling that 8 adjoint iters couldn't pass. Confirms the raw-adjoint streak-smearing WAS the architectural ceiling. iter-6 (ADJOINT K=20) gave hr 0.0 -- depth HURT. (2) FAILURE MODE addressed: none at iter-9; goal is to find where filtered-DC depth saturates. (3) ONE KNOB: n_iter 10 -> 20 (double the filtered-DC depth). Still 13 params (weight-tied). All else byte-for-byte iter-9. (4) HYPOTHESIS: because the ramp-filtered correction reconstructs the residual properly (no streak smearing), MORE filtered-DC steps drive Rx->g further and REMOVE more streaks -> hr climbs past 0.335 (the OPPOSITE of iter-6's adjoint K=20 collapse). This directly tests whether filtered depth is monotonic. Risk: K=20 halves epochs in the 1080s wall (iter-9 K10 finished 16ep in 990s; K20 ~ 8-9ep), so undertraining could cap the gain -- if hr>0.335 but epochs<10, iter-11 will re-run best-K at higher train budget. (5) BUDGET: K=20 filtered (1 fbp/step), train_n=200, 1080s backstop + 200-val -> <20min. (6) SERIAL; iter-11 self-dispatches (next: if depth helps, push K further or add FoE capacity on the filtered-DC unroll to trace params-vs-hr toward VN 0.63)., dc_mode=filtered, per_step_alpha=False", "run_id": "breast-ct-claude-agentic-param-efficient-search-20260703-01", "runtime": {"elapsed_s": 1214.674421787262}, "schema_version": 3, "solver_key": "param-efficient", "solver_name": "Param-efficient (evolved)", "split": {"train_n": 200, "val_n": 200}, "status": "keep", "ts": "2026-07-07T02:11:33Z"}
{"advice_for_others": "param_efficient-claude-agentic: reg_type=bilateral, bilateral_on_top=False, proj_filter_on=False, n_iter=30, learnable_alpha=True, alpha_init=0.1, foe_n_filters=24, foe_kernel=7, foe_n_bumps=31, n_bf=3, bf_multiscale=True, bf_sigmas=[0.8, 1.6, 3.2], bf_kernel=7, bf_sigma_r=0.02, bf_gain_init=0.0, epochs=16, cosine_lr=True, lr=0.005, max_train_s=1080, batch_size=4, train_n=200, val_n=200, display_min=0.0, display_max=0.05, seed=42, rationale=iter-11 param_efficient breast -- FILTERED-DC DEPTH SWEEP to saturation. SIX-BOX: (1) PRIOR: filtered-DC depth is MONOTONIC: K10 hr 0.3352 (16 epochs) -> K20 hr 0.3774 (only 9 epochs, wall-cut). So depth climbed +0.042 DESPITE fewer epochs -- depth's benefit OUTWEIGHS the undertraining cost. 13 params throughout. (2) FAILURE MODE: none yet; find where filtered-DC depth saturates vs the epochs-vs-wall tradeoff (K20 already down to 9 epochs; K30 will be ~6). (3) ONE KNOB: n_iter 20 -> 30. Still 13 params (weight-tied). All else byte-for-byte iter-10. (4) HYPOTHESIS: if filtered depth still dominates, K=30 climbs past 0.377 even at ~6 epochs -> keep pushing; if it FLATTENS or DROPS, K~20-30 is the practical saturation under the 1080s wall and the next lever is STACKING capacity (FoE / streak-reg) on the best-K filtered-DC unroll, NOT more depth. Either outcome maps the frontier. (5) BUDGET: K=30 filtered (1 fbp/step), train_n=200, 1080s backstop + 200-val -> <20min (backstop guarantees). (6) SERIAL; iter-12 self-dispatches (next: if saturated, re-fix best-K and STACK FoE capacity on the filtered-DC unroll -- reg_type foe + bilateral_on_top -- to climb toward VN 0.63 at minimal added params)., dc_mode=filtered, per_step_alpha=False", "agent": "param_efficient-claude-agentic", "campaign": "search-20260703-01", "cfg_full": {"alpha_init": 0.1, "batch_size": 4, "bf_gain_init": 0.0, "bf_kernel": 7, "bf_multiscale": true, "bf_sigma_r": 0.02, "bf_sigmas": [0.8, 1.6, 3.2], "bilateral_on_top": false, "cosine_lr": true, "dc_mode": "filtered", "display_max": 0.05, "display_min": 0.0, "epochs": 16, "foe_kernel": 7, "foe_n_bumps": 31, "foe_n_filters": 24, "learnable_alpha": true, "lr": 0.005, "max_train_s": 1080, "n_bf": 3, "n_iter": 30, "per_step_alpha": false, "proj_filter_on": false, "rationale": "iter-11 param_efficient breast -- FILTERED-DC DEPTH SWEEP to saturation. SIX-BOX: (1) PRIOR: filtered-DC depth is MONOTONIC: K10 hr 0.3352 (16 epochs) -> K20 hr 0.3774 (only 9 epochs, wall-cut). So depth climbed +0.042 DESPITE fewer epochs -- depth's benefit OUTWEIGHS the undertraining cost. 13 params throughout. (2) FAILURE MODE: none yet; find where filtered-DC depth saturates vs the epochs-vs-wall tradeoff (K20 already down to 9 epochs; K30 will be ~6). (3) ONE KNOB: n_iter 20 -> 30. Still 13 params (weight-tied). All else byte-for-byte iter-10. (4) HYPOTHESIS: if filtered depth still dominates, K=30 climbs past 0.377 even at ~6 epochs -> keep pushing; if it FLATTENS or DROPS, K~20-30 is the practical saturation under the 1080s wall and the next lever is STACKING capacity (FoE / streak-reg) on the best-K filtered-DC unroll, NOT more depth. Either outcome maps the frontier. (5) BUDGET: K=30 filtered (1 fbp/step), train_n=200, 1080s backstop + 200-val -> <20min (backstop guarantees). (6) SERIAL; iter-12 self-dispatches (next: if saturated, re-fix best-K and STACK FoE capacity on the filtered-DC unroll -- reg_type foe + bilateral_on_top -- to climb toward VN 0.63 at minimal added params).", "reg_type": "bilateral", "seed": 42, "train_n": 200, "val_n": 200}, "challenge": "breast_ct", "change_class": "architecture", "git_commit": "671da566", "images": {"comparison": "runs/breast-ct-claude-agentic-param-efficient-search-20260703-01/iterations/iter-0011/comparison.png", "test_showcase": null, "valtest_showcase": null}, "iter": 11, "kept": true, "metrics": {"headroom": 0.43447393005762225, "headroom_std": 0.010103842634539456, "val_psnr": 41.275142669677734, "val_psnr_std": 0.45175951053489316, "val_rmse": 0.002948813373222947, "val_rmse_std": 0.00014759375588815243, "val_ssim": 0.9730863571166992, "val_ssim_std": 0.002291189945751822}, "model": "claude-opus-4-8-1m", "obs_path": "breast-ct-claude-agentic-param-efficient-search-20260703-01/iterations/iter-0011/observation.json", "obs_sha1": "8bf9298604f8f45c6da7a6db890f9742ec3c1c7a", "params_M": 1.3e-05, "params_source": "observation", "rationale": "param_efficient-claude-agentic: reg_type=bilateral, bilateral_on_top=False, proj_filter_on=False, n_iter=30, learnable_alpha=True, alpha_init=0.1, foe_n_filters=24, foe_kernel=7, foe_n_bumps=31, n_bf=3, bf_multiscale=True, bf_sigmas=[0.8, 1.6, 3.2], bf_kernel=7, bf_sigma_r=0.02, bf_gain_init=0.0, epochs=16, cosine_lr=True, lr=0.005, max_train_s=1080, batch_size=4, train_n=200, val_n=200, display_min=0.0, display_max=0.05, seed=42, rationale=iter-11 param_efficient breast -- FILTERED-DC DEPTH SWEEP to saturation. SIX-BOX: (1) PRIOR: filtered-DC depth is MONOTONIC: K10 hr 0.3352 (16 epochs) -> K20 hr 0.3774 (only 9 epochs, wall-cut). So depth climbed +0.042 DESPITE fewer epochs -- depth's benefit OUTWEIGHS the undertraining cost. 13 params throughout. (2) FAILURE MODE: none yet; find where filtered-DC depth saturates vs the epochs-vs-wall tradeoff (K20 already down to 9 epochs; K30 will be ~6). (3) ONE KNOB: n_iter 20 -> 30. Still 13 params (weight-tied). All else byte-for-byte iter-10. (4) HYPOTHESIS: if filtered depth still dominates, K=30 climbs past 0.377 even at ~6 epochs -> keep pushing; if it FLATTENS or DROPS, K~20-30 is the practical saturation under the 1080s wall and the next lever is STACKING capacity (FoE / streak-reg) on the best-K filtered-DC unroll, NOT more depth. Either outcome maps the frontier. (5) BUDGET: K=30 filtered (1 fbp/step), train_n=200, 1080s backstop + 200-val -> <20min (backstop guarantees). (6) SERIAL; iter-12 self-dispatches (next: if saturated, re-fix best-K and STACK FoE capacity on the filtered-DC unroll -- reg_type foe + bilateral_on_top -- to climb toward VN 0.63 at minimal added params)., dc_mode=filtered, per_step_alpha=False", "run_id": "breast-ct-claude-agentic-param-efficient-search-20260703-01", "runtime": {"elapsed_s": 1230.7944502830505}, "schema_version": 3, "solver_key": "param-efficient", "solver_name": "Param-efficient (evolved)", "split": {"train_n": 200, "val_n": 200}, "status": "keep", "ts": "2026-07-07T02:51:27Z"}
