{"advice_for_others": "fastdiff_wdm_wavelet_unconstrained-claude-agentic: val_n=200, seed=42, fd_recon_ckpt=/cluster/maier/Agent4CT/checkpoints/fast_diffusion_wavelet_breast.pt, fd_recon_steps=8, fd_recon_init=noise, fd_recon_init_t=1.0, fd_recon_eta=0.0, fd_recon_dc=0, fd_recon_dc_n_cg=5, fd_recon_dc_relax=0.5, dataset_kind=breast_ct, rationale=iter-10 INIT=noise (fully generative), breast-native wdm-wavelet UNCONSTRAINED (DC OFF). SIX-BOX: (1) PRIOR: steps 8 vs 16 identical (rmse0.01130 vs 0.01131) -> NFE not the limiter, prior is the ceiling. Best t=0.5 eta=0.0 steps=8. All hr=0; DC-off floor ~0.0113. (2) Failure mode: FBP-warm-start recons plateau; unknown = how much the FBP init contributes vs the prior alone. (3) ONE KNOB: fd_recon_init fbp->noise (start from pure N(0,I) at t=1, no FBP warm-start), eta=0.0 steps=8. (4) HYPOTHESIS: with NO FBP anchor and eta=0 (no DPS), the recon is UNCONDITIONAL prior sampling -> rmse MUCH worse (the prior draws a plausible breast, not THIS one). This bounds the pure-generative extreme and shows the FBP warm-start is what keeps DC-off recon near-usable. Confirms the prior alone cannot solve the inverse problem. (5) BUDGET: noise-init 8-step still <10min. (6) Loop continues.", "agent": "fastdiff_wdm_wavelet_unconstrained-claude-agentic", "campaign": "search-20260703-01", "cfg_full": {"dataset_kind": "breast_ct", "fd_recon_ckpt": "/cluster/maier/Agent4CT/checkpoints/fast_diffusion_wavelet_breast.pt", "fd_recon_dc": 0, "fd_recon_dc_n_cg": 5, "fd_recon_dc_relax": 0.5, "fd_recon_eta": 0.0, "fd_recon_init": "noise", "fd_recon_init_t": 1.0, "fd_recon_steps": 8, "rationale": "iter-10 INIT=noise (fully generative), breast-native wdm-wavelet UNCONSTRAINED (DC OFF). SIX-BOX: (1) PRIOR: steps 8 vs 16 identical (rmse0.01130 vs 0.01131) -> NFE not the limiter, prior is the ceiling. Best t=0.5 eta=0.0 steps=8. All hr=0; DC-off floor ~0.0113. (2) Failure mode: FBP-warm-start recons plateau; unknown = how much the FBP init contributes vs the prior alone. (3) ONE KNOB: fd_recon_init fbp->noise (start from pure N(0,I) at t=1, no FBP warm-start), eta=0.0 steps=8. (4) HYPOTHESIS: with NO FBP anchor and eta=0 (no DPS), the recon is UNCONDITIONAL prior sampling -> rmse MUCH worse (the prior draws a plausible breast, not THIS one). This bounds the pure-generative extreme and shows the FBP warm-start is what keeps DC-off recon near-usable. Confirms the prior alone cannot solve the inverse problem. (5) BUDGET: noise-init 8-step still <10min. (6) Loop continues.", "seed": 42, "val_n": 200}, "challenge": "breast_ct", "change_class": "architecture", "git_commit": "671da566", "images": {"comparison": "runs/breast-ct-claude-agentic-fastdiff-wdm-wavelet-unconstrained-search-20260703-01/iterations/iter-0010/comparison.png", "test_showcase": null, "valtest_showcase": null}, "iter": 10, "kept": false, "metrics": {"headroom": 0.0, "headroom_std": 0.0, "val_psnr": 18.232759475708008, "val_psnr_std": 1.365236956041466, "val_rmse": 0.04185685142874718, "val_rmse_std": 0.006315425887040983, "val_ssim": 0.8257167339324951, "val_ssim_std": 0.02450481942752996}, "model": "claude-opus-4-8-1m", "obs_path": "breast-ct-claude-agentic-fastdiff-wdm-wavelet-unconstrained-search-20260703-01/iterations/iter-0010/observation.json", "obs_sha1": "1f54358148aa5a2ceb106761745bdad4877f4b07", "params_M": 3.824908, "params_source": "observation", "rationale": "fastdiff_wdm_wavelet_unconstrained-claude-agentic: val_n=200, seed=42, fd_recon_ckpt=/cluster/maier/Agent4CT/checkpoints/fast_diffusion_wavelet_breast.pt, fd_recon_steps=8, fd_recon_init=noise, fd_recon_init_t=1.0, fd_recon_eta=0.0, fd_recon_dc=0, fd_recon_dc_n_cg=5, fd_recon_dc_relax=0.5, dataset_kind=breast_ct, rationale=iter-10 INIT=noise (fully generative), breast-native wdm-wavelet UNCONSTRAINED (DC OFF). SIX-BOX: (1) PRIOR: steps 8 vs 16 identical (rmse0.01130 vs 0.01131) -> NFE not the limiter, prior is the ceiling. Best t=0.5 eta=0.0 steps=8. All hr=0; DC-off floor ~0.0113. (2) Failure mode: FBP-warm-start recons plateau; unknown = how much the FBP init contributes vs the prior alone. (3) ONE KNOB: fd_recon_init fbp->noise (start from pure N(0,I) at t=1, no FBP warm-start), eta=0.0 steps=8. (4) HYPOTHESIS: with NO FBP anchor and eta=0 (no DPS), the recon is UNCONDITIONAL prior sampling -> rmse MUCH worse (the prior draws a plausible breast, not THIS one). This bounds the pure-generative extreme and shows the FBP warm-start is what keeps DC-off recon near-usable. Confirms the prior alone cannot solve the inverse problem. (5) BUDGET: noise-init 8-step still <10min. (6) Loop continues.", "run_id": "breast-ct-claude-agentic-fastdiff-wdm-wavelet-unconstrained-search-20260703-01", "runtime": {"elapsed_s": 85.3577024936676}, "schema_version": 3, "solver_key": "fastdiff-wdm-wavelet-unconstrained", "solver_name": "Fast-diffusion WDM (wavelet, unconstrained)", "split": {"train_n": 3600, "val_n": 200}, "status": "discard", "ts": "2026-07-07T01:52:23Z"}
{"advice_for_others": "fastdiff_wdm_wavelet_unconstrained-claude-agentic: val_n=200, seed=42, fd_recon_ckpt=/cluster/maier/Agent4CT/checkpoints/fast_diffusion_wavelet_breast.pt, fd_recon_steps=8, fd_recon_init=fbp, fd_recon_init_t=0.6, fd_recon_eta=0.0, fd_recon_dc=0, fd_recon_dc_n_cg=5, fd_recon_dc_relax=0.5, dataset_kind=breast_ct, rationale=iter-11 INIT_T fine 0.6, breast-native wdm-wavelet UNCONSTRAINED (DC OFF). SIX-BOX: (1) PRIOR: init=noise (iter-10) rmse0.04186 (unconditional prior draws wrong breast) confirms FBP warm-start is essential; best remains fbp t=0.5 eta=0.0 steps=8 rmse0.01130. All hr=0. (2) Failure mode: fbp-init recons plateau ~0.0113; init_t minimum bracketed by t=0.4(0.01429) and t=0.5(0.01360@eta1) but eta now 0 -- re-probe the init_t minimum at eta=0. (3) ONE KNOB: fd_recon_init_t 0.5->0.6 at eta=0.0 steps=8. (4) HYPOTHESIS: at eta=0 the optimal init_t may shift (no DPS to fight prior drift); t=0.6 lets the prior denoise slightly more. If rmse rises vs t=0.5, 0.5 is the eta=0 optimum. (5) BUDGET: <5min. (6) Loop continues.", "agent": "fastdiff_wdm_wavelet_unconstrained-claude-agentic", "campaign": "search-20260703-01", "cfg_full": {"dataset_kind": "breast_ct", "fd_recon_ckpt": "/cluster/maier/Agent4CT/checkpoints/fast_diffusion_wavelet_breast.pt", "fd_recon_dc": 0, "fd_recon_dc_n_cg": 5, "fd_recon_dc_relax": 0.5, "fd_recon_eta": 0.0, "fd_recon_init": "fbp", "fd_recon_init_t": 0.6, "fd_recon_steps": 8, "rationale": "iter-11 INIT_T fine 0.6, breast-native wdm-wavelet UNCONSTRAINED (DC OFF). SIX-BOX: (1) PRIOR: init=noise (iter-10) rmse0.04186 (unconditional prior draws wrong breast) confirms FBP warm-start is essential; best remains fbp t=0.5 eta=0.0 steps=8 rmse0.01130. All hr=0. (2) Failure mode: fbp-init recons plateau ~0.0113; init_t minimum bracketed by t=0.4(0.01429) and t=0.5(0.01360@eta1) but eta now 0 -- re-probe the init_t minimum at eta=0. (3) ONE KNOB: fd_recon_init_t 0.5->0.6 at eta=0.0 steps=8. (4) HYPOTHESIS: at eta=0 the optimal init_t may shift (no DPS to fight prior drift); t=0.6 lets the prior denoise slightly more. If rmse rises vs t=0.5, 0.5 is the eta=0 optimum. (5) BUDGET: <5min. (6) Loop continues.", "seed": 42, "val_n": 200}, "challenge": "breast_ct", "change_class": "architecture", "git_commit": "671da566", "images": {"comparison": "runs/breast-ct-claude-agentic-fastdiff-wdm-wavelet-unconstrained-search-20260703-01/iterations/iter-0011/comparison.png", "test_showcase": null, "valtest_showcase": null}, "iter": 11, "kept": false, "metrics": {"headroom": 0.0, "headroom_std": 0.0, "val_psnr": 29.375755310058594, "val_psnr_std": 1.2117612051720472, "val_rmse": 0.011604241095483303, "val_rmse_std": 0.0016724860069790683, "val_ssim": 0.9376330375671387, "val_ssim_std": 0.012654483351513908}, "model": "claude-opus-4-8-1m", "obs_path": "breast-ct-claude-agentic-fastdiff-wdm-wavelet-unconstrained-search-20260703-01/iterations/iter-0011/observation.json", "obs_sha1": "d784529bc0d86e5d67e386a92223c8bfc22e724e", "params_M": 3.824908, "params_source": "observation", "rationale": "fastdiff_wdm_wavelet_unconstrained-claude-agentic: val_n=200, seed=42, fd_recon_ckpt=/cluster/maier/Agent4CT/checkpoints/fast_diffusion_wavelet_breast.pt, fd_recon_steps=8, fd_recon_init=fbp, fd_recon_init_t=0.6, fd_recon_eta=0.0, fd_recon_dc=0, fd_recon_dc_n_cg=5, fd_recon_dc_relax=0.5, dataset_kind=breast_ct, rationale=iter-11 INIT_T fine 0.6, breast-native wdm-wavelet UNCONSTRAINED (DC OFF). SIX-BOX: (1) PRIOR: init=noise (iter-10) rmse0.04186 (unconditional prior draws wrong breast) confirms FBP warm-start is essential; best remains fbp t=0.5 eta=0.0 steps=8 rmse0.01130. All hr=0. (2) Failure mode: fbp-init recons plateau ~0.0113; init_t minimum bracketed by t=0.4(0.01429) and t=0.5(0.01360@eta1) but eta now 0 -- re-probe the init_t minimum at eta=0. (3) ONE KNOB: fd_recon_init_t 0.5->0.6 at eta=0.0 steps=8. (4) HYPOTHESIS: at eta=0 the optimal init_t may shift (no DPS to fight prior drift); t=0.6 lets the prior denoise slightly more. If rmse rises vs t=0.5, 0.5 is the eta=0 optimum. (5) BUDGET: <5min. (6) Loop continues.", "run_id": "breast-ct-claude-agentic-fastdiff-wdm-wavelet-unconstrained-search-20260703-01", "runtime": {"elapsed_s": 82.80897688865662}, "schema_version": 3, "solver_key": "fastdiff-wdm-wavelet-unconstrained", "solver_name": "Fast-diffusion WDM (wavelet, unconstrained)", "split": {"train_n": 3600, "val_n": 200}, "status": "discard", "ts": "2026-07-07T02:31:58Z"}
{"advice_for_others": "fastdiff_wdm_wavelet_unconstrained-claude-agentic: val_n=200, seed=42, fd_recon_ckpt=/cluster/maier/Agent4CT/checkpoints/fast_diffusion_wavelet_breast.pt, fd_recon_steps=8, fd_recon_init=fbp, fd_recon_init_t=0.45, fd_recon_eta=0.0, fd_recon_dc=0, fd_recon_dc_n_cg=5, fd_recon_dc_relax=0.5, dataset_kind=breast_ct, rationale=iter-12 INIT_T 0.45 bracket at eta=0, breast-native wdm-wavelet UNCONSTRAINED (DC OFF). SIX-BOX: (1) PRIOR: at eta=0 init_t: 0.5 rmse0.01130 (BEST), 0.6 rmse0.01160 (worse). Bracket the low side. All hr=0. (2) Failure mode: prior-denoise plateau ~0.0113. (3) ONE KNOB: fd_recon_init_t 0.5->0.45 at eta=0.0 steps=8. (4) HYPOTHESIS: t=0.45 rmse >= t=0.5 (confirming 0.5 optimum) or marginally < (refining it). Pins the eta=0 init_t optimum for the final seed-variance config. (5) BUDGET: <5min. (6) Loop continues.", "agent": "fastdiff_wdm_wavelet_unconstrained-claude-agentic", "campaign": "search-20260703-01", "cfg_full": {"dataset_kind": "breast_ct", "fd_recon_ckpt": "/cluster/maier/Agent4CT/checkpoints/fast_diffusion_wavelet_breast.pt", "fd_recon_dc": 0, "fd_recon_dc_n_cg": 5, "fd_recon_dc_relax": 0.5, "fd_recon_eta": 0.0, "fd_recon_init": "fbp", "fd_recon_init_t": 0.45, "fd_recon_steps": 8, "rationale": "iter-12 INIT_T 0.45 bracket at eta=0, breast-native wdm-wavelet UNCONSTRAINED (DC OFF). SIX-BOX: (1) PRIOR: at eta=0 init_t: 0.5 rmse0.01130 (BEST), 0.6 rmse0.01160 (worse). Bracket the low side. All hr=0. (2) Failure mode: prior-denoise plateau ~0.0113. (3) ONE KNOB: fd_recon_init_t 0.5->0.45 at eta=0.0 steps=8. (4) HYPOTHESIS: t=0.45 rmse >= t=0.5 (confirming 0.5 optimum) or marginally < (refining it). Pins the eta=0 init_t optimum for the final seed-variance config. (5) BUDGET: <5min. (6) Loop continues.", "seed": 42, "val_n": 200}, "challenge": "breast_ct", "change_class": "architecture", "git_commit": "671da566", "images": {"comparison": "runs/breast-ct-claude-agentic-fastdiff-wdm-wavelet-unconstrained-search-20260703-01/iterations/iter-0012/comparison.png", "test_showcase": null, "valtest_showcase": null}, "iter": 12, "kept": false, "metrics": {"headroom": 0.0, "headroom_std": 0.0, "val_psnr": 29.621994018554688, "val_psnr_std": 0.9899549499454231, "val_rmse": 0.011279888451099396, "val_rmse_std": 0.0011985021107185794, "val_ssim": 0.937083899974823, "val_ssim_std": 0.012166297741485138}, "model": "claude-opus-4-8-1m", "obs_path": "breast-ct-claude-agentic-fastdiff-wdm-wavelet-unconstrained-search-20260703-01/iterations/iter-0012/observation.json", "obs_sha1": "629c61ab07ed7e420be238fd083c2f199da4f9de", "params_M": 3.824908, "params_source": "observation", "rationale": "fastdiff_wdm_wavelet_unconstrained-claude-agentic: val_n=200, seed=42, fd_recon_ckpt=/cluster/maier/Agent4CT/checkpoints/fast_diffusion_wavelet_breast.pt, fd_recon_steps=8, fd_recon_init=fbp, fd_recon_init_t=0.45, fd_recon_eta=0.0, fd_recon_dc=0, fd_recon_dc_n_cg=5, fd_recon_dc_relax=0.5, dataset_kind=breast_ct, rationale=iter-12 INIT_T 0.45 bracket at eta=0, breast-native wdm-wavelet UNCONSTRAINED (DC OFF). SIX-BOX: (1) PRIOR: at eta=0 init_t: 0.5 rmse0.01130 (BEST), 0.6 rmse0.01160 (worse). Bracket the low side. All hr=0. (2) Failure mode: prior-denoise plateau ~0.0113. (3) ONE KNOB: fd_recon_init_t 0.5->0.45 at eta=0.0 steps=8. (4) HYPOTHESIS: t=0.45 rmse >= t=0.5 (confirming 0.5 optimum) or marginally < (refining it). Pins the eta=0 init_t optimum for the final seed-variance config. (5) BUDGET: <5min. (6) Loop continues.", "run_id": "breast-ct-claude-agentic-fastdiff-wdm-wavelet-unconstrained-search-20260703-01", "runtime": {"elapsed_s": 79.59544444084167}, "schema_version": 3, "solver_key": "fastdiff-wdm-wavelet-unconstrained", "solver_name": "Fast-diffusion WDM (wavelet, unconstrained)", "split": {"train_n": 3600, "val_n": 200}, "status": "discard", "ts": "2026-07-07T03:11:37Z"}
{"advice_for_others": "fastdiff_wdm_wavelet_unconstrained-claude-agentic: val_n=200, seed=42, fd_recon_ckpt=/cluster/maier/Agent4CT/checkpoints/fast_diffusion_wavelet_breast.pt, fd_recon_steps=4, fd_recon_init=fbp, fd_recon_init_t=0.45, fd_recon_eta=0.0, fd_recon_dc=0, fd_recon_dc_n_cg=5, fd_recon_dc_relax=0.5, dataset_kind=breast_ct, rationale=iter-13 STEPS=4 efficiency, breast-native wdm-wavelet UNCONSTRAINED (DC OFF). SIX-BOX: (1) PRIOR: init_t optimum at eta=0 is a FLAT minimum ~t0.45-0.5 (t0.45 rmse0.01128, t0.5 0.01130, t0.6 0.01160). steps 8=16. Best t0.45 eta0 steps8. All hr=0; DC-off floor ~0.0113. (2) Failure mode: prior ceiling, not NFE. (3) ONE KNOB: fd_recon_steps 8->4 at t0.45 eta0. (4) HYPOTHESIS: 4 steps ~= 8 steps rmse (since 16=8) -> confirms even 4 NFE suffices for the DC-off prior-denoise; if slightly worse, 8 is the min. Documents the NFE floor. (5) BUDGET: <5min. (6) Loop continues -- iters 14-20 = eta fine + seed variance at best config for mean+/-std.", "agent": "fastdiff_wdm_wavelet_unconstrained-claude-agentic", "campaign": "search-20260703-01", "cfg_full": {"dataset_kind": "breast_ct", "fd_recon_ckpt": "/cluster/maier/Agent4CT/checkpoints/fast_diffusion_wavelet_breast.pt", "fd_recon_dc": 0, "fd_recon_dc_n_cg": 5, "fd_recon_dc_relax": 0.5, "fd_recon_eta": 0.0, "fd_recon_init": "fbp", "fd_recon_init_t": 0.45, "fd_recon_steps": 4, "rationale": "iter-13 STEPS=4 efficiency, breast-native wdm-wavelet UNCONSTRAINED (DC OFF). SIX-BOX: (1) PRIOR: init_t optimum at eta=0 is a FLAT minimum ~t0.45-0.5 (t0.45 rmse0.01128, t0.5 0.01130, t0.6 0.01160). steps 8=16. Best t0.45 eta0 steps8. All hr=0; DC-off floor ~0.0113. (2) Failure mode: prior ceiling, not NFE. (3) ONE KNOB: fd_recon_steps 8->4 at t0.45 eta0. (4) HYPOTHESIS: 4 steps ~= 8 steps rmse (since 16=8) -> confirms even 4 NFE suffices for the DC-off prior-denoise; if slightly worse, 8 is the min. Documents the NFE floor. (5) BUDGET: <5min. (6) Loop continues -- iters 14-20 = eta fine + seed variance at best config for mean+/-std.", "seed": 42, "val_n": 200}, "challenge": "breast_ct", "change_class": "architecture", "git_commit": "671da566", "images": {"comparison": "runs/breast-ct-claude-agentic-fastdiff-wdm-wavelet-unconstrained-search-20260703-01/iterations/iter-0013/comparison.png", "test_showcase": null, "valtest_showcase": null}, "iter": 13, "kept": false, "metrics": {"headroom": 0.0, "headroom_std": 0.0, "val_psnr": 29.60422706604004, "val_psnr_std": 0.9694591689259536, "val_rmse": 0.011302984319627285, "val_rmse_std": 0.0011787142280139165, "val_ssim": 0.9251366853713989, "val_ssim_std": 0.011665867152120956}, "model": "claude-opus-4-8-1m", "obs_path": "breast-ct-claude-agentic-fastdiff-wdm-wavelet-unconstrained-search-20260703-01/iterations/iter-0013/observation.json", "obs_sha1": "96bcbc367e95cf0c110fbbe8dda6f24adc986f60", "params_M": 3.824908, "params_source": "observation", "rationale": "fastdiff_wdm_wavelet_unconstrained-claude-agentic: val_n=200, seed=42, fd_recon_ckpt=/cluster/maier/Agent4CT/checkpoints/fast_diffusion_wavelet_breast.pt, fd_recon_steps=4, fd_recon_init=fbp, fd_recon_init_t=0.45, fd_recon_eta=0.0, fd_recon_dc=0, fd_recon_dc_n_cg=5, fd_recon_dc_relax=0.5, dataset_kind=breast_ct, rationale=iter-13 STEPS=4 efficiency, breast-native wdm-wavelet UNCONSTRAINED (DC OFF). SIX-BOX: (1) PRIOR: init_t optimum at eta=0 is a FLAT minimum ~t0.45-0.5 (t0.45 rmse0.01128, t0.5 0.01130, t0.6 0.01160). steps 8=16. Best t0.45 eta0 steps8. All hr=0; DC-off floor ~0.0113. (2) Failure mode: prior ceiling, not NFE. (3) ONE KNOB: fd_recon_steps 8->4 at t0.45 eta0. (4) HYPOTHESIS: 4 steps ~= 8 steps rmse (since 16=8) -> confirms even 4 NFE suffices for the DC-off prior-denoise; if slightly worse, 8 is the min. Documents the NFE floor. (5) BUDGET: <5min. (6) Loop continues -- iters 14-20 = eta fine + seed variance at best config for mean+/-std.", "run_id": "breast-ct-claude-agentic-fastdiff-wdm-wavelet-unconstrained-search-20260703-01", "runtime": {"elapsed_s": 52.95499229431152}, "schema_version": 3, "solver_key": "fastdiff-wdm-wavelet-unconstrained", "solver_name": "Fast-diffusion WDM (wavelet, unconstrained)", "split": {"train_n": 3600, "val_n": 200}, "status": "discard", "ts": "2026-07-07T04:14:33Z"}
{"advice_for_others": "fastdiff_wdm_wavelet_unconstrained-claude-agentic: val_n=200, seed=42, fd_recon_ckpt=/cluster/maier/Agent4CT/checkpoints/fast_diffusion_wavelet_breast.pt, fd_recon_steps=8, fd_recon_init=fbp, fd_recon_init_t=0.5, fd_recon_eta=0.1, fd_recon_dc=0, fd_recon_dc_n_cg=5, fd_recon_dc_relax=0.5, dataset_kind=breast_ct, rationale=iter-14 ETA=0.1 fine-check between eta0(rmse0.01130) and eta0.2(0.01141) at t0.5; confirms eta~0 flat optimum. DC OFF. hr expected 0.", "agent": "fastdiff_wdm_wavelet_unconstrained-claude-agentic", "campaign": "search-20260703-01", "cfg_full": {"dataset_kind": "breast_ct", "fd_recon_ckpt": "/cluster/maier/Agent4CT/checkpoints/fast_diffusion_wavelet_breast.pt", "fd_recon_dc": 0, "fd_recon_dc_n_cg": 5, "fd_recon_dc_relax": 0.5, "fd_recon_eta": 0.1, "fd_recon_init": "fbp", "fd_recon_init_t": 0.5, "fd_recon_steps": 8, "rationale": "iter-14 ETA=0.1 fine-check between eta0(rmse0.01130) and eta0.2(0.01141) at t0.5; confirms eta~0 flat optimum. DC OFF. hr expected 0.", "seed": 42, "val_n": 200}, "challenge": "breast_ct", "change_class": "architecture", "git_commit": "671da566", "images": {"comparison": "runs/breast-ct-claude-agentic-fastdiff-wdm-wavelet-unconstrained-search-20260703-01/iterations/iter-0014/comparison.png", "test_showcase": null, "valtest_showcase": null}, "iter": 14, "kept": false, "metrics": {"headroom": 0.0, "headroom_std": 0.0, "val_psnr": 29.59722137451172, "val_psnr_std": 0.9848037894993265, "val_rmse": 0.011312108486890793, "val_rmse_std": 0.001195095024279591, "val_ssim": 0.935730516910553, "val_ssim_std": 0.01215589540731905}, "model": "claude-opus-4-8-1m", "obs_path": "breast-ct-claude-agentic-fastdiff-wdm-wavelet-unconstrained-search-20260703-01/iterations/iter-0014/observation.json", "obs_sha1": "3a371b715f087e9fb43a02cc9645e86a2fb67501", "params_M": 3.824908, "params_source": "observation", "rationale": "fastdiff_wdm_wavelet_unconstrained-claude-agentic: val_n=200, seed=42, fd_recon_ckpt=/cluster/maier/Agent4CT/checkpoints/fast_diffusion_wavelet_breast.pt, fd_recon_steps=8, fd_recon_init=fbp, fd_recon_init_t=0.5, fd_recon_eta=0.1, fd_recon_dc=0, fd_recon_dc_n_cg=5, fd_recon_dc_relax=0.5, dataset_kind=breast_ct, rationale=iter-14 ETA=0.1 fine-check between eta0(rmse0.01130) and eta0.2(0.01141) at t0.5; confirms eta~0 flat optimum. DC OFF. hr expected 0.", "run_id": "breast-ct-claude-agentic-fastdiff-wdm-wavelet-unconstrained-search-20260703-01", "runtime": {"elapsed_s": 82.0999538898468}, "schema_version": 3, "solver_key": "fastdiff-wdm-wavelet-unconstrained", "solver_name": "Fast-diffusion WDM (wavelet, unconstrained)", "split": {"train_n": 3600, "val_n": 200}, "status": "discard", "ts": "2026-07-07T04:16:47Z"}
