{"advice_for_others": "manduca_bilateral-claude-agentic: proj_n_bf=1, proj_sr=1.5, proj_w=5, proj_kernel=5, bf_d_w_ratio=0.16666666666666666, manduca_N0=100000.0, manduca_bowtie=True, img_n_bf=6, img_kernel=9, img_sx=0.5, img_sy=0.5, img_sr=0.05, epochs=10, batch_size=1, lr=0.005, optimizer=adam, lambda_neg=1.0, grad_clip=1.0, train_n=400, val_n=200, val_chunk=10, seed=42, rationale=iter-13 manduca_bilateral breast (train_n=400, val=200). SIX-BOX from BEST (iter-8 hr=0.2771): (1) PRIOR: ceiling hr=0.2771 (iter-8). lr 1e-3 (iter-12) REGRESSED to 0.2353 -> lr=5e-3 optimal. All SCALAR levers mapped (img_sr peak 0.05, img_n_bf sat@6, img_kernel 9, img spatial 0.5, epochs inert, proj_n_bf worse, proj_sr flat, lr optimal). The TRAINABLE BOWTIE (manduca_bowtie, per-detector log-N0 profile) is the one UNTESTED architectural DOF -- makes the Manduca noise model per-ray instead of scalar-N0. (2) FAILURE MODE: scalar-N0 assumes uniform incident flux across detectors; if the breast sinogram has per-detector-column intensity structure, a single N0 mis-stabilizes per-ray variance, leaving the proj-bilateral's noise-adaptivity mistuned column-wise. (3) ONE KNOB: manduca_bowtie False -> True (from iter-8 best; +n_det=1024 params, init zero = identical to scalar at step 0). Architecturally-distinct DOF. (4) HYPOTHESIS: bowtie=True lifts hr above 0.2771 because a learnable per-detector blank-scan profile lets the sqrt/Anscombe variance stabilization adapt per ray, so the proj-bilateral becomes genuinely noise-adaptive column-wise (the paper's per-ray mechanism). FALSIFIER: if flat (proj-domain already inert), the bowtie is cosmetic -> proj-domain conclusively exhausted, remaining iters consolidate the best config. (5) BUDGET: +1024 params but same forward cost (one broadcast add); ~500s, under 20-min. params_M ~1e-3. (6) Loop continues; iter-14 on landing. turbo, save ckpt+recon, params_M logged.", "agent": "manduca_bilateral-claude-agentic", "campaign": "search-20260703-01", "cfg_full": {"batch_size": 1, "bf_d_w_ratio": 0.16666666666666666, "epochs": 10, "grad_clip": 1.0, "img_kernel": 9, "img_n_bf": 6, "img_sr": 0.05, "img_sx": 0.5, "img_sy": 0.5, "lambda_neg": 1.0, "lr": 0.005, "manduca_N0": 100000.0, "manduca_bowtie": true, "optimizer": "adam", "proj_kernel": 5, "proj_n_bf": 1, "proj_sr": 1.5, "proj_w": 5, "rationale": "iter-13 manduca_bilateral breast (train_n=400, val=200). SIX-BOX from BEST (iter-8 hr=0.2771): (1) PRIOR: ceiling hr=0.2771 (iter-8). lr 1e-3 (iter-12) REGRESSED to 0.2353 -> lr=5e-3 optimal. All SCALAR levers mapped (img_sr peak 0.05, img_n_bf sat@6, img_kernel 9, img spatial 0.5, epochs inert, proj_n_bf worse, proj_sr flat, lr optimal). The TRAINABLE BOWTIE (manduca_bowtie, per-detector log-N0 profile) is the one UNTESTED architectural DOF -- makes the Manduca noise model per-ray instead of scalar-N0. (2) FAILURE MODE: scalar-N0 assumes uniform incident flux across detectors; if the breast sinogram has per-detector-column intensity structure, a single N0 mis-stabilizes per-ray variance, leaving the proj-bilateral's noise-adaptivity mistuned column-wise. (3) ONE KNOB: manduca_bowtie False -> True (from iter-8 best; +n_det=1024 params, init zero = identical to scalar at step 0). Architecturally-distinct DOF. (4) HYPOTHESIS: bowtie=True lifts hr above 0.2771 because a learnable per-detector blank-scan profile lets the sqrt/Anscombe variance stabilization adapt per ray, so the proj-bilateral becomes genuinely noise-adaptive column-wise (the paper's per-ray mechanism). FALSIFIER: if flat (proj-domain already inert), the bowtie is cosmetic -> proj-domain conclusively exhausted, remaining iters consolidate the best config. (5) BUDGET: +1024 params but same forward cost (one broadcast add); ~500s, under 20-min. params_M ~1e-3. (6) Loop continues; iter-14 on landing. turbo, save ckpt+recon, params_M logged.", "seed": 42, "train_n": 400, "val_chunk": 10, "val_n": 200}, "challenge": "breast_ct", "change_class": "architecture", "git_commit": "671da566", "images": {"comparison": "runs/breast-ct-claude-agentic-manduca-bilateral-search-20260703-01/iterations/iter-0013/comparison.png", "test_showcase": null, "valtest_showcase": null}, "iter": 13, "kept": false, "metrics": {"headroom": 0.0, "headroom_std": 0.0, "val_psnr": 16.678421020507812, "val_psnr_std": 0.17881342850146645, "val_rmse": 0.05005915090441704, "val_rmse_std": 0.0005200933135962208, "val_ssim": 0.4516042172908783, "val_ssim_std": 0.004250561844048963}, "model": "claude-opus-4-8-1m", "obs_path": "breast-ct-claude-agentic-manduca-bilateral-search-20260703-01/iterations/iter-0013/observation.json", "obs_sha1": "b9cdd30722b5efa80f151a5f82840d08e311f7e0", "params_M": 0.001046, "params_source": "observation", "rationale": "manduca_bilateral-claude-agentic: proj_n_bf=1, proj_sr=1.5, proj_w=5, proj_kernel=5, bf_d_w_ratio=0.16666666666666666, manduca_N0=100000.0, manduca_bowtie=True, img_n_bf=6, img_kernel=9, img_sx=0.5, img_sy=0.5, img_sr=0.05, epochs=10, batch_size=1, lr=0.005, optimizer=adam, lambda_neg=1.0, grad_clip=1.0, train_n=400, val_n=200, val_chunk=10, seed=42, rationale=iter-13 manduca_bilateral breast (train_n=400, val=200). SIX-BOX from BEST (iter-8 hr=0.2771): (1) PRIOR: ceiling hr=0.2771 (iter-8). lr 1e-3 (iter-12) REGRESSED to 0.2353 -> lr=5e-3 optimal. All SCALAR levers mapped (img_sr peak 0.05, img_n_bf sat@6, img_kernel 9, img spatial 0.5, epochs inert, proj_n_bf worse, proj_sr flat, lr optimal). The TRAINABLE BOWTIE (manduca_bowtie, per-detector log-N0 profile) is the one UNTESTED architectural DOF -- makes the Manduca noise model per-ray instead of scalar-N0. (2) FAILURE MODE: scalar-N0 assumes uniform incident flux across detectors; if the breast sinogram has per-detector-column intensity structure, a single N0 mis-stabilizes per-ray variance, leaving the proj-bilateral's noise-adaptivity mistuned column-wise. (3) ONE KNOB: manduca_bowtie False -> True (from iter-8 best; +n_det=1024 params, init zero = identical to scalar at step 0). Architecturally-distinct DOF. (4) HYPOTHESIS: bowtie=True lifts hr above 0.2771 because a learnable per-detector blank-scan profile lets the sqrt/Anscombe variance stabilization adapt per ray, so the proj-bilateral becomes genuinely noise-adaptive column-wise (the paper's per-ray mechanism). FALSIFIER: if flat (proj-domain already inert), the bowtie is cosmetic -> proj-domain conclusively exhausted, remaining iters consolidate the best config. (5) BUDGET: +1024 params but same forward cost (one broadcast add); ~500s, under 20-min. params_M ~1e-3. (6) Loop continues; iter-14 on landing. turbo, save ckpt+recon, params_M logged.", "run_id": "breast-ct-claude-agentic-manduca-bilateral-search-20260703-01", "runtime": {"elapsed_s": 488.0917422771454}, "schema_version": 3, "solver_key": "manduca-bilateral", "solver_name": "Manduca proj-bilateral (trainable)", "split": {"train_n": 400, "val_n": 200}, "status": "discard", "ts": "2026-07-05T08:18:54Z"}
{"advice_for_others": "manduca_bilateral-claude-agentic: proj_n_bf=1, proj_sr=1.5, proj_w=5, proj_kernel=5, bf_d_w_ratio=0.16666666666666666, manduca_N0=100000.0, manduca_bowtie=False, img_n_bf=6, img_kernel=9, img_sx=0.5, img_sy=0.5, img_sr=0.05, epochs=10, batch_size=1, lr=0.005, optimizer=adam, lambda_neg=1.0, grad_clip=1.0, train_n=1600, val_n=200, val_chunk=10, seed=42, rationale=iter-14 manduca_bilateral breast (val=200). SIX-BOX from BEST (iter-8 hr=0.2771): (1) PRIOR: bowtie=True (iter-13) COLLAPSED to hr=0 ssim=0.45 (1024 per-detector log-N0 params diverged, corrupted the log-sino inversion) -> revert bowtie=False; proj-domain conclusively harmful when given DOF. All levers mapped at train_n=400. TRAIN_N (=400 throughout) UNTESTED -- coordinator allows <=2400. (2) FAILURE MODE: the 21-param image bilateral may be DATA-limited not capacity-limited -- 400 train scenes may under-determine the sigma optimum for the val=200 distribution. (3) ONE KNOB: train_n 400 -> 1600 (from iter-8 best config, bowtie reverted False; 4x supervised scenes). (4) HYPOTHESIS: train_n 400->1600 lifts hr above 0.2771 because more supervised scene diversity lets the bilateral sigmas converge to a denoiser that generalizes better to val=200, IF the plateau was data- not capacity-limited. FALSIFIER: if flat, the plateau is a genuine 21-param capacity ceiling -> iters 15-20 confirm best config. (5) BUDGET: 16000 steps vs iter-4's 4000@236s -> ~950s, under 1200s (20-min). ep10 kept. (6) Loop continues; iter-15 on landing. turbo, save ckpt+recon, params_M logged.", "agent": "manduca_bilateral-claude-agentic", "campaign": "search-20260703-01", "cfg_full": {"batch_size": 1, "bf_d_w_ratio": 0.16666666666666666, "epochs": 10, "grad_clip": 1.0, "img_kernel": 9, "img_n_bf": 6, "img_sr": 0.05, "img_sx": 0.5, "img_sy": 0.5, "lambda_neg": 1.0, "lr": 0.005, "manduca_N0": 100000.0, "manduca_bowtie": false, "optimizer": "adam", "proj_kernel": 5, "proj_n_bf": 1, "proj_sr": 1.5, "proj_w": 5, "rationale": "iter-14 manduca_bilateral breast (val=200). SIX-BOX from BEST (iter-8 hr=0.2771): (1) PRIOR: bowtie=True (iter-13) COLLAPSED to hr=0 ssim=0.45 (1024 per-detector log-N0 params diverged, corrupted the log-sino inversion) -> revert bowtie=False; proj-domain conclusively harmful when given DOF. All levers mapped at train_n=400. TRAIN_N (=400 throughout) UNTESTED -- coordinator allows <=2400. (2) FAILURE MODE: the 21-param image bilateral may be DATA-limited not capacity-limited -- 400 train scenes may under-determine the sigma optimum for the val=200 distribution. (3) ONE KNOB: train_n 400 -> 1600 (from iter-8 best config, bowtie reverted False; 4x supervised scenes). (4) HYPOTHESIS: train_n 400->1600 lifts hr above 0.2771 because more supervised scene diversity lets the bilateral sigmas converge to a denoiser that generalizes better to val=200, IF the plateau was data- not capacity-limited. FALSIFIER: if flat, the plateau is a genuine 21-param capacity ceiling -> iters 15-20 confirm best config. (5) BUDGET: 16000 steps vs iter-4's 4000@236s -> ~950s, under 1200s (20-min). ep10 kept. (6) Loop continues; iter-15 on landing. turbo, save ckpt+recon, params_M logged.", "seed": 42, "train_n": 1600, "val_chunk": 10, "val_n": 200}, "challenge": "breast_ct", "change_class": "architecture", "git_commit": "671da566", "images": {"comparison": "runs/breast-ct-claude-agentic-manduca-bilateral-search-20260703-01/iterations/iter-0014/comparison.png", "test_showcase": null, "valtest_showcase": null}, "iter": 14, "kept": true, "metrics": {"headroom": 0.27814241976554055, "headroom_std": 0.00936822267858847, "val_psnr": 39.15516662597656, "val_psnr_std": 0.5654787712087934, "val_rmse": 0.0037639702204614878, "val_rmse_std": 0.0002385446297853118, "val_ssim": 0.9815382361412048, "val_ssim_std": 0.003328489266682958}, "model": "claude-opus-4-8-1m", "obs_path": "breast-ct-claude-agentic-manduca-bilateral-search-20260703-01/iterations/iter-0014/observation.json", "obs_sha1": "2414bf12efefd49709a617ec9aaa77333b896103", "params_M": 2.2e-05, "params_source": "observation", "rationale": "manduca_bilateral-claude-agentic: proj_n_bf=1, proj_sr=1.5, proj_w=5, proj_kernel=5, bf_d_w_ratio=0.16666666666666666, manduca_N0=100000.0, manduca_bowtie=False, img_n_bf=6, img_kernel=9, img_sx=0.5, img_sy=0.5, img_sr=0.05, epochs=10, batch_size=1, lr=0.005, optimizer=adam, lambda_neg=1.0, grad_clip=1.0, train_n=1600, val_n=200, val_chunk=10, seed=42, rationale=iter-14 manduca_bilateral breast (val=200). SIX-BOX from BEST (iter-8 hr=0.2771): (1) PRIOR: bowtie=True (iter-13) COLLAPSED to hr=0 ssim=0.45 (1024 per-detector log-N0 params diverged, corrupted the log-sino inversion) -> revert bowtie=False; proj-domain conclusively harmful when given DOF. All levers mapped at train_n=400. TRAIN_N (=400 throughout) UNTESTED -- coordinator allows <=2400. (2) FAILURE MODE: the 21-param image bilateral may be DATA-limited not capacity-limited -- 400 train scenes may under-determine the sigma optimum for the val=200 distribution. (3) ONE KNOB: train_n 400 -> 1600 (from iter-8 best config, bowtie reverted False; 4x supervised scenes). (4) HYPOTHESIS: train_n 400->1600 lifts hr above 0.2771 because more supervised scene diversity lets the bilateral sigmas converge to a denoiser that generalizes better to val=200, IF the plateau was data- not capacity-limited. FALSIFIER: if flat, the plateau is a genuine 21-param capacity ceiling -> iters 15-20 confirm best config. (5) BUDGET: 16000 steps vs iter-4's 4000@236s -> ~950s, under 1200s (20-min). ep10 kept. (6) Loop continues; iter-15 on landing. turbo, save ckpt+recon, params_M logged.", "run_id": "breast-ct-claude-agentic-manduca-bilateral-search-20260703-01", "runtime": {"elapsed_s": 1764.9290957450867}, "schema_version": 3, "solver_key": "manduca-bilateral", "solver_name": "Manduca proj-bilateral (trainable)", "split": {"train_n": 1600, "val_n": 200}, "status": "keep", "ts": "2026-07-05T09:40:10Z"}
{"advice_for_others": "manduca_bilateral-claude-agentic: proj_n_bf=1, proj_sr=1.5, proj_w=5, proj_kernel=5, bf_d_w_ratio=0.16666666666666666, manduca_N0=100000.0, manduca_bowtie=False, img_n_bf=6, img_kernel=9, img_sx=0.5, img_sy=0.5, img_sr=0.05, epochs=10, batch_size=1, lr=0.005, optimizer=adam, lambda_neg=1.0, grad_clip=1.0, train_n=400, val_n=200, val_chunk=10, seed=42, rationale=iter-15 manduca_bilateral breast CEILING CONFIRMATION (val=200). SIX-BOX: (1) PRIOR: ceiling hr~0.278 -- iter-14 (train_n=1600) hr=0.2781 vs iter-8 (train_n=400) hr=0.2771 = +0.001 for 4x data & 7x wall -> CAPACITY ceiling confirmed, NOT data-limited. bowtie collapsed (hr=0), proj-domain harmful, all image-tail knobs at optimum (img_sr=0.05, img_n_bf=6, img_kernel=9, img spatial=0.5, ep10, lr=5e-3). (2) FAILURE MODE: none new -- the 21-param image bilateral is at its architectural ceiling; FBP + fixed-capacity bilateral sets ~0.278. (3) ONE KNOB: revert train_n 1600->400 (efficient best config; confirmation reproducing the iter-8 operating point toward HARD iter-20 stop). (4) HYPOTHESIS: train_n=400 at best image-tail config reproduces hr~0.277 within +/-0.001 run noise, confirming the ceiling is capacity- not data-bound and stable. (5) BUDGET: ~236-500s, well under 20-min (much cheaper than iter-14's 1765s). (6) Loop continues; iter-16 on landing. turbo, save ckpt+recon, params_M logged.", "agent": "manduca_bilateral-claude-agentic", "campaign": "search-20260703-01", "cfg_full": {"batch_size": 1, "bf_d_w_ratio": 0.16666666666666666, "epochs": 10, "grad_clip": 1.0, "img_kernel": 9, "img_n_bf": 6, "img_sr": 0.05, "img_sx": 0.5, "img_sy": 0.5, "lambda_neg": 1.0, "lr": 0.005, "manduca_N0": 100000.0, "manduca_bowtie": false, "optimizer": "adam", "proj_kernel": 5, "proj_n_bf": 1, "proj_sr": 1.5, "proj_w": 5, "rationale": "iter-15 manduca_bilateral breast CEILING CONFIRMATION (val=200). SIX-BOX: (1) PRIOR: ceiling hr~0.278 -- iter-14 (train_n=1600) hr=0.2781 vs iter-8 (train_n=400) hr=0.2771 = +0.001 for 4x data & 7x wall -> CAPACITY ceiling confirmed, NOT data-limited. bowtie collapsed (hr=0), proj-domain harmful, all image-tail knobs at optimum (img_sr=0.05, img_n_bf=6, img_kernel=9, img spatial=0.5, ep10, lr=5e-3). (2) FAILURE MODE: none new -- the 21-param image bilateral is at its architectural ceiling; FBP + fixed-capacity bilateral sets ~0.278. (3) ONE KNOB: revert train_n 1600->400 (efficient best config; confirmation reproducing the iter-8 operating point toward HARD iter-20 stop). (4) HYPOTHESIS: train_n=400 at best image-tail config reproduces hr~0.277 within +/-0.001 run noise, confirming the ceiling is capacity- not data-bound and stable. (5) BUDGET: ~236-500s, well under 20-min (much cheaper than iter-14's 1765s). (6) Loop continues; iter-16 on landing. turbo, save ckpt+recon, params_M logged.", "seed": 42, "train_n": 400, "val_chunk": 10, "val_n": 200}, "challenge": "breast_ct", "change_class": "architecture", "git_commit": "671da566", "images": {"comparison": "runs/breast-ct-claude-agentic-manduca-bilateral-search-20260703-01/iterations/iter-0015/comparison.png", "test_showcase": null, "valtest_showcase": null}, "iter": 15, "kept": true, "metrics": {"headroom": 0.2770812091781544, "headroom_std": 0.009381967318271251, "val_psnr": 39.14240646362305, "val_psnr_std": 0.5638726386472839, "val_rmse": 0.0037695036735385656, "val_rmse_std": 0.00023820019699248747, "val_ssim": 0.9814385771751404, "val_ssim_std": 0.0033376241747160055}, "model": "claude-opus-4-8-1m", "obs_path": "breast-ct-claude-agentic-manduca-bilateral-search-20260703-01/iterations/iter-0015/observation.json", "obs_sha1": "23c2b50ae0d30da59129aba4bbf20fb8d58c5b03", "params_M": 2.2e-05, "params_source": "observation", "rationale": "manduca_bilateral-claude-agentic: proj_n_bf=1, proj_sr=1.5, proj_w=5, proj_kernel=5, bf_d_w_ratio=0.16666666666666666, manduca_N0=100000.0, manduca_bowtie=False, img_n_bf=6, img_kernel=9, img_sx=0.5, img_sy=0.5, img_sr=0.05, epochs=10, batch_size=1, lr=0.005, optimizer=adam, lambda_neg=1.0, grad_clip=1.0, train_n=400, val_n=200, val_chunk=10, seed=42, rationale=iter-15 manduca_bilateral breast CEILING CONFIRMATION (val=200). SIX-BOX: (1) PRIOR: ceiling hr~0.278 -- iter-14 (train_n=1600) hr=0.2781 vs iter-8 (train_n=400) hr=0.2771 = +0.001 for 4x data & 7x wall -> CAPACITY ceiling confirmed, NOT data-limited. bowtie collapsed (hr=0), proj-domain harmful, all image-tail knobs at optimum (img_sr=0.05, img_n_bf=6, img_kernel=9, img spatial=0.5, ep10, lr=5e-3). (2) FAILURE MODE: none new -- the 21-param image bilateral is at its architectural ceiling; FBP + fixed-capacity bilateral sets ~0.278. (3) ONE KNOB: revert train_n 1600->400 (efficient best config; confirmation reproducing the iter-8 operating point toward HARD iter-20 stop). (4) HYPOTHESIS: train_n=400 at best image-tail config reproduces hr~0.277 within +/-0.001 run noise, confirming the ceiling is capacity- not data-bound and stable. (5) BUDGET: ~236-500s, well under 20-min (much cheaper than iter-14's 1765s). (6) Loop continues; iter-16 on landing. turbo, save ckpt+recon, params_M logged.", "run_id": "breast-ct-claude-agentic-manduca-bilateral-search-20260703-01", "runtime": {"elapsed_s": 472.8542788028717}, "schema_version": 3, "solver_key": "manduca-bilateral", "solver_name": "Manduca proj-bilateral (trainable)", "split": {"train_n": 400, "val_n": 200}, "status": "keep", "ts": "2026-07-05T10:20:06Z"}
