{"advice_for_others": "naf-claude-agentic: val_n=12, naf_n_freqs=8, naf_hidden=64, naf_layers=3, naf_n_iter=8000, naf_lr=0.01, naf_tv_weight=0.0001, naf_n_clip=0.05, naf_outer_wall_s=800, naf_per_scene_s=60.0, naf_encoding=hash, seed=42, naf_hash_log2_size=21, rationale=iter-12 breast-ct-claude-agentic-naf-search-20260703-01 (redone breast split train3600/val200/test200 seed20260703; val_n=12 CONSTANT for iters 2-20 per coordinator budget intervention 2026-07-05 -- first-12 of the 200-case breast val split, deterministic). SIX-BOX: (1) prior result: all iters so far hr=0 (iter-1 val_n=20 ssim0.355 PSNR6.26 in 970s, NOT a timeout -- a genuine converged fit). (2) failure mode: NAF per-scene INR recon is far below the 128-view breast LD-FBP baseline. (3) ONE knob changed: hash log2_size 19->21 (bigger table). (4) hypothesis: iter-11 (hash default) result informs this. KNOB: bigger hashmap 2^19->2^21 (fewer collisions at fine levels). HYPOTHESIS: hash collisions at 512px cap detail; a larger table sharpens the fit. Tests hash capacity. (5) wall: val_n=12 x per_scene 60.0s = ~720s < 20min. (6) serial, no user return.", "agent": "naf-claude-agentic", "campaign": "search-20260703-01", "cfg_full": {"naf_encoding": "hash", "naf_hash_log2_size": 21, "naf_hidden": 64, "naf_layers": 3, "naf_lr": 0.01, "naf_n_clip": 0.05, "naf_n_freqs": 8, "naf_n_iter": 8000, "naf_outer_wall_s": 800, "naf_per_scene_s": 60.0, "naf_tv_weight": 0.0001, "rationale": "iter-12 breast-ct-claude-agentic-naf-search-20260703-01 (redone breast split train3600/val200/test200 seed20260703; val_n=12 CONSTANT for iters 2-20 per coordinator budget intervention 2026-07-05 -- first-12 of the 200-case breast val split, deterministic). SIX-BOX: (1) prior result: all iters so far hr=0 (iter-1 val_n=20 ssim0.355 PSNR6.26 in 970s, NOT a timeout -- a genuine converged fit). (2) failure mode: NAF per-scene INR recon is far below the 128-view breast LD-FBP baseline. (3) ONE knob changed: hash log2_size 19->21 (bigger table). (4) hypothesis: iter-11 (hash default) result informs this. KNOB: bigger hashmap 2^19->2^21 (fewer collisions at fine levels). HYPOTHESIS: hash collisions at 512px cap detail; a larger table sharpens the fit. Tests hash capacity. (5) wall: val_n=12 x per_scene 60.0s = ~720s < 20min. (6) serial, no user return.", "seed": 42, "val_n": 12}, "challenge": "breast_ct", "change_class": "architecture", "git_commit": "671da566", "images": {"comparison": "runs/breast-ct-claude-agentic-naf-search-20260703-01/iterations/iter-0012/comparison.png", "test_showcase": null, "valtest_showcase": null}, "iter": 12, "kept": false, "metrics": {"headroom": 0.0, "headroom_std": 0.0, "val_psnr": 22.008800506591797, "val_psnr_std": 0.6798172545533402, "val_rmse": 0.026057807728648186, "val_rmse_std": 0.0020013967254806945, "val_ssim": 0.8350316882133484, "val_ssim_std": 0.013653024823748928}, "model": "claude-opus-4-8-1m", "obs_path": "breast-ct-claude-agentic-naf-search-20260703-01/iterations/iter-0012/observation.json", "obs_sha1": "dc3c7fe4f107d15a2738c09867074c6ad5f54be2", "params_M": 67.115201, "params_source": "observation", "rationale": "naf-claude-agentic: val_n=12, naf_n_freqs=8, naf_hidden=64, naf_layers=3, naf_n_iter=8000, naf_lr=0.01, naf_tv_weight=0.0001, naf_n_clip=0.05, naf_outer_wall_s=800, naf_per_scene_s=60.0, naf_encoding=hash, seed=42, naf_hash_log2_size=21, rationale=iter-12 breast-ct-claude-agentic-naf-search-20260703-01 (redone breast split train3600/val200/test200 seed20260703; val_n=12 CONSTANT for iters 2-20 per coordinator budget intervention 2026-07-05 -- first-12 of the 200-case breast val split, deterministic). SIX-BOX: (1) prior result: all iters so far hr=0 (iter-1 val_n=20 ssim0.355 PSNR6.26 in 970s, NOT a timeout -- a genuine converged fit). (2) failure mode: NAF per-scene INR recon is far below the 128-view breast LD-FBP baseline. (3) ONE knob changed: hash log2_size 19->21 (bigger table). (4) hypothesis: iter-11 (hash default) result informs this. KNOB: bigger hashmap 2^19->2^21 (fewer collisions at fine levels). HYPOTHESIS: hash collisions at 512px cap detail; a larger table sharpens the fit. Tests hash capacity. (5) wall: val_n=12 x per_scene 60.0s = ~720s < 20min. (6) serial, no user return.", "run_id": "breast-ct-claude-agentic-naf-search-20260703-01", "runtime": {"elapsed_s": 744.0138189792633}, "schema_version": 3, "solver_key": "naf", "solver_name": "NAF", "split": {"train_n": 0, "val_n": 12}, "status": "discard", "ts": "2026-07-06T07:04:31Z"}
{"advice_for_others": "naf-claude-agentic: val_n=12, naf_n_freqs=8, naf_hidden=64, naf_layers=3, naf_n_iter=8000, naf_lr=0.01, naf_tv_weight=0.0001, naf_n_clip=0.05, naf_outer_wall_s=800, naf_per_scene_s=60.0, naf_encoding=hash, seed=42, naf_hash_max_res=1024, rationale=iter-13 breast-ct-claude-agentic-naf-search-20260703-01 (redone breast split train3600/val200/test200 seed20260703; val_n=12 CONSTANT for iters 2-20 per coordinator budget intervention 2026-07-05 -- first-12 of the 200-case breast val split, deterministic). SIX-BOX: (1) prior result: all iters so far hr=0 (iter-1 val_n=20 ssim0.355 PSNR6.26 in 970s, NOT a timeout -- a genuine converged fit). (2) failure mode: NAF per-scene INR recon is far below the 128-view breast LD-FBP baseline. (3) ONE knob changed: hash max_res 512->1024. (4) hypothesis: KNOB: raise finest hash grid res 512->1024 (sub-pixel features). HYPOTHESIS: finer top level resolves edges below one pixel. Tests the hash resolution axis. (5) wall: val_n=12 x per_scene 60.0s = ~720s < 20min. (6) serial, no user return.", "agent": "naf-claude-agentic", "campaign": "search-20260703-01", "cfg_full": {"naf_encoding": "hash", "naf_hash_max_res": 1024, "naf_hidden": 64, "naf_layers": 3, "naf_lr": 0.01, "naf_n_clip": 0.05, "naf_n_freqs": 8, "naf_n_iter": 8000, "naf_outer_wall_s": 800, "naf_per_scene_s": 60.0, "naf_tv_weight": 0.0001, "rationale": "iter-13 breast-ct-claude-agentic-naf-search-20260703-01 (redone breast split train3600/val200/test200 seed20260703; val_n=12 CONSTANT for iters 2-20 per coordinator budget intervention 2026-07-05 -- first-12 of the 200-case breast val split, deterministic). SIX-BOX: (1) prior result: all iters so far hr=0 (iter-1 val_n=20 ssim0.355 PSNR6.26 in 970s, NOT a timeout -- a genuine converged fit). (2) failure mode: NAF per-scene INR recon is far below the 128-view breast LD-FBP baseline. (3) ONE knob changed: hash max_res 512->1024. (4) hypothesis: KNOB: raise finest hash grid res 512->1024 (sub-pixel features). HYPOTHESIS: finer top level resolves edges below one pixel. Tests the hash resolution axis. (5) wall: val_n=12 x per_scene 60.0s = ~720s < 20min. (6) serial, no user return.", "seed": 42, "val_n": 12}, "challenge": "breast_ct", "change_class": "architecture", "git_commit": "671da566", "images": {"comparison": "runs/breast-ct-claude-agentic-naf-search-20260703-01/iterations/iter-0013/comparison.png", "test_showcase": null, "valtest_showcase": null}, "iter": 13, "kept": false, "metrics": {"headroom": 0.0, "headroom_std": 0.0, "val_psnr": 21.828031539916992, "val_psnr_std": 0.7914638507908461, "val_rmse": 0.026605796068906784, "val_rmse_std": 0.002591274778530749, "val_ssim": 0.8291264772415161, "val_ssim_std": 0.013578048724292075}, "model": "claude-opus-4-8-1m", "obs_path": "breast-ct-claude-agentic-naf-search-20260703-01/iterations/iter-0013/observation.json", "obs_sha1": "ddeb3b97633ce5ea877393233d6824d44a7097dc", "params_M": 16.783553, "params_source": "observation", "rationale": "naf-claude-agentic: val_n=12, naf_n_freqs=8, naf_hidden=64, naf_layers=3, naf_n_iter=8000, naf_lr=0.01, naf_tv_weight=0.0001, naf_n_clip=0.05, naf_outer_wall_s=800, naf_per_scene_s=60.0, naf_encoding=hash, seed=42, naf_hash_max_res=1024, rationale=iter-13 breast-ct-claude-agentic-naf-search-20260703-01 (redone breast split train3600/val200/test200 seed20260703; val_n=12 CONSTANT for iters 2-20 per coordinator budget intervention 2026-07-05 -- first-12 of the 200-case breast val split, deterministic). SIX-BOX: (1) prior result: all iters so far hr=0 (iter-1 val_n=20 ssim0.355 PSNR6.26 in 970s, NOT a timeout -- a genuine converged fit). (2) failure mode: NAF per-scene INR recon is far below the 128-view breast LD-FBP baseline. (3) ONE knob changed: hash max_res 512->1024. (4) hypothesis: KNOB: raise finest hash grid res 512->1024 (sub-pixel features). HYPOTHESIS: finer top level resolves edges below one pixel. Tests the hash resolution axis. (5) wall: val_n=12 x per_scene 60.0s = ~720s < 20min. (6) serial, no user return.", "run_id": "breast-ct-claude-agentic-naf-search-20260703-01", "runtime": {"elapsed_s": 740.0063054561615}, "schema_version": 3, "solver_key": "naf", "solver_name": "NAF", "split": {"train_n": 0, "val_n": 12}, "status": "discard", "ts": "2026-07-06T08:30:15Z"}
{"advice_for_others": "naf-claude-agentic: val_n=12, naf_n_freqs=8, naf_hidden=64, naf_layers=3, naf_n_iter=8000, naf_lr=0.01, naf_tv_weight=0.0001, naf_n_clip=0.05, naf_outer_wall_s=800, naf_per_scene_s=60.0, naf_encoding=hash, seed=42, naf_hash_levels=20, rationale=iter-14 breast-ct-claude-agentic-naf-search-20260703-01 (redone breast split train3600/val200/test200 seed20260703; val_n=12 CONSTANT for iters 2-20 per coordinator budget intervention 2026-07-05 -- first-12 of the 200-case breast val split, deterministic). SIX-BOX: (1) prior result: all iters so far hr=0 (iter-1 val_n=20 ssim0.355 PSNR6.26 in 970s, NOT a timeout -- a genuine converged fit). (2) failure mode: NAF per-scene INR recon is far below the 128-view breast LD-FBP baseline. (3) ONE knob changed: hash levels 16->20. (4) hypothesis: KNOB: more hash resolution levels 16->20 (denser multi-scale pyramid). HYPOTHESIS: extra levels bridge coarse-to-fine detail. Tests level count. (5) wall: val_n=12 x per_scene 60.0s = ~720s < 20min. (6) serial, no user return.", "agent": "naf-claude-agentic", "campaign": "search-20260703-01", "cfg_full": {"naf_encoding": "hash", "naf_hash_levels": 20, "naf_hidden": 64, "naf_layers": 3, "naf_lr": 0.01, "naf_n_clip": 0.05, "naf_n_freqs": 8, "naf_n_iter": 8000, "naf_outer_wall_s": 800, "naf_per_scene_s": 60.0, "naf_tv_weight": 0.0001, "rationale": "iter-14 breast-ct-claude-agentic-naf-search-20260703-01 (redone breast split train3600/val200/test200 seed20260703; val_n=12 CONSTANT for iters 2-20 per coordinator budget intervention 2026-07-05 -- first-12 of the 200-case breast val split, deterministic). SIX-BOX: (1) prior result: all iters so far hr=0 (iter-1 val_n=20 ssim0.355 PSNR6.26 in 970s, NOT a timeout -- a genuine converged fit). (2) failure mode: NAF per-scene INR recon is far below the 128-view breast LD-FBP baseline. (3) ONE knob changed: hash levels 16->20. (4) hypothesis: KNOB: more hash resolution levels 16->20 (denser multi-scale pyramid). HYPOTHESIS: extra levels bridge coarse-to-fine detail. Tests level count. (5) wall: val_n=12 x per_scene 60.0s = ~720s < 20min. (6) serial, no user return.", "seed": 42, "val_n": 12}, "challenge": "breast_ct", "change_class": "architecture", "git_commit": "671da566", "images": {"comparison": "runs/breast-ct-claude-agentic-naf-search-20260703-01/iterations/iter-0014/comparison.png", "test_showcase": null, "valtest_showcase": null}, "iter": 14, "kept": false, "metrics": {"headroom": 0.0, "headroom_std": 0.0, "val_psnr": 21.90463638305664, "val_psnr_std": 0.7281462261121704, "val_rmse": 0.026372192427515984, "val_rmse_std": 0.002411903339384781, "val_ssim": 0.8340286612510681, "val_ssim_std": 0.010584299174213035}, "model": "claude-opus-4-8-1m", "obs_path": "breast-ct-claude-agentic-naf-search-20260703-01/iterations/iter-0014/observation.json", "obs_sha1": "a3fb94edb42939b65021b5a32ef938731046df9b", "params_M": 20.978369, "params_source": "observation", "rationale": "naf-claude-agentic: val_n=12, naf_n_freqs=8, naf_hidden=64, naf_layers=3, naf_n_iter=8000, naf_lr=0.01, naf_tv_weight=0.0001, naf_n_clip=0.05, naf_outer_wall_s=800, naf_per_scene_s=60.0, naf_encoding=hash, seed=42, naf_hash_levels=20, rationale=iter-14 breast-ct-claude-agentic-naf-search-20260703-01 (redone breast split train3600/val200/test200 seed20260703; val_n=12 CONSTANT for iters 2-20 per coordinator budget intervention 2026-07-05 -- first-12 of the 200-case breast val split, deterministic). SIX-BOX: (1) prior result: all iters so far hr=0 (iter-1 val_n=20 ssim0.355 PSNR6.26 in 970s, NOT a timeout -- a genuine converged fit). (2) failure mode: NAF per-scene INR recon is far below the 128-view breast LD-FBP baseline. (3) ONE knob changed: hash levels 16->20. (4) hypothesis: KNOB: more hash resolution levels 16->20 (denser multi-scale pyramid). HYPOTHESIS: extra levels bridge coarse-to-fine detail. Tests level count. (5) wall: val_n=12 x per_scene 60.0s = ~720s < 20min. (6) serial, no user return.", "run_id": "breast-ct-claude-agentic-naf-search-20260703-01", "runtime": {"elapsed_s": 737.5771591663361}, "schema_version": 3, "solver_key": "naf", "solver_name": "NAF", "split": {"train_n": 0, "val_n": 12}, "status": "discard", "ts": "2026-07-06T09:51:09Z"}
{"advice_for_others": "naf-claude-agentic: val_n=12, naf_n_freqs=8, naf_hidden=128, naf_layers=3, naf_n_iter=8000, naf_lr=0.01, naf_tv_weight=0.0001, naf_n_clip=0.05, naf_outer_wall_s=800, naf_per_scene_s=60.0, naf_encoding=hash, seed=42, rationale=iter-15 breast-ct-claude-agentic-naf-search-20260703-01 (redone breast split train3600/val200/test200 seed20260703; val_n=12 CONSTANT for iters 2-20 per coordinator budget intervention 2026-07-05 -- first-12 of the 200-case breast val split, deterministic). SIX-BOX: (1) prior result: all iters so far hr=0 (iter-1 val_n=20 ssim0.355 PSNR6.26 in 970s, NOT a timeout -- a genuine converged fit). (2) failure mode: NAF per-scene INR recon is far below the 128-view breast LD-FBP baseline. (3) ONE knob changed: hash + wider MLP hidden 64->128. (4) hypothesis: KNOB: widen the hash-fed MLP 64->128. HYPOTHESIS: if the hash features are rich but the small MLP is the bottleneck, widening helps decode them into mu. Tests decoder capacity for the hash path. (5) wall: val_n=12 x per_scene 60.0s = ~720s < 20min. (6) serial, no user return.", "agent": "naf-claude-agentic", "campaign": "search-20260703-01", "cfg_full": {"naf_encoding": "hash", "naf_hidden": 128, "naf_layers": 3, "naf_lr": 0.01, "naf_n_clip": 0.05, "naf_n_freqs": 8, "naf_n_iter": 8000, "naf_outer_wall_s": 800, "naf_per_scene_s": 60.0, "naf_tv_weight": 0.0001, "rationale": "iter-15 breast-ct-claude-agentic-naf-search-20260703-01 (redone breast split train3600/val200/test200 seed20260703; val_n=12 CONSTANT for iters 2-20 per coordinator budget intervention 2026-07-05 -- first-12 of the 200-case breast val split, deterministic). SIX-BOX: (1) prior result: all iters so far hr=0 (iter-1 val_n=20 ssim0.355 PSNR6.26 in 970s, NOT a timeout -- a genuine converged fit). (2) failure mode: NAF per-scene INR recon is far below the 128-view breast LD-FBP baseline. (3) ONE knob changed: hash + wider MLP hidden 64->128. (4) hypothesis: KNOB: widen the hash-fed MLP 64->128. HYPOTHESIS: if the hash features are rich but the small MLP is the bottleneck, widening helps decode them into mu. Tests decoder capacity for the hash path. (5) wall: val_n=12 x per_scene 60.0s = ~720s < 20min. (6) serial, no user return.", "seed": 42, "val_n": 12}, "challenge": "breast_ct", "change_class": "architecture", "git_commit": "671da566", "images": {"comparison": "runs/breast-ct-claude-agentic-naf-search-20260703-01/iterations/iter-0015/comparison.png", "test_showcase": null, "valtest_showcase": null}, "iter": 15, "kept": false, "metrics": {"headroom": 0.0, "headroom_std": null, "val_psnr": 17.8305606842041, "val_psnr_std": null, "val_rmse": 0.04215506464242935, "val_rmse_std": null, "val_ssim": 0.8168981075286865, "val_ssim_std": null}, "model": "claude-opus-4-8-1m", "obs_path": "breast-ct-claude-agentic-naf-search-20260703-01/iterations/iter-0015/observation.json", "obs_sha1": "cb341b7a39aba16df781647e75b502d709dc609e", "params_M": 16.798081, "params_source": "observation", "rationale": "naf-claude-agentic: val_n=12, naf_n_freqs=8, naf_hidden=128, naf_layers=3, naf_n_iter=8000, naf_lr=0.01, naf_tv_weight=0.0001, naf_n_clip=0.05, naf_outer_wall_s=800, naf_per_scene_s=60.0, naf_encoding=hash, seed=42, rationale=iter-15 breast-ct-claude-agentic-naf-search-20260703-01 (redone breast split train3600/val200/test200 seed20260703; val_n=12 CONSTANT for iters 2-20 per coordinator budget intervention 2026-07-05 -- first-12 of the 200-case breast val split, deterministic). SIX-BOX: (1) prior result: all iters so far hr=0 (iter-1 val_n=20 ssim0.355 PSNR6.26 in 970s, NOT a timeout -- a genuine converged fit). (2) failure mode: NAF per-scene INR recon is far below the 128-view breast LD-FBP baseline. (3) ONE knob changed: hash + wider MLP hidden 64->128. (4) hypothesis: KNOB: widen the hash-fed MLP 64->128. HYPOTHESIS: if the hash features are rich but the small MLP is the bottleneck, widening helps decode them into mu. Tests decoder capacity for the hash path. (5) wall: val_n=12 x per_scene 60.0s = ~720s < 20min. (6) serial, no user return.", "run_id": "breast-ct-claude-agentic-naf-search-20260703-01", "runtime": {"elapsed_s": 738.2053973674774}, "schema_version": 3, "solver_key": "naf", "solver_name": "NAF", "split": {"train_n": 0, "val_n": 12}, "status": "discard", "ts": "2026-07-06T10:26:41Z"}
{"advice_for_others": "naf-claude-agentic: val_n=12, naf_n_freqs=8, naf_hidden=64, naf_layers=3, naf_n_iter=8000, naf_lr=0.05, naf_tv_weight=0.0001, naf_n_clip=0.05, naf_outer_wall_s=800, naf_per_scene_s=60.0, naf_encoding=hash, seed=42, rationale=iter-16 breast-ct-claude-agentic-naf-search-20260703-01 (redone breast split train3600/val200/test200 seed20260703; val_n=12 CONSTANT for iters 2-20 per coordinator budget intervention 2026-07-05 -- first-12 of the 200-case breast val split, deterministic). SIX-BOX: (1) prior result: all iters so far hr=0 (iter-1 val_n=20 ssim0.355 PSNR6.26 in 970s, NOT a timeout -- a genuine converged fit). (2) failure mode: NAF per-scene INR recon is far below the 128-view breast LD-FBP baseline. (3) ONE knob changed: hash + lr 1e-2->5e-2. (4) hypothesis: KNOB: higher lr for the hash tables (Instant-NGP trains tables at high lr). HYPOTHESIS: hash feature tables need aggressive lr to populate in a short per-scene budget. Tests hash optimization. (5) wall: val_n=12 x per_scene 60.0s = ~720s < 20min. (6) serial, no user return.", "agent": "naf-claude-agentic", "campaign": "search-20260703-01", "cfg_full": {"naf_encoding": "hash", "naf_hidden": 64, "naf_layers": 3, "naf_lr": 0.05, "naf_n_clip": 0.05, "naf_n_freqs": 8, "naf_n_iter": 8000, "naf_outer_wall_s": 800, "naf_per_scene_s": 60.0, "naf_tv_weight": 0.0001, "rationale": "iter-16 breast-ct-claude-agentic-naf-search-20260703-01 (redone breast split train3600/val200/test200 seed20260703; val_n=12 CONSTANT for iters 2-20 per coordinator budget intervention 2026-07-05 -- first-12 of the 200-case breast val split, deterministic). SIX-BOX: (1) prior result: all iters so far hr=0 (iter-1 val_n=20 ssim0.355 PSNR6.26 in 970s, NOT a timeout -- a genuine converged fit). (2) failure mode: NAF per-scene INR recon is far below the 128-view breast LD-FBP baseline. (3) ONE knob changed: hash + lr 1e-2->5e-2. (4) hypothesis: KNOB: higher lr for the hash tables (Instant-NGP trains tables at high lr). HYPOTHESIS: hash feature tables need aggressive lr to populate in a short per-scene budget. Tests hash optimization. (5) wall: val_n=12 x per_scene 60.0s = ~720s < 20min. (6) serial, no user return.", "seed": 42, "val_n": 12}, "challenge": "breast_ct", "change_class": "architecture", "git_commit": "671da566", "images": {"comparison": "runs/breast-ct-claude-agentic-naf-search-20260703-01/iterations/iter-0016/comparison.png", "test_showcase": null, "valtest_showcase": null}, "iter": 16, "kept": false, "metrics": {"headroom": 0.0, "headroom_std": null, "val_psnr": 14.045634269714355, "val_psnr_std": null, "val_rmse": 0.06517726927995682, "val_rmse_std": null, "val_ssim": 0.7782753705978394, "val_ssim_std": null}, "model": "claude-opus-4-8-1m", "obs_path": "breast-ct-claude-agentic-naf-search-20260703-01/iterations/iter-0016/observation.json", "obs_sha1": "fac46a94834dcf89ca093b699c36bc809a017f05", "params_M": 16.783553, "params_source": "observation", "rationale": "naf-claude-agentic: val_n=12, naf_n_freqs=8, naf_hidden=64, naf_layers=3, naf_n_iter=8000, naf_lr=0.05, naf_tv_weight=0.0001, naf_n_clip=0.05, naf_outer_wall_s=800, naf_per_scene_s=60.0, naf_encoding=hash, seed=42, rationale=iter-16 breast-ct-claude-agentic-naf-search-20260703-01 (redone breast split train3600/val200/test200 seed20260703; val_n=12 CONSTANT for iters 2-20 per coordinator budget intervention 2026-07-05 -- first-12 of the 200-case breast val split, deterministic). SIX-BOX: (1) prior result: all iters so far hr=0 (iter-1 val_n=20 ssim0.355 PSNR6.26 in 970s, NOT a timeout -- a genuine converged fit). (2) failure mode: NAF per-scene INR recon is far below the 128-view breast LD-FBP baseline. (3) ONE knob changed: hash + lr 1e-2->5e-2. (4) hypothesis: KNOB: higher lr for the hash tables (Instant-NGP trains tables at high lr). HYPOTHESIS: hash feature tables need aggressive lr to populate in a short per-scene budget. Tests hash optimization. (5) wall: val_n=12 x per_scene 60.0s = ~720s < 20min. (6) serial, no user return.", "run_id": "breast-ct-claude-agentic-naf-search-20260703-01", "runtime": {"elapsed_s": 732.6667423248291}, "schema_version": 3, "solver_key": "naf", "solver_name": "NAF", "split": {"train_n": 0, "val_n": 12}, "status": "discard", "ts": "2026-07-06T10:44:06Z"}
