{"advice_for_others": "itnet_v3-claude-agentic: itnet_k=2, unet_c=24, alpha_init=0.0025734, lr=0.00021567, epochs=5, batch_size=2, train_n=2400, val_n=200, grad_clip=1.0, max_train_s=1100, seed=45, rationale=iter-18 (breast-ct redo, search-20260703-01). FOURTH bs=2 seed replicate of the c24/ep5/bs2/lr2.16e-4 champion config. ONE KNOB: seed 44 -> 45. All else = iter-7/16/17 config exactly. SIX-BOX (NUMBERS): (1) bs=2 spread so far: s42 0.8469, s43 0.6699, s44 0.8277 -> provisional mean 0.7815 +/- 0.078. Still high-variance (s43 unlucky). bs=1 for comparison: s42 0.8638, s43 0.7983, s44 0.6142 -> 0.759 +/- 0.104. FINDING holds: itnet_v3 breast is intrinsically high-variance (train loss always 1e-6, val hr swings ~0.2); bs=2 is marginally tighter than bs=1. (2) FAILURE MODE: high generalization variance; more seeds needed to tighten the reportable mean. (3) ONE KNOB: seed 44 -> 45 (4th bs=2 point). (4) HYPOTHESIS: n/a (variance replicate); seed 45 refines the 4-point bs=2 mean+/-std. (5) BUDGET (HARD 20min=1200s): bs=2 = 939.5-1096.9s across prior runs, all < 1200s. max_train_s=1100 fences the TRAIN phase. train_n=2400 (<= OOM-safe cap). val=200 distinct val_truth.h5 cases, 256px inscribed-circle FOV (breast default). (6) do NOT return control mid-campaign; gate on iter-18 numeric-headroom obs via iter_wait.sh v3 then dispatch iter-19.", "agent": "itnet_v3-claude-agentic", "campaign": "search-20260703-01", "cfg_full": {"alpha_init": 0.0025734, "batch_size": 2, "epochs": 5, "grad_clip": 1.0, "itnet_k": 2, "lr": 0.00021567, "max_train_s": 1100, "rationale": "iter-18 (breast-ct redo, search-20260703-01). FOURTH bs=2 seed replicate of the c24/ep5/bs2/lr2.16e-4 champion config. ONE KNOB: seed 44 -> 45. All else = iter-7/16/17 config exactly. SIX-BOX (NUMBERS): (1) bs=2 spread so far: s42 0.8469, s43 0.6699, s44 0.8277 -> provisional mean 0.7815 +/- 0.078. Still high-variance (s43 unlucky). bs=1 for comparison: s42 0.8638, s43 0.7983, s44 0.6142 -> 0.759 +/- 0.104. FINDING holds: itnet_v3 breast is intrinsically high-variance (train loss always 1e-6, val hr swings ~0.2); bs=2 is marginally tighter than bs=1. (2) FAILURE MODE: high generalization variance; more seeds needed to tighten the reportable mean. (3) ONE KNOB: seed 44 -> 45 (4th bs=2 point). (4) HYPOTHESIS: n/a (variance replicate); seed 45 refines the 4-point bs=2 mean+/-std. (5) BUDGET (HARD 20min=1200s): bs=2 = 939.5-1096.9s across prior runs, all < 1200s. max_train_s=1100 fences the TRAIN phase. train_n=2400 (<= OOM-safe cap). val=200 distinct val_truth.h5 cases, 256px inscribed-circle FOV (breast default). (6) do NOT return control mid-campaign; gate on iter-18 numeric-headroom obs via iter_wait.sh v3 then dispatch iter-19.", "seed": 45, "train_n": 2400, "unet_c": 24, "val_n": 200}, "challenge": "breast_ct", "change_class": "architecture", "git_commit": "671da566", "images": {"comparison": "runs/breast-ct-claude-agentic-itnet-v3-search-20260703-01/iterations/iter-0018/comparison.png", "test_showcase": null, "valtest_showcase": null}, "iter": 18, "kept": true, "metrics": {"headroom": 0.840170136178422, "headroom_std": 0.013803621476266861, "val_psnr": 52.25103759765625, "val_psnr_std": 1.2945288321068467, "val_rmse": 0.0008333982550539076, "val_rmse_std": 0.00012088300044692635, "val_ssim": 0.998065710067749, "val_ssim_std": 0.0005378857817685659}, "model": "claude-opus-4-8-1m", "obs_path": "breast-ct-claude-agentic-itnet-v3-search-20260703-01/iterations/iter-0018/observation.json", "obs_sha1": "86f3ea3556d8e93a70bb07fae9d6abc5220bcbdc", "params_M": 8.317706, "params_source": "observation", "rationale": "itnet_v3-claude-agentic: itnet_k=2, unet_c=24, alpha_init=0.0025734, lr=0.00021567, epochs=5, batch_size=2, train_n=2400, val_n=200, grad_clip=1.0, max_train_s=1100, seed=45, rationale=iter-18 (breast-ct redo, search-20260703-01). FOURTH bs=2 seed replicate of the c24/ep5/bs2/lr2.16e-4 champion config. ONE KNOB: seed 44 -> 45. All else = iter-7/16/17 config exactly. SIX-BOX (NUMBERS): (1) bs=2 spread so far: s42 0.8469, s43 0.6699, s44 0.8277 -> provisional mean 0.7815 +/- 0.078. Still high-variance (s43 unlucky). bs=1 for comparison: s42 0.8638, s43 0.7983, s44 0.6142 -> 0.759 +/- 0.104. FINDING holds: itnet_v3 breast is intrinsically high-variance (train loss always 1e-6, val hr swings ~0.2); bs=2 is marginally tighter than bs=1. (2) FAILURE MODE: high generalization variance; more seeds needed to tighten the reportable mean. (3) ONE KNOB: seed 44 -> 45 (4th bs=2 point). (4) HYPOTHESIS: n/a (variance replicate); seed 45 refines the 4-point bs=2 mean+/-std. (5) BUDGET (HARD 20min=1200s): bs=2 = 939.5-1096.9s across prior runs, all < 1200s. max_train_s=1100 fences the TRAIN phase. train_n=2400 (<= OOM-safe cap). val=200 distinct val_truth.h5 cases, 256px inscribed-circle FOV (breast default). (6) do NOT return control mid-campaign; gate on iter-18 numeric-headroom obs via iter_wait.sh v3 then dispatch iter-19.", "run_id": "breast-ct-claude-agentic-itnet-v3-search-20260703-01", "runtime": {"elapsed_s": 1092.9372828006744}, "schema_version": 3, "solver_key": "itnet-v3", "solver_name": "ITNet v3", "split": {"train_n": 400, "val_n": 200}, "status": "keep", "ts": "2026-07-05T11:28:58Z"}
{"advice_for_others": "itnet_v3-claude-agentic: itnet_k=2, unet_c=24, alpha_init=0.0025734, lr=0.00021567, epochs=5, batch_size=2, train_n=2400, val_n=200, grad_clip=1.0, max_train_s=1100, seed=46, rationale=iter-19 (breast-ct redo, search-20260703-01). FIFTH bs=2 seed replicate of the c24/ep5/bs2/lr2.16e-4 champion config. ONE KNOB: seed 45 -> 46. All else = iter-7/16/17/18 config exactly. SIX-BOX (NUMBERS): (1) bs=2 4-point spread: s42 0.8469, s43 0.6699, s44 0.8277, s45 0.8402 -> mean 0.7962 +/- 0.075. Three of four seeds cluster in 0.83-0.85; s43 (0.6699) is a low outlier. Adding s46 to firm up the mean and reduce the outlier's leverage. (2) FAILURE MODE: high generalization variance intrinsic to itnet_v3 breast (confirmed at both bs); more seeds tighten the reportable mean+/-std. (3) ONE KNOB: seed 45 -> 46 (5th bs=2 point). (4) HYPOTHESIS: n/a (variance replicate); s46 refines the 5-point bs=2 mean+/-std. (5) BUDGET (HARD 20min=1200s): bs=2 = 939.5-1096.9s across prior runs, all < 1200s. max_train_s=1100 fences the TRAIN phase. train_n=2400 (<= OOM-safe cap). val=200 distinct val_truth.h5 cases, 256px inscribed-circle FOV (breast default). (6) do NOT return control mid-campaign; gate on iter-19 numeric-headroom obs via iter_wait.sh v3 then dispatch iter-20 (FINAL).", "agent": "itnet_v3-claude-agentic", "campaign": "search-20260703-01", "cfg_full": {"alpha_init": 0.0025734, "batch_size": 2, "epochs": 5, "grad_clip": 1.0, "itnet_k": 2, "lr": 0.00021567, "max_train_s": 1100, "rationale": "iter-19 (breast-ct redo, search-20260703-01). FIFTH bs=2 seed replicate of the c24/ep5/bs2/lr2.16e-4 champion config. ONE KNOB: seed 45 -> 46. All else = iter-7/16/17/18 config exactly. SIX-BOX (NUMBERS): (1) bs=2 4-point spread: s42 0.8469, s43 0.6699, s44 0.8277, s45 0.8402 -> mean 0.7962 +/- 0.075. Three of four seeds cluster in 0.83-0.85; s43 (0.6699) is a low outlier. Adding s46 to firm up the mean and reduce the outlier's leverage. (2) FAILURE MODE: high generalization variance intrinsic to itnet_v3 breast (confirmed at both bs); more seeds tighten the reportable mean+/-std. (3) ONE KNOB: seed 45 -> 46 (5th bs=2 point). (4) HYPOTHESIS: n/a (variance replicate); s46 refines the 5-point bs=2 mean+/-std. (5) BUDGET (HARD 20min=1200s): bs=2 = 939.5-1096.9s across prior runs, all < 1200s. max_train_s=1100 fences the TRAIN phase. train_n=2400 (<= OOM-safe cap). val=200 distinct val_truth.h5 cases, 256px inscribed-circle FOV (breast default). (6) do NOT return control mid-campaign; gate on iter-19 numeric-headroom obs via iter_wait.sh v3 then dispatch iter-20 (FINAL).", "seed": 46, "train_n": 2400, "unet_c": 24, "val_n": 200}, "challenge": "breast_ct", "change_class": "architecture", "git_commit": "671da566", "images": {"comparison": "runs/breast-ct-claude-agentic-itnet-v3-search-20260703-01/iterations/iter-0019/comparison.png", "test_showcase": null, "valtest_showcase": null}, "iter": 19, "kept": true, "metrics": {"headroom": 0.8367044682565149, "headroom_std": 0.016331608640212884, "val_psnr": 52.0647087097168, "val_psnr_std": 1.4431062556333398, "val_rmse": 0.00085146923083812, "val_rmse_std": 0.00013686188445042566, "val_ssim": 0.9980766177177429, "val_ssim_std": 0.0006279498451835423}, "model": "claude-opus-4-8-1m", "obs_path": "breast-ct-claude-agentic-itnet-v3-search-20260703-01/iterations/iter-0019/observation.json", "obs_sha1": "a6fa853d3ed5efe8c12726fda36222bdae7b4854", "params_M": 8.317706, "params_source": "observation", "rationale": "itnet_v3-claude-agentic: itnet_k=2, unet_c=24, alpha_init=0.0025734, lr=0.00021567, epochs=5, batch_size=2, train_n=2400, val_n=200, grad_clip=1.0, max_train_s=1100, seed=46, rationale=iter-19 (breast-ct redo, search-20260703-01). FIFTH bs=2 seed replicate of the c24/ep5/bs2/lr2.16e-4 champion config. ONE KNOB: seed 45 -> 46. All else = iter-7/16/17/18 config exactly. SIX-BOX (NUMBERS): (1) bs=2 4-point spread: s42 0.8469, s43 0.6699, s44 0.8277, s45 0.8402 -> mean 0.7962 +/- 0.075. Three of four seeds cluster in 0.83-0.85; s43 (0.6699) is a low outlier. Adding s46 to firm up the mean and reduce the outlier's leverage. (2) FAILURE MODE: high generalization variance intrinsic to itnet_v3 breast (confirmed at both bs); more seeds tighten the reportable mean+/-std. (3) ONE KNOB: seed 45 -> 46 (5th bs=2 point). (4) HYPOTHESIS: n/a (variance replicate); s46 refines the 5-point bs=2 mean+/-std. (5) BUDGET (HARD 20min=1200s): bs=2 = 939.5-1096.9s across prior runs, all < 1200s. max_train_s=1100 fences the TRAIN phase. train_n=2400 (<= OOM-safe cap). val=200 distinct val_truth.h5 cases, 256px inscribed-circle FOV (breast default). (6) do NOT return control mid-campaign; gate on iter-19 numeric-headroom obs via iter_wait.sh v3 then dispatch iter-20 (FINAL).", "run_id": "breast-ct-claude-agentic-itnet-v3-search-20260703-01", "runtime": {"elapsed_s": 1145.2932391166687}, "schema_version": 3, "solver_key": "itnet-v3", "solver_name": "ITNet v3", "split": {"train_n": 400, "val_n": 200}, "status": "keep", "ts": "2026-07-05T12:29:51Z"}
{"advice_for_others": "itnet_v3-claude-agentic: itnet_k=2, unet_c=24, alpha_init=0.0025734, lr=0.00021567, epochs=5, batch_size=2, train_n=2400, val_n=200, grad_clip=1.0, max_train_s=1100, seed=47, rationale=iter-20 (FINAL; breast-ct redo, search-20260703-01). SIXTH bs=2 seed replicate of the c24/ep5/bs2/lr2.16e-4 champion config. ONE KNOB: seed 46 -> 47. All else = iter-7/16/17/18/19 config exactly. SIX-BOX (NUMBERS): (1) bs=2 5-point spread: s42 0.8469, s43 0.6699, s44 0.8277, s45 0.8402, s46 0.8367 -> mean 0.8043 +/- 0.067 (4 of 5 cluster tightly in 0.827-0.847; s43 0.6699 the lone low outlier). This FINAL iter adds s47 to complete a 6-seed bs=2 mean+/-std for the leaderboard/paper. (2) FINDING (campaign conclusion): itnet_v3 on breast-CT is intrinsically HIGH-VARIANCE across seeds -- every run converges to train loss 1e-6 yet val hr swings ~0.2, at BOTH bs=1 and bs=2; the champion number must be the multi-seed MEAN, not any single peak (single-best point was iter-12 bs=1 0.8638, a favorable-seed high). All architecture axes bounded (itnet_k=2 optimal, unet_c=24 optimal) and training recipe fully mapped (lr optimal 2.16e-4, alpha_init inert, bs=2 tighter than bs=1). (3) ONE KNOB: seed 46 -> 47 (6th bs=2 point). (4) HYPOTHESIS: n/a (variance replicate); s47 completes the 6-seed bs=2 mean+/-std. (5) BUDGET (HARD 20min=1200s): bs=2 = 939.5-1145.3s across prior runs, all < 1200s. max_train_s=1100 fences the TRAIN phase. train_n=2400 (<= OOM-safe cap). val=200 distinct val_truth.h5 cases, 256px inscribed-circle FOV (breast default). (6) FINAL iter of the 20-iter agentic search; compile the full trajectory + champion mean+/-std + seed-variance finding after this lands.", "agent": "itnet_v3-claude-agentic", "campaign": "search-20260703-01", "cfg_full": {"alpha_init": 0.0025734, "batch_size": 2, "epochs": 5, "grad_clip": 1.0, "itnet_k": 2, "lr": 0.00021567, "max_train_s": 1100, "rationale": "iter-20 (FINAL; breast-ct redo, search-20260703-01). SIXTH bs=2 seed replicate of the c24/ep5/bs2/lr2.16e-4 champion config. ONE KNOB: seed 46 -> 47. All else = iter-7/16/17/18/19 config exactly. SIX-BOX (NUMBERS): (1) bs=2 5-point spread: s42 0.8469, s43 0.6699, s44 0.8277, s45 0.8402, s46 0.8367 -> mean 0.8043 +/- 0.067 (4 of 5 cluster tightly in 0.827-0.847; s43 0.6699 the lone low outlier). This FINAL iter adds s47 to complete a 6-seed bs=2 mean+/-std for the leaderboard/paper. (2) FINDING (campaign conclusion): itnet_v3 on breast-CT is intrinsically HIGH-VARIANCE across seeds -- every run converges to train loss 1e-6 yet val hr swings ~0.2, at BOTH bs=1 and bs=2; the champion number must be the multi-seed MEAN, not any single peak (single-best point was iter-12 bs=1 0.8638, a favorable-seed high). All architecture axes bounded (itnet_k=2 optimal, unet_c=24 optimal) and training recipe fully mapped (lr optimal 2.16e-4, alpha_init inert, bs=2 tighter than bs=1). (3) ONE KNOB: seed 46 -> 47 (6th bs=2 point). (4) HYPOTHESIS: n/a (variance replicate); s47 completes the 6-seed bs=2 mean+/-std. (5) BUDGET (HARD 20min=1200s): bs=2 = 939.5-1145.3s across prior runs, all < 1200s. max_train_s=1100 fences the TRAIN phase. train_n=2400 (<= OOM-safe cap). val=200 distinct val_truth.h5 cases, 256px inscribed-circle FOV (breast default). (6) FINAL iter of the 20-iter agentic search; compile the full trajectory + champion mean+/-std + seed-variance finding after this lands.", "seed": 47, "train_n": 2400, "unet_c": 24, "val_n": 200}, "challenge": "breast_ct", "change_class": "architecture", "git_commit": "671da566", "images": {"comparison": "runs/breast-ct-claude-agentic-itnet-v3-search-20260703-01/iterations/iter-0020/comparison.png", "test_showcase": null, "valtest_showcase": null}, "iter": 20, "kept": true, "metrics": {"headroom": 0.8382806669364271, "headroom_std": 0.013487768435718476, "val_psnr": 52.148956298828125, "val_psnr_std": 1.2461945098386114, "val_rmse": 0.0008432504837401211, "val_rmse_std": 0.00011887760637977778, "val_ssim": 0.9981047511100769, "val_ssim_std": 0.000515572479356621}, "model": "claude-opus-4-8-1m", "obs_path": "breast-ct-claude-agentic-itnet-v3-search-20260703-01/iterations/iter-0020/observation.json", "obs_sha1": "ef1b8719655ab039f2e977a9fe0051a3cab12888", "params_M": 8.317706, "params_source": "observation", "rationale": "itnet_v3-claude-agentic: itnet_k=2, unet_c=24, alpha_init=0.0025734, lr=0.00021567, epochs=5, batch_size=2, train_n=2400, val_n=200, grad_clip=1.0, max_train_s=1100, seed=47, rationale=iter-20 (FINAL; breast-ct redo, search-20260703-01). SIXTH bs=2 seed replicate of the c24/ep5/bs2/lr2.16e-4 champion config. ONE KNOB: seed 46 -> 47. All else = iter-7/16/17/18/19 config exactly. SIX-BOX (NUMBERS): (1) bs=2 5-point spread: s42 0.8469, s43 0.6699, s44 0.8277, s45 0.8402, s46 0.8367 -> mean 0.8043 +/- 0.067 (4 of 5 cluster tightly in 0.827-0.847; s43 0.6699 the lone low outlier). This FINAL iter adds s47 to complete a 6-seed bs=2 mean+/-std for the leaderboard/paper. (2) FINDING (campaign conclusion): itnet_v3 on breast-CT is intrinsically HIGH-VARIANCE across seeds -- every run converges to train loss 1e-6 yet val hr swings ~0.2, at BOTH bs=1 and bs=2; the champion number must be the multi-seed MEAN, not any single peak (single-best point was iter-12 bs=1 0.8638, a favorable-seed high). All architecture axes bounded (itnet_k=2 optimal, unet_c=24 optimal) and training recipe fully mapped (lr optimal 2.16e-4, alpha_init inert, bs=2 tighter than bs=1). (3) ONE KNOB: seed 46 -> 47 (6th bs=2 point). (4) HYPOTHESIS: n/a (variance replicate); s47 completes the 6-seed bs=2 mean+/-std. (5) BUDGET (HARD 20min=1200s): bs=2 = 939.5-1145.3s across prior runs, all < 1200s. max_train_s=1100 fences the TRAIN phase. train_n=2400 (<= OOM-safe cap). val=200 distinct val_truth.h5 cases, 256px inscribed-circle FOV (breast default). (6) FINAL iter of the 20-iter agentic search; compile the full trajectory + champion mean+/-std + seed-variance finding after this lands.", "run_id": "breast-ct-claude-agentic-itnet-v3-search-20260703-01", "runtime": {"elapsed_s": 1076.5991625785828}, "schema_version": 3, "solver_key": "itnet-v3", "solver_name": "ITNet v3", "split": {"train_n": 400, "val_n": 200}, "status": "keep", "ts": "2026-07-05T13:28:42Z"}
{"advice_for_others": "learned_primal_dual-claude-agentic: lpd_iters=10, lpd_n_primal=5, lpd_n_dual=5, lpd_hidden=32, lpd_share_weights=False, epochs=8, lr=0.0005, lr_schedule=cosine, batch_size=1, grad_clip=1.0, lambda_neg=1.0, loss_base=mse, train_n=400, val_n=200, val_chunk=4, rationale=iter-1 onboarding LPD on re-split breast (train3600/val200/test200, seed20260703), scoring val=200. Sized to fit HARD 20-min: I=10 n_primal=n_dual=5 hidden=32 epochs=8 train_n=400. lr=5e-4 (the prior breast run found 1e-3 unstable-ish, 5e-4 gave the cleanest converge at hidden=32). HYPOTHESIS: if LPD at this conservative Adler-default size runs on breast val=200 under 20 min, expect headroom>0 (clears FBP) at val_ssim~0.99, because the prior uncapped breast LPD hit hr=0.39 at I=10/h32/ep10/val20 and this only shrinks epochs 10->8 to buy budget margin.", "agent": "learned_primal_dual-claude-agentic", "campaign": "search-20260703-01", "cfg_full": {"batch_size": 1, "epochs": 8, "grad_clip": 1.0, "lambda_neg": 1.0, "loss_base": "mse", "lpd_hidden": 32, "lpd_iters": 10, "lpd_n_dual": 5, "lpd_n_primal": 5, "lpd_share_weights": false, "lr": 0.0005, "lr_schedule": "cosine", "rationale": "iter-1 onboarding LPD on re-split breast (train3600/val200/test200, seed20260703), scoring val=200. Sized to fit HARD 20-min: I=10 n_primal=n_dual=5 hidden=32 epochs=8 train_n=400. lr=5e-4 (the prior breast run found 1e-3 unstable-ish, 5e-4 gave the cleanest converge at hidden=32). HYPOTHESIS: if LPD at this conservative Adler-default size runs on breast val=200 under 20 min, expect headroom>0 (clears FBP) at val_ssim~0.99, because the prior uncapped breast LPD hit hr=0.39 at I=10/h32/ep10/val20 and this only shrinks epochs 10->8 to buy budget margin.", "train_n": 400, "val_chunk": 4, "val_n": 200}, "challenge": "breast_ct", "change_class": "architecture", "git_commit": null, "images": {"comparison": "runs/breast-ct-claude-agentic-learned-primal-dual-search-20260703-01/iterations/iter-0001/comparison.png", "test_showcase": null, "valtest_showcase": null}, "iter": 1, "kept": true, "metrics": {"headroom": 0.31542918952053445, "headroom_std": null, "val_psnr": 39.61582565307617, "val_psnr_std": null, "val_rmse": 0.0035695480182766914, "val_rmse_std": null, "val_ssim": 0.976807177066803, "val_ssim_std": null}, "model": "claude-opus-4-8-1m", "obs_path": "breast-ct-claude-agentic-learned-primal-dual-search-20260703-01/iterations/iter-0001/observation.json", "obs_sha1": "9178785ae96f410c6c1688aaeb97b2240c70163e", "params_M": 0.25322, "params_source": "observation", "rationale": "learned_primal_dual-claude-agentic: lpd_iters=10, lpd_n_primal=5, lpd_n_dual=5, lpd_hidden=32, lpd_share_weights=False, epochs=8, lr=0.0005, lr_schedule=cosine, batch_size=1, grad_clip=1.0, lambda_neg=1.0, loss_base=mse, train_n=400, val_n=200, val_chunk=4, rationale=iter-1 onboarding LPD on re-split breast (train3600/val200/test200, seed20260703), scoring val=200. Sized to fit HARD 20-min: I=10 n_primal=n_dual=5 hidden=32 epochs=8 train_n=400. lr=5e-4 (the prior breast run found 1e-3 unstable-ish, 5e-4 gave the cleanest converge at hidden=32). HYPOTHESIS: if LPD at this conservative Adler-default size runs on breast val=200 under 20 min, expect headroom>0 (clears FBP) at val_ssim~0.99, because the prior uncapped breast LPD hit hr=0.39 at I=10/h32/ep10/val20 and this only shrinks epochs 10->8 to buy budget margin.", "run_id": "breast-ct-claude-agentic-learned-primal-dual-search-20260703-01", "runtime": {"elapsed_s": 976.2210402488708}, "schema_version": 3, "solver_key": "learned-primal-dual", "solver_name": "Learned Primal-Dual", "split": {"train_n": 400, "val_n": 200}, "status": "keep", "ts": "2026-07-03T16:20:33Z"}
