{"advice_for_others": "param_efficient-claude-agentic: reg_type=bilateral, bilateral_on_top=False, proj_filter_on=False, n_iter=30, learnable_alpha=True, alpha_init=0.1, foe_n_filters=24, foe_kernel=7, foe_n_bumps=31, n_bf=1, bf_multiscale=True, bf_sigmas=[0.8, 1.6, 3.2], bf_kernel=7, bf_sigma_r=0.02, bf_gain_init=0.0, epochs=16, cosine_lr=True, lr=0.005, max_train_s=1080, batch_size=4, train_n=200, val_n=200, display_min=0.0, display_max=0.05, seed=42, rationale=iter-24 param_efficient breast -- WU-COMBINATION #2 (LAST): BAND-SELECTIVE PROX on x between DC steps (frequency-selective regularizer, solver edit). SIX-BOX: (1) PRIOR: champion LPD-combine W=4 filtered-DC K=30 = 0.5047 @ 183p. Wu combos so far: init NULL (iter-22, 0.4768), band-weighted DC REGRESSED (iter-23, 0.3202 -- reshaping the ramp breaks the projector inverse). Prox capacity also fought filtered-DC (iters13-14, hr 0.0) BUT those were ISOTROPIC (FoE/bilateral); a FREQUENCY-SELECTIVE prox is a genuinely distinct test. (2) FAILURE MODE (to test): can a per-band spectral gain on the ITERATE (not the DC filter) suppress streak-band energy in x without breaking the DC inverse? (3) ONE KNOB (architectural): band_prox=True -- I added a BandProx: decompose x into 4 radial 2D-freq bands, add Sum_b g_b*band_b(x) AFTER each DC step, g_b ZERO-INIT => x_out==x at init => pipeline == the 0.5047 champion BYTE-FOR-BYTE. +4 params -> 187 total. All else byte-for-byte iter-15 (LPD W=4, filtered-DC K=30, seed42). (4) HYPOTHESIS: a frequency-selective gain on the reconstruction can boost/suppress specific spectral bands (e.g. attenuate the streak band, boost detail band) WITHOUT touching the DC filter's projector inverse -> hr climbs past 0.5047. OR (likely, given iters13-14) any prox between DC steps fights the filtered-DC -> null/regress, completing the Wu exploration. (5) BUDGET: band prox = 1 fft2/ifft2 per step (moderate at 512^2); iter-15 finished 16ep in 1020s -> expect ~10-14ep; train_n=200, max_train_s=1080, --time=00:30:00, 200-val -> 20-min comparable. (6) SERIAL; iter-25: Wu exploration COMPLETE after this -> finish champion seed replicates 45/46 -> mean+-std -> FINAL REPORT., dc_mode=filtered, per_step_alpha=True, lpd_on=True, lpd_width=4, lpd_kernel=3, anisotropic_on_top=False, band_prox=True, band_prox_n_bands=4", "agent": "param_efficient-claude-agentic", "campaign": "search-20260703-01", "cfg_full": {"alpha_init": 0.1, "anisotropic_on_top": false, "band_prox": true, "band_prox_n_bands": 4, "batch_size": 4, "bf_gain_init": 0.0, "bf_kernel": 7, "bf_multiscale": true, "bf_sigma_r": 0.02, "bf_sigmas": [0.8, 1.6, 3.2], "bilateral_on_top": false, "cosine_lr": true, "dc_mode": "filtered", "display_max": 0.05, "display_min": 0.0, "epochs": 16, "foe_kernel": 7, "foe_n_bumps": 31, "foe_n_filters": 24, "learnable_alpha": true, "lpd_kernel": 3, "lpd_on": true, "lpd_width": 4, "lr": 0.005, "max_train_s": 1080, "n_bf": 1, "n_iter": 30, "per_step_alpha": true, "proj_filter_on": false, "rationale": "iter-24 param_efficient breast -- WU-COMBINATION #2 (LAST): BAND-SELECTIVE PROX on x between DC steps (frequency-selective regularizer, solver edit). SIX-BOX: (1) PRIOR: champion LPD-combine W=4 filtered-DC K=30 = 0.5047 @ 183p. Wu combos so far: init NULL (iter-22, 0.4768), band-weighted DC REGRESSED (iter-23, 0.3202 -- reshaping the ramp breaks the projector inverse). Prox capacity also fought filtered-DC (iters13-14, hr 0.0) BUT those were ISOTROPIC (FoE/bilateral); a FREQUENCY-SELECTIVE prox is a genuinely distinct test. (2) FAILURE MODE (to test): can a per-band spectral gain on the ITERATE (not the DC filter) suppress streak-band energy in x without breaking the DC inverse? (3) ONE KNOB (architectural): band_prox=True -- I added a BandProx: decompose x into 4 radial 2D-freq bands, add Sum_b g_b*band_b(x) AFTER each DC step, g_b ZERO-INIT => x_out==x at init => pipeline == the 0.5047 champion BYTE-FOR-BYTE. +4 params -> 187 total. All else byte-for-byte iter-15 (LPD W=4, filtered-DC K=30, seed42). (4) HYPOTHESIS: a frequency-selective gain on the reconstruction can boost/suppress specific spectral bands (e.g. attenuate the streak band, boost detail band) WITHOUT touching the DC filter's projector inverse -> hr climbs past 0.5047. OR (likely, given iters13-14) any prox between DC steps fights the filtered-DC -> null/regress, completing the Wu exploration. (5) BUDGET: band prox = 1 fft2/ifft2 per step (moderate at 512^2); iter-15 finished 16ep in 1020s -> expect ~10-14ep; train_n=200, max_train_s=1080, --time=00:30:00, 200-val -> 20-min comparable. (6) SERIAL; iter-25: Wu exploration COMPLETE after this -> finish champion seed replicates 45/46 -> mean+-std -> FINAL REPORT.", "reg_type": "bilateral", "seed": 42, "train_n": 200, "val_n": 200}, "challenge": "breast_ct", "change_class": "architecture", "git_commit": "671da566", "images": {"comparison": "runs/breast-ct-claude-agentic-param-efficient-search-20260703-01/iterations/iter-0024/comparison.png", "test_showcase": null, "valtest_showcase": null}, "iter": 24, "kept": true, "metrics": {"headroom": 0.24343088498783083, "headroom_std": 0.026215845569907872, "val_psnr": 38.747222900390625, "val_psnr_std": 0.3139719115210566, "val_rmse": 0.00394496601074934, "val_rmse_std": 0.00013133195658976635, "val_ssim": 0.9600307941436768, "val_ssim_std": 0.003124478010708758}, "model": "claude-opus-4-8-1m", "obs_path": "breast-ct-claude-agentic-param-efficient-search-20260703-01/iterations/iter-0024/observation.json", "obs_sha1": "6f94318c19ceaa271680525b24e5bcf8e1ecf747", "params_M": 0.000187, "params_source": "observation", "rationale": "param_efficient-claude-agentic: reg_type=bilateral, bilateral_on_top=False, proj_filter_on=False, n_iter=30, learnable_alpha=True, alpha_init=0.1, foe_n_filters=24, foe_kernel=7, foe_n_bumps=31, n_bf=1, bf_multiscale=True, bf_sigmas=[0.8, 1.6, 3.2], bf_kernel=7, bf_sigma_r=0.02, bf_gain_init=0.0, epochs=16, cosine_lr=True, lr=0.005, max_train_s=1080, batch_size=4, train_n=200, val_n=200, display_min=0.0, display_max=0.05, seed=42, rationale=iter-24 param_efficient breast -- WU-COMBINATION #2 (LAST): BAND-SELECTIVE PROX on x between DC steps (frequency-selective regularizer, solver edit). SIX-BOX: (1) PRIOR: champion LPD-combine W=4 filtered-DC K=30 = 0.5047 @ 183p. Wu combos so far: init NULL (iter-22, 0.4768), band-weighted DC REGRESSED (iter-23, 0.3202 -- reshaping the ramp breaks the projector inverse). Prox capacity also fought filtered-DC (iters13-14, hr 0.0) BUT those were ISOTROPIC (FoE/bilateral); a FREQUENCY-SELECTIVE prox is a genuinely distinct test. (2) FAILURE MODE (to test): can a per-band spectral gain on the ITERATE (not the DC filter) suppress streak-band energy in x without breaking the DC inverse? (3) ONE KNOB (architectural): band_prox=True -- I added a BandProx: decompose x into 4 radial 2D-freq bands, add Sum_b g_b*band_b(x) AFTER each DC step, g_b ZERO-INIT => x_out==x at init => pipeline == the 0.5047 champion BYTE-FOR-BYTE. +4 params -> 187 total. All else byte-for-byte iter-15 (LPD W=4, filtered-DC K=30, seed42). (4) HYPOTHESIS: a frequency-selective gain on the reconstruction can boost/suppress specific spectral bands (e.g. attenuate the streak band, boost detail band) WITHOUT touching the DC filter's projector inverse -> hr climbs past 0.5047. OR (likely, given iters13-14) any prox between DC steps fights the filtered-DC -> null/regress, completing the Wu exploration. (5) BUDGET: band prox = 1 fft2/ifft2 per step (moderate at 512^2); iter-15 finished 16ep in 1020s -> expect ~10-14ep; train_n=200, max_train_s=1080, --time=00:30:00, 200-val -> 20-min comparable. (6) SERIAL; iter-25: Wu exploration COMPLETE after this -> finish champion seed replicates 45/46 -> mean+-std -> FINAL REPORT., dc_mode=filtered, per_step_alpha=True, lpd_on=True, lpd_width=4, lpd_kernel=3, anisotropic_on_top=False, band_prox=True, band_prox_n_bands=4", "run_id": "breast-ct-claude-agentic-param-efficient-search-20260703-01", "runtime": {"elapsed_s": 1214.6909277439117}, "schema_version": 3, "solver_key": "param-efficient", "solver_name": "Param-efficient (evolved)", "split": {"train_n": 200, "val_n": 200}, "status": "keep", "ts": "2026-07-07T10:50:45Z"}
{"advice_for_others": "param_efficient-claude-agentic: reg_type=bilateral, bilateral_on_top=False, proj_filter_on=False, n_iter=30, learnable_alpha=True, alpha_init=0.1, foe_n_filters=24, foe_kernel=7, foe_n_bumps=31, n_bf=1, bf_multiscale=True, bf_sigmas=[0.8, 1.6, 3.2], bf_kernel=7, bf_sigma_r=0.02, bf_gain_init=0.0, epochs=16, cosine_lr=True, lr=0.005, max_train_s=1080, batch_size=4, train_n=200, val_n=200, display_min=0.0, display_max=0.05, seed=42, rationale=iter-25 param_efficient breast -- CONJUGATE-GRADIENT DATA-CONSISTENCY (highest-upside untested lever). SIX-BOX: (1) PRIOR: champion = LPD-combine W=4 + FILTERED-DC (single fbp(Rx-g)) K=30, 5-seed mean 0.4590+-0.0294 @ 183p (best 0.5047). Filtered-DC uses ONE filtered gradient per step; a proper CG solve of the normal equations is a MUCH stronger DC solver -- CG-DC is the mechanism that got fastdiff-pixel-DC-on to 0.52 and wavelet-DC-on to 0.28. UNTESTED in this unroll. (2) FAILURE MODE: a single filtered gradient only partially enforces Rx=g each step; 30 of them approximate consistency but a per-step CG solve nails it far better. (3) ONE KNOB (architectural): dc_mode 'filtered'->'cg' -- I added CGDataConsistency: n_cg=5 matrix-free CG iterations solving (R^T R + lam I)d = R^T(g - Rx) for the DC update d (lam = softplus(learnable), damps the ill-conditioned 128-view normal operator), fed to the SAME LPD-combine block. +1 param (lam) -> 184 total. NOT byte-for-byte the champion (CG is a different, stronger DC operator) -- it is a genuine architectural swap of the DC solver. (4) HYPOTHESIS: a per-step CG least-squares DC solve enforces Rx=g much more completely than one filtered gradient, so the LPD-combine routes a cleaner, more consistent correction -> hr climbs past 0.5047 toward the 0.52-0.63 regime (fastdiff CG-DC reached 0.52). Risk: CG on the ill-conditioned 128-view operator can amplify streaks if underdamped -> lam is learnable to control this. (5) BUDGET: 5 CG iters = 5 fwd+back-proj PAIRS per unroll step x K=30 -> ~10x the projector calls of filtered-DC; may only fit a few epochs in 1080s -- if hr promising but undertrained, iter-26 reduces cg_n or K. train_n=200, --time=00:30:00, 200-val, 20-min budget. (6) SERIAL; iter-26: tune cg_n/lam if it helps, then multi-scale-bilateral POST-filter., dc_mode=cg, per_step_alpha=True, lpd_on=True, lpd_width=4, lpd_kernel=3, anisotropic_on_top=False, cg_n=5, cg_lam_init=0.01", "agent": "param_efficient-claude-agentic", "campaign": "search-20260703-01", "cfg_full": {"alpha_init": 0.1, "anisotropic_on_top": false, "batch_size": 4, "bf_gain_init": 0.0, "bf_kernel": 7, "bf_multiscale": true, "bf_sigma_r": 0.02, "bf_sigmas": [0.8, 1.6, 3.2], "bilateral_on_top": false, "cg_lam_init": 0.01, "cg_n": 5, "cosine_lr": true, "dc_mode": "cg", "display_max": 0.05, "display_min": 0.0, "epochs": 16, "foe_kernel": 7, "foe_n_bumps": 31, "foe_n_filters": 24, "learnable_alpha": true, "lpd_kernel": 3, "lpd_on": true, "lpd_width": 4, "lr": 0.005, "max_train_s": 1080, "n_bf": 1, "n_iter": 30, "per_step_alpha": true, "proj_filter_on": false, "rationale": "iter-25 param_efficient breast -- CONJUGATE-GRADIENT DATA-CONSISTENCY (highest-upside untested lever). SIX-BOX: (1) PRIOR: champion = LPD-combine W=4 + FILTERED-DC (single fbp(Rx-g)) K=30, 5-seed mean 0.4590+-0.0294 @ 183p (best 0.5047). Filtered-DC uses ONE filtered gradient per step; a proper CG solve of the normal equations is a MUCH stronger DC solver -- CG-DC is the mechanism that got fastdiff-pixel-DC-on to 0.52 and wavelet-DC-on to 0.28. UNTESTED in this unroll. (2) FAILURE MODE: a single filtered gradient only partially enforces Rx=g each step; 30 of them approximate consistency but a per-step CG solve nails it far better. (3) ONE KNOB (architectural): dc_mode 'filtered'->'cg' -- I added CGDataConsistency: n_cg=5 matrix-free CG iterations solving (R^T R + lam I)d = R^T(g - Rx) for the DC update d (lam = softplus(learnable), damps the ill-conditioned 128-view normal operator), fed to the SAME LPD-combine block. +1 param (lam) -> 184 total. NOT byte-for-byte the champion (CG is a different, stronger DC operator) -- it is a genuine architectural swap of the DC solver. (4) HYPOTHESIS: a per-step CG least-squares DC solve enforces Rx=g much more completely than one filtered gradient, so the LPD-combine routes a cleaner, more consistent correction -> hr climbs past 0.5047 toward the 0.52-0.63 regime (fastdiff CG-DC reached 0.52). Risk: CG on the ill-conditioned 128-view operator can amplify streaks if underdamped -> lam is learnable to control this. (5) BUDGET: 5 CG iters = 5 fwd+back-proj PAIRS per unroll step x K=30 -> ~10x the projector calls of filtered-DC; may only fit a few epochs in 1080s -- if hr promising but undertrained, iter-26 reduces cg_n or K. train_n=200, --time=00:30:00, 200-val, 20-min budget. (6) SERIAL; iter-26: tune cg_n/lam if it helps, then multi-scale-bilateral POST-filter.", "reg_type": "bilateral", "seed": 42, "train_n": 200, "val_n": 200}, "challenge": "breast_ct", "change_class": "architecture", "git_commit": "671da566", "images": {"comparison": "runs/breast-ct-claude-agentic-param-efficient-search-20260703-01/iterations/iter-0025/comparison.png", "test_showcase": null, "valtest_showcase": null}, "iter": 25, "kept": true, "metrics": {"headroom": 0.23618182449811298, "headroom_std": 0.014993047249201004, "val_psnr": 38.664398193359375, "val_psnr_std": 0.4276953778724433, "val_rmse": 0.003982764668762684, "val_rmse_std": 0.00018752706058526247, "val_ssim": 0.9627381563186646, "val_ssim_std": 0.004237173906607709}, "model": "claude-opus-4-8-1m", "obs_path": "breast-ct-claude-agentic-param-efficient-search-20260703-01/iterations/iter-0025/observation.json", "obs_sha1": "17b68e36ce1aacbc619ee67b93a4dd137006de92", "params_M": 0.000184, "params_source": "observation", "rationale": "param_efficient-claude-agentic: reg_type=bilateral, bilateral_on_top=False, proj_filter_on=False, n_iter=30, learnable_alpha=True, alpha_init=0.1, foe_n_filters=24, foe_kernel=7, foe_n_bumps=31, n_bf=1, bf_multiscale=True, bf_sigmas=[0.8, 1.6, 3.2], bf_kernel=7, bf_sigma_r=0.02, bf_gain_init=0.0, epochs=16, cosine_lr=True, lr=0.005, max_train_s=1080, batch_size=4, train_n=200, val_n=200, display_min=0.0, display_max=0.05, seed=42, rationale=iter-25 param_efficient breast -- CONJUGATE-GRADIENT DATA-CONSISTENCY (highest-upside untested lever). SIX-BOX: (1) PRIOR: champion = LPD-combine W=4 + FILTERED-DC (single fbp(Rx-g)) K=30, 5-seed mean 0.4590+-0.0294 @ 183p (best 0.5047). Filtered-DC uses ONE filtered gradient per step; a proper CG solve of the normal equations is a MUCH stronger DC solver -- CG-DC is the mechanism that got fastdiff-pixel-DC-on to 0.52 and wavelet-DC-on to 0.28. UNTESTED in this unroll. (2) FAILURE MODE: a single filtered gradient only partially enforces Rx=g each step; 30 of them approximate consistency but a per-step CG solve nails it far better. (3) ONE KNOB (architectural): dc_mode 'filtered'->'cg' -- I added CGDataConsistency: n_cg=5 matrix-free CG iterations solving (R^T R + lam I)d = R^T(g - Rx) for the DC update d (lam = softplus(learnable), damps the ill-conditioned 128-view normal operator), fed to the SAME LPD-combine block. +1 param (lam) -> 184 total. NOT byte-for-byte the champion (CG is a different, stronger DC operator) -- it is a genuine architectural swap of the DC solver. (4) HYPOTHESIS: a per-step CG least-squares DC solve enforces Rx=g much more completely than one filtered gradient, so the LPD-combine routes a cleaner, more consistent correction -> hr climbs past 0.5047 toward the 0.52-0.63 regime (fastdiff CG-DC reached 0.52). Risk: CG on the ill-conditioned 128-view operator can amplify streaks if underdamped -> lam is learnable to control this. (5) BUDGET: 5 CG iters = 5 fwd+back-proj PAIRS per unroll step x K=30 -> ~10x the projector calls of filtered-DC; may only fit a few epochs in 1080s -- if hr promising but undertrained, iter-26 reduces cg_n or K. train_n=200, --time=00:30:00, 200-val, 20-min budget. (6) SERIAL; iter-26: tune cg_n/lam if it helps, then multi-scale-bilateral POST-filter., dc_mode=cg, per_step_alpha=True, lpd_on=True, lpd_width=4, lpd_kernel=3, anisotropic_on_top=False, cg_n=5, cg_lam_init=0.01", "run_id": "breast-ct-claude-agentic-param-efficient-search-20260703-01", "runtime": {"elapsed_s": 1418.1035730838776}, "schema_version": 3, "solver_key": "param-efficient", "solver_name": "Param-efficient (evolved)", "split": {"train_n": 200, "val_n": 200}, "status": "keep", "ts": "2026-07-07T12:12:44Z"}
