{"advice_for_others": "manhart_pwls_tv-claude-agentic: val_n=200, pwls_gamma=1.0, pwls_weight_norm=mean, tv_lambda=0.003, tv_iterations=1000, tv_lr=0.02, tv_decay=0.01, tv_optimizer=gd, tv_init=fbp, rationale=iter-11 STEP-SIZE probe (revert optimizer). iter-10 tv_optimizer gd->adam COLLAPSED hr 0.3596->0.0 (adam lr=0.01 destabilized the data term: data 0.80->1.16, TV crashed 76007->18685, ssim 0.74) => GD is required; revert to gd. Earlier GD logs showed the TV term still descending at iter-1000 (under-converged). ONE knob: tv_lr 0.01->0.02 (2x GD step; keep gd, lambda=3e-3, 1000 iters, gamma=1.0). HYPOTHESIS: a larger GD step lets the TV objective descend further within 1000 iters so hr rises past 0.3596; if it destabilizes the data term (hr drops) then lr=0.01 was near the GD stability limit and I revert + add iterations instead. Budget: ~870s at 1000 iters, <1200s wall.", "agent": "manhart_pwls_tv-claude-agentic", "campaign": "search-20260703-01", "cfg_full": {"pwls_gamma": 1.0, "pwls_weight_norm": "mean", "rationale": "iter-11 STEP-SIZE probe (revert optimizer). iter-10 tv_optimizer gd->adam COLLAPSED hr 0.3596->0.0 (adam lr=0.01 destabilized the data term: data 0.80->1.16, TV crashed 76007->18685, ssim 0.74) => GD is required; revert to gd. Earlier GD logs showed the TV term still descending at iter-1000 (under-converged). ONE knob: tv_lr 0.01->0.02 (2x GD step; keep gd, lambda=3e-3, 1000 iters, gamma=1.0). HYPOTHESIS: a larger GD step lets the TV objective descend further within 1000 iters so hr rises past 0.3596; if it destabilizes the data term (hr drops) then lr=0.01 was near the GD stability limit and I revert + add iterations instead. Budget: ~870s at 1000 iters, <1200s wall.", "tv_decay": 0.01, "tv_init": "fbp", "tv_iterations": 1000, "tv_lambda": 0.003, "tv_lr": 0.02, "tv_optimizer": "gd", "val_n": 200}, "challenge": "breast_ct", "change_class": "architecture", "git_commit": "671da566", "images": {"comparison": "runs/breast-ct-claude-agentic-manhart-pwls-tv-search-20260703-01/iterations/iter-0011/comparison.png", "test_showcase": null, "valtest_showcase": null}, "iter": 11, "kept": true, "metrics": {"headroom": 0.23961006248755867, "headroom_std": null, "val_psnr": 38.703468322753906, "val_psnr_std": null, "val_rmse": 0.003964888863265514, "val_rmse_std": null, "val_ssim": 0.9824456572532654, "val_ssim_std": null}, "model": "claude-opus-4-8-1m", "obs_path": "breast-ct-claude-agentic-manhart-pwls-tv-search-20260703-01/iterations/iter-0011/observation.json", "obs_sha1": "31c2f83494926c13fbcaac7c24a51802d200ebdf", "params_M": 0.0, "params_source": "observation", "rationale": "manhart_pwls_tv-claude-agentic: val_n=200, pwls_gamma=1.0, pwls_weight_norm=mean, tv_lambda=0.003, tv_iterations=1000, tv_lr=0.02, tv_decay=0.01, tv_optimizer=gd, tv_init=fbp, rationale=iter-11 STEP-SIZE probe (revert optimizer). iter-10 tv_optimizer gd->adam COLLAPSED hr 0.3596->0.0 (adam lr=0.01 destabilized the data term: data 0.80->1.16, TV crashed 76007->18685, ssim 0.74) => GD is required; revert to gd. Earlier GD logs showed the TV term still descending at iter-1000 (under-converged). ONE knob: tv_lr 0.01->0.02 (2x GD step; keep gd, lambda=3e-3, 1000 iters, gamma=1.0). HYPOTHESIS: a larger GD step lets the TV objective descend further within 1000 iters so hr rises past 0.3596; if it destabilizes the data term (hr drops) then lr=0.01 was near the GD stability limit and I revert + add iterations instead. Budget: ~870s at 1000 iters, <1200s wall.", "run_id": "breast-ct-claude-agentic-manhart-pwls-tv-search-20260703-01", "runtime": {"elapsed_s": 886.8612477779388}, "schema_version": 3, "solver_key": "manhart-pwls-tv", "solver_name": "Manhart PWLS-TV (ray-weighted)", "split": {"train_n": 400, "val_n": 200}, "status": "keep", "ts": "2026-07-05T07:25:29Z"}
{"advice_for_others": "manhart_pwls_tv-claude-agentic: val_n=200, pwls_gamma=1.0, pwls_weight_norm=mean, tv_lambda=0.003, tv_iterations=1000, tv_lr=0.01, tv_decay=0.001, tv_optimizer=gd, tv_init=fbp, rationale=iter-12 DECAY probe. Optimizer space is peaked at GD lr=0.01: iter-10 adam collapsed hr->0.0, iter-11 lr 0.01->0.02 hurt hr 0.3596->0.2396. Revert lr=0.01. Earlier GD logs show the TV term STILL descending at iter-1000, but with tv_decay=0.01 the GD step at iter1000 = 0.01/(1+0.01*1000) = ~0.0009 (11x shrunk) => late convergence is step-starved. ONE knob: tv_decay 0.01->0.001 (10x less decay; step at iter1000 = 0.01/2 = 0.005 vs 0.0009). HYPOTHESIS: larger late steps converge the TV term further within 1000 iters so hr rises past 0.3596; if too-large late steps oscillate (hr drops) decay=0.01 was protective and I revert + add iterations. Keep gd, lambda=3e-3, lr=0.01, 1000 iters, gamma=1.0. Budget: ~870s, <1200s wall.", "agent": "manhart_pwls_tv-claude-agentic", "campaign": "search-20260703-01", "cfg_full": {"pwls_gamma": 1.0, "pwls_weight_norm": "mean", "rationale": "iter-12 DECAY probe. Optimizer space is peaked at GD lr=0.01: iter-10 adam collapsed hr->0.0, iter-11 lr 0.01->0.02 hurt hr 0.3596->0.2396. Revert lr=0.01. Earlier GD logs show the TV term STILL descending at iter-1000, but with tv_decay=0.01 the GD step at iter1000 = 0.01/(1+0.01*1000) = ~0.0009 (11x shrunk) => late convergence is step-starved. ONE knob: tv_decay 0.01->0.001 (10x less decay; step at iter1000 = 0.01/2 = 0.005 vs 0.0009). HYPOTHESIS: larger late steps converge the TV term further within 1000 iters so hr rises past 0.3596; if too-large late steps oscillate (hr drops) decay=0.01 was protective and I revert + add iterations. Keep gd, lambda=3e-3, lr=0.01, 1000 iters, gamma=1.0. Budget: ~870s, <1200s wall.", "tv_decay": 0.001, "tv_init": "fbp", "tv_iterations": 1000, "tv_lambda": 0.003, "tv_lr": 0.01, "tv_optimizer": "gd", "val_n": 200}, "challenge": "breast_ct", "change_class": "architecture", "git_commit": "671da566", "images": {"comparison": "runs/breast-ct-claude-agentic-manhart-pwls-tv-search-20260703-01/iterations/iter-0012/comparison.png", "test_showcase": null, "valtest_showcase": null}, "iter": 12, "kept": true, "metrics": {"headroom": 0.08259143999659213, "headroom_std": null, "val_psnr": 37.072940826416016, "val_psnr_std": null, "val_rmse": 0.004783628508448601, "val_rmse_std": null, "val_ssim": 0.9729093909263611, "val_ssim_std": null}, "model": "claude-opus-4-8-1m", "obs_path": "breast-ct-claude-agentic-manhart-pwls-tv-search-20260703-01/iterations/iter-0012/observation.json", "obs_sha1": "e091652790cfc07e846c0edb0a889602ebfb7b83", "params_M": 0.0, "params_source": "observation", "rationale": "manhart_pwls_tv-claude-agentic: val_n=200, pwls_gamma=1.0, pwls_weight_norm=mean, tv_lambda=0.003, tv_iterations=1000, tv_lr=0.01, tv_decay=0.001, tv_optimizer=gd, tv_init=fbp, rationale=iter-12 DECAY probe. Optimizer space is peaked at GD lr=0.01: iter-10 adam collapsed hr->0.0, iter-11 lr 0.01->0.02 hurt hr 0.3596->0.2396. Revert lr=0.01. Earlier GD logs show the TV term STILL descending at iter-1000, but with tv_decay=0.01 the GD step at iter1000 = 0.01/(1+0.01*1000) = ~0.0009 (11x shrunk) => late convergence is step-starved. ONE knob: tv_decay 0.01->0.001 (10x less decay; step at iter1000 = 0.01/2 = 0.005 vs 0.0009). HYPOTHESIS: larger late steps converge the TV term further within 1000 iters so hr rises past 0.3596; if too-large late steps oscillate (hr drops) decay=0.01 was protective and I revert + add iterations. Keep gd, lambda=3e-3, lr=0.01, 1000 iters, gamma=1.0. Budget: ~870s, <1200s wall.", "run_id": "breast-ct-claude-agentic-manhart-pwls-tv-search-20260703-01", "runtime": {"elapsed_s": 852.2342503070831}, "schema_version": 3, "solver_key": "manhart-pwls-tv", "solver_name": "Manhart PWLS-TV (ray-weighted)", "split": {"train_n": 400, "val_n": 200}, "status": "keep", "ts": "2026-07-05T08:24:54Z"}
{"advice_for_others": "manhart_pwls_tv-claude-agentic: val_n=200, pwls_gamma=1.0, pwls_weight_norm=mean, tv_lambda=0.003, tv_iterations=1200, tv_lr=0.01, tv_decay=0.01, tv_optimizer=gd, tv_init=fbp, rationale=iter-13 CONVERGENCE at the peak config. Both late-step levers destabilize: iter-11 lr 0.01->0.02 -> hr 0.2396, iter-12 decay 0.01->0.001 -> hr 0.0826. So GD lr=0.01, decay=0.01 is the stable schedule; revert both. Earlier GD logs show the TV term STILL descending at iter-1000 (under-converged) but larger steps oscillate. The stable way to converge further is MORE iterations at the safe schedule. ONE knob: tv_iterations 1000->1200 (keep gd, lambda=3e-3, lr=0.01, decay=0.01, gamma=1.0). HYPOTHESIS: 200 more stable GD iters converge TV further so hr rises past 0.3596; if saturated, GD/TV has converged and 0.3596 is the plateau. Budget: iter-9 868s at 1000 iters -> ~1040s at 1200, still <1200s wall.", "agent": "manhart_pwls_tv-claude-agentic", "campaign": "search-20260703-01", "cfg_full": {"pwls_gamma": 1.0, "pwls_weight_norm": "mean", "rationale": "iter-13 CONVERGENCE at the peak config. Both late-step levers destabilize: iter-11 lr 0.01->0.02 -> hr 0.2396, iter-12 decay 0.01->0.001 -> hr 0.0826. So GD lr=0.01, decay=0.01 is the stable schedule; revert both. Earlier GD logs show the TV term STILL descending at iter-1000 (under-converged) but larger steps oscillate. The stable way to converge further is MORE iterations at the safe schedule. ONE knob: tv_iterations 1000->1200 (keep gd, lambda=3e-3, lr=0.01, decay=0.01, gamma=1.0). HYPOTHESIS: 200 more stable GD iters converge TV further so hr rises past 0.3596; if saturated, GD/TV has converged and 0.3596 is the plateau. Budget: iter-9 868s at 1000 iters -> ~1040s at 1200, still <1200s wall.", "tv_decay": 0.01, "tv_init": "fbp", "tv_iterations": 1200, "tv_lambda": 0.003, "tv_lr": 0.01, "tv_optimizer": "gd", "val_n": 200}, "challenge": "breast_ct", "change_class": "architecture", "git_commit": "671da566", "images": {"comparison": "runs/breast-ct-claude-agentic-manhart-pwls-tv-search-20260703-01/iterations/iter-0013/comparison.png", "test_showcase": null, "valtest_showcase": null}, "iter": 13, "kept": true, "metrics": {"headroom": 0.356040974534786, "headroom_std": null, "val_psnr": 40.14703369140625, "val_psnr_std": null, "val_rmse": 0.003357785055413842, "val_rmse_std": null, "val_ssim": 0.9904214143753052, "val_ssim_std": null}, "model": "claude-opus-4-8-1m", "obs_path": "breast-ct-claude-agentic-manhart-pwls-tv-search-20260703-01/iterations/iter-0013/observation.json", "obs_sha1": "f61cafd05298bce0a07ebf45779b2be86433be6b", "params_M": 0.0, "params_source": "observation", "rationale": "manhart_pwls_tv-claude-agentic: val_n=200, pwls_gamma=1.0, pwls_weight_norm=mean, tv_lambda=0.003, tv_iterations=1200, tv_lr=0.01, tv_decay=0.01, tv_optimizer=gd, tv_init=fbp, rationale=iter-13 CONVERGENCE at the peak config. Both late-step levers destabilize: iter-11 lr 0.01->0.02 -> hr 0.2396, iter-12 decay 0.01->0.001 -> hr 0.0826. So GD lr=0.01, decay=0.01 is the stable schedule; revert both. Earlier GD logs show the TV term STILL descending at iter-1000 (under-converged) but larger steps oscillate. The stable way to converge further is MORE iterations at the safe schedule. ONE knob: tv_iterations 1000->1200 (keep gd, lambda=3e-3, lr=0.01, decay=0.01, gamma=1.0). HYPOTHESIS: 200 more stable GD iters converge TV further so hr rises past 0.3596; if saturated, GD/TV has converged and 0.3596 is the plateau. Budget: iter-9 868s at 1000 iters -> ~1040s at 1200, still <1200s wall.", "run_id": "breast-ct-claude-agentic-manhart-pwls-tv-search-20260703-01", "runtime": {"elapsed_s": 1046.5506255626678}, "schema_version": 3, "solver_key": "manhart-pwls-tv", "solver_name": "Manhart PWLS-TV (ray-weighted)", "split": {"train_n": 400, "val_n": 200}, "status": "keep", "ts": "2026-07-05T09:28:40Z"}
{"advice_for_others": "manhart_pwls_tv-claude-agentic: val_n=200, pwls_gamma=0.0, pwls_weight_norm=mean, tv_lambda=0.003, tv_iterations=1000, tv_lr=0.01, tv_decay=0.01, tv_optimizer=gd, tv_init=fbp, rationale=iter-14 PWLS re-test in the CONVERGED regime. TV core is plateaued: iter-9 (1000it) hr=0.3596 best, iter-13 (1200it) hr=0.3560 (saturated, no gain, wall-risky). Optimizer/lr/decay/lambda all peaked. The method's actual novelty (Manhart PWLS ray weighting) was only inert-checked earlier at lambda=1e-3/200it (iter-1 vs iter-2 bit-identical). Now re-test at the BEST converged config. ONE knob: pwls_gamma 1.0->0.0 (exactly plain TV; W==1) at lambda=3e-3, 1000it, gd, lr=0.01, decay=0.01. HYPOTHESIS: if gamma=0 hr DIFFERS from iter-9's gamma=1.0 at lambda=3e-3, PWLS ray-weighting is LIVE in the converged regime (gamma tunable); if bit-identical, PWLS is confirmed inert on breast at every regime -> clean PWLS-negative result matching Mayo. Budget: ~868s at 1000 iters, <1200s wall.", "agent": "manhart_pwls_tv-claude-agentic", "campaign": "search-20260703-01", "cfg_full": {"pwls_gamma": 0.0, "pwls_weight_norm": "mean", "rationale": "iter-14 PWLS re-test in the CONVERGED regime. TV core is plateaued: iter-9 (1000it) hr=0.3596 best, iter-13 (1200it) hr=0.3560 (saturated, no gain, wall-risky). Optimizer/lr/decay/lambda all peaked. The method's actual novelty (Manhart PWLS ray weighting) was only inert-checked earlier at lambda=1e-3/200it (iter-1 vs iter-2 bit-identical). Now re-test at the BEST converged config. ONE knob: pwls_gamma 1.0->0.0 (exactly plain TV; W==1) at lambda=3e-3, 1000it, gd, lr=0.01, decay=0.01. HYPOTHESIS: if gamma=0 hr DIFFERS from iter-9's gamma=1.0 at lambda=3e-3, PWLS ray-weighting is LIVE in the converged regime (gamma tunable); if bit-identical, PWLS is confirmed inert on breast at every regime -> clean PWLS-negative result matching Mayo. Budget: ~868s at 1000 iters, <1200s wall.", "tv_decay": 0.01, "tv_init": "fbp", "tv_iterations": 1000, "tv_lambda": 0.003, "tv_lr": 0.01, "tv_optimizer": "gd", "val_n": 200}, "challenge": "breast_ct", "change_class": "architecture", "git_commit": "671da566", "images": {"comparison": "runs/breast-ct-claude-agentic-manhart-pwls-tv-search-20260703-01/iterations/iter-0014/comparison.png", "test_showcase": null, "valtest_showcase": null}, "iter": 14, "kept": true, "metrics": {"headroom": 0.3596555026265029, "headroom_std": null, "val_psnr": 40.1959228515625, "val_psnr_std": null, "val_rmse": 0.0033389378804713488, "val_rmse_std": null, "val_ssim": 0.9907816052436829, "val_ssim_std": null}, "model": "claude-opus-4-8-1m", "obs_path": "breast-ct-claude-agentic-manhart-pwls-tv-search-20260703-01/iterations/iter-0014/observation.json", "obs_sha1": "11685f38a5959553c64a1e22c6d4b2a19049145d", "params_M": 0.0, "params_source": "observation", "rationale": "manhart_pwls_tv-claude-agentic: val_n=200, pwls_gamma=0.0, pwls_weight_norm=mean, tv_lambda=0.003, tv_iterations=1000, tv_lr=0.01, tv_decay=0.01, tv_optimizer=gd, tv_init=fbp, rationale=iter-14 PWLS re-test in the CONVERGED regime. TV core is plateaued: iter-9 (1000it) hr=0.3596 best, iter-13 (1200it) hr=0.3560 (saturated, no gain, wall-risky). Optimizer/lr/decay/lambda all peaked. The method's actual novelty (Manhart PWLS ray weighting) was only inert-checked earlier at lambda=1e-3/200it (iter-1 vs iter-2 bit-identical). Now re-test at the BEST converged config. ONE knob: pwls_gamma 1.0->0.0 (exactly plain TV; W==1) at lambda=3e-3, 1000it, gd, lr=0.01, decay=0.01. HYPOTHESIS: if gamma=0 hr DIFFERS from iter-9's gamma=1.0 at lambda=3e-3, PWLS ray-weighting is LIVE in the converged regime (gamma tunable); if bit-identical, PWLS is confirmed inert on breast at every regime -> clean PWLS-negative result matching Mayo. Budget: ~868s at 1000 iters, <1200s wall.", "run_id": "breast-ct-claude-agentic-manhart-pwls-tv-search-20260703-01", "runtime": {"elapsed_s": 892.8200995922089}, "schema_version": 3, "solver_key": "manhart-pwls-tv", "solver_name": "Manhart PWLS-TV (ray-weighted)", "split": {"train_n": 400, "val_n": 200}, "status": "keep", "ts": "2026-07-05T10:27:08Z"}
{"advice_for_others": "manhart_pwls_tv-claude-agentic: val_n=200, pwls_gamma=1.0, pwls_weight_norm=mean, tv_lambda=0.003, tv_iterations=1000, tv_lr=0.01, tv_decay=0.01, tv_optimizer=gd, tv_init=zeros, rationale=iter-15 INIT-scheme probe. PWLS confirmed INERT: iter-14 (gamma=0, plain TV) hr=0.35965550 vs iter-9 (gamma=1, Manhart) hr=0.35964474 differ at the 7th sig-digit (dHR~1.1e-7) -> Manhart ray-weight has no measurable effect on breast at any regime (TV term dominates data residual). PWLS-negative confirmed (matches Mayo). Only plain-TV knobs remain; tv_init untested. ONE knob: tv_init fbp->zeros at best config (gamma=1, lambda=3e-3, 1000it, gd, lr=0.01, decay=0.01). HYPOTHESIS: FBP init warm-starts GD near the data-consistent solution; zeros forces reconstruction from scratch in 1000 iters. If hr drops, FBP warm-start is essential (expected for TV-GD); if hr matches, GD is fully converged and init-agnostic at 1000 iters. Budget: ~868s at 1000 iters, <1200s wall.", "agent": "manhart_pwls_tv-claude-agentic", "campaign": "search-20260703-01", "cfg_full": {"pwls_gamma": 1.0, "pwls_weight_norm": "mean", "rationale": "iter-15 INIT-scheme probe. PWLS confirmed INERT: iter-14 (gamma=0, plain TV) hr=0.35965550 vs iter-9 (gamma=1, Manhart) hr=0.35964474 differ at the 7th sig-digit (dHR~1.1e-7) -> Manhart ray-weight has no measurable effect on breast at any regime (TV term dominates data residual). PWLS-negative confirmed (matches Mayo). Only plain-TV knobs remain; tv_init untested. ONE knob: tv_init fbp->zeros at best config (gamma=1, lambda=3e-3, 1000it, gd, lr=0.01, decay=0.01). HYPOTHESIS: FBP init warm-starts GD near the data-consistent solution; zeros forces reconstruction from scratch in 1000 iters. If hr drops, FBP warm-start is essential (expected for TV-GD); if hr matches, GD is fully converged and init-agnostic at 1000 iters. Budget: ~868s at 1000 iters, <1200s wall.", "tv_decay": 0.01, "tv_init": "zeros", "tv_iterations": 1000, "tv_lambda": 0.003, "tv_lr": 0.01, "tv_optimizer": "gd", "val_n": 200}, "challenge": "breast_ct", "change_class": "architecture", "git_commit": "671da566", "images": {"comparison": "runs/breast-ct-claude-agentic-manhart-pwls-tv-search-20260703-01/iterations/iter-0015/comparison.png", "test_showcase": null, "valtest_showcase": null}, "iter": 15, "kept": false, "metrics": {"headroom": 0.0, "headroom_std": null, "val_psnr": 4.367226600646973, "val_psnr_std": null, "val_rmse": 0.20655852556228638, "val_rmse_std": null, "val_ssim": 0.3554087281227112, "val_ssim_std": null}, "model": "claude-opus-4-8-1m", "obs_path": "breast-ct-claude-agentic-manhart-pwls-tv-search-20260703-01/iterations/iter-0015/observation.json", "obs_sha1": "df7ae6dc89e0de3bcd51382ad6a65711537e4a7a", "params_M": 0.0, "params_source": "observation", "rationale": "manhart_pwls_tv-claude-agentic: val_n=200, pwls_gamma=1.0, pwls_weight_norm=mean, tv_lambda=0.003, tv_iterations=1000, tv_lr=0.01, tv_decay=0.01, tv_optimizer=gd, tv_init=zeros, rationale=iter-15 INIT-scheme probe. PWLS confirmed INERT: iter-14 (gamma=0, plain TV) hr=0.35965550 vs iter-9 (gamma=1, Manhart) hr=0.35964474 differ at the 7th sig-digit (dHR~1.1e-7) -> Manhart ray-weight has no measurable effect on breast at any regime (TV term dominates data residual). PWLS-negative confirmed (matches Mayo). Only plain-TV knobs remain; tv_init untested. ONE knob: tv_init fbp->zeros at best config (gamma=1, lambda=3e-3, 1000it, gd, lr=0.01, decay=0.01). HYPOTHESIS: FBP init warm-starts GD near the data-consistent solution; zeros forces reconstruction from scratch in 1000 iters. If hr drops, FBP warm-start is essential (expected for TV-GD); if hr matches, GD is fully converged and init-agnostic at 1000 iters. Budget: ~868s at 1000 iters, <1200s wall.", "run_id": "breast-ct-claude-agentic-manhart-pwls-tv-search-20260703-01", "runtime": {"elapsed_s": 885.8489646911621}, "schema_version": 3, "solver_key": "manhart-pwls-tv", "solver_name": "Manhart PWLS-TV (ray-weighted)", "split": {"train_n": 400, "val_n": 200}, "status": "discard", "ts": "2026-07-05T11:25:32Z"}
