{"advice_for_others": "itnet_v3-claude-agentic: itnet_k=2, unet_c=16, alpha_init=0.0025734, lr=0.00021567, epochs=4, batch_size=2, train_n=2400, val_n=200, grad_clip=1.0, max_train_s=1000, seed=42, rationale=iter-2 RE-DISPATCH (breast-ct redo, search-20260703-01). Prior iter-2 attempt (train_n=3600/ep3) CRASHED: CUDA OutOfMemoryError at solver line 217 proj.fbp(train_noisy) -- the solver precomputes the FBP init for ALL train sinograms in ONE GPU batch, so 3600x512x512 blew GPU memory (it also landed on an 11GB GTX 1080 Ti before the node-exclusion fix). FIX: train_n 3600 -> 2400 (respects the coordinator train_n<=2400 cap; the whole-train FBP precompute now fits the excluded->>=24GB nodes with expandable_segments), epochs 3 -> 4 so total gradient exposure (2400*4=9600 sample-epochs) still exceeds iter-1's 4800 and doubles distinct-data coverage vs the 400 iter-1 used. This RE-DISPATCH keeps the SAME ONE KNOB intent as iter-2 (train_n up = data-coverage lever) at a memory-safe size. SIX-BOX (NUMBERS): (1) iter-1 (train_n=400/ep12): hr 0.7737, SSIM 0.9957, PSNR 49.23, RMSE 1.18e-3, params 3.699M, elapsed 393.2s=6.55min. iter-2-attempt-1 (train_n=3600/ep3): CRASH OOM, elapsed 17s, no result.json. (2) FAILURE MODE (attempt-1) = GPU OOM from whole-train FBP precompute at train_n=3600, NOT a metric issue. Underlying limiter for the SCIENCE is still DATA COVERAGE (iter-1 loss plateaued at 2e-6 by ep8 on only 400 cases). (3) ONE KNOB (vs iter-1): train_n 400 -> 2400 (6x more distinct training cases, memory-safe). epochs 12 -> 4 to fit the wall AND keep sample-epochs (9600) at 2x iter-1. (4) HYPOTHESIS: training on 2400 distinct cases lifts hr above 0.7737 because iter-1 was data-coverage-limited; the bigger, memory-safe train set generalizes better to the 200-case val split. FALSIFIER (NUMBERS): if hr <= 0.7737 at train_n=2400/ep4 -> 4 epochs too few on the larger set (optimization-limited) and iter-3 adds epochs; if it OOMs again, iter-3 must shrink train_n further or the solver's whole-batch FBP precompute is the hard ceiling. (5) BUDGET (HARD 20min=1200s): iter-1 measured 393.2s at 400*12=4800 s-e. At 2400*4=9600 s-e = 2x train work: train ~= 2*(393-90)=606s + fixed ~130s (bigger h5 load) ~= 736s = 12.3min < 1200s, comfortable. max_train_s=1000 fences a runaway. val=200 distinct val_truth.h5 cases, 256px inscribed-circle FOV (breast default). (6) do NOT return control mid-campaign; gate on iter-2 numeric-headroom obs via iter_wait.sh then dispatch iter-3.", "agent": "itnet_v3-claude-agentic", "campaign": "search-20260703-01", "cfg_full": {"alpha_init": 0.0025734, "batch_size": 2, "epochs": 4, "grad_clip": 1.0, "itnet_k": 2, "lr": 0.00021567, "max_train_s": 1000, "rationale": "iter-2 RE-DISPATCH (breast-ct redo, search-20260703-01). Prior iter-2 attempt (train_n=3600/ep3) CRASHED: CUDA OutOfMemoryError at solver line 217 proj.fbp(train_noisy) -- the solver precomputes the FBP init for ALL train sinograms in ONE GPU batch, so 3600x512x512 blew GPU memory (it also landed on an 11GB GTX 1080 Ti before the node-exclusion fix). FIX: train_n 3600 -> 2400 (respects the coordinator train_n<=2400 cap; the whole-train FBP precompute now fits the excluded->>=24GB nodes with expandable_segments), epochs 3 -> 4 so total gradient exposure (2400*4=9600 sample-epochs) still exceeds iter-1's 4800 and doubles distinct-data coverage vs the 400 iter-1 used. This RE-DISPATCH keeps the SAME ONE KNOB intent as iter-2 (train_n up = data-coverage lever) at a memory-safe size. SIX-BOX (NUMBERS): (1) iter-1 (train_n=400/ep12): hr 0.7737, SSIM 0.9957, PSNR 49.23, RMSE 1.18e-3, params 3.699M, elapsed 393.2s=6.55min. iter-2-attempt-1 (train_n=3600/ep3): CRASH OOM, elapsed 17s, no result.json. (2) FAILURE MODE (attempt-1) = GPU OOM from whole-train FBP precompute at train_n=3600, NOT a metric issue. Underlying limiter for the SCIENCE is still DATA COVERAGE (iter-1 loss plateaued at 2e-6 by ep8 on only 400 cases). (3) ONE KNOB (vs iter-1): train_n 400 -> 2400 (6x more distinct training cases, memory-safe). epochs 12 -> 4 to fit the wall AND keep sample-epochs (9600) at 2x iter-1. (4) HYPOTHESIS: training on 2400 distinct cases lifts hr above 0.7737 because iter-1 was data-coverage-limited; the bigger, memory-safe train set generalizes better to the 200-case val split. FALSIFIER (NUMBERS): if hr <= 0.7737 at train_n=2400/ep4 -> 4 epochs too few on the larger set (optimization-limited) and iter-3 adds epochs; if it OOMs again, iter-3 must shrink train_n further or the solver's whole-batch FBP precompute is the hard ceiling. (5) BUDGET (HARD 20min=1200s): iter-1 measured 393.2s at 400*12=4800 s-e. At 2400*4=9600 s-e = 2x train work: train ~= 2*(393-90)=606s + fixed ~130s (bigger h5 load) ~= 736s = 12.3min < 1200s, comfortable. max_train_s=1000 fences a runaway. val=200 distinct val_truth.h5 cases, 256px inscribed-circle FOV (breast default). (6) do NOT return control mid-campaign; gate on iter-2 numeric-headroom obs via iter_wait.sh then dispatch iter-3.", "seed": 42, "train_n": 2400, "unet_c": 16, "val_n": 200}, "challenge": "breast_ct", "change_class": "architecture", "git_commit": null, "images": {"comparison": "runs/breast-ct-claude-agentic-itnet-v3-search-20260703-01/iterations/iter-0002/comparison.png", "test_showcase": null, "valtest_showcase": null}, "iter": 2, "kept": true, "metrics": {"headroom": 0.8198211686462148, "headroom_std": 0.01698348012190995, "val_psnr": 51.210121154785156, "val_psnr_std": 1.372901162377373, "val_rmse": 0.0009395035449415445, "val_rmse_std": 0.00014530902781294047, "val_ssim": 0.9974505305290222, "val_ssim_std": 0.0007593090891781225}, "model": "claude-opus-4-8-1m", "obs_path": "breast-ct-claude-agentic-itnet-v3-search-20260703-01/iterations/iter-0002/observation.json", "obs_sha1": "078a6f458b2d38877e884fd3b7803f2e67a7972c", "params_M": 3.698994, "params_source": "observation", "rationale": "itnet_v3-claude-agentic: itnet_k=2, unet_c=16, alpha_init=0.0025734, lr=0.00021567, epochs=4, batch_size=2, train_n=2400, val_n=200, grad_clip=1.0, max_train_s=1000, seed=42, rationale=iter-2 RE-DISPATCH (breast-ct redo, search-20260703-01). Prior iter-2 attempt (train_n=3600/ep3) CRASHED: CUDA OutOfMemoryError at solver line 217 proj.fbp(train_noisy) -- the solver precomputes the FBP init for ALL train sinograms in ONE GPU batch, so 3600x512x512 blew GPU memory (it also landed on an 11GB GTX 1080 Ti before the node-exclusion fix). FIX: train_n 3600 -> 2400 (respects the coordinator train_n<=2400 cap; the whole-train FBP precompute now fits the excluded->>=24GB nodes with expandable_segments), epochs 3 -> 4 so total gradient exposure (2400*4=9600 sample-epochs) still exceeds iter-1's 4800 and doubles distinct-data coverage vs the 400 iter-1 used. This RE-DISPATCH keeps the SAME ONE KNOB intent as iter-2 (train_n up = data-coverage lever) at a memory-safe size. SIX-BOX (NUMBERS): (1) iter-1 (train_n=400/ep12): hr 0.7737, SSIM 0.9957, PSNR 49.23, RMSE 1.18e-3, params 3.699M, elapsed 393.2s=6.55min. iter-2-attempt-1 (train_n=3600/ep3): CRASH OOM, elapsed 17s, no result.json. (2) FAILURE MODE (attempt-1) = GPU OOM from whole-train FBP precompute at train_n=3600, NOT a metric issue. Underlying limiter for the SCIENCE is still DATA COVERAGE (iter-1 loss plateaued at 2e-6 by ep8 on only 400 cases). (3) ONE KNOB (vs iter-1): train_n 400 -> 2400 (6x more distinct training cases, memory-safe). epochs 12 -> 4 to fit the wall AND keep sample-epochs (9600) at 2x iter-1. (4) HYPOTHESIS: training on 2400 distinct cases lifts hr above 0.7737 because iter-1 was data-coverage-limited; the bigger, memory-safe train set generalizes better to the 200-case val split. FALSIFIER (NUMBERS): if hr <= 0.7737 at train_n=2400/ep4 -> 4 epochs too few on the larger set (optimization-limited) and iter-3 adds epochs; if it OOMs again, iter-3 must shrink train_n further or the solver's whole-batch FBP precompute is the hard ceiling. (5) BUDGET (HARD 20min=1200s): iter-1 measured 393.2s at 400*12=4800 s-e. At 2400*4=9600 s-e = 2x train work: train ~= 2*(393-90)=606s + fixed ~130s (bigger h5 load) ~= 736s = 12.3min < 1200s, comfortable. max_train_s=1000 fences a runaway. val=200 distinct val_truth.h5 cases, 256px inscribed-circle FOV (breast default). (6) do NOT return control mid-campaign; gate on iter-2 numeric-headroom obs via iter_wait.sh then dispatch iter-3.", "run_id": "breast-ct-claude-agentic-itnet-v3-search-20260703-01", "runtime": {"elapsed_s": 902.0923070907593}, "schema_version": 3, "solver_key": "itnet-v3", "solver_name": "ITNet v3", "split": {"train_n": 400, "val_n": 200}, "status": "keep", "ts": "2026-07-04T00:07:25Z"}
{"advice_for_others": "itnet_v3-claude-agentic: itnet_k=2, unet_c=16, alpha_init=0.0025734, lr=0.00021567, epochs=5, batch_size=2, train_n=2400, val_n=200, grad_clip=1.0, max_train_s=1050, seed=42, rationale=iter-3 (breast-ct redo, search-20260703-01). ONE KNOB: epochs 4 -> 5 at train_n=2400 (all else = iter-2 exactly: itnet_k=2, unet_c=16, alpha_init=0.0025734, lr=2.16e-4, batch_size=2, train_n=2400, val_n=200, grad_clip=1.0, seed=42). SIX-BOX (NUMBERS): (1) iter-1 (train_n=400/ep12): hr 0.7737, SSIM 0.9957, PSNR 49.23, RMSE 1.18e-3, elapsed 393.2s. iter-2 (train_n=2400/ep4): hr 0.8198, SSIM 0.9975, PSNR 51.21, RMSE 9.40e-4, elapsed 902.1s=15.0min, params 3.699M. Data-coverage lever CONFIRMED: 6x more distinct cases -> hr +0.046. (2) FAILURE MODE now in question: iter-2 traded epochs DOWN to 4 to fund the 6x bigger set. Is 4 epochs enough to CONVERGE on 2400 cases, or is the net now OPTIMIZATION-limited (under-trained on the larger set)? iter-2 used only 15.0/20 min -> ~5 min budget headroom remains for more gradient steps. (3) ONE KNOB: epochs 4 -> 5 (+25pct gradient steps on the SAME 2400 cases; train_n held so any hr change isolates OPTIMIZATION vs the already-confirmed coverage gain). (4) HYPOTHESIS: 5 epochs lifts hr above 0.8198 because iter-2's 4 epochs were slightly under-trained on the 6x larger set (loss had not yet plateaued the way it did on the tiny 400-case iter-1). FALSIFIER (NUMBERS): if hr <= 0.8198 at ep5, the 2400-case set is already converged at 4 epochs (optimization exhausted) -> iter-4 must pivot the lever to architecture (itnet_k 2->3 for more DC unrolling, or unet_c 16->24 for capacity) rather than epochs. (5) BUDGET (HARD 20min=1200s): two timing points (400*12=4800 s-e -> 393.2s) and (2400*4=9600 s-e -> 902.1s) give slope 0.106 s/sample-epoch. At 2400*5=12000 s-e: 393.2 + (12000-4800)*0.106 = 393.2 + 763 = 1156s = 19.3min < 1200s (tight but inside; max_train_s=1050 fences the TRAIN phase alone so a runaway train cannot eat the val+figure, and a finite val+figure always land inside the 30-min sbatch wall). epochs=6 (14400 s-e -> ~1411s=23.5min) would BUST the wall, so 5 is the largest epoch count the measured timing permits at train_n=2400. train_n held at 2400 (<= the 2400 OOM-safe cap; the whole-train FBP precompute fits >=24GB nodes). val=200 distinct val_truth.h5 cases, 256px inscribed-circle FOV (breast default). (6) do NOT return control mid-campaign; gate on iter-3 numeric-headroom obs via iter_wait.sh then dispatch iter-4.", "agent": "itnet_v3-claude-agentic", "campaign": "search-20260703-01", "cfg_full": {"alpha_init": 0.0025734, "batch_size": 2, "epochs": 5, "grad_clip": 1.0, "itnet_k": 2, "lr": 0.00021567, "max_train_s": 1050, "rationale": "iter-3 (breast-ct redo, search-20260703-01). ONE KNOB: epochs 4 -> 5 at train_n=2400 (all else = iter-2 exactly: itnet_k=2, unet_c=16, alpha_init=0.0025734, lr=2.16e-4, batch_size=2, train_n=2400, val_n=200, grad_clip=1.0, seed=42). SIX-BOX (NUMBERS): (1) iter-1 (train_n=400/ep12): hr 0.7737, SSIM 0.9957, PSNR 49.23, RMSE 1.18e-3, elapsed 393.2s. iter-2 (train_n=2400/ep4): hr 0.8198, SSIM 0.9975, PSNR 51.21, RMSE 9.40e-4, elapsed 902.1s=15.0min, params 3.699M. Data-coverage lever CONFIRMED: 6x more distinct cases -> hr +0.046. (2) FAILURE MODE now in question: iter-2 traded epochs DOWN to 4 to fund the 6x bigger set. Is 4 epochs enough to CONVERGE on 2400 cases, or is the net now OPTIMIZATION-limited (under-trained on the larger set)? iter-2 used only 15.0/20 min -> ~5 min budget headroom remains for more gradient steps. (3) ONE KNOB: epochs 4 -> 5 (+25pct gradient steps on the SAME 2400 cases; train_n held so any hr change isolates OPTIMIZATION vs the already-confirmed coverage gain). (4) HYPOTHESIS: 5 epochs lifts hr above 0.8198 because iter-2's 4 epochs were slightly under-trained on the 6x larger set (loss had not yet plateaued the way it did on the tiny 400-case iter-1). FALSIFIER (NUMBERS): if hr <= 0.8198 at ep5, the 2400-case set is already converged at 4 epochs (optimization exhausted) -> iter-4 must pivot the lever to architecture (itnet_k 2->3 for more DC unrolling, or unet_c 16->24 for capacity) rather than epochs. (5) BUDGET (HARD 20min=1200s): two timing points (400*12=4800 s-e -> 393.2s) and (2400*4=9600 s-e -> 902.1s) give slope 0.106 s/sample-epoch. At 2400*5=12000 s-e: 393.2 + (12000-4800)*0.106 = 393.2 + 763 = 1156s = 19.3min < 1200s (tight but inside; max_train_s=1050 fences the TRAIN phase alone so a runaway train cannot eat the val+figure, and a finite val+figure always land inside the 30-min sbatch wall). epochs=6 (14400 s-e -> ~1411s=23.5min) would BUST the wall, so 5 is the largest epoch count the measured timing permits at train_n=2400. train_n held at 2400 (<= the 2400 OOM-safe cap; the whole-train FBP precompute fits >=24GB nodes). val=200 distinct val_truth.h5 cases, 256px inscribed-circle FOV (breast default). (6) do NOT return control mid-campaign; gate on iter-3 numeric-headroom obs via iter_wait.sh then dispatch iter-4.", "seed": 42, "train_n": 2400, "unet_c": 16, "val_n": 200}, "challenge": "breast_ct", "change_class": "architecture", "git_commit": null, "images": {"comparison": "runs/breast-ct-claude-agentic-itnet-v3-search-20260703-01/iterations/iter-0003/comparison.png", "test_showcase": null, "valtest_showcase": null}, "iter": 3, "kept": true, "metrics": {"headroom": 0.8276770450317474, "headroom_std": 0.015554368439212481, "val_psnr": 51.59733200073242, "val_psnr_std": 1.3303138889464834, "val_rmse": 0.0008985407766886055, "val_rmse_std": 0.00013470884180644732, "val_ssim": 0.997747004032135, "val_ssim_std": 0.0006639322500093614}, "model": "claude-opus-4-8-1m", "obs_path": "breast-ct-claude-agentic-itnet-v3-search-20260703-01/iterations/iter-0003/observation.json", "obs_sha1": "068b969c5a51ba982ba871c896de8859d4663c1c", "params_M": 3.698994, "params_source": "observation", "rationale": "itnet_v3-claude-agentic: itnet_k=2, unet_c=16, alpha_init=0.0025734, lr=0.00021567, epochs=5, batch_size=2, train_n=2400, val_n=200, grad_clip=1.0, max_train_s=1050, seed=42, rationale=iter-3 (breast-ct redo, search-20260703-01). ONE KNOB: epochs 4 -> 5 at train_n=2400 (all else = iter-2 exactly: itnet_k=2, unet_c=16, alpha_init=0.0025734, lr=2.16e-4, batch_size=2, train_n=2400, val_n=200, grad_clip=1.0, seed=42). SIX-BOX (NUMBERS): (1) iter-1 (train_n=400/ep12): hr 0.7737, SSIM 0.9957, PSNR 49.23, RMSE 1.18e-3, elapsed 393.2s. iter-2 (train_n=2400/ep4): hr 0.8198, SSIM 0.9975, PSNR 51.21, RMSE 9.40e-4, elapsed 902.1s=15.0min, params 3.699M. Data-coverage lever CONFIRMED: 6x more distinct cases -> hr +0.046. (2) FAILURE MODE now in question: iter-2 traded epochs DOWN to 4 to fund the 6x bigger set. Is 4 epochs enough to CONVERGE on 2400 cases, or is the net now OPTIMIZATION-limited (under-trained on the larger set)? iter-2 used only 15.0/20 min -> ~5 min budget headroom remains for more gradient steps. (3) ONE KNOB: epochs 4 -> 5 (+25pct gradient steps on the SAME 2400 cases; train_n held so any hr change isolates OPTIMIZATION vs the already-confirmed coverage gain). (4) HYPOTHESIS: 5 epochs lifts hr above 0.8198 because iter-2's 4 epochs were slightly under-trained on the 6x larger set (loss had not yet plateaued the way it did on the tiny 400-case iter-1). FALSIFIER (NUMBERS): if hr <= 0.8198 at ep5, the 2400-case set is already converged at 4 epochs (optimization exhausted) -> iter-4 must pivot the lever to architecture (itnet_k 2->3 for more DC unrolling, or unet_c 16->24 for capacity) rather than epochs. (5) BUDGET (HARD 20min=1200s): two timing points (400*12=4800 s-e -> 393.2s) and (2400*4=9600 s-e -> 902.1s) give slope 0.106 s/sample-epoch. At 2400*5=12000 s-e: 393.2 + (12000-4800)*0.106 = 393.2 + 763 = 1156s = 19.3min < 1200s (tight but inside; max_train_s=1050 fences the TRAIN phase alone so a runaway train cannot eat the val+figure, and a finite val+figure always land inside the 30-min sbatch wall). epochs=6 (14400 s-e -> ~1411s=23.5min) would BUST the wall, so 5 is the largest epoch count the measured timing permits at train_n=2400. train_n held at 2400 (<= the 2400 OOM-safe cap; the whole-train FBP precompute fits >=24GB nodes). val=200 distinct val_truth.h5 cases, 256px inscribed-circle FOV (breast default). (6) do NOT return control mid-campaign; gate on iter-3 numeric-headroom obs via iter_wait.sh then dispatch iter-4.", "run_id": "breast-ct-claude-agentic-itnet-v3-search-20260703-01", "runtime": {"elapsed_s": 877.3698220252991}, "schema_version": 3, "solver_key": "itnet-v3", "solver_name": "ITNet v3", "split": {"train_n": 400, "val_n": 200}, "status": "keep", "ts": "2026-07-04T07:46:35Z"}
