{"advice_for_others": "fastdiff_flow_pixel_constrained-claude-agentic: image_size=512, pixel_spacing=0.3516, n_angles=128, n_det=1024, det_spacing=0.35754, sod=500.0, sdd=1000.0, display_min=0.0, display_max=0.5, train_n=400, val_n=200, noise_i0=100000.0, noise_sigma_e=10.0, seed=42, dataset_kind=breast_ct, fd_recon_ckpt=/cluster/maier/Agent4CT/checkpoints/fast_diffusion_pixel_breast.pt, fd_recon_steps=8, fd_recon_init=fbp, fd_recon_init_t=0.01, fd_recon_eta=1.0, fd_recon_dc=1, fd_recon_dc_n_cg=20, fd_recon_dc_relax=1.0, rationale=iter-20 CHAMPION CONFIRMATION toward the HARD iter-20 stop. Locks the best config found: init_t0.01, n_cg20, relax1.0, steps8, eta1.0 (iter-15, hr=0.5164, rmse0.002522, psnr42.63, ssim0.978 - HALF the FBP baseline rmse0.00521). SEARCH SUMMARY: the breast-native prior + few-step flow with a deep-but-not-over-converged CG data-consistency step (DC-ON constrained variant) CLEARS the strong 128-view breast FBP baseline by a wide margin. Two levers dominate: init_t (optimum ~0.01: near-FBP embed so the prior lightly denoises without repainting; higher init_t catastrophically repaints, lower loses the prior's denoise) and dc_n_cg (SEMI-CONVERGENCE peak at ~20: enough CG to beat the analytic Hann FBP on sparse data, but not so many that CG re-amplifies measurement noise). dc_relax=1.0 (full projection) best; eta/steps near-neutral. This confirms the FAIR TEST: prior-mismatch (Mayo out_scale0.05 vs breast0.5) WAS the cause of the old hr=0; a matched breast-native prior lifts pixel-DC-on to hr~0.52. Confirmation run reproduces the champion (deterministic seed=42).", "agent": "fastdiff_flow_pixel_constrained-claude-agentic", "campaign": "search-20260703-01", "cfg_full": {"dataset_kind": "breast_ct", "det_spacing": 0.35754, "display_max": 0.5, "display_min": 0.0, "fd_recon_ckpt": "/cluster/maier/Agent4CT/checkpoints/fast_diffusion_pixel_breast.pt", "fd_recon_dc": 1, "fd_recon_dc_n_cg": 20, "fd_recon_dc_relax": 1.0, "fd_recon_eta": 1.0, "fd_recon_init": "fbp", "fd_recon_init_t": 0.01, "fd_recon_steps": 8, "image_size": 512, "n_angles": 128, "n_det": 1024, "noise_i0": 100000.0, "noise_sigma_e": 10.0, "pixel_spacing": 0.3516, "rationale": "iter-20 CHAMPION CONFIRMATION toward the HARD iter-20 stop. Locks the best config found: init_t0.01, n_cg20, relax1.0, steps8, eta1.0 (iter-15, hr=0.5164, rmse0.002522, psnr42.63, ssim0.978 - HALF the FBP baseline rmse0.00521). SEARCH SUMMARY: the breast-native prior + few-step flow with a deep-but-not-over-converged CG data-consistency step (DC-ON constrained variant) CLEARS the strong 128-view breast FBP baseline by a wide margin. Two levers dominate: init_t (optimum ~0.01: near-FBP embed so the prior lightly denoises without repainting; higher init_t catastrophically repaints, lower loses the prior's denoise) and dc_n_cg (SEMI-CONVERGENCE peak at ~20: enough CG to beat the analytic Hann FBP on sparse data, but not so many that CG re-amplifies measurement noise). dc_relax=1.0 (full projection) best; eta/steps near-neutral. This confirms the FAIR TEST: prior-mismatch (Mayo out_scale0.05 vs breast0.5) WAS the cause of the old hr=0; a matched breast-native prior lifts pixel-DC-on to hr~0.52. Confirmation run reproduces the champion (deterministic seed=42).", "sdd": 1000.0, "seed": 42, "sod": 500.0, "train_n": 400, "val_n": 200}, "challenge": "breast_ct", "change_class": "architecture", "git_commit": "671da566", "images": {"comparison": "runs/breast-ct-claude-agentic-fastdiff-flow-pixel-constrained-search-20260703-01/iterations/iter-0020/comparison.png", "test_showcase": null, "valtest_showcase": null}, "iter": 20, "kept": true, "metrics": {"headroom": 0.516400405480144, "headroom_std": 0.02285636773953885, "val_psnr": 42.63447570800781, "val_psnr_std": 0.5503425727717733, "val_rmse": 0.0025216254871338606, "val_rmse_std": 0.00016311408977069124, "val_ssim": 0.9778558611869812, "val_ssim_std": 0.0042968419795897}, "model": "claude-opus-4-8-1m", "obs_path": "breast-ct-claude-agentic-fastdiff-flow-pixel-constrained-search-20260703-01/iterations/iter-0020/observation.json", "obs_sha1": "16d8b08e499d06d003f7d039688c6a192147feb4", "params_M": 3.822787, "params_source": "observation", "rationale": "fastdiff_flow_pixel_constrained-claude-agentic: image_size=512, pixel_spacing=0.3516, n_angles=128, n_det=1024, det_spacing=0.35754, sod=500.0, sdd=1000.0, display_min=0.0, display_max=0.5, train_n=400, val_n=200, noise_i0=100000.0, noise_sigma_e=10.0, seed=42, dataset_kind=breast_ct, fd_recon_ckpt=/cluster/maier/Agent4CT/checkpoints/fast_diffusion_pixel_breast.pt, fd_recon_steps=8, fd_recon_init=fbp, fd_recon_init_t=0.01, fd_recon_eta=1.0, fd_recon_dc=1, fd_recon_dc_n_cg=20, fd_recon_dc_relax=1.0, rationale=iter-20 CHAMPION CONFIRMATION toward the HARD iter-20 stop. Locks the best config found: init_t0.01, n_cg20, relax1.0, steps8, eta1.0 (iter-15, hr=0.5164, rmse0.002522, psnr42.63, ssim0.978 - HALF the FBP baseline rmse0.00521). SEARCH SUMMARY: the breast-native prior + few-step flow with a deep-but-not-over-converged CG data-consistency step (DC-ON constrained variant) CLEARS the strong 128-view breast FBP baseline by a wide margin. Two levers dominate: init_t (optimum ~0.01: near-FBP embed so the prior lightly denoises without repainting; higher init_t catastrophically repaints, lower loses the prior's denoise) and dc_n_cg (SEMI-CONVERGENCE peak at ~20: enough CG to beat the analytic Hann FBP on sparse data, but not so many that CG re-amplifies measurement noise). dc_relax=1.0 (full projection) best; eta/steps near-neutral. This confirms the FAIR TEST: prior-mismatch (Mayo out_scale0.05 vs breast0.5) WAS the cause of the old hr=0; a matched breast-native prior lifts pixel-DC-on to hr~0.52. Confirmation run reproduces the champion (deterministic seed=42).", "run_id": "breast-ct-claude-agentic-fastdiff-flow-pixel-constrained-search-20260703-01", "runtime": {"elapsed_s": 278.02718567848206}, "schema_version": 3, "solver_key": "fastdiff-flow-pixel-constrained", "solver_name": "Fast-diffusion flow (pixel, constrained DC)", "split": {"train_n": 400, "val_n": 200}, "status": "keep", "ts": "2026-07-06T22:38:33Z"}
{"advice_for_others": "fastdiff_flow_pixel_unconstrained-claude-agentic: image_size=512, pixel_spacing=0.3516, n_angles=128, n_det=1024, det_spacing=0.35754, sod=500.0, sdd=1000.0, display_min=0.0, display_max=0.5, train_n=400, val_n=200, noise_i0=100000.0, noise_sigma_e=10.0, seed=42, fd_recon_ckpt=/cluster/maier/Agent4CT/checkpoints/fast_diffusion_pixel_breast.pt, fd_recon_steps=8, fd_recon_init=fbp, fd_recon_init_t=0.7, fd_recon_eta=1.0, fd_recon_dc=0, fd_recon_dc_n_cg=5, fd_recon_dc_relax=0.5, rationale=iter-1 RE-RUN fastdiff_flow_pixel_unconstrained with the BREAST-NATIVE prior (fast_diffusion_pixel_breast.pt, out_scale=0.5, n_train=3600) and DC-PROJECTION OFF (fd_recon_dc=0) = genuine UNCONSTRAINED variant (pure DPS-guided generative sampling from the prior, NO hard CG data-consistency projection). This is the FAIR test: the campaign's 4 fastdiff solvers all scored hr=0 using the OUT-OF-DOMAIN Mayo prior (out_scale 0.05 vs breast 0.5). SIX-BOX: (1) PRIOR: same-slug Mayo-prior run (hr=0 all 20 iters, val_ssim plateaued ~0.895, DC ON) + constrained-sibling breast-prior run (contrast). (2) FAILURE MODE observed in the Mayo-prior run: out_scale mismatch pinned recon intensity 10x too low -> RMSE never beat sparse FBP baseline (hr=0). Breast prior fixes the intensity scale. (3) ONE KNOB vs constrained sibling: fd_recon_dc 1->0 (DC projection OFF); vs Mayo-prior run: ckpt swapped to breast-native. (4) HYPOTHESIS: the breast-native prior alone (DC off) may partially clear the 128-view sparse FBP baseline via the learned prior filling the null space, but is EXPECTED to UNDERPERFORM the DC-on constrained sibling because without the CG projection there is no hard sinogram fidelity anchor - that gap IS the finding (how much the breast prior contributes vs the DC step). (5) BUDGET: 200 slices x 8-step Euler (no CG since DC off) at 512^2, single shared breast PYRO-NN projector; fits the HARD 20-min budget (30-min sbatch wall). (6) Loop continues; iter-2 self-dispatched on landing, tuning sampler knobs (steps, init_t, eta). out_scale auto-reads from ckpt (0.5); pixel domain auto-detected.", "agent": "fastdiff_flow_pixel_unconstrained-claude-agentic", "campaign": "search-20260703-01", "cfg_full": {"det_spacing": 0.35754, "display_max": 0.5, "display_min": 0.0, "fd_recon_ckpt": "/cluster/maier/Agent4CT/checkpoints/fast_diffusion_pixel_breast.pt", "fd_recon_dc": 0, "fd_recon_dc_n_cg": 5, "fd_recon_dc_relax": 0.5, "fd_recon_eta": 1.0, "fd_recon_init": "fbp", "fd_recon_init_t": 0.7, "fd_recon_steps": 8, "image_size": 512, "n_angles": 128, "n_det": 1024, "noise_i0": 100000.0, "noise_sigma_e": 10.0, "pixel_spacing": 0.3516, "rationale": "iter-1 RE-RUN fastdiff_flow_pixel_unconstrained with the BREAST-NATIVE prior (fast_diffusion_pixel_breast.pt, out_scale=0.5, n_train=3600) and DC-PROJECTION OFF (fd_recon_dc=0) = genuine UNCONSTRAINED variant (pure DPS-guided generative sampling from the prior, NO hard CG data-consistency projection). This is the FAIR test: the campaign's 4 fastdiff solvers all scored hr=0 using the OUT-OF-DOMAIN Mayo prior (out_scale 0.05 vs breast 0.5). SIX-BOX: (1) PRIOR: same-slug Mayo-prior run (hr=0 all 20 iters, val_ssim plateaued ~0.895, DC ON) + constrained-sibling breast-prior run (contrast). (2) FAILURE MODE observed in the Mayo-prior run: out_scale mismatch pinned recon intensity 10x too low -> RMSE never beat sparse FBP baseline (hr=0). Breast prior fixes the intensity scale. (3) ONE KNOB vs constrained sibling: fd_recon_dc 1->0 (DC projection OFF); vs Mayo-prior run: ckpt swapped to breast-native. (4) HYPOTHESIS: the breast-native prior alone (DC off) may partially clear the 128-view sparse FBP baseline via the learned prior filling the null space, but is EXPECTED to UNDERPERFORM the DC-on constrained sibling because without the CG projection there is no hard sinogram fidelity anchor - that gap IS the finding (how much the breast prior contributes vs the DC step). (5) BUDGET: 200 slices x 8-step Euler (no CG since DC off) at 512^2, single shared breast PYRO-NN projector; fits the HARD 20-min budget (30-min sbatch wall). (6) Loop continues; iter-2 self-dispatched on landing, tuning sampler knobs (steps, init_t, eta). out_scale auto-reads from ckpt (0.5); pixel domain auto-detected.", "sdd": 1000.0, "seed": 42, "sod": 500.0, "train_n": 400, "val_n": 200}, "challenge": "breast_ct", "change_class": "architecture", "git_commit": "671da566", "images": {"comparison": "runs/breast-ct-claude-agentic-fastdiff-flow-pixel-unconstrained-search-20260703-01/iterations/iter-0001/comparison.png", "test_showcase": null, "valtest_showcase": null}, "iter": 1, "kept": false, "metrics": {"headroom": 0.0, "headroom_std": 0.0, "val_psnr": 18.995059967041016, "val_psnr_std": 0.8149147913839869, "val_rmse": 0.03833994269371033, "val_rmse_std": 0.0035283561386422546, "val_ssim": 0.6896629333496094, "val_ssim_std": 0.014709672674626187}, "model": "claude-opus-4-8-1m", "obs_path": "breast-ct-claude-agentic-fastdiff-flow-pixel-unconstrained-search-20260703-01/iterations/iter-0001/observation.json", "obs_sha1": "d501abcc0ac69c4f0aac582744d992415555fcf8", "params_M": 3.822787, "params_source": "observation", "rationale": "fastdiff_flow_pixel_unconstrained-claude-agentic: image_size=512, pixel_spacing=0.3516, n_angles=128, n_det=1024, det_spacing=0.35754, sod=500.0, sdd=1000.0, display_min=0.0, display_max=0.5, train_n=400, val_n=200, noise_i0=100000.0, noise_sigma_e=10.0, seed=42, fd_recon_ckpt=/cluster/maier/Agent4CT/checkpoints/fast_diffusion_pixel_breast.pt, fd_recon_steps=8, fd_recon_init=fbp, fd_recon_init_t=0.7, fd_recon_eta=1.0, fd_recon_dc=0, fd_recon_dc_n_cg=5, fd_recon_dc_relax=0.5, rationale=iter-1 RE-RUN fastdiff_flow_pixel_unconstrained with the BREAST-NATIVE prior (fast_diffusion_pixel_breast.pt, out_scale=0.5, n_train=3600) and DC-PROJECTION OFF (fd_recon_dc=0) = genuine UNCONSTRAINED variant (pure DPS-guided generative sampling from the prior, NO hard CG data-consistency projection). This is the FAIR test: the campaign's 4 fastdiff solvers all scored hr=0 using the OUT-OF-DOMAIN Mayo prior (out_scale 0.05 vs breast 0.5). SIX-BOX: (1) PRIOR: same-slug Mayo-prior run (hr=0 all 20 iters, val_ssim plateaued ~0.895, DC ON) + constrained-sibling breast-prior run (contrast). (2) FAILURE MODE observed in the Mayo-prior run: out_scale mismatch pinned recon intensity 10x too low -> RMSE never beat sparse FBP baseline (hr=0). Breast prior fixes the intensity scale. (3) ONE KNOB vs constrained sibling: fd_recon_dc 1->0 (DC projection OFF); vs Mayo-prior run: ckpt swapped to breast-native. (4) HYPOTHESIS: the breast-native prior alone (DC off) may partially clear the 128-view sparse FBP baseline via the learned prior filling the null space, but is EXPECTED to UNDERPERFORM the DC-on constrained sibling because without the CG projection there is no hard sinogram fidelity anchor - that gap IS the finding (how much the breast prior contributes vs the DC step). (5) BUDGET: 200 slices x 8-step Euler (no CG since DC off) at 512^2, single shared breast PYRO-NN projector; fits the HARD 20-min budget (30-min sbatch wall). (6) Loop continues; iter-2 self-dispatched on landing, tuning sampler knobs (steps, init_t, eta). out_scale auto-reads from ckpt (0.5); pixel domain auto-detected.", "run_id": "breast-ct-claude-agentic-fastdiff-flow-pixel-unconstrained-search-20260703-01", "runtime": {"elapsed_s": 130.51196432113647}, "schema_version": 3, "solver_key": "fastdiff-flow-pixel-unconstrained", "solver_name": "Fast-diffusion flow (pixel, unconstrained)", "split": {"train_n": 3600, "val_n": 200}, "status": "discard", "ts": "2026-07-06T20:05:26Z"}
{"advice_for_others": "fastdiff_flow_pixel_unconstrained-claude-agentic: image_size=512, pixel_spacing=0.3516, n_angles=128, n_det=1024, det_spacing=0.35754, sod=500.0, sdd=1000.0, display_min=0.0, display_max=0.5, train_n=400, val_n=200, noise_i0=100000.0, noise_sigma_e=10.0, seed=42, fd_recon_ckpt=/cluster/maier/Agent4CT/checkpoints/fast_diffusion_pixel_breast.pt, fd_recon_steps=8, fd_recon_init=fbp, fd_recon_init_t=0.4, fd_recon_eta=1.0, fd_recon_dc=0, fd_recon_dc_n_cg=5, fd_recon_dc_relax=0.5, rationale=iter-2: DC-off breast-prior. ONE KNOB init_t 0.7->0.4. PRIOR iter-1: hr=0, PSNR 19.0 vs sparse-FBP baseline PSNR 36.3 (RMSE 3.8e-2 vs 5.2e-3) - the DC-free sampler drifted far from measurement. FAILURE MODE: init_t=0.7 injects 70% noise into the FBP embedding; with NO hard DC anchor and only soft DPS guidance the generative prior hallucinates plausible breast texture and loses fidelity. HYPOTHESIS: lowering init_t to 0.4 injects less noise so the DC-free sampler stays anchored near the measured FBP -> PSNR/RMSE improve toward baseline. init_t is the dominant fidelity lever when DC is off.", "agent": "fastdiff_flow_pixel_unconstrained-claude-agentic", "campaign": "search-20260703-01", "cfg_full": {"det_spacing": 0.35754, "display_max": 0.5, "display_min": 0.0, "fd_recon_ckpt": "/cluster/maier/Agent4CT/checkpoints/fast_diffusion_pixel_breast.pt", "fd_recon_dc": 0, "fd_recon_dc_n_cg": 5, "fd_recon_dc_relax": 0.5, "fd_recon_eta": 1.0, "fd_recon_init": "fbp", "fd_recon_init_t": 0.4, "fd_recon_steps": 8, "image_size": 512, "n_angles": 128, "n_det": 1024, "noise_i0": 100000.0, "noise_sigma_e": 10.0, "pixel_spacing": 0.3516, "rationale": "iter-2: DC-off breast-prior. ONE KNOB init_t 0.7->0.4. PRIOR iter-1: hr=0, PSNR 19.0 vs sparse-FBP baseline PSNR 36.3 (RMSE 3.8e-2 vs 5.2e-3) - the DC-free sampler drifted far from measurement. FAILURE MODE: init_t=0.7 injects 70% noise into the FBP embedding; with NO hard DC anchor and only soft DPS guidance the generative prior hallucinates plausible breast texture and loses fidelity. HYPOTHESIS: lowering init_t to 0.4 injects less noise so the DC-free sampler stays anchored near the measured FBP -> PSNR/RMSE improve toward baseline. init_t is the dominant fidelity lever when DC is off.", "sdd": 1000.0, "seed": 42, "sod": 500.0, "train_n": 400, "val_n": 200}, "challenge": "breast_ct", "change_class": "architecture", "git_commit": "671da566", "images": {"comparison": "runs/breast-ct-claude-agentic-fastdiff-flow-pixel-unconstrained-search-20260703-01/iterations/iter-0002/comparison.png", "test_showcase": null, "valtest_showcase": null}, "iter": 2, "kept": false, "metrics": {"headroom": 0.0, "headroom_std": 0.0, "val_psnr": 24.642866134643555, "val_psnr_std": 0.7160025918000306, "val_rmse": 0.020010648295283318, "val_rmse_std": 0.0016035749031489228, "val_ssim": 0.5904179811477661, "val_ssim_std": 0.008737993851251687}, "model": "claude-opus-4-8-1m", "obs_path": "breast-ct-claude-agentic-fastdiff-flow-pixel-unconstrained-search-20260703-01/iterations/iter-0002/observation.json", "obs_sha1": "04cbd7563970bef42889d3b7d4580d2c79c1b00f", "params_M": 3.822787, "params_source": "observation", "rationale": "fastdiff_flow_pixel_unconstrained-claude-agentic: image_size=512, pixel_spacing=0.3516, n_angles=128, n_det=1024, det_spacing=0.35754, sod=500.0, sdd=1000.0, display_min=0.0, display_max=0.5, train_n=400, val_n=200, noise_i0=100000.0, noise_sigma_e=10.0, seed=42, fd_recon_ckpt=/cluster/maier/Agent4CT/checkpoints/fast_diffusion_pixel_breast.pt, fd_recon_steps=8, fd_recon_init=fbp, fd_recon_init_t=0.4, fd_recon_eta=1.0, fd_recon_dc=0, fd_recon_dc_n_cg=5, fd_recon_dc_relax=0.5, rationale=iter-2: DC-off breast-prior. ONE KNOB init_t 0.7->0.4. PRIOR iter-1: hr=0, PSNR 19.0 vs sparse-FBP baseline PSNR 36.3 (RMSE 3.8e-2 vs 5.2e-3) - the DC-free sampler drifted far from measurement. FAILURE MODE: init_t=0.7 injects 70% noise into the FBP embedding; with NO hard DC anchor and only soft DPS guidance the generative prior hallucinates plausible breast texture and loses fidelity. HYPOTHESIS: lowering init_t to 0.4 injects less noise so the DC-free sampler stays anchored near the measured FBP -> PSNR/RMSE improve toward baseline. init_t is the dominant fidelity lever when DC is off.", "run_id": "breast-ct-claude-agentic-fastdiff-flow-pixel-unconstrained-search-20260703-01", "runtime": {"elapsed_s": 130.82463812828064}, "schema_version": 3, "solver_key": "fastdiff-flow-pixel-unconstrained", "solver_name": "Fast-diffusion flow (pixel, unconstrained)", "split": {"train_n": 3600, "val_n": 200}, "status": "discard", "ts": "2026-07-06T20:15:51Z"}
