{"advice_for_others": "fastdiff_flow_pixel_unconstrained-claude-agentic: image_size=512, pixel_spacing=0.3516, n_angles=128, n_det=1024, det_spacing=0.35754, sod=500.0, sdd=1000.0, display_min=0.0, display_max=0.5, train_n=400, val_n=200, noise_i0=100000.0, noise_sigma_e=10.0, seed=42, fd_recon_ckpt=/cluster/maier/Agent4CT/checkpoints/fast_diffusion_pixel_breast.pt, fd_recon_steps=8, fd_recon_init=fbp, fd_recon_init_t=0.02, fd_recon_eta=0.02, fd_recon_dc=0, fd_recon_dc_n_cg=5, fd_recon_dc_relax=0.5, rationale=iter-19: DC-off breast-prior. At hr-peak init_t=0.02, continue eta fine-tune. ONE KNOB eta 0.05->0.02. PRIOR: at init_t0.02, eta0.1->hr0.209, eta0.05->hr0.261(best) - gentler DPS = better denoise, less overshoot. HYPOTHESIS: eta=0.02 (near-minimal guidance) edges hr higher still, OR flattens => eta~0.02-0.05 is the joint optimum with init_t0.02. As eta->0 the recon becomes pure prior-denoise of the FBP-init with ~no measurement pull; the question is whether the whisper of DPS still adds value at the peak. Locates the eta floor at the champion init_t.", "agent": "fastdiff_flow_pixel_unconstrained-claude-agentic", "campaign": "search-20260703-01", "cfg_full": {"det_spacing": 0.35754, "display_max": 0.5, "display_min": 0.0, "fd_recon_ckpt": "/cluster/maier/Agent4CT/checkpoints/fast_diffusion_pixel_breast.pt", "fd_recon_dc": 0, "fd_recon_dc_n_cg": 5, "fd_recon_dc_relax": 0.5, "fd_recon_eta": 0.02, "fd_recon_init": "fbp", "fd_recon_init_t": 0.02, "fd_recon_steps": 8, "image_size": 512, "n_angles": 128, "n_det": 1024, "noise_i0": 100000.0, "noise_sigma_e": 10.0, "pixel_spacing": 0.3516, "rationale": "iter-19: DC-off breast-prior. At hr-peak init_t=0.02, continue eta fine-tune. ONE KNOB eta 0.05->0.02. PRIOR: at init_t0.02, eta0.1->hr0.209, eta0.05->hr0.261(best) - gentler DPS = better denoise, less overshoot. HYPOTHESIS: eta=0.02 (near-minimal guidance) edges hr higher still, OR flattens => eta~0.02-0.05 is the joint optimum with init_t0.02. As eta->0 the recon becomes pure prior-denoise of the FBP-init with ~no measurement pull; the question is whether the whisper of DPS still adds value at the peak. Locates the eta floor at the champion init_t.", "sdd": 1000.0, "seed": 42, "sod": 500.0, "train_n": 400, "val_n": 200}, "challenge": "breast_ct", "change_class": "architecture", "git_commit": "671da566", "images": {"comparison": "runs/breast-ct-claude-agentic-fastdiff-flow-pixel-unconstrained-search-20260703-01/iterations/iter-0019/comparison.png", "test_showcase": null, "valtest_showcase": null}, "iter": 19, "kept": true, "metrics": {"headroom": 0.27085786056266214, "headroom_std": 0.019194820496196974, "val_psnr": 39.06795120239258, "val_psnr_std": 0.44496397290619405, "val_rmse": 0.0038019539788365364, "val_rmse_std": 0.00019060982980320773, "val_ssim": 0.9758236408233643, "val_ssim_std": 0.0024257312557969834}, "model": "claude-opus-4-8-1m", "obs_path": "breast-ct-claude-agentic-fastdiff-flow-pixel-unconstrained-search-20260703-01/iterations/iter-0019/observation.json", "obs_sha1": "e4587feadbcd4f055e13473b98952648959eed75", "params_M": 3.822787, "params_source": "observation", "rationale": "fastdiff_flow_pixel_unconstrained-claude-agentic: image_size=512, pixel_spacing=0.3516, n_angles=128, n_det=1024, det_spacing=0.35754, sod=500.0, sdd=1000.0, display_min=0.0, display_max=0.5, train_n=400, val_n=200, noise_i0=100000.0, noise_sigma_e=10.0, seed=42, fd_recon_ckpt=/cluster/maier/Agent4CT/checkpoints/fast_diffusion_pixel_breast.pt, fd_recon_steps=8, fd_recon_init=fbp, fd_recon_init_t=0.02, fd_recon_eta=0.02, fd_recon_dc=0, fd_recon_dc_n_cg=5, fd_recon_dc_relax=0.5, rationale=iter-19: DC-off breast-prior. At hr-peak init_t=0.02, continue eta fine-tune. ONE KNOB eta 0.05->0.02. PRIOR: at init_t0.02, eta0.1->hr0.209, eta0.05->hr0.261(best) - gentler DPS = better denoise, less overshoot. HYPOTHESIS: eta=0.02 (near-minimal guidance) edges hr higher still, OR flattens => eta~0.02-0.05 is the joint optimum with init_t0.02. As eta->0 the recon becomes pure prior-denoise of the FBP-init with ~no measurement pull; the question is whether the whisper of DPS still adds value at the peak. Locates the eta floor at the champion init_t.", "run_id": "breast-ct-claude-agentic-fastdiff-flow-pixel-unconstrained-search-20260703-01", "runtime": {"elapsed_s": 167.78331327438354}, "schema_version": 3, "solver_key": "fastdiff-flow-pixel-unconstrained", "solver_name": "Fast-diffusion flow (pixel, unconstrained)", "split": {"train_n": 3600, "val_n": 200}, "status": "keep", "ts": "2026-07-06T21:31:20Z"}
{"advice_for_others": "fastdiff_flow_pixel_unconstrained-claude-agentic: image_size=512, pixel_spacing=0.3516, n_angles=128, n_det=1024, det_spacing=0.35754, sod=500.0, sdd=1000.0, display_min=0.0, display_max=0.5, train_n=400, val_n=200, noise_i0=100000.0, noise_sigma_e=10.0, seed=42, fd_recon_ckpt=/cluster/maier/Agent4CT/checkpoints/fast_diffusion_pixel_breast.pt, fd_recon_steps=16, fd_recon_init=noise, fd_recon_init_t=0.7, fd_recon_eta=1.0, fd_recon_dc=0, fd_recon_dc_n_cg=5, fd_recon_dc_relax=0.5, rationale=iter-20 (FINAL): DC-off breast-prior. Architecturally-DISTINCT family for STOP-protocol edge coverage. ONE KNOB init fbp->noise (pure unconditional generation from the prior, ZERO FBP anchor; init_t ignored when init=noise so t starts at 1.0; eta back to 1.0 and steps=16 since full-trajectory generation needs guidance+NFE). PRIOR: the FBP-anchored regime peaks at hr0.271 (init_t0.02) - the entire gain came from lightly denoising the FBP init. HYPOTHESIS: with NO FBP init, the DC-off sampler must reconstruct ENTIRELY from the prior + soft DPS on 128-view sparse data -> hr~0 (cannot match FBP), quantifying that the FBP INIT (not the generative prior per se) is what carries the DC-off variant. This is the honest lower bound: the breast prior as a pure generator (no measurement warm-start) does NOT reconstruct sparse-view breast CT. Completes 20 iters + >=3 distinct families (init_t sweep, eta sweep, NFE, seed-robustness, noise-init).", "agent": "fastdiff_flow_pixel_unconstrained-claude-agentic", "campaign": "search-20260703-01", "cfg_full": {"det_spacing": 0.35754, "display_max": 0.5, "display_min": 0.0, "fd_recon_ckpt": "/cluster/maier/Agent4CT/checkpoints/fast_diffusion_pixel_breast.pt", "fd_recon_dc": 0, "fd_recon_dc_n_cg": 5, "fd_recon_dc_relax": 0.5, "fd_recon_eta": 1.0, "fd_recon_init": "noise", "fd_recon_init_t": 0.7, "fd_recon_steps": 16, "image_size": 512, "n_angles": 128, "n_det": 1024, "noise_i0": 100000.0, "noise_sigma_e": 10.0, "pixel_spacing": 0.3516, "rationale": "iter-20 (FINAL): DC-off breast-prior. Architecturally-DISTINCT family for STOP-protocol edge coverage. ONE KNOB init fbp->noise (pure unconditional generation from the prior, ZERO FBP anchor; init_t ignored when init=noise so t starts at 1.0; eta back to 1.0 and steps=16 since full-trajectory generation needs guidance+NFE). PRIOR: the FBP-anchored regime peaks at hr0.271 (init_t0.02) - the entire gain came from lightly denoising the FBP init. HYPOTHESIS: with NO FBP init, the DC-off sampler must reconstruct ENTIRELY from the prior + soft DPS on 128-view sparse data -> hr~0 (cannot match FBP), quantifying that the FBP INIT (not the generative prior per se) is what carries the DC-off variant. This is the honest lower bound: the breast prior as a pure generator (no measurement warm-start) does NOT reconstruct sparse-view breast CT. Completes 20 iters + >=3 distinct families (init_t sweep, eta sweep, NFE, seed-robustness, noise-init).", "sdd": 1000.0, "seed": 42, "sod": 500.0, "train_n": 400, "val_n": 200}, "challenge": "breast_ct", "change_class": "architecture", "git_commit": "671da566", "images": {"comparison": "runs/breast-ct-claude-agentic-fastdiff-flow-pixel-unconstrained-search-20260703-01/iterations/iter-0020/comparison.png", "test_showcase": null, "valtest_showcase": null}, "iter": 20, "kept": false, "metrics": {"headroom": 0.0, "headroom_std": 0.0, "val_psnr": 6.867376327514648, "val_psnr_std": 0.9699724124153905, "val_rmse": 0.1548943668603897, "val_rmse_std": 0.017273191805620928, "val_ssim": 0.3557876646518707, "val_ssim_std": 0.022619106164639146}, "model": "claude-opus-4-8-1m", "obs_path": "breast-ct-claude-agentic-fastdiff-flow-pixel-unconstrained-search-20260703-01/iterations/iter-0020/observation.json", "obs_sha1": "ba1502fe17047e6de788486e970b71b49497b3f3", "params_M": 3.822787, "params_source": "observation", "rationale": "fastdiff_flow_pixel_unconstrained-claude-agentic: image_size=512, pixel_spacing=0.3516, n_angles=128, n_det=1024, det_spacing=0.35754, sod=500.0, sdd=1000.0, display_min=0.0, display_max=0.5, train_n=400, val_n=200, noise_i0=100000.0, noise_sigma_e=10.0, seed=42, fd_recon_ckpt=/cluster/maier/Agent4CT/checkpoints/fast_diffusion_pixel_breast.pt, fd_recon_steps=16, fd_recon_init=noise, fd_recon_init_t=0.7, fd_recon_eta=1.0, fd_recon_dc=0, fd_recon_dc_n_cg=5, fd_recon_dc_relax=0.5, rationale=iter-20 (FINAL): DC-off breast-prior. Architecturally-DISTINCT family for STOP-protocol edge coverage. ONE KNOB init fbp->noise (pure unconditional generation from the prior, ZERO FBP anchor; init_t ignored when init=noise so t starts at 1.0; eta back to 1.0 and steps=16 since full-trajectory generation needs guidance+NFE). PRIOR: the FBP-anchored regime peaks at hr0.271 (init_t0.02) - the entire gain came from lightly denoising the FBP init. HYPOTHESIS: with NO FBP init, the DC-off sampler must reconstruct ENTIRELY from the prior + soft DPS on 128-view sparse data -> hr~0 (cannot match FBP), quantifying that the FBP INIT (not the generative prior per se) is what carries the DC-off variant. This is the honest lower bound: the breast prior as a pure generator (no measurement warm-start) does NOT reconstruct sparse-view breast CT. Completes 20 iters + >=3 distinct families (init_t sweep, eta sweep, NFE, seed-robustness, noise-init).", "run_id": "breast-ct-claude-agentic-fastdiff-flow-pixel-unconstrained-search-20260703-01", "runtime": {"elapsed_s": 268.83489751815796}, "schema_version": 3, "solver_key": "fastdiff-flow-pixel-unconstrained", "solver_name": "Fast-diffusion flow (pixel, unconstrained)", "split": {"train_n": 3600, "val_n": 200}, "status": "discard", "ts": "2026-07-06T21:36:42Z"}
{"advice_for_others": "fastdiff_wdm_wavelet_constrained-claude-agentic: val_n=200, seed=42, fd_recon_ckpt=/cluster/maier/Agent4CT/checkpoints/fast_diffusion_wavelet_breast.pt, fd_recon_steps=8, fd_recon_init=fbp, fd_recon_init_t=0.7, fd_recon_eta=1.0, fd_recon_dc=1, fd_recon_dc_n_cg=5, fd_recon_dc_relax=0.5, dataset_kind=breast_ct, rationale=iter-1 ONBOARDING/FEASIBILITY fastdiff_wdm_wavelet_CONSTRAINED (per-image few-step DC-CONSTRAINED Haar-wavelet flow recon, solver_fast_recon.py) on re-split Breast-CT (train 3600/val 200/test 200, seed 20260703), val_n=200. RE-RUN with the BREAST-NATIVE wavelet prior fast_diffusion_wavelet_breast.pt (out_scale=0.5, n_train=3600, val_flow_loss 0.0031) -- the FAIR test replacing the earlier Mayo-prior fallback (out_scale 0.05, 10x mu mismatch, all 20 iters hr=0). DC ON (constrained): fd_recon_dc=1 enables the hard CG data-consistency projection each Euler step (dc_relax=0.5, n_cg=5) -- this is what makes constrained genuine (a real min||Ax-y||^2 CG solve onto the measured 128-view sinogram), vs the unconstrained sibling which sets dc=0. SIX-BOX: (1) PRIOR: none for the breast-native prior yet; nearest = the archived Mayo-prior wdm-constrained curve (all hr=0, out_scale mismatch). (2) FAILURE MODE: N/A onboarding; goal = does the breast-native DC-constrained wavelet recon clear the 128-view sparse-FBP baseline (breast baseline_PSNR ~36.3) with hr>0, confirming the recon is no longer FBP-bounded? (3) ONE KNOB: N/A baseline -- canonical fast_recon constrained defaults (8-step Euler, FBP init t=0.7, eta=1.0, DC on CG=5 relax=0.5). (4) HYPOTHESIS: with a breast-native prior (out_scale matched at 0.5) the wavelet flow now injects CORRECTLY-scaled structure and DPS+hard-CG DC anchors it to the measured sparse sinogram, so hr should clear 0 (unlike the Mayo-prior run). FALSIFIER: if hr=0 still, the sparse-view wavelet prior is over-smoothing/mis-aligned -> iters raise dc_relax toward 1.0 and lower init_t (less prior drift). (5) BUDGET: 200 slices x 8-step Euler + 5-iter CG, breast single shared PYRO-NN projector, 512^2 -- well inside HARD 20-min (30-min sbatch wall). val = ALL 200 fixed seed-20260703 val cases. (6) Loop continues; iter-2 self-dispatched on landing. Reserved levers iters 2-20: fd_recon_dc_relax, fd_recon_init_t, fd_recon_steps, fd_recon_eta, fd_recon_dc_n_cg.", "agent": "fastdiff_wdm_wavelet_constrained-claude-agentic", "campaign": "search-20260703-01", "cfg_full": {"dataset_kind": "breast_ct", "fd_recon_ckpt": "/cluster/maier/Agent4CT/checkpoints/fast_diffusion_wavelet_breast.pt", "fd_recon_dc": 1, "fd_recon_dc_n_cg": 5, "fd_recon_dc_relax": 0.5, "fd_recon_eta": 1.0, "fd_recon_init": "fbp", "fd_recon_init_t": 0.7, "fd_recon_steps": 8, "rationale": "iter-1 ONBOARDING/FEASIBILITY fastdiff_wdm_wavelet_CONSTRAINED (per-image few-step DC-CONSTRAINED Haar-wavelet flow recon, solver_fast_recon.py) on re-split Breast-CT (train 3600/val 200/test 200, seed 20260703), val_n=200. RE-RUN with the BREAST-NATIVE wavelet prior fast_diffusion_wavelet_breast.pt (out_scale=0.5, n_train=3600, val_flow_loss 0.0031) -- the FAIR test replacing the earlier Mayo-prior fallback (out_scale 0.05, 10x mu mismatch, all 20 iters hr=0). DC ON (constrained): fd_recon_dc=1 enables the hard CG data-consistency projection each Euler step (dc_relax=0.5, n_cg=5) -- this is what makes constrained genuine (a real min||Ax-y||^2 CG solve onto the measured 128-view sinogram), vs the unconstrained sibling which sets dc=0. SIX-BOX: (1) PRIOR: none for the breast-native prior yet; nearest = the archived Mayo-prior wdm-constrained curve (all hr=0, out_scale mismatch). (2) FAILURE MODE: N/A onboarding; goal = does the breast-native DC-constrained wavelet recon clear the 128-view sparse-FBP baseline (breast baseline_PSNR ~36.3) with hr>0, confirming the recon is no longer FBP-bounded? (3) ONE KNOB: N/A baseline -- canonical fast_recon constrained defaults (8-step Euler, FBP init t=0.7, eta=1.0, DC on CG=5 relax=0.5). (4) HYPOTHESIS: with a breast-native prior (out_scale matched at 0.5) the wavelet flow now injects CORRECTLY-scaled structure and DPS+hard-CG DC anchors it to the measured sparse sinogram, so hr should clear 0 (unlike the Mayo-prior run). FALSIFIER: if hr=0 still, the sparse-view wavelet prior is over-smoothing/mis-aligned -> iters raise dc_relax toward 1.0 and lower init_t (less prior drift). (5) BUDGET: 200 slices x 8-step Euler + 5-iter CG, breast single shared PYRO-NN projector, 512^2 -- well inside HARD 20-min (30-min sbatch wall). val = ALL 200 fixed seed-20260703 val cases. (6) Loop continues; iter-2 self-dispatched on landing. Reserved levers iters 2-20: fd_recon_dc_relax, fd_recon_init_t, fd_recon_steps, fd_recon_eta, fd_recon_dc_n_cg.", "seed": 42, "val_n": 200}, "challenge": "breast_ct", "change_class": "architecture", "git_commit": "671da566", "images": {"comparison": "runs/breast-ct-claude-agentic-fastdiff-wdm-wavelet-constrained-search-20260703-01/iterations/iter-0001/comparison.png", "test_showcase": null, "valtest_showcase": null}, "iter": 1, "kept": false, "metrics": {"headroom": 0.0, "headroom_std": 0.0, "val_psnr": 17.135313034057617, "val_psnr_std": 0.2977228426292813, "val_rmse": 0.04749400168657303, "val_rmse_std": 0.0013226338275693366, "val_ssim": 0.3259071409702301, "val_ssim_std": 0.007764932265393809}, "model": "claude-opus-4-8-1m", "obs_path": "breast-ct-claude-agentic-fastdiff-wdm-wavelet-constrained-search-20260703-01/iterations/iter-0001/observation.json", "obs_sha1": "7bd0a6a75a1f62601462c5364345016d10c19e9f", "params_M": 3.824908, "params_source": "observation", "rationale": "fastdiff_wdm_wavelet_constrained-claude-agentic: val_n=200, seed=42, fd_recon_ckpt=/cluster/maier/Agent4CT/checkpoints/fast_diffusion_wavelet_breast.pt, fd_recon_steps=8, fd_recon_init=fbp, fd_recon_init_t=0.7, fd_recon_eta=1.0, fd_recon_dc=1, fd_recon_dc_n_cg=5, fd_recon_dc_relax=0.5, dataset_kind=breast_ct, rationale=iter-1 ONBOARDING/FEASIBILITY fastdiff_wdm_wavelet_CONSTRAINED (per-image few-step DC-CONSTRAINED Haar-wavelet flow recon, solver_fast_recon.py) on re-split Breast-CT (train 3600/val 200/test 200, seed 20260703), val_n=200. RE-RUN with the BREAST-NATIVE wavelet prior fast_diffusion_wavelet_breast.pt (out_scale=0.5, n_train=3600, val_flow_loss 0.0031) -- the FAIR test replacing the earlier Mayo-prior fallback (out_scale 0.05, 10x mu mismatch, all 20 iters hr=0). DC ON (constrained): fd_recon_dc=1 enables the hard CG data-consistency projection each Euler step (dc_relax=0.5, n_cg=5) -- this is what makes constrained genuine (a real min||Ax-y||^2 CG solve onto the measured 128-view sinogram), vs the unconstrained sibling which sets dc=0. SIX-BOX: (1) PRIOR: none for the breast-native prior yet; nearest = the archived Mayo-prior wdm-constrained curve (all hr=0, out_scale mismatch). (2) FAILURE MODE: N/A onboarding; goal = does the breast-native DC-constrained wavelet recon clear the 128-view sparse-FBP baseline (breast baseline_PSNR ~36.3) with hr>0, confirming the recon is no longer FBP-bounded? (3) ONE KNOB: N/A baseline -- canonical fast_recon constrained defaults (8-step Euler, FBP init t=0.7, eta=1.0, DC on CG=5 relax=0.5). (4) HYPOTHESIS: with a breast-native prior (out_scale matched at 0.5) the wavelet flow now injects CORRECTLY-scaled structure and DPS+hard-CG DC anchors it to the measured sparse sinogram, so hr should clear 0 (unlike the Mayo-prior run). FALSIFIER: if hr=0 still, the sparse-view wavelet prior is over-smoothing/mis-aligned -> iters raise dc_relax toward 1.0 and lower init_t (less prior drift). (5) BUDGET: 200 slices x 8-step Euler + 5-iter CG, breast single shared PYRO-NN projector, 512^2 -- well inside HARD 20-min (30-min sbatch wall). val = ALL 200 fixed seed-20260703 val cases. (6) Loop continues; iter-2 self-dispatched on landing. Reserved levers iters 2-20: fd_recon_dc_relax, fd_recon_init_t, fd_recon_steps, fd_recon_eta, fd_recon_dc_n_cg.", "run_id": "breast-ct-claude-agentic-fastdiff-wdm-wavelet-constrained-search-20260703-01", "runtime": {"elapsed_s": 136.36482334136963}, "schema_version": 3, "solver_key": "fastdiff-wdm-wavelet-constrained", "solver_name": "Fast-diffusion WDM (wavelet, constrained DC)", "split": {"train_n": 3600, "val_n": 200}, "status": "discard", "ts": "2026-07-06T20:20:13Z"}
