{"advice_for_others": "manduca_bilateral-claude-agentic: proj_n_bf=1, proj_sr=1.5, proj_w=5, proj_kernel=5, bf_d_w_ratio=0.16666666666666666, manduca_N0=100000.0, manduca_bowtie=False, img_n_bf=6, img_kernel=9, img_sx=2.0, img_sy=2.0, img_sr=0.05, epochs=10, batch_size=1, lr=0.005, optimizer=adam, lambda_neg=1.0, grad_clip=1.0, train_n=400, val_n=200, val_chunk=10, seed=42, rationale=iter-10 manduca_bilateral breast (train_n=400, val=200). SIX-BOX from BEST (iter-8 img_kernel=9 hr=0.2771): (1) PRIOR: best hr=0.2771 (iter-8). proj_n_bf 1->3 (iter-9) REGRESSED to 0.2472 (-0.030) -> proj-domain cascade over-smooths the sinogram (matches Mayo: proj-domain cosmetic); REVERT proj_n_bf to 1. Image spatial sigma (img_sx=img_sy=0.5px) UNTOUCHED. (2) FAILURE MODE: with img_kernel=9 the sigma=0.5px Gaussian spatial weight decays to ~0 within +/-2px, so most of the 9-tap kernel carries near-zero weight -- the extra taps from iter-8 are largely UNUSED; streaks spanning many px still aren't pooled. (3) ONE KNOB: img spatial sigma img_sx & img_sy 0.5 -> 2.0 (isotropic image spatial bandwidth, one conceptual knob; proj_n_bf reverted to 1, img_kernel=9 kept). (4) HYPOTHESIS: img_sx/sy 0.5->2.0 lifts hr above 0.2771 because the wider spatial sigma makes the 9-tap kernel's outer taps carry real weight, extending effective spatial reach to pool coherent streak pixels (still range-gated at sigma_r=0.05 so edges preserved). FALSIFIER: if hr drops, spatial pooling over-blurs -> optimum sigma_spatial near 1.0 -> iter-11 bisects. (5) BUDGET: same params/cost as iter-8 ~500s, under 20-min. (6) Loop continues; iter-11 on landing. turbo, save ckpt+recon, params_M logged.", "agent": "manduca_bilateral-claude-agentic", "campaign": "search-20260703-01", "cfg_full": {"batch_size": 1, "bf_d_w_ratio": 0.16666666666666666, "epochs": 10, "grad_clip": 1.0, "img_kernel": 9, "img_n_bf": 6, "img_sr": 0.05, "img_sx": 2.0, "img_sy": 2.0, "lambda_neg": 1.0, "lr": 0.005, "manduca_N0": 100000.0, "manduca_bowtie": false, "optimizer": "adam", "proj_kernel": 5, "proj_n_bf": 1, "proj_sr": 1.5, "proj_w": 5, "rationale": "iter-10 manduca_bilateral breast (train_n=400, val=200). SIX-BOX from BEST (iter-8 img_kernel=9 hr=0.2771): (1) PRIOR: best hr=0.2771 (iter-8). proj_n_bf 1->3 (iter-9) REGRESSED to 0.2472 (-0.030) -> proj-domain cascade over-smooths the sinogram (matches Mayo: proj-domain cosmetic); REVERT proj_n_bf to 1. Image spatial sigma (img_sx=img_sy=0.5px) UNTOUCHED. (2) FAILURE MODE: with img_kernel=9 the sigma=0.5px Gaussian spatial weight decays to ~0 within +/-2px, so most of the 9-tap kernel carries near-zero weight -- the extra taps from iter-8 are largely UNUSED; streaks spanning many px still aren't pooled. (3) ONE KNOB: img spatial sigma img_sx & img_sy 0.5 -> 2.0 (isotropic image spatial bandwidth, one conceptual knob; proj_n_bf reverted to 1, img_kernel=9 kept). (4) HYPOTHESIS: img_sx/sy 0.5->2.0 lifts hr above 0.2771 because the wider spatial sigma makes the 9-tap kernel's outer taps carry real weight, extending effective spatial reach to pool coherent streak pixels (still range-gated at sigma_r=0.05 so edges preserved). FALSIFIER: if hr drops, spatial pooling over-blurs -> optimum sigma_spatial near 1.0 -> iter-11 bisects. (5) BUDGET: same params/cost as iter-8 ~500s, under 20-min. (6) Loop continues; iter-11 on landing. turbo, save ckpt+recon, params_M logged.", "seed": 42, "train_n": 400, "val_chunk": 10, "val_n": 200}, "challenge": "breast_ct", "change_class": "architecture", "git_commit": "671da566", "images": {"comparison": "runs/breast-ct-claude-agentic-manduca-bilateral-search-20260703-01/iterations/iter-0010/comparison.png", "test_showcase": null, "valtest_showcase": null}, "iter": 10, "kept": true, "metrics": {"headroom": 0.24679821700903648, "headroom_std": 0.008628516660396754, "val_psnr": 38.78596878051758, "val_psnr_std": 0.5892151165508641, "val_rmse": 0.0039274077862501144, "val_rmse_std": 0.00025983718411391255, "val_ssim": 0.9803834557533264, "val_ssim_std": 0.003527499512705848}, "model": "claude-opus-4-8-1m", "obs_path": "breast-ct-claude-agentic-manduca-bilateral-search-20260703-01/iterations/iter-0010/observation.json", "obs_sha1": "fb8d24684265e66c9fe91aff8d18bbfbbe866aa6", "params_M": 2.2e-05, "params_source": "observation", "rationale": "manduca_bilateral-claude-agentic: proj_n_bf=1, proj_sr=1.5, proj_w=5, proj_kernel=5, bf_d_w_ratio=0.16666666666666666, manduca_N0=100000.0, manduca_bowtie=False, img_n_bf=6, img_kernel=9, img_sx=2.0, img_sy=2.0, img_sr=0.05, epochs=10, batch_size=1, lr=0.005, optimizer=adam, lambda_neg=1.0, grad_clip=1.0, train_n=400, val_n=200, val_chunk=10, seed=42, rationale=iter-10 manduca_bilateral breast (train_n=400, val=200). SIX-BOX from BEST (iter-8 img_kernel=9 hr=0.2771): (1) PRIOR: best hr=0.2771 (iter-8). proj_n_bf 1->3 (iter-9) REGRESSED to 0.2472 (-0.030) -> proj-domain cascade over-smooths the sinogram (matches Mayo: proj-domain cosmetic); REVERT proj_n_bf to 1. Image spatial sigma (img_sx=img_sy=0.5px) UNTOUCHED. (2) FAILURE MODE: with img_kernel=9 the sigma=0.5px Gaussian spatial weight decays to ~0 within +/-2px, so most of the 9-tap kernel carries near-zero weight -- the extra taps from iter-8 are largely UNUSED; streaks spanning many px still aren't pooled. (3) ONE KNOB: img spatial sigma img_sx & img_sy 0.5 -> 2.0 (isotropic image spatial bandwidth, one conceptual knob; proj_n_bf reverted to 1, img_kernel=9 kept). (4) HYPOTHESIS: img_sx/sy 0.5->2.0 lifts hr above 0.2771 because the wider spatial sigma makes the 9-tap kernel's outer taps carry real weight, extending effective spatial reach to pool coherent streak pixels (still range-gated at sigma_r=0.05 so edges preserved). FALSIFIER: if hr drops, spatial pooling over-blurs -> optimum sigma_spatial near 1.0 -> iter-11 bisects. (5) BUDGET: same params/cost as iter-8 ~500s, under 20-min. (6) Loop continues; iter-11 on landing. turbo, save ckpt+recon, params_M logged.", "run_id": "breast-ct-claude-agentic-manduca-bilateral-search-20260703-01", "runtime": {"elapsed_s": 487.0214502811432}, "schema_version": 3, "solver_key": "manduca-bilateral", "solver_name": "Manduca proj-bilateral (trainable)", "split": {"train_n": 400, "val_n": 200}, "status": "keep", "ts": "2026-07-05T05:18:22Z"}
{"advice_for_others": "manduca_bilateral-claude-agentic: proj_n_bf=1, proj_sr=2.5, proj_w=5, proj_kernel=5, bf_d_w_ratio=0.16666666666666666, manduca_N0=100000.0, manduca_bowtie=False, img_n_bf=6, img_kernel=9, img_sx=0.5, img_sy=0.5, img_sr=0.05, epochs=10, batch_size=1, lr=0.005, optimizer=adam, lambda_neg=1.0, grad_clip=1.0, train_n=400, val_n=200, val_chunk=10, seed=42, rationale=iter-11 manduca_bilateral breast (train_n=400, val=200). SIX-BOX from BEST (iter-8 hr=0.2771; config proj_n_bf=1/img_n_bf=6/img_kernel=9/img_sr=0.05/img_sxy=0.5/ep10): (1) PRIOR: img spatial sigma 0.5->2.0 (iter-10) REGRESSED to 0.2468 (-0.030) -> revert img_sx/sy=0.5 (already optimal). proj_n_bf 1->3 (iter-9) regressed. proj_sr FIXED at 1.5 since iter-1 -- the PAPER'S KEY noise-adaptive lever, UNTESTED on breast. (2) FAILURE MODE: proj-domain range sigma on the sqrt-count sinogram (proj_sr=1.5) may be mistuned -- breast N0=1e5 so Q=sqrt(N0*exp(-P)) spans large values, and range sigma 1.5 sqrt-counts may UNDER-smooth sinogram noise (paper range 0.7-2.8; wider = more noise-adaptive averaging). A better proj_sr suppresses sinogram noise pre-FBP without the over-smoothing that a deeper cascade caused. (3) ONE KNOB: proj_sr 1.5 -> 2.5 (widen proj-domain noise-adaptive range bandwidth toward paper upper bound; img spatial sigma reverted to 0.5). (4) HYPOTHESIS: proj_sr 1.5->2.5 lifts hr above 0.2771 because a wider range sigma on the variance-stabilized sqrt-count sinogram averages more signal-dependent noise (edge-preserving via the range gate), reducing streak-generating inconsistencies before FBP -- the paper's intended mechanism. FALSIFIER: if flat (as on Mayo), proj-domain range inert on this substrate -> proj-domain exhausted, iter-12 consolidates best config / tests lr. (5) BUDGET: proj_n_bf=1 single pass, same cost as iter-8 ~500s, under 20-min. (6) Loop continues; iter-12 on landing. turbo, save ckpt+recon, params_M logged.", "agent": "manduca_bilateral-claude-agentic", "campaign": "search-20260703-01", "cfg_full": {"batch_size": 1, "bf_d_w_ratio": 0.16666666666666666, "epochs": 10, "grad_clip": 1.0, "img_kernel": 9, "img_n_bf": 6, "img_sr": 0.05, "img_sx": 0.5, "img_sy": 0.5, "lambda_neg": 1.0, "lr": 0.005, "manduca_N0": 100000.0, "manduca_bowtie": false, "optimizer": "adam", "proj_kernel": 5, "proj_n_bf": 1, "proj_sr": 2.5, "proj_w": 5, "rationale": "iter-11 manduca_bilateral breast (train_n=400, val=200). SIX-BOX from BEST (iter-8 hr=0.2771; config proj_n_bf=1/img_n_bf=6/img_kernel=9/img_sr=0.05/img_sxy=0.5/ep10): (1) PRIOR: img spatial sigma 0.5->2.0 (iter-10) REGRESSED to 0.2468 (-0.030) -> revert img_sx/sy=0.5 (already optimal). proj_n_bf 1->3 (iter-9) regressed. proj_sr FIXED at 1.5 since iter-1 -- the PAPER'S KEY noise-adaptive lever, UNTESTED on breast. (2) FAILURE MODE: proj-domain range sigma on the sqrt-count sinogram (proj_sr=1.5) may be mistuned -- breast N0=1e5 so Q=sqrt(N0*exp(-P)) spans large values, and range sigma 1.5 sqrt-counts may UNDER-smooth sinogram noise (paper range 0.7-2.8; wider = more noise-adaptive averaging). A better proj_sr suppresses sinogram noise pre-FBP without the over-smoothing that a deeper cascade caused. (3) ONE KNOB: proj_sr 1.5 -> 2.5 (widen proj-domain noise-adaptive range bandwidth toward paper upper bound; img spatial sigma reverted to 0.5). (4) HYPOTHESIS: proj_sr 1.5->2.5 lifts hr above 0.2771 because a wider range sigma on the variance-stabilized sqrt-count sinogram averages more signal-dependent noise (edge-preserving via the range gate), reducing streak-generating inconsistencies before FBP -- the paper's intended mechanism. FALSIFIER: if flat (as on Mayo), proj-domain range inert on this substrate -> proj-domain exhausted, iter-12 consolidates best config / tests lr. (5) BUDGET: proj_n_bf=1 single pass, same cost as iter-8 ~500s, under 20-min. (6) Loop continues; iter-12 on landing. turbo, save ckpt+recon, params_M logged.", "seed": 42, "train_n": 400, "val_chunk": 10, "val_n": 200}, "challenge": "breast_ct", "change_class": "architecture", "git_commit": "671da566", "images": {"comparison": "runs/breast-ct-claude-agentic-manduca-bilateral-search-20260703-01/iterations/iter-0011/comparison.png", "test_showcase": null, "valtest_showcase": null}, "iter": 11, "kept": true, "metrics": {"headroom": 0.2770939797843982, "headroom_std": 0.00938070657253447, "val_psnr": 39.14255905151367, "val_psnr_std": 0.5639175699009383, "val_rmse": 0.0037694370839744806, "val_rmse_std": 0.00023821540454246965, "val_ssim": 0.9814375042915344, "val_ssim_std": 0.0033378581614807003}, "model": "claude-opus-4-8-1m", "obs_path": "breast-ct-claude-agentic-manduca-bilateral-search-20260703-01/iterations/iter-0011/observation.json", "obs_sha1": "c4cf3a18593580de651dcaf21d21bb0f956cb100", "params_M": 2.2e-05, "params_source": "observation", "rationale": "manduca_bilateral-claude-agentic: proj_n_bf=1, proj_sr=2.5, proj_w=5, proj_kernel=5, bf_d_w_ratio=0.16666666666666666, manduca_N0=100000.0, manduca_bowtie=False, img_n_bf=6, img_kernel=9, img_sx=0.5, img_sy=0.5, img_sr=0.05, epochs=10, batch_size=1, lr=0.005, optimizer=adam, lambda_neg=1.0, grad_clip=1.0, train_n=400, val_n=200, val_chunk=10, seed=42, rationale=iter-11 manduca_bilateral breast (train_n=400, val=200). SIX-BOX from BEST (iter-8 hr=0.2771; config proj_n_bf=1/img_n_bf=6/img_kernel=9/img_sr=0.05/img_sxy=0.5/ep10): (1) PRIOR: img spatial sigma 0.5->2.0 (iter-10) REGRESSED to 0.2468 (-0.030) -> revert img_sx/sy=0.5 (already optimal). proj_n_bf 1->3 (iter-9) regressed. proj_sr FIXED at 1.5 since iter-1 -- the PAPER'S KEY noise-adaptive lever, UNTESTED on breast. (2) FAILURE MODE: proj-domain range sigma on the sqrt-count sinogram (proj_sr=1.5) may be mistuned -- breast N0=1e5 so Q=sqrt(N0*exp(-P)) spans large values, and range sigma 1.5 sqrt-counts may UNDER-smooth sinogram noise (paper range 0.7-2.8; wider = more noise-adaptive averaging). A better proj_sr suppresses sinogram noise pre-FBP without the over-smoothing that a deeper cascade caused. (3) ONE KNOB: proj_sr 1.5 -> 2.5 (widen proj-domain noise-adaptive range bandwidth toward paper upper bound; img spatial sigma reverted to 0.5). (4) HYPOTHESIS: proj_sr 1.5->2.5 lifts hr above 0.2771 because a wider range sigma on the variance-stabilized sqrt-count sinogram averages more signal-dependent noise (edge-preserving via the range gate), reducing streak-generating inconsistencies before FBP -- the paper's intended mechanism. FALSIFIER: if flat (as on Mayo), proj-domain range inert on this substrate -> proj-domain exhausted, iter-12 consolidates best config / tests lr. (5) BUDGET: proj_n_bf=1 single pass, same cost as iter-8 ~500s, under 20-min. (6) Loop continues; iter-12 on landing. turbo, save ckpt+recon, params_M logged.", "run_id": "breast-ct-claude-agentic-manduca-bilateral-search-20260703-01", "runtime": {"elapsed_s": 491.0428433418274}, "schema_version": 3, "solver_key": "manduca-bilateral", "solver_name": "Manduca proj-bilateral (trainable)", "split": {"train_n": 400, "val_n": 200}, "status": "keep", "ts": "2026-07-05T06:18:57Z"}
{"advice_for_others": "manduca_bilateral-claude-agentic: proj_n_bf=1, proj_sr=1.5, proj_w=5, proj_kernel=5, bf_d_w_ratio=0.16666666666666666, manduca_N0=100000.0, manduca_bowtie=False, img_n_bf=6, img_kernel=9, img_sx=0.5, img_sy=0.5, img_sr=0.05, epochs=10, batch_size=1, lr=0.001, optimizer=adam, lambda_neg=1.0, grad_clip=1.0, train_n=400, val_n=200, val_chunk=10, seed=42, rationale=iter-12 manduca_bilateral breast (train_n=400, val=200). SIX-BOX from BEST (iter-8 hr=0.2771, reproduced iter-11): (1) PRIOR: best hr=0.2771 (iter-8, also iter-11 proj_sr=2.5 FLAT -> proj-domain range INERT, matches Mayo; proj_n_bf 1->3 worse). Image tail fully mapped: img_sr peak 0.05, img_n_bf sat@6, img_kernel best 9, img spatial sigma 0.5 optimal (2.0 worse), epochs inert. Only lr (=5e-3 throughout) UNTESTED. (2) FAILURE MODE: supervised MSE may converge to a shallow local optimum of the 21 bilateral sigmas at lr=5e-3 (epochs-inert => settles fast, possibly prematurely); a lower lr could descend into a better basin. (3) ONE KNOB: lr 5e-3 -> 1e-3 (from iter-8 best config; 5x lower; ep=10 kept). (4) HYPOTHESIS: lr 5e-3->1e-3 lifts hr above 0.2771 because a gentler step lets the bilateral sigmas converge more precisely to a better denoising point rather than overshooting into the fast shallow basin at 5e-3. FALSIFIER: if flat/drops, the sigma optimum is lr-insensitive and the architecture is at its ceiling ~0.277 -> remaining iters consolidate/confirm best config. (5) BUDGET: ep10 base ~500s, under 20-min. (6) Loop continues; iter-13 on landing. turbo, save ckpt+recon, params_M logged.", "agent": "manduca_bilateral-claude-agentic", "campaign": "search-20260703-01", "cfg_full": {"batch_size": 1, "bf_d_w_ratio": 0.16666666666666666, "epochs": 10, "grad_clip": 1.0, "img_kernel": 9, "img_n_bf": 6, "img_sr": 0.05, "img_sx": 0.5, "img_sy": 0.5, "lambda_neg": 1.0, "lr": 0.001, "manduca_N0": 100000.0, "manduca_bowtie": false, "optimizer": "adam", "proj_kernel": 5, "proj_n_bf": 1, "proj_sr": 1.5, "proj_w": 5, "rationale": "iter-12 manduca_bilateral breast (train_n=400, val=200). SIX-BOX from BEST (iter-8 hr=0.2771, reproduced iter-11): (1) PRIOR: best hr=0.2771 (iter-8, also iter-11 proj_sr=2.5 FLAT -> proj-domain range INERT, matches Mayo; proj_n_bf 1->3 worse). Image tail fully mapped: img_sr peak 0.05, img_n_bf sat@6, img_kernel best 9, img spatial sigma 0.5 optimal (2.0 worse), epochs inert. Only lr (=5e-3 throughout) UNTESTED. (2) FAILURE MODE: supervised MSE may converge to a shallow local optimum of the 21 bilateral sigmas at lr=5e-3 (epochs-inert => settles fast, possibly prematurely); a lower lr could descend into a better basin. (3) ONE KNOB: lr 5e-3 -> 1e-3 (from iter-8 best config; 5x lower; ep=10 kept). (4) HYPOTHESIS: lr 5e-3->1e-3 lifts hr above 0.2771 because a gentler step lets the bilateral sigmas converge more precisely to a better denoising point rather than overshooting into the fast shallow basin at 5e-3. FALSIFIER: if flat/drops, the sigma optimum is lr-insensitive and the architecture is at its ceiling ~0.277 -> remaining iters consolidate/confirm best config. (5) BUDGET: ep10 base ~500s, under 20-min. (6) Loop continues; iter-13 on landing. turbo, save ckpt+recon, params_M logged.", "seed": 42, "train_n": 400, "val_chunk": 10, "val_n": 200}, "challenge": "breast_ct", "change_class": "architecture", "git_commit": "671da566", "images": {"comparison": "runs/breast-ct-claude-agentic-manduca-bilateral-search-20260703-01/iterations/iter-0012/comparison.png", "test_showcase": null, "valtest_showcase": null}, "iter": 12, "kept": true, "metrics": {"headroom": 0.2353254794402616, "headroom_std": 0.007199437384974678, "val_psnr": 38.6546630859375, "val_psnr_std": 0.5875808529458312, "val_rmse": 0.003987229894846678, "val_rmse_std": 0.00026274164133260105, "val_ssim": 0.9734212756156921, "val_ssim_std": 0.00437886977884806}, "model": "claude-opus-4-8-1m", "obs_path": "breast-ct-claude-agentic-manduca-bilateral-search-20260703-01/iterations/iter-0012/observation.json", "obs_sha1": "e46a64beeacb796ccd2a9b7a3e689e16d9f2e4ea", "params_M": 2.2e-05, "params_source": "observation", "rationale": "manduca_bilateral-claude-agentic: proj_n_bf=1, proj_sr=1.5, proj_w=5, proj_kernel=5, bf_d_w_ratio=0.16666666666666666, manduca_N0=100000.0, manduca_bowtie=False, img_n_bf=6, img_kernel=9, img_sx=0.5, img_sy=0.5, img_sr=0.05, epochs=10, batch_size=1, lr=0.001, optimizer=adam, lambda_neg=1.0, grad_clip=1.0, train_n=400, val_n=200, val_chunk=10, seed=42, rationale=iter-12 manduca_bilateral breast (train_n=400, val=200). SIX-BOX from BEST (iter-8 hr=0.2771, reproduced iter-11): (1) PRIOR: best hr=0.2771 (iter-8, also iter-11 proj_sr=2.5 FLAT -> proj-domain range INERT, matches Mayo; proj_n_bf 1->3 worse). Image tail fully mapped: img_sr peak 0.05, img_n_bf sat@6, img_kernel best 9, img spatial sigma 0.5 optimal (2.0 worse), epochs inert. Only lr (=5e-3 throughout) UNTESTED. (2) FAILURE MODE: supervised MSE may converge to a shallow local optimum of the 21 bilateral sigmas at lr=5e-3 (epochs-inert => settles fast, possibly prematurely); a lower lr could descend into a better basin. (3) ONE KNOB: lr 5e-3 -> 1e-3 (from iter-8 best config; 5x lower; ep=10 kept). (4) HYPOTHESIS: lr 5e-3->1e-3 lifts hr above 0.2771 because a gentler step lets the bilateral sigmas converge more precisely to a better denoising point rather than overshooting into the fast shallow basin at 5e-3. FALSIFIER: if flat/drops, the sigma optimum is lr-insensitive and the architecture is at its ceiling ~0.277 -> remaining iters consolidate/confirm best config. (5) BUDGET: ep10 base ~500s, under 20-min. (6) Loop continues; iter-13 on landing. turbo, save ckpt+recon, params_M logged.", "run_id": "breast-ct-claude-agentic-manduca-bilateral-search-20260703-01", "runtime": {"elapsed_s": 492.37214183807373}, "schema_version": 3, "solver_key": "manduca-bilateral", "solver_name": "Manduca proj-bilateral (trainable)", "split": {"train_n": 400, "val_n": 200}, "status": "keep", "ts": "2026-07-05T07:18:55Z"}
