{"advice_for_others": "param_efficient-claude-agentic: reg_type=bilateral, bilateral_on_top=False, proj_filter_on=False, n_iter=30, learnable_alpha=True, alpha_init=0.1, foe_n_filters=24, foe_kernel=7, foe_n_bumps=31, n_bf=1, bf_multiscale=True, bf_sigmas=[0.8, 1.6, 3.2], bf_kernel=7, bf_sigma_r=0.02, bf_gain_init=0.0, epochs=16, cosine_lr=True, lr=0.005, max_train_s=1080, batch_size=4, train_n=200, val_n=200, display_min=0.0, display_max=0.05, seed=44, rationale=iter-19 param_efficient breast -- SEED REPLICATE 2/4 of the CHAMPION (LPD-combine W=4, filtered-DC K=30, 183 params). SIX-BOX: (1) PRIOR: architecture search COMPLETE; champion = iter-15 (seed 42) hr 0.5047 @ 183p. Adjoint/config capped ~0.26; filtered-DC broke it (0.4345 @ 13p); prox capacity fought it (0.0); LPD learned-combination WON (0.5047); W=8 and sinogram-dual both regressed -> W=4 primal-only is the optimum. (2) FAILURE MODE: single-seed hr is noise-confounded (breast seed variance is large, ~+-0.05 per the DL-tier solvers) -- need mean+-std. (3) ONE KNOB: seed 42 -> 44 (replicate 2/4). ALL else byte-for-byte the champion. (4) HYPOTHESIS: hr lands near 0.5047 +- seed noise; the 5-seed (42-46) mean+-std is the REPORTED headline number @ 183 params. (5) BUDGET: identical to iter-15 (16ep in ~1020s), max_train_s=1080, --time=00:30:00, 200-val -> 20-min comparable. (6) SERIAL; next replicate self-dispatches; recon_raw.npz (pred/truth/baseline) saved to the iter dir for test-scorability., dc_mode=filtered, per_step_alpha=True, lpd_on=True, lpd_width=4, lpd_kernel=3, anisotropic_on_top=False", "agent": "param_efficient-claude-agentic", "campaign": "search-20260703-01", "cfg_full": {"alpha_init": 0.1, "anisotropic_on_top": false, "batch_size": 4, "bf_gain_init": 0.0, "bf_kernel": 7, "bf_multiscale": true, "bf_sigma_r": 0.02, "bf_sigmas": [0.8, 1.6, 3.2], "bilateral_on_top": false, "cosine_lr": true, "dc_mode": "filtered", "display_max": 0.05, "display_min": 0.0, "epochs": 16, "foe_kernel": 7, "foe_n_bumps": 31, "foe_n_filters": 24, "learnable_alpha": true, "lpd_kernel": 3, "lpd_on": true, "lpd_width": 4, "lr": 0.005, "max_train_s": 1080, "n_bf": 1, "n_iter": 30, "per_step_alpha": true, "proj_filter_on": false, "rationale": "iter-19 param_efficient breast -- SEED REPLICATE 2/4 of the CHAMPION (LPD-combine W=4, filtered-DC K=30, 183 params). SIX-BOX: (1) PRIOR: architecture search COMPLETE; champion = iter-15 (seed 42) hr 0.5047 @ 183p. Adjoint/config capped ~0.26; filtered-DC broke it (0.4345 @ 13p); prox capacity fought it (0.0); LPD learned-combination WON (0.5047); W=8 and sinogram-dual both regressed -> W=4 primal-only is the optimum. (2) FAILURE MODE: single-seed hr is noise-confounded (breast seed variance is large, ~+-0.05 per the DL-tier solvers) -- need mean+-std. (3) ONE KNOB: seed 42 -> 44 (replicate 2/4). ALL else byte-for-byte the champion. (4) HYPOTHESIS: hr lands near 0.5047 +- seed noise; the 5-seed (42-46) mean+-std is the REPORTED headline number @ 183 params. (5) BUDGET: identical to iter-15 (16ep in ~1020s), max_train_s=1080, --time=00:30:00, 200-val -> 20-min comparable. (6) SERIAL; next replicate self-dispatches; recon_raw.npz (pred/truth/baseline) saved to the iter dir for test-scorability.", "reg_type": "bilateral", "seed": 44, "train_n": 200, "val_n": 200}, "challenge": "breast_ct", "change_class": "architecture", "git_commit": "671da566", "images": {"comparison": "runs/breast-ct-claude-agentic-param-efficient-search-20260703-01/iterations/iter-0019/comparison.png", "test_showcase": null, "valtest_showcase": null}, "iter": 19, "kept": true, "metrics": {"headroom": 0.4626517369051498, "headroom_std": 0.010824468836342799, "val_psnr": 41.719078063964844, "val_psnr_std": 0.45507470332584127, "val_rmse": 0.0028018862940371037, "val_rmse_std": 0.0001422177122079772, "val_ssim": 0.9755021929740906, "val_ssim_std": 0.002565347339384528}, "model": "claude-opus-4-8-1m", "obs_path": "breast-ct-claude-agentic-param-efficient-search-20260703-01/iterations/iter-0019/observation.json", "obs_sha1": "c255059825666268672ae7b5f56a2bc65ec4c846", "params_M": 0.000183, "params_source": "observation", "rationale": "param_efficient-claude-agentic: reg_type=bilateral, bilateral_on_top=False, proj_filter_on=False, n_iter=30, learnable_alpha=True, alpha_init=0.1, foe_n_filters=24, foe_kernel=7, foe_n_bumps=31, n_bf=1, bf_multiscale=True, bf_sigmas=[0.8, 1.6, 3.2], bf_kernel=7, bf_sigma_r=0.02, bf_gain_init=0.0, epochs=16, cosine_lr=True, lr=0.005, max_train_s=1080, batch_size=4, train_n=200, val_n=200, display_min=0.0, display_max=0.05, seed=44, rationale=iter-19 param_efficient breast -- SEED REPLICATE 2/4 of the CHAMPION (LPD-combine W=4, filtered-DC K=30, 183 params). SIX-BOX: (1) PRIOR: architecture search COMPLETE; champion = iter-15 (seed 42) hr 0.5047 @ 183p. Adjoint/config capped ~0.26; filtered-DC broke it (0.4345 @ 13p); prox capacity fought it (0.0); LPD learned-combination WON (0.5047); W=8 and sinogram-dual both regressed -> W=4 primal-only is the optimum. (2) FAILURE MODE: single-seed hr is noise-confounded (breast seed variance is large, ~+-0.05 per the DL-tier solvers) -- need mean+-std. (3) ONE KNOB: seed 42 -> 44 (replicate 2/4). ALL else byte-for-byte the champion. (4) HYPOTHESIS: hr lands near 0.5047 +- seed noise; the 5-seed (42-46) mean+-std is the REPORTED headline number @ 183 params. (5) BUDGET: identical to iter-15 (16ep in ~1020s), max_train_s=1080, --time=00:30:00, 200-val -> 20-min comparable. (6) SERIAL; next replicate self-dispatches; recon_raw.npz (pred/truth/baseline) saved to the iter dir for test-scorability., dc_mode=filtered, per_step_alpha=True, lpd_on=True, lpd_width=4, lpd_kernel=3, anisotropic_on_top=False", "run_id": "breast-ct-claude-agentic-param-efficient-search-20260703-01", "runtime": {"elapsed_s": 1131.4009230136871}, "schema_version": 3, "solver_key": "param-efficient", "solver_name": "Param-efficient (evolved)", "split": {"train_n": 200, "val_n": 200}, "status": "keep", "ts": "2026-07-07T09:50:20Z"}
{"advice_for_others": "param_efficient-claude-agentic: reg_type=bilateral, bilateral_on_top=False, proj_filter_on=False, n_iter=30, learnable_alpha=True, alpha_init=0.1, foe_n_filters=24, foe_kernel=7, foe_n_bumps=31, n_bf=1, bf_multiscale=True, bf_sigmas=[0.8, 1.6, 3.2], bf_kernel=7, bf_sigma_r=0.02, bf_gain_init=0.0, epochs=16, cosine_lr=True, lr=0.005, max_train_s=1080, batch_size=4, train_n=200, val_n=200, display_min=0.0, display_max=0.05, seed=45, rationale=iter-20 param_efficient breast -- SEED REPLICATE 3/4 of the CHAMPION (LPD-combine W=4, filtered-DC K=30, 183 params). SIX-BOX: (1) PRIOR: architecture search COMPLETE; champion = iter-15 (seed 42) hr 0.5047 @ 183p. Adjoint/config capped ~0.26; filtered-DC broke it (0.4345 @ 13p); prox capacity fought it (0.0); LPD learned-combination WON (0.5047); W=8 and sinogram-dual both regressed -> W=4 primal-only is the optimum. (2) FAILURE MODE: single-seed hr is noise-confounded (breast seed variance is large, ~+-0.05 per the DL-tier solvers) -- need mean+-std. (3) ONE KNOB: seed 42 -> 45 (replicate 3/4). ALL else byte-for-byte the champion. (4) HYPOTHESIS: hr lands near 0.5047 +- seed noise; the 5-seed (42-46) mean+-std is the REPORTED headline number @ 183 params. (5) BUDGET: identical to iter-15 (16ep in ~1020s), max_train_s=1080, --time=00:30:00, 200-val -> 20-min comparable. (6) SERIAL; next replicate self-dispatches; recon_raw.npz (pred/truth/baseline) saved to the iter dir for test-scorability., dc_mode=filtered, per_step_alpha=True, lpd_on=True, lpd_width=4, lpd_kernel=3, anisotropic_on_top=False", "agent": "param_efficient-claude-agentic", "campaign": "search-20260703-01", "cfg_full": {"alpha_init": 0.1, "anisotropic_on_top": false, "batch_size": 4, "bf_gain_init": 0.0, "bf_kernel": 7, "bf_multiscale": true, "bf_sigma_r": 0.02, "bf_sigmas": [0.8, 1.6, 3.2], "bilateral_on_top": false, "cosine_lr": true, "dc_mode": "filtered", "display_max": 0.05, "display_min": 0.0, "epochs": 16, "foe_kernel": 7, "foe_n_bumps": 31, "foe_n_filters": 24, "learnable_alpha": true, "lpd_kernel": 3, "lpd_on": true, "lpd_width": 4, "lr": 0.005, "max_train_s": 1080, "n_bf": 1, "n_iter": 30, "per_step_alpha": true, "proj_filter_on": false, "rationale": "iter-20 param_efficient breast -- SEED REPLICATE 3/4 of the CHAMPION (LPD-combine W=4, filtered-DC K=30, 183 params). SIX-BOX: (1) PRIOR: architecture search COMPLETE; champion = iter-15 (seed 42) hr 0.5047 @ 183p. Adjoint/config capped ~0.26; filtered-DC broke it (0.4345 @ 13p); prox capacity fought it (0.0); LPD learned-combination WON (0.5047); W=8 and sinogram-dual both regressed -> W=4 primal-only is the optimum. (2) FAILURE MODE: single-seed hr is noise-confounded (breast seed variance is large, ~+-0.05 per the DL-tier solvers) -- need mean+-std. (3) ONE KNOB: seed 42 -> 45 (replicate 3/4). ALL else byte-for-byte the champion. (4) HYPOTHESIS: hr lands near 0.5047 +- seed noise; the 5-seed (42-46) mean+-std is the REPORTED headline number @ 183 params. (5) BUDGET: identical to iter-15 (16ep in ~1020s), max_train_s=1080, --time=00:30:00, 200-val -> 20-min comparable. (6) SERIAL; next replicate self-dispatches; recon_raw.npz (pred/truth/baseline) saved to the iter dir for test-scorability.", "reg_type": "bilateral", "seed": 45, "train_n": 200, "val_n": 200}, "challenge": "breast_ct", "change_class": "architecture", "git_commit": "671da566", "images": {"comparison": "runs/breast-ct-claude-agentic-param-efficient-search-20260703-01/iterations/iter-0020/comparison.png", "test_showcase": null, "valtest_showcase": null}, "iter": 20, "kept": true, "metrics": {"headroom": 0.42362708615220657, "headroom_std": 0.017479370252918538, "val_psnr": 41.11012268066406, "val_psnr_std": 0.36488158218184963, "val_rmse": 0.003005371894687414, "val_rmse_std": 0.00011894847633515242, "val_ssim": 0.968178391456604, "val_ssim_std": 0.0020914277789088613}, "model": "claude-opus-4-8-1m", "obs_path": "breast-ct-claude-agentic-param-efficient-search-20260703-01/iterations/iter-0020/observation.json", "obs_sha1": "a2fee689fa909425a2ab599a4bb745068d4e572c", "params_M": 0.000183, "params_source": "observation", "rationale": "param_efficient-claude-agentic: reg_type=bilateral, bilateral_on_top=False, proj_filter_on=False, n_iter=30, learnable_alpha=True, alpha_init=0.1, foe_n_filters=24, foe_kernel=7, foe_n_bumps=31, n_bf=1, bf_multiscale=True, bf_sigmas=[0.8, 1.6, 3.2], bf_kernel=7, bf_sigma_r=0.02, bf_gain_init=0.0, epochs=16, cosine_lr=True, lr=0.005, max_train_s=1080, batch_size=4, train_n=200, val_n=200, display_min=0.0, display_max=0.05, seed=45, rationale=iter-20 param_efficient breast -- SEED REPLICATE 3/4 of the CHAMPION (LPD-combine W=4, filtered-DC K=30, 183 params). SIX-BOX: (1) PRIOR: architecture search COMPLETE; champion = iter-15 (seed 42) hr 0.5047 @ 183p. Adjoint/config capped ~0.26; filtered-DC broke it (0.4345 @ 13p); prox capacity fought it (0.0); LPD learned-combination WON (0.5047); W=8 and sinogram-dual both regressed -> W=4 primal-only is the optimum. (2) FAILURE MODE: single-seed hr is noise-confounded (breast seed variance is large, ~+-0.05 per the DL-tier solvers) -- need mean+-std. (3) ONE KNOB: seed 42 -> 45 (replicate 3/4). ALL else byte-for-byte the champion. (4) HYPOTHESIS: hr lands near 0.5047 +- seed noise; the 5-seed (42-46) mean+-std is the REPORTED headline number @ 183 params. (5) BUDGET: identical to iter-15 (16ep in ~1020s), max_train_s=1080, --time=00:30:00, 200-val -> 20-min comparable. (6) SERIAL; next replicate self-dispatches; recon_raw.npz (pred/truth/baseline) saved to the iter dir for test-scorability., dc_mode=filtered, per_step_alpha=True, lpd_on=True, lpd_width=4, lpd_kernel=3, anisotropic_on_top=False", "run_id": "breast-ct-claude-agentic-param-efficient-search-20260703-01", "runtime": {"elapsed_s": 1137.8300485610962}, "schema_version": 3, "solver_key": "param-efficient", "solver_name": "Param-efficient (evolved)", "split": {"train_n": 200, "val_n": 200}, "status": "keep", "ts": "2026-07-07T11:22:45Z"}
{"advice_for_others": "param_efficient-claude-agentic: reg_type=bilateral, bilateral_on_top=False, proj_filter_on=False, n_iter=30, learnable_alpha=True, alpha_init=0.1, foe_n_filters=24, foe_kernel=7, foe_n_bumps=31, n_bf=1, bf_multiscale=True, bf_sigmas=[0.8, 1.6, 3.2], bf_kernel=7, bf_sigma_r=0.02, bf_gain_init=0.0, epochs=16, cosine_lr=True, lr=0.005, max_train_s=1080, batch_size=4, train_n=200, val_n=200, display_min=0.0, display_max=0.05, seed=46, rationale=iter-21 param_efficient breast -- SEED REPLICATE 4/4 of the CHAMPION (LPD-combine W=4, filtered-DC K=30, 183 params). SIX-BOX: (1) PRIOR: architecture search COMPLETE; champion = iter-15 (seed 42) hr 0.5047 @ 183p. Adjoint/config capped ~0.26; filtered-DC broke it (0.4345 @ 13p); prox capacity fought it (0.0); LPD learned-combination WON (0.5047); W=8 and sinogram-dual both regressed -> W=4 primal-only is the optimum. (2) FAILURE MODE: single-seed hr is noise-confounded (breast seed variance is large, ~+-0.05 per the DL-tier solvers) -- need mean+-std. (3) ONE KNOB: seed 42 -> 46 (replicate 4/4). ALL else byte-for-byte the champion. (4) HYPOTHESIS: hr lands near 0.5047 +- seed noise; the 5-seed (42-46) mean+-std is the REPORTED headline number @ 183 params. (5) BUDGET: identical to iter-15 (16ep in ~1020s), max_train_s=1080, --time=00:30:00, 200-val -> 20-min comparable. (6) SERIAL; next replicate self-dispatches; recon_raw.npz (pred/truth/baseline) saved to the iter dir for test-scorability., dc_mode=filtered, per_step_alpha=True, lpd_on=True, lpd_width=4, lpd_kernel=3, anisotropic_on_top=False", "agent": "param_efficient-claude-agentic", "campaign": "search-20260703-01", "cfg_full": {"alpha_init": 0.1, "anisotropic_on_top": false, "batch_size": 4, "bf_gain_init": 0.0, "bf_kernel": 7, "bf_multiscale": true, "bf_sigma_r": 0.02, "bf_sigmas": [0.8, 1.6, 3.2], "bilateral_on_top": false, "cosine_lr": true, "dc_mode": "filtered", "display_max": 0.05, "display_min": 0.0, "epochs": 16, "foe_kernel": 7, "foe_n_bumps": 31, "foe_n_filters": 24, "learnable_alpha": true, "lpd_kernel": 3, "lpd_on": true, "lpd_width": 4, "lr": 0.005, "max_train_s": 1080, "n_bf": 1, "n_iter": 30, "per_step_alpha": true, "proj_filter_on": false, "rationale": "iter-21 param_efficient breast -- SEED REPLICATE 4/4 of the CHAMPION (LPD-combine W=4, filtered-DC K=30, 183 params). SIX-BOX: (1) PRIOR: architecture search COMPLETE; champion = iter-15 (seed 42) hr 0.5047 @ 183p. Adjoint/config capped ~0.26; filtered-DC broke it (0.4345 @ 13p); prox capacity fought it (0.0); LPD learned-combination WON (0.5047); W=8 and sinogram-dual both regressed -> W=4 primal-only is the optimum. (2) FAILURE MODE: single-seed hr is noise-confounded (breast seed variance is large, ~+-0.05 per the DL-tier solvers) -- need mean+-std. (3) ONE KNOB: seed 42 -> 46 (replicate 4/4). ALL else byte-for-byte the champion. (4) HYPOTHESIS: hr lands near 0.5047 +- seed noise; the 5-seed (42-46) mean+-std is the REPORTED headline number @ 183 params. (5) BUDGET: identical to iter-15 (16ep in ~1020s), max_train_s=1080, --time=00:30:00, 200-val -> 20-min comparable. (6) SERIAL; next replicate self-dispatches; recon_raw.npz (pred/truth/baseline) saved to the iter dir for test-scorability.", "reg_type": "bilateral", "seed": 46, "train_n": 200, "val_n": 200}, "challenge": "breast_ct", "change_class": "architecture", "git_commit": "671da566", "images": {"comparison": "runs/breast-ct-claude-agentic-param-efficient-search-20260703-01/iterations/iter-0021/comparison.png", "test_showcase": null, "valtest_showcase": null}, "iter": 21, "kept": true, "metrics": {"headroom": 0.449706226938674, "headroom_std": 0.013081059718864481, "val_psnr": 41.51230239868164, "val_psnr_std": 0.41530548170958637, "val_rmse": 0.0028693878557533026, "val_rmse_std": 0.00013207478695398606, "val_ssim": 0.9739974141120911, "val_ssim_std": 0.0023569694671034414}, "model": "claude-opus-4-8-1m", "obs_path": "breast-ct-claude-agentic-param-efficient-search-20260703-01/iterations/iter-0021/observation.json", "obs_sha1": "d03f65b869a2c0836b0d2b902a45f50b7fb8b1f0", "params_M": 0.000183, "params_source": "observation", "rationale": "param_efficient-claude-agentic: reg_type=bilateral, bilateral_on_top=False, proj_filter_on=False, n_iter=30, learnable_alpha=True, alpha_init=0.1, foe_n_filters=24, foe_kernel=7, foe_n_bumps=31, n_bf=1, bf_multiscale=True, bf_sigmas=[0.8, 1.6, 3.2], bf_kernel=7, bf_sigma_r=0.02, bf_gain_init=0.0, epochs=16, cosine_lr=True, lr=0.005, max_train_s=1080, batch_size=4, train_n=200, val_n=200, display_min=0.0, display_max=0.05, seed=46, rationale=iter-21 param_efficient breast -- SEED REPLICATE 4/4 of the CHAMPION (LPD-combine W=4, filtered-DC K=30, 183 params). SIX-BOX: (1) PRIOR: architecture search COMPLETE; champion = iter-15 (seed 42) hr 0.5047 @ 183p. Adjoint/config capped ~0.26; filtered-DC broke it (0.4345 @ 13p); prox capacity fought it (0.0); LPD learned-combination WON (0.5047); W=8 and sinogram-dual both regressed -> W=4 primal-only is the optimum. (2) FAILURE MODE: single-seed hr is noise-confounded (breast seed variance is large, ~+-0.05 per the DL-tier solvers) -- need mean+-std. (3) ONE KNOB: seed 42 -> 46 (replicate 4/4). ALL else byte-for-byte the champion. (4) HYPOTHESIS: hr lands near 0.5047 +- seed noise; the 5-seed (42-46) mean+-std is the REPORTED headline number @ 183 params. (5) BUDGET: identical to iter-15 (16ep in ~1020s), max_train_s=1080, --time=00:30:00, 200-val -> 20-min comparable. (6) SERIAL; next replicate self-dispatches; recon_raw.npz (pred/truth/baseline) saved to the iter dir for test-scorability., dc_mode=filtered, per_step_alpha=True, lpd_on=True, lpd_width=4, lpd_kernel=3, anisotropic_on_top=False", "run_id": "breast-ct-claude-agentic-param-efficient-search-20260703-01", "runtime": {"elapsed_s": 1147.2101292610168}, "schema_version": 3, "solver_key": "param-efficient", "solver_name": "Param-efficient (evolved)", "split": {"train_n": 200, "val_n": 200}, "status": "keep", "ts": "2026-07-07T11:42:20Z"}
