{"advice_for_others": "fastdiff_flow_pixel_unconstrained-claude-agentic: image_size=512, pixel_spacing=0.3516, n_angles=128, n_det=1024, det_spacing=0.35754, sod=500.0, sdd=1000.0, display_min=0.0, display_max=0.5, train_n=400, val_n=200, noise_i0=100000.0, noise_sigma_e=10.0, seed=42, fd_recon_ckpt=/cluster/maier/Agent4CT/checkpoints/fast_diffusion_pixel_breast.pt, fd_recon_steps=8, fd_recon_init=fbp, fd_recon_init_t=0.2, fd_recon_eta=0.1, fd_recon_dc=0, fd_recon_dc_n_cg=5, fd_recon_dc_relax=0.5, rationale=iter-11: DC-off breast-prior. Fine init_t sweep at low eta=0.1, steps=8. ONE KNOB init_t 0.25->0.2. PRIOR: iter-10 init_t0.25 PSNR29.20 (best) > iter-9 init_t0.3 PSNR28.98 - init_t peak still descending at low eta. HYPOTHESIS: init_t=0.2 continues toward the peak (at eta=0.1 the low-init_t degradation seen at eta=1.0/iter-3 does NOT apply since guidance is gentle); if PSNR turns down, peak is ~0.25. Completes the init_t fine-grid at the tuned operating point.", "agent": "fastdiff_flow_pixel_unconstrained-claude-agentic", "campaign": "search-20260703-01", "cfg_full": {"det_spacing": 0.35754, "display_max": 0.5, "display_min": 0.0, "fd_recon_ckpt": "/cluster/maier/Agent4CT/checkpoints/fast_diffusion_pixel_breast.pt", "fd_recon_dc": 0, "fd_recon_dc_n_cg": 5, "fd_recon_dc_relax": 0.5, "fd_recon_eta": 0.1, "fd_recon_init": "fbp", "fd_recon_init_t": 0.2, "fd_recon_steps": 8, "image_size": 512, "n_angles": 128, "n_det": 1024, "noise_i0": 100000.0, "noise_sigma_e": 10.0, "pixel_spacing": 0.3516, "rationale": "iter-11: DC-off breast-prior. Fine init_t sweep at low eta=0.1, steps=8. ONE KNOB init_t 0.25->0.2. PRIOR: iter-10 init_t0.25 PSNR29.20 (best) > iter-9 init_t0.3 PSNR28.98 - init_t peak still descending at low eta. HYPOTHESIS: init_t=0.2 continues toward the peak (at eta=0.1 the low-init_t degradation seen at eta=1.0/iter-3 does NOT apply since guidance is gentle); if PSNR turns down, peak is ~0.25. Completes the init_t fine-grid at the tuned operating point.", "sdd": 1000.0, "seed": 42, "sod": 500.0, "train_n": 400, "val_n": 200}, "challenge": "breast_ct", "change_class": "architecture", "git_commit": "671da566", "images": {"comparison": "runs/breast-ct-claude-agentic-fastdiff-flow-pixel-unconstrained-search-20260703-01/iterations/iter-0011/comparison.png", "test_showcase": null, "valtest_showcase": null}, "iter": 11, "kept": false, "metrics": {"headroom": 0.0, "headroom_std": 0.0, "val_psnr": 29.576740264892578, "val_psnr_std": 0.7062242386744998, "val_rmse": 0.011338810436427593, "val_rmse_std": 0.0008958789914988379, "val_ssim": 0.7665520906448364, "val_ssim_std": 0.009341712071913054}, "model": "claude-opus-4-8-1m", "obs_path": "breast-ct-claude-agentic-fastdiff-flow-pixel-unconstrained-search-20260703-01/iterations/iter-0011/observation.json", "obs_sha1": "fee81cd5c57302a1e95ad11465b598d6f400e349", "params_M": 3.822787, "params_source": "observation", "rationale": "fastdiff_flow_pixel_unconstrained-claude-agentic: image_size=512, pixel_spacing=0.3516, n_angles=128, n_det=1024, det_spacing=0.35754, sod=500.0, sdd=1000.0, display_min=0.0, display_max=0.5, train_n=400, val_n=200, noise_i0=100000.0, noise_sigma_e=10.0, seed=42, fd_recon_ckpt=/cluster/maier/Agent4CT/checkpoints/fast_diffusion_pixel_breast.pt, fd_recon_steps=8, fd_recon_init=fbp, fd_recon_init_t=0.2, fd_recon_eta=0.1, fd_recon_dc=0, fd_recon_dc_n_cg=5, fd_recon_dc_relax=0.5, rationale=iter-11: DC-off breast-prior. Fine init_t sweep at low eta=0.1, steps=8. ONE KNOB init_t 0.25->0.2. PRIOR: iter-10 init_t0.25 PSNR29.20 (best) > iter-9 init_t0.3 PSNR28.98 - init_t peak still descending at low eta. HYPOTHESIS: init_t=0.2 continues toward the peak (at eta=0.1 the low-init_t degradation seen at eta=1.0/iter-3 does NOT apply since guidance is gentle); if PSNR turns down, peak is ~0.25. Completes the init_t fine-grid at the tuned operating point.", "run_id": "breast-ct-claude-agentic-fastdiff-flow-pixel-unconstrained-search-20260703-01", "runtime": {"elapsed_s": 141.48940682411194}, "schema_version": 3, "solver_key": "fastdiff-flow-pixel-unconstrained", "solver_name": "Fast-diffusion flow (pixel, unconstrained)", "split": {"train_n": 3600, "val_n": 200}, "status": "discard", "ts": "2026-07-06T20:53:50Z"}
{"advice_for_others": "fastdiff_flow_pixel_unconstrained-claude-agentic: image_size=512, pixel_spacing=0.3516, n_angles=128, n_det=1024, det_spacing=0.35754, sod=500.0, sdd=1000.0, display_min=0.0, display_max=0.5, train_n=400, val_n=200, noise_i0=100000.0, noise_sigma_e=10.0, seed=42, fd_recon_ckpt=/cluster/maier/Agent4CT/checkpoints/fast_diffusion_pixel_breast.pt, fd_recon_steps=8, fd_recon_init=fbp, fd_recon_init_t=0.1, fd_recon_eta=0.1, fd_recon_dc=0, fd_recon_dc_n_cg=5, fd_recon_dc_relax=0.5, rationale=iter-12: DC-off breast-prior. Fine init_t sweep at low eta=0.1. ONE KNOB init_t 0.2->0.1. PRIOR (low-eta init_t): 0.3->28.98, 0.25->29.20, 0.2->29.58 - monotonically rising as init_t drops (at gentle eta the recon -> light prior-denoise of the FBP init). HYPOTHESIS: init_t=0.1 approaches pure minimal-noise prior-denoise of the FBP -> PSNR near its ceiling; if it saturates/turns, ~0.1-0.2 is the floor. Tests the extreme low-init_t end: as init_t->0 the sampler reduces to FBP passed through ~0 flow-time (identity-ish), so PSNR should approach but not exceed the FBP baseline (the prior can only lightly denoise, never add the missing sparse-view null-space info the DC step would).", "agent": "fastdiff_flow_pixel_unconstrained-claude-agentic", "campaign": "search-20260703-01", "cfg_full": {"det_spacing": 0.35754, "display_max": 0.5, "display_min": 0.0, "fd_recon_ckpt": "/cluster/maier/Agent4CT/checkpoints/fast_diffusion_pixel_breast.pt", "fd_recon_dc": 0, "fd_recon_dc_n_cg": 5, "fd_recon_dc_relax": 0.5, "fd_recon_eta": 0.1, "fd_recon_init": "fbp", "fd_recon_init_t": 0.1, "fd_recon_steps": 8, "image_size": 512, "n_angles": 128, "n_det": 1024, "noise_i0": 100000.0, "noise_sigma_e": 10.0, "pixel_spacing": 0.3516, "rationale": "iter-12: DC-off breast-prior. Fine init_t sweep at low eta=0.1. ONE KNOB init_t 0.2->0.1. PRIOR (low-eta init_t): 0.3->28.98, 0.25->29.20, 0.2->29.58 - monotonically rising as init_t drops (at gentle eta the recon -> light prior-denoise of the FBP init). HYPOTHESIS: init_t=0.1 approaches pure minimal-noise prior-denoise of the FBP -> PSNR near its ceiling; if it saturates/turns, ~0.1-0.2 is the floor. Tests the extreme low-init_t end: as init_t->0 the sampler reduces to FBP passed through ~0 flow-time (identity-ish), so PSNR should approach but not exceed the FBP baseline (the prior can only lightly denoise, never add the missing sparse-view null-space info the DC step would).", "sdd": 1000.0, "seed": 42, "sod": 500.0, "train_n": 400, "val_n": 200}, "challenge": "breast_ct", "change_class": "architecture", "git_commit": "671da566", "images": {"comparison": "runs/breast-ct-claude-agentic-fastdiff-flow-pixel-unconstrained-search-20260703-01/iterations/iter-0012/comparison.png", "test_showcase": null, "valtest_showcase": null}, "iter": 12, "kept": false, "metrics": {"headroom": 0.0, "headroom_std": 0.0, "val_psnr": 31.876598358154297, "val_psnr_std": 0.7031814921952307, "val_rmse": 0.008701109327375889, "val_rmse_std": 0.0006785895195209702, "val_ssim": 0.8241379261016846, "val_ssim_std": 0.010771374145207185}, "model": "claude-opus-4-8-1m", "obs_path": "breast-ct-claude-agentic-fastdiff-flow-pixel-unconstrained-search-20260703-01/iterations/iter-0012/observation.json", "obs_sha1": "6889cac8c91bc2e5bee0c4aa0e866a258a1e2eca", "params_M": 3.822787, "params_source": "observation", "rationale": "fastdiff_flow_pixel_unconstrained-claude-agentic: image_size=512, pixel_spacing=0.3516, n_angles=128, n_det=1024, det_spacing=0.35754, sod=500.0, sdd=1000.0, display_min=0.0, display_max=0.5, train_n=400, val_n=200, noise_i0=100000.0, noise_sigma_e=10.0, seed=42, fd_recon_ckpt=/cluster/maier/Agent4CT/checkpoints/fast_diffusion_pixel_breast.pt, fd_recon_steps=8, fd_recon_init=fbp, fd_recon_init_t=0.1, fd_recon_eta=0.1, fd_recon_dc=0, fd_recon_dc_n_cg=5, fd_recon_dc_relax=0.5, rationale=iter-12: DC-off breast-prior. Fine init_t sweep at low eta=0.1. ONE KNOB init_t 0.2->0.1. PRIOR (low-eta init_t): 0.3->28.98, 0.25->29.20, 0.2->29.58 - monotonically rising as init_t drops (at gentle eta the recon -> light prior-denoise of the FBP init). HYPOTHESIS: init_t=0.1 approaches pure minimal-noise prior-denoise of the FBP -> PSNR near its ceiling; if it saturates/turns, ~0.1-0.2 is the floor. Tests the extreme low-init_t end: as init_t->0 the sampler reduces to FBP passed through ~0 flow-time (identity-ish), so PSNR should approach but not exceed the FBP baseline (the prior can only lightly denoise, never add the missing sparse-view null-space info the DC step would).", "run_id": "breast-ct-claude-agentic-fastdiff-flow-pixel-unconstrained-search-20260703-01", "runtime": {"elapsed_s": 151.1279661655426}, "schema_version": 3, "solver_key": "fastdiff-flow-pixel-unconstrained", "solver_name": "Fast-diffusion flow (pixel, unconstrained)", "split": {"train_n": 3600, "val_n": 200}, "status": "discard", "ts": "2026-07-06T20:57:02Z"}
{"advice_for_others": "fastdiff_flow_pixel_unconstrained-claude-agentic: image_size=512, pixel_spacing=0.3516, n_angles=128, n_det=1024, det_spacing=0.35754, sod=500.0, sdd=1000.0, display_min=0.0, display_max=0.5, train_n=400, val_n=200, noise_i0=100000.0, noise_sigma_e=10.0, seed=42, fd_recon_ckpt=/cluster/maier/Agent4CT/checkpoints/fast_diffusion_pixel_breast.pt, fd_recon_steps=8, fd_recon_init=fbp, fd_recon_init_t=0.05, fd_recon_eta=0.1, fd_recon_dc=0, fd_recon_dc_n_cg=5, fd_recon_dc_relax=0.5, rationale=iter-13: DC-off breast-prior. ONE KNOB init_t 0.1->0.05. PRIOR (low-eta): init_t0.2->PSNR29.58, init_t0.1->PSNR31.88 (big jump). MECHANISM CONFIRMED: as init_t->0 the DC-off sampler converges to the FBP init (minimal generative perturbation) + light prior denoise => PSNR rises toward the FBP baseline (36.32). HYPOTHESIS: init_t=0.05 pushes PSNR further toward baseline (recon ~= lightly-denoised FBP). This is the KEY finding: the breast prior alone (no DC) can only APPROACH the FBP asymptotically by trusting it - it cannot EXCEED it, because without the CG data-consistency projection there is no mechanism to inject the missing sparse-view null-space information. hr stays 0 (RMSE never beats the FBP's 5.2e-3).", "agent": "fastdiff_flow_pixel_unconstrained-claude-agentic", "campaign": "search-20260703-01", "cfg_full": {"det_spacing": 0.35754, "display_max": 0.5, "display_min": 0.0, "fd_recon_ckpt": "/cluster/maier/Agent4CT/checkpoints/fast_diffusion_pixel_breast.pt", "fd_recon_dc": 0, "fd_recon_dc_n_cg": 5, "fd_recon_dc_relax": 0.5, "fd_recon_eta": 0.1, "fd_recon_init": "fbp", "fd_recon_init_t": 0.05, "fd_recon_steps": 8, "image_size": 512, "n_angles": 128, "n_det": 1024, "noise_i0": 100000.0, "noise_sigma_e": 10.0, "pixel_spacing": 0.3516, "rationale": "iter-13: DC-off breast-prior. ONE KNOB init_t 0.1->0.05. PRIOR (low-eta): init_t0.2->PSNR29.58, init_t0.1->PSNR31.88 (big jump). MECHANISM CONFIRMED: as init_t->0 the DC-off sampler converges to the FBP init (minimal generative perturbation) + light prior denoise => PSNR rises toward the FBP baseline (36.32). HYPOTHESIS: init_t=0.05 pushes PSNR further toward baseline (recon ~= lightly-denoised FBP). This is the KEY finding: the breast prior alone (no DC) can only APPROACH the FBP asymptotically by trusting it - it cannot EXCEED it, because without the CG data-consistency projection there is no mechanism to inject the missing sparse-view null-space information. hr stays 0 (RMSE never beats the FBP's 5.2e-3).", "sdd": 1000.0, "seed": 42, "sod": 500.0, "train_n": 400, "val_n": 200}, "challenge": "breast_ct", "change_class": "architecture", "git_commit": "671da566", "images": {"comparison": "runs/breast-ct-claude-agentic-fastdiff-flow-pixel-unconstrained-search-20260703-01/iterations/iter-0013/comparison.png", "test_showcase": null, "valtest_showcase": null}, "iter": 13, "kept": false, "metrics": {"headroom": 0.0, "headroom_std": 0.0007122271411563541, "val_psnr": 35.43415832519531, "val_psnr_std": 0.7887617419954203, "val_rmse": 0.0057769217528402805, "val_rmse_std": 0.0005035457448748328, "val_ssim": 0.9131503105163574, "val_ssim_std": 0.01004163253010605}, "model": "claude-opus-4-8-1m", "obs_path": "breast-ct-claude-agentic-fastdiff-flow-pixel-unconstrained-search-20260703-01/iterations/iter-0013/observation.json", "obs_sha1": "fa38cedb9c13e216cb2da89e3b77c02f5d252cd9", "params_M": 3.822787, "params_source": "observation", "rationale": "fastdiff_flow_pixel_unconstrained-claude-agentic: image_size=512, pixel_spacing=0.3516, n_angles=128, n_det=1024, det_spacing=0.35754, sod=500.0, sdd=1000.0, display_min=0.0, display_max=0.5, train_n=400, val_n=200, noise_i0=100000.0, noise_sigma_e=10.0, seed=42, fd_recon_ckpt=/cluster/maier/Agent4CT/checkpoints/fast_diffusion_pixel_breast.pt, fd_recon_steps=8, fd_recon_init=fbp, fd_recon_init_t=0.05, fd_recon_eta=0.1, fd_recon_dc=0, fd_recon_dc_n_cg=5, fd_recon_dc_relax=0.5, rationale=iter-13: DC-off breast-prior. ONE KNOB init_t 0.1->0.05. PRIOR (low-eta): init_t0.2->PSNR29.58, init_t0.1->PSNR31.88 (big jump). MECHANISM CONFIRMED: as init_t->0 the DC-off sampler converges to the FBP init (minimal generative perturbation) + light prior denoise => PSNR rises toward the FBP baseline (36.32). HYPOTHESIS: init_t=0.05 pushes PSNR further toward baseline (recon ~= lightly-denoised FBP). This is the KEY finding: the breast prior alone (no DC) can only APPROACH the FBP asymptotically by trusting it - it cannot EXCEED it, because without the CG data-consistency projection there is no mechanism to inject the missing sparse-view null-space information. hr stays 0 (RMSE never beats the FBP's 5.2e-3).", "run_id": "breast-ct-claude-agentic-fastdiff-flow-pixel-unconstrained-search-20260703-01", "runtime": {"elapsed_s": 154.21195769309998}, "schema_version": 3, "solver_key": "fastdiff-flow-pixel-unconstrained", "solver_name": "Fast-diffusion flow (pixel, unconstrained)", "split": {"train_n": 3600, "val_n": 200}, "status": "discard", "ts": "2026-07-06T21:00:08Z"}
{"advice_for_others": "fastdiff_flow_pixel_unconstrained-claude-agentic: image_size=512, pixel_spacing=0.3516, n_angles=128, n_det=1024, det_spacing=0.35754, sod=500.0, sdd=1000.0, display_min=0.0, display_max=0.5, train_n=400, val_n=200, noise_i0=100000.0, noise_sigma_e=10.0, seed=42, fd_recon_ckpt=/cluster/maier/Agent4CT/checkpoints/fast_diffusion_pixel_breast.pt, fd_recon_steps=8, fd_recon_init=fbp, fd_recon_init_t=0.02, fd_recon_eta=0.1, fd_recon_dc=0, fd_recon_dc_n_cg=5, fd_recon_dc_relax=0.5, rationale=iter-14: DC-off breast-prior. ONE KNOB init_t 0.05->0.02. PRIOR: init_t0.1->PSNR31.9/RMSE8.7e-3, init_t0.05->PSNR35.4/RMSE5.78e-3 - approaching the FBP baseline (PSNR36.3/RMSE5.21e-3) from BELOW. hr still 0 because recon RMSE (5.78e-3) > baseline RMSE (5.21e-3) by a hair: the prior's light denoise slightly HURTS vs raw FBP on this well-conditioned 128-view breast data. HYPOTHESIS: init_t=0.02 gets even closer to the FBP (recon ~= FBP + minimal prior touch) -> RMSE approaches but stays just above 5.21e-3 => hr=0 asymptote CONFIRMED. This is the definitive finding: the DC-off breast prior can at best RECOVER the FBP, never EXCEED it (no null-space injection without DC). Edge coverage of the init_t lever (its low end).", "agent": "fastdiff_flow_pixel_unconstrained-claude-agentic", "campaign": "search-20260703-01", "cfg_full": {"det_spacing": 0.35754, "display_max": 0.5, "display_min": 0.0, "fd_recon_ckpt": "/cluster/maier/Agent4CT/checkpoints/fast_diffusion_pixel_breast.pt", "fd_recon_dc": 0, "fd_recon_dc_n_cg": 5, "fd_recon_dc_relax": 0.5, "fd_recon_eta": 0.1, "fd_recon_init": "fbp", "fd_recon_init_t": 0.02, "fd_recon_steps": 8, "image_size": 512, "n_angles": 128, "n_det": 1024, "noise_i0": 100000.0, "noise_sigma_e": 10.0, "pixel_spacing": 0.3516, "rationale": "iter-14: DC-off breast-prior. ONE KNOB init_t 0.05->0.02. PRIOR: init_t0.1->PSNR31.9/RMSE8.7e-3, init_t0.05->PSNR35.4/RMSE5.78e-3 - approaching the FBP baseline (PSNR36.3/RMSE5.21e-3) from BELOW. hr still 0 because recon RMSE (5.78e-3) > baseline RMSE (5.21e-3) by a hair: the prior's light denoise slightly HURTS vs raw FBP on this well-conditioned 128-view breast data. HYPOTHESIS: init_t=0.02 gets even closer to the FBP (recon ~= FBP + minimal prior touch) -> RMSE approaches but stays just above 5.21e-3 => hr=0 asymptote CONFIRMED. This is the definitive finding: the DC-off breast prior can at best RECOVER the FBP, never EXCEED it (no null-space injection without DC). Edge coverage of the init_t lever (its low end).", "sdd": 1000.0, "seed": 42, "sod": 500.0, "train_n": 400, "val_n": 200}, "challenge": "breast_ct", "change_class": "architecture", "git_commit": "671da566", "images": {"comparison": "runs/breast-ct-claude-agentic-fastdiff-flow-pixel-unconstrained-search-20260703-01/iterations/iter-0014/comparison.png", "test_showcase": null, "valtest_showcase": null}, "iter": 14, "kept": true, "metrics": {"headroom": 0.2085437320480329, "headroom_std": 0.018530606670771554, "val_psnr": 38.35565948486328, "val_psnr_std": 0.552468163923917, "val_rmse": 0.004126877523958683, "val_rmse_std": 0.0002600398168325226, "val_ssim": 0.9745359420776367, "val_ssim_std": 0.003956644683789466}, "model": "claude-opus-4-8-1m", "obs_path": "breast-ct-claude-agentic-fastdiff-flow-pixel-unconstrained-search-20260703-01/iterations/iter-0014/observation.json", "obs_sha1": "d7c04647484f02b271ff305b40fee134f815ae47", "params_M": 3.822787, "params_source": "observation", "rationale": "fastdiff_flow_pixel_unconstrained-claude-agentic: image_size=512, pixel_spacing=0.3516, n_angles=128, n_det=1024, det_spacing=0.35754, sod=500.0, sdd=1000.0, display_min=0.0, display_max=0.5, train_n=400, val_n=200, noise_i0=100000.0, noise_sigma_e=10.0, seed=42, fd_recon_ckpt=/cluster/maier/Agent4CT/checkpoints/fast_diffusion_pixel_breast.pt, fd_recon_steps=8, fd_recon_init=fbp, fd_recon_init_t=0.02, fd_recon_eta=0.1, fd_recon_dc=0, fd_recon_dc_n_cg=5, fd_recon_dc_relax=0.5, rationale=iter-14: DC-off breast-prior. ONE KNOB init_t 0.05->0.02. PRIOR: init_t0.1->PSNR31.9/RMSE8.7e-3, init_t0.05->PSNR35.4/RMSE5.78e-3 - approaching the FBP baseline (PSNR36.3/RMSE5.21e-3) from BELOW. hr still 0 because recon RMSE (5.78e-3) > baseline RMSE (5.21e-3) by a hair: the prior's light denoise slightly HURTS vs raw FBP on this well-conditioned 128-view breast data. HYPOTHESIS: init_t=0.02 gets even closer to the FBP (recon ~= FBP + minimal prior touch) -> RMSE approaches but stays just above 5.21e-3 => hr=0 asymptote CONFIRMED. This is the definitive finding: the DC-off breast prior can at best RECOVER the FBP, never EXCEED it (no null-space injection without DC). Edge coverage of the init_t lever (its low end).", "run_id": "breast-ct-claude-agentic-fastdiff-flow-pixel-unconstrained-search-20260703-01", "runtime": {"elapsed_s": 140.70335221290588}, "schema_version": 3, "solver_key": "fastdiff-flow-pixel-unconstrained", "solver_name": "Fast-diffusion flow (pixel, unconstrained)", "split": {"train_n": 3600, "val_n": 200}, "status": "keep", "ts": "2026-07-06T21:03:06Z"}
