{"advice_for_others": "dual_domain_n2i-claude-agentic: warm_start=True, pretrain_epochs=3, pretrain_steps=0, n_iter=25, grad_clip=1.0, outer_wall_s=1400, per_scene_s=None, batch_size=1, lr=0.0003, optimizer=adam, unet_c=16, train_n=400, val_n=200, seed=42, rationale=iter-19 SIX-BOX. (1) PRIOR: iter-18 hr=0.0, warm_start OFF at matched n_iter=50 gave rmse=0.00659 (WORST) -- vs iter-6's warm-started 0.00628 at the SAME n_iter, confirming the warm-start provides a materially better init (from-scratch 50 steps is under-fit). Iters 1-18 all hr=0. NOTE: verified the solver HARDCODES torch.optim.Adam (the `optimizer` cfg key is a no-op), so I do NOT test optimizer as it would be a fake lever. (2) FAILURE MODE: plain-UNet N2I at the over-smoothed FBP-consistent plateau; no edge-preserving structural guard (bilateral sibling range kernel hr~0.21). (3) ONE KNOB: relative to iter-6 best reference (warm_start=True, lr=3e-4, c=16), n_iter 50 -> 25 (extreme early-stop, below all prior 50/100/200/400). Extends the inner-step sweep to its minimal end: freeze the recon almost AT the warm-start init. (4) HYPOTHESIS: with only 25 per-image steps the recon stays closest to the warm-started init; if the warm-start init is the least-over-smoothed point and per-image steps only push toward the smooth mean, 25 steps should give the LOWEST rmse of the n_iter sweep. If it dips toward baseline, minimal-step early-stop is the lever. Per the ceiling, expect hr=0 -- the warm-start init is itself over-smoothed, so freezing near it just yields a blurry recon (rmse ~0.0063). (5) BUDGET: 25 steps/scene very fast; pretrain ep=3 + 200*25-step fits + figure ~= 8 min << 30-min wall. (6) Loop continues; iter-20 (FINAL) self-dispatched. Reserved final lever: per_scene_s explicit to guarantee full deep-fit completion, OR a confirmatory replicate of the best config.", "agent": "dual_domain_n2i-claude-agentic", "campaign": "search-20260703-01", "cfg_full": {"batch_size": 1, "grad_clip": 1.0, "lr": 0.0003, "n_iter": 25, "optimizer": "adam", "outer_wall_s": 1400, "per_scene_s": null, "pretrain_epochs": 3, "pretrain_steps": 0, "rationale": "iter-19 SIX-BOX. (1) PRIOR: iter-18 hr=0.0, warm_start OFF at matched n_iter=50 gave rmse=0.00659 (WORST) -- vs iter-6's warm-started 0.00628 at the SAME n_iter, confirming the warm-start provides a materially better init (from-scratch 50 steps is under-fit). Iters 1-18 all hr=0. NOTE: verified the solver HARDCODES torch.optim.Adam (the `optimizer` cfg key is a no-op), so I do NOT test optimizer as it would be a fake lever. (2) FAILURE MODE: plain-UNet N2I at the over-smoothed FBP-consistent plateau; no edge-preserving structural guard (bilateral sibling range kernel hr~0.21). (3) ONE KNOB: relative to iter-6 best reference (warm_start=True, lr=3e-4, c=16), n_iter 50 -> 25 (extreme early-stop, below all prior 50/100/200/400). Extends the inner-step sweep to its minimal end: freeze the recon almost AT the warm-start init. (4) HYPOTHESIS: with only 25 per-image steps the recon stays closest to the warm-started init; if the warm-start init is the least-over-smoothed point and per-image steps only push toward the smooth mean, 25 steps should give the LOWEST rmse of the n_iter sweep. If it dips toward baseline, minimal-step early-stop is the lever. Per the ceiling, expect hr=0 -- the warm-start init is itself over-smoothed, so freezing near it just yields a blurry recon (rmse ~0.0063). (5) BUDGET: 25 steps/scene very fast; pretrain ep=3 + 200*25-step fits + figure ~= 8 min << 30-min wall. (6) Loop continues; iter-20 (FINAL) self-dispatched. Reserved final lever: per_scene_s explicit to guarantee full deep-fit completion, OR a confirmatory replicate of the best config.", "seed": 42, "train_n": 400, "unet_c": 16, "val_n": 200, "warm_start": true}, "challenge": "breast_ct", "change_class": "architecture", "git_commit": "671da566", "images": {"comparison": "runs/breast-ct-claude-agentic-dual-domain-n2i-search-20260703-01/iterations/iter-0019/comparison.png", "test_showcase": null, "valtest_showcase": null}, "iter": 19, "kept": false, "metrics": {"headroom": 0.0, "headroom_std": 0.0, "val_psnr": 34.6331672668457, "val_psnr_std": 0.9429750768708915, "val_rmse": 0.006334993056952953, "val_rmse_std": 0.0006553240948269009, "val_ssim": 0.9449787139892578, "val_ssim_std": 0.010929475973211384}, "model": "claude-opus-4-8-1m", "obs_path": "breast-ct-claude-agentic-dual-domain-n2i-search-20260703-01/iterations/iter-0019/observation.json", "obs_sha1": "2638ab7154487cf8743ac048e3df259bcc023002", "params_M": 0.465762, "params_source": "observation", "rationale": "dual_domain_n2i-claude-agentic: warm_start=True, pretrain_epochs=3, pretrain_steps=0, n_iter=25, grad_clip=1.0, outer_wall_s=1400, per_scene_s=None, batch_size=1, lr=0.0003, optimizer=adam, unet_c=16, train_n=400, val_n=200, seed=42, rationale=iter-19 SIX-BOX. (1) PRIOR: iter-18 hr=0.0, warm_start OFF at matched n_iter=50 gave rmse=0.00659 (WORST) -- vs iter-6's warm-started 0.00628 at the SAME n_iter, confirming the warm-start provides a materially better init (from-scratch 50 steps is under-fit). Iters 1-18 all hr=0. NOTE: verified the solver HARDCODES torch.optim.Adam (the `optimizer` cfg key is a no-op), so I do NOT test optimizer as it would be a fake lever. (2) FAILURE MODE: plain-UNet N2I at the over-smoothed FBP-consistent plateau; no edge-preserving structural guard (bilateral sibling range kernel hr~0.21). (3) ONE KNOB: relative to iter-6 best reference (warm_start=True, lr=3e-4, c=16), n_iter 50 -> 25 (extreme early-stop, below all prior 50/100/200/400). Extends the inner-step sweep to its minimal end: freeze the recon almost AT the warm-start init. (4) HYPOTHESIS: with only 25 per-image steps the recon stays closest to the warm-started init; if the warm-start init is the least-over-smoothed point and per-image steps only push toward the smooth mean, 25 steps should give the LOWEST rmse of the n_iter sweep. If it dips toward baseline, minimal-step early-stop is the lever. Per the ceiling, expect hr=0 -- the warm-start init is itself over-smoothed, so freezing near it just yields a blurry recon (rmse ~0.0063). (5) BUDGET: 25 steps/scene very fast; pretrain ep=3 + 200*25-step fits + figure ~= 8 min << 30-min wall. (6) Loop continues; iter-20 (FINAL) self-dispatched. Reserved final lever: per_scene_s explicit to guarantee full deep-fit completion, OR a confirmatory replicate of the best config.", "run_id": "breast-ct-claude-agentic-dual-domain-n2i-search-20260703-01", "runtime": {"elapsed_s": 551.6352317333221}, "schema_version": 3, "solver_key": "dual-domain-n2i", "solver_name": "DD-UNet N2I (per-image)", "split": {"train_n": 400, "val_n": 200}, "status": "discard", "ts": "2026-07-06T11:28:23Z"}
{"advice_for_others": "dual_domain_n2i-claude-agentic: warm_start=True, pretrain_epochs=3, pretrain_steps=0, n_iter=100, grad_clip=1.0, outer_wall_s=1400, per_scene_s=None, batch_size=1, lr=0.0003, optimizer=adam, unet_c=16, train_n=400, val_n=200, seed=42, rationale=iter-20 SIX-BOX (FINAL). (1) PRIOR: iter-19 hr=0.0, n_iter=25 extreme early-stop gave rmse=0.00633 -- freezing near the warm-start init did NOT beat baseline; the init is itself over-smoothed. The full inner-step sweep (25/50/100/200/400 -> 0.00633/0.00628/0.00627/0.00633/0.00623) is FLAT within ~3%, all hr=0. Iters 1-19 ALL hr=0. (2) FAILURE MODE: plain-UNet N2I converges to the over-smoothed FBP-consistent plateau on dense 128-view breast; it has NO edge-preserving structural guard, unlike the bilateral sibling (dual_domain_bilateral_n2i) whose tight range kernel reached hr~0.21. This is the DOCUMENTED structural ceiling (docs/findings.md: N2I over-smooths dense breast at 128 views because the FBP self-supervision target is itself a poor supervision signal). (3) ONE KNOB: relative to iter-19 (n_iter=25), n_iter 25 -> 100 -- returns to the best-rmse inner-step count (iter-10, rmse=0.00627) as a CONFIRMATORY closing replicate of the best-found config at full val_n=200. (4) HYPOTHESIS: this reproduces iter-10's ~0.00627 rmse at hr=0, confirming the best config the search found still cannot beat the sparse-FBP baseline -- a clean final datapoint that the ceiling is genuine and config-robust, not a missed lever. (5) BUDGET: n_iter=100 + pretrain ep=3 + figure ~= 16 min < 30-min wall. (6) FINAL iter -- loop ends here (20 valid six-box iters). Ceiling documented across 20 genuinely different levers: budget, per-scene fit, capacity (up/down), warm-start (off/1/3/10 ep/steps-cap/batch), lr (1e-4..3e-3), grad_clip, seed, inner-steps (25..400). Every one hr=0.", "agent": "dual_domain_n2i-claude-agentic", "campaign": "search-20260703-01", "cfg_full": {"batch_size": 1, "grad_clip": 1.0, "lr": 0.0003, "n_iter": 100, "optimizer": "adam", "outer_wall_s": 1400, "per_scene_s": null, "pretrain_epochs": 3, "pretrain_steps": 0, "rationale": "iter-20 SIX-BOX (FINAL). (1) PRIOR: iter-19 hr=0.0, n_iter=25 extreme early-stop gave rmse=0.00633 -- freezing near the warm-start init did NOT beat baseline; the init is itself over-smoothed. The full inner-step sweep (25/50/100/200/400 -> 0.00633/0.00628/0.00627/0.00633/0.00623) is FLAT within ~3%, all hr=0. Iters 1-19 ALL hr=0. (2) FAILURE MODE: plain-UNet N2I converges to the over-smoothed FBP-consistent plateau on dense 128-view breast; it has NO edge-preserving structural guard, unlike the bilateral sibling (dual_domain_bilateral_n2i) whose tight range kernel reached hr~0.21. This is the DOCUMENTED structural ceiling (docs/findings.md: N2I over-smooths dense breast at 128 views because the FBP self-supervision target is itself a poor supervision signal). (3) ONE KNOB: relative to iter-19 (n_iter=25), n_iter 25 -> 100 -- returns to the best-rmse inner-step count (iter-10, rmse=0.00627) as a CONFIRMATORY closing replicate of the best-found config at full val_n=200. (4) HYPOTHESIS: this reproduces iter-10's ~0.00627 rmse at hr=0, confirming the best config the search found still cannot beat the sparse-FBP baseline -- a clean final datapoint that the ceiling is genuine and config-robust, not a missed lever. (5) BUDGET: n_iter=100 + pretrain ep=3 + figure ~= 16 min < 30-min wall. (6) FINAL iter -- loop ends here (20 valid six-box iters). Ceiling documented across 20 genuinely different levers: budget, per-scene fit, capacity (up/down), warm-start (off/1/3/10 ep/steps-cap/batch), lr (1e-4..3e-3), grad_clip, seed, inner-steps (25..400). Every one hr=0.", "seed": 42, "train_n": 400, "unet_c": 16, "val_n": 200, "warm_start": true}, "challenge": "breast_ct", "change_class": "architecture", "git_commit": "671da566", "images": {"comparison": "runs/breast-ct-claude-agentic-dual-domain-n2i-search-20260703-01/iterations/iter-0020/comparison.png", "test_showcase": null, "valtest_showcase": null}, "iter": 20, "kept": false, "metrics": {"headroom": 0.0, "headroom_std": 0.0, "val_psnr": 34.76396179199219, "val_psnr_std": 0.9303839007551886, "val_rmse": 0.0062403143383562565, "val_rmse_std": 0.0006441948613012504, "val_ssim": 0.9428812861442566, "val_ssim_std": 0.01032382299566357}, "model": "claude-opus-4-8-1m", "obs_path": "breast-ct-claude-agentic-dual-domain-n2i-search-20260703-01/iterations/iter-0020/observation.json", "obs_sha1": "a88ecdb0e288a6566057a37d79d847d10dc47eeb", "params_M": 0.465762, "params_source": "observation", "rationale": "dual_domain_n2i-claude-agentic: warm_start=True, pretrain_epochs=3, pretrain_steps=0, n_iter=100, grad_clip=1.0, outer_wall_s=1400, per_scene_s=None, batch_size=1, lr=0.0003, optimizer=adam, unet_c=16, train_n=400, val_n=200, seed=42, rationale=iter-20 SIX-BOX (FINAL). (1) PRIOR: iter-19 hr=0.0, n_iter=25 extreme early-stop gave rmse=0.00633 -- freezing near the warm-start init did NOT beat baseline; the init is itself over-smoothed. The full inner-step sweep (25/50/100/200/400 -> 0.00633/0.00628/0.00627/0.00633/0.00623) is FLAT within ~3%, all hr=0. Iters 1-19 ALL hr=0. (2) FAILURE MODE: plain-UNet N2I converges to the over-smoothed FBP-consistent plateau on dense 128-view breast; it has NO edge-preserving structural guard, unlike the bilateral sibling (dual_domain_bilateral_n2i) whose tight range kernel reached hr~0.21. This is the DOCUMENTED structural ceiling (docs/findings.md: N2I over-smooths dense breast at 128 views because the FBP self-supervision target is itself a poor supervision signal). (3) ONE KNOB: relative to iter-19 (n_iter=25), n_iter 25 -> 100 -- returns to the best-rmse inner-step count (iter-10, rmse=0.00627) as a CONFIRMATORY closing replicate of the best-found config at full val_n=200. (4) HYPOTHESIS: this reproduces iter-10's ~0.00627 rmse at hr=0, confirming the best config the search found still cannot beat the sparse-FBP baseline -- a clean final datapoint that the ceiling is genuine and config-robust, not a missed lever. (5) BUDGET: n_iter=100 + pretrain ep=3 + figure ~= 16 min < 30-min wall. (6) FINAL iter -- loop ends here (20 valid six-box iters). Ceiling documented across 20 genuinely different levers: budget, per-scene fit, capacity (up/down), warm-start (off/1/3/10 ep/steps-cap/batch), lr (1e-4..3e-3), grad_clip, seed, inner-steps (25..400). Every one hr=0.", "run_id": "breast-ct-claude-agentic-dual-domain-n2i-search-20260703-01", "runtime": {"elapsed_s": 1528.5312221050262}, "schema_version": 3, "solver_key": "dual-domain-n2i", "solver_name": "DD-UNet N2I (per-image)", "split": {"train_n": 400, "val_n": 200}, "status": "discard", "ts": "2026-07-06T12:39:33Z"}
{"advice_for_others": "dual_domain_supervised-claude-agentic: unet_c=16, epochs=10, batch_size=1, lr=0.0005, optimizer=adam, lambda_neg=1.0, grad_clip=1.0, train_n=400, val_n=200, val_chunk=10, seed=42, rationale=iter-1 ONBOARDING dual_domain_supervised (DD-UNet supervised L2: proj_dn -> FBP(128 views) -> img_dn, MSE-vs-clean-phantom + lambda_neg negativity penalty) on the re-split Breast-CT (train 3600 / val 200 / test 200, seed 20260703), scoring val=200. SIX-BOX: (1) PRIOR: none (first iter of this slug); nearest reference = the OLD-split breast DD-UNet-L2 run which hit hr=0.812 at c=16/lr=5e-4/ep=10/val_n=20. (2) Failure mode: N/A onboarding; goal = does DD-supervised run on the new breast val=200 split under the HARD 20-min budget and clear the sparse-view FBP baseline (hr>0)? (3) ONE KNOB: N/A baseline (mirrors the prior known-good breast config, only val_n 20->200 as required by the re-split cap). (4) HYPOTHESIS: DD-UNet-L2 at c=16/lr=5e-4/ep=10 on 400 train scenes trains stably (grad_clip=1.0 safety) and CLEARS the breast FBP baseline (hr>0) at val_ssim ~0.99, because the identical config on the old-split breast val hit hr=0.812 and breast is synthetic/clean; the new val=200 is just a larger, tighter-spread val pool. (5) BUDGET: breast uses a SINGLE shared PYRO-NN projector (no per-sample-ps swap, unlike Mayo), so FBP is batched and val_chunk=10 is fine; prior run trained ep=10 + scored val=20 + figure in ~151s -> ep=10 + batched val=200 forward + figure fits comfortably in 20 min (30-min sbatch wall). (6) Loop continues; iter-2 dispatched on landing. Knobs reserved for iters 2-5: unet_c, epochs, lr, lambda_neg (sino-vs-image loss balance is implicit in the single MSE).", "agent": "dual_domain_supervised-claude-agentic", "campaign": "search-20260703-01", "cfg_full": {"batch_size": 1, "epochs": 10, "grad_clip": 1.0, "lambda_neg": 1.0, "lr": 0.0005, "optimizer": "adam", "rationale": "iter-1 ONBOARDING dual_domain_supervised (DD-UNet supervised L2: proj_dn -> FBP(128 views) -> img_dn, MSE-vs-clean-phantom + lambda_neg negativity penalty) on the re-split Breast-CT (train 3600 / val 200 / test 200, seed 20260703), scoring val=200. SIX-BOX: (1) PRIOR: none (first iter of this slug); nearest reference = the OLD-split breast DD-UNet-L2 run which hit hr=0.812 at c=16/lr=5e-4/ep=10/val_n=20. (2) Failure mode: N/A onboarding; goal = does DD-supervised run on the new breast val=200 split under the HARD 20-min budget and clear the sparse-view FBP baseline (hr>0)? (3) ONE KNOB: N/A baseline (mirrors the prior known-good breast config, only val_n 20->200 as required by the re-split cap). (4) HYPOTHESIS: DD-UNet-L2 at c=16/lr=5e-4/ep=10 on 400 train scenes trains stably (grad_clip=1.0 safety) and CLEARS the breast FBP baseline (hr>0) at val_ssim ~0.99, because the identical config on the old-split breast val hit hr=0.812 and breast is synthetic/clean; the new val=200 is just a larger, tighter-spread val pool. (5) BUDGET: breast uses a SINGLE shared PYRO-NN projector (no per-sample-ps swap, unlike Mayo), so FBP is batched and val_chunk=10 is fine; prior run trained ep=10 + scored val=20 + figure in ~151s -> ep=10 + batched val=200 forward + figure fits comfortably in 20 min (30-min sbatch wall). (6) Loop continues; iter-2 dispatched on landing. Knobs reserved for iters 2-5: unet_c, epochs, lr, lambda_neg (sino-vs-image loss balance is implicit in the single MSE).", "seed": 42, "train_n": 400, "unet_c": 16, "val_chunk": 10, "val_n": 200}, "challenge": "breast_ct", "change_class": "architecture", "git_commit": null, "images": {"comparison": "runs/breast-ct-claude-agentic-dual-domain-supervised-search-20260703-01/iterations/iter-0001/comparison.png", "test_showcase": null, "valtest_showcase": null}, "iter": 1, "kept": true, "metrics": {"headroom": 0.8094808357938321, "headroom_std": null, "val_psnr": 50.72542190551758, "val_psnr_std": null, "val_rmse": 0.0009934214176610112, "val_rmse_std": null, "val_ssim": 0.9974700808525085, "val_ssim_std": null}, "model": "claude-opus-4-8-1m", "obs_path": "breast-ct-claude-agentic-dual-domain-supervised-search-20260703-01/iterations/iter-0001/observation.json", "obs_sha1": "511879882ea5f2d14ffdf39b560fe32bf1b99278", "params_M": 0.465762, "params_source": "observation", "rationale": "dual_domain_supervised-claude-agentic: unet_c=16, epochs=10, batch_size=1, lr=0.0005, optimizer=adam, lambda_neg=1.0, grad_clip=1.0, train_n=400, val_n=200, val_chunk=10, seed=42, rationale=iter-1 ONBOARDING dual_domain_supervised (DD-UNet supervised L2: proj_dn -> FBP(128 views) -> img_dn, MSE-vs-clean-phantom + lambda_neg negativity penalty) on the re-split Breast-CT (train 3600 / val 200 / test 200, seed 20260703), scoring val=200. SIX-BOX: (1) PRIOR: none (first iter of this slug); nearest reference = the OLD-split breast DD-UNet-L2 run which hit hr=0.812 at c=16/lr=5e-4/ep=10/val_n=20. (2) Failure mode: N/A onboarding; goal = does DD-supervised run on the new breast val=200 split under the HARD 20-min budget and clear the sparse-view FBP baseline (hr>0)? (3) ONE KNOB: N/A baseline (mirrors the prior known-good breast config, only val_n 20->200 as required by the re-split cap). (4) HYPOTHESIS: DD-UNet-L2 at c=16/lr=5e-4/ep=10 on 400 train scenes trains stably (grad_clip=1.0 safety) and CLEARS the breast FBP baseline (hr>0) at val_ssim ~0.99, because the identical config on the old-split breast val hit hr=0.812 and breast is synthetic/clean; the new val=200 is just a larger, tighter-spread val pool. (5) BUDGET: breast uses a SINGLE shared PYRO-NN projector (no per-sample-ps swap, unlike Mayo), so FBP is batched and val_chunk=10 is fine; prior run trained ep=10 + scored val=20 + figure in ~151s -> ep=10 + batched val=200 forward + figure fits comfortably in 20 min (30-min sbatch wall). (6) Loop continues; iter-2 dispatched on landing. Knobs reserved for iters 2-5: unet_c, epochs, lr, lambda_neg (sino-vs-image loss balance is implicit in the single MSE).", "run_id": "breast-ct-claude-agentic-dual-domain-supervised-search-20260703-01", "runtime": {"elapsed_s": 226.53502464294434}, "schema_version": 3, "solver_key": "dual-domain-supervised", "solver_name": "DD-UNet supervised L2", "split": {"train_n": 400, "val_n": 200}, "status": "keep", "ts": "2026-07-03T16:11:51Z"}
