{"advice_for_others": "r2gaussian-claude-agentic: val_n=15, gs_n_gaussians=512, gs_n_iter=150, gs_lr_pos=0.005, gs_lr_scale=0.01, gs_lr_amp=0.01, gs_lr_rot=0.01, gs_amp_init=0.01, gs_scale_init=0.04, gs_tv_weight=0.0001, gs_n_clip=0.05, gs_init_from_fbp=False, gs_render=raster, gs_ssim_weight=0.0, seed=42, train_n=0, rationale=iter-1 ONBOARDING r2gaussian (R2-Gaussian-lite: N anisotropic 2D Gaussians rasterized to a mu-image, forward-projected via PYRO-NN, MSE+TV+neg vs the 128-view noisy sino, per-scene) on the re-split Breast-CT (train 3600 / val 200 / test 200, seed 20260703). REDUCED val_n=15 (NOT 200) because r2gaussian is a HEAVY per-scene fit (timing probe: 273 ms/Adam-step at 512 Gaussians/128-view/512^2 -> ~41 s/scene at gs_n_iter=150); 15 scenes x 41 s = ~615 s (~10 min) fits the HARD 20-min train+score budget with all 15 scenes completing (gs_outer_wall_s=1080 self-truncate never fires). val_n=15 is held CONSTANT across all 20 iters. SIX-BOX: (1) PRIOR: none (first iter this slug); documented ceiling (docs/findings.md 2026-06-03): R2-Gaussian is STRUCTURALLY bounded on dense 128-view breast -> hr=0 confirmed at gs_n_iter 300->40k and with FBP warm-start; the anisotropic-Gaussian basis is too coarse for densely-distributed soft tissue at 512^2/128-view, and the 128-view FBP baseline is already very strong (SSIM ~0.957). (2) FAILURE MODE: N/A onboarding; goal = does r2gaussian run on the new breast val=15 split under the HARD 20-min budget, and does it clear the 128-view sparse-FBP baseline (hr>0)? Expect hr=0 per the documented ceiling. (3) ONE KNOB: N/A baseline (mirrors the Mayo iter-1 knobs adapted to breast: 512 Gaussians / 150 steps / default LRs). (4) HYPOTHESIS: cold-init 512-Gaussian / 150-step per-scene fit lands BELOW the 128-view FBP baseline on RMSE -> hr=0, because the Gaussian basis is too sparse for dense breast soft tissue (findings 2026-06-03). If hr>0, the ceiling is refuted and I re-map; if hr=0 at SSIM ~0.88-0.94 (per prior breast R2-G), the documented ceiling reproduces on the new split. (5) BUDGET: 15 scenes x ~41 s = ~615 s + FBP-load + scoring + figure << 1200 s HARD < 1800 s (30-min) SLURM wall; gs_outer_wall_s=1080 self-truncates before the SLURM kill. (6) STRICT SERIAL, one job at a time; loop continues, iter-2 self-dispatched on the per-JOBID DONE sentinel. Reserved levers for iters 2-N: gs_n_iter, gs_n_gaussians, gs_init_from_fbp, gs_ssim_weight, gs_lr_*.", "agent": "r2gaussian-claude-agentic", "campaign": "search-20260703-01", "cfg_full": {"gs_amp_init": 0.01, "gs_init_from_fbp": false, "gs_lr_amp": 0.01, "gs_lr_pos": 0.005, "gs_lr_rot": 0.01, "gs_lr_scale": 0.01, "gs_n_clip": 0.05, "gs_n_gaussians": 512, "gs_n_iter": 150, "gs_render": "raster", "gs_scale_init": 0.04, "gs_ssim_weight": 0.0, "gs_tv_weight": 0.0001, "rationale": "iter-1 ONBOARDING r2gaussian (R2-Gaussian-lite: N anisotropic 2D Gaussians rasterized to a mu-image, forward-projected via PYRO-NN, MSE+TV+neg vs the 128-view noisy sino, per-scene) on the re-split Breast-CT (train 3600 / val 200 / test 200, seed 20260703). REDUCED val_n=15 (NOT 200) because r2gaussian is a HEAVY per-scene fit (timing probe: 273 ms/Adam-step at 512 Gaussians/128-view/512^2 -> ~41 s/scene at gs_n_iter=150); 15 scenes x 41 s = ~615 s (~10 min) fits the HARD 20-min train+score budget with all 15 scenes completing (gs_outer_wall_s=1080 self-truncate never fires). val_n=15 is held CONSTANT across all 20 iters. SIX-BOX: (1) PRIOR: none (first iter this slug); documented ceiling (docs/findings.md 2026-06-03): R2-Gaussian is STRUCTURALLY bounded on dense 128-view breast -> hr=0 confirmed at gs_n_iter 300->40k and with FBP warm-start; the anisotropic-Gaussian basis is too coarse for densely-distributed soft tissue at 512^2/128-view, and the 128-view FBP baseline is already very strong (SSIM ~0.957). (2) FAILURE MODE: N/A onboarding; goal = does r2gaussian run on the new breast val=15 split under the HARD 20-min budget, and does it clear the 128-view sparse-FBP baseline (hr>0)? Expect hr=0 per the documented ceiling. (3) ONE KNOB: N/A baseline (mirrors the Mayo iter-1 knobs adapted to breast: 512 Gaussians / 150 steps / default LRs). (4) HYPOTHESIS: cold-init 512-Gaussian / 150-step per-scene fit lands BELOW the 128-view FBP baseline on RMSE -> hr=0, because the Gaussian basis is too sparse for dense breast soft tissue (findings 2026-06-03). If hr>0, the ceiling is refuted and I re-map; if hr=0 at SSIM ~0.88-0.94 (per prior breast R2-G), the documented ceiling reproduces on the new split. (5) BUDGET: 15 scenes x ~41 s = ~615 s + FBP-load + scoring + figure << 1200 s HARD < 1800 s (30-min) SLURM wall; gs_outer_wall_s=1080 self-truncates before the SLURM kill. (6) STRICT SERIAL, one job at a time; loop continues, iter-2 self-dispatched on the per-JOBID DONE sentinel. Reserved levers for iters 2-N: gs_n_iter, gs_n_gaussians, gs_init_from_fbp, gs_ssim_weight, gs_lr_*.", "seed": 42, "train_n": 0, "val_n": 15}, "challenge": "breast_ct", "change_class": "architecture", "git_commit": "671da566", "images": {"comparison": "runs/breast-ct-claude-agentic-r2gaussian-search-20260703-01/iterations/iter-0001/comparison.png", "test_showcase": null, "valtest_showcase": null}, "iter": 1, "kept": false, "metrics": {"headroom": 0.0, "headroom_std": 0.0, "val_psnr": 20.139568328857422, "val_psnr_std": 0.45055499945257954, "val_rmse": 0.03231465071439743, "val_rmse_std": 0.001717403883974575, "val_ssim": 0.8032422661781311, "val_ssim_std": 0.015030125714902816}, "model": "claude-opus-4-8-1m", "obs_path": "breast-ct-claude-agentic-r2gaussian-search-20260703-01/iterations/iter-0001/observation.json", "obs_sha1": "9b49727cb7ee94a8b2ba34838e2cddc3efad6500", "params_M": 0.003072, "params_source": "observation", "rationale": "r2gaussian-claude-agentic: val_n=15, gs_n_gaussians=512, gs_n_iter=150, gs_lr_pos=0.005, gs_lr_scale=0.01, gs_lr_amp=0.01, gs_lr_rot=0.01, gs_amp_init=0.01, gs_scale_init=0.04, gs_tv_weight=0.0001, gs_n_clip=0.05, gs_init_from_fbp=False, gs_render=raster, gs_ssim_weight=0.0, seed=42, train_n=0, rationale=iter-1 ONBOARDING r2gaussian (R2-Gaussian-lite: N anisotropic 2D Gaussians rasterized to a mu-image, forward-projected via PYRO-NN, MSE+TV+neg vs the 128-view noisy sino, per-scene) on the re-split Breast-CT (train 3600 / val 200 / test 200, seed 20260703). REDUCED val_n=15 (NOT 200) because r2gaussian is a HEAVY per-scene fit (timing probe: 273 ms/Adam-step at 512 Gaussians/128-view/512^2 -> ~41 s/scene at gs_n_iter=150); 15 scenes x 41 s = ~615 s (~10 min) fits the HARD 20-min train+score budget with all 15 scenes completing (gs_outer_wall_s=1080 self-truncate never fires). val_n=15 is held CONSTANT across all 20 iters. SIX-BOX: (1) PRIOR: none (first iter this slug); documented ceiling (docs/findings.md 2026-06-03): R2-Gaussian is STRUCTURALLY bounded on dense 128-view breast -> hr=0 confirmed at gs_n_iter 300->40k and with FBP warm-start; the anisotropic-Gaussian basis is too coarse for densely-distributed soft tissue at 512^2/128-view, and the 128-view FBP baseline is already very strong (SSIM ~0.957). (2) FAILURE MODE: N/A onboarding; goal = does r2gaussian run on the new breast val=15 split under the HARD 20-min budget, and does it clear the 128-view sparse-FBP baseline (hr>0)? Expect hr=0 per the documented ceiling. (3) ONE KNOB: N/A baseline (mirrors the Mayo iter-1 knobs adapted to breast: 512 Gaussians / 150 steps / default LRs). (4) HYPOTHESIS: cold-init 512-Gaussian / 150-step per-scene fit lands BELOW the 128-view FBP baseline on RMSE -> hr=0, because the Gaussian basis is too sparse for dense breast soft tissue (findings 2026-06-03). If hr>0, the ceiling is refuted and I re-map; if hr=0 at SSIM ~0.88-0.94 (per prior breast R2-G), the documented ceiling reproduces on the new split. (5) BUDGET: 15 scenes x ~41 s = ~615 s + FBP-load + scoring + figure << 1200 s HARD < 1800 s (30-min) SLURM wall; gs_outer_wall_s=1080 self-truncates before the SLURM kill. (6) STRICT SERIAL, one job at a time; loop continues, iter-2 self-dispatched on the per-JOBID DONE sentinel. Reserved levers for iters 2-N: gs_n_iter, gs_n_gaussians, gs_init_from_fbp, gs_ssim_weight, gs_lr_*.", "run_id": "breast-ct-claude-agentic-r2gaussian-search-20260703-01", "runtime": {"elapsed_s": 604.1369919776917}, "schema_version": 3, "solver_key": "r2gaussian", "solver_name": "R2-Gaussian", "split": {"train_n": 400, "val_n": 15}, "status": "discard", "ts": "2026-07-05T17:30:35Z"}
{"advice_for_others": "r2gaussian-claude-agentic: val_n=15, gs_n_gaussians=512, gs_n_iter=220, gs_lr_pos=0.005, gs_lr_scale=0.01, gs_lr_amp=0.01, gs_lr_rot=0.01, gs_amp_init=0.01, gs_scale_init=0.04, gs_tv_weight=0.0001, gs_n_clip=0.05, gs_init_from_fbp=False, gs_render=raster, gs_ssim_weight=0.0, seed=42, train_n=0, rationale=iter-2 RE-DISPATCH (search-20260703-01). ONE KNOB vs iter-1: gs_n_iter 150->220 (per-scene Adam steps quality lever). RE-DISPATCH REASON: the first iter-2 attempt (gs_n_iter=250, NO gs_outer_wall_s in cfg) fell back to the solver-default 600s in-solver wall and TRUNCATED at sample 10/15 on the RTX 5000 node (~66 s/scene) -> val_n dropped to 10, breaking the val_n=15-CONSTANT requirement (it still gave hr=0, SSIM 0.8033, PSNR 20.32 on the 10 completed). FIX: add gs_outer_wall_s=1080 (generous, never fires for 15 scenes) AND reduce steps 250->220 so all 15 scenes finish on the slower shared nodes: 220 steps x ~58 s/scene x 15 = ~870 s < 1080 wall < 1200 s HARD < 1800 s SLURM. PRIOR NUMBERS: iter-1 hr=0.0000, SSIM=0.8032, PSNR=20.14, RMSE=0.03231, 15/15 scenes, vs 128-view FBP baseline PSNR=35.97 (hr=0). FAILURE MODE: per-scene 512-Gaussian recon lands FAR below the strong sparse-FBP baseline (basis too coarse for dense breast soft tissue / possible under-fit). HYPOTHESIS (falsifiable in NUMBERS): if 220 steps lifts SSIM materially above iter-1 0.8032 / drops RMSE below 0.03231, the quality lever works (under-fit). FALSIFIER: if SSIM stays ~0.80 flat, 150-220 steps already saturate the Gaussian basis -> quality is NOT the lever (basis-coarseness ceiling). hr expected 0 either way (matching FBP PSNR 35.9 with 512 Gaussians in 220 steps is implausible). val_n=15 HELD CONSTANT (now enforced by gs_outer_wall_s=1080). TRAJECTORY: iter-1 SSIM 0.8032 @150 steps -> iter-2 @220 steps quality test., gs_outer_wall_s=1080", "agent": "r2gaussian-claude-agentic", "campaign": "search-20260703-01", "cfg_full": {"gs_amp_init": 0.01, "gs_init_from_fbp": false, "gs_lr_amp": 0.01, "gs_lr_pos": 0.005, "gs_lr_rot": 0.01, "gs_lr_scale": 0.01, "gs_n_clip": 0.05, "gs_n_gaussians": 512, "gs_n_iter": 220, "gs_outer_wall_s": 1080, "gs_render": "raster", "gs_scale_init": 0.04, "gs_ssim_weight": 0.0, "gs_tv_weight": 0.0001, "rationale": "iter-2 RE-DISPATCH (search-20260703-01). ONE KNOB vs iter-1: gs_n_iter 150->220 (per-scene Adam steps quality lever). RE-DISPATCH REASON: the first iter-2 attempt (gs_n_iter=250, NO gs_outer_wall_s in cfg) fell back to the solver-default 600s in-solver wall and TRUNCATED at sample 10/15 on the RTX 5000 node (~66 s/scene) -> val_n dropped to 10, breaking the val_n=15-CONSTANT requirement (it still gave hr=0, SSIM 0.8033, PSNR 20.32 on the 10 completed). FIX: add gs_outer_wall_s=1080 (generous, never fires for 15 scenes) AND reduce steps 250->220 so all 15 scenes finish on the slower shared nodes: 220 steps x ~58 s/scene x 15 = ~870 s < 1080 wall < 1200 s HARD < 1800 s SLURM. PRIOR NUMBERS: iter-1 hr=0.0000, SSIM=0.8032, PSNR=20.14, RMSE=0.03231, 15/15 scenes, vs 128-view FBP baseline PSNR=35.97 (hr=0). FAILURE MODE: per-scene 512-Gaussian recon lands FAR below the strong sparse-FBP baseline (basis too coarse for dense breast soft tissue / possible under-fit). HYPOTHESIS (falsifiable in NUMBERS): if 220 steps lifts SSIM materially above iter-1 0.8032 / drops RMSE below 0.03231, the quality lever works (under-fit). FALSIFIER: if SSIM stays ~0.80 flat, 150-220 steps already saturate the Gaussian basis -> quality is NOT the lever (basis-coarseness ceiling). hr expected 0 either way (matching FBP PSNR 35.9 with 512 Gaussians in 220 steps is implausible). val_n=15 HELD CONSTANT (now enforced by gs_outer_wall_s=1080). TRAJECTORY: iter-1 SSIM 0.8032 @150 steps -> iter-2 @220 steps quality test.", "seed": 42, "train_n": 0, "val_n": 15}, "challenge": "breast_ct", "change_class": "architecture", "git_commit": "671da566", "images": {"comparison": "runs/breast-ct-claude-agentic-r2gaussian-search-20260703-01/iterations/iter-0002/comparison.png", "test_showcase": null, "valtest_showcase": null}, "iter": 2, "kept": false, "metrics": {"headroom": 0.0, "headroom_std": 0.0, "val_psnr": 20.30097198486328, "val_psnr_std": 0.3900953425552293, "val_rmse": 0.031719714403152466, "val_rmse_std": 0.001410939924478274, "val_ssim": 0.8047700524330139, "val_ssim_std": 0.014081205822667513}, "model": "claude-opus-4-8-1m", "obs_path": "breast-ct-claude-agentic-r2gaussian-search-20260703-01/iterations/iter-0002/observation.json", "obs_sha1": "0d4923b884da8937a13f2ce66dc6ec6c996d4b1f", "params_M": 0.003072, "params_source": "observation", "rationale": "r2gaussian-claude-agentic: val_n=15, gs_n_gaussians=512, gs_n_iter=220, gs_lr_pos=0.005, gs_lr_scale=0.01, gs_lr_amp=0.01, gs_lr_rot=0.01, gs_amp_init=0.01, gs_scale_init=0.04, gs_tv_weight=0.0001, gs_n_clip=0.05, gs_init_from_fbp=False, gs_render=raster, gs_ssim_weight=0.0, seed=42, train_n=0, rationale=iter-2 RE-DISPATCH (search-20260703-01). ONE KNOB vs iter-1: gs_n_iter 150->220 (per-scene Adam steps quality lever). RE-DISPATCH REASON: the first iter-2 attempt (gs_n_iter=250, NO gs_outer_wall_s in cfg) fell back to the solver-default 600s in-solver wall and TRUNCATED at sample 10/15 on the RTX 5000 node (~66 s/scene) -> val_n dropped to 10, breaking the val_n=15-CONSTANT requirement (it still gave hr=0, SSIM 0.8033, PSNR 20.32 on the 10 completed). FIX: add gs_outer_wall_s=1080 (generous, never fires for 15 scenes) AND reduce steps 250->220 so all 15 scenes finish on the slower shared nodes: 220 steps x ~58 s/scene x 15 = ~870 s < 1080 wall < 1200 s HARD < 1800 s SLURM. PRIOR NUMBERS: iter-1 hr=0.0000, SSIM=0.8032, PSNR=20.14, RMSE=0.03231, 15/15 scenes, vs 128-view FBP baseline PSNR=35.97 (hr=0). FAILURE MODE: per-scene 512-Gaussian recon lands FAR below the strong sparse-FBP baseline (basis too coarse for dense breast soft tissue / possible under-fit). HYPOTHESIS (falsifiable in NUMBERS): if 220 steps lifts SSIM materially above iter-1 0.8032 / drops RMSE below 0.03231, the quality lever works (under-fit). FALSIFIER: if SSIM stays ~0.80 flat, 150-220 steps already saturate the Gaussian basis -> quality is NOT the lever (basis-coarseness ceiling). hr expected 0 either way (matching FBP PSNR 35.9 with 512 Gaussians in 220 steps is implausible). val_n=15 HELD CONSTANT (now enforced by gs_outer_wall_s=1080). TRAJECTORY: iter-1 SSIM 0.8032 @150 steps -> iter-2 @220 steps quality test., gs_outer_wall_s=1080", "run_id": "breast-ct-claude-agentic-r2gaussian-search-20260703-01", "runtime": {"elapsed_s": 871.7814691066742}, "schema_version": 3, "solver_key": "r2gaussian", "solver_name": "R2-Gaussian", "split": {"train_n": 400, "val_n": 15}, "status": "discard", "ts": "2026-07-05T17:58:31Z"}
