{"advice_for_others": "param_efficient-claude-agentic: reg_type=foe, bilateral_on_top=True, proj_filter_on=False, n_iter=5, learnable_alpha=True, alpha_init=0.1, foe_n_filters=24, foe_kernel=7, foe_n_bumps=31, n_bf=3, bf_multiscale=True, bf_sigmas=[0.8, 1.6, 3.2], bf_kernel=7, bf_sigma_r=0.02, bf_gain_init=0.0, epochs=16, cosine_lr=True, lr=0.005, max_train_s=1080, batch_size=4, train_n=800, val_n=200, display_min=0.0, display_max=0.05, seed=42, rationale=iter-1 ONBOARDING of param_efficient (FoE unrolled prox-gradient + DC, K=5, + multi-RF PARALLEL bilateral bank, zero-init gains) on the re-split Breast-CT (train 3600/val 200/test 200, seed 20260703; 128-view SPARSE). 1,932 reg params. SIX-BOX: (1) PRIOR: none (first iter); cross-solver evidence: DL tier (ItNet/DD-UNet) plateaus val hr ~0.88 at 0.23-0.47M params; the FoE param-efficient recombination targets that hr at ~1.9k params (~200x fewer). (2) FAILURE MODE: N/A onboarding; goal = does the Mayo-evolved FoE+bilateral seed RUN on breast 128-view 512^2 and clear the sparse-view FBP baseline (hr>0). (3) ONE KNOB: N/A baseline seed = Mayo iter-25/27 champion arch (FoE nf24/k7 + M=3 bilateral bank ON TOP), proj-filter OFF (turned on later as the sparse-view lever). (4) HYPOTHESIS: FoE+bilateral (1,932 params, K=5 DC unroll, FBP warm-start) clears breast FBP (hr>0) and lands hr ~0.4-0.6 in one 18-min run, because unrolled data-consistency is the strong-performer trait on breast and the FBP init leaves large sparse-view headroom -- but 200x fewer params than the DL tier means it will START well below 0.88 and the projection-domain + anisotropic streak levers (dormant here) are the sparse-view-specific gains to add next. (5) BUDGET: train_n=800 x FoE K=5 unroll at 512^2, bs=4, hard max_train_s=1080 backstop + 200-slice val pass; breast uses ONE shared PYRO-NN projector (no per-sample-ps) -> well inside 20 min. (6) Loop continues STRICT SERIAL; iter-2 self-dispatched on landing. AGENT4CT_SAVE_RECON -> dashboard iter dir so recon_raw.npz (pred/truth/baseline) lands where rescore reads it.", "agent": "param_efficient-claude-agentic", "campaign": "search-20260703-01", "cfg_full": {"alpha_init": 0.1, "batch_size": 4, "bf_gain_init": 0.0, "bf_kernel": 7, "bf_multiscale": true, "bf_sigma_r": 0.02, "bf_sigmas": [0.8, 1.6, 3.2], "bilateral_on_top": true, "cosine_lr": true, "display_max": 0.05, "display_min": 0.0, "epochs": 16, "foe_kernel": 7, "foe_n_bumps": 31, "foe_n_filters": 24, "learnable_alpha": true, "lr": 0.005, "max_train_s": 1080, "n_bf": 3, "n_iter": 5, "proj_filter_on": false, "rationale": "iter-1 ONBOARDING of param_efficient (FoE unrolled prox-gradient + DC, K=5, + multi-RF PARALLEL bilateral bank, zero-init gains) on the re-split Breast-CT (train 3600/val 200/test 200, seed 20260703; 128-view SPARSE). 1,932 reg params. SIX-BOX: (1) PRIOR: none (first iter); cross-solver evidence: DL tier (ItNet/DD-UNet) plateaus val hr ~0.88 at 0.23-0.47M params; the FoE param-efficient recombination targets that hr at ~1.9k params (~200x fewer). (2) FAILURE MODE: N/A onboarding; goal = does the Mayo-evolved FoE+bilateral seed RUN on breast 128-view 512^2 and clear the sparse-view FBP baseline (hr>0). (3) ONE KNOB: N/A baseline seed = Mayo iter-25/27 champion arch (FoE nf24/k7 + M=3 bilateral bank ON TOP), proj-filter OFF (turned on later as the sparse-view lever). (4) HYPOTHESIS: FoE+bilateral (1,932 params, K=5 DC unroll, FBP warm-start) clears breast FBP (hr>0) and lands hr ~0.4-0.6 in one 18-min run, because unrolled data-consistency is the strong-performer trait on breast and the FBP init leaves large sparse-view headroom -- but 200x fewer params than the DL tier means it will START well below 0.88 and the projection-domain + anisotropic streak levers (dormant here) are the sparse-view-specific gains to add next. (5) BUDGET: train_n=800 x FoE K=5 unroll at 512^2, bs=4, hard max_train_s=1080 backstop + 200-slice val pass; breast uses ONE shared PYRO-NN projector (no per-sample-ps) -> well inside 20 min. (6) Loop continues STRICT SERIAL; iter-2 self-dispatched on landing. AGENT4CT_SAVE_RECON -> dashboard iter dir so recon_raw.npz (pred/truth/baseline) lands where rescore reads it.", "reg_type": "foe", "seed": 42, "train_n": 800, "val_n": 200}, "challenge": "breast_ct", "change_class": "architecture", "git_commit": "671da566", "images": {"comparison": "runs/breast-ct-claude-agentic-param-efficient-search-20260703-01/iterations/iter-0001/comparison.png", "test_showcase": null, "valtest_showcase": null}, "iter": 1, "kept": true, "metrics": {"headroom": 0.263540794362072, "headroom_std": 0.024661617912453374, "val_psnr": 38.98122024536133, "val_psnr_std": 0.327474758489529, "val_rmse": 0.003840107237920165, "val_rmse_std": 0.00013258404021013081, "val_ssim": 0.987461507320404, "val_ssim_std": 0.0024836810725645227}, "model": "claude-opus-4-8-1m", "obs_path": "breast-ct-claude-agentic-param-efficient-search-20260703-01/iterations/iter-0001/observation.json", "obs_sha1": "a3c3f49bf42a16164e350cf8184d590f71abc40b", "params_M": 0.001933, "params_source": "observation", "rationale": "param_efficient-claude-agentic: reg_type=foe, bilateral_on_top=True, proj_filter_on=False, n_iter=5, learnable_alpha=True, alpha_init=0.1, foe_n_filters=24, foe_kernel=7, foe_n_bumps=31, n_bf=3, bf_multiscale=True, bf_sigmas=[0.8, 1.6, 3.2], bf_kernel=7, bf_sigma_r=0.02, bf_gain_init=0.0, epochs=16, cosine_lr=True, lr=0.005, max_train_s=1080, batch_size=4, train_n=800, val_n=200, display_min=0.0, display_max=0.05, seed=42, rationale=iter-1 ONBOARDING of param_efficient (FoE unrolled prox-gradient + DC, K=5, + multi-RF PARALLEL bilateral bank, zero-init gains) on the re-split Breast-CT (train 3600/val 200/test 200, seed 20260703; 128-view SPARSE). 1,932 reg params. SIX-BOX: (1) PRIOR: none (first iter); cross-solver evidence: DL tier (ItNet/DD-UNet) plateaus val hr ~0.88 at 0.23-0.47M params; the FoE param-efficient recombination targets that hr at ~1.9k params (~200x fewer). (2) FAILURE MODE: N/A onboarding; goal = does the Mayo-evolved FoE+bilateral seed RUN on breast 128-view 512^2 and clear the sparse-view FBP baseline (hr>0). (3) ONE KNOB: N/A baseline seed = Mayo iter-25/27 champion arch (FoE nf24/k7 + M=3 bilateral bank ON TOP), proj-filter OFF (turned on later as the sparse-view lever). (4) HYPOTHESIS: FoE+bilateral (1,932 params, K=5 DC unroll, FBP warm-start) clears breast FBP (hr>0) and lands hr ~0.4-0.6 in one 18-min run, because unrolled data-consistency is the strong-performer trait on breast and the FBP init leaves large sparse-view headroom -- but 200x fewer params than the DL tier means it will START well below 0.88 and the projection-domain + anisotropic streak levers (dormant here) are the sparse-view-specific gains to add next. (5) BUDGET: train_n=800 x FoE K=5 unroll at 512^2, bs=4, hard max_train_s=1080 backstop + 200-slice val pass; breast uses ONE shared PYRO-NN projector (no per-sample-ps) -> well inside 20 min. (6) Loop continues STRICT SERIAL; iter-2 self-dispatched on landing. AGENT4CT_SAVE_RECON -> dashboard iter dir so recon_raw.npz (pred/truth/baseline) lands where rescore reads it.", "run_id": "breast-ct-claude-agentic-param-efficient-search-20260703-01", "runtime": {"elapsed_s": 1284.2200210094452}, "schema_version": 3, "solver_key": "param-efficient", "solver_name": "Param-efficient (evolved)", "split": {"train_n": 800, "val_n": 200}, "status": "keep", "ts": "2026-07-06T14:46:04Z"}
{"advice_for_others": "param_efficient-claude-agentic: reg_type=foe, bilateral_on_top=True, proj_filter_on=False, n_iter=5, learnable_alpha=True, alpha_init=0.1, foe_n_filters=24, foe_kernel=7, foe_n_bumps=31, n_bf=3, bf_multiscale=True, bf_sigmas=[0.8, 1.6, 3.2], bf_kernel=7, bf_sigma_r=0.02, bf_gain_init=0.0, epochs=16, cosine_lr=True, lr=0.005, max_train_s=1080, batch_size=4, train_n=200, val_n=200, display_min=0.0, display_max=0.05, seed=42, rationale=iter-2 param_efficient breast (FoE K=5 DC unroll + M=3 bilateral bank, 1,933 params). SIX-BOX: (1) PRIOR: iter-1 hr 0.2635 ssim 0.9875 @ 1,933 params, but training WALL-CUT at epoch 3/16 (loss 2.05e-4 -> 2.35e-5 -> 2.02e-5 STILL dropping; bilateral gains 0.94 -> 1.53 -> 1.81 STILL climbing at cutoff) => compute-starved, NOT an arch ceiling. (2) FAILURE MODE: undertraining -- the FoE unroll at train_n=800/bs4/512^2 fits only 3/16 epochs in the 1080s wall; the anneal never completes. (3) ONE KNOB: train_n 800->200 (Mayo proven value); all else byte-for-byte iter-1. (4) HYPOTHESIS: at train_n=200 ~4x more epochs (~12/16) fit the SAME 1080s wall, so the cosine anneal completes and hr rises WELL past 0.2635, because iter-1 was compute-starved not data-starved (200 breast phantoms trained the DL tier fine). ZERO extra params. (5) BUDGET: train_n=200 x K=5 unroll bs4 + 200-val pass, 1080s backstop => <20min. (6) SERIAL; iter-3 self-dispatches on landing (next lever = the Manduca PROJECTION filter, the sparse-view-specific gain dormant here).", "agent": "param_efficient-claude-agentic", "campaign": "search-20260703-01", "cfg_full": {"alpha_init": 0.1, "batch_size": 4, "bf_gain_init": 0.0, "bf_kernel": 7, "bf_multiscale": true, "bf_sigma_r": 0.02, "bf_sigmas": [0.8, 1.6, 3.2], "bilateral_on_top": true, "cosine_lr": true, "display_max": 0.05, "display_min": 0.0, "epochs": 16, "foe_kernel": 7, "foe_n_bumps": 31, "foe_n_filters": 24, "learnable_alpha": true, "lr": 0.005, "max_train_s": 1080, "n_bf": 3, "n_iter": 5, "proj_filter_on": false, "rationale": "iter-2 param_efficient breast (FoE K=5 DC unroll + M=3 bilateral bank, 1,933 params). SIX-BOX: (1) PRIOR: iter-1 hr 0.2635 ssim 0.9875 @ 1,933 params, but training WALL-CUT at epoch 3/16 (loss 2.05e-4 -> 2.35e-5 -> 2.02e-5 STILL dropping; bilateral gains 0.94 -> 1.53 -> 1.81 STILL climbing at cutoff) => compute-starved, NOT an arch ceiling. (2) FAILURE MODE: undertraining -- the FoE unroll at train_n=800/bs4/512^2 fits only 3/16 epochs in the 1080s wall; the anneal never completes. (3) ONE KNOB: train_n 800->200 (Mayo proven value); all else byte-for-byte iter-1. (4) HYPOTHESIS: at train_n=200 ~4x more epochs (~12/16) fit the SAME 1080s wall, so the cosine anneal completes and hr rises WELL past 0.2635, because iter-1 was compute-starved not data-starved (200 breast phantoms trained the DL tier fine). ZERO extra params. (5) BUDGET: train_n=200 x K=5 unroll bs4 + 200-val pass, 1080s backstop => <20min. (6) SERIAL; iter-3 self-dispatches on landing (next lever = the Manduca PROJECTION filter, the sparse-view-specific gain dormant here).", "reg_type": "foe", "seed": 42, "train_n": 200, "val_n": 200}, "challenge": "breast_ct", "change_class": "architecture", "git_commit": "671da566", "images": {"comparison": "runs/breast-ct-claude-agentic-param-efficient-search-20260703-01/iterations/iter-0002/comparison.png", "test_showcase": null, "valtest_showcase": null}, "iter": 2, "kept": true, "metrics": {"headroom": 0.1896760990245311, "headroom_std": 0.0317090881168139, "val_psnr": 38.151023864746094, "val_psnr_std": 0.2975369815684068, "val_rmse": 0.004225258715450764, "val_rmse_std": 0.00012806619606929294, "val_ssim": 0.9853028655052185, "val_ssim_std": 0.002426372429704161}, "model": "claude-opus-4-8-1m", "obs_path": "breast-ct-claude-agentic-param-efficient-search-20260703-01/iterations/iter-0002/observation.json", "obs_sha1": "1c5ea7e19337f3f76b0e00900774028aee101a11", "params_M": 0.001933, "params_source": "observation", "rationale": "param_efficient-claude-agentic: reg_type=foe, bilateral_on_top=True, proj_filter_on=False, n_iter=5, learnable_alpha=True, alpha_init=0.1, foe_n_filters=24, foe_kernel=7, foe_n_bumps=31, n_bf=3, bf_multiscale=True, bf_sigmas=[0.8, 1.6, 3.2], bf_kernel=7, bf_sigma_r=0.02, bf_gain_init=0.0, epochs=16, cosine_lr=True, lr=0.005, max_train_s=1080, batch_size=4, train_n=200, val_n=200, display_min=0.0, display_max=0.05, seed=42, rationale=iter-2 param_efficient breast (FoE K=5 DC unroll + M=3 bilateral bank, 1,933 params). SIX-BOX: (1) PRIOR: iter-1 hr 0.2635 ssim 0.9875 @ 1,933 params, but training WALL-CUT at epoch 3/16 (loss 2.05e-4 -> 2.35e-5 -> 2.02e-5 STILL dropping; bilateral gains 0.94 -> 1.53 -> 1.81 STILL climbing at cutoff) => compute-starved, NOT an arch ceiling. (2) FAILURE MODE: undertraining -- the FoE unroll at train_n=800/bs4/512^2 fits only 3/16 epochs in the 1080s wall; the anneal never completes. (3) ONE KNOB: train_n 800->200 (Mayo proven value); all else byte-for-byte iter-1. (4) HYPOTHESIS: at train_n=200 ~4x more epochs (~12/16) fit the SAME 1080s wall, so the cosine anneal completes and hr rises WELL past 0.2635, because iter-1 was compute-starved not data-starved (200 breast phantoms trained the DL tier fine). ZERO extra params. (5) BUDGET: train_n=200 x K=5 unroll bs4 + 200-val pass, 1080s backstop => <20min. (6) SERIAL; iter-3 self-dispatches on landing (next lever = the Manduca PROJECTION filter, the sparse-view-specific gain dormant here).", "run_id": "breast-ct-claude-agentic-param-efficient-search-20260703-01", "runtime": {"elapsed_s": 1164.0383315086365}, "schema_version": 3, "solver_key": "param-efficient", "solver_name": "Param-efficient (evolved)", "split": {"train_n": 200, "val_n": 200}, "status": "keep", "ts": "2026-07-06T15:38:40Z"}
{"advice_for_others": "param_efficient-claude-agentic: reg_type=foe, bilateral_on_top=True, proj_filter_on=False, n_iter=5, learnable_alpha=True, alpha_init=0.5, foe_n_filters=24, foe_kernel=7, foe_n_bumps=31, n_bf=3, bf_multiscale=True, bf_sigmas=[0.8, 1.6, 3.2], bf_kernel=7, bf_sigma_r=0.02, bf_gain_init=0.0, epochs=16, cosine_lr=True, lr=0.005, max_train_s=1080, batch_size=4, train_n=200, val_n=200, display_min=0.0, display_max=0.05, seed=42, rationale=iter-3 param_efficient breast. SIX-BOX: (1) PRIOR: iter-1 hr 0.2635 (3 epochs, reg barely engaged) BEAT iter-2 hr 0.1897 (11 epochs, reg fully engaged, train-loss monotonically down while val hr FELL). Diagnosis: the DC step is a GENUINE projector round-trip dc=R^T(Rx-g)/dc_norm, but with K=5 tied steps at weak alpha~0.09 five GD-DC steps cannot null the sparse-view streak residual, while the FoE+bilateral reg over-smooths every step -> the reg WINS as training proceeds. Data-consistency is the differentiator (coordinator: VN 0.63 @ 9k, LPD 0.68 -- genuine DC; image-domain-only caps ~0.28). Our DC is present but TOO WEAK relative to reg over K=5. (2) FAILURE MODE: under-consistency -- streaks survive because the GD-DC step size is too small to enforce Rx=g in 5 tied steps; reg dominates. (3) ONE KNOB: alpha_init 0.1 -> 0.5 (5x stronger DC/prox step). All else byte-for-byte iter-2 (train_n=200, K=5, FoE+M3 bilateral). (4) HYPOTHESIS: a 5x stronger step drives Rx toward g much harder per iteration, so the 5 unrolled steps actually remove streaks before the reg smooths them -> hr rises well past 0.2635, because DC-strength (not reg cleverness) is the sparse-view lever. Risk: too-strong alpha can diverge (dc_norm scaling keeps grad O(1), softplus keeps alpha>0); grad_clip=1 guards. ZERO extra params. (5) BUDGET: train_n=200 K=5 bs4 + 200-val, 1080s backstop -> <20min. (6) SERIAL; iter-4 self-dispatches (next: projection-domain filter ON -- sparse-view-native).", "agent": "param_efficient-claude-agentic", "campaign": "search-20260703-01", "cfg_full": {"alpha_init": 0.5, "batch_size": 4, "bf_gain_init": 0.0, "bf_kernel": 7, "bf_multiscale": true, "bf_sigma_r": 0.02, "bf_sigmas": [0.8, 1.6, 3.2], "bilateral_on_top": true, "cosine_lr": true, "display_max": 0.05, "display_min": 0.0, "epochs": 16, "foe_kernel": 7, "foe_n_bumps": 31, "foe_n_filters": 24, "learnable_alpha": true, "lr": 0.005, "max_train_s": 1080, "n_bf": 3, "n_iter": 5, "proj_filter_on": false, "rationale": "iter-3 param_efficient breast. SIX-BOX: (1) PRIOR: iter-1 hr 0.2635 (3 epochs, reg barely engaged) BEAT iter-2 hr 0.1897 (11 epochs, reg fully engaged, train-loss monotonically down while val hr FELL). Diagnosis: the DC step is a GENUINE projector round-trip dc=R^T(Rx-g)/dc_norm, but with K=5 tied steps at weak alpha~0.09 five GD-DC steps cannot null the sparse-view streak residual, while the FoE+bilateral reg over-smooths every step -> the reg WINS as training proceeds. Data-consistency is the differentiator (coordinator: VN 0.63 @ 9k, LPD 0.68 -- genuine DC; image-domain-only caps ~0.28). Our DC is present but TOO WEAK relative to reg over K=5. (2) FAILURE MODE: under-consistency -- streaks survive because the GD-DC step size is too small to enforce Rx=g in 5 tied steps; reg dominates. (3) ONE KNOB: alpha_init 0.1 -> 0.5 (5x stronger DC/prox step). All else byte-for-byte iter-2 (train_n=200, K=5, FoE+M3 bilateral). (4) HYPOTHESIS: a 5x stronger step drives Rx toward g much harder per iteration, so the 5 unrolled steps actually remove streaks before the reg smooths them -> hr rises well past 0.2635, because DC-strength (not reg cleverness) is the sparse-view lever. Risk: too-strong alpha can diverge (dc_norm scaling keeps grad O(1), softplus keeps alpha>0); grad_clip=1 guards. ZERO extra params. (5) BUDGET: train_n=200 K=5 bs4 + 200-val, 1080s backstop -> <20min. (6) SERIAL; iter-4 self-dispatches (next: projection-domain filter ON -- sparse-view-native).", "reg_type": "foe", "seed": 42, "train_n": 200, "val_n": 200}, "challenge": "breast_ct", "change_class": "architecture", "git_commit": "671da566", "images": {"comparison": "runs/breast-ct-claude-agentic-param-efficient-search-20260703-01/iterations/iter-0003/comparison.png", "test_showcase": null, "valtest_showcase": null}, "iter": 3, "kept": false, "metrics": {"headroom": 0.0, "headroom_std": 0.0, "val_psnr": 29.034774780273438, "val_psnr_std": 0.9546723278964957, "val_rmse": 0.012068845331668854, "val_rmse_std": 0.001240968645370239, "val_ssim": 0.94614177942276, "val_ssim_std": 0.011417413356640779}, "model": "claude-opus-4-8-1m", "obs_path": "breast-ct-claude-agentic-param-efficient-search-20260703-01/iterations/iter-0003/observation.json", "obs_sha1": "2181e0051013262f6e70c8c0e0e9ab837c7371d9", "params_M": 0.001933, "params_source": "observation", "rationale": "param_efficient-claude-agentic: reg_type=foe, bilateral_on_top=True, proj_filter_on=False, n_iter=5, learnable_alpha=True, alpha_init=0.5, foe_n_filters=24, foe_kernel=7, foe_n_bumps=31, n_bf=3, bf_multiscale=True, bf_sigmas=[0.8, 1.6, 3.2], bf_kernel=7, bf_sigma_r=0.02, bf_gain_init=0.0, epochs=16, cosine_lr=True, lr=0.005, max_train_s=1080, batch_size=4, train_n=200, val_n=200, display_min=0.0, display_max=0.05, seed=42, rationale=iter-3 param_efficient breast. SIX-BOX: (1) PRIOR: iter-1 hr 0.2635 (3 epochs, reg barely engaged) BEAT iter-2 hr 0.1897 (11 epochs, reg fully engaged, train-loss monotonically down while val hr FELL). Diagnosis: the DC step is a GENUINE projector round-trip dc=R^T(Rx-g)/dc_norm, but with K=5 tied steps at weak alpha~0.09 five GD-DC steps cannot null the sparse-view streak residual, while the FoE+bilateral reg over-smooths every step -> the reg WINS as training proceeds. Data-consistency is the differentiator (coordinator: VN 0.63 @ 9k, LPD 0.68 -- genuine DC; image-domain-only caps ~0.28). Our DC is present but TOO WEAK relative to reg over K=5. (2) FAILURE MODE: under-consistency -- streaks survive because the GD-DC step size is too small to enforce Rx=g in 5 tied steps; reg dominates. (3) ONE KNOB: alpha_init 0.1 -> 0.5 (5x stronger DC/prox step). All else byte-for-byte iter-2 (train_n=200, K=5, FoE+M3 bilateral). (4) HYPOTHESIS: a 5x stronger step drives Rx toward g much harder per iteration, so the 5 unrolled steps actually remove streaks before the reg smooths them -> hr rises well past 0.2635, because DC-strength (not reg cleverness) is the sparse-view lever. Risk: too-strong alpha can diverge (dc_norm scaling keeps grad O(1), softplus keeps alpha>0); grad_clip=1 guards. ZERO extra params. (5) BUDGET: train_n=200 K=5 bs4 + 200-val, 1080s backstop -> <20min. (6) SERIAL; iter-4 self-dispatches (next: projection-domain filter ON -- sparse-view-native).", "run_id": "breast-ct-claude-agentic-param-efficient-search-20260703-01", "runtime": {"elapsed_s": 1163.516711473465}, "schema_version": 3, "solver_key": "param-efficient", "solver_name": "Param-efficient (evolved)", "split": {"train_n": 200, "val_n": 200}, "status": "discard", "ts": "2026-07-06T16:09:23Z"}
