{"advice_for_others": "fastdiff_wdm_wavelet_unconstrained-claude-agentic: val_n=200, seed=42, fd_recon_ckpt=/cluster/maier/Agent4CT/checkpoints/fast_diffusion_wavelet_breast.pt, fd_recon_steps=8, fd_recon_init=fbp, fd_recon_init_t=0.4, fd_recon_eta=1.0, fd_recon_dc=0, fd_recon_dc_n_cg=5, fd_recon_dc_relax=0.5, dataset_kind=breast_ct, rationale=iter-2 INIT_T lever, breast-native wdm-wavelet UNCONSTRAINED (DC OFF, fd_recon_dc=0). SIX-BOX: (1) PRIOR: iter-1 (init_t=0.7) hr=0.0, calibrated masked rmse=0.02248, psnr=23.63, ssim=0.856 -- prior regenerates too much at high embed time, drifts above the calibrated FBP floor. (2) Failure mode: at init_t=0.7 the FBP warm-start is embedded deep in noise so the few-step flow reconstructs mostly from the prior; with the hard CG DC projection OFF only DPS soft-guidance enforces the sinogram -> under-constrained, RMSE too high. (3) ONE KNOB: fd_recon_init_t 0.7->0.4 (retain more FBP structure), all else identical. (4) HYPOTHESIS: lower init_t keeps more of the strong 128-view FBP so calibrated RMSE drops toward the floor; the DC-on sibling found t=0.4 best, so this is the fair single-knob comparison. If hr still 0, prior-alone (no DC) is structurally below the calibrated FBP baseline -- the intended finding. (5) BUDGET: iter-1 ran <5min. (6) Loop continues.", "agent": "fastdiff_wdm_wavelet_unconstrained-claude-agentic", "campaign": "search-20260703-01", "cfg_full": {"dataset_kind": "breast_ct", "fd_recon_ckpt": "/cluster/maier/Agent4CT/checkpoints/fast_diffusion_wavelet_breast.pt", "fd_recon_dc": 0, "fd_recon_dc_n_cg": 5, "fd_recon_dc_relax": 0.5, "fd_recon_eta": 1.0, "fd_recon_init": "fbp", "fd_recon_init_t": 0.4, "fd_recon_steps": 8, "rationale": "iter-2 INIT_T lever, breast-native wdm-wavelet UNCONSTRAINED (DC OFF, fd_recon_dc=0). SIX-BOX: (1) PRIOR: iter-1 (init_t=0.7) hr=0.0, calibrated masked rmse=0.02248, psnr=23.63, ssim=0.856 -- prior regenerates too much at high embed time, drifts above the calibrated FBP floor. (2) Failure mode: at init_t=0.7 the FBP warm-start is embedded deep in noise so the few-step flow reconstructs mostly from the prior; with the hard CG DC projection OFF only DPS soft-guidance enforces the sinogram -> under-constrained, RMSE too high. (3) ONE KNOB: fd_recon_init_t 0.7->0.4 (retain more FBP structure), all else identical. (4) HYPOTHESIS: lower init_t keeps more of the strong 128-view FBP so calibrated RMSE drops toward the floor; the DC-on sibling found t=0.4 best, so this is the fair single-knob comparison. If hr still 0, prior-alone (no DC) is structurally below the calibrated FBP baseline -- the intended finding. (5) BUDGET: iter-1 ran <5min. (6) Loop continues.", "seed": 42, "val_n": 200}, "challenge": "breast_ct", "change_class": "architecture", "git_commit": "671da566", "images": {"comparison": "runs/breast-ct-claude-agentic-fastdiff-wdm-wavelet-unconstrained-search-20260703-01/iterations/iter-0002/comparison.png", "test_showcase": null, "valtest_showcase": null}, "iter": 2, "kept": false, "metrics": {"headroom": 0.0, "headroom_std": 0.0, "val_psnr": 27.568864822387695, "val_psnr_std": 0.5083544652899029, "val_rmse": 0.014287663623690605, "val_rmse_std": 0.0007986987073728811, "val_ssim": 0.7125030159950256, "val_ssim_std": 0.007472231454528199}, "model": "claude-opus-4-8-1m", "obs_path": "breast-ct-claude-agentic-fastdiff-wdm-wavelet-unconstrained-search-20260703-01/iterations/iter-0002/observation.json", "obs_sha1": "dd6aa78a8822da6d29b08ae9a5dc3516f80308b5", "params_M": 3.824908, "params_source": "observation", "rationale": "fastdiff_wdm_wavelet_unconstrained-claude-agentic: val_n=200, seed=42, fd_recon_ckpt=/cluster/maier/Agent4CT/checkpoints/fast_diffusion_wavelet_breast.pt, fd_recon_steps=8, fd_recon_init=fbp, fd_recon_init_t=0.4, fd_recon_eta=1.0, fd_recon_dc=0, fd_recon_dc_n_cg=5, fd_recon_dc_relax=0.5, dataset_kind=breast_ct, rationale=iter-2 INIT_T lever, breast-native wdm-wavelet UNCONSTRAINED (DC OFF, fd_recon_dc=0). SIX-BOX: (1) PRIOR: iter-1 (init_t=0.7) hr=0.0, calibrated masked rmse=0.02248, psnr=23.63, ssim=0.856 -- prior regenerates too much at high embed time, drifts above the calibrated FBP floor. (2) Failure mode: at init_t=0.7 the FBP warm-start is embedded deep in noise so the few-step flow reconstructs mostly from the prior; with the hard CG DC projection OFF only DPS soft-guidance enforces the sinogram -> under-constrained, RMSE too high. (3) ONE KNOB: fd_recon_init_t 0.7->0.4 (retain more FBP structure), all else identical. (4) HYPOTHESIS: lower init_t keeps more of the strong 128-view FBP so calibrated RMSE drops toward the floor; the DC-on sibling found t=0.4 best, so this is the fair single-knob comparison. If hr still 0, prior-alone (no DC) is structurally below the calibrated FBP baseline -- the intended finding. (5) BUDGET: iter-1 ran <5min. (6) Loop continues.", "run_id": "breast-ct-claude-agentic-fastdiff-wdm-wavelet-unconstrained-search-20260703-01", "runtime": {"elapsed_s": 100.36620235443115}, "schema_version": 3, "solver_key": "fastdiff-wdm-wavelet-unconstrained", "solver_name": "Fast-diffusion WDM (wavelet, unconstrained)", "split": {"train_n": 3600, "val_n": 200}, "status": "discard", "ts": "2026-07-07T01:21:05Z"}
{"advice_for_others": "fastdiff_wdm_wavelet_unconstrained-claude-agentic: val_n=200, seed=42, fd_recon_ckpt=/cluster/maier/Agent4CT/checkpoints/fast_diffusion_wavelet_breast.pt, fd_recon_steps=8, fd_recon_init=fbp, fd_recon_init_t=0.2, fd_recon_eta=1.0, fd_recon_dc=0, fd_recon_dc_n_cg=5, fd_recon_dc_relax=0.5, dataset_kind=breast_ct, rationale=iter-3 INIT_T lever continued, breast-native wdm-wavelet UNCONSTRAINED (DC OFF). SIX-BOX: (1) PRIOR: iter-1 t=0.7 rmse=0.02248; iter-2 t=0.4 rmse=0.01429 (big drop) -- lowering init_t monotonically improves calibrated RMSE by retaining more of the strong 128-view FBP. Both hr=0. (2) Failure mode: with DC-projection OFF the prior term still perturbs the FBP away from the data manifold; less embedding (lower t) = less prior drift. (3) ONE KNOB: fd_recon_init_t 0.4->0.2. (4) HYPOTHESIS: t=0.2 retains still more FBP -> RMSE drops further toward the calibrated FBP floor; tests whether prior-alone can asymptotically REACH but not BEAT baseline (hr->0 from above). If rmse plateaus above baseline, confirms prior-without-DC is net-neutral-to-harmful on sparse breast. (5) BUDGET: <5min. (6) Loop continues.", "agent": "fastdiff_wdm_wavelet_unconstrained-claude-agentic", "campaign": "search-20260703-01", "cfg_full": {"dataset_kind": "breast_ct", "fd_recon_ckpt": "/cluster/maier/Agent4CT/checkpoints/fast_diffusion_wavelet_breast.pt", "fd_recon_dc": 0, "fd_recon_dc_n_cg": 5, "fd_recon_dc_relax": 0.5, "fd_recon_eta": 1.0, "fd_recon_init": "fbp", "fd_recon_init_t": 0.2, "fd_recon_steps": 8, "rationale": "iter-3 INIT_T lever continued, breast-native wdm-wavelet UNCONSTRAINED (DC OFF). SIX-BOX: (1) PRIOR: iter-1 t=0.7 rmse=0.02248; iter-2 t=0.4 rmse=0.01429 (big drop) -- lowering init_t monotonically improves calibrated RMSE by retaining more of the strong 128-view FBP. Both hr=0. (2) Failure mode: with DC-projection OFF the prior term still perturbs the FBP away from the data manifold; less embedding (lower t) = less prior drift. (3) ONE KNOB: fd_recon_init_t 0.4->0.2. (4) HYPOTHESIS: t=0.2 retains still more FBP -> RMSE drops further toward the calibrated FBP floor; tests whether prior-alone can asymptotically REACH but not BEAT baseline (hr->0 from above). If rmse plateaus above baseline, confirms prior-without-DC is net-neutral-to-harmful on sparse breast. (5) BUDGET: <5min. (6) Loop continues.", "seed": 42, "val_n": 200}, "challenge": "breast_ct", "change_class": "architecture", "git_commit": "671da566", "images": {"comparison": "runs/breast-ct-claude-agentic-fastdiff-wdm-wavelet-unconstrained-search-20260703-01/iterations/iter-0003/comparison.png", "test_showcase": null, "valtest_showcase": null}, "iter": 3, "kept": false, "metrics": {"headroom": 0.0, "headroom_std": 0.0, "val_psnr": 25.054370880126953, "val_psnr_std": 0.18824662013146304, "val_rmse": 0.01908472739160061, "val_rmse_std": 0.00024517311007818475, "val_ssim": 0.5664541721343994, "val_ssim_std": 0.005241194961097579}, "model": "claude-opus-4-8-1m", "obs_path": "breast-ct-claude-agentic-fastdiff-wdm-wavelet-unconstrained-search-20260703-01/iterations/iter-0003/observation.json", "obs_sha1": "0b7090262a28f03cfc1638eee19358b0dbfd77a7", "params_M": 3.824908, "params_source": "observation", "rationale": "fastdiff_wdm_wavelet_unconstrained-claude-agentic: val_n=200, seed=42, fd_recon_ckpt=/cluster/maier/Agent4CT/checkpoints/fast_diffusion_wavelet_breast.pt, fd_recon_steps=8, fd_recon_init=fbp, fd_recon_init_t=0.2, fd_recon_eta=1.0, fd_recon_dc=0, fd_recon_dc_n_cg=5, fd_recon_dc_relax=0.5, dataset_kind=breast_ct, rationale=iter-3 INIT_T lever continued, breast-native wdm-wavelet UNCONSTRAINED (DC OFF). SIX-BOX: (1) PRIOR: iter-1 t=0.7 rmse=0.02248; iter-2 t=0.4 rmse=0.01429 (big drop) -- lowering init_t monotonically improves calibrated RMSE by retaining more of the strong 128-view FBP. Both hr=0. (2) Failure mode: with DC-projection OFF the prior term still perturbs the FBP away from the data manifold; less embedding (lower t) = less prior drift. (3) ONE KNOB: fd_recon_init_t 0.4->0.2. (4) HYPOTHESIS: t=0.2 retains still more FBP -> RMSE drops further toward the calibrated FBP floor; tests whether prior-alone can asymptotically REACH but not BEAT baseline (hr->0 from above). If rmse plateaus above baseline, confirms prior-without-DC is net-neutral-to-harmful on sparse breast. (5) BUDGET: <5min. (6) Loop continues.", "run_id": "breast-ct-claude-agentic-fastdiff-wdm-wavelet-unconstrained-search-20260703-01", "runtime": {"elapsed_s": 93.10051894187927}, "schema_version": 3, "solver_key": "fastdiff-wdm-wavelet-unconstrained", "solver_name": "Fast-diffusion WDM (wavelet, unconstrained)", "split": {"train_n": 3600, "val_n": 200}, "status": "discard", "ts": "2026-07-07T01:23:20Z"}
{"advice_for_others": "fastdiff_wdm_wavelet_unconstrained-claude-agentic: val_n=200, seed=42, fd_recon_ckpt=/cluster/maier/Agent4CT/checkpoints/fast_diffusion_wavelet_breast.pt, fd_recon_steps=8, fd_recon_init=fbp, fd_recon_init_t=0.5, fd_recon_eta=1.0, fd_recon_dc=0, fd_recon_dc_n_cg=5, fd_recon_dc_relax=0.5, dataset_kind=breast_ct, rationale=iter-4 INIT_T bracket, breast-native wdm-wavelet UNCONSTRAINED (DC OFF). SIX-BOX: (1) PRIOR: init_t sweep is NON-monotonic -- t=0.7 rmse0.02248, t=0.4 rmse0.01429 (BEST), t=0.2 rmse0.01908. Minimum near t=0.4. All hr=0. (2) Failure mode: at very low t=0.2 the shallow embedding + 8 Euler steps over a tiny t-range over-applies DPS (noise-dir recovery /max(t,eps) blows up), degrading rmse & ssim; at high t the prior over-regenerates. Sweet spot ~0.4. (3) ONE KNOB: fd_recon_init_t 0.4->0.5 (bracket the high side of the minimum). (4) HYPOTHESIS: t=0.5 rmse sits between t=0.4 and t=0.7; confirms 0.4 is near-optimal so the eta/steps levers (iters 5+) take over. (5) BUDGET: <5min. (6) Loop continues.", "agent": "fastdiff_wdm_wavelet_unconstrained-claude-agentic", "campaign": "search-20260703-01", "cfg_full": {"dataset_kind": "breast_ct", "fd_recon_ckpt": "/cluster/maier/Agent4CT/checkpoints/fast_diffusion_wavelet_breast.pt", "fd_recon_dc": 0, "fd_recon_dc_n_cg": 5, "fd_recon_dc_relax": 0.5, "fd_recon_eta": 1.0, "fd_recon_init": "fbp", "fd_recon_init_t": 0.5, "fd_recon_steps": 8, "rationale": "iter-4 INIT_T bracket, breast-native wdm-wavelet UNCONSTRAINED (DC OFF). SIX-BOX: (1) PRIOR: init_t sweep is NON-monotonic -- t=0.7 rmse0.02248, t=0.4 rmse0.01429 (BEST), t=0.2 rmse0.01908. Minimum near t=0.4. All hr=0. (2) Failure mode: at very low t=0.2 the shallow embedding + 8 Euler steps over a tiny t-range over-applies DPS (noise-dir recovery /max(t,eps) blows up), degrading rmse & ssim; at high t the prior over-regenerates. Sweet spot ~0.4. (3) ONE KNOB: fd_recon_init_t 0.4->0.5 (bracket the high side of the minimum). (4) HYPOTHESIS: t=0.5 rmse sits between t=0.4 and t=0.7; confirms 0.4 is near-optimal so the eta/steps levers (iters 5+) take over. (5) BUDGET: <5min. (6) Loop continues.", "seed": 42, "val_n": 200}, "challenge": "breast_ct", "change_class": "architecture", "git_commit": "671da566", "images": {"comparison": "runs/breast-ct-claude-agentic-fastdiff-wdm-wavelet-unconstrained-search-20260703-01/iterations/iter-0004/comparison.png", "test_showcase": null, "valtest_showcase": null}, "iter": 4, "kept": false, "metrics": {"headroom": 0.0, "headroom_std": 0.0, "val_psnr": 27.997177124023438, "val_psnr_std": 1.011593429412414, "val_rmse": 0.013600211590528488, "val_rmse_std": 0.0017334096070171679, "val_ssim": 0.7864111065864563, "val_ssim_std": 0.009602544953197832}, "model": "claude-opus-4-8-1m", "obs_path": "breast-ct-claude-agentic-fastdiff-wdm-wavelet-unconstrained-search-20260703-01/iterations/iter-0004/observation.json", "obs_sha1": "1e75c017bcad489246feea0783f947098cce4485", "params_M": 3.824908, "params_source": "observation", "rationale": "fastdiff_wdm_wavelet_unconstrained-claude-agentic: val_n=200, seed=42, fd_recon_ckpt=/cluster/maier/Agent4CT/checkpoints/fast_diffusion_wavelet_breast.pt, fd_recon_steps=8, fd_recon_init=fbp, fd_recon_init_t=0.5, fd_recon_eta=1.0, fd_recon_dc=0, fd_recon_dc_n_cg=5, fd_recon_dc_relax=0.5, dataset_kind=breast_ct, rationale=iter-4 INIT_T bracket, breast-native wdm-wavelet UNCONSTRAINED (DC OFF). SIX-BOX: (1) PRIOR: init_t sweep is NON-monotonic -- t=0.7 rmse0.02248, t=0.4 rmse0.01429 (BEST), t=0.2 rmse0.01908. Minimum near t=0.4. All hr=0. (2) Failure mode: at very low t=0.2 the shallow embedding + 8 Euler steps over a tiny t-range over-applies DPS (noise-dir recovery /max(t,eps) blows up), degrading rmse & ssim; at high t the prior over-regenerates. Sweet spot ~0.4. (3) ONE KNOB: fd_recon_init_t 0.4->0.5 (bracket the high side of the minimum). (4) HYPOTHESIS: t=0.5 rmse sits between t=0.4 and t=0.7; confirms 0.4 is near-optimal so the eta/steps levers (iters 5+) take over. (5) BUDGET: <5min. (6) Loop continues.", "run_id": "breast-ct-claude-agentic-fastdiff-wdm-wavelet-unconstrained-search-20260703-01", "runtime": {"elapsed_s": 92.72800540924072}, "schema_version": 3, "solver_key": "fastdiff-wdm-wavelet-unconstrained", "solver_name": "Fast-diffusion WDM (wavelet, unconstrained)", "split": {"train_n": 3600, "val_n": 200}, "status": "discard", "ts": "2026-07-07T01:25:27Z"}
{"advice_for_others": "fastdiff_wdm_wavelet_unconstrained-claude-agentic: val_n=200, seed=42, fd_recon_ckpt=/cluster/maier/Agent4CT/checkpoints/fast_diffusion_wavelet_breast.pt, fd_recon_steps=8, fd_recon_init=fbp, fd_recon_init_t=0.5, fd_recon_eta=2.0, fd_recon_dc=0, fd_recon_dc_n_cg=5, fd_recon_dc_relax=0.5, dataset_kind=breast_ct, rationale=iter-5 ETA (DPS soft-DC strength) lever, breast-native wdm-wavelet UNCONSTRAINED (DC OFF). SIX-BOX: (1) PRIOR: init_t minimum at t=0.5 (rmse0.01360, BEST) > t=0.4(0.01429) > t=0.2(0.01908) > t=0.7(0.02248). Locked t=0.5. All hr=0; best rmse ~2.6x the calibrated FBP floor. (2) Failure mode: with the hard CG DC-projection OFF, the ONLY sinogram-fidelity term is the DPS soft gradient scaled by eta; at eta=1.0 it is too weak to pull the prior-perturbed estimate back onto the measured 128-view data. (3) ONE KNOB: fd_recon_eta 1.0->2.0 at locked t=0.5, steps=8. (4) HYPOTHESIS: stronger DPS guidance lowers calibrated RMSE toward the FBP floor; this is the closest DC-off can come to emulating the DC-on data term. If even 2x eta cannot clear hr>0, it confirms DPS-alone (no hard CG) is structurally below baseline on sparse breast -- the intended contrast vs the DC-on sibling. (5) BUDGET: <5min. (6) Loop continues.", "agent": "fastdiff_wdm_wavelet_unconstrained-claude-agentic", "campaign": "search-20260703-01", "cfg_full": {"dataset_kind": "breast_ct", "fd_recon_ckpt": "/cluster/maier/Agent4CT/checkpoints/fast_diffusion_wavelet_breast.pt", "fd_recon_dc": 0, "fd_recon_dc_n_cg": 5, "fd_recon_dc_relax": 0.5, "fd_recon_eta": 2.0, "fd_recon_init": "fbp", "fd_recon_init_t": 0.5, "fd_recon_steps": 8, "rationale": "iter-5 ETA (DPS soft-DC strength) lever, breast-native wdm-wavelet UNCONSTRAINED (DC OFF). SIX-BOX: (1) PRIOR: init_t minimum at t=0.5 (rmse0.01360, BEST) > t=0.4(0.01429) > t=0.2(0.01908) > t=0.7(0.02248). Locked t=0.5. All hr=0; best rmse ~2.6x the calibrated FBP floor. (2) Failure mode: with the hard CG DC-projection OFF, the ONLY sinogram-fidelity term is the DPS soft gradient scaled by eta; at eta=1.0 it is too weak to pull the prior-perturbed estimate back onto the measured 128-view data. (3) ONE KNOB: fd_recon_eta 1.0->2.0 at locked t=0.5, steps=8. (4) HYPOTHESIS: stronger DPS guidance lowers calibrated RMSE toward the FBP floor; this is the closest DC-off can come to emulating the DC-on data term. If even 2x eta cannot clear hr>0, it confirms DPS-alone (no hard CG) is structurally below baseline on sparse breast -- the intended contrast vs the DC-on sibling. (5) BUDGET: <5min. (6) Loop continues.", "seed": 42, "val_n": 200}, "challenge": "breast_ct", "change_class": "architecture", "git_commit": "671da566", "images": {"comparison": "runs/breast-ct-claude-agentic-fastdiff-wdm-wavelet-unconstrained-search-20260703-01/iterations/iter-0005/comparison.png", "test_showcase": null, "valtest_showcase": null}, "iter": 5, "kept": false, "metrics": {"headroom": 0.0, "headroom_std": 0.0, "val_psnr": 21.047897338867188, "val_psnr_std": 0.4779516501147514, "val_rmse": 0.030269799754023552, "val_rmse_std": 0.001545212158033851, "val_ssim": 0.45349955558776855, "val_ssim_std": 0.006288259256127725}, "model": "claude-opus-4-8-1m", "obs_path": "breast-ct-claude-agentic-fastdiff-wdm-wavelet-unconstrained-search-20260703-01/iterations/iter-0005/observation.json", "obs_sha1": "057dbbe2e4ec69224585cb6ae679fa4dac4fba9e", "params_M": 3.824908, "params_source": "observation", "rationale": "fastdiff_wdm_wavelet_unconstrained-claude-agentic: val_n=200, seed=42, fd_recon_ckpt=/cluster/maier/Agent4CT/checkpoints/fast_diffusion_wavelet_breast.pt, fd_recon_steps=8, fd_recon_init=fbp, fd_recon_init_t=0.5, fd_recon_eta=2.0, fd_recon_dc=0, fd_recon_dc_n_cg=5, fd_recon_dc_relax=0.5, dataset_kind=breast_ct, rationale=iter-5 ETA (DPS soft-DC strength) lever, breast-native wdm-wavelet UNCONSTRAINED (DC OFF). SIX-BOX: (1) PRIOR: init_t minimum at t=0.5 (rmse0.01360, BEST) > t=0.4(0.01429) > t=0.2(0.01908) > t=0.7(0.02248). Locked t=0.5. All hr=0; best rmse ~2.6x the calibrated FBP floor. (2) Failure mode: with the hard CG DC-projection OFF, the ONLY sinogram-fidelity term is the DPS soft gradient scaled by eta; at eta=1.0 it is too weak to pull the prior-perturbed estimate back onto the measured 128-view data. (3) ONE KNOB: fd_recon_eta 1.0->2.0 at locked t=0.5, steps=8. (4) HYPOTHESIS: stronger DPS guidance lowers calibrated RMSE toward the FBP floor; this is the closest DC-off can come to emulating the DC-on data term. If even 2x eta cannot clear hr>0, it confirms DPS-alone (no hard CG) is structurally below baseline on sparse breast -- the intended contrast vs the DC-on sibling. (5) BUDGET: <5min. (6) Loop continues.", "run_id": "breast-ct-claude-agentic-fastdiff-wdm-wavelet-unconstrained-search-20260703-01", "runtime": {"elapsed_s": 73.84248566627502}, "schema_version": 3, "solver_key": "fastdiff-wdm-wavelet-unconstrained", "solver_name": "Fast-diffusion WDM (wavelet, unconstrained)", "split": {"train_n": 3600, "val_n": 200}, "status": "discard", "ts": "2026-07-07T01:27:25Z"}
