{"advice_for_others": "dual_domain_n2i-claude-agentic: warm_start=True, pretrain_epochs=3, pretrain_steps=0, n_iter=50, grad_clip=1.0, outer_wall_s=1400, per_scene_s=None, batch_size=1, lr=0.0001, optimizer=adam, unet_c=16, train_n=400, val_n=200, seed=42, rationale=iter-13 SIX-BOX. (1) PRIOR: iter-12 hr=0.0, seed 42->314 variance check gave rmse=0.00629 (vs seed-42 ~0.00628) -- the ceiling is SEED-INDEPENDENT, confirming it is structural not a one-off RNG artifact. Iters 1-12 all hr=0. (2) FAILURE MODE: plain-UNet N2I regresses to the over-smoothed FBP mean; no edge-preserving structural guard (bilateral sibling range kernel hr~0.21). (3) ONE KNOB: relative to iter-6 best reference (n_iter=50, c=16, seed=42), lr 3e-4 -> 1e-4. Extends the lr sweep to its gentle end (iter-7=3e-3 up, iter-5/6=3e-4, now 1e-4). (4) HYPOTHESIS: a very gentle step size with the warm-started init may barely move off the (already over-smoothed) init in 50 steps, so rmse ~= the warm-start's own rmse; tests whether even minimal per-image adjustment can help. Per the ceiling, expect rmse ~0.0063 (hr=0) -- gentle steps neither escape nor worsen the over-smoothed basin. If unexpectedly lower, gentle-lr early-stop would be a lever worth a follow-up. (5) BUDGET: identical to iter-6 (n_iter=50 fast); ~12 min << 30-min wall. (6) Loop continues; iter-14 self-dispatched. Reserved levers: n_iter=400 high, pretrain_epochs=1 minimal, pretrain_steps cap, batch_size=2 warm-start, warm_start off + high n_iter.", "agent": "dual_domain_n2i-claude-agentic", "campaign": "search-20260703-01", "cfg_full": {"batch_size": 1, "grad_clip": 1.0, "lr": 0.0001, "n_iter": 50, "optimizer": "adam", "outer_wall_s": 1400, "per_scene_s": null, "pretrain_epochs": 3, "pretrain_steps": 0, "rationale": "iter-13 SIX-BOX. (1) PRIOR: iter-12 hr=0.0, seed 42->314 variance check gave rmse=0.00629 (vs seed-42 ~0.00628) -- the ceiling is SEED-INDEPENDENT, confirming it is structural not a one-off RNG artifact. Iters 1-12 all hr=0. (2) FAILURE MODE: plain-UNet N2I regresses to the over-smoothed FBP mean; no edge-preserving structural guard (bilateral sibling range kernel hr~0.21). (3) ONE KNOB: relative to iter-6 best reference (n_iter=50, c=16, seed=42), lr 3e-4 -> 1e-4. Extends the lr sweep to its gentle end (iter-7=3e-3 up, iter-5/6=3e-4, now 1e-4). (4) HYPOTHESIS: a very gentle step size with the warm-started init may barely move off the (already over-smoothed) init in 50 steps, so rmse ~= the warm-start's own rmse; tests whether even minimal per-image adjustment can help. Per the ceiling, expect rmse ~0.0063 (hr=0) -- gentle steps neither escape nor worsen the over-smoothed basin. If unexpectedly lower, gentle-lr early-stop would be a lever worth a follow-up. (5) BUDGET: identical to iter-6 (n_iter=50 fast); ~12 min << 30-min wall. (6) Loop continues; iter-14 self-dispatched. Reserved levers: n_iter=400 high, pretrain_epochs=1 minimal, pretrain_steps cap, batch_size=2 warm-start, warm_start off + high n_iter.", "seed": 42, "train_n": 400, "unet_c": 16, "val_n": 200, "warm_start": true}, "challenge": "breast_ct", "change_class": "architecture", "git_commit": "671da566", "images": {"comparison": "runs/breast-ct-claude-agentic-dual-domain-n2i-search-20260703-01/iterations/iter-0013/comparison.png", "test_showcase": null, "valtest_showcase": null}, "iter": 13, "kept": false, "metrics": {"headroom": 0.0, "headroom_std": 0.0, "val_psnr": 34.579402923583984, "val_psnr_std": 0.9566283820246719, "val_rmse": 0.0063743265345692635, "val_rmse_std": 0.0006749493660483605, "val_ssim": 0.9404169917106628, "val_ssim_std": 0.011828408905987407}, "model": "claude-opus-4-8-1m", "obs_path": "breast-ct-claude-agentic-dual-domain-n2i-search-20260703-01/iterations/iter-0013/observation.json", "obs_sha1": "89c6fdfebce2c6744fffc5de4cc57beb00431ca9", "params_M": 0.465762, "params_source": "observation", "rationale": "dual_domain_n2i-claude-agentic: warm_start=True, pretrain_epochs=3, pretrain_steps=0, n_iter=50, grad_clip=1.0, outer_wall_s=1400, per_scene_s=None, batch_size=1, lr=0.0001, optimizer=adam, unet_c=16, train_n=400, val_n=200, seed=42, rationale=iter-13 SIX-BOX. (1) PRIOR: iter-12 hr=0.0, seed 42->314 variance check gave rmse=0.00629 (vs seed-42 ~0.00628) -- the ceiling is SEED-INDEPENDENT, confirming it is structural not a one-off RNG artifact. Iters 1-12 all hr=0. (2) FAILURE MODE: plain-UNet N2I regresses to the over-smoothed FBP mean; no edge-preserving structural guard (bilateral sibling range kernel hr~0.21). (3) ONE KNOB: relative to iter-6 best reference (n_iter=50, c=16, seed=42), lr 3e-4 -> 1e-4. Extends the lr sweep to its gentle end (iter-7=3e-3 up, iter-5/6=3e-4, now 1e-4). (4) HYPOTHESIS: a very gentle step size with the warm-started init may barely move off the (already over-smoothed) init in 50 steps, so rmse ~= the warm-start's own rmse; tests whether even minimal per-image adjustment can help. Per the ceiling, expect rmse ~0.0063 (hr=0) -- gentle steps neither escape nor worsen the over-smoothed basin. If unexpectedly lower, gentle-lr early-stop would be a lever worth a follow-up. (5) BUDGET: identical to iter-6 (n_iter=50 fast); ~12 min << 30-min wall. (6) Loop continues; iter-14 self-dispatched. Reserved levers: n_iter=400 high, pretrain_epochs=1 minimal, pretrain_steps cap, batch_size=2 warm-start, warm_start off + high n_iter.", "run_id": "breast-ct-claude-agentic-dual-domain-n2i-search-20260703-01", "runtime": {"elapsed_s": 896.6265068054199}, "schema_version": 3, "solver_key": "dual-domain-n2i", "solver_name": "DD-UNet N2I (per-image)", "split": {"train_n": 400, "val_n": 200}, "status": "discard", "ts": "2026-07-06T05:49:39Z"}
{"advice_for_others": "dual_domain_n2i-claude-agentic: warm_start=True, pretrain_epochs=3, pretrain_steps=0, n_iter=400, grad_clip=1.0, outer_wall_s=1400, per_scene_s=None, batch_size=1, lr=0.0003, optimizer=adam, unet_c=16, train_n=400, val_n=200, seed=42, rationale=iter-14 SIX-BOX. (1) PRIOR: iter-13 hr=0.0, very-gentle lr=1e-4 gave rmse=0.00637 -- gentle steps neither escape nor worsen the over-smoothed basin. lr sweep (1e-4/3e-4/1e-3/3e-3 -> 0.00637/0.00628/0.00633/0.00657) shows lr is not a lever. Iters 1-13 all hr=0. (2) FAILURE MODE: plain-UNet N2I regresses to the over-smoothed FBP mean; no edge-preserving structural guard (bilateral sibling range kernel hr~0.21). (3) ONE KNOB: relative to iter-6 best reference (lr=3e-4, c=16), n_iter 50 -> 400 (8x). Completes the inner-step sweep at the HIGH end (iter-6=50, iter-10=100, iter-2/5=200, now 400). (4) HYPOTHESIS: the classic N2I pathology is that MANY inner steps over-smooth MORE (the denoiser regresses ever closer to the low-frequency FBP-consistent mean). If rmse RISES above the 50-step 0.00628, that directly demonstrates the over-smoothing mechanism -- the more we optimize the N2I self-sup loss, the further from the truth we get. This is the strongest single-lever evidence for WHY the ceiling exists. (5) BUDGET: n_iter=400 is per-scene-wall-capped at 7.0s (per_scene = outer_wall/200); on 512^2 c=16 that fits maybe ~90-120 of the 400 steps/scene, so all 200 scans still complete inside 1400s + figure ~= 25 min < 30-min wall. (6) Loop continues; iter-15 self-dispatched. Reserved levers: pretrain_epochs=1 minimal, pretrain_steps cap, batch_size=2 warm-start, warm_start off + n_iter high, per_scene_s explicit.", "agent": "dual_domain_n2i-claude-agentic", "campaign": "search-20260703-01", "cfg_full": {"batch_size": 1, "grad_clip": 1.0, "lr": 0.0003, "n_iter": 400, "optimizer": "adam", "outer_wall_s": 1400, "per_scene_s": null, "pretrain_epochs": 3, "pretrain_steps": 0, "rationale": "iter-14 SIX-BOX. (1) PRIOR: iter-13 hr=0.0, very-gentle lr=1e-4 gave rmse=0.00637 -- gentle steps neither escape nor worsen the over-smoothed basin. lr sweep (1e-4/3e-4/1e-3/3e-3 -> 0.00637/0.00628/0.00633/0.00657) shows lr is not a lever. Iters 1-13 all hr=0. (2) FAILURE MODE: plain-UNet N2I regresses to the over-smoothed FBP mean; no edge-preserving structural guard (bilateral sibling range kernel hr~0.21). (3) ONE KNOB: relative to iter-6 best reference (lr=3e-4, c=16), n_iter 50 -> 400 (8x). Completes the inner-step sweep at the HIGH end (iter-6=50, iter-10=100, iter-2/5=200, now 400). (4) HYPOTHESIS: the classic N2I pathology is that MANY inner steps over-smooth MORE (the denoiser regresses ever closer to the low-frequency FBP-consistent mean). If rmse RISES above the 50-step 0.00628, that directly demonstrates the over-smoothing mechanism -- the more we optimize the N2I self-sup loss, the further from the truth we get. This is the strongest single-lever evidence for WHY the ceiling exists. (5) BUDGET: n_iter=400 is per-scene-wall-capped at 7.0s (per_scene = outer_wall/200); on 512^2 c=16 that fits maybe ~90-120 of the 400 steps/scene, so all 200 scans still complete inside 1400s + figure ~= 25 min < 30-min wall. (6) Loop continues; iter-15 self-dispatched. Reserved levers: pretrain_epochs=1 minimal, pretrain_steps cap, batch_size=2 warm-start, warm_start off + n_iter high, per_scene_s explicit.", "seed": 42, "train_n": 400, "unet_c": 16, "val_n": 200, "warm_start": true}, "challenge": "breast_ct", "change_class": "architecture", "git_commit": "671da566", "images": {"comparison": "runs/breast-ct-claude-agentic-dual-domain-n2i-search-20260703-01/iterations/iter-0014/comparison.png", "test_showcase": null, "valtest_showcase": null}, "iter": 14, "kept": false, "metrics": {"headroom": 0.0, "headroom_std": 0.0, "val_psnr": 34.771881103515625, "val_psnr_std": 0.9732801157191046, "val_rmse": 0.006234627217054367, "val_rmse_std": 0.0006677587299146486, "val_ssim": 0.9432809352874756, "val_ssim_std": 0.01113376495272543}, "model": "claude-opus-4-8-1m", "obs_path": "breast-ct-claude-agentic-dual-domain-n2i-search-20260703-01/iterations/iter-0014/observation.json", "obs_sha1": "10ed929cab083aed70fa6d2cab69a975819ec0df", "params_M": 0.465762, "params_source": "observation", "rationale": "dual_domain_n2i-claude-agentic: warm_start=True, pretrain_epochs=3, pretrain_steps=0, n_iter=400, grad_clip=1.0, outer_wall_s=1400, per_scene_s=None, batch_size=1, lr=0.0003, optimizer=adam, unet_c=16, train_n=400, val_n=200, seed=42, rationale=iter-14 SIX-BOX. (1) PRIOR: iter-13 hr=0.0, very-gentle lr=1e-4 gave rmse=0.00637 -- gentle steps neither escape nor worsen the over-smoothed basin. lr sweep (1e-4/3e-4/1e-3/3e-3 -> 0.00637/0.00628/0.00633/0.00657) shows lr is not a lever. Iters 1-13 all hr=0. (2) FAILURE MODE: plain-UNet N2I regresses to the over-smoothed FBP mean; no edge-preserving structural guard (bilateral sibling range kernel hr~0.21). (3) ONE KNOB: relative to iter-6 best reference (lr=3e-4, c=16), n_iter 50 -> 400 (8x). Completes the inner-step sweep at the HIGH end (iter-6=50, iter-10=100, iter-2/5=200, now 400). (4) HYPOTHESIS: the classic N2I pathology is that MANY inner steps over-smooth MORE (the denoiser regresses ever closer to the low-frequency FBP-consistent mean). If rmse RISES above the 50-step 0.00628, that directly demonstrates the over-smoothing mechanism -- the more we optimize the N2I self-sup loss, the further from the truth we get. This is the strongest single-lever evidence for WHY the ceiling exists. (5) BUDGET: n_iter=400 is per-scene-wall-capped at 7.0s (per_scene = outer_wall/200); on 512^2 c=16 that fits maybe ~90-120 of the 400 steps/scene, so all 200 scans still complete inside 1400s + figure ~= 25 min < 30-min wall. (6) Loop continues; iter-15 self-dispatched. Reserved levers: pretrain_epochs=1 minimal, pretrain_steps cap, batch_size=2 warm-start, warm_start off + n_iter high, per_scene_s explicit.", "run_id": "breast-ct-claude-agentic-dual-domain-n2i-search-20260703-01", "runtime": {"elapsed_s": 1529.274926662445}, "schema_version": 3, "solver_key": "dual-domain-n2i", "solver_name": "DD-UNet N2I (per-image)", "split": {"train_n": 400, "val_n": 198}, "status": "discard", "ts": "2026-07-06T07:17:43Z"}
{"advice_for_others": "dual_domain_n2i-claude-agentic: warm_start=True, pretrain_epochs=1, pretrain_steps=0, n_iter=50, grad_clip=1.0, outer_wall_s=1400, per_scene_s=None, batch_size=1, lr=0.0003, optimizer=adam, unet_c=16, train_n=400, val_n=200, seed=42, rationale=iter-15 SIX-BOX. (1) PRIOR: iter-14 hr=0.0, n_iter=400 (high) gave rmse=0.00623 (marginally LOWEST of run) -- many inner steps did NOT over-smooth further; the per-image plateau is flat across 50-400 steps, all hr=0. Iters 1-14 all hr=0. (2) FAILURE MODE: plain-UNet N2I sits at the over-smoothed FBP-consistent plateau; no edge-preserving structural guard (bilateral sibling range kernel hr~0.21). (3) ONE KNOB: relative to iter-6 best reference (n_iter=50, lr=3e-4, c=16, pretrain_epochs=3), pretrain_epochs 3 -> 1 (minimal warm-start). iter-8 tested ep=10 (up), iter-4 tested warm_start off; this fills ep=1 (minimal-but-present init) to bracket warm-start strength: off / 1 / 3 / 10. (4) HYPOTHESIS: a 1-epoch warm-start gives a barely-adapted init that is LESS collapsed toward the smooth mean than the ep=3/10 inits, so the 50-step per-image fit may retain slightly more detail; if rmse dips below 0.00628, minimal warm-start is mildly preferable. Per the ceiling, expect hr=0 -- warm-start strength (off/1/3/10) has shown no monotone effect, all pinned at the plateau. (5) BUDGET: ep=1 warm-start (~150s) + 200*50-step fast fits + figure ~= 11 min << 30-min wall. (6) Loop continues; iter-16 self-dispatched. Reserved levers: pretrain_steps hard cap, batch_size=2 warm-start, warm_start off + n_iter=400, per_scene_s explicit=10, optimizer variation.", "agent": "dual_domain_n2i-claude-agentic", "campaign": "search-20260703-01", "cfg_full": {"batch_size": 1, "grad_clip": 1.0, "lr": 0.0003, "n_iter": 50, "optimizer": "adam", "outer_wall_s": 1400, "per_scene_s": null, "pretrain_epochs": 1, "pretrain_steps": 0, "rationale": "iter-15 SIX-BOX. (1) PRIOR: iter-14 hr=0.0, n_iter=400 (high) gave rmse=0.00623 (marginally LOWEST of run) -- many inner steps did NOT over-smooth further; the per-image plateau is flat across 50-400 steps, all hr=0. Iters 1-14 all hr=0. (2) FAILURE MODE: plain-UNet N2I sits at the over-smoothed FBP-consistent plateau; no edge-preserving structural guard (bilateral sibling range kernel hr~0.21). (3) ONE KNOB: relative to iter-6 best reference (n_iter=50, lr=3e-4, c=16, pretrain_epochs=3), pretrain_epochs 3 -> 1 (minimal warm-start). iter-8 tested ep=10 (up), iter-4 tested warm_start off; this fills ep=1 (minimal-but-present init) to bracket warm-start strength: off / 1 / 3 / 10. (4) HYPOTHESIS: a 1-epoch warm-start gives a barely-adapted init that is LESS collapsed toward the smooth mean than the ep=3/10 inits, so the 50-step per-image fit may retain slightly more detail; if rmse dips below 0.00628, minimal warm-start is mildly preferable. Per the ceiling, expect hr=0 -- warm-start strength (off/1/3/10) has shown no monotone effect, all pinned at the plateau. (5) BUDGET: ep=1 warm-start (~150s) + 200*50-step fast fits + figure ~= 11 min << 30-min wall. (6) Loop continues; iter-16 self-dispatched. Reserved levers: pretrain_steps hard cap, batch_size=2 warm-start, warm_start off + n_iter=400, per_scene_s explicit=10, optimizer variation.", "seed": 42, "train_n": 400, "unet_c": 16, "val_n": 200, "warm_start": true}, "challenge": "breast_ct", "change_class": "architecture", "git_commit": "671da566", "images": {"comparison": "runs/breast-ct-claude-agentic-dual-domain-n2i-search-20260703-01/iterations/iter-0015/comparison.png", "test_showcase": null, "valtest_showcase": null}, "iter": 15, "kept": false, "metrics": {"headroom": 0.0, "headroom_std": 0.0, "val_psnr": 34.538570404052734, "val_psnr_std": 0.9627263497164082, "val_rmse": 0.0064043621532619, "val_rmse_std": 0.0006817523799847353, "val_ssim": 0.9419400691986084, "val_ssim_std": 0.011695067957865655}, "model": "claude-opus-4-8-1m", "obs_path": "breast-ct-claude-agentic-dual-domain-n2i-search-20260703-01/iterations/iter-0015/observation.json", "obs_sha1": "8853db9b2877fbaeecaeec14bc17ab7c1b0bb3f9", "params_M": 0.465762, "params_source": "observation", "rationale": "dual_domain_n2i-claude-agentic: warm_start=True, pretrain_epochs=1, pretrain_steps=0, n_iter=50, grad_clip=1.0, outer_wall_s=1400, per_scene_s=None, batch_size=1, lr=0.0003, optimizer=adam, unet_c=16, train_n=400, val_n=200, seed=42, rationale=iter-15 SIX-BOX. (1) PRIOR: iter-14 hr=0.0, n_iter=400 (high) gave rmse=0.00623 (marginally LOWEST of run) -- many inner steps did NOT over-smooth further; the per-image plateau is flat across 50-400 steps, all hr=0. Iters 1-14 all hr=0. (2) FAILURE MODE: plain-UNet N2I sits at the over-smoothed FBP-consistent plateau; no edge-preserving structural guard (bilateral sibling range kernel hr~0.21). (3) ONE KNOB: relative to iter-6 best reference (n_iter=50, lr=3e-4, c=16, pretrain_epochs=3), pretrain_epochs 3 -> 1 (minimal warm-start). iter-8 tested ep=10 (up), iter-4 tested warm_start off; this fills ep=1 (minimal-but-present init) to bracket warm-start strength: off / 1 / 3 / 10. (4) HYPOTHESIS: a 1-epoch warm-start gives a barely-adapted init that is LESS collapsed toward the smooth mean than the ep=3/10 inits, so the 50-step per-image fit may retain slightly more detail; if rmse dips below 0.00628, minimal warm-start is mildly preferable. Per the ceiling, expect hr=0 -- warm-start strength (off/1/3/10) has shown no monotone effect, all pinned at the plateau. (5) BUDGET: ep=1 warm-start (~150s) + 200*50-step fast fits + figure ~= 11 min << 30-min wall. (6) Loop continues; iter-16 self-dispatched. Reserved levers: pretrain_steps hard cap, batch_size=2 warm-start, warm_start off + n_iter=400, per_scene_s explicit=10, optimizer variation.", "run_id": "breast-ct-claude-agentic-dual-domain-n2i-search-20260703-01", "runtime": {"elapsed_s": 824.1556470394135}, "schema_version": 3, "solver_key": "dual-domain-n2i", "solver_name": "DD-UNet N2I (per-image)", "split": {"train_n": 400, "val_n": 200}, "status": "discard", "ts": "2026-07-06T08:33:48Z"}
