{"advice_for_others": "dual_domain_n2i-claude-agentic: warm_start=False, pretrain_epochs=3, pretrain_steps=0, n_iter=300, grad_clip=1.0, outer_wall_s=1400, per_scene_s=None, batch_size=1, lr=0.001, optimizer=adam, unet_c=16, train_n=400, val_n=200, seed=42, rationale=iter-4 SIX-BOX. (1) PRIOR: iter-3 hr=0.0, unet_c=32 (4x capacity) gave rmse=0.00654 (SLIGHTLY WORSE than c=16's 0.00638), ssim=0.932, 196/200. So higher denoiser capacity does NOT sharpen -- capacity is NOT the limiter. Iters 1-3 (budget, per-scene fit, capacity) all pinned at hr=0. (2) FAILURE MODE: structural over-smoothing from the poor 128-view FBP self-supervision target, independent of budget or capacity. (3) ONE KNOB: warm_start True -> False (back to c=16). Pure per-image N2I: each val scan is optimized FROM SCRATCH on its own sinogram with NO amortised train-set pre-pass init; n_iter raised to 300 to compensate for losing the warm init (this is the SAME knob -- turning off the amortised init -- expressed as the from-scratch regime it defines; no train split is loaded at all). (4) HYPOTHESIS: removing the amortised warm-start tests whether the pre-pass was pulling every scan toward an over-smoothed mean. If pure per-image N2I clears hr>0, warm-start was the culprit. Per the documented ceiling, more likely each from-scratch fit STILL converges to the same over-smoothed FBP-consistent solution (hr=0), because the ceiling is set by the self-supervision TARGET, not the initialization. (5) BUDGET: no warm-start pre-pass (SAVES ~130s), so the full 1400s outer wall goes to the 200 per-image fits at 7.0s each; c=16 + figure ~= 24 min < 30-min wall. (6) Loop continues; iter-5 self-dispatched. Reserved levers: pretrain_epochs (stronger warm-start), lr up/down, n_iter early-stop, unet_c=8.", "agent": "dual_domain_n2i-claude-agentic", "campaign": "search-20260703-01", "cfg_full": {"batch_size": 1, "grad_clip": 1.0, "lr": 0.001, "n_iter": 300, "optimizer": "adam", "outer_wall_s": 1400, "per_scene_s": null, "pretrain_epochs": 3, "pretrain_steps": 0, "rationale": "iter-4 SIX-BOX. (1) PRIOR: iter-3 hr=0.0, unet_c=32 (4x capacity) gave rmse=0.00654 (SLIGHTLY WORSE than c=16's 0.00638), ssim=0.932, 196/200. So higher denoiser capacity does NOT sharpen -- capacity is NOT the limiter. Iters 1-3 (budget, per-scene fit, capacity) all pinned at hr=0. (2) FAILURE MODE: structural over-smoothing from the poor 128-view FBP self-supervision target, independent of budget or capacity. (3) ONE KNOB: warm_start True -> False (back to c=16). Pure per-image N2I: each val scan is optimized FROM SCRATCH on its own sinogram with NO amortised train-set pre-pass init; n_iter raised to 300 to compensate for losing the warm init (this is the SAME knob -- turning off the amortised init -- expressed as the from-scratch regime it defines; no train split is loaded at all). (4) HYPOTHESIS: removing the amortised warm-start tests whether the pre-pass was pulling every scan toward an over-smoothed mean. If pure per-image N2I clears hr>0, warm-start was the culprit. Per the documented ceiling, more likely each from-scratch fit STILL converges to the same over-smoothed FBP-consistent solution (hr=0), because the ceiling is set by the self-supervision TARGET, not the initialization. (5) BUDGET: no warm-start pre-pass (SAVES ~130s), so the full 1400s outer wall goes to the 200 per-image fits at 7.0s each; c=16 + figure ~= 24 min < 30-min wall. (6) Loop continues; iter-5 self-dispatched. Reserved levers: pretrain_epochs (stronger warm-start), lr up/down, n_iter early-stop, unet_c=8.", "seed": 42, "train_n": 400, "unet_c": 16, "val_n": 200, "warm_start": false}, "challenge": "breast_ct", "change_class": "architecture", "git_commit": "671da566", "images": {"comparison": "runs/breast-ct-claude-agentic-dual-domain-n2i-search-20260703-01/iterations/iter-0004/comparison.png", "test_showcase": null, "valtest_showcase": null}, "iter": 4, "kept": false, "metrics": {"headroom": 0.0, "headroom_std": 0.0, "val_psnr": 34.390289306640625, "val_psnr_std": 0.9809265512543881, "val_rmse": 0.006514633074402809, "val_rmse_std": 0.0007034871974204068, "val_ssim": 0.9383020401000977, "val_ssim_std": 0.013137069761623498}, "model": "claude-opus-4-8-1m", "obs_path": "breast-ct-claude-agentic-dual-domain-n2i-search-20260703-01/iterations/iter-0004/observation.json", "obs_sha1": "20d8b9eee9a04ac43acad2f6cd422087fa2fa93f", "params_M": 0.465762, "params_source": "observation", "rationale": "dual_domain_n2i-claude-agentic: warm_start=False, pretrain_epochs=3, pretrain_steps=0, n_iter=300, grad_clip=1.0, outer_wall_s=1400, per_scene_s=None, batch_size=1, lr=0.001, optimizer=adam, unet_c=16, train_n=400, val_n=200, seed=42, rationale=iter-4 SIX-BOX. (1) PRIOR: iter-3 hr=0.0, unet_c=32 (4x capacity) gave rmse=0.00654 (SLIGHTLY WORSE than c=16's 0.00638), ssim=0.932, 196/200. So higher denoiser capacity does NOT sharpen -- capacity is NOT the limiter. Iters 1-3 (budget, per-scene fit, capacity) all pinned at hr=0. (2) FAILURE MODE: structural over-smoothing from the poor 128-view FBP self-supervision target, independent of budget or capacity. (3) ONE KNOB: warm_start True -> False (back to c=16). Pure per-image N2I: each val scan is optimized FROM SCRATCH on its own sinogram with NO amortised train-set pre-pass init; n_iter raised to 300 to compensate for losing the warm init (this is the SAME knob -- turning off the amortised init -- expressed as the from-scratch regime it defines; no train split is loaded at all). (4) HYPOTHESIS: removing the amortised warm-start tests whether the pre-pass was pulling every scan toward an over-smoothed mean. If pure per-image N2I clears hr>0, warm-start was the culprit. Per the documented ceiling, more likely each from-scratch fit STILL converges to the same over-smoothed FBP-consistent solution (hr=0), because the ceiling is set by the self-supervision TARGET, not the initialization. (5) BUDGET: no warm-start pre-pass (SAVES ~130s), so the full 1400s outer wall goes to the 200 per-image fits at 7.0s each; c=16 + figure ~= 24 min < 30-min wall. (6) Loop continues; iter-5 self-dispatched. Reserved levers: pretrain_epochs (stronger warm-start), lr up/down, n_iter early-stop, unet_c=8.", "run_id": "breast-ct-claude-agentic-dual-domain-n2i-search-20260703-01", "runtime": {"elapsed_s": 1434.3322653770447}, "schema_version": 3, "solver_key": "dual-domain-n2i", "solver_name": "DD-UNet N2I (per-image)", "split": {"train_n": 400, "val_n": 197}, "status": "discard", "ts": "2026-07-05T20:37:59Z"}
{"advice_for_others": "dual_domain_n2i-claude-agentic: warm_start=True, pretrain_epochs=3, pretrain_steps=0, n_iter=200, grad_clip=1.0, outer_wall_s=1400, per_scene_s=None, batch_size=1, lr=0.0003, optimizer=adam, unet_c=16, train_n=400, val_n=200, seed=42, rationale=iter-5 SIX-BOX. (1) PRIOR: iter-4 hr=0.0, warm_start OFF (pure per-image from scratch, n_iter=300) gave rmse=0.00651, ssim=0.938, 197/200 -- no better than warm-started iters. So the amortised warm-start is NOT what pulls scans to over-smooth; from-scratch fits reach the same FBP-consistent plateau. Iters 1-4 (budget, per-scene fit, capacity, warm-start on/off) ALL pinned at hr=0. (2) FAILURE MODE: structural over-smoothing set by the 128-view FBP self-supervision target, independent of budget/capacity/init. (3) ONE KNOB: lr 1e-3 -> 3e-4 (back to warm_start=True, c=16, n_iter=200 -- identical to iter-2 except lr). (4) HYPOTHESIS: a gentler per-image step size may let the N2I fit settle into a sharper local optimum instead of over-shooting into an over-smoothed mean; if hr rises, the over-smoothing was partly an optimization/step-size artifact. Per the documented ceiling, more likely lr just changes convergence speed and the SAME over-smoothed solution is reached (hr=0), since the target itself is the limiter. (5) BUDGET: identical compute profile to iter-2 (warm-start ep=3 + 200*7.0s + figure ~= 26 min < 30-min wall). (6) Loop continues; iter-6 self-dispatched. Reserved levers: lr up (3e-3), n_iter early-stop (50), pretrain_epochs up (10), unet_c=8, grad_clip variation.", "agent": "dual_domain_n2i-claude-agentic", "campaign": "search-20260703-01", "cfg_full": {"batch_size": 1, "grad_clip": 1.0, "lr": 0.0003, "n_iter": 200, "optimizer": "adam", "outer_wall_s": 1400, "per_scene_s": null, "pretrain_epochs": 3, "pretrain_steps": 0, "rationale": "iter-5 SIX-BOX. (1) PRIOR: iter-4 hr=0.0, warm_start OFF (pure per-image from scratch, n_iter=300) gave rmse=0.00651, ssim=0.938, 197/200 -- no better than warm-started iters. So the amortised warm-start is NOT what pulls scans to over-smooth; from-scratch fits reach the same FBP-consistent plateau. Iters 1-4 (budget, per-scene fit, capacity, warm-start on/off) ALL pinned at hr=0. (2) FAILURE MODE: structural over-smoothing set by the 128-view FBP self-supervision target, independent of budget/capacity/init. (3) ONE KNOB: lr 1e-3 -> 3e-4 (back to warm_start=True, c=16, n_iter=200 -- identical to iter-2 except lr). (4) HYPOTHESIS: a gentler per-image step size may let the N2I fit settle into a sharper local optimum instead of over-shooting into an over-smoothed mean; if hr rises, the over-smoothing was partly an optimization/step-size artifact. Per the documented ceiling, more likely lr just changes convergence speed and the SAME over-smoothed solution is reached (hr=0), since the target itself is the limiter. (5) BUDGET: identical compute profile to iter-2 (warm-start ep=3 + 200*7.0s + figure ~= 26 min < 30-min wall). (6) Loop continues; iter-6 self-dispatched. Reserved levers: lr up (3e-3), n_iter early-stop (50), pretrain_epochs up (10), unet_c=8, grad_clip variation.", "seed": 42, "train_n": 400, "unet_c": 16, "val_n": 200, "warm_start": true}, "challenge": "breast_ct", "change_class": "architecture", "git_commit": "671da566", "images": {"comparison": "runs/breast-ct-claude-agentic-dual-domain-n2i-search-20260703-01/iterations/iter-0005/comparison.png", "test_showcase": null, "valtest_showcase": null}, "iter": 5, "kept": false, "metrics": {"headroom": 0.0, "headroom_std": 0.0, "val_psnr": 34.642417907714844, "val_psnr_std": 0.9683381124362275, "val_rmse": 0.00632824981585145, "val_rmse_std": 0.00068037445496675, "val_ssim": 0.9414029717445374, "val_ssim_std": 0.012098980454888211}, "model": "claude-opus-4-8-1m", "obs_path": "breast-ct-claude-agentic-dual-domain-n2i-search-20260703-01/iterations/iter-0005/observation.json", "obs_sha1": "a4f275502eeab2fc418c6ac0788af8ffa8d14a84", "params_M": 0.465762, "params_source": "observation", "rationale": "dual_domain_n2i-claude-agentic: warm_start=True, pretrain_epochs=3, pretrain_steps=0, n_iter=200, grad_clip=1.0, outer_wall_s=1400, per_scene_s=None, batch_size=1, lr=0.0003, optimizer=adam, unet_c=16, train_n=400, val_n=200, seed=42, rationale=iter-5 SIX-BOX. (1) PRIOR: iter-4 hr=0.0, warm_start OFF (pure per-image from scratch, n_iter=300) gave rmse=0.00651, ssim=0.938, 197/200 -- no better than warm-started iters. So the amortised warm-start is NOT what pulls scans to over-smooth; from-scratch fits reach the same FBP-consistent plateau. Iters 1-4 (budget, per-scene fit, capacity, warm-start on/off) ALL pinned at hr=0. (2) FAILURE MODE: structural over-smoothing set by the 128-view FBP self-supervision target, independent of budget/capacity/init. (3) ONE KNOB: lr 1e-3 -> 3e-4 (back to warm_start=True, c=16, n_iter=200 -- identical to iter-2 except lr). (4) HYPOTHESIS: a gentler per-image step size may let the N2I fit settle into a sharper local optimum instead of over-shooting into an over-smoothed mean; if hr rises, the over-smoothing was partly an optimization/step-size artifact. Per the documented ceiling, more likely lr just changes convergence speed and the SAME over-smoothed solution is reached (hr=0), since the target itself is the limiter. (5) BUDGET: identical compute profile to iter-2 (warm-start ep=3 + 200*7.0s + figure ~= 26 min < 30-min wall). (6) Loop continues; iter-6 self-dispatched. Reserved levers: lr up (3e-3), n_iter early-stop (50), pretrain_epochs up (10), unet_c=8, grad_clip variation.", "run_id": "breast-ct-claude-agentic-dual-domain-n2i-search-20260703-01", "runtime": {"elapsed_s": 1596.1494433879852}, "schema_version": 3, "solver_key": "dual-domain-n2i", "solver_name": "DD-UNet N2I (per-image)", "split": {"train_n": 400, "val_n": 197}, "status": "discard", "ts": "2026-07-05T21:45:27Z"}
{"advice_for_others": "dual_domain_n2i-claude-agentic: warm_start=True, pretrain_epochs=3, pretrain_steps=0, n_iter=50, grad_clip=1.0, outer_wall_s=1400, per_scene_s=None, batch_size=1, lr=0.0003, optimizer=adam, unet_c=16, train_n=400, val_n=200, seed=42, rationale=iter-6 SIX-BOX. (1) PRIOR: iter-5 hr=0.0, lr 1e-3->3e-4 gave rmse=0.00633 (best yet, but still >> baseline 0.00521), ssim=0.941, 197/200. Gentler steps nudged rmse down ~1% -- not near baseline. Iters 1-5 (budget, per-scene fit, capacity, warm-start, lr) all pinned at hr=0. (2) FAILURE MODE: N2I converges toward the over-smoothed FBP-consistent mean; the self-supervision target caps recon RMSE above the sparse-FBP baseline. A known N2I pathology on dense phantoms is that MORE inner steps over-smooth MORE (the denoiser regresses to the low-frequency mean). (3) ONE KNOB: n_iter 200 -> 50 (early-stop; keep lr=3e-4, c=16, warm_start=True -- identical to iter-5 except inner-step count). (4) HYPOTHESIS: stopping the per-image fit early (50 steps) may HALT before the denoiser collapses to the over-smoothed mean, preserving more high-frequency detail from the warm-started init and LOWERING rmse toward baseline. If hr rises, over-smoothing is a late-optimization effect and early-stop is the lever. Per the documented ceiling, more likely the warm-started init is ALREADY over-smoothed so early-stop just freezes a still-blurry recon (hr=0). (5) BUDGET: 50 inner steps/scene is far under the 7.0s per-scene wall, so all 200 scans finish FAST (~3-4s each) -> loop well under 1400s; warm-start ep=3 + fast loop + figure ~= 12-15 min << 30-min wall. (6) Loop continues; iter-7 self-dispatched. Reserved levers: lr up (3e-3), pretrain_epochs up (10), unet_c=8, grad_clip, n_iter mid (100).", "agent": "dual_domain_n2i-claude-agentic", "campaign": "search-20260703-01", "cfg_full": {"batch_size": 1, "grad_clip": 1.0, "lr": 0.0003, "n_iter": 50, "optimizer": "adam", "outer_wall_s": 1400, "per_scene_s": null, "pretrain_epochs": 3, "pretrain_steps": 0, "rationale": "iter-6 SIX-BOX. (1) PRIOR: iter-5 hr=0.0, lr 1e-3->3e-4 gave rmse=0.00633 (best yet, but still >> baseline 0.00521), ssim=0.941, 197/200. Gentler steps nudged rmse down ~1% -- not near baseline. Iters 1-5 (budget, per-scene fit, capacity, warm-start, lr) all pinned at hr=0. (2) FAILURE MODE: N2I converges toward the over-smoothed FBP-consistent mean; the self-supervision target caps recon RMSE above the sparse-FBP baseline. A known N2I pathology on dense phantoms is that MORE inner steps over-smooth MORE (the denoiser regresses to the low-frequency mean). (3) ONE KNOB: n_iter 200 -> 50 (early-stop; keep lr=3e-4, c=16, warm_start=True -- identical to iter-5 except inner-step count). (4) HYPOTHESIS: stopping the per-image fit early (50 steps) may HALT before the denoiser collapses to the over-smoothed mean, preserving more high-frequency detail from the warm-started init and LOWERING rmse toward baseline. If hr rises, over-smoothing is a late-optimization effect and early-stop is the lever. Per the documented ceiling, more likely the warm-started init is ALREADY over-smoothed so early-stop just freezes a still-blurry recon (hr=0). (5) BUDGET: 50 inner steps/scene is far under the 7.0s per-scene wall, so all 200 scans finish FAST (~3-4s each) -> loop well under 1400s; warm-start ep=3 + fast loop + figure ~= 12-15 min << 30-min wall. (6) Loop continues; iter-7 self-dispatched. Reserved levers: lr up (3e-3), pretrain_epochs up (10), unet_c=8, grad_clip, n_iter mid (100).", "seed": 42, "train_n": 400, "unet_c": 16, "val_n": 200, "warm_start": true}, "challenge": "breast_ct", "change_class": "architecture", "git_commit": "671da566", "images": {"comparison": "runs/breast-ct-claude-agentic-dual-domain-n2i-search-20260703-01/iterations/iter-0006/comparison.png", "test_showcase": null, "valtest_showcase": null}, "iter": 6, "kept": false, "metrics": {"headroom": 0.0, "headroom_std": 0.0, "val_psnr": 34.70803451538086, "val_psnr_std": 0.948646855882872, "val_rmse": 0.006280622910708189, "val_rmse_std": 0.0006587384805394495, "val_ssim": 0.9424485564231873, "val_ssim_std": 0.01183448564854796}, "model": "claude-opus-4-8-1m", "obs_path": "breast-ct-claude-agentic-dual-domain-n2i-search-20260703-01/iterations/iter-0006/observation.json", "obs_sha1": "13c29d449f7ff1a1e4116498f426daca072df918", "params_M": 0.465762, "params_source": "observation", "rationale": "dual_domain_n2i-claude-agentic: warm_start=True, pretrain_epochs=3, pretrain_steps=0, n_iter=50, grad_clip=1.0, outer_wall_s=1400, per_scene_s=None, batch_size=1, lr=0.0003, optimizer=adam, unet_c=16, train_n=400, val_n=200, seed=42, rationale=iter-6 SIX-BOX. (1) PRIOR: iter-5 hr=0.0, lr 1e-3->3e-4 gave rmse=0.00633 (best yet, but still >> baseline 0.00521), ssim=0.941, 197/200. Gentler steps nudged rmse down ~1% -- not near baseline. Iters 1-5 (budget, per-scene fit, capacity, warm-start, lr) all pinned at hr=0. (2) FAILURE MODE: N2I converges toward the over-smoothed FBP-consistent mean; the self-supervision target caps recon RMSE above the sparse-FBP baseline. A known N2I pathology on dense phantoms is that MORE inner steps over-smooth MORE (the denoiser regresses to the low-frequency mean). (3) ONE KNOB: n_iter 200 -> 50 (early-stop; keep lr=3e-4, c=16, warm_start=True -- identical to iter-5 except inner-step count). (4) HYPOTHESIS: stopping the per-image fit early (50 steps) may HALT before the denoiser collapses to the over-smoothed mean, preserving more high-frequency detail from the warm-started init and LOWERING rmse toward baseline. If hr rises, over-smoothing is a late-optimization effect and early-stop is the lever. Per the documented ceiling, more likely the warm-started init is ALREADY over-smoothed so early-stop just freezes a still-blurry recon (hr=0). (5) BUDGET: 50 inner steps/scene is far under the 7.0s per-scene wall, so all 200 scans finish FAST (~3-4s each) -> loop well under 1400s; warm-start ep=3 + fast loop + figure ~= 12-15 min << 30-min wall. (6) Loop continues; iter-7 self-dispatched. Reserved levers: lr up (3e-3), pretrain_epochs up (10), unet_c=8, grad_clip, n_iter mid (100).", "run_id": "breast-ct-claude-agentic-dual-domain-n2i-search-20260703-01", "runtime": {"elapsed_s": 1245.2898063659668}, "schema_version": 3, "solver_key": "dual-domain-n2i", "solver_name": "DD-UNet N2I (per-image)", "split": {"train_n": 400, "val_n": 200}, "status": "discard", "ts": "2026-07-05T22:34:33Z"}
