{"advice_for_others": "param_efficient-claude-agentic: reg_type=bilateral, bilateral_on_top=False, proj_filter_on=False, n_iter=30, learnable_alpha=True, alpha_init=0.1, foe_n_filters=24, foe_kernel=7, foe_n_bumps=31, n_bf=1, bf_multiscale=True, bf_sigmas=[0.8, 1.6, 3.2], bf_kernel=7, bf_sigma_r=0.02, bf_gain_init=0.0, epochs=16, cosine_lr=True, lr=0.005, max_train_s=1080, batch_size=4, train_n=200, val_n=200, display_min=0.0, display_max=0.05, seed=45, rationale=iter-35 param_efficient breast -- GRAD-CLIP FIX on the FAILING seed 45. SIX-BOX: (1) PRIOR: champion (filtered-DC K30 + LPD W4 + 3-scale post-BF, 195p) is SEED-FRAGILE: seeds 42/43/44/46 = 0.6201/0.5586/0.5593/0.5469 (4-good mean 0.571+-0.031) but seed45 COLLAPSED to hr 0.0 (converged, PSNR 35.5<baseline -- a bad basin). Default grad_clip=1.0 did not prevent it. (2) FAILURE MODE: on some seeds the LPD+post-filter optimization enters a bad basin early and converges there. (3) ONE KNOB: grad_clip 1.0->0.1 (10x tighter) on the EXACT failing seed 45. All else byte-for-byte the champion. (4) HYPOTHESIS: a tighter grad-clip damps the early large-gradient step that sends seed45 into the bad basin -> seed45 recovers to the ~0.55-0.62 good-seed regime, directly PROVING grad-clip is the fragility fix. If seed45 recovers, re-run 2-3 more seeds with grad_clip=0.1 for a grad-clipped mean+-std (likely tighter). If it does NOT recover, report the raw fragility honestly. (5) BUDGET: identical to the champion (16ep ~1120s), max_train_s=1080, --time=00:30:00, 200-val -> 20-min. (6) SERIAL; iter-36+: if fix works, grad-clipped replicates; else final report with the honest raw seed story., dc_mode=filtered, per_step_alpha=True, lpd_on=True, lpd_width=4, lpd_kernel=3, anisotropic_on_top=False, post_bilateral=True, post_n_bf=3, post_bf_kernel=7, post_bf_sigma_r=0.02, grad_clip=0.1", "agent": "param_efficient-claude-agentic", "campaign": "search-20260703-01", "cfg_full": {"alpha_init": 0.1, "anisotropic_on_top": false, "batch_size": 4, "bf_gain_init": 0.0, "bf_kernel": 7, "bf_multiscale": true, "bf_sigma_r": 0.02, "bf_sigmas": [0.8, 1.6, 3.2], "bilateral_on_top": false, "cosine_lr": true, "dc_mode": "filtered", "display_max": 0.05, "display_min": 0.0, "epochs": 16, "foe_kernel": 7, "foe_n_bumps": 31, "foe_n_filters": 24, "grad_clip": 0.1, "learnable_alpha": true, "lpd_kernel": 3, "lpd_on": true, "lpd_width": 4, "lr": 0.005, "max_train_s": 1080, "n_bf": 1, "n_iter": 30, "per_step_alpha": true, "post_bf_kernel": 7, "post_bf_sigma_r": 0.02, "post_bilateral": true, "post_n_bf": 3, "proj_filter_on": false, "rationale": "iter-35 param_efficient breast -- GRAD-CLIP FIX on the FAILING seed 45. SIX-BOX: (1) PRIOR: champion (filtered-DC K30 + LPD W4 + 3-scale post-BF, 195p) is SEED-FRAGILE: seeds 42/43/44/46 = 0.6201/0.5586/0.5593/0.5469 (4-good mean 0.571+-0.031) but seed45 COLLAPSED to hr 0.0 (converged, PSNR 35.5<baseline -- a bad basin). Default grad_clip=1.0 did not prevent it. (2) FAILURE MODE: on some seeds the LPD+post-filter optimization enters a bad basin early and converges there. (3) ONE KNOB: grad_clip 1.0->0.1 (10x tighter) on the EXACT failing seed 45. All else byte-for-byte the champion. (4) HYPOTHESIS: a tighter grad-clip damps the early large-gradient step that sends seed45 into the bad basin -> seed45 recovers to the ~0.55-0.62 good-seed regime, directly PROVING grad-clip is the fragility fix. If seed45 recovers, re-run 2-3 more seeds with grad_clip=0.1 for a grad-clipped mean+-std (likely tighter). If it does NOT recover, report the raw fragility honestly. (5) BUDGET: identical to the champion (16ep ~1120s), max_train_s=1080, --time=00:30:00, 200-val -> 20-min. (6) SERIAL; iter-36+: if fix works, grad-clipped replicates; else final report with the honest raw seed story.", "reg_type": "bilateral", "seed": 45, "train_n": 200, "val_n": 200}, "challenge": "breast_ct", "change_class": "architecture", "git_commit": "671da566", "images": {"comparison": "runs/breast-ct-claude-agentic-param-efficient-search-20260703-01/iterations/iter-0035/comparison.png", "test_showcase": null, "valtest_showcase": null}, "iter": 35, "kept": false, "metrics": {"headroom": 0.0, "headroom_std": 0.0005835906698231157, "val_psnr": 35.434425354003906, "val_psnr_std": 0.6518200220833746, "val_rmse": 0.005776746664196253, "val_rmse_std": 0.00040988655749895215, "val_ssim": 0.96610426902771, "val_ssim_std": 0.004307837189214848}, "model": "claude-opus-4-8-1m", "obs_path": "breast-ct-claude-agentic-param-efficient-search-20260703-01/iterations/iter-0035/observation.json", "obs_sha1": "585a452ee167a3d1ce4107c04593442a7b89a2a9", "params_M": 0.000195, "params_source": "observation", "rationale": "param_efficient-claude-agentic: reg_type=bilateral, bilateral_on_top=False, proj_filter_on=False, n_iter=30, learnable_alpha=True, alpha_init=0.1, foe_n_filters=24, foe_kernel=7, foe_n_bumps=31, n_bf=1, bf_multiscale=True, bf_sigmas=[0.8, 1.6, 3.2], bf_kernel=7, bf_sigma_r=0.02, bf_gain_init=0.0, epochs=16, cosine_lr=True, lr=0.005, max_train_s=1080, batch_size=4, train_n=200, val_n=200, display_min=0.0, display_max=0.05, seed=45, rationale=iter-35 param_efficient breast -- GRAD-CLIP FIX on the FAILING seed 45. SIX-BOX: (1) PRIOR: champion (filtered-DC K30 + LPD W4 + 3-scale post-BF, 195p) is SEED-FRAGILE: seeds 42/43/44/46 = 0.6201/0.5586/0.5593/0.5469 (4-good mean 0.571+-0.031) but seed45 COLLAPSED to hr 0.0 (converged, PSNR 35.5<baseline -- a bad basin). Default grad_clip=1.0 did not prevent it. (2) FAILURE MODE: on some seeds the LPD+post-filter optimization enters a bad basin early and converges there. (3) ONE KNOB: grad_clip 1.0->0.1 (10x tighter) on the EXACT failing seed 45. All else byte-for-byte the champion. (4) HYPOTHESIS: a tighter grad-clip damps the early large-gradient step that sends seed45 into the bad basin -> seed45 recovers to the ~0.55-0.62 good-seed regime, directly PROVING grad-clip is the fragility fix. If seed45 recovers, re-run 2-3 more seeds with grad_clip=0.1 for a grad-clipped mean+-std (likely tighter). If it does NOT recover, report the raw fragility honestly. (5) BUDGET: identical to the champion (16ep ~1120s), max_train_s=1080, --time=00:30:00, 200-val -> 20-min. (6) SERIAL; iter-36+: if fix works, grad-clipped replicates; else final report with the honest raw seed story., dc_mode=filtered, per_step_alpha=True, lpd_on=True, lpd_width=4, lpd_kernel=3, anisotropic_on_top=False, post_bilateral=True, post_n_bf=3, post_bf_kernel=7, post_bf_sigma_r=0.02, grad_clip=0.1", "run_id": "breast-ct-claude-agentic-param-efficient-search-20260703-01", "runtime": {"elapsed_s": 1144.0459895133972}, "schema_version": 3, "solver_key": "param-efficient", "solver_name": "Param-efficient (evolved)", "split": {"train_n": 200, "val_n": 200}, "status": "discard", "ts": "2026-07-08T07:57:29Z"}
{"advice_for_others": "param_efficient-claude-agentic: reg_type=bilateral, bilateral_on_top=False, proj_filter_on=False, n_iter=30, learnable_alpha=True, alpha_init=0.1, foe_n_filters=24, foe_kernel=7, foe_n_bumps=31, n_bf=1, bf_multiscale=True, bf_sigmas=[0.8, 1.6, 3.2], bf_kernel=7, bf_sigma_r=0.02, bf_gain_init=0.0, epochs=16, cosine_lr=True, lr=0.002, max_train_s=1080, batch_size=4, train_n=200, val_n=200, display_min=0.0, display_max=0.05, seed=45, rationale=iter-36 param_efficient breast -- LOWER LR stabilizer on seed 45. SIX-BOX: (1) PRIOR: champion seed-fragile (4-good 0.571+-0.031, seed45=0.0 collapse). grad_clip 1->0.1 (iter-35) did NOT recover seed45 (still 0.0). The collapse looks like an early LARGE-LR step entering a bad basin (loss converges there). (2) FAILURE MODE: peak LR 5e-3 sends seed45 into a bad basin in the first epochs. (3) ONE KNOB: peak lr 5e-3->2e-3 (gentler start) on the EXACT failing seed 45. All else byte-for-byte the champion (grad_clip back to 1.0). (4) HYPOTHESIS: a gentler LR keeps seed45 in the good basin -> recovers to ~0.55+, showing the fragility is an LR-schedule artifact fixable without arch change. If it recovers, re-run other seeds at lr=2e-3 for a stabilized mean+-std. If NOT, this is intrinsic VN-family seed-fragility -> report honestly (single-best 0.6201, 4-good 0.571+-0.031, 1/5 collapse). (5) BUDGET: identical to champion (16ep ~1120s); note lower LR may need the full 16ep to reach the good regime -- it fits (post-filter champion completes 16ep in budget). --time=00:30:00, 200-val -> 20-min. (6) SERIAL; iter-37: CONCLUDE the seed story (recovered or honest fragility) -> FINAL REPORT., dc_mode=filtered, per_step_alpha=True, lpd_on=True, lpd_width=4, lpd_kernel=3, anisotropic_on_top=False, post_bilateral=True, post_n_bf=3, post_bf_kernel=7, post_bf_sigma_r=0.02, grad_clip=1.0", "agent": "param_efficient-claude-agentic", "campaign": "search-20260703-01", "cfg_full": {"alpha_init": 0.1, "anisotropic_on_top": false, "batch_size": 4, "bf_gain_init": 0.0, "bf_kernel": 7, "bf_multiscale": true, "bf_sigma_r": 0.02, "bf_sigmas": [0.8, 1.6, 3.2], "bilateral_on_top": false, "cosine_lr": true, "dc_mode": "filtered", "display_max": 0.05, "display_min": 0.0, "epochs": 16, "foe_kernel": 7, "foe_n_bumps": 31, "foe_n_filters": 24, "grad_clip": 1.0, "learnable_alpha": true, "lpd_kernel": 3, "lpd_on": true, "lpd_width": 4, "lr": 0.002, "max_train_s": 1080, "n_bf": 1, "n_iter": 30, "per_step_alpha": true, "post_bf_kernel": 7, "post_bf_sigma_r": 0.02, "post_bilateral": true, "post_n_bf": 3, "proj_filter_on": false, "rationale": "iter-36 param_efficient breast -- LOWER LR stabilizer on seed 45. SIX-BOX: (1) PRIOR: champion seed-fragile (4-good 0.571+-0.031, seed45=0.0 collapse). grad_clip 1->0.1 (iter-35) did NOT recover seed45 (still 0.0). The collapse looks like an early LARGE-LR step entering a bad basin (loss converges there). (2) FAILURE MODE: peak LR 5e-3 sends seed45 into a bad basin in the first epochs. (3) ONE KNOB: peak lr 5e-3->2e-3 (gentler start) on the EXACT failing seed 45. All else byte-for-byte the champion (grad_clip back to 1.0). (4) HYPOTHESIS: a gentler LR keeps seed45 in the good basin -> recovers to ~0.55+, showing the fragility is an LR-schedule artifact fixable without arch change. If it recovers, re-run other seeds at lr=2e-3 for a stabilized mean+-std. If NOT, this is intrinsic VN-family seed-fragility -> report honestly (single-best 0.6201, 4-good 0.571+-0.031, 1/5 collapse). (5) BUDGET: identical to champion (16ep ~1120s); note lower LR may need the full 16ep to reach the good regime -- it fits (post-filter champion completes 16ep in budget). --time=00:30:00, 200-val -> 20-min. (6) SERIAL; iter-37: CONCLUDE the seed story (recovered or honest fragility) -> FINAL REPORT.", "reg_type": "bilateral", "seed": 45, "train_n": 200, "val_n": 200}, "challenge": "breast_ct", "change_class": "architecture", "git_commit": "671da566", "images": {"comparison": "runs/breast-ct-claude-agentic-param-efficient-search-20260703-01/iterations/iter-0036/comparison.png", "test_showcase": null, "valtest_showcase": null}, "iter": 36, "kept": false, "metrics": {"headroom": 0.0, "headroom_std": 0.002609951360476503, "val_psnr": 35.51445388793945, "val_psnr_std": 0.673707151543046, "val_rmse": 0.005723764654248953, "val_rmse_std": 0.0004231077739847496, "val_ssim": 0.9696151614189148, "val_ssim_std": 0.003947351978888787}, "model": "claude-opus-4-8-1m", "obs_path": "breast-ct-claude-agentic-param-efficient-search-20260703-01/iterations/iter-0036/observation.json", "obs_sha1": "3baa9e9a799e652c046ad55b2e1de94f481c875b", "params_M": 0.000195, "params_source": "observation", "rationale": "param_efficient-claude-agentic: reg_type=bilateral, bilateral_on_top=False, proj_filter_on=False, n_iter=30, learnable_alpha=True, alpha_init=0.1, foe_n_filters=24, foe_kernel=7, foe_n_bumps=31, n_bf=1, bf_multiscale=True, bf_sigmas=[0.8, 1.6, 3.2], bf_kernel=7, bf_sigma_r=0.02, bf_gain_init=0.0, epochs=16, cosine_lr=True, lr=0.002, max_train_s=1080, batch_size=4, train_n=200, val_n=200, display_min=0.0, display_max=0.05, seed=45, rationale=iter-36 param_efficient breast -- LOWER LR stabilizer on seed 45. SIX-BOX: (1) PRIOR: champion seed-fragile (4-good 0.571+-0.031, seed45=0.0 collapse). grad_clip 1->0.1 (iter-35) did NOT recover seed45 (still 0.0). The collapse looks like an early LARGE-LR step entering a bad basin (loss converges there). (2) FAILURE MODE: peak LR 5e-3 sends seed45 into a bad basin in the first epochs. (3) ONE KNOB: peak lr 5e-3->2e-3 (gentler start) on the EXACT failing seed 45. All else byte-for-byte the champion (grad_clip back to 1.0). (4) HYPOTHESIS: a gentler LR keeps seed45 in the good basin -> recovers to ~0.55+, showing the fragility is an LR-schedule artifact fixable without arch change. If it recovers, re-run other seeds at lr=2e-3 for a stabilized mean+-std. If NOT, this is intrinsic VN-family seed-fragility -> report honestly (single-best 0.6201, 4-good 0.571+-0.031, 1/5 collapse). (5) BUDGET: identical to champion (16ep ~1120s); note lower LR may need the full 16ep to reach the good regime -- it fits (post-filter champion completes 16ep in budget). --time=00:30:00, 200-val -> 20-min. (6) SERIAL; iter-37: CONCLUDE the seed story (recovered or honest fragility) -> FINAL REPORT., dc_mode=filtered, per_step_alpha=True, lpd_on=True, lpd_width=4, lpd_kernel=3, anisotropic_on_top=False, post_bilateral=True, post_n_bf=3, post_bf_kernel=7, post_bf_sigma_r=0.02, grad_clip=1.0", "run_id": "breast-ct-claude-agentic-param-efficient-search-20260703-01", "runtime": {"elapsed_s": 1158.923626422882}, "schema_version": 3, "solver_key": "param-efficient", "solver_name": "Param-efficient (evolved)", "split": {"train_n": 200, "val_n": 200}, "status": "discard", "ts": "2026-07-08T09:06:03Z"}
