{"advice_for_others": "manduca_bilateral-claude-agentic: proj_n_bf=1, proj_sr=1.5, proj_w=5, proj_kernel=5, bf_d_w_ratio=0.16666666666666666, manduca_N0=100000.0, manduca_bowtie=False, img_n_bf=6, img_kernel=5, img_sx=0.5, img_sy=0.5, img_sr=0.05, epochs=30, batch_size=1, lr=0.005, optimizer=adam, lambda_neg=1.0, grad_clip=1.0, train_n=400, val_n=200, val_chunk=10, seed=42, rationale=iter-7 manduca_bilateral breast (train_n=400, val=200). SIX-BOX from BEST (iter-4 img_sr=0.05 ep=10 hr=0.2752): (1) PRIOR: img_sr NOW FULLY MAPPED -- 0.02->0.2466, 0.05->0.2752(peak), 0.07->0.2563, 0.10->0.1558; optimum img_sr=0.05. img_n_bf saturated by 6 (3->6 gave only +0.0036). ALL 6 iters ran ep=10. The sibling breast DD-supervised run showed epochs 10->44 lifted hr 0.81->0.88 monotonically -- epochs is a proven breast-supervised lever, UNTESTED on this bilateral. (2) FAILURE MODE: possible under-training -- iter-4 used only ~236s of the 1200s budget; the trainable bilateral sigmas may still be descending on the supervised MSE. (3) ONE KNOB: epochs 10 -> 30 (from iter-4 best config img_n_bf=6/img_sr=0.05; 3x training passes). (4) HYPOTHESIS: epochs 10->30 lifts hr above 0.2752 because iter-4 was well under budget and the trainable sigmas may still be improving; more gradient passes settle them to a better denoising operating point. FALSIFIER: if hr flat/drops, the 21-param bilateral converged by ep10 -> iter-8 attacks proj_sr or img_kernel. (5) BUDGET: 3x iter-4's 236s ~ 710s < 1200s (20-min budget), 30-min sbatch wall. (6) Loop continues; iter-8 on landing. turbo, save ckpt+recon, params_M logged.", "agent": "manduca_bilateral-claude-agentic", "campaign": "search-20260703-01", "cfg_full": {"batch_size": 1, "bf_d_w_ratio": 0.16666666666666666, "epochs": 30, "grad_clip": 1.0, "img_kernel": 5, "img_n_bf": 6, "img_sr": 0.05, "img_sx": 0.5, "img_sy": 0.5, "lambda_neg": 1.0, "lr": 0.005, "manduca_N0": 100000.0, "manduca_bowtie": false, "optimizer": "adam", "proj_kernel": 5, "proj_n_bf": 1, "proj_sr": 1.5, "proj_w": 5, "rationale": "iter-7 manduca_bilateral breast (train_n=400, val=200). SIX-BOX from BEST (iter-4 img_sr=0.05 ep=10 hr=0.2752): (1) PRIOR: img_sr NOW FULLY MAPPED -- 0.02->0.2466, 0.05->0.2752(peak), 0.07->0.2563, 0.10->0.1558; optimum img_sr=0.05. img_n_bf saturated by 6 (3->6 gave only +0.0036). ALL 6 iters ran ep=10. The sibling breast DD-supervised run showed epochs 10->44 lifted hr 0.81->0.88 monotonically -- epochs is a proven breast-supervised lever, UNTESTED on this bilateral. (2) FAILURE MODE: possible under-training -- iter-4 used only ~236s of the 1200s budget; the trainable bilateral sigmas may still be descending on the supervised MSE. (3) ONE KNOB: epochs 10 -> 30 (from iter-4 best config img_n_bf=6/img_sr=0.05; 3x training passes). (4) HYPOTHESIS: epochs 10->30 lifts hr above 0.2752 because iter-4 was well under budget and the trainable sigmas may still be improving; more gradient passes settle them to a better denoising operating point. FALSIFIER: if hr flat/drops, the 21-param bilateral converged by ep10 -> iter-8 attacks proj_sr or img_kernel. (5) BUDGET: 3x iter-4's 236s ~ 710s < 1200s (20-min budget), 30-min sbatch wall. (6) Loop continues; iter-8 on landing. turbo, save ckpt+recon, params_M logged.", "seed": 42, "train_n": 400, "val_chunk": 10, "val_n": 200}, "challenge": "breast_ct", "change_class": "architecture", "git_commit": "671da566", "images": {"comparison": "runs/breast-ct-claude-agentic-manduca-bilateral-search-20260703-01/iterations/iter-0007/comparison.png", "test_showcase": null, "valtest_showcase": null}, "iter": 7, "kept": true, "metrics": {"headroom": 0.2757854391690926, "headroom_std": 0.009502776639350612, "val_psnr": 39.126853942871094, "val_psnr_std": 0.5593636315394316, "val_rmse": 0.0037762601859867573, "val_rmse_std": 0.0002366429204600379, "val_ssim": 0.9815380573272705, "val_ssim_std": 0.0033105130722760946}, "model": "claude-opus-4-8-1m", "obs_path": "breast-ct-claude-agentic-manduca-bilateral-search-20260703-01/iterations/iter-0007/observation.json", "obs_sha1": "a4067824ff6654f3fae556f4b6ea8f28f9e1245e", "params_M": 2.2e-05, "params_source": "observation", "rationale": "manduca_bilateral-claude-agentic: proj_n_bf=1, proj_sr=1.5, proj_w=5, proj_kernel=5, bf_d_w_ratio=0.16666666666666666, manduca_N0=100000.0, manduca_bowtie=False, img_n_bf=6, img_kernel=5, img_sx=0.5, img_sy=0.5, img_sr=0.05, epochs=30, batch_size=1, lr=0.005, optimizer=adam, lambda_neg=1.0, grad_clip=1.0, train_n=400, val_n=200, val_chunk=10, seed=42, rationale=iter-7 manduca_bilateral breast (train_n=400, val=200). SIX-BOX from BEST (iter-4 img_sr=0.05 ep=10 hr=0.2752): (1) PRIOR: img_sr NOW FULLY MAPPED -- 0.02->0.2466, 0.05->0.2752(peak), 0.07->0.2563, 0.10->0.1558; optimum img_sr=0.05. img_n_bf saturated by 6 (3->6 gave only +0.0036). ALL 6 iters ran ep=10. The sibling breast DD-supervised run showed epochs 10->44 lifted hr 0.81->0.88 monotonically -- epochs is a proven breast-supervised lever, UNTESTED on this bilateral. (2) FAILURE MODE: possible under-training -- iter-4 used only ~236s of the 1200s budget; the trainable bilateral sigmas may still be descending on the supervised MSE. (3) ONE KNOB: epochs 10 -> 30 (from iter-4 best config img_n_bf=6/img_sr=0.05; 3x training passes). (4) HYPOTHESIS: epochs 10->30 lifts hr above 0.2752 because iter-4 was well under budget and the trainable sigmas may still be improving; more gradient passes settle them to a better denoising operating point. FALSIFIER: if hr flat/drops, the 21-param bilateral converged by ep10 -> iter-8 attacks proj_sr or img_kernel. (5) BUDGET: 3x iter-4's 236s ~ 710s < 1200s (20-min budget), 30-min sbatch wall. (6) Loop continues; iter-8 on landing. turbo, save ckpt+recon, params_M logged.", "run_id": "breast-ct-claude-agentic-manduca-bilateral-search-20260703-01", "runtime": {"elapsed_s": 652.2504298686981}, "schema_version": 3, "solver_key": "manduca-bilateral", "solver_name": "Manduca proj-bilateral (trainable)", "split": {"train_n": 400, "val_n": 200}, "status": "keep", "ts": "2026-07-04T20:21:07Z"}
{"advice_for_others": "manduca_bilateral-claude-agentic: proj_n_bf=1, proj_sr=1.5, proj_w=5, proj_kernel=5, bf_d_w_ratio=0.16666666666666666, manduca_N0=100000.0, manduca_bowtie=False, img_n_bf=6, img_kernel=9, img_sx=0.5, img_sy=0.5, img_sr=0.05, epochs=10, batch_size=1, lr=0.005, optimizer=adam, lambda_neg=1.0, grad_clip=1.0, train_n=400, val_n=200, val_chunk=10, seed=42, rationale=iter-8 manduca_bilateral breast (train_n=400, val=200). SIX-BOX from BEST (iter-4/7 img_sr=0.05 img_n_bf=6 hr~0.2755): (1) PRIOR: best hr=0.2758 (iter-7 ep30) ~= iter-4 0.2752 (ep10). img_n_bf SATURATED by 6; img_sr PEAK=0.05 (fully mapped); EPOCHS INERT (10->30 = +0.0006, 21-param bilateral converged by ep10). Image spatial footprint (img_kernel=5, img_sx=img_sy=0.5) UNTOUCHED. (2) FAILURE MODE: the image bilateral spatial reach is small -- kernel=5/sigma=0.5px pools only immediate neighbors, so coherent 128-view STREAKS (which extend across many pixels) aren't averaged out. Range bandwidth is tuned; the spatial kernel cannot reach the streak structure. (3) ONE KNOB: img_kernel 5 -> 9 (from iter-4 best; ep=10 kept -- proven equivalent to ep30, cheaper). Larger spatial support per filter. (4) HYPOTHESIS: img_kernel 5->9 lifts hr above 0.2758 because a wider spatial kernel lets each edge-preserving bilateral pool pixels further along the coherent streak direction, suppressing streak residual the 5-tap kernel can't reach; range sigma=0.05 keeps it edge-preserving. FALSIFIER: if hr flat/drops, spatial reach not binding (or sigma_spatial=0.5 caps effective reach) -> iter-9 raises img_sx/img_sy instead. (5) BUDGET: larger kernel = modestly more compute; ep10 base 236s -> est ~400s, under 20-min. (6) Loop continues; iter-9 on landing. turbo, save ckpt+recon, params_M logged.", "agent": "manduca_bilateral-claude-agentic", "campaign": "search-20260703-01", "cfg_full": {"batch_size": 1, "bf_d_w_ratio": 0.16666666666666666, "epochs": 10, "grad_clip": 1.0, "img_kernel": 9, "img_n_bf": 6, "img_sr": 0.05, "img_sx": 0.5, "img_sy": 0.5, "lambda_neg": 1.0, "lr": 0.005, "manduca_N0": 100000.0, "manduca_bowtie": false, "optimizer": "adam", "proj_kernel": 5, "proj_n_bf": 1, "proj_sr": 1.5, "proj_w": 5, "rationale": "iter-8 manduca_bilateral breast (train_n=400, val=200). SIX-BOX from BEST (iter-4/7 img_sr=0.05 img_n_bf=6 hr~0.2755): (1) PRIOR: best hr=0.2758 (iter-7 ep30) ~= iter-4 0.2752 (ep10). img_n_bf SATURATED by 6; img_sr PEAK=0.05 (fully mapped); EPOCHS INERT (10->30 = +0.0006, 21-param bilateral converged by ep10). Image spatial footprint (img_kernel=5, img_sx=img_sy=0.5) UNTOUCHED. (2) FAILURE MODE: the image bilateral spatial reach is small -- kernel=5/sigma=0.5px pools only immediate neighbors, so coherent 128-view STREAKS (which extend across many pixels) aren't averaged out. Range bandwidth is tuned; the spatial kernel cannot reach the streak structure. (3) ONE KNOB: img_kernel 5 -> 9 (from iter-4 best; ep=10 kept -- proven equivalent to ep30, cheaper). Larger spatial support per filter. (4) HYPOTHESIS: img_kernel 5->9 lifts hr above 0.2758 because a wider spatial kernel lets each edge-preserving bilateral pool pixels further along the coherent streak direction, suppressing streak residual the 5-tap kernel can't reach; range sigma=0.05 keeps it edge-preserving. FALSIFIER: if hr flat/drops, spatial reach not binding (or sigma_spatial=0.5 caps effective reach) -> iter-9 raises img_sx/img_sy instead. (5) BUDGET: larger kernel = modestly more compute; ep10 base 236s -> est ~400s, under 20-min. (6) Loop continues; iter-9 on landing. turbo, save ckpt+recon, params_M logged.", "seed": 42, "train_n": 400, "val_chunk": 10, "val_n": 200}, "challenge": "breast_ct", "change_class": "architecture", "git_commit": "671da566", "images": {"comparison": "runs/breast-ct-claude-agentic-manduca-bilateral-search-20260703-01/iterations/iter-0008/comparison.png", "test_showcase": null, "valtest_showcase": null}, "iter": 8, "kept": true, "metrics": {"headroom": 0.27708013751888916, "headroom_std": 0.009382003855316885, "val_psnr": 39.14239501953125, "val_psnr_std": 0.5638711499244398, "val_rmse": 0.0037695092614740133, "val_rmse_std": 0.00023819978690335717, "val_ssim": 0.9814385175704956, "val_ssim_std": 0.0033376393235195396}, "model": "claude-opus-4-8-1m", "obs_path": "breast-ct-claude-agentic-manduca-bilateral-search-20260703-01/iterations/iter-0008/observation.json", "obs_sha1": "7411405d988287e3101ffb12e77c41cf336c091c", "params_M": 2.2e-05, "params_source": "observation", "rationale": "manduca_bilateral-claude-agentic: proj_n_bf=1, proj_sr=1.5, proj_w=5, proj_kernel=5, bf_d_w_ratio=0.16666666666666666, manduca_N0=100000.0, manduca_bowtie=False, img_n_bf=6, img_kernel=9, img_sx=0.5, img_sy=0.5, img_sr=0.05, epochs=10, batch_size=1, lr=0.005, optimizer=adam, lambda_neg=1.0, grad_clip=1.0, train_n=400, val_n=200, val_chunk=10, seed=42, rationale=iter-8 manduca_bilateral breast (train_n=400, val=200). SIX-BOX from BEST (iter-4/7 img_sr=0.05 img_n_bf=6 hr~0.2755): (1) PRIOR: best hr=0.2758 (iter-7 ep30) ~= iter-4 0.2752 (ep10). img_n_bf SATURATED by 6; img_sr PEAK=0.05 (fully mapped); EPOCHS INERT (10->30 = +0.0006, 21-param bilateral converged by ep10). Image spatial footprint (img_kernel=5, img_sx=img_sy=0.5) UNTOUCHED. (2) FAILURE MODE: the image bilateral spatial reach is small -- kernel=5/sigma=0.5px pools only immediate neighbors, so coherent 128-view STREAKS (which extend across many pixels) aren't averaged out. Range bandwidth is tuned; the spatial kernel cannot reach the streak structure. (3) ONE KNOB: img_kernel 5 -> 9 (from iter-4 best; ep=10 kept -- proven equivalent to ep30, cheaper). Larger spatial support per filter. (4) HYPOTHESIS: img_kernel 5->9 lifts hr above 0.2758 because a wider spatial kernel lets each edge-preserving bilateral pool pixels further along the coherent streak direction, suppressing streak residual the 5-tap kernel can't reach; range sigma=0.05 keeps it edge-preserving. FALSIFIER: if hr flat/drops, spatial reach not binding (or sigma_spatial=0.5 caps effective reach) -> iter-9 raises img_sx/img_sy instead. (5) BUDGET: larger kernel = modestly more compute; ep10 base 236s -> est ~400s, under 20-min. (6) Loop continues; iter-9 on landing. turbo, save ckpt+recon, params_M logged.", "run_id": "breast-ct-claude-agentic-manduca-bilateral-search-20260703-01", "runtime": {"elapsed_s": 497.2898223400116}, "schema_version": 3, "solver_key": "manduca-bilateral", "solver_name": "Manduca proj-bilateral (trainable)", "split": {"train_n": 400, "val_n": 200}, "status": "keep", "ts": "2026-07-04T23:18:33Z"}
{"advice_for_others": "manduca_bilateral-claude-agentic: proj_n_bf=3, proj_sr=1.5, proj_w=5, proj_kernel=5, bf_d_w_ratio=0.16666666666666666, manduca_N0=100000.0, manduca_bowtie=False, img_n_bf=6, img_kernel=9, img_sx=0.5, img_sy=0.5, img_sr=0.05, epochs=10, batch_size=1, lr=0.005, optimizer=adam, lambda_neg=1.0, grad_clip=1.0, train_n=400, val_n=200, val_chunk=10, seed=42, rationale=iter-9 manduca_bilateral breast (train_n=400, val=200). SIX-BOX from BEST (iter-8 img_kernel=9 hr=0.2771): (1) PRIOR: IMAGE-DOMAIN fully explored -- img_n_bf sat@6, img_sr peak=0.05, img_kernel 5->9 (+0.0019, best 0.2771), epochs inert. The PROJECTION-DOMAIN Manduca denoiser (proj_n_bf=1, proj_sr=1.5, bf_d_w_ratio=1/6) is UNTOUCHED -- the solver's namesake core. (2) FAILURE MODE: the single proj-domain bilateral (proj_n_bf=1) is one shallow noise-modeled smoothing pass on the sqrt-count sinogram; too weak to suppress the sinogram inconsistencies that generate streaks after FBP. The image tail cleans post-FBP residual but cannot undo streak structure already baked into backprojection. (3) ONE KNOB: proj_n_bf 1 -> 3 (deepen the projection-domain Manduca bilateral cascade; from iter-8 best; params 21->27). Architecturally-distinct config family from the 8 image-domain-focused iters. (4) HYPOTHESIS: proj_n_bf 1->3 lifts hr above 0.2771 because a deeper noise-modeled bilateral cascade on the sqrt-count sinogram suppresses more signal-dependent sinogram noise BEFORE backprojection, reducing streak inconsistencies the post-FBP tail only partially cleans. FALSIFIER: if hr flat (as on Mayo), proj-domain is cosmetic on breast too -> iter-10 tunes proj_sr or consolidates. (5) BUDGET: +2 proj bilateral passes; ep10 base ~236-500s -> est ~450s, under 20-min. (6) Loop continues; iter-10 on landing. turbo, save ckpt+recon, params_M logged.", "agent": "manduca_bilateral-claude-agentic", "campaign": "search-20260703-01", "cfg_full": {"batch_size": 1, "bf_d_w_ratio": 0.16666666666666666, "epochs": 10, "grad_clip": 1.0, "img_kernel": 9, "img_n_bf": 6, "img_sr": 0.05, "img_sx": 0.5, "img_sy": 0.5, "lambda_neg": 1.0, "lr": 0.005, "manduca_N0": 100000.0, "manduca_bowtie": false, "optimizer": "adam", "proj_kernel": 5, "proj_n_bf": 3, "proj_sr": 1.5, "proj_w": 5, "rationale": "iter-9 manduca_bilateral breast (train_n=400, val=200). SIX-BOX from BEST (iter-8 img_kernel=9 hr=0.2771): (1) PRIOR: IMAGE-DOMAIN fully explored -- img_n_bf sat@6, img_sr peak=0.05, img_kernel 5->9 (+0.0019, best 0.2771), epochs inert. The PROJECTION-DOMAIN Manduca denoiser (proj_n_bf=1, proj_sr=1.5, bf_d_w_ratio=1/6) is UNTOUCHED -- the solver's namesake core. (2) FAILURE MODE: the single proj-domain bilateral (proj_n_bf=1) is one shallow noise-modeled smoothing pass on the sqrt-count sinogram; too weak to suppress the sinogram inconsistencies that generate streaks after FBP. The image tail cleans post-FBP residual but cannot undo streak structure already baked into backprojection. (3) ONE KNOB: proj_n_bf 1 -> 3 (deepen the projection-domain Manduca bilateral cascade; from iter-8 best; params 21->27). Architecturally-distinct config family from the 8 image-domain-focused iters. (4) HYPOTHESIS: proj_n_bf 1->3 lifts hr above 0.2771 because a deeper noise-modeled bilateral cascade on the sqrt-count sinogram suppresses more signal-dependent sinogram noise BEFORE backprojection, reducing streak inconsistencies the post-FBP tail only partially cleans. FALSIFIER: if hr flat (as on Mayo), proj-domain is cosmetic on breast too -> iter-10 tunes proj_sr or consolidates. (5) BUDGET: +2 proj bilateral passes; ep10 base ~236-500s -> est ~450s, under 20-min. (6) Loop continues; iter-10 on landing. turbo, save ckpt+recon, params_M logged.", "seed": 42, "train_n": 400, "val_chunk": 10, "val_n": 200}, "challenge": "breast_ct", "change_class": "architecture", "git_commit": "671da566", "images": {"comparison": "runs/breast-ct-claude-agentic-manduca-bilateral-search-20260703-01/iterations/iter-0009/comparison.png", "test_showcase": null, "valtest_showcase": null}, "iter": 9, "kept": true, "metrics": {"headroom": 0.24716275976908952, "headroom_std": 0.008670554388877663, "val_psnr": 38.7901725769043, "val_psnr_std": 0.5872044536339804, "val_rmse": 0.003925506956875324, "val_rmse_std": 0.0002587880573437355, "val_ssim": 0.9804481267929077, "val_ssim_std": 0.00350821964614662}, "model": "claude-opus-4-8-1m", "obs_path": "breast-ct-claude-agentic-manduca-bilateral-search-20260703-01/iterations/iter-0009/observation.json", "obs_sha1": "15416bf9ff8d8f1603aa8efeb6deb70e060a1821", "params_M": 2.8e-05, "params_source": "observation", "rationale": "manduca_bilateral-claude-agentic: proj_n_bf=3, proj_sr=1.5, proj_w=5, proj_kernel=5, bf_d_w_ratio=0.16666666666666666, manduca_N0=100000.0, manduca_bowtie=False, img_n_bf=6, img_kernel=9, img_sx=0.5, img_sy=0.5, img_sr=0.05, epochs=10, batch_size=1, lr=0.005, optimizer=adam, lambda_neg=1.0, grad_clip=1.0, train_n=400, val_n=200, val_chunk=10, seed=42, rationale=iter-9 manduca_bilateral breast (train_n=400, val=200). SIX-BOX from BEST (iter-8 img_kernel=9 hr=0.2771): (1) PRIOR: IMAGE-DOMAIN fully explored -- img_n_bf sat@6, img_sr peak=0.05, img_kernel 5->9 (+0.0019, best 0.2771), epochs inert. The PROJECTION-DOMAIN Manduca denoiser (proj_n_bf=1, proj_sr=1.5, bf_d_w_ratio=1/6) is UNTOUCHED -- the solver's namesake core. (2) FAILURE MODE: the single proj-domain bilateral (proj_n_bf=1) is one shallow noise-modeled smoothing pass on the sqrt-count sinogram; too weak to suppress the sinogram inconsistencies that generate streaks after FBP. The image tail cleans post-FBP residual but cannot undo streak structure already baked into backprojection. (3) ONE KNOB: proj_n_bf 1 -> 3 (deepen the projection-domain Manduca bilateral cascade; from iter-8 best; params 21->27). Architecturally-distinct config family from the 8 image-domain-focused iters. (4) HYPOTHESIS: proj_n_bf 1->3 lifts hr above 0.2771 because a deeper noise-modeled bilateral cascade on the sqrt-count sinogram suppresses more signal-dependent sinogram noise BEFORE backprojection, reducing streak inconsistencies the post-FBP tail only partially cleans. FALSIFIER: if hr flat (as on Mayo), proj-domain is cosmetic on breast too -> iter-10 tunes proj_sr or consolidates. (5) BUDGET: +2 proj bilateral passes; ep10 base ~236-500s -> est ~450s, under 20-min. (6) Loop continues; iter-10 on landing. turbo, save ckpt+recon, params_M logged.", "run_id": "breast-ct-claude-agentic-manduca-bilateral-search-20260703-01", "runtime": {"elapsed_s": 485.55787205696106}, "schema_version": 3, "solver_key": "manduca-bilateral", "solver_name": "Manduca proj-bilateral (trainable)", "split": {"train_n": 400, "val_n": 200}, "status": "keep", "ts": "2026-07-05T03:18:47Z"}
