{"advice_for_others": "manduca_bilateral-claude-agentic: proj_n_bf=1, proj_sr=1.5, proj_w=5, proj_kernel=5, bf_d_w_ratio=0.16666666666666666, manduca_N0=100000.0, manduca_bowtie=False, img_n_bf=6, img_kernel=9, img_sx=0.5, img_sy=0.5, img_sr=0.05, epochs=10, batch_size=1, lr=0.005, optimizer=adam, lambda_neg=1.0, grad_clip=1.0, train_n=400, val_n=200, val_chunk=10, seed=42, rationale=iter-20 manduca_bilateral breast CEILING CONFIRMATION toward HARD iter-20 stop (val=200). Ceiling hr=0.2771 reproduced 4x (iter-8/11/15/16); best hr=0.2781 (iter-14 train_n=1600). ALL levers exhausted: img_sr peak 0.05, img_n_bf sat@6, img_kernel best 9, img spatial 0.5 optimal, epochs inert, lr 5e-3 optimal (1e-3 worse), proj_n_bf worse, proj_sr flat, bowtie collapsed hr=0, train_n 4x=+0.001 (capacity-bound not data-bound). Firm 21-param image-bilateral ceiling; the sparse-view FBP + trainable bilateral tail sets ~0.278. ONE KNOB: none productive remains -- confirmation at best efficient config (train_n=400 seed=42). BUDGET ~470s. turbo, save ckpt+recon, params_M logged.", "agent": "manduca_bilateral-claude-agentic", "campaign": "search-20260703-01", "cfg_full": {"batch_size": 1, "bf_d_w_ratio": 0.16666666666666666, "epochs": 10, "grad_clip": 1.0, "img_kernel": 9, "img_n_bf": 6, "img_sr": 0.05, "img_sx": 0.5, "img_sy": 0.5, "lambda_neg": 1.0, "lr": 0.005, "manduca_N0": 100000.0, "manduca_bowtie": false, "optimizer": "adam", "proj_kernel": 5, "proj_n_bf": 1, "proj_sr": 1.5, "proj_w": 5, "rationale": "iter-20 manduca_bilateral breast CEILING CONFIRMATION toward HARD iter-20 stop (val=200). Ceiling hr=0.2771 reproduced 4x (iter-8/11/15/16); best hr=0.2781 (iter-14 train_n=1600). ALL levers exhausted: img_sr peak 0.05, img_n_bf sat@6, img_kernel best 9, img spatial 0.5 optimal, epochs inert, lr 5e-3 optimal (1e-3 worse), proj_n_bf worse, proj_sr flat, bowtie collapsed hr=0, train_n 4x=+0.001 (capacity-bound not data-bound). Firm 21-param image-bilateral ceiling; the sparse-view FBP + trainable bilateral tail sets ~0.278. ONE KNOB: none productive remains -- confirmation at best efficient config (train_n=400 seed=42). BUDGET ~470s. turbo, save ckpt+recon, params_M logged.", "seed": 42, "train_n": 400, "val_chunk": 10, "val_n": 200}, "challenge": "breast_ct", "change_class": "architecture", "git_commit": "671da566", "images": {"comparison": "runs/breast-ct-claude-agentic-manduca-bilateral-search-20260703-01/iterations/iter-0020/comparison.png", "test_showcase": null, "valtest_showcase": null}, "iter": 20, "kept": true, "metrics": {"headroom": 0.27708134313556254, "headroom_std": 0.00938200902664152, "val_psnr": 39.14241027832031, "val_psnr_std": 0.5638719071705757, "val_rmse": 0.0037695029750466347, "val_rmse_std": 0.0002381997378602056, "val_ssim": 0.9814385771751404, "val_ssim_std": 0.0033376300524529472}, "model": "claude-opus-4-8-1m", "obs_path": "breast-ct-claude-agentic-manduca-bilateral-search-20260703-01/iterations/iter-0020/observation.json", "obs_sha1": "7c53247d9d6595a970ae0cb1594e6d0f8a66295d", "params_M": 2.2e-05, "params_source": "observation", "rationale": "manduca_bilateral-claude-agentic: proj_n_bf=1, proj_sr=1.5, proj_w=5, proj_kernel=5, bf_d_w_ratio=0.16666666666666666, manduca_N0=100000.0, manduca_bowtie=False, img_n_bf=6, img_kernel=9, img_sx=0.5, img_sy=0.5, img_sr=0.05, epochs=10, batch_size=1, lr=0.005, optimizer=adam, lambda_neg=1.0, grad_clip=1.0, train_n=400, val_n=200, val_chunk=10, seed=42, rationale=iter-20 manduca_bilateral breast CEILING CONFIRMATION toward HARD iter-20 stop (val=200). Ceiling hr=0.2771 reproduced 4x (iter-8/11/15/16); best hr=0.2781 (iter-14 train_n=1600). ALL levers exhausted: img_sr peak 0.05, img_n_bf sat@6, img_kernel best 9, img spatial 0.5 optimal, epochs inert, lr 5e-3 optimal (1e-3 worse), proj_n_bf worse, proj_sr flat, bowtie collapsed hr=0, train_n 4x=+0.001 (capacity-bound not data-bound). Firm 21-param image-bilateral ceiling; the sparse-view FBP + trainable bilateral tail sets ~0.278. ONE KNOB: none productive remains -- confirmation at best efficient config (train_n=400 seed=42). BUDGET ~470s. turbo, save ckpt+recon, params_M logged.", "run_id": "breast-ct-claude-agentic-manduca-bilateral-search-20260703-01", "runtime": {"elapsed_s": 335.9816083908081}, "schema_version": 3, "solver_key": "manduca-bilateral", "solver_name": "Manduca proj-bilateral (trainable)", "split": {"train_n": 400, "val_n": 200}, "status": "keep", "ts": "2026-07-05T14:36:53Z"}
{"advice_for_others": "manhart_pwls_tv-claude-agentic: val_n=200, pwls_gamma=1.0, pwls_weight_norm=mean, tv_lambda=0.001, tv_iterations=200, tv_lr=0.01, tv_decay=0.01, tv_optimizer=gd, tv_init=fbp, rationale=iter-1 onboarding on breast_ct (128-view sparse, mu up to 0.05): Manhart 2013 PWLS statistical ray weighting W=exp(-gamma*p) on TV-iterative, gamma=1.0 paper baseline. Seeded from Mayo run config (tv_lambda=0.001, tv_iter=200, tv_lr=0.01, gd, fbp init). val_n=200 (full breast val). Feasibility: does PWLS-TV run on breast and clear the FBP baseline.", "agent": "manhart_pwls_tv-claude-agentic", "campaign": "search-20260703-01", "cfg_full": {"pwls_gamma": 1.0, "pwls_weight_norm": "mean", "rationale": "iter-1 onboarding on breast_ct (128-view sparse, mu up to 0.05): Manhart 2013 PWLS statistical ray weighting W=exp(-gamma*p) on TV-iterative, gamma=1.0 paper baseline. Seeded from Mayo run config (tv_lambda=0.001, tv_iter=200, tv_lr=0.01, gd, fbp init). val_n=200 (full breast val). Feasibility: does PWLS-TV run on breast and clear the FBP baseline.", "tv_decay": 0.01, "tv_init": "fbp", "tv_iterations": 200, "tv_lambda": 0.001, "tv_lr": 0.01, "tv_optimizer": "gd", "val_n": 200}, "challenge": "breast_ct", "change_class": "architecture", "git_commit": null, "images": {"comparison": "runs/breast-ct-claude-agentic-manhart-pwls-tv-search-20260703-01/iterations/iter-0001/comparison.png", "test_showcase": null, "valtest_showcase": null}, "iter": 1, "kept": true, "metrics": {"headroom": 0.16647824813002154, "headroom_std": null, "val_psnr": 37.905860900878906, "val_psnr_std": null, "val_rmse": 0.004346218891441822, "val_rmse_std": null, "val_ssim": 0.9611913561820984, "val_ssim_std": null}, "model": "claude-opus-4-8-1m", "obs_path": "breast-ct-claude-agentic-manhart-pwls-tv-search-20260703-01/iterations/iter-0001/observation.json", "obs_sha1": "4e3915310fd73f16c35402b58fcb6b1453067f65", "params_M": 0.0, "params_source": "observation", "rationale": "manhart_pwls_tv-claude-agentic: val_n=200, pwls_gamma=1.0, pwls_weight_norm=mean, tv_lambda=0.001, tv_iterations=200, tv_lr=0.01, tv_decay=0.01, tv_optimizer=gd, tv_init=fbp, rationale=iter-1 onboarding on breast_ct (128-view sparse, mu up to 0.05): Manhart 2013 PWLS statistical ray weighting W=exp(-gamma*p) on TV-iterative, gamma=1.0 paper baseline. Seeded from Mayo run config (tv_lambda=0.001, tv_iter=200, tv_lr=0.01, gd, fbp init). val_n=200 (full breast val). Feasibility: does PWLS-TV run on breast and clear the FBP baseline.", "run_id": "breast-ct-claude-agentic-manhart-pwls-tv-search-20260703-01", "runtime": {"elapsed_s": 198.76592993736267}, "schema_version": 3, "solver_key": "manhart-pwls-tv", "solver_name": "Manhart PWLS-TV (ray-weighted)", "split": {"train_n": 400, "val_n": 200}, "status": "keep", "ts": "2026-07-03T22:37:56Z"}
{"advice_for_others": "manhart_pwls_tv-claude-agentic: val_n=200, pwls_gamma=0.0, pwls_weight_norm=mean, tv_lambda=0.001, tv_iterations=200, tv_lr=0.01, tv_decay=0.01, tv_optimizer=gd, tv_init=fbp, rationale=iter-2 PWLS-ACTIVATION TEST. iter-1 (gamma=1.0, Manhart) gave hr=0.16648/ssim=0.9612. Mayo lesson: at tv_lambda=0.001 the TV term can dominate the data term ~1000x, making the PWLS ray-weight W=exp(-gamma*p) INERT (Mayo iter-1 g=1.0 vs iter-2 g=0.5 were bit-identical). ONE knob: pwls_gamma 1.0->0.0 (exactly plain TV; W==1 everywhere). HYPOTHESIS: if plain-TV (g=0) hr DIFFERS from iter-1's g=1.0, PWLS ray-weighting is LIVE on breast (128-view sparse data term bites harder than dense Mayo) and gamma is a real lever; if bit-identical, PWLS is inert here and I pivot to TV knobs (tv_lambda/lr/iterations). All else fixed from iter-1. Budget: iter-1 ran 199s<<1200s.", "agent": "manhart_pwls_tv-claude-agentic", "campaign": "search-20260703-01", "cfg_full": {"pwls_gamma": 0.0, "pwls_weight_norm": "mean", "rationale": "iter-2 PWLS-ACTIVATION TEST. iter-1 (gamma=1.0, Manhart) gave hr=0.16648/ssim=0.9612. Mayo lesson: at tv_lambda=0.001 the TV term can dominate the data term ~1000x, making the PWLS ray-weight W=exp(-gamma*p) INERT (Mayo iter-1 g=1.0 vs iter-2 g=0.5 were bit-identical). ONE knob: pwls_gamma 1.0->0.0 (exactly plain TV; W==1 everywhere). HYPOTHESIS: if plain-TV (g=0) hr DIFFERS from iter-1's g=1.0, PWLS ray-weighting is LIVE on breast (128-view sparse data term bites harder than dense Mayo) and gamma is a real lever; if bit-identical, PWLS is inert here and I pivot to TV knobs (tv_lambda/lr/iterations). All else fixed from iter-1. Budget: iter-1 ran 199s<<1200s.", "tv_decay": 0.01, "tv_init": "fbp", "tv_iterations": 200, "tv_lambda": 0.001, "tv_lr": 0.01, "tv_optimizer": "gd", "val_n": 200}, "challenge": "breast_ct", "change_class": "architecture", "git_commit": null, "images": {"comparison": "runs/breast-ct-claude-agentic-manhart-pwls-tv-search-20260703-01/iterations/iter-0002/comparison.png", "test_showcase": null, "valtest_showcase": null}, "iter": 2, "kept": true, "metrics": {"headroom": 0.16647790587870925, "headroom_std": null, "val_psnr": 37.90584945678711, "val_psnr_std": null, "val_rmse": 0.0043462226167321205, "val_rmse_std": null, "val_ssim": 0.9611910581588745, "val_ssim_std": null}, "model": "claude-opus-4-8-1m", "obs_path": "breast-ct-claude-agentic-manhart-pwls-tv-search-20260703-01/iterations/iter-0002/observation.json", "obs_sha1": "30a13ecf98fb6a10df20cedac467420b08b98397", "params_M": 0.0, "params_source": "observation", "rationale": "manhart_pwls_tv-claude-agentic: val_n=200, pwls_gamma=0.0, pwls_weight_norm=mean, tv_lambda=0.001, tv_iterations=200, tv_lr=0.01, tv_decay=0.01, tv_optimizer=gd, tv_init=fbp, rationale=iter-2 PWLS-ACTIVATION TEST. iter-1 (gamma=1.0, Manhart) gave hr=0.16648/ssim=0.9612. Mayo lesson: at tv_lambda=0.001 the TV term can dominate the data term ~1000x, making the PWLS ray-weight W=exp(-gamma*p) INERT (Mayo iter-1 g=1.0 vs iter-2 g=0.5 were bit-identical). ONE knob: pwls_gamma 1.0->0.0 (exactly plain TV; W==1 everywhere). HYPOTHESIS: if plain-TV (g=0) hr DIFFERS from iter-1's g=1.0, PWLS ray-weighting is LIVE on breast (128-view sparse data term bites harder than dense Mayo) and gamma is a real lever; if bit-identical, PWLS is inert here and I pivot to TV knobs (tv_lambda/lr/iterations). All else fixed from iter-1. Budget: iter-1 ran 199s<<1200s.", "run_id": "breast-ct-claude-agentic-manhart-pwls-tv-search-20260703-01", "runtime": {"elapsed_s": 266.69430136680603}, "schema_version": 3, "solver_key": "manhart-pwls-tv", "solver_name": "Manhart PWLS-TV (ray-weighted)", "split": {"train_n": 400, "val_n": 200}, "status": "keep", "ts": "2026-07-03T23:31:54Z"}
{"advice_for_others": "manhart_pwls_tv-claude-agentic: val_n=200, pwls_gamma=1.0, pwls_weight_norm=mean, tv_lambda=0.0001, tv_iterations=200, tv_lr=0.01, tv_decay=0.01, tv_optimizer=gd, tv_init=fbp, rationale=iter-3 PWLS-ACTIVATION (lower lambda). DIAGNOSIS: iter-1 (gamma=1.0) hr=0.16647825 and iter-2 (gamma=0.0 plain TV) hr=0.16647791 differ only at the 8th sig-digit (dHR~3.4e-7) => PWLS ray-weight is INERT at tv_lambda=0.001 (TV term dominates data term, same as Mayo). To let the data term BITE so Manhart's gamma can shape the recon: ONE knob tv_lambda 0.001->1e-4 (10x drop; gamma=1.0 full Manhart kept). HYPOTHESIS: at 10x lower lambda the data-fidelity term is non-negligible, so (a) hr moves materially and (b) PWLS weighting starts to matter; if hr improves this is the productive regime, if it collapses (under-regularized/noisy on 128-view sparse) I back off toward 3e-4. All else fixed from iter-1. Budget: iter-1/2 ran ~200-270s<<1200s.", "agent": "manhart_pwls_tv-claude-agentic", "campaign": "search-20260703-01", "cfg_full": {"pwls_gamma": 1.0, "pwls_weight_norm": "mean", "rationale": "iter-3 PWLS-ACTIVATION (lower lambda). DIAGNOSIS: iter-1 (gamma=1.0) hr=0.16647825 and iter-2 (gamma=0.0 plain TV) hr=0.16647791 differ only at the 8th sig-digit (dHR~3.4e-7) => PWLS ray-weight is INERT at tv_lambda=0.001 (TV term dominates data term, same as Mayo). To let the data term BITE so Manhart's gamma can shape the recon: ONE knob tv_lambda 0.001->1e-4 (10x drop; gamma=1.0 full Manhart kept). HYPOTHESIS: at 10x lower lambda the data-fidelity term is non-negligible, so (a) hr moves materially and (b) PWLS weighting starts to matter; if hr improves this is the productive regime, if it collapses (under-regularized/noisy on 128-view sparse) I back off toward 3e-4. All else fixed from iter-1. Budget: iter-1/2 ran ~200-270s<<1200s.", "tv_decay": 0.01, "tv_init": "fbp", "tv_iterations": 200, "tv_lambda": 0.0001, "tv_lr": 0.01, "tv_optimizer": "gd", "val_n": 200}, "challenge": "breast_ct", "change_class": "architecture", "git_commit": null, "images": {"comparison": "runs/breast-ct-claude-agentic-manhart-pwls-tv-search-20260703-01/iterations/iter-0003/comparison.png", "test_showcase": null, "valtest_showcase": null}, "iter": 3, "kept": true, "metrics": {"headroom": 0.021663056216833843, "headroom_std": null, "val_psnr": 36.514427185058594, "val_psnr_std": null, "val_rmse": 0.005101326387375593, "val_rmse_std": null, "val_ssim": 0.9258205890655518, "val_ssim_std": null}, "model": "claude-opus-4-8-1m", "obs_path": "breast-ct-claude-agentic-manhart-pwls-tv-search-20260703-01/iterations/iter-0003/observation.json", "obs_sha1": "624dbce84924ea08bca01bfb5473a57e8d78f733", "params_M": 0.0, "params_source": "observation", "rationale": "manhart_pwls_tv-claude-agentic: val_n=200, pwls_gamma=1.0, pwls_weight_norm=mean, tv_lambda=0.0001, tv_iterations=200, tv_lr=0.01, tv_decay=0.01, tv_optimizer=gd, tv_init=fbp, rationale=iter-3 PWLS-ACTIVATION (lower lambda). DIAGNOSIS: iter-1 (gamma=1.0) hr=0.16647825 and iter-2 (gamma=0.0 plain TV) hr=0.16647791 differ only at the 8th sig-digit (dHR~3.4e-7) => PWLS ray-weight is INERT at tv_lambda=0.001 (TV term dominates data term, same as Mayo). To let the data term BITE so Manhart's gamma can shape the recon: ONE knob tv_lambda 0.001->1e-4 (10x drop; gamma=1.0 full Manhart kept). HYPOTHESIS: at 10x lower lambda the data-fidelity term is non-negligible, so (a) hr moves materially and (b) PWLS weighting starts to matter; if hr improves this is the productive regime, if it collapses (under-regularized/noisy on 128-view sparse) I back off toward 3e-4. All else fixed from iter-1. Budget: iter-1/2 ran ~200-270s<<1200s.", "run_id": "breast-ct-claude-agentic-manhart-pwls-tv-search-20260703-01", "runtime": {"elapsed_s": 243.8486647605896}, "schema_version": 3, "solver_key": "manhart-pwls-tv", "solver_name": "Manhart PWLS-TV (ray-weighted)", "split": {"train_n": 400, "val_n": 200}, "status": "keep", "ts": "2026-07-04T00:01:31Z"}
{"advice_for_others": "manhart_pwls_tv-claude-agentic: val_n=200, pwls_gamma=1.0, pwls_weight_norm=mean, tv_lambda=0.001, tv_iterations=400, tv_lr=0.01, tv_decay=0.01, tv_optimizer=gd, tv_init=fbp, rationale=iter-4 CONVERGENCE probe. iter-3 (tv_lambda=1e-4) COLLAPSED hr 0.1665->0.0217 (under-regularized: on 128-view sparse the data term drags in streaks/noise faster than PWLS helps) => lower lambda is the WRONG direction; revert to lambda=1e-3. At lambda=1e-3 plain TV only reaches hr=0.1665/ssim=0.96 in 200 GD iters at lr=0.01 \u2014 the data-consistency solve may not be converged. ONE knob: tv_iterations 200->400 (double GD steps, same lambda/lr, gamma=1.0). HYPOTHESIS: more iters enforce data-consistency further so hr climbs past 0.1665; if it saturates the solve is already converged and I pivot to lr/optimizer. Budget: iter-1 200s -> ~400s at 2x iters, <<1200s.", "agent": "manhart_pwls_tv-claude-agentic", "campaign": "search-20260703-01", "cfg_full": {"pwls_gamma": 1.0, "pwls_weight_norm": "mean", "rationale": "iter-4 CONVERGENCE probe. iter-3 (tv_lambda=1e-4) COLLAPSED hr 0.1665->0.0217 (under-regularized: on 128-view sparse the data term drags in streaks/noise faster than PWLS helps) => lower lambda is the WRONG direction; revert to lambda=1e-3. At lambda=1e-3 plain TV only reaches hr=0.1665/ssim=0.96 in 200 GD iters at lr=0.01 \u2014 the data-consistency solve may not be converged. ONE knob: tv_iterations 200->400 (double GD steps, same lambda/lr, gamma=1.0). HYPOTHESIS: more iters enforce data-consistency further so hr climbs past 0.1665; if it saturates the solve is already converged and I pivot to lr/optimizer. Budget: iter-1 200s -> ~400s at 2x iters, <<1200s.", "tv_decay": 0.01, "tv_init": "fbp", "tv_iterations": 400, "tv_lambda": 0.001, "tv_lr": 0.01, "tv_optimizer": "gd", "val_n": 200}, "challenge": "breast_ct", "change_class": "architecture", "git_commit": null, "images": {"comparison": "runs/breast-ct-claude-agentic-manhart-pwls-tv-search-20260703-01/iterations/iter-0004/comparison.png", "test_showcase": null, "valtest_showcase": null}, "iter": 4, "kept": true, "metrics": {"headroom": 0.21782823070216273, "headroom_std": null, "val_psnr": 38.458152770996094, "val_psnr_std": null, "val_rmse": 0.004078465513885021, "val_rmse_std": null, "val_ssim": 0.9714768528938293, "val_ssim_std": null}, "model": "claude-opus-4-8-1m", "obs_path": "breast-ct-claude-agentic-manhart-pwls-tv-search-20260703-01/iterations/iter-0004/observation.json", "obs_sha1": "09c0c3f31e70785d372c46a71e13197096d1353f", "params_M": 0.0, "params_source": "observation", "rationale": "manhart_pwls_tv-claude-agentic: val_n=200, pwls_gamma=1.0, pwls_weight_norm=mean, tv_lambda=0.001, tv_iterations=400, tv_lr=0.01, tv_decay=0.01, tv_optimizer=gd, tv_init=fbp, rationale=iter-4 CONVERGENCE probe. iter-3 (tv_lambda=1e-4) COLLAPSED hr 0.1665->0.0217 (under-regularized: on 128-view sparse the data term drags in streaks/noise faster than PWLS helps) => lower lambda is the WRONG direction; revert to lambda=1e-3. At lambda=1e-3 plain TV only reaches hr=0.1665/ssim=0.96 in 200 GD iters at lr=0.01 \u2014 the data-consistency solve may not be converged. ONE knob: tv_iterations 200->400 (double GD steps, same lambda/lr, gamma=1.0). HYPOTHESIS: more iters enforce data-consistency further so hr climbs past 0.1665; if it saturates the solve is already converged and I pivot to lr/optimizer. Budget: iter-1 200s -> ~400s at 2x iters, <<1200s.", "run_id": "breast-ct-claude-agentic-manhart-pwls-tv-search-20260703-01", "runtime": {"elapsed_s": 388.30950450897217}, "schema_version": 3, "solver_key": "manhart-pwls-tv", "solver_name": "Manhart PWLS-TV (ray-weighted)", "split": {"train_n": 400, "val_n": 200}, "status": "keep", "ts": "2026-07-04T07:45:55Z"}
