{"advice_for_others": "naf-claude-agentic: val_n=12, naf_n_freqs=8, naf_hidden=128, naf_layers=6, naf_n_iter=8000, naf_lr=0.01, naf_tv_weight=0.0001, naf_n_clip=0.05, naf_outer_wall_s=800, naf_per_scene_s=60.0, naf_encoding=fourier, seed=42, rationale=iter-4 breast-ct-claude-agentic-naf-search-20260703-01 (redone breast split train3600/val200/test200 seed20260703; val_n=12 CONSTANT for iters 2-20 per coordinator budget intervention 2026-07-05 -- first-12 of the 200-case breast val split, deterministic). SIX-BOX: (1) prior result: all iters so far hr=0 (iter-1 val_n=20 ssim0.355 PSNR6.26 in 970s, NOT a timeout -- a genuine converged fit). (2) failure mode: NAF per-scene INR recon is far below the 128-view breast LD-FBP baseline. (3) ONE knob changed: naf_layers 4->6. (4) hypothesis: iter-3 (hidden=256) hr=0. KNOB: deepen MLP 4->6 layers (more nonlinear capacity). HYPOTHESIS: depth over width may better compose posenc features into sharp edges. Expect hr=0 (capacity is not the limiter; the basis is). (5) wall: val_n=12 x per_scene 60.0s = ~720s < 20min. (6) serial, no user return.", "agent": "naf-claude-agentic", "campaign": "search-20260703-01", "cfg_full": {"naf_encoding": "fourier", "naf_hidden": 128, "naf_layers": 6, "naf_lr": 0.01, "naf_n_clip": 0.05, "naf_n_freqs": 8, "naf_n_iter": 8000, "naf_outer_wall_s": 800, "naf_per_scene_s": 60.0, "naf_tv_weight": 0.0001, "rationale": "iter-4 breast-ct-claude-agentic-naf-search-20260703-01 (redone breast split train3600/val200/test200 seed20260703; val_n=12 CONSTANT for iters 2-20 per coordinator budget intervention 2026-07-05 -- first-12 of the 200-case breast val split, deterministic). SIX-BOX: (1) prior result: all iters so far hr=0 (iter-1 val_n=20 ssim0.355 PSNR6.26 in 970s, NOT a timeout -- a genuine converged fit). (2) failure mode: NAF per-scene INR recon is far below the 128-view breast LD-FBP baseline. (3) ONE knob changed: naf_layers 4->6. (4) hypothesis: iter-3 (hidden=256) hr=0. KNOB: deepen MLP 4->6 layers (more nonlinear capacity). HYPOTHESIS: depth over width may better compose posenc features into sharp edges. Expect hr=0 (capacity is not the limiter; the basis is). (5) wall: val_n=12 x per_scene 60.0s = ~720s < 20min. (6) serial, no user return.", "seed": 42, "val_n": 12}, "challenge": "breast_ct", "change_class": "architecture", "git_commit": "671da566", "images": {"comparison": "runs/breast-ct-claude-agentic-naf-search-20260703-01/iterations/iter-0004/comparison.png", "test_showcase": null, "valtest_showcase": null}, "iter": 4, "kept": false, "metrics": {"headroom": 0.0, "headroom_std": 0.0, "val_psnr": 6.2663893699646, "val_psnr_std": 0.2078534710795732, "val_rmse": 0.1596093773841858, "val_rmse_std": 0.0016800014389741125, "val_ssim": 0.35450929403305054, "val_ssim_std": 0.0001269633100316407}, "model": "claude-opus-4-8-1m", "obs_path": "breast-ct-claude-agentic-naf-search-20260703-01/iterations/iter-0004/observation.json", "obs_sha1": "0a5387a4b52e362679bef3cac82514a5bc9a7619", "params_M": 0.070657, "params_source": "observation", "rationale": "naf-claude-agentic: val_n=12, naf_n_freqs=8, naf_hidden=128, naf_layers=6, naf_n_iter=8000, naf_lr=0.01, naf_tv_weight=0.0001, naf_n_clip=0.05, naf_outer_wall_s=800, naf_per_scene_s=60.0, naf_encoding=fourier, seed=42, rationale=iter-4 breast-ct-claude-agentic-naf-search-20260703-01 (redone breast split train3600/val200/test200 seed20260703; val_n=12 CONSTANT for iters 2-20 per coordinator budget intervention 2026-07-05 -- first-12 of the 200-case breast val split, deterministic). SIX-BOX: (1) prior result: all iters so far hr=0 (iter-1 val_n=20 ssim0.355 PSNR6.26 in 970s, NOT a timeout -- a genuine converged fit). (2) failure mode: NAF per-scene INR recon is far below the 128-view breast LD-FBP baseline. (3) ONE knob changed: naf_layers 4->6. (4) hypothesis: iter-3 (hidden=256) hr=0. KNOB: deepen MLP 4->6 layers (more nonlinear capacity). HYPOTHESIS: depth over width may better compose posenc features into sharp edges. Expect hr=0 (capacity is not the limiter; the basis is). (5) wall: val_n=12 x per_scene 60.0s = ~720s < 20min. (6) serial, no user return.", "run_id": "breast-ct-claude-agentic-naf-search-20260703-01", "runtime": {"elapsed_s": 728.5963842868805}, "schema_version": 3, "solver_key": "naf", "solver_name": "NAF", "split": {"train_n": 0, "val_n": 12}, "status": "discard", "ts": "2026-07-05T22:25:32Z"}
{"advice_for_others": "naf-claude-agentic: val_n=12, naf_n_freqs=8, naf_hidden=128, naf_layers=4, naf_n_iter=8000, naf_lr=0.003, naf_tv_weight=0.0001, naf_n_clip=0.05, naf_outer_wall_s=800, naf_per_scene_s=60.0, naf_encoding=fourier, seed=42, rationale=iter-5 breast-ct-claude-agentic-naf-search-20260703-01 (redone breast split train3600/val200/test200 seed20260703; val_n=12 CONSTANT for iters 2-20 per coordinator budget intervention 2026-07-05 -- first-12 of the 200-case breast val split, deterministic). SIX-BOX: (1) prior result: all iters so far hr=0 (iter-1 val_n=20 ssim0.355 PSNR6.26 in 970s, NOT a timeout -- a genuine converged fit). (2) failure mode: NAF per-scene INR recon is far below the 128-view breast LD-FBP baseline. (3) ONE knob changed: naf_lr 1e-2->3e-3. (4) hypothesis: iters 2-4 hr=0 at capacity bumps. KNOB: lower lr 1e-2->3e-3 (finer convergence, less bouncing near the minimum). HYPOTHESIS: last_loss plateaued ~0.85-0.91 at lr=1e-2 -- maybe the optimizer overshoots; a smaller lr with the same 60s wall converges to a lower data-fit loss and a sharper recon. Expect hr=0 but tests optimization vs capacity. (5) wall: val_n=12 x per_scene 60.0s = ~720s < 20min. (6) serial, no user return.", "agent": "naf-claude-agentic", "campaign": "search-20260703-01", "cfg_full": {"naf_encoding": "fourier", "naf_hidden": 128, "naf_layers": 4, "naf_lr": 0.003, "naf_n_clip": 0.05, "naf_n_freqs": 8, "naf_n_iter": 8000, "naf_outer_wall_s": 800, "naf_per_scene_s": 60.0, "naf_tv_weight": 0.0001, "rationale": "iter-5 breast-ct-claude-agentic-naf-search-20260703-01 (redone breast split train3600/val200/test200 seed20260703; val_n=12 CONSTANT for iters 2-20 per coordinator budget intervention 2026-07-05 -- first-12 of the 200-case breast val split, deterministic). SIX-BOX: (1) prior result: all iters so far hr=0 (iter-1 val_n=20 ssim0.355 PSNR6.26 in 970s, NOT a timeout -- a genuine converged fit). (2) failure mode: NAF per-scene INR recon is far below the 128-view breast LD-FBP baseline. (3) ONE knob changed: naf_lr 1e-2->3e-3. (4) hypothesis: iters 2-4 hr=0 at capacity bumps. KNOB: lower lr 1e-2->3e-3 (finer convergence, less bouncing near the minimum). HYPOTHESIS: last_loss plateaued ~0.85-0.91 at lr=1e-2 -- maybe the optimizer overshoots; a smaller lr with the same 60s wall converges to a lower data-fit loss and a sharper recon. Expect hr=0 but tests optimization vs capacity. (5) wall: val_n=12 x per_scene 60.0s = ~720s < 20min. (6) serial, no user return.", "seed": 42, "val_n": 12}, "challenge": "breast_ct", "change_class": "architecture", "git_commit": "671da566", "images": {"comparison": "runs/breast-ct-claude-agentic-naf-search-20260703-01/iterations/iter-0005/comparison.png", "test_showcase": null, "valtest_showcase": null}, "iter": 5, "kept": false, "metrics": {"headroom": 0.0, "headroom_std": null, "val_psnr": 13.291093826293945, "val_psnr_std": null, "val_rmse": 0.0710924044251442, "val_rmse_std": null, "val_ssim": 0.7678041458129883, "val_ssim_std": null}, "model": "claude-opus-4-8-1m", "obs_path": "breast-ct-claude-agentic-naf-search-20260703-01/iterations/iter-0005/observation.json", "obs_sha1": "0e2e0b22bc08d4fad8a36be8079bbde277d81dd4", "params_M": 0.037633, "params_source": "observation", "rationale": "naf-claude-agentic: val_n=12, naf_n_freqs=8, naf_hidden=128, naf_layers=4, naf_n_iter=8000, naf_lr=0.003, naf_tv_weight=0.0001, naf_n_clip=0.05, naf_outer_wall_s=800, naf_per_scene_s=60.0, naf_encoding=fourier, seed=42, rationale=iter-5 breast-ct-claude-agentic-naf-search-20260703-01 (redone breast split train3600/val200/test200 seed20260703; val_n=12 CONSTANT for iters 2-20 per coordinator budget intervention 2026-07-05 -- first-12 of the 200-case breast val split, deterministic). SIX-BOX: (1) prior result: all iters so far hr=0 (iter-1 val_n=20 ssim0.355 PSNR6.26 in 970s, NOT a timeout -- a genuine converged fit). (2) failure mode: NAF per-scene INR recon is far below the 128-view breast LD-FBP baseline. (3) ONE knob changed: naf_lr 1e-2->3e-3. (4) hypothesis: iters 2-4 hr=0 at capacity bumps. KNOB: lower lr 1e-2->3e-3 (finer convergence, less bouncing near the minimum). HYPOTHESIS: last_loss plateaued ~0.85-0.91 at lr=1e-2 -- maybe the optimizer overshoots; a smaller lr with the same 60s wall converges to a lower data-fit loss and a sharper recon. Expect hr=0 but tests optimization vs capacity. (5) wall: val_n=12 x per_scene 60.0s = ~720s < 20min. (6) serial, no user return.", "run_id": "breast-ct-claude-agentic-naf-search-20260703-01", "runtime": {"elapsed_s": 729.781270980835}, "schema_version": 3, "solver_key": "naf", "solver_name": "NAF", "split": {"train_n": 0, "val_n": 12}, "status": "discard", "ts": "2026-07-05T23:25:29Z"}
{"advice_for_others": "naf-claude-agentic: val_n=12, naf_n_freqs=8, naf_hidden=128, naf_layers=4, naf_n_iter=8000, naf_lr=0.03, naf_tv_weight=0.0001, naf_n_clip=0.05, naf_outer_wall_s=800, naf_per_scene_s=60.0, naf_encoding=fourier, seed=42, rationale=iter-6 breast-ct-claude-agentic-naf-search-20260703-01 (redone breast split train3600/val200/test200 seed20260703; val_n=12 CONSTANT for iters 2-20 per coordinator budget intervention 2026-07-05 -- first-12 of the 200-case breast val split, deterministic). SIX-BOX: (1) prior result: all iters so far hr=0 (iter-1 val_n=20 ssim0.355 PSNR6.26 in 970s, NOT a timeout -- a genuine converged fit). (2) failure mode: NAF per-scene INR recon is far below the 128-view breast LD-FBP baseline. (3) ONE knob changed: naf_lr 1e-2->3e-2. (4) hypothesis: iter-5 (lr=3e-3) hr=0. KNOB: raise lr the other way 1e-2->3e-2 (faster convergence within the tiny per-scene step budget). HYPOTHESIS: with only ~1000-1500 steps/scene a more aggressive lr reaches a lower loss sooner. Expect hr=0 (loss floor is basis-limited, not step-limited). (5) wall: val_n=12 x per_scene 60.0s = ~720s < 20min. (6) serial, no user return.", "agent": "naf-claude-agentic", "campaign": "search-20260703-01", "cfg_full": {"naf_encoding": "fourier", "naf_hidden": 128, "naf_layers": 4, "naf_lr": 0.03, "naf_n_clip": 0.05, "naf_n_freqs": 8, "naf_n_iter": 8000, "naf_outer_wall_s": 800, "naf_per_scene_s": 60.0, "naf_tv_weight": 0.0001, "rationale": "iter-6 breast-ct-claude-agentic-naf-search-20260703-01 (redone breast split train3600/val200/test200 seed20260703; val_n=12 CONSTANT for iters 2-20 per coordinator budget intervention 2026-07-05 -- first-12 of the 200-case breast val split, deterministic). SIX-BOX: (1) prior result: all iters so far hr=0 (iter-1 val_n=20 ssim0.355 PSNR6.26 in 970s, NOT a timeout -- a genuine converged fit). (2) failure mode: NAF per-scene INR recon is far below the 128-view breast LD-FBP baseline. (3) ONE knob changed: naf_lr 1e-2->3e-2. (4) hypothesis: iter-5 (lr=3e-3) hr=0. KNOB: raise lr the other way 1e-2->3e-2 (faster convergence within the tiny per-scene step budget). HYPOTHESIS: with only ~1000-1500 steps/scene a more aggressive lr reaches a lower loss sooner. Expect hr=0 (loss floor is basis-limited, not step-limited). (5) wall: val_n=12 x per_scene 60.0s = ~720s < 20min. (6) serial, no user return.", "seed": 42, "val_n": 12}, "challenge": "breast_ct", "change_class": "architecture", "git_commit": "671da566", "images": {"comparison": "runs/breast-ct-claude-agentic-naf-search-20260703-01/iterations/iter-0006/comparison.png", "test_showcase": null, "valtest_showcase": null}, "iter": 6, "kept": false, "metrics": {"headroom": 0.0, "headroom_std": null, "val_psnr": 13.284096717834473, "val_psnr_std": null, "val_rmse": 0.07114969938993454, "val_rmse_std": null, "val_ssim": 0.7664913535118103, "val_ssim_std": null}, "model": "claude-opus-4-8-1m", "obs_path": "breast-ct-claude-agentic-naf-search-20260703-01/iterations/iter-0006/observation.json", "obs_sha1": "8750db3be53565e7087e15fffca69e45c4e13fa6", "params_M": 0.037633, "params_source": "observation", "rationale": "naf-claude-agentic: val_n=12, naf_n_freqs=8, naf_hidden=128, naf_layers=4, naf_n_iter=8000, naf_lr=0.03, naf_tv_weight=0.0001, naf_n_clip=0.05, naf_outer_wall_s=800, naf_per_scene_s=60.0, naf_encoding=fourier, seed=42, rationale=iter-6 breast-ct-claude-agentic-naf-search-20260703-01 (redone breast split train3600/val200/test200 seed20260703; val_n=12 CONSTANT for iters 2-20 per coordinator budget intervention 2026-07-05 -- first-12 of the 200-case breast val split, deterministic). SIX-BOX: (1) prior result: all iters so far hr=0 (iter-1 val_n=20 ssim0.355 PSNR6.26 in 970s, NOT a timeout -- a genuine converged fit). (2) failure mode: NAF per-scene INR recon is far below the 128-view breast LD-FBP baseline. (3) ONE knob changed: naf_lr 1e-2->3e-2. (4) hypothesis: iter-5 (lr=3e-3) hr=0. KNOB: raise lr the other way 1e-2->3e-2 (faster convergence within the tiny per-scene step budget). HYPOTHESIS: with only ~1000-1500 steps/scene a more aggressive lr reaches a lower loss sooner. Expect hr=0 (loss floor is basis-limited, not step-limited). (5) wall: val_n=12 x per_scene 60.0s = ~720s < 20min. (6) serial, no user return.", "run_id": "breast-ct-claude-agentic-naf-search-20260703-01", "runtime": {"elapsed_s": 734.95543217659}, "schema_version": 3, "solver_key": "naf", "solver_name": "NAF", "split": {"train_n": 0, "val_n": 12}, "status": "discard", "ts": "2026-07-06T00:25:33Z"}
{"advice_for_others": "naf-claude-agentic: val_n=12, naf_n_freqs=8, naf_hidden=128, naf_layers=4, naf_n_iter=8000, naf_lr=0.01, naf_tv_weight=0.0, naf_n_clip=0.05, naf_outer_wall_s=800, naf_per_scene_s=60.0, naf_encoding=fourier, seed=42, rationale=iter-7 breast-ct-claude-agentic-naf-search-20260703-01 (redone breast split train3600/val200/test200 seed20260703; val_n=12 CONSTANT for iters 2-20 per coordinator budget intervention 2026-07-05 -- first-12 of the 200-case breast val split, deterministic). SIX-BOX: (1) prior result: all iters so far hr=0 (iter-1 val_n=20 ssim0.355 PSNR6.26 in 970s, NOT a timeout -- a genuine converged fit). (2) failure mode: NAF per-scene INR recon is far below the 128-view breast LD-FBP baseline. (3) ONE knob changed: naf_tv_weight 1e-4->0. (4) hypothesis: iters 5-6 (lr sweep) hr=0. KNOB: drop TV prior 1e-4->0 (pure data fit, no smoothing). HYPOTHESIS: TV may be over-smoothing already-blurry NAF output; removing it lets the field sharpen. Expect hr=0 -- NAF's problem is under-resolution, not over-smoothing. (5) wall: val_n=12 x per_scene 60.0s = ~720s < 20min. (6) serial, no user return.", "agent": "naf-claude-agentic", "campaign": "search-20260703-01", "cfg_full": {"naf_encoding": "fourier", "naf_hidden": 128, "naf_layers": 4, "naf_lr": 0.01, "naf_n_clip": 0.05, "naf_n_freqs": 8, "naf_n_iter": 8000, "naf_outer_wall_s": 800, "naf_per_scene_s": 60.0, "naf_tv_weight": 0.0, "rationale": "iter-7 breast-ct-claude-agentic-naf-search-20260703-01 (redone breast split train3600/val200/test200 seed20260703; val_n=12 CONSTANT for iters 2-20 per coordinator budget intervention 2026-07-05 -- first-12 of the 200-case breast val split, deterministic). SIX-BOX: (1) prior result: all iters so far hr=0 (iter-1 val_n=20 ssim0.355 PSNR6.26 in 970s, NOT a timeout -- a genuine converged fit). (2) failure mode: NAF per-scene INR recon is far below the 128-view breast LD-FBP baseline. (3) ONE knob changed: naf_tv_weight 1e-4->0. (4) hypothesis: iters 5-6 (lr sweep) hr=0. KNOB: drop TV prior 1e-4->0 (pure data fit, no smoothing). HYPOTHESIS: TV may be over-smoothing already-blurry NAF output; removing it lets the field sharpen. Expect hr=0 -- NAF's problem is under-resolution, not over-smoothing. (5) wall: val_n=12 x per_scene 60.0s = ~720s < 20min. (6) serial, no user return.", "seed": 42, "val_n": 12}, "challenge": "breast_ct", "change_class": "architecture", "git_commit": "671da566", "images": {"comparison": "runs/breast-ct-claude-agentic-naf-search-20260703-01/iterations/iter-0007/comparison.png", "test_showcase": null, "valtest_showcase": null}, "iter": 7, "kept": false, "metrics": {"headroom": 0.0, "headroom_std": 0.0, "val_psnr": 6.2663893699646, "val_psnr_std": 0.2078534710795732, "val_rmse": 0.1596093773841858, "val_rmse_std": 0.0016800014389741125, "val_ssim": 0.35450929403305054, "val_ssim_std": 0.0001269633100316407}, "model": "claude-opus-4-8-1m", "obs_path": "breast-ct-claude-agentic-naf-search-20260703-01/iterations/iter-0007/observation.json", "obs_sha1": "736c250771c25eb7fd766d73a75fe43f597b0fc7", "params_M": 0.037633, "params_source": "observation", "rationale": "naf-claude-agentic: val_n=12, naf_n_freqs=8, naf_hidden=128, naf_layers=4, naf_n_iter=8000, naf_lr=0.01, naf_tv_weight=0.0, naf_n_clip=0.05, naf_outer_wall_s=800, naf_per_scene_s=60.0, naf_encoding=fourier, seed=42, rationale=iter-7 breast-ct-claude-agentic-naf-search-20260703-01 (redone breast split train3600/val200/test200 seed20260703; val_n=12 CONSTANT for iters 2-20 per coordinator budget intervention 2026-07-05 -- first-12 of the 200-case breast val split, deterministic). SIX-BOX: (1) prior result: all iters so far hr=0 (iter-1 val_n=20 ssim0.355 PSNR6.26 in 970s, NOT a timeout -- a genuine converged fit). (2) failure mode: NAF per-scene INR recon is far below the 128-view breast LD-FBP baseline. (3) ONE knob changed: naf_tv_weight 1e-4->0. (4) hypothesis: iters 5-6 (lr sweep) hr=0. KNOB: drop TV prior 1e-4->0 (pure data fit, no smoothing). HYPOTHESIS: TV may be over-smoothing already-blurry NAF output; removing it lets the field sharpen. Expect hr=0 -- NAF's problem is under-resolution, not over-smoothing. (5) wall: val_n=12 x per_scene 60.0s = ~720s < 20min. (6) serial, no user return.", "run_id": "breast-ct-claude-agentic-naf-search-20260703-01", "runtime": {"elapsed_s": 734.8422057628632}, "schema_version": 3, "solver_key": "naf", "solver_name": "NAF", "split": {"train_n": 0, "val_n": 12}, "status": "discard", "ts": "2026-07-06T01:25:38Z"}
