{"advice_for_others": "param_efficient-claude-agentic: reg_type=bilateral, bilateral_on_top=False, proj_filter_on=False, n_iter=30, learnable_alpha=True, alpha_init=0.1, foe_n_filters=24, foe_kernel=7, foe_n_bumps=31, n_bf=1, bf_multiscale=True, bf_sigmas=[0.8, 1.6, 3.2], bf_kernel=7, bf_sigma_r=0.02, bf_gain_init=0.0, epochs=16, cosine_lr=True, lr=0.005, max_train_s=1080, batch_size=4, train_n=200, val_n=200, display_min=0.0, display_max=0.05, seed=42, rationale=iter-22 param_efficient breast -- WU-2015 LEARNED DE-ALIASED INITIALIZER, end-to-end (solver edit). SIX-BOX: (1) PRIOR: architecture search reached champion LPD-combine W=4 = 0.5047 @ 183p (seed42). But the unroll STILL initializes x0 from the raw Hann FBP -- the STREAKY starting point (the sparse-view problem itself). Wu-2015-trainable STANDALONE reaches hr 0.31 -> it produces a DE-ALIASED x0 that already beats raw FBP. (2) FAILURE MODE: raw-FBP x0 injects coherent streaks the K=30 unroll must then undo; a cleaner init could let the unroll climb higher. (3) ONE KNOB (architectural): wu_init_on=True -- I added a WuInit front-end (Wu aliasing-free band-decomposition FBP: 4 band scales + sigmoid slope + offset + 1 gain = 7 params) as a RESIDUAL on the plain FBP: x0 = fbp + gain*(wu_aliasfree - fbp), gain ZERO-INIT => x0 == plain FBP == the 0.5047 champion BYTE-FOR-BYTE at init (no regression). Trained END-TO-END with the DC+LPD unroll (init + LPD block + per-step alpha co-adapt). Total ~= 183 + 7 = 190 params. seed 42 to compare directly vs iter-15's 0.5047. (4) HYPOTHESIS: a learned de-streaked band-decomposition init feeds the DC+LPD unroll a cleaner starting image, so end-to-end training lifts hr past 0.5047 (the init and unroll co-adapt) -- OR the gain trains toward 0 (raw FBP already optimal for this unroll), a clean null. Either way maps the init lever. (5) BUDGET: WuInit = n_bands extra back-projections at x0 ONCE per forward (cheap vs K=30 unroll); iter-15 finished 16ep in 1020s -> expect ~14-16ep; train_n=200, max_train_s=1080, --time=00:30:00, 200-val -> 20-min comparable. (6) SERIAL; iter-23: if Wu-init helps, tune n_bands/gain; then resume seed replicates of whichever config is champion for mean+-std., dc_mode=filtered, per_step_alpha=True, lpd_on=True, lpd_width=4, lpd_kernel=3, anisotropic_on_top=False, wu_init_on=True, wu_n_bands=4, wu_sigmoid_slope=10.0, wu_sigmoid_offset=1.0, wu_gain_init=0.0", "agent": "param_efficient-claude-agentic", "campaign": "search-20260703-01", "cfg_full": {"alpha_init": 0.1, "anisotropic_on_top": false, "batch_size": 4, "bf_gain_init": 0.0, "bf_kernel": 7, "bf_multiscale": true, "bf_sigma_r": 0.02, "bf_sigmas": [0.8, 1.6, 3.2], "bilateral_on_top": false, "cosine_lr": true, "dc_mode": "filtered", "display_max": 0.05, "display_min": 0.0, "epochs": 16, "foe_kernel": 7, "foe_n_bumps": 31, "foe_n_filters": 24, "learnable_alpha": true, "lpd_kernel": 3, "lpd_on": true, "lpd_width": 4, "lr": 0.005, "max_train_s": 1080, "n_bf": 1, "n_iter": 30, "per_step_alpha": true, "proj_filter_on": false, "rationale": "iter-22 param_efficient breast -- WU-2015 LEARNED DE-ALIASED INITIALIZER, end-to-end (solver edit). SIX-BOX: (1) PRIOR: architecture search reached champion LPD-combine W=4 = 0.5047 @ 183p (seed42). But the unroll STILL initializes x0 from the raw Hann FBP -- the STREAKY starting point (the sparse-view problem itself). Wu-2015-trainable STANDALONE reaches hr 0.31 -> it produces a DE-ALIASED x0 that already beats raw FBP. (2) FAILURE MODE: raw-FBP x0 injects coherent streaks the K=30 unroll must then undo; a cleaner init could let the unroll climb higher. (3) ONE KNOB (architectural): wu_init_on=True -- I added a WuInit front-end (Wu aliasing-free band-decomposition FBP: 4 band scales + sigmoid slope + offset + 1 gain = 7 params) as a RESIDUAL on the plain FBP: x0 = fbp + gain*(wu_aliasfree - fbp), gain ZERO-INIT => x0 == plain FBP == the 0.5047 champion BYTE-FOR-BYTE at init (no regression). Trained END-TO-END with the DC+LPD unroll (init + LPD block + per-step alpha co-adapt). Total ~= 183 + 7 = 190 params. seed 42 to compare directly vs iter-15's 0.5047. (4) HYPOTHESIS: a learned de-streaked band-decomposition init feeds the DC+LPD unroll a cleaner starting image, so end-to-end training lifts hr past 0.5047 (the init and unroll co-adapt) -- OR the gain trains toward 0 (raw FBP already optimal for this unroll), a clean null. Either way maps the init lever. (5) BUDGET: WuInit = n_bands extra back-projections at x0 ONCE per forward (cheap vs K=30 unroll); iter-15 finished 16ep in 1020s -> expect ~14-16ep; train_n=200, max_train_s=1080, --time=00:30:00, 200-val -> 20-min comparable. (6) SERIAL; iter-23: if Wu-init helps, tune n_bands/gain; then resume seed replicates of whichever config is champion for mean+-std.", "reg_type": "bilateral", "seed": 42, "train_n": 200, "val_n": 200, "wu_gain_init": 0.0, "wu_init_on": true, "wu_n_bands": 4, "wu_sigmoid_offset": 1.0, "wu_sigmoid_slope": 10.0}, "challenge": "breast_ct", "change_class": "architecture", "git_commit": "671da566", "images": {"comparison": "runs/breast-ct-claude-agentic-param-efficient-search-20260703-01/iterations/iter-0022/comparison.png", "test_showcase": null, "valtest_showcase": null}, "iter": 22, "kept": true, "metrics": {"headroom": 0.4767673648318401, "headroom_std": 0.012052128892181093, "val_psnr": 41.95030212402344, "val_psnr_std": 0.4231652616966838, "val_rmse": 0.002728283405303955, "val_rmse_std": 0.000128482360966567, "val_ssim": 0.9689329266548157, "val_ssim_std": 0.002119670187687876}, "model": "claude-opus-4-8-1m", "obs_path": "breast-ct-claude-agentic-param-efficient-search-20260703-01/iterations/iter-0022/observation.json", "obs_sha1": "c3e37aa38e571bb75339cd2fd447a18abc6904fd", "params_M": 0.00019, "params_source": "observation", "rationale": "param_efficient-claude-agentic: reg_type=bilateral, bilateral_on_top=False, proj_filter_on=False, n_iter=30, learnable_alpha=True, alpha_init=0.1, foe_n_filters=24, foe_kernel=7, foe_n_bumps=31, n_bf=1, bf_multiscale=True, bf_sigmas=[0.8, 1.6, 3.2], bf_kernel=7, bf_sigma_r=0.02, bf_gain_init=0.0, epochs=16, cosine_lr=True, lr=0.005, max_train_s=1080, batch_size=4, train_n=200, val_n=200, display_min=0.0, display_max=0.05, seed=42, rationale=iter-22 param_efficient breast -- WU-2015 LEARNED DE-ALIASED INITIALIZER, end-to-end (solver edit). SIX-BOX: (1) PRIOR: architecture search reached champion LPD-combine W=4 = 0.5047 @ 183p (seed42). But the unroll STILL initializes x0 from the raw Hann FBP -- the STREAKY starting point (the sparse-view problem itself). Wu-2015-trainable STANDALONE reaches hr 0.31 -> it produces a DE-ALIASED x0 that already beats raw FBP. (2) FAILURE MODE: raw-FBP x0 injects coherent streaks the K=30 unroll must then undo; a cleaner init could let the unroll climb higher. (3) ONE KNOB (architectural): wu_init_on=True -- I added a WuInit front-end (Wu aliasing-free band-decomposition FBP: 4 band scales + sigmoid slope + offset + 1 gain = 7 params) as a RESIDUAL on the plain FBP: x0 = fbp + gain*(wu_aliasfree - fbp), gain ZERO-INIT => x0 == plain FBP == the 0.5047 champion BYTE-FOR-BYTE at init (no regression). Trained END-TO-END with the DC+LPD unroll (init + LPD block + per-step alpha co-adapt). Total ~= 183 + 7 = 190 params. seed 42 to compare directly vs iter-15's 0.5047. (4) HYPOTHESIS: a learned de-streaked band-decomposition init feeds the DC+LPD unroll a cleaner starting image, so end-to-end training lifts hr past 0.5047 (the init and unroll co-adapt) -- OR the gain trains toward 0 (raw FBP already optimal for this unroll), a clean null. Either way maps the init lever. (5) BUDGET: WuInit = n_bands extra back-projections at x0 ONCE per forward (cheap vs K=30 unroll); iter-15 finished 16ep in 1020s -> expect ~14-16ep; train_n=200, max_train_s=1080, --time=00:30:00, 200-val -> 20-min comparable. (6) SERIAL; iter-23: if Wu-init helps, tune n_bands/gain; then resume seed replicates of whichever config is champion for mean+-std., dc_mode=filtered, per_step_alpha=True, lpd_on=True, lpd_width=4, lpd_kernel=3, anisotropic_on_top=False, wu_init_on=True, wu_n_bands=4, wu_sigmoid_slope=10.0, wu_sigmoid_offset=1.0, wu_gain_init=0.0", "run_id": "breast-ct-claude-agentic-param-efficient-search-20260703-01", "runtime": {"elapsed_s": 1114.4846193790436}, "schema_version": 3, "solver_key": "param-efficient", "solver_name": "Param-efficient (evolved)", "split": {"train_n": 200, "val_n": 200}, "status": "keep", "ts": "2026-07-07T09:06:49Z"}
{"advice_for_others": "param_efficient-claude-agentic: reg_type=bilateral, bilateral_on_top=False, proj_filter_on=False, n_iter=30, learnable_alpha=True, alpha_init=0.1, foe_n_filters=24, foe_kernel=7, foe_n_bumps=31, n_bf=1, bf_multiscale=True, bf_sigmas=[0.8, 1.6, 3.2], bf_kernel=7, bf_sigma_r=0.02, bf_gain_init=0.0, epochs=16, cosine_lr=True, lr=0.005, max_train_s=1080, batch_size=4, train_n=200, val_n=200, display_min=0.0, display_max=0.05, seed=42, rationale=iter-23 param_efficient breast -- WU-COMBINATION #1: BAND-WEIGHTED filtered-DC (frequency-selective DC, solver edit). SIX-BOX: (1) PRIOR: champion = LPD-combine W=4 filtered-DC K=30 = 0.5047 @ 183p (seed42). The filtered-DC applies a UNIFORM ramp/Hann filter fbp(Rx-g) EVERY step; but sparse-view streaks have a characteristic spectral signature a learned per-band weighting could target. Wu-init (iter-22) was a null for INITIALIZATION, but Wu's distinctive value is FREQUENCY-BAND SELECTIVITY, which the uniform ramp lacks. (2) FAILURE MODE: uniform ramp-filtered DC cannot down-weight streak-frequency components while preserving detail-frequency. (3) ONE KNOB (architectural): dc_mode 'filtered'->'band' -- I added a BandWeightedDC module: it reweights the residual spectrum by Sum_i s_i*tri_i(f) (tri_i = triangular partition-of-unity band windows, Sum tri_i=1) BEFORE the projector's fbp. s_i init 1.0 => reweight == identity => dc == fbp(resid) == the 0.5047 champion BYTE-FOR-BYTE at init (no regression). +6 band-scale params -> 189 total. All else byte-for-byte iter-15 (LPD W=4, K=30, seed42). (4) HYPOTHESIS: a learned per-band DC filter lets each of the K=30 DC corrections down-weight the streak-frequency band while preserving fibroglandular detail frequencies -> hr climbs past 0.5047, because frequency-selectivity is a lever uniform filtered-DC lacks. OR the s_i train back toward 1.0 (uniform ramp already captures the useful spectrum) -> clean null. (5) BUDGET: band reweight = 1 FFT/iFFT per step (cheap); iter-15 finished 16ep in 1020s -> expect ~14-16ep; train_n=200, max_train_s=1080, --time=00:30:00, 200-val -> 20-min comparable. (6) SERIAL; iter-24: if band-DC helps, tune n_bands; else try Wu band-selective PROX (#2) or report the null; then finish champion seed replicates., dc_mode=band, per_step_alpha=True, lpd_on=True, lpd_width=4, lpd_kernel=3, anisotropic_on_top=False, band_dc_n_bands=6", "agent": "param_efficient-claude-agentic", "campaign": "search-20260703-01", "cfg_full": {"alpha_init": 0.1, "anisotropic_on_top": false, "band_dc_n_bands": 6, "batch_size": 4, "bf_gain_init": 0.0, "bf_kernel": 7, "bf_multiscale": true, "bf_sigma_r": 0.02, "bf_sigmas": [0.8, 1.6, 3.2], "bilateral_on_top": false, "cosine_lr": true, "dc_mode": "band", "display_max": 0.05, "display_min": 0.0, "epochs": 16, "foe_kernel": 7, "foe_n_bumps": 31, "foe_n_filters": 24, "learnable_alpha": true, "lpd_kernel": 3, "lpd_on": true, "lpd_width": 4, "lr": 0.005, "max_train_s": 1080, "n_bf": 1, "n_iter": 30, "per_step_alpha": true, "proj_filter_on": false, "rationale": "iter-23 param_efficient breast -- WU-COMBINATION #1: BAND-WEIGHTED filtered-DC (frequency-selective DC, solver edit). SIX-BOX: (1) PRIOR: champion = LPD-combine W=4 filtered-DC K=30 = 0.5047 @ 183p (seed42). The filtered-DC applies a UNIFORM ramp/Hann filter fbp(Rx-g) EVERY step; but sparse-view streaks have a characteristic spectral signature a learned per-band weighting could target. Wu-init (iter-22) was a null for INITIALIZATION, but Wu's distinctive value is FREQUENCY-BAND SELECTIVITY, which the uniform ramp lacks. (2) FAILURE MODE: uniform ramp-filtered DC cannot down-weight streak-frequency components while preserving detail-frequency. (3) ONE KNOB (architectural): dc_mode 'filtered'->'band' -- I added a BandWeightedDC module: it reweights the residual spectrum by Sum_i s_i*tri_i(f) (tri_i = triangular partition-of-unity band windows, Sum tri_i=1) BEFORE the projector's fbp. s_i init 1.0 => reweight == identity => dc == fbp(resid) == the 0.5047 champion BYTE-FOR-BYTE at init (no regression). +6 band-scale params -> 189 total. All else byte-for-byte iter-15 (LPD W=4, K=30, seed42). (4) HYPOTHESIS: a learned per-band DC filter lets each of the K=30 DC corrections down-weight the streak-frequency band while preserving fibroglandular detail frequencies -> hr climbs past 0.5047, because frequency-selectivity is a lever uniform filtered-DC lacks. OR the s_i train back toward 1.0 (uniform ramp already captures the useful spectrum) -> clean null. (5) BUDGET: band reweight = 1 FFT/iFFT per step (cheap); iter-15 finished 16ep in 1020s -> expect ~14-16ep; train_n=200, max_train_s=1080, --time=00:30:00, 200-val -> 20-min comparable. (6) SERIAL; iter-24: if band-DC helps, tune n_bands; else try Wu band-selective PROX (#2) or report the null; then finish champion seed replicates.", "reg_type": "bilateral", "seed": 42, "train_n": 200, "val_n": 200}, "challenge": "breast_ct", "change_class": "architecture", "git_commit": "671da566", "images": {"comparison": "runs/breast-ct-claude-agentic-param-efficient-search-20260703-01/iterations/iter-0023/comparison.png", "test_showcase": null, "valtest_showcase": null}, "iter": 23, "kept": true, "metrics": {"headroom": 0.32016780576604487, "headroom_std": 0.01141860205231501, "val_psnr": 39.67616271972656, "val_psnr_std": 0.4575257389173124, "val_rmse": 0.00354483793489635, "val_rmse_std": 0.0001807379895567797, "val_ssim": 0.9677989482879639, "val_ssim_std": 0.003519987165113417}, "model": "claude-opus-4-8-1m", "obs_path": "breast-ct-claude-agentic-param-efficient-search-20260703-01/iterations/iter-0023/observation.json", "obs_sha1": "d04ae8b0cb29d2b5572514c2c022f93aa64948f7", "params_M": 0.000189, "params_source": "observation", "rationale": "param_efficient-claude-agentic: reg_type=bilateral, bilateral_on_top=False, proj_filter_on=False, n_iter=30, learnable_alpha=True, alpha_init=0.1, foe_n_filters=24, foe_kernel=7, foe_n_bumps=31, n_bf=1, bf_multiscale=True, bf_sigmas=[0.8, 1.6, 3.2], bf_kernel=7, bf_sigma_r=0.02, bf_gain_init=0.0, epochs=16, cosine_lr=True, lr=0.005, max_train_s=1080, batch_size=4, train_n=200, val_n=200, display_min=0.0, display_max=0.05, seed=42, rationale=iter-23 param_efficient breast -- WU-COMBINATION #1: BAND-WEIGHTED filtered-DC (frequency-selective DC, solver edit). SIX-BOX: (1) PRIOR: champion = LPD-combine W=4 filtered-DC K=30 = 0.5047 @ 183p (seed42). The filtered-DC applies a UNIFORM ramp/Hann filter fbp(Rx-g) EVERY step; but sparse-view streaks have a characteristic spectral signature a learned per-band weighting could target. Wu-init (iter-22) was a null for INITIALIZATION, but Wu's distinctive value is FREQUENCY-BAND SELECTIVITY, which the uniform ramp lacks. (2) FAILURE MODE: uniform ramp-filtered DC cannot down-weight streak-frequency components while preserving detail-frequency. (3) ONE KNOB (architectural): dc_mode 'filtered'->'band' -- I added a BandWeightedDC module: it reweights the residual spectrum by Sum_i s_i*tri_i(f) (tri_i = triangular partition-of-unity band windows, Sum tri_i=1) BEFORE the projector's fbp. s_i init 1.0 => reweight == identity => dc == fbp(resid) == the 0.5047 champion BYTE-FOR-BYTE at init (no regression). +6 band-scale params -> 189 total. All else byte-for-byte iter-15 (LPD W=4, K=30, seed42). (4) HYPOTHESIS: a learned per-band DC filter lets each of the K=30 DC corrections down-weight the streak-frequency band while preserving fibroglandular detail frequencies -> hr climbs past 0.5047, because frequency-selectivity is a lever uniform filtered-DC lacks. OR the s_i train back toward 1.0 (uniform ramp already captures the useful spectrum) -> clean null. (5) BUDGET: band reweight = 1 FFT/iFFT per step (cheap); iter-15 finished 16ep in 1020s -> expect ~14-16ep; train_n=200, max_train_s=1080, --time=00:30:00, 200-val -> 20-min comparable. (6) SERIAL; iter-24: if band-DC helps, tune n_bands; else try Wu band-selective PROX (#2) or report the null; then finish champion seed replicates., dc_mode=band, per_step_alpha=True, lpd_on=True, lpd_width=4, lpd_kernel=3, anisotropic_on_top=False, band_dc_n_bands=6", "run_id": "breast-ct-claude-agentic-param-efficient-search-20260703-01", "runtime": {"elapsed_s": 1141.321772813797}, "schema_version": 3, "solver_key": "param-efficient", "solver_name": "Param-efficient (evolved)", "split": {"train_n": 200, "val_n": 200}, "status": "keep", "ts": "2026-07-07T10:10:52Z"}
