{"advice_for_others": "fastdiff_flow_pixel_constrained-claude-agentic: image_size=512, pixel_spacing=0.3516, n_angles=128, n_det=1024, det_spacing=0.35754, sod=500.0, sdd=1000.0, display_min=0.0, display_max=0.5, train_n=400, val_n=200, noise_i0=100000.0, noise_sigma_e=10.0, seed=42, dataset_kind=breast_ct, fd_recon_ckpt=/cluster/maier/Agent4CT/checkpoints/fast_diffusion_pixel_breast.pt, fd_recon_steps=8, fd_recon_init=fbp, fd_recon_init_t=0.01, fd_recon_eta=1.0, fd_recon_dc=1, fd_recon_dc_n_cg=45, fd_recon_dc_relax=1.0, rationale=iter-12 RE-MAP n_cg at the winning low init_t: n_cg 30->45 (init_t0.01, the hr0.3605 best). SIX-BOX: (1)PRIOR: init_t is near-plateaued (0.05->0.02->0.01: hr 0.0557->0.3531->0.3605). At init_t~0.01 the recon is near-pure FBP+deep-CG-DC (light prior). Earlier the n_cg semi-convergence peak sat at 30 (measured at init_t0.05 where prior-noise amplified past 30). (2)FAILURE: at high init_t the CG over-converged past n_cg30 because it amplified PRIOR-injected noise; at init_t0.01 that prior-noise is minimal, so the peak may shift RIGHT - more CG could keep helping. (3)ONE KNOB: dc_n_cg 30->45 at init_t0.01. (4)HYPOTHESIS: with minimal prior-noise, n_cg45 drives the data-consistent LS solution further, lowering rmse below 0.003335 and lifting hr above 0.3605; re-maps the argmax n_cg at the winning init_t. (5)BUDGET: 45 CG ~ iter-8 x1.1 (~8min), inside 20-min. (6)Serial.", "agent": "fastdiff_flow_pixel_constrained-claude-agentic", "campaign": "search-20260703-01", "cfg_full": {"dataset_kind": "breast_ct", "det_spacing": 0.35754, "display_max": 0.5, "display_min": 0.0, "fd_recon_ckpt": "/cluster/maier/Agent4CT/checkpoints/fast_diffusion_pixel_breast.pt", "fd_recon_dc": 1, "fd_recon_dc_n_cg": 45, "fd_recon_dc_relax": 1.0, "fd_recon_eta": 1.0, "fd_recon_init": "fbp", "fd_recon_init_t": 0.01, "fd_recon_steps": 8, "image_size": 512, "n_angles": 128, "n_det": 1024, "noise_i0": 100000.0, "noise_sigma_e": 10.0, "pixel_spacing": 0.3516, "rationale": "iter-12 RE-MAP n_cg at the winning low init_t: n_cg 30->45 (init_t0.01, the hr0.3605 best). SIX-BOX: (1)PRIOR: init_t is near-plateaued (0.05->0.02->0.01: hr 0.0557->0.3531->0.3605). At init_t~0.01 the recon is near-pure FBP+deep-CG-DC (light prior). Earlier the n_cg semi-convergence peak sat at 30 (measured at init_t0.05 where prior-noise amplified past 30). (2)FAILURE: at high init_t the CG over-converged past n_cg30 because it amplified PRIOR-injected noise; at init_t0.01 that prior-noise is minimal, so the peak may shift RIGHT - more CG could keep helping. (3)ONE KNOB: dc_n_cg 30->45 at init_t0.01. (4)HYPOTHESIS: with minimal prior-noise, n_cg45 drives the data-consistent LS solution further, lowering rmse below 0.003335 and lifting hr above 0.3605; re-maps the argmax n_cg at the winning init_t. (5)BUDGET: 45 CG ~ iter-8 x1.1 (~8min), inside 20-min. (6)Serial.", "sdd": 1000.0, "seed": 42, "sod": 500.0, "train_n": 400, "val_n": 200}, "challenge": "breast_ct", "change_class": "architecture", "git_commit": "671da566", "images": {"comparison": "runs/breast-ct-claude-agentic-fastdiff-flow-pixel-constrained-search-20260703-01/iterations/iter-0012/comparison.png", "test_showcase": null, "valtest_showcase": null}, "iter": 12, "kept": false, "metrics": {"headroom": 0.0, "headroom_std": 0.0, "val_psnr": 30.345901489257812, "val_psnr_std": 0.31083436079298843, "val_rmse": 0.010377897880971432, "val_rmse_std": 0.0003496355066324941, "val_ssim": 0.7203750610351562, "val_ssim_std": 0.008585612426865596}, "model": "claude-opus-4-8-1m", "obs_path": "breast-ct-claude-agentic-fastdiff-flow-pixel-constrained-search-20260703-01/iterations/iter-0012/observation.json", "obs_sha1": "ad292cd778e70fde30df42649bf45d25284198fc", "params_M": 3.822787, "params_source": "observation", "rationale": "fastdiff_flow_pixel_constrained-claude-agentic: image_size=512, pixel_spacing=0.3516, n_angles=128, n_det=1024, det_spacing=0.35754, sod=500.0, sdd=1000.0, display_min=0.0, display_max=0.5, train_n=400, val_n=200, noise_i0=100000.0, noise_sigma_e=10.0, seed=42, dataset_kind=breast_ct, fd_recon_ckpt=/cluster/maier/Agent4CT/checkpoints/fast_diffusion_pixel_breast.pt, fd_recon_steps=8, fd_recon_init=fbp, fd_recon_init_t=0.01, fd_recon_eta=1.0, fd_recon_dc=1, fd_recon_dc_n_cg=45, fd_recon_dc_relax=1.0, rationale=iter-12 RE-MAP n_cg at the winning low init_t: n_cg 30->45 (init_t0.01, the hr0.3605 best). SIX-BOX: (1)PRIOR: init_t is near-plateaued (0.05->0.02->0.01: hr 0.0557->0.3531->0.3605). At init_t~0.01 the recon is near-pure FBP+deep-CG-DC (light prior). Earlier the n_cg semi-convergence peak sat at 30 (measured at init_t0.05 where prior-noise amplified past 30). (2)FAILURE: at high init_t the CG over-converged past n_cg30 because it amplified PRIOR-injected noise; at init_t0.01 that prior-noise is minimal, so the peak may shift RIGHT - more CG could keep helping. (3)ONE KNOB: dc_n_cg 30->45 at init_t0.01. (4)HYPOTHESIS: with minimal prior-noise, n_cg45 drives the data-consistent LS solution further, lowering rmse below 0.003335 and lifting hr above 0.3605; re-maps the argmax n_cg at the winning init_t. (5)BUDGET: 45 CG ~ iter-8 x1.1 (~8min), inside 20-min. (6)Serial.", "run_id": "breast-ct-claude-agentic-fastdiff-flow-pixel-constrained-search-20260703-01", "runtime": {"elapsed_s": 382.53315687179565}, "schema_version": 3, "solver_key": "fastdiff-flow-pixel-constrained", "solver_name": "Fast-diffusion flow (pixel, constrained DC)", "split": {"train_n": 400, "val_n": 200}, "status": "discard", "ts": "2026-07-06T22:02:07Z"}
{"advice_for_others": "fastdiff_flow_pixel_constrained-claude-agentic: image_size=512, pixel_spacing=0.3516, n_angles=128, n_det=1024, det_spacing=0.35754, sod=500.0, sdd=1000.0, display_min=0.0, display_max=0.5, train_n=400, val_n=200, noise_i0=100000.0, noise_sigma_e=10.0, seed=42, dataset_kind=breast_ct, fd_recon_ckpt=/cluster/maier/Agent4CT/checkpoints/fast_diffusion_pixel_breast.pt, fd_recon_steps=8, fd_recon_init=fbp, fd_recon_init_t=0.005, fd_recon_eta=1.0, fd_recon_dc=1, fd_recon_dc_n_cg=30, fd_recon_dc_relax=1.0, rationale=iter-13 EXPLORATORY single knob init_t 0.01->0.005 at the peak n_cg30. SIX-BOX: (1)PRIOR: TWO levers now locked. n_cg: peak at 30 (iter-12 n_cg45 CRASHED to rmse0.01038/hr0 - the DC semi-convergence peak does NOT shift right at low init_t; over-converging CG amplifies MEASUREMENT noise regardless). init_t: near-plateau 0.02->0.01 gave hr0.3531->0.3605. Best=iter-11 (init_t0.01,n_cg30,rlx1.0,hr0.3605). (2)FAILURE: init_t0.01 may not be the exact plateau bottom. (3)ONE KNOB: init_t 0.01->0.005. (4)HYPOTHESIS: even less prior embed edges hr above 0.3605 or confirms the init_t plateau (~0.36 is the near-pure-DC ceiling for n_cg30). (5)BUDGET: n_cg30 ~5.5min. (6)Serial.", "agent": "fastdiff_flow_pixel_constrained-claude-agentic", "campaign": "search-20260703-01", "cfg_full": {"dataset_kind": "breast_ct", "det_spacing": 0.35754, "display_max": 0.5, "display_min": 0.0, "fd_recon_ckpt": "/cluster/maier/Agent4CT/checkpoints/fast_diffusion_pixel_breast.pt", "fd_recon_dc": 1, "fd_recon_dc_n_cg": 30, "fd_recon_dc_relax": 1.0, "fd_recon_eta": 1.0, "fd_recon_init": "fbp", "fd_recon_init_t": 0.005, "fd_recon_steps": 8, "image_size": 512, "n_angles": 128, "n_det": 1024, "noise_i0": 100000.0, "noise_sigma_e": 10.0, "pixel_spacing": 0.3516, "rationale": "iter-13 EXPLORATORY single knob init_t 0.01->0.005 at the peak n_cg30. SIX-BOX: (1)PRIOR: TWO levers now locked. n_cg: peak at 30 (iter-12 n_cg45 CRASHED to rmse0.01038/hr0 - the DC semi-convergence peak does NOT shift right at low init_t; over-converging CG amplifies MEASUREMENT noise regardless). init_t: near-plateau 0.02->0.01 gave hr0.3531->0.3605. Best=iter-11 (init_t0.01,n_cg30,rlx1.0,hr0.3605). (2)FAILURE: init_t0.01 may not be the exact plateau bottom. (3)ONE KNOB: init_t 0.01->0.005. (4)HYPOTHESIS: even less prior embed edges hr above 0.3605 or confirms the init_t plateau (~0.36 is the near-pure-DC ceiling for n_cg30). (5)BUDGET: n_cg30 ~5.5min. (6)Serial.", "sdd": 1000.0, "seed": 42, "sod": 500.0, "train_n": 400, "val_n": 200}, "challenge": "breast_ct", "change_class": "architecture", "git_commit": "671da566", "images": {"comparison": "runs/breast-ct-claude-agentic-fastdiff-flow-pixel-constrained-search-20260703-01/iterations/iter-0013/comparison.png", "test_showcase": null, "valtest_showcase": null}, "iter": 13, "kept": true, "metrics": {"headroom": 0.24395260444011657, "headroom_std": 0.05375498300618993, "val_psnr": 38.75321578979492, "val_psnr_std": 0.3993514476116442, "val_rmse": 0.003942245617508888, "val_rmse_std": 0.00017104875132280584, "val_ssim": 0.9263087511062622, "val_ssim_std": 0.005893668439445844}, "model": "claude-opus-4-8-1m", "obs_path": "breast-ct-claude-agentic-fastdiff-flow-pixel-constrained-search-20260703-01/iterations/iter-0013/observation.json", "obs_sha1": "bcb33c65698b986bb34876ef17b12205a9c72f92", "params_M": 3.822787, "params_source": "observation", "rationale": "fastdiff_flow_pixel_constrained-claude-agentic: image_size=512, pixel_spacing=0.3516, n_angles=128, n_det=1024, det_spacing=0.35754, sod=500.0, sdd=1000.0, display_min=0.0, display_max=0.5, train_n=400, val_n=200, noise_i0=100000.0, noise_sigma_e=10.0, seed=42, dataset_kind=breast_ct, fd_recon_ckpt=/cluster/maier/Agent4CT/checkpoints/fast_diffusion_pixel_breast.pt, fd_recon_steps=8, fd_recon_init=fbp, fd_recon_init_t=0.005, fd_recon_eta=1.0, fd_recon_dc=1, fd_recon_dc_n_cg=30, fd_recon_dc_relax=1.0, rationale=iter-13 EXPLORATORY single knob init_t 0.01->0.005 at the peak n_cg30. SIX-BOX: (1)PRIOR: TWO levers now locked. n_cg: peak at 30 (iter-12 n_cg45 CRASHED to rmse0.01038/hr0 - the DC semi-convergence peak does NOT shift right at low init_t; over-converging CG amplifies MEASUREMENT noise regardless). init_t: near-plateau 0.02->0.01 gave hr0.3531->0.3605. Best=iter-11 (init_t0.01,n_cg30,rlx1.0,hr0.3605). (2)FAILURE: init_t0.01 may not be the exact plateau bottom. (3)ONE KNOB: init_t 0.01->0.005. (4)HYPOTHESIS: even less prior embed edges hr above 0.3605 or confirms the init_t plateau (~0.36 is the near-pure-DC ceiling for n_cg30). (5)BUDGET: n_cg30 ~5.5min. (6)Serial.", "run_id": "breast-ct-claude-agentic-fastdiff-flow-pixel-constrained-search-20260703-01", "runtime": {"elapsed_s": 316.39142370224}, "schema_version": 3, "solver_key": "fastdiff-flow-pixel-constrained", "solver_name": "Fast-diffusion flow (pixel, constrained DC)", "split": {"train_n": 400, "val_n": 200}, "status": "keep", "ts": "2026-07-06T22:08:22Z"}
{"advice_for_others": "fastdiff_flow_pixel_constrained-claude-agentic: image_size=512, pixel_spacing=0.3516, n_angles=128, n_det=1024, det_spacing=0.35754, sod=500.0, sdd=1000.0, display_min=0.0, display_max=0.5, train_n=400, val_n=200, noise_i0=100000.0, noise_sigma_e=10.0, seed=42, dataset_kind=breast_ct, fd_recon_ckpt=/cluster/maier/Agent4CT/checkpoints/fast_diffusion_pixel_breast.pt, fd_recon_steps=8, fd_recon_init=fbp, fd_recon_init_t=0.01, fd_recon_eta=1.0, fd_recon_dc=1, fd_recon_dc_n_cg=25, fd_recon_dc_relax=1.0, rationale=iter-14 dc_n_cg 30->25 at init_t0.01 (fine-map the argmax LEFT at the winning low init_t; n_cg45 crashed so peak<=30).", "agent": "fastdiff_flow_pixel_constrained-claude-agentic", "campaign": "search-20260703-01", "cfg_full": {"dataset_kind": "breast_ct", "det_spacing": 0.35754, "display_max": 0.5, "display_min": 0.0, "fd_recon_ckpt": "/cluster/maier/Agent4CT/checkpoints/fast_diffusion_pixel_breast.pt", "fd_recon_dc": 1, "fd_recon_dc_n_cg": 25, "fd_recon_dc_relax": 1.0, "fd_recon_eta": 1.0, "fd_recon_init": "fbp", "fd_recon_init_t": 0.01, "fd_recon_steps": 8, "image_size": 512, "n_angles": 128, "n_det": 1024, "noise_i0": 100000.0, "noise_sigma_e": 10.0, "pixel_spacing": 0.3516, "rationale": "iter-14 dc_n_cg 30->25 at init_t0.01 (fine-map the argmax LEFT at the winning low init_t; n_cg45 crashed so peak<=30).", "sdd": 1000.0, "seed": 42, "sod": 500.0, "train_n": 400, "val_n": 200}, "challenge": "breast_ct", "change_class": "architecture", "git_commit": "671da566", "images": {"comparison": "runs/breast-ct-claude-agentic-fastdiff-flow-pixel-constrained-search-20260703-01/iterations/iter-0014/comparison.png", "test_showcase": null, "valtest_showcase": null}, "iter": 14, "kept": true, "metrics": {"headroom": 0.5018463796090391, "headroom_std": 0.022124186202867473, "val_psnr": 42.376930236816406, "val_psnr_std": 0.564924749670333, "val_rmse": 0.002597514307126403, "val_rmse_std": 0.00017399241977285922, "val_ssim": 0.9741517901420593, "val_ssim_std": 0.004580289396046933}, "model": "claude-opus-4-8-1m", "obs_path": "breast-ct-claude-agentic-fastdiff-flow-pixel-constrained-search-20260703-01/iterations/iter-0014/observation.json", "obs_sha1": "42db758b8cf31ddf0eafd1d0a014e206aa4ed933", "params_M": 3.822787, "params_source": "observation", "rationale": "fastdiff_flow_pixel_constrained-claude-agentic: image_size=512, pixel_spacing=0.3516, n_angles=128, n_det=1024, det_spacing=0.35754, sod=500.0, sdd=1000.0, display_min=0.0, display_max=0.5, train_n=400, val_n=200, noise_i0=100000.0, noise_sigma_e=10.0, seed=42, dataset_kind=breast_ct, fd_recon_ckpt=/cluster/maier/Agent4CT/checkpoints/fast_diffusion_pixel_breast.pt, fd_recon_steps=8, fd_recon_init=fbp, fd_recon_init_t=0.01, fd_recon_eta=1.0, fd_recon_dc=1, fd_recon_dc_n_cg=25, fd_recon_dc_relax=1.0, rationale=iter-14 dc_n_cg 30->25 at init_t0.01 (fine-map the argmax LEFT at the winning low init_t; n_cg45 crashed so peak<=30).", "run_id": "breast-ct-claude-agentic-fastdiff-flow-pixel-constrained-search-20260703-01", "runtime": {"elapsed_s": 289.82248306274414}, "schema_version": 3, "solver_key": "fastdiff-flow-pixel-constrained", "solver_name": "Fast-diffusion flow (pixel, constrained DC)", "split": {"train_n": 400, "val_n": 200}, "status": "keep", "ts": "2026-07-06T22:13:44Z"}
{"advice_for_others": "fastdiff_flow_pixel_constrained-claude-agentic: image_size=512, pixel_spacing=0.3516, n_angles=128, n_det=1024, det_spacing=0.35754, sod=500.0, sdd=1000.0, display_min=0.0, display_max=0.5, train_n=400, val_n=200, noise_i0=100000.0, noise_sigma_e=10.0, seed=42, dataset_kind=breast_ct, fd_recon_ckpt=/cluster/maier/Agent4CT/checkpoints/fast_diffusion_pixel_breast.pt, fd_recon_steps=8, fd_recon_init=fbp, fd_recon_init_t=0.01, fd_recon_eta=1.0, fd_recon_dc=1, fd_recon_dc_n_cg=20, fd_recon_dc_relax=1.0, rationale=iter-15 EXPLORATORY dc_n_cg 25->20 at init_t0.01, continuing DOWN the n_cg axis. SIX-BOX: (1)PRIOR: BIG JUMP - at init_t0.01 the n_cg semi-convergence peak is LOWER than the init_t0.05 peak: n_cg30 hr0.3605 -> n_cg25 hr0.5018 (rmse0.003335->0.002598, psnr40.2->42.4, ssim0.950->0.974). Fewer CG iters = less measurement-noise amplification at low init_t. (Earlier n_cg20 at init_t0.05 was hr0 because high init_t injected prior-noise; at init_t0.01 that's gone.) (2)FAILURE: n_cg25 may not be the argmax; the peak could be lower. (3)ONE KNOB: dc_n_cg 25->20. (4)HYPOTHESIS: n_cg20 continues the climb (peak still left) OR drops (peak was 25). Brackets the true argmax at the winning init_t. (5)BUDGET: 20 CG faster than 25, ~4min. (6)Serial.", "agent": "fastdiff_flow_pixel_constrained-claude-agentic", "campaign": "search-20260703-01", "cfg_full": {"dataset_kind": "breast_ct", "det_spacing": 0.35754, "display_max": 0.5, "display_min": 0.0, "fd_recon_ckpt": "/cluster/maier/Agent4CT/checkpoints/fast_diffusion_pixel_breast.pt", "fd_recon_dc": 1, "fd_recon_dc_n_cg": 20, "fd_recon_dc_relax": 1.0, "fd_recon_eta": 1.0, "fd_recon_init": "fbp", "fd_recon_init_t": 0.01, "fd_recon_steps": 8, "image_size": 512, "n_angles": 128, "n_det": 1024, "noise_i0": 100000.0, "noise_sigma_e": 10.0, "pixel_spacing": 0.3516, "rationale": "iter-15 EXPLORATORY dc_n_cg 25->20 at init_t0.01, continuing DOWN the n_cg axis. SIX-BOX: (1)PRIOR: BIG JUMP - at init_t0.01 the n_cg semi-convergence peak is LOWER than the init_t0.05 peak: n_cg30 hr0.3605 -> n_cg25 hr0.5018 (rmse0.003335->0.002598, psnr40.2->42.4, ssim0.950->0.974). Fewer CG iters = less measurement-noise amplification at low init_t. (Earlier n_cg20 at init_t0.05 was hr0 because high init_t injected prior-noise; at init_t0.01 that's gone.) (2)FAILURE: n_cg25 may not be the argmax; the peak could be lower. (3)ONE KNOB: dc_n_cg 25->20. (4)HYPOTHESIS: n_cg20 continues the climb (peak still left) OR drops (peak was 25). Brackets the true argmax at the winning init_t. (5)BUDGET: 20 CG faster than 25, ~4min. (6)Serial.", "sdd": 1000.0, "seed": 42, "sod": 500.0, "train_n": 400, "val_n": 200}, "challenge": "breast_ct", "change_class": "architecture", "git_commit": "671da566", "images": {"comparison": "runs/breast-ct-claude-agentic-fastdiff-flow-pixel-constrained-search-20260703-01/iterations/iter-0015/comparison.png", "test_showcase": null, "valtest_showcase": null}, "iter": 15, "kept": true, "metrics": {"headroom": 0.5163877241788388, "headroom_std": 0.022844181674357703, "val_psnr": 42.634246826171875, "val_psnr_std": 0.5502058817741182, "val_rmse": 0.0025216916110366583, "val_rmse_std": 0.0001630614319503259, "val_ssim": 0.9778562188148499, "val_ssim_std": 0.004297106207667864}, "model": "claude-opus-4-8-1m", "obs_path": "breast-ct-claude-agentic-fastdiff-flow-pixel-constrained-search-20260703-01/iterations/iter-0015/observation.json", "obs_sha1": "a5812227b5fd6703f867064d6b3fae9e7cd548f3", "params_M": 3.822787, "params_source": "observation", "rationale": "fastdiff_flow_pixel_constrained-claude-agentic: image_size=512, pixel_spacing=0.3516, n_angles=128, n_det=1024, det_spacing=0.35754, sod=500.0, sdd=1000.0, display_min=0.0, display_max=0.5, train_n=400, val_n=200, noise_i0=100000.0, noise_sigma_e=10.0, seed=42, dataset_kind=breast_ct, fd_recon_ckpt=/cluster/maier/Agent4CT/checkpoints/fast_diffusion_pixel_breast.pt, fd_recon_steps=8, fd_recon_init=fbp, fd_recon_init_t=0.01, fd_recon_eta=1.0, fd_recon_dc=1, fd_recon_dc_n_cg=20, fd_recon_dc_relax=1.0, rationale=iter-15 EXPLORATORY dc_n_cg 25->20 at init_t0.01, continuing DOWN the n_cg axis. SIX-BOX: (1)PRIOR: BIG JUMP - at init_t0.01 the n_cg semi-convergence peak is LOWER than the init_t0.05 peak: n_cg30 hr0.3605 -> n_cg25 hr0.5018 (rmse0.003335->0.002598, psnr40.2->42.4, ssim0.950->0.974). Fewer CG iters = less measurement-noise amplification at low init_t. (Earlier n_cg20 at init_t0.05 was hr0 because high init_t injected prior-noise; at init_t0.01 that's gone.) (2)FAILURE: n_cg25 may not be the argmax; the peak could be lower. (3)ONE KNOB: dc_n_cg 25->20. (4)HYPOTHESIS: n_cg20 continues the climb (peak still left) OR drops (peak was 25). Brackets the true argmax at the winning init_t. (5)BUDGET: 20 CG faster than 25, ~4min. (6)Serial.", "run_id": "breast-ct-claude-agentic-fastdiff-flow-pixel-constrained-search-20260703-01", "runtime": {"elapsed_s": 232.05063366889954}, "schema_version": 3, "solver_key": "fastdiff-flow-pixel-constrained", "solver_name": "Fast-diffusion flow (pixel, constrained DC)", "split": {"train_n": 400, "val_n": 200}, "status": "keep", "ts": "2026-07-06T22:18:48Z"}
