{"advice_for_others": "itnet-claude-agentic: pretrain_epochs=60, pretrain_lr=0.001, itnet_k=1, itnet_alpha=0.02, unet_c=16, finetune_epochs=0, finetune_lr=0.0001, train_n=800, val_n=200, grad_clip=1.0, seed=43, rationale=iter-14 (breast ItNet v1). SIX-BOX: (1) PRIOR: ALPHA MAP (tn800): a0.0->0.8842, a0.02->0.8852 (champion, iter-12), a0.03->0.8828 (iter-13). Shallow interior optimum ~a0.02; architecture plateaus ~0.885 across ALL exhausted lever families (k, alpha, lr, width-hurts, data-diversity-saturates, compute-flat). (2) FAILURE MODE: none active; the task now is to CHARACTERIZE the ~0.885 plateaus run-to-run noise band (needed for honest reporting; the +-0.001 deltas between iter-8/10/12 are suspected GPU/seed noise, not signal). (3) ONE KNOB (from champion iter-12): seed 42 -> 43. All else = iter-12 (c16,tn800,ep60,k1,a0.02,lr1e-3). (4) HYPOTHESIS: a seed replicate of the champion lands within +-0.002 of 0.8852, confirming the recent sub-0.001 improvements are noise and the true plateau is ~0.885. FALSIFIER: if hr swings > 0.005 from 0.8852, the search is seed-noise-limited and single-run deltas are unreliable -> report the plateau as a mean over replicates. (5) BUDGET: ep60/tn800 = ~1140s, in budget. (6) Loop to iter-20 (seed replicates to finish per plateau).", "agent": "itnet-claude-agentic", "campaign": "search-20260703-01", "cfg_full": {"finetune_epochs": 0, "finetune_lr": 0.0001, "grad_clip": 1.0, "itnet_alpha": 0.02, "itnet_k": 1, "pretrain_epochs": 60, "pretrain_lr": 0.001, "rationale": "iter-14 (breast ItNet v1). SIX-BOX: (1) PRIOR: ALPHA MAP (tn800): a0.0->0.8842, a0.02->0.8852 (champion, iter-12), a0.03->0.8828 (iter-13). Shallow interior optimum ~a0.02; architecture plateaus ~0.885 across ALL exhausted lever families (k, alpha, lr, width-hurts, data-diversity-saturates, compute-flat). (2) FAILURE MODE: none active; the task now is to CHARACTERIZE the ~0.885 plateaus run-to-run noise band (needed for honest reporting; the +-0.001 deltas between iter-8/10/12 are suspected GPU/seed noise, not signal). (3) ONE KNOB (from champion iter-12): seed 42 -> 43. All else = iter-12 (c16,tn800,ep60,k1,a0.02,lr1e-3). (4) HYPOTHESIS: a seed replicate of the champion lands within +-0.002 of 0.8852, confirming the recent sub-0.001 improvements are noise and the true plateau is ~0.885. FALSIFIER: if hr swings > 0.005 from 0.8852, the search is seed-noise-limited and single-run deltas are unreliable -> report the plateau as a mean over replicates. (5) BUDGET: ep60/tn800 = ~1140s, in budget. (6) Loop to iter-20 (seed replicates to finish per plateau).", "seed": 43, "train_n": 800, "unet_c": 16, "val_n": 200}, "challenge": "breast_ct", "change_class": "architecture", "git_commit": "671da566", "images": {"comparison": "runs/breast-ct-claude-agentic-itnet-search-20260703-01/iterations/iter-0014/comparison.png", "test_showcase": null, "valtest_showcase": null}, "iter": 14, "kept": true, "metrics": {"headroom": 0.8699227574793109, "headroom_std": 0.014453360352036896, "val_psnr": 54.04016876220703, "val_psnr_std": 1.5364564355932904, "val_rmse": 0.0006782596465200186, "val_rmse_std": 0.0001155081156922181, "val_ssim": 0.9986164569854736, "val_ssim_std": 0.0004873319808823803}, "model": "claude-opus-4-8-1m", "obs_path": "breast-ct-claude-agentic-itnet-search-20260703-01/iterations/iter-0014/observation.json", "obs_sha1": "419c7b66814d423a28fd3c29f3e6d4c58dbf6b66", "params_M": 0.232881, "params_source": "observation", "rationale": "itnet-claude-agentic: pretrain_epochs=60, pretrain_lr=0.001, itnet_k=1, itnet_alpha=0.02, unet_c=16, finetune_epochs=0, finetune_lr=0.0001, train_n=800, val_n=200, grad_clip=1.0, seed=43, rationale=iter-14 (breast ItNet v1). SIX-BOX: (1) PRIOR: ALPHA MAP (tn800): a0.0->0.8842, a0.02->0.8852 (champion, iter-12), a0.03->0.8828 (iter-13). Shallow interior optimum ~a0.02; architecture plateaus ~0.885 across ALL exhausted lever families (k, alpha, lr, width-hurts, data-diversity-saturates, compute-flat). (2) FAILURE MODE: none active; the task now is to CHARACTERIZE the ~0.885 plateaus run-to-run noise band (needed for honest reporting; the +-0.001 deltas between iter-8/10/12 are suspected GPU/seed noise, not signal). (3) ONE KNOB (from champion iter-12): seed 42 -> 43. All else = iter-12 (c16,tn800,ep60,k1,a0.02,lr1e-3). (4) HYPOTHESIS: a seed replicate of the champion lands within +-0.002 of 0.8852, confirming the recent sub-0.001 improvements are noise and the true plateau is ~0.885. FALSIFIER: if hr swings > 0.005 from 0.8852, the search is seed-noise-limited and single-run deltas are unreliable -> report the plateau as a mean over replicates. (5) BUDGET: ep60/tn800 = ~1140s, in budget. (6) Loop to iter-20 (seed replicates to finish per plateau).", "run_id": "breast-ct-claude-agentic-itnet-search-20260703-01", "runtime": {"elapsed_s": 1016.7256569862366}, "schema_version": 3, "solver_key": "itnet", "solver_name": "ITNet v1", "split": {"train_n": 400, "val_n": 200}, "status": "keep", "ts": "2026-07-04T21:27:42Z"}
{"advice_for_others": "itnet-claude-agentic: pretrain_epochs=60, pretrain_lr=0.001, itnet_k=1, itnet_alpha=0.02, unet_c=16, finetune_epochs=0, finetune_lr=0.0001, train_n=800, val_n=200, grad_clip=1.0, seed=44, rationale=iter-15 (breast ItNet v1). SIX-BOX: (1) PRIOR: SEED-NOISE DISCOVERY. Champion config (c16,tn800,ep60,k1,a0.02) at seed42 (iter-12) = 0.8852, at seed43 (iter-14) = 0.8699 -> a 0.0153 swing from SEED ALONE. This DWARFS the sub-0.001 deltas between iter-8/10/12 -> those were NOISE, not signal. The search is seed-noise-limited (~+-0.015 band). (2) FAILURE MODE: single-run hr is unreliable at the plateau; the honest reported number must be a MEAN over seeds. (3) ONE KNOB (from champion iter-12): seed 43 -> 44 (third replicate). All else identical. (4) HYPOTHESIS: seed44 lands within the [0.870, 0.885] band established by seeds 42/43, letting me estimate the plateau MEAN over 3 seeds. FALSIFIER: if seed44 is outside that band, the noise is even wider and more replicates are needed. (5) BUDGET: ep60/tn800 ~1140s, in budget. (6) Loop to iter-20; remaining iters extend the seed-replicate set for a plateau mean+-std.", "agent": "itnet-claude-agentic", "campaign": "search-20260703-01", "cfg_full": {"finetune_epochs": 0, "finetune_lr": 0.0001, "grad_clip": 1.0, "itnet_alpha": 0.02, "itnet_k": 1, "pretrain_epochs": 60, "pretrain_lr": 0.001, "rationale": "iter-15 (breast ItNet v1). SIX-BOX: (1) PRIOR: SEED-NOISE DISCOVERY. Champion config (c16,tn800,ep60,k1,a0.02) at seed42 (iter-12) = 0.8852, at seed43 (iter-14) = 0.8699 -> a 0.0153 swing from SEED ALONE. This DWARFS the sub-0.001 deltas between iter-8/10/12 -> those were NOISE, not signal. The search is seed-noise-limited (~+-0.015 band). (2) FAILURE MODE: single-run hr is unreliable at the plateau; the honest reported number must be a MEAN over seeds. (3) ONE KNOB (from champion iter-12): seed 43 -> 44 (third replicate). All else identical. (4) HYPOTHESIS: seed44 lands within the [0.870, 0.885] band established by seeds 42/43, letting me estimate the plateau MEAN over 3 seeds. FALSIFIER: if seed44 is outside that band, the noise is even wider and more replicates are needed. (5) BUDGET: ep60/tn800 ~1140s, in budget. (6) Loop to iter-20; remaining iters extend the seed-replicate set for a plateau mean+-std.", "seed": 44, "train_n": 800, "unet_c": 16, "val_n": 200}, "challenge": "breast_ct", "change_class": "architecture", "git_commit": "671da566", "images": {"comparison": "runs/breast-ct-claude-agentic-itnet-search-20260703-01/iterations/iter-0015/comparison.png", "test_showcase": null, "valtest_showcase": null}, "iter": 15, "kept": true, "metrics": {"headroom": 0.8784297338471702, "headroom_std": 0.013667574040170534, "val_psnr": 54.627647399902344, "val_psnr_std": 1.5482619990603441, "val_rmse": 0.0006339018582366407, "val_rmse_std": 0.0001089614338309206, "val_ssim": 0.9984180927276611, "val_ssim_std": 0.0005037193769485401}, "model": "claude-opus-4-8-1m", "obs_path": "breast-ct-claude-agentic-itnet-search-20260703-01/iterations/iter-0015/observation.json", "obs_sha1": "e46f6c7bdbf342ef8d9c153e70e4a12cdeab29ed", "params_M": 0.232881, "params_source": "observation", "rationale": "itnet-claude-agentic: pretrain_epochs=60, pretrain_lr=0.001, itnet_k=1, itnet_alpha=0.02, unet_c=16, finetune_epochs=0, finetune_lr=0.0001, train_n=800, val_n=200, grad_clip=1.0, seed=44, rationale=iter-15 (breast ItNet v1). SIX-BOX: (1) PRIOR: SEED-NOISE DISCOVERY. Champion config (c16,tn800,ep60,k1,a0.02) at seed42 (iter-12) = 0.8852, at seed43 (iter-14) = 0.8699 -> a 0.0153 swing from SEED ALONE. This DWARFS the sub-0.001 deltas between iter-8/10/12 -> those were NOISE, not signal. The search is seed-noise-limited (~+-0.015 band). (2) FAILURE MODE: single-run hr is unreliable at the plateau; the honest reported number must be a MEAN over seeds. (3) ONE KNOB (from champion iter-12): seed 43 -> 44 (third replicate). All else identical. (4) HYPOTHESIS: seed44 lands within the [0.870, 0.885] band established by seeds 42/43, letting me estimate the plateau MEAN over 3 seeds. FALSIFIER: if seed44 is outside that band, the noise is even wider and more replicates are needed. (5) BUDGET: ep60/tn800 ~1140s, in budget. (6) Loop to iter-20; remaining iters extend the seed-replicate set for a plateau mean+-std.", "run_id": "breast-ct-claude-agentic-itnet-search-20260703-01", "runtime": {"elapsed_s": 1218.8495044708252}, "schema_version": 3, "solver_key": "itnet", "solver_name": "ITNet v1", "split": {"train_n": 400, "val_n": 200}, "status": "keep", "ts": "2026-07-04T22:30:34Z"}
{"advice_for_others": "itnet-claude-agentic: pretrain_epochs=60, pretrain_lr=0.001, itnet_k=1, itnet_alpha=0.02, unet_c=16, finetune_epochs=0, finetune_lr=0.0001, train_n=800, val_n=200, grad_clip=1.0, seed=45, rationale=iter-16 (breast ItNet v1). SIX-BOX: (1) PRIOR: SEED REPLICATES of champion config (c16,tn800,ep60,k1,a0.02): seed42 0.8852, seed43 0.8699, seed44 0.8784 -> mean ~0.878, std ~0.008, range 0.015. Confirms plateau ~0.878+-0.008 and that iter-8/10/12 sub-0.001 deltas were noise. (2) FAILURE MODE: n=3 std is still coarse; extend to n=5 for a tighter plateau mean+-std (the reported number). (3) ONE KNOB (from champion iter-12): seed 44 -> 45 (fourth replicate). All else identical. (4) HYPOTHESIS: seed45 lands in [0.870,0.885], tightening the plateau mean estimate toward ~0.878. FALSIFIER: an outlier outside that band widens the std. (5) BUDGET: ep60/tn800 ~1140s, in budget. (6) Loop to iter-20 (n=5 seed replicates then final summary).", "agent": "itnet-claude-agentic", "campaign": "search-20260703-01", "cfg_full": {"finetune_epochs": 0, "finetune_lr": 0.0001, "grad_clip": 1.0, "itnet_alpha": 0.02, "itnet_k": 1, "pretrain_epochs": 60, "pretrain_lr": 0.001, "rationale": "iter-16 (breast ItNet v1). SIX-BOX: (1) PRIOR: SEED REPLICATES of champion config (c16,tn800,ep60,k1,a0.02): seed42 0.8852, seed43 0.8699, seed44 0.8784 -> mean ~0.878, std ~0.008, range 0.015. Confirms plateau ~0.878+-0.008 and that iter-8/10/12 sub-0.001 deltas were noise. (2) FAILURE MODE: n=3 std is still coarse; extend to n=5 for a tighter plateau mean+-std (the reported number). (3) ONE KNOB (from champion iter-12): seed 44 -> 45 (fourth replicate). All else identical. (4) HYPOTHESIS: seed45 lands in [0.870,0.885], tightening the plateau mean estimate toward ~0.878. FALSIFIER: an outlier outside that band widens the std. (5) BUDGET: ep60/tn800 ~1140s, in budget. (6) Loop to iter-20 (n=5 seed replicates then final summary).", "seed": 45, "train_n": 800, "unet_c": 16, "val_n": 200}, "challenge": "breast_ct", "change_class": "architecture", "git_commit": "671da566", "images": {"comparison": "runs/breast-ct-claude-agentic-itnet-search-20260703-01/iterations/iter-0016/comparison.png", "test_showcase": null, "valtest_showcase": null}, "iter": 16, "kept": true, "metrics": {"headroom": 0.8892614182392299, "headroom_std": 0.014109650252525292, "val_psnr": 55.43821716308594, "val_psnr_std": 1.7032378496626799, "val_rmse": 0.0005774223827756941, "val_rmse_std": 0.0001081022355081402, "val_ssim": 0.9987801909446716, "val_ssim_std": 0.0005050262968202963}, "model": "claude-opus-4-8-1m", "obs_path": "breast-ct-claude-agentic-itnet-search-20260703-01/iterations/iter-0016/observation.json", "obs_sha1": "347d2ff34f117485b04f4327b84886546c548086", "params_M": 0.232881, "params_source": "observation", "rationale": "itnet-claude-agentic: pretrain_epochs=60, pretrain_lr=0.001, itnet_k=1, itnet_alpha=0.02, unet_c=16, finetune_epochs=0, finetune_lr=0.0001, train_n=800, val_n=200, grad_clip=1.0, seed=45, rationale=iter-16 (breast ItNet v1). SIX-BOX: (1) PRIOR: SEED REPLICATES of champion config (c16,tn800,ep60,k1,a0.02): seed42 0.8852, seed43 0.8699, seed44 0.8784 -> mean ~0.878, std ~0.008, range 0.015. Confirms plateau ~0.878+-0.008 and that iter-8/10/12 sub-0.001 deltas were noise. (2) FAILURE MODE: n=3 std is still coarse; extend to n=5 for a tighter plateau mean+-std (the reported number). (3) ONE KNOB (from champion iter-12): seed 44 -> 45 (fourth replicate). All else identical. (4) HYPOTHESIS: seed45 lands in [0.870,0.885], tightening the plateau mean estimate toward ~0.878. FALSIFIER: an outlier outside that band widens the std. (5) BUDGET: ep60/tn800 ~1140s, in budget. (6) Loop to iter-20 (n=5 seed replicates then final summary).", "run_id": "breast-ct-claude-agentic-itnet-search-20260703-01", "runtime": {"elapsed_s": 894.4129612445831}, "schema_version": 3, "solver_key": "itnet", "solver_name": "ITNet v1", "split": {"train_n": 400, "val_n": 200}, "status": "keep", "ts": "2026-07-04T23:25:07Z"}
{"advice_for_others": "itnet-claude-agentic: pretrain_epochs=60, pretrain_lr=0.001, itnet_k=1, itnet_alpha=0.02, unet_c=16, finetune_epochs=0, finetune_lr=0.0001, train_n=800, val_n=200, grad_clip=1.0, seed=46, rationale=iter-17 (breast ItNet v1). SIX-BOX: (1) PRIOR: champion-config seed replicates: s42 0.8852, s43 0.8699, s44 0.8784, s45 0.8893 -> mean ~0.881, std ~0.007, range 0.019. Plateau firmly ~0.881+-0.007; single-run deltas < 0.015 are NOISE. (2) FAILURE MODE: n=4 -> extend to n=5 for the final reported plateau mean+-std. (3) ONE KNOB (from champion iter-12): seed 45 -> 46 (fifth replicate). All else identical. (4) HYPOTHESIS: seed46 lands in [0.870,0.890], completing an n=5 estimate of the plateau mean ~0.881. FALSIFIER: an outlier widens std but does not change the plateau conclusion. (5) BUDGET: ep60/tn800 ~1140s, in budget. (6) Loop to iter-20 (n=5 replicates done at iter-17; iters 18-20 = final plateau confirmations).", "agent": "itnet-claude-agentic", "campaign": "search-20260703-01", "cfg_full": {"finetune_epochs": 0, "finetune_lr": 0.0001, "grad_clip": 1.0, "itnet_alpha": 0.02, "itnet_k": 1, "pretrain_epochs": 60, "pretrain_lr": 0.001, "rationale": "iter-17 (breast ItNet v1). SIX-BOX: (1) PRIOR: champion-config seed replicates: s42 0.8852, s43 0.8699, s44 0.8784, s45 0.8893 -> mean ~0.881, std ~0.007, range 0.019. Plateau firmly ~0.881+-0.007; single-run deltas < 0.015 are NOISE. (2) FAILURE MODE: n=4 -> extend to n=5 for the final reported plateau mean+-std. (3) ONE KNOB (from champion iter-12): seed 45 -> 46 (fifth replicate). All else identical. (4) HYPOTHESIS: seed46 lands in [0.870,0.890], completing an n=5 estimate of the plateau mean ~0.881. FALSIFIER: an outlier widens std but does not change the plateau conclusion. (5) BUDGET: ep60/tn800 ~1140s, in budget. (6) Loop to iter-20 (n=5 replicates done at iter-17; iters 18-20 = final plateau confirmations).", "seed": 46, "train_n": 800, "unet_c": 16, "val_n": 200}, "challenge": "breast_ct", "change_class": "architecture", "git_commit": "671da566", "images": {"comparison": "runs/breast-ct-claude-agentic-itnet-search-20260703-01/iterations/iter-0017/comparison.png", "test_showcase": null, "valtest_showcase": null}, "iter": 17, "kept": true, "metrics": {"headroom": 0.8841721976936285, "headroom_std": 0.013328053550268925, "val_psnr": 55.047943115234375, "val_psnr_std": 1.5900772297887253, "val_rmse": 0.0006039590225555003, "val_rmse_std": 0.00010559779259538929, "val_ssim": 0.9986667633056641, "val_ssim_std": 0.00045960011621252935}, "model": "claude-opus-4-8-1m", "obs_path": "breast-ct-claude-agentic-itnet-search-20260703-01/iterations/iter-0017/observation.json", "obs_sha1": "ba079468162226ccae4e956ff20083e581dc1ca1", "params_M": 0.232881, "params_source": "observation", "rationale": "itnet-claude-agentic: pretrain_epochs=60, pretrain_lr=0.001, itnet_k=1, itnet_alpha=0.02, unet_c=16, finetune_epochs=0, finetune_lr=0.0001, train_n=800, val_n=200, grad_clip=1.0, seed=46, rationale=iter-17 (breast ItNet v1). SIX-BOX: (1) PRIOR: champion-config seed replicates: s42 0.8852, s43 0.8699, s44 0.8784, s45 0.8893 -> mean ~0.881, std ~0.007, range 0.019. Plateau firmly ~0.881+-0.007; single-run deltas < 0.015 are NOISE. (2) FAILURE MODE: n=4 -> extend to n=5 for the final reported plateau mean+-std. (3) ONE KNOB (from champion iter-12): seed 45 -> 46 (fifth replicate). All else identical. (4) HYPOTHESIS: seed46 lands in [0.870,0.890], completing an n=5 estimate of the plateau mean ~0.881. FALSIFIER: an outlier widens std but does not change the plateau conclusion. (5) BUDGET: ep60/tn800 ~1140s, in budget. (6) Loop to iter-20 (n=5 replicates done at iter-17; iters 18-20 = final plateau confirmations).", "run_id": "breast-ct-claude-agentic-itnet-search-20260703-01", "runtime": {"elapsed_s": 1244.9466412067413}, "schema_version": 3, "solver_key": "itnet", "solver_name": "ITNet v1", "split": {"train_n": 400, "val_n": 200}, "status": "keep", "ts": "2026-07-05T00:30:59Z"}
