{"advice_for_others": "fastdiff_wdm_wavelet_constrained-claude-agentic: val_n=200, seed=42, fd_recon_ckpt=/cluster/maier/Agent4CT/checkpoints/fast_diffusion_wavelet_breast.pt, fd_recon_steps=5, fd_recon_init=fbp, fd_recon_init_t=0.005, fd_recon_eta=1.0, fd_recon_dc=1, fd_recon_dc_n_cg=18, fd_recon_dc_relax=1.0, dataset_kind=breast_ct, rationale=iter-17 NFE bracket (steps=5) around the steps=4 peak, breast-native wavelet CONSTRAINED, val=200. SIX-BOX: (1) PRIOR: steps sweep @n_cg18/init_t0.005: 2->hr0.002, 4->0.1304(BEST), 8->0.0768, 16->0. SHARP interior peak at steps=4 (drops steeply either side). (2) FAILURE MODE: steps<4 under-apply the interleaved CG-DC re-embed schedule; steps>4 accumulate re-embed+prior drift. (3) ONE KNOB: fd_recon_steps 4 -> 5 (bracket the peak from above). (4) HYPOTHESIS: steps=5 lands between 0.1304(steps4) and 0.0768(steps8); if >0.1304 peak is 5, else confirm steps=4. (5) BUDGET ~2min. (6) iter-18 on landing (will try steps=3 to bracket below).", "agent": "fastdiff_wdm_wavelet_constrained-claude-agentic", "campaign": "search-20260703-01", "cfg_full": {"dataset_kind": "breast_ct", "fd_recon_ckpt": "/cluster/maier/Agent4CT/checkpoints/fast_diffusion_wavelet_breast.pt", "fd_recon_dc": 1, "fd_recon_dc_n_cg": 18, "fd_recon_dc_relax": 1.0, "fd_recon_eta": 1.0, "fd_recon_init": "fbp", "fd_recon_init_t": 0.005, "fd_recon_steps": 5, "rationale": "iter-17 NFE bracket (steps=5) around the steps=4 peak, breast-native wavelet CONSTRAINED, val=200. SIX-BOX: (1) PRIOR: steps sweep @n_cg18/init_t0.005: 2->hr0.002, 4->0.1304(BEST), 8->0.0768, 16->0. SHARP interior peak at steps=4 (drops steeply either side). (2) FAILURE MODE: steps<4 under-apply the interleaved CG-DC re-embed schedule; steps>4 accumulate re-embed+prior drift. (3) ONE KNOB: fd_recon_steps 4 -> 5 (bracket the peak from above). (4) HYPOTHESIS: steps=5 lands between 0.1304(steps4) and 0.0768(steps8); if >0.1304 peak is 5, else confirm steps=4. (5) BUDGET ~2min. (6) iter-18 on landing (will try steps=3 to bracket below).", "seed": 42, "val_n": 200}, "challenge": "breast_ct", "change_class": "architecture", "git_commit": "671da566", "images": {"comparison": "runs/breast-ct-claude-agentic-fastdiff-wdm-wavelet-constrained-search-20260703-01/iterations/iter-0017/comparison.png", "test_showcase": null, "valtest_showcase": null}, "iter": 17, "kept": true, "metrics": {"headroom": 0.26579927161105843, "headroom_std": 0.03614538610136096, "val_psnr": 39.007904052734375, "val_psnr_std": 0.24655654819853792, "val_rmse": 0.003828330896794796, "val_rmse_std": 8.671150269860678e-05, "val_ssim": 0.9290040135383606, "val_ssim_std": 0.0033894631547936325}, "model": "claude-opus-4-8-1m", "obs_path": "breast-ct-claude-agentic-fastdiff-wdm-wavelet-constrained-search-20260703-01/iterations/iter-0017/observation.json", "obs_sha1": "0c30ab7825f96f6977fd794eb325bd018f813b59", "params_M": 3.824908, "params_source": "observation", "rationale": "fastdiff_wdm_wavelet_constrained-claude-agentic: val_n=200, seed=42, fd_recon_ckpt=/cluster/maier/Agent4CT/checkpoints/fast_diffusion_wavelet_breast.pt, fd_recon_steps=5, fd_recon_init=fbp, fd_recon_init_t=0.005, fd_recon_eta=1.0, fd_recon_dc=1, fd_recon_dc_n_cg=18, fd_recon_dc_relax=1.0, dataset_kind=breast_ct, rationale=iter-17 NFE bracket (steps=5) around the steps=4 peak, breast-native wavelet CONSTRAINED, val=200. SIX-BOX: (1) PRIOR: steps sweep @n_cg18/init_t0.005: 2->hr0.002, 4->0.1304(BEST), 8->0.0768, 16->0. SHARP interior peak at steps=4 (drops steeply either side). (2) FAILURE MODE: steps<4 under-apply the interleaved CG-DC re-embed schedule; steps>4 accumulate re-embed+prior drift. (3) ONE KNOB: fd_recon_steps 4 -> 5 (bracket the peak from above). (4) HYPOTHESIS: steps=5 lands between 0.1304(steps4) and 0.0768(steps8); if >0.1304 peak is 5, else confirm steps=4. (5) BUDGET ~2min. (6) iter-18 on landing (will try steps=3 to bracket below).", "run_id": "breast-ct-claude-agentic-fastdiff-wdm-wavelet-constrained-search-20260703-01", "runtime": {"elapsed_s": 139.19232606887817}, "schema_version": 3, "solver_key": "fastdiff-wdm-wavelet-constrained", "solver_name": "Fast-diffusion WDM (wavelet, constrained DC)", "split": {"train_n": 3600, "val_n": 200}, "status": "keep", "ts": "2026-07-06T22:05:18Z"}
{"advice_for_others": "fastdiff_wdm_wavelet_constrained-claude-agentic: val_n=200, seed=42, fd_recon_ckpt=/cluster/maier/Agent4CT/checkpoints/fast_diffusion_wavelet_breast.pt, fd_recon_steps=6, fd_recon_init=fbp, fd_recon_init_t=0.005, fd_recon_eta=1.0, fd_recon_dc=1, fd_recon_dc_n_cg=18, fd_recon_dc_relax=1.0, dataset_kind=breast_ct, rationale=iter-18 NFE bracket (steps=6), breast-native wavelet CONSTRAINED, val=200. SIX-BOX: (1) PRIOR: steps@n_cg18/init_t0.005: 2->0.002, 4->0.130, 5->0.2658(BEST), 8->0.0768, 16->0. Non-monotone/sharp: steps=5 nearly 2x steps4. (2) FAILURE MODE: the interleaved DC re-embed schedule is sharply sensitive to step count; 5 hits a sweet spot, 8 falls off. (3) ONE KNOB: fd_recon_steps 5 -> 6. (4) HYPOTHESIS: steps=6 lands between 0.266(5) and 0.077(8); if >0.266 peak is 6, else steps=5 optimal. (5) BUDGET ~2min. (6) iter-19 on landing (steps=7 or refine around 5).", "agent": "fastdiff_wdm_wavelet_constrained-claude-agentic", "campaign": "search-20260703-01", "cfg_full": {"dataset_kind": "breast_ct", "fd_recon_ckpt": "/cluster/maier/Agent4CT/checkpoints/fast_diffusion_wavelet_breast.pt", "fd_recon_dc": 1, "fd_recon_dc_n_cg": 18, "fd_recon_dc_relax": 1.0, "fd_recon_eta": 1.0, "fd_recon_init": "fbp", "fd_recon_init_t": 0.005, "fd_recon_steps": 6, "rationale": "iter-18 NFE bracket (steps=6), breast-native wavelet CONSTRAINED, val=200. SIX-BOX: (1) PRIOR: steps@n_cg18/init_t0.005: 2->0.002, 4->0.130, 5->0.2658(BEST), 8->0.0768, 16->0. Non-monotone/sharp: steps=5 nearly 2x steps4. (2) FAILURE MODE: the interleaved DC re-embed schedule is sharply sensitive to step count; 5 hits a sweet spot, 8 falls off. (3) ONE KNOB: fd_recon_steps 5 -> 6. (4) HYPOTHESIS: steps=6 lands between 0.266(5) and 0.077(8); if >0.266 peak is 6, else steps=5 optimal. (5) BUDGET ~2min. (6) iter-19 on landing (steps=7 or refine around 5).", "seed": 42, "val_n": 200}, "challenge": "breast_ct", "change_class": "architecture", "git_commit": "671da566", "images": {"comparison": "runs/breast-ct-claude-agentic-fastdiff-wdm-wavelet-constrained-search-20260703-01/iterations/iter-0018/comparison.png", "test_showcase": null, "valtest_showcase": null}, "iter": 18, "kept": true, "metrics": {"headroom": 0.10327991141664516, "headroom_std": 0.052754116451402475, "val_psnr": 37.27105712890625, "val_psnr_std": 0.2053819067575442, "val_rmse": 0.004675752948969603, "val_rmse_std": 7.175562642294414e-05, "val_ssim": 0.8885961771011353, "val_ssim_std": 0.005531415129777912}, "model": "claude-opus-4-8-1m", "obs_path": "breast-ct-claude-agentic-fastdiff-wdm-wavelet-constrained-search-20260703-01/iterations/iter-0018/observation.json", "obs_sha1": "f8bc4faf198f53383722138d0e05bc6f8cff473c", "params_M": 3.824908, "params_source": "observation", "rationale": "fastdiff_wdm_wavelet_constrained-claude-agentic: val_n=200, seed=42, fd_recon_ckpt=/cluster/maier/Agent4CT/checkpoints/fast_diffusion_wavelet_breast.pt, fd_recon_steps=6, fd_recon_init=fbp, fd_recon_init_t=0.005, fd_recon_eta=1.0, fd_recon_dc=1, fd_recon_dc_n_cg=18, fd_recon_dc_relax=1.0, dataset_kind=breast_ct, rationale=iter-18 NFE bracket (steps=6), breast-native wavelet CONSTRAINED, val=200. SIX-BOX: (1) PRIOR: steps@n_cg18/init_t0.005: 2->0.002, 4->0.130, 5->0.2658(BEST), 8->0.0768, 16->0. Non-monotone/sharp: steps=5 nearly 2x steps4. (2) FAILURE MODE: the interleaved DC re-embed schedule is sharply sensitive to step count; 5 hits a sweet spot, 8 falls off. (3) ONE KNOB: fd_recon_steps 5 -> 6. (4) HYPOTHESIS: steps=6 lands between 0.266(5) and 0.077(8); if >0.266 peak is 6, else steps=5 optimal. (5) BUDGET ~2min. (6) iter-19 on landing (steps=7 or refine around 5).", "run_id": "breast-ct-claude-agentic-fastdiff-wdm-wavelet-constrained-search-20260703-01", "runtime": {"elapsed_s": 144.76002383232117}, "schema_version": 3, "solver_key": "fastdiff-wdm-wavelet-constrained", "solver_name": "Fast-diffusion WDM (wavelet, constrained DC)", "split": {"train_n": 3600, "val_n": 200}, "status": "keep", "ts": "2026-07-06T22:08:46Z"}
{"advice_for_others": "fastdiff_wdm_wavelet_constrained-claude-agentic: val_n=200, seed=42, fd_recon_ckpt=/cluster/maier/Agent4CT/checkpoints/fast_diffusion_wavelet_breast.pt, fd_recon_steps=5, fd_recon_init=fbp, fd_recon_init_t=0.005, fd_recon_eta=1.0, fd_recon_dc=1, fd_recon_dc_n_cg=22, fd_recon_dc_relax=1.0, dataset_kind=breast_ct, rationale=iter-19 re-optimize n_cg AT the steps=5 peak, breast-native wavelet CONSTRAINED, val=200. SIX-BOX: (1) PRIOR: BEST is iter-17 steps5/n_cg18/init_t0.005/relax1.0 hr0.2658 (PSNR39.0/RMSE3.83e-3). n_cg was tuned at steps=8 (opt~18-20); the steps<->n_cg schedules interact, so the n_cg optimum may shift at steps=5. (2) FAILURE MODE: n_cg18 may be slightly under/over-converged at the steps=5 schedule. (3) ONE KNOB: fd_recon_dc_n_cg 18 -> 22 (test if a stronger CG solve helps more at the sharper steps=5 schedule). (4) HYPOTHESIS: at steps=5 fewer DC applications occur, so each may want more CG iters -> n_cg22 could beat 0.2658; if it drops, 18 remains optimal and I lock steps5/n_cg18. (5) BUDGET ~2.5min. (6) iter-20 (final): the better of a dc_relax0.9 nudge or n_cg16 at steps5.", "agent": "fastdiff_wdm_wavelet_constrained-claude-agentic", "campaign": "search-20260703-01", "cfg_full": {"dataset_kind": "breast_ct", "fd_recon_ckpt": "/cluster/maier/Agent4CT/checkpoints/fast_diffusion_wavelet_breast.pt", "fd_recon_dc": 1, "fd_recon_dc_n_cg": 22, "fd_recon_dc_relax": 1.0, "fd_recon_eta": 1.0, "fd_recon_init": "fbp", "fd_recon_init_t": 0.005, "fd_recon_steps": 5, "rationale": "iter-19 re-optimize n_cg AT the steps=5 peak, breast-native wavelet CONSTRAINED, val=200. SIX-BOX: (1) PRIOR: BEST is iter-17 steps5/n_cg18/init_t0.005/relax1.0 hr0.2658 (PSNR39.0/RMSE3.83e-3). n_cg was tuned at steps=8 (opt~18-20); the steps<->n_cg schedules interact, so the n_cg optimum may shift at steps=5. (2) FAILURE MODE: n_cg18 may be slightly under/over-converged at the steps=5 schedule. (3) ONE KNOB: fd_recon_dc_n_cg 18 -> 22 (test if a stronger CG solve helps more at the sharper steps=5 schedule). (4) HYPOTHESIS: at steps=5 fewer DC applications occur, so each may want more CG iters -> n_cg22 could beat 0.2658; if it drops, 18 remains optimal and I lock steps5/n_cg18. (5) BUDGET ~2.5min. (6) iter-20 (final): the better of a dc_relax0.9 nudge or n_cg16 at steps5.", "seed": 42, "val_n": 200}, "challenge": "breast_ct", "change_class": "architecture", "git_commit": "671da566", "images": {"comparison": "runs/breast-ct-claude-agentic-fastdiff-wdm-wavelet-constrained-search-20260703-01/iterations/iter-0019/comparison.png", "test_showcase": null, "valtest_showcase": null}, "iter": 19, "kept": true, "metrics": {"headroom": 0.2684305523269339, "headroom_std": 0.036011261242236726, "val_psnr": 39.039085388183594, "val_psnr_std": 0.2519492110542341, "val_rmse": 0.0038146106526255608, "val_rmse_std": 8.932202310794366e-05, "val_ssim": 0.9271124005317688, "val_ssim_std": 0.0035435661257262317}, "model": "claude-opus-4-8-1m", "obs_path": "breast-ct-claude-agentic-fastdiff-wdm-wavelet-constrained-search-20260703-01/iterations/iter-0019/observation.json", "obs_sha1": "45df2679de917bba2a89551eb2b4b6531e622233", "params_M": 3.824908, "params_source": "observation", "rationale": "fastdiff_wdm_wavelet_constrained-claude-agentic: val_n=200, seed=42, fd_recon_ckpt=/cluster/maier/Agent4CT/checkpoints/fast_diffusion_wavelet_breast.pt, fd_recon_steps=5, fd_recon_init=fbp, fd_recon_init_t=0.005, fd_recon_eta=1.0, fd_recon_dc=1, fd_recon_dc_n_cg=22, fd_recon_dc_relax=1.0, dataset_kind=breast_ct, rationale=iter-19 re-optimize n_cg AT the steps=5 peak, breast-native wavelet CONSTRAINED, val=200. SIX-BOX: (1) PRIOR: BEST is iter-17 steps5/n_cg18/init_t0.005/relax1.0 hr0.2658 (PSNR39.0/RMSE3.83e-3). n_cg was tuned at steps=8 (opt~18-20); the steps<->n_cg schedules interact, so the n_cg optimum may shift at steps=5. (2) FAILURE MODE: n_cg18 may be slightly under/over-converged at the steps=5 schedule. (3) ONE KNOB: fd_recon_dc_n_cg 18 -> 22 (test if a stronger CG solve helps more at the sharper steps=5 schedule). (4) HYPOTHESIS: at steps=5 fewer DC applications occur, so each may want more CG iters -> n_cg22 could beat 0.2658; if it drops, 18 remains optimal and I lock steps5/n_cg18. (5) BUDGET ~2.5min. (6) iter-20 (final): the better of a dc_relax0.9 nudge or n_cg16 at steps5.", "run_id": "breast-ct-claude-agentic-fastdiff-wdm-wavelet-constrained-search-20260703-01", "runtime": {"elapsed_s": 143.09531688690186}, "schema_version": 3, "solver_key": "fastdiff-wdm-wavelet-constrained", "solver_name": "Fast-diffusion WDM (wavelet, constrained DC)", "split": {"train_n": 3600, "val_n": 200}, "status": "keep", "ts": "2026-07-06T22:12:10Z"}
{"advice_for_others": "fastdiff_wdm_wavelet_constrained-claude-agentic: val_n=200, seed=42, fd_recon_ckpt=/cluster/maier/Agent4CT/checkpoints/fast_diffusion_wavelet_breast.pt, fd_recon_steps=5, fd_recon_init=fbp, fd_recon_init_t=0.005, fd_recon_eta=1.0, fd_recon_dc=1, fd_recon_dc_n_cg=22, fd_recon_dc_relax=0.9, dataset_kind=breast_ct, rationale=iter-20 FINAL: dc_relax nudge at the optimum, breast-native wavelet CONSTRAINED, val=200. SIX-BOX: (1) PRIOR: BEST iter-19 steps5/n_cg22/init_t0.005/relax1.0 hr0.2684 (PSNR39.04/RMSE3.81e-3); n_cg plateau 18-22 ~0.266-0.268. All other levers characterized: init_t must be ~0 (prior net-harmful, monotone), steps=5 is a sharp peak, dc_relax=1.0 has been fixed since iter-2. (2) FAILURE MODE: dc_relax=1.0 fully replaces the warm-start each step; a slight blend-back (0.9) might retain useful FBP structure the CG-LSQ drops. (3) ONE KNOB: fd_recon_dc_relax 1.0 -> 0.9 (retain 10% warm-start FBP). (4) HYPOTHESIS: 0.9 blends a little regularized-FBP structure into the CG-LSQ solution -> could edge above 0.2684; if it drops, relax=1.0 (full DC) is confirmed optimal and iter-19 is the champion. (5) BUDGET ~2.5min. (6) FINAL iter -- loop concludes at 20 per protocol.", "agent": "fastdiff_wdm_wavelet_constrained-claude-agentic", "campaign": "search-20260703-01", "cfg_full": {"dataset_kind": "breast_ct", "fd_recon_ckpt": "/cluster/maier/Agent4CT/checkpoints/fast_diffusion_wavelet_breast.pt", "fd_recon_dc": 1, "fd_recon_dc_n_cg": 22, "fd_recon_dc_relax": 0.9, "fd_recon_eta": 1.0, "fd_recon_init": "fbp", "fd_recon_init_t": 0.005, "fd_recon_steps": 5, "rationale": "iter-20 FINAL: dc_relax nudge at the optimum, breast-native wavelet CONSTRAINED, val=200. SIX-BOX: (1) PRIOR: BEST iter-19 steps5/n_cg22/init_t0.005/relax1.0 hr0.2684 (PSNR39.04/RMSE3.81e-3); n_cg plateau 18-22 ~0.266-0.268. All other levers characterized: init_t must be ~0 (prior net-harmful, monotone), steps=5 is a sharp peak, dc_relax=1.0 has been fixed since iter-2. (2) FAILURE MODE: dc_relax=1.0 fully replaces the warm-start each step; a slight blend-back (0.9) might retain useful FBP structure the CG-LSQ drops. (3) ONE KNOB: fd_recon_dc_relax 1.0 -> 0.9 (retain 10% warm-start FBP). (4) HYPOTHESIS: 0.9 blends a little regularized-FBP structure into the CG-LSQ solution -> could edge above 0.2684; if it drops, relax=1.0 (full DC) is confirmed optimal and iter-19 is the champion. (5) BUDGET ~2.5min. (6) FINAL iter -- loop concludes at 20 per protocol.", "seed": 42, "val_n": 200}, "challenge": "breast_ct", "change_class": "architecture", "git_commit": "671da566", "images": {"comparison": "runs/breast-ct-claude-agentic-fastdiff-wdm-wavelet-constrained-search-20260703-01/iterations/iter-0020/comparison.png", "test_showcase": null, "valtest_showcase": null}, "iter": 20, "kept": true, "metrics": {"headroom": 0.27669639419700076, "headroom_std": 0.03375746398337493, "val_psnr": 39.13778305053711, "val_psnr_std": 0.25755289288217215, "val_rmse": 0.0037715102080255747, "val_rmse_std": 9.204824835853468e-05, "val_ssim": 0.9293705821037292, "val_ssim_std": 0.003374615461279479}, "model": "claude-opus-4-8-1m", "obs_path": "breast-ct-claude-agentic-fastdiff-wdm-wavelet-constrained-search-20260703-01/iterations/iter-0020/observation.json", "obs_sha1": "4e477d99c62b14b2c491f0ca427f365b6df5c198", "params_M": 3.824908, "params_source": "observation", "rationale": "fastdiff_wdm_wavelet_constrained-claude-agentic: val_n=200, seed=42, fd_recon_ckpt=/cluster/maier/Agent4CT/checkpoints/fast_diffusion_wavelet_breast.pt, fd_recon_steps=5, fd_recon_init=fbp, fd_recon_init_t=0.005, fd_recon_eta=1.0, fd_recon_dc=1, fd_recon_dc_n_cg=22, fd_recon_dc_relax=0.9, dataset_kind=breast_ct, rationale=iter-20 FINAL: dc_relax nudge at the optimum, breast-native wavelet CONSTRAINED, val=200. SIX-BOX: (1) PRIOR: BEST iter-19 steps5/n_cg22/init_t0.005/relax1.0 hr0.2684 (PSNR39.04/RMSE3.81e-3); n_cg plateau 18-22 ~0.266-0.268. All other levers characterized: init_t must be ~0 (prior net-harmful, monotone), steps=5 is a sharp peak, dc_relax=1.0 has been fixed since iter-2. (2) FAILURE MODE: dc_relax=1.0 fully replaces the warm-start each step; a slight blend-back (0.9) might retain useful FBP structure the CG-LSQ drops. (3) ONE KNOB: fd_recon_dc_relax 1.0 -> 0.9 (retain 10% warm-start FBP). (4) HYPOTHESIS: 0.9 blends a little regularized-FBP structure into the CG-LSQ solution -> could edge above 0.2684; if it drops, relax=1.0 (full DC) is confirmed optimal and iter-19 is the champion. (5) BUDGET ~2.5min. (6) FINAL iter -- loop concludes at 20 per protocol.", "run_id": "breast-ct-claude-agentic-fastdiff-wdm-wavelet-constrained-search-20260703-01", "runtime": {"elapsed_s": 122.4727578163147}, "schema_version": 3, "solver_key": "fastdiff-wdm-wavelet-constrained", "solver_name": "Fast-diffusion WDM (wavelet, constrained DC)", "split": {"train_n": 3600, "val_n": 200}, "status": "keep", "ts": "2026-07-06T22:15:18Z"}
{"advice_for_others": "fastdiff_wdm_wavelet_unconstrained-claude-agentic: val_n=200, seed=42, fd_recon_ckpt=/cluster/maier/Agent4CT/checkpoints/fast_diffusion_wavelet_breast.pt, fd_recon_steps=8, fd_recon_init=fbp, fd_recon_init_t=0.7, fd_recon_eta=1.0, fd_recon_dc=0, fd_recon_dc_n_cg=5, fd_recon_dc_relax=0.5, dataset_kind=breast_ct", "agent": "fastdiff_wdm_wavelet_unconstrained-claude-agentic", "campaign": "search-20260703-01", "cfg_full": {"dataset_kind": "breast_ct", "fd_recon_ckpt": "/cluster/maier/Agent4CT/checkpoints/fast_diffusion_wavelet_breast.pt", "fd_recon_dc": 0, "fd_recon_dc_n_cg": 5, "fd_recon_dc_relax": 0.5, "fd_recon_eta": 1.0, "fd_recon_init": "fbp", "fd_recon_init_t": 0.7, "fd_recon_steps": 8, "seed": 42, "val_n": 200}, "challenge": "breast_ct", "change_class": "architecture", "git_commit": "671da566", "images": {"comparison": "runs/breast-ct-claude-agentic-fastdiff-wdm-wavelet-unconstrained-search-20260703-01/iterations/iter-0001/comparison.png", "test_showcase": null, "valtest_showcase": null}, "iter": 1, "kept": false, "metrics": {"headroom": 0.0, "headroom_std": 0.0, "val_psnr": 23.632835388183594, "val_psnr_std": 2.6999908982393217, "val_rmse": 0.022478261962532997, "val_rmse_std": 0.00608060637648982, "val_ssim": 0.8563522100448608, "val_ssim_std": 0.017724221573407792}, "model": "claude-opus-4-8-1m", "obs_path": "breast-ct-claude-agentic-fastdiff-wdm-wavelet-unconstrained-search-20260703-01/iterations/iter-0001/observation.json", "obs_sha1": "9874dcc573ce8269ffb2f7955b89d6179cac576d", "params_M": 3.824908, "params_source": "observation", "rationale": "fastdiff_wdm_wavelet_unconstrained-claude-agentic: val_n=200, seed=42, fd_recon_ckpt=/cluster/maier/Agent4CT/checkpoints/fast_diffusion_wavelet_breast.pt, fd_recon_steps=8, fd_recon_init=fbp, fd_recon_init_t=0.7, fd_recon_eta=1.0, fd_recon_dc=0, fd_recon_dc_n_cg=5, fd_recon_dc_relax=0.5, dataset_kind=breast_ct", "run_id": "breast-ct-claude-agentic-fastdiff-wdm-wavelet-unconstrained-search-20260703-01", "runtime": {"elapsed_s": 92.80252003669739}, "schema_version": 3, "solver_key": "fastdiff-wdm-wavelet-unconstrained", "solver_name": "Fast-diffusion WDM (wavelet, unconstrained)", "split": {"train_n": 3600, "val_n": 200}, "status": "discard", "ts": "2026-07-07T01:17:50Z"}
