{"advice_for_others": "itnet_v3-claude-agentic: itnet_k=2, unet_c=24, alpha_init=0.0025734, lr=0.00035, epochs=5, batch_size=2, train_n=2400, val_n=200, grad_clip=1.0, max_train_s=1080, seed=42, rationale=iter-9 (breast-ct redo, search-20260703-01). START FROM iter-7 CHAMPION (c24/ep5/k2/lr2.16e-4, hr 0.8469). ONE KNOB: lr 0.00021567 -> 0.00035 (~1.6x higher learning rate). All else = iter-7 champion exactly (itnet_k=2, unet_c=24, alpha_init=0.0025734, epochs=5, batch_size=2, train_n=2400, val_n=200, grad_clip=1.0, seed=42). SIX-BOX (NUMBERS): (1) iter-6 (c24/ep4): 0.8385. iter-7 (c24/ep5): 0.8469=CHAMPION, SSIM 0.9983, PSNR 52.63, elapsed 939.5s=15.7min. iter-8 (c32/ep3): 0.8085 REGRESS -- capacity beyond c=24 is too under-trained at the epochs the wall allows, so c=24 is the capacity SWEET SPOT and the architecture axes (itnet_k=2 optimal per iter-4, unet_c=24 optimal per iter-6/7/8) are now BOUNDED. (2) FAILURE MODE: the remaining under-exploited lever is the TRAINING RECIPE. The c24/ep5 net is EPOCH-BUDGET-LIMITED (epochs still climbing at ep5 but the 20-min wall caps ~ep5-6 at c24). A HIGHER lr can reach a lower training loss in the SAME 5 epochs -> effectively buys convergence the epoch budget can't. lr has been fixed at the TPE-seed 2.16e-4 since iter-1 and never tuned on this redo split. (3) ONE KNOB: lr 2.16e-4 -> 3.5e-4 (~1.6x). c/k/epochs/train_n all held so any hr change isolates the lr effect. grad_clip=1.0 retained guards the higher lr against the occasional exploding-gradient step from the FBP adjoint in dc_step. (4) HYPOTHESIS: lr=3.5e-4 lifts hr above 0.8469 because the c24 net is epoch-budget-limited and a higher lr converges further within the fixed 5-epoch budget. FALSIFIER (NUMBERS): if hr <= 0.8469 at lr=3.5e-4, either the higher lr overshoots (unstable / worse) -> iter-10 tries a LOWER lr (1.5e-4) instead, or lr is already near-optimal -> iter-10 pivots to alpha_init (the DC step size). (5) BUDGET (HARD 20min=1200s): IDENTICAL config to iter-7 except the lr scalar (no compute change) -> elapsed ~= 939.5s = 15.7min < 1200s, same ~4min margin. max_train_s=1080 fences the TRAIN phase. train_n=2400 (<= OOM-safe cap). val=200 distinct val_truth.h5 cases, 256px inscribed-circle FOV (breast default). (6) do NOT return control mid-campaign; gate on iter-9 numeric-headroom obs via iter_wait.sh v3 then dispatch iter-10.", "agent": "itnet_v3-claude-agentic", "campaign": "search-20260703-01", "cfg_full": {"alpha_init": 0.0025734, "batch_size": 2, "epochs": 5, "grad_clip": 1.0, "itnet_k": 2, "lr": 0.00035, "max_train_s": 1080, "rationale": "iter-9 (breast-ct redo, search-20260703-01). START FROM iter-7 CHAMPION (c24/ep5/k2/lr2.16e-4, hr 0.8469). ONE KNOB: lr 0.00021567 -> 0.00035 (~1.6x higher learning rate). All else = iter-7 champion exactly (itnet_k=2, unet_c=24, alpha_init=0.0025734, epochs=5, batch_size=2, train_n=2400, val_n=200, grad_clip=1.0, seed=42). SIX-BOX (NUMBERS): (1) iter-6 (c24/ep4): 0.8385. iter-7 (c24/ep5): 0.8469=CHAMPION, SSIM 0.9983, PSNR 52.63, elapsed 939.5s=15.7min. iter-8 (c32/ep3): 0.8085 REGRESS -- capacity beyond c=24 is too under-trained at the epochs the wall allows, so c=24 is the capacity SWEET SPOT and the architecture axes (itnet_k=2 optimal per iter-4, unet_c=24 optimal per iter-6/7/8) are now BOUNDED. (2) FAILURE MODE: the remaining under-exploited lever is the TRAINING RECIPE. The c24/ep5 net is EPOCH-BUDGET-LIMITED (epochs still climbing at ep5 but the 20-min wall caps ~ep5-6 at c24). A HIGHER lr can reach a lower training loss in the SAME 5 epochs -> effectively buys convergence the epoch budget can't. lr has been fixed at the TPE-seed 2.16e-4 since iter-1 and never tuned on this redo split. (3) ONE KNOB: lr 2.16e-4 -> 3.5e-4 (~1.6x). c/k/epochs/train_n all held so any hr change isolates the lr effect. grad_clip=1.0 retained guards the higher lr against the occasional exploding-gradient step from the FBP adjoint in dc_step. (4) HYPOTHESIS: lr=3.5e-4 lifts hr above 0.8469 because the c24 net is epoch-budget-limited and a higher lr converges further within the fixed 5-epoch budget. FALSIFIER (NUMBERS): if hr <= 0.8469 at lr=3.5e-4, either the higher lr overshoots (unstable / worse) -> iter-10 tries a LOWER lr (1.5e-4) instead, or lr is already near-optimal -> iter-10 pivots to alpha_init (the DC step size). (5) BUDGET (HARD 20min=1200s): IDENTICAL config to iter-7 except the lr scalar (no compute change) -> elapsed ~= 939.5s = 15.7min < 1200s, same ~4min margin. max_train_s=1080 fences the TRAIN phase. train_n=2400 (<= OOM-safe cap). val=200 distinct val_truth.h5 cases, 256px inscribed-circle FOV (breast default). (6) do NOT return control mid-campaign; gate on iter-9 numeric-headroom obs via iter_wait.sh v3 then dispatch iter-10.", "seed": 42, "train_n": 2400, "unet_c": 24, "val_n": 200}, "challenge": "breast_ct", "change_class": "architecture", "git_commit": "671da566", "images": {"comparison": "runs/breast-ct-claude-agentic-itnet-v3-search-20260703-01/iterations/iter-0009/comparison.png", "test_showcase": null, "valtest_showcase": null}, "iter": 9, "kept": true, "metrics": {"headroom": 0.8398295159788415, "headroom_std": 0.017576067402157107, "val_psnr": 52.232547760009766, "val_psnr_std": 1.5396086246085752, "val_rmse": 0.0008351743454113603, "val_rmse_std": 0.000141661303007351, "val_ssim": 0.9981305003166199, "val_ssim_std": 0.0006359577501461546}, "model": "claude-opus-4-8-1m", "obs_path": "breast-ct-claude-agentic-itnet-v3-search-20260703-01/iterations/iter-0009/observation.json", "obs_sha1": "5086dc3b3c658295cabde557533da726de4c5aef", "params_M": 8.317706, "params_source": "observation", "rationale": "itnet_v3-claude-agentic: itnet_k=2, unet_c=24, alpha_init=0.0025734, lr=0.00035, epochs=5, batch_size=2, train_n=2400, val_n=200, grad_clip=1.0, max_train_s=1080, seed=42, rationale=iter-9 (breast-ct redo, search-20260703-01). START FROM iter-7 CHAMPION (c24/ep5/k2/lr2.16e-4, hr 0.8469). ONE KNOB: lr 0.00021567 -> 0.00035 (~1.6x higher learning rate). All else = iter-7 champion exactly (itnet_k=2, unet_c=24, alpha_init=0.0025734, epochs=5, batch_size=2, train_n=2400, val_n=200, grad_clip=1.0, seed=42). SIX-BOX (NUMBERS): (1) iter-6 (c24/ep4): 0.8385. iter-7 (c24/ep5): 0.8469=CHAMPION, SSIM 0.9983, PSNR 52.63, elapsed 939.5s=15.7min. iter-8 (c32/ep3): 0.8085 REGRESS -- capacity beyond c=24 is too under-trained at the epochs the wall allows, so c=24 is the capacity SWEET SPOT and the architecture axes (itnet_k=2 optimal per iter-4, unet_c=24 optimal per iter-6/7/8) are now BOUNDED. (2) FAILURE MODE: the remaining under-exploited lever is the TRAINING RECIPE. The c24/ep5 net is EPOCH-BUDGET-LIMITED (epochs still climbing at ep5 but the 20-min wall caps ~ep5-6 at c24). A HIGHER lr can reach a lower training loss in the SAME 5 epochs -> effectively buys convergence the epoch budget can't. lr has been fixed at the TPE-seed 2.16e-4 since iter-1 and never tuned on this redo split. (3) ONE KNOB: lr 2.16e-4 -> 3.5e-4 (~1.6x). c/k/epochs/train_n all held so any hr change isolates the lr effect. grad_clip=1.0 retained guards the higher lr against the occasional exploding-gradient step from the FBP adjoint in dc_step. (4) HYPOTHESIS: lr=3.5e-4 lifts hr above 0.8469 because the c24 net is epoch-budget-limited and a higher lr converges further within the fixed 5-epoch budget. FALSIFIER (NUMBERS): if hr <= 0.8469 at lr=3.5e-4, either the higher lr overshoots (unstable / worse) -> iter-10 tries a LOWER lr (1.5e-4) instead, or lr is already near-optimal -> iter-10 pivots to alpha_init (the DC step size). (5) BUDGET (HARD 20min=1200s): IDENTICAL config to iter-7 except the lr scalar (no compute change) -> elapsed ~= 939.5s = 15.7min < 1200s, same ~4min margin. max_train_s=1080 fences the TRAIN phase. train_n=2400 (<= OOM-safe cap). val=200 distinct val_truth.h5 cases, 256px inscribed-circle FOV (breast default). (6) do NOT return control mid-campaign; gate on iter-9 numeric-headroom obs via iter_wait.sh v3 then dispatch iter-10.", "run_id": "breast-ct-claude-agentic-itnet-v3-search-20260703-01", "runtime": {"elapsed_s": 1093.900800228119}, "schema_version": 3, "solver_key": "itnet-v3", "solver_name": "ITNet v3", "split": {"train_n": 400, "val_n": 200}, "status": "keep", "ts": "2026-07-04T23:28:57Z"}
{"advice_for_others": "itnet_v3-claude-agentic: itnet_k=2, unet_c=24, alpha_init=0.0025734, lr=0.00015, epochs=5, batch_size=2, train_n=2400, val_n=200, grad_clip=1.0, max_train_s=1100, seed=42, rationale=iter-10 (breast-ct redo, search-20260703-01). START FROM iter-7 CHAMPION (c24/ep5/lr2.16e-4, hr 0.8469). ONE KNOB: lr 0.00021567 -> 0.00015 (~0.7x, LOWER). All else = champion exactly (itnet_k=2, unet_c=24, alpha_init=0.0025734, epochs=5, batch_size=2, train_n=2400, val_n=200, grad_clip=1.0, seed=42). SIX-BOX (NUMBERS): (1) iter-7 (c24/ep5/lr2.16e-4): 0.8469=CHAMPION. iter-9 (c24/ep5/lr3.5e-4): 0.8398 -- HIGHER lr slightly REGRESSED (-0.007, overshoot). (2) FAILURE MODE: iter-9's falsifier fired (higher lr worse) -> probe the OTHER direction. The champion lr 2.16e-4 may be near-optimal or want slightly LOWER for a smoother descent that generalizes better on the 200-case val split. (3) ONE KNOB: lr 2.16e-4 -> 1.5e-4 (~0.7x). c/k/epochs/train_n held so any hr change isolates lr direction. (4) HYPOTHESIS: lr=1.5e-4 lifts hr above 0.8469 because a gentler lr avoids the mild overshoot seen at 3.5e-4 and finds a flatter minimum. FALSIFIER (NUMBERS): if hr <= 0.8469 at lr=1.5e-4, then lr 2.16e-4 is at the recipe optimum (both 1.5e-4 and 3.5e-4 are worse -> unimodal peak at the seed) -> iter-11 pivots to alpha_init (DC step size) as the last training-recipe lever. (5) BUDGET (HARD 20min=1200s): IDENTICAL config to iter-7 except the lr scalar (no compute change). iter-7=939.5s=15.7min; iter-9 (same config, diff lr) took 1093.9s=18.2min due to node variance -- both < 1200s. max_train_s=1100 fences the TRAIN phase so even on a slow node a finite val+figure land inside the 30-min sbatch wall. train_n=2400 (<= OOM-safe cap). val=200 distinct val_truth.h5 cases, 256px inscribed-circle FOV (breast default). (6) do NOT return control mid-campaign; gate on iter-10 numeric-headroom obs via iter_wait.sh v3 then dispatch iter-11.", "agent": "itnet_v3-claude-agentic", "campaign": "search-20260703-01", "cfg_full": {"alpha_init": 0.0025734, "batch_size": 2, "epochs": 5, "grad_clip": 1.0, "itnet_k": 2, "lr": 0.00015, "max_train_s": 1100, "rationale": "iter-10 (breast-ct redo, search-20260703-01). START FROM iter-7 CHAMPION (c24/ep5/lr2.16e-4, hr 0.8469). ONE KNOB: lr 0.00021567 -> 0.00015 (~0.7x, LOWER). All else = champion exactly (itnet_k=2, unet_c=24, alpha_init=0.0025734, epochs=5, batch_size=2, train_n=2400, val_n=200, grad_clip=1.0, seed=42). SIX-BOX (NUMBERS): (1) iter-7 (c24/ep5/lr2.16e-4): 0.8469=CHAMPION. iter-9 (c24/ep5/lr3.5e-4): 0.8398 -- HIGHER lr slightly REGRESSED (-0.007, overshoot). (2) FAILURE MODE: iter-9's falsifier fired (higher lr worse) -> probe the OTHER direction. The champion lr 2.16e-4 may be near-optimal or want slightly LOWER for a smoother descent that generalizes better on the 200-case val split. (3) ONE KNOB: lr 2.16e-4 -> 1.5e-4 (~0.7x). c/k/epochs/train_n held so any hr change isolates lr direction. (4) HYPOTHESIS: lr=1.5e-4 lifts hr above 0.8469 because a gentler lr avoids the mild overshoot seen at 3.5e-4 and finds a flatter minimum. FALSIFIER (NUMBERS): if hr <= 0.8469 at lr=1.5e-4, then lr 2.16e-4 is at the recipe optimum (both 1.5e-4 and 3.5e-4 are worse -> unimodal peak at the seed) -> iter-11 pivots to alpha_init (DC step size) as the last training-recipe lever. (5) BUDGET (HARD 20min=1200s): IDENTICAL config to iter-7 except the lr scalar (no compute change). iter-7=939.5s=15.7min; iter-9 (same config, diff lr) took 1093.9s=18.2min due to node variance -- both < 1200s. max_train_s=1100 fences the TRAIN phase so even on a slow node a finite val+figure land inside the 30-min sbatch wall. train_n=2400 (<= OOM-safe cap). val=200 distinct val_truth.h5 cases, 256px inscribed-circle FOV (breast default). (6) do NOT return control mid-campaign; gate on iter-10 numeric-headroom obs via iter_wait.sh v3 then dispatch iter-11.", "seed": 42, "train_n": 2400, "unet_c": 24, "val_n": 200}, "challenge": "breast_ct", "change_class": "architecture", "git_commit": "671da566", "images": {"comparison": "runs/breast-ct-claude-agentic-itnet-v3-search-20260703-01/iterations/iter-0010/comparison.png", "test_showcase": null, "valtest_showcase": null}, "iter": 10, "kept": true, "metrics": {"headroom": 0.8415407883786412, "headroom_std": 0.017820121552836812, "val_psnr": 52.32585144042969, "val_psnr_std": 1.5635369081955353, "val_rmse": 0.0008262512856163085, "val_rmse_std": 0.00014258715614078174, "val_ssim": 0.9980906248092651, "val_ssim_std": 0.0006393504956508228}, "model": "claude-opus-4-8-1m", "obs_path": "breast-ct-claude-agentic-itnet-v3-search-20260703-01/iterations/iter-0010/observation.json", "obs_sha1": "11a7d3d7c590e06779e6261e0ab69a525f222fee", "params_M": 8.317706, "params_source": "observation", "rationale": "itnet_v3-claude-agentic: itnet_k=2, unet_c=24, alpha_init=0.0025734, lr=0.00015, epochs=5, batch_size=2, train_n=2400, val_n=200, grad_clip=1.0, max_train_s=1100, seed=42, rationale=iter-10 (breast-ct redo, search-20260703-01). START FROM iter-7 CHAMPION (c24/ep5/lr2.16e-4, hr 0.8469). ONE KNOB: lr 0.00021567 -> 0.00015 (~0.7x, LOWER). All else = champion exactly (itnet_k=2, unet_c=24, alpha_init=0.0025734, epochs=5, batch_size=2, train_n=2400, val_n=200, grad_clip=1.0, seed=42). SIX-BOX (NUMBERS): (1) iter-7 (c24/ep5/lr2.16e-4): 0.8469=CHAMPION. iter-9 (c24/ep5/lr3.5e-4): 0.8398 -- HIGHER lr slightly REGRESSED (-0.007, overshoot). (2) FAILURE MODE: iter-9's falsifier fired (higher lr worse) -> probe the OTHER direction. The champion lr 2.16e-4 may be near-optimal or want slightly LOWER for a smoother descent that generalizes better on the 200-case val split. (3) ONE KNOB: lr 2.16e-4 -> 1.5e-4 (~0.7x). c/k/epochs/train_n held so any hr change isolates lr direction. (4) HYPOTHESIS: lr=1.5e-4 lifts hr above 0.8469 because a gentler lr avoids the mild overshoot seen at 3.5e-4 and finds a flatter minimum. FALSIFIER (NUMBERS): if hr <= 0.8469 at lr=1.5e-4, then lr 2.16e-4 is at the recipe optimum (both 1.5e-4 and 3.5e-4 are worse -> unimodal peak at the seed) -> iter-11 pivots to alpha_init (DC step size) as the last training-recipe lever. (5) BUDGET (HARD 20min=1200s): IDENTICAL config to iter-7 except the lr scalar (no compute change). iter-7=939.5s=15.7min; iter-9 (same config, diff lr) took 1093.9s=18.2min due to node variance -- both < 1200s. max_train_s=1100 fences the TRAIN phase so even on a slow node a finite val+figure land inside the 30-min sbatch wall. train_n=2400 (<= OOM-safe cap). val=200 distinct val_truth.h5 cases, 256px inscribed-circle FOV (breast default). (6) do NOT return control mid-campaign; gate on iter-10 numeric-headroom obs via iter_wait.sh v3 then dispatch iter-11.", "run_id": "breast-ct-claude-agentic-itnet-v3-search-20260703-01", "runtime": {"elapsed_s": 866.6718666553497}, "schema_version": 3, "solver_key": "itnet-v3", "solver_name": "ITNet v3", "split": {"train_n": 400, "val_n": 200}, "status": "keep", "ts": "2026-07-05T02:24:41Z"}
