{"advice_for_others": "fastdiff_wdm_wavelet_constrained-claude-agentic: val_n=200, seed=42, fd_recon_ckpt=/cluster/maier/Agent4CT/checkpoints/fast_diffusion_wavelet_breast.pt, fd_recon_steps=8, fd_recon_init=fbp, fd_recon_init_t=0.005, fd_recon_eta=1.0, fd_recon_dc=1, fd_recon_dc_n_cg=15, fd_recon_dc_relax=1.0, dataset_kind=breast_ct, rationale=iter-9 DC-STRENGTH (n_cg up) at near-prior-off init_t, breast-native wavelet CONSTRAINED, val=200. SIX-BOX: (1) PRIOR: init_t->0 asymptote pinned: init_t0.02->PSNR33.7, 0.05->28.9... 0.005->35.19dB/RMSE5.94e-3 (iter-8), converging to JUST UNDER baseline 36.32dB/RMSE5.21e-3. hr=0 throughout; the CG-DC-projected near-FBP is marginally WORSE than the plain Hann FBP. (2) FAILURE MODE: at n_cg=5 the CG least-squares solve of min||Ax-y||^2 on the 128-view system is UNDER-converged, leaving residual streaks -> RMSE just above the plain FBP. (3) ONE KNOB: fd_recon_dc_n_cg 5 -> 15 (stronger LSQ CG solve), init_t=0.005 fixed. (4) HYPOTHESIS: more CG iters drive the recon closer to the exact 128-view least-squares solution; IF that LSQ solution beats the plain Hann FBP, hr crosses 0. FALSIFIER: if RMSE stays >=baseline even at n_cg=15, the CG-DC/wavelet recon is genuinely FBP-bounded on sparse breast (the plain regularized-FBP baseline is at/above the unregularized LSQ solution) -> the wavelet prior + DC cannot clear it; conclude. (5) BUDGET: n_cg=15 ~2-3x CG cost, still well inside 20min at ~90s base. (6) iter-10 on landing.", "agent": "fastdiff_wdm_wavelet_constrained-claude-agentic", "campaign": "search-20260703-01", "cfg_full": {"dataset_kind": "breast_ct", "fd_recon_ckpt": "/cluster/maier/Agent4CT/checkpoints/fast_diffusion_wavelet_breast.pt", "fd_recon_dc": 1, "fd_recon_dc_n_cg": 15, "fd_recon_dc_relax": 1.0, "fd_recon_eta": 1.0, "fd_recon_init": "fbp", "fd_recon_init_t": 0.005, "fd_recon_steps": 8, "rationale": "iter-9 DC-STRENGTH (n_cg up) at near-prior-off init_t, breast-native wavelet CONSTRAINED, val=200. SIX-BOX: (1) PRIOR: init_t->0 asymptote pinned: init_t0.02->PSNR33.7, 0.05->28.9... 0.005->35.19dB/RMSE5.94e-3 (iter-8), converging to JUST UNDER baseline 36.32dB/RMSE5.21e-3. hr=0 throughout; the CG-DC-projected near-FBP is marginally WORSE than the plain Hann FBP. (2) FAILURE MODE: at n_cg=5 the CG least-squares solve of min||Ax-y||^2 on the 128-view system is UNDER-converged, leaving residual streaks -> RMSE just above the plain FBP. (3) ONE KNOB: fd_recon_dc_n_cg 5 -> 15 (stronger LSQ CG solve), init_t=0.005 fixed. (4) HYPOTHESIS: more CG iters drive the recon closer to the exact 128-view least-squares solution; IF that LSQ solution beats the plain Hann FBP, hr crosses 0. FALSIFIER: if RMSE stays >=baseline even at n_cg=15, the CG-DC/wavelet recon is genuinely FBP-bounded on sparse breast (the plain regularized-FBP baseline is at/above the unregularized LSQ solution) -> the wavelet prior + DC cannot clear it; conclude. (5) BUDGET: n_cg=15 ~2-3x CG cost, still well inside 20min at ~90s base. (6) iter-10 on landing.", "seed": 42, "val_n": 200}, "challenge": "breast_ct", "change_class": "architecture", "git_commit": "671da566", "images": {"comparison": "runs/breast-ct-claude-agentic-fastdiff-wdm-wavelet-constrained-search-20260703-01/iterations/iter-0009/comparison.png", "test_showcase": null, "valtest_showcase": null}, "iter": 9, "kept": true, "metrics": {"headroom": 0.06947602738410918, "headroom_std": 0.04760874554342132, "val_psnr": 36.94964599609375, "val_psnr_std": 0.18382638675261667, "val_rmse": 0.004852015990763903, "val_rmse_std": 5.890898124514137e-05, "val_ssim": 0.88271564245224, "val_ssim_std": 0.00476488410821148}, "model": "claude-opus-4-8-1m", "obs_path": "breast-ct-claude-agentic-fastdiff-wdm-wavelet-constrained-search-20260703-01/iterations/iter-0009/observation.json", "obs_sha1": "ac41644fdf1d894348277e8d00a19f3471817b01", "params_M": 3.824908, "params_source": "observation", "rationale": "fastdiff_wdm_wavelet_constrained-claude-agentic: val_n=200, seed=42, fd_recon_ckpt=/cluster/maier/Agent4CT/checkpoints/fast_diffusion_wavelet_breast.pt, fd_recon_steps=8, fd_recon_init=fbp, fd_recon_init_t=0.005, fd_recon_eta=1.0, fd_recon_dc=1, fd_recon_dc_n_cg=15, fd_recon_dc_relax=1.0, dataset_kind=breast_ct, rationale=iter-9 DC-STRENGTH (n_cg up) at near-prior-off init_t, breast-native wavelet CONSTRAINED, val=200. SIX-BOX: (1) PRIOR: init_t->0 asymptote pinned: init_t0.02->PSNR33.7, 0.05->28.9... 0.005->35.19dB/RMSE5.94e-3 (iter-8), converging to JUST UNDER baseline 36.32dB/RMSE5.21e-3. hr=0 throughout; the CG-DC-projected near-FBP is marginally WORSE than the plain Hann FBP. (2) FAILURE MODE: at n_cg=5 the CG least-squares solve of min||Ax-y||^2 on the 128-view system is UNDER-converged, leaving residual streaks -> RMSE just above the plain FBP. (3) ONE KNOB: fd_recon_dc_n_cg 5 -> 15 (stronger LSQ CG solve), init_t=0.005 fixed. (4) HYPOTHESIS: more CG iters drive the recon closer to the exact 128-view least-squares solution; IF that LSQ solution beats the plain Hann FBP, hr crosses 0. FALSIFIER: if RMSE stays >=baseline even at n_cg=15, the CG-DC/wavelet recon is genuinely FBP-bounded on sparse breast (the plain regularized-FBP baseline is at/above the unregularized LSQ solution) -> the wavelet prior + DC cannot clear it; conclude. (5) BUDGET: n_cg=15 ~2-3x CG cost, still well inside 20min at ~90s base. (6) iter-10 on landing.", "run_id": "breast-ct-claude-agentic-fastdiff-wdm-wavelet-constrained-search-20260703-01", "runtime": {"elapsed_s": 270.8452732563019}, "schema_version": 3, "solver_key": "fastdiff-wdm-wavelet-constrained", "solver_name": "Fast-diffusion WDM (wavelet, constrained DC)", "split": {"train_n": 3600, "val_n": 200}, "status": "keep", "ts": "2026-07-06T21:32:52Z"}
{"advice_for_others": "fastdiff_wdm_wavelet_constrained-claude-agentic: val_n=200, seed=42, fd_recon_ckpt=/cluster/maier/Agent4CT/checkpoints/fast_diffusion_wavelet_breast.pt, fd_recon_steps=8, fd_recon_init=fbp, fd_recon_init_t=0.005, fd_recon_eta=1.0, fd_recon_dc=1, fd_recon_dc_n_cg=25, fd_recon_dc_relax=1.0, dataset_kind=breast_ct, rationale=iter-10 DC-STRENGTH (n_cg up further), breast-native wavelet CONSTRAINED, val=200. SIX-BOX: (1) PRIOR: BREAKTHROUGH iter-9 (init_t0.005/n_cg15) hr=0.0695 (PSNR 36.95/RMSE 4.85e-3) CLEARED baseline 36.32/5.21e-3 -- more CG iters crossed it (iter-8 n_cg5 was RMSE 5.94e-3, hr=0). Direction confirmed: low init_t (prior-light) + strong CG-DC. (2) FAILURE MODE at iter-8: under-converged CG (n_cg5) left the recon just below the FBP; n_cg15 converged enough to beat it. (3) ONE KNOB: fd_recon_dc_n_cg 15 -> 25 (drive CG closer to the exact 128-view LSQ solution). (4) HYPOTHESIS: more CG iters lower RMSE further (the LSQ solution beats the regularized FBP) -> hr rises above 0.0695. FALSIFIER: if hr plateaus/drops, the CG has converged and 128-view LSQ noise amplification caps the gain -> pivot to raising init_t slightly so the wavelet prior can regularize the LSQ noise (prior+DC synergy). (5) BUDGET: n_cg25 ~4x CG cost of base, still well inside 20min. (6) iter-11 on landing.", "agent": "fastdiff_wdm_wavelet_constrained-claude-agentic", "campaign": "search-20260703-01", "cfg_full": {"dataset_kind": "breast_ct", "fd_recon_ckpt": "/cluster/maier/Agent4CT/checkpoints/fast_diffusion_wavelet_breast.pt", "fd_recon_dc": 1, "fd_recon_dc_n_cg": 25, "fd_recon_dc_relax": 1.0, "fd_recon_eta": 1.0, "fd_recon_init": "fbp", "fd_recon_init_t": 0.005, "fd_recon_steps": 8, "rationale": "iter-10 DC-STRENGTH (n_cg up further), breast-native wavelet CONSTRAINED, val=200. SIX-BOX: (1) PRIOR: BREAKTHROUGH iter-9 (init_t0.005/n_cg15) hr=0.0695 (PSNR 36.95/RMSE 4.85e-3) CLEARED baseline 36.32/5.21e-3 -- more CG iters crossed it (iter-8 n_cg5 was RMSE 5.94e-3, hr=0). Direction confirmed: low init_t (prior-light) + strong CG-DC. (2) FAILURE MODE at iter-8: under-converged CG (n_cg5) left the recon just below the FBP; n_cg15 converged enough to beat it. (3) ONE KNOB: fd_recon_dc_n_cg 15 -> 25 (drive CG closer to the exact 128-view LSQ solution). (4) HYPOTHESIS: more CG iters lower RMSE further (the LSQ solution beats the regularized FBP) -> hr rises above 0.0695. FALSIFIER: if hr plateaus/drops, the CG has converged and 128-view LSQ noise amplification caps the gain -> pivot to raising init_t slightly so the wavelet prior can regularize the LSQ noise (prior+DC synergy). (5) BUDGET: n_cg25 ~4x CG cost of base, still well inside 20min. (6) iter-11 on landing.", "seed": 42, "val_n": 200}, "challenge": "breast_ct", "change_class": "architecture", "git_commit": "671da566", "images": {"comparison": "runs/breast-ct-claude-agentic-fastdiff-wdm-wavelet-constrained-search-20260703-01/iterations/iter-0010/comparison.png", "test_showcase": null, "valtest_showcase": null}, "iter": 10, "kept": true, "metrics": {"headroom": 0.04315661165988505, "headroom_std": 0.041030455097409935, "val_psnr": 36.70737838745117, "val_psnr_std": 0.18837764508525773, "val_rmse": 0.004989252891391516, "val_rmse_std": 7.057131694666326e-05, "val_ssim": 0.8707011342048645, "val_ssim_std": 0.004895160515367046}, "model": "claude-opus-4-8-1m", "obs_path": "breast-ct-claude-agentic-fastdiff-wdm-wavelet-constrained-search-20260703-01/iterations/iter-0010/observation.json", "obs_sha1": "7713861157809da3f2032a8afc95fcb05cb002d3", "params_M": 3.824908, "params_source": "observation", "rationale": "fastdiff_wdm_wavelet_constrained-claude-agentic: val_n=200, seed=42, fd_recon_ckpt=/cluster/maier/Agent4CT/checkpoints/fast_diffusion_wavelet_breast.pt, fd_recon_steps=8, fd_recon_init=fbp, fd_recon_init_t=0.005, fd_recon_eta=1.0, fd_recon_dc=1, fd_recon_dc_n_cg=25, fd_recon_dc_relax=1.0, dataset_kind=breast_ct, rationale=iter-10 DC-STRENGTH (n_cg up further), breast-native wavelet CONSTRAINED, val=200. SIX-BOX: (1) PRIOR: BREAKTHROUGH iter-9 (init_t0.005/n_cg15) hr=0.0695 (PSNR 36.95/RMSE 4.85e-3) CLEARED baseline 36.32/5.21e-3 -- more CG iters crossed it (iter-8 n_cg5 was RMSE 5.94e-3, hr=0). Direction confirmed: low init_t (prior-light) + strong CG-DC. (2) FAILURE MODE at iter-8: under-converged CG (n_cg5) left the recon just below the FBP; n_cg15 converged enough to beat it. (3) ONE KNOB: fd_recon_dc_n_cg 15 -> 25 (drive CG closer to the exact 128-view LSQ solution). (4) HYPOTHESIS: more CG iters lower RMSE further (the LSQ solution beats the regularized FBP) -> hr rises above 0.0695. FALSIFIER: if hr plateaus/drops, the CG has converged and 128-view LSQ noise amplification caps the gain -> pivot to raising init_t slightly so the wavelet prior can regularize the LSQ noise (prior+DC synergy). (5) BUDGET: n_cg25 ~4x CG cost of base, still well inside 20min. (6) iter-11 on landing.", "run_id": "breast-ct-claude-agentic-fastdiff-wdm-wavelet-constrained-search-20260703-01", "runtime": {"elapsed_s": 254.5937123298645}, "schema_version": 3, "solver_key": "fastdiff-wdm-wavelet-constrained", "solver_name": "Fast-diffusion WDM (wavelet, constrained DC)", "split": {"train_n": 3600, "val_n": 200}, "status": "keep", "ts": "2026-07-06T21:38:05Z"}
{"advice_for_others": "fastdiff_wdm_wavelet_constrained-claude-agentic: val_n=200, seed=42, fd_recon_ckpt=/cluster/maier/Agent4CT/checkpoints/fast_diffusion_wavelet_breast.pt, fd_recon_steps=8, fd_recon_init=fbp, fd_recon_init_t=0.02, fd_recon_eta=1.0, fd_recon_dc=1, fd_recon_dc_n_cg=15, fd_recon_dc_relax=1.0, dataset_kind=breast_ct, rationale=iter-11 PRIOR+DC SYNERGY: add prior back (init_t up) at the winning n_cg=15, breast-native wavelet CONSTRAINED, val=200. SIX-BOX: (1) PRIOR: n_cg sweep at init_t0.005: n_cg5->RMSE5.94e-3(hr0), n_cg15->4.85e-3(hr0.0695 BEST), n_cg25->4.99e-3(hr0.043). Interior n_cg optimum ~15; over-converged CG amplifies 128-view LSQ noise. (2) FAILURE MODE: at n_cg25 the CG solves the unregularized LSQ too exactly -> sparse-system noise re-enters. FIX per iter-10 falsifier: let the wavelet prior regularize that noise by embedding the FBP at a slightly higher flow-time. (3) ONE KNOB: fd_recon_init_t 0.005 -> 0.02 (re-introduce light wavelet-prior denoising), n_cg=15 fixed. (4) HYPOTHESIS: init_t=0.02 gives the wavelet prior enough influence to suppress the CG-DC LSQ streak-noise while DC still pins the data -> RMSE drops below iter-9 4.85e-3, hr>0.0695 (genuine prior+DC synergy, the whole point of the constrained wavelet variant). FALSIFIER: if RMSE rises (>4.85e-3), the prior at 0.02 injects more error than it removes -> the optimum is minimal-prior (init_t~0.005) and hr~0.07 is the ceiling; sweep init_t between 0.005-0.02 to localize. (5) BUDGET ~2min. (6) iter-12 on landing.", "agent": "fastdiff_wdm_wavelet_constrained-claude-agentic", "campaign": "search-20260703-01", "cfg_full": {"dataset_kind": "breast_ct", "fd_recon_ckpt": "/cluster/maier/Agent4CT/checkpoints/fast_diffusion_wavelet_breast.pt", "fd_recon_dc": 1, "fd_recon_dc_n_cg": 15, "fd_recon_dc_relax": 1.0, "fd_recon_eta": 1.0, "fd_recon_init": "fbp", "fd_recon_init_t": 0.02, "fd_recon_steps": 8, "rationale": "iter-11 PRIOR+DC SYNERGY: add prior back (init_t up) at the winning n_cg=15, breast-native wavelet CONSTRAINED, val=200. SIX-BOX: (1) PRIOR: n_cg sweep at init_t0.005: n_cg5->RMSE5.94e-3(hr0), n_cg15->4.85e-3(hr0.0695 BEST), n_cg25->4.99e-3(hr0.043). Interior n_cg optimum ~15; over-converged CG amplifies 128-view LSQ noise. (2) FAILURE MODE: at n_cg25 the CG solves the unregularized LSQ too exactly -> sparse-system noise re-enters. FIX per iter-10 falsifier: let the wavelet prior regularize that noise by embedding the FBP at a slightly higher flow-time. (3) ONE KNOB: fd_recon_init_t 0.005 -> 0.02 (re-introduce light wavelet-prior denoising), n_cg=15 fixed. (4) HYPOTHESIS: init_t=0.02 gives the wavelet prior enough influence to suppress the CG-DC LSQ streak-noise while DC still pins the data -> RMSE drops below iter-9 4.85e-3, hr>0.0695 (genuine prior+DC synergy, the whole point of the constrained wavelet variant). FALSIFIER: if RMSE rises (>4.85e-3), the prior at 0.02 injects more error than it removes -> the optimum is minimal-prior (init_t~0.005) and hr~0.07 is the ceiling; sweep init_t between 0.005-0.02 to localize. (5) BUDGET ~2min. (6) iter-12 on landing.", "seed": 42, "val_n": 200}, "challenge": "breast_ct", "change_class": "architecture", "git_commit": "671da566", "images": {"comparison": "runs/breast-ct-claude-agentic-fastdiff-wdm-wavelet-constrained-search-20260703-01/iterations/iter-0011/comparison.png", "test_showcase": null, "valtest_showcase": null}, "iter": 11, "kept": true, "metrics": {"headroom": 0.011863268066009569, "headroom_std": 0.02888569515836732, "val_psnr": 36.4278564453125, "val_psnr_std": 0.20598372708656326, "val_rmse": 0.005152425263077021, "val_rmse_std": 8.83424524497968e-05, "val_ssim": 0.8808329701423645, "val_ssim_std": 0.00428470221694147}, "model": "claude-opus-4-8-1m", "obs_path": "breast-ct-claude-agentic-fastdiff-wdm-wavelet-constrained-search-20260703-01/iterations/iter-0011/observation.json", "obs_sha1": "5114329b1682b5e91e4f58b7cbdb8e85fbc7b66b", "params_M": 3.824908, "params_source": "observation", "rationale": "fastdiff_wdm_wavelet_constrained-claude-agentic: val_n=200, seed=42, fd_recon_ckpt=/cluster/maier/Agent4CT/checkpoints/fast_diffusion_wavelet_breast.pt, fd_recon_steps=8, fd_recon_init=fbp, fd_recon_init_t=0.02, fd_recon_eta=1.0, fd_recon_dc=1, fd_recon_dc_n_cg=15, fd_recon_dc_relax=1.0, dataset_kind=breast_ct, rationale=iter-11 PRIOR+DC SYNERGY: add prior back (init_t up) at the winning n_cg=15, breast-native wavelet CONSTRAINED, val=200. SIX-BOX: (1) PRIOR: n_cg sweep at init_t0.005: n_cg5->RMSE5.94e-3(hr0), n_cg15->4.85e-3(hr0.0695 BEST), n_cg25->4.99e-3(hr0.043). Interior n_cg optimum ~15; over-converged CG amplifies 128-view LSQ noise. (2) FAILURE MODE: at n_cg25 the CG solves the unregularized LSQ too exactly -> sparse-system noise re-enters. FIX per iter-10 falsifier: let the wavelet prior regularize that noise by embedding the FBP at a slightly higher flow-time. (3) ONE KNOB: fd_recon_init_t 0.005 -> 0.02 (re-introduce light wavelet-prior denoising), n_cg=15 fixed. (4) HYPOTHESIS: init_t=0.02 gives the wavelet prior enough influence to suppress the CG-DC LSQ streak-noise while DC still pins the data -> RMSE drops below iter-9 4.85e-3, hr>0.0695 (genuine prior+DC synergy, the whole point of the constrained wavelet variant). FALSIFIER: if RMSE rises (>4.85e-3), the prior at 0.02 injects more error than it removes -> the optimum is minimal-prior (init_t~0.005) and hr~0.07 is the ceiling; sweep init_t between 0.005-0.02 to localize. (5) BUDGET ~2min. (6) iter-12 on landing.", "run_id": "breast-ct-claude-agentic-fastdiff-wdm-wavelet-constrained-search-20260703-01", "runtime": {"elapsed_s": 182.9882528781891}, "schema_version": 3, "solver_key": "fastdiff-wdm-wavelet-constrained", "solver_name": "Fast-diffusion WDM (wavelet, constrained DC)", "split": {"train_n": 3600, "val_n": 200}, "status": "keep", "ts": "2026-07-06T21:41:52Z"}
{"advice_for_others": "fastdiff_wdm_wavelet_constrained-claude-agentic: val_n=200, seed=42, fd_recon_ckpt=/cluster/maier/Agent4CT/checkpoints/fast_diffusion_wavelet_breast.pt, fd_recon_steps=8, fd_recon_init=fbp, fd_recon_init_t=0.005, fd_recon_eta=1.0, fd_recon_dc=1, fd_recon_dc_n_cg=20, fd_recon_dc_relax=1.0, dataset_kind=breast_ct, rationale=iter-12 n_cg localize (15 vs 20 vs 25), breast-native wavelet CONSTRAINED, val=200. SIX-BOX: (1) PRIOR: at init_t0.005 the n_cg optimum is interior: n_cg5->hr0(RMSE5.94e-3), n_cg15->hr0.0695(4.85e-3 BEST), n_cg25->hr0.043(4.99e-3). Adding prior (init_t0.02,iter-11) hurt (hr0.012). So minimal-prior + n_cg~15 is the ridge. (2) FAILURE MODE: n_cg25 over-converged (LSQ noise); n_cg5 under-converged. (3) ONE KNOB: fd_recon_dc_n_cg 15 -> 20 (sample between the 15-peak and 25-decline to see if the optimum is >15). (4) HYPOTHESIS: n_cg=20 lands between hr0.0695 and hr0.043 (a smooth interior peak near 15-18); if it beats 0.0695 the true optimum is ~18-20, else 15 is optimal. (5) BUDGET ~3min. (6) iter-13 on landing.", "agent": "fastdiff_wdm_wavelet_constrained-claude-agentic", "campaign": "search-20260703-01", "cfg_full": {"dataset_kind": "breast_ct", "fd_recon_ckpt": "/cluster/maier/Agent4CT/checkpoints/fast_diffusion_wavelet_breast.pt", "fd_recon_dc": 1, "fd_recon_dc_n_cg": 20, "fd_recon_dc_relax": 1.0, "fd_recon_eta": 1.0, "fd_recon_init": "fbp", "fd_recon_init_t": 0.005, "fd_recon_steps": 8, "rationale": "iter-12 n_cg localize (15 vs 20 vs 25), breast-native wavelet CONSTRAINED, val=200. SIX-BOX: (1) PRIOR: at init_t0.005 the n_cg optimum is interior: n_cg5->hr0(RMSE5.94e-3), n_cg15->hr0.0695(4.85e-3 BEST), n_cg25->hr0.043(4.99e-3). Adding prior (init_t0.02,iter-11) hurt (hr0.012). So minimal-prior + n_cg~15 is the ridge. (2) FAILURE MODE: n_cg25 over-converged (LSQ noise); n_cg5 under-converged. (3) ONE KNOB: fd_recon_dc_n_cg 15 -> 20 (sample between the 15-peak and 25-decline to see if the optimum is >15). (4) HYPOTHESIS: n_cg=20 lands between hr0.0695 and hr0.043 (a smooth interior peak near 15-18); if it beats 0.0695 the true optimum is ~18-20, else 15 is optimal. (5) BUDGET ~3min. (6) iter-13 on landing.", "seed": 42, "val_n": 200}, "challenge": "breast_ct", "change_class": "architecture", "git_commit": "671da566", "images": {"comparison": "runs/breast-ct-claude-agentic-fastdiff-wdm-wavelet-constrained-search-20260703-01/iterations/iter-0012/comparison.png", "test_showcase": null, "valtest_showcase": null}, "iter": 12, "kept": true, "metrics": {"headroom": 0.07596930017702919, "headroom_std": 0.04783837152757185, "val_psnr": 37.010467529296875, "val_psnr_std": 0.18471813134483248, "val_rmse": 0.004818158224225044, "val_rmse_std": 6.199170387673962e-05, "val_ssim": 0.8799880743026733, "val_ssim_std": 0.00485497150958447}, "model": "claude-opus-4-8-1m", "obs_path": "breast-ct-claude-agentic-fastdiff-wdm-wavelet-constrained-search-20260703-01/iterations/iter-0012/observation.json", "obs_sha1": "2fb912a55f7bd540946ac1821403710702cd07df", "params_M": 3.824908, "params_source": "observation", "rationale": "fastdiff_wdm_wavelet_constrained-claude-agentic: val_n=200, seed=42, fd_recon_ckpt=/cluster/maier/Agent4CT/checkpoints/fast_diffusion_wavelet_breast.pt, fd_recon_steps=8, fd_recon_init=fbp, fd_recon_init_t=0.005, fd_recon_eta=1.0, fd_recon_dc=1, fd_recon_dc_n_cg=20, fd_recon_dc_relax=1.0, dataset_kind=breast_ct, rationale=iter-12 n_cg localize (15 vs 20 vs 25), breast-native wavelet CONSTRAINED, val=200. SIX-BOX: (1) PRIOR: at init_t0.005 the n_cg optimum is interior: n_cg5->hr0(RMSE5.94e-3), n_cg15->hr0.0695(4.85e-3 BEST), n_cg25->hr0.043(4.99e-3). Adding prior (init_t0.02,iter-11) hurt (hr0.012). So minimal-prior + n_cg~15 is the ridge. (2) FAILURE MODE: n_cg25 over-converged (LSQ noise); n_cg5 under-converged. (3) ONE KNOB: fd_recon_dc_n_cg 15 -> 20 (sample between the 15-peak and 25-decline to see if the optimum is >15). (4) HYPOTHESIS: n_cg=20 lands between hr0.0695 and hr0.043 (a smooth interior peak near 15-18); if it beats 0.0695 the true optimum is ~18-20, else 15 is optimal. (5) BUDGET ~3min. (6) iter-13 on landing.", "run_id": "breast-ct-claude-agentic-fastdiff-wdm-wavelet-constrained-search-20260703-01", "runtime": {"elapsed_s": 233.5791153907776}, "schema_version": 3, "solver_key": "fastdiff-wdm-wavelet-constrained", "solver_name": "Fast-diffusion WDM (wavelet, constrained DC)", "split": {"train_n": 3600, "val_n": 200}, "status": "keep", "ts": "2026-07-06T21:46:42Z"}
