{"advice_for_others": "dual_domain_n2i-claude-agentic: warm_start=True, pretrain_epochs=3, pretrain_steps=0, n_iter=50, grad_clip=1.0, outer_wall_s=1400, per_scene_s=None, batch_size=1, lr=0.003, optimizer=adam, unet_c=16, train_n=400, val_n=200, seed=42, rationale=iter-7 SIX-BOX. (1) PRIOR: iter-6 hr=0.0, early-stop n_iter=50 (lr=3e-4) gave rmse=0.00628 (marginally best, still >> baseline 0.00521), ssim=0.942, 200/200. Stopping early froze a still-blurry recon -- the warm-started init is already over-smoothed. Iters 1-6 (budget, per-scene fit, capacity, warm-start, lr-down, early-stop) all hr=0. NOTE: the SIBLING solver dual_domain_bilateral_n2i (a DIFFERENT solver with a trainable bilateral post-filter) reached hr~0.20; that bilateral edge-preserving stage is exactly the structural element THIS plain-UNet N2I solver lacks -- documented as the likely reason for our ceiling, but out of scope to add (protocol fixes SOLVER=dual_domain_n2i). (2) FAILURE MODE: plain-UNet N2I regresses to the over-smoothed FBP-consistent mean; no edge-preserving prior to hold detail. (3) ONE KNOB: lr 3e-4 -> 3e-3 (keep n_iter=50, warm_start=True, c=16 -- identical to iter-6 except lr, an order-of-magnitude aggressive step). (4) HYPOTHESIS: a large step size with only 50 inner iters may jump the per-image fit into a sharper, higher-frequency basin the small-lr fits never reached, lowering rmse; if hr rises, the plateau was an optimization-basin artifact. Per the ceiling, more likely lr=3e-3 either destabilizes (grad_clip=1.0 catches it) or converges to the same over-smoothed solution (hr=0). (5) BUDGET: 50 inner steps/scene, fast; loop << 1400s wall; total ~13 min << 30-min wall. (6) Loop continues; iter-8 self-dispatched. Reserved levers: pretrain_epochs up (10), unet_c=8, n_iter mid (100), grad_clip off, seed change (variance check).", "agent": "dual_domain_n2i-claude-agentic", "campaign": "search-20260703-01", "cfg_full": {"batch_size": 1, "grad_clip": 1.0, "lr": 0.003, "n_iter": 50, "optimizer": "adam", "outer_wall_s": 1400, "per_scene_s": null, "pretrain_epochs": 3, "pretrain_steps": 0, "rationale": "iter-7 SIX-BOX. (1) PRIOR: iter-6 hr=0.0, early-stop n_iter=50 (lr=3e-4) gave rmse=0.00628 (marginally best, still >> baseline 0.00521), ssim=0.942, 200/200. Stopping early froze a still-blurry recon -- the warm-started init is already over-smoothed. Iters 1-6 (budget, per-scene fit, capacity, warm-start, lr-down, early-stop) all hr=0. NOTE: the SIBLING solver dual_domain_bilateral_n2i (a DIFFERENT solver with a trainable bilateral post-filter) reached hr~0.20; that bilateral edge-preserving stage is exactly the structural element THIS plain-UNet N2I solver lacks -- documented as the likely reason for our ceiling, but out of scope to add (protocol fixes SOLVER=dual_domain_n2i). (2) FAILURE MODE: plain-UNet N2I regresses to the over-smoothed FBP-consistent mean; no edge-preserving prior to hold detail. (3) ONE KNOB: lr 3e-4 -> 3e-3 (keep n_iter=50, warm_start=True, c=16 -- identical to iter-6 except lr, an order-of-magnitude aggressive step). (4) HYPOTHESIS: a large step size with only 50 inner iters may jump the per-image fit into a sharper, higher-frequency basin the small-lr fits never reached, lowering rmse; if hr rises, the plateau was an optimization-basin artifact. Per the ceiling, more likely lr=3e-3 either destabilizes (grad_clip=1.0 catches it) or converges to the same over-smoothed solution (hr=0). (5) BUDGET: 50 inner steps/scene, fast; loop << 1400s wall; total ~13 min << 30-min wall. (6) Loop continues; iter-8 self-dispatched. Reserved levers: pretrain_epochs up (10), unet_c=8, n_iter mid (100), grad_clip off, seed change (variance check).", "seed": 42, "train_n": 400, "unet_c": 16, "val_n": 200, "warm_start": true}, "challenge": "breast_ct", "change_class": "architecture", "git_commit": "671da566", "images": {"comparison": "runs/breast-ct-claude-agentic-dual-domain-n2i-search-20260703-01/iterations/iter-0007/comparison.png", "test_showcase": null, "valtest_showcase": null}, "iter": 7, "kept": false, "metrics": {"headroom": 0.0, "headroom_std": 0.0, "val_psnr": 34.31477355957031, "val_psnr_std": 0.9451803474954881, "val_rmse": 0.006571519188582897, "val_rmse_std": 0.000685973793685257, "val_ssim": 0.93094801902771, "val_ssim_std": 0.012117191096576314}, "model": "claude-opus-4-8-1m", "obs_path": "breast-ct-claude-agentic-dual-domain-n2i-search-20260703-01/iterations/iter-0007/observation.json", "obs_sha1": "ecf954f231f96719105b9766030476930cd5118d", "params_M": 0.465762, "params_source": "observation", "rationale": "dual_domain_n2i-claude-agentic: warm_start=True, pretrain_epochs=3, pretrain_steps=0, n_iter=50, grad_clip=1.0, outer_wall_s=1400, per_scene_s=None, batch_size=1, lr=0.003, optimizer=adam, unet_c=16, train_n=400, val_n=200, seed=42, rationale=iter-7 SIX-BOX. (1) PRIOR: iter-6 hr=0.0, early-stop n_iter=50 (lr=3e-4) gave rmse=0.00628 (marginally best, still >> baseline 0.00521), ssim=0.942, 200/200. Stopping early froze a still-blurry recon -- the warm-started init is already over-smoothed. Iters 1-6 (budget, per-scene fit, capacity, warm-start, lr-down, early-stop) all hr=0. NOTE: the SIBLING solver dual_domain_bilateral_n2i (a DIFFERENT solver with a trainable bilateral post-filter) reached hr~0.20; that bilateral edge-preserving stage is exactly the structural element THIS plain-UNet N2I solver lacks -- documented as the likely reason for our ceiling, but out of scope to add (protocol fixes SOLVER=dual_domain_n2i). (2) FAILURE MODE: plain-UNet N2I regresses to the over-smoothed FBP-consistent mean; no edge-preserving prior to hold detail. (3) ONE KNOB: lr 3e-4 -> 3e-3 (keep n_iter=50, warm_start=True, c=16 -- identical to iter-6 except lr, an order-of-magnitude aggressive step). (4) HYPOTHESIS: a large step size with only 50 inner iters may jump the per-image fit into a sharper, higher-frequency basin the small-lr fits never reached, lowering rmse; if hr rises, the plateau was an optimization-basin artifact. Per the ceiling, more likely lr=3e-3 either destabilizes (grad_clip=1.0 catches it) or converges to the same over-smoothed solution (hr=0). (5) BUDGET: 50 inner steps/scene, fast; loop << 1400s wall; total ~13 min << 30-min wall. (6) Loop continues; iter-8 self-dispatched. Reserved levers: pretrain_epochs up (10), unet_c=8, n_iter mid (100), grad_clip off, seed change (variance check).", "run_id": "breast-ct-claude-agentic-dual-domain-n2i-search-20260703-01", "runtime": {"elapsed_s": 1348.5001361370087}, "schema_version": 3, "solver_key": "dual-domain-n2i", "solver_name": "DD-UNet N2I (per-image)", "split": {"train_n": 400, "val_n": 200}, "status": "discard", "ts": "2026-07-05T23:36:25Z"}
{"advice_for_others": "dual_domain_n2i-claude-agentic: warm_start=True, pretrain_epochs=10, pretrain_steps=0, n_iter=50, grad_clip=1.0, outer_wall_s=1400, per_scene_s=None, batch_size=1, lr=0.0003, optimizer=adam, unet_c=16, train_n=400, val_n=200, seed=42, rationale=iter-8 SIX-BOX. (1) PRIOR: iter-7 hr=0.0, aggressive lr=3e-3 (n_iter=50) gave rmse=0.00657 (WORST of the run), ssim=0.931 -- the big step destabilized/over-smoothed. Best config remains iter-6: lr=3e-4, n_iter=50, rmse=0.00628. (2) FAILURE MODE: plain-UNet N2I regresses to the over-smoothed FBP mean; large lr worsens it. (3) ONE KNOB: relative to the BEST reference config (iter-6: warm_start=True, lr=3e-4, n_iter=50, pretrain_epochs=3), change ONLY pretrain_epochs 3 -> 10 (revert lr to iter-6's 3e-4). A stronger amortised warm-start = a better generic init for the 50-step per-image fits. (4) HYPOTHESIS: 10 warm-start epochs on the 400-scene train split give the denoisers a stronger, more detail-aware initialization, so the short 50-step per-image fit starts from a sharper point and lands at lower rmse. If hr rises, the warm-start init quality was the lever. Per the documented ceiling, more likely the amortised N2I warm-start ALSO converges to an over-smoothed mean (same GT-free FBP target), so a stronger warm-start just entrenches the blur (hr=0). (5) BUDGET: pretrain ep=10 (~430s) + 200*50-step fast fits (~400s) + figure ~= 15 min < 30-min wall. (6) Loop continues; iter-9 self-dispatched. Reserved levers: unet_c=8 (smaller), n_iter=100 mid, grad_clip off, seed variance check, pretrain_steps cap.", "agent": "dual_domain_n2i-claude-agentic", "campaign": "search-20260703-01", "cfg_full": {"batch_size": 1, "grad_clip": 1.0, "lr": 0.0003, "n_iter": 50, "optimizer": "adam", "outer_wall_s": 1400, "per_scene_s": null, "pretrain_epochs": 10, "pretrain_steps": 0, "rationale": "iter-8 SIX-BOX. (1) PRIOR: iter-7 hr=0.0, aggressive lr=3e-3 (n_iter=50) gave rmse=0.00657 (WORST of the run), ssim=0.931 -- the big step destabilized/over-smoothed. Best config remains iter-6: lr=3e-4, n_iter=50, rmse=0.00628. (2) FAILURE MODE: plain-UNet N2I regresses to the over-smoothed FBP mean; large lr worsens it. (3) ONE KNOB: relative to the BEST reference config (iter-6: warm_start=True, lr=3e-4, n_iter=50, pretrain_epochs=3), change ONLY pretrain_epochs 3 -> 10 (revert lr to iter-6's 3e-4). A stronger amortised warm-start = a better generic init for the 50-step per-image fits. (4) HYPOTHESIS: 10 warm-start epochs on the 400-scene train split give the denoisers a stronger, more detail-aware initialization, so the short 50-step per-image fit starts from a sharper point and lands at lower rmse. If hr rises, the warm-start init quality was the lever. Per the documented ceiling, more likely the amortised N2I warm-start ALSO converges to an over-smoothed mean (same GT-free FBP target), so a stronger warm-start just entrenches the blur (hr=0). (5) BUDGET: pretrain ep=10 (~430s) + 200*50-step fast fits (~400s) + figure ~= 15 min < 30-min wall. (6) Loop continues; iter-9 self-dispatched. Reserved levers: unet_c=8 (smaller), n_iter=100 mid, grad_clip off, seed variance check, pretrain_steps cap.", "seed": 42, "train_n": 400, "unet_c": 16, "val_n": 200, "warm_start": true}, "challenge": "breast_ct", "change_class": "architecture", "git_commit": "671da566", "images": {"comparison": "runs/breast-ct-claude-agentic-dual-domain-n2i-search-20260703-01/iterations/iter-0008/comparison.png", "test_showcase": null, "valtest_showcase": null}, "iter": 8, "kept": false, "metrics": {"headroom": 0.0, "headroom_std": 0.0, "val_psnr": 34.59112548828125, "val_psnr_std": 0.8868908727076625, "val_rmse": 0.006365731358528137, "val_rmse_std": 0.0006279061114307785, "val_ssim": 0.9379792809486389, "val_ssim_std": 0.01044838888550924}, "model": "claude-opus-4-8-1m", "obs_path": "breast-ct-claude-agentic-dual-domain-n2i-search-20260703-01/iterations/iter-0008/observation.json", "obs_sha1": "7e1c35744b2af20fc33483854ff5c28d4730319f", "params_M": 0.465762, "params_source": "observation", "rationale": "dual_domain_n2i-claude-agentic: warm_start=True, pretrain_epochs=10, pretrain_steps=0, n_iter=50, grad_clip=1.0, outer_wall_s=1400, per_scene_s=None, batch_size=1, lr=0.0003, optimizer=adam, unet_c=16, train_n=400, val_n=200, seed=42, rationale=iter-8 SIX-BOX. (1) PRIOR: iter-7 hr=0.0, aggressive lr=3e-3 (n_iter=50) gave rmse=0.00657 (WORST of the run), ssim=0.931 -- the big step destabilized/over-smoothed. Best config remains iter-6: lr=3e-4, n_iter=50, rmse=0.00628. (2) FAILURE MODE: plain-UNet N2I regresses to the over-smoothed FBP mean; large lr worsens it. (3) ONE KNOB: relative to the BEST reference config (iter-6: warm_start=True, lr=3e-4, n_iter=50, pretrain_epochs=3), change ONLY pretrain_epochs 3 -> 10 (revert lr to iter-6's 3e-4). A stronger amortised warm-start = a better generic init for the 50-step per-image fits. (4) HYPOTHESIS: 10 warm-start epochs on the 400-scene train split give the denoisers a stronger, more detail-aware initialization, so the short 50-step per-image fit starts from a sharper point and lands at lower rmse. If hr rises, the warm-start init quality was the lever. Per the documented ceiling, more likely the amortised N2I warm-start ALSO converges to an over-smoothed mean (same GT-free FBP target), so a stronger warm-start just entrenches the blur (hr=0). (5) BUDGET: pretrain ep=10 (~430s) + 200*50-step fast fits (~400s) + figure ~= 15 min < 30-min wall. (6) Loop continues; iter-9 self-dispatched. Reserved levers: unet_c=8 (smaller), n_iter=100 mid, grad_clip off, seed variance check, pretrain_steps cap.", "run_id": "breast-ct-claude-agentic-dual-domain-n2i-search-20260703-01", "runtime": {"elapsed_s": 1238.6711466312408}, "schema_version": 3, "solver_key": "dual-domain-n2i", "solver_name": "DD-UNet N2I (per-image)", "split": {"train_n": 400, "val_n": 200}, "status": "discard", "ts": "2026-07-06T00:34:16Z"}
{"advice_for_others": "dual_domain_n2i-claude-agentic: warm_start=True, pretrain_epochs=3, pretrain_steps=0, n_iter=50, grad_clip=1.0, outer_wall_s=1400, per_scene_s=None, batch_size=1, lr=0.0003, optimizer=adam, unet_c=8, train_n=400, val_n=200, seed=42, rationale=iter-9 SIX-BOX. (1) PRIOR: iter-8 hr=0.0, stronger warm-start pretrain_epochs=10 gave rmse=0.00637, ssim=0.938 -- no better than ep=3; the amortised warm-start is ALSO over-smoothed, so entrenching it doesn't help. Best remains iter-6 (lr=3e-4, n_iter=50, c=16, ep=3, rmse=0.00628). Iters 1-8 all hr=0. (2) FAILURE MODE: plain-UNet N2I regresses to the over-smoothed FBP mean regardless of budget/capacity-up/warm-start strength/lr. (3) ONE KNOB: relative to iter-6 best reference, unet_c 16 -> 8 (both denoisers; ~0.12M params). iter-3 already tested c=32 (up); this tests c=8 (DOWN) to complete the capacity sweep. (4) HYPOTHESIS: a smaller-capacity denoiser has LESS ability to regress toward the smooth low-frequency mean, so it may leave more high-frequency structure intact and lower rmse; if hr rises, the denoiser was over-parameterized for the blur. Per the ceiling, more likely c=8 is simply a weaker denoiser that still cannot beat the FBP target and may even raise rmse (hr=0). Together with iter-3 (c=32) this brackets capacity: if BOTH c=8 and c=32 give hr=0, capacity is conclusively NOT the lever. (5) BUDGET: c=8 fast; pretrain ep=3 + 200*50-step fits + figure ~= 12 min << 30-min wall. (6) Loop continues; iter-10 self-dispatched. Reserved levers: n_iter=100 mid, grad_clip off, seed variance check, pretrain_steps cap, lr=1e-4 very gentle.", "agent": "dual_domain_n2i-claude-agentic", "campaign": "search-20260703-01", "cfg_full": {"batch_size": 1, "grad_clip": 1.0, "lr": 0.0003, "n_iter": 50, "optimizer": "adam", "outer_wall_s": 1400, "per_scene_s": null, "pretrain_epochs": 3, "pretrain_steps": 0, "rationale": "iter-9 SIX-BOX. (1) PRIOR: iter-8 hr=0.0, stronger warm-start pretrain_epochs=10 gave rmse=0.00637, ssim=0.938 -- no better than ep=3; the amortised warm-start is ALSO over-smoothed, so entrenching it doesn't help. Best remains iter-6 (lr=3e-4, n_iter=50, c=16, ep=3, rmse=0.00628). Iters 1-8 all hr=0. (2) FAILURE MODE: plain-UNet N2I regresses to the over-smoothed FBP mean regardless of budget/capacity-up/warm-start strength/lr. (3) ONE KNOB: relative to iter-6 best reference, unet_c 16 -> 8 (both denoisers; ~0.12M params). iter-3 already tested c=32 (up); this tests c=8 (DOWN) to complete the capacity sweep. (4) HYPOTHESIS: a smaller-capacity denoiser has LESS ability to regress toward the smooth low-frequency mean, so it may leave more high-frequency structure intact and lower rmse; if hr rises, the denoiser was over-parameterized for the blur. Per the ceiling, more likely c=8 is simply a weaker denoiser that still cannot beat the FBP target and may even raise rmse (hr=0). Together with iter-3 (c=32) this brackets capacity: if BOTH c=8 and c=32 give hr=0, capacity is conclusively NOT the lever. (5) BUDGET: c=8 fast; pretrain ep=3 + 200*50-step fits + figure ~= 12 min << 30-min wall. (6) Loop continues; iter-10 self-dispatched. Reserved levers: n_iter=100 mid, grad_clip off, seed variance check, pretrain_steps cap, lr=1e-4 very gentle.", "seed": 42, "train_n": 400, "unet_c": 8, "val_n": 200, "warm_start": true}, "challenge": "breast_ct", "change_class": "architecture", "git_commit": "671da566", "images": {"comparison": "runs/breast-ct-claude-agentic-dual-domain-n2i-search-20260703-01/iterations/iter-0009/comparison.png", "test_showcase": null, "valtest_showcase": null}, "iter": 9, "kept": false, "metrics": {"headroom": 0.0, "headroom_std": 0.0, "val_psnr": 34.70185089111328, "val_psnr_std": 0.9584785809427567, "val_rmse": 0.006285094190388918, "val_rmse_std": 0.0006658434031656514, "val_ssim": 0.9451594352722168, "val_ssim_std": 0.011206732952072912}, "model": "claude-opus-4-8-1m", "obs_path": "breast-ct-claude-agentic-dual-domain-n2i-search-20260703-01/iterations/iter-0009/observation.json", "obs_sha1": "c7e1c3049f0571bf6afa05c01c8be1b6eaf8afa4", "params_M": 0.117298, "params_source": "observation", "rationale": "dual_domain_n2i-claude-agentic: warm_start=True, pretrain_epochs=3, pretrain_steps=0, n_iter=50, grad_clip=1.0, outer_wall_s=1400, per_scene_s=None, batch_size=1, lr=0.0003, optimizer=adam, unet_c=8, train_n=400, val_n=200, seed=42, rationale=iter-9 SIX-BOX. (1) PRIOR: iter-8 hr=0.0, stronger warm-start pretrain_epochs=10 gave rmse=0.00637, ssim=0.938 -- no better than ep=3; the amortised warm-start is ALSO over-smoothed, so entrenching it doesn't help. Best remains iter-6 (lr=3e-4, n_iter=50, c=16, ep=3, rmse=0.00628). Iters 1-8 all hr=0. (2) FAILURE MODE: plain-UNet N2I regresses to the over-smoothed FBP mean regardless of budget/capacity-up/warm-start strength/lr. (3) ONE KNOB: relative to iter-6 best reference, unet_c 16 -> 8 (both denoisers; ~0.12M params). iter-3 already tested c=32 (up); this tests c=8 (DOWN) to complete the capacity sweep. (4) HYPOTHESIS: a smaller-capacity denoiser has LESS ability to regress toward the smooth low-frequency mean, so it may leave more high-frequency structure intact and lower rmse; if hr rises, the denoiser was over-parameterized for the blur. Per the ceiling, more likely c=8 is simply a weaker denoiser that still cannot beat the FBP target and may even raise rmse (hr=0). Together with iter-3 (c=32) this brackets capacity: if BOTH c=8 and c=32 give hr=0, capacity is conclusively NOT the lever. (5) BUDGET: c=8 fast; pretrain ep=3 + 200*50-step fits + figure ~= 12 min << 30-min wall. (6) Loop continues; iter-10 self-dispatched. Reserved levers: n_iter=100 mid, grad_clip off, seed variance check, pretrain_steps cap, lr=1e-4 very gentle.", "run_id": "breast-ct-claude-agentic-dual-domain-n2i-search-20260703-01", "runtime": {"elapsed_s": 850.8449213504791}, "schema_version": 3, "solver_key": "dual-domain-n2i", "solver_name": "DD-UNet N2I (per-image)", "split": {"train_n": 400, "val_n": 200}, "status": "discard", "ts": "2026-07-06T01:27:53Z"}
