{"advice_for_others": "learned_primal_dual-claude-agentic: lpd_iters=12, lpd_n_primal=5, lpd_n_dual=5, lpd_hidden=32, lpd_share_weights=False, epochs=10, lr=0.0012, lr_schedule=cosine, batch_size=1, grad_clip=1.0, lambda_neg=1.0, loss_base=l1, train_n=400, val_n=200, val_chunk=4, rationale=iter-12 one-knob: loss_base mse->l1 at the BEST config (iter-6: I12/h32/ep10/lr1.2e-3/cosine/gc1.0, hr=0.6685). FAILURE MODE: every optimizer/capacity/memory/data knob off iter-6 is exhausted (lr1.6e-3, gc0.5, hidden48, n_primal7, constant-lr, train_n500 -- all worse or collapsed). Untested = LOSS FORMULATION. HYPOTHESIS: if I switch the supervised recon loss mse->l1, expect hr to differ from 0.6685 -- L1 down-weights large residuals and typically reduces over-smoothing, which can lower RMSE and raise the RMSE-based headroom; distinct loss-landscape test. Time-neutral ~1800s (at wall).", "agent": "learned_primal_dual-claude-agentic", "campaign": "search-20260703-01", "cfg_full": {"batch_size": 1, "epochs": 10, "grad_clip": 1.0, "lambda_neg": 1.0, "loss_base": "l1", "lpd_hidden": 32, "lpd_iters": 12, "lpd_n_dual": 5, "lpd_n_primal": 5, "lpd_share_weights": false, "lr": 0.0012, "lr_schedule": "cosine", "rationale": "iter-12 one-knob: loss_base mse->l1 at the BEST config (iter-6: I12/h32/ep10/lr1.2e-3/cosine/gc1.0, hr=0.6685). FAILURE MODE: every optimizer/capacity/memory/data knob off iter-6 is exhausted (lr1.6e-3, gc0.5, hidden48, n_primal7, constant-lr, train_n500 -- all worse or collapsed). Untested = LOSS FORMULATION. HYPOTHESIS: if I switch the supervised recon loss mse->l1, expect hr to differ from 0.6685 -- L1 down-weights large residuals and typically reduces over-smoothing, which can lower RMSE and raise the RMSE-based headroom; distinct loss-landscape test. Time-neutral ~1800s (at wall).", "train_n": 400, "val_chunk": 4, "val_n": 200}, "challenge": "breast_ct", "change_class": "architecture", "git_commit": "671da566", "images": {"comparison": "runs/breast-ct-claude-agentic-learned-primal-dual-search-20260703-01/iterations/iter-0012/comparison.png", "test_showcase": null, "valtest_showcase": null}, "iter": 12, "kept": true, "metrics": {"headroom": 0.5144880741738244, "headroom_std": 0.028365127418586576, "val_psnr": 42.600196838378906, "val_psnr_std": 1.0069008092306921, "val_rmse": 0.002531596925109625, "val_rmse_std": 0.00029075675615271236, "val_ssim": 0.9885925054550171, "val_ssim_std": 0.00288317441033331}, "model": "claude-opus-4-8-1m", "obs_path": "breast-ct-claude-agentic-learned-primal-dual-search-20260703-01/iterations/iter-0012/observation.json", "obs_sha1": "094b0c6f653c521cbcf6ff7517e1683af7655de7", "params_M": 0.303864, "params_source": "observation", "rationale": "learned_primal_dual-claude-agentic: lpd_iters=12, lpd_n_primal=5, lpd_n_dual=5, lpd_hidden=32, lpd_share_weights=False, epochs=10, lr=0.0012, lr_schedule=cosine, batch_size=1, grad_clip=1.0, lambda_neg=1.0, loss_base=l1, train_n=400, val_n=200, val_chunk=4, rationale=iter-12 one-knob: loss_base mse->l1 at the BEST config (iter-6: I12/h32/ep10/lr1.2e-3/cosine/gc1.0, hr=0.6685). FAILURE MODE: every optimizer/capacity/memory/data knob off iter-6 is exhausted (lr1.6e-3, gc0.5, hidden48, n_primal7, constant-lr, train_n500 -- all worse or collapsed). Untested = LOSS FORMULATION. HYPOTHESIS: if I switch the supervised recon loss mse->l1, expect hr to differ from 0.6685 -- L1 down-weights large residuals and typically reduces over-smoothing, which can lower RMSE and raise the RMSE-based headroom; distinct loss-landscape test. Time-neutral ~1800s (at wall).", "run_id": "breast-ct-claude-agentic-learned-primal-dual-search-20260703-01", "runtime": {"elapsed_s": 1126.0645434856415}, "schema_version": 3, "solver_key": "learned-primal-dual", "solver_name": "Learned Primal-Dual", "split": {"train_n": 400, "val_n": 200}, "status": "keep", "ts": "2026-07-04T11:29:24Z"}
{"advice_for_others": "learned_primal_dual-claude-agentic: lpd_iters=12, lpd_n_primal=5, lpd_n_dual=5, lpd_hidden=32, lpd_share_weights=False, epochs=10, lr=0.0012, lr_schedule=cosine, batch_size=1, grad_clip=1.0, lambda_neg=1.0, loss_base=mse, train_n=400, val_n=200, val_chunk=4, seed=43, rationale=iter-13 one-knob: seed 42->43 on the CHAMPION config (iter-6: I12/h32/ep10/lr1.2e-3/cosine/gc1.0/mse, hr=0.6685). SEARCH CONVERGED: 8 distinct single-knob changes off iter-6 (lr up/down, gc0.5, hidden48, n_primal7, constant-lr, train_n500, l1-loss) were ALL worse or collapsed -> iter-6 is the budget-bound optimum (old champ 0.90 needed ~4000s, unreachable under 20 min). Remaining iters characterize the champion SEED SPREAD for the leaderboard/paper mean+/-std. HYPOTHESIS: hr lands within ~+/-0.01 of 0.6685 (config fixed; only train-subset sampling + init RNG change), starting the replicate set {42,43,44,45}. Time-neutral ~1800s.", "agent": "learned_primal_dual-claude-agentic", "campaign": "search-20260703-01", "cfg_full": {"batch_size": 1, "epochs": 10, "grad_clip": 1.0, "lambda_neg": 1.0, "loss_base": "mse", "lpd_hidden": 32, "lpd_iters": 12, "lpd_n_dual": 5, "lpd_n_primal": 5, "lpd_share_weights": false, "lr": 0.0012, "lr_schedule": "cosine", "rationale": "iter-13 one-knob: seed 42->43 on the CHAMPION config (iter-6: I12/h32/ep10/lr1.2e-3/cosine/gc1.0/mse, hr=0.6685). SEARCH CONVERGED: 8 distinct single-knob changes off iter-6 (lr up/down, gc0.5, hidden48, n_primal7, constant-lr, train_n500, l1-loss) were ALL worse or collapsed -> iter-6 is the budget-bound optimum (old champ 0.90 needed ~4000s, unreachable under 20 min). Remaining iters characterize the champion SEED SPREAD for the leaderboard/paper mean+/-std. HYPOTHESIS: hr lands within ~+/-0.01 of 0.6685 (config fixed; only train-subset sampling + init RNG change), starting the replicate set {42,43,44,45}. Time-neutral ~1800s.", "seed": 43, "train_n": 400, "val_chunk": 4, "val_n": 200}, "challenge": "breast_ct", "change_class": "architecture", "git_commit": "671da566", "images": {"comparison": "runs/breast-ct-claude-agentic-learned-primal-dual-search-20260703-01/iterations/iter-0013/comparison.png", "test_showcase": null, "valtest_showcase": null}, "iter": 13, "kept": true, "metrics": {"headroom": 0.4935594171209534, "headroom_std": 0.027021962688478778, "val_psnr": 42.23362350463867, "val_psnr_std": 0.9603524088621792, "val_rmse": 0.002640724880620837, "val_rmse_std": 0.000288934763931029, "val_ssim": 0.985295832157135, "val_ssim_std": 0.0033092662828750133}, "model": "claude-opus-4-8-1m", "obs_path": "breast-ct-claude-agentic-learned-primal-dual-search-20260703-01/iterations/iter-0013/observation.json", "obs_sha1": "ed3acef03367e3a848cbf83fdd730a163a44b4c4", "params_M": 0.303864, "params_source": "observation", "rationale": "learned_primal_dual-claude-agentic: lpd_iters=12, lpd_n_primal=5, lpd_n_dual=5, lpd_hidden=32, lpd_share_weights=False, epochs=10, lr=0.0012, lr_schedule=cosine, batch_size=1, grad_clip=1.0, lambda_neg=1.0, loss_base=mse, train_n=400, val_n=200, val_chunk=4, seed=43, rationale=iter-13 one-knob: seed 42->43 on the CHAMPION config (iter-6: I12/h32/ep10/lr1.2e-3/cosine/gc1.0/mse, hr=0.6685). SEARCH CONVERGED: 8 distinct single-knob changes off iter-6 (lr up/down, gc0.5, hidden48, n_primal7, constant-lr, train_n500, l1-loss) were ALL worse or collapsed -> iter-6 is the budget-bound optimum (old champ 0.90 needed ~4000s, unreachable under 20 min). Remaining iters characterize the champion SEED SPREAD for the leaderboard/paper mean+/-std. HYPOTHESIS: hr lands within ~+/-0.01 of 0.6685 (config fixed; only train-subset sampling + init RNG change), starting the replicate set {42,43,44,45}. Time-neutral ~1800s.", "run_id": "breast-ct-claude-agentic-learned-primal-dual-search-20260703-01", "runtime": {"elapsed_s": 1176.1913619041443}, "schema_version": 3, "solver_key": "learned-primal-dual", "solver_name": "Learned Primal-Dual", "split": {"train_n": 400, "val_n": 200}, "status": "keep", "ts": "2026-07-04T12:29:51Z"}
{"advice_for_others": "learned_primal_dual-claude-agentic: lpd_iters=12, lpd_n_primal=5, lpd_n_dual=5, lpd_hidden=32, lpd_share_weights=False, epochs=10, lr=0.0012, lr_schedule=cosine, batch_size=1, grad_clip=1.0, lambda_neg=1.0, loss_base=mse, train_n=400, val_n=200, val_chunk=4, seed=44, rationale=iter-14 one-knob: seed 43->44 on the champion config (I12/h32/ep10/lr1.2e-3/cosine/gc1.0/mse). FINDING from iter-13: the seed-42 champion (0.6685) is NOT seed-robust -- seed 43 gave 0.4936 (Delta~0.175). So the config is under-converged at the 20-min budget (400 samples x 10 ep) and hr has high run-to-run variance. HYPOTHESIS: seed 44 lands in [0.49,0.67]; this 3rd replicate {42:0.669, 43:0.494, 44:?} tightens an honest mean+/-std for the leaderboard/paper (the reported number must be the replicate mean, not the lucky seed-42 max). Time-neutral ~1800s.", "agent": "learned_primal_dual-claude-agentic", "campaign": "search-20260703-01", "cfg_full": {"batch_size": 1, "epochs": 10, "grad_clip": 1.0, "lambda_neg": 1.0, "loss_base": "mse", "lpd_hidden": 32, "lpd_iters": 12, "lpd_n_dual": 5, "lpd_n_primal": 5, "lpd_share_weights": false, "lr": 0.0012, "lr_schedule": "cosine", "rationale": "iter-14 one-knob: seed 43->44 on the champion config (I12/h32/ep10/lr1.2e-3/cosine/gc1.0/mse). FINDING from iter-13: the seed-42 champion (0.6685) is NOT seed-robust -- seed 43 gave 0.4936 (Delta~0.175). So the config is under-converged at the 20-min budget (400 samples x 10 ep) and hr has high run-to-run variance. HYPOTHESIS: seed 44 lands in [0.49,0.67]; this 3rd replicate {42:0.669, 43:0.494, 44:?} tightens an honest mean+/-std for the leaderboard/paper (the reported number must be the replicate mean, not the lucky seed-42 max). Time-neutral ~1800s.", "seed": 44, "train_n": 400, "val_chunk": 4, "val_n": 200}, "challenge": "breast_ct", "change_class": "architecture", "git_commit": "671da566", "images": {"comparison": "runs/breast-ct-claude-agentic-learned-primal-dual-search-20260703-01/iterations/iter-0014/comparison.png", "test_showcase": null, "valtest_showcase": null}, "iter": 14, "kept": true, "metrics": {"headroom": 0.6277943180447147, "headroom_std": 0.03584140656526419, "val_psnr": 44.908538818359375, "val_psnr_std": 1.2641585836862579, "val_rmse": 0.0019407860236242414, "val_rmse_std": 0.0002864511226682989, "val_ssim": 0.9925280809402466, "val_ssim_std": 0.002111796108344386}, "model": "claude-opus-4-8-1m", "obs_path": "breast-ct-claude-agentic-learned-primal-dual-search-20260703-01/iterations/iter-0014/observation.json", "obs_sha1": "8bc3ff76c3e4a51711f55847484543382fcd38f8", "params_M": 0.303864, "params_source": "observation", "rationale": "learned_primal_dual-claude-agentic: lpd_iters=12, lpd_n_primal=5, lpd_n_dual=5, lpd_hidden=32, lpd_share_weights=False, epochs=10, lr=0.0012, lr_schedule=cosine, batch_size=1, grad_clip=1.0, lambda_neg=1.0, loss_base=mse, train_n=400, val_n=200, val_chunk=4, seed=44, rationale=iter-14 one-knob: seed 43->44 on the champion config (I12/h32/ep10/lr1.2e-3/cosine/gc1.0/mse). FINDING from iter-13: the seed-42 champion (0.6685) is NOT seed-robust -- seed 43 gave 0.4936 (Delta~0.175). So the config is under-converged at the 20-min budget (400 samples x 10 ep) and hr has high run-to-run variance. HYPOTHESIS: seed 44 lands in [0.49,0.67]; this 3rd replicate {42:0.669, 43:0.494, 44:?} tightens an honest mean+/-std for the leaderboard/paper (the reported number must be the replicate mean, not the lucky seed-42 max). Time-neutral ~1800s.", "run_id": "breast-ct-claude-agentic-learned-primal-dual-search-20260703-01", "runtime": {"elapsed_s": 1395.0763666629791}, "schema_version": 3, "solver_key": "learned-primal-dual", "solver_name": "Learned Primal-Dual", "split": {"train_n": 400, "val_n": 200}, "status": "keep", "ts": "2026-07-04T14:32:57Z"}
{"advice_for_others": "learned_primal_dual-claude-agentic: lpd_iters=12, lpd_n_primal=5, lpd_n_dual=5, lpd_hidden=32, lpd_share_weights=False, epochs=10, lr=0.0012, lr_schedule=cosine, batch_size=1, grad_clip=1.0, lambda_neg=1.0, loss_base=mse, train_n=400, val_n=200, val_chunk=4, seed=45, rationale=iter-15 one-knob: seed 44->45 on the champion config (I12/h32/ep10/lr1.2e-3/cosine/gc1.0/mse). Replicates so far {42:0.6685, 43:0.4936, 44:0.6278} -> mean 0.597, std ~0.078 (seed-fragile, as flagged). HYPOTHESIS: seed 45 lands in [0.49,0.67], COMPLETING the 4-seed set {42,43,44,45} for the reported champion mean+/-std (the honest leaderboard number, not the seed-42 max). Time-neutral ~1800s.", "agent": "learned_primal_dual-claude-agentic", "campaign": "search-20260703-01", "cfg_full": {"batch_size": 1, "epochs": 10, "grad_clip": 1.0, "lambda_neg": 1.0, "loss_base": "mse", "lpd_hidden": 32, "lpd_iters": 12, "lpd_n_dual": 5, "lpd_n_primal": 5, "lpd_share_weights": false, "lr": 0.0012, "lr_schedule": "cosine", "rationale": "iter-15 one-knob: seed 44->45 on the champion config (I12/h32/ep10/lr1.2e-3/cosine/gc1.0/mse). Replicates so far {42:0.6685, 43:0.4936, 44:0.6278} -> mean 0.597, std ~0.078 (seed-fragile, as flagged). HYPOTHESIS: seed 45 lands in [0.49,0.67], COMPLETING the 4-seed set {42,43,44,45} for the reported champion mean+/-std (the honest leaderboard number, not the seed-42 max). Time-neutral ~1800s.", "seed": 45, "train_n": 400, "val_chunk": 4, "val_n": 200}, "challenge": "breast_ct", "change_class": "architecture", "git_commit": "671da566", "images": {"comparison": "runs/breast-ct-claude-agentic-learned-primal-dual-search-20260703-01/iterations/iter-0015/comparison.png", "test_showcase": null, "valtest_showcase": null}, "iter": 15, "kept": false, "metrics": {"headroom": 0.0, "headroom_std": 0.0, "val_psnr": 16.083568572998047, "val_psnr_std": 0.25276446237313005, "val_rmse": 0.053607549518346786, "val_rmse_std": 0.0012246924710566478, "val_ssim": 0.708482027053833, "val_ssim_std": 0.011206881451889378}, "model": "claude-opus-4-8-1m", "obs_path": "breast-ct-claude-agentic-learned-primal-dual-search-20260703-01/iterations/iter-0015/observation.json", "obs_sha1": "18057e87438f8092c71d63c74d033745d387f1c8", "params_M": 0.303864, "params_source": "observation", "rationale": "learned_primal_dual-claude-agentic: lpd_iters=12, lpd_n_primal=5, lpd_n_dual=5, lpd_hidden=32, lpd_share_weights=False, epochs=10, lr=0.0012, lr_schedule=cosine, batch_size=1, grad_clip=1.0, lambda_neg=1.0, loss_base=mse, train_n=400, val_n=200, val_chunk=4, seed=45, rationale=iter-15 one-knob: seed 44->45 on the champion config (I12/h32/ep10/lr1.2e-3/cosine/gc1.0/mse). Replicates so far {42:0.6685, 43:0.4936, 44:0.6278} -> mean 0.597, std ~0.078 (seed-fragile, as flagged). HYPOTHESIS: seed 45 lands in [0.49,0.67], COMPLETING the 4-seed set {42,43,44,45} for the reported champion mean+/-std (the honest leaderboard number, not the seed-42 max). Time-neutral ~1800s.", "run_id": "breast-ct-claude-agentic-learned-primal-dual-search-20260703-01", "runtime": {"elapsed_s": 1304.8453602790833}, "schema_version": 3, "solver_key": "learned-primal-dual", "solver_name": "Learned Primal-Dual", "split": {"train_n": 400, "val_n": 200}, "status": "discard", "ts": "2026-07-04T19:35:28Z"}
{"advice_for_others": "learned_primal_dual-claude-agentic: lpd_iters=12, lpd_n_primal=5, lpd_n_dual=5, lpd_hidden=32, lpd_share_weights=False, epochs=10, lr=0.0008, lr_schedule=cosine, batch_size=1, grad_clip=1.0, lambda_neg=1.0, loss_base=mse, train_n=400, val_n=200, val_chunk=4, seed=42, rationale=iter-16 one-knob: lr 1.2e-3->8e-4 at I=12 (seed 42, else champion). DECISIVE FINDING: the iter-6 champion (I12/lr1.2e-3) is UNSTABLE across seeds -- {42:0.669, 43:0.494, 44:0.628, 45:0.0} = mean 0.4475 +/- 0.2663, with a full collapse (hr=0) on seed 45. Cause: the large lr at depth I=12 amplifies gradient variance -> ~25% of seeds diverge. HYPOTHESIS: if I lower lr 1.2e-3->8e-4 at I=12, expect hr ~0.55-0.65 with NO collapse (all seeds stable), trading a little peak for reliability -- a defensible, reportable operating point. Seed 42 for direct compare to iter-6 (0.6685). Time-neutral ~1800s. If stable, iters 17-19 replicate THIS at seeds 43-45 for an honest stable mean+/-std.", "agent": "learned_primal_dual-claude-agentic", "campaign": "search-20260703-01", "cfg_full": {"batch_size": 1, "epochs": 10, "grad_clip": 1.0, "lambda_neg": 1.0, "loss_base": "mse", "lpd_hidden": 32, "lpd_iters": 12, "lpd_n_dual": 5, "lpd_n_primal": 5, "lpd_share_weights": false, "lr": 0.0008, "lr_schedule": "cosine", "rationale": "iter-16 one-knob: lr 1.2e-3->8e-4 at I=12 (seed 42, else champion). DECISIVE FINDING: the iter-6 champion (I12/lr1.2e-3) is UNSTABLE across seeds -- {42:0.669, 43:0.494, 44:0.628, 45:0.0} = mean 0.4475 +/- 0.2663, with a full collapse (hr=0) on seed 45. Cause: the large lr at depth I=12 amplifies gradient variance -> ~25% of seeds diverge. HYPOTHESIS: if I lower lr 1.2e-3->8e-4 at I=12, expect hr ~0.55-0.65 with NO collapse (all seeds stable), trading a little peak for reliability -- a defensible, reportable operating point. Seed 42 for direct compare to iter-6 (0.6685). Time-neutral ~1800s. If stable, iters 17-19 replicate THIS at seeds 43-45 for an honest stable mean+/-std.", "seed": 42, "train_n": 400, "val_chunk": 4, "val_n": 200}, "challenge": "breast_ct", "change_class": "architecture", "git_commit": "671da566", "images": {"comparison": "runs/breast-ct-claude-agentic-learned-primal-dual-search-20260703-01/iterations/iter-0016/comparison.png", "test_showcase": null, "valtest_showcase": null}, "iter": 16, "kept": true, "metrics": {"headroom": 0.6791025952104511, "headroom_std": 0.017737714211971265, "val_psnr": 46.196876525878906, "val_psnr_std": 0.9877945864529508, "val_rmse": 0.0016732501098886132, "val_rmse_std": 0.0001903652835549427, "val_ssim": 0.9920519590377808, "val_ssim_std": 0.001984796247741167}, "model": "claude-opus-4-8-1m", "obs_path": "breast-ct-claude-agentic-learned-primal-dual-search-20260703-01/iterations/iter-0016/observation.json", "obs_sha1": "18a0a7edc631420190c237f717a131e0048b64f8", "params_M": 0.303864, "params_source": "observation", "rationale": "learned_primal_dual-claude-agentic: lpd_iters=12, lpd_n_primal=5, lpd_n_dual=5, lpd_hidden=32, lpd_share_weights=False, epochs=10, lr=0.0008, lr_schedule=cosine, batch_size=1, grad_clip=1.0, lambda_neg=1.0, loss_base=mse, train_n=400, val_n=200, val_chunk=4, seed=42, rationale=iter-16 one-knob: lr 1.2e-3->8e-4 at I=12 (seed 42, else champion). DECISIVE FINDING: the iter-6 champion (I12/lr1.2e-3) is UNSTABLE across seeds -- {42:0.669, 43:0.494, 44:0.628, 45:0.0} = mean 0.4475 +/- 0.2663, with a full collapse (hr=0) on seed 45. Cause: the large lr at depth I=12 amplifies gradient variance -> ~25% of seeds diverge. HYPOTHESIS: if I lower lr 1.2e-3->8e-4 at I=12, expect hr ~0.55-0.65 with NO collapse (all seeds stable), trading a little peak for reliability -- a defensible, reportable operating point. Seed 42 for direct compare to iter-6 (0.6685). Time-neutral ~1800s. If stable, iters 17-19 replicate THIS at seeds 43-45 for an honest stable mean+/-std.", "run_id": "breast-ct-claude-agentic-learned-primal-dual-search-20260703-01", "runtime": {"elapsed_s": 1168.206110715866}, "schema_version": 3, "solver_key": "learned-primal-dual", "solver_name": "Learned Primal-Dual", "split": {"train_n": 400, "val_n": 200}, "status": "keep", "ts": "2026-07-04T20:29:44Z"}
