{"advice_for_others": "fastdiff_flow_pixel_unconstrained-claude-agentic: image_size=512, pixel_spacing=0.3516, n_angles=128, n_det=1024, det_spacing=0.35754, sod=500.0, sdd=1000.0, display_min=0.0, display_max=0.5, train_n=400, val_n=200, noise_i0=100000.0, noise_sigma_e=10.0, seed=42, fd_recon_ckpt=/cluster/maier/Agent4CT/checkpoints/fast_diffusion_pixel_breast.pt, fd_recon_steps=8, fd_recon_init=fbp, fd_recon_init_t=0.01, fd_recon_eta=0.1, fd_recon_dc=0, fd_recon_dc_n_cg=5, fd_recon_dc_relax=0.5, rationale=iter-15: DC-off breast-prior. ONE KNOB init_t 0.02->0.01. BREAKTHROUGH at iter-14: init_t0.02 gave hr=0.2085 (PSNR38.36 > FBP baseline 36.32; RMSE4.13e-3 < baseline 5.21e-3) - the breast prior CLEARED the baseline! MECHANISM: at init_t~0.02 the FBP is embedded at ~2% noise and the prior acts as a learned FBP-DENOISER (well-conditioned 128-view breast: FBP has removable noise; the prior's light denoise + whisper of DPS drops RMSE below raw FBP). So the DC-off prior DOES contribute (21% headroom recovered) as a denoiser, NOT just recovering FBP. HYPOTHESIS: init_t=0.01 - is hr still rising (even lighter touch) or did the peak pass at 0.02? Brackets the hr peak. Also a robustness check that iter-14's cross was not a fluke.", "agent": "fastdiff_flow_pixel_unconstrained-claude-agentic", "campaign": "search-20260703-01", "cfg_full": {"det_spacing": 0.35754, "display_max": 0.5, "display_min": 0.0, "fd_recon_ckpt": "/cluster/maier/Agent4CT/checkpoints/fast_diffusion_pixel_breast.pt", "fd_recon_dc": 0, "fd_recon_dc_n_cg": 5, "fd_recon_dc_relax": 0.5, "fd_recon_eta": 0.1, "fd_recon_init": "fbp", "fd_recon_init_t": 0.01, "fd_recon_steps": 8, "image_size": 512, "n_angles": 128, "n_det": 1024, "noise_i0": 100000.0, "noise_sigma_e": 10.0, "pixel_spacing": 0.3516, "rationale": "iter-15: DC-off breast-prior. ONE KNOB init_t 0.02->0.01. BREAKTHROUGH at iter-14: init_t0.02 gave hr=0.2085 (PSNR38.36 > FBP baseline 36.32; RMSE4.13e-3 < baseline 5.21e-3) - the breast prior CLEARED the baseline! MECHANISM: at init_t~0.02 the FBP is embedded at ~2% noise and the prior acts as a learned FBP-DENOISER (well-conditioned 128-view breast: FBP has removable noise; the prior's light denoise + whisper of DPS drops RMSE below raw FBP). So the DC-off prior DOES contribute (21% headroom recovered) as a denoiser, NOT just recovering FBP. HYPOTHESIS: init_t=0.01 - is hr still rising (even lighter touch) or did the peak pass at 0.02? Brackets the hr peak. Also a robustness check that iter-14's cross was not a fluke.", "sdd": 1000.0, "seed": 42, "sod": 500.0, "train_n": 400, "val_n": 200}, "challenge": "breast_ct", "change_class": "architecture", "git_commit": "671da566", "images": {"comparison": "runs/breast-ct-claude-agentic-fastdiff-flow-pixel-unconstrained-search-20260703-01/iterations/iter-0015/comparison.png", "test_showcase": null, "valtest_showcase": null}, "iter": 15, "kept": true, "metrics": {"headroom": 0.13841327807262793, "headroom_std": 0.01880917649755242, "val_psnr": 37.618221282958984, "val_psnr_std": 0.5464772963051884, "val_rmse": 0.004492557607591152, "val_rmse_std": 0.0002747447774383456, "val_ssim": 0.9750758409500122, "val_ssim_std": 0.0030151108939748678}, "model": "claude-opus-4-8-1m", "obs_path": "breast-ct-claude-agentic-fastdiff-flow-pixel-unconstrained-search-20260703-01/iterations/iter-0015/observation.json", "obs_sha1": "822b34108d23a3f8649e2006d00f60fa12811f99", "params_M": 3.822787, "params_source": "observation", "rationale": "fastdiff_flow_pixel_unconstrained-claude-agentic: image_size=512, pixel_spacing=0.3516, n_angles=128, n_det=1024, det_spacing=0.35754, sod=500.0, sdd=1000.0, display_min=0.0, display_max=0.5, train_n=400, val_n=200, noise_i0=100000.0, noise_sigma_e=10.0, seed=42, fd_recon_ckpt=/cluster/maier/Agent4CT/checkpoints/fast_diffusion_pixel_breast.pt, fd_recon_steps=8, fd_recon_init=fbp, fd_recon_init_t=0.01, fd_recon_eta=0.1, fd_recon_dc=0, fd_recon_dc_n_cg=5, fd_recon_dc_relax=0.5, rationale=iter-15: DC-off breast-prior. ONE KNOB init_t 0.02->0.01. BREAKTHROUGH at iter-14: init_t0.02 gave hr=0.2085 (PSNR38.36 > FBP baseline 36.32; RMSE4.13e-3 < baseline 5.21e-3) - the breast prior CLEARED the baseline! MECHANISM: at init_t~0.02 the FBP is embedded at ~2% noise and the prior acts as a learned FBP-DENOISER (well-conditioned 128-view breast: FBP has removable noise; the prior's light denoise + whisper of DPS drops RMSE below raw FBP). So the DC-off prior DOES contribute (21% headroom recovered) as a denoiser, NOT just recovering FBP. HYPOTHESIS: init_t=0.01 - is hr still rising (even lighter touch) or did the peak pass at 0.02? Brackets the hr peak. Also a robustness check that iter-14's cross was not a fluke.", "run_id": "breast-ct-claude-agentic-fastdiff-flow-pixel-unconstrained-search-20260703-01", "runtime": {"elapsed_s": 152.45453786849976}, "schema_version": 3, "solver_key": "fastdiff-flow-pixel-unconstrained", "solver_name": "Fast-diffusion flow (pixel, unconstrained)", "split": {"train_n": 3600, "val_n": 200}, "status": "keep", "ts": "2026-07-06T21:06:23Z"}
{"advice_for_others": "fastdiff_flow_pixel_unconstrained-claude-agentic: image_size=512, pixel_spacing=0.3516, n_angles=128, n_det=1024, det_spacing=0.35754, sod=500.0, sdd=1000.0, display_min=0.0, display_max=0.5, train_n=400, val_n=200, noise_i0=100000.0, noise_sigma_e=10.0, seed=42, fd_recon_ckpt=/cluster/maier/Agent4CT/checkpoints/fast_diffusion_pixel_breast.pt, fd_recon_steps=8, fd_recon_init=fbp, fd_recon_init_t=0.03, fd_recon_eta=0.1, fd_recon_dc=0, fd_recon_dc_n_cg=5, fd_recon_dc_relax=0.5, rationale=iter-16: DC-off breast-prior. ONE KNOB init_t 0.02->0.03 (upper bracket of the hr peak). PRIOR: hr vs init_t: 0.05->0(RMSE5.78e-3), 0.02->0.2085(RMSE4.13e-3 BEST), 0.01->0.1384(RMSE4.49e-3). The hr PEAK is at init_t~0.02 - a sweet spot where the prior optimally denoises the FBP. Below 0.02 (0.01) the prior has too little noise-room; above (0.05) too much generative drift re-raises RMSE. HYPOTHESIS: init_t=0.03 sits between the 0.02 peak and the 0.05 zero - hr should be positive but likely below the 0.02 peak, confirming 0.02 is near-optimal. Fine-grid confirmation of the peak location.", "agent": "fastdiff_flow_pixel_unconstrained-claude-agentic", "campaign": "search-20260703-01", "cfg_full": {"det_spacing": 0.35754, "display_max": 0.5, "display_min": 0.0, "fd_recon_ckpt": "/cluster/maier/Agent4CT/checkpoints/fast_diffusion_pixel_breast.pt", "fd_recon_dc": 0, "fd_recon_dc_n_cg": 5, "fd_recon_dc_relax": 0.5, "fd_recon_eta": 0.1, "fd_recon_init": "fbp", "fd_recon_init_t": 0.03, "fd_recon_steps": 8, "image_size": 512, "n_angles": 128, "n_det": 1024, "noise_i0": 100000.0, "noise_sigma_e": 10.0, "pixel_spacing": 0.3516, "rationale": "iter-16: DC-off breast-prior. ONE KNOB init_t 0.02->0.03 (upper bracket of the hr peak). PRIOR: hr vs init_t: 0.05->0(RMSE5.78e-3), 0.02->0.2085(RMSE4.13e-3 BEST), 0.01->0.1384(RMSE4.49e-3). The hr PEAK is at init_t~0.02 - a sweet spot where the prior optimally denoises the FBP. Below 0.02 (0.01) the prior has too little noise-room; above (0.05) too much generative drift re-raises RMSE. HYPOTHESIS: init_t=0.03 sits between the 0.02 peak and the 0.05 zero - hr should be positive but likely below the 0.02 peak, confirming 0.02 is near-optimal. Fine-grid confirmation of the peak location.", "sdd": 1000.0, "seed": 42, "sod": 500.0, "train_n": 400, "val_n": 200}, "challenge": "breast_ct", "change_class": "architecture", "git_commit": "671da566", "images": {"comparison": "runs/breast-ct-claude-agentic-fastdiff-flow-pixel-unconstrained-search-20260703-01/iterations/iter-0016/comparison.png", "test_showcase": null, "valtest_showcase": null}, "iter": 16, "kept": true, "metrics": {"headroom": 0.18109871687557022, "headroom_std": 0.027108197309237, "val_psnr": 38.05956268310547, "val_psnr_std": 0.7953801897483147, "val_rmse": 0.004269983619451523, "val_rmse_std": 0.000386313630928408, "val_ssim": 0.9644467830657959, "val_ssim_std": 0.007632440476053151}, "model": "claude-opus-4-8-1m", "obs_path": "breast-ct-claude-agentic-fastdiff-flow-pixel-unconstrained-search-20260703-01/iterations/iter-0016/observation.json", "obs_sha1": "8e3e445a0c49457646e9d647554c77b404ad9499", "params_M": 3.822787, "params_source": "observation", "rationale": "fastdiff_flow_pixel_unconstrained-claude-agentic: image_size=512, pixel_spacing=0.3516, n_angles=128, n_det=1024, det_spacing=0.35754, sod=500.0, sdd=1000.0, display_min=0.0, display_max=0.5, train_n=400, val_n=200, noise_i0=100000.0, noise_sigma_e=10.0, seed=42, fd_recon_ckpt=/cluster/maier/Agent4CT/checkpoints/fast_diffusion_pixel_breast.pt, fd_recon_steps=8, fd_recon_init=fbp, fd_recon_init_t=0.03, fd_recon_eta=0.1, fd_recon_dc=0, fd_recon_dc_n_cg=5, fd_recon_dc_relax=0.5, rationale=iter-16: DC-off breast-prior. ONE KNOB init_t 0.02->0.03 (upper bracket of the hr peak). PRIOR: hr vs init_t: 0.05->0(RMSE5.78e-3), 0.02->0.2085(RMSE4.13e-3 BEST), 0.01->0.1384(RMSE4.49e-3). The hr PEAK is at init_t~0.02 - a sweet spot where the prior optimally denoises the FBP. Below 0.02 (0.01) the prior has too little noise-room; above (0.05) too much generative drift re-raises RMSE. HYPOTHESIS: init_t=0.03 sits between the 0.02 peak and the 0.05 zero - hr should be positive but likely below the 0.02 peak, confirming 0.02 is near-optimal. Fine-grid confirmation of the peak location.", "run_id": "breast-ct-claude-agentic-fastdiff-flow-pixel-unconstrained-search-20260703-01", "runtime": {"elapsed_s": 155.74923539161682}, "schema_version": 3, "solver_key": "fastdiff-flow-pixel-unconstrained", "solver_name": "Fast-diffusion flow (pixel, unconstrained)", "split": {"train_n": 3600, "val_n": 200}, "status": "keep", "ts": "2026-07-06T21:09:33Z"}
{"advice_for_others": "fastdiff_flow_pixel_unconstrained-claude-agentic: image_size=512, pixel_spacing=0.3516, n_angles=128, n_det=1024, det_spacing=0.35754, sod=500.0, sdd=1000.0, display_min=0.0, display_max=0.5, train_n=400, val_n=200, noise_i0=100000.0, noise_sigma_e=10.0, seed=123, fd_recon_ckpt=/cluster/maier/Agent4CT/checkpoints/fast_diffusion_pixel_breast.pt, fd_recon_steps=8, fd_recon_init=fbp, fd_recon_init_t=0.02, fd_recon_eta=0.1, fd_recon_dc=0, fd_recon_dc_n_cg=5, fd_recon_dc_relax=0.5, rationale=iter-17: DC-off breast-prior. ROBUSTNESS check of the champion (iter-14: init_t0.02/eta0.1/steps8, hr0.2085). ONE KNOB seed 42->123 (different val-slice draw + sampler noise). PRIOR: hr peak firmly at init_t~0.02 (3 KEEPs 14/15/16). README caveat: don't over-trust a single hr number - confirm the cross is seed-robust, not val-draw luck. HYPOTHESIS: hr stays ~0.20 at seed=123 => the DC-off breast prior's baseline-clearing is REAL and reproducible, not a favourable-draw artefact. If hr collapses, the cross was seed-fragile (would qualify the finding).", "agent": "fastdiff_flow_pixel_unconstrained-claude-agentic", "campaign": "search-20260703-01", "cfg_full": {"det_spacing": 0.35754, "display_max": 0.5, "display_min": 0.0, "fd_recon_ckpt": "/cluster/maier/Agent4CT/checkpoints/fast_diffusion_pixel_breast.pt", "fd_recon_dc": 0, "fd_recon_dc_n_cg": 5, "fd_recon_dc_relax": 0.5, "fd_recon_eta": 0.1, "fd_recon_init": "fbp", "fd_recon_init_t": 0.02, "fd_recon_steps": 8, "image_size": 512, "n_angles": 128, "n_det": 1024, "noise_i0": 100000.0, "noise_sigma_e": 10.0, "pixel_spacing": 0.3516, "rationale": "iter-17: DC-off breast-prior. ROBUSTNESS check of the champion (iter-14: init_t0.02/eta0.1/steps8, hr0.2085). ONE KNOB seed 42->123 (different val-slice draw + sampler noise). PRIOR: hr peak firmly at init_t~0.02 (3 KEEPs 14/15/16). README caveat: don't over-trust a single hr number - confirm the cross is seed-robust, not val-draw luck. HYPOTHESIS: hr stays ~0.20 at seed=123 => the DC-off breast prior's baseline-clearing is REAL and reproducible, not a favourable-draw artefact. If hr collapses, the cross was seed-fragile (would qualify the finding).", "sdd": 1000.0, "seed": 123, "sod": 500.0, "train_n": 400, "val_n": 200}, "challenge": "breast_ct", "change_class": "architecture", "git_commit": "671da566", "images": {"comparison": "runs/breast-ct-claude-agentic-fastdiff-flow-pixel-unconstrained-search-20260703-01/iterations/iter-0017/comparison.png", "test_showcase": null, "valtest_showcase": null}, "iter": 17, "kept": true, "metrics": {"headroom": 0.20885344157568209, "headroom_std": 0.019937219642968507, "val_psnr": 38.35905838012695, "val_psnr_std": 0.5539180509414369, "val_rmse": 0.0041252626106143, "val_rmse_std": 0.0002592273941328338, "val_ssim": 0.9746328592300415, "val_ssim_std": 0.0039009071560641316}, "model": "claude-opus-4-8-1m", "obs_path": "breast-ct-claude-agentic-fastdiff-flow-pixel-unconstrained-search-20260703-01/iterations/iter-0017/observation.json", "obs_sha1": "6a19a87a8e3ae2acf9aef8625791234957f2a3b2", "params_M": 3.822787, "params_source": "observation", "rationale": "fastdiff_flow_pixel_unconstrained-claude-agentic: image_size=512, pixel_spacing=0.3516, n_angles=128, n_det=1024, det_spacing=0.35754, sod=500.0, sdd=1000.0, display_min=0.0, display_max=0.5, train_n=400, val_n=200, noise_i0=100000.0, noise_sigma_e=10.0, seed=123, fd_recon_ckpt=/cluster/maier/Agent4CT/checkpoints/fast_diffusion_pixel_breast.pt, fd_recon_steps=8, fd_recon_init=fbp, fd_recon_init_t=0.02, fd_recon_eta=0.1, fd_recon_dc=0, fd_recon_dc_n_cg=5, fd_recon_dc_relax=0.5, rationale=iter-17: DC-off breast-prior. ROBUSTNESS check of the champion (iter-14: init_t0.02/eta0.1/steps8, hr0.2085). ONE KNOB seed 42->123 (different val-slice draw + sampler noise). PRIOR: hr peak firmly at init_t~0.02 (3 KEEPs 14/15/16). README caveat: don't over-trust a single hr number - confirm the cross is seed-robust, not val-draw luck. HYPOTHESIS: hr stays ~0.20 at seed=123 => the DC-off breast prior's baseline-clearing is REAL and reproducible, not a favourable-draw artefact. If hr collapses, the cross was seed-fragile (would qualify the finding).", "run_id": "breast-ct-claude-agentic-fastdiff-flow-pixel-unconstrained-search-20260703-01", "runtime": {"elapsed_s": 146.872211933136}, "schema_version": 3, "solver_key": "fastdiff-flow-pixel-unconstrained", "solver_name": "Fast-diffusion flow (pixel, unconstrained)", "split": {"train_n": 3600, "val_n": 200}, "status": "keep", "ts": "2026-07-06T21:23:36Z"}
{"advice_for_others": "fastdiff_flow_pixel_unconstrained-claude-agentic: image_size=512, pixel_spacing=0.3516, n_angles=128, n_det=1024, det_spacing=0.35754, sod=500.0, sdd=1000.0, display_min=0.0, display_max=0.5, train_n=400, val_n=200, noise_i0=100000.0, noise_sigma_e=10.0, seed=42, fd_recon_ckpt=/cluster/maier/Agent4CT/checkpoints/fast_diffusion_pixel_breast.pt, fd_recon_steps=8, fd_recon_init=fbp, fd_recon_init_t=0.02, fd_recon_eta=0.05, fd_recon_dc=0, fd_recon_dc_n_cg=5, fd_recon_dc_relax=0.5, rationale=iter-18: DC-off breast-prior. At the hr-peak init_t=0.02, fine-tune eta. ONE KNOB eta 0.1->0.05 (seed 42). PRIOR: champion init_t0.02/eta0.1 = hr0.2085 (seed42) / 0.2089 (seed123, robust). Earlier eta sweep at HIGH init_t0.4 found lower eta = better up to ~0.05-0.1. HYPOTHESIS: at the low-init_t peak, eta=0.05 (even gentler DPS) may edge hr slightly above 0.209 by denoising with minimal measurement overshoot; if flat/lower, eta~0.1 is the joint optimum. Fine 2-lever refinement (init_t x eta) around the champion.", "agent": "fastdiff_flow_pixel_unconstrained-claude-agentic", "campaign": "search-20260703-01", "cfg_full": {"det_spacing": 0.35754, "display_max": 0.5, "display_min": 0.0, "fd_recon_ckpt": "/cluster/maier/Agent4CT/checkpoints/fast_diffusion_pixel_breast.pt", "fd_recon_dc": 0, "fd_recon_dc_n_cg": 5, "fd_recon_dc_relax": 0.5, "fd_recon_eta": 0.05, "fd_recon_init": "fbp", "fd_recon_init_t": 0.02, "fd_recon_steps": 8, "image_size": 512, "n_angles": 128, "n_det": 1024, "noise_i0": 100000.0, "noise_sigma_e": 10.0, "pixel_spacing": 0.3516, "rationale": "iter-18: DC-off breast-prior. At the hr-peak init_t=0.02, fine-tune eta. ONE KNOB eta 0.1->0.05 (seed 42). PRIOR: champion init_t0.02/eta0.1 = hr0.2085 (seed42) / 0.2089 (seed123, robust). Earlier eta sweep at HIGH init_t0.4 found lower eta = better up to ~0.05-0.1. HYPOTHESIS: at the low-init_t peak, eta=0.05 (even gentler DPS) may edge hr slightly above 0.209 by denoising with minimal measurement overshoot; if flat/lower, eta~0.1 is the joint optimum. Fine 2-lever refinement (init_t x eta) around the champion.", "sdd": 1000.0, "seed": 42, "sod": 500.0, "train_n": 400, "val_n": 200}, "challenge": "breast_ct", "change_class": "architecture", "git_commit": "671da566", "images": {"comparison": "runs/breast-ct-claude-agentic-fastdiff-flow-pixel-unconstrained-search-20260703-01/iterations/iter-0018/comparison.png", "test_showcase": null, "valtest_showcase": null}, "iter": 18, "kept": true, "metrics": {"headroom": 0.26074121848908727, "headroom_std": 0.0172750063818138, "val_psnr": 38.948265075683594, "val_psnr_std": 0.4951394946275317, "val_rmse": 0.0038547050207853317, "val_rmse_std": 0.00021677350970811477, "val_ssim": 0.9760755896568298, "val_ssim_std": 0.0028312919459315597}, "model": "claude-opus-4-8-1m", "obs_path": "breast-ct-claude-agentic-fastdiff-flow-pixel-unconstrained-search-20260703-01/iterations/iter-0018/observation.json", "obs_sha1": "a434571092b1f83401e27623ad6a65e1970d9c86", "params_M": 3.822787, "params_source": "observation", "rationale": "fastdiff_flow_pixel_unconstrained-claude-agentic: image_size=512, pixel_spacing=0.3516, n_angles=128, n_det=1024, det_spacing=0.35754, sod=500.0, sdd=1000.0, display_min=0.0, display_max=0.5, train_n=400, val_n=200, noise_i0=100000.0, noise_sigma_e=10.0, seed=42, fd_recon_ckpt=/cluster/maier/Agent4CT/checkpoints/fast_diffusion_pixel_breast.pt, fd_recon_steps=8, fd_recon_init=fbp, fd_recon_init_t=0.02, fd_recon_eta=0.05, fd_recon_dc=0, fd_recon_dc_n_cg=5, fd_recon_dc_relax=0.5, rationale=iter-18: DC-off breast-prior. At the hr-peak init_t=0.02, fine-tune eta. ONE KNOB eta 0.1->0.05 (seed 42). PRIOR: champion init_t0.02/eta0.1 = hr0.2085 (seed42) / 0.2089 (seed123, robust). Earlier eta sweep at HIGH init_t0.4 found lower eta = better up to ~0.05-0.1. HYPOTHESIS: at the low-init_t peak, eta=0.05 (even gentler DPS) may edge hr slightly above 0.209 by denoising with minimal measurement overshoot; if flat/lower, eta~0.1 is the joint optimum. Fine 2-lever refinement (init_t x eta) around the champion.", "run_id": "breast-ct-claude-agentic-fastdiff-flow-pixel-unconstrained-search-20260703-01", "runtime": {"elapsed_s": 155.7896866798401}, "schema_version": 3, "solver_key": "fastdiff-flow-pixel-unconstrained", "solver_name": "Fast-diffusion flow (pixel, unconstrained)", "split": {"train_n": 3600, "val_n": 200}, "status": "keep", "ts": "2026-07-06T21:26:54Z"}
