{"advice_for_others": "fastdiff_wdm_wavelet_constrained-claude-agentic: val_n=200, seed=42, fd_recon_ckpt=/cluster/maier/Agent4CT/checkpoints/fast_diffusion_wavelet_breast.pt, fd_recon_steps=8, fd_recon_init=fbp, fd_recon_init_t=0.005, fd_recon_eta=1.0, fd_recon_dc=1, fd_recon_dc_n_cg=18, fd_recon_dc_relax=1.0, dataset_kind=breast_ct, rationale=iter-13 n_cg fine-localize (18), breast-native wavelet CONSTRAINED, val=200. SIX-BOX: (1) PRIOR: n_cg@init_t0.005: 5->hr0, 15->0.0695, 20->0.0760(BEST), 25->0.043. Interior peak in 18-22. (2) FAILURE MODE: <15 under-converged, >~22 over-converged (LSQ noise re-enters). (3) ONE KNOB: n_cg 20 -> 18 (bracket the peak from below). (4) HYPOTHESIS: n_cg=18 ~ 0.072-0.076 (near the peak); if <0.0760, peak is at/above 20 -> confirm 20 optimal; if >, try 19. (5) BUDGET ~3min. (6) iter-14 on landing.", "agent": "fastdiff_wdm_wavelet_constrained-claude-agentic", "campaign": "search-20260703-01", "cfg_full": {"dataset_kind": "breast_ct", "fd_recon_ckpt": "/cluster/maier/Agent4CT/checkpoints/fast_diffusion_wavelet_breast.pt", "fd_recon_dc": 1, "fd_recon_dc_n_cg": 18, "fd_recon_dc_relax": 1.0, "fd_recon_eta": 1.0, "fd_recon_init": "fbp", "fd_recon_init_t": 0.005, "fd_recon_steps": 8, "rationale": "iter-13 n_cg fine-localize (18), breast-native wavelet CONSTRAINED, val=200. SIX-BOX: (1) PRIOR: n_cg@init_t0.005: 5->hr0, 15->0.0695, 20->0.0760(BEST), 25->0.043. Interior peak in 18-22. (2) FAILURE MODE: <15 under-converged, >~22 over-converged (LSQ noise re-enters). (3) ONE KNOB: n_cg 20 -> 18 (bracket the peak from below). (4) HYPOTHESIS: n_cg=18 ~ 0.072-0.076 (near the peak); if <0.0760, peak is at/above 20 -> confirm 20 optimal; if >, try 19. (5) BUDGET ~3min. (6) iter-14 on landing.", "seed": 42, "val_n": 200}, "challenge": "breast_ct", "change_class": "architecture", "git_commit": "671da566", "images": {"comparison": "runs/breast-ct-claude-agentic-fastdiff-wdm-wavelet-constrained-search-20260703-01/iterations/iter-0013/comparison.png", "test_showcase": null, "valtest_showcase": null}, "iter": 13, "kept": true, "metrics": {"headroom": 0.07683779070655294, "headroom_std": 0.048217957865001826, "val_psnr": 37.018638610839844, "val_psnr_std": 0.18421901019556444, "val_rmse": 0.0048136296682059765, "val_rmse_std": 6.116810290757079e-05, "val_ssim": 0.8817664980888367, "val_ssim_std": 0.004844593257972846}, "model": "claude-opus-4-8-1m", "obs_path": "breast-ct-claude-agentic-fastdiff-wdm-wavelet-constrained-search-20260703-01/iterations/iter-0013/observation.json", "obs_sha1": "788470fedcd8c1a767c34e711db00e840a5a745e", "params_M": 3.824908, "params_source": "observation", "rationale": "fastdiff_wdm_wavelet_constrained-claude-agentic: val_n=200, seed=42, fd_recon_ckpt=/cluster/maier/Agent4CT/checkpoints/fast_diffusion_wavelet_breast.pt, fd_recon_steps=8, fd_recon_init=fbp, fd_recon_init_t=0.005, fd_recon_eta=1.0, fd_recon_dc=1, fd_recon_dc_n_cg=18, fd_recon_dc_relax=1.0, dataset_kind=breast_ct, rationale=iter-13 n_cg fine-localize (18), breast-native wavelet CONSTRAINED, val=200. SIX-BOX: (1) PRIOR: n_cg@init_t0.005: 5->hr0, 15->0.0695, 20->0.0760(BEST), 25->0.043. Interior peak in 18-22. (2) FAILURE MODE: <15 under-converged, >~22 over-converged (LSQ noise re-enters). (3) ONE KNOB: n_cg 20 -> 18 (bracket the peak from below). (4) HYPOTHESIS: n_cg=18 ~ 0.072-0.076 (near the peak); if <0.0760, peak is at/above 20 -> confirm 20 optimal; if >, try 19. (5) BUDGET ~3min. (6) iter-14 on landing.", "run_id": "breast-ct-claude-agentic-fastdiff-wdm-wavelet-constrained-search-20260703-01", "runtime": {"elapsed_s": 176.54156255722046}, "schema_version": 3, "solver_key": "fastdiff-wdm-wavelet-constrained", "solver_name": "Fast-diffusion WDM (wavelet, constrained DC)", "split": {"train_n": 3600, "val_n": 200}, "status": "keep", "ts": "2026-07-06T21:50:31Z"}
{"advice_for_others": "fastdiff_wdm_wavelet_constrained-claude-agentic: val_n=200, seed=42, fd_recon_ckpt=/cluster/maier/Agent4CT/checkpoints/fast_diffusion_wavelet_breast.pt, fd_recon_steps=16, fd_recon_init=fbp, fd_recon_init_t=0.005, fd_recon_eta=1.0, fd_recon_dc=1, fd_recon_dc_n_cg=18, fd_recon_dc_relax=1.0, dataset_kind=breast_ct, rationale=iter-14 NFE (steps) lever, breast-native wavelet CONSTRAINED, val=200. SIX-BOX: (1) PRIOR: n_cg plateau found at init_t0.005: n_cg18->hr0.0768(BEST), 20->0.0760, 15->0.0695, 25->0.043. Prior near-off at init_t0.005; the CG-DC is doing the work (DC runs once per Euler step). (2) FAILURE MODE: at steps=8 the recon may still benefit from more interleaved DC re-projections; OR fewer steps suffice (prior off). (3) ONE KNOB: fd_recon_steps 8 -> 16 (double the Euler steps = double the CG-DC re-projections + prior evals). (4) HYPOTHESIS: more steps = more DC applications interleaved -> slightly lower RMSE (hr>0.0768); if flat, DC has converged at 8 steps and steps is neutral -> revert to 8 (cheaper) and try dc_relax. FALSIFIER: if hr drops, the extra near-off-prior Euler steps add drift -> fewer steps better. (5) BUDGET: 16 steps x n_cg18 ~2x cost ~6min, inside 20min. (6) iter-15 on landing.", "agent": "fastdiff_wdm_wavelet_constrained-claude-agentic", "campaign": "search-20260703-01", "cfg_full": {"dataset_kind": "breast_ct", "fd_recon_ckpt": "/cluster/maier/Agent4CT/checkpoints/fast_diffusion_wavelet_breast.pt", "fd_recon_dc": 1, "fd_recon_dc_n_cg": 18, "fd_recon_dc_relax": 1.0, "fd_recon_eta": 1.0, "fd_recon_init": "fbp", "fd_recon_init_t": 0.005, "fd_recon_steps": 16, "rationale": "iter-14 NFE (steps) lever, breast-native wavelet CONSTRAINED, val=200. SIX-BOX: (1) PRIOR: n_cg plateau found at init_t0.005: n_cg18->hr0.0768(BEST), 20->0.0760, 15->0.0695, 25->0.043. Prior near-off at init_t0.005; the CG-DC is doing the work (DC runs once per Euler step). (2) FAILURE MODE: at steps=8 the recon may still benefit from more interleaved DC re-projections; OR fewer steps suffice (prior off). (3) ONE KNOB: fd_recon_steps 8 -> 16 (double the Euler steps = double the CG-DC re-projections + prior evals). (4) HYPOTHESIS: more steps = more DC applications interleaved -> slightly lower RMSE (hr>0.0768); if flat, DC has converged at 8 steps and steps is neutral -> revert to 8 (cheaper) and try dc_relax. FALSIFIER: if hr drops, the extra near-off-prior Euler steps add drift -> fewer steps better. (5) BUDGET: 16 steps x n_cg18 ~2x cost ~6min, inside 20min. (6) iter-15 on landing.", "seed": 42, "val_n": 200}, "challenge": "breast_ct", "change_class": "architecture", "git_commit": "671da566", "images": {"comparison": "runs/breast-ct-claude-agentic-fastdiff-wdm-wavelet-constrained-search-20260703-01/iterations/iter-0014/comparison.png", "test_showcase": null, "valtest_showcase": null}, "iter": 14, "kept": false, "metrics": {"headroom": 0.0, "headroom_std": 0.0019358826167636793, "val_psnr": 35.37167739868164, "val_psnr_std": 0.18954474935674925, "val_rmse": 0.005818629637360573, "val_rmse_std": 7.841278060812715e-05, "val_ssim": 0.8266743421554565, "val_ssim_std": 0.005873327340976609}, "model": "claude-opus-4-8-1m", "obs_path": "breast-ct-claude-agentic-fastdiff-wdm-wavelet-constrained-search-20260703-01/iterations/iter-0014/observation.json", "obs_sha1": "d17d94fc5ccc46fe18d779c322402753cd6977c4", "params_M": 3.824908, "params_source": "observation", "rationale": "fastdiff_wdm_wavelet_constrained-claude-agentic: val_n=200, seed=42, fd_recon_ckpt=/cluster/maier/Agent4CT/checkpoints/fast_diffusion_wavelet_breast.pt, fd_recon_steps=16, fd_recon_init=fbp, fd_recon_init_t=0.005, fd_recon_eta=1.0, fd_recon_dc=1, fd_recon_dc_n_cg=18, fd_recon_dc_relax=1.0, dataset_kind=breast_ct, rationale=iter-14 NFE (steps) lever, breast-native wavelet CONSTRAINED, val=200. SIX-BOX: (1) PRIOR: n_cg plateau found at init_t0.005: n_cg18->hr0.0768(BEST), 20->0.0760, 15->0.0695, 25->0.043. Prior near-off at init_t0.005; the CG-DC is doing the work (DC runs once per Euler step). (2) FAILURE MODE: at steps=8 the recon may still benefit from more interleaved DC re-projections; OR fewer steps suffice (prior off). (3) ONE KNOB: fd_recon_steps 8 -> 16 (double the Euler steps = double the CG-DC re-projections + prior evals). (4) HYPOTHESIS: more steps = more DC applications interleaved -> slightly lower RMSE (hr>0.0768); if flat, DC has converged at 8 steps and steps is neutral -> revert to 8 (cheaper) and try dc_relax. FALSIFIER: if hr drops, the extra near-off-prior Euler steps add drift -> fewer steps better. (5) BUDGET: 16 steps x n_cg18 ~2x cost ~6min, inside 20min. (6) iter-15 on landing.", "run_id": "breast-ct-claude-agentic-fastdiff-wdm-wavelet-constrained-search-20260703-01", "runtime": {"elapsed_s": 364.0153503417969}, "schema_version": 3, "solver_key": "fastdiff-wdm-wavelet-constrained", "solver_name": "Fast-diffusion WDM (wavelet, constrained DC)", "split": {"train_n": 3600, "val_n": 200}, "status": "discard", "ts": "2026-07-06T21:57:35Z"}
{"advice_for_others": "fastdiff_wdm_wavelet_constrained-claude-agentic: val_n=200, seed=42, fd_recon_ckpt=/cluster/maier/Agent4CT/checkpoints/fast_diffusion_wavelet_breast.pt, fd_recon_steps=4, fd_recon_init=fbp, fd_recon_init_t=0.005, fd_recon_eta=1.0, fd_recon_dc=1, fd_recon_dc_n_cg=18, fd_recon_dc_relax=1.0, dataset_kind=breast_ct, rationale=iter-15 NFE (fewer steps) lever, breast-native wavelet CONSTRAINED, val=200. SIX-BOX: (1) PRIOR: steps16 (iter-14) DROPPED to hr0 (RMSE5.82e-3) vs steps8 hr0.0768 -- more Euler steps HURT (each step re-embeds noise + evaluates the near-off prior -> accumulated drift). (2) FAILURE MODE: extra steps compound the deterministic re-embed noise injection and prior drift. Direction: fewer steps. (3) ONE KNOB: fd_recon_steps 8 -> 4 (halve the Euler/DC re-embed count), n_cg18/init_t0.005 fixed. (4) HYPOTHESIS: fewer steps = less accumulated re-embed drift while the strong CG-DC (n_cg18) still pins the data -> RMSE <= steps8 (hr>=0.0768). If flat/slightly worse, steps=8 is optimal. FALSIFIER: if hr drops, too few DC applications under-constrain -> 8 is the sweet spot. (5) BUDGET ~1.5min. (6) iter-16 on landing.", "agent": "fastdiff_wdm_wavelet_constrained-claude-agentic", "campaign": "search-20260703-01", "cfg_full": {"dataset_kind": "breast_ct", "fd_recon_ckpt": "/cluster/maier/Agent4CT/checkpoints/fast_diffusion_wavelet_breast.pt", "fd_recon_dc": 1, "fd_recon_dc_n_cg": 18, "fd_recon_dc_relax": 1.0, "fd_recon_eta": 1.0, "fd_recon_init": "fbp", "fd_recon_init_t": 0.005, "fd_recon_steps": 4, "rationale": "iter-15 NFE (fewer steps) lever, breast-native wavelet CONSTRAINED, val=200. SIX-BOX: (1) PRIOR: steps16 (iter-14) DROPPED to hr0 (RMSE5.82e-3) vs steps8 hr0.0768 -- more Euler steps HURT (each step re-embeds noise + evaluates the near-off prior -> accumulated drift). (2) FAILURE MODE: extra steps compound the deterministic re-embed noise injection and prior drift. Direction: fewer steps. (3) ONE KNOB: fd_recon_steps 8 -> 4 (halve the Euler/DC re-embed count), n_cg18/init_t0.005 fixed. (4) HYPOTHESIS: fewer steps = less accumulated re-embed drift while the strong CG-DC (n_cg18) still pins the data -> RMSE <= steps8 (hr>=0.0768). If flat/slightly worse, steps=8 is optimal. FALSIFIER: if hr drops, too few DC applications under-constrain -> 8 is the sweet spot. (5) BUDGET ~1.5min. (6) iter-16 on landing.", "seed": 42, "val_n": 200}, "challenge": "breast_ct", "change_class": "architecture", "git_commit": "671da566", "images": {"comparison": "runs/breast-ct-claude-agentic-fastdiff-wdm-wavelet-constrained-search-20260703-01/iterations/iter-0015/comparison.png", "test_showcase": null, "valtest_showcase": null}, "iter": 15, "kept": true, "metrics": {"headroom": 0.13044781336410904, "headroom_std": 0.04881131657433595, "val_psnr": 37.53828430175781, "val_psnr_std": 0.25195067786216657, "val_rmse": 0.004534091800451279, "val_rmse_std": 0.00010664798363541632, "val_ssim": 0.9038277864456177, "val_ssim_std": 0.005571268767339705}, "model": "claude-opus-4-8-1m", "obs_path": "breast-ct-claude-agentic-fastdiff-wdm-wavelet-constrained-search-20260703-01/iterations/iter-0015/observation.json", "obs_sha1": "0d6a15eb940c163a2bb666abd0dab4906ce46cb4", "params_M": 3.824908, "params_source": "observation", "rationale": "fastdiff_wdm_wavelet_constrained-claude-agentic: val_n=200, seed=42, fd_recon_ckpt=/cluster/maier/Agent4CT/checkpoints/fast_diffusion_wavelet_breast.pt, fd_recon_steps=4, fd_recon_init=fbp, fd_recon_init_t=0.005, fd_recon_eta=1.0, fd_recon_dc=1, fd_recon_dc_n_cg=18, fd_recon_dc_relax=1.0, dataset_kind=breast_ct, rationale=iter-15 NFE (fewer steps) lever, breast-native wavelet CONSTRAINED, val=200. SIX-BOX: (1) PRIOR: steps16 (iter-14) DROPPED to hr0 (RMSE5.82e-3) vs steps8 hr0.0768 -- more Euler steps HURT (each step re-embeds noise + evaluates the near-off prior -> accumulated drift). (2) FAILURE MODE: extra steps compound the deterministic re-embed noise injection and prior drift. Direction: fewer steps. (3) ONE KNOB: fd_recon_steps 8 -> 4 (halve the Euler/DC re-embed count), n_cg18/init_t0.005 fixed. (4) HYPOTHESIS: fewer steps = less accumulated re-embed drift while the strong CG-DC (n_cg18) still pins the data -> RMSE <= steps8 (hr>=0.0768). If flat/slightly worse, steps=8 is optimal. FALSIFIER: if hr drops, too few DC applications under-constrain -> 8 is the sweet spot. (5) BUDGET ~1.5min. (6) iter-16 on landing.", "run_id": "breast-ct-claude-agentic-fastdiff-wdm-wavelet-constrained-search-20260703-01", "runtime": {"elapsed_s": 117.24796533584595}, "schema_version": 3, "solver_key": "fastdiff-wdm-wavelet-constrained", "solver_name": "Fast-diffusion WDM (wavelet, constrained DC)", "split": {"train_n": 3600, "val_n": 200}, "status": "keep", "ts": "2026-07-06T22:00:18Z"}
{"advice_for_others": "fastdiff_wdm_wavelet_constrained-claude-agentic: val_n=200, seed=42, fd_recon_ckpt=/cluster/maier/Agent4CT/checkpoints/fast_diffusion_wavelet_breast.pt, fd_recon_steps=2, fd_recon_init=fbp, fd_recon_init_t=0.005, fd_recon_eta=1.0, fd_recon_dc=1, fd_recon_dc_n_cg=18, fd_recon_dc_relax=1.0, dataset_kind=breast_ct, rationale=iter-16 NFE (steps=2) lever, breast-native wavelet CONSTRAINED, val=200. SIX-BOX: (1) PRIOR: steps sweep @n_cg18/init_t0.005: 16->hr0, 8->0.0768, 4->0.1304(BEST). STRONGLY monotonic: fewer steps = far better (each Euler step re-embeds noise + net-harmful prior -> accumulated drift). (2) FAILURE MODE: prior + deterministic re-embed noise accumulate over steps. (3) ONE KNOB: fd_recon_steps 4 -> 2 (minimal Euler/re-embed count). (4) HYPOTHESIS: steps=2 continues the trend -> hr>0.1304 (recon approaches embed-once + strong CG-DC, minimal prior damage). FALSIFIER: if hr drops vs steps4, 2 steps under-apply the interleaved DC schedule -> 4 is optimal; then try steps=3 / steps=1. (5) BUDGET ~1min. (6) iter-17 on landing.", "agent": "fastdiff_wdm_wavelet_constrained-claude-agentic", "campaign": "search-20260703-01", "cfg_full": {"dataset_kind": "breast_ct", "fd_recon_ckpt": "/cluster/maier/Agent4CT/checkpoints/fast_diffusion_wavelet_breast.pt", "fd_recon_dc": 1, "fd_recon_dc_n_cg": 18, "fd_recon_dc_relax": 1.0, "fd_recon_eta": 1.0, "fd_recon_init": "fbp", "fd_recon_init_t": 0.005, "fd_recon_steps": 2, "rationale": "iter-16 NFE (steps=2) lever, breast-native wavelet CONSTRAINED, val=200. SIX-BOX: (1) PRIOR: steps sweep @n_cg18/init_t0.005: 16->hr0, 8->0.0768, 4->0.1304(BEST). STRONGLY monotonic: fewer steps = far better (each Euler step re-embeds noise + net-harmful prior -> accumulated drift). (2) FAILURE MODE: prior + deterministic re-embed noise accumulate over steps. (3) ONE KNOB: fd_recon_steps 4 -> 2 (minimal Euler/re-embed count). (4) HYPOTHESIS: steps=2 continues the trend -> hr>0.1304 (recon approaches embed-once + strong CG-DC, minimal prior damage). FALSIFIER: if hr drops vs steps4, 2 steps under-apply the interleaved DC schedule -> 4 is optimal; then try steps=3 / steps=1. (5) BUDGET ~1min. (6) iter-17 on landing.", "seed": 42, "val_n": 200}, "challenge": "breast_ct", "change_class": "architecture", "git_commit": "671da566", "images": {"comparison": "runs/breast-ct-claude-agentic-fastdiff-wdm-wavelet-constrained-search-20260703-01/iterations/iter-0016/comparison.png", "test_showcase": null, "valtest_showcase": null}, "iter": 16, "kept": true, "metrics": {"headroom": 0.0021869886455021526, "headroom_std": 0.031182087605645784, "val_psnr": 36.34321212768555, "val_psnr_std": 0.30735916994261797, "val_rmse": 0.0052028801292181015, "val_rmse_std": 0.00015249998593846025, "val_ssim": 0.8859085440635681, "val_ssim_std": 0.0072867057605945475}, "model": "claude-opus-4-8-1m", "obs_path": "breast-ct-claude-agentic-fastdiff-wdm-wavelet-constrained-search-20260703-01/iterations/iter-0016/observation.json", "obs_sha1": "62faa6d2bd2d61337c554bdcfaaf8957200aa03b", "params_M": 3.824908, "params_source": "observation", "rationale": "fastdiff_wdm_wavelet_constrained-claude-agentic: val_n=200, seed=42, fd_recon_ckpt=/cluster/maier/Agent4CT/checkpoints/fast_diffusion_wavelet_breast.pt, fd_recon_steps=2, fd_recon_init=fbp, fd_recon_init_t=0.005, fd_recon_eta=1.0, fd_recon_dc=1, fd_recon_dc_n_cg=18, fd_recon_dc_relax=1.0, dataset_kind=breast_ct, rationale=iter-16 NFE (steps=2) lever, breast-native wavelet CONSTRAINED, val=200. SIX-BOX: (1) PRIOR: steps sweep @n_cg18/init_t0.005: 16->hr0, 8->0.0768, 4->0.1304(BEST). STRONGLY monotonic: fewer steps = far better (each Euler step re-embeds noise + net-harmful prior -> accumulated drift). (2) FAILURE MODE: prior + deterministic re-embed noise accumulate over steps. (3) ONE KNOB: fd_recon_steps 4 -> 2 (minimal Euler/re-embed count). (4) HYPOTHESIS: steps=2 continues the trend -> hr>0.1304 (recon approaches embed-once + strong CG-DC, minimal prior damage). FALSIFIER: if hr drops vs steps4, 2 steps under-apply the interleaved DC schedule -> 4 is optimal; then try steps=3 / steps=1. (5) BUDGET ~1min. (6) iter-17 on landing.", "run_id": "breast-ct-claude-agentic-fastdiff-wdm-wavelet-constrained-search-20260703-01", "runtime": {"elapsed_s": 59.511075496673584}, "schema_version": 3, "solver_key": "fastdiff-wdm-wavelet-constrained", "solver_name": "Fast-diffusion WDM (wavelet, constrained DC)", "split": {"train_n": 3600, "val_n": 200}, "status": "keep", "ts": "2026-07-06T22:02:15Z"}
