{"advice_for_others": "dual_domain_supervised-claude-agentic: unet_c=16, epochs=20, batch_size=1, lr=0.0005, optimizer=adam, lambda_neg=1.0, grad_clip=1.0, train_n=400, val_n=200, val_chunk=10, seed=42, rationale=iter-2 dual_domain_supervised on re-split Breast-CT (train3600/val200/test200, seed20260703), val=200. SIX-BOX: (1) PRIOR: iter-1 hr=0.8095, val_ssim=0.9975, elapsed=227s at c=16/lr=5e-4/ep=10. Only ~4 of 20 budget-min used. (2) Failure mode: not a failure, but hr=0.8095 sits below the breast DD-supervised prior ceiling (~0.836); with 227s spent the L2 fit is likely still descending -> mild undertraining. (3) ONE KNOB: epochs 10 -> 20 (double training steps; unet_c/lr/lambda_neg/grad_clip all unchanged). (4) HYPOTHESIS: doubling epochs to 20 lifts val headroom above 0.8095 because iter-1 used only ~4 min and the supervised MSE was still improving with more gradient passes over the 400 train scenes; expect hr toward ~0.82-0.84. (5) BUDGET: projected ~450s (2x iter-1 train + same val + figure) << 20 min (30-min sbatch wall). (6) Loop continues; iter-3 dispatched on landing. If hr plateaus/drops, epochs is not the lever -> pivot to capacity (unet_c) at iter-3.", "agent": "dual_domain_supervised-claude-agentic", "campaign": "search-20260703-01", "cfg_full": {"batch_size": 1, "epochs": 20, "grad_clip": 1.0, "lambda_neg": 1.0, "lr": 0.0005, "optimizer": "adam", "rationale": "iter-2 dual_domain_supervised on re-split Breast-CT (train3600/val200/test200, seed20260703), val=200. SIX-BOX: (1) PRIOR: iter-1 hr=0.8095, val_ssim=0.9975, elapsed=227s at c=16/lr=5e-4/ep=10. Only ~4 of 20 budget-min used. (2) Failure mode: not a failure, but hr=0.8095 sits below the breast DD-supervised prior ceiling (~0.836); with 227s spent the L2 fit is likely still descending -> mild undertraining. (3) ONE KNOB: epochs 10 -> 20 (double training steps; unet_c/lr/lambda_neg/grad_clip all unchanged). (4) HYPOTHESIS: doubling epochs to 20 lifts val headroom above 0.8095 because iter-1 used only ~4 min and the supervised MSE was still improving with more gradient passes over the 400 train scenes; expect hr toward ~0.82-0.84. (5) BUDGET: projected ~450s (2x iter-1 train + same val + figure) << 20 min (30-min sbatch wall). (6) Loop continues; iter-3 dispatched on landing. If hr plateaus/drops, epochs is not the lever -> pivot to capacity (unet_c) at iter-3.", "seed": 42, "train_n": 400, "unet_c": 16, "val_chunk": 10, "val_n": 200}, "challenge": "breast_ct", "change_class": "architecture", "git_commit": null, "images": {"comparison": "runs/breast-ct-claude-agentic-dual-domain-supervised-search-20260703-01/iterations/iter-0002/comparison.png", "test_showcase": null, "valtest_showcase": null}, "iter": 2, "kept": true, "metrics": {"headroom": 0.8372067137815499, "headroom_std": null, "val_psnr": 52.091461181640625, "val_psnr_std": null, "val_rmse": 0.0008488507592119277, "val_rmse_std": null, "val_ssim": 0.9982503056526184, "val_ssim_std": null}, "model": "claude-opus-4-8-1m", "obs_path": "breast-ct-claude-agentic-dual-domain-supervised-search-20260703-01/iterations/iter-0002/observation.json", "obs_sha1": "4c1939435b7e8b0f2088ed57bbf8bcd4bac270cd", "params_M": 0.465762, "params_source": "observation", "rationale": "dual_domain_supervised-claude-agentic: unet_c=16, epochs=20, batch_size=1, lr=0.0005, optimizer=adam, lambda_neg=1.0, grad_clip=1.0, train_n=400, val_n=200, val_chunk=10, seed=42, rationale=iter-2 dual_domain_supervised on re-split Breast-CT (train3600/val200/test200, seed20260703), val=200. SIX-BOX: (1) PRIOR: iter-1 hr=0.8095, val_ssim=0.9975, elapsed=227s at c=16/lr=5e-4/ep=10. Only ~4 of 20 budget-min used. (2) Failure mode: not a failure, but hr=0.8095 sits below the breast DD-supervised prior ceiling (~0.836); with 227s spent the L2 fit is likely still descending -> mild undertraining. (3) ONE KNOB: epochs 10 -> 20 (double training steps; unet_c/lr/lambda_neg/grad_clip all unchanged). (4) HYPOTHESIS: doubling epochs to 20 lifts val headroom above 0.8095 because iter-1 used only ~4 min and the supervised MSE was still improving with more gradient passes over the 400 train scenes; expect hr toward ~0.82-0.84. (5) BUDGET: projected ~450s (2x iter-1 train + same val + figure) << 20 min (30-min sbatch wall). (6) Loop continues; iter-3 dispatched on landing. If hr plateaus/drops, epochs is not the lever -> pivot to capacity (unet_c) at iter-3.", "run_id": "breast-ct-claude-agentic-dual-domain-supervised-search-20260703-01", "runtime": {"elapsed_s": 440.22432255744934}, "schema_version": 3, "solver_key": "dual-domain-supervised", "solver_name": "DD-UNet supervised L2", "split": {"train_n": 400, "val_n": 200}, "status": "keep", "ts": "2026-07-03T16:53:22Z"}
{"advice_for_others": "dual_domain_supervised-claude-agentic: unet_c=32, epochs=20, batch_size=1, lr=0.0005, optimizer=adam, lambda_neg=1.0, grad_clip=1.0, train_n=400, val_n=200, val_chunk=10, seed=42, rationale=iter-3 dual_domain_supervised on re-split Breast-CT (train3600/val200/test200, seed20260703), val=200. SIX-BOX: (1) PRIOR: iter-1 hr=0.8095 (ep10,227s); iter-2 hr=0.8372 (ep20,440s). Doubling epochs gave +0.028 hr -> the c=16 fit was undertrained. 440s used, ~13 min budget still free. (2) Failure mode: unknown whether hr is now epochs-limited or CAPACITY-limited; since more training clearly helped and budget remains, the c=16 dual U-Net may be capacity-bound on the sino+image denoising. (3) ONE KNOB: unet_c 16 -> 32 (both proj_dn and img_dn SmallUNet widths double; epochs=20/lr=5e-4/lambda_neg=1.0/grad_clip=1.0 all unchanged). (4) HYPOTHESIS: doubling channels to 32 raises val headroom above 0.8372 because iter-2 still had ample budget and a wider network can fit finer breast detail if the c=16 model was capacity-limited; expect hr ~0.85. Params ~0.47M -> ~1.85M. (5) BUDGET: wider net ~1.5-2x iter-2 step cost -> projected ~700-900s << 20 min (breast uses one shared PYRO-NN projector, FBP batched; 30-min sbatch wall). (6) Loop continues; iter-4 on landing. If wider net does NOT beat 0.8372, capacity is not the lever -> iter-4 pivots to lr.", "agent": "dual_domain_supervised-claude-agentic", "campaign": "search-20260703-01", "cfg_full": {"batch_size": 1, "epochs": 20, "grad_clip": 1.0, "lambda_neg": 1.0, "lr": 0.0005, "optimizer": "adam", "rationale": "iter-3 dual_domain_supervised on re-split Breast-CT (train3600/val200/test200, seed20260703), val=200. SIX-BOX: (1) PRIOR: iter-1 hr=0.8095 (ep10,227s); iter-2 hr=0.8372 (ep20,440s). Doubling epochs gave +0.028 hr -> the c=16 fit was undertrained. 440s used, ~13 min budget still free. (2) Failure mode: unknown whether hr is now epochs-limited or CAPACITY-limited; since more training clearly helped and budget remains, the c=16 dual U-Net may be capacity-bound on the sino+image denoising. (3) ONE KNOB: unet_c 16 -> 32 (both proj_dn and img_dn SmallUNet widths double; epochs=20/lr=5e-4/lambda_neg=1.0/grad_clip=1.0 all unchanged). (4) HYPOTHESIS: doubling channels to 32 raises val headroom above 0.8372 because iter-2 still had ample budget and a wider network can fit finer breast detail if the c=16 model was capacity-limited; expect hr ~0.85. Params ~0.47M -> ~1.85M. (5) BUDGET: wider net ~1.5-2x iter-2 step cost -> projected ~700-900s << 20 min (breast uses one shared PYRO-NN projector, FBP batched; 30-min sbatch wall). (6) Loop continues; iter-4 on landing. If wider net does NOT beat 0.8372, capacity is not the lever -> iter-4 pivots to lr.", "seed": 42, "train_n": 400, "unet_c": 32, "val_chunk": 10, "val_n": 200}, "challenge": "breast_ct", "change_class": "architecture", "git_commit": null, "images": {"comparison": "runs/breast-ct-claude-agentic-dual-domain-supervised-search-20260703-01/iterations/iter-0003/comparison.png", "test_showcase": null, "valtest_showcase": null}, "iter": 3, "kept": true, "metrics": {"headroom": 0.824324571421325, "headroom_std": null, "val_psnr": 51.42997360229492, "val_psnr_std": null, "val_rmse": 0.0009160219342447817, "val_rmse_std": null, "val_ssim": 0.9979411363601685, "val_ssim_std": null}, "model": "claude-opus-4-8-1m", "obs_path": "breast-ct-claude-agentic-dual-domain-supervised-search-20260703-01/iterations/iter-0003/observation.json", "obs_sha1": "20b2692aff788bc5e77bda98370e49327b89f2ff", "params_M": 1.856194, "params_source": "observation", "rationale": "dual_domain_supervised-claude-agentic: unet_c=32, epochs=20, batch_size=1, lr=0.0005, optimizer=adam, lambda_neg=1.0, grad_clip=1.0, train_n=400, val_n=200, val_chunk=10, seed=42, rationale=iter-3 dual_domain_supervised on re-split Breast-CT (train3600/val200/test200, seed20260703), val=200. SIX-BOX: (1) PRIOR: iter-1 hr=0.8095 (ep10,227s); iter-2 hr=0.8372 (ep20,440s). Doubling epochs gave +0.028 hr -> the c=16 fit was undertrained. 440s used, ~13 min budget still free. (2) Failure mode: unknown whether hr is now epochs-limited or CAPACITY-limited; since more training clearly helped and budget remains, the c=16 dual U-Net may be capacity-bound on the sino+image denoising. (3) ONE KNOB: unet_c 16 -> 32 (both proj_dn and img_dn SmallUNet widths double; epochs=20/lr=5e-4/lambda_neg=1.0/grad_clip=1.0 all unchanged). (4) HYPOTHESIS: doubling channels to 32 raises val headroom above 0.8372 because iter-2 still had ample budget and a wider network can fit finer breast detail if the c=16 model was capacity-limited; expect hr ~0.85. Params ~0.47M -> ~1.85M. (5) BUDGET: wider net ~1.5-2x iter-2 step cost -> projected ~700-900s << 20 min (breast uses one shared PYRO-NN projector, FBP batched; 30-min sbatch wall). (6) Loop continues; iter-4 on landing. If wider net does NOT beat 0.8372, capacity is not the lever -> iter-4 pivots to lr.", "run_id": "breast-ct-claude-agentic-dual-domain-supervised-search-20260703-01", "runtime": {"elapsed_s": 667.9939396381378}, "schema_version": 3, "solver_key": "dual-domain-supervised", "solver_name": "DD-UNet supervised L2", "split": {"train_n": 400, "val_n": 200}, "status": "keep", "ts": "2026-07-03T19:20:19Z"}
{"advice_for_others": "dual_domain_supervised-claude-agentic: unet_c=16, epochs=32, batch_size=1, lr=0.0005, optimizer=adam, lambda_neg=1.0, grad_clip=1.0, train_n=400, val_n=200, val_chunk=10, seed=42, rationale=iter-4 dual_domain_supervised on re-split Breast-CT (train3600/val200/test200, seed20260703), val=200. SIX-BOX vs the BEST config (iter-2 c16/ep20 hr=0.8372): (1) PRIOR: iter-1 hr=0.8095 (c16/ep10), iter-2 hr=0.8372 (c16/ep20, BEST), iter-3 hr=0.8243 (c32/ep20 \u2014 REGRESSED, 3x params no gain). (2) Failure mode: c=32 was over-parameterized (capacity is NOT the lever); revert to the winning c=16. Open question: is c16 still EPOCHS-limited beyond 20? The 10->20 step gave +0.028 hr. (3) ONE KNOB vs the best config: epochs 20 -> 32 (unet_c=16 is iter-2 value, lr/lambda_neg/grad_clip unchanged). (4) HYPOTHESIS: at c=16, raising epochs 20->32 lifts hr above 0.8372 because the 10->20 doubling was still improving and the supervised MSE likely keeps descending; expect hr ~0.84-0.85. If it plateaus, epochs is saturated and iter-5 pivots to lr. (5) BUDGET: iter-2 ep20=440s -> ep32 ~ 700s << 20 min (30-min sbatch wall; breast single shared projector). (6) iter-5 dispatched on landing. Artifacts (recon_raw.npz + model_ckpt.pt) saved via AGENT4CT_SAVE_RECON / AGENT4CT_MODEL_CKPT to this iter dir.", "agent": "dual_domain_supervised-claude-agentic", "campaign": "search-20260703-01", "cfg_full": {"batch_size": 1, "epochs": 32, "grad_clip": 1.0, "lambda_neg": 1.0, "lr": 0.0005, "optimizer": "adam", "rationale": "iter-4 dual_domain_supervised on re-split Breast-CT (train3600/val200/test200, seed20260703), val=200. SIX-BOX vs the BEST config (iter-2 c16/ep20 hr=0.8372): (1) PRIOR: iter-1 hr=0.8095 (c16/ep10), iter-2 hr=0.8372 (c16/ep20, BEST), iter-3 hr=0.8243 (c32/ep20 \u2014 REGRESSED, 3x params no gain). (2) Failure mode: c=32 was over-parameterized (capacity is NOT the lever); revert to the winning c=16. Open question: is c16 still EPOCHS-limited beyond 20? The 10->20 step gave +0.028 hr. (3) ONE KNOB vs the best config: epochs 20 -> 32 (unet_c=16 is iter-2 value, lr/lambda_neg/grad_clip unchanged). (4) HYPOTHESIS: at c=16, raising epochs 20->32 lifts hr above 0.8372 because the 10->20 doubling was still improving and the supervised MSE likely keeps descending; expect hr ~0.84-0.85. If it plateaus, epochs is saturated and iter-5 pivots to lr. (5) BUDGET: iter-2 ep20=440s -> ep32 ~ 700s << 20 min (30-min sbatch wall; breast single shared projector). (6) iter-5 dispatched on landing. Artifacts (recon_raw.npz + model_ckpt.pt) saved via AGENT4CT_SAVE_RECON / AGENT4CT_MODEL_CKPT to this iter dir.", "seed": 42, "train_n": 400, "unet_c": 16, "val_chunk": 10, "val_n": 200}, "challenge": "breast_ct", "change_class": "architecture", "git_commit": null, "images": {"comparison": "runs/breast-ct-claude-agentic-dual-domain-supervised-search-20260703-01/iterations/iter-0004/comparison.png", "test_showcase": null, "valtest_showcase": null}, "iter": 4, "kept": true, "metrics": {"headroom": 0.8611617147397914, "headroom_std": 0.015260254509951545, "val_psnr": 53.47400665283203, "val_psnr_std": 1.5547767420854999, "val_rmse": 0.0007239425322040915, "val_rmse_std": 0.00012311402520330533, "val_ssim": 0.9987428188323975, "val_ssim_std": 0.00041996562420234916}, "model": "claude-opus-4-8-1m", "obs_path": "breast-ct-claude-agentic-dual-domain-supervised-search-20260703-01/iterations/iter-0004/observation.json", "obs_sha1": "120b5d097f93d45a5535e4c5a14c80949cfc9499", "params_M": 0.465762, "params_source": "observation", "rationale": "dual_domain_supervised-claude-agentic: unet_c=16, epochs=32, batch_size=1, lr=0.0005, optimizer=adam, lambda_neg=1.0, grad_clip=1.0, train_n=400, val_n=200, val_chunk=10, seed=42, rationale=iter-4 dual_domain_supervised on re-split Breast-CT (train3600/val200/test200, seed20260703), val=200. SIX-BOX vs the BEST config (iter-2 c16/ep20 hr=0.8372): (1) PRIOR: iter-1 hr=0.8095 (c16/ep10), iter-2 hr=0.8372 (c16/ep20, BEST), iter-3 hr=0.8243 (c32/ep20 \u2014 REGRESSED, 3x params no gain). (2) Failure mode: c=32 was over-parameterized (capacity is NOT the lever); revert to the winning c=16. Open question: is c16 still EPOCHS-limited beyond 20? The 10->20 step gave +0.028 hr. (3) ONE KNOB vs the best config: epochs 20 -> 32 (unet_c=16 is iter-2 value, lr/lambda_neg/grad_clip unchanged). (4) HYPOTHESIS: at c=16, raising epochs 20->32 lifts hr above 0.8372 because the 10->20 doubling was still improving and the supervised MSE likely keeps descending; expect hr ~0.84-0.85. If it plateaus, epochs is saturated and iter-5 pivots to lr. (5) BUDGET: iter-2 ep20=440s -> ep32 ~ 700s << 20 min (30-min sbatch wall; breast single shared projector). (6) iter-5 dispatched on landing. Artifacts (recon_raw.npz + model_ckpt.pt) saved via AGENT4CT_SAVE_RECON / AGENT4CT_MODEL_CKPT to this iter dir.", "run_id": "breast-ct-claude-agentic-dual-domain-supervised-search-20260703-01", "runtime": {"elapsed_s": 838.1706871986389}, "schema_version": 3, "solver_key": "dual-domain-supervised", "solver_name": "DD-UNet supervised L2", "split": {"train_n": 400, "val_n": 200}, "status": "keep", "ts": "2026-07-03T20:38:06Z"}
{"advice_for_others": "dual_domain_supervised-claude-agentic: unet_c=16, epochs=44, batch_size=1, lr=0.0005, optimizer=adam, lambda_neg=1.0, grad_clip=1.0, train_n=400, val_n=200, val_chunk=10, seed=42, rationale=iter-5 dual_domain_supervised on re-split Breast-CT (train3600/val200/test200, seed20260703), val=200. SIX-BOX vs BEST (iter-4 c16/ep32/lr5e-4 hr=0.8612): (1) PRIOR: hr vs epochs at c=16 is monotone rising -- ep10=0.8095, ep20=0.8372, ep32=0.8612 (+0.028 then +0.024, still climbing); c=32 (iter-3) REGRESSED to 0.8243 so capacity is not the lever. (2) Failure mode: none; the epochs trend has NOT plateaued at ep32 (per-epoch gain still ~healthy), so the supervised L2 fit is likely still improving. (3) ONE KNOB: epochs 32 -> 44 (c=16/lr=5e-4/lambda_neg=1.0/grad_clip=1.0 all held at the iter-4 winning values). (4) HYPOTHESIS: raising epochs 32->44 lifts val headroom above 0.8612 because the hr-vs-epochs curve is still rising at ep32 with no plateau; expect hr ~0.87. (5) BUDGET: iter-4 ep32=838s -> ep44 ~ 1150s ~ 19 min compute, safely inside the HARD 20-min budget and the 30-min sbatch wall (chose 44 not 48 to keep margin; ep48 would risk ~21 min). breast uses one shared PYRO-NN projector, FBP batched. (6) FINAL iter of this 5-iter search. Artifacts recon_raw.npz + model_ckpt.pt saved to this iter dir via AGENT4CT_SAVE_RECON / AGENT4CT_MODEL_CKPT.", "agent": "dual_domain_supervised-claude-agentic", "campaign": "search-20260703-01", "cfg_full": {"batch_size": 1, "epochs": 44, "grad_clip": 1.0, "lambda_neg": 1.0, "lr": 0.0005, "optimizer": "adam", "rationale": "iter-5 dual_domain_supervised on re-split Breast-CT (train3600/val200/test200, seed20260703), val=200. SIX-BOX vs BEST (iter-4 c16/ep32/lr5e-4 hr=0.8612): (1) PRIOR: hr vs epochs at c=16 is monotone rising -- ep10=0.8095, ep20=0.8372, ep32=0.8612 (+0.028 then +0.024, still climbing); c=32 (iter-3) REGRESSED to 0.8243 so capacity is not the lever. (2) Failure mode: none; the epochs trend has NOT plateaued at ep32 (per-epoch gain still ~healthy), so the supervised L2 fit is likely still improving. (3) ONE KNOB: epochs 32 -> 44 (c=16/lr=5e-4/lambda_neg=1.0/grad_clip=1.0 all held at the iter-4 winning values). (4) HYPOTHESIS: raising epochs 32->44 lifts val headroom above 0.8612 because the hr-vs-epochs curve is still rising at ep32 with no plateau; expect hr ~0.87. (5) BUDGET: iter-4 ep32=838s -> ep44 ~ 1150s ~ 19 min compute, safely inside the HARD 20-min budget and the 30-min sbatch wall (chose 44 not 48 to keep margin; ep48 would risk ~21 min). breast uses one shared PYRO-NN projector, FBP batched. (6) FINAL iter of this 5-iter search. Artifacts recon_raw.npz + model_ckpt.pt saved to this iter dir via AGENT4CT_SAVE_RECON / AGENT4CT_MODEL_CKPT.", "seed": 42, "train_n": 400, "unet_c": 16, "val_chunk": 10, "val_n": 200}, "challenge": "breast_ct", "change_class": "architecture", "git_commit": null, "images": {"comparison": "runs/breast-ct-claude-agentic-dual-domain-supervised-search-20260703-01/iterations/iter-0005/comparison.png", "test_showcase": null, "valtest_showcase": null}, "iter": 5, "kept": true, "metrics": {"headroom": 0.8797650191639382, "headroom_std": 0.01331717392641435, "val_psnr": 54.72357940673828, "val_psnr_std": 1.5456910914557265, "val_rmse": 0.0006269395817071199, "val_rmse_std": 0.00010667752541236112, "val_ssim": 0.9989693760871887, "val_ssim_std": 0.00032682782967789883}, "model": "claude-opus-4-8-1m", "obs_path": "breast-ct-claude-agentic-dual-domain-supervised-search-20260703-01/iterations/iter-0005/observation.json", "obs_sha1": "8f84e7fd15fb4d6622f3dfda8c019d5c23cdd0aa", "params_M": 0.465762, "params_source": "observation", "rationale": "dual_domain_supervised-claude-agentic: unet_c=16, epochs=44, batch_size=1, lr=0.0005, optimizer=adam, lambda_neg=1.0, grad_clip=1.0, train_n=400, val_n=200, val_chunk=10, seed=42, rationale=iter-5 dual_domain_supervised on re-split Breast-CT (train3600/val200/test200, seed20260703), val=200. SIX-BOX vs BEST (iter-4 c16/ep32/lr5e-4 hr=0.8612): (1) PRIOR: hr vs epochs at c=16 is monotone rising -- ep10=0.8095, ep20=0.8372, ep32=0.8612 (+0.028 then +0.024, still climbing); c=32 (iter-3) REGRESSED to 0.8243 so capacity is not the lever. (2) Failure mode: none; the epochs trend has NOT plateaued at ep32 (per-epoch gain still ~healthy), so the supervised L2 fit is likely still improving. (3) ONE KNOB: epochs 32 -> 44 (c=16/lr=5e-4/lambda_neg=1.0/grad_clip=1.0 all held at the iter-4 winning values). (4) HYPOTHESIS: raising epochs 32->44 lifts val headroom above 0.8612 because the hr-vs-epochs curve is still rising at ep32 with no plateau; expect hr ~0.87. (5) BUDGET: iter-4 ep32=838s -> ep44 ~ 1150s ~ 19 min compute, safely inside the HARD 20-min budget and the 30-min sbatch wall (chose 44 not 48 to keep margin; ep48 would risk ~21 min). breast uses one shared PYRO-NN projector, FBP batched. (6) FINAL iter of this 5-iter search. Artifacts recon_raw.npz + model_ckpt.pt saved to this iter dir via AGENT4CT_SAVE_RECON / AGENT4CT_MODEL_CKPT.", "run_id": "breast-ct-claude-agentic-dual-domain-supervised-search-20260703-01", "runtime": {"elapsed_s": 1107.7427158355713}, "schema_version": 3, "solver_key": "dual-domain-supervised", "solver_name": "DD-UNet supervised L2", "split": {"train_n": 400, "val_n": 200}, "status": "keep", "ts": "2026-07-03T21:28:59Z"}
