{"advice_for_others": "hammernik_vn-claude-agentic: train_n=200, val_n=200, epochs=15, batch_size=2, lr=0.0035, vn_T=3, vn_n_filters=32, vn_kernel=7, vn_n_bumps=31, vn_lambda_init=0.01, grad_clip=1.0, vn_init=fbp, vn_dc_norm=True, vn_checkpoint=True, max_train_s=1080, rationale=iter-15 (one knob: add grad_clip=1.0 at lr=3.5e-3). lr=3.5e-3 DIVERGED (RMSE 1.6e8) but the pre-cliff lr trend was still rising toward the 2.4e-3 peak (0.5766) -> instability, not a true optimum, capped us. Hypothesis: grad_clip=1.0 tames the explosion and lets the rising lr trend continue -> hr>0.5766; if clipping over-constrains, lands below.", "agent": "hammernik_vn-claude-agentic", "campaign": "search-20260703-01", "cfg_full": {"batch_size": 2, "epochs": 15, "grad_clip": 1.0, "lr": 0.0035, "max_train_s": 1080, "rationale": "iter-15 (one knob: add grad_clip=1.0 at lr=3.5e-3). lr=3.5e-3 DIVERGED (RMSE 1.6e8) but the pre-cliff lr trend was still rising toward the 2.4e-3 peak (0.5766) -> instability, not a true optimum, capped us. Hypothesis: grad_clip=1.0 tames the explosion and lets the rising lr trend continue -> hr>0.5766; if clipping over-constrains, lands below.", "train_n": 200, "val_n": 200, "vn_T": 3, "vn_checkpoint": true, "vn_dc_norm": true, "vn_init": "fbp", "vn_kernel": 7, "vn_lambda_init": 0.01, "vn_n_bumps": 31, "vn_n_filters": 32}, "challenge": "breast_ct", "change_class": "architecture", "git_commit": "671da566", "images": {"comparison": "runs/breast-ct-claude-agentic-hammernik-vn-search-20260703-01/iterations/iter-0015/comparison.png", "test_showcase": null, "valtest_showcase": null}, "iter": 15, "kept": false, "metrics": {"headroom": 0.0, "headroom_std": 0.0, "val_psnr": 34.171268463134766, "val_psnr_std": 0.22794253320966062, "val_rmse": 0.006680993363261223, "val_rmse_std": 0.0001378706291794532, "val_ssim": 0.9406960010528564, "val_ssim_std": 0.004539805479247481}, "model": "claude-opus-4-8-1m", "obs_path": "breast-ct-claude-agentic-hammernik-vn-search-20260703-01/iterations/iter-0015/observation.json", "obs_sha1": "bcd161c9a6c11bbad9135c126fdc28a09fccb89f", "params_M": 0.007683, "params_source": "observation", "rationale": "hammernik_vn-claude-agentic: train_n=200, val_n=200, epochs=15, batch_size=2, lr=0.0035, vn_T=3, vn_n_filters=32, vn_kernel=7, vn_n_bumps=31, vn_lambda_init=0.01, grad_clip=1.0, vn_init=fbp, vn_dc_norm=True, vn_checkpoint=True, max_train_s=1080, rationale=iter-15 (one knob: add grad_clip=1.0 at lr=3.5e-3). lr=3.5e-3 DIVERGED (RMSE 1.6e8) but the pre-cliff lr trend was still rising toward the 2.4e-3 peak (0.5766) -> instability, not a true optimum, capped us. Hypothesis: grad_clip=1.0 tames the explosion and lets the rising lr trend continue -> hr>0.5766; if clipping over-constrains, lands below.", "run_id": "breast-ct-claude-agentic-hammernik-vn-search-20260703-01", "runtime": {"elapsed_s": 957.8417773246765}, "schema_version": 3, "solver_key": "hammernik-vn", "solver_name": "Hammernik VN (MRI port)", "split": {"train_n": 200, "val_n": 200}, "status": "discard", "ts": "2026-07-05T10:27:40Z"}
{"advice_for_others": "hammernik_vn-claude-agentic: train_n=200, val_n=200, epochs=15, batch_size=2, lr=0.002, vn_T=3, vn_n_filters=32, vn_kernel=7, vn_n_bumps=31, vn_lambda_init=0.01, vn_init=fbp, vn_dc_norm=True, vn_checkpoint=True, max_train_s=1080, rationale=iter-16 (one knob: lr 2.4e-3 -> 2.0e-3). grad_clip did NOT rescue lr=3.5e-3 (stabilized but hr=0, worse than FBP) -> lr peak is a stability edge at 2.4e-3. Refine just below to confirm 2.4e-3 is near-peak. Hypothesis: 2.0e-3 lands slightly below or above 0.5766, pinning the lr optimum.", "agent": "hammernik_vn-claude-agentic", "campaign": "search-20260703-01", "cfg_full": {"batch_size": 2, "epochs": 15, "lr": 0.002, "max_train_s": 1080, "rationale": "iter-16 (one knob: lr 2.4e-3 -> 2.0e-3). grad_clip did NOT rescue lr=3.5e-3 (stabilized but hr=0, worse than FBP) -> lr peak is a stability edge at 2.4e-3. Refine just below to confirm 2.4e-3 is near-peak. Hypothesis: 2.0e-3 lands slightly below or above 0.5766, pinning the lr optimum.", "train_n": 200, "val_n": 200, "vn_T": 3, "vn_checkpoint": true, "vn_dc_norm": true, "vn_init": "fbp", "vn_kernel": 7, "vn_lambda_init": 0.01, "vn_n_bumps": 31, "vn_n_filters": 32}, "challenge": "breast_ct", "change_class": "architecture", "git_commit": "671da566", "images": {"comparison": "runs/breast-ct-claude-agentic-hammernik-vn-search-20260703-01/iterations/iter-0016/comparison.png", "test_showcase": null, "valtest_showcase": null}, "iter": 16, "kept": true, "metrics": {"headroom": 0.590998115755097, "headroom_std": 0.01355701894019108, "val_psnr": 44.089691162109375, "val_psnr_std": 0.7691728964807162, "val_rmse": 0.00213265186175704, "val_rmse_std": 0.0001903903765953682, "val_ssim": 0.9869192838668823, "val_ssim_std": 0.002188498218206403}, "model": "claude-opus-4-8-1m", "obs_path": "breast-ct-claude-agentic-hammernik-vn-search-20260703-01/iterations/iter-0016/observation.json", "obs_sha1": "22305814db5fe4ea85fe1ca57c655e835362d13b", "params_M": 0.007683, "params_source": "observation", "rationale": "hammernik_vn-claude-agentic: train_n=200, val_n=200, epochs=15, batch_size=2, lr=0.002, vn_T=3, vn_n_filters=32, vn_kernel=7, vn_n_bumps=31, vn_lambda_init=0.01, vn_init=fbp, vn_dc_norm=True, vn_checkpoint=True, max_train_s=1080, rationale=iter-16 (one knob: lr 2.4e-3 -> 2.0e-3). grad_clip did NOT rescue lr=3.5e-3 (stabilized but hr=0, worse than FBP) -> lr peak is a stability edge at 2.4e-3. Refine just below to confirm 2.4e-3 is near-peak. Hypothesis: 2.0e-3 lands slightly below or above 0.5766, pinning the lr optimum.", "run_id": "breast-ct-claude-agentic-hammernik-vn-search-20260703-01", "runtime": {"elapsed_s": 958.595418214798}, "schema_version": 3, "solver_key": "hammernik-vn", "solver_name": "Hammernik VN (MRI port)", "split": {"train_n": 200, "val_n": 200}, "status": "keep", "ts": "2026-07-05T11:26:12Z"}
{"advice_for_others": "hammernik_vn-claude-agentic: train_n=200, val_n=200, epochs=15, batch_size=2, lr=0.0016, vn_T=3, vn_n_filters=32, vn_kernel=7, vn_n_bumps=31, vn_lambda_init=0.01, vn_init=fbp, vn_dc_norm=True, vn_checkpoint=True, max_train_s=1080, rationale=iter-17 (one knob: lr 2.0e-3 -> 1.6e-3). iter-16 found lr=2.0e-3 (0.5910) beats 2.4e-3 (0.5766) -> true lr peak is ~2.0e-3, below the earlier bracket. Probe the low midpoint. Hypothesis: 1.6e-3 lands just below 0.5910 (peak ~2.0e-3) or above (peak <2.0e-3).", "agent": "hammernik_vn-claude-agentic", "campaign": "search-20260703-01", "cfg_full": {"batch_size": 2, "epochs": 15, "lr": 0.0016, "max_train_s": 1080, "rationale": "iter-17 (one knob: lr 2.0e-3 -> 1.6e-3). iter-16 found lr=2.0e-3 (0.5910) beats 2.4e-3 (0.5766) -> true lr peak is ~2.0e-3, below the earlier bracket. Probe the low midpoint. Hypothesis: 1.6e-3 lands just below 0.5910 (peak ~2.0e-3) or above (peak <2.0e-3).", "train_n": 200, "val_n": 200, "vn_T": 3, "vn_checkpoint": true, "vn_dc_norm": true, "vn_init": "fbp", "vn_kernel": 7, "vn_lambda_init": 0.01, "vn_n_bumps": 31, "vn_n_filters": 32}, "challenge": "breast_ct", "change_class": "architecture", "git_commit": "671da566", "images": {"comparison": "runs/breast-ct-claude-agentic-hammernik-vn-search-20260703-01/iterations/iter-0017/comparison.png", "test_showcase": null, "valtest_showcase": null}, "iter": 17, "kept": true, "metrics": {"headroom": 0.5714817270039113, "headroom_std": 0.012531443102357771, "val_psnr": 43.68480682373047, "val_psnr_std": 0.7587254082123405, "val_rmse": 0.002234415849670768, "val_rmse_std": 0.00019379254932228092, "val_ssim": 0.9852938652038574, "val_ssim_std": 0.002338940079507882}, "model": "claude-opus-4-8-1m", "obs_path": "breast-ct-claude-agentic-hammernik-vn-search-20260703-01/iterations/iter-0017/observation.json", "obs_sha1": "517031607c1b33f534de0830ecac65d353f5a227", "params_M": 0.007683, "params_source": "observation", "rationale": "hammernik_vn-claude-agentic: train_n=200, val_n=200, epochs=15, batch_size=2, lr=0.0016, vn_T=3, vn_n_filters=32, vn_kernel=7, vn_n_bumps=31, vn_lambda_init=0.01, vn_init=fbp, vn_dc_norm=True, vn_checkpoint=True, max_train_s=1080, rationale=iter-17 (one knob: lr 2.0e-3 -> 1.6e-3). iter-16 found lr=2.0e-3 (0.5910) beats 2.4e-3 (0.5766) -> true lr peak is ~2.0e-3, below the earlier bracket. Probe the low midpoint. Hypothesis: 1.6e-3 lands just below 0.5910 (peak ~2.0e-3) or above (peak <2.0e-3).", "run_id": "breast-ct-claude-agentic-hammernik-vn-search-20260703-01", "runtime": {"elapsed_s": 960.0254666805267}, "schema_version": 3, "solver_key": "hammernik-vn", "solver_name": "Hammernik VN (MRI port)", "split": {"train_n": 200, "val_n": 200}, "status": "keep", "ts": "2026-07-05T12:26:13Z"}
{"advice_for_others": "hammernik_vn-claude-agentic: train_n=200, val_n=200, epochs=15, batch_size=2, lr=0.002, vn_T=3, vn_n_filters=32, vn_kernel=7, vn_n_bumps=63, vn_lambda_init=0.01, vn_init=fbp, vn_dc_norm=True, vn_checkpoint=True, max_train_s=1080, rationale=iter-18 (one knob: vn_n_bumps 31 -> 63, at the locked optimum lr=2.0e-3/lambda=1e-2). lr peak pinned at 2.0e-3 (0.5910); capacity/lr/lambda axes exhausted. Probe the regularisers RBF-activation resolution. Hypothesis: finer learned nonlinearity models sharper breast edges -> hr>0.5910; if it overfits 200 samples, 31 stays.", "agent": "hammernik_vn-claude-agentic", "campaign": "search-20260703-01", "cfg_full": {"batch_size": 2, "epochs": 15, "lr": 0.002, "max_train_s": 1080, "rationale": "iter-18 (one knob: vn_n_bumps 31 -> 63, at the locked optimum lr=2.0e-3/lambda=1e-2). lr peak pinned at 2.0e-3 (0.5910); capacity/lr/lambda axes exhausted. Probe the regularisers RBF-activation resolution. Hypothesis: finer learned nonlinearity models sharper breast edges -> hr>0.5910; if it overfits 200 samples, 31 stays.", "train_n": 200, "val_n": 200, "vn_T": 3, "vn_checkpoint": true, "vn_dc_norm": true, "vn_init": "fbp", "vn_kernel": 7, "vn_lambda_init": 0.01, "vn_n_bumps": 63, "vn_n_filters": 32}, "challenge": "breast_ct", "change_class": "architecture", "git_commit": "671da566", "images": {"comparison": null, "test_showcase": null, "valtest_showcase": null}, "iter": 18, "kept": false, "metrics": {"headroom": 0.0, "headroom_std": null, "val_psnr": null, "val_psnr_std": null, "val_rmse": null, "val_rmse_std": null, "val_ssim": null, "val_ssim_std": null}, "model": "claude-opus-4-8-1m", "obs_path": "breast-ct-claude-agentic-hammernik-vn-search-20260703-01/iterations/iter-0018/observation.json", "obs_sha1": "411fbcc5f0e1e69a42b37d759dd66dfaa2150b40", "params_M": null, "params_source": "none", "rationale": "hammernik_vn-claude-agentic: train_n=200, val_n=200, epochs=15, batch_size=2, lr=0.002, vn_T=3, vn_n_filters=32, vn_kernel=7, vn_n_bumps=63, vn_lambda_init=0.01, vn_init=fbp, vn_dc_norm=True, vn_checkpoint=True, max_train_s=1080, rationale=iter-18 (one knob: vn_n_bumps 31 -> 63, at the locked optimum lr=2.0e-3/lambda=1e-2). lr peak pinned at 2.0e-3 (0.5910); capacity/lr/lambda axes exhausted. Probe the regularisers RBF-activation resolution. Hypothesis: finer learned nonlinearity models sharper breast edges -> hr>0.5910; if it overfits 200 samples, 31 stays.", "run_id": "breast-ct-claude-agentic-hammernik-vn-search-20260703-01", "runtime": {"elapsed_s": 10.178092956542969}, "schema_version": 3, "solver_key": "hammernik-vn", "solver_name": "Hammernik VN (MRI port)", "split": {"train_n": 200, "val_n": 100}, "status": "discard", "ts": "2026-07-05T13:10:56Z"}
{"advice_for_others": "hammernik_vn-claude-agentic: train_n=200, val_n=200, epochs=15, batch_size=2, lr=0.002, vn_T=3, vn_n_filters=32, vn_kernel=7, vn_n_bumps=21, vn_lambda_init=0.01, vn_init=fbp, vn_dc_norm=True, vn_checkpoint=True, max_train_s=1080, rationale=iter-19 (one knob: vn_n_bumps 31 -> 21, at locked optimum lr=2.0e-3). n_bumps=63 DIVERGED (hr=0) -> the RBF activation over-parameterized. Probe the SMOOTHER opposite direction. Hypothesis: 21 bumps = smoother learned nonlinearity, better-regularized at 200 samples -> hr>=0.5910; if 31 was optimal, a small drop brackets it.", "agent": "hammernik_vn-claude-agentic", "campaign": "search-20260703-01", "cfg_full": {"batch_size": 2, "epochs": 15, "lr": 0.002, "max_train_s": 1080, "rationale": "iter-19 (one knob: vn_n_bumps 31 -> 21, at locked optimum lr=2.0e-3). n_bumps=63 DIVERGED (hr=0) -> the RBF activation over-parameterized. Probe the SMOOTHER opposite direction. Hypothesis: 21 bumps = smoother learned nonlinearity, better-regularized at 200 samples -> hr>=0.5910; if 31 was optimal, a small drop brackets it.", "train_n": 200, "val_n": 200, "vn_T": 3, "vn_checkpoint": true, "vn_dc_norm": true, "vn_init": "fbp", "vn_kernel": 7, "vn_lambda_init": 0.01, "vn_n_bumps": 21, "vn_n_filters": 32}, "challenge": "breast_ct", "change_class": "architecture", "git_commit": "671da566", "images": {"comparison": "runs/breast-ct-claude-agentic-hammernik-vn-search-20260703-01/iterations/iter-0019/comparison.png", "test_showcase": null, "valtest_showcase": null}, "iter": 19, "kept": true, "metrics": {"headroom": 0.5624332613029466, "headroom_std": 0.009400747575752495, "val_psnr": 43.5033073425293, "val_psnr_std": 0.6824962595383245, "val_rmse": 0.0022815971169620752, "val_rmse_std": 0.00017798571960030236, "val_ssim": 0.9820693135261536, "val_ssim_std": 0.002263351410842843}, "model": "claude-opus-4-8-1m", "obs_path": "breast-ct-claude-agentic-hammernik-vn-search-20260703-01/iterations/iter-0019/observation.json", "obs_sha1": "64a6443356df906275594fa313542013f0c8670d", "params_M": 0.006723, "params_source": "observation", "rationale": "hammernik_vn-claude-agentic: train_n=200, val_n=200, epochs=15, batch_size=2, lr=0.002, vn_T=3, vn_n_filters=32, vn_kernel=7, vn_n_bumps=21, vn_lambda_init=0.01, vn_init=fbp, vn_dc_norm=True, vn_checkpoint=True, max_train_s=1080, rationale=iter-19 (one knob: vn_n_bumps 31 -> 21, at locked optimum lr=2.0e-3). n_bumps=63 DIVERGED (hr=0) -> the RBF activation over-parameterized. Probe the SMOOTHER opposite direction. Hypothesis: 21 bumps = smoother learned nonlinearity, better-regularized at 200 samples -> hr>=0.5910; if 31 was optimal, a small drop brackets it.", "run_id": "breast-ct-claude-agentic-hammernik-vn-search-20260703-01", "runtime": {"elapsed_s": 991.3650271892548}, "schema_version": 3, "solver_key": "hammernik-vn", "solver_name": "Hammernik VN (MRI port)", "split": {"train_n": 200, "val_n": 200}, "status": "keep", "ts": "2026-07-05T14:38:00Z"}
{"advice_for_others": "hammernik_vn-claude-agentic: train_n=200, val_n=200, epochs=15, batch_size=2, lr=0.002, vn_T=3, vn_n_filters=32, vn_kernel=7, vn_n_bumps=31, vn_lambda_init=0.01, vn_filter_init_std=0.1, vn_init=fbp, vn_dc_norm=True, vn_checkpoint=True, max_train_s=1080, rationale=iter-20 FINAL (one knob: vn_filter_init_std 0.05 -> 0.1, at locked optimum). All other axes exhausted (lr peak 2.0e-3->0.5910; n_bumps 31 optimal; capacity bumps hurt). Last unprobed lever: filter init scale. Hypothesis: richer initial filter diversity helps the active regulariser break symmetry within the wall-limited ~12 epochs -> hr>0.5910; else 0.05 stays.", "agent": "hammernik_vn-claude-agentic", "campaign": "search-20260703-01", "cfg_full": {"batch_size": 2, "epochs": 15, "lr": 0.002, "max_train_s": 1080, "rationale": "iter-20 FINAL (one knob: vn_filter_init_std 0.05 -> 0.1, at locked optimum). All other axes exhausted (lr peak 2.0e-3->0.5910; n_bumps 31 optimal; capacity bumps hurt). Last unprobed lever: filter init scale. Hypothesis: richer initial filter diversity helps the active regulariser break symmetry within the wall-limited ~12 epochs -> hr>0.5910; else 0.05 stays.", "train_n": 200, "val_n": 200, "vn_T": 3, "vn_checkpoint": true, "vn_dc_norm": true, "vn_filter_init_std": 0.1, "vn_init": "fbp", "vn_kernel": 7, "vn_lambda_init": 0.01, "vn_n_bumps": 31, "vn_n_filters": 32}, "challenge": "breast_ct", "change_class": "architecture", "git_commit": "671da566", "images": {"comparison": "runs/breast-ct-claude-agentic-hammernik-vn-search-20260703-01/iterations/iter-0020/comparison.png", "test_showcase": null, "valtest_showcase": null}, "iter": 20, "kept": true, "metrics": {"headroom": 0.5242222231946538, "headroom_std": 0.011083948797088364, "val_psnr": 42.7761116027832, "val_psnr_std": 0.7184896983539564, "val_rmse": 0.0024808403104543686, "val_rmse_std": 0.0002024152458390263, "val_ssim": 0.9807502031326294, "val_ssim_std": 0.0028390788963571496}, "model": "claude-opus-4-8-1m", "obs_path": "breast-ct-claude-agentic-hammernik-vn-search-20260703-01/iterations/iter-0020/observation.json", "obs_sha1": "3964bad342f48172a96f0323406c30189a37f488", "params_M": 0.007683, "params_source": "observation", "rationale": "hammernik_vn-claude-agentic: train_n=200, val_n=200, epochs=15, batch_size=2, lr=0.002, vn_T=3, vn_n_filters=32, vn_kernel=7, vn_n_bumps=31, vn_lambda_init=0.01, vn_filter_init_std=0.1, vn_init=fbp, vn_dc_norm=True, vn_checkpoint=True, max_train_s=1080, rationale=iter-20 FINAL (one knob: vn_filter_init_std 0.05 -> 0.1, at locked optimum). All other axes exhausted (lr peak 2.0e-3->0.5910; n_bumps 31 optimal; capacity bumps hurt). Last unprobed lever: filter init scale. Hypothesis: richer initial filter diversity helps the active regulariser break symmetry within the wall-limited ~12 epochs -> hr>0.5910; else 0.05 stays.", "run_id": "breast-ct-claude-agentic-hammernik-vn-search-20260703-01", "runtime": {"elapsed_s": 1216.6177611351013}, "schema_version": 3, "solver_key": "hammernik-vn", "solver_name": "Hammernik VN (MRI port)", "split": {"train_n": 200, "val_n": 200}, "status": "keep", "ts": "2026-07-05T15:34:01Z"}
