{"advice_for_others": "hammernik_2017-claude-agentic: vn_T=5, vn_n_filters=16, vn_kernel=9, vn_n_bumps=31, vn_x_range=2.0, vn_filter_init_std=0.05, vn_rbf_init_std=0.01, vn_lambda_init=0.02, epochs=20, batch_size=2, lr=0.0005, grad_clip=1.0, train_n=400, val_n=200, seed=42, max_train_s=1500, rationale=iter-8 (six-box; RE-DISPATCH cheaper after TIMEOUT). First attempt (T=5,f=16,ep=24,lr=5e-4,max_train_s=1680) was KILLED at the 30-min wall (elapsed 30:24, no obs) -- iter-6's identical-compute config ran 1732s, dangerously close to the 1800s kill, and iter-8 crossed it on a slower node before the epoch guard tripped. FINDING: T=5/ep=24 is not reproducibly budget-safe. FIX: keep the lr hypothesis, cut epochs 24->20 (DEPENDENT budget var, ~+200s margin) and tighten max_train_s 1680->1500 so the epoch loop breaks well before the kill. WIDTH axis falsified (iter-7 f=24 regressed); best=iter-6 (T=5,f=16,lambda=0.02, hr=0.6329). ONE KNOB vs iter-6: lr 9.6e-4 -> 5e-4 (~2x lower). HYPOTHESIS: a gentler lr lets the T=5 unroll settle into a lower-loss basin, hr > 0.6329; if it regresses, 9.6e-4 was already well-tuned. All else = iter-6 (T=5, f=16, kernel=9, n_bumps=31, x_range=2.0, lambda=0.02, batch=2, grad_clip=1.0, seed=42, train_n=400). VN plateaus early so ep=20 still converges. batch_size=2 (OOM guard); expandable_segments via --export.", "agent": "hammernik_2017-claude-agentic", "campaign": "search-20260703-01", "cfg_full": {"batch_size": 2, "epochs": 20, "grad_clip": 1.0, "lr": 0.0005, "max_train_s": 1500, "rationale": "iter-8 (six-box; RE-DISPATCH cheaper after TIMEOUT). First attempt (T=5,f=16,ep=24,lr=5e-4,max_train_s=1680) was KILLED at the 30-min wall (elapsed 30:24, no obs) -- iter-6's identical-compute config ran 1732s, dangerously close to the 1800s kill, and iter-8 crossed it on a slower node before the epoch guard tripped. FINDING: T=5/ep=24 is not reproducibly budget-safe. FIX: keep the lr hypothesis, cut epochs 24->20 (DEPENDENT budget var, ~+200s margin) and tighten max_train_s 1680->1500 so the epoch loop breaks well before the kill. WIDTH axis falsified (iter-7 f=24 regressed); best=iter-6 (T=5,f=16,lambda=0.02, hr=0.6329). ONE KNOB vs iter-6: lr 9.6e-4 -> 5e-4 (~2x lower). HYPOTHESIS: a gentler lr lets the T=5 unroll settle into a lower-loss basin, hr > 0.6329; if it regresses, 9.6e-4 was already well-tuned. All else = iter-6 (T=5, f=16, kernel=9, n_bumps=31, x_range=2.0, lambda=0.02, batch=2, grad_clip=1.0, seed=42, train_n=400). VN plateaus early so ep=20 still converges. batch_size=2 (OOM guard); expandable_segments via --export.", "seed": 42, "train_n": 400, "val_n": 200, "vn_T": 5, "vn_filter_init_std": 0.05, "vn_kernel": 9, "vn_lambda_init": 0.02, "vn_n_bumps": 31, "vn_n_filters": 16, "vn_rbf_init_std": 0.01, "vn_x_range": 2.0}, "challenge": "breast_ct", "change_class": "architecture", "git_commit": "671da566", "images": {"comparison": "runs/breast-ct-claude-agentic-hammernik-2017-search-20260703-01/iterations/iter-0008/comparison.png", "test_showcase": null, "valtest_showcase": null}, "iter": 8, "kept": true, "metrics": {"headroom": 0.5196546774488686, "headroom_std": null, "val_psnr": 42.69312286376953, "val_psnr_std": null, "val_rmse": 0.0025046567898243666, "val_rmse_std": null, "val_ssim": 0.9792042374610901, "val_ssim_std": null}, "model": "claude-opus-4-8-1m", "obs_path": "breast-ct-claude-agentic-hammernik-2017-search-20260703-01/iterations/iter-0008/observation.json", "obs_sha1": "b8b29a0fa55032979b9eaaa615c053da46c17247", "params_M": 0.008965, "params_source": "observation", "rationale": "hammernik_2017-claude-agentic: vn_T=5, vn_n_filters=16, vn_kernel=9, vn_n_bumps=31, vn_x_range=2.0, vn_filter_init_std=0.05, vn_rbf_init_std=0.01, vn_lambda_init=0.02, epochs=20, batch_size=2, lr=0.0005, grad_clip=1.0, train_n=400, val_n=200, seed=42, max_train_s=1500, rationale=iter-8 (six-box; RE-DISPATCH cheaper after TIMEOUT). First attempt (T=5,f=16,ep=24,lr=5e-4,max_train_s=1680) was KILLED at the 30-min wall (elapsed 30:24, no obs) -- iter-6's identical-compute config ran 1732s, dangerously close to the 1800s kill, and iter-8 crossed it on a slower node before the epoch guard tripped. FINDING: T=5/ep=24 is not reproducibly budget-safe. FIX: keep the lr hypothesis, cut epochs 24->20 (DEPENDENT budget var, ~+200s margin) and tighten max_train_s 1680->1500 so the epoch loop breaks well before the kill. WIDTH axis falsified (iter-7 f=24 regressed); best=iter-6 (T=5,f=16,lambda=0.02, hr=0.6329). ONE KNOB vs iter-6: lr 9.6e-4 -> 5e-4 (~2x lower). HYPOTHESIS: a gentler lr lets the T=5 unroll settle into a lower-loss basin, hr > 0.6329; if it regresses, 9.6e-4 was already well-tuned. All else = iter-6 (T=5, f=16, kernel=9, n_bumps=31, x_range=2.0, lambda=0.02, batch=2, grad_clip=1.0, seed=42, train_n=400). VN plateaus early so ep=20 still converges. batch_size=2 (OOM guard); expandable_segments via --export.", "run_id": "breast-ct-claude-agentic-hammernik-2017-search-20260703-01", "runtime": {"elapsed_s": 1622.5320115089417}, "schema_version": 3, "solver_key": "hammernik-2017", "solver_name": "Hammernik VN (2017)", "split": {"train_n": 400, "val_n": 200}, "status": "keep", "ts": "2026-07-04T21:37:48Z"}
{"advice_for_others": "hammernik_2017-claude-agentic: vn_T=5, vn_n_filters=16, vn_kernel=11, vn_n_bumps=31, vn_x_range=2.0, vn_filter_init_std=0.05, vn_rbf_init_std=0.01, vn_lambda_init=0.02, epochs=20, batch_size=2, lr=0.00096, grad_clip=1.0, train_n=400, val_n=200, seed=42, max_train_s=1500, rationale=iter-9 (six-box). AXES so far (best=iter-6 T=5,f=16,k=9,lambda=0.02,lr=9.6e-4, hr=0.6329): lambda optimum=0.02 (0.05 collapsed); depth T 3->4->5 helps (decelerating, T=5 best, budget-capped ep<=20); width f=16->24 REGRESSED (iter-7 0.5227); lr 9.6e-4->5e-4 REGRESSED (iter-8 0.5196, under-converges). lr and width exhausted. UNTESTED productive lever: receptive field. ONE KNOB vs iter-6: vn_kernel 9 -> 11 (larger analysis filters; paper's near-best k). HYPOTHESIS: sparse-view streaks are long-range; a wider kernel lets each filter capture them better, lifting hr above 0.6329; if it regresses, k=9 was sufficient or larger kernels over-smooth. All else = iter-6 (T=5, f=16, n_bumps=31, x_range=2.0, lambda=0.02, lr=9.6e-4, batch=2, grad_clip=1.0, seed=42, train_n=400) with ep=20/max_train_s=1500 (the budget-safe T=5 setting proven by iter-8-rerun at 1622s). k=11 ~1.5x conv cost but the RBF-bump loop dominates wall, so modest increase -> stays under the 1800s kill. batch_size=2 (OOM guard); expandable_segments via --export.", "agent": "hammernik_2017-claude-agentic", "campaign": "search-20260703-01", "cfg_full": {"batch_size": 2, "epochs": 20, "grad_clip": 1.0, "lr": 0.00096, "max_train_s": 1500, "rationale": "iter-9 (six-box). AXES so far (best=iter-6 T=5,f=16,k=9,lambda=0.02,lr=9.6e-4, hr=0.6329): lambda optimum=0.02 (0.05 collapsed); depth T 3->4->5 helps (decelerating, T=5 best, budget-capped ep<=20); width f=16->24 REGRESSED (iter-7 0.5227); lr 9.6e-4->5e-4 REGRESSED (iter-8 0.5196, under-converges). lr and width exhausted. UNTESTED productive lever: receptive field. ONE KNOB vs iter-6: vn_kernel 9 -> 11 (larger analysis filters; paper's near-best k). HYPOTHESIS: sparse-view streaks are long-range; a wider kernel lets each filter capture them better, lifting hr above 0.6329; if it regresses, k=9 was sufficient or larger kernels over-smooth. All else = iter-6 (T=5, f=16, n_bumps=31, x_range=2.0, lambda=0.02, lr=9.6e-4, batch=2, grad_clip=1.0, seed=42, train_n=400) with ep=20/max_train_s=1500 (the budget-safe T=5 setting proven by iter-8-rerun at 1622s). k=11 ~1.5x conv cost but the RBF-bump loop dominates wall, so modest increase -> stays under the 1800s kill. batch_size=2 (OOM guard); expandable_segments via --export.", "seed": 42, "train_n": 400, "val_n": 200, "vn_T": 5, "vn_filter_init_std": 0.05, "vn_kernel": 11, "vn_lambda_init": 0.02, "vn_n_bumps": 31, "vn_n_filters": 16, "vn_rbf_init_std": 0.01, "vn_x_range": 2.0}, "challenge": "breast_ct", "change_class": "architecture", "git_commit": "671da566", "images": {"comparison": "runs/breast-ct-claude-agentic-hammernik-2017-search-20260703-01/iterations/iter-0009/comparison.png", "test_showcase": null, "valtest_showcase": null}, "iter": 9, "kept": false, "metrics": {"headroom": 0.0, "headroom_std": null, "val_psnr": 20.109844207763672, "val_psnr_std": null, "val_rmse": 0.0337219163775444, "val_rmse_std": null, "val_ssim": 0.8102079033851624, "val_ssim_std": null}, "model": "claude-opus-4-8-1m", "obs_path": "breast-ct-claude-agentic-hammernik-2017-search-20260703-01/iterations/iter-0009/observation.json", "obs_sha1": "77c781227922af6562f6a058ca82275c748eb9fc", "params_M": 0.012165, "params_source": "observation", "rationale": "hammernik_2017-claude-agentic: vn_T=5, vn_n_filters=16, vn_kernel=11, vn_n_bumps=31, vn_x_range=2.0, vn_filter_init_std=0.05, vn_rbf_init_std=0.01, vn_lambda_init=0.02, epochs=20, batch_size=2, lr=0.00096, grad_clip=1.0, train_n=400, val_n=200, seed=42, max_train_s=1500, rationale=iter-9 (six-box). AXES so far (best=iter-6 T=5,f=16,k=9,lambda=0.02,lr=9.6e-4, hr=0.6329): lambda optimum=0.02 (0.05 collapsed); depth T 3->4->5 helps (decelerating, T=5 best, budget-capped ep<=20); width f=16->24 REGRESSED (iter-7 0.5227); lr 9.6e-4->5e-4 REGRESSED (iter-8 0.5196, under-converges). lr and width exhausted. UNTESTED productive lever: receptive field. ONE KNOB vs iter-6: vn_kernel 9 -> 11 (larger analysis filters; paper's near-best k). HYPOTHESIS: sparse-view streaks are long-range; a wider kernel lets each filter capture them better, lifting hr above 0.6329; if it regresses, k=9 was sufficient or larger kernels over-smooth. All else = iter-6 (T=5, f=16, n_bumps=31, x_range=2.0, lambda=0.02, lr=9.6e-4, batch=2, grad_clip=1.0, seed=42, train_n=400) with ep=20/max_train_s=1500 (the budget-safe T=5 setting proven by iter-8-rerun at 1622s). k=11 ~1.5x conv cost but the RBF-bump loop dominates wall, so modest increase -> stays under the 1800s kill. batch_size=2 (OOM guard); expandable_segments via --export.", "run_id": "breast-ct-claude-agentic-hammernik-2017-search-20260703-01", "runtime": {"elapsed_s": 1645.2927372455597}, "schema_version": 3, "solver_key": "hammernik-2017", "solver_name": "Hammernik VN (2017)", "split": {"train_n": 400, "val_n": 200}, "status": "discard", "ts": "2026-07-05T00:37:41Z"}
{"advice_for_others": "hammernik_2017-claude-agentic: vn_T=5, vn_n_filters=16, vn_kernel=9, vn_n_bumps=31, vn_x_range=3.0, vn_filter_init_std=0.05, vn_rbf_init_std=0.01, vn_lambda_init=0.02, epochs=20, batch_size=2, lr=0.00096, grad_clip=1.0, train_n=400, val_n=200, seed=42, max_train_s=1500, rationale=iter-10 (six-box). AXES MAPPED (best=iter-6 T=5,f=16,k=9,lambda=0.02,lr=9.6e-4, hr=0.6329): lambda opt=0.02 (0.05 collapsed); depth T=5 best (budget-capped); width f=24 REGRESSED (iter-7 0.5227); lr=5e-4 REGRESSED (iter-8 0.5196); kernel=11 COLLAPSED (iter-9 hr=0, SSIM 0.81<<FBP floor -- wider filters blow up the unroll dynamics). k=9 is the safe/best kernel. UNTESTED productive lever: the RBF activation grid domain. ONE KNOB vs iter-6: vn_x_range 2.0 -> 3.0 (widen the learned-nonlinearity input domain from [-2,2] to [-3,3]). HYPOTHESIS: if filter responses K_i*y saturate the [-2,2] RBF grid, extending to [-3,3] lets the learned activation rho'_i shape a wider response range, lifting hr above 0.6329; if it ties/regresses, activation range wasn't the limiter (bumps get spread thinner over a wider grid at fixed n_bumps=31). All else = iter-6 (T=5, f=16, k=9, n_bumps=31, lambda=0.02, lr=9.6e-4, batch=2, grad_clip=1.0, seed=42, train_n=400), ep=20/max_train_s=1500 (T=5-safe). BUDGET: x_range is FREE (same params/cost) -> ~1645s like iter-9, under the 1800s kill. batch_size=2 (OOM guard); expandable_segments via --export.", "agent": "hammernik_2017-claude-agentic", "campaign": "search-20260703-01", "cfg_full": {"batch_size": 2, "epochs": 20, "grad_clip": 1.0, "lr": 0.00096, "max_train_s": 1500, "rationale": "iter-10 (six-box). AXES MAPPED (best=iter-6 T=5,f=16,k=9,lambda=0.02,lr=9.6e-4, hr=0.6329): lambda opt=0.02 (0.05 collapsed); depth T=5 best (budget-capped); width f=24 REGRESSED (iter-7 0.5227); lr=5e-4 REGRESSED (iter-8 0.5196); kernel=11 COLLAPSED (iter-9 hr=0, SSIM 0.81<<FBP floor -- wider filters blow up the unroll dynamics). k=9 is the safe/best kernel. UNTESTED productive lever: the RBF activation grid domain. ONE KNOB vs iter-6: vn_x_range 2.0 -> 3.0 (widen the learned-nonlinearity input domain from [-2,2] to [-3,3]). HYPOTHESIS: if filter responses K_i*y saturate the [-2,2] RBF grid, extending to [-3,3] lets the learned activation rho'_i shape a wider response range, lifting hr above 0.6329; if it ties/regresses, activation range wasn't the limiter (bumps get spread thinner over a wider grid at fixed n_bumps=31). All else = iter-6 (T=5, f=16, k=9, n_bumps=31, lambda=0.02, lr=9.6e-4, batch=2, grad_clip=1.0, seed=42, train_n=400), ep=20/max_train_s=1500 (T=5-safe). BUDGET: x_range is FREE (same params/cost) -> ~1645s like iter-9, under the 1800s kill. batch_size=2 (OOM guard); expandable_segments via --export.", "seed": 42, "train_n": 400, "val_n": 200, "vn_T": 5, "vn_filter_init_std": 0.05, "vn_kernel": 9, "vn_lambda_init": 0.02, "vn_n_bumps": 31, "vn_n_filters": 16, "vn_rbf_init_std": 0.01, "vn_x_range": 3.0}, "challenge": "breast_ct", "change_class": "architecture", "git_commit": "671da566", "images": {"comparison": "runs/breast-ct-claude-agentic-hammernik-2017-search-20260703-01/iterations/iter-0010/comparison.png", "test_showcase": null, "valtest_showcase": null}, "iter": 10, "kept": true, "metrics": {"headroom": 0.5555578973295054, "headroom_std": null, "val_psnr": 43.367897033691406, "val_psnr_std": null, "val_rmse": 0.00231744721531868, "val_rmse_std": null, "val_ssim": 0.9840423464775085, "val_ssim_std": null}, "model": "claude-opus-4-8-1m", "obs_path": "breast-ct-claude-agentic-hammernik-2017-search-20260703-01/iterations/iter-0010/observation.json", "obs_sha1": "0b3e91d8f2a5f1d957b9eefac8b77b8cb2a66fd4", "params_M": 0.008965, "params_source": "observation", "rationale": "hammernik_2017-claude-agentic: vn_T=5, vn_n_filters=16, vn_kernel=9, vn_n_bumps=31, vn_x_range=3.0, vn_filter_init_std=0.05, vn_rbf_init_std=0.01, vn_lambda_init=0.02, epochs=20, batch_size=2, lr=0.00096, grad_clip=1.0, train_n=400, val_n=200, seed=42, max_train_s=1500, rationale=iter-10 (six-box). AXES MAPPED (best=iter-6 T=5,f=16,k=9,lambda=0.02,lr=9.6e-4, hr=0.6329): lambda opt=0.02 (0.05 collapsed); depth T=5 best (budget-capped); width f=24 REGRESSED (iter-7 0.5227); lr=5e-4 REGRESSED (iter-8 0.5196); kernel=11 COLLAPSED (iter-9 hr=0, SSIM 0.81<<FBP floor -- wider filters blow up the unroll dynamics). k=9 is the safe/best kernel. UNTESTED productive lever: the RBF activation grid domain. ONE KNOB vs iter-6: vn_x_range 2.0 -> 3.0 (widen the learned-nonlinearity input domain from [-2,2] to [-3,3]). HYPOTHESIS: if filter responses K_i*y saturate the [-2,2] RBF grid, extending to [-3,3] lets the learned activation rho'_i shape a wider response range, lifting hr above 0.6329; if it ties/regresses, activation range wasn't the limiter (bumps get spread thinner over a wider grid at fixed n_bumps=31). All else = iter-6 (T=5, f=16, k=9, n_bumps=31, lambda=0.02, lr=9.6e-4, batch=2, grad_clip=1.0, seed=42, train_n=400), ep=20/max_train_s=1500 (T=5-safe). BUDGET: x_range is FREE (same params/cost) -> ~1645s like iter-9, under the 1800s kill. batch_size=2 (OOM guard); expandable_segments via --export.", "run_id": "breast-ct-claude-agentic-hammernik-2017-search-20260703-01", "runtime": {"elapsed_s": 1627.9564225673676}, "schema_version": 3, "solver_key": "hammernik-2017", "solver_name": "Hammernik VN (2017)", "split": {"train_n": 400, "val_n": 200}, "status": "keep", "ts": "2026-07-05T02:37:52Z"}
{"advice_for_others": "hammernik_2017-claude-agentic: vn_T=4, vn_n_filters=16, vn_kernel=9, vn_n_bumps=31, vn_x_range=2.0, vn_filter_init_std=0.05, vn_rbf_init_std=0.01, vn_lambda_init=0.02, epochs=10, batch_size=2, lr=0.00096, grad_clip=1.0, train_n=800, val_n=200, seed=42, max_train_s=1500, rationale=iter-11 (six-box). iter-10 x_range=3.0 hr=0.5555 REGRESSED (31 bumps spread thin over [-3,3]). ALL single-knob deviations from iter-6 (best, hr=0.6329) regress: lambda 0.05 collapse, width f=24 (0.5227), lr 5e-4 (0.5196), kernel 11 (hr=0), x_range 3.0 (0.5555) -> iter-6 is a robust local optimum in ARCHITECTURE space. Remaining untested high-value axis: TRAINING DATA VOLUME (all iters so far used train_n=400). iter-2's train_n=1600 FAILED only due to wall-truncated epochs (under-training confound), NOT data itself. Test data CLEANLY at the cheaper T=4 base (iter-5: T=4,f=16, hr=0.6174, had budget headroom) so more data completes real epochs. ONE KNOB vs iter-5: train_n 400 -> 800 (2x). HYPOTHESIS: doubling train data reduces overfit of the learned analysis filters, lifting hr above iter-5's 0.6174 (and toward/past iter-6's 0.6329); tests whether DATA is the remaining lever. All else = iter-5 (T=4, f=16, k=9, n_bumps=31, x_range=2.0, lambda=0.02, lr=9.6e-4, batch=2, grad_clip=1.0, seed=42). BUDGET: epochs=10 DEPENDENT budget var so total steps 800*10/2=4000 ~= iter-5's 400*18/2=3600 -> matched wall ~1660s under the 1800s kill; max_train_s=1500 guards. batch_size=2 (OOM guard); expandable_segments via --export.", "agent": "hammernik_2017-claude-agentic", "campaign": "search-20260703-01", "cfg_full": {"batch_size": 2, "epochs": 10, "grad_clip": 1.0, "lr": 0.00096, "max_train_s": 1500, "rationale": "iter-11 (six-box). iter-10 x_range=3.0 hr=0.5555 REGRESSED (31 bumps spread thin over [-3,3]). ALL single-knob deviations from iter-6 (best, hr=0.6329) regress: lambda 0.05 collapse, width f=24 (0.5227), lr 5e-4 (0.5196), kernel 11 (hr=0), x_range 3.0 (0.5555) -> iter-6 is a robust local optimum in ARCHITECTURE space. Remaining untested high-value axis: TRAINING DATA VOLUME (all iters so far used train_n=400). iter-2's train_n=1600 FAILED only due to wall-truncated epochs (under-training confound), NOT data itself. Test data CLEANLY at the cheaper T=4 base (iter-5: T=4,f=16, hr=0.6174, had budget headroom) so more data completes real epochs. ONE KNOB vs iter-5: train_n 400 -> 800 (2x). HYPOTHESIS: doubling train data reduces overfit of the learned analysis filters, lifting hr above iter-5's 0.6174 (and toward/past iter-6's 0.6329); tests whether DATA is the remaining lever. All else = iter-5 (T=4, f=16, k=9, n_bumps=31, x_range=2.0, lambda=0.02, lr=9.6e-4, batch=2, grad_clip=1.0, seed=42). BUDGET: epochs=10 DEPENDENT budget var so total steps 800*10/2=4000 ~= iter-5's 400*18/2=3600 -> matched wall ~1660s under the 1800s kill; max_train_s=1500 guards. batch_size=2 (OOM guard); expandable_segments via --export.", "seed": 42, "train_n": 800, "val_n": 200, "vn_T": 4, "vn_filter_init_std": 0.05, "vn_kernel": 9, "vn_lambda_init": 0.02, "vn_n_bumps": 31, "vn_n_filters": 16, "vn_rbf_init_std": 0.01, "vn_x_range": 2.0}, "challenge": "breast_ct", "change_class": "architecture", "git_commit": "671da566", "images": {"comparison": "runs/breast-ct-claude-agentic-hammernik-2017-search-20260703-01/iterations/iter-0011/comparison.png", "test_showcase": null, "valtest_showcase": null}, "iter": 11, "kept": true, "metrics": {"headroom": 0.6258089129722479, "headroom_std": null, "val_psnr": 44.862327575683594, "val_psnr_std": null, "val_rmse": 0.0019511384889483452, "val_rmse_std": null, "val_ssim": 0.9894985556602478, "val_ssim_std": null}, "model": "claude-opus-4-8-1m", "obs_path": "breast-ct-claude-agentic-hammernik-2017-search-20260703-01/iterations/iter-0011/observation.json", "obs_sha1": "d9f8b236e7ac748da58ab191d641644f01213183", "params_M": 0.007172, "params_source": "observation", "rationale": "hammernik_2017-claude-agentic: vn_T=4, vn_n_filters=16, vn_kernel=9, vn_n_bumps=31, vn_x_range=2.0, vn_filter_init_std=0.05, vn_rbf_init_std=0.01, vn_lambda_init=0.02, epochs=10, batch_size=2, lr=0.00096, grad_clip=1.0, train_n=800, val_n=200, seed=42, max_train_s=1500, rationale=iter-11 (six-box). iter-10 x_range=3.0 hr=0.5555 REGRESSED (31 bumps spread thin over [-3,3]). ALL single-knob deviations from iter-6 (best, hr=0.6329) regress: lambda 0.05 collapse, width f=24 (0.5227), lr 5e-4 (0.5196), kernel 11 (hr=0), x_range 3.0 (0.5555) -> iter-6 is a robust local optimum in ARCHITECTURE space. Remaining untested high-value axis: TRAINING DATA VOLUME (all iters so far used train_n=400). iter-2's train_n=1600 FAILED only due to wall-truncated epochs (under-training confound), NOT data itself. Test data CLEANLY at the cheaper T=4 base (iter-5: T=4,f=16, hr=0.6174, had budget headroom) so more data completes real epochs. ONE KNOB vs iter-5: train_n 400 -> 800 (2x). HYPOTHESIS: doubling train data reduces overfit of the learned analysis filters, lifting hr above iter-5's 0.6174 (and toward/past iter-6's 0.6329); tests whether DATA is the remaining lever. All else = iter-5 (T=4, f=16, k=9, n_bumps=31, x_range=2.0, lambda=0.02, lr=9.6e-4, batch=2, grad_clip=1.0, seed=42). BUDGET: epochs=10 DEPENDENT budget var so total steps 800*10/2=4000 ~= iter-5's 400*18/2=3600 -> matched wall ~1660s under the 1800s kill; max_train_s=1500 guards. batch_size=2 (OOM guard); expandable_segments via --export.", "run_id": "breast-ct-claude-agentic-hammernik-2017-search-20260703-01", "runtime": {"elapsed_s": 1254.9013845920563}, "schema_version": 3, "solver_key": "hammernik-2017", "solver_name": "Hammernik VN (2017)", "split": {"train_n": 400, "val_n": 200}, "status": "keep", "ts": "2026-07-05T04:31:36Z"}
