{"advice_for_others": "dual_domain_bilateral_supervised-claude-agentic: proj_n_bf=1, img_n_bf=7, proj_kernel=3, proj_sx=0.01, proj_sy=0.3, proj_sr=0.0005, img_kernel=7, img_sx=0.5, img_sy=0.5, img_sr=0.02, epochs=10, batch_size=1, lr=0.01, optimizer=adam, lambda_neg=1.0, grad_clip=1.0, train_n=800, val_n=200, val_chunk=10, seed=46, rationale=iter-17 dual_domain_bilateral_supervised, re-split Breast-CT val=200. SIX-BOX at BEST config (img_n_bf7/img_kernel7/lr1e-2/lneg1.0/train_n800). (1) PRIOR: 4 seed replicates -- 42=0.2561,43=0.2538,44=0.2538,45=0.2564 -> mean~0.2550 std~0.0013 (seed45 new peak). Seed variance is SMALL (~0.001-0.002), confirming a robust ~0.255 BF optimum. (2) Failure mode: n=4 still modest; add seeds to solidify mean+-std. (3) ONE KNOB: seed 46 (5th replicate). (4) HYPOTHESIS: seed=46 lands ~0.253-0.257; n=5 gives mean ~0.255+-0.0013. (5) BUDGET: ~200s. (6) Loop to iter-20. Artifacts saved.", "agent": "dual_domain_bilateral_supervised-claude-agentic", "campaign": "search-20260703-01", "cfg_full": {"batch_size": 1, "epochs": 10, "grad_clip": 1.0, "img_kernel": 7, "img_n_bf": 7, "img_sr": 0.02, "img_sx": 0.5, "img_sy": 0.5, "lambda_neg": 1.0, "lr": 0.01, "optimizer": "adam", "proj_kernel": 3, "proj_n_bf": 1, "proj_sr": 0.0005, "proj_sx": 0.01, "proj_sy": 0.3, "rationale": "iter-17 dual_domain_bilateral_supervised, re-split Breast-CT val=200. SIX-BOX at BEST config (img_n_bf7/img_kernel7/lr1e-2/lneg1.0/train_n800). (1) PRIOR: 4 seed replicates -- 42=0.2561,43=0.2538,44=0.2538,45=0.2564 -> mean~0.2550 std~0.0013 (seed45 new peak). Seed variance is SMALL (~0.001-0.002), confirming a robust ~0.255 BF optimum. (2) Failure mode: n=4 still modest; add seeds to solidify mean+-std. (3) ONE KNOB: seed 46 (5th replicate). (4) HYPOTHESIS: seed=46 lands ~0.253-0.257; n=5 gives mean ~0.255+-0.0013. (5) BUDGET: ~200s. (6) Loop to iter-20. Artifacts saved.", "seed": 46, "train_n": 800, "val_chunk": 10, "val_n": 200}, "challenge": "breast_ct", "change_class": "architecture", "git_commit": "671da566", "images": {"comparison": "runs/breast-ct-claude-agentic-dual-domain-bilateral-supervised-search-20260703-01/iterations/iter-0017/comparison.png", "test_showcase": null, "valtest_showcase": null}, "iter": 17, "kept": true, "metrics": {"headroom": 0.254193067811294, "headroom_std": 0.009475351375978784, "val_psnr": 38.871665954589844, "val_psnr_std": 0.5852298349905917, "val_rmse": 0.0038888489361852407, "val_rmse_std": 0.0002554506956835358, "val_ssim": 0.9832944869995117, "val_ssim_std": 0.003133982758233555}, "model": "claude-opus-4-8-1m", "obs_path": "breast-ct-claude-agentic-dual-domain-bilateral-supervised-search-20260703-01/iterations/iter-0017/observation.json", "obs_sha1": "f16d0f7db7f9aa132bacf724ba516744e8e9ac19", "params_M": 2.4e-05, "params_source": "observation", "rationale": "dual_domain_bilateral_supervised-claude-agentic: proj_n_bf=1, img_n_bf=7, proj_kernel=3, proj_sx=0.01, proj_sy=0.3, proj_sr=0.0005, img_kernel=7, img_sx=0.5, img_sy=0.5, img_sr=0.02, epochs=10, batch_size=1, lr=0.01, optimizer=adam, lambda_neg=1.0, grad_clip=1.0, train_n=800, val_n=200, val_chunk=10, seed=46, rationale=iter-17 dual_domain_bilateral_supervised, re-split Breast-CT val=200. SIX-BOX at BEST config (img_n_bf7/img_kernel7/lr1e-2/lneg1.0/train_n800). (1) PRIOR: 4 seed replicates -- 42=0.2561,43=0.2538,44=0.2538,45=0.2564 -> mean~0.2550 std~0.0013 (seed45 new peak). Seed variance is SMALL (~0.001-0.002), confirming a robust ~0.255 BF optimum. (2) Failure mode: n=4 still modest; add seeds to solidify mean+-std. (3) ONE KNOB: seed 46 (5th replicate). (4) HYPOTHESIS: seed=46 lands ~0.253-0.257; n=5 gives mean ~0.255+-0.0013. (5) BUDGET: ~200s. (6) Loop to iter-20. Artifacts saved.", "run_id": "breast-ct-claude-agentic-dual-domain-bilateral-supervised-search-20260703-01", "runtime": {"elapsed_s": 727.7141845226288}, "schema_version": 3, "solver_key": "dual-domain-bilateral-supervised", "solver_name": "DD-BF supervised L2", "split": {"train_n": 400, "val_n": 200}, "status": "keep", "ts": "2026-07-05T19:00:29Z"}
{"advice_for_others": "dual_domain_bilateral_supervised-claude-agentic: proj_n_bf=1, img_n_bf=7, proj_kernel=3, proj_sx=0.01, proj_sy=0.3, proj_sr=0.0005, img_kernel=7, img_sx=0.5, img_sy=0.5, img_sr=0.02, epochs=10, batch_size=1, lr=0.01, optimizer=adam, lambda_neg=1.0, grad_clip=1.0, train_n=800, val_n=200, val_chunk=10, seed=47, rationale=iter-18 dual_domain_bilateral_supervised, re-split Breast-CT val=200. SIX-BOX at BEST config (img_n_bf7/img_kernel7/lr1e-2/lneg1.0/train_n800). (1) PRIOR: 5 seed replicates -- 42=0.2561,43=0.2538,44=0.2538,45=0.2564,46=0.2542 -> mean~0.2549 std~0.0012. Seed variance is SMALL and stable; the ~0.255 BF optimum is robust. (2) Failure mode: n=5 good; adding seeds tightens the reported std. (3) ONE KNOB: seed 47 (6th replicate). (4) HYPOTHESIS: seed=47 lands ~0.253-0.257; mean stays ~0.255+-0.0012. (5) BUDGET: ~200s. (6) Loop to iter-20. Artifacts saved.", "agent": "dual_domain_bilateral_supervised-claude-agentic", "campaign": "search-20260703-01", "cfg_full": {"batch_size": 1, "epochs": 10, "grad_clip": 1.0, "img_kernel": 7, "img_n_bf": 7, "img_sr": 0.02, "img_sx": 0.5, "img_sy": 0.5, "lambda_neg": 1.0, "lr": 0.01, "optimizer": "adam", "proj_kernel": 3, "proj_n_bf": 1, "proj_sr": 0.0005, "proj_sx": 0.01, "proj_sy": 0.3, "rationale": "iter-18 dual_domain_bilateral_supervised, re-split Breast-CT val=200. SIX-BOX at BEST config (img_n_bf7/img_kernel7/lr1e-2/lneg1.0/train_n800). (1) PRIOR: 5 seed replicates -- 42=0.2561,43=0.2538,44=0.2538,45=0.2564,46=0.2542 -> mean~0.2549 std~0.0012. Seed variance is SMALL and stable; the ~0.255 BF optimum is robust. (2) Failure mode: n=5 good; adding seeds tightens the reported std. (3) ONE KNOB: seed 47 (6th replicate). (4) HYPOTHESIS: seed=47 lands ~0.253-0.257; mean stays ~0.255+-0.0012. (5) BUDGET: ~200s. (6) Loop to iter-20. Artifacts saved.", "seed": 47, "train_n": 800, "val_chunk": 10, "val_n": 200}, "challenge": "breast_ct", "change_class": "architecture", "git_commit": "671da566", "images": {"comparison": "runs/breast-ct-claude-agentic-dual-domain-bilateral-supervised-search-20260703-01/iterations/iter-0018/comparison.png", "test_showcase": null, "valtest_showcase": null}, "iter": 18, "kept": true, "metrics": {"headroom": 0.25507240889087823, "headroom_std": 0.009450706784223486, "val_psnr": 38.88191604614258, "val_psnr_std": 0.584386367014947, "val_rmse": 0.003884263802319765, "val_rmse_std": 0.0002547916905520766, "val_ssim": 0.9832639098167419, "val_ssim_std": 0.0031373701107813836}, "model": "claude-opus-4-8-1m", "obs_path": "breast-ct-claude-agentic-dual-domain-bilateral-supervised-search-20260703-01/iterations/iter-0018/observation.json", "obs_sha1": "c35baef249fd8da6c85e23923cb0b9412b7239da", "params_M": 2.4e-05, "params_source": "observation", "rationale": "dual_domain_bilateral_supervised-claude-agentic: proj_n_bf=1, img_n_bf=7, proj_kernel=3, proj_sx=0.01, proj_sy=0.3, proj_sr=0.0005, img_kernel=7, img_sx=0.5, img_sy=0.5, img_sr=0.02, epochs=10, batch_size=1, lr=0.01, optimizer=adam, lambda_neg=1.0, grad_clip=1.0, train_n=800, val_n=200, val_chunk=10, seed=47, rationale=iter-18 dual_domain_bilateral_supervised, re-split Breast-CT val=200. SIX-BOX at BEST config (img_n_bf7/img_kernel7/lr1e-2/lneg1.0/train_n800). (1) PRIOR: 5 seed replicates -- 42=0.2561,43=0.2538,44=0.2538,45=0.2564,46=0.2542 -> mean~0.2549 std~0.0012. Seed variance is SMALL and stable; the ~0.255 BF optimum is robust. (2) Failure mode: n=5 good; adding seeds tightens the reported std. (3) ONE KNOB: seed 47 (6th replicate). (4) HYPOTHESIS: seed=47 lands ~0.253-0.257; mean stays ~0.255+-0.0012. (5) BUDGET: ~200s. (6) Loop to iter-20. Artifacts saved.", "run_id": "breast-ct-claude-agentic-dual-domain-bilateral-supervised-search-20260703-01", "runtime": {"elapsed_s": 741.8299534320831}, "schema_version": 3, "solver_key": "dual-domain-bilateral-supervised", "solver_name": "DD-BF supervised L2", "split": {"train_n": 400, "val_n": 200}, "status": "keep", "ts": "2026-07-05T19:17:03Z"}
{"advice_for_others": "dual_domain_bilateral_supervised-claude-agentic: proj_n_bf=1, img_n_bf=7, proj_kernel=3, proj_sx=0.01, proj_sy=0.3, proj_sr=0.0005, img_kernel=7, img_sx=0.5, img_sy=0.5, img_sr=0.02, epochs=10, batch_size=1, lr=0.01, optimizer=adam, lambda_neg=1.0, grad_clip=1.0, train_n=800, val_n=200, val_chunk=10, seed=48, rationale=iter-19 dual_domain_bilateral_supervised, re-split Breast-CT val=200. SIX-BOX at BEST config (img_n_bf7/img_kernel7/lr1e-2/lneg1.0/train_n800). (1) PRIOR: 6 seed replicates -- 42=0.2561,43=0.2538,44=0.2538,45=0.2564,46=0.2542,47=0.2551 -> mean~0.2549 std~0.0011. The BF optimum is highly seed-robust (~0.255 +- 0.001), in stark contrast to the sibling DD-UNet (~0.04 seed spread). (2) Failure mode: none; n=6 solid, add 2 more for n=8. (3) ONE KNOB: seed 48 (7th replicate). (4) HYPOTHESIS: seed=48 lands ~0.253-0.257; mean stays ~0.255+-0.001. (5) BUDGET: ~200s. (6) iter-20 = final 8th replicate. Artifacts saved.", "agent": "dual_domain_bilateral_supervised-claude-agentic", "campaign": "search-20260703-01", "cfg_full": {"batch_size": 1, "epochs": 10, "grad_clip": 1.0, "img_kernel": 7, "img_n_bf": 7, "img_sr": 0.02, "img_sx": 0.5, "img_sy": 0.5, "lambda_neg": 1.0, "lr": 0.01, "optimizer": "adam", "proj_kernel": 3, "proj_n_bf": 1, "proj_sr": 0.0005, "proj_sx": 0.01, "proj_sy": 0.3, "rationale": "iter-19 dual_domain_bilateral_supervised, re-split Breast-CT val=200. SIX-BOX at BEST config (img_n_bf7/img_kernel7/lr1e-2/lneg1.0/train_n800). (1) PRIOR: 6 seed replicates -- 42=0.2561,43=0.2538,44=0.2538,45=0.2564,46=0.2542,47=0.2551 -> mean~0.2549 std~0.0011. The BF optimum is highly seed-robust (~0.255 +- 0.001), in stark contrast to the sibling DD-UNet (~0.04 seed spread). (2) Failure mode: none; n=6 solid, add 2 more for n=8. (3) ONE KNOB: seed 48 (7th replicate). (4) HYPOTHESIS: seed=48 lands ~0.253-0.257; mean stays ~0.255+-0.001. (5) BUDGET: ~200s. (6) iter-20 = final 8th replicate. Artifacts saved.", "seed": 48, "train_n": 800, "val_chunk": 10, "val_n": 200}, "challenge": "breast_ct", "change_class": "architecture", "git_commit": "671da566", "images": {"comparison": "runs/breast-ct-claude-agentic-dual-domain-bilateral-supervised-search-20260703-01/iterations/iter-0019/comparison.png", "test_showcase": null, "valtest_showcase": null}, "iter": 19, "kept": true, "metrics": {"headroom": 0.25599568800033645, "headroom_std": 0.00957928897547392, "val_psnr": 38.89268493652344, "val_psnr_std": 0.582792969286266, "val_rmse": 0.003879449563100934, "val_rmse_std": 0.00025375196526388155, "val_ssim": 0.9835601449012756, "val_ssim_std": 0.0030919621222905286}, "model": "claude-opus-4-8-1m", "obs_path": "breast-ct-claude-agentic-dual-domain-bilateral-supervised-search-20260703-01/iterations/iter-0019/observation.json", "obs_sha1": "4f7652cb3fd55ee91f641519a5a3e819f0e56a02", "params_M": 2.4e-05, "params_source": "observation", "rationale": "dual_domain_bilateral_supervised-claude-agentic: proj_n_bf=1, img_n_bf=7, proj_kernel=3, proj_sx=0.01, proj_sy=0.3, proj_sr=0.0005, img_kernel=7, img_sx=0.5, img_sy=0.5, img_sr=0.02, epochs=10, batch_size=1, lr=0.01, optimizer=adam, lambda_neg=1.0, grad_clip=1.0, train_n=800, val_n=200, val_chunk=10, seed=48, rationale=iter-19 dual_domain_bilateral_supervised, re-split Breast-CT val=200. SIX-BOX at BEST config (img_n_bf7/img_kernel7/lr1e-2/lneg1.0/train_n800). (1) PRIOR: 6 seed replicates -- 42=0.2561,43=0.2538,44=0.2538,45=0.2564,46=0.2542,47=0.2551 -> mean~0.2549 std~0.0011. The BF optimum is highly seed-robust (~0.255 +- 0.001), in stark contrast to the sibling DD-UNet (~0.04 seed spread). (2) Failure mode: none; n=6 solid, add 2 more for n=8. (3) ONE KNOB: seed 48 (7th replicate). (4) HYPOTHESIS: seed=48 lands ~0.253-0.257; mean stays ~0.255+-0.001. (5) BUDGET: ~200s. (6) iter-20 = final 8th replicate. Artifacts saved.", "run_id": "breast-ct-claude-agentic-dual-domain-bilateral-supervised-search-20260703-01", "runtime": {"elapsed_s": 739.9929986000061}, "schema_version": 3, "solver_key": "dual-domain-bilateral-supervised", "solver_name": "DD-BF supervised L2", "split": {"train_n": 400, "val_n": 200}, "status": "keep", "ts": "2026-07-05T19:30:13Z"}
{"advice_for_others": "dual_domain_bilateral_supervised-claude-agentic: proj_n_bf=1, img_n_bf=7, proj_kernel=3, proj_sx=0.01, proj_sy=0.3, proj_sr=0.0005, img_kernel=7, img_sx=0.5, img_sy=0.5, img_sr=0.02, epochs=10, batch_size=1, lr=0.01, optimizer=adam, lambda_neg=1.0, grad_clip=1.0, train_n=800, val_n=200, val_chunk=10, seed=49, rationale=iter-20 (FINAL) dual_domain_bilateral_supervised, re-split Breast-CT val=200. SIX-BOX at BEST config (img_n_bf7/img_kernel7/lr1e-2/lneg1.0/train_n800). (1) PRIOR: 7 seed replicates -- 42=0.2561,43=0.2538,44=0.2538,45=0.2564,46=0.2542,47=0.2551,48=0.2560 -> mean~0.2551 std~0.0011. The 24-param DD-BF optimum is highly seed-robust (~0.255+-0.001), unlike the sibling DD-UNet (~0.04). (2) Failure mode: none; final replicate to close at n=8. (3) ONE KNOB: seed 49 (8th/final replicate). (4) HYPOTHESIS: seed=49 lands ~0.253-0.257; n=8 gives the honest reportable config number ~0.255+-0.001. (5) BUDGET: ~200s. (6) FINAL iter of the 20-iter search; primary finding = a robust ~0.255 hr with tiny seed variance at a 24-param trainable-bilateral DD pipeline. Artifacts saved.", "agent": "dual_domain_bilateral_supervised-claude-agentic", "campaign": "search-20260703-01", "cfg_full": {"batch_size": 1, "epochs": 10, "grad_clip": 1.0, "img_kernel": 7, "img_n_bf": 7, "img_sr": 0.02, "img_sx": 0.5, "img_sy": 0.5, "lambda_neg": 1.0, "lr": 0.01, "optimizer": "adam", "proj_kernel": 3, "proj_n_bf": 1, "proj_sr": 0.0005, "proj_sx": 0.01, "proj_sy": 0.3, "rationale": "iter-20 (FINAL) dual_domain_bilateral_supervised, re-split Breast-CT val=200. SIX-BOX at BEST config (img_n_bf7/img_kernel7/lr1e-2/lneg1.0/train_n800). (1) PRIOR: 7 seed replicates -- 42=0.2561,43=0.2538,44=0.2538,45=0.2564,46=0.2542,47=0.2551,48=0.2560 -> mean~0.2551 std~0.0011. The 24-param DD-BF optimum is highly seed-robust (~0.255+-0.001), unlike the sibling DD-UNet (~0.04). (2) Failure mode: none; final replicate to close at n=8. (3) ONE KNOB: seed 49 (8th/final replicate). (4) HYPOTHESIS: seed=49 lands ~0.253-0.257; n=8 gives the honest reportable config number ~0.255+-0.001. (5) BUDGET: ~200s. (6) FINAL iter of the 20-iter search; primary finding = a robust ~0.255 hr with tiny seed variance at a 24-param trainable-bilateral DD pipeline. Artifacts saved.", "seed": 49, "train_n": 800, "val_chunk": 10, "val_n": 200}, "challenge": "breast_ct", "change_class": "architecture", "git_commit": "671da566", "images": {"comparison": "runs/breast-ct-claude-agentic-dual-domain-bilateral-supervised-search-20260703-01/iterations/iter-0020/comparison.png", "test_showcase": null, "valtest_showcase": null}, "iter": 20, "kept": true, "metrics": {"headroom": 0.2564459635016073, "headroom_std": 0.009650570981768029, "val_psnr": 38.897945404052734, "val_psnr_std": 0.5794727087514562, "val_rmse": 0.0038771016988903284, "val_rmse_std": 0.00025210201496984696, "val_ssim": 0.9836108088493347, "val_ssim_std": 0.0030672575843967626}, "model": "claude-opus-4-8-1m", "obs_path": "breast-ct-claude-agentic-dual-domain-bilateral-supervised-search-20260703-01/iterations/iter-0020/observation.json", "obs_sha1": "a85250938ed5a98d6c8d59dee4bfd111b273d7db", "params_M": 2.4e-05, "params_source": "observation", "rationale": "dual_domain_bilateral_supervised-claude-agentic: proj_n_bf=1, img_n_bf=7, proj_kernel=3, proj_sx=0.01, proj_sy=0.3, proj_sr=0.0005, img_kernel=7, img_sx=0.5, img_sy=0.5, img_sr=0.02, epochs=10, batch_size=1, lr=0.01, optimizer=adam, lambda_neg=1.0, grad_clip=1.0, train_n=800, val_n=200, val_chunk=10, seed=49, rationale=iter-20 (FINAL) dual_domain_bilateral_supervised, re-split Breast-CT val=200. SIX-BOX at BEST config (img_n_bf7/img_kernel7/lr1e-2/lneg1.0/train_n800). (1) PRIOR: 7 seed replicates -- 42=0.2561,43=0.2538,44=0.2538,45=0.2564,46=0.2542,47=0.2551,48=0.2560 -> mean~0.2551 std~0.0011. The 24-param DD-BF optimum is highly seed-robust (~0.255+-0.001), unlike the sibling DD-UNet (~0.04). (2) Failure mode: none; final replicate to close at n=8. (3) ONE KNOB: seed 49 (8th/final replicate). (4) HYPOTHESIS: seed=49 lands ~0.253-0.257; n=8 gives the honest reportable config number ~0.255+-0.001. (5) BUDGET: ~200s. (6) FINAL iter of the 20-iter search; primary finding = a robust ~0.255 hr with tiny seed variance at a 24-param trainable-bilateral DD pipeline. Artifacts saved.", "run_id": "breast-ct-claude-agentic-dual-domain-bilateral-supervised-search-20260703-01", "runtime": {"elapsed_s": 494.38196420669556}, "schema_version": 3, "solver_key": "dual-domain-bilateral-supervised", "solver_name": "DD-BF supervised L2", "split": {"train_n": 400, "val_n": 200}, "status": "keep", "ts": "2026-07-05T19:40:03Z"}
