{"advice_for_others": "dual_domain_bilateral_n2i-claude-agentic: warm_start=True, pretrain_epochs=5, train_n=400, n_iter=60, val_n=200, batch_size=1, grad_clip=1.0, lr=0.003, proj_n_bf=1, img_n_bf=1, img_sr=0.0002, outer_wall_s=1000, seed=42, rationale=iter-18 dual_domain_bilateral_n2i, ONE-KNOB: pretrain_epochs 2->5 (richer warm-start init), on CHAMPION base (warm_start=True, img_sr=0.0002, lr=3e-3, n_iter=60; iter-15 hr=0.2056). warm_start REVERTED to True (iter-17 warm_start=False CRASHED to hr=0.0025, SSIM0.908 -> the warm-start pre-pass is ESSENTIAL: without a generic BF-sigma seed the 60-step per-scene fit from raw CONFIG init does not converge). HYPOTHESIS: since the warm-start init is CRITICAL, a BETTER init should help -- 5 warm-start epochs (vs 2) on the 400 train scenes give the generic BF sigmas more time to settle near the breast-optimal edge-preserving values, so each per-scene fit STARTS closer to its optimum and converges better in 60 steps -> hr above 0.2056. If FLAT/DROP, 2 warm-start epochs already saturate the generic init (the tiny 6-param BF learns its generic sigmas fast) and warm-start DEPTH is neutral -> 2 epochs is the efficient choice. WALL: pretrain 2->5 adds ~3x400=1200 warm steps ~ +90s; n_iter60 per-scene unchanged; outer_wall_s=1000, expect val_n~196-200 (report it). ONE knob: pretrain_epochs 2->5.", "agent": "dual_domain_bilateral_n2i-claude-agentic", "campaign": "search-20260703-01", "cfg_full": {"batch_size": 1, "grad_clip": 1.0, "img_n_bf": 1, "img_sr": 0.0002, "lr": 0.003, "n_iter": 60, "outer_wall_s": 1000, "pretrain_epochs": 5, "proj_n_bf": 1, "rationale": "iter-18 dual_domain_bilateral_n2i, ONE-KNOB: pretrain_epochs 2->5 (richer warm-start init), on CHAMPION base (warm_start=True, img_sr=0.0002, lr=3e-3, n_iter=60; iter-15 hr=0.2056). warm_start REVERTED to True (iter-17 warm_start=False CRASHED to hr=0.0025, SSIM0.908 -> the warm-start pre-pass is ESSENTIAL: without a generic BF-sigma seed the 60-step per-scene fit from raw CONFIG init does not converge). HYPOTHESIS: since the warm-start init is CRITICAL, a BETTER init should help -- 5 warm-start epochs (vs 2) on the 400 train scenes give the generic BF sigmas more time to settle near the breast-optimal edge-preserving values, so each per-scene fit STARTS closer to its optimum and converges better in 60 steps -> hr above 0.2056. If FLAT/DROP, 2 warm-start epochs already saturate the generic init (the tiny 6-param BF learns its generic sigmas fast) and warm-start DEPTH is neutral -> 2 epochs is the efficient choice. WALL: pretrain 2->5 adds ~3x400=1200 warm steps ~ +90s; n_iter60 per-scene unchanged; outer_wall_s=1000, expect val_n~196-200 (report it). ONE knob: pretrain_epochs 2->5.", "seed": 42, "train_n": 400, "val_n": 200, "warm_start": true}, "challenge": "breast_ct", "change_class": "architecture", "git_commit": "671da566", "images": {"comparison": "runs/breast-ct-claude-agentic-dual-domain-bilateral-n2i-search-20260703-01/iterations/iter-0018/comparison.png", "test_showcase": null, "valtest_showcase": null}, "iter": 18, "kept": true, "metrics": {"headroom": 0.040300288948978524, "headroom_std": 0.08117490261793137, "val_psnr": 38.889129638671875, "val_psnr_std": 0.9725347757339478, "val_rmse": 0.0009307381114922464, "val_rmse_std": 0.00010115304758073762, "val_ssim": 0.9595800638198853, "val_ssim_std": 0.010532241314649582}, "model": "claude-opus-4-8-1m", "obs_path": "breast-ct-claude-agentic-dual-domain-bilateral-n2i-search-20260703-01/iterations/iter-0018/observation.json", "obs_sha1": "0574d377308bd27796b8221f2dcc6bb241373d3d", "params_M": 6e-06, "params_source": "observation", "rationale": "dual_domain_bilateral_n2i-claude-agentic: warm_start=True, pretrain_epochs=5, train_n=400, n_iter=60, val_n=200, batch_size=1, grad_clip=1.0, lr=0.003, proj_n_bf=1, img_n_bf=1, img_sr=0.0002, outer_wall_s=1000, seed=42, rationale=iter-18 dual_domain_bilateral_n2i, ONE-KNOB: pretrain_epochs 2->5 (richer warm-start init), on CHAMPION base (warm_start=True, img_sr=0.0002, lr=3e-3, n_iter=60; iter-15 hr=0.2056). warm_start REVERTED to True (iter-17 warm_start=False CRASHED to hr=0.0025, SSIM0.908 -> the warm-start pre-pass is ESSENTIAL: without a generic BF-sigma seed the 60-step per-scene fit from raw CONFIG init does not converge). HYPOTHESIS: since the warm-start init is CRITICAL, a BETTER init should help -- 5 warm-start epochs (vs 2) on the 400 train scenes give the generic BF sigmas more time to settle near the breast-optimal edge-preserving values, so each per-scene fit STARTS closer to its optimum and converges better in 60 steps -> hr above 0.2056. If FLAT/DROP, 2 warm-start epochs already saturate the generic init (the tiny 6-param BF learns its generic sigmas fast) and warm-start DEPTH is neutral -> 2 epochs is the efficient choice. WALL: pretrain 2->5 adds ~3x400=1200 warm steps ~ +90s; n_iter60 per-scene unchanged; outer_wall_s=1000, expect val_n~196-200 (report it). ONE knob: pretrain_epochs 2->5.", "run_id": "breast-ct-claude-agentic-dual-domain-bilateral-n2i-search-20260703-01", "runtime": {"elapsed_s": 1476.9533545970917}, "schema_version": 3, "solver_key": "dual-domain-bilateral-n2i", "solver_name": "DD-BF N2I (per-image)", "split": {"train_n": 400, "val_n": 196}, "status": "keep", "ts": "2026-07-06T00:31:06Z"}
{"advice_for_others": "dual_domain_bilateral_n2i-claude-agentic: warm_start=True, pretrain_epochs=1, train_n=400, n_iter=60, val_n=200, batch_size=1, grad_clip=1.0, lr=0.003, proj_n_bf=1, img_n_bf=1, img_sr=0.0002, outer_wall_s=1000, seed=42, rationale=iter-19 dual_domain_bilateral_n2i, ONE-KNOB: pretrain_epochs 2->1 (SHORTER warm-start), on CHAMPION base (img_sr=0.0002, lr=3e-3, n_iter=60; iter-15 hr=0.2056). warm-start DEPTH now shows a NON-MONOTONE sweet spot: 0 epochs (warm_start=False, iter-17) -> hr=0.0025 CRASH (no seed); 2 epochs (iter-15) -> 0.2056 PEAK; 5 epochs (iter-18) -> 0.0403 CRASH. The 5-epoch collapse = the AMORTISED warm-start ITSELF over-smooths (the N2I-over-smoothing bias operates in the warm-start pre-pass too, using the WIDE default sigmas), seeding a blurred init the tight per-scene img_sr cannot recover. So the warm-start must be SHORT: enough to seed, not enough to over-smooth. HYPOTHESIS: 1 epoch is even less over-smoothed than 2 while still providing the essential non-crash seed -> hr >= 0.2056 (possibly higher if 2 epochs already began mild over-smoothing). If hr < 0.2056, 2 epochs is the sweet spot (1 under-seeds). This MAPS the warm-start sweet spot precisely for the paper. WALL: pretrain 2->1 SAVES warm steps, ~950-1000s, val_n~196-200. ONE knob: pretrain_epochs 2->1.", "agent": "dual_domain_bilateral_n2i-claude-agentic", "campaign": "search-20260703-01", "cfg_full": {"batch_size": 1, "grad_clip": 1.0, "img_n_bf": 1, "img_sr": 0.0002, "lr": 0.003, "n_iter": 60, "outer_wall_s": 1000, "pretrain_epochs": 1, "proj_n_bf": 1, "rationale": "iter-19 dual_domain_bilateral_n2i, ONE-KNOB: pretrain_epochs 2->1 (SHORTER warm-start), on CHAMPION base (img_sr=0.0002, lr=3e-3, n_iter=60; iter-15 hr=0.2056). warm-start DEPTH now shows a NON-MONOTONE sweet spot: 0 epochs (warm_start=False, iter-17) -> hr=0.0025 CRASH (no seed); 2 epochs (iter-15) -> 0.2056 PEAK; 5 epochs (iter-18) -> 0.0403 CRASH. The 5-epoch collapse = the AMORTISED warm-start ITSELF over-smooths (the N2I-over-smoothing bias operates in the warm-start pre-pass too, using the WIDE default sigmas), seeding a blurred init the tight per-scene img_sr cannot recover. So the warm-start must be SHORT: enough to seed, not enough to over-smooth. HYPOTHESIS: 1 epoch is even less over-smoothed than 2 while still providing the essential non-crash seed -> hr >= 0.2056 (possibly higher if 2 epochs already began mild over-smoothing). If hr < 0.2056, 2 epochs is the sweet spot (1 under-seeds). This MAPS the warm-start sweet spot precisely for the paper. WALL: pretrain 2->1 SAVES warm steps, ~950-1000s, val_n~196-200. ONE knob: pretrain_epochs 2->1.", "seed": 42, "train_n": 400, "val_n": 200, "warm_start": true}, "challenge": "breast_ct", "change_class": "architecture", "git_commit": "671da566", "images": {"comparison": "runs/breast-ct-claude-agentic-dual-domain-bilateral-n2i-search-20260703-01/iterations/iter-0019/comparison.png", "test_showcase": null, "valtest_showcase": null}, "iter": 19, "kept": true, "metrics": {"headroom": 0.17688781489739858, "headroom_std": 0.10839782655239105, "val_psnr": 40.22265625, "val_psnr_std": 1.7533164024353027, "val_rmse": 0.0007982724928297102, "val_rmse_std": 0.00019641626568045467, "val_ssim": 0.9520886540412903, "val_ssim_std": 0.02543768659234047}, "model": "claude-opus-4-8-1m", "obs_path": "breast-ct-claude-agentic-dual-domain-bilateral-n2i-search-20260703-01/iterations/iter-0019/observation.json", "obs_sha1": "3868e6013c4eb4c6e923bb0712e365594875ae28", "params_M": 6e-06, "params_source": "observation", "rationale": "dual_domain_bilateral_n2i-claude-agentic: warm_start=True, pretrain_epochs=1, train_n=400, n_iter=60, val_n=200, batch_size=1, grad_clip=1.0, lr=0.003, proj_n_bf=1, img_n_bf=1, img_sr=0.0002, outer_wall_s=1000, seed=42, rationale=iter-19 dual_domain_bilateral_n2i, ONE-KNOB: pretrain_epochs 2->1 (SHORTER warm-start), on CHAMPION base (img_sr=0.0002, lr=3e-3, n_iter=60; iter-15 hr=0.2056). warm-start DEPTH now shows a NON-MONOTONE sweet spot: 0 epochs (warm_start=False, iter-17) -> hr=0.0025 CRASH (no seed); 2 epochs (iter-15) -> 0.2056 PEAK; 5 epochs (iter-18) -> 0.0403 CRASH. The 5-epoch collapse = the AMORTISED warm-start ITSELF over-smooths (the N2I-over-smoothing bias operates in the warm-start pre-pass too, using the WIDE default sigmas), seeding a blurred init the tight per-scene img_sr cannot recover. So the warm-start must be SHORT: enough to seed, not enough to over-smooth. HYPOTHESIS: 1 epoch is even less over-smoothed than 2 while still providing the essential non-crash seed -> hr >= 0.2056 (possibly higher if 2 epochs already began mild over-smoothing). If hr < 0.2056, 2 epochs is the sweet spot (1 under-seeds). This MAPS the warm-start sweet spot precisely for the paper. WALL: pretrain 2->1 SAVES warm steps, ~950-1000s, val_n~196-200. ONE knob: pretrain_epochs 2->1.", "run_id": "breast-ct-claude-agentic-dual-domain-bilateral-n2i-search-20260703-01", "runtime": {"elapsed_s": 1315.3865644931793}, "schema_version": 3, "solver_key": "dual-domain-bilateral-n2i", "solver_name": "DD-BF N2I (per-image)", "split": {"train_n": 400, "val_n": 196}, "status": "keep", "ts": "2026-07-06T00:54:03Z"}
{"advice_for_others": "dual_domain_bilateral_n2i-claude-agentic: warm_start=True, pretrain_epochs=2, train_n=400, n_iter=60, val_n=200, batch_size=1, grad_clip=1.0, lr=0.003, proj_n_bf=1, img_n_bf=1, img_sr=0.0003, outer_wall_s=1300, seed=42, rationale=iter-20 (FINAL) dual_domain_bilateral_n2i, ONE-KNOB: image BF range sigma img_sr 0.0002->0.0003, on the fully-tuned CHAMPION base (warm_start=True, pretrain_epochs=2, lr=3e-3, n_iter=60; iter-15 hr=0.2056 = campaign best). pretrain_epochs CONFIRMED at 2 (iter-19 pretrain=1 -> 0.1769 under-seed; iter-18 pretrain=5 -> 0.0403 warm-start over-smooths; clean bell curve peaked at 2). RATIONALE for revisiting img_sr: it was tuned back at iter-5/7 under the OLD regime (lr=5e-3, n_iter=30); the whole optimum has since moved (gentle lr=3e-3, n_iter=60), so the ideal edge-preserving range sigma may have shifted. 0.0003 sits between the iter-5 value (5e-4, hr0.1257) and iter-7 (2e-4, hr0.1261) -- re-locating the range optimum under the FINAL lr/n_iter. HYPOTHESIS: if hr>0.2056, the range optimum shifted up to ~3e-4 under gentle lr and this is the new champion; if <=, 2e-4 remains optimal and 0.2056 (iter-15) is the confirmed campaign ceiling. SECONDARY: outer_wall_s raised 1000->1300 so the FINAL iter scores a CLEAN val_n=200 (iters 15/16/19 trimmed to 196-197 at n_iter=60 under a 900-1000s wall) -- gives an unambiguous full-200 endpoint. Still fits the 1800s sbatch wall. ONE knob: img_sr 0.0002->0.0003 (wall raised only to preserve val_n=200, not a second lever).", "agent": "dual_domain_bilateral_n2i-claude-agentic", "campaign": "search-20260703-01", "cfg_full": {"batch_size": 1, "grad_clip": 1.0, "img_n_bf": 1, "img_sr": 0.0003, "lr": 0.003, "n_iter": 60, "outer_wall_s": 1300, "pretrain_epochs": 2, "proj_n_bf": 1, "rationale": "iter-20 (FINAL) dual_domain_bilateral_n2i, ONE-KNOB: image BF range sigma img_sr 0.0002->0.0003, on the fully-tuned CHAMPION base (warm_start=True, pretrain_epochs=2, lr=3e-3, n_iter=60; iter-15 hr=0.2056 = campaign best). pretrain_epochs CONFIRMED at 2 (iter-19 pretrain=1 -> 0.1769 under-seed; iter-18 pretrain=5 -> 0.0403 warm-start over-smooths; clean bell curve peaked at 2). RATIONALE for revisiting img_sr: it was tuned back at iter-5/7 under the OLD regime (lr=5e-3, n_iter=30); the whole optimum has since moved (gentle lr=3e-3, n_iter=60), so the ideal edge-preserving range sigma may have shifted. 0.0003 sits between the iter-5 value (5e-4, hr0.1257) and iter-7 (2e-4, hr0.1261) -- re-locating the range optimum under the FINAL lr/n_iter. HYPOTHESIS: if hr>0.2056, the range optimum shifted up to ~3e-4 under gentle lr and this is the new champion; if <=, 2e-4 remains optimal and 0.2056 (iter-15) is the confirmed campaign ceiling. SECONDARY: outer_wall_s raised 1000->1300 so the FINAL iter scores a CLEAN val_n=200 (iters 15/16/19 trimmed to 196-197 at n_iter=60 under a 900-1000s wall) -- gives an unambiguous full-200 endpoint. Still fits the 1800s sbatch wall. ONE knob: img_sr 0.0002->0.0003 (wall raised only to preserve val_n=200, not a second lever).", "seed": 42, "train_n": 400, "val_n": 200, "warm_start": true}, "challenge": "breast_ct", "change_class": "architecture", "git_commit": "671da566", "images": {"comparison": "runs/breast-ct-claude-agentic-dual-domain-bilateral-n2i-search-20260703-01/iterations/iter-0020/comparison.png", "test_showcase": null, "valtest_showcase": null}, "iter": 20, "kept": true, "metrics": {"headroom": 0.20344853568888321, "headroom_std": 0.11938692629337311, "val_psnr": 40.38005065917969, "val_psnr_std": 1.8029093742370605, "val_rmse": 0.0007839375175535679, "val_rmse_std": 0.00019210405298508704, "val_ssim": 0.9591338634490967, "val_ssim_std": 0.024359339848160744}, "model": "claude-opus-4-8-1m", "obs_path": "breast-ct-claude-agentic-dual-domain-bilateral-n2i-search-20260703-01/iterations/iter-0020/observation.json", "obs_sha1": "9c586673cde9cd7f544955ab7494762f99e29102", "params_M": 6e-06, "params_source": "observation", "rationale": "dual_domain_bilateral_n2i-claude-agentic: warm_start=True, pretrain_epochs=2, train_n=400, n_iter=60, val_n=200, batch_size=1, grad_clip=1.0, lr=0.003, proj_n_bf=1, img_n_bf=1, img_sr=0.0003, outer_wall_s=1300, seed=42, rationale=iter-20 (FINAL) dual_domain_bilateral_n2i, ONE-KNOB: image BF range sigma img_sr 0.0002->0.0003, on the fully-tuned CHAMPION base (warm_start=True, pretrain_epochs=2, lr=3e-3, n_iter=60; iter-15 hr=0.2056 = campaign best). pretrain_epochs CONFIRMED at 2 (iter-19 pretrain=1 -> 0.1769 under-seed; iter-18 pretrain=5 -> 0.0403 warm-start over-smooths; clean bell curve peaked at 2). RATIONALE for revisiting img_sr: it was tuned back at iter-5/7 under the OLD regime (lr=5e-3, n_iter=30); the whole optimum has since moved (gentle lr=3e-3, n_iter=60), so the ideal edge-preserving range sigma may have shifted. 0.0003 sits between the iter-5 value (5e-4, hr0.1257) and iter-7 (2e-4, hr0.1261) -- re-locating the range optimum under the FINAL lr/n_iter. HYPOTHESIS: if hr>0.2056, the range optimum shifted up to ~3e-4 under gentle lr and this is the new champion; if <=, 2e-4 remains optimal and 0.2056 (iter-15) is the confirmed campaign ceiling. SECONDARY: outer_wall_s raised 1000->1300 so the FINAL iter scores a CLEAN val_n=200 (iters 15/16/19 trimmed to 196-197 at n_iter=60 under a 900-1000s wall) -- gives an unambiguous full-200 endpoint. Still fits the 1800s sbatch wall. ONE knob: img_sr 0.0002->0.0003 (wall raised only to preserve val_n=200, not a second lever).", "run_id": "breast-ct-claude-agentic-dual-domain-bilateral-n2i-search-20260703-01", "runtime": {"elapsed_s": 1591.3430943489075}, "schema_version": 3, "solver_key": "dual-domain-bilateral-n2i", "solver_name": "DD-BF N2I (per-image)", "split": {"train_n": 400, "val_n": 200}, "status": "keep", "ts": "2026-07-06T01:21:32Z"}
