{"advice_for_others": "fastdiff_flow_pixel_constrained-claude-agentic: image_size=512, pixel_spacing=0.3516, n_angles=128, n_det=1024, det_spacing=0.35754, sod=500.0, sdd=1000.0, display_min=0.0, display_max=0.5, train_n=400, val_n=200, noise_i0=100000.0, noise_sigma_e=10.0, seed=42, dataset_kind=breast_ct, fd_recon_ckpt=/cluster/maier/Agent4CT/checkpoints/fast_diffusion_pixel_breast.pt, fd_recon_steps=8, fd_recon_init=fbp, fd_recon_init_t=0.05, fd_recon_eta=1.0, fd_recon_dc=1, fd_recon_dc_n_cg=40, fd_recon_dc_relax=1.0, rationale=iter-8 EXPLORATORY single knob dc_n_cg 30->40 (map RIGHT shoulder of the DC semi-convergence peak). SIX-BOX: (1)PRIOR: n_cg curve now resolved (init_t0.05,relax1.0): n_cg5 rmse0.00669 hr0 -> n_cg20 rmse0.005327 hr0 (just above FBP0.00521) -> n_cg30 rmse0.004924 hr=0.0557 (PEAK, below FBP) -> n_cg60 rmse0.00992 hr0 (over-converged, noise-amplified). Clean inverted-U in rmse: DC CG semi-converges, optimum ~n_cg30. (2)FAILURE: 30 may not be the exact argmax; the right shoulder (30->60) decay is uncharted. (3)ONE KNOB: dc_n_cg 30->40. (4)HYPOTHESIS: n_cg40 rmse should sit between n_cg30(0.004924) and n_cg60(0.00992); if still < FBP0.00521 then hr>0 and the >0 plateau spans ~30-40; if > FBP the peak is tight at 30. Pinpoints the argmax hr. (5)BUDGET: 40 CG ~ iter-5 x1.3 (~7min), inside 20-min. (6)Serial.", "agent": "fastdiff_flow_pixel_constrained-claude-agentic", "campaign": "search-20260703-01", "cfg_full": {"dataset_kind": "breast_ct", "det_spacing": 0.35754, "display_max": 0.5, "display_min": 0.0, "fd_recon_ckpt": "/cluster/maier/Agent4CT/checkpoints/fast_diffusion_pixel_breast.pt", "fd_recon_dc": 1, "fd_recon_dc_n_cg": 40, "fd_recon_dc_relax": 1.0, "fd_recon_eta": 1.0, "fd_recon_init": "fbp", "fd_recon_init_t": 0.05, "fd_recon_steps": 8, "image_size": 512, "n_angles": 128, "n_det": 1024, "noise_i0": 100000.0, "noise_sigma_e": 10.0, "pixel_spacing": 0.3516, "rationale": "iter-8 EXPLORATORY single knob dc_n_cg 30->40 (map RIGHT shoulder of the DC semi-convergence peak). SIX-BOX: (1)PRIOR: n_cg curve now resolved (init_t0.05,relax1.0): n_cg5 rmse0.00669 hr0 -> n_cg20 rmse0.005327 hr0 (just above FBP0.00521) -> n_cg30 rmse0.004924 hr=0.0557 (PEAK, below FBP) -> n_cg60 rmse0.00992 hr0 (over-converged, noise-amplified). Clean inverted-U in rmse: DC CG semi-converges, optimum ~n_cg30. (2)FAILURE: 30 may not be the exact argmax; the right shoulder (30->60) decay is uncharted. (3)ONE KNOB: dc_n_cg 30->40. (4)HYPOTHESIS: n_cg40 rmse should sit between n_cg30(0.004924) and n_cg60(0.00992); if still < FBP0.00521 then hr>0 and the >0 plateau spans ~30-40; if > FBP the peak is tight at 30. Pinpoints the argmax hr. (5)BUDGET: 40 CG ~ iter-5 x1.3 (~7min), inside 20-min. (6)Serial.", "sdd": 1000.0, "seed": 42, "sod": 500.0, "train_n": 400, "val_n": 200}, "challenge": "breast_ct", "change_class": "architecture", "git_commit": "671da566", "images": {"comparison": "runs/breast-ct-claude-agentic-fastdiff-flow-pixel-constrained-search-20260703-01/iterations/iter-0008/comparison.png", "test_showcase": null, "valtest_showcase": null}, "iter": 8, "kept": false, "metrics": {"headroom": 0.0, "headroom_std": 0.01787017001173463, "val_psnr": 36.045108795166016, "val_psnr_std": 0.6419798080047012, "val_rmse": 0.005384546238929033, "val_rmse_std": 0.0003956894759839537, "val_ssim": 0.8898441791534424, "val_ssim_std": 0.010087891488755454}, "model": "claude-opus-4-8-1m", "obs_path": "breast-ct-claude-agentic-fastdiff-flow-pixel-constrained-search-20260703-01/iterations/iter-0008/observation.json", "obs_sha1": "393d054486b30872730707c3fb08bf13bfe7d92f", "params_M": 3.822787, "params_source": "observation", "rationale": "fastdiff_flow_pixel_constrained-claude-agentic: image_size=512, pixel_spacing=0.3516, n_angles=128, n_det=1024, det_spacing=0.35754, sod=500.0, sdd=1000.0, display_min=0.0, display_max=0.5, train_n=400, val_n=200, noise_i0=100000.0, noise_sigma_e=10.0, seed=42, dataset_kind=breast_ct, fd_recon_ckpt=/cluster/maier/Agent4CT/checkpoints/fast_diffusion_pixel_breast.pt, fd_recon_steps=8, fd_recon_init=fbp, fd_recon_init_t=0.05, fd_recon_eta=1.0, fd_recon_dc=1, fd_recon_dc_n_cg=40, fd_recon_dc_relax=1.0, rationale=iter-8 EXPLORATORY single knob dc_n_cg 30->40 (map RIGHT shoulder of the DC semi-convergence peak). SIX-BOX: (1)PRIOR: n_cg curve now resolved (init_t0.05,relax1.0): n_cg5 rmse0.00669 hr0 -> n_cg20 rmse0.005327 hr0 (just above FBP0.00521) -> n_cg30 rmse0.004924 hr=0.0557 (PEAK, below FBP) -> n_cg60 rmse0.00992 hr0 (over-converged, noise-amplified). Clean inverted-U in rmse: DC CG semi-converges, optimum ~n_cg30. (2)FAILURE: 30 may not be the exact argmax; the right shoulder (30->60) decay is uncharted. (3)ONE KNOB: dc_n_cg 30->40. (4)HYPOTHESIS: n_cg40 rmse should sit between n_cg30(0.004924) and n_cg60(0.00992); if still < FBP0.00521 then hr>0 and the >0 plateau spans ~30-40; if > FBP the peak is tight at 30. Pinpoints the argmax hr. (5)BUDGET: 40 CG ~ iter-5 x1.3 (~7min), inside 20-min. (6)Serial.", "run_id": "breast-ct-claude-agentic-fastdiff-flow-pixel-constrained-search-20260703-01", "runtime": {"elapsed_s": 479.1030910015106}, "schema_version": 3, "solver_key": "fastdiff-flow-pixel-constrained", "solver_name": "Fast-diffusion flow (pixel, constrained DC)", "split": {"train_n": 400, "val_n": 200}, "status": "discard", "ts": "2026-07-06T21:35:45Z"}
{"advice_for_others": "fastdiff_flow_pixel_constrained-claude-agentic: image_size=512, pixel_spacing=0.3516, n_angles=128, n_det=1024, det_spacing=0.35754, sod=500.0, sdd=1000.0, display_min=0.0, display_max=0.5, train_n=400, val_n=200, noise_i0=100000.0, noise_sigma_e=10.0, seed=42, dataset_kind=breast_ct, fd_recon_ckpt=/cluster/maier/Agent4CT/checkpoints/fast_diffusion_pixel_breast.pt, fd_recon_steps=8, fd_recon_init=fbp, fd_recon_init_t=0.05, fd_recon_eta=1.0, fd_recon_dc=1, fd_recon_dc_n_cg=30, fd_recon_dc_relax=0.75, rationale=iter-9 EXPLORATORY single knob dc_relax 1.0->0.75 at the peak base (init_t0.05, n_cg30, the hr=0.0557 winner). SIX-BOX: (1)PRIOR: n_cg curve fully mapped as an inverted-U (rmse): 5=0.00669, 20=0.005327, 30=0.004924(PEAK,hr0.0557), 40=0.005385, 60=0.00992 -> DC CG semi-converges, argmax n_cg30. All the >0 mass is at n_cg30. (2)FAILURE / next lever: at relax1.0 the CG projection is FULLY applied each step; the semi-convergence (noise re-amplification past the peak) suggests the projection is slightly too aggressive. A partial blend (relax<1) mixes the CG solution with the prior's clean estimate, acting as implicit regularization. (3)ONE KNOB: dc_relax 1.0->0.75 (n_cg30/init_t0.05/steps8/eta1.0 held). (4)HYPOTHESIS: a 0.75 blend tempers the noise-amplifying part of the deep CG while keeping most of the data-consistency gain, possibly lifting hr above 0.0557. (5)BUDGET: n_cg30 ~ iter-5 (~5.5min), inside 20-min. (6)Serial.", "agent": "fastdiff_flow_pixel_constrained-claude-agentic", "campaign": "search-20260703-01", "cfg_full": {"dataset_kind": "breast_ct", "det_spacing": 0.35754, "display_max": 0.5, "display_min": 0.0, "fd_recon_ckpt": "/cluster/maier/Agent4CT/checkpoints/fast_diffusion_pixel_breast.pt", "fd_recon_dc": 1, "fd_recon_dc_n_cg": 30, "fd_recon_dc_relax": 0.75, "fd_recon_eta": 1.0, "fd_recon_init": "fbp", "fd_recon_init_t": 0.05, "fd_recon_steps": 8, "image_size": 512, "n_angles": 128, "n_det": 1024, "noise_i0": 100000.0, "noise_sigma_e": 10.0, "pixel_spacing": 0.3516, "rationale": "iter-9 EXPLORATORY single knob dc_relax 1.0->0.75 at the peak base (init_t0.05, n_cg30, the hr=0.0557 winner). SIX-BOX: (1)PRIOR: n_cg curve fully mapped as an inverted-U (rmse): 5=0.00669, 20=0.005327, 30=0.004924(PEAK,hr0.0557), 40=0.005385, 60=0.00992 -> DC CG semi-converges, argmax n_cg30. All the >0 mass is at n_cg30. (2)FAILURE / next lever: at relax1.0 the CG projection is FULLY applied each step; the semi-convergence (noise re-amplification past the peak) suggests the projection is slightly too aggressive. A partial blend (relax<1) mixes the CG solution with the prior's clean estimate, acting as implicit regularization. (3)ONE KNOB: dc_relax 1.0->0.75 (n_cg30/init_t0.05/steps8/eta1.0 held). (4)HYPOTHESIS: a 0.75 blend tempers the noise-amplifying part of the deep CG while keeping most of the data-consistency gain, possibly lifting hr above 0.0557. (5)BUDGET: n_cg30 ~ iter-5 (~5.5min), inside 20-min. (6)Serial.", "sdd": 1000.0, "seed": 42, "sod": 500.0, "train_n": 400, "val_n": 200}, "challenge": "breast_ct", "change_class": "architecture", "git_commit": "671da566", "images": {"comparison": "runs/breast-ct-claude-agentic-fastdiff-flow-pixel-constrained-search-20260703-01/iterations/iter-0009/comparison.png", "test_showcase": null, "valtest_showcase": null}, "iter": 9, "kept": false, "metrics": {"headroom": 0.0, "headroom_std": 0.0, "val_psnr": 35.149620056152344, "val_psnr_std": 0.6166787956823148, "val_rmse": 0.005969300866127014, "val_rmse_std": 0.0004152048065583838, "val_ssim": 0.8709304332733154, "val_ssim_std": 0.0083419219912633}, "model": "claude-opus-4-8-1m", "obs_path": "breast-ct-claude-agentic-fastdiff-flow-pixel-constrained-search-20260703-01/iterations/iter-0009/observation.json", "obs_sha1": "437e70e9b02303397161f526ba822cdc5af47b3c", "params_M": 3.822787, "params_source": "observation", "rationale": "fastdiff_flow_pixel_constrained-claude-agentic: image_size=512, pixel_spacing=0.3516, n_angles=128, n_det=1024, det_spacing=0.35754, sod=500.0, sdd=1000.0, display_min=0.0, display_max=0.5, train_n=400, val_n=200, noise_i0=100000.0, noise_sigma_e=10.0, seed=42, dataset_kind=breast_ct, fd_recon_ckpt=/cluster/maier/Agent4CT/checkpoints/fast_diffusion_pixel_breast.pt, fd_recon_steps=8, fd_recon_init=fbp, fd_recon_init_t=0.05, fd_recon_eta=1.0, fd_recon_dc=1, fd_recon_dc_n_cg=30, fd_recon_dc_relax=0.75, rationale=iter-9 EXPLORATORY single knob dc_relax 1.0->0.75 at the peak base (init_t0.05, n_cg30, the hr=0.0557 winner). SIX-BOX: (1)PRIOR: n_cg curve fully mapped as an inverted-U (rmse): 5=0.00669, 20=0.005327, 30=0.004924(PEAK,hr0.0557), 40=0.005385, 60=0.00992 -> DC CG semi-converges, argmax n_cg30. All the >0 mass is at n_cg30. (2)FAILURE / next lever: at relax1.0 the CG projection is FULLY applied each step; the semi-convergence (noise re-amplification past the peak) suggests the projection is slightly too aggressive. A partial blend (relax<1) mixes the CG solution with the prior's clean estimate, acting as implicit regularization. (3)ONE KNOB: dc_relax 1.0->0.75 (n_cg30/init_t0.05/steps8/eta1.0 held). (4)HYPOTHESIS: a 0.75 blend tempers the noise-amplifying part of the deep CG while keeping most of the data-consistency gain, possibly lifting hr above 0.0557. (5)BUDGET: n_cg30 ~ iter-5 (~5.5min), inside 20-min. (6)Serial.", "run_id": "breast-ct-claude-agentic-fastdiff-flow-pixel-constrained-search-20260703-01", "runtime": {"elapsed_s": 318.6897532939911}, "schema_version": 3, "solver_key": "fastdiff-flow-pixel-constrained", "solver_name": "Fast-diffusion flow (pixel, constrained DC)", "split": {"train_n": 400, "val_n": 200}, "status": "discard", "ts": "2026-07-06T21:42:18Z"}
{"advice_for_others": "fastdiff_flow_pixel_constrained-claude-agentic: image_size=512, pixel_spacing=0.3516, n_angles=128, n_det=1024, det_spacing=0.35754, sod=500.0, sdd=1000.0, display_min=0.0, display_max=0.5, train_n=400, val_n=200, noise_i0=100000.0, noise_sigma_e=10.0, seed=42, dataset_kind=breast_ct, fd_recon_ckpt=/cluster/maier/Agent4CT/checkpoints/fast_diffusion_pixel_breast.pt, fd_recon_steps=8, fd_recon_init=fbp, fd_recon_init_t=0.02, fd_recon_eta=1.0, fd_recon_dc=1, fd_recon_dc_n_cg=30, fd_recon_dc_relax=1.0, rationale=iter-10 EXPLORATORY single knob init_t 0.05->0.02 at the peak (n_cg30,relax1.0). SIX-BOX: (1)PRIOR: at the peak (init_t0.05,n_cg30,relax1.0) hr=0.0557 (best). iter-9 tempered DC (relax0.75) got WORSE (rmse0.004924->0.005969), i.e. reducing the DC lets the prior's perturbation back in -> the gain is DC-dominated, prior slightly HURTS. (2)FAILURE: init_t0.05 still embeds a little prior-noise; at init_t->0 the recon is FBP + pure CG-DC, minimizing prior perturbation. (3)ONE KNOB: init_t 0.05->0.02 (relax1.0/n_cg30/steps8/eta1.0 held). (4)HYPOTHESIS: less prior at init_t0.02 should let the deep CG DC dominate even more cleanly, lowering rmse below 0.004924 and lifting hr above 0.0557. If it plateaus, hr~0.056 is the DC-limit for this config. (5)BUDGET: n_cg30 ~5.5min, inside 20-min. (6)Serial.", "agent": "fastdiff_flow_pixel_constrained-claude-agentic", "campaign": "search-20260703-01", "cfg_full": {"dataset_kind": "breast_ct", "det_spacing": 0.35754, "display_max": 0.5, "display_min": 0.0, "fd_recon_ckpt": "/cluster/maier/Agent4CT/checkpoints/fast_diffusion_pixel_breast.pt", "fd_recon_dc": 1, "fd_recon_dc_n_cg": 30, "fd_recon_dc_relax": 1.0, "fd_recon_eta": 1.0, "fd_recon_init": "fbp", "fd_recon_init_t": 0.02, "fd_recon_steps": 8, "image_size": 512, "n_angles": 128, "n_det": 1024, "noise_i0": 100000.0, "noise_sigma_e": 10.0, "pixel_spacing": 0.3516, "rationale": "iter-10 EXPLORATORY single knob init_t 0.05->0.02 at the peak (n_cg30,relax1.0). SIX-BOX: (1)PRIOR: at the peak (init_t0.05,n_cg30,relax1.0) hr=0.0557 (best). iter-9 tempered DC (relax0.75) got WORSE (rmse0.004924->0.005969), i.e. reducing the DC lets the prior's perturbation back in -> the gain is DC-dominated, prior slightly HURTS. (2)FAILURE: init_t0.05 still embeds a little prior-noise; at init_t->0 the recon is FBP + pure CG-DC, minimizing prior perturbation. (3)ONE KNOB: init_t 0.05->0.02 (relax1.0/n_cg30/steps8/eta1.0 held). (4)HYPOTHESIS: less prior at init_t0.02 should let the deep CG DC dominate even more cleanly, lowering rmse below 0.004924 and lifting hr above 0.0557. If it plateaus, hr~0.056 is the DC-limit for this config. (5)BUDGET: n_cg30 ~5.5min, inside 20-min. (6)Serial.", "sdd": 1000.0, "seed": 42, "sod": 500.0, "train_n": 400, "val_n": 200}, "challenge": "breast_ct", "change_class": "architecture", "git_commit": "671da566", "images": {"comparison": "runs/breast-ct-claude-agentic-fastdiff-flow-pixel-constrained-search-20260703-01/iterations/iter-0010/comparison.png", "test_showcase": null, "valtest_showcase": null}, "iter": 10, "kept": true, "metrics": {"headroom": 0.35306988852689625, "headroom_std": 0.03834374862479287, "val_psnr": 40.10704803466797, "val_psnr_std": 0.6659564629775574, "val_rmse": 0.0033732771407812834, "val_rmse_std": 0.0002588524251272227, "val_ssim": 0.9529603123664856, "val_ssim_std": 0.007638188376545331}, "model": "claude-opus-4-8-1m", "obs_path": "breast-ct-claude-agentic-fastdiff-flow-pixel-constrained-search-20260703-01/iterations/iter-0010/observation.json", "obs_sha1": "79b1e64a76bc011c7331fd545b3ea0894c171d5f", "params_M": 3.822787, "params_source": "observation", "rationale": "fastdiff_flow_pixel_constrained-claude-agentic: image_size=512, pixel_spacing=0.3516, n_angles=128, n_det=1024, det_spacing=0.35754, sod=500.0, sdd=1000.0, display_min=0.0, display_max=0.5, train_n=400, val_n=200, noise_i0=100000.0, noise_sigma_e=10.0, seed=42, dataset_kind=breast_ct, fd_recon_ckpt=/cluster/maier/Agent4CT/checkpoints/fast_diffusion_pixel_breast.pt, fd_recon_steps=8, fd_recon_init=fbp, fd_recon_init_t=0.02, fd_recon_eta=1.0, fd_recon_dc=1, fd_recon_dc_n_cg=30, fd_recon_dc_relax=1.0, rationale=iter-10 EXPLORATORY single knob init_t 0.05->0.02 at the peak (n_cg30,relax1.0). SIX-BOX: (1)PRIOR: at the peak (init_t0.05,n_cg30,relax1.0) hr=0.0557 (best). iter-9 tempered DC (relax0.75) got WORSE (rmse0.004924->0.005969), i.e. reducing the DC lets the prior's perturbation back in -> the gain is DC-dominated, prior slightly HURTS. (2)FAILURE: init_t0.05 still embeds a little prior-noise; at init_t->0 the recon is FBP + pure CG-DC, minimizing prior perturbation. (3)ONE KNOB: init_t 0.05->0.02 (relax1.0/n_cg30/steps8/eta1.0 held). (4)HYPOTHESIS: less prior at init_t0.02 should let the deep CG DC dominate even more cleanly, lowering rmse below 0.004924 and lifting hr above 0.0557. If it plateaus, hr~0.056 is the DC-limit for this config. (5)BUDGET: n_cg30 ~5.5min, inside 20-min. (6)Serial.", "run_id": "breast-ct-claude-agentic-fastdiff-flow-pixel-constrained-search-20260703-01", "runtime": {"elapsed_s": 324.2453694343567}, "schema_version": 3, "solver_key": "fastdiff-flow-pixel-constrained", "solver_name": "Fast-diffusion flow (pixel, constrained DC)", "split": {"train_n": 400, "val_n": 200}, "status": "keep", "ts": "2026-07-06T21:48:35Z"}
{"advice_for_others": "fastdiff_flow_pixel_constrained-claude-agentic: image_size=512, pixel_spacing=0.3516, n_angles=128, n_det=1024, det_spacing=0.35754, sod=500.0, sdd=1000.0, display_min=0.0, display_max=0.5, train_n=400, val_n=200, noise_i0=100000.0, noise_sigma_e=10.0, seed=42, dataset_kind=breast_ct, fd_recon_ckpt=/cluster/maier/Agent4CT/checkpoints/fast_diffusion_pixel_breast.pt, fd_recon_steps=8, fd_recon_init=fbp, fd_recon_init_t=0.01, fd_recon_eta=1.0, fd_recon_dc=1, fd_recon_dc_n_cg=30, fd_recon_dc_relax=1.0, rationale=iter-11 EXPLORATORY single knob init_t 0.02->0.01 continuing the WINNING direction (n_cg30,relax1.0). SIX-BOX: (1)PRIOR: BIG JUMP - init_t 0.05->0.02 leaped hr 0.0557->0.3531 (rmse0.004924->0.003373, psnr36.82->40.11, ssim0.902->0.953). Less prior perturbation lets the deep CG DC dominate and clear the FBP baseline by a wide margin. init_t is the dominant lever AT the peak n_cg. (2)FAILURE: init_t0.02 may still embed a little prior-noise; lower could be better. (3)ONE KNOB: init_t 0.02->0.01. (4)HYPOTHESIS: pushing init_t toward 0 further reduces prior perturbation, letting the DC-CG solution get even cleaner; hr should rise above 0.3531 or plateau (marking the near-pure-DC limit). (5)BUDGET: n_cg30 ~5.5min. (6)Serial.", "agent": "fastdiff_flow_pixel_constrained-claude-agentic", "campaign": "search-20260703-01", "cfg_full": {"dataset_kind": "breast_ct", "det_spacing": 0.35754, "display_max": 0.5, "display_min": 0.0, "fd_recon_ckpt": "/cluster/maier/Agent4CT/checkpoints/fast_diffusion_pixel_breast.pt", "fd_recon_dc": 1, "fd_recon_dc_n_cg": 30, "fd_recon_dc_relax": 1.0, "fd_recon_eta": 1.0, "fd_recon_init": "fbp", "fd_recon_init_t": 0.01, "fd_recon_steps": 8, "image_size": 512, "n_angles": 128, "n_det": 1024, "noise_i0": 100000.0, "noise_sigma_e": 10.0, "pixel_spacing": 0.3516, "rationale": "iter-11 EXPLORATORY single knob init_t 0.02->0.01 continuing the WINNING direction (n_cg30,relax1.0). SIX-BOX: (1)PRIOR: BIG JUMP - init_t 0.05->0.02 leaped hr 0.0557->0.3531 (rmse0.004924->0.003373, psnr36.82->40.11, ssim0.902->0.953). Less prior perturbation lets the deep CG DC dominate and clear the FBP baseline by a wide margin. init_t is the dominant lever AT the peak n_cg. (2)FAILURE: init_t0.02 may still embed a little prior-noise; lower could be better. (3)ONE KNOB: init_t 0.02->0.01. (4)HYPOTHESIS: pushing init_t toward 0 further reduces prior perturbation, letting the DC-CG solution get even cleaner; hr should rise above 0.3531 or plateau (marking the near-pure-DC limit). (5)BUDGET: n_cg30 ~5.5min. (6)Serial.", "sdd": 1000.0, "seed": 42, "sod": 500.0, "train_n": 400, "val_n": 200}, "challenge": "breast_ct", "change_class": "architecture", "git_commit": "671da566", "images": {"comparison": "runs/breast-ct-claude-agentic-fastdiff-flow-pixel-constrained-search-20260703-01/iterations/iter-0011/comparison.png", "test_showcase": null, "valtest_showcase": null}, "iter": 11, "kept": true, "metrics": {"headroom": 0.3604654537686639, "headroom_std": 0.03253498308520526, "val_psnr": 40.206912994384766, "val_psnr_std": 0.4945338981335328, "val_rmse": 0.0033347145654261112, "val_rmse_std": 0.00019624977088553375, "val_ssim": 0.9502614140510559, "val_ssim_std": 0.005631613347202798}, "model": "claude-opus-4-8-1m", "obs_path": "breast-ct-claude-agentic-fastdiff-flow-pixel-constrained-search-20260703-01/iterations/iter-0011/observation.json", "obs_sha1": "576dd416358866658ce7d62a499bd4affad11962", "params_M": 3.822787, "params_source": "observation", "rationale": "fastdiff_flow_pixel_constrained-claude-agentic: image_size=512, pixel_spacing=0.3516, n_angles=128, n_det=1024, det_spacing=0.35754, sod=500.0, sdd=1000.0, display_min=0.0, display_max=0.5, train_n=400, val_n=200, noise_i0=100000.0, noise_sigma_e=10.0, seed=42, dataset_kind=breast_ct, fd_recon_ckpt=/cluster/maier/Agent4CT/checkpoints/fast_diffusion_pixel_breast.pt, fd_recon_steps=8, fd_recon_init=fbp, fd_recon_init_t=0.01, fd_recon_eta=1.0, fd_recon_dc=1, fd_recon_dc_n_cg=30, fd_recon_dc_relax=1.0, rationale=iter-11 EXPLORATORY single knob init_t 0.02->0.01 continuing the WINNING direction (n_cg30,relax1.0). SIX-BOX: (1)PRIOR: BIG JUMP - init_t 0.05->0.02 leaped hr 0.0557->0.3531 (rmse0.004924->0.003373, psnr36.82->40.11, ssim0.902->0.953). Less prior perturbation lets the deep CG DC dominate and clear the FBP baseline by a wide margin. init_t is the dominant lever AT the peak n_cg. (2)FAILURE: init_t0.02 may still embed a little prior-noise; lower could be better. (3)ONE KNOB: init_t 0.02->0.01. (4)HYPOTHESIS: pushing init_t toward 0 further reduces prior perturbation, letting the DC-CG solution get even cleaner; hr should rise above 0.3531 or plateau (marking the near-pure-DC limit). (5)BUDGET: n_cg30 ~5.5min. (6)Serial.", "run_id": "breast-ct-claude-agentic-fastdiff-flow-pixel-constrained-search-20260703-01", "runtime": {"elapsed_s": 327.71870255470276}, "schema_version": 3, "solver_key": "fastdiff-flow-pixel-constrained", "solver_name": "Fast-diffusion flow (pixel, constrained DC)", "split": {"train_n": 400, "val_n": 200}, "status": "keep", "ts": "2026-07-06T21:55:01Z"}
