{"advice_for_others": "param_efficient-claude-agentic: reg_type=bilateral, bilateral_on_top=False, proj_filter_on=False, n_iter=40, learnable_alpha=True, alpha_init=0.1, foe_n_filters=24, foe_kernel=7, foe_n_bumps=31, n_bf=3, bf_multiscale=True, bf_sigmas=[0.8, 1.6, 3.2], bf_kernel=7, bf_sigma_r=0.02, bf_gain_init=0.0, epochs=16, cosine_lr=True, lr=0.005, max_train_s=2400, batch_size=4, train_n=200, val_n=200, display_min=0.0, display_max=0.05, seed=42, rationale=iter-12 param_efficient breast -- DEEP-K FRONTIER PROBE (decouple depth from undertraining). SIX-BOX: (1) PRIOR: filtered-DC depth is STILL climbing, NOT saturated: K10 0.3352(16ep) -> K20 0.3774(9ep) -> K30 0.4345(6ep), 13 params throughout. But the 1080s wall now cuts K30 at only 6 epochs, so the epochs-vs-wall confound is SEVERE -- each deeper K trains LESS, muddying whether hr would be even higher if trained fully. (2) FAILURE MODE: undertraining masks the true deep-K hr. (3) ONE KNOB (intent = depth at FULL training): n_iter 30->40 AND max_train_s 1080->2400 so the run reaches all 16 epochs -- this DECOUPLES depth from the wall confound. Coordinator explicitly authorized a higher --time for the deep-K frontier probes (this is the finale, not a routine search iter). sbatch --time raised to 00:50:00 to match. Still 13 params. (4) HYPOTHESIS: at K=40 trained to FULL 16 epochs, hr climbs clearly past K30's 0.4345 -- and this run also tells me the TRUE achievable hr of the filtered-DC compact when NOT undertrained, so I can then re-baseline the K-sweep. If K=40-fully-trained only matches K30-undertrained, depth has saturated ~K30 and the next lever is STACKING capacity. (5) BUDGET: DELIBERATE EXCEPTION -- K=40 x 16 epochs, max_train_s=2400 (~40min train) + 200-val, sbatch --time=00:50:00. Justified: frontier finale, decouples the depth signal. (6) SERIAL; iter-13 self-dispatches (next: re-fix the epochs-normalised best-K, then STACK FoE capacity + directional streak-reg on the filtered-DC unroll toward VN 0.63)., dc_mode=filtered, per_step_alpha=False", "agent": "param_efficient-claude-agentic", "campaign": "search-20260703-01", "cfg_full": {"alpha_init": 0.1, "batch_size": 4, "bf_gain_init": 0.0, "bf_kernel": 7, "bf_multiscale": true, "bf_sigma_r": 0.02, "bf_sigmas": [0.8, 1.6, 3.2], "bilateral_on_top": false, "cosine_lr": true, "dc_mode": "filtered", "display_max": 0.05, "display_min": 0.0, "epochs": 16, "foe_kernel": 7, "foe_n_bumps": 31, "foe_n_filters": 24, "learnable_alpha": true, "lr": 0.005, "max_train_s": 2400, "n_bf": 3, "n_iter": 40, "per_step_alpha": false, "proj_filter_on": false, "rationale": "iter-12 param_efficient breast -- DEEP-K FRONTIER PROBE (decouple depth from undertraining). SIX-BOX: (1) PRIOR: filtered-DC depth is STILL climbing, NOT saturated: K10 0.3352(16ep) -> K20 0.3774(9ep) -> K30 0.4345(6ep), 13 params throughout. But the 1080s wall now cuts K30 at only 6 epochs, so the epochs-vs-wall confound is SEVERE -- each deeper K trains LESS, muddying whether hr would be even higher if trained fully. (2) FAILURE MODE: undertraining masks the true deep-K hr. (3) ONE KNOB (intent = depth at FULL training): n_iter 30->40 AND max_train_s 1080->2400 so the run reaches all 16 epochs -- this DECOUPLES depth from the wall confound. Coordinator explicitly authorized a higher --time for the deep-K frontier probes (this is the finale, not a routine search iter). sbatch --time raised to 00:50:00 to match. Still 13 params. (4) HYPOTHESIS: at K=40 trained to FULL 16 epochs, hr climbs clearly past K30's 0.4345 -- and this run also tells me the TRUE achievable hr of the filtered-DC compact when NOT undertrained, so I can then re-baseline the K-sweep. If K=40-fully-trained only matches K30-undertrained, depth has saturated ~K30 and the next lever is STACKING capacity. (5) BUDGET: DELIBERATE EXCEPTION -- K=40 x 16 epochs, max_train_s=2400 (~40min train) + 200-val, sbatch --time=00:50:00. Justified: frontier finale, decouples the depth signal. (6) SERIAL; iter-13 self-dispatches (next: re-fix the epochs-normalised best-K, then STACK FoE capacity + directional streak-reg on the filtered-DC unroll toward VN 0.63).", "reg_type": "bilateral", "seed": 42, "train_n": 200, "val_n": 200}, "challenge": "breast_ct", "change_class": "architecture", "git_commit": "671da566", "images": {"comparison": "runs/breast-ct-claude-agentic-param-efficient-search-20260703-01/iterations/iter-0012/comparison.png", "test_showcase": null, "valtest_showcase": null}, "iter": 12, "kept": true, "metrics": {"headroom": 0.36780078282923223, "headroom_std": 0.008504826453220033, "val_psnr": 40.3071174621582, "val_psnr_std": 0.49277456198297376, "val_rmse": 0.003296466078609228, "val_rmse_std": 0.00018089299247246742, "val_ssim": 0.9689271450042725, "val_ssim_std": 0.002833700015957791}, "model": "claude-opus-4-8-1m", "obs_path": "breast-ct-claude-agentic-param-efficient-search-20260703-01/iterations/iter-0012/observation.json", "obs_sha1": "7b43c09369ed52076a91fe51a7989b1b4184de93", "params_M": 1.3e-05, "params_source": "observation", "rationale": "param_efficient-claude-agentic: reg_type=bilateral, bilateral_on_top=False, proj_filter_on=False, n_iter=40, learnable_alpha=True, alpha_init=0.1, foe_n_filters=24, foe_kernel=7, foe_n_bumps=31, n_bf=3, bf_multiscale=True, bf_sigmas=[0.8, 1.6, 3.2], bf_kernel=7, bf_sigma_r=0.02, bf_gain_init=0.0, epochs=16, cosine_lr=True, lr=0.005, max_train_s=2400, batch_size=4, train_n=200, val_n=200, display_min=0.0, display_max=0.05, seed=42, rationale=iter-12 param_efficient breast -- DEEP-K FRONTIER PROBE (decouple depth from undertraining). SIX-BOX: (1) PRIOR: filtered-DC depth is STILL climbing, NOT saturated: K10 0.3352(16ep) -> K20 0.3774(9ep) -> K30 0.4345(6ep), 13 params throughout. But the 1080s wall now cuts K30 at only 6 epochs, so the epochs-vs-wall confound is SEVERE -- each deeper K trains LESS, muddying whether hr would be even higher if trained fully. (2) FAILURE MODE: undertraining masks the true deep-K hr. (3) ONE KNOB (intent = depth at FULL training): n_iter 30->40 AND max_train_s 1080->2400 so the run reaches all 16 epochs -- this DECOUPLES depth from the wall confound. Coordinator explicitly authorized a higher --time for the deep-K frontier probes (this is the finale, not a routine search iter). sbatch --time raised to 00:50:00 to match. Still 13 params. (4) HYPOTHESIS: at K=40 trained to FULL 16 epochs, hr climbs clearly past K30's 0.4345 -- and this run also tells me the TRUE achievable hr of the filtered-DC compact when NOT undertrained, so I can then re-baseline the K-sweep. If K=40-fully-trained only matches K30-undertrained, depth has saturated ~K30 and the next lever is STACKING capacity. (5) BUDGET: DELIBERATE EXCEPTION -- K=40 x 16 epochs, max_train_s=2400 (~40min train) + 200-val, sbatch --time=00:50:00. Justified: frontier finale, decouples the depth signal. (6) SERIAL; iter-13 self-dispatches (next: re-fix the epochs-normalised best-K, then STACK FoE capacity + directional streak-reg on the filtered-DC unroll toward VN 0.63)., dc_mode=filtered, per_step_alpha=False", "run_id": "breast-ct-claude-agentic-param-efficient-search-20260703-01", "runtime": {"elapsed_s": 2670.733811378479}, "schema_version": 3, "solver_key": "param-efficient", "solver_name": "Param-efficient (evolved)", "split": {"train_n": 200, "val_n": 200}, "status": "keep", "ts": "2026-07-07T03:55:17Z"}
{"advice_for_others": "param_efficient-claude-agentic: reg_type=foe, bilateral_on_top=True, proj_filter_on=False, n_iter=30, learnable_alpha=True, alpha_init=0.1, foe_n_filters=8, foe_kernel=5, foe_n_bumps=11, n_bf=3, bf_multiscale=True, bf_sigmas=[0.8, 1.6, 3.2], bf_kernel=7, bf_sigma_r=0.02, bf_gain_init=0.0, epochs=16, cosine_lr=True, lr=0.005, max_train_s=1080, batch_size=4, train_n=200, val_n=200, display_min=0.0, display_max=0.05, seed=42, rationale=iter-13 param_efficient breast -- CAPACITY-STACK #1: small FoE prox on the filtered-DC K=30 unroll (20-min budget). SIX-BOX: (1) PRIOR: filtered-DC (fbp(Rx-g)) is the sparse-view lever; 20-min K-sweep saturated at K=30 -> hr 0.4345 @ 13 params (CHAMPION). iter-12 diagnostic (K=40, 50-min, 10ep) gave only 0.368 -- CONFIRMS depth saturated ~K30 (alpha collapsed to 0.006). So depth is done; the climb toward VN 0.63 now needs CAPACITY. (2) FAILURE MODE: the 13-param bilateral gate lacks the learned-filter capacity VN uses to reach 0.63; it can preserve edges but not learn rich streak-removing priors. (3) ONE KNOB: reg_type bilateral->foe with bilateral_on_top=True at a SMALL FoE geometry (nf8/k5/nb11 = 300 reg params; total ~312 with alpha). All else byte-for-byte iter-11 (filtered-DC K=30, 20-min wall). FoE zero-init RBF => FoE(x)=0 at init AND bilateral gains zero-init => pipeline == the 0.4345 champion BYTE-FOR-BYTE at init (worst case == 0.4345, NO regression). (4) HYPOTHESIS: a small learned FoE filter bank (the mechanism that gets VN to 0.63) added to the filtered-DC unroll gives the prox genuine streak-removing capacity -> hr climbs past 0.4345 toward the VN regime, at ~312 params (still ~30x fewer than VN's 9k). Kept SMALL (300p) so it trains within the ~6 epochs K=30 allows in 20 min. (5) BUDGET: K=30 filtered + small FoE (nf8/k5 is CHEAP per step), train_n=200, max_train_s=1080, --time=00:30:00, 200-val -> 20-min budget, comparable to all solvers. (6) SERIAL; iter-14 self-dispatches (next: if FoE capacity helps, GROW nf/nb along the params-vs-hr frontier; if not, directional streak-reg instead)., dc_mode=filtered, per_step_alpha=False, foe_rbf_init_std=0.0", "agent": "param_efficient-claude-agentic", "campaign": "search-20260703-01", "cfg_full": {"alpha_init": 0.1, "batch_size": 4, "bf_gain_init": 0.0, "bf_kernel": 7, "bf_multiscale": true, "bf_sigma_r": 0.02, "bf_sigmas": [0.8, 1.6, 3.2], "bilateral_on_top": true, "cosine_lr": true, "dc_mode": "filtered", "display_max": 0.05, "display_min": 0.0, "epochs": 16, "foe_kernel": 5, "foe_n_bumps": 11, "foe_n_filters": 8, "foe_rbf_init_std": 0.0, "learnable_alpha": true, "lr": 0.005, "max_train_s": 1080, "n_bf": 3, "n_iter": 30, "per_step_alpha": false, "proj_filter_on": false, "rationale": "iter-13 param_efficient breast -- CAPACITY-STACK #1: small FoE prox on the filtered-DC K=30 unroll (20-min budget). SIX-BOX: (1) PRIOR: filtered-DC (fbp(Rx-g)) is the sparse-view lever; 20-min K-sweep saturated at K=30 -> hr 0.4345 @ 13 params (CHAMPION). iter-12 diagnostic (K=40, 50-min, 10ep) gave only 0.368 -- CONFIRMS depth saturated ~K30 (alpha collapsed to 0.006). So depth is done; the climb toward VN 0.63 now needs CAPACITY. (2) FAILURE MODE: the 13-param bilateral gate lacks the learned-filter capacity VN uses to reach 0.63; it can preserve edges but not learn rich streak-removing priors. (3) ONE KNOB: reg_type bilateral->foe with bilateral_on_top=True at a SMALL FoE geometry (nf8/k5/nb11 = 300 reg params; total ~312 with alpha). All else byte-for-byte iter-11 (filtered-DC K=30, 20-min wall). FoE zero-init RBF => FoE(x)=0 at init AND bilateral gains zero-init => pipeline == the 0.4345 champion BYTE-FOR-BYTE at init (worst case == 0.4345, NO regression). (4) HYPOTHESIS: a small learned FoE filter bank (the mechanism that gets VN to 0.63) added to the filtered-DC unroll gives the prox genuine streak-removing capacity -> hr climbs past 0.4345 toward the VN regime, at ~312 params (still ~30x fewer than VN's 9k). Kept SMALL (300p) so it trains within the ~6 epochs K=30 allows in 20 min. (5) BUDGET: K=30 filtered + small FoE (nf8/k5 is CHEAP per step), train_n=200, max_train_s=1080, --time=00:30:00, 200-val -> 20-min budget, comparable to all solvers. (6) SERIAL; iter-14 self-dispatches (next: if FoE capacity helps, GROW nf/nb along the params-vs-hr frontier; if not, directional streak-reg instead).", "reg_type": "foe", "seed": 42, "train_n": 200, "val_n": 200}, "challenge": "breast_ct", "change_class": "architecture", "git_commit": "671da566", "images": {"comparison": "runs/breast-ct-claude-agentic-param-efficient-search-20260703-01/iterations/iter-0013/comparison.png", "test_showcase": null, "valtest_showcase": null}, "iter": 13, "kept": false, "metrics": {"headroom": 0.0, "headroom_std": 0.0, "val_psnr": 34.286277770996094, "val_psnr_std": 0.2388673198361748, "val_rmse": 0.006593112833797932, "val_rmse_std": 0.0001458339644511481, "val_ssim": 0.9618072509765625, "val_ssim_std": 0.004039984191065049}, "model": "claude-opus-4-8-1m", "obs_path": "breast-ct-claude-agentic-param-efficient-search-20260703-01/iterations/iter-0013/observation.json", "obs_sha1": "59134a49ff6a136ffa7029f969ec2d154b812c5d", "params_M": 0.000301, "params_source": "observation", "rationale": "param_efficient-claude-agentic: reg_type=foe, bilateral_on_top=True, proj_filter_on=False, n_iter=30, learnable_alpha=True, alpha_init=0.1, foe_n_filters=8, foe_kernel=5, foe_n_bumps=11, n_bf=3, bf_multiscale=True, bf_sigmas=[0.8, 1.6, 3.2], bf_kernel=7, bf_sigma_r=0.02, bf_gain_init=0.0, epochs=16, cosine_lr=True, lr=0.005, max_train_s=1080, batch_size=4, train_n=200, val_n=200, display_min=0.0, display_max=0.05, seed=42, rationale=iter-13 param_efficient breast -- CAPACITY-STACK #1: small FoE prox on the filtered-DC K=30 unroll (20-min budget). SIX-BOX: (1) PRIOR: filtered-DC (fbp(Rx-g)) is the sparse-view lever; 20-min K-sweep saturated at K=30 -> hr 0.4345 @ 13 params (CHAMPION). iter-12 diagnostic (K=40, 50-min, 10ep) gave only 0.368 -- CONFIRMS depth saturated ~K30 (alpha collapsed to 0.006). So depth is done; the climb toward VN 0.63 now needs CAPACITY. (2) FAILURE MODE: the 13-param bilateral gate lacks the learned-filter capacity VN uses to reach 0.63; it can preserve edges but not learn rich streak-removing priors. (3) ONE KNOB: reg_type bilateral->foe with bilateral_on_top=True at a SMALL FoE geometry (nf8/k5/nb11 = 300 reg params; total ~312 with alpha). All else byte-for-byte iter-11 (filtered-DC K=30, 20-min wall). FoE zero-init RBF => FoE(x)=0 at init AND bilateral gains zero-init => pipeline == the 0.4345 champion BYTE-FOR-BYTE at init (worst case == 0.4345, NO regression). (4) HYPOTHESIS: a small learned FoE filter bank (the mechanism that gets VN to 0.63) added to the filtered-DC unroll gives the prox genuine streak-removing capacity -> hr climbs past 0.4345 toward the VN regime, at ~312 params (still ~30x fewer than VN's 9k). Kept SMALL (300p) so it trains within the ~6 epochs K=30 allows in 20 min. (5) BUDGET: K=30 filtered + small FoE (nf8/k5 is CHEAP per step), train_n=200, max_train_s=1080, --time=00:30:00, 200-val -> 20-min budget, comparable to all solvers. (6) SERIAL; iter-14 self-dispatches (next: if FoE capacity helps, GROW nf/nb along the params-vs-hr frontier; if not, directional streak-reg instead)., dc_mode=filtered, per_step_alpha=False, foe_rbf_init_std=0.0", "run_id": "breast-ct-claude-agentic-param-efficient-search-20260703-01", "runtime": {"elapsed_s": 1436.9906959533691}, "schema_version": 3, "solver_key": "param-efficient", "solver_name": "Param-efficient (evolved)", "split": {"train_n": 200, "val_n": 200}, "status": "discard", "ts": "2026-07-07T04:38:24Z"}
