{"advice_for_others": "hammernik_vn-claude-agentic: train_n=200, val_n=200, epochs=15, batch_size=2, lr=0.0003, vn_T=3, vn_n_filters=32, vn_kernel=9, vn_n_bumps=31, vn_lambda_init=0.01, vn_init=fbp, vn_dc_norm=True, vn_checkpoint=True, max_train_s=1080, rationale=iter-8 (one knob: vn_kernel 7 -> 9, hold lambda_init=1e-2 peak). lambda_init axis exhausted: concave peak at 1e-2 (hr 0.523). Now the regulariser is active, give it wider spatial support. Hypothesis: 9x9 filters model breast texture better -> hr>0.523; if flat/down, k7 stays optimal.", "agent": "hammernik_vn-claude-agentic", "campaign": "search-20260703-01", "cfg_full": {"batch_size": 2, "epochs": 15, "lr": 0.0003, "max_train_s": 1080, "rationale": "iter-8 (one knob: vn_kernel 7 -> 9, hold lambda_init=1e-2 peak). lambda_init axis exhausted: concave peak at 1e-2 (hr 0.523). Now the regulariser is active, give it wider spatial support. Hypothesis: 9x9 filters model breast texture better -> hr>0.523; if flat/down, k7 stays optimal.", "train_n": 200, "val_n": 200, "vn_T": 3, "vn_checkpoint": true, "vn_dc_norm": true, "vn_init": "fbp", "vn_kernel": 9, "vn_lambda_init": 0.01, "vn_n_bumps": 31, "vn_n_filters": 32}, "challenge": "breast_ct", "change_class": "architecture", "git_commit": "671da566", "images": {"comparison": "runs/breast-ct-claude-agentic-hammernik-vn-search-20260703-01/iterations/iter-0008/comparison.png", "test_showcase": null, "valtest_showcase": null}, "iter": 8, "kept": true, "metrics": {"headroom": 0.4819772363497178, "headroom_std": 0.012906610823749982, "val_psnr": 42.0372200012207, "val_psnr_std": 0.7373030260804015, "val_rmse": 0.002701117657124996, "val_rmse_std": 0.0002247938957878886, "val_ssim": 0.9771055579185486, "val_ssim_std": 0.003570875084085828}, "model": "claude-opus-4-8-1m", "obs_path": "breast-ct-claude-agentic-hammernik-vn-search-20260703-01/iterations/iter-0008/observation.json", "obs_sha1": "4b435b27340b77c09e056ad8b926187153569390", "params_M": 0.010755, "params_source": "observation", "rationale": "hammernik_vn-claude-agentic: train_n=200, val_n=200, epochs=15, batch_size=2, lr=0.0003, vn_T=3, vn_n_filters=32, vn_kernel=9, vn_n_bumps=31, vn_lambda_init=0.01, vn_init=fbp, vn_dc_norm=True, vn_checkpoint=True, max_train_s=1080, rationale=iter-8 (one knob: vn_kernel 7 -> 9, hold lambda_init=1e-2 peak). lambda_init axis exhausted: concave peak at 1e-2 (hr 0.523). Now the regulariser is active, give it wider spatial support. Hypothesis: 9x9 filters model breast texture better -> hr>0.523; if flat/down, k7 stays optimal.", "run_id": "breast-ct-claude-agentic-hammernik-vn-search-20260703-01", "runtime": {"elapsed_s": 1224.3604190349579}, "schema_version": 3, "solver_key": "hammernik-vn", "solver_name": "Hammernik VN (MRI port)", "split": {"train_n": 200, "val_n": 200}, "status": "keep", "ts": "2026-07-04T22:30:40Z"}
{"advice_for_others": "hammernik_vn-claude-agentic: train_n=200, val_n=200, epochs=15, batch_size=2, lr=0.0003, vn_T=3, vn_n_filters=48, vn_kernel=7, vn_n_bumps=31, vn_lambda_init=0.01, vn_init=fbp, vn_dc_norm=True, vn_checkpoint=True, max_train_s=1080, rationale=iter-9 (one knob: vn_n_filters 32 -> 48, revert kernel to 7). k9 (iter-8) dropped to 0.482 -> larger kernel over-parameterizes at 200 samples; k7 optimal. Try capacity via a WIDER filter bank instead (historical breast note favors this). Hypothesis: 48 filters give the active regulariser more feature diversity -> hr>0.523; if underfits like k9, 32 stays.", "agent": "hammernik_vn-claude-agentic", "campaign": "search-20260703-01", "cfg_full": {"batch_size": 2, "epochs": 15, "lr": 0.0003, "max_train_s": 1080, "rationale": "iter-9 (one knob: vn_n_filters 32 -> 48, revert kernel to 7). k9 (iter-8) dropped to 0.482 -> larger kernel over-parameterizes at 200 samples; k7 optimal. Try capacity via a WIDER filter bank instead (historical breast note favors this). Hypothesis: 48 filters give the active regulariser more feature diversity -> hr>0.523; if underfits like k9, 32 stays.", "train_n": 200, "val_n": 200, "vn_T": 3, "vn_checkpoint": true, "vn_dc_norm": true, "vn_init": "fbp", "vn_kernel": 7, "vn_lambda_init": 0.01, "vn_n_bumps": 31, "vn_n_filters": 48}, "challenge": "breast_ct", "change_class": "architecture", "git_commit": "671da566", "images": {"comparison": "runs/breast-ct-claude-agentic-hammernik-vn-search-20260703-01/iterations/iter-0009/comparison.png", "test_showcase": null, "valtest_showcase": null}, "iter": 9, "kept": true, "metrics": {"headroom": 0.47436113256166124, "headroom_std": 0.01154554290897397, "val_psnr": 41.91044616699219, "val_psnr_std": 0.7062643206814675, "val_rmse": 0.002740830183029175, "val_rmse_std": 0.00021801462502448826, "val_ssim": 0.9778947234153748, "val_ssim_std": 0.003332666667526523}, "model": "claude-opus-4-8-1m", "obs_path": "breast-ct-claude-agentic-hammernik-vn-search-20260703-01/iterations/iter-0009/observation.json", "obs_sha1": "5c5272c5453d6f3c96e99f571a15b1b2ef7b0be4", "params_M": 0.011523, "params_source": "observation", "rationale": "hammernik_vn-claude-agentic: train_n=200, val_n=200, epochs=15, batch_size=2, lr=0.0003, vn_T=3, vn_n_filters=48, vn_kernel=7, vn_n_bumps=31, vn_lambda_init=0.01, vn_init=fbp, vn_dc_norm=True, vn_checkpoint=True, max_train_s=1080, rationale=iter-9 (one knob: vn_n_filters 32 -> 48, revert kernel to 7). k9 (iter-8) dropped to 0.482 -> larger kernel over-parameterizes at 200 samples; k7 optimal. Try capacity via a WIDER filter bank instead (historical breast note favors this). Hypothesis: 48 filters give the active regulariser more feature diversity -> hr>0.523; if underfits like k9, 32 stays.", "run_id": "breast-ct-claude-agentic-hammernik-vn-search-20260703-01", "runtime": {"elapsed_s": 1241.899282693863}, "schema_version": 3, "solver_key": "hammernik-vn", "solver_name": "Hammernik VN (MRI port)", "split": {"train_n": 200, "val_n": 200}, "status": "keep", "ts": "2026-07-05T03:30:56Z"}
{"advice_for_others": "hammernik_vn-claude-agentic: train_n=200, val_n=200, epochs=15, batch_size=2, lr=0.0006, vn_T=3, vn_n_filters=32, vn_kernel=7, vn_n_bumps=31, vn_lambda_init=0.01, vn_init=fbp, vn_dc_norm=True, vn_checkpoint=True, max_train_s=1080, rationale=iter-10 (one knob: lr 3e-4 -> 6e-4, best arch T3/f32/k7/lambda1e-2). All capacity bumps (T4, k9, f48) hurt; f32/k7 optimal. Training is wall-capped ~12 epochs, so faster convergence could help. Hypothesis: 2x lr converges the active filter bank+lambda better within the wall -> hr>0.523; if it destabilizes, 3e-4 stays.", "agent": "hammernik_vn-claude-agentic", "campaign": "search-20260703-01", "cfg_full": {"batch_size": 2, "epochs": 15, "lr": 0.0006, "max_train_s": 1080, "rationale": "iter-10 (one knob: lr 3e-4 -> 6e-4, best arch T3/f32/k7/lambda1e-2). All capacity bumps (T4, k9, f48) hurt; f32/k7 optimal. Training is wall-capped ~12 epochs, so faster convergence could help. Hypothesis: 2x lr converges the active filter bank+lambda better within the wall -> hr>0.523; if it destabilizes, 3e-4 stays.", "train_n": 200, "val_n": 200, "vn_T": 3, "vn_checkpoint": true, "vn_dc_norm": true, "vn_init": "fbp", "vn_kernel": 7, "vn_lambda_init": 0.01, "vn_n_bumps": 31, "vn_n_filters": 32}, "challenge": "breast_ct", "change_class": "architecture", "git_commit": "671da566", "images": {"comparison": "runs/breast-ct-claude-agentic-hammernik-vn-search-20260703-01/iterations/iter-0010/comparison.png", "test_showcase": null, "valtest_showcase": null}, "iter": 10, "kept": true, "metrics": {"headroom": 0.5443857155321561, "headroom_std": 0.01352596110970021, "val_psnr": 43.152252197265625, "val_psnr_std": 0.7820991707221172, "val_rmse": 0.002375702140852809, "val_rmse_std": 0.00020963800728387609, "val_ssim": 0.9816706776618958, "val_ssim_std": 0.002922819617438282}, "model": "claude-opus-4-8-1m", "obs_path": "breast-ct-claude-agentic-hammernik-vn-search-20260703-01/iterations/iter-0010/observation.json", "obs_sha1": "396efdb3c23654e8848e7176f49ca18d09df643c", "params_M": 0.007683, "params_source": "observation", "rationale": "hammernik_vn-claude-agentic: train_n=200, val_n=200, epochs=15, batch_size=2, lr=0.0006, vn_T=3, vn_n_filters=32, vn_kernel=7, vn_n_bumps=31, vn_lambda_init=0.01, vn_init=fbp, vn_dc_norm=True, vn_checkpoint=True, max_train_s=1080, rationale=iter-10 (one knob: lr 3e-4 -> 6e-4, best arch T3/f32/k7/lambda1e-2). All capacity bumps (T4, k9, f48) hurt; f32/k7 optimal. Training is wall-capped ~12 epochs, so faster convergence could help. Hypothesis: 2x lr converges the active filter bank+lambda better within the wall -> hr>0.523; if it destabilizes, 3e-4 stays.", "run_id": "breast-ct-claude-agentic-hammernik-vn-search-20260703-01", "runtime": {"elapsed_s": 957.430370092392}, "schema_version": 3, "solver_key": "hammernik-vn", "solver_name": "Hammernik VN (MRI port)", "split": {"train_n": 200, "val_n": 200}, "status": "keep", "ts": "2026-07-05T05:26:10Z"}
{"advice_for_others": "hammernik_vn-claude-agentic: train_n=200, val_n=200, epochs=15, batch_size=2, lr=0.0012, vn_T=3, vn_n_filters=32, vn_kernel=7, vn_n_bumps=31, vn_lambda_init=0.01, vn_init=fbp, vn_dc_norm=True, vn_checkpoint=True, max_train_s=1080, rationale=iter-11 (one knob: lr 6e-4 -> 1.2e-3). iter-10 lifted 0.523->0.544 by doubling lr (wall-capped training converges better with faster lr). Hypothesis: push lr up again -> hr>0.544; if it overshoots/destabilizes, 6e-4 brackets the peak.", "agent": "hammernik_vn-claude-agentic", "campaign": "search-20260703-01", "cfg_full": {"batch_size": 2, "epochs": 15, "lr": 0.0012, "max_train_s": 1080, "rationale": "iter-11 (one knob: lr 6e-4 -> 1.2e-3). iter-10 lifted 0.523->0.544 by doubling lr (wall-capped training converges better with faster lr). Hypothesis: push lr up again -> hr>0.544; if it overshoots/destabilizes, 6e-4 brackets the peak.", "train_n": 200, "val_n": 200, "vn_T": 3, "vn_checkpoint": true, "vn_dc_norm": true, "vn_init": "fbp", "vn_kernel": 7, "vn_lambda_init": 0.01, "vn_n_bumps": 31, "vn_n_filters": 32}, "challenge": "breast_ct", "change_class": "architecture", "git_commit": "671da566", "images": {"comparison": "runs/breast-ct-claude-agentic-hammernik-vn-search-20260703-01/iterations/iter-0011/comparison.png", "test_showcase": null, "valtest_showcase": null}, "iter": 11, "kept": true, "metrics": {"headroom": 0.554082401131172, "headroom_std": 0.011642347175594573, "val_psnr": 43.33910369873047, "val_psnr_std": 0.7317145858482313, "val_rmse": 0.0023251408711075783, "val_rmse_std": 0.00019354514126119596, "val_ssim": 0.9829810857772827, "val_ssim_std": 0.0025233052768049917}, "model": "claude-opus-4-8-1m", "obs_path": "breast-ct-claude-agentic-hammernik-vn-search-20260703-01/iterations/iter-0011/observation.json", "obs_sha1": "93d7dbce3f2e0c888ed20c3fe5b99b73cc78305d", "params_M": 0.007683, "params_source": "observation", "rationale": "hammernik_vn-claude-agentic: train_n=200, val_n=200, epochs=15, batch_size=2, lr=0.0012, vn_T=3, vn_n_filters=32, vn_kernel=7, vn_n_bumps=31, vn_lambda_init=0.01, vn_init=fbp, vn_dc_norm=True, vn_checkpoint=True, max_train_s=1080, rationale=iter-11 (one knob: lr 6e-4 -> 1.2e-3). iter-10 lifted 0.523->0.544 by doubling lr (wall-capped training converges better with faster lr). Hypothesis: push lr up again -> hr>0.544; if it overshoots/destabilizes, 6e-4 brackets the peak.", "run_id": "breast-ct-claude-agentic-hammernik-vn-search-20260703-01", "runtime": {"elapsed_s": 958.5946061611176}, "schema_version": 3, "solver_key": "hammernik-vn", "solver_name": "Hammernik VN (MRI port)", "split": {"train_n": 200, "val_n": 200}, "status": "keep", "ts": "2026-07-05T06:26:11Z"}
{"advice_for_others": "hammernik_vn-claude-agentic: train_n=200, val_n=200, epochs=15, batch_size=2, lr=0.0024, vn_T=3, vn_n_filters=32, vn_kernel=7, vn_n_bumps=31, vn_lambda_init=0.01, vn_init=fbp, vn_dc_norm=True, vn_checkpoint=True, max_train_s=1080, rationale=iter-12 (one knob: lr 1.2e-3 -> 2.4e-3). lr sweep still rising but flattening (6e-4->0.5444, 1.2e-3->0.5541). Push once more to bracket the peak. Hypothesis: 2.4e-3 either edges >0.5541 or turns over (peak ~1.2e-3).", "agent": "hammernik_vn-claude-agentic", "campaign": "search-20260703-01", "cfg_full": {"batch_size": 2, "epochs": 15, "lr": 0.0024, "max_train_s": 1080, "rationale": "iter-12 (one knob: lr 1.2e-3 -> 2.4e-3). lr sweep still rising but flattening (6e-4->0.5444, 1.2e-3->0.5541). Push once more to bracket the peak. Hypothesis: 2.4e-3 either edges >0.5541 or turns over (peak ~1.2e-3).", "train_n": 200, "val_n": 200, "vn_T": 3, "vn_checkpoint": true, "vn_dc_norm": true, "vn_init": "fbp", "vn_kernel": 7, "vn_lambda_init": 0.01, "vn_n_bumps": 31, "vn_n_filters": 32}, "challenge": "breast_ct", "change_class": "architecture", "git_commit": "671da566", "images": {"comparison": "runs/breast-ct-claude-agentic-hammernik-vn-search-20260703-01/iterations/iter-0012/comparison.png", "test_showcase": null, "valtest_showcase": null}, "iter": 12, "kept": true, "metrics": {"headroom": 0.5766480623641392, "headroom_std": 0.01572221716263314, "val_psnr": 43.79016876220703, "val_psnr_std": 0.8664328350408738, "val_rmse": 0.0022074771113693714, "val_rmse_std": 0.00021642542171830323, "val_ssim": 0.9850606322288513, "val_ssim_std": 0.00283016341496515}, "model": "claude-opus-4-8-1m", "obs_path": "breast-ct-claude-agentic-hammernik-vn-search-20260703-01/iterations/iter-0012/observation.json", "obs_sha1": "8785a25cd6fba1db5d3903de3969662b905b4fe9", "params_M": 0.007683, "params_source": "observation", "rationale": "hammernik_vn-claude-agentic: train_n=200, val_n=200, epochs=15, batch_size=2, lr=0.0024, vn_T=3, vn_n_filters=32, vn_kernel=7, vn_n_bumps=31, vn_lambda_init=0.01, vn_init=fbp, vn_dc_norm=True, vn_checkpoint=True, max_train_s=1080, rationale=iter-12 (one knob: lr 1.2e-3 -> 2.4e-3). lr sweep still rising but flattening (6e-4->0.5444, 1.2e-3->0.5541). Push once more to bracket the peak. Hypothesis: 2.4e-3 either edges >0.5541 or turns over (peak ~1.2e-3).", "run_id": "breast-ct-claude-agentic-hammernik-vn-search-20260703-01", "runtime": {"elapsed_s": 955.6766436100006}, "schema_version": 3, "solver_key": "hammernik-vn", "solver_name": "Hammernik VN (MRI port)", "split": {"train_n": 200, "val_n": 200}, "status": "keep", "ts": "2026-07-05T07:26:09Z"}
{"advice_for_others": "hammernik_vn-claude-agentic: train_n=200, val_n=200, epochs=15, batch_size=2, lr=0.0048, vn_T=3, vn_n_filters=32, vn_kernel=7, vn_n_bumps=31, vn_lambda_init=0.01, vn_init=fbp, vn_dc_norm=True, vn_checkpoint=True, max_train_s=1080, rationale=iter-13 (one knob: lr 2.4e-3 -> 4.8e-3). lr sweep still monotone rising (1.2e-3->0.5541, 2.4e-3->0.5766). Push again to find the peak. Hypothesis: hr keeps rising or turns over; 4.8e-3 locates whether the peak is >2.4e-3.", "agent": "hammernik_vn-claude-agentic", "campaign": "search-20260703-01", "cfg_full": {"batch_size": 2, "epochs": 15, "lr": 0.0048, "max_train_s": 1080, "rationale": "iter-13 (one knob: lr 2.4e-3 -> 4.8e-3). lr sweep still monotone rising (1.2e-3->0.5541, 2.4e-3->0.5766). Push again to find the peak. Hypothesis: hr keeps rising or turns over; 4.8e-3 locates whether the peak is >2.4e-3.", "train_n": 200, "val_n": 200, "vn_T": 3, "vn_checkpoint": true, "vn_dc_norm": true, "vn_init": "fbp", "vn_kernel": 7, "vn_lambda_init": 0.01, "vn_n_bumps": 31, "vn_n_filters": 32}, "challenge": "breast_ct", "change_class": "architecture", "git_commit": "671da566", "images": {"comparison": "runs/breast-ct-claude-agentic-hammernik-vn-search-20260703-01/iterations/iter-0013/comparison.png", "test_showcase": null, "valtest_showcase": null}, "iter": 13, "kept": true, "metrics": {"headroom": 0.5076279813449127, "headroom_std": 0.010426347222736781, "val_psnr": 42.478328704833984, "val_psnr_std": 0.6968315942005572, "val_rmse": 0.0025673673953861, "val_rmse_std": 0.000202260736371106, "val_ssim": 0.9828097224235535, "val_ssim_std": 0.0026769233598954584}, "model": "claude-opus-4-8-1m", "obs_path": "breast-ct-claude-agentic-hammernik-vn-search-20260703-01/iterations/iter-0013/observation.json", "obs_sha1": "f57e36287376ef4e2a08f399796e45698a47078c", "params_M": 0.007683, "params_source": "observation", "rationale": "hammernik_vn-claude-agentic: train_n=200, val_n=200, epochs=15, batch_size=2, lr=0.0048, vn_T=3, vn_n_filters=32, vn_kernel=7, vn_n_bumps=31, vn_lambda_init=0.01, vn_init=fbp, vn_dc_norm=True, vn_checkpoint=True, max_train_s=1080, rationale=iter-13 (one knob: lr 2.4e-3 -> 4.8e-3). lr sweep still monotone rising (1.2e-3->0.5541, 2.4e-3->0.5766). Push again to find the peak. Hypothesis: hr keeps rising or turns over; 4.8e-3 locates whether the peak is >2.4e-3.", "run_id": "breast-ct-claude-agentic-hammernik-vn-search-20260703-01", "runtime": {"elapsed_s": 956.2036230564117}, "schema_version": 3, "solver_key": "hammernik-vn", "solver_name": "Hammernik VN (MRI port)", "split": {"train_n": 200, "val_n": 200}, "status": "keep", "ts": "2026-07-05T08:26:09Z"}
{"advice_for_others": "hammernik_vn-claude-agentic: train_n=200, val_n=200, epochs=15, batch_size=2, lr=0.0035, vn_T=3, vn_n_filters=32, vn_kernel=7, vn_n_bumps=31, vn_lambda_init=0.01, vn_init=fbp, vn_dc_norm=True, vn_checkpoint=True, max_train_s=1080, rationale=iter-14 (one knob: lr 2.4e-3 -> 3.5e-3). lr peak bracketed: 2.4e-3->0.5766 (best), 4.8e-3->0.5076 (destabilized). Refine the midpoint. Hypothesis: 3.5e-3 either exceeds 0.5766 (peak >2.4e-3) or falls between, tightening the optimum.", "agent": "hammernik_vn-claude-agentic", "campaign": "search-20260703-01", "cfg_full": {"batch_size": 2, "epochs": 15, "lr": 0.0035, "max_train_s": 1080, "rationale": "iter-14 (one knob: lr 2.4e-3 -> 3.5e-3). lr peak bracketed: 2.4e-3->0.5766 (best), 4.8e-3->0.5076 (destabilized). Refine the midpoint. Hypothesis: 3.5e-3 either exceeds 0.5766 (peak >2.4e-3) or falls between, tightening the optimum.", "train_n": 200, "val_n": 200, "vn_T": 3, "vn_checkpoint": true, "vn_dc_norm": true, "vn_init": "fbp", "vn_kernel": 7, "vn_lambda_init": 0.01, "vn_n_bumps": 31, "vn_n_filters": 32}, "challenge": "breast_ct", "change_class": "architecture", "git_commit": "671da566", "images": {"comparison": "runs/breast-ct-claude-agentic-hammernik-vn-search-20260703-01/iterations/iter-0014/comparison.png", "test_showcase": null, "valtest_showcase": null}, "iter": 14, "kept": false, "metrics": {"headroom": 0.0, "headroom_std": 0.0, "val_psnr": -173.7239227294922, "val_psnr_std": 0.17265547033873088, "val_rmse": 165806288.0, "val_rmse_std": 1260183.1058052417, "val_ssim": 0.18124370276927948, "val_ssim_std": 7.138883031508876e-06}, "model": "claude-opus-4-8-1m", "obs_path": "breast-ct-claude-agentic-hammernik-vn-search-20260703-01/iterations/iter-0014/observation.json", "obs_sha1": "db11f5fb5d890d01d890364c3a39802c12427826", "params_M": 0.007683, "params_source": "observation", "rationale": "hammernik_vn-claude-agentic: train_n=200, val_n=200, epochs=15, batch_size=2, lr=0.0035, vn_T=3, vn_n_filters=32, vn_kernel=7, vn_n_bumps=31, vn_lambda_init=0.01, vn_init=fbp, vn_dc_norm=True, vn_checkpoint=True, max_train_s=1080, rationale=iter-14 (one knob: lr 2.4e-3 -> 3.5e-3). lr peak bracketed: 2.4e-3->0.5766 (best), 4.8e-3->0.5076 (destabilized). Refine the midpoint. Hypothesis: 3.5e-3 either exceeds 0.5766 (peak >2.4e-3) or falls between, tightening the optimum.", "run_id": "breast-ct-claude-agentic-hammernik-vn-search-20260703-01", "runtime": {"elapsed_s": 958.3912997245789}, "schema_version": 3, "solver_key": "hammernik-vn", "solver_name": "Hammernik VN (MRI port)", "split": {"train_n": 200, "val_n": 200}, "status": "discard", "ts": "2026-07-05T09:26:12Z"}
