{"advice_for_others": "param_efficient-claude-agentic: reg_type=bilateral, bilateral_on_top=False, proj_filter_on=False, n_iter=30, learnable_alpha=True, alpha_init=0.1, foe_n_filters=24, foe_kernel=7, foe_n_bumps=31, n_bf=1, bf_multiscale=True, bf_sigmas=[0.8, 1.6, 3.2], bf_kernel=7, bf_sigma_r=0.02, bf_gain_init=0.0, epochs=16, cosine_lr=True, lr=0.005, max_train_s=1080, batch_size=4, train_n=200, val_n=200, display_min=0.0, display_max=0.05, seed=42, rationale=iter-28 param_efficient breast -- MULTI-SCALE BILATERAL POST-FILTER (output denoiser, highest remaining upside). SIX-BOX: (1) PRIOR: champion LPD-combine W=4 filtered-DC K=30 = 0.4590+-0.0294 (best 0.5047) @ 183p. In-loop prox FAILED (iters13-14/24, hr 0.0) -- but that was INSIDE the DC step. fastdiff finding: an edge-preserving denoiser helps at the OUTPUT, not in-loop. UNTESTED here. (2) FAILURE MODE: the data-consistent recon still carries residual streak-noise the DC+LPD leaves; a light output bilateral could clean it WITHOUT disturbing the DC (it is post-hoc, not in the consistency loop). (3) ONE KNOB: post_bilateral=True -- a 3-scale edge-preserving bilateral bank on the FINAL x: x_out = x + Sum_i g_i*(BF_i(x)-x), g_i ZERO-INIT => identity at init => pipeline == the 0.5047 champion BYTE-FOR-BYTE. +12 params (3 filters x (3 sigma + 1 gain)) -> 195 total. sigma_r=0.02 tight range kernel (edge-preserving, cannot over-smooth fibroglandular detail). All else byte-for-byte iter-15. (4) HYPOTHESIS: a light multi-scale edge-preserving denoiser on the OUTPUT removes residual streak-noise the unroll leaves -> hr climbs past 0.5047, because the denoiser role (output) is productive where the in-loop prox role was not. (5) BUDGET: 3 bilaterals applied ONCE at output (cheap vs K=30 unroll); iter-15 finished 16ep in 1020s -> ~14-16ep; train_n=200, max_train_s=1080, --time=00:30:00, 200-val -> 20-min. (6) SERIAL; iter-29: if post-BF helps, tune scales/sigma_r; else record + continue menu (learned per-step DC schedule, 2-step LPD, grad-clip variance reduction)., dc_mode=filtered, per_step_alpha=True, lpd_on=True, lpd_width=4, lpd_kernel=3, anisotropic_on_top=False, post_bilateral=True, post_n_bf=3, post_bf_kernel=7, post_bf_sigma_r=0.02", "agent": "param_efficient-claude-agentic", "campaign": "search-20260703-01", "cfg_full": {"alpha_init": 0.1, "anisotropic_on_top": false, "batch_size": 4, "bf_gain_init": 0.0, "bf_kernel": 7, "bf_multiscale": true, "bf_sigma_r": 0.02, "bf_sigmas": [0.8, 1.6, 3.2], "bilateral_on_top": false, "cosine_lr": true, "dc_mode": "filtered", "display_max": 0.05, "display_min": 0.0, "epochs": 16, "foe_kernel": 7, "foe_n_bumps": 31, "foe_n_filters": 24, "learnable_alpha": true, "lpd_kernel": 3, "lpd_on": true, "lpd_width": 4, "lr": 0.005, "max_train_s": 1080, "n_bf": 1, "n_iter": 30, "per_step_alpha": true, "post_bf_kernel": 7, "post_bf_sigma_r": 0.02, "post_bilateral": true, "post_n_bf": 3, "proj_filter_on": false, "rationale": "iter-28 param_efficient breast -- MULTI-SCALE BILATERAL POST-FILTER (output denoiser, highest remaining upside). SIX-BOX: (1) PRIOR: champion LPD-combine W=4 filtered-DC K=30 = 0.4590+-0.0294 (best 0.5047) @ 183p. In-loop prox FAILED (iters13-14/24, hr 0.0) -- but that was INSIDE the DC step. fastdiff finding: an edge-preserving denoiser helps at the OUTPUT, not in-loop. UNTESTED here. (2) FAILURE MODE: the data-consistent recon still carries residual streak-noise the DC+LPD leaves; a light output bilateral could clean it WITHOUT disturbing the DC (it is post-hoc, not in the consistency loop). (3) ONE KNOB: post_bilateral=True -- a 3-scale edge-preserving bilateral bank on the FINAL x: x_out = x + Sum_i g_i*(BF_i(x)-x), g_i ZERO-INIT => identity at init => pipeline == the 0.5047 champion BYTE-FOR-BYTE. +12 params (3 filters x (3 sigma + 1 gain)) -> 195 total. sigma_r=0.02 tight range kernel (edge-preserving, cannot over-smooth fibroglandular detail). All else byte-for-byte iter-15. (4) HYPOTHESIS: a light multi-scale edge-preserving denoiser on the OUTPUT removes residual streak-noise the unroll leaves -> hr climbs past 0.5047, because the denoiser role (output) is productive where the in-loop prox role was not. (5) BUDGET: 3 bilaterals applied ONCE at output (cheap vs K=30 unroll); iter-15 finished 16ep in 1020s -> ~14-16ep; train_n=200, max_train_s=1080, --time=00:30:00, 200-val -> 20-min. (6) SERIAL; iter-29: if post-BF helps, tune scales/sigma_r; else record + continue menu (learned per-step DC schedule, 2-step LPD, grad-clip variance reduction).", "reg_type": "bilateral", "seed": 42, "train_n": 200, "val_n": 200}, "challenge": "breast_ct", "change_class": "architecture", "git_commit": "671da566", "images": {"comparison": "runs/breast-ct-claude-agentic-param-efficient-search-20260703-01/iterations/iter-0028/comparison.png", "test_showcase": null, "valtest_showcase": null}, "iter": 28, "kept": true, "metrics": {"headroom": 0.6200783043564111, "headroom_std": 0.007811968623900262, "val_psnr": 44.730316162109375, "val_psnr_std": 0.6513158753322934, "val_rmse": 0.0019810195080935955, "val_rmse_std": 0.00014619294385263896, "val_ssim": 0.9906948804855347, "val_ssim_std": 0.001683433041185298}, "model": "claude-opus-4-8-1m", "obs_path": "breast-ct-claude-agentic-param-efficient-search-20260703-01/iterations/iter-0028/observation.json", "obs_sha1": "f7883e23c3c277240cb324f8cb10380db9703d84", "params_M": 0.000195, "params_source": "observation", "rationale": "param_efficient-claude-agentic: reg_type=bilateral, bilateral_on_top=False, proj_filter_on=False, n_iter=30, learnable_alpha=True, alpha_init=0.1, foe_n_filters=24, foe_kernel=7, foe_n_bumps=31, n_bf=1, bf_multiscale=True, bf_sigmas=[0.8, 1.6, 3.2], bf_kernel=7, bf_sigma_r=0.02, bf_gain_init=0.0, epochs=16, cosine_lr=True, lr=0.005, max_train_s=1080, batch_size=4, train_n=200, val_n=200, display_min=0.0, display_max=0.05, seed=42, rationale=iter-28 param_efficient breast -- MULTI-SCALE BILATERAL POST-FILTER (output denoiser, highest remaining upside). SIX-BOX: (1) PRIOR: champion LPD-combine W=4 filtered-DC K=30 = 0.4590+-0.0294 (best 0.5047) @ 183p. In-loop prox FAILED (iters13-14/24, hr 0.0) -- but that was INSIDE the DC step. fastdiff finding: an edge-preserving denoiser helps at the OUTPUT, not in-loop. UNTESTED here. (2) FAILURE MODE: the data-consistent recon still carries residual streak-noise the DC+LPD leaves; a light output bilateral could clean it WITHOUT disturbing the DC (it is post-hoc, not in the consistency loop). (3) ONE KNOB: post_bilateral=True -- a 3-scale edge-preserving bilateral bank on the FINAL x: x_out = x + Sum_i g_i*(BF_i(x)-x), g_i ZERO-INIT => identity at init => pipeline == the 0.5047 champion BYTE-FOR-BYTE. +12 params (3 filters x (3 sigma + 1 gain)) -> 195 total. sigma_r=0.02 tight range kernel (edge-preserving, cannot over-smooth fibroglandular detail). All else byte-for-byte iter-15. (4) HYPOTHESIS: a light multi-scale edge-preserving denoiser on the OUTPUT removes residual streak-noise the unroll leaves -> hr climbs past 0.5047, because the denoiser role (output) is productive where the in-loop prox role was not. (5) BUDGET: 3 bilaterals applied ONCE at output (cheap vs K=30 unroll); iter-15 finished 16ep in 1020s -> ~14-16ep; train_n=200, max_train_s=1080, --time=00:30:00, 200-val -> 20-min. (6) SERIAL; iter-29: if post-BF helps, tune scales/sigma_r; else record + continue menu (learned per-step DC schedule, 2-step LPD, grad-clip variance reduction)., dc_mode=filtered, per_step_alpha=True, lpd_on=True, lpd_width=4, lpd_kernel=3, anisotropic_on_top=False, post_bilateral=True, post_n_bf=3, post_bf_kernel=7, post_bf_sigma_r=0.02", "run_id": "breast-ct-claude-agentic-param-efficient-search-20260703-01", "runtime": {"elapsed_s": 1180.296593427658}, "schema_version": 3, "solver_key": "param-efficient", "solver_name": "Param-efficient (evolved)", "split": {"train_n": 200, "val_n": 200}, "status": "keep", "ts": "2026-07-07T16:24:48Z"}
{"advice_for_others": "param_efficient-claude-agentic: reg_type=bilateral, bilateral_on_top=False, proj_filter_on=False, n_iter=30, learnable_alpha=True, alpha_init=0.1, foe_n_filters=24, foe_kernel=7, foe_n_bumps=31, n_bf=1, bf_multiscale=True, bf_sigmas=[0.8, 1.6, 3.2], bf_kernel=7, bf_sigma_r=0.02, bf_gain_init=0.0, epochs=16, cosine_lr=True, lr=0.005, max_train_s=1080, batch_size=4, train_n=200, val_n=200, display_min=0.0, display_max=0.05, seed=42, rationale=iter-29 param_efficient breast -- TUNE post-filter: n_bf 3->5 scales. SIX-BOX: (1) PRIOR: iter-28 BREAKTHROUGH -- multi-scale bilateral POST-filter (3 scales, output denoiser) jumped hr 0.5047->0.6201 @ 195p, PSNR 44.73, full 16ep. VN-tier hr (~0.62) at ~46x fewer params than VN 9k. The +0.12 jump suggests more post-filter headroom. (2) FAILURE MODE: 3 scales may under-cover the streak-noise spectrum the output carries. (3) ONE KNOB: post_n_bf 3->5 (more edge-preserving scales in the output bilateral bank). g_i zero-init => identity at init => starts == the 0.6201 champion byte-for-byte (worst case 0.6201, no regression). +8 params (2 more filters x 4) -> 203 total. All else byte-for-byte iter-28. (4) HYPOTHESIS: more output-denoiser scales clean residual streak-noise across more spatial bandwidths -> hr climbs past 0.6201 toward 0.68. OR it saturates at ~0.62 (3 scales already cover it) -> peak found. (5) BUDGET: 5 bilaterals applied ONCE at output (cheap); iter-28 finished 16ep in 1120s -> ~16ep; train_n=200, max_train_s=1080, --time=00:30:00, 200-val -> 20-min comparable. (6) SERIAL; iter-30: tune sigma_r or a 2nd post-pass if 5 helps; then SEED REPLICATES of the peak post-filter champion for mean+-std., dc_mode=filtered, per_step_alpha=True, lpd_on=True, lpd_width=4, lpd_kernel=3, anisotropic_on_top=False, post_bilateral=True, post_n_bf=5, post_bf_kernel=7, post_bf_sigma_r=0.02", "agent": "param_efficient-claude-agentic", "campaign": "search-20260703-01", "cfg_full": {"alpha_init": 0.1, "anisotropic_on_top": false, "batch_size": 4, "bf_gain_init": 0.0, "bf_kernel": 7, "bf_multiscale": true, "bf_sigma_r": 0.02, "bf_sigmas": [0.8, 1.6, 3.2], "bilateral_on_top": false, "cosine_lr": true, "dc_mode": "filtered", "display_max": 0.05, "display_min": 0.0, "epochs": 16, "foe_kernel": 7, "foe_n_bumps": 31, "foe_n_filters": 24, "learnable_alpha": true, "lpd_kernel": 3, "lpd_on": true, "lpd_width": 4, "lr": 0.005, "max_train_s": 1080, "n_bf": 1, "n_iter": 30, "per_step_alpha": true, "post_bf_kernel": 7, "post_bf_sigma_r": 0.02, "post_bilateral": true, "post_n_bf": 5, "proj_filter_on": false, "rationale": "iter-29 param_efficient breast -- TUNE post-filter: n_bf 3->5 scales. SIX-BOX: (1) PRIOR: iter-28 BREAKTHROUGH -- multi-scale bilateral POST-filter (3 scales, output denoiser) jumped hr 0.5047->0.6201 @ 195p, PSNR 44.73, full 16ep. VN-tier hr (~0.62) at ~46x fewer params than VN 9k. The +0.12 jump suggests more post-filter headroom. (2) FAILURE MODE: 3 scales may under-cover the streak-noise spectrum the output carries. (3) ONE KNOB: post_n_bf 3->5 (more edge-preserving scales in the output bilateral bank). g_i zero-init => identity at init => starts == the 0.6201 champion byte-for-byte (worst case 0.6201, no regression). +8 params (2 more filters x 4) -> 203 total. All else byte-for-byte iter-28. (4) HYPOTHESIS: more output-denoiser scales clean residual streak-noise across more spatial bandwidths -> hr climbs past 0.6201 toward 0.68. OR it saturates at ~0.62 (3 scales already cover it) -> peak found. (5) BUDGET: 5 bilaterals applied ONCE at output (cheap); iter-28 finished 16ep in 1120s -> ~16ep; train_n=200, max_train_s=1080, --time=00:30:00, 200-val -> 20-min comparable. (6) SERIAL; iter-30: tune sigma_r or a 2nd post-pass if 5 helps; then SEED REPLICATES of the peak post-filter champion for mean+-std.", "reg_type": "bilateral", "seed": 42, "train_n": 200, "val_n": 200}, "challenge": "breast_ct", "change_class": "architecture", "git_commit": "671da566", "images": {"comparison": "runs/breast-ct-claude-agentic-param-efficient-search-20260703-01/iterations/iter-0029/comparison.png", "test_showcase": null, "valtest_showcase": null}, "iter": 29, "kept": true, "metrics": {"headroom": 0.6169889339571224, "headroom_std": 0.007760045731548353, "val_psnr": 44.65996551513672, "val_psnr_std": 0.648739293540205, "val_rmse": 0.0019971283618360758, "val_rmse_std": 0.00014673958897646767, "val_ssim": 0.990505576133728, "val_ssim_std": 0.0017018059220541032}, "model": "claude-opus-4-8-1m", "obs_path": "breast-ct-claude-agentic-param-efficient-search-20260703-01/iterations/iter-0029/observation.json", "obs_sha1": "f89013ea238a4ba23df9bc0845fe5013aaff1c7d", "params_M": 0.000203, "params_source": "observation", "rationale": "param_efficient-claude-agentic: reg_type=bilateral, bilateral_on_top=False, proj_filter_on=False, n_iter=30, learnable_alpha=True, alpha_init=0.1, foe_n_filters=24, foe_kernel=7, foe_n_bumps=31, n_bf=1, bf_multiscale=True, bf_sigmas=[0.8, 1.6, 3.2], bf_kernel=7, bf_sigma_r=0.02, bf_gain_init=0.0, epochs=16, cosine_lr=True, lr=0.005, max_train_s=1080, batch_size=4, train_n=200, val_n=200, display_min=0.0, display_max=0.05, seed=42, rationale=iter-29 param_efficient breast -- TUNE post-filter: n_bf 3->5 scales. SIX-BOX: (1) PRIOR: iter-28 BREAKTHROUGH -- multi-scale bilateral POST-filter (3 scales, output denoiser) jumped hr 0.5047->0.6201 @ 195p, PSNR 44.73, full 16ep. VN-tier hr (~0.62) at ~46x fewer params than VN 9k. The +0.12 jump suggests more post-filter headroom. (2) FAILURE MODE: 3 scales may under-cover the streak-noise spectrum the output carries. (3) ONE KNOB: post_n_bf 3->5 (more edge-preserving scales in the output bilateral bank). g_i zero-init => identity at init => starts == the 0.6201 champion byte-for-byte (worst case 0.6201, no regression). +8 params (2 more filters x 4) -> 203 total. All else byte-for-byte iter-28. (4) HYPOTHESIS: more output-denoiser scales clean residual streak-noise across more spatial bandwidths -> hr climbs past 0.6201 toward 0.68. OR it saturates at ~0.62 (3 scales already cover it) -> peak found. (5) BUDGET: 5 bilaterals applied ONCE at output (cheap); iter-28 finished 16ep in 1120s -> ~16ep; train_n=200, max_train_s=1080, --time=00:30:00, 200-val -> 20-min comparable. (6) SERIAL; iter-30: tune sigma_r or a 2nd post-pass if 5 helps; then SEED REPLICATES of the peak post-filter champion for mean+-std., dc_mode=filtered, per_step_alpha=True, lpd_on=True, lpd_width=4, lpd_kernel=3, anisotropic_on_top=False, post_bilateral=True, post_n_bf=5, post_bf_kernel=7, post_bf_sigma_r=0.02", "run_id": "breast-ct-claude-agentic-param-efficient-search-20260703-01", "runtime": {"elapsed_s": 1176.2677536010742}, "schema_version": 3, "solver_key": "param-efficient", "solver_name": "Param-efficient (evolved)", "split": {"train_n": 200, "val_n": 200}, "status": "keep", "ts": "2026-07-07T17:01:19Z"}
{"advice_for_others": "param_efficient-claude-agentic: reg_type=bilateral, bilateral_on_top=False, proj_filter_on=False, n_iter=30, learnable_alpha=True, alpha_init=0.1, foe_n_filters=24, foe_kernel=7, foe_n_bumps=31, n_bf=1, bf_multiscale=True, bf_sigmas=[0.8, 1.6, 3.2], bf_kernel=7, bf_sigma_r=0.02, bf_gain_init=0.0, epochs=16, cosine_lr=True, lr=0.005, max_train_s=1080, batch_size=4, train_n=200, val_n=200, display_min=0.0, display_max=0.05, seed=42, rationale=iter-30 param_efficient breast -- TUNE post-filter range sigma_r 0.02->0.03. SIX-BOX: (1) PRIOR: 3-scale post-filter = CHAMPION 0.6201 @ 195p; 5-scale (iter-29) 0.617 marginally lower -> 3 scales is the scale optimum. sigma_r (range/edge-preservation width) untuned; it is the highest-leverage post-filter knob (controls streak-removal vs detail-preservation). (2) FAILURE MODE: sigma_r=0.02 may be too tight -- leaving streak-noise the wider gate would remove. (3) ONE KNOB: post_bf_sigma_r 0.02->0.03 (wider range gate). Note: sigma_r is a learnable INIT (log_sr trains), so this shifts the starting point; g_i zero-init still => identity at init => no regression. 195 params (unchanged). All else byte-for-byte iter-28. (4) HYPOTHESIS: a slightly wider range gate removes more residual streak-noise at the output while the tight-enough kernel still preserves fibroglandular edges -> hr climbs past 0.6201. OR it over-smooths (hr drops) -> 0.02 was optimal. Cheap 1-knob probe of the peak post-filter. (5) BUDGET: identical to iter-28 (3 output bilaterals); train_n=200, max_train_s=1080, --time=00:30:00, 200-val -> 20-min. (6) SERIAL; iter-31: LOCK champion (best of iter-28 vs iter-30), then SEED REPLICATES for mean+-std + check if post-filter reduces seed variance vs LPD-only 0.459+-0.029., dc_mode=filtered, per_step_alpha=True, lpd_on=True, lpd_width=4, lpd_kernel=3, anisotropic_on_top=False, post_bilateral=True, post_n_bf=3, post_bf_kernel=7, post_bf_sigma_r=0.03", "agent": "param_efficient-claude-agentic", "campaign": "search-20260703-01", "cfg_full": {"alpha_init": 0.1, "anisotropic_on_top": false, "batch_size": 4, "bf_gain_init": 0.0, "bf_kernel": 7, "bf_multiscale": true, "bf_sigma_r": 0.02, "bf_sigmas": [0.8, 1.6, 3.2], "bilateral_on_top": false, "cosine_lr": true, "dc_mode": "filtered", "display_max": 0.05, "display_min": 0.0, "epochs": 16, "foe_kernel": 7, "foe_n_bumps": 31, "foe_n_filters": 24, "learnable_alpha": true, "lpd_kernel": 3, "lpd_on": true, "lpd_width": 4, "lr": 0.005, "max_train_s": 1080, "n_bf": 1, "n_iter": 30, "per_step_alpha": true, "post_bf_kernel": 7, "post_bf_sigma_r": 0.03, "post_bilateral": true, "post_n_bf": 3, "proj_filter_on": false, "rationale": "iter-30 param_efficient breast -- TUNE post-filter range sigma_r 0.02->0.03. SIX-BOX: (1) PRIOR: 3-scale post-filter = CHAMPION 0.6201 @ 195p; 5-scale (iter-29) 0.617 marginally lower -> 3 scales is the scale optimum. sigma_r (range/edge-preservation width) untuned; it is the highest-leverage post-filter knob (controls streak-removal vs detail-preservation). (2) FAILURE MODE: sigma_r=0.02 may be too tight -- leaving streak-noise the wider gate would remove. (3) ONE KNOB: post_bf_sigma_r 0.02->0.03 (wider range gate). Note: sigma_r is a learnable INIT (log_sr trains), so this shifts the starting point; g_i zero-init still => identity at init => no regression. 195 params (unchanged). All else byte-for-byte iter-28. (4) HYPOTHESIS: a slightly wider range gate removes more residual streak-noise at the output while the tight-enough kernel still preserves fibroglandular edges -> hr climbs past 0.6201. OR it over-smooths (hr drops) -> 0.02 was optimal. Cheap 1-knob probe of the peak post-filter. (5) BUDGET: identical to iter-28 (3 output bilaterals); train_n=200, max_train_s=1080, --time=00:30:00, 200-val -> 20-min. (6) SERIAL; iter-31: LOCK champion (best of iter-28 vs iter-30), then SEED REPLICATES for mean+-std + check if post-filter reduces seed variance vs LPD-only 0.459+-0.029.", "reg_type": "bilateral", "seed": 42, "train_n": 200, "val_n": 200}, "challenge": "breast_ct", "change_class": "architecture", "git_commit": "671da566", "images": {"comparison": "runs/breast-ct-claude-agentic-param-efficient-search-20260703-01/iterations/iter-0030/comparison.png", "test_showcase": null, "valtest_showcase": null}, "iter": 30, "kept": true, "metrics": {"headroom": 0.5522595087210291, "headroom_std": 0.007240333253818029, "val_psnr": 43.30366516113281, "val_psnr_std": 0.6038597645556848, "val_rmse": 0.002334645949304104, "val_rmse_std": 0.00015906660361029328, "val_ssim": 0.9830815196037292, "val_ssim_std": 0.002196279639299077}, "model": "claude-opus-4-8-1m", "obs_path": "breast-ct-claude-agentic-param-efficient-search-20260703-01/iterations/iter-0030/observation.json", "obs_sha1": "cca62d89f9365cc87e54d26681335b0265634917", "params_M": 0.000195, "params_source": "observation", "rationale": "param_efficient-claude-agentic: reg_type=bilateral, bilateral_on_top=False, proj_filter_on=False, n_iter=30, learnable_alpha=True, alpha_init=0.1, foe_n_filters=24, foe_kernel=7, foe_n_bumps=31, n_bf=1, bf_multiscale=True, bf_sigmas=[0.8, 1.6, 3.2], bf_kernel=7, bf_sigma_r=0.02, bf_gain_init=0.0, epochs=16, cosine_lr=True, lr=0.005, max_train_s=1080, batch_size=4, train_n=200, val_n=200, display_min=0.0, display_max=0.05, seed=42, rationale=iter-30 param_efficient breast -- TUNE post-filter range sigma_r 0.02->0.03. SIX-BOX: (1) PRIOR: 3-scale post-filter = CHAMPION 0.6201 @ 195p; 5-scale (iter-29) 0.617 marginally lower -> 3 scales is the scale optimum. sigma_r (range/edge-preservation width) untuned; it is the highest-leverage post-filter knob (controls streak-removal vs detail-preservation). (2) FAILURE MODE: sigma_r=0.02 may be too tight -- leaving streak-noise the wider gate would remove. (3) ONE KNOB: post_bf_sigma_r 0.02->0.03 (wider range gate). Note: sigma_r is a learnable INIT (log_sr trains), so this shifts the starting point; g_i zero-init still => identity at init => no regression. 195 params (unchanged). All else byte-for-byte iter-28. (4) HYPOTHESIS: a slightly wider range gate removes more residual streak-noise at the output while the tight-enough kernel still preserves fibroglandular edges -> hr climbs past 0.6201. OR it over-smooths (hr drops) -> 0.02 was optimal. Cheap 1-knob probe of the peak post-filter. (5) BUDGET: identical to iter-28 (3 output bilaterals); train_n=200, max_train_s=1080, --time=00:30:00, 200-val -> 20-min. (6) SERIAL; iter-31: LOCK champion (best of iter-28 vs iter-30), then SEED REPLICATES for mean+-std + check if post-filter reduces seed variance vs LPD-only 0.459+-0.029., dc_mode=filtered, per_step_alpha=True, lpd_on=True, lpd_width=4, lpd_kernel=3, anisotropic_on_top=False, post_bilateral=True, post_n_bf=3, post_bf_kernel=7, post_bf_sigma_r=0.03", "run_id": "breast-ct-claude-agentic-param-efficient-search-20260703-01", "runtime": {"elapsed_s": 1163.662704706192}, "schema_version": 3, "solver_key": "param-efficient", "solver_name": "Param-efficient (evolved)", "split": {"train_n": 200, "val_n": 200}, "status": "keep", "ts": "2026-07-07T18:19:57Z"}
