{"advice_for_others": "fastdiff_flow_pixel_constrained-claude-agentic: image_size=512, pixel_spacing=0.3516, n_angles=128, n_det=1024, det_spacing=0.35754, sod=500.0, sdd=1000.0, display_min=0.0, display_max=0.5, train_n=400, val_n=200, noise_i0=100000.0, noise_sigma_e=10.0, seed=42, dataset_kind=breast_ct, fd_recon_ckpt=/cluster/maier/Agent4CT/checkpoints/fast_diffusion_pixel_breast.pt, fd_recon_steps=8, fd_recon_init=fbp, fd_recon_init_t=0.3, fd_recon_eta=1.0, fd_recon_dc=1, fd_recon_dc_n_cg=5, fd_recon_dc_relax=0.5, rationale=iter-2 EXPLORATORY single knob fd_recon_init_t 0.7->0.3 from iter-1 base. SIX-BOX (breast-native prior): (1)PRIOR iter-1 hr=0 (breast prior fast_diffusion_pixel_breast.pt out_scale0.5, DC on, init_t0.7): matched-scale breast prior still did not clear the strong 128-view breast FBP baseline. (2)FAILURE: even a matched prior repaints when embedded high on the flow schedule, pulling RMSE above the FBP it started from. (3)ONE KNOB: init_t 0.7->0.3. (4)HYPOTHESIS: low init_t preserves the strong FBP while the breast prior lightly denoises + DC re-anchors, dropping RMSE toward baseline and lifting hr>0. (5)BUDGET: fast. (6)Serial.", "agent": "fastdiff_flow_pixel_constrained-claude-agentic", "campaign": "search-20260703-01", "cfg_full": {"dataset_kind": "breast_ct", "det_spacing": 0.35754, "display_max": 0.5, "display_min": 0.0, "fd_recon_ckpt": "/cluster/maier/Agent4CT/checkpoints/fast_diffusion_pixel_breast.pt", "fd_recon_dc": 1, "fd_recon_dc_n_cg": 5, "fd_recon_dc_relax": 0.5, "fd_recon_eta": 1.0, "fd_recon_init": "fbp", "fd_recon_init_t": 0.3, "fd_recon_steps": 8, "image_size": 512, "n_angles": 128, "n_det": 1024, "noise_i0": 100000.0, "noise_sigma_e": 10.0, "pixel_spacing": 0.3516, "rationale": "iter-2 EXPLORATORY single knob fd_recon_init_t 0.7->0.3 from iter-1 base. SIX-BOX (breast-native prior): (1)PRIOR iter-1 hr=0 (breast prior fast_diffusion_pixel_breast.pt out_scale0.5, DC on, init_t0.7): matched-scale breast prior still did not clear the strong 128-view breast FBP baseline. (2)FAILURE: even a matched prior repaints when embedded high on the flow schedule, pulling RMSE above the FBP it started from. (3)ONE KNOB: init_t 0.7->0.3. (4)HYPOTHESIS: low init_t preserves the strong FBP while the breast prior lightly denoises + DC re-anchors, dropping RMSE toward baseline and lifting hr>0. (5)BUDGET: fast. (6)Serial.", "sdd": 1000.0, "seed": 42, "sod": 500.0, "train_n": 400, "val_n": 200}, "challenge": "breast_ct", "change_class": "architecture", "git_commit": "671da566", "images": {"comparison": "runs/breast-ct-claude-agentic-fastdiff-flow-pixel-constrained-search-20260703-01/iterations/iter-0002/comparison.png", "test_showcase": null, "valtest_showcase": null}, "iter": 2, "kept": false, "metrics": {"headroom": 0.0, "headroom_std": 0.0, "val_psnr": 22.24899673461914, "val_psnr_std": 0.5659436444930465, "val_rmse": 0.02636055462062359, "val_rmse_std": 0.0016195823293391326, "val_ssim": 0.4536875784397125, "val_ssim_std": 0.023372858129227316}, "model": "claude-opus-4-8-1m", "obs_path": "breast-ct-claude-agentic-fastdiff-flow-pixel-constrained-search-20260703-01/iterations/iter-0002/observation.json", "obs_sha1": "e16a51499dfbbe0ad922d41b98690458a45d3cd3", "params_M": 3.822787, "params_source": "observation", "rationale": "fastdiff_flow_pixel_constrained-claude-agentic: image_size=512, pixel_spacing=0.3516, n_angles=128, n_det=1024, det_spacing=0.35754, sod=500.0, sdd=1000.0, display_min=0.0, display_max=0.5, train_n=400, val_n=200, noise_i0=100000.0, noise_sigma_e=10.0, seed=42, dataset_kind=breast_ct, fd_recon_ckpt=/cluster/maier/Agent4CT/checkpoints/fast_diffusion_pixel_breast.pt, fd_recon_steps=8, fd_recon_init=fbp, fd_recon_init_t=0.3, fd_recon_eta=1.0, fd_recon_dc=1, fd_recon_dc_n_cg=5, fd_recon_dc_relax=0.5, rationale=iter-2 EXPLORATORY single knob fd_recon_init_t 0.7->0.3 from iter-1 base. SIX-BOX (breast-native prior): (1)PRIOR iter-1 hr=0 (breast prior fast_diffusion_pixel_breast.pt out_scale0.5, DC on, init_t0.7): matched-scale breast prior still did not clear the strong 128-view breast FBP baseline. (2)FAILURE: even a matched prior repaints when embedded high on the flow schedule, pulling RMSE above the FBP it started from. (3)ONE KNOB: init_t 0.7->0.3. (4)HYPOTHESIS: low init_t preserves the strong FBP while the breast prior lightly denoises + DC re-anchors, dropping RMSE toward baseline and lifting hr>0. (5)BUDGET: fast. (6)Serial.", "run_id": "breast-ct-claude-agentic-fastdiff-flow-pixel-constrained-search-20260703-01", "runtime": {"elapsed_s": 207.77954959869385}, "schema_version": 3, "solver_key": "fastdiff-flow-pixel-constrained", "solver_name": "Fast-diffusion flow (pixel, constrained DC)", "split": {"train_n": 400, "val_n": 200}, "status": "discard", "ts": "2026-07-06T20:43:09Z"}
{"advice_for_others": "fastdiff_flow_pixel_constrained-claude-agentic: image_size=512, pixel_spacing=0.3516, n_angles=128, n_det=1024, det_spacing=0.35754, sod=500.0, sdd=1000.0, display_min=0.0, display_max=0.5, train_n=400, val_n=200, noise_i0=100000.0, noise_sigma_e=10.0, seed=42, dataset_kind=breast_ct, fd_recon_ckpt=/cluster/maier/Agent4CT/checkpoints/fast_diffusion_pixel_breast.pt, fd_recon_steps=8, fd_recon_init=fbp, fd_recon_init_t=0.15, fd_recon_eta=1.0, fd_recon_dc=1, fd_recon_dc_n_cg=5, fd_recon_dc_relax=0.5, rationale=iter-3 EXPLORATORY single knob fd_recon_init_t 0.3->0.15 from iter-2 base. SIX-BOX: (1)PRIOR: init_t axis is MONOTONIC so far: 0.7 (iter-1 rmse0.0428 psnr18.0 ssim0.427) -> 0.3 (iter-2 rmse0.0264 psnr22.2 ssim0.454). Lower init_t preserves the strong 128-view breast FBP; the breast prior at high init_t repaints/darkens (pred mean 0.036 vs truth 0.126). All hr=0 (FBP baseline rmse~0.00521 very strong). (2)FAILURE: even init_t0.3 lets the prior perturb the FBP enough to leave rmse 5x baseline. (3)ONE KNOB: init_t 0.3->0.15 (embed even closer to FBP; steps/DC/eta held). (4)HYPOTHESIS: pushing init_t toward 0 keeps the recon almost at the FBP while the prior only lightly denoises + DC re-anchors, dropping rmse further toward baseline; maps whether the init_t axis reaches hr>0 or asymptotes above the FBP floor. (5)BUDGET: fewer effective steps, fast. (6)Serial.", "agent": "fastdiff_flow_pixel_constrained-claude-agentic", "campaign": "search-20260703-01", "cfg_full": {"dataset_kind": "breast_ct", "det_spacing": 0.35754, "display_max": 0.5, "display_min": 0.0, "fd_recon_ckpt": "/cluster/maier/Agent4CT/checkpoints/fast_diffusion_pixel_breast.pt", "fd_recon_dc": 1, "fd_recon_dc_n_cg": 5, "fd_recon_dc_relax": 0.5, "fd_recon_eta": 1.0, "fd_recon_init": "fbp", "fd_recon_init_t": 0.15, "fd_recon_steps": 8, "image_size": 512, "n_angles": 128, "n_det": 1024, "noise_i0": 100000.0, "noise_sigma_e": 10.0, "pixel_spacing": 0.3516, "rationale": "iter-3 EXPLORATORY single knob fd_recon_init_t 0.3->0.15 from iter-2 base. SIX-BOX: (1)PRIOR: init_t axis is MONOTONIC so far: 0.7 (iter-1 rmse0.0428 psnr18.0 ssim0.427) -> 0.3 (iter-2 rmse0.0264 psnr22.2 ssim0.454). Lower init_t preserves the strong 128-view breast FBP; the breast prior at high init_t repaints/darkens (pred mean 0.036 vs truth 0.126). All hr=0 (FBP baseline rmse~0.00521 very strong). (2)FAILURE: even init_t0.3 lets the prior perturb the FBP enough to leave rmse 5x baseline. (3)ONE KNOB: init_t 0.3->0.15 (embed even closer to FBP; steps/DC/eta held). (4)HYPOTHESIS: pushing init_t toward 0 keeps the recon almost at the FBP while the prior only lightly denoises + DC re-anchors, dropping rmse further toward baseline; maps whether the init_t axis reaches hr>0 or asymptotes above the FBP floor. (5)BUDGET: fewer effective steps, fast. (6)Serial.", "sdd": 1000.0, "seed": 42, "sod": 500.0, "train_n": 400, "val_n": 200}, "challenge": "breast_ct", "change_class": "architecture", "git_commit": "671da566", "images": {"comparison": "runs/breast-ct-claude-agentic-fastdiff-flow-pixel-constrained-search-20260703-01/iterations/iter-0003/comparison.png", "test_showcase": null, "valtest_showcase": null}, "iter": 3, "kept": false, "metrics": {"headroom": 0.0, "headroom_std": 0.0, "val_psnr": 27.48645782470703, "val_psnr_std": 0.5572480006974189, "val_rmse": 0.014423864893615246, "val_rmse_std": 0.0009041200052711584, "val_ssim": 0.6764799952507019, "val_ssim_std": 0.006009131892833123}, "model": "claude-opus-4-8-1m", "obs_path": "breast-ct-claude-agentic-fastdiff-flow-pixel-constrained-search-20260703-01/iterations/iter-0003/observation.json", "obs_sha1": "1994740d9b1abf4afadbb44fd7ac908513e2790a", "params_M": 3.822787, "params_source": "observation", "rationale": "fastdiff_flow_pixel_constrained-claude-agentic: image_size=512, pixel_spacing=0.3516, n_angles=128, n_det=1024, det_spacing=0.35754, sod=500.0, sdd=1000.0, display_min=0.0, display_max=0.5, train_n=400, val_n=200, noise_i0=100000.0, noise_sigma_e=10.0, seed=42, dataset_kind=breast_ct, fd_recon_ckpt=/cluster/maier/Agent4CT/checkpoints/fast_diffusion_pixel_breast.pt, fd_recon_steps=8, fd_recon_init=fbp, fd_recon_init_t=0.15, fd_recon_eta=1.0, fd_recon_dc=1, fd_recon_dc_n_cg=5, fd_recon_dc_relax=0.5, rationale=iter-3 EXPLORATORY single knob fd_recon_init_t 0.3->0.15 from iter-2 base. SIX-BOX: (1)PRIOR: init_t axis is MONOTONIC so far: 0.7 (iter-1 rmse0.0428 psnr18.0 ssim0.427) -> 0.3 (iter-2 rmse0.0264 psnr22.2 ssim0.454). Lower init_t preserves the strong 128-view breast FBP; the breast prior at high init_t repaints/darkens (pred mean 0.036 vs truth 0.126). All hr=0 (FBP baseline rmse~0.00521 very strong). (2)FAILURE: even init_t0.3 lets the prior perturb the FBP enough to leave rmse 5x baseline. (3)ONE KNOB: init_t 0.3->0.15 (embed even closer to FBP; steps/DC/eta held). (4)HYPOTHESIS: pushing init_t toward 0 keeps the recon almost at the FBP while the prior only lightly denoises + DC re-anchors, dropping rmse further toward baseline; maps whether the init_t axis reaches hr>0 or asymptotes above the FBP floor. (5)BUDGET: fewer effective steps, fast. (6)Serial.", "run_id": "breast-ct-claude-agentic-fastdiff-flow-pixel-constrained-search-20260703-01", "runtime": {"elapsed_s": 166.69253969192505}, "schema_version": 3, "solver_key": "fastdiff-flow-pixel-constrained", "solver_name": "Fast-diffusion flow (pixel, constrained DC)", "split": {"train_n": 400, "val_n": 200}, "status": "discard", "ts": "2026-07-06T20:48:07Z"}
{"advice_for_others": "fastdiff_flow_pixel_constrained-claude-agentic: image_size=512, pixel_spacing=0.3516, n_angles=128, n_det=1024, det_spacing=0.35754, sod=500.0, sdd=1000.0, display_min=0.0, display_max=0.5, train_n=400, val_n=200, noise_i0=100000.0, noise_sigma_e=10.0, seed=42, dataset_kind=breast_ct, fd_recon_ckpt=/cluster/maier/Agent4CT/checkpoints/fast_diffusion_pixel_breast.pt, fd_recon_steps=8, fd_recon_init=fbp, fd_recon_init_t=0.05, fd_recon_eta=1.0, fd_recon_dc=1, fd_recon_dc_n_cg=5, fd_recon_dc_relax=0.5, rationale=iter-4 EXPLORATORY single knob fd_recon_init_t 0.15->0.05 from iter-3 base. SIX-BOX: (1)PRIOR: init_t axis strongly MONOTONIC: 0.7 rmse0.0428/ssim0.427 -> 0.3 rmse0.0264/ssim0.454 -> 0.15 rmse0.0144/ssim0.676. Recon approaches the 128-view breast FBP (rmse0.00521,ssim0.920) as init_t->0. All hr=0. (2)FAILURE: recon still 2.8x FBP rmse at init_t0.15; the breast prior perturbs the near-oracle FBP rather than improving it. (3)ONE KNOB: init_t 0.15->0.05 (embed almost AT the FBP). (4)HYPOTHESIS: at init_t~0 the recon converges TO the FBP so rmse->0.00521 and hr->0 from below (equal to baseline, cannot exceed). This maps the init_t asymptote: if rmse bottoms at the FBP floor, it PROVES the sparse-view breast FBP is already near-oracle (128 views is not very sparse at this geometry) and a prior has no noise headroom to exploit -> regime-bound ceiling, distinct from the Mayo prior-mismatch cause. (5)BUDGET: minimal steps, fast. (6)Serial.", "agent": "fastdiff_flow_pixel_constrained-claude-agentic", "campaign": "search-20260703-01", "cfg_full": {"dataset_kind": "breast_ct", "det_spacing": 0.35754, "display_max": 0.5, "display_min": 0.0, "fd_recon_ckpt": "/cluster/maier/Agent4CT/checkpoints/fast_diffusion_pixel_breast.pt", "fd_recon_dc": 1, "fd_recon_dc_n_cg": 5, "fd_recon_dc_relax": 0.5, "fd_recon_eta": 1.0, "fd_recon_init": "fbp", "fd_recon_init_t": 0.05, "fd_recon_steps": 8, "image_size": 512, "n_angles": 128, "n_det": 1024, "noise_i0": 100000.0, "noise_sigma_e": 10.0, "pixel_spacing": 0.3516, "rationale": "iter-4 EXPLORATORY single knob fd_recon_init_t 0.15->0.05 from iter-3 base. SIX-BOX: (1)PRIOR: init_t axis strongly MONOTONIC: 0.7 rmse0.0428/ssim0.427 -> 0.3 rmse0.0264/ssim0.454 -> 0.15 rmse0.0144/ssim0.676. Recon approaches the 128-view breast FBP (rmse0.00521,ssim0.920) as init_t->0. All hr=0. (2)FAILURE: recon still 2.8x FBP rmse at init_t0.15; the breast prior perturbs the near-oracle FBP rather than improving it. (3)ONE KNOB: init_t 0.15->0.05 (embed almost AT the FBP). (4)HYPOTHESIS: at init_t~0 the recon converges TO the FBP so rmse->0.00521 and hr->0 from below (equal to baseline, cannot exceed). This maps the init_t asymptote: if rmse bottoms at the FBP floor, it PROVES the sparse-view breast FBP is already near-oracle (128 views is not very sparse at this geometry) and a prior has no noise headroom to exploit -> regime-bound ceiling, distinct from the Mayo prior-mismatch cause. (5)BUDGET: minimal steps, fast. (6)Serial.", "sdd": 1000.0, "seed": 42, "sod": 500.0, "train_n": 400, "val_n": 200}, "challenge": "breast_ct", "change_class": "architecture", "git_commit": "671da566", "images": {"comparison": "runs/breast-ct-claude-agentic-fastdiff-flow-pixel-constrained-search-20260703-01/iterations/iter-0004/comparison.png", "test_showcase": null, "valtest_showcase": null}, "iter": 4, "kept": false, "metrics": {"headroom": 0.0, "headroom_std": 0.0, "val_psnr": 34.15509033203125, "val_psnr_std": 0.8176639346331084, "val_rmse": 0.00669344887137413, "val_rmse_std": 0.0006181384048228653, "val_ssim": 0.9152635931968689, "val_ssim_std": 0.014342492601570271}, "model": "claude-opus-4-8-1m", "obs_path": "breast-ct-claude-agentic-fastdiff-flow-pixel-constrained-search-20260703-01/iterations/iter-0004/observation.json", "obs_sha1": "a3789a3d7516c545b07362aed77228331be42d58", "params_M": 3.822787, "params_source": "observation", "rationale": "fastdiff_flow_pixel_constrained-claude-agentic: image_size=512, pixel_spacing=0.3516, n_angles=128, n_det=1024, det_spacing=0.35754, sod=500.0, sdd=1000.0, display_min=0.0, display_max=0.5, train_n=400, val_n=200, noise_i0=100000.0, noise_sigma_e=10.0, seed=42, dataset_kind=breast_ct, fd_recon_ckpt=/cluster/maier/Agent4CT/checkpoints/fast_diffusion_pixel_breast.pt, fd_recon_steps=8, fd_recon_init=fbp, fd_recon_init_t=0.05, fd_recon_eta=1.0, fd_recon_dc=1, fd_recon_dc_n_cg=5, fd_recon_dc_relax=0.5, rationale=iter-4 EXPLORATORY single knob fd_recon_init_t 0.15->0.05 from iter-3 base. SIX-BOX: (1)PRIOR: init_t axis strongly MONOTONIC: 0.7 rmse0.0428/ssim0.427 -> 0.3 rmse0.0264/ssim0.454 -> 0.15 rmse0.0144/ssim0.676. Recon approaches the 128-view breast FBP (rmse0.00521,ssim0.920) as init_t->0. All hr=0. (2)FAILURE: recon still 2.8x FBP rmse at init_t0.15; the breast prior perturbs the near-oracle FBP rather than improving it. (3)ONE KNOB: init_t 0.15->0.05 (embed almost AT the FBP). (4)HYPOTHESIS: at init_t~0 the recon converges TO the FBP so rmse->0.00521 and hr->0 from below (equal to baseline, cannot exceed). This maps the init_t asymptote: if rmse bottoms at the FBP floor, it PROVES the sparse-view breast FBP is already near-oracle (128 views is not very sparse at this geometry) and a prior has no noise headroom to exploit -> regime-bound ceiling, distinct from the Mayo prior-mismatch cause. (5)BUDGET: minimal steps, fast. (6)Serial.", "run_id": "breast-ct-claude-agentic-fastdiff-flow-pixel-constrained-search-20260703-01", "runtime": {"elapsed_s": 184.76386094093323}, "schema_version": 3, "solver_key": "fastdiff-flow-pixel-constrained", "solver_name": "Fast-diffusion flow (pixel, constrained DC)", "split": {"train_n": 400, "val_n": 200}, "status": "discard", "ts": "2026-07-06T20:53:04Z"}
