{"advice_for_others": "itnet-claude-agentic: pretrain_epochs=20, pretrain_lr=0.001, itnet_k=5, itnet_alpha=0.1, unet_c=16, finetune_epochs=0, finetune_lr=0.0001, train_n=400, val_n=200, grad_clip=1.0, seed=42, rationale=iter-1 ONBOARDING of ItNet v1 (solver_itnet.py: pretrain SmallUNet FBP->truth denoiser, then FIXED analytic k-iter DC unroll at eval; only trainable component is the UNet) on the re-split Breast-CT (train 3600 / val 200 / test 200, seed 20260703). SIX-BOX: (1) PRIOR: none (first iter). (2) Failure mode: N/A onboarding; goal = does v1 run on breast 128-view 512^2 and clear the sparse-view FBP baseline (hr>0). ItNet v1 is the Mayo test champion (hr 0.3756), so breast (synthetic, cleaner) should clear easily. (3) ONE KNOB: N/A baseline. (4) HYPOTHESIS: a conservative UNet(c=16, 20 pretrain epochs, lr 1e-3) on 400 train scenes will clear breast FBP (hr>0) and land ssim ~0.9+, because v1 cleared demo_dl/breast trivially before and the sparse-view FBP baseline leaves large headroom. (5) BUDGET: train_n=400 x 20 epochs SmallUNet(c=16) at 512^2 + 200-slice k=5 DC val pass; breast uses a single shared PYRO-NN projector (no per-sample-ps swap unlike Mayo), FBP batched -> well inside 20 min. val_n=200 = the FULL new breast val split (was 400; capped to <=200 per re-split; part of onboarding, not a separate knob). (6) Loop continues; iter-2 dispatched on landing. grad_clip=1.0 retained (DC adjoint safety).", "agent": "itnet-claude-agentic", "campaign": "search-20260703-01", "cfg_full": {"finetune_epochs": 0, "finetune_lr": 0.0001, "grad_clip": 1.0, "itnet_alpha": 0.1, "itnet_k": 5, "pretrain_epochs": 20, "pretrain_lr": 0.001, "rationale": "iter-1 ONBOARDING of ItNet v1 (solver_itnet.py: pretrain SmallUNet FBP->truth denoiser, then FIXED analytic k-iter DC unroll at eval; only trainable component is the UNet) on the re-split Breast-CT (train 3600 / val 200 / test 200, seed 20260703). SIX-BOX: (1) PRIOR: none (first iter). (2) Failure mode: N/A onboarding; goal = does v1 run on breast 128-view 512^2 and clear the sparse-view FBP baseline (hr>0). ItNet v1 is the Mayo test champion (hr 0.3756), so breast (synthetic, cleaner) should clear easily. (3) ONE KNOB: N/A baseline. (4) HYPOTHESIS: a conservative UNet(c=16, 20 pretrain epochs, lr 1e-3) on 400 train scenes will clear breast FBP (hr>0) and land ssim ~0.9+, because v1 cleared demo_dl/breast trivially before and the sparse-view FBP baseline leaves large headroom. (5) BUDGET: train_n=400 x 20 epochs SmallUNet(c=16) at 512^2 + 200-slice k=5 DC val pass; breast uses a single shared PYRO-NN projector (no per-sample-ps swap unlike Mayo), FBP batched -> well inside 20 min. val_n=200 = the FULL new breast val split (was 400; capped to <=200 per re-split; part of onboarding, not a separate knob). (6) Loop continues; iter-2 dispatched on landing. grad_clip=1.0 retained (DC adjoint safety).", "seed": 42, "train_n": 400, "unet_c": 16, "val_n": 200}, "challenge": "breast_ct", "change_class": "architecture", "git_commit": null, "images": {"comparison": "runs/breast-ct-claude-agentic-itnet-search-20260703-01/iterations/iter-0001/comparison.png", "test_showcase": null, "valtest_showcase": null}, "iter": 1, "kept": false, "metrics": {"headroom": 0.0, "headroom_std": null, "val_psnr": 25.630817413330078, "val_psnr_std": null, "val_rmse": 0.017859267070889473, "val_rmse_std": null, "val_ssim": 0.8237218260765076, "val_ssim_std": null}, "model": "claude-opus-4-8-1m", "obs_path": "breast-ct-claude-agentic-itnet-search-20260703-01/iterations/iter-0001/observation.json", "obs_sha1": "311a371b63915b9b4788119a770c980603a12695", "params_M": 0.232881, "params_source": "observation", "rationale": "itnet-claude-agentic: pretrain_epochs=20, pretrain_lr=0.001, itnet_k=5, itnet_alpha=0.1, unet_c=16, finetune_epochs=0, finetune_lr=0.0001, train_n=400, val_n=200, grad_clip=1.0, seed=42, rationale=iter-1 ONBOARDING of ItNet v1 (solver_itnet.py: pretrain SmallUNet FBP->truth denoiser, then FIXED analytic k-iter DC unroll at eval; only trainable component is the UNet) on the re-split Breast-CT (train 3600 / val 200 / test 200, seed 20260703). SIX-BOX: (1) PRIOR: none (first iter). (2) Failure mode: N/A onboarding; goal = does v1 run on breast 128-view 512^2 and clear the sparse-view FBP baseline (hr>0). ItNet v1 is the Mayo test champion (hr 0.3756), so breast (synthetic, cleaner) should clear easily. (3) ONE KNOB: N/A baseline. (4) HYPOTHESIS: a conservative UNet(c=16, 20 pretrain epochs, lr 1e-3) on 400 train scenes will clear breast FBP (hr>0) and land ssim ~0.9+, because v1 cleared demo_dl/breast trivially before and the sparse-view FBP baseline leaves large headroom. (5) BUDGET: train_n=400 x 20 epochs SmallUNet(c=16) at 512^2 + 200-slice k=5 DC val pass; breast uses a single shared PYRO-NN projector (no per-sample-ps swap unlike Mayo), FBP batched -> well inside 20 min. val_n=200 = the FULL new breast val split (was 400; capped to <=200 per re-split; part of onboarding, not a separate knob). (6) Loop continues; iter-2 dispatched on landing. grad_clip=1.0 retained (DC adjoint safety).", "run_id": "breast-ct-claude-agentic-itnet-search-20260703-01", "runtime": {"elapsed_s": 211.94263768196106}, "schema_version": 3, "solver_key": "itnet", "solver_name": "ITNet v1", "split": {"train_n": 400, "val_n": 200}, "status": "discard", "ts": "2026-07-03T16:08:02Z"}
{"advice_for_others": "itnet-claude-agentic: pretrain_epochs=120, pretrain_lr=0.001, itnet_k=5, itnet_alpha=0.1, unet_c=16, finetune_epochs=0, finetune_lr=0.0001, train_n=400, val_n=200, grad_clip=1.0, seed=42, rationale=iter-2 (breast ItNet v1, search-20260703-01). SIX-BOX: (1) PRIOR NUMBERS: iter-1 (pretrain_epochs=20) -> val_ssim 0.8237, hr 0.0000 (BELOW sparse-view FBP baseline), PSNR 25.63, RMSE 0.01786, elapsed 211.9s. Job clean (only benign CuDNN warn). (2) FAILURE MODE: under-baseline recon (hr=0) AND severe budget under-use (212s of a 1200s budget). The single trainable component is the SmallUNet denoiser (0.2329M), pretrained FBP->truth for only 20 epochs; likely UNDER-TRAINED. (3) ONE KNOB: pretrain_epochs 20 -> 120 (6x). All else identical to iter-1. (4) HYPOTHESIS: if I train the denoiser 6x longer, I expect hr to clear 0 (recon RMSE drops below the FBP baseline) and ssim to rise, because the denoiser was the only trainable lever and 20 epochs on 400 scenes is far from converged; a sibling ITNet v2 reached hr 0.826 and DD-supervised 0.81 on this same val=200, so the substrate clears baseline easily -> iter-1 was under-trained. FALSIFIER: if hr stays 0 at 120 epochs, the denoiser is NOT the bottleneck and the fixed k=5/alpha=0.1 DC unroll is re-injecting sparse-view streaks (raising RMSE) -> iter-3 pivots to the DC knobs (k, alpha). (5) BUDGET: 20ep=212s measured -> per-epoch ~ (212-fixed)/20; fixed cost (load+200-slice k=5 val+fig) dominates. Even at a conservative 6x train cost, 120 epochs predicts ~900s < 1200s budget. (6) Loop continues; iter-3 dispatched on landing via numeric-headroom gate.", "agent": "itnet-claude-agentic", "campaign": "search-20260703-01", "cfg_full": {"finetune_epochs": 0, "finetune_lr": 0.0001, "grad_clip": 1.0, "itnet_alpha": 0.1, "itnet_k": 5, "pretrain_epochs": 120, "pretrain_lr": 0.001, "rationale": "iter-2 (breast ItNet v1, search-20260703-01). SIX-BOX: (1) PRIOR NUMBERS: iter-1 (pretrain_epochs=20) -> val_ssim 0.8237, hr 0.0000 (BELOW sparse-view FBP baseline), PSNR 25.63, RMSE 0.01786, elapsed 211.9s. Job clean (only benign CuDNN warn). (2) FAILURE MODE: under-baseline recon (hr=0) AND severe budget under-use (212s of a 1200s budget). The single trainable component is the SmallUNet denoiser (0.2329M), pretrained FBP->truth for only 20 epochs; likely UNDER-TRAINED. (3) ONE KNOB: pretrain_epochs 20 -> 120 (6x). All else identical to iter-1. (4) HYPOTHESIS: if I train the denoiser 6x longer, I expect hr to clear 0 (recon RMSE drops below the FBP baseline) and ssim to rise, because the denoiser was the only trainable lever and 20 epochs on 400 scenes is far from converged; a sibling ITNet v2 reached hr 0.826 and DD-supervised 0.81 on this same val=200, so the substrate clears baseline easily -> iter-1 was under-trained. FALSIFIER: if hr stays 0 at 120 epochs, the denoiser is NOT the bottleneck and the fixed k=5/alpha=0.1 DC unroll is re-injecting sparse-view streaks (raising RMSE) -> iter-3 pivots to the DC knobs (k, alpha). (5) BUDGET: 20ep=212s measured -> per-epoch ~ (212-fixed)/20; fixed cost (load+200-slice k=5 val+fig) dominates. Even at a conservative 6x train cost, 120 epochs predicts ~900s < 1200s budget. (6) Loop continues; iter-3 dispatched on landing via numeric-headroom gate.", "seed": 42, "train_n": 400, "unet_c": 16, "val_n": 200}, "challenge": "breast_ct", "change_class": "architecture", "git_commit": null, "images": {"comparison": "runs/breast-ct-claude-agentic-itnet-search-20260703-01/iterations/iter-0002/comparison.png", "test_showcase": null, "valtest_showcase": null}, "iter": 2, "kept": false, "metrics": {"headroom": 0.0, "headroom_std": null, "val_psnr": 23.857040405273438, "val_psnr_std": null, "val_rmse": 0.021905461326241493, "val_rmse_std": null, "val_ssim": 0.7114381194114685, "val_ssim_std": null}, "model": "claude-opus-4-8-1m", "obs_path": "breast-ct-claude-agentic-itnet-search-20260703-01/iterations/iter-0002/observation.json", "obs_sha1": "310196966b90d6ed552ebce9202606c06f57e9e8", "params_M": 0.232881, "params_source": "observation", "rationale": "itnet-claude-agentic: pretrain_epochs=120, pretrain_lr=0.001, itnet_k=5, itnet_alpha=0.1, unet_c=16, finetune_epochs=0, finetune_lr=0.0001, train_n=400, val_n=200, grad_clip=1.0, seed=42, rationale=iter-2 (breast ItNet v1, search-20260703-01). SIX-BOX: (1) PRIOR NUMBERS: iter-1 (pretrain_epochs=20) -> val_ssim 0.8237, hr 0.0000 (BELOW sparse-view FBP baseline), PSNR 25.63, RMSE 0.01786, elapsed 211.9s. Job clean (only benign CuDNN warn). (2) FAILURE MODE: under-baseline recon (hr=0) AND severe budget under-use (212s of a 1200s budget). The single trainable component is the SmallUNet denoiser (0.2329M), pretrained FBP->truth for only 20 epochs; likely UNDER-TRAINED. (3) ONE KNOB: pretrain_epochs 20 -> 120 (6x). All else identical to iter-1. (4) HYPOTHESIS: if I train the denoiser 6x longer, I expect hr to clear 0 (recon RMSE drops below the FBP baseline) and ssim to rise, because the denoiser was the only trainable lever and 20 epochs on 400 scenes is far from converged; a sibling ITNet v2 reached hr 0.826 and DD-supervised 0.81 on this same val=200, so the substrate clears baseline easily -> iter-1 was under-trained. FALSIFIER: if hr stays 0 at 120 epochs, the denoiser is NOT the bottleneck and the fixed k=5/alpha=0.1 DC unroll is re-injecting sparse-view streaks (raising RMSE) -> iter-3 pivots to the DC knobs (k, alpha). (5) BUDGET: 20ep=212s measured -> per-epoch ~ (212-fixed)/20; fixed cost (load+200-slice k=5 val+fig) dominates. Even at a conservative 6x train cost, 120 epochs predicts ~900s < 1200s budget. (6) Loop continues; iter-3 dispatched on landing via numeric-headroom gate.", "run_id": "breast-ct-claude-agentic-itnet-search-20260703-01", "runtime": {"elapsed_s": 1183.7891535758972}, "schema_version": 3, "solver_key": "itnet", "solver_name": "ITNet v1", "split": {"train_n": 400, "val_n": 200}, "status": "discard", "ts": "2026-07-03T17:13:06Z"}
{"advice_for_others": "itnet-claude-agentic: pretrain_epochs=120, pretrain_lr=0.001, itnet_k=1, itnet_alpha=0.1, unet_c=16, finetune_epochs=0, finetune_lr=0.0001, train_n=400, val_n=200, grad_clip=1.0, seed=42, rationale=iter-3 (breast ItNet v1, search-20260703-01). SIX-BOX: (1) PRIOR NUMBERS: iter-1 (k=5, ep=20) ssim 0.8237 hr 0.0000 elapsed 212s; iter-2 (k=5, ep=120) ssim 0.7114 hr 0.0000 elapsed 1184s. CRITICAL SIGNAL: 6x MORE pretraining made ssim DROP 0.8237->0.7114 -> the denoiser is NOT under-trained; MORE denoising quality gets DESTROYED downstream. (2) FAILURE MODE: the FIXED analytic k=5 DC unroll re-injects sparse-view streaks. Mechanism: x <- x_denoised - alpha*FBP(R*x_denoised - g); on a 128-view sparse system FBP(residual) is itself a streaky sparse-view recon, so each of the 5 fixed (untrained) DC steps drags the clean denoised image back toward the streaky FBP, raising RMSE above baseline. A cleaner x_denoised (iter-2) is corrupted MORE by 5 steps -> ssim fell. On Mayo the v1 CHAMPION used k=1 for exactly this reason. (3) ONE KNOB: itnet_k 5 -> 1 (all else identical to iter-2: ep=120, alpha=0.1, unet_c=16, lr=1e-3, train_n=400, val_n=200). (4) HYPOTHESIS: if I cut the fixed DC unroll to a single step (k=1), I expect hr to clear 0 and ssim to jump back above iter-1, because the dominant damage is the repeated streak re-injection; one mild DC step barely perturbs the clean denoiser output. FALSIFIER: if hr is still 0 at k=1, the DC step itself (any alpha>0) is net-harmful on sparse breast -> iter-4 drops alpha toward 0 (or k stays 1 with alpha lowered). (5) BUDGET: k=1 is CHEAPER than k=5 (1 forward+FBP per val slice instead of 5); iter-2 at k=5/ep=120 was 1184s, so k=1/ep=120 predicts well under 1000s < 1200s budget. (6) Loop continues; iter-4 dispatched on landing via numeric-headroom gate.", "agent": "itnet-claude-agentic", "campaign": "search-20260703-01", "cfg_full": {"finetune_epochs": 0, "finetune_lr": 0.0001, "grad_clip": 1.0, "itnet_alpha": 0.1, "itnet_k": 1, "pretrain_epochs": 120, "pretrain_lr": 0.001, "rationale": "iter-3 (breast ItNet v1, search-20260703-01). SIX-BOX: (1) PRIOR NUMBERS: iter-1 (k=5, ep=20) ssim 0.8237 hr 0.0000 elapsed 212s; iter-2 (k=5, ep=120) ssim 0.7114 hr 0.0000 elapsed 1184s. CRITICAL SIGNAL: 6x MORE pretraining made ssim DROP 0.8237->0.7114 -> the denoiser is NOT under-trained; MORE denoising quality gets DESTROYED downstream. (2) FAILURE MODE: the FIXED analytic k=5 DC unroll re-injects sparse-view streaks. Mechanism: x <- x_denoised - alpha*FBP(R*x_denoised - g); on a 128-view sparse system FBP(residual) is itself a streaky sparse-view recon, so each of the 5 fixed (untrained) DC steps drags the clean denoised image back toward the streaky FBP, raising RMSE above baseline. A cleaner x_denoised (iter-2) is corrupted MORE by 5 steps -> ssim fell. On Mayo the v1 CHAMPION used k=1 for exactly this reason. (3) ONE KNOB: itnet_k 5 -> 1 (all else identical to iter-2: ep=120, alpha=0.1, unet_c=16, lr=1e-3, train_n=400, val_n=200). (4) HYPOTHESIS: if I cut the fixed DC unroll to a single step (k=1), I expect hr to clear 0 and ssim to jump back above iter-1, because the dominant damage is the repeated streak re-injection; one mild DC step barely perturbs the clean denoiser output. FALSIFIER: if hr is still 0 at k=1, the DC step itself (any alpha>0) is net-harmful on sparse breast -> iter-4 drops alpha toward 0 (or k stays 1 with alpha lowered). (5) BUDGET: k=1 is CHEAPER than k=5 (1 forward+FBP per val slice instead of 5); iter-2 at k=5/ep=120 was 1184s, so k=1/ep=120 predicts well under 1000s < 1200s budget. (6) Loop continues; iter-4 dispatched on landing via numeric-headroom gate.", "seed": 42, "train_n": 400, "unet_c": 16, "val_n": 200}, "challenge": "breast_ct", "change_class": "architecture", "git_commit": null, "images": {"comparison": "runs/breast-ct-claude-agentic-itnet-search-20260703-01/iterations/iter-0003/comparison.png", "test_showcase": null, "valtest_showcase": null}, "iter": 3, "kept": true, "metrics": {"headroom": 0.8198985871429166, "headroom_std": null, "val_psnr": 51.21385192871094, "val_psnr_std": null, "val_rmse": 0.000939100282266736, "val_rmse_std": null, "val_ssim": 0.9814695715904236, "val_ssim_std": null}, "model": "claude-opus-4-8-1m", "obs_path": "breast-ct-claude-agentic-itnet-search-20260703-01/iterations/iter-0003/observation.json", "obs_sha1": "fa87b5a9b7656abd89234aff5a848581a5732b57", "params_M": 0.232881, "params_source": "observation", "rationale": "itnet-claude-agentic: pretrain_epochs=120, pretrain_lr=0.001, itnet_k=1, itnet_alpha=0.1, unet_c=16, finetune_epochs=0, finetune_lr=0.0001, train_n=400, val_n=200, grad_clip=1.0, seed=42, rationale=iter-3 (breast ItNet v1, search-20260703-01). SIX-BOX: (1) PRIOR NUMBERS: iter-1 (k=5, ep=20) ssim 0.8237 hr 0.0000 elapsed 212s; iter-2 (k=5, ep=120) ssim 0.7114 hr 0.0000 elapsed 1184s. CRITICAL SIGNAL: 6x MORE pretraining made ssim DROP 0.8237->0.7114 -> the denoiser is NOT under-trained; MORE denoising quality gets DESTROYED downstream. (2) FAILURE MODE: the FIXED analytic k=5 DC unroll re-injects sparse-view streaks. Mechanism: x <- x_denoised - alpha*FBP(R*x_denoised - g); on a 128-view sparse system FBP(residual) is itself a streaky sparse-view recon, so each of the 5 fixed (untrained) DC steps drags the clean denoised image back toward the streaky FBP, raising RMSE above baseline. A cleaner x_denoised (iter-2) is corrupted MORE by 5 steps -> ssim fell. On Mayo the v1 CHAMPION used k=1 for exactly this reason. (3) ONE KNOB: itnet_k 5 -> 1 (all else identical to iter-2: ep=120, alpha=0.1, unet_c=16, lr=1e-3, train_n=400, val_n=200). (4) HYPOTHESIS: if I cut the fixed DC unroll to a single step (k=1), I expect hr to clear 0 and ssim to jump back above iter-1, because the dominant damage is the repeated streak re-injection; one mild DC step barely perturbs the clean denoiser output. FALSIFIER: if hr is still 0 at k=1, the DC step itself (any alpha>0) is net-harmful on sparse breast -> iter-4 drops alpha toward 0 (or k stays 1 with alpha lowered). (5) BUDGET: k=1 is CHEAPER than k=5 (1 forward+FBP per val slice instead of 5); iter-2 at k=5/ep=120 was 1184s, so k=1/ep=120 predicts well under 1000s < 1200s budget. (6) Loop continues; iter-4 dispatched on landing via numeric-headroom gate.", "run_id": "breast-ct-claude-agentic-itnet-search-20260703-01", "runtime": {"elapsed_s": 1190.2290992736816}, "schema_version": 3, "solver_key": "itnet", "solver_name": "ITNet v1", "split": {"train_n": 400, "val_n": 200}, "status": "keep", "ts": "2026-07-03T19:29:04Z"}
