{"advice_for_others": "manduca_bilateral-claude-agentic: proj_n_bf=1, proj_sr=1.5, proj_w=5, proj_kernel=5, bf_d_w_ratio=0.16666666666666666, manduca_N0=100000.0, manduca_bowtie=False, img_n_bf=1, img_kernel=5, img_sx=0.5, img_sy=0.5, img_sr=0.02, epochs=10, batch_size=1, lr=0.005, optimizer=adam, lambda_neg=1.0, grad_clip=1.0, train_n=400, val_n=200, val_chunk=10, seed=42, rationale=iter-1 ONBOARDING manduca_bilateral on re-split Breast-CT (train3600/val200/test200 seed20260703, per-iter train_n=400, score val=200) under HARD 20-min budget. Manduca 2009 proj-space bilateral w/ CT noise model: N=N0*exp(-P) -> Q=sqrt(N) (Anscombe) -> trainable bilateral on Q -> invert -> FBP(128 views) -> optional image bilateral tail; supervised L2 vs clean phantom. SIX-BOX: (1) PRIOR: none (first iter of slug); nearest ref = Mayo manduca iter-1 hr=0.0598 at these paper-faithful defaults, and the sibling breast DD-UNet-supervised run (same split) clears FBP baseline trivially at hr~0.81. (2) Failure mode: N/A onboarding; goal = does Manduca proj-bilateral run on breast val=200 under 20-min budget and clear the 128-view sparse FBP baseline (hr>0)? (3) ONE KNOB: N/A baseline = paper-faithful CONFIG defaults (proj_n_bf=1, proj_sr=1.5, bf_d_w_ratio=1/6, manduca_N0=1e5=dataset i0, img_n_bf=1, ep=10). (4) HYPOTHESIS: the ~6-9 param Manduca bilateral trains stably on breast (finite val_score, comparison.png) and clears hr>0; but expect a MODEST hr (the noise model targets Poisson photon noise, while breast's dominant defect is 128-view STREAK aliasing, so the proj-bilateral on sqrt-counts is a weak lever here vs the DD-UNet). The image-domain bilateral tail (img_n_bf) is the reserved iter-2+ lever. (5) BUDGET: bilateral is ~6-9 params, far cheaper than the DD-UNet (which ran ep10 train_n=400 val=200 in 227s); ep10 fits well under 20 min (30-min sbatch wall). breast uses a single shared PYRO-NN projector (no per-sample-ps swap), FBP batched, val_chunk=10 fine. (6) Loop continues; iter-2 dispatched on landing. Reserved knobs for iters 2-N: img_n_bf (image-domain denoise depth, the primary lever mirroring Mayo bilateral-supervised), proj_sr, bf_d_w_ratio, epochs.", "agent": "manduca_bilateral-claude-agentic", "campaign": "search-20260703-01", "cfg_full": {"batch_size": 1, "bf_d_w_ratio": 0.16666666666666666, "epochs": 10, "grad_clip": 1.0, "img_kernel": 5, "img_n_bf": 1, "img_sr": 0.02, "img_sx": 0.5, "img_sy": 0.5, "lambda_neg": 1.0, "lr": 0.005, "manduca_N0": 100000.0, "manduca_bowtie": false, "optimizer": "adam", "proj_kernel": 5, "proj_n_bf": 1, "proj_sr": 1.5, "proj_w": 5, "rationale": "iter-1 ONBOARDING manduca_bilateral on re-split Breast-CT (train3600/val200/test200 seed20260703, per-iter train_n=400, score val=200) under HARD 20-min budget. Manduca 2009 proj-space bilateral w/ CT noise model: N=N0*exp(-P) -> Q=sqrt(N) (Anscombe) -> trainable bilateral on Q -> invert -> FBP(128 views) -> optional image bilateral tail; supervised L2 vs clean phantom. SIX-BOX: (1) PRIOR: none (first iter of slug); nearest ref = Mayo manduca iter-1 hr=0.0598 at these paper-faithful defaults, and the sibling breast DD-UNet-supervised run (same split) clears FBP baseline trivially at hr~0.81. (2) Failure mode: N/A onboarding; goal = does Manduca proj-bilateral run on breast val=200 under 20-min budget and clear the 128-view sparse FBP baseline (hr>0)? (3) ONE KNOB: N/A baseline = paper-faithful CONFIG defaults (proj_n_bf=1, proj_sr=1.5, bf_d_w_ratio=1/6, manduca_N0=1e5=dataset i0, img_n_bf=1, ep=10). (4) HYPOTHESIS: the ~6-9 param Manduca bilateral trains stably on breast (finite val_score, comparison.png) and clears hr>0; but expect a MODEST hr (the noise model targets Poisson photon noise, while breast's dominant defect is 128-view STREAK aliasing, so the proj-bilateral on sqrt-counts is a weak lever here vs the DD-UNet). The image-domain bilateral tail (img_n_bf) is the reserved iter-2+ lever. (5) BUDGET: bilateral is ~6-9 params, far cheaper than the DD-UNet (which ran ep10 train_n=400 val=200 in 227s); ep10 fits well under 20 min (30-min sbatch wall). breast uses a single shared PYRO-NN projector (no per-sample-ps swap), FBP batched, val_chunk=10 fine. (6) Loop continues; iter-2 dispatched on landing. Reserved knobs for iters 2-N: img_n_bf (image-domain denoise depth, the primary lever mirroring Mayo bilateral-supervised), proj_sr, bf_d_w_ratio, epochs.", "seed": 42, "train_n": 400, "val_chunk": 10, "val_n": 200}, "challenge": "breast_ct", "change_class": "architecture", "git_commit": null, "images": {"comparison": "runs/breast-ct-claude-agentic-manduca-bilateral-search-20260703-01/iterations/iter-0001/comparison.png", "test_showcase": null, "valtest_showcase": null}, "iter": 1, "kept": true, "metrics": {"headroom": 0.2158927247642327, "headroom_std": 0.0074983796839724155, "val_psnr": 38.43668746948242, "val_psnr_std": 0.5825858604820706, "val_rmse": 0.004088557790964842, "val_rmse_std": 0.0002670256743122654, "val_ssim": 0.9742181301116943, "val_ssim_std": 0.004118264964430234}, "model": "claude-opus-4-8-1m", "obs_path": "breast-ct-claude-agentic-manduca-bilateral-search-20260703-01/iterations/iter-0001/observation.json", "obs_sha1": "f7d81297ad388c8843cc39b4c0b3507cfb58ddb5", "params_M": 7e-06, "params_source": "observation", "rationale": "manduca_bilateral-claude-agentic: proj_n_bf=1, proj_sr=1.5, proj_w=5, proj_kernel=5, bf_d_w_ratio=0.16666666666666666, manduca_N0=100000.0, manduca_bowtie=False, img_n_bf=1, img_kernel=5, img_sx=0.5, img_sy=0.5, img_sr=0.02, epochs=10, batch_size=1, lr=0.005, optimizer=adam, lambda_neg=1.0, grad_clip=1.0, train_n=400, val_n=200, val_chunk=10, seed=42, rationale=iter-1 ONBOARDING manduca_bilateral on re-split Breast-CT (train3600/val200/test200 seed20260703, per-iter train_n=400, score val=200) under HARD 20-min budget. Manduca 2009 proj-space bilateral w/ CT noise model: N=N0*exp(-P) -> Q=sqrt(N) (Anscombe) -> trainable bilateral on Q -> invert -> FBP(128 views) -> optional image bilateral tail; supervised L2 vs clean phantom. SIX-BOX: (1) PRIOR: none (first iter of slug); nearest ref = Mayo manduca iter-1 hr=0.0598 at these paper-faithful defaults, and the sibling breast DD-UNet-supervised run (same split) clears FBP baseline trivially at hr~0.81. (2) Failure mode: N/A onboarding; goal = does Manduca proj-bilateral run on breast val=200 under 20-min budget and clear the 128-view sparse FBP baseline (hr>0)? (3) ONE KNOB: N/A baseline = paper-faithful CONFIG defaults (proj_n_bf=1, proj_sr=1.5, bf_d_w_ratio=1/6, manduca_N0=1e5=dataset i0, img_n_bf=1, ep=10). (4) HYPOTHESIS: the ~6-9 param Manduca bilateral trains stably on breast (finite val_score, comparison.png) and clears hr>0; but expect a MODEST hr (the noise model targets Poisson photon noise, while breast's dominant defect is 128-view STREAK aliasing, so the proj-bilateral on sqrt-counts is a weak lever here vs the DD-UNet). The image-domain bilateral tail (img_n_bf) is the reserved iter-2+ lever. (5) BUDGET: bilateral is ~6-9 params, far cheaper than the DD-UNet (which ran ep10 train_n=400 val=200 in 227s); ep10 fits well under 20 min (30-min sbatch wall). breast uses a single shared PYRO-NN projector (no per-sample-ps swap), FBP batched, val_chunk=10 fine. (6) Loop continues; iter-2 dispatched on landing. Reserved knobs for iters 2-N: img_n_bf (image-domain denoise depth, the primary lever mirroring Mayo bilateral-supervised), proj_sr, bf_d_w_ratio, epochs.", "run_id": "breast-ct-claude-agentic-manduca-bilateral-search-20260703-01", "runtime": {"elapsed_s": 106.81551742553711}, "schema_version": 3, "solver_key": "manduca-bilateral", "solver_name": "Manduca proj-bilateral (trainable)", "split": {"train_n": 400, "val_n": 200}, "status": "keep", "ts": "2026-07-03T22:36:30Z"}
{"advice_for_others": "manduca_bilateral-claude-agentic: proj_n_bf=1, proj_sr=1.5, proj_w=5, proj_kernel=5, bf_d_w_ratio=0.16666666666666666, manduca_N0=100000.0, manduca_bowtie=False, img_n_bf=3, img_kernel=5, img_sx=0.5, img_sy=0.5, img_sr=0.02, epochs=10, batch_size=1, lr=0.005, optimizer=adam, lambda_neg=1.0, grad_clip=1.0, train_n=400, val_n=200, val_chunk=10, seed=42, rationale=iter-2 manduca_bilateral on re-split Breast-CT (train3600/val200/test200 seed20260703, per-iter train_n=400, val=200). SIX-BOX vs iter-1: (1) PRIOR: iter-1 hr=0.2159 val_ssim=0.9742 psnr=38.44 rmse=4.09e-3 in 106.8s at paper-faithful defaults (proj_n_bf=1 proj_sr=1.5 bf_d_w_ratio=1/6 img_n_bf=1 ep=10); cleared FBP baseline strongly; only ~107s of the 1200s budget used. (2) FAILURE MODE: under-denoising -- the 6-param bilateral (1 proj + 1 img filter) leaves substantial 128-view streak/residual in the reconstructed image where calibrated-SSIM-headroom is measured (cf. the DD-UNet's hr=0.81 on the same split; the tiny bilateral is far under-capacity). On Mayo the img_n_bf DEPTH was the primary capacity lever for bilateral-supervised. (3) ONE KNOB: img_n_bf 1->3 (image-domain bilateral cascade depth: +2 trainable image-domain BFs, ~3 params each, placed exactly where the metric lives). All else held (epochs=10, proj_sr=1.5, bf_d_w_ratio=1/6, lr=5e-3). Params 6->12. (4) HYPOTHESIS: raising img_n_bf 1->3 lifts hr above 0.2159 because a deeper image-domain bilateral cascade (Wagner 2022 sec 3.2: cascading BFs enlarge the effective receptive field at ~3 params each) suppresses more surviving 128-view residual noise in the FBP output. FALSIFIER: if hr stays <=~0.22, image-domain depth is not the lever -> iter-3 attacks the proj-domain (proj_sr / bf_d_w_ratio) or epochs. (5) BUDGET: +2 cheap bilateral passes/step; iter-1 ran 107s so this stays far under the 20-min budget (30-min sbatch wall). (6) Loop continues; iter-3 dispatched on landing. --qos=turbo active.", "agent": "manduca_bilateral-claude-agentic", "campaign": "search-20260703-01", "cfg_full": {"batch_size": 1, "bf_d_w_ratio": 0.16666666666666666, "epochs": 10, "grad_clip": 1.0, "img_kernel": 5, "img_n_bf": 3, "img_sr": 0.02, "img_sx": 0.5, "img_sy": 0.5, "lambda_neg": 1.0, "lr": 0.005, "manduca_N0": 100000.0, "manduca_bowtie": false, "optimizer": "adam", "proj_kernel": 5, "proj_n_bf": 1, "proj_sr": 1.5, "proj_w": 5, "rationale": "iter-2 manduca_bilateral on re-split Breast-CT (train3600/val200/test200 seed20260703, per-iter train_n=400, val=200). SIX-BOX vs iter-1: (1) PRIOR: iter-1 hr=0.2159 val_ssim=0.9742 psnr=38.44 rmse=4.09e-3 in 106.8s at paper-faithful defaults (proj_n_bf=1 proj_sr=1.5 bf_d_w_ratio=1/6 img_n_bf=1 ep=10); cleared FBP baseline strongly; only ~107s of the 1200s budget used. (2) FAILURE MODE: under-denoising -- the 6-param bilateral (1 proj + 1 img filter) leaves substantial 128-view streak/residual in the reconstructed image where calibrated-SSIM-headroom is measured (cf. the DD-UNet's hr=0.81 on the same split; the tiny bilateral is far under-capacity). On Mayo the img_n_bf DEPTH was the primary capacity lever for bilateral-supervised. (3) ONE KNOB: img_n_bf 1->3 (image-domain bilateral cascade depth: +2 trainable image-domain BFs, ~3 params each, placed exactly where the metric lives). All else held (epochs=10, proj_sr=1.5, bf_d_w_ratio=1/6, lr=5e-3). Params 6->12. (4) HYPOTHESIS: raising img_n_bf 1->3 lifts hr above 0.2159 because a deeper image-domain bilateral cascade (Wagner 2022 sec 3.2: cascading BFs enlarge the effective receptive field at ~3 params each) suppresses more surviving 128-view residual noise in the FBP output. FALSIFIER: if hr stays <=~0.22, image-domain depth is not the lever -> iter-3 attacks the proj-domain (proj_sr / bf_d_w_ratio) or epochs. (5) BUDGET: +2 cheap bilateral passes/step; iter-1 ran 107s so this stays far under the 20-min budget (30-min sbatch wall). (6) Loop continues; iter-3 dispatched on landing. --qos=turbo active.", "seed": 42, "train_n": 400, "val_chunk": 10, "val_n": 200}, "challenge": "breast_ct", "change_class": "architecture", "git_commit": null, "images": {"comparison": "runs/breast-ct-claude-agentic-manduca-bilateral-search-20260703-01/iterations/iter-0002/comparison.png", "test_showcase": null, "valtest_showcase": null}, "iter": 2, "kept": true, "metrics": {"headroom": 0.2431103695625907, "headroom_std": 0.0088820821710678, "val_psnr": 38.74354553222656, "val_psnr_std": 0.5755052795245496, "val_rmse": 0.0039466372691094875, "val_rmse_std": 0.00025481562814549523, "val_ssim": 0.9810739159584045, "val_ssim_std": 0.003403293583841983}, "model": "claude-opus-4-8-1m", "obs_path": "breast-ct-claude-agentic-manduca-bilateral-search-20260703-01/iterations/iter-0002/observation.json", "obs_sha1": "aeef6086c70455348f8f0d7cbd633cad9873186e", "params_M": 1.3e-05, "params_source": "observation", "rationale": "manduca_bilateral-claude-agentic: proj_n_bf=1, proj_sr=1.5, proj_w=5, proj_kernel=5, bf_d_w_ratio=0.16666666666666666, manduca_N0=100000.0, manduca_bowtie=False, img_n_bf=3, img_kernel=5, img_sx=0.5, img_sy=0.5, img_sr=0.02, epochs=10, batch_size=1, lr=0.005, optimizer=adam, lambda_neg=1.0, grad_clip=1.0, train_n=400, val_n=200, val_chunk=10, seed=42, rationale=iter-2 manduca_bilateral on re-split Breast-CT (train3600/val200/test200 seed20260703, per-iter train_n=400, val=200). SIX-BOX vs iter-1: (1) PRIOR: iter-1 hr=0.2159 val_ssim=0.9742 psnr=38.44 rmse=4.09e-3 in 106.8s at paper-faithful defaults (proj_n_bf=1 proj_sr=1.5 bf_d_w_ratio=1/6 img_n_bf=1 ep=10); cleared FBP baseline strongly; only ~107s of the 1200s budget used. (2) FAILURE MODE: under-denoising -- the 6-param bilateral (1 proj + 1 img filter) leaves substantial 128-view streak/residual in the reconstructed image where calibrated-SSIM-headroom is measured (cf. the DD-UNet's hr=0.81 on the same split; the tiny bilateral is far under-capacity). On Mayo the img_n_bf DEPTH was the primary capacity lever for bilateral-supervised. (3) ONE KNOB: img_n_bf 1->3 (image-domain bilateral cascade depth: +2 trainable image-domain BFs, ~3 params each, placed exactly where the metric lives). All else held (epochs=10, proj_sr=1.5, bf_d_w_ratio=1/6, lr=5e-3). Params 6->12. (4) HYPOTHESIS: raising img_n_bf 1->3 lifts hr above 0.2159 because a deeper image-domain bilateral cascade (Wagner 2022 sec 3.2: cascading BFs enlarge the effective receptive field at ~3 params each) suppresses more surviving 128-view residual noise in the FBP output. FALSIFIER: if hr stays <=~0.22, image-domain depth is not the lever -> iter-3 attacks the proj-domain (proj_sr / bf_d_w_ratio) or epochs. (5) BUDGET: +2 cheap bilateral passes/step; iter-1 ran 107s so this stays far under the 20-min budget (30-min sbatch wall). (6) Loop continues; iter-3 dispatched on landing. --qos=turbo active.", "run_id": "breast-ct-claude-agentic-manduca-bilateral-search-20260703-01", "runtime": {"elapsed_s": 139.90820598602295}, "schema_version": 3, "solver_key": "manduca-bilateral", "solver_name": "Manduca proj-bilateral (trainable)", "split": {"train_n": 400, "val_n": 200}, "status": "keep", "ts": "2026-07-03T23:29:53Z"}
{"advice_for_others": "manduca_bilateral-claude-agentic: proj_n_bf=1, proj_sr=1.5, proj_w=5, proj_kernel=5, bf_d_w_ratio=0.16666666666666666, manduca_N0=100000.0, manduca_bowtie=False, img_n_bf=6, img_kernel=5, img_sx=0.5, img_sy=0.5, img_sr=0.02, epochs=10, batch_size=1, lr=0.005, optimizer=adam, lambda_neg=1.0, grad_clip=1.0, train_n=400, val_n=200, val_chunk=10, seed=42, rationale=iter-3 manduca_bilateral breast (train3600/val200/test200 seed20260703, per-iter train_n=400, val=200). SIX-BOX: (1) PRIOR: iter-1 hr=0.2159 (img_n_bf=1 ep10); iter-2 hr=0.2431 (img_n_bf=3 ep10, 140s). img_n_bf 1->3 gave +0.027 hr -> image-domain bilateral DEPTH is a rising lever; budget barely used (140/1200s). (2) FAILURE MODE: still under-denoising; the img_n_bf depth trend is monotone rising and NOT yet plateaued -> the image-domain cascade is the productive axis. (3) ONE KNOB: img_n_bf 3->6 (double image-domain bilateral depth again; +3 trainable BFs, params 12->21). All else held (ep=10, proj_sr=1.5, bf_d_w_ratio=1/6, lr=5e-3). (4) HYPOTHESIS: img_n_bf 3->6 lifts hr above 0.2431 because the depth curve is still rising (1->3 = +0.027) and a deeper edge-preserving cascade further suppresses residual 128-view streak in the reconstructed image where calibrated-SSIM-headroom lives. FALSIFIER: if hr plateaus <=~0.245, img depth saturating -> iter-4 pivots to proj-domain range (proj_sr) or epochs. (5) BUDGET: +3 cheap bilateral passes; iter-2 was 140s -> far under the 20-min budget (30-min sbatch wall). (6) Loop continues; iter-4 on landing. --qos=turbo active.", "agent": "manduca_bilateral-claude-agentic", "campaign": "search-20260703-01", "cfg_full": {"batch_size": 1, "bf_d_w_ratio": 0.16666666666666666, "epochs": 10, "grad_clip": 1.0, "img_kernel": 5, "img_n_bf": 6, "img_sr": 0.02, "img_sx": 0.5, "img_sy": 0.5, "lambda_neg": 1.0, "lr": 0.005, "manduca_N0": 100000.0, "manduca_bowtie": false, "optimizer": "adam", "proj_kernel": 5, "proj_n_bf": 1, "proj_sr": 1.5, "proj_w": 5, "rationale": "iter-3 manduca_bilateral breast (train3600/val200/test200 seed20260703, per-iter train_n=400, val=200). SIX-BOX: (1) PRIOR: iter-1 hr=0.2159 (img_n_bf=1 ep10); iter-2 hr=0.2431 (img_n_bf=3 ep10, 140s). img_n_bf 1->3 gave +0.027 hr -> image-domain bilateral DEPTH is a rising lever; budget barely used (140/1200s). (2) FAILURE MODE: still under-denoising; the img_n_bf depth trend is monotone rising and NOT yet plateaued -> the image-domain cascade is the productive axis. (3) ONE KNOB: img_n_bf 3->6 (double image-domain bilateral depth again; +3 trainable BFs, params 12->21). All else held (ep=10, proj_sr=1.5, bf_d_w_ratio=1/6, lr=5e-3). (4) HYPOTHESIS: img_n_bf 3->6 lifts hr above 0.2431 because the depth curve is still rising (1->3 = +0.027) and a deeper edge-preserving cascade further suppresses residual 128-view streak in the reconstructed image where calibrated-SSIM-headroom lives. FALSIFIER: if hr plateaus <=~0.245, img depth saturating -> iter-4 pivots to proj-domain range (proj_sr) or epochs. (5) BUDGET: +3 cheap bilateral passes; iter-2 was 140s -> far under the 20-min budget (30-min sbatch wall). (6) Loop continues; iter-4 on landing. --qos=turbo active.", "seed": 42, "train_n": 400, "val_chunk": 10, "val_n": 200}, "challenge": "breast_ct", "change_class": "architecture", "git_commit": null, "images": {"comparison": "runs/breast-ct-claude-agentic-manduca-bilateral-search-20260703-01/iterations/iter-0003/comparison.png", "test_showcase": null, "valtest_showcase": null}, "iter": 3, "kept": true, "metrics": {"headroom": 0.24657102524480945, "headroom_std": 0.00905703783468433, "val_psnr": 38.78335189819336, "val_psnr_std": 0.5778525934330445, "val_rmse": 0.003928592428565025, "val_rmse_std": 0.00025475522339795623, "val_ssim": 0.9819186329841614, "val_ssim_std": 0.0033101668831031364}, "model": "claude-opus-4-8-1m", "obs_path": "breast-ct-claude-agentic-manduca-bilateral-search-20260703-01/iterations/iter-0003/observation.json", "obs_sha1": "b3f6fa8cb3edce1eba076067931cd2486a17f7f8", "params_M": 2.2e-05, "params_source": "observation", "rationale": "manduca_bilateral-claude-agentic: proj_n_bf=1, proj_sr=1.5, proj_w=5, proj_kernel=5, bf_d_w_ratio=0.16666666666666666, manduca_N0=100000.0, manduca_bowtie=False, img_n_bf=6, img_kernel=5, img_sx=0.5, img_sy=0.5, img_sr=0.02, epochs=10, batch_size=1, lr=0.005, optimizer=adam, lambda_neg=1.0, grad_clip=1.0, train_n=400, val_n=200, val_chunk=10, seed=42, rationale=iter-3 manduca_bilateral breast (train3600/val200/test200 seed20260703, per-iter train_n=400, val=200). SIX-BOX: (1) PRIOR: iter-1 hr=0.2159 (img_n_bf=1 ep10); iter-2 hr=0.2431 (img_n_bf=3 ep10, 140s). img_n_bf 1->3 gave +0.027 hr -> image-domain bilateral DEPTH is a rising lever; budget barely used (140/1200s). (2) FAILURE MODE: still under-denoising; the img_n_bf depth trend is monotone rising and NOT yet plateaued -> the image-domain cascade is the productive axis. (3) ONE KNOB: img_n_bf 3->6 (double image-domain bilateral depth again; +3 trainable BFs, params 12->21). All else held (ep=10, proj_sr=1.5, bf_d_w_ratio=1/6, lr=5e-3). (4) HYPOTHESIS: img_n_bf 3->6 lifts hr above 0.2431 because the depth curve is still rising (1->3 = +0.027) and a deeper edge-preserving cascade further suppresses residual 128-view streak in the reconstructed image where calibrated-SSIM-headroom lives. FALSIFIER: if hr plateaus <=~0.245, img depth saturating -> iter-4 pivots to proj-domain range (proj_sr) or epochs. (5) BUDGET: +3 cheap bilateral passes; iter-2 was 140s -> far under the 20-min budget (30-min sbatch wall). (6) Loop continues; iter-4 on landing. --qos=turbo active.", "run_id": "breast-ct-claude-agentic-manduca-bilateral-search-20260703-01", "runtime": {"elapsed_s": 270.76208758354187}, "schema_version": 3, "solver_key": "manduca-bilateral", "solver_name": "Manduca proj-bilateral (trainable)", "split": {"train_n": 400, "val_n": 200}, "status": "keep", "ts": "2026-07-03T23:57:25Z"}
