{"advice_for_others": "hammernik_2017-claude-agentic: vn_T=4, vn_n_filters=16, vn_kernel=9, vn_n_bumps=31, vn_x_range=2.0, vn_filter_init_std=0.05, vn_rbf_init_std=0.01, vn_lambda_init=0.02, epochs=30, batch_size=2, lr=0.00096, grad_clip=1.0, train_n=400, val_n=200, seed=42, max_train_s=1550, rationale=iter-5 (six-box). LAMBDA SWEEP COMPLETE: iter-1 lambda=0.0097 hr=0.5777; iter-3 lambda=0.02 hr=0.5921 BEST; iter-4 lambda=0.05 hr=0.0 (RMSE 2.1e-3->1.27e-2, SSIM 0.9866->0.9334 -- COLLAPSE). FAILURE MODE (iter-4): lambda over-anchoring -- above ~0.02 the data-fidelity term drives each step too hard toward y_NN=FBP-of-NOISY (which carries sparse-view streaks), degrading the recon. The lambda optimum is a bracketed interior maximum at ~0.02. Lambda is now fully characterized -> DONE with it; RESET to the iter-3 winner (lambda=0.02) and evolve the ARCHITECTURE. ONE KNOB: vn_T (unroll/cascade depth) 3 -> 4 (the core VN capacity lever; one extra data+regularizer GD step of the variational energy). HYPOTHESIS: with lambda fixed at its optimum, a deeper unroll gives one more streak-suppression step, lifting hr above 0.5921; predict hr > 0.595, OR diminishing returns if T=3 already saturates the tiny 16-filter bank. All else = iter-3 (filters=16, kernel=9, n_bumps=31, x_range=2.0, epochs=30, lr=9.6e-4, batch=2, grad_clip=1.0, seed=42, train_n=400). BUDGET: T=4 is ~1.33x iter-3's per-step cost -> 30 full epochs ~1580s, still UNDER the 1800s SLURM kill; max_train_s=1550 guards the wall so all 30 epochs complete (NO iter-2-style under-training). batch_size=2 (512px OOM guard).", "agent": "hammernik_2017-claude-agentic", "campaign": "search-20260703-01", "cfg_full": {"batch_size": 2, "epochs": 30, "grad_clip": 1.0, "lr": 0.00096, "max_train_s": 1550, "rationale": "iter-5 (six-box). LAMBDA SWEEP COMPLETE: iter-1 lambda=0.0097 hr=0.5777; iter-3 lambda=0.02 hr=0.5921 BEST; iter-4 lambda=0.05 hr=0.0 (RMSE 2.1e-3->1.27e-2, SSIM 0.9866->0.9334 -- COLLAPSE). FAILURE MODE (iter-4): lambda over-anchoring -- above ~0.02 the data-fidelity term drives each step too hard toward y_NN=FBP-of-NOISY (which carries sparse-view streaks), degrading the recon. The lambda optimum is a bracketed interior maximum at ~0.02. Lambda is now fully characterized -> DONE with it; RESET to the iter-3 winner (lambda=0.02) and evolve the ARCHITECTURE. ONE KNOB: vn_T (unroll/cascade depth) 3 -> 4 (the core VN capacity lever; one extra data+regularizer GD step of the variational energy). HYPOTHESIS: with lambda fixed at its optimum, a deeper unroll gives one more streak-suppression step, lifting hr above 0.5921; predict hr > 0.595, OR diminishing returns if T=3 already saturates the tiny 16-filter bank. All else = iter-3 (filters=16, kernel=9, n_bumps=31, x_range=2.0, epochs=30, lr=9.6e-4, batch=2, grad_clip=1.0, seed=42, train_n=400). BUDGET: T=4 is ~1.33x iter-3's per-step cost -> 30 full epochs ~1580s, still UNDER the 1800s SLURM kill; max_train_s=1550 guards the wall so all 30 epochs complete (NO iter-2-style under-training). batch_size=2 (512px OOM guard).", "seed": 42, "train_n": 400, "val_n": 200, "vn_T": 4, "vn_filter_init_std": 0.05, "vn_kernel": 9, "vn_lambda_init": 0.02, "vn_n_bumps": 31, "vn_n_filters": 16, "vn_rbf_init_std": 0.01, "vn_x_range": 2.0}, "challenge": "breast_ct", "change_class": "architecture", "git_commit": "1176d9f5", "images": {"comparison": "runs/breast-ct-claude-agentic-hammernik-2017-search-20260703-01/iterations/iter-0005/comparison.png", "test_showcase": null, "valtest_showcase": null}, "iter": 5, "kept": true, "metrics": {"headroom": 0.6173779016179286, "headroom_std": null, "val_psnr": 44.668792724609375, "val_psnr_std": null, "val_rmse": 0.001995100174099207, "val_rmse_std": null, "val_ssim": 0.9890750050544739, "val_ssim_std": null}, "model": "claude-opus-4-8-1m", "obs_path": "breast-ct-claude-agentic-hammernik-2017-search-20260703-01/iterations/iter-0005/observation.json", "obs_sha1": "66f33141039b14e775abb2270986e0f5d90ca3ec", "params_M": 0.007172, "params_source": "observation", "rationale": "hammernik_2017-claude-agentic: vn_T=4, vn_n_filters=16, vn_kernel=9, vn_n_bumps=31, vn_x_range=2.0, vn_filter_init_std=0.05, vn_rbf_init_std=0.01, vn_lambda_init=0.02, epochs=30, batch_size=2, lr=0.00096, grad_clip=1.0, train_n=400, val_n=200, seed=42, max_train_s=1550, rationale=iter-5 (six-box). LAMBDA SWEEP COMPLETE: iter-1 lambda=0.0097 hr=0.5777; iter-3 lambda=0.02 hr=0.5921 BEST; iter-4 lambda=0.05 hr=0.0 (RMSE 2.1e-3->1.27e-2, SSIM 0.9866->0.9334 -- COLLAPSE). FAILURE MODE (iter-4): lambda over-anchoring -- above ~0.02 the data-fidelity term drives each step too hard toward y_NN=FBP-of-NOISY (which carries sparse-view streaks), degrading the recon. The lambda optimum is a bracketed interior maximum at ~0.02. Lambda is now fully characterized -> DONE with it; RESET to the iter-3 winner (lambda=0.02) and evolve the ARCHITECTURE. ONE KNOB: vn_T (unroll/cascade depth) 3 -> 4 (the core VN capacity lever; one extra data+regularizer GD step of the variational energy). HYPOTHESIS: with lambda fixed at its optimum, a deeper unroll gives one more streak-suppression step, lifting hr above 0.5921; predict hr > 0.595, OR diminishing returns if T=3 already saturates the tiny 16-filter bank. All else = iter-3 (filters=16, kernel=9, n_bumps=31, x_range=2.0, epochs=30, lr=9.6e-4, batch=2, grad_clip=1.0, seed=42, train_n=400). BUDGET: T=4 is ~1.33x iter-3's per-step cost -> 30 full epochs ~1580s, still UNDER the 1800s SLURM kill; max_train_s=1550 guards the wall so all 30 epochs complete (NO iter-2-style under-training). batch_size=2 (512px OOM guard).", "run_id": "breast-ct-claude-agentic-hammernik-2017-search-20260703-01", "runtime": {"elapsed_s": 1660.4646043777466}, "schema_version": 3, "solver_key": "hammernik-2017", "solver_name": "Hammernik VN (2017)", "split": {"train_n": 400, "val_n": 200}, "status": "keep", "ts": "2026-07-04T08:52:18Z"}
{"advice_for_others": "hammernik_2017-claude-agentic: vn_T=5, vn_n_filters=16, vn_kernel=9, vn_n_bumps=31, vn_x_range=2.0, vn_filter_init_std=0.05, vn_rbf_init_std=0.01, vn_lambda_init=0.02, epochs=24, batch_size=2, lr=0.00096, grad_clip=1.0, train_n=400, val_n=200, seed=42, max_train_s=1650, rationale=iter-6 (six-box). DEPTH GRADIENT: iter-3 T=3 hr=0.5921 -> iter-5 T=4 hr=0.6174 (+0.025, NEW BEST, ssim 0.9891, RMSE 2.0e-3, 1660s). Lambda fixed at its optimum 0.02. FAILURE MODE: none -- each extra unroll step suppresses more sparse-view streaks. HYPOTHESIS KNOB: vn_T 4 -> 5 (continue the winning depth direction; one more data+regularizer GD step). Predict hr > 0.6174 unless the tiny 16-filter bank saturates. BUDGET NOTE: T=5 at 30 epochs would be ~2075s > the 1800s SLURM kill, so epochs is set to 24 as a DEPENDENT budget variable (NOT a hypothesis knob) to hold wall-time ~constant (24*T5 ~= 30*T4 ~1650s) -- this keeps the compute matched to iter-5 so the T=4->5 comparison is clean and avoids the iter-2 under-training trap (24 epochs still fully converges this VN, which plateaued well before 30 in iters 1/3/5). All else = iter-5 (filters=16, kernel=9, n_bumps=31, x_range=2.0, lr=9.6e-4, batch=2, grad_clip=1.0, seed=42, train_n=400). max_train_s=1650 guards the wall under the 1800s kill. batch_size=2 (512px OOM guard).", "agent": "hammernik_2017-claude-agentic", "campaign": "search-20260703-01", "cfg_full": {"batch_size": 2, "epochs": 24, "grad_clip": 1.0, "lr": 0.00096, "max_train_s": 1650, "rationale": "iter-6 (six-box). DEPTH GRADIENT: iter-3 T=3 hr=0.5921 -> iter-5 T=4 hr=0.6174 (+0.025, NEW BEST, ssim 0.9891, RMSE 2.0e-3, 1660s). Lambda fixed at its optimum 0.02. FAILURE MODE: none -- each extra unroll step suppresses more sparse-view streaks. HYPOTHESIS KNOB: vn_T 4 -> 5 (continue the winning depth direction; one more data+regularizer GD step). Predict hr > 0.6174 unless the tiny 16-filter bank saturates. BUDGET NOTE: T=5 at 30 epochs would be ~2075s > the 1800s SLURM kill, so epochs is set to 24 as a DEPENDENT budget variable (NOT a hypothesis knob) to hold wall-time ~constant (24*T5 ~= 30*T4 ~1650s) -- this keeps the compute matched to iter-5 so the T=4->5 comparison is clean and avoids the iter-2 under-training trap (24 epochs still fully converges this VN, which plateaued well before 30 in iters 1/3/5). All else = iter-5 (filters=16, kernel=9, n_bumps=31, x_range=2.0, lr=9.6e-4, batch=2, grad_clip=1.0, seed=42, train_n=400). max_train_s=1650 guards the wall under the 1800s kill. batch_size=2 (512px OOM guard).", "seed": 42, "train_n": 400, "val_n": 200, "vn_T": 5, "vn_filter_init_std": 0.05, "vn_kernel": 9, "vn_lambda_init": 0.02, "vn_n_bumps": 31, "vn_n_filters": 16, "vn_rbf_init_std": 0.01, "vn_x_range": 2.0}, "challenge": "breast_ct", "change_class": "architecture", "git_commit": "671da566", "images": {"comparison": "runs/breast-ct-claude-agentic-hammernik-2017-search-20260703-01/iterations/iter-0006/comparison.png", "test_showcase": null, "valtest_showcase": null}, "iter": 6, "kept": true, "metrics": {"headroom": 0.6329364517665366, "headroom_std": 0.014089806744174142, "val_psnr": 45.02937316894531, "val_psnr_std": 0.8584639121154305, "val_rmse": 0.0019139734795317054, "val_rmse_std": 0.00018654186872792044, "val_ssim": 0.9895423054695129, "val_ssim_std": 0.0019193614162798841}, "model": "claude-opus-4-8-1m", "obs_path": "breast-ct-claude-agentic-hammernik-2017-search-20260703-01/iterations/iter-0006/observation.json", "obs_sha1": "a07723391a46a1d7024da619ab7f9e1c1b94d14c", "params_M": 0.008965, "params_source": "observation", "rationale": "hammernik_2017-claude-agentic: vn_T=5, vn_n_filters=16, vn_kernel=9, vn_n_bumps=31, vn_x_range=2.0, vn_filter_init_std=0.05, vn_rbf_init_std=0.01, vn_lambda_init=0.02, epochs=24, batch_size=2, lr=0.00096, grad_clip=1.0, train_n=400, val_n=200, seed=42, max_train_s=1650, rationale=iter-6 (six-box). DEPTH GRADIENT: iter-3 T=3 hr=0.5921 -> iter-5 T=4 hr=0.6174 (+0.025, NEW BEST, ssim 0.9891, RMSE 2.0e-3, 1660s). Lambda fixed at its optimum 0.02. FAILURE MODE: none -- each extra unroll step suppresses more sparse-view streaks. HYPOTHESIS KNOB: vn_T 4 -> 5 (continue the winning depth direction; one more data+regularizer GD step). Predict hr > 0.6174 unless the tiny 16-filter bank saturates. BUDGET NOTE: T=5 at 30 epochs would be ~2075s > the 1800s SLURM kill, so epochs is set to 24 as a DEPENDENT budget variable (NOT a hypothesis knob) to hold wall-time ~constant (24*T5 ~= 30*T4 ~1650s) -- this keeps the compute matched to iter-5 so the T=4->5 comparison is clean and avoids the iter-2 under-training trap (24 epochs still fully converges this VN, which plateaued well before 30 in iters 1/3/5). All else = iter-5 (filters=16, kernel=9, n_bumps=31, x_range=2.0, lr=9.6e-4, batch=2, grad_clip=1.0, seed=42, train_n=400). max_train_s=1650 guards the wall under the 1800s kill. batch_size=2 (512px OOM guard).", "run_id": "breast-ct-claude-agentic-hammernik-2017-search-20260703-01", "runtime": {"elapsed_s": 1732.135291337967}, "schema_version": 3, "solver_key": "hammernik-2017", "solver_name": "Hammernik VN (2017)", "split": {"train_n": 400, "val_n": 200}, "status": "keep", "ts": "2026-07-04T11:40:24Z"}
{"advice_for_others": "hammernik_2017-claude-agentic: vn_T=4, vn_n_filters=24, vn_kernel=9, vn_n_bumps=31, vn_x_range=2.0, vn_filter_init_std=0.05, vn_rbf_init_std=0.01, vn_lambda_init=0.02, epochs=18, batch_size=2, lr=0.00096, grad_clip=1.0, train_n=400, val_n=200, seed=42, max_train_s=1680, rationale=iter-7 (six-box; RESCOPED after 2 OOMs). ORIGINAL plan (T=5,f=24) OOMed twice on 16GB RTX5000 in the _rho_prime RBF-bump loop (48MiB short; expandable_segments did not save it) -> FINDING: T=5 x 24-filter x 512px x 31-bump is memory-infeasible on the default node pool. Width axis must be tested at a memory-safe depth. DEPTH gradient recap (lambda=0.02): T=3 hr=0.5921, T=4 hr=0.6174, T=5 hr=0.6329 (best). ONE KNOB relative to iter-5 (T=4, f=16, hr=0.6174, ran 1660s memory-safe): vn_n_filters 16 -> 24 at T=4. HYPOTHESIS: widening the filter bank 16->24 at the memory-safe T=4 lifts hr above iter-5's 0.6174 (tests capacity/width independent of depth); if it also clears iter-6's 0.6329 the width axis beats the depth axis. All else = iter-5 (T=4, kernel=9, n_bumps=31, x_range=2.0, lambda=0.02, lr=9.6e-4, batch=2, grad_clip=1.0, seed=42, train_n=400). BUDGET: 24f/T4 ~1.5x iter-5 per-step; epochs=18 DEPENDENT budget var to hold wall <1700s under the 1800s kill; VN plateaus early so ep=18 converges. MEMORY: 24f/T4 is ~1.5x iter-5 forward memory (iter-5 was not near the 16GB limit) -> expected to fit; expandable_segments retained via --export as extra headroom. batch_size=2 (OOM guard).", "agent": "hammernik_2017-claude-agentic", "campaign": "search-20260703-01", "cfg_full": {"batch_size": 2, "epochs": 18, "grad_clip": 1.0, "lr": 0.00096, "max_train_s": 1680, "rationale": "iter-7 (six-box; RESCOPED after 2 OOMs). ORIGINAL plan (T=5,f=24) OOMed twice on 16GB RTX5000 in the _rho_prime RBF-bump loop (48MiB short; expandable_segments did not save it) -> FINDING: T=5 x 24-filter x 512px x 31-bump is memory-infeasible on the default node pool. Width axis must be tested at a memory-safe depth. DEPTH gradient recap (lambda=0.02): T=3 hr=0.5921, T=4 hr=0.6174, T=5 hr=0.6329 (best). ONE KNOB relative to iter-5 (T=4, f=16, hr=0.6174, ran 1660s memory-safe): vn_n_filters 16 -> 24 at T=4. HYPOTHESIS: widening the filter bank 16->24 at the memory-safe T=4 lifts hr above iter-5's 0.6174 (tests capacity/width independent of depth); if it also clears iter-6's 0.6329 the width axis beats the depth axis. All else = iter-5 (T=4, kernel=9, n_bumps=31, x_range=2.0, lambda=0.02, lr=9.6e-4, batch=2, grad_clip=1.0, seed=42, train_n=400). BUDGET: 24f/T4 ~1.5x iter-5 per-step; epochs=18 DEPENDENT budget var to hold wall <1700s under the 1800s kill; VN plateaus early so ep=18 converges. MEMORY: 24f/T4 is ~1.5x iter-5 forward memory (iter-5 was not near the 16GB limit) -> expected to fit; expandable_segments retained via --export as extra headroom. batch_size=2 (OOM guard).", "seed": 42, "train_n": 400, "val_n": 200, "vn_T": 4, "vn_filter_init_std": 0.05, "vn_kernel": 9, "vn_lambda_init": 0.02, "vn_n_bumps": 31, "vn_n_filters": 24, "vn_rbf_init_std": 0.01, "vn_x_range": 2.0}, "challenge": "breast_ct", "change_class": "architecture", "git_commit": "671da566", "images": {"comparison": "runs/breast-ct-claude-agentic-hammernik-2017-search-20260703-01/iterations/iter-0007/comparison.png", "test_showcase": null, "valtest_showcase": null}, "iter": 7, "kept": true, "metrics": {"headroom": 0.5227116748078537, "headroom_std": null, "val_psnr": 42.74858093261719, "val_psnr_std": null, "val_rmse": 0.0024887167382985353, "val_rmse_std": null, "val_ssim": 0.9795144200325012, "val_ssim_std": null}, "model": "claude-opus-4-8-1m", "obs_path": "breast-ct-claude-agentic-hammernik-2017-search-20260703-01/iterations/iter-0007/observation.json", "obs_sha1": "16bf86eaa716f86c4413ef024c69aabb27c29494", "params_M": 0.010756, "params_source": "observation", "rationale": "hammernik_2017-claude-agentic: vn_T=4, vn_n_filters=24, vn_kernel=9, vn_n_bumps=31, vn_x_range=2.0, vn_filter_init_std=0.05, vn_rbf_init_std=0.01, vn_lambda_init=0.02, epochs=18, batch_size=2, lr=0.00096, grad_clip=1.0, train_n=400, val_n=200, seed=42, max_train_s=1680, rationale=iter-7 (six-box; RESCOPED after 2 OOMs). ORIGINAL plan (T=5,f=24) OOMed twice on 16GB RTX5000 in the _rho_prime RBF-bump loop (48MiB short; expandable_segments did not save it) -> FINDING: T=5 x 24-filter x 512px x 31-bump is memory-infeasible on the default node pool. Width axis must be tested at a memory-safe depth. DEPTH gradient recap (lambda=0.02): T=3 hr=0.5921, T=4 hr=0.6174, T=5 hr=0.6329 (best). ONE KNOB relative to iter-5 (T=4, f=16, hr=0.6174, ran 1660s memory-safe): vn_n_filters 16 -> 24 at T=4. HYPOTHESIS: widening the filter bank 16->24 at the memory-safe T=4 lifts hr above iter-5's 0.6174 (tests capacity/width independent of depth); if it also clears iter-6's 0.6329 the width axis beats the depth axis. All else = iter-5 (T=4, kernel=9, n_bumps=31, x_range=2.0, lambda=0.02, lr=9.6e-4, batch=2, grad_clip=1.0, seed=42, train_n=400). BUDGET: 24f/T4 ~1.5x iter-5 per-step; epochs=18 DEPENDENT budget var to hold wall <1700s under the 1800s kill; VN plateaus early so ep=18 converges. MEMORY: 24f/T4 is ~1.5x iter-5 forward memory (iter-5 was not near the 16GB limit) -> expected to fit; expandable_segments retained via --export as extra headroom. batch_size=2 (OOM guard).", "run_id": "breast-ct-claude-agentic-hammernik-2017-search-20260703-01", "runtime": {"elapsed_s": 1779.2882325649261}, "schema_version": 3, "solver_key": "hammernik-2017", "solver_name": "Hammernik VN (2017)", "split": {"train_n": 400, "val_n": 200}, "status": "keep", "ts": "2026-07-04T13:41:51Z"}
