{"advice_for_others": "itnet_v3-claude-agentic: itnet_k=3, unet_c=16, alpha_init=0.0025734, lr=0.00021567, epochs=3, batch_size=2, train_n=2400, val_n=200, grad_clip=1.0, max_train_s=1000, seed=42, rationale=iter-4 (breast-ct redo, search-20260703-01). ONE KNOB (ARCHITECTURE): itnet_k 2 -> 3 (one MORE unrolled denoiser+data-consistency step), with epochs traded DOWN 5 -> 3 to fund the extra unroll pass inside the HARD 20-min wall. All else = iter-3 exactly (unet_c=16, alpha_init=0.0025734, lr=2.16e-4, batch_size=2, train_n=2400, val_n=200, grad_clip=1.0, seed=42). SIX-BOX (NUMBERS): (1) iter-1 (n400/ep12/k2): hr 0.7737. iter-2 (n2400/ep4/k2): hr 0.8198. iter-3 (n2400/ep5/k2): hr 0.8277, SSIM 0.9977, PSNR 51.60, RMSE 8.99e-4, elapsed 877.4s=14.6min, params 3.699M. (2) FAILURE MODE: the EPOCHS lever is now in DIMINISHING RETURNS -- coverage (n400->2400) gave +0.046 but the ep4->5 step gave only +0.0079, so more epochs on k=2 will not move the needle much. The distinctive ItNet lever not yet tried is UNROLL DEPTH: itnet_k controls how many denoiser+DC iterations refine the recon; k=2 may under-enforce sinogram data-consistency on this 128-view breast geometry. (3) ONE KNOB: itnet_k 2 -> 3 (an ARCHITECTURE change, explicitly allowed). epochs 5 -> 3 funds the ~1.5x per-forward cost of the extra unroll while holding train_n=2400 so the coverage gain is preserved. (4) HYPOTHESIS: a 3rd unroll step lifts hr above 0.8277 because more DC iterations better reconcile the recon with the measured sinogram (sharper edges, fewer sparse-view streaks) than the k=2 net could at any epoch count. FALSIFIER (NUMBERS): if hr <= 0.8277 at k=3/ep3, then either 3 epochs is too few to train the deeper unrolled loop (optimization-limited -> iter-5 keeps k=3 but adds epochs by trading train_n down) OR k=2 already saturates DC on this geometry (-> iter-5 pivots to capacity, unet_c 16->24). (5) BUDGET (HARD 20min=1200s): iter-3 (k2/ep5/n2400) = 877.4s with ~4.6 min headroom. Train work ~ epochs*k*train_n: iter-3 = 5*2*2400 = 24000 units; iter-4 = 3*3*2400 = 21600 units = 0.9x iter-3 train. The k=3 VAL forward is ~1.5x iter-3's k=2 val, but val is a small share of the 877s (200 cases, one forward each). Net predicted elapsed ~= 0.9*train + 1.5*val + fixed ~= 850-950s = 14-16min < 1200s. max_train_s=1000 fences the TRAIN phase alone so a runaway cannot eat val+figure; a finite val+figure always land inside the 30-min sbatch wall. train_n=2400 (<= OOM-safe cap; whole-train FBP precompute fits >=24GB nodes). val=200 distinct val_truth.h5 cases, 256px inscribed-circle FOV (breast default). (6) do NOT return control mid-campaign; gate on iter-4 numeric-headroom obs via iter_wait.sh v3 sentinel then dispatch iter-5.", "agent": "itnet_v3-claude-agentic", "campaign": "search-20260703-01", "cfg_full": {"alpha_init": 0.0025734, "batch_size": 2, "epochs": 3, "grad_clip": 1.0, "itnet_k": 3, "lr": 0.00021567, "max_train_s": 1000, "rationale": "iter-4 (breast-ct redo, search-20260703-01). ONE KNOB (ARCHITECTURE): itnet_k 2 -> 3 (one MORE unrolled denoiser+data-consistency step), with epochs traded DOWN 5 -> 3 to fund the extra unroll pass inside the HARD 20-min wall. All else = iter-3 exactly (unet_c=16, alpha_init=0.0025734, lr=2.16e-4, batch_size=2, train_n=2400, val_n=200, grad_clip=1.0, seed=42). SIX-BOX (NUMBERS): (1) iter-1 (n400/ep12/k2): hr 0.7737. iter-2 (n2400/ep4/k2): hr 0.8198. iter-3 (n2400/ep5/k2): hr 0.8277, SSIM 0.9977, PSNR 51.60, RMSE 8.99e-4, elapsed 877.4s=14.6min, params 3.699M. (2) FAILURE MODE: the EPOCHS lever is now in DIMINISHING RETURNS -- coverage (n400->2400) gave +0.046 but the ep4->5 step gave only +0.0079, so more epochs on k=2 will not move the needle much. The distinctive ItNet lever not yet tried is UNROLL DEPTH: itnet_k controls how many denoiser+DC iterations refine the recon; k=2 may under-enforce sinogram data-consistency on this 128-view breast geometry. (3) ONE KNOB: itnet_k 2 -> 3 (an ARCHITECTURE change, explicitly allowed). epochs 5 -> 3 funds the ~1.5x per-forward cost of the extra unroll while holding train_n=2400 so the coverage gain is preserved. (4) HYPOTHESIS: a 3rd unroll step lifts hr above 0.8277 because more DC iterations better reconcile the recon with the measured sinogram (sharper edges, fewer sparse-view streaks) than the k=2 net could at any epoch count. FALSIFIER (NUMBERS): if hr <= 0.8277 at k=3/ep3, then either 3 epochs is too few to train the deeper unrolled loop (optimization-limited -> iter-5 keeps k=3 but adds epochs by trading train_n down) OR k=2 already saturates DC on this geometry (-> iter-5 pivots to capacity, unet_c 16->24). (5) BUDGET (HARD 20min=1200s): iter-3 (k2/ep5/n2400) = 877.4s with ~4.6 min headroom. Train work ~ epochs*k*train_n: iter-3 = 5*2*2400 = 24000 units; iter-4 = 3*3*2400 = 21600 units = 0.9x iter-3 train. The k=3 VAL forward is ~1.5x iter-3's k=2 val, but val is a small share of the 877s (200 cases, one forward each). Net predicted elapsed ~= 0.9*train + 1.5*val + fixed ~= 850-950s = 14-16min < 1200s. max_train_s=1000 fences the TRAIN phase alone so a runaway cannot eat val+figure; a finite val+figure always land inside the 30-min sbatch wall. train_n=2400 (<= OOM-safe cap; whole-train FBP precompute fits >=24GB nodes). val=200 distinct val_truth.h5 cases, 256px inscribed-circle FOV (breast default). (6) do NOT return control mid-campaign; gate on iter-4 numeric-headroom obs via iter_wait.sh v3 sentinel then dispatch iter-5.", "seed": 42, "train_n": 2400, "unet_c": 16, "val_n": 200}, "challenge": "breast_ct", "change_class": "architecture", "git_commit": "1176d9f5", "images": {"comparison": "runs/breast-ct-claude-agentic-itnet-v3-search-20260703-01/iterations/iter-0004/comparison.png", "test_showcase": null, "valtest_showcase": null}, "iter": 4, "kept": true, "metrics": {"headroom": 0.7946376001119526, "headroom_std": 0.016556655174357324, "val_psnr": 50.07377624511719, "val_psnr_std": 1.238357553501948, "val_rmse": 0.0010708178160712123, "val_rmse_std": 0.00015163746832719466, "val_ssim": 0.9962430596351624, "val_ssim_std": 0.0009494542005676871}, "model": "claude-opus-4-8-1m", "obs_path": "breast-ct-claude-agentic-itnet-v3-search-20260703-01/iterations/iter-0004/observation.json", "obs_sha1": "d7cf689e16aed6b16f611ac8b54a9011a428f227", "params_M": 3.698994, "params_source": "observation", "rationale": "itnet_v3-claude-agentic: itnet_k=3, unet_c=16, alpha_init=0.0025734, lr=0.00021567, epochs=3, batch_size=2, train_n=2400, val_n=200, grad_clip=1.0, max_train_s=1000, seed=42, rationale=iter-4 (breast-ct redo, search-20260703-01). ONE KNOB (ARCHITECTURE): itnet_k 2 -> 3 (one MORE unrolled denoiser+data-consistency step), with epochs traded DOWN 5 -> 3 to fund the extra unroll pass inside the HARD 20-min wall. All else = iter-3 exactly (unet_c=16, alpha_init=0.0025734, lr=2.16e-4, batch_size=2, train_n=2400, val_n=200, grad_clip=1.0, seed=42). SIX-BOX (NUMBERS): (1) iter-1 (n400/ep12/k2): hr 0.7737. iter-2 (n2400/ep4/k2): hr 0.8198. iter-3 (n2400/ep5/k2): hr 0.8277, SSIM 0.9977, PSNR 51.60, RMSE 8.99e-4, elapsed 877.4s=14.6min, params 3.699M. (2) FAILURE MODE: the EPOCHS lever is now in DIMINISHING RETURNS -- coverage (n400->2400) gave +0.046 but the ep4->5 step gave only +0.0079, so more epochs on k=2 will not move the needle much. The distinctive ItNet lever not yet tried is UNROLL DEPTH: itnet_k controls how many denoiser+DC iterations refine the recon; k=2 may under-enforce sinogram data-consistency on this 128-view breast geometry. (3) ONE KNOB: itnet_k 2 -> 3 (an ARCHITECTURE change, explicitly allowed). epochs 5 -> 3 funds the ~1.5x per-forward cost of the extra unroll while holding train_n=2400 so the coverage gain is preserved. (4) HYPOTHESIS: a 3rd unroll step lifts hr above 0.8277 because more DC iterations better reconcile the recon with the measured sinogram (sharper edges, fewer sparse-view streaks) than the k=2 net could at any epoch count. FALSIFIER (NUMBERS): if hr <= 0.8277 at k=3/ep3, then either 3 epochs is too few to train the deeper unrolled loop (optimization-limited -> iter-5 keeps k=3 but adds epochs by trading train_n down) OR k=2 already saturates DC on this geometry (-> iter-5 pivots to capacity, unet_c 16->24). (5) BUDGET (HARD 20min=1200s): iter-3 (k2/ep5/n2400) = 877.4s with ~4.6 min headroom. Train work ~ epochs*k*train_n: iter-3 = 5*2*2400 = 24000 units; iter-4 = 3*3*2400 = 21600 units = 0.9x iter-3 train. The k=3 VAL forward is ~1.5x iter-3's k=2 val, but val is a small share of the 877s (200 cases, one forward each). Net predicted elapsed ~= 0.9*train + 1.5*val + fixed ~= 850-950s = 14-16min < 1200s. max_train_s=1000 fences the TRAIN phase alone so a runaway cannot eat val+figure; a finite val+figure always land inside the 30-min sbatch wall. train_n=2400 (<= OOM-safe cap; whole-train FBP precompute fits >=24GB nodes). val=200 distinct val_truth.h5 cases, 256px inscribed-circle FOV (breast default). (6) do NOT return control mid-campaign; gate on iter-4 numeric-headroom obs via iter_wait.sh v3 sentinel then dispatch iter-5.", "run_id": "breast-ct-claude-agentic-itnet-v3-search-20260703-01", "runtime": {"elapsed_s": 805.8369681835175}, "schema_version": 3, "solver_key": "itnet-v3", "solver_name": "ITNet v3", "split": {"train_n": 400, "val_n": 200}, "status": "keep", "ts": "2026-07-04T08:38:21Z"}
{"advice_for_others": "itnet_v3-claude-agentic: itnet_k=2, unet_c=24, alpha_init=0.0025734, lr=0.00021567, epochs=3, batch_size=2, train_n=2400, val_n=200, grad_clip=1.0, max_train_s=1050, seed=42, rationale=iter-5 (breast-ct redo, search-20260703-01). START FROM iter-3 BEST (k2/n2400/ep5, hr 0.8277), NOT iter-4's regressed k3. ONE KNOB (ARCHITECTURE): unet_c 16 -> 24 (denoiser CAPACITY), with epochs traded DOWN 5 -> 3 to fund the bigger net inside the HARD 20-min wall. All else = iter-3 best exactly (itnet_k=2, alpha_init=0.0025734, lr=2.16e-4, batch_size=2, train_n=2400, val_n=200, grad_clip=1.0, seed=42). SIX-BOX (NUMBERS): (1) iter-1 (n400/ep12/k2/c16): 0.7737. iter-2 (n2400/ep4/k2/c16): 0.8198. iter-3 (n2400/ep5/k2/c16): 0.8277 = BEST, elapsed 877.4s. iter-4 (n2400/ep3/k3/c16): 0.7946 = REGRESSED -0.033. (2) FAILURE MODE: iter-4's k=2->3 REGRESSED, but it confounded k-up WITH epochs-down (5->3) -> the deeper unrolled loop was under-trained at 3 epochs. Rather than chase k=3 with more epochs (would need train_n cut, muddying the coverage gain), REVERT to the confirmed-good k=2 and test the single strongest UNTRIED lever: denoiser CAPACITY. My v3 runs unet_c=16 (3.7M params); the sibling itnet_v2 breast champion used unet_c=96 (~0.871), so capacity is clearly the dominant unexplored axis on this dataset. (3) ONE KNOB vs iter-3 best: unet_c 16 -> 24 (params 3.70M -> ~8.3M, conv FLOPs x2.25). epochs 5 -> 3 funds the bigger net; k held at 2 (confirmed good), train_n held at 2400 (coverage locked). itnet_v3 is END-TO-END unrolled so added denoiser capacity is trained against the full recon objective. (4) HYPOTHESIS: c=24 lifts hr above 0.8277 because the c=16 denoiser is representationally saturated (ep4->5 gave only +0.008) and more channels capture the finer breast-tissue structure. FALSIFIER (NUMBERS): if hr <= 0.8277 at c24/ep3, then 3 epochs is too few to train the bigger net (iter-6 trades train_n down for epochs at c24) OR c=16 already suffices (iter-6 reverts to c16/ep5 champion and pivots to lr/alpha). (5) BUDGET (HARD 20min=1200s): iter-3 (c16/ep5/k2/n2400)=877.4s, ~5min headroom. Raising c 16->24 scales UNet conv FLOPs x2.25 but the k=2 DC projector fwd+adj is FLAT in c and is a large share of per-forward, so per-epoch scales ~1.5-1.7x, NOT 2.25x. epochs 5->3 = 0.6x. Net train ~= 0.6*1.6 = 0.96x iter-3 train; val (200 fwd) also ~1.5x its small share. Predicted elapsed ~= 880-980s = 15-16min < 1200s. max_train_s=1050 fences the TRAIN phase; a finite val+figure land inside the 30-min sbatch wall. train_n=2400 (<= OOM-safe cap; c=24 whole-train FBP precompute is unchanged in c and fits >=24GB nodes). val=200 distinct val_truth.h5 cases, 256px inscribed-circle FOV (breast default). (6) do NOT return control mid-campaign; gate on iter-5 numeric-headroom obs via iter_wait.sh v3 then dispatch iter-6.", "agent": "itnet_v3-claude-agentic", "campaign": "search-20260703-01", "cfg_full": {"alpha_init": 0.0025734, "batch_size": 2, "epochs": 3, "grad_clip": 1.0, "itnet_k": 2, "lr": 0.00021567, "max_train_s": 1050, "rationale": "iter-5 (breast-ct redo, search-20260703-01). START FROM iter-3 BEST (k2/n2400/ep5, hr 0.8277), NOT iter-4's regressed k3. ONE KNOB (ARCHITECTURE): unet_c 16 -> 24 (denoiser CAPACITY), with epochs traded DOWN 5 -> 3 to fund the bigger net inside the HARD 20-min wall. All else = iter-3 best exactly (itnet_k=2, alpha_init=0.0025734, lr=2.16e-4, batch_size=2, train_n=2400, val_n=200, grad_clip=1.0, seed=42). SIX-BOX (NUMBERS): (1) iter-1 (n400/ep12/k2/c16): 0.7737. iter-2 (n2400/ep4/k2/c16): 0.8198. iter-3 (n2400/ep5/k2/c16): 0.8277 = BEST, elapsed 877.4s. iter-4 (n2400/ep3/k3/c16): 0.7946 = REGRESSED -0.033. (2) FAILURE MODE: iter-4's k=2->3 REGRESSED, but it confounded k-up WITH epochs-down (5->3) -> the deeper unrolled loop was under-trained at 3 epochs. Rather than chase k=3 with more epochs (would need train_n cut, muddying the coverage gain), REVERT to the confirmed-good k=2 and test the single strongest UNTRIED lever: denoiser CAPACITY. My v3 runs unet_c=16 (3.7M params); the sibling itnet_v2 breast champion used unet_c=96 (~0.871), so capacity is clearly the dominant unexplored axis on this dataset. (3) ONE KNOB vs iter-3 best: unet_c 16 -> 24 (params 3.70M -> ~8.3M, conv FLOPs x2.25). epochs 5 -> 3 funds the bigger net; k held at 2 (confirmed good), train_n held at 2400 (coverage locked). itnet_v3 is END-TO-END unrolled so added denoiser capacity is trained against the full recon objective. (4) HYPOTHESIS: c=24 lifts hr above 0.8277 because the c=16 denoiser is representationally saturated (ep4->5 gave only +0.008) and more channels capture the finer breast-tissue structure. FALSIFIER (NUMBERS): if hr <= 0.8277 at c24/ep3, then 3 epochs is too few to train the bigger net (iter-6 trades train_n down for epochs at c24) OR c=16 already suffices (iter-6 reverts to c16/ep5 champion and pivots to lr/alpha). (5) BUDGET (HARD 20min=1200s): iter-3 (c16/ep5/k2/n2400)=877.4s, ~5min headroom. Raising c 16->24 scales UNet conv FLOPs x2.25 but the k=2 DC projector fwd+adj is FLAT in c and is a large share of per-forward, so per-epoch scales ~1.5-1.7x, NOT 2.25x. epochs 5->3 = 0.6x. Net train ~= 0.6*1.6 = 0.96x iter-3 train; val (200 fwd) also ~1.5x its small share. Predicted elapsed ~= 880-980s = 15-16min < 1200s. max_train_s=1050 fences the TRAIN phase; a finite val+figure land inside the 30-min sbatch wall. train_n=2400 (<= OOM-safe cap; c=24 whole-train FBP precompute is unchanged in c and fits >=24GB nodes). val=200 distinct val_truth.h5 cases, 256px inscribed-circle FOV (breast default). (6) do NOT return control mid-campaign; gate on iter-5 numeric-headroom obs via iter_wait.sh v3 then dispatch iter-6.", "seed": 42, "train_n": 2400, "unet_c": 24, "val_n": 200}, "challenge": "breast_ct", "change_class": "architecture", "git_commit": "671da566", "images": {"comparison": "runs/breast-ct-claude-agentic-itnet-v3-search-20260703-01/iterations/iter-0005/comparison.png", "test_showcase": null, "valtest_showcase": null}, "iter": 5, "kept": true, "metrics": {"headroom": 0.8268991543626043, "headroom_std": 0.01667093966009502, "val_psnr": 51.55821228027344, "val_psnr_std": 1.3990727851906282, "val_rmse": 0.0009025969193316996, "val_rmse_std": 0.00014045800919200126, "val_ssim": 0.9977295398712158, "val_ssim_std": 0.0006763446797541814}, "model": "claude-opus-4-8-1m", "obs_path": "breast-ct-claude-agentic-itnet-v3-search-20260703-01/iterations/iter-0005/observation.json", "obs_sha1": "5974a0091c87ee02dd92879237fff16bd4c853f1", "params_M": 8.317706, "params_source": "observation", "rationale": "itnet_v3-claude-agentic: itnet_k=2, unet_c=24, alpha_init=0.0025734, lr=0.00021567, epochs=3, batch_size=2, train_n=2400, val_n=200, grad_clip=1.0, max_train_s=1050, seed=42, rationale=iter-5 (breast-ct redo, search-20260703-01). START FROM iter-3 BEST (k2/n2400/ep5, hr 0.8277), NOT iter-4's regressed k3. ONE KNOB (ARCHITECTURE): unet_c 16 -> 24 (denoiser CAPACITY), with epochs traded DOWN 5 -> 3 to fund the bigger net inside the HARD 20-min wall. All else = iter-3 best exactly (itnet_k=2, alpha_init=0.0025734, lr=2.16e-4, batch_size=2, train_n=2400, val_n=200, grad_clip=1.0, seed=42). SIX-BOX (NUMBERS): (1) iter-1 (n400/ep12/k2/c16): 0.7737. iter-2 (n2400/ep4/k2/c16): 0.8198. iter-3 (n2400/ep5/k2/c16): 0.8277 = BEST, elapsed 877.4s. iter-4 (n2400/ep3/k3/c16): 0.7946 = REGRESSED -0.033. (2) FAILURE MODE: iter-4's k=2->3 REGRESSED, but it confounded k-up WITH epochs-down (5->3) -> the deeper unrolled loop was under-trained at 3 epochs. Rather than chase k=3 with more epochs (would need train_n cut, muddying the coverage gain), REVERT to the confirmed-good k=2 and test the single strongest UNTRIED lever: denoiser CAPACITY. My v3 runs unet_c=16 (3.7M params); the sibling itnet_v2 breast champion used unet_c=96 (~0.871), so capacity is clearly the dominant unexplored axis on this dataset. (3) ONE KNOB vs iter-3 best: unet_c 16 -> 24 (params 3.70M -> ~8.3M, conv FLOPs x2.25). epochs 5 -> 3 funds the bigger net; k held at 2 (confirmed good), train_n held at 2400 (coverage locked). itnet_v3 is END-TO-END unrolled so added denoiser capacity is trained against the full recon objective. (4) HYPOTHESIS: c=24 lifts hr above 0.8277 because the c=16 denoiser is representationally saturated (ep4->5 gave only +0.008) and more channels capture the finer breast-tissue structure. FALSIFIER (NUMBERS): if hr <= 0.8277 at c24/ep3, then 3 epochs is too few to train the bigger net (iter-6 trades train_n down for epochs at c24) OR c=16 already suffices (iter-6 reverts to c16/ep5 champion and pivots to lr/alpha). (5) BUDGET (HARD 20min=1200s): iter-3 (c16/ep5/k2/n2400)=877.4s, ~5min headroom. Raising c 16->24 scales UNet conv FLOPs x2.25 but the k=2 DC projector fwd+adj is FLAT in c and is a large share of per-forward, so per-epoch scales ~1.5-1.7x, NOT 2.25x. epochs 5->3 = 0.6x. Net train ~= 0.6*1.6 = 0.96x iter-3 train; val (200 fwd) also ~1.5x its small share. Predicted elapsed ~= 880-980s = 15-16min < 1200s. max_train_s=1050 fences the TRAIN phase; a finite val+figure land inside the 30-min sbatch wall. train_n=2400 (<= OOM-safe cap; c=24 whole-train FBP precompute is unchanged in c and fits >=24GB nodes). val=200 distinct val_truth.h5 cases, 256px inscribed-circle FOV (breast default). (6) do NOT return control mid-campaign; gate on iter-5 numeric-headroom obs via iter_wait.sh v3 then dispatch iter-6.", "run_id": "breast-ct-claude-agentic-itnet-v3-search-20260703-01", "runtime": {"elapsed_s": 745.0279581546783}, "schema_version": 3, "solver_key": "itnet-v3", "solver_name": "ITNet v3", "split": {"train_n": 400, "val_n": 200}, "status": "keep", "ts": "2026-07-04T10:24:23Z"}
