{"advice_for_others": "fastdiff_flow_pixel_unconstrained-claude-agentic: image_size=512, pixel_spacing=0.3516, n_angles=128, n_det=1024, det_spacing=0.35754, sod=500.0, sdd=1000.0, display_min=0.0, display_max=0.5, train_n=400, val_n=200, noise_i0=100000.0, noise_sigma_e=10.0, seed=42, fd_recon_ckpt=/cluster/maier/Agent4CT/checkpoints/fast_diffusion_pixel_breast.pt, fd_recon_steps=8, fd_recon_init=fbp, fd_recon_init_t=0.2, fd_recon_eta=1.0, fd_recon_dc=0, fd_recon_dc_n_cg=5, fd_recon_dc_relax=0.5, rationale=iter-3: DC-off breast-prior. ONE KNOB init_t 0.4->0.2. TREND: iter-1 (init_t0.7) PSNR19.0/RMSE3.8e-2; iter-2 (init_t0.4) PSNR24.6/RMSE2.0e-2 - monotonic fidelity gain as init_t drops (less injected noise, sampler stays nearer the measured FBP). Both hr=0 (sparse-FBP baseline PSNR36.3/RMSE5.2e-3 is a very strong bar for a DC-free prior sampler). HYPOTHESIS: init_t=0.2 pushes PSNR further toward the FBP baseline because the DC-free sampler reduces to a light prior-denoise of the FBP init; tests whether the breast prior ALONE can approach (not just trail) the baseline. If PSNR keeps rising monotonically, the prior contributes fidelity only insofar as it preserves the FBP - the DC step (absent here) is what would let it EXCEED baseline.", "agent": "fastdiff_flow_pixel_unconstrained-claude-agentic", "campaign": "search-20260703-01", "cfg_full": {"det_spacing": 0.35754, "display_max": 0.5, "display_min": 0.0, "fd_recon_ckpt": "/cluster/maier/Agent4CT/checkpoints/fast_diffusion_pixel_breast.pt", "fd_recon_dc": 0, "fd_recon_dc_n_cg": 5, "fd_recon_dc_relax": 0.5, "fd_recon_eta": 1.0, "fd_recon_init": "fbp", "fd_recon_init_t": 0.2, "fd_recon_steps": 8, "image_size": 512, "n_angles": 128, "n_det": 1024, "noise_i0": 100000.0, "noise_sigma_e": 10.0, "pixel_spacing": 0.3516, "rationale": "iter-3: DC-off breast-prior. ONE KNOB init_t 0.4->0.2. TREND: iter-1 (init_t0.7) PSNR19.0/RMSE3.8e-2; iter-2 (init_t0.4) PSNR24.6/RMSE2.0e-2 - monotonic fidelity gain as init_t drops (less injected noise, sampler stays nearer the measured FBP). Both hr=0 (sparse-FBP baseline PSNR36.3/RMSE5.2e-3 is a very strong bar for a DC-free prior sampler). HYPOTHESIS: init_t=0.2 pushes PSNR further toward the FBP baseline because the DC-free sampler reduces to a light prior-denoise of the FBP init; tests whether the breast prior ALONE can approach (not just trail) the baseline. If PSNR keeps rising monotonically, the prior contributes fidelity only insofar as it preserves the FBP - the DC step (absent here) is what would let it EXCEED baseline.", "sdd": 1000.0, "seed": 42, "sod": 500.0, "train_n": 400, "val_n": 200}, "challenge": "breast_ct", "change_class": "architecture", "git_commit": "671da566", "images": {"comparison": "runs/breast-ct-claude-agentic-fastdiff-flow-pixel-unconstrained-search-20260703-01/iterations/iter-0003/comparison.png", "test_showcase": null, "valtest_showcase": null}, "iter": 3, "kept": false, "metrics": {"headroom": 0.0, "headroom_std": 0.0, "val_psnr": 24.176288604736328, "val_psnr_std": 0.4886163824489181, "val_rmse": 0.021114952862262726, "val_rmse_std": 0.001136230706147959, "val_ssim": 0.572429358959198, "val_ssim_std": 0.0059799039991399105}, "model": "claude-opus-4-8-1m", "obs_path": "breast-ct-claude-agentic-fastdiff-flow-pixel-unconstrained-search-20260703-01/iterations/iter-0003/observation.json", "obs_sha1": "d3ce31366cf69a878e27d78c47a47574a4c928f1", "params_M": 3.822787, "params_source": "observation", "rationale": "fastdiff_flow_pixel_unconstrained-claude-agentic: image_size=512, pixel_spacing=0.3516, n_angles=128, n_det=1024, det_spacing=0.35754, sod=500.0, sdd=1000.0, display_min=0.0, display_max=0.5, train_n=400, val_n=200, noise_i0=100000.0, noise_sigma_e=10.0, seed=42, fd_recon_ckpt=/cluster/maier/Agent4CT/checkpoints/fast_diffusion_pixel_breast.pt, fd_recon_steps=8, fd_recon_init=fbp, fd_recon_init_t=0.2, fd_recon_eta=1.0, fd_recon_dc=0, fd_recon_dc_n_cg=5, fd_recon_dc_relax=0.5, rationale=iter-3: DC-off breast-prior. ONE KNOB init_t 0.4->0.2. TREND: iter-1 (init_t0.7) PSNR19.0/RMSE3.8e-2; iter-2 (init_t0.4) PSNR24.6/RMSE2.0e-2 - monotonic fidelity gain as init_t drops (less injected noise, sampler stays nearer the measured FBP). Both hr=0 (sparse-FBP baseline PSNR36.3/RMSE5.2e-3 is a very strong bar for a DC-free prior sampler). HYPOTHESIS: init_t=0.2 pushes PSNR further toward the FBP baseline because the DC-free sampler reduces to a light prior-denoise of the FBP init; tests whether the breast prior ALONE can approach (not just trail) the baseline. If PSNR keeps rising monotonically, the prior contributes fidelity only insofar as it preserves the FBP - the DC step (absent here) is what would let it EXCEED baseline.", "run_id": "breast-ct-claude-agentic-fastdiff-flow-pixel-unconstrained-search-20260703-01", "runtime": {"elapsed_s": 150.27251076698303}, "schema_version": 3, "solver_key": "fastdiff-flow-pixel-unconstrained", "solver_name": "Fast-diffusion flow (pixel, unconstrained)", "split": {"train_n": 3600, "val_n": 200}, "status": "discard", "ts": "2026-07-06T20:19:46Z"}
{"advice_for_others": "fastdiff_flow_pixel_unconstrained-claude-agentic: image_size=512, pixel_spacing=0.3516, n_angles=128, n_det=1024, det_spacing=0.35754, sod=500.0, sdd=1000.0, display_min=0.0, display_max=0.5, train_n=400, val_n=200, noise_i0=100000.0, noise_sigma_e=10.0, seed=42, fd_recon_ckpt=/cluster/maier/Agent4CT/checkpoints/fast_diffusion_pixel_breast.pt, fd_recon_steps=8, fd_recon_init=fbp, fd_recon_init_t=0.4, fd_recon_eta=3.0, fd_recon_dc=0, fd_recon_dc_n_cg=5, fd_recon_dc_relax=0.5, rationale=iter-4: DC-off breast-prior. Fix init_t=0.4 (iter-2 sweet spot: PSNR24.6, best so far). ONE KNOB eta 1.0->3.0 (DPS guidance scale). TREND: init_t sweep plateaued - iter-2 init_t0.4 PSNR24.6 > iter-3 init_t0.2 PSNR24.2, so ~0.4 is the init_t optimum. FAILURE MODE: with DC off, the ONLY data-fidelity term is the soft DPS gradient (eta/||r||)*grad; at eta=1.0 it under-corrects, leaving the recon 11.7dB below the FBP baseline. HYPOTHESIS: raising eta to 3.0 strengthens the sinogram-consistency pull each Euler step -> PSNR/RMSE improve toward baseline. This directly tests whether cranking the SOFT guidance can substitute for the absent HARD CG DC projection (the constrained sibling's anchor). Expect partial recovery but NOT reaching baseline - that residual gap = the value of the DC step.", "agent": "fastdiff_flow_pixel_unconstrained-claude-agentic", "campaign": "search-20260703-01", "cfg_full": {"det_spacing": 0.35754, "display_max": 0.5, "display_min": 0.0, "fd_recon_ckpt": "/cluster/maier/Agent4CT/checkpoints/fast_diffusion_pixel_breast.pt", "fd_recon_dc": 0, "fd_recon_dc_n_cg": 5, "fd_recon_dc_relax": 0.5, "fd_recon_eta": 3.0, "fd_recon_init": "fbp", "fd_recon_init_t": 0.4, "fd_recon_steps": 8, "image_size": 512, "n_angles": 128, "n_det": 1024, "noise_i0": 100000.0, "noise_sigma_e": 10.0, "pixel_spacing": 0.3516, "rationale": "iter-4: DC-off breast-prior. Fix init_t=0.4 (iter-2 sweet spot: PSNR24.6, best so far). ONE KNOB eta 1.0->3.0 (DPS guidance scale). TREND: init_t sweep plateaued - iter-2 init_t0.4 PSNR24.6 > iter-3 init_t0.2 PSNR24.2, so ~0.4 is the init_t optimum. FAILURE MODE: with DC off, the ONLY data-fidelity term is the soft DPS gradient (eta/||r||)*grad; at eta=1.0 it under-corrects, leaving the recon 11.7dB below the FBP baseline. HYPOTHESIS: raising eta to 3.0 strengthens the sinogram-consistency pull each Euler step -> PSNR/RMSE improve toward baseline. This directly tests whether cranking the SOFT guidance can substitute for the absent HARD CG DC projection (the constrained sibling's anchor). Expect partial recovery but NOT reaching baseline - that residual gap = the value of the DC step.", "sdd": 1000.0, "seed": 42, "sod": 500.0, "train_n": 400, "val_n": 200}, "challenge": "breast_ct", "change_class": "architecture", "git_commit": "671da566", "images": {"comparison": "runs/breast-ct-claude-agentic-fastdiff-flow-pixel-unconstrained-search-20260703-01/iterations/iter-0004/comparison.png", "test_showcase": null, "valtest_showcase": null}, "iter": 4, "kept": false, "metrics": {"headroom": 0.0, "headroom_std": 0.0, "val_psnr": 12.757911682128906, "val_psnr_std": 0.3020757262999445, "val_rmse": 0.07861562073230743, "val_rmse_std": 0.002233063094152182, "val_ssim": 0.4060579538345337, "val_ssim_std": 0.009863912074493148}, "model": "claude-opus-4-8-1m", "obs_path": "breast-ct-claude-agentic-fastdiff-flow-pixel-unconstrained-search-20260703-01/iterations/iter-0004/observation.json", "obs_sha1": "37cf9d20c4fa61154d9fc902b9d48125b38673ae", "params_M": 3.822787, "params_source": "observation", "rationale": "fastdiff_flow_pixel_unconstrained-claude-agentic: image_size=512, pixel_spacing=0.3516, n_angles=128, n_det=1024, det_spacing=0.35754, sod=500.0, sdd=1000.0, display_min=0.0, display_max=0.5, train_n=400, val_n=200, noise_i0=100000.0, noise_sigma_e=10.0, seed=42, fd_recon_ckpt=/cluster/maier/Agent4CT/checkpoints/fast_diffusion_pixel_breast.pt, fd_recon_steps=8, fd_recon_init=fbp, fd_recon_init_t=0.4, fd_recon_eta=3.0, fd_recon_dc=0, fd_recon_dc_n_cg=5, fd_recon_dc_relax=0.5, rationale=iter-4: DC-off breast-prior. Fix init_t=0.4 (iter-2 sweet spot: PSNR24.6, best so far). ONE KNOB eta 1.0->3.0 (DPS guidance scale). TREND: init_t sweep plateaued - iter-2 init_t0.4 PSNR24.6 > iter-3 init_t0.2 PSNR24.2, so ~0.4 is the init_t optimum. FAILURE MODE: with DC off, the ONLY data-fidelity term is the soft DPS gradient (eta/||r||)*grad; at eta=1.0 it under-corrects, leaving the recon 11.7dB below the FBP baseline. HYPOTHESIS: raising eta to 3.0 strengthens the sinogram-consistency pull each Euler step -> PSNR/RMSE improve toward baseline. This directly tests whether cranking the SOFT guidance can substitute for the absent HARD CG DC projection (the constrained sibling's anchor). Expect partial recovery but NOT reaching baseline - that residual gap = the value of the DC step.", "run_id": "breast-ct-claude-agentic-fastdiff-flow-pixel-unconstrained-search-20260703-01", "runtime": {"elapsed_s": 127.6432478427887}, "schema_version": 3, "solver_key": "fastdiff-flow-pixel-unconstrained", "solver_name": "Fast-diffusion flow (pixel, unconstrained)", "split": {"train_n": 3600, "val_n": 200}, "status": "discard", "ts": "2026-07-06T20:22:26Z"}
{"advice_for_others": "fastdiff_flow_pixel_unconstrained-claude-agentic: image_size=512, pixel_spacing=0.3516, n_angles=128, n_det=1024, det_spacing=0.35754, sod=500.0, sdd=1000.0, display_min=0.0, display_max=0.5, train_n=400, val_n=200, noise_i0=100000.0, noise_sigma_e=10.0, seed=42, fd_recon_ckpt=/cluster/maier/Agent4CT/checkpoints/fast_diffusion_pixel_breast.pt, fd_recon_steps=8, fd_recon_init=fbp, fd_recon_init_t=0.4, fd_recon_eta=0.5, fd_recon_dc=0, fd_recon_dc_n_cg=5, fd_recon_dc_relax=0.5, rationale=iter-5: DC-off breast-prior. Fix init_t=0.4 (best). ONE KNOB eta 1.0->0.5. FAILURE MODE at iter-4: eta=3.0 DESTABILIZED the sampler (PSNR crashed 24.6->12.8, RMSE 2.0e-2->7.9e-2) - the adaptive DPS step (eta/||r||)*grad OVERSHOOTS at large eta with no hard-DC to re-anchor => divergence. So cranking soft guidance does NOT substitute for the hard CG DC projection. HYPOTHESIS: a GENTLER eta=0.5 is more stable and may edge past the eta=1.0 result (PSNR24.6) by taking smaller, non-overshooting fidelity steps. Brackets the eta optimum around 1.0 (1.0 vs 0.5 vs the failed 3.0).", "agent": "fastdiff_flow_pixel_unconstrained-claude-agentic", "campaign": "search-20260703-01", "cfg_full": {"det_spacing": 0.35754, "display_max": 0.5, "display_min": 0.0, "fd_recon_ckpt": "/cluster/maier/Agent4CT/checkpoints/fast_diffusion_pixel_breast.pt", "fd_recon_dc": 0, "fd_recon_dc_n_cg": 5, "fd_recon_dc_relax": 0.5, "fd_recon_eta": 0.5, "fd_recon_init": "fbp", "fd_recon_init_t": 0.4, "fd_recon_steps": 8, "image_size": 512, "n_angles": 128, "n_det": 1024, "noise_i0": 100000.0, "noise_sigma_e": 10.0, "pixel_spacing": 0.3516, "rationale": "iter-5: DC-off breast-prior. Fix init_t=0.4 (best). ONE KNOB eta 1.0->0.5. FAILURE MODE at iter-4: eta=3.0 DESTABILIZED the sampler (PSNR crashed 24.6->12.8, RMSE 2.0e-2->7.9e-2) - the adaptive DPS step (eta/||r||)*grad OVERSHOOTS at large eta with no hard-DC to re-anchor => divergence. So cranking soft guidance does NOT substitute for the hard CG DC projection. HYPOTHESIS: a GENTLER eta=0.5 is more stable and may edge past the eta=1.0 result (PSNR24.6) by taking smaller, non-overshooting fidelity steps. Brackets the eta optimum around 1.0 (1.0 vs 0.5 vs the failed 3.0).", "sdd": 1000.0, "seed": 42, "sod": 500.0, "train_n": 400, "val_n": 200}, "challenge": "breast_ct", "change_class": "architecture", "git_commit": "671da566", "images": {"comparison": "runs/breast-ct-claude-agentic-fastdiff-flow-pixel-unconstrained-search-20260703-01/iterations/iter-0005/comparison.png", "test_showcase": null, "valtest_showcase": null}, "iter": 5, "kept": false, "metrics": {"headroom": 0.0, "headroom_std": 0.0, "val_psnr": 26.950355529785156, "val_psnr_std": 0.852057949210922, "val_rmse": 0.015342170372605324, "val_rmse_std": 0.0014777161864004775, "val_ssim": 0.7217198014259338, "val_ssim_std": 0.01090533820075039}, "model": "claude-opus-4-8-1m", "obs_path": "breast-ct-claude-agentic-fastdiff-flow-pixel-unconstrained-search-20260703-01/iterations/iter-0005/observation.json", "obs_sha1": "9555b2b2ad7bbfc995b2d0e57f8388ae677bbf81", "params_M": 3.822787, "params_source": "observation", "rationale": "fastdiff_flow_pixel_unconstrained-claude-agentic: image_size=512, pixel_spacing=0.3516, n_angles=128, n_det=1024, det_spacing=0.35754, sod=500.0, sdd=1000.0, display_min=0.0, display_max=0.5, train_n=400, val_n=200, noise_i0=100000.0, noise_sigma_e=10.0, seed=42, fd_recon_ckpt=/cluster/maier/Agent4CT/checkpoints/fast_diffusion_pixel_breast.pt, fd_recon_steps=8, fd_recon_init=fbp, fd_recon_init_t=0.4, fd_recon_eta=0.5, fd_recon_dc=0, fd_recon_dc_n_cg=5, fd_recon_dc_relax=0.5, rationale=iter-5: DC-off breast-prior. Fix init_t=0.4 (best). ONE KNOB eta 1.0->0.5. FAILURE MODE at iter-4: eta=3.0 DESTABILIZED the sampler (PSNR crashed 24.6->12.8, RMSE 2.0e-2->7.9e-2) - the adaptive DPS step (eta/||r||)*grad OVERSHOOTS at large eta with no hard-DC to re-anchor => divergence. So cranking soft guidance does NOT substitute for the hard CG DC projection. HYPOTHESIS: a GENTLER eta=0.5 is more stable and may edge past the eta=1.0 result (PSNR24.6) by taking smaller, non-overshooting fidelity steps. Brackets the eta optimum around 1.0 (1.0 vs 0.5 vs the failed 3.0).", "run_id": "breast-ct-claude-agentic-fastdiff-flow-pixel-unconstrained-search-20260703-01", "runtime": {"elapsed_s": 130.66302704811096}, "schema_version": 3, "solver_key": "fastdiff-flow-pixel-unconstrained", "solver_name": "Fast-diffusion flow (pixel, unconstrained)", "split": {"train_n": 3600, "val_n": 200}, "status": "discard", "ts": "2026-07-06T20:28:31Z"}
{"advice_for_others": "fastdiff_flow_pixel_unconstrained-claude-agentic: image_size=512, pixel_spacing=0.3516, n_angles=128, n_det=1024, det_spacing=0.35754, sod=500.0, sdd=1000.0, display_min=0.0, display_max=0.5, train_n=400, val_n=200, noise_i0=100000.0, noise_sigma_e=10.0, seed=42, fd_recon_ckpt=/cluster/maier/Agent4CT/checkpoints/fast_diffusion_pixel_breast.pt, fd_recon_steps=8, fd_recon_init=fbp, fd_recon_init_t=0.4, fd_recon_eta=0.2, fd_recon_dc=0, fd_recon_dc_n_cg=5, fd_recon_dc_relax=0.5, rationale=iter-6: DC-off breast-prior. Fix init_t=0.4. ONE KNOB eta 0.5->0.2. TREND (eta at init_t0.4): eta3.0 PSNR12.8 (diverged) > eta1.0 PSNR24.6 > eta0.5 PSNR27.0 (BEST) - monotonic: LOWER eta = more stable = better, because the soft DPS step overshoots when large and there is no hard DC to re-anchor. HYPOTHESIS: eta=0.2 continues the gain (even gentler guidance, FBP-init+prior dominate) -> PSNR edges higher toward the FBP baseline (36.3). Tests whether eta->0 (near pure prior-denoise of the FBP init, minimal measurement pull) is optimal for the DC-free variant.", "agent": "fastdiff_flow_pixel_unconstrained-claude-agentic", "campaign": "search-20260703-01", "cfg_full": {"det_spacing": 0.35754, "display_max": 0.5, "display_min": 0.0, "fd_recon_ckpt": "/cluster/maier/Agent4CT/checkpoints/fast_diffusion_pixel_breast.pt", "fd_recon_dc": 0, "fd_recon_dc_n_cg": 5, "fd_recon_dc_relax": 0.5, "fd_recon_eta": 0.2, "fd_recon_init": "fbp", "fd_recon_init_t": 0.4, "fd_recon_steps": 8, "image_size": 512, "n_angles": 128, "n_det": 1024, "noise_i0": 100000.0, "noise_sigma_e": 10.0, "pixel_spacing": 0.3516, "rationale": "iter-6: DC-off breast-prior. Fix init_t=0.4. ONE KNOB eta 0.5->0.2. TREND (eta at init_t0.4): eta3.0 PSNR12.8 (diverged) > eta1.0 PSNR24.6 > eta0.5 PSNR27.0 (BEST) - monotonic: LOWER eta = more stable = better, because the soft DPS step overshoots when large and there is no hard DC to re-anchor. HYPOTHESIS: eta=0.2 continues the gain (even gentler guidance, FBP-init+prior dominate) -> PSNR edges higher toward the FBP baseline (36.3). Tests whether eta->0 (near pure prior-denoise of the FBP init, minimal measurement pull) is optimal for the DC-free variant.", "sdd": 1000.0, "seed": 42, "sod": 500.0, "train_n": 400, "val_n": 200}, "challenge": "breast_ct", "change_class": "architecture", "git_commit": "671da566", "images": {"comparison": "runs/breast-ct-claude-agentic-fastdiff-flow-pixel-unconstrained-search-20260703-01/iterations/iter-0006/comparison.png", "test_showcase": null, "valtest_showcase": null}, "iter": 6, "kept": false, "metrics": {"headroom": 0.0, "headroom_std": 0.0, "val_psnr": 28.120433807373047, "val_psnr_std": 0.873896000279772, "val_rmse": 0.013408580794930458, "val_rmse_std": 0.0013240545175851682, "val_ssim": 0.7967538237571716, "val_ssim_std": 0.011352686025133627}, "model": "claude-opus-4-8-1m", "obs_path": "breast-ct-claude-agentic-fastdiff-flow-pixel-unconstrained-search-20260703-01/iterations/iter-0006/observation.json", "obs_sha1": "0e36a520b8e78f1d76f596b2985bcc9775757dfc", "params_M": 3.822787, "params_source": "observation", "rationale": "fastdiff_flow_pixel_unconstrained-claude-agentic: image_size=512, pixel_spacing=0.3516, n_angles=128, n_det=1024, det_spacing=0.35754, sod=500.0, sdd=1000.0, display_min=0.0, display_max=0.5, train_n=400, val_n=200, noise_i0=100000.0, noise_sigma_e=10.0, seed=42, fd_recon_ckpt=/cluster/maier/Agent4CT/checkpoints/fast_diffusion_pixel_breast.pt, fd_recon_steps=8, fd_recon_init=fbp, fd_recon_init_t=0.4, fd_recon_eta=0.2, fd_recon_dc=0, fd_recon_dc_n_cg=5, fd_recon_dc_relax=0.5, rationale=iter-6: DC-off breast-prior. Fix init_t=0.4. ONE KNOB eta 0.5->0.2. TREND (eta at init_t0.4): eta3.0 PSNR12.8 (diverged) > eta1.0 PSNR24.6 > eta0.5 PSNR27.0 (BEST) - monotonic: LOWER eta = more stable = better, because the soft DPS step overshoots when large and there is no hard DC to re-anchor. HYPOTHESIS: eta=0.2 continues the gain (even gentler guidance, FBP-init+prior dominate) -> PSNR edges higher toward the FBP baseline (36.3). Tests whether eta->0 (near pure prior-denoise of the FBP init, minimal measurement pull) is optimal for the DC-free variant.", "run_id": "breast-ct-claude-agentic-fastdiff-flow-pixel-unconstrained-search-20260703-01", "runtime": {"elapsed_s": 131.20772242546082}, "schema_version": 3, "solver_key": "fastdiff-flow-pixel-unconstrained", "solver_name": "Fast-diffusion flow (pixel, unconstrained)", "split": {"train_n": 3600, "val_n": 200}, "status": "discard", "ts": "2026-07-06T20:34:50Z"}
