{"advice_for_others": "dual_domain_supervised-claude-agentic: unet_c=16, epochs=44, batch_size=1, lr=0.001, optimizer=adam, lambda_neg=0.03, grad_clip=1.0, train_n=400, val_n=200, val_chunk=10, seed=43, rationale=iter-14 dual_domain_supervised, re-split Breast-CT val=200. SIX-BOX vs BEST (iter-8 c16/ep44/lr1e-3/lneg0.03/bs1/tn400/seed42 hr=0.8915). (1) PRIOR: search PLATEAUED at iter-8 -- every neighbor worse: lr2e-3=0.8470, ep52=0.8911(flat), c32=0.8243, lneg0.1=0.8869, lneg0.0=0.8731, bs2=0.8588, data-swap tn800/ep22=0.8785. iter-8 is optimal on every config-accessible axis. (2) Failure mode: NOT a failure -- but ALL 13 iters used seed=42; the init/training NOISE FLOOR is unknown, so iter-8s small margins over iter-7 (0.8869) and iter-11 (0.8911) may be noise not signal. (3) ONE KNOB: seed 42 -> 43 (iter-8 config otherwise identical) -- a REPLICATE to measure variance at the optimum. (4) HYPOTHESIS: at the plateau config, changing only the seed yields hr within +-~0.003 of 0.8915 (init noise), confirming a robust ~0.89 optimum not a lucky seed; if it lands much lower, iter-8 was seed-lucky and iters 15-16 add seeds to report an honest mean+-std. (5) BUDGET: same config -> ~941s, inside 20-min budget. (6) Loop to iter-20 (iters 14-16 = seed replicates to bound the noise floor). Artifacts saved.", "agent": "dual_domain_supervised-claude-agentic", "campaign": "search-20260703-01", "cfg_full": {"batch_size": 1, "epochs": 44, "grad_clip": 1.0, "lambda_neg": 0.03, "lr": 0.001, "optimizer": "adam", "rationale": "iter-14 dual_domain_supervised, re-split Breast-CT val=200. SIX-BOX vs BEST (iter-8 c16/ep44/lr1e-3/lneg0.03/bs1/tn400/seed42 hr=0.8915). (1) PRIOR: search PLATEAUED at iter-8 -- every neighbor worse: lr2e-3=0.8470, ep52=0.8911(flat), c32=0.8243, lneg0.1=0.8869, lneg0.0=0.8731, bs2=0.8588, data-swap tn800/ep22=0.8785. iter-8 is optimal on every config-accessible axis. (2) Failure mode: NOT a failure -- but ALL 13 iters used seed=42; the init/training NOISE FLOOR is unknown, so iter-8s small margins over iter-7 (0.8869) and iter-11 (0.8911) may be noise not signal. (3) ONE KNOB: seed 42 -> 43 (iter-8 config otherwise identical) -- a REPLICATE to measure variance at the optimum. (4) HYPOTHESIS: at the plateau config, changing only the seed yields hr within +-~0.003 of 0.8915 (init noise), confirming a robust ~0.89 optimum not a lucky seed; if it lands much lower, iter-8 was seed-lucky and iters 15-16 add seeds to report an honest mean+-std. (5) BUDGET: same config -> ~941s, inside 20-min budget. (6) Loop to iter-20 (iters 14-16 = seed replicates to bound the noise floor). Artifacts saved.", "seed": 43, "train_n": 400, "unet_c": 16, "val_chunk": 10, "val_n": 200}, "challenge": "breast_ct", "change_class": "architecture", "git_commit": "671da566", "images": {"comparison": "runs/breast-ct-claude-agentic-dual-domain-supervised-search-20260703-01/iterations/iter-0014/comparison.png", "test_showcase": null, "valtest_showcase": null}, "iter": 14, "kept": true, "metrics": {"headroom": 0.858914070698612, "headroom_std": 0.0163513421213654, "val_psnr": 53.33452224731445, "val_psnr_std": 1.594076691595825, "val_rmse": 0.0007356620626524091, "val_rmse_std": 0.00013085746532342452, "val_ssim": 0.998680830001831, "val_ssim_std": 0.0004857140064255781}, "model": "claude-opus-4-8-1m", "obs_path": "breast-ct-claude-agentic-dual-domain-supervised-search-20260703-01/iterations/iter-0014/observation.json", "obs_sha1": "afa968fb915dded25d858eb2ac564bb670880317", "params_M": 0.465762, "params_source": "observation", "rationale": "dual_domain_supervised-claude-agentic: unet_c=16, epochs=44, batch_size=1, lr=0.001, optimizer=adam, lambda_neg=0.03, grad_clip=1.0, train_n=400, val_n=200, val_chunk=10, seed=43, rationale=iter-14 dual_domain_supervised, re-split Breast-CT val=200. SIX-BOX vs BEST (iter-8 c16/ep44/lr1e-3/lneg0.03/bs1/tn400/seed42 hr=0.8915). (1) PRIOR: search PLATEAUED at iter-8 -- every neighbor worse: lr2e-3=0.8470, ep52=0.8911(flat), c32=0.8243, lneg0.1=0.8869, lneg0.0=0.8731, bs2=0.8588, data-swap tn800/ep22=0.8785. iter-8 is optimal on every config-accessible axis. (2) Failure mode: NOT a failure -- but ALL 13 iters used seed=42; the init/training NOISE FLOOR is unknown, so iter-8s small margins over iter-7 (0.8869) and iter-11 (0.8911) may be noise not signal. (3) ONE KNOB: seed 42 -> 43 (iter-8 config otherwise identical) -- a REPLICATE to measure variance at the optimum. (4) HYPOTHESIS: at the plateau config, changing only the seed yields hr within +-~0.003 of 0.8915 (init noise), confirming a robust ~0.89 optimum not a lucky seed; if it lands much lower, iter-8 was seed-lucky and iters 15-16 add seeds to report an honest mean+-std. (5) BUDGET: same config -> ~941s, inside 20-min budget. (6) Loop to iter-20 (iters 14-16 = seed replicates to bound the noise floor). Artifacts saved.", "run_id": "breast-ct-claude-agentic-dual-domain-supervised-search-20260703-01", "runtime": {"elapsed_s": 899.1806645393372}, "schema_version": 3, "solver_key": "dual-domain-supervised", "solver_name": "DD-UNet supervised L2", "split": {"train_n": 400, "val_n": 200}, "status": "keep", "ts": "2026-07-04T14:24:44Z"}
{"advice_for_others": "dual_domain_supervised-claude-agentic: unet_c=16, epochs=44, batch_size=1, lr=0.001, optimizer=adam, lambda_neg=0.03, grad_clip=1.0, train_n=400, val_n=200, val_chunk=10, seed=44, rationale=iter-15 dual_domain_supervised, re-split Breast-CT val=200. SIX-BOX vs BEST config (c16/ep44/lr1e-3/lneg0.03/bs1/tn400). (1) PRIOR: seed42(iter-8)=0.8915 but seed43(iter-14)=0.8589 at the IDENTICAL config -> seed/init variance is LARGE (~0.033 spread over 2 seeds), far above the +-0.003 I hypothesized. (2) Failure mode: single-seed optimization (iters 1-13 all seed=42) was NOISE-CONFOUNDED -- 0.8915 is likely an upper-tail draw, not a robust config gain; cannot report a trustworthy best from 2 seeds. (3) ONE KNOB: seed 44 (config otherwise identical) -- 3rd replicate to estimate mean+-std at the optimum. (4) HYPOTHESIS: seed=44 lands in [0.859,0.892]; with 3 seeds the HONEST best-config number is the mean (~0.87-0.88 +- ~0.017), NOT the seed-42 peak. This bounds the noise floor for the leaderboard. (5) BUDGET: same config -> ~941s, inside 20-min. (6) Loop to iter-20; iters 14-16 seed replicates, 17-20 reserved (a 4th replicate if variance still wide, else confirm config edges under the measured noise floor). Artifacts saved.", "agent": "dual_domain_supervised-claude-agentic", "campaign": "search-20260703-01", "cfg_full": {"batch_size": 1, "epochs": 44, "grad_clip": 1.0, "lambda_neg": 0.03, "lr": 0.001, "optimizer": "adam", "rationale": "iter-15 dual_domain_supervised, re-split Breast-CT val=200. SIX-BOX vs BEST config (c16/ep44/lr1e-3/lneg0.03/bs1/tn400). (1) PRIOR: seed42(iter-8)=0.8915 but seed43(iter-14)=0.8589 at the IDENTICAL config -> seed/init variance is LARGE (~0.033 spread over 2 seeds), far above the +-0.003 I hypothesized. (2) Failure mode: single-seed optimization (iters 1-13 all seed=42) was NOISE-CONFOUNDED -- 0.8915 is likely an upper-tail draw, not a robust config gain; cannot report a trustworthy best from 2 seeds. (3) ONE KNOB: seed 44 (config otherwise identical) -- 3rd replicate to estimate mean+-std at the optimum. (4) HYPOTHESIS: seed=44 lands in [0.859,0.892]; with 3 seeds the HONEST best-config number is the mean (~0.87-0.88 +- ~0.017), NOT the seed-42 peak. This bounds the noise floor for the leaderboard. (5) BUDGET: same config -> ~941s, inside 20-min. (6) Loop to iter-20; iters 14-16 seed replicates, 17-20 reserved (a 4th replicate if variance still wide, else confirm config edges under the measured noise floor). Artifacts saved.", "seed": 44, "train_n": 400, "unet_c": 16, "val_chunk": 10, "val_n": 200}, "challenge": "breast_ct", "change_class": "architecture", "git_commit": "671da566", "images": {"comparison": "runs/breast-ct-claude-agentic-dual-domain-supervised-search-20260703-01/iterations/iter-0015/comparison.png", "test_showcase": null, "valtest_showcase": null}, "iter": 15, "kept": true, "metrics": {"headroom": 0.831656327982747, "headroom_std": 0.011180888051404936, "val_psnr": 51.80026626586914, "val_psnr_std": 1.1007922491157314, "val_rmse": 0.0008777916664257646, "val_rmse_std": 0.00011102132184475852, "val_ssim": 0.9982197284698486, "val_ssim_std": 0.0005196216344583389}, "model": "claude-opus-4-8-1m", "obs_path": "breast-ct-claude-agentic-dual-domain-supervised-search-20260703-01/iterations/iter-0015/observation.json", "obs_sha1": "c48a8c1c01937a09c28d43229ff6a1fce949df5f", "params_M": 0.465762, "params_source": "observation", "rationale": "dual_domain_supervised-claude-agentic: unet_c=16, epochs=44, batch_size=1, lr=0.001, optimizer=adam, lambda_neg=0.03, grad_clip=1.0, train_n=400, val_n=200, val_chunk=10, seed=44, rationale=iter-15 dual_domain_supervised, re-split Breast-CT val=200. SIX-BOX vs BEST config (c16/ep44/lr1e-3/lneg0.03/bs1/tn400). (1) PRIOR: seed42(iter-8)=0.8915 but seed43(iter-14)=0.8589 at the IDENTICAL config -> seed/init variance is LARGE (~0.033 spread over 2 seeds), far above the +-0.003 I hypothesized. (2) Failure mode: single-seed optimization (iters 1-13 all seed=42) was NOISE-CONFOUNDED -- 0.8915 is likely an upper-tail draw, not a robust config gain; cannot report a trustworthy best from 2 seeds. (3) ONE KNOB: seed 44 (config otherwise identical) -- 3rd replicate to estimate mean+-std at the optimum. (4) HYPOTHESIS: seed=44 lands in [0.859,0.892]; with 3 seeds the HONEST best-config number is the mean (~0.87-0.88 +- ~0.017), NOT the seed-42 peak. This bounds the noise floor for the leaderboard. (5) BUDGET: same config -> ~941s, inside 20-min. (6) Loop to iter-20; iters 14-16 seed replicates, 17-20 reserved (a 4th replicate if variance still wide, else confirm config edges under the measured noise floor). Artifacts saved.", "run_id": "breast-ct-claude-agentic-dual-domain-supervised-search-20260703-01", "runtime": {"elapsed_s": 789.7403254508972}, "schema_version": 3, "solver_key": "dual-domain-supervised", "solver_name": "DD-UNet supervised L2", "split": {"train_n": 400, "val_n": 200}, "status": "keep", "ts": "2026-07-04T16:22:56Z"}
{"advice_for_others": "dual_domain_supervised-claude-agentic: unet_c=16, epochs=44, batch_size=1, lr=0.001, optimizer=adam, lambda_neg=0.03, grad_clip=1.0, train_n=400, val_n=200, val_chunk=10, seed=45, rationale=iter-16 dual_domain_supervised, re-split Breast-CT val=200. SIX-BOX at the BEST config (c16/ep44/lr1e-3/lneg0.03/bs1/tn400). (1) PRIOR: 3 seed replicates -- seed42(iter-8)=0.8915, seed43(iter-14)=0.8589, seed44(iter-15)=0.8317 -> mean~0.861 std~0.030, spread 0.060. Seed/init variance DOMINATES the config-knob deltas from iters 1-13. (2) Failure mode: the whole single-seed(=42) sweep was NOISE-CONFOUNDED; 0.8915 was a favorable upper-tail draw, NOT a robust config gain -- the lr/lambda_neg improvements sit within this +-0.03 band. n=3 std is itself noisy. (3) ONE KNOB: seed 45 (config identical) -- 4th replicate to stabilize mean+-std. (4) HYPOTHESIS: seed=45 lands in [0.83,0.89]; n=4 gives a stable mean (~0.86+-0.03) that is the HONEST reportable number for this config, replacing the seed-42 peak. (5) BUDGET: ~941s, inside 20-min. (6) Loop to iter-20; the headline result is now the variance characterization, so iters 17-20 add replicates to solidify the mean+-std at n=7-8. Artifacts saved.", "agent": "dual_domain_supervised-claude-agentic", "campaign": "search-20260703-01", "cfg_full": {"batch_size": 1, "epochs": 44, "grad_clip": 1.0, "lambda_neg": 0.03, "lr": 0.001, "optimizer": "adam", "rationale": "iter-16 dual_domain_supervised, re-split Breast-CT val=200. SIX-BOX at the BEST config (c16/ep44/lr1e-3/lneg0.03/bs1/tn400). (1) PRIOR: 3 seed replicates -- seed42(iter-8)=0.8915, seed43(iter-14)=0.8589, seed44(iter-15)=0.8317 -> mean~0.861 std~0.030, spread 0.060. Seed/init variance DOMINATES the config-knob deltas from iters 1-13. (2) Failure mode: the whole single-seed(=42) sweep was NOISE-CONFOUNDED; 0.8915 was a favorable upper-tail draw, NOT a robust config gain -- the lr/lambda_neg improvements sit within this +-0.03 band. n=3 std is itself noisy. (3) ONE KNOB: seed 45 (config identical) -- 4th replicate to stabilize mean+-std. (4) HYPOTHESIS: seed=45 lands in [0.83,0.89]; n=4 gives a stable mean (~0.86+-0.03) that is the HONEST reportable number for this config, replacing the seed-42 peak. (5) BUDGET: ~941s, inside 20-min. (6) Loop to iter-20; the headline result is now the variance characterization, so iters 17-20 add replicates to solidify the mean+-std at n=7-8. Artifacts saved.", "seed": 45, "train_n": 400, "unet_c": 16, "val_chunk": 10, "val_n": 200}, "challenge": "breast_ct", "change_class": "architecture", "git_commit": "671da566", "images": {"comparison": "runs/breast-ct-claude-agentic-dual-domain-supervised-search-20260703-01/iterations/iter-0016/comparison.png", "test_showcase": null, "valtest_showcase": null}, "iter": 16, "kept": true, "metrics": {"headroom": 0.8865779052972921, "headroom_std": 0.013936778012565453, "val_psnr": 55.230247497558594, "val_psnr_std": 1.6710914094870752, "val_rmse": 0.0005914149805903435, "val_rmse_std": 0.00010842289724768846, "val_ssim": 0.9991090297698975, "val_ssim_std": 0.0003198483057426364}, "model": "claude-opus-4-8-1m", "obs_path": "breast-ct-claude-agentic-dual-domain-supervised-search-20260703-01/iterations/iter-0016/observation.json", "obs_sha1": "795552cf1b5e9893f767b4bd682a11787f31b344", "params_M": 0.465762, "params_source": "observation", "rationale": "dual_domain_supervised-claude-agentic: unet_c=16, epochs=44, batch_size=1, lr=0.001, optimizer=adam, lambda_neg=0.03, grad_clip=1.0, train_n=400, val_n=200, val_chunk=10, seed=45, rationale=iter-16 dual_domain_supervised, re-split Breast-CT val=200. SIX-BOX at the BEST config (c16/ep44/lr1e-3/lneg0.03/bs1/tn400). (1) PRIOR: 3 seed replicates -- seed42(iter-8)=0.8915, seed43(iter-14)=0.8589, seed44(iter-15)=0.8317 -> mean~0.861 std~0.030, spread 0.060. Seed/init variance DOMINATES the config-knob deltas from iters 1-13. (2) Failure mode: the whole single-seed(=42) sweep was NOISE-CONFOUNDED; 0.8915 was a favorable upper-tail draw, NOT a robust config gain -- the lr/lambda_neg improvements sit within this +-0.03 band. n=3 std is itself noisy. (3) ONE KNOB: seed 45 (config identical) -- 4th replicate to stabilize mean+-std. (4) HYPOTHESIS: seed=45 lands in [0.83,0.89]; n=4 gives a stable mean (~0.86+-0.03) that is the HONEST reportable number for this config, replacing the seed-42 peak. (5) BUDGET: ~941s, inside 20-min. (6) Loop to iter-20; the headline result is now the variance characterization, so iters 17-20 add replicates to solidify the mean+-std at n=7-8. Artifacts saved.", "run_id": "breast-ct-claude-agentic-dual-domain-supervised-search-20260703-01", "runtime": {"elapsed_s": 815.0248401165009}, "schema_version": 3, "solver_key": "dual-domain-supervised", "solver_name": "DD-UNet supervised L2", "split": {"train_n": 400, "val_n": 200}, "status": "keep", "ts": "2026-07-04T19:27:20Z"}
{"advice_for_others": "dual_domain_supervised-claude-agentic: unet_c=16, epochs=44, batch_size=1, lr=0.001, optimizer=adam, lambda_neg=0.03, grad_clip=1.0, train_n=400, val_n=200, val_chunk=10, seed=46, rationale=iter-17 dual_domain_supervised, re-split Breast-CT val=200. SIX-BOX at BEST config (c16/ep44/lr1e-3/lneg0.03/bs1/tn400). (1) PRIOR: 4 seed replicates -- 42=0.8915,43=0.8589,44=0.8317,45=0.8866 -> mean~0.867, still spanning 0.832-0.892 (spread 0.060). Seed variance confirmed LARGE and dominant over the config-knob deltas. (2) Failure mode: single-seed(=42) sweep noise-confounded; n=4 mean still shifting as seed45 came in high. (3) ONE KNOB: seed 46 (5th replicate). (4) HYPOTHESIS: n=5 stabilizes the mean near ~0.865+-0.025; the honest config number is this mean, NOT the seed-42 0.8915 peak. (5) BUDGET: ~941s, inside 20-min. (6) Loop to iter-20 (iters 17-20 = replicates 5-8 to solidify mean+-std; the variance characterization is the primary finding). Artifacts saved.", "agent": "dual_domain_supervised-claude-agentic", "campaign": "search-20260703-01", "cfg_full": {"batch_size": 1, "epochs": 44, "grad_clip": 1.0, "lambda_neg": 0.03, "lr": 0.001, "optimizer": "adam", "rationale": "iter-17 dual_domain_supervised, re-split Breast-CT val=200. SIX-BOX at BEST config (c16/ep44/lr1e-3/lneg0.03/bs1/tn400). (1) PRIOR: 4 seed replicates -- 42=0.8915,43=0.8589,44=0.8317,45=0.8866 -> mean~0.867, still spanning 0.832-0.892 (spread 0.060). Seed variance confirmed LARGE and dominant over the config-knob deltas. (2) Failure mode: single-seed(=42) sweep noise-confounded; n=4 mean still shifting as seed45 came in high. (3) ONE KNOB: seed 46 (5th replicate). (4) HYPOTHESIS: n=5 stabilizes the mean near ~0.865+-0.025; the honest config number is this mean, NOT the seed-42 0.8915 peak. (5) BUDGET: ~941s, inside 20-min. (6) Loop to iter-20 (iters 17-20 = replicates 5-8 to solidify mean+-std; the variance characterization is the primary finding). Artifacts saved.", "seed": 46, "train_n": 400, "unet_c": 16, "val_chunk": 10, "val_n": 200}, "challenge": "breast_ct", "change_class": "architecture", "git_commit": "671da566", "images": {"comparison": "runs/breast-ct-claude-agentic-dual-domain-supervised-search-20260703-01/iterations/iter-0017/comparison.png", "test_showcase": null, "valtest_showcase": null}, "iter": 17, "kept": true, "metrics": {"headroom": 0.8843776771946175, "headroom_std": 0.012272932803028732, "val_psnr": 55.06336212158203, "val_psnr_std": 1.5035233326785498, "val_rmse": 0.0006028875941410661, "val_rmse_std": 9.947443899308113e-05, "val_ssim": 0.9990568161010742, "val_ssim_std": 0.00031500649990900015}, "model": "claude-opus-4-8-1m", "obs_path": "breast-ct-claude-agentic-dual-domain-supervised-search-20260703-01/iterations/iter-0017/observation.json", "obs_sha1": "253e8bd2452dd686dcd0b5d912670e03eeb17252", "params_M": 0.465762, "params_source": "observation", "rationale": "dual_domain_supervised-claude-agentic: unet_c=16, epochs=44, batch_size=1, lr=0.001, optimizer=adam, lambda_neg=0.03, grad_clip=1.0, train_n=400, val_n=200, val_chunk=10, seed=46, rationale=iter-17 dual_domain_supervised, re-split Breast-CT val=200. SIX-BOX at BEST config (c16/ep44/lr1e-3/lneg0.03/bs1/tn400). (1) PRIOR: 4 seed replicates -- 42=0.8915,43=0.8589,44=0.8317,45=0.8866 -> mean~0.867, still spanning 0.832-0.892 (spread 0.060). Seed variance confirmed LARGE and dominant over the config-knob deltas. (2) Failure mode: single-seed(=42) sweep noise-confounded; n=4 mean still shifting as seed45 came in high. (3) ONE KNOB: seed 46 (5th replicate). (4) HYPOTHESIS: n=5 stabilizes the mean near ~0.865+-0.025; the honest config number is this mean, NOT the seed-42 0.8915 peak. (5) BUDGET: ~941s, inside 20-min. (6) Loop to iter-20 (iters 17-20 = replicates 5-8 to solidify mean+-std; the variance characterization is the primary finding). Artifacts saved.", "run_id": "breast-ct-claude-agentic-dual-domain-supervised-search-20260703-01", "runtime": {"elapsed_s": 856.288759469986}, "schema_version": 3, "solver_key": "dual-domain-supervised", "solver_name": "DD-UNet supervised L2", "split": {"train_n": 400, "val_n": 200}, "status": "keep", "ts": "2026-07-04T20:24:29Z"}
