{"advice_for_others": "itnet_v3-claude-agentic: itnet_k=2, unet_c=24, alpha_init=0.0025734, lr=0.00021567, epochs=5, batch_size=1, train_n=2400, val_n=200, grad_clip=1.0, max_train_s=1140, seed=44, rationale=iter-15 (breast-ct redo, search-20260703-01). SECOND SEED REPLICATE of the iter-12 champion (c24/ep5/bs1/lr2.16e-4/alpha0.0025734/n2400). ONE KNOB: seed 43 -> 44. Everything else = champion config EXACTLY. SIX-BOX (NUMBERS): (1) champion seed points so far: seed42(iter-12) 0.8638; seed43(iter-14) 0.7983. iter-14 log CONFIRMS all 5 epochs completed (loss 1e-6, 'Time limit reached AT epoch 5' fired only after ep5 finished) -> the 0.064 swing is a GENUINE seed effect, NOT budget truncation. (2) FAILURE MODE: the champion is SEED-SENSITIVE (spread 0.8638 vs 0.7983 across two seeds) -- likely the val_n=200 noise floor compounded with end-to-end unrolled-training run-to-run variance. iter-14's falsifier (swing>0.02) FIRED -> must widen the replicate set to characterize the true mean+/-std before reporting a champion number. (3) ONE KNOB: seed 43 -> 44 (3rd seed point). (4) HYPOTHESIS: seed 44 lands somewhere in [0.79, 0.87]; three points (42,43,44) let me compute a provisional mean+/-std and see whether 0.8638 was a favorable-seed high or the norm. FALSIFIER: n/a for a replicate -- this is variance characterization; the outcome (wherever it lands) refines the spread. (5) BUDGET (HARD 20min=1200s): identical config to iter-12/14 except seed; both prior runs completed all 5 epochs (iter-12 1190.98s, iter-14 finished ep5 then the 1130s fence tripped). max_train_s raised to 1140 so a fast-enough node completes ep5 cleanly and a slow node still lands val+figure inside the 30-min sbatch wall on the fully-or-nearly-trained model -> valid numeric-headroom obs either way. train_n=2400 (<= OOM-safe cap). val=200 distinct val_truth.h5 cases, 256px inscribed-circle FOV (breast default). (6) do NOT return control mid-campaign; gate on iter-15 numeric-headroom obs via iter_wait.sh v3 then dispatch iter-16.", "agent": "itnet_v3-claude-agentic", "campaign": "search-20260703-01", "cfg_full": {"alpha_init": 0.0025734, "batch_size": 1, "epochs": 5, "grad_clip": 1.0, "itnet_k": 2, "lr": 0.00021567, "max_train_s": 1140, "rationale": "iter-15 (breast-ct redo, search-20260703-01). SECOND SEED REPLICATE of the iter-12 champion (c24/ep5/bs1/lr2.16e-4/alpha0.0025734/n2400). ONE KNOB: seed 43 -> 44. Everything else = champion config EXACTLY. SIX-BOX (NUMBERS): (1) champion seed points so far: seed42(iter-12) 0.8638; seed43(iter-14) 0.7983. iter-14 log CONFIRMS all 5 epochs completed (loss 1e-6, 'Time limit reached AT epoch 5' fired only after ep5 finished) -> the 0.064 swing is a GENUINE seed effect, NOT budget truncation. (2) FAILURE MODE: the champion is SEED-SENSITIVE (spread 0.8638 vs 0.7983 across two seeds) -- likely the val_n=200 noise floor compounded with end-to-end unrolled-training run-to-run variance. iter-14's falsifier (swing>0.02) FIRED -> must widen the replicate set to characterize the true mean+/-std before reporting a champion number. (3) ONE KNOB: seed 43 -> 44 (3rd seed point). (4) HYPOTHESIS: seed 44 lands somewhere in [0.79, 0.87]; three points (42,43,44) let me compute a provisional mean+/-std and see whether 0.8638 was a favorable-seed high or the norm. FALSIFIER: n/a for a replicate -- this is variance characterization; the outcome (wherever it lands) refines the spread. (5) BUDGET (HARD 20min=1200s): identical config to iter-12/14 except seed; both prior runs completed all 5 epochs (iter-12 1190.98s, iter-14 finished ep5 then the 1130s fence tripped). max_train_s raised to 1140 so a fast-enough node completes ep5 cleanly and a slow node still lands val+figure inside the 30-min sbatch wall on the fully-or-nearly-trained model -> valid numeric-headroom obs either way. train_n=2400 (<= OOM-safe cap). val=200 distinct val_truth.h5 cases, 256px inscribed-circle FOV (breast default). (6) do NOT return control mid-campaign; gate on iter-15 numeric-headroom obs via iter_wait.sh v3 then dispatch iter-16.", "seed": 44, "train_n": 2400, "unet_c": 24, "val_n": 200}, "challenge": "breast_ct", "change_class": "architecture", "git_commit": "671da566", "images": {"comparison": "runs/breast-ct-claude-agentic-itnet-v3-search-20260703-01/iterations/iter-0015/comparison.png", "test_showcase": null, "valtest_showcase": null}, "iter": 15, "kept": true, "metrics": {"headroom": 0.6142497728752145, "headroom_std": 0.01578013724614807, "val_psnr": 44.59807586669922, "val_psnr_std": 0.6857642105085584, "val_rmse": 0.0020114111248403788, "val_rmse_std": 0.00015346332767580357, "val_ssim": 0.988529622554779, "val_ssim_std": 0.001757776065536437}, "model": "claude-opus-4-8-1m", "obs_path": "breast-ct-claude-agentic-itnet-v3-search-20260703-01/iterations/iter-0015/observation.json", "obs_sha1": "f963b1e775a3f6591419582cfeb8de3ce78237e6", "params_M": 8.317706, "params_source": "observation", "rationale": "itnet_v3-claude-agentic: itnet_k=2, unet_c=24, alpha_init=0.0025734, lr=0.00021567, epochs=5, batch_size=1, train_n=2400, val_n=200, grad_clip=1.0, max_train_s=1140, seed=44, rationale=iter-15 (breast-ct redo, search-20260703-01). SECOND SEED REPLICATE of the iter-12 champion (c24/ep5/bs1/lr2.16e-4/alpha0.0025734/n2400). ONE KNOB: seed 43 -> 44. Everything else = champion config EXACTLY. SIX-BOX (NUMBERS): (1) champion seed points so far: seed42(iter-12) 0.8638; seed43(iter-14) 0.7983. iter-14 log CONFIRMS all 5 epochs completed (loss 1e-6, 'Time limit reached AT epoch 5' fired only after ep5 finished) -> the 0.064 swing is a GENUINE seed effect, NOT budget truncation. (2) FAILURE MODE: the champion is SEED-SENSITIVE (spread 0.8638 vs 0.7983 across two seeds) -- likely the val_n=200 noise floor compounded with end-to-end unrolled-training run-to-run variance. iter-14's falsifier (swing>0.02) FIRED -> must widen the replicate set to characterize the true mean+/-std before reporting a champion number. (3) ONE KNOB: seed 43 -> 44 (3rd seed point). (4) HYPOTHESIS: seed 44 lands somewhere in [0.79, 0.87]; three points (42,43,44) let me compute a provisional mean+/-std and see whether 0.8638 was a favorable-seed high or the norm. FALSIFIER: n/a for a replicate -- this is variance characterization; the outcome (wherever it lands) refines the spread. (5) BUDGET (HARD 20min=1200s): identical config to iter-12/14 except seed; both prior runs completed all 5 epochs (iter-12 1190.98s, iter-14 finished ep5 then the 1130s fence tripped). max_train_s raised to 1140 so a fast-enough node completes ep5 cleanly and a slow node still lands val+figure inside the 30-min sbatch wall on the fully-or-nearly-trained model -> valid numeric-headroom obs either way. train_n=2400 (<= OOM-safe cap). val=200 distinct val_truth.h5 cases, 256px inscribed-circle FOV (breast default). (6) do NOT return control mid-campaign; gate on iter-15 numeric-headroom obs via iter_wait.sh v3 then dispatch iter-16.", "run_id": "breast-ct-claude-agentic-itnet-v3-search-20260703-01", "runtime": {"elapsed_s": 1236.1861050128937}, "schema_version": 3, "solver_key": "itnet-v3", "solver_name": "ITNet v3", "split": {"train_n": 400, "val_n": 200}, "status": "keep", "ts": "2026-07-05T08:31:22Z"}
{"advice_for_others": "itnet_v3-claude-agentic: itnet_k=2, unet_c=24, alpha_init=0.0025734, lr=0.00021567, epochs=5, batch_size=2, train_n=2400, val_n=200, grad_clip=1.0, max_train_s=1100, seed=43, rationale=iter-16 (breast-ct redo, search-20260703-01). PIVOT: characterize the STABLE bs=2 champion (iter-7 c24/ep5/bs2/lr2.16e-4, hr 0.8469) instead of the high-variance bs=1 line. ONE KNOB: seed 42 -> 43 (bs=2 seed replicate). All else = iter-7 exactly (itnet_k=2, unet_c=24, alpha_init=0.0025734, lr=2.16e-4, epochs=5, batch_size=2, train_n=2400, val_n=200, grad_clip=1.0). SIX-BOX (NUMBERS): (1) bs=1 line is HIGH-VARIANCE: iter-12 s42 0.8638, iter-14 s43 0.7983, iter-15 s44 0.6142 -> mean 0.759 +/- 0.104. Both iter-14 and iter-15 logs CONFIRM all 5 epochs completed (train loss converged to 1e-6 in every run) yet val hr swung 0.25 across seeds. KEY FINDING: with an IDENTICAL, converged train loss the val hr varies enormously -> the bs=1 single-sample gradients drive end-to-end unrolled training to different minima that generalize very differently; 0.8638 was a FAVORABLE-SEED win, not a robust champion. (2) FAILURE MODE: bs=1 = high generalization variance. The bs=2 champion (iter-7, 0.8469) trained more stably and finished comfortably in budget (15.7min, no wall risk). Need bs=2 seed replicates to test whether bs=2 is the more ROBUST (reportable) champion. (3) ONE KNOB: seed 42 -> 43 at the iter-7 bs=2 config. (4) HYPOTHESIS: bs=2 hr at seed 43 stays within ~+/-0.02 of 0.8469 (tight spread), confirming bs=2 as the stable champion whose mean the leaderboard should report -- even though its single-best point (0.8469) is below bs=1's lucky 0.8638. FALSIFIER (NUMBERS): if bs=2 also swings >0.05, the whole itnet_v3 breast recipe is high-variance and the reported number must be a multi-seed mean with a wide std, not any single peak. (5) BUDGET (HARD 20min=1200s): iter-7 bs2 config = 939.5s = 15.7min, ~4min margin -> no wall risk (unlike the bs=1 line at 19.85-20.6min). max_train_s=1100 fences the TRAIN phase. train_n=2400 (<= OOM-safe cap). val=200 distinct val_truth.h5 cases, 256px inscribed-circle FOV (breast default). (6) do NOT return control mid-campaign; gate on iter-16 numeric-headroom obs via iter_wait.sh v3 then dispatch iter-17.", "agent": "itnet_v3-claude-agentic", "campaign": "search-20260703-01", "cfg_full": {"alpha_init": 0.0025734, "batch_size": 2, "epochs": 5, "grad_clip": 1.0, "itnet_k": 2, "lr": 0.00021567, "max_train_s": 1100, "rationale": "iter-16 (breast-ct redo, search-20260703-01). PIVOT: characterize the STABLE bs=2 champion (iter-7 c24/ep5/bs2/lr2.16e-4, hr 0.8469) instead of the high-variance bs=1 line. ONE KNOB: seed 42 -> 43 (bs=2 seed replicate). All else = iter-7 exactly (itnet_k=2, unet_c=24, alpha_init=0.0025734, lr=2.16e-4, epochs=5, batch_size=2, train_n=2400, val_n=200, grad_clip=1.0). SIX-BOX (NUMBERS): (1) bs=1 line is HIGH-VARIANCE: iter-12 s42 0.8638, iter-14 s43 0.7983, iter-15 s44 0.6142 -> mean 0.759 +/- 0.104. Both iter-14 and iter-15 logs CONFIRM all 5 epochs completed (train loss converged to 1e-6 in every run) yet val hr swung 0.25 across seeds. KEY FINDING: with an IDENTICAL, converged train loss the val hr varies enormously -> the bs=1 single-sample gradients drive end-to-end unrolled training to different minima that generalize very differently; 0.8638 was a FAVORABLE-SEED win, not a robust champion. (2) FAILURE MODE: bs=1 = high generalization variance. The bs=2 champion (iter-7, 0.8469) trained more stably and finished comfortably in budget (15.7min, no wall risk). Need bs=2 seed replicates to test whether bs=2 is the more ROBUST (reportable) champion. (3) ONE KNOB: seed 42 -> 43 at the iter-7 bs=2 config. (4) HYPOTHESIS: bs=2 hr at seed 43 stays within ~+/-0.02 of 0.8469 (tight spread), confirming bs=2 as the stable champion whose mean the leaderboard should report -- even though its single-best point (0.8469) is below bs=1's lucky 0.8638. FALSIFIER (NUMBERS): if bs=2 also swings >0.05, the whole itnet_v3 breast recipe is high-variance and the reported number must be a multi-seed mean with a wide std, not any single peak. (5) BUDGET (HARD 20min=1200s): iter-7 bs2 config = 939.5s = 15.7min, ~4min margin -> no wall risk (unlike the bs=1 line at 19.85-20.6min). max_train_s=1100 fences the TRAIN phase. train_n=2400 (<= OOM-safe cap). val=200 distinct val_truth.h5 cases, 256px inscribed-circle FOV (breast default). (6) do NOT return control mid-campaign; gate on iter-16 numeric-headroom obs via iter_wait.sh v3 then dispatch iter-17.", "seed": 43, "train_n": 2400, "unet_c": 24, "val_n": 200}, "challenge": "breast_ct", "change_class": "architecture", "git_commit": "671da566", "images": {"comparison": "runs/breast-ct-claude-agentic-itnet-v3-search-20260703-01/iterations/iter-0016/comparison.png", "test_showcase": null, "valtest_showcase": null}, "iter": 16, "kept": true, "metrics": {"headroom": 0.6699079819771917, "headroom_std": 0.02474558725976664, "val_psnr": 45.95149612426758, "val_psnr_std": 1.2085629491156817, "val_rmse": 0.0017211934318765998, "val_rmse_std": 0.00023576516924444425, "val_ssim": 0.9953629970550537, "val_ssim_std": 0.0012847122629355183}, "model": "claude-opus-4-8-1m", "obs_path": "breast-ct-claude-agentic-itnet-v3-search-20260703-01/iterations/iter-0016/observation.json", "obs_sha1": "c64b05f0b882bf6635a36832afbc594c620a5165", "params_M": 8.317706, "params_source": "observation", "rationale": "itnet_v3-claude-agentic: itnet_k=2, unet_c=24, alpha_init=0.0025734, lr=0.00021567, epochs=5, batch_size=2, train_n=2400, val_n=200, grad_clip=1.0, max_train_s=1100, seed=43, rationale=iter-16 (breast-ct redo, search-20260703-01). PIVOT: characterize the STABLE bs=2 champion (iter-7 c24/ep5/bs2/lr2.16e-4, hr 0.8469) instead of the high-variance bs=1 line. ONE KNOB: seed 42 -> 43 (bs=2 seed replicate). All else = iter-7 exactly (itnet_k=2, unet_c=24, alpha_init=0.0025734, lr=2.16e-4, epochs=5, batch_size=2, train_n=2400, val_n=200, grad_clip=1.0). SIX-BOX (NUMBERS): (1) bs=1 line is HIGH-VARIANCE: iter-12 s42 0.8638, iter-14 s43 0.7983, iter-15 s44 0.6142 -> mean 0.759 +/- 0.104. Both iter-14 and iter-15 logs CONFIRM all 5 epochs completed (train loss converged to 1e-6 in every run) yet val hr swung 0.25 across seeds. KEY FINDING: with an IDENTICAL, converged train loss the val hr varies enormously -> the bs=1 single-sample gradients drive end-to-end unrolled training to different minima that generalize very differently; 0.8638 was a FAVORABLE-SEED win, not a robust champion. (2) FAILURE MODE: bs=1 = high generalization variance. The bs=2 champion (iter-7, 0.8469) trained more stably and finished comfortably in budget (15.7min, no wall risk). Need bs=2 seed replicates to test whether bs=2 is the more ROBUST (reportable) champion. (3) ONE KNOB: seed 42 -> 43 at the iter-7 bs=2 config. (4) HYPOTHESIS: bs=2 hr at seed 43 stays within ~+/-0.02 of 0.8469 (tight spread), confirming bs=2 as the stable champion whose mean the leaderboard should report -- even though its single-best point (0.8469) is below bs=1's lucky 0.8638. FALSIFIER (NUMBERS): if bs=2 also swings >0.05, the whole itnet_v3 breast recipe is high-variance and the reported number must be a multi-seed mean with a wide std, not any single peak. (5) BUDGET (HARD 20min=1200s): iter-7 bs2 config = 939.5s = 15.7min, ~4min margin -> no wall risk (unlike the bs=1 line at 19.85-20.6min). max_train_s=1100 fences the TRAIN phase. train_n=2400 (<= OOM-safe cap). val=200 distinct val_truth.h5 cases, 256px inscribed-circle FOV (breast default). (6) do NOT return control mid-campaign; gate on iter-16 numeric-headroom obs via iter_wait.sh v3 then dispatch iter-17.", "run_id": "breast-ct-claude-agentic-itnet-v3-search-20260703-01", "runtime": {"elapsed_s": 1096.8963725566864}, "schema_version": 3, "solver_key": "itnet-v3", "solver_name": "ITNet v3", "split": {"train_n": 400, "val_n": 200}, "status": "keep", "ts": "2026-07-05T09:29:03Z"}
{"advice_for_others": "itnet_v3-claude-agentic: itnet_k=2, unet_c=24, alpha_init=0.0025734, lr=0.00021567, epochs=5, batch_size=2, train_n=2400, val_n=200, grad_clip=1.0, max_train_s=1100, seed=44, rationale=iter-17 (breast-ct redo, search-20260703-01). THIRD bs=2 seed replicate of the c24/ep5/bs2/lr2.16e-4 champion config. ONE KNOB: seed 43 -> 44. All else = iter-7/16 config exactly. SIX-BOX (NUMBERS): (1) FINDING confirmed: itnet_v3 breast is HIGH-VARIANCE across seeds at BOTH batch sizes. bs=1: s42 0.8638, s43 0.7983, s44 0.6142. bs=2: s42 0.8469, s43 0.6699. Every run converges to train loss 1e-6 yet val hr swings ~0.2 -- end-to-end unrolled training finds different-generalizing minima; seed 42 is favorable for both. iter-16's falsifier FIRED (bs=2 also swings>0.05) -> the reported champion MUST be a multi-seed mean+/-std, not a single peak. (2) FAILURE MODE: high generalization variance intrinsic to the recipe (not a bug -- train loss is stable). Building the bs=2 mean+/-std as the reportable number. (3) ONE KNOB: seed 43 -> 44 (3rd bs=2 point). (4) HYPOTHESIS: n/a for a variance replicate; seed 44 refines the bs=2 spread. Provisional bs=2 mean after this = mean(0.8469, 0.6699, s44). (5) BUDGET (HARD 20min=1200s): bs=2 config = iter-7 939.5s / iter-16 1096.9s, both < 1200s (bs=2 has ~2-4min margin vs bs=1's wall-hugging 19.85-20.6min). max_train_s=1100 fences the TRAIN phase. train_n=2400 (<= OOM-safe cap). val=200 distinct val_truth.h5 cases, 256px inscribed-circle FOV (breast default). (6) do NOT return control mid-campaign; gate on iter-17 numeric-headroom obs via iter_wait.sh v3 then dispatch iter-18.", "agent": "itnet_v3-claude-agentic", "campaign": "search-20260703-01", "cfg_full": {"alpha_init": 0.0025734, "batch_size": 2, "epochs": 5, "grad_clip": 1.0, "itnet_k": 2, "lr": 0.00021567, "max_train_s": 1100, "rationale": "iter-17 (breast-ct redo, search-20260703-01). THIRD bs=2 seed replicate of the c24/ep5/bs2/lr2.16e-4 champion config. ONE KNOB: seed 43 -> 44. All else = iter-7/16 config exactly. SIX-BOX (NUMBERS): (1) FINDING confirmed: itnet_v3 breast is HIGH-VARIANCE across seeds at BOTH batch sizes. bs=1: s42 0.8638, s43 0.7983, s44 0.6142. bs=2: s42 0.8469, s43 0.6699. Every run converges to train loss 1e-6 yet val hr swings ~0.2 -- end-to-end unrolled training finds different-generalizing minima; seed 42 is favorable for both. iter-16's falsifier FIRED (bs=2 also swings>0.05) -> the reported champion MUST be a multi-seed mean+/-std, not a single peak. (2) FAILURE MODE: high generalization variance intrinsic to the recipe (not a bug -- train loss is stable). Building the bs=2 mean+/-std as the reportable number. (3) ONE KNOB: seed 43 -> 44 (3rd bs=2 point). (4) HYPOTHESIS: n/a for a variance replicate; seed 44 refines the bs=2 spread. Provisional bs=2 mean after this = mean(0.8469, 0.6699, s44). (5) BUDGET (HARD 20min=1200s): bs=2 config = iter-7 939.5s / iter-16 1096.9s, both < 1200s (bs=2 has ~2-4min margin vs bs=1's wall-hugging 19.85-20.6min). max_train_s=1100 fences the TRAIN phase. train_n=2400 (<= OOM-safe cap). val=200 distinct val_truth.h5 cases, 256px inscribed-circle FOV (breast default). (6) do NOT return control mid-campaign; gate on iter-17 numeric-headroom obs via iter_wait.sh v3 then dispatch iter-18.", "seed": 44, "train_n": 2400, "unet_c": 24, "val_n": 200}, "challenge": "breast_ct", "change_class": "architecture", "git_commit": "671da566", "images": {"comparison": "runs/breast-ct-claude-agentic-itnet-v3-search-20260703-01/iterations/iter-0017/comparison.png", "test_showcase": null, "valtest_showcase": null}, "iter": 17, "kept": true, "metrics": {"headroom": 0.8277879729288153, "headroom_std": 0.014722908133416882, "val_psnr": 51.60293197631836, "val_psnr_std": 1.2710260094843133, "val_rmse": 0.0008979623671621084, "val_rmse_std": 0.00012856470730479957, "val_ssim": 0.9977032542228699, "val_ssim_std": 0.0006307003002864024}, "model": "claude-opus-4-8-1m", "obs_path": "breast-ct-claude-agentic-itnet-v3-search-20260703-01/iterations/iter-0017/observation.json", "obs_sha1": "239efd8996eb66739da8f8d51c4dc318adac670d", "params_M": 8.317706, "params_source": "observation", "rationale": "itnet_v3-claude-agentic: itnet_k=2, unet_c=24, alpha_init=0.0025734, lr=0.00021567, epochs=5, batch_size=2, train_n=2400, val_n=200, grad_clip=1.0, max_train_s=1100, seed=44, rationale=iter-17 (breast-ct redo, search-20260703-01). THIRD bs=2 seed replicate of the c24/ep5/bs2/lr2.16e-4 champion config. ONE KNOB: seed 43 -> 44. All else = iter-7/16 config exactly. SIX-BOX (NUMBERS): (1) FINDING confirmed: itnet_v3 breast is HIGH-VARIANCE across seeds at BOTH batch sizes. bs=1: s42 0.8638, s43 0.7983, s44 0.6142. bs=2: s42 0.8469, s43 0.6699. Every run converges to train loss 1e-6 yet val hr swings ~0.2 -- end-to-end unrolled training finds different-generalizing minima; seed 42 is favorable for both. iter-16's falsifier FIRED (bs=2 also swings>0.05) -> the reported champion MUST be a multi-seed mean+/-std, not a single peak. (2) FAILURE MODE: high generalization variance intrinsic to the recipe (not a bug -- train loss is stable). Building the bs=2 mean+/-std as the reportable number. (3) ONE KNOB: seed 43 -> 44 (3rd bs=2 point). (4) HYPOTHESIS: n/a for a variance replicate; seed 44 refines the bs=2 spread. Provisional bs=2 mean after this = mean(0.8469, 0.6699, s44). (5) BUDGET (HARD 20min=1200s): bs=2 config = iter-7 939.5s / iter-16 1096.9s, both < 1200s (bs=2 has ~2-4min margin vs bs=1's wall-hugging 19.85-20.6min). max_train_s=1100 fences the TRAIN phase. train_n=2400 (<= OOM-safe cap). val=200 distinct val_truth.h5 cases, 256px inscribed-circle FOV (breast default). (6) do NOT return control mid-campaign; gate on iter-17 numeric-headroom obs via iter_wait.sh v3 then dispatch iter-18.", "run_id": "breast-ct-claude-agentic-itnet-v3-search-20260703-01", "runtime": {"elapsed_s": 1092.8721251487732}, "schema_version": 3, "solver_key": "itnet-v3", "solver_name": "ITNet v3", "split": {"train_n": 400, "val_n": 200}, "status": "keep", "ts": "2026-07-05T10:30:28Z"}
