{"advice_for_others": "manhart_pwls_tv-claude-agentic: val_n=200, pwls_gamma=1.0, pwls_weight_norm=mean, tv_lambda=0.001, tv_iterations=800, tv_lr=0.01, tv_decay=0.01, tv_optimizer=gd, tv_init=fbp, rationale=iter-5 CONVERGENCE-2. iter-4 (tv_iterations 200->400) lifted hr 0.1665->0.2178 (ssim 0.96->0.9715): the GD data-consistency solve was NOT converged; more iters help. ONE knob: tv_iterations 400->800 (same lambda=1e-3, lr=0.01, gamma=1.0). HYPOTHESIS: if 800 iters still climbs past 0.2178 the solve is still convergence-limited (keep pushing/raise lr); if it saturates ~0.2178 GD has converged and I pivot to lr or lambda for a better-regularized optimum. Budget: iter-4 388s at 400 iters -> ~780s at 800, <<1200s.", "agent": "manhart_pwls_tv-claude-agentic", "campaign": "search-20260703-01", "cfg_full": {"pwls_gamma": 1.0, "pwls_weight_norm": "mean", "rationale": "iter-5 CONVERGENCE-2. iter-4 (tv_iterations 200->400) lifted hr 0.1665->0.2178 (ssim 0.96->0.9715): the GD data-consistency solve was NOT converged; more iters help. ONE knob: tv_iterations 400->800 (same lambda=1e-3, lr=0.01, gamma=1.0). HYPOTHESIS: if 800 iters still climbs past 0.2178 the solve is still convergence-limited (keep pushing/raise lr); if it saturates ~0.2178 GD has converged and I pivot to lr or lambda for a better-regularized optimum. Budget: iter-4 388s at 400 iters -> ~780s at 800, <<1200s.", "tv_decay": 0.01, "tv_init": "fbp", "tv_iterations": 800, "tv_lambda": 0.001, "tv_lr": 0.01, "tv_optimizer": "gd", "val_n": 200}, "challenge": "breast_ct", "change_class": "architecture", "git_commit": "671da566", "images": {"comparison": "runs/breast-ct-claude-agentic-manhart-pwls-tv-search-20260703-01/iterations/iter-0005/comparison.png", "test_showcase": null, "valtest_showcase": null}, "iter": 5, "kept": true, "metrics": {"headroom": 0.2634728333036692, "headroom_std": null, "val_psnr": 38.98042297363281, "val_psnr_std": null, "val_rmse": 0.0038404616061598063, "val_rmse_std": null, "val_ssim": 0.9794023633003235, "val_ssim_std": null}, "model": "claude-opus-4-8-1m", "obs_path": "breast-ct-claude-agentic-manhart-pwls-tv-search-20260703-01/iterations/iter-0005/observation.json", "obs_sha1": "bd6455538fa3f2026f739fb368e85744b4053883", "params_M": 0.0, "params_source": "observation", "rationale": "manhart_pwls_tv-claude-agentic: val_n=200, pwls_gamma=1.0, pwls_weight_norm=mean, tv_lambda=0.001, tv_iterations=800, tv_lr=0.01, tv_decay=0.01, tv_optimizer=gd, tv_init=fbp, rationale=iter-5 CONVERGENCE-2. iter-4 (tv_iterations 200->400) lifted hr 0.1665->0.2178 (ssim 0.96->0.9715): the GD data-consistency solve was NOT converged; more iters help. ONE knob: tv_iterations 400->800 (same lambda=1e-3, lr=0.01, gamma=1.0). HYPOTHESIS: if 800 iters still climbs past 0.2178 the solve is still convergence-limited (keep pushing/raise lr); if it saturates ~0.2178 GD has converged and I pivot to lr or lambda for a better-regularized optimum. Budget: iter-4 388s at 400 iters -> ~780s at 800, <<1200s.", "run_id": "breast-ct-claude-agentic-manhart-pwls-tv-search-20260703-01", "runtime": {"elapsed_s": 717.8318042755127}, "schema_version": 3, "solver_key": "manhart-pwls-tv", "solver_name": "Manhart PWLS-TV (ray-weighted)", "split": {"train_n": 400, "val_n": 200}, "status": "keep", "ts": "2026-07-04T08:41:10Z"}
{"advice_for_others": "manhart_pwls_tv-claude-agentic: val_n=200, pwls_gamma=1.0, pwls_weight_norm=mean, tv_lambda=0.001, tv_iterations=1000, tv_lr=0.01, tv_decay=0.01, tv_optimizer=gd, tv_init=fbp, rationale=iter-6 SATURATION probe. iter-5 (800 iters) hr=0.2635 (best), up from iter-4 (400) 0.2178. Slurm log: the DATA term is FLAT at 0.740 from iter 450->800 (data-consistency CONVERGED) while the TV term keeps dropping (100684->92709) -> the 0.2178->0.2635 gain is from continued TV smoothing, still net-beneficial. ONE knob: tv_iterations 800->1000 (same lambda=1e-3, lr=0.01, gamma=1.0). HYPOTHESIS: if hr still climbs past 0.2635 the TV-smoothing optimum is not reached (then reach it faster via higher lambda next); if it saturates ~0.2635 GD+TV has converged and I pivot to lambda/optimizer. Budget: iter-5 717.8s total at 800 iters -> ~900s at 1000, still <1200s wall.", "agent": "manhart_pwls_tv-claude-agentic", "campaign": "search-20260703-01", "cfg_full": {"pwls_gamma": 1.0, "pwls_weight_norm": "mean", "rationale": "iter-6 SATURATION probe. iter-5 (800 iters) hr=0.2635 (best), up from iter-4 (400) 0.2178. Slurm log: the DATA term is FLAT at 0.740 from iter 450->800 (data-consistency CONVERGED) while the TV term keeps dropping (100684->92709) -> the 0.2178->0.2635 gain is from continued TV smoothing, still net-beneficial. ONE knob: tv_iterations 800->1000 (same lambda=1e-3, lr=0.01, gamma=1.0). HYPOTHESIS: if hr still climbs past 0.2635 the TV-smoothing optimum is not reached (then reach it faster via higher lambda next); if it saturates ~0.2635 GD+TV has converged and I pivot to lambda/optimizer. Budget: iter-5 717.8s total at 800 iters -> ~900s at 1000, still <1200s wall.", "tv_decay": 0.01, "tv_init": "fbp", "tv_iterations": 1000, "tv_lambda": 0.001, "tv_lr": 0.01, "tv_optimizer": "gd", "val_n": 200}, "challenge": "breast_ct", "change_class": "architecture", "git_commit": "671da566", "images": {"comparison": "runs/breast-ct-claude-agentic-manhart-pwls-tv-search-20260703-01/iterations/iter-0006/comparison.png", "test_showcase": null, "valtest_showcase": null}, "iter": 6, "kept": true, "metrics": {"headroom": 0.27629800486515443, "headroom_std": null, "val_psnr": 39.132999420166016, "val_psnr_std": null, "val_rmse": 0.0037735875230282545, "val_rmse_std": null, "val_ssim": 0.9814026951789856, "val_ssim_std": null}, "model": "claude-opus-4-8-1m", "obs_path": "breast-ct-claude-agentic-manhart-pwls-tv-search-20260703-01/iterations/iter-0006/observation.json", "obs_sha1": "3a9645011765d00e1313270d3c29934884bfd588", "params_M": 0.0, "params_source": "observation", "rationale": "manhart_pwls_tv-claude-agentic: val_n=200, pwls_gamma=1.0, pwls_weight_norm=mean, tv_lambda=0.001, tv_iterations=1000, tv_lr=0.01, tv_decay=0.01, tv_optimizer=gd, tv_init=fbp, rationale=iter-6 SATURATION probe. iter-5 (800 iters) hr=0.2635 (best), up from iter-4 (400) 0.2178. Slurm log: the DATA term is FLAT at 0.740 from iter 450->800 (data-consistency CONVERGED) while the TV term keeps dropping (100684->92709) -> the 0.2178->0.2635 gain is from continued TV smoothing, still net-beneficial. ONE knob: tv_iterations 800->1000 (same lambda=1e-3, lr=0.01, gamma=1.0). HYPOTHESIS: if hr still climbs past 0.2635 the TV-smoothing optimum is not reached (then reach it faster via higher lambda next); if it saturates ~0.2635 GD+TV has converged and I pivot to lambda/optimizer. Budget: iter-5 717.8s total at 800 iters -> ~900s at 1000, still <1200s wall.", "run_id": "breast-ct-claude-agentic-manhart-pwls-tv-search-20260703-01", "runtime": {"elapsed_s": 848.6255488395691}, "schema_version": 3, "solver_key": "manhart-pwls-tv", "solver_name": "Manhart PWLS-TV (ray-weighted)", "split": {"train_n": 400, "val_n": 200}, "status": "keep", "ts": "2026-07-04T10:27:17Z"}
{"advice_for_others": "manhart_pwls_tv-claude-agentic: val_n=200, pwls_gamma=1.0, pwls_weight_norm=mean, tv_lambda=0.002, tv_iterations=1000, tv_lr=0.01, tv_decay=0.01, tv_optimizer=gd, tv_init=fbp, rationale=iter-7 REGULARIZATION knob (efficiency pivot). iters 200->400->800->1000 lifted hr 0.1665->0.2178->0.2635->0.2763 monotonically, BUT the data term converged by ~iter 450 (flat 0.740) so all gains are continued TV smoothing, and runtime is now 848s@1000it (wall=1200s) \u2014 adding raw iters is nearly exhausted. Reach a smoother optimum PER STEP instead. ONE knob: tv_lambda 0.001->0.002 (2x stronger TV), iterations kept at 1000, gamma=1.0. HYPOTHESIS: stronger TV reaches a more-smoothed optimum in the same 1000 iters so hr rises past 0.2763 at ~same 848s runtime; if it over-smooths (hr drops, fine structure lost) the lambda=1e-3 optimum was near-best and I back toward 1.5e-3. Budget: ~848s, <1200s wall.", "agent": "manhart_pwls_tv-claude-agentic", "campaign": "search-20260703-01", "cfg_full": {"pwls_gamma": 1.0, "pwls_weight_norm": "mean", "rationale": "iter-7 REGULARIZATION knob (efficiency pivot). iters 200->400->800->1000 lifted hr 0.1665->0.2178->0.2635->0.2763 monotonically, BUT the data term converged by ~iter 450 (flat 0.740) so all gains are continued TV smoothing, and runtime is now 848s@1000it (wall=1200s) \u2014 adding raw iters is nearly exhausted. Reach a smoother optimum PER STEP instead. ONE knob: tv_lambda 0.001->0.002 (2x stronger TV), iterations kept at 1000, gamma=1.0. HYPOTHESIS: stronger TV reaches a more-smoothed optimum in the same 1000 iters so hr rises past 0.2763 at ~same 848s runtime; if it over-smooths (hr drops, fine structure lost) the lambda=1e-3 optimum was near-best and I back toward 1.5e-3. Budget: ~848s, <1200s wall.", "tv_decay": 0.01, "tv_init": "fbp", "tv_iterations": 1000, "tv_lambda": 0.002, "tv_lr": 0.01, "tv_optimizer": "gd", "val_n": 200}, "challenge": "breast_ct", "change_class": "architecture", "git_commit": "671da566", "images": {"comparison": "runs/breast-ct-claude-agentic-manhart-pwls-tv-search-20260703-01/iterations/iter-0007/comparison.png", "test_showcase": null, "valtest_showcase": null}, "iter": 7, "kept": true, "metrics": {"headroom": 0.35522401295493167, "headroom_std": null, "val_psnr": 40.136024475097656, "val_psnr_std": null, "val_rmse": 0.0033620449248701334, "val_rmse_std": null, "val_ssim": 0.9909402132034302, "val_ssim_std": null}, "model": "claude-opus-4-8-1m", "obs_path": "breast-ct-claude-agentic-manhart-pwls-tv-search-20260703-01/iterations/iter-0007/observation.json", "obs_sha1": "bd3dd521019c8fd85e1e8e6574a4cfc5ce69c8f6", "params_M": 0.0, "params_source": "observation", "rationale": "manhart_pwls_tv-claude-agentic: val_n=200, pwls_gamma=1.0, pwls_weight_norm=mean, tv_lambda=0.002, tv_iterations=1000, tv_lr=0.01, tv_decay=0.01, tv_optimizer=gd, tv_init=fbp, rationale=iter-7 REGULARIZATION knob (efficiency pivot). iters 200->400->800->1000 lifted hr 0.1665->0.2178->0.2635->0.2763 monotonically, BUT the data term converged by ~iter 450 (flat 0.740) so all gains are continued TV smoothing, and runtime is now 848s@1000it (wall=1200s) \u2014 adding raw iters is nearly exhausted. Reach a smoother optimum PER STEP instead. ONE knob: tv_lambda 0.001->0.002 (2x stronger TV), iterations kept at 1000, gamma=1.0. HYPOTHESIS: stronger TV reaches a more-smoothed optimum in the same 1000 iters so hr rises past 0.2763 at ~same 848s runtime; if it over-smooths (hr drops, fine structure lost) the lambda=1e-3 optimum was near-best and I back toward 1.5e-3. Budget: ~848s, <1200s wall.", "run_id": "breast-ct-claude-agentic-manhart-pwls-tv-search-20260703-01", "runtime": {"elapsed_s": 859.7468054294586}, "schema_version": 3, "solver_key": "manhart-pwls-tv", "solver_name": "Manhart PWLS-TV (ray-weighted)", "split": {"train_n": 400, "val_n": 200}, "status": "keep", "ts": "2026-07-04T14:24:34Z"}
{"advice_for_others": "manhart_pwls_tv-claude-agentic: val_n=200, pwls_gamma=1.0, pwls_weight_norm=mean, tv_lambda=0.004, tv_iterations=1000, tv_lr=0.01, tv_decay=0.01, tv_optimizer=gd, tv_init=fbp, rationale=iter-8 LAMBDA sweep up. iter-7 tv_lambda 0.001->0.002 jumped hr 0.2763->0.3552 (ssim 0.9814->0.9909) at 1000 iters \u2014 TV was underweighted; stronger TV is strongly productive and not yet over-smoothing. ONE knob: tv_lambda 0.002->0.004 (2x), iterations kept 1000, gamma=1.0. HYPOTHESIS: if hr rises past 0.3552 TV is still underweighted (keep climbing lambda); if hr drops (over-smoothing loses fine breast structure) the optimum is between 2e-3 and 4e-3 and I bisect (~3e-3). Budget: iter-7 860s at 1000 iters -> ~860s, <1200s wall.", "agent": "manhart_pwls_tv-claude-agentic", "campaign": "search-20260703-01", "cfg_full": {"pwls_gamma": 1.0, "pwls_weight_norm": "mean", "rationale": "iter-8 LAMBDA sweep up. iter-7 tv_lambda 0.001->0.002 jumped hr 0.2763->0.3552 (ssim 0.9814->0.9909) at 1000 iters \u2014 TV was underweighted; stronger TV is strongly productive and not yet over-smoothing. ONE knob: tv_lambda 0.002->0.004 (2x), iterations kept 1000, gamma=1.0. HYPOTHESIS: if hr rises past 0.3552 TV is still underweighted (keep climbing lambda); if hr drops (over-smoothing loses fine breast structure) the optimum is between 2e-3 and 4e-3 and I bisect (~3e-3). Budget: iter-7 860s at 1000 iters -> ~860s, <1200s wall.", "tv_decay": 0.01, "tv_init": "fbp", "tv_iterations": 1000, "tv_lambda": 0.004, "tv_lr": 0.01, "tv_optimizer": "gd", "val_n": 200}, "challenge": "breast_ct", "change_class": "architecture", "git_commit": "671da566", "images": {"comparison": "runs/breast-ct-claude-agentic-manhart-pwls-tv-search-20260703-01/iterations/iter-0008/comparison.png", "test_showcase": null, "valtest_showcase": null}, "iter": 8, "kept": true, "metrics": {"headroom": 0.3335755580955865, "headroom_std": null, "val_psnr": 39.849178314208984, "val_psnr_std": null, "val_rmse": 0.003474926110357046, "val_rmse_std": null, "val_ssim": 0.9886202216148376, "val_ssim_std": null}, "model": "claude-opus-4-8-1m", "obs_path": "breast-ct-claude-agentic-manhart-pwls-tv-search-20260703-01/iterations/iter-0008/observation.json", "obs_sha1": "708761d0c5f2111725696adc6afd41ecb9d79fba", "params_M": 0.0, "params_source": "observation", "rationale": "manhart_pwls_tv-claude-agentic: val_n=200, pwls_gamma=1.0, pwls_weight_norm=mean, tv_lambda=0.004, tv_iterations=1000, tv_lr=0.01, tv_decay=0.01, tv_optimizer=gd, tv_init=fbp, rationale=iter-8 LAMBDA sweep up. iter-7 tv_lambda 0.001->0.002 jumped hr 0.2763->0.3552 (ssim 0.9814->0.9909) at 1000 iters \u2014 TV was underweighted; stronger TV is strongly productive and not yet over-smoothing. ONE knob: tv_lambda 0.002->0.004 (2x), iterations kept 1000, gamma=1.0. HYPOTHESIS: if hr rises past 0.3552 TV is still underweighted (keep climbing lambda); if hr drops (over-smoothing loses fine breast structure) the optimum is between 2e-3 and 4e-3 and I bisect (~3e-3). Budget: iter-7 860s at 1000 iters -> ~860s, <1200s wall.", "run_id": "breast-ct-claude-agentic-manhart-pwls-tv-search-20260703-01", "runtime": {"elapsed_s": 847.3892769813538}, "schema_version": 3, "solver_key": "manhart-pwls-tv", "solver_name": "Manhart PWLS-TV (ray-weighted)", "split": {"train_n": 400, "val_n": 200}, "status": "keep", "ts": "2026-07-05T03:24:22Z"}
{"advice_for_others": "manhart_pwls_tv-claude-agentic: val_n=200, pwls_gamma=1.0, pwls_weight_norm=mean, tv_lambda=0.003, tv_iterations=1000, tv_lr=0.01, tv_decay=0.01, tv_optimizer=gd, tv_init=fbp, rationale=iter-9 LAMBDA bisection. iter-7 (lambda=2e-3) hr=0.3552 BEST; iter-8 (lambda=4e-3) hr=0.3336 DROPPED (over-smoothed, fine breast structure lost) => interior lambda optimum bracketed in (2e-3, 4e-3). ONE knob: tv_lambda -> 0.003 (midpoint), iterations 1000, gamma=1.0. HYPOTHESIS: if hr>0.3552 the peak is near 3e-3; if hr<0.3552 the optimum is at/below 2e-3 and I test 1.5e-3 next. Budget: ~850s at 1000 iters, <1200s wall.", "agent": "manhart_pwls_tv-claude-agentic", "campaign": "search-20260703-01", "cfg_full": {"pwls_gamma": 1.0, "pwls_weight_norm": "mean", "rationale": "iter-9 LAMBDA bisection. iter-7 (lambda=2e-3) hr=0.3552 BEST; iter-8 (lambda=4e-3) hr=0.3336 DROPPED (over-smoothed, fine breast structure lost) => interior lambda optimum bracketed in (2e-3, 4e-3). ONE knob: tv_lambda -> 0.003 (midpoint), iterations 1000, gamma=1.0. HYPOTHESIS: if hr>0.3552 the peak is near 3e-3; if hr<0.3552 the optimum is at/below 2e-3 and I test 1.5e-3 next. Budget: ~850s at 1000 iters, <1200s wall.", "tv_decay": 0.01, "tv_init": "fbp", "tv_iterations": 1000, "tv_lambda": 0.003, "tv_lr": 0.01, "tv_optimizer": "gd", "val_n": 200}, "challenge": "breast_ct", "change_class": "architecture", "git_commit": "671da566", "images": {"comparison": "runs/breast-ct-claude-agentic-manhart-pwls-tv-search-20260703-01/iterations/iter-0009/comparison.png", "test_showcase": null, "valtest_showcase": null}, "iter": 9, "kept": true, "metrics": {"headroom": 0.35964474138138125, "headroom_std": 0.015624216526327481, "val_psnr": 40.195777893066406, "val_psnr_std": 0.5682804032273038, "val_rmse": 0.0033389939926564693, "val_rmse_std": 0.00021263991422567477, "val_ssim": 0.9907816052436829, "val_ssim_std": 0.0016732377924869042}, "model": "claude-opus-4-8-1m", "obs_path": "breast-ct-claude-agentic-manhart-pwls-tv-search-20260703-01/iterations/iter-0009/observation.json", "obs_sha1": "4b42c6277e487c9c8ea4cda3546ae5be5e4a1aed", "params_M": 0.0, "params_source": "observation", "rationale": "manhart_pwls_tv-claude-agentic: val_n=200, pwls_gamma=1.0, pwls_weight_norm=mean, tv_lambda=0.003, tv_iterations=1000, tv_lr=0.01, tv_decay=0.01, tv_optimizer=gd, tv_init=fbp, rationale=iter-9 LAMBDA bisection. iter-7 (lambda=2e-3) hr=0.3552 BEST; iter-8 (lambda=4e-3) hr=0.3336 DROPPED (over-smoothed, fine breast structure lost) => interior lambda optimum bracketed in (2e-3, 4e-3). ONE knob: tv_lambda -> 0.003 (midpoint), iterations 1000, gamma=1.0. HYPOTHESIS: if hr>0.3552 the peak is near 3e-3; if hr<0.3552 the optimum is at/below 2e-3 and I test 1.5e-3 next. Budget: ~850s at 1000 iters, <1200s wall.", "run_id": "breast-ct-claude-agentic-manhart-pwls-tv-search-20260703-01", "runtime": {"elapsed_s": 867.8383164405823}, "schema_version": 3, "solver_key": "manhart-pwls-tv", "solver_name": "Manhart PWLS-TV (ray-weighted)", "split": {"train_n": 400, "val_n": 200}, "status": "keep", "ts": "2026-07-05T05:24:42Z"}
{"advice_for_others": "manhart_pwls_tv-claude-agentic: val_n=200, pwls_gamma=1.0, pwls_weight_norm=mean, tv_lambda=0.003, tv_iterations=1000, tv_lr=0.01, tv_decay=0.01, tv_optimizer=adam, tv_init=fbp, rationale=iter-10 OPTIMIZER pivot. Lambda peak located and shallow: lambda 2e-3->0.3552, 3e-3->0.3596 (BEST), 4e-3->0.3336; further lambda bisection is sub-0.005 noise-floor. Data term converged by ~iter450 while TV term still descended at iter-1000 in earlier GD logs => the TV minimum may be under-converged by plain GD. ONE knob: tv_optimizer gd->adam (keep lambda=3e-3, 1000 iters, lr=0.01, gamma=1.0). HYPOTHESIS: Adam's adaptive per-parameter steps reach a deeper TV minimum than plain GD in the same 1000 iters so hr rises past 0.3596; if Adam overshoots/destabilizes (hr drops) GD was better and I revert then tune lr. Watch: adam at lr=0.01 may be aggressive. Budget: ~870s at 1000 iters, <1200s wall.", "agent": "manhart_pwls_tv-claude-agentic", "campaign": "search-20260703-01", "cfg_full": {"pwls_gamma": 1.0, "pwls_weight_norm": "mean", "rationale": "iter-10 OPTIMIZER pivot. Lambda peak located and shallow: lambda 2e-3->0.3552, 3e-3->0.3596 (BEST), 4e-3->0.3336; further lambda bisection is sub-0.005 noise-floor. Data term converged by ~iter450 while TV term still descended at iter-1000 in earlier GD logs => the TV minimum may be under-converged by plain GD. ONE knob: tv_optimizer gd->adam (keep lambda=3e-3, 1000 iters, lr=0.01, gamma=1.0). HYPOTHESIS: Adam's adaptive per-parameter steps reach a deeper TV minimum than plain GD in the same 1000 iters so hr rises past 0.3596; if Adam overshoots/destabilizes (hr drops) GD was better and I revert then tune lr. Watch: adam at lr=0.01 may be aggressive. Budget: ~870s at 1000 iters, <1200s wall.", "tv_decay": 0.01, "tv_init": "fbp", "tv_iterations": 1000, "tv_lambda": 0.003, "tv_lr": 0.01, "tv_optimizer": "adam", "val_n": 200}, "challenge": "breast_ct", "change_class": "architecture", "git_commit": "671da566", "images": {"comparison": "runs/breast-ct-claude-agentic-manhart-pwls-tv-search-20260703-01/iterations/iter-0010/comparison.png", "test_showcase": null, "valtest_showcase": null}, "iter": 10, "kept": false, "metrics": {"headroom": 0.0, "headroom_std": null, "val_psnr": 17.708871841430664, "val_psnr_std": null, "val_rmse": 0.04445911943912506, "val_rmse_std": null, "val_ssim": 0.7423549294471741, "val_ssim_std": null}, "model": "claude-opus-4-8-1m", "obs_path": "breast-ct-claude-agentic-manhart-pwls-tv-search-20260703-01/iterations/iter-0010/observation.json", "obs_sha1": "7e290b687669b972cd72b78dbb64156ce68c5db3", "params_M": 0.0, "params_source": "observation", "rationale": "manhart_pwls_tv-claude-agentic: val_n=200, pwls_gamma=1.0, pwls_weight_norm=mean, tv_lambda=0.003, tv_iterations=1000, tv_lr=0.01, tv_decay=0.01, tv_optimizer=adam, tv_init=fbp, rationale=iter-10 OPTIMIZER pivot. Lambda peak located and shallow: lambda 2e-3->0.3552, 3e-3->0.3596 (BEST), 4e-3->0.3336; further lambda bisection is sub-0.005 noise-floor. Data term converged by ~iter450 while TV term still descended at iter-1000 in earlier GD logs => the TV minimum may be under-converged by plain GD. ONE knob: tv_optimizer gd->adam (keep lambda=3e-3, 1000 iters, lr=0.01, gamma=1.0). HYPOTHESIS: Adam's adaptive per-parameter steps reach a deeper TV minimum than plain GD in the same 1000 iters so hr rises past 0.3596; if Adam overshoots/destabilizes (hr drops) GD was better and I revert then tune lr. Watch: adam at lr=0.01 may be aggressive. Budget: ~870s at 1000 iters, <1200s wall.", "run_id": "breast-ct-claude-agentic-manhart-pwls-tv-search-20260703-01", "runtime": {"elapsed_s": 864.4712958335876}, "schema_version": 3, "solver_key": "manhart-pwls-tv", "solver_name": "Manhart PWLS-TV (ray-weighted)", "split": {"train_n": 400, "val_n": 200}, "status": "discard", "ts": "2026-07-05T06:25:07Z"}
