{"advice_for_others": "fastdiff_wdm_wavelet_unconstrained-claude-agentic: val_n=200, seed=42, fd_recon_ckpt=/cluster/maier/Agent4CT/checkpoints/fast_diffusion_wavelet_breast.pt, fd_recon_steps=8, fd_recon_init=fbp, fd_recon_init_t=0.5, fd_recon_eta=0.5, fd_recon_dc=0, fd_recon_dc_n_cg=5, fd_recon_dc_relax=0.5, dataset_kind=breast_ct, rationale=iter-6 ETA DOWN, breast-native wdm-wavelet UNCONSTRAINED (DC OFF). SIX-BOX: (1) PRIOR: eta=2.0 (iter-5) BLEW UP rmse to 0.03027 (ssim0.454) vs eta=1.0 (iter-4) rmse0.01360 at same t=0.5. Stronger DPS-soft-gradient WITHOUT the hard CG projection over-corrects and diverges -- DPS-alone is an unprojected gradient step, not a proper solve. (2) Failure mode: too-strong soft guidance destabilizes; the sweet spot is LOW eta where the prior mostly denoises the FBP warm-start. (3) ONE KNOB: fd_recon_eta 1.0->0.5 at locked t=0.5, steps=8. (4) HYPOTHESIS: lower eta lets the recon stay near the FBP warm-start -> rmse at/below the eta=1.0 value (0.01360). Maps the eta minimum. If even the best (t,eta,steps) cannot clear hr>0, it confirms prior+DPS WITHOUT hard-CG DC is structurally below the calibrated FBP baseline on sparse breast. (5) BUDGET: <5min. (6) Loop continues.", "agent": "fastdiff_wdm_wavelet_unconstrained-claude-agentic", "campaign": "search-20260703-01", "cfg_full": {"dataset_kind": "breast_ct", "fd_recon_ckpt": "/cluster/maier/Agent4CT/checkpoints/fast_diffusion_wavelet_breast.pt", "fd_recon_dc": 0, "fd_recon_dc_n_cg": 5, "fd_recon_dc_relax": 0.5, "fd_recon_eta": 0.5, "fd_recon_init": "fbp", "fd_recon_init_t": 0.5, "fd_recon_steps": 8, "rationale": "iter-6 ETA DOWN, breast-native wdm-wavelet UNCONSTRAINED (DC OFF). SIX-BOX: (1) PRIOR: eta=2.0 (iter-5) BLEW UP rmse to 0.03027 (ssim0.454) vs eta=1.0 (iter-4) rmse0.01360 at same t=0.5. Stronger DPS-soft-gradient WITHOUT the hard CG projection over-corrects and diverges -- DPS-alone is an unprojected gradient step, not a proper solve. (2) Failure mode: too-strong soft guidance destabilizes; the sweet spot is LOW eta where the prior mostly denoises the FBP warm-start. (3) ONE KNOB: fd_recon_eta 1.0->0.5 at locked t=0.5, steps=8. (4) HYPOTHESIS: lower eta lets the recon stay near the FBP warm-start -> rmse at/below the eta=1.0 value (0.01360). Maps the eta minimum. If even the best (t,eta,steps) cannot clear hr>0, it confirms prior+DPS WITHOUT hard-CG DC is structurally below the calibrated FBP baseline on sparse breast. (5) BUDGET: <5min. (6) Loop continues.", "seed": 42, "val_n": 200}, "challenge": "breast_ct", "change_class": "architecture", "git_commit": "671da566", "images": {"comparison": "runs/breast-ct-claude-agentic-fastdiff-wdm-wavelet-unconstrained-search-20260703-01/iterations/iter-0006/comparison.png", "test_showcase": null, "valtest_showcase": null}, "iter": 6, "kept": false, "metrics": {"headroom": 0.0, "headroom_std": 0.0, "val_psnr": 29.269485473632812, "val_psnr_std": 1.0574003067845048, "val_rmse": 0.011747085489332676, "val_rmse_std": 0.0014523182731518733, "val_ssim": 0.9037923812866211, "val_ssim_std": 0.010906021625626362}, "model": "claude-opus-4-8-1m", "obs_path": "breast-ct-claude-agentic-fastdiff-wdm-wavelet-unconstrained-search-20260703-01/iterations/iter-0006/observation.json", "obs_sha1": "f6b0c52ddf109ee30b88ae85432d75ed9c79a7af", "params_M": 3.824908, "params_source": "observation", "rationale": "fastdiff_wdm_wavelet_unconstrained-claude-agentic: val_n=200, seed=42, fd_recon_ckpt=/cluster/maier/Agent4CT/checkpoints/fast_diffusion_wavelet_breast.pt, fd_recon_steps=8, fd_recon_init=fbp, fd_recon_init_t=0.5, fd_recon_eta=0.5, fd_recon_dc=0, fd_recon_dc_n_cg=5, fd_recon_dc_relax=0.5, dataset_kind=breast_ct, rationale=iter-6 ETA DOWN, breast-native wdm-wavelet UNCONSTRAINED (DC OFF). SIX-BOX: (1) PRIOR: eta=2.0 (iter-5) BLEW UP rmse to 0.03027 (ssim0.454) vs eta=1.0 (iter-4) rmse0.01360 at same t=0.5. Stronger DPS-soft-gradient WITHOUT the hard CG projection over-corrects and diverges -- DPS-alone is an unprojected gradient step, not a proper solve. (2) Failure mode: too-strong soft guidance destabilizes; the sweet spot is LOW eta where the prior mostly denoises the FBP warm-start. (3) ONE KNOB: fd_recon_eta 1.0->0.5 at locked t=0.5, steps=8. (4) HYPOTHESIS: lower eta lets the recon stay near the FBP warm-start -> rmse at/below the eta=1.0 value (0.01360). Maps the eta minimum. If even the best (t,eta,steps) cannot clear hr>0, it confirms prior+DPS WITHOUT hard-CG DC is structurally below the calibrated FBP baseline on sparse breast. (5) BUDGET: <5min. (6) Loop continues.", "run_id": "breast-ct-claude-agentic-fastdiff-wdm-wavelet-unconstrained-search-20260703-01", "runtime": {"elapsed_s": 72.01854419708252}, "schema_version": 3, "solver_key": "fastdiff-wdm-wavelet-unconstrained", "solver_name": "Fast-diffusion WDM (wavelet, unconstrained)", "split": {"train_n": 3600, "val_n": 200}, "status": "discard", "ts": "2026-07-07T01:29:15Z"}
{"advice_for_others": "fastdiff_wdm_wavelet_unconstrained-claude-agentic: val_n=200, seed=42, fd_recon_ckpt=/cluster/maier/Agent4CT/checkpoints/fast_diffusion_wavelet_breast.pt, fd_recon_steps=8, fd_recon_init=fbp, fd_recon_init_t=0.5, fd_recon_eta=0.2, fd_recon_dc=0, fd_recon_dc_n_cg=5, fd_recon_dc_relax=0.5, dataset_kind=breast_ct, rationale=iter-7 ETA lower still, breast-native wdm-wavelet UNCONSTRAINED (DC OFF). SIX-BOX: (1) PRIOR: eta sweep at t=0.5 MONOTONIC DOWN: eta2.0 rmse0.03027, eta1.0 rmse0.01360, eta0.5 rmse0.01175 (BEST, ssim0.904). Less DPS = better because DPS-without-hard-CG over-corrects. (2) Failure mode: any nonzero DPS soft-gradient perturbs the FBP warm-start off-manifold; the prior alone denoising the FBP is the strongest DC-off mode. (3) ONE KNOB: fd_recon_eta 0.5->0.2 at t=0.5, steps=8. (4) HYPOTHESIS: eta=0.2 rmse below 0.01175, approaching the pure-prior-denoise limit (eta->0). Tests whether even the optimal DC-off recon (prior-denoised FBP, minimal DPS) clears the calibrated FBP baseline. (5) BUDGET: <5min. (6) Loop continues.", "agent": "fastdiff_wdm_wavelet_unconstrained-claude-agentic", "campaign": "search-20260703-01", "cfg_full": {"dataset_kind": "breast_ct", "fd_recon_ckpt": "/cluster/maier/Agent4CT/checkpoints/fast_diffusion_wavelet_breast.pt", "fd_recon_dc": 0, "fd_recon_dc_n_cg": 5, "fd_recon_dc_relax": 0.5, "fd_recon_eta": 0.2, "fd_recon_init": "fbp", "fd_recon_init_t": 0.5, "fd_recon_steps": 8, "rationale": "iter-7 ETA lower still, breast-native wdm-wavelet UNCONSTRAINED (DC OFF). SIX-BOX: (1) PRIOR: eta sweep at t=0.5 MONOTONIC DOWN: eta2.0 rmse0.03027, eta1.0 rmse0.01360, eta0.5 rmse0.01175 (BEST, ssim0.904). Less DPS = better because DPS-without-hard-CG over-corrects. (2) Failure mode: any nonzero DPS soft-gradient perturbs the FBP warm-start off-manifold; the prior alone denoising the FBP is the strongest DC-off mode. (3) ONE KNOB: fd_recon_eta 0.5->0.2 at t=0.5, steps=8. (4) HYPOTHESIS: eta=0.2 rmse below 0.01175, approaching the pure-prior-denoise limit (eta->0). Tests whether even the optimal DC-off recon (prior-denoised FBP, minimal DPS) clears the calibrated FBP baseline. (5) BUDGET: <5min. (6) Loop continues.", "seed": 42, "val_n": 200}, "challenge": "breast_ct", "change_class": "architecture", "git_commit": "671da566", "images": {"comparison": "runs/breast-ct-claude-agentic-fastdiff-wdm-wavelet-unconstrained-search-20260703-01/iterations/iter-0007/comparison.png", "test_showcase": null, "valtest_showcase": null}, "iter": 7, "kept": false, "metrics": {"headroom": 0.0, "headroom_std": 0.0, "val_psnr": 29.52541160583496, "val_psnr_std": 1.0540031091383883, "val_rmse": 0.011406014673411846, "val_rmse_std": 0.001396384578310376, "val_ssim": 0.9315074682235718, "val_ssim_std": 0.011941652230904456}, "model": "claude-opus-4-8-1m", "obs_path": "breast-ct-claude-agentic-fastdiff-wdm-wavelet-unconstrained-search-20260703-01/iterations/iter-0007/observation.json", "obs_sha1": "42a39b22d9e48c531c169c6ea82e0a9d10adf67b", "params_M": 3.824908, "params_source": "observation", "rationale": "fastdiff_wdm_wavelet_unconstrained-claude-agentic: val_n=200, seed=42, fd_recon_ckpt=/cluster/maier/Agent4CT/checkpoints/fast_diffusion_wavelet_breast.pt, fd_recon_steps=8, fd_recon_init=fbp, fd_recon_init_t=0.5, fd_recon_eta=0.2, fd_recon_dc=0, fd_recon_dc_n_cg=5, fd_recon_dc_relax=0.5, dataset_kind=breast_ct, rationale=iter-7 ETA lower still, breast-native wdm-wavelet UNCONSTRAINED (DC OFF). SIX-BOX: (1) PRIOR: eta sweep at t=0.5 MONOTONIC DOWN: eta2.0 rmse0.03027, eta1.0 rmse0.01360, eta0.5 rmse0.01175 (BEST, ssim0.904). Less DPS = better because DPS-without-hard-CG over-corrects. (2) Failure mode: any nonzero DPS soft-gradient perturbs the FBP warm-start off-manifold; the prior alone denoising the FBP is the strongest DC-off mode. (3) ONE KNOB: fd_recon_eta 0.5->0.2 at t=0.5, steps=8. (4) HYPOTHESIS: eta=0.2 rmse below 0.01175, approaching the pure-prior-denoise limit (eta->0). Tests whether even the optimal DC-off recon (prior-denoised FBP, minimal DPS) clears the calibrated FBP baseline. (5) BUDGET: <5min. (6) Loop continues.", "run_id": "breast-ct-claude-agentic-fastdiff-wdm-wavelet-unconstrained-search-20260703-01", "runtime": {"elapsed_s": 76.85761666297913}, "schema_version": 3, "solver_key": "fastdiff-wdm-wavelet-unconstrained", "solver_name": "Fast-diffusion WDM (wavelet, unconstrained)", "split": {"train_n": 3600, "val_n": 200}, "status": "discard", "ts": "2026-07-07T01:31:17Z"}
{"advice_for_others": "fastdiff_wdm_wavelet_unconstrained-claude-agentic: val_n=200, seed=42, fd_recon_ckpt=/cluster/maier/Agent4CT/checkpoints/fast_diffusion_wavelet_breast.pt, fd_recon_steps=8, fd_recon_init=fbp, fd_recon_init_t=0.5, fd_recon_eta=0.0, fd_recon_dc=0, fd_recon_dc_n_cg=5, fd_recon_dc_relax=0.5, dataset_kind=breast_ct, rationale=iter-8 ETA=0 (pure prior, ZERO DPS), breast-native wdm-wavelet UNCONSTRAINED (DC OFF). SIX-BOX: (1) PRIOR: eta down monotonic at t=0.5: 2.0->0.0303, 1.0->0.0136, 0.5->0.01175, 0.2->0.01141 (BEST, ssim0.9315). Diminishing returns; extrapolate eta->0. (2) Failure mode: any DPS perturbs off-manifold; the pure prior-denoised-FBP is the theoretical DC-off floor. (3) ONE KNOB: fd_recon_eta 0.2->0.0 at t=0.5, steps=8 -- fully removes DPS soft-DC, leaving ONLY the wavelet prior denoising the FBP warm-start (the purest possible unconstrained/prior-standalone recon). (4) HYPOTHESIS: eta=0 gives the minimum DC-off rmse (~0.0114 or marginally below); if THIS cannot clear hr>0, the finding is definitive: the breast wavelet prior WITHOUT any data-consistency projection cannot beat the calibrated 128-view FBP baseline. (5) BUDGET: <5min. (6) Loop continues.", "agent": "fastdiff_wdm_wavelet_unconstrained-claude-agentic", "campaign": "search-20260703-01", "cfg_full": {"dataset_kind": "breast_ct", "fd_recon_ckpt": "/cluster/maier/Agent4CT/checkpoints/fast_diffusion_wavelet_breast.pt", "fd_recon_dc": 0, "fd_recon_dc_n_cg": 5, "fd_recon_dc_relax": 0.5, "fd_recon_eta": 0.0, "fd_recon_init": "fbp", "fd_recon_init_t": 0.5, "fd_recon_steps": 8, "rationale": "iter-8 ETA=0 (pure prior, ZERO DPS), breast-native wdm-wavelet UNCONSTRAINED (DC OFF). SIX-BOX: (1) PRIOR: eta down monotonic at t=0.5: 2.0->0.0303, 1.0->0.0136, 0.5->0.01175, 0.2->0.01141 (BEST, ssim0.9315). Diminishing returns; extrapolate eta->0. (2) Failure mode: any DPS perturbs off-manifold; the pure prior-denoised-FBP is the theoretical DC-off floor. (3) ONE KNOB: fd_recon_eta 0.2->0.0 at t=0.5, steps=8 -- fully removes DPS soft-DC, leaving ONLY the wavelet prior denoising the FBP warm-start (the purest possible unconstrained/prior-standalone recon). (4) HYPOTHESIS: eta=0 gives the minimum DC-off rmse (~0.0114 or marginally below); if THIS cannot clear hr>0, the finding is definitive: the breast wavelet prior WITHOUT any data-consistency projection cannot beat the calibrated 128-view FBP baseline. (5) BUDGET: <5min. (6) Loop continues.", "seed": 42, "val_n": 200}, "challenge": "breast_ct", "change_class": "architecture", "git_commit": "671da566", "images": {"comparison": "runs/breast-ct-claude-agentic-fastdiff-wdm-wavelet-unconstrained-search-20260703-01/iterations/iter-0008/comparison.png", "test_showcase": null, "valtest_showcase": null}, "iter": 8, "kept": false, "metrics": {"headroom": 0.0, "headroom_std": 0.0, "val_psnr": 29.608531951904297, "val_psnr_std": 0.9907401747845093, "val_rmse": 0.011297385208308697, "val_rmse_std": 0.001200510527382727, "val_ssim": 0.9378042221069336, "val_ssim_std": 0.012295738507825716}, "model": "claude-opus-4-8-1m", "obs_path": "breast-ct-claude-agentic-fastdiff-wdm-wavelet-unconstrained-search-20260703-01/iterations/iter-0008/observation.json", "obs_sha1": "18fedee84d48f6e8e0b0def57ddcfb84fd01a7b1", "params_M": 3.824908, "params_source": "observation", "rationale": "fastdiff_wdm_wavelet_unconstrained-claude-agentic: val_n=200, seed=42, fd_recon_ckpt=/cluster/maier/Agent4CT/checkpoints/fast_diffusion_wavelet_breast.pt, fd_recon_steps=8, fd_recon_init=fbp, fd_recon_init_t=0.5, fd_recon_eta=0.0, fd_recon_dc=0, fd_recon_dc_n_cg=5, fd_recon_dc_relax=0.5, dataset_kind=breast_ct, rationale=iter-8 ETA=0 (pure prior, ZERO DPS), breast-native wdm-wavelet UNCONSTRAINED (DC OFF). SIX-BOX: (1) PRIOR: eta down monotonic at t=0.5: 2.0->0.0303, 1.0->0.0136, 0.5->0.01175, 0.2->0.01141 (BEST, ssim0.9315). Diminishing returns; extrapolate eta->0. (2) Failure mode: any DPS perturbs off-manifold; the pure prior-denoised-FBP is the theoretical DC-off floor. (3) ONE KNOB: fd_recon_eta 0.2->0.0 at t=0.5, steps=8 -- fully removes DPS soft-DC, leaving ONLY the wavelet prior denoising the FBP warm-start (the purest possible unconstrained/prior-standalone recon). (4) HYPOTHESIS: eta=0 gives the minimum DC-off rmse (~0.0114 or marginally below); if THIS cannot clear hr>0, the finding is definitive: the breast wavelet prior WITHOUT any data-consistency projection cannot beat the calibrated 128-view FBP baseline. (5) BUDGET: <5min. (6) Loop continues.", "run_id": "breast-ct-claude-agentic-fastdiff-wdm-wavelet-unconstrained-search-20260703-01", "runtime": {"elapsed_s": 78.12966990470886}, "schema_version": 3, "solver_key": "fastdiff-wdm-wavelet-unconstrained", "solver_name": "Fast-diffusion WDM (wavelet, unconstrained)", "split": {"train_n": 3600, "val_n": 200}, "status": "discard", "ts": "2026-07-07T01:33:17Z"}
{"advice_for_others": "fastdiff_wdm_wavelet_unconstrained-claude-agentic: val_n=200, seed=42, fd_recon_ckpt=/cluster/maier/Agent4CT/checkpoints/fast_diffusion_wavelet_breast.pt, fd_recon_steps=16, fd_recon_init=fbp, fd_recon_init_t=0.5, fd_recon_eta=0.0, fd_recon_dc=0, fd_recon_dc_n_cg=5, fd_recon_dc_relax=0.5, dataset_kind=breast_ct, rationale=iter-9 STEPS (NFE) lever, breast-native wdm-wavelet UNCONSTRAINED (DC OFF). SIX-BOX: (1) PRIOR: eta minimized at 0.0 (pure prior denoise): t=0.5 eta0.0 rmse0.01130 (BEST, ssim0.938). eta sweep done; init_t min ~0.5. All hr=0; DC-off floor ~0.0113 vs calibrated FBP floor ~0.0044. (2) Failure mode: recon plateaus above baseline -- prior-denoised FBP retains sparse-view streak residual the prior does not fully remove without a projection. (3) ONE KNOB: fd_recon_steps 8->16 at t=0.5, eta=0.0. (4) HYPOTHESIS: more Euler steps = finer flow integration of the denoising trajectory -> marginally lower rmse; tests whether NFE (not just prior/DPS balance) is the limiter. If 16 steps ~= 8 steps, the ceiling is the prior itself, not integration granularity. (5) BUDGET: 16-step over 200 val still <10min. (6) Loop continues.", "agent": "fastdiff_wdm_wavelet_unconstrained-claude-agentic", "campaign": "search-20260703-01", "cfg_full": {"dataset_kind": "breast_ct", "fd_recon_ckpt": "/cluster/maier/Agent4CT/checkpoints/fast_diffusion_wavelet_breast.pt", "fd_recon_dc": 0, "fd_recon_dc_n_cg": 5, "fd_recon_dc_relax": 0.5, "fd_recon_eta": 0.0, "fd_recon_init": "fbp", "fd_recon_init_t": 0.5, "fd_recon_steps": 16, "rationale": "iter-9 STEPS (NFE) lever, breast-native wdm-wavelet UNCONSTRAINED (DC OFF). SIX-BOX: (1) PRIOR: eta minimized at 0.0 (pure prior denoise): t=0.5 eta0.0 rmse0.01130 (BEST, ssim0.938). eta sweep done; init_t min ~0.5. All hr=0; DC-off floor ~0.0113 vs calibrated FBP floor ~0.0044. (2) Failure mode: recon plateaus above baseline -- prior-denoised FBP retains sparse-view streak residual the prior does not fully remove without a projection. (3) ONE KNOB: fd_recon_steps 8->16 at t=0.5, eta=0.0. (4) HYPOTHESIS: more Euler steps = finer flow integration of the denoising trajectory -> marginally lower rmse; tests whether NFE (not just prior/DPS balance) is the limiter. If 16 steps ~= 8 steps, the ceiling is the prior itself, not integration granularity. (5) BUDGET: 16-step over 200 val still <10min. (6) Loop continues.", "seed": 42, "val_n": 200}, "challenge": "breast_ct", "change_class": "architecture", "git_commit": "671da566", "images": {"comparison": "runs/breast-ct-claude-agentic-fastdiff-wdm-wavelet-unconstrained-search-20260703-01/iterations/iter-0009/comparison.png", "test_showcase": null, "valtest_showcase": null}, "iter": 9, "kept": false, "metrics": {"headroom": 0.0, "headroom_std": 0.0, "val_psnr": 29.60144805908203, "val_psnr_std": 0.9964979682547348, "val_rmse": 0.011306601576507092, "val_rmse_std": 0.0012077611273119315, "val_ssim": 0.9407914280891418, "val_ssim_std": 0.012491781038319619}, "model": "claude-opus-4-8-1m", "obs_path": "breast-ct-claude-agentic-fastdiff-wdm-wavelet-unconstrained-search-20260703-01/iterations/iter-0009/observation.json", "obs_sha1": "6c969413d6a395f37c81948a22dd8c0089721646", "params_M": 3.824908, "params_source": "observation", "rationale": "fastdiff_wdm_wavelet_unconstrained-claude-agentic: val_n=200, seed=42, fd_recon_ckpt=/cluster/maier/Agent4CT/checkpoints/fast_diffusion_wavelet_breast.pt, fd_recon_steps=16, fd_recon_init=fbp, fd_recon_init_t=0.5, fd_recon_eta=0.0, fd_recon_dc=0, fd_recon_dc_n_cg=5, fd_recon_dc_relax=0.5, dataset_kind=breast_ct, rationale=iter-9 STEPS (NFE) lever, breast-native wdm-wavelet UNCONSTRAINED (DC OFF). SIX-BOX: (1) PRIOR: eta minimized at 0.0 (pure prior denoise): t=0.5 eta0.0 rmse0.01130 (BEST, ssim0.938). eta sweep done; init_t min ~0.5. All hr=0; DC-off floor ~0.0113 vs calibrated FBP floor ~0.0044. (2) Failure mode: recon plateaus above baseline -- prior-denoised FBP retains sparse-view streak residual the prior does not fully remove without a projection. (3) ONE KNOB: fd_recon_steps 8->16 at t=0.5, eta=0.0. (4) HYPOTHESIS: more Euler steps = finer flow integration of the denoising trajectory -> marginally lower rmse; tests whether NFE (not just prior/DPS balance) is the limiter. If 16 steps ~= 8 steps, the ceiling is the prior itself, not integration granularity. (5) BUDGET: 16-step over 200 val still <10min. (6) Loop continues.", "run_id": "breast-ct-claude-agentic-fastdiff-wdm-wavelet-unconstrained-search-20260703-01", "runtime": {"elapsed_s": 112.45543193817139}, "schema_version": 3, "solver_key": "fastdiff-wdm-wavelet-unconstrained", "solver_name": "Fast-diffusion WDM (wavelet, unconstrained)", "split": {"train_n": 3600, "val_n": 200}, "status": "discard", "ts": "2026-07-07T01:35:50Z"}
