{"advice_for_others": "naf-claude-agentic: val_n=12, naf_n_freqs=8, naf_hidden=64, naf_layers=3, naf_n_iter=8000, naf_lr=0.01, naf_tv_weight=0.0, naf_n_clip=0.05, naf_outer_wall_s=800, naf_per_scene_s=60.0, naf_encoding=hash, seed=42, rationale=iter-17 breast-ct-claude-agentic-naf-search-20260703-01 (redone breast split train3600/val200/test200 seed20260703; val_n=12 CONSTANT for iters 2-20 per coordinator budget intervention 2026-07-05 -- first-12 of the 200-case breast val split, deterministic). SIX-BOX: (1) prior result: all iters so far hr=0 (iter-1 val_n=20 ssim0.355 PSNR6.26 in 970s, NOT a timeout -- a genuine converged fit). (2) failure mode: NAF per-scene INR recon is far below the 128-view breast LD-FBP baseline. (3) ONE knob changed: hash + tv 1e-4->0. (4) hypothesis: KNOB: drop TV on the hash path (hash can be noisy; TV may fight its detail). HYPOTHESIS: pure data-fit lets the hash grid sharpen fully. (5) wall: val_n=12 x per_scene 60.0s = ~720s < 20min. (6) serial, no user return.", "agent": "naf-claude-agentic", "campaign": "search-20260703-01", "cfg_full": {"naf_encoding": "hash", "naf_hidden": 64, "naf_layers": 3, "naf_lr": 0.01, "naf_n_clip": 0.05, "naf_n_freqs": 8, "naf_n_iter": 8000, "naf_outer_wall_s": 800, "naf_per_scene_s": 60.0, "naf_tv_weight": 0.0, "rationale": "iter-17 breast-ct-claude-agentic-naf-search-20260703-01 (redone breast split train3600/val200/test200 seed20260703; val_n=12 CONSTANT for iters 2-20 per coordinator budget intervention 2026-07-05 -- first-12 of the 200-case breast val split, deterministic). SIX-BOX: (1) prior result: all iters so far hr=0 (iter-1 val_n=20 ssim0.355 PSNR6.26 in 970s, NOT a timeout -- a genuine converged fit). (2) failure mode: NAF per-scene INR recon is far below the 128-view breast LD-FBP baseline. (3) ONE knob changed: hash + tv 1e-4->0. (4) hypothesis: KNOB: drop TV on the hash path (hash can be noisy; TV may fight its detail). HYPOTHESIS: pure data-fit lets the hash grid sharpen fully. (5) wall: val_n=12 x per_scene 60.0s = ~720s < 20min. (6) serial, no user return.", "seed": 42, "val_n": 12}, "challenge": "breast_ct", "change_class": "architecture", "git_commit": "671da566", "images": {"comparison": "runs/breast-ct-claude-agentic-naf-search-20260703-01/iterations/iter-0017/comparison.png", "test_showcase": null, "valtest_showcase": null}, "iter": 17, "kept": false, "metrics": {"headroom": 0.0, "headroom_std": 0.0, "val_psnr": 22.018728256225586, "val_psnr_std": 0.518479518906799, "val_rmse": 0.026028044521808624, "val_rmse_std": 0.0016680145019620477, "val_ssim": 0.8292853832244873, "val_ssim_std": 0.012554883345808296}, "model": "claude-opus-4-8-1m", "obs_path": "breast-ct-claude-agentic-naf-search-20260703-01/iterations/iter-0017/observation.json", "obs_sha1": "09d496fce0d2f37f2b421e6f87618c16baed4707", "params_M": 16.783553, "params_source": "observation", "rationale": "naf-claude-agentic: val_n=12, naf_n_freqs=8, naf_hidden=64, naf_layers=3, naf_n_iter=8000, naf_lr=0.01, naf_tv_weight=0.0, naf_n_clip=0.05, naf_outer_wall_s=800, naf_per_scene_s=60.0, naf_encoding=hash, seed=42, rationale=iter-17 breast-ct-claude-agentic-naf-search-20260703-01 (redone breast split train3600/val200/test200 seed20260703; val_n=12 CONSTANT for iters 2-20 per coordinator budget intervention 2026-07-05 -- first-12 of the 200-case breast val split, deterministic). SIX-BOX: (1) prior result: all iters so far hr=0 (iter-1 val_n=20 ssim0.355 PSNR6.26 in 970s, NOT a timeout -- a genuine converged fit). (2) failure mode: NAF per-scene INR recon is far below the 128-view breast LD-FBP baseline. (3) ONE knob changed: hash + tv 1e-4->0. (4) hypothesis: KNOB: drop TV on the hash path (hash can be noisy; TV may fight its detail). HYPOTHESIS: pure data-fit lets the hash grid sharpen fully. (5) wall: val_n=12 x per_scene 60.0s = ~720s < 20min. (6) serial, no user return.", "run_id": "breast-ct-claude-agentic-naf-search-20260703-01", "runtime": {"elapsed_s": 744.9935567378998}, "schema_version": 3, "solver_key": "naf", "solver_name": "NAF", "split": {"train_n": 0, "val_n": 12}, "status": "discard", "ts": "2026-07-06T11:30:56Z"}
{"advice_for_others": "naf-claude-agentic: val_n=12, naf_n_freqs=8, naf_hidden=64, naf_layers=3, naf_n_iter=8000, naf_lr=0.01, naf_tv_weight=0.0001, naf_n_clip=0.05, naf_outer_wall_s=800, naf_per_scene_s=60.0, naf_encoding=hash, seed=42, naf_hash_base_res=32, rationale=iter-18 breast-ct-claude-agentic-naf-search-20260703-01 (redone breast split train3600/val200/test200 seed20260703; val_n=12 CONSTANT for iters 2-20 per coordinator budget intervention 2026-07-05 -- first-12 of the 200-case breast val split, deterministic). SIX-BOX: (1) prior result: all iters so far hr=0 (iter-1 val_n=20 ssim0.355 PSNR6.26 in 970s, NOT a timeout -- a genuine converged fit). (2) failure mode: NAF per-scene INR recon is far below the 128-view breast LD-FBP baseline. (3) ONE knob changed: hash base_res 16->32. (4) hypothesis: KNOB: coarser-level start 16->32 (skip the too-coarse levels). HYPOTHESIS: for a single 512px scene the very coarse levels waste capacity; starting finer concentrates the pyramid on useful scales. (5) wall: val_n=12 x per_scene 60.0s = ~720s < 20min. (6) serial, no user return.", "agent": "naf-claude-agentic", "campaign": "search-20260703-01", "cfg_full": {"naf_encoding": "hash", "naf_hash_base_res": 32, "naf_hidden": 64, "naf_layers": 3, "naf_lr": 0.01, "naf_n_clip": 0.05, "naf_n_freqs": 8, "naf_n_iter": 8000, "naf_outer_wall_s": 800, "naf_per_scene_s": 60.0, "naf_tv_weight": 0.0001, "rationale": "iter-18 breast-ct-claude-agentic-naf-search-20260703-01 (redone breast split train3600/val200/test200 seed20260703; val_n=12 CONSTANT for iters 2-20 per coordinator budget intervention 2026-07-05 -- first-12 of the 200-case breast val split, deterministic). SIX-BOX: (1) prior result: all iters so far hr=0 (iter-1 val_n=20 ssim0.355 PSNR6.26 in 970s, NOT a timeout -- a genuine converged fit). (2) failure mode: NAF per-scene INR recon is far below the 128-view breast LD-FBP baseline. (3) ONE knob changed: hash base_res 16->32. (4) hypothesis: KNOB: coarser-level start 16->32 (skip the too-coarse levels). HYPOTHESIS: for a single 512px scene the very coarse levels waste capacity; starting finer concentrates the pyramid on useful scales. (5) wall: val_n=12 x per_scene 60.0s = ~720s < 20min. (6) serial, no user return.", "seed": 42, "val_n": 12}, "challenge": "breast_ct", "change_class": "architecture", "git_commit": "671da566", "images": {"comparison": "runs/breast-ct-claude-agentic-naf-search-20260703-01/iterations/iter-0018/comparison.png", "test_showcase": null, "valtest_showcase": null}, "iter": 18, "kept": false, "metrics": {"headroom": 0.0, "headroom_std": 0.0, "val_psnr": 21.822851181030273, "val_psnr_std": 0.7312543594475172, "val_rmse": 0.02662167139351368, "val_rmse_std": 0.0024298527675337953, "val_ssim": 0.829532265663147, "val_ssim_std": 0.01427743638345982}, "model": "claude-opus-4-8-1m", "obs_path": "breast-ct-claude-agentic-naf-search-20260703-01/iterations/iter-0018/observation.json", "obs_sha1": "b57d504a3cff523356174c9a17e2486ae1a377c0", "params_M": 16.783553, "params_source": "observation", "rationale": "naf-claude-agentic: val_n=12, naf_n_freqs=8, naf_hidden=64, naf_layers=3, naf_n_iter=8000, naf_lr=0.01, naf_tv_weight=0.0001, naf_n_clip=0.05, naf_outer_wall_s=800, naf_per_scene_s=60.0, naf_encoding=hash, seed=42, naf_hash_base_res=32, rationale=iter-18 breast-ct-claude-agentic-naf-search-20260703-01 (redone breast split train3600/val200/test200 seed20260703; val_n=12 CONSTANT for iters 2-20 per coordinator budget intervention 2026-07-05 -- first-12 of the 200-case breast val split, deterministic). SIX-BOX: (1) prior result: all iters so far hr=0 (iter-1 val_n=20 ssim0.355 PSNR6.26 in 970s, NOT a timeout -- a genuine converged fit). (2) failure mode: NAF per-scene INR recon is far below the 128-view breast LD-FBP baseline. (3) ONE knob changed: hash base_res 16->32. (4) hypothesis: KNOB: coarser-level start 16->32 (skip the too-coarse levels). HYPOTHESIS: for a single 512px scene the very coarse levels waste capacity; starting finer concentrates the pyramid on useful scales. (5) wall: val_n=12 x per_scene 60.0s = ~720s < 20min. (6) serial, no user return.", "run_id": "breast-ct-claude-agentic-naf-search-20260703-01", "runtime": {"elapsed_s": 733.0734851360321}, "schema_version": 3, "solver_key": "naf", "solver_name": "NAF", "split": {"train_n": 0, "val_n": 12}, "status": "discard", "ts": "2026-07-06T12:25:51Z"}
{"advice_for_others": "naf-claude-agentic: val_n=12, naf_n_freqs=8, naf_hidden=64, naf_layers=3, naf_n_iter=8000, naf_lr=0.01, naf_tv_weight=0.0001, naf_n_clip=0.05, naf_outer_wall_s=800, naf_per_scene_s=60.0, naf_encoding=hash, seed=42, naf_hash_feat_dim=4, rationale=iter-19 breast-ct-claude-agentic-naf-search-20260703-01 (redone breast split train3600/val200/test200 seed20260703; val_n=12 CONSTANT for iters 2-20 per coordinator budget intervention 2026-07-05 -- first-12 of the 200-case breast val split, deterministic). SIX-BOX: (1) prior result: all iters so far hr=0 (iter-1 val_n=20 ssim0.355 PSNR6.26 in 970s, NOT a timeout -- a genuine converged fit). (2) failure mode: NAF per-scene INR recon is far below the 128-view breast LD-FBP baseline. (3) ONE knob changed: hash feat_dim 2->4. (4) hypothesis: KNOB: more features per hash level 2->4 (richer per-level embedding). HYPOTHESIS: wider per-level features carry more local structure. Final hash-capacity axis. (5) wall: val_n=12 x per_scene 60.0s = ~720s < 20min. (6) serial, no user return.", "agent": "naf-claude-agentic", "campaign": "search-20260703-01", "cfg_full": {"naf_encoding": "hash", "naf_hash_feat_dim": 4, "naf_hidden": 64, "naf_layers": 3, "naf_lr": 0.01, "naf_n_clip": 0.05, "naf_n_freqs": 8, "naf_n_iter": 8000, "naf_outer_wall_s": 800, "naf_per_scene_s": 60.0, "naf_tv_weight": 0.0001, "rationale": "iter-19 breast-ct-claude-agentic-naf-search-20260703-01 (redone breast split train3600/val200/test200 seed20260703; val_n=12 CONSTANT for iters 2-20 per coordinator budget intervention 2026-07-05 -- first-12 of the 200-case breast val split, deterministic). SIX-BOX: (1) prior result: all iters so far hr=0 (iter-1 val_n=20 ssim0.355 PSNR6.26 in 970s, NOT a timeout -- a genuine converged fit). (2) failure mode: NAF per-scene INR recon is far below the 128-view breast LD-FBP baseline. (3) ONE knob changed: hash feat_dim 2->4. (4) hypothesis: KNOB: more features per hash level 2->4 (richer per-level embedding). HYPOTHESIS: wider per-level features carry more local structure. Final hash-capacity axis. (5) wall: val_n=12 x per_scene 60.0s = ~720s < 20min. (6) serial, no user return.", "seed": 42, "val_n": 12}, "challenge": "breast_ct", "change_class": "architecture", "git_commit": "671da566", "images": {"comparison": "runs/breast-ct-claude-agentic-naf-search-20260703-01/iterations/iter-0019/comparison.png", "test_showcase": null, "valtest_showcase": null}, "iter": 19, "kept": false, "metrics": {"headroom": 0.0, "headroom_std": 0.0, "val_psnr": 21.444984436035156, "val_psnr_std": 1.118589843321031, "val_rmse": 0.027805376797914505, "val_rmse_std": 0.003866246481628285, "val_ssim": 0.8365227580070496, "val_ssim_std": 0.017957358510596468}, "model": "claude-opus-4-8-1m", "obs_path": "breast-ct-claude-agentic-naf-search-20260703-01/iterations/iter-0019/observation.json", "obs_sha1": "0dea0aee6a84cc127c89f10b2195e71239912012", "params_M": 33.562817, "params_source": "observation", "rationale": "naf-claude-agentic: val_n=12, naf_n_freqs=8, naf_hidden=64, naf_layers=3, naf_n_iter=8000, naf_lr=0.01, naf_tv_weight=0.0001, naf_n_clip=0.05, naf_outer_wall_s=800, naf_per_scene_s=60.0, naf_encoding=hash, seed=42, naf_hash_feat_dim=4, rationale=iter-19 breast-ct-claude-agentic-naf-search-20260703-01 (redone breast split train3600/val200/test200 seed20260703; val_n=12 CONSTANT for iters 2-20 per coordinator budget intervention 2026-07-05 -- first-12 of the 200-case breast val split, deterministic). SIX-BOX: (1) prior result: all iters so far hr=0 (iter-1 val_n=20 ssim0.355 PSNR6.26 in 970s, NOT a timeout -- a genuine converged fit). (2) failure mode: NAF per-scene INR recon is far below the 128-view breast LD-FBP baseline. (3) ONE knob changed: hash feat_dim 2->4. (4) hypothesis: KNOB: more features per hash level 2->4 (richer per-level embedding). HYPOTHESIS: wider per-level features carry more local structure. Final hash-capacity axis. (5) wall: val_n=12 x per_scene 60.0s = ~720s < 20min. (6) serial, no user return.", "run_id": "breast-ct-claude-agentic-naf-search-20260703-01", "runtime": {"elapsed_s": 732.9607827663422}, "schema_version": 3, "solver_key": "naf", "solver_name": "NAF", "split": {"train_n": 0, "val_n": 12}, "status": "discard", "ts": "2026-07-06T13:10:04Z"}
{"advice_for_others": "naf-claude-agentic: val_n=12, naf_n_freqs=8, naf_hidden=128, naf_layers=3, naf_n_iter=8000, naf_lr=0.01, naf_tv_weight=0.0001, naf_n_clip=0.05, naf_outer_wall_s=1150, naf_per_scene_s=90.0, naf_encoding=hash, seed=42, naf_hash_log2_size=21, rationale=iter-20 breast-ct-claude-agentic-naf-search-20260703-01 (redone breast split train3600/val200/test200 seed20260703; val_n=12 CONSTANT for iters 2-20 per coordinator budget intervention 2026-07-05 -- first-12 of the 200-case breast val split, deterministic). SIX-BOX: (1) prior result: all iters so far hr=0 (iter-1 val_n=20 ssim0.355 PSNR6.26 in 970s, NOT a timeout -- a genuine converged fit). (2) failure mode: NAF per-scene INR recon is far below the 128-view breast LD-FBP baseline. (3) ONE knob changed: best-so-far config, per_scene 60->90 (deepest fit). (4) hypothesis: FINAL iter: combine the strongest hash knobs (wide MLP + big table) with the DEEPEST per-scene fit that still fits <20min (12*90=1080s ~18min). HYPOTHESIS: the most-converged, highest-capacity NAF possible in budget. If THIS is still hr=0, the hr=0 plateau is a robust structural verdict for the paper: NAF's per-scene INR basis (even Instant-NGP hash) cannot beat 128-view FBP on dense 512^2 breast soft-tissue. (5) wall: val_n=12 x per_scene 90.0s = ~1080s < 20min. (6) serial, no user return.", "agent": "naf-claude-agentic", "campaign": "search-20260703-01", "cfg_full": {"naf_encoding": "hash", "naf_hash_log2_size": 21, "naf_hidden": 128, "naf_layers": 3, "naf_lr": 0.01, "naf_n_clip": 0.05, "naf_n_freqs": 8, "naf_n_iter": 8000, "naf_outer_wall_s": 1150, "naf_per_scene_s": 90.0, "naf_tv_weight": 0.0001, "rationale": "iter-20 breast-ct-claude-agentic-naf-search-20260703-01 (redone breast split train3600/val200/test200 seed20260703; val_n=12 CONSTANT for iters 2-20 per coordinator budget intervention 2026-07-05 -- first-12 of the 200-case breast val split, deterministic). SIX-BOX: (1) prior result: all iters so far hr=0 (iter-1 val_n=20 ssim0.355 PSNR6.26 in 970s, NOT a timeout -- a genuine converged fit). (2) failure mode: NAF per-scene INR recon is far below the 128-view breast LD-FBP baseline. (3) ONE knob changed: best-so-far config, per_scene 60->90 (deepest fit). (4) hypothesis: FINAL iter: combine the strongest hash knobs (wide MLP + big table) with the DEEPEST per-scene fit that still fits <20min (12*90=1080s ~18min). HYPOTHESIS: the most-converged, highest-capacity NAF possible in budget. If THIS is still hr=0, the hr=0 plateau is a robust structural verdict for the paper: NAF's per-scene INR basis (even Instant-NGP hash) cannot beat 128-view FBP on dense 512^2 breast soft-tissue. (5) wall: val_n=12 x per_scene 90.0s = ~1080s < 20min. (6) serial, no user return.", "seed": 42, "val_n": 12}, "challenge": "breast_ct", "change_class": "architecture", "git_commit": "671da566", "images": {"comparison": "runs/breast-ct-claude-agentic-naf-search-20260703-01/iterations/iter-0020/comparison.png", "test_showcase": null, "valtest_showcase": null}, "iter": 20, "kept": false, "metrics": {"headroom": 0.0, "headroom_std": 0.0, "val_psnr": 20.726940155029297, "val_psnr_std": 1.1623663574777872, "val_rmse": 0.030201664194464684, "val_rmse_std": 0.00434126813171713, "val_ssim": 0.8272830843925476, "val_ssim_std": 0.016549182811290346}, "model": "claude-opus-4-8-1m", "obs_path": "breast-ct-claude-agentic-naf-search-20260703-01/iterations/iter-0020/observation.json", "obs_sha1": "02aa7cbf8de6c612e92de0a0da13ab3bf8ac3663", "params_M": 67.129729, "params_source": "observation", "rationale": "naf-claude-agentic: val_n=12, naf_n_freqs=8, naf_hidden=128, naf_layers=3, naf_n_iter=8000, naf_lr=0.01, naf_tv_weight=0.0001, naf_n_clip=0.05, naf_outer_wall_s=1150, naf_per_scene_s=90.0, naf_encoding=hash, seed=42, naf_hash_log2_size=21, rationale=iter-20 breast-ct-claude-agentic-naf-search-20260703-01 (redone breast split train3600/val200/test200 seed20260703; val_n=12 CONSTANT for iters 2-20 per coordinator budget intervention 2026-07-05 -- first-12 of the 200-case breast val split, deterministic). SIX-BOX: (1) prior result: all iters so far hr=0 (iter-1 val_n=20 ssim0.355 PSNR6.26 in 970s, NOT a timeout -- a genuine converged fit). (2) failure mode: NAF per-scene INR recon is far below the 128-view breast LD-FBP baseline. (3) ONE knob changed: best-so-far config, per_scene 60->90 (deepest fit). (4) hypothesis: FINAL iter: combine the strongest hash knobs (wide MLP + big table) with the DEEPEST per-scene fit that still fits <20min (12*90=1080s ~18min). HYPOTHESIS: the most-converged, highest-capacity NAF possible in budget. If THIS is still hr=0, the hr=0 plateau is a robust structural verdict for the paper: NAF's per-scene INR basis (even Instant-NGP hash) cannot beat 128-view FBP on dense 512^2 breast soft-tissue. (5) wall: val_n=12 x per_scene 90.0s = ~1080s < 20min. (6) serial, no user return.", "run_id": "breast-ct-claude-agentic-naf-search-20260703-01", "runtime": {"elapsed_s": 1095.4503011703491}, "schema_version": 3, "solver_key": "naf", "solver_name": "NAF", "split": {"train_n": 0, "val_n": 12}, "status": "discard", "ts": "2026-07-06T13:31:59Z"}
