{"advice_for_others": "dual_domain_bilateral_n2i-claude-agentic: warm_start=True, pretrain_epochs=2, train_n=400, n_iter=30, val_n=200, batch_size=1, grad_clip=1.0, lr=0.005, proj_n_bf=1, img_n_bf=1, img_sr=0.0002, img_kernel=5, outer_wall_s=900, seed=42, rationale=iter-10 dual_domain_bilateral_n2i, ONE-KNOB: image BF KERNEL img_kernel 7->5 (tighter spatial window), on iter-7 CHAMPION base (img_sr=0.0002, img_sx=img_sy=1.5 default, n_iter=30). Spatial sigma REVERTED to default 1.5 (iter-9 widen 1.5->2.5 gave hr=0.1140 < champ 0.1261 -> widening blurs fibroglandular detail; spatial axis does NOT want to widen). CHAMPION = iter-7 hr=0.1261 SSIM0.9606 (val_n=200). HYPOTHESIS: iter-9 showed breast fine structure is DAMAGED by a wider spatial support -> the recon wants the SHARPEST possible spatial averaging. A 5x5 kernel (vs 7x7) confines the BF to immediate neighbours, denoising flat noise while preserving the finest fibroglandular edges better than 7x7 -> hr could edge above 0.1261. If FLAT/DROP, 7x7 is already fine (the tight range sigma, not the window, sets edge-preservation) and kernel is neutral. SECONDARY BENEFIT: 5x5 unfold is FASTER than 7x7 -> keeps the per-image loop under outer_wall_s=900 so val_n stays a clean 200 (iters 8/9 trimmed to 193 under heavier configs, confounding hr). BUDGET: smaller kernel -> ~700-900s, no wall trim expected. ONE knob: img_kernel 7->5.", "agent": "dual_domain_bilateral_n2i-claude-agentic", "campaign": "search-20260703-01", "cfg_full": {"batch_size": 1, "grad_clip": 1.0, "img_kernel": 5, "img_n_bf": 1, "img_sr": 0.0002, "lr": 0.005, "n_iter": 30, "outer_wall_s": 900, "pretrain_epochs": 2, "proj_n_bf": 1, "rationale": "iter-10 dual_domain_bilateral_n2i, ONE-KNOB: image BF KERNEL img_kernel 7->5 (tighter spatial window), on iter-7 CHAMPION base (img_sr=0.0002, img_sx=img_sy=1.5 default, n_iter=30). Spatial sigma REVERTED to default 1.5 (iter-9 widen 1.5->2.5 gave hr=0.1140 < champ 0.1261 -> widening blurs fibroglandular detail; spatial axis does NOT want to widen). CHAMPION = iter-7 hr=0.1261 SSIM0.9606 (val_n=200). HYPOTHESIS: iter-9 showed breast fine structure is DAMAGED by a wider spatial support -> the recon wants the SHARPEST possible spatial averaging. A 5x5 kernel (vs 7x7) confines the BF to immediate neighbours, denoising flat noise while preserving the finest fibroglandular edges better than 7x7 -> hr could edge above 0.1261. If FLAT/DROP, 7x7 is already fine (the tight range sigma, not the window, sets edge-preservation) and kernel is neutral. SECONDARY BENEFIT: 5x5 unfold is FASTER than 7x7 -> keeps the per-image loop under outer_wall_s=900 so val_n stays a clean 200 (iters 8/9 trimmed to 193 under heavier configs, confounding hr). BUDGET: smaller kernel -> ~700-900s, no wall trim expected. ONE knob: img_kernel 7->5.", "seed": 42, "train_n": 400, "val_n": 200, "warm_start": true}, "challenge": "breast_ct", "change_class": "architecture", "git_commit": "671da566", "images": {"comparison": "runs/breast-ct-claude-agentic-dual-domain-bilateral-n2i-search-20260703-01/iterations/iter-0010/comparison.png", "test_showcase": null, "valtest_showcase": null}, "iter": 10, "kept": true, "metrics": {"headroom": 0.12600588106777144, "headroom_std": 0.103781558573246, "val_psnr": 39.57415771484375, "val_psnr_std": 1.220029354095459, "val_rmse": 0.0008601538138464093, "val_rmse_std": 0.00012339340173639357, "val_ssim": 0.9606124758720398, "val_ssim_std": 0.01476235967129469}, "model": "claude-opus-4-8-1m", "obs_path": "breast-ct-claude-agentic-dual-domain-bilateral-n2i-search-20260703-01/iterations/iter-0010/observation.json", "obs_sha1": "2ad1042894062cf6b4ca59e90a70cf8ccc67c32d", "params_M": 6e-06, "params_source": "observation", "rationale": "dual_domain_bilateral_n2i-claude-agentic: warm_start=True, pretrain_epochs=2, train_n=400, n_iter=30, val_n=200, batch_size=1, grad_clip=1.0, lr=0.005, proj_n_bf=1, img_n_bf=1, img_sr=0.0002, img_kernel=5, outer_wall_s=900, seed=42, rationale=iter-10 dual_domain_bilateral_n2i, ONE-KNOB: image BF KERNEL img_kernel 7->5 (tighter spatial window), on iter-7 CHAMPION base (img_sr=0.0002, img_sx=img_sy=1.5 default, n_iter=30). Spatial sigma REVERTED to default 1.5 (iter-9 widen 1.5->2.5 gave hr=0.1140 < champ 0.1261 -> widening blurs fibroglandular detail; spatial axis does NOT want to widen). CHAMPION = iter-7 hr=0.1261 SSIM0.9606 (val_n=200). HYPOTHESIS: iter-9 showed breast fine structure is DAMAGED by a wider spatial support -> the recon wants the SHARPEST possible spatial averaging. A 5x5 kernel (vs 7x7) confines the BF to immediate neighbours, denoising flat noise while preserving the finest fibroglandular edges better than 7x7 -> hr could edge above 0.1261. If FLAT/DROP, 7x7 is already fine (the tight range sigma, not the window, sets edge-preservation) and kernel is neutral. SECONDARY BENEFIT: 5x5 unfold is FASTER than 7x7 -> keeps the per-image loop under outer_wall_s=900 so val_n stays a clean 200 (iters 8/9 trimmed to 193 under heavier configs, confounding hr). BUDGET: smaller kernel -> ~700-900s, no wall trim expected. ONE knob: img_kernel 7->5.", "run_id": "breast-ct-claude-agentic-dual-domain-bilateral-n2i-search-20260703-01", "runtime": {"elapsed_s": 1316.914873600006}, "schema_version": 3, "solver_key": "dual-domain-bilateral-n2i", "solver_name": "DD-BF N2I (per-image)", "split": {"train_n": 400, "val_n": 200}, "status": "keep", "ts": "2026-07-05T21:33:59Z"}
{"advice_for_others": "dual_domain_bilateral_n2i-claude-agentic: warm_start=True, pretrain_epochs=2, train_n=400, n_iter=30, val_n=200, batch_size=1, grad_clip=1.0, lr=0.002, proj_n_bf=1, img_n_bf=1, img_sr=0.0002, outer_wall_s=900, seed=42, rationale=iter-11 dual_domain_bilateral_n2i, ONE-KNOB: per-scene Adam lr 0.005->0.002 (gentler optimization), on iter-7 CHAMPION base (img_sr=0.0002, img_kernel=7 default, n_iter=30). img_kernel REVERTED to 7 (iter-10 kernel 7->5 gave hr=0.1260 = TIED with iter-7 0.1261 on a clean val_n=200 -> kernel is NEUTRAL; the tight range sigma, not window size, sets edge-preservation). PLATEAU: iters 5,7,10 all cluster at hr~0.126 (img_sr-driven ceiling). HYPOTHESIS: the N2I self-sup target is the noisy 64-view half-FBP, so each Adam step pulls the BF PARTLY toward that noise floor; at lr=5e-3 the 30-step fit may OVERSHOOT the sweet spot (denoised but sharp) toward the noisy target. A gentler lr=2e-3 lets the fit settle MORE PRECISELY at the edge-preserving optimum before drifting toward noise -> hr could edge above 0.126. If FLAT/DROP, the 30-step fit is already well-damped and lr is neutral -> the ~0.126 plateau is the genuine edge-preserving N2I ceiling on dense breast. BUDGET: same step count, ~700-950s, val_n=200 expected. ONE knob: lr 0.005->0.002.", "agent": "dual_domain_bilateral_n2i-claude-agentic", "campaign": "search-20260703-01", "cfg_full": {"batch_size": 1, "grad_clip": 1.0, "img_n_bf": 1, "img_sr": 0.0002, "lr": 0.002, "n_iter": 30, "outer_wall_s": 900, "pretrain_epochs": 2, "proj_n_bf": 1, "rationale": "iter-11 dual_domain_bilateral_n2i, ONE-KNOB: per-scene Adam lr 0.005->0.002 (gentler optimization), on iter-7 CHAMPION base (img_sr=0.0002, img_kernel=7 default, n_iter=30). img_kernel REVERTED to 7 (iter-10 kernel 7->5 gave hr=0.1260 = TIED with iter-7 0.1261 on a clean val_n=200 -> kernel is NEUTRAL; the tight range sigma, not window size, sets edge-preservation). PLATEAU: iters 5,7,10 all cluster at hr~0.126 (img_sr-driven ceiling). HYPOTHESIS: the N2I self-sup target is the noisy 64-view half-FBP, so each Adam step pulls the BF PARTLY toward that noise floor; at lr=5e-3 the 30-step fit may OVERSHOOT the sweet spot (denoised but sharp) toward the noisy target. A gentler lr=2e-3 lets the fit settle MORE PRECISELY at the edge-preserving optimum before drifting toward noise -> hr could edge above 0.126. If FLAT/DROP, the 30-step fit is already well-damped and lr is neutral -> the ~0.126 plateau is the genuine edge-preserving N2I ceiling on dense breast. BUDGET: same step count, ~700-950s, val_n=200 expected. ONE knob: lr 0.005->0.002.", "seed": 42, "train_n": 400, "val_n": 200, "warm_start": true}, "challenge": "breast_ct", "change_class": "architecture", "git_commit": "671da566", "images": {"comparison": "runs/breast-ct-claude-agentic-dual-domain-bilateral-n2i-search-20260703-01/iterations/iter-0011/comparison.png", "test_showcase": null, "valtest_showcase": null}, "iter": 11, "kept": true, "metrics": {"headroom": 0.18347694148989335, "headroom_std": 0.11500991135835648, "val_psnr": 40.164955139160156, "val_psnr_std": 1.9143799543380737, "val_rmse": 0.0008035928476601839, "val_rmse_std": 0.0002151450316887349, "val_ssim": 0.9536712169647217, "val_ssim_std": 0.02817680314183235}, "model": "claude-opus-4-8-1m", "obs_path": "breast-ct-claude-agentic-dual-domain-bilateral-n2i-search-20260703-01/iterations/iter-0011/observation.json", "obs_sha1": "17e1be46e7a87f0fd9fd9c0330bdda53a8079186", "params_M": 6e-06, "params_source": "observation", "rationale": "dual_domain_bilateral_n2i-claude-agentic: warm_start=True, pretrain_epochs=2, train_n=400, n_iter=30, val_n=200, batch_size=1, grad_clip=1.0, lr=0.002, proj_n_bf=1, img_n_bf=1, img_sr=0.0002, outer_wall_s=900, seed=42, rationale=iter-11 dual_domain_bilateral_n2i, ONE-KNOB: per-scene Adam lr 0.005->0.002 (gentler optimization), on iter-7 CHAMPION base (img_sr=0.0002, img_kernel=7 default, n_iter=30). img_kernel REVERTED to 7 (iter-10 kernel 7->5 gave hr=0.1260 = TIED with iter-7 0.1261 on a clean val_n=200 -> kernel is NEUTRAL; the tight range sigma, not window size, sets edge-preservation). PLATEAU: iters 5,7,10 all cluster at hr~0.126 (img_sr-driven ceiling). HYPOTHESIS: the N2I self-sup target is the noisy 64-view half-FBP, so each Adam step pulls the BF PARTLY toward that noise floor; at lr=5e-3 the 30-step fit may OVERSHOOT the sweet spot (denoised but sharp) toward the noisy target. A gentler lr=2e-3 lets the fit settle MORE PRECISELY at the edge-preserving optimum before drifting toward noise -> hr could edge above 0.126. If FLAT/DROP, the 30-step fit is already well-damped and lr is neutral -> the ~0.126 plateau is the genuine edge-preserving N2I ceiling on dense breast. BUDGET: same step count, ~700-950s, val_n=200 expected. ONE knob: lr 0.005->0.002.", "run_id": "breast-ct-claude-agentic-dual-domain-bilateral-n2i-search-20260703-01", "runtime": {"elapsed_s": 1306.6201400756836}, "schema_version": 3, "solver_key": "dual-domain-bilateral-n2i", "solver_name": "DD-BF N2I (per-image)", "split": {"train_n": 400, "val_n": 200}, "status": "keep", "ts": "2026-07-05T21:56:37Z"}
{"advice_for_others": "dual_domain_bilateral_n2i-claude-agentic: warm_start=True, pretrain_epochs=2, train_n=400, n_iter=30, val_n=200, batch_size=1, grad_clip=1.0, lr=0.001, proj_n_bf=1, img_n_bf=1, img_sr=0.0002, outer_wall_s=900, seed=42, rationale=iter-12 dual_domain_bilateral_n2i, ONE-KNOB: per-scene Adam lr 0.002->0.001 (continue down the lr axis), on the iter-11 NEW CHAMPION base (img_sr=0.0002, n_iter=30, img_kernel=7). BREAKTHROUGH#2 PRIOR: iter-11 (lr 5e-3->2e-3) hr 0.126->0.1835 (+0.057!), PSNR 39.57->40.16, recon_rmse 8.60e-4->8.04e-4 -- CONFIRMED lr=5e-3 was OVERSHOOTING each 30-step per-scene fit toward the noisy 64-view half-target; a gentler lr settles at the edge-preserving denoised-but-sharp optimum. (SSIM dipped 0.9606->0.9537 but hr is RMSE-based and RMSE clearly improved -> real gain.) HYPOTHESIS: the lr axis is monotone-improving so far; lr=1e-3 damps the drift-toward-noise even more, converging tighter to the edge-preserving optimum -> hr climbs above 0.1835. RISK: too-low lr -> the 30-step fit UNDER-converges from the warm-start init (barely denoises) -> recon ~ warm-start-generic, hr regresses. This iter locates the lr optimum: if hr>0.1835 keep lowering (5e-4); if hr<0.1835 the optimum is ~2e-3 and I bracket (1.5e-3). BUDGET: same steps, ~940s, val_n=200. ONE knob: lr 0.002->0.001.", "agent": "dual_domain_bilateral_n2i-claude-agentic", "campaign": "search-20260703-01", "cfg_full": {"batch_size": 1, "grad_clip": 1.0, "img_n_bf": 1, "img_sr": 0.0002, "lr": 0.001, "n_iter": 30, "outer_wall_s": 900, "pretrain_epochs": 2, "proj_n_bf": 1, "rationale": "iter-12 dual_domain_bilateral_n2i, ONE-KNOB: per-scene Adam lr 0.002->0.001 (continue down the lr axis), on the iter-11 NEW CHAMPION base (img_sr=0.0002, n_iter=30, img_kernel=7). BREAKTHROUGH#2 PRIOR: iter-11 (lr 5e-3->2e-3) hr 0.126->0.1835 (+0.057!), PSNR 39.57->40.16, recon_rmse 8.60e-4->8.04e-4 -- CONFIRMED lr=5e-3 was OVERSHOOTING each 30-step per-scene fit toward the noisy 64-view half-target; a gentler lr settles at the edge-preserving denoised-but-sharp optimum. (SSIM dipped 0.9606->0.9537 but hr is RMSE-based and RMSE clearly improved -> real gain.) HYPOTHESIS: the lr axis is monotone-improving so far; lr=1e-3 damps the drift-toward-noise even more, converging tighter to the edge-preserving optimum -> hr climbs above 0.1835. RISK: too-low lr -> the 30-step fit UNDER-converges from the warm-start init (barely denoises) -> recon ~ warm-start-generic, hr regresses. This iter locates the lr optimum: if hr>0.1835 keep lowering (5e-4); if hr<0.1835 the optimum is ~2e-3 and I bracket (1.5e-3). BUDGET: same steps, ~940s, val_n=200. ONE knob: lr 0.002->0.001.", "seed": 42, "train_n": 400, "val_n": 200, "warm_start": true}, "challenge": "breast_ct", "change_class": "architecture", "git_commit": "671da566", "images": {"comparison": "runs/breast-ct-claude-agentic-dual-domain-bilateral-n2i-search-20260703-01/iterations/iter-0012/comparison.png", "test_showcase": null, "valtest_showcase": null}, "iter": 12, "kept": true, "metrics": {"headroom": 0.08949938767956633, "headroom_std": 0.09791018068790436, "val_psnr": 39.218719482421875, "val_psnr_std": 1.8119713068008423, "val_rmse": 0.0008960822015069425, "val_rmse_std": 0.00022124830866232514, "val_ssim": 0.9299665689468384, "val_ssim_std": 0.02959536202251911}, "model": "claude-opus-4-8-1m", "obs_path": "breast-ct-claude-agentic-dual-domain-bilateral-n2i-search-20260703-01/iterations/iter-0012/observation.json", "obs_sha1": "4c52c0cb0ac8acf5b8e6ff2897fbf1d98f94fd87", "params_M": 6e-06, "params_source": "observation", "rationale": "dual_domain_bilateral_n2i-claude-agentic: warm_start=True, pretrain_epochs=2, train_n=400, n_iter=30, val_n=200, batch_size=1, grad_clip=1.0, lr=0.001, proj_n_bf=1, img_n_bf=1, img_sr=0.0002, outer_wall_s=900, seed=42, rationale=iter-12 dual_domain_bilateral_n2i, ONE-KNOB: per-scene Adam lr 0.002->0.001 (continue down the lr axis), on the iter-11 NEW CHAMPION base (img_sr=0.0002, n_iter=30, img_kernel=7). BREAKTHROUGH#2 PRIOR: iter-11 (lr 5e-3->2e-3) hr 0.126->0.1835 (+0.057!), PSNR 39.57->40.16, recon_rmse 8.60e-4->8.04e-4 -- CONFIRMED lr=5e-3 was OVERSHOOTING each 30-step per-scene fit toward the noisy 64-view half-target; a gentler lr settles at the edge-preserving denoised-but-sharp optimum. (SSIM dipped 0.9606->0.9537 but hr is RMSE-based and RMSE clearly improved -> real gain.) HYPOTHESIS: the lr axis is monotone-improving so far; lr=1e-3 damps the drift-toward-noise even more, converging tighter to the edge-preserving optimum -> hr climbs above 0.1835. RISK: too-low lr -> the 30-step fit UNDER-converges from the warm-start init (barely denoises) -> recon ~ warm-start-generic, hr regresses. This iter locates the lr optimum: if hr>0.1835 keep lowering (5e-4); if hr<0.1835 the optimum is ~2e-3 and I bracket (1.5e-3). BUDGET: same steps, ~940s, val_n=200. ONE knob: lr 0.002->0.001.", "run_id": "breast-ct-claude-agentic-dual-domain-bilateral-n2i-search-20260703-01", "runtime": {"elapsed_s": 1345.848262310028}, "schema_version": 3, "solver_key": "dual-domain-bilateral-n2i", "solver_name": "DD-BF N2I (per-image)", "split": {"train_n": 400, "val_n": 200}, "status": "keep", "ts": "2026-07-05T22:19:57Z"}
{"advice_for_others": "dual_domain_bilateral_n2i-claude-agentic: warm_start=True, pretrain_epochs=2, train_n=400, n_iter=30, val_n=200, batch_size=1, grad_clip=1.0, lr=0.003, proj_n_bf=1, img_n_bf=1, img_sr=0.0002, outer_wall_s=900, seed=42, rationale=iter-13 dual_domain_bilateral_n2i, ONE-KNOB: lr 0.002->0.003 (bracket the lr peak on the HIGH side), on iter-11 CHAMPION base (img_sr=0.0002, n_iter=30). lr AXIS now bracketed: 5e-3->hr0.126, 2e-3->hr0.1835 (PEAK so far), 1e-3->hr0.0895 (iter-12: UNDER-converged, SSIM crashed to 0.930 -- 30 steps from warm-start too few at this low lr). So the optimum is a PEAK near 2e-3 with steep falloff BELOW it (under-convergence) and gentler falloff ABOVE it (overshoot-to-noise). HYPOTHESIS: 3e-3 sits between the 2e-3 peak and the 5e-3 mild-overshoot; if hr(3e-3) < 0.1835 the peak is at/below 2e-3 and I stop refining lr (2e-3 confirmed optimal); if hr(3e-3) ~ or > 0.1835 the ridge is broad on the high side and 2-3e-3 is a plateau. Either way this NAILS the lr optimum in one clean step (val_n=200). BUDGET: same steps, ~950s. ONE knob: lr 0.002->0.003.", "agent": "dual_domain_bilateral_n2i-claude-agentic", "campaign": "search-20260703-01", "cfg_full": {"batch_size": 1, "grad_clip": 1.0, "img_n_bf": 1, "img_sr": 0.0002, "lr": 0.003, "n_iter": 30, "outer_wall_s": 900, "pretrain_epochs": 2, "proj_n_bf": 1, "rationale": "iter-13 dual_domain_bilateral_n2i, ONE-KNOB: lr 0.002->0.003 (bracket the lr peak on the HIGH side), on iter-11 CHAMPION base (img_sr=0.0002, n_iter=30). lr AXIS now bracketed: 5e-3->hr0.126, 2e-3->hr0.1835 (PEAK so far), 1e-3->hr0.0895 (iter-12: UNDER-converged, SSIM crashed to 0.930 -- 30 steps from warm-start too few at this low lr). So the optimum is a PEAK near 2e-3 with steep falloff BELOW it (under-convergence) and gentler falloff ABOVE it (overshoot-to-noise). HYPOTHESIS: 3e-3 sits between the 2e-3 peak and the 5e-3 mild-overshoot; if hr(3e-3) < 0.1835 the peak is at/below 2e-3 and I stop refining lr (2e-3 confirmed optimal); if hr(3e-3) ~ or > 0.1835 the ridge is broad on the high side and 2-3e-3 is a plateau. Either way this NAILS the lr optimum in one clean step (val_n=200). BUDGET: same steps, ~950s. ONE knob: lr 0.002->0.003.", "seed": 42, "train_n": 400, "val_n": 200, "warm_start": true}, "challenge": "breast_ct", "change_class": "architecture", "git_commit": "671da566", "images": {"comparison": "runs/breast-ct-claude-agentic-dual-domain-bilateral-n2i-search-20260703-01/iterations/iter-0013/comparison.png", "test_showcase": null, "valtest_showcase": null}, "iter": 13, "kept": true, "metrics": {"headroom": 0.19882179919887932, "headroom_std": 0.11924386769533157, "val_psnr": 40.329742431640625, "val_psnr_std": 1.8433849811553955, "val_rmse": 0.0007884909864515066, "val_rmse_std": 0.00019907303794752806, "val_ssim": 0.9583393931388855, "val_ssim_std": 0.02558719366788864}, "model": "claude-opus-4-8-1m", "obs_path": "breast-ct-claude-agentic-dual-domain-bilateral-n2i-search-20260703-01/iterations/iter-0013/observation.json", "obs_sha1": "79c84c77e02c33e6df6e8becd960990e9cdac38f", "params_M": 6e-06, "params_source": "observation", "rationale": "dual_domain_bilateral_n2i-claude-agentic: warm_start=True, pretrain_epochs=2, train_n=400, n_iter=30, val_n=200, batch_size=1, grad_clip=1.0, lr=0.003, proj_n_bf=1, img_n_bf=1, img_sr=0.0002, outer_wall_s=900, seed=42, rationale=iter-13 dual_domain_bilateral_n2i, ONE-KNOB: lr 0.002->0.003 (bracket the lr peak on the HIGH side), on iter-11 CHAMPION base (img_sr=0.0002, n_iter=30). lr AXIS now bracketed: 5e-3->hr0.126, 2e-3->hr0.1835 (PEAK so far), 1e-3->hr0.0895 (iter-12: UNDER-converged, SSIM crashed to 0.930 -- 30 steps from warm-start too few at this low lr). So the optimum is a PEAK near 2e-3 with steep falloff BELOW it (under-convergence) and gentler falloff ABOVE it (overshoot-to-noise). HYPOTHESIS: 3e-3 sits between the 2e-3 peak and the 5e-3 mild-overshoot; if hr(3e-3) < 0.1835 the peak is at/below 2e-3 and I stop refining lr (2e-3 confirmed optimal); if hr(3e-3) ~ or > 0.1835 the ridge is broad on the high side and 2-3e-3 is a plateau. Either way this NAILS the lr optimum in one clean step (val_n=200). BUDGET: same steps, ~950s. ONE knob: lr 0.002->0.003.", "run_id": "breast-ct-claude-agentic-dual-domain-bilateral-n2i-search-20260703-01", "runtime": {"elapsed_s": 973.0382099151611}, "schema_version": 3, "solver_key": "dual-domain-bilateral-n2i", "solver_name": "DD-BF N2I (per-image)", "split": {"train_n": 400, "val_n": 200}, "status": "keep", "ts": "2026-07-05T22:36:56Z"}
