{"advice_for_others": "dual_domain_n2i-claude-agentic: warm_start=True, pretrain_epochs=3, pretrain_steps=0, n_iter=100, grad_clip=1.0, outer_wall_s=1400, per_scene_s=None, batch_size=1, lr=0.0003, optimizer=adam, unet_c=16, train_n=400, val_n=200, seed=42, rationale=iter-10 SIX-BOX (HALFWAY). (1) PRIOR: iter-9 hr=0.0, unet_c=8 (down) gave rmse=0.00629, ssim=0.945 (highest ssim) -- no clear from iter-3's c=32 (rmse 0.00654). With c=8, c=16, c=32 ALL at hr=0, capacity is CONCLUSIVELY not the lever. Iters 1-9 all hr=0. (2) FAILURE MODE: plain-UNet N2I regresses to the over-smoothed FBP mean; no edge-preserving structural guard (unlike the bilateral sibling's range kernel, hr~0.21). (3) ONE KNOB: relative to iter-6 best reference (lr=3e-4, c=16, ep=3), n_iter 50 -> 100. Completes the inner-step sweep (iter-2/5 used 200, iter-6 used 50; this fills 100). (4) HYPOTHESIS: 100 inner steps is a middle ground -- enough to refine past the warm init but maybe not so many that it collapses fully to the smooth mean; if there is a sweet spot in inner-step count, rmse dips here. Per the ceiling, more likely rmse sits between the 50-step (0.00628) and 200-step (0.00633) values, still far above baseline 0.00521 (hr=0), confirming inner-step count is monotone-flat and not a lever. (5) BUDGET: 100 steps/scene, moderate; pretrain ep=3 + 200*100-step fits + figure ~= 16 min < 30-min wall. (6) Loop continues; iter-11 self-dispatched. Reserved levers: grad_clip off (2.0/none), seed variance check (314), lr=1e-4 very gentle, pretrain_steps cap, n_iter=400 high.", "agent": "dual_domain_n2i-claude-agentic", "campaign": "search-20260703-01", "cfg_full": {"batch_size": 1, "grad_clip": 1.0, "lr": 0.0003, "n_iter": 100, "optimizer": "adam", "outer_wall_s": 1400, "per_scene_s": null, "pretrain_epochs": 3, "pretrain_steps": 0, "rationale": "iter-10 SIX-BOX (HALFWAY). (1) PRIOR: iter-9 hr=0.0, unet_c=8 (down) gave rmse=0.00629, ssim=0.945 (highest ssim) -- no clear from iter-3's c=32 (rmse 0.00654). With c=8, c=16, c=32 ALL at hr=0, capacity is CONCLUSIVELY not the lever. Iters 1-9 all hr=0. (2) FAILURE MODE: plain-UNet N2I regresses to the over-smoothed FBP mean; no edge-preserving structural guard (unlike the bilateral sibling's range kernel, hr~0.21). (3) ONE KNOB: relative to iter-6 best reference (lr=3e-4, c=16, ep=3), n_iter 50 -> 100. Completes the inner-step sweep (iter-2/5 used 200, iter-6 used 50; this fills 100). (4) HYPOTHESIS: 100 inner steps is a middle ground -- enough to refine past the warm init but maybe not so many that it collapses fully to the smooth mean; if there is a sweet spot in inner-step count, rmse dips here. Per the ceiling, more likely rmse sits between the 50-step (0.00628) and 200-step (0.00633) values, still far above baseline 0.00521 (hr=0), confirming inner-step count is monotone-flat and not a lever. (5) BUDGET: 100 steps/scene, moderate; pretrain ep=3 + 200*100-step fits + figure ~= 16 min < 30-min wall. (6) Loop continues; iter-11 self-dispatched. Reserved levers: grad_clip off (2.0/none), seed variance check (314), lr=1e-4 very gentle, pretrain_steps cap, n_iter=400 high.", "seed": 42, "train_n": 400, "unet_c": 16, "val_n": 200, "warm_start": true}, "challenge": "breast_ct", "change_class": "architecture", "git_commit": "671da566", "images": {"comparison": "runs/breast-ct-claude-agentic-dual-domain-n2i-search-20260703-01/iterations/iter-0010/comparison.png", "test_showcase": null, "valtest_showcase": null}, "iter": 10, "kept": false, "metrics": {"headroom": 0.0, "headroom_std": 0.0, "val_psnr": 34.72379684448242, "val_psnr_std": 0.924173168544248, "val_rmse": 0.00626923656091094, "val_rmse_std": 0.0006469846013434121, "val_ssim": 0.9419757127761841, "val_ssim_std": 0.01040919365453625}, "model": "claude-opus-4-8-1m", "obs_path": "breast-ct-claude-agentic-dual-domain-n2i-search-20260703-01/iterations/iter-0010/observation.json", "obs_sha1": "edf401f456f94397d0bec3bad2dd6afe70edd8f7", "params_M": 0.465762, "params_source": "observation", "rationale": "dual_domain_n2i-claude-agentic: warm_start=True, pretrain_epochs=3, pretrain_steps=0, n_iter=100, grad_clip=1.0, outer_wall_s=1400, per_scene_s=None, batch_size=1, lr=0.0003, optimizer=adam, unet_c=16, train_n=400, val_n=200, seed=42, rationale=iter-10 SIX-BOX (HALFWAY). (1) PRIOR: iter-9 hr=0.0, unet_c=8 (down) gave rmse=0.00629, ssim=0.945 (highest ssim) -- no clear from iter-3's c=32 (rmse 0.00654). With c=8, c=16, c=32 ALL at hr=0, capacity is CONCLUSIVELY not the lever. Iters 1-9 all hr=0. (2) FAILURE MODE: plain-UNet N2I regresses to the over-smoothed FBP mean; no edge-preserving structural guard (unlike the bilateral sibling's range kernel, hr~0.21). (3) ONE KNOB: relative to iter-6 best reference (lr=3e-4, c=16, ep=3), n_iter 50 -> 100. Completes the inner-step sweep (iter-2/5 used 200, iter-6 used 50; this fills 100). (4) HYPOTHESIS: 100 inner steps is a middle ground -- enough to refine past the warm init but maybe not so many that it collapses fully to the smooth mean; if there is a sweet spot in inner-step count, rmse dips here. Per the ceiling, more likely rmse sits between the 50-step (0.00628) and 200-step (0.00633) values, still far above baseline 0.00521 (hr=0), confirming inner-step count is monotone-flat and not a lever. (5) BUDGET: 100 steps/scene, moderate; pretrain ep=3 + 200*100-step fits + figure ~= 16 min < 30-min wall. (6) Loop continues; iter-11 self-dispatched. Reserved levers: grad_clip off (2.0/none), seed variance check (314), lr=1e-4 very gentle, pretrain_steps cap, n_iter=400 high.", "run_id": "breast-ct-claude-agentic-dual-domain-n2i-search-20260703-01", "runtime": {"elapsed_s": 1533.3779921531677}, "schema_version": 3, "solver_key": "dual-domain-n2i", "solver_name": "DD-UNet N2I (per-image)", "split": {"train_n": 400, "val_n": 199}, "status": "discard", "ts": "2026-07-06T02:39:18Z"}
{"advice_for_others": "dual_domain_n2i-claude-agentic: warm_start=True, pretrain_epochs=3, pretrain_steps=0, n_iter=50, grad_clip=0.0, outer_wall_s=1400, per_scene_s=None, batch_size=1, lr=0.0003, optimizer=adam, unet_c=16, train_n=400, val_n=200, seed=42, rationale=iter-11 SIX-BOX. (1) PRIOR: iter-10 hr=0.0, n_iter=100 gave rmse=0.00627 -- with 50/100/200-step fits at 0.00628/0.00627/0.00633, inner-step count is MONOTONE-FLAT and NOT a lever. Iters 1-10 all hr=0, rmse 0.00627-0.00657, all far above baseline 0.00521. (2) FAILURE MODE: plain-UNet N2I regresses to the over-smoothed FBP mean; no edge-preserving structural guard (the bilateral sibling's tight range kernel, hr~0.21, is exactly what this solver lacks). (3) ONE KNOB: relative to iter-6 best reference (lr=3e-4, n_iter=50, c=16), grad_clip 1.0 -> 0.0 (OFF). grad_clip has been pinned at 1.0 all run; breast's 128-view FBP adjoint is far milder than Mayo's 2304-view, so clipping may be needlessly damping the per-image updates. (4) HYPOTHESIS: removing grad-norm clipping lets full-magnitude gradients through, which on the well-conditioned 128-view breast geometry may drive the per-image fit to a sharper solution the clipped runs couldn't reach, lowering rmse. If hr rises, clipping was over-damping. Per the ceiling, more likely the unclipped fit reaches the same over-smoothed FBP-consistent solution (hr=0), since the over-smoothing is set by the TARGET not the step magnitude; grad_clip<=0 still skips nonfinite-grad steps so it stays stable. (5) BUDGET: identical to iter-6 (n_iter=50 fast); ~12 min << 30-min wall. (6) Loop continues; iter-12 self-dispatched. Reserved levers: seed variance check (314), lr=1e-4 very gentle, pretrain_steps cap, n_iter=400 high, batch_size up for warm-start.", "agent": "dual_domain_n2i-claude-agentic", "campaign": "search-20260703-01", "cfg_full": {"batch_size": 1, "grad_clip": 0.0, "lr": 0.0003, "n_iter": 50, "optimizer": "adam", "outer_wall_s": 1400, "per_scene_s": null, "pretrain_epochs": 3, "pretrain_steps": 0, "rationale": "iter-11 SIX-BOX. (1) PRIOR: iter-10 hr=0.0, n_iter=100 gave rmse=0.00627 -- with 50/100/200-step fits at 0.00628/0.00627/0.00633, inner-step count is MONOTONE-FLAT and NOT a lever. Iters 1-10 all hr=0, rmse 0.00627-0.00657, all far above baseline 0.00521. (2) FAILURE MODE: plain-UNet N2I regresses to the over-smoothed FBP mean; no edge-preserving structural guard (the bilateral sibling's tight range kernel, hr~0.21, is exactly what this solver lacks). (3) ONE KNOB: relative to iter-6 best reference (lr=3e-4, n_iter=50, c=16), grad_clip 1.0 -> 0.0 (OFF). grad_clip has been pinned at 1.0 all run; breast's 128-view FBP adjoint is far milder than Mayo's 2304-view, so clipping may be needlessly damping the per-image updates. (4) HYPOTHESIS: removing grad-norm clipping lets full-magnitude gradients through, which on the well-conditioned 128-view breast geometry may drive the per-image fit to a sharper solution the clipped runs couldn't reach, lowering rmse. If hr rises, clipping was over-damping. Per the ceiling, more likely the unclipped fit reaches the same over-smoothed FBP-consistent solution (hr=0), since the over-smoothing is set by the TARGET not the step magnitude; grad_clip<=0 still skips nonfinite-grad steps so it stays stable. (5) BUDGET: identical to iter-6 (n_iter=50 fast); ~12 min << 30-min wall. (6) Loop continues; iter-12 self-dispatched. Reserved levers: seed variance check (314), lr=1e-4 very gentle, pretrain_steps cap, n_iter=400 high, batch_size up for warm-start.", "seed": 42, "train_n": 400, "unet_c": 16, "val_n": 200, "warm_start": true}, "challenge": "breast_ct", "change_class": "architecture", "git_commit": "671da566", "images": {"comparison": "runs/breast-ct-claude-agentic-dual-domain-n2i-search-20260703-01/iterations/iter-0011/comparison.png", "test_showcase": null, "valtest_showcase": null}, "iter": 11, "kept": false, "metrics": {"headroom": 0.0, "headroom_std": 0.0, "val_psnr": 34.61840057373047, "val_psnr_std": 0.9843053261512701, "val_rmse": 0.0063457731157541275, "val_rmse_std": 0.0006923091136710043, "val_ssim": 0.9421713948249817, "val_ssim_std": 0.011820114138622162}, "model": "claude-opus-4-8-1m", "obs_path": "breast-ct-claude-agentic-dual-domain-n2i-search-20260703-01/iterations/iter-0011/observation.json", "obs_sha1": "c5e97211cae9504d28ef9fd425136f3e8c3d5722", "params_M": 0.465762, "params_source": "observation", "rationale": "dual_domain_n2i-claude-agentic: warm_start=True, pretrain_epochs=3, pretrain_steps=0, n_iter=50, grad_clip=0.0, outer_wall_s=1400, per_scene_s=None, batch_size=1, lr=0.0003, optimizer=adam, unet_c=16, train_n=400, val_n=200, seed=42, rationale=iter-11 SIX-BOX. (1) PRIOR: iter-10 hr=0.0, n_iter=100 gave rmse=0.00627 -- with 50/100/200-step fits at 0.00628/0.00627/0.00633, inner-step count is MONOTONE-FLAT and NOT a lever. Iters 1-10 all hr=0, rmse 0.00627-0.00657, all far above baseline 0.00521. (2) FAILURE MODE: plain-UNet N2I regresses to the over-smoothed FBP mean; no edge-preserving structural guard (the bilateral sibling's tight range kernel, hr~0.21, is exactly what this solver lacks). (3) ONE KNOB: relative to iter-6 best reference (lr=3e-4, n_iter=50, c=16), grad_clip 1.0 -> 0.0 (OFF). grad_clip has been pinned at 1.0 all run; breast's 128-view FBP adjoint is far milder than Mayo's 2304-view, so clipping may be needlessly damping the per-image updates. (4) HYPOTHESIS: removing grad-norm clipping lets full-magnitude gradients through, which on the well-conditioned 128-view breast geometry may drive the per-image fit to a sharper solution the clipped runs couldn't reach, lowering rmse. If hr rises, clipping was over-damping. Per the ceiling, more likely the unclipped fit reaches the same over-smoothed FBP-consistent solution (hr=0), since the over-smoothing is set by the TARGET not the step magnitude; grad_clip<=0 still skips nonfinite-grad steps so it stays stable. (5) BUDGET: identical to iter-6 (n_iter=50 fast); ~12 min << 30-min wall. (6) Loop continues; iter-12 self-dispatched. Reserved levers: seed variance check (314), lr=1e-4 very gentle, pretrain_steps cap, n_iter=400 high, batch_size up for warm-start.", "run_id": "breast-ct-claude-agentic-dual-domain-n2i-search-20260703-01", "runtime": {"elapsed_s": 962.5135140419006}, "schema_version": 3, "solver_key": "dual-domain-n2i", "solver_name": "DD-UNet N2I (per-image)", "split": {"train_n": 400, "val_n": 200}, "status": "discard", "ts": "2026-07-06T03:29:59Z"}
{"advice_for_others": "dual_domain_n2i-claude-agentic: warm_start=True, pretrain_epochs=3, pretrain_steps=0, n_iter=50, grad_clip=1.0, outer_wall_s=1400, per_scene_s=None, batch_size=1, lr=0.0003, optimizer=adam, unet_c=16, train_n=400, val_n=200, seed=314, rationale=iter-12 SIX-BOX. (1) PRIOR: iter-11 hr=0.0, grad_clip OFF gave rmse=0.00635, ssim=0.942 -- no better than clipped; removing the grad-norm damp did not sharpen. Iters 1-11 all hr=0. (2) FAILURE MODE: plain-UNet N2I regresses to the over-smoothed FBP mean; no edge-preserving structural guard (bilateral sibling range kernel hr~0.21 is what this solver lacks). (3) ONE KNOB: relative to iter-6 best reference (lr=3e-4, n_iter=50, c=16, grad_clip=1.0), seed 42 -> 314. (4) HYPOTHESIS: VARIANCE CHECK -- re-running the best config under a different RNG seed (warm-start init + train permutation) tests whether hr=0 is robust to seed or a one-off. If rmse lands ~0.0062-0.0064 again (hr=0), the ceiling is seed-independent and structural; a large swing would signal seed sensitivity. The breast VAL SPLIT is fixed (staged h5, seed-20260703), so seed only perturbs training RNG, not the val cases. Per the ceiling, expect hr=0 again. (5) BUDGET: identical to iter-6 (n_iter=50 fast); ~12 min << 30-min wall. (6) Loop continues; iter-13 self-dispatched. Reserved levers: lr=1e-4 very gentle, n_iter=400 high, pretrain_steps cap, batch_size=2 warm-start, pretrain_epochs=1 minimal warm-start.", "agent": "dual_domain_n2i-claude-agentic", "campaign": "search-20260703-01", "cfg_full": {"batch_size": 1, "grad_clip": 1.0, "lr": 0.0003, "n_iter": 50, "optimizer": "adam", "outer_wall_s": 1400, "per_scene_s": null, "pretrain_epochs": 3, "pretrain_steps": 0, "rationale": "iter-12 SIX-BOX. (1) PRIOR: iter-11 hr=0.0, grad_clip OFF gave rmse=0.00635, ssim=0.942 -- no better than clipped; removing the grad-norm damp did not sharpen. Iters 1-11 all hr=0. (2) FAILURE MODE: plain-UNet N2I regresses to the over-smoothed FBP mean; no edge-preserving structural guard (bilateral sibling range kernel hr~0.21 is what this solver lacks). (3) ONE KNOB: relative to iter-6 best reference (lr=3e-4, n_iter=50, c=16, grad_clip=1.0), seed 42 -> 314. (4) HYPOTHESIS: VARIANCE CHECK -- re-running the best config under a different RNG seed (warm-start init + train permutation) tests whether hr=0 is robust to seed or a one-off. If rmse lands ~0.0062-0.0064 again (hr=0), the ceiling is seed-independent and structural; a large swing would signal seed sensitivity. The breast VAL SPLIT is fixed (staged h5, seed-20260703), so seed only perturbs training RNG, not the val cases. Per the ceiling, expect hr=0 again. (5) BUDGET: identical to iter-6 (n_iter=50 fast); ~12 min << 30-min wall. (6) Loop continues; iter-13 self-dispatched. Reserved levers: lr=1e-4 very gentle, n_iter=400 high, pretrain_steps cap, batch_size=2 warm-start, pretrain_epochs=1 minimal warm-start.", "seed": 314, "train_n": 400, "unet_c": 16, "val_n": 200, "warm_start": true}, "challenge": "breast_ct", "change_class": "architecture", "git_commit": "671da566", "images": {"comparison": "runs/breast-ct-claude-agentic-dual-domain-n2i-search-20260703-01/iterations/iter-0012/comparison.png", "test_showcase": null, "valtest_showcase": null}, "iter": 12, "kept": false, "metrics": {"headroom": 0.0, "headroom_std": 0.0, "val_psnr": 34.69007873535156, "val_psnr_std": 0.9364403405606202, "val_rmse": 0.006293622311204672, "val_rmse_std": 0.0006505749696630535, "val_ssim": 0.9436529278755188, "val_ssim_std": 0.01094877081079817}, "model": "claude-opus-4-8-1m", "obs_path": "breast-ct-claude-agentic-dual-domain-n2i-search-20260703-01/iterations/iter-0012/observation.json", "obs_sha1": "c973145fd7bf35597ec819f910c2969b1b02a0d9", "params_M": 0.465762, "params_source": "observation", "rationale": "dual_domain_n2i-claude-agentic: warm_start=True, pretrain_epochs=3, pretrain_steps=0, n_iter=50, grad_clip=1.0, outer_wall_s=1400, per_scene_s=None, batch_size=1, lr=0.0003, optimizer=adam, unet_c=16, train_n=400, val_n=200, seed=314, rationale=iter-12 SIX-BOX. (1) PRIOR: iter-11 hr=0.0, grad_clip OFF gave rmse=0.00635, ssim=0.942 -- no better than clipped; removing the grad-norm damp did not sharpen. Iters 1-11 all hr=0. (2) FAILURE MODE: plain-UNet N2I regresses to the over-smoothed FBP mean; no edge-preserving structural guard (bilateral sibling range kernel hr~0.21 is what this solver lacks). (3) ONE KNOB: relative to iter-6 best reference (lr=3e-4, n_iter=50, c=16, grad_clip=1.0), seed 42 -> 314. (4) HYPOTHESIS: VARIANCE CHECK -- re-running the best config under a different RNG seed (warm-start init + train permutation) tests whether hr=0 is robust to seed or a one-off. If rmse lands ~0.0062-0.0064 again (hr=0), the ceiling is seed-independent and structural; a large swing would signal seed sensitivity. The breast VAL SPLIT is fixed (staged h5, seed-20260703), so seed only perturbs training RNG, not the val cases. Per the ceiling, expect hr=0 again. (5) BUDGET: identical to iter-6 (n_iter=50 fast); ~12 min << 30-min wall. (6) Loop continues; iter-13 self-dispatched. Reserved levers: lr=1e-4 very gentle, n_iter=400 high, pretrain_steps cap, batch_size=2 warm-start, pretrain_epochs=1 minimal warm-start.", "run_id": "breast-ct-claude-agentic-dual-domain-n2i-search-20260703-01", "runtime": {"elapsed_s": 918.6888709068298}, "schema_version": 3, "solver_key": "dual-domain-n2i", "solver_name": "DD-UNet N2I (per-image)", "split": {"train_n": 400, "val_n": 200}, "status": "discard", "ts": "2026-07-06T04:29:04Z"}
