{"advice_for_others": "itnet_v3-claude-agentic: itnet_k=2, unet_c=24, alpha_init=0.0025734, lr=0.00015, epochs=4, batch_size=1, train_n=2400, val_n=200, grad_clip=1.0, max_train_s=1080, seed=42, rationale=iter-13 (breast-ct redo, search-20260703-01). START FROM iter-12 NEW CHAMPION (c24/ep5/bs1/lr2.16e-4, hr 0.8638). ONE KNOB: lr 0.00021567 -> 0.00015 (LOWER, re-tune lr for the smaller batch). epochs traded 5 -> 4 to fund the SAME train+score wall room, since iter-12 hit 19.85min at ep5/bs1 (at the wall); at bs=1 4 epochs still = 9600 gradient updates > iter-7 bs2/ep5's 6000, so this stays a heavily-optimized regime. All else = iter-12 champion (itnet_k=2, unet_c=24, alpha_init=0.0025734, batch_size=1, train_n=2400, val_n=200, grad_clip=1.0, seed=42). SIX-BOX (NUMBERS): (1) iter-12 (c24/ep5/bs1/lr2.16e-4): 0.8638=NEW BEST (+0.017 over the bs2 champion), SSIM 0.9987, PSNR 53.64, elapsed 1190.98s=19.85min (AT the wall). bs=1 doubled gradient updates/epoch and converged the epoch-budget-limited net much further. (2) FAILURE MODE / lever: at bs=1 the noisier per-step gradient often prefers a LOWER lr than bs=2 did (the iter-9/10 lr sweep was done at bs=2). Re-tune lr DOWN for the smaller batch; simultaneously ep5->4 is REQUIRED to keep train+score inside the wall (iter-12 was already at 19.85min). (3) ONE KNOB (primary): lr 2.16e-4 -> 1.5e-4 at bs=1 (epochs 5->4 is a budget-forced trade, not a free knob -- flagged). (4) HYPOTHESIS: lr=1.5e-4 at bs=1 lifts hr above 0.8638 because the smaller batch's noisier gradients converge more stably at a lower lr, finding a flatter minimum. FALSIFIER (NUMBERS): if hr <= 0.8638, either bs=1 already prefers lr=2.16e-4 (iter-14 keeps lr=2.16e-4/bs1 and instead trims train_n to 2000 to fit ep5 fully) OR the ep5->4 cut cost more than the lr gain -> iter-14 restores ep5 at lr2.16e-4/bs1 (=re-confirm iter-12) and does seed replicates. (5) BUDGET (HARD 20min=1200s): iter-12 ep5/bs1=1190.98s. Per-epoch@bs1/n2400 ~= (1191-140 fixed)/5 ~= 210s. At ep4: 140 + 4*210 = 980s = 16.3min < 1200s with ~4min margin (the ep5->4 cut buys back the headroom iter-12 lacked). max_train_s=1080 fences the TRAIN phase. train_n=2400 (<= OOM-safe cap; bs=1 low peak mem). val=200 distinct val_truth.h5 cases, 256px inscribed-circle FOV (breast default). (6) do NOT return control mid-campaign; gate on iter-13 numeric-headroom obs via iter_wait.sh v3 then dispatch iter-14.", "agent": "itnet_v3-claude-agentic", "campaign": "search-20260703-01", "cfg_full": {"alpha_init": 0.0025734, "batch_size": 1, "epochs": 4, "grad_clip": 1.0, "itnet_k": 2, "lr": 0.00015, "max_train_s": 1080, "rationale": "iter-13 (breast-ct redo, search-20260703-01). START FROM iter-12 NEW CHAMPION (c24/ep5/bs1/lr2.16e-4, hr 0.8638). ONE KNOB: lr 0.00021567 -> 0.00015 (LOWER, re-tune lr for the smaller batch). epochs traded 5 -> 4 to fund the SAME train+score wall room, since iter-12 hit 19.85min at ep5/bs1 (at the wall); at bs=1 4 epochs still = 9600 gradient updates > iter-7 bs2/ep5's 6000, so this stays a heavily-optimized regime. All else = iter-12 champion (itnet_k=2, unet_c=24, alpha_init=0.0025734, batch_size=1, train_n=2400, val_n=200, grad_clip=1.0, seed=42). SIX-BOX (NUMBERS): (1) iter-12 (c24/ep5/bs1/lr2.16e-4): 0.8638=NEW BEST (+0.017 over the bs2 champion), SSIM 0.9987, PSNR 53.64, elapsed 1190.98s=19.85min (AT the wall). bs=1 doubled gradient updates/epoch and converged the epoch-budget-limited net much further. (2) FAILURE MODE / lever: at bs=1 the noisier per-step gradient often prefers a LOWER lr than bs=2 did (the iter-9/10 lr sweep was done at bs=2). Re-tune lr DOWN for the smaller batch; simultaneously ep5->4 is REQUIRED to keep train+score inside the wall (iter-12 was already at 19.85min). (3) ONE KNOB (primary): lr 2.16e-4 -> 1.5e-4 at bs=1 (epochs 5->4 is a budget-forced trade, not a free knob -- flagged). (4) HYPOTHESIS: lr=1.5e-4 at bs=1 lifts hr above 0.8638 because the smaller batch's noisier gradients converge more stably at a lower lr, finding a flatter minimum. FALSIFIER (NUMBERS): if hr <= 0.8638, either bs=1 already prefers lr=2.16e-4 (iter-14 keeps lr=2.16e-4/bs1 and instead trims train_n to 2000 to fit ep5 fully) OR the ep5->4 cut cost more than the lr gain -> iter-14 restores ep5 at lr2.16e-4/bs1 (=re-confirm iter-12) and does seed replicates. (5) BUDGET (HARD 20min=1200s): iter-12 ep5/bs1=1190.98s. Per-epoch@bs1/n2400 ~= (1191-140 fixed)/5 ~= 210s. At ep4: 140 + 4*210 = 980s = 16.3min < 1200s with ~4min margin (the ep5->4 cut buys back the headroom iter-12 lacked). max_train_s=1080 fences the TRAIN phase. train_n=2400 (<= OOM-safe cap; bs=1 low peak mem). val=200 distinct val_truth.h5 cases, 256px inscribed-circle FOV (breast default). (6) do NOT return control mid-campaign; gate on iter-13 numeric-headroom obs via iter_wait.sh v3 then dispatch iter-14.", "seed": 42, "train_n": 2400, "unet_c": 24, "val_n": 200}, "challenge": "breast_ct", "change_class": "architecture", "git_commit": "671da566", "images": {"comparison": "runs/breast-ct-claude-agentic-itnet-v3-search-20260703-01/iterations/iter-0013/comparison.png", "test_showcase": null, "valtest_showcase": null}, "iter": 13, "kept": true, "metrics": {"headroom": 0.8379209801324196, "headroom_std": 0.013883810339325205, "val_psnr": 52.129661560058594, "val_psnr_std": 1.312698404617994, "val_rmse": 0.000845125992782414, "val_rmse_std": 0.00012359755011289036, "val_ssim": 0.9983085989952087, "val_ssim_std": 0.0005388026316820495}, "model": "claude-opus-4-8-1m", "obs_path": "breast-ct-claude-agentic-itnet-v3-search-20260703-01/iterations/iter-0013/observation.json", "obs_sha1": "639b5b2aef2e7de8c2b54233dd4caf006f244ed7", "params_M": 8.317706, "params_source": "observation", "rationale": "itnet_v3-claude-agentic: itnet_k=2, unet_c=24, alpha_init=0.0025734, lr=0.00015, epochs=4, batch_size=1, train_n=2400, val_n=200, grad_clip=1.0, max_train_s=1080, seed=42, rationale=iter-13 (breast-ct redo, search-20260703-01). START FROM iter-12 NEW CHAMPION (c24/ep5/bs1/lr2.16e-4, hr 0.8638). ONE KNOB: lr 0.00021567 -> 0.00015 (LOWER, re-tune lr for the smaller batch). epochs traded 5 -> 4 to fund the SAME train+score wall room, since iter-12 hit 19.85min at ep5/bs1 (at the wall); at bs=1 4 epochs still = 9600 gradient updates > iter-7 bs2/ep5's 6000, so this stays a heavily-optimized regime. All else = iter-12 champion (itnet_k=2, unet_c=24, alpha_init=0.0025734, batch_size=1, train_n=2400, val_n=200, grad_clip=1.0, seed=42). SIX-BOX (NUMBERS): (1) iter-12 (c24/ep5/bs1/lr2.16e-4): 0.8638=NEW BEST (+0.017 over the bs2 champion), SSIM 0.9987, PSNR 53.64, elapsed 1190.98s=19.85min (AT the wall). bs=1 doubled gradient updates/epoch and converged the epoch-budget-limited net much further. (2) FAILURE MODE / lever: at bs=1 the noisier per-step gradient often prefers a LOWER lr than bs=2 did (the iter-9/10 lr sweep was done at bs=2). Re-tune lr DOWN for the smaller batch; simultaneously ep5->4 is REQUIRED to keep train+score inside the wall (iter-12 was already at 19.85min). (3) ONE KNOB (primary): lr 2.16e-4 -> 1.5e-4 at bs=1 (epochs 5->4 is a budget-forced trade, not a free knob -- flagged). (4) HYPOTHESIS: lr=1.5e-4 at bs=1 lifts hr above 0.8638 because the smaller batch's noisier gradients converge more stably at a lower lr, finding a flatter minimum. FALSIFIER (NUMBERS): if hr <= 0.8638, either bs=1 already prefers lr=2.16e-4 (iter-14 keeps lr=2.16e-4/bs1 and instead trims train_n to 2000 to fit ep5 fully) OR the ep5->4 cut cost more than the lr gain -> iter-14 restores ep5 at lr2.16e-4/bs1 (=re-confirm iter-12) and does seed replicates. (5) BUDGET (HARD 20min=1200s): iter-12 ep5/bs1=1190.98s. Per-epoch@bs1/n2400 ~= (1191-140 fixed)/5 ~= 210s. At ep4: 140 + 4*210 = 980s = 16.3min < 1200s with ~4min margin (the ep5->4 cut buys back the headroom iter-12 lacked). max_train_s=1080 fences the TRAIN phase. train_n=2400 (<= OOM-safe cap; bs=1 low peak mem). val=200 distinct val_truth.h5 cases, 256px inscribed-circle FOV (breast default). (6) do NOT return control mid-campaign; gate on iter-13 numeric-headroom obs via iter_wait.sh v3 then dispatch iter-14.", "run_id": "breast-ct-claude-agentic-itnet-v3-search-20260703-01", "runtime": {"elapsed_s": 1022.5375425815582}, "schema_version": 3, "solver_key": "itnet-v3", "solver_name": "ITNet v3", "split": {"train_n": 400, "val_n": 200}, "status": "keep", "ts": "2026-07-05T06:27:48Z"}
{"advice_for_others": "itnet_v3-claude-agentic: itnet_k=2, unet_c=24, alpha_init=0.0025734, lr=0.00021567, epochs=5, batch_size=1, train_n=2400, val_n=200, grad_clip=1.0, max_train_s=1130, seed=43, rationale=iter-14 (breast-ct redo, search-20260703-01). FIRST SEED REPLICATE of the iter-12 champion (c24/ep5/bs1/lr2.16e-4/alpha0.0025734/n2400, hr 0.8638). ONE KNOB: seed 42 -> 43. EVERYTHING else = iter-12 champion EXACTLY (itnet_k=2, unet_c=24, alpha_init=0.0025734, lr=2.16e-4, epochs=5, batch_size=1, train_n=2400, val_n=200, grad_clip=1.0) so this is a TRUE replicate of the reported champion config (n2400 held -- NOT trimmed). SIX-BOX (NUMBERS): (1) iter-12 (c24/ep5/bs1/lr2.16e-4/seed42): 0.8638=CHAMPION, SSIM 0.9987, PSNR 53.64, RMSE 7.10e-4, elapsed 1190.98s=19.85min. iter-13 (bs1/ep4/lr1.5e-4): 0.8379 -- confirmed lr=2.16e-4/ep5 best at bs=1; TRAINING RECIPE FULLY MAPPED (lr optimal 2.16e-4, alpha_init inert, bs=1>>bs=2, epochs wall-capped, arch k=2/c=24 bounded). (2) FAILURE MODE: none -- search PLATEAUED at the champion. Remaining iters establish the champion SEED SPREAD (leaderboard mean+/-std, per the itnet_v2 sibling protocol). (3) ONE KNOB: seed 42 -> 43. (4) HYPOTHESIS: hr within ~+/-0.01 of 0.8638 at seed 43, giving the 2nd point of the champion mean+/-std and confirming robustness. FALSIFIER (NUMBERS): if hr swings >0.02 from 0.8638, the champion is seed-sensitive (val_n=200 noise floor) -> iters 15+ widen the replicate set. (5) BUDGET (HARD 20min=1200s): IDENTICAL config to iter-12 except the seed scalar (no compute change) -> elapsed ~= iter-12's 1190.98s=19.85min, just inside 1200s. max_train_s=1130 fences the TRAIN phase so if this node is slower than iter-12's the train loop truncates gracefully and a finite val+figure still land inside the 30-min sbatch wall (the metric is still computed on the trained-so-far model -> valid numeric-headroom obs). train_n=2400 (<= OOM-safe cap; bs=1 low peak mem). val=200 distinct val_truth.h5 cases, 256px inscribed-circle FOV (breast default). (6) do NOT return control mid-campaign; gate on iter-14 numeric-headroom obs via iter_wait.sh v3 then dispatch iter-15.", "agent": "itnet_v3-claude-agentic", "campaign": "search-20260703-01", "cfg_full": {"alpha_init": 0.0025734, "batch_size": 1, "epochs": 5, "grad_clip": 1.0, "itnet_k": 2, "lr": 0.00021567, "max_train_s": 1130, "rationale": "iter-14 (breast-ct redo, search-20260703-01). FIRST SEED REPLICATE of the iter-12 champion (c24/ep5/bs1/lr2.16e-4/alpha0.0025734/n2400, hr 0.8638). ONE KNOB: seed 42 -> 43. EVERYTHING else = iter-12 champion EXACTLY (itnet_k=2, unet_c=24, alpha_init=0.0025734, lr=2.16e-4, epochs=5, batch_size=1, train_n=2400, val_n=200, grad_clip=1.0) so this is a TRUE replicate of the reported champion config (n2400 held -- NOT trimmed). SIX-BOX (NUMBERS): (1) iter-12 (c24/ep5/bs1/lr2.16e-4/seed42): 0.8638=CHAMPION, SSIM 0.9987, PSNR 53.64, RMSE 7.10e-4, elapsed 1190.98s=19.85min. iter-13 (bs1/ep4/lr1.5e-4): 0.8379 -- confirmed lr=2.16e-4/ep5 best at bs=1; TRAINING RECIPE FULLY MAPPED (lr optimal 2.16e-4, alpha_init inert, bs=1>>bs=2, epochs wall-capped, arch k=2/c=24 bounded). (2) FAILURE MODE: none -- search PLATEAUED at the champion. Remaining iters establish the champion SEED SPREAD (leaderboard mean+/-std, per the itnet_v2 sibling protocol). (3) ONE KNOB: seed 42 -> 43. (4) HYPOTHESIS: hr within ~+/-0.01 of 0.8638 at seed 43, giving the 2nd point of the champion mean+/-std and confirming robustness. FALSIFIER (NUMBERS): if hr swings >0.02 from 0.8638, the champion is seed-sensitive (val_n=200 noise floor) -> iters 15+ widen the replicate set. (5) BUDGET (HARD 20min=1200s): IDENTICAL config to iter-12 except the seed scalar (no compute change) -> elapsed ~= iter-12's 1190.98s=19.85min, just inside 1200s. max_train_s=1130 fences the TRAIN phase so if this node is slower than iter-12's the train loop truncates gracefully and a finite val+figure still land inside the 30-min sbatch wall (the metric is still computed on the trained-so-far model -> valid numeric-headroom obs). train_n=2400 (<= OOM-safe cap; bs=1 low peak mem). val=200 distinct val_truth.h5 cases, 256px inscribed-circle FOV (breast default). (6) do NOT return control mid-campaign; gate on iter-14 numeric-headroom obs via iter_wait.sh v3 then dispatch iter-15.", "seed": 43, "train_n": 2400, "unet_c": 24, "val_n": 200}, "challenge": "breast_ct", "change_class": "architecture", "git_commit": "671da566", "images": {"comparison": "runs/breast-ct-claude-agentic-itnet-v3-search-20260703-01/iterations/iter-0014/comparison.png", "test_showcase": null, "valtest_showcase": null}, "iter": 14, "kept": true, "metrics": {"headroom": 0.7983456974532643, "headroom_std": 0.016249063844032876, "val_psnr": 50.23204803466797, "val_psnr_std": 1.282469237533725, "val_rmse": 0.0010514827445149422, "val_rmse_std": 0.00015037193312682337, "val_ssim": 0.9980447292327881, "val_ssim_std": 0.0006253577740772626}, "model": "claude-opus-4-8-1m", "obs_path": "breast-ct-claude-agentic-itnet-v3-search-20260703-01/iterations/iter-0014/observation.json", "obs_sha1": "bf1ec8cb9cc56f83ab732618333f1c78bdd1c6e1", "params_M": 8.317706, "params_source": "observation", "rationale": "itnet_v3-claude-agentic: itnet_k=2, unet_c=24, alpha_init=0.0025734, lr=0.00021567, epochs=5, batch_size=1, train_n=2400, val_n=200, grad_clip=1.0, max_train_s=1130, seed=43, rationale=iter-14 (breast-ct redo, search-20260703-01). FIRST SEED REPLICATE of the iter-12 champion (c24/ep5/bs1/lr2.16e-4/alpha0.0025734/n2400, hr 0.8638). ONE KNOB: seed 42 -> 43. EVERYTHING else = iter-12 champion EXACTLY (itnet_k=2, unet_c=24, alpha_init=0.0025734, lr=2.16e-4, epochs=5, batch_size=1, train_n=2400, val_n=200, grad_clip=1.0) so this is a TRUE replicate of the reported champion config (n2400 held -- NOT trimmed). SIX-BOX (NUMBERS): (1) iter-12 (c24/ep5/bs1/lr2.16e-4/seed42): 0.8638=CHAMPION, SSIM 0.9987, PSNR 53.64, RMSE 7.10e-4, elapsed 1190.98s=19.85min. iter-13 (bs1/ep4/lr1.5e-4): 0.8379 -- confirmed lr=2.16e-4/ep5 best at bs=1; TRAINING RECIPE FULLY MAPPED (lr optimal 2.16e-4, alpha_init inert, bs=1>>bs=2, epochs wall-capped, arch k=2/c=24 bounded). (2) FAILURE MODE: none -- search PLATEAUED at the champion. Remaining iters establish the champion SEED SPREAD (leaderboard mean+/-std, per the itnet_v2 sibling protocol). (3) ONE KNOB: seed 42 -> 43. (4) HYPOTHESIS: hr within ~+/-0.01 of 0.8638 at seed 43, giving the 2nd point of the champion mean+/-std and confirming robustness. FALSIFIER (NUMBERS): if hr swings >0.02 from 0.8638, the champion is seed-sensitive (val_n=200 noise floor) -> iters 15+ widen the replicate set. (5) BUDGET (HARD 20min=1200s): IDENTICAL config to iter-12 except the seed scalar (no compute change) -> elapsed ~= iter-12's 1190.98s=19.85min, just inside 1200s. max_train_s=1130 fences the TRAIN phase so if this node is slower than iter-12's the train loop truncates gracefully and a finite val+figure still land inside the 30-min sbatch wall (the metric is still computed on the trained-so-far model -> valid numeric-headroom obs). train_n=2400 (<= OOM-safe cap; bs=1 low peak mem). val=200 distinct val_truth.h5 cases, 256px inscribed-circle FOV (breast default). (6) do NOT return control mid-campaign; gate on iter-14 numeric-headroom obs via iter_wait.sh v3 then dispatch iter-15.", "run_id": "breast-ct-claude-agentic-itnet-v3-search-20260703-01", "runtime": {"elapsed_s": 1214.0867409706116}, "schema_version": 3, "solver_key": "itnet-v3", "solver_name": "ITNet v3", "split": {"train_n": 400, "val_n": 200}, "status": "keep", "ts": "2026-07-05T07:31:29Z"}
