{"advice_for_others": "itnet_v3-claude-agentic: itnet_k=2, unet_c=24, alpha_init=0.005, lr=0.00021567, epochs=5, batch_size=2, train_n=2400, val_n=200, grad_clip=1.0, max_train_s=1100, seed=42, rationale=iter-11 (breast-ct redo, search-20260703-01). START FROM iter-7 CHAMPION (c24/ep5/lr2.16e-4/alpha0.0025734, hr 0.8469). ONE KNOB: alpha_init 0.0025734 -> 0.005 (~2x, stronger initial DC step size). All else = champion exactly (itnet_k=2, unet_c=24, lr=2.16e-4, epochs=5, batch_size=2, train_n=2400, val_n=200, grad_clip=1.0, seed=42). SIX-BOX (NUMBERS): (1) lr is now BRACKETED and UNIMODAL at the seed: iter-10 lr1.5e-4 -> 0.8415, iter-7 lr2.16e-4 -> 0.8469 (CHAMPION), iter-9 lr3.5e-4 -> 0.8398. Both lr neighbors are worse -> lr=2.16e-4 is the recipe optimum (iter-10 falsifier fired). (2) FAILURE MODE / lever: the last un-tuned training-recipe knob is alpha_init -- the DC step size the unrolled loop uses in dc_step (x <- x - alpha * R^T(Rx - sino)). It is learnable (softplus(log_alpha)) but its INIT sets the optimization path; it has been fixed at the TPE-seed 0.0025734 since iter-1. A larger init -> stronger sinogram data-consistency pull early in training, which can sharpen the 128-view breast recon. (3) ONE KNOB: alpha_init 0.0025734 -> 0.005 (~2x). c/k/lr/epochs/train_n held so any hr change isolates the DC-step init. (4) HYPOTHESIS: alpha_init=0.005 lifts hr above 0.8469 because a stronger initial DC coupling enforces measured-sinogram consistency better on this sparse 128-view geometry. FALSIFIER (NUMBERS): if hr <= 0.8469 at alpha_init=0.005, the learnable alpha already converges to its optimum regardless of init (init is inert) OR a stronger DC over-weights the noisy sinogram -> iter-12 tries a LOWER alpha_init (0.0015) or, if that is also flat, declares the training recipe exhausted and does a seed-robustness replicate of the champion. (5) BUDGET (HARD 20min=1200s): IDENTICAL config to iter-7 except the alpha_init scalar (no compute change) -> elapsed ~= 900-1090s = 15-18min < 1200s. max_train_s=1100 fences the TRAIN phase. train_n=2400 (<= OOM-safe cap). val=200 distinct val_truth.h5 cases, 256px inscribed-circle FOV (breast default). (6) do NOT return control mid-campaign; gate on iter-11 numeric-headroom obs via iter_wait.sh v3 then dispatch iter-12.", "agent": "itnet_v3-claude-agentic", "campaign": "search-20260703-01", "cfg_full": {"alpha_init": 0.005, "batch_size": 2, "epochs": 5, "grad_clip": 1.0, "itnet_k": 2, "lr": 0.00021567, "max_train_s": 1100, "rationale": "iter-11 (breast-ct redo, search-20260703-01). START FROM iter-7 CHAMPION (c24/ep5/lr2.16e-4/alpha0.0025734, hr 0.8469). ONE KNOB: alpha_init 0.0025734 -> 0.005 (~2x, stronger initial DC step size). All else = champion exactly (itnet_k=2, unet_c=24, lr=2.16e-4, epochs=5, batch_size=2, train_n=2400, val_n=200, grad_clip=1.0, seed=42). SIX-BOX (NUMBERS): (1) lr is now BRACKETED and UNIMODAL at the seed: iter-10 lr1.5e-4 -> 0.8415, iter-7 lr2.16e-4 -> 0.8469 (CHAMPION), iter-9 lr3.5e-4 -> 0.8398. Both lr neighbors are worse -> lr=2.16e-4 is the recipe optimum (iter-10 falsifier fired). (2) FAILURE MODE / lever: the last un-tuned training-recipe knob is alpha_init -- the DC step size the unrolled loop uses in dc_step (x <- x - alpha * R^T(Rx - sino)). It is learnable (softplus(log_alpha)) but its INIT sets the optimization path; it has been fixed at the TPE-seed 0.0025734 since iter-1. A larger init -> stronger sinogram data-consistency pull early in training, which can sharpen the 128-view breast recon. (3) ONE KNOB: alpha_init 0.0025734 -> 0.005 (~2x). c/k/lr/epochs/train_n held so any hr change isolates the DC-step init. (4) HYPOTHESIS: alpha_init=0.005 lifts hr above 0.8469 because a stronger initial DC coupling enforces measured-sinogram consistency better on this sparse 128-view geometry. FALSIFIER (NUMBERS): if hr <= 0.8469 at alpha_init=0.005, the learnable alpha already converges to its optimum regardless of init (init is inert) OR a stronger DC over-weights the noisy sinogram -> iter-12 tries a LOWER alpha_init (0.0015) or, if that is also flat, declares the training recipe exhausted and does a seed-robustness replicate of the champion. (5) BUDGET (HARD 20min=1200s): IDENTICAL config to iter-7 except the alpha_init scalar (no compute change) -> elapsed ~= 900-1090s = 15-18min < 1200s. max_train_s=1100 fences the TRAIN phase. train_n=2400 (<= OOM-safe cap). val=200 distinct val_truth.h5 cases, 256px inscribed-circle FOV (breast default). (6) do NOT return control mid-campaign; gate on iter-11 numeric-headroom obs via iter_wait.sh v3 then dispatch iter-12.", "seed": 42, "train_n": 2400, "unet_c": 24, "val_n": 200}, "challenge": "breast_ct", "change_class": "architecture", "git_commit": "671da566", "images": {"comparison": "runs/breast-ct-claude-agentic-itnet-v3-search-20260703-01/iterations/iter-0011/comparison.png", "test_showcase": null, "valtest_showcase": null}, "iter": 11, "kept": true, "metrics": {"headroom": 0.8459102111177683, "headroom_std": 0.01729714168956865, "val_psnr": 52.568721771240234, "val_psnr_std": 1.5710128547902606, "val_rmse": 0.0008034678758122027, "val_rmse_std": 0.00013895338867922624, "val_ssim": 0.9982790350914001, "val_ssim_std": 0.0005866062306402859}, "model": "claude-opus-4-8-1m", "obs_path": "breast-ct-claude-agentic-itnet-v3-search-20260703-01/iterations/iter-0011/observation.json", "obs_sha1": "f69009046499ff1780aafd464e018c99e8d34d8f", "params_M": 8.317706, "params_source": "observation", "rationale": "itnet_v3-claude-agentic: itnet_k=2, unet_c=24, alpha_init=0.005, lr=0.00021567, epochs=5, batch_size=2, train_n=2400, val_n=200, grad_clip=1.0, max_train_s=1100, seed=42, rationale=iter-11 (breast-ct redo, search-20260703-01). START FROM iter-7 CHAMPION (c24/ep5/lr2.16e-4/alpha0.0025734, hr 0.8469). ONE KNOB: alpha_init 0.0025734 -> 0.005 (~2x, stronger initial DC step size). All else = champion exactly (itnet_k=2, unet_c=24, lr=2.16e-4, epochs=5, batch_size=2, train_n=2400, val_n=200, grad_clip=1.0, seed=42). SIX-BOX (NUMBERS): (1) lr is now BRACKETED and UNIMODAL at the seed: iter-10 lr1.5e-4 -> 0.8415, iter-7 lr2.16e-4 -> 0.8469 (CHAMPION), iter-9 lr3.5e-4 -> 0.8398. Both lr neighbors are worse -> lr=2.16e-4 is the recipe optimum (iter-10 falsifier fired). (2) FAILURE MODE / lever: the last un-tuned training-recipe knob is alpha_init -- the DC step size the unrolled loop uses in dc_step (x <- x - alpha * R^T(Rx - sino)). It is learnable (softplus(log_alpha)) but its INIT sets the optimization path; it has been fixed at the TPE-seed 0.0025734 since iter-1. A larger init -> stronger sinogram data-consistency pull early in training, which can sharpen the 128-view breast recon. (3) ONE KNOB: alpha_init 0.0025734 -> 0.005 (~2x). c/k/lr/epochs/train_n held so any hr change isolates the DC-step init. (4) HYPOTHESIS: alpha_init=0.005 lifts hr above 0.8469 because a stronger initial DC coupling enforces measured-sinogram consistency better on this sparse 128-view geometry. FALSIFIER (NUMBERS): if hr <= 0.8469 at alpha_init=0.005, the learnable alpha already converges to its optimum regardless of init (init is inert) OR a stronger DC over-weights the noisy sinogram -> iter-12 tries a LOWER alpha_init (0.0015) or, if that is also flat, declares the training recipe exhausted and does a seed-robustness replicate of the champion. (5) BUDGET (HARD 20min=1200s): IDENTICAL config to iter-7 except the alpha_init scalar (no compute change) -> elapsed ~= 900-1090s = 15-18min < 1200s. max_train_s=1100 fences the TRAIN phase. train_n=2400 (<= OOM-safe cap). val=200 distinct val_truth.h5 cases, 256px inscribed-circle FOV (breast default). (6) do NOT return control mid-campaign; gate on iter-11 numeric-headroom obs via iter_wait.sh v3 then dispatch iter-12.", "run_id": "breast-ct-claude-agentic-itnet-v3-search-20260703-01", "runtime": {"elapsed_s": 1062.0515472888947}, "schema_version": 3, "solver_key": "itnet-v3", "solver_name": "ITNet v3", "split": {"train_n": 400, "val_n": 200}, "status": "keep", "ts": "2026-07-05T04:28:27Z"}
{"advice_for_others": "itnet_v3-claude-agentic: itnet_k=2, unet_c=24, alpha_init=0.0025734, lr=0.00021567, epochs=5, batch_size=1, train_n=2400, val_n=200, grad_clip=1.0, max_train_s=1120, seed=42, rationale=iter-12 (breast-ct redo, search-20260703-01). START FROM iter-7 CHAMPION (c24/ep5/lr2.16e-4/alpha0.0025734/bs2, hr 0.8469). ONE KNOB: batch_size 2 -> 1. All else = champion exactly (itnet_k=2, unet_c=24, alpha_init=0.0025734, lr=2.16e-4, epochs=5, train_n=2400, val_n=200, grad_clip=1.0, seed=42). SIX-BOX (NUMBERS): (1) champion iter-7 (c24/ep5/bs2): 0.8469. TRAINING RECIPE now mapped: lr unimodal-optimal at 2.16e-4 (iter-9 3.5e-4->0.8398, iter-10 1.5e-4->0.8415), alpha_init INERT (iter-11 0.005->0.8459 = tie, learnable alpha self-corrects). (2) FAILURE MODE / lever: the c24 net was EPOCH-BUDGET-LIMITED (epochs still climbing at ep5 but the wall caps it). batch_size 2->1 DOUBLES the number of gradient UPDATES per epoch (2400 steps/epoch vs 1200) at the SAME data and ~same total compute -- effectively buys the extra optimization the epoch budget couldn't, and small-batch noise often generalizes better. This is the last un-probed training lever before seed replicates. (3) ONE KNOB: batch_size 2 -> 1 (2x gradient updates/epoch; c/k/lr/alpha/epochs/train_n held). (4) HYPOTHESIS: bs=1 lifts hr above 0.8469 because 2x more optimizer steps on the epoch-budget-limited c24 net converges further, and small-batch gradient noise regularizes toward a flatter minimum on the 200-case val split. FALSIFIER (NUMBERS): if hr <= 0.8469 at bs=1, the champion bs=2 is already optimal (or bs=1's noisier gradients hurt) -> the training recipe is fully exhausted and iters 13+ become SEED-ROBUSTNESS replicates of the champion to establish the leaderboard mean+/-std. (5) BUDGET (HARD 20min=1200s): bs=1 vs bs=2 keeps total forward/backward work ~constant (same samples/epoch) but doubles optimizer-step + python-loop overhead; iter-7 bs2 = 939.5s, worst observed same-config node variance = 1093.9s (iter-9). bs=1 overhead adds maybe +5-8pct -> predicted ~1000-1150s = 16.7-19.2min < 1200s. max_train_s=1120 fences the TRAIN phase so even on a slow node a finite val+figure land inside the 30-min sbatch wall. train_n=2400 (<= OOM-safe cap; bs=1 uses LESS peak GPU mem than bs=2). val=200 distinct val_truth.h5 cases, 256px inscribed-circle FOV (breast default). (6) do NOT return control mid-campaign; gate on iter-12 numeric-headroom obs via iter_wait.sh v3 then dispatch iter-13.", "agent": "itnet_v3-claude-agentic", "campaign": "search-20260703-01", "cfg_full": {"alpha_init": 0.0025734, "batch_size": 1, "epochs": 5, "grad_clip": 1.0, "itnet_k": 2, "lr": 0.00021567, "max_train_s": 1120, "rationale": "iter-12 (breast-ct redo, search-20260703-01). START FROM iter-7 CHAMPION (c24/ep5/lr2.16e-4/alpha0.0025734/bs2, hr 0.8469). ONE KNOB: batch_size 2 -> 1. All else = champion exactly (itnet_k=2, unet_c=24, alpha_init=0.0025734, lr=2.16e-4, epochs=5, train_n=2400, val_n=200, grad_clip=1.0, seed=42). SIX-BOX (NUMBERS): (1) champion iter-7 (c24/ep5/bs2): 0.8469. TRAINING RECIPE now mapped: lr unimodal-optimal at 2.16e-4 (iter-9 3.5e-4->0.8398, iter-10 1.5e-4->0.8415), alpha_init INERT (iter-11 0.005->0.8459 = tie, learnable alpha self-corrects). (2) FAILURE MODE / lever: the c24 net was EPOCH-BUDGET-LIMITED (epochs still climbing at ep5 but the wall caps it). batch_size 2->1 DOUBLES the number of gradient UPDATES per epoch (2400 steps/epoch vs 1200) at the SAME data and ~same total compute -- effectively buys the extra optimization the epoch budget couldn't, and small-batch noise often generalizes better. This is the last un-probed training lever before seed replicates. (3) ONE KNOB: batch_size 2 -> 1 (2x gradient updates/epoch; c/k/lr/alpha/epochs/train_n held). (4) HYPOTHESIS: bs=1 lifts hr above 0.8469 because 2x more optimizer steps on the epoch-budget-limited c24 net converges further, and small-batch gradient noise regularizes toward a flatter minimum on the 200-case val split. FALSIFIER (NUMBERS): if hr <= 0.8469 at bs=1, the champion bs=2 is already optimal (or bs=1's noisier gradients hurt) -> the training recipe is fully exhausted and iters 13+ become SEED-ROBUSTNESS replicates of the champion to establish the leaderboard mean+/-std. (5) BUDGET (HARD 20min=1200s): bs=1 vs bs=2 keeps total forward/backward work ~constant (same samples/epoch) but doubles optimizer-step + python-loop overhead; iter-7 bs2 = 939.5s, worst observed same-config node variance = 1093.9s (iter-9). bs=1 overhead adds maybe +5-8pct -> predicted ~1000-1150s = 16.7-19.2min < 1200s. max_train_s=1120 fences the TRAIN phase so even on a slow node a finite val+figure land inside the 30-min sbatch wall. train_n=2400 (<= OOM-safe cap; bs=1 uses LESS peak GPU mem than bs=2). val=200 distinct val_truth.h5 cases, 256px inscribed-circle FOV (breast default). (6) do NOT return control mid-campaign; gate on iter-12 numeric-headroom obs via iter_wait.sh v3 then dispatch iter-13.", "seed": 42, "train_n": 2400, "unet_c": 24, "val_n": 200}, "challenge": "breast_ct", "change_class": "architecture", "git_commit": "671da566", "images": {"comparison": "runs/breast-ct-claude-agentic-itnet-v3-search-20260703-01/iterations/iter-0012/comparison.png", "test_showcase": null, "valtest_showcase": null}, "iter": 12, "kept": true, "metrics": {"headroom": 0.8638244357780948, "headroom_std": 0.013792208579289908, "val_psnr": 53.642215728759766, "val_psnr_std": 1.45011802615081, "val_rmse": 0.0007100580260157585, "val_rmse_std": 0.00011368956650626485, "val_ssim": 0.99869704246521, "val_ssim_std": 0.00044073248399201806}, "model": "claude-opus-4-8-1m", "obs_path": "breast-ct-claude-agentic-itnet-v3-search-20260703-01/iterations/iter-0012/observation.json", "obs_sha1": "c251e42d5271a245f8fc01ace779490f2f72f20b", "params_M": 8.317706, "params_source": "observation", "rationale": "itnet_v3-claude-agentic: itnet_k=2, unet_c=24, alpha_init=0.0025734, lr=0.00021567, epochs=5, batch_size=1, train_n=2400, val_n=200, grad_clip=1.0, max_train_s=1120, seed=42, rationale=iter-12 (breast-ct redo, search-20260703-01). START FROM iter-7 CHAMPION (c24/ep5/lr2.16e-4/alpha0.0025734/bs2, hr 0.8469). ONE KNOB: batch_size 2 -> 1. All else = champion exactly (itnet_k=2, unet_c=24, alpha_init=0.0025734, lr=2.16e-4, epochs=5, train_n=2400, val_n=200, grad_clip=1.0, seed=42). SIX-BOX (NUMBERS): (1) champion iter-7 (c24/ep5/bs2): 0.8469. TRAINING RECIPE now mapped: lr unimodal-optimal at 2.16e-4 (iter-9 3.5e-4->0.8398, iter-10 1.5e-4->0.8415), alpha_init INERT (iter-11 0.005->0.8459 = tie, learnable alpha self-corrects). (2) FAILURE MODE / lever: the c24 net was EPOCH-BUDGET-LIMITED (epochs still climbing at ep5 but the wall caps it). batch_size 2->1 DOUBLES the number of gradient UPDATES per epoch (2400 steps/epoch vs 1200) at the SAME data and ~same total compute -- effectively buys the extra optimization the epoch budget couldn't, and small-batch noise often generalizes better. This is the last un-probed training lever before seed replicates. (3) ONE KNOB: batch_size 2 -> 1 (2x gradient updates/epoch; c/k/lr/alpha/epochs/train_n held). (4) HYPOTHESIS: bs=1 lifts hr above 0.8469 because 2x more optimizer steps on the epoch-budget-limited c24 net converges further, and small-batch gradient noise regularizes toward a flatter minimum on the 200-case val split. FALSIFIER (NUMBERS): if hr <= 0.8469 at bs=1, the champion bs=2 is already optimal (or bs=1's noisier gradients hurt) -> the training recipe is fully exhausted and iters 13+ become SEED-ROBUSTNESS replicates of the champion to establish the leaderboard mean+/-std. (5) BUDGET (HARD 20min=1200s): bs=1 vs bs=2 keeps total forward/backward work ~constant (same samples/epoch) but doubles optimizer-step + python-loop overhead; iter-7 bs2 = 939.5s, worst observed same-config node variance = 1093.9s (iter-9). bs=1 overhead adds maybe +5-8pct -> predicted ~1000-1150s = 16.7-19.2min < 1200s. max_train_s=1120 fences the TRAIN phase so even on a slow node a finite val+figure land inside the 30-min sbatch wall. train_n=2400 (<= OOM-safe cap; bs=1 uses LESS peak GPU mem than bs=2). val=200 distinct val_truth.h5 cases, 256px inscribed-circle FOV (breast default). (6) do NOT return control mid-campaign; gate on iter-12 numeric-headroom obs via iter_wait.sh v3 then dispatch iter-13.", "run_id": "breast-ct-claude-agentic-itnet-v3-search-20260703-01", "runtime": {"elapsed_s": 1190.982089996338}, "schema_version": 3, "solver_key": "itnet-v3", "solver_name": "ITNet v3", "split": {"train_n": 400, "val_n": 200}, "status": "keep", "ts": "2026-07-05T05:30:36Z"}
