{"advice_for_others": "manhart_pwls_tv-claude-agentic: val_n=200, pwls_gamma=1.0, pwls_weight_norm=mean, tv_lambda=0.0025, tv_iterations=1000, tv_lr=0.01, tv_decay=0.01, tv_optimizer=gd, tv_init=fbp, rationale=iter-16 LAMBDA peak refinement. tv_init zeros (iter-15) collapsed hr->0.0 (FBP warm-start essential for TV-GD); revert to fbp. Lambda peak is shallow: 2e-3->0.3552, 3e-3->0.3596 (best), 4e-3->0.3336. ONE knob: tv_lambda 3e-3->2.5e-3 (best config otherwise: gamma=1, 1000it, gd, lr=0.01, decay=0.01, fbp init). HYPOTHESIS: if hr>0.3596 the true peak is between 2e-3 and 3e-3 (near 2.5e-3); if hr<0.3596 the peak is at/above 3e-3 and 0.3596 stands as the plain-TV optimum on breast. Budget: ~868s at 1000 iters, <1200s wall.", "agent": "manhart_pwls_tv-claude-agentic", "campaign": "search-20260703-01", "cfg_full": {"pwls_gamma": 1.0, "pwls_weight_norm": "mean", "rationale": "iter-16 LAMBDA peak refinement. tv_init zeros (iter-15) collapsed hr->0.0 (FBP warm-start essential for TV-GD); revert to fbp. Lambda peak is shallow: 2e-3->0.3552, 3e-3->0.3596 (best), 4e-3->0.3336. ONE knob: tv_lambda 3e-3->2.5e-3 (best config otherwise: gamma=1, 1000it, gd, lr=0.01, decay=0.01, fbp init). HYPOTHESIS: if hr>0.3596 the true peak is between 2e-3 and 3e-3 (near 2.5e-3); if hr<0.3596 the peak is at/above 3e-3 and 0.3596 stands as the plain-TV optimum on breast. Budget: ~868s at 1000 iters, <1200s wall.", "tv_decay": 0.01, "tv_init": "fbp", "tv_iterations": 1000, "tv_lambda": 0.0025, "tv_lr": 0.01, "tv_optimizer": "gd", "val_n": 200}, "challenge": "breast_ct", "change_class": "architecture", "git_commit": "671da566", "images": {"comparison": "runs/breast-ct-claude-agentic-manhart-pwls-tv-search-20260703-01/iterations/iter-0016/comparison.png", "test_showcase": null, "valtest_showcase": null}, "iter": 16, "kept": true, "metrics": {"headroom": 0.36284940445662006, "headroom_std": 0.014770061058368566, "val_psnr": 40.23935317993164, "val_psnr_std": 0.5958039841330928, "val_rmse": 0.0033222839701920748, "val_rmse_std": 0.0002222606827587547, "val_ssim": 0.9913056492805481, "val_ssim_std": 0.001753353561319879}, "model": "claude-opus-4-8-1m", "obs_path": "breast-ct-claude-agentic-manhart-pwls-tv-search-20260703-01/iterations/iter-0016/observation.json", "obs_sha1": "a9c370646ccaafb659913269695f790cbc372e36", "params_M": 0.0, "params_source": "observation", "rationale": "manhart_pwls_tv-claude-agentic: val_n=200, pwls_gamma=1.0, pwls_weight_norm=mean, tv_lambda=0.0025, tv_iterations=1000, tv_lr=0.01, tv_decay=0.01, tv_optimizer=gd, tv_init=fbp, rationale=iter-16 LAMBDA peak refinement. tv_init zeros (iter-15) collapsed hr->0.0 (FBP warm-start essential for TV-GD); revert to fbp. Lambda peak is shallow: 2e-3->0.3552, 3e-3->0.3596 (best), 4e-3->0.3336. ONE knob: tv_lambda 3e-3->2.5e-3 (best config otherwise: gamma=1, 1000it, gd, lr=0.01, decay=0.01, fbp init). HYPOTHESIS: if hr>0.3596 the true peak is between 2e-3 and 3e-3 (near 2.5e-3); if hr<0.3596 the peak is at/above 3e-3 and 0.3596 stands as the plain-TV optimum on breast. Budget: ~868s at 1000 iters, <1200s wall.", "run_id": "breast-ct-claude-agentic-manhart-pwls-tv-search-20260703-01", "runtime": {"elapsed_s": 827.9737975597382}, "schema_version": 3, "solver_key": "manhart-pwls-tv", "solver_name": "Manhart PWLS-TV (ray-weighted)", "split": {"train_n": 400, "val_n": 200}, "status": "keep", "ts": "2026-07-05T12:24:34Z"}
{"advice_for_others": "manhart_pwls_tv-claude-agentic: val_n=200, pwls_gamma=1.0, pwls_weight_norm=mean, tv_lambda=0.00225, tv_iterations=1000, tv_lr=0.01, tv_decay=0.01, tv_optimizer=gd, tv_init=fbp, rationale=iter-17 LAMBDA peak refinement (fine). iter-16 (lambda=2.5e-3) hr=0.36285 NEW BEST, beating 3e-3 (0.3596) and 2e-3 (0.3552) => peak bracketed at 2.5e-3 (2e-3<2.5e-3>3e-3). ONE knob: tv_lambda 2.5e-3->2.25e-3 (test the low side of the bracket). HYPOTHESIS: if hr>0.36285 the peak is between 2e-3 and 2.5e-3; if hr<0.36285 the peak is at/above 2.5e-3 and 0.3628 stands as the plain-TV optimum. Also verifies the just-applied solver save-fix: recon_raw.npz should now have keys pred+truth+baseline with truth=real phantom (per-case mean ~0.13, not ~0.067). Best config otherwise: gamma=1, 1000it, gd, lr=0.01, decay=0.01, fbp init. Budget: ~830s at 1000 iters, <1200s wall.", "agent": "manhart_pwls_tv-claude-agentic", "campaign": "search-20260703-01", "cfg_full": {"pwls_gamma": 1.0, "pwls_weight_norm": "mean", "rationale": "iter-17 LAMBDA peak refinement (fine). iter-16 (lambda=2.5e-3) hr=0.36285 NEW BEST, beating 3e-3 (0.3596) and 2e-3 (0.3552) => peak bracketed at 2.5e-3 (2e-3<2.5e-3>3e-3). ONE knob: tv_lambda 2.5e-3->2.25e-3 (test the low side of the bracket). HYPOTHESIS: if hr>0.36285 the peak is between 2e-3 and 2.5e-3; if hr<0.36285 the peak is at/above 2.5e-3 and 0.3628 stands as the plain-TV optimum. Also verifies the just-applied solver save-fix: recon_raw.npz should now have keys pred+truth+baseline with truth=real phantom (per-case mean ~0.13, not ~0.067). Best config otherwise: gamma=1, 1000it, gd, lr=0.01, decay=0.01, fbp init. Budget: ~830s at 1000 iters, <1200s wall.", "tv_decay": 0.01, "tv_init": "fbp", "tv_iterations": 1000, "tv_lambda": 0.00225, "tv_lr": 0.01, "tv_optimizer": "gd", "val_n": 200}, "challenge": "breast_ct", "change_class": "architecture", "git_commit": "671da566", "images": {"comparison": "runs/breast-ct-claude-agentic-manhart-pwls-tv-search-20260703-01/iterations/iter-0017/comparison.png", "test_showcase": null, "valtest_showcase": null}, "iter": 17, "kept": true, "metrics": {"headroom": 0.36071921375217464, "headroom_std": 0.014249159882153743, "val_psnr": 40.210365295410156, "val_psnr_std": 0.6134600703013307, "val_rmse": 0.0033333913888782263, "val_rmse_std": 0.00022989168550962264, "val_ssim": 0.9912824630737305, "val_ssim_std": 0.0018954230189804045}, "model": "claude-opus-4-8-1m", "obs_path": "breast-ct-claude-agentic-manhart-pwls-tv-search-20260703-01/iterations/iter-0017/observation.json", "obs_sha1": "d89df716dc55e6cee613b5eca6ae2c8e03310243", "params_M": 0.0, "params_source": "observation", "rationale": "manhart_pwls_tv-claude-agentic: val_n=200, pwls_gamma=1.0, pwls_weight_norm=mean, tv_lambda=0.00225, tv_iterations=1000, tv_lr=0.01, tv_decay=0.01, tv_optimizer=gd, tv_init=fbp, rationale=iter-17 LAMBDA peak refinement (fine). iter-16 (lambda=2.5e-3) hr=0.36285 NEW BEST, beating 3e-3 (0.3596) and 2e-3 (0.3552) => peak bracketed at 2.5e-3 (2e-3<2.5e-3>3e-3). ONE knob: tv_lambda 2.5e-3->2.25e-3 (test the low side of the bracket). HYPOTHESIS: if hr>0.36285 the peak is between 2e-3 and 2.5e-3; if hr<0.36285 the peak is at/above 2.5e-3 and 0.3628 stands as the plain-TV optimum. Also verifies the just-applied solver save-fix: recon_raw.npz should now have keys pred+truth+baseline with truth=real phantom (per-case mean ~0.13, not ~0.067). Best config otherwise: gamma=1, 1000it, gd, lr=0.01, decay=0.01, fbp init. Budget: ~830s at 1000 iters, <1200s wall.", "run_id": "breast-ct-claude-agentic-manhart-pwls-tv-search-20260703-01", "runtime": {"elapsed_s": 828.2017557621002}, "schema_version": 3, "solver_key": "manhart-pwls-tv", "solver_name": "Manhart PWLS-TV (ray-weighted)", "split": {"train_n": 400, "val_n": 200}, "status": "keep", "ts": "2026-07-05T12:44:02Z"}
{"advice_for_others": "manhart_pwls_tv-claude-agentic: val_n=200, pwls_gamma=1.0, pwls_weight_norm=mean, tv_lambda=0.00275, tv_iterations=1000, tv_lr=0.01, tv_decay=0.01, tv_optimizer=gd, tv_init=fbp, rationale=iter-18 LAMBDA peak bracket (high side). Peak at lambda=2.5e-3 (iter-16 hr=0.36285 best); neighbors 2.25e-3->0.36072 (iter-17) and 3e-3->0.3596 (iter-9) both lower. ONE knob: tv_lambda 2.5e-3->2.75e-3 to bracket the high side. HYPOTHESIS: if hr>0.36285 the true optimum is just above 2.5e-3 (between 2.5 and 3e-3); if hr<0.36285, lambda=2.5e-3 is the confirmed plain-TV optimum on breast. Save-fix now live so this iter produces a std-capable recon_raw.npz (pred+truth+baseline). Best config otherwise: gamma=1, 1000it, gd, lr=0.01, decay=0.01, fbp init. Budget: ~830s at 1000 iters, <1200s wall.", "agent": "manhart_pwls_tv-claude-agentic", "campaign": "search-20260703-01", "cfg_full": {"pwls_gamma": 1.0, "pwls_weight_norm": "mean", "rationale": "iter-18 LAMBDA peak bracket (high side). Peak at lambda=2.5e-3 (iter-16 hr=0.36285 best); neighbors 2.25e-3->0.36072 (iter-17) and 3e-3->0.3596 (iter-9) both lower. ONE knob: tv_lambda 2.5e-3->2.75e-3 to bracket the high side. HYPOTHESIS: if hr>0.36285 the true optimum is just above 2.5e-3 (between 2.5 and 3e-3); if hr<0.36285, lambda=2.5e-3 is the confirmed plain-TV optimum on breast. Save-fix now live so this iter produces a std-capable recon_raw.npz (pred+truth+baseline). Best config otherwise: gamma=1, 1000it, gd, lr=0.01, decay=0.01, fbp init. Budget: ~830s at 1000 iters, <1200s wall.", "tv_decay": 0.01, "tv_init": "fbp", "tv_iterations": 1000, "tv_lambda": 0.00275, "tv_lr": 0.01, "tv_optimizer": "gd", "val_n": 200}, "challenge": "breast_ct", "change_class": "architecture", "git_commit": "671da566", "images": {"comparison": "runs/breast-ct-claude-agentic-manhart-pwls-tv-search-20260703-01/iterations/iter-0018/comparison.png", "test_showcase": null, "valtest_showcase": null}, "iter": 18, "kept": true, "metrics": {"headroom": 0.362319736864784, "headroom_std": 0.015235661662694681, "val_psnr": 40.232139587402344, "val_psnr_std": 0.5809099178880767, "val_rmse": 0.003325045807287097, "val_rmse_std": 0.00021664731648051358, "val_ssim": 0.9911164045333862, "val_ssim_std": 0.0016865491781018662}, "model": "claude-opus-4-8-1m", "obs_path": "breast-ct-claude-agentic-manhart-pwls-tv-search-20260703-01/iterations/iter-0018/observation.json", "obs_sha1": "3b1332d10c18e402fc426e7915268b8ae4dbece9", "params_M": 0.0, "params_source": "observation", "rationale": "manhart_pwls_tv-claude-agentic: val_n=200, pwls_gamma=1.0, pwls_weight_norm=mean, tv_lambda=0.00275, tv_iterations=1000, tv_lr=0.01, tv_decay=0.01, tv_optimizer=gd, tv_init=fbp, rationale=iter-18 LAMBDA peak bracket (high side). Peak at lambda=2.5e-3 (iter-16 hr=0.36285 best); neighbors 2.25e-3->0.36072 (iter-17) and 3e-3->0.3596 (iter-9) both lower. ONE knob: tv_lambda 2.5e-3->2.75e-3 to bracket the high side. HYPOTHESIS: if hr>0.36285 the true optimum is just above 2.5e-3 (between 2.5 and 3e-3); if hr<0.36285, lambda=2.5e-3 is the confirmed plain-TV optimum on breast. Save-fix now live so this iter produces a std-capable recon_raw.npz (pred+truth+baseline). Best config otherwise: gamma=1, 1000it, gd, lr=0.01, decay=0.01, fbp init. Budget: ~830s at 1000 iters, <1200s wall.", "run_id": "breast-ct-claude-agentic-manhart-pwls-tv-search-20260703-01", "runtime": {"elapsed_s": 821.672266960144}, "schema_version": 3, "solver_key": "manhart-pwls-tv", "solver_name": "Manhart PWLS-TV (ray-weighted)", "split": {"train_n": 400, "val_n": 200}, "status": "keep", "ts": "2026-07-05T14:45:42Z"}
{"advice_for_others": "manhart_pwls_tv-claude-agentic: val_n=200, pwls_gamma=1.0, pwls_weight_norm=max, tv_lambda=0.0025, tv_iterations=1000, tv_lr=0.01, tv_decay=0.01, tv_optimizer=gd, tv_init=fbp, rationale=iter-19 PWLS weight-norm confirm. Lambda peak fully mapped at 2.5e-3 (iter-16 hr=0.36285): 2e-3=0.3552, 2.25e-3=0.3607, 2.5e-3=0.36285 PEAK, 2.75e-3=0.36232, 3e-3=0.3596, 4e-3=0.3336. Last untested PWLS sub-lever: pwls_weight_norm. ONE knob: pwls_weight_norm mean->max at best config (gamma=1, lambda=2.5e-3, 1000it, gd, lr=0.01, decay=0.01, fbp). HYPOTHESIS: since the gamma ray-weight is INERT (W has no measurable effect on the TV-dominated recon), changing its normalization also has no effect -> hr ~= 0.3628, completing the PWLS-negative result (inert regardless of normalization). Budget: ~830s at 1000 iters, <1200s wall.", "agent": "manhart_pwls_tv-claude-agentic", "campaign": "search-20260703-01", "cfg_full": {"pwls_gamma": 1.0, "pwls_weight_norm": "max", "rationale": "iter-19 PWLS weight-norm confirm. Lambda peak fully mapped at 2.5e-3 (iter-16 hr=0.36285): 2e-3=0.3552, 2.25e-3=0.3607, 2.5e-3=0.36285 PEAK, 2.75e-3=0.36232, 3e-3=0.3596, 4e-3=0.3336. Last untested PWLS sub-lever: pwls_weight_norm. ONE knob: pwls_weight_norm mean->max at best config (gamma=1, lambda=2.5e-3, 1000it, gd, lr=0.01, decay=0.01, fbp). HYPOTHESIS: since the gamma ray-weight is INERT (W has no measurable effect on the TV-dominated recon), changing its normalization also has no effect -> hr ~= 0.3628, completing the PWLS-negative result (inert regardless of normalization). Budget: ~830s at 1000 iters, <1200s wall.", "tv_decay": 0.01, "tv_init": "fbp", "tv_iterations": 1000, "tv_lambda": 0.0025, "tv_lr": 0.01, "tv_optimizer": "gd", "val_n": 200}, "challenge": "breast_ct", "change_class": "architecture", "git_commit": "671da566", "images": {"comparison": "runs/breast-ct-claude-agentic-manhart-pwls-tv-search-20260703-01/iterations/iter-0019/comparison.png", "test_showcase": null, "valtest_showcase": null}, "iter": 19, "kept": true, "metrics": {"headroom": 0.36285520927764003, "headroom_std": 0.0147688470577763, "val_psnr": 40.23943328857422, "val_psnr_std": 0.5958034236115315, "val_rmse": 0.0033222537022083998, "val_rmse_std": 0.00022225859243560063, "val_ssim": 0.9913056492805481, "val_ssim_std": 0.0017533336612843863}, "model": "claude-opus-4-8-1m", "obs_path": "breast-ct-claude-agentic-manhart-pwls-tv-search-20260703-01/iterations/iter-0019/observation.json", "obs_sha1": "4a05f7026295a5e595f92af77f75010e3c63134f", "params_M": 0.0, "params_source": "observation", "rationale": "manhart_pwls_tv-claude-agentic: val_n=200, pwls_gamma=1.0, pwls_weight_norm=max, tv_lambda=0.0025, tv_iterations=1000, tv_lr=0.01, tv_decay=0.01, tv_optimizer=gd, tv_init=fbp, rationale=iter-19 PWLS weight-norm confirm. Lambda peak fully mapped at 2.5e-3 (iter-16 hr=0.36285): 2e-3=0.3552, 2.25e-3=0.3607, 2.5e-3=0.36285 PEAK, 2.75e-3=0.36232, 3e-3=0.3596, 4e-3=0.3336. Last untested PWLS sub-lever: pwls_weight_norm. ONE knob: pwls_weight_norm mean->max at best config (gamma=1, lambda=2.5e-3, 1000it, gd, lr=0.01, decay=0.01, fbp). HYPOTHESIS: since the gamma ray-weight is INERT (W has no measurable effect on the TV-dominated recon), changing its normalization also has no effect -> hr ~= 0.3628, completing the PWLS-negative result (inert regardless of normalization). Budget: ~830s at 1000 iters, <1200s wall.", "run_id": "breast-ct-claude-agentic-manhart-pwls-tv-search-20260703-01", "runtime": {"elapsed_s": 827.8983790874481}, "schema_version": 3, "solver_key": "manhart-pwls-tv", "solver_name": "Manhart PWLS-TV (ray-weighted)", "split": {"train_n": 400, "val_n": 200}, "status": "keep", "ts": "2026-07-05T15:28:06Z"}
{"advice_for_others": "manhart_pwls_tv-claude-agentic: val_n=200, pwls_gamma=1.0, pwls_weight_norm=mean, tv_lambda=0.0025, tv_iterations=1000, tv_lr=0.01, tv_decay=0.01, tv_optimizer=gd, tv_init=fbp, rationale=iter-20 FINAL canonical best-config reproduction. Search complete: the lambda peak is firmly at 2.5e-3 (hr=0.36285, iter-16), and PWLS ray-weighting is INERT on breast across BOTH gamma (iter-9 g=1 vs iter-14 g=0 identical to 7 digits) AND normalization (iter-19 norm=max vs iter-16 norm=mean identical to 6 digits) -- the TV term dominates the data residual so W=exp(-gamma*p) has no measurable effect. This iter reverts pwls_weight_norm max->mean to exactly reproduce the iter-16 best config (gamma=1, lambda=2.5e-3, 1000it, gd, lr=0.01, decay=0.01, fbp init) with the save-fix live, producing the definitive std-capable recon_raw.npz (pred+truth+baseline) as the canonical final result. HYPOTHESIS: reproduces hr~=0.3628, the plain-TV optimum on breast. Budget: ~830s at 1000 iters, <1200s wall.", "agent": "manhart_pwls_tv-claude-agentic", "campaign": "search-20260703-01", "cfg_full": {"pwls_gamma": 1.0, "pwls_weight_norm": "mean", "rationale": "iter-20 FINAL canonical best-config reproduction. Search complete: the lambda peak is firmly at 2.5e-3 (hr=0.36285, iter-16), and PWLS ray-weighting is INERT on breast across BOTH gamma (iter-9 g=1 vs iter-14 g=0 identical to 7 digits) AND normalization (iter-19 norm=max vs iter-16 norm=mean identical to 6 digits) -- the TV term dominates the data residual so W=exp(-gamma*p) has no measurable effect. This iter reverts pwls_weight_norm max->mean to exactly reproduce the iter-16 best config (gamma=1, lambda=2.5e-3, 1000it, gd, lr=0.01, decay=0.01, fbp init) with the save-fix live, producing the definitive std-capable recon_raw.npz (pred+truth+baseline) as the canonical final result. HYPOTHESIS: reproduces hr~=0.3628, the plain-TV optimum on breast. Budget: ~830s at 1000 iters, <1200s wall.", "tv_decay": 0.01, "tv_init": "fbp", "tv_iterations": 1000, "tv_lambda": 0.0025, "tv_lr": 0.01, "tv_optimizer": "gd", "val_n": 200}, "challenge": "breast_ct", "change_class": "architecture", "git_commit": "671da566", "images": {"comparison": "runs/breast-ct-claude-agentic-manhart-pwls-tv-search-20260703-01/iterations/iter-0020/comparison.png", "test_showcase": null, "valtest_showcase": null}, "iter": 20, "kept": true, "metrics": {"headroom": 0.36284940445662006, "headroom_std": 0.014770061058368566, "val_psnr": 40.23935317993164, "val_psnr_std": 0.5958039841330928, "val_rmse": 0.0033222839701920748, "val_rmse_std": 0.0002222606827587547, "val_ssim": 0.9913056492805481, "val_ssim_std": 0.001753353561319879}, "model": "claude-opus-4-8-1m", "obs_path": "breast-ct-claude-agentic-manhart-pwls-tv-search-20260703-01/iterations/iter-0020/observation.json", "obs_sha1": "b538806b87b2fbb3b69775330821512b98e6dc40", "params_M": 0.0, "params_source": "observation", "rationale": "manhart_pwls_tv-claude-agentic: val_n=200, pwls_gamma=1.0, pwls_weight_norm=mean, tv_lambda=0.0025, tv_iterations=1000, tv_lr=0.01, tv_decay=0.01, tv_optimizer=gd, tv_init=fbp, rationale=iter-20 FINAL canonical best-config reproduction. Search complete: the lambda peak is firmly at 2.5e-3 (hr=0.36285, iter-16), and PWLS ray-weighting is INERT on breast across BOTH gamma (iter-9 g=1 vs iter-14 g=0 identical to 7 digits) AND normalization (iter-19 norm=max vs iter-16 norm=mean identical to 6 digits) -- the TV term dominates the data residual so W=exp(-gamma*p) has no measurable effect. This iter reverts pwls_weight_norm max->mean to exactly reproduce the iter-16 best config (gamma=1, lambda=2.5e-3, 1000it, gd, lr=0.01, decay=0.01, fbp init) with the save-fix live, producing the definitive std-capable recon_raw.npz (pred+truth+baseline) as the canonical final result. HYPOTHESIS: reproduces hr~=0.3628, the plain-TV optimum on breast. Budget: ~830s at 1000 iters, <1200s wall.", "run_id": "breast-ct-claude-agentic-manhart-pwls-tv-search-20260703-01", "runtime": {"elapsed_s": 823.4530711174011}, "schema_version": 3, "solver_key": "manhart-pwls-tv", "solver_name": "Manhart PWLS-TV (ray-weighted)", "split": {"train_n": 400, "val_n": 200}, "status": "keep", "ts": "2026-07-05T16:27:30Z"}
