{"advice_for_others": "dual_domain_bilateral_n2i-claude-agentic: warm_start=True, pretrain_epochs=2, train_n=400, n_iter=30, val_n=200, batch_size=1, grad_clip=1.0, lr=0.005, proj_n_bf=1, img_n_bf=1, img_sr=0.0002, outer_wall_s=900, seed=42, rationale=iter-7 dual_domain_bilateral_n2i, ONE-KNOB: image BF range sigma img_sr 0.0005->0.0002 (even tighter edge-preservation). proj_sr REVERTED to default 0.02 (iter-6 tightened proj_sr->0.0005 and hr DROPPED 0.1257->0.1003 = edge-hard projection filtering causes view inconsistency, findings.md confirmed; proj domain stays gentle). CHAMPION = iter-5 (img_sr=0.0005) hr=0.1257 SSIM0.9605 PSNR39.57. HYPOTHESIS: the image-domain range sigma is the live lever; 0.02->0.0005 gained +0.126 hr by making the BF stop at intensity edges. A yet-tighter 0.0002 preserves MORE fibroglandular edge detail -> hr climbs further, UNLESS the kernel becomes near-identity (range so tight the BF barely averages -> no denoising -> recon regresses toward the raw noisy FBP, hr back toward 0). This iter locates which side of the sweet spot 0.0005 is on: if hr>0.1257 keep tightening (0.0001); if hr<0.1257 the optimum is at/above 0.0005 (next: 0.001). BUDGET: value change, ~1000s. ONE knob: img_sr 0.0005->0.0002.", "agent": "dual_domain_bilateral_n2i-claude-agentic", "campaign": "search-20260703-01", "cfg_full": {"batch_size": 1, "grad_clip": 1.0, "img_n_bf": 1, "img_sr": 0.0002, "lr": 0.005, "n_iter": 30, "outer_wall_s": 900, "pretrain_epochs": 2, "proj_n_bf": 1, "rationale": "iter-7 dual_domain_bilateral_n2i, ONE-KNOB: image BF range sigma img_sr 0.0005->0.0002 (even tighter edge-preservation). proj_sr REVERTED to default 0.02 (iter-6 tightened proj_sr->0.0005 and hr DROPPED 0.1257->0.1003 = edge-hard projection filtering causes view inconsistency, findings.md confirmed; proj domain stays gentle). CHAMPION = iter-5 (img_sr=0.0005) hr=0.1257 SSIM0.9605 PSNR39.57. HYPOTHESIS: the image-domain range sigma is the live lever; 0.02->0.0005 gained +0.126 hr by making the BF stop at intensity edges. A yet-tighter 0.0002 preserves MORE fibroglandular edge detail -> hr climbs further, UNLESS the kernel becomes near-identity (range so tight the BF barely averages -> no denoising -> recon regresses toward the raw noisy FBP, hr back toward 0). This iter locates which side of the sweet spot 0.0005 is on: if hr>0.1257 keep tightening (0.0001); if hr<0.1257 the optimum is at/above 0.0005 (next: 0.001). BUDGET: value change, ~1000s. ONE knob: img_sr 0.0005->0.0002.", "seed": 42, "train_n": 400, "val_n": 200, "warm_start": true}, "challenge": "breast_ct", "change_class": "architecture", "git_commit": "671da566", "images": {"comparison": "runs/breast-ct-claude-agentic-dual-domain-bilateral-n2i-search-20260703-01/iterations/iter-0007/comparison.png", "test_showcase": null, "valtest_showcase": null}, "iter": 7, "kept": true, "metrics": {"headroom": 0.12607235920622262, "headroom_std": 0.10277719795703888, "val_psnr": 39.5748176574707, "val_psnr_std": 1.2094732522964478, "val_rmse": 0.0008600883884355426, "val_rmse_std": 0.00012244292884133756, "val_ssim": 0.960568368434906, "val_ssim_std": 0.014734688214957714}, "model": "claude-opus-4-8-1m", "obs_path": "breast-ct-claude-agentic-dual-domain-bilateral-n2i-search-20260703-01/iterations/iter-0007/observation.json", "obs_sha1": "e01b557f5f770064bfb068d267a742c24d4ec150", "params_M": 6e-06, "params_source": "observation", "rationale": "dual_domain_bilateral_n2i-claude-agentic: warm_start=True, pretrain_epochs=2, train_n=400, n_iter=30, val_n=200, batch_size=1, grad_clip=1.0, lr=0.005, proj_n_bf=1, img_n_bf=1, img_sr=0.0002, outer_wall_s=900, seed=42, rationale=iter-7 dual_domain_bilateral_n2i, ONE-KNOB: image BF range sigma img_sr 0.0005->0.0002 (even tighter edge-preservation). proj_sr REVERTED to default 0.02 (iter-6 tightened proj_sr->0.0005 and hr DROPPED 0.1257->0.1003 = edge-hard projection filtering causes view inconsistency, findings.md confirmed; proj domain stays gentle). CHAMPION = iter-5 (img_sr=0.0005) hr=0.1257 SSIM0.9605 PSNR39.57. HYPOTHESIS: the image-domain range sigma is the live lever; 0.02->0.0005 gained +0.126 hr by making the BF stop at intensity edges. A yet-tighter 0.0002 preserves MORE fibroglandular edge detail -> hr climbs further, UNLESS the kernel becomes near-identity (range so tight the BF barely averages -> no denoising -> recon regresses toward the raw noisy FBP, hr back toward 0). This iter locates which side of the sweet spot 0.0005 is on: if hr>0.1257 keep tightening (0.0001); if hr<0.1257 the optimum is at/above 0.0005 (next: 0.001). BUDGET: value change, ~1000s. ONE knob: img_sr 0.0005->0.0002.", "run_id": "breast-ct-claude-agentic-dual-domain-bilateral-n2i-search-20260703-01", "runtime": {"elapsed_s": 990.3106069564819}, "schema_version": 3, "solver_key": "dual-domain-bilateral-n2i", "solver_name": "DD-BF N2I (per-image)", "split": {"train_n": 400, "val_n": 200}, "status": "keep", "ts": "2026-07-05T20:15:59Z"}
{"advice_for_others": "dual_domain_bilateral_n2i-claude-agentic: warm_start=True, pretrain_epochs=2, train_n=400, n_iter=100, val_n=200, batch_size=1, grad_clip=1.0, lr=0.005, proj_n_bf=1, img_n_bf=1, img_sr=0.0002, outer_wall_s=900, seed=42, rationale=iter-8 dual_domain_bilateral_n2i, ONE-KNOB: per-scene steps n_iter 30->100, on the iter-7 CHAMPION base (img_sr=0.0002, img_n_bf=proj_n_bf=1). CHAMPION = iter-7 hr=0.1261 SSIM0.9606 PSNR39.57 (img_sr 0.0005->0.0002 marginal +0.0004 over iter-5's 0.1257; range-sigma optimum is flat ~2e-4..5e-4). HYPOTHESIS: iter-1/iter-3 showed n_iter did NOT help when img_sr was WIDE (0.02) -- more steps just pulled the over-smoothing BF further toward the blurry 64-view half-target. But now img_sr is TIGHT/edge-preserving, so additional per-scene N2I steps should refine the edge-preserving denoiser toward better noise suppression WITHOUT over-blurring (the tight range kernel structurally cannot cross edges regardless of step count) -> hr climbs above 0.1261. If hr FLAT/DROPS, the edge-preserving BF converges fast (30 steps already enough) and n_iter is saturated -> revert to 30 and move to spatial sigma. FAILURE watched: even edge-preserving, too many steps could still creep the recon toward the noisy half-target mean (mild PSNR drop). BUDGET: n_iter 30->100 ~3.3x inner steps; iter-7 ran 692s at n_iter30 on a fast node but iter-1 n_iter120 was 1200s -> n_iter100 ~1000-1100s; outer_wall_s=900 caps it (may trim a few scenes). ONE knob: n_iter 30->100.", "agent": "dual_domain_bilateral_n2i-claude-agentic", "campaign": "search-20260703-01", "cfg_full": {"batch_size": 1, "grad_clip": 1.0, "img_n_bf": 1, "img_sr": 0.0002, "lr": 0.005, "n_iter": 100, "outer_wall_s": 900, "pretrain_epochs": 2, "proj_n_bf": 1, "rationale": "iter-8 dual_domain_bilateral_n2i, ONE-KNOB: per-scene steps n_iter 30->100, on the iter-7 CHAMPION base (img_sr=0.0002, img_n_bf=proj_n_bf=1). CHAMPION = iter-7 hr=0.1261 SSIM0.9606 PSNR39.57 (img_sr 0.0005->0.0002 marginal +0.0004 over iter-5's 0.1257; range-sigma optimum is flat ~2e-4..5e-4). HYPOTHESIS: iter-1/iter-3 showed n_iter did NOT help when img_sr was WIDE (0.02) -- more steps just pulled the over-smoothing BF further toward the blurry 64-view half-target. But now img_sr is TIGHT/edge-preserving, so additional per-scene N2I steps should refine the edge-preserving denoiser toward better noise suppression WITHOUT over-blurring (the tight range kernel structurally cannot cross edges regardless of step count) -> hr climbs above 0.1261. If hr FLAT/DROPS, the edge-preserving BF converges fast (30 steps already enough) and n_iter is saturated -> revert to 30 and move to spatial sigma. FAILURE watched: even edge-preserving, too many steps could still creep the recon toward the noisy half-target mean (mild PSNR drop). BUDGET: n_iter 30->100 ~3.3x inner steps; iter-7 ran 692s at n_iter30 on a fast node but iter-1 n_iter120 was 1200s -> n_iter100 ~1000-1100s; outer_wall_s=900 caps it (may trim a few scenes). ONE knob: n_iter 30->100.", "seed": 42, "train_n": 400, "val_n": 200, "warm_start": true}, "challenge": "breast_ct", "change_class": "architecture", "git_commit": "671da566", "images": {"comparison": "runs/breast-ct-claude-agentic-dual-domain-bilateral-n2i-search-20260703-01/iterations/iter-0008/comparison.png", "test_showcase": null, "valtest_showcase": null}, "iter": 8, "kept": true, "metrics": {"headroom": 0.11599626985746714, "headroom_std": 0.09876967966556549, "val_psnr": 39.72456359863281, "val_psnr_std": 1.0911306142807007, "val_rmse": 0.0008453876944258809, "val_rmse_std": 0.00010730858775787055, "val_ssim": 0.9620240330696106, "val_ssim_std": 0.011356047354638577}, "model": "claude-opus-4-8-1m", "obs_path": "breast-ct-claude-agentic-dual-domain-bilateral-n2i-search-20260703-01/iterations/iter-0008/observation.json", "obs_sha1": "095027b871283cb2e3303acad438ca3991834461", "params_M": 6e-06, "params_source": "observation", "rationale": "dual_domain_bilateral_n2i-claude-agentic: warm_start=True, pretrain_epochs=2, train_n=400, n_iter=100, val_n=200, batch_size=1, grad_clip=1.0, lr=0.005, proj_n_bf=1, img_n_bf=1, img_sr=0.0002, outer_wall_s=900, seed=42, rationale=iter-8 dual_domain_bilateral_n2i, ONE-KNOB: per-scene steps n_iter 30->100, on the iter-7 CHAMPION base (img_sr=0.0002, img_n_bf=proj_n_bf=1). CHAMPION = iter-7 hr=0.1261 SSIM0.9606 PSNR39.57 (img_sr 0.0005->0.0002 marginal +0.0004 over iter-5's 0.1257; range-sigma optimum is flat ~2e-4..5e-4). HYPOTHESIS: iter-1/iter-3 showed n_iter did NOT help when img_sr was WIDE (0.02) -- more steps just pulled the over-smoothing BF further toward the blurry 64-view half-target. But now img_sr is TIGHT/edge-preserving, so additional per-scene N2I steps should refine the edge-preserving denoiser toward better noise suppression WITHOUT over-blurring (the tight range kernel structurally cannot cross edges regardless of step count) -> hr climbs above 0.1261. If hr FLAT/DROPS, the edge-preserving BF converges fast (30 steps already enough) and n_iter is saturated -> revert to 30 and move to spatial sigma. FAILURE watched: even edge-preserving, too many steps could still creep the recon toward the noisy half-target mean (mild PSNR drop). BUDGET: n_iter 30->100 ~3.3x inner steps; iter-7 ran 692s at n_iter30 on a fast node but iter-1 n_iter120 was 1200s -> n_iter100 ~1000-1100s; outer_wall_s=900 caps it (may trim a few scenes). ONE knob: n_iter 30->100.", "run_id": "breast-ct-claude-agentic-dual-domain-bilateral-n2i-search-20260703-01", "runtime": {"elapsed_s": 1428.7247788906097}, "schema_version": 3, "solver_key": "dual-domain-bilateral-n2i", "solver_name": "DD-BF N2I (per-image)", "split": {"train_n": 400, "val_n": 193}, "status": "keep", "ts": "2026-07-05T20:45:37Z"}
{"advice_for_others": "dual_domain_bilateral_n2i-claude-agentic: warm_start=True, pretrain_epochs=2, train_n=400, n_iter=30, val_n=200, batch_size=1, grad_clip=1.0, lr=0.005, proj_n_bf=1, img_n_bf=1, img_sr=0.0002, img_sx=2.5, img_sy=2.5, outer_wall_s=900, seed=42, rationale=iter-9 dual_domain_bilateral_n2i, ONE-KNOB: image BF SPATIAL sigma img_sx=img_sy 1.5->2.5 (isotropic widen), on iter-7 CHAMPION base (img_sr=0.0002, n_iter=30). n_iter REVERTED to 30 (iter-8 n_iter=100 gave hr=0.1160 on a wall-trimmed val_n=193/harder-baseline subset; SSIM/PSNR were actually higher 0.9620/39.72 but n_iter did not clearly help and it trims the val set -> keep 30 for a clean 200-scene comparison). CHAMPION = iter-7 hr=0.1261 (img_sr=0.0002). HYPOTHESIS: with the range kernel now EDGE-PRESERVING (tight img_sr), a WIDER spatial sigma lets each output pixel average over MORE same-tissue neighbours -> stronger flat-region noise suppression, while the tight range kernel still BLOCKS averaging across fibroglandular edges -> cleaner denoise WITHOUT new blur -> hr climbs above 0.1261. This is the direction that lifted the DEMO bilateral monotonically (1.5->2.5->3.5); the question is whether it transfers to breast NOW that range-edge-preservation is on (on the OLD-split breast it barely moved because range was not this tight). If hr FLAT/DROPS, breast's fine fibroglandular structure sits inside the widened window and even edge-guarded spatial widening blurs it -> spatial axis capped at 1.5. BUDGET: spatial-sigma cost is independent of VALUE (same 7x7 kernel unfold); ~700-1000s like iter-7. ONE knob: img_sx/img_sy 1.5->2.5.", "agent": "dual_domain_bilateral_n2i-claude-agentic", "campaign": "search-20260703-01", "cfg_full": {"batch_size": 1, "grad_clip": 1.0, "img_n_bf": 1, "img_sr": 0.0002, "img_sx": 2.5, "img_sy": 2.5, "lr": 0.005, "n_iter": 30, "outer_wall_s": 900, "pretrain_epochs": 2, "proj_n_bf": 1, "rationale": "iter-9 dual_domain_bilateral_n2i, ONE-KNOB: image BF SPATIAL sigma img_sx=img_sy 1.5->2.5 (isotropic widen), on iter-7 CHAMPION base (img_sr=0.0002, n_iter=30). n_iter REVERTED to 30 (iter-8 n_iter=100 gave hr=0.1160 on a wall-trimmed val_n=193/harder-baseline subset; SSIM/PSNR were actually higher 0.9620/39.72 but n_iter did not clearly help and it trims the val set -> keep 30 for a clean 200-scene comparison). CHAMPION = iter-7 hr=0.1261 (img_sr=0.0002). HYPOTHESIS: with the range kernel now EDGE-PRESERVING (tight img_sr), a WIDER spatial sigma lets each output pixel average over MORE same-tissue neighbours -> stronger flat-region noise suppression, while the tight range kernel still BLOCKS averaging across fibroglandular edges -> cleaner denoise WITHOUT new blur -> hr climbs above 0.1261. This is the direction that lifted the DEMO bilateral monotonically (1.5->2.5->3.5); the question is whether it transfers to breast NOW that range-edge-preservation is on (on the OLD-split breast it barely moved because range was not this tight). If hr FLAT/DROPS, breast's fine fibroglandular structure sits inside the widened window and even edge-guarded spatial widening blurs it -> spatial axis capped at 1.5. BUDGET: spatial-sigma cost is independent of VALUE (same 7x7 kernel unfold); ~700-1000s like iter-7. ONE knob: img_sx/img_sy 1.5->2.5.", "seed": 42, "train_n": 400, "val_n": 200, "warm_start": true}, "challenge": "breast_ct", "change_class": "architecture", "git_commit": "671da566", "images": {"comparison": "runs/breast-ct-claude-agentic-dual-domain-bilateral-n2i-search-20260703-01/iterations/iter-0009/comparison.png", "test_showcase": null, "valtest_showcase": null}, "iter": 9, "kept": true, "metrics": {"headroom": 0.11402760380948807, "headroom_std": 0.09916464984416962, "val_psnr": 39.70524215698242, "val_psnr_std": 1.094692587852478, "val_rmse": 0.0008472703630104661, "val_rmse_std": 0.00010767040657810867, "val_ssim": 0.9619981646537781, "val_ssim_std": 0.011293313466012478}, "model": "claude-opus-4-8-1m", "obs_path": "breast-ct-claude-agentic-dual-domain-bilateral-n2i-search-20260703-01/iterations/iter-0009/observation.json", "obs_sha1": "30744c48ffb99cd01aaedd3bd488474b4dd71524", "params_M": 6e-06, "params_source": "observation", "rationale": "dual_domain_bilateral_n2i-claude-agentic: warm_start=True, pretrain_epochs=2, train_n=400, n_iter=30, val_n=200, batch_size=1, grad_clip=1.0, lr=0.005, proj_n_bf=1, img_n_bf=1, img_sr=0.0002, img_sx=2.5, img_sy=2.5, outer_wall_s=900, seed=42, rationale=iter-9 dual_domain_bilateral_n2i, ONE-KNOB: image BF SPATIAL sigma img_sx=img_sy 1.5->2.5 (isotropic widen), on iter-7 CHAMPION base (img_sr=0.0002, n_iter=30). n_iter REVERTED to 30 (iter-8 n_iter=100 gave hr=0.1160 on a wall-trimmed val_n=193/harder-baseline subset; SSIM/PSNR were actually higher 0.9620/39.72 but n_iter did not clearly help and it trims the val set -> keep 30 for a clean 200-scene comparison). CHAMPION = iter-7 hr=0.1261 (img_sr=0.0002). HYPOTHESIS: with the range kernel now EDGE-PRESERVING (tight img_sr), a WIDER spatial sigma lets each output pixel average over MORE same-tissue neighbours -> stronger flat-region noise suppression, while the tight range kernel still BLOCKS averaging across fibroglandular edges -> cleaner denoise WITHOUT new blur -> hr climbs above 0.1261. This is the direction that lifted the DEMO bilateral monotonically (1.5->2.5->3.5); the question is whether it transfers to breast NOW that range-edge-preservation is on (on the OLD-split breast it barely moved because range was not this tight). If hr FLAT/DROPS, breast's fine fibroglandular structure sits inside the widened window and even edge-guarded spatial widening blurs it -> spatial axis capped at 1.5. BUDGET: spatial-sigma cost is independent of VALUE (same 7x7 kernel unfold); ~700-1000s like iter-7. ONE knob: img_sx/img_sy 1.5->2.5.", "run_id": "breast-ct-claude-agentic-dual-domain-bilateral-n2i-search-20260703-01", "runtime": {"elapsed_s": 1401.1876335144043}, "schema_version": 3, "solver_key": "dual-domain-bilateral-n2i", "solver_name": "DD-BF N2I (per-image)", "split": {"train_n": 400, "val_n": 193}, "status": "keep", "ts": "2026-07-05T21:10:21Z"}
