{"advice_for_others": "naf-claude-agentic: val_n=20, naf_n_freqs=8, naf_hidden=128, naf_layers=4, naf_n_iter=5000, naf_lr=0.01, naf_tv_weight=0.0001, naf_n_clip=0.05, naf_outer_wall_s=1000, naf_per_scene_s=48.0, seed=42, rationale=ITER-1 FEASIBILITY (breast-ct-claude-agentic-naf-search-20260703-01, REDONE breast split train3600/val200/test200 seed20260703). GOAL: does naf (Neural Attenuation Field, per-scene self-supervised INR -- one coordinate-MLP optimized PER breast slice against its OWN 128-view sinogram, no training set) run on the redone breast_ct staged val split and produce a FINITE val_score + comparison.png + recon_raw.npz WITHIN the HARD 20-min budget, scoring under the frozen calibrated-headroom metric (display 0..0.05, mu>=0 floor, FOV-masked)? BUDGET REASONING (load-bearing): NAF has NO training (train_n=0); the ENTIRE budget is the per-scene fit loop, total = val_n x per_scene. Per the user hint, naf is HEAVY so I use a SMALL val_n=20 (NOT 200) kept CONSTANT across all 20 iters so they are comparable (breast val load is deterministic first-20 of the 200-case val split). 1000s outer wall / 20 scenes = 48 s/scene (naf_per_scene_s=48), inside the 20-min compute budget with figure+IO headroom before the 30-min sbatch kill. breast is 512x512 at 128 views x det; each Adam step = a 512^2 MLP forward + 128-view fan-beam forward-project + backward. 48 s/scene buys HUNDREDS of steps -- a GENUINE NeRF-style per-scene fit, so hr=0 here would be a STRUCTURAL verdict, NOT budget starvation. naf_n_iter=5000 is a HIGH CAP so the PER-SCENE WALL (t_limit in fit_one_scene), NOT the iter count, is the governor. Leaner MLP than default (hidden 192->128, layers 5->4, n_freqs 10->8) for cheaper steps => more steps/scene; naf_lr 5e-3->1e-2 converges faster from the water-mu init in a bounded budget. naf_n_clip=0.05 (sigmoid head out_scale), naf_tv_weight=1e-4 defaults. HYPOTHESIS: NAF is STRUCTURALLY FBP-bounded on dense-view (128-angle) breast-CT -- docs/findings.md 2026-05-23 confirms NAF's sin/cos-posenc coordinate-MLP basis is too coarse for dense soft-tissue at 512^2/128-views and cannot beat the ~0.84 breast LD-FBP baseline (hr=0) even at 5x n_iter. Expect val_ssim that does NOT clear the FBP baseline (hr near 0). This iter ESTABLISHES that datapoint on the redone split under the frozen metric -- a real, valid finding (do NOT reduce val_n further or inflate to make NAF look better; hr=0 plateau documents the ceiling for paper section 5.4).", "agent": "naf-claude-agentic", "campaign": "search-20260703-01", "cfg_full": {"naf_hidden": 128, "naf_layers": 4, "naf_lr": 0.01, "naf_n_clip": 0.05, "naf_n_freqs": 8, "naf_n_iter": 5000, "naf_outer_wall_s": 1000, "naf_per_scene_s": 48.0, "naf_tv_weight": 0.0001, "rationale": "ITER-1 FEASIBILITY (breast-ct-claude-agentic-naf-search-20260703-01, REDONE breast split train3600/val200/test200 seed20260703). GOAL: does naf (Neural Attenuation Field, per-scene self-supervised INR -- one coordinate-MLP optimized PER breast slice against its OWN 128-view sinogram, no training set) run on the redone breast_ct staged val split and produce a FINITE val_score + comparison.png + recon_raw.npz WITHIN the HARD 20-min budget, scoring under the frozen calibrated-headroom metric (display 0..0.05, mu>=0 floor, FOV-masked)? BUDGET REASONING (load-bearing): NAF has NO training (train_n=0); the ENTIRE budget is the per-scene fit loop, total = val_n x per_scene. Per the user hint, naf is HEAVY so I use a SMALL val_n=20 (NOT 200) kept CONSTANT across all 20 iters so they are comparable (breast val load is deterministic first-20 of the 200-case val split). 1000s outer wall / 20 scenes = 48 s/scene (naf_per_scene_s=48), inside the 20-min compute budget with figure+IO headroom before the 30-min sbatch kill. breast is 512x512 at 128 views x det; each Adam step = a 512^2 MLP forward + 128-view fan-beam forward-project + backward. 48 s/scene buys HUNDREDS of steps -- a GENUINE NeRF-style per-scene fit, so hr=0 here would be a STRUCTURAL verdict, NOT budget starvation. naf_n_iter=5000 is a HIGH CAP so the PER-SCENE WALL (t_limit in fit_one_scene), NOT the iter count, is the governor. Leaner MLP than default (hidden 192->128, layers 5->4, n_freqs 10->8) for cheaper steps => more steps/scene; naf_lr 5e-3->1e-2 converges faster from the water-mu init in a bounded budget. naf_n_clip=0.05 (sigmoid head out_scale), naf_tv_weight=1e-4 defaults. HYPOTHESIS: NAF is STRUCTURALLY FBP-bounded on dense-view (128-angle) breast-CT -- docs/findings.md 2026-05-23 confirms NAF's sin/cos-posenc coordinate-MLP basis is too coarse for dense soft-tissue at 512^2/128-views and cannot beat the ~0.84 breast LD-FBP baseline (hr=0) even at 5x n_iter. Expect val_ssim that does NOT clear the FBP baseline (hr near 0). This iter ESTABLISHES that datapoint on the redone split under the frozen metric -- a real, valid finding (do NOT reduce val_n further or inflate to make NAF look better; hr=0 plateau documents the ceiling for paper section 5.4).", "seed": 42, "val_n": 20}, "challenge": "breast_ct", "change_class": "architecture", "git_commit": "671da566", "images": {"comparison": "runs/breast-ct-claude-agentic-naf-search-20260703-01/iterations/iter-0001/comparison.png", "test_showcase": null, "valtest_showcase": null}, "iter": 1, "kept": false, "metrics": {"headroom": 0.0, "headroom_std": 0.0, "val_psnr": 6.261971473693848, "val_psnr_std": 0.20383017208604173, "val_rmse": 0.15969057381153107, "val_rmse_std": 0.0013792179654752723, "val_ssim": 0.35450854897499084, "val_ssim_std": 0.00012094457300061093}, "model": "claude-opus-4-8-1m", "obs_path": "breast-ct-claude-agentic-naf-search-20260703-01/iterations/iter-0001/observation.json", "obs_sha1": "83fdd5583e18343d90f9d46a1bfe181cbd0c2497", "params_M": 0.037633, "params_source": "observation", "rationale": "naf-claude-agentic: val_n=20, naf_n_freqs=8, naf_hidden=128, naf_layers=4, naf_n_iter=5000, naf_lr=0.01, naf_tv_weight=0.0001, naf_n_clip=0.05, naf_outer_wall_s=1000, naf_per_scene_s=48.0, seed=42, rationale=ITER-1 FEASIBILITY (breast-ct-claude-agentic-naf-search-20260703-01, REDONE breast split train3600/val200/test200 seed20260703). GOAL: does naf (Neural Attenuation Field, per-scene self-supervised INR -- one coordinate-MLP optimized PER breast slice against its OWN 128-view sinogram, no training set) run on the redone breast_ct staged val split and produce a FINITE val_score + comparison.png + recon_raw.npz WITHIN the HARD 20-min budget, scoring under the frozen calibrated-headroom metric (display 0..0.05, mu>=0 floor, FOV-masked)? BUDGET REASONING (load-bearing): NAF has NO training (train_n=0); the ENTIRE budget is the per-scene fit loop, total = val_n x per_scene. Per the user hint, naf is HEAVY so I use a SMALL val_n=20 (NOT 200) kept CONSTANT across all 20 iters so they are comparable (breast val load is deterministic first-20 of the 200-case val split). 1000s outer wall / 20 scenes = 48 s/scene (naf_per_scene_s=48), inside the 20-min compute budget with figure+IO headroom before the 30-min sbatch kill. breast is 512x512 at 128 views x det; each Adam step = a 512^2 MLP forward + 128-view fan-beam forward-project + backward. 48 s/scene buys HUNDREDS of steps -- a GENUINE NeRF-style per-scene fit, so hr=0 here would be a STRUCTURAL verdict, NOT budget starvation. naf_n_iter=5000 is a HIGH CAP so the PER-SCENE WALL (t_limit in fit_one_scene), NOT the iter count, is the governor. Leaner MLP than default (hidden 192->128, layers 5->4, n_freqs 10->8) for cheaper steps => more steps/scene; naf_lr 5e-3->1e-2 converges faster from the water-mu init in a bounded budget. naf_n_clip=0.05 (sigmoid head out_scale), naf_tv_weight=1e-4 defaults. HYPOTHESIS: NAF is STRUCTURALLY FBP-bounded on dense-view (128-angle) breast-CT -- docs/findings.md 2026-05-23 confirms NAF's sin/cos-posenc coordinate-MLP basis is too coarse for dense soft-tissue at 512^2/128-views and cannot beat the ~0.84 breast LD-FBP baseline (hr=0) even at 5x n_iter. Expect val_ssim that does NOT clear the FBP baseline (hr near 0). This iter ESTABLISHES that datapoint on the redone split under the frozen metric -- a real, valid finding (do NOT reduce val_n further or inflate to make NAF look better; hr=0 plateau documents the ceiling for paper section 5.4).", "run_id": "breast-ct-claude-agentic-naf-search-20260703-01", "runtime": {"elapsed_s": 970.432380437851}, "schema_version": 3, "solver_key": "naf", "solver_name": "NAF", "split": {"train_n": 0, "val_n": 20}, "status": "discard", "ts": "2026-07-05T17:33:28Z"}
{"advice_for_others": "naf-claude-agentic: val_n=12, naf_n_freqs=12, naf_hidden=128, naf_layers=4, naf_n_iter=8000, naf_lr=0.01, naf_tv_weight=0.0001, naf_n_clip=0.05, naf_outer_wall_s=800, naf_per_scene_s=60.0, naf_encoding=fourier, seed=42, rationale=iter-2 breast-ct-claude-agentic-naf-search-20260703-01 (redone breast split train3600/val200/test200 seed20260703; val_n=12 CONSTANT for iters 2-20 per coordinator budget intervention 2026-07-05 -- first-12 of the 200-case breast val split, deterministic). SIX-BOX: (1) prior result: all iters so far hr=0 (iter-1 val_n=20 ssim0.355 PSNR6.26 in 970s, NOT a timeout -- a genuine converged fit). (2) failure mode: NAF per-scene INR recon is far below the 128-view breast LD-FBP baseline. (3) ONE knob changed: naf_n_freqs 8->12. (4) hypothesis: Prior iters hr=0 (iter-1 ssim0.355). KNOB: raise Fourier posenc bands 8->12 (finer spatial frequencies). HYPOTHESIS: the coordinate-MLP basis may be too coarse for dense soft-tissue detail; more high-freq bands could let the field represent fine breast structure -> clear FBP. Expect still hr=0 (findings.md: sin/cos posenc structurally too coarse at 512^2/128-views) but tests the capacity axis first. (5) wall: val_n=12 x per_scene 60.0s = ~720s < 20min. (6) serial, no user return.", "agent": "naf-claude-agentic", "campaign": "search-20260703-01", "cfg_full": {"naf_encoding": "fourier", "naf_hidden": 128, "naf_layers": 4, "naf_lr": 0.01, "naf_n_clip": 0.05, "naf_n_freqs": 12, "naf_n_iter": 8000, "naf_outer_wall_s": 800, "naf_per_scene_s": 60.0, "naf_tv_weight": 0.0001, "rationale": "iter-2 breast-ct-claude-agentic-naf-search-20260703-01 (redone breast split train3600/val200/test200 seed20260703; val_n=12 CONSTANT for iters 2-20 per coordinator budget intervention 2026-07-05 -- first-12 of the 200-case breast val split, deterministic). SIX-BOX: (1) prior result: all iters so far hr=0 (iter-1 val_n=20 ssim0.355 PSNR6.26 in 970s, NOT a timeout -- a genuine converged fit). (2) failure mode: NAF per-scene INR recon is far below the 128-view breast LD-FBP baseline. (3) ONE knob changed: naf_n_freqs 8->12. (4) hypothesis: Prior iters hr=0 (iter-1 ssim0.355). KNOB: raise Fourier posenc bands 8->12 (finer spatial frequencies). HYPOTHESIS: the coordinate-MLP basis may be too coarse for dense soft-tissue detail; more high-freq bands could let the field represent fine breast structure -> clear FBP. Expect still hr=0 (findings.md: sin/cos posenc structurally too coarse at 512^2/128-views) but tests the capacity axis first. (5) wall: val_n=12 x per_scene 60.0s = ~720s < 20min. (6) serial, no user return.", "seed": 42, "val_n": 12}, "challenge": "breast_ct", "change_class": "architecture", "git_commit": "671da566", "images": {"comparison": "runs/breast-ct-claude-agentic-naf-search-20260703-01/iterations/iter-0002/comparison.png", "test_showcase": null, "valtest_showcase": null}, "iter": 2, "kept": false, "metrics": {"headroom": 0.0, "headroom_std": null, "val_psnr": 12.863236427307129, "val_psnr_std": null, "val_rmse": 0.07468201220035553, "val_rmse_std": null, "val_ssim": 0.7526856660842896, "val_ssim_std": null}, "model": "claude-opus-4-8-1m", "obs_path": "breast-ct-claude-agentic-naf-search-20260703-01/iterations/iter-0002/observation.json", "obs_sha1": "7c07b824dd17956a4a9d5d07117fef6c845ee61f", "params_M": 0.039681, "params_source": "observation", "rationale": "naf-claude-agentic: val_n=12, naf_n_freqs=12, naf_hidden=128, naf_layers=4, naf_n_iter=8000, naf_lr=0.01, naf_tv_weight=0.0001, naf_n_clip=0.05, naf_outer_wall_s=800, naf_per_scene_s=60.0, naf_encoding=fourier, seed=42, rationale=iter-2 breast-ct-claude-agentic-naf-search-20260703-01 (redone breast split train3600/val200/test200 seed20260703; val_n=12 CONSTANT for iters 2-20 per coordinator budget intervention 2026-07-05 -- first-12 of the 200-case breast val split, deterministic). SIX-BOX: (1) prior result: all iters so far hr=0 (iter-1 val_n=20 ssim0.355 PSNR6.26 in 970s, NOT a timeout -- a genuine converged fit). (2) failure mode: NAF per-scene INR recon is far below the 128-view breast LD-FBP baseline. (3) ONE knob changed: naf_n_freqs 8->12. (4) hypothesis: Prior iters hr=0 (iter-1 ssim0.355). KNOB: raise Fourier posenc bands 8->12 (finer spatial frequencies). HYPOTHESIS: the coordinate-MLP basis may be too coarse for dense soft-tissue detail; more high-freq bands could let the field represent fine breast structure -> clear FBP. Expect still hr=0 (findings.md: sin/cos posenc structurally too coarse at 512^2/128-views) but tests the capacity axis first. (5) wall: val_n=12 x per_scene 60.0s = ~720s < 20min. (6) serial, no user return.", "run_id": "breast-ct-claude-agentic-naf-search-20260703-01", "runtime": {"elapsed_s": 730.6042761802673}, "schema_version": 3, "solver_key": "naf", "solver_name": "NAF", "split": {"train_n": 0, "val_n": 12}, "status": "discard", "ts": "2026-07-05T20:30:20Z"}
{"advice_for_others": "naf-claude-agentic: val_n=12, naf_n_freqs=8, naf_hidden=256, naf_layers=4, naf_n_iter=8000, naf_lr=0.01, naf_tv_weight=0.0001, naf_n_clip=0.05, naf_outer_wall_s=800, naf_per_scene_s=60.0, naf_encoding=fourier, seed=42, rationale=iter-3 breast-ct-claude-agentic-naf-search-20260703-01 (redone breast split train3600/val200/test200 seed20260703; val_n=12 CONSTANT for iters 2-20 per coordinator budget intervention 2026-07-05 -- first-12 of the 200-case breast val split, deterministic). SIX-BOX: (1) prior result: all iters so far hr=0 (iter-1 val_n=20 ssim0.355 PSNR6.26 in 970s, NOT a timeout -- a genuine converged fit). (2) failure mode: NAF per-scene INR recon is far below the 128-view breast LD-FBP baseline. (3) ONE knob changed: naf_hidden 128->256. (4) hypothesis: iter-2 (freqs=12) hr=0. KNOB: widen MLP hidden 128->256 (more model capacity per scene). HYPOTHESIS: if the bottleneck is MLP width not encoding, a wider net fits finer detail. Fewer steps/scene at 60s wall (bigger fwd), but per-scene fit still hundreds of steps. Expect hr=0 if the ceiling is the encoding basis, not width. (5) wall: val_n=12 x per_scene 60.0s = ~720s < 20min. (6) serial, no user return.", "agent": "naf-claude-agentic", "campaign": "search-20260703-01", "cfg_full": {"naf_encoding": "fourier", "naf_hidden": 256, "naf_layers": 4, "naf_lr": 0.01, "naf_n_clip": 0.05, "naf_n_freqs": 8, "naf_n_iter": 8000, "naf_outer_wall_s": 800, "naf_per_scene_s": 60.0, "naf_tv_weight": 0.0001, "rationale": "iter-3 breast-ct-claude-agentic-naf-search-20260703-01 (redone breast split train3600/val200/test200 seed20260703; val_n=12 CONSTANT for iters 2-20 per coordinator budget intervention 2026-07-05 -- first-12 of the 200-case breast val split, deterministic). SIX-BOX: (1) prior result: all iters so far hr=0 (iter-1 val_n=20 ssim0.355 PSNR6.26 in 970s, NOT a timeout -- a genuine converged fit). (2) failure mode: NAF per-scene INR recon is far below the 128-view breast LD-FBP baseline. (3) ONE knob changed: naf_hidden 128->256. (4) hypothesis: iter-2 (freqs=12) hr=0. KNOB: widen MLP hidden 128->256 (more model capacity per scene). HYPOTHESIS: if the bottleneck is MLP width not encoding, a wider net fits finer detail. Fewer steps/scene at 60s wall (bigger fwd), but per-scene fit still hundreds of steps. Expect hr=0 if the ceiling is the encoding basis, not width. (5) wall: val_n=12 x per_scene 60.0s = ~720s < 20min. (6) serial, no user return.", "seed": 42, "val_n": 12}, "challenge": "breast_ct", "change_class": "architecture", "git_commit": "671da566", "images": {"comparison": "runs/breast-ct-claude-agentic-naf-search-20260703-01/iterations/iter-0003/comparison.png", "test_showcase": null, "valtest_showcase": null}, "iter": 3, "kept": false, "metrics": {"headroom": 0.0, "headroom_std": 0.0, "val_psnr": 6.2663893699646, "val_psnr_std": 0.2078534710795732, "val_rmse": 0.1596093773841858, "val_rmse_std": 0.0016800014389741125, "val_ssim": 0.35450929403305054, "val_ssim_std": 0.0001269633100316407}, "model": "claude-opus-4-8-1m", "obs_path": "breast-ct-claude-agentic-naf-search-20260703-01/iterations/iter-0003/observation.json", "obs_sha1": "13b463a3a76b45abd1e2bbcbf64a970ee14e16f8", "params_M": 0.140801, "params_source": "observation", "rationale": "naf-claude-agentic: val_n=12, naf_n_freqs=8, naf_hidden=256, naf_layers=4, naf_n_iter=8000, naf_lr=0.01, naf_tv_weight=0.0001, naf_n_clip=0.05, naf_outer_wall_s=800, naf_per_scene_s=60.0, naf_encoding=fourier, seed=42, rationale=iter-3 breast-ct-claude-agentic-naf-search-20260703-01 (redone breast split train3600/val200/test200 seed20260703; val_n=12 CONSTANT for iters 2-20 per coordinator budget intervention 2026-07-05 -- first-12 of the 200-case breast val split, deterministic). SIX-BOX: (1) prior result: all iters so far hr=0 (iter-1 val_n=20 ssim0.355 PSNR6.26 in 970s, NOT a timeout -- a genuine converged fit). (2) failure mode: NAF per-scene INR recon is far below the 128-view breast LD-FBP baseline. (3) ONE knob changed: naf_hidden 128->256. (4) hypothesis: iter-2 (freqs=12) hr=0. KNOB: widen MLP hidden 128->256 (more model capacity per scene). HYPOTHESIS: if the bottleneck is MLP width not encoding, a wider net fits finer detail. Fewer steps/scene at 60s wall (bigger fwd), but per-scene fit still hundreds of steps. Expect hr=0 if the ceiling is the encoding basis, not width. (5) wall: val_n=12 x per_scene 60.0s = ~720s < 20min. (6) serial, no user return.", "run_id": "breast-ct-claude-agentic-naf-search-20260703-01", "runtime": {"elapsed_s": 729.5237441062927}, "schema_version": 3, "solver_key": "naf", "solver_name": "NAF", "split": {"train_n": 0, "val_n": 12}, "status": "discard", "ts": "2026-07-05T21:30:42Z"}
