{"advice_for_others": "learned_primal_dual-claude-agentic: lpd_iters=10, lpd_n_primal=5, lpd_n_dual=5, lpd_hidden=32, lpd_share_weights=False, epochs=10, lr=0.0016, lr_schedule=cosine, batch_size=1, grad_clip=1.0, lambda_neg=1.0, loss_base=mse, train_n=400, val_n=200, val_chunk=4, rationale=iter-7 one-knob: lr 1.2e-3->1.6e-3 at the CHEAP I=10 baseline (h32, ep10) -- i.e. one knob vs iter-5 (hr=0.621, same I10/h32/ep10/lr1.2e-3). FAILURE MODE: iter-6 (I=12) improved hr to 0.6685 but ran 1799.8s = AT the 30-min wall, so depth is wall-bound; I keep exploring the lr axis, which is the strongest unsaturated lever (fixed-I10 lr sweep: 5e-4=0.44, 8e-4=0.566, 1.2e-3=0.621 -- still climbing). HYPOTHESIS: if I push lr 1.2e-3->1.6e-3 with cosine decay at I10, expect hr above 0.621 (and competitive with iter-6 0.6685) because the lr sweep has not plateaued; wall ~1388s (I10), large margin under the ceiling. grad_clip=1.0 guards the higher lr.", "agent": "learned_primal_dual-claude-agentic", "campaign": "search-20260703-01", "cfg_full": {"batch_size": 1, "epochs": 10, "grad_clip": 1.0, "lambda_neg": 1.0, "loss_base": "mse", "lpd_hidden": 32, "lpd_iters": 10, "lpd_n_dual": 5, "lpd_n_primal": 5, "lpd_share_weights": false, "lr": 0.0016, "lr_schedule": "cosine", "rationale": "iter-7 one-knob: lr 1.2e-3->1.6e-3 at the CHEAP I=10 baseline (h32, ep10) -- i.e. one knob vs iter-5 (hr=0.621, same I10/h32/ep10/lr1.2e-3). FAILURE MODE: iter-6 (I=12) improved hr to 0.6685 but ran 1799.8s = AT the 30-min wall, so depth is wall-bound; I keep exploring the lr axis, which is the strongest unsaturated lever (fixed-I10 lr sweep: 5e-4=0.44, 8e-4=0.566, 1.2e-3=0.621 -- still climbing). HYPOTHESIS: if I push lr 1.2e-3->1.6e-3 with cosine decay at I10, expect hr above 0.621 (and competitive with iter-6 0.6685) because the lr sweep has not plateaued; wall ~1388s (I10), large margin under the ceiling. grad_clip=1.0 guards the higher lr.", "train_n": 400, "val_chunk": 4, "val_n": 200}, "challenge": "breast_ct", "change_class": "architecture", "git_commit": null, "images": {"comparison": "runs/breast-ct-claude-agentic-learned-primal-dual-search-20260703-01/iterations/iter-0007/comparison.png", "test_showcase": null, "valtest_showcase": null}, "iter": 7, "kept": true, "metrics": {"headroom": 0.550241328628275, "headroom_std": 0.035663580972917504, "val_psnr": 43.26460266113281, "val_psnr_std": 1.1272776353537217, "val_rmse": 0.002345170360058546, "val_rmse_std": 0.00030772143389367956, "val_ssim": 0.9896417260169983, "val_ssim_std": 0.002791194759733559}, "model": "claude-opus-4-8-1m", "obs_path": "breast-ct-claude-agentic-learned-primal-dual-search-20260703-01/iterations/iter-0007/observation.json", "obs_sha1": "9d7305c38dd2588e59d41421e124644c41b4811a", "params_M": 0.25322, "params_source": "observation", "rationale": "learned_primal_dual-claude-agentic: lpd_iters=10, lpd_n_primal=5, lpd_n_dual=5, lpd_hidden=32, lpd_share_weights=False, epochs=10, lr=0.0016, lr_schedule=cosine, batch_size=1, grad_clip=1.0, lambda_neg=1.0, loss_base=mse, train_n=400, val_n=200, val_chunk=4, rationale=iter-7 one-knob: lr 1.2e-3->1.6e-3 at the CHEAP I=10 baseline (h32, ep10) -- i.e. one knob vs iter-5 (hr=0.621, same I10/h32/ep10/lr1.2e-3). FAILURE MODE: iter-6 (I=12) improved hr to 0.6685 but ran 1799.8s = AT the 30-min wall, so depth is wall-bound; I keep exploring the lr axis, which is the strongest unsaturated lever (fixed-I10 lr sweep: 5e-4=0.44, 8e-4=0.566, 1.2e-3=0.621 -- still climbing). HYPOTHESIS: if I push lr 1.2e-3->1.6e-3 with cosine decay at I10, expect hr above 0.621 (and competitive with iter-6 0.6685) because the lr sweep has not plateaued; wall ~1388s (I10), large margin under the ceiling. grad_clip=1.0 guards the higher lr.", "run_id": "breast-ct-claude-agentic-learned-primal-dual-search-20260703-01", "runtime": {"elapsed_s": 1230.2127759456635}, "schema_version": 3, "solver_key": "learned-primal-dual", "solver_name": "Learned Primal-Dual", "split": {"train_n": 400, "val_n": 200}, "status": "keep", "ts": "2026-07-03T23:47:41Z"}
{"advice_for_others": "learned_primal_dual-claude-agentic: lpd_iters=12, lpd_n_primal=5, lpd_n_dual=5, lpd_hidden=32, lpd_share_weights=False, epochs=10, lr=0.0012, lr_schedule=cosine, batch_size=1, grad_clip=0.5, lambda_neg=1.0, loss_base=mse, train_n=400, val_n=200, val_chunk=4, rationale=iter-8 one-knob: grad_clip 1.0->0.5 at the BEST config (iter-6: I12/h32/ep10/lr1.2e-3, hr=0.6685). FAILURE MODE: lr axis saturated (I10 sweep peaked at lr1.2e-3=0.621; 1.6e-3 overshot to 0.550), and depth (I=12) is what set the 0.6685 best but ran at the 1800s wall. HYPOTHESIS: if I tighten grad_clip 1.0->0.5, expect hr >= 0.6685 because deeper I=12 unrolls carry larger/noisier grads and a tighter clip stabilizes late-epoch convergence (the old breast LPD champion paired I>=12 with gc=0.5); time-neutral (~1800s, at wall). If this TIMEOUTs I will re-dispatch at I=11.", "agent": "learned_primal_dual-claude-agentic", "campaign": "search-20260703-01", "cfg_full": {"batch_size": 1, "epochs": 10, "grad_clip": 0.5, "lambda_neg": 1.0, "loss_base": "mse", "lpd_hidden": 32, "lpd_iters": 12, "lpd_n_dual": 5, "lpd_n_primal": 5, "lpd_share_weights": false, "lr": 0.0012, "lr_schedule": "cosine", "rationale": "iter-8 one-knob: grad_clip 1.0->0.5 at the BEST config (iter-6: I12/h32/ep10/lr1.2e-3, hr=0.6685). FAILURE MODE: lr axis saturated (I10 sweep peaked at lr1.2e-3=0.621; 1.6e-3 overshot to 0.550), and depth (I=12) is what set the 0.6685 best but ran at the 1800s wall. HYPOTHESIS: if I tighten grad_clip 1.0->0.5, expect hr >= 0.6685 because deeper I=12 unrolls carry larger/noisier grads and a tighter clip stabilizes late-epoch convergence (the old breast LPD champion paired I>=12 with gc=0.5); time-neutral (~1800s, at wall). If this TIMEOUTs I will re-dispatch at I=11.", "train_n": 400, "val_chunk": 4, "val_n": 200}, "challenge": "breast_ct", "change_class": "architecture", "git_commit": null, "images": {"comparison": "runs/breast-ct-claude-agentic-learned-primal-dual-search-20260703-01/iterations/iter-0008/comparison.png", "test_showcase": null, "valtest_showcase": null}, "iter": 8, "kept": false, "metrics": {"headroom": 0.0, "headroom_std": 0.0, "val_psnr": 16.10369873046875, "val_psnr_std": 0.25311439895201593, "val_rmse": 0.05348346009850502, "val_rmse_std": 0.0012239307404529529, "val_ssim": 0.7067359089851379, "val_ssim_std": 0.011198190463788562}, "model": "claude-opus-4-8-1m", "obs_path": "breast-ct-claude-agentic-learned-primal-dual-search-20260703-01/iterations/iter-0008/observation.json", "obs_sha1": "475a588ba5d15f3a2ca96f4cc8df581507317d76", "params_M": 0.303864, "params_source": "observation", "rationale": "learned_primal_dual-claude-agentic: lpd_iters=12, lpd_n_primal=5, lpd_n_dual=5, lpd_hidden=32, lpd_share_weights=False, epochs=10, lr=0.0012, lr_schedule=cosine, batch_size=1, grad_clip=0.5, lambda_neg=1.0, loss_base=mse, train_n=400, val_n=200, val_chunk=4, rationale=iter-8 one-knob: grad_clip 1.0->0.5 at the BEST config (iter-6: I12/h32/ep10/lr1.2e-3, hr=0.6685). FAILURE MODE: lr axis saturated (I10 sweep peaked at lr1.2e-3=0.621; 1.6e-3 overshot to 0.550), and depth (I=12) is what set the 0.6685 best but ran at the 1800s wall. HYPOTHESIS: if I tighten grad_clip 1.0->0.5, expect hr >= 0.6685 because deeper I=12 unrolls carry larger/noisier grads and a tighter clip stabilizes late-epoch convergence (the old breast LPD champion paired I>=12 with gc=0.5); time-neutral (~1800s, at wall). If this TIMEOUTs I will re-dispatch at I=11.", "run_id": "breast-ct-claude-agentic-learned-primal-dual-search-20260703-01", "runtime": {"elapsed_s": 1400.6548373699188}, "schema_version": 3, "solver_key": "learned-primal-dual", "solver_name": "Learned Primal-Dual", "split": {"train_n": 400, "val_n": 200}, "status": "discard", "ts": "2026-07-04T00:15:44Z"}
{"advice_for_others": "learned_primal_dual-claude-agentic: lpd_iters=12, lpd_n_primal=7, lpd_n_dual=5, lpd_hidden=32, lpd_share_weights=False, epochs=10, lr=0.0012, lr_schedule=cosine, batch_size=1, grad_clip=1.0, lambda_neg=1.0, loss_base=mse, train_n=400, val_n=200, val_chunk=4, rationale=iter-9 one-knob: lpd_n_primal 5->7 at the BEST config (iter-6: I12/h32/ep10/lr1.2e-3/gc1.0, hr=0.6685); grad_clip reverted to 1.0 (iter-8 gc=0.5 COLLAPSED to hr=0.0/ssim0.71 -- divergence). FAILURE MODE resolved: gc must stay 1.0. Remaining time-neutral lever = inter-iteration memory. HYPOTHESIS: if I widen the image-domain primal memory n_primal 5->7 at I=12, expect hr>0.6685 because the primal channels carry the quality-bearing partial reconstruction between unrolled steps (Adler 2018) and more state = richer updates; only the primal block in/out channels grow by 2 -> ~time-neutral (~1800s, at wall). If TIMEOUT, re-dispatch at I=11.", "agent": "learned_primal_dual-claude-agentic", "campaign": "search-20260703-01", "cfg_full": {"batch_size": 1, "epochs": 10, "grad_clip": 1.0, "lambda_neg": 1.0, "loss_base": "mse", "lpd_hidden": 32, "lpd_iters": 12, "lpd_n_dual": 5, "lpd_n_primal": 7, "lpd_share_weights": false, "lr": 0.0012, "lr_schedule": "cosine", "rationale": "iter-9 one-knob: lpd_n_primal 5->7 at the BEST config (iter-6: I12/h32/ep10/lr1.2e-3/gc1.0, hr=0.6685); grad_clip reverted to 1.0 (iter-8 gc=0.5 COLLAPSED to hr=0.0/ssim0.71 -- divergence). FAILURE MODE resolved: gc must stay 1.0. Remaining time-neutral lever = inter-iteration memory. HYPOTHESIS: if I widen the image-domain primal memory n_primal 5->7 at I=12, expect hr>0.6685 because the primal channels carry the quality-bearing partial reconstruction between unrolled steps (Adler 2018) and more state = richer updates; only the primal block in/out channels grow by 2 -> ~time-neutral (~1800s, at wall). If TIMEOUT, re-dispatch at I=11.", "train_n": 400, "val_chunk": 4, "val_n": 200}, "challenge": "breast_ct", "change_class": "architecture", "git_commit": null, "images": {"comparison": "runs/breast-ct-claude-agentic-learned-primal-dual-search-20260703-01/iterations/iter-0009/comparison.png", "test_showcase": null, "valtest_showcase": null}, "iter": 9, "kept": true, "metrics": {"headroom": 0.47060304678087395, "headroom_std": 0.0222055432168211, "val_psnr": 41.84856414794922, "val_psnr_std": 0.8671169580782435, "val_rmse": 0.0027604259084910154, "val_rmse_std": 0.0002717698217563817, "val_ssim": 0.9833331108093262, "val_ssim_std": 0.0035048915776928796}, "model": "claude-opus-4-8-1m", "obs_path": "breast-ct-claude-agentic-learned-primal-dual-search-20260703-01/iterations/iter-0009/observation.json", "obs_sha1": "9a27132990a14d2511eb0ab9659f89d12e4d3d8a", "params_M": 0.317712, "params_source": "observation", "rationale": "learned_primal_dual-claude-agentic: lpd_iters=12, lpd_n_primal=7, lpd_n_dual=5, lpd_hidden=32, lpd_share_weights=False, epochs=10, lr=0.0012, lr_schedule=cosine, batch_size=1, grad_clip=1.0, lambda_neg=1.0, loss_base=mse, train_n=400, val_n=200, val_chunk=4, rationale=iter-9 one-knob: lpd_n_primal 5->7 at the BEST config (iter-6: I12/h32/ep10/lr1.2e-3/gc1.0, hr=0.6685); grad_clip reverted to 1.0 (iter-8 gc=0.5 COLLAPSED to hr=0.0/ssim0.71 -- divergence). FAILURE MODE resolved: gc must stay 1.0. Remaining time-neutral lever = inter-iteration memory. HYPOTHESIS: if I widen the image-domain primal memory n_primal 5->7 at I=12, expect hr>0.6685 because the primal channels carry the quality-bearing partial reconstruction between unrolled steps (Adler 2018) and more state = richer updates; only the primal block in/out channels grow by 2 -> ~time-neutral (~1800s, at wall). If TIMEOUT, re-dispatch at I=11.", "run_id": "breast-ct-claude-agentic-learned-primal-dual-search-20260703-01", "runtime": {"elapsed_s": 1399.832929134369}, "schema_version": 3, "solver_key": "learned-primal-dual", "solver_name": "Learned Primal-Dual", "split": {"train_n": 400, "val_n": 200}, "status": "keep", "ts": "2026-07-04T07:54:50Z"}
{"advice_for_others": "learned_primal_dual-claude-agentic: lpd_iters=12, lpd_n_primal=5, lpd_n_dual=5, lpd_hidden=32, lpd_share_weights=False, epochs=10, lr=0.0012, lr_schedule=constant, batch_size=1, grad_clip=1.0, lambda_neg=1.0, loss_base=mse, train_n=400, val_n=200, val_chunk=4, rationale=iter-10 one-knob: lr_schedule cosine->constant at the BEST config (iter-6: I12/h32/ep10/lr1.2e-3/np5/nd5/gc1.0, hr=0.6685). FAILURE MODE survey: off iter-6, lr1.6e-3(0.55)/gc0.5(0.0)/n_primal7(0.47)/hidden48(0.53) all HURT -- only DEPTH(I=12) helped. Before concluding a budget-bound local optimum, test whether cosine annealing is under-training the last epochs. HYPOTHESIS: if I hold lr=1.2e-3 CONSTANT (no cosine decay to ~0) at I=12, hr will differ from 0.6685 -- higher if cosine decayed too early (more effective late-epoch learning), lower if the anneal was stabilizing. Informative one-knob; time-neutral ~1800s (at wall).", "agent": "learned_primal_dual-claude-agentic", "campaign": "search-20260703-01", "cfg_full": {"batch_size": 1, "epochs": 10, "grad_clip": 1.0, "lambda_neg": 1.0, "loss_base": "mse", "lpd_hidden": 32, "lpd_iters": 12, "lpd_n_dual": 5, "lpd_n_primal": 5, "lpd_share_weights": false, "lr": 0.0012, "lr_schedule": "constant", "rationale": "iter-10 one-knob: lr_schedule cosine->constant at the BEST config (iter-6: I12/h32/ep10/lr1.2e-3/np5/nd5/gc1.0, hr=0.6685). FAILURE MODE survey: off iter-6, lr1.6e-3(0.55)/gc0.5(0.0)/n_primal7(0.47)/hidden48(0.53) all HURT -- only DEPTH(I=12) helped. Before concluding a budget-bound local optimum, test whether cosine annealing is under-training the last epochs. HYPOTHESIS: if I hold lr=1.2e-3 CONSTANT (no cosine decay to ~0) at I=12, hr will differ from 0.6685 -- higher if cosine decayed too early (more effective late-epoch learning), lower if the anneal was stabilizing. Informative one-knob; time-neutral ~1800s (at wall).", "train_n": 400, "val_chunk": 4, "val_n": 200}, "challenge": "breast_ct", "change_class": "architecture", "git_commit": "1176d9f5", "images": {"comparison": "runs/breast-ct-claude-agentic-learned-primal-dual-search-20260703-01/iterations/iter-0010/comparison.png", "test_showcase": null, "valtest_showcase": null}, "iter": 10, "kept": false, "metrics": {"headroom": 0.0, "headroom_std": 0.0, "val_psnr": 30.99632453918457, "val_psnr_std": 0.9119331722834212, "val_rmse": 0.00962915737181902, "val_rmse_std": 0.000961840226560727, "val_ssim": 0.9488400220870972, "val_ssim_std": 0.009219575397122147}, "model": "claude-opus-4-8-1m", "obs_path": "breast-ct-claude-agentic-learned-primal-dual-search-20260703-01/iterations/iter-0010/observation.json", "obs_sha1": "e18a44bfe47e5bfc17ff2cf2060c321eeed4cea1", "params_M": 0.303864, "params_source": "observation", "rationale": "learned_primal_dual-claude-agentic: lpd_iters=12, lpd_n_primal=5, lpd_n_dual=5, lpd_hidden=32, lpd_share_weights=False, epochs=10, lr=0.0012, lr_schedule=constant, batch_size=1, grad_clip=1.0, lambda_neg=1.0, loss_base=mse, train_n=400, val_n=200, val_chunk=4, rationale=iter-10 one-knob: lr_schedule cosine->constant at the BEST config (iter-6: I12/h32/ep10/lr1.2e-3/np5/nd5/gc1.0, hr=0.6685). FAILURE MODE survey: off iter-6, lr1.6e-3(0.55)/gc0.5(0.0)/n_primal7(0.47)/hidden48(0.53) all HURT -- only DEPTH(I=12) helped. Before concluding a budget-bound local optimum, test whether cosine annealing is under-training the last epochs. HYPOTHESIS: if I hold lr=1.2e-3 CONSTANT (no cosine decay to ~0) at I=12, hr will differ from 0.6685 -- higher if cosine decayed too early (more effective late-epoch learning), lower if the anneal was stabilizing. Informative one-knob; time-neutral ~1800s (at wall).", "run_id": "breast-ct-claude-agentic-learned-primal-dual-search-20260703-01", "runtime": {"elapsed_s": 1087.4545948505402}, "schema_version": 3, "solver_key": "learned-primal-dual", "solver_name": "Learned Primal-Dual", "split": {"train_n": 400, "val_n": 200}, "status": "discard", "ts": "2026-07-04T08:42:25Z"}
{"advice_for_others": "learned_primal_dual-claude-agentic: lpd_iters=10, lpd_n_primal=5, lpd_n_dual=5, lpd_hidden=32, lpd_share_weights=False, epochs=10, lr=0.0012, lr_schedule=cosine, batch_size=1, grad_clip=1.0, lambda_neg=1.0, loss_base=mse, train_n=500, val_n=200, val_chunk=4, rationale=iter-11 one-knob: train_n 400->500 at the CHEAP I=10 base (iter-5: I10/h32/ep10/lr1.2e-3/cosine/gc1.0, hr=0.621, 1388s). FAILURE MODE: architecture/optimizer knobs off the iter-6 best are exhausted (lr1.6e-3/gc0.5/hidden48/n_primal7/constant-lr ALL worse or collapsed) -> pivot to the untested DATA axis. Chose I=10 (not the wall-bound I=12) and only +100 samples so wall stays <1800s (est ~1675s). HYPOTHESIS: if I add training data 400->500 at I=10, expect val hr above 0.621 because LPD is data-limited on breast s diverse phantoms and more scenes improve generalization to the 200 val cases; if it beats 0.6685 the data axis is the new lever to push. If TIMEOUT, re-dispatch train_n=450.", "agent": "learned_primal_dual-claude-agentic", "campaign": "search-20260703-01", "cfg_full": {"batch_size": 1, "epochs": 10, "grad_clip": 1.0, "lambda_neg": 1.0, "loss_base": "mse", "lpd_hidden": 32, "lpd_iters": 10, "lpd_n_dual": 5, "lpd_n_primal": 5, "lpd_share_weights": false, "lr": 0.0012, "lr_schedule": "cosine", "rationale": "iter-11 one-knob: train_n 400->500 at the CHEAP I=10 base (iter-5: I10/h32/ep10/lr1.2e-3/cosine/gc1.0, hr=0.621, 1388s). FAILURE MODE: architecture/optimizer knobs off the iter-6 best are exhausted (lr1.6e-3/gc0.5/hidden48/n_primal7/constant-lr ALL worse or collapsed) -> pivot to the untested DATA axis. Chose I=10 (not the wall-bound I=12) and only +100 samples so wall stays <1800s (est ~1675s). HYPOTHESIS: if I add training data 400->500 at I=10, expect val hr above 0.621 because LPD is data-limited on breast s diverse phantoms and more scenes improve generalization to the 200 val cases; if it beats 0.6685 the data axis is the new lever to push. If TIMEOUT, re-dispatch train_n=450.", "train_n": 500, "val_chunk": 4, "val_n": 200}, "challenge": "breast_ct", "change_class": "architecture", "git_commit": "671da566", "images": {"comparison": "runs/breast-ct-claude-agentic-learned-primal-dual-search-20260703-01/iterations/iter-0011/comparison.png", "test_showcase": null, "valtest_showcase": null}, "iter": 11, "kept": true, "metrics": {"headroom": 0.5973745330356384, "headroom_std": 0.021597027017188897, "val_psnr": 44.226173400878906, "val_psnr_std": 0.9572319813207453, "val_rmse": 0.002099403413012624, "val_rmse_std": 0.00023033103955456293, "val_ssim": 0.991013765335083, "val_ssim_std": 0.0021425394691623294}, "model": "claude-opus-4-8-1m", "obs_path": "breast-ct-claude-agentic-learned-primal-dual-search-20260703-01/iterations/iter-0011/observation.json", "obs_sha1": "301996e1737ef37abebbc4c461cf5a98c1204976", "params_M": 0.25322, "params_source": "observation", "rationale": "learned_primal_dual-claude-agentic: lpd_iters=10, lpd_n_primal=5, lpd_n_dual=5, lpd_hidden=32, lpd_share_weights=False, epochs=10, lr=0.0012, lr_schedule=cosine, batch_size=1, grad_clip=1.0, lambda_neg=1.0, loss_base=mse, train_n=500, val_n=200, val_chunk=4, rationale=iter-11 one-knob: train_n 400->500 at the CHEAP I=10 base (iter-5: I10/h32/ep10/lr1.2e-3/cosine/gc1.0, hr=0.621, 1388s). FAILURE MODE: architecture/optimizer knobs off the iter-6 best are exhausted (lr1.6e-3/gc0.5/hidden48/n_primal7/constant-lr ALL worse or collapsed) -> pivot to the untested DATA axis. Chose I=10 (not the wall-bound I=12) and only +100 samples so wall stays <1800s (est ~1675s). HYPOTHESIS: if I add training data 400->500 at I=10, expect val hr above 0.621 because LPD is data-limited on breast s diverse phantoms and more scenes improve generalization to the 200 val cases; if it beats 0.6685 the data axis is the new lever to push. If TIMEOUT, re-dispatch train_n=450.", "run_id": "breast-ct-claude-agentic-learned-primal-dual-search-20260703-01", "runtime": {"elapsed_s": 1139.7641303539276}, "schema_version": 3, "solver_key": "learned-primal-dual", "solver_name": "Learned Primal-Dual", "split": {"train_n": 400, "val_n": 200}, "status": "keep", "ts": "2026-07-04T10:30:42Z"}
