{"advice_for_others": "manduca_bilateral-claude-agentic: proj_n_bf=1, proj_sr=1.5, proj_w=5, proj_kernel=5, bf_d_w_ratio=0.16666666666666666, manduca_N0=100000.0, manduca_bowtie=False, img_n_bf=6, img_kernel=5, img_sx=0.5, img_sy=0.5, img_sr=0.05, epochs=10, batch_size=1, lr=0.005, optimizer=adam, lambda_neg=1.0, grad_clip=1.0, train_n=400, val_n=200, val_chunk=10, seed=42, rationale=iter-4 manduca_bilateral breast (train3600/val200/test200 seed20260703, per-iter train_n=400, val=200). SIX-BOX from BEST (iter-3 img_n_bf=6 hr=0.2467): (1) PRIOR: iter-1 hr=0.2159 (img=1); iter-2 hr=0.2431 (img=3, +0.027); iter-3 hr=0.2467 (img=6, +0.0036). img_n_bf DEPTH is PLATEAUING (1->3 big, 3->6 tiny). ep=10 and proj_sr=1.5 untouched since iter-1. budget 271/1200s. (2) FAILURE MODE: image-domain depth saturating; the binding constraint shifts to the image bilateral RANGE BANDWIDTH. img_sr=0.02 is a very tight range sigma in image-intensity units (breast mu up to 0.5, display_max=0.5), so each image BF only averages pixels within +/-0.02 mu -- barely reaching across the 128-view streak residual whose amplitude likely exceeds 0.02. The filters cannot pool the noisy neighbors. (3) ONE KNOB (from iter-3 best, img_n_bf=6 held): img_sr 0.02 -> 0.05 (widen image-domain range bandwidth 2.5x). All else held. (4) HYPOTHESIS: img_sr 0.02->0.05 lifts hr above 0.2467 because the current tight range sigma prevents averaging across streak residual >0.02 mu; widening to +/-0.05 lets each edge-preserving filter pool genuinely-noisy neighbors up to the wider threshold, suppressing more residual where calibrated-SSIM-headroom lives. FALSIFIER: if hr drops (edge over-smoothing) or stays flat, range bandwidth is not binding -> iter-5 attacks proj_sr or epochs. (5) BUDGET: same params (21) and filter passes -> ~270s, well under the 20-min budget. (6) Loop continues; iter-5 on landing. --qos=turbo, save ckpt+recon.", "agent": "manduca_bilateral-claude-agentic", "campaign": "search-20260703-01", "cfg_full": {"batch_size": 1, "bf_d_w_ratio": 0.16666666666666666, "epochs": 10, "grad_clip": 1.0, "img_kernel": 5, "img_n_bf": 6, "img_sr": 0.05, "img_sx": 0.5, "img_sy": 0.5, "lambda_neg": 1.0, "lr": 0.005, "manduca_N0": 100000.0, "manduca_bowtie": false, "optimizer": "adam", "proj_kernel": 5, "proj_n_bf": 1, "proj_sr": 1.5, "proj_w": 5, "rationale": "iter-4 manduca_bilateral breast (train3600/val200/test200 seed20260703, per-iter train_n=400, val=200). SIX-BOX from BEST (iter-3 img_n_bf=6 hr=0.2467): (1) PRIOR: iter-1 hr=0.2159 (img=1); iter-2 hr=0.2431 (img=3, +0.027); iter-3 hr=0.2467 (img=6, +0.0036). img_n_bf DEPTH is PLATEAUING (1->3 big, 3->6 tiny). ep=10 and proj_sr=1.5 untouched since iter-1. budget 271/1200s. (2) FAILURE MODE: image-domain depth saturating; the binding constraint shifts to the image bilateral RANGE BANDWIDTH. img_sr=0.02 is a very tight range sigma in image-intensity units (breast mu up to 0.5, display_max=0.5), so each image BF only averages pixels within +/-0.02 mu -- barely reaching across the 128-view streak residual whose amplitude likely exceeds 0.02. The filters cannot pool the noisy neighbors. (3) ONE KNOB (from iter-3 best, img_n_bf=6 held): img_sr 0.02 -> 0.05 (widen image-domain range bandwidth 2.5x). All else held. (4) HYPOTHESIS: img_sr 0.02->0.05 lifts hr above 0.2467 because the current tight range sigma prevents averaging across streak residual >0.02 mu; widening to +/-0.05 lets each edge-preserving filter pool genuinely-noisy neighbors up to the wider threshold, suppressing more residual where calibrated-SSIM-headroom lives. FALSIFIER: if hr drops (edge over-smoothing) or stays flat, range bandwidth is not binding -> iter-5 attacks proj_sr or epochs. (5) BUDGET: same params (21) and filter passes -> ~270s, well under the 20-min budget. (6) Loop continues; iter-5 on landing. --qos=turbo, save ckpt+recon.", "seed": 42, "train_n": 400, "val_chunk": 10, "val_n": 200}, "challenge": "breast_ct", "change_class": "architecture", "git_commit": null, "images": {"comparison": "runs/breast-ct-claude-agentic-manduca-bilateral-search-20260703-01/iterations/iter-0004/comparison.png", "test_showcase": null, "valtest_showcase": null}, "iter": 4, "kept": true, "metrics": {"headroom": 0.2752183974603819, "headroom_std": 0.009504684275895656, "val_psnr": 39.120052337646484, "val_psnr_std": 0.5587609490364478, "val_rmse": 0.0037792169023305178, "val_rmse_std": 0.00023656980589079925, "val_ssim": 0.9814876317977905, "val_ssim_std": 0.003316521780708086}, "model": "claude-opus-4-8-1m", "obs_path": "breast-ct-claude-agentic-manduca-bilateral-search-20260703-01/iterations/iter-0004/observation.json", "obs_sha1": "1dbfab9694b84f35db4235df60b72581bae0b994", "params_M": 2.2e-05, "params_source": "observation", "rationale": "manduca_bilateral-claude-agentic: proj_n_bf=1, proj_sr=1.5, proj_w=5, proj_kernel=5, bf_d_w_ratio=0.16666666666666666, manduca_N0=100000.0, manduca_bowtie=False, img_n_bf=6, img_kernel=5, img_sx=0.5, img_sy=0.5, img_sr=0.05, epochs=10, batch_size=1, lr=0.005, optimizer=adam, lambda_neg=1.0, grad_clip=1.0, train_n=400, val_n=200, val_chunk=10, seed=42, rationale=iter-4 manduca_bilateral breast (train3600/val200/test200 seed20260703, per-iter train_n=400, val=200). SIX-BOX from BEST (iter-3 img_n_bf=6 hr=0.2467): (1) PRIOR: iter-1 hr=0.2159 (img=1); iter-2 hr=0.2431 (img=3, +0.027); iter-3 hr=0.2467 (img=6, +0.0036). img_n_bf DEPTH is PLATEAUING (1->3 big, 3->6 tiny). ep=10 and proj_sr=1.5 untouched since iter-1. budget 271/1200s. (2) FAILURE MODE: image-domain depth saturating; the binding constraint shifts to the image bilateral RANGE BANDWIDTH. img_sr=0.02 is a very tight range sigma in image-intensity units (breast mu up to 0.5, display_max=0.5), so each image BF only averages pixels within +/-0.02 mu -- barely reaching across the 128-view streak residual whose amplitude likely exceeds 0.02. The filters cannot pool the noisy neighbors. (3) ONE KNOB (from iter-3 best, img_n_bf=6 held): img_sr 0.02 -> 0.05 (widen image-domain range bandwidth 2.5x). All else held. (4) HYPOTHESIS: img_sr 0.02->0.05 lifts hr above 0.2467 because the current tight range sigma prevents averaging across streak residual >0.02 mu; widening to +/-0.05 lets each edge-preserving filter pool genuinely-noisy neighbors up to the wider threshold, suppressing more residual where calibrated-SSIM-headroom lives. FALSIFIER: if hr drops (edge over-smoothing) or stays flat, range bandwidth is not binding -> iter-5 attacks proj_sr or epochs. (5) BUDGET: same params (21) and filter passes -> ~270s, well under the 20-min budget. (6) Loop continues; iter-5 on landing. --qos=turbo, save ckpt+recon.", "run_id": "breast-ct-claude-agentic-manduca-bilateral-search-20260703-01", "runtime": {"elapsed_s": 235.5434272289276}, "schema_version": 3, "solver_key": "manduca-bilateral", "solver_name": "Manduca proj-bilateral (trainable)", "split": {"train_n": 400, "val_n": 200}, "status": "keep", "ts": "2026-07-04T07:39:26Z"}
{"advice_for_others": "manduca_bilateral-claude-agentic: proj_n_bf=1, proj_sr=1.5, proj_w=5, proj_kernel=5, bf_d_w_ratio=0.16666666666666666, manduca_N0=100000.0, manduca_bowtie=False, img_n_bf=6, img_kernel=5, img_sx=0.5, img_sy=0.5, img_sr=0.1, epochs=10, batch_size=1, lr=0.005, optimizer=adam, lambda_neg=1.0, grad_clip=1.0, train_n=400, val_n=200, val_chunk=10, seed=42, rationale=iter-5 manduca_bilateral breast (train_n=400, val=200). SIX-BOX from BEST (iter-4 img_sr=0.05 hr=0.2752): (1) PRIOR: iter-2 hr=0.2431 (img_sr=0.02,img=3); iter-3 hr=0.2467 (img_sr=0.02,img=6); iter-4 hr=0.2752 (img_sr=0.05,img=6, +0.0285 -- biggest lever yet). Widening image range bandwidth is the binding lever. (2) FAILURE MODE: img_sr was under-reaching; 0.05 helped strongly but likely not yet at optimum -- the streak residual amplitude spans up to ~0.05+ mu so a wider range may pool more of it. (3) ONE KNOB: img_sr 0.05 -> 0.10 (double image range bandwidth again; img_n_bf=6 held). (4) HYPOTHESIS: img_sr 0.05->0.10 lifts hr above 0.2752 because the 0.02->0.05 step gave +0.0285 and the range-sigma optimum for suppressing streak residual sits wider than 0.05. FALSIFIER: if hr drops (over-smoothing real breast edges), optimum is in (0.05,0.10) -> iter-6 bisects to 0.07. (5) BUDGET: identical cost ~236s, far under 20-min. (6) Loop continues; iter-6 on landing. turbo, save ckpt+recon.", "agent": "manduca_bilateral-claude-agentic", "campaign": "search-20260703-01", "cfg_full": {"batch_size": 1, "bf_d_w_ratio": 0.16666666666666666, "epochs": 10, "grad_clip": 1.0, "img_kernel": 5, "img_n_bf": 6, "img_sr": 0.1, "img_sx": 0.5, "img_sy": 0.5, "lambda_neg": 1.0, "lr": 0.005, "manduca_N0": 100000.0, "manduca_bowtie": false, "optimizer": "adam", "proj_kernel": 5, "proj_n_bf": 1, "proj_sr": 1.5, "proj_w": 5, "rationale": "iter-5 manduca_bilateral breast (train_n=400, val=200). SIX-BOX from BEST (iter-4 img_sr=0.05 hr=0.2752): (1) PRIOR: iter-2 hr=0.2431 (img_sr=0.02,img=3); iter-3 hr=0.2467 (img_sr=0.02,img=6); iter-4 hr=0.2752 (img_sr=0.05,img=6, +0.0285 -- biggest lever yet). Widening image range bandwidth is the binding lever. (2) FAILURE MODE: img_sr was under-reaching; 0.05 helped strongly but likely not yet at optimum -- the streak residual amplitude spans up to ~0.05+ mu so a wider range may pool more of it. (3) ONE KNOB: img_sr 0.05 -> 0.10 (double image range bandwidth again; img_n_bf=6 held). (4) HYPOTHESIS: img_sr 0.05->0.10 lifts hr above 0.2752 because the 0.02->0.05 step gave +0.0285 and the range-sigma optimum for suppressing streak residual sits wider than 0.05. FALSIFIER: if hr drops (over-smoothing real breast edges), optimum is in (0.05,0.10) -> iter-6 bisects to 0.07. (5) BUDGET: identical cost ~236s, far under 20-min. (6) Loop continues; iter-6 on landing. turbo, save ckpt+recon.", "seed": 42, "train_n": 400, "val_chunk": 10, "val_n": 200}, "challenge": "breast_ct", "change_class": "architecture", "git_commit": "1176d9f5", "images": {"comparison": "runs/breast-ct-claude-agentic-manduca-bilateral-search-20260703-01/iterations/iter-0005/comparison.png", "test_showcase": null, "valtest_showcase": null}, "iter": 5, "kept": true, "metrics": {"headroom": 0.1557704966667378, "headroom_std": 0.005584814719640601, "val_psnr": 37.794986724853516, "val_psnr_std": 0.6218857316147693, "val_rmse": 0.004402052145451307, "val_rmse_std": 0.0003076677736958981, "val_ssim": 0.9558666944503784, "val_ssim_std": 0.0061535030073998}, "model": "claude-opus-4-8-1m", "obs_path": "breast-ct-claude-agentic-manduca-bilateral-search-20260703-01/iterations/iter-0005/observation.json", "obs_sha1": "766daf130ec8d63185df5b8596d15552d64f43ee", "params_M": 2.2e-05, "params_source": "observation", "rationale": "manduca_bilateral-claude-agentic: proj_n_bf=1, proj_sr=1.5, proj_w=5, proj_kernel=5, bf_d_w_ratio=0.16666666666666666, manduca_N0=100000.0, manduca_bowtie=False, img_n_bf=6, img_kernel=5, img_sx=0.5, img_sy=0.5, img_sr=0.1, epochs=10, batch_size=1, lr=0.005, optimizer=adam, lambda_neg=1.0, grad_clip=1.0, train_n=400, val_n=200, val_chunk=10, seed=42, rationale=iter-5 manduca_bilateral breast (train_n=400, val=200). SIX-BOX from BEST (iter-4 img_sr=0.05 hr=0.2752): (1) PRIOR: iter-2 hr=0.2431 (img_sr=0.02,img=3); iter-3 hr=0.2467 (img_sr=0.02,img=6); iter-4 hr=0.2752 (img_sr=0.05,img=6, +0.0285 -- biggest lever yet). Widening image range bandwidth is the binding lever. (2) FAILURE MODE: img_sr was under-reaching; 0.05 helped strongly but likely not yet at optimum -- the streak residual amplitude spans up to ~0.05+ mu so a wider range may pool more of it. (3) ONE KNOB: img_sr 0.05 -> 0.10 (double image range bandwidth again; img_n_bf=6 held). (4) HYPOTHESIS: img_sr 0.05->0.10 lifts hr above 0.2752 because the 0.02->0.05 step gave +0.0285 and the range-sigma optimum for suppressing streak residual sits wider than 0.05. FALSIFIER: if hr drops (over-smoothing real breast edges), optimum is in (0.05,0.10) -> iter-6 bisects to 0.07. (5) BUDGET: identical cost ~236s, far under 20-min. (6) Loop continues; iter-6 on landing. turbo, save ckpt+recon.", "run_id": "breast-ct-claude-agentic-manduca-bilateral-search-20260703-01", "runtime": {"elapsed_s": 260.6104426383972}, "schema_version": 3, "solver_key": "manduca-bilateral", "solver_name": "Manduca proj-bilateral (trainable)", "split": {"train_n": 400, "val_n": 200}, "status": "keep", "ts": "2026-07-04T08:29:11Z"}
{"advice_for_others": "manduca_bilateral-claude-agentic: proj_n_bf=1, proj_sr=1.5, proj_w=5, proj_kernel=5, bf_d_w_ratio=0.16666666666666666, manduca_N0=100000.0, manduca_bowtie=False, img_n_bf=6, img_kernel=5, img_sx=0.5, img_sy=0.5, img_sr=0.07, epochs=10, batch_size=1, lr=0.005, optimizer=adam, lambda_neg=1.0, grad_clip=1.0, train_n=400, val_n=200, val_chunk=10, seed=42, rationale=iter-6 manduca_bilateral breast (train_n=400, val=200). SIX-BOX from BEST (iter-4 img_sr=0.05 hr=0.2752): (1) PRIOR: iter-4 hr=0.2752 (img_sr=0.05, BEST); iter-5 hr=0.1558 (img_sr=0.10, REGRESSED -0.12, ssim 0.9815->0.9559). The img range-sigma optimum is BETWEEN 0.05 and 0.10. (2) FAILURE MODE: iter-5 over-smoothed -- range bandwidth 0.10 too wide, averaged across real breast tissue edges, ssim collapsed. (3) ONE KNOB: img_sr 0.05 -> 0.07 (bisect toward the peak from the iter-4 best state; img_n_bf=6 held). (4) HYPOTHESIS: img_sr=0.07 lifts hr above 0.2752 because 0.05 helped strongly and 0.10 over-smoothed, so the optimum sits between; 0.07 pools slightly more streak residual than 0.05 without crossing into the edge-destroying regime that collapsed iter-5. FALSIFIER: if hr<=0.2752, peak is at/below 0.05 -> iter-7 tries 0.06 or pivots off img_sr (to epochs or proj_sr). (5) BUDGET: ~236s, under 20-min. (6) Loop continues; iter-7 on landing. turbo, save ckpt+recon, params_M logged.", "agent": "manduca_bilateral-claude-agentic", "campaign": "search-20260703-01", "cfg_full": {"batch_size": 1, "bf_d_w_ratio": 0.16666666666666666, "epochs": 10, "grad_clip": 1.0, "img_kernel": 5, "img_n_bf": 6, "img_sr": 0.07, "img_sx": 0.5, "img_sy": 0.5, "lambda_neg": 1.0, "lr": 0.005, "manduca_N0": 100000.0, "manduca_bowtie": false, "optimizer": "adam", "proj_kernel": 5, "proj_n_bf": 1, "proj_sr": 1.5, "proj_w": 5, "rationale": "iter-6 manduca_bilateral breast (train_n=400, val=200). SIX-BOX from BEST (iter-4 img_sr=0.05 hr=0.2752): (1) PRIOR: iter-4 hr=0.2752 (img_sr=0.05, BEST); iter-5 hr=0.1558 (img_sr=0.10, REGRESSED -0.12, ssim 0.9815->0.9559). The img range-sigma optimum is BETWEEN 0.05 and 0.10. (2) FAILURE MODE: iter-5 over-smoothed -- range bandwidth 0.10 too wide, averaged across real breast tissue edges, ssim collapsed. (3) ONE KNOB: img_sr 0.05 -> 0.07 (bisect toward the peak from the iter-4 best state; img_n_bf=6 held). (4) HYPOTHESIS: img_sr=0.07 lifts hr above 0.2752 because 0.05 helped strongly and 0.10 over-smoothed, so the optimum sits between; 0.07 pools slightly more streak residual than 0.05 without crossing into the edge-destroying regime that collapsed iter-5. FALSIFIER: if hr<=0.2752, peak is at/below 0.05 -> iter-7 tries 0.06 or pivots off img_sr (to epochs or proj_sr). (5) BUDGET: ~236s, under 20-min. (6) Loop continues; iter-7 on landing. turbo, save ckpt+recon, params_M logged.", "seed": 42, "train_n": 400, "val_chunk": 10, "val_n": 200}, "challenge": "breast_ct", "change_class": "architecture", "git_commit": "671da566", "images": {"comparison": "runs/breast-ct-claude-agentic-manduca-bilateral-search-20260703-01/iterations/iter-0006/comparison.png", "test_showcase": null, "valtest_showcase": null}, "iter": 6, "kept": true, "metrics": {"headroom": 0.25634482565845196, "headroom_std": 0.008697915729568587, "val_psnr": 38.896766662597656, "val_psnr_std": 0.5636799054807307, "val_rmse": 0.0038776290602982044, "val_rmse_std": 0.00024480325581806143, "val_ssim": 0.9785897135734558, "val_ssim_std": 0.003718352980540942}, "model": "claude-opus-4-8-1m", "obs_path": "breast-ct-claude-agentic-manduca-bilateral-search-20260703-01/iterations/iter-0006/observation.json", "obs_sha1": "2be7409383036c6ac910cc6d79e0aa31c1659e9d", "params_M": 2.2e-05, "params_source": "observation", "rationale": "manduca_bilateral-claude-agentic: proj_n_bf=1, proj_sr=1.5, proj_w=5, proj_kernel=5, bf_d_w_ratio=0.16666666666666666, manduca_N0=100000.0, manduca_bowtie=False, img_n_bf=6, img_kernel=5, img_sx=0.5, img_sy=0.5, img_sr=0.07, epochs=10, batch_size=1, lr=0.005, optimizer=adam, lambda_neg=1.0, grad_clip=1.0, train_n=400, val_n=200, val_chunk=10, seed=42, rationale=iter-6 manduca_bilateral breast (train_n=400, val=200). SIX-BOX from BEST (iter-4 img_sr=0.05 hr=0.2752): (1) PRIOR: iter-4 hr=0.2752 (img_sr=0.05, BEST); iter-5 hr=0.1558 (img_sr=0.10, REGRESSED -0.12, ssim 0.9815->0.9559). The img range-sigma optimum is BETWEEN 0.05 and 0.10. (2) FAILURE MODE: iter-5 over-smoothed -- range bandwidth 0.10 too wide, averaged across real breast tissue edges, ssim collapsed. (3) ONE KNOB: img_sr 0.05 -> 0.07 (bisect toward the peak from the iter-4 best state; img_n_bf=6 held). (4) HYPOTHESIS: img_sr=0.07 lifts hr above 0.2752 because 0.05 helped strongly and 0.10 over-smoothed, so the optimum sits between; 0.07 pools slightly more streak residual than 0.05 without crossing into the edge-destroying regime that collapsed iter-5. FALSIFIER: if hr<=0.2752, peak is at/below 0.05 -> iter-7 tries 0.06 or pivots off img_sr (to epochs or proj_sr). (5) BUDGET: ~236s, under 20-min. (6) Loop continues; iter-7 on landing. turbo, save ckpt+recon, params_M logged.", "run_id": "breast-ct-claude-agentic-manduca-bilateral-search-20260703-01", "runtime": {"elapsed_s": 216.2417140007019}, "schema_version": 3, "solver_key": "manduca-bilateral", "solver_name": "Manduca proj-bilateral (trainable)", "split": {"train_n": 400, "val_n": 200}, "status": "keep", "ts": "2026-07-04T13:13:13Z"}
