{"advice_for_others": "param_efficient-claude-agentic: reg_type=foe, bilateral_on_top=True, proj_filter_on=False, n_iter=5, learnable_alpha=True, alpha_init=0.1, foe_n_filters=24, foe_kernel=7, foe_n_bumps=31, n_bf=3, bf_multiscale=True, bf_sigmas=[0.8, 1.6, 3.2], bf_kernel=7, bf_sigma_r=0.02, bf_gain_init=0.0, epochs=16, cosine_lr=True, lr=0.005, max_train_s=1080, batch_size=4, train_n=200, val_n=200, display_min=0.0, display_max=0.05, seed=42, rationale=iter-7 param_efficient breast -- LEARNED PER-STEP DC WEIGHT (step toward VN). SIX-BOX: (1) PRIOR: 6 iters map the plain tied-GD unroll. KEY new finding iter-6: deep DC (K20) on the lean prox gave hr 0.0 -- DEEPER DC made it WORSE (0.066->0.0), not better. So the problem is NOT under-consistency: on 128-view sparse data the DC gradient R^T(Rx-g) itself is CORRUPTING -- with only 128 views R^T R is a STREAKY operator, so back-projecting the residual RE-INJECTS coherent streaks; iterating it 20x AMPLIFIES exactly what we want removed. This is why LPD (primal-dual) + VN (learned per-step gradient weighting) win and a plain repeated R^T(Rx-g) GD unroll caps ~image-domain. Best point stays iter-1 0.264 (FoE capacity as image cleanup). (2) FAILURE MODE: raw tied DC gradient amplifies streaks over steps; a SINGLE shared scalar alpha can't attenuate the harmful later steps. (3) ONE KNOB: per_step_alpha False->True on the FoE+bilateral K5 arch (iter-2 base, the fully-trained 0.190 config). +4 params (5 per-step alphas vs 1) -> ~1937 total. This is the MINIMAL move from plain-GD toward VN: each step learns its OWN DC weight, so the net can DOWN-WEIGHT the streak-amplifying later steps. (4) HYPOTHESIS: learned per-step alphas let the unroll learn to apply DC strongly early (coarse consistency) then softly late (avoid streak re-injection), rescuing the fully-trained FoE from the over-regularize/corrupt regime -> hr exceeds 0.264, because per-step DC weighting is VN's core trick and it directly targets the iter-6 corruption finding. (5) BUDGET: K=5 FoE+bilateral, train_n=200, 1080s backstop + 200-val -> <20min (same cost as iter-2). (6) SERIAL; iter-8 self-dispatches (next: if per-step helps, sweep K deeper WITH per-step alphas; if not, projection-domain filter +5p)., per_step_alpha=True", "agent": "param_efficient-claude-agentic", "campaign": "search-20260703-01", "cfg_full": {"alpha_init": 0.1, "batch_size": 4, "bf_gain_init": 0.0, "bf_kernel": 7, "bf_multiscale": true, "bf_sigma_r": 0.02, "bf_sigmas": [0.8, 1.6, 3.2], "bilateral_on_top": true, "cosine_lr": true, "display_max": 0.05, "display_min": 0.0, "epochs": 16, "foe_kernel": 7, "foe_n_bumps": 31, "foe_n_filters": 24, "learnable_alpha": true, "lr": 0.005, "max_train_s": 1080, "n_bf": 3, "n_iter": 5, "per_step_alpha": true, "proj_filter_on": false, "rationale": "iter-7 param_efficient breast -- LEARNED PER-STEP DC WEIGHT (step toward VN). SIX-BOX: (1) PRIOR: 6 iters map the plain tied-GD unroll. KEY new finding iter-6: deep DC (K20) on the lean prox gave hr 0.0 -- DEEPER DC made it WORSE (0.066->0.0), not better. So the problem is NOT under-consistency: on 128-view sparse data the DC gradient R^T(Rx-g) itself is CORRUPTING -- with only 128 views R^T R is a STREAKY operator, so back-projecting the residual RE-INJECTS coherent streaks; iterating it 20x AMPLIFIES exactly what we want removed. This is why LPD (primal-dual) + VN (learned per-step gradient weighting) win and a plain repeated R^T(Rx-g) GD unroll caps ~image-domain. Best point stays iter-1 0.264 (FoE capacity as image cleanup). (2) FAILURE MODE: raw tied DC gradient amplifies streaks over steps; a SINGLE shared scalar alpha can't attenuate the harmful later steps. (3) ONE KNOB: per_step_alpha False->True on the FoE+bilateral K5 arch (iter-2 base, the fully-trained 0.190 config). +4 params (5 per-step alphas vs 1) -> ~1937 total. This is the MINIMAL move from plain-GD toward VN: each step learns its OWN DC weight, so the net can DOWN-WEIGHT the streak-amplifying later steps. (4) HYPOTHESIS: learned per-step alphas let the unroll learn to apply DC strongly early (coarse consistency) then softly late (avoid streak re-injection), rescuing the fully-trained FoE from the over-regularize/corrupt regime -> hr exceeds 0.264, because per-step DC weighting is VN's core trick and it directly targets the iter-6 corruption finding. (5) BUDGET: K=5 FoE+bilateral, train_n=200, 1080s backstop + 200-val -> <20min (same cost as iter-2). (6) SERIAL; iter-8 self-dispatches (next: if per-step helps, sweep K deeper WITH per-step alphas; if not, projection-domain filter +5p).", "reg_type": "foe", "seed": 42, "train_n": 200, "val_n": 200}, "challenge": "breast_ct", "change_class": "architecture", "git_commit": "671da566", "images": {"comparison": "runs/breast-ct-claude-agentic-param-efficient-search-20260703-01/iterations/iter-0007/comparison.png", "test_showcase": null, "valtest_showcase": null}, "iter": 7, "kept": true, "metrics": {"headroom": 0.18967538458502098, "headroom_std": 0.03170895244669629, "val_psnr": 38.15102005004883, "val_psnr_std": 0.29755386532916983, "val_rmse": 0.004225262440741062, "val_rmse_std": 0.00012807556528540595, "val_ssim": 0.9853033423423767, "val_ssim_std": 0.002426376676504488}, "model": "claude-opus-4-8-1m", "obs_path": "breast-ct-claude-agentic-param-efficient-search-20260703-01/iterations/iter-0007/observation.json", "obs_sha1": "ca88af609db03467efa94dfbd3f286970518c012", "params_M": 0.001937, "params_source": "observation", "rationale": "param_efficient-claude-agentic: reg_type=foe, bilateral_on_top=True, proj_filter_on=False, n_iter=5, learnable_alpha=True, alpha_init=0.1, foe_n_filters=24, foe_kernel=7, foe_n_bumps=31, n_bf=3, bf_multiscale=True, bf_sigmas=[0.8, 1.6, 3.2], bf_kernel=7, bf_sigma_r=0.02, bf_gain_init=0.0, epochs=16, cosine_lr=True, lr=0.005, max_train_s=1080, batch_size=4, train_n=200, val_n=200, display_min=0.0, display_max=0.05, seed=42, rationale=iter-7 param_efficient breast -- LEARNED PER-STEP DC WEIGHT (step toward VN). SIX-BOX: (1) PRIOR: 6 iters map the plain tied-GD unroll. KEY new finding iter-6: deep DC (K20) on the lean prox gave hr 0.0 -- DEEPER DC made it WORSE (0.066->0.0), not better. So the problem is NOT under-consistency: on 128-view sparse data the DC gradient R^T(Rx-g) itself is CORRUPTING -- with only 128 views R^T R is a STREAKY operator, so back-projecting the residual RE-INJECTS coherent streaks; iterating it 20x AMPLIFIES exactly what we want removed. This is why LPD (primal-dual) + VN (learned per-step gradient weighting) win and a plain repeated R^T(Rx-g) GD unroll caps ~image-domain. Best point stays iter-1 0.264 (FoE capacity as image cleanup). (2) FAILURE MODE: raw tied DC gradient amplifies streaks over steps; a SINGLE shared scalar alpha can't attenuate the harmful later steps. (3) ONE KNOB: per_step_alpha False->True on the FoE+bilateral K5 arch (iter-2 base, the fully-trained 0.190 config). +4 params (5 per-step alphas vs 1) -> ~1937 total. This is the MINIMAL move from plain-GD toward VN: each step learns its OWN DC weight, so the net can DOWN-WEIGHT the streak-amplifying later steps. (4) HYPOTHESIS: learned per-step alphas let the unroll learn to apply DC strongly early (coarse consistency) then softly late (avoid streak re-injection), rescuing the fully-trained FoE from the over-regularize/corrupt regime -> hr exceeds 0.264, because per-step DC weighting is VN's core trick and it directly targets the iter-6 corruption finding. (5) BUDGET: K=5 FoE+bilateral, train_n=200, 1080s backstop + 200-val -> <20min (same cost as iter-2). (6) SERIAL; iter-8 self-dispatches (next: if per-step helps, sweep K deeper WITH per-step alphas; if not, projection-domain filter +5p)., per_step_alpha=True", "run_id": "breast-ct-claude-agentic-param-efficient-search-20260703-01", "runtime": {"elapsed_s": 1164.1419320106506}, "schema_version": 3, "solver_key": "param-efficient", "solver_name": "Param-efficient (evolved)", "split": {"train_n": 200, "val_n": 200}, "status": "keep", "ts": "2026-07-06T18:12:13Z"}
{"advice_for_others": "param_efficient-claude-agentic: reg_type=foe, bilateral_on_top=True, proj_filter_on=True, n_iter=5, learnable_alpha=True, alpha_init=0.1, foe_n_filters=24, foe_kernel=7, foe_n_bumps=31, n_bf=3, bf_multiscale=True, bf_sigmas=[0.8, 1.6, 3.2], bf_kernel=7, bf_sigma_r=0.02, bf_gain_init=0.0, epochs=16, cosine_lr=True, lr=0.005, max_train_s=1080, batch_size=4, train_n=200, val_n=200, display_min=0.0, display_max=0.05, seed=42, rationale=iter-8 param_efficient breast -- PROJECTION-DOMAIN FILTER ON (sparse-view-native lever). SIX-BOX: (1) PRIOR: 7 iters prove the config-only GD-unroll caps at image-domain ~0.26. iter-7 per_step_alpha gave IDENTICAL 0.1897 to iter-2 -- the 5 per-step alphas COLLAPSED to one shared value; the loss landscape has no incentive to differentiate them, so config-only per-step-alpha CANNOT express a genuine VN. Combined with iter-6 (deeper DC WORSE = streak re-injection), verdict: the image-domain DC gradient R^T(Rx-g) is corrupting on 128-view sparse and no image-side knob escapes ~0.26. (2) FAILURE MODE: image-domain-only ceiling; the DC gradient re-injects streaks; no config knob learns to combine it. (3) ONE KNOB: proj_filter_on False->True (Manduca sinogram bilateral, +5 params: 3 sigma + log_N0 + 1 zero-init gain). It denoises the LOG-SINOGRAM on the Anscombe sqrt-count (noise-adaptive) BEFORE the FBP init, then recomputes x0 from the FILTERED sino, so it removes streak-CAUSING projection inconsistencies at the SOURCE rather than fighting them in image space. On dense Mayo this was null (FBP already averages proj noise); on 128-view SPARSE it is the native lever. All else byte-for-byte iter-2 (FoE+bilateral K5). (4) HYPOTHESIS: cleaning the sinogram before back-projection reduces the coherent streaks the FBP init injects, so the FoE+DC unroll starts from a cleaner image and hr exceeds 0.264, because sparse-view streaks are a PROJECTION-domain defect and this is the one lever VN/LPD lack. Zero-init gain => at init pipeline==iter-2 byte-for-byte (worst case == 0.190, no regression). (5) BUDGET: +1 sinogram bilateral per forward (cheap vs the K=5 image unroll); train_n=200, 1080s backstop + 200-val -> <20min. (6) SERIAL; iter-9 self-dispatches (next: if proj-filter helps, TUNE its sigma_r/gain or make it multi-scale; if not, directional streak reg +3p)., proj_n_bf=1, proj_multiscale=False, proj_kernel=5, proj_sigma_x=0.83, proj_sigma_y=0.83, proj_sigma_r=1.5, proj_gain_init=0.0, proj_N0=100000.0, per_step_alpha=False", "agent": "param_efficient-claude-agentic", "campaign": "search-20260703-01", "cfg_full": {"alpha_init": 0.1, "batch_size": 4, "bf_gain_init": 0.0, "bf_kernel": 7, "bf_multiscale": true, "bf_sigma_r": 0.02, "bf_sigmas": [0.8, 1.6, 3.2], "bilateral_on_top": true, "cosine_lr": true, "display_max": 0.05, "display_min": 0.0, "epochs": 16, "foe_kernel": 7, "foe_n_bumps": 31, "foe_n_filters": 24, "learnable_alpha": true, "lr": 0.005, "max_train_s": 1080, "n_bf": 3, "n_iter": 5, "per_step_alpha": false, "proj_N0": 100000.0, "proj_filter_on": true, "proj_gain_init": 0.0, "proj_kernel": 5, "proj_multiscale": false, "proj_n_bf": 1, "proj_sigma_r": 1.5, "proj_sigma_x": 0.83, "proj_sigma_y": 0.83, "rationale": "iter-8 param_efficient breast -- PROJECTION-DOMAIN FILTER ON (sparse-view-native lever). SIX-BOX: (1) PRIOR: 7 iters prove the config-only GD-unroll caps at image-domain ~0.26. iter-7 per_step_alpha gave IDENTICAL 0.1897 to iter-2 -- the 5 per-step alphas COLLAPSED to one shared value; the loss landscape has no incentive to differentiate them, so config-only per-step-alpha CANNOT express a genuine VN. Combined with iter-6 (deeper DC WORSE = streak re-injection), verdict: the image-domain DC gradient R^T(Rx-g) is corrupting on 128-view sparse and no image-side knob escapes ~0.26. (2) FAILURE MODE: image-domain-only ceiling; the DC gradient re-injects streaks; no config knob learns to combine it. (3) ONE KNOB: proj_filter_on False->True (Manduca sinogram bilateral, +5 params: 3 sigma + log_N0 + 1 zero-init gain). It denoises the LOG-SINOGRAM on the Anscombe sqrt-count (noise-adaptive) BEFORE the FBP init, then recomputes x0 from the FILTERED sino, so it removes streak-CAUSING projection inconsistencies at the SOURCE rather than fighting them in image space. On dense Mayo this was null (FBP already averages proj noise); on 128-view SPARSE it is the native lever. All else byte-for-byte iter-2 (FoE+bilateral K5). (4) HYPOTHESIS: cleaning the sinogram before back-projection reduces the coherent streaks the FBP init injects, so the FoE+DC unroll starts from a cleaner image and hr exceeds 0.264, because sparse-view streaks are a PROJECTION-domain defect and this is the one lever VN/LPD lack. Zero-init gain => at init pipeline==iter-2 byte-for-byte (worst case == 0.190, no regression). (5) BUDGET: +1 sinogram bilateral per forward (cheap vs the K=5 image unroll); train_n=200, 1080s backstop + 200-val -> <20min. (6) SERIAL; iter-9 self-dispatches (next: if proj-filter helps, TUNE its sigma_r/gain or make it multi-scale; if not, directional streak reg +3p).", "reg_type": "foe", "seed": 42, "train_n": 200, "val_n": 200}, "challenge": "breast_ct", "change_class": "architecture", "git_commit": "671da566", "images": {"comparison": "runs/breast-ct-claude-agentic-param-efficient-search-20260703-01/iterations/iter-0008/comparison.png", "test_showcase": null, "valtest_showcase": null}, "iter": 8, "kept": true, "metrics": {"headroom": 0.18147174360480633, "headroom_std": 0.032323184538207525, "val_psnr": 38.06352233886719, "val_psnr_std": 0.2994667737903127, "val_rmse": 0.004268038552254438, "val_rmse_std": 0.00013030232380607123, "val_ssim": 0.9849401712417603, "val_ssim_std": 0.0024641793559721952}, "model": "claude-opus-4-8-1m", "obs_path": "breast-ct-claude-agentic-param-efficient-search-20260703-01/iterations/iter-0008/observation.json", "obs_sha1": "95bca1ed7250b0ba17c855bdf6444cc3715ca44c", "params_M": 0.001938, "params_source": "observation", "rationale": "param_efficient-claude-agentic: reg_type=foe, bilateral_on_top=True, proj_filter_on=True, n_iter=5, learnable_alpha=True, alpha_init=0.1, foe_n_filters=24, foe_kernel=7, foe_n_bumps=31, n_bf=3, bf_multiscale=True, bf_sigmas=[0.8, 1.6, 3.2], bf_kernel=7, bf_sigma_r=0.02, bf_gain_init=0.0, epochs=16, cosine_lr=True, lr=0.005, max_train_s=1080, batch_size=4, train_n=200, val_n=200, display_min=0.0, display_max=0.05, seed=42, rationale=iter-8 param_efficient breast -- PROJECTION-DOMAIN FILTER ON (sparse-view-native lever). SIX-BOX: (1) PRIOR: 7 iters prove the config-only GD-unroll caps at image-domain ~0.26. iter-7 per_step_alpha gave IDENTICAL 0.1897 to iter-2 -- the 5 per-step alphas COLLAPSED to one shared value; the loss landscape has no incentive to differentiate them, so config-only per-step-alpha CANNOT express a genuine VN. Combined with iter-6 (deeper DC WORSE = streak re-injection), verdict: the image-domain DC gradient R^T(Rx-g) is corrupting on 128-view sparse and no image-side knob escapes ~0.26. (2) FAILURE MODE: image-domain-only ceiling; the DC gradient re-injects streaks; no config knob learns to combine it. (3) ONE KNOB: proj_filter_on False->True (Manduca sinogram bilateral, +5 params: 3 sigma + log_N0 + 1 zero-init gain). It denoises the LOG-SINOGRAM on the Anscombe sqrt-count (noise-adaptive) BEFORE the FBP init, then recomputes x0 from the FILTERED sino, so it removes streak-CAUSING projection inconsistencies at the SOURCE rather than fighting them in image space. On dense Mayo this was null (FBP already averages proj noise); on 128-view SPARSE it is the native lever. All else byte-for-byte iter-2 (FoE+bilateral K5). (4) HYPOTHESIS: cleaning the sinogram before back-projection reduces the coherent streaks the FBP init injects, so the FoE+DC unroll starts from a cleaner image and hr exceeds 0.264, because sparse-view streaks are a PROJECTION-domain defect and this is the one lever VN/LPD lack. Zero-init gain => at init pipeline==iter-2 byte-for-byte (worst case == 0.190, no regression). (5) BUDGET: +1 sinogram bilateral per forward (cheap vs the K=5 image unroll); train_n=200, 1080s backstop + 200-val -> <20min. (6) SERIAL; iter-9 self-dispatches (next: if proj-filter helps, TUNE its sigma_r/gain or make it multi-scale; if not, directional streak reg +3p)., proj_n_bf=1, proj_multiscale=False, proj_kernel=5, proj_sigma_x=0.83, proj_sigma_y=0.83, proj_sigma_r=1.5, proj_gain_init=0.0, proj_N0=100000.0, per_step_alpha=False", "run_id": "breast-ct-claude-agentic-param-efficient-search-20260703-01", "runtime": {"elapsed_s": 1148.1950402259827}, "schema_version": 3, "solver_key": "param-efficient", "solver_name": "Param-efficient (evolved)", "split": {"train_n": 200, "val_n": 200}, "status": "keep", "ts": "2026-07-06T19:50:15Z"}
