{"advice_for_others": "dual_domain_bilateral_supervised-claude-agentic: proj_n_bf=1, img_n_bf=7, proj_kernel=3, proj_sx=0.01, proj_sy=0.3, proj_sr=0.0005, img_kernel=7, img_sx=0.5, img_sy=0.5, img_sr=0.02, epochs=10, batch_size=1, lr=0.01, optimizer=adam, lambda_neg=0.1, grad_clip=1.0, train_n=400, val_n=200, val_chunk=10, seed=42, rationale=iter-9 dual_domain_bilateral_supervised, re-split Breast-CT val=200. SIX-BOX vs BEST (iter-6 lr=1e-2/img_sr0.02/lneg1.0 hr=0.2555). (1) PRIOR: img_sr init widening HURT (iter-8 img_sr0.05=0.2493) -> trainable sigma finds its own optimum, reverted to 0.02; lr bracketed at 1e-2. (2) Failure mode: lambda_neg=1.0 may over-suppress the low-mu breast background, biasing the L2 fit away from true attenuation (the sibling DD-UNet gained by lowering it 1.0->0.03). (3) ONE KNOB: lambda_neg 1.0 -> 0.1 (best config otherwise). (4) HYPOTHESIS: lowering the negativity-penalty weight lets the supervised L2 term dominate and fit breast attenuation more faithfully -> hr above 0.2555 toward ~0.26; if hr DROPS, the penalty is load-bearing for the BF (which cannot clamp negatives itself) and iter-10 reverts to 1.0 and pivots to proj-side BF (proj_n_bf). (5) BUDGET: same ep10 -> ~120s. (6) Loop continues to iter-20. Artifacts saved.", "agent": "dual_domain_bilateral_supervised-claude-agentic", "campaign": "search-20260703-01", "cfg_full": {"batch_size": 1, "epochs": 10, "grad_clip": 1.0, "img_kernel": 7, "img_n_bf": 7, "img_sr": 0.02, "img_sx": 0.5, "img_sy": 0.5, "lambda_neg": 0.1, "lr": 0.01, "optimizer": "adam", "proj_kernel": 3, "proj_n_bf": 1, "proj_sr": 0.0005, "proj_sx": 0.01, "proj_sy": 0.3, "rationale": "iter-9 dual_domain_bilateral_supervised, re-split Breast-CT val=200. SIX-BOX vs BEST (iter-6 lr=1e-2/img_sr0.02/lneg1.0 hr=0.2555). (1) PRIOR: img_sr init widening HURT (iter-8 img_sr0.05=0.2493) -> trainable sigma finds its own optimum, reverted to 0.02; lr bracketed at 1e-2. (2) Failure mode: lambda_neg=1.0 may over-suppress the low-mu breast background, biasing the L2 fit away from true attenuation (the sibling DD-UNet gained by lowering it 1.0->0.03). (3) ONE KNOB: lambda_neg 1.0 -> 0.1 (best config otherwise). (4) HYPOTHESIS: lowering the negativity-penalty weight lets the supervised L2 term dominate and fit breast attenuation more faithfully -> hr above 0.2555 toward ~0.26; if hr DROPS, the penalty is load-bearing for the BF (which cannot clamp negatives itself) and iter-10 reverts to 1.0 and pivots to proj-side BF (proj_n_bf). (5) BUDGET: same ep10 -> ~120s. (6) Loop continues to iter-20. Artifacts saved.", "seed": 42, "train_n": 400, "val_chunk": 10, "val_n": 200}, "challenge": "breast_ct", "change_class": "architecture", "git_commit": "671da566", "images": {"comparison": "runs/breast-ct-claude-agentic-dual-domain-bilateral-supervised-search-20260703-01/iterations/iter-0009/comparison.png", "test_showcase": null, "valtest_showcase": null}, "iter": 9, "kept": true, "metrics": {"headroom": 0.24872854326051796, "headroom_std": 0.008817992577715693, "val_psnr": 38.808258056640625, "val_psnr_std": 0.5967494120509887, "val_rmse": 0.003917342517524958, "val_rmse_std": 0.00026261002996019327, "val_ssim": 0.981605589389801, "val_ssim_std": 0.003416973913811887}, "model": "claude-opus-4-8-1m", "obs_path": "breast-ct-claude-agentic-dual-domain-bilateral-supervised-search-20260703-01/iterations/iter-0009/observation.json", "obs_sha1": "a8ea6ed9adf6e7a231901c9bf397597739289d98", "params_M": 2.4e-05, "params_source": "observation", "rationale": "dual_domain_bilateral_supervised-claude-agentic: proj_n_bf=1, img_n_bf=7, proj_kernel=3, proj_sx=0.01, proj_sy=0.3, proj_sr=0.0005, img_kernel=7, img_sx=0.5, img_sy=0.5, img_sr=0.02, epochs=10, batch_size=1, lr=0.01, optimizer=adam, lambda_neg=0.1, grad_clip=1.0, train_n=400, val_n=200, val_chunk=10, seed=42, rationale=iter-9 dual_domain_bilateral_supervised, re-split Breast-CT val=200. SIX-BOX vs BEST (iter-6 lr=1e-2/img_sr0.02/lneg1.0 hr=0.2555). (1) PRIOR: img_sr init widening HURT (iter-8 img_sr0.05=0.2493) -> trainable sigma finds its own optimum, reverted to 0.02; lr bracketed at 1e-2. (2) Failure mode: lambda_neg=1.0 may over-suppress the low-mu breast background, biasing the L2 fit away from true attenuation (the sibling DD-UNet gained by lowering it 1.0->0.03). (3) ONE KNOB: lambda_neg 1.0 -> 0.1 (best config otherwise). (4) HYPOTHESIS: lowering the negativity-penalty weight lets the supervised L2 term dominate and fit breast attenuation more faithfully -> hr above 0.2555 toward ~0.26; if hr DROPS, the penalty is load-bearing for the BF (which cannot clamp negatives itself) and iter-10 reverts to 1.0 and pivots to proj-side BF (proj_n_bf). (5) BUDGET: same ep10 -> ~120s. (6) Loop continues to iter-20. Artifacts saved.", "run_id": "breast-ct-claude-agentic-dual-domain-bilateral-supervised-search-20260703-01", "runtime": {"elapsed_s": 265.9608371257782}, "schema_version": 3, "solver_key": "dual-domain-bilateral-supervised", "solver_name": "DD-BF supervised L2", "split": {"train_n": 400, "val_n": 200}, "status": "keep", "ts": "2026-07-05T17:22:59Z"}
{"advice_for_others": "dual_domain_bilateral_supervised-claude-agentic: proj_n_bf=3, img_n_bf=7, proj_kernel=3, proj_sx=0.01, proj_sy=0.3, proj_sr=0.0005, img_kernel=7, img_sx=0.5, img_sy=0.5, img_sr=0.02, epochs=10, batch_size=1, lr=0.01, optimizer=adam, lambda_neg=1.0, grad_clip=1.0, train_n=400, val_n=200, val_chunk=10, seed=42, rationale=iter-10 dual_domain_bilateral_supervised, re-split Breast-CT val=200. SIX-BOX vs BEST (iter-6 proj_n_bf=1/img_n_bf=7/lr1e-2/lneg1.0 hr=0.2555). (1) PRIOR: lambda_neg lowering HURT (iter-9 lneg0.1=0.2487) -> the negativity penalty is LOAD-BEARING for BFs (a bilateral cannot clamp negatives itself, unlike the DD-UNet); reverted to 1.0. img side fully mapped (depth7, kernel7, lr1e-2 all optimal). The PROJECTION-domain BF is still at its minimal proj_n_bf=1. (2) Failure mode: a single sinogram BF barely denoises the sparse-view sinogram before FBP; streaks that a deeper proj stack could suppress pre-reconstruction survive into the image. (3) ONE KNOB: proj_n_bf 1 -> 3 (best config otherwise). (4) HYPOTHESIS: 3 chained projection BFs denoise the sinogram more before FBP -> fewer streaks -> hr above 0.2555 toward ~0.26-0.27; if flat/down, proj-domain denoising is not the lever (image-domain dominates) and iter-11 pushes proj_kernel or reverts. (5) BUDGET: proj BFs act on the sinogram (smaller than 512x512 image); 3x cheap -> ~130s. (6) Loop continues. Artifacts saved.", "agent": "dual_domain_bilateral_supervised-claude-agentic", "campaign": "search-20260703-01", "cfg_full": {"batch_size": 1, "epochs": 10, "grad_clip": 1.0, "img_kernel": 7, "img_n_bf": 7, "img_sr": 0.02, "img_sx": 0.5, "img_sy": 0.5, "lambda_neg": 1.0, "lr": 0.01, "optimizer": "adam", "proj_kernel": 3, "proj_n_bf": 3, "proj_sr": 0.0005, "proj_sx": 0.01, "proj_sy": 0.3, "rationale": "iter-10 dual_domain_bilateral_supervised, re-split Breast-CT val=200. SIX-BOX vs BEST (iter-6 proj_n_bf=1/img_n_bf=7/lr1e-2/lneg1.0 hr=0.2555). (1) PRIOR: lambda_neg lowering HURT (iter-9 lneg0.1=0.2487) -> the negativity penalty is LOAD-BEARING for BFs (a bilateral cannot clamp negatives itself, unlike the DD-UNet); reverted to 1.0. img side fully mapped (depth7, kernel7, lr1e-2 all optimal). The PROJECTION-domain BF is still at its minimal proj_n_bf=1. (2) Failure mode: a single sinogram BF barely denoises the sparse-view sinogram before FBP; streaks that a deeper proj stack could suppress pre-reconstruction survive into the image. (3) ONE KNOB: proj_n_bf 1 -> 3 (best config otherwise). (4) HYPOTHESIS: 3 chained projection BFs denoise the sinogram more before FBP -> fewer streaks -> hr above 0.2555 toward ~0.26-0.27; if flat/down, proj-domain denoising is not the lever (image-domain dominates) and iter-11 pushes proj_kernel or reverts. (5) BUDGET: proj BFs act on the sinogram (smaller than 512x512 image); 3x cheap -> ~130s. (6) Loop continues. Artifacts saved.", "seed": 42, "train_n": 400, "val_chunk": 10, "val_n": 200}, "challenge": "breast_ct", "change_class": "architecture", "git_commit": "671da566", "images": {"comparison": "runs/breast-ct-claude-agentic-dual-domain-bilateral-supervised-search-20260703-01/iterations/iter-0010/comparison.png", "test_showcase": null, "valtest_showcase": null}, "iter": 10, "kept": true, "metrics": {"headroom": 0.2554991078883142, "headroom_std": 0.009514983816910065, "val_psnr": 38.88689422607422, "val_psnr_std": 0.5831707429305093, "val_rmse": 0.0038820388726890087, "val_rmse_std": 0.00025410570685666193, "val_ssim": 0.9834036231040955, "val_ssim_std": 0.003113238866659877}, "model": "claude-opus-4-8-1m", "obs_path": "breast-ct-claude-agentic-dual-domain-bilateral-supervised-search-20260703-01/iterations/iter-0010/observation.json", "obs_sha1": "69c8ba9dc065e9eab36d16d3562b8645424daa82", "params_M": 3e-05, "params_source": "observation", "rationale": "dual_domain_bilateral_supervised-claude-agentic: proj_n_bf=3, img_n_bf=7, proj_kernel=3, proj_sx=0.01, proj_sy=0.3, proj_sr=0.0005, img_kernel=7, img_sx=0.5, img_sy=0.5, img_sr=0.02, epochs=10, batch_size=1, lr=0.01, optimizer=adam, lambda_neg=1.0, grad_clip=1.0, train_n=400, val_n=200, val_chunk=10, seed=42, rationale=iter-10 dual_domain_bilateral_supervised, re-split Breast-CT val=200. SIX-BOX vs BEST (iter-6 proj_n_bf=1/img_n_bf=7/lr1e-2/lneg1.0 hr=0.2555). (1) PRIOR: lambda_neg lowering HURT (iter-9 lneg0.1=0.2487) -> the negativity penalty is LOAD-BEARING for BFs (a bilateral cannot clamp negatives itself, unlike the DD-UNet); reverted to 1.0. img side fully mapped (depth7, kernel7, lr1e-2 all optimal). The PROJECTION-domain BF is still at its minimal proj_n_bf=1. (2) Failure mode: a single sinogram BF barely denoises the sparse-view sinogram before FBP; streaks that a deeper proj stack could suppress pre-reconstruction survive into the image. (3) ONE KNOB: proj_n_bf 1 -> 3 (best config otherwise). (4) HYPOTHESIS: 3 chained projection BFs denoise the sinogram more before FBP -> fewer streaks -> hr above 0.2555 toward ~0.26-0.27; if flat/down, proj-domain denoising is not the lever (image-domain dominates) and iter-11 pushes proj_kernel or reverts. (5) BUDGET: proj BFs act on the sinogram (smaller than 512x512 image); 3x cheap -> ~130s. (6) Loop continues. Artifacts saved.", "run_id": "breast-ct-claude-agentic-dual-domain-bilateral-supervised-search-20260703-01", "runtime": {"elapsed_s": 284.1871645450592}, "schema_version": 3, "solver_key": "dual-domain-bilateral-supervised", "solver_name": "DD-BF supervised L2", "split": {"train_n": 400, "val_n": 200}, "status": "keep", "ts": "2026-07-05T17:28:38Z"}
{"advice_for_others": "dual_domain_bilateral_supervised-claude-agentic: proj_n_bf=1, img_n_bf=11, proj_kernel=3, proj_sx=0.01, proj_sy=0.3, proj_sr=0.0005, img_kernel=7, img_sx=0.5, img_sy=0.5, img_sr=0.02, epochs=10, batch_size=1, lr=0.01, optimizer=adam, lambda_neg=1.0, grad_clip=1.0, train_n=400, val_n=200, val_chunk=10, seed=42, rationale=iter-11 dual_domain_bilateral_supervised, re-split Breast-CT val=200. SIX-BOX vs BEST (iter-6 proj_n_bf=1/img_n_bf=7/img_kernel7/lr1e-2 hr=0.2555). (1) PRIOR: proj-domain depth gave NOTHING (iter-10 proj_n_bf=3=0.2555, identical) -> image-domain denoising dominates for breast sparse-view; reverted to proj_n_bf=1. Image BF depth was the biggest lever (1->3 +0.027) but tapered (3->7 +0.0035) UNDER the old 5x5/lr5e-3 regime. (2) Failure mode: the earlier depth taper was measured before the kernel(7) + lr(1e-2) improvements; deeper image stacks may now yield more with the better-conditioned per-filter setup. (3) ONE KNOB: img_n_bf 7 -> 11 (best config otherwise: img_kernel7/lr1e-2/lneg1.0/proj1). (4) HYPOTHESIS: 11 chained image BFs at the improved kernel/lr enlarge effective RF further and lift hr above 0.2555 toward ~0.26; if flat/down, image depth is truly saturated ~7-11 and iter-12 pivots to img_sx/img_sy (spatial sigma init) or a train_n/data lever. (5) BUDGET: 11 cheap 7x7 image BFs -> ~150s, inside 20 min. (6) Loop continues. Artifacts saved.", "agent": "dual_domain_bilateral_supervised-claude-agentic", "campaign": "search-20260703-01", "cfg_full": {"batch_size": 1, "epochs": 10, "grad_clip": 1.0, "img_kernel": 7, "img_n_bf": 11, "img_sr": 0.02, "img_sx": 0.5, "img_sy": 0.5, "lambda_neg": 1.0, "lr": 0.01, "optimizer": "adam", "proj_kernel": 3, "proj_n_bf": 1, "proj_sr": 0.0005, "proj_sx": 0.01, "proj_sy": 0.3, "rationale": "iter-11 dual_domain_bilateral_supervised, re-split Breast-CT val=200. SIX-BOX vs BEST (iter-6 proj_n_bf=1/img_n_bf=7/img_kernel7/lr1e-2 hr=0.2555). (1) PRIOR: proj-domain depth gave NOTHING (iter-10 proj_n_bf=3=0.2555, identical) -> image-domain denoising dominates for breast sparse-view; reverted to proj_n_bf=1. Image BF depth was the biggest lever (1->3 +0.027) but tapered (3->7 +0.0035) UNDER the old 5x5/lr5e-3 regime. (2) Failure mode: the earlier depth taper was measured before the kernel(7) + lr(1e-2) improvements; deeper image stacks may now yield more with the better-conditioned per-filter setup. (3) ONE KNOB: img_n_bf 7 -> 11 (best config otherwise: img_kernel7/lr1e-2/lneg1.0/proj1). (4) HYPOTHESIS: 11 chained image BFs at the improved kernel/lr enlarge effective RF further and lift hr above 0.2555 toward ~0.26; if flat/down, image depth is truly saturated ~7-11 and iter-12 pivots to img_sx/img_sy (spatial sigma init) or a train_n/data lever. (5) BUDGET: 11 cheap 7x7 image BFs -> ~150s, inside 20 min. (6) Loop continues. Artifacts saved.", "seed": 42, "train_n": 400, "val_chunk": 10, "val_n": 200}, "challenge": "breast_ct", "change_class": "architecture", "git_commit": "671da566", "images": {"comparison": "runs/breast-ct-claude-agentic-dual-domain-bilateral-supervised-search-20260703-01/iterations/iter-0011/comparison.png", "test_showcase": null, "valtest_showcase": null}, "iter": 11, "kept": true, "metrics": {"headroom": 0.25552768546872007, "headroom_std": 0.009514839130933973, "val_psnr": 38.887229919433594, "val_psnr_std": 0.5831404311705477, "val_rmse": 0.0038818898610770702, "val_rmse_std": 0.00025408363668415055, "val_ssim": 0.9834045767784119, "val_ssim_std": 0.0031130972618046717}, "model": "claude-opus-4-8-1m", "obs_path": "breast-ct-claude-agentic-dual-domain-bilateral-supervised-search-20260703-01/iterations/iter-0011/observation.json", "obs_sha1": "4c3779ffd487b63b265bddb3795c4c7f1c94b0a7", "params_M": 3.6e-05, "params_source": "observation", "rationale": "dual_domain_bilateral_supervised-claude-agentic: proj_n_bf=1, img_n_bf=11, proj_kernel=3, proj_sx=0.01, proj_sy=0.3, proj_sr=0.0005, img_kernel=7, img_sx=0.5, img_sy=0.5, img_sr=0.02, epochs=10, batch_size=1, lr=0.01, optimizer=adam, lambda_neg=1.0, grad_clip=1.0, train_n=400, val_n=200, val_chunk=10, seed=42, rationale=iter-11 dual_domain_bilateral_supervised, re-split Breast-CT val=200. SIX-BOX vs BEST (iter-6 proj_n_bf=1/img_n_bf=7/img_kernel7/lr1e-2 hr=0.2555). (1) PRIOR: proj-domain depth gave NOTHING (iter-10 proj_n_bf=3=0.2555, identical) -> image-domain denoising dominates for breast sparse-view; reverted to proj_n_bf=1. Image BF depth was the biggest lever (1->3 +0.027) but tapered (3->7 +0.0035) UNDER the old 5x5/lr5e-3 regime. (2) Failure mode: the earlier depth taper was measured before the kernel(7) + lr(1e-2) improvements; deeper image stacks may now yield more with the better-conditioned per-filter setup. (3) ONE KNOB: img_n_bf 7 -> 11 (best config otherwise: img_kernel7/lr1e-2/lneg1.0/proj1). (4) HYPOTHESIS: 11 chained image BFs at the improved kernel/lr enlarge effective RF further and lift hr above 0.2555 toward ~0.26; if flat/down, image depth is truly saturated ~7-11 and iter-12 pivots to img_sx/img_sy (spatial sigma init) or a train_n/data lever. (5) BUDGET: 11 cheap 7x7 image BFs -> ~150s, inside 20 min. (6) Loop continues. Artifacts saved.", "run_id": "breast-ct-claude-agentic-dual-domain-bilateral-supervised-search-20260703-01", "runtime": {"elapsed_s": 367.0329022407532}, "schema_version": 3, "solver_key": "dual-domain-bilateral-supervised", "solver_name": "DD-BF supervised L2", "split": {"train_n": 400, "val_n": 200}, "status": "keep", "ts": "2026-07-05T17:35:32Z"}
{"advice_for_others": "dual_domain_bilateral_supervised-claude-agentic: proj_n_bf=1, img_n_bf=7, proj_kernel=3, proj_sx=0.01, proj_sy=0.3, proj_sr=0.0005, img_kernel=7, img_sx=0.5, img_sy=0.5, img_sr=0.02, epochs=10, batch_size=1, lr=0.01, optimizer=adam, lambda_neg=1.0, grad_clip=1.0, train_n=800, val_n=200, val_chunk=10, seed=42, rationale=iter-12 dual_domain_bilateral_supervised, re-split Breast-CT val=200. SIX-BOX vs BEST (iter-6 train_n=400/img_n_bf7 hr=0.2555). (1) PRIOR: image BF depth SATURATED (iter-11 img_n_bf=11=0.2555, flat vs 7); proj depth null; kept img_n_bf=7 (same hr, fewer params). ALL architecture axes mapped -> best hr=0.2555. Every iter used only train_n=400 of the 3600-scene pool. (2) Failure mode: a ~24-param BF has almost no capacity to overfit, so more UNIQUE training scenes should mostly help (rarely hurt) generalization on val=200. (3) ONE KNOB: train_n 400 -> 800 (best config otherwise: img_n_bf7/img_kernel7/lr1e-2/lneg1.0/ep10). (4) HYPOTHESIS: doubling unique breast scenes gives the trainable sigmas a broader gradient signal and lifts hr above 0.2555 toward ~0.26; if flat, 400 scenes already saturate the tiny BF and iter-13 reverts to 400. (5) BUDGET: 2x train scenes at ep10 -> ~200s, well inside 20 min (train_n=800 <= 2400 cap). (6) Loop continues. Artifacts saved.", "agent": "dual_domain_bilateral_supervised-claude-agentic", "campaign": "search-20260703-01", "cfg_full": {"batch_size": 1, "epochs": 10, "grad_clip": 1.0, "img_kernel": 7, "img_n_bf": 7, "img_sr": 0.02, "img_sx": 0.5, "img_sy": 0.5, "lambda_neg": 1.0, "lr": 0.01, "optimizer": "adam", "proj_kernel": 3, "proj_n_bf": 1, "proj_sr": 0.0005, "proj_sx": 0.01, "proj_sy": 0.3, "rationale": "iter-12 dual_domain_bilateral_supervised, re-split Breast-CT val=200. SIX-BOX vs BEST (iter-6 train_n=400/img_n_bf7 hr=0.2555). (1) PRIOR: image BF depth SATURATED (iter-11 img_n_bf=11=0.2555, flat vs 7); proj depth null; kept img_n_bf=7 (same hr, fewer params). ALL architecture axes mapped -> best hr=0.2555. Every iter used only train_n=400 of the 3600-scene pool. (2) Failure mode: a ~24-param BF has almost no capacity to overfit, so more UNIQUE training scenes should mostly help (rarely hurt) generalization on val=200. (3) ONE KNOB: train_n 400 -> 800 (best config otherwise: img_n_bf7/img_kernel7/lr1e-2/lneg1.0/ep10). (4) HYPOTHESIS: doubling unique breast scenes gives the trainable sigmas a broader gradient signal and lifts hr above 0.2555 toward ~0.26; if flat, 400 scenes already saturate the tiny BF and iter-13 reverts to 400. (5) BUDGET: 2x train scenes at ep10 -> ~200s, well inside 20 min (train_n=800 <= 2400 cap). (6) Loop continues. Artifacts saved.", "seed": 42, "train_n": 800, "val_chunk": 10, "val_n": 200}, "challenge": "breast_ct", "change_class": "architecture", "git_commit": "671da566", "images": {"comparison": "runs/breast-ct-claude-agentic-dual-domain-bilateral-supervised-search-20260703-01/iterations/iter-0012/comparison.png", "test_showcase": null, "valtest_showcase": null}, "iter": 12, "kept": true, "metrics": {"headroom": 0.25607923277055444, "headroom_std": 0.009700653007506997, "val_psnr": 38.8936653137207, "val_psnr_std": 0.5791469252542624, "val_rmse": 0.0038790139369666576, "val_rmse_std": 0.0002520690407317889, "val_ssim": 0.9836856722831726, "val_ssim_std": 0.0030529238053224705}, "model": "claude-opus-4-8-1m", "obs_path": "breast-ct-claude-agentic-dual-domain-bilateral-supervised-search-20260703-01/iterations/iter-0012/observation.json", "obs_sha1": "9335ab2e730e1a36b7bddae2879f56a5313df6b4", "params_M": 2.4e-05, "params_source": "observation", "rationale": "dual_domain_bilateral_supervised-claude-agentic: proj_n_bf=1, img_n_bf=7, proj_kernel=3, proj_sx=0.01, proj_sy=0.3, proj_sr=0.0005, img_kernel=7, img_sx=0.5, img_sy=0.5, img_sr=0.02, epochs=10, batch_size=1, lr=0.01, optimizer=adam, lambda_neg=1.0, grad_clip=1.0, train_n=800, val_n=200, val_chunk=10, seed=42, rationale=iter-12 dual_domain_bilateral_supervised, re-split Breast-CT val=200. SIX-BOX vs BEST (iter-6 train_n=400/img_n_bf7 hr=0.2555). (1) PRIOR: image BF depth SATURATED (iter-11 img_n_bf=11=0.2555, flat vs 7); proj depth null; kept img_n_bf=7 (same hr, fewer params). ALL architecture axes mapped -> best hr=0.2555. Every iter used only train_n=400 of the 3600-scene pool. (2) Failure mode: a ~24-param BF has almost no capacity to overfit, so more UNIQUE training scenes should mostly help (rarely hurt) generalization on val=200. (3) ONE KNOB: train_n 400 -> 800 (best config otherwise: img_n_bf7/img_kernel7/lr1e-2/lneg1.0/ep10). (4) HYPOTHESIS: doubling unique breast scenes gives the trainable sigmas a broader gradient signal and lifts hr above 0.2555 toward ~0.26; if flat, 400 scenes already saturate the tiny BF and iter-13 reverts to 400. (5) BUDGET: 2x train scenes at ep10 -> ~200s, well inside 20 min (train_n=800 <= 2400 cap). (6) Loop continues. Artifacts saved.", "run_id": "breast-ct-claude-agentic-dual-domain-bilateral-supervised-search-20260703-01", "runtime": {"elapsed_s": 718.9673910140991}, "schema_version": 3, "solver_key": "dual-domain-bilateral-supervised", "solver_name": "DD-BF supervised L2", "split": {"train_n": 400, "val_n": 200}, "status": "keep", "ts": "2026-07-05T17:48:33Z"}
