{"advice_for_others": "itnet-claude-agentic: pretrain_epochs=120, pretrain_lr=0.001, itnet_k=1, itnet_alpha=0.05, unet_c=16, finetune_epochs=0, finetune_lr=0.0001, train_n=400, val_n=200, grad_clip=1.0, seed=42, rationale=iter-4 REDO (breast ItNet v1, search-20260703-01). Prior iter-4 (unet_c 16->32, ep120) was CANCELLED DUE TO TIME LIMIT (c16/ep120 was already 1190s ~ the 1200s budget; 4x denoiser conv cost overran the 30-min wall). SIX-BOX: (1) PRIOR NUMBERS: iter-1 (k5,c16,ep20) hr 0.0000; iter-2 (k5,c16,ep120) hr 0.0000 ssim 0.7114; iter-3 (k1,c16,ep120) hr 0.8199 ssim 0.9815 PSNR 51.21 elapsed 1190s KEPT (best). (2) FAILURE MODE: budget overrun on the width lever; also note the DC step at k=1/alpha=0.1 may still slightly over-correct on 128-view sparse breast (each DC step FBPs a sparse-view residual = mild streak). (3) ONE KNOB (COMPUTE-FREE, guaranteed in-budget): itnet_alpha 0.1 -> 0.05. Same k=1, ep=120, c=16, train_n=400, val_n=200 as the KEPT iter-3 -> identical ~1190s train/score cost, no overrun risk. (4) HYPOTHESIS: if I halve the single DC-step strength, I expect hr to edge above 0.8199 because the fixed (untrained) DC step re-injects a mild sparse-view streak that slightly corrupts the clean denoiser output; a gentler step preserves more denoiser quality. FALSIFIER: if hr is flat/lower, the k=1 DC step is already near-optimal or mildly helpful and alpha is not the lever -> the denoiser (width/data) is the true ceiling, to be probed in iter-5 with a BUDGET-SAFE capacity move (c=24 with epochs cut to fit). (5) BUDGET: byte-for-byte the iter-3 cost profile (only a float alpha changed) = ~1190s < 1200s, safely inside the 30-min wall. (6) Loop continues; iter-5 dispatched on landing. Artifacts: AGENT4CT_MODEL_CKPT set -> model_ckpt.pt persists.", "agent": "itnet-claude-agentic", "campaign": "search-20260703-01", "cfg_full": {"finetune_epochs": 0, "finetune_lr": 0.0001, "grad_clip": 1.0, "itnet_alpha": 0.05, "itnet_k": 1, "pretrain_epochs": 120, "pretrain_lr": 0.001, "rationale": "iter-4 REDO (breast ItNet v1, search-20260703-01). Prior iter-4 (unet_c 16->32, ep120) was CANCELLED DUE TO TIME LIMIT (c16/ep120 was already 1190s ~ the 1200s budget; 4x denoiser conv cost overran the 30-min wall). SIX-BOX: (1) PRIOR NUMBERS: iter-1 (k5,c16,ep20) hr 0.0000; iter-2 (k5,c16,ep120) hr 0.0000 ssim 0.7114; iter-3 (k1,c16,ep120) hr 0.8199 ssim 0.9815 PSNR 51.21 elapsed 1190s KEPT (best). (2) FAILURE MODE: budget overrun on the width lever; also note the DC step at k=1/alpha=0.1 may still slightly over-correct on 128-view sparse breast (each DC step FBPs a sparse-view residual = mild streak). (3) ONE KNOB (COMPUTE-FREE, guaranteed in-budget): itnet_alpha 0.1 -> 0.05. Same k=1, ep=120, c=16, train_n=400, val_n=200 as the KEPT iter-3 -> identical ~1190s train/score cost, no overrun risk. (4) HYPOTHESIS: if I halve the single DC-step strength, I expect hr to edge above 0.8199 because the fixed (untrained) DC step re-injects a mild sparse-view streak that slightly corrupts the clean denoiser output; a gentler step preserves more denoiser quality. FALSIFIER: if hr is flat/lower, the k=1 DC step is already near-optimal or mildly helpful and alpha is not the lever -> the denoiser (width/data) is the true ceiling, to be probed in iter-5 with a BUDGET-SAFE capacity move (c=24 with epochs cut to fit). (5) BUDGET: byte-for-byte the iter-3 cost profile (only a float alpha changed) = ~1190s < 1200s, safely inside the 30-min wall. (6) Loop continues; iter-5 dispatched on landing. Artifacts: AGENT4CT_MODEL_CKPT set -> model_ckpt.pt persists.", "seed": 42, "train_n": 400, "unet_c": 16, "val_n": 200}, "challenge": "breast_ct", "change_class": "architecture", "git_commit": null, "images": {"comparison": "runs/breast-ct-claude-agentic-itnet-search-20260703-01/iterations/iter-0004/comparison.png", "test_showcase": null, "valtest_showcase": null}, "iter": 4, "kept": true, "metrics": {"headroom": 0.8666141918522854, "headroom_std": null, "val_psnr": 53.821998596191406, "val_psnr_std": null, "val_rmse": 0.0006955117569305003, "val_rmse_std": null, "val_ssim": 0.9966080188751221, "val_ssim_std": null}, "model": "claude-opus-4-8-1m", "obs_path": "breast-ct-claude-agentic-itnet-search-20260703-01/iterations/iter-0004/observation.json", "obs_sha1": "9e032e9ab49720858dfa68b6f8b6831c9036e54b", "params_M": 0.232881, "params_source": "observation", "rationale": "itnet-claude-agentic: pretrain_epochs=120, pretrain_lr=0.001, itnet_k=1, itnet_alpha=0.05, unet_c=16, finetune_epochs=0, finetune_lr=0.0001, train_n=400, val_n=200, grad_clip=1.0, seed=42, rationale=iter-4 REDO (breast ItNet v1, search-20260703-01). Prior iter-4 (unet_c 16->32, ep120) was CANCELLED DUE TO TIME LIMIT (c16/ep120 was already 1190s ~ the 1200s budget; 4x denoiser conv cost overran the 30-min wall). SIX-BOX: (1) PRIOR NUMBERS: iter-1 (k5,c16,ep20) hr 0.0000; iter-2 (k5,c16,ep120) hr 0.0000 ssim 0.7114; iter-3 (k1,c16,ep120) hr 0.8199 ssim 0.9815 PSNR 51.21 elapsed 1190s KEPT (best). (2) FAILURE MODE: budget overrun on the width lever; also note the DC step at k=1/alpha=0.1 may still slightly over-correct on 128-view sparse breast (each DC step FBPs a sparse-view residual = mild streak). (3) ONE KNOB (COMPUTE-FREE, guaranteed in-budget): itnet_alpha 0.1 -> 0.05. Same k=1, ep=120, c=16, train_n=400, val_n=200 as the KEPT iter-3 -> identical ~1190s train/score cost, no overrun risk. (4) HYPOTHESIS: if I halve the single DC-step strength, I expect hr to edge above 0.8199 because the fixed (untrained) DC step re-injects a mild sparse-view streak that slightly corrupts the clean denoiser output; a gentler step preserves more denoiser quality. FALSIFIER: if hr is flat/lower, the k=1 DC step is already near-optimal or mildly helpful and alpha is not the lever -> the denoiser (width/data) is the true ceiling, to be probed in iter-5 with a BUDGET-SAFE capacity move (c=24 with epochs cut to fit). (5) BUDGET: byte-for-byte the iter-3 cost profile (only a float alpha changed) = ~1190s < 1200s, safely inside the 30-min wall. (6) Loop continues; iter-5 dispatched on landing. Artifacts: AGENT4CT_MODEL_CKPT set -> model_ckpt.pt persists.", "run_id": "breast-ct-claude-agentic-itnet-search-20260703-01", "runtime": {"elapsed_s": 1185.8112244606018}, "schema_version": 3, "solver_key": "itnet", "solver_name": "ITNet v1", "split": {"train_n": 400, "val_n": 200}, "status": "keep", "ts": "2026-07-03T21:30:24Z"}
{"advice_for_others": "itnet-claude-agentic: pretrain_epochs=120, pretrain_lr=0.001, itnet_k=1, itnet_alpha=0.0, unet_c=16, finetune_epochs=0, finetune_lr=0.0001, train_n=400, val_n=200, grad_clip=1.0, seed=42, rationale=iter-5 (breast ItNet v1). SIX-BOX: (1) PRIOR: iter-3 (k1,alpha0.1) hr 0.8199; iter-4 (k1,alpha0.05) hr 0.8666 (+0.047 from HALVING alpha). Clear monotone: LESS DC step = HIGHER hr. (2) FAILURE MODE: the fixed untrained DC step (x <- x_denoised - alpha*FBP(R*x_denoised - g)) re-injects sparse-view streaks; every alpha reduction has helped -> the DC step is NET-HARMFUL on 128-view breast. (3) ONE KNOB: itnet_alpha 0.05 -> 0.0 (all else = iter-4). At alpha=0 the DC step contributes exactly zero, so recon == pure pretrained-denoiser output -> this is the DECISIVE test of the DC step net effect. (4) HYPOTHESIS: if I zero the DC step, hr rises above 0.8666 because the fixed DC step has only hurt so far; the pure denoiser is the ceiling for this pretrain-then-fixed-DC architecture. FALSIFIER: if hr drops vs iter-4, a small DC step IS mildly helpful and the optimum alpha is ~0.05 (interior) -> future iters tune the DENOISER (data/width/epochs), not alpha. (5) BUDGET: compute-free change (float), ~1190s = in budget. (6) Loop continues to iter-20.", "agent": "itnet-claude-agentic", "campaign": "search-20260703-01", "cfg_full": {"finetune_epochs": 0, "finetune_lr": 0.0001, "grad_clip": 1.0, "itnet_alpha": 0.0, "itnet_k": 1, "pretrain_epochs": 120, "pretrain_lr": 0.001, "rationale": "iter-5 (breast ItNet v1). SIX-BOX: (1) PRIOR: iter-3 (k1,alpha0.1) hr 0.8199; iter-4 (k1,alpha0.05) hr 0.8666 (+0.047 from HALVING alpha). Clear monotone: LESS DC step = HIGHER hr. (2) FAILURE MODE: the fixed untrained DC step (x <- x_denoised - alpha*FBP(R*x_denoised - g)) re-injects sparse-view streaks; every alpha reduction has helped -> the DC step is NET-HARMFUL on 128-view breast. (3) ONE KNOB: itnet_alpha 0.05 -> 0.0 (all else = iter-4). At alpha=0 the DC step contributes exactly zero, so recon == pure pretrained-denoiser output -> this is the DECISIVE test of the DC step net effect. (4) HYPOTHESIS: if I zero the DC step, hr rises above 0.8666 because the fixed DC step has only hurt so far; the pure denoiser is the ceiling for this pretrain-then-fixed-DC architecture. FALSIFIER: if hr drops vs iter-4, a small DC step IS mildly helpful and the optimum alpha is ~0.05 (interior) -> future iters tune the DENOISER (data/width/epochs), not alpha. (5) BUDGET: compute-free change (float), ~1190s = in budget. (6) Loop continues to iter-20.", "seed": 42, "train_n": 400, "unet_c": 16, "val_n": 200}, "challenge": "breast_ct", "change_class": "architecture", "git_commit": null, "images": {"comparison": "runs/breast-ct-claude-agentic-itnet-search-20260703-01/iterations/iter-0005/comparison.png", "test_showcase": null, "valtest_showcase": null}, "iter": 5, "kept": true, "metrics": {"headroom": 0.8741783726039719, "headroom_std": 0.01714115050312542, "val_psnr": 54.32908630371094, "val_psnr_std": 1.8008622330087076, "val_rmse": 0.0006560699548572302, "val_rmse_std": 0.00012830007853281052, "val_ssim": 0.9988352656364441, "val_ssim_std": 0.00044534172731426456}, "model": "claude-opus-4-8-1m", "obs_path": "breast-ct-claude-agentic-itnet-search-20260703-01/iterations/iter-0005/observation.json", "obs_sha1": "1595ceb1c0e96e24e30ca1f4f2bfcefad80214e5", "params_M": 0.232881, "params_source": "observation", "rationale": "itnet-claude-agentic: pretrain_epochs=120, pretrain_lr=0.001, itnet_k=1, itnet_alpha=0.0, unet_c=16, finetune_epochs=0, finetune_lr=0.0001, train_n=400, val_n=200, grad_clip=1.0, seed=42, rationale=iter-5 (breast ItNet v1). SIX-BOX: (1) PRIOR: iter-3 (k1,alpha0.1) hr 0.8199; iter-4 (k1,alpha0.05) hr 0.8666 (+0.047 from HALVING alpha). Clear monotone: LESS DC step = HIGHER hr. (2) FAILURE MODE: the fixed untrained DC step (x <- x_denoised - alpha*FBP(R*x_denoised - g)) re-injects sparse-view streaks; every alpha reduction has helped -> the DC step is NET-HARMFUL on 128-view breast. (3) ONE KNOB: itnet_alpha 0.05 -> 0.0 (all else = iter-4). At alpha=0 the DC step contributes exactly zero, so recon == pure pretrained-denoiser output -> this is the DECISIVE test of the DC step net effect. (4) HYPOTHESIS: if I zero the DC step, hr rises above 0.8666 because the fixed DC step has only hurt so far; the pure denoiser is the ceiling for this pretrain-then-fixed-DC architecture. FALSIFIER: if hr drops vs iter-4, a small DC step IS mildly helpful and the optimum alpha is ~0.05 (interior) -> future iters tune the DENOISER (data/width/epochs), not alpha. (5) BUDGET: compute-free change (float), ~1190s = in budget. (6) Loop continues to iter-20.", "run_id": "breast-ct-claude-agentic-itnet-search-20260703-01", "runtime": {"elapsed_s": 1189.1753146648407}, "schema_version": 3, "solver_key": "itnet", "solver_name": "ITNet v1", "split": {"train_n": 400, "val_n": 200}, "status": "keep", "ts": "2026-07-03T22:48:24Z"}
{"advice_for_others": "itnet-claude-agentic: pretrain_epochs=120, pretrain_lr=0.0003, itnet_k=1, itnet_alpha=0.0, unet_c=16, finetune_epochs=0, finetune_lr=0.0001, train_n=400, val_n=200, grad_clip=1.0, seed=42, rationale=iter-6 (breast ItNet v1). SIX-BOX: (1) PRIOR: iter-3 (a0.1) 0.8199; iter-4 (a0.05) 0.8666; iter-5 (a0.0) 0.8741 BEST. alpha monotone down = hr up -> the fixed DC step is NET-HARMFUL; at alpha=0 recon == pure pretrained SmallUNet denoiser. DC lever EXHAUSTED (last step only +0.0076). (2) FAILURE MODE: none active (above baseline); the remaining ceiling is DENOISER quality (recon is now purely its output). Levers: pretrain_lr, pretrain_epochs, unet_c, train_n. (3) ONE KNOB (compute-free): pretrain_lr 1e-3 -> 3e-4. All else = iter-5 (k1, a0.0, c16, ep120, train_n400, val_n200). (4) HYPOTHESIS: if I lower the denoiser LR ~3x, I expect hr above 0.8741 because at ep120 lr=1e-3 the Adam denoiser likely oscillates near the optimum on 400 scenes; a gentler lr converges to a lower-loss (higher-SSIM/lower-RMSE) denoiser. FALSIFIER: if hr drops, 1e-3 was already well-tuned and lr is not the lever -> iter-7 tries a capacity/data denoiser move (unet_c or train_n with a compensating epoch cut). (5) BUDGET: float change only, ~1189s, in budget (+turbo qos). (6) Loop to iter-20.", "agent": "itnet-claude-agentic", "campaign": "search-20260703-01", "cfg_full": {"finetune_epochs": 0, "finetune_lr": 0.0001, "grad_clip": 1.0, "itnet_alpha": 0.0, "itnet_k": 1, "pretrain_epochs": 120, "pretrain_lr": 0.0003, "rationale": "iter-6 (breast ItNet v1). SIX-BOX: (1) PRIOR: iter-3 (a0.1) 0.8199; iter-4 (a0.05) 0.8666; iter-5 (a0.0) 0.8741 BEST. alpha monotone down = hr up -> the fixed DC step is NET-HARMFUL; at alpha=0 recon == pure pretrained SmallUNet denoiser. DC lever EXHAUSTED (last step only +0.0076). (2) FAILURE MODE: none active (above baseline); the remaining ceiling is DENOISER quality (recon is now purely its output). Levers: pretrain_lr, pretrain_epochs, unet_c, train_n. (3) ONE KNOB (compute-free): pretrain_lr 1e-3 -> 3e-4. All else = iter-5 (k1, a0.0, c16, ep120, train_n400, val_n200). (4) HYPOTHESIS: if I lower the denoiser LR ~3x, I expect hr above 0.8741 because at ep120 lr=1e-3 the Adam denoiser likely oscillates near the optimum on 400 scenes; a gentler lr converges to a lower-loss (higher-SSIM/lower-RMSE) denoiser. FALSIFIER: if hr drops, 1e-3 was already well-tuned and lr is not the lever -> iter-7 tries a capacity/data denoiser move (unet_c or train_n with a compensating epoch cut). (5) BUDGET: float change only, ~1189s, in budget (+turbo qos). (6) Loop to iter-20.", "seed": 42, "train_n": 400, "unet_c": 16, "val_n": 200}, "challenge": "breast_ct", "change_class": "architecture", "git_commit": null, "images": {"comparison": "runs/breast-ct-claude-agentic-itnet-search-20260703-01/iterations/iter-0006/comparison.png", "test_showcase": null, "valtest_showcase": null}, "iter": 6, "kept": true, "metrics": {"headroom": 0.8698548768601541, "headroom_std": 0.016549282247414192, "val_psnr": 54.03563690185547, "val_psnr_std": 1.7262245317395646, "val_rmse": 0.0006786138983443379, "val_rmse_std": 0.00012602493828101622, "val_ssim": 0.9987475275993347, "val_ssim_std": 0.00045407515711134826}, "model": "claude-opus-4-8-1m", "obs_path": "breast-ct-claude-agentic-itnet-search-20260703-01/iterations/iter-0006/observation.json", "obs_sha1": "0ff880e9b485e77de8c01e6df9bdf33795144560", "params_M": 0.232881, "params_source": "observation", "rationale": "itnet-claude-agentic: pretrain_epochs=120, pretrain_lr=0.0003, itnet_k=1, itnet_alpha=0.0, unet_c=16, finetune_epochs=0, finetune_lr=0.0001, train_n=400, val_n=200, grad_clip=1.0, seed=42, rationale=iter-6 (breast ItNet v1). SIX-BOX: (1) PRIOR: iter-3 (a0.1) 0.8199; iter-4 (a0.05) 0.8666; iter-5 (a0.0) 0.8741 BEST. alpha monotone down = hr up -> the fixed DC step is NET-HARMFUL; at alpha=0 recon == pure pretrained SmallUNet denoiser. DC lever EXHAUSTED (last step only +0.0076). (2) FAILURE MODE: none active (above baseline); the remaining ceiling is DENOISER quality (recon is now purely its output). Levers: pretrain_lr, pretrain_epochs, unet_c, train_n. (3) ONE KNOB (compute-free): pretrain_lr 1e-3 -> 3e-4. All else = iter-5 (k1, a0.0, c16, ep120, train_n400, val_n200). (4) HYPOTHESIS: if I lower the denoiser LR ~3x, I expect hr above 0.8741 because at ep120 lr=1e-3 the Adam denoiser likely oscillates near the optimum on 400 scenes; a gentler lr converges to a lower-loss (higher-SSIM/lower-RMSE) denoiser. FALSIFIER: if hr drops, 1e-3 was already well-tuned and lr is not the lever -> iter-7 tries a capacity/data denoiser move (unet_c or train_n with a compensating epoch cut). (5) BUDGET: float change only, ~1189s, in budget (+turbo qos). (6) Loop to iter-20.", "run_id": "breast-ct-claude-agentic-itnet-search-20260703-01", "runtime": {"elapsed_s": 1191.9449877738953}, "schema_version": 3, "solver_key": "itnet", "solver_name": "ITNet v1", "split": {"train_n": 400, "val_n": 200}, "status": "keep", "ts": "2026-07-03T23:46:16Z"}
