{"advice_for_others": "dual_domain_supervised-claude-agentic: unet_c=16, epochs=44, batch_size=1, lr=0.001, optimizer=adam, lambda_neg=1.0, grad_clip=1.0, train_n=400, val_n=200, val_chunk=10, seed=42, rationale=iter-6 dual_domain_supervised, re-split Breast-CT val=200. SIX-BOX vs BEST (iter-5 c16/ep44/lr5e-4 hr=0.8798): (1) PRIOR: epochs is the monotone lever (ep10=0.8095,ep20=0.8372,ep32=0.8612,ep44=0.8798 at c=16); c=32 REGRESSED (0.8243). iter-5 used 1108s (~18.5 min) so simply adding epochs would breach the 20-min budget. (2) Failure mode: the still-rising hr-vs-epochs curve indicates the Adam optimizer has NOT converged within the epoch budget -- an optimization-SPEED limit (not capacity: c=32 hurt). Need more loss-descent per epoch at fixed wall time. (3) ONE KNOB: lr 5e-4 -> 1e-3 (c=16, epochs=44, lambda_neg=1.0, grad_clip=1.0 all held at iter-5 winning values). (4) HYPOTHESIS: doubling lr to 1e-3 reaches a lower L2 minimum within the same 44 epochs (faster descent on the not-yet-converged curve) -> hr above 0.8798; grad_clip=1.0 + nonfinite-skip guard instability. Expect ~0.88-0.89. If hr DROPS (lr too high/unstable), revert lr and pivot iter-7 to train_n 400->800. (5) BUDGET: same ep=44 -> ~1108s, inside the HARD 20-min budget (30-min sbatch wall). (6) Loop continues to iter-20 target. Artifacts recon_raw.npz + model_ckpt.pt saved to this iter dir.", "agent": "dual_domain_supervised-claude-agentic", "campaign": "search-20260703-01", "cfg_full": {"batch_size": 1, "epochs": 44, "grad_clip": 1.0, "lambda_neg": 1.0, "lr": 0.001, "optimizer": "adam", "rationale": "iter-6 dual_domain_supervised, re-split Breast-CT val=200. SIX-BOX vs BEST (iter-5 c16/ep44/lr5e-4 hr=0.8798): (1) PRIOR: epochs is the monotone lever (ep10=0.8095,ep20=0.8372,ep32=0.8612,ep44=0.8798 at c=16); c=32 REGRESSED (0.8243). iter-5 used 1108s (~18.5 min) so simply adding epochs would breach the 20-min budget. (2) Failure mode: the still-rising hr-vs-epochs curve indicates the Adam optimizer has NOT converged within the epoch budget -- an optimization-SPEED limit (not capacity: c=32 hurt). Need more loss-descent per epoch at fixed wall time. (3) ONE KNOB: lr 5e-4 -> 1e-3 (c=16, epochs=44, lambda_neg=1.0, grad_clip=1.0 all held at iter-5 winning values). (4) HYPOTHESIS: doubling lr to 1e-3 reaches a lower L2 minimum within the same 44 epochs (faster descent on the not-yet-converged curve) -> hr above 0.8798; grad_clip=1.0 + nonfinite-skip guard instability. Expect ~0.88-0.89. If hr DROPS (lr too high/unstable), revert lr and pivot iter-7 to train_n 400->800. (5) BUDGET: same ep=44 -> ~1108s, inside the HARD 20-min budget (30-min sbatch wall). (6) Loop continues to iter-20 target. Artifacts recon_raw.npz + model_ckpt.pt saved to this iter dir.", "seed": 42, "train_n": 400, "unet_c": 16, "val_chunk": 10, "val_n": 200}, "challenge": "breast_ct", "change_class": "architecture", "git_commit": null, "images": {"comparison": "runs/breast-ct-claude-agentic-dual-domain-supervised-search-20260703-01/iterations/iter-0006/comparison.png", "test_showcase": null, "valtest_showcase": null}, "iter": 6, "kept": true, "metrics": {"headroom": 0.8843286557808758, "headroom_std": 0.012142847258220365, "val_psnr": 55.0596809387207, "val_psnr_std": 1.484927300304722, "val_rmse": 0.0006031434750184417, "val_rmse_std": 9.910845936061315e-05, "val_ssim": 0.999077558517456, "val_ssim_std": 0.00031628516860586145}, "model": "claude-opus-4-8-1m", "obs_path": "breast-ct-claude-agentic-dual-domain-supervised-search-20260703-01/iterations/iter-0006/observation.json", "obs_sha1": "a45bd3d61f4c054da9f4425908842cd93484a97a", "params_M": 0.465762, "params_source": "observation", "rationale": "dual_domain_supervised-claude-agentic: unet_c=16, epochs=44, batch_size=1, lr=0.001, optimizer=adam, lambda_neg=1.0, grad_clip=1.0, train_n=400, val_n=200, val_chunk=10, seed=42, rationale=iter-6 dual_domain_supervised, re-split Breast-CT val=200. SIX-BOX vs BEST (iter-5 c16/ep44/lr5e-4 hr=0.8798): (1) PRIOR: epochs is the monotone lever (ep10=0.8095,ep20=0.8372,ep32=0.8612,ep44=0.8798 at c=16); c=32 REGRESSED (0.8243). iter-5 used 1108s (~18.5 min) so simply adding epochs would breach the 20-min budget. (2) Failure mode: the still-rising hr-vs-epochs curve indicates the Adam optimizer has NOT converged within the epoch budget -- an optimization-SPEED limit (not capacity: c=32 hurt). Need more loss-descent per epoch at fixed wall time. (3) ONE KNOB: lr 5e-4 -> 1e-3 (c=16, epochs=44, lambda_neg=1.0, grad_clip=1.0 all held at iter-5 winning values). (4) HYPOTHESIS: doubling lr to 1e-3 reaches a lower L2 minimum within the same 44 epochs (faster descent on the not-yet-converged curve) -> hr above 0.8798; grad_clip=1.0 + nonfinite-skip guard instability. Expect ~0.88-0.89. If hr DROPS (lr too high/unstable), revert lr and pivot iter-7 to train_n 400->800. (5) BUDGET: same ep=44 -> ~1108s, inside the HARD 20-min budget (30-min sbatch wall). (6) Loop continues to iter-20 target. Artifacts recon_raw.npz + model_ckpt.pt saved to this iter dir.", "run_id": "breast-ct-claude-agentic-dual-domain-supervised-search-20260703-01", "runtime": {"elapsed_s": 1022.5793981552124}, "schema_version": 3, "solver_key": "dual-domain-supervised", "solver_name": "DD-UNet supervised L2", "split": {"train_n": 400, "val_n": 200}, "status": "keep", "ts": "2026-07-03T22:28:34Z"}
{"advice_for_others": "dual_domain_supervised-claude-agentic: unet_c=16, epochs=44, batch_size=1, lr=0.001, optimizer=adam, lambda_neg=0.1, grad_clip=1.0, train_n=400, val_n=200, val_chunk=10, seed=42, rationale=iter-7 dual_domain_supervised, re-split Breast-CT val=200. SIX-BOX vs BEST (iter-6 c16/ep44/lr1e-3/lambda_neg1.0 hr=0.8843): (1) PRIOR: epochs lever tapering (ep32->44 +0.0186, lr5e-4->1e-3 +0.0045 -- diminishing); c=32 REGRESSED. iter-6 elapsed 1023s (~17 min, room but data-scaling at fixed epochs would breach 20-min). (2) Failure mode: hr gains flattening toward ~0.88 with epochs+lr near-tapped; a still-UNTESTED axis is the LOSS weighting -- lambda_neg=1.0 may over-suppress low-mu breast regions. (3) ONE KNOB: lambda_neg 1.0 -> 0.1 (c=16, epochs=44, lr=1e-3 all held at iter-6 winning values). Budget-neutral (same compute). (4) HYPOTHESIS: lowering the negativity-penalty weight to 0.1 lets the supervised L2 term dominate and fit true breast attenuation more faithfully -> hr above 0.8843; a cross-dataset Mayo hint flagged lambda_neg~0.1 as favorable. Expect ~0.885-0.89. If hr DROPS, the penalty was load-bearing -> revert to 1.0 and iter-8 pivots to an architecture knob (sino-branch depth). (5) BUDGET: same ep=44 -> ~1023s, inside the HARD 20-min budget (30-min wall). (6) Loop continues to iter-20. Artifacts saved to this iter dir.", "agent": "dual_domain_supervised-claude-agentic", "campaign": "search-20260703-01", "cfg_full": {"batch_size": 1, "epochs": 44, "grad_clip": 1.0, "lambda_neg": 0.1, "lr": 0.001, "optimizer": "adam", "rationale": "iter-7 dual_domain_supervised, re-split Breast-CT val=200. SIX-BOX vs BEST (iter-6 c16/ep44/lr1e-3/lambda_neg1.0 hr=0.8843): (1) PRIOR: epochs lever tapering (ep32->44 +0.0186, lr5e-4->1e-3 +0.0045 -- diminishing); c=32 REGRESSED. iter-6 elapsed 1023s (~17 min, room but data-scaling at fixed epochs would breach 20-min). (2) Failure mode: hr gains flattening toward ~0.88 with epochs+lr near-tapped; a still-UNTESTED axis is the LOSS weighting -- lambda_neg=1.0 may over-suppress low-mu breast regions. (3) ONE KNOB: lambda_neg 1.0 -> 0.1 (c=16, epochs=44, lr=1e-3 all held at iter-6 winning values). Budget-neutral (same compute). (4) HYPOTHESIS: lowering the negativity-penalty weight to 0.1 lets the supervised L2 term dominate and fit true breast attenuation more faithfully -> hr above 0.8843; a cross-dataset Mayo hint flagged lambda_neg~0.1 as favorable. Expect ~0.885-0.89. If hr DROPS, the penalty was load-bearing -> revert to 1.0 and iter-8 pivots to an architecture knob (sino-branch depth). (5) BUDGET: same ep=44 -> ~1023s, inside the HARD 20-min budget (30-min wall). (6) Loop continues to iter-20. Artifacts saved to this iter dir.", "seed": 42, "train_n": 400, "unet_c": 16, "val_chunk": 10, "val_n": 200}, "challenge": "breast_ct", "change_class": "architecture", "git_commit": null, "images": {"comparison": "runs/breast-ct-claude-agentic-dual-domain-supervised-search-20260703-01/iterations/iter-0007/comparison.png", "test_showcase": null, "valtest_showcase": null}, "iter": 7, "kept": true, "metrics": {"headroom": 0.8869194243870603, "headroom_std": 0.0101460382358516, "val_psnr": 55.256431579589844, "val_psnr_std": 1.291101152286534, "val_rmse": 0.0005896344664506614, "val_rmse_std": 8.549853729904078e-05, "val_ssim": 0.9990624785423279, "val_ssim_std": 0.00027696233181181854}, "model": "claude-opus-4-8-1m", "obs_path": "breast-ct-claude-agentic-dual-domain-supervised-search-20260703-01/iterations/iter-0007/observation.json", "obs_sha1": "7d58b370410440ab1038f95516a50c7a73325a50", "params_M": 0.465762, "params_source": "observation", "rationale": "dual_domain_supervised-claude-agentic: unet_c=16, epochs=44, batch_size=1, lr=0.001, optimizer=adam, lambda_neg=0.1, grad_clip=1.0, train_n=400, val_n=200, val_chunk=10, seed=42, rationale=iter-7 dual_domain_supervised, re-split Breast-CT val=200. SIX-BOX vs BEST (iter-6 c16/ep44/lr1e-3/lambda_neg1.0 hr=0.8843): (1) PRIOR: epochs lever tapering (ep32->44 +0.0186, lr5e-4->1e-3 +0.0045 -- diminishing); c=32 REGRESSED. iter-6 elapsed 1023s (~17 min, room but data-scaling at fixed epochs would breach 20-min). (2) Failure mode: hr gains flattening toward ~0.88 with epochs+lr near-tapped; a still-UNTESTED axis is the LOSS weighting -- lambda_neg=1.0 may over-suppress low-mu breast regions. (3) ONE KNOB: lambda_neg 1.0 -> 0.1 (c=16, epochs=44, lr=1e-3 all held at iter-6 winning values). Budget-neutral (same compute). (4) HYPOTHESIS: lowering the negativity-penalty weight to 0.1 lets the supervised L2 term dominate and fit true breast attenuation more faithfully -> hr above 0.8843; a cross-dataset Mayo hint flagged lambda_neg~0.1 as favorable. Expect ~0.885-0.89. If hr DROPS, the penalty was load-bearing -> revert to 1.0 and iter-8 pivots to an architecture knob (sino-branch depth). (5) BUDGET: same ep=44 -> ~1023s, inside the HARD 20-min budget (30-min wall). (6) Loop continues to iter-20. Artifacts saved to this iter dir.", "run_id": "breast-ct-claude-agentic-dual-domain-supervised-search-20260703-01", "runtime": {"elapsed_s": 1029.9158039093018}, "schema_version": 3, "solver_key": "dual-domain-supervised", "solver_name": "DD-UNet supervised L2", "split": {"train_n": 400, "val_n": 200}, "status": "keep", "ts": "2026-07-03T23:43:58Z"}
{"advice_for_others": "dual_domain_supervised-claude-agentic: unet_c=16, epochs=44, batch_size=1, lr=0.001, optimizer=adam, lambda_neg=0.03, grad_clip=1.0, train_n=400, val_n=200, val_chunk=10, seed=42, rationale=iter-8 dual_domain_supervised, re-split Breast-CT val=200. SIX-BOX vs BEST (iter-7 c16/ep44/lr1e-3/lneg0.1 hr=0.8869): (1) PRIOR: lambda_neg 1.0->0.1 gave +0.0026 (iter-6 0.8843 -> iter-7 0.8869); loss-weighting is a live lever, plateau forming ~0.887. (2) Failure mode: penalty still mildly active at 0.1; unclear if the L2 fit wants it near-zero. (3) ONE KNOB: lambda_neg 0.1 -> 0.03 (c=16, ep=44, lr=1e-3 held). Budget-neutral. (4) HYPOTHESIS: lowering the negativity penalty to 0.03 further frees the supervised L2 fit -> hr above 0.8869; if it flattens/drops, the penalty is effectively off and iter-9 stops tuning it and pivots to train_n (data lever). Expect ~0.887-0.89. (5) BUDGET: same ep=44 -> ~1030s, inside 20-min budget. (6) Loop to iter-20. Artifacts saved.", "agent": "dual_domain_supervised-claude-agentic", "campaign": "search-20260703-01", "cfg_full": {"batch_size": 1, "epochs": 44, "grad_clip": 1.0, "lambda_neg": 0.03, "lr": 0.001, "optimizer": "adam", "rationale": "iter-8 dual_domain_supervised, re-split Breast-CT val=200. SIX-BOX vs BEST (iter-7 c16/ep44/lr1e-3/lneg0.1 hr=0.8869): (1) PRIOR: lambda_neg 1.0->0.1 gave +0.0026 (iter-6 0.8843 -> iter-7 0.8869); loss-weighting is a live lever, plateau forming ~0.887. (2) Failure mode: penalty still mildly active at 0.1; unclear if the L2 fit wants it near-zero. (3) ONE KNOB: lambda_neg 0.1 -> 0.03 (c=16, ep=44, lr=1e-3 held). Budget-neutral. (4) HYPOTHESIS: lowering the negativity penalty to 0.03 further frees the supervised L2 fit -> hr above 0.8869; if it flattens/drops, the penalty is effectively off and iter-9 stops tuning it and pivots to train_n (data lever). Expect ~0.887-0.89. (5) BUDGET: same ep=44 -> ~1030s, inside 20-min budget. (6) Loop to iter-20. Artifacts saved.", "seed": 42, "train_n": 400, "unet_c": 16, "val_chunk": 10, "val_n": 200}, "challenge": "breast_ct", "change_class": "architecture", "git_commit": null, "images": {"comparison": "runs/breast-ct-claude-agentic-dual-domain-supervised-search-20260703-01/iterations/iter-0008/comparison.png", "test_showcase": null, "valtest_showcase": null}, "iter": 8, "kept": true, "metrics": {"headroom": 0.8915438850273929, "headroom_std": 0.010629517061311062, "val_psnr": 55.619117736816406, "val_psnr_std": 1.4044507288756076, "val_rmse": 0.000565520953387022, "val_rmse_std": 8.825259797778359e-05, "val_ssim": 0.9991382956504822, "val_ssim_std": 0.00027375768102684274}, "model": "claude-opus-4-8-1m", "obs_path": "breast-ct-claude-agentic-dual-domain-supervised-search-20260703-01/iterations/iter-0008/observation.json", "obs_sha1": "d93ce5d782e9eeb392848c8e51e14cd2726c74bf", "params_M": 0.465762, "params_source": "observation", "rationale": "dual_domain_supervised-claude-agentic: unet_c=16, epochs=44, batch_size=1, lr=0.001, optimizer=adam, lambda_neg=0.03, grad_clip=1.0, train_n=400, val_n=200, val_chunk=10, seed=42, rationale=iter-8 dual_domain_supervised, re-split Breast-CT val=200. SIX-BOX vs BEST (iter-7 c16/ep44/lr1e-3/lneg0.1 hr=0.8869): (1) PRIOR: lambda_neg 1.0->0.1 gave +0.0026 (iter-6 0.8843 -> iter-7 0.8869); loss-weighting is a live lever, plateau forming ~0.887. (2) Failure mode: penalty still mildly active at 0.1; unclear if the L2 fit wants it near-zero. (3) ONE KNOB: lambda_neg 0.1 -> 0.03 (c=16, ep=44, lr=1e-3 held). Budget-neutral. (4) HYPOTHESIS: lowering the negativity penalty to 0.03 further frees the supervised L2 fit -> hr above 0.8869; if it flattens/drops, the penalty is effectively off and iter-9 stops tuning it and pivots to train_n (data lever). Expect ~0.887-0.89. (5) BUDGET: same ep=44 -> ~1030s, inside 20-min budget. (6) Loop to iter-20. Artifacts saved.", "run_id": "breast-ct-claude-agentic-dual-domain-supervised-search-20260703-01", "runtime": {"elapsed_s": 941.0925467014313}, "schema_version": 3, "solver_key": "dual-domain-supervised", "solver_name": "DD-UNet supervised L2", "split": {"train_n": 400, "val_n": 200}, "status": "keep", "ts": "2026-07-04T00:08:04Z"}
{"advice_for_others": "dual_domain_supervised-claude-agentic: unet_c=16, epochs=44, batch_size=1, lr=0.001, optimizer=adam, lambda_neg=0.0, grad_clip=1.0, train_n=400, val_n=200, val_chunk=10, seed=42, rationale=iter-9 dual_domain_supervised, re-split Breast-CT val=200. SIX-BOX vs BEST (iter-8 c16/ep44/lr1e-3/lneg0.03 hr=0.8915): (1) PRIOR: lambda_neg sweep monotone improving 1.0(0.8843)->0.1(0.8869)->0.03(0.8915); latest step +0.0046 = largest recent gain -> the negativity penalty was load-bearing against the supervised L2 fit. (2) Failure mode: none; penalty at 0.03 still constrains the fit and hr keeps rising as it relaxes. (3) ONE KNOB: lambda_neg 0.03 -> 0.0 (fully off; c=16, ep=44, lr=1e-3 held) -- the sweep endpoint. (4) HYPOTHESIS: lambda_neg=0.0 gives pure supervised L2 its best fit -> hr above 0.8915; if hr DROPS vs 0.03 a tiny penalty is protective and 0.03 is the optimum. Either way the loss-weighting sweep resolves and iter-10 pivots to the DATA lever (train_n 400->higher, still <=2400). Expect ~0.89-0.895. (5) BUDGET: same ep=44 -> ~940s, inside 20-min budget. (6) Loop to iter-20. Artifacts saved.", "agent": "dual_domain_supervised-claude-agentic", "campaign": "search-20260703-01", "cfg_full": {"batch_size": 1, "epochs": 44, "grad_clip": 1.0, "lambda_neg": 0.0, "lr": 0.001, "optimizer": "adam", "rationale": "iter-9 dual_domain_supervised, re-split Breast-CT val=200. SIX-BOX vs BEST (iter-8 c16/ep44/lr1e-3/lneg0.03 hr=0.8915): (1) PRIOR: lambda_neg sweep monotone improving 1.0(0.8843)->0.1(0.8869)->0.03(0.8915); latest step +0.0046 = largest recent gain -> the negativity penalty was load-bearing against the supervised L2 fit. (2) Failure mode: none; penalty at 0.03 still constrains the fit and hr keeps rising as it relaxes. (3) ONE KNOB: lambda_neg 0.03 -> 0.0 (fully off; c=16, ep=44, lr=1e-3 held) -- the sweep endpoint. (4) HYPOTHESIS: lambda_neg=0.0 gives pure supervised L2 its best fit -> hr above 0.8915; if hr DROPS vs 0.03 a tiny penalty is protective and 0.03 is the optimum. Either way the loss-weighting sweep resolves and iter-10 pivots to the DATA lever (train_n 400->higher, still <=2400). Expect ~0.89-0.895. (5) BUDGET: same ep=44 -> ~940s, inside 20-min budget. (6) Loop to iter-20. Artifacts saved.", "seed": 42, "train_n": 400, "unet_c": 16, "val_chunk": 10, "val_n": 200}, "challenge": "breast_ct", "change_class": "architecture", "git_commit": null, "images": {"comparison": "runs/breast-ct-claude-agentic-dual-domain-supervised-search-20260703-01/iterations/iter-0009/comparison.png", "test_showcase": null, "valtest_showcase": null}, "iter": 9, "kept": true, "metrics": {"headroom": 0.8731261814485243, "headroom_std": 0.009854892625690028, "val_psnr": 54.256752014160156, "val_psnr_std": 1.1997044733896507, "val_rmse": 0.0006615560851059854, "val_rmse_std": 9.044396522540935e-05, "val_ssim": 0.9989429116249084, "val_ssim_std": 0.0003387162927053587}, "model": "claude-opus-4-8-1m", "obs_path": "breast-ct-claude-agentic-dual-domain-supervised-search-20260703-01/iterations/iter-0009/observation.json", "obs_sha1": "898d40183c4a68f208c53b6a13734af6aadcf65f", "params_M": 0.465762, "params_source": "observation", "rationale": "dual_domain_supervised-claude-agentic: unet_c=16, epochs=44, batch_size=1, lr=0.001, optimizer=adam, lambda_neg=0.0, grad_clip=1.0, train_n=400, val_n=200, val_chunk=10, seed=42, rationale=iter-9 dual_domain_supervised, re-split Breast-CT val=200. SIX-BOX vs BEST (iter-8 c16/ep44/lr1e-3/lneg0.03 hr=0.8915): (1) PRIOR: lambda_neg sweep monotone improving 1.0(0.8843)->0.1(0.8869)->0.03(0.8915); latest step +0.0046 = largest recent gain -> the negativity penalty was load-bearing against the supervised L2 fit. (2) Failure mode: none; penalty at 0.03 still constrains the fit and hr keeps rising as it relaxes. (3) ONE KNOB: lambda_neg 0.03 -> 0.0 (fully off; c=16, ep=44, lr=1e-3 held) -- the sweep endpoint. (4) HYPOTHESIS: lambda_neg=0.0 gives pure supervised L2 its best fit -> hr above 0.8915; if hr DROPS vs 0.03 a tiny penalty is protective and 0.03 is the optimum. Either way the loss-weighting sweep resolves and iter-10 pivots to the DATA lever (train_n 400->higher, still <=2400). Expect ~0.89-0.895. (5) BUDGET: same ep=44 -> ~940s, inside 20-min budget. (6) Loop to iter-20. Artifacts saved.", "run_id": "breast-ct-claude-agentic-dual-domain-supervised-search-20260703-01", "runtime": {"elapsed_s": 830.4981021881104}, "schema_version": 3, "solver_key": "dual-domain-supervised", "solver_name": "DD-UNet supervised L2", "split": {"train_n": 400, "val_n": 200}, "status": "keep", "ts": "2026-07-04T07:45:01Z"}
