{"advice_for_others": "param_efficient-claude-agentic: reg_type=bilateral, bilateral_on_top=False, proj_filter_on=False, n_iter=30, learnable_alpha=True, alpha_init=0.1, foe_n_filters=24, foe_kernel=7, foe_n_bumps=31, n_bf=3, bf_multiscale=True, bf_sigmas=[0.8, 1.6, 3.2], bf_kernel=7, bf_sigma_r=0.02, bf_gain_init=0.0, epochs=16, cosine_lr=True, lr=0.005, max_train_s=1080, batch_size=4, train_n=200, val_n=200, display_min=0.0, display_max=0.05, seed=42, rationale=iter-14 param_efficient breast -- CAPACITY-STACK #2: DIRECTIONAL STREAK REG on the lean filtered-DC unroll (solver edit, 20-min budget). SIX-BOX: (1) PRIOR: iter-13 (+300-param FoE prox) gave hr 0.0 -- PSNR 34.3 < baseline. NOT undertrained (loss converged 3.8e-3->4.4e-5 by ep5, gains engaged ~0.28). READ: a learned FoE ISOTROPIC smoother FIGHTS filtered-DC -- fbp(Rx-g) already produces a complete ramp-filtered reconstruction each step, so an added smoothing prior just OVER-SMOOTHS the recon the DC just made (the FoE solves the streak-smearing problem filtered-DC ALREADY solved -> pure drag). So on filtered-DC, isotropic prox capacity is a LIABILITY. (2) FAILURE MODE (iter-13): isotropic prox over-smooths the filtered-DC reconstruction. (3) ONE KNOB: add a DIRECTIONAL (oriented) streak reg on the LEAN bilateral path (I edited build_reg to compose ComposedBilateralAnisotropicReg -- bilateral gate + AnisotropicOrientedReg, NO FoE). +3 params (2 sigma along/across + 1 zero-init gain over 4 fixed orientations) -> 16 total. Zero-init gain => reg==bilateral==champion BYTE-FOR-BYTE at init (worst case == 0.4345, no regression). (4) HYPOTHESIS: unlike the isotropic FoE, the oriented reg smooths ALONG residual streak directions while PRESERVING across them, so it removes the specific directional streaks filtered-DC leaves WITHOUT the isotropic over-smoothing that killed iter-13 -> hr climbs past 0.4345. This is the sparse-view-NATIVE prox form (streaks are directional). (5) BUDGET: K=30 filtered + lean bilat + aniso (analytic oriented kernels, cheap), train_n=200, max_train_s=1080, --time=00:30:00, 200-val -> 20-min comparable. (6) SERIAL; iter-15 self-dispatches (next: if directional helps, tune orientations/sigmas; if not, LPD dual-update block or accept 0.4345 @ 13p as the honest ceiling)., dc_mode=filtered, per_step_alpha=False, anisotropic_on_top=True, aniso_n_orient=4, aniso_kernel=7, aniso_sigma_along=2.0, aniso_sigma_across=0.6, aniso_gain_init=0.0", "agent": "param_efficient-claude-agentic", "campaign": "search-20260703-01", "cfg_full": {"alpha_init": 0.1, "aniso_gain_init": 0.0, "aniso_kernel": 7, "aniso_n_orient": 4, "aniso_sigma_across": 0.6, "aniso_sigma_along": 2.0, "anisotropic_on_top": true, "batch_size": 4, "bf_gain_init": 0.0, "bf_kernel": 7, "bf_multiscale": true, "bf_sigma_r": 0.02, "bf_sigmas": [0.8, 1.6, 3.2], "bilateral_on_top": false, "cosine_lr": true, "dc_mode": "filtered", "display_max": 0.05, "display_min": 0.0, "epochs": 16, "foe_kernel": 7, "foe_n_bumps": 31, "foe_n_filters": 24, "learnable_alpha": true, "lr": 0.005, "max_train_s": 1080, "n_bf": 3, "n_iter": 30, "per_step_alpha": false, "proj_filter_on": false, "rationale": "iter-14 param_efficient breast -- CAPACITY-STACK #2: DIRECTIONAL STREAK REG on the lean filtered-DC unroll (solver edit, 20-min budget). SIX-BOX: (1) PRIOR: iter-13 (+300-param FoE prox) gave hr 0.0 -- PSNR 34.3 < baseline. NOT undertrained (loss converged 3.8e-3->4.4e-5 by ep5, gains engaged ~0.28). READ: a learned FoE ISOTROPIC smoother FIGHTS filtered-DC -- fbp(Rx-g) already produces a complete ramp-filtered reconstruction each step, so an added smoothing prior just OVER-SMOOTHS the recon the DC just made (the FoE solves the streak-smearing problem filtered-DC ALREADY solved -> pure drag). So on filtered-DC, isotropic prox capacity is a LIABILITY. (2) FAILURE MODE (iter-13): isotropic prox over-smooths the filtered-DC reconstruction. (3) ONE KNOB: add a DIRECTIONAL (oriented) streak reg on the LEAN bilateral path (I edited build_reg to compose ComposedBilateralAnisotropicReg -- bilateral gate + AnisotropicOrientedReg, NO FoE). +3 params (2 sigma along/across + 1 zero-init gain over 4 fixed orientations) -> 16 total. Zero-init gain => reg==bilateral==champion BYTE-FOR-BYTE at init (worst case == 0.4345, no regression). (4) HYPOTHESIS: unlike the isotropic FoE, the oriented reg smooths ALONG residual streak directions while PRESERVING across them, so it removes the specific directional streaks filtered-DC leaves WITHOUT the isotropic over-smoothing that killed iter-13 -> hr climbs past 0.4345. This is the sparse-view-NATIVE prox form (streaks are directional). (5) BUDGET: K=30 filtered + lean bilat + aniso (analytic oriented kernels, cheap), train_n=200, max_train_s=1080, --time=00:30:00, 200-val -> 20-min comparable. (6) SERIAL; iter-15 self-dispatches (next: if directional helps, tune orientations/sigmas; if not, LPD dual-update block or accept 0.4345 @ 13p as the honest ceiling).", "reg_type": "bilateral", "seed": 42, "train_n": 200, "val_n": 200}, "challenge": "breast_ct", "change_class": "architecture", "git_commit": "671da566", "images": {"comparison": "runs/breast-ct-claude-agentic-param-efficient-search-20260703-01/iterations/iter-0014/comparison.png", "test_showcase": null, "valtest_showcase": null}, "iter": 14, "kept": false, "metrics": {"headroom": 0.0, "headroom_std": 0.0, "val_psnr": 24.609092712402344, "val_psnr_std": 0.16258750862274876, "val_rmse": 0.02008860930800438, "val_rmse_std": 6.140350121275273e-05, "val_ssim": 0.8270629644393921, "val_ssim_std": 0.005297688818983815}, "model": "claude-opus-4-8-1m", "obs_path": "breast-ct-claude-agentic-param-efficient-search-20260703-01/iterations/iter-0014/observation.json", "obs_sha1": "2669911cf63978c794849a980f0ea5a94e641e0a", "params_M": 1.6e-05, "params_source": "observation", "rationale": "param_efficient-claude-agentic: reg_type=bilateral, bilateral_on_top=False, proj_filter_on=False, n_iter=30, learnable_alpha=True, alpha_init=0.1, foe_n_filters=24, foe_kernel=7, foe_n_bumps=31, n_bf=3, bf_multiscale=True, bf_sigmas=[0.8, 1.6, 3.2], bf_kernel=7, bf_sigma_r=0.02, bf_gain_init=0.0, epochs=16, cosine_lr=True, lr=0.005, max_train_s=1080, batch_size=4, train_n=200, val_n=200, display_min=0.0, display_max=0.05, seed=42, rationale=iter-14 param_efficient breast -- CAPACITY-STACK #2: DIRECTIONAL STREAK REG on the lean filtered-DC unroll (solver edit, 20-min budget). SIX-BOX: (1) PRIOR: iter-13 (+300-param FoE prox) gave hr 0.0 -- PSNR 34.3 < baseline. NOT undertrained (loss converged 3.8e-3->4.4e-5 by ep5, gains engaged ~0.28). READ: a learned FoE ISOTROPIC smoother FIGHTS filtered-DC -- fbp(Rx-g) already produces a complete ramp-filtered reconstruction each step, so an added smoothing prior just OVER-SMOOTHS the recon the DC just made (the FoE solves the streak-smearing problem filtered-DC ALREADY solved -> pure drag). So on filtered-DC, isotropic prox capacity is a LIABILITY. (2) FAILURE MODE (iter-13): isotropic prox over-smooths the filtered-DC reconstruction. (3) ONE KNOB: add a DIRECTIONAL (oriented) streak reg on the LEAN bilateral path (I edited build_reg to compose ComposedBilateralAnisotropicReg -- bilateral gate + AnisotropicOrientedReg, NO FoE). +3 params (2 sigma along/across + 1 zero-init gain over 4 fixed orientations) -> 16 total. Zero-init gain => reg==bilateral==champion BYTE-FOR-BYTE at init (worst case == 0.4345, no regression). (4) HYPOTHESIS: unlike the isotropic FoE, the oriented reg smooths ALONG residual streak directions while PRESERVING across them, so it removes the specific directional streaks filtered-DC leaves WITHOUT the isotropic over-smoothing that killed iter-13 -> hr climbs past 0.4345. This is the sparse-view-NATIVE prox form (streaks are directional). (5) BUDGET: K=30 filtered + lean bilat + aniso (analytic oriented kernels, cheap), train_n=200, max_train_s=1080, --time=00:30:00, 200-val -> 20-min comparable. (6) SERIAL; iter-15 self-dispatches (next: if directional helps, tune orientations/sigmas; if not, LPD dual-update block or accept 0.4345 @ 13p as the honest ceiling)., dc_mode=filtered, per_step_alpha=False, anisotropic_on_top=True, aniso_n_orient=4, aniso_kernel=7, aniso_sigma_along=2.0, aniso_sigma_across=0.6, aniso_gain_init=0.0", "run_id": "breast-ct-claude-agentic-param-efficient-search-20260703-01", "runtime": {"elapsed_s": 1268.332531452179}, "schema_version": 3, "solver_key": "param-efficient", "solver_name": "Param-efficient (evolved)", "split": {"train_n": 200, "val_n": 200}, "status": "discard", "ts": "2026-07-07T05:22:48Z"}
{"advice_for_others": "param_efficient-claude-agentic: reg_type=bilateral, bilateral_on_top=False, proj_filter_on=False, n_iter=30, learnable_alpha=True, alpha_init=0.1, foe_n_filters=24, foe_kernel=7, foe_n_bumps=31, n_bf=1, bf_multiscale=True, bf_sigmas=[0.8, 1.6, 3.2], bf_kernel=7, bf_sigma_r=0.02, bf_gain_init=0.0, epochs=16, cosine_lr=True, lr=0.005, max_train_s=1080, batch_size=4, train_n=200, val_n=200, display_min=0.0, display_max=0.05, seed=42, rationale=iter-15 param_efficient breast -- LPD-STYLE LEARNED DUAL/COMBINATION block (last distinct arch lever, solver edit, 20-min budget). SIX-BOX: (1) PRIOR: filtered-DC K=30 = 20-min CHAMPION 0.4345 @ 13p. Added PROX capacity does NOT help it: iter-13 (isotropic FoE +300p) hr 0.0, iter-14 (directional aniso +3p) hr 0.0 -- both FIGHT the filtered gradient because fbp(Rx-g) already does the reconstruction, leaving nothing for a prox to add. So the remaining lever is not a better PROX but a better way to COMBINE the DC correction across steps -- LPD's mechanism (0.68 on breast). (2) FAILURE MODE: the fixed x<-x-alpha*fbp(resid) update applies the SAME correction rule every step; it cannot learn to weight/route the correction using image context or cross-step memory. (3) ONE KNOB (architectural): lpd_on=True -- I added a minimal LPDCombine block: a weight-tied 2-layer 3x3 conv g(x, fbp_dc, mem)->update (3->W=4->1, 149 params) with a 1-ch primal MEMORY carried across the 30 steps; final layer ZERO-INIT => update==0 at init => x stays at the FBP init (safe seed, already clears baseline). per_step_alpha=True (the K alphas now scale the LEARNED update per step -- a real role, not the collapsed scalars of iter-7). Total ~= 149 (conv) + 30 (per-step alpha) + 12 (bilateral, UNUSED in LPD path) ~= 190 trainable. (4) HYPOTHESIS: a tiny learned operator that COMBINES the filtered-DC correction with image context + cross-step memory (LPD's mechanism) breaks past 0.4345 toward the LPD/VN regime, because it learns HOW to apply consistency (route/attenuate per-pixel + accumulate) rather than a fixed step -- the capacity that helps DC, unlike a prox smoother. (5) BUDGET: K=30 filtered + 1 tiny conv/step + 1 fbp/step, train_n=200, max_train_s=1080, --time=00:30:00, 200-val -> 20-min comparable. (6) SERIAL; iter-16: if LPD beats 0.4345, grow W / tune; if not, 0.4345 @ 13p is the honest comparable champion -> CONSOLIDATE the final report (Pareto + filtered-vs-adjoint-DC + capacity-doesnt-help-filtered-DC findings)., dc_mode=filtered, per_step_alpha=True, lpd_on=True, lpd_width=4, lpd_kernel=3, anisotropic_on_top=False", "agent": "param_efficient-claude-agentic", "campaign": "search-20260703-01", "cfg_full": {"alpha_init": 0.1, "anisotropic_on_top": false, "batch_size": 4, "bf_gain_init": 0.0, "bf_kernel": 7, "bf_multiscale": true, "bf_sigma_r": 0.02, "bf_sigmas": [0.8, 1.6, 3.2], "bilateral_on_top": false, "cosine_lr": true, "dc_mode": "filtered", "display_max": 0.05, "display_min": 0.0, "epochs": 16, "foe_kernel": 7, "foe_n_bumps": 31, "foe_n_filters": 24, "learnable_alpha": true, "lpd_kernel": 3, "lpd_on": true, "lpd_width": 4, "lr": 0.005, "max_train_s": 1080, "n_bf": 1, "n_iter": 30, "per_step_alpha": true, "proj_filter_on": false, "rationale": "iter-15 param_efficient breast -- LPD-STYLE LEARNED DUAL/COMBINATION block (last distinct arch lever, solver edit, 20-min budget). SIX-BOX: (1) PRIOR: filtered-DC K=30 = 20-min CHAMPION 0.4345 @ 13p. Added PROX capacity does NOT help it: iter-13 (isotropic FoE +300p) hr 0.0, iter-14 (directional aniso +3p) hr 0.0 -- both FIGHT the filtered gradient because fbp(Rx-g) already does the reconstruction, leaving nothing for a prox to add. So the remaining lever is not a better PROX but a better way to COMBINE the DC correction across steps -- LPD's mechanism (0.68 on breast). (2) FAILURE MODE: the fixed x<-x-alpha*fbp(resid) update applies the SAME correction rule every step; it cannot learn to weight/route the correction using image context or cross-step memory. (3) ONE KNOB (architectural): lpd_on=True -- I added a minimal LPDCombine block: a weight-tied 2-layer 3x3 conv g(x, fbp_dc, mem)->update (3->W=4->1, 149 params) with a 1-ch primal MEMORY carried across the 30 steps; final layer ZERO-INIT => update==0 at init => x stays at the FBP init (safe seed, already clears baseline). per_step_alpha=True (the K alphas now scale the LEARNED update per step -- a real role, not the collapsed scalars of iter-7). Total ~= 149 (conv) + 30 (per-step alpha) + 12 (bilateral, UNUSED in LPD path) ~= 190 trainable. (4) HYPOTHESIS: a tiny learned operator that COMBINES the filtered-DC correction with image context + cross-step memory (LPD's mechanism) breaks past 0.4345 toward the LPD/VN regime, because it learns HOW to apply consistency (route/attenuate per-pixel + accumulate) rather than a fixed step -- the capacity that helps DC, unlike a prox smoother. (5) BUDGET: K=30 filtered + 1 tiny conv/step + 1 fbp/step, train_n=200, max_train_s=1080, --time=00:30:00, 200-val -> 20-min comparable. (6) SERIAL; iter-16: if LPD beats 0.4345, grow W / tune; if not, 0.4345 @ 13p is the honest comparable champion -> CONSOLIDATE the final report (Pareto + filtered-vs-adjoint-DC + capacity-doesnt-help-filtered-DC findings).", "reg_type": "bilateral", "seed": 42, "train_n": 200, "val_n": 200}, "challenge": "breast_ct", "change_class": "architecture", "git_commit": "671da566", "images": {"comparison": "runs/breast-ct-claude-agentic-param-efficient-search-20260703-01/iterations/iter-0015/comparison.png", "test_showcase": null, "valtest_showcase": null}, "iter": 15, "kept": true, "metrics": {"headroom": 0.5046771229056541, "headroom_std": 0.00994756939577897, "val_psnr": 42.426429748535156, "val_psnr_std": 0.46723948325687703, "val_rmse": 0.002582754008471966, "val_rmse_std": 0.00013600286189393952, "val_ssim": 0.9726505875587463, "val_ssim_std": 0.002252142452063174}, "model": "claude-opus-4-8-1m", "obs_path": "breast-ct-claude-agentic-param-efficient-search-20260703-01/iterations/iter-0015/observation.json", "obs_sha1": "37859d5a896f5af39018f5b689de9cf3f369440a", "params_M": 0.000183, "params_source": "observation", "rationale": "param_efficient-claude-agentic: reg_type=bilateral, bilateral_on_top=False, proj_filter_on=False, n_iter=30, learnable_alpha=True, alpha_init=0.1, foe_n_filters=24, foe_kernel=7, foe_n_bumps=31, n_bf=1, bf_multiscale=True, bf_sigmas=[0.8, 1.6, 3.2], bf_kernel=7, bf_sigma_r=0.02, bf_gain_init=0.0, epochs=16, cosine_lr=True, lr=0.005, max_train_s=1080, batch_size=4, train_n=200, val_n=200, display_min=0.0, display_max=0.05, seed=42, rationale=iter-15 param_efficient breast -- LPD-STYLE LEARNED DUAL/COMBINATION block (last distinct arch lever, solver edit, 20-min budget). SIX-BOX: (1) PRIOR: filtered-DC K=30 = 20-min CHAMPION 0.4345 @ 13p. Added PROX capacity does NOT help it: iter-13 (isotropic FoE +300p) hr 0.0, iter-14 (directional aniso +3p) hr 0.0 -- both FIGHT the filtered gradient because fbp(Rx-g) already does the reconstruction, leaving nothing for a prox to add. So the remaining lever is not a better PROX but a better way to COMBINE the DC correction across steps -- LPD's mechanism (0.68 on breast). (2) FAILURE MODE: the fixed x<-x-alpha*fbp(resid) update applies the SAME correction rule every step; it cannot learn to weight/route the correction using image context or cross-step memory. (3) ONE KNOB (architectural): lpd_on=True -- I added a minimal LPDCombine block: a weight-tied 2-layer 3x3 conv g(x, fbp_dc, mem)->update (3->W=4->1, 149 params) with a 1-ch primal MEMORY carried across the 30 steps; final layer ZERO-INIT => update==0 at init => x stays at the FBP init (safe seed, already clears baseline). per_step_alpha=True (the K alphas now scale the LEARNED update per step -- a real role, not the collapsed scalars of iter-7). Total ~= 149 (conv) + 30 (per-step alpha) + 12 (bilateral, UNUSED in LPD path) ~= 190 trainable. (4) HYPOTHESIS: a tiny learned operator that COMBINES the filtered-DC correction with image context + cross-step memory (LPD's mechanism) breaks past 0.4345 toward the LPD/VN regime, because it learns HOW to apply consistency (route/attenuate per-pixel + accumulate) rather than a fixed step -- the capacity that helps DC, unlike a prox smoother. (5) BUDGET: K=30 filtered + 1 tiny conv/step + 1 fbp/step, train_n=200, max_train_s=1080, --time=00:30:00, 200-val -> 20-min comparable. (6) SERIAL; iter-16: if LPD beats 0.4345, grow W / tune; if not, 0.4345 @ 13p is the honest comparable champion -> CONSOLIDATE the final report (Pareto + filtered-vs-adjoint-DC + capacity-doesnt-help-filtered-DC findings)., dc_mode=filtered, per_step_alpha=True, lpd_on=True, lpd_width=4, lpd_kernel=3, anisotropic_on_top=False", "run_id": "breast-ct-claude-agentic-param-efficient-search-20260703-01", "runtime": {"elapsed_s": 1078.9848341941833}, "schema_version": 3, "solver_key": "param-efficient", "solver_name": "Param-efficient (evolved)", "split": {"train_n": 200, "val_n": 200}, "status": "keep", "ts": "2026-07-07T06:01:23Z"}
