{"advice_for_others": "itnet_v2-claude-agentic: itnet_k=1, unet_c=32, itnet_alpha_init=0.0026, residual_learning=False, pretrain_lr=0.0005, pretrain_epochs=15, pretrain_patience=15, grad_clip=1.0, train_n=2400, val_n=200, seed=42, rationale=ITER-12 slot (v3 sentinel gate, strict serial, 20-min, --qos=turbo). SIX-BOX (VERIFIED, real hr>0): best=iter-6 c32/n2400 hr0.8768. LEARNED THIS ROUND: c48/n2400 does NOT fit the 30-min wall -- BOTH attempts (771871, 771918) TIMEOUT'd at 30min. So capacity-scaling above c=32 is budget-infeasible at n=2400; I must tune TRAINING knobs at the fast, budget-safe c=32/n2400 champion instead. (2) FAILURE MODE: heavier nets time out; the recon IS the pretrained denoiser (single k=1 DC step), so denoiser training quality dominates and pretrain_lr (fixed at 2.5e-4 all along) is the untested cheap lever. (3) ONE KNOB vs iter-6 (c32/n2400): pretrain_lr 0.00025 -> 0.0005 (2x). Hold c=32, n=2400, k=1, ep=15, grad_clip=1.0, seed=42. (4) HYPOTHESIS: if pretrain_lr 2.5e-4->5e-4, hr rises above 0.8768 because a higher lr may reach a better denoiser minimum in 15 epochs (loss floored ~1e-6 by ep4-6 at 2.5e-4, suggesting room to move faster); grad_clip=1.0 guards instability. FALSIFIER: hr <= ~0.877 (flat) or unstable => lr near-optimal; iter-13 tries itnet_alpha_init instead. (5) BUDGET: identical cost to iter-6 (c32/n2400, fits easily) -- only lr changes. (6) STRICT one-at-a-time via v3 sentinel; rm DONE.* before dispatch.", "agent": "itnet_v2-claude-agentic", "campaign": "search-20260703-01", "cfg_full": {"grad_clip": 1.0, "itnet_alpha_init": 0.0026, "itnet_k": 1, "pretrain_epochs": 15, "pretrain_lr": 0.0005, "pretrain_patience": 15, "rationale": "ITER-12 slot (v3 sentinel gate, strict serial, 20-min, --qos=turbo). SIX-BOX (VERIFIED, real hr>0): best=iter-6 c32/n2400 hr0.8768. LEARNED THIS ROUND: c48/n2400 does NOT fit the 30-min wall -- BOTH attempts (771871, 771918) TIMEOUT'd at 30min. So capacity-scaling above c=32 is budget-infeasible at n=2400; I must tune TRAINING knobs at the fast, budget-safe c=32/n2400 champion instead. (2) FAILURE MODE: heavier nets time out; the recon IS the pretrained denoiser (single k=1 DC step), so denoiser training quality dominates and pretrain_lr (fixed at 2.5e-4 all along) is the untested cheap lever. (3) ONE KNOB vs iter-6 (c32/n2400): pretrain_lr 0.00025 -> 0.0005 (2x). Hold c=32, n=2400, k=1, ep=15, grad_clip=1.0, seed=42. (4) HYPOTHESIS: if pretrain_lr 2.5e-4->5e-4, hr rises above 0.8768 because a higher lr may reach a better denoiser minimum in 15 epochs (loss floored ~1e-6 by ep4-6 at 2.5e-4, suggesting room to move faster); grad_clip=1.0 guards instability. FALSIFIER: hr <= ~0.877 (flat) or unstable => lr near-optimal; iter-13 tries itnet_alpha_init instead. (5) BUDGET: identical cost to iter-6 (c32/n2400, fits easily) -- only lr changes. (6) STRICT one-at-a-time via v3 sentinel; rm DONE.* before dispatch.", "residual_learning": false, "seed": 42, "train_n": 2400, "unet_c": 32, "val_n": 200}, "challenge": "breast_ct", "change_class": "architecture", "git_commit": "671da566", "images": {"comparison": "runs/breast-ct-claude-agentic-itnet-v2-search-20260703-01/iterations/iter-0012/comparison.png", "test_showcase": null, "valtest_showcase": null}, "iter": 12, "kept": true, "metrics": {"headroom": 0.8503769762401532, "headroom_std": 0.01618938609953838, "val_psnr": 52.8242301940918, "val_psnr_std": 1.5264109151828709, "val_rmse": 0.0007801768952049315, "val_rmse_std": 0.00013050618782508688, "val_ssim": 0.9984728693962097, "val_ssim_std": 0.0005390405334812464}, "model": "claude-opus-4-8-1m", "obs_path": "breast-ct-claude-agentic-itnet-v2-search-20260703-01/iterations/iter-0012/observation.json", "obs_sha1": "c05b00abf901e2212d5b2c7724e57ade079e9d78", "params_M": 0.928098, "params_source": "observation", "rationale": "itnet_v2-claude-agentic: itnet_k=1, unet_c=32, itnet_alpha_init=0.0026, residual_learning=False, pretrain_lr=0.0005, pretrain_epochs=15, pretrain_patience=15, grad_clip=1.0, train_n=2400, val_n=200, seed=42, rationale=ITER-12 slot (v3 sentinel gate, strict serial, 20-min, --qos=turbo). SIX-BOX (VERIFIED, real hr>0): best=iter-6 c32/n2400 hr0.8768. LEARNED THIS ROUND: c48/n2400 does NOT fit the 30-min wall -- BOTH attempts (771871, 771918) TIMEOUT'd at 30min. So capacity-scaling above c=32 is budget-infeasible at n=2400; I must tune TRAINING knobs at the fast, budget-safe c=32/n2400 champion instead. (2) FAILURE MODE: heavier nets time out; the recon IS the pretrained denoiser (single k=1 DC step), so denoiser training quality dominates and pretrain_lr (fixed at 2.5e-4 all along) is the untested cheap lever. (3) ONE KNOB vs iter-6 (c32/n2400): pretrain_lr 0.00025 -> 0.0005 (2x). Hold c=32, n=2400, k=1, ep=15, grad_clip=1.0, seed=42. (4) HYPOTHESIS: if pretrain_lr 2.5e-4->5e-4, hr rises above 0.8768 because a higher lr may reach a better denoiser minimum in 15 epochs (loss floored ~1e-6 by ep4-6 at 2.5e-4, suggesting room to move faster); grad_clip=1.0 guards instability. FALSIFIER: hr <= ~0.877 (flat) or unstable => lr near-optimal; iter-13 tries itnet_alpha_init instead. (5) BUDGET: identical cost to iter-6 (c32/n2400, fits easily) -- only lr changes. (6) STRICT one-at-a-time via v3 sentinel; rm DONE.* before dispatch.", "run_id": "breast-ct-claude-agentic-itnet-v2-search-20260703-01", "runtime": {"elapsed_s": 1455.0646550655365}, "schema_version": 3, "solver_key": "itnet-v2", "solver_name": "ITNet v2", "split": {"train_n": 400, "val_n": 200}, "status": "keep", "ts": "2026-07-04T10:41:08Z"}
{"advice_for_others": "itnet_v2-claude-agentic: itnet_k=1, unet_c=32, itnet_alpha_init=0.001, residual_learning=False, pretrain_lr=0.00025, pretrain_epochs=15, pretrain_patience=15, grad_clip=1.0, train_n=2400, val_n=200, seed=42, rationale=ITER-13 (v3 sentinel gate, normal QOS, strict serial, 20-min). SIX-BOX (VERIFIED via DONE.<jobid> sentinel + obs): iter-6 c32/n2400/lr2.5e-4/alpha0.0026 hr0.8768=BEST; iter-12 c32/n2400/lr5e-4 hr0.8504 (lr 2x HURT -0.026 -> lr=2.5e-4 is better, reverted). (2) FAILURE MODE: lr-up degraded the denoiser; capacity>c32 times out at n2400; data capped at 2400. Remaining cheap training knob at the c32/n2400 champion: itnet_alpha_init (the single k=1 DC-step strength), fixed at 0.0026 all along and untested. The learned alpha settled tiny (~0.0014) so the DC step is near-vestigial; a smaller alpha_init tests whether an even-milder DC step (closer to pure denoiser) helps. (3) ONE KNOB vs iter-6 (c32/n2400/lr2.5e-4): itnet_alpha_init 0.0026 -> 0.001. Hold c=32, n=2400, k=1, lr=2.5e-4, ep=15, grad_clip=1.0, seed=42. (4) HYPOTHESIS: if alpha_init 0.0026->0.001, hr rises above 0.8768 because a milder DC step corrupts the strong pretrained denoiser recon less (k=2/k=4 collapse showed DC hurts on sparse breast; smaller alpha = gentler). FALSIFIER: hr <= ~0.877 => alpha near-optimal/vestigial; iter-14 does seed replicates of the iter-6 champion for mean+/-std. (5) BUDGET: identical to iter-6 (c32/n2400, fits) -- only alpha changes. (6) STRICT one-at-a-time; rm DONE.* before dispatch; confirm via ssh cat DONE.<jobid>.", "agent": "itnet_v2-claude-agentic", "campaign": "search-20260703-01", "cfg_full": {"grad_clip": 1.0, "itnet_alpha_init": 0.001, "itnet_k": 1, "pretrain_epochs": 15, "pretrain_lr": 0.00025, "pretrain_patience": 15, "rationale": "ITER-13 (v3 sentinel gate, normal QOS, strict serial, 20-min). SIX-BOX (VERIFIED via DONE.<jobid> sentinel + obs): iter-6 c32/n2400/lr2.5e-4/alpha0.0026 hr0.8768=BEST; iter-12 c32/n2400/lr5e-4 hr0.8504 (lr 2x HURT -0.026 -> lr=2.5e-4 is better, reverted). (2) FAILURE MODE: lr-up degraded the denoiser; capacity>c32 times out at n2400; data capped at 2400. Remaining cheap training knob at the c32/n2400 champion: itnet_alpha_init (the single k=1 DC-step strength), fixed at 0.0026 all along and untested. The learned alpha settled tiny (~0.0014) so the DC step is near-vestigial; a smaller alpha_init tests whether an even-milder DC step (closer to pure denoiser) helps. (3) ONE KNOB vs iter-6 (c32/n2400/lr2.5e-4): itnet_alpha_init 0.0026 -> 0.001. Hold c=32, n=2400, k=1, lr=2.5e-4, ep=15, grad_clip=1.0, seed=42. (4) HYPOTHESIS: if alpha_init 0.0026->0.001, hr rises above 0.8768 because a milder DC step corrupts the strong pretrained denoiser recon less (k=2/k=4 collapse showed DC hurts on sparse breast; smaller alpha = gentler). FALSIFIER: hr <= ~0.877 => alpha near-optimal/vestigial; iter-14 does seed replicates of the iter-6 champion for mean+/-std. (5) BUDGET: identical to iter-6 (c32/n2400, fits) -- only alpha changes. (6) STRICT one-at-a-time; rm DONE.* before dispatch; confirm via ssh cat DONE.<jobid>.", "residual_learning": false, "seed": 42, "train_n": 2400, "unet_c": 32, "val_n": 200}, "challenge": "breast_ct", "change_class": "architecture", "git_commit": "671da566", "images": {"comparison": "runs/breast-ct-claude-agentic-itnet-v2-search-20260703-01/iterations/iter-0013/comparison.png", "test_showcase": null, "valtest_showcase": null}, "iter": 13, "kept": true, "metrics": {"headroom": 0.8803831119359712, "headroom_std": 0.01487322232683282, "val_psnr": 54.768348693847656, "val_psnr_std": 1.7017774962272916, "val_rmse": 0.0006237163906916976, "val_rmse_std": 0.00011421913852740467, "val_ssim": 0.9989535808563232, "val_ssim_std": 0.00037671992561392554}, "model": "claude-opus-4-8-1m", "obs_path": "breast-ct-claude-agentic-itnet-v2-search-20260703-01/iterations/iter-0013/observation.json", "obs_sha1": "a049b7c19c8c64aa0a0be4ddfecb8c466046054f", "params_M": 0.928098, "params_source": "observation", "rationale": "itnet_v2-claude-agentic: itnet_k=1, unet_c=32, itnet_alpha_init=0.001, residual_learning=False, pretrain_lr=0.00025, pretrain_epochs=15, pretrain_patience=15, grad_clip=1.0, train_n=2400, val_n=200, seed=42, rationale=ITER-13 (v3 sentinel gate, normal QOS, strict serial, 20-min). SIX-BOX (VERIFIED via DONE.<jobid> sentinel + obs): iter-6 c32/n2400/lr2.5e-4/alpha0.0026 hr0.8768=BEST; iter-12 c32/n2400/lr5e-4 hr0.8504 (lr 2x HURT -0.026 -> lr=2.5e-4 is better, reverted). (2) FAILURE MODE: lr-up degraded the denoiser; capacity>c32 times out at n2400; data capped at 2400. Remaining cheap training knob at the c32/n2400 champion: itnet_alpha_init (the single k=1 DC-step strength), fixed at 0.0026 all along and untested. The learned alpha settled tiny (~0.0014) so the DC step is near-vestigial; a smaller alpha_init tests whether an even-milder DC step (closer to pure denoiser) helps. (3) ONE KNOB vs iter-6 (c32/n2400/lr2.5e-4): itnet_alpha_init 0.0026 -> 0.001. Hold c=32, n=2400, k=1, lr=2.5e-4, ep=15, grad_clip=1.0, seed=42. (4) HYPOTHESIS: if alpha_init 0.0026->0.001, hr rises above 0.8768 because a milder DC step corrupts the strong pretrained denoiser recon less (k=2/k=4 collapse showed DC hurts on sparse breast; smaller alpha = gentler). FALSIFIER: hr <= ~0.877 => alpha near-optimal/vestigial; iter-14 does seed replicates of the iter-6 champion for mean+/-std. (5) BUDGET: identical to iter-6 (c32/n2400, fits) -- only alpha changes. (6) STRICT one-at-a-time; rm DONE.* before dispatch; confirm via ssh cat DONE.<jobid>.", "run_id": "breast-ct-claude-agentic-itnet-v2-search-20260703-01", "runtime": {"elapsed_s": 1466.900857925415}, "schema_version": 3, "solver_key": "itnet-v2", "solver_name": "ITNet v2", "split": {"train_n": 400, "val_n": 200}, "status": "keep", "ts": "2026-07-04T11:35:29Z"}
{"advice_for_others": "itnet_v2-claude-agentic: itnet_k=1, unet_c=32, itnet_alpha_init=0.0004, residual_learning=False, pretrain_lr=0.00025, pretrain_epochs=15, pretrain_patience=15, grad_clip=1.0, train_n=2400, val_n=200, seed=42, rationale=ITER-14 (v3 sentinel, normal QOS, strict serial). SIX-BOX (sentinel-verified): iter-6 c32/n2400/alpha0.0026 0.8768; iter-13 c32/n2400/alpha0.001 0.8804=BEST (smaller DC-step alpha HELPED +0.0036 -- the k=1 DC step was slightly over-strong; a milder step lets the strong pretrained denoiser recon dominate, consistent with k>=2 collapse). (2) OPEN QUESTION: is alpha monotonic-better as it shrinks toward 0 (pure denoiser)? iter-13 (0.001) beat iter-6 (0.0026); test even smaller. (3) ONE KNOB vs iter-13 (c32/n2400/alpha0.001): itnet_alpha_init 0.001 -> 0.0004. Hold c=32, n=2400, k=1, lr=2.5e-4, ep=15, grad_clip=1.0, seed=42. (4) HYPOTHESIS: if alpha 0.001->0.0004, hr rises above 0.8804 because an even milder DC step corrupts the denoiser recon even less (approaching pure-denoiser). FALSIFIER: hr <= ~0.880 => alpha optimum is near 0.001 (or the DC step's tiny residual consistency has some value); then iter-15 locks alpha=0.001 champion and does seed replicates. (5) BUDGET: identical to iter-6 (c32/n2400) -- only alpha changes. (6) STRICT one-at-a-time; rm DONE.* before dispatch; confirm via ssh cat DONE.<jobid>.", "agent": "itnet_v2-claude-agentic", "campaign": "search-20260703-01", "cfg_full": {"grad_clip": 1.0, "itnet_alpha_init": 0.0004, "itnet_k": 1, "pretrain_epochs": 15, "pretrain_lr": 0.00025, "pretrain_patience": 15, "rationale": "ITER-14 (v3 sentinel, normal QOS, strict serial). SIX-BOX (sentinel-verified): iter-6 c32/n2400/alpha0.0026 0.8768; iter-13 c32/n2400/alpha0.001 0.8804=BEST (smaller DC-step alpha HELPED +0.0036 -- the k=1 DC step was slightly over-strong; a milder step lets the strong pretrained denoiser recon dominate, consistent with k>=2 collapse). (2) OPEN QUESTION: is alpha monotonic-better as it shrinks toward 0 (pure denoiser)? iter-13 (0.001) beat iter-6 (0.0026); test even smaller. (3) ONE KNOB vs iter-13 (c32/n2400/alpha0.001): itnet_alpha_init 0.001 -> 0.0004. Hold c=32, n=2400, k=1, lr=2.5e-4, ep=15, grad_clip=1.0, seed=42. (4) HYPOTHESIS: if alpha 0.001->0.0004, hr rises above 0.8804 because an even milder DC step corrupts the denoiser recon even less (approaching pure-denoiser). FALSIFIER: hr <= ~0.880 => alpha optimum is near 0.001 (or the DC step's tiny residual consistency has some value); then iter-15 locks alpha=0.001 champion and does seed replicates. (5) BUDGET: identical to iter-6 (c32/n2400) -- only alpha changes. (6) STRICT one-at-a-time; rm DONE.* before dispatch; confirm via ssh cat DONE.<jobid>.", "residual_learning": false, "seed": 42, "train_n": 2400, "unet_c": 32, "val_n": 200}, "challenge": "breast_ct", "change_class": "architecture", "git_commit": "671da566", "images": {"comparison": "runs/breast-ct-claude-agentic-itnet-v2-search-20260703-01/iterations/iter-0014/comparison.png", "test_showcase": null, "valtest_showcase": null}, "iter": 14, "kept": true, "metrics": {"headroom": 0.885264095690599, "headroom_std": 0.014733892129840553, "val_psnr": 55.130210876464844, "val_psnr_std": 1.7426694854992593, "val_rmse": 0.0005982655566185713, "val_rmse_std": 0.00011191713880655362, "val_ssim": 0.9990134835243225, "val_ssim_std": 0.00035471423689497505}, "model": "claude-opus-4-8-1m", "obs_path": "breast-ct-claude-agentic-itnet-v2-search-20260703-01/iterations/iter-0014/observation.json", "obs_sha1": "767a709c26e1977c91246175ac01691e7db1bcce", "params_M": 0.928098, "params_source": "observation", "rationale": "itnet_v2-claude-agentic: itnet_k=1, unet_c=32, itnet_alpha_init=0.0004, residual_learning=False, pretrain_lr=0.00025, pretrain_epochs=15, pretrain_patience=15, grad_clip=1.0, train_n=2400, val_n=200, seed=42, rationale=ITER-14 (v3 sentinel, normal QOS, strict serial). SIX-BOX (sentinel-verified): iter-6 c32/n2400/alpha0.0026 0.8768; iter-13 c32/n2400/alpha0.001 0.8804=BEST (smaller DC-step alpha HELPED +0.0036 -- the k=1 DC step was slightly over-strong; a milder step lets the strong pretrained denoiser recon dominate, consistent with k>=2 collapse). (2) OPEN QUESTION: is alpha monotonic-better as it shrinks toward 0 (pure denoiser)? iter-13 (0.001) beat iter-6 (0.0026); test even smaller. (3) ONE KNOB vs iter-13 (c32/n2400/alpha0.001): itnet_alpha_init 0.001 -> 0.0004. Hold c=32, n=2400, k=1, lr=2.5e-4, ep=15, grad_clip=1.0, seed=42. (4) HYPOTHESIS: if alpha 0.001->0.0004, hr rises above 0.8804 because an even milder DC step corrupts the denoiser recon even less (approaching pure-denoiser). FALSIFIER: hr <= ~0.880 => alpha optimum is near 0.001 (or the DC step's tiny residual consistency has some value); then iter-15 locks alpha=0.001 champion and does seed replicates. (5) BUDGET: identical to iter-6 (c32/n2400) -- only alpha changes. (6) STRICT one-at-a-time; rm DONE.* before dispatch; confirm via ssh cat DONE.<jobid>.", "run_id": "breast-ct-claude-agentic-itnet-v2-search-20260703-01", "runtime": {"elapsed_s": 1463.795390367508}, "schema_version": 3, "solver_key": "itnet-v2", "solver_name": "ITNet v2", "split": {"train_n": 400, "val_n": 200}, "status": "keep", "ts": "2026-07-04T12:34:23Z"}
{"advice_for_others": "itnet_v2-claude-agentic: itnet_k=1, unet_c=32, itnet_alpha_init=0.0001, residual_learning=False, pretrain_lr=0.00025, pretrain_epochs=15, pretrain_patience=15, grad_clip=1.0, train_n=2400, val_n=200, seed=42, rationale=ITER-15 (v3 sentinel, normal QOS, strict serial). SIX-BOX (sentinel-verified): alpha trend MONOTONIC-better as it shrinks: alpha0.0026 hr0.8768(i6), alpha0.001 0.8804(i13), alpha0.0004 0.8853(i14)=BEST (+0.0049). The k=1 DC step is best VERY WEAK (approaching pure pretrained denoiser). (2) OPEN QUESTION: does hr keep rising toward alpha->0? Test one more step down. (3) ONE KNOB vs iter-14 (c32/n2400/alpha0.0004): itnet_alpha_init 0.0004 -> 0.0001. Hold c=32, n=2400, k=1, lr=2.5e-4, ep=15, grad_clip=1.0, seed=42. (4) HYPOTHESIS: if alpha 0.0004->0.0001, hr rises above 0.8853 because an even weaker DC step corrupts the strong denoiser recon even less (the learned alpha is softplus(log_alpha) so alpha_init sets the starting DC strength). FALSIFIER: hr <= ~0.885 (flat/down) => alpha optimum reached ~0.0004; iter-16 LOCKS the best-alpha champion and begins seed replicates for mean+/-std. (5) BUDGET: identical to iter-6 (c32/n2400) -- only alpha changes. (6) STRICT one-at-a-time; rm DONE.* first; confirm via ssh cat DONE.<jobid>.", "agent": "itnet_v2-claude-agentic", "campaign": "search-20260703-01", "cfg_full": {"grad_clip": 1.0, "itnet_alpha_init": 0.0001, "itnet_k": 1, "pretrain_epochs": 15, "pretrain_lr": 0.00025, "pretrain_patience": 15, "rationale": "ITER-15 (v3 sentinel, normal QOS, strict serial). SIX-BOX (sentinel-verified): alpha trend MONOTONIC-better as it shrinks: alpha0.0026 hr0.8768(i6), alpha0.001 0.8804(i13), alpha0.0004 0.8853(i14)=BEST (+0.0049). The k=1 DC step is best VERY WEAK (approaching pure pretrained denoiser). (2) OPEN QUESTION: does hr keep rising toward alpha->0? Test one more step down. (3) ONE KNOB vs iter-14 (c32/n2400/alpha0.0004): itnet_alpha_init 0.0004 -> 0.0001. Hold c=32, n=2400, k=1, lr=2.5e-4, ep=15, grad_clip=1.0, seed=42. (4) HYPOTHESIS: if alpha 0.0004->0.0001, hr rises above 0.8853 because an even weaker DC step corrupts the strong denoiser recon even less (the learned alpha is softplus(log_alpha) so alpha_init sets the starting DC strength). FALSIFIER: hr <= ~0.885 (flat/down) => alpha optimum reached ~0.0004; iter-16 LOCKS the best-alpha champion and begins seed replicates for mean+/-std. (5) BUDGET: identical to iter-6 (c32/n2400) -- only alpha changes. (6) STRICT one-at-a-time; rm DONE.* first; confirm via ssh cat DONE.<jobid>.", "residual_learning": false, "seed": 42, "train_n": 2400, "unet_c": 32, "val_n": 200}, "challenge": "breast_ct", "change_class": "architecture", "git_commit": "671da566", "images": {"comparison": "runs/breast-ct-claude-agentic-itnet-v2-search-20260703-01/iterations/iter-0015/comparison.png", "test_showcase": null, "valtest_showcase": null}, "iter": 15, "kept": true, "metrics": {"headroom": 0.8767319688193592, "headroom_std": 0.015025275321955614, "val_psnr": 54.50718307495117, "val_psnr_std": 1.672195885460692, "val_rmse": 0.0006427544867619872, "val_rmse_std": 0.00011627964398447079, "val_ssim": 0.9989038705825806, "val_ssim_std": 0.0003955396665365753}, "model": "claude-opus-4-8-1m", "obs_path": "breast-ct-claude-agentic-itnet-v2-search-20260703-01/iterations/iter-0015/observation.json", "obs_sha1": "52eeb352761e44eff029ccea5e72e0b2c0f92e61", "params_M": 0.928098, "params_source": "observation", "rationale": "itnet_v2-claude-agentic: itnet_k=1, unet_c=32, itnet_alpha_init=0.0001, residual_learning=False, pretrain_lr=0.00025, pretrain_epochs=15, pretrain_patience=15, grad_clip=1.0, train_n=2400, val_n=200, seed=42, rationale=ITER-15 (v3 sentinel, normal QOS, strict serial). SIX-BOX (sentinel-verified): alpha trend MONOTONIC-better as it shrinks: alpha0.0026 hr0.8768(i6), alpha0.001 0.8804(i13), alpha0.0004 0.8853(i14)=BEST (+0.0049). The k=1 DC step is best VERY WEAK (approaching pure pretrained denoiser). (2) OPEN QUESTION: does hr keep rising toward alpha->0? Test one more step down. (3) ONE KNOB vs iter-14 (c32/n2400/alpha0.0004): itnet_alpha_init 0.0004 -> 0.0001. Hold c=32, n=2400, k=1, lr=2.5e-4, ep=15, grad_clip=1.0, seed=42. (4) HYPOTHESIS: if alpha 0.0004->0.0001, hr rises above 0.8853 because an even weaker DC step corrupts the strong denoiser recon even less (the learned alpha is softplus(log_alpha) so alpha_init sets the starting DC strength). FALSIFIER: hr <= ~0.885 (flat/down) => alpha optimum reached ~0.0004; iter-16 LOCKS the best-alpha champion and begins seed replicates for mean+/-std. (5) BUDGET: identical to iter-6 (c32/n2400) -- only alpha changes. (6) STRICT one-at-a-time; rm DONE.* first; confirm via ssh cat DONE.<jobid>.", "run_id": "breast-ct-claude-agentic-itnet-v2-search-20260703-01", "runtime": {"elapsed_s": 1488.2193050384521}, "schema_version": 3, "solver_key": "itnet-v2", "solver_name": "ITNet v2", "split": {"train_n": 400, "val_n": 200}, "status": "keep", "ts": "2026-07-04T13:34:40Z"}
