{"advice_for_others": "itnet-claude-agentic: pretrain_epochs=100, pretrain_lr=0.001, itnet_k=1, itnet_alpha=0.0, unet_c=16, finetune_epochs=0, finetune_lr=0.0001, train_n=800, val_n=200, grad_clip=1.0, seed=42, rationale=iter-10 (breast ItNet v1). SIX-BOX: (1) PRIOR: iter-8 (tn800,ep60=48000 steps) 0.8842 CHAMPION; iter-9 (tn1600,ep30=48000 steps) 0.8840 FLAT -> scene diversity SATURATES ~800 at fixed compute (and ep30 may undertrain each scene). lr/alpha/width levers already exhausted or below champion. (2) FAILURE MODE: at fixed 48000 grad steps the denoiser plateaus ~0.884; the remaining lever is TOTAL COMPUTE (more grad steps) at the good train_n=800. (3) ONE KNOB (from champion iter-8): pretrain_epochs 60 -> 100 (tn800 fixed). 800x100 = 80000 grad steps (1.67x iter-8). (4) HYPOTHESIS: if I give the denoiser MORE total training at the diversity-saturating train_n=800, I expect hr above 0.8842 because iter-9 showed diversity is saturated but each scene at ep60 may be undertrained; more epochs lowers denoiser loss further. FALSIFIER: if hr<=0.8842, the pure-denoiser architecture is near its ceiling ~0.884 at c16 and MORE compute wont help -> iter-11 must change ARCHITECTURE (width at matched-or-more compute, or add a residual/normalization) rather than training budget. (5) BUDGET: 80000 steps ~ 1.67x iter-8s 890s ~= 1490s; turbo -> within 20-min wall (iter-8 ran 890s, headroom to ~1200s+). If TIMEOUT, re-dispatch ep80. (6) Loop to iter-20.", "agent": "itnet-claude-agentic", "campaign": "search-20260703-01", "cfg_full": {"finetune_epochs": 0, "finetune_lr": 0.0001, "grad_clip": 1.0, "itnet_alpha": 0.0, "itnet_k": 1, "pretrain_epochs": 100, "pretrain_lr": 0.001, "rationale": "iter-10 (breast ItNet v1). SIX-BOX: (1) PRIOR: iter-8 (tn800,ep60=48000 steps) 0.8842 CHAMPION; iter-9 (tn1600,ep30=48000 steps) 0.8840 FLAT -> scene diversity SATURATES ~800 at fixed compute (and ep30 may undertrain each scene). lr/alpha/width levers already exhausted or below champion. (2) FAILURE MODE: at fixed 48000 grad steps the denoiser plateaus ~0.884; the remaining lever is TOTAL COMPUTE (more grad steps) at the good train_n=800. (3) ONE KNOB (from champion iter-8): pretrain_epochs 60 -> 100 (tn800 fixed). 800x100 = 80000 grad steps (1.67x iter-8). (4) HYPOTHESIS: if I give the denoiser MORE total training at the diversity-saturating train_n=800, I expect hr above 0.8842 because iter-9 showed diversity is saturated but each scene at ep60 may be undertrained; more epochs lowers denoiser loss further. FALSIFIER: if hr<=0.8842, the pure-denoiser architecture is near its ceiling ~0.884 at c16 and MORE compute wont help -> iter-11 must change ARCHITECTURE (width at matched-or-more compute, or add a residual/normalization) rather than training budget. (5) BUDGET: 80000 steps ~ 1.67x iter-8s 890s ~= 1490s; turbo -> within 20-min wall (iter-8 ran 890s, headroom to ~1200s+). If TIMEOUT, re-dispatch ep80. (6) Loop to iter-20.", "seed": 42, "train_n": 800, "unet_c": 16, "val_n": 200}, "challenge": "breast_ct", "change_class": "architecture", "git_commit": "671da566", "images": {"comparison": "runs/breast-ct-claude-agentic-itnet-search-20260703-01/iterations/iter-0010/comparison.png", "test_showcase": null, "valtest_showcase": null}, "iter": 10, "kept": true, "metrics": {"headroom": 0.8847309898586204, "headroom_std": 0.015763086695564445, "val_psnr": 55.08994674682617, "val_psnr_std": 1.8206629340594893, "val_rmse": 0.0006010453216731548, "val_rmse_std": 0.0001174716714279528, "val_ssim": 0.9989992380142212, "val_ssim_std": 0.00038920022794681054}, "model": "claude-opus-4-8-1m", "obs_path": "breast-ct-claude-agentic-itnet-search-20260703-01/iterations/iter-0010/observation.json", "obs_sha1": "7a84e3ba1cd8f35d06fedbae567b802669eba873", "params_M": 0.232881, "params_source": "observation", "rationale": "itnet-claude-agentic: pretrain_epochs=100, pretrain_lr=0.001, itnet_k=1, itnet_alpha=0.0, unet_c=16, finetune_epochs=0, finetune_lr=0.0001, train_n=800, val_n=200, grad_clip=1.0, seed=42, rationale=iter-10 (breast ItNet v1). SIX-BOX: (1) PRIOR: iter-8 (tn800,ep60=48000 steps) 0.8842 CHAMPION; iter-9 (tn1600,ep30=48000 steps) 0.8840 FLAT -> scene diversity SATURATES ~800 at fixed compute (and ep30 may undertrain each scene). lr/alpha/width levers already exhausted or below champion. (2) FAILURE MODE: at fixed 48000 grad steps the denoiser plateaus ~0.884; the remaining lever is TOTAL COMPUTE (more grad steps) at the good train_n=800. (3) ONE KNOB (from champion iter-8): pretrain_epochs 60 -> 100 (tn800 fixed). 800x100 = 80000 grad steps (1.67x iter-8). (4) HYPOTHESIS: if I give the denoiser MORE total training at the diversity-saturating train_n=800, I expect hr above 0.8842 because iter-9 showed diversity is saturated but each scene at ep60 may be undertrained; more epochs lowers denoiser loss further. FALSIFIER: if hr<=0.8842, the pure-denoiser architecture is near its ceiling ~0.884 at c16 and MORE compute wont help -> iter-11 must change ARCHITECTURE (width at matched-or-more compute, or add a residual/normalization) rather than training budget. (5) BUDGET: 80000 steps ~ 1.67x iter-8s 890s ~= 1490s; turbo -> within 20-min wall (iter-8 ran 890s, headroom to ~1200s+). If TIMEOUT, re-dispatch ep80. (6) Loop to iter-20.", "run_id": "breast-ct-claude-agentic-itnet-search-20260703-01", "runtime": {"elapsed_s": 1783.4600863456726}, "schema_version": 3, "solver_key": "itnet", "solver_name": "ITNet v1", "split": {"train_n": 400, "val_n": 200}, "status": "keep", "ts": "2026-07-04T11:40:12Z"}
{"advice_for_others": "itnet-claude-agentic: pretrain_epochs=40, pretrain_lr=0.001, itnet_k=1, itnet_alpha=0.0, unet_c=24, finetune_epochs=0, finetune_lr=0.0001, train_n=800, val_n=200, grad_clip=1.0, seed=42, rationale=iter-11 (breast ItNet v1). SIX-BOX: (1) PRIOR: iter-8 (c16,tn800,ep60) 0.8842; iter-9 (tn1600) 0.8840 diversity-saturated; iter-10 (tn800,ep100=80000 steps) 0.8847 = FLAT (+0.0005 noise, 1783s at the wall). Training-budget levers (diversity, epochs, lr, alpha) are EXHAUSTED; pure-denoiser c16 ceiling ~0.884. (2) FAILURE MODE: capacity ceiling of the c=16 SmallUNet. iter-7 tested c24 but was CONFOUNDED (ep120->80 cut AND ran before the tn800 diversity win). Now test WIDTH cleanly at the good tn800. (3) ONE KNOB (architecture/capacity from champion iter-8): unet_c 16 -> 24 at tn800. pretrain_epochs 60 -> 40 SOLELY to keep wall-time in budget (c24 per-step ~2.25x c16; 800x40 fits under turbo). (4) HYPOTHESIS: if I widen the denoiser to c=24 at the diversity-rich tn800, I expect hr above 0.8847 because training budget is saturated but c16 may be capacity-limited for 512^2 breast detail; more channels resolve finer structure. FALSIFIER: if hr<=0.8847, c16 was NOT capacity-limited and the ~0.884 plateau is the pretrain-then-fixed-DC v1 ARCHITECTURE ceiling on breast -> remaining iters confirm the plateau (repeat best for noise band) + probe grad_clip / seed robustness rather than chase capacity. (5) BUDGET: c24 @ tn800 ep40 ~ 2.25 * (40/60) * 890s(iter-8) ~= 1335s; turbo -> within 20-min wall. If TIMEOUT, re-dispatch ep30. (6) Loop to iter-20.", "agent": "itnet-claude-agentic", "campaign": "search-20260703-01", "cfg_full": {"finetune_epochs": 0, "finetune_lr": 0.0001, "grad_clip": 1.0, "itnet_alpha": 0.0, "itnet_k": 1, "pretrain_epochs": 40, "pretrain_lr": 0.001, "rationale": "iter-11 (breast ItNet v1). SIX-BOX: (1) PRIOR: iter-8 (c16,tn800,ep60) 0.8842; iter-9 (tn1600) 0.8840 diversity-saturated; iter-10 (tn800,ep100=80000 steps) 0.8847 = FLAT (+0.0005 noise, 1783s at the wall). Training-budget levers (diversity, epochs, lr, alpha) are EXHAUSTED; pure-denoiser c16 ceiling ~0.884. (2) FAILURE MODE: capacity ceiling of the c=16 SmallUNet. iter-7 tested c24 but was CONFOUNDED (ep120->80 cut AND ran before the tn800 diversity win). Now test WIDTH cleanly at the good tn800. (3) ONE KNOB (architecture/capacity from champion iter-8): unet_c 16 -> 24 at tn800. pretrain_epochs 60 -> 40 SOLELY to keep wall-time in budget (c24 per-step ~2.25x c16; 800x40 fits under turbo). (4) HYPOTHESIS: if I widen the denoiser to c=24 at the diversity-rich tn800, I expect hr above 0.8847 because training budget is saturated but c16 may be capacity-limited for 512^2 breast detail; more channels resolve finer structure. FALSIFIER: if hr<=0.8847, c16 was NOT capacity-limited and the ~0.884 plateau is the pretrain-then-fixed-DC v1 ARCHITECTURE ceiling on breast -> remaining iters confirm the plateau (repeat best for noise band) + probe grad_clip / seed robustness rather than chase capacity. (5) BUDGET: c24 @ tn800 ep40 ~ 2.25 * (40/60) * 890s(iter-8) ~= 1335s; turbo -> within 20-min wall. If TIMEOUT, re-dispatch ep30. (6) Loop to iter-20.", "seed": 42, "train_n": 800, "unet_c": 24, "val_n": 200}, "challenge": "breast_ct", "change_class": "architecture", "git_commit": "671da566", "images": {"comparison": "runs/breast-ct-claude-agentic-itnet-search-20260703-01/iterations/iter-0011/comparison.png", "test_showcase": null, "valtest_showcase": null}, "iter": 11, "kept": true, "metrics": {"headroom": 0.8543443481449444, "headroom_std": 0.016026014508285082, "val_psnr": 53.05765151977539, "val_psnr_std": 1.5382599445234577, "val_rmse": 0.0007594898925162852, "val_rmse_std": 0.0001283460402544024, "val_ssim": 0.9985619187355042, "val_ssim_std": 0.0005061295127021702}, "model": "claude-opus-4-8-1m", "obs_path": "breast-ct-claude-agentic-itnet-search-20260703-01/iterations/iter-0011/observation.json", "obs_sha1": "5be2fe64ced7d0bb03b1872013a0bc981495f6ed", "params_M": 0.522697, "params_source": "observation", "rationale": "itnet-claude-agentic: pretrain_epochs=40, pretrain_lr=0.001, itnet_k=1, itnet_alpha=0.0, unet_c=24, finetune_epochs=0, finetune_lr=0.0001, train_n=800, val_n=200, grad_clip=1.0, seed=42, rationale=iter-11 (breast ItNet v1). SIX-BOX: (1) PRIOR: iter-8 (c16,tn800,ep60) 0.8842; iter-9 (tn1600) 0.8840 diversity-saturated; iter-10 (tn800,ep100=80000 steps) 0.8847 = FLAT (+0.0005 noise, 1783s at the wall). Training-budget levers (diversity, epochs, lr, alpha) are EXHAUSTED; pure-denoiser c16 ceiling ~0.884. (2) FAILURE MODE: capacity ceiling of the c=16 SmallUNet. iter-7 tested c24 but was CONFOUNDED (ep120->80 cut AND ran before the tn800 diversity win). Now test WIDTH cleanly at the good tn800. (3) ONE KNOB (architecture/capacity from champion iter-8): unet_c 16 -> 24 at tn800. pretrain_epochs 60 -> 40 SOLELY to keep wall-time in budget (c24 per-step ~2.25x c16; 800x40 fits under turbo). (4) HYPOTHESIS: if I widen the denoiser to c=24 at the diversity-rich tn800, I expect hr above 0.8847 because training budget is saturated but c16 may be capacity-limited for 512^2 breast detail; more channels resolve finer structure. FALSIFIER: if hr<=0.8847, c16 was NOT capacity-limited and the ~0.884 plateau is the pretrain-then-fixed-DC v1 ARCHITECTURE ceiling on breast -> remaining iters confirm the plateau (repeat best for noise band) + probe grad_clip / seed robustness rather than chase capacity. (5) BUDGET: c24 @ tn800 ep40 ~ 2.25 * (40/60) * 890s(iter-8) ~= 1335s; turbo -> within 20-min wall. If TIMEOUT, re-dispatch ep30. (6) Loop to iter-20.", "run_id": "breast-ct-claude-agentic-itnet-search-20260703-01", "runtime": {"elapsed_s": 849.4547493457794}, "schema_version": 3, "solver_key": "itnet", "solver_name": "ITNet v1", "split": {"train_n": 400, "val_n": 200}, "status": "keep", "ts": "2026-07-04T12:23:58Z"}
{"advice_for_others": "itnet-claude-agentic: pretrain_epochs=60, pretrain_lr=0.001, itnet_k=1, itnet_alpha=0.02, unet_c=16, finetune_epochs=0, finetune_lr=0.0001, train_n=800, val_n=200, grad_clip=1.0, seed=42, rationale=iter-12 REDO (breast ItNet v1). Prior iter-12 (ep100,a0.02) TIMED OUT 30:24 (repeating iter-10s at-the-wall ep100 profile overran). SIX-BOX: (1) PRIOR: champion iter-10 (c16,tn800,ep100,a0.0) 0.8847 ~= iter-8 (ep60,a0.0) 0.8842 (tied, ep100 gain was noise); iter-11 (c24) 0.8543 width hurts. All alpha tests were at OLD tn400/weak denoiser; never re-probed with tn800. (2) FAILURE MODE: possible untested interior alpha optimum with the strong tn800 denoiser + budget overrun on ep100 -> use the SAFE ep60 profile (iter-8 ran 890s). (3) ONE KNOB vs iter-8 baseline: itnet_alpha 0.0 -> 0.02 (tn800, ep60, c16 all = iter-8). Clean single-knob alpha test at compute-safe profile. (4) HYPOTHESIS: if a tiny DC nudge helps the strong tn800 denoiser, hr rises above iter-8s 0.8842 because a small alpha adds sinogram consistency with minimal streak re-injection off a clean x_denoised. FALSIFIER: if hr<=0.8842, alpha=0 is optimal across denoiser strengths -> DC step unconditionally net-harmful on 128-view breast, alpha lever CLOSED. (5) BUDGET: ep60/tn800 = iter-8s 890s (well under wall); only float alpha changed. (6) Loop to iter-20.", "agent": "itnet-claude-agentic", "campaign": "search-20260703-01", "cfg_full": {"finetune_epochs": 0, "finetune_lr": 0.0001, "grad_clip": 1.0, "itnet_alpha": 0.02, "itnet_k": 1, "pretrain_epochs": 60, "pretrain_lr": 0.001, "rationale": "iter-12 REDO (breast ItNet v1). Prior iter-12 (ep100,a0.02) TIMED OUT 30:24 (repeating iter-10s at-the-wall ep100 profile overran). SIX-BOX: (1) PRIOR: champion iter-10 (c16,tn800,ep100,a0.0) 0.8847 ~= iter-8 (ep60,a0.0) 0.8842 (tied, ep100 gain was noise); iter-11 (c24) 0.8543 width hurts. All alpha tests were at OLD tn400/weak denoiser; never re-probed with tn800. (2) FAILURE MODE: possible untested interior alpha optimum with the strong tn800 denoiser + budget overrun on ep100 -> use the SAFE ep60 profile (iter-8 ran 890s). (3) ONE KNOB vs iter-8 baseline: itnet_alpha 0.0 -> 0.02 (tn800, ep60, c16 all = iter-8). Clean single-knob alpha test at compute-safe profile. (4) HYPOTHESIS: if a tiny DC nudge helps the strong tn800 denoiser, hr rises above iter-8s 0.8842 because a small alpha adds sinogram consistency with minimal streak re-injection off a clean x_denoised. FALSIFIER: if hr<=0.8842, alpha=0 is optimal across denoiser strengths -> DC step unconditionally net-harmful on 128-view breast, alpha lever CLOSED. (5) BUDGET: ep60/tn800 = iter-8s 890s (well under wall); only float alpha changed. (6) Loop to iter-20.", "seed": 42, "train_n": 800, "unet_c": 16, "val_n": 200}, "challenge": "breast_ct", "change_class": "architecture", "git_commit": "671da566", "images": {"comparison": "runs/breast-ct-claude-agentic-itnet-search-20260703-01/iterations/iter-0012/comparison.png", "test_showcase": null, "valtest_showcase": null}, "iter": 12, "kept": true, "metrics": {"headroom": 0.8851973290857523, "headroom_std": 0.013874730339989717, "val_psnr": 55.12515640258789, "val_psnr_std": 1.632238287338429, "val_rmse": 0.0005986136966384947, "val_rmse_std": 0.00010823945563540215, "val_ssim": 0.9987267851829529, "val_ssim_std": 0.0004555248093755383}, "model": "claude-opus-4-8-1m", "obs_path": "breast-ct-claude-agentic-itnet-search-20260703-01/iterations/iter-0012/observation.json", "obs_sha1": "48dbfec993ee2ed3936035a8aab0bf7e1f265c4e", "params_M": 0.232881, "params_source": "observation", "rationale": "itnet-claude-agentic: pretrain_epochs=60, pretrain_lr=0.001, itnet_k=1, itnet_alpha=0.02, unet_c=16, finetune_epochs=0, finetune_lr=0.0001, train_n=800, val_n=200, grad_clip=1.0, seed=42, rationale=iter-12 REDO (breast ItNet v1). Prior iter-12 (ep100,a0.02) TIMED OUT 30:24 (repeating iter-10s at-the-wall ep100 profile overran). SIX-BOX: (1) PRIOR: champion iter-10 (c16,tn800,ep100,a0.0) 0.8847 ~= iter-8 (ep60,a0.0) 0.8842 (tied, ep100 gain was noise); iter-11 (c24) 0.8543 width hurts. All alpha tests were at OLD tn400/weak denoiser; never re-probed with tn800. (2) FAILURE MODE: possible untested interior alpha optimum with the strong tn800 denoiser + budget overrun on ep100 -> use the SAFE ep60 profile (iter-8 ran 890s). (3) ONE KNOB vs iter-8 baseline: itnet_alpha 0.0 -> 0.02 (tn800, ep60, c16 all = iter-8). Clean single-knob alpha test at compute-safe profile. (4) HYPOTHESIS: if a tiny DC nudge helps the strong tn800 denoiser, hr rises above iter-8s 0.8842 because a small alpha adds sinogram consistency with minimal streak re-injection off a clean x_denoised. FALSIFIER: if hr<=0.8842, alpha=0 is optimal across denoiser strengths -> DC step unconditionally net-harmful on 128-view breast, alpha lever CLOSED. (5) BUDGET: ep60/tn800 = iter-8s 890s (well under wall); only float alpha changed. (6) Loop to iter-20.", "run_id": "breast-ct-claude-agentic-itnet-search-20260703-01", "runtime": {"elapsed_s": 1140.2573363780975}, "schema_version": 3, "solver_key": "itnet", "solver_name": "ITNet v1", "split": {"train_n": 400, "val_n": 200}, "status": "keep", "ts": "2026-07-04T19:32:45Z"}
{"advice_for_others": "itnet-claude-agentic: pretrain_epochs=60, pretrain_lr=0.001, itnet_k=1, itnet_alpha=0.03, unet_c=16, finetune_epochs=0, finetune_lr=0.0001, train_n=800, val_n=200, grad_clip=1.0, seed=42, rationale=iter-13 (breast ItNet v1). SIX-BOX: (1) PRIOR: iter-8 (a0.0) 0.8842; iter-12 (a0.02) 0.8852 -> a tiny DC step is neutral-to-marginally-POSITIVE with the strong tn800 denoiser (reverses the earlier tn400 finding that alpha=0 was best; a gentle nudge off a CLEAN x_denoised adds mild sinogram consistency without big streak re-injection). Plateau ~0.885. (2) FAILURE MODE: mapping a shallow interior alpha optimum; need >1 point to confirm 0.02 isnt noise. (3) ONE KNOB (from champion iter-12): itnet_alpha 0.02 -> 0.03. All else = iter-12 (c16,tn800,ep60,lr1e-3). (4) HYPOTHESIS: if the interior alpha optimum is >0.02, hr rises above 0.8852; if 0.02 was already past the peak, hr falls back toward 0.884 -> either way this LOCATES the optimum. (5) BUDGET: float change, ep60 = ~1140s, in budget. (6) Loop to iter-20.", "agent": "itnet-claude-agentic", "campaign": "search-20260703-01", "cfg_full": {"finetune_epochs": 0, "finetune_lr": 0.0001, "grad_clip": 1.0, "itnet_alpha": 0.03, "itnet_k": 1, "pretrain_epochs": 60, "pretrain_lr": 0.001, "rationale": "iter-13 (breast ItNet v1). SIX-BOX: (1) PRIOR: iter-8 (a0.0) 0.8842; iter-12 (a0.02) 0.8852 -> a tiny DC step is neutral-to-marginally-POSITIVE with the strong tn800 denoiser (reverses the earlier tn400 finding that alpha=0 was best; a gentle nudge off a CLEAN x_denoised adds mild sinogram consistency without big streak re-injection). Plateau ~0.885. (2) FAILURE MODE: mapping a shallow interior alpha optimum; need >1 point to confirm 0.02 isnt noise. (3) ONE KNOB (from champion iter-12): itnet_alpha 0.02 -> 0.03. All else = iter-12 (c16,tn800,ep60,lr1e-3). (4) HYPOTHESIS: if the interior alpha optimum is >0.02, hr rises above 0.8852; if 0.02 was already past the peak, hr falls back toward 0.884 -> either way this LOCATES the optimum. (5) BUDGET: float change, ep60 = ~1140s, in budget. (6) Loop to iter-20.", "seed": 42, "train_n": 800, "unet_c": 16, "val_n": 200}, "challenge": "breast_ct", "change_class": "architecture", "git_commit": "671da566", "images": {"comparison": "runs/breast-ct-claude-agentic-itnet-search-20260703-01/iterations/iter-0013/comparison.png", "test_showcase": null, "valtest_showcase": null}, "iter": 13, "kept": true, "metrics": {"headroom": 0.8828134677027349, "headroom_std": 0.01228306418872209, "val_psnr": 54.94664001464844, "val_psnr_std": 1.464127454350545, "val_rmse": 0.0006110438262112439, "val_rmse_std": 0.00010081009644544147, "val_ssim": 0.9979335069656372, "val_ssim_std": 0.0005379892930143745}, "model": "claude-opus-4-8-1m", "obs_path": "breast-ct-claude-agentic-itnet-search-20260703-01/iterations/iter-0013/observation.json", "obs_sha1": "f85a035f651f90c1d5aaf8014d9339064272bd3f", "params_M": 0.232881, "params_source": "observation", "rationale": "itnet-claude-agentic: pretrain_epochs=60, pretrain_lr=0.001, itnet_k=1, itnet_alpha=0.03, unet_c=16, finetune_epochs=0, finetune_lr=0.0001, train_n=800, val_n=200, grad_clip=1.0, seed=42, rationale=iter-13 (breast ItNet v1). SIX-BOX: (1) PRIOR: iter-8 (a0.0) 0.8842; iter-12 (a0.02) 0.8852 -> a tiny DC step is neutral-to-marginally-POSITIVE with the strong tn800 denoiser (reverses the earlier tn400 finding that alpha=0 was best; a gentle nudge off a CLEAN x_denoised adds mild sinogram consistency without big streak re-injection). Plateau ~0.885. (2) FAILURE MODE: mapping a shallow interior alpha optimum; need >1 point to confirm 0.02 isnt noise. (3) ONE KNOB (from champion iter-12): itnet_alpha 0.02 -> 0.03. All else = iter-12 (c16,tn800,ep60,lr1e-3). (4) HYPOTHESIS: if the interior alpha optimum is >0.02, hr rises above 0.8852; if 0.02 was already past the peak, hr falls back toward 0.884 -> either way this LOCATES the optimum. (5) BUDGET: float change, ep60 = ~1140s, in budget. (6) Loop to iter-20.", "run_id": "breast-ct-claude-agentic-itnet-search-20260703-01", "runtime": {"elapsed_s": 1065.2161419391632}, "schema_version": 3, "solver_key": "itnet", "solver_name": "ITNet v1", "split": {"train_n": 400, "val_n": 200}, "status": "keep", "ts": "2026-07-04T20:28:00Z"}
