{"advice_for_others": "dual_domain_n2i-claude-agentic: warm_start=True, pretrain_epochs=3, pretrain_steps=0, n_iter=200, grad_clip=1.0, outer_wall_s=900, per_scene_s=None, batch_size=1, lr=0.001, optimizer=adam, unet_c=16, train_n=400, val_n=200, seed=42, rationale=iter-1 ONBOARDING dual_domain_n2i (Noise2Inverse self-supervised DD-UNet: warm-start amortised N2I pre-pass on train, then PER-IMAGE N2I fine-tune of each val scan on its own 128-view sinogram split into two half-view subsets, GT-free) on the re-split Breast-CT (train 3600 / val 200 / test 200, seed 20260703), scoring val=200. SIX-BOX: (1) PRIOR: none for this slug; nearest reference = the OLD-split breast N2I run (search-20260618-01) which hit hr=0 on ALL 20 iters (val_ssim ~0.96 but never beat the 128-view sparse FBP baseline -> over-smoothing), the DOCUMENTED structural ceiling (docs/findings.md: N2I over-smooths dense breast at 128 views because the FBP is a poor self-supervision target). (2) Failure mode: N/A onboarding; goal = does N2I run under the HARD 20-min budget at the required val=200 and produce a legitimate hr (expected ~0 per the documented ceiling)? (3) ONE KNOB: N/A baseline (mirrors a known-good N2I breast config: warm_start ep=3, n_iter=200, c=16, lr=1e-3; only val_n 16->200 as the re-split requires, and outer_wall=900s so per_scene=4.5s keeps 200 per-image fits inside the 20-min budget). (4) HYPOTHESIS: N2I trains stably (grad_clip=1.0) but PLATEAUS at hr~0 -- it will land at val_ssim ~0.95-0.96 yet fail to beat the sparse-view FBP baseline (hr=0), reproducing the documented over-smoothing ceiling on the new val=200 split. If it clears hr>0 that is itself a finding. (5) BUDGET: breast uses a SINGLE shared PYRO-NN projector; warm-start ep=3 on 400 scenes + 200 per-image fits at per_scene=4.5s (n_iter=200 capped by the 4.5s wall on 512^2 c=16) + figure fits inside 20 min (30-min sbatch wall). (6) Loop continues; iter-2 self-dispatched on landing. Knobs reserved for iters 2-20: n_iter (inner steps), pretrain_epochs, unet_c (net depth/width), lr, warm_start on/off, outer_wall/per_scene budget -- genuinely different levers to document the ceiling.", "agent": "dual_domain_n2i-claude-agentic", "campaign": "search-20260703-01", "cfg_full": {"batch_size": 1, "grad_clip": 1.0, "lr": 0.001, "n_iter": 200, "optimizer": "adam", "outer_wall_s": 900, "per_scene_s": null, "pretrain_epochs": 3, "pretrain_steps": 0, "rationale": "iter-1 ONBOARDING dual_domain_n2i (Noise2Inverse self-supervised DD-UNet: warm-start amortised N2I pre-pass on train, then PER-IMAGE N2I fine-tune of each val scan on its own 128-view sinogram split into two half-view subsets, GT-free) on the re-split Breast-CT (train 3600 / val 200 / test 200, seed 20260703), scoring val=200. SIX-BOX: (1) PRIOR: none for this slug; nearest reference = the OLD-split breast N2I run (search-20260618-01) which hit hr=0 on ALL 20 iters (val_ssim ~0.96 but never beat the 128-view sparse FBP baseline -> over-smoothing), the DOCUMENTED structural ceiling (docs/findings.md: N2I over-smooths dense breast at 128 views because the FBP is a poor self-supervision target). (2) Failure mode: N/A onboarding; goal = does N2I run under the HARD 20-min budget at the required val=200 and produce a legitimate hr (expected ~0 per the documented ceiling)? (3) ONE KNOB: N/A baseline (mirrors a known-good N2I breast config: warm_start ep=3, n_iter=200, c=16, lr=1e-3; only val_n 16->200 as the re-split requires, and outer_wall=900s so per_scene=4.5s keeps 200 per-image fits inside the 20-min budget). (4) HYPOTHESIS: N2I trains stably (grad_clip=1.0) but PLATEAUS at hr~0 -- it will land at val_ssim ~0.95-0.96 yet fail to beat the sparse-view FBP baseline (hr=0), reproducing the documented over-smoothing ceiling on the new val=200 split. If it clears hr>0 that is itself a finding. (5) BUDGET: breast uses a SINGLE shared PYRO-NN projector; warm-start ep=3 on 400 scenes + 200 per-image fits at per_scene=4.5s (n_iter=200 capped by the 4.5s wall on 512^2 c=16) + figure fits inside 20 min (30-min sbatch wall). (6) Loop continues; iter-2 self-dispatched on landing. Knobs reserved for iters 2-20: n_iter (inner steps), pretrain_epochs, unet_c (net depth/width), lr, warm_start on/off, outer_wall/per_scene budget -- genuinely different levers to document the ceiling.", "seed": 42, "train_n": 400, "unet_c": 16, "val_n": 200, "warm_start": true}, "challenge": "breast_ct", "change_class": "architecture", "git_commit": "671da566", "images": {"comparison": "runs/breast-ct-claude-agentic-dual-domain-n2i-search-20260703-01/iterations/iter-0001/comparison.png", "test_showcase": null, "valtest_showcase": null}, "iter": 1, "kept": false, "metrics": {"headroom": 0.0, "headroom_std": 0.0, "val_psnr": 34.54658126831055, "val_psnr_std": 0.9471545888442259, "val_rmse": 0.0063984589651227, "val_rmse_std": 0.0006720001406051625, "val_ssim": 0.9404124617576599, "val_ssim_std": 0.010500652945268767}, "model": "claude-opus-4-8-1m", "obs_path": "breast-ct-claude-agentic-dual-domain-n2i-search-20260703-01/iterations/iter-0001/observation.json", "obs_sha1": "eede6978813907590215b3d63ff1fc5ece115d1e", "params_M": 0.465762, "params_source": "observation", "rationale": "dual_domain_n2i-claude-agentic: warm_start=True, pretrain_epochs=3, pretrain_steps=0, n_iter=200, grad_clip=1.0, outer_wall_s=900, per_scene_s=None, batch_size=1, lr=0.001, optimizer=adam, unet_c=16, train_n=400, val_n=200, seed=42, rationale=iter-1 ONBOARDING dual_domain_n2i (Noise2Inverse self-supervised DD-UNet: warm-start amortised N2I pre-pass on train, then PER-IMAGE N2I fine-tune of each val scan on its own 128-view sinogram split into two half-view subsets, GT-free) on the re-split Breast-CT (train 3600 / val 200 / test 200, seed 20260703), scoring val=200. SIX-BOX: (1) PRIOR: none for this slug; nearest reference = the OLD-split breast N2I run (search-20260618-01) which hit hr=0 on ALL 20 iters (val_ssim ~0.96 but never beat the 128-view sparse FBP baseline -> over-smoothing), the DOCUMENTED structural ceiling (docs/findings.md: N2I over-smooths dense breast at 128 views because the FBP is a poor self-supervision target). (2) Failure mode: N/A onboarding; goal = does N2I run under the HARD 20-min budget at the required val=200 and produce a legitimate hr (expected ~0 per the documented ceiling)? (3) ONE KNOB: N/A baseline (mirrors a known-good N2I breast config: warm_start ep=3, n_iter=200, c=16, lr=1e-3; only val_n 16->200 as the re-split requires, and outer_wall=900s so per_scene=4.5s keeps 200 per-image fits inside the 20-min budget). (4) HYPOTHESIS: N2I trains stably (grad_clip=1.0) but PLATEAUS at hr~0 -- it will land at val_ssim ~0.95-0.96 yet fail to beat the sparse-view FBP baseline (hr=0), reproducing the documented over-smoothing ceiling on the new val=200 split. If it clears hr>0 that is itself a finding. (5) BUDGET: breast uses a SINGLE shared PYRO-NN projector; warm-start ep=3 on 400 scenes + 200 per-image fits at per_scene=4.5s (n_iter=200 capped by the 4.5s wall on 512^2 c=16) + figure fits inside 20 min (30-min sbatch wall). (6) Loop continues; iter-2 self-dispatched on landing. Knobs reserved for iters 2-20: n_iter (inner steps), pretrain_epochs, unet_c (net depth/width), lr, warm_start on/off, outer_wall/per_scene budget -- genuinely different levers to document the ceiling.", "run_id": "breast-ct-claude-agentic-dual-domain-n2i-search-20260703-01", "runtime": {"elapsed_s": 1018.2448709011078}, "schema_version": 3, "solver_key": "dual-domain-n2i", "solver_name": "DD-UNet N2I (per-image)", "split": {"train_n": 400, "val_n": 197}, "status": "discard", "ts": "2026-07-05T16:47:07Z"}
{"advice_for_others": "dual_domain_n2i-claude-agentic: warm_start=True, pretrain_epochs=3, pretrain_steps=0, n_iter=200, grad_clip=1.0, outer_wall_s=1400, per_scene_s=None, batch_size=1, lr=0.001, optimizer=adam, unet_c=16, train_n=400, val_n=200, seed=42, rationale=iter-2 SIX-BOX. (1) PRIOR: iter-1 hr=0.0 (val_rmse 0.00640 > baseline 0.00521 -> recon WORSE than 128-view sparse FBP), val_ssim=0.940, only 197/200 scans reconstructed because the outer_wall=900s cut the loop at per_scene=4.5s. Ceiling holds. (2) FAILURE MODE: N2I over-smooths -> recon RMSE above the sparse-FBP baseline; ALSO the per-scene budget was so tight (4.5s) that inner N2I steps were wall-clipped well below n_iter=200, so each val scan was UNDER-fit. (3) ONE KNOB: outer_wall_s 900 -> 1400 (per_scene 4.5s -> 7.0s). Everything else identical to iter-1. (4) HYPOTHESIS: giving each per-image N2I fit ~55% more wall lets n_iter=200 actually complete on all 200 scans; if the iter-1 hr=0 was partly under-fitting rather than pure over-smoothing, more inner steps should DROP val_rmse toward/below baseline (hr>0). If hr stays 0 even fully-fit, that is stronger evidence the ceiling is STRUCTURAL (the FBP self-supervision target itself caps N2I), which is the documented finding. (5) BUDGET: warm-start ep=3 (~130s) + 200 scans * 7.0s = 1400s + figure ~= 26 min... TOO LONG for 30-min wall. Correction: keep outer_wall=1400 but it is the WHOLE val-loop cap, and warm-start is separate; 130+1400 = 25.5 min + ~1 min figure = ~26.5 min < 30 min wall. Fits. (6) Loop continues; iter-3 self-dispatched on landing. Reserved levers: n_iter, pretrain_epochs, unet_c, lr, warm_start on/off.", "agent": "dual_domain_n2i-claude-agentic", "campaign": "search-20260703-01", "cfg_full": {"batch_size": 1, "grad_clip": 1.0, "lr": 0.001, "n_iter": 200, "optimizer": "adam", "outer_wall_s": 1400, "per_scene_s": null, "pretrain_epochs": 3, "pretrain_steps": 0, "rationale": "iter-2 SIX-BOX. (1) PRIOR: iter-1 hr=0.0 (val_rmse 0.00640 > baseline 0.00521 -> recon WORSE than 128-view sparse FBP), val_ssim=0.940, only 197/200 scans reconstructed because the outer_wall=900s cut the loop at per_scene=4.5s. Ceiling holds. (2) FAILURE MODE: N2I over-smooths -> recon RMSE above the sparse-FBP baseline; ALSO the per-scene budget was so tight (4.5s) that inner N2I steps were wall-clipped well below n_iter=200, so each val scan was UNDER-fit. (3) ONE KNOB: outer_wall_s 900 -> 1400 (per_scene 4.5s -> 7.0s). Everything else identical to iter-1. (4) HYPOTHESIS: giving each per-image N2I fit ~55% more wall lets n_iter=200 actually complete on all 200 scans; if the iter-1 hr=0 was partly under-fitting rather than pure over-smoothing, more inner steps should DROP val_rmse toward/below baseline (hr>0). If hr stays 0 even fully-fit, that is stronger evidence the ceiling is STRUCTURAL (the FBP self-supervision target itself caps N2I), which is the documented finding. (5) BUDGET: warm-start ep=3 (~130s) + 200 scans * 7.0s = 1400s + figure ~= 26 min... TOO LONG for 30-min wall. Correction: keep outer_wall=1400 but it is the WHOLE val-loop cap, and warm-start is separate; 130+1400 = 25.5 min + ~1 min figure = ~26.5 min < 30 min wall. Fits. (6) Loop continues; iter-3 self-dispatched on landing. Reserved levers: n_iter, pretrain_epochs, unet_c, lr, warm_start on/off.", "seed": 42, "train_n": 400, "unet_c": 16, "val_n": 200, "warm_start": true}, "challenge": "breast_ct", "change_class": "architecture", "git_commit": "671da566", "images": {"comparison": "runs/breast-ct-claude-agentic-dual-domain-n2i-search-20260703-01/iterations/iter-0002/comparison.png", "test_showcase": null, "valtest_showcase": null}, "iter": 2, "kept": false, "metrics": {"headroom": 0.0, "headroom_std": 0.0, "val_psnr": 34.570220947265625, "val_psnr_std": 1.0140963157926, "val_rmse": 0.006381071172654629, "val_rmse_std": 0.0007240327803353278, "val_ssim": 0.9415791034698486, "val_ssim_std": 0.012192914807934399}, "model": "claude-opus-4-8-1m", "obs_path": "breast-ct-claude-agentic-dual-domain-n2i-search-20260703-01/iterations/iter-0002/observation.json", "obs_sha1": "7532a5544dd7ed0991edc814ecbdfe76db646f79", "params_M": 0.465762, "params_source": "observation", "rationale": "dual_domain_n2i-claude-agentic: warm_start=True, pretrain_epochs=3, pretrain_steps=0, n_iter=200, grad_clip=1.0, outer_wall_s=1400, per_scene_s=None, batch_size=1, lr=0.001, optimizer=adam, unet_c=16, train_n=400, val_n=200, seed=42, rationale=iter-2 SIX-BOX. (1) PRIOR: iter-1 hr=0.0 (val_rmse 0.00640 > baseline 0.00521 -> recon WORSE than 128-view sparse FBP), val_ssim=0.940, only 197/200 scans reconstructed because the outer_wall=900s cut the loop at per_scene=4.5s. Ceiling holds. (2) FAILURE MODE: N2I over-smooths -> recon RMSE above the sparse-FBP baseline; ALSO the per-scene budget was so tight (4.5s) that inner N2I steps were wall-clipped well below n_iter=200, so each val scan was UNDER-fit. (3) ONE KNOB: outer_wall_s 900 -> 1400 (per_scene 4.5s -> 7.0s). Everything else identical to iter-1. (4) HYPOTHESIS: giving each per-image N2I fit ~55% more wall lets n_iter=200 actually complete on all 200 scans; if the iter-1 hr=0 was partly under-fitting rather than pure over-smoothing, more inner steps should DROP val_rmse toward/below baseline (hr>0). If hr stays 0 even fully-fit, that is stronger evidence the ceiling is STRUCTURAL (the FBP self-supervision target itself caps N2I), which is the documented finding. (5) BUDGET: warm-start ep=3 (~130s) + 200 scans * 7.0s = 1400s + figure ~= 26 min... TOO LONG for 30-min wall. Correction: keep outer_wall=1400 but it is the WHOLE val-loop cap, and warm-start is separate; 130+1400 = 25.5 min + ~1 min figure = ~26.5 min < 30 min wall. Fits. (6) Loop continues; iter-3 self-dispatched on landing. Reserved levers: n_iter, pretrain_epochs, unet_c, lr, warm_start on/off.", "run_id": "breast-ct-claude-agentic-dual-domain-n2i-search-20260703-01", "runtime": {"elapsed_s": 1573.8909714221954}, "schema_version": 3, "solver_key": "dual-domain-n2i", "solver_name": "DD-UNet N2I (per-image)", "split": {"train_n": 400, "val_n": 198}, "status": "discard", "ts": "2026-07-05T17:41:02Z"}
{"advice_for_others": "dual_domain_n2i-claude-agentic: warm_start=True, pretrain_epochs=3, pretrain_steps=0, n_iter=200, grad_clip=1.0, outer_wall_s=1400, per_scene_s=None, batch_size=1, lr=0.001, optimizer=adam, unet_c=32, train_n=400, val_n=200, seed=42, rationale=iter-3 SIX-BOX. (1) PRIOR: iter-2 hr=0.0, val_rmse=0.00638 (baseline 0.00521), val_ssim=0.942, 198/200 scans -- essentially IDENTICAL to iter-1's 0.00640 despite +55% per-scene budget (7.0s vs 4.5s). So MORE inner N2I optimization does NOT lower RMSE: the iter-1 plateau was NOT under-fitting. (2) FAILURE MODE: structural over-smoothing -- the N2I self-supervision target (128-view FBP split into two half-view subsets) is itself too poor to push recon RMSE below the full-view sparse FBP baseline, regardless of how long each scan is fit. (3) ONE KNOB: unet_c 16 -> 32 (both denoisers; ~4x params, 0.466M -> ~1.86M). Everything else identical to iter-2. (4) HYPOTHESIS: a higher-capacity denoiser pair is more expressive and MIGHT sharpen edges the c=16 net blurred; if hr rises above 0 that identifies capacity as the bottleneck. More likely (per the documented ceiling) the extra capacity just fits the noisy FBP target more faithfully and hr STAYS 0, showing capacity is not the limiter -- the SUPERVISION TARGET is. (5) BUDGET: c=32 is ~2-3x slower per step so per_scene=7.0s fits fewer inner iters, but warm-start ep=3 + 200*7.0s loop + figure ~= 26 min < 30-min wall. (6) Loop continues; iter-4 self-dispatched. Reserved levers: warm_start off (pure per-image), pretrain_epochs, lr, n_iter early-stop, unet_c=8.", "agent": "dual_domain_n2i-claude-agentic", "campaign": "search-20260703-01", "cfg_full": {"batch_size": 1, "grad_clip": 1.0, "lr": 0.001, "n_iter": 200, "optimizer": "adam", "outer_wall_s": 1400, "per_scene_s": null, "pretrain_epochs": 3, "pretrain_steps": 0, "rationale": "iter-3 SIX-BOX. (1) PRIOR: iter-2 hr=0.0, val_rmse=0.00638 (baseline 0.00521), val_ssim=0.942, 198/200 scans -- essentially IDENTICAL to iter-1's 0.00640 despite +55% per-scene budget (7.0s vs 4.5s). So MORE inner N2I optimization does NOT lower RMSE: the iter-1 plateau was NOT under-fitting. (2) FAILURE MODE: structural over-smoothing -- the N2I self-supervision target (128-view FBP split into two half-view subsets) is itself too poor to push recon RMSE below the full-view sparse FBP baseline, regardless of how long each scan is fit. (3) ONE KNOB: unet_c 16 -> 32 (both denoisers; ~4x params, 0.466M -> ~1.86M). Everything else identical to iter-2. (4) HYPOTHESIS: a higher-capacity denoiser pair is more expressive and MIGHT sharpen edges the c=16 net blurred; if hr rises above 0 that identifies capacity as the bottleneck. More likely (per the documented ceiling) the extra capacity just fits the noisy FBP target more faithfully and hr STAYS 0, showing capacity is not the limiter -- the SUPERVISION TARGET is. (5) BUDGET: c=32 is ~2-3x slower per step so per_scene=7.0s fits fewer inner iters, but warm-start ep=3 + 200*7.0s loop + figure ~= 26 min < 30-min wall. (6) Loop continues; iter-4 self-dispatched. Reserved levers: warm_start off (pure per-image), pretrain_epochs, lr, n_iter early-stop, unet_c=8.", "seed": 42, "train_n": 400, "unet_c": 32, "val_n": 200, "warm_start": true}, "challenge": "breast_ct", "change_class": "architecture", "git_commit": "671da566", "images": {"comparison": "runs/breast-ct-claude-agentic-dual-domain-n2i-search-20260703-01/iterations/iter-0003/comparison.png", "test_showcase": null, "valtest_showcase": null}, "iter": 3, "kept": false, "metrics": {"headroom": 0.0, "headroom_std": 0.0, "val_psnr": 34.35380554199219, "val_psnr_std": 0.9733159624987351, "val_rmse": 0.006542055867612362, "val_rmse_std": 0.0007011317246580042, "val_ssim": 0.9321907162666321, "val_ssim_std": 0.012482673001423666}, "model": "claude-opus-4-8-1m", "obs_path": "breast-ct-claude-agentic-dual-domain-n2i-search-20260703-01/iterations/iter-0003/observation.json", "obs_sha1": "a8c438a8a6ef5e034ef317bd9449176c06443bfa", "params_M": 1.856194, "params_source": "observation", "rationale": "dual_domain_n2i-claude-agentic: warm_start=True, pretrain_epochs=3, pretrain_steps=0, n_iter=200, grad_clip=1.0, outer_wall_s=1400, per_scene_s=None, batch_size=1, lr=0.001, optimizer=adam, unet_c=32, train_n=400, val_n=200, seed=42, rationale=iter-3 SIX-BOX. (1) PRIOR: iter-2 hr=0.0, val_rmse=0.00638 (baseline 0.00521), val_ssim=0.942, 198/200 scans -- essentially IDENTICAL to iter-1's 0.00640 despite +55% per-scene budget (7.0s vs 4.5s). So MORE inner N2I optimization does NOT lower RMSE: the iter-1 plateau was NOT under-fitting. (2) FAILURE MODE: structural over-smoothing -- the N2I self-supervision target (128-view FBP split into two half-view subsets) is itself too poor to push recon RMSE below the full-view sparse FBP baseline, regardless of how long each scan is fit. (3) ONE KNOB: unet_c 16 -> 32 (both denoisers; ~4x params, 0.466M -> ~1.86M). Everything else identical to iter-2. (4) HYPOTHESIS: a higher-capacity denoiser pair is more expressive and MIGHT sharpen edges the c=16 net blurred; if hr rises above 0 that identifies capacity as the bottleneck. More likely (per the documented ceiling) the extra capacity just fits the noisy FBP target more faithfully and hr STAYS 0, showing capacity is not the limiter -- the SUPERVISION TARGET is. (5) BUDGET: c=32 is ~2-3x slower per step so per_scene=7.0s fits fewer inner iters, but warm-start ep=3 + 200*7.0s loop + figure ~= 26 min < 30-min wall. (6) Loop continues; iter-4 self-dispatched. Reserved levers: warm_start off (pure per-image), pretrain_epochs, lr, n_iter early-stop, unet_c=8.", "run_id": "breast-ct-claude-agentic-dual-domain-n2i-search-20260703-01", "runtime": {"elapsed_s": 1594.559072971344}, "schema_version": 3, "solver_key": "dual-domain-n2i", "solver_name": "DD-UNet N2I (per-image)", "split": {"train_n": 400, "val_n": 196}, "status": "discard", "ts": "2026-07-05T18:40:33Z"}
