{"advice_for_others": "itnet_v2-claude-agentic: itnet_k=1, unet_c=32, itnet_alpha_init=0.0004, residual_learning=False, pretrain_lr=0.00025, pretrain_epochs=10, pretrain_patience=10, grad_clip=1.0, train_n=2400, val_n=200, seed=43, rationale=ITER-16 champion seed replicate (seed 43), ep=10 budget-safe. Champion c32/n2400/lr2.5e-4/alpha0.0004 hr0.8853. pretrain_epochs 15->10 (epochs proven dead: iter-14 ep15==ep30, loss floors ep~6; ep10 fully converges + fits budget on slow lme222 node where ep15 TIMEOUT'd twice). Seed replicate for mean+/-std.", "agent": "itnet_v2-claude-agentic", "campaign": "search-20260703-01", "cfg_full": {"grad_clip": 1.0, "itnet_alpha_init": 0.0004, "itnet_k": 1, "pretrain_epochs": 10, "pretrain_lr": 0.00025, "pretrain_patience": 10, "rationale": "ITER-16 champion seed replicate (seed 43), ep=10 budget-safe. Champion c32/n2400/lr2.5e-4/alpha0.0004 hr0.8853. pretrain_epochs 15->10 (epochs proven dead: iter-14 ep15==ep30, loss floors ep~6; ep10 fully converges + fits budget on slow lme222 node where ep15 TIMEOUT'd twice). Seed replicate for mean+/-std.", "residual_learning": false, "seed": 43, "train_n": 2400, "unet_c": 32, "val_n": 200}, "challenge": "breast_ct", "change_class": "architecture", "git_commit": "671da566", "images": {"comparison": "runs/breast-ct-claude-agentic-itnet-v2-search-20260703-01/iterations/iter-0016/comparison.png", "test_showcase": null, "valtest_showcase": null}, "iter": 16, "kept": true, "metrics": {"headroom": 0.8704600718065291, "headroom_std": 0.014587161806791312, "val_psnr": 54.07612228393555, "val_psnr_std": 1.5718254059094, "val_rmse": 0.0006754579371772707, "val_rmse_std": 0.00011576620508333184, "val_ssim": 0.9987436532974243, "val_ssim_std": 0.0004157211716896033}, "model": "claude-opus-4-8-1m", "obs_path": "breast-ct-claude-agentic-itnet-v2-search-20260703-01/iterations/iter-0016/observation.json", "obs_sha1": "78c1873f31275b778dd6551d53f69e77f56ff83f", "params_M": 0.928098, "params_source": "observation", "rationale": "itnet_v2-claude-agentic: itnet_k=1, unet_c=32, itnet_alpha_init=0.0004, residual_learning=False, pretrain_lr=0.00025, pretrain_epochs=10, pretrain_patience=10, grad_clip=1.0, train_n=2400, val_n=200, seed=43, rationale=ITER-16 champion seed replicate (seed 43), ep=10 budget-safe. Champion c32/n2400/lr2.5e-4/alpha0.0004 hr0.8853. pretrain_epochs 15->10 (epochs proven dead: iter-14 ep15==ep30, loss floors ep~6; ep10 fully converges + fits budget on slow lme222 node where ep15 TIMEOUT'd twice). Seed replicate for mean+/-std.", "run_id": "breast-ct-claude-agentic-itnet-v2-search-20260703-01", "runtime": {"elapsed_s": 817.7811608314514}, "schema_version": 3, "solver_key": "itnet-v2", "solver_name": "ITNet v2", "split": {"train_n": 400, "val_n": 200}, "status": "keep", "ts": "2026-07-04T22:28:51Z"}
{"advice_for_others": "itnet_v2-claude-agentic: itnet_k=1, unet_c=32, itnet_alpha_init=0.0004, residual_learning=False, pretrain_lr=0.00025, pretrain_epochs=10, pretrain_patience=10, grad_clip=1.0, train_n=2400, val_n=200, seed=44, rationale=ITER-17 champion seed replicate (seed 44). Champion c32/n2400/lr2.5e-4/alpha0.0004 hr0.8853. pretrain_epochs 15->10 for BUDGET-SAFETY on slow nodes (epochs proven dead: iter-14 showed ep15==ep30, loss floors by ep~6, so ep10 fully converges the denoiser -- scientifically equivalent for seed-variance). Seed replicate for mean+/-std.", "agent": "itnet_v2-claude-agentic", "campaign": "search-20260703-01", "cfg_full": {"grad_clip": 1.0, "itnet_alpha_init": 0.0004, "itnet_k": 1, "pretrain_epochs": 10, "pretrain_lr": 0.00025, "pretrain_patience": 10, "rationale": "ITER-17 champion seed replicate (seed 44). Champion c32/n2400/lr2.5e-4/alpha0.0004 hr0.8853. pretrain_epochs 15->10 for BUDGET-SAFETY on slow nodes (epochs proven dead: iter-14 showed ep15==ep30, loss floors by ep~6, so ep10 fully converges the denoiser -- scientifically equivalent for seed-variance). Seed replicate for mean+/-std.", "residual_learning": false, "seed": 44, "train_n": 2400, "unet_c": 32, "val_n": 200}, "challenge": "breast_ct", "change_class": "architecture", "git_commit": "671da566", "images": {"comparison": "runs/breast-ct-claude-agentic-itnet-v2-search-20260703-01/iterations/iter-0017/comparison.png", "test_showcase": null, "valtest_showcase": null}, "iter": 17, "kept": true, "metrics": {"headroom": 0.8754181592126662, "headroom_std": 0.01510084274369431, "val_psnr": 54.41510009765625, "val_psnr_std": 1.6731220529174526, "val_rmse": 0.000649605062790215, "val_rmse_std": 0.00011693937914760775, "val_ssim": 0.9988805651664734, "val_ssim_std": 0.0004027028978047622}, "model": "claude-opus-4-8-1m", "obs_path": "breast-ct-claude-agentic-itnet-v2-search-20260703-01/iterations/iter-0017/observation.json", "obs_sha1": "7dc53d348dcfa31389745290258516f652452dda", "params_M": 0.928098, "params_source": "observation", "rationale": "itnet_v2-claude-agentic: itnet_k=1, unet_c=32, itnet_alpha_init=0.0004, residual_learning=False, pretrain_lr=0.00025, pretrain_epochs=10, pretrain_patience=10, grad_clip=1.0, train_n=2400, val_n=200, seed=44, rationale=ITER-17 champion seed replicate (seed 44). Champion c32/n2400/lr2.5e-4/alpha0.0004 hr0.8853. pretrain_epochs 15->10 for BUDGET-SAFETY on slow nodes (epochs proven dead: iter-14 showed ep15==ep30, loss floors by ep~6, so ep10 fully converges the denoiser -- scientifically equivalent for seed-variance). Seed replicate for mean+/-std.", "run_id": "breast-ct-claude-agentic-itnet-v2-search-20260703-01", "runtime": {"elapsed_s": 993.142041683197}, "schema_version": 3, "solver_key": "itnet-v2", "solver_name": "ITNet v2", "split": {"train_n": 400, "val_n": 200}, "status": "keep", "ts": "2026-07-05T00:27:16Z"}
{"advice_for_others": "itnet_v2-claude-agentic: itnet_k=1, unet_c=32, itnet_alpha_init=0.0004, residual_learning=False, pretrain_lr=0.00025, pretrain_epochs=10, pretrain_patience=10, grad_clip=1.0, train_n=2400, val_n=200, seed=45, rationale=ITER-18 champion seed replicate (seed 45), ep=10 budget-safe. Champion c32/n2400/alpha0.0004 hr0.8853. Seed replicate for mean+/-std.", "agent": "itnet_v2-claude-agentic", "campaign": "search-20260703-01", "cfg_full": {"grad_clip": 1.0, "itnet_alpha_init": 0.0004, "itnet_k": 1, "pretrain_epochs": 10, "pretrain_lr": 0.00025, "pretrain_patience": 10, "rationale": "ITER-18 champion seed replicate (seed 45), ep=10 budget-safe. Champion c32/n2400/alpha0.0004 hr0.8853. Seed replicate for mean+/-std.", "residual_learning": false, "seed": 45, "train_n": 2400, "unet_c": 32, "val_n": 200}, "challenge": "breast_ct", "change_class": "architecture", "git_commit": "671da566", "images": {"comparison": "runs/breast-ct-claude-agentic-itnet-v2-search-20260703-01/iterations/iter-0018/comparison.png", "test_showcase": null, "valtest_showcase": null}, "iter": 18, "kept": true, "metrics": {"headroom": 0.8689090794455843, "headroom_std": 0.015644011745751498, "val_psnr": 53.97274398803711, "val_psnr_std": 1.6444322245086966, "val_rmse": 0.0006835452513769269, "val_rmse_std": 0.00012138928331109937, "val_ssim": 0.9987806677818298, "val_ssim_std": 0.0004394598136917365}, "model": "claude-opus-4-8-1m", "obs_path": "breast-ct-claude-agentic-itnet-v2-search-20260703-01/iterations/iter-0018/observation.json", "obs_sha1": "6fb2943997fee9977ccb21fadf86684b5bd3eb2d", "params_M": 0.928098, "params_source": "observation", "rationale": "itnet_v2-claude-agentic: itnet_k=1, unet_c=32, itnet_alpha_init=0.0004, residual_learning=False, pretrain_lr=0.00025, pretrain_epochs=10, pretrain_patience=10, grad_clip=1.0, train_n=2400, val_n=200, seed=45, rationale=ITER-18 champion seed replicate (seed 45), ep=10 budget-safe. Champion c32/n2400/alpha0.0004 hr0.8853. Seed replicate for mean+/-std.", "run_id": "breast-ct-claude-agentic-itnet-v2-search-20260703-01", "runtime": {"elapsed_s": 987.783055305481}, "schema_version": 3, "solver_key": "itnet-v2", "solver_name": "ITNet v2", "split": {"train_n": 400, "val_n": 200}, "status": "keep", "ts": "2026-07-05T01:26:44Z"}
{"advice_for_others": "itnet_v2-claude-agentic: itnet_k=1, unet_c=32, itnet_alpha_init=0.0004, residual_learning=False, pretrain_lr=0.00025, pretrain_epochs=10, pretrain_patience=10, grad_clip=1.0, train_n=2400, val_n=200, seed=46, rationale=ITER-19 champion seed replicate (seed 46), ep=10 budget-safe. Champion c32/n2400/alpha0.0004 hr0.8853. Seed replicate for mean+/-std.", "agent": "itnet_v2-claude-agentic", "campaign": "search-20260703-01", "cfg_full": {"grad_clip": 1.0, "itnet_alpha_init": 0.0004, "itnet_k": 1, "pretrain_epochs": 10, "pretrain_lr": 0.00025, "pretrain_patience": 10, "rationale": "ITER-19 champion seed replicate (seed 46), ep=10 budget-safe. Champion c32/n2400/alpha0.0004 hr0.8853. Seed replicate for mean+/-std.", "residual_learning": false, "seed": 46, "train_n": 2400, "unet_c": 32, "val_n": 200}, "challenge": "breast_ct", "change_class": "architecture", "git_commit": "671da566", "images": {"comparison": "runs/breast-ct-claude-agentic-itnet-v2-search-20260703-01/iterations/iter-0019/comparison.png", "test_showcase": null, "valtest_showcase": null}, "iter": 19, "kept": true, "metrics": {"headroom": 0.867249235527398, "headroom_std": 0.0136748666664457, "val_psnr": 53.86345672607422, "val_psnr_std": 1.474811625160753, "val_rmse": 0.0006922001484781504, "val_rmse_std": 0.00011172126975555722, "val_ssim": 0.9987461566925049, "val_ssim_std": 0.00042580668648420773}, "model": "claude-opus-4-8-1m", "obs_path": "breast-ct-claude-agentic-itnet-v2-search-20260703-01/iterations/iter-0019/observation.json", "obs_sha1": "c14c6c63a6de49a34e310da9ee8802b23d2085ad", "params_M": 0.928098, "params_source": "observation", "rationale": "itnet_v2-claude-agentic: itnet_k=1, unet_c=32, itnet_alpha_init=0.0004, residual_learning=False, pretrain_lr=0.00025, pretrain_epochs=10, pretrain_patience=10, grad_clip=1.0, train_n=2400, val_n=200, seed=46, rationale=ITER-19 champion seed replicate (seed 46), ep=10 budget-safe. Champion c32/n2400/alpha0.0004 hr0.8853. Seed replicate for mean+/-std.", "run_id": "breast-ct-claude-agentic-itnet-v2-search-20260703-01", "runtime": {"elapsed_s": 816.2464904785156}, "schema_version": 3, "solver_key": "itnet-v2", "solver_name": "ITNet v2", "split": {"train_n": 400, "val_n": 200}, "status": "keep", "ts": "2026-07-05T02:24:18Z"}
{"advice_for_others": "itnet_v2-claude-agentic: itnet_k=1, unet_c=32, itnet_alpha_init=0.0004, residual_learning=False, pretrain_lr=0.00025, pretrain_epochs=10, pretrain_patience=10, grad_clip=1.0, train_n=2400, val_n=200, seed=47, rationale=ITER-20 champion seed replicate (seed 47), FINAL, ep=10 budget-safe. Champion c32/n2400/alpha0.0004 hr0.8853. 5th seed replicate -> 20 valid iters + mean+/-std.", "agent": "itnet_v2-claude-agentic", "campaign": "search-20260703-01", "cfg_full": {"grad_clip": 1.0, "itnet_alpha_init": 0.0004, "itnet_k": 1, "pretrain_epochs": 10, "pretrain_lr": 0.00025, "pretrain_patience": 10, "rationale": "ITER-20 champion seed replicate (seed 47), FINAL, ep=10 budget-safe. Champion c32/n2400/alpha0.0004 hr0.8853. 5th seed replicate -> 20 valid iters + mean+/-std.", "residual_learning": false, "seed": 47, "train_n": 2400, "unet_c": 32, "val_n": 200}, "challenge": "breast_ct", "change_class": "architecture", "git_commit": "671da566", "images": {"comparison": "runs/breast-ct-claude-agentic-itnet-v2-search-20260703-01/iterations/iter-0020/comparison.png", "test_showcase": null, "valtest_showcase": null}, "iter": 20, "kept": true, "metrics": {"headroom": 0.836802569731752, "headroom_std": 0.01587760834989127, "val_psnr": 52.06993103027344, "val_psnr_std": 1.4059949613795297, "val_rmse": 0.0008509577019140124, "val_rmse_std": 0.00013293749171627205, "val_ssim": 0.9982295632362366, "val_ssim_std": 0.0005876789104515292}, "model": "claude-opus-4-8-1m", "obs_path": "breast-ct-claude-agentic-itnet-v2-search-20260703-01/iterations/iter-0020/observation.json", "obs_sha1": "d6008ccb79f404eb12f8afcc5d86b6ed1485ae96", "params_M": 0.928098, "params_source": "observation", "rationale": "itnet_v2-claude-agentic: itnet_k=1, unet_c=32, itnet_alpha_init=0.0004, residual_learning=False, pretrain_lr=0.00025, pretrain_epochs=10, pretrain_patience=10, grad_clip=1.0, train_n=2400, val_n=200, seed=47, rationale=ITER-20 champion seed replicate (seed 47), FINAL, ep=10 budget-safe. Champion c32/n2400/alpha0.0004 hr0.8853. 5th seed replicate -> 20 valid iters + mean+/-std.", "run_id": "breast-ct-claude-agentic-itnet-v2-search-20260703-01", "runtime": {"elapsed_s": 993.8962914943695}, "schema_version": 3, "solver_key": "itnet-v2", "solver_name": "ITNet v2", "split": {"train_n": 400, "val_n": 200}, "status": "keep", "ts": "2026-07-05T03:26:48Z"}
{"advice_for_others": "itnet_v3-claude-agentic: itnet_k=2, unet_c=16, alpha_init=0.0025734, lr=0.00021567, epochs=12, batch_size=2, train_n=400, val_n=200, grad_clip=1.0, max_train_s=1000, seed=42, rationale=iter-1 (breast-ct redo, search-20260703-01) FEASIBILITY. SIX-BOX: (1) no prior iter in THIS run; seed from the breast-ct TPE v3 winner (search-20260521-01 trial-18: itnet_k=2, unet_c=16, alpha_init=0.0025734, lr=0.00021567, batch_size=2, epochs=15 -> hr 0.7342 on the OLD 400-case val pool). (2) failure mode to guard: none observed yet; risk is the HARD 20-min train+score wall on the NEW split (train pool now 3600, val now 200 distinct cases) at 512^2/128-view. (3) ONE KNOB vs the TPE seed: train_n held at 400 (standard agentic per-iter train_n, NOT the full 3600) and epochs trimmed 15 -> 12 purely to guarantee the feasibility run lands inside 20 min while I measure per-epoch cost; all architecture knobs = TPE winner exactly. (4) HYPOTHESIS: itnet_k=2/unet_c=16 at lr=2.16e-4 reproduces near the TPE-winner headroom (target hr > 0.60) on the new val-200 split, confirming the architecture transfers to the redo split. FALSIFIER: hr < 0.40 or a crash/timeout => the new split or budget breaks the seed and iter-2 must fix the specific error. (5) BUDGET: 400 samples * 12 ep at batch_size=2 on itnet_k=2; max_train_s=1000 backstop fences a runaway inside the 30-min sbatch wall; measure elapsed to size epochs/train_n for iter-2. val = 200 distinct val_truth.h5 cases (val_n<=200), 256px inscribed-circle FOV (breast metric default). (6) do NOT return control mid-campaign; dispatch iter-2 myself once this lands.", "agent": "itnet_v3-claude-agentic", "campaign": "search-20260703-01", "cfg_full": {"alpha_init": 0.0025734, "batch_size": 2, "epochs": 12, "grad_clip": 1.0, "itnet_k": 2, "lr": 0.00021567, "max_train_s": 1000, "rationale": "iter-1 (breast-ct redo, search-20260703-01) FEASIBILITY. SIX-BOX: (1) no prior iter in THIS run; seed from the breast-ct TPE v3 winner (search-20260521-01 trial-18: itnet_k=2, unet_c=16, alpha_init=0.0025734, lr=0.00021567, batch_size=2, epochs=15 -> hr 0.7342 on the OLD 400-case val pool). (2) failure mode to guard: none observed yet; risk is the HARD 20-min train+score wall on the NEW split (train pool now 3600, val now 200 distinct cases) at 512^2/128-view. (3) ONE KNOB vs the TPE seed: train_n held at 400 (standard agentic per-iter train_n, NOT the full 3600) and epochs trimmed 15 -> 12 purely to guarantee the feasibility run lands inside 20 min while I measure per-epoch cost; all architecture knobs = TPE winner exactly. (4) HYPOTHESIS: itnet_k=2/unet_c=16 at lr=2.16e-4 reproduces near the TPE-winner headroom (target hr > 0.60) on the new val-200 split, confirming the architecture transfers to the redo split. FALSIFIER: hr < 0.40 or a crash/timeout => the new split or budget breaks the seed and iter-2 must fix the specific error. (5) BUDGET: 400 samples * 12 ep at batch_size=2 on itnet_k=2; max_train_s=1000 backstop fences a runaway inside the 30-min sbatch wall; measure elapsed to size epochs/train_n for iter-2. val = 200 distinct val_truth.h5 cases (val_n<=200), 256px inscribed-circle FOV (breast metric default). (6) do NOT return control mid-campaign; dispatch iter-2 myself once this lands.", "seed": 42, "train_n": 400, "unet_c": 16, "val_n": 200}, "challenge": "breast_ct", "change_class": "architecture", "git_commit": null, "images": {"comparison": "runs/breast-ct-claude-agentic-itnet-v3-search-20260703-01/iterations/iter-0001/comparison.png", "test_showcase": null, "valtest_showcase": null}, "iter": 1, "kept": true, "metrics": {"headroom": 0.7737431691768648, "headroom_std": 0.013818312803391932, "val_psnr": 49.23216247558594, "val_psnr_std": 0.993828897010215, "val_rmse": 0.001179767306894064, "val_rmse_std": 0.0001349077261268465, "val_ssim": 0.9956854581832886, "val_ssim_std": 0.0008914568735535111}, "model": "claude-opus-4-8-1m", "obs_path": "breast-ct-claude-agentic-itnet-v3-search-20260703-01/iterations/iter-0001/observation.json", "obs_sha1": "99fc559fd71eb4925fa517e89f07cdac1dee91e0", "params_M": 3.698994, "params_source": "observation", "rationale": "itnet_v3-claude-agentic: itnet_k=2, unet_c=16, alpha_init=0.0025734, lr=0.00021567, epochs=12, batch_size=2, train_n=400, val_n=200, grad_clip=1.0, max_train_s=1000, seed=42, rationale=iter-1 (breast-ct redo, search-20260703-01) FEASIBILITY. SIX-BOX: (1) no prior iter in THIS run; seed from the breast-ct TPE v3 winner (search-20260521-01 trial-18: itnet_k=2, unet_c=16, alpha_init=0.0025734, lr=0.00021567, batch_size=2, epochs=15 -> hr 0.7342 on the OLD 400-case val pool). (2) failure mode to guard: none observed yet; risk is the HARD 20-min train+score wall on the NEW split (train pool now 3600, val now 200 distinct cases) at 512^2/128-view. (3) ONE KNOB vs the TPE seed: train_n held at 400 (standard agentic per-iter train_n, NOT the full 3600) and epochs trimmed 15 -> 12 purely to guarantee the feasibility run lands inside 20 min while I measure per-epoch cost; all architecture knobs = TPE winner exactly. (4) HYPOTHESIS: itnet_k=2/unet_c=16 at lr=2.16e-4 reproduces near the TPE-winner headroom (target hr > 0.60) on the new val-200 split, confirming the architecture transfers to the redo split. FALSIFIER: hr < 0.40 or a crash/timeout => the new split or budget breaks the seed and iter-2 must fix the specific error. (5) BUDGET: 400 samples * 12 ep at batch_size=2 on itnet_k=2; max_train_s=1000 backstop fences a runaway inside the 30-min sbatch wall; measure elapsed to size epochs/train_n for iter-2. val = 200 distinct val_truth.h5 cases (val_n<=200), 256px inscribed-circle FOV (breast metric default). (6) do NOT return control mid-campaign; dispatch iter-2 myself once this lands.", "run_id": "breast-ct-claude-agentic-itnet-v3-search-20260703-01", "runtime": {"elapsed_s": 393.24546909332275}, "schema_version": 3, "solver_key": "itnet-v3", "solver_name": "ITNet v3", "split": {"train_n": 400, "val_n": 200}, "status": "keep", "ts": "2026-07-03T22:41:47Z"}
