{"advice_for_others": "param_efficient-claude-agentic: reg_type=bilateral, bilateral_on_top=False, proj_filter_on=False, n_iter=30, learnable_alpha=True, alpha_init=0.1, foe_n_filters=24, foe_kernel=7, foe_n_bumps=31, n_bf=1, bf_multiscale=True, bf_sigmas=[0.8, 1.6, 3.2], bf_kernel=7, bf_sigma_r=0.02, bf_gain_init=0.0, epochs=16, cosine_lr=True, lr=0.005, max_train_s=1080, batch_size=4, train_n=200, val_n=200, display_min=0.0, display_max=0.05, seed=43, rationale=iter-31 SEED REPLICATE 1/4 of the LOCKED CHAMPION (filtered-DC K30 + LPD-combine W4 + 3-scale bilateral POST-filter sigma_r=0.02, 195 params, seed42=0.6201). Post-filter fully tuned (3 scales optimal, sigma_r=0.02 optimal). ONE KNOB: seed 42->43; all else byte-for-byte the champion. HYPOTHESIS: hr near 0.6201 +- seed noise; 5-seed (42-46) mean+-std is the reported headline @ 195p, and check if the post-filter tightens the spread vs LPD-only 0.459+-0.029. BUDGET: identical to iter-28 (16ep ~1120s), max_train_s=1080, --time=00:30:00 -> 20-min comparable. SERIAL; recon saved., dc_mode=filtered, per_step_alpha=True, lpd_on=True, lpd_width=4, lpd_kernel=3, anisotropic_on_top=False, post_bilateral=True, post_n_bf=3, post_bf_kernel=7, post_bf_sigma_r=0.02", "agent": "param_efficient-claude-agentic", "campaign": "search-20260703-01", "cfg_full": {"alpha_init": 0.1, "anisotropic_on_top": false, "batch_size": 4, "bf_gain_init": 0.0, "bf_kernel": 7, "bf_multiscale": true, "bf_sigma_r": 0.02, "bf_sigmas": [0.8, 1.6, 3.2], "bilateral_on_top": false, "cosine_lr": true, "dc_mode": "filtered", "display_max": 0.05, "display_min": 0.0, "epochs": 16, "foe_kernel": 7, "foe_n_bumps": 31, "foe_n_filters": 24, "learnable_alpha": true, "lpd_kernel": 3, "lpd_on": true, "lpd_width": 4, "lr": 0.005, "max_train_s": 1080, "n_bf": 1, "n_iter": 30, "per_step_alpha": true, "post_bf_kernel": 7, "post_bf_sigma_r": 0.02, "post_bilateral": true, "post_n_bf": 3, "proj_filter_on": false, "rationale": "iter-31 SEED REPLICATE 1/4 of the LOCKED CHAMPION (filtered-DC K30 + LPD-combine W4 + 3-scale bilateral POST-filter sigma_r=0.02, 195 params, seed42=0.6201). Post-filter fully tuned (3 scales optimal, sigma_r=0.02 optimal). ONE KNOB: seed 42->43; all else byte-for-byte the champion. HYPOTHESIS: hr near 0.6201 +- seed noise; 5-seed (42-46) mean+-std is the reported headline @ 195p, and check if the post-filter tightens the spread vs LPD-only 0.459+-0.029. BUDGET: identical to iter-28 (16ep ~1120s), max_train_s=1080, --time=00:30:00 -> 20-min comparable. SERIAL; recon saved.", "reg_type": "bilateral", "seed": 43, "train_n": 200, "val_n": 200}, "challenge": "breast_ct", "change_class": "architecture", "git_commit": "671da566", "images": {"comparison": "runs/breast-ct-claude-agentic-param-efficient-search-20260703-01/iterations/iter-0031/comparison.png", "test_showcase": null, "valtest_showcase": null}, "iter": 31, "kept": true, "metrics": {"headroom": 0.5586011417279202, "headroom_std": 0.007188271609039349, "val_psnr": 43.427574157714844, "val_psnr_std": 0.6344556360154634, "val_rmse": 0.002301578875631094, "val_rmse_std": 0.00016492196053315895, "val_ssim": 0.9895534515380859, "val_ssim_std": 0.002313378582038849}, "model": "claude-opus-4-8-1m", "obs_path": "breast-ct-claude-agentic-param-efficient-search-20260703-01/iterations/iter-0031/observation.json", "obs_sha1": "e16f9db135403dac8e96f76c6d5fdee07f45af18", "params_M": 0.000195, "params_source": "observation", "rationale": "param_efficient-claude-agentic: reg_type=bilateral, bilateral_on_top=False, proj_filter_on=False, n_iter=30, learnable_alpha=True, alpha_init=0.1, foe_n_filters=24, foe_kernel=7, foe_n_bumps=31, n_bf=1, bf_multiscale=True, bf_sigmas=[0.8, 1.6, 3.2], bf_kernel=7, bf_sigma_r=0.02, bf_gain_init=0.0, epochs=16, cosine_lr=True, lr=0.005, max_train_s=1080, batch_size=4, train_n=200, val_n=200, display_min=0.0, display_max=0.05, seed=43, rationale=iter-31 SEED REPLICATE 1/4 of the LOCKED CHAMPION (filtered-DC K30 + LPD-combine W4 + 3-scale bilateral POST-filter sigma_r=0.02, 195 params, seed42=0.6201). Post-filter fully tuned (3 scales optimal, sigma_r=0.02 optimal). ONE KNOB: seed 42->43; all else byte-for-byte the champion. HYPOTHESIS: hr near 0.6201 +- seed noise; 5-seed (42-46) mean+-std is the reported headline @ 195p, and check if the post-filter tightens the spread vs LPD-only 0.459+-0.029. BUDGET: identical to iter-28 (16ep ~1120s), max_train_s=1080, --time=00:30:00 -> 20-min comparable. SERIAL; recon saved., dc_mode=filtered, per_step_alpha=True, lpd_on=True, lpd_width=4, lpd_kernel=3, anisotropic_on_top=False, post_bilateral=True, post_n_bf=3, post_bf_kernel=7, post_bf_sigma_r=0.02", "run_id": "breast-ct-claude-agentic-param-efficient-search-20260703-01", "runtime": {"elapsed_s": 1141.0900585651398}, "schema_version": 3, "solver_key": "param-efficient", "solver_name": "Param-efficient (evolved)", "split": {"train_n": 200, "val_n": 200}, "status": "keep", "ts": "2026-07-07T19:26:52Z"}
{"advice_for_others": "param_efficient-claude-agentic: reg_type=bilateral, bilateral_on_top=False, proj_filter_on=False, n_iter=30, learnable_alpha=True, alpha_init=0.1, foe_n_filters=24, foe_kernel=7, foe_n_bumps=31, n_bf=1, bf_multiscale=True, bf_sigmas=[0.8, 1.6, 3.2], bf_kernel=7, bf_sigma_r=0.02, bf_gain_init=0.0, epochs=16, cosine_lr=True, lr=0.005, max_train_s=1080, batch_size=4, train_n=200, val_n=200, display_min=0.0, display_max=0.05, seed=44, rationale=iter-32 SEED REPLICATE 2/4 of the LOCKED CHAMPION (filtered-DC K30 + LPD-combine W4 + 3-scale bilateral POST-filter sigma_r=0.02, 195 params, seed42=0.6201). Post-filter fully tuned (3 scales optimal, sigma_r=0.02 optimal). ONE KNOB: seed 42->44; all else byte-for-byte the champion. HYPOTHESIS: hr near 0.6201 +- seed noise; 5-seed (42-46) mean+-std is the reported headline @ 195p, and check if the post-filter tightens the spread vs LPD-only 0.459+-0.029. BUDGET: identical to iter-28 (16ep ~1120s), max_train_s=1080, --time=00:30:00 -> 20-min comparable. SERIAL; recon saved., dc_mode=filtered, per_step_alpha=True, lpd_on=True, lpd_width=4, lpd_kernel=3, anisotropic_on_top=False, post_bilateral=True, post_n_bf=3, post_bf_kernel=7, post_bf_sigma_r=0.02", "agent": "param_efficient-claude-agentic", "campaign": "search-20260703-01", "cfg_full": {"alpha_init": 0.1, "anisotropic_on_top": false, "batch_size": 4, "bf_gain_init": 0.0, "bf_kernel": 7, "bf_multiscale": true, "bf_sigma_r": 0.02, "bf_sigmas": [0.8, 1.6, 3.2], "bilateral_on_top": false, "cosine_lr": true, "dc_mode": "filtered", "display_max": 0.05, "display_min": 0.0, "epochs": 16, "foe_kernel": 7, "foe_n_bumps": 31, "foe_n_filters": 24, "learnable_alpha": true, "lpd_kernel": 3, "lpd_on": true, "lpd_width": 4, "lr": 0.005, "max_train_s": 1080, "n_bf": 1, "n_iter": 30, "per_step_alpha": true, "post_bf_kernel": 7, "post_bf_sigma_r": 0.02, "post_bilateral": true, "post_n_bf": 3, "proj_filter_on": false, "rationale": "iter-32 SEED REPLICATE 2/4 of the LOCKED CHAMPION (filtered-DC K30 + LPD-combine W4 + 3-scale bilateral POST-filter sigma_r=0.02, 195 params, seed42=0.6201). Post-filter fully tuned (3 scales optimal, sigma_r=0.02 optimal). ONE KNOB: seed 42->44; all else byte-for-byte the champion. HYPOTHESIS: hr near 0.6201 +- seed noise; 5-seed (42-46) mean+-std is the reported headline @ 195p, and check if the post-filter tightens the spread vs LPD-only 0.459+-0.029. BUDGET: identical to iter-28 (16ep ~1120s), max_train_s=1080, --time=00:30:00 -> 20-min comparable. SERIAL; recon saved.", "reg_type": "bilateral", "seed": 44, "train_n": 200, "val_n": 200}, "challenge": "breast_ct", "change_class": "architecture", "git_commit": "671da566", "images": {"comparison": "runs/breast-ct-claude-agentic-param-efficient-search-20260703-01/iterations/iter-0032/comparison.png", "test_showcase": null, "valtest_showcase": null}, "iter": 32, "kept": true, "metrics": {"headroom": 0.5592915582095396, "headroom_std": 0.007160102515959864, "val_psnr": 43.44116973876953, "val_psnr_std": 0.5248035733140086, "val_rmse": 0.002297978848218918, "val_rmse_std": 0.00013612421265289738, "val_ssim": 0.9908439517021179, "val_ssim_std": 0.0017366847424964958}, "model": "claude-opus-4-8-1m", "obs_path": "breast-ct-claude-agentic-param-efficient-search-20260703-01/iterations/iter-0032/observation.json", "obs_sha1": "32062567ac997c8a309a32957632bb98474265a7", "params_M": 0.000195, "params_source": "observation", "rationale": "param_efficient-claude-agentic: reg_type=bilateral, bilateral_on_top=False, proj_filter_on=False, n_iter=30, learnable_alpha=True, alpha_init=0.1, foe_n_filters=24, foe_kernel=7, foe_n_bumps=31, n_bf=1, bf_multiscale=True, bf_sigmas=[0.8, 1.6, 3.2], bf_kernel=7, bf_sigma_r=0.02, bf_gain_init=0.0, epochs=16, cosine_lr=True, lr=0.005, max_train_s=1080, batch_size=4, train_n=200, val_n=200, display_min=0.0, display_max=0.05, seed=44, rationale=iter-32 SEED REPLICATE 2/4 of the LOCKED CHAMPION (filtered-DC K30 + LPD-combine W4 + 3-scale bilateral POST-filter sigma_r=0.02, 195 params, seed42=0.6201). Post-filter fully tuned (3 scales optimal, sigma_r=0.02 optimal). ONE KNOB: seed 42->44; all else byte-for-byte the champion. HYPOTHESIS: hr near 0.6201 +- seed noise; 5-seed (42-46) mean+-std is the reported headline @ 195p, and check if the post-filter tightens the spread vs LPD-only 0.459+-0.029. BUDGET: identical to iter-28 (16ep ~1120s), max_train_s=1080, --time=00:30:00 -> 20-min comparable. SERIAL; recon saved., dc_mode=filtered, per_step_alpha=True, lpd_on=True, lpd_width=4, lpd_kernel=3, anisotropic_on_top=False, post_bilateral=True, post_n_bf=3, post_bf_kernel=7, post_bf_sigma_r=0.02", "run_id": "breast-ct-claude-agentic-param-efficient-search-20260703-01", "runtime": {"elapsed_s": 1197.916718006134}, "schema_version": 3, "solver_key": "param-efficient", "solver_name": "Param-efficient (evolved)", "split": {"train_n": 200, "val_n": 200}, "status": "keep", "ts": "2026-07-07T19:52:43Z"}
{"advice_for_others": "param_efficient-claude-agentic: reg_type=bilateral, bilateral_on_top=False, proj_filter_on=False, n_iter=30, learnable_alpha=True, alpha_init=0.1, foe_n_filters=24, foe_kernel=7, foe_n_bumps=31, n_bf=1, bf_multiscale=True, bf_sigmas=[0.8, 1.6, 3.2], bf_kernel=7, bf_sigma_r=0.02, bf_gain_init=0.0, epochs=16, cosine_lr=True, lr=0.005, max_train_s=1080, batch_size=4, train_n=200, val_n=200, display_min=0.0, display_max=0.05, seed=45, rationale=iter-33 SEED REPLICATE 3/4 of the LOCKED CHAMPION (filtered-DC K30 + LPD-combine W4 + 3-scale bilateral POST-filter sigma_r=0.02, 195 params, seed42=0.6201). Post-filter fully tuned (3 scales optimal, sigma_r=0.02 optimal). ONE KNOB: seed 42->45; all else byte-for-byte the champion. HYPOTHESIS: hr near 0.6201 +- seed noise; 5-seed (42-46) mean+-std is the reported headline @ 195p, and check if the post-filter tightens the spread vs LPD-only 0.459+-0.029. BUDGET: identical to iter-28 (16ep ~1120s), max_train_s=1080, --time=00:30:00 -> 20-min comparable. SERIAL; recon saved., dc_mode=filtered, per_step_alpha=True, lpd_on=True, lpd_width=4, lpd_kernel=3, anisotropic_on_top=False, post_bilateral=True, post_n_bf=3, post_bf_kernel=7, post_bf_sigma_r=0.02", "agent": "param_efficient-claude-agentic", "campaign": "search-20260703-01", "cfg_full": {"alpha_init": 0.1, "anisotropic_on_top": false, "batch_size": 4, "bf_gain_init": 0.0, "bf_kernel": 7, "bf_multiscale": true, "bf_sigma_r": 0.02, "bf_sigmas": [0.8, 1.6, 3.2], "bilateral_on_top": false, "cosine_lr": true, "dc_mode": "filtered", "display_max": 0.05, "display_min": 0.0, "epochs": 16, "foe_kernel": 7, "foe_n_bumps": 31, "foe_n_filters": 24, "learnable_alpha": true, "lpd_kernel": 3, "lpd_on": true, "lpd_width": 4, "lr": 0.005, "max_train_s": 1080, "n_bf": 1, "n_iter": 30, "per_step_alpha": true, "post_bf_kernel": 7, "post_bf_sigma_r": 0.02, "post_bilateral": true, "post_n_bf": 3, "proj_filter_on": false, "rationale": "iter-33 SEED REPLICATE 3/4 of the LOCKED CHAMPION (filtered-DC K30 + LPD-combine W4 + 3-scale bilateral POST-filter sigma_r=0.02, 195 params, seed42=0.6201). Post-filter fully tuned (3 scales optimal, sigma_r=0.02 optimal). ONE KNOB: seed 42->45; all else byte-for-byte the champion. HYPOTHESIS: hr near 0.6201 +- seed noise; 5-seed (42-46) mean+-std is the reported headline @ 195p, and check if the post-filter tightens the spread vs LPD-only 0.459+-0.029. BUDGET: identical to iter-28 (16ep ~1120s), max_train_s=1080, --time=00:30:00 -> 20-min comparable. SERIAL; recon saved.", "reg_type": "bilateral", "seed": 45, "train_n": 200, "val_n": 200}, "challenge": "breast_ct", "change_class": "architecture", "git_commit": "671da566", "images": {"comparison": "runs/breast-ct-claude-agentic-param-efficient-search-20260703-01/iterations/iter-0033/comparison.png", "test_showcase": null, "valtest_showcase": null}, "iter": 33, "kept": false, "metrics": {"headroom": 0.0, "headroom_std": 0.002688503061055252, "val_psnr": 35.514408111572266, "val_psnr_std": 0.682120011093462, "val_rmse": 0.005723797250539064, "val_rmse_std": 0.00042430401676941054, "val_ssim": 0.969373881816864, "val_ssim_std": 0.004204671298061404}, "model": "claude-opus-4-8-1m", "obs_path": "breast-ct-claude-agentic-param-efficient-search-20260703-01/iterations/iter-0033/observation.json", "obs_sha1": "d058342c56ff6cae11b2696356f85180b01f6bfb", "params_M": 0.000195, "params_source": "observation", "rationale": "param_efficient-claude-agentic: reg_type=bilateral, bilateral_on_top=False, proj_filter_on=False, n_iter=30, learnable_alpha=True, alpha_init=0.1, foe_n_filters=24, foe_kernel=7, foe_n_bumps=31, n_bf=1, bf_multiscale=True, bf_sigmas=[0.8, 1.6, 3.2], bf_kernel=7, bf_sigma_r=0.02, bf_gain_init=0.0, epochs=16, cosine_lr=True, lr=0.005, max_train_s=1080, batch_size=4, train_n=200, val_n=200, display_min=0.0, display_max=0.05, seed=45, rationale=iter-33 SEED REPLICATE 3/4 of the LOCKED CHAMPION (filtered-DC K30 + LPD-combine W4 + 3-scale bilateral POST-filter sigma_r=0.02, 195 params, seed42=0.6201). Post-filter fully tuned (3 scales optimal, sigma_r=0.02 optimal). ONE KNOB: seed 42->45; all else byte-for-byte the champion. HYPOTHESIS: hr near 0.6201 +- seed noise; 5-seed (42-46) mean+-std is the reported headline @ 195p, and check if the post-filter tightens the spread vs LPD-only 0.459+-0.029. BUDGET: identical to iter-28 (16ep ~1120s), max_train_s=1080, --time=00:30:00 -> 20-min comparable. SERIAL; recon saved., dc_mode=filtered, per_step_alpha=True, lpd_on=True, lpd_width=4, lpd_kernel=3, anisotropic_on_top=False, post_bilateral=True, post_n_bf=3, post_bf_kernel=7, post_bf_sigma_r=0.02", "run_id": "breast-ct-claude-agentic-param-efficient-search-20260703-01", "runtime": {"elapsed_s": 1156.968751192093}, "schema_version": 3, "solver_key": "param-efficient", "solver_name": "Param-efficient (evolved)", "split": {"train_n": 200, "val_n": 200}, "status": "discard", "ts": "2026-07-07T20:12:15Z"}
{"advice_for_others": "param_efficient-claude-agentic: reg_type=bilateral, bilateral_on_top=False, proj_filter_on=False, n_iter=30, learnable_alpha=True, alpha_init=0.1, foe_n_filters=24, foe_kernel=7, foe_n_bumps=31, n_bf=1, bf_multiscale=True, bf_sigmas=[0.8, 1.6, 3.2], bf_kernel=7, bf_sigma_r=0.02, bf_gain_init=0.0, epochs=16, cosine_lr=True, lr=0.005, max_train_s=1080, batch_size=4, train_n=200, val_n=200, display_min=0.0, display_max=0.05, seed=46, rationale=iter-34 SEED REPLICATE 4/4 of the LOCKED CHAMPION (filtered-DC K30 + LPD-combine W4 + 3-scale bilateral POST-filter sigma_r=0.02, 195 params, seed42=0.6201). Post-filter fully tuned (3 scales optimal, sigma_r=0.02 optimal). ONE KNOB: seed 42->46; all else byte-for-byte the champion. HYPOTHESIS: hr near 0.6201 +- seed noise; 5-seed (42-46) mean+-std is the reported headline @ 195p, and check if the post-filter tightens the spread vs LPD-only 0.459+-0.029. BUDGET: identical to iter-28 (16ep ~1120s), max_train_s=1080, --time=00:30:00 -> 20-min comparable. SERIAL; recon saved., dc_mode=filtered, per_step_alpha=True, lpd_on=True, lpd_width=4, lpd_kernel=3, anisotropic_on_top=False, post_bilateral=True, post_n_bf=3, post_bf_kernel=7, post_bf_sigma_r=0.02", "agent": "param_efficient-claude-agentic", "campaign": "search-20260703-01", "cfg_full": {"alpha_init": 0.1, "anisotropic_on_top": false, "batch_size": 4, "bf_gain_init": 0.0, "bf_kernel": 7, "bf_multiscale": true, "bf_sigma_r": 0.02, "bf_sigmas": [0.8, 1.6, 3.2], "bilateral_on_top": false, "cosine_lr": true, "dc_mode": "filtered", "display_max": 0.05, "display_min": 0.0, "epochs": 16, "foe_kernel": 7, "foe_n_bumps": 31, "foe_n_filters": 24, "learnable_alpha": true, "lpd_kernel": 3, "lpd_on": true, "lpd_width": 4, "lr": 0.005, "max_train_s": 1080, "n_bf": 1, "n_iter": 30, "per_step_alpha": true, "post_bf_kernel": 7, "post_bf_sigma_r": 0.02, "post_bilateral": true, "post_n_bf": 3, "proj_filter_on": false, "rationale": "iter-34 SEED REPLICATE 4/4 of the LOCKED CHAMPION (filtered-DC K30 + LPD-combine W4 + 3-scale bilateral POST-filter sigma_r=0.02, 195 params, seed42=0.6201). Post-filter fully tuned (3 scales optimal, sigma_r=0.02 optimal). ONE KNOB: seed 42->46; all else byte-for-byte the champion. HYPOTHESIS: hr near 0.6201 +- seed noise; 5-seed (42-46) mean+-std is the reported headline @ 195p, and check if the post-filter tightens the spread vs LPD-only 0.459+-0.029. BUDGET: identical to iter-28 (16ep ~1120s), max_train_s=1080, --time=00:30:00 -> 20-min comparable. SERIAL; recon saved.", "reg_type": "bilateral", "seed": 46, "train_n": 200, "val_n": 200}, "challenge": "breast_ct", "change_class": "architecture", "git_commit": "671da566", "images": {"comparison": "runs/breast-ct-claude-agentic-param-efficient-search-20260703-01/iterations/iter-0034/comparison.png", "test_showcase": null, "valtest_showcase": null}, "iter": 34, "kept": true, "metrics": {"headroom": 0.5468701789286962, "headroom_std": 0.006358515001936856, "val_psnr": 43.199745178222656, "val_psnr_std": 0.5198559838093897, "val_rmse": 0.0023627474438399076, "val_rmse_std": 0.00013824775434220145, "val_ssim": 0.9897221326828003, "val_ssim_std": 0.0018789269151480803}, "model": "claude-opus-4-8-1m", "obs_path": "breast-ct-claude-agentic-param-efficient-search-20260703-01/iterations/iter-0034/observation.json", "obs_sha1": "acf76bcb5c1877676cc2075c2ffca0316e1dc628", "params_M": 0.000195, "params_source": "observation", "rationale": "param_efficient-claude-agentic: reg_type=bilateral, bilateral_on_top=False, proj_filter_on=False, n_iter=30, learnable_alpha=True, alpha_init=0.1, foe_n_filters=24, foe_kernel=7, foe_n_bumps=31, n_bf=1, bf_multiscale=True, bf_sigmas=[0.8, 1.6, 3.2], bf_kernel=7, bf_sigma_r=0.02, bf_gain_init=0.0, epochs=16, cosine_lr=True, lr=0.005, max_train_s=1080, batch_size=4, train_n=200, val_n=200, display_min=0.0, display_max=0.05, seed=46, rationale=iter-34 SEED REPLICATE 4/4 of the LOCKED CHAMPION (filtered-DC K30 + LPD-combine W4 + 3-scale bilateral POST-filter sigma_r=0.02, 195 params, seed42=0.6201). Post-filter fully tuned (3 scales optimal, sigma_r=0.02 optimal). ONE KNOB: seed 42->46; all else byte-for-byte the champion. HYPOTHESIS: hr near 0.6201 +- seed noise; 5-seed (42-46) mean+-std is the reported headline @ 195p, and check if the post-filter tightens the spread vs LPD-only 0.459+-0.029. BUDGET: identical to iter-28 (16ep ~1120s), max_train_s=1080, --time=00:30:00 -> 20-min comparable. SERIAL; recon saved., dc_mode=filtered, per_step_alpha=True, lpd_on=True, lpd_width=4, lpd_kernel=3, anisotropic_on_top=False, post_bilateral=True, post_n_bf=3, post_bf_kernel=7, post_bf_sigma_r=0.02", "run_id": "breast-ct-claude-agentic-param-efficient-search-20260703-01", "runtime": {"elapsed_s": 1199.8089015483856}, "schema_version": 3, "solver_key": "param-efficient", "solver_name": "Param-efficient (evolved)", "split": {"train_n": 200, "val_n": 200}, "status": "keep", "ts": "2026-07-07T20:32:30Z"}
