{"advice_for_others": "dual_domain_bilateral_supervised-claude-agentic: proj_n_bf=1, img_n_bf=1, proj_kernel=3, proj_sx=0.01, proj_sy=0.3, proj_sr=0.0005, img_kernel=5, img_sx=0.5, img_sy=0.5, img_sr=0.02, epochs=10, batch_size=1, lr=0.005, optimizer=adam, lambda_neg=1.0, grad_clip=1.0, train_n=400, val_n=200, val_chunk=10, seed=42, rationale=iter-1 ONBOARDING dual_domain_bilateral_supervised (DD trainable-bilateral supervised L2: proj_dn(BF) -> FBP(128 views) -> img_dn(BF), MSE-vs-clean-phantom + lambda_neg negativity penalty; 6 trainable params) on re-split Breast-CT (train3600/val200/test200, seed20260703), scoring val=200. SIX-BOX: (1) PRIOR: none (first iter of this slug); references = OLD-split breast TPE bilateral-supervised best hr=0.263 (img_n_bf=7/img_kernel=7/lr~5.9e-3, different scoring), and sibling DD-UNet-supervised onboarding hr=0.809. (2) Failure: N/A onboarding; goal = does DD-BF-supervised run on the new breast val=200 split under HARD 20-min budget and CLEAR the sparse-view FBP baseline (hr>0)? (3) ONE KNOB: N/A baseline (solver CONFIG defaults: 1 BF/domain, img_kernel=5, lr=5e-3, ep=10; only added train_n/val_n=200/seed/val_chunk per protocol). (4) HYPOTHESIS: minimal 6-param DD-BF at ep=10/lr=5e-3 trains stably (grad_clip=1.0) and CLEARS the breast FBP baseline (hr>0), though far below the DD-UNet ceiling because a single BF/domain has tiny capacity; expect hr ~0.2-0.5. (5) BUDGET: breast uses ONE shared PYRO-NN projector (FBP batched, val_chunk=10 fine); BF forward is cheap; ep=10 + val=200 forward + figure fits well inside 20 min (30-min sbatch wall). (6) Loop continues; iter-2 dispatched on landing. Knobs reserved 2-5: img_n_bf (BF stack depth), img_kernel, epochs, lr, lambda_neg.", "agent": "dual_domain_bilateral_supervised-claude-agentic", "campaign": "search-20260703-01", "cfg_full": {"batch_size": 1, "epochs": 10, "grad_clip": 1.0, "img_kernel": 5, "img_n_bf": 1, "img_sr": 0.02, "img_sx": 0.5, "img_sy": 0.5, "lambda_neg": 1.0, "lr": 0.005, "optimizer": "adam", "proj_kernel": 3, "proj_n_bf": 1, "proj_sr": 0.0005, "proj_sx": 0.01, "proj_sy": 0.3, "rationale": "iter-1 ONBOARDING dual_domain_bilateral_supervised (DD trainable-bilateral supervised L2: proj_dn(BF) -> FBP(128 views) -> img_dn(BF), MSE-vs-clean-phantom + lambda_neg negativity penalty; 6 trainable params) on re-split Breast-CT (train3600/val200/test200, seed20260703), scoring val=200. SIX-BOX: (1) PRIOR: none (first iter of this slug); references = OLD-split breast TPE bilateral-supervised best hr=0.263 (img_n_bf=7/img_kernel=7/lr~5.9e-3, different scoring), and sibling DD-UNet-supervised onboarding hr=0.809. (2) Failure: N/A onboarding; goal = does DD-BF-supervised run on the new breast val=200 split under HARD 20-min budget and CLEAR the sparse-view FBP baseline (hr>0)? (3) ONE KNOB: N/A baseline (solver CONFIG defaults: 1 BF/domain, img_kernel=5, lr=5e-3, ep=10; only added train_n/val_n=200/seed/val_chunk per protocol). (4) HYPOTHESIS: minimal 6-param DD-BF at ep=10/lr=5e-3 trains stably (grad_clip=1.0) and CLEARS the breast FBP baseline (hr>0), though far below the DD-UNet ceiling because a single BF/domain has tiny capacity; expect hr ~0.2-0.5. (5) BUDGET: breast uses ONE shared PYRO-NN projector (FBP batched, val_chunk=10 fine); BF forward is cheap; ep=10 + val=200 forward + figure fits well inside 20 min (30-min sbatch wall). (6) Loop continues; iter-2 dispatched on landing. Knobs reserved 2-5: img_n_bf (BF stack depth), img_kernel, epochs, lr, lambda_neg.", "seed": 42, "train_n": 400, "val_chunk": 10, "val_n": 200}, "challenge": "breast_ct", "change_class": "architecture", "git_commit": "671da566", "images": {"comparison": "runs/breast-ct-claude-agentic-dual-domain-bilateral-supervised-search-20260703-01/iterations/iter-0001/comparison.png", "test_showcase": null, "valtest_showcase": null}, "iter": 1, "kept": true, "metrics": {"headroom": 0.21575135504616216, "headroom_std": 0.007489411745411647, "val_psnr": 38.435123443603516, "val_psnr_std": 0.5827092156723083, "val_rmse": 0.00408929493278265, "val_rmse_std": 0.0002671286436782556, "val_ssim": 0.9741824865341187, "val_ssim_std": 0.004122454714048271}, "model": "claude-opus-4-8-1m", "obs_path": "breast-ct-claude-agentic-dual-domain-bilateral-supervised-search-20260703-01/iterations/iter-0001/observation.json", "obs_sha1": "3916efbcc9ed92f231748d9248d30e6ede33951e", "params_M": 6e-06, "params_source": "observation", "rationale": "dual_domain_bilateral_supervised-claude-agentic: proj_n_bf=1, img_n_bf=1, proj_kernel=3, proj_sx=0.01, proj_sy=0.3, proj_sr=0.0005, img_kernel=5, img_sx=0.5, img_sy=0.5, img_sr=0.02, epochs=10, batch_size=1, lr=0.005, optimizer=adam, lambda_neg=1.0, grad_clip=1.0, train_n=400, val_n=200, val_chunk=10, seed=42, rationale=iter-1 ONBOARDING dual_domain_bilateral_supervised (DD trainable-bilateral supervised L2: proj_dn(BF) -> FBP(128 views) -> img_dn(BF), MSE-vs-clean-phantom + lambda_neg negativity penalty; 6 trainable params) on re-split Breast-CT (train3600/val200/test200, seed20260703), scoring val=200. SIX-BOX: (1) PRIOR: none (first iter of this slug); references = OLD-split breast TPE bilateral-supervised best hr=0.263 (img_n_bf=7/img_kernel=7/lr~5.9e-3, different scoring), and sibling DD-UNet-supervised onboarding hr=0.809. (2) Failure: N/A onboarding; goal = does DD-BF-supervised run on the new breast val=200 split under HARD 20-min budget and CLEAR the sparse-view FBP baseline (hr>0)? (3) ONE KNOB: N/A baseline (solver CONFIG defaults: 1 BF/domain, img_kernel=5, lr=5e-3, ep=10; only added train_n/val_n=200/seed/val_chunk per protocol). (4) HYPOTHESIS: minimal 6-param DD-BF at ep=10/lr=5e-3 trains stably (grad_clip=1.0) and CLEARS the breast FBP baseline (hr>0), though far below the DD-UNet ceiling because a single BF/domain has tiny capacity; expect hr ~0.2-0.5. (5) BUDGET: breast uses ONE shared PYRO-NN projector (FBP batched, val_chunk=10 fine); BF forward is cheap; ep=10 + val=200 forward + figure fits well inside 20 min (30-min sbatch wall). (6) Loop continues; iter-2 dispatched on landing. Knobs reserved 2-5: img_n_bf (BF stack depth), img_kernel, epochs, lr, lambda_neg.", "run_id": "breast-ct-claude-agentic-dual-domain-bilateral-supervised-search-20260703-01", "runtime": {"elapsed_s": 92.61492562294006}, "schema_version": 3, "solver_key": "dual-domain-bilateral-supervised", "solver_name": "DD-BF supervised L2", "split": {"train_n": 400, "val_n": 200}, "status": "keep", "ts": "2026-07-05T16:29:17Z"}
{"advice_for_others": "dual_domain_bilateral_supervised-claude-agentic: proj_n_bf=1, img_n_bf=3, proj_kernel=3, proj_sx=0.01, proj_sy=0.3, proj_sr=0.0005, img_kernel=5, img_sx=0.5, img_sy=0.5, img_sr=0.02, epochs=10, batch_size=1, lr=0.005, optimizer=adam, lambda_neg=1.0, grad_clip=1.0, train_n=400, val_n=200, val_chunk=10, seed=42, rationale=iter-2 dual_domain_bilateral_supervised, re-split Breast-CT val=200. SIX-BOX vs iter-1 (1BF/domain, hr=0.2158, ssim=0.9742, 93s). (1) PRIOR: onboarding cleared FBP baseline at hr=0.2158 but only 6 trainable params and 93s used of 20-min budget -> heavily capacity-starved; the OLD-split TPE best used img_n_bf=7 (7 chained image BFs) and reached hr=0.263. (2) Failure mode: a SINGLE image-domain bilateral has too small an effective receptive field to remove sparse-view streaks. (3) ONE KNOB: img_n_bf 1 -> 3 (3 chained image BFs = larger effective RF at +6 params; proj side/kernels/lr/epochs unchanged). (4) HYPOTHESIS: chaining 3 image BFs (Wagner 2022 cascade) enlarges the effective receptive field and lifts hr above 0.2158 toward ~0.24-0.27, because the OLD-split TPE found deep image BF stacks strongly beneficial; params ~12 still tiny. (5) BUDGET: 3x image BF forward is still cheap (BF kernels 5x5); << 20 min. (6) Loop continues; iter-3 pivots to img_n_bf deeper (->7) if this helps, else to img_kernel. Artifacts recon_raw.npz + model_ckpt.pt saved.", "agent": "dual_domain_bilateral_supervised-claude-agentic", "campaign": "search-20260703-01", "cfg_full": {"batch_size": 1, "epochs": 10, "grad_clip": 1.0, "img_kernel": 5, "img_n_bf": 3, "img_sr": 0.02, "img_sx": 0.5, "img_sy": 0.5, "lambda_neg": 1.0, "lr": 0.005, "optimizer": "adam", "proj_kernel": 3, "proj_n_bf": 1, "proj_sr": 0.0005, "proj_sx": 0.01, "proj_sy": 0.3, "rationale": "iter-2 dual_domain_bilateral_supervised, re-split Breast-CT val=200. SIX-BOX vs iter-1 (1BF/domain, hr=0.2158, ssim=0.9742, 93s). (1) PRIOR: onboarding cleared FBP baseline at hr=0.2158 but only 6 trainable params and 93s used of 20-min budget -> heavily capacity-starved; the OLD-split TPE best used img_n_bf=7 (7 chained image BFs) and reached hr=0.263. (2) Failure mode: a SINGLE image-domain bilateral has too small an effective receptive field to remove sparse-view streaks. (3) ONE KNOB: img_n_bf 1 -> 3 (3 chained image BFs = larger effective RF at +6 params; proj side/kernels/lr/epochs unchanged). (4) HYPOTHESIS: chaining 3 image BFs (Wagner 2022 cascade) enlarges the effective receptive field and lifts hr above 0.2158 toward ~0.24-0.27, because the OLD-split TPE found deep image BF stacks strongly beneficial; params ~12 still tiny. (5) BUDGET: 3x image BF forward is still cheap (BF kernels 5x5); << 20 min. (6) Loop continues; iter-3 pivots to img_n_bf deeper (->7) if this helps, else to img_kernel. Artifacts recon_raw.npz + model_ckpt.pt saved.", "seed": 42, "train_n": 400, "val_chunk": 10, "val_n": 200}, "challenge": "breast_ct", "change_class": "architecture", "git_commit": "671da566", "images": {"comparison": "runs/breast-ct-claude-agentic-dual-domain-bilateral-supervised-search-20260703-01/iterations/iter-0002/comparison.png", "test_showcase": null, "valtest_showcase": null}, "iter": 2, "kept": true, "metrics": {"headroom": 0.24307598716116474, "headroom_std": 0.008881255919882107, "val_psnr": 38.7431526184082, "val_psnr_std": 0.575408359969332, "val_rmse": 0.003946816548705101, "val_rmse_std": 0.0002547784819056525, "val_ssim": 0.9810682535171509, "val_ssim_std": 0.0034037800185827177}, "model": "claude-opus-4-8-1m", "obs_path": "breast-ct-claude-agentic-dual-domain-bilateral-supervised-search-20260703-01/iterations/iter-0002/observation.json", "obs_sha1": "ee790cca0e6af454dcbf94d5ef84f1d43d4ebd12", "params_M": 1.2e-05, "params_source": "observation", "rationale": "dual_domain_bilateral_supervised-claude-agentic: proj_n_bf=1, img_n_bf=3, proj_kernel=3, proj_sx=0.01, proj_sy=0.3, proj_sr=0.0005, img_kernel=5, img_sx=0.5, img_sy=0.5, img_sr=0.02, epochs=10, batch_size=1, lr=0.005, optimizer=adam, lambda_neg=1.0, grad_clip=1.0, train_n=400, val_n=200, val_chunk=10, seed=42, rationale=iter-2 dual_domain_bilateral_supervised, re-split Breast-CT val=200. SIX-BOX vs iter-1 (1BF/domain, hr=0.2158, ssim=0.9742, 93s). (1) PRIOR: onboarding cleared FBP baseline at hr=0.2158 but only 6 trainable params and 93s used of 20-min budget -> heavily capacity-starved; the OLD-split TPE best used img_n_bf=7 (7 chained image BFs) and reached hr=0.263. (2) Failure mode: a SINGLE image-domain bilateral has too small an effective receptive field to remove sparse-view streaks. (3) ONE KNOB: img_n_bf 1 -> 3 (3 chained image BFs = larger effective RF at +6 params; proj side/kernels/lr/epochs unchanged). (4) HYPOTHESIS: chaining 3 image BFs (Wagner 2022 cascade) enlarges the effective receptive field and lifts hr above 0.2158 toward ~0.24-0.27, because the OLD-split TPE found deep image BF stacks strongly beneficial; params ~12 still tiny. (5) BUDGET: 3x image BF forward is still cheap (BF kernels 5x5); << 20 min. (6) Loop continues; iter-3 pivots to img_n_bf deeper (->7) if this helps, else to img_kernel. Artifacts recon_raw.npz + model_ckpt.pt saved.", "run_id": "breast-ct-claude-agentic-dual-domain-bilateral-supervised-search-20260703-01", "runtime": {"elapsed_s": 161.02451992034912}, "schema_version": 3, "solver_key": "dual-domain-bilateral-supervised", "solver_name": "DD-BF supervised L2", "split": {"train_n": 400, "val_n": 200}, "status": "keep", "ts": "2026-07-05T16:33:02Z"}
{"advice_for_others": "dual_domain_bilateral_supervised-claude-agentic: proj_n_bf=1, img_n_bf=7, proj_kernel=3, proj_sx=0.01, proj_sy=0.3, proj_sr=0.0005, img_kernel=5, img_sx=0.5, img_sy=0.5, img_sr=0.02, epochs=10, batch_size=1, lr=0.005, optimizer=adam, lambda_neg=1.0, grad_clip=1.0, train_n=400, val_n=200, val_chunk=10, seed=42, rationale=iter-3 dual_domain_bilateral_supervised, re-split Breast-CT val=200. SIX-BOX vs BEST (iter-2 img_n_bf=3 hr=0.2431; iter-1 img_n_bf=1 hr=0.2158). (1) PRIOR: deepening the image BF stack is the lever -- 1->3 gave +0.027 hr; OLD-split TPE best used img_n_bf=7. (2) Failure: image effective RF still too small for sparse-view streaks at 3 BFs. (3) ONE KNOB: img_n_bf 3 -> 7 (proj/kernels/lr/epochs held). (4) HYPOTHESIS: 7 chained image BFs (TPE-favored depth) enlarge effective RF and lift hr above 0.2431 toward ~0.26; params ~24 still tiny. (5) BUDGET: 7 cheap 5x5 BF passes << 20 min. (6) iter-4 pivots to epochs/img_kernel if depth saturates. Artifacts saved.", "agent": "dual_domain_bilateral_supervised-claude-agentic", "campaign": "search-20260703-01", "cfg_full": {"batch_size": 1, "epochs": 10, "grad_clip": 1.0, "img_kernel": 5, "img_n_bf": 7, "img_sr": 0.02, "img_sx": 0.5, "img_sy": 0.5, "lambda_neg": 1.0, "lr": 0.005, "optimizer": "adam", "proj_kernel": 3, "proj_n_bf": 1, "proj_sr": 0.0005, "proj_sx": 0.01, "proj_sy": 0.3, "rationale": "iter-3 dual_domain_bilateral_supervised, re-split Breast-CT val=200. SIX-BOX vs BEST (iter-2 img_n_bf=3 hr=0.2431; iter-1 img_n_bf=1 hr=0.2158). (1) PRIOR: deepening the image BF stack is the lever -- 1->3 gave +0.027 hr; OLD-split TPE best used img_n_bf=7. (2) Failure: image effective RF still too small for sparse-view streaks at 3 BFs. (3) ONE KNOB: img_n_bf 3 -> 7 (proj/kernels/lr/epochs held). (4) HYPOTHESIS: 7 chained image BFs (TPE-favored depth) enlarge effective RF and lift hr above 0.2431 toward ~0.26; params ~24 still tiny. (5) BUDGET: 7 cheap 5x5 BF passes << 20 min. (6) iter-4 pivots to epochs/img_kernel if depth saturates. Artifacts saved.", "seed": 42, "train_n": 400, "val_chunk": 10, "val_n": 200}, "challenge": "breast_ct", "change_class": "architecture", "git_commit": "671da566", "images": {"comparison": "runs/breast-ct-claude-agentic-dual-domain-bilateral-supervised-search-20260703-01/iterations/iter-0003/comparison.png", "test_showcase": null, "valtest_showcase": null}, "iter": 3, "kept": true, "metrics": {"headroom": 0.2465722755139521, "headroom_std": 0.009056567709560648, "val_psnr": 38.783363342285156, "val_psnr_std": 0.5778759304687165, "val_rmse": 0.003928585909307003, "val_rmse_std": 0.00025476597950805155, "val_ssim": 0.9819187521934509, "val_ssim_std": 0.003310185625531243}, "model": "claude-opus-4-8-1m", "obs_path": "breast-ct-claude-agentic-dual-domain-bilateral-supervised-search-20260703-01/iterations/iter-0003/observation.json", "obs_sha1": "bee2491a0e4a0212aa2d99a248f627ee304c2fc6", "params_M": 2.4e-05, "params_source": "observation", "rationale": "dual_domain_bilateral_supervised-claude-agentic: proj_n_bf=1, img_n_bf=7, proj_kernel=3, proj_sx=0.01, proj_sy=0.3, proj_sr=0.0005, img_kernel=5, img_sx=0.5, img_sy=0.5, img_sr=0.02, epochs=10, batch_size=1, lr=0.005, optimizer=adam, lambda_neg=1.0, grad_clip=1.0, train_n=400, val_n=200, val_chunk=10, seed=42, rationale=iter-3 dual_domain_bilateral_supervised, re-split Breast-CT val=200. SIX-BOX vs BEST (iter-2 img_n_bf=3 hr=0.2431; iter-1 img_n_bf=1 hr=0.2158). (1) PRIOR: deepening the image BF stack is the lever -- 1->3 gave +0.027 hr; OLD-split TPE best used img_n_bf=7. (2) Failure: image effective RF still too small for sparse-view streaks at 3 BFs. (3) ONE KNOB: img_n_bf 3 -> 7 (proj/kernels/lr/epochs held). (4) HYPOTHESIS: 7 chained image BFs (TPE-favored depth) enlarge effective RF and lift hr above 0.2431 toward ~0.26; params ~24 still tiny. (5) BUDGET: 7 cheap 5x5 BF passes << 20 min. (6) iter-4 pivots to epochs/img_kernel if depth saturates. Artifacts saved.", "run_id": "breast-ct-claude-agentic-dual-domain-bilateral-supervised-search-20260703-01", "runtime": {"elapsed_s": 240.74256825447083}, "schema_version": 3, "solver_key": "dual-domain-bilateral-supervised", "solver_name": "DD-BF supervised L2", "split": {"train_n": 400, "val_n": 200}, "status": "keep", "ts": "2026-07-05T16:37:56Z"}
{"advice_for_others": "dual_domain_bilateral_supervised-claude-agentic: proj_n_bf=1, img_n_bf=7, proj_kernel=3, proj_sx=0.01, proj_sy=0.3, proj_sr=0.0005, img_kernel=5, img_sx=0.5, img_sy=0.5, img_sr=0.02, epochs=30, batch_size=1, lr=0.005, optimizer=adam, lambda_neg=1.0, grad_clip=1.0, train_n=400, val_n=200, val_chunk=10, seed=42, rationale=iter-4 dual_domain_bilateral_supervised, re-split Breast-CT val=200. SIX-BOX vs BEST (iter-3 img_n_bf=7/ep10 hr=0.2466). (1) PRIOR: BF-depth is now saturating -- img_n_bf 1->3 gave +0.027, 3->7 only +0.0035; every iter used ep=10 and <=~120s of the 20-min budget. (2) Failure mode: with 6-24 params but only 10 epochs, the tiny BF sigmas are likely UNDER-trained (few gradient passes over 400 scenes), not capacity-bound. (3) ONE KNOB: epochs 10 -> 30 (img_n_bf=7 held at best; lr/kernels/lambda_neg unchanged). (4) HYPOTHESIS: tripling epochs lets the BF sigmas converge further and lifts hr above 0.2466 toward ~0.26-0.28, because the sibling DD-UNet showed epochs was its dominant monotone lever and budget is nearly untouched. If flat, BF fit is saturated and iter-5 pivots to lr or img_kernel. (5) BUDGET: 3x ep at ~93s/10ep base -> ~280s, well inside 20 min. (6) Loop continues. Artifacts saved.", "agent": "dual_domain_bilateral_supervised-claude-agentic", "campaign": "search-20260703-01", "cfg_full": {"batch_size": 1, "epochs": 30, "grad_clip": 1.0, "img_kernel": 5, "img_n_bf": 7, "img_sr": 0.02, "img_sx": 0.5, "img_sy": 0.5, "lambda_neg": 1.0, "lr": 0.005, "optimizer": "adam", "proj_kernel": 3, "proj_n_bf": 1, "proj_sr": 0.0005, "proj_sx": 0.01, "proj_sy": 0.3, "rationale": "iter-4 dual_domain_bilateral_supervised, re-split Breast-CT val=200. SIX-BOX vs BEST (iter-3 img_n_bf=7/ep10 hr=0.2466). (1) PRIOR: BF-depth is now saturating -- img_n_bf 1->3 gave +0.027, 3->7 only +0.0035; every iter used ep=10 and <=~120s of the 20-min budget. (2) Failure mode: with 6-24 params but only 10 epochs, the tiny BF sigmas are likely UNDER-trained (few gradient passes over 400 scenes), not capacity-bound. (3) ONE KNOB: epochs 10 -> 30 (img_n_bf=7 held at best; lr/kernels/lambda_neg unchanged). (4) HYPOTHESIS: tripling epochs lets the BF sigmas converge further and lifts hr above 0.2466 toward ~0.26-0.28, because the sibling DD-UNet showed epochs was its dominant monotone lever and budget is nearly untouched. If flat, BF fit is saturated and iter-5 pivots to lr or img_kernel. (5) BUDGET: 3x ep at ~93s/10ep base -> ~280s, well inside 20 min. (6) Loop continues. Artifacts saved.", "seed": 42, "train_n": 400, "val_chunk": 10, "val_n": 200}, "challenge": "breast_ct", "change_class": "architecture", "git_commit": "671da566", "images": {"comparison": "runs/breast-ct-claude-agentic-dual-domain-bilateral-supervised-search-20260703-01/iterations/iter-0004/comparison.png", "test_showcase": null, "valtest_showcase": null}, "iter": 4, "kept": true, "metrics": {"headroom": 0.2461631695894536, "headroom_std": 0.009068805527387964, "val_psnr": 38.77865219116211, "val_psnr_std": 0.5781887400953288, "val_rmse": 0.00393071910366416, "val_rmse_std": 0.00025503131449452403, "val_ssim": 0.9819562435150146, "val_ssim_std": 0.003308438970417058}, "model": "claude-opus-4-8-1m", "obs_path": "breast-ct-claude-agentic-dual-domain-bilateral-supervised-search-20260703-01/iterations/iter-0004/observation.json", "obs_sha1": "1ccb28b165983717973094ccfe421f36ec2760ec", "params_M": 2.4e-05, "params_source": "observation", "rationale": "dual_domain_bilateral_supervised-claude-agentic: proj_n_bf=1, img_n_bf=7, proj_kernel=3, proj_sx=0.01, proj_sy=0.3, proj_sr=0.0005, img_kernel=5, img_sx=0.5, img_sy=0.5, img_sr=0.02, epochs=30, batch_size=1, lr=0.005, optimizer=adam, lambda_neg=1.0, grad_clip=1.0, train_n=400, val_n=200, val_chunk=10, seed=42, rationale=iter-4 dual_domain_bilateral_supervised, re-split Breast-CT val=200. SIX-BOX vs BEST (iter-3 img_n_bf=7/ep10 hr=0.2466). (1) PRIOR: BF-depth is now saturating -- img_n_bf 1->3 gave +0.027, 3->7 only +0.0035; every iter used ep=10 and <=~120s of the 20-min budget. (2) Failure mode: with 6-24 params but only 10 epochs, the tiny BF sigmas are likely UNDER-trained (few gradient passes over 400 scenes), not capacity-bound. (3) ONE KNOB: epochs 10 -> 30 (img_n_bf=7 held at best; lr/kernels/lambda_neg unchanged). (4) HYPOTHESIS: tripling epochs lets the BF sigmas converge further and lifts hr above 0.2466 toward ~0.26-0.28, because the sibling DD-UNet showed epochs was its dominant monotone lever and budget is nearly untouched. If flat, BF fit is saturated and iter-5 pivots to lr or img_kernel. (5) BUDGET: 3x ep at ~93s/10ep base -> ~280s, well inside 20 min. (6) Loop continues. Artifacts saved.", "run_id": "breast-ct-claude-agentic-dual-domain-bilateral-supervised-search-20260703-01", "runtime": {"elapsed_s": 652.9278702735901}, "schema_version": 3, "solver_key": "dual-domain-bilateral-supervised", "solver_name": "DD-BF supervised L2", "split": {"train_n": 400, "val_n": 200}, "status": "keep", "ts": "2026-07-05T16:49:16Z"}
