{"advice_for_others": "dual_domain_bilateral_n2i-claude-agentic: warm_start=True, pretrain_epochs=2, train_n=400, n_iter=30, val_n=200, batch_size=1, grad_clip=1.0, lr=0.005, proj_n_bf=2, img_n_bf=1, outer_wall_s=1050, seed=42, rationale=iter-4 dual_domain_bilateral_n2i, ONE-KNOB: projection-domain BF DEPTH proj_n_bf 1->2 (vs iter-3 base: proj_n_bf=1, img_n_bf=1, n_iter=30). PRIOR trajectory: iter-1 (n_iter120) SSIM0.9567 recon_rmse9.80e-4 > base9.65e-4; iter-2 (img depth3) SSIM0.9560 WORSE; iter-3 (n_iter30 early-stop) SSIM0.9563 recon_rmse9.86e-4 ~= base9.84e-4 (early-stop reaches FBP PARITY but never beats it). All hr=0. So image-domain BF + optimization steps are exhausted; recon asymptotes to FBP from ABOVE. NEW AXIS: the projection (sinogram) domain has only ever been at depth 1. KNOB: proj_n_bf 1->2 (2 stacked projection BFs = extra 3 proj params). HYPOTHESIS: denoising the 64-view half-sinogram MORE before FBP could suppress the sparse-view streak noise that the image-domain BF cannot reach, so the N2I recon might finally dip recon_rmse BELOW baseline (hr>0). If hr stays 0, the projection domain is ALSO bounded by FBP on dense breast and the N2I ceiling is confirmed to hold across BOTH domains. FAILURE watched: findings.md warns projection BF that is too strong -> view inconsistency -> new artifacts (PSNR/SSIM drop). BUDGET: proj depth2 adds one sinogram unfold per half-pass; cheap; n_iter=30 -> ~1000s (iter-3 ran 1047s). ONE knob: proj_n_bf 1->2.", "agent": "dual_domain_bilateral_n2i-claude-agentic", "campaign": "search-20260703-01", "cfg_full": {"batch_size": 1, "grad_clip": 1.0, "img_n_bf": 1, "lr": 0.005, "n_iter": 30, "outer_wall_s": 1050, "pretrain_epochs": 2, "proj_n_bf": 2, "rationale": "iter-4 dual_domain_bilateral_n2i, ONE-KNOB: projection-domain BF DEPTH proj_n_bf 1->2 (vs iter-3 base: proj_n_bf=1, img_n_bf=1, n_iter=30). PRIOR trajectory: iter-1 (n_iter120) SSIM0.9567 recon_rmse9.80e-4 > base9.65e-4; iter-2 (img depth3) SSIM0.9560 WORSE; iter-3 (n_iter30 early-stop) SSIM0.9563 recon_rmse9.86e-4 ~= base9.84e-4 (early-stop reaches FBP PARITY but never beats it). All hr=0. So image-domain BF + optimization steps are exhausted; recon asymptotes to FBP from ABOVE. NEW AXIS: the projection (sinogram) domain has only ever been at depth 1. KNOB: proj_n_bf 1->2 (2 stacked projection BFs = extra 3 proj params). HYPOTHESIS: denoising the 64-view half-sinogram MORE before FBP could suppress the sparse-view streak noise that the image-domain BF cannot reach, so the N2I recon might finally dip recon_rmse BELOW baseline (hr>0). If hr stays 0, the projection domain is ALSO bounded by FBP on dense breast and the N2I ceiling is confirmed to hold across BOTH domains. FAILURE watched: findings.md warns projection BF that is too strong -> view inconsistency -> new artifacts (PSNR/SSIM drop). BUDGET: proj depth2 adds one sinogram unfold per half-pass; cheap; n_iter=30 -> ~1000s (iter-3 ran 1047s). ONE knob: proj_n_bf 1->2.", "seed": 42, "train_n": 400, "val_n": 200, "warm_start": true}, "challenge": "breast_ct", "change_class": "architecture", "git_commit": "671da566", "images": {"comparison": "runs/breast-ct-claude-agentic-dual-domain-bilateral-n2i-search-20260703-01/iterations/iter-0004/comparison.png", "test_showcase": null, "valtest_showcase": null}, "iter": 4, "kept": false, "metrics": {"headroom": 0.0, "headroom_std": 0.06391993910074234, "val_psnr": 38.393409729003906, "val_psnr_std": 0.9397286772727966, "val_rmse": 0.000985402031801641, "val_rmse_std": 0.00010454773291712627, "val_ssim": 0.9562934637069702, "val_ssim_std": 0.011027626693248749}, "model": "claude-opus-4-8-1m", "obs_path": "breast-ct-claude-agentic-dual-domain-bilateral-n2i-search-20260703-01/iterations/iter-0004/observation.json", "obs_sha1": "236f22fa08416ef48133cbb03041616ef5166851", "params_M": 9e-06, "params_source": "observation", "rationale": "dual_domain_bilateral_n2i-claude-agentic: warm_start=True, pretrain_epochs=2, train_n=400, n_iter=30, val_n=200, batch_size=1, grad_clip=1.0, lr=0.005, proj_n_bf=2, img_n_bf=1, outer_wall_s=1050, seed=42, rationale=iter-4 dual_domain_bilateral_n2i, ONE-KNOB: projection-domain BF DEPTH proj_n_bf 1->2 (vs iter-3 base: proj_n_bf=1, img_n_bf=1, n_iter=30). PRIOR trajectory: iter-1 (n_iter120) SSIM0.9567 recon_rmse9.80e-4 > base9.65e-4; iter-2 (img depth3) SSIM0.9560 WORSE; iter-3 (n_iter30 early-stop) SSIM0.9563 recon_rmse9.86e-4 ~= base9.84e-4 (early-stop reaches FBP PARITY but never beats it). All hr=0. So image-domain BF + optimization steps are exhausted; recon asymptotes to FBP from ABOVE. NEW AXIS: the projection (sinogram) domain has only ever been at depth 1. KNOB: proj_n_bf 1->2 (2 stacked projection BFs = extra 3 proj params). HYPOTHESIS: denoising the 64-view half-sinogram MORE before FBP could suppress the sparse-view streak noise that the image-domain BF cannot reach, so the N2I recon might finally dip recon_rmse BELOW baseline (hr>0). If hr stays 0, the projection domain is ALSO bounded by FBP on dense breast and the N2I ceiling is confirmed to hold across BOTH domains. FAILURE watched: findings.md warns projection BF that is too strong -> view inconsistency -> new artifacts (PSNR/SSIM drop). BUDGET: proj depth2 adds one sinogram unfold per half-pass; cheap; n_iter=30 -> ~1000s (iter-3 ran 1047s). ONE knob: proj_n_bf 1->2.", "run_id": "breast-ct-claude-agentic-dual-domain-bilateral-n2i-search-20260703-01", "runtime": {"elapsed_s": 1522.9979429244995}, "schema_version": 3, "solver_key": "dual-domain-bilateral-n2i", "solver_name": "DD-BF N2I (per-image)", "split": {"train_n": 400, "val_n": 200}, "status": "discard", "ts": "2026-07-05T19:06:46Z"}
{"advice_for_others": "dual_domain_bilateral_n2i-claude-agentic: warm_start=True, pretrain_epochs=2, train_n=400, n_iter=30, val_n=200, batch_size=1, grad_clip=1.0, lr=0.005, proj_n_bf=1, img_n_bf=1, img_sr=0.0005, outer_wall_s=900, seed=42, rationale=iter-5 dual_domain_bilateral_n2i, ONE-KNOB: image-domain BF RANGE sigma img_sr 0.02->0.0005 (much tighter intensity bandwidth -> edge-preserving). Back to proj_n_bf=1/img_n_bf=1/n_iter=30 (iter-4 proj depth2 was hr=0 SSIM0.9563 recon_rmse9.85e-4 ~= base9.84e-4 -> projection axis also FBP-bounded). TRAJECTORY so far (all hr=0): depth (img & proj), n_iter/early-stop all asymptote to FBP from above, never below. HYPOTHESIS: the failure is edge-BLINDNESS -- a wide range sigma (0.02) lets the BF average across fibroglandular tissue edges (over-smooth). A TIGHT img_sr=0.0005 (the old-split breast N2I champion value) makes the range kernel edge-preserving: it smooths flat noise but STOPS at intensity edges, so the recon could retain detail AND denoise -> first real shot at recon_rmse < baseline (hr>0). If STILL hr=0, edge-preservation via range sigma does not unlock breast N2I either. FAILURE watched: too-tight img_sr -> BF becomes near-identity (no denoising) -> recon = raw noisy FBP (SSIM/PSNR ~ baseline, not below). BUDGET: img_sr is a VALUE change, same kernel/unfold cost as iter-3 (1047s); outer_wall_s tightened 1050->900 to keep total safely under the 30-min sbatch wall (iter-4 proj-depth2 ran 25 min). ONE knob: img_sr 0.02->0.0005.", "agent": "dual_domain_bilateral_n2i-claude-agentic", "campaign": "search-20260703-01", "cfg_full": {"batch_size": 1, "grad_clip": 1.0, "img_n_bf": 1, "img_sr": 0.0005, "lr": 0.005, "n_iter": 30, "outer_wall_s": 900, "pretrain_epochs": 2, "proj_n_bf": 1, "rationale": "iter-5 dual_domain_bilateral_n2i, ONE-KNOB: image-domain BF RANGE sigma img_sr 0.02->0.0005 (much tighter intensity bandwidth -> edge-preserving). Back to proj_n_bf=1/img_n_bf=1/n_iter=30 (iter-4 proj depth2 was hr=0 SSIM0.9563 recon_rmse9.85e-4 ~= base9.84e-4 -> projection axis also FBP-bounded). TRAJECTORY so far (all hr=0): depth (img & proj), n_iter/early-stop all asymptote to FBP from above, never below. HYPOTHESIS: the failure is edge-BLINDNESS -- a wide range sigma (0.02) lets the BF average across fibroglandular tissue edges (over-smooth). A TIGHT img_sr=0.0005 (the old-split breast N2I champion value) makes the range kernel edge-preserving: it smooths flat noise but STOPS at intensity edges, so the recon could retain detail AND denoise -> first real shot at recon_rmse < baseline (hr>0). If STILL hr=0, edge-preservation via range sigma does not unlock breast N2I either. FAILURE watched: too-tight img_sr -> BF becomes near-identity (no denoising) -> recon = raw noisy FBP (SSIM/PSNR ~ baseline, not below). BUDGET: img_sr is a VALUE change, same kernel/unfold cost as iter-3 (1047s); outer_wall_s tightened 1050->900 to keep total safely under the 30-min sbatch wall (iter-4 proj-depth2 ran 25 min). ONE knob: img_sr 0.02->0.0005.", "seed": 42, "train_n": 400, "val_n": 200, "warm_start": true}, "challenge": "breast_ct", "change_class": "architecture", "git_commit": "671da566", "images": {"comparison": "runs/breast-ct-claude-agentic-dual-domain-bilateral-n2i-search-20260703-01/iterations/iter-0005/comparison.png", "test_showcase": null, "valtest_showcase": null}, "iter": 5, "kept": true, "metrics": {"headroom": 0.1256536179070813, "headroom_std": 0.10236502438783646, "val_psnr": 39.570655822753906, "val_psnr_std": 1.1851730346679688, "val_rmse": 0.0008605004986748099, "val_rmse_std": 0.0001194169235532172, "val_ssim": 0.9605477452278137, "val_ssim_std": 0.014120560139417648}, "model": "claude-opus-4-8-1m", "obs_path": "breast-ct-claude-agentic-dual-domain-bilateral-n2i-search-20260703-01/iterations/iter-0005/observation.json", "obs_sha1": "0333d8ab3655889507ba8ad91a5bbea42bf9bb70", "params_M": 6e-06, "params_source": "observation", "rationale": "dual_domain_bilateral_n2i-claude-agentic: warm_start=True, pretrain_epochs=2, train_n=400, n_iter=30, val_n=200, batch_size=1, grad_clip=1.0, lr=0.005, proj_n_bf=1, img_n_bf=1, img_sr=0.0005, outer_wall_s=900, seed=42, rationale=iter-5 dual_domain_bilateral_n2i, ONE-KNOB: image-domain BF RANGE sigma img_sr 0.02->0.0005 (much tighter intensity bandwidth -> edge-preserving). Back to proj_n_bf=1/img_n_bf=1/n_iter=30 (iter-4 proj depth2 was hr=0 SSIM0.9563 recon_rmse9.85e-4 ~= base9.84e-4 -> projection axis also FBP-bounded). TRAJECTORY so far (all hr=0): depth (img & proj), n_iter/early-stop all asymptote to FBP from above, never below. HYPOTHESIS: the failure is edge-BLINDNESS -- a wide range sigma (0.02) lets the BF average across fibroglandular tissue edges (over-smooth). A TIGHT img_sr=0.0005 (the old-split breast N2I champion value) makes the range kernel edge-preserving: it smooths flat noise but STOPS at intensity edges, so the recon could retain detail AND denoise -> first real shot at recon_rmse < baseline (hr>0). If STILL hr=0, edge-preservation via range sigma does not unlock breast N2I either. FAILURE watched: too-tight img_sr -> BF becomes near-identity (no denoising) -> recon = raw noisy FBP (SSIM/PSNR ~ baseline, not below). BUDGET: img_sr is a VALUE change, same kernel/unfold cost as iter-3 (1047s); outer_wall_s tightened 1050->900 to keep total safely under the 30-min sbatch wall (iter-4 proj-depth2 ran 25 min). ONE knob: img_sr 0.02->0.0005.", "run_id": "breast-ct-claude-agentic-dual-domain-bilateral-n2i-search-20260703-01", "runtime": {"elapsed_s": 1381.6844527721405}, "schema_version": 3, "solver_key": "dual-domain-bilateral-n2i", "solver_name": "DD-BF N2I (per-image)", "split": {"train_n": 400, "val_n": 200}, "status": "keep", "ts": "2026-07-05T19:31:30Z"}
{"advice_for_others": "dual_domain_bilateral_n2i-claude-agentic: warm_start=True, pretrain_epochs=2, train_n=400, n_iter=30, val_n=200, batch_size=1, grad_clip=1.0, lr=0.005, proj_n_bf=1, img_n_bf=1, img_sr=0.0005, proj_sr=0.0005, outer_wall_s=900, seed=42, rationale=iter-6 dual_domain_bilateral_n2i, ONE-KNOB: projection-domain BF RANGE sigma proj_sr 0.02->0.0005 (edge-preserving), keeping the iter-5 WINNER img_sr=0.0005. BREAKTHROUGH PRIOR: iter-5 (img_sr 0.02->0.0005) hr=0.1257, SSIM0.9605, PSNR39.57, recon_rmse8.61e-4 < baseline9.84e-4 -- the FIRST recon to BEAT the 128-view FBP. Root cause: a TIGHT range sigma makes the image BF EDGE-PRESERVING (smooths flat noise, stops at fibroglandular edges) instead of over-smoothing. Iters 1-4 (wide sr=0.02, depth, n_iter) all floored at hr=0 = confirmed the wide-range BF was the over-smoothing culprit, not the N2I loss per se. HYPOTHESIS: the SAME edge-preserving fix in the PROJECTION domain (proj_sr 0.02->0.0005) suppresses sparse-view streak noise in the sinogram before FBP WITHOUT the view-inconsistency that a strong-but-wide proj filter causes (findings.md: keep proj filtering gentle/soft -- a tight RANGE sigma is soft-edged in intensity, exactly the recommended lever) -> hr climbs above 0.1257. If hr drops vs iter-5, proj-domain edge-preservation induces view inconsistency and the image domain alone is the safe lever. BUDGET: value change only, ~1020s like iter-5. ONE knob: proj_sr 0.02->0.0005.", "agent": "dual_domain_bilateral_n2i-claude-agentic", "campaign": "search-20260703-01", "cfg_full": {"batch_size": 1, "grad_clip": 1.0, "img_n_bf": 1, "img_sr": 0.0005, "lr": 0.005, "n_iter": 30, "outer_wall_s": 900, "pretrain_epochs": 2, "proj_n_bf": 1, "proj_sr": 0.0005, "rationale": "iter-6 dual_domain_bilateral_n2i, ONE-KNOB: projection-domain BF RANGE sigma proj_sr 0.02->0.0005 (edge-preserving), keeping the iter-5 WINNER img_sr=0.0005. BREAKTHROUGH PRIOR: iter-5 (img_sr 0.02->0.0005) hr=0.1257, SSIM0.9605, PSNR39.57, recon_rmse8.61e-4 < baseline9.84e-4 -- the FIRST recon to BEAT the 128-view FBP. Root cause: a TIGHT range sigma makes the image BF EDGE-PRESERVING (smooths flat noise, stops at fibroglandular edges) instead of over-smoothing. Iters 1-4 (wide sr=0.02, depth, n_iter) all floored at hr=0 = confirmed the wide-range BF was the over-smoothing culprit, not the N2I loss per se. HYPOTHESIS: the SAME edge-preserving fix in the PROJECTION domain (proj_sr 0.02->0.0005) suppresses sparse-view streak noise in the sinogram before FBP WITHOUT the view-inconsistency that a strong-but-wide proj filter causes (findings.md: keep proj filtering gentle/soft -- a tight RANGE sigma is soft-edged in intensity, exactly the recommended lever) -> hr climbs above 0.1257. If hr drops vs iter-5, proj-domain edge-preservation induces view inconsistency and the image domain alone is the safe lever. BUDGET: value change only, ~1020s like iter-5. ONE knob: proj_sr 0.02->0.0005.", "seed": 42, "train_n": 400, "val_n": 200, "warm_start": true}, "challenge": "breast_ct", "change_class": "architecture", "git_commit": "671da566", "images": {"comparison": "runs/breast-ct-claude-agentic-dual-domain-bilateral-n2i-search-20260703-01/iterations/iter-0006/comparison.png", "test_showcase": null, "valtest_showcase": null}, "iter": 6, "kept": true, "metrics": {"headroom": 0.10028215356520953, "headroom_std": 0.09332339465618134, "val_psnr": 39.322200775146484, "val_psnr_std": 1.0907533168792725, "val_rmse": 0.0008854701882228255, "val_rmse_std": 0.00011348623957019299, "val_ssim": 0.9584285020828247, "val_ssim_std": 0.012977302074432373}, "model": "claude-opus-4-8-1m", "obs_path": "breast-ct-claude-agentic-dual-domain-bilateral-n2i-search-20260703-01/iterations/iter-0006/observation.json", "obs_sha1": "69905d7165edee1937284f777518fc55c693578d", "params_M": 6e-06, "params_source": "observation", "rationale": "dual_domain_bilateral_n2i-claude-agentic: warm_start=True, pretrain_epochs=2, train_n=400, n_iter=30, val_n=200, batch_size=1, grad_clip=1.0, lr=0.005, proj_n_bf=1, img_n_bf=1, img_sr=0.0005, proj_sr=0.0005, outer_wall_s=900, seed=42, rationale=iter-6 dual_domain_bilateral_n2i, ONE-KNOB: projection-domain BF RANGE sigma proj_sr 0.02->0.0005 (edge-preserving), keeping the iter-5 WINNER img_sr=0.0005. BREAKTHROUGH PRIOR: iter-5 (img_sr 0.02->0.0005) hr=0.1257, SSIM0.9605, PSNR39.57, recon_rmse8.61e-4 < baseline9.84e-4 -- the FIRST recon to BEAT the 128-view FBP. Root cause: a TIGHT range sigma makes the image BF EDGE-PRESERVING (smooths flat noise, stops at fibroglandular edges) instead of over-smoothing. Iters 1-4 (wide sr=0.02, depth, n_iter) all floored at hr=0 = confirmed the wide-range BF was the over-smoothing culprit, not the N2I loss per se. HYPOTHESIS: the SAME edge-preserving fix in the PROJECTION domain (proj_sr 0.02->0.0005) suppresses sparse-view streak noise in the sinogram before FBP WITHOUT the view-inconsistency that a strong-but-wide proj filter causes (findings.md: keep proj filtering gentle/soft -- a tight RANGE sigma is soft-edged in intensity, exactly the recommended lever) -> hr climbs above 0.1257. If hr drops vs iter-5, proj-domain edge-preservation induces view inconsistency and the image domain alone is the safe lever. BUDGET: value change only, ~1020s like iter-5. ONE knob: proj_sr 0.02->0.0005.", "run_id": "breast-ct-claude-agentic-dual-domain-bilateral-n2i-search-20260703-01", "runtime": {"elapsed_s": 1311.0988025665283}, "schema_version": 3, "solver_key": "dual-domain-bilateral-n2i", "solver_name": "DD-BF N2I (per-image)", "split": {"train_n": 400, "val_n": 200}, "status": "keep", "ts": "2026-07-05T19:57:40Z"}
