{"advice_for_others": "r2gaussian-claude-agentic: val_n=15, gs_n_gaussians=1024, gs_n_iter=130, gs_lr_pos=0.005, gs_lr_scale=0.01, gs_lr_amp=0.01, gs_lr_rot=0.01, gs_amp_init=0.01, gs_scale_init=0.04, gs_tv_weight=0.0001, gs_n_clip=0.05, gs_init_from_fbp=False, gs_render=raster, gs_ssim_weight=0.0, seed=42, train_n=0, rationale=iter-3 (search-20260703-01). ONE KNOB (capacity): gs_n_gaussians 512->1024. gs_n_iter set to 130 (down from 220) ONLY to keep the per-scene cost in budget at 2x Gaussians (1024 Gaussians ~506 ms/step -> 130 steps x 15 scenes ~987 s < 1080 in-solver wall < 1200 HARD); this is NOT a second free knob because the step axis is already proven SATURATED -- iter-1 (150 steps) SSIM 0.8032 vs iter-2 (220 steps) SSIM 0.8048 = +0.0016 FLAT, so any step count >=130 gives the same per-scene quality. The isolated variable is therefore CAPACITY. PRIOR NUMBERS: iter-1 hr=0 SSIM 0.8032 (512 G/150 it), iter-2 hr=0 SSIM 0.8048 (512 G/220 it, quality lever REFUTED flat), both recon PSNR ~20.2 vs 128-view FBP baseline PSNR 35.97 -> hr=0. All 15/15 scenes completed. FAILURE MODE: the 512-Gaussian anisotropic mixture is too COARSE a basis to represent dense breast soft tissue -> saturates near SSIM 0.80, far below the strong sparse-FBP baseline (documented ceiling, findings 2026-06-03). HYPOTHESIS (falsifiable in NUMBERS): if doubling the basis (512->1024 Gaussians) lifts SSIM materially above 0.8048 / RMSE below 0.03172, capacity is the binding limiter and more splats help. FALSIFIER: if SSIM stays ~0.80 flat (or drops), the basis-coarseness ceiling is confirmed as capacity-insensitive in this budget -- 1024 splats still land far below the FBP floor on PSNR/RMSE (hr=0). Prior findings (1024 G at 10k-40k iters -> hr=0) predict FLAT. val_n=15 HELD CONSTANT (gs_outer_wall_s=1080). TRAJECTORY: iter-1 0.8032 (512G) -> iter-2 0.8048 (512G, +steps flat) -> iter-3 capacity test at 1024G., gs_outer_wall_s=1080", "agent": "r2gaussian-claude-agentic", "campaign": "search-20260703-01", "cfg_full": {"gs_amp_init": 0.01, "gs_init_from_fbp": false, "gs_lr_amp": 0.01, "gs_lr_pos": 0.005, "gs_lr_rot": 0.01, "gs_lr_scale": 0.01, "gs_n_clip": 0.05, "gs_n_gaussians": 1024, "gs_n_iter": 130, "gs_outer_wall_s": 1080, "gs_render": "raster", "gs_scale_init": 0.04, "gs_ssim_weight": 0.0, "gs_tv_weight": 0.0001, "rationale": "iter-3 (search-20260703-01). ONE KNOB (capacity): gs_n_gaussians 512->1024. gs_n_iter set to 130 (down from 220) ONLY to keep the per-scene cost in budget at 2x Gaussians (1024 Gaussians ~506 ms/step -> 130 steps x 15 scenes ~987 s < 1080 in-solver wall < 1200 HARD); this is NOT a second free knob because the step axis is already proven SATURATED -- iter-1 (150 steps) SSIM 0.8032 vs iter-2 (220 steps) SSIM 0.8048 = +0.0016 FLAT, so any step count >=130 gives the same per-scene quality. The isolated variable is therefore CAPACITY. PRIOR NUMBERS: iter-1 hr=0 SSIM 0.8032 (512 G/150 it), iter-2 hr=0 SSIM 0.8048 (512 G/220 it, quality lever REFUTED flat), both recon PSNR ~20.2 vs 128-view FBP baseline PSNR 35.97 -> hr=0. All 15/15 scenes completed. FAILURE MODE: the 512-Gaussian anisotropic mixture is too COARSE a basis to represent dense breast soft tissue -> saturates near SSIM 0.80, far below the strong sparse-FBP baseline (documented ceiling, findings 2026-06-03). HYPOTHESIS (falsifiable in NUMBERS): if doubling the basis (512->1024 Gaussians) lifts SSIM materially above 0.8048 / RMSE below 0.03172, capacity is the binding limiter and more splats help. FALSIFIER: if SSIM stays ~0.80 flat (or drops), the basis-coarseness ceiling is confirmed as capacity-insensitive in this budget -- 1024 splats still land far below the FBP floor on PSNR/RMSE (hr=0). Prior findings (1024 G at 10k-40k iters -> hr=0) predict FLAT. val_n=15 HELD CONSTANT (gs_outer_wall_s=1080). TRAJECTORY: iter-1 0.8032 (512G) -> iter-2 0.8048 (512G, +steps flat) -> iter-3 capacity test at 1024G.", "seed": 42, "train_n": 0, "val_n": 15}, "challenge": "breast_ct", "change_class": "architecture", "git_commit": "671da566", "images": {"comparison": "runs/breast-ct-claude-agentic-r2gaussian-search-20260703-01/iterations/iter-0003/comparison.png", "test_showcase": null, "valtest_showcase": null}, "iter": 3, "kept": false, "metrics": {"headroom": 0.0, "headroom_std": 0.0, "val_psnr": 20.38434600830078, "val_psnr_std": 0.6299981287196477, "val_rmse": 0.03141670301556587, "val_rmse_std": 0.0023736621127928258, "val_ssim": 0.814484179019928, "val_ssim_std": 0.01670093607193835}, "model": "claude-opus-4-8-1m", "obs_path": "breast-ct-claude-agentic-r2gaussian-search-20260703-01/iterations/iter-0003/observation.json", "obs_sha1": "9e838997b68a1aec9a73ad23b7be6939694ae29d", "params_M": 0.006144, "params_source": "observation", "rationale": "r2gaussian-claude-agentic: val_n=15, gs_n_gaussians=1024, gs_n_iter=130, gs_lr_pos=0.005, gs_lr_scale=0.01, gs_lr_amp=0.01, gs_lr_rot=0.01, gs_amp_init=0.01, gs_scale_init=0.04, gs_tv_weight=0.0001, gs_n_clip=0.05, gs_init_from_fbp=False, gs_render=raster, gs_ssim_weight=0.0, seed=42, train_n=0, rationale=iter-3 (search-20260703-01). ONE KNOB (capacity): gs_n_gaussians 512->1024. gs_n_iter set to 130 (down from 220) ONLY to keep the per-scene cost in budget at 2x Gaussians (1024 Gaussians ~506 ms/step -> 130 steps x 15 scenes ~987 s < 1080 in-solver wall < 1200 HARD); this is NOT a second free knob because the step axis is already proven SATURATED -- iter-1 (150 steps) SSIM 0.8032 vs iter-2 (220 steps) SSIM 0.8048 = +0.0016 FLAT, so any step count >=130 gives the same per-scene quality. The isolated variable is therefore CAPACITY. PRIOR NUMBERS: iter-1 hr=0 SSIM 0.8032 (512 G/150 it), iter-2 hr=0 SSIM 0.8048 (512 G/220 it, quality lever REFUTED flat), both recon PSNR ~20.2 vs 128-view FBP baseline PSNR 35.97 -> hr=0. All 15/15 scenes completed. FAILURE MODE: the 512-Gaussian anisotropic mixture is too COARSE a basis to represent dense breast soft tissue -> saturates near SSIM 0.80, far below the strong sparse-FBP baseline (documented ceiling, findings 2026-06-03). HYPOTHESIS (falsifiable in NUMBERS): if doubling the basis (512->1024 Gaussians) lifts SSIM materially above 0.8048 / RMSE below 0.03172, capacity is the binding limiter and more splats help. FALSIFIER: if SSIM stays ~0.80 flat (or drops), the basis-coarseness ceiling is confirmed as capacity-insensitive in this budget -- 1024 splats still land far below the FBP floor on PSNR/RMSE (hr=0). Prior findings (1024 G at 10k-40k iters -> hr=0) predict FLAT. val_n=15 HELD CONSTANT (gs_outer_wall_s=1080). TRAJECTORY: iter-1 0.8032 (512G) -> iter-2 0.8048 (512G, +steps flat) -> iter-3 capacity test at 1024G., gs_outer_wall_s=1080", "run_id": "breast-ct-claude-agentic-r2gaussian-search-20260703-01", "runtime": {"elapsed_s": 995.3900299072266}, "schema_version": 3, "solver_key": "r2gaussian", "solver_name": "R2-Gaussian", "split": {"train_n": 400, "val_n": 15}, "status": "discard", "ts": "2026-07-05T18:16:45Z"}
{"advice_for_others": "r2gaussian-claude-agentic: val_n=15, gs_n_gaussians=1024, gs_n_iter=130, gs_lr_pos=0.005, gs_lr_scale=0.01, gs_lr_amp=0.01, gs_lr_rot=0.01, gs_amp_init=0.01, gs_scale_init=0.04, gs_tv_weight=0.0001, gs_n_clip=0.05, gs_init_from_fbp=True, gs_render=raster, gs_ssim_weight=0.0, seed=42, train_n=0, rationale=iter-4 (search-20260703-01). ONE KNOB (init): gs_init_from_fbp False->True (FBP warm-start: Gaussian positions sampled prop to FBP^2, amps seeded from FBP intensity clamped to gs_amp_init_max=0.05). Base = iter-3 config (1024 Gaussians / 130 it -- the run-best-SSIM point). init-only change, ~0 extra per-step cost. PRIOR NUMBERS: iter-1 hr=0 SSIM 0.8032 (512G/150it, cold), iter-2 hr=0 SSIM 0.8048 (512G/220it, quality lever FLAT +0.0016), iter-3 hr=0 SSIM 0.8145 (1024G/130it, capacity +0.0097 BEST). hr pinned 0 at every iter (recon PSNR ~20.4 vs 128-view FBP baseline PSNR 35.97). FAILURE MODE: cold uniform-random init wastes Gaussians on background; combined with the coarse basis, the per-scene recon lands far below the strong sparse-FBP baseline on PSNR/RMSE -> hr=0. Warm-start is the documented untested lever for the new split. HYPOTHESIS (falsifiable in NUMBERS): FBP warm-start anchors Gaussians on anatomy from iter 0, so SSIM lifts above iter-3 0.8145 (toward the FBP structure). FALSIFIER: if SSIM <= 0.8145 (no lift), warm-start does NOT rescue the coarse-basis ceiling on the new split -- consistent with findings 2026-06-03 (old-split v3 warm-start gave the SAME SSIM ~0.89 as cold, hr=0). hr expected 0 either way (even matching FBP PSNR 35.97 with a 1024-Gaussian mixture is implausible, and the metric is PSNR/RMSE-gated). val_n=15 HELD CONSTANT (gs_outer_wall_s=1080). BUDGET: init only -> same ~987s as iter-3 << 1080 wall. TRAJECTORY: iter-3 0.8145 (1024G cold, BEST) -> iter-4 warm-start test., gs_outer_wall_s=1080, gs_amp_init_max=0.05", "agent": "r2gaussian-claude-agentic", "campaign": "search-20260703-01", "cfg_full": {"gs_amp_init": 0.01, "gs_amp_init_max": 0.05, "gs_init_from_fbp": true, "gs_lr_amp": 0.01, "gs_lr_pos": 0.005, "gs_lr_rot": 0.01, "gs_lr_scale": 0.01, "gs_n_clip": 0.05, "gs_n_gaussians": 1024, "gs_n_iter": 130, "gs_outer_wall_s": 1080, "gs_render": "raster", "gs_scale_init": 0.04, "gs_ssim_weight": 0.0, "gs_tv_weight": 0.0001, "rationale": "iter-4 (search-20260703-01). ONE KNOB (init): gs_init_from_fbp False->True (FBP warm-start: Gaussian positions sampled prop to FBP^2, amps seeded from FBP intensity clamped to gs_amp_init_max=0.05). Base = iter-3 config (1024 Gaussians / 130 it -- the run-best-SSIM point). init-only change, ~0 extra per-step cost. PRIOR NUMBERS: iter-1 hr=0 SSIM 0.8032 (512G/150it, cold), iter-2 hr=0 SSIM 0.8048 (512G/220it, quality lever FLAT +0.0016), iter-3 hr=0 SSIM 0.8145 (1024G/130it, capacity +0.0097 BEST). hr pinned 0 at every iter (recon PSNR ~20.4 vs 128-view FBP baseline PSNR 35.97). FAILURE MODE: cold uniform-random init wastes Gaussians on background; combined with the coarse basis, the per-scene recon lands far below the strong sparse-FBP baseline on PSNR/RMSE -> hr=0. Warm-start is the documented untested lever for the new split. HYPOTHESIS (falsifiable in NUMBERS): FBP warm-start anchors Gaussians on anatomy from iter 0, so SSIM lifts above iter-3 0.8145 (toward the FBP structure). FALSIFIER: if SSIM <= 0.8145 (no lift), warm-start does NOT rescue the coarse-basis ceiling on the new split -- consistent with findings 2026-06-03 (old-split v3 warm-start gave the SAME SSIM ~0.89 as cold, hr=0). hr expected 0 either way (even matching FBP PSNR 35.97 with a 1024-Gaussian mixture is implausible, and the metric is PSNR/RMSE-gated). val_n=15 HELD CONSTANT (gs_outer_wall_s=1080). BUDGET: init only -> same ~987s as iter-3 << 1080 wall. TRAJECTORY: iter-3 0.8145 (1024G cold, BEST) -> iter-4 warm-start test.", "seed": 42, "train_n": 0, "val_n": 15}, "challenge": "breast_ct", "change_class": "architecture", "git_commit": "671da566", "images": {"comparison": "runs/breast-ct-claude-agentic-r2gaussian-search-20260703-01/iterations/iter-0004/comparison.png", "test_showcase": null, "valtest_showcase": null}, "iter": 4, "kept": false, "metrics": {"headroom": 0.0, "headroom_std": 0.0, "val_psnr": 22.500497817993164, "val_psnr_std": 0.4460151049672133, "val_rmse": 0.024623680859804153, "val_rmse_std": 0.0013344253752599342, "val_ssim": 0.8539265394210815, "val_ssim_std": 0.013658917211098623}, "model": "claude-opus-4-8-1m", "obs_path": "breast-ct-claude-agentic-r2gaussian-search-20260703-01/iterations/iter-0004/observation.json", "obs_sha1": "4379b2b77bfb72b6f61afc5baa8d20de1ff39783", "params_M": 0.006144, "params_source": "observation", "rationale": "r2gaussian-claude-agentic: val_n=15, gs_n_gaussians=1024, gs_n_iter=130, gs_lr_pos=0.005, gs_lr_scale=0.01, gs_lr_amp=0.01, gs_lr_rot=0.01, gs_amp_init=0.01, gs_scale_init=0.04, gs_tv_weight=0.0001, gs_n_clip=0.05, gs_init_from_fbp=True, gs_render=raster, gs_ssim_weight=0.0, seed=42, train_n=0, rationale=iter-4 (search-20260703-01). ONE KNOB (init): gs_init_from_fbp False->True (FBP warm-start: Gaussian positions sampled prop to FBP^2, amps seeded from FBP intensity clamped to gs_amp_init_max=0.05). Base = iter-3 config (1024 Gaussians / 130 it -- the run-best-SSIM point). init-only change, ~0 extra per-step cost. PRIOR NUMBERS: iter-1 hr=0 SSIM 0.8032 (512G/150it, cold), iter-2 hr=0 SSIM 0.8048 (512G/220it, quality lever FLAT +0.0016), iter-3 hr=0 SSIM 0.8145 (1024G/130it, capacity +0.0097 BEST). hr pinned 0 at every iter (recon PSNR ~20.4 vs 128-view FBP baseline PSNR 35.97). FAILURE MODE: cold uniform-random init wastes Gaussians on background; combined with the coarse basis, the per-scene recon lands far below the strong sparse-FBP baseline on PSNR/RMSE -> hr=0. Warm-start is the documented untested lever for the new split. HYPOTHESIS (falsifiable in NUMBERS): FBP warm-start anchors Gaussians on anatomy from iter 0, so SSIM lifts above iter-3 0.8145 (toward the FBP structure). FALSIFIER: if SSIM <= 0.8145 (no lift), warm-start does NOT rescue the coarse-basis ceiling on the new split -- consistent with findings 2026-06-03 (old-split v3 warm-start gave the SAME SSIM ~0.89 as cold, hr=0). hr expected 0 either way (even matching FBP PSNR 35.97 with a 1024-Gaussian mixture is implausible, and the metric is PSNR/RMSE-gated). val_n=15 HELD CONSTANT (gs_outer_wall_s=1080). BUDGET: init only -> same ~987s as iter-3 << 1080 wall. TRAJECTORY: iter-3 0.8145 (1024G cold, BEST) -> iter-4 warm-start test., gs_outer_wall_s=1080, gs_amp_init_max=0.05", "run_id": "breast-ct-claude-agentic-r2gaussian-search-20260703-01", "runtime": {"elapsed_s": 997.1118357181549}, "schema_version": 3, "solver_key": "r2gaussian", "solver_name": "R2-Gaussian", "split": {"train_n": 400, "val_n": 15}, "status": "discard", "ts": "2026-07-05T18:34:34Z"}
{"advice_for_others": "r2gaussian-claude-agentic: val_n=15, gs_n_gaussians=1024, gs_n_iter=130, gs_lr_pos=0.005, gs_lr_scale=0.01, gs_lr_amp=0.01, gs_lr_rot=0.01, gs_amp_init=0.01, gs_scale_init=0.04, gs_tv_weight=0.0001, gs_n_clip=0.05, gs_init_from_fbp=True, gs_render=raster, gs_ssim_weight=0.15, seed=42, train_n=0, rationale=iter-5 (search-20260703-01). ONE KNOB (loss-formulation): gs_ssim_weight 0.0->0.15 (add gs_ssim_weight*(1-SSIM(mu,fbp)) to the per-scene loss; the benchmark is SSIM-scored). Base = iter-4 BEST (warm-start ON, 1024 Gaussians / 130 it -- the run-best config). The SSIM term needs an FBP target, which warm-start provides. PRIOR NUMBERS: iter-1 0.8032 (cold 512G/150it), iter-2 0.8048 (512G/220it, steps FLAT), iter-3 0.8145 (1024G/130it, capacity +0.010), iter-4 0.8539 (warm-start, BEST, +0.039, PSNR 22.50). hr pinned 0 at EVERY iter -- even the best config (warm-start) sits PSNR 22.50 vs 128-view FBP baseline 35.97 (a 13.5 dB gap) -> hr=0. FAILURE MODE: the coarse anisotropic-Gaussian basis cannot reconstruct dense breast soft tissue near the strong sparse-FBP baseline; warm-start gave the biggest lift (it literally seeds from FBP) yet stays far below the FBP floor on the PSNR/RMSE-gated headroom. HYPOTHESIS (falsifiable in NUMBERS): a pure-L2 loss ignores the SSIM the metric rewards; adding an SSIM pull toward FBP structure lifts SSIM above iter-4 0.8539. FALSIFIER: if SSIM <= 0.8539 (no lift), the SSIM-loss lever is exhausted. hr expected 0 regardless (matching FBP PSNR 35.97 with a 1024-Gaussian mixture is implausible, and SSIM-weight typically TRADES PSNR DOWN -- the headroom gate is PSNR/RMSE-based, so it cannot move hr off 0). val_n=15 HELD CONSTANT (gs_outer_wall_s=1080). BUDGET: SSIM term = 1 cheap conv/step vs the dominating projection -> same ~990s as iter-4 << 1080 wall. TRAJECTORY: iter-4 0.8539 (warm-start, BEST) -> iter-5 SSIM-loss @0.15 test., gs_outer_wall_s=1080, gs_amp_init_max=0.05", "agent": "r2gaussian-claude-agentic", "campaign": "search-20260703-01", "cfg_full": {"gs_amp_init": 0.01, "gs_amp_init_max": 0.05, "gs_init_from_fbp": true, "gs_lr_amp": 0.01, "gs_lr_pos": 0.005, "gs_lr_rot": 0.01, "gs_lr_scale": 0.01, "gs_n_clip": 0.05, "gs_n_gaussians": 1024, "gs_n_iter": 130, "gs_outer_wall_s": 1080, "gs_render": "raster", "gs_scale_init": 0.04, "gs_ssim_weight": 0.15, "gs_tv_weight": 0.0001, "rationale": "iter-5 (search-20260703-01). ONE KNOB (loss-formulation): gs_ssim_weight 0.0->0.15 (add gs_ssim_weight*(1-SSIM(mu,fbp)) to the per-scene loss; the benchmark is SSIM-scored). Base = iter-4 BEST (warm-start ON, 1024 Gaussians / 130 it -- the run-best config). The SSIM term needs an FBP target, which warm-start provides. PRIOR NUMBERS: iter-1 0.8032 (cold 512G/150it), iter-2 0.8048 (512G/220it, steps FLAT), iter-3 0.8145 (1024G/130it, capacity +0.010), iter-4 0.8539 (warm-start, BEST, +0.039, PSNR 22.50). hr pinned 0 at EVERY iter -- even the best config (warm-start) sits PSNR 22.50 vs 128-view FBP baseline 35.97 (a 13.5 dB gap) -> hr=0. FAILURE MODE: the coarse anisotropic-Gaussian basis cannot reconstruct dense breast soft tissue near the strong sparse-FBP baseline; warm-start gave the biggest lift (it literally seeds from FBP) yet stays far below the FBP floor on the PSNR/RMSE-gated headroom. HYPOTHESIS (falsifiable in NUMBERS): a pure-L2 loss ignores the SSIM the metric rewards; adding an SSIM pull toward FBP structure lifts SSIM above iter-4 0.8539. FALSIFIER: if SSIM <= 0.8539 (no lift), the SSIM-loss lever is exhausted. hr expected 0 regardless (matching FBP PSNR 35.97 with a 1024-Gaussian mixture is implausible, and SSIM-weight typically TRADES PSNR DOWN -- the headroom gate is PSNR/RMSE-based, so it cannot move hr off 0). val_n=15 HELD CONSTANT (gs_outer_wall_s=1080). BUDGET: SSIM term = 1 cheap conv/step vs the dominating projection -> same ~990s as iter-4 << 1080 wall. TRAJECTORY: iter-4 0.8539 (warm-start, BEST) -> iter-5 SSIM-loss @0.15 test.", "seed": 42, "train_n": 0, "val_n": 15}, "challenge": "breast_ct", "change_class": "architecture", "git_commit": "671da566", "images": {"comparison": "runs/breast-ct-claude-agentic-r2gaussian-search-20260703-01/iterations/iter-0005/comparison.png", "test_showcase": null, "valtest_showcase": null}, "iter": 5, "kept": false, "metrics": {"headroom": 0.0, "headroom_std": 0.0, "val_psnr": 28.54726791381836, "val_psnr_std": 0.7007070809072475, "val_rmse": 0.012274800799787045, "val_rmse_std": 0.0009942375361250435, "val_ssim": 0.926371693611145, "val_ssim_std": 0.011958003452764371}, "model": "claude-opus-4-8-1m", "obs_path": "breast-ct-claude-agentic-r2gaussian-search-20260703-01/iterations/iter-0005/observation.json", "obs_sha1": "6e419c19428bd38e6dd20b85971dd913d1752a4b", "params_M": 0.006144, "params_source": "observation", "rationale": "r2gaussian-claude-agentic: val_n=15, gs_n_gaussians=1024, gs_n_iter=130, gs_lr_pos=0.005, gs_lr_scale=0.01, gs_lr_amp=0.01, gs_lr_rot=0.01, gs_amp_init=0.01, gs_scale_init=0.04, gs_tv_weight=0.0001, gs_n_clip=0.05, gs_init_from_fbp=True, gs_render=raster, gs_ssim_weight=0.15, seed=42, train_n=0, rationale=iter-5 (search-20260703-01). ONE KNOB (loss-formulation): gs_ssim_weight 0.0->0.15 (add gs_ssim_weight*(1-SSIM(mu,fbp)) to the per-scene loss; the benchmark is SSIM-scored). Base = iter-4 BEST (warm-start ON, 1024 Gaussians / 130 it -- the run-best config). The SSIM term needs an FBP target, which warm-start provides. PRIOR NUMBERS: iter-1 0.8032 (cold 512G/150it), iter-2 0.8048 (512G/220it, steps FLAT), iter-3 0.8145 (1024G/130it, capacity +0.010), iter-4 0.8539 (warm-start, BEST, +0.039, PSNR 22.50). hr pinned 0 at EVERY iter -- even the best config (warm-start) sits PSNR 22.50 vs 128-view FBP baseline 35.97 (a 13.5 dB gap) -> hr=0. FAILURE MODE: the coarse anisotropic-Gaussian basis cannot reconstruct dense breast soft tissue near the strong sparse-FBP baseline; warm-start gave the biggest lift (it literally seeds from FBP) yet stays far below the FBP floor on the PSNR/RMSE-gated headroom. HYPOTHESIS (falsifiable in NUMBERS): a pure-L2 loss ignores the SSIM the metric rewards; adding an SSIM pull toward FBP structure lifts SSIM above iter-4 0.8539. FALSIFIER: if SSIM <= 0.8539 (no lift), the SSIM-loss lever is exhausted. hr expected 0 regardless (matching FBP PSNR 35.97 with a 1024-Gaussian mixture is implausible, and SSIM-weight typically TRADES PSNR DOWN -- the headroom gate is PSNR/RMSE-based, so it cannot move hr off 0). val_n=15 HELD CONSTANT (gs_outer_wall_s=1080). BUDGET: SSIM term = 1 cheap conv/step vs the dominating projection -> same ~990s as iter-4 << 1080 wall. TRAJECTORY: iter-4 0.8539 (warm-start, BEST) -> iter-5 SSIM-loss @0.15 test., gs_outer_wall_s=1080, gs_amp_init_max=0.05", "run_id": "breast-ct-claude-agentic-r2gaussian-search-20260703-01", "runtime": {"elapsed_s": 664.9339900016785}, "schema_version": 3, "solver_key": "r2gaussian", "solver_name": "R2-Gaussian", "split": {"train_n": 400, "val_n": 15}, "status": "discard", "ts": "2026-07-05T18:46:54Z"}
