{"advice_for_others": "dual_domain_n2i-claude-agentic: warm_start=True, pretrain_epochs=3, pretrain_steps=0, n_iter=50, grad_clip=1.0, outer_wall_s=1400, per_scene_s=None, batch_size=2, lr=0.0003, optimizer=adam, unet_c=16, train_n=400, val_n=200, seed=42, rationale=iter-16 SIX-BOX. (1) PRIOR: iter-15 hr=0.0, minimal warm-start pretrain_epochs=1 gave rmse=0.00640 -- warm-start strength (off/1/3/10 -> ~0.0065/0.0064/0.0063/0.0064) is NON-monotone noise around the plateau, not a lever. Iters 1-15 all hr=0. (2) FAILURE MODE: plain-UNet N2I at the over-smoothed FBP-consistent plateau; no edge-preserving structural guard (bilateral sibling range kernel hr~0.21). (3) ONE KNOB: relative to iter-6 best reference (n_iter=50, lr=3e-4, c=16, pretrain=3), batch_size 1 -> 2 (affects ONLY the warm-start pre-pass; the per-image fit is always batch_size=1 internally). (4) HYPOTHESIS: batch_size=2 gives a lower-variance gradient estimate for the amortised warm-start, so the shared init may be a slightly better generic starting point for the per-image fits; if rmse dips, warm-start batch statistics matter. Per the ceiling, expect hr=0 -- the warm-start converges to the same over-smoothed mean regardless of batch size, so the per-image fits inherit the same plateau. (5) BUDGET: bs=2 halves warm-start steps/epoch (faster) + 200*50-step fast fits + figure ~= 11 min << 30-min wall. (6) Loop continues; iter-17 self-dispatched. Reserved levers: pretrain_steps hard cap, warm_start off + n_iter=400, per_scene_s explicit, n_iter=25 aggressive early-stop, lr=5e-4 mid.", "agent": "dual_domain_n2i-claude-agentic", "campaign": "search-20260703-01", "cfg_full": {"batch_size": 2, "grad_clip": 1.0, "lr": 0.0003, "n_iter": 50, "optimizer": "adam", "outer_wall_s": 1400, "per_scene_s": null, "pretrain_epochs": 3, "pretrain_steps": 0, "rationale": "iter-16 SIX-BOX. (1) PRIOR: iter-15 hr=0.0, minimal warm-start pretrain_epochs=1 gave rmse=0.00640 -- warm-start strength (off/1/3/10 -> ~0.0065/0.0064/0.0063/0.0064) is NON-monotone noise around the plateau, not a lever. Iters 1-15 all hr=0. (2) FAILURE MODE: plain-UNet N2I at the over-smoothed FBP-consistent plateau; no edge-preserving structural guard (bilateral sibling range kernel hr~0.21). (3) ONE KNOB: relative to iter-6 best reference (n_iter=50, lr=3e-4, c=16, pretrain=3), batch_size 1 -> 2 (affects ONLY the warm-start pre-pass; the per-image fit is always batch_size=1 internally). (4) HYPOTHESIS: batch_size=2 gives a lower-variance gradient estimate for the amortised warm-start, so the shared init may be a slightly better generic starting point for the per-image fits; if rmse dips, warm-start batch statistics matter. Per the ceiling, expect hr=0 -- the warm-start converges to the same over-smoothed mean regardless of batch size, so the per-image fits inherit the same plateau. (5) BUDGET: bs=2 halves warm-start steps/epoch (faster) + 200*50-step fast fits + figure ~= 11 min << 30-min wall. (6) Loop continues; iter-17 self-dispatched. Reserved levers: pretrain_steps hard cap, warm_start off + n_iter=400, per_scene_s explicit, n_iter=25 aggressive early-stop, lr=5e-4 mid.", "seed": 42, "train_n": 400, "unet_c": 16, "val_n": 200, "warm_start": true}, "challenge": "breast_ct", "change_class": "architecture", "git_commit": "671da566", "images": {"comparison": "runs/breast-ct-claude-agentic-dual-domain-n2i-search-20260703-01/iterations/iter-0016/comparison.png", "test_showcase": null, "valtest_showcase": null}, "iter": 16, "kept": false, "metrics": {"headroom": 0.0, "headroom_std": 9.450083712483246e-05, "val_psnr": 34.62349319458008, "val_psnr_std": 0.9633653979306798, "val_rmse": 0.006342051085084677, "val_rmse_std": 0.0006751471218780551, "val_ssim": 0.9434933066368103, "val_ssim_std": 0.011709487770286372}, "model": "claude-opus-4-8-1m", "obs_path": "breast-ct-claude-agentic-dual-domain-n2i-search-20260703-01/iterations/iter-0016/observation.json", "obs_sha1": "5b0fbc4ccd53bf2c539b5743c1f1e7f757d5ae0a", "params_M": 0.465762, "params_source": "observation", "rationale": "dual_domain_n2i-claude-agentic: warm_start=True, pretrain_epochs=3, pretrain_steps=0, n_iter=50, grad_clip=1.0, outer_wall_s=1400, per_scene_s=None, batch_size=2, lr=0.0003, optimizer=adam, unet_c=16, train_n=400, val_n=200, seed=42, rationale=iter-16 SIX-BOX. (1) PRIOR: iter-15 hr=0.0, minimal warm-start pretrain_epochs=1 gave rmse=0.00640 -- warm-start strength (off/1/3/10 -> ~0.0065/0.0064/0.0063/0.0064) is NON-monotone noise around the plateau, not a lever. Iters 1-15 all hr=0. (2) FAILURE MODE: plain-UNet N2I at the over-smoothed FBP-consistent plateau; no edge-preserving structural guard (bilateral sibling range kernel hr~0.21). (3) ONE KNOB: relative to iter-6 best reference (n_iter=50, lr=3e-4, c=16, pretrain=3), batch_size 1 -> 2 (affects ONLY the warm-start pre-pass; the per-image fit is always batch_size=1 internally). (4) HYPOTHESIS: batch_size=2 gives a lower-variance gradient estimate for the amortised warm-start, so the shared init may be a slightly better generic starting point for the per-image fits; if rmse dips, warm-start batch statistics matter. Per the ceiling, expect hr=0 -- the warm-start converges to the same over-smoothed mean regardless of batch size, so the per-image fits inherit the same plateau. (5) BUDGET: bs=2 halves warm-start steps/epoch (faster) + 200*50-step fast fits + figure ~= 11 min << 30-min wall. (6) Loop continues; iter-17 self-dispatched. Reserved levers: pretrain_steps hard cap, warm_start off + n_iter=400, per_scene_s explicit, n_iter=25 aggressive early-stop, lr=5e-4 mid.", "run_id": "breast-ct-claude-agentic-dual-domain-n2i-search-20260703-01", "runtime": {"elapsed_s": 878.3070440292358}, "schema_version": 3, "solver_key": "dual-domain-n2i", "solver_name": "DD-UNet N2I (per-image)", "split": {"train_n": 400, "val_n": 200}, "status": "discard", "ts": "2026-07-06T09:53:43Z"}
{"advice_for_others": "dual_domain_n2i-claude-agentic: warm_start=True, pretrain_epochs=3, pretrain_steps=100, n_iter=50, grad_clip=1.0, outer_wall_s=1400, per_scene_s=None, batch_size=1, lr=0.0003, optimizer=adam, unet_c=16, train_n=400, val_n=200, seed=42, rationale=iter-17 SIX-BOX. (1) PRIOR: iter-16 hr=0.0, batch_size=2 warm-start gave rmse=0.00634 -- warm-start batch statistics do not matter; still at the plateau. Iters 1-16 all hr=0, rmse tightly in 0.00623-0.00657. (2) FAILURE MODE: plain-UNet N2I at the over-smoothed FBP-consistent plateau; no edge-preserving structural guard (bilateral sibling range kernel hr~0.21). (3) ONE KNOB: relative to iter-6 best reference (n_iter=50, lr=3e-4, c=16, batch_size=1), pretrain_steps 0 -> 100 (a HARD cap on total warm-start optimizer steps -- an alternative bound to pretrain_epochs that stops the amortised pre-pass after exactly 100 steps regardless of epoch boundaries). (4) HYPOTHESIS: capping the warm-start at 100 steps yields a LESS-converged (less over-smoothed) shared init than the full 3-epoch (~1200-step) pre-pass; if a fresher init lowers rmse, warm-start CONVERGENCE (not strength/batch) is the subtle lever. Per the ceiling, expect hr=0 -- any warm-start, however truncated, lands the per-image fits at the same over-smoothed plateau. (5) BUDGET: warm-start hard-capped at 100 steps (fast, ~40s) + 200*50-step fits + figure ~= 10 min << 30-min wall. (6) Loop continues; iter-18 self-dispatched. Reserved levers: warm_start off + n_iter=400 (pure per-image, max steps), per_scene_s explicit=10, n_iter=25 aggressive early-stop.", "agent": "dual_domain_n2i-claude-agentic", "campaign": "search-20260703-01", "cfg_full": {"batch_size": 1, "grad_clip": 1.0, "lr": 0.0003, "n_iter": 50, "optimizer": "adam", "outer_wall_s": 1400, "per_scene_s": null, "pretrain_epochs": 3, "pretrain_steps": 100, "rationale": "iter-17 SIX-BOX. (1) PRIOR: iter-16 hr=0.0, batch_size=2 warm-start gave rmse=0.00634 -- warm-start batch statistics do not matter; still at the plateau. Iters 1-16 all hr=0, rmse tightly in 0.00623-0.00657. (2) FAILURE MODE: plain-UNet N2I at the over-smoothed FBP-consistent plateau; no edge-preserving structural guard (bilateral sibling range kernel hr~0.21). (3) ONE KNOB: relative to iter-6 best reference (n_iter=50, lr=3e-4, c=16, batch_size=1), pretrain_steps 0 -> 100 (a HARD cap on total warm-start optimizer steps -- an alternative bound to pretrain_epochs that stops the amortised pre-pass after exactly 100 steps regardless of epoch boundaries). (4) HYPOTHESIS: capping the warm-start at 100 steps yields a LESS-converged (less over-smoothed) shared init than the full 3-epoch (~1200-step) pre-pass; if a fresher init lowers rmse, warm-start CONVERGENCE (not strength/batch) is the subtle lever. Per the ceiling, expect hr=0 -- any warm-start, however truncated, lands the per-image fits at the same over-smoothed plateau. (5) BUDGET: warm-start hard-capped at 100 steps (fast, ~40s) + 200*50-step fits + figure ~= 10 min << 30-min wall. (6) Loop continues; iter-18 self-dispatched. Reserved levers: warm_start off + n_iter=400 (pure per-image, max steps), per_scene_s explicit=10, n_iter=25 aggressive early-stop.", "seed": 42, "train_n": 400, "unet_c": 16, "val_n": 200, "warm_start": true}, "challenge": "breast_ct", "change_class": "architecture", "git_commit": "671da566", "images": {"comparison": "runs/breast-ct-claude-agentic-dual-domain-n2i-search-20260703-01/iterations/iter-0017/comparison.png", "test_showcase": null, "valtest_showcase": null}, "iter": 17, "kept": false, "metrics": {"headroom": 0.0, "headroom_std": 0.0, "val_psnr": 34.38856887817383, "val_psnr_std": 0.986506784400514, "val_rmse": 0.0065159243531525135, "val_rmse_std": 0.0007117310125129624, "val_ssim": 0.9350098967552185, "val_ssim_std": 0.014114315852491897}, "model": "claude-opus-4-8-1m", "obs_path": "breast-ct-claude-agentic-dual-domain-n2i-search-20260703-01/iterations/iter-0017/observation.json", "obs_sha1": "adfa14e46b00b3ada2487056af7989972cc84e33", "params_M": 0.465762, "params_source": "observation", "rationale": "dual_domain_n2i-claude-agentic: warm_start=True, pretrain_epochs=3, pretrain_steps=100, n_iter=50, grad_clip=1.0, outer_wall_s=1400, per_scene_s=None, batch_size=1, lr=0.0003, optimizer=adam, unet_c=16, train_n=400, val_n=200, seed=42, rationale=iter-17 SIX-BOX. (1) PRIOR: iter-16 hr=0.0, batch_size=2 warm-start gave rmse=0.00634 -- warm-start batch statistics do not matter; still at the plateau. Iters 1-16 all hr=0, rmse tightly in 0.00623-0.00657. (2) FAILURE MODE: plain-UNet N2I at the over-smoothed FBP-consistent plateau; no edge-preserving structural guard (bilateral sibling range kernel hr~0.21). (3) ONE KNOB: relative to iter-6 best reference (n_iter=50, lr=3e-4, c=16, batch_size=1), pretrain_steps 0 -> 100 (a HARD cap on total warm-start optimizer steps -- an alternative bound to pretrain_epochs that stops the amortised pre-pass after exactly 100 steps regardless of epoch boundaries). (4) HYPOTHESIS: capping the warm-start at 100 steps yields a LESS-converged (less over-smoothed) shared init than the full 3-epoch (~1200-step) pre-pass; if a fresher init lowers rmse, warm-start CONVERGENCE (not strength/batch) is the subtle lever. Per the ceiling, expect hr=0 -- any warm-start, however truncated, lands the per-image fits at the same over-smoothed plateau. (5) BUDGET: warm-start hard-capped at 100 steps (fast, ~40s) + 200*50-step fits + figure ~= 10 min << 30-min wall. (6) Loop continues; iter-18 self-dispatched. Reserved levers: warm_start off + n_iter=400 (pure per-image, max steps), per_scene_s explicit=10, n_iter=25 aggressive early-stop.", "run_id": "breast-ct-claude-agentic-dual-domain-n2i-search-20260703-01", "runtime": {"elapsed_s": 810.3592126369476}, "schema_version": 3, "solver_key": "dual-domain-n2i", "solver_name": "DD-UNet N2I (per-image)", "split": {"train_n": 400, "val_n": 200}, "status": "discard", "ts": "2026-07-06T10:28:24Z"}
{"advice_for_others": "dual_domain_n2i-claude-agentic: warm_start=False, pretrain_epochs=3, pretrain_steps=0, n_iter=50, grad_clip=1.0, outer_wall_s=1400, per_scene_s=None, batch_size=1, lr=0.0003, optimizer=adam, unet_c=16, train_n=400, val_n=200, seed=42, rationale=iter-18 SIX-BOX. (1) PRIOR: iter-17 hr=0.0, pretrain_steps=100 cap gave rmse=0.00652 -- a truncated warm-start lands the per-image fits at the same plateau; warm-start convergence is not a lever. Iters 1-17 all hr=0. (2) FAILURE MODE: plain-UNet N2I at the over-smoothed FBP-consistent plateau; no edge-preserving structural guard (bilateral sibling range kernel hr~0.21). (3) ONE KNOB: relative to iter-6 best reference (warm_start=True, n_iter=50, lr=3e-4, c=16), warm_start True -> False, keeping n_iter=50 fixed. iter-4 tested warm_start off but CONFOUNDED it with n_iter=300; this cleanly ISOLATES the warm_start effect at the best-config n_iter=50 (each val scan optimized from a FRESH random init, no amortised pre-pass, no train split loaded). (4) HYPOTHESIS: a from-scratch 50-step per-image fit (random init) may retain different high-frequency content than a warm-started fit; comparing rmse to iter-6's warm-started 0.00628 at MATCHED n_iter isolates whether the warm-start helps, hurts, or is neutral. Per the ceiling, expect hr=0 -- 50 steps from random init is too few to beat the FBP target, likely rmse >= warm-started (warm-start at least provides a sane init). (5) BUDGET: no warm-start (saves ~130s) + 200*50-step fast fits + figure ~= 9 min << 30-min wall. (6) Loop continues; iter-19 self-dispatched. Reserved levers: warm_start off + n_iter=400 (pure per-image max steps), per_scene_s explicit=10 (guarantee full n_iter completes).", "agent": "dual_domain_n2i-claude-agentic", "campaign": "search-20260703-01", "cfg_full": {"batch_size": 1, "grad_clip": 1.0, "lr": 0.0003, "n_iter": 50, "optimizer": "adam", "outer_wall_s": 1400, "per_scene_s": null, "pretrain_epochs": 3, "pretrain_steps": 0, "rationale": "iter-18 SIX-BOX. (1) PRIOR: iter-17 hr=0.0, pretrain_steps=100 cap gave rmse=0.00652 -- a truncated warm-start lands the per-image fits at the same plateau; warm-start convergence is not a lever. Iters 1-17 all hr=0. (2) FAILURE MODE: plain-UNet N2I at the over-smoothed FBP-consistent plateau; no edge-preserving structural guard (bilateral sibling range kernel hr~0.21). (3) ONE KNOB: relative to iter-6 best reference (warm_start=True, n_iter=50, lr=3e-4, c=16), warm_start True -> False, keeping n_iter=50 fixed. iter-4 tested warm_start off but CONFOUNDED it with n_iter=300; this cleanly ISOLATES the warm_start effect at the best-config n_iter=50 (each val scan optimized from a FRESH random init, no amortised pre-pass, no train split loaded). (4) HYPOTHESIS: a from-scratch 50-step per-image fit (random init) may retain different high-frequency content than a warm-started fit; comparing rmse to iter-6's warm-started 0.00628 at MATCHED n_iter isolates whether the warm-start helps, hurts, or is neutral. Per the ceiling, expect hr=0 -- 50 steps from random init is too few to beat the FBP target, likely rmse >= warm-started (warm-start at least provides a sane init). (5) BUDGET: no warm-start (saves ~130s) + 200*50-step fast fits + figure ~= 9 min << 30-min wall. (6) Loop continues; iter-19 self-dispatched. Reserved levers: warm_start off + n_iter=400 (pure per-image max steps), per_scene_s explicit=10 (guarantee full n_iter completes).", "seed": 42, "train_n": 400, "unet_c": 16, "val_n": 200, "warm_start": false}, "challenge": "breast_ct", "change_class": "architecture", "git_commit": "671da566", "images": {"comparison": "runs/breast-ct-claude-agentic-dual-domain-n2i-search-20260703-01/iterations/iter-0018/comparison.png", "test_showcase": null, "valtest_showcase": null}, "iter": 18, "kept": false, "metrics": {"headroom": 0.0, "headroom_std": 0.0, "val_psnr": 34.29449462890625, "val_psnr_std": 0.995541230404835, "val_rmse": 0.006586879026144743, "val_rmse_std": 0.0007312317172134592, "val_ssim": 0.9279898405075073, "val_ssim_std": 0.015616138704860477}, "model": "claude-opus-4-8-1m", "obs_path": "breast-ct-claude-agentic-dual-domain-n2i-search-20260703-01/iterations/iter-0018/observation.json", "obs_sha1": "5ba04b1cd43c0ffe9a78b04cc2bcde61f933c738", "params_M": 0.465762, "params_source": "observation", "rationale": "dual_domain_n2i-claude-agentic: warm_start=False, pretrain_epochs=3, pretrain_steps=0, n_iter=50, grad_clip=1.0, outer_wall_s=1400, per_scene_s=None, batch_size=1, lr=0.0003, optimizer=adam, unet_c=16, train_n=400, val_n=200, seed=42, rationale=iter-18 SIX-BOX. (1) PRIOR: iter-17 hr=0.0, pretrain_steps=100 cap gave rmse=0.00652 -- a truncated warm-start lands the per-image fits at the same plateau; warm-start convergence is not a lever. Iters 1-17 all hr=0. (2) FAILURE MODE: plain-UNet N2I at the over-smoothed FBP-consistent plateau; no edge-preserving structural guard (bilateral sibling range kernel hr~0.21). (3) ONE KNOB: relative to iter-6 best reference (warm_start=True, n_iter=50, lr=3e-4, c=16), warm_start True -> False, keeping n_iter=50 fixed. iter-4 tested warm_start off but CONFOUNDED it with n_iter=300; this cleanly ISOLATES the warm_start effect at the best-config n_iter=50 (each val scan optimized from a FRESH random init, no amortised pre-pass, no train split loaded). (4) HYPOTHESIS: a from-scratch 50-step per-image fit (random init) may retain different high-frequency content than a warm-started fit; comparing rmse to iter-6's warm-started 0.00628 at MATCHED n_iter isolates whether the warm-start helps, hurts, or is neutral. Per the ceiling, expect hr=0 -- 50 steps from random init is too few to beat the FBP target, likely rmse >= warm-started (warm-start at least provides a sane init). (5) BUDGET: no warm-start (saves ~130s) + 200*50-step fast fits + figure ~= 9 min << 30-min wall. (6) Loop continues; iter-19 self-dispatched. Reserved levers: warm_start off + n_iter=400 (pure per-image max steps), per_scene_s explicit=10 (guarantee full n_iter completes).", "run_id": "breast-ct-claude-agentic-dual-domain-n2i-search-20260703-01", "runtime": {"elapsed_s": 809.3446455001831}, "schema_version": 3, "solver_key": "dual-domain-n2i", "solver_name": "DD-UNet N2I (per-image)", "split": {"train_n": 400, "val_n": 200}, "status": "discard", "ts": "2026-07-06T10:45:51Z"}
