{"advice_for_others": "fastdiff_flow_pixel_constrained-claude-agentic: image_size=512, pixel_spacing=0.3516, n_angles=128, n_det=1024, det_spacing=0.35754, sod=500.0, sdd=1000.0, display_min=0.0, display_max=0.5, train_n=400, val_n=200, noise_i0=100000.0, noise_sigma_e=10.0, seed=42, dataset_kind=breast_ct, fd_recon_ckpt=/cluster/maier/Agent4CT/checkpoints/fast_diffusion_pixel_breast.pt, fd_recon_steps=8, fd_recon_init=fbp, fd_recon_init_t=0.05, fd_recon_eta=1.0, fd_recon_dc=1, fd_recon_dc_n_cg=30, fd_recon_dc_relax=1.0, rationale=iter-5 EXPLORATORY DC-strength combo (dc_n_cg 5->30 + dc_relax 0.5->1.0) on the near-FBP init_t0.05 base. SIX-BOX: (1)PRIOR: init_t axis fully mapped and MONOTONIC to the FBP floor: 0.7->0.05 gave rmse 0.0428->0.0264->0.0144->0.00669 (ssim 0.427->0.915), converging TO the 128-view breast FBP (rmse0.00521, ssim0.920) from ABOVE. hr=0 throughout: the breast-native prior cannot EXCEED the near-oracle sparse-view FBP. (2)FAILURE / OPEN QUESTION: at init_t0.05 the prior barely acts, so recon ~ DC-projected FBP. The ONLY way to beat the FBP is if a DEEP data-consistency CG solve finds a lower-rmse data-consistent image than the analytic FBP. In the Mayo sibling dc_n_cg was the ONLY lever that moved rmse. (3)ONE KNOB (DC-strength, combined): dc_n_cg 5->30 AND dc_relax 0.5->1.0 (full deep CG projection). (4)HYPOTHESIS: if full deep DC at near-FBP init STILL cannot push rmse below 0.00521, the regime-bound ceiling is PROVEN at the DC limit: the data-consistent solution the constrained flow converges to IS the FBP; a prior has no sparse-view-noise headroom to exploit at 128 views. (5)BUDGET: 30 CG x 8 steps x 200 slices, CG cheap fwd/back-proj, inside 20-min. (6)Serial.", "agent": "fastdiff_flow_pixel_constrained-claude-agentic", "campaign": "search-20260703-01", "cfg_full": {"dataset_kind": "breast_ct", "det_spacing": 0.35754, "display_max": 0.5, "display_min": 0.0, "fd_recon_ckpt": "/cluster/maier/Agent4CT/checkpoints/fast_diffusion_pixel_breast.pt", "fd_recon_dc": 1, "fd_recon_dc_n_cg": 30, "fd_recon_dc_relax": 1.0, "fd_recon_eta": 1.0, "fd_recon_init": "fbp", "fd_recon_init_t": 0.05, "fd_recon_steps": 8, "image_size": 512, "n_angles": 128, "n_det": 1024, "noise_i0": 100000.0, "noise_sigma_e": 10.0, "pixel_spacing": 0.3516, "rationale": "iter-5 EXPLORATORY DC-strength combo (dc_n_cg 5->30 + dc_relax 0.5->1.0) on the near-FBP init_t0.05 base. SIX-BOX: (1)PRIOR: init_t axis fully mapped and MONOTONIC to the FBP floor: 0.7->0.05 gave rmse 0.0428->0.0264->0.0144->0.00669 (ssim 0.427->0.915), converging TO the 128-view breast FBP (rmse0.00521, ssim0.920) from ABOVE. hr=0 throughout: the breast-native prior cannot EXCEED the near-oracle sparse-view FBP. (2)FAILURE / OPEN QUESTION: at init_t0.05 the prior barely acts, so recon ~ DC-projected FBP. The ONLY way to beat the FBP is if a DEEP data-consistency CG solve finds a lower-rmse data-consistent image than the analytic FBP. In the Mayo sibling dc_n_cg was the ONLY lever that moved rmse. (3)ONE KNOB (DC-strength, combined): dc_n_cg 5->30 AND dc_relax 0.5->1.0 (full deep CG projection). (4)HYPOTHESIS: if full deep DC at near-FBP init STILL cannot push rmse below 0.00521, the regime-bound ceiling is PROVEN at the DC limit: the data-consistent solution the constrained flow converges to IS the FBP; a prior has no sparse-view-noise headroom to exploit at 128 views. (5)BUDGET: 30 CG x 8 steps x 200 slices, CG cheap fwd/back-proj, inside 20-min. (6)Serial.", "sdd": 1000.0, "seed": 42, "sod": 500.0, "train_n": 400, "val_n": 200}, "challenge": "breast_ct", "change_class": "architecture", "git_commit": "671da566", "images": {"comparison": "runs/breast-ct-claude-agentic-fastdiff-flow-pixel-constrained-search-20260703-01/iterations/iter-0005/comparison.png", "test_showcase": null, "valtest_showcase": null}, "iter": 5, "kept": true, "metrics": {"headroom": 0.05569136356049498, "headroom_std": 0.048040269304557355, "val_psnr": 36.82191467285156, "val_psnr_std": 0.6868064328514202, "val_rmse": 0.004923893138766289, "val_rmse_std": 0.0003878539443442436, "val_ssim": 0.9022442698478699, "val_ssim_std": 0.009649589721691464}, "model": "claude-opus-4-8-1m", "obs_path": "breast-ct-claude-agentic-fastdiff-flow-pixel-constrained-search-20260703-01/iterations/iter-0005/observation.json", "obs_sha1": "03fc21fd44c20c9dfb327a6c1c06cd9dacd2c2e0", "params_M": 3.822787, "params_source": "observation", "rationale": "fastdiff_flow_pixel_constrained-claude-agentic: image_size=512, pixel_spacing=0.3516, n_angles=128, n_det=1024, det_spacing=0.35754, sod=500.0, sdd=1000.0, display_min=0.0, display_max=0.5, train_n=400, val_n=200, noise_i0=100000.0, noise_sigma_e=10.0, seed=42, dataset_kind=breast_ct, fd_recon_ckpt=/cluster/maier/Agent4CT/checkpoints/fast_diffusion_pixel_breast.pt, fd_recon_steps=8, fd_recon_init=fbp, fd_recon_init_t=0.05, fd_recon_eta=1.0, fd_recon_dc=1, fd_recon_dc_n_cg=30, fd_recon_dc_relax=1.0, rationale=iter-5 EXPLORATORY DC-strength combo (dc_n_cg 5->30 + dc_relax 0.5->1.0) on the near-FBP init_t0.05 base. SIX-BOX: (1)PRIOR: init_t axis fully mapped and MONOTONIC to the FBP floor: 0.7->0.05 gave rmse 0.0428->0.0264->0.0144->0.00669 (ssim 0.427->0.915), converging TO the 128-view breast FBP (rmse0.00521, ssim0.920) from ABOVE. hr=0 throughout: the breast-native prior cannot EXCEED the near-oracle sparse-view FBP. (2)FAILURE / OPEN QUESTION: at init_t0.05 the prior barely acts, so recon ~ DC-projected FBP. The ONLY way to beat the FBP is if a DEEP data-consistency CG solve finds a lower-rmse data-consistent image than the analytic FBP. In the Mayo sibling dc_n_cg was the ONLY lever that moved rmse. (3)ONE KNOB (DC-strength, combined): dc_n_cg 5->30 AND dc_relax 0.5->1.0 (full deep CG projection). (4)HYPOTHESIS: if full deep DC at near-FBP init STILL cannot push rmse below 0.00521, the regime-bound ceiling is PROVEN at the DC limit: the data-consistent solution the constrained flow converges to IS the FBP; a prior has no sparse-view-noise headroom to exploit at 128 views. (5)BUDGET: 30 CG x 8 steps x 200 slices, CG cheap fwd/back-proj, inside 20-min. (6)Serial.", "run_id": "breast-ct-claude-agentic-fastdiff-flow-pixel-constrained-search-20260703-01", "runtime": {"elapsed_s": 331.7223274707794}, "schema_version": 3, "solver_key": "fastdiff-flow-pixel-constrained", "solver_name": "Fast-diffusion flow (pixel, constrained DC)", "split": {"train_n": 400, "val_n": 200}, "status": "keep", "ts": "2026-07-06T21:00:32Z"}
{"advice_for_others": "fastdiff_flow_pixel_constrained-claude-agentic: image_size=512, pixel_spacing=0.3516, n_angles=128, n_det=1024, det_spacing=0.35754, sod=500.0, sdd=1000.0, display_min=0.0, display_max=0.5, train_n=400, val_n=200, noise_i0=100000.0, noise_sigma_e=10.0, seed=42, dataset_kind=breast_ct, fd_recon_ckpt=/cluster/maier/Agent4CT/checkpoints/fast_diffusion_pixel_breast.pt, fd_recon_steps=8, fd_recon_init=fbp, fd_recon_init_t=0.05, fd_recon_eta=1.0, fd_recon_dc=1, fd_recon_dc_n_cg=60, fd_recon_dc_relax=1.0, rationale=iter-6 EXPLORATORY single knob dc_n_cg 30->60 from iter-5 (the BREAKTHROUGH: init_t0.05/n_cg30/relax1.0 gave hr=0.0557, rmse0.004924 < FBP0.00521, psnr36.82>36.32). SIX-BOX: (1)PRIOR: DEEP full DC is the winning lever. iter-4 (n_cg5,relax0.5,init_t0.05) was rmse0.00669 hr=0; iter-5 (n_cg30,relax1.0) dropped rmse to 0.004924 -> FIRST hr>0. The deep CG solves the 128-view least-squares more accurately than the analytic Hann FBP, beating baseline. (2)FAILURE: n_cg30 may still under-converge the CG; more iters could lower rmse further. (3)ONE KNOB: dc_n_cg 30->60 (2x deeper, extend the winning direction; relax1.0/init_t0.05/steps8/eta1.0 held). (4)HYPOTHESIS: 60 CG iters drive the recon closer to the exact data-consistent LS solution, lifting hr above 0.0557; if it converges (hr plateaus), that is the DC-limit hr for this prior. (5)BUDGET: 60 CG x 8 steps x 200 slices; iter-5 (30CG) took ~5.5min, 60CG ~ up to ~11min, inside the 20-min HARD budget. (6)Serial.", "agent": "fastdiff_flow_pixel_constrained-claude-agentic", "campaign": "search-20260703-01", "cfg_full": {"dataset_kind": "breast_ct", "det_spacing": 0.35754, "display_max": 0.5, "display_min": 0.0, "fd_recon_ckpt": "/cluster/maier/Agent4CT/checkpoints/fast_diffusion_pixel_breast.pt", "fd_recon_dc": 1, "fd_recon_dc_n_cg": 60, "fd_recon_dc_relax": 1.0, "fd_recon_eta": 1.0, "fd_recon_init": "fbp", "fd_recon_init_t": 0.05, "fd_recon_steps": 8, "image_size": 512, "n_angles": 128, "n_det": 1024, "noise_i0": 100000.0, "noise_sigma_e": 10.0, "pixel_spacing": 0.3516, "rationale": "iter-6 EXPLORATORY single knob dc_n_cg 30->60 from iter-5 (the BREAKTHROUGH: init_t0.05/n_cg30/relax1.0 gave hr=0.0557, rmse0.004924 < FBP0.00521, psnr36.82>36.32). SIX-BOX: (1)PRIOR: DEEP full DC is the winning lever. iter-4 (n_cg5,relax0.5,init_t0.05) was rmse0.00669 hr=0; iter-5 (n_cg30,relax1.0) dropped rmse to 0.004924 -> FIRST hr>0. The deep CG solves the 128-view least-squares more accurately than the analytic Hann FBP, beating baseline. (2)FAILURE: n_cg30 may still under-converge the CG; more iters could lower rmse further. (3)ONE KNOB: dc_n_cg 30->60 (2x deeper, extend the winning direction; relax1.0/init_t0.05/steps8/eta1.0 held). (4)HYPOTHESIS: 60 CG iters drive the recon closer to the exact data-consistent LS solution, lifting hr above 0.0557; if it converges (hr plateaus), that is the DC-limit hr for this prior. (5)BUDGET: 60 CG x 8 steps x 200 slices; iter-5 (30CG) took ~5.5min, 60CG ~ up to ~11min, inside the 20-min HARD budget. (6)Serial.", "sdd": 1000.0, "seed": 42, "sod": 500.0, "train_n": 400, "val_n": 200}, "challenge": "breast_ct", "change_class": "architecture", "git_commit": "671da566", "images": {"comparison": "runs/breast-ct-claude-agentic-fastdiff-flow-pixel-constrained-search-20260703-01/iterations/iter-0006/comparison.png", "test_showcase": null, "valtest_showcase": null}, "iter": 6, "kept": false, "metrics": {"headroom": 0.0, "headroom_std": 0.0, "val_psnr": 30.736635208129883, "val_psnr_std": 0.4174136586471874, "val_rmse": 0.009921394288539886, "val_rmse_std": 0.0004576722646820638, "val_ssim": 0.7497767210006714, "val_ssim_std": 0.012231364717188348}, "model": "claude-opus-4-8-1m", "obs_path": "breast-ct-claude-agentic-fastdiff-flow-pixel-constrained-search-20260703-01/iterations/iter-0006/observation.json", "obs_sha1": "d641e8fb67a2e331939f362de9db25ffd6216f08", "params_M": 3.822787, "params_source": "observation", "rationale": "fastdiff_flow_pixel_constrained-claude-agentic: image_size=512, pixel_spacing=0.3516, n_angles=128, n_det=1024, det_spacing=0.35754, sod=500.0, sdd=1000.0, display_min=0.0, display_max=0.5, train_n=400, val_n=200, noise_i0=100000.0, noise_sigma_e=10.0, seed=42, dataset_kind=breast_ct, fd_recon_ckpt=/cluster/maier/Agent4CT/checkpoints/fast_diffusion_pixel_breast.pt, fd_recon_steps=8, fd_recon_init=fbp, fd_recon_init_t=0.05, fd_recon_eta=1.0, fd_recon_dc=1, fd_recon_dc_n_cg=60, fd_recon_dc_relax=1.0, rationale=iter-6 EXPLORATORY single knob dc_n_cg 30->60 from iter-5 (the BREAKTHROUGH: init_t0.05/n_cg30/relax1.0 gave hr=0.0557, rmse0.004924 < FBP0.00521, psnr36.82>36.32). SIX-BOX: (1)PRIOR: DEEP full DC is the winning lever. iter-4 (n_cg5,relax0.5,init_t0.05) was rmse0.00669 hr=0; iter-5 (n_cg30,relax1.0) dropped rmse to 0.004924 -> FIRST hr>0. The deep CG solves the 128-view least-squares more accurately than the analytic Hann FBP, beating baseline. (2)FAILURE: n_cg30 may still under-converge the CG; more iters could lower rmse further. (3)ONE KNOB: dc_n_cg 30->60 (2x deeper, extend the winning direction; relax1.0/init_t0.05/steps8/eta1.0 held). (4)HYPOTHESIS: 60 CG iters drive the recon closer to the exact data-consistent LS solution, lifting hr above 0.0557; if it converges (hr plateaus), that is the DC-limit hr for this prior. (5)BUDGET: 60 CG x 8 steps x 200 slices; iter-5 (30CG) took ~5.5min, 60CG ~ up to ~11min, inside the 20-min HARD budget. (6)Serial.", "run_id": "breast-ct-claude-agentic-fastdiff-flow-pixel-constrained-search-20260703-01", "runtime": {"elapsed_s": 450.8767440319061}, "schema_version": 3, "solver_key": "fastdiff-flow-pixel-constrained", "solver_name": "Fast-diffusion flow (pixel, constrained DC)", "split": {"train_n": 400, "val_n": 200}, "status": "discard", "ts": "2026-07-06T21:10:06Z"}
{"advice_for_others": "fastdiff_flow_pixel_constrained-claude-agentic: image_size=512, pixel_spacing=0.3516, n_angles=128, n_det=1024, det_spacing=0.35754, sod=500.0, sdd=1000.0, display_min=0.0, display_max=0.5, train_n=400, val_n=200, noise_i0=100000.0, noise_sigma_e=10.0, seed=42, dataset_kind=breast_ct, fd_recon_ckpt=/cluster/maier/Agent4CT/checkpoints/fast_diffusion_pixel_breast.pt, fd_recon_steps=8, fd_recon_init=fbp, fd_recon_init_t=0.05, fd_recon_eta=1.0, fd_recon_dc=1, fd_recon_dc_n_cg=20, fd_recon_dc_relax=1.0, rationale=iter-7 EXPLORATORY single knob dc_n_cg 30->20 (map LEFT of the peak). SIX-BOX: (1)PRIOR: KEY FINDING - the DC CG solve shows SEMI-CONVERGENCE on the noisy sparse-view data: n_cg5 rmse0.00669 hr0; n_cg30 rmse0.004924 hr=0.0557 (BEST, beats FBP0.00521); n_cg60 rmse0.00992 hr0 (WORSE - too-deep CG re-amplifies sparse-view/measurement noise, classic ill-posed LS semi-convergence). The optimum is near n_cg~30. (2)FAILURE: n_cg is a one-dimensional peak; 30 may not be the exact argmax. (3)ONE KNOB: dc_n_cg 30->20 (probe left of peak; init_t0.05/relax1.0/steps8/eta1.0 held). (4)HYPOTHESIS: n_cg20 lands between n_cg5(hr0) and n_cg30(hr0.0557) - if hr(20) < hr(30) it confirms 30 is near-optimal from the left; if hr(20) > hr(30) the peak is lower. Refines the argmax hr. (5)BUDGET: 20 CG < 30 CG, faster than iter-5 (~4min). (6)Serial.", "agent": "fastdiff_flow_pixel_constrained-claude-agentic", "campaign": "search-20260703-01", "cfg_full": {"dataset_kind": "breast_ct", "det_spacing": 0.35754, "display_max": 0.5, "display_min": 0.0, "fd_recon_ckpt": "/cluster/maier/Agent4CT/checkpoints/fast_diffusion_pixel_breast.pt", "fd_recon_dc": 1, "fd_recon_dc_n_cg": 20, "fd_recon_dc_relax": 1.0, "fd_recon_eta": 1.0, "fd_recon_init": "fbp", "fd_recon_init_t": 0.05, "fd_recon_steps": 8, "image_size": 512, "n_angles": 128, "n_det": 1024, "noise_i0": 100000.0, "noise_sigma_e": 10.0, "pixel_spacing": 0.3516, "rationale": "iter-7 EXPLORATORY single knob dc_n_cg 30->20 (map LEFT of the peak). SIX-BOX: (1)PRIOR: KEY FINDING - the DC CG solve shows SEMI-CONVERGENCE on the noisy sparse-view data: n_cg5 rmse0.00669 hr0; n_cg30 rmse0.004924 hr=0.0557 (BEST, beats FBP0.00521); n_cg60 rmse0.00992 hr0 (WORSE - too-deep CG re-amplifies sparse-view/measurement noise, classic ill-posed LS semi-convergence). The optimum is near n_cg~30. (2)FAILURE: n_cg is a one-dimensional peak; 30 may not be the exact argmax. (3)ONE KNOB: dc_n_cg 30->20 (probe left of peak; init_t0.05/relax1.0/steps8/eta1.0 held). (4)HYPOTHESIS: n_cg20 lands between n_cg5(hr0) and n_cg30(hr0.0557) - if hr(20) < hr(30) it confirms 30 is near-optimal from the left; if hr(20) > hr(30) the peak is lower. Refines the argmax hr. (5)BUDGET: 20 CG < 30 CG, faster than iter-5 (~4min). (6)Serial.", "sdd": 1000.0, "seed": 42, "sod": 500.0, "train_n": 400, "val_n": 200}, "challenge": "breast_ct", "change_class": "architecture", "git_commit": "671da566", "images": {"comparison": "runs/breast-ct-claude-agentic-fastdiff-flow-pixel-constrained-search-20260703-01/iterations/iter-0007/comparison.png", "test_showcase": null, "valtest_showcase": null}, "iter": 7, "kept": false, "metrics": {"headroom": 0.0, "headroom_std": 0.021294817626476788, "val_psnr": 36.13764953613281, "val_psnr_std": 0.5606699526820803, "val_rmse": 0.005327483173459768, "val_rmse_std": 0.00034025634974540423, "val_ssim": 0.8781355023384094, "val_ssim_std": 0.008402443516338556}, "model": "claude-opus-4-8-1m", "obs_path": "breast-ct-claude-agentic-fastdiff-flow-pixel-constrained-search-20260703-01/iterations/iter-0007/observation.json", "obs_sha1": "d260690e3930319ce402ab311cb5542e5362c944", "params_M": 3.822787, "params_source": "observation", "rationale": "fastdiff_flow_pixel_constrained-claude-agentic: image_size=512, pixel_spacing=0.3516, n_angles=128, n_det=1024, det_spacing=0.35754, sod=500.0, sdd=1000.0, display_min=0.0, display_max=0.5, train_n=400, val_n=200, noise_i0=100000.0, noise_sigma_e=10.0, seed=42, dataset_kind=breast_ct, fd_recon_ckpt=/cluster/maier/Agent4CT/checkpoints/fast_diffusion_pixel_breast.pt, fd_recon_steps=8, fd_recon_init=fbp, fd_recon_init_t=0.05, fd_recon_eta=1.0, fd_recon_dc=1, fd_recon_dc_n_cg=20, fd_recon_dc_relax=1.0, rationale=iter-7 EXPLORATORY single knob dc_n_cg 30->20 (map LEFT of the peak). SIX-BOX: (1)PRIOR: KEY FINDING - the DC CG solve shows SEMI-CONVERGENCE on the noisy sparse-view data: n_cg5 rmse0.00669 hr0; n_cg30 rmse0.004924 hr=0.0557 (BEST, beats FBP0.00521); n_cg60 rmse0.00992 hr0 (WORSE - too-deep CG re-amplifies sparse-view/measurement noise, classic ill-posed LS semi-convergence). The optimum is near n_cg~30. (2)FAILURE: n_cg is a one-dimensional peak; 30 may not be the exact argmax. (3)ONE KNOB: dc_n_cg 30->20 (probe left of peak; init_t0.05/relax1.0/steps8/eta1.0 held). (4)HYPOTHESIS: n_cg20 lands between n_cg5(hr0) and n_cg30(hr0.0557) - if hr(20) < hr(30) it confirms 30 is near-optimal from the left; if hr(20) > hr(30) the peak is lower. Refines the argmax hr. (5)BUDGET: 20 CG < 30 CG, faster than iter-5 (~4min). (6)Serial.", "run_id": "breast-ct-claude-agentic-fastdiff-flow-pixel-constrained-search-20260703-01", "runtime": {"elapsed_s": 288.0938262939453}, "schema_version": 3, "solver_key": "fastdiff-flow-pixel-constrained", "solver_name": "Fast-diffusion flow (pixel, constrained DC)", "split": {"train_n": 400, "val_n": 200}, "status": "discard", "ts": "2026-07-06T21:26:47Z"}
