{"advice_for_others": "fastdiff_flow_pixel_constrained-claude-agentic: image_size=512, pixel_spacing=0.3516, n_angles=128, n_det=1024, det_spacing=0.35754, sod=500.0, sdd=1000.0, display_min=0.0, display_max=0.5, train_n=400, val_n=200, noise_i0=100000.0, noise_sigma_e=10.0, seed=42, dataset_kind=breast_ct, fd_recon_ckpt=/cluster/maier/Agent4CT/checkpoints/fast_diffusion_pixel_breast.pt, fd_recon_steps=8, fd_recon_init=fbp, fd_recon_init_t=0.01, fd_recon_eta=1.0, fd_recon_dc=1, fd_recon_dc_n_cg=15, fd_recon_dc_relax=1.0, rationale=iter-16 dc_n_cg 20->15 at init_t0.01, continuing DOWN the n_cg axis if iter-15 (n_cg20) still climbing. Maps the argmax further left.", "agent": "fastdiff_flow_pixel_constrained-claude-agentic", "campaign": "search-20260703-01", "cfg_full": {"dataset_kind": "breast_ct", "det_spacing": 0.35754, "display_max": 0.5, "display_min": 0.0, "fd_recon_ckpt": "/cluster/maier/Agent4CT/checkpoints/fast_diffusion_pixel_breast.pt", "fd_recon_dc": 1, "fd_recon_dc_n_cg": 15, "fd_recon_dc_relax": 1.0, "fd_recon_eta": 1.0, "fd_recon_init": "fbp", "fd_recon_init_t": 0.01, "fd_recon_steps": 8, "image_size": 512, "n_angles": 128, "n_det": 1024, "noise_i0": 100000.0, "noise_sigma_e": 10.0, "pixel_spacing": 0.3516, "rationale": "iter-16 dc_n_cg 20->15 at init_t0.01, continuing DOWN the n_cg axis if iter-15 (n_cg20) still climbing. Maps the argmax further left.", "sdd": 1000.0, "seed": 42, "sod": 500.0, "train_n": 400, "val_n": 200}, "challenge": "breast_ct", "change_class": "architecture", "git_commit": "671da566", "images": {"comparison": "runs/breast-ct-claude-agentic-fastdiff-flow-pixel-constrained-search-20260703-01/iterations/iter-0016/comparison.png", "test_showcase": null, "valtest_showcase": null}, "iter": 16, "kept": true, "metrics": {"headroom": 0.4938259030582387, "headroom_std": 0.024367968956019535, "val_psnr": 42.238197326660156, "val_psnr_std": 0.4681756468461509, "val_rmse": 0.002639335347339511, "val_rmse_std": 0.00014340414977916924, "val_ssim": 0.9758946299552917, "val_ssim_std": 0.0037656833008678373}, "model": "claude-opus-4-8-1m", "obs_path": "breast-ct-claude-agentic-fastdiff-flow-pixel-constrained-search-20260703-01/iterations/iter-0016/observation.json", "obs_sha1": "38981dd70a0c4dd172805ca648c7f26dc84e5681", "params_M": 3.822787, "params_source": "observation", "rationale": "fastdiff_flow_pixel_constrained-claude-agentic: image_size=512, pixel_spacing=0.3516, n_angles=128, n_det=1024, det_spacing=0.35754, sod=500.0, sdd=1000.0, display_min=0.0, display_max=0.5, train_n=400, val_n=200, noise_i0=100000.0, noise_sigma_e=10.0, seed=42, dataset_kind=breast_ct, fd_recon_ckpt=/cluster/maier/Agent4CT/checkpoints/fast_diffusion_pixel_breast.pt, fd_recon_steps=8, fd_recon_init=fbp, fd_recon_init_t=0.01, fd_recon_eta=1.0, fd_recon_dc=1, fd_recon_dc_n_cg=15, fd_recon_dc_relax=1.0, rationale=iter-16 dc_n_cg 20->15 at init_t0.01, continuing DOWN the n_cg axis if iter-15 (n_cg20) still climbing. Maps the argmax further left.", "run_id": "breast-ct-claude-agentic-fastdiff-flow-pixel-constrained-search-20260703-01", "runtime": {"elapsed_s": 212.33215141296387}, "schema_version": 3, "solver_key": "fastdiff-flow-pixel-constrained", "solver_name": "Fast-diffusion flow (pixel, constrained DC)", "split": {"train_n": 400, "val_n": 200}, "status": "keep", "ts": "2026-07-06T22:23:18Z"}
{"advice_for_others": "fastdiff_flow_pixel_constrained-claude-agentic: image_size=512, pixel_spacing=0.3516, n_angles=128, n_det=1024, det_spacing=0.35754, sod=500.0, sdd=1000.0, display_min=0.0, display_max=0.5, train_n=400, val_n=200, noise_i0=100000.0, noise_sigma_e=10.0, seed=42, dataset_kind=breast_ct, fd_recon_ckpt=/cluster/maier/Agent4CT/checkpoints/fast_diffusion_pixel_breast.pt, fd_recon_steps=8, fd_recon_init=fbp, fd_recon_init_t=0.01, fd_recon_eta=1.0, fd_recon_dc=1, fd_recon_dc_n_cg=18, fd_recon_dc_relax=1.0, rationale=iter-17 EXPLORATORY dc_n_cg 20->18 fine near the argmax at init_t0.01. SIX-BOX: (1)PRIOR: n_cg argmax at init_t0.01 is ~20: n_cg15 hr0.4938, n_cg20 hr0.5164 (BEST), n_cg25 hr0.5018. Clean inverted-U peaking at 20. (2)FAILURE: 20 may not be the exact argmax; 18 probes the immediate left of the peak. (3)ONE KNOB: dc_n_cg 20->18. (4)HYPOTHESIS: n_cg18 lands between 15(0.494) and 20(0.516); if >0.516 the true peak is 18, else 20 stands. Final argmax refinement. (5)BUDGET: 18 CG ~4min. (6)Serial.", "agent": "fastdiff_flow_pixel_constrained-claude-agentic", "campaign": "search-20260703-01", "cfg_full": {"dataset_kind": "breast_ct", "det_spacing": 0.35754, "display_max": 0.5, "display_min": 0.0, "fd_recon_ckpt": "/cluster/maier/Agent4CT/checkpoints/fast_diffusion_pixel_breast.pt", "fd_recon_dc": 1, "fd_recon_dc_n_cg": 18, "fd_recon_dc_relax": 1.0, "fd_recon_eta": 1.0, "fd_recon_init": "fbp", "fd_recon_init_t": 0.01, "fd_recon_steps": 8, "image_size": 512, "n_angles": 128, "n_det": 1024, "noise_i0": 100000.0, "noise_sigma_e": 10.0, "pixel_spacing": 0.3516, "rationale": "iter-17 EXPLORATORY dc_n_cg 20->18 fine near the argmax at init_t0.01. SIX-BOX: (1)PRIOR: n_cg argmax at init_t0.01 is ~20: n_cg15 hr0.4938, n_cg20 hr0.5164 (BEST), n_cg25 hr0.5018. Clean inverted-U peaking at 20. (2)FAILURE: 20 may not be the exact argmax; 18 probes the immediate left of the peak. (3)ONE KNOB: dc_n_cg 20->18. (4)HYPOTHESIS: n_cg18 lands between 15(0.494) and 20(0.516); if >0.516 the true peak is 18, else 20 stands. Final argmax refinement. (5)BUDGET: 18 CG ~4min. (6)Serial.", "sdd": 1000.0, "seed": 42, "sod": 500.0, "train_n": 400, "val_n": 200}, "challenge": "breast_ct", "change_class": "architecture", "git_commit": "671da566", "images": {"comparison": "runs/breast-ct-claude-agentic-fastdiff-flow-pixel-constrained-search-20260703-01/iterations/iter-0017/comparison.png", "test_showcase": null, "valtest_showcase": null}, "iter": 17, "kept": true, "metrics": {"headroom": 0.5108074604274189, "headroom_std": 0.023198374422274116, "val_psnr": 42.534603118896484, "val_psnr_std": 0.5102031644680598, "val_rmse": 0.002550788689404726, "val_rmse_std": 0.00015210042922800347, "val_ssim": 0.9774112701416016, "val_ssim_std": 0.004072943062326343}, "model": "claude-opus-4-8-1m", "obs_path": "breast-ct-claude-agentic-fastdiff-flow-pixel-constrained-search-20260703-01/iterations/iter-0017/observation.json", "obs_sha1": "3a35f5ff54e334eb71221e456b04828962b8725a", "params_M": 3.822787, "params_source": "observation", "rationale": "fastdiff_flow_pixel_constrained-claude-agentic: image_size=512, pixel_spacing=0.3516, n_angles=128, n_det=1024, det_spacing=0.35754, sod=500.0, sdd=1000.0, display_min=0.0, display_max=0.5, train_n=400, val_n=200, noise_i0=100000.0, noise_sigma_e=10.0, seed=42, dataset_kind=breast_ct, fd_recon_ckpt=/cluster/maier/Agent4CT/checkpoints/fast_diffusion_pixel_breast.pt, fd_recon_steps=8, fd_recon_init=fbp, fd_recon_init_t=0.01, fd_recon_eta=1.0, fd_recon_dc=1, fd_recon_dc_n_cg=18, fd_recon_dc_relax=1.0, rationale=iter-17 EXPLORATORY dc_n_cg 20->18 fine near the argmax at init_t0.01. SIX-BOX: (1)PRIOR: n_cg argmax at init_t0.01 is ~20: n_cg15 hr0.4938, n_cg20 hr0.5164 (BEST), n_cg25 hr0.5018. Clean inverted-U peaking at 20. (2)FAILURE: 20 may not be the exact argmax; 18 probes the immediate left of the peak. (3)ONE KNOB: dc_n_cg 20->18. (4)HYPOTHESIS: n_cg18 lands between 15(0.494) and 20(0.516); if >0.516 the true peak is 18, else 20 stands. Final argmax refinement. (5)BUDGET: 18 CG ~4min. (6)Serial.", "run_id": "breast-ct-claude-agentic-fastdiff-flow-pixel-constrained-search-20260703-01", "runtime": {"elapsed_s": 227.08469557762146}, "schema_version": 3, "solver_key": "fastdiff-flow-pixel-constrained", "solver_name": "Fast-diffusion flow (pixel, constrained DC)", "split": {"train_n": 400, "val_n": 200}, "status": "keep", "ts": "2026-07-06T22:28:31Z"}
{"advice_for_others": "fastdiff_flow_pixel_constrained-claude-agentic: image_size=512, pixel_spacing=0.3516, n_angles=128, n_det=1024, det_spacing=0.35754, sod=500.0, sdd=1000.0, display_min=0.0, display_max=0.5, train_n=400, val_n=200, noise_i0=100000.0, noise_sigma_e=10.0, seed=42, dataset_kind=breast_ct, fd_recon_ckpt=/cluster/maier/Agent4CT/checkpoints/fast_diffusion_pixel_breast.pt, fd_recon_steps=8, fd_recon_init=fbp, fd_recon_init_t=0.01, fd_recon_eta=1.0, fd_recon_dc=1, fd_recon_dc_n_cg=20, fd_recon_dc_relax=1.0, rationale=iter-18 CHAMPION CONFIRMATION toward the HARD iter-20 stop. Locks the best config found: init_t0.01, n_cg20, relax1.0, steps8, eta1.0 (iter-15, hr=0.5164, rmse0.002522, psnr42.63, ssim0.978 - HALF the FBP baseline rmse0.00521). SEARCH SUMMARY: the breast-native prior + few-step flow with a deep-but-not-over-converged CG data-consistency step (DC-ON constrained variant) CLEARS the strong 128-view breast FBP baseline by a wide margin. Two levers dominate: init_t (optimum ~0.01: near-FBP embed so the prior lightly denoises without repainting; higher init_t catastrophically repaints, lower loses the prior's denoise) and dc_n_cg (SEMI-CONVERGENCE peak at ~20: enough CG to beat the analytic Hann FBP on sparse data, but not so many that CG re-amplifies measurement noise). dc_relax=1.0 (full projection) best; eta/steps near-neutral. This confirms the FAIR TEST: prior-mismatch (Mayo out_scale0.05 vs breast0.5) WAS the cause of the old hr=0; a matched breast-native prior lifts pixel-DC-on to hr~0.52. Confirmation run reproduces the champion (deterministic seed=42).", "agent": "fastdiff_flow_pixel_constrained-claude-agentic", "campaign": "search-20260703-01", "cfg_full": {"dataset_kind": "breast_ct", "det_spacing": 0.35754, "display_max": 0.5, "display_min": 0.0, "fd_recon_ckpt": "/cluster/maier/Agent4CT/checkpoints/fast_diffusion_pixel_breast.pt", "fd_recon_dc": 1, "fd_recon_dc_n_cg": 20, "fd_recon_dc_relax": 1.0, "fd_recon_eta": 1.0, "fd_recon_init": "fbp", "fd_recon_init_t": 0.01, "fd_recon_steps": 8, "image_size": 512, "n_angles": 128, "n_det": 1024, "noise_i0": 100000.0, "noise_sigma_e": 10.0, "pixel_spacing": 0.3516, "rationale": "iter-18 CHAMPION CONFIRMATION toward the HARD iter-20 stop. Locks the best config found: init_t0.01, n_cg20, relax1.0, steps8, eta1.0 (iter-15, hr=0.5164, rmse0.002522, psnr42.63, ssim0.978 - HALF the FBP baseline rmse0.00521). SEARCH SUMMARY: the breast-native prior + few-step flow with a deep-but-not-over-converged CG data-consistency step (DC-ON constrained variant) CLEARS the strong 128-view breast FBP baseline by a wide margin. Two levers dominate: init_t (optimum ~0.01: near-FBP embed so the prior lightly denoises without repainting; higher init_t catastrophically repaints, lower loses the prior's denoise) and dc_n_cg (SEMI-CONVERGENCE peak at ~20: enough CG to beat the analytic Hann FBP on sparse data, but not so many that CG re-amplifies measurement noise). dc_relax=1.0 (full projection) best; eta/steps near-neutral. This confirms the FAIR TEST: prior-mismatch (Mayo out_scale0.05 vs breast0.5) WAS the cause of the old hr=0; a matched breast-native prior lifts pixel-DC-on to hr~0.52. Confirmation run reproduces the champion (deterministic seed=42).", "sdd": 1000.0, "seed": 42, "sod": 500.0, "train_n": 400, "val_n": 200}, "challenge": "breast_ct", "change_class": "architecture", "git_commit": "671da566", "images": {"comparison": "runs/breast-ct-claude-agentic-fastdiff-flow-pixel-constrained-search-20260703-01/iterations/iter-0018/comparison.png", "test_showcase": null, "valtest_showcase": null}, "iter": 18, "kept": true, "metrics": {"headroom": 0.5164004501326134, "headroom_std": 0.022856054105674734, "val_psnr": 42.634483337402344, "val_psnr_std": 0.550471215683283, "val_rmse": 0.002521625254303217, "val_rmse_std": 0.00016314177089112568, "val_ssim": 0.9778556823730469, "val_ssim_std": 0.0042966422544665215}, "model": "claude-opus-4-8-1m", "obs_path": "breast-ct-claude-agentic-fastdiff-flow-pixel-constrained-search-20260703-01/iterations/iter-0018/observation.json", "obs_sha1": "fd1a8324fb7efe4ddb025f1b83d6d0c6aa0f1e2a", "params_M": 3.822787, "params_source": "observation", "rationale": "fastdiff_flow_pixel_constrained-claude-agentic: image_size=512, pixel_spacing=0.3516, n_angles=128, n_det=1024, det_spacing=0.35754, sod=500.0, sdd=1000.0, display_min=0.0, display_max=0.5, train_n=400, val_n=200, noise_i0=100000.0, noise_sigma_e=10.0, seed=42, dataset_kind=breast_ct, fd_recon_ckpt=/cluster/maier/Agent4CT/checkpoints/fast_diffusion_pixel_breast.pt, fd_recon_steps=8, fd_recon_init=fbp, fd_recon_init_t=0.01, fd_recon_eta=1.0, fd_recon_dc=1, fd_recon_dc_n_cg=20, fd_recon_dc_relax=1.0, rationale=iter-18 CHAMPION CONFIRMATION toward the HARD iter-20 stop. Locks the best config found: init_t0.01, n_cg20, relax1.0, steps8, eta1.0 (iter-15, hr=0.5164, rmse0.002522, psnr42.63, ssim0.978 - HALF the FBP baseline rmse0.00521). SEARCH SUMMARY: the breast-native prior + few-step flow with a deep-but-not-over-converged CG data-consistency step (DC-ON constrained variant) CLEARS the strong 128-view breast FBP baseline by a wide margin. Two levers dominate: init_t (optimum ~0.01: near-FBP embed so the prior lightly denoises without repainting; higher init_t catastrophically repaints, lower loses the prior's denoise) and dc_n_cg (SEMI-CONVERGENCE peak at ~20: enough CG to beat the analytic Hann FBP on sparse data, but not so many that CG re-amplifies measurement noise). dc_relax=1.0 (full projection) best; eta/steps near-neutral. This confirms the FAIR TEST: prior-mismatch (Mayo out_scale0.05 vs breast0.5) WAS the cause of the old hr=0; a matched breast-native prior lifts pixel-DC-on to hr~0.52. Confirmation run reproduces the champion (deterministic seed=42).", "run_id": "breast-ct-claude-agentic-fastdiff-flow-pixel-constrained-search-20260703-01", "runtime": {"elapsed_s": 233.05994510650635}, "schema_version": 3, "solver_key": "fastdiff-flow-pixel-constrained", "solver_name": "Fast-diffusion flow (pixel, constrained DC)", "split": {"train_n": 400, "val_n": 200}, "status": "keep", "ts": "2026-07-06T22:33:25Z"}
{"advice_for_others": "fastdiff_flow_pixel_constrained-claude-agentic: image_size=512, pixel_spacing=0.3516, n_angles=128, n_det=1024, det_spacing=0.35754, sod=500.0, sdd=1000.0, display_min=0.0, display_max=0.5, train_n=400, val_n=200, noise_i0=100000.0, noise_sigma_e=10.0, seed=42, dataset_kind=breast_ct, fd_recon_ckpt=/cluster/maier/Agent4CT/checkpoints/fast_diffusion_pixel_breast.pt, fd_recon_steps=8, fd_recon_init=fbp, fd_recon_init_t=0.01, fd_recon_eta=1.0, fd_recon_dc=1, fd_recon_dc_n_cg=20, fd_recon_dc_relax=1.0, rationale=iter-19 CHAMPION CONFIRMATION toward the HARD iter-20 stop. Locks the best config found: init_t0.01, n_cg20, relax1.0, steps8, eta1.0 (iter-15, hr=0.5164, rmse0.002522, psnr42.63, ssim0.978 - HALF the FBP baseline rmse0.00521). SEARCH SUMMARY: the breast-native prior + few-step flow with a deep-but-not-over-converged CG data-consistency step (DC-ON constrained variant) CLEARS the strong 128-view breast FBP baseline by a wide margin. Two levers dominate: init_t (optimum ~0.01: near-FBP embed so the prior lightly denoises without repainting; higher init_t catastrophically repaints, lower loses the prior's denoise) and dc_n_cg (SEMI-CONVERGENCE peak at ~20: enough CG to beat the analytic Hann FBP on sparse data, but not so many that CG re-amplifies measurement noise). dc_relax=1.0 (full projection) best; eta/steps near-neutral. This confirms the FAIR TEST: prior-mismatch (Mayo out_scale0.05 vs breast0.5) WAS the cause of the old hr=0; a matched breast-native prior lifts pixel-DC-on to hr~0.52. Confirmation run reproduces the champion (deterministic seed=42).", "agent": "fastdiff_flow_pixel_constrained-claude-agentic", "campaign": "search-20260703-01", "cfg_full": {"dataset_kind": "breast_ct", "det_spacing": 0.35754, "display_max": 0.5, "display_min": 0.0, "fd_recon_ckpt": "/cluster/maier/Agent4CT/checkpoints/fast_diffusion_pixel_breast.pt", "fd_recon_dc": 1, "fd_recon_dc_n_cg": 20, "fd_recon_dc_relax": 1.0, "fd_recon_eta": 1.0, "fd_recon_init": "fbp", "fd_recon_init_t": 0.01, "fd_recon_steps": 8, "image_size": 512, "n_angles": 128, "n_det": 1024, "noise_i0": 100000.0, "noise_sigma_e": 10.0, "pixel_spacing": 0.3516, "rationale": "iter-19 CHAMPION CONFIRMATION toward the HARD iter-20 stop. Locks the best config found: init_t0.01, n_cg20, relax1.0, steps8, eta1.0 (iter-15, hr=0.5164, rmse0.002522, psnr42.63, ssim0.978 - HALF the FBP baseline rmse0.00521). SEARCH SUMMARY: the breast-native prior + few-step flow with a deep-but-not-over-converged CG data-consistency step (DC-ON constrained variant) CLEARS the strong 128-view breast FBP baseline by a wide margin. Two levers dominate: init_t (optimum ~0.01: near-FBP embed so the prior lightly denoises without repainting; higher init_t catastrophically repaints, lower loses the prior's denoise) and dc_n_cg (SEMI-CONVERGENCE peak at ~20: enough CG to beat the analytic Hann FBP on sparse data, but not so many that CG re-amplifies measurement noise). dc_relax=1.0 (full projection) best; eta/steps near-neutral. This confirms the FAIR TEST: prior-mismatch (Mayo out_scale0.05 vs breast0.5) WAS the cause of the old hr=0; a matched breast-native prior lifts pixel-DC-on to hr~0.52. Confirmation run reproduces the champion (deterministic seed=42).", "sdd": 1000.0, "seed": 42, "sod": 500.0, "train_n": 400, "val_n": 200}, "challenge": "breast_ct", "change_class": "architecture", "git_commit": "671da566", "images": {"comparison": "runs/breast-ct-claude-agentic-fastdiff-flow-pixel-constrained-search-20260703-01/iterations/iter-0019/comparison.png", "test_showcase": null, "valtest_showcase": null}, "iter": 19, "kept": true, "metrics": {"headroom": 0.5163998249980419, "headroom_std": 0.022850675515486474, "val_psnr": 42.63446807861328, "val_psnr_std": 0.5504896014680055, "val_rmse": 0.002521628513932228, "val_rmse_std": 0.0001631336615557759, "val_ssim": 0.9778560996055603, "val_ssim_std": 0.004297053994220412}, "model": "claude-opus-4-8-1m", "obs_path": "breast-ct-claude-agentic-fastdiff-flow-pixel-constrained-search-20260703-01/iterations/iter-0019/observation.json", "obs_sha1": "80123c6b88ae6e9656e4865de2f125a8ff0416a4", "params_M": 3.822787, "params_source": "observation", "rationale": "fastdiff_flow_pixel_constrained-claude-agentic: image_size=512, pixel_spacing=0.3516, n_angles=128, n_det=1024, det_spacing=0.35754, sod=500.0, sdd=1000.0, display_min=0.0, display_max=0.5, train_n=400, val_n=200, noise_i0=100000.0, noise_sigma_e=10.0, seed=42, dataset_kind=breast_ct, fd_recon_ckpt=/cluster/maier/Agent4CT/checkpoints/fast_diffusion_pixel_breast.pt, fd_recon_steps=8, fd_recon_init=fbp, fd_recon_init_t=0.01, fd_recon_eta=1.0, fd_recon_dc=1, fd_recon_dc_n_cg=20, fd_recon_dc_relax=1.0, rationale=iter-19 CHAMPION CONFIRMATION toward the HARD iter-20 stop. Locks the best config found: init_t0.01, n_cg20, relax1.0, steps8, eta1.0 (iter-15, hr=0.5164, rmse0.002522, psnr42.63, ssim0.978 - HALF the FBP baseline rmse0.00521). SEARCH SUMMARY: the breast-native prior + few-step flow with a deep-but-not-over-converged CG data-consistency step (DC-ON constrained variant) CLEARS the strong 128-view breast FBP baseline by a wide margin. Two levers dominate: init_t (optimum ~0.01: near-FBP embed so the prior lightly denoises without repainting; higher init_t catastrophically repaints, lower loses the prior's denoise) and dc_n_cg (SEMI-CONVERGENCE peak at ~20: enough CG to beat the analytic Hann FBP on sparse data, but not so many that CG re-amplifies measurement noise). dc_relax=1.0 (full projection) best; eta/steps near-neutral. This confirms the FAIR TEST: prior-mismatch (Mayo out_scale0.05 vs breast0.5) WAS the cause of the old hr=0; a matched breast-native prior lifts pixel-DC-on to hr~0.52. Confirmation run reproduces the champion (deterministic seed=42).", "run_id": "breast-ct-claude-agentic-fastdiff-flow-pixel-constrained-search-20260703-01", "runtime": {"elapsed_s": 273.3507716655731}, "schema_version": 3, "solver_key": "fastdiff-flow-pixel-constrained", "solver_name": "Fast-diffusion flow (pixel, constrained DC)", "split": {"train_n": 400, "val_n": 200}, "status": "keep", "ts": "2026-07-06T22:38:29Z"}
