{"advice_for_others": "itnet_v2-claude-agentic: itnet_k=1, unet_c=64, itnet_alpha_init=0.0026, residual_learning=False, pretrain_lr=0.00025, pretrain_epochs=15, pretrain_patience=15, grad_clip=1.0, train_n=1200, val_n=200, seed=42, rationale=ITER-8 (breast itnet_v2, extend-to-20, 20-min budget). SIX-BOX (VERIFIED): i5 c32/n1200 hr0.8499; i6 c32/n2400 hr0.8574 (~15min, near budget); i7 c48/n1200 hr0.8621 (BEST, beats i6 at HALF the data, well within budget). (2) FINDING: denoiser WIDTH is the EFFICIENT lever -- c32->c48 at n1200 gave +0.012 (bigger than data doubling's +0.0075) and stays in budget, while data-scaling is diminishing AND expensive. (3) ONE KNOB: unet_c 48 -> 64. Hold n=1200 (fast, in-budget), k=1 (locked), all else = champion (alpha0.0026, residual False, lr2.5e-4, epochs15, patience15, grad_clip1.0, val_n200, seed42). (4) HYPOTHESIS: if c 48->64, hr rises above 0.8621 because the capacity axis is still paying (c16->32 +0.009, c32->48 +0.012 -- not yet saturated) and the wider denoiser closes more of the val generalization gap. FALSIFIER: hr <= ~0.863 (flat/down) => width saturates at 48; iter-9 pivots to DEPTH (more U-Net levels via a different knob) or combines best-c with n2400, or tunes pretrain_epochs. (5) BUDGET: c64/n1200 ~1.8x c48 conv FLOPs on the fast n1200 base (i7 fit comfortably) -> well under 20min. (6) Serial gated loop; dispatch iter-9 only after iter-8 writes numeric-hr observation.json.", "agent": "itnet_v2-claude-agentic", "campaign": "search-20260703-01", "cfg_full": {"grad_clip": 1.0, "itnet_alpha_init": 0.0026, "itnet_k": 1, "pretrain_epochs": 15, "pretrain_lr": 0.00025, "pretrain_patience": 15, "rationale": "ITER-8 (breast itnet_v2, extend-to-20, 20-min budget). SIX-BOX (VERIFIED): i5 c32/n1200 hr0.8499; i6 c32/n2400 hr0.8574 (~15min, near budget); i7 c48/n1200 hr0.8621 (BEST, beats i6 at HALF the data, well within budget). (2) FINDING: denoiser WIDTH is the EFFICIENT lever -- c32->c48 at n1200 gave +0.012 (bigger than data doubling's +0.0075) and stays in budget, while data-scaling is diminishing AND expensive. (3) ONE KNOB: unet_c 48 -> 64. Hold n=1200 (fast, in-budget), k=1 (locked), all else = champion (alpha0.0026, residual False, lr2.5e-4, epochs15, patience15, grad_clip1.0, val_n200, seed42). (4) HYPOTHESIS: if c 48->64, hr rises above 0.8621 because the capacity axis is still paying (c16->32 +0.009, c32->48 +0.012 -- not yet saturated) and the wider denoiser closes more of the val generalization gap. FALSIFIER: hr <= ~0.863 (flat/down) => width saturates at 48; iter-9 pivots to DEPTH (more U-Net levels via a different knob) or combines best-c with n2400, or tunes pretrain_epochs. (5) BUDGET: c64/n1200 ~1.8x c48 conv FLOPs on the fast n1200 base (i7 fit comfortably) -> well under 20min. (6) Serial gated loop; dispatch iter-9 only after iter-8 writes numeric-hr observation.json.", "residual_learning": false, "seed": 42, "train_n": 1200, "unet_c": 64, "val_n": 200}, "challenge": "breast_ct", "change_class": "architecture", "git_commit": null, "images": {"comparison": "runs/breast-ct-claude-agentic-itnet-v2-search-20260703-01/iterations/iter-0008/comparison.png", "test_showcase": null, "valtest_showcase": null}, "iter": 8, "kept": true, "metrics": {"headroom": 0.6035291152724416, "headroom_std": 0.022916662556876605, "val_psnr": 44.35996627807617, "val_psnr_std": 1.1132053630838186, "val_rmse": 0.0020673125982284546, "val_rmse_std": 0.0002410048122026527, "val_ssim": 0.9902437925338745, "val_ssim_std": 0.002092641691015829}, "model": "claude-opus-4-8-1m", "obs_path": "breast-ct-claude-agentic-itnet-v2-search-20260703-01/iterations/iter-0008/observation.json", "obs_sha1": "47a4f8fb7a3c879c3ad6a96cfbd50be9b32d63b5", "params_M": 3.705538, "params_source": "observation", "rationale": "itnet_v2-claude-agentic: itnet_k=1, unet_c=64, itnet_alpha_init=0.0026, residual_learning=False, pretrain_lr=0.00025, pretrain_epochs=15, pretrain_patience=15, grad_clip=1.0, train_n=1200, val_n=200, seed=42, rationale=ITER-8 (breast itnet_v2, extend-to-20, 20-min budget). SIX-BOX (VERIFIED): i5 c32/n1200 hr0.8499; i6 c32/n2400 hr0.8574 (~15min, near budget); i7 c48/n1200 hr0.8621 (BEST, beats i6 at HALF the data, well within budget). (2) FINDING: denoiser WIDTH is the EFFICIENT lever -- c32->c48 at n1200 gave +0.012 (bigger than data doubling's +0.0075) and stays in budget, while data-scaling is diminishing AND expensive. (3) ONE KNOB: unet_c 48 -> 64. Hold n=1200 (fast, in-budget), k=1 (locked), all else = champion (alpha0.0026, residual False, lr2.5e-4, epochs15, patience15, grad_clip1.0, val_n200, seed42). (4) HYPOTHESIS: if c 48->64, hr rises above 0.8621 because the capacity axis is still paying (c16->32 +0.009, c32->48 +0.012 -- not yet saturated) and the wider denoiser closes more of the val generalization gap. FALSIFIER: hr <= ~0.863 (flat/down) => width saturates at 48; iter-9 pivots to DEPTH (more U-Net levels via a different knob) or combines best-c with n2400, or tunes pretrain_epochs. (5) BUDGET: c64/n1200 ~1.8x c48 conv FLOPs on the fast n1200 base (i7 fit comfortably) -> well under 20min. (6) Serial gated loop; dispatch iter-9 only after iter-8 writes numeric-hr observation.json.", "run_id": "breast-ct-claude-agentic-itnet-v2-search-20260703-01", "runtime": {"elapsed_s": 1599.871433019638}, "schema_version": 3, "solver_key": "itnet-v2", "solver_name": "ITNet v2", "split": {"train_n": 400, "val_n": 200}, "status": "keep", "ts": "2026-07-03T23:09:54Z"}
{"advice_for_others": "itnet_v2-claude-agentic: itnet_k=1, unet_c=64, itnet_alpha_init=0.0026, residual_learning=False, pretrain_lr=0.0005, pretrain_epochs=15, pretrain_patience=15, grad_clip=1.0, train_n=1200, val_n=200, seed=42, rationale=ITER-10 (breast itnet_v2, extend-to-20, 20-min budget). SIX-BOX (VERIFIED): i7 c48/n1200 0.8621; i8 c64/n1200 0.8650; i9 c64/n2400 0.8686=BEST. (2) FINDING: width AND data are both heavily DIMINISHING near c=64/n2400 (c48->64 +0.0029; c64 n1200->2400 +0.0036). The two obvious capacity/data axes are near-saturated. The recon IS the pretrained denoiser (the single k=1 DC step barely moves PSNR ~53/SSIM0.9986), so DENOISER TRAINING QUALITY dominates -- and pretrain_lr has been fixed at 2.5e-4 all along. (3) ONE KNOB vs iter-8 (c64/n1200 fast baseline): pretrain_lr 0.00025 -> 0.0005 (2x). Hold c=64, n=1200 (fast, isolate lr cheaply -- NOT at slow n2400), k=1, all else = champion (alpha0.0026, residual False, epochs15, patience15, grad_clip1.0, val_n200, seed42). (4) HYPOTHESIS: if pretrain_lr 2.5e-4->5e-4, hr rises above iter-8's 0.8650 (and possibly above the 0.8686 best) because a higher lr may reach a better denoiser minimum within 15 epochs -- the loss floored at ~1e-6 by epoch ~4 at 2.5e-4, suggesting headroom to move faster/further. grad_clip=1.0 guards against instability. FALSIFIER: hr <= ~0.865 (flat) or training destabilizes => lr is already near-optimal; iter-11 reverts lr and tries a DIFFERENT knob (alpha_init, or an architecture/depth change). (5) BUDGET: identical cost to iter-8 (c64/n1200, comfortably in budget) -- only lr changes. (6) Serial gated loop; dispatch iter-11 only after iter-10 writes numeric-hr observation.json.", "agent": "itnet_v2-claude-agentic", "campaign": "search-20260703-01", "cfg_full": {"grad_clip": 1.0, "itnet_alpha_init": 0.0026, "itnet_k": 1, "pretrain_epochs": 15, "pretrain_lr": 0.0005, "pretrain_patience": 15, "rationale": "ITER-10 (breast itnet_v2, extend-to-20, 20-min budget). SIX-BOX (VERIFIED): i7 c48/n1200 0.8621; i8 c64/n1200 0.8650; i9 c64/n2400 0.8686=BEST. (2) FINDING: width AND data are both heavily DIMINISHING near c=64/n2400 (c48->64 +0.0029; c64 n1200->2400 +0.0036). The two obvious capacity/data axes are near-saturated. The recon IS the pretrained denoiser (the single k=1 DC step barely moves PSNR ~53/SSIM0.9986), so DENOISER TRAINING QUALITY dominates -- and pretrain_lr has been fixed at 2.5e-4 all along. (3) ONE KNOB vs iter-8 (c64/n1200 fast baseline): pretrain_lr 0.00025 -> 0.0005 (2x). Hold c=64, n=1200 (fast, isolate lr cheaply -- NOT at slow n2400), k=1, all else = champion (alpha0.0026, residual False, epochs15, patience15, grad_clip1.0, val_n200, seed42). (4) HYPOTHESIS: if pretrain_lr 2.5e-4->5e-4, hr rises above iter-8's 0.8650 (and possibly above the 0.8686 best) because a higher lr may reach a better denoiser minimum within 15 epochs -- the loss floored at ~1e-6 by epoch ~4 at 2.5e-4, suggesting headroom to move faster/further. grad_clip=1.0 guards against instability. FALSIFIER: hr <= ~0.865 (flat) or training destabilizes => lr is already near-optimal; iter-11 reverts lr and tries a DIFFERENT knob (alpha_init, or an architecture/depth change). (5) BUDGET: identical cost to iter-8 (c64/n1200, comfortably in budget) -- only lr changes. (6) Serial gated loop; dispatch iter-11 only after iter-10 writes numeric-hr observation.json.", "residual_learning": false, "seed": 42, "train_n": 1200, "unet_c": 64, "val_n": 200}, "challenge": "breast_ct", "change_class": "architecture", "git_commit": null, "images": {"comparison": "runs/breast-ct-claude-agentic-itnet-v2-search-20260703-01/iterations/iter-0010/comparison.png", "test_showcase": null, "valtest_showcase": null}, "iter": 10, "kept": true, "metrics": {"headroom": 0.8618230674478229, "headroom_std": 0.016273774880189006, "val_psnr": 53.51548767089844, "val_psnr_std": 1.6190767667803372, "val_rmse": 0.0007204937282949686, "val_rmse_std": 0.0001270749292409842, "val_ssim": 0.9986385107040405, "val_ssim_std": 0.00048446171911099975}, "model": "claude-opus-4-8-1m", "obs_path": "breast-ct-claude-agentic-itnet-v2-search-20260703-01/iterations/iter-0010/observation.json", "obs_sha1": "ecb6c0e7b4d5c3c2e7357426bd0b1e2692955666", "params_M": 3.705538, "params_source": "observation", "rationale": "itnet_v2-claude-agentic: itnet_k=1, unet_c=64, itnet_alpha_init=0.0026, residual_learning=False, pretrain_lr=0.0005, pretrain_epochs=15, pretrain_patience=15, grad_clip=1.0, train_n=1200, val_n=200, seed=42, rationale=ITER-10 (breast itnet_v2, extend-to-20, 20-min budget). SIX-BOX (VERIFIED): i7 c48/n1200 0.8621; i8 c64/n1200 0.8650; i9 c64/n2400 0.8686=BEST. (2) FINDING: width AND data are both heavily DIMINISHING near c=64/n2400 (c48->64 +0.0029; c64 n1200->2400 +0.0036). The two obvious capacity/data axes are near-saturated. The recon IS the pretrained denoiser (the single k=1 DC step barely moves PSNR ~53/SSIM0.9986), so DENOISER TRAINING QUALITY dominates -- and pretrain_lr has been fixed at 2.5e-4 all along. (3) ONE KNOB vs iter-8 (c64/n1200 fast baseline): pretrain_lr 0.00025 -> 0.0005 (2x). Hold c=64, n=1200 (fast, isolate lr cheaply -- NOT at slow n2400), k=1, all else = champion (alpha0.0026, residual False, epochs15, patience15, grad_clip1.0, val_n200, seed42). (4) HYPOTHESIS: if pretrain_lr 2.5e-4->5e-4, hr rises above iter-8's 0.8650 (and possibly above the 0.8686 best) because a higher lr may reach a better denoiser minimum within 15 epochs -- the loss floored at ~1e-6 by epoch ~4 at 2.5e-4, suggesting headroom to move faster/further. grad_clip=1.0 guards against instability. FALSIFIER: hr <= ~0.865 (flat) or training destabilizes => lr is already near-optimal; iter-11 reverts lr and tries a DIFFERENT knob (alpha_init, or an architecture/depth change). (5) BUDGET: identical cost to iter-8 (c64/n1200, comfortably in budget) -- only lr changes. (6) Serial gated loop; dispatch iter-11 only after iter-10 writes numeric-hr observation.json.", "run_id": "breast-ct-claude-agentic-itnet-v2-search-20260703-01", "runtime": {"elapsed_s": 1571.0457093715668}, "schema_version": 3, "solver_key": "itnet-v2", "solver_name": "ITNet v2", "split": {"train_n": 400, "val_n": 200}, "status": "keep", "ts": "2026-07-03T23:01:49Z"}
{"advice_for_others": "itnet_v2-claude-agentic: itnet_k=1, unet_c=64, itnet_alpha_init=0.01, residual_learning=False, pretrain_lr=0.00025, pretrain_epochs=15, pretrain_patience=15, grad_clip=1.0, train_n=1200, val_n=200, seed=42, rationale=ITER-11 (breast itnet_v2, extend-to-20, 20-min budget). SIX-BOX (VERIFIED): i8 c64/n1200/lr2.5e-4 0.8650; i9 c64/n2400 0.8686=BEST; i10 c64/n1200/lr5e-4 0.8651 (= i8 -> pretrain_lr is a DEAD knob, denoiser converges regardless). (2) FINDING: width, data, AND lr are all saturated/dead; the pretrain-denoiser+single-DC family plateaus ~0.865-0.869. The single k=1 DC step is near-VESTIGIAL: learned alpha settled tiny (~0.0014-0.0018) from alpha_init=0.0026, so data-consistency barely contributes. (3) ONE KNOB vs iter-8 (c64/n1200/lr2.5e-4 baseline): itnet_alpha_init 0.0026 -> 0.01 (~4x larger initial DC step, still learnable via softplus(log_alpha)). Revert lr to 2.5e-4. Hold c=64, n=1200, k=1, all else = champion. (4) HYPOTHESIS: if alpha_init 0.0026->0.01, hr rises above 0.8650 because a stronger initial DC step lets the single data-consistency correction actually enforce sinogram agreement on the denoised recon (currently the DC step is too weak to matter), and the learnable alpha can still shrink if 0.01 is too large. FALSIFIER: hr <= ~0.865 (flat) or worse (the k=2/k=4 collapse showed DC can CORRUPT on sparse breast) => a single DC step is intrinsically near-vestigial here regardless of alpha; iter-12 pivots to a real ARCHITECTURE change (denoiser depth / residual block) since scalar knobs are exhausted. (5) BUDGET: identical to iter-8 (c64/n1200) -- only alpha_init changes, no cost delta. (6) Serial gated loop; dispatch iter-12 only after iter-11 writes numeric-hr observation.json.", "agent": "itnet_v2-claude-agentic", "campaign": "search-20260703-01", "cfg_full": {"grad_clip": 1.0, "itnet_alpha_init": 0.01, "itnet_k": 1, "pretrain_epochs": 15, "pretrain_lr": 0.00025, "pretrain_patience": 15, "rationale": "ITER-11 (breast itnet_v2, extend-to-20, 20-min budget). SIX-BOX (VERIFIED): i8 c64/n1200/lr2.5e-4 0.8650; i9 c64/n2400 0.8686=BEST; i10 c64/n1200/lr5e-4 0.8651 (= i8 -> pretrain_lr is a DEAD knob, denoiser converges regardless). (2) FINDING: width, data, AND lr are all saturated/dead; the pretrain-denoiser+single-DC family plateaus ~0.865-0.869. The single k=1 DC step is near-VESTIGIAL: learned alpha settled tiny (~0.0014-0.0018) from alpha_init=0.0026, so data-consistency barely contributes. (3) ONE KNOB vs iter-8 (c64/n1200/lr2.5e-4 baseline): itnet_alpha_init 0.0026 -> 0.01 (~4x larger initial DC step, still learnable via softplus(log_alpha)). Revert lr to 2.5e-4. Hold c=64, n=1200, k=1, all else = champion. (4) HYPOTHESIS: if alpha_init 0.0026->0.01, hr rises above 0.8650 because a stronger initial DC step lets the single data-consistency correction actually enforce sinogram agreement on the denoised recon (currently the DC step is too weak to matter), and the learnable alpha can still shrink if 0.01 is too large. FALSIFIER: hr <= ~0.865 (flat) or worse (the k=2/k=4 collapse showed DC can CORRUPT on sparse breast) => a single DC step is intrinsically near-vestigial here regardless of alpha; iter-12 pivots to a real ARCHITECTURE change (denoiser depth / residual block) since scalar knobs are exhausted. (5) BUDGET: identical to iter-8 (c64/n1200) -- only alpha_init changes, no cost delta. (6) Serial gated loop; dispatch iter-12 only after iter-11 writes numeric-hr observation.json.", "residual_learning": false, "seed": 42, "train_n": 1200, "unet_c": 64, "val_n": 200}, "challenge": "breast_ct", "change_class": "architecture", "git_commit": null, "images": {"comparison": "runs/breast-ct-claude-agentic-itnet-v2-search-20260703-01/iterations/iter-0011/comparison.png", "test_showcase": null, "valtest_showcase": null}, "iter": 11, "kept": true, "metrics": {"headroom": 0.8033613307293204, "headroom_std": 0.017826948936467083, "val_psnr": 50.4508171081543, "val_psnr_std": 1.3613768338345322, "val_rmse": 0.0010253298096358776, "val_rmse_std": 0.0001549171767306747, "val_ssim": 0.9976308941841125, "val_ssim_std": 0.0007324168296970517}, "model": "claude-opus-4-8-1m", "obs_path": "breast-ct-claude-agentic-itnet-v2-search-20260703-01/iterations/iter-0011/observation.json", "obs_sha1": "0047eae780d149a52be4d1aec3887aaa27f34cf8", "params_M": 3.705538, "params_source": "observation", "rationale": "itnet_v2-claude-agentic: itnet_k=1, unet_c=64, itnet_alpha_init=0.01, residual_learning=False, pretrain_lr=0.00025, pretrain_epochs=15, pretrain_patience=15, grad_clip=1.0, train_n=1200, val_n=200, seed=42, rationale=ITER-11 (breast itnet_v2, extend-to-20, 20-min budget). SIX-BOX (VERIFIED): i8 c64/n1200/lr2.5e-4 0.8650; i9 c64/n2400 0.8686=BEST; i10 c64/n1200/lr5e-4 0.8651 (= i8 -> pretrain_lr is a DEAD knob, denoiser converges regardless). (2) FINDING: width, data, AND lr are all saturated/dead; the pretrain-denoiser+single-DC family plateaus ~0.865-0.869. The single k=1 DC step is near-VESTIGIAL: learned alpha settled tiny (~0.0014-0.0018) from alpha_init=0.0026, so data-consistency barely contributes. (3) ONE KNOB vs iter-8 (c64/n1200/lr2.5e-4 baseline): itnet_alpha_init 0.0026 -> 0.01 (~4x larger initial DC step, still learnable via softplus(log_alpha)). Revert lr to 2.5e-4. Hold c=64, n=1200, k=1, all else = champion. (4) HYPOTHESIS: if alpha_init 0.0026->0.01, hr rises above 0.8650 because a stronger initial DC step lets the single data-consistency correction actually enforce sinogram agreement on the denoised recon (currently the DC step is too weak to matter), and the learnable alpha can still shrink if 0.01 is too large. FALSIFIER: hr <= ~0.865 (flat) or worse (the k=2/k=4 collapse showed DC can CORRUPT on sparse breast) => a single DC step is intrinsically near-vestigial here regardless of alpha; iter-12 pivots to a real ARCHITECTURE change (denoiser depth / residual block) since scalar knobs are exhausted. (5) BUDGET: identical to iter-8 (c64/n1200) -- only alpha_init changes, no cost delta. (6) Serial gated loop; dispatch iter-12 only after iter-11 writes numeric-hr observation.json.", "run_id": "breast-ct-claude-agentic-itnet-v2-search-20260703-01", "runtime": {"elapsed_s": 1225.1569204330444}, "schema_version": 3, "solver_key": "itnet-v2", "solver_name": "ITNet v2", "split": {"train_n": 400, "val_n": 200}, "status": "keep", "ts": "2026-07-03T22:57:00Z"}
