{"advice_for_others": "dual_domain_bilateral_supervised-claude-agentic: proj_n_bf=1, img_n_bf=7, proj_kernel=3, proj_sx=0.01, proj_sy=0.3, proj_sr=0.0005, img_kernel=7, img_sx=0.5, img_sy=0.5, img_sr=0.02, epochs=10, batch_size=1, lr=0.01, optimizer=adam, lambda_neg=1.0, grad_clip=1.0, train_n=1600, val_n=200, val_chunk=10, seed=42, rationale=iter-13 dual_domain_bilateral_supervised, re-split Breast-CT val=200. SIX-BOX vs BEST (iter-12 train_n=800 hr=0.2561). (1) PRIOR: data lever POSITIVE -- train_n 400->800 gave +0.0006 (new best 0.2561); the ~24-param BF cannot overfit, so more unique scenes help. (2) Failure mode: 800 scenes may still under-sample the breast phantom distribution for the trainable sigmas. (3) ONE KNOB: train_n 800 -> 1600 (best config otherwise: img_n_bf7/img_kernel7/lr1e-2/lneg1.0/ep10). (4) HYPOTHESIS: doubling to 1600 unique scenes continues the small positive data trend and lifts hr above 0.2561 toward ~0.257; if flat, the tiny BF is data-saturated and iter-14 stops scaling data and characterizes seed variance. (5) BUDGET: 1600 scenes ep10 -> ~360s, inside 20 min (<= 2400 cap). (6) Loop continues. Artifacts saved.", "agent": "dual_domain_bilateral_supervised-claude-agentic", "campaign": "search-20260703-01", "cfg_full": {"batch_size": 1, "epochs": 10, "grad_clip": 1.0, "img_kernel": 7, "img_n_bf": 7, "img_sr": 0.02, "img_sx": 0.5, "img_sy": 0.5, "lambda_neg": 1.0, "lr": 0.01, "optimizer": "adam", "proj_kernel": 3, "proj_n_bf": 1, "proj_sr": 0.0005, "proj_sx": 0.01, "proj_sy": 0.3, "rationale": "iter-13 dual_domain_bilateral_supervised, re-split Breast-CT val=200. SIX-BOX vs BEST (iter-12 train_n=800 hr=0.2561). (1) PRIOR: data lever POSITIVE -- train_n 400->800 gave +0.0006 (new best 0.2561); the ~24-param BF cannot overfit, so more unique scenes help. (2) Failure mode: 800 scenes may still under-sample the breast phantom distribution for the trainable sigmas. (3) ONE KNOB: train_n 800 -> 1600 (best config otherwise: img_n_bf7/img_kernel7/lr1e-2/lneg1.0/ep10). (4) HYPOTHESIS: doubling to 1600 unique scenes continues the small positive data trend and lifts hr above 0.2561 toward ~0.257; if flat, the tiny BF is data-saturated and iter-14 stops scaling data and characterizes seed variance. (5) BUDGET: 1600 scenes ep10 -> ~360s, inside 20 min (<= 2400 cap). (6) Loop continues. Artifacts saved.", "seed": 42, "train_n": 1600, "val_chunk": 10, "val_n": 200}, "challenge": "breast_ct", "change_class": "architecture", "git_commit": "671da566", "images": {"comparison": "runs/breast-ct-claude-agentic-dual-domain-bilateral-supervised-search-20260703-01/iterations/iter-0013/comparison.png", "test_showcase": null, "valtest_showcase": null}, "iter": 13, "kept": true, "metrics": {"headroom": 0.25512393784054765, "headroom_std": 0.009507567426888729, "val_psnr": 38.88251495361328, "val_psnr_std": 0.5842297770665922, "val_rmse": 0.0038839951157569885, "val_rmse_std": 0.0002546905395939168, "val_ssim": 0.9833937883377075, "val_ssim_std": 0.003120085816405725}, "model": "claude-opus-4-8-1m", "obs_path": "breast-ct-claude-agentic-dual-domain-bilateral-supervised-search-20260703-01/iterations/iter-0013/observation.json", "obs_sha1": "b5f19107931494675e66f14d39bc136368a7f23d", "params_M": 2.4e-05, "params_source": "observation", "rationale": "dual_domain_bilateral_supervised-claude-agentic: proj_n_bf=1, img_n_bf=7, proj_kernel=3, proj_sx=0.01, proj_sy=0.3, proj_sr=0.0005, img_kernel=7, img_sx=0.5, img_sy=0.5, img_sr=0.02, epochs=10, batch_size=1, lr=0.01, optimizer=adam, lambda_neg=1.0, grad_clip=1.0, train_n=1600, val_n=200, val_chunk=10, seed=42, rationale=iter-13 dual_domain_bilateral_supervised, re-split Breast-CT val=200. SIX-BOX vs BEST (iter-12 train_n=800 hr=0.2561). (1) PRIOR: data lever POSITIVE -- train_n 400->800 gave +0.0006 (new best 0.2561); the ~24-param BF cannot overfit, so more unique scenes help. (2) Failure mode: 800 scenes may still under-sample the breast phantom distribution for the trainable sigmas. (3) ONE KNOB: train_n 800 -> 1600 (best config otherwise: img_n_bf7/img_kernel7/lr1e-2/lneg1.0/ep10). (4) HYPOTHESIS: doubling to 1600 unique scenes continues the small positive data trend and lifts hr above 0.2561 toward ~0.257; if flat, the tiny BF is data-saturated and iter-14 stops scaling data and characterizes seed variance. (5) BUDGET: 1600 scenes ep10 -> ~360s, inside 20 min (<= 2400 cap). (6) Loop continues. Artifacts saved.", "run_id": "breast-ct-claude-agentic-dual-domain-bilateral-supervised-search-20260703-01", "runtime": {"elapsed_s": 1323.2273106575012}, "schema_version": 3, "solver_key": "dual-domain-bilateral-supervised", "solver_name": "DD-BF supervised L2", "split": {"train_n": 400, "val_n": 200}, "status": "keep", "ts": "2026-07-05T18:11:44Z"}
{"advice_for_others": "dual_domain_bilateral_supervised-claude-agentic: proj_n_bf=1, img_n_bf=7, proj_kernel=3, proj_sx=0.01, proj_sy=0.3, proj_sr=0.0005, img_kernel=7, img_sx=0.5, img_sy=0.5, img_sr=0.02, epochs=10, batch_size=1, lr=0.01, optimizer=adam, lambda_neg=1.0, grad_clip=1.0, train_n=800, val_n=200, val_chunk=10, seed=43, rationale=iter-14 dual_domain_bilateral_supervised, re-split Breast-CT val=200. SIX-BOX vs BEST (iter-12 train_n=800/seed42 hr=0.2561). (1) PRIOR: data lever peaked at train_n=800 (0.2561); 1600 DROPPED (iter-13=0.2551) -> the ~24-param BF is data-saturated at 800; reverted. ALL config axes now mapped: best = img_n_bf7/img_kernel7/lr1e-2/lneg1.0/train_n800, hr=0.2561. Config deltas since iter-5 are all <=0.006. (2) Failure mode: NOT a failure -- but all 13 iters used seed=42, so the init/training NOISE FLOOR is unknown and the small config deltas may be partly seed luck (the sibling DD-UNet found seed variance ~+-0.04 DOMINATED its knob deltas). (3) ONE KNOB: seed 42 -> 43 (best config otherwise) -- a REPLICATE to measure variance at the optimum. (4) HYPOTHESIS: at the plateau config, changing only the seed yields hr within a modest band of 0.2561; the honest reportable number is the seed mean+-std, not the seed-42 peak. If it lands much lower, iters 15-20 add seeds for an honest mean. (5) BUDGET: train_n800/ep10 -> ~200s. (6) Loop to iter-20: iters 14-20 = seed replicates to bound the noise floor at the best config. Artifacts saved.", "agent": "dual_domain_bilateral_supervised-claude-agentic", "campaign": "search-20260703-01", "cfg_full": {"batch_size": 1, "epochs": 10, "grad_clip": 1.0, "img_kernel": 7, "img_n_bf": 7, "img_sr": 0.02, "img_sx": 0.5, "img_sy": 0.5, "lambda_neg": 1.0, "lr": 0.01, "optimizer": "adam", "proj_kernel": 3, "proj_n_bf": 1, "proj_sr": 0.0005, "proj_sx": 0.01, "proj_sy": 0.3, "rationale": "iter-14 dual_domain_bilateral_supervised, re-split Breast-CT val=200. SIX-BOX vs BEST (iter-12 train_n=800/seed42 hr=0.2561). (1) PRIOR: data lever peaked at train_n=800 (0.2561); 1600 DROPPED (iter-13=0.2551) -> the ~24-param BF is data-saturated at 800; reverted. ALL config axes now mapped: best = img_n_bf7/img_kernel7/lr1e-2/lneg1.0/train_n800, hr=0.2561. Config deltas since iter-5 are all <=0.006. (2) Failure mode: NOT a failure -- but all 13 iters used seed=42, so the init/training NOISE FLOOR is unknown and the small config deltas may be partly seed luck (the sibling DD-UNet found seed variance ~+-0.04 DOMINATED its knob deltas). (3) ONE KNOB: seed 42 -> 43 (best config otherwise) -- a REPLICATE to measure variance at the optimum. (4) HYPOTHESIS: at the plateau config, changing only the seed yields hr within a modest band of 0.2561; the honest reportable number is the seed mean+-std, not the seed-42 peak. If it lands much lower, iters 15-20 add seeds for an honest mean. (5) BUDGET: train_n800/ep10 -> ~200s. (6) Loop to iter-20: iters 14-20 = seed replicates to bound the noise floor at the best config. Artifacts saved.", "seed": 43, "train_n": 800, "val_chunk": 10, "val_n": 200}, "challenge": "breast_ct", "change_class": "architecture", "git_commit": "671da566", "images": {"comparison": "runs/breast-ct-claude-agentic-dual-domain-bilateral-supervised-search-20260703-01/iterations/iter-0014/comparison.png", "test_showcase": null, "valtest_showcase": null}, "iter": 14, "kept": true, "metrics": {"headroom": 0.2538466539538109, "headroom_std": 0.009367063097133144, "val_psnr": 38.86763381958008, "val_psnr_std": 0.5870185731145459, "val_rmse": 0.0038906552363187075, "val_rmse_std": 0.0002564135387203179, "val_ssim": 0.9831000566482544, "val_ssim_std": 0.0031720492262918157}, "model": "claude-opus-4-8-1m", "obs_path": "breast-ct-claude-agentic-dual-domain-bilateral-supervised-search-20260703-01/iterations/iter-0014/observation.json", "obs_sha1": "af73f9eeba6966f4a61d055fb9f79b63f2591b8b", "params_M": 2.4e-05, "params_source": "observation", "rationale": "dual_domain_bilateral_supervised-claude-agentic: proj_n_bf=1, img_n_bf=7, proj_kernel=3, proj_sx=0.01, proj_sy=0.3, proj_sr=0.0005, img_kernel=7, img_sx=0.5, img_sy=0.5, img_sr=0.02, epochs=10, batch_size=1, lr=0.01, optimizer=adam, lambda_neg=1.0, grad_clip=1.0, train_n=800, val_n=200, val_chunk=10, seed=43, rationale=iter-14 dual_domain_bilateral_supervised, re-split Breast-CT val=200. SIX-BOX vs BEST (iter-12 train_n=800/seed42 hr=0.2561). (1) PRIOR: data lever peaked at train_n=800 (0.2561); 1600 DROPPED (iter-13=0.2551) -> the ~24-param BF is data-saturated at 800; reverted. ALL config axes now mapped: best = img_n_bf7/img_kernel7/lr1e-2/lneg1.0/train_n800, hr=0.2561. Config deltas since iter-5 are all <=0.006. (2) Failure mode: NOT a failure -- but all 13 iters used seed=42, so the init/training NOISE FLOOR is unknown and the small config deltas may be partly seed luck (the sibling DD-UNet found seed variance ~+-0.04 DOMINATED its knob deltas). (3) ONE KNOB: seed 42 -> 43 (best config otherwise) -- a REPLICATE to measure variance at the optimum. (4) HYPOTHESIS: at the plateau config, changing only the seed yields hr within a modest band of 0.2561; the honest reportable number is the seed mean+-std, not the seed-42 peak. If it lands much lower, iters 15-20 add seeds for an honest mean. (5) BUDGET: train_n800/ep10 -> ~200s. (6) Loop to iter-20: iters 14-20 = seed replicates to bound the noise floor at the best config. Artifacts saved.", "run_id": "breast-ct-claude-agentic-dual-domain-bilateral-supervised-search-20260703-01", "runtime": {"elapsed_s": 737.3836348056793}, "schema_version": 3, "solver_key": "dual-domain-bilateral-supervised", "solver_name": "DD-BF supervised L2", "split": {"train_n": 400, "val_n": 200}, "status": "keep", "ts": "2026-07-05T18:24:49Z"}
{"advice_for_others": "dual_domain_bilateral_supervised-claude-agentic: proj_n_bf=1, img_n_bf=7, proj_kernel=3, proj_sx=0.01, proj_sy=0.3, proj_sr=0.0005, img_kernel=7, img_sx=0.5, img_sy=0.5, img_sr=0.02, epochs=10, batch_size=1, lr=0.01, optimizer=adam, lambda_neg=1.0, grad_clip=1.0, train_n=800, val_n=200, val_chunk=10, seed=44, rationale=iter-15 dual_domain_bilateral_supervised, re-split Breast-CT val=200. SIX-BOX at BEST config (img_n_bf7/img_kernel7/lr1e-2/lneg1.0/train_n800). (1) PRIOR: 2 seed replicates -- seed42(iter-12)=0.2561, seed43(iter-14)=0.2538 -> spread only 0.0023, FAR tighter than the sibling DD-UNet (~0.04). The tiny 24-param BF has a near-deterministic optimum (no large random-init variance). (2) Failure mode: n=2 std is unreliable; need n>=3 to trust the ~0.256 mean. (3) ONE KNOB: seed 44 (3rd replicate). (4) HYPOTHESIS: seed=44 lands in [0.253,0.257]; n=3 gives a stable mean ~0.255+-0.001. (5) BUDGET: train_n800/ep10 -> ~200s. (6) Loop to iter-20: seed replicates for an honest mean+-std at the best config. Artifacts saved.", "agent": "dual_domain_bilateral_supervised-claude-agentic", "campaign": "search-20260703-01", "cfg_full": {"batch_size": 1, "epochs": 10, "grad_clip": 1.0, "img_kernel": 7, "img_n_bf": 7, "img_sr": 0.02, "img_sx": 0.5, "img_sy": 0.5, "lambda_neg": 1.0, "lr": 0.01, "optimizer": "adam", "proj_kernel": 3, "proj_n_bf": 1, "proj_sr": 0.0005, "proj_sx": 0.01, "proj_sy": 0.3, "rationale": "iter-15 dual_domain_bilateral_supervised, re-split Breast-CT val=200. SIX-BOX at BEST config (img_n_bf7/img_kernel7/lr1e-2/lneg1.0/train_n800). (1) PRIOR: 2 seed replicates -- seed42(iter-12)=0.2561, seed43(iter-14)=0.2538 -> spread only 0.0023, FAR tighter than the sibling DD-UNet (~0.04). The tiny 24-param BF has a near-deterministic optimum (no large random-init variance). (2) Failure mode: n=2 std is unreliable; need n>=3 to trust the ~0.256 mean. (3) ONE KNOB: seed 44 (3rd replicate). (4) HYPOTHESIS: seed=44 lands in [0.253,0.257]; n=3 gives a stable mean ~0.255+-0.001. (5) BUDGET: train_n800/ep10 -> ~200s. (6) Loop to iter-20: seed replicates for an honest mean+-std at the best config. Artifacts saved.", "seed": 44, "train_n": 800, "val_chunk": 10, "val_n": 200}, "challenge": "breast_ct", "change_class": "architecture", "git_commit": "671da566", "images": {"comparison": "runs/breast-ct-claude-agentic-dual-domain-bilateral-supervised-search-20260703-01/iterations/iter-0015/comparison.png", "test_showcase": null, "valtest_showcase": null}, "iter": 15, "kept": true, "metrics": {"headroom": 0.2537802110793672, "headroom_std": 0.009359698407980899, "val_psnr": 38.86686325073242, "val_psnr_std": 0.5871440861147433, "val_rmse": 0.0038910016883164644, "val_rmse_std": 0.00025646314436745616, "val_ssim": 0.9830533266067505, "val_ssim_std": 0.0031769035437672196}, "model": "claude-opus-4-8-1m", "obs_path": "breast-ct-claude-agentic-dual-domain-bilateral-supervised-search-20260703-01/iterations/iter-0015/observation.json", "obs_sha1": "f0a00256747be3072a034b2e4d605031a1642c19", "params_M": 2.4e-05, "params_source": "observation", "rationale": "dual_domain_bilateral_supervised-claude-agentic: proj_n_bf=1, img_n_bf=7, proj_kernel=3, proj_sx=0.01, proj_sy=0.3, proj_sr=0.0005, img_kernel=7, img_sx=0.5, img_sy=0.5, img_sr=0.02, epochs=10, batch_size=1, lr=0.01, optimizer=adam, lambda_neg=1.0, grad_clip=1.0, train_n=800, val_n=200, val_chunk=10, seed=44, rationale=iter-15 dual_domain_bilateral_supervised, re-split Breast-CT val=200. SIX-BOX at BEST config (img_n_bf7/img_kernel7/lr1e-2/lneg1.0/train_n800). (1) PRIOR: 2 seed replicates -- seed42(iter-12)=0.2561, seed43(iter-14)=0.2538 -> spread only 0.0023, FAR tighter than the sibling DD-UNet (~0.04). The tiny 24-param BF has a near-deterministic optimum (no large random-init variance). (2) Failure mode: n=2 std is unreliable; need n>=3 to trust the ~0.256 mean. (3) ONE KNOB: seed 44 (3rd replicate). (4) HYPOTHESIS: seed=44 lands in [0.253,0.257]; n=3 gives a stable mean ~0.255+-0.001. (5) BUDGET: train_n800/ep10 -> ~200s. (6) Loop to iter-20: seed replicates for an honest mean+-std at the best config. Artifacts saved.", "run_id": "breast-ct-claude-agentic-dual-domain-bilateral-supervised-search-20260703-01", "runtime": {"elapsed_s": 495.6667423248291}, "schema_version": 3, "solver_key": "dual-domain-bilateral-supervised", "solver_name": "DD-BF supervised L2", "split": {"train_n": 400, "val_n": 200}, "status": "keep", "ts": "2026-07-05T18:34:02Z"}
{"advice_for_others": "dual_domain_bilateral_supervised-claude-agentic: proj_n_bf=1, img_n_bf=7, proj_kernel=3, proj_sx=0.01, proj_sy=0.3, proj_sr=0.0005, img_kernel=7, img_sx=0.5, img_sy=0.5, img_sr=0.02, epochs=10, batch_size=1, lr=0.01, optimizer=adam, lambda_neg=1.0, grad_clip=1.0, train_n=800, val_n=200, val_chunk=10, seed=45, rationale=iter-16 dual_domain_bilateral_supervised, re-split Breast-CT val=200. SIX-BOX at BEST config (img_n_bf7/img_kernel7/lr1e-2/lneg1.0/train_n800). (1) PRIOR: 3 seed replicates -- 42=0.2561, 43=0.2538, 44=0.2538 -> mean~0.2546 std~0.0011. The BF optimum is highly seed-robust (24 params, no random-init blow-up), UNLIKE the sibling DD-UNet (~0.04 spread). (2) Failure mode: n=3 std still noisy; add seeds for a solid mean+-std. (3) ONE KNOB: seed 45 (4th replicate). (4) HYPOTHESIS: seed=45 lands ~0.253-0.256; n=4 keeps mean ~0.254+-0.001. (5) BUDGET: ~200s. (6) Loop to iter-20: replicates for honest mean+-std. Artifacts saved.", "agent": "dual_domain_bilateral_supervised-claude-agentic", "campaign": "search-20260703-01", "cfg_full": {"batch_size": 1, "epochs": 10, "grad_clip": 1.0, "img_kernel": 7, "img_n_bf": 7, "img_sr": 0.02, "img_sx": 0.5, "img_sy": 0.5, "lambda_neg": 1.0, "lr": 0.01, "optimizer": "adam", "proj_kernel": 3, "proj_n_bf": 1, "proj_sr": 0.0005, "proj_sx": 0.01, "proj_sy": 0.3, "rationale": "iter-16 dual_domain_bilateral_supervised, re-split Breast-CT val=200. SIX-BOX at BEST config (img_n_bf7/img_kernel7/lr1e-2/lneg1.0/train_n800). (1) PRIOR: 3 seed replicates -- 42=0.2561, 43=0.2538, 44=0.2538 -> mean~0.2546 std~0.0011. The BF optimum is highly seed-robust (24 params, no random-init blow-up), UNLIKE the sibling DD-UNet (~0.04 spread). (2) Failure mode: n=3 std still noisy; add seeds for a solid mean+-std. (3) ONE KNOB: seed 45 (4th replicate). (4) HYPOTHESIS: seed=45 lands ~0.253-0.256; n=4 keeps mean ~0.254+-0.001. (5) BUDGET: ~200s. (6) Loop to iter-20: replicates for honest mean+-std. Artifacts saved.", "seed": 45, "train_n": 800, "val_chunk": 10, "val_n": 200}, "challenge": "breast_ct", "change_class": "architecture", "git_commit": "671da566", "images": {"comparison": "runs/breast-ct-claude-agentic-dual-domain-bilateral-supervised-search-20260703-01/iterations/iter-0016/comparison.png", "test_showcase": null, "valtest_showcase": null}, "iter": 16, "kept": true, "metrics": {"headroom": 0.256419082715038, "headroom_std": 0.009580980066591643, "val_psnr": 38.89763259887695, "val_psnr_std": 0.5801442748976379, "val_rmse": 0.003877241862937808, "val_rmse_std": 0.00025243330566139993, "val_ssim": 0.9834887385368347, "val_ssim_std": 0.0030879080483150407}, "model": "claude-opus-4-8-1m", "obs_path": "breast-ct-claude-agentic-dual-domain-bilateral-supervised-search-20260703-01/iterations/iter-0016/observation.json", "obs_sha1": "5e263fa866743af3169b9b1b66bd963204f319d7", "params_M": 2.4e-05, "params_source": "observation", "rationale": "dual_domain_bilateral_supervised-claude-agentic: proj_n_bf=1, img_n_bf=7, proj_kernel=3, proj_sx=0.01, proj_sy=0.3, proj_sr=0.0005, img_kernel=7, img_sx=0.5, img_sy=0.5, img_sr=0.02, epochs=10, batch_size=1, lr=0.01, optimizer=adam, lambda_neg=1.0, grad_clip=1.0, train_n=800, val_n=200, val_chunk=10, seed=45, rationale=iter-16 dual_domain_bilateral_supervised, re-split Breast-CT val=200. SIX-BOX at BEST config (img_n_bf7/img_kernel7/lr1e-2/lneg1.0/train_n800). (1) PRIOR: 3 seed replicates -- 42=0.2561, 43=0.2538, 44=0.2538 -> mean~0.2546 std~0.0011. The BF optimum is highly seed-robust (24 params, no random-init blow-up), UNLIKE the sibling DD-UNet (~0.04 spread). (2) Failure mode: n=3 std still noisy; add seeds for a solid mean+-std. (3) ONE KNOB: seed 45 (4th replicate). (4) HYPOTHESIS: seed=45 lands ~0.253-0.256; n=4 keeps mean ~0.254+-0.001. (5) BUDGET: ~200s. (6) Loop to iter-20: replicates for honest mean+-std. Artifacts saved.", "run_id": "breast-ct-claude-agentic-dual-domain-bilateral-supervised-search-20260703-01", "runtime": {"elapsed_s": 767.5445053577423}, "schema_version": 3, "solver_key": "dual-domain-bilateral-supervised", "solver_name": "DD-BF supervised L2", "split": {"train_n": 400, "val_n": 200}, "status": "keep", "ts": "2026-07-05T18:47:56Z"}
