{"advice_for_others": "hammernik_2017-claude-agentic: vn_T=3, vn_n_filters=16, vn_kernel=9, vn_n_bumps=31, vn_x_range=2.0, vn_filter_init_std=0.05, vn_rbf_init_std=0.01, vn_lambda_init=0.0097, epochs=30, batch_size=2, lr=0.00096, grad_clip=1.0, train_n=1600, val_n=200, seed=42, max_train_s=1000, rationale=iter-2 (six-box). PREV iter-1 NUMBERS: hr=0.5777, ssim=0.9849, PSNR=43.81, RMSE=2.20e-3, elapsed 1084.5s (fits 20-min budget), params 0.0054M, train_n=400. No failure mode -- clears the ~0.84 breast FBP floor strongly. DIAGNOSIS: this is a tiny 5.4k-param VN trained on only 400 of 3600 available train cases -> DATA-LIMITED, not capacity-limited (a 5k-param filter bank cannot overfit 400 cases, so more data should still lift it). ONE KNOB: train_n 400 -> 1600 (4x). All else held (T=3, filters=16, kernel=9, lambda_init=0.0097, epochs=30, lr=9.6e-4, batch=2, grad_clip=1.0, seed=42). HYPOTHESIS: feeding 4x more training data raises val hr above 0.5777 because the tiny filter bank is data-limited; predict hr > 0.59. BUDGET: max_train_s=1000 hard-caps wall (solver breaks epoch loop at 1000s); at 4x data the loop wall-truncates to ~7 epochs, staying under the 20-min budget + 30-min SLURM kill. batch_size=2 KEPT (512px OOM guard in the RBF-bump loop).", "agent": "hammernik_2017-claude-agentic", "campaign": "search-20260703-01", "cfg_full": {"batch_size": 2, "epochs": 30, "grad_clip": 1.0, "lr": 0.00096, "max_train_s": 1000, "rationale": "iter-2 (six-box). PREV iter-1 NUMBERS: hr=0.5777, ssim=0.9849, PSNR=43.81, RMSE=2.20e-3, elapsed 1084.5s (fits 20-min budget), params 0.0054M, train_n=400. No failure mode -- clears the ~0.84 breast FBP floor strongly. DIAGNOSIS: this is a tiny 5.4k-param VN trained on only 400 of 3600 available train cases -> DATA-LIMITED, not capacity-limited (a 5k-param filter bank cannot overfit 400 cases, so more data should still lift it). ONE KNOB: train_n 400 -> 1600 (4x). All else held (T=3, filters=16, kernel=9, lambda_init=0.0097, epochs=30, lr=9.6e-4, batch=2, grad_clip=1.0, seed=42). HYPOTHESIS: feeding 4x more training data raises val hr above 0.5777 because the tiny filter bank is data-limited; predict hr > 0.59. BUDGET: max_train_s=1000 hard-caps wall (solver breaks epoch loop at 1000s); at 4x data the loop wall-truncates to ~7 epochs, staying under the 20-min budget + 30-min SLURM kill. batch_size=2 KEPT (512px OOM guard in the RBF-bump loop).", "seed": 42, "train_n": 1600, "val_n": 200, "vn_T": 3, "vn_filter_init_std": 0.05, "vn_kernel": 9, "vn_lambda_init": 0.0097, "vn_n_bumps": 31, "vn_n_filters": 16, "vn_rbf_init_std": 0.01, "vn_x_range": 2.0}, "challenge": "breast_ct", "change_class": "architecture", "git_commit": null, "images": {"comparison": "runs/breast-ct-claude-agentic-hammernik-2017-search-20260703-01/iterations/iter-0002/comparison.png", "test_showcase": null, "valtest_showcase": null}, "iter": 2, "kept": true, "metrics": {"headroom": 0.09471128115168359, "headroom_std": 0.02980929302728411, "val_psnr": 37.188453674316406, "val_psnr_std": 0.3298991819639645, "val_rmse": 0.0047204322181642056, "val_rmse_std": 0.00016582608675806668, "val_ssim": 0.9566664099693298, "val_ssim_std": 0.004378868342844244}, "model": "claude-opus-4-8-1m", "obs_path": "breast-ct-claude-agentic-hammernik-2017-search-20260703-01/iterations/iter-0002/observation.json", "obs_sha1": "adb3f70fa9de78183b99d20d282b351d8c6317c4", "params_M": 0.005379, "params_source": "observation", "rationale": "hammernik_2017-claude-agentic: vn_T=3, vn_n_filters=16, vn_kernel=9, vn_n_bumps=31, vn_x_range=2.0, vn_filter_init_std=0.05, vn_rbf_init_std=0.01, vn_lambda_init=0.0097, epochs=30, batch_size=2, lr=0.00096, grad_clip=1.0, train_n=1600, val_n=200, seed=42, max_train_s=1000, rationale=iter-2 (six-box). PREV iter-1 NUMBERS: hr=0.5777, ssim=0.9849, PSNR=43.81, RMSE=2.20e-3, elapsed 1084.5s (fits 20-min budget), params 0.0054M, train_n=400. No failure mode -- clears the ~0.84 breast FBP floor strongly. DIAGNOSIS: this is a tiny 5.4k-param VN trained on only 400 of 3600 available train cases -> DATA-LIMITED, not capacity-limited (a 5k-param filter bank cannot overfit 400 cases, so more data should still lift it). ONE KNOB: train_n 400 -> 1600 (4x). All else held (T=3, filters=16, kernel=9, lambda_init=0.0097, epochs=30, lr=9.6e-4, batch=2, grad_clip=1.0, seed=42). HYPOTHESIS: feeding 4x more training data raises val hr above 0.5777 because the tiny filter bank is data-limited; predict hr > 0.59. BUDGET: max_train_s=1000 hard-caps wall (solver breaks epoch loop at 1000s); at 4x data the loop wall-truncates to ~7 epochs, staying under the 20-min budget + 30-min SLURM kill. batch_size=2 KEPT (512px OOM guard in the RBF-bump loop).", "run_id": "breast-ct-claude-agentic-hammernik-2017-search-20260703-01", "runtime": {"elapsed_s": 1137.4771475791931}, "schema_version": 3, "solver_key": "hammernik-2017", "solver_name": "Hammernik VN (2017)", "split": {"train_n": 400, "val_n": 200}, "status": "keep", "ts": "2026-07-03T23:46:04Z"}
{"advice_for_others": "hammernik_2017-claude-agentic: vn_T=3, vn_n_filters=16, vn_kernel=9, vn_n_bumps=31, vn_x_range=2.0, vn_filter_init_std=0.05, vn_rbf_init_std=0.01, vn_lambda_init=0.02, epochs=30, batch_size=2, lr=0.00096, grad_clip=1.0, train_n=400, val_n=200, seed=42, max_train_s=1100, rationale=iter-3 (six-box). PREV NUMBERS: iter-1 hr=0.5777 (train_n=400, 30 full epochs, ~1084s) BEST; iter-2 hr=0.0947 REGRESSED (train_n=1600 same 1000s wall -> epochs wall-truncated ~7-8, fewer effective passes/sample -> under-trained; SSIM 0.9849->0.9567, RMSE 2.2e-3->4.7e-3). FAILURE MODE (iter-2): under-training from the wall cap, NOT data-hunger -- my iter-2 data-limited hypothesis is FALSIFIED (train_n change was confounded by reduced effective epochs). LESSON: this VN needs its full epoch budget to converge; keep train_n at the working 400 where 30 epochs FIT the budget. RESET baseline to the iter-1 WINNER. ONE KNOB vs iter-1: vn_lambda_init 0.0097 -> 0.02 (~2x stronger data-fidelity anchor to the FBP init). HYPOTHESIS: a stronger lambda anchor keeps each unrolled step closer to the clean FBP init and reduces the learned regularizer over-smoothing the recon, so val hr rises above 0.5777; predict hr > 0.59. All else = iter-1 (T=3, filters=16, kernel=9, n_bumps=31, x_range=2.0, epochs=30, lr=9.6e-4, batch=2, grad_clip=1.0, seed=42, train_n=400). BUDGET: identical compute to iter-1 (lambda_init is free); max_train_s raised 1000->1100 so all 30 epochs complete (iter-1 hit 1084s and slightly clipped) -- still well under the 30-min SLURM kill. batch_size=2 (512px OOM guard).", "agent": "hammernik_2017-claude-agentic", "campaign": "search-20260703-01", "cfg_full": {"batch_size": 2, "epochs": 30, "grad_clip": 1.0, "lr": 0.00096, "max_train_s": 1100, "rationale": "iter-3 (six-box). PREV NUMBERS: iter-1 hr=0.5777 (train_n=400, 30 full epochs, ~1084s) BEST; iter-2 hr=0.0947 REGRESSED (train_n=1600 same 1000s wall -> epochs wall-truncated ~7-8, fewer effective passes/sample -> under-trained; SSIM 0.9849->0.9567, RMSE 2.2e-3->4.7e-3). FAILURE MODE (iter-2): under-training from the wall cap, NOT data-hunger -- my iter-2 data-limited hypothesis is FALSIFIED (train_n change was confounded by reduced effective epochs). LESSON: this VN needs its full epoch budget to converge; keep train_n at the working 400 where 30 epochs FIT the budget. RESET baseline to the iter-1 WINNER. ONE KNOB vs iter-1: vn_lambda_init 0.0097 -> 0.02 (~2x stronger data-fidelity anchor to the FBP init). HYPOTHESIS: a stronger lambda anchor keeps each unrolled step closer to the clean FBP init and reduces the learned regularizer over-smoothing the recon, so val hr rises above 0.5777; predict hr > 0.59. All else = iter-1 (T=3, filters=16, kernel=9, n_bumps=31, x_range=2.0, epochs=30, lr=9.6e-4, batch=2, grad_clip=1.0, seed=42, train_n=400). BUDGET: identical compute to iter-1 (lambda_init is free); max_train_s raised 1000->1100 so all 30 epochs complete (iter-1 hit 1084s and slightly clipped) -- still well under the 30-min SLURM kill. batch_size=2 (512px OOM guard).", "seed": 42, "train_n": 400, "val_n": 200, "vn_T": 3, "vn_filter_init_std": 0.05, "vn_kernel": 9, "vn_lambda_init": 0.02, "vn_n_bumps": 31, "vn_n_filters": 16, "vn_rbf_init_std": 0.01, "vn_x_range": 2.0}, "challenge": "breast_ct", "change_class": "architecture", "git_commit": null, "images": {"comparison": "runs/breast-ct-claude-agentic-hammernik-2017-search-20260703-01/iterations/iter-0003/comparison.png", "test_showcase": null, "valtest_showcase": null}, "iter": 3, "kept": true, "metrics": {"headroom": 0.5920946017932968, "headroom_std": 0.01319216910218408, "val_psnr": 44.113006591796875, "val_psnr_std": 0.7899582339122673, "val_rmse": 0.0021269344724714756, "val_rmse_std": 0.00019225770849000978, "val_ssim": 0.9866148233413696, "val_ssim_std": 0.0022656534514588866}, "model": "claude-opus-4-8-1m", "obs_path": "breast-ct-claude-agentic-hammernik-2017-search-20260703-01/iterations/iter-0003/observation.json", "obs_sha1": "43932ddcea279bcc3e7d351d69c063513cd04131", "params_M": 0.005379, "params_source": "observation", "rationale": "hammernik_2017-claude-agentic: vn_T=3, vn_n_filters=16, vn_kernel=9, vn_n_bumps=31, vn_x_range=2.0, vn_filter_init_std=0.05, vn_rbf_init_std=0.01, vn_lambda_init=0.02, epochs=30, batch_size=2, lr=0.00096, grad_clip=1.0, train_n=400, val_n=200, seed=42, max_train_s=1100, rationale=iter-3 (six-box). PREV NUMBERS: iter-1 hr=0.5777 (train_n=400, 30 full epochs, ~1084s) BEST; iter-2 hr=0.0947 REGRESSED (train_n=1600 same 1000s wall -> epochs wall-truncated ~7-8, fewer effective passes/sample -> under-trained; SSIM 0.9849->0.9567, RMSE 2.2e-3->4.7e-3). FAILURE MODE (iter-2): under-training from the wall cap, NOT data-hunger -- my iter-2 data-limited hypothesis is FALSIFIED (train_n change was confounded by reduced effective epochs). LESSON: this VN needs its full epoch budget to converge; keep train_n at the working 400 where 30 epochs FIT the budget. RESET baseline to the iter-1 WINNER. ONE KNOB vs iter-1: vn_lambda_init 0.0097 -> 0.02 (~2x stronger data-fidelity anchor to the FBP init). HYPOTHESIS: a stronger lambda anchor keeps each unrolled step closer to the clean FBP init and reduces the learned regularizer over-smoothing the recon, so val hr rises above 0.5777; predict hr > 0.59. All else = iter-1 (T=3, filters=16, kernel=9, n_bumps=31, x_range=2.0, epochs=30, lr=9.6e-4, batch=2, grad_clip=1.0, seed=42, train_n=400). BUDGET: identical compute to iter-1 (lambda_init is free); max_train_s raised 1000->1100 so all 30 epochs complete (iter-1 hit 1084s and slightly clipped) -- still well under the 30-min SLURM kill. batch_size=2 (512px OOM guard).", "run_id": "breast-ct-claude-agentic-hammernik-2017-search-20260703-01", "runtime": {"elapsed_s": 1188.870411157608}, "schema_version": 3, "solver_key": "hammernik-2017", "solver_name": "Hammernik VN (2017)", "split": {"train_n": 400, "val_n": 200}, "status": "keep", "ts": "2026-07-04T00:18:07Z"}
{"advice_for_others": "hammernik_2017-claude-agentic: vn_T=3, vn_n_filters=16, vn_kernel=9, vn_n_bumps=31, vn_x_range=2.0, vn_filter_init_std=0.05, vn_rbf_init_std=0.01, vn_lambda_init=0.05, epochs=30, batch_size=2, lr=0.00096, grad_clip=1.0, train_n=400, val_n=200, seed=42, max_train_s=1100, rationale=iter-4 (six-box). PREV NUMBERS: iter-1 hr=0.5777 (lambda=0.0097); iter-3 hr=0.5921 BEST (lambda=0.02, ssim 0.9866, PSNR 44.11, RMSE 2.13e-3, 1189s, all 30 ep). iter-2 hr=0.0947 was the under-trained outlier (ignored). FAILURE MODE: none -- raising lambda_init 0.0097->0.02 lifted hr +0.014; the learned regularizer was slightly over-smoothing the FBP init at low lambda, and a stronger data-fidelity anchor helps. GRADIENT: 'more lambda -> better' locally. ONE KNOB: vn_lambda_init 0.02 -> 0.05 (continue the winning direction, ~2.5x). HYPOTHESIS: pushing the FBP-init anchor further reduces regularizer over-smoothing and lifts hr above 0.5921, OR plateaus/regresses -- which localizes the lambda optimum. Predict hr >= 0.593 or a clear plateau. All else = iter-3 (T=3, filters=16, kernel=9, n_bumps=31, x_range=2.0, epochs=30, lr=9.6e-4, batch=2, grad_clip=1.0, seed=42, train_n=400, max_train_s=1100). BUDGET: lambda_init is FREE -> compute identical to iter-3 (~1189s), fits 20-min budget under the 30-min kill. batch_size=2 (512px OOM guard).", "agent": "hammernik_2017-claude-agentic", "campaign": "search-20260703-01", "cfg_full": {"batch_size": 2, "epochs": 30, "grad_clip": 1.0, "lr": 0.00096, "max_train_s": 1100, "rationale": "iter-4 (six-box). PREV NUMBERS: iter-1 hr=0.5777 (lambda=0.0097); iter-3 hr=0.5921 BEST (lambda=0.02, ssim 0.9866, PSNR 44.11, RMSE 2.13e-3, 1189s, all 30 ep). iter-2 hr=0.0947 was the under-trained outlier (ignored). FAILURE MODE: none -- raising lambda_init 0.0097->0.02 lifted hr +0.014; the learned regularizer was slightly over-smoothing the FBP init at low lambda, and a stronger data-fidelity anchor helps. GRADIENT: 'more lambda -> better' locally. ONE KNOB: vn_lambda_init 0.02 -> 0.05 (continue the winning direction, ~2.5x). HYPOTHESIS: pushing the FBP-init anchor further reduces regularizer over-smoothing and lifts hr above 0.5921, OR plateaus/regresses -- which localizes the lambda optimum. Predict hr >= 0.593 or a clear plateau. All else = iter-3 (T=3, filters=16, kernel=9, n_bumps=31, x_range=2.0, epochs=30, lr=9.6e-4, batch=2, grad_clip=1.0, seed=42, train_n=400, max_train_s=1100). BUDGET: lambda_init is FREE -> compute identical to iter-3 (~1189s), fits 20-min budget under the 30-min kill. batch_size=2 (512px OOM guard).", "seed": 42, "train_n": 400, "val_n": 200, "vn_T": 3, "vn_filter_init_std": 0.05, "vn_kernel": 9, "vn_lambda_init": 0.05, "vn_n_bumps": 31, "vn_n_filters": 16, "vn_rbf_init_std": 0.01, "vn_x_range": 2.0}, "challenge": "breast_ct", "change_class": "architecture", "git_commit": null, "images": {"comparison": "runs/breast-ct-claude-agentic-hammernik-2017-search-20260703-01/iterations/iter-0004/comparison.png", "test_showcase": null, "valtest_showcase": null}, "iter": 4, "kept": false, "metrics": {"headroom": 0.0, "headroom_std": 0.0, "val_psnr": 28.61891746520996, "val_psnr_std": 0.9553230572104252, "val_rmse": 0.012660728767514229, "val_rmse_std": 0.0013241212641608388, "val_ssim": 0.933437168598175, "val_ssim_std": 0.008915357366931803}, "model": "claude-opus-4-8-1m", "obs_path": "breast-ct-claude-agentic-hammernik-2017-search-20260703-01/iterations/iter-0004/observation.json", "obs_sha1": "db8820231560cbde9f5930e23ebf7511eabc6e6f", "params_M": 0.005379, "params_source": "observation", "rationale": "hammernik_2017-claude-agentic: vn_T=3, vn_n_filters=16, vn_kernel=9, vn_n_bumps=31, vn_x_range=2.0, vn_filter_init_std=0.05, vn_rbf_init_std=0.01, vn_lambda_init=0.05, epochs=30, batch_size=2, lr=0.00096, grad_clip=1.0, train_n=400, val_n=200, seed=42, max_train_s=1100, rationale=iter-4 (six-box). PREV NUMBERS: iter-1 hr=0.5777 (lambda=0.0097); iter-3 hr=0.5921 BEST (lambda=0.02, ssim 0.9866, PSNR 44.11, RMSE 2.13e-3, 1189s, all 30 ep). iter-2 hr=0.0947 was the under-trained outlier (ignored). FAILURE MODE: none -- raising lambda_init 0.0097->0.02 lifted hr +0.014; the learned regularizer was slightly over-smoothing the FBP init at low lambda, and a stronger data-fidelity anchor helps. GRADIENT: 'more lambda -> better' locally. ONE KNOB: vn_lambda_init 0.02 -> 0.05 (continue the winning direction, ~2.5x). HYPOTHESIS: pushing the FBP-init anchor further reduces regularizer over-smoothing and lifts hr above 0.5921, OR plateaus/regresses -- which localizes the lambda optimum. Predict hr >= 0.593 or a clear plateau. All else = iter-3 (T=3, filters=16, kernel=9, n_bumps=31, x_range=2.0, epochs=30, lr=9.6e-4, batch=2, grad_clip=1.0, seed=42, train_n=400, max_train_s=1100). BUDGET: lambda_init is FREE -> compute identical to iter-3 (~1189s), fits 20-min budget under the 30-min kill. batch_size=2 (512px OOM guard).", "run_id": "breast-ct-claude-agentic-hammernik-2017-search-20260703-01", "runtime": {"elapsed_s": 1190.242397069931}, "schema_version": 3, "solver_key": "hammernik-2017", "solver_name": "Hammernik VN (2017)", "split": {"train_n": 400, "val_n": 200}, "status": "discard", "ts": "2026-07-04T07:51:34Z"}
