{"advice_for_others": "itnet_v2-claude-agentic: itnet_k=1, unet_c=32, itnet_alpha_init=0.0026, residual_learning=False, pretrain_lr=0.00025, pretrain_epochs=15, pretrain_patience=15, grad_clip=1.0, train_n=1200, val_n=200, seed=42, rationale=ITER-5 (breast itnet_v2 search-20260703-01, strict 20-min budget). SIX-BOX (NUMBERS): trajectory -> iter1 k=4/c16 hr0.0000; iter2 k=1/c16 hr0.3382; iter3 k=2/c16 hr0.2098 (k monotone-decreasing, k=1 LOCKED); iter4 k=1/c32 hr0.3830 (PSNR33.02 SSIM0.9227 RMSE0.00984, alpha0.0015) = current BEST. (2) FAILURE MODE: doubling width (c16->c32) helped (+0.045 hr), confirming capacity mattered; but the pretrain loss has floored near ~1e-6 (train-PERFECT) at only train_n=600 while val PSNR (33.02) still trails the FBP baseline (36.32) -> the residual gap is now a GENERALIZATION / DATA-quantity gap, not optimization: the denoiser memorizes 600 scenes perfectly yet under-generalizes to the 200 val scenes. breast has 3600 train cases available and I have held train_n=600 for all 4 prior iters. (3) ONE KNOB: train_n 600 -> 1200 (2x training scenes). ALL else identical to iter-4 (the c32/k1 champion): itnet_k=1, unet_c=32, alpha_init=0.0026, residual_learning=False, pretrain_lr=2.5e-4, pretrain_epochs=15, patience=15, grad_clip=1.0, val_n=200, seed=42. (4) HYPOTHESIS: if train_n 600->1200, val hr rises above 0.3830 because more diverse training scenes reduce the train-perfect / val-gap overfit (a data-quantity fix for a model that already drives train loss to ~0), improving generalization to the held-out val scenes. FALSIFIER: if hr <= ~0.385 (flat), 600 scenes already saturated the c32 denoiser's generalization and the residual gap is an intrinsic single-DC-step-vs-FBP ceiling (then a Step-3 TPE around k=1/c32 + a lower-alpha / residual_learning-True probe is the next move, not more data). (5) BUDGET: 2x train scenes ~2x the pretrain epoch cost; iter-4 (c32/k1/n600) finished well inside budget, pretrain floored by epoch ~3 so 15 epochs at 1200 scenes is still comfortably < 1200s (val=200 + figure fixed). (6) FINAL of the 5-iter onboarding block; I report the trajectory when iter-5 lands.", "agent": "itnet_v2-claude-agentic", "campaign": "search-20260703-01", "cfg_full": {"grad_clip": 1.0, "itnet_alpha_init": 0.0026, "itnet_k": 1, "pretrain_epochs": 15, "pretrain_lr": 0.00025, "pretrain_patience": 15, "rationale": "ITER-5 (breast itnet_v2 search-20260703-01, strict 20-min budget). SIX-BOX (NUMBERS): trajectory -> iter1 k=4/c16 hr0.0000; iter2 k=1/c16 hr0.3382; iter3 k=2/c16 hr0.2098 (k monotone-decreasing, k=1 LOCKED); iter4 k=1/c32 hr0.3830 (PSNR33.02 SSIM0.9227 RMSE0.00984, alpha0.0015) = current BEST. (2) FAILURE MODE: doubling width (c16->c32) helped (+0.045 hr), confirming capacity mattered; but the pretrain loss has floored near ~1e-6 (train-PERFECT) at only train_n=600 while val PSNR (33.02) still trails the FBP baseline (36.32) -> the residual gap is now a GENERALIZATION / DATA-quantity gap, not optimization: the denoiser memorizes 600 scenes perfectly yet under-generalizes to the 200 val scenes. breast has 3600 train cases available and I have held train_n=600 for all 4 prior iters. (3) ONE KNOB: train_n 600 -> 1200 (2x training scenes). ALL else identical to iter-4 (the c32/k1 champion): itnet_k=1, unet_c=32, alpha_init=0.0026, residual_learning=False, pretrain_lr=2.5e-4, pretrain_epochs=15, patience=15, grad_clip=1.0, val_n=200, seed=42. (4) HYPOTHESIS: if train_n 600->1200, val hr rises above 0.3830 because more diverse training scenes reduce the train-perfect / val-gap overfit (a data-quantity fix for a model that already drives train loss to ~0), improving generalization to the held-out val scenes. FALSIFIER: if hr <= ~0.385 (flat), 600 scenes already saturated the c32 denoiser's generalization and the residual gap is an intrinsic single-DC-step-vs-FBP ceiling (then a Step-3 TPE around k=1/c32 + a lower-alpha / residual_learning-True probe is the next move, not more data). (5) BUDGET: 2x train scenes ~2x the pretrain epoch cost; iter-4 (c32/k1/n600) finished well inside budget, pretrain floored by epoch ~3 so 15 epochs at 1200 scenes is still comfortably < 1200s (val=200 + figure fixed). (6) FINAL of the 5-iter onboarding block; I report the trajectory when iter-5 lands.", "residual_learning": false, "seed": 42, "train_n": 1200, "unet_c": 32, "val_n": 200}, "challenge": "breast_ct", "change_class": "architecture", "git_commit": null, "images": {"comparison": "runs/breast-ct-claude-agentic-itnet-v2-search-20260703-01/iterations/iter-0005/comparison.png", "test_showcase": null, "valtest_showcase": null}, "iter": 5, "kept": true, "metrics": {"headroom": 0.8498876522045717, "headroom_std": null, "val_psnr": 52.795867919921875, "val_psnr_std": null, "val_rmse": 0.0007827287190593779, "val_rmse_std": null, "val_ssim": 0.9984647631645203, "val_ssim_std": null}, "model": "claude-opus-4-8-1m", "obs_path": "breast-ct-claude-agentic-itnet-v2-search-20260703-01/iterations/iter-0005/observation.json", "obs_sha1": "89a5848c941fea6da9aae2a1699cdc57b0acb247", "params_M": 0.928098, "params_source": "observation", "rationale": "itnet_v2-claude-agentic: itnet_k=1, unet_c=32, itnet_alpha_init=0.0026, residual_learning=False, pretrain_lr=0.00025, pretrain_epochs=15, pretrain_patience=15, grad_clip=1.0, train_n=1200, val_n=200, seed=42, rationale=ITER-5 (breast itnet_v2 search-20260703-01, strict 20-min budget). SIX-BOX (NUMBERS): trajectory -> iter1 k=4/c16 hr0.0000; iter2 k=1/c16 hr0.3382; iter3 k=2/c16 hr0.2098 (k monotone-decreasing, k=1 LOCKED); iter4 k=1/c32 hr0.3830 (PSNR33.02 SSIM0.9227 RMSE0.00984, alpha0.0015) = current BEST. (2) FAILURE MODE: doubling width (c16->c32) helped (+0.045 hr), confirming capacity mattered; but the pretrain loss has floored near ~1e-6 (train-PERFECT) at only train_n=600 while val PSNR (33.02) still trails the FBP baseline (36.32) -> the residual gap is now a GENERALIZATION / DATA-quantity gap, not optimization: the denoiser memorizes 600 scenes perfectly yet under-generalizes to the 200 val scenes. breast has 3600 train cases available and I have held train_n=600 for all 4 prior iters. (3) ONE KNOB: train_n 600 -> 1200 (2x training scenes). ALL else identical to iter-4 (the c32/k1 champion): itnet_k=1, unet_c=32, alpha_init=0.0026, residual_learning=False, pretrain_lr=2.5e-4, pretrain_epochs=15, patience=15, grad_clip=1.0, val_n=200, seed=42. (4) HYPOTHESIS: if train_n 600->1200, val hr rises above 0.3830 because more diverse training scenes reduce the train-perfect / val-gap overfit (a data-quantity fix for a model that already drives train loss to ~0), improving generalization to the held-out val scenes. FALSIFIER: if hr <= ~0.385 (flat), 600 scenes already saturated the c32 denoiser's generalization and the residual gap is an intrinsic single-DC-step-vs-FBP ceiling (then a Step-3 TPE around k=1/c32 + a lower-alpha / residual_learning-True probe is the next move, not more data). (5) BUDGET: 2x train scenes ~2x the pretrain epoch cost; iter-4 (c32/k1/n600) finished well inside budget, pretrain floored by epoch ~3 so 15 epochs at 1200 scenes is still comfortably < 1200s (val=200 + figure fixed). (6) FINAL of the 5-iter onboarding block; I report the trajectory when iter-5 lands.", "run_id": "breast-ct-claude-agentic-itnet-v2-search-20260703-01", "runtime": {"elapsed_s": 751.7064740657806}, "schema_version": 3, "solver_key": "itnet-v2", "solver_name": "ITNet v2", "split": {"train_n": 400, "val_n": 200}, "status": "keep", "ts": "2026-07-03T16:46:01Z"}
{"advice_for_others": "itnet_v2-claude-agentic: itnet_k=1, unet_c=32, itnet_alpha_init=0.0026, residual_learning=False, pretrain_lr=0.00025, pretrain_epochs=15, pretrain_patience=15, grad_clip=1.0, train_n=2400, val_n=200, seed=42, rationale=ITER-6 (breast itnet_v2 search-20260703-01, 20-min budget, extend to iter-20). SIX-BOX (NUMBERS, corrected authoritative tsv): iter1 k4/c16/n600 hr0.0000; iter2 k1/c16/n600 hr0.8260 (PSNR51.51); iter3 k2/c16/n600 hr0.0000; iter4 k1/c32/n600 hr0.8347 (PSNR51.96); iter5 k1/c32/n1200 hr0.8499 (PSNR52.80, ssim0.9985)=BEST. FINDINGS LOCKED: k=1 strongly optimal (k=2 and k=4 collapse to hr=0 -- extra DC steps corrupt on 128-view sparse breast); widening c16->c32 gave +0.009; doubling train_n 600->1200 gave +0.015 (data lever still climbing). (2) FAILURE MODE: at the k1/c32 champion the recon is already excellent (PSNR 52.8) and the residual gap to hr=1 is GENERALIZATION; the most recent proven-positive lever is TRAIN DATA (n600->1200 = +0.015) and c32 still trains to ~0 loss, so it is not yet data-saturated. (3) ONE KNOB: train_n 1200 -> 2400 (2x again; breast has 3600 train cases available). All else = iter-5 champion (k=1, c=32, alpha0.0026, residual False, lr2.5e-4, epochs15, patience15, grad_clip1.0, val_n200, seed42). (4) HYPOTHESIS: if train_n 1200->2400, hr rises above 0.8499 (diminishing but positive, toward ~0.86) because more diverse scenes further close the train-perfect/val-gap for the c=32 denoiser. FALSIFIER: hr <= ~0.851 (flat) => data saturated at 1200; iter-7 then pivots to denoiser DEPTH/width (architecture) rather than data. (5) BUDGET: 2400 scenes x15 epochs pretrain on cheap 128-view breast; iter-5 (n1200) ran ~235s, so ~2x ~ well under 1200s. (6) Self-driving to iter-20.", "agent": "itnet_v2-claude-agentic", "campaign": "search-20260703-01", "cfg_full": {"grad_clip": 1.0, "itnet_alpha_init": 0.0026, "itnet_k": 1, "pretrain_epochs": 15, "pretrain_lr": 0.00025, "pretrain_patience": 15, "rationale": "ITER-6 (breast itnet_v2 search-20260703-01, 20-min budget, extend to iter-20). SIX-BOX (NUMBERS, corrected authoritative tsv): iter1 k4/c16/n600 hr0.0000; iter2 k1/c16/n600 hr0.8260 (PSNR51.51); iter3 k2/c16/n600 hr0.0000; iter4 k1/c32/n600 hr0.8347 (PSNR51.96); iter5 k1/c32/n1200 hr0.8499 (PSNR52.80, ssim0.9985)=BEST. FINDINGS LOCKED: k=1 strongly optimal (k=2 and k=4 collapse to hr=0 -- extra DC steps corrupt on 128-view sparse breast); widening c16->c32 gave +0.009; doubling train_n 600->1200 gave +0.015 (data lever still climbing). (2) FAILURE MODE: at the k1/c32 champion the recon is already excellent (PSNR 52.8) and the residual gap to hr=1 is GENERALIZATION; the most recent proven-positive lever is TRAIN DATA (n600->1200 = +0.015) and c32 still trains to ~0 loss, so it is not yet data-saturated. (3) ONE KNOB: train_n 1200 -> 2400 (2x again; breast has 3600 train cases available). All else = iter-5 champion (k=1, c=32, alpha0.0026, residual False, lr2.5e-4, epochs15, patience15, grad_clip1.0, val_n200, seed42). (4) HYPOTHESIS: if train_n 1200->2400, hr rises above 0.8499 (diminishing but positive, toward ~0.86) because more diverse scenes further close the train-perfect/val-gap for the c=32 denoiser. FALSIFIER: hr <= ~0.851 (flat) => data saturated at 1200; iter-7 then pivots to denoiser DEPTH/width (architecture) rather than data. (5) BUDGET: 2400 scenes x15 epochs pretrain on cheap 128-view breast; iter-5 (n1200) ran ~235s, so ~2x ~ well under 1200s. (6) Self-driving to iter-20.", "residual_learning": false, "seed": 42, "train_n": 2400, "unet_c": 32, "val_n": 200}, "challenge": "breast_ct", "change_class": "architecture", "git_commit": null, "images": {"comparison": "runs/breast-ct-claude-agentic-itnet-v2-search-20260703-01/iterations/iter-0006/comparison.png", "test_showcase": null, "valtest_showcase": null}, "iter": 6, "kept": true, "metrics": {"headroom": 0.876804584091904, "headroom_std": 0.014287196005167575, "val_psnr": 54.512298583984375, "val_psnr_std": 1.6095534762494466, "val_rmse": 0.0006423761369660497, "val_rmse_std": 0.00011215886216573792, "val_ssim": 0.9989162087440491, "val_ssim_std": 0.0004011797235120038}, "model": "claude-opus-4-8-1m", "obs_path": "breast-ct-claude-agentic-itnet-v2-search-20260703-01/iterations/iter-0006/observation.json", "obs_sha1": "a25ecb2437e877ee5eaa29bc0aa7c5511144fc36", "params_M": 0.928098, "params_source": "observation", "rationale": "itnet_v2-claude-agentic: itnet_k=1, unet_c=32, itnet_alpha_init=0.0026, residual_learning=False, pretrain_lr=0.00025, pretrain_epochs=15, pretrain_patience=15, grad_clip=1.0, train_n=2400, val_n=200, seed=42, rationale=ITER-6 (breast itnet_v2 search-20260703-01, 20-min budget, extend to iter-20). SIX-BOX (NUMBERS, corrected authoritative tsv): iter1 k4/c16/n600 hr0.0000; iter2 k1/c16/n600 hr0.8260 (PSNR51.51); iter3 k2/c16/n600 hr0.0000; iter4 k1/c32/n600 hr0.8347 (PSNR51.96); iter5 k1/c32/n1200 hr0.8499 (PSNR52.80, ssim0.9985)=BEST. FINDINGS LOCKED: k=1 strongly optimal (k=2 and k=4 collapse to hr=0 -- extra DC steps corrupt on 128-view sparse breast); widening c16->c32 gave +0.009; doubling train_n 600->1200 gave +0.015 (data lever still climbing). (2) FAILURE MODE: at the k1/c32 champion the recon is already excellent (PSNR 52.8) and the residual gap to hr=1 is GENERALIZATION; the most recent proven-positive lever is TRAIN DATA (n600->1200 = +0.015) and c32 still trains to ~0 loss, so it is not yet data-saturated. (3) ONE KNOB: train_n 1200 -> 2400 (2x again; breast has 3600 train cases available). All else = iter-5 champion (k=1, c=32, alpha0.0026, residual False, lr2.5e-4, epochs15, patience15, grad_clip1.0, val_n200, seed42). (4) HYPOTHESIS: if train_n 1200->2400, hr rises above 0.8499 (diminishing but positive, toward ~0.86) because more diverse scenes further close the train-perfect/val-gap for the c=32 denoiser. FALSIFIER: hr <= ~0.851 (flat) => data saturated at 1200; iter-7 then pivots to denoiser DEPTH/width (architecture) rather than data. (5) BUDGET: 2400 scenes x15 epochs pretrain on cheap 128-view breast; iter-5 (n1200) ran ~235s, so ~2x ~ well under 1200s. (6) Self-driving to iter-20.", "run_id": "breast-ct-claude-agentic-itnet-v2-search-20260703-01", "runtime": {"elapsed_s": 1484.3541991710663}, "schema_version": 3, "solver_key": "itnet-v2", "solver_name": "ITNet v2", "split": {"train_n": 400, "val_n": 200}, "status": "keep", "ts": "2026-07-03T22:36:12Z"}
{"advice_for_others": "itnet_v2-claude-agentic: itnet_k=1, unet_c=48, itnet_alpha_init=0.0026, residual_learning=False, pretrain_lr=0.00025, pretrain_epochs=15, pretrain_patience=15, grad_clip=1.0, train_n=1200, val_n=200, seed=42, rationale=ITER-7 (breast itnet_v2 search, extend-to-20, 20-min budget). SIX-BOX (VERIFIED tsv/solver-log): i4 c32/n600 hr0.8347; i5 c32/n1200 hr0.8499 (PSNR52.80); i6 c32/n2400 hr0.8574 (PSNR52.88, ~15min elapsed). (2) FINDINGS: DATA lever now strongly DIMINISHING (n600->1200 +0.015, n1200->2400 only +0.0075) AND n=2400 nears the 20-min compute budget (~15min) -- data is not the efficient lever anymore. PIVOT to denoiser CAPACITY (architecture; coordinator allows). The proven capacity axis c16->c32 gave +0.009. (3) ONE KNOB vs the n1200 baseline (iter-5): unet_c 32 -> 48. Hold train_n=1200 (fast ~4min baseline, leaves ample budget for a wider net), k=1 (locked), all else = champion (alpha0.0026, residual False, lr2.5e-4, epochs15, patience15, grad_clip1.0, val_n200, seed42). NOTE isolating width against iter-5 (n1200), not iter-6 (n2400), because n2400+c48 would risk the time budget and n1200 is the clean fast baseline for the width knob. (4) HYPOTHESIS: if c 32->48 at n1200, hr rises above iter-5's 0.8499 (toward/above iter-6's 0.8574) because added denoiser capacity closes the val generalization gap more cheaply than data, and does so within ~6-8 min. FALSIFIER: hr <= ~0.851 => c=32 already capacity-sufficient at n1200; iter-8 then tries DEPTH or pretrain_epochs, or combines best-c with n2400. (5) BUDGET: c48/n1200 ~2.25x c32 conv FLOPs on the fast n1200 base (iter-5 ~4min) -> comfortably <20min. (6) Self-driving to iter-20.", "agent": "itnet_v2-claude-agentic", "campaign": "search-20260703-01", "cfg_full": {"grad_clip": 1.0, "itnet_alpha_init": 0.0026, "itnet_k": 1, "pretrain_epochs": 15, "pretrain_lr": 0.00025, "pretrain_patience": 15, "rationale": "ITER-7 (breast itnet_v2 search, extend-to-20, 20-min budget). SIX-BOX (VERIFIED tsv/solver-log): i4 c32/n600 hr0.8347; i5 c32/n1200 hr0.8499 (PSNR52.80); i6 c32/n2400 hr0.8574 (PSNR52.88, ~15min elapsed). (2) FINDINGS: DATA lever now strongly DIMINISHING (n600->1200 +0.015, n1200->2400 only +0.0075) AND n=2400 nears the 20-min compute budget (~15min) -- data is not the efficient lever anymore. PIVOT to denoiser CAPACITY (architecture; coordinator allows). The proven capacity axis c16->c32 gave +0.009. (3) ONE KNOB vs the n1200 baseline (iter-5): unet_c 32 -> 48. Hold train_n=1200 (fast ~4min baseline, leaves ample budget for a wider net), k=1 (locked), all else = champion (alpha0.0026, residual False, lr2.5e-4, epochs15, patience15, grad_clip1.0, val_n200, seed42). NOTE isolating width against iter-5 (n1200), not iter-6 (n2400), because n2400+c48 would risk the time budget and n1200 is the clean fast baseline for the width knob. (4) HYPOTHESIS: if c 32->48 at n1200, hr rises above iter-5's 0.8499 (toward/above iter-6's 0.8574) because added denoiser capacity closes the val generalization gap more cheaply than data, and does so within ~6-8 min. FALSIFIER: hr <= ~0.851 => c=32 already capacity-sufficient at n1200; iter-8 then tries DEPTH or pretrain_epochs, or combines best-c with n2400. (5) BUDGET: c48/n1200 ~2.25x c32 conv FLOPs on the fast n1200 base (iter-5 ~4min) -> comfortably <20min. (6) Self-driving to iter-20.", "residual_learning": false, "seed": 42, "train_n": 1200, "unet_c": 48, "val_n": 200}, "challenge": "breast_ct", "change_class": "architecture", "git_commit": null, "images": {"comparison": "runs/breast-ct-claude-agentic-itnet-v2-search-20260703-01/iterations/iter-0007/comparison.png", "test_showcase": null, "valtest_showcase": null}, "iter": 7, "kept": true, "metrics": {"headroom": 0.8607464023074957, "headroom_std": 0.015880408381892492, "val_psnr": 53.44806671142578, "val_psnr_std": 1.5947047988592864, "val_rmse": 0.0007261080900207162, "val_rmse_std": 0.0001253070751265291, "val_ssim": 0.9986510872840881, "val_ssim_std": 0.00046885386585270115}, "model": "claude-opus-4-8-1m", "obs_path": "breast-ct-claude-agentic-itnet-v2-search-20260703-01/iterations/iter-0007/observation.json", "obs_sha1": "1072a871a356708a6adf171427448f711cad8454", "params_M": 2.08565, "params_source": "observation", "rationale": "itnet_v2-claude-agentic: itnet_k=1, unet_c=48, itnet_alpha_init=0.0026, residual_learning=False, pretrain_lr=0.00025, pretrain_epochs=15, pretrain_patience=15, grad_clip=1.0, train_n=1200, val_n=200, seed=42, rationale=ITER-7 (breast itnet_v2 search, extend-to-20, 20-min budget). SIX-BOX (VERIFIED tsv/solver-log): i4 c32/n600 hr0.8347; i5 c32/n1200 hr0.8499 (PSNR52.80); i6 c32/n2400 hr0.8574 (PSNR52.88, ~15min elapsed). (2) FINDINGS: DATA lever now strongly DIMINISHING (n600->1200 +0.015, n1200->2400 only +0.0075) AND n=2400 nears the 20-min compute budget (~15min) -- data is not the efficient lever anymore. PIVOT to denoiser CAPACITY (architecture; coordinator allows). The proven capacity axis c16->c32 gave +0.009. (3) ONE KNOB vs the n1200 baseline (iter-5): unet_c 32 -> 48. Hold train_n=1200 (fast ~4min baseline, leaves ample budget for a wider net), k=1 (locked), all else = champion (alpha0.0026, residual False, lr2.5e-4, epochs15, patience15, grad_clip1.0, val_n200, seed42). NOTE isolating width against iter-5 (n1200), not iter-6 (n2400), because n2400+c48 would risk the time budget and n1200 is the clean fast baseline for the width knob. (4) HYPOTHESIS: if c 32->48 at n1200, hr rises above iter-5's 0.8499 (toward/above iter-6's 0.8574) because added denoiser capacity closes the val generalization gap more cheaply than data, and does so within ~6-8 min. FALSIFIER: hr <= ~0.851 => c=32 already capacity-sufficient at n1200; iter-8 then tries DEPTH or pretrain_epochs, or combines best-c with n2400. (5) BUDGET: c48/n1200 ~2.25x c32 conv FLOPs on the fast n1200 base (iter-5 ~4min) -> comfortably <20min. (6) Self-driving to iter-20.", "run_id": "breast-ct-claude-agentic-itnet-v2-search-20260703-01", "runtime": {"elapsed_s": 1306.5525205135345}, "schema_version": 3, "solver_key": "itnet-v2", "solver_name": "ITNet v2", "split": {"train_n": 400, "val_n": 200}, "status": "keep", "ts": "2026-07-03T23:03:11Z"}
