{"advice_for_others": "dual_domain_bilateral_n2i-claude-agentic: warm_start=True, pretrain_epochs=2, train_n=400, n_iter=120, val_n=200, batch_size=1, grad_clip=1.0, lr=0.005, proj_n_bf=1, img_n_bf=1, outer_wall_s=1050, seed=42, rationale=iter-1 ONBOARDING dual_domain_bilateral_n2i (self-supervised Noise2Inverse, per-image: warm-start amortised N2I pre-pass on train, then per-scene Adam of the 2x64-view split-MSE self-sup loss on each val scan's own 128-view sinogram; 6 trainable BF params at proj_n_bf=img_n_bf=1) on the RE-SPLIT Breast-CT (train3600/val200/test200, seed20260703), scoring val=200. SIX-BOX: (1) PRIOR: none (first iter of this slug). Nearest reference = OLD-split breast N2I-BF which plateaued ~SSIM0.9748 and hr=0 (N2I over-smooths dense breast, docs/findings.md 2026-05-22: split-view FBP noise floor makes MSE-vs-half-view pull toward blur). (2) FAILURE MODE: N/A onboarding; goal = does per-image N2I-BF RUN on the new val=200 split under the HARD 20-min budget and produce finite val metrics + a comparison figure? Expect hr near 0 (structurally bounded on dense 128-view breast per the documented risk). (3) ONE KNOB: N/A baseline (solver near-defaults; only val_n set to the required 200 and n_iter sized for the wall). (4) HYPOTHESIS: per-image N2I-BF trains stably (grad_clip=1.0) and gives val_ssim ~0.95-0.97 but hr~=0 because minimising MSE against the noisy 64-view half-set FBP encourages over-smoothing on the already-clean dense breast FBP. (5) BUDGET: per-image N2I cost = warm(2 ep x 400) + val_n(200) x n_iter(120) inner steps on breast's LIGHT 128-view adjoint (18x fewer angles than Mayo 2304). outer_wall_s=1050 hard internal backstop keeps the per-image loop well under the 1800s sbatch wall; iter-1 measures the true per-scene rate so iters 2-5 can raise n_iter safely. (6) Loop continues; iter-2 dispatched on landing. Levers reserved for iters 2-20: img_n_bf/proj_n_bf (BF DEPTH), img_sx/sy/sr + proj_sx/sy/sr + kernels (BILATERAL params), n_iter + pretrain_epochs + lr (OPTIMIZATION), warm_start on/off, train_n. (NOTE: the brief's num_splits + consistency_weight are NOT wired in this solver -- the N2I split is a fixed 2-way odd/even with a fixed negativity weight in DualDomainPipeline.training_step; genuine levers are BF depth/params/optimization, which is what this campaign sweeps.)", "agent": "dual_domain_bilateral_n2i-claude-agentic", "campaign": "search-20260703-01", "cfg_full": {"batch_size": 1, "grad_clip": 1.0, "img_n_bf": 1, "lr": 0.005, "n_iter": 120, "outer_wall_s": 1050, "pretrain_epochs": 2, "proj_n_bf": 1, "rationale": "iter-1 ONBOARDING dual_domain_bilateral_n2i (self-supervised Noise2Inverse, per-image: warm-start amortised N2I pre-pass on train, then per-scene Adam of the 2x64-view split-MSE self-sup loss on each val scan's own 128-view sinogram; 6 trainable BF params at proj_n_bf=img_n_bf=1) on the RE-SPLIT Breast-CT (train3600/val200/test200, seed20260703), scoring val=200. SIX-BOX: (1) PRIOR: none (first iter of this slug). Nearest reference = OLD-split breast N2I-BF which plateaued ~SSIM0.9748 and hr=0 (N2I over-smooths dense breast, docs/findings.md 2026-05-22: split-view FBP noise floor makes MSE-vs-half-view pull toward blur). (2) FAILURE MODE: N/A onboarding; goal = does per-image N2I-BF RUN on the new val=200 split under the HARD 20-min budget and produce finite val metrics + a comparison figure? Expect hr near 0 (structurally bounded on dense 128-view breast per the documented risk). (3) ONE KNOB: N/A baseline (solver near-defaults; only val_n set to the required 200 and n_iter sized for the wall). (4) HYPOTHESIS: per-image N2I-BF trains stably (grad_clip=1.0) and gives val_ssim ~0.95-0.97 but hr~=0 because minimising MSE against the noisy 64-view half-set FBP encourages over-smoothing on the already-clean dense breast FBP. (5) BUDGET: per-image N2I cost = warm(2 ep x 400) + val_n(200) x n_iter(120) inner steps on breast's LIGHT 128-view adjoint (18x fewer angles than Mayo 2304). outer_wall_s=1050 hard internal backstop keeps the per-image loop well under the 1800s sbatch wall; iter-1 measures the true per-scene rate so iters 2-5 can raise n_iter safely. (6) Loop continues; iter-2 dispatched on landing. Levers reserved for iters 2-20: img_n_bf/proj_n_bf (BF DEPTH), img_sx/sy/sr + proj_sx/sy/sr + kernels (BILATERAL params), n_iter + pretrain_epochs + lr (OPTIMIZATION), warm_start on/off, train_n. (NOTE: the brief's num_splits + consistency_weight are NOT wired in this solver -- the N2I split is a fixed 2-way odd/even with a fixed negativity weight in DualDomainPipeline.training_step; genuine levers are BF depth/params/optimization, which is what this campaign sweeps.)", "seed": 42, "train_n": 400, "val_n": 200, "warm_start": true}, "challenge": "breast_ct", "change_class": "architecture", "git_commit": "671da566", "images": {"comparison": "runs/breast-ct-claude-agentic-dual-domain-bilateral-n2i-search-20260703-01/iterations/iter-0001/comparison.png", "test_showcase": null, "valtest_showcase": null}, "iter": 1, "kept": false, "metrics": {"headroom": 0.0, "headroom_std": 0.056634239852428436, "val_psnr": 38.4378547668457, "val_psnr_std": 0.9018663167953491, "val_rmse": 0.0009803726570680737, "val_rmse_std": 9.987241355702281e-05, "val_ssim": 0.95673668384552, "val_ssim_std": 0.010141978040337563}, "model": "claude-opus-4-8-1m", "obs_path": "breast-ct-claude-agentic-dual-domain-bilateral-n2i-search-20260703-01/iterations/iter-0001/observation.json", "obs_sha1": "33e220bd4d6656d245117975288e0cf77f12095d", "params_M": 6e-06, "params_source": "observation", "rationale": "dual_domain_bilateral_n2i-claude-agentic: warm_start=True, pretrain_epochs=2, train_n=400, n_iter=120, val_n=200, batch_size=1, grad_clip=1.0, lr=0.005, proj_n_bf=1, img_n_bf=1, outer_wall_s=1050, seed=42, rationale=iter-1 ONBOARDING dual_domain_bilateral_n2i (self-supervised Noise2Inverse, per-image: warm-start amortised N2I pre-pass on train, then per-scene Adam of the 2x64-view split-MSE self-sup loss on each val scan's own 128-view sinogram; 6 trainable BF params at proj_n_bf=img_n_bf=1) on the RE-SPLIT Breast-CT (train3600/val200/test200, seed20260703), scoring val=200. SIX-BOX: (1) PRIOR: none (first iter of this slug). Nearest reference = OLD-split breast N2I-BF which plateaued ~SSIM0.9748 and hr=0 (N2I over-smooths dense breast, docs/findings.md 2026-05-22: split-view FBP noise floor makes MSE-vs-half-view pull toward blur). (2) FAILURE MODE: N/A onboarding; goal = does per-image N2I-BF RUN on the new val=200 split under the HARD 20-min budget and produce finite val metrics + a comparison figure? Expect hr near 0 (structurally bounded on dense 128-view breast per the documented risk). (3) ONE KNOB: N/A baseline (solver near-defaults; only val_n set to the required 200 and n_iter sized for the wall). (4) HYPOTHESIS: per-image N2I-BF trains stably (grad_clip=1.0) and gives val_ssim ~0.95-0.97 but hr~=0 because minimising MSE against the noisy 64-view half-set FBP encourages over-smoothing on the already-clean dense breast FBP. (5) BUDGET: per-image N2I cost = warm(2 ep x 400) + val_n(200) x n_iter(120) inner steps on breast's LIGHT 128-view adjoint (18x fewer angles than Mayo 2304). outer_wall_s=1050 hard internal backstop keeps the per-image loop well under the 1800s sbatch wall; iter-1 measures the true per-scene rate so iters 2-5 can raise n_iter safely. (6) Loop continues; iter-2 dispatched on landing. Levers reserved for iters 2-20: img_n_bf/proj_n_bf (BF DEPTH), img_sx/sy/sr + proj_sx/sy/sr + kernels (BILATERAL params), n_iter + pretrain_epochs + lr (OPTIMIZATION), warm_start on/off, train_n. (NOTE: the brief's num_splits + consistency_weight are NOT wired in this solver -- the N2I split is a fixed 2-way odd/even with a fixed negativity weight in DualDomainPipeline.training_step; genuine levers are BF depth/params/optimization, which is what this campaign sweeps.)", "run_id": "breast-ct-claude-agentic-dual-domain-bilateral-n2i-search-20260703-01", "runtime": {"elapsed_s": 1578.2149069309235}, "schema_version": 3, "solver_key": "dual-domain-bilateral-n2i", "solver_name": "DD-BF N2I (per-image)", "split": {"train_n": 400, "val_n": 195}, "status": "discard", "ts": "2026-07-05T17:46:58Z"}
{"advice_for_others": "dual_domain_bilateral_n2i-claude-agentic: warm_start=True, pretrain_epochs=2, train_n=400, n_iter=120, val_n=200, batch_size=1, grad_clip=1.0, lr=0.005, proj_n_bf=1, img_n_bf=3, outer_wall_s=1050, seed=42, rationale=iter-2 dual_domain_bilateral_n2i, ONE-KNOB vs iter-1. PRIOR: iter-1 (img_n_bf=1, 6 params) hr=0.0, val_ssim=0.9567, val_psnr=38.44, recon_rmse 9.80e-4 slightly ABOVE baseline_rmse 9.65e-4 (recon marginally WORSE than the clean 128-view FBP -> hr floors at 0). This is the documented N2I-over-smooths-dense-breast failure (findings.md 2026-05-22). KNOB: image-domain BF DEPTH img_n_bf 1->3 (proj_n_bf held at 1). HYPOTHESIS: a deeper image-domain BF cascade (3 stacked TrainableBilateralFilter2d = 12 img params) gives the N2I loss more edge-preserving capacity, so it MIGHT recover fine detail rather than blur -- if hr climbs off 0, depth is a live lever; if it stays 0 (or SSIM/PSNR drop), deeper BF just compounds the over-smoothing and DEPTH is exhausted as an escape from the N2I ceiling. FAILURE MODE watched: over-smoothing (val_psnr drops below iter-1 38.44 / recon_rmse rises above baseline). BUDGET: img_n_bf 1->3 triples image-domain unfold cost but on breast's light 128-view adjoint iter-1 ran 1200s at depth1/n_iter120; depth3 image BF is cheap vs the FBP adjoints, expect <1300s; outer_wall_s=1050 internal backstop unchanged (it cut iter-1 at 195/200 scenes -> val_n effectively ~195, consistent across iters). ONE knob changed: img_n_bf 1->3.", "agent": "dual_domain_bilateral_n2i-claude-agentic", "campaign": "search-20260703-01", "cfg_full": {"batch_size": 1, "grad_clip": 1.0, "img_n_bf": 3, "lr": 0.005, "n_iter": 120, "outer_wall_s": 1050, "pretrain_epochs": 2, "proj_n_bf": 1, "rationale": "iter-2 dual_domain_bilateral_n2i, ONE-KNOB vs iter-1. PRIOR: iter-1 (img_n_bf=1, 6 params) hr=0.0, val_ssim=0.9567, val_psnr=38.44, recon_rmse 9.80e-4 slightly ABOVE baseline_rmse 9.65e-4 (recon marginally WORSE than the clean 128-view FBP -> hr floors at 0). This is the documented N2I-over-smooths-dense-breast failure (findings.md 2026-05-22). KNOB: image-domain BF DEPTH img_n_bf 1->3 (proj_n_bf held at 1). HYPOTHESIS: a deeper image-domain BF cascade (3 stacked TrainableBilateralFilter2d = 12 img params) gives the N2I loss more edge-preserving capacity, so it MIGHT recover fine detail rather than blur -- if hr climbs off 0, depth is a live lever; if it stays 0 (or SSIM/PSNR drop), deeper BF just compounds the over-smoothing and DEPTH is exhausted as an escape from the N2I ceiling. FAILURE MODE watched: over-smoothing (val_psnr drops below iter-1 38.44 / recon_rmse rises above baseline). BUDGET: img_n_bf 1->3 triples image-domain unfold cost but on breast's light 128-view adjoint iter-1 ran 1200s at depth1/n_iter120; depth3 image BF is cheap vs the FBP adjoints, expect <1300s; outer_wall_s=1050 internal backstop unchanged (it cut iter-1 at 195/200 scenes -> val_n effectively ~195, consistent across iters). ONE knob changed: img_n_bf 1->3.", "seed": 42, "train_n": 400, "val_n": 200, "warm_start": true}, "challenge": "breast_ct", "change_class": "architecture", "git_commit": "671da566", "images": {"comparison": "runs/breast-ct-claude-agentic-dual-domain-bilateral-n2i-search-20260703-01/iterations/iter-0002/comparison.png", "test_showcase": null, "valtest_showcase": null}, "iter": 2, "kept": false, "metrics": {"headroom": 0.0, "headroom_std": 0.055733826011419296, "val_psnr": 38.397010803222656, "val_psnr_std": 0.9037750363349915, "val_rmse": 0.0009849938796833158, "val_rmse_std": 0.00010034925799118355, "val_ssim": 0.9559911489486694, "val_ssim_std": 0.01014993991702795}, "model": "claude-opus-4-8-1m", "obs_path": "breast-ct-claude-agentic-dual-domain-bilateral-n2i-search-20260703-01/iterations/iter-0002/observation.json", "obs_sha1": "fc3966deff45e61aabad8294cf4eb929edad75de", "params_M": 1.2e-05, "params_source": "observation", "rationale": "dual_domain_bilateral_n2i-claude-agentic: warm_start=True, pretrain_epochs=2, train_n=400, n_iter=120, val_n=200, batch_size=1, grad_clip=1.0, lr=0.005, proj_n_bf=1, img_n_bf=3, outer_wall_s=1050, seed=42, rationale=iter-2 dual_domain_bilateral_n2i, ONE-KNOB vs iter-1. PRIOR: iter-1 (img_n_bf=1, 6 params) hr=0.0, val_ssim=0.9567, val_psnr=38.44, recon_rmse 9.80e-4 slightly ABOVE baseline_rmse 9.65e-4 (recon marginally WORSE than the clean 128-view FBP -> hr floors at 0). This is the documented N2I-over-smooths-dense-breast failure (findings.md 2026-05-22). KNOB: image-domain BF DEPTH img_n_bf 1->3 (proj_n_bf held at 1). HYPOTHESIS: a deeper image-domain BF cascade (3 stacked TrainableBilateralFilter2d = 12 img params) gives the N2I loss more edge-preserving capacity, so it MIGHT recover fine detail rather than blur -- if hr climbs off 0, depth is a live lever; if it stays 0 (or SSIM/PSNR drop), deeper BF just compounds the over-smoothing and DEPTH is exhausted as an escape from the N2I ceiling. FAILURE MODE watched: over-smoothing (val_psnr drops below iter-1 38.44 / recon_rmse rises above baseline). BUDGET: img_n_bf 1->3 triples image-domain unfold cost but on breast's light 128-view adjoint iter-1 ran 1200s at depth1/n_iter120; depth3 image BF is cheap vs the FBP adjoints, expect <1300s; outer_wall_s=1050 internal backstop unchanged (it cut iter-1 at 195/200 scenes -> val_n effectively ~195, consistent across iters). ONE knob changed: img_n_bf 1->3.", "run_id": "breast-ct-claude-agentic-dual-domain-bilateral-n2i-search-20260703-01", "runtime": {"elapsed_s": 1481.6812851428986}, "schema_version": 3, "solver_key": "dual-domain-bilateral-n2i", "solver_name": "DD-BF N2I (per-image)", "split": {"train_n": 400, "val_n": 195}, "status": "discard", "ts": "2026-07-05T18:13:38Z"}
{"advice_for_others": "dual_domain_bilateral_n2i-claude-agentic: warm_start=True, pretrain_epochs=2, train_n=400, n_iter=30, val_n=200, batch_size=1, grad_clip=1.0, lr=0.005, proj_n_bf=1, img_n_bf=1, outer_wall_s=1050, seed=42, rationale=iter-3 dual_domain_bilateral_n2i, ONE-KNOB vs iter-1 (return to img_n_bf=1 baseline; iter-2 img_n_bf=3 was hr=0 SSIM0.9560, marginally WORSE than iter-1 0.9567 -> DEPTH compounds over-smoothing, exhausted). PRIOR: iter-1 (n_iter=120) hr=0 SSIM0.9567 PSNR38.44 recon_rmse 9.80e-4 > baseline 9.65e-4. KNOB: per-scene optimization steps n_iter 120->30 (EARLY-STOP the per-image N2I fit). HYPOTHESIS: the N2I split-MSE target is the noisy 64-view half FBP, so MORE steps pull the recon further BELOW the clean 128-view FBP (over-smooth). With the warm-start init + only 30 per-scene steps the recon stays CLOSER to the raw FBP, so recon_rmse should APPROACH baseline_rmse from above -- if hr ticks off 0, the ceiling is partly a CONVERGENCE artifact and there is an early-stop sweet spot (next: n_iter 10, 60); if hr stays 0, the N2I MSE floor is structural even at the warm-start-dominated regime. FAILURE watched: too few steps -> recon = warm-start-generic-BF (may be WORSE than a good FBP if the generic sigma over-blurs). BUDGET: n_iter 120->30 is ~4x FEWER inner steps -> expect ~350-450s, well under wall (iter-1 depth1/n_iter120 = 1200s). ONE knob: n_iter 120->30.", "agent": "dual_domain_bilateral_n2i-claude-agentic", "campaign": "search-20260703-01", "cfg_full": {"batch_size": 1, "grad_clip": 1.0, "img_n_bf": 1, "lr": 0.005, "n_iter": 30, "outer_wall_s": 1050, "pretrain_epochs": 2, "proj_n_bf": 1, "rationale": "iter-3 dual_domain_bilateral_n2i, ONE-KNOB vs iter-1 (return to img_n_bf=1 baseline; iter-2 img_n_bf=3 was hr=0 SSIM0.9560, marginally WORSE than iter-1 0.9567 -> DEPTH compounds over-smoothing, exhausted). PRIOR: iter-1 (n_iter=120) hr=0 SSIM0.9567 PSNR38.44 recon_rmse 9.80e-4 > baseline 9.65e-4. KNOB: per-scene optimization steps n_iter 120->30 (EARLY-STOP the per-image N2I fit). HYPOTHESIS: the N2I split-MSE target is the noisy 64-view half FBP, so MORE steps pull the recon further BELOW the clean 128-view FBP (over-smooth). With the warm-start init + only 30 per-scene steps the recon stays CLOSER to the raw FBP, so recon_rmse should APPROACH baseline_rmse from above -- if hr ticks off 0, the ceiling is partly a CONVERGENCE artifact and there is an early-stop sweet spot (next: n_iter 10, 60); if hr stays 0, the N2I MSE floor is structural even at the warm-start-dominated regime. FAILURE watched: too few steps -> recon = warm-start-generic-BF (may be WORSE than a good FBP if the generic sigma over-blurs). BUDGET: n_iter 120->30 is ~4x FEWER inner steps -> expect ~350-450s, well under wall (iter-1 depth1/n_iter120 = 1200s). ONE knob: n_iter 120->30.", "seed": 42, "train_n": 400, "val_n": 200, "warm_start": true}, "challenge": "breast_ct", "change_class": "architecture", "git_commit": "671da566", "images": {"comparison": "runs/breast-ct-claude-agentic-dual-domain-bilateral-n2i-search-20260703-01/iterations/iter-0003/comparison.png", "test_showcase": null, "valtest_showcase": null}, "iter": 3, "kept": false, "metrics": {"headroom": 0.0, "headroom_std": 0.06389786303043365, "val_psnr": 38.38795852661133, "val_psnr_std": 0.9411689639091492, "val_rmse": 0.0009860206628218293, "val_rmse_std": 0.0001047648984240368, "val_ssim": 0.9563228487968445, "val_ssim_std": 0.011034871451556683}, "model": "claude-opus-4-8-1m", "obs_path": "breast-ct-claude-agentic-dual-domain-bilateral-n2i-search-20260703-01/iterations/iter-0003/observation.json", "obs_sha1": "74cd788d36e7d15b03671584da4bd47104723f3b", "params_M": 6e-06, "params_source": "observation", "rationale": "dual_domain_bilateral_n2i-claude-agentic: warm_start=True, pretrain_epochs=2, train_n=400, n_iter=30, val_n=200, batch_size=1, grad_clip=1.0, lr=0.005, proj_n_bf=1, img_n_bf=1, outer_wall_s=1050, seed=42, rationale=iter-3 dual_domain_bilateral_n2i, ONE-KNOB vs iter-1 (return to img_n_bf=1 baseline; iter-2 img_n_bf=3 was hr=0 SSIM0.9560, marginally WORSE than iter-1 0.9567 -> DEPTH compounds over-smoothing, exhausted). PRIOR: iter-1 (n_iter=120) hr=0 SSIM0.9567 PSNR38.44 recon_rmse 9.80e-4 > baseline 9.65e-4. KNOB: per-scene optimization steps n_iter 120->30 (EARLY-STOP the per-image N2I fit). HYPOTHESIS: the N2I split-MSE target is the noisy 64-view half FBP, so MORE steps pull the recon further BELOW the clean 128-view FBP (over-smooth). With the warm-start init + only 30 per-scene steps the recon stays CLOSER to the raw FBP, so recon_rmse should APPROACH baseline_rmse from above -- if hr ticks off 0, the ceiling is partly a CONVERGENCE artifact and there is an early-stop sweet spot (next: n_iter 10, 60); if hr stays 0, the N2I MSE floor is structural even at the warm-start-dominated regime. FAILURE watched: too few steps -> recon = warm-start-generic-BF (may be WORSE than a good FBP if the generic sigma over-blurs). BUDGET: n_iter 120->30 is ~4x FEWER inner steps -> expect ~350-450s, well under wall (iter-1 depth1/n_iter120 = 1200s). ONE knob: n_iter 120->30.", "run_id": "breast-ct-claude-agentic-dual-domain-bilateral-n2i-search-20260703-01", "runtime": {"elapsed_s": 1463.0964605808258}, "schema_version": 3, "solver_key": "dual-domain-bilateral-n2i", "solver_name": "DD-BF N2I (per-image)", "split": {"train_n": 400, "val_n": 200}, "status": "discard", "ts": "2026-07-05T18:39:10Z"}
