{"advice_for_others": "dual_domain_bilateral_n2i-claude-agentic: warm_start=True, pretrain_epochs=2, train_n=400, n_iter=30, val_n=200, batch_size=1, grad_clip=1.0, lr=0.0035, proj_n_bf=1, img_n_bf=1, img_sr=0.0002, outer_wall_s=900, seed=42, rationale=iter-14 dual_domain_bilateral_n2i, ONE-KNOB: lr 0.003->0.0035 (fine-tune the lr ridge top), on iter-13 CHAMPION base (img_sr=0.0002, n_iter=30). lr CURVE: 1e-3->0.0895(under-conv), 2e-3->0.1835, 3e-3->0.1988(PEAK), 5e-3->0.126(overshoot). The optimum is between 3e-3 and 5e-3, nearer 3e-3. HYPOTHESIS: 3.5e-3 sits just above the 3e-3 champion on the ridge; if hr>0.1988 the true peak is ~3.5-4e-3 (next: 4e-3); if hr<0.1988 the peak is at 3e-3 and lr is NAILED (stop refining lr, move to a fresh axis e.g. pretrain_epochs / warm_start / a mild n_iter bump at the optimal lr). BUDGET: same steps, ~700-950s, val_n=200. ONE knob: lr 0.003->0.0035.", "agent": "dual_domain_bilateral_n2i-claude-agentic", "campaign": "search-20260703-01", "cfg_full": {"batch_size": 1, "grad_clip": 1.0, "img_n_bf": 1, "img_sr": 0.0002, "lr": 0.0035, "n_iter": 30, "outer_wall_s": 900, "pretrain_epochs": 2, "proj_n_bf": 1, "rationale": "iter-14 dual_domain_bilateral_n2i, ONE-KNOB: lr 0.003->0.0035 (fine-tune the lr ridge top), on iter-13 CHAMPION base (img_sr=0.0002, n_iter=30). lr CURVE: 1e-3->0.0895(under-conv), 2e-3->0.1835, 3e-3->0.1988(PEAK), 5e-3->0.126(overshoot). The optimum is between 3e-3 and 5e-3, nearer 3e-3. HYPOTHESIS: 3.5e-3 sits just above the 3e-3 champion on the ridge; if hr>0.1988 the true peak is ~3.5-4e-3 (next: 4e-3); if hr<0.1988 the peak is at 3e-3 and lr is NAILED (stop refining lr, move to a fresh axis e.g. pretrain_epochs / warm_start / a mild n_iter bump at the optimal lr). BUDGET: same steps, ~700-950s, val_n=200. ONE knob: lr 0.003->0.0035.", "seed": 42, "train_n": 400, "val_n": 200, "warm_start": true}, "challenge": "breast_ct", "change_class": "architecture", "git_commit": "671da566", "images": {"comparison": "runs/breast-ct-claude-agentic-dual-domain-bilateral-n2i-search-20260703-01/iterations/iter-0014/comparison.png", "test_showcase": null, "valtest_showcase": null}, "iter": 14, "kept": true, "metrics": {"headroom": 0.19726246101358813, "headroom_std": 0.11906763166189194, "val_psnr": 40.31285858154297, "val_psnr_std": 1.7633562088012695, "val_rmse": 0.0007900256314314902, "val_rmse_std": 0.00018685591930989176, "val_ssim": 0.9596063494682312, "val_ssim_std": 0.023773865774273872}, "model": "claude-opus-4-8-1m", "obs_path": "breast-ct-claude-agentic-dual-domain-bilateral-n2i-search-20260703-01/iterations/iter-0014/observation.json", "obs_sha1": "9f69693353f4eb20ff2f80e6fbaf074ea79dde97", "params_M": 6e-06, "params_source": "observation", "rationale": "dual_domain_bilateral_n2i-claude-agentic: warm_start=True, pretrain_epochs=2, train_n=400, n_iter=30, val_n=200, batch_size=1, grad_clip=1.0, lr=0.0035, proj_n_bf=1, img_n_bf=1, img_sr=0.0002, outer_wall_s=900, seed=42, rationale=iter-14 dual_domain_bilateral_n2i, ONE-KNOB: lr 0.003->0.0035 (fine-tune the lr ridge top), on iter-13 CHAMPION base (img_sr=0.0002, n_iter=30). lr CURVE: 1e-3->0.0895(under-conv), 2e-3->0.1835, 3e-3->0.1988(PEAK), 5e-3->0.126(overshoot). The optimum is between 3e-3 and 5e-3, nearer 3e-3. HYPOTHESIS: 3.5e-3 sits just above the 3e-3 champion on the ridge; if hr>0.1988 the true peak is ~3.5-4e-3 (next: 4e-3); if hr<0.1988 the peak is at 3e-3 and lr is NAILED (stop refining lr, move to a fresh axis e.g. pretrain_epochs / warm_start / a mild n_iter bump at the optimal lr). BUDGET: same steps, ~700-950s, val_n=200. ONE knob: lr 0.003->0.0035.", "run_id": "breast-ct-claude-agentic-dual-domain-bilateral-n2i-search-20260703-01", "runtime": {"elapsed_s": 982.8250312805176}, "schema_version": 3, "solver_key": "dual-domain-bilateral-n2i", "solver_name": "DD-BF N2I (per-image)", "split": {"train_n": 400, "val_n": 200}, "status": "keep", "ts": "2026-07-05T22:54:52Z"}
{"advice_for_others": "dual_domain_bilateral_n2i-claude-agentic: warm_start=True, pretrain_epochs=2, train_n=400, n_iter=60, val_n=200, batch_size=1, grad_clip=1.0, lr=0.003, proj_n_bf=1, img_n_bf=1, img_sr=0.0002, outer_wall_s=900, seed=42, rationale=iter-15 dual_domain_bilateral_n2i, ONE-KNOB: n_iter 30->60 at the NAILED optimal lr=3e-3 (iter-13 champion hr=0.1988; iter-14 lr3.5e-3 was 0.1973 = ridge top confirmed at 3e-3). img_sr=0.0002, kernel=7, spatial=1.5 all fixed at their tested optima. HYPOTHESIS: iter-8 (n_iter 30->100) DROPPED hr, BUT that was at the OVERSHOOTING lr=5e-3 where extra steps drift the fit toward the noisy 64-view half-target. Now at the GENTLE lr=3e-3 the per-scene fit does NOT overshoot, so MORE steps (60) should let the edge-preserving BF converge FURTHER on genuine denoising -> hr climbs above 0.1988. This is the lr x n_iter interaction: gentle-lr + more-steps is the classic well-damped-convergence regime. If hr FLAT/DROPS, 30 steps already converge the 6-param BF (tiny model converges fast) and n_iter is saturated at the optimal lr -> the ~0.199 hr is the edge-preserving N2I ceiling. RISK: 60 steps x 200 scenes may approach outer_wall_s=900 -> possible val_n trim; iter-13 ran 694s at n_iter30 on a fast node, n_iter60 ~1100-1300s could trim a few scenes (noted if so). ONE knob: n_iter 30->60.", "agent": "dual_domain_bilateral_n2i-claude-agentic", "campaign": "search-20260703-01", "cfg_full": {"batch_size": 1, "grad_clip": 1.0, "img_n_bf": 1, "img_sr": 0.0002, "lr": 0.003, "n_iter": 60, "outer_wall_s": 900, "pretrain_epochs": 2, "proj_n_bf": 1, "rationale": "iter-15 dual_domain_bilateral_n2i, ONE-KNOB: n_iter 30->60 at the NAILED optimal lr=3e-3 (iter-13 champion hr=0.1988; iter-14 lr3.5e-3 was 0.1973 = ridge top confirmed at 3e-3). img_sr=0.0002, kernel=7, spatial=1.5 all fixed at their tested optima. HYPOTHESIS: iter-8 (n_iter 30->100) DROPPED hr, BUT that was at the OVERSHOOTING lr=5e-3 where extra steps drift the fit toward the noisy 64-view half-target. Now at the GENTLE lr=3e-3 the per-scene fit does NOT overshoot, so MORE steps (60) should let the edge-preserving BF converge FURTHER on genuine denoising -> hr climbs above 0.1988. This is the lr x n_iter interaction: gentle-lr + more-steps is the classic well-damped-convergence regime. If hr FLAT/DROPS, 30 steps already converge the 6-param BF (tiny model converges fast) and n_iter is saturated at the optimal lr -> the ~0.199 hr is the edge-preserving N2I ceiling. RISK: 60 steps x 200 scenes may approach outer_wall_s=900 -> possible val_n trim; iter-13 ran 694s at n_iter30 on a fast node, n_iter60 ~1100-1300s could trim a few scenes (noted if so). ONE knob: n_iter 30->60.", "seed": 42, "train_n": 400, "val_n": 200, "warm_start": true}, "challenge": "breast_ct", "change_class": "architecture", "git_commit": "671da566", "images": {"comparison": "runs/breast-ct-claude-agentic-dual-domain-bilateral-n2i-search-20260703-01/iterations/iter-0015/comparison.png", "test_showcase": null, "valtest_showcase": null}, "iter": 15, "kept": true, "metrics": {"headroom": 0.2055215705216945, "headroom_std": 0.11518307030200958, "val_psnr": 40.53019714355469, "val_psnr_std": 1.6632953882217407, "val_rmse": 0.0007705028401687741, "val_rmse_std": 0.00017412958550266922, "val_ssim": 0.960396409034729, "val_ssim_std": 0.021466048434376717}, "model": "claude-opus-4-8-1m", "obs_path": "breast-ct-claude-agentic-dual-domain-bilateral-n2i-search-20260703-01/iterations/iter-0015/observation.json", "obs_sha1": "93ab6452efe01856b559487b491d81c48e360e3e", "params_M": 6e-06, "params_source": "observation", "rationale": "dual_domain_bilateral_n2i-claude-agentic: warm_start=True, pretrain_epochs=2, train_n=400, n_iter=60, val_n=200, batch_size=1, grad_clip=1.0, lr=0.003, proj_n_bf=1, img_n_bf=1, img_sr=0.0002, outer_wall_s=900, seed=42, rationale=iter-15 dual_domain_bilateral_n2i, ONE-KNOB: n_iter 30->60 at the NAILED optimal lr=3e-3 (iter-13 champion hr=0.1988; iter-14 lr3.5e-3 was 0.1973 = ridge top confirmed at 3e-3). img_sr=0.0002, kernel=7, spatial=1.5 all fixed at their tested optima. HYPOTHESIS: iter-8 (n_iter 30->100) DROPPED hr, BUT that was at the OVERSHOOTING lr=5e-3 where extra steps drift the fit toward the noisy 64-view half-target. Now at the GENTLE lr=3e-3 the per-scene fit does NOT overshoot, so MORE steps (60) should let the edge-preserving BF converge FURTHER on genuine denoising -> hr climbs above 0.1988. This is the lr x n_iter interaction: gentle-lr + more-steps is the classic well-damped-convergence regime. If hr FLAT/DROPS, 30 steps already converge the 6-param BF (tiny model converges fast) and n_iter is saturated at the optimal lr -> the ~0.199 hr is the edge-preserving N2I ceiling. RISK: 60 steps x 200 scenes may approach outer_wall_s=900 -> possible val_n trim; iter-13 ran 694s at n_iter30 on a fast node, n_iter60 ~1100-1300s could trim a few scenes (noted if so). ONE knob: n_iter 30->60.", "run_id": "breast-ct-claude-agentic-dual-domain-bilateral-n2i-search-20260703-01", "runtime": {"elapsed_s": 1258.4225528240204}, "schema_version": 3, "solver_key": "dual-domain-bilateral-n2i", "solver_name": "DD-BF N2I (per-image)", "split": {"train_n": 400, "val_n": 196}, "status": "keep", "ts": "2026-07-05T23:17:18Z"}
{"advice_for_others": "dual_domain_bilateral_n2i-claude-agentic: warm_start=True, pretrain_epochs=2, train_n=400, n_iter=90, val_n=200, batch_size=1, grad_clip=1.0, lr=0.003, proj_n_bf=1, img_n_bf=1, img_sr=0.0002, outer_wall_s=1150, seed=42, rationale=iter-16 dual_domain_bilateral_n2i, ONE-KNOB: n_iter 60->90 at optimal lr=3e-3 (iter-15 champion hr=0.2056 at n_iter=60). n_iter CURVE at gentle lr=3e-3: 30->0.1988, 60->0.2056 (rising). img_sr=0.0002, kernel=7, spatial=1.5 fixed. HYPOTHESIS: the gentle-lr regime is well-damped (no overshoot), so the per-scene edge-preserving fit keeps IMPROVING with more steps; 90 steps should push hr above 0.2056 IF the 6-param BF has not yet fully converged at 60. If FLAT/DROP, the tiny bilateral (6 params) has converged by ~60 steps and n_iter is saturated -> ~0.205 is the practical ceiling. WALL: n_iter60 trimmed val to 196 at outer_wall_s=900; n_iter90 is 1.5x more per-scene work so I RAISE outer_wall_s 900->1150 to keep val_n at/near 200 for a clean comparison (total still fits the 30-min=1800s sbatch wall: warm-start ~120s + 200x90 steps at breast-light 128-view adjoint + figure ~ under 1500s). Report val_n. ONE knob: n_iter 60->90 (outer_wall_s raised only to PRESERVE val_n, not as a second lever).", "agent": "dual_domain_bilateral_n2i-claude-agentic", "campaign": "search-20260703-01", "cfg_full": {"batch_size": 1, "grad_clip": 1.0, "img_n_bf": 1, "img_sr": 0.0002, "lr": 0.003, "n_iter": 90, "outer_wall_s": 1150, "pretrain_epochs": 2, "proj_n_bf": 1, "rationale": "iter-16 dual_domain_bilateral_n2i, ONE-KNOB: n_iter 60->90 at optimal lr=3e-3 (iter-15 champion hr=0.2056 at n_iter=60). n_iter CURVE at gentle lr=3e-3: 30->0.1988, 60->0.2056 (rising). img_sr=0.0002, kernel=7, spatial=1.5 fixed. HYPOTHESIS: the gentle-lr regime is well-damped (no overshoot), so the per-scene edge-preserving fit keeps IMPROVING with more steps; 90 steps should push hr above 0.2056 IF the 6-param BF has not yet fully converged at 60. If FLAT/DROP, the tiny bilateral (6 params) has converged by ~60 steps and n_iter is saturated -> ~0.205 is the practical ceiling. WALL: n_iter60 trimmed val to 196 at outer_wall_s=900; n_iter90 is 1.5x more per-scene work so I RAISE outer_wall_s 900->1150 to keep val_n at/near 200 for a clean comparison (total still fits the 30-min=1800s sbatch wall: warm-start ~120s + 200x90 steps at breast-light 128-view adjoint + figure ~ under 1500s). Report val_n. ONE knob: n_iter 60->90 (outer_wall_s raised only to PRESERVE val_n, not as a second lever).", "seed": 42, "train_n": 400, "val_n": 200, "warm_start": true}, "challenge": "breast_ct", "change_class": "architecture", "git_commit": "671da566", "images": {"comparison": "runs/breast-ct-claude-agentic-dual-domain-bilateral-n2i-search-20260703-01/iterations/iter-0016/comparison.png", "test_showcase": null, "valtest_showcase": null}, "iter": 16, "kept": true, "metrics": {"headroom": 0.20507613745861097, "headroom_std": 0.11629504710435867, "val_psnr": 40.49107360839844, "val_psnr_std": 1.6844706535339355, "val_rmse": 0.0007739806897006929, "val_rmse_std": 0.00017645278421696275, "val_ssim": 0.9603676199913025, "val_ssim_std": 0.021808501332998276}, "model": "claude-opus-4-8-1m", "obs_path": "breast-ct-claude-agentic-dual-domain-bilateral-n2i-search-20260703-01/iterations/iter-0016/observation.json", "obs_sha1": "7336807c366fc515d11ac774d832af7022049f1c", "params_M": 6e-06, "params_source": "observation", "rationale": "dual_domain_bilateral_n2i-claude-agentic: warm_start=True, pretrain_epochs=2, train_n=400, n_iter=90, val_n=200, batch_size=1, grad_clip=1.0, lr=0.003, proj_n_bf=1, img_n_bf=1, img_sr=0.0002, outer_wall_s=1150, seed=42, rationale=iter-16 dual_domain_bilateral_n2i, ONE-KNOB: n_iter 60->90 at optimal lr=3e-3 (iter-15 champion hr=0.2056 at n_iter=60). n_iter CURVE at gentle lr=3e-3: 30->0.1988, 60->0.2056 (rising). img_sr=0.0002, kernel=7, spatial=1.5 fixed. HYPOTHESIS: the gentle-lr regime is well-damped (no overshoot), so the per-scene edge-preserving fit keeps IMPROVING with more steps; 90 steps should push hr above 0.2056 IF the 6-param BF has not yet fully converged at 60. If FLAT/DROP, the tiny bilateral (6 params) has converged by ~60 steps and n_iter is saturated -> ~0.205 is the practical ceiling. WALL: n_iter60 trimmed val to 196 at outer_wall_s=900; n_iter90 is 1.5x more per-scene work so I RAISE outer_wall_s 900->1150 to keep val_n at/near 200 for a clean comparison (total still fits the 30-min=1800s sbatch wall: warm-start ~120s + 200x90 steps at breast-light 128-view adjoint + figure ~ under 1500s). Report val_n. ONE knob: n_iter 60->90 (outer_wall_s raised only to PRESERVE val_n, not as a second lever).", "run_id": "breast-ct-claude-agentic-dual-domain-bilateral-n2i-search-20260703-01", "runtime": {"elapsed_s": 1514.0614640712738}, "schema_version": 3, "solver_key": "dual-domain-bilateral-n2i", "solver_name": "DD-BF N2I (per-image)", "split": {"train_n": 400, "val_n": 197}, "status": "keep", "ts": "2026-07-05T23:44:03Z"}
{"advice_for_others": "dual_domain_bilateral_n2i-claude-agentic: warm_start=False, train_n=400, n_iter=60, val_n=200, batch_size=1, grad_clip=1.0, lr=0.003, proj_n_bf=1, img_n_bf=1, img_sr=0.0002, outer_wall_s=1000, seed=42, rationale=iter-17 dual_domain_bilateral_n2i, ONE-KNOB: warm_start True->False (pure per-image N2I, NO amortised pre-pass), on the CHAMPION base (img_sr=0.0002, lr=3e-3, n_iter=60; iter-15 hr=0.2056). n_iter held at 60 (iter-16 n_iter90 hr=0.2051 = TIED -> the 6-param BF converges by 60, saturated). HYPOTHESIS: the warm-start pre-pass captures a GENERIC BF-sigma init from the 400 train scenes; but the per-scene fit already tunes sigmas per image, so warm-start may add a generic-abdomen bias the tight img_sr must undo. With warm_start=False each scene fits from the CONFIG init (img_sr=0.0002 exactly) -> if hr >= 0.2056 the warm-start is UNNECESSARY (pure per-image N2I is self-sufficient AND drops the train-set dependency, a cleaner self-supervised story: train_n=0); if hr DROPS, the warm-start init genuinely helps the 60-step fit converge and should be kept. Either outcome is a clean methodological finding for the paper. WALL: skipping warm-start SAVES ~120s -> n_iter60 fits comfortably, val_n~200 (outer_wall_s=1000). ONE knob: warm_start True->False.", "agent": "dual_domain_bilateral_n2i-claude-agentic", "campaign": "search-20260703-01", "cfg_full": {"batch_size": 1, "grad_clip": 1.0, "img_n_bf": 1, "img_sr": 0.0002, "lr": 0.003, "n_iter": 60, "outer_wall_s": 1000, "proj_n_bf": 1, "rationale": "iter-17 dual_domain_bilateral_n2i, ONE-KNOB: warm_start True->False (pure per-image N2I, NO amortised pre-pass), on the CHAMPION base (img_sr=0.0002, lr=3e-3, n_iter=60; iter-15 hr=0.2056). n_iter held at 60 (iter-16 n_iter90 hr=0.2051 = TIED -> the 6-param BF converges by 60, saturated). HYPOTHESIS: the warm-start pre-pass captures a GENERIC BF-sigma init from the 400 train scenes; but the per-scene fit already tunes sigmas per image, so warm-start may add a generic-abdomen bias the tight img_sr must undo. With warm_start=False each scene fits from the CONFIG init (img_sr=0.0002 exactly) -> if hr >= 0.2056 the warm-start is UNNECESSARY (pure per-image N2I is self-sufficient AND drops the train-set dependency, a cleaner self-supervised story: train_n=0); if hr DROPS, the warm-start init genuinely helps the 60-step fit converge and should be kept. Either outcome is a clean methodological finding for the paper. WALL: skipping warm-start SAVES ~120s -> n_iter60 fits comfortably, val_n~200 (outer_wall_s=1000). ONE knob: warm_start True->False.", "seed": 42, "train_n": 400, "val_n": 200, "warm_start": false}, "challenge": "breast_ct", "change_class": "architecture", "git_commit": "671da566", "images": {"comparison": "runs/breast-ct-claude-agentic-dual-domain-bilateral-n2i-search-20260703-01/iterations/iter-0017/comparison.png", "test_showcase": null, "valtest_showcase": null}, "iter": 17, "kept": true, "metrics": {"headroom": 0.0025387993663684716, "headroom_std": 0.07417676597833633, "val_psnr": 38.553916931152344, "val_psnr_std": 1.5059130191802979, "val_rmse": 0.0009673600434325635, "val_rmse_std": 0.0001941048540174961, "val_ssim": 0.9082974791526794, "val_ssim_std": 0.026129281148314476}, "model": "claude-opus-4-8-1m", "obs_path": "breast-ct-claude-agentic-dual-domain-bilateral-n2i-search-20260703-01/iterations/iter-0017/observation.json", "obs_sha1": "fd8a6cfe4c4e08aafbc7977941d3e2adc689104c", "params_M": 6e-06, "params_source": "observation", "rationale": "dual_domain_bilateral_n2i-claude-agentic: warm_start=False, train_n=400, n_iter=60, val_n=200, batch_size=1, grad_clip=1.0, lr=0.003, proj_n_bf=1, img_n_bf=1, img_sr=0.0002, outer_wall_s=1000, seed=42, rationale=iter-17 dual_domain_bilateral_n2i, ONE-KNOB: warm_start True->False (pure per-image N2I, NO amortised pre-pass), on the CHAMPION base (img_sr=0.0002, lr=3e-3, n_iter=60; iter-15 hr=0.2056). n_iter held at 60 (iter-16 n_iter90 hr=0.2051 = TIED -> the 6-param BF converges by 60, saturated). HYPOTHESIS: the warm-start pre-pass captures a GENERIC BF-sigma init from the 400 train scenes; but the per-scene fit already tunes sigmas per image, so warm-start may add a generic-abdomen bias the tight img_sr must undo. With warm_start=False each scene fits from the CONFIG init (img_sr=0.0002 exactly) -> if hr >= 0.2056 the warm-start is UNNECESSARY (pure per-image N2I is self-sufficient AND drops the train-set dependency, a cleaner self-supervised story: train_n=0); if hr DROPS, the warm-start init genuinely helps the 60-step fit converge and should be kept. Either outcome is a clean methodological finding for the paper. WALL: skipping warm-start SAVES ~120s -> n_iter60 fits comfortably, val_n~200 (outer_wall_s=1000). ONE knob: warm_start True->False.", "run_id": "breast-ct-claude-agentic-dual-domain-bilateral-n2i-search-20260703-01", "runtime": {"elapsed_s": 1167.3675436973572}, "schema_version": 3, "solver_key": "dual-domain-bilateral-n2i", "solver_name": "DD-BF N2I (per-image)", "split": {"train_n": 400, "val_n": 196}, "status": "keep", "ts": "2026-07-06T00:05:05Z"}
