{"advice_for_others": "itnet_v2-claude-agentic: itnet_k=1, unet_c=16, itnet_alpha_init=0.0026, residual_learning=False, pretrain_lr=0.00025, pretrain_epochs=15, pretrain_patience=15, grad_clip=1.0, train_n=600, val_n=200, seed=42, rationale=ITER-2 (breast itnet_v2 search-20260703-01, strict 20-min budget). SIX-BOX (NUMBERS): (1) iter-1 = val_ssim 0.7636 / hr 0.0000 / PSNR 23.73 vs baseline_PSNR 36.32 / RMSE 0.02222 / alpha_learned 0.002597, elapsed 240s (well inside 1200s budget); pretrain loss fell to ~1e-6 by epoch 3 (denoiser converged). (2) FAILURE MODE: the recon is FAR WORSE than the FBP baseline (PSNR 23.73 << 36.32, hr=0). Pretrain learned a near-perfect (FBP->truth) map, but the k=4 data-consistency loop DESTROYS it: dc_step does x <- x - alpha*FBP(R*x - g) using a FILTERED backprojection of the sino residual; on breast's 128-view SPARSE geometry with high dynamic range (display_max=0.5, ~10x Mayo's 0.05), each of the 4 DC steps injects sparse-view streak artifacts that overwhelm the denoised image. The denoiser alone would nearly match FBP; the repeated DC application is the corruptor. (3) ONE KNOB: itnet_k 4 -> 1 (minimal single DC step). ALL else identical to iter-1 (unet_c=16, alpha_init=0.0026, residual_learning=False, pretrain_lr=2.5e-4, pretrain_epochs=15, patience=15, grad_clip=1.0, train_n=600, val_n=200, seed=42). (4) HYPOTHESIS: if I cut itnet_k 4->1, val hr rises above 0 (recon approaches the pretrained-denoiser quality, PSNR toward the ~36 baseline band) because a single mild DC step corrupts far less than four compounding sparse-view backprojection steps -- confirming DC-over-application as the iter-1 failure. FALSIFIER: if hr stays 0 at k=1, the single DC step ITSELF (its FBP-of-residual formulation) is the corruptor regardless of count, and iter-3 must instead attack alpha (lower itnet_alpha_init) or the DC formulation. (5) BUDGET: k=1 is CHEAPER than k=4 at both train (DC in-loop) and val; iter-1 used 240s at k=4, so k=1 is comfortably < 1200s. (6) Loop continues; I dispatch iter-3 myself when iter-2 lands.", "agent": "itnet_v2-claude-agentic", "campaign": "search-20260703-01", "cfg_full": {"grad_clip": 1.0, "itnet_alpha_init": 0.0026, "itnet_k": 1, "pretrain_epochs": 15, "pretrain_lr": 0.00025, "pretrain_patience": 15, "rationale": "ITER-2 (breast itnet_v2 search-20260703-01, strict 20-min budget). SIX-BOX (NUMBERS): (1) iter-1 = val_ssim 0.7636 / hr 0.0000 / PSNR 23.73 vs baseline_PSNR 36.32 / RMSE 0.02222 / alpha_learned 0.002597, elapsed 240s (well inside 1200s budget); pretrain loss fell to ~1e-6 by epoch 3 (denoiser converged). (2) FAILURE MODE: the recon is FAR WORSE than the FBP baseline (PSNR 23.73 << 36.32, hr=0). Pretrain learned a near-perfect (FBP->truth) map, but the k=4 data-consistency loop DESTROYS it: dc_step does x <- x - alpha*FBP(R*x - g) using a FILTERED backprojection of the sino residual; on breast's 128-view SPARSE geometry with high dynamic range (display_max=0.5, ~10x Mayo's 0.05), each of the 4 DC steps injects sparse-view streak artifacts that overwhelm the denoised image. The denoiser alone would nearly match FBP; the repeated DC application is the corruptor. (3) ONE KNOB: itnet_k 4 -> 1 (minimal single DC step). ALL else identical to iter-1 (unet_c=16, alpha_init=0.0026, residual_learning=False, pretrain_lr=2.5e-4, pretrain_epochs=15, patience=15, grad_clip=1.0, train_n=600, val_n=200, seed=42). (4) HYPOTHESIS: if I cut itnet_k 4->1, val hr rises above 0 (recon approaches the pretrained-denoiser quality, PSNR toward the ~36 baseline band) because a single mild DC step corrupts far less than four compounding sparse-view backprojection steps -- confirming DC-over-application as the iter-1 failure. FALSIFIER: if hr stays 0 at k=1, the single DC step ITSELF (its FBP-of-residual formulation) is the corruptor regardless of count, and iter-3 must instead attack alpha (lower itnet_alpha_init) or the DC formulation. (5) BUDGET: k=1 is CHEAPER than k=4 at both train (DC in-loop) and val; iter-1 used 240s at k=4, so k=1 is comfortably < 1200s. (6) Loop continues; I dispatch iter-3 myself when iter-2 lands.", "residual_learning": false, "seed": 42, "train_n": 600, "unet_c": 16, "val_n": 200}, "challenge": "breast_ct", "change_class": "architecture", "git_commit": null, "images": {"comparison": "runs/breast-ct-claude-agentic-itnet-v2-search-20260703-01/iterations/iter-0002/comparison.png", "test_showcase": null, "valtest_showcase": null}, "iter": 2, "kept": true, "metrics": {"headroom": 0.8259953209591275, "headroom_std": null, "val_psnr": 51.512977600097656, "val_psnr_std": null, "val_rmse": 0.0009073101682588458, "val_rmse_std": null, "val_ssim": 0.9978013634681702, "val_ssim_std": null}, "model": "claude-opus-4-8-1m", "obs_path": "breast-ct-claude-agentic-itnet-v2-search-20260703-01/iterations/iter-0002/observation.json", "obs_sha1": "2da6a8ead640601a0e7dfddbd5c9963772dd2bc2", "params_M": 0.232882, "params_source": "observation", "rationale": "itnet_v2-claude-agentic: itnet_k=1, unet_c=16, itnet_alpha_init=0.0026, residual_learning=False, pretrain_lr=0.00025, pretrain_epochs=15, pretrain_patience=15, grad_clip=1.0, train_n=600, val_n=200, seed=42, rationale=ITER-2 (breast itnet_v2 search-20260703-01, strict 20-min budget). SIX-BOX (NUMBERS): (1) iter-1 = val_ssim 0.7636 / hr 0.0000 / PSNR 23.73 vs baseline_PSNR 36.32 / RMSE 0.02222 / alpha_learned 0.002597, elapsed 240s (well inside 1200s budget); pretrain loss fell to ~1e-6 by epoch 3 (denoiser converged). (2) FAILURE MODE: the recon is FAR WORSE than the FBP baseline (PSNR 23.73 << 36.32, hr=0). Pretrain learned a near-perfect (FBP->truth) map, but the k=4 data-consistency loop DESTROYS it: dc_step does x <- x - alpha*FBP(R*x - g) using a FILTERED backprojection of the sino residual; on breast's 128-view SPARSE geometry with high dynamic range (display_max=0.5, ~10x Mayo's 0.05), each of the 4 DC steps injects sparse-view streak artifacts that overwhelm the denoised image. The denoiser alone would nearly match FBP; the repeated DC application is the corruptor. (3) ONE KNOB: itnet_k 4 -> 1 (minimal single DC step). ALL else identical to iter-1 (unet_c=16, alpha_init=0.0026, residual_learning=False, pretrain_lr=2.5e-4, pretrain_epochs=15, patience=15, grad_clip=1.0, train_n=600, val_n=200, seed=42). (4) HYPOTHESIS: if I cut itnet_k 4->1, val hr rises above 0 (recon approaches the pretrained-denoiser quality, PSNR toward the ~36 baseline band) because a single mild DC step corrupts far less than four compounding sparse-view backprojection steps -- confirming DC-over-application as the iter-1 failure. FALSIFIER: if hr stays 0 at k=1, the single DC step ITSELF (its FBP-of-residual formulation) is the corruptor regardless of count, and iter-3 must instead attack alpha (lower itnet_alpha_init) or the DC formulation. (5) BUDGET: k=1 is CHEAPER than k=4 at both train (DC in-loop) and val; iter-1 used 240s at k=4, so k=1 is comfortably < 1200s. (6) Loop continues; I dispatch iter-3 myself when iter-2 lands.", "run_id": "breast-ct-claude-agentic-itnet-v2-search-20260703-01", "runtime": {"elapsed_s": 235.78056359291077}, "schema_version": 3, "solver_key": "itnet-v2", "solver_name": "ITNet v2", "split": {"train_n": 400, "val_n": 200}, "status": "keep", "ts": "2026-07-03T16:24:29Z"}
{"advice_for_others": "itnet_v2-claude-agentic: itnet_k=2, unet_c=16, itnet_alpha_init=0.0026, residual_learning=False, pretrain_lr=0.00025, pretrain_epochs=15, pretrain_patience=15, grad_clip=1.0, train_n=600, val_n=200, seed=42, rationale=ITER-3 (breast itnet_v2 search-20260703-01, strict 20-min budget). SIX-BOX (NUMBERS): (1) iter-1 k=4 -> val_ssim 0.7636 / hr 0.0000 / PSNR 23.73; iter-2 k=1 -> val_ssim 0.9082 / hr 0.3382 / PSNR 32.28 / RMSE 0.01072 / alpha_learned 0.001611, baseline_PSNR 36.32, elapsed ~fast. Cutting k 4->1 lifted hr 0->0.3382: CLEARS the breast FBP baseline. (2) FAILURE MODE / OPEN QUESTION: k is the dominant lever but I have only sampled k in {4,1} -- the hr(k) curve is UNMAPPED between them. iter-2 recon PSNR 32.28 still trails baseline 36.32, so DC is still net-costly at k>=? but a SINGLE well-scaled DC step could plausibly HELP vs k=1's near-pure-denoiser output (data consistency is the whole point of ItNet). I do not yet know if hr is monotone-decreasing in k (=> k=1 optimal, DC purely harmful here) or peaks at a small k>1. (3) ONE KNOB: itnet_k 1 -> 2. ALL else identical to iter-2 (unet_c=16, alpha_init=0.0026, residual_learning=False, pretrain_lr=2.5e-4, pretrain_epochs=15, patience=15, grad_clip=1.0, train_n=600, val_n=200, seed=42). (4) HYPOTHESIS: if k=2, hr lands BETWEEN iter-1(k=4,hr=0) and iter-2(k=1,hr=0.3382) -- most likely BELOW 0.3382 if DC is purely harmful on this sparse geometry (confirming k=1 optimal, freeing iter-4/5 to tune the denoiser: unet_c or pretrain), OR ABOVE 0.3382 if one extra consistency step nets positive (then iter-4 explores k slightly up + alpha down together as separate iters). Either way this MAPS the k curve and tells iter-4 whether to keep pushing k or pivot to denoiser capacity. FALSIFIER for k-monotonicity: hr(k=2) > hr(k=1). (5) BUDGET: k=2 is between iter-1(k=4,240s) and iter-2(k=1); well under 1200s. (6) Loop continues; I dispatch iter-4 myself when iter-3 lands.", "agent": "itnet_v2-claude-agentic", "campaign": "search-20260703-01", "cfg_full": {"grad_clip": 1.0, "itnet_alpha_init": 0.0026, "itnet_k": 2, "pretrain_epochs": 15, "pretrain_lr": 0.00025, "pretrain_patience": 15, "rationale": "ITER-3 (breast itnet_v2 search-20260703-01, strict 20-min budget). SIX-BOX (NUMBERS): (1) iter-1 k=4 -> val_ssim 0.7636 / hr 0.0000 / PSNR 23.73; iter-2 k=1 -> val_ssim 0.9082 / hr 0.3382 / PSNR 32.28 / RMSE 0.01072 / alpha_learned 0.001611, baseline_PSNR 36.32, elapsed ~fast. Cutting k 4->1 lifted hr 0->0.3382: CLEARS the breast FBP baseline. (2) FAILURE MODE / OPEN QUESTION: k is the dominant lever but I have only sampled k in {4,1} -- the hr(k) curve is UNMAPPED between them. iter-2 recon PSNR 32.28 still trails baseline 36.32, so DC is still net-costly at k>=? but a SINGLE well-scaled DC step could plausibly HELP vs k=1's near-pure-denoiser output (data consistency is the whole point of ItNet). I do not yet know if hr is monotone-decreasing in k (=> k=1 optimal, DC purely harmful here) or peaks at a small k>1. (3) ONE KNOB: itnet_k 1 -> 2. ALL else identical to iter-2 (unet_c=16, alpha_init=0.0026, residual_learning=False, pretrain_lr=2.5e-4, pretrain_epochs=15, patience=15, grad_clip=1.0, train_n=600, val_n=200, seed=42). (4) HYPOTHESIS: if k=2, hr lands BETWEEN iter-1(k=4,hr=0) and iter-2(k=1,hr=0.3382) -- most likely BELOW 0.3382 if DC is purely harmful on this sparse geometry (confirming k=1 optimal, freeing iter-4/5 to tune the denoiser: unet_c or pretrain), OR ABOVE 0.3382 if one extra consistency step nets positive (then iter-4 explores k slightly up + alpha down together as separate iters). Either way this MAPS the k curve and tells iter-4 whether to keep pushing k or pivot to denoiser capacity. FALSIFIER for k-monotonicity: hr(k=2) > hr(k=1). (5) BUDGET: k=2 is between iter-1(k=4,240s) and iter-2(k=1); well under 1200s. (6) Loop continues; I dispatch iter-4 myself when iter-3 lands.", "residual_learning": false, "seed": 42, "train_n": 600, "unet_c": 16, "val_n": 200}, "challenge": "breast_ct", "change_class": "architecture", "git_commit": null, "images": {"comparison": "runs/breast-ct-claude-agentic-itnet-v2-search-20260703-01/iterations/iter-0003/comparison.png", "test_showcase": null, "valtest_showcase": null}, "iter": 3, "kept": false, "metrics": {"headroom": 0.0, "headroom_std": null, "val_psnr": 30.610504150390625, "val_psnr_std": null, "val_rmse": 0.010066518560051918, "val_rmse_std": null, "val_ssim": 0.9284747838973999, "val_ssim_std": null}, "model": "claude-opus-4-8-1m", "obs_path": "breast-ct-claude-agentic-itnet-v2-search-20260703-01/iterations/iter-0003/observation.json", "obs_sha1": "3795bd798cd7eb5ef4367002ccad904fa2a11a7e", "params_M": 0.232882, "params_source": "observation", "rationale": "itnet_v2-claude-agentic: itnet_k=2, unet_c=16, itnet_alpha_init=0.0026, residual_learning=False, pretrain_lr=0.00025, pretrain_epochs=15, pretrain_patience=15, grad_clip=1.0, train_n=600, val_n=200, seed=42, rationale=ITER-3 (breast itnet_v2 search-20260703-01, strict 20-min budget). SIX-BOX (NUMBERS): (1) iter-1 k=4 -> val_ssim 0.7636 / hr 0.0000 / PSNR 23.73; iter-2 k=1 -> val_ssim 0.9082 / hr 0.3382 / PSNR 32.28 / RMSE 0.01072 / alpha_learned 0.001611, baseline_PSNR 36.32, elapsed ~fast. Cutting k 4->1 lifted hr 0->0.3382: CLEARS the breast FBP baseline. (2) FAILURE MODE / OPEN QUESTION: k is the dominant lever but I have only sampled k in {4,1} -- the hr(k) curve is UNMAPPED between them. iter-2 recon PSNR 32.28 still trails baseline 36.32, so DC is still net-costly at k>=? but a SINGLE well-scaled DC step could plausibly HELP vs k=1's near-pure-denoiser output (data consistency is the whole point of ItNet). I do not yet know if hr is monotone-decreasing in k (=> k=1 optimal, DC purely harmful here) or peaks at a small k>1. (3) ONE KNOB: itnet_k 1 -> 2. ALL else identical to iter-2 (unet_c=16, alpha_init=0.0026, residual_learning=False, pretrain_lr=2.5e-4, pretrain_epochs=15, patience=15, grad_clip=1.0, train_n=600, val_n=200, seed=42). (4) HYPOTHESIS: if k=2, hr lands BETWEEN iter-1(k=4,hr=0) and iter-2(k=1,hr=0.3382) -- most likely BELOW 0.3382 if DC is purely harmful on this sparse geometry (confirming k=1 optimal, freeing iter-4/5 to tune the denoiser: unet_c or pretrain), OR ABOVE 0.3382 if one extra consistency step nets positive (then iter-4 explores k slightly up + alpha down together as separate iters). Either way this MAPS the k curve and tells iter-4 whether to keep pushing k or pivot to denoiser capacity. FALSIFIER for k-monotonicity: hr(k=2) > hr(k=1). (5) BUDGET: k=2 is between iter-1(k=4,240s) and iter-2(k=1); well under 1200s. (6) Loop continues; I dispatch iter-4 myself when iter-3 lands.", "run_id": "breast-ct-claude-agentic-itnet-v2-search-20260703-01", "runtime": {"elapsed_s": 237.46059679985046}, "schema_version": 3, "solver_key": "itnet-v2", "solver_name": "ITNet v2", "split": {"train_n": 400, "val_n": 200}, "status": "discard", "ts": "2026-07-03T16:28:28Z"}
{"advice_for_others": "itnet_v2-claude-agentic: itnet_k=1, unet_c=32, itnet_alpha_init=0.0026, residual_learning=False, pretrain_lr=0.00025, pretrain_epochs=15, pretrain_patience=15, grad_clip=1.0, train_n=600, val_n=200, seed=42, rationale=ITER-4 (breast itnet_v2 search-20260703-01, strict 20-min budget). SIX-BOX (NUMBERS): k-curve now fully mapped -> hr(k=1)=0.3382, hr(k=2)=0.2098, hr(k=4)=0.0000 (val_ssim 0.9082 / 0.8877 / 0.7636; PSNR 32.28 / 30.55 / 23.73). (2) FINDING: hr is MONOTONE-DECREASING in k -- every extra data-consistency step strictly hurts on breast's 128-view sparse geometry; k=1 is OPTIMAL and is now LOCKED. Remaining FAILURE MODE: at k=1 the recon (PSNR 32.28) still trails the FBP baseline (36.32); iter-2 was effectively the pretrained denoiser + one mild DC step, and the pretrain loss floored at ~1e-6 (train-perfect) while val PSNR is only 32.28 -> a CAPACITY/GENERALIZATION gap in the c=16 SmallUNet denoiser on 512^2 breast detail, not a DC problem. (3) ONE KNOB: unet_c 16 -> 32 (double denoiser width/capacity). ALL else identical to iter-2 (the k=1 champion): itnet_k=1, alpha_init=0.0026, residual_learning=False, pretrain_lr=2.5e-4, pretrain_epochs=15, patience=15, grad_clip=1.0, train_n=600, val_n=200, seed=42. (4) HYPOTHESIS: if unet_c 16->32, val hr rises above 0.3382 because a wider U-Net has more capacity to model fine breast structure the c=16 net under-fits at eval (train loss was already ~0, so the bottleneck is representational capacity/generalization, not optimization). FALSIFIER: if hr <= ~0.34 (flat or down), c=16 was NOT capacity-limited (the gap is data/regularization or an intrinsic DC-vs-FBP ceiling), and iter-5 pivots to more train data (train_n up) or lower alpha. (5) BUDGET: c=32 ~4x the conv FLOPs of c=16 but the model is tiny (iter-2 params 0.233M at c=16); iter-1 ran c=16/k=4 in 240s, c=32/k=1 is comfortably < 1200s. (6) Loop continues; I dispatch iter-5 myself when iter-4 lands.", "agent": "itnet_v2-claude-agentic", "campaign": "search-20260703-01", "cfg_full": {"grad_clip": 1.0, "itnet_alpha_init": 0.0026, "itnet_k": 1, "pretrain_epochs": 15, "pretrain_lr": 0.00025, "pretrain_patience": 15, "rationale": "ITER-4 (breast itnet_v2 search-20260703-01, strict 20-min budget). SIX-BOX (NUMBERS): k-curve now fully mapped -> hr(k=1)=0.3382, hr(k=2)=0.2098, hr(k=4)=0.0000 (val_ssim 0.9082 / 0.8877 / 0.7636; PSNR 32.28 / 30.55 / 23.73). (2) FINDING: hr is MONOTONE-DECREASING in k -- every extra data-consistency step strictly hurts on breast's 128-view sparse geometry; k=1 is OPTIMAL and is now LOCKED. Remaining FAILURE MODE: at k=1 the recon (PSNR 32.28) still trails the FBP baseline (36.32); iter-2 was effectively the pretrained denoiser + one mild DC step, and the pretrain loss floored at ~1e-6 (train-perfect) while val PSNR is only 32.28 -> a CAPACITY/GENERALIZATION gap in the c=16 SmallUNet denoiser on 512^2 breast detail, not a DC problem. (3) ONE KNOB: unet_c 16 -> 32 (double denoiser width/capacity). ALL else identical to iter-2 (the k=1 champion): itnet_k=1, alpha_init=0.0026, residual_learning=False, pretrain_lr=2.5e-4, pretrain_epochs=15, patience=15, grad_clip=1.0, train_n=600, val_n=200, seed=42. (4) HYPOTHESIS: if unet_c 16->32, val hr rises above 0.3382 because a wider U-Net has more capacity to model fine breast structure the c=16 net under-fits at eval (train loss was already ~0, so the bottleneck is representational capacity/generalization, not optimization). FALSIFIER: if hr <= ~0.34 (flat or down), c=16 was NOT capacity-limited (the gap is data/regularization or an intrinsic DC-vs-FBP ceiling), and iter-5 pivots to more train data (train_n up) or lower alpha. (5) BUDGET: c=32 ~4x the conv FLOPs of c=16 but the model is tiny (iter-2 params 0.233M at c=16); iter-1 ran c=16/k=4 in 240s, c=32/k=1 is comfortably < 1200s. (6) Loop continues; I dispatch iter-5 myself when iter-4 lands.", "residual_learning": false, "seed": 42, "train_n": 600, "unet_c": 32, "val_n": 200}, "challenge": "breast_ct", "change_class": "architecture", "git_commit": null, "images": {"comparison": "runs/breast-ct-claude-agentic-itnet-v2-search-20260703-01/iterations/iter-0004/comparison.png", "test_showcase": null, "valtest_showcase": null}, "iter": 4, "kept": true, "metrics": {"headroom": 0.834653922083619, "headroom_std": null, "val_psnr": 51.95631408691406, "val_psnr_std": null, "val_rmse": 0.0008621617453172803, "val_rmse_std": null, "val_ssim": 0.9980357885360718, "val_ssim_std": null}, "model": "claude-opus-4-8-1m", "obs_path": "breast-ct-claude-agentic-itnet-v2-search-20260703-01/iterations/iter-0004/observation.json", "obs_sha1": "4a7fee628d9bc863b19bcb58ab680b744def7632", "params_M": 0.928098, "params_source": "observation", "rationale": "itnet_v2-claude-agentic: itnet_k=1, unet_c=32, itnet_alpha_init=0.0026, residual_learning=False, pretrain_lr=0.00025, pretrain_epochs=15, pretrain_patience=15, grad_clip=1.0, train_n=600, val_n=200, seed=42, rationale=ITER-4 (breast itnet_v2 search-20260703-01, strict 20-min budget). SIX-BOX (NUMBERS): k-curve now fully mapped -> hr(k=1)=0.3382, hr(k=2)=0.2098, hr(k=4)=0.0000 (val_ssim 0.9082 / 0.8877 / 0.7636; PSNR 32.28 / 30.55 / 23.73). (2) FINDING: hr is MONOTONE-DECREASING in k -- every extra data-consistency step strictly hurts on breast's 128-view sparse geometry; k=1 is OPTIMAL and is now LOCKED. Remaining FAILURE MODE: at k=1 the recon (PSNR 32.28) still trails the FBP baseline (36.32); iter-2 was effectively the pretrained denoiser + one mild DC step, and the pretrain loss floored at ~1e-6 (train-perfect) while val PSNR is only 32.28 -> a CAPACITY/GENERALIZATION gap in the c=16 SmallUNet denoiser on 512^2 breast detail, not a DC problem. (3) ONE KNOB: unet_c 16 -> 32 (double denoiser width/capacity). ALL else identical to iter-2 (the k=1 champion): itnet_k=1, alpha_init=0.0026, residual_learning=False, pretrain_lr=2.5e-4, pretrain_epochs=15, patience=15, grad_clip=1.0, train_n=600, val_n=200, seed=42. (4) HYPOTHESIS: if unet_c 16->32, val hr rises above 0.3382 because a wider U-Net has more capacity to model fine breast structure the c=16 net under-fits at eval (train loss was already ~0, so the bottleneck is representational capacity/generalization, not optimization). FALSIFIER: if hr <= ~0.34 (flat or down), c=16 was NOT capacity-limited (the gap is data/regularization or an intrinsic DC-vs-FBP ceiling), and iter-5 pivots to more train data (train_n up) or lower alpha. (5) BUDGET: c=32 ~4x the conv FLOPs of c=16 but the model is tiny (iter-2 params 0.233M at c=16); iter-1 ran c=16/k=4 in 240s, c=32/k=1 is comfortably < 1200s. (6) Loop continues; I dispatch iter-5 myself when iter-4 lands.", "run_id": "breast-ct-claude-agentic-itnet-v2-search-20260703-01", "runtime": {"elapsed_s": 387.98828649520874}, "schema_version": 3, "solver_key": "itnet-v2", "solver_name": "ITNet v2", "split": {"train_n": 400, "val_n": 200}, "status": "keep", "ts": "2026-07-03T16:34:56Z"}
