{"advice_for_others": "dual_domain_supervised-claude-agentic: unet_c=16, epochs=22, batch_size=1, lr=0.001, optimizer=adam, lambda_neg=0.03, grad_clip=1.0, train_n=800, val_n=200, val_chunk=10, seed=42, rationale=iter-10 dual_domain_supervised, re-split Breast-CT val=200. SIX-BOX vs BEST (iter-8 c16/ep44/lr1e-3/lneg0.03/train_n400 hr=0.8915): (1) PRIOR: loss-weighting sweep RESOLVED -- lneg 1.0(0.8843)/0.1(0.8869)/0.03(0.8915 BEST)/0.0(0.8731, iter-9 DROPPED) => 0.03 is the optimum, a tiny penalty is protective. All 9 iters used only train_n=400 of the 3600-scene pool. (2) Failure mode: possible DATA limitation -- 400 scenes repeated 44x may memorize rather than generalize; more UNIQUE scenes at the same gradient budget could lift val hr. (3) ONE KNOB (constant-compute data swap): train_n 400->800 WITH epochs 44->22 to hold total gradient steps fixed at 17600 (= 400x44 = 800x22); same wall time + same optimizer budget, so the single EFFECTIVE lever is 2x unique training scenes per step. lneg=0.03/c=16/lr=1e-3 held at iter-8 winners. (4) HYPOTHESIS: 2x more distinct breast scenes at identical total steps improves val generalization -> hr above 0.8915; if it DROPS, 400 scenes already saturated the val distribution and iter-11 reverts to train_n=400 and instead spends budget on more steps (train_n=800 ep=44, if it fits). Expect ~0.89-0.90. (5) BUDGET: 17600 steps = iter-8 step count -> ~941s, inside 20-min budget (train_n=800 <= 2400 cap, OOM-fixed sbatch). (6) Loop to iter-20. Artifacts saved.", "agent": "dual_domain_supervised-claude-agentic", "campaign": "search-20260703-01", "cfg_full": {"batch_size": 1, "epochs": 22, "grad_clip": 1.0, "lambda_neg": 0.03, "lr": 0.001, "optimizer": "adam", "rationale": "iter-10 dual_domain_supervised, re-split Breast-CT val=200. SIX-BOX vs BEST (iter-8 c16/ep44/lr1e-3/lneg0.03/train_n400 hr=0.8915): (1) PRIOR: loss-weighting sweep RESOLVED -- lneg 1.0(0.8843)/0.1(0.8869)/0.03(0.8915 BEST)/0.0(0.8731, iter-9 DROPPED) => 0.03 is the optimum, a tiny penalty is protective. All 9 iters used only train_n=400 of the 3600-scene pool. (2) Failure mode: possible DATA limitation -- 400 scenes repeated 44x may memorize rather than generalize; more UNIQUE scenes at the same gradient budget could lift val hr. (3) ONE KNOB (constant-compute data swap): train_n 400->800 WITH epochs 44->22 to hold total gradient steps fixed at 17600 (= 400x44 = 800x22); same wall time + same optimizer budget, so the single EFFECTIVE lever is 2x unique training scenes per step. lneg=0.03/c=16/lr=1e-3 held at iter-8 winners. (4) HYPOTHESIS: 2x more distinct breast scenes at identical total steps improves val generalization -> hr above 0.8915; if it DROPS, 400 scenes already saturated the val distribution and iter-11 reverts to train_n=400 and instead spends budget on more steps (train_n=800 ep=44, if it fits). Expect ~0.89-0.90. (5) BUDGET: 17600 steps = iter-8 step count -> ~941s, inside 20-min budget (train_n=800 <= 2400 cap, OOM-fixed sbatch). (6) Loop to iter-20. Artifacts saved.", "seed": 42, "train_n": 800, "unet_c": 16, "val_chunk": 10, "val_n": 200}, "challenge": "breast_ct", "change_class": "architecture", "git_commit": "1176d9f5", "images": {"comparison": "runs/breast-ct-claude-agentic-dual-domain-supervised-search-20260703-01/iterations/iter-0010/comparison.png", "test_showcase": null, "valtest_showcase": null}, "iter": 10, "kept": true, "metrics": {"headroom": 0.8785481521959772, "headroom_std": 0.01115998042518728, "val_psnr": 54.63611602783203, "val_psnr_std": 1.3102307590690243, "val_rmse": 0.0006332843913696706, "val_rmse_std": 9.360450719390533e-05, "val_ssim": 0.9989380240440369, "val_ssim_std": 0.00030899710604255883}, "model": "claude-opus-4-8-1m", "obs_path": "breast-ct-claude-agentic-dual-domain-supervised-search-20260703-01/iterations/iter-0010/observation.json", "obs_sha1": "a15571b84cb2da69485a5613774396479c7bac33", "params_M": 0.465762, "params_source": "observation", "rationale": "dual_domain_supervised-claude-agentic: unet_c=16, epochs=22, batch_size=1, lr=0.001, optimizer=adam, lambda_neg=0.03, grad_clip=1.0, train_n=800, val_n=200, val_chunk=10, seed=42, rationale=iter-10 dual_domain_supervised, re-split Breast-CT val=200. SIX-BOX vs BEST (iter-8 c16/ep44/lr1e-3/lneg0.03/train_n400 hr=0.8915): (1) PRIOR: loss-weighting sweep RESOLVED -- lneg 1.0(0.8843)/0.1(0.8869)/0.03(0.8915 BEST)/0.0(0.8731, iter-9 DROPPED) => 0.03 is the optimum, a tiny penalty is protective. All 9 iters used only train_n=400 of the 3600-scene pool. (2) Failure mode: possible DATA limitation -- 400 scenes repeated 44x may memorize rather than generalize; more UNIQUE scenes at the same gradient budget could lift val hr. (3) ONE KNOB (constant-compute data swap): train_n 400->800 WITH epochs 44->22 to hold total gradient steps fixed at 17600 (= 400x44 = 800x22); same wall time + same optimizer budget, so the single EFFECTIVE lever is 2x unique training scenes per step. lneg=0.03/c=16/lr=1e-3 held at iter-8 winners. (4) HYPOTHESIS: 2x more distinct breast scenes at identical total steps improves val generalization -> hr above 0.8915; if it DROPS, 400 scenes already saturated the val distribution and iter-11 reverts to train_n=400 and instead spends budget on more steps (train_n=800 ep=44, if it fits). Expect ~0.89-0.90. (5) BUDGET: 17600 steps = iter-8 step count -> ~941s, inside 20-min budget (train_n=800 <= 2400 cap, OOM-fixed sbatch). (6) Loop to iter-20. Artifacts saved.", "run_id": "breast-ct-claude-agentic-dual-domain-supervised-search-20260703-01", "runtime": {"elapsed_s": 774.0308511257172}, "schema_version": 3, "solver_key": "dual-domain-supervised", "solver_name": "DD-UNet supervised L2", "split": {"train_n": 400, "val_n": 200}, "status": "keep", "ts": "2026-07-04T08:36:52Z"}
{"advice_for_others": "dual_domain_supervised-claude-agentic: unet_c=16, epochs=52, batch_size=1, lr=0.001, optimizer=adam, lambda_neg=0.03, grad_clip=1.0, train_n=400, val_n=200, val_chunk=10, seed=42, rationale=iter-11 dual_domain_supervised, re-split Breast-CT val=200. SIX-BOX vs BEST (iter-8 c16/ep44/lr1e-3/lneg0.03/tn400 hr=0.8915). (1) PRIOR: landscape mapped -- epochs monotone up to 44; c=32 WORSE (iter-3 0.8243); lr1e-3>5e-4; lneg 0.03 OPTIMAL (0.1=0.8869, 0.0=0.8731 both lower); constant-compute data swap tn800/ep22 WORSE (iter-10 0.8785) => repetition-to-convergence beats more scenes. iter-8 elapsed only 941s (~16 min) -> ep=44 was NOT the budget ceiling. (2) Failure mode: epochs curve may NOT be saturated -- ep32->44 still gave +0.0186; I capped at 44 assuming budget-bound but ~4 min was spare. (3) ONE KNOB: epochs 44 -> 52 (iter-8 config otherwise identical). (4) HYPOTHESIS: more gradient passes-to-convergence has been the dominant lever throughout and budget was under-used, so ep=52 lifts hr above 0.8915; expect ~0.892-0.895. If flat/down, epochs saturates ~44-52 and iter-12 pivots to lr-schedule/warmup. (5) BUDGET: iter-8 ep44=941s -> ep52 ~ 1112s ~ 18.5 min, inside 20-min budget. (6) Loop to iter-20. Artifacts saved.", "agent": "dual_domain_supervised-claude-agentic", "campaign": "search-20260703-01", "cfg_full": {"batch_size": 1, "epochs": 52, "grad_clip": 1.0, "lambda_neg": 0.03, "lr": 0.001, "optimizer": "adam", "rationale": "iter-11 dual_domain_supervised, re-split Breast-CT val=200. SIX-BOX vs BEST (iter-8 c16/ep44/lr1e-3/lneg0.03/tn400 hr=0.8915). (1) PRIOR: landscape mapped -- epochs monotone up to 44; c=32 WORSE (iter-3 0.8243); lr1e-3>5e-4; lneg 0.03 OPTIMAL (0.1=0.8869, 0.0=0.8731 both lower); constant-compute data swap tn800/ep22 WORSE (iter-10 0.8785) => repetition-to-convergence beats more scenes. iter-8 elapsed only 941s (~16 min) -> ep=44 was NOT the budget ceiling. (2) Failure mode: epochs curve may NOT be saturated -- ep32->44 still gave +0.0186; I capped at 44 assuming budget-bound but ~4 min was spare. (3) ONE KNOB: epochs 44 -> 52 (iter-8 config otherwise identical). (4) HYPOTHESIS: more gradient passes-to-convergence has been the dominant lever throughout and budget was under-used, so ep=52 lifts hr above 0.8915; expect ~0.892-0.895. If flat/down, epochs saturates ~44-52 and iter-12 pivots to lr-schedule/warmup. (5) BUDGET: iter-8 ep44=941s -> ep52 ~ 1112s ~ 18.5 min, inside 20-min budget. (6) Loop to iter-20. Artifacts saved.", "seed": 42, "train_n": 400, "unet_c": 16, "val_chunk": 10, "val_n": 200}, "challenge": "breast_ct", "change_class": "architecture", "git_commit": "671da566", "images": {"comparison": "runs/breast-ct-claude-agentic-dual-domain-supervised-search-20260703-01/iterations/iter-0011/comparison.png", "test_showcase": null, "valtest_showcase": null}, "iter": 11, "kept": true, "metrics": {"headroom": 0.8911248662546911, "headroom_std": 0.013614223523232312, "val_psnr": 55.58562469482422, "val_psnr_std": 1.6856687393208063, "val_rmse": 0.0005677058361470699, "val_rmse_std": 0.00010589033183821028, "val_ssim": 0.9991576671600342, "val_ssim_std": 0.00029921485754820694}, "model": "claude-opus-4-8-1m", "obs_path": "breast-ct-claude-agentic-dual-domain-supervised-search-20260703-01/iterations/iter-0011/observation.json", "obs_sha1": "5d10d86e012a7845c717f69c7e847148f845f85b", "params_M": 0.465762, "params_source": "observation", "rationale": "dual_domain_supervised-claude-agentic: unet_c=16, epochs=52, batch_size=1, lr=0.001, optimizer=adam, lambda_neg=0.03, grad_clip=1.0, train_n=400, val_n=200, val_chunk=10, seed=42, rationale=iter-11 dual_domain_supervised, re-split Breast-CT val=200. SIX-BOX vs BEST (iter-8 c16/ep44/lr1e-3/lneg0.03/tn400 hr=0.8915). (1) PRIOR: landscape mapped -- epochs monotone up to 44; c=32 WORSE (iter-3 0.8243); lr1e-3>5e-4; lneg 0.03 OPTIMAL (0.1=0.8869, 0.0=0.8731 both lower); constant-compute data swap tn800/ep22 WORSE (iter-10 0.8785) => repetition-to-convergence beats more scenes. iter-8 elapsed only 941s (~16 min) -> ep=44 was NOT the budget ceiling. (2) Failure mode: epochs curve may NOT be saturated -- ep32->44 still gave +0.0186; I capped at 44 assuming budget-bound but ~4 min was spare. (3) ONE KNOB: epochs 44 -> 52 (iter-8 config otherwise identical). (4) HYPOTHESIS: more gradient passes-to-convergence has been the dominant lever throughout and budget was under-used, so ep=52 lifts hr above 0.8915; expect ~0.892-0.895. If flat/down, epochs saturates ~44-52 and iter-12 pivots to lr-schedule/warmup. (5) BUDGET: iter-8 ep44=941s -> ep52 ~ 1112s ~ 18.5 min, inside 20-min budget. (6) Loop to iter-20. Artifacts saved.", "run_id": "breast-ct-claude-agentic-dual-domain-supervised-search-20260703-01", "runtime": {"elapsed_s": 915.9353678226471}, "schema_version": 3, "solver_key": "dual-domain-supervised", "solver_name": "DD-UNet supervised L2", "split": {"train_n": 400, "val_n": 200}, "status": "keep", "ts": "2026-07-04T10:26:49Z"}
{"advice_for_others": "dual_domain_supervised-claude-agentic: unet_c=16, epochs=44, batch_size=1, lr=0.002, optimizer=adam, lambda_neg=0.03, grad_clip=1.0, train_n=400, val_n=200, val_chunk=10, seed=42, rationale=iter-12 dual_domain_supervised, re-split Breast-CT val=200. SIX-BOX vs BEST (iter-8 c16/ep44/lr1e-3/lneg0.03/tn400 hr=0.8915). (1) PRIOR: epochs SATURATE at ~44 -- iter-11 (ep52) = 0.8911, flat vs iter-8 (-0.0004, val noise). lr1e-3 beat 5e-4 (iter-6 +0.0045). lneg0.03 optimal; c=32 worse; data-diversity worse. (2) Failure mode: epochs cannot buy more; fit is optimizer-LIMITED within 44 epochs -- a higher lr covers more loss-descent per epoch. (3) ONE KNOB: lr 1e-3 -> 2e-3 (iter-8 config otherwise identical). (4) HYPOTHESIS: doubling lr to 2e-3 reaches a lower L2 minimum within 44 epochs -> hr above 0.8915; grad_clip=1.0 + nonfinite-skip guard instability. If hr DROPS (too aggressive/unstable), 1e-3 is the lr optimum and iter-13 tries a cosine lr-schedule at 1e-3. Expect ~0.89-0.895. (5) BUDGET: same ep=44 -> ~941s, inside 20-min budget. (6) Loop to iter-20. Artifacts saved.", "agent": "dual_domain_supervised-claude-agentic", "campaign": "search-20260703-01", "cfg_full": {"batch_size": 1, "epochs": 44, "grad_clip": 1.0, "lambda_neg": 0.03, "lr": 0.002, "optimizer": "adam", "rationale": "iter-12 dual_domain_supervised, re-split Breast-CT val=200. SIX-BOX vs BEST (iter-8 c16/ep44/lr1e-3/lneg0.03/tn400 hr=0.8915). (1) PRIOR: epochs SATURATE at ~44 -- iter-11 (ep52) = 0.8911, flat vs iter-8 (-0.0004, val noise). lr1e-3 beat 5e-4 (iter-6 +0.0045). lneg0.03 optimal; c=32 worse; data-diversity worse. (2) Failure mode: epochs cannot buy more; fit is optimizer-LIMITED within 44 epochs -- a higher lr covers more loss-descent per epoch. (3) ONE KNOB: lr 1e-3 -> 2e-3 (iter-8 config otherwise identical). (4) HYPOTHESIS: doubling lr to 2e-3 reaches a lower L2 minimum within 44 epochs -> hr above 0.8915; grad_clip=1.0 + nonfinite-skip guard instability. If hr DROPS (too aggressive/unstable), 1e-3 is the lr optimum and iter-13 tries a cosine lr-schedule at 1e-3. Expect ~0.89-0.895. (5) BUDGET: same ep=44 -> ~941s, inside 20-min budget. (6) Loop to iter-20. Artifacts saved.", "seed": 42, "train_n": 400, "unet_c": 16, "val_chunk": 10, "val_n": 200}, "challenge": "breast_ct", "change_class": "architecture", "git_commit": "671da566", "images": {"comparison": "runs/breast-ct-claude-agentic-dual-domain-supervised-search-20260703-01/iterations/iter-0012/comparison.png", "test_showcase": null, "valtest_showcase": null}, "iter": 12, "kept": true, "metrics": {"headroom": 0.8470340467934661, "headroom_std": 0.014126379285295388, "val_psnr": 52.63229751586914, "val_psnr_std": 1.3542960154759272, "val_rmse": 0.0007976078777574003, "val_rmse_std": 0.00012174515854444792, "val_ssim": 0.9984807968139648, "val_ssim_std": 0.0004923989469385551}, "model": "claude-opus-4-8-1m", "obs_path": "breast-ct-claude-agentic-dual-domain-supervised-search-20260703-01/iterations/iter-0012/observation.json", "obs_sha1": "60c5718f6982e10c7aa6707b8f90186248742d08", "params_M": 0.465762, "params_source": "observation", "rationale": "dual_domain_supervised-claude-agentic: unet_c=16, epochs=44, batch_size=1, lr=0.002, optimizer=adam, lambda_neg=0.03, grad_clip=1.0, train_n=400, val_n=200, val_chunk=10, seed=42, rationale=iter-12 dual_domain_supervised, re-split Breast-CT val=200. SIX-BOX vs BEST (iter-8 c16/ep44/lr1e-3/lneg0.03/tn400 hr=0.8915). (1) PRIOR: epochs SATURATE at ~44 -- iter-11 (ep52) = 0.8911, flat vs iter-8 (-0.0004, val noise). lr1e-3 beat 5e-4 (iter-6 +0.0045). lneg0.03 optimal; c=32 worse; data-diversity worse. (2) Failure mode: epochs cannot buy more; fit is optimizer-LIMITED within 44 epochs -- a higher lr covers more loss-descent per epoch. (3) ONE KNOB: lr 1e-3 -> 2e-3 (iter-8 config otherwise identical). (4) HYPOTHESIS: doubling lr to 2e-3 reaches a lower L2 minimum within 44 epochs -> hr above 0.8915; grad_clip=1.0 + nonfinite-skip guard instability. If hr DROPS (too aggressive/unstable), 1e-3 is the lr optimum and iter-13 tries a cosine lr-schedule at 1e-3. Expect ~0.89-0.895. (5) BUDGET: same ep=44 -> ~941s, inside 20-min budget. (6) Loop to iter-20. Artifacts saved.", "run_id": "breast-ct-claude-agentic-dual-domain-supervised-search-20260703-01", "runtime": {"elapsed_s": 800.4016785621643}, "schema_version": 3, "solver_key": "dual-domain-supervised", "solver_name": "DD-UNet supervised L2", "split": {"train_n": 400, "val_n": 200}, "status": "keep", "ts": "2026-07-04T11:23:36Z"}
{"advice_for_others": "dual_domain_supervised-claude-agentic: unet_c=16, epochs=44, batch_size=2, lr=0.001, optimizer=adam, lambda_neg=0.03, grad_clip=1.0, train_n=400, val_n=200, val_chunk=10, seed=42, rationale=iter-13 dual_domain_supervised, re-split Breast-CT val=200. SIX-BOX vs BEST (iter-8 c16/ep44/lr1e-3/lneg0.03/bs1/tn400 hr=0.8915). (1) PRIOR: lr BRACKETED -- 5e-4<1e-3(best)>2e-3 (iter-12=0.8470, sharp drop). epochs SATURATE ~44 (iter-11 ep52 flat). VERIFIED the solver hardcodes Adam(lr) with NO lr_schedule/weight_decay/AdamW support, so those are NOT available knobs. Remaining effective config knobs: batch_size, train_n, seed. (2) Failure mode: constant lr=1e-3 with batch_size=1 gives noisy single-sample gradients that may jitter near the minimum instead of settling. (3) ONE KNOB: batch_size 1 -> 2 (iter-8 config otherwise identical). Breast has NO per-sample-ps constraint (_per_ps=False), so batching >1 is valid here (unlike Mayo). (4) HYPOTHESIS: batch_size=2 averages 2 samples/step -> smoother gradients settle into a marginally better minimum -> hr >= 0.8915, and it is also ~faster (half the steps) so budget-safe. If hr DROPS, single-sample stochasticity was beneficial and iter-14 reverts to bs=1 and tries a modest train_n bump (400->500) at ep=44. Expect ~0.89-0.895. (5) BUDGET: <= iter-8 941s (fewer optimizer steps), inside 20-min budget. (6) Loop to iter-20. Artifacts saved.", "agent": "dual_domain_supervised-claude-agentic", "campaign": "search-20260703-01", "cfg_full": {"batch_size": 2, "epochs": 44, "grad_clip": 1.0, "lambda_neg": 0.03, "lr": 0.001, "optimizer": "adam", "rationale": "iter-13 dual_domain_supervised, re-split Breast-CT val=200. SIX-BOX vs BEST (iter-8 c16/ep44/lr1e-3/lneg0.03/bs1/tn400 hr=0.8915). (1) PRIOR: lr BRACKETED -- 5e-4<1e-3(best)>2e-3 (iter-12=0.8470, sharp drop). epochs SATURATE ~44 (iter-11 ep52 flat). VERIFIED the solver hardcodes Adam(lr) with NO lr_schedule/weight_decay/AdamW support, so those are NOT available knobs. Remaining effective config knobs: batch_size, train_n, seed. (2) Failure mode: constant lr=1e-3 with batch_size=1 gives noisy single-sample gradients that may jitter near the minimum instead of settling. (3) ONE KNOB: batch_size 1 -> 2 (iter-8 config otherwise identical). Breast has NO per-sample-ps constraint (_per_ps=False), so batching >1 is valid here (unlike Mayo). (4) HYPOTHESIS: batch_size=2 averages 2 samples/step -> smoother gradients settle into a marginally better minimum -> hr >= 0.8915, and it is also ~faster (half the steps) so budget-safe. If hr DROPS, single-sample stochasticity was beneficial and iter-14 reverts to bs=1 and tries a modest train_n bump (400->500) at ep=44. Expect ~0.89-0.895. (5) BUDGET: <= iter-8 941s (fewer optimizer steps), inside 20-min budget. (6) Loop to iter-20. Artifacts saved.", "seed": 42, "train_n": 400, "unet_c": 16, "val_chunk": 10, "val_n": 200}, "challenge": "breast_ct", "change_class": "architecture", "git_commit": "671da566", "images": {"comparison": "runs/breast-ct-claude-agentic-dual-domain-supervised-search-20260703-01/iterations/iter-0013/comparison.png", "test_showcase": null, "valtest_showcase": null}, "iter": 13, "kept": true, "metrics": {"headroom": 0.8587626765011647, "headroom_std": 0.014162451982652917, "val_psnr": 53.32521057128906, "val_psnr_std": 1.4280277686352405, "val_rmse": 0.0007364514749497175, "val_rmse_std": 0.00011812682377743495, "val_ssim": 0.9985755681991577, "val_ssim_std": 0.0004737517691783055}, "model": "claude-opus-4-8-1m", "obs_path": "breast-ct-claude-agentic-dual-domain-supervised-search-20260703-01/iterations/iter-0013/observation.json", "obs_sha1": "8c976eae946824a72a21539550248856bbba6628", "params_M": 0.465762, "params_source": "observation", "rationale": "dual_domain_supervised-claude-agentic: unet_c=16, epochs=44, batch_size=2, lr=0.001, optimizer=adam, lambda_neg=0.03, grad_clip=1.0, train_n=400, val_n=200, val_chunk=10, seed=42, rationale=iter-13 dual_domain_supervised, re-split Breast-CT val=200. SIX-BOX vs BEST (iter-8 c16/ep44/lr1e-3/lneg0.03/bs1/tn400 hr=0.8915). (1) PRIOR: lr BRACKETED -- 5e-4<1e-3(best)>2e-3 (iter-12=0.8470, sharp drop). epochs SATURATE ~44 (iter-11 ep52 flat). VERIFIED the solver hardcodes Adam(lr) with NO lr_schedule/weight_decay/AdamW support, so those are NOT available knobs. Remaining effective config knobs: batch_size, train_n, seed. (2) Failure mode: constant lr=1e-3 with batch_size=1 gives noisy single-sample gradients that may jitter near the minimum instead of settling. (3) ONE KNOB: batch_size 1 -> 2 (iter-8 config otherwise identical). Breast has NO per-sample-ps constraint (_per_ps=False), so batching >1 is valid here (unlike Mayo). (4) HYPOTHESIS: batch_size=2 averages 2 samples/step -> smoother gradients settle into a marginally better minimum -> hr >= 0.8915, and it is also ~faster (half the steps) so budget-safe. If hr DROPS, single-sample stochasticity was beneficial and iter-14 reverts to bs=1 and tries a modest train_n bump (400->500) at ep=44. Expect ~0.89-0.895. (5) BUDGET: <= iter-8 941s (fewer optimizer steps), inside 20-min budget. (6) Loop to iter-20. Artifacts saved.", "run_id": "breast-ct-claude-agentic-dual-domain-supervised-search-20260703-01", "runtime": {"elapsed_s": 557.0465500354767}, "schema_version": 3, "solver_key": "dual-domain-supervised", "solver_name": "DD-UNet supervised L2", "split": {"train_n": 400, "val_n": 200}, "status": "keep", "ts": "2026-07-04T12:19:09Z"}
