{"advice_for_others": "itnet-claude-agentic: pretrain_epochs=80, pretrain_lr=0.001, itnet_k=1, itnet_alpha=0.0, unet_c=24, finetune_epochs=0, finetune_lr=0.0001, train_n=400, val_n=200, grad_clip=1.0, seed=42, rationale=iter-7 (breast ItNet v1). SIX-BOX: (1) PRIOR: iter-5 (c16,ep120,lr1e-3,a0.0) hr 0.8741 BEST; iter-6 (lr 3e-4) hr 0.8698 -> lr LOWER hurt, so lr=1e-3 already near-optimal (lever exhausted). alpha exhausted (a0.0 best). Recon == pure SmallUNet denoiser; only untested denoiser levers are CAPACITY (unet_c) and DATA (train_n). (2) FAILURE MODE: denoiser capacity ceiling at c=16 on 512^2 sparse-view. (3) ONE KNOB (capacity/architecture, allowed): unet_c 16 -> 24 (~2.25x conv cost, ~2.25x params). Budget-compensation: pretrain_epochs 120 -> 80 SOLELY to fit the 20-min wall (iter-4 c32@ep120 TIMED OUT; c24 needs an epoch cut). lr restored to the champion 1e-3. (4) HYPOTHESIS: if I widen the denoiser to c=24, I expect hr above 0.8741 because the recon is now purely the denoiser output and c=16 is a small model for 512^2 sparse-view; more channels capture finer breast structure. FALSIFIER: if hr<=0.8741, either c=16 was already capacity-saturated on 400 scenes OR the ep120->80 cut offset the width gain -> iter-8 disambiguates (train_n up, or c24 at more epochs if budget allows under turbo). (5) BUDGET: c24@ep80 ~ (24/16)^2 * (80/120) * 1189s ~= 1783s?? RISK -> mitigated by turbo qos (faster nodes); if it TIMES OUT, iter-7 re-dispatched cheaper (ep60). (6) Loop to iter-20.", "agent": "itnet-claude-agentic", "campaign": "search-20260703-01", "cfg_full": {"finetune_epochs": 0, "finetune_lr": 0.0001, "grad_clip": 1.0, "itnet_alpha": 0.0, "itnet_k": 1, "pretrain_epochs": 80, "pretrain_lr": 0.001, "rationale": "iter-7 (breast ItNet v1). SIX-BOX: (1) PRIOR: iter-5 (c16,ep120,lr1e-3,a0.0) hr 0.8741 BEST; iter-6 (lr 3e-4) hr 0.8698 -> lr LOWER hurt, so lr=1e-3 already near-optimal (lever exhausted). alpha exhausted (a0.0 best). Recon == pure SmallUNet denoiser; only untested denoiser levers are CAPACITY (unet_c) and DATA (train_n). (2) FAILURE MODE: denoiser capacity ceiling at c=16 on 512^2 sparse-view. (3) ONE KNOB (capacity/architecture, allowed): unet_c 16 -> 24 (~2.25x conv cost, ~2.25x params). Budget-compensation: pretrain_epochs 120 -> 80 SOLELY to fit the 20-min wall (iter-4 c32@ep120 TIMED OUT; c24 needs an epoch cut). lr restored to the champion 1e-3. (4) HYPOTHESIS: if I widen the denoiser to c=24, I expect hr above 0.8741 because the recon is now purely the denoiser output and c=16 is a small model for 512^2 sparse-view; more channels capture finer breast structure. FALSIFIER: if hr<=0.8741, either c=16 was already capacity-saturated on 400 scenes OR the ep120->80 cut offset the width gain -> iter-8 disambiguates (train_n up, or c24 at more epochs if budget allows under turbo). (5) BUDGET: c24@ep80 ~ (24/16)^2 * (80/120) * 1189s ~= 1783s?? RISK -> mitigated by turbo qos (faster nodes); if it TIMES OUT, iter-7 re-dispatched cheaper (ep60). (6) Loop to iter-20.", "seed": 42, "train_n": 400, "unet_c": 24, "val_n": 200}, "challenge": "breast_ct", "change_class": "architecture", "git_commit": null, "images": {"comparison": "runs/breast-ct-claude-agentic-itnet-search-20260703-01/iterations/iter-0007/comparison.png", "test_showcase": null, "valtest_showcase": null}, "iter": 7, "kept": true, "metrics": {"headroom": 0.8584009356835655, "headroom_std": 0.01586747577932014, "val_psnr": 53.30299377441406, "val_psnr_std": 1.5511561872745947, "val_rmse": 0.0007383376942016184, "val_rmse_std": 0.0001262851929947131, "val_ssim": 0.9985829591751099, "val_ssim_std": 0.0004985108511925009}, "model": "claude-opus-4-8-1m", "obs_path": "breast-ct-claude-agentic-itnet-search-20260703-01/iterations/iter-0007/observation.json", "obs_sha1": "23d2ee08abe90bc1856365d7ac785e0d3fd137fe", "params_M": 0.522697, "params_source": "observation", "rationale": "itnet-claude-agentic: pretrain_epochs=80, pretrain_lr=0.001, itnet_k=1, itnet_alpha=0.0, unet_c=24, finetune_epochs=0, finetune_lr=0.0001, train_n=400, val_n=200, grad_clip=1.0, seed=42, rationale=iter-7 (breast ItNet v1). SIX-BOX: (1) PRIOR: iter-5 (c16,ep120,lr1e-3,a0.0) hr 0.8741 BEST; iter-6 (lr 3e-4) hr 0.8698 -> lr LOWER hurt, so lr=1e-3 already near-optimal (lever exhausted). alpha exhausted (a0.0 best). Recon == pure SmallUNet denoiser; only untested denoiser levers are CAPACITY (unet_c) and DATA (train_n). (2) FAILURE MODE: denoiser capacity ceiling at c=16 on 512^2 sparse-view. (3) ONE KNOB (capacity/architecture, allowed): unet_c 16 -> 24 (~2.25x conv cost, ~2.25x params). Budget-compensation: pretrain_epochs 120 -> 80 SOLELY to fit the 20-min wall (iter-4 c32@ep120 TIMED OUT; c24 needs an epoch cut). lr restored to the champion 1e-3. (4) HYPOTHESIS: if I widen the denoiser to c=24, I expect hr above 0.8741 because the recon is now purely the denoiser output and c=16 is a small model for 512^2 sparse-view; more channels capture finer breast structure. FALSIFIER: if hr<=0.8741, either c=16 was already capacity-saturated on 400 scenes OR the ep120->80 cut offset the width gain -> iter-8 disambiguates (train_n up, or c24 at more epochs if budget allows under turbo). (5) BUDGET: c24@ep80 ~ (24/16)^2 * (80/120) * 1189s ~= 1783s?? RISK -> mitigated by turbo qos (faster nodes); if it TIMES OUT, iter-7 re-dispatched cheaper (ep60). (6) Loop to iter-20.", "run_id": "breast-ct-claude-agentic-itnet-search-20260703-01", "runtime": {"elapsed_s": 865.6746788024902}, "schema_version": 3, "solver_key": "itnet", "solver_name": "ITNet v1", "split": {"train_n": 400, "val_n": 200}, "status": "keep", "ts": "2026-07-04T00:06:16Z"}
{"advice_for_others": "itnet-claude-agentic: pretrain_epochs=60, pretrain_lr=0.001, itnet_k=1, itnet_alpha=0.0, unet_c=16, finetune_epochs=0, finetune_lr=0.0001, train_n=800, val_n=200, grad_clip=1.0, seed=42, rationale=iter-8 REDO (breast ItNet v1). Prior iter-8 (train_n800, ep120) TIMED OUT at 30:15 (2x data at full epochs overran even turbo). SIX-BOX: (1) PRIOR: iter-5 (train_n400,ep120,c16,k1,a0.0,lr1e-3) hr 0.8741 CHAMPION (400x120=48000 grad steps). iter-6 lr dead; iter-7 c24+epcut 0.8584. (2) FAILURE MODE: is the denoiser DATA-limited (400 scenes) or COMPUTE-limited? Disentangle by holding total gradient steps CONSTANT while doubling scene DIVERSITY. (3) ONE KNOB (data-diversity, compute-matched): train_n 400 -> 800 with pretrain_epochs 120 -> 60 so 800x60 = 48000 grad steps = EXACTLY iter-5s budget (the epoch cut is pure compute-normalization, not an independent hypothesis). All else = champion iter-5. (4) HYPOTHESIS: if I show the denoiser 2x MORE distinct scenes at the SAME total compute, I expect hr above 0.8741 because 400 scenes likely under-cover the breast-phantom distribution and more diversity reduces val overfit at equal training cost. FALSIFIER: if hr<=0.8741, the denoiser was NOT data-diversity-limited at 400 scenes -> the ceiling is model CAPACITY -> iter-9 tests unet_c at compute-matched epochs (width up, epochs down to hold steps). (5) BUDGET: 48000 grad steps = iter-5s ~1189s train portion; +turbo -> comfortably < 20 min. train_n=800 <= 2400 FBP-safe. (6) Loop to iter-20.", "agent": "itnet-claude-agentic", "campaign": "search-20260703-01", "cfg_full": {"finetune_epochs": 0, "finetune_lr": 0.0001, "grad_clip": 1.0, "itnet_alpha": 0.0, "itnet_k": 1, "pretrain_epochs": 60, "pretrain_lr": 0.001, "rationale": "iter-8 REDO (breast ItNet v1). Prior iter-8 (train_n800, ep120) TIMED OUT at 30:15 (2x data at full epochs overran even turbo). SIX-BOX: (1) PRIOR: iter-5 (train_n400,ep120,c16,k1,a0.0,lr1e-3) hr 0.8741 CHAMPION (400x120=48000 grad steps). iter-6 lr dead; iter-7 c24+epcut 0.8584. (2) FAILURE MODE: is the denoiser DATA-limited (400 scenes) or COMPUTE-limited? Disentangle by holding total gradient steps CONSTANT while doubling scene DIVERSITY. (3) ONE KNOB (data-diversity, compute-matched): train_n 400 -> 800 with pretrain_epochs 120 -> 60 so 800x60 = 48000 grad steps = EXACTLY iter-5s budget (the epoch cut is pure compute-normalization, not an independent hypothesis). All else = champion iter-5. (4) HYPOTHESIS: if I show the denoiser 2x MORE distinct scenes at the SAME total compute, I expect hr above 0.8741 because 400 scenes likely under-cover the breast-phantom distribution and more diversity reduces val overfit at equal training cost. FALSIFIER: if hr<=0.8741, the denoiser was NOT data-diversity-limited at 400 scenes -> the ceiling is model CAPACITY -> iter-9 tests unet_c at compute-matched epochs (width up, epochs down to hold steps). (5) BUDGET: 48000 grad steps = iter-5s ~1189s train portion; +turbo -> comfortably < 20 min. train_n=800 <= 2400 FBP-safe. (6) Loop to iter-20.", "seed": 42, "train_n": 800, "unet_c": 16, "val_n": 200}, "challenge": "breast_ct", "change_class": "architecture", "git_commit": "1176d9f5", "images": {"comparison": "runs/breast-ct-claude-agentic-itnet-search-20260703-01/iterations/iter-0008/comparison.png", "test_showcase": null, "valtest_showcase": null}, "iter": 8, "kept": true, "metrics": {"headroom": 0.8841841533923062, "headroom_std": 0.014795951027771275, "val_psnr": 55.04883575439453, "val_psnr_std": 1.725715079379994, "val_rmse": 0.0006038966821506619, "val_rmse_std": 0.00011259568291206905, "val_ssim": 0.998993456363678, "val_ssim_std": 0.0003676225374846424}, "model": "claude-opus-4-8-1m", "obs_path": "breast-ct-claude-agentic-itnet-search-20260703-01/iterations/iter-0008/observation.json", "obs_sha1": "8be0f984b5434f06da99555b4a2e04306ae1f7b2", "params_M": 0.232881, "params_source": "observation", "rationale": "itnet-claude-agentic: pretrain_epochs=60, pretrain_lr=0.001, itnet_k=1, itnet_alpha=0.0, unet_c=16, finetune_epochs=0, finetune_lr=0.0001, train_n=800, val_n=200, grad_clip=1.0, seed=42, rationale=iter-8 REDO (breast ItNet v1). Prior iter-8 (train_n800, ep120) TIMED OUT at 30:15 (2x data at full epochs overran even turbo). SIX-BOX: (1) PRIOR: iter-5 (train_n400,ep120,c16,k1,a0.0,lr1e-3) hr 0.8741 CHAMPION (400x120=48000 grad steps). iter-6 lr dead; iter-7 c24+epcut 0.8584. (2) FAILURE MODE: is the denoiser DATA-limited (400 scenes) or COMPUTE-limited? Disentangle by holding total gradient steps CONSTANT while doubling scene DIVERSITY. (3) ONE KNOB (data-diversity, compute-matched): train_n 400 -> 800 with pretrain_epochs 120 -> 60 so 800x60 = 48000 grad steps = EXACTLY iter-5s budget (the epoch cut is pure compute-normalization, not an independent hypothesis). All else = champion iter-5. (4) HYPOTHESIS: if I show the denoiser 2x MORE distinct scenes at the SAME total compute, I expect hr above 0.8741 because 400 scenes likely under-cover the breast-phantom distribution and more diversity reduces val overfit at equal training cost. FALSIFIER: if hr<=0.8741, the denoiser was NOT data-diversity-limited at 400 scenes -> the ceiling is model CAPACITY -> iter-9 tests unet_c at compute-matched epochs (width up, epochs down to hold steps). (5) BUDGET: 48000 grad steps = iter-5s ~1189s train portion; +turbo -> comfortably < 20 min. train_n=800 <= 2400 FBP-safe. (6) Loop to iter-20.", "run_id": "breast-ct-claude-agentic-itnet-search-20260703-01", "runtime": {"elapsed_s": 889.8157649040222}, "schema_version": 3, "solver_key": "itnet", "solver_name": "ITNet v1", "split": {"train_n": 400, "val_n": 200}, "status": "keep", "ts": "2026-07-04T08:38:51Z"}
{"advice_for_others": "itnet-claude-agentic: pretrain_epochs=30, pretrain_lr=0.001, itnet_k=1, itnet_alpha=0.0, unet_c=16, finetune_epochs=0, finetune_lr=0.0001, train_n=1600, val_n=200, grad_clip=1.0, seed=42, rationale=iter-9 (breast ItNet v1). SIX-BOX: (1) PRIOR: iter-5 (tn400,ep120) 0.8741; iter-8 (tn800,ep60, compute-matched 48000 steps) 0.8842 NEW BEST (+0.010). CONFIRMED: at equal compute, 2x MORE scene DIVERSITY helps -> denoiser was DATA-diversity-limited, not compute-limited. (2) FAILURE MODE: keep pushing the winning lever until diversity saturates. (3) ONE KNOB (from champion iter-8): train_n 800 -> 1600, with pretrain_epochs 60 -> 30 so 1600x30 = 48000 grad steps = SAME compute (epoch cut is pure compute-normalization). All else = iter-8 (k1,a0.0,c16,lr1e-3,val200). (4) HYPOTHESIS: if I double scene diversity again at fixed compute, I expect hr above 0.8842 (continuing the 0.8741->0.8842 diversity slope) because the breast-phantom distribution is still under-covered at 800 scenes. FALSIFIER: if hr<=0.8842, diversity saturates around 800-1600 scenes at fixed 48000 steps -> the ceiling shifts to COMPUTE (more total grad steps) or CAPACITY -> iter-10 raises total steps (more epochs at the best train_n, budget permitting) or width. (5) BUDGET: 48000 grad steps = iter-8s ~890s (turbo) < 20 min; each epoch now touches 1600 scenes but only 30 epochs. train_n=1600 <= 2400 FBP-safe cap. (6) Loop to iter-20.", "agent": "itnet-claude-agentic", "campaign": "search-20260703-01", "cfg_full": {"finetune_epochs": 0, "finetune_lr": 0.0001, "grad_clip": 1.0, "itnet_alpha": 0.0, "itnet_k": 1, "pretrain_epochs": 30, "pretrain_lr": 0.001, "rationale": "iter-9 (breast ItNet v1). SIX-BOX: (1) PRIOR: iter-5 (tn400,ep120) 0.8741; iter-8 (tn800,ep60, compute-matched 48000 steps) 0.8842 NEW BEST (+0.010). CONFIRMED: at equal compute, 2x MORE scene DIVERSITY helps -> denoiser was DATA-diversity-limited, not compute-limited. (2) FAILURE MODE: keep pushing the winning lever until diversity saturates. (3) ONE KNOB (from champion iter-8): train_n 800 -> 1600, with pretrain_epochs 60 -> 30 so 1600x30 = 48000 grad steps = SAME compute (epoch cut is pure compute-normalization). All else = iter-8 (k1,a0.0,c16,lr1e-3,val200). (4) HYPOTHESIS: if I double scene diversity again at fixed compute, I expect hr above 0.8842 (continuing the 0.8741->0.8842 diversity slope) because the breast-phantom distribution is still under-covered at 800 scenes. FALSIFIER: if hr<=0.8842, diversity saturates around 800-1600 scenes at fixed 48000 steps -> the ceiling shifts to COMPUTE (more total grad steps) or CAPACITY -> iter-10 raises total steps (more epochs at the best train_n, budget permitting) or width. (5) BUDGET: 48000 grad steps = iter-8s ~890s (turbo) < 20 min; each epoch now touches 1600 scenes but only 30 epochs. train_n=1600 <= 2400 FBP-safe cap. (6) Loop to iter-20.", "seed": 42, "train_n": 1600, "unet_c": 16, "val_n": 200}, "challenge": "breast_ct", "change_class": "architecture", "git_commit": "671da566", "images": {"comparison": "runs/breast-ct-claude-agentic-itnet-search-20260703-01/iterations/iter-0009/comparison.png", "test_showcase": null, "valtest_showcase": null}, "iter": 9, "kept": true, "metrics": {"headroom": 0.8840667062347082, "headroom_std": 0.014041467937810317, "val_psnr": 55.040035247802734, "val_psnr_std": 1.6600532756251254, "val_rmse": 0.0006045090849511325, "val_rmse_std": 0.00010872708629790954, "val_ssim": 0.9989974498748779, "val_ssim_std": 0.00035306293927033416}, "model": "claude-opus-4-8-1m", "obs_path": "breast-ct-claude-agentic-itnet-search-20260703-01/iterations/iter-0009/observation.json", "obs_sha1": "2e6f603c259587dda101a5dd49a19ca338bff33c", "params_M": 0.232881, "params_source": "observation", "rationale": "itnet-claude-agentic: pretrain_epochs=30, pretrain_lr=0.001, itnet_k=1, itnet_alpha=0.0, unet_c=16, finetune_epochs=0, finetune_lr=0.0001, train_n=1600, val_n=200, grad_clip=1.0, seed=42, rationale=iter-9 (breast ItNet v1). SIX-BOX: (1) PRIOR: iter-5 (tn400,ep120) 0.8741; iter-8 (tn800,ep60, compute-matched 48000 steps) 0.8842 NEW BEST (+0.010). CONFIRMED: at equal compute, 2x MORE scene DIVERSITY helps -> denoiser was DATA-diversity-limited, not compute-limited. (2) FAILURE MODE: keep pushing the winning lever until diversity saturates. (3) ONE KNOB (from champion iter-8): train_n 800 -> 1600, with pretrain_epochs 60 -> 30 so 1600x30 = 48000 grad steps = SAME compute (epoch cut is pure compute-normalization). All else = iter-8 (k1,a0.0,c16,lr1e-3,val200). (4) HYPOTHESIS: if I double scene diversity again at fixed compute, I expect hr above 0.8842 (continuing the 0.8741->0.8842 diversity slope) because the breast-phantom distribution is still under-covered at 800 scenes. FALSIFIER: if hr<=0.8842, diversity saturates around 800-1600 scenes at fixed 48000 steps -> the ceiling shifts to COMPUTE (more total grad steps) or CAPACITY -> iter-10 raises total steps (more epochs at the best train_n, budget permitting) or width. (5) BUDGET: 48000 grad steps = iter-8s ~890s (turbo) < 20 min; each epoch now touches 1600 scenes but only 30 epochs. train_n=1600 <= 2400 FBP-safe cap. (6) Loop to iter-20.", "run_id": "breast-ct-claude-agentic-itnet-search-20260703-01", "runtime": {"elapsed_s": 907.7412624359131}, "schema_version": 3, "solver_key": "itnet", "solver_name": "ITNet v1", "split": {"train_n": 400, "val_n": 200}, "status": "keep", "ts": "2026-07-04T10:26:26Z"}
