{"advice_for_others": "dual_domain_supervised-claude-agentic: unet_c=16, epochs=44, batch_size=1, lr=0.001, optimizer=adam, lambda_neg=0.03, grad_clip=1.0, train_n=400, val_n=200, val_chunk=10, seed=47, rationale=iter-18 dual_domain_supervised, re-split Breast-CT val=200. SIX-BOX at BEST config (c16/ep44/lr1e-3/lneg0.03/bs1/tn400). (1) PRIOR: 5 seed replicates -- 42=0.8915,43=0.8589,44=0.8317,45=0.8866,46=0.8844 -> mean~0.871 sstd~0.024. seed44 (0.8317) is a low-tail outlier; the other 4 cluster ~0.86-0.89. Seed variance remains the dominant effect over the iters1-13 knob deltas. (2) Failure mode: single-seed(=42) sweep noise-confounded; want n>=6 for a stable mean+-std. (3) ONE KNOB: seed 47 (6th replicate). (4) HYPOTHESIS: n=6 keeps mean ~0.87+-0.024; honest config number is this mean not the 0.8915 peak. (5) BUDGET: ~941s. (6) Loop to iter-20; iters 18-20 = replicates 6-8. Artifacts saved.", "agent": "dual_domain_supervised-claude-agentic", "campaign": "search-20260703-01", "cfg_full": {"batch_size": 1, "epochs": 44, "grad_clip": 1.0, "lambda_neg": 0.03, "lr": 0.001, "optimizer": "adam", "rationale": "iter-18 dual_domain_supervised, re-split Breast-CT val=200. SIX-BOX at BEST config (c16/ep44/lr1e-3/lneg0.03/bs1/tn400). (1) PRIOR: 5 seed replicates -- 42=0.8915,43=0.8589,44=0.8317,45=0.8866,46=0.8844 -> mean~0.871 sstd~0.024. seed44 (0.8317) is a low-tail outlier; the other 4 cluster ~0.86-0.89. Seed variance remains the dominant effect over the iters1-13 knob deltas. (2) Failure mode: single-seed(=42) sweep noise-confounded; want n>=6 for a stable mean+-std. (3) ONE KNOB: seed 47 (6th replicate). (4) HYPOTHESIS: n=6 keeps mean ~0.87+-0.024; honest config number is this mean not the 0.8915 peak. (5) BUDGET: ~941s. (6) Loop to iter-20; iters 18-20 = replicates 6-8. Artifacts saved.", "seed": 47, "train_n": 400, "unet_c": 16, "val_chunk": 10, "val_n": 200}, "challenge": "breast_ct", "change_class": "architecture", "git_commit": "671da566", "images": {"comparison": "runs/breast-ct-claude-agentic-dual-domain-supervised-search-20260703-01/iterations/iter-0018/comparison.png", "test_showcase": null, "valtest_showcase": null}, "iter": 18, "kept": true, "metrics": {"headroom": 0.7672160274859168, "headroom_std": 0.010831363061342464, "val_psnr": 48.985137939453125, "val_psnr_std": 0.8981169753616228, "val_rmse": 0.0012138016754761338, "val_rmse_std": 0.00012438779584481277, "val_ssim": 0.99565190076828, "val_ssim_std": 0.0010364995448394533}, "model": "claude-opus-4-8-1m", "obs_path": "breast-ct-claude-agentic-dual-domain-supervised-search-20260703-01/iterations/iter-0018/observation.json", "obs_sha1": "bf25d542084ddcffd479a834983c11f31a1f81f9", "params_M": 0.465762, "params_source": "observation", "rationale": "dual_domain_supervised-claude-agentic: unet_c=16, epochs=44, batch_size=1, lr=0.001, optimizer=adam, lambda_neg=0.03, grad_clip=1.0, train_n=400, val_n=200, val_chunk=10, seed=47, rationale=iter-18 dual_domain_supervised, re-split Breast-CT val=200. SIX-BOX at BEST config (c16/ep44/lr1e-3/lneg0.03/bs1/tn400). (1) PRIOR: 5 seed replicates -- 42=0.8915,43=0.8589,44=0.8317,45=0.8866,46=0.8844 -> mean~0.871 sstd~0.024. seed44 (0.8317) is a low-tail outlier; the other 4 cluster ~0.86-0.89. Seed variance remains the dominant effect over the iters1-13 knob deltas. (2) Failure mode: single-seed(=42) sweep noise-confounded; want n>=6 for a stable mean+-std. (3) ONE KNOB: seed 47 (6th replicate). (4) HYPOTHESIS: n=6 keeps mean ~0.87+-0.024; honest config number is this mean not the 0.8915 peak. (5) BUDGET: ~941s. (6) Loop to iter-20; iters 18-20 = replicates 6-8. Artifacts saved.", "run_id": "breast-ct-claude-agentic-dual-domain-supervised-search-20260703-01", "runtime": {"elapsed_s": 831.5143945217133}, "schema_version": 3, "solver_key": "dual-domain-supervised", "solver_name": "DD-UNet supervised L2", "split": {"train_n": 400, "val_n": 200}, "status": "keep", "ts": "2026-07-04T21:24:37Z"}
{"advice_for_others": "dual_domain_supervised-claude-agentic: unet_c=16, epochs=44, batch_size=1, lr=0.001, optimizer=adam, lambda_neg=0.03, grad_clip=1.0, train_n=400, val_n=200, val_chunk=10, seed=48, rationale=iter-19 dual_domain_supervised, re-split Breast-CT val=200. SIX-BOX at BEST config (c16/ep44/lr1e-3/lneg0.03/bs1/tn400). (1) PRIOR: 6 seed replicates -- 42=0.8915,43=0.8589,44=0.8317,45=0.8866,46=0.8844,47=0.7672 -> mean~0.850 sstd~0.047, spread 0.124. Seed variance is VERY large and dominant; 0.8915 (seed42) is an upper-tail outlier and 0.7672 (seed47) a low-tail one. (2) Failure mode: single-seed(=42) sweep was noise-confounded -- the iters1-13 knob deltas (~0.88-0.89) sit well within this +-0.05 band, so few are statistically distinguishable. (3) ONE KNOB: seed 48 (7th replicate). (4) HYPOTHESIS: n=7 keeps mean ~0.85+-0.045; honest config number is this mean, NOT the seed-42 peak; the primary reportable finding is the large seed variance itself. (5) BUDGET: ~941s. (6) iter-20 = final (8th) replicate. Artifacts saved.", "agent": "dual_domain_supervised-claude-agentic", "campaign": "search-20260703-01", "cfg_full": {"batch_size": 1, "epochs": 44, "grad_clip": 1.0, "lambda_neg": 0.03, "lr": 0.001, "optimizer": "adam", "rationale": "iter-19 dual_domain_supervised, re-split Breast-CT val=200. SIX-BOX at BEST config (c16/ep44/lr1e-3/lneg0.03/bs1/tn400). (1) PRIOR: 6 seed replicates -- 42=0.8915,43=0.8589,44=0.8317,45=0.8866,46=0.8844,47=0.7672 -> mean~0.850 sstd~0.047, spread 0.124. Seed variance is VERY large and dominant; 0.8915 (seed42) is an upper-tail outlier and 0.7672 (seed47) a low-tail one. (2) Failure mode: single-seed(=42) sweep was noise-confounded -- the iters1-13 knob deltas (~0.88-0.89) sit well within this +-0.05 band, so few are statistically distinguishable. (3) ONE KNOB: seed 48 (7th replicate). (4) HYPOTHESIS: n=7 keeps mean ~0.85+-0.045; honest config number is this mean, NOT the seed-42 peak; the primary reportable finding is the large seed variance itself. (5) BUDGET: ~941s. (6) iter-20 = final (8th) replicate. Artifacts saved.", "seed": 48, "train_n": 400, "unet_c": 16, "val_chunk": 10, "val_n": 200}, "challenge": "breast_ct", "change_class": "architecture", "git_commit": "671da566", "images": {"comparison": "runs/breast-ct-claude-agentic-dual-domain-supervised-search-20260703-01/iterations/iter-0019/comparison.png", "test_showcase": null, "valtest_showcase": null}, "iter": 19, "kept": true, "metrics": {"headroom": 0.8924881061449925, "headroom_std": 0.012165758389167815, "val_psnr": 55.695068359375, "val_psnr_std": 1.5659375509492137, "val_rmse": 0.0005605975165963173, "val_rmse_std": 9.723310102983872e-05, "val_ssim": 0.9991475939750671, "val_ssim_std": 0.00029780688131551564}, "model": "claude-opus-4-8-1m", "obs_path": "breast-ct-claude-agentic-dual-domain-supervised-search-20260703-01/iterations/iter-0019/observation.json", "obs_sha1": "bae1e19085b13b827074429decbc49585f4f7f62", "params_M": 0.465762, "params_source": "observation", "rationale": "dual_domain_supervised-claude-agentic: unet_c=16, epochs=44, batch_size=1, lr=0.001, optimizer=adam, lambda_neg=0.03, grad_clip=1.0, train_n=400, val_n=200, val_chunk=10, seed=48, rationale=iter-19 dual_domain_supervised, re-split Breast-CT val=200. SIX-BOX at BEST config (c16/ep44/lr1e-3/lneg0.03/bs1/tn400). (1) PRIOR: 6 seed replicates -- 42=0.8915,43=0.8589,44=0.8317,45=0.8866,46=0.8844,47=0.7672 -> mean~0.850 sstd~0.047, spread 0.124. Seed variance is VERY large and dominant; 0.8915 (seed42) is an upper-tail outlier and 0.7672 (seed47) a low-tail one. (2) Failure mode: single-seed(=42) sweep was noise-confounded -- the iters1-13 knob deltas (~0.88-0.89) sit well within this +-0.05 band, so few are statistically distinguishable. (3) ONE KNOB: seed 48 (7th replicate). (4) HYPOTHESIS: n=7 keeps mean ~0.85+-0.045; honest config number is this mean, NOT the seed-42 peak; the primary reportable finding is the large seed variance itself. (5) BUDGET: ~941s. (6) iter-20 = final (8th) replicate. Artifacts saved.", "run_id": "breast-ct-claude-agentic-dual-domain-supervised-search-20260703-01", "runtime": {"elapsed_s": 782.4619495868683}, "schema_version": 3, "solver_key": "dual-domain-supervised", "solver_name": "DD-UNet supervised L2", "split": {"train_n": 400, "val_n": 200}, "status": "keep", "ts": "2026-07-04T22:22:48Z"}
{"advice_for_others": "dual_domain_supervised-claude-agentic: unet_c=16, epochs=44, batch_size=1, lr=0.001, optimizer=adam, lambda_neg=0.03, grad_clip=1.0, train_n=400, val_n=200, val_chunk=10, seed=49, rationale=iter-20 (FINAL) dual_domain_supervised, re-split Breast-CT val=200. SIX-BOX at BEST config (c16/ep44/lr1e-3/lneg0.03/bs1/tn400). (1) PRIOR: 7 seed replicates -- 42=0.8915,43=0.8589,44=0.8317,45=0.8866,46=0.8844,47=0.7672,48=0.8925 -> mean~0.862 sstd~0.043, spread 0.125. Seed variance is the DOMINANT effect; the seed-42 0.8915 that led the earlier sweep is an upper-tail draw (5 of 7 seeds cluster 0.86-0.89, one low outlier 0.767). (2) Failure mode: the single-seed(=42) knob sweep (iters1-13) was noise-confounded -- lr/lambda_neg deltas (~0.005-0.02) sit inside this +-0.04 seed band, so most are not statistically distinguishable from noise; epochs (10->44, +0.08) and the initial onboarding (clearing FBP) are the only effects clearly ABOVE the noise floor. (3) ONE KNOB: seed 49 (final 8th replicate). (4) HYPOTHESIS: n=8 gives the honest reportable config number ~0.86+-0.04, closing the run; the primary finding is the mean+-std characterization, not the 0.8915 peak. (5) BUDGET: ~941s, inside 20-min. (6) FINAL iter of the 20-iter search. Artifacts saved.", "agent": "dual_domain_supervised-claude-agentic", "campaign": "search-20260703-01", "cfg_full": {"batch_size": 1, "epochs": 44, "grad_clip": 1.0, "lambda_neg": 0.03, "lr": 0.001, "optimizer": "adam", "rationale": "iter-20 (FINAL) dual_domain_supervised, re-split Breast-CT val=200. SIX-BOX at BEST config (c16/ep44/lr1e-3/lneg0.03/bs1/tn400). (1) PRIOR: 7 seed replicates -- 42=0.8915,43=0.8589,44=0.8317,45=0.8866,46=0.8844,47=0.7672,48=0.8925 -> mean~0.862 sstd~0.043, spread 0.125. Seed variance is the DOMINANT effect; the seed-42 0.8915 that led the earlier sweep is an upper-tail draw (5 of 7 seeds cluster 0.86-0.89, one low outlier 0.767). (2) Failure mode: the single-seed(=42) knob sweep (iters1-13) was noise-confounded -- lr/lambda_neg deltas (~0.005-0.02) sit inside this +-0.04 seed band, so most are not statistically distinguishable from noise; epochs (10->44, +0.08) and the initial onboarding (clearing FBP) are the only effects clearly ABOVE the noise floor. (3) ONE KNOB: seed 49 (final 8th replicate). (4) HYPOTHESIS: n=8 gives the honest reportable config number ~0.86+-0.04, closing the run; the primary finding is the mean+-std characterization, not the 0.8915 peak. (5) BUDGET: ~941s, inside 20-min. (6) FINAL iter of the 20-iter search. Artifacts saved.", "seed": 49, "train_n": 400, "unet_c": 16, "val_chunk": 10, "val_n": 200}, "challenge": "breast_ct", "change_class": "architecture", "git_commit": "671da566", "images": {"comparison": "runs/breast-ct-claude-agentic-dual-domain-supervised-search-20260703-01/iterations/iter-0020/comparison.png", "test_showcase": null, "valtest_showcase": null}, "iter": 20, "kept": true, "metrics": {"headroom": 0.8899520579831962, "headroom_std": 0.012538710428009083, "val_psnr": 55.492557525634766, "val_psnr_std": 1.5847427814316721, "val_rmse": 0.0005738211912102997, "val_rmse_std": 9.981202318954891e-05, "val_ssim": 0.9991158843040466, "val_ssim_std": 0.000304776404162023}, "model": "claude-opus-4-8-1m", "obs_path": "breast-ct-claude-agentic-dual-domain-supervised-search-20260703-01/iterations/iter-0020/observation.json", "obs_sha1": "413f7275e681a8ad2ced54ac9ec7ace7e10572d2", "params_M": 0.465762, "params_source": "observation", "rationale": "dual_domain_supervised-claude-agentic: unet_c=16, epochs=44, batch_size=1, lr=0.001, optimizer=adam, lambda_neg=0.03, grad_clip=1.0, train_n=400, val_n=200, val_chunk=10, seed=49, rationale=iter-20 (FINAL) dual_domain_supervised, re-split Breast-CT val=200. SIX-BOX at BEST config (c16/ep44/lr1e-3/lneg0.03/bs1/tn400). (1) PRIOR: 7 seed replicates -- 42=0.8915,43=0.8589,44=0.8317,45=0.8866,46=0.8844,47=0.7672,48=0.8925 -> mean~0.862 sstd~0.043, spread 0.125. Seed variance is the DOMINANT effect; the seed-42 0.8915 that led the earlier sweep is an upper-tail draw (5 of 7 seeds cluster 0.86-0.89, one low outlier 0.767). (2) Failure mode: the single-seed(=42) knob sweep (iters1-13) was noise-confounded -- lr/lambda_neg deltas (~0.005-0.02) sit inside this +-0.04 seed band, so most are not statistically distinguishable from noise; epochs (10->44, +0.08) and the initial onboarding (clearing FBP) are the only effects clearly ABOVE the noise floor. (3) ONE KNOB: seed 49 (final 8th replicate). (4) HYPOTHESIS: n=8 gives the honest reportable config number ~0.86+-0.04, closing the run; the primary finding is the mean+-std characterization, not the 0.8915 peak. (5) BUDGET: ~941s, inside 20-min. (6) FINAL iter of the 20-iter search. Artifacts saved.", "run_id": "breast-ct-claude-agentic-dual-domain-supervised-search-20260703-01", "runtime": {"elapsed_s": 781.9954612255096}, "schema_version": 3, "solver_key": "dual-domain-supervised", "solver_name": "DD-UNet supervised L2", "split": {"train_n": 400, "val_n": 200}, "status": "keep", "ts": "2026-07-04T23:22:48Z"}
{"advice_for_others": "fastdiff_flow_pixel_constrained-claude-agentic: image_size=512, pixel_spacing=0.3516, n_angles=128, n_det=1024, det_spacing=0.35754, sod=500.0, sdd=1000.0, display_min=0.0, display_max=0.5, train_n=400, val_n=200, noise_i0=100000.0, noise_sigma_e=10.0, seed=42, dataset_kind=breast_ct, fd_recon_ckpt=/cluster/maier/Agent4CT/checkpoints/fast_diffusion_pixel_breast.pt, fd_recon_steps=8, fd_recon_init=fbp, fd_recon_init_t=0.7, fd_recon_eta=1.0, fd_recon_dc=1, fd_recon_dc_n_cg=5, fd_recon_dc_relax=0.5, rationale=iter-1 BREAST-NATIVE PRIOR SANITY (corrected re-run overwriting the hr=0 Mayo-prior run). fastdiff_flow_pixel_constrained, DC ON (fd_recon_dc=1). Prior swapped: Mayo fast_diffusion_pixel_constrained.pt (out_scale 0.05) -> breast-native fast_diffusion_pixel_breast.pt (out_scale 0.5, n_train 3600, val-loss 0.0047, pixel/ch64). dataset_kind=breast_ct (128-view 512^2 breast geometry+FOV). Canonical fast_recon constrained defaults steps8/init_t0.7/eta1.0/dc1/n_cg5/relax0.5. GOAL: does the breast-native prior lift pixel-DC-on above the 128-view FBP baseline (hr>0)? The old run scored hr=0 because the Mayo prior (out_scale 0.05, ~10x mu mismatch) degraded the strong breast FBP; a matched-scale breast prior should denoise rather than repaint. If hr>0 here, prior-mismatch was the cause; if still 0, architectural/regime ceiling.", "agent": "fastdiff_flow_pixel_constrained-claude-agentic", "campaign": "search-20260703-01", "cfg_full": {"dataset_kind": "breast_ct", "det_spacing": 0.35754, "display_max": 0.5, "display_min": 0.0, "fd_recon_ckpt": "/cluster/maier/Agent4CT/checkpoints/fast_diffusion_pixel_breast.pt", "fd_recon_dc": 1, "fd_recon_dc_n_cg": 5, "fd_recon_dc_relax": 0.5, "fd_recon_eta": 1.0, "fd_recon_init": "fbp", "fd_recon_init_t": 0.7, "fd_recon_steps": 8, "image_size": 512, "n_angles": 128, "n_det": 1024, "noise_i0": 100000.0, "noise_sigma_e": 10.0, "pixel_spacing": 0.3516, "rationale": "iter-1 BREAST-NATIVE PRIOR SANITY (corrected re-run overwriting the hr=0 Mayo-prior run). fastdiff_flow_pixel_constrained, DC ON (fd_recon_dc=1). Prior swapped: Mayo fast_diffusion_pixel_constrained.pt (out_scale 0.05) -> breast-native fast_diffusion_pixel_breast.pt (out_scale 0.5, n_train 3600, val-loss 0.0047, pixel/ch64). dataset_kind=breast_ct (128-view 512^2 breast geometry+FOV). Canonical fast_recon constrained defaults steps8/init_t0.7/eta1.0/dc1/n_cg5/relax0.5. GOAL: does the breast-native prior lift pixel-DC-on above the 128-view FBP baseline (hr>0)? The old run scored hr=0 because the Mayo prior (out_scale 0.05, ~10x mu mismatch) degraded the strong breast FBP; a matched-scale breast prior should denoise rather than repaint. If hr>0 here, prior-mismatch was the cause; if still 0, architectural/regime ceiling.", "sdd": 1000.0, "seed": 42, "sod": 500.0, "train_n": 400, "val_n": 200}, "challenge": "breast_ct", "change_class": "architecture", "git_commit": "671da566", "images": {"comparison": "runs/breast-ct-claude-agentic-fastdiff-flow-pixel-constrained-search-20260703-01/iterations/iter-0001/comparison.png", "test_showcase": null, "valtest_showcase": null}, "iter": 1, "kept": false, "metrics": {"headroom": 0.0, "headroom_std": 0.0, "val_psnr": 18.045860290527344, "val_psnr_std": 0.8194941747819228, "val_rmse": 0.04276726022362709, "val_rmse_std": 0.003893202113140722, "val_ssim": 0.42688921093940735, "val_ssim_std": 0.011595386408032067}, "model": "claude-opus-4-8-1m", "obs_path": "breast-ct-claude-agentic-fastdiff-flow-pixel-constrained-search-20260703-01/iterations/iter-0001/observation.json", "obs_sha1": "f62166bded64fe49d1320373806c2b4b98c415b8", "params_M": 3.822787, "params_source": "observation", "rationale": "fastdiff_flow_pixel_constrained-claude-agentic: image_size=512, pixel_spacing=0.3516, n_angles=128, n_det=1024, det_spacing=0.35754, sod=500.0, sdd=1000.0, display_min=0.0, display_max=0.5, train_n=400, val_n=200, noise_i0=100000.0, noise_sigma_e=10.0, seed=42, dataset_kind=breast_ct, fd_recon_ckpt=/cluster/maier/Agent4CT/checkpoints/fast_diffusion_pixel_breast.pt, fd_recon_steps=8, fd_recon_init=fbp, fd_recon_init_t=0.7, fd_recon_eta=1.0, fd_recon_dc=1, fd_recon_dc_n_cg=5, fd_recon_dc_relax=0.5, rationale=iter-1 BREAST-NATIVE PRIOR SANITY (corrected re-run overwriting the hr=0 Mayo-prior run). fastdiff_flow_pixel_constrained, DC ON (fd_recon_dc=1). Prior swapped: Mayo fast_diffusion_pixel_constrained.pt (out_scale 0.05) -> breast-native fast_diffusion_pixel_breast.pt (out_scale 0.5, n_train 3600, val-loss 0.0047, pixel/ch64). dataset_kind=breast_ct (128-view 512^2 breast geometry+FOV). Canonical fast_recon constrained defaults steps8/init_t0.7/eta1.0/dc1/n_cg5/relax0.5. GOAL: does the breast-native prior lift pixel-DC-on above the 128-view FBP baseline (hr>0)? The old run scored hr=0 because the Mayo prior (out_scale 0.05, ~10x mu mismatch) degraded the strong breast FBP; a matched-scale breast prior should denoise rather than repaint. If hr>0 here, prior-mismatch was the cause; if still 0, architectural/regime ceiling.", "run_id": "breast-ct-claude-agentic-fastdiff-flow-pixel-constrained-search-20260703-01", "runtime": {"elapsed_s": 190.43588304519653}, "schema_version": 3, "solver_key": "fastdiff-flow-pixel-constrained", "solver_name": "Fast-diffusion flow (pixel, constrained DC)", "split": {"train_n": 400, "val_n": 200}, "status": "discard", "ts": "2026-07-06T20:21:22Z"}
