{"advice_for_others": "param_efficient-claude-agentic: reg_type=bilateral, bilateral_on_top=False, proj_filter_on=False, n_iter=30, learnable_alpha=True, alpha_init=0.1, foe_n_filters=24, foe_kernel=7, foe_n_bumps=31, n_bf=1, bf_multiscale=True, bf_sigmas=[0.8, 1.6, 3.2], bf_kernel=7, bf_sigma_r=0.02, bf_gain_init=0.0, epochs=16, cosine_lr=True, lr=0.005, max_train_s=1080, batch_size=4, train_n=200, val_n=200, display_min=0.0, display_max=0.05, seed=42, rationale=iter-26 param_efficient breast -- CG-DC budget-fitted (n_cg 5->2). SIX-BOX: (1) PRIOR: iter-25 CG-DC n_cg=5 gave hr 0.2362 but was EPOCH-STARVED -- only 3/16 epochs (vs champion filtered-DC's ~6-16), loss STILL DESCENDING at cutoff (1.07e-3->2.5e-5->1.84e-5 dropping ep2->3). Not a genuine null; 5 CG iters ~ 10x projector calls halved epochs. (2) FAILURE MODE: CG cost too high to train in the 20-min wall. (3) ONE KNOB: cg_n 5->2 (a LIGHTLY-solved CG-DC, ~2.5x the projector calls of filtered-DC instead of ~10x) so it trains a COMPARABLE number of epochs to the champion. Still a stronger DC than one filtered gradient. All else byte-for-byte iter-25 (K=30, LPD W=4, seed42). (4) HYPOTHESIS: at n_cg=2 the run reaches ~6-8 epochs (comparable to the champion) and a lightly-solved CG-DC -- if CG's extra consistency-completeness is worth anything per projector-call -- beats the filtered-DC champion 0.5047. If a budget-fitted CG-DC STILL underperforms filtered-DC, that's a CLEAN FINDING: the single filtered gradient + LPD-combine is already near-optimal per projector-call and CG's extra completeness isn't worth the epochs it costs under a fixed wall. (5) BUDGET: n_cg=2 x K=30 = 2 fwd+back pairs/step x30; expect ~6-8 epochs; train_n=200, max_train_s=1080, --time=00:30:00, 200-val -> 20-min comparable. (6) SERIAL; iter-27: if CG-DC helps, tune cg_n/lam/K; else record the finding and continue the menu (multi-scale bilateral POST-filter, learned per-step DC schedule, 2-step LPD)., dc_mode=cg, per_step_alpha=True, lpd_on=True, lpd_width=4, lpd_kernel=3, anisotropic_on_top=False, cg_n=2, cg_lam_init=0.01", "agent": "param_efficient-claude-agentic", "campaign": "search-20260703-01", "cfg_full": {"alpha_init": 0.1, "anisotropic_on_top": false, "batch_size": 4, "bf_gain_init": 0.0, "bf_kernel": 7, "bf_multiscale": true, "bf_sigma_r": 0.02, "bf_sigmas": [0.8, 1.6, 3.2], "bilateral_on_top": false, "cg_lam_init": 0.01, "cg_n": 2, "cosine_lr": true, "dc_mode": "cg", "display_max": 0.05, "display_min": 0.0, "epochs": 16, "foe_kernel": 7, "foe_n_bumps": 31, "foe_n_filters": 24, "learnable_alpha": true, "lpd_kernel": 3, "lpd_on": true, "lpd_width": 4, "lr": 0.005, "max_train_s": 1080, "n_bf": 1, "n_iter": 30, "per_step_alpha": true, "proj_filter_on": false, "rationale": "iter-26 param_efficient breast -- CG-DC budget-fitted (n_cg 5->2). SIX-BOX: (1) PRIOR: iter-25 CG-DC n_cg=5 gave hr 0.2362 but was EPOCH-STARVED -- only 3/16 epochs (vs champion filtered-DC's ~6-16), loss STILL DESCENDING at cutoff (1.07e-3->2.5e-5->1.84e-5 dropping ep2->3). Not a genuine null; 5 CG iters ~ 10x projector calls halved epochs. (2) FAILURE MODE: CG cost too high to train in the 20-min wall. (3) ONE KNOB: cg_n 5->2 (a LIGHTLY-solved CG-DC, ~2.5x the projector calls of filtered-DC instead of ~10x) so it trains a COMPARABLE number of epochs to the champion. Still a stronger DC than one filtered gradient. All else byte-for-byte iter-25 (K=30, LPD W=4, seed42). (4) HYPOTHESIS: at n_cg=2 the run reaches ~6-8 epochs (comparable to the champion) and a lightly-solved CG-DC -- if CG's extra consistency-completeness is worth anything per projector-call -- beats the filtered-DC champion 0.5047. If a budget-fitted CG-DC STILL underperforms filtered-DC, that's a CLEAN FINDING: the single filtered gradient + LPD-combine is already near-optimal per projector-call and CG's extra completeness isn't worth the epochs it costs under a fixed wall. (5) BUDGET: n_cg=2 x K=30 = 2 fwd+back pairs/step x30; expect ~6-8 epochs; train_n=200, max_train_s=1080, --time=00:30:00, 200-val -> 20-min comparable. (6) SERIAL; iter-27: if CG-DC helps, tune cg_n/lam/K; else record the finding and continue the menu (multi-scale bilateral POST-filter, learned per-step DC schedule, 2-step LPD).", "reg_type": "bilateral", "seed": 42, "train_n": 200, "val_n": 200}, "challenge": "breast_ct", "change_class": "architecture", "git_commit": "671da566", "images": {"comparison": "runs/breast-ct-claude-agentic-param-efficient-search-20260703-01/iterations/iter-0026/comparison.png", "test_showcase": null, "valtest_showcase": null}, "iter": 26, "kept": true, "metrics": {"headroom": 0.24268250960095072, "headroom_std": 0.017479015987805185, "val_psnr": 38.73863983154297, "val_psnr_std": 0.40480249430824355, "val_rmse": 0.003948868252336979, "val_rmse_std": 0.00017485010533522025, "val_ssim": 0.9634141325950623, "val_ssim_std": 0.004146947596429576}, "model": "claude-opus-4-8-1m", "obs_path": "breast-ct-claude-agentic-param-efficient-search-20260703-01/iterations/iter-0026/observation.json", "obs_sha1": "d0eed2e1a4e645ae7b48d495548ebef2c0f4ceab", "params_M": 0.000184, "params_source": "observation", "rationale": "param_efficient-claude-agentic: reg_type=bilateral, bilateral_on_top=False, proj_filter_on=False, n_iter=30, learnable_alpha=True, alpha_init=0.1, foe_n_filters=24, foe_kernel=7, foe_n_bumps=31, n_bf=1, bf_multiscale=True, bf_sigmas=[0.8, 1.6, 3.2], bf_kernel=7, bf_sigma_r=0.02, bf_gain_init=0.0, epochs=16, cosine_lr=True, lr=0.005, max_train_s=1080, batch_size=4, train_n=200, val_n=200, display_min=0.0, display_max=0.05, seed=42, rationale=iter-26 param_efficient breast -- CG-DC budget-fitted (n_cg 5->2). SIX-BOX: (1) PRIOR: iter-25 CG-DC n_cg=5 gave hr 0.2362 but was EPOCH-STARVED -- only 3/16 epochs (vs champion filtered-DC's ~6-16), loss STILL DESCENDING at cutoff (1.07e-3->2.5e-5->1.84e-5 dropping ep2->3). Not a genuine null; 5 CG iters ~ 10x projector calls halved epochs. (2) FAILURE MODE: CG cost too high to train in the 20-min wall. (3) ONE KNOB: cg_n 5->2 (a LIGHTLY-solved CG-DC, ~2.5x the projector calls of filtered-DC instead of ~10x) so it trains a COMPARABLE number of epochs to the champion. Still a stronger DC than one filtered gradient. All else byte-for-byte iter-25 (K=30, LPD W=4, seed42). (4) HYPOTHESIS: at n_cg=2 the run reaches ~6-8 epochs (comparable to the champion) and a lightly-solved CG-DC -- if CG's extra consistency-completeness is worth anything per projector-call -- beats the filtered-DC champion 0.5047. If a budget-fitted CG-DC STILL underperforms filtered-DC, that's a CLEAN FINDING: the single filtered gradient + LPD-combine is already near-optimal per projector-call and CG's extra completeness isn't worth the epochs it costs under a fixed wall. (5) BUDGET: n_cg=2 x K=30 = 2 fwd+back pairs/step x30; expect ~6-8 epochs; train_n=200, max_train_s=1080, --time=00:30:00, 200-val -> 20-min comparable. (6) SERIAL; iter-27: if CG-DC helps, tune cg_n/lam/K; else record the finding and continue the menu (multi-scale bilateral POST-filter, learned per-step DC schedule, 2-step LPD)., dc_mode=cg, per_step_alpha=True, lpd_on=True, lpd_width=4, lpd_kernel=3, anisotropic_on_top=False, cg_n=2, cg_lam_init=0.01", "run_id": "breast-ct-claude-agentic-param-efficient-search-20260703-01", "runtime": {"elapsed_s": 1292.7993047237396}, "schema_version": 3, "solver_key": "param-efficient", "solver_name": "Param-efficient (evolved)", "split": {"train_n": 200, "val_n": 200}, "status": "keep", "ts": "2026-07-07T13:04:19Z"}
{"advice_for_others": "param_efficient-claude-agentic: reg_type=bilateral, bilateral_on_top=False, proj_filter_on=False, n_iter=30, learnable_alpha=True, alpha_init=0.1, foe_n_filters=24, foe_kernel=7, foe_n_bumps=31, n_bf=3, bf_multiscale=True, bf_sigmas=[0.8, 1.6, 3.2], bf_kernel=7, bf_sigma_r=0.02, bf_gain_init=0.0, epochs=16, cosine_lr=True, lr=0.005, max_train_s=1080, batch_size=4, train_n=200, val_n=200, display_min=0.0, display_max=0.05, seed=42, rationale=iter-27 param_efficient breast -- DIAGNOSTIC: CG-DC WITHOUT LPD-combine (isolate the mismatch). SIX-BOX: (1) PRIOR: CG-DC + LPD-combine gave 0.2362 (n_cg5) / 0.2427 (n_cg2, 5ep) -- far below filtered-DC+LPD 0.5047 AND below filtered-DC+bilateral 0.4345 (iter-11). iter-26 reached 5 epochs (not just starved), so the pattern = INTEGRATION MISMATCH: the CG least-squares solution doesn't compose with the LPD-combine, which learned to route the SINGLE filtered-gradient correction. (2) FAILURE MODE (to isolate): is CG-DC bad vs filtered-DC in general, or only bad WITH the LPD-combine? (3) ONE KNOB: lpd_on True->False on the CG-DC config (raw CG-DC prox-grad unroll + 3-scale bilateral gate, the iter-11 structure but with dc_mode=cg instead of filtered). n_cg=2, K=30, seed42, ~15 params. (4) HYPOTHESIS: if raw CG-DC + bilateral reaches ~0.4345 (filtered-DC+bilateral's level), the problem is specifically CG-DC-vs-LPD-combine (CG doesn't compose with the learned router) -> filtered-gradient is the right DC for the LPD-combine. If raw CG-DC + bilateral ALSO underperforms filtered-DC+bilateral, then CG-DC is just worse per-projector-call under the wall regardless of the combiner. Either way isolates the finding. (5) BUDGET: n_cg=2 x K=30 + bilateral, train_n=200, max_train_s=1080, --time=00:30:00, 200-val -> 20-min comparable. (6) SERIAL; iter-28: CONCLUDE CG-DC, then continue menu (multi-scale bilateral POST-filter, learned per-step DC schedule, 2-step LPD)., dc_mode=cg, per_step_alpha=False, cg_n=2, cg_lam_init=0.01, lpd_on=False", "agent": "param_efficient-claude-agentic", "campaign": "search-20260703-01", "cfg_full": {"alpha_init": 0.1, "batch_size": 4, "bf_gain_init": 0.0, "bf_kernel": 7, "bf_multiscale": true, "bf_sigma_r": 0.02, "bf_sigmas": [0.8, 1.6, 3.2], "bilateral_on_top": false, "cg_lam_init": 0.01, "cg_n": 2, "cosine_lr": true, "dc_mode": "cg", "display_max": 0.05, "display_min": 0.0, "epochs": 16, "foe_kernel": 7, "foe_n_bumps": 31, "foe_n_filters": 24, "learnable_alpha": true, "lpd_on": false, "lr": 0.005, "max_train_s": 1080, "n_bf": 3, "n_iter": 30, "per_step_alpha": false, "proj_filter_on": false, "rationale": "iter-27 param_efficient breast -- DIAGNOSTIC: CG-DC WITHOUT LPD-combine (isolate the mismatch). SIX-BOX: (1) PRIOR: CG-DC + LPD-combine gave 0.2362 (n_cg5) / 0.2427 (n_cg2, 5ep) -- far below filtered-DC+LPD 0.5047 AND below filtered-DC+bilateral 0.4345 (iter-11). iter-26 reached 5 epochs (not just starved), so the pattern = INTEGRATION MISMATCH: the CG least-squares solution doesn't compose with the LPD-combine, which learned to route the SINGLE filtered-gradient correction. (2) FAILURE MODE (to isolate): is CG-DC bad vs filtered-DC in general, or only bad WITH the LPD-combine? (3) ONE KNOB: lpd_on True->False on the CG-DC config (raw CG-DC prox-grad unroll + 3-scale bilateral gate, the iter-11 structure but with dc_mode=cg instead of filtered). n_cg=2, K=30, seed42, ~15 params. (4) HYPOTHESIS: if raw CG-DC + bilateral reaches ~0.4345 (filtered-DC+bilateral's level), the problem is specifically CG-DC-vs-LPD-combine (CG doesn't compose with the learned router) -> filtered-gradient is the right DC for the LPD-combine. If raw CG-DC + bilateral ALSO underperforms filtered-DC+bilateral, then CG-DC is just worse per-projector-call under the wall regardless of the combiner. Either way isolates the finding. (5) BUDGET: n_cg=2 x K=30 + bilateral, train_n=200, max_train_s=1080, --time=00:30:00, 200-val -> 20-min comparable. (6) SERIAL; iter-28: CONCLUDE CG-DC, then continue menu (multi-scale bilateral POST-filter, learned per-step DC schedule, 2-step LPD).", "reg_type": "bilateral", "seed": 42, "train_n": 200, "val_n": 200}, "challenge": "breast_ct", "change_class": "architecture", "git_commit": "671da566", "images": {"comparison": "runs/breast-ct-claude-agentic-param-efficient-search-20260703-01/iterations/iter-0027/comparison.png", "test_showcase": null, "valtest_showcase": null}, "iter": 27, "kept": false, "metrics": {"headroom": 0.0, "headroom_std": 0.0, "val_psnr": 29.279449462890625, "val_psnr_std": 0.3113803823329991, "val_rmse": 0.011733618564903736, "val_rmse_std": 0.0003840957420572142, "val_ssim": 0.8458541035652161, "val_ssim_std": 0.009788942776624565}, "model": "claude-opus-4-8-1m", "obs_path": "breast-ct-claude-agentic-param-efficient-search-20260703-01/iterations/iter-0027/observation.json", "obs_sha1": "6e7b3e5651f535a3a6a18ed5d6a6ff0a6d05597c", "params_M": 1.4e-05, "params_source": "observation", "rationale": "param_efficient-claude-agentic: reg_type=bilateral, bilateral_on_top=False, proj_filter_on=False, n_iter=30, learnable_alpha=True, alpha_init=0.1, foe_n_filters=24, foe_kernel=7, foe_n_bumps=31, n_bf=3, bf_multiscale=True, bf_sigmas=[0.8, 1.6, 3.2], bf_kernel=7, bf_sigma_r=0.02, bf_gain_init=0.0, epochs=16, cosine_lr=True, lr=0.005, max_train_s=1080, batch_size=4, train_n=200, val_n=200, display_min=0.0, display_max=0.05, seed=42, rationale=iter-27 param_efficient breast -- DIAGNOSTIC: CG-DC WITHOUT LPD-combine (isolate the mismatch). SIX-BOX: (1) PRIOR: CG-DC + LPD-combine gave 0.2362 (n_cg5) / 0.2427 (n_cg2, 5ep) -- far below filtered-DC+LPD 0.5047 AND below filtered-DC+bilateral 0.4345 (iter-11). iter-26 reached 5 epochs (not just starved), so the pattern = INTEGRATION MISMATCH: the CG least-squares solution doesn't compose with the LPD-combine, which learned to route the SINGLE filtered-gradient correction. (2) FAILURE MODE (to isolate): is CG-DC bad vs filtered-DC in general, or only bad WITH the LPD-combine? (3) ONE KNOB: lpd_on True->False on the CG-DC config (raw CG-DC prox-grad unroll + 3-scale bilateral gate, the iter-11 structure but with dc_mode=cg instead of filtered). n_cg=2, K=30, seed42, ~15 params. (4) HYPOTHESIS: if raw CG-DC + bilateral reaches ~0.4345 (filtered-DC+bilateral's level), the problem is specifically CG-DC-vs-LPD-combine (CG doesn't compose with the learned router) -> filtered-gradient is the right DC for the LPD-combine. If raw CG-DC + bilateral ALSO underperforms filtered-DC+bilateral, then CG-DC is just worse per-projector-call under the wall regardless of the combiner. Either way isolates the finding. (5) BUDGET: n_cg=2 x K=30 + bilateral, train_n=200, max_train_s=1080, --time=00:30:00, 200-val -> 20-min comparable. (6) SERIAL; iter-28: CONCLUDE CG-DC, then continue menu (multi-scale bilateral POST-filter, learned per-step DC schedule, 2-step LPD)., dc_mode=cg, per_step_alpha=False, cg_n=2, cg_lam_init=0.01, lpd_on=False", "run_id": "breast-ct-claude-agentic-param-efficient-search-20260703-01", "runtime": {"elapsed_s": 1254.100587129593}, "schema_version": 3, "solver_key": "param-efficient", "solver_name": "Param-efficient (evolved)", "split": {"train_n": 200, "val_n": 200}, "status": "discard", "ts": "2026-07-07T15:46:45Z"}
