{"advice_for_others": "fastdiff_wdm_wavelet_constrained-claude-agentic: val_n=200, seed=42, fd_recon_ckpt=/cluster/maier/Agent4CT/checkpoints/fast_diffusion_wavelet_breast.pt, fd_recon_steps=8, fd_recon_init=fbp, fd_recon_init_t=0.7, fd_recon_eta=1.0, fd_recon_dc=1, fd_recon_dc_n_cg=5, fd_recon_dc_relax=1.0, dataset_kind=breast_ct, rationale=iter-2 DC-STRENGTH lever, breast-native wavelet CONSTRAINED, val=200. SIX-BOX: (1) PRIOR: iter-1 (breast prior, init_t0.7/dc_relax0.5) scored SSIM 0.326 / PSNR 17.1 / RMSE 4.75e-2 vs 128-view sparse-FBP baseline PSNR 36.3 / RMSE 5.21e-3 -> ~9x worse, hr=0, FAR below floor and much worse than the archived Mayo-prior iter-1 (SSIM 0.72). (2) FAILURE MODE: with the CORRECTLY-scaled breast prior (out_scale 0.5), embedding the FBP at init_t=0.7 injects a large amount of prior structure that the half-strength CG DC (relax=0.5) only half-corrects back onto the measured sparse sinogram -> the strong prior at high flow-time dominates and corrupts HU. The prior is now impactful (unlike the mis-scaled Mayo prior), so weak DC is decisively wrong. (3) ONE KNOB: fd_recon_dc_relax 0.5 -> 1.0 (full CG-projected-image blend), all else identical to iter-1. (4) HYPOTHESIS: at dc_relax=1.0 the recon leans fully on the CG solve of min||Ax-y||^2 onto the measured sinogram each step, so RMSE drops sharply toward the sparse-FBP floor (the archived Mayo-prior curve gained SSIM 0.72->0.82 on exactly this knob at iter-2, and dc_relax=1.0 was best throughout). FALSIFIER: if RMSE stays >>baseline, the high init_t is the dominant problem -> iter-3 lowers init_t to 0.4 (the archived best region). (5) BUDGET: iter-1 ran ~90s for 200 slices; dc_relax is free. (6) Loop continues; iter-3 self-dispatched on landing.", "agent": "fastdiff_wdm_wavelet_constrained-claude-agentic", "campaign": "search-20260703-01", "cfg_full": {"dataset_kind": "breast_ct", "fd_recon_ckpt": "/cluster/maier/Agent4CT/checkpoints/fast_diffusion_wavelet_breast.pt", "fd_recon_dc": 1, "fd_recon_dc_n_cg": 5, "fd_recon_dc_relax": 1.0, "fd_recon_eta": 1.0, "fd_recon_init": "fbp", "fd_recon_init_t": 0.7, "fd_recon_steps": 8, "rationale": "iter-2 DC-STRENGTH lever, breast-native wavelet CONSTRAINED, val=200. SIX-BOX: (1) PRIOR: iter-1 (breast prior, init_t0.7/dc_relax0.5) scored SSIM 0.326 / PSNR 17.1 / RMSE 4.75e-2 vs 128-view sparse-FBP baseline PSNR 36.3 / RMSE 5.21e-3 -> ~9x worse, hr=0, FAR below floor and much worse than the archived Mayo-prior iter-1 (SSIM 0.72). (2) FAILURE MODE: with the CORRECTLY-scaled breast prior (out_scale 0.5), embedding the FBP at init_t=0.7 injects a large amount of prior structure that the half-strength CG DC (relax=0.5) only half-corrects back onto the measured sparse sinogram -> the strong prior at high flow-time dominates and corrupts HU. The prior is now impactful (unlike the mis-scaled Mayo prior), so weak DC is decisively wrong. (3) ONE KNOB: fd_recon_dc_relax 0.5 -> 1.0 (full CG-projected-image blend), all else identical to iter-1. (4) HYPOTHESIS: at dc_relax=1.0 the recon leans fully on the CG solve of min||Ax-y||^2 onto the measured sinogram each step, so RMSE drops sharply toward the sparse-FBP floor (the archived Mayo-prior curve gained SSIM 0.72->0.82 on exactly this knob at iter-2, and dc_relax=1.0 was best throughout). FALSIFIER: if RMSE stays >>baseline, the high init_t is the dominant problem -> iter-3 lowers init_t to 0.4 (the archived best region). (5) BUDGET: iter-1 ran ~90s for 200 slices; dc_relax is free. (6) Loop continues; iter-3 self-dispatched on landing.", "seed": 42, "val_n": 200}, "challenge": "breast_ct", "change_class": "architecture", "git_commit": "671da566", "images": {"comparison": "runs/breast-ct-claude-agentic-fastdiff-wdm-wavelet-constrained-search-20260703-01/iterations/iter-0002/comparison.png", "test_showcase": null, "valtest_showcase": null}, "iter": 2, "kept": false, "metrics": {"headroom": 0.0, "headroom_std": 0.0, "val_psnr": 16.490530014038086, "val_psnr_std": 0.21361588839788886, "val_rmse": 0.05115380510687828, "val_rmse_std": 0.0008060389637048338, "val_ssim": 0.3539787232875824, "val_ssim_std": 0.006440563787432457}, "model": "claude-opus-4-8-1m", "obs_path": "breast-ct-claude-agentic-fastdiff-wdm-wavelet-constrained-search-20260703-01/iterations/iter-0002/observation.json", "obs_sha1": "d7184ea9dec0bd1e979ee0a58e9b9f7080c4b286", "params_M": 3.824908, "params_source": "observation", "rationale": "fastdiff_wdm_wavelet_constrained-claude-agentic: val_n=200, seed=42, fd_recon_ckpt=/cluster/maier/Agent4CT/checkpoints/fast_diffusion_wavelet_breast.pt, fd_recon_steps=8, fd_recon_init=fbp, fd_recon_init_t=0.7, fd_recon_eta=1.0, fd_recon_dc=1, fd_recon_dc_n_cg=5, fd_recon_dc_relax=1.0, dataset_kind=breast_ct, rationale=iter-2 DC-STRENGTH lever, breast-native wavelet CONSTRAINED, val=200. SIX-BOX: (1) PRIOR: iter-1 (breast prior, init_t0.7/dc_relax0.5) scored SSIM 0.326 / PSNR 17.1 / RMSE 4.75e-2 vs 128-view sparse-FBP baseline PSNR 36.3 / RMSE 5.21e-3 -> ~9x worse, hr=0, FAR below floor and much worse than the archived Mayo-prior iter-1 (SSIM 0.72). (2) FAILURE MODE: with the CORRECTLY-scaled breast prior (out_scale 0.5), embedding the FBP at init_t=0.7 injects a large amount of prior structure that the half-strength CG DC (relax=0.5) only half-corrects back onto the measured sparse sinogram -> the strong prior at high flow-time dominates and corrupts HU. The prior is now impactful (unlike the mis-scaled Mayo prior), so weak DC is decisively wrong. (3) ONE KNOB: fd_recon_dc_relax 0.5 -> 1.0 (full CG-projected-image blend), all else identical to iter-1. (4) HYPOTHESIS: at dc_relax=1.0 the recon leans fully on the CG solve of min||Ax-y||^2 onto the measured sinogram each step, so RMSE drops sharply toward the sparse-FBP floor (the archived Mayo-prior curve gained SSIM 0.72->0.82 on exactly this knob at iter-2, and dc_relax=1.0 was best throughout). FALSIFIER: if RMSE stays >>baseline, the high init_t is the dominant problem -> iter-3 lowers init_t to 0.4 (the archived best region). (5) BUDGET: iter-1 ran ~90s for 200 slices; dc_relax is free. (6) Loop continues; iter-3 self-dispatched on landing.", "run_id": "breast-ct-claude-agentic-fastdiff-wdm-wavelet-constrained-search-20260703-01", "runtime": {"elapsed_s": 101.31810855865479}, "schema_version": 3, "solver_key": "fastdiff-wdm-wavelet-constrained", "solver_name": "Fast-diffusion WDM (wavelet, constrained DC)", "split": {"train_n": 3600, "val_n": 200}, "status": "discard", "ts": "2026-07-06T20:30:21Z"}
{"advice_for_others": "fastdiff_wdm_wavelet_constrained-claude-agentic: val_n=200, seed=42, fd_recon_ckpt=/cluster/maier/Agent4CT/checkpoints/fast_diffusion_wavelet_breast.pt, fd_recon_steps=8, fd_recon_init=fbp, fd_recon_init_t=0.4, fd_recon_eta=1.0, fd_recon_dc=1, fd_recon_dc_n_cg=5, fd_recon_dc_relax=1.0, dataset_kind=breast_ct, rationale=iter-3 INIT_T lever, breast-native wavelet CONSTRAINED, val=200. SIX-BOX: (1) PRIOR: iter-1 (init_t0.7/relax0.5) SSIM 0.326/PSNR 17.1/RMSE 4.75e-2; iter-2 (init_t0.7/relax1.0) SSIM 0.354/PSNR 16.5/RMSE 5.12e-2 -- full DC did NOT rescue, both ~9x worse than baseline (PSNR 36.3/RMSE 5.21e-3), hr=0. (2) FAILURE MODE: init_t=0.7 embeds the FBP at high flow-time where most FBP structure is replaced by noise; 8 Euler steps of the 512^2 wavelet prior cannot rebuild breast detail from that, and even full CG DC can't fix a trajectory that started from mostly-noise. The dominant lever is init_t, not dc_relax (the archived Mayo-prior curve's big SSIM gains 0.82->0.91 came from lowering init_t 0.7->0.2). (3) ONE KNOB: fd_recon_init_t 0.7 -> 0.4 (embed FBP closer to clean, far less prior drift), keeping dc_relax=1.0 from iter-2. (4) HYPOTHESIS: at init_t=0.4 the FBP is embedded near-clean so the wavelet prior only lightly denoises the sparse-view streaks while full CG DC pins the measured rays -> RMSE drops sharply toward the sparse-FBP floor and may clear hr>0 (this is the archived best region). FALSIFIER: if still PSNR<<36, even light prior injection + DC can't beat the strong 128-view FBP baseline here -> iter-4 pushes init_t lower (0.2) and/or raises dc_n_cg. (5) BUDGET: ~90s/iter, init_t is free. (6) Loop continues; iter-4 self-dispatched on landing.", "agent": "fastdiff_wdm_wavelet_constrained-claude-agentic", "campaign": "search-20260703-01", "cfg_full": {"dataset_kind": "breast_ct", "fd_recon_ckpt": "/cluster/maier/Agent4CT/checkpoints/fast_diffusion_wavelet_breast.pt", "fd_recon_dc": 1, "fd_recon_dc_n_cg": 5, "fd_recon_dc_relax": 1.0, "fd_recon_eta": 1.0, "fd_recon_init": "fbp", "fd_recon_init_t": 0.4, "fd_recon_steps": 8, "rationale": "iter-3 INIT_T lever, breast-native wavelet CONSTRAINED, val=200. SIX-BOX: (1) PRIOR: iter-1 (init_t0.7/relax0.5) SSIM 0.326/PSNR 17.1/RMSE 4.75e-2; iter-2 (init_t0.7/relax1.0) SSIM 0.354/PSNR 16.5/RMSE 5.12e-2 -- full DC did NOT rescue, both ~9x worse than baseline (PSNR 36.3/RMSE 5.21e-3), hr=0. (2) FAILURE MODE: init_t=0.7 embeds the FBP at high flow-time where most FBP structure is replaced by noise; 8 Euler steps of the 512^2 wavelet prior cannot rebuild breast detail from that, and even full CG DC can't fix a trajectory that started from mostly-noise. The dominant lever is init_t, not dc_relax (the archived Mayo-prior curve's big SSIM gains 0.82->0.91 came from lowering init_t 0.7->0.2). (3) ONE KNOB: fd_recon_init_t 0.7 -> 0.4 (embed FBP closer to clean, far less prior drift), keeping dc_relax=1.0 from iter-2. (4) HYPOTHESIS: at init_t=0.4 the FBP is embedded near-clean so the wavelet prior only lightly denoises the sparse-view streaks while full CG DC pins the measured rays -> RMSE drops sharply toward the sparse-FBP floor and may clear hr>0 (this is the archived best region). FALSIFIER: if still PSNR<<36, even light prior injection + DC can't beat the strong 128-view FBP baseline here -> iter-4 pushes init_t lower (0.2) and/or raises dc_n_cg. (5) BUDGET: ~90s/iter, init_t is free. (6) Loop continues; iter-4 self-dispatched on landing.", "seed": 42, "val_n": 200}, "challenge": "breast_ct", "change_class": "architecture", "git_commit": "671da566", "images": {"comparison": "runs/breast-ct-claude-agentic-fastdiff-wdm-wavelet-constrained-search-20260703-01/iterations/iter-0003/comparison.png", "test_showcase": null, "valtest_showcase": null}, "iter": 3, "kept": false, "metrics": {"headroom": 0.0, "headroom_std": 0.0, "val_psnr": 19.387470245361328, "val_psnr_std": 0.5283908344907315, "val_rmse": 0.036646366119384766, "val_rmse_std": 0.002127206783526412, "val_ssim": 0.40248602628707886, "val_ssim_std": 0.011600333070052723}, "model": "claude-opus-4-8-1m", "obs_path": "breast-ct-claude-agentic-fastdiff-wdm-wavelet-constrained-search-20260703-01/iterations/iter-0003/observation.json", "obs_sha1": "768036247f7eb9f153f4df29a94c1b0b5a85b26a", "params_M": 3.824908, "params_source": "observation", "rationale": "fastdiff_wdm_wavelet_constrained-claude-agentic: val_n=200, seed=42, fd_recon_ckpt=/cluster/maier/Agent4CT/checkpoints/fast_diffusion_wavelet_breast.pt, fd_recon_steps=8, fd_recon_init=fbp, fd_recon_init_t=0.4, fd_recon_eta=1.0, fd_recon_dc=1, fd_recon_dc_n_cg=5, fd_recon_dc_relax=1.0, dataset_kind=breast_ct, rationale=iter-3 INIT_T lever, breast-native wavelet CONSTRAINED, val=200. SIX-BOX: (1) PRIOR: iter-1 (init_t0.7/relax0.5) SSIM 0.326/PSNR 17.1/RMSE 4.75e-2; iter-2 (init_t0.7/relax1.0) SSIM 0.354/PSNR 16.5/RMSE 5.12e-2 -- full DC did NOT rescue, both ~9x worse than baseline (PSNR 36.3/RMSE 5.21e-3), hr=0. (2) FAILURE MODE: init_t=0.7 embeds the FBP at high flow-time where most FBP structure is replaced by noise; 8 Euler steps of the 512^2 wavelet prior cannot rebuild breast detail from that, and even full CG DC can't fix a trajectory that started from mostly-noise. The dominant lever is init_t, not dc_relax (the archived Mayo-prior curve's big SSIM gains 0.82->0.91 came from lowering init_t 0.7->0.2). (3) ONE KNOB: fd_recon_init_t 0.7 -> 0.4 (embed FBP closer to clean, far less prior drift), keeping dc_relax=1.0 from iter-2. (4) HYPOTHESIS: at init_t=0.4 the FBP is embedded near-clean so the wavelet prior only lightly denoises the sparse-view streaks while full CG DC pins the measured rays -> RMSE drops sharply toward the sparse-FBP floor and may clear hr>0 (this is the archived best region). FALSIFIER: if still PSNR<<36, even light prior injection + DC can't beat the strong 128-view FBP baseline here -> iter-4 pushes init_t lower (0.2) and/or raises dc_n_cg. (5) BUDGET: ~90s/iter, init_t is free. (6) Loop continues; iter-4 self-dispatched on landing.", "run_id": "breast-ct-claude-agentic-fastdiff-wdm-wavelet-constrained-search-20260703-01", "runtime": {"elapsed_s": 99.1857500076294}, "schema_version": 3, "solver_key": "fastdiff-wdm-wavelet-constrained", "solver_name": "Fast-diffusion WDM (wavelet, constrained DC)", "split": {"train_n": 3600, "val_n": 200}, "status": "discard", "ts": "2026-07-06T20:40:04Z"}
{"advice_for_others": "fastdiff_wdm_wavelet_constrained-claude-agentic: val_n=200, seed=42, fd_recon_ckpt=/cluster/maier/Agent4CT/checkpoints/fast_diffusion_wavelet_breast.pt, fd_recon_steps=8, fd_recon_init=fbp, fd_recon_init_t=0.2, fd_recon_eta=1.0, fd_recon_dc=1, fd_recon_dc_n_cg=5, fd_recon_dc_relax=1.0, dataset_kind=breast_ct, rationale=iter-4 INIT_T lever (continue lowering), breast-native wavelet CONSTRAINED, val=200. SIX-BOX: (1) PRIOR: init_t sweep at relax1.0: iter-2 init_t0.7 PSNR 16.5/RMSE 5.12e-2; iter-3 init_t0.4 PSNR 19.4/RMSE 3.66e-2 -- MONOTONIC improvement as init_t drops (prior over-injection is the failure). All hr=0, baseline PSNR 36.3/RMSE 5.21e-3. (2) FAILURE MODE: at init_t=0.4 the FBP embed still carries enough flow-time noise that the 8-step wavelet prior degrades detail relative to the strong 128-view FBP. (3) ONE KNOB: fd_recon_init_t 0.4 -> 0.2 (embed FBP even closer to clean; minimal prior drift), relax1.0 fixed. (4) HYPOTHESIS: init_t=0.2 continues the RMSE-down trend (archived Mayo-prior best SSIM was at init_t0.2) toward the FBP floor; the prior becomes a very light streak-denoiser. FALSIFIER: if PSNR still <<36, the wavelet flow prior fundamentally cannot improve on the 128-view breast FBP even as a light denoiser -> pivot to dc_n_cg (stronger DC) and steps, then conclude the prior is FBP-bounded here. (5) BUDGET: ~90s/iter. (6) Loop continues; iter-5 on landing.", "agent": "fastdiff_wdm_wavelet_constrained-claude-agentic", "campaign": "search-20260703-01", "cfg_full": {"dataset_kind": "breast_ct", "fd_recon_ckpt": "/cluster/maier/Agent4CT/checkpoints/fast_diffusion_wavelet_breast.pt", "fd_recon_dc": 1, "fd_recon_dc_n_cg": 5, "fd_recon_dc_relax": 1.0, "fd_recon_eta": 1.0, "fd_recon_init": "fbp", "fd_recon_init_t": 0.2, "fd_recon_steps": 8, "rationale": "iter-4 INIT_T lever (continue lowering), breast-native wavelet CONSTRAINED, val=200. SIX-BOX: (1) PRIOR: init_t sweep at relax1.0: iter-2 init_t0.7 PSNR 16.5/RMSE 5.12e-2; iter-3 init_t0.4 PSNR 19.4/RMSE 3.66e-2 -- MONOTONIC improvement as init_t drops (prior over-injection is the failure). All hr=0, baseline PSNR 36.3/RMSE 5.21e-3. (2) FAILURE MODE: at init_t=0.4 the FBP embed still carries enough flow-time noise that the 8-step wavelet prior degrades detail relative to the strong 128-view FBP. (3) ONE KNOB: fd_recon_init_t 0.4 -> 0.2 (embed FBP even closer to clean; minimal prior drift), relax1.0 fixed. (4) HYPOTHESIS: init_t=0.2 continues the RMSE-down trend (archived Mayo-prior best SSIM was at init_t0.2) toward the FBP floor; the prior becomes a very light streak-denoiser. FALSIFIER: if PSNR still <<36, the wavelet flow prior fundamentally cannot improve on the 128-view breast FBP even as a light denoiser -> pivot to dc_n_cg (stronger DC) and steps, then conclude the prior is FBP-bounded here. (5) BUDGET: ~90s/iter. (6) Loop continues; iter-5 on landing.", "seed": 42, "val_n": 200}, "challenge": "breast_ct", "change_class": "architecture", "git_commit": "671da566", "images": {"comparison": "runs/breast-ct-claude-agentic-fastdiff-wdm-wavelet-constrained-search-20260703-01/iterations/iter-0004/comparison.png", "test_showcase": null, "valtest_showcase": null}, "iter": 4, "kept": false, "metrics": {"headroom": 0.0, "headroom_std": 0.0, "val_psnr": 22.04148292541504, "val_psnr_std": 0.38348690681092684, "val_rmse": 0.026997925713658333, "val_rmse_std": 0.0011053714754383818, "val_ssim": 0.46055829524993896, "val_ssim_std": 0.009761938492331706}, "model": "claude-opus-4-8-1m", "obs_path": "breast-ct-claude-agentic-fastdiff-wdm-wavelet-constrained-search-20260703-01/iterations/iter-0004/observation.json", "obs_sha1": "45ad88b0abf395bfde9cfd71f8d477ac451d164a", "params_M": 3.824908, "params_source": "observation", "rationale": "fastdiff_wdm_wavelet_constrained-claude-agentic: val_n=200, seed=42, fd_recon_ckpt=/cluster/maier/Agent4CT/checkpoints/fast_diffusion_wavelet_breast.pt, fd_recon_steps=8, fd_recon_init=fbp, fd_recon_init_t=0.2, fd_recon_eta=1.0, fd_recon_dc=1, fd_recon_dc_n_cg=5, fd_recon_dc_relax=1.0, dataset_kind=breast_ct, rationale=iter-4 INIT_T lever (continue lowering), breast-native wavelet CONSTRAINED, val=200. SIX-BOX: (1) PRIOR: init_t sweep at relax1.0: iter-2 init_t0.7 PSNR 16.5/RMSE 5.12e-2; iter-3 init_t0.4 PSNR 19.4/RMSE 3.66e-2 -- MONOTONIC improvement as init_t drops (prior over-injection is the failure). All hr=0, baseline PSNR 36.3/RMSE 5.21e-3. (2) FAILURE MODE: at init_t=0.4 the FBP embed still carries enough flow-time noise that the 8-step wavelet prior degrades detail relative to the strong 128-view FBP. (3) ONE KNOB: fd_recon_init_t 0.4 -> 0.2 (embed FBP even closer to clean; minimal prior drift), relax1.0 fixed. (4) HYPOTHESIS: init_t=0.2 continues the RMSE-down trend (archived Mayo-prior best SSIM was at init_t0.2) toward the FBP floor; the prior becomes a very light streak-denoiser. FALSIFIER: if PSNR still <<36, the wavelet flow prior fundamentally cannot improve on the 128-view breast FBP even as a light denoiser -> pivot to dc_n_cg (stronger DC) and steps, then conclude the prior is FBP-bounded here. (5) BUDGET: ~90s/iter. (6) Loop continues; iter-5 on landing.", "run_id": "breast-ct-claude-agentic-fastdiff-wdm-wavelet-constrained-search-20260703-01", "runtime": {"elapsed_s": 138.9387423992157}, "schema_version": 3, "solver_key": "fastdiff-wdm-wavelet-constrained", "solver_name": "Fast-diffusion WDM (wavelet, constrained DC)", "split": {"train_n": 3600, "val_n": 200}, "status": "discard", "ts": "2026-07-06T20:43:24Z"}
