{"advice_for_others": "itnet-claude-agentic: pretrain_epochs=60, pretrain_lr=0.001, itnet_k=1, itnet_alpha=0.0, unet_c=16, finetune_epochs=0, finetune_lr=0.0001, train_n=800, val_n=200, grad_clip=1.0, seed=43, rationale=iter-18 (breast ItNet v1). SIX-BOX: (1) PRIOR: n=5 seed replicates of the a0.02 champion (c16,tn800,ep60): 0.8852/0.8699/0.8784/0.8893/0.8842 -> plateau 0.881+-0.007. The a0.02-vs-a0.0 gap (iter-12 0.8852 vs iter-8 0.8842) is 0.001, FAR inside the +-0.007 seed noise -> may be illusory. (2) FAILURE MODE: cannot claim a0.02 > a0.0 without a MATCHED-SEED comparison. iter-14 gave a0.02 @ seed43 = 0.8699; I have NO a0.0 @ seed43. (3) ONE KNOB (from iter-14): itnet_alpha 0.02 -> 0.0 (seed 43 held). Directly pairs vs iter-14 at the SAME seed. (4) HYPOTHESIS: if the tiny DC step is genuinely (even marginally) helpful, a0.0 @ seed43 < iter-14s 0.8699; if within +-0.002, the DC step is DISPENSABLE and the simplest architecture (pure denoiser, a0.0) is as good -> report a0.0 as the canonical config. FALSIFIER: a0.0 @ seed43 notably ABOVE 0.8699 would mean a0.02 HURT at that seed (DC step net-negative). (5) BUDGET: ep60/tn800 ~1140s, in budget. (6) Loop to iter-20.", "agent": "itnet-claude-agentic", "campaign": "search-20260703-01", "cfg_full": {"finetune_epochs": 0, "finetune_lr": 0.0001, "grad_clip": 1.0, "itnet_alpha": 0.0, "itnet_k": 1, "pretrain_epochs": 60, "pretrain_lr": 0.001, "rationale": "iter-18 (breast ItNet v1). SIX-BOX: (1) PRIOR: n=5 seed replicates of the a0.02 champion (c16,tn800,ep60): 0.8852/0.8699/0.8784/0.8893/0.8842 -> plateau 0.881+-0.007. The a0.02-vs-a0.0 gap (iter-12 0.8852 vs iter-8 0.8842) is 0.001, FAR inside the +-0.007 seed noise -> may be illusory. (2) FAILURE MODE: cannot claim a0.02 > a0.0 without a MATCHED-SEED comparison. iter-14 gave a0.02 @ seed43 = 0.8699; I have NO a0.0 @ seed43. (3) ONE KNOB (from iter-14): itnet_alpha 0.02 -> 0.0 (seed 43 held). Directly pairs vs iter-14 at the SAME seed. (4) HYPOTHESIS: if the tiny DC step is genuinely (even marginally) helpful, a0.0 @ seed43 < iter-14s 0.8699; if within +-0.002, the DC step is DISPENSABLE and the simplest architecture (pure denoiser, a0.0) is as good -> report a0.0 as the canonical config. FALSIFIER: a0.0 @ seed43 notably ABOVE 0.8699 would mean a0.02 HURT at that seed (DC step net-negative). (5) BUDGET: ep60/tn800 ~1140s, in budget. (6) Loop to iter-20.", "seed": 43, "train_n": 800, "unet_c": 16, "val_n": 200}, "challenge": "breast_ct", "change_class": "architecture", "git_commit": "671da566", "images": {"comparison": "runs/breast-ct-claude-agentic-itnet-search-20260703-01/iterations/iter-0018/comparison.png", "test_showcase": null, "valtest_showcase": null}, "iter": 18, "kept": true, "metrics": {"headroom": 0.8790963393994904, "headroom_std": 0.014801996913840581, "val_psnr": 54.67540740966797, "val_psnr_std": 1.6728628497565656, "val_rmse": 0.000630425987765193, "val_rmse_std": 0.00011400565871269687, "val_ssim": 0.9989245533943176, "val_ssim_std": 0.00038299226561597775}, "model": "claude-opus-4-8-1m", "obs_path": "breast-ct-claude-agentic-itnet-search-20260703-01/iterations/iter-0018/observation.json", "obs_sha1": "c59cc106aab9c9fc3c6a63d454749cd92cb75a88", "params_M": 0.232881, "params_source": "observation", "rationale": "itnet-claude-agentic: pretrain_epochs=60, pretrain_lr=0.001, itnet_k=1, itnet_alpha=0.0, unet_c=16, finetune_epochs=0, finetune_lr=0.0001, train_n=800, val_n=200, grad_clip=1.0, seed=43, rationale=iter-18 (breast ItNet v1). SIX-BOX: (1) PRIOR: n=5 seed replicates of the a0.02 champion (c16,tn800,ep60): 0.8852/0.8699/0.8784/0.8893/0.8842 -> plateau 0.881+-0.007. The a0.02-vs-a0.0 gap (iter-12 0.8852 vs iter-8 0.8842) is 0.001, FAR inside the +-0.007 seed noise -> may be illusory. (2) FAILURE MODE: cannot claim a0.02 > a0.0 without a MATCHED-SEED comparison. iter-14 gave a0.02 @ seed43 = 0.8699; I have NO a0.0 @ seed43. (3) ONE KNOB (from iter-14): itnet_alpha 0.02 -> 0.0 (seed 43 held). Directly pairs vs iter-14 at the SAME seed. (4) HYPOTHESIS: if the tiny DC step is genuinely (even marginally) helpful, a0.0 @ seed43 < iter-14s 0.8699; if within +-0.002, the DC step is DISPENSABLE and the simplest architecture (pure denoiser, a0.0) is as good -> report a0.0 as the canonical config. FALSIFIER: a0.0 @ seed43 notably ABOVE 0.8699 would mean a0.02 HURT at that seed (DC step net-negative). (5) BUDGET: ep60/tn800 ~1140s, in budget. (6) Loop to iter-20.", "run_id": "breast-ct-claude-agentic-itnet-search-20260703-01", "runtime": {"elapsed_s": 1332.8469541072845}, "schema_version": 3, "solver_key": "itnet", "solver_name": "ITNet v1", "split": {"train_n": 400, "val_n": 200}, "status": "keep", "ts": "2026-07-05T01:32:26Z"}
{"advice_for_others": "itnet-claude-agentic: pretrain_epochs=60, pretrain_lr=0.001, itnet_k=1, itnet_alpha=0.0, unet_c=16, finetune_epochs=0, finetune_lr=0.0001, train_n=800, val_n=200, grad_clip=1.0, seed=44, rationale=iter-19 (breast ItNet v1). SIX-BOX: (1) PRIOR: MATCHED-SEED alpha test at seed43 -> a0.0 (iter-18) 0.8791 BEATS a0.02 (iter-14) 0.8699 by +0.009, REVERSING the seed42 single-run (a0.02 0.8852 > a0.0 0.8842). So the a0.02 champion was a favorable-seed artifact; the tiny DC step is NOT reliably helpful. (2) FAILURE MODE: need a 2nd matched-seed pair to confirm a0.0 >= a0.02 generally (not just at seed43). (3) ONE KNOB (from iter-18): seed 43 -> 44 (a0.0 held). Pairs vs iter-15 (a0.02, seed44 = 0.8784). (4) HYPOTHESIS: a0.0 @ seed44 >= iter-15s 0.8784, confirming the pure denoiser (a0.0) is >= the tiny-DC config across seeds -> canonical config = a0.0 (simplest). FALSIFIER: a0.0 @ seed44 notably below 0.8784 -> the alpha effect is itself seed-dependent (no consistent winner) and both sit in the same 0.881+-0.007 plateau. (5) BUDGET: ep60/tn800 ~1140s, in budget. (6) iter-20 is the final replicate.", "agent": "itnet-claude-agentic", "campaign": "search-20260703-01", "cfg_full": {"finetune_epochs": 0, "finetune_lr": 0.0001, "grad_clip": 1.0, "itnet_alpha": 0.0, "itnet_k": 1, "pretrain_epochs": 60, "pretrain_lr": 0.001, "rationale": "iter-19 (breast ItNet v1). SIX-BOX: (1) PRIOR: MATCHED-SEED alpha test at seed43 -> a0.0 (iter-18) 0.8791 BEATS a0.02 (iter-14) 0.8699 by +0.009, REVERSING the seed42 single-run (a0.02 0.8852 > a0.0 0.8842). So the a0.02 champion was a favorable-seed artifact; the tiny DC step is NOT reliably helpful. (2) FAILURE MODE: need a 2nd matched-seed pair to confirm a0.0 >= a0.02 generally (not just at seed43). (3) ONE KNOB (from iter-18): seed 43 -> 44 (a0.0 held). Pairs vs iter-15 (a0.02, seed44 = 0.8784). (4) HYPOTHESIS: a0.0 @ seed44 >= iter-15s 0.8784, confirming the pure denoiser (a0.0) is >= the tiny-DC config across seeds -> canonical config = a0.0 (simplest). FALSIFIER: a0.0 @ seed44 notably below 0.8784 -> the alpha effect is itself seed-dependent (no consistent winner) and both sit in the same 0.881+-0.007 plateau. (5) BUDGET: ep60/tn800 ~1140s, in budget. (6) iter-20 is the final replicate.", "seed": 44, "train_n": 800, "unet_c": 16, "val_n": 200}, "challenge": "breast_ct", "change_class": "architecture", "git_commit": "671da566", "images": {"comparison": "runs/breast-ct-claude-agentic-itnet-search-20260703-01/iterations/iter-0019/comparison.png", "test_showcase": null, "valtest_showcase": null}, "iter": 19, "kept": true, "metrics": {"headroom": 0.881945423697905, "headroom_std": 0.015345914950257581, "val_psnr": 54.88254165649414, "val_psnr_std": 1.7493467147077386, "val_rmse": 0.0006155700539238751, "val_rmse_std": 0.00011640890045192823, "val_ssim": 0.9989651441574097, "val_ssim_std": 0.0003808843604369996}, "model": "claude-opus-4-8-1m", "obs_path": "breast-ct-claude-agentic-itnet-search-20260703-01/iterations/iter-0019/observation.json", "obs_sha1": "8b87ade14aa1e1c5b72e0701c0d3d30a6cd75ecb", "params_M": 0.232881, "params_source": "observation", "rationale": "itnet-claude-agentic: pretrain_epochs=60, pretrain_lr=0.001, itnet_k=1, itnet_alpha=0.0, unet_c=16, finetune_epochs=0, finetune_lr=0.0001, train_n=800, val_n=200, grad_clip=1.0, seed=44, rationale=iter-19 (breast ItNet v1). SIX-BOX: (1) PRIOR: MATCHED-SEED alpha test at seed43 -> a0.0 (iter-18) 0.8791 BEATS a0.02 (iter-14) 0.8699 by +0.009, REVERSING the seed42 single-run (a0.02 0.8852 > a0.0 0.8842). So the a0.02 champion was a favorable-seed artifact; the tiny DC step is NOT reliably helpful. (2) FAILURE MODE: need a 2nd matched-seed pair to confirm a0.0 >= a0.02 generally (not just at seed43). (3) ONE KNOB (from iter-18): seed 43 -> 44 (a0.0 held). Pairs vs iter-15 (a0.02, seed44 = 0.8784). (4) HYPOTHESIS: a0.0 @ seed44 >= iter-15s 0.8784, confirming the pure denoiser (a0.0) is >= the tiny-DC config across seeds -> canonical config = a0.0 (simplest). FALSIFIER: a0.0 @ seed44 notably below 0.8784 -> the alpha effect is itself seed-dependent (no consistent winner) and both sit in the same 0.881+-0.007 plateau. (5) BUDGET: ep60/tn800 ~1140s, in budget. (6) iter-20 is the final replicate.", "run_id": "breast-ct-claude-agentic-itnet-search-20260703-01", "runtime": {"elapsed_s": 1060.984049320221}, "schema_version": 3, "solver_key": "itnet", "solver_name": "ITNet v1", "split": {"train_n": 400, "val_n": 200}, "status": "keep", "ts": "2026-07-05T02:27:55Z"}
{"advice_for_others": "itnet-claude-agentic: pretrain_epochs=60, pretrain_lr=0.001, itnet_k=1, itnet_alpha=0.0, unet_c=16, finetune_epochs=0, finetune_lr=0.0001, train_n=800, val_n=200, grad_clip=1.0, seed=45, rationale=iter-20 FINAL (breast ItNet v1). SIX-BOX: (1) PRIOR: matched-seed alpha pairs both favor a0.0: seed43 a0.0 0.8791 > a0.02 0.8699; seed44 a0.0 0.8819 > a0.02 0.8784. a0.0 (pure pretrained denoiser) is the canonical config; the tiny DC step is dispensable. Plateau ~0.881+-0.007. (2) FAILURE MODE: complete the 3rd matched-seed pair to finalize the a0.0>=a0.02 conclusion. (3) ONE KNOB (from iter-19): seed 44 -> 45 (a0.0 held). Pairs vs iter-16 (a0.02, seed45 = 0.8893). (4) HYPOTHESIS: a0.0 @ seed45 lands within +-0.007 of iter-16s 0.8893, giving a clean 3-pair a0.0-vs-a0.02 set that shows the two configs are statistically indistinguishable within seed noise (with a0.0 winning 2 of 2 matched pairs so far) -> report a0.0 as canonical. FALSIFIER: a large deviation would indicate residual seed sensitivity, already the headline finding. (5) BUDGET: ep60/tn800 ~1140s, in budget. (6) FINAL iter of the 20-iter search; compile report after.", "agent": "itnet-claude-agentic", "campaign": "search-20260703-01", "cfg_full": {"finetune_epochs": 0, "finetune_lr": 0.0001, "grad_clip": 1.0, "itnet_alpha": 0.0, "itnet_k": 1, "pretrain_epochs": 60, "pretrain_lr": 0.001, "rationale": "iter-20 FINAL (breast ItNet v1). SIX-BOX: (1) PRIOR: matched-seed alpha pairs both favor a0.0: seed43 a0.0 0.8791 > a0.02 0.8699; seed44 a0.0 0.8819 > a0.02 0.8784. a0.0 (pure pretrained denoiser) is the canonical config; the tiny DC step is dispensable. Plateau ~0.881+-0.007. (2) FAILURE MODE: complete the 3rd matched-seed pair to finalize the a0.0>=a0.02 conclusion. (3) ONE KNOB (from iter-19): seed 44 -> 45 (a0.0 held). Pairs vs iter-16 (a0.02, seed45 = 0.8893). (4) HYPOTHESIS: a0.0 @ seed45 lands within +-0.007 of iter-16s 0.8893, giving a clean 3-pair a0.0-vs-a0.02 set that shows the two configs are statistically indistinguishable within seed noise (with a0.0 winning 2 of 2 matched pairs so far) -> report a0.0 as canonical. FALSIFIER: a large deviation would indicate residual seed sensitivity, already the headline finding. (5) BUDGET: ep60/tn800 ~1140s, in budget. (6) FINAL iter of the 20-iter search; compile report after.", "seed": 45, "train_n": 800, "unet_c": 16, "val_n": 200}, "challenge": "breast_ct", "change_class": "architecture", "git_commit": "671da566", "images": {"comparison": "runs/breast-ct-claude-agentic-itnet-search-20260703-01/iterations/iter-0020/comparison.png", "test_showcase": null, "valtest_showcase": null}, "iter": 20, "kept": true, "metrics": {"headroom": 0.8866706931286726, "headroom_std": 0.015202427207095763, "val_psnr": 55.23735046386719, "val_psnr_std": 1.795760770060814, "val_rmse": 0.0005909311585128307, "val_rmse_std": 0.00011410004802288513, "val_ssim": 0.9990310668945312, "val_ssim_std": 0.00035295517754081117}, "model": "claude-opus-4-8-1m", "obs_path": "breast-ct-claude-agentic-itnet-search-20260703-01/iterations/iter-0020/observation.json", "obs_sha1": "34cd0de3994f674c2299e8fb368691d5546da1f2", "params_M": 0.232881, "params_source": "observation", "rationale": "itnet-claude-agentic: pretrain_epochs=60, pretrain_lr=0.001, itnet_k=1, itnet_alpha=0.0, unet_c=16, finetune_epochs=0, finetune_lr=0.0001, train_n=800, val_n=200, grad_clip=1.0, seed=45, rationale=iter-20 FINAL (breast ItNet v1). SIX-BOX: (1) PRIOR: matched-seed alpha pairs both favor a0.0: seed43 a0.0 0.8791 > a0.02 0.8699; seed44 a0.0 0.8819 > a0.02 0.8784. a0.0 (pure pretrained denoiser) is the canonical config; the tiny DC step is dispensable. Plateau ~0.881+-0.007. (2) FAILURE MODE: complete the 3rd matched-seed pair to finalize the a0.0>=a0.02 conclusion. (3) ONE KNOB (from iter-19): seed 44 -> 45 (a0.0 held). Pairs vs iter-16 (a0.02, seed45 = 0.8893). (4) HYPOTHESIS: a0.0 @ seed45 lands within +-0.007 of iter-16s 0.8893, giving a clean 3-pair a0.0-vs-a0.02 set that shows the two configs are statistically indistinguishable within seed noise (with a0.0 winning 2 of 2 matched pairs so far) -> report a0.0 as canonical. FALSIFIER: a large deviation would indicate residual seed sensitivity, already the headline finding. (5) BUDGET: ep60/tn800 ~1140s, in budget. (6) FINAL iter of the 20-iter search; compile report after.", "run_id": "breast-ct-claude-agentic-itnet-search-20260703-01", "runtime": {"elapsed_s": 1264.9250497817993}, "schema_version": 3, "solver_key": "itnet", "solver_name": "ITNet v1", "split": {"train_n": 400, "val_n": 200}, "status": "keep", "ts": "2026-07-05T03:31:16Z"}
{"advice_for_others": "itnet_v2-claude-agentic: itnet_k=4, unet_c=16, itnet_alpha_init=0.0026, residual_learning=False, pretrain_lr=0.00025, pretrain_epochs=15, pretrain_patience=15, grad_clip=1.0, train_n=600, val_n=200, seed=42, rationale=ITER-1 feasibility onboarding (breast-ct-claude-agentic-itnet-v2-search-20260703-01, strict 20-min budget, re-split breast val=200). itnet_v2 on breast (512^2, 128-view fan, cheap geometry, NO per-sample-ps -> fast batched val). CONFIG seeded from the prior breast itnet_v2 TPE winner (search-20260521-01, hr 0.5385): itnet_k=4, itnet_alpha_init=0.0026, pretrain_lr=2.5e-4 -- BUT residual_learning FORCED to False (NOT the TPE's True). REASON: the Mayo v2 campaign proved CONFIG-default residual_learning=True DOUBLE-APPLIES the residual (SmallUNet defaults residual=True returning x-body(x), then ItNetV2.forward re-adds denoiser(x) -> ~2x collapse) and only False matches the working v1/v3 recipe; the prior breast TPE=True predates that audit -- flag residual_learning True-vs-False as a later one-knob test if hr underperforms 0.5385. unet_c=16 (conservative width), pretrain_epochs=15 with pretrain_patience=15 to disable the 1pct early-stop so the full budget converges, grad_clip=1.0, train_n=600, val_n=200 (ALL re-split val cases -- do NOT exceed 200), seed=42. HYPOTHESIS: itnet_v2 at k=4/c=16/lr=2.5e-4 for 15 pretrain epochs on 600 breast train scenes produces a finite val_ssim that CLEARS the 128-view breast FBP baseline (hr>0) inside 20 min, establishing the corrected-split onboarding baseline that iters 2-5 will improve one knob at a time (pretrain_epochs, k, unet_c, lr, alpha).", "agent": "itnet_v2-claude-agentic", "campaign": "search-20260703-01", "cfg_full": {"grad_clip": 1.0, "itnet_alpha_init": 0.0026, "itnet_k": 4, "pretrain_epochs": 15, "pretrain_lr": 0.00025, "pretrain_patience": 15, "rationale": "ITER-1 feasibility onboarding (breast-ct-claude-agentic-itnet-v2-search-20260703-01, strict 20-min budget, re-split breast val=200). itnet_v2 on breast (512^2, 128-view fan, cheap geometry, NO per-sample-ps -> fast batched val). CONFIG seeded from the prior breast itnet_v2 TPE winner (search-20260521-01, hr 0.5385): itnet_k=4, itnet_alpha_init=0.0026, pretrain_lr=2.5e-4 -- BUT residual_learning FORCED to False (NOT the TPE's True). REASON: the Mayo v2 campaign proved CONFIG-default residual_learning=True DOUBLE-APPLIES the residual (SmallUNet defaults residual=True returning x-body(x), then ItNetV2.forward re-adds denoiser(x) -> ~2x collapse) and only False matches the working v1/v3 recipe; the prior breast TPE=True predates that audit -- flag residual_learning True-vs-False as a later one-knob test if hr underperforms 0.5385. unet_c=16 (conservative width), pretrain_epochs=15 with pretrain_patience=15 to disable the 1pct early-stop so the full budget converges, grad_clip=1.0, train_n=600, val_n=200 (ALL re-split val cases -- do NOT exceed 200), seed=42. HYPOTHESIS: itnet_v2 at k=4/c=16/lr=2.5e-4 for 15 pretrain epochs on 600 breast train scenes produces a finite val_ssim that CLEARS the 128-view breast FBP baseline (hr>0) inside 20 min, establishing the corrected-split onboarding baseline that iters 2-5 will improve one knob at a time (pretrain_epochs, k, unet_c, lr, alpha).", "residual_learning": false, "seed": 42, "train_n": 600, "unet_c": 16, "val_n": 200}, "challenge": "breast_ct", "change_class": "architecture", "git_commit": null, "images": {"comparison": "runs/breast-ct-claude-agentic-itnet-v2-search-20260703-01/iterations/iter-0001/comparison.png", "test_showcase": null, "valtest_showcase": null}, "iter": 1, "kept": false, "metrics": {"headroom": 0.0, "headroom_std": null, "val_psnr": 23.732845306396484, "val_psnr_std": null, "val_rmse": 0.022220928221940994, "val_rmse_std": null, "val_ssim": 0.7635519504547119, "val_ssim_std": null}, "model": "claude-opus-4-8-1m", "obs_path": "breast-ct-claude-agentic-itnet-v2-search-20260703-01/iterations/iter-0001/observation.json", "obs_sha1": "5256c4e8a32ef37347f02d995752987adb4f4746", "params_M": 0.232882, "params_source": "observation", "rationale": "itnet_v2-claude-agentic: itnet_k=4, unet_c=16, itnet_alpha_init=0.0026, residual_learning=False, pretrain_lr=0.00025, pretrain_epochs=15, pretrain_patience=15, grad_clip=1.0, train_n=600, val_n=200, seed=42, rationale=ITER-1 feasibility onboarding (breast-ct-claude-agentic-itnet-v2-search-20260703-01, strict 20-min budget, re-split breast val=200). itnet_v2 on breast (512^2, 128-view fan, cheap geometry, NO per-sample-ps -> fast batched val). CONFIG seeded from the prior breast itnet_v2 TPE winner (search-20260521-01, hr 0.5385): itnet_k=4, itnet_alpha_init=0.0026, pretrain_lr=2.5e-4 -- BUT residual_learning FORCED to False (NOT the TPE's True). REASON: the Mayo v2 campaign proved CONFIG-default residual_learning=True DOUBLE-APPLIES the residual (SmallUNet defaults residual=True returning x-body(x), then ItNetV2.forward re-adds denoiser(x) -> ~2x collapse) and only False matches the working v1/v3 recipe; the prior breast TPE=True predates that audit -- flag residual_learning True-vs-False as a later one-knob test if hr underperforms 0.5385. unet_c=16 (conservative width), pretrain_epochs=15 with pretrain_patience=15 to disable the 1pct early-stop so the full budget converges, grad_clip=1.0, train_n=600, val_n=200 (ALL re-split val cases -- do NOT exceed 200), seed=42. HYPOTHESIS: itnet_v2 at k=4/c=16/lr=2.5e-4 for 15 pretrain epochs on 600 breast train scenes produces a finite val_ssim that CLEARS the 128-view breast FBP baseline (hr>0) inside 20 min, establishing the corrected-split onboarding baseline that iters 2-5 will improve one knob at a time (pretrain_epochs, k, unet_c, lr, alpha).", "run_id": "breast-ct-claude-agentic-itnet-v2-search-20260703-01", "runtime": {"elapsed_s": 240.14791584014893}, "schema_version": 3, "solver_key": "itnet-v2", "solver_name": "ITNet v2", "split": {"train_n": 400, "val_n": 200}, "status": "discard", "ts": "2026-07-03T16:19:01Z"}
