{"advice_for_others": "learned_primal_dual-claude-agentic: lpd_iters=10, lpd_n_primal=5, lpd_n_dual=5, lpd_hidden=32, lpd_share_weights=False, epochs=10, lr=0.0005, lr_schedule=cosine, batch_size=1, grad_clip=1.0, lambda_neg=1.0, loss_base=mse, train_n=400, val_n=200, val_chunk=4, rationale=iter-2 one-knob: epochs 8->10 (all else fixed from iter-1). FAILURE MODE observed at iter-1: undertraining (hr=0.3154 only, at 8 epochs / 976s). In the prior uncapped breast LPD run the single biggest hr jump came from more epochs (ep10->20 lifted hr 0.39->0.75). HYPOTHESIS: if I raise epochs 8->10, expect hr to climb meaningfully above 0.3154 because iter-1 was undertrained; sized to stay <20min (8ep=976s -> ~10ep should land ~1180s, still under the 1200s cap).", "agent": "learned_primal_dual-claude-agentic", "campaign": "search-20260703-01", "cfg_full": {"batch_size": 1, "epochs": 10, "grad_clip": 1.0, "lambda_neg": 1.0, "loss_base": "mse", "lpd_hidden": 32, "lpd_iters": 10, "lpd_n_dual": 5, "lpd_n_primal": 5, "lpd_share_weights": false, "lr": 0.0005, "lr_schedule": "cosine", "rationale": "iter-2 one-knob: epochs 8->10 (all else fixed from iter-1). FAILURE MODE observed at iter-1: undertraining (hr=0.3154 only, at 8 epochs / 976s). In the prior uncapped breast LPD run the single biggest hr jump came from more epochs (ep10->20 lifted hr 0.39->0.75). HYPOTHESIS: if I raise epochs 8->10, expect hr to climb meaningfully above 0.3154 because iter-1 was undertrained; sized to stay <20min (8ep=976s -> ~10ep should land ~1180s, still under the 1200s cap).", "train_n": 400, "val_chunk": 4, "val_n": 200}, "challenge": "breast_ct", "change_class": "architecture", "git_commit": null, "images": {"comparison": "runs/breast-ct-claude-agentic-learned-primal-dual-search-20260703-01/iterations/iter-0002/comparison.png", "test_showcase": null, "valtest_showcase": null}, "iter": 2, "kept": true, "metrics": {"headroom": 0.4389154045056465, "headroom_std": null, "val_psnr": 41.34362030029297, "val_psnr_std": null, "val_rmse": 0.002925655571743846, "val_rmse_std": null, "val_ssim": 0.9850336313247681, "val_ssim_std": null}, "model": "claude-opus-4-8-1m", "obs_path": "breast-ct-claude-agentic-learned-primal-dual-search-20260703-01/iterations/iter-0002/observation.json", "obs_sha1": "0c0d3c1e2987a37c8c446dcd989d8fce687dc5e8", "params_M": 0.25322, "params_source": "observation", "rationale": "learned_primal_dual-claude-agentic: lpd_iters=10, lpd_n_primal=5, lpd_n_dual=5, lpd_hidden=32, lpd_share_weights=False, epochs=10, lr=0.0005, lr_schedule=cosine, batch_size=1, grad_clip=1.0, lambda_neg=1.0, loss_base=mse, train_n=400, val_n=200, val_chunk=4, rationale=iter-2 one-knob: epochs 8->10 (all else fixed from iter-1). FAILURE MODE observed at iter-1: undertraining (hr=0.3154 only, at 8 epochs / 976s). In the prior uncapped breast LPD run the single biggest hr jump came from more epochs (ep10->20 lifted hr 0.39->0.75). HYPOTHESIS: if I raise epochs 8->10, expect hr to climb meaningfully above 0.3154 because iter-1 was undertrained; sized to stay <20min (8ep=976s -> ~10ep should land ~1180s, still under the 1200s cap).", "run_id": "breast-ct-claude-agentic-learned-primal-dual-search-20260703-01", "runtime": {"elapsed_s": 1328.1975944042206}, "schema_version": 3, "solver_key": "learned-primal-dual", "solver_name": "Learned Primal-Dual", "split": {"train_n": 400, "val_n": 200}, "status": "keep", "ts": "2026-07-03T17:14:21Z"}
{"advice_for_others": "learned_primal_dual-claude-agentic: lpd_iters=10, lpd_n_primal=5, lpd_n_dual=5, lpd_hidden=32, lpd_share_weights=False, epochs=10, lr=0.0008, lr_schedule=cosine, batch_size=1, grad_clip=1.0, lambda_neg=1.0, loss_base=mse, train_n=400, val_n=200, val_chunk=4, rationale=iter-3 one-knob: lr 5e-4 -> 8e-4 (epochs stay 10, all else fixed from iter-2). FAILURE MODE: epoch-budget-bound -- iter-2 at 10 epochs already spent 1328s (~ the 20-min ceiling), so I cannot buy more gain with more epochs. Remaining headroom must come from better optimization PER step. HYPOTHESIS: if I raise initial lr 5e-4->8e-4 with the same cosine decay to ~0, expect hr to climb above 0.4389 because LPD here is optimization-limited (not capacity-limited) and a larger initial step exploits the fixed 10-epoch budget better; wall stays ~1328s (epochs unchanged).", "agent": "learned_primal_dual-claude-agentic", "campaign": "search-20260703-01", "cfg_full": {"batch_size": 1, "epochs": 10, "grad_clip": 1.0, "lambda_neg": 1.0, "loss_base": "mse", "lpd_hidden": 32, "lpd_iters": 10, "lpd_n_dual": 5, "lpd_n_primal": 5, "lpd_share_weights": false, "lr": 0.0008, "lr_schedule": "cosine", "rationale": "iter-3 one-knob: lr 5e-4 -> 8e-4 (epochs stay 10, all else fixed from iter-2). FAILURE MODE: epoch-budget-bound -- iter-2 at 10 epochs already spent 1328s (~ the 20-min ceiling), so I cannot buy more gain with more epochs. Remaining headroom must come from better optimization PER step. HYPOTHESIS: if I raise initial lr 5e-4->8e-4 with the same cosine decay to ~0, expect hr to climb above 0.4389 because LPD here is optimization-limited (not capacity-limited) and a larger initial step exploits the fixed 10-epoch budget better; wall stays ~1328s (epochs unchanged).", "train_n": 400, "val_chunk": 4, "val_n": 200}, "challenge": "breast_ct", "change_class": "architecture", "git_commit": null, "images": {"comparison": "runs/breast-ct-claude-agentic-learned-primal-dual-search-20260703-01/iterations/iter-0003/comparison.png", "test_showcase": null, "valtest_showcase": null}, "iter": 3, "kept": true, "metrics": {"headroom": 0.5662698611862513, "headroom_std": null, "val_psnr": 43.579803466796875, "val_psnr_std": null, "val_rmse": 0.0022615930065512657, "val_rmse_std": null, "val_ssim": 0.9890022873878479, "val_ssim_std": null}, "model": "claude-opus-4-8-1m", "obs_path": "breast-ct-claude-agentic-learned-primal-dual-search-20260703-01/iterations/iter-0003/observation.json", "obs_sha1": "8193f187f422406c0251b48e61e6f0d74f41c3e2", "params_M": 0.25322, "params_source": "observation", "rationale": "learned_primal_dual-claude-agentic: lpd_iters=10, lpd_n_primal=5, lpd_n_dual=5, lpd_hidden=32, lpd_share_weights=False, epochs=10, lr=0.0008, lr_schedule=cosine, batch_size=1, grad_clip=1.0, lambda_neg=1.0, loss_base=mse, train_n=400, val_n=200, val_chunk=4, rationale=iter-3 one-knob: lr 5e-4 -> 8e-4 (epochs stay 10, all else fixed from iter-2). FAILURE MODE: epoch-budget-bound -- iter-2 at 10 epochs already spent 1328s (~ the 20-min ceiling), so I cannot buy more gain with more epochs. Remaining headroom must come from better optimization PER step. HYPOTHESIS: if I raise initial lr 5e-4->8e-4 with the same cosine decay to ~0, expect hr to climb above 0.4389 because LPD here is optimization-limited (not capacity-limited) and a larger initial step exploits the fixed 10-epoch budget better; wall stays ~1328s (epochs unchanged).", "run_id": "breast-ct-claude-agentic-learned-primal-dual-search-20260703-01", "runtime": {"elapsed_s": 1517.1426854133606}, "schema_version": 3, "solver_key": "learned-primal-dual", "solver_name": "Learned Primal-Dual", "split": {"train_n": 400, "val_n": 200}, "status": "keep", "ts": "2026-07-03T19:34:31Z"}
{"advice_for_others": "learned_primal_dual-claude-agentic: lpd_iters=10, lpd_n_primal=5, lpd_n_dual=5, lpd_hidden=48, lpd_share_weights=False, epochs=10, lr=0.0008, lr_schedule=cosine, batch_size=1, grad_clip=1.0, lambda_neg=1.0, loss_base=mse, train_n=400, val_n=200, val_chunk=4, rationale=iter-4 one-knob: lpd_hidden 32->48 (epochs=10, lr=8e-4, I=10 fixed from iter-3). FAILURE MODE: capacity-limited -- epochs are at the budget ceiling and lr is tuned (8e-4 best), yet hr=0.566 is still well below the old uncapped champion ~0.90 which used wider proximals (hidden 64). HYPOTHESIS: if I widen the proximal CNN hidden 32->48, expect hr above 0.5663 because the proximal blocks are now the bottleneck (lr/epochs already tuned) and wider convs fit breast mu-structure better; chose 48 not 64 to keep wall under the 30-min SLURM ceiling (iter-3 was 1517s at h32).", "agent": "learned_primal_dual-claude-agentic", "campaign": "search-20260703-01", "cfg_full": {"batch_size": 1, "epochs": 10, "grad_clip": 1.0, "lambda_neg": 1.0, "loss_base": "mse", "lpd_hidden": 48, "lpd_iters": 10, "lpd_n_dual": 5, "lpd_n_primal": 5, "lpd_share_weights": false, "lr": 0.0008, "lr_schedule": "cosine", "rationale": "iter-4 one-knob: lpd_hidden 32->48 (epochs=10, lr=8e-4, I=10 fixed from iter-3). FAILURE MODE: capacity-limited -- epochs are at the budget ceiling and lr is tuned (8e-4 best), yet hr=0.566 is still well below the old uncapped champion ~0.90 which used wider proximals (hidden 64). HYPOTHESIS: if I widen the proximal CNN hidden 32->48, expect hr above 0.5663 because the proximal blocks are now the bottleneck (lr/epochs already tuned) and wider convs fit breast mu-structure better; chose 48 not 64 to keep wall under the 30-min SLURM ceiling (iter-3 was 1517s at h32).", "train_n": 400, "val_chunk": 4, "val_n": 200}, "challenge": "breast_ct", "change_class": "architecture", "git_commit": null, "images": {"comparison": "runs/breast-ct-claude-agentic-learned-primal-dual-search-20260703-01/iterations/iter-0004/comparison.png", "test_showcase": null, "valtest_showcase": null}, "iter": 4, "kept": true, "metrics": {"headroom": 0.5331913712892251, "headroom_std": 0.02965484154014347, "val_psnr": 42.94141387939453, "val_psnr_std": 1.0545284134177981, "val_rmse": 0.0024340737145394087, "val_rmse_std": 0.0002929356364137218, "val_ssim": 0.989298403263092, "val_ssim_std": 0.0026702564471361985}, "model": "claude-opus-4-8-1m", "obs_path": "breast-ct-claude-agentic-learned-primal-dual-search-20260703-01/iterations/iter-0004/observation.json", "obs_sha1": "c59c2ee54931f4666b37edaa859c2714062d6df5", "params_M": 0.51802, "params_source": "observation", "rationale": "learned_primal_dual-claude-agentic: lpd_iters=10, lpd_n_primal=5, lpd_n_dual=5, lpd_hidden=48, lpd_share_weights=False, epochs=10, lr=0.0008, lr_schedule=cosine, batch_size=1, grad_clip=1.0, lambda_neg=1.0, loss_base=mse, train_n=400, val_n=200, val_chunk=4, rationale=iter-4 one-knob: lpd_hidden 32->48 (epochs=10, lr=8e-4, I=10 fixed from iter-3). FAILURE MODE: capacity-limited -- epochs are at the budget ceiling and lr is tuned (8e-4 best), yet hr=0.566 is still well below the old uncapped champion ~0.90 which used wider proximals (hidden 64). HYPOTHESIS: if I widen the proximal CNN hidden 32->48, expect hr above 0.5663 because the proximal blocks are now the bottleneck (lr/epochs already tuned) and wider convs fit breast mu-structure better; chose 48 not 64 to keep wall under the 30-min SLURM ceiling (iter-3 was 1517s at h32).", "run_id": "breast-ct-claude-agentic-learned-primal-dual-search-20260703-01", "runtime": {"elapsed_s": 1778.7259414196014}, "schema_version": 3, "solver_key": "learned-primal-dual", "solver_name": "Learned Primal-Dual", "split": {"train_n": 400, "val_n": 200}, "status": "keep", "ts": "2026-07-03T20:53:32Z"}
{"advice_for_others": "learned_primal_dual-claude-agentic: lpd_iters=10, lpd_n_primal=5, lpd_n_dual=5, lpd_hidden=32, lpd_share_weights=False, epochs=10, lr=0.0012, lr_schedule=cosine, batch_size=1, grad_clip=1.0, lambda_neg=1.0, loss_base=mse, train_n=400, val_n=200, val_chunk=4, rationale=iter-5 one-knob: REVERT iter-4 (hidden 48->32, which hurt hr 0.566->0.533 AND hit the 29.6-min wall) and instead push lr 8e-4 -> 1.2e-3 (epochs=10, I=10 fixed). FAILURE MODE at iter-4: over-widening proximals both lowered hr and blew the wall -> not capacity-limited. HYPOTHESIS: if I raise lr 8e-4->1.2e-3 with the same cosine decay at h32/I10/ep10, expect hr above 0.5663 because lr was the strongest single-knob lever (0.44->0.57 from 5e-4->8e-4) and iter-3 was likely not yet at the lr optimum; wall stays ~1517s (h32) safely under the 30-min ceiling.", "agent": "learned_primal_dual-claude-agentic", "campaign": "search-20260703-01", "cfg_full": {"batch_size": 1, "epochs": 10, "grad_clip": 1.0, "lambda_neg": 1.0, "loss_base": "mse", "lpd_hidden": 32, "lpd_iters": 10, "lpd_n_dual": 5, "lpd_n_primal": 5, "lpd_share_weights": false, "lr": 0.0012, "lr_schedule": "cosine", "rationale": "iter-5 one-knob: REVERT iter-4 (hidden 48->32, which hurt hr 0.566->0.533 AND hit the 29.6-min wall) and instead push lr 8e-4 -> 1.2e-3 (epochs=10, I=10 fixed). FAILURE MODE at iter-4: over-widening proximals both lowered hr and blew the wall -> not capacity-limited. HYPOTHESIS: if I raise lr 8e-4->1.2e-3 with the same cosine decay at h32/I10/ep10, expect hr above 0.5663 because lr was the strongest single-knob lever (0.44->0.57 from 5e-4->8e-4) and iter-3 was likely not yet at the lr optimum; wall stays ~1517s (h32) safely under the 30-min ceiling.", "train_n": 400, "val_chunk": 4, "val_n": 200}, "challenge": "breast_ct", "change_class": "architecture", "git_commit": null, "images": {"comparison": "runs/breast-ct-claude-agentic-learned-primal-dual-search-20260703-01/iterations/iter-0005/comparison.png", "test_showcase": null, "valtest_showcase": null}, "iter": 5, "kept": true, "metrics": {"headroom": 0.6209559839372636, "headroom_std": 0.019101804840938465, "val_psnr": 44.75040054321289, "val_psnr_std": 0.9327784561477724, "val_rmse": 0.0019764439202845097, "val_rmse_std": 0.00021219483178992233, "val_ssim": 0.9916570782661438, "val_ssim_std": 0.0019778058310263155}, "model": "claude-opus-4-8-1m", "obs_path": "breast-ct-claude-agentic-learned-primal-dual-search-20260703-01/iterations/iter-0005/observation.json", "obs_sha1": "f3bcd2499d138cb3f9ecaf84d8652ac365dd7722", "params_M": 0.25322, "params_source": "observation", "rationale": "learned_primal_dual-claude-agentic: lpd_iters=10, lpd_n_primal=5, lpd_n_dual=5, lpd_hidden=32, lpd_share_weights=False, epochs=10, lr=0.0012, lr_schedule=cosine, batch_size=1, grad_clip=1.0, lambda_neg=1.0, loss_base=mse, train_n=400, val_n=200, val_chunk=4, rationale=iter-5 one-knob: REVERT iter-4 (hidden 48->32, which hurt hr 0.566->0.533 AND hit the 29.6-min wall) and instead push lr 8e-4 -> 1.2e-3 (epochs=10, I=10 fixed). FAILURE MODE at iter-4: over-widening proximals both lowered hr and blew the wall -> not capacity-limited. HYPOTHESIS: if I raise lr 8e-4->1.2e-3 with the same cosine decay at h32/I10/ep10, expect hr above 0.5663 because lr was the strongest single-knob lever (0.44->0.57 from 5e-4->8e-4) and iter-3 was likely not yet at the lr optimum; wall stays ~1517s (h32) safely under the 30-min ceiling.", "run_id": "breast-ct-claude-agentic-learned-primal-dual-search-20260703-01", "runtime": {"elapsed_s": 1388.019504070282}, "schema_version": 3, "solver_key": "learned-primal-dual", "solver_name": "Learned Primal-Dual", "split": {"train_n": 400, "val_n": 200}, "status": "keep", "ts": "2026-07-03T21:33:41Z"}
{"advice_for_others": "learned_primal_dual-claude-agentic: lpd_iters=12, lpd_n_primal=5, lpd_n_dual=5, lpd_hidden=32, lpd_share_weights=False, epochs=10, lr=0.0012, lr_schedule=cosine, batch_size=1, grad_clip=1.0, lambda_neg=1.0, loss_base=mse, train_n=400, val_n=200, val_chunk=4, rationale=iter-6 one-knob: lpd_iters 10->12 (lr=1.2e-3, ep10, h32 fixed from best iter-5 hr=0.621). FAILURE MODE avoided: widening hidden (iter-4) hurt hr AND hit the wall, so I add DEPTH not WIDTH. HYPOTHESIS: if I add unrolled primal-dual iters I 10->12, expect hr above 0.621 because unroll depth is LPD s core inductive lever (old champion used I=15) and at h32 the extra convs are cheap; est wall ~1666s (1388*12/10), under the 30-min ceiling.", "agent": "learned_primal_dual-claude-agentic", "campaign": "search-20260703-01", "cfg_full": {"batch_size": 1, "epochs": 10, "grad_clip": 1.0, "lambda_neg": 1.0, "loss_base": "mse", "lpd_hidden": 32, "lpd_iters": 12, "lpd_n_dual": 5, "lpd_n_primal": 5, "lpd_share_weights": false, "lr": 0.0012, "lr_schedule": "cosine", "rationale": "iter-6 one-knob: lpd_iters 10->12 (lr=1.2e-3, ep10, h32 fixed from best iter-5 hr=0.621). FAILURE MODE avoided: widening hidden (iter-4) hurt hr AND hit the wall, so I add DEPTH not WIDTH. HYPOTHESIS: if I add unrolled primal-dual iters I 10->12, expect hr above 0.621 because unroll depth is LPD s core inductive lever (old champion used I=15) and at h32 the extra convs are cheap; est wall ~1666s (1388*12/10), under the 30-min ceiling.", "train_n": 400, "val_chunk": 4, "val_n": 200}, "challenge": "breast_ct", "change_class": "architecture", "git_commit": null, "images": {"comparison": "runs/breast-ct-claude-agentic-learned-primal-dual-search-20260703-01/iterations/iter-0006/comparison.png", "test_showcase": null, "valtest_showcase": null}, "iter": 6, "kept": true, "metrics": {"headroom": 0.6685118249509672, "headroom_std": 0.01783379234268451, "val_psnr": 45.91483688354492, "val_psnr_std": 0.9602115363069474, "val_rmse": 0.0017284741625189781, "val_rmse_std": 0.00019170635584320693, "val_ssim": 0.9929436445236206, "val_ssim_std": 0.0017458115806065226}, "model": "claude-opus-4-8-1m", "obs_path": "breast-ct-claude-agentic-learned-primal-dual-search-20260703-01/iterations/iter-0006/observation.json", "obs_sha1": "26b17da671ee417e61edafe0776d55532dbae659", "params_M": 0.303864, "params_source": "observation", "rationale": "learned_primal_dual-claude-agentic: lpd_iters=12, lpd_n_primal=5, lpd_n_dual=5, lpd_hidden=32, lpd_share_weights=False, epochs=10, lr=0.0012, lr_schedule=cosine, batch_size=1, grad_clip=1.0, lambda_neg=1.0, loss_base=mse, train_n=400, val_n=200, val_chunk=4, rationale=iter-6 one-knob: lpd_iters 10->12 (lr=1.2e-3, ep10, h32 fixed from best iter-5 hr=0.621). FAILURE MODE avoided: widening hidden (iter-4) hurt hr AND hit the wall, so I add DEPTH not WIDTH. HYPOTHESIS: if I add unrolled primal-dual iters I 10->12, expect hr above 0.621 because unroll depth is LPD s core inductive lever (old champion used I=15) and at h32 the extra convs are cheap; est wall ~1666s (1388*12/10), under the 30-min ceiling.", "run_id": "breast-ct-claude-agentic-learned-primal-dual-search-20260703-01", "runtime": {"elapsed_s": 1799.8276722431183}, "schema_version": 3, "solver_key": "learned-primal-dual", "solver_name": "Learned Primal-Dual", "split": {"train_n": 400, "val_n": 200}, "status": "keep", "ts": "2026-07-03T22:41:21Z"}
