{"advice_for_others": "manduca_bilateral-claude-agentic: proj_n_bf=1, proj_sr=1.5, proj_w=5, proj_kernel=5, bf_d_w_ratio=0.16666666666666666, manduca_N0=100000.0, manduca_bowtie=False, img_n_bf=6, img_kernel=9, img_sx=0.5, img_sy=0.5, img_sr=0.05, epochs=10, batch_size=1, lr=0.005, optimizer=adam, lambda_neg=1.0, grad_clip=1.0, train_n=400, val_n=200, val_chunk=10, seed=42, rationale=iter-16 manduca_bilateral breast CEILING CONFIRMATION toward HARD iter-20 stop (val=200). PRIOR: ceiling hr=0.2771 reproduced 3x (iter-8/11/15); best hr=0.2781 (iter-14 train_n=1600, +0.001 noise). ALL levers exhausted: img_sr peak 0.05, img_n_bf sat@6, img_kernel best 9, img spatial 0.5 optimal, epochs inert, lr=5e-3 optimal (1e-3 worse), proj_n_bf worse, proj_sr flat, bowtie collapsed hr=0, train_n 4x = +0.001. Firm 21-param image-bilateral capacity ceiling; FBP+bilateral sets ~0.278. FAILURE MODE: none new. ONE KNOB: none productive remains -- confirmation at best config (train_n=400 seed=42). HYPOTHESIS: reproduces hr~0.277 confirming stability. BUDGET ~470s. Loop continues to iter-20. turbo, save ckpt+recon, params_M logged.", "agent": "manduca_bilateral-claude-agentic", "campaign": "search-20260703-01", "cfg_full": {"batch_size": 1, "bf_d_w_ratio": 0.16666666666666666, "epochs": 10, "grad_clip": 1.0, "img_kernel": 9, "img_n_bf": 6, "img_sr": 0.05, "img_sx": 0.5, "img_sy": 0.5, "lambda_neg": 1.0, "lr": 0.005, "manduca_N0": 100000.0, "manduca_bowtie": false, "optimizer": "adam", "proj_kernel": 5, "proj_n_bf": 1, "proj_sr": 1.5, "proj_w": 5, "rationale": "iter-16 manduca_bilateral breast CEILING CONFIRMATION toward HARD iter-20 stop (val=200). PRIOR: ceiling hr=0.2771 reproduced 3x (iter-8/11/15); best hr=0.2781 (iter-14 train_n=1600, +0.001 noise). ALL levers exhausted: img_sr peak 0.05, img_n_bf sat@6, img_kernel best 9, img spatial 0.5 optimal, epochs inert, lr=5e-3 optimal (1e-3 worse), proj_n_bf worse, proj_sr flat, bowtie collapsed hr=0, train_n 4x = +0.001. Firm 21-param image-bilateral capacity ceiling; FBP+bilateral sets ~0.278. FAILURE MODE: none new. ONE KNOB: none productive remains -- confirmation at best config (train_n=400 seed=42). HYPOTHESIS: reproduces hr~0.277 confirming stability. BUDGET ~470s. Loop continues to iter-20. turbo, save ckpt+recon, params_M logged.", "seed": 42, "train_n": 400, "val_chunk": 10, "val_n": 200}, "challenge": "breast_ct", "change_class": "architecture", "git_commit": "671da566", "images": {"comparison": "runs/breast-ct-claude-agentic-manduca-bilateral-search-20260703-01/iterations/iter-0016/comparison.png", "test_showcase": null, "valtest_showcase": null}, "iter": 16, "kept": true, "metrics": {"headroom": 0.27708170035531754, "headroom_std": 0.009381938112652291, "val_psnr": 39.14241409301758, "val_psnr_std": 0.563873625240202, "val_rmse": 0.0037695011124014854, "val_rmse_std": 0.00023820032679237554, "val_ssim": 0.9814385771751404, "val_ssim_std": 0.003337622533821539}, "model": "claude-opus-4-8-1m", "obs_path": "breast-ct-claude-agentic-manduca-bilateral-search-20260703-01/iterations/iter-0016/observation.json", "obs_sha1": "9a175c5c24fb0ad4c293d5ca5024248151870742", "params_M": 2.2e-05, "params_source": "observation", "rationale": "manduca_bilateral-claude-agentic: proj_n_bf=1, proj_sr=1.5, proj_w=5, proj_kernel=5, bf_d_w_ratio=0.16666666666666666, manduca_N0=100000.0, manduca_bowtie=False, img_n_bf=6, img_kernel=9, img_sx=0.5, img_sy=0.5, img_sr=0.05, epochs=10, batch_size=1, lr=0.005, optimizer=adam, lambda_neg=1.0, grad_clip=1.0, train_n=400, val_n=200, val_chunk=10, seed=42, rationale=iter-16 manduca_bilateral breast CEILING CONFIRMATION toward HARD iter-20 stop (val=200). PRIOR: ceiling hr=0.2771 reproduced 3x (iter-8/11/15); best hr=0.2781 (iter-14 train_n=1600, +0.001 noise). ALL levers exhausted: img_sr peak 0.05, img_n_bf sat@6, img_kernel best 9, img spatial 0.5 optimal, epochs inert, lr=5e-3 optimal (1e-3 worse), proj_n_bf worse, proj_sr flat, bowtie collapsed hr=0, train_n 4x = +0.001. Firm 21-param image-bilateral capacity ceiling; FBP+bilateral sets ~0.278. FAILURE MODE: none new. ONE KNOB: none productive remains -- confirmation at best config (train_n=400 seed=42). HYPOTHESIS: reproduces hr~0.277 confirming stability. BUDGET ~470s. Loop continues to iter-20. turbo, save ckpt+recon, params_M logged.", "run_id": "breast-ct-claude-agentic-manduca-bilateral-search-20260703-01", "runtime": {"elapsed_s": 478.5961751937866}, "schema_version": 3, "solver_key": "manduca-bilateral", "solver_name": "Manduca proj-bilateral (trainable)", "split": {"train_n": 400, "val_n": 200}, "status": "keep", "ts": "2026-07-05T11:18:44Z"}
{"advice_for_others": "manduca_bilateral-claude-agentic: proj_n_bf=1, proj_sr=1.5, proj_w=5, proj_kernel=5, bf_d_w_ratio=0.16666666666666666, manduca_N0=100000.0, manduca_bowtie=False, img_n_bf=6, img_kernel=9, img_sx=0.5, img_sy=0.5, img_sr=0.05, epochs=10, batch_size=1, lr=0.005, optimizer=adam, lambda_neg=1.0, grad_clip=1.0, train_n=400, val_n=200, val_chunk=10, seed=42, rationale=iter-17 manduca_bilateral breast CEILING CONFIRMATION toward HARD iter-20 stop (val=200). Ceiling hr=0.2771 reproduced 4x (iter-8/11/15/16); best hr=0.2781 (iter-14 train_n=1600). ALL levers exhausted: img_sr peak 0.05, img_n_bf sat@6, img_kernel best 9, img spatial 0.5 optimal, epochs inert, lr 5e-3 optimal (1e-3 worse), proj_n_bf worse, proj_sr flat, bowtie collapsed hr=0, train_n 4x=+0.001 (capacity-bound not data-bound). Firm 21-param image-bilateral ceiling; the sparse-view FBP + trainable bilateral tail sets ~0.278. ONE KNOB: none productive remains -- confirmation at best efficient config (train_n=400 seed=42). BUDGET ~470s. turbo, save ckpt+recon, params_M logged.", "agent": "manduca_bilateral-claude-agentic", "campaign": "search-20260703-01", "cfg_full": {"batch_size": 1, "bf_d_w_ratio": 0.16666666666666666, "epochs": 10, "grad_clip": 1.0, "img_kernel": 9, "img_n_bf": 6, "img_sr": 0.05, "img_sx": 0.5, "img_sy": 0.5, "lambda_neg": 1.0, "lr": 0.005, "manduca_N0": 100000.0, "manduca_bowtie": false, "optimizer": "adam", "proj_kernel": 5, "proj_n_bf": 1, "proj_sr": 1.5, "proj_w": 5, "rationale": "iter-17 manduca_bilateral breast CEILING CONFIRMATION toward HARD iter-20 stop (val=200). Ceiling hr=0.2771 reproduced 4x (iter-8/11/15/16); best hr=0.2781 (iter-14 train_n=1600). ALL levers exhausted: img_sr peak 0.05, img_n_bf sat@6, img_kernel best 9, img spatial 0.5 optimal, epochs inert, lr 5e-3 optimal (1e-3 worse), proj_n_bf worse, proj_sr flat, bowtie collapsed hr=0, train_n 4x=+0.001 (capacity-bound not data-bound). Firm 21-param image-bilateral ceiling; the sparse-view FBP + trainable bilateral tail sets ~0.278. ONE KNOB: none productive remains -- confirmation at best efficient config (train_n=400 seed=42). BUDGET ~470s. turbo, save ckpt+recon, params_M logged.", "seed": 42, "train_n": 400, "val_chunk": 10, "val_n": 200}, "challenge": "breast_ct", "change_class": "architecture", "git_commit": "671da566", "images": {"comparison": "runs/breast-ct-claude-agentic-manduca-bilateral-search-20260703-01/iterations/iter-0017/comparison.png", "test_showcase": null, "valtest_showcase": null}, "iter": 17, "kept": true, "metrics": {"headroom": 0.27708045008617477, "headroom_std": 0.009382048337548162, "val_psnr": 39.14239501953125, "val_psnr_std": 0.5638713221127736, "val_rmse": 0.0037695076316595078, "val_rmse_std": 0.00023819974314484398, "val_ssim": 0.9814385175704956, "val_ssim_std": 0.0033376054160952876}, "model": "claude-opus-4-8-1m", "obs_path": "breast-ct-claude-agentic-manduca-bilateral-search-20260703-01/iterations/iter-0017/observation.json", "obs_sha1": "95478a946322072fa2de23fdc6e70aacb6052298", "params_M": 2.2e-05, "params_source": "observation", "rationale": "manduca_bilateral-claude-agentic: proj_n_bf=1, proj_sr=1.5, proj_w=5, proj_kernel=5, bf_d_w_ratio=0.16666666666666666, manduca_N0=100000.0, manduca_bowtie=False, img_n_bf=6, img_kernel=9, img_sx=0.5, img_sy=0.5, img_sr=0.05, epochs=10, batch_size=1, lr=0.005, optimizer=adam, lambda_neg=1.0, grad_clip=1.0, train_n=400, val_n=200, val_chunk=10, seed=42, rationale=iter-17 manduca_bilateral breast CEILING CONFIRMATION toward HARD iter-20 stop (val=200). Ceiling hr=0.2771 reproduced 4x (iter-8/11/15/16); best hr=0.2781 (iter-14 train_n=1600). ALL levers exhausted: img_sr peak 0.05, img_n_bf sat@6, img_kernel best 9, img spatial 0.5 optimal, epochs inert, lr 5e-3 optimal (1e-3 worse), proj_n_bf worse, proj_sr flat, bowtie collapsed hr=0, train_n 4x=+0.001 (capacity-bound not data-bound). Firm 21-param image-bilateral ceiling; the sparse-view FBP + trainable bilateral tail sets ~0.278. ONE KNOB: none productive remains -- confirmation at best efficient config (train_n=400 seed=42). BUDGET ~470s. turbo, save ckpt+recon, params_M logged.", "run_id": "breast-ct-claude-agentic-manduca-bilateral-search-20260703-01", "runtime": {"elapsed_s": 502.87333941459656}, "schema_version": 3, "solver_key": "manduca-bilateral", "solver_name": "Manduca proj-bilateral (trainable)", "split": {"train_n": 400, "val_n": 200}, "status": "keep", "ts": "2026-07-05T12:19:08Z"}
{"advice_for_others": "manduca_bilateral-claude-agentic: proj_n_bf=1, proj_sr=1.5, proj_w=5, proj_kernel=5, bf_d_w_ratio=0.16666666666666666, manduca_N0=100000.0, manduca_bowtie=False, img_n_bf=6, img_kernel=9, img_sx=0.5, img_sy=0.5, img_sr=0.05, epochs=10, batch_size=1, lr=0.005, optimizer=adam, lambda_neg=1.0, grad_clip=1.0, train_n=400, val_n=200, val_chunk=10, seed=42, rationale=iter-18 manduca_bilateral breast CEILING CONFIRMATION toward HARD iter-20 stop (val=200). Ceiling hr=0.2771 reproduced 4x (iter-8/11/15/16); best hr=0.2781 (iter-14 train_n=1600). ALL levers exhausted: img_sr peak 0.05, img_n_bf sat@6, img_kernel best 9, img spatial 0.5 optimal, epochs inert, lr 5e-3 optimal (1e-3 worse), proj_n_bf worse, proj_sr flat, bowtie collapsed hr=0, train_n 4x=+0.001 (capacity-bound not data-bound). Firm 21-param image-bilateral ceiling; the sparse-view FBP + trainable bilateral tail sets ~0.278. ONE KNOB: none productive remains -- confirmation at best efficient config (train_n=400 seed=42). BUDGET ~470s. turbo, save ckpt+recon, params_M logged.", "agent": "manduca_bilateral-claude-agentic", "campaign": "search-20260703-01", "cfg_full": {"batch_size": 1, "bf_d_w_ratio": 0.16666666666666666, "epochs": 10, "grad_clip": 1.0, "img_kernel": 9, "img_n_bf": 6, "img_sr": 0.05, "img_sx": 0.5, "img_sy": 0.5, "lambda_neg": 1.0, "lr": 0.005, "manduca_N0": 100000.0, "manduca_bowtie": false, "optimizer": "adam", "proj_kernel": 5, "proj_n_bf": 1, "proj_sr": 1.5, "proj_w": 5, "rationale": "iter-18 manduca_bilateral breast CEILING CONFIRMATION toward HARD iter-20 stop (val=200). Ceiling hr=0.2771 reproduced 4x (iter-8/11/15/16); best hr=0.2781 (iter-14 train_n=1600). ALL levers exhausted: img_sr peak 0.05, img_n_bf sat@6, img_kernel best 9, img spatial 0.5 optimal, epochs inert, lr 5e-3 optimal (1e-3 worse), proj_n_bf worse, proj_sr flat, bowtie collapsed hr=0, train_n 4x=+0.001 (capacity-bound not data-bound). Firm 21-param image-bilateral ceiling; the sparse-view FBP + trainable bilateral tail sets ~0.278. ONE KNOB: none productive remains -- confirmation at best efficient config (train_n=400 seed=42). BUDGET ~470s. turbo, save ckpt+recon, params_M logged.", "seed": 42, "train_n": 400, "val_chunk": 10, "val_n": 200}, "challenge": "breast_ct", "change_class": "architecture", "git_commit": "671da566", "images": {"comparison": "runs/breast-ct-claude-agentic-manduca-bilateral-search-20260703-01/iterations/iter-0018/comparison.png", "test_showcase": null, "valtest_showcase": null}, "iter": 18, "kept": true, "metrics": {"headroom": 0.27708089661086865, "headroom_std": 0.009381971802230054, "val_psnr": 39.14240264892578, "val_psnr_std": 0.5638718713339491, "val_rmse": 0.003769505303353071, "val_rmse_std": 0.00023819993578449297, "val_ssim": 0.9814385175704956, "val_ssim_std": 0.003337632306538291}, "model": "claude-opus-4-8-1m", "obs_path": "breast-ct-claude-agentic-manduca-bilateral-search-20260703-01/iterations/iter-0018/observation.json", "obs_sha1": "f7b092020024f7e84c820274164bef87e8ec1891", "params_M": 2.2e-05, "params_source": "observation", "rationale": "manduca_bilateral-claude-agentic: proj_n_bf=1, proj_sr=1.5, proj_w=5, proj_kernel=5, bf_d_w_ratio=0.16666666666666666, manduca_N0=100000.0, manduca_bowtie=False, img_n_bf=6, img_kernel=9, img_sx=0.5, img_sy=0.5, img_sr=0.05, epochs=10, batch_size=1, lr=0.005, optimizer=adam, lambda_neg=1.0, grad_clip=1.0, train_n=400, val_n=200, val_chunk=10, seed=42, rationale=iter-18 manduca_bilateral breast CEILING CONFIRMATION toward HARD iter-20 stop (val=200). Ceiling hr=0.2771 reproduced 4x (iter-8/11/15/16); best hr=0.2781 (iter-14 train_n=1600). ALL levers exhausted: img_sr peak 0.05, img_n_bf sat@6, img_kernel best 9, img spatial 0.5 optimal, epochs inert, lr 5e-3 optimal (1e-3 worse), proj_n_bf worse, proj_sr flat, bowtie collapsed hr=0, train_n 4x=+0.001 (capacity-bound not data-bound). Firm 21-param image-bilateral ceiling; the sparse-view FBP + trainable bilateral tail sets ~0.278. ONE KNOB: none productive remains -- confirmation at best efficient config (train_n=400 seed=42). BUDGET ~470s. turbo, save ckpt+recon, params_M logged.", "run_id": "breast-ct-claude-agentic-manduca-bilateral-search-20260703-01", "runtime": {"elapsed_s": 335.92755484580994}, "schema_version": 3, "solver_key": "manduca-bilateral", "solver_name": "Manduca proj-bilateral (trainable)", "split": {"train_n": 400, "val_n": 200}, "status": "keep", "ts": "2026-07-05T13:15:50Z"}
{"advice_for_others": "manduca_bilateral-claude-agentic: proj_n_bf=1, proj_sr=1.5, proj_w=5, proj_kernel=5, bf_d_w_ratio=0.16666666666666666, manduca_N0=100000.0, manduca_bowtie=False, img_n_bf=6, img_kernel=9, img_sx=0.5, img_sy=0.5, img_sr=0.05, epochs=10, batch_size=1, lr=0.005, optimizer=adam, lambda_neg=1.0, grad_clip=1.0, train_n=400, val_n=200, val_chunk=10, seed=42, rationale=iter-19 manduca_bilateral breast CEILING CONFIRMATION toward HARD iter-20 stop (val=200). Ceiling hr=0.2771 reproduced 4x (iter-8/11/15/16); best hr=0.2781 (iter-14 train_n=1600). ALL levers exhausted: img_sr peak 0.05, img_n_bf sat@6, img_kernel best 9, img spatial 0.5 optimal, epochs inert, lr 5e-3 optimal (1e-3 worse), proj_n_bf worse, proj_sr flat, bowtie collapsed hr=0, train_n 4x=+0.001 (capacity-bound not data-bound). Firm 21-param image-bilateral ceiling; the sparse-view FBP + trainable bilateral tail sets ~0.278. ONE KNOB: none productive remains -- confirmation at best efficient config (train_n=400 seed=42). BUDGET ~470s. turbo, save ckpt+recon, params_M logged.", "agent": "manduca_bilateral-claude-agentic", "campaign": "search-20260703-01", "cfg_full": {"batch_size": 1, "bf_d_w_ratio": 0.16666666666666666, "epochs": 10, "grad_clip": 1.0, "img_kernel": 9, "img_n_bf": 6, "img_sr": 0.05, "img_sx": 0.5, "img_sy": 0.5, "lambda_neg": 1.0, "lr": 0.005, "manduca_N0": 100000.0, "manduca_bowtie": false, "optimizer": "adam", "proj_kernel": 5, "proj_n_bf": 1, "proj_sr": 1.5, "proj_w": 5, "rationale": "iter-19 manduca_bilateral breast CEILING CONFIRMATION toward HARD iter-20 stop (val=200). Ceiling hr=0.2771 reproduced 4x (iter-8/11/15/16); best hr=0.2781 (iter-14 train_n=1600). ALL levers exhausted: img_sr peak 0.05, img_n_bf sat@6, img_kernel best 9, img spatial 0.5 optimal, epochs inert, lr 5e-3 optimal (1e-3 worse), proj_n_bf worse, proj_sr flat, bowtie collapsed hr=0, train_n 4x=+0.001 (capacity-bound not data-bound). Firm 21-param image-bilateral ceiling; the sparse-view FBP + trainable bilateral tail sets ~0.278. ONE KNOB: none productive remains -- confirmation at best efficient config (train_n=400 seed=42). BUDGET ~470s. turbo, save ckpt+recon, params_M logged.", "seed": 42, "train_n": 400, "val_chunk": 10, "val_n": 200}, "challenge": "breast_ct", "change_class": "architecture", "git_commit": "671da566", "images": {"comparison": "runs/breast-ct-claude-agentic-manduca-bilateral-search-20260703-01/iterations/iter-0019/comparison.png", "test_showcase": null, "valtest_showcase": null}, "iter": 19, "kept": true, "metrics": {"headroom": 0.2770811198732156, "headroom_std": 0.009382031644045491, "val_psnr": 39.14240646362305, "val_psnr_std": 0.5638718136649269, "val_rmse": 0.003769504139199853, "val_rmse_std": 0.00023819984446011978, "val_ssim": 0.9814385771751404, "val_ssim_std": 0.0033376338747437766}, "model": "claude-opus-4-8-1m", "obs_path": "breast-ct-claude-agentic-manduca-bilateral-search-20260703-01/iterations/iter-0019/observation.json", "obs_sha1": "3f4dbd4c1fcc49da1a2aa517eb50244691113cd6", "params_M": 2.2e-05, "params_source": "observation", "rationale": "manduca_bilateral-claude-agentic: proj_n_bf=1, proj_sr=1.5, proj_w=5, proj_kernel=5, bf_d_w_ratio=0.16666666666666666, manduca_N0=100000.0, manduca_bowtie=False, img_n_bf=6, img_kernel=9, img_sx=0.5, img_sy=0.5, img_sr=0.05, epochs=10, batch_size=1, lr=0.005, optimizer=adam, lambda_neg=1.0, grad_clip=1.0, train_n=400, val_n=200, val_chunk=10, seed=42, rationale=iter-19 manduca_bilateral breast CEILING CONFIRMATION toward HARD iter-20 stop (val=200). Ceiling hr=0.2771 reproduced 4x (iter-8/11/15/16); best hr=0.2781 (iter-14 train_n=1600). ALL levers exhausted: img_sr peak 0.05, img_n_bf sat@6, img_kernel best 9, img spatial 0.5 optimal, epochs inert, lr 5e-3 optimal (1e-3 worse), proj_n_bf worse, proj_sr flat, bowtie collapsed hr=0, train_n 4x=+0.001 (capacity-bound not data-bound). Firm 21-param image-bilateral ceiling; the sparse-view FBP + trainable bilateral tail sets ~0.278. ONE KNOB: none productive remains -- confirmation at best efficient config (train_n=400 seed=42). BUDGET ~470s. turbo, save ckpt+recon, params_M logged.", "run_id": "breast-ct-claude-agentic-manduca-bilateral-search-20260703-01", "runtime": {"elapsed_s": 335.40585923194885}, "schema_version": 3, "solver_key": "manduca-bilateral", "solver_name": "Manduca proj-bilateral (trainable)", "split": {"train_n": 400, "val_n": 200}, "status": "keep", "ts": "2026-07-05T14:24:12Z"}
