{"advice_for_others": "itnet_v3-claude-agentic: itnet_k=2, unet_c=24, alpha_init=0.0025734, lr=0.00021567, epochs=4, batch_size=2, train_n=2400, val_n=200, grad_clip=1.0, max_train_s=1050, seed=42, rationale=iter-6 (breast-ct redo, search-20260703-01). ONE KNOB: epochs 3 -> 4 at unet_c=24 (all else = iter-5 exactly: itnet_k=2, unet_c=24, alpha_init=0.0025734, lr=2.16e-4, batch_size=2, train_n=2400, val_n=200, grad_clip=1.0, seed=42). SIX-BOX (NUMBERS): (1) iter-3 (c16/ep5/k2/n2400): 0.8277 = prior best, 877s. iter-4 (c16/ep3/k3): 0.7946 regress. iter-5 (c24/ep3/k2/n2400): 0.8269, SSIM 0.9977, PSNR 51.56, params 8.32M, elapsed 745.0s=12.4min. (2) FAILURE MODE: c=24 at 3 epochs TIED c=16 at 5 epochs (0.8269 vs 0.8277, within noise) -> the added capacity did NOT pay off, but iter-5 gave the bigger net only 3 epochs AND finished in just 12.4min (7.6min budget headroom -- the c-scaling is cheap because the k=2 projector DC steps dominate per-forward and are flat in c). So the c=24 net is likely UNDER-TRAINED at ep3, not capacity-useless. (3) ONE KNOB: epochs 3 -> 4 at c=24 (+33pct gradient steps to properly train the 8.3M-param denoiser; c/k/train_n all held so any hr change isolates whether capacity pays off WHEN adequately trained). (4) HYPOTHESIS: c=24 at ep4 lifts hr above 0.8277 because the bigger denoiser needed more than 3 epochs to exploit its extra channels. FALSIFIER (NUMBERS): if hr <= 0.8277 at c24/ep4, the c=16 champion is genuinely capacity-sufficient on this breast val set -> iter-7 reverts to the c16/ep5 champion and pivots to a training-recipe lever (lr or alpha_init), abandoning the capacity axis. (5) BUDGET (HARD 20min=1200s): iter-5 (c24/ep3/n2400)=745.0s. Per-epoch@c24/n2400 ~= (745-130 fixed)/3 ~= 205s; fixed ~130s. At ep4: 130 + 4*205 = 950s = 15.8min < 1200s with ~4min margin. ep5 (~1155s=19.3min) is tight; ep4 is the safe next step. max_train_s=1050 fences the TRAIN phase; a finite val+figure land inside the 30-min sbatch wall. train_n=2400 (<= OOM-safe cap). val=200 distinct val_truth.h5 cases, 256px inscribed-circle FOV (breast default). (6) do NOT return control mid-campaign; gate on iter-6 numeric-headroom obs via iter_wait.sh v3 then dispatch iter-7.", "agent": "itnet_v3-claude-agentic", "campaign": "search-20260703-01", "cfg_full": {"alpha_init": 0.0025734, "batch_size": 2, "epochs": 4, "grad_clip": 1.0, "itnet_k": 2, "lr": 0.00021567, "max_train_s": 1050, "rationale": "iter-6 (breast-ct redo, search-20260703-01). ONE KNOB: epochs 3 -> 4 at unet_c=24 (all else = iter-5 exactly: itnet_k=2, unet_c=24, alpha_init=0.0025734, lr=2.16e-4, batch_size=2, train_n=2400, val_n=200, grad_clip=1.0, seed=42). SIX-BOX (NUMBERS): (1) iter-3 (c16/ep5/k2/n2400): 0.8277 = prior best, 877s. iter-4 (c16/ep3/k3): 0.7946 regress. iter-5 (c24/ep3/k2/n2400): 0.8269, SSIM 0.9977, PSNR 51.56, params 8.32M, elapsed 745.0s=12.4min. (2) FAILURE MODE: c=24 at 3 epochs TIED c=16 at 5 epochs (0.8269 vs 0.8277, within noise) -> the added capacity did NOT pay off, but iter-5 gave the bigger net only 3 epochs AND finished in just 12.4min (7.6min budget headroom -- the c-scaling is cheap because the k=2 projector DC steps dominate per-forward and are flat in c). So the c=24 net is likely UNDER-TRAINED at ep3, not capacity-useless. (3) ONE KNOB: epochs 3 -> 4 at c=24 (+33pct gradient steps to properly train the 8.3M-param denoiser; c/k/train_n all held so any hr change isolates whether capacity pays off WHEN adequately trained). (4) HYPOTHESIS: c=24 at ep4 lifts hr above 0.8277 because the bigger denoiser needed more than 3 epochs to exploit its extra channels. FALSIFIER (NUMBERS): if hr <= 0.8277 at c24/ep4, the c=16 champion is genuinely capacity-sufficient on this breast val set -> iter-7 reverts to the c16/ep5 champion and pivots to a training-recipe lever (lr or alpha_init), abandoning the capacity axis. (5) BUDGET (HARD 20min=1200s): iter-5 (c24/ep3/n2400)=745.0s. Per-epoch@c24/n2400 ~= (745-130 fixed)/3 ~= 205s; fixed ~130s. At ep4: 130 + 4*205 = 950s = 15.8min < 1200s with ~4min margin. ep5 (~1155s=19.3min) is tight; ep4 is the safe next step. max_train_s=1050 fences the TRAIN phase; a finite val+figure land inside the 30-min sbatch wall. train_n=2400 (<= OOM-safe cap). val=200 distinct val_truth.h5 cases, 256px inscribed-circle FOV (breast default). (6) do NOT return control mid-campaign; gate on iter-6 numeric-headroom obs via iter_wait.sh v3 then dispatch iter-7.", "seed": 42, "train_n": 2400, "unet_c": 24, "val_n": 200}, "challenge": "breast_ct", "change_class": "architecture", "git_commit": "671da566", "images": {"comparison": "runs/breast-ct-claude-agentic-itnet-v3-search-20260703-01/iterations/iter-0006/comparison.png", "test_showcase": null, "valtest_showcase": null}, "iter": 6, "kept": true, "metrics": {"headroom": 0.8385718568523992, "headroom_std": 0.016346277305685348, "val_psnr": 52.16461181640625, "val_psnr_std": 1.4469016852606553, "val_rmse": 0.0008417321369051933, "val_rmse_std": 0.0001357810673671957, "val_ssim": 0.9980659484863281, "val_ssim_std": 0.0006062043199324832}, "model": "claude-opus-4-8-1m", "obs_path": "breast-ct-claude-agentic-itnet-v3-search-20260703-01/iterations/iter-0006/observation.json", "obs_sha1": "34871251d1fa2606934ccfe307cbf409dab0cef9", "params_M": 8.317706, "params_source": "observation", "rationale": "itnet_v3-claude-agentic: itnet_k=2, unet_c=24, alpha_init=0.0025734, lr=0.00021567, epochs=4, batch_size=2, train_n=2400, val_n=200, grad_clip=1.0, max_train_s=1050, seed=42, rationale=iter-6 (breast-ct redo, search-20260703-01). ONE KNOB: epochs 3 -> 4 at unet_c=24 (all else = iter-5 exactly: itnet_k=2, unet_c=24, alpha_init=0.0025734, lr=2.16e-4, batch_size=2, train_n=2400, val_n=200, grad_clip=1.0, seed=42). SIX-BOX (NUMBERS): (1) iter-3 (c16/ep5/k2/n2400): 0.8277 = prior best, 877s. iter-4 (c16/ep3/k3): 0.7946 regress. iter-5 (c24/ep3/k2/n2400): 0.8269, SSIM 0.9977, PSNR 51.56, params 8.32M, elapsed 745.0s=12.4min. (2) FAILURE MODE: c=24 at 3 epochs TIED c=16 at 5 epochs (0.8269 vs 0.8277, within noise) -> the added capacity did NOT pay off, but iter-5 gave the bigger net only 3 epochs AND finished in just 12.4min (7.6min budget headroom -- the c-scaling is cheap because the k=2 projector DC steps dominate per-forward and are flat in c). So the c=24 net is likely UNDER-TRAINED at ep3, not capacity-useless. (3) ONE KNOB: epochs 3 -> 4 at c=24 (+33pct gradient steps to properly train the 8.3M-param denoiser; c/k/train_n all held so any hr change isolates whether capacity pays off WHEN adequately trained). (4) HYPOTHESIS: c=24 at ep4 lifts hr above 0.8277 because the bigger denoiser needed more than 3 epochs to exploit its extra channels. FALSIFIER (NUMBERS): if hr <= 0.8277 at c24/ep4, the c=16 champion is genuinely capacity-sufficient on this breast val set -> iter-7 reverts to the c16/ep5 champion and pivots to a training-recipe lever (lr or alpha_init), abandoning the capacity axis. (5) BUDGET (HARD 20min=1200s): iter-5 (c24/ep3/n2400)=745.0s. Per-epoch@c24/n2400 ~= (745-130 fixed)/3 ~= 205s; fixed ~130s. At ep4: 130 + 4*205 = 950s = 15.8min < 1200s with ~4min margin. ep5 (~1155s=19.3min) is tight; ep4 is the safe next step. max_train_s=1050 fences the TRAIN phase; a finite val+figure land inside the 30-min sbatch wall. train_n=2400 (<= OOM-safe cap). val=200 distinct val_truth.h5 cases, 256px inscribed-circle FOV (breast default). (6) do NOT return control mid-campaign; gate on iter-6 numeric-headroom obs via iter_wait.sh v3 then dispatch iter-7.", "run_id": "breast-ct-claude-agentic-itnet-v3-search-20260703-01", "runtime": {"elapsed_s": 759.8418333530426}, "schema_version": 3, "solver_key": "itnet-v3", "solver_name": "ITNet v3", "split": {"train_n": 400, "val_n": 200}, "status": "keep", "ts": "2026-07-04T11:23:38Z"}
{"advice_for_others": "itnet_v3-claude-agentic: itnet_k=2, unet_c=24, alpha_init=0.0025734, lr=0.00021567, epochs=5, batch_size=2, train_n=2400, val_n=200, grad_clip=1.0, max_train_s=1080, seed=42, rationale=iter-7 (breast-ct redo, search-20260703-01). ONE KNOB: epochs 4 -> 5 at unet_c=24 (all else = iter-6 exactly: itnet_k=2, unet_c=24, alpha_init=0.0025734, lr=2.16e-4, batch_size=2, train_n=2400, val_n=200, grad_clip=1.0, seed=42). SIX-BOX (NUMBERS): (1) iter-3 (c16/ep5): 0.8277. iter-5 (c24/ep3): 0.8269. iter-6 (c24/ep4): 0.8385 = NEW BEST, SSIM 0.9981, PSNR 52.16, params 8.32M, elapsed 759.8s=12.7min. (2) FAILURE MODE / signal: capacity PAYS OFF once trained -- c24/ep3->ep4 gave +0.0116 (0.8269->0.8385) and beat the c16/ep5 champion by +0.011. The epochs lever is STILL climbing at c=24 (unlike c=16 where ep4->5 gave only +0.008). iter-6 used just 12.7/20min -> ~7min budget headroom for another epoch. (3) ONE KNOB: epochs 4 -> 5 at c=24 (+25pct gradient steps; c/k/train_n held so any hr change isolates whether the c=24 net is still under-trained at ep4). (4) HYPOTHESIS: c=24 at ep5 lifts hr above 0.8385 because the 8.3M-param denoiser was still improving from ep3->4 and has not yet plateaued. FALSIFIER (NUMBERS): if hr <= 0.8385 at c24/ep5, the c=24 net has converged at ep4 -> iter-8 pivots the lever to MORE capacity (unet_c 24->32) rather than epochs. (5) BUDGET (HARD 20min=1200s): iter-6 (c24/ep4/n2400)=759.8s. Per-epoch@c24/n2400 ~= (760-130 fixed)/4 ~= 158s; fixed ~130s. At ep5: 130 + 5*158 = 920s = 15.3min < 1200s with ~5min margin. max_train_s=1080 fences the TRAIN phase; a finite val+figure land inside the 30-min sbatch wall. train_n=2400 (<= OOM-safe cap). val=200 distinct val_truth.h5 cases, 256px inscribed-circle FOV (breast default). (6) do NOT return control mid-campaign; gate on iter-7 numeric-headroom obs via iter_wait.sh v3 then dispatch iter-8.", "agent": "itnet_v3-claude-agentic", "campaign": "search-20260703-01", "cfg_full": {"alpha_init": 0.0025734, "batch_size": 2, "epochs": 5, "grad_clip": 1.0, "itnet_k": 2, "lr": 0.00021567, "max_train_s": 1080, "rationale": "iter-7 (breast-ct redo, search-20260703-01). ONE KNOB: epochs 4 -> 5 at unet_c=24 (all else = iter-6 exactly: itnet_k=2, unet_c=24, alpha_init=0.0025734, lr=2.16e-4, batch_size=2, train_n=2400, val_n=200, grad_clip=1.0, seed=42). SIX-BOX (NUMBERS): (1) iter-3 (c16/ep5): 0.8277. iter-5 (c24/ep3): 0.8269. iter-6 (c24/ep4): 0.8385 = NEW BEST, SSIM 0.9981, PSNR 52.16, params 8.32M, elapsed 759.8s=12.7min. (2) FAILURE MODE / signal: capacity PAYS OFF once trained -- c24/ep3->ep4 gave +0.0116 (0.8269->0.8385) and beat the c16/ep5 champion by +0.011. The epochs lever is STILL climbing at c=24 (unlike c=16 where ep4->5 gave only +0.008). iter-6 used just 12.7/20min -> ~7min budget headroom for another epoch. (3) ONE KNOB: epochs 4 -> 5 at c=24 (+25pct gradient steps; c/k/train_n held so any hr change isolates whether the c=24 net is still under-trained at ep4). (4) HYPOTHESIS: c=24 at ep5 lifts hr above 0.8385 because the 8.3M-param denoiser was still improving from ep3->4 and has not yet plateaued. FALSIFIER (NUMBERS): if hr <= 0.8385 at c24/ep5, the c=24 net has converged at ep4 -> iter-8 pivots the lever to MORE capacity (unet_c 24->32) rather than epochs. (5) BUDGET (HARD 20min=1200s): iter-6 (c24/ep4/n2400)=759.8s. Per-epoch@c24/n2400 ~= (760-130 fixed)/4 ~= 158s; fixed ~130s. At ep5: 130 + 5*158 = 920s = 15.3min < 1200s with ~5min margin. max_train_s=1080 fences the TRAIN phase; a finite val+figure land inside the 30-min sbatch wall. train_n=2400 (<= OOM-safe cap). val=200 distinct val_truth.h5 cases, 256px inscribed-circle FOV (breast default). (6) do NOT return control mid-campaign; gate on iter-7 numeric-headroom obs via iter_wait.sh v3 then dispatch iter-8.", "seed": 42, "train_n": 2400, "unet_c": 24, "val_n": 200}, "challenge": "breast_ct", "change_class": "architecture", "git_commit": "671da566", "images": {"comparison": "runs/breast-ct-claude-agentic-itnet-v3-search-20260703-01/iterations/iter-0007/comparison.png", "test_showcase": null, "valtest_showcase": null}, "iter": 7, "kept": true, "metrics": {"headroom": 0.8469261441011989, "headroom_std": 0.01657516232768816, "val_psnr": 52.62617492675781, "val_psnr_std": 1.5194527757678506, "val_rmse": 0.0007981705130077899, "val_rmse_std": 0.00013425672814929848, "val_ssim": 0.998254656791687, "val_ssim_std": 0.000575984114408986}, "model": "claude-opus-4-8-1m", "obs_path": "breast-ct-claude-agentic-itnet-v3-search-20260703-01/iterations/iter-0007/observation.json", "obs_sha1": "fae43ccc4c5f367bda97a86ea204c45842b04658", "params_M": 8.317706, "params_source": "observation", "rationale": "itnet_v3-claude-agentic: itnet_k=2, unet_c=24, alpha_init=0.0025734, lr=0.00021567, epochs=5, batch_size=2, train_n=2400, val_n=200, grad_clip=1.0, max_train_s=1080, seed=42, rationale=iter-7 (breast-ct redo, search-20260703-01). ONE KNOB: epochs 4 -> 5 at unet_c=24 (all else = iter-6 exactly: itnet_k=2, unet_c=24, alpha_init=0.0025734, lr=2.16e-4, batch_size=2, train_n=2400, val_n=200, grad_clip=1.0, seed=42). SIX-BOX (NUMBERS): (1) iter-3 (c16/ep5): 0.8277. iter-5 (c24/ep3): 0.8269. iter-6 (c24/ep4): 0.8385 = NEW BEST, SSIM 0.9981, PSNR 52.16, params 8.32M, elapsed 759.8s=12.7min. (2) FAILURE MODE / signal: capacity PAYS OFF once trained -- c24/ep3->ep4 gave +0.0116 (0.8269->0.8385) and beat the c16/ep5 champion by +0.011. The epochs lever is STILL climbing at c=24 (unlike c=16 where ep4->5 gave only +0.008). iter-6 used just 12.7/20min -> ~7min budget headroom for another epoch. (3) ONE KNOB: epochs 4 -> 5 at c=24 (+25pct gradient steps; c/k/train_n held so any hr change isolates whether the c=24 net is still under-trained at ep4). (4) HYPOTHESIS: c=24 at ep5 lifts hr above 0.8385 because the 8.3M-param denoiser was still improving from ep3->4 and has not yet plateaued. FALSIFIER (NUMBERS): if hr <= 0.8385 at c24/ep5, the c=24 net has converged at ep4 -> iter-8 pivots the lever to MORE capacity (unet_c 24->32) rather than epochs. (5) BUDGET (HARD 20min=1200s): iter-6 (c24/ep4/n2400)=759.8s. Per-epoch@c24/n2400 ~= (760-130 fixed)/4 ~= 158s; fixed ~130s. At ep5: 130 + 5*158 = 920s = 15.3min < 1200s with ~5min margin. max_train_s=1080 fences the TRAIN phase; a finite val+figure land inside the 30-min sbatch wall. train_n=2400 (<= OOM-safe cap). val=200 distinct val_truth.h5 cases, 256px inscribed-circle FOV (breast default). (6) do NOT return control mid-campaign; gate on iter-7 numeric-headroom obs via iter_wait.sh v3 then dispatch iter-8.", "run_id": "breast-ct-claude-agentic-itnet-v3-search-20260703-01", "runtime": {"elapsed_s": 939.5483920574188}, "schema_version": 3, "solver_key": "itnet-v3", "solver_name": "ITNet v3", "split": {"train_n": 400, "val_n": 200}, "status": "keep", "ts": "2026-07-04T13:25:30Z"}
{"advice_for_others": "itnet_v3-claude-agentic: itnet_k=2, unet_c=32, alpha_init=0.0025734, lr=0.00021567, epochs=3, batch_size=2, train_n=2400, val_n=200, grad_clip=1.0, max_train_s=1050, seed=42, rationale=iter-8 (breast-ct redo, search-20260703-01). ONE KNOB (ARCHITECTURE): unet_c 24 -> 32 (MORE denoiser capacity), epochs traded DOWN 5 -> 3 to fund the bigger net inside the HARD 20-min wall. All else = iter-7 exactly (itnet_k=2, alpha_init=0.0025734, lr=2.16e-4, batch_size=2, train_n=2400, val_n=200, grad_clip=1.0, seed=42). SIX-BOX (NUMBERS): (1) iter-5 (c24/ep3): 0.8269. iter-6 (c24/ep4): 0.8385. iter-7 (c24/ep5): 0.8469=NEW BEST, SSIM 0.9983, PSNR 52.63, params 8.32M, elapsed 939.5s=15.7min. (2) SIGNAL: c=24 epochs lever still climbing (ep3->4 +0.0116, ep4->5 +0.0084) but iter-7 used 15.7/20min -> ~1 more epoch fits at c=24. Capacity (c16->c24) has been the dominant productive axis. Test whether MORE capacity (c=32) raises the ceiling further. (3) ONE KNOB: unet_c 24->32 (params 8.32M->~14.7M, UNet conv FLOPs x1.78 vs c24). epochs 5->3 funds it; k/train_n held. (4) HYPOTHESIS: c=32 even at 3 epochs lands within noise of or above c24/ep5=0.8469, signalling headroom to train it further. FALSIFIER: if hr < ~0.835 at c32/ep3 (below c24/ep4=0.8385), the bigger net is too under-trained within the wall -> iter-9 reverts to c24/ep5 champion and pivots to lr/alpha. (5) BUDGET (HARD 20min=1200s): iter-7 per-epoch@c24 ~=162s. c32 UNet share x1.78, projector flat -> per-epoch@c32 ~=200s, fixed ~140s. ep3: 140+3*200=740s=12.3min<1200s. max_train_s=1050 fences TRAIN phase. train_n=2400 (OOM-safe; FBP precompute flat in c; ~14.7M params fine on 24GB). val=200 distinct val_truth.h5 cases, 256px inscribed-circle FOV (breast default). (6) do NOT return control mid-campaign; gate iter-8 obs via iter_wait.sh v3 then dispatch iter-9.", "agent": "itnet_v3-claude-agentic", "campaign": "search-20260703-01", "cfg_full": {"alpha_init": 0.0025734, "batch_size": 2, "epochs": 3, "grad_clip": 1.0, "itnet_k": 2, "lr": 0.00021567, "max_train_s": 1050, "rationale": "iter-8 (breast-ct redo, search-20260703-01). ONE KNOB (ARCHITECTURE): unet_c 24 -> 32 (MORE denoiser capacity), epochs traded DOWN 5 -> 3 to fund the bigger net inside the HARD 20-min wall. All else = iter-7 exactly (itnet_k=2, alpha_init=0.0025734, lr=2.16e-4, batch_size=2, train_n=2400, val_n=200, grad_clip=1.0, seed=42). SIX-BOX (NUMBERS): (1) iter-5 (c24/ep3): 0.8269. iter-6 (c24/ep4): 0.8385. iter-7 (c24/ep5): 0.8469=NEW BEST, SSIM 0.9983, PSNR 52.63, params 8.32M, elapsed 939.5s=15.7min. (2) SIGNAL: c=24 epochs lever still climbing (ep3->4 +0.0116, ep4->5 +0.0084) but iter-7 used 15.7/20min -> ~1 more epoch fits at c=24. Capacity (c16->c24) has been the dominant productive axis. Test whether MORE capacity (c=32) raises the ceiling further. (3) ONE KNOB: unet_c 24->32 (params 8.32M->~14.7M, UNet conv FLOPs x1.78 vs c24). epochs 5->3 funds it; k/train_n held. (4) HYPOTHESIS: c=32 even at 3 epochs lands within noise of or above c24/ep5=0.8469, signalling headroom to train it further. FALSIFIER: if hr < ~0.835 at c32/ep3 (below c24/ep4=0.8385), the bigger net is too under-trained within the wall -> iter-9 reverts to c24/ep5 champion and pivots to lr/alpha. (5) BUDGET (HARD 20min=1200s): iter-7 per-epoch@c24 ~=162s. c32 UNet share x1.78, projector flat -> per-epoch@c32 ~=200s, fixed ~140s. ep3: 140+3*200=740s=12.3min<1200s. max_train_s=1050 fences TRAIN phase. train_n=2400 (OOM-safe; FBP precompute flat in c; ~14.7M params fine on 24GB). val=200 distinct val_truth.h5 cases, 256px inscribed-circle FOV (breast default). (6) do NOT return control mid-campaign; gate iter-8 obs via iter_wait.sh v3 then dispatch iter-9.", "seed": 42, "train_n": 2400, "unet_c": 32, "val_n": 200}, "challenge": "breast_ct", "change_class": "architecture", "git_commit": "671da566", "images": {"comparison": "runs/breast-ct-claude-agentic-itnet-v3-search-20260703-01/iterations/iter-0008/comparison.png", "test_showcase": null, "valtest_showcase": null}, "iter": 8, "kept": true, "metrics": {"headroom": 0.8084669833836552, "headroom_std": 0.015397849747494592, "val_psnr": 50.6793212890625, "val_psnr_std": 1.248713236809001, "val_rmse": 0.0009987074881792068, "val_rmse_std": 0.00013922710306927752, "val_ssim": 0.9971915483474731, "val_ssim_std": 0.0007568101788261388}, "model": "claude-opus-4-8-1m", "obs_path": "breast-ct-claude-agentic-itnet-v3-search-20260703-01/iterations/iter-0008/observation.json", "obs_sha1": "79a35b2ec17c41084d5f35794aa2a5e7fb0fb541", "params_M": 14.782562, "params_source": "observation", "rationale": "itnet_v3-claude-agentic: itnet_k=2, unet_c=32, alpha_init=0.0025734, lr=0.00021567, epochs=3, batch_size=2, train_n=2400, val_n=200, grad_clip=1.0, max_train_s=1050, seed=42, rationale=iter-8 (breast-ct redo, search-20260703-01). ONE KNOB (ARCHITECTURE): unet_c 24 -> 32 (MORE denoiser capacity), epochs traded DOWN 5 -> 3 to fund the bigger net inside the HARD 20-min wall. All else = iter-7 exactly (itnet_k=2, alpha_init=0.0025734, lr=2.16e-4, batch_size=2, train_n=2400, val_n=200, grad_clip=1.0, seed=42). SIX-BOX (NUMBERS): (1) iter-5 (c24/ep3): 0.8269. iter-6 (c24/ep4): 0.8385. iter-7 (c24/ep5): 0.8469=NEW BEST, SSIM 0.9983, PSNR 52.63, params 8.32M, elapsed 939.5s=15.7min. (2) SIGNAL: c=24 epochs lever still climbing (ep3->4 +0.0116, ep4->5 +0.0084) but iter-7 used 15.7/20min -> ~1 more epoch fits at c=24. Capacity (c16->c24) has been the dominant productive axis. Test whether MORE capacity (c=32) raises the ceiling further. (3) ONE KNOB: unet_c 24->32 (params 8.32M->~14.7M, UNet conv FLOPs x1.78 vs c24). epochs 5->3 funds it; k/train_n held. (4) HYPOTHESIS: c=32 even at 3 epochs lands within noise of or above c24/ep5=0.8469, signalling headroom to train it further. FALSIFIER: if hr < ~0.835 at c32/ep3 (below c24/ep4=0.8385), the bigger net is too under-trained within the wall -> iter-9 reverts to c24/ep5 champion and pivots to lr/alpha. (5) BUDGET (HARD 20min=1200s): iter-7 per-epoch@c24 ~=162s. c32 UNet share x1.78, projector flat -> per-epoch@c32 ~=200s, fixed ~140s. ep3: 140+3*200=740s=12.3min<1200s. max_train_s=1050 fences TRAIN phase. train_n=2400 (OOM-safe; FBP precompute flat in c; ~14.7M params fine on 24GB). val=200 distinct val_truth.h5 cases, 256px inscribed-circle FOV (breast default). (6) do NOT return control mid-campaign; gate iter-8 obs via iter_wait.sh v3 then dispatch iter-9.", "run_id": "breast-ct-claude-agentic-itnet-v3-search-20260703-01", "runtime": {"elapsed_s": 819.5407400131226}, "schema_version": 3, "solver_key": "itnet-v3", "solver_name": "ITNet v3", "split": {"train_n": 400, "val_n": 200}, "status": "keep", "ts": "2026-07-04T19:27:25Z"}
