{"advice_for_others": "naf-claude-agentic: val_n=12, naf_n_freqs=8, naf_hidden=128, naf_layers=4, naf_n_iter=8000, naf_lr=0.01, naf_tv_weight=0.001, naf_n_clip=0.05, naf_outer_wall_s=800, naf_per_scene_s=60.0, naf_encoding=fourier, seed=42, rationale=iter-8 breast-ct-claude-agentic-naf-search-20260703-01 (redone breast split train3600/val200/test200 seed20260703; val_n=12 CONSTANT for iters 2-20 per coordinator budget intervention 2026-07-05 -- first-12 of the 200-case breast val split, deterministic). SIX-BOX: (1) prior result: all iters so far hr=0 (iter-1 val_n=20 ssim0.355 PSNR6.26 in 970s, NOT a timeout -- a genuine converged fit). (2) failure mode: NAF per-scene INR recon is far below the 128-view breast LD-FBP baseline. (3) ONE knob changed: naf_tv_weight 1e-4->1e-3. (4) hypothesis: iter-7 (tv=0) hr=0. KNOB: raise TV 1e-4->1e-3 (stronger denoising). HYPOTHESIS: opposite bet -- the raw NAF recon is noisy (ssim0.35, PSNR6.26 very low), maybe heavy TV cleans it toward baseline. Expect hr=0; TV cannot manufacture the missing structure. (5) wall: val_n=12 x per_scene 60.0s = ~720s < 20min. (6) serial, no user return.", "agent": "naf-claude-agentic", "campaign": "search-20260703-01", "cfg_full": {"naf_encoding": "fourier", "naf_hidden": 128, "naf_layers": 4, "naf_lr": 0.01, "naf_n_clip": 0.05, "naf_n_freqs": 8, "naf_n_iter": 8000, "naf_outer_wall_s": 800, "naf_per_scene_s": 60.0, "naf_tv_weight": 0.001, "rationale": "iter-8 breast-ct-claude-agentic-naf-search-20260703-01 (redone breast split train3600/val200/test200 seed20260703; val_n=12 CONSTANT for iters 2-20 per coordinator budget intervention 2026-07-05 -- first-12 of the 200-case breast val split, deterministic). SIX-BOX: (1) prior result: all iters so far hr=0 (iter-1 val_n=20 ssim0.355 PSNR6.26 in 970s, NOT a timeout -- a genuine converged fit). (2) failure mode: NAF per-scene INR recon is far below the 128-view breast LD-FBP baseline. (3) ONE knob changed: naf_tv_weight 1e-4->1e-3. (4) hypothesis: iter-7 (tv=0) hr=0. KNOB: raise TV 1e-4->1e-3 (stronger denoising). HYPOTHESIS: opposite bet -- the raw NAF recon is noisy (ssim0.35, PSNR6.26 very low), maybe heavy TV cleans it toward baseline. Expect hr=0; TV cannot manufacture the missing structure. (5) wall: val_n=12 x per_scene 60.0s = ~720s < 20min. (6) serial, no user return.", "seed": 42, "val_n": 12}, "challenge": "breast_ct", "change_class": "architecture", "git_commit": "671da566", "images": {"comparison": "runs/breast-ct-claude-agentic-naf-search-20260703-01/iterations/iter-0008/comparison.png", "test_showcase": null, "valtest_showcase": null}, "iter": 8, "kept": false, "metrics": {"headroom": 0.0, "headroom_std": 0.0, "val_psnr": 6.2663893699646, "val_psnr_std": 0.2078534710795732, "val_rmse": 0.1596093773841858, "val_rmse_std": 0.0016800014389741125, "val_ssim": 0.35450929403305054, "val_ssim_std": 0.0001269633100316407}, "model": "claude-opus-4-8-1m", "obs_path": "breast-ct-claude-agentic-naf-search-20260703-01/iterations/iter-0008/observation.json", "obs_sha1": "40eac9d107cb7f03296bfa02344988017708ffc9", "params_M": 0.037633, "params_source": "observation", "rationale": "naf-claude-agentic: val_n=12, naf_n_freqs=8, naf_hidden=128, naf_layers=4, naf_n_iter=8000, naf_lr=0.01, naf_tv_weight=0.001, naf_n_clip=0.05, naf_outer_wall_s=800, naf_per_scene_s=60.0, naf_encoding=fourier, seed=42, rationale=iter-8 breast-ct-claude-agentic-naf-search-20260703-01 (redone breast split train3600/val200/test200 seed20260703; val_n=12 CONSTANT for iters 2-20 per coordinator budget intervention 2026-07-05 -- first-12 of the 200-case breast val split, deterministic). SIX-BOX: (1) prior result: all iters so far hr=0 (iter-1 val_n=20 ssim0.355 PSNR6.26 in 970s, NOT a timeout -- a genuine converged fit). (2) failure mode: NAF per-scene INR recon is far below the 128-view breast LD-FBP baseline. (3) ONE knob changed: naf_tv_weight 1e-4->1e-3. (4) hypothesis: iter-7 (tv=0) hr=0. KNOB: raise TV 1e-4->1e-3 (stronger denoising). HYPOTHESIS: opposite bet -- the raw NAF recon is noisy (ssim0.35, PSNR6.26 very low), maybe heavy TV cleans it toward baseline. Expect hr=0; TV cannot manufacture the missing structure. (5) wall: val_n=12 x per_scene 60.0s = ~720s < 20min. (6) serial, no user return.", "run_id": "breast-ct-claude-agentic-naf-search-20260703-01", "runtime": {"elapsed_s": 727.5877783298492}, "schema_version": 3, "solver_key": "naf", "solver_name": "NAF", "split": {"train_n": 0, "val_n": 12}, "status": "discard", "ts": "2026-07-06T02:25:24Z"}
{"advice_for_others": "naf-claude-agentic: val_n=12, naf_n_freqs=8, naf_hidden=128, naf_layers=4, naf_n_iter=8000, naf_lr=0.01, naf_tv_weight=0.0001, naf_n_clip=0.05, naf_outer_wall_s=1150, naf_per_scene_s=90.0, naf_encoding=fourier, seed=42, rationale=iter-9 breast-ct-claude-agentic-naf-search-20260703-01 (redone breast split train3600/val200/test200 seed20260703; val_n=12 CONSTANT for iters 2-20 per coordinator budget intervention 2026-07-05 -- first-12 of the 200-case breast val split, deterministic). SIX-BOX: (1) prior result: all iters so far hr=0 (iter-1 val_n=20 ssim0.355 PSNR6.26 in 970s, NOT a timeout -- a genuine converged fit). (2) failure mode: NAF per-scene INR recon is far below the 128-view breast LD-FBP baseline. (3) ONE knob changed: per_scene 60->90 (deeper fit, in-budget). (4) hypothesis: iters 7-8 (TV sweep) hr=0. KNOB: raise per-scene fit budget 60->90s (12*90=1080s ~18min, in-budget) so each scene runs MORE Adam steps -> lower data-fit loss. HYPOTHESIS: if the hr=0 were step-starvation the deeper fit would lift it; it will not (loss floor is basis-limited). This isolates convergence from the basis ceiling for the fourier path. (5) wall: val_n=12 x per_scene 90.0s = ~1080s < 20min. (6) serial, no user return.", "agent": "naf-claude-agentic", "campaign": "search-20260703-01", "cfg_full": {"naf_encoding": "fourier", "naf_hidden": 128, "naf_layers": 4, "naf_lr": 0.01, "naf_n_clip": 0.05, "naf_n_freqs": 8, "naf_n_iter": 8000, "naf_outer_wall_s": 1150, "naf_per_scene_s": 90.0, "naf_tv_weight": 0.0001, "rationale": "iter-9 breast-ct-claude-agentic-naf-search-20260703-01 (redone breast split train3600/val200/test200 seed20260703; val_n=12 CONSTANT for iters 2-20 per coordinator budget intervention 2026-07-05 -- first-12 of the 200-case breast val split, deterministic). SIX-BOX: (1) prior result: all iters so far hr=0 (iter-1 val_n=20 ssim0.355 PSNR6.26 in 970s, NOT a timeout -- a genuine converged fit). (2) failure mode: NAF per-scene INR recon is far below the 128-view breast LD-FBP baseline. (3) ONE knob changed: per_scene 60->90 (deeper fit, in-budget). (4) hypothesis: iters 7-8 (TV sweep) hr=0. KNOB: raise per-scene fit budget 60->90s (12*90=1080s ~18min, in-budget) so each scene runs MORE Adam steps -> lower data-fit loss. HYPOTHESIS: if the hr=0 were step-starvation the deeper fit would lift it; it will not (loss floor is basis-limited). This isolates convergence from the basis ceiling for the fourier path. (5) wall: val_n=12 x per_scene 90.0s = ~1080s < 20min. (6) serial, no user return.", "seed": 42, "val_n": 12}, "challenge": "breast_ct", "change_class": "architecture", "git_commit": "671da566", "images": {"comparison": "runs/breast-ct-claude-agentic-naf-search-20260703-01/iterations/iter-0009/comparison.png", "test_showcase": null, "valtest_showcase": null}, "iter": 9, "kept": false, "metrics": {"headroom": 0.0, "headroom_std": 0.0, "val_psnr": 6.2663893699646, "val_psnr_std": 0.2078534710795732, "val_rmse": 0.1596093773841858, "val_rmse_std": 0.0016800014389741125, "val_ssim": 0.35450929403305054, "val_ssim_std": 0.0001269633100316407}, "model": "claude-opus-4-8-1m", "obs_path": "breast-ct-claude-agentic-naf-search-20260703-01/iterations/iter-0009/observation.json", "obs_sha1": "ce15ea8312e5abdf85f65251bc3b6ab103e631a0", "params_M": 0.037633, "params_source": "observation", "rationale": "naf-claude-agentic: val_n=12, naf_n_freqs=8, naf_hidden=128, naf_layers=4, naf_n_iter=8000, naf_lr=0.01, naf_tv_weight=0.0001, naf_n_clip=0.05, naf_outer_wall_s=1150, naf_per_scene_s=90.0, naf_encoding=fourier, seed=42, rationale=iter-9 breast-ct-claude-agentic-naf-search-20260703-01 (redone breast split train3600/val200/test200 seed20260703; val_n=12 CONSTANT for iters 2-20 per coordinator budget intervention 2026-07-05 -- first-12 of the 200-case breast val split, deterministic). SIX-BOX: (1) prior result: all iters so far hr=0 (iter-1 val_n=20 ssim0.355 PSNR6.26 in 970s, NOT a timeout -- a genuine converged fit). (2) failure mode: NAF per-scene INR recon is far below the 128-view breast LD-FBP baseline. (3) ONE knob changed: per_scene 60->90 (deeper fit, in-budget). (4) hypothesis: iters 7-8 (TV sweep) hr=0. KNOB: raise per-scene fit budget 60->90s (12*90=1080s ~18min, in-budget) so each scene runs MORE Adam steps -> lower data-fit loss. HYPOTHESIS: if the hr=0 were step-starvation the deeper fit would lift it; it will not (loss floor is basis-limited). This isolates convergence from the basis ceiling for the fourier path. (5) wall: val_n=12 x per_scene 90.0s = ~1080s < 20min. (6) serial, no user return.", "run_id": "breast-ct-claude-agentic-naf-search-20260703-01", "runtime": {"elapsed_s": 1093.8983843326569}, "schema_version": 3, "solver_key": "naf", "solver_name": "NAF", "split": {"train_n": 0, "val_n": 12}, "status": "discard", "ts": "2026-07-06T03:31:52Z"}
{"advice_for_others": "naf-claude-agentic: val_n=12, naf_n_freqs=8, naf_hidden=128, naf_layers=4, naf_n_iter=8000, naf_lr=0.01, naf_tv_weight=0.0001, naf_n_clip=0.08, naf_outer_wall_s=800, naf_per_scene_s=60.0, naf_encoding=fourier, seed=42, rationale=iter-10 breast-ct-claude-agentic-naf-search-20260703-01 (redone breast split train3600/val200/test200 seed20260703; val_n=12 CONSTANT for iters 2-20 per coordinator budget intervention 2026-07-05 -- first-12 of the 200-case breast val split, deterministic). SIX-BOX: (1) prior result: all iters so far hr=0 (iter-1 val_n=20 ssim0.355 PSNR6.26 in 970s, NOT a timeout -- a genuine converged fit). (2) failure mode: NAF per-scene INR recon is far below the 128-view breast LD-FBP baseline. (3) ONE knob changed: naf_n_clip 0.05->0.08. (4) hypothesis: KNOB: raise sigmoid-head out_scale 0.05->0.08 (wider mu range for bone/dense tissue in breast, mu can exceed 0.05). HYPOTHESIS: if the head saturates dense-tissue mu at the 0.05 cap, widening it recovers HU contrast -> better RMSE. Expect hr=0 but a real head-range test. (5) wall: val_n=12 x per_scene 60.0s = ~720s < 20min. (6) serial, no user return.", "agent": "naf-claude-agentic", "campaign": "search-20260703-01", "cfg_full": {"naf_encoding": "fourier", "naf_hidden": 128, "naf_layers": 4, "naf_lr": 0.01, "naf_n_clip": 0.08, "naf_n_freqs": 8, "naf_n_iter": 8000, "naf_outer_wall_s": 800, "naf_per_scene_s": 60.0, "naf_tv_weight": 0.0001, "rationale": "iter-10 breast-ct-claude-agentic-naf-search-20260703-01 (redone breast split train3600/val200/test200 seed20260703; val_n=12 CONSTANT for iters 2-20 per coordinator budget intervention 2026-07-05 -- first-12 of the 200-case breast val split, deterministic). SIX-BOX: (1) prior result: all iters so far hr=0 (iter-1 val_n=20 ssim0.355 PSNR6.26 in 970s, NOT a timeout -- a genuine converged fit). (2) failure mode: NAF per-scene INR recon is far below the 128-view breast LD-FBP baseline. (3) ONE knob changed: naf_n_clip 0.05->0.08. (4) hypothesis: KNOB: raise sigmoid-head out_scale 0.05->0.08 (wider mu range for bone/dense tissue in breast, mu can exceed 0.05). HYPOTHESIS: if the head saturates dense-tissue mu at the 0.05 cap, widening it recovers HU contrast -> better RMSE. Expect hr=0 but a real head-range test. (5) wall: val_n=12 x per_scene 60.0s = ~720s < 20min. (6) serial, no user return.", "seed": 42, "val_n": 12}, "challenge": "breast_ct", "change_class": "architecture", "git_commit": "671da566", "images": {"comparison": "runs/breast-ct-claude-agentic-naf-search-20260703-01/iterations/iter-0010/comparison.png", "test_showcase": null, "valtest_showcase": null}, "iter": 10, "kept": false, "metrics": {"headroom": 0.0, "headroom_std": 0.0, "val_psnr": 20.178760528564453, "val_psnr_std": 3.424076148157591, "val_rmse": 0.0321691669523716, "val_rmse_std": 0.009822502199835447, "val_ssim": 0.5064835548400879, "val_ssim_std": 0.08897729313156413}, "model": "claude-opus-4-8-1m", "obs_path": "breast-ct-claude-agentic-naf-search-20260703-01/iterations/iter-0010/observation.json", "obs_sha1": "cd9ed306dd4c2f6225fdd397aef0f500c6593894", "params_M": 0.037633, "params_source": "observation", "rationale": "naf-claude-agentic: val_n=12, naf_n_freqs=8, naf_hidden=128, naf_layers=4, naf_n_iter=8000, naf_lr=0.01, naf_tv_weight=0.0001, naf_n_clip=0.08, naf_outer_wall_s=800, naf_per_scene_s=60.0, naf_encoding=fourier, seed=42, rationale=iter-10 breast-ct-claude-agentic-naf-search-20260703-01 (redone breast split train3600/val200/test200 seed20260703; val_n=12 CONSTANT for iters 2-20 per coordinator budget intervention 2026-07-05 -- first-12 of the 200-case breast val split, deterministic). SIX-BOX: (1) prior result: all iters so far hr=0 (iter-1 val_n=20 ssim0.355 PSNR6.26 in 970s, NOT a timeout -- a genuine converged fit). (2) failure mode: NAF per-scene INR recon is far below the 128-view breast LD-FBP baseline. (3) ONE knob changed: naf_n_clip 0.05->0.08. (4) hypothesis: KNOB: raise sigmoid-head out_scale 0.05->0.08 (wider mu range for bone/dense tissue in breast, mu can exceed 0.05). HYPOTHESIS: if the head saturates dense-tissue mu at the 0.05 cap, widening it recovers HU contrast -> better RMSE. Expect hr=0 but a real head-range test. (5) wall: val_n=12 x per_scene 60.0s = ~720s < 20min. (6) serial, no user return.", "run_id": "breast-ct-claude-agentic-naf-search-20260703-01", "runtime": {"elapsed_s": 735.175496339798}, "schema_version": 3, "solver_key": "naf", "solver_name": "NAF", "split": {"train_n": 0, "val_n": 12}, "status": "discard", "ts": "2026-07-06T04:25:46Z"}
{"advice_for_others": "naf-claude-agentic: val_n=12, naf_n_freqs=8, naf_hidden=64, naf_layers=3, naf_n_iter=8000, naf_lr=0.01, naf_tv_weight=0.0001, naf_n_clip=0.05, naf_outer_wall_s=800, naf_per_scene_s=60.0, naf_encoding=hash, seed=42, rationale=iter-11 breast-ct-claude-agentic-naf-search-20260703-01 (redone breast split train3600/val200/test200 seed20260703; val_n=12 CONSTANT for iters 2-20 per coordinator budget intervention 2026-07-05 -- first-12 of the 200-case breast val split, deterministic). SIX-BOX: (1) prior result: all iters so far hr=0 (iter-1 val_n=20 ssim0.355 PSNR6.26 in 970s, NOT a timeout -- a genuine converged fit). (2) failure mode: NAF per-scene INR recon is far below the 128-view breast LD-FBP baseline. (3) ONE knob changed: encoding fourier->hash (Instant-NGP). (4) hypothesis: iters 2-10 (fourier variants) all hr=0. KNOB: swap the encoder to the paper's Instant-NGP multi-res HASH grid + small MLP (the NAF headline contribution, chest_50.yaml). HYPOTHESIS: the hash grid represents fine local detail far better than global sin/cos posenc -- this is the single most likely change to escape the basis ceiling. If ANY config beats FBP it is this one. (5) wall: val_n=12 x per_scene 60.0s = ~720s < 20min. (6) serial, no user return.", "agent": "naf-claude-agentic", "campaign": "search-20260703-01", "cfg_full": {"naf_encoding": "hash", "naf_hidden": 64, "naf_layers": 3, "naf_lr": 0.01, "naf_n_clip": 0.05, "naf_n_freqs": 8, "naf_n_iter": 8000, "naf_outer_wall_s": 800, "naf_per_scene_s": 60.0, "naf_tv_weight": 0.0001, "rationale": "iter-11 breast-ct-claude-agentic-naf-search-20260703-01 (redone breast split train3600/val200/test200 seed20260703; val_n=12 CONSTANT for iters 2-20 per coordinator budget intervention 2026-07-05 -- first-12 of the 200-case breast val split, deterministic). SIX-BOX: (1) prior result: all iters so far hr=0 (iter-1 val_n=20 ssim0.355 PSNR6.26 in 970s, NOT a timeout -- a genuine converged fit). (2) failure mode: NAF per-scene INR recon is far below the 128-view breast LD-FBP baseline. (3) ONE knob changed: encoding fourier->hash (Instant-NGP). (4) hypothesis: iters 2-10 (fourier variants) all hr=0. KNOB: swap the encoder to the paper's Instant-NGP multi-res HASH grid + small MLP (the NAF headline contribution, chest_50.yaml). HYPOTHESIS: the hash grid represents fine local detail far better than global sin/cos posenc -- this is the single most likely change to escape the basis ceiling. If ANY config beats FBP it is this one. (5) wall: val_n=12 x per_scene 60.0s = ~720s < 20min. (6) serial, no user return.", "seed": 42, "val_n": 12}, "challenge": "breast_ct", "change_class": "architecture", "git_commit": "671da566", "images": {"comparison": "runs/breast-ct-claude-agentic-naf-search-20260703-01/iterations/iter-0011/comparison.png", "test_showcase": null, "valtest_showcase": null}, "iter": 11, "kept": false, "metrics": {"headroom": 0.0, "headroom_std": 0.0, "val_psnr": 22.05402374267578, "val_psnr_std": 0.5397032352769338, "val_rmse": 0.025922494009137154, "val_rmse_std": 0.0017522022166579644, "val_ssim": 0.8308674693107605, "val_ssim_std": 0.012778365460129944}, "model": "claude-opus-4-8-1m", "obs_path": "breast-ct-claude-agentic-naf-search-20260703-01/iterations/iter-0011/observation.json", "obs_sha1": "3e01e2465f6fa1962f4d41eca1c169be2afc9f4b", "params_M": 16.783553, "params_source": "observation", "rationale": "naf-claude-agentic: val_n=12, naf_n_freqs=8, naf_hidden=64, naf_layers=3, naf_n_iter=8000, naf_lr=0.01, naf_tv_weight=0.0001, naf_n_clip=0.05, naf_outer_wall_s=800, naf_per_scene_s=60.0, naf_encoding=hash, seed=42, rationale=iter-11 breast-ct-claude-agentic-naf-search-20260703-01 (redone breast split train3600/val200/test200 seed20260703; val_n=12 CONSTANT for iters 2-20 per coordinator budget intervention 2026-07-05 -- first-12 of the 200-case breast val split, deterministic). SIX-BOX: (1) prior result: all iters so far hr=0 (iter-1 val_n=20 ssim0.355 PSNR6.26 in 970s, NOT a timeout -- a genuine converged fit). (2) failure mode: NAF per-scene INR recon is far below the 128-view breast LD-FBP baseline. (3) ONE knob changed: encoding fourier->hash (Instant-NGP). (4) hypothesis: iters 2-10 (fourier variants) all hr=0. KNOB: swap the encoder to the paper's Instant-NGP multi-res HASH grid + small MLP (the NAF headline contribution, chest_50.yaml). HYPOTHESIS: the hash grid represents fine local detail far better than global sin/cos posenc -- this is the single most likely change to escape the basis ceiling. If ANY config beats FBP it is this one. (5) wall: val_n=12 x per_scene 60.0s = ~720s < 20min. (6) serial, no user return.", "run_id": "breast-ct-claude-agentic-naf-search-20260703-01", "runtime": {"elapsed_s": 738.0356068611145}, "schema_version": 3, "solver_key": "naf", "solver_name": "NAF", "split": {"train_n": 0, "val_n": 12}, "status": "discard", "ts": "2026-07-06T05:46:46Z"}
