{"advice_for_others": "hammernik_vn-claude-agentic: train_n=200, val_n=200, epochs=15, batch_size=2, lr=0.0003, vn_T=3, vn_n_filters=32, vn_kernel=7, vn_n_bumps=31, vn_lambda_init=0.000327, vn_init=fbp, vn_dc_norm=True, vn_checkpoint=True, max_train_s=1080, rationale=iter-1 feasibility: seed from historical breast-CT VN TPE best (T=3, filters=32, kernel=7, lr=3e-4) but on the NEW val-200 held-out split. Expect hr near the old 0.488 if the new val split behaves like the old single-patient val. max_train_s=1080 (18min) hard cap to fit 20-min budget.", "agent": "hammernik_vn-claude-agentic", "campaign": "search-20260703-01", "cfg_full": {"batch_size": 2, "epochs": 15, "lr": 0.0003, "max_train_s": 1080, "rationale": "iter-1 feasibility: seed from historical breast-CT VN TPE best (T=3, filters=32, kernel=7, lr=3e-4) but on the NEW val-200 held-out split. Expect hr near the old 0.488 if the new val split behaves like the old single-patient val. max_train_s=1080 (18min) hard cap to fit 20-min budget.", "train_n": 200, "val_n": 200, "vn_T": 3, "vn_checkpoint": true, "vn_dc_norm": true, "vn_init": "fbp", "vn_kernel": 7, "vn_lambda_init": 0.000327, "vn_n_bumps": 31, "vn_n_filters": 32}, "challenge": "breast_ct", "change_class": "architecture", "git_commit": null, "images": {"comparison": "runs/breast-ct-claude-agentic-hammernik-vn-search-20260703-01/iterations/iter-0001/comparison.png", "test_showcase": null, "valtest_showcase": null}, "iter": 1, "kept": true, "metrics": {"headroom": 0.5083374160556277, "headroom_std": 0.013523133724115875, "val_psnr": 42.490848541259766, "val_psnr_std": 0.7726859226887811, "val_rmse": 0.0025636693462729454, "val_rmse_std": 0.00022270542225490578, "val_ssim": 0.979552149772644, "val_ssim_std": 0.003299357666680047}, "model": "claude-opus-4-8-1m", "obs_path": "breast-ct-claude-agentic-hammernik-vn-search-20260703-01/iterations/iter-0001/observation.json", "obs_sha1": "6cd9cf0505e3d84d1c09f217a68bb5ede24710e3", "params_M": 0.007683, "params_source": "observation", "rationale": "hammernik_vn-claude-agentic: train_n=200, val_n=200, epochs=15, batch_size=2, lr=0.0003, vn_T=3, vn_n_filters=32, vn_kernel=7, vn_n_bumps=31, vn_lambda_init=0.000327, vn_init=fbp, vn_dc_norm=True, vn_checkpoint=True, max_train_s=1080, rationale=iter-1 feasibility: seed from historical breast-CT VN TPE best (T=3, filters=32, kernel=7, lr=3e-4) but on the NEW val-200 held-out split. Expect hr near the old 0.488 if the new val split behaves like the old single-patient val. max_train_s=1080 (18min) hard cap to fit 20-min budget.", "run_id": "breast-ct-claude-agentic-hammernik-vn-search-20260703-01", "runtime": {"elapsed_s": 1170.1514241695404}, "schema_version": 3, "solver_key": "hammernik-vn", "solver_name": "Hammernik VN (MRI port)", "split": {"train_n": 200, "val_n": 200}, "status": "keep", "ts": "2026-07-03T22:53:59Z"}
{"advice_for_others": "hammernik_vn-claude-agentic: train_n=200, val_n=200, epochs=11, batch_size=2, lr=0.0003, vn_T=4, vn_n_filters=32, vn_kernel=7, vn_n_bumps=31, vn_lambda_init=0.000327, vn_init=fbp, vn_dc_norm=True, vn_checkpoint=True, max_train_s=1080, rationale=iter-2 (one knob: vn_T 3->4). Hypothesis: deeper unroll is the VNs native capacity axis on CT (adds one DC+learned-regulariser step), so hr should rise above iter-1 0.5083. Epochs cut 15->11 to offset the +33% per-step cost and stay under the 20-min wall (iter-1 was 1170s at T=3/ep=15).", "agent": "hammernik_vn-claude-agentic", "campaign": "search-20260703-01", "cfg_full": {"batch_size": 2, "epochs": 11, "lr": 0.0003, "max_train_s": 1080, "rationale": "iter-2 (one knob: vn_T 3->4). Hypothesis: deeper unroll is the VNs native capacity axis on CT (adds one DC+learned-regulariser step), so hr should rise above iter-1 0.5083. Epochs cut 15->11 to offset the +33% per-step cost and stay under the 20-min wall (iter-1 was 1170s at T=3/ep=15).", "train_n": 200, "val_n": 200, "vn_T": 4, "vn_checkpoint": true, "vn_dc_norm": true, "vn_init": "fbp", "vn_kernel": 7, "vn_lambda_init": 0.000327, "vn_n_bumps": 31, "vn_n_filters": 32}, "challenge": "breast_ct", "change_class": "architecture", "git_commit": null, "images": {"comparison": "runs/breast-ct-claude-agentic-hammernik-vn-search-20260703-01/iterations/iter-0002/comparison.png", "test_showcase": null, "valtest_showcase": null}, "iter": 2, "kept": true, "metrics": {"headroom": 0.486130407179617, "headroom_std": 0.014184580463863231, "val_psnr": 42.107139587402344, "val_psnr_std": 0.7623103710566838, "val_rmse": 0.002679461846128106, "val_rmse_std": 0.00022952769276379705, "val_ssim": 0.9791994094848633, "val_ssim_std": 0.0034057783854325395}, "model": "claude-opus-4-8-1m", "obs_path": "breast-ct-claude-agentic-hammernik-vn-search-20260703-01/iterations/iter-0002/observation.json", "obs_sha1": "5faa0fd036ad8299ed46b51dde42482d3cdbdaa9", "params_M": 0.010244, "params_source": "observation", "rationale": "hammernik_vn-claude-agentic: train_n=200, val_n=200, epochs=11, batch_size=2, lr=0.0003, vn_T=4, vn_n_filters=32, vn_kernel=7, vn_n_bumps=31, vn_lambda_init=0.000327, vn_init=fbp, vn_dc_norm=True, vn_checkpoint=True, max_train_s=1080, rationale=iter-2 (one knob: vn_T 3->4). Hypothesis: deeper unroll is the VNs native capacity axis on CT (adds one DC+learned-regulariser step), so hr should rise above iter-1 0.5083. Epochs cut 15->11 to offset the +33% per-step cost and stay under the 20-min wall (iter-1 was 1170s at T=3/ep=15).", "run_id": "breast-ct-claude-agentic-hammernik-vn-search-20260703-01", "runtime": {"elapsed_s": 969.8182549476624}, "schema_version": 3, "solver_key": "hammernik-vn", "solver_name": "Hammernik VN (MRI port)", "split": {"train_n": 200, "val_n": 200}, "status": "keep", "ts": "2026-07-04T00:08:26Z"}
{"advice_for_others": "hammernik_vn-claude-agentic: train_n=200, val_n=200, epochs=20, batch_size=2, lr=0.0003, vn_T=3, vn_n_filters=32, vn_kernel=7, vn_n_bumps=31, vn_lambda_init=0.000327, vn_init=fbp, vn_dc_norm=True, vn_checkpoint=True, max_train_s=1080, rationale=iter-3 (one knob: epochs 15->20, back to iter-1 winner T=3). iter-2 (T=4,ep=11) fell to 0.486 vs iter-1 (T=3,ep=15) 0.508 -> the drop tracks TRAINING TIME not unroll depth. Hypothesis: iter-1 was undertrained at ep=15; more epochs on T=3 should exceed 0.508. max_train_s=1080 caps the wall (may early-stop before ep20).", "agent": "hammernik_vn-claude-agentic", "campaign": "search-20260703-01", "cfg_full": {"batch_size": 2, "epochs": 20, "lr": 0.0003, "max_train_s": 1080, "rationale": "iter-3 (one knob: epochs 15->20, back to iter-1 winner T=3). iter-2 (T=4,ep=11) fell to 0.486 vs iter-1 (T=3,ep=15) 0.508 -> the drop tracks TRAINING TIME not unroll depth. Hypothesis: iter-1 was undertrained at ep=15; more epochs on T=3 should exceed 0.508. max_train_s=1080 caps the wall (may early-stop before ep20).", "train_n": 200, "val_n": 200, "vn_T": 3, "vn_checkpoint": true, "vn_dc_norm": true, "vn_init": "fbp", "vn_kernel": 7, "vn_lambda_init": 0.000327, "vn_n_bumps": 31, "vn_n_filters": 32}, "challenge": "breast_ct", "change_class": "architecture", "git_commit": null, "images": {"comparison": "runs/breast-ct-claude-agentic-hammernik-vn-search-20260703-01/iterations/iter-0003/comparison.png", "test_showcase": null, "valtest_showcase": null}, "iter": 3, "kept": true, "metrics": {"headroom": 0.5083372411686122, "headroom_std": 0.013523097816300341, "val_psnr": 42.490848541259766, "val_psnr_std": 0.7726862129090732, "val_rmse": 0.0025636691134423018, "val_rmse_std": 0.00022270544468073932, "val_ssim": 0.979552149772644, "val_ssim_std": 0.0032993812586994734}, "model": "claude-opus-4-8-1m", "obs_path": "breast-ct-claude-agentic-hammernik-vn-search-20260703-01/iterations/iter-0003/observation.json", "obs_sha1": "e865699d10764e5462f25df06d53a0854995dbe5", "params_M": 0.007683, "params_source": "observation", "rationale": "hammernik_vn-claude-agentic: train_n=200, val_n=200, epochs=20, batch_size=2, lr=0.0003, vn_T=3, vn_n_filters=32, vn_kernel=7, vn_n_bumps=31, vn_lambda_init=0.000327, vn_init=fbp, vn_dc_norm=True, vn_checkpoint=True, max_train_s=1080, rationale=iter-3 (one knob: epochs 15->20, back to iter-1 winner T=3). iter-2 (T=4,ep=11) fell to 0.486 vs iter-1 (T=3,ep=15) 0.508 -> the drop tracks TRAINING TIME not unroll depth. Hypothesis: iter-1 was undertrained at ep=15; more epochs on T=3 should exceed 0.508. max_train_s=1080 caps the wall (may early-stop before ep20).", "run_id": "breast-ct-claude-agentic-hammernik-vn-search-20260703-01", "runtime": {"elapsed_s": 1213.8904831409454}, "schema_version": 3, "solver_key": "hammernik-vn", "solver_name": "Hammernik VN (MRI port)", "split": {"train_n": 200, "val_n": 200}, "status": "keep", "ts": "2026-07-04T07:51:53Z"}
{"advice_for_others": "hammernik_vn-claude-agentic: train_n=120, val_n=200, epochs=24, batch_size=2, lr=0.0003, vn_T=3, vn_n_filters=32, vn_kernel=7, vn_n_bumps=31, vn_lambda_init=0.000327, vn_init=fbp, vn_dc_norm=True, vn_checkpoint=True, max_train_s=1080, rationale=iter-4 (one knob: train_n 200->120). iter-1/3 both wall-capped at ep12 (train_n=200) -> identical hr 0.5083; learned lambda stayed pinned at init = regulariser underused. Hypothesis: cheaper epochs let the run finish ~20-24 real epochs under the 1080s wall, giving the filter bank + lambda more steps -> hr>0.5083. If it drops, breast VN is data-size-bound not epoch-bound.", "agent": "hammernik_vn-claude-agentic", "campaign": "search-20260703-01", "cfg_full": {"batch_size": 2, "epochs": 24, "lr": 0.0003, "max_train_s": 1080, "rationale": "iter-4 (one knob: train_n 200->120). iter-1/3 both wall-capped at ep12 (train_n=200) -> identical hr 0.5083; learned lambda stayed pinned at init = regulariser underused. Hypothesis: cheaper epochs let the run finish ~20-24 real epochs under the 1080s wall, giving the filter bank + lambda more steps -> hr>0.5083. If it drops, breast VN is data-size-bound not epoch-bound.", "train_n": 120, "val_n": 200, "vn_T": 3, "vn_checkpoint": true, "vn_dc_norm": true, "vn_init": "fbp", "vn_kernel": 7, "vn_lambda_init": 0.000327, "vn_n_bumps": 31, "vn_n_filters": 32}, "challenge": "breast_ct", "change_class": "architecture", "git_commit": "1176d9f5", "images": {"comparison": "runs/breast-ct-claude-agentic-hammernik-vn-search-20260703-01/iterations/iter-0004/comparison.png", "test_showcase": null, "valtest_showcase": null}, "iter": 4, "kept": true, "metrics": {"headroom": 0.5073794903527893, "headroom_std": 0.013183456378153033, "val_psnr": 42.47394561767578, "val_psnr_std": 0.7694383428875345, "val_rmse": 0.0025686630979180336, "val_rmse_std": 0.0002222640911968502, "val_ssim": 0.9794331192970276, "val_ssim_std": 0.003297167948110422}, "model": "claude-opus-4-8-1m", "obs_path": "breast-ct-claude-agentic-hammernik-vn-search-20260703-01/iterations/iter-0004/observation.json", "obs_sha1": "c57e521ed2c82f42d5f67d05cb6cfb93492b1093", "params_M": 0.007683, "params_source": "observation", "rationale": "hammernik_vn-claude-agentic: train_n=120, val_n=200, epochs=24, batch_size=2, lr=0.0003, vn_T=3, vn_n_filters=32, vn_kernel=7, vn_n_bumps=31, vn_lambda_init=0.000327, vn_init=fbp, vn_dc_norm=True, vn_checkpoint=True, max_train_s=1080, rationale=iter-4 (one knob: train_n 200->120). iter-1/3 both wall-capped at ep12 (train_n=200) -> identical hr 0.5083; learned lambda stayed pinned at init = regulariser underused. Hypothesis: cheaper epochs let the run finish ~20-24 real epochs under the 1080s wall, giving the filter bank + lambda more steps -> hr>0.5083. If it drops, breast VN is data-size-bound not epoch-bound.", "run_id": "breast-ct-claude-agentic-hammernik-vn-search-20260703-01", "runtime": {"elapsed_s": 1156.4476776123047}, "schema_version": 3, "solver_key": "hammernik-vn", "solver_name": "Hammernik VN (MRI port)", "split": {"train_n": 120, "val_n": 200}, "status": "keep", "ts": "2026-07-04T08:43:49Z"}
{"advice_for_others": "hammernik_vn-claude-agentic: train_n=200, val_n=200, epochs=15, batch_size=2, lr=0.0003, vn_T=3, vn_n_filters=32, vn_kernel=7, vn_n_bumps=31, vn_lambda_init=0.01, vn_init=fbp, vn_dc_norm=True, vn_checkpoint=True, max_train_s=1080, rationale=iter-5 (one knob: vn_lambda_init 3.27e-4 -> 1.0e-2, ~30x). Across iters 1/3/4 the learned lambda_t stayed frozen at its ~3.25e-4 init -> regulariser dormant, result is data-consistency-dominated, hr pinned at 0.508. Hypothesis: a larger lambda_init activates the regulariser gradient so the learned filter bank engages -> hr>0.508; if it over-smooths and drops, DC-dominance is confirmed optimal.", "agent": "hammernik_vn-claude-agentic", "campaign": "search-20260703-01", "cfg_full": {"batch_size": 2, "epochs": 15, "lr": 0.0003, "max_train_s": 1080, "rationale": "iter-5 (one knob: vn_lambda_init 3.27e-4 -> 1.0e-2, ~30x). Across iters 1/3/4 the learned lambda_t stayed frozen at its ~3.25e-4 init -> regulariser dormant, result is data-consistency-dominated, hr pinned at 0.508. Hypothesis: a larger lambda_init activates the regulariser gradient so the learned filter bank engages -> hr>0.508; if it over-smooths and drops, DC-dominance is confirmed optimal.", "train_n": 200, "val_n": 200, "vn_T": 3, "vn_checkpoint": true, "vn_dc_norm": true, "vn_init": "fbp", "vn_kernel": 7, "vn_lambda_init": 0.01, "vn_n_bumps": 31, "vn_n_filters": 32}, "challenge": "breast_ct", "change_class": "architecture", "git_commit": "671da566", "images": {"comparison": "runs/breast-ct-claude-agentic-hammernik-vn-search-20260703-01/iterations/iter-0005/comparison.png", "test_showcase": null, "valtest_showcase": null}, "iter": 5, "kept": true, "metrics": {"headroom": 0.5229846353531997, "headroom_std": 0.014840128909882818, "val_psnr": 42.75354766845703, "val_psnr_std": 0.8120819243106092, "val_rmse": 0.0024872934445738792, "val_rmse_std": 0.00022698749279073915, "val_ssim": 0.9807581305503845, "val_ssim_std": 0.0032925691823121116}, "model": "claude-opus-4-8-1m", "obs_path": "breast-ct-claude-agentic-hammernik-vn-search-20260703-01/iterations/iter-0005/observation.json", "obs_sha1": "328b8a3b6dbbc4aa04a703584e461285ad4866f3", "params_M": 0.007683, "params_source": "observation", "rationale": "hammernik_vn-claude-agentic: train_n=200, val_n=200, epochs=15, batch_size=2, lr=0.0003, vn_T=3, vn_n_filters=32, vn_kernel=7, vn_n_bumps=31, vn_lambda_init=0.01, vn_init=fbp, vn_dc_norm=True, vn_checkpoint=True, max_train_s=1080, rationale=iter-5 (one knob: vn_lambda_init 3.27e-4 -> 1.0e-2, ~30x). Across iters 1/3/4 the learned lambda_t stayed frozen at its ~3.25e-4 init -> regulariser dormant, result is data-consistency-dominated, hr pinned at 0.508. Hypothesis: a larger lambda_init activates the regulariser gradient so the learned filter bank engages -> hr>0.508; if it over-smooths and drops, DC-dominance is confirmed optimal.", "run_id": "breast-ct-claude-agentic-hammernik-vn-search-20260703-01", "runtime": {"elapsed_s": 978.0110635757446}, "schema_version": 3, "solver_key": "hammernik-vn", "solver_name": "Hammernik VN (MRI port)", "split": {"train_n": 200, "val_n": 200}, "status": "keep", "ts": "2026-07-04T12:25:55Z"}
{"advice_for_others": "hammernik_vn-claude-agentic: train_n=200, val_n=200, epochs=15, batch_size=2, lr=0.0003, vn_T=3, vn_n_filters=32, vn_kernel=7, vn_n_bumps=31, vn_lambda_init=0.03, vn_init=fbp, vn_dc_norm=True, vn_checkpoint=True, max_train_s=1080, rationale=iter-6 (one knob: vn_lambda_init 1e-2 -> 3e-2). iter-5 lifted hr 0.508->0.523 by activating the regulariser (lambda stayed ~0.0099). Hypothesis: push lambda_init further up the productive axis for more structure -> hr>0.523; if it over-smooths and drops, 1e-2 brackets the peak.", "agent": "hammernik_vn-claude-agentic", "campaign": "search-20260703-01", "cfg_full": {"batch_size": 2, "epochs": 15, "lr": 0.0003, "max_train_s": 1080, "rationale": "iter-6 (one knob: vn_lambda_init 1e-2 -> 3e-2). iter-5 lifted hr 0.508->0.523 by activating the regulariser (lambda stayed ~0.0099). Hypothesis: push lambda_init further up the productive axis for more structure -> hr>0.523; if it over-smooths and drops, 1e-2 brackets the peak.", "train_n": 200, "val_n": 200, "vn_T": 3, "vn_checkpoint": true, "vn_dc_norm": true, "vn_init": "fbp", "vn_kernel": 7, "vn_lambda_init": 0.03, "vn_n_bumps": 31, "vn_n_filters": 32}, "challenge": "breast_ct", "change_class": "architecture", "git_commit": "671da566", "images": {"comparison": "runs/breast-ct-claude-agentic-hammernik-vn-search-20260703-01/iterations/iter-0006/comparison.png", "test_showcase": null, "valtest_showcase": null}, "iter": 6, "kept": true, "metrics": {"headroom": 0.5060617959812599, "headroom_std": 0.0141606472718062, "val_psnr": 42.45074462890625, "val_psnr_std": 0.7841674032359213, "val_rmse": 0.0025755339302122593, "val_rmse_std": 0.00022710966755605763, "val_ssim": 0.9800881743431091, "val_ssim_std": 0.0033402357985508387}, "model": "claude-opus-4-8-1m", "obs_path": "breast-ct-claude-agentic-hammernik-vn-search-20260703-01/iterations/iter-0006/observation.json", "obs_sha1": "f711709600272f03d6b19a8697fdc40e16be36b5", "params_M": 0.007683, "params_source": "observation", "rationale": "hammernik_vn-claude-agentic: train_n=200, val_n=200, epochs=15, batch_size=2, lr=0.0003, vn_T=3, vn_n_filters=32, vn_kernel=7, vn_n_bumps=31, vn_lambda_init=0.03, vn_init=fbp, vn_dc_norm=True, vn_checkpoint=True, max_train_s=1080, rationale=iter-6 (one knob: vn_lambda_init 1e-2 -> 3e-2). iter-5 lifted hr 0.508->0.523 by activating the regulariser (lambda stayed ~0.0099). Hypothesis: push lambda_init further up the productive axis for more structure -> hr>0.523; if it over-smooths and drops, 1e-2 brackets the peak.", "run_id": "breast-ct-claude-agentic-hammernik-vn-search-20260703-01", "runtime": {"elapsed_s": 1122.1376037597656}, "schema_version": 3, "solver_key": "hammernik-vn", "solver_name": "Hammernik VN (MRI port)", "split": {"train_n": 200, "val_n": 200}, "status": "keep", "ts": "2026-07-04T14:28:24Z"}
{"advice_for_others": "hammernik_vn-claude-agentic: train_n=200, val_n=200, epochs=15, batch_size=2, lr=0.0003, vn_T=3, vn_n_filters=32, vn_kernel=7, vn_n_bumps=31, vn_lambda_init=0.004, vn_init=fbp, vn_dc_norm=True, vn_checkpoint=True, max_train_s=1080, rationale=iter-7 (one knob: vn_lambda_init 1e-2 -> 4e-3). lambda_init peak is bracketed: 3.25e-4 dormant (0.508), 1e-2 peak (0.523), 3e-2 over-smooth (0.506). Probe the rising flank at 4e-3 to refine the optimum. Hypothesis: hr lands 0.508-0.523; if >0.523 peak is <1e-2, else 1e-2 stays best.", "agent": "hammernik_vn-claude-agentic", "campaign": "search-20260703-01", "cfg_full": {"batch_size": 2, "epochs": 15, "lr": 0.0003, "max_train_s": 1080, "rationale": "iter-7 (one knob: vn_lambda_init 1e-2 -> 4e-3). lambda_init peak is bracketed: 3.25e-4 dormant (0.508), 1e-2 peak (0.523), 3e-2 over-smooth (0.506). Probe the rising flank at 4e-3 to refine the optimum. Hypothesis: hr lands 0.508-0.523; if >0.523 peak is <1e-2, else 1e-2 stays best.", "train_n": 200, "val_n": 200, "vn_T": 3, "vn_checkpoint": true, "vn_dc_norm": true, "vn_init": "fbp", "vn_kernel": 7, "vn_lambda_init": 0.004, "vn_n_bumps": 31, "vn_n_filters": 32}, "challenge": "breast_ct", "change_class": "architecture", "git_commit": "671da566", "images": {"comparison": "runs/breast-ct-claude-agentic-hammernik-vn-search-20260703-01/iterations/iter-0007/comparison.png", "test_showcase": null, "valtest_showcase": null}, "iter": 7, "kept": true, "metrics": {"headroom": 0.5140271267323706, "headroom_std": 0.014361239753610195, "val_psnr": 42.591957092285156, "val_psnr_std": 0.7921731650961839, "val_rmse": 0.0025340004358440638, "val_rmse_std": 0.000225500704724162, "val_ssim": 0.9801194071769714, "val_ssim_std": 0.003297093969819116}, "model": "claude-opus-4-8-1m", "obs_path": "breast-ct-claude-agentic-hammernik-vn-search-20260703-01/iterations/iter-0007/observation.json", "obs_sha1": "01e8fddf568069a34e3bb0918bc213caf9c07b09", "params_M": 0.007683, "params_source": "observation", "rationale": "hammernik_vn-claude-agentic: train_n=200, val_n=200, epochs=15, batch_size=2, lr=0.0003, vn_T=3, vn_n_filters=32, vn_kernel=7, vn_n_bumps=31, vn_lambda_init=0.004, vn_init=fbp, vn_dc_norm=True, vn_checkpoint=True, max_train_s=1080, rationale=iter-7 (one knob: vn_lambda_init 1e-2 -> 4e-3). lambda_init peak is bracketed: 3.25e-4 dormant (0.508), 1e-2 peak (0.523), 3e-2 over-smooth (0.506). Probe the rising flank at 4e-3 to refine the optimum. Hypothesis: hr lands 0.508-0.523; if >0.523 peak is <1e-2, else 1e-2 stays best.", "run_id": "breast-ct-claude-agentic-hammernik-vn-search-20260703-01", "runtime": {"elapsed_s": 1225.7246174812317}, "schema_version": 3, "solver_key": "hammernik-vn", "solver_name": "Hammernik VN (MRI port)", "split": {"train_n": 200, "val_n": 200}, "status": "keep", "ts": "2026-07-04T19:34:11Z"}
