{"advice_for_others": "learned_primal_dual-claude-agentic: lpd_iters=12, lpd_n_primal=5, lpd_n_dual=5, lpd_hidden=32, lpd_share_weights=False, epochs=10, lr=0.0008, lr_schedule=cosine, batch_size=1, grad_clip=1.0, lambda_neg=1.0, loss_base=mse, train_n=400, val_n=200, val_chunk=4, seed=43, rationale=iter-17 one-knob: seed 42->43 on the NEW BEST config (iter-16: I12/h32/ep10/lr8e-4/cosine/gc1.0/mse, hr=0.6791). BREAKTHROUGH at iter-16: lowering lr 1.2e-3->8e-4 at I=12 both RAISED hr to 0.6791 (new max) AND removed the divergence -- the fragile champion was fragile because lr1.2e-3 was too aggressive at depth 12. Now confirm SEED-STABILITY. HYPOTHESIS: lr8e-4/I12 at seed 43 lands near ~0.68 with NO collapse (vs the lr1.2e-3 seed-43=0.494), starting a stable replicate set {42,43,44,45} whose mean+/-std is the honest reportable result. Time-neutral ~1800s.", "agent": "learned_primal_dual-claude-agentic", "campaign": "search-20260703-01", "cfg_full": {"batch_size": 1, "epochs": 10, "grad_clip": 1.0, "lambda_neg": 1.0, "loss_base": "mse", "lpd_hidden": 32, "lpd_iters": 12, "lpd_n_dual": 5, "lpd_n_primal": 5, "lpd_share_weights": false, "lr": 0.0008, "lr_schedule": "cosine", "rationale": "iter-17 one-knob: seed 42->43 on the NEW BEST config (iter-16: I12/h32/ep10/lr8e-4/cosine/gc1.0/mse, hr=0.6791). BREAKTHROUGH at iter-16: lowering lr 1.2e-3->8e-4 at I=12 both RAISED hr to 0.6791 (new max) AND removed the divergence -- the fragile champion was fragile because lr1.2e-3 was too aggressive at depth 12. Now confirm SEED-STABILITY. HYPOTHESIS: lr8e-4/I12 at seed 43 lands near ~0.68 with NO collapse (vs the lr1.2e-3 seed-43=0.494), starting a stable replicate set {42,43,44,45} whose mean+/-std is the honest reportable result. Time-neutral ~1800s.", "seed": 43, "train_n": 400, "val_chunk": 4, "val_n": 200}, "challenge": "breast_ct", "change_class": "architecture", "git_commit": "671da566", "images": {"comparison": "runs/breast-ct-claude-agentic-learned-primal-dual-search-20260703-01/iterations/iter-0017/comparison.png", "test_showcase": null, "valtest_showcase": null}, "iter": 17, "kept": true, "metrics": {"headroom": 0.5859399733281869, "headroom_std": 0.019937647349833627, "val_psnr": 43.982933044433594, "val_psnr_std": 0.919405556720113, "val_rmse": 0.002159026451408863, "val_rmse_std": 0.00022788731311197035, "val_ssim": 0.9894995093345642, "val_ssim_std": 0.0024713613937193354}, "model": "claude-opus-4-8-1m", "obs_path": "breast-ct-claude-agentic-learned-primal-dual-search-20260703-01/iterations/iter-0017/observation.json", "obs_sha1": "2193bd8d529b39935135bf1a9b1cb148f8e59432", "params_M": 0.303864, "params_source": "observation", "rationale": "learned_primal_dual-claude-agentic: lpd_iters=12, lpd_n_primal=5, lpd_n_dual=5, lpd_hidden=32, lpd_share_weights=False, epochs=10, lr=0.0008, lr_schedule=cosine, batch_size=1, grad_clip=1.0, lambda_neg=1.0, loss_base=mse, train_n=400, val_n=200, val_chunk=4, seed=43, rationale=iter-17 one-knob: seed 42->43 on the NEW BEST config (iter-16: I12/h32/ep10/lr8e-4/cosine/gc1.0/mse, hr=0.6791). BREAKTHROUGH at iter-16: lowering lr 1.2e-3->8e-4 at I=12 both RAISED hr to 0.6791 (new max) AND removed the divergence -- the fragile champion was fragile because lr1.2e-3 was too aggressive at depth 12. Now confirm SEED-STABILITY. HYPOTHESIS: lr8e-4/I12 at seed 43 lands near ~0.68 with NO collapse (vs the lr1.2e-3 seed-43=0.494), starting a stable replicate set {42,43,44,45} whose mean+/-std is the honest reportable result. Time-neutral ~1800s.", "run_id": "breast-ct-claude-agentic-learned-primal-dual-search-20260703-01", "runtime": {"elapsed_s": 1109.865721464157}, "schema_version": 3, "solver_key": "learned-primal-dual", "solver_name": "Learned Primal-Dual", "split": {"train_n": 400, "val_n": 200}, "status": "keep", "ts": "2026-07-04T21:29:15Z"}
{"advice_for_others": "learned_primal_dual-claude-agentic: lpd_iters=12, lpd_n_primal=5, lpd_n_dual=5, lpd_hidden=32, lpd_share_weights=False, epochs=10, lr=0.0008, lr_schedule=cosine, batch_size=1, grad_clip=1.0, lambda_neg=1.0, loss_base=mse, train_n=400, val_n=200, val_chunk=4, seed=44, rationale=iter-18 one-knob: seed 44 on the stable best config (I12/h32/ep10/lr8e-4/cosine/gc1.0/mse, iter-16 hr=0.6791). Replicates {42:0.6791, 43:0.5859} both healthy (no collapse -- contrast lr1.2e-3 which collapsed on seed45). HYPOTHESIS: seed 44 lands ~0.60-0.68 with no collapse, extending the stable set toward an honest mean+/-std. Time-neutral ~1800s.", "agent": "learned_primal_dual-claude-agentic", "campaign": "search-20260703-01", "cfg_full": {"batch_size": 1, "epochs": 10, "grad_clip": 1.0, "lambda_neg": 1.0, "loss_base": "mse", "lpd_hidden": 32, "lpd_iters": 12, "lpd_n_dual": 5, "lpd_n_primal": 5, "lpd_share_weights": false, "lr": 0.0008, "lr_schedule": "cosine", "rationale": "iter-18 one-knob: seed 44 on the stable best config (I12/h32/ep10/lr8e-4/cosine/gc1.0/mse, iter-16 hr=0.6791). Replicates {42:0.6791, 43:0.5859} both healthy (no collapse -- contrast lr1.2e-3 which collapsed on seed45). HYPOTHESIS: seed 44 lands ~0.60-0.68 with no collapse, extending the stable set toward an honest mean+/-std. Time-neutral ~1800s.", "seed": 44, "train_n": 400, "val_chunk": 4, "val_n": 200}, "challenge": "breast_ct", "change_class": "architecture", "git_commit": "671da566", "images": {"comparison": "runs/breast-ct-claude-agentic-learned-primal-dual-search-20260703-01/iterations/iter-0018/comparison.png", "test_showcase": null, "valtest_showcase": null}, "iter": 18, "kept": true, "metrics": {"headroom": 0.5785025687226062, "headroom_std": 0.02035305971204805, "val_psnr": 43.82830047607422, "val_psnr_std": 0.9189453177544133, "val_rmse": 0.002197807189077139, "val_rmse_std": 0.00023177673416432254, "val_ssim": 0.9890682697296143, "val_ssim_std": 0.0024465768890518753}, "model": "claude-opus-4-8-1m", "obs_path": "breast-ct-claude-agentic-learned-primal-dual-search-20260703-01/iterations/iter-0018/observation.json", "obs_sha1": "fd910af33bae9187e1ff0bad1e84d5f892fdb770", "params_M": 0.303864, "params_source": "observation", "rationale": "learned_primal_dual-claude-agentic: lpd_iters=12, lpd_n_primal=5, lpd_n_dual=5, lpd_hidden=32, lpd_share_weights=False, epochs=10, lr=0.0008, lr_schedule=cosine, batch_size=1, grad_clip=1.0, lambda_neg=1.0, loss_base=mse, train_n=400, val_n=200, val_chunk=4, seed=44, rationale=iter-18 one-knob: seed 44 on the stable best config (I12/h32/ep10/lr8e-4/cosine/gc1.0/mse, iter-16 hr=0.6791). Replicates {42:0.6791, 43:0.5859} both healthy (no collapse -- contrast lr1.2e-3 which collapsed on seed45). HYPOTHESIS: seed 44 lands ~0.60-0.68 with no collapse, extending the stable set toward an honest mean+/-std. Time-neutral ~1800s.", "run_id": "breast-ct-claude-agentic-learned-primal-dual-search-20260703-01", "runtime": {"elapsed_s": 1084.3451404571533}, "schema_version": 3, "solver_key": "learned-primal-dual", "solver_name": "Learned Primal-Dual", "split": {"train_n": 400, "val_n": 200}, "status": "keep", "ts": "2026-07-04T22:28:18Z"}
{"advice_for_others": "learned_primal_dual-claude-agentic: lpd_iters=12, lpd_n_primal=5, lpd_n_dual=5, lpd_hidden=32, lpd_share_weights=False, epochs=10, lr=0.0008, lr_schedule=cosine, batch_size=1, grad_clip=1.0, lambda_neg=1.0, loss_base=mse, train_n=400, val_n=200, val_chunk=4, seed=45, rationale=iter-19 one-knob: seed 45 (the COLLAPSE-TEST) on the stable best config (I12/h32/ep10/lr8e-4/cosine/gc1.0/mse, iter-16 hr=0.6791). Replicates {42:0.6791, 43:0.5859, 44:0.5785} = mean 0.615 +/- 0.046, ZERO collapses -- vs the lr1.2e-3 config s 0.4475 +/- 0.2663 with a full collapse on seed 45. HYPOTHESIS: lr8e-4/I12 at seed 45 stays HEALTHY (~0.55-0.68, no hr=0), decisively confirming the lower lr removes the divergence and completing the 4-seed stable replicate set for the honest reportable mean+/-std. Time-neutral ~1800s.", "agent": "learned_primal_dual-claude-agentic", "campaign": "search-20260703-01", "cfg_full": {"batch_size": 1, "epochs": 10, "grad_clip": 1.0, "lambda_neg": 1.0, "loss_base": "mse", "lpd_hidden": 32, "lpd_iters": 12, "lpd_n_dual": 5, "lpd_n_primal": 5, "lpd_share_weights": false, "lr": 0.0008, "lr_schedule": "cosine", "rationale": "iter-19 one-knob: seed 45 (the COLLAPSE-TEST) on the stable best config (I12/h32/ep10/lr8e-4/cosine/gc1.0/mse, iter-16 hr=0.6791). Replicates {42:0.6791, 43:0.5859, 44:0.5785} = mean 0.615 +/- 0.046, ZERO collapses -- vs the lr1.2e-3 config s 0.4475 +/- 0.2663 with a full collapse on seed 45. HYPOTHESIS: lr8e-4/I12 at seed 45 stays HEALTHY (~0.55-0.68, no hr=0), decisively confirming the lower lr removes the divergence and completing the 4-seed stable replicate set for the honest reportable mean+/-std. Time-neutral ~1800s.", "seed": 45, "train_n": 400, "val_chunk": 4, "val_n": 200}, "challenge": "breast_ct", "change_class": "architecture", "git_commit": "671da566", "images": {"comparison": "runs/breast-ct-claude-agentic-learned-primal-dual-search-20260703-01/iterations/iter-0019/comparison.png", "test_showcase": null, "valtest_showcase": null}, "iter": 19, "kept": false, "metrics": {"headroom": 0.0, "headroom_std": 0.0, "val_psnr": 16.10190200805664, "val_psnr_std": 0.25394844195417343, "val_rmse": 0.05349452421069145, "val_rmse_std": 0.0012315060400211425, "val_ssim": 0.7076051235198975, "val_ssim_std": 0.011207612707329286}, "model": "claude-opus-4-8-1m", "obs_path": "breast-ct-claude-agentic-learned-primal-dual-search-20260703-01/iterations/iter-0019/observation.json", "obs_sha1": "624f1c39e3d64af077a51328106e8c9e3b949284", "params_M": 0.303864, "params_source": "observation", "rationale": "learned_primal_dual-claude-agentic: lpd_iters=12, lpd_n_primal=5, lpd_n_dual=5, lpd_hidden=32, lpd_share_weights=False, epochs=10, lr=0.0008, lr_schedule=cosine, batch_size=1, grad_clip=1.0, lambda_neg=1.0, loss_base=mse, train_n=400, val_n=200, val_chunk=4, seed=45, rationale=iter-19 one-knob: seed 45 (the COLLAPSE-TEST) on the stable best config (I12/h32/ep10/lr8e-4/cosine/gc1.0/mse, iter-16 hr=0.6791). Replicates {42:0.6791, 43:0.5859, 44:0.5785} = mean 0.615 +/- 0.046, ZERO collapses -- vs the lr1.2e-3 config s 0.4475 +/- 0.2663 with a full collapse on seed 45. HYPOTHESIS: lr8e-4/I12 at seed 45 stays HEALTHY (~0.55-0.68, no hr=0), decisively confirming the lower lr removes the divergence and completing the 4-seed stable replicate set for the honest reportable mean+/-std. Time-neutral ~1800s.", "run_id": "breast-ct-claude-agentic-learned-primal-dual-search-20260703-01", "runtime": {"elapsed_s": 1082.8165373802185}, "schema_version": 3, "solver_key": "learned-primal-dual", "solver_name": "Learned Primal-Dual", "split": {"train_n": 400, "val_n": 200}, "status": "discard", "ts": "2026-07-04T23:28:15Z"}
{"advice_for_others": "learned_primal_dual-claude-agentic: lpd_iters=10, lpd_n_primal=5, lpd_n_dual=5, lpd_hidden=32, lpd_share_weights=False, epochs=10, lr=0.0008, lr_schedule=cosine, batch_size=1, grad_clip=1.0, lambda_neg=1.0, loss_base=mse, train_n=400, val_n=200, val_chunk=4, seed=45, rationale=iter-20 (FINAL) one-knob: lpd_iters 12->10 at lr8e-4, seed 45 (the pathological seed). DECISIVE FINDING: seed 45 collapses to hr=0 at I=12 for BOTH lr1.2e-3 AND lr8e-4 -> the ~25% collapse is DEPTH-driven, not lr-driven. Every I=10 run in this campaign (iters 1,2,3,5,7,11) was collapse-free. HYPOTHESIS: if I revert depth I=12->10 at lr8e-4 on the worst seed 45, expect a HEALTHY hr (~0.55-0.62, no hr=0), identifying I=10/lr8e-4 as the ROBUST operating point (trading iter-16 s fragile 0.6791 peak for reliability -- the honest recommendation). Cheaper too (~1400s at I=10).", "agent": "learned_primal_dual-claude-agentic", "campaign": "search-20260703-01", "cfg_full": {"batch_size": 1, "epochs": 10, "grad_clip": 1.0, "lambda_neg": 1.0, "loss_base": "mse", "lpd_hidden": 32, "lpd_iters": 10, "lpd_n_dual": 5, "lpd_n_primal": 5, "lpd_share_weights": false, "lr": 0.0008, "lr_schedule": "cosine", "rationale": "iter-20 (FINAL) one-knob: lpd_iters 12->10 at lr8e-4, seed 45 (the pathological seed). DECISIVE FINDING: seed 45 collapses to hr=0 at I=12 for BOTH lr1.2e-3 AND lr8e-4 -> the ~25% collapse is DEPTH-driven, not lr-driven. Every I=10 run in this campaign (iters 1,2,3,5,7,11) was collapse-free. HYPOTHESIS: if I revert depth I=12->10 at lr8e-4 on the worst seed 45, expect a HEALTHY hr (~0.55-0.62, no hr=0), identifying I=10/lr8e-4 as the ROBUST operating point (trading iter-16 s fragile 0.6791 peak for reliability -- the honest recommendation). Cheaper too (~1400s at I=10).", "seed": 45, "train_n": 400, "val_chunk": 4, "val_n": 200}, "challenge": "breast_ct", "change_class": "architecture", "git_commit": "671da566", "images": {"comparison": "runs/breast-ct-claude-agentic-learned-primal-dual-search-20260703-01/iterations/iter-0020/comparison.png", "test_showcase": null, "valtest_showcase": null}, "iter": 20, "kept": true, "metrics": {"headroom": 0.4427420938560971, "headroom_std": 0.031495104399463764, "val_psnr": 41.40306854248047, "val_psnr_std": 0.9838540410625715, "val_rmse": 0.002905700821429491, "val_rmse_std": 0.0003255715951146111, "val_ssim": 0.9835805296897888, "val_ssim_std": 0.003597410687520036}, "model": "claude-opus-4-8-1m", "obs_path": "breast-ct-claude-agentic-learned-primal-dual-search-20260703-01/iterations/iter-0020/observation.json", "obs_sha1": "acedb7725c1ae4c96ce186d01e5b8356c453074f", "params_M": 0.25322, "params_source": "observation", "rationale": "learned_primal_dual-claude-agentic: lpd_iters=10, lpd_n_primal=5, lpd_n_dual=5, lpd_hidden=32, lpd_share_weights=False, epochs=10, lr=0.0008, lr_schedule=cosine, batch_size=1, grad_clip=1.0, lambda_neg=1.0, loss_base=mse, train_n=400, val_n=200, val_chunk=4, seed=45, rationale=iter-20 (FINAL) one-knob: lpd_iters 12->10 at lr8e-4, seed 45 (the pathological seed). DECISIVE FINDING: seed 45 collapses to hr=0 at I=12 for BOTH lr1.2e-3 AND lr8e-4 -> the ~25% collapse is DEPTH-driven, not lr-driven. Every I=10 run in this campaign (iters 1,2,3,5,7,11) was collapse-free. HYPOTHESIS: if I revert depth I=12->10 at lr8e-4 on the worst seed 45, expect a HEALTHY hr (~0.55-0.62, no hr=0), identifying I=10/lr8e-4 as the ROBUST operating point (trading iter-16 s fragile 0.6791 peak for reliability -- the honest recommendation). Cheaper too (~1400s at I=10).", "run_id": "breast-ct-claude-agentic-learned-primal-dual-search-20260703-01", "runtime": {"elapsed_s": 938.2148339748383}, "schema_version": 3, "solver_key": "learned-primal-dual", "solver_name": "Learned Primal-Dual", "split": {"train_n": 400, "val_n": 200}, "status": "keep", "ts": "2026-07-05T00:25:54Z"}
