{"advice_for_others": "hammernik_2017-claude-agentic: vn_T=5, vn_n_filters=16, vn_kernel=9, vn_n_bumps=31, vn_x_range=2.0, vn_filter_init_std=0.05, vn_rbf_init_std=0.01, vn_lambda_init=0.02, epochs=8, batch_size=2, lr=0.00096, grad_clip=1.0, train_n=800, val_n=200, seed=42, max_train_s=1450, rationale=iter-12 (six-box). DATA lever CONFIRMED positive: iter-11 (T=4, train_n=800) hr=0.6258 vs iter-5 (T=4, train_n=400) hr=0.6174 (+0.008). Depth T=5 still dominates (iter-6 best 0.6329). COMBINE the two positive levers: T=5 + more data. ONE KNOB vs iter-6 (best): train_n 400 -> 800. HYPOTHESIS: stacking the data gain (+0.008 seen at T=4) on top of the best depth (T=5) pushes hr above iter-6's 0.6329; risk = epochs budget-squeezed under-trains at T=5+800. All else = iter-6 (T=5, f=16, k=9, n_bumps=31, x_range=2.0, lambda=0.02, lr=9.6e-4, batch=2, grad_clip=1.0, seed=42). BUDGET: iter-11 (T=4,800,ep=10)=1255s; T=5 ~1.25x -> epochs=8 DEPENDENT budget var for margin (~1250s), max_train_s=1450 guards under the 1800s kill. VN plateaus early so ep=8 at 800 cases (=3200 steps) still converges (iter-11 converged at 4000 steps). batch_size=2 (OOM guard); expandable_segments via --export.", "agent": "hammernik_2017-claude-agentic", "campaign": "search-20260703-01", "cfg_full": {"batch_size": 2, "epochs": 8, "grad_clip": 1.0, "lr": 0.00096, "max_train_s": 1450, "rationale": "iter-12 (six-box). DATA lever CONFIRMED positive: iter-11 (T=4, train_n=800) hr=0.6258 vs iter-5 (T=4, train_n=400) hr=0.6174 (+0.008). Depth T=5 still dominates (iter-6 best 0.6329). COMBINE the two positive levers: T=5 + more data. ONE KNOB vs iter-6 (best): train_n 400 -> 800. HYPOTHESIS: stacking the data gain (+0.008 seen at T=4) on top of the best depth (T=5) pushes hr above iter-6's 0.6329; risk = epochs budget-squeezed under-trains at T=5+800. All else = iter-6 (T=5, f=16, k=9, n_bumps=31, x_range=2.0, lambda=0.02, lr=9.6e-4, batch=2, grad_clip=1.0, seed=42). BUDGET: iter-11 (T=4,800,ep=10)=1255s; T=5 ~1.25x -> epochs=8 DEPENDENT budget var for margin (~1250s), max_train_s=1450 guards under the 1800s kill. VN plateaus early so ep=8 at 800 cases (=3200 steps) still converges (iter-11 converged at 4000 steps). batch_size=2 (OOM guard); expandable_segments via --export.", "seed": 42, "train_n": 800, "val_n": 200, "vn_T": 5, "vn_filter_init_std": 0.05, "vn_kernel": 9, "vn_lambda_init": 0.02, "vn_n_bumps": 31, "vn_n_filters": 16, "vn_rbf_init_std": 0.01, "vn_x_range": 2.0}, "challenge": "breast_ct", "change_class": "architecture", "git_commit": "671da566", "images": {"comparison": "runs/breast-ct-claude-agentic-hammernik-2017-search-20260703-01/iterations/iter-0012/comparison.png", "test_showcase": null, "valtest_showcase": null}, "iter": 12, "kept": true, "metrics": {"headroom": 0.6231544129722926, "headroom_std": null, "val_psnr": 44.80093002319336, "val_psnr_std": null, "val_rmse": 0.0019649798050522804, "val_rmse_std": null, "val_ssim": 0.9893506169319153, "val_ssim_std": null}, "model": "claude-opus-4-8-1m", "obs_path": "breast-ct-claude-agentic-hammernik-2017-search-20260703-01/iterations/iter-0012/observation.json", "obs_sha1": "05f89c4f912a5fba2c1f7f6de02062eebfc7149f", "params_M": 0.008965, "params_source": "observation", "rationale": "hammernik_2017-claude-agentic: vn_T=5, vn_n_filters=16, vn_kernel=9, vn_n_bumps=31, vn_x_range=2.0, vn_filter_init_std=0.05, vn_rbf_init_std=0.01, vn_lambda_init=0.02, epochs=8, batch_size=2, lr=0.00096, grad_clip=1.0, train_n=800, val_n=200, seed=42, max_train_s=1450, rationale=iter-12 (six-box). DATA lever CONFIRMED positive: iter-11 (T=4, train_n=800) hr=0.6258 vs iter-5 (T=4, train_n=400) hr=0.6174 (+0.008). Depth T=5 still dominates (iter-6 best 0.6329). COMBINE the two positive levers: T=5 + more data. ONE KNOB vs iter-6 (best): train_n 400 -> 800. HYPOTHESIS: stacking the data gain (+0.008 seen at T=4) on top of the best depth (T=5) pushes hr above iter-6's 0.6329; risk = epochs budget-squeezed under-trains at T=5+800. All else = iter-6 (T=5, f=16, k=9, n_bumps=31, x_range=2.0, lambda=0.02, lr=9.6e-4, batch=2, grad_clip=1.0, seed=42). BUDGET: iter-11 (T=4,800,ep=10)=1255s; T=5 ~1.25x -> epochs=8 DEPENDENT budget var for margin (~1250s), max_train_s=1450 guards under the 1800s kill. VN plateaus early so ep=8 at 800 cases (=3200 steps) still converges (iter-11 converged at 4000 steps). batch_size=2 (OOM guard); expandable_segments via --export.", "run_id": "breast-ct-claude-agentic-hammernik-2017-search-20260703-01", "runtime": {"elapsed_s": 1634.7240629196167}, "schema_version": 3, "solver_key": "hammernik-2017", "solver_name": "Hammernik VN (2017)", "split": {"train_n": 400, "val_n": 200}, "status": "keep", "ts": "2026-07-05T06:37:31Z"}
{"advice_for_others": "hammernik_2017-claude-agentic: vn_T=4, vn_n_filters=16, vn_kernel=9, vn_n_bumps=51, vn_x_range=2.0, vn_filter_init_std=0.05, vn_rbf_init_std=0.01, vn_lambda_init=0.02, epochs=16, batch_size=2, lr=0.00096, grad_clip=1.0, train_n=400, val_n=200, seed=42, max_train_s=1450, rationale=iter-13 (six-box; RESCOPED T=5->T=4 after OOM). First attempt (T=5, n_bumps=51) OOMed on 16GB RTX5000 in the _rho_prime bump loop (like the earlier f=24 OOM) -> 51 bumps at T=5x512px is memory-infeasible on the default pool. Test the activation-resolution hypothesis at the memory-safe T=4 base (iter-5: T=4,f=16,n_bumps=31, hr=0.6174). ONE KNOB vs iter-5: vn_n_bumps 31 -> 51 (denser RBF grid over [-2,2] -> finer learned nonlinearity rho'). HYPOTHESIS: a sharper activation improves streak/anatomy separation, lifting hr above iter-5's 0.6174; if it ties/regresses, 31 bumps already suffices. All else = iter-5 (T=4, f=16, k=9, x_range=2.0, lambda=0.02, lr=9.6e-4, batch=2, grad_clip=1.0, seed=42, train_n=400). BUDGET: 51 bumps at T=4 ~ still heavier RBF loop; epochs=16 DEPENDENT budget var, max_train_s=1450 guards under the 1800s kill. batch_size=2 (OOM guard); expandable_segments via --export. NOTE: T=4x51-bump memory ~ iter-5(T=4x31)x1.65 loop but T=4<T=5 activation tensors -> expected to fit; if it OOMs again, n_bumps axis is memory-bounded and I will file that + move on.", "agent": "hammernik_2017-claude-agentic", "campaign": "search-20260703-01", "cfg_full": {"batch_size": 2, "epochs": 16, "grad_clip": 1.0, "lr": 0.00096, "max_train_s": 1450, "rationale": "iter-13 (six-box; RESCOPED T=5->T=4 after OOM). First attempt (T=5, n_bumps=51) OOMed on 16GB RTX5000 in the _rho_prime bump loop (like the earlier f=24 OOM) -> 51 bumps at T=5x512px is memory-infeasible on the default pool. Test the activation-resolution hypothesis at the memory-safe T=4 base (iter-5: T=4,f=16,n_bumps=31, hr=0.6174). ONE KNOB vs iter-5: vn_n_bumps 31 -> 51 (denser RBF grid over [-2,2] -> finer learned nonlinearity rho'). HYPOTHESIS: a sharper activation improves streak/anatomy separation, lifting hr above iter-5's 0.6174; if it ties/regresses, 31 bumps already suffices. All else = iter-5 (T=4, f=16, k=9, x_range=2.0, lambda=0.02, lr=9.6e-4, batch=2, grad_clip=1.0, seed=42, train_n=400). BUDGET: 51 bumps at T=4 ~ still heavier RBF loop; epochs=16 DEPENDENT budget var, max_train_s=1450 guards under the 1800s kill. batch_size=2 (OOM guard); expandable_segments via --export. NOTE: T=4x51-bump memory ~ iter-5(T=4x31)x1.65 loop but T=4<T=5 activation tensors -> expected to fit; if it OOMs again, n_bumps axis is memory-bounded and I will file that + move on.", "seed": 42, "train_n": 400, "val_n": 200, "vn_T": 4, "vn_filter_init_std": 0.05, "vn_kernel": 9, "vn_lambda_init": 0.02, "vn_n_bumps": 51, "vn_n_filters": 16, "vn_rbf_init_std": 0.01, "vn_x_range": 2.0}, "challenge": "breast_ct", "change_class": "architecture", "git_commit": "671da566", "images": {"comparison": "runs/breast-ct-claude-agentic-hammernik-2017-search-20260703-01/iterations/iter-0013/comparison.png", "test_showcase": null, "valtest_showcase": null}, "iter": 13, "kept": true, "metrics": {"headroom": 0.5771490630706306, "headroom_std": null, "val_psnr": 43.80044937133789, "val_psnr_std": null, "val_rmse": 0.002204864751547575, "val_rmse_std": null, "val_ssim": 0.9850611686706543, "val_ssim_std": null}, "model": "claude-opus-4-8-1m", "obs_path": "breast-ct-claude-agentic-hammernik-2017-search-20260703-01/iterations/iter-0013/observation.json", "obs_sha1": "1b26325e28cee9a1a7c078a011c57bc048a70df6", "params_M": 0.008452, "params_source": "observation", "rationale": "hammernik_2017-claude-agentic: vn_T=4, vn_n_filters=16, vn_kernel=9, vn_n_bumps=51, vn_x_range=2.0, vn_filter_init_std=0.05, vn_rbf_init_std=0.01, vn_lambda_init=0.02, epochs=16, batch_size=2, lr=0.00096, grad_clip=1.0, train_n=400, val_n=200, seed=42, max_train_s=1450, rationale=iter-13 (six-box; RESCOPED T=5->T=4 after OOM). First attempt (T=5, n_bumps=51) OOMed on 16GB RTX5000 in the _rho_prime bump loop (like the earlier f=24 OOM) -> 51 bumps at T=5x512px is memory-infeasible on the default pool. Test the activation-resolution hypothesis at the memory-safe T=4 base (iter-5: T=4,f=16,n_bumps=31, hr=0.6174). ONE KNOB vs iter-5: vn_n_bumps 31 -> 51 (denser RBF grid over [-2,2] -> finer learned nonlinearity rho'). HYPOTHESIS: a sharper activation improves streak/anatomy separation, lifting hr above iter-5's 0.6174; if it ties/regresses, 31 bumps already suffices. All else = iter-5 (T=4, f=16, k=9, x_range=2.0, lambda=0.02, lr=9.6e-4, batch=2, grad_clip=1.0, seed=42, train_n=400). BUDGET: 51 bumps at T=4 ~ still heavier RBF loop; epochs=16 DEPENDENT budget var, max_train_s=1450 guards under the 1800s kill. batch_size=2 (OOM guard); expandable_segments via --export. NOTE: T=4x51-bump memory ~ iter-5(T=4x31)x1.65 loop but T=4<T=5 activation tensors -> expected to fit; if it OOMs again, n_bumps axis is memory-bounded and I will file that + move on.", "run_id": "breast-ct-claude-agentic-hammernik-2017-search-20260703-01", "runtime": {"elapsed_s": 1651.5031349658966}, "schema_version": 3, "solver_key": "hammernik-2017", "solver_name": "Hammernik VN (2017)", "split": {"train_n": 400, "val_n": 200}, "status": "keep", "ts": "2026-07-05T07:39:14Z"}
{"advice_for_others": "hammernik_2017-claude-agentic: vn_T=5, vn_n_filters=16, vn_kernel=9, vn_n_bumps=31, vn_x_range=2.0, vn_filter_init_std=0.05, vn_rbf_init_std=0.01, vn_lambda_init=0.02, epochs=20, batch_size=2, lr=0.00096, grad_clip=1.0, train_n=400, val_n=200, seed=43, max_train_s=1500, rationale=iter-14 (six-box). iter-13 (T=4, n_bumps=51) hr=0.5771 REGRESSED vs iter-5 (n_bumps=31) 0.6174 -> 31 bumps optimal. ALL architecture+data axes now EXHAUSTED around iter-6 (T=5,f=16,k=9,n_bumps=31,x_range=2.0,lambda=0.02,lr=9.6e-4, hr=0.6329, also the 16GB-memory-practical ceiling): lambda 0.05 collapse, width f=24 regress+OOM-at-T5, lr 5e-4 regress, kernel 11 collapse, x_range 3.0 regress, n_bumps 51 regress+OOM-at-T5, data-800 regress-under-budget. Per plan, move to ROBUSTNESS confirmation (seed spread) for the champion mean+/-std. ONE KNOB vs iter-6: seed 42 -> 43. HYPOTHESIS: the champion reproduces hr~0.633 at seed=43 (within ~+/-0.005), confirming it is not a seed artifact. All else = iter-6 architecture (T=5,f=16,k=9,n_bumps=31,x_range=2.0,lambda=0.02,lr=9.6e-4,train_n=400), ep=20/max_train_s=1500 (the proven budget-safe T=5 setting from iters 8rerun/9/10 at ~1620-1650s). batch_size=2 (OOM guard); expandable_segments via --export.", "agent": "hammernik_2017-claude-agentic", "campaign": "search-20260703-01", "cfg_full": {"batch_size": 2, "epochs": 20, "grad_clip": 1.0, "lr": 0.00096, "max_train_s": 1500, "rationale": "iter-14 (six-box). iter-13 (T=4, n_bumps=51) hr=0.5771 REGRESSED vs iter-5 (n_bumps=31) 0.6174 -> 31 bumps optimal. ALL architecture+data axes now EXHAUSTED around iter-6 (T=5,f=16,k=9,n_bumps=31,x_range=2.0,lambda=0.02,lr=9.6e-4, hr=0.6329, also the 16GB-memory-practical ceiling): lambda 0.05 collapse, width f=24 regress+OOM-at-T5, lr 5e-4 regress, kernel 11 collapse, x_range 3.0 regress, n_bumps 51 regress+OOM-at-T5, data-800 regress-under-budget. Per plan, move to ROBUSTNESS confirmation (seed spread) for the champion mean+/-std. ONE KNOB vs iter-6: seed 42 -> 43. HYPOTHESIS: the champion reproduces hr~0.633 at seed=43 (within ~+/-0.005), confirming it is not a seed artifact. All else = iter-6 architecture (T=5,f=16,k=9,n_bumps=31,x_range=2.0,lambda=0.02,lr=9.6e-4,train_n=400), ep=20/max_train_s=1500 (the proven budget-safe T=5 setting from iters 8rerun/9/10 at ~1620-1650s). batch_size=2 (OOM guard); expandable_segments via --export.", "seed": 43, "train_n": 400, "val_n": 200, "vn_T": 5, "vn_filter_init_std": 0.05, "vn_kernel": 9, "vn_lambda_init": 0.02, "vn_n_bumps": 31, "vn_n_filters": 16, "vn_rbf_init_std": 0.01, "vn_x_range": 2.0}, "challenge": "breast_ct", "change_class": "architecture", "git_commit": "671da566", "images": {"comparison": "runs/breast-ct-claude-agentic-hammernik-2017-search-20260703-01/iterations/iter-0014/comparison.png", "test_showcase": null, "valtest_showcase": null}, "iter": 14, "kept": false, "metrics": {"headroom": 0.0, "headroom_std": null, "val_psnr": -136.12469482421875, "val_psnr_std": null, "val_rmse": 2185942.0, "val_rmse_std": null, "val_ssim": 0.18348842859268188, "val_ssim_std": null}, "model": "claude-opus-4-8-1m", "obs_path": "breast-ct-claude-agentic-hammernik-2017-search-20260703-01/iterations/iter-0014/observation.json", "obs_sha1": "f0a7879ad1c445447fefbcf44dad7b5931a27b68", "params_M": 0.008965, "params_source": "observation", "rationale": "hammernik_2017-claude-agentic: vn_T=5, vn_n_filters=16, vn_kernel=9, vn_n_bumps=31, vn_x_range=2.0, vn_filter_init_std=0.05, vn_rbf_init_std=0.01, vn_lambda_init=0.02, epochs=20, batch_size=2, lr=0.00096, grad_clip=1.0, train_n=400, val_n=200, seed=43, max_train_s=1500, rationale=iter-14 (six-box). iter-13 (T=4, n_bumps=51) hr=0.5771 REGRESSED vs iter-5 (n_bumps=31) 0.6174 -> 31 bumps optimal. ALL architecture+data axes now EXHAUSTED around iter-6 (T=5,f=16,k=9,n_bumps=31,x_range=2.0,lambda=0.02,lr=9.6e-4, hr=0.6329, also the 16GB-memory-practical ceiling): lambda 0.05 collapse, width f=24 regress+OOM-at-T5, lr 5e-4 regress, kernel 11 collapse, x_range 3.0 regress, n_bumps 51 regress+OOM-at-T5, data-800 regress-under-budget. Per plan, move to ROBUSTNESS confirmation (seed spread) for the champion mean+/-std. ONE KNOB vs iter-6: seed 42 -> 43. HYPOTHESIS: the champion reproduces hr~0.633 at seed=43 (within ~+/-0.005), confirming it is not a seed artifact. All else = iter-6 architecture (T=5,f=16,k=9,n_bumps=31,x_range=2.0,lambda=0.02,lr=9.6e-4,train_n=400), ep=20/max_train_s=1500 (the proven budget-safe T=5 setting from iters 8rerun/9/10 at ~1620-1650s). batch_size=2 (OOM guard); expandable_segments via --export.", "run_id": "breast-ct-claude-agentic-hammernik-2017-search-20260703-01", "runtime": {"elapsed_s": 1634.0341770648956}, "schema_version": 3, "solver_key": "hammernik-2017", "solver_name": "Hammernik VN (2017)", "split": {"train_n": 400, "val_n": 200}, "status": "discard", "ts": "2026-07-05T08:37:29Z"}
{"advice_for_others": "hammernik_2017-claude-agentic: vn_T=5, vn_n_filters=16, vn_kernel=9, vn_n_bumps=31, vn_x_range=2.0, vn_filter_init_std=0.05, vn_rbf_init_std=0.01, vn_lambda_init=0.02, epochs=20, batch_size=2, lr=0.00096, grad_clip=0.1, train_n=400, val_n=200, seed=43, max_train_s=1500, rationale=iter-15 (six-box). iter-14 (champion config, seed=43) DIVERGED: RMSE=2.19e6, PSNR=-136, SSIM=0.18 -> the unrolled VN exploded (NaN/inf) at seed=43 despite grad_clip=1.0. FAILURE MODE: numerical divergence / VN-family instability -- the champion sits near an instability edge at grad_clip=1.0 and is seed-fragile. This is a STABILITY problem, not a config-quality problem. ONE KNOB vs iter-14: grad_clip 1.0 -> 0.1 (10x tighter gradient clipping to prevent the explosion). Keep seed=43 to still obtain the replicate. HYPOTHESIS: tighter clipping prevents the seed=43 divergence and yields a STABLE hr~0.63 replicate, confirming champion robustness once the training is stabilized; also a generally safer training recipe. All else = iter-6 champion (T=5,f=16,k=9,n_bumps=31,x_range=2.0,lambda=0.02,lr=9.6e-4,train_n=400, ep=20/max_train_s=1500). grad_clip is FREE -> same budget ~1630s under the 1800s kill. batch_size=2 (OOM guard); expandable_segments via --export.", "agent": "hammernik_2017-claude-agentic", "campaign": "search-20260703-01", "cfg_full": {"batch_size": 2, "epochs": 20, "grad_clip": 0.1, "lr": 0.00096, "max_train_s": 1500, "rationale": "iter-15 (six-box). iter-14 (champion config, seed=43) DIVERGED: RMSE=2.19e6, PSNR=-136, SSIM=0.18 -> the unrolled VN exploded (NaN/inf) at seed=43 despite grad_clip=1.0. FAILURE MODE: numerical divergence / VN-family instability -- the champion sits near an instability edge at grad_clip=1.0 and is seed-fragile. This is a STABILITY problem, not a config-quality problem. ONE KNOB vs iter-14: grad_clip 1.0 -> 0.1 (10x tighter gradient clipping to prevent the explosion). Keep seed=43 to still obtain the replicate. HYPOTHESIS: tighter clipping prevents the seed=43 divergence and yields a STABLE hr~0.63 replicate, confirming champion robustness once the training is stabilized; also a generally safer training recipe. All else = iter-6 champion (T=5,f=16,k=9,n_bumps=31,x_range=2.0,lambda=0.02,lr=9.6e-4,train_n=400, ep=20/max_train_s=1500). grad_clip is FREE -> same budget ~1630s under the 1800s kill. batch_size=2 (OOM guard); expandable_segments via --export.", "seed": 43, "train_n": 400, "val_n": 200, "vn_T": 5, "vn_filter_init_std": 0.05, "vn_kernel": 9, "vn_lambda_init": 0.02, "vn_n_bumps": 31, "vn_n_filters": 16, "vn_rbf_init_std": 0.01, "vn_x_range": 2.0}, "challenge": "breast_ct", "change_class": "architecture", "git_commit": "671da566", "images": {"comparison": "runs/breast-ct-claude-agentic-hammernik-2017-search-20260703-01/iterations/iter-0015/comparison.png", "test_showcase": null, "valtest_showcase": null}, "iter": 15, "kept": true, "metrics": {"headroom": 0.5418583857650071, "headroom_std": null, "val_psnr": 43.10420227050781, "val_psnr_std": null, "val_rmse": 0.002388880355283618, "val_rmse_std": null, "val_ssim": 0.9819177985191345, "val_ssim_std": null}, "model": "claude-opus-4-8-1m", "obs_path": "breast-ct-claude-agentic-hammernik-2017-search-20260703-01/iterations/iter-0015/observation.json", "obs_sha1": "18e9f61b00d5ec7a405df0d997a8a5f92ea443e7", "params_M": 0.008965, "params_source": "observation", "rationale": "hammernik_2017-claude-agentic: vn_T=5, vn_n_filters=16, vn_kernel=9, vn_n_bumps=31, vn_x_range=2.0, vn_filter_init_std=0.05, vn_rbf_init_std=0.01, vn_lambda_init=0.02, epochs=20, batch_size=2, lr=0.00096, grad_clip=0.1, train_n=400, val_n=200, seed=43, max_train_s=1500, rationale=iter-15 (six-box). iter-14 (champion config, seed=43) DIVERGED: RMSE=2.19e6, PSNR=-136, SSIM=0.18 -> the unrolled VN exploded (NaN/inf) at seed=43 despite grad_clip=1.0. FAILURE MODE: numerical divergence / VN-family instability -- the champion sits near an instability edge at grad_clip=1.0 and is seed-fragile. This is a STABILITY problem, not a config-quality problem. ONE KNOB vs iter-14: grad_clip 1.0 -> 0.1 (10x tighter gradient clipping to prevent the explosion). Keep seed=43 to still obtain the replicate. HYPOTHESIS: tighter clipping prevents the seed=43 divergence and yields a STABLE hr~0.63 replicate, confirming champion robustness once the training is stabilized; also a generally safer training recipe. All else = iter-6 champion (T=5,f=16,k=9,n_bumps=31,x_range=2.0,lambda=0.02,lr=9.6e-4,train_n=400, ep=20/max_train_s=1500). grad_clip is FREE -> same budget ~1630s under the 1800s kill. batch_size=2 (OOM guard); expandable_segments via --export.", "run_id": "breast-ct-claude-agentic-hammernik-2017-search-20260703-01", "runtime": {"elapsed_s": 1628.3955492973328}, "schema_version": 3, "solver_key": "hammernik-2017", "solver_name": "Hammernik VN (2017)", "split": {"train_n": 400, "val_n": 200}, "status": "keep", "ts": "2026-07-05T09:37:54Z"}
