{"advice_for_others": "dual_domain_bilateral_supervised-claude-agentic: proj_n_bf=1, img_n_bf=7, proj_kernel=3, proj_sx=0.01, proj_sy=0.3, proj_sr=0.0005, img_kernel=7, img_sx=0.5, img_sy=0.5, img_sr=0.02, epochs=10, batch_size=1, lr=0.005, optimizer=adam, lambda_neg=1.0, grad_clip=1.0, train_n=400, val_n=200, val_chunk=10, seed=42, rationale=iter-5 dual_domain_bilateral_supervised, re-split Breast-CT val=200. SIX-BOX vs BEST (iter-3 img_n_bf=7/img_kernel5/ep10 hr=0.2466). (1) PRIOR: BF-depth saturated (7 BFs = 0.2466); epochs is NOT a lever (iter-4 ep30 = 0.2462, flat) -> the 6-24-param BF fit converges by ep10. OLD-split TPE best used img_kernel=7. (2) Failure mode: the 5x5 image BF footprint is too small to span sparse-view streak spacing; deeper stacks help only marginally because each filter is spatially narrow. (3) ONE KNOB: img_kernel 5 -> 7 (img_n_bf=7 held; epochs reverted 30->10 since ep30 wasted budget with no gain; lr/lambda_neg unchanged). (4) HYPOTHESIS: a 7x7 image BF kernel enlarges each filters spatial footprint and lifts hr above 0.2466 toward ~0.26-0.28, matching the TPE-favored img_kernel=7. If flat/down, spatial footprint is not the lever and iter-6 pivots to lr. (5) BUDGET: 7x7 vs 5x5 BF ~2x per-filter cost but still cheap; ep10 -> ~120s, well inside 20 min. (6) Loop continues. Artifacts saved.", "agent": "dual_domain_bilateral_supervised-claude-agentic", "campaign": "search-20260703-01", "cfg_full": {"batch_size": 1, "epochs": 10, "grad_clip": 1.0, "img_kernel": 7, "img_n_bf": 7, "img_sr": 0.02, "img_sx": 0.5, "img_sy": 0.5, "lambda_neg": 1.0, "lr": 0.005, "optimizer": "adam", "proj_kernel": 3, "proj_n_bf": 1, "proj_sr": 0.0005, "proj_sx": 0.01, "proj_sy": 0.3, "rationale": "iter-5 dual_domain_bilateral_supervised, re-split Breast-CT val=200. SIX-BOX vs BEST (iter-3 img_n_bf=7/img_kernel5/ep10 hr=0.2466). (1) PRIOR: BF-depth saturated (7 BFs = 0.2466); epochs is NOT a lever (iter-4 ep30 = 0.2462, flat) -> the 6-24-param BF fit converges by ep10. OLD-split TPE best used img_kernel=7. (2) Failure mode: the 5x5 image BF footprint is too small to span sparse-view streak spacing; deeper stacks help only marginally because each filter is spatially narrow. (3) ONE KNOB: img_kernel 5 -> 7 (img_n_bf=7 held; epochs reverted 30->10 since ep30 wasted budget with no gain; lr/lambda_neg unchanged). (4) HYPOTHESIS: a 7x7 image BF kernel enlarges each filters spatial footprint and lifts hr above 0.2466 toward ~0.26-0.28, matching the TPE-favored img_kernel=7. If flat/down, spatial footprint is not the lever and iter-6 pivots to lr. (5) BUDGET: 7x7 vs 5x5 BF ~2x per-filter cost but still cheap; ep10 -> ~120s, well inside 20 min. (6) Loop continues. Artifacts saved.", "seed": 42, "train_n": 400, "val_chunk": 10, "val_n": 200}, "challenge": "breast_ct", "change_class": "architecture", "git_commit": "671da566", "images": {"comparison": "runs/breast-ct-claude-agentic-dual-domain-bilateral-supervised-search-20260703-01/iterations/iter-0005/comparison.png", "test_showcase": null, "valtest_showcase": null}, "iter": 5, "kept": true, "metrics": {"headroom": 0.25153749615207344, "headroom_std": 0.00920586590122583, "val_psnr": 38.84079360961914, "val_psnr_std": 0.579296143642746, "val_rmse": 0.0039026958402246237, "val_rmse_std": 0.00025374596795407463, "val_ssim": 0.9824118614196777, "val_ssim_std": 0.0032415218631526646}, "model": "claude-opus-4-8-1m", "obs_path": "breast-ct-claude-agentic-dual-domain-bilateral-supervised-search-20260703-01/iterations/iter-0005/observation.json", "obs_sha1": "edcbcd383f59604a343bc14eec12057029ee56b6", "params_M": 2.4e-05, "params_source": "observation", "rationale": "dual_domain_bilateral_supervised-claude-agentic: proj_n_bf=1, img_n_bf=7, proj_kernel=3, proj_sx=0.01, proj_sy=0.3, proj_sr=0.0005, img_kernel=7, img_sx=0.5, img_sy=0.5, img_sr=0.02, epochs=10, batch_size=1, lr=0.005, optimizer=adam, lambda_neg=1.0, grad_clip=1.0, train_n=400, val_n=200, val_chunk=10, seed=42, rationale=iter-5 dual_domain_bilateral_supervised, re-split Breast-CT val=200. SIX-BOX vs BEST (iter-3 img_n_bf=7/img_kernel5/ep10 hr=0.2466). (1) PRIOR: BF-depth saturated (7 BFs = 0.2466); epochs is NOT a lever (iter-4 ep30 = 0.2462, flat) -> the 6-24-param BF fit converges by ep10. OLD-split TPE best used img_kernel=7. (2) Failure mode: the 5x5 image BF footprint is too small to span sparse-view streak spacing; deeper stacks help only marginally because each filter is spatially narrow. (3) ONE KNOB: img_kernel 5 -> 7 (img_n_bf=7 held; epochs reverted 30->10 since ep30 wasted budget with no gain; lr/lambda_neg unchanged). (4) HYPOTHESIS: a 7x7 image BF kernel enlarges each filters spatial footprint and lifts hr above 0.2466 toward ~0.26-0.28, matching the TPE-favored img_kernel=7. If flat/down, spatial footprint is not the lever and iter-6 pivots to lr. (5) BUDGET: 7x7 vs 5x5 BF ~2x per-filter cost but still cheap; ep10 -> ~120s, well inside 20 min. (6) Loop continues. Artifacts saved.", "run_id": "breast-ct-claude-agentic-dual-domain-bilateral-supervised-search-20260703-01", "runtime": {"elapsed_s": 364.99930930137634}, "schema_version": 3, "solver_key": "dual-domain-bilateral-supervised", "solver_name": "DD-BF supervised L2", "split": {"train_n": 400, "val_n": 200}, "status": "keep", "ts": "2026-07-05T16:56:12Z"}
{"advice_for_others": "dual_domain_bilateral_supervised-claude-agentic: proj_n_bf=1, img_n_bf=7, proj_kernel=3, proj_sx=0.01, proj_sy=0.3, proj_sr=0.0005, img_kernel=7, img_sx=0.5, img_sy=0.5, img_sr=0.02, epochs=10, batch_size=1, lr=0.01, optimizer=adam, lambda_neg=1.0, grad_clip=1.0, train_n=400, val_n=200, val_chunk=10, seed=42, rationale=iter-6 dual_domain_bilateral_supervised, re-split Breast-CT val=200. SIX-BOX vs BEST (iter-5 img_kernel=7/lr5e-3/ep10 hr=0.2515). (1) PRIOR: img_kernel 5->7 gave +0.005 (new best 0.2515); depth saturated at 7 BFs; epochs flat. All iters used Wagner default lr=5e-3. (2) Failure mode: with only ~24 params and 10 epochs, lr=5e-3 may leave the BF sigmas short of their optimum (under-stepped). (3) ONE KNOB: lr 5e-3 -> 1e-2 (img_kernel=7/img_n_bf=7/ep10 held; grad_clip=1.0 guards instability). (4) HYPOTHESIS: doubling lr reaches a lower L2 minimum within 10 epochs and lifts hr above 0.2515 toward ~0.26; if hr DROPS (too aggressive), 5e-3 is the lr optimum and iter-7 pivots to img_sr (range bandwidth) or lambda_neg. (5) BUDGET: same ep10 -> ~120s, inside 20 min. (6) Loop continues. Artifacts saved.", "agent": "dual_domain_bilateral_supervised-claude-agentic", "campaign": "search-20260703-01", "cfg_full": {"batch_size": 1, "epochs": 10, "grad_clip": 1.0, "img_kernel": 7, "img_n_bf": 7, "img_sr": 0.02, "img_sx": 0.5, "img_sy": 0.5, "lambda_neg": 1.0, "lr": 0.01, "optimizer": "adam", "proj_kernel": 3, "proj_n_bf": 1, "proj_sr": 0.0005, "proj_sx": 0.01, "proj_sy": 0.3, "rationale": "iter-6 dual_domain_bilateral_supervised, re-split Breast-CT val=200. SIX-BOX vs BEST (iter-5 img_kernel=7/lr5e-3/ep10 hr=0.2515). (1) PRIOR: img_kernel 5->7 gave +0.005 (new best 0.2515); depth saturated at 7 BFs; epochs flat. All iters used Wagner default lr=5e-3. (2) Failure mode: with only ~24 params and 10 epochs, lr=5e-3 may leave the BF sigmas short of their optimum (under-stepped). (3) ONE KNOB: lr 5e-3 -> 1e-2 (img_kernel=7/img_n_bf=7/ep10 held; grad_clip=1.0 guards instability). (4) HYPOTHESIS: doubling lr reaches a lower L2 minimum within 10 epochs and lifts hr above 0.2515 toward ~0.26; if hr DROPS (too aggressive), 5e-3 is the lr optimum and iter-7 pivots to img_sr (range bandwidth) or lambda_neg. (5) BUDGET: same ep10 -> ~120s, inside 20 min. (6) Loop continues. Artifacts saved.", "seed": 42, "train_n": 400, "val_chunk": 10, "val_n": 200}, "challenge": "breast_ct", "change_class": "architecture", "git_commit": "671da566", "images": {"comparison": "runs/breast-ct-claude-agentic-dual-domain-bilateral-supervised-search-20260703-01/iterations/iter-0006/comparison.png", "test_showcase": null, "valtest_showcase": null}, "iter": 6, "kept": true, "metrics": {"headroom": 0.255499197193253, "headroom_std": 0.009515002363673617, "val_psnr": 38.88689422607422, "val_psnr_std": 0.583170482354471, "val_rmse": 0.0038820384070277214, "val_rmse_std": 0.00025410545416108056, "val_ssim": 0.9834036231040955, "val_ssim_std": 0.0031132160840876113}, "model": "claude-opus-4-8-1m", "obs_path": "breast-ct-claude-agentic-dual-domain-bilateral-supervised-search-20260703-01/iterations/iter-0006/observation.json", "obs_sha1": "80d6b3e030ef72b52e75d47a35a2f690c344300c", "params_M": 2.4e-05, "params_source": "observation", "rationale": "dual_domain_bilateral_supervised-claude-agentic: proj_n_bf=1, img_n_bf=7, proj_kernel=3, proj_sx=0.01, proj_sy=0.3, proj_sr=0.0005, img_kernel=7, img_sx=0.5, img_sy=0.5, img_sr=0.02, epochs=10, batch_size=1, lr=0.01, optimizer=adam, lambda_neg=1.0, grad_clip=1.0, train_n=400, val_n=200, val_chunk=10, seed=42, rationale=iter-6 dual_domain_bilateral_supervised, re-split Breast-CT val=200. SIX-BOX vs BEST (iter-5 img_kernel=7/lr5e-3/ep10 hr=0.2515). (1) PRIOR: img_kernel 5->7 gave +0.005 (new best 0.2515); depth saturated at 7 BFs; epochs flat. All iters used Wagner default lr=5e-3. (2) Failure mode: with only ~24 params and 10 epochs, lr=5e-3 may leave the BF sigmas short of their optimum (under-stepped). (3) ONE KNOB: lr 5e-3 -> 1e-2 (img_kernel=7/img_n_bf=7/ep10 held; grad_clip=1.0 guards instability). (4) HYPOTHESIS: doubling lr reaches a lower L2 minimum within 10 epochs and lifts hr above 0.2515 toward ~0.26; if hr DROPS (too aggressive), 5e-3 is the lr optimum and iter-7 pivots to img_sr (range bandwidth) or lambda_neg. (5) BUDGET: same ep10 -> ~120s, inside 20 min. (6) Loop continues. Artifacts saved.", "run_id": "breast-ct-claude-agentic-dual-domain-bilateral-supervised-search-20260703-01", "runtime": {"elapsed_s": 368.1080074310303}, "schema_version": 3, "solver_key": "dual-domain-bilateral-supervised", "solver_name": "DD-BF supervised L2", "split": {"train_n": 400, "val_n": 200}, "status": "keep", "ts": "2026-07-05T17:03:30Z"}
{"advice_for_others": "dual_domain_bilateral_supervised-claude-agentic: proj_n_bf=1, img_n_bf=7, proj_kernel=3, proj_sx=0.01, proj_sy=0.3, proj_sr=0.0005, img_kernel=7, img_sx=0.5, img_sy=0.5, img_sr=0.02, epochs=10, batch_size=1, lr=0.02, optimizer=adam, lambda_neg=1.0, grad_clip=1.0, train_n=400, val_n=200, val_chunk=10, seed=42, rationale=iter-7 dual_domain_bilateral_supervised, re-split Breast-CT val=200. SIX-BOX vs BEST (iter-6 lr=1e-2 hr=0.2555). (1) PRIOR: lr sweep rising -- 5e-3(0.2515)->1e-2(0.2555, +0.004). Under-stepping was real; the BF fit wants a faster lr within 10 epochs. (2) Failure mode: lr=1e-2 may still under-step the ~24-param BF within 10 epochs. (3) ONE KNOB: lr 1e-2 -> 2e-2 (img_kernel=7/img_n_bf=7/ep10 held; grad_clip=1.0 guards blow-up). (4) HYPOTHESIS: 2e-2 continues the rising lr trend and lifts hr above 0.2555 toward ~0.26; if hr DROPS (unstable/overshoot), 1e-2 is the lr optimum and iter-8 pivots to img_sr (BF range bandwidth). Expect ~0.256-0.26. (5) BUDGET: same ep10 -> ~120s. (6) Loop continues. Artifacts saved.", "agent": "dual_domain_bilateral_supervised-claude-agentic", "campaign": "search-20260703-01", "cfg_full": {"batch_size": 1, "epochs": 10, "grad_clip": 1.0, "img_kernel": 7, "img_n_bf": 7, "img_sr": 0.02, "img_sx": 0.5, "img_sy": 0.5, "lambda_neg": 1.0, "lr": 0.02, "optimizer": "adam", "proj_kernel": 3, "proj_n_bf": 1, "proj_sr": 0.0005, "proj_sx": 0.01, "proj_sy": 0.3, "rationale": "iter-7 dual_domain_bilateral_supervised, re-split Breast-CT val=200. SIX-BOX vs BEST (iter-6 lr=1e-2 hr=0.2555). (1) PRIOR: lr sweep rising -- 5e-3(0.2515)->1e-2(0.2555, +0.004). Under-stepping was real; the BF fit wants a faster lr within 10 epochs. (2) Failure mode: lr=1e-2 may still under-step the ~24-param BF within 10 epochs. (3) ONE KNOB: lr 1e-2 -> 2e-2 (img_kernel=7/img_n_bf=7/ep10 held; grad_clip=1.0 guards blow-up). (4) HYPOTHESIS: 2e-2 continues the rising lr trend and lifts hr above 0.2555 toward ~0.26; if hr DROPS (unstable/overshoot), 1e-2 is the lr optimum and iter-8 pivots to img_sr (BF range bandwidth). Expect ~0.256-0.26. (5) BUDGET: same ep10 -> ~120s. (6) Loop continues. Artifacts saved.", "seed": 42, "train_n": 400, "val_chunk": 10, "val_n": 200}, "challenge": "breast_ct", "change_class": "architecture", "git_commit": "671da566", "images": {"comparison": "runs/breast-ct-claude-agentic-dual-domain-bilateral-supervised-search-20260703-01/iterations/iter-0007/comparison.png", "test_showcase": null, "valtest_showcase": null}, "iter": 7, "kept": true, "metrics": {"headroom": 0.24921936320398974, "headroom_std": 0.009937203915523385, "val_psnr": 38.813934326171875, "val_psnr_std": 0.578261479577381, "val_rmse": 0.003914783243089914, "val_rmse_std": 0.00025380662770071717, "val_ssim": 0.9835312366485596, "val_ssim_std": 0.0030339172475671804}, "model": "claude-opus-4-8-1m", "obs_path": "breast-ct-claude-agentic-dual-domain-bilateral-supervised-search-20260703-01/iterations/iter-0007/observation.json", "obs_sha1": "0e00c0002518c5584d7f4d7fc682ef1e0cbc4cdc", "params_M": 2.4e-05, "params_source": "observation", "rationale": "dual_domain_bilateral_supervised-claude-agentic: proj_n_bf=1, img_n_bf=7, proj_kernel=3, proj_sx=0.01, proj_sy=0.3, proj_sr=0.0005, img_kernel=7, img_sx=0.5, img_sy=0.5, img_sr=0.02, epochs=10, batch_size=1, lr=0.02, optimizer=adam, lambda_neg=1.0, grad_clip=1.0, train_n=400, val_n=200, val_chunk=10, seed=42, rationale=iter-7 dual_domain_bilateral_supervised, re-split Breast-CT val=200. SIX-BOX vs BEST (iter-6 lr=1e-2 hr=0.2555). (1) PRIOR: lr sweep rising -- 5e-3(0.2515)->1e-2(0.2555, +0.004). Under-stepping was real; the BF fit wants a faster lr within 10 epochs. (2) Failure mode: lr=1e-2 may still under-step the ~24-param BF within 10 epochs. (3) ONE KNOB: lr 1e-2 -> 2e-2 (img_kernel=7/img_n_bf=7/ep10 held; grad_clip=1.0 guards blow-up). (4) HYPOTHESIS: 2e-2 continues the rising lr trend and lifts hr above 0.2555 toward ~0.26; if hr DROPS (unstable/overshoot), 1e-2 is the lr optimum and iter-8 pivots to img_sr (BF range bandwidth). Expect ~0.256-0.26. (5) BUDGET: same ep10 -> ~120s. (6) Loop continues. Artifacts saved.", "run_id": "breast-ct-claude-agentic-dual-domain-bilateral-supervised-search-20260703-01", "runtime": {"elapsed_s": 364.28574800491333}, "schema_version": 3, "solver_key": "dual-domain-bilateral-supervised", "solver_name": "DD-BF supervised L2", "split": {"train_n": 400, "val_n": 200}, "status": "keep", "ts": "2026-07-05T17:10:10Z"}
{"advice_for_others": "dual_domain_bilateral_supervised-claude-agentic: proj_n_bf=1, img_n_bf=7, proj_kernel=3, proj_sx=0.01, proj_sy=0.3, proj_sr=0.0005, img_kernel=7, img_sx=0.5, img_sy=0.5, img_sr=0.05, epochs=10, batch_size=1, lr=0.01, optimizer=adam, lambda_neg=1.0, grad_clip=1.0, train_n=400, val_n=200, val_chunk=10, seed=42, rationale=iter-8 dual_domain_bilateral_supervised, re-split Breast-CT val=200. SIX-BOX vs BEST (iter-6 lr=1e-2/img_sr0.02 hr=0.2555). (1) PRIOR: lr BRACKETED -- 5e-3(0.2515)<1e-2(0.2555,best)>2e-2(0.2492,iter-7 dropped) => lr=1e-2 optimal, reverted. Depth+kernel+epochs already mapped. (2) Failure mode: img_sr=0.02 (BF range/intensity bandwidth INIT) may be too narrow -- the BF only averages near-identical-intensity pixels, limiting streak suppression in smooth breast tissue. (3) ONE KNOB: img_sr 0.02 -> 0.05 (best config otherwise: lr=1e-2/img_kernel=7/img_n_bf=7; note sigmas are TRAINABLE so this only moves the INIT). (4) HYPOTHESIS: a wider range-sigma init lets each image BF average over broader intensity neighborhoods from the start -> better streak suppression in smooth tissue -> hr above 0.2555 toward ~0.26; if flat/down, the trainable sigma already finds its own optimum regardless of init and iter-9 pivots to lambda_neg. (5) BUDGET: same ep10 -> ~120s. (6) Loop continues. Artifacts saved.", "agent": "dual_domain_bilateral_supervised-claude-agentic", "campaign": "search-20260703-01", "cfg_full": {"batch_size": 1, "epochs": 10, "grad_clip": 1.0, "img_kernel": 7, "img_n_bf": 7, "img_sr": 0.05, "img_sx": 0.5, "img_sy": 0.5, "lambda_neg": 1.0, "lr": 0.01, "optimizer": "adam", "proj_kernel": 3, "proj_n_bf": 1, "proj_sr": 0.0005, "proj_sx": 0.01, "proj_sy": 0.3, "rationale": "iter-8 dual_domain_bilateral_supervised, re-split Breast-CT val=200. SIX-BOX vs BEST (iter-6 lr=1e-2/img_sr0.02 hr=0.2555). (1) PRIOR: lr BRACKETED -- 5e-3(0.2515)<1e-2(0.2555,best)>2e-2(0.2492,iter-7 dropped) => lr=1e-2 optimal, reverted. Depth+kernel+epochs already mapped. (2) Failure mode: img_sr=0.02 (BF range/intensity bandwidth INIT) may be too narrow -- the BF only averages near-identical-intensity pixels, limiting streak suppression in smooth breast tissue. (3) ONE KNOB: img_sr 0.02 -> 0.05 (best config otherwise: lr=1e-2/img_kernel=7/img_n_bf=7; note sigmas are TRAINABLE so this only moves the INIT). (4) HYPOTHESIS: a wider range-sigma init lets each image BF average over broader intensity neighborhoods from the start -> better streak suppression in smooth tissue -> hr above 0.2555 toward ~0.26; if flat/down, the trainable sigma already finds its own optimum regardless of init and iter-9 pivots to lambda_neg. (5) BUDGET: same ep10 -> ~120s. (6) Loop continues. Artifacts saved.", "seed": 42, "train_n": 400, "val_chunk": 10, "val_n": 200}, "challenge": "breast_ct", "change_class": "architecture", "git_commit": "671da566", "images": {"comparison": "runs/breast-ct-claude-agentic-dual-domain-bilateral-supervised-search-20260703-01/iterations/iter-0008/comparison.png", "test_showcase": null, "valtest_showcase": null}, "iter": 8, "kept": true, "metrics": {"headroom": 0.2493258146910018, "headroom_std": 0.009009750274060232, "val_psnr": 38.81517028808594, "val_psnr_std": 0.5799510254578555, "val_rmse": 0.0039142281748354435, "val_rmse_std": 0.00025479106340421366, "val_ssim": 0.9817245006561279, "val_ssim_std": 0.0033321498846730466}, "model": "claude-opus-4-8-1m", "obs_path": "breast-ct-claude-agentic-dual-domain-bilateral-supervised-search-20260703-01/iterations/iter-0008/observation.json", "obs_sha1": "c417c0b4aaac9131dc5250a223e16612c529d212", "params_M": 2.4e-05, "params_source": "observation", "rationale": "dual_domain_bilateral_supervised-claude-agentic: proj_n_bf=1, img_n_bf=7, proj_kernel=3, proj_sx=0.01, proj_sy=0.3, proj_sr=0.0005, img_kernel=7, img_sx=0.5, img_sy=0.5, img_sr=0.05, epochs=10, batch_size=1, lr=0.01, optimizer=adam, lambda_neg=1.0, grad_clip=1.0, train_n=400, val_n=200, val_chunk=10, seed=42, rationale=iter-8 dual_domain_bilateral_supervised, re-split Breast-CT val=200. SIX-BOX vs BEST (iter-6 lr=1e-2/img_sr0.02 hr=0.2555). (1) PRIOR: lr BRACKETED -- 5e-3(0.2515)<1e-2(0.2555,best)>2e-2(0.2492,iter-7 dropped) => lr=1e-2 optimal, reverted. Depth+kernel+epochs already mapped. (2) Failure mode: img_sr=0.02 (BF range/intensity bandwidth INIT) may be too narrow -- the BF only averages near-identical-intensity pixels, limiting streak suppression in smooth breast tissue. (3) ONE KNOB: img_sr 0.02 -> 0.05 (best config otherwise: lr=1e-2/img_kernel=7/img_n_bf=7; note sigmas are TRAINABLE so this only moves the INIT). (4) HYPOTHESIS: a wider range-sigma init lets each image BF average over broader intensity neighborhoods from the start -> better streak suppression in smooth tissue -> hr above 0.2555 toward ~0.26; if flat/down, the trainable sigma already finds its own optimum regardless of init and iter-9 pivots to lambda_neg. (5) BUDGET: same ep10 -> ~120s. (6) Loop continues. Artifacts saved.", "run_id": "breast-ct-claude-agentic-dual-domain-bilateral-supervised-search-20260703-01", "runtime": {"elapsed_s": 390.9259386062622}, "schema_version": 3, "solver_key": "dual-domain-bilateral-supervised", "solver_name": "DD-BF supervised L2", "split": {"train_n": 400, "val_n": 200}, "status": "keep", "ts": "2026-07-05T17:17:50Z"}
