{"advice_for_others": "fastdiff_wdm_wavelet_constrained-claude-agentic: val_n=200, seed=42, fd_recon_ckpt=/cluster/maier/Agent4CT/checkpoints/fast_diffusion_wavelet_breast.pt, fd_recon_steps=8, fd_recon_init=fbp, fd_recon_init_t=0.1, fd_recon_eta=1.0, fd_recon_dc=1, fd_recon_dc_n_cg=5, fd_recon_dc_relax=1.0, dataset_kind=breast_ct, rationale=iter-5 INIT_T lever (push lower), breast-native wavelet CONSTRAINED, val=200. SIX-BOX: (1) PRIOR: init_t sweep at relax1.0: 0.7->PSNR16.5, 0.4->19.4, 0.2->22.0, RMSE 5.12e-2->3.66e-2->2.70e-2. STRICTLY MONOTONIC: every init_t drop helps. baseline PSNR36.3/RMSE5.21e-3, hr=0 so far. (2) FAILURE MODE: even at init_t=0.2 the wavelet-prior embed still degrades the strong 128-view breast FBP; the prior is not yet a near-identity light denoiser. (3) ONE KNOB: fd_recon_init_t 0.2 -> 0.1 (FBP embedded very close to clean; prior barely perturbs it). (4) HYPOTHESIS: init_t=0.1 continues the RMSE-down trend toward the FBP floor; at very low init_t the recon approaches (light-denoised FBP -> CG-DC), which should approach or clear the baseline. FALSIFIER: if PSNR still <<36 even at init_t=0.1, the 8-step wavelet prior CANNOT match the 128-view breast FBP (it always injects net-harmful structure), meaning this DC-on wavelet variant is FBP-bounded here regardless of init_t -> pivot iters to steps/n_cg and then conclude. (5) BUDGET: ~90s/iter. (6) Loop continues; iter-6 on landing.", "agent": "fastdiff_wdm_wavelet_constrained-claude-agentic", "campaign": "search-20260703-01", "cfg_full": {"dataset_kind": "breast_ct", "fd_recon_ckpt": "/cluster/maier/Agent4CT/checkpoints/fast_diffusion_wavelet_breast.pt", "fd_recon_dc": 1, "fd_recon_dc_n_cg": 5, "fd_recon_dc_relax": 1.0, "fd_recon_eta": 1.0, "fd_recon_init": "fbp", "fd_recon_init_t": 0.1, "fd_recon_steps": 8, "rationale": "iter-5 INIT_T lever (push lower), breast-native wavelet CONSTRAINED, val=200. SIX-BOX: (1) PRIOR: init_t sweep at relax1.0: 0.7->PSNR16.5, 0.4->19.4, 0.2->22.0, RMSE 5.12e-2->3.66e-2->2.70e-2. STRICTLY MONOTONIC: every init_t drop helps. baseline PSNR36.3/RMSE5.21e-3, hr=0 so far. (2) FAILURE MODE: even at init_t=0.2 the wavelet-prior embed still degrades the strong 128-view breast FBP; the prior is not yet a near-identity light denoiser. (3) ONE KNOB: fd_recon_init_t 0.2 -> 0.1 (FBP embedded very close to clean; prior barely perturbs it). (4) HYPOTHESIS: init_t=0.1 continues the RMSE-down trend toward the FBP floor; at very low init_t the recon approaches (light-denoised FBP -> CG-DC), which should approach or clear the baseline. FALSIFIER: if PSNR still <<36 even at init_t=0.1, the 8-step wavelet prior CANNOT match the 128-view breast FBP (it always injects net-harmful structure), meaning this DC-on wavelet variant is FBP-bounded here regardless of init_t -> pivot iters to steps/n_cg and then conclude. (5) BUDGET: ~90s/iter. (6) Loop continues; iter-6 on landing.", "seed": 42, "val_n": 200}, "challenge": "breast_ct", "change_class": "architecture", "git_commit": "671da566", "images": {"comparison": "runs/breast-ct-claude-agentic-fastdiff-wdm-wavelet-constrained-search-20260703-01/iterations/iter-0005/comparison.png", "test_showcase": null, "valtest_showcase": null}, "iter": 5, "kept": false, "metrics": {"headroom": 0.0, "headroom_std": 0.0, "val_psnr": 25.19988250732422, "val_psnr_std": 0.19831201987666025, "val_rmse": 0.018767667934298515, "val_rmse_std": 0.0002370779858229542, "val_ssim": 0.5276275277137756, "val_ssim_std": 0.00548574652868065}, "model": "claude-opus-4-8-1m", "obs_path": "breast-ct-claude-agentic-fastdiff-wdm-wavelet-constrained-search-20260703-01/iterations/iter-0005/observation.json", "obs_sha1": "15af8d14519b5400ed96b1aac25b46e315468a42", "params_M": 3.824908, "params_source": "observation", "rationale": "fastdiff_wdm_wavelet_constrained-claude-agentic: val_n=200, seed=42, fd_recon_ckpt=/cluster/maier/Agent4CT/checkpoints/fast_diffusion_wavelet_breast.pt, fd_recon_steps=8, fd_recon_init=fbp, fd_recon_init_t=0.1, fd_recon_eta=1.0, fd_recon_dc=1, fd_recon_dc_n_cg=5, fd_recon_dc_relax=1.0, dataset_kind=breast_ct, rationale=iter-5 INIT_T lever (push lower), breast-native wavelet CONSTRAINED, val=200. SIX-BOX: (1) PRIOR: init_t sweep at relax1.0: 0.7->PSNR16.5, 0.4->19.4, 0.2->22.0, RMSE 5.12e-2->3.66e-2->2.70e-2. STRICTLY MONOTONIC: every init_t drop helps. baseline PSNR36.3/RMSE5.21e-3, hr=0 so far. (2) FAILURE MODE: even at init_t=0.2 the wavelet-prior embed still degrades the strong 128-view breast FBP; the prior is not yet a near-identity light denoiser. (3) ONE KNOB: fd_recon_init_t 0.2 -> 0.1 (FBP embedded very close to clean; prior barely perturbs it). (4) HYPOTHESIS: init_t=0.1 continues the RMSE-down trend toward the FBP floor; at very low init_t the recon approaches (light-denoised FBP -> CG-DC), which should approach or clear the baseline. FALSIFIER: if PSNR still <<36 even at init_t=0.1, the 8-step wavelet prior CANNOT match the 128-view breast FBP (it always injects net-harmful structure), meaning this DC-on wavelet variant is FBP-bounded here regardless of init_t -> pivot iters to steps/n_cg and then conclude. (5) BUDGET: ~90s/iter. (6) Loop continues; iter-6 on landing.", "run_id": "breast-ct-claude-agentic-fastdiff-wdm-wavelet-constrained-search-20260703-01", "runtime": {"elapsed_s": 126.20326399803162}, "schema_version": 3, "solver_key": "fastdiff-wdm-wavelet-constrained", "solver_name": "Fast-diffusion WDM (wavelet, constrained DC)", "split": {"train_n": 3600, "val_n": 200}, "status": "discard", "ts": "2026-07-06T20:52:27Z"}
{"advice_for_others": "fastdiff_wdm_wavelet_constrained-claude-agentic: val_n=200, seed=42, fd_recon_ckpt=/cluster/maier/Agent4CT/checkpoints/fast_diffusion_wavelet_breast.pt, fd_recon_steps=8, fd_recon_init=fbp, fd_recon_init_t=0.05, fd_recon_eta=1.0, fd_recon_dc=1, fd_recon_dc_n_cg=5, fd_recon_dc_relax=1.0, dataset_kind=breast_ct, rationale=iter-6 INIT_T limit probe, breast-native wavelet CONSTRAINED, val=200. SIX-BOX: (1) PRIOR: init_t@relax1.0: 0.7->PSNR16.5, 0.4->19.4, 0.2->22.0, 0.1->25.2 (RMSE 1.88e-2). MONOTONIC toward baseline PSNR36.3/RMSE5.21e-3 as init_t->0. hr=0 throughout. (2) FAILURE MODE: the wavelet prior injects net-harmful structure; the recon improves as prior influence shrinks. (3) ONE KNOB: fd_recon_init_t 0.1 -> 0.05 (near prior-off; recon ~ light-denoised FBP + full CG-DC). (4) HYPOTHESIS: continues the trend; establishes the init_t->0 asymptote (does DC-anchored near-FBP clear the baseline, or is even the CG-DC-projected FBP below the plain Hann FBP baseline?). This localizes whether ANY init_t can clear hr>0. FALSIFIER: if PSNR plateaus below 36 as init_t->0, the DC-on wavelet recon is structurally FBP-bounded on sparse breast (the CG-DC/prior chain never beats the plain FBP baseline) -> spend remaining iters confirming via steps/n_cg then conclude. (5) BUDGET ~90s. (6) iter-7 on landing.", "agent": "fastdiff_wdm_wavelet_constrained-claude-agentic", "campaign": "search-20260703-01", "cfg_full": {"dataset_kind": "breast_ct", "fd_recon_ckpt": "/cluster/maier/Agent4CT/checkpoints/fast_diffusion_wavelet_breast.pt", "fd_recon_dc": 1, "fd_recon_dc_n_cg": 5, "fd_recon_dc_relax": 1.0, "fd_recon_eta": 1.0, "fd_recon_init": "fbp", "fd_recon_init_t": 0.05, "fd_recon_steps": 8, "rationale": "iter-6 INIT_T limit probe, breast-native wavelet CONSTRAINED, val=200. SIX-BOX: (1) PRIOR: init_t@relax1.0: 0.7->PSNR16.5, 0.4->19.4, 0.2->22.0, 0.1->25.2 (RMSE 1.88e-2). MONOTONIC toward baseline PSNR36.3/RMSE5.21e-3 as init_t->0. hr=0 throughout. (2) FAILURE MODE: the wavelet prior injects net-harmful structure; the recon improves as prior influence shrinks. (3) ONE KNOB: fd_recon_init_t 0.1 -> 0.05 (near prior-off; recon ~ light-denoised FBP + full CG-DC). (4) HYPOTHESIS: continues the trend; establishes the init_t->0 asymptote (does DC-anchored near-FBP clear the baseline, or is even the CG-DC-projected FBP below the plain Hann FBP baseline?). This localizes whether ANY init_t can clear hr>0. FALSIFIER: if PSNR plateaus below 36 as init_t->0, the DC-on wavelet recon is structurally FBP-bounded on sparse breast (the CG-DC/prior chain never beats the plain FBP baseline) -> spend remaining iters confirming via steps/n_cg then conclude. (5) BUDGET ~90s. (6) iter-7 on landing.", "seed": 42, "val_n": 200}, "challenge": "breast_ct", "change_class": "architecture", "git_commit": "671da566", "images": {"comparison": "runs/breast-ct-claude-agentic-fastdiff-wdm-wavelet-constrained-search-20260703-01/iterations/iter-0006/comparison.png", "test_showcase": null, "valtest_showcase": null}, "iter": 6, "kept": false, "metrics": {"headroom": 0.0, "headroom_std": 0.0, "val_psnr": 28.900611877441406, "val_psnr_std": 0.20464584628957283, "val_rmse": 0.012256708927452564, "val_rmse_std": 0.00020919430669469915, "val_ssim": 0.6474815011024475, "val_ssim_std": 0.006128966012456079}, "model": "claude-opus-4-8-1m", "obs_path": "breast-ct-claude-agentic-fastdiff-wdm-wavelet-constrained-search-20260703-01/iterations/iter-0006/observation.json", "obs_sha1": "5ffcc046b2391092eca2d09e8b11a93a6ee33c8d", "params_M": 3.824908, "params_source": "observation", "rationale": "fastdiff_wdm_wavelet_constrained-claude-agentic: val_n=200, seed=42, fd_recon_ckpt=/cluster/maier/Agent4CT/checkpoints/fast_diffusion_wavelet_breast.pt, fd_recon_steps=8, fd_recon_init=fbp, fd_recon_init_t=0.05, fd_recon_eta=1.0, fd_recon_dc=1, fd_recon_dc_n_cg=5, fd_recon_dc_relax=1.0, dataset_kind=breast_ct, rationale=iter-6 INIT_T limit probe, breast-native wavelet CONSTRAINED, val=200. SIX-BOX: (1) PRIOR: init_t@relax1.0: 0.7->PSNR16.5, 0.4->19.4, 0.2->22.0, 0.1->25.2 (RMSE 1.88e-2). MONOTONIC toward baseline PSNR36.3/RMSE5.21e-3 as init_t->0. hr=0 throughout. (2) FAILURE MODE: the wavelet prior injects net-harmful structure; the recon improves as prior influence shrinks. (3) ONE KNOB: fd_recon_init_t 0.1 -> 0.05 (near prior-off; recon ~ light-denoised FBP + full CG-DC). (4) HYPOTHESIS: continues the trend; establishes the init_t->0 asymptote (does DC-anchored near-FBP clear the baseline, or is even the CG-DC-projected FBP below the plain Hann FBP baseline?). This localizes whether ANY init_t can clear hr>0. FALSIFIER: if PSNR plateaus below 36 as init_t->0, the DC-on wavelet recon is structurally FBP-bounded on sparse breast (the CG-DC/prior chain never beats the plain FBP baseline) -> spend remaining iters confirming via steps/n_cg then conclude. (5) BUDGET ~90s. (6) iter-7 on landing.", "run_id": "breast-ct-claude-agentic-fastdiff-wdm-wavelet-constrained-search-20260703-01", "runtime": {"elapsed_s": 98.4136073589325}, "schema_version": 3, "solver_key": "fastdiff-wdm-wavelet-constrained", "solver_name": "Fast-diffusion WDM (wavelet, constrained DC)", "split": {"train_n": 3600, "val_n": 200}, "status": "discard", "ts": "2026-07-06T20:54:51Z"}
{"advice_for_others": "fastdiff_wdm_wavelet_constrained-claude-agentic: val_n=200, seed=42, fd_recon_ckpt=/cluster/maier/Agent4CT/checkpoints/fast_diffusion_wavelet_breast.pt, fd_recon_steps=8, fd_recon_init=fbp, fd_recon_init_t=0.02, fd_recon_eta=1.0, fd_recon_dc=1, fd_recon_dc_n_cg=5, fd_recon_dc_relax=1.0, dataset_kind=breast_ct, rationale=iter-7 INIT_T asymptote pin, breast-native wavelet CONSTRAINED, val=200. SIX-BOX: (1) PRIOR: init_t@relax1.0: 0.7->16.5,0.4->19.4,0.2->22.0,0.1->25.2,0.05->28.9dB (RMSE 1.23e-2). Monotonic, still below baseline 36.3dB/5.21e-3. hr=0. (2) FAILURE MODE: prior net-harmful; recon = light-denoised-FBP+CG-DC and rises toward but has not reached baseline. (3) ONE KNOB: init_t 0.05->0.02 (essentially prior-off). (4) HYPOTHESIS: near-flat vs iter-6 -> pins the init_t->0 asymptote. If PSNR ~29-31 and still <36, confirms the DC-on wavelet recon at NFE8/CG5 is FBP-bounded on sparse breast. (5) BUDGET ~90s. (6) iter-8 pivots to the OTHER DC lever (dc_n_cg up: does a stronger least-squares CG solve at this low init_t finally reach/beat FBP?).", "agent": "fastdiff_wdm_wavelet_constrained-claude-agentic", "campaign": "search-20260703-01", "cfg_full": {"dataset_kind": "breast_ct", "fd_recon_ckpt": "/cluster/maier/Agent4CT/checkpoints/fast_diffusion_wavelet_breast.pt", "fd_recon_dc": 1, "fd_recon_dc_n_cg": 5, "fd_recon_dc_relax": 1.0, "fd_recon_eta": 1.0, "fd_recon_init": "fbp", "fd_recon_init_t": 0.02, "fd_recon_steps": 8, "rationale": "iter-7 INIT_T asymptote pin, breast-native wavelet CONSTRAINED, val=200. SIX-BOX: (1) PRIOR: init_t@relax1.0: 0.7->16.5,0.4->19.4,0.2->22.0,0.1->25.2,0.05->28.9dB (RMSE 1.23e-2). Monotonic, still below baseline 36.3dB/5.21e-3. hr=0. (2) FAILURE MODE: prior net-harmful; recon = light-denoised-FBP+CG-DC and rises toward but has not reached baseline. (3) ONE KNOB: init_t 0.05->0.02 (essentially prior-off). (4) HYPOTHESIS: near-flat vs iter-6 -> pins the init_t->0 asymptote. If PSNR ~29-31 and still <36, confirms the DC-on wavelet recon at NFE8/CG5 is FBP-bounded on sparse breast. (5) BUDGET ~90s. (6) iter-8 pivots to the OTHER DC lever (dc_n_cg up: does a stronger least-squares CG solve at this low init_t finally reach/beat FBP?).", "seed": 42, "val_n": 200}, "challenge": "breast_ct", "change_class": "architecture", "git_commit": "671da566", "images": {"comparison": "runs/breast-ct-claude-agentic-fastdiff-wdm-wavelet-constrained-search-20260703-01/iterations/iter-0007/comparison.png", "test_showcase": null, "valtest_showcase": null}, "iter": 7, "kept": false, "metrics": {"headroom": 0.0, "headroom_std": 0.0, "val_psnr": 33.69291305541992, "val_psnr_std": 0.22062543990200298, "val_rmse": 0.0070592560805380344, "val_rmse_std": 0.00013812586854162402, "val_ssim": 0.8362066745758057, "val_ssim_std": 0.004341262593877879}, "model": "claude-opus-4-8-1m", "obs_path": "breast-ct-claude-agentic-fastdiff-wdm-wavelet-constrained-search-20260703-01/iterations/iter-0007/observation.json", "obs_sha1": "22720a9945f71aa83f9989f6ccfd327c23faa027", "params_M": 3.824908, "params_source": "observation", "rationale": "fastdiff_wdm_wavelet_constrained-claude-agentic: val_n=200, seed=42, fd_recon_ckpt=/cluster/maier/Agent4CT/checkpoints/fast_diffusion_wavelet_breast.pt, fd_recon_steps=8, fd_recon_init=fbp, fd_recon_init_t=0.02, fd_recon_eta=1.0, fd_recon_dc=1, fd_recon_dc_n_cg=5, fd_recon_dc_relax=1.0, dataset_kind=breast_ct, rationale=iter-7 INIT_T asymptote pin, breast-native wavelet CONSTRAINED, val=200. SIX-BOX: (1) PRIOR: init_t@relax1.0: 0.7->16.5,0.4->19.4,0.2->22.0,0.1->25.2,0.05->28.9dB (RMSE 1.23e-2). Monotonic, still below baseline 36.3dB/5.21e-3. hr=0. (2) FAILURE MODE: prior net-harmful; recon = light-denoised-FBP+CG-DC and rises toward but has not reached baseline. (3) ONE KNOB: init_t 0.05->0.02 (essentially prior-off). (4) HYPOTHESIS: near-flat vs iter-6 -> pins the init_t->0 asymptote. If PSNR ~29-31 and still <36, confirms the DC-on wavelet recon at NFE8/CG5 is FBP-bounded on sparse breast. (5) BUDGET ~90s. (6) iter-8 pivots to the OTHER DC lever (dc_n_cg up: does a stronger least-squares CG solve at this low init_t finally reach/beat FBP?).", "run_id": "breast-ct-claude-agentic-fastdiff-wdm-wavelet-constrained-search-20260703-01", "runtime": {"elapsed_s": 153.10760164260864}, "schema_version": 3, "solver_key": "fastdiff-wdm-wavelet-constrained", "solver_name": "Fast-diffusion WDM (wavelet, constrained DC)", "split": {"train_n": 3600, "val_n": 200}, "status": "discard", "ts": "2026-07-06T20:58:14Z"}
{"advice_for_others": "fastdiff_wdm_wavelet_constrained-claude-agentic: val_n=200, seed=42, fd_recon_ckpt=/cluster/maier/Agent4CT/checkpoints/fast_diffusion_wavelet_breast.pt, fd_recon_steps=8, fd_recon_init=fbp, fd_recon_init_t=0.005, fd_recon_eta=1.0, fd_recon_dc=1, fd_recon_dc_n_cg=5, fd_recon_dc_relax=1.0, dataset_kind=breast_ct, rationale=iter-8 INIT_T asymptote pin (near prior-off), breast-native wavelet CONSTRAINED, val=200. SIX-BOX: (1) PRIOR: init_t@relax1.0: 0.1->25.2,0.05->28.9,0.02->33.7dB/RMSE7.06e-3. Still climbing, now only ~2.6dB below baseline 36.3dB/5.21e-3. hr=0. (2) FAILURE MODE: the recon asymptotes to (near-clean FBP embed + full CG-DC) as init_t->0; it approaches but has not crossed the plain-Hann-FBP baseline. (3) ONE KNOB: init_t 0.02->0.005 (essentially prior-off; FBP embedded almost clean). (4) HYPOTHESIS: near-flat vs iter-7 or a small further gain -> pins the true init_t->0 asymptote. If it saturates at ~34-35dB just under 36.3, the DC-on wavelet recon is FBP-bounded (the CG-DC-projected near-FBP never beats the plain FBP baseline; the wavelet prior adds no value on sparse breast). (5) BUDGET ~90s. (6) iter-9 tests dc_n_cg-up at this init_t (does a stronger LSQ CG solve finally cross the baseline?).", "agent": "fastdiff_wdm_wavelet_constrained-claude-agentic", "campaign": "search-20260703-01", "cfg_full": {"dataset_kind": "breast_ct", "fd_recon_ckpt": "/cluster/maier/Agent4CT/checkpoints/fast_diffusion_wavelet_breast.pt", "fd_recon_dc": 1, "fd_recon_dc_n_cg": 5, "fd_recon_dc_relax": 1.0, "fd_recon_eta": 1.0, "fd_recon_init": "fbp", "fd_recon_init_t": 0.005, "fd_recon_steps": 8, "rationale": "iter-8 INIT_T asymptote pin (near prior-off), breast-native wavelet CONSTRAINED, val=200. SIX-BOX: (1) PRIOR: init_t@relax1.0: 0.1->25.2,0.05->28.9,0.02->33.7dB/RMSE7.06e-3. Still climbing, now only ~2.6dB below baseline 36.3dB/5.21e-3. hr=0. (2) FAILURE MODE: the recon asymptotes to (near-clean FBP embed + full CG-DC) as init_t->0; it approaches but has not crossed the plain-Hann-FBP baseline. (3) ONE KNOB: init_t 0.02->0.005 (essentially prior-off; FBP embedded almost clean). (4) HYPOTHESIS: near-flat vs iter-7 or a small further gain -> pins the true init_t->0 asymptote. If it saturates at ~34-35dB just under 36.3, the DC-on wavelet recon is FBP-bounded (the CG-DC-projected near-FBP never beats the plain FBP baseline; the wavelet prior adds no value on sparse breast). (5) BUDGET ~90s. (6) iter-9 tests dc_n_cg-up at this init_t (does a stronger LSQ CG solve finally cross the baseline?).", "seed": 42, "val_n": 200}, "challenge": "breast_ct", "change_class": "architecture", "git_commit": "671da566", "images": {"comparison": "runs/breast-ct-claude-agentic-fastdiff-wdm-wavelet-constrained-search-20260703-01/iterations/iter-0008/comparison.png", "test_showcase": null, "valtest_showcase": null}, "iter": 8, "kept": false, "metrics": {"headroom": 0.0, "headroom_std": 0.0, "val_psnr": 35.192047119140625, "val_psnr_std": 0.20262076675151183, "val_rmse": 0.005940216593444347, "val_rmse_std": 0.00010127380835911327, "val_ssim": 0.8760147094726562, "val_ssim_std": 0.00517805484126801}, "model": "claude-opus-4-8-1m", "obs_path": "breast-ct-claude-agentic-fastdiff-wdm-wavelet-constrained-search-20260703-01/iterations/iter-0008/observation.json", "obs_sha1": "f5fb22c98179fa54099d2a6255df2db52a229545", "params_M": 3.824908, "params_source": "observation", "rationale": "fastdiff_wdm_wavelet_constrained-claude-agentic: val_n=200, seed=42, fd_recon_ckpt=/cluster/maier/Agent4CT/checkpoints/fast_diffusion_wavelet_breast.pt, fd_recon_steps=8, fd_recon_init=fbp, fd_recon_init_t=0.005, fd_recon_eta=1.0, fd_recon_dc=1, fd_recon_dc_n_cg=5, fd_recon_dc_relax=1.0, dataset_kind=breast_ct, rationale=iter-8 INIT_T asymptote pin (near prior-off), breast-native wavelet CONSTRAINED, val=200. SIX-BOX: (1) PRIOR: init_t@relax1.0: 0.1->25.2,0.05->28.9,0.02->33.7dB/RMSE7.06e-3. Still climbing, now only ~2.6dB below baseline 36.3dB/5.21e-3. hr=0. (2) FAILURE MODE: the recon asymptotes to (near-clean FBP embed + full CG-DC) as init_t->0; it approaches but has not crossed the plain-Hann-FBP baseline. (3) ONE KNOB: init_t 0.02->0.005 (essentially prior-off; FBP embedded almost clean). (4) HYPOTHESIS: near-flat vs iter-7 or a small further gain -> pins the true init_t->0 asymptote. If it saturates at ~34-35dB just under 36.3, the DC-on wavelet recon is FBP-bounded (the CG-DC-projected near-FBP never beats the plain FBP baseline; the wavelet prior adds no value on sparse breast). (5) BUDGET ~90s. (6) iter-9 tests dc_n_cg-up at this init_t (does a stronger LSQ CG solve finally cross the baseline?).", "run_id": "breast-ct-claude-agentic-fastdiff-wdm-wavelet-constrained-search-20260703-01", "runtime": {"elapsed_s": 141.6494698524475}, "schema_version": 3, "solver_key": "fastdiff-wdm-wavelet-constrained", "solver_name": "Fast-diffusion WDM (wavelet, constrained DC)", "split": {"train_n": 3600, "val_n": 200}, "status": "discard", "ts": "2026-07-06T21:27:06Z"}
