iter	commit	val_score	headroom	status	change_class	agent	model	val_psnr	val_rmse	elapsed_s	params_M	rationale
17	671da566	0.949871	0.308882	keep	architecture	wu_2015_trainable-claude-agentic	claude-opus-4-8-1m	39.5331	3.603685e-03	578.1	1.2e-05	wu_2015_trainable-claude-agentic: wu_n_bands=6, wu_n_outer=2, wu_motion_range=8, wu_motion_window=2, epochs=12, batch_size=1, lr=7e-05, weight_decay=0.0, loss_base=mse, lambda_neg=0.7, wu_soft_thresh=0.0008, wu_sigmoid_slope=6.0, wu_sigmoid_offset=1.0, wu_band_scale=1.0, wu_residual_blend=1.0, train_n=600, val_n=200, val_chunk=4, seed=42, rationale=ITER-17 (one knob vs iter-11 best). NUMBERS: soft_thresh=0.0008 optimum; motion_range=8 confirmed (12->0.2875 worse). Plateau 0.3088. Base = iter-11. FAILURE MODE: motion + residual knobs exhausted; sigmoid_slope INIT (band roll-off steepness around the Nyquist boundary f.dR==offset) untested this campaign. TPE kept 10.0. ONE KNOB: wu_sigmoid_slope 10.0 -> 6.0 (INIT only; still trainable, NO param change, 12 params). HYPOTHESIS: if the band roll-off starts shallower (slope=6) I expect val hr >= 0.3088 because a smoother sigmoid transition lets adjacent radial-frequency bands overlap and the learnable per-band scales get more graceful control over the aliasing-free FBP; risk = too-soft transition blurs the alias-suppression selection (hr down) -> slope=10 confirmed. Budget: ~735s.
18	671da566	0.949855	0.309723	keep	architecture	wu_2015_trainable-claude-agentic	claude-opus-4-8-1m	39.5437	3.599300e-03	737.0	1.2e-05	wu_2015_trainable-claude-agentic: wu_n_bands=6, wu_n_outer=2, wu_motion_range=8, wu_motion_window=2, epochs=12, batch_size=1, lr=7e-05, weight_decay=0.0, loss_base=mse, lambda_neg=0.7, wu_soft_thresh=0.0008, wu_sigmoid_slope=4.0, wu_sigmoid_offset=1.0, wu_band_scale=1.0, wu_residual_blend=1.0, train_n=600, val_n=200, val_chunk=4, seed=42, rationale=ITER-18 (one knob vs iter-17 best). NUMBERS: sigmoid_slope 10->0.30880(iter-11), 6->0.30888(iter-17 marginal BEST, +8e-5). Shallower band roll-off helps a hair. FAILURE MODE: at the ultra-low-param ceiling ~0.309; gains now sub-1e-3 (noise-floor territory). ONE KNOB: wu_sigmoid_slope 6.0 -> 4.0 (INIT, NO param change, 12 params). HYPOTHESIS: if slope=4 gives hr > 0.30888 the shallow-roll-off trend continues and I adopt it; if hr < 0.30888 the slope optimum is near 6 and the method has fully plateaued at hr~0.309 (12 params) -- consistent with the known ultra-low-param ceiling. Budget: ~735s.
19	671da566	0.949733	0.311302	keep	architecture	wu_2015_trainable-claude-agentic	claude-opus-4-8-1m	39.5636	3.591066e-03	712.3	1.2e-05	wu_2015_trainable-claude-agentic: wu_n_bands=6, wu_n_outer=2, wu_motion_range=8, wu_motion_window=2, epochs=12, batch_size=1, lr=7e-05, weight_decay=0.0, loss_base=mse, lambda_neg=0.7, wu_soft_thresh=0.0008, wu_sigmoid_slope=2.5, wu_sigmoid_offset=1.0, wu_band_scale=1.0, wu_residual_blend=1.0, train_n=600, val_n=200, val_chunk=4, seed=42, rationale=ITER-19 (one knob vs iter-18 best). NUMBERS sigmoid_slope: 10->0.30880, 6->0.30888, 4->0.30972(iter-18 BEST). Monotone improvement as the band roll-off shallows. FAILURE MODE: at ultra-low-param ceiling ~0.31; a shallower Nyquist-boundary sigmoid keeps lifting hr (softer band overlap -> the learnable per-band scales get finer spectral control). ONE KNOB: wu_sigmoid_slope 4.0 -> 2.5 (INIT, NO param change, 12 params). HYPOTHESIS: if slope=2.5 gives hr > 0.30972 the shallow-roll-off trend continues toward a broad optimum; if hr < 0.30972 the slope optimum brackets near 4 and iter-18 stands as the campaign best. Budget: ~735s.
20	671da566	0.949356	0.312669	keep	architecture	wu_2015_trainable-claude-agentic	claude-opus-4-8-1m	39.5809	3.583936e-03	534.2	1.2e-05	wu_2015_trainable-claude-agentic: wu_n_bands=6, wu_n_outer=2, wu_motion_range=8, wu_motion_window=2, epochs=12, batch_size=1, lr=7e-05, weight_decay=0.0, loss_base=mse, lambda_neg=0.7, wu_soft_thresh=0.0008, wu_sigmoid_slope=1.5, wu_sigmoid_offset=1.0, wu_band_scale=1.0, wu_residual_blend=1.0, train_n=600, val_n=200, val_chunk=4, seed=42, rationale=ITER-20 (FINAL, one knob vs iter-19 best). NUMBERS sigmoid_slope descent: 10->0.30880, 6->0.30889, 4->0.30972, 2.5->0.31130(iter-19 BEST). Monotone climbing as the Nyquist-boundary band roll-off shallows. FAILURE MODE: at the ultra-low-param ceiling but a softer band-overlap keeps lifting hr; peak not yet bracketed on the shallow side. ONE KNOB: wu_sigmoid_slope 2.5 -> 1.5 (INIT, NO param change, 12 params). HYPOTHESIS: if slope=1.5 gives hr > 0.31130 the shallow trend continues toward a broad max; if hr < 0.31130 the sigmoid_slope optimum brackets near 2.5 and iter-19 (hr=0.3113) is the campaign best. Either way this HARD-STOP iter-20 closes the six-box search with the slope axis characterized. Budget: ~735s.
