iter	commit	val_score	headroom	status	change_class	agent	model	val_psnr	val_rmse	elapsed_s	params_M	rationale
34		0.9623	0.379638	keep	architecture	param_efficient-claude-agentic	claude-opus-4-8-1m	43.3922	6.090249e-04	1241.2	0.001945	param_efficient-claude-agentic: val_n=214, rationale=Push the dominant Manduca lever: 3->5 parallel projection scales (octave ladder 0.6-4.7px) on the iter-32 champion (0.4004). Per-scale zero-init gains so seed==iter-32. Tests if more projection scales gain beyond 3 or saturate at the dense-view ceiling. ~1945 params., reg_type=foe, n_iter=5, learnable_alpha=True, per_step_alpha=False, momentum=False, cnn_channels=12, cnn_layers=3, alpha_init=0.1, clip_max=0.05, epochs=16, cosine_lr=True, cosine_lr_min=1e-05, lr=0.005, max_train_s=1080, train_n=200, foe_n_filters=24, foe_kernel=7, foe_n_bumps=31, foe_rbf_init_std=0.0, foe_filter_init_std=0.05, foe_x_range=1.0, bilateral_on_top=False, proj_filter_on=True, proj_n_bf=5, proj_kernel=5, proj_sigma_x=0.83, proj_sigma_y=0.83, proj_sigma_r=1.5, proj_N0=None, proj_eps=1.0, proj_gain_init=0.0, anisotropic_on_top=True, aniso_n_orient=4, aniso_kernel=7, aniso_sigma_along=2.0, aniso_sigma_across=0.6, aniso_gain_init=0.0, proj_multiscale=True, proj_sigmas=[0.6, 1.0, 1.7, 2.8, 4.7]
35		0.956078	0.369018	keep	architecture	param_efficient-claude-agentic	claude-opus-4-8-1m	43.2447	6.194510e-04	1228.6	0.000977	param_efficient-claude-agentic: val_n=214, rationale=FRONTIER on the iter-32 3-scale champion: FoE nf24->12 (~977p). Consistent Pareto mid-point vs iter-32 nf24 0.4004 @ 1937p., reg_type=foe, n_iter=5, learnable_alpha=True, per_step_alpha=False, momentum=False, cnn_channels=12, cnn_layers=3, alpha_init=0.1, clip_max=0.05, epochs=16, cosine_lr=True, cosine_lr_min=1e-05, lr=0.005, max_train_s=1080, train_n=200, foe_n_filters=12, foe_kernel=7, foe_n_bumps=31, foe_rbf_init_std=0.0, foe_filter_init_std=0.05, foe_x_range=1.0, bilateral_on_top=False, proj_filter_on=True, proj_n_bf=3, proj_kernel=5, proj_sigma_x=0.83, proj_sigma_y=0.83, proj_sigma_r=1.5, proj_N0=None, proj_eps=1.0, proj_gain_init=0.0, anisotropic_on_top=True, aniso_n_orient=4, aniso_kernel=7, aniso_sigma_along=2.0, aniso_sigma_across=0.6, aniso_gain_init=0.0, proj_multiscale=True, proj_sigmas=[0.83, 1.66, 3.32]
36		0.926179	0.308483	keep	architecture	param_efficient-claude-agentic	claude-opus-4-8-1m	42.449	6.788796e-04	1324.2	0.000497	param_efficient-claude-agentic: val_n=214, rationale=FRONTIER on the iter-32 3-scale champion: FoE nf24->6 (~487p). Pareto low-point - how much headroom survives at ~500 params?, reg_type=foe, n_iter=5, learnable_alpha=True, per_step_alpha=False, momentum=False, cnn_channels=12, cnn_layers=3, alpha_init=0.1, clip_max=0.05, epochs=16, cosine_lr=True, cosine_lr_min=1e-05, lr=0.005, max_train_s=1080, train_n=200, foe_n_filters=6, foe_kernel=7, foe_n_bumps=31, foe_rbf_init_std=0.0, foe_filter_init_std=0.05, foe_x_range=1.0, bilateral_on_top=False, proj_filter_on=True, proj_n_bf=3, proj_kernel=5, proj_sigma_x=0.83, proj_sigma_y=0.83, proj_sigma_r=1.5, proj_N0=None, proj_eps=1.0, proj_gain_init=0.0, anisotropic_on_top=True, aniso_n_orient=4, aniso_kernel=7, aniso_sigma_along=2.0, aniso_sigma_across=0.6, aniso_gain_init=0.0, proj_multiscale=True, proj_sigmas=[0.83, 1.66, 3.32]
37		0.371905	0	discard	architecture	param_efficient-claude-agentic	claude-opus-4-8-1m	16.5905	1.332648e-02	1355.1	0.001937	param_efficient-claude-agentic: val_n=214, rationale=Seed-robustness of the iter-32 champion (FoE + 3-scale Manduca + anisotropic, 0.4004 @ 1937p): re-run at seed 123 to confirm the 0.40 val hr is robust, not seed-luck. Validates the headline for the iter-40 findings writeup., reg_type=foe, n_iter=5, learnable_alpha=True, per_step_alpha=False, momentum=False, cnn_channels=12, cnn_layers=3, alpha_init=0.1, clip_max=0.05, epochs=16, cosine_lr=True, cosine_lr_min=1e-05, lr=0.005, max_train_s=1080, train_n=200, foe_n_filters=24, foe_kernel=7, foe_n_bumps=31, foe_rbf_init_std=0.0, foe_filter_init_std=0.05, foe_x_range=1.0, bilateral_on_top=False, proj_filter_on=True, proj_n_bf=3, proj_kernel=5, proj_sigma_x=0.83, proj_sigma_y=0.83, proj_sigma_r=1.5, proj_N0=None, proj_eps=1.0, proj_gain_init=0.0, anisotropic_on_top=True, aniso_n_orient=4, aniso_kernel=7, aniso_sigma_along=2.0, aniso_sigma_across=0.6, aniso_gain_init=0.0, proj_multiscale=True, proj_sigmas=[0.83, 1.66, 3.32], seed=123
38		0.371905	0	discard	architecture	param_efficient-claude-agentic	claude-opus-4-8-1m	16.5905	1.332648e-02	1298.7	0.001929	param_efficient-claude-agentic: val_n=214, rationale=Seed-robustness of the SIMPLER iter-31 (FoE + 1-scale Manduca + anisotropic, 0.3968 @ seed42): does it converge at seed 123 where the 3-scale iter-32 diverged? If yes, iter-31 is the seed-ROBUST champion (slightly lower hr, stable across seeds)., reg_type=foe, n_iter=5, learnable_alpha=True, per_step_alpha=False, momentum=False, cnn_channels=12, cnn_layers=3, alpha_init=0.1, clip_max=0.05, epochs=16, cosine_lr=True, cosine_lr_min=1e-05, lr=0.005, max_train_s=1080, train_n=200, foe_n_filters=24, foe_kernel=7, foe_n_bumps=31, foe_rbf_init_std=0.0, foe_filter_init_std=0.05, foe_x_range=1.0, bilateral_on_top=False, proj_filter_on=True, proj_n_bf=1, proj_kernel=5, proj_sigma_x=0.83, proj_sigma_y=0.83, proj_sigma_r=1.5, proj_N0=None, proj_eps=1.0, proj_gain_init=0.0, anisotropic_on_top=True, aniso_n_orient=4, aniso_kernel=7, aniso_sigma_along=2.0, aniso_sigma_across=0.6, aniso_gain_init=0.0, seed=123
39		0.371905	0	discard	architecture	param_efficient-claude-agentic	claude-opus-4-8-1m	16.5905	1.332648e-02	1281.2	0.001926	param_efficient-claude-agentic: val_n=214, rationale=Seed-robustness of FoE + 1-scale Manduca (iter-28, 0.394 @ seed42, NO anisotropic) at seed 123. Both aniso configs (iter-31/32) diverged at seed 123; if THIS converges, the anisotropic term is the instability and FoE+Manduca is the seed-ROBUST recommended champion (0.394; aniso +0.0026 not worth the fragility)., reg_type=foe, n_iter=5, learnable_alpha=True, per_step_alpha=False, momentum=False, cnn_channels=12, cnn_layers=3, alpha_init=0.1, clip_max=0.05, epochs=16, cosine_lr=True, cosine_lr_min=1e-05, lr=0.005, max_train_s=1080, train_n=200, foe_n_filters=24, foe_kernel=7, foe_n_bumps=31, foe_rbf_init_std=0.0, foe_filter_init_std=0.05, foe_x_range=1.0, bilateral_on_top=False, proj_filter_on=True, proj_n_bf=1, proj_kernel=5, proj_sigma_x=0.83, proj_sigma_y=0.83, proj_sigma_r=1.5, proj_N0=None, proj_eps=1.0, proj_gain_init=0.0, seed=123
