iter	commit	val_score	headroom	status	change_class	agent	model	val_psnr	val_rmse	elapsed_s	params_M	rationale
23		0.898337	0.24012	keep	architecture	param_efficient-claude-agentic	claude-opus-4-8-1m	36.4629	7.513234e-04	1247.6	0.001921	param_efficient-claude-agentic: val_n=214, rationale=iter-23 ORDERED-SUBSETS DC training (idea A denoiser-pretrain DEAD: froze x2 hr0, the FoE reg only learns COUPLED through the DC unroll). MODEL byte-for-byte iter-7 (FoE nf24/k7/nb31 1920p + 1 alpha = 1921p, K=5 tied prox+DC, single scalar alpha, no momentum/per-step/learned-init, foe_rbf_init_std=0.0, peak lr 5e-3, PARTIAL cosine T_max=16, max_train_s=1080, val_n=214). two_phase=False (SINGLE-PHASE iter-7 trainer). ONLY change: DURING TRAINING the DC term uses S=2304/4=576 RANDOM views/step via a reduced-angle projector R_S + the strided sino g[:,off::r] (ordered-subsets, random offset re-randomized each step; reduced projector per (ps,off) cached with angle_start=2pi*off/2304 so its S views land EXACTLY on the strided columns; each gets its OWN power-iter ||R_S^T R_S|| so alpha stays O(1)). r=4 => projection physics ~4x cheaper/step => ESTIMATED ~3-4x more epochs in-budget (iter-7 ~8 -> ~24-30) => the FoE finally gets ITNet-like gradient exposure on the COUPLED objective. INFERENCE/val scoring uses the FULL 2304-view DC (verified: eval projector n_angles==2304 assert; full dc_norm) -> NO train/test recon mismatch. STABILITY: params unchanged 1921; DC_S is a strict subset of the full DC physics with dc_norm rescaled; recon dynamics + trainer byte-for-byte iter-7. HYPOTHESIS: cheaper subsampled-view training -> more epochs -> lower val-RMSE -> hr>0.2515 (training-bound confirmed). If it saturates ~0.25/below -> ceiling is CAPACITY not training (clean decisive result). PREDICTED hr ~0.27-0.30. Telemetry: n_train_views=576 vs eval 2304, epochs_done vs iter-7~8. DEAD ENDS not reintroduced: projection-free/denoiser pretrain, two-phase, capacity^, K>5, momentum/per-step-alpha, learned-init, peak LR>5e-3, constant LR, full anneal to 1e-5, bilateral-alone. Champion iter-7 val 0.2515/test 0.1852., reg_type=foe, n_iter=5, learnable_alpha=True, per_step_alpha=False, momentum=False, cnn_channels=12, cnn_layers=3, alpha_init=0.1, clip_max=0.05, epochs=16, cosine_lr=True, cosine_lr_min=1e-05, lr=0.005, max_train_s=1080, train_n=200, foe_n_filters=24, foe_kernel=7, foe_n_bumps=31, foe_rbf_init_std=0.0, foe_filter_init_std=0.05, foe_x_range=1.0, two_phase=False, train_view_subset=4, train_view_random_offset=True
24		0.292345	0	discard	architecture	param_efficient-claude-agentic	claude-opus-4-8-1m	11.3805	1.348786e-02	1231.2	0.001921	param_efficient-claude-agentic: val_n=214, rationale=iter-24 STEERABLE/ROTATION-EQUIVARIANT FoE (iso-param 1,921). Pivot away from training-efficiency (iters 21-23 settled: pretrain FROZE x2; ordered-subsets NO speedup, hr 0.2401<iter-7). Attack HEADROOM-PER-PARAM at same ~8-ep coupled training. FAILURE MODE: iter-7 24 FREE 7x7 analysis kernels are orientation-blind -> must spend separate weights on each rotated copy. CHANGE (ONE knob, analysis-filter parameterization): reg_type foe->steerable_foe; each filter K_f=sum_b c_fb*B_b over a SHARED FIXED steerable basis (n_rad=7 Gaussian radial profiles x circular-harmonic orders 0..3 -> Nb=49 = complete 7x7 frame). Span closed under rotation -> rotation-steerable by construction. OPTION (a) ISO-PARAM: nf24*Nb49=1,176 analysis (BYTE-IDENTICAL to iter-7 free) + 24*31=744 rbf + 1 alpha = 1,921 TOTAL exactly; basis atoms FIXED buffers (0 trainable). STABILITY: zero-init rbf (foe_rbf_init_std=0.0) -> reg(x)=0 at init (verified =0.0); coeff_std 0.05 over L2-normed atoms -> eff kernel element std 0.0496~iter-7; K=5, single tied scalar alpha, plain Adam peak lr 5e-3 PARTIAL cosine T_max=16, grad_clip=1.0, bs=1, per-sample-ps, full-view DC -- all iter-7 byte-for-byte; only the analysis frame changes (free 49-vector -> 49 steerable coeffs). HYPOTHESIS: equivariance gives more denoising power per param -> val-RMSE<7.40e-4 at same params/training -> hr>0.2515. NULL (hr~0.2515) cleanly says the free 7x7 bank was already near-optimal per param. PREDICTED val hr ~0.25-0.28. DEAD ENDS NOT reintroduced: pretrain, ordered-subsets, capacity^, K>5, momentum/per-step-alpha, learned-init, peak LR>5e-3, constant LR, full anneal to 1e-5, bilateral-alone., reg_type=steerable_foe, n_iter=5, learnable_alpha=True, per_step_alpha=False, momentum=False, cnn_channels=12, cnn_layers=3, alpha_init=0.1, clip_max=0.05, epochs=16, cosine_lr=True, cosine_lr_min=1e-05, lr=0.005, max_train_s=1080, train_n=200, foe_n_filters=24, foe_kernel=7, foe_n_bumps=31, foe_rbf_init_std=0.0, foe_filter_init_std=0.05, foe_x_range=1.0, steer_n_rad=7, steer_max_order=3, steer_coeff_init_std=0.05, two_phase=False, train_view_subset=1, learned_init=False, cosine_t_max=16, warmup_frac=0.0, weight_decay=0.0
25		0.922664	0.292997	keep	architecture	param_efficient-claude-agentic	claude-opus-4-8-1m	37.0893	6.990415e-04	1291.6	0.001925	param_efficient-claude-agentic: val_n=214, rationale=iter-25 composed reg = FoE(x) + gain*(x-BF(x)), zero-init gain. SIX-BOX: PRIOR iter-7 CHAMPION FoE nf24/k7/nb31 1921p val hr 0.2515/test 0.1852 (UNDER-TRAINED, razor-sharp optimum); extension 4/4 fail (21/22 pretrain FROZE, 23 ordered-subsets NULL 0.2401, 24 steerable DIVERGED) => only changes that START byte-for-byte iter-7 stay stable. FAILURE MODE: every prior change perturbed training off iter-7 seed; never tried ADDING an orthogonal complementary term that is identity (zero) at init. CHANGE (ONE knob, bilateral_on_top=true): add a single TrainableBilateralFilter2d edge residual term scaled by ONE zero-init scalar gain; FoE unchanged (nf24/k7, zero-init RBF). +4 params (3 sigmas + 1 gain) => total 1925 (iter-7 1921). VERIFY-AT-INIT: gain=0 AND zero-init RBF => reg(x)==FoE(x)==0 at init == iter-7 seed byte-for-byte (runtime self-check asserts gain==0 and ||reg-FoE||==0). STABILITY: strict superset of iter-7; bilateral term is additive correction lifted off zero only by supervised grad; no capacity^/no analysis reparam/no pooling/no extra stage/no added depth; trainer iter-7 EXACTLY (plain Adam, peak lr 5e-3, partial cosine T_max=16, grad_clip 1.0, bs1, per-sample-ps, full-view DC, max_train_s 1080, train_n 200, val_n 214). HYPOTHESIS: complementary edge term lifts val-RMSE below 7.40e-4 => hr>0.2515; NULL (gain->~0, hr~0.2515) = FoE already subsumes edge prior + iter-7 reproduces; SAFE (worst case == iter-7). PRED hr ~0.25-0.27. Report learned gain. DEAD ENDS not reintroduced: pretrain/ordered-subsets/steerable/capacity^/K>5/momentum/per-step-alpha/learned-init/LR>5e-3/constant-LR/full-anneal/bilateral-ALONE., reg_type=foe, n_iter=5, learnable_alpha=True, per_step_alpha=False, momentum=False, cnn_channels=12, cnn_layers=3, alpha_init=0.1, clip_max=0.05, epochs=16, cosine_lr=True, cosine_lr_min=1e-05, lr=0.005, max_train_s=1080, train_n=200, foe_n_filters=24, foe_kernel=7, foe_n_bumps=31, foe_rbf_init_std=0.0, foe_filter_init_std=0.05, foe_x_range=1.0, bilateral_on_top=True, n_bf=1, bf_kernel=7, bf_sigma_x=1.5, bf_sigma_y=1.5, bf_sigma_r=0.02, bf_gain_init=0.0
26		0.935235	0.340021	keep	architecture	param_efficient-claude-agentic	claude-opus-4-8-1m	37.6872	6.525470e-04	1299.2	0.001926	param_efficient-claude-agentic: val_n=214, rationale=iter-26 DUAL-DOMAIN (idea G): FIRST projection-domain lever. PREPEND a zero-init NOISE-ADAPTIVE Manduca proj filter (Manduca 2009 photon/Anscombe variance-stabilising bilateral) to the iter-7 CHAMPION FoE image-domain unroll. sino_filtered = sino + proj_gain*(Manduca(sino)-sino): N=N0*exp(-P) photon counts, Q=sqrt(N) Anscombe variance stabilisation, Qhat=BF(Q) single fixed range sigma (IMPLICITLY noise-adaptive: dense low-count noisy rays smoothed more, scale=learnable log_N0), Nhat=Qhat^2, Phat=-ln(Nhat/N0). ZERO-INIT proj_gain => sino_filtered==sino byte-for-byte => SAME LD-FBP init + SAME DC g => whole pipeline == iter-7 at init (worst case == iter-7, no regression). Filtered sino feeds BOTH the LD-FBP init (recomputed in forward so grads flow to proj params) AND the DC term. FoE image reg UNCHANGED (nf24/k7/nb31, zero-init RBF). +5 params (3 sigma + log_N0 + gain) = 1926 vs iter-7 1921. CAVEAT: proj-domain filtering NEAR-COSMETIC/NEGATIVE STANDALONE on dense full-view Mayo (2304 views -> FBP already averages projection noise; Manduca standalone test hr ~0.069, PWLS ray-weighting NEGATIVE). This iter tests the COMBINATION on the FoE baseline. REALISTIC: modest/NULL (proj_gain->~0, hr~0.2515) confirming dense-view ceiling. Trainer iter-7 byte-for-byte: K=5 tied scalar alpha, no momentum/per-step-alpha, peak lr 5e-3, PARTIAL cosine T_max=16, max_train_s=1080, train_n=200, val_n=214, per-sample-ps, grad_clip=1.0, full-view DC. PREDICTED hr ~0.25-0.26 (gain->~0). REPORT proj_gain + learned proj sigma stack + log_N0., reg_type=foe, n_iter=5, learnable_alpha=True, per_step_alpha=False, momentum=False, cnn_channels=12, cnn_layers=3, alpha_init=0.1, clip_max=0.05, epochs=16, cosine_lr=True, cosine_lr_min=1e-05, lr=0.005, max_train_s=1080, train_n=200, foe_n_filters=24, foe_kernel=7, foe_n_bumps=31, foe_rbf_init_std=0.0, foe_filter_init_std=0.05, foe_x_range=1.0, bilateral_on_top=False, proj_filter_on=True, proj_n_bf=1, proj_kernel=5, proj_sigma_x=0.83, proj_sigma_y=0.83, proj_sigma_r=1.5, proj_N0=None, proj_eps=1.0, proj_gain_init=0.0
27		0.92967	0.306436	keep	architecture	param_efficient-claude-agentic	claude-opus-4-8-1m	37.256	6.857543e-04	1262.0	0.001933	param_efficient-claude-agentic: val_n=214, rationale=iter-27 SCALE iter-25 CHAMPION (hr 0.2930 @1925p): the single zero-init-gain image bilateral that TRAINED NON-ZERO -> +0.041 hr. PRIOR: iter-7 FoE-only 0.2515 ceiling; iter-25 +1 parallel bilateral @sigma(1.5,1.5) NEW CHAMPION 0.2930. FAILURE MODE: iter-25 single-scale RF cannot both preserve fine edges AND smooth broad noise; campaign multi-scale via POOLING (microunet 2/5/6) REGRESSED (psnr cap 32.4). CHANGE (ONE knob): scale bilateral branch M=1->M=3 MULTI-RF PARALLEL BANK reg(x)=FoE(x)+Sum_i gain_i*(x-BF_i(x)), distinct spatial sigma {0.8,1.6,3.2}px (octave ladder small/mid/large), each PER-FILTER zero-init gain. NO pooling. PARAMS: FoE 1920 + alpha 1 + 3*(3 sigma + 1 gain)=12 = 1933 (iter-7 1921, iter-25 1925; +8 over iter-25). VERIFIED LOCAL: 1933p, 3 zero-init gains, bank==0 at init regardless of sigma, FoE(x)==0 (zero-init RBF) => reg==iter-7 byte-for-byte. KEEP iter-25/7: FoE nf24/k7/nb31 zero-init RBF, K=5 tied prox+DC, single scalar alpha, no momentum/per-step-alpha, peak lr 5e-3, partial cosine T_max=16, max_train_s=1080, train_n=200, val_n=214, per-sample-ps, grad_clip, full-view DC. HYPOTHESIS: multiple spatial scales add MORE headroom than iter-25 single bilateral -> hr>0.2930; NULL (one gain non-zero, hr~0.2930)=one scale suffices. SAFE: zero-init gains => worst case ~iter-25/iter-7. PREDICTED hr ~0.293-0.31. DEAD ENDS avoided: pooling/U-Net, denoiser-pretrain, ordered-subsets, steerable reparam, FoE-capacity, K>5, momentum, peak LR>5e-3, constant LR, bilateral-ALONE., reg_type=foe, n_iter=5, learnable_alpha=True, per_step_alpha=False, momentum=False, cnn_channels=12, cnn_layers=3, alpha_init=0.1, clip_max=0.05, epochs=16, cosine_lr=True, cosine_lr_min=1e-05, lr=0.005, max_train_s=1080, train_n=200, foe_n_filters=24, foe_kernel=7, foe_n_bumps=31, foe_rbf_init_std=0.0, foe_filter_init_std=0.05, foe_x_range=1.0, bilateral_on_top=True, n_bf=3, bf_kernel=7, bf_sigma_x=1.5, bf_sigma_y=1.5, bf_sigma_r=0.02, bf_gain_init=0.0, bf_multiscale=True, bf_sigmas=[0.8, 1.6, 3.2], proj_filter_on=False
28		0.970407	0.394173	keep	architecture	param_efficient-claude-agentic	claude-opus-4-8-1m	43.5981	5.947549e-04	1328.6	0.001926	param_efficient-claude-agentic: val_n=214, rationale=RE-ANCHOR at display_max=0.09 + upper-clamp-removed: re-run iter-26 (FoE + gentle Manduca PROJECTION filter, the old 0.05 champion) to establish the 0.09 val-hr baseline, reg_type=foe, n_iter=5, learnable_alpha=True, per_step_alpha=False, momentum=False, cnn_channels=12, cnn_layers=3, alpha_init=0.1, clip_max=0.05, epochs=16, cosine_lr=True, cosine_lr_min=1e-05, lr=0.005, max_train_s=1080, train_n=200, foe_n_filters=24, foe_kernel=7, foe_n_bumps=31, foe_rbf_init_std=0.0, foe_filter_init_std=0.05, foe_x_range=1.0, bilateral_on_top=False, proj_filter_on=True, proj_n_bf=1, proj_kernel=5, proj_sigma_x=0.83, proj_sigma_y=0.83, proj_sigma_r=1.5, proj_N0=None, proj_eps=1.0, proj_gain_init=0.0
29		0.965994	0.34638	keep	architecture	param_efficient-claude-agentic	claude-opus-4-8-1m	42.9385	6.416753e-04	1414.8	0.001925	param_efficient-claude-agentic: val_n=214, rationale=RE-ANCHOR at 0.09 + clamp-removed: re-run iter-25 (FoE + image bilateral) for the 0.09 val frontier, reg_type=foe, n_iter=5, learnable_alpha=True, per_step_alpha=False, momentum=False, cnn_channels=12, cnn_layers=3, alpha_init=0.1, clip_max=0.05, epochs=16, cosine_lr=True, cosine_lr_min=1e-05, lr=0.005, max_train_s=1080, train_n=200, foe_n_filters=24, foe_kernel=7, foe_n_bumps=31, foe_rbf_init_std=0.0, foe_filter_init_std=0.05, foe_x_range=1.0, bilateral_on_top=True, n_bf=1, bf_kernel=7, bf_sigma_x=1.5, bf_sigma_y=1.5, bf_sigma_r=0.02, bf_gain_init=0.0
30		0.963175	0.38121	keep	architecture	param_efficient-claude-agentic	claude-opus-4-8-1m	43.4142	6.074813e-04	1253.4	0.00193	param_efficient-claude-agentic: val_n=214, rationale=RECOMBINATION(a) at 0.09: compose the two winning biases on the FoE+Manduca champion (iter-28, 0.3942) — add a zero-init image BILATERAL term on top of FoE+Manduca-proj. Seed == iter-28 (bilateral gain 0). Tests whether image edge-preserving cleanup STACKS on the projection-domain streak fix. params ~1930., reg_type=foe, n_iter=5, learnable_alpha=True, per_step_alpha=False, momentum=False, cnn_channels=12, cnn_layers=3, alpha_init=0.1, clip_max=0.05, epochs=16, cosine_lr=True, cosine_lr_min=1e-05, lr=0.005, max_train_s=1080, train_n=200, foe_n_filters=24, foe_kernel=7, foe_n_bumps=31, foe_rbf_init_std=0.0, foe_filter_init_std=0.05, foe_x_range=1.0, bilateral_on_top=True, proj_filter_on=True, proj_n_bf=1, proj_kernel=5, proj_sigma_x=0.83, proj_sigma_y=0.83, proj_sigma_r=1.5, proj_N0=None, proj_eps=1.0, proj_gain_init=0.0, n_bf=1, bf_kernel=7, bf_sigma_x=1.5, bf_sigma_y=1.5, bf_sigma_r=0.02, bf_gain_init=0.0
31		0.971498	0.396783	keep	architecture	param_efficient-claude-agentic	claude-opus-4-8-1m	43.6356	5.921929e-04	1305.0	0.001929	param_efficient-claude-agentic: val_n=214, rationale=RECOMBINATION(b) at 0.09 — add an IMAGE-DOMAIN ORIENTED ANISOTROPIC term for RESIDUAL DIRECTIONAL streaks on top of the iter-28 champion (FoE+gentle Manduca PROJECTION filter, val hr 0.3942 @ 1,926p). [1 PRIOR] iter-28 (FoE+Manduca, 0.3942) is the 0.09 champion; iter-30 (FoE+Manduca+ISOTROPIC image bilateral) REGRESSED to 0.3812 — the isotropic image bilateral is REDUNDANT on the projection-domain streak fix (no gain). [2 FAILURE MODE] iter-30 showed an ISOTROPIC image prior cannot catch what Manduca leaves; but LD-CT streaks are DIRECTIONAL (photon-starved high-attenuation rays backproject as oriented streaks) and the gentle Manduca filter must stay soft (view-consistency) so it deliberately leaves residual directional streaks. An isotropic filter is the wrong tool for an oriented artifact. [3 ONE KNOB] add a config-gated ZERO-INIT-gain oriented anisotropic-smoothing residual ON TOP of FoE+Manduca: reg(x)=FoE(x)+gain*Sum_theta(x-G_theta(x)), G_theta = oriented anisotropic Gaussian (elongated ALONG theta sigma_along=2.0px, narrow ACROSS sigma_across=0.6px) at M=4 FIXED orientations {0,45,90,135}deg; analytic kernels (NO trainable conv weights), 2 shared learnable sigmas + 1 ZERO-INIT shared gain = +3 params (NOT a steerable/equivariant FoE reparam — that DIVERGED iter-24). Total 1,929p. Everything else iter-26/iter-7 byte-for-byte (K=5 tied prox+DC, single alpha, no momentum/per-step-alpha, peak lr 5e-3, partial cosine T_max=16, max_train_s=1080, train_n=200, val_n=214, mu>=0 only NO upper clamp, Manduca proj_filter_on=true). [4 HYPOTHESIS] a DIRECTION-aware image prior catches the residual directional streaks the isotropic bilateral (iter-30) could not -> hr > 0.3942. Realistic NULL: gain->0, hr~0.394 (Manduca subsumes image-domain streak cleanup) — a clean publishable result. [5 SELF-CHECK] VERIFIED offline (cluster CPU): aniso_gain=0 => term==0 EXACTLY regardless of sigmas/orientations; ||reg-FoE||==0 at init => pipeline==iter-28 byte-for-byte; FoE(x)==0 (zero-init RBF); params=FoE1920+alpha1+Manduca5+aniso3=1929. [6 SAFETY] zero-init => worst case == champion (no divergence/regression risk). REPORT the learned aniso_gain (0=Manduca subsumes it) + learned sigma_along/sigma_across., reg_type=foe, n_iter=5, learnable_alpha=True, per_step_alpha=False, momentum=False, cnn_channels=12, cnn_layers=3, alpha_init=0.1, clip_max=0.05, epochs=16, cosine_lr=True, cosine_lr_min=1e-05, lr=0.005, max_train_s=1080, train_n=200, foe_n_filters=24, foe_kernel=7, foe_n_bumps=31, foe_rbf_init_std=0.0, foe_filter_init_std=0.05, foe_x_range=1.0, bilateral_on_top=False, proj_filter_on=True, proj_n_bf=1, proj_kernel=5, proj_sigma_x=0.83, proj_sigma_y=0.83, proj_sigma_r=1.5, proj_N0=None, proj_eps=1.0, proj_gain_init=0.0, anisotropic_on_top=True, aniso_n_orient=4, aniso_kernel=7, aniso_sigma_along=2.0, aniso_sigma_across=0.6, aniso_gain_init=0.0
32		0.971499	0.400413	keep	architecture	param_efficient-claude-agentic	claude-opus-4-8-1m	43.688	5.886293e-04	1361.1	0.001937	param_efficient-claude-agentic: val_n=214, rationale=param_efficient-claude-agentic: val_n=214, rationale=PUSH THE DOMINANT LEVER at 0.09 — extend the gentle Manduca PROJECTION filter to a MULTI-SCALE PARALLEL bank on top of the iter-31 champion (FoE + single-scale Manduca + anisotropic, val hr 0.3968 @ 1,929p). [PRIOR: FoE+Manduca 0.394 = the DOMINANT complementary bias (+0.048 over bilateral); +anisotropic 0.3968; isotropic image bilateral on Manduca REDUNDANT (iter-30 0.381).] FAILURE MODE addressed: the Manduca proj filter had ONE spatial scale; one projection bandwidth cannot both smooth broad streaks AND preserve fine ray structure. CHANGE (ONE knob): proj_multiscale=True, proj_n_bf=3, per-filter init sigma [0.83,1.66,3.32]px (x2 octave ladder, first==iter-31), each parallel projection bilateral on the SAME sqrt-count Q with its OWN ZERO-INIT gain => out=P+SUM_i gain_i*(Phat_i-P). FoE+anisotropic+the single existing Manduca scale all intact. PARAMS: FoE 1920 + alpha 1 + aniso 3 + proj(3*3 sigma + 1 logN0 + 3 gains = 13) = 1937 (+8 over iter-31, <<233k). ZERO-INIT: all proj gains=0 => ||sino_filtered-sino||=0 => pipeline==iter-31 byte-for-byte (worst case ==0.3968, no regression); runtime self-check asserts it. GENTLENESS: each added proj scale gentle (zero-init gain, soft range sigma); lever is STRENGTH not edge-hardness. DENSE-VIEW CAVEAT: 2304 views => FBP already averages much proj noise => small gain or clean null, maps the Manduca ceiling. HYPOTHESIS: more projection scales add headroom => hr>0.3968; NULL = only the 0.83 scale gain stays nonzero (hr~0.3968) => one proj scale suffices. peak lr 5e-3, partial cosine T_max=16, K=5 tied, mu>=0 only, max_train_s=1080. PREDICTED hr ~0.397-0.41. REPORT the per-scale proj gain VECTOR., reg_type=foe, n_iter=5, learnable_alpha=True, per_step_alpha=False, momentum=False, cnn_channels=12, cnn_layers=3, alpha_init=0.1, clip_max=0.05, epochs=16, cosine_lr=True, cosine_lr_min=1e-05, lr=0.005, max_train_s=1080, train_n=200, foe_n_filters=24, foe_kernel=7, foe_n_bumps=31, foe_rbf_init_std=0.0, foe_filter_init_std=0.05, foe_x_range=1.0, bilateral_on_top=False, proj_filter_on=True, proj_n_bf=3, proj_kernel=5, proj_sigma_x=0.83, proj_sigma_y=0.83, proj_sigma_r=1.5, proj_N0=None, proj_eps=1.0, proj_gain_init=0.0, anisotropic_on_top=True, aniso_n_orient=4, aniso_kernel=7, aniso_sigma_along=2.0, aniso_sigma_across=0.6, aniso_gain_init=0.0, proj_multiscale=True, proj_sigmas=[0.83, 1.66, 3.32]
33		0.951357	0.360016	keep	architecture	param_efficient-claude-agentic	claude-opus-4-8-1m	43.1217	6.282880e-04	1339.1	0.000969	param_efficient-claude-agentic: val_n=214, rationale=FRONTIER RE-MAP (agenda c) at 0.09: halve the FoE bank nf24->12 (~960 reg params, ~970 total) on the iter-31 champion (FoE + Manduca proj + anisotropic) to map the param/headroom Pareto — how much val hr does halving the FoE cost vs 0.3968 @ 1929p? Expect a Pareto low-end point (lower hr, far fewer params). Orthogonal to the iter-32 Manduca-capacity push; builds the param-efficiency curve for the campaign writeup., reg_type=foe, n_iter=5, learnable_alpha=True, per_step_alpha=False, momentum=False, cnn_channels=12, cnn_layers=3, alpha_init=0.1, clip_max=0.05, epochs=16, cosine_lr=True, cosine_lr_min=1e-05, lr=0.005, max_train_s=1080, train_n=200, foe_n_filters=12, foe_kernel=7, foe_n_bumps=31, foe_rbf_init_std=0.0, foe_filter_init_std=0.05, foe_x_range=1.0, bilateral_on_top=False, proj_filter_on=True, proj_n_bf=1, proj_kernel=5, proj_sigma_x=0.83, proj_sigma_y=0.83, proj_sigma_r=1.5, proj_N0=None, proj_eps=1.0, proj_gain_init=0.0, anisotropic_on_top=True, aniso_n_orient=4, aniso_kernel=7, aniso_sigma_along=2.0, aniso_sigma_across=0.6, aniso_gain_init=0.0
