{"ts": "2026-07-06T21:10:06Z", "run_id": "breast-ct-claude-agentic-fastdiff-flow-pixel-constrained-search-20260703-01", "iter": 6, "agent": "fastdiff_flow_pixel_constrained-claude-agentic", "model": "claude-opus-4-8-1m", "change_class": "architecture", "status": "discard", "kept": false, "val_score": 0.7497767210006714, "headroom": 0.0, "params_M": 3.822787, "train_n": 400, "rationale": "fastdiff_flow_pixel_constrained-claude-agentic: image_size=512, pixel_spacing=0.3516, n_angles=128, n_det=1024, det_spacing=0.35754, sod=500.0, sdd=1000.0, display_min=0.0, display_max=0.5, train_n=400, val_n=200, noise_i0=100000.0, noise_sigma_e=10.0, seed=42, dataset_kind=breast_ct, fd_recon_ckpt=/cluster/maier/Agent4CT/checkpoints/fast_diffusion_pixel_breast.pt, fd_recon_steps=8, fd_recon_init=fbp, fd_recon_init_t=0.05, fd_recon_eta=1.0, fd_recon_dc=1, fd_recon_dc_n_cg=60, fd_recon_dc_relax=1.0, rationale=iter-6 EXPLORATORY single knob dc_n_cg 30->60 from iter-5 (the BREAKTHROUGH: init_t0.05/n_cg30/relax1.0 gave hr=0.0557, rmse0.004924 < FBP0.00521, psnr36.82>36.32). SIX-BOX: (1)PRIOR: DEEP full DC is the winning lever. iter-4 (n_cg5,relax0.5,init_t0.05) was rmse0.00669 hr=0; iter-5 (n_cg30,relax1.0) dropped rmse to 0.004924 -> FIRST hr>0. The deep CG solves the 128-view least-squares more accurately than the analytic Hann FBP, beating baseline. (2)FAILURE: n_cg30 may still under-converge the CG; more iters could lower rmse further. (3)ONE KNOB: dc_n_cg 30->60 (2x deeper, extend the winning direction; relax1.0/init_t0.05/steps8/eta1.0 held). (4)HYPOTHESIS: 60 CG iters drive the recon closer to the exact data-consistent LS solution, lifting hr above 0.0557; if it converges (hr plateaus), that is the DC-limit hr for this prior. (5)BUDGET: 60 CG x 8 steps x 200 slices; iter-5 (30CG) took ~5.5min, 60CG ~ up to ~11min, inside the 20-min HARD budget. (6)Serial.", "advice_for_others": "fastdiff_flow_pixel_constrained-claude-agentic: image_size=512, pixel_spacing=0.3516, n_angles=128, n_det=1024, det_spacing=0.35754, sod=500.0, sdd=1000.0, display_min=0.0, display_max=0.5, train_n=400, val_n=200, noise_i0=100000.0, noise_sigma_e=10.0, seed=42, dataset_kind=breast_ct, fd_recon_ckpt=/cluster/maier/Agent4CT/checkpoints/fast_diffusion_pixel_breast.pt, fd_recon_steps=8, fd_recon_init=fbp, fd_recon_init_t=0.05, fd_recon_eta=1.0, fd_recon_dc=1, fd_recon_dc_n_cg=60, fd_recon_dc_relax=1.0, rationale=iter-6 EXPLORATORY single knob dc_n_cg 30->60 from iter-5 (the BREAKTHROUGH: init_t0.05/n_cg30/relax1.0 gave hr=0.0557, rmse0.004924 < FBP0.00521, psnr36.82>36.32). SIX-BOX: (1)PRIOR: DEEP full DC is the winning lever. iter-4 (n_cg5,relax0.5,init_t0.05) was rmse0.00669 hr=0; iter-5 (n_cg30,relax1.0) dropped rmse to 0.004924 -> FIRST hr>0. The deep CG solves the 128-view least-squares more accurately than the analytic Hann FBP, beating baseline. (2)FAILURE: n_cg30 may still under-converge the CG; more iters could lower rmse further. (3)ONE KNOB: dc_n_cg 30->60 (2x deeper, extend the winning direction; relax1.0/init_t0.05/steps8/eta1.0 held). (4)HYPOTHESIS: 60 CG iters drive the recon closer to the exact data-consistent LS solution, lifting hr above 0.0557; if it converges (hr plateaus), that is the DC-limit hr for this prior. (5)BUDGET: 60 CG x 8 steps x 200 slices; iter-5 (30CG) took ~5.5min, 60CG ~ up to ~11min, inside the 20-min HARD budget. (6)Serial.", "comparison_image": "runs/breast-ct-claude-agentic-fastdiff-flow-pixel-constrained-search-20260703-01/iterations/iter-0006/comparison.png"}
{"ts": "2026-07-06T21:09:33Z", "run_id": "breast-ct-claude-agentic-fastdiff-flow-pixel-unconstrained-search-20260703-01", "iter": 16, "agent": "fastdiff_flow_pixel_unconstrained-claude-agentic", "model": "claude-opus-4-8-1m", "change_class": "architecture", "status": "keep", "kept": true, "val_score": 0.9644467830657959, "headroom": 0.18109871687557022, "params_M": 3.822787, "train_n": 3600, "rationale": "fastdiff_flow_pixel_unconstrained-claude-agentic: image_size=512, pixel_spacing=0.3516, n_angles=128, n_det=1024, det_spacing=0.35754, sod=500.0, sdd=1000.0, display_min=0.0, display_max=0.5, train_n=400, val_n=200, noise_i0=100000.0, noise_sigma_e=10.0, seed=42, fd_recon_ckpt=/cluster/maier/Agent4CT/checkpoints/fast_diffusion_pixel_breast.pt, fd_recon_steps=8, fd_recon_init=fbp, fd_recon_init_t=0.03, fd_recon_eta=0.1, fd_recon_dc=0, fd_recon_dc_n_cg=5, fd_recon_dc_relax=0.5, rationale=iter-16: DC-off breast-prior. ONE KNOB init_t 0.02->0.03 (upper bracket of the hr peak). PRIOR: hr vs init_t: 0.05->0(RMSE5.78e-3), 0.02->0.2085(RMSE4.13e-3 BEST), 0.01->0.1384(RMSE4.49e-3). The hr PEAK is at init_t~0.02 - a sweet spot where the prior optimally denoises the FBP. Below 0.02 (0.01) the prior has too little noise-room; above (0.05) too much generative drift re-raises RMSE. HYPOTHESIS: init_t=0.03 sits between the 0.02 peak and the 0.05 zero - hr should be positive but likely below the 0.02 peak, confirming 0.02 is near-optimal. Fine-grid confirmation of the peak location.", "advice_for_others": "fastdiff_flow_pixel_unconstrained-claude-agentic: image_size=512, pixel_spacing=0.3516, n_angles=128, n_det=1024, det_spacing=0.35754, sod=500.0, sdd=1000.0, display_min=0.0, display_max=0.5, train_n=400, val_n=200, noise_i0=100000.0, noise_sigma_e=10.0, seed=42, fd_recon_ckpt=/cluster/maier/Agent4CT/checkpoints/fast_diffusion_pixel_breast.pt, fd_recon_steps=8, fd_recon_init=fbp, fd_recon_init_t=0.03, fd_recon_eta=0.1, fd_recon_dc=0, fd_recon_dc_n_cg=5, fd_recon_dc_relax=0.5, rationale=iter-16: DC-off breast-prior. ONE KNOB init_t 0.02->0.03 (upper bracket of the hr peak). PRIOR: hr vs init_t: 0.05->0(RMSE5.78e-3), 0.02->0.2085(RMSE4.13e-3 BEST), 0.01->0.1384(RMSE4.49e-3). The hr PEAK is at init_t~0.02 - a sweet spot where the prior optimally denoises the FBP. Below 0.02 (0.01) the prior has too little noise-room; above (0.05) too much generative drift re-raises RMSE. HYPOTHESIS: init_t=0.03 sits between the 0.02 peak and the 0.05 zero - hr should be positive but likely below the 0.02 peak, confirming 0.02 is near-optimal. Fine-grid confirmation of the peak location.", "comparison_image": "runs/breast-ct-claude-agentic-fastdiff-flow-pixel-unconstrained-search-20260703-01/iterations/iter-0016/comparison.png"}
{"ts": "2026-07-06T21:06:23Z", "run_id": "breast-ct-claude-agentic-fastdiff-flow-pixel-unconstrained-search-20260703-01", "iter": 15, "agent": "fastdiff_flow_pixel_unconstrained-claude-agentic", "model": "claude-opus-4-8-1m", "change_class": "architecture", "status": "keep", "kept": true, "val_score": 0.9750758409500122, "headroom": 0.13841327807262793, "params_M": 3.822787, "train_n": 3600, "rationale": "fastdiff_flow_pixel_unconstrained-claude-agentic: image_size=512, pixel_spacing=0.3516, n_angles=128, n_det=1024, det_spacing=0.35754, sod=500.0, sdd=1000.0, display_min=0.0, display_max=0.5, train_n=400, val_n=200, noise_i0=100000.0, noise_sigma_e=10.0, seed=42, fd_recon_ckpt=/cluster/maier/Agent4CT/checkpoints/fast_diffusion_pixel_breast.pt, fd_recon_steps=8, fd_recon_init=fbp, fd_recon_init_t=0.01, fd_recon_eta=0.1, fd_recon_dc=0, fd_recon_dc_n_cg=5, fd_recon_dc_relax=0.5, rationale=iter-15: DC-off breast-prior. ONE KNOB init_t 0.02->0.01. BREAKTHROUGH at iter-14: init_t0.02 gave hr=0.2085 (PSNR38.36 > FBP baseline 36.32; RMSE4.13e-3 < baseline 5.21e-3) - the breast prior CLEARED the baseline! MECHANISM: at init_t~0.02 the FBP is embedded at ~2% noise and the prior acts as a learned FBP-DENOISER (well-conditioned 128-view breast: FBP has removable noise; the prior's light denoise + whisper of DPS drops RMSE below raw FBP). So the DC-off prior DOES contribute (21% headroom recovered) as a denoiser, NOT just recovering FBP. HYPOTHESIS: init_t=0.01 - is hr still rising (even lighter touch) or did the peak pass at 0.02? Brackets the hr peak. Also a robustness check that iter-14's cross was not a fluke.", "advice_for_others": "fastdiff_flow_pixel_unconstrained-claude-agentic: image_size=512, pixel_spacing=0.3516, n_angles=128, n_det=1024, det_spacing=0.35754, sod=500.0, sdd=1000.0, display_min=0.0, display_max=0.5, train_n=400, val_n=200, noise_i0=100000.0, noise_sigma_e=10.0, seed=42, fd_recon_ckpt=/cluster/maier/Agent4CT/checkpoints/fast_diffusion_pixel_breast.pt, fd_recon_steps=8, fd_recon_init=fbp, fd_recon_init_t=0.01, fd_recon_eta=0.1, fd_recon_dc=0, fd_recon_dc_n_cg=5, fd_recon_dc_relax=0.5, rationale=iter-15: DC-off breast-prior. ONE KNOB init_t 0.02->0.01. BREAKTHROUGH at iter-14: init_t0.02 gave hr=0.2085 (PSNR38.36 > FBP baseline 36.32; RMSE4.13e-3 < baseline 5.21e-3) - the breast prior CLEARED the baseline! MECHANISM: at init_t~0.02 the FBP is embedded at ~2% noise and the prior acts as a learned FBP-DENOISER (well-conditioned 128-view breast: FBP has removable noise; the prior's light denoise + whisper of DPS drops RMSE below raw FBP). So the DC-off prior DOES contribute (21% headroom recovered) as a denoiser, NOT just recovering FBP. HYPOTHESIS: init_t=0.01 - is hr still rising (even lighter touch) or did the peak pass at 0.02? Brackets the hr peak. Also a robustness check that iter-14's cross was not a fluke.", "comparison_image": "runs/breast-ct-claude-agentic-fastdiff-flow-pixel-unconstrained-search-20260703-01/iterations/iter-0015/comparison.png"}
{"ts": "2026-07-06T21:03:06Z", "run_id": "breast-ct-claude-agentic-fastdiff-flow-pixel-unconstrained-search-20260703-01", "iter": 14, "agent": "fastdiff_flow_pixel_unconstrained-claude-agentic", "model": "claude-opus-4-8-1m", "change_class": "architecture", "status": "keep", "kept": true, "val_score": 0.9745359420776367, "headroom": 0.2085437320480329, "params_M": 3.822787, "train_n": 3600, "rationale": "fastdiff_flow_pixel_unconstrained-claude-agentic: image_size=512, pixel_spacing=0.3516, n_angles=128, n_det=1024, det_spacing=0.35754, sod=500.0, sdd=1000.0, display_min=0.0, display_max=0.5, train_n=400, val_n=200, noise_i0=100000.0, noise_sigma_e=10.0, seed=42, fd_recon_ckpt=/cluster/maier/Agent4CT/checkpoints/fast_diffusion_pixel_breast.pt, fd_recon_steps=8, fd_recon_init=fbp, fd_recon_init_t=0.02, fd_recon_eta=0.1, fd_recon_dc=0, fd_recon_dc_n_cg=5, fd_recon_dc_relax=0.5, rationale=iter-14: DC-off breast-prior. ONE KNOB init_t 0.05->0.02. PRIOR: init_t0.1->PSNR31.9/RMSE8.7e-3, init_t0.05->PSNR35.4/RMSE5.78e-3 - approaching the FBP baseline (PSNR36.3/RMSE5.21e-3) from BELOW. hr still 0 because recon RMSE (5.78e-3) > baseline RMSE (5.21e-3) by a hair: the prior's light denoise slightly HURTS vs raw FBP on this well-conditioned 128-view breast data. HYPOTHESIS: init_t=0.02 gets even closer to the FBP (recon ~= FBP + minimal prior touch) -> RMSE approaches but stays just above 5.21e-3 => hr=0 asymptote CONFIRMED. This is the definitive finding: the DC-off breast prior can at best RECOVER the FBP, never EXCEED it (no null-space injection without DC). Edge coverage of the init_t lever (its low end).", "advice_for_others": "fastdiff_flow_pixel_unconstrained-claude-agentic: image_size=512, pixel_spacing=0.3516, n_angles=128, n_det=1024, det_spacing=0.35754, sod=500.0, sdd=1000.0, display_min=0.0, display_max=0.5, train_n=400, val_n=200, noise_i0=100000.0, noise_sigma_e=10.0, seed=42, fd_recon_ckpt=/cluster/maier/Agent4CT/checkpoints/fast_diffusion_pixel_breast.pt, fd_recon_steps=8, fd_recon_init=fbp, fd_recon_init_t=0.02, fd_recon_eta=0.1, fd_recon_dc=0, fd_recon_dc_n_cg=5, fd_recon_dc_relax=0.5, rationale=iter-14: DC-off breast-prior. ONE KNOB init_t 0.05->0.02. PRIOR: init_t0.1->PSNR31.9/RMSE8.7e-3, init_t0.05->PSNR35.4/RMSE5.78e-3 - approaching the FBP baseline (PSNR36.3/RMSE5.21e-3) from BELOW. hr still 0 because recon RMSE (5.78e-3) > baseline RMSE (5.21e-3) by a hair: the prior's light denoise slightly HURTS vs raw FBP on this well-conditioned 128-view breast data. HYPOTHESIS: init_t=0.02 gets even closer to the FBP (recon ~= FBP + minimal prior touch) -> RMSE approaches but stays just above 5.21e-3 => hr=0 asymptote CONFIRMED. This is the definitive finding: the DC-off breast prior can at best RECOVER the FBP, never EXCEED it (no null-space injection without DC). Edge coverage of the init_t lever (its low end).", "comparison_image": "runs/breast-ct-claude-agentic-fastdiff-flow-pixel-unconstrained-search-20260703-01/iterations/iter-0014/comparison.png"}
{"ts": "2026-07-06T21:00:32Z", "run_id": "breast-ct-claude-agentic-fastdiff-flow-pixel-constrained-search-20260703-01", "iter": 5, "agent": "fastdiff_flow_pixel_constrained-claude-agentic", "model": "claude-opus-4-8-1m", "change_class": "architecture", "status": "keep", "kept": true, "val_score": 0.9022442698478699, "headroom": 0.05569136356049498, "params_M": 3.822787, "train_n": 400, "rationale": "fastdiff_flow_pixel_constrained-claude-agentic: image_size=512, pixel_spacing=0.3516, n_angles=128, n_det=1024, det_spacing=0.35754, sod=500.0, sdd=1000.0, display_min=0.0, display_max=0.5, train_n=400, val_n=200, noise_i0=100000.0, noise_sigma_e=10.0, seed=42, dataset_kind=breast_ct, fd_recon_ckpt=/cluster/maier/Agent4CT/checkpoints/fast_diffusion_pixel_breast.pt, fd_recon_steps=8, fd_recon_init=fbp, fd_recon_init_t=0.05, fd_recon_eta=1.0, fd_recon_dc=1, fd_recon_dc_n_cg=30, fd_recon_dc_relax=1.0, rationale=iter-5 EXPLORATORY DC-strength combo (dc_n_cg 5->30 + dc_relax 0.5->1.0) on the near-FBP init_t0.05 base. SIX-BOX: (1)PRIOR: init_t axis fully mapped and MONOTONIC to the FBP floor: 0.7->0.05 gave rmse 0.0428->0.0264->0.0144->0.00669 (ssim 0.427->0.915), converging TO the 128-view breast FBP (rmse0.00521, ssim0.920) from ABOVE. hr=0 throughout: the breast-native prior cannot EXCEED the near-oracle sparse-view FBP. (2)FAILURE / OPEN QUESTION: at init_t0.05 the prior barely acts, so recon ~ DC-projected FBP. The ONLY way to beat the FBP is if a DEEP data-consistency CG solve finds a lower-rmse data-consistent image than the analytic FBP. In the Mayo sibling dc_n_cg was the ONLY lever that moved rmse. (3)ONE KNOB (DC-strength, combined): dc_n_cg 5->30 AND dc_relax 0.5->1.0 (full deep CG projection). (4)HYPOTHESIS: if full deep DC at near-FBP init STILL cannot push rmse below 0.00521, the regime-bound ceiling is PROVEN at the DC limit: the data-consistent solution the constrained flow converges to IS the FBP; a prior has no sparse-view-noise headroom to exploit at 128 views. (5)BUDGET: 30 CG x 8 steps x 200 slices, CG cheap fwd/back-proj, inside 20-min. (6)Serial.", "advice_for_others": "fastdiff_flow_pixel_constrained-claude-agentic: image_size=512, pixel_spacing=0.3516, n_angles=128, n_det=1024, det_spacing=0.35754, sod=500.0, sdd=1000.0, display_min=0.0, display_max=0.5, train_n=400, val_n=200, noise_i0=100000.0, noise_sigma_e=10.0, seed=42, dataset_kind=breast_ct, fd_recon_ckpt=/cluster/maier/Agent4CT/checkpoints/fast_diffusion_pixel_breast.pt, fd_recon_steps=8, fd_recon_init=fbp, fd_recon_init_t=0.05, fd_recon_eta=1.0, fd_recon_dc=1, fd_recon_dc_n_cg=30, fd_recon_dc_relax=1.0, rationale=iter-5 EXPLORATORY DC-strength combo (dc_n_cg 5->30 + dc_relax 0.5->1.0) on the near-FBP init_t0.05 base. SIX-BOX: (1)PRIOR: init_t axis fully mapped and MONOTONIC to the FBP floor: 0.7->0.05 gave rmse 0.0428->0.0264->0.0144->0.00669 (ssim 0.427->0.915), converging TO the 128-view breast FBP (rmse0.00521, ssim0.920) from ABOVE. hr=0 throughout: the breast-native prior cannot EXCEED the near-oracle sparse-view FBP. (2)FAILURE / OPEN QUESTION: at init_t0.05 the prior barely acts, so recon ~ DC-projected FBP. The ONLY way to beat the FBP is if a DEEP data-consistency CG solve finds a lower-rmse data-consistent image than the analytic FBP. In the Mayo sibling dc_n_cg was the ONLY lever that moved rmse. (3)ONE KNOB (DC-strength, combined): dc_n_cg 5->30 AND dc_relax 0.5->1.0 (full deep CG projection). (4)HYPOTHESIS: if full deep DC at near-FBP init STILL cannot push rmse below 0.00521, the regime-bound ceiling is PROVEN at the DC limit: the data-consistent solution the constrained flow converges to IS the FBP; a prior has no sparse-view-noise headroom to exploit at 128 views. (5)BUDGET: 30 CG x 8 steps x 200 slices, CG cheap fwd/back-proj, inside 20-min. (6)Serial.", "comparison_image": "runs/breast-ct-claude-agentic-fastdiff-flow-pixel-constrained-search-20260703-01/iterations/iter-0005/comparison.png"}
{"ts": "2026-07-06T21:00:08Z", "run_id": "breast-ct-claude-agentic-fastdiff-flow-pixel-unconstrained-search-20260703-01", "iter": 13, "agent": "fastdiff_flow_pixel_unconstrained-claude-agentic", "model": "claude-opus-4-8-1m", "change_class": "architecture", "status": "discard", "kept": false, "val_score": 0.9131503105163574, "headroom": 0.0, "params_M": 3.822787, "train_n": 3600, "rationale": "fastdiff_flow_pixel_unconstrained-claude-agentic: image_size=512, pixel_spacing=0.3516, n_angles=128, n_det=1024, det_spacing=0.35754, sod=500.0, sdd=1000.0, display_min=0.0, display_max=0.5, train_n=400, val_n=200, noise_i0=100000.0, noise_sigma_e=10.0, seed=42, fd_recon_ckpt=/cluster/maier/Agent4CT/checkpoints/fast_diffusion_pixel_breast.pt, fd_recon_steps=8, fd_recon_init=fbp, fd_recon_init_t=0.05, fd_recon_eta=0.1, fd_recon_dc=0, fd_recon_dc_n_cg=5, fd_recon_dc_relax=0.5, rationale=iter-13: DC-off breast-prior. ONE KNOB init_t 0.1->0.05. PRIOR (low-eta): init_t0.2->PSNR29.58, init_t0.1->PSNR31.88 (big jump). MECHANISM CONFIRMED: as init_t->0 the DC-off sampler converges to the FBP init (minimal generative perturbation) + light prior denoise => PSNR rises toward the FBP baseline (36.32). HYPOTHESIS: init_t=0.05 pushes PSNR further toward baseline (recon ~= lightly-denoised FBP). This is the KEY finding: the breast prior alone (no DC) can only APPROACH the FBP asymptotically by trusting it - it cannot EXCEED it, because without the CG data-consistency projection there is no mechanism to inject the missing sparse-view null-space information. hr stays 0 (RMSE never beats the FBP's 5.2e-3).", "advice_for_others": "fastdiff_flow_pixel_unconstrained-claude-agentic: image_size=512, pixel_spacing=0.3516, n_angles=128, n_det=1024, det_spacing=0.35754, sod=500.0, sdd=1000.0, display_min=0.0, display_max=0.5, train_n=400, val_n=200, noise_i0=100000.0, noise_sigma_e=10.0, seed=42, fd_recon_ckpt=/cluster/maier/Agent4CT/checkpoints/fast_diffusion_pixel_breast.pt, fd_recon_steps=8, fd_recon_init=fbp, fd_recon_init_t=0.05, fd_recon_eta=0.1, fd_recon_dc=0, fd_recon_dc_n_cg=5, fd_recon_dc_relax=0.5, rationale=iter-13: DC-off breast-prior. ONE KNOB init_t 0.1->0.05. PRIOR (low-eta): init_t0.2->PSNR29.58, init_t0.1->PSNR31.88 (big jump). MECHANISM CONFIRMED: as init_t->0 the DC-off sampler converges to the FBP init (minimal generative perturbation) + light prior denoise => PSNR rises toward the FBP baseline (36.32). HYPOTHESIS: init_t=0.05 pushes PSNR further toward baseline (recon ~= lightly-denoised FBP). This is the KEY finding: the breast prior alone (no DC) can only APPROACH the FBP asymptotically by trusting it - it cannot EXCEED it, because without the CG data-consistency projection there is no mechanism to inject the missing sparse-view null-space information. hr stays 0 (RMSE never beats the FBP's 5.2e-3).", "comparison_image": "runs/breast-ct-claude-agentic-fastdiff-flow-pixel-unconstrained-search-20260703-01/iterations/iter-0013/comparison.png"}
{"ts": "2026-07-06T20:58:14Z", "run_id": "breast-ct-claude-agentic-fastdiff-wdm-wavelet-constrained-search-20260703-01", "iter": 7, "agent": "fastdiff_wdm_wavelet_constrained-claude-agentic", "model": "claude-opus-4-8-1m", "change_class": "architecture", "status": "discard", "kept": false, "val_score": 0.8362066745758057, "headroom": 0.0, "params_M": 3.824908, "train_n": 3600, "rationale": "fastdiff_wdm_wavelet_constrained-claude-agentic: val_n=200, seed=42, fd_recon_ckpt=/cluster/maier/Agent4CT/checkpoints/fast_diffusion_wavelet_breast.pt, fd_recon_steps=8, fd_recon_init=fbp, fd_recon_init_t=0.02, fd_recon_eta=1.0, fd_recon_dc=1, fd_recon_dc_n_cg=5, fd_recon_dc_relax=1.0, dataset_kind=breast_ct, rationale=iter-7 INIT_T asymptote pin, breast-native wavelet CONSTRAINED, val=200. SIX-BOX: (1) PRIOR: init_t@relax1.0: 0.7->16.5,0.4->19.4,0.2->22.0,0.1->25.2,0.05->28.9dB (RMSE 1.23e-2). Monotonic, still below baseline 36.3dB/5.21e-3. hr=0. (2) FAILURE MODE: prior net-harmful; recon = light-denoised-FBP+CG-DC and rises toward but has not reached baseline. (3) ONE KNOB: init_t 0.05->0.02 (essentially prior-off). (4) HYPOTHESIS: near-flat vs iter-6 -> pins the init_t->0 asymptote. If PSNR ~29-31 and still <36, confirms the DC-on wavelet recon at NFE8/CG5 is FBP-bounded on sparse breast. (5) BUDGET ~90s. (6) iter-8 pivots to the OTHER DC lever (dc_n_cg up: does a stronger least-squares CG solve at this low init_t finally reach/beat FBP?).", "advice_for_others": "fastdiff_wdm_wavelet_constrained-claude-agentic: val_n=200, seed=42, fd_recon_ckpt=/cluster/maier/Agent4CT/checkpoints/fast_diffusion_wavelet_breast.pt, fd_recon_steps=8, fd_recon_init=fbp, fd_recon_init_t=0.02, fd_recon_eta=1.0, fd_recon_dc=1, fd_recon_dc_n_cg=5, fd_recon_dc_relax=1.0, dataset_kind=breast_ct, rationale=iter-7 INIT_T asymptote pin, breast-native wavelet CONSTRAINED, val=200. SIX-BOX: (1) PRIOR: init_t@relax1.0: 0.7->16.5,0.4->19.4,0.2->22.0,0.1->25.2,0.05->28.9dB (RMSE 1.23e-2). Monotonic, still below baseline 36.3dB/5.21e-3. hr=0. (2) FAILURE MODE: prior net-harmful; recon = light-denoised-FBP+CG-DC and rises toward but has not reached baseline. (3) ONE KNOB: init_t 0.05->0.02 (essentially prior-off). (4) HYPOTHESIS: near-flat vs iter-6 -> pins the init_t->0 asymptote. If PSNR ~29-31 and still <36, confirms the DC-on wavelet recon at NFE8/CG5 is FBP-bounded on sparse breast. (5) BUDGET ~90s. (6) iter-8 pivots to the OTHER DC lever (dc_n_cg up: does a stronger least-squares CG solve at this low init_t finally reach/beat FBP?).", "comparison_image": "runs/breast-ct-claude-agentic-fastdiff-wdm-wavelet-constrained-search-20260703-01/iterations/iter-0007/comparison.png"}
