{"ts": "2026-07-05T23:17:18Z", "run_id": "breast-ct-claude-agentic-dual-domain-bilateral-n2i-search-20260703-01", "iter": 15, "agent": "dual_domain_bilateral_n2i-claude-agentic", "model": "claude-opus-4-8-1m", "change_class": "architecture", "status": "keep", "kept": true, "val_score": 0.960396409034729, "headroom": 0.2055215705216945, "params_M": 6e-06, "train_n": 400, "rationale": "dual_domain_bilateral_n2i-claude-agentic: warm_start=True, pretrain_epochs=2, train_n=400, n_iter=60, val_n=200, batch_size=1, grad_clip=1.0, lr=0.003, proj_n_bf=1, img_n_bf=1, img_sr=0.0002, outer_wall_s=900, seed=42, rationale=iter-15 dual_domain_bilateral_n2i, ONE-KNOB: n_iter 30->60 at the NAILED optimal lr=3e-3 (iter-13 champion hr=0.1988; iter-14 lr3.5e-3 was 0.1973 = ridge top confirmed at 3e-3). img_sr=0.0002, kernel=7, spatial=1.5 all fixed at their tested optima. HYPOTHESIS: iter-8 (n_iter 30->100) DROPPED hr, BUT that was at the OVERSHOOTING lr=5e-3 where extra steps drift the fit toward the noisy 64-view half-target. Now at the GENTLE lr=3e-3 the per-scene fit does NOT overshoot, so MORE steps (60) should let the edge-preserving BF converge FURTHER on genuine denoising -> hr climbs above 0.1988. This is the lr x n_iter interaction: gentle-lr + more-steps is the classic well-damped-convergence regime. If hr FLAT/DROPS, 30 steps already converge the 6-param BF (tiny model converges fast) and n_iter is saturated at the optimal lr -> the ~0.199 hr is the edge-preserving N2I ceiling. RISK: 60 steps x 200 scenes may approach outer_wall_s=900 -> possible val_n trim; iter-13 ran 694s at n_iter30 on a fast node, n_iter60 ~1100-1300s could trim a few scenes (noted if so). ONE knob: n_iter 30->60.", "advice_for_others": "dual_domain_bilateral_n2i-claude-agentic: warm_start=True, pretrain_epochs=2, train_n=400, n_iter=60, val_n=200, batch_size=1, grad_clip=1.0, lr=0.003, proj_n_bf=1, img_n_bf=1, img_sr=0.0002, outer_wall_s=900, seed=42, rationale=iter-15 dual_domain_bilateral_n2i, ONE-KNOB: n_iter 30->60 at the NAILED optimal lr=3e-3 (iter-13 champion hr=0.1988; iter-14 lr3.5e-3 was 0.1973 = ridge top confirmed at 3e-3). img_sr=0.0002, kernel=7, spatial=1.5 all fixed at their tested optima. HYPOTHESIS: iter-8 (n_iter 30->100) DROPPED hr, BUT that was at the OVERSHOOTING lr=5e-3 where extra steps drift the fit toward the noisy 64-view half-target. Now at the GENTLE lr=3e-3 the per-scene fit does NOT overshoot, so MORE steps (60) should let the edge-preserving BF converge FURTHER on genuine denoising -> hr climbs above 0.1988. This is the lr x n_iter interaction: gentle-lr + more-steps is the classic well-damped-convergence regime. If hr FLAT/DROPS, 30 steps already converge the 6-param BF (tiny model converges fast) and n_iter is saturated at the optimal lr -> the ~0.199 hr is the edge-preserving N2I ceiling. RISK: 60 steps x 200 scenes may approach outer_wall_s=900 -> possible val_n trim; iter-13 ran 694s at n_iter30 on a fast node, n_iter60 ~1100-1300s could trim a few scenes (noted if so). ONE knob: n_iter 30->60.", "comparison_image": "runs/breast-ct-claude-agentic-dual-domain-bilateral-n2i-search-20260703-01/iterations/iter-0015/comparison.png"}
{"ts": "2026-07-05T22:57:30Z", "run_id": "breast-ct-claude-agentic-tv-iterative-supervised-search-20260703-01", "iter": 18, "agent": "tv_iterative_supervised-claude-agentic", "model": "claude-opus-4-8-1m", "change_class": "architecture", "status": "keep", "kept": true, "val_score": 0.9577618837356567, "headroom": 0.1500951678079987, "params_M": 2e-05, "train_n": 400, "rationale": "tv_iterative_supervised-claude-agentic: val_n=200, val_chunk=5, train_n=400, epochs=20, batch_size=1, lr=0.005, tv_K=10, tv_step_init=0.001, tv_lambda_init=0.5, tv_share_steps=False, tv_eps=1e-06, lambda_neg=1.0, loss_base=mse, grad_clip=1.0, rationale=tv_iterative_supervised iter-18 (breast_ct). LAMBDA peak bisection (low side). Lambda axis mapped: 0.05->0.1195, 0.2->0.1462, 1.0->0.1495(ep20 best), 5.0->0.0015(over-smooth collapse). Peak bracketed between 0.2 and 5.0, near 1.0. ONE KNOB vs iter-12 (lambda=1.0, ep20, hr=0.1495): tv_lambda_init 1.0->0.5. HYPOTHESIS: if hr>0.1495 the peak is below 1.0 (test 0.7 next); if hr<0.1495 the peak is at/above 1.0. Refines the plateau location. FALSIFIER: hr~0.15 either way -> plateau flat, ceiling confirmed. BUDGET: iter-12 under wall.", "advice_for_others": "tv_iterative_supervised-claude-agentic: val_n=200, val_chunk=5, train_n=400, epochs=20, batch_size=1, lr=0.005, tv_K=10, tv_step_init=0.001, tv_lambda_init=0.5, tv_share_steps=False, tv_eps=1e-06, lambda_neg=1.0, loss_base=mse, grad_clip=1.0, rationale=tv_iterative_supervised iter-18 (breast_ct). LAMBDA peak bisection (low side). Lambda axis mapped: 0.05->0.1195, 0.2->0.1462, 1.0->0.1495(ep20 best), 5.0->0.0015(over-smooth collapse). Peak bracketed between 0.2 and 5.0, near 1.0. ONE KNOB vs iter-12 (lambda=1.0, ep20, hr=0.1495): tv_lambda_init 1.0->0.5. HYPOTHESIS: if hr>0.1495 the peak is below 1.0 (test 0.7 next); if hr<0.1495 the peak is at/above 1.0. Refines the plateau location. FALSIFIER: hr~0.15 either way -> plateau flat, ceiling confirmed. BUDGET: iter-12 under wall.", "comparison_image": "runs/breast-ct-claude-agentic-tv-iterative-supervised-search-20260703-01/iterations/iter-0018/comparison.png"}
{"ts": "2026-07-05T22:54:52Z", "run_id": "breast-ct-claude-agentic-dual-domain-bilateral-n2i-search-20260703-01", "iter": 14, "agent": "dual_domain_bilateral_n2i-claude-agentic", "model": "claude-opus-4-8-1m", "change_class": "architecture", "status": "keep", "kept": true, "val_score": 0.9596063494682312, "headroom": 0.19726246101358813, "params_M": 6e-06, "train_n": 400, "rationale": "dual_domain_bilateral_n2i-claude-agentic: warm_start=True, pretrain_epochs=2, train_n=400, n_iter=30, val_n=200, batch_size=1, grad_clip=1.0, lr=0.0035, proj_n_bf=1, img_n_bf=1, img_sr=0.0002, outer_wall_s=900, seed=42, rationale=iter-14 dual_domain_bilateral_n2i, ONE-KNOB: lr 0.003->0.0035 (fine-tune the lr ridge top), on iter-13 CHAMPION base (img_sr=0.0002, n_iter=30). lr CURVE: 1e-3->0.0895(under-conv), 2e-3->0.1835, 3e-3->0.1988(PEAK), 5e-3->0.126(overshoot). The optimum is between 3e-3 and 5e-3, nearer 3e-3. HYPOTHESIS: 3.5e-3 sits just above the 3e-3 champion on the ridge; if hr>0.1988 the true peak is ~3.5-4e-3 (next: 4e-3); if hr<0.1988 the peak is at 3e-3 and lr is NAILED (stop refining lr, move to a fresh axis e.g. pretrain_epochs / warm_start / a mild n_iter bump at the optimal lr). BUDGET: same steps, ~700-950s, val_n=200. ONE knob: lr 0.003->0.0035.", "advice_for_others": "dual_domain_bilateral_n2i-claude-agentic: warm_start=True, pretrain_epochs=2, train_n=400, n_iter=30, val_n=200, batch_size=1, grad_clip=1.0, lr=0.0035, proj_n_bf=1, img_n_bf=1, img_sr=0.0002, outer_wall_s=900, seed=42, rationale=iter-14 dual_domain_bilateral_n2i, ONE-KNOB: lr 0.003->0.0035 (fine-tune the lr ridge top), on iter-13 CHAMPION base (img_sr=0.0002, n_iter=30). lr CURVE: 1e-3->0.0895(under-conv), 2e-3->0.1835, 3e-3->0.1988(PEAK), 5e-3->0.126(overshoot). The optimum is between 3e-3 and 5e-3, nearer 3e-3. HYPOTHESIS: 3.5e-3 sits just above the 3e-3 champion on the ridge; if hr>0.1988 the true peak is ~3.5-4e-3 (next: 4e-3); if hr<0.1988 the peak is at 3e-3 and lr is NAILED (stop refining lr, move to a fresh axis e.g. pretrain_epochs / warm_start / a mild n_iter bump at the optimal lr). BUDGET: same steps, ~700-950s, val_n=200. ONE knob: lr 0.003->0.0035.", "comparison_image": "runs/breast-ct-claude-agentic-dual-domain-bilateral-n2i-search-20260703-01/iterations/iter-0014/comparison.png"}
{"ts": "2026-07-05T22:51:29Z", "run_id": "breast-ct-claude-agentic-r2gaussian-search-20260703-01", "iter": 20, "agent": "r2gaussian-claude-agentic", "model": "claude-opus-4-8-1m", "change_class": "architecture", "status": "discard", "kept": false, "val_score": 0.9276393055915833, "headroom": 0.0, "params_M": 0.006144, "train_n": 400, "rationale": "r2gaussian-claude-agentic: val_n=15, gs_n_gaussians=1024, gs_n_iter=130, gs_lr_pos=0.005, gs_lr_scale=0.01, gs_lr_amp=0.01, gs_lr_rot=0.01, gs_amp_init=0.01, gs_scale_init=0.04, gs_tv_weight=0.0001, gs_n_clip=0.05, gs_init_from_fbp=True, gs_render=raster, gs_ssim_weight=0.3, seed=42, train_n=0, rationale=iter-20 (search-20260703-01) -- FINAL CEILING CONFIRMATION #12 (closes the r2gaussian breast search). SIX-BOX: hr pinned 0 at EVERY prior iter; best SSIM 0.9278 @ iter-6. R2-Gaussian is REGIME-BOUNDED on dense 128-view breast: the coarse anisotropic-Gaussian basis (1024 splats, 0.006M params) plateaus at SSIM ~0.928 / PSNR ~28.7 dB, ~7.3 dB BELOW the 128-view FBP baseline (PSNR 35.97), so the RMSE/PSNR-gated headroom stays 0 (reproduces findings.md 2026-06-03). All 7 lever families mapped+exhausted (steps FLAT, capacity +0.010, warm-start +0.039, SSIM-loss +0.073, SSIM-weight saturated, basis-scale FLAT, TV-reg FLAT); NONE moves hr off 0 -- the strongest (warm-start + SSIM-loss) got closest but stayed 7.3 dB short. The R2-G paper's regime is SPARSE-view CBCT (<=50 views) where FBP is weak; dense 128-view 2D CT is the wrong inductive bias. DECISION: empty-patch re-run of the iter-6 run-best config (warm-start + SSIM-loss@0.30, 1024G/130it) to confirm SSIM ~0.928 / hr=0 reproduces. BUDGET: ~660-1000s node-dependent, under the 1080 in-solver wall and 1800 SLURM wall, figure excluded. val_n=15 HELD CONSTANT. PREDICTION: SSIM ~0.928 (0.925-0.930), hr 0 -- faithful-but-regime-bounded negative result., gs_outer_wall_s=1080, gs_amp_init_max=0.05", "advice_for_others": "r2gaussian-claude-agentic: val_n=15, gs_n_gaussians=1024, gs_n_iter=130, gs_lr_pos=0.005, gs_lr_scale=0.01, gs_lr_amp=0.01, gs_lr_rot=0.01, gs_amp_init=0.01, gs_scale_init=0.04, gs_tv_weight=0.0001, gs_n_clip=0.05, gs_init_from_fbp=True, gs_render=raster, gs_ssim_weight=0.3, seed=42, train_n=0, rationale=iter-20 (search-20260703-01) -- FINAL CEILING CONFIRMATION #12 (closes the r2gaussian breast search). SIX-BOX: hr pinned 0 at EVERY prior iter; best SSIM 0.9278 @ iter-6. R2-Gaussian is REGIME-BOUNDED on dense 128-view breast: the coarse anisotropic-Gaussian basis (1024 splats, 0.006M params) plateaus at SSIM ~0.928 / PSNR ~28.7 dB, ~7.3 dB BELOW the 128-view FBP baseline (PSNR 35.97), so the RMSE/PSNR-gated headroom stays 0 (reproduces findings.md 2026-06-03). All 7 lever families mapped+exhausted (steps FLAT, capacity +0.010, warm-start +0.039, SSIM-loss +0.073, SSIM-weight saturated, basis-scale FLAT, TV-reg FLAT); NONE moves hr off 0 -- the strongest (warm-start + SSIM-loss) got closest but stayed 7.3 dB short. The R2-G paper's regime is SPARSE-view CBCT (<=50 views) where FBP is weak; dense 128-view 2D CT is the wrong inductive bias. DECISION: empty-patch re-run of the iter-6 run-best config (warm-start + SSIM-loss@0.30, 1024G/130it) to confirm SSIM ~0.928 / hr=0 reproduces. BUDGET: ~660-1000s node-dependent, under the 1080 in-solver wall and 1800 SLURM wall, figure excluded. val_n=15 HELD CONSTANT. PREDICTION: SSIM ~0.928 (0.925-0.930), hr 0 -- faithful-but-regime-bounded negative result., gs_outer_wall_s=1080, gs_amp_init_max=0.05", "comparison_image": "runs/breast-ct-claude-agentic-r2gaussian-search-20260703-01/iterations/iter-0020/comparison.png"}
{"ts": "2026-07-05T22:43:12Z", "run_id": "breast-ct-claude-agentic-tv-iterative-supervised-search-20260703-01", "iter": 17, "agent": "tv_iterative_supervised-claude-agentic", "model": "claude-opus-4-8-1m", "change_class": "architecture", "status": "keep", "kept": true, "val_score": 0.9559089541435242, "headroom": 0.13508979477635763, "params_M": 2e-05, "train_n": 400, "rationale": "tv_iterative_supervised-claude-agentic: val_n=200, val_chunk=5, train_n=400, epochs=20, batch_size=1, lr=0.001, tv_K=10, tv_step_init=0.001, tv_lambda_init=1.0, tv_share_steps=False, tv_eps=1e-06, lambda_neg=1.0, loss_base=mse, grad_clip=1.0, rationale=tv_iterative_supervised iter-17 (breast_ct). OUTER-LR lower (finer convergence). iter-7 (lr=5e-2) drove step->0 faster (hr0 at dead lambda); now with active lambda=1.0, a LOWER lr may let the scalars settle into a finer lambda schedule minimum. ONE KNOB vs iter-12 (lr=5e-3, hr=0.1495): lr 5e-3->1e-3 (epochs=20 gives room to converge at the lower lr). HYPOTHESIS: finer optimisation steps find a slightly better per-iter lambda profile so hr edges above 0.1495. FALSIFIER: hr <=0.15 -> optimisation-converged, ceiling confirmed. BUDGET: iter-12 under wall.", "advice_for_others": "tv_iterative_supervised-claude-agentic: val_n=200, val_chunk=5, train_n=400, epochs=20, batch_size=1, lr=0.001, tv_K=10, tv_step_init=0.001, tv_lambda_init=1.0, tv_share_steps=False, tv_eps=1e-06, lambda_neg=1.0, loss_base=mse, grad_clip=1.0, rationale=tv_iterative_supervised iter-17 (breast_ct). OUTER-LR lower (finer convergence). iter-7 (lr=5e-2) drove step->0 faster (hr0 at dead lambda); now with active lambda=1.0, a LOWER lr may let the scalars settle into a finer lambda schedule minimum. ONE KNOB vs iter-12 (lr=5e-3, hr=0.1495): lr 5e-3->1e-3 (epochs=20 gives room to converge at the lower lr). HYPOTHESIS: finer optimisation steps find a slightly better per-iter lambda profile so hr edges above 0.1495. FALSIFIER: hr <=0.15 -> optimisation-converged, ceiling confirmed. BUDGET: iter-12 under wall.", "comparison_image": "runs/breast-ct-claude-agentic-tv-iterative-supervised-search-20260703-01/iterations/iter-0017/comparison.png"}
{"ts": "2026-07-05T22:36:56Z", "run_id": "breast-ct-claude-agentic-dual-domain-bilateral-n2i-search-20260703-01", "iter": 13, "agent": "dual_domain_bilateral_n2i-claude-agentic", "model": "claude-opus-4-8-1m", "change_class": "architecture", "status": "keep", "kept": true, "val_score": 0.9583393931388855, "headroom": 0.19882179919887932, "params_M": 6e-06, "train_n": 400, "rationale": "dual_domain_bilateral_n2i-claude-agentic: warm_start=True, pretrain_epochs=2, train_n=400, n_iter=30, val_n=200, batch_size=1, grad_clip=1.0, lr=0.003, proj_n_bf=1, img_n_bf=1, img_sr=0.0002, outer_wall_s=900, seed=42, rationale=iter-13 dual_domain_bilateral_n2i, ONE-KNOB: lr 0.002->0.003 (bracket the lr peak on the HIGH side), on iter-11 CHAMPION base (img_sr=0.0002, n_iter=30). lr AXIS now bracketed: 5e-3->hr0.126, 2e-3->hr0.1835 (PEAK so far), 1e-3->hr0.0895 (iter-12: UNDER-converged, SSIM crashed to 0.930 -- 30 steps from warm-start too few at this low lr). So the optimum is a PEAK near 2e-3 with steep falloff BELOW it (under-convergence) and gentler falloff ABOVE it (overshoot-to-noise). HYPOTHESIS: 3e-3 sits between the 2e-3 peak and the 5e-3 mild-overshoot; if hr(3e-3) < 0.1835 the peak is at/below 2e-3 and I stop refining lr (2e-3 confirmed optimal); if hr(3e-3) ~ or > 0.1835 the ridge is broad on the high side and 2-3e-3 is a plateau. Either way this NAILS the lr optimum in one clean step (val_n=200). BUDGET: same steps, ~950s. ONE knob: lr 0.002->0.003.", "advice_for_others": "dual_domain_bilateral_n2i-claude-agentic: warm_start=True, pretrain_epochs=2, train_n=400, n_iter=30, val_n=200, batch_size=1, grad_clip=1.0, lr=0.003, proj_n_bf=1, img_n_bf=1, img_sr=0.0002, outer_wall_s=900, seed=42, rationale=iter-13 dual_domain_bilateral_n2i, ONE-KNOB: lr 0.002->0.003 (bracket the lr peak on the HIGH side), on iter-11 CHAMPION base (img_sr=0.0002, n_iter=30). lr AXIS now bracketed: 5e-3->hr0.126, 2e-3->hr0.1835 (PEAK so far), 1e-3->hr0.0895 (iter-12: UNDER-converged, SSIM crashed to 0.930 -- 30 steps from warm-start too few at this low lr). So the optimum is a PEAK near 2e-3 with steep falloff BELOW it (under-convergence) and gentler falloff ABOVE it (overshoot-to-noise). HYPOTHESIS: 3e-3 sits between the 2e-3 peak and the 5e-3 mild-overshoot; if hr(3e-3) < 0.1835 the peak is at/below 2e-3 and I stop refining lr (2e-3 confirmed optimal); if hr(3e-3) ~ or > 0.1835 the ridge is broad on the high side and 2-3e-3 is a plateau. Either way this NAILS the lr optimum in one clean step (val_n=200). BUDGET: same steps, ~950s. ONE knob: lr 0.002->0.003.", "comparison_image": "runs/breast-ct-claude-agentic-dual-domain-bilateral-n2i-search-20260703-01/iterations/iter-0013/comparison.png"}
{"ts": "2026-07-05T22:34:33Z", "run_id": "breast-ct-claude-agentic-dual-domain-n2i-search-20260703-01", "iter": 6, "agent": "dual_domain_n2i-claude-agentic", "model": "claude-opus-4-8-1m", "change_class": "architecture", "status": "discard", "kept": false, "val_score": 0.9424485564231873, "headroom": 0.0, "params_M": 0.465762, "train_n": 400, "rationale": "dual_domain_n2i-claude-agentic: warm_start=True, pretrain_epochs=3, pretrain_steps=0, n_iter=50, grad_clip=1.0, outer_wall_s=1400, per_scene_s=None, batch_size=1, lr=0.0003, optimizer=adam, unet_c=16, train_n=400, val_n=200, seed=42, rationale=iter-6 SIX-BOX. (1) PRIOR: iter-5 hr=0.0, lr 1e-3->3e-4 gave rmse=0.00633 (best yet, but still >> baseline 0.00521), ssim=0.941, 197/200. Gentler steps nudged rmse down ~1% -- not near baseline. Iters 1-5 (budget, per-scene fit, capacity, warm-start, lr) all pinned at hr=0. (2) FAILURE MODE: N2I converges toward the over-smoothed FBP-consistent mean; the self-supervision target caps recon RMSE above the sparse-FBP baseline. A known N2I pathology on dense phantoms is that MORE inner steps over-smooth MORE (the denoiser regresses to the low-frequency mean). (3) ONE KNOB: n_iter 200 -> 50 (early-stop; keep lr=3e-4, c=16, warm_start=True -- identical to iter-5 except inner-step count). (4) HYPOTHESIS: stopping the per-image fit early (50 steps) may HALT before the denoiser collapses to the over-smoothed mean, preserving more high-frequency detail from the warm-started init and LOWERING rmse toward baseline. If hr rises, over-smoothing is a late-optimization effect and early-stop is the lever. Per the documented ceiling, more likely the warm-started init is ALREADY over-smoothed so early-stop just freezes a still-blurry recon (hr=0). (5) BUDGET: 50 inner steps/scene is far under the 7.0s per-scene wall, so all 200 scans finish FAST (~3-4s each) -> loop well under 1400s; warm-start ep=3 + fast loop + figure ~= 12-15 min << 30-min wall. (6) Loop continues; iter-7 self-dispatched. Reserved levers: lr up (3e-3), pretrain_epochs up (10), unet_c=8, grad_clip, n_iter mid (100).", "advice_for_others": "dual_domain_n2i-claude-agentic: warm_start=True, pretrain_epochs=3, pretrain_steps=0, n_iter=50, grad_clip=1.0, outer_wall_s=1400, per_scene_s=None, batch_size=1, lr=0.0003, optimizer=adam, unet_c=16, train_n=400, val_n=200, seed=42, rationale=iter-6 SIX-BOX. (1) PRIOR: iter-5 hr=0.0, lr 1e-3->3e-4 gave rmse=0.00633 (best yet, but still >> baseline 0.00521), ssim=0.941, 197/200. Gentler steps nudged rmse down ~1% -- not near baseline. Iters 1-5 (budget, per-scene fit, capacity, warm-start, lr) all pinned at hr=0. (2) FAILURE MODE: N2I converges toward the over-smoothed FBP-consistent mean; the self-supervision target caps recon RMSE above the sparse-FBP baseline. A known N2I pathology on dense phantoms is that MORE inner steps over-smooth MORE (the denoiser regresses to the low-frequency mean). (3) ONE KNOB: n_iter 200 -> 50 (early-stop; keep lr=3e-4, c=16, warm_start=True -- identical to iter-5 except inner-step count). (4) HYPOTHESIS: stopping the per-image fit early (50 steps) may HALT before the denoiser collapses to the over-smoothed mean, preserving more high-frequency detail from the warm-started init and LOWERING rmse toward baseline. If hr rises, over-smoothing is a late-optimization effect and early-stop is the lever. Per the documented ceiling, more likely the warm-started init is ALREADY over-smoothed so early-stop just freezes a still-blurry recon (hr=0). (5) BUDGET: 50 inner steps/scene is far under the 7.0s per-scene wall, so all 200 scans finish FAST (~3-4s each) -> loop well under 1400s; warm-start ep=3 + fast loop + figure ~= 12-15 min << 30-min wall. (6) Loop continues; iter-7 self-dispatched. Reserved levers: lr up (3e-3), pretrain_epochs up (10), unet_c=8, grad_clip, n_iter mid (100).", "comparison_image": "runs/breast-ct-claude-agentic-dual-domain-n2i-search-20260703-01/iterations/iter-0006/comparison.png"}
