{"ts": "2026-07-06T00:25:33Z", "run_id": "breast-ct-claude-agentic-naf-search-20260703-01", "iter": 6, "agent": "naf-claude-agentic", "model": "claude-opus-4-8-1m", "change_class": "architecture", "status": "discard", "kept": false, "val_score": 0.7664913535118103, "headroom": 0.0, "params_M": 0.037633, "train_n": 0, "rationale": "naf-claude-agentic: val_n=12, naf_n_freqs=8, naf_hidden=128, naf_layers=4, naf_n_iter=8000, naf_lr=0.03, naf_tv_weight=0.0001, naf_n_clip=0.05, naf_outer_wall_s=800, naf_per_scene_s=60.0, naf_encoding=fourier, seed=42, rationale=iter-6 breast-ct-claude-agentic-naf-search-20260703-01 (redone breast split train3600/val200/test200 seed20260703; val_n=12 CONSTANT for iters 2-20 per coordinator budget intervention 2026-07-05 -- first-12 of the 200-case breast val split, deterministic). SIX-BOX: (1) prior result: all iters so far hr=0 (iter-1 val_n=20 ssim0.355 PSNR6.26 in 970s, NOT a timeout -- a genuine converged fit). (2) failure mode: NAF per-scene INR recon is far below the 128-view breast LD-FBP baseline. (3) ONE knob changed: naf_lr 1e-2->3e-2. (4) hypothesis: iter-5 (lr=3e-3) hr=0. KNOB: raise lr the other way 1e-2->3e-2 (faster convergence within the tiny per-scene step budget). HYPOTHESIS: with only ~1000-1500 steps/scene a more aggressive lr reaches a lower loss sooner. Expect hr=0 (loss floor is basis-limited, not step-limited). (5) wall: val_n=12 x per_scene 60.0s = ~720s < 20min. (6) serial, no user return.", "advice_for_others": "naf-claude-agentic: val_n=12, naf_n_freqs=8, naf_hidden=128, naf_layers=4, naf_n_iter=8000, naf_lr=0.03, naf_tv_weight=0.0001, naf_n_clip=0.05, naf_outer_wall_s=800, naf_per_scene_s=60.0, naf_encoding=fourier, seed=42, rationale=iter-6 breast-ct-claude-agentic-naf-search-20260703-01 (redone breast split train3600/val200/test200 seed20260703; val_n=12 CONSTANT for iters 2-20 per coordinator budget intervention 2026-07-05 -- first-12 of the 200-case breast val split, deterministic). SIX-BOX: (1) prior result: all iters so far hr=0 (iter-1 val_n=20 ssim0.355 PSNR6.26 in 970s, NOT a timeout -- a genuine converged fit). (2) failure mode: NAF per-scene INR recon is far below the 128-view breast LD-FBP baseline. (3) ONE knob changed: naf_lr 1e-2->3e-2. (4) hypothesis: iter-5 (lr=3e-3) hr=0. KNOB: raise lr the other way 1e-2->3e-2 (faster convergence within the tiny per-scene step budget). HYPOTHESIS: with only ~1000-1500 steps/scene a more aggressive lr reaches a lower loss sooner. Expect hr=0 (loss floor is basis-limited, not step-limited). (5) wall: val_n=12 x per_scene 60.0s = ~720s < 20min. (6) serial, no user return.", "comparison_image": "runs/breast-ct-claude-agentic-naf-search-20260703-01/iterations/iter-0006/comparison.png"}
{"ts": "2026-07-06T00:05:05Z", "run_id": "breast-ct-claude-agentic-dual-domain-bilateral-n2i-search-20260703-01", "iter": 17, "agent": "dual_domain_bilateral_n2i-claude-agentic", "model": "claude-opus-4-8-1m", "change_class": "architecture", "status": "keep", "kept": true, "val_score": 0.9082974791526794, "headroom": 0.0025387993663684716, "params_M": 6e-06, "train_n": 400, "rationale": "dual_domain_bilateral_n2i-claude-agentic: warm_start=False, train_n=400, n_iter=60, val_n=200, batch_size=1, grad_clip=1.0, lr=0.003, proj_n_bf=1, img_n_bf=1, img_sr=0.0002, outer_wall_s=1000, seed=42, rationale=iter-17 dual_domain_bilateral_n2i, ONE-KNOB: warm_start True->False (pure per-image N2I, NO amortised pre-pass), on the CHAMPION base (img_sr=0.0002, lr=3e-3, n_iter=60; iter-15 hr=0.2056). n_iter held at 60 (iter-16 n_iter90 hr=0.2051 = TIED -> the 6-param BF converges by 60, saturated). HYPOTHESIS: the warm-start pre-pass captures a GENERIC BF-sigma init from the 400 train scenes; but the per-scene fit already tunes sigmas per image, so warm-start may add a generic-abdomen bias the tight img_sr must undo. With warm_start=False each scene fits from the CONFIG init (img_sr=0.0002 exactly) -> if hr >= 0.2056 the warm-start is UNNECESSARY (pure per-image N2I is self-sufficient AND drops the train-set dependency, a cleaner self-supervised story: train_n=0); if hr DROPS, the warm-start init genuinely helps the 60-step fit converge and should be kept. Either outcome is a clean methodological finding for the paper. WALL: skipping warm-start SAVES ~120s -> n_iter60 fits comfortably, val_n~200 (outer_wall_s=1000). ONE knob: warm_start True->False.", "advice_for_others": "dual_domain_bilateral_n2i-claude-agentic: warm_start=False, train_n=400, n_iter=60, val_n=200, batch_size=1, grad_clip=1.0, lr=0.003, proj_n_bf=1, img_n_bf=1, img_sr=0.0002, outer_wall_s=1000, seed=42, rationale=iter-17 dual_domain_bilateral_n2i, ONE-KNOB: warm_start True->False (pure per-image N2I, NO amortised pre-pass), on the CHAMPION base (img_sr=0.0002, lr=3e-3, n_iter=60; iter-15 hr=0.2056). n_iter held at 60 (iter-16 n_iter90 hr=0.2051 = TIED -> the 6-param BF converges by 60, saturated). HYPOTHESIS: the warm-start pre-pass captures a GENERIC BF-sigma init from the 400 train scenes; but the per-scene fit already tunes sigmas per image, so warm-start may add a generic-abdomen bias the tight img_sr must undo. With warm_start=False each scene fits from the CONFIG init (img_sr=0.0002 exactly) -> if hr >= 0.2056 the warm-start is UNNECESSARY (pure per-image N2I is self-sufficient AND drops the train-set dependency, a cleaner self-supervised story: train_n=0); if hr DROPS, the warm-start init genuinely helps the 60-step fit converge and should be kept. Either outcome is a clean methodological finding for the paper. WALL: skipping warm-start SAVES ~120s -> n_iter60 fits comfortably, val_n~200 (outer_wall_s=1000). ONE knob: warm_start True->False.", "comparison_image": "runs/breast-ct-claude-agentic-dual-domain-bilateral-n2i-search-20260703-01/iterations/iter-0017/comparison.png"}
{"ts": "2026-07-05T23:44:03Z", "run_id": "breast-ct-claude-agentic-dual-domain-bilateral-n2i-search-20260703-01", "iter": 16, "agent": "dual_domain_bilateral_n2i-claude-agentic", "model": "claude-opus-4-8-1m", "change_class": "architecture", "status": "keep", "kept": true, "val_score": 0.9603676199913025, "headroom": 0.20507613745861097, "params_M": 6e-06, "train_n": 400, "rationale": "dual_domain_bilateral_n2i-claude-agentic: warm_start=True, pretrain_epochs=2, train_n=400, n_iter=90, val_n=200, batch_size=1, grad_clip=1.0, lr=0.003, proj_n_bf=1, img_n_bf=1, img_sr=0.0002, outer_wall_s=1150, seed=42, rationale=iter-16 dual_domain_bilateral_n2i, ONE-KNOB: n_iter 60->90 at optimal lr=3e-3 (iter-15 champion hr=0.2056 at n_iter=60). n_iter CURVE at gentle lr=3e-3: 30->0.1988, 60->0.2056 (rising). img_sr=0.0002, kernel=7, spatial=1.5 fixed. HYPOTHESIS: the gentle-lr regime is well-damped (no overshoot), so the per-scene edge-preserving fit keeps IMPROVING with more steps; 90 steps should push hr above 0.2056 IF the 6-param BF has not yet fully converged at 60. If FLAT/DROP, the tiny bilateral (6 params) has converged by ~60 steps and n_iter is saturated -> ~0.205 is the practical ceiling. WALL: n_iter60 trimmed val to 196 at outer_wall_s=900; n_iter90 is 1.5x more per-scene work so I RAISE outer_wall_s 900->1150 to keep val_n at/near 200 for a clean comparison (total still fits the 30-min=1800s sbatch wall: warm-start ~120s + 200x90 steps at breast-light 128-view adjoint + figure ~ under 1500s). Report val_n. ONE knob: n_iter 60->90 (outer_wall_s raised only to PRESERVE val_n, not as a second lever).", "advice_for_others": "dual_domain_bilateral_n2i-claude-agentic: warm_start=True, pretrain_epochs=2, train_n=400, n_iter=90, val_n=200, batch_size=1, grad_clip=1.0, lr=0.003, proj_n_bf=1, img_n_bf=1, img_sr=0.0002, outer_wall_s=1150, seed=42, rationale=iter-16 dual_domain_bilateral_n2i, ONE-KNOB: n_iter 60->90 at optimal lr=3e-3 (iter-15 champion hr=0.2056 at n_iter=60). n_iter CURVE at gentle lr=3e-3: 30->0.1988, 60->0.2056 (rising). img_sr=0.0002, kernel=7, spatial=1.5 fixed. HYPOTHESIS: the gentle-lr regime is well-damped (no overshoot), so the per-scene edge-preserving fit keeps IMPROVING with more steps; 90 steps should push hr above 0.2056 IF the 6-param BF has not yet fully converged at 60. If FLAT/DROP, the tiny bilateral (6 params) has converged by ~60 steps and n_iter is saturated -> ~0.205 is the practical ceiling. WALL: n_iter60 trimmed val to 196 at outer_wall_s=900; n_iter90 is 1.5x more per-scene work so I RAISE outer_wall_s 900->1150 to keep val_n at/near 200 for a clean comparison (total still fits the 30-min=1800s sbatch wall: warm-start ~120s + 200x90 steps at breast-light 128-view adjoint + figure ~ under 1500s). Report val_n. ONE knob: n_iter 60->90 (outer_wall_s raised only to PRESERVE val_n, not as a second lever).", "comparison_image": "runs/breast-ct-claude-agentic-dual-domain-bilateral-n2i-search-20260703-01/iterations/iter-0016/comparison.png"}
{"ts": "2026-07-05T23:36:25Z", "run_id": "breast-ct-claude-agentic-dual-domain-n2i-search-20260703-01", "iter": 7, "agent": "dual_domain_n2i-claude-agentic", "model": "claude-opus-4-8-1m", "change_class": "architecture", "status": "discard", "kept": false, "val_score": 0.93094801902771, "headroom": 0.0, "params_M": 0.465762, "train_n": 400, "rationale": "dual_domain_n2i-claude-agentic: warm_start=True, pretrain_epochs=3, pretrain_steps=0, n_iter=50, grad_clip=1.0, outer_wall_s=1400, per_scene_s=None, batch_size=1, lr=0.003, optimizer=adam, unet_c=16, train_n=400, val_n=200, seed=42, rationale=iter-7 SIX-BOX. (1) PRIOR: iter-6 hr=0.0, early-stop n_iter=50 (lr=3e-4) gave rmse=0.00628 (marginally best, still >> baseline 0.00521), ssim=0.942, 200/200. Stopping early froze a still-blurry recon -- the warm-started init is already over-smoothed. Iters 1-6 (budget, per-scene fit, capacity, warm-start, lr-down, early-stop) all hr=0. NOTE: the SIBLING solver dual_domain_bilateral_n2i (a DIFFERENT solver with a trainable bilateral post-filter) reached hr~0.20; that bilateral edge-preserving stage is exactly the structural element THIS plain-UNet N2I solver lacks -- documented as the likely reason for our ceiling, but out of scope to add (protocol fixes SOLVER=dual_domain_n2i). (2) FAILURE MODE: plain-UNet N2I regresses to the over-smoothed FBP-consistent mean; no edge-preserving prior to hold detail. (3) ONE KNOB: lr 3e-4 -> 3e-3 (keep n_iter=50, warm_start=True, c=16 -- identical to iter-6 except lr, an order-of-magnitude aggressive step). (4) HYPOTHESIS: a large step size with only 50 inner iters may jump the per-image fit into a sharper, higher-frequency basin the small-lr fits never reached, lowering rmse; if hr rises, the plateau was an optimization-basin artifact. Per the ceiling, more likely lr=3e-3 either destabilizes (grad_clip=1.0 catches it) or converges to the same over-smoothed solution (hr=0). (5) BUDGET: 50 inner steps/scene, fast; loop << 1400s wall; total ~13 min << 30-min wall. (6) Loop continues; iter-8 self-dispatched. Reserved levers: pretrain_epochs up (10), unet_c=8, n_iter mid (100), grad_clip off, seed change (variance check).", "advice_for_others": "dual_domain_n2i-claude-agentic: warm_start=True, pretrain_epochs=3, pretrain_steps=0, n_iter=50, grad_clip=1.0, outer_wall_s=1400, per_scene_s=None, batch_size=1, lr=0.003, optimizer=adam, unet_c=16, train_n=400, val_n=200, seed=42, rationale=iter-7 SIX-BOX. (1) PRIOR: iter-6 hr=0.0, early-stop n_iter=50 (lr=3e-4) gave rmse=0.00628 (marginally best, still >> baseline 0.00521), ssim=0.942, 200/200. Stopping early froze a still-blurry recon -- the warm-started init is already over-smoothed. Iters 1-6 (budget, per-scene fit, capacity, warm-start, lr-down, early-stop) all hr=0. NOTE: the SIBLING solver dual_domain_bilateral_n2i (a DIFFERENT solver with a trainable bilateral post-filter) reached hr~0.20; that bilateral edge-preserving stage is exactly the structural element THIS plain-UNet N2I solver lacks -- documented as the likely reason for our ceiling, but out of scope to add (protocol fixes SOLVER=dual_domain_n2i). (2) FAILURE MODE: plain-UNet N2I regresses to the over-smoothed FBP-consistent mean; no edge-preserving prior to hold detail. (3) ONE KNOB: lr 3e-4 -> 3e-3 (keep n_iter=50, warm_start=True, c=16 -- identical to iter-6 except lr, an order-of-magnitude aggressive step). (4) HYPOTHESIS: a large step size with only 50 inner iters may jump the per-image fit into a sharper, higher-frequency basin the small-lr fits never reached, lowering rmse; if hr rises, the plateau was an optimization-basin artifact. Per the ceiling, more likely lr=3e-3 either destabilizes (grad_clip=1.0 catches it) or converges to the same over-smoothed solution (hr=0). (5) BUDGET: 50 inner steps/scene, fast; loop << 1400s wall; total ~13 min << 30-min wall. (6) Loop continues; iter-8 self-dispatched. Reserved levers: pretrain_epochs up (10), unet_c=8, n_iter mid (100), grad_clip off, seed change (variance check).", "comparison_image": "runs/breast-ct-claude-agentic-dual-domain-n2i-search-20260703-01/iterations/iter-0007/comparison.png"}
{"ts": "2026-07-05T23:35:48Z", "run_id": "breast-ct-claude-agentic-tv-iterative-supervised-search-20260703-01", "iter": 20, "agent": "tv_iterative_supervised-claude-agentic", "model": "claude-opus-4-8-1m", "change_class": "architecture", "status": "keep", "kept": true, "val_score": 0.9575998187065125, "headroom": 0.1493679576916066, "params_M": 1.2e-05, "train_n": 400, "rationale": "tv_iterative_supervised-claude-agentic: val_n=200, val_chunk=5, train_n=400, epochs=20, batch_size=1, lr=0.005, tv_K=6, tv_step_init=0.001, tv_lambda_init=1.0, tv_share_steps=False, tv_eps=1e-06, lambda_neg=1.0, loss_base=mse, grad_clip=1.0, rationale=tv_iterative_supervised iter-20 (breast_ct). K LOW edge (final). Depth UP falsified twice (K30/K50 collapse). Test K DOWN: fewer TV passes = less smoothing, may retain more fine breast structure. ONE KNOB vs iter-12 (K=10, ep20, hr=0.1495): tv_K 10->6. HYPOTHESIS: if hr>0.1495 the K=10 smoothing was slightly too much and fewer passes preserve structure; if hr<0.1495 K=10 was optimal. Closes the K axis low edge. This is the HARD-STOP iter-20. BUDGET: K=6 < K=10 -> faster, under wall.", "advice_for_others": "tv_iterative_supervised-claude-agentic: val_n=200, val_chunk=5, train_n=400, epochs=20, batch_size=1, lr=0.005, tv_K=6, tv_step_init=0.001, tv_lambda_init=1.0, tv_share_steps=False, tv_eps=1e-06, lambda_neg=1.0, loss_base=mse, grad_clip=1.0, rationale=tv_iterative_supervised iter-20 (breast_ct). K LOW edge (final). Depth UP falsified twice (K30/K50 collapse). Test K DOWN: fewer TV passes = less smoothing, may retain more fine breast structure. ONE KNOB vs iter-12 (K=10, ep20, hr=0.1495): tv_K 10->6. HYPOTHESIS: if hr>0.1495 the K=10 smoothing was slightly too much and fewer passes preserve structure; if hr<0.1495 K=10 was optimal. Closes the K axis low edge. This is the HARD-STOP iter-20. BUDGET: K=6 < K=10 -> faster, under wall.", "comparison_image": "runs/breast-ct-claude-agentic-tv-iterative-supervised-search-20260703-01/iterations/iter-0020/comparison.png"}
{"ts": "2026-07-05T23:25:29Z", "run_id": "breast-ct-claude-agentic-naf-search-20260703-01", "iter": 5, "agent": "naf-claude-agentic", "model": "claude-opus-4-8-1m", "change_class": "architecture", "status": "discard", "kept": false, "val_score": 0.7678041458129883, "headroom": 0.0, "params_M": 0.037633, "train_n": 0, "rationale": "naf-claude-agentic: val_n=12, naf_n_freqs=8, naf_hidden=128, naf_layers=4, naf_n_iter=8000, naf_lr=0.003, naf_tv_weight=0.0001, naf_n_clip=0.05, naf_outer_wall_s=800, naf_per_scene_s=60.0, naf_encoding=fourier, seed=42, rationale=iter-5 breast-ct-claude-agentic-naf-search-20260703-01 (redone breast split train3600/val200/test200 seed20260703; val_n=12 CONSTANT for iters 2-20 per coordinator budget intervention 2026-07-05 -- first-12 of the 200-case breast val split, deterministic). SIX-BOX: (1) prior result: all iters so far hr=0 (iter-1 val_n=20 ssim0.355 PSNR6.26 in 970s, NOT a timeout -- a genuine converged fit). (2) failure mode: NAF per-scene INR recon is far below the 128-view breast LD-FBP baseline. (3) ONE knob changed: naf_lr 1e-2->3e-3. (4) hypothesis: iters 2-4 hr=0 at capacity bumps. KNOB: lower lr 1e-2->3e-3 (finer convergence, less bouncing near the minimum). HYPOTHESIS: last_loss plateaued ~0.85-0.91 at lr=1e-2 -- maybe the optimizer overshoots; a smaller lr with the same 60s wall converges to a lower data-fit loss and a sharper recon. Expect hr=0 but tests optimization vs capacity. (5) wall: val_n=12 x per_scene 60.0s = ~720s < 20min. (6) serial, no user return.", "advice_for_others": "naf-claude-agentic: val_n=12, naf_n_freqs=8, naf_hidden=128, naf_layers=4, naf_n_iter=8000, naf_lr=0.003, naf_tv_weight=0.0001, naf_n_clip=0.05, naf_outer_wall_s=800, naf_per_scene_s=60.0, naf_encoding=fourier, seed=42, rationale=iter-5 breast-ct-claude-agentic-naf-search-20260703-01 (redone breast split train3600/val200/test200 seed20260703; val_n=12 CONSTANT for iters 2-20 per coordinator budget intervention 2026-07-05 -- first-12 of the 200-case breast val split, deterministic). SIX-BOX: (1) prior result: all iters so far hr=0 (iter-1 val_n=20 ssim0.355 PSNR6.26 in 970s, NOT a timeout -- a genuine converged fit). (2) failure mode: NAF per-scene INR recon is far below the 128-view breast LD-FBP baseline. (3) ONE knob changed: naf_lr 1e-2->3e-3. (4) hypothesis: iters 2-4 hr=0 at capacity bumps. KNOB: lower lr 1e-2->3e-3 (finer convergence, less bouncing near the minimum). HYPOTHESIS: last_loss plateaued ~0.85-0.91 at lr=1e-2 -- maybe the optimizer overshoots; a smaller lr with the same 60s wall converges to a lower data-fit loss and a sharper recon. Expect hr=0 but tests optimization vs capacity. (5) wall: val_n=12 x per_scene 60.0s = ~720s < 20min. (6) serial, no user return.", "comparison_image": "runs/breast-ct-claude-agentic-naf-search-20260703-01/iterations/iter-0005/comparison.png"}
{"ts": "2026-07-05T23:25:09Z", "run_id": "breast-ct-claude-agentic-tv-iterative-supervised-search-20260703-01", "iter": 19, "agent": "tv_iterative_supervised-claude-agentic", "model": "claude-opus-4-8-1m", "change_class": "architecture", "status": "keep", "kept": true, "val_score": 0.9575257897377014, "headroom": 0.1492616848144721, "params_M": 2e-05, "train_n": 400, "rationale": "tv_iterative_supervised-claude-agentic: val_n=200, val_chunk=5, train_n=400, epochs=30, batch_size=1, lr=0.005, tv_K=10, tv_step_init=0.001, tv_lambda_init=1.0, tv_share_steps=False, tv_eps=1e-06, lambda_neg=1.0, loss_base=mse, grad_clip=1.0, rationale=tv_iterative_supervised iter-19 (breast_ct). EPOCHS edge (deeper convergence). epochs 10->20 lifted hr 0.1471->0.1495 (tiny). Test whether more epochs keep helping. ONE KNOB vs iter-12 (epochs=20): epochs 20->30. HYPOTHESIS: if hr keeps rising the schedule is still under-converged; if it saturates ~0.15 the plateau/ceiling is confirmed converged. BUDGET: epochs=30 at K=10 ~ 1.5x iter-12 train; iter-12 ran comfortably under wall so ~1100-1150s, watch the wall (fallback val_n cut if needed).", "advice_for_others": "tv_iterative_supervised-claude-agentic: val_n=200, val_chunk=5, train_n=400, epochs=30, batch_size=1, lr=0.005, tv_K=10, tv_step_init=0.001, tv_lambda_init=1.0, tv_share_steps=False, tv_eps=1e-06, lambda_neg=1.0, loss_base=mse, grad_clip=1.0, rationale=tv_iterative_supervised iter-19 (breast_ct). EPOCHS edge (deeper convergence). epochs 10->20 lifted hr 0.1471->0.1495 (tiny). Test whether more epochs keep helping. ONE KNOB vs iter-12 (epochs=20): epochs 20->30. HYPOTHESIS: if hr keeps rising the schedule is still under-converged; if it saturates ~0.15 the plateau/ceiling is confirmed converged. BUDGET: epochs=30 at K=10 ~ 1.5x iter-12 train; iter-12 ran comfortably under wall so ~1100-1150s, watch the wall (fallback val_n cut if needed).", "comparison_image": "runs/breast-ct-claude-agentic-tv-iterative-supervised-search-20260703-01/iterations/iter-0019/comparison.png"}
