{"ts": "2026-07-07T13:04:19Z", "run_id": "breast-ct-claude-agentic-param-efficient-search-20260703-01", "iter": 26, "agent": "param_efficient-claude-agentic", "model": "claude-opus-4-8-1m", "change_class": "architecture", "status": "keep", "kept": true, "val_score": 0.9634141325950623, "headroom": 0.24268250960095072, "params_M": 0.000184, "train_n": 200, "rationale": "param_efficient-claude-agentic: reg_type=bilateral, bilateral_on_top=False, proj_filter_on=False, n_iter=30, learnable_alpha=True, alpha_init=0.1, foe_n_filters=24, foe_kernel=7, foe_n_bumps=31, n_bf=1, bf_multiscale=True, bf_sigmas=[0.8, 1.6, 3.2], bf_kernel=7, bf_sigma_r=0.02, bf_gain_init=0.0, epochs=16, cosine_lr=True, lr=0.005, max_train_s=1080, batch_size=4, train_n=200, val_n=200, display_min=0.0, display_max=0.05, seed=42, rationale=iter-26 param_efficient breast -- CG-DC budget-fitted (n_cg 5->2). SIX-BOX: (1) PRIOR: iter-25 CG-DC n_cg=5 gave hr 0.2362 but was EPOCH-STARVED -- only 3/16 epochs (vs champion filtered-DC's ~6-16), loss STILL DESCENDING at cutoff (1.07e-3->2.5e-5->1.84e-5 dropping ep2->3). Not a genuine null; 5 CG iters ~ 10x projector calls halved epochs. (2) FAILURE MODE: CG cost too high to train in the 20-min wall. (3) ONE KNOB: cg_n 5->2 (a LIGHTLY-solved CG-DC, ~2.5x the projector calls of filtered-DC instead of ~10x) so it trains a COMPARABLE number of epochs to the champion. Still a stronger DC than one filtered gradient. All else byte-for-byte iter-25 (K=30, LPD W=4, seed42). (4) HYPOTHESIS: at n_cg=2 the run reaches ~6-8 epochs (comparable to the champion) and a lightly-solved CG-DC -- if CG's extra consistency-completeness is worth anything per projector-call -- beats the filtered-DC champion 0.5047. If a budget-fitted CG-DC STILL underperforms filtered-DC, that's a CLEAN FINDING: the single filtered gradient + LPD-combine is already near-optimal per projector-call and CG's extra completeness isn't worth the epochs it costs under a fixed wall. (5) BUDGET: n_cg=2 x K=30 = 2 fwd+back pairs/step x30; expect ~6-8 epochs; train_n=200, max_train_s=1080, --time=00:30:00, 200-val -> 20-min comparable. (6) SERIAL; iter-27: if CG-DC helps, tune cg_n/lam/K; else record the finding and continue the menu (multi-scale bilateral POST-filter, learned per-step DC schedule, 2-step LPD)., dc_mode=cg, per_step_alpha=True, lpd_on=True, lpd_width=4, lpd_kernel=3, anisotropic_on_top=False, cg_n=2, cg_lam_init=0.01", "advice_for_others": "param_efficient-claude-agentic: reg_type=bilateral, bilateral_on_top=False, proj_filter_on=False, n_iter=30, learnable_alpha=True, alpha_init=0.1, foe_n_filters=24, foe_kernel=7, foe_n_bumps=31, n_bf=1, bf_multiscale=True, bf_sigmas=[0.8, 1.6, 3.2], bf_kernel=7, bf_sigma_r=0.02, bf_gain_init=0.0, epochs=16, cosine_lr=True, lr=0.005, max_train_s=1080, batch_size=4, train_n=200, val_n=200, display_min=0.0, display_max=0.05, seed=42, rationale=iter-26 param_efficient breast -- CG-DC budget-fitted (n_cg 5->2). SIX-BOX: (1) PRIOR: iter-25 CG-DC n_cg=5 gave hr 0.2362 but was EPOCH-STARVED -- only 3/16 epochs (vs champion filtered-DC's ~6-16), loss STILL DESCENDING at cutoff (1.07e-3->2.5e-5->1.84e-5 dropping ep2->3). Not a genuine null; 5 CG iters ~ 10x projector calls halved epochs. (2) FAILURE MODE: CG cost too high to train in the 20-min wall. (3) ONE KNOB: cg_n 5->2 (a LIGHTLY-solved CG-DC, ~2.5x the projector calls of filtered-DC instead of ~10x) so it trains a COMPARABLE number of epochs to the champion. Still a stronger DC than one filtered gradient. All else byte-for-byte iter-25 (K=30, LPD W=4, seed42). (4) HYPOTHESIS: at n_cg=2 the run reaches ~6-8 epochs (comparable to the champion) and a lightly-solved CG-DC -- if CG's extra consistency-completeness is worth anything per projector-call -- beats the filtered-DC champion 0.5047. If a budget-fitted CG-DC STILL underperforms filtered-DC, that's a CLEAN FINDING: the single filtered gradient + LPD-combine is already near-optimal per projector-call and CG's extra completeness isn't worth the epochs it costs under a fixed wall. (5) BUDGET: n_cg=2 x K=30 = 2 fwd+back pairs/step x30; expect ~6-8 epochs; train_n=200, max_train_s=1080, --time=00:30:00, 200-val -> 20-min comparable. (6) SERIAL; iter-27: if CG-DC helps, tune cg_n/lam/K; else record the finding and continue the menu (multi-scale bilateral POST-filter, learned per-step DC schedule, 2-step LPD)., dc_mode=cg, per_step_alpha=True, lpd_on=True, lpd_width=4, lpd_kernel=3, anisotropic_on_top=False, cg_n=2, cg_lam_init=0.01", "comparison_image": "runs/breast-ct-claude-agentic-param-efficient-search-20260703-01/iterations/iter-0026/comparison.png"}
{"ts": "2026-07-07T12:12:44Z", "run_id": "breast-ct-claude-agentic-param-efficient-search-20260703-01", "iter": 25, "agent": "param_efficient-claude-agentic", "model": "claude-opus-4-8-1m", "change_class": "architecture", "status": "keep", "kept": true, "val_score": 0.9627381563186646, "headroom": 0.23618182449811298, "params_M": 0.000184, "train_n": 200, "rationale": "param_efficient-claude-agentic: reg_type=bilateral, bilateral_on_top=False, proj_filter_on=False, n_iter=30, learnable_alpha=True, alpha_init=0.1, foe_n_filters=24, foe_kernel=7, foe_n_bumps=31, n_bf=1, bf_multiscale=True, bf_sigmas=[0.8, 1.6, 3.2], bf_kernel=7, bf_sigma_r=0.02, bf_gain_init=0.0, epochs=16, cosine_lr=True, lr=0.005, max_train_s=1080, batch_size=4, train_n=200, val_n=200, display_min=0.0, display_max=0.05, seed=42, rationale=iter-25 param_efficient breast -- CONJUGATE-GRADIENT DATA-CONSISTENCY (highest-upside untested lever). SIX-BOX: (1) PRIOR: champion = LPD-combine W=4 + FILTERED-DC (single fbp(Rx-g)) K=30, 5-seed mean 0.4590+-0.0294 @ 183p (best 0.5047). Filtered-DC uses ONE filtered gradient per step; a proper CG solve of the normal equations is a MUCH stronger DC solver -- CG-DC is the mechanism that got fastdiff-pixel-DC-on to 0.52 and wavelet-DC-on to 0.28. UNTESTED in this unroll. (2) FAILURE MODE: a single filtered gradient only partially enforces Rx=g each step; 30 of them approximate consistency but a per-step CG solve nails it far better. (3) ONE KNOB (architectural): dc_mode 'filtered'->'cg' -- I added CGDataConsistency: n_cg=5 matrix-free CG iterations solving (R^T R + lam I)d = R^T(g - Rx) for the DC update d (lam = softplus(learnable), damps the ill-conditioned 128-view normal operator), fed to the SAME LPD-combine block. +1 param (lam) -> 184 total. NOT byte-for-byte the champion (CG is a different, stronger DC operator) -- it is a genuine architectural swap of the DC solver. (4) HYPOTHESIS: a per-step CG least-squares DC solve enforces Rx=g much more completely than one filtered gradient, so the LPD-combine routes a cleaner, more consistent correction -> hr climbs past 0.5047 toward the 0.52-0.63 regime (fastdiff CG-DC reached 0.52). Risk: CG on the ill-conditioned 128-view operator can amplify streaks if underdamped -> lam is learnable to control this. (5) BUDGET: 5 CG iters = 5 fwd+back-proj PAIRS per unroll step x K=30 -> ~10x the projector calls of filtered-DC; may only fit a few epochs in 1080s -- if hr promising but undertrained, iter-26 reduces cg_n or K. train_n=200, --time=00:30:00, 200-val, 20-min budget. (6) SERIAL; iter-26: tune cg_n/lam if it helps, then multi-scale-bilateral POST-filter., dc_mode=cg, per_step_alpha=True, lpd_on=True, lpd_width=4, lpd_kernel=3, anisotropic_on_top=False, cg_n=5, cg_lam_init=0.01", "advice_for_others": "param_efficient-claude-agentic: reg_type=bilateral, bilateral_on_top=False, proj_filter_on=False, n_iter=30, learnable_alpha=True, alpha_init=0.1, foe_n_filters=24, foe_kernel=7, foe_n_bumps=31, n_bf=1, bf_multiscale=True, bf_sigmas=[0.8, 1.6, 3.2], bf_kernel=7, bf_sigma_r=0.02, bf_gain_init=0.0, epochs=16, cosine_lr=True, lr=0.005, max_train_s=1080, batch_size=4, train_n=200, val_n=200, display_min=0.0, display_max=0.05, seed=42, rationale=iter-25 param_efficient breast -- CONJUGATE-GRADIENT DATA-CONSISTENCY (highest-upside untested lever). SIX-BOX: (1) PRIOR: champion = LPD-combine W=4 + FILTERED-DC (single fbp(Rx-g)) K=30, 5-seed mean 0.4590+-0.0294 @ 183p (best 0.5047). Filtered-DC uses ONE filtered gradient per step; a proper CG solve of the normal equations is a MUCH stronger DC solver -- CG-DC is the mechanism that got fastdiff-pixel-DC-on to 0.52 and wavelet-DC-on to 0.28. UNTESTED in this unroll. (2) FAILURE MODE: a single filtered gradient only partially enforces Rx=g each step; 30 of them approximate consistency but a per-step CG solve nails it far better. (3) ONE KNOB (architectural): dc_mode 'filtered'->'cg' -- I added CGDataConsistency: n_cg=5 matrix-free CG iterations solving (R^T R + lam I)d = R^T(g - Rx) for the DC update d (lam = softplus(learnable), damps the ill-conditioned 128-view normal operator), fed to the SAME LPD-combine block. +1 param (lam) -> 184 total. NOT byte-for-byte the champion (CG is a different, stronger DC operator) -- it is a genuine architectural swap of the DC solver. (4) HYPOTHESIS: a per-step CG least-squares DC solve enforces Rx=g much more completely than one filtered gradient, so the LPD-combine routes a cleaner, more consistent correction -> hr climbs past 0.5047 toward the 0.52-0.63 regime (fastdiff CG-DC reached 0.52). Risk: CG on the ill-conditioned 128-view operator can amplify streaks if underdamped -> lam is learnable to control this. (5) BUDGET: 5 CG iters = 5 fwd+back-proj PAIRS per unroll step x K=30 -> ~10x the projector calls of filtered-DC; may only fit a few epochs in 1080s -- if hr promising but undertrained, iter-26 reduces cg_n or K. train_n=200, --time=00:30:00, 200-val, 20-min budget. (6) SERIAL; iter-26: tune cg_n/lam if it helps, then multi-scale-bilateral POST-filter., dc_mode=cg, per_step_alpha=True, lpd_on=True, lpd_width=4, lpd_kernel=3, anisotropic_on_top=False, cg_n=5, cg_lam_init=0.01", "comparison_image": "runs/breast-ct-claude-agentic-param-efficient-search-20260703-01/iterations/iter-0025/comparison.png"}
{"ts": "2026-07-07T11:42:20Z", "run_id": "breast-ct-claude-agentic-param-efficient-search-20260703-01", "iter": 21, "agent": "param_efficient-claude-agentic", "model": "claude-opus-4-8-1m", "change_class": "architecture", "status": "keep", "kept": true, "val_score": 0.9739974141120911, "headroom": 0.449706226938674, "params_M": 0.000183, "train_n": 200, "rationale": "param_efficient-claude-agentic: reg_type=bilateral, bilateral_on_top=False, proj_filter_on=False, n_iter=30, learnable_alpha=True, alpha_init=0.1, foe_n_filters=24, foe_kernel=7, foe_n_bumps=31, n_bf=1, bf_multiscale=True, bf_sigmas=[0.8, 1.6, 3.2], bf_kernel=7, bf_sigma_r=0.02, bf_gain_init=0.0, epochs=16, cosine_lr=True, lr=0.005, max_train_s=1080, batch_size=4, train_n=200, val_n=200, display_min=0.0, display_max=0.05, seed=46, rationale=iter-21 param_efficient breast -- SEED REPLICATE 4/4 of the CHAMPION (LPD-combine W=4, filtered-DC K=30, 183 params). SIX-BOX: (1) PRIOR: architecture search COMPLETE; champion = iter-15 (seed 42) hr 0.5047 @ 183p. Adjoint/config capped ~0.26; filtered-DC broke it (0.4345 @ 13p); prox capacity fought it (0.0); LPD learned-combination WON (0.5047); W=8 and sinogram-dual both regressed -> W=4 primal-only is the optimum. (2) FAILURE MODE: single-seed hr is noise-confounded (breast seed variance is large, ~+-0.05 per the DL-tier solvers) -- need mean+-std. (3) ONE KNOB: seed 42 -> 46 (replicate 4/4). ALL else byte-for-byte the champion. (4) HYPOTHESIS: hr lands near 0.5047 +- seed noise; the 5-seed (42-46) mean+-std is the REPORTED headline number @ 183 params. (5) BUDGET: identical to iter-15 (16ep in ~1020s), max_train_s=1080, --time=00:30:00, 200-val -> 20-min comparable. (6) SERIAL; next replicate self-dispatches; recon_raw.npz (pred/truth/baseline) saved to the iter dir for test-scorability., dc_mode=filtered, per_step_alpha=True, lpd_on=True, lpd_width=4, lpd_kernel=3, anisotropic_on_top=False", "advice_for_others": "param_efficient-claude-agentic: reg_type=bilateral, bilateral_on_top=False, proj_filter_on=False, n_iter=30, learnable_alpha=True, alpha_init=0.1, foe_n_filters=24, foe_kernel=7, foe_n_bumps=31, n_bf=1, bf_multiscale=True, bf_sigmas=[0.8, 1.6, 3.2], bf_kernel=7, bf_sigma_r=0.02, bf_gain_init=0.0, epochs=16, cosine_lr=True, lr=0.005, max_train_s=1080, batch_size=4, train_n=200, val_n=200, display_min=0.0, display_max=0.05, seed=46, rationale=iter-21 param_efficient breast -- SEED REPLICATE 4/4 of the CHAMPION (LPD-combine W=4, filtered-DC K=30, 183 params). SIX-BOX: (1) PRIOR: architecture search COMPLETE; champion = iter-15 (seed 42) hr 0.5047 @ 183p. Adjoint/config capped ~0.26; filtered-DC broke it (0.4345 @ 13p); prox capacity fought it (0.0); LPD learned-combination WON (0.5047); W=8 and sinogram-dual both regressed -> W=4 primal-only is the optimum. (2) FAILURE MODE: single-seed hr is noise-confounded (breast seed variance is large, ~+-0.05 per the DL-tier solvers) -- need mean+-std. (3) ONE KNOB: seed 42 -> 46 (replicate 4/4). ALL else byte-for-byte the champion. (4) HYPOTHESIS: hr lands near 0.5047 +- seed noise; the 5-seed (42-46) mean+-std is the REPORTED headline number @ 183 params. (5) BUDGET: identical to iter-15 (16ep in ~1020s), max_train_s=1080, --time=00:30:00, 200-val -> 20-min comparable. (6) SERIAL; next replicate self-dispatches; recon_raw.npz (pred/truth/baseline) saved to the iter dir for test-scorability., dc_mode=filtered, per_step_alpha=True, lpd_on=True, lpd_width=4, lpd_kernel=3, anisotropic_on_top=False", "comparison_image": "runs/breast-ct-claude-agentic-param-efficient-search-20260703-01/iterations/iter-0021/comparison.png"}
{"ts": "2026-07-07T11:22:45Z", "run_id": "breast-ct-claude-agentic-param-efficient-search-20260703-01", "iter": 20, "agent": "param_efficient-claude-agentic", "model": "claude-opus-4-8-1m", "change_class": "architecture", "status": "keep", "kept": true, "val_score": 0.968178391456604, "headroom": 0.42362708615220657, "params_M": 0.000183, "train_n": 200, "rationale": "param_efficient-claude-agentic: reg_type=bilateral, bilateral_on_top=False, proj_filter_on=False, n_iter=30, learnable_alpha=True, alpha_init=0.1, foe_n_filters=24, foe_kernel=7, foe_n_bumps=31, n_bf=1, bf_multiscale=True, bf_sigmas=[0.8, 1.6, 3.2], bf_kernel=7, bf_sigma_r=0.02, bf_gain_init=0.0, epochs=16, cosine_lr=True, lr=0.005, max_train_s=1080, batch_size=4, train_n=200, val_n=200, display_min=0.0, display_max=0.05, seed=45, rationale=iter-20 param_efficient breast -- SEED REPLICATE 3/4 of the CHAMPION (LPD-combine W=4, filtered-DC K=30, 183 params). SIX-BOX: (1) PRIOR: architecture search COMPLETE; champion = iter-15 (seed 42) hr 0.5047 @ 183p. Adjoint/config capped ~0.26; filtered-DC broke it (0.4345 @ 13p); prox capacity fought it (0.0); LPD learned-combination WON (0.5047); W=8 and sinogram-dual both regressed -> W=4 primal-only is the optimum. (2) FAILURE MODE: single-seed hr is noise-confounded (breast seed variance is large, ~+-0.05 per the DL-tier solvers) -- need mean+-std. (3) ONE KNOB: seed 42 -> 45 (replicate 3/4). ALL else byte-for-byte the champion. (4) HYPOTHESIS: hr lands near 0.5047 +- seed noise; the 5-seed (42-46) mean+-std is the REPORTED headline number @ 183 params. (5) BUDGET: identical to iter-15 (16ep in ~1020s), max_train_s=1080, --time=00:30:00, 200-val -> 20-min comparable. (6) SERIAL; next replicate self-dispatches; recon_raw.npz (pred/truth/baseline) saved to the iter dir for test-scorability., dc_mode=filtered, per_step_alpha=True, lpd_on=True, lpd_width=4, lpd_kernel=3, anisotropic_on_top=False", "advice_for_others": "param_efficient-claude-agentic: reg_type=bilateral, bilateral_on_top=False, proj_filter_on=False, n_iter=30, learnable_alpha=True, alpha_init=0.1, foe_n_filters=24, foe_kernel=7, foe_n_bumps=31, n_bf=1, bf_multiscale=True, bf_sigmas=[0.8, 1.6, 3.2], bf_kernel=7, bf_sigma_r=0.02, bf_gain_init=0.0, epochs=16, cosine_lr=True, lr=0.005, max_train_s=1080, batch_size=4, train_n=200, val_n=200, display_min=0.0, display_max=0.05, seed=45, rationale=iter-20 param_efficient breast -- SEED REPLICATE 3/4 of the CHAMPION (LPD-combine W=4, filtered-DC K=30, 183 params). SIX-BOX: (1) PRIOR: architecture search COMPLETE; champion = iter-15 (seed 42) hr 0.5047 @ 183p. Adjoint/config capped ~0.26; filtered-DC broke it (0.4345 @ 13p); prox capacity fought it (0.0); LPD learned-combination WON (0.5047); W=8 and sinogram-dual both regressed -> W=4 primal-only is the optimum. (2) FAILURE MODE: single-seed hr is noise-confounded (breast seed variance is large, ~+-0.05 per the DL-tier solvers) -- need mean+-std. (3) ONE KNOB: seed 42 -> 45 (replicate 3/4). ALL else byte-for-byte the champion. (4) HYPOTHESIS: hr lands near 0.5047 +- seed noise; the 5-seed (42-46) mean+-std is the REPORTED headline number @ 183 params. (5) BUDGET: identical to iter-15 (16ep in ~1020s), max_train_s=1080, --time=00:30:00, 200-val -> 20-min comparable. (6) SERIAL; next replicate self-dispatches; recon_raw.npz (pred/truth/baseline) saved to the iter dir for test-scorability., dc_mode=filtered, per_step_alpha=True, lpd_on=True, lpd_width=4, lpd_kernel=3, anisotropic_on_top=False", "comparison_image": "runs/breast-ct-claude-agentic-param-efficient-search-20260703-01/iterations/iter-0020/comparison.png"}
