{"ts": "2026-07-06T22:08:22Z", "run_id": "breast-ct-claude-agentic-fastdiff-flow-pixel-constrained-search-20260703-01", "iter": 13, "agent": "fastdiff_flow_pixel_constrained-claude-agentic", "model": "claude-opus-4-8-1m", "change_class": "architecture", "status": "keep", "kept": true, "val_score": 0.9263087511062622, "headroom": 0.24395260444011657, "params_M": 3.822787, "train_n": 400, "rationale": "fastdiff_flow_pixel_constrained-claude-agentic: image_size=512, pixel_spacing=0.3516, n_angles=128, n_det=1024, det_spacing=0.35754, sod=500.0, sdd=1000.0, display_min=0.0, display_max=0.5, train_n=400, val_n=200, noise_i0=100000.0, noise_sigma_e=10.0, seed=42, dataset_kind=breast_ct, fd_recon_ckpt=/cluster/maier/Agent4CT/checkpoints/fast_diffusion_pixel_breast.pt, fd_recon_steps=8, fd_recon_init=fbp, fd_recon_init_t=0.005, fd_recon_eta=1.0, fd_recon_dc=1, fd_recon_dc_n_cg=30, fd_recon_dc_relax=1.0, rationale=iter-13 EXPLORATORY single knob init_t 0.01->0.005 at the peak n_cg30. SIX-BOX: (1)PRIOR: TWO levers now locked. n_cg: peak at 30 (iter-12 n_cg45 CRASHED to rmse0.01038/hr0 - the DC semi-convergence peak does NOT shift right at low init_t; over-converging CG amplifies MEASUREMENT noise regardless). init_t: near-plateau 0.02->0.01 gave hr0.3531->0.3605. Best=iter-11 (init_t0.01,n_cg30,rlx1.0,hr0.3605). (2)FAILURE: init_t0.01 may not be the exact plateau bottom. (3)ONE KNOB: init_t 0.01->0.005. (4)HYPOTHESIS: even less prior embed edges hr above 0.3605 or confirms the init_t plateau (~0.36 is the near-pure-DC ceiling for n_cg30). (5)BUDGET: n_cg30 ~5.5min. (6)Serial.", "advice_for_others": "fastdiff_flow_pixel_constrained-claude-agentic: image_size=512, pixel_spacing=0.3516, n_angles=128, n_det=1024, det_spacing=0.35754, sod=500.0, sdd=1000.0, display_min=0.0, display_max=0.5, train_n=400, val_n=200, noise_i0=100000.0, noise_sigma_e=10.0, seed=42, dataset_kind=breast_ct, fd_recon_ckpt=/cluster/maier/Agent4CT/checkpoints/fast_diffusion_pixel_breast.pt, fd_recon_steps=8, fd_recon_init=fbp, fd_recon_init_t=0.005, fd_recon_eta=1.0, fd_recon_dc=1, fd_recon_dc_n_cg=30, fd_recon_dc_relax=1.0, rationale=iter-13 EXPLORATORY single knob init_t 0.01->0.005 at the peak n_cg30. SIX-BOX: (1)PRIOR: TWO levers now locked. n_cg: peak at 30 (iter-12 n_cg45 CRASHED to rmse0.01038/hr0 - the DC semi-convergence peak does NOT shift right at low init_t; over-converging CG amplifies MEASUREMENT noise regardless). init_t: near-plateau 0.02->0.01 gave hr0.3531->0.3605. Best=iter-11 (init_t0.01,n_cg30,rlx1.0,hr0.3605). (2)FAILURE: init_t0.01 may not be the exact plateau bottom. (3)ONE KNOB: init_t 0.01->0.005. (4)HYPOTHESIS: even less prior embed edges hr above 0.3605 or confirms the init_t plateau (~0.36 is the near-pure-DC ceiling for n_cg30). (5)BUDGET: n_cg30 ~5.5min. (6)Serial.", "comparison_image": "runs/breast-ct-claude-agentic-fastdiff-flow-pixel-constrained-search-20260703-01/iterations/iter-0013/comparison.png"}
{"ts": "2026-07-06T22:05:18Z", "run_id": "breast-ct-claude-agentic-fastdiff-wdm-wavelet-constrained-search-20260703-01", "iter": 17, "agent": "fastdiff_wdm_wavelet_constrained-claude-agentic", "model": "claude-opus-4-8-1m", "change_class": "architecture", "status": "keep", "kept": true, "val_score": 0.9290040135383606, "headroom": 0.26579927161105843, "params_M": 3.824908, "train_n": 3600, "rationale": "fastdiff_wdm_wavelet_constrained-claude-agentic: val_n=200, seed=42, fd_recon_ckpt=/cluster/maier/Agent4CT/checkpoints/fast_diffusion_wavelet_breast.pt, fd_recon_steps=5, fd_recon_init=fbp, fd_recon_init_t=0.005, fd_recon_eta=1.0, fd_recon_dc=1, fd_recon_dc_n_cg=18, fd_recon_dc_relax=1.0, dataset_kind=breast_ct, rationale=iter-17 NFE bracket (steps=5) around the steps=4 peak, breast-native wavelet CONSTRAINED, val=200. SIX-BOX: (1) PRIOR: steps sweep @n_cg18/init_t0.005: 2->hr0.002, 4->0.1304(BEST), 8->0.0768, 16->0. SHARP interior peak at steps=4 (drops steeply either side). (2) FAILURE MODE: steps<4 under-apply the interleaved CG-DC re-embed schedule; steps>4 accumulate re-embed+prior drift. (3) ONE KNOB: fd_recon_steps 4 -> 5 (bracket the peak from above). (4) HYPOTHESIS: steps=5 lands between 0.1304(steps4) and 0.0768(steps8); if >0.1304 peak is 5, else confirm steps=4. (5) BUDGET ~2min. (6) iter-18 on landing (will try steps=3 to bracket below).", "advice_for_others": "fastdiff_wdm_wavelet_constrained-claude-agentic: val_n=200, seed=42, fd_recon_ckpt=/cluster/maier/Agent4CT/checkpoints/fast_diffusion_wavelet_breast.pt, fd_recon_steps=5, fd_recon_init=fbp, fd_recon_init_t=0.005, fd_recon_eta=1.0, fd_recon_dc=1, fd_recon_dc_n_cg=18, fd_recon_dc_relax=1.0, dataset_kind=breast_ct, rationale=iter-17 NFE bracket (steps=5) around the steps=4 peak, breast-native wavelet CONSTRAINED, val=200. SIX-BOX: (1) PRIOR: steps sweep @n_cg18/init_t0.005: 2->hr0.002, 4->0.1304(BEST), 8->0.0768, 16->0. SHARP interior peak at steps=4 (drops steeply either side). (2) FAILURE MODE: steps<4 under-apply the interleaved CG-DC re-embed schedule; steps>4 accumulate re-embed+prior drift. (3) ONE KNOB: fd_recon_steps 4 -> 5 (bracket the peak from above). (4) HYPOTHESIS: steps=5 lands between 0.1304(steps4) and 0.0768(steps8); if >0.1304 peak is 5, else confirm steps=4. (5) BUDGET ~2min. (6) iter-18 on landing (will try steps=3 to bracket below).", "comparison_image": "runs/breast-ct-claude-agentic-fastdiff-wdm-wavelet-constrained-search-20260703-01/iterations/iter-0017/comparison.png"}
{"ts": "2026-07-06T22:02:15Z", "run_id": "breast-ct-claude-agentic-fastdiff-wdm-wavelet-constrained-search-20260703-01", "iter": 16, "agent": "fastdiff_wdm_wavelet_constrained-claude-agentic", "model": "claude-opus-4-8-1m", "change_class": "architecture", "status": "keep", "kept": true, "val_score": 0.8859085440635681, "headroom": 0.0021869886455021526, "params_M": 3.824908, "train_n": 3600, "rationale": "fastdiff_wdm_wavelet_constrained-claude-agentic: val_n=200, seed=42, fd_recon_ckpt=/cluster/maier/Agent4CT/checkpoints/fast_diffusion_wavelet_breast.pt, fd_recon_steps=2, fd_recon_init=fbp, fd_recon_init_t=0.005, fd_recon_eta=1.0, fd_recon_dc=1, fd_recon_dc_n_cg=18, fd_recon_dc_relax=1.0, dataset_kind=breast_ct, rationale=iter-16 NFE (steps=2) lever, breast-native wavelet CONSTRAINED, val=200. SIX-BOX: (1) PRIOR: steps sweep @n_cg18/init_t0.005: 16->hr0, 8->0.0768, 4->0.1304(BEST). STRONGLY monotonic: fewer steps = far better (each Euler step re-embeds noise + net-harmful prior -> accumulated drift). (2) FAILURE MODE: prior + deterministic re-embed noise accumulate over steps. (3) ONE KNOB: fd_recon_steps 4 -> 2 (minimal Euler/re-embed count). (4) HYPOTHESIS: steps=2 continues the trend -> hr>0.1304 (recon approaches embed-once + strong CG-DC, minimal prior damage). FALSIFIER: if hr drops vs steps4, 2 steps under-apply the interleaved DC schedule -> 4 is optimal; then try steps=3 / steps=1. (5) BUDGET ~1min. (6) iter-17 on landing.", "advice_for_others": "fastdiff_wdm_wavelet_constrained-claude-agentic: val_n=200, seed=42, fd_recon_ckpt=/cluster/maier/Agent4CT/checkpoints/fast_diffusion_wavelet_breast.pt, fd_recon_steps=2, fd_recon_init=fbp, fd_recon_init_t=0.005, fd_recon_eta=1.0, fd_recon_dc=1, fd_recon_dc_n_cg=18, fd_recon_dc_relax=1.0, dataset_kind=breast_ct, rationale=iter-16 NFE (steps=2) lever, breast-native wavelet CONSTRAINED, val=200. SIX-BOX: (1) PRIOR: steps sweep @n_cg18/init_t0.005: 16->hr0, 8->0.0768, 4->0.1304(BEST). STRONGLY monotonic: fewer steps = far better (each Euler step re-embeds noise + net-harmful prior -> accumulated drift). (2) FAILURE MODE: prior + deterministic re-embed noise accumulate over steps. (3) ONE KNOB: fd_recon_steps 4 -> 2 (minimal Euler/re-embed count). (4) HYPOTHESIS: steps=2 continues the trend -> hr>0.1304 (recon approaches embed-once + strong CG-DC, minimal prior damage). FALSIFIER: if hr drops vs steps4, 2 steps under-apply the interleaved DC schedule -> 4 is optimal; then try steps=3 / steps=1. (5) BUDGET ~1min. (6) iter-17 on landing.", "comparison_image": "runs/breast-ct-claude-agentic-fastdiff-wdm-wavelet-constrained-search-20260703-01/iterations/iter-0016/comparison.png"}
{"ts": "2026-07-06T22:02:07Z", "run_id": "breast-ct-claude-agentic-fastdiff-flow-pixel-constrained-search-20260703-01", "iter": 12, "agent": "fastdiff_flow_pixel_constrained-claude-agentic", "model": "claude-opus-4-8-1m", "change_class": "architecture", "status": "discard", "kept": false, "val_score": 0.7203750610351562, "headroom": 0.0, "params_M": 3.822787, "train_n": 400, "rationale": "fastdiff_flow_pixel_constrained-claude-agentic: image_size=512, pixel_spacing=0.3516, n_angles=128, n_det=1024, det_spacing=0.35754, sod=500.0, sdd=1000.0, display_min=0.0, display_max=0.5, train_n=400, val_n=200, noise_i0=100000.0, noise_sigma_e=10.0, seed=42, dataset_kind=breast_ct, fd_recon_ckpt=/cluster/maier/Agent4CT/checkpoints/fast_diffusion_pixel_breast.pt, fd_recon_steps=8, fd_recon_init=fbp, fd_recon_init_t=0.01, fd_recon_eta=1.0, fd_recon_dc=1, fd_recon_dc_n_cg=45, fd_recon_dc_relax=1.0, rationale=iter-12 RE-MAP n_cg at the winning low init_t: n_cg 30->45 (init_t0.01, the hr0.3605 best). SIX-BOX: (1)PRIOR: init_t is near-plateaued (0.05->0.02->0.01: hr 0.0557->0.3531->0.3605). At init_t~0.01 the recon is near-pure FBP+deep-CG-DC (light prior). Earlier the n_cg semi-convergence peak sat at 30 (measured at init_t0.05 where prior-noise amplified past 30). (2)FAILURE: at high init_t the CG over-converged past n_cg30 because it amplified PRIOR-injected noise; at init_t0.01 that prior-noise is minimal, so the peak may shift RIGHT - more CG could keep helping. (3)ONE KNOB: dc_n_cg 30->45 at init_t0.01. (4)HYPOTHESIS: with minimal prior-noise, n_cg45 drives the data-consistent LS solution further, lowering rmse below 0.003335 and lifting hr above 0.3605; re-maps the argmax n_cg at the winning init_t. (5)BUDGET: 45 CG ~ iter-8 x1.1 (~8min), inside 20-min. (6)Serial.", "advice_for_others": "fastdiff_flow_pixel_constrained-claude-agentic: image_size=512, pixel_spacing=0.3516, n_angles=128, n_det=1024, det_spacing=0.35754, sod=500.0, sdd=1000.0, display_min=0.0, display_max=0.5, train_n=400, val_n=200, noise_i0=100000.0, noise_sigma_e=10.0, seed=42, dataset_kind=breast_ct, fd_recon_ckpt=/cluster/maier/Agent4CT/checkpoints/fast_diffusion_pixel_breast.pt, fd_recon_steps=8, fd_recon_init=fbp, fd_recon_init_t=0.01, fd_recon_eta=1.0, fd_recon_dc=1, fd_recon_dc_n_cg=45, fd_recon_dc_relax=1.0, rationale=iter-12 RE-MAP n_cg at the winning low init_t: n_cg 30->45 (init_t0.01, the hr0.3605 best). SIX-BOX: (1)PRIOR: init_t is near-plateaued (0.05->0.02->0.01: hr 0.0557->0.3531->0.3605). At init_t~0.01 the recon is near-pure FBP+deep-CG-DC (light prior). Earlier the n_cg semi-convergence peak sat at 30 (measured at init_t0.05 where prior-noise amplified past 30). (2)FAILURE: at high init_t the CG over-converged past n_cg30 because it amplified PRIOR-injected noise; at init_t0.01 that prior-noise is minimal, so the peak may shift RIGHT - more CG could keep helping. (3)ONE KNOB: dc_n_cg 30->45 at init_t0.01. (4)HYPOTHESIS: with minimal prior-noise, n_cg45 drives the data-consistent LS solution further, lowering rmse below 0.003335 and lifting hr above 0.3605; re-maps the argmax n_cg at the winning init_t. (5)BUDGET: 45 CG ~ iter-8 x1.1 (~8min), inside 20-min. (6)Serial.", "comparison_image": "runs/breast-ct-claude-agentic-fastdiff-flow-pixel-constrained-search-20260703-01/iterations/iter-0012/comparison.png"}
{"ts": "2026-07-06T22:00:18Z", "run_id": "breast-ct-claude-agentic-fastdiff-wdm-wavelet-constrained-search-20260703-01", "iter": 15, "agent": "fastdiff_wdm_wavelet_constrained-claude-agentic", "model": "claude-opus-4-8-1m", "change_class": "architecture", "status": "keep", "kept": true, "val_score": 0.9038277864456177, "headroom": 0.13044781336410904, "params_M": 3.824908, "train_n": 3600, "rationale": "fastdiff_wdm_wavelet_constrained-claude-agentic: val_n=200, seed=42, fd_recon_ckpt=/cluster/maier/Agent4CT/checkpoints/fast_diffusion_wavelet_breast.pt, fd_recon_steps=4, fd_recon_init=fbp, fd_recon_init_t=0.005, fd_recon_eta=1.0, fd_recon_dc=1, fd_recon_dc_n_cg=18, fd_recon_dc_relax=1.0, dataset_kind=breast_ct, rationale=iter-15 NFE (fewer steps) lever, breast-native wavelet CONSTRAINED, val=200. SIX-BOX: (1) PRIOR: steps16 (iter-14) DROPPED to hr0 (RMSE5.82e-3) vs steps8 hr0.0768 -- more Euler steps HURT (each step re-embeds noise + evaluates the near-off prior -> accumulated drift). (2) FAILURE MODE: extra steps compound the deterministic re-embed noise injection and prior drift. Direction: fewer steps. (3) ONE KNOB: fd_recon_steps 8 -> 4 (halve the Euler/DC re-embed count), n_cg18/init_t0.005 fixed. (4) HYPOTHESIS: fewer steps = less accumulated re-embed drift while the strong CG-DC (n_cg18) still pins the data -> RMSE <= steps8 (hr>=0.0768). If flat/slightly worse, steps=8 is optimal. FALSIFIER: if hr drops, too few DC applications under-constrain -> 8 is the sweet spot. (5) BUDGET ~1.5min. (6) iter-16 on landing.", "advice_for_others": "fastdiff_wdm_wavelet_constrained-claude-agentic: val_n=200, seed=42, fd_recon_ckpt=/cluster/maier/Agent4CT/checkpoints/fast_diffusion_wavelet_breast.pt, fd_recon_steps=4, fd_recon_init=fbp, fd_recon_init_t=0.005, fd_recon_eta=1.0, fd_recon_dc=1, fd_recon_dc_n_cg=18, fd_recon_dc_relax=1.0, dataset_kind=breast_ct, rationale=iter-15 NFE (fewer steps) lever, breast-native wavelet CONSTRAINED, val=200. SIX-BOX: (1) PRIOR: steps16 (iter-14) DROPPED to hr0 (RMSE5.82e-3) vs steps8 hr0.0768 -- more Euler steps HURT (each step re-embeds noise + evaluates the near-off prior -> accumulated drift). (2) FAILURE MODE: extra steps compound the deterministic re-embed noise injection and prior drift. Direction: fewer steps. (3) ONE KNOB: fd_recon_steps 8 -> 4 (halve the Euler/DC re-embed count), n_cg18/init_t0.005 fixed. (4) HYPOTHESIS: fewer steps = less accumulated re-embed drift while the strong CG-DC (n_cg18) still pins the data -> RMSE <= steps8 (hr>=0.0768). If flat/slightly worse, steps=8 is optimal. FALSIFIER: if hr drops, too few DC applications under-constrain -> 8 is the sweet spot. (5) BUDGET ~1.5min. (6) iter-16 on landing.", "comparison_image": "runs/breast-ct-claude-agentic-fastdiff-wdm-wavelet-constrained-search-20260703-01/iterations/iter-0015/comparison.png"}
{"ts": "2026-07-06T21:57:35Z", "run_id": "breast-ct-claude-agentic-fastdiff-wdm-wavelet-constrained-search-20260703-01", "iter": 14, "agent": "fastdiff_wdm_wavelet_constrained-claude-agentic", "model": "claude-opus-4-8-1m", "change_class": "architecture", "status": "discard", "kept": false, "val_score": 0.8266743421554565, "headroom": 0.0, "params_M": 3.824908, "train_n": 3600, "rationale": "fastdiff_wdm_wavelet_constrained-claude-agentic: val_n=200, seed=42, fd_recon_ckpt=/cluster/maier/Agent4CT/checkpoints/fast_diffusion_wavelet_breast.pt, fd_recon_steps=16, fd_recon_init=fbp, fd_recon_init_t=0.005, fd_recon_eta=1.0, fd_recon_dc=1, fd_recon_dc_n_cg=18, fd_recon_dc_relax=1.0, dataset_kind=breast_ct, rationale=iter-14 NFE (steps) lever, breast-native wavelet CONSTRAINED, val=200. SIX-BOX: (1) PRIOR: n_cg plateau found at init_t0.005: n_cg18->hr0.0768(BEST), 20->0.0760, 15->0.0695, 25->0.043. Prior near-off at init_t0.005; the CG-DC is doing the work (DC runs once per Euler step). (2) FAILURE MODE: at steps=8 the recon may still benefit from more interleaved DC re-projections; OR fewer steps suffice (prior off). (3) ONE KNOB: fd_recon_steps 8 -> 16 (double the Euler steps = double the CG-DC re-projections + prior evals). (4) HYPOTHESIS: more steps = more DC applications interleaved -> slightly lower RMSE (hr>0.0768); if flat, DC has converged at 8 steps and steps is neutral -> revert to 8 (cheaper) and try dc_relax. FALSIFIER: if hr drops, the extra near-off-prior Euler steps add drift -> fewer steps better. (5) BUDGET: 16 steps x n_cg18 ~2x cost ~6min, inside 20min. (6) iter-15 on landing.", "advice_for_others": "fastdiff_wdm_wavelet_constrained-claude-agentic: val_n=200, seed=42, fd_recon_ckpt=/cluster/maier/Agent4CT/checkpoints/fast_diffusion_wavelet_breast.pt, fd_recon_steps=16, fd_recon_init=fbp, fd_recon_init_t=0.005, fd_recon_eta=1.0, fd_recon_dc=1, fd_recon_dc_n_cg=18, fd_recon_dc_relax=1.0, dataset_kind=breast_ct, rationale=iter-14 NFE (steps) lever, breast-native wavelet CONSTRAINED, val=200. SIX-BOX: (1) PRIOR: n_cg plateau found at init_t0.005: n_cg18->hr0.0768(BEST), 20->0.0760, 15->0.0695, 25->0.043. Prior near-off at init_t0.005; the CG-DC is doing the work (DC runs once per Euler step). (2) FAILURE MODE: at steps=8 the recon may still benefit from more interleaved DC re-projections; OR fewer steps suffice (prior off). (3) ONE KNOB: fd_recon_steps 8 -> 16 (double the Euler steps = double the CG-DC re-projections + prior evals). (4) HYPOTHESIS: more steps = more DC applications interleaved -> slightly lower RMSE (hr>0.0768); if flat, DC has converged at 8 steps and steps is neutral -> revert to 8 (cheaper) and try dc_relax. FALSIFIER: if hr drops, the extra near-off-prior Euler steps add drift -> fewer steps better. (5) BUDGET: 16 steps x n_cg18 ~2x cost ~6min, inside 20min. (6) iter-15 on landing.", "comparison_image": "runs/breast-ct-claude-agentic-fastdiff-wdm-wavelet-constrained-search-20260703-01/iterations/iter-0014/comparison.png"}
{"ts": "2026-07-06T21:55:01Z", "run_id": "breast-ct-claude-agentic-fastdiff-flow-pixel-constrained-search-20260703-01", "iter": 11, "agent": "fastdiff_flow_pixel_constrained-claude-agentic", "model": "claude-opus-4-8-1m", "change_class": "architecture", "status": "keep", "kept": true, "val_score": 0.9502614140510559, "headroom": 0.3604654537686639, "params_M": 3.822787, "train_n": 400, "rationale": "fastdiff_flow_pixel_constrained-claude-agentic: image_size=512, pixel_spacing=0.3516, n_angles=128, n_det=1024, det_spacing=0.35754, sod=500.0, sdd=1000.0, display_min=0.0, display_max=0.5, train_n=400, val_n=200, noise_i0=100000.0, noise_sigma_e=10.0, seed=42, dataset_kind=breast_ct, fd_recon_ckpt=/cluster/maier/Agent4CT/checkpoints/fast_diffusion_pixel_breast.pt, fd_recon_steps=8, fd_recon_init=fbp, fd_recon_init_t=0.01, fd_recon_eta=1.0, fd_recon_dc=1, fd_recon_dc_n_cg=30, fd_recon_dc_relax=1.0, rationale=iter-11 EXPLORATORY single knob init_t 0.02->0.01 continuing the WINNING direction (n_cg30,relax1.0). SIX-BOX: (1)PRIOR: BIG JUMP - init_t 0.05->0.02 leaped hr 0.0557->0.3531 (rmse0.004924->0.003373, psnr36.82->40.11, ssim0.902->0.953). Less prior perturbation lets the deep CG DC dominate and clear the FBP baseline by a wide margin. init_t is the dominant lever AT the peak n_cg. (2)FAILURE: init_t0.02 may still embed a little prior-noise; lower could be better. (3)ONE KNOB: init_t 0.02->0.01. (4)HYPOTHESIS: pushing init_t toward 0 further reduces prior perturbation, letting the DC-CG solution get even cleaner; hr should rise above 0.3531 or plateau (marking the near-pure-DC limit). (5)BUDGET: n_cg30 ~5.5min. (6)Serial.", "advice_for_others": "fastdiff_flow_pixel_constrained-claude-agentic: image_size=512, pixel_spacing=0.3516, n_angles=128, n_det=1024, det_spacing=0.35754, sod=500.0, sdd=1000.0, display_min=0.0, display_max=0.5, train_n=400, val_n=200, noise_i0=100000.0, noise_sigma_e=10.0, seed=42, dataset_kind=breast_ct, fd_recon_ckpt=/cluster/maier/Agent4CT/checkpoints/fast_diffusion_pixel_breast.pt, fd_recon_steps=8, fd_recon_init=fbp, fd_recon_init_t=0.01, fd_recon_eta=1.0, fd_recon_dc=1, fd_recon_dc_n_cg=30, fd_recon_dc_relax=1.0, rationale=iter-11 EXPLORATORY single knob init_t 0.02->0.01 continuing the WINNING direction (n_cg30,relax1.0). SIX-BOX: (1)PRIOR: BIG JUMP - init_t 0.05->0.02 leaped hr 0.0557->0.3531 (rmse0.004924->0.003373, psnr36.82->40.11, ssim0.902->0.953). Less prior perturbation lets the deep CG DC dominate and clear the FBP baseline by a wide margin. init_t is the dominant lever AT the peak n_cg. (2)FAILURE: init_t0.02 may still embed a little prior-noise; lower could be better. (3)ONE KNOB: init_t 0.02->0.01. (4)HYPOTHESIS: pushing init_t toward 0 further reduces prior perturbation, letting the DC-CG solution get even cleaner; hr should rise above 0.3531 or plateau (marking the near-pure-DC limit). (5)BUDGET: n_cg30 ~5.5min. (6)Serial.", "comparison_image": "runs/breast-ct-claude-agentic-fastdiff-flow-pixel-constrained-search-20260703-01/iterations/iter-0011/comparison.png"}
