{"ts": "2026-07-06T11:28:23Z", "run_id": "breast-ct-claude-agentic-dual-domain-n2i-search-20260703-01", "iter": 19, "agent": "dual_domain_n2i-claude-agentic", "model": "claude-opus-4-8-1m", "change_class": "architecture", "status": "discard", "kept": false, "val_score": 0.9449787139892578, "headroom": 0.0, "params_M": 0.465762, "train_n": 400, "rationale": "dual_domain_n2i-claude-agentic: warm_start=True, pretrain_epochs=3, pretrain_steps=0, n_iter=25, grad_clip=1.0, outer_wall_s=1400, per_scene_s=None, batch_size=1, lr=0.0003, optimizer=adam, unet_c=16, train_n=400, val_n=200, seed=42, rationale=iter-19 SIX-BOX. (1) PRIOR: iter-18 hr=0.0, warm_start OFF at matched n_iter=50 gave rmse=0.00659 (WORST) -- vs iter-6's warm-started 0.00628 at the SAME n_iter, confirming the warm-start provides a materially better init (from-scratch 50 steps is under-fit). Iters 1-18 all hr=0. NOTE: verified the solver HARDCODES torch.optim.Adam (the `optimizer` cfg key is a no-op), so I do NOT test optimizer as it would be a fake lever. (2) FAILURE MODE: plain-UNet N2I at the over-smoothed FBP-consistent plateau; no edge-preserving structural guard (bilateral sibling range kernel hr~0.21). (3) ONE KNOB: relative to iter-6 best reference (warm_start=True, lr=3e-4, c=16), n_iter 50 -> 25 (extreme early-stop, below all prior 50/100/200/400). Extends the inner-step sweep to its minimal end: freeze the recon almost AT the warm-start init. (4) HYPOTHESIS: with only 25 per-image steps the recon stays closest to the warm-started init; if the warm-start init is the least-over-smoothed point and per-image steps only push toward the smooth mean, 25 steps should give the LOWEST rmse of the n_iter sweep. If it dips toward baseline, minimal-step early-stop is the lever. Per the ceiling, expect hr=0 -- the warm-start init is itself over-smoothed, so freezing near it just yields a blurry recon (rmse ~0.0063). (5) BUDGET: 25 steps/scene very fast; pretrain ep=3 + 200*25-step fits + figure ~= 8 min << 30-min wall. (6) Loop continues; iter-20 (FINAL) self-dispatched. Reserved final lever: per_scene_s explicit to guarantee full deep-fit completion, OR a confirmatory replicate of the best config.", "advice_for_others": "dual_domain_n2i-claude-agentic: warm_start=True, pretrain_epochs=3, pretrain_steps=0, n_iter=25, grad_clip=1.0, outer_wall_s=1400, per_scene_s=None, batch_size=1, lr=0.0003, optimizer=adam, unet_c=16, train_n=400, val_n=200, seed=42, rationale=iter-19 SIX-BOX. (1) PRIOR: iter-18 hr=0.0, warm_start OFF at matched n_iter=50 gave rmse=0.00659 (WORST) -- vs iter-6's warm-started 0.00628 at the SAME n_iter, confirming the warm-start provides a materially better init (from-scratch 50 steps is under-fit). Iters 1-18 all hr=0. NOTE: verified the solver HARDCODES torch.optim.Adam (the `optimizer` cfg key is a no-op), so I do NOT test optimizer as it would be a fake lever. (2) FAILURE MODE: plain-UNet N2I at the over-smoothed FBP-consistent plateau; no edge-preserving structural guard (bilateral sibling range kernel hr~0.21). (3) ONE KNOB: relative to iter-6 best reference (warm_start=True, lr=3e-4, c=16), n_iter 50 -> 25 (extreme early-stop, below all prior 50/100/200/400). Extends the inner-step sweep to its minimal end: freeze the recon almost AT the warm-start init. (4) HYPOTHESIS: with only 25 per-image steps the recon stays closest to the warm-started init; if the warm-start init is the least-over-smoothed point and per-image steps only push toward the smooth mean, 25 steps should give the LOWEST rmse of the n_iter sweep. If it dips toward baseline, minimal-step early-stop is the lever. Per the ceiling, expect hr=0 -- the warm-start init is itself over-smoothed, so freezing near it just yields a blurry recon (rmse ~0.0063). (5) BUDGET: 25 steps/scene very fast; pretrain ep=3 + 200*25-step fits + figure ~= 8 min << 30-min wall. (6) Loop continues; iter-20 (FINAL) self-dispatched. Reserved final lever: per_scene_s explicit to guarantee full deep-fit completion, OR a confirmatory replicate of the best config.", "comparison_image": "runs/breast-ct-claude-agentic-dual-domain-n2i-search-20260703-01/iterations/iter-0019/comparison.png"}
{"ts": "2026-07-06T10:45:51Z", "run_id": "breast-ct-claude-agentic-dual-domain-n2i-search-20260703-01", "iter": 18, "agent": "dual_domain_n2i-claude-agentic", "model": "claude-opus-4-8-1m", "change_class": "architecture", "status": "discard", "kept": false, "val_score": 0.9279898405075073, "headroom": 0.0, "params_M": 0.465762, "train_n": 400, "rationale": "dual_domain_n2i-claude-agentic: warm_start=False, pretrain_epochs=3, pretrain_steps=0, n_iter=50, grad_clip=1.0, outer_wall_s=1400, per_scene_s=None, batch_size=1, lr=0.0003, optimizer=adam, unet_c=16, train_n=400, val_n=200, seed=42, rationale=iter-18 SIX-BOX. (1) PRIOR: iter-17 hr=0.0, pretrain_steps=100 cap gave rmse=0.00652 -- a truncated warm-start lands the per-image fits at the same plateau; warm-start convergence is not a lever. Iters 1-17 all hr=0. (2) FAILURE MODE: plain-UNet N2I at the over-smoothed FBP-consistent plateau; no edge-preserving structural guard (bilateral sibling range kernel hr~0.21). (3) ONE KNOB: relative to iter-6 best reference (warm_start=True, n_iter=50, lr=3e-4, c=16), warm_start True -> False, keeping n_iter=50 fixed. iter-4 tested warm_start off but CONFOUNDED it with n_iter=300; this cleanly ISOLATES the warm_start effect at the best-config n_iter=50 (each val scan optimized from a FRESH random init, no amortised pre-pass, no train split loaded). (4) HYPOTHESIS: a from-scratch 50-step per-image fit (random init) may retain different high-frequency content than a warm-started fit; comparing rmse to iter-6's warm-started 0.00628 at MATCHED n_iter isolates whether the warm-start helps, hurts, or is neutral. Per the ceiling, expect hr=0 -- 50 steps from random init is too few to beat the FBP target, likely rmse >= warm-started (warm-start at least provides a sane init). (5) BUDGET: no warm-start (saves ~130s) + 200*50-step fast fits + figure ~= 9 min << 30-min wall. (6) Loop continues; iter-19 self-dispatched. Reserved levers: warm_start off + n_iter=400 (pure per-image max steps), per_scene_s explicit=10 (guarantee full n_iter completes).", "advice_for_others": "dual_domain_n2i-claude-agentic: warm_start=False, pretrain_epochs=3, pretrain_steps=0, n_iter=50, grad_clip=1.0, outer_wall_s=1400, per_scene_s=None, batch_size=1, lr=0.0003, optimizer=adam, unet_c=16, train_n=400, val_n=200, seed=42, rationale=iter-18 SIX-BOX. (1) PRIOR: iter-17 hr=0.0, pretrain_steps=100 cap gave rmse=0.00652 -- a truncated warm-start lands the per-image fits at the same plateau; warm-start convergence is not a lever. Iters 1-17 all hr=0. (2) FAILURE MODE: plain-UNet N2I at the over-smoothed FBP-consistent plateau; no edge-preserving structural guard (bilateral sibling range kernel hr~0.21). (3) ONE KNOB: relative to iter-6 best reference (warm_start=True, n_iter=50, lr=3e-4, c=16), warm_start True -> False, keeping n_iter=50 fixed. iter-4 tested warm_start off but CONFOUNDED it with n_iter=300; this cleanly ISOLATES the warm_start effect at the best-config n_iter=50 (each val scan optimized from a FRESH random init, no amortised pre-pass, no train split loaded). (4) HYPOTHESIS: a from-scratch 50-step per-image fit (random init) may retain different high-frequency content than a warm-started fit; comparing rmse to iter-6's warm-started 0.00628 at MATCHED n_iter isolates whether the warm-start helps, hurts, or is neutral. Per the ceiling, expect hr=0 -- 50 steps from random init is too few to beat the FBP target, likely rmse >= warm-started (warm-start at least provides a sane init). (5) BUDGET: no warm-start (saves ~130s) + 200*50-step fast fits + figure ~= 9 min << 30-min wall. (6) Loop continues; iter-19 self-dispatched. Reserved levers: warm_start off + n_iter=400 (pure per-image max steps), per_scene_s explicit=10 (guarantee full n_iter completes).", "comparison_image": "runs/breast-ct-claude-agentic-dual-domain-n2i-search-20260703-01/iterations/iter-0018/comparison.png"}
{"ts": "2026-07-06T10:44:06Z", "run_id": "breast-ct-claude-agentic-naf-search-20260703-01", "iter": 16, "agent": "naf-claude-agentic", "model": "claude-opus-4-8-1m", "change_class": "architecture", "status": "discard", "kept": false, "val_score": 0.7782753705978394, "headroom": 0.0, "params_M": 16.783553, "train_n": 0, "rationale": "naf-claude-agentic: val_n=12, naf_n_freqs=8, naf_hidden=64, naf_layers=3, naf_n_iter=8000, naf_lr=0.05, naf_tv_weight=0.0001, naf_n_clip=0.05, naf_outer_wall_s=800, naf_per_scene_s=60.0, naf_encoding=hash, seed=42, rationale=iter-16 breast-ct-claude-agentic-naf-search-20260703-01 (redone breast split train3600/val200/test200 seed20260703; val_n=12 CONSTANT for iters 2-20 per coordinator budget intervention 2026-07-05 -- first-12 of the 200-case breast val split, deterministic). SIX-BOX: (1) prior result: all iters so far hr=0 (iter-1 val_n=20 ssim0.355 PSNR6.26 in 970s, NOT a timeout -- a genuine converged fit). (2) failure mode: NAF per-scene INR recon is far below the 128-view breast LD-FBP baseline. (3) ONE knob changed: hash + lr 1e-2->5e-2. (4) hypothesis: KNOB: higher lr for the hash tables (Instant-NGP trains tables at high lr). HYPOTHESIS: hash feature tables need aggressive lr to populate in a short per-scene budget. Tests hash optimization. (5) wall: val_n=12 x per_scene 60.0s = ~720s < 20min. (6) serial, no user return.", "advice_for_others": "naf-claude-agentic: val_n=12, naf_n_freqs=8, naf_hidden=64, naf_layers=3, naf_n_iter=8000, naf_lr=0.05, naf_tv_weight=0.0001, naf_n_clip=0.05, naf_outer_wall_s=800, naf_per_scene_s=60.0, naf_encoding=hash, seed=42, rationale=iter-16 breast-ct-claude-agentic-naf-search-20260703-01 (redone breast split train3600/val200/test200 seed20260703; val_n=12 CONSTANT for iters 2-20 per coordinator budget intervention 2026-07-05 -- first-12 of the 200-case breast val split, deterministic). SIX-BOX: (1) prior result: all iters so far hr=0 (iter-1 val_n=20 ssim0.355 PSNR6.26 in 970s, NOT a timeout -- a genuine converged fit). (2) failure mode: NAF per-scene INR recon is far below the 128-view breast LD-FBP baseline. (3) ONE knob changed: hash + lr 1e-2->5e-2. (4) hypothesis: KNOB: higher lr for the hash tables (Instant-NGP trains tables at high lr). HYPOTHESIS: hash feature tables need aggressive lr to populate in a short per-scene budget. Tests hash optimization. (5) wall: val_n=12 x per_scene 60.0s = ~720s < 20min. (6) serial, no user return.", "comparison_image": "runs/breast-ct-claude-agentic-naf-search-20260703-01/iterations/iter-0016/comparison.png"}
{"ts": "2026-07-06T10:28:24Z", "run_id": "breast-ct-claude-agentic-dual-domain-n2i-search-20260703-01", "iter": 17, "agent": "dual_domain_n2i-claude-agentic", "model": "claude-opus-4-8-1m", "change_class": "architecture", "status": "discard", "kept": false, "val_score": 0.9350098967552185, "headroom": 0.0, "params_M": 0.465762, "train_n": 400, "rationale": "dual_domain_n2i-claude-agentic: warm_start=True, pretrain_epochs=3, pretrain_steps=100, n_iter=50, grad_clip=1.0, outer_wall_s=1400, per_scene_s=None, batch_size=1, lr=0.0003, optimizer=adam, unet_c=16, train_n=400, val_n=200, seed=42, rationale=iter-17 SIX-BOX. (1) PRIOR: iter-16 hr=0.0, batch_size=2 warm-start gave rmse=0.00634 -- warm-start batch statistics do not matter; still at the plateau. Iters 1-16 all hr=0, rmse tightly in 0.00623-0.00657. (2) FAILURE MODE: plain-UNet N2I at the over-smoothed FBP-consistent plateau; no edge-preserving structural guard (bilateral sibling range kernel hr~0.21). (3) ONE KNOB: relative to iter-6 best reference (n_iter=50, lr=3e-4, c=16, batch_size=1), pretrain_steps 0 -> 100 (a HARD cap on total warm-start optimizer steps -- an alternative bound to pretrain_epochs that stops the amortised pre-pass after exactly 100 steps regardless of epoch boundaries). (4) HYPOTHESIS: capping the warm-start at 100 steps yields a LESS-converged (less over-smoothed) shared init than the full 3-epoch (~1200-step) pre-pass; if a fresher init lowers rmse, warm-start CONVERGENCE (not strength/batch) is the subtle lever. Per the ceiling, expect hr=0 -- any warm-start, however truncated, lands the per-image fits at the same over-smoothed plateau. (5) BUDGET: warm-start hard-capped at 100 steps (fast, ~40s) + 200*50-step fits + figure ~= 10 min << 30-min wall. (6) Loop continues; iter-18 self-dispatched. Reserved levers: warm_start off + n_iter=400 (pure per-image, max steps), per_scene_s explicit=10, n_iter=25 aggressive early-stop.", "advice_for_others": "dual_domain_n2i-claude-agentic: warm_start=True, pretrain_epochs=3, pretrain_steps=100, n_iter=50, grad_clip=1.0, outer_wall_s=1400, per_scene_s=None, batch_size=1, lr=0.0003, optimizer=adam, unet_c=16, train_n=400, val_n=200, seed=42, rationale=iter-17 SIX-BOX. (1) PRIOR: iter-16 hr=0.0, batch_size=2 warm-start gave rmse=0.00634 -- warm-start batch statistics do not matter; still at the plateau. Iters 1-16 all hr=0, rmse tightly in 0.00623-0.00657. (2) FAILURE MODE: plain-UNet N2I at the over-smoothed FBP-consistent plateau; no edge-preserving structural guard (bilateral sibling range kernel hr~0.21). (3) ONE KNOB: relative to iter-6 best reference (n_iter=50, lr=3e-4, c=16, batch_size=1), pretrain_steps 0 -> 100 (a HARD cap on total warm-start optimizer steps -- an alternative bound to pretrain_epochs that stops the amortised pre-pass after exactly 100 steps regardless of epoch boundaries). (4) HYPOTHESIS: capping the warm-start at 100 steps yields a LESS-converged (less over-smoothed) shared init than the full 3-epoch (~1200-step) pre-pass; if a fresher init lowers rmse, warm-start CONVERGENCE (not strength/batch) is the subtle lever. Per the ceiling, expect hr=0 -- any warm-start, however truncated, lands the per-image fits at the same over-smoothed plateau. (5) BUDGET: warm-start hard-capped at 100 steps (fast, ~40s) + 200*50-step fits + figure ~= 10 min << 30-min wall. (6) Loop continues; iter-18 self-dispatched. Reserved levers: warm_start off + n_iter=400 (pure per-image, max steps), per_scene_s explicit=10, n_iter=25 aggressive early-stop.", "comparison_image": "runs/breast-ct-claude-agentic-dual-domain-n2i-search-20260703-01/iterations/iter-0017/comparison.png"}
{"ts": "2026-07-06T10:26:41Z", "run_id": "breast-ct-claude-agentic-naf-search-20260703-01", "iter": 15, "agent": "naf-claude-agentic", "model": "claude-opus-4-8-1m", "change_class": "architecture", "status": "discard", "kept": false, "val_score": 0.8168981075286865, "headroom": 0.0, "params_M": 16.798081, "train_n": 0, "rationale": "naf-claude-agentic: val_n=12, naf_n_freqs=8, naf_hidden=128, naf_layers=3, naf_n_iter=8000, naf_lr=0.01, naf_tv_weight=0.0001, naf_n_clip=0.05, naf_outer_wall_s=800, naf_per_scene_s=60.0, naf_encoding=hash, seed=42, rationale=iter-15 breast-ct-claude-agentic-naf-search-20260703-01 (redone breast split train3600/val200/test200 seed20260703; val_n=12 CONSTANT for iters 2-20 per coordinator budget intervention 2026-07-05 -- first-12 of the 200-case breast val split, deterministic). SIX-BOX: (1) prior result: all iters so far hr=0 (iter-1 val_n=20 ssim0.355 PSNR6.26 in 970s, NOT a timeout -- a genuine converged fit). (2) failure mode: NAF per-scene INR recon is far below the 128-view breast LD-FBP baseline. (3) ONE knob changed: hash + wider MLP hidden 64->128. (4) hypothesis: KNOB: widen the hash-fed MLP 64->128. HYPOTHESIS: if the hash features are rich but the small MLP is the bottleneck, widening helps decode them into mu. Tests decoder capacity for the hash path. (5) wall: val_n=12 x per_scene 60.0s = ~720s < 20min. (6) serial, no user return.", "advice_for_others": "naf-claude-agentic: val_n=12, naf_n_freqs=8, naf_hidden=128, naf_layers=3, naf_n_iter=8000, naf_lr=0.01, naf_tv_weight=0.0001, naf_n_clip=0.05, naf_outer_wall_s=800, naf_per_scene_s=60.0, naf_encoding=hash, seed=42, rationale=iter-15 breast-ct-claude-agentic-naf-search-20260703-01 (redone breast split train3600/val200/test200 seed20260703; val_n=12 CONSTANT for iters 2-20 per coordinator budget intervention 2026-07-05 -- first-12 of the 200-case breast val split, deterministic). SIX-BOX: (1) prior result: all iters so far hr=0 (iter-1 val_n=20 ssim0.355 PSNR6.26 in 970s, NOT a timeout -- a genuine converged fit). (2) failure mode: NAF per-scene INR recon is far below the 128-view breast LD-FBP baseline. (3) ONE knob changed: hash + wider MLP hidden 64->128. (4) hypothesis: KNOB: widen the hash-fed MLP 64->128. HYPOTHESIS: if the hash features are rich but the small MLP is the bottleneck, widening helps decode them into mu. Tests decoder capacity for the hash path. (5) wall: val_n=12 x per_scene 60.0s = ~720s < 20min. (6) serial, no user return.", "comparison_image": "runs/breast-ct-claude-agentic-naf-search-20260703-01/iterations/iter-0015/comparison.png"}
{"ts": "2026-07-06T09:53:43Z", "run_id": "breast-ct-claude-agentic-dual-domain-n2i-search-20260703-01", "iter": 16, "agent": "dual_domain_n2i-claude-agentic", "model": "claude-opus-4-8-1m", "change_class": "architecture", "status": "discard", "kept": false, "val_score": 0.9434933066368103, "headroom": 0.0, "params_M": 0.465762, "train_n": 400, "rationale": "dual_domain_n2i-claude-agentic: warm_start=True, pretrain_epochs=3, pretrain_steps=0, n_iter=50, grad_clip=1.0, outer_wall_s=1400, per_scene_s=None, batch_size=2, lr=0.0003, optimizer=adam, unet_c=16, train_n=400, val_n=200, seed=42, rationale=iter-16 SIX-BOX. (1) PRIOR: iter-15 hr=0.0, minimal warm-start pretrain_epochs=1 gave rmse=0.00640 -- warm-start strength (off/1/3/10 -> ~0.0065/0.0064/0.0063/0.0064) is NON-monotone noise around the plateau, not a lever. Iters 1-15 all hr=0. (2) FAILURE MODE: plain-UNet N2I at the over-smoothed FBP-consistent plateau; no edge-preserving structural guard (bilateral sibling range kernel hr~0.21). (3) ONE KNOB: relative to iter-6 best reference (n_iter=50, lr=3e-4, c=16, pretrain=3), batch_size 1 -> 2 (affects ONLY the warm-start pre-pass; the per-image fit is always batch_size=1 internally). (4) HYPOTHESIS: batch_size=2 gives a lower-variance gradient estimate for the amortised warm-start, so the shared init may be a slightly better generic starting point for the per-image fits; if rmse dips, warm-start batch statistics matter. Per the ceiling, expect hr=0 -- the warm-start converges to the same over-smoothed mean regardless of batch size, so the per-image fits inherit the same plateau. (5) BUDGET: bs=2 halves warm-start steps/epoch (faster) + 200*50-step fast fits + figure ~= 11 min << 30-min wall. (6) Loop continues; iter-17 self-dispatched. Reserved levers: pretrain_steps hard cap, warm_start off + n_iter=400, per_scene_s explicit, n_iter=25 aggressive early-stop, lr=5e-4 mid.", "advice_for_others": "dual_domain_n2i-claude-agentic: warm_start=True, pretrain_epochs=3, pretrain_steps=0, n_iter=50, grad_clip=1.0, outer_wall_s=1400, per_scene_s=None, batch_size=2, lr=0.0003, optimizer=adam, unet_c=16, train_n=400, val_n=200, seed=42, rationale=iter-16 SIX-BOX. (1) PRIOR: iter-15 hr=0.0, minimal warm-start pretrain_epochs=1 gave rmse=0.00640 -- warm-start strength (off/1/3/10 -> ~0.0065/0.0064/0.0063/0.0064) is NON-monotone noise around the plateau, not a lever. Iters 1-15 all hr=0. (2) FAILURE MODE: plain-UNet N2I at the over-smoothed FBP-consistent plateau; no edge-preserving structural guard (bilateral sibling range kernel hr~0.21). (3) ONE KNOB: relative to iter-6 best reference (n_iter=50, lr=3e-4, c=16, pretrain=3), batch_size 1 -> 2 (affects ONLY the warm-start pre-pass; the per-image fit is always batch_size=1 internally). (4) HYPOTHESIS: batch_size=2 gives a lower-variance gradient estimate for the amortised warm-start, so the shared init may be a slightly better generic starting point for the per-image fits; if rmse dips, warm-start batch statistics matter. Per the ceiling, expect hr=0 -- the warm-start converges to the same over-smoothed mean regardless of batch size, so the per-image fits inherit the same plateau. (5) BUDGET: bs=2 halves warm-start steps/epoch (faster) + 200*50-step fast fits + figure ~= 11 min << 30-min wall. (6) Loop continues; iter-17 self-dispatched. Reserved levers: pretrain_steps hard cap, warm_start off + n_iter=400, per_scene_s explicit, n_iter=25 aggressive early-stop, lr=5e-4 mid.", "comparison_image": "runs/breast-ct-claude-agentic-dual-domain-n2i-search-20260703-01/iterations/iter-0016/comparison.png"}
