{"ts": "2026-07-06T17:42:00Z", "run_id": "breast-ct-claude-agentic-param-efficient-search-20260703-01", "iter": 6, "agent": "param_efficient-claude-agentic", "model": "claude-opus-4-8-1m", "change_class": "architecture", "status": "discard", "kept": false, "val_score": 0.9483468532562256, "headroom": 0.0, "params_M": 1.3e-05, "train_n": 200, "rationale": "param_efficient-claude-agentic: reg_type=bilateral, bilateral_on_top=False, proj_filter_on=False, n_iter=20, learnable_alpha=True, alpha_init=0.1, foe_n_filters=24, foe_kernel=7, foe_n_bumps=31, n_bf=3, bf_multiscale=True, bf_sigmas=[0.8, 1.6, 3.2], bf_kernel=7, bf_sigma_r=0.02, bf_gain_init=0.0, epochs=16, cosine_lr=True, lr=0.005, max_train_s=1080, batch_size=4, train_n=200, val_n=200, display_min=0.0, display_max=0.05, seed=42, rationale=iter-6 param_efficient breast -- DC DEPTH on the lean prox. SIX-BOX: (1) PRIOR: iter-5 (pivot: reg foe->bilateral, 13 params, K5) hr 0.0664 -- cleared baseline (PSNR 36.92>36.32), ran ALL 16 epochs stably, alpha auto-tuned to 0.022. But 0.066 < iter-1's 0.264 AND < the bilateral-alone-no-DC ceiling 0.26-0.28. Read: at K=5 five weak DC steps + a light gate do too LITTLE work; the prox can't over-smooth (good) but the shallow DC removes few streaks. iter-4's K=12 collapse was the FoE over-regularizing, NOT the depth -- the light bilateral gate CAN'T over-smooth, so deep DC should now compound productively. (2) FAILURE MODE: under-consistency -- the DC-dominant compact is too SHALLOW (K=5) to null the sparse-view residual. (3) ONE KNOB: n_iter 5 -> 20 (deep weight-TIED DC unroll on the 13-param bilateral prox). WEIGHT-TIED => still 13 params. All else byte-for-byte iter-5. (4) HYPOTHESIS: 20 tied DC steps with a non-over-smoothing bilateral gate drive Rx->g far enough to remove coherent streaks -> hr rises WELL past 0.264 (and past iter-5's 0.066), because on the LEAN prox depth is the free lever that FoE poisoned in iter-4. This is VN's mechanism (learned reg + genuine DC + weight-share) in 13 params. (5) BUDGET: K=20 bilateral is ~4x the round-trips of iter-5's K5 but bilateral is cheap per step; iter-5 finished 16ep in 465s so K20 ~fits several epochs under the 1080s backstop; 200-val pass fits; <20min guaranteed by backstop. (6) SERIAL; iter-7 self-dispatches (next: sweep alpha_init on the STABLE deep-DC lean prox, then proj-domain +5p).", "advice_for_others": "param_efficient-claude-agentic: reg_type=bilateral, bilateral_on_top=False, proj_filter_on=False, n_iter=20, learnable_alpha=True, alpha_init=0.1, foe_n_filters=24, foe_kernel=7, foe_n_bumps=31, n_bf=3, bf_multiscale=True, bf_sigmas=[0.8, 1.6, 3.2], bf_kernel=7, bf_sigma_r=0.02, bf_gain_init=0.0, epochs=16, cosine_lr=True, lr=0.005, max_train_s=1080, batch_size=4, train_n=200, val_n=200, display_min=0.0, display_max=0.05, seed=42, rationale=iter-6 param_efficient breast -- DC DEPTH on the lean prox. SIX-BOX: (1) PRIOR: iter-5 (pivot: reg foe->bilateral, 13 params, K5) hr 0.0664 -- cleared baseline (PSNR 36.92>36.32), ran ALL 16 epochs stably, alpha auto-tuned to 0.022. But 0.066 < iter-1's 0.264 AND < the bilateral-alone-no-DC ceiling 0.26-0.28. Read: at K=5 five weak DC steps + a light gate do too LITTLE work; the prox can't over-smooth (good) but the shallow DC removes few streaks. iter-4's K=12 collapse was the FoE over-regularizing, NOT the depth -- the light bilateral gate CAN'T over-smooth, so deep DC should now compound productively. (2) FAILURE MODE: under-consistency -- the DC-dominant compact is too SHALLOW (K=5) to null the sparse-view residual. (3) ONE KNOB: n_iter 5 -> 20 (deep weight-TIED DC unroll on the 13-param bilateral prox). WEIGHT-TIED => still 13 params. All else byte-for-byte iter-5. (4) HYPOTHESIS: 20 tied DC steps with a non-over-smoothing bilateral gate drive Rx->g far enough to remove coherent streaks -> hr rises WELL past 0.264 (and past iter-5's 0.066), because on the LEAN prox depth is the free lever that FoE poisoned in iter-4. This is VN's mechanism (learned reg + genuine DC + weight-share) in 13 params. (5) BUDGET: K=20 bilateral is ~4x the round-trips of iter-5's K5 but bilateral is cheap per step; iter-5 finished 16ep in 465s so K20 ~fits several epochs under the 1080s backstop; 200-val pass fits; <20min guaranteed by backstop. (6) SERIAL; iter-7 self-dispatches (next: sweep alpha_init on the STABLE deep-DC lean prox, then proj-domain +5p).", "comparison_image": "runs/breast-ct-claude-agentic-param-efficient-search-20260703-01/iterations/iter-0006/comparison.png"}
{"ts": "2026-07-06T17:06:22Z", "run_id": "breast-ct-claude-agentic-param-efficient-search-20260703-01", "iter": 5, "agent": "param_efficient-claude-agentic", "model": "claude-opus-4-8-1m", "change_class": "architecture", "status": "keep", "kept": true, "val_score": 0.9481168389320374, "headroom": 0.06640393749047224, "params_M": 1.3e-05, "train_n": 200, "rationale": "param_efficient-claude-agentic: reg_type=bilateral, bilateral_on_top=False, proj_filter_on=False, n_iter=5, learnable_alpha=True, alpha_init=0.1, foe_n_filters=24, foe_kernel=7, foe_n_bumps=31, n_bf=3, bf_multiscale=True, bf_sigmas=[0.8, 1.6, 3.2], bf_kernel=7, bf_sigma_r=0.02, bf_gain_init=0.0, epochs=16, cosine_lr=True, lr=0.005, max_train_s=1080, batch_size=4, train_n=200, val_n=200, display_min=0.0, display_max=0.05, seed=42, rationale=iter-5 param_efficient breast -- ARCHITECTURE PIVOT (drop Mayo FoE). SIX-BOX: (1) PRIOR: 4 negatives converge -- iter1(K5,a.09,3ep) 0.264 BEST; iter2(11ep) 0.190; iter3(a0.5) 0.0 diverge; iter4(K12) 0.0 over-regularize. EVERY direction that engages the FoE reg MORE lowers hr; best result had FoE LEAST trained. Verdict: the Mayo FoE is a NOISE prior added INSIDE the GD step (x=x-alpha*(dc+reg)) so a trained FoE smoother directly CORRUPTS the DC direction on coherent streaks. (2) FAILURE MODE: reg-DC conflict -- the FoE fights consistency; it is the ceiling, not the help. (3) ONE KNOB: reg_type foe -> bilateral (standalone 3-scale edge-preserving gate, 12 reg params, bilateral_on_top=False). K=5, alpha=0.1, train_n=200 else byte-for-byte iter-2. The range kernel (sigma_r=0.02) STRUCTURALLY vetoes over-smoothing (coordinator: DD-bf-N2I 0.21 vs plain-N2I 0.00) so it CAN'T corrupt DC the way FoE did. (4) HYPOTHESIS: replacing the FoE noise prior with a light bilateral gate lets the genuine DC unroll DOMINATE -- streaks get removed by re-imposing Rx=g while the gate only preserves edges, so hr rises past 0.264 at just 12 reg params (13 total). Note: bilateral ALONE (no DC) capped 0.28 on breast; the bet is that WITH the K=5 DC unroll it does better because DC does the streak removal. (5) BUDGET: K=5 bilateral is CHEAPER than FoE per step -> more epochs fit 1080s wall; 200-val pass fits; <20min. (6) SERIAL; iter-6 self-dispatches (next: DC depth K on THIS lean prox, then projection-domain filter +5p).", "advice_for_others": "param_efficient-claude-agentic: reg_type=bilateral, bilateral_on_top=False, proj_filter_on=False, n_iter=5, learnable_alpha=True, alpha_init=0.1, foe_n_filters=24, foe_kernel=7, foe_n_bumps=31, n_bf=3, bf_multiscale=True, bf_sigmas=[0.8, 1.6, 3.2], bf_kernel=7, bf_sigma_r=0.02, bf_gain_init=0.0, epochs=16, cosine_lr=True, lr=0.005, max_train_s=1080, batch_size=4, train_n=200, val_n=200, display_min=0.0, display_max=0.05, seed=42, rationale=iter-5 param_efficient breast -- ARCHITECTURE PIVOT (drop Mayo FoE). SIX-BOX: (1) PRIOR: 4 negatives converge -- iter1(K5,a.09,3ep) 0.264 BEST; iter2(11ep) 0.190; iter3(a0.5) 0.0 diverge; iter4(K12) 0.0 over-regularize. EVERY direction that engages the FoE reg MORE lowers hr; best result had FoE LEAST trained. Verdict: the Mayo FoE is a NOISE prior added INSIDE the GD step (x=x-alpha*(dc+reg)) so a trained FoE smoother directly CORRUPTS the DC direction on coherent streaks. (2) FAILURE MODE: reg-DC conflict -- the FoE fights consistency; it is the ceiling, not the help. (3) ONE KNOB: reg_type foe -> bilateral (standalone 3-scale edge-preserving gate, 12 reg params, bilateral_on_top=False). K=5, alpha=0.1, train_n=200 else byte-for-byte iter-2. The range kernel (sigma_r=0.02) STRUCTURALLY vetoes over-smoothing (coordinator: DD-bf-N2I 0.21 vs plain-N2I 0.00) so it CAN'T corrupt DC the way FoE did. (4) HYPOTHESIS: replacing the FoE noise prior with a light bilateral gate lets the genuine DC unroll DOMINATE -- streaks get removed by re-imposing Rx=g while the gate only preserves edges, so hr rises past 0.264 at just 12 reg params (13 total). Note: bilateral ALONE (no DC) capped 0.28 on breast; the bet is that WITH the K=5 DC unroll it does better because DC does the streak removal. (5) BUDGET: K=5 bilateral is CHEAPER than FoE per step -> more epochs fit 1080s wall; 200-val pass fits; <20min. (6) SERIAL; iter-6 self-dispatches (next: DC depth K on THIS lean prox, then projection-domain filter +5p).", "comparison_image": "runs/breast-ct-claude-agentic-param-efficient-search-20260703-01/iterations/iter-0005/comparison.png"}
{"ts": "2026-07-06T16:43:11Z", "run_id": "breast-ct-claude-agentic-param-efficient-search-20260703-01", "iter": 4, "agent": "param_efficient-claude-agentic", "model": "claude-opus-4-8-1m", "change_class": "architecture", "status": "discard", "kept": false, "val_score": 0.9713464379310608, "headroom": 0.0, "params_M": 0.001933, "train_n": 200, "rationale": "param_efficient-claude-agentic: reg_type=foe, bilateral_on_top=True, proj_filter_on=False, n_iter=12, learnable_alpha=True, alpha_init=0.1, foe_n_filters=24, foe_kernel=7, foe_n_bumps=31, n_bf=3, bf_multiscale=True, bf_sigmas=[0.8, 1.6, 3.2], bf_kernel=7, bf_sigma_r=0.02, bf_gain_init=0.0, epochs=16, cosine_lr=True, lr=0.005, max_train_s=1080, batch_size=4, train_n=200, val_n=200, display_min=0.0, display_max=0.05, seed=42, rationale=iter-4 param_efficient breast. SIX-BOX: (1) PRIOR: iter-1 (a~0.09,3ep) hr 0.264 BEST; iter-2 (a~0.09,11ep) 0.190; iter-3 (a=0.5,11ep) hr 0.0 DIVERGED -- bilateral gains went NEGATIVE (-0.18,-0.24), train-loss ROSE 7x, PSNR 38->29. So DC-strength is NOT a monotonic lever in the tied-GD prox: too-weak alpha leaves streaks, too-strong overshoots+diverges. The plain GD unroll x=x-alpha*(dc+reg) is step-size-fragile; VN/LPD win by NOT relying on a single hand-tuned step (learned DC depth / primal-dual). (2) FAILURE MODE: under-consistency at safe alpha -- 5 tied steps can't null the sparse-view residual, but a bigger single step diverges. The fix is DEPTH, not step size. (3) ONE KNOB: n_iter 5 -> 12 (deeper weight-TIED DC unroll), alpha reverted to 0.1 (iter-3's 0.5 diverged). All else byte-for-byte iter-2. WEIGHT-TIED => ZERO extra params (VN's free-depth trick). (4) HYPOTHESIS: 12 tied safe-alpha DC steps drive Rx->g much further than 5, removing streaks that 5 steps left, WITHOUT the per-step overshoot that killed iter-3 -> hr rises past 0.264, because on sparse-view CONSISTENCY DEPTH (not step size, not reg cleverness) is the lever. (5) BUDGET: K=12 is ~2.4x the fwd/back-proj of K=5; with train_n=200/bs4 + checkpointing + the 1080s wall backstop, expect ~5-6 epochs (fewer than iter-2's 11 but the anneal still progresses); 200-val pass fits. ~<20min (backstop guarantees it). (6) SERIAL; iter-5 self-dispatches (next: projection-domain filter ON, sparse-view-native, if depth alone plateaus).", "advice_for_others": "param_efficient-claude-agentic: reg_type=foe, bilateral_on_top=True, proj_filter_on=False, n_iter=12, learnable_alpha=True, alpha_init=0.1, foe_n_filters=24, foe_kernel=7, foe_n_bumps=31, n_bf=3, bf_multiscale=True, bf_sigmas=[0.8, 1.6, 3.2], bf_kernel=7, bf_sigma_r=0.02, bf_gain_init=0.0, epochs=16, cosine_lr=True, lr=0.005, max_train_s=1080, batch_size=4, train_n=200, val_n=200, display_min=0.0, display_max=0.05, seed=42, rationale=iter-4 param_efficient breast. SIX-BOX: (1) PRIOR: iter-1 (a~0.09,3ep) hr 0.264 BEST; iter-2 (a~0.09,11ep) 0.190; iter-3 (a=0.5,11ep) hr 0.0 DIVERGED -- bilateral gains went NEGATIVE (-0.18,-0.24), train-loss ROSE 7x, PSNR 38->29. So DC-strength is NOT a monotonic lever in the tied-GD prox: too-weak alpha leaves streaks, too-strong overshoots+diverges. The plain GD unroll x=x-alpha*(dc+reg) is step-size-fragile; VN/LPD win by NOT relying on a single hand-tuned step (learned DC depth / primal-dual). (2) FAILURE MODE: under-consistency at safe alpha -- 5 tied steps can't null the sparse-view residual, but a bigger single step diverges. The fix is DEPTH, not step size. (3) ONE KNOB: n_iter 5 -> 12 (deeper weight-TIED DC unroll), alpha reverted to 0.1 (iter-3's 0.5 diverged). All else byte-for-byte iter-2. WEIGHT-TIED => ZERO extra params (VN's free-depth trick). (4) HYPOTHESIS: 12 tied safe-alpha DC steps drive Rx->g much further than 5, removing streaks that 5 steps left, WITHOUT the per-step overshoot that killed iter-3 -> hr rises past 0.264, because on sparse-view CONSISTENCY DEPTH (not step size, not reg cleverness) is the lever. (5) BUDGET: K=12 is ~2.4x the fwd/back-proj of K=5; with train_n=200/bs4 + checkpointing + the 1080s wall backstop, expect ~5-6 epochs (fewer than iter-2's 11 but the anneal still progresses); 200-val pass fits. ~<20min (backstop guarantees it). (6) SERIAL; iter-5 self-dispatches (next: projection-domain filter ON, sparse-view-native, if depth alone plateaus).", "comparison_image": "runs/breast-ct-claude-agentic-param-efficient-search-20260703-01/iterations/iter-0004/comparison.png"}
{"ts": "2026-07-06T16:09:23Z", "run_id": "breast-ct-claude-agentic-param-efficient-search-20260703-01", "iter": 3, "agent": "param_efficient-claude-agentic", "model": "claude-opus-4-8-1m", "change_class": "architecture", "status": "discard", "kept": false, "val_score": 0.94614177942276, "headroom": 0.0, "params_M": 0.001933, "train_n": 200, "rationale": "param_efficient-claude-agentic: reg_type=foe, bilateral_on_top=True, proj_filter_on=False, n_iter=5, learnable_alpha=True, alpha_init=0.5, foe_n_filters=24, foe_kernel=7, foe_n_bumps=31, n_bf=3, bf_multiscale=True, bf_sigmas=[0.8, 1.6, 3.2], bf_kernel=7, bf_sigma_r=0.02, bf_gain_init=0.0, epochs=16, cosine_lr=True, lr=0.005, max_train_s=1080, batch_size=4, train_n=200, val_n=200, display_min=0.0, display_max=0.05, seed=42, rationale=iter-3 param_efficient breast. SIX-BOX: (1) PRIOR: iter-1 hr 0.2635 (3 epochs, reg barely engaged) BEAT iter-2 hr 0.1897 (11 epochs, reg fully engaged, train-loss monotonically down while val hr FELL). Diagnosis: the DC step is a GENUINE projector round-trip dc=R^T(Rx-g)/dc_norm, but with K=5 tied steps at weak alpha~0.09 five GD-DC steps cannot null the sparse-view streak residual, while the FoE+bilateral reg over-smooths every step -> the reg WINS as training proceeds. Data-consistency is the differentiator (coordinator: VN 0.63 @ 9k, LPD 0.68 -- genuine DC; image-domain-only caps ~0.28). Our DC is present but TOO WEAK relative to reg over K=5. (2) FAILURE MODE: under-consistency -- streaks survive because the GD-DC step size is too small to enforce Rx=g in 5 tied steps; reg dominates. (3) ONE KNOB: alpha_init 0.1 -> 0.5 (5x stronger DC/prox step). All else byte-for-byte iter-2 (train_n=200, K=5, FoE+M3 bilateral). (4) HYPOTHESIS: a 5x stronger step drives Rx toward g much harder per iteration, so the 5 unrolled steps actually remove streaks before the reg smooths them -> hr rises well past 0.2635, because DC-strength (not reg cleverness) is the sparse-view lever. Risk: too-strong alpha can diverge (dc_norm scaling keeps grad O(1), softplus keeps alpha>0); grad_clip=1 guards. ZERO extra params. (5) BUDGET: train_n=200 K=5 bs4 + 200-val, 1080s backstop -> <20min. (6) SERIAL; iter-4 self-dispatches (next: projection-domain filter ON -- sparse-view-native).", "advice_for_others": "param_efficient-claude-agentic: reg_type=foe, bilateral_on_top=True, proj_filter_on=False, n_iter=5, learnable_alpha=True, alpha_init=0.5, foe_n_filters=24, foe_kernel=7, foe_n_bumps=31, n_bf=3, bf_multiscale=True, bf_sigmas=[0.8, 1.6, 3.2], bf_kernel=7, bf_sigma_r=0.02, bf_gain_init=0.0, epochs=16, cosine_lr=True, lr=0.005, max_train_s=1080, batch_size=4, train_n=200, val_n=200, display_min=0.0, display_max=0.05, seed=42, rationale=iter-3 param_efficient breast. SIX-BOX: (1) PRIOR: iter-1 hr 0.2635 (3 epochs, reg barely engaged) BEAT iter-2 hr 0.1897 (11 epochs, reg fully engaged, train-loss monotonically down while val hr FELL). Diagnosis: the DC step is a GENUINE projector round-trip dc=R^T(Rx-g)/dc_norm, but with K=5 tied steps at weak alpha~0.09 five GD-DC steps cannot null the sparse-view streak residual, while the FoE+bilateral reg over-smooths every step -> the reg WINS as training proceeds. Data-consistency is the differentiator (coordinator: VN 0.63 @ 9k, LPD 0.68 -- genuine DC; image-domain-only caps ~0.28). Our DC is present but TOO WEAK relative to reg over K=5. (2) FAILURE MODE: under-consistency -- streaks survive because the GD-DC step size is too small to enforce Rx=g in 5 tied steps; reg dominates. (3) ONE KNOB: alpha_init 0.1 -> 0.5 (5x stronger DC/prox step). All else byte-for-byte iter-2 (train_n=200, K=5, FoE+M3 bilateral). (4) HYPOTHESIS: a 5x stronger step drives Rx toward g much harder per iteration, so the 5 unrolled steps actually remove streaks before the reg smooths them -> hr rises well past 0.2635, because DC-strength (not reg cleverness) is the sparse-view lever. Risk: too-strong alpha can diverge (dc_norm scaling keeps grad O(1), softplus keeps alpha>0); grad_clip=1 guards. ZERO extra params. (5) BUDGET: train_n=200 K=5 bs4 + 200-val, 1080s backstop -> <20min. (6) SERIAL; iter-4 self-dispatches (next: projection-domain filter ON -- sparse-view-native).", "comparison_image": "runs/breast-ct-claude-agentic-param-efficient-search-20260703-01/iterations/iter-0003/comparison.png"}
{"ts": "2026-07-06T15:38:40Z", "run_id": "breast-ct-claude-agentic-param-efficient-search-20260703-01", "iter": 2, "agent": "param_efficient-claude-agentic", "model": "claude-opus-4-8-1m", "change_class": "architecture", "status": "keep", "kept": true, "val_score": 0.9853028655052185, "headroom": 0.1896760990245311, "params_M": 0.001933, "train_n": 200, "rationale": "param_efficient-claude-agentic: reg_type=foe, bilateral_on_top=True, proj_filter_on=False, n_iter=5, learnable_alpha=True, alpha_init=0.1, foe_n_filters=24, foe_kernel=7, foe_n_bumps=31, n_bf=3, bf_multiscale=True, bf_sigmas=[0.8, 1.6, 3.2], bf_kernel=7, bf_sigma_r=0.02, bf_gain_init=0.0, epochs=16, cosine_lr=True, lr=0.005, max_train_s=1080, batch_size=4, train_n=200, val_n=200, display_min=0.0, display_max=0.05, seed=42, rationale=iter-2 param_efficient breast (FoE K=5 DC unroll + M=3 bilateral bank, 1,933 params). SIX-BOX: (1) PRIOR: iter-1 hr 0.2635 ssim 0.9875 @ 1,933 params, but training WALL-CUT at epoch 3/16 (loss 2.05e-4 -> 2.35e-5 -> 2.02e-5 STILL dropping; bilateral gains 0.94 -> 1.53 -> 1.81 STILL climbing at cutoff) => compute-starved, NOT an arch ceiling. (2) FAILURE MODE: undertraining -- the FoE unroll at train_n=800/bs4/512^2 fits only 3/16 epochs in the 1080s wall; the anneal never completes. (3) ONE KNOB: train_n 800->200 (Mayo proven value); all else byte-for-byte iter-1. (4) HYPOTHESIS: at train_n=200 ~4x more epochs (~12/16) fit the SAME 1080s wall, so the cosine anneal completes and hr rises WELL past 0.2635, because iter-1 was compute-starved not data-starved (200 breast phantoms trained the DL tier fine). ZERO extra params. (5) BUDGET: train_n=200 x K=5 unroll bs4 + 200-val pass, 1080s backstop => <20min. (6) SERIAL; iter-3 self-dispatches on landing (next lever = the Manduca PROJECTION filter, the sparse-view-specific gain dormant here).", "advice_for_others": "param_efficient-claude-agentic: reg_type=foe, bilateral_on_top=True, proj_filter_on=False, n_iter=5, learnable_alpha=True, alpha_init=0.1, foe_n_filters=24, foe_kernel=7, foe_n_bumps=31, n_bf=3, bf_multiscale=True, bf_sigmas=[0.8, 1.6, 3.2], bf_kernel=7, bf_sigma_r=0.02, bf_gain_init=0.0, epochs=16, cosine_lr=True, lr=0.005, max_train_s=1080, batch_size=4, train_n=200, val_n=200, display_min=0.0, display_max=0.05, seed=42, rationale=iter-2 param_efficient breast (FoE K=5 DC unroll + M=3 bilateral bank, 1,933 params). SIX-BOX: (1) PRIOR: iter-1 hr 0.2635 ssim 0.9875 @ 1,933 params, but training WALL-CUT at epoch 3/16 (loss 2.05e-4 -> 2.35e-5 -> 2.02e-5 STILL dropping; bilateral gains 0.94 -> 1.53 -> 1.81 STILL climbing at cutoff) => compute-starved, NOT an arch ceiling. (2) FAILURE MODE: undertraining -- the FoE unroll at train_n=800/bs4/512^2 fits only 3/16 epochs in the 1080s wall; the anneal never completes. (3) ONE KNOB: train_n 800->200 (Mayo proven value); all else byte-for-byte iter-1. (4) HYPOTHESIS: at train_n=200 ~4x more epochs (~12/16) fit the SAME 1080s wall, so the cosine anneal completes and hr rises WELL past 0.2635, because iter-1 was compute-starved not data-starved (200 breast phantoms trained the DL tier fine). ZERO extra params. (5) BUDGET: train_n=200 x K=5 unroll bs4 + 200-val pass, 1080s backstop => <20min. (6) SERIAL; iter-3 self-dispatches on landing (next lever = the Manduca PROJECTION filter, the sparse-view-specific gain dormant here).", "comparison_image": "runs/breast-ct-claude-agentic-param-efficient-search-20260703-01/iterations/iter-0002/comparison.png"}
