{"ts": "2026-07-06T21:35:45Z", "run_id": "breast-ct-claude-agentic-fastdiff-flow-pixel-constrained-search-20260703-01", "iter": 8, "agent": "fastdiff_flow_pixel_constrained-claude-agentic", "model": "claude-opus-4-8-1m", "change_class": "architecture", "status": "discard", "kept": false, "val_score": 0.8898441791534424, "headroom": 0.0, "params_M": 3.822787, "train_n": 400, "rationale": "fastdiff_flow_pixel_constrained-claude-agentic: image_size=512, pixel_spacing=0.3516, n_angles=128, n_det=1024, det_spacing=0.35754, sod=500.0, sdd=1000.0, display_min=0.0, display_max=0.5, train_n=400, val_n=200, noise_i0=100000.0, noise_sigma_e=10.0, seed=42, dataset_kind=breast_ct, fd_recon_ckpt=/cluster/maier/Agent4CT/checkpoints/fast_diffusion_pixel_breast.pt, fd_recon_steps=8, fd_recon_init=fbp, fd_recon_init_t=0.05, fd_recon_eta=1.0, fd_recon_dc=1, fd_recon_dc_n_cg=40, fd_recon_dc_relax=1.0, rationale=iter-8 EXPLORATORY single knob dc_n_cg 30->40 (map RIGHT shoulder of the DC semi-convergence peak). SIX-BOX: (1)PRIOR: n_cg curve now resolved (init_t0.05,relax1.0): n_cg5 rmse0.00669 hr0 -> n_cg20 rmse0.005327 hr0 (just above FBP0.00521) -> n_cg30 rmse0.004924 hr=0.0557 (PEAK, below FBP) -> n_cg60 rmse0.00992 hr0 (over-converged, noise-amplified). Clean inverted-U in rmse: DC CG semi-converges, optimum ~n_cg30. (2)FAILURE: 30 may not be the exact argmax; the right shoulder (30->60) decay is uncharted. (3)ONE KNOB: dc_n_cg 30->40. (4)HYPOTHESIS: n_cg40 rmse should sit between n_cg30(0.004924) and n_cg60(0.00992); if still < FBP0.00521 then hr>0 and the >0 plateau spans ~30-40; if > FBP the peak is tight at 30. Pinpoints the argmax hr. (5)BUDGET: 40 CG ~ iter-5 x1.3 (~7min), inside 20-min. (6)Serial.", "advice_for_others": "fastdiff_flow_pixel_constrained-claude-agentic: image_size=512, pixel_spacing=0.3516, n_angles=128, n_det=1024, det_spacing=0.35754, sod=500.0, sdd=1000.0, display_min=0.0, display_max=0.5, train_n=400, val_n=200, noise_i0=100000.0, noise_sigma_e=10.0, seed=42, dataset_kind=breast_ct, fd_recon_ckpt=/cluster/maier/Agent4CT/checkpoints/fast_diffusion_pixel_breast.pt, fd_recon_steps=8, fd_recon_init=fbp, fd_recon_init_t=0.05, fd_recon_eta=1.0, fd_recon_dc=1, fd_recon_dc_n_cg=40, fd_recon_dc_relax=1.0, rationale=iter-8 EXPLORATORY single knob dc_n_cg 30->40 (map RIGHT shoulder of the DC semi-convergence peak). SIX-BOX: (1)PRIOR: n_cg curve now resolved (init_t0.05,relax1.0): n_cg5 rmse0.00669 hr0 -> n_cg20 rmse0.005327 hr0 (just above FBP0.00521) -> n_cg30 rmse0.004924 hr=0.0557 (PEAK, below FBP) -> n_cg60 rmse0.00992 hr0 (over-converged, noise-amplified). Clean inverted-U in rmse: DC CG semi-converges, optimum ~n_cg30. (2)FAILURE: 30 may not be the exact argmax; the right shoulder (30->60) decay is uncharted. (3)ONE KNOB: dc_n_cg 30->40. (4)HYPOTHESIS: n_cg40 rmse should sit between n_cg30(0.004924) and n_cg60(0.00992); if still < FBP0.00521 then hr>0 and the >0 plateau spans ~30-40; if > FBP the peak is tight at 30. Pinpoints the argmax hr. (5)BUDGET: 40 CG ~ iter-5 x1.3 (~7min), inside 20-min. (6)Serial.", "comparison_image": "runs/breast-ct-claude-agentic-fastdiff-flow-pixel-constrained-search-20260703-01/iterations/iter-0008/comparison.png"}
{"ts": "2026-07-06T21:32:52Z", "run_id": "breast-ct-claude-agentic-fastdiff-wdm-wavelet-constrained-search-20260703-01", "iter": 9, "agent": "fastdiff_wdm_wavelet_constrained-claude-agentic", "model": "claude-opus-4-8-1m", "change_class": "architecture", "status": "keep", "kept": true, "val_score": 0.88271564245224, "headroom": 0.06947602738410918, "params_M": 3.824908, "train_n": 3600, "rationale": "fastdiff_wdm_wavelet_constrained-claude-agentic: val_n=200, seed=42, fd_recon_ckpt=/cluster/maier/Agent4CT/checkpoints/fast_diffusion_wavelet_breast.pt, fd_recon_steps=8, fd_recon_init=fbp, fd_recon_init_t=0.005, fd_recon_eta=1.0, fd_recon_dc=1, fd_recon_dc_n_cg=15, fd_recon_dc_relax=1.0, dataset_kind=breast_ct, rationale=iter-9 DC-STRENGTH (n_cg up) at near-prior-off init_t, breast-native wavelet CONSTRAINED, val=200. SIX-BOX: (1) PRIOR: init_t->0 asymptote pinned: init_t0.02->PSNR33.7, 0.05->28.9... 0.005->35.19dB/RMSE5.94e-3 (iter-8), converging to JUST UNDER baseline 36.32dB/RMSE5.21e-3. hr=0 throughout; the CG-DC-projected near-FBP is marginally WORSE than the plain Hann FBP. (2) FAILURE MODE: at n_cg=5 the CG least-squares solve of min||Ax-y||^2 on the 128-view system is UNDER-converged, leaving residual streaks -> RMSE just above the plain FBP. (3) ONE KNOB: fd_recon_dc_n_cg 5 -> 15 (stronger LSQ CG solve), init_t=0.005 fixed. (4) HYPOTHESIS: more CG iters drive the recon closer to the exact 128-view least-squares solution; IF that LSQ solution beats the plain Hann FBP, hr crosses 0. FALSIFIER: if RMSE stays >=baseline even at n_cg=15, the CG-DC/wavelet recon is genuinely FBP-bounded on sparse breast (the plain regularized-FBP baseline is at/above the unregularized LSQ solution) -> the wavelet prior + DC cannot clear it; conclude. (5) BUDGET: n_cg=15 ~2-3x CG cost, still well inside 20min at ~90s base. (6) iter-10 on landing.", "advice_for_others": "fastdiff_wdm_wavelet_constrained-claude-agentic: val_n=200, seed=42, fd_recon_ckpt=/cluster/maier/Agent4CT/checkpoints/fast_diffusion_wavelet_breast.pt, fd_recon_steps=8, fd_recon_init=fbp, fd_recon_init_t=0.005, fd_recon_eta=1.0, fd_recon_dc=1, fd_recon_dc_n_cg=15, fd_recon_dc_relax=1.0, dataset_kind=breast_ct, rationale=iter-9 DC-STRENGTH (n_cg up) at near-prior-off init_t, breast-native wavelet CONSTRAINED, val=200. SIX-BOX: (1) PRIOR: init_t->0 asymptote pinned: init_t0.02->PSNR33.7, 0.05->28.9... 0.005->35.19dB/RMSE5.94e-3 (iter-8), converging to JUST UNDER baseline 36.32dB/RMSE5.21e-3. hr=0 throughout; the CG-DC-projected near-FBP is marginally WORSE than the plain Hann FBP. (2) FAILURE MODE: at n_cg=5 the CG least-squares solve of min||Ax-y||^2 on the 128-view system is UNDER-converged, leaving residual streaks -> RMSE just above the plain FBP. (3) ONE KNOB: fd_recon_dc_n_cg 5 -> 15 (stronger LSQ CG solve), init_t=0.005 fixed. (4) HYPOTHESIS: more CG iters drive the recon closer to the exact 128-view least-squares solution; IF that LSQ solution beats the plain Hann FBP, hr crosses 0. FALSIFIER: if RMSE stays >=baseline even at n_cg=15, the CG-DC/wavelet recon is genuinely FBP-bounded on sparse breast (the plain regularized-FBP baseline is at/above the unregularized LSQ solution) -> the wavelet prior + DC cannot clear it; conclude. (5) BUDGET: n_cg=15 ~2-3x CG cost, still well inside 20min at ~90s base. (6) iter-10 on landing.", "comparison_image": "runs/breast-ct-claude-agentic-fastdiff-wdm-wavelet-constrained-search-20260703-01/iterations/iter-0009/comparison.png"}
{"ts": "2026-07-06T21:31:20Z", "run_id": "breast-ct-claude-agentic-fastdiff-flow-pixel-unconstrained-search-20260703-01", "iter": 19, "agent": "fastdiff_flow_pixel_unconstrained-claude-agentic", "model": "claude-opus-4-8-1m", "change_class": "architecture", "status": "keep", "kept": true, "val_score": 0.9758236408233643, "headroom": 0.27085786056266214, "params_M": 3.822787, "train_n": 3600, "rationale": "fastdiff_flow_pixel_unconstrained-claude-agentic: image_size=512, pixel_spacing=0.3516, n_angles=128, n_det=1024, det_spacing=0.35754, sod=500.0, sdd=1000.0, display_min=0.0, display_max=0.5, train_n=400, val_n=200, noise_i0=100000.0, noise_sigma_e=10.0, seed=42, fd_recon_ckpt=/cluster/maier/Agent4CT/checkpoints/fast_diffusion_pixel_breast.pt, fd_recon_steps=8, fd_recon_init=fbp, fd_recon_init_t=0.02, fd_recon_eta=0.02, fd_recon_dc=0, fd_recon_dc_n_cg=5, fd_recon_dc_relax=0.5, rationale=iter-19: DC-off breast-prior. At hr-peak init_t=0.02, continue eta fine-tune. ONE KNOB eta 0.05->0.02. PRIOR: at init_t0.02, eta0.1->hr0.209, eta0.05->hr0.261(best) - gentler DPS = better denoise, less overshoot. HYPOTHESIS: eta=0.02 (near-minimal guidance) edges hr higher still, OR flattens => eta~0.02-0.05 is the joint optimum with init_t0.02. As eta->0 the recon becomes pure prior-denoise of the FBP-init with ~no measurement pull; the question is whether the whisper of DPS still adds value at the peak. Locates the eta floor at the champion init_t.", "advice_for_others": "fastdiff_flow_pixel_unconstrained-claude-agentic: image_size=512, pixel_spacing=0.3516, n_angles=128, n_det=1024, det_spacing=0.35754, sod=500.0, sdd=1000.0, display_min=0.0, display_max=0.5, train_n=400, val_n=200, noise_i0=100000.0, noise_sigma_e=10.0, seed=42, fd_recon_ckpt=/cluster/maier/Agent4CT/checkpoints/fast_diffusion_pixel_breast.pt, fd_recon_steps=8, fd_recon_init=fbp, fd_recon_init_t=0.02, fd_recon_eta=0.02, fd_recon_dc=0, fd_recon_dc_n_cg=5, fd_recon_dc_relax=0.5, rationale=iter-19: DC-off breast-prior. At hr-peak init_t=0.02, continue eta fine-tune. ONE KNOB eta 0.05->0.02. PRIOR: at init_t0.02, eta0.1->hr0.209, eta0.05->hr0.261(best) - gentler DPS = better denoise, less overshoot. HYPOTHESIS: eta=0.02 (near-minimal guidance) edges hr higher still, OR flattens => eta~0.02-0.05 is the joint optimum with init_t0.02. As eta->0 the recon becomes pure prior-denoise of the FBP-init with ~no measurement pull; the question is whether the whisper of DPS still adds value at the peak. Locates the eta floor at the champion init_t.", "comparison_image": "runs/breast-ct-claude-agentic-fastdiff-flow-pixel-unconstrained-search-20260703-01/iterations/iter-0019/comparison.png"}
{"ts": "2026-07-06T21:27:06Z", "run_id": "breast-ct-claude-agentic-fastdiff-wdm-wavelet-constrained-search-20260703-01", "iter": 8, "agent": "fastdiff_wdm_wavelet_constrained-claude-agentic", "model": "claude-opus-4-8-1m", "change_class": "architecture", "status": "discard", "kept": false, "val_score": 0.8760147094726562, "headroom": 0.0, "params_M": 3.824908, "train_n": 3600, "rationale": "fastdiff_wdm_wavelet_constrained-claude-agentic: val_n=200, seed=42, fd_recon_ckpt=/cluster/maier/Agent4CT/checkpoints/fast_diffusion_wavelet_breast.pt, fd_recon_steps=8, fd_recon_init=fbp, fd_recon_init_t=0.005, fd_recon_eta=1.0, fd_recon_dc=1, fd_recon_dc_n_cg=5, fd_recon_dc_relax=1.0, dataset_kind=breast_ct, rationale=iter-8 INIT_T asymptote pin (near prior-off), breast-native wavelet CONSTRAINED, val=200. SIX-BOX: (1) PRIOR: init_t@relax1.0: 0.1->25.2,0.05->28.9,0.02->33.7dB/RMSE7.06e-3. Still climbing, now only ~2.6dB below baseline 36.3dB/5.21e-3. hr=0. (2) FAILURE MODE: the recon asymptotes to (near-clean FBP embed + full CG-DC) as init_t->0; it approaches but has not crossed the plain-Hann-FBP baseline. (3) ONE KNOB: init_t 0.02->0.005 (essentially prior-off; FBP embedded almost clean). (4) HYPOTHESIS: near-flat vs iter-7 or a small further gain -> pins the true init_t->0 asymptote. If it saturates at ~34-35dB just under 36.3, the DC-on wavelet recon is FBP-bounded (the CG-DC-projected near-FBP never beats the plain FBP baseline; the wavelet prior adds no value on sparse breast). (5) BUDGET ~90s. (6) iter-9 tests dc_n_cg-up at this init_t (does a stronger LSQ CG solve finally cross the baseline?).", "advice_for_others": "fastdiff_wdm_wavelet_constrained-claude-agentic: val_n=200, seed=42, fd_recon_ckpt=/cluster/maier/Agent4CT/checkpoints/fast_diffusion_wavelet_breast.pt, fd_recon_steps=8, fd_recon_init=fbp, fd_recon_init_t=0.005, fd_recon_eta=1.0, fd_recon_dc=1, fd_recon_dc_n_cg=5, fd_recon_dc_relax=1.0, dataset_kind=breast_ct, rationale=iter-8 INIT_T asymptote pin (near prior-off), breast-native wavelet CONSTRAINED, val=200. SIX-BOX: (1) PRIOR: init_t@relax1.0: 0.1->25.2,0.05->28.9,0.02->33.7dB/RMSE7.06e-3. Still climbing, now only ~2.6dB below baseline 36.3dB/5.21e-3. hr=0. (2) FAILURE MODE: the recon asymptotes to (near-clean FBP embed + full CG-DC) as init_t->0; it approaches but has not crossed the plain-Hann-FBP baseline. (3) ONE KNOB: init_t 0.02->0.005 (essentially prior-off; FBP embedded almost clean). (4) HYPOTHESIS: near-flat vs iter-7 or a small further gain -> pins the true init_t->0 asymptote. If it saturates at ~34-35dB just under 36.3, the DC-on wavelet recon is FBP-bounded (the CG-DC-projected near-FBP never beats the plain FBP baseline; the wavelet prior adds no value on sparse breast). (5) BUDGET ~90s. (6) iter-9 tests dc_n_cg-up at this init_t (does a stronger LSQ CG solve finally cross the baseline?).", "comparison_image": "runs/breast-ct-claude-agentic-fastdiff-wdm-wavelet-constrained-search-20260703-01/iterations/iter-0008/comparison.png"}
{"ts": "2026-07-06T21:26:54Z", "run_id": "breast-ct-claude-agentic-fastdiff-flow-pixel-unconstrained-search-20260703-01", "iter": 18, "agent": "fastdiff_flow_pixel_unconstrained-claude-agentic", "model": "claude-opus-4-8-1m", "change_class": "architecture", "status": "keep", "kept": true, "val_score": 0.9760755896568298, "headroom": 0.26074121848908727, "params_M": 3.822787, "train_n": 3600, "rationale": "fastdiff_flow_pixel_unconstrained-claude-agentic: image_size=512, pixel_spacing=0.3516, n_angles=128, n_det=1024, det_spacing=0.35754, sod=500.0, sdd=1000.0, display_min=0.0, display_max=0.5, train_n=400, val_n=200, noise_i0=100000.0, noise_sigma_e=10.0, seed=42, fd_recon_ckpt=/cluster/maier/Agent4CT/checkpoints/fast_diffusion_pixel_breast.pt, fd_recon_steps=8, fd_recon_init=fbp, fd_recon_init_t=0.02, fd_recon_eta=0.05, fd_recon_dc=0, fd_recon_dc_n_cg=5, fd_recon_dc_relax=0.5, rationale=iter-18: DC-off breast-prior. At the hr-peak init_t=0.02, fine-tune eta. ONE KNOB eta 0.1->0.05 (seed 42). PRIOR: champion init_t0.02/eta0.1 = hr0.2085 (seed42) / 0.2089 (seed123, robust). Earlier eta sweep at HIGH init_t0.4 found lower eta = better up to ~0.05-0.1. HYPOTHESIS: at the low-init_t peak, eta=0.05 (even gentler DPS) may edge hr slightly above 0.209 by denoising with minimal measurement overshoot; if flat/lower, eta~0.1 is the joint optimum. Fine 2-lever refinement (init_t x eta) around the champion.", "advice_for_others": "fastdiff_flow_pixel_unconstrained-claude-agentic: image_size=512, pixel_spacing=0.3516, n_angles=128, n_det=1024, det_spacing=0.35754, sod=500.0, sdd=1000.0, display_min=0.0, display_max=0.5, train_n=400, val_n=200, noise_i0=100000.0, noise_sigma_e=10.0, seed=42, fd_recon_ckpt=/cluster/maier/Agent4CT/checkpoints/fast_diffusion_pixel_breast.pt, fd_recon_steps=8, fd_recon_init=fbp, fd_recon_init_t=0.02, fd_recon_eta=0.05, fd_recon_dc=0, fd_recon_dc_n_cg=5, fd_recon_dc_relax=0.5, rationale=iter-18: DC-off breast-prior. At the hr-peak init_t=0.02, fine-tune eta. ONE KNOB eta 0.1->0.05 (seed 42). PRIOR: champion init_t0.02/eta0.1 = hr0.2085 (seed42) / 0.2089 (seed123, robust). Earlier eta sweep at HIGH init_t0.4 found lower eta = better up to ~0.05-0.1. HYPOTHESIS: at the low-init_t peak, eta=0.05 (even gentler DPS) may edge hr slightly above 0.209 by denoising with minimal measurement overshoot; if flat/lower, eta~0.1 is the joint optimum. Fine 2-lever refinement (init_t x eta) around the champion.", "comparison_image": "runs/breast-ct-claude-agentic-fastdiff-flow-pixel-unconstrained-search-20260703-01/iterations/iter-0018/comparison.png"}
{"ts": "2026-07-06T21:26:47Z", "run_id": "breast-ct-claude-agentic-fastdiff-flow-pixel-constrained-search-20260703-01", "iter": 7, "agent": "fastdiff_flow_pixel_constrained-claude-agentic", "model": "claude-opus-4-8-1m", "change_class": "architecture", "status": "discard", "kept": false, "val_score": 0.8781355023384094, "headroom": 0.0, "params_M": 3.822787, "train_n": 400, "rationale": "fastdiff_flow_pixel_constrained-claude-agentic: image_size=512, pixel_spacing=0.3516, n_angles=128, n_det=1024, det_spacing=0.35754, sod=500.0, sdd=1000.0, display_min=0.0, display_max=0.5, train_n=400, val_n=200, noise_i0=100000.0, noise_sigma_e=10.0, seed=42, dataset_kind=breast_ct, fd_recon_ckpt=/cluster/maier/Agent4CT/checkpoints/fast_diffusion_pixel_breast.pt, fd_recon_steps=8, fd_recon_init=fbp, fd_recon_init_t=0.05, fd_recon_eta=1.0, fd_recon_dc=1, fd_recon_dc_n_cg=20, fd_recon_dc_relax=1.0, rationale=iter-7 EXPLORATORY single knob dc_n_cg 30->20 (map LEFT of the peak). SIX-BOX: (1)PRIOR: KEY FINDING - the DC CG solve shows SEMI-CONVERGENCE on the noisy sparse-view data: n_cg5 rmse0.00669 hr0; n_cg30 rmse0.004924 hr=0.0557 (BEST, beats FBP0.00521); n_cg60 rmse0.00992 hr0 (WORSE - too-deep CG re-amplifies sparse-view/measurement noise, classic ill-posed LS semi-convergence). The optimum is near n_cg~30. (2)FAILURE: n_cg is a one-dimensional peak; 30 may not be the exact argmax. (3)ONE KNOB: dc_n_cg 30->20 (probe left of peak; init_t0.05/relax1.0/steps8/eta1.0 held). (4)HYPOTHESIS: n_cg20 lands between n_cg5(hr0) and n_cg30(hr0.0557) - if hr(20) < hr(30) it confirms 30 is near-optimal from the left; if hr(20) > hr(30) the peak is lower. Refines the argmax hr. (5)BUDGET: 20 CG < 30 CG, faster than iter-5 (~4min). (6)Serial.", "advice_for_others": "fastdiff_flow_pixel_constrained-claude-agentic: image_size=512, pixel_spacing=0.3516, n_angles=128, n_det=1024, det_spacing=0.35754, sod=500.0, sdd=1000.0, display_min=0.0, display_max=0.5, train_n=400, val_n=200, noise_i0=100000.0, noise_sigma_e=10.0, seed=42, dataset_kind=breast_ct, fd_recon_ckpt=/cluster/maier/Agent4CT/checkpoints/fast_diffusion_pixel_breast.pt, fd_recon_steps=8, fd_recon_init=fbp, fd_recon_init_t=0.05, fd_recon_eta=1.0, fd_recon_dc=1, fd_recon_dc_n_cg=20, fd_recon_dc_relax=1.0, rationale=iter-7 EXPLORATORY single knob dc_n_cg 30->20 (map LEFT of the peak). SIX-BOX: (1)PRIOR: KEY FINDING - the DC CG solve shows SEMI-CONVERGENCE on the noisy sparse-view data: n_cg5 rmse0.00669 hr0; n_cg30 rmse0.004924 hr=0.0557 (BEST, beats FBP0.00521); n_cg60 rmse0.00992 hr0 (WORSE - too-deep CG re-amplifies sparse-view/measurement noise, classic ill-posed LS semi-convergence). The optimum is near n_cg~30. (2)FAILURE: n_cg is a one-dimensional peak; 30 may not be the exact argmax. (3)ONE KNOB: dc_n_cg 30->20 (probe left of peak; init_t0.05/relax1.0/steps8/eta1.0 held). (4)HYPOTHESIS: n_cg20 lands between n_cg5(hr0) and n_cg30(hr0.0557) - if hr(20) < hr(30) it confirms 30 is near-optimal from the left; if hr(20) > hr(30) the peak is lower. Refines the argmax hr. (5)BUDGET: 20 CG < 30 CG, faster than iter-5 (~4min). (6)Serial.", "comparison_image": "runs/breast-ct-claude-agentic-fastdiff-flow-pixel-constrained-search-20260703-01/iterations/iter-0007/comparison.png"}
{"ts": "2026-07-06T21:23:36Z", "run_id": "breast-ct-claude-agentic-fastdiff-flow-pixel-unconstrained-search-20260703-01", "iter": 17, "agent": "fastdiff_flow_pixel_unconstrained-claude-agentic", "model": "claude-opus-4-8-1m", "change_class": "architecture", "status": "keep", "kept": true, "val_score": 0.9746328592300415, "headroom": 0.20885344157568209, "params_M": 3.822787, "train_n": 3600, "rationale": "fastdiff_flow_pixel_unconstrained-claude-agentic: image_size=512, pixel_spacing=0.3516, n_angles=128, n_det=1024, det_spacing=0.35754, sod=500.0, sdd=1000.0, display_min=0.0, display_max=0.5, train_n=400, val_n=200, noise_i0=100000.0, noise_sigma_e=10.0, seed=123, fd_recon_ckpt=/cluster/maier/Agent4CT/checkpoints/fast_diffusion_pixel_breast.pt, fd_recon_steps=8, fd_recon_init=fbp, fd_recon_init_t=0.02, fd_recon_eta=0.1, fd_recon_dc=0, fd_recon_dc_n_cg=5, fd_recon_dc_relax=0.5, rationale=iter-17: DC-off breast-prior. ROBUSTNESS check of the champion (iter-14: init_t0.02/eta0.1/steps8, hr0.2085). ONE KNOB seed 42->123 (different val-slice draw + sampler noise). PRIOR: hr peak firmly at init_t~0.02 (3 KEEPs 14/15/16). README caveat: don't over-trust a single hr number - confirm the cross is seed-robust, not val-draw luck. HYPOTHESIS: hr stays ~0.20 at seed=123 => the DC-off breast prior's baseline-clearing is REAL and reproducible, not a favourable-draw artefact. If hr collapses, the cross was seed-fragile (would qualify the finding).", "advice_for_others": "fastdiff_flow_pixel_unconstrained-claude-agentic: image_size=512, pixel_spacing=0.3516, n_angles=128, n_det=1024, det_spacing=0.35754, sod=500.0, sdd=1000.0, display_min=0.0, display_max=0.5, train_n=400, val_n=200, noise_i0=100000.0, noise_sigma_e=10.0, seed=123, fd_recon_ckpt=/cluster/maier/Agent4CT/checkpoints/fast_diffusion_pixel_breast.pt, fd_recon_steps=8, fd_recon_init=fbp, fd_recon_init_t=0.02, fd_recon_eta=0.1, fd_recon_dc=0, fd_recon_dc_n_cg=5, fd_recon_dc_relax=0.5, rationale=iter-17: DC-off breast-prior. ROBUSTNESS check of the champion (iter-14: init_t0.02/eta0.1/steps8, hr0.2085). ONE KNOB seed 42->123 (different val-slice draw + sampler noise). PRIOR: hr peak firmly at init_t~0.02 (3 KEEPs 14/15/16). README caveat: don't over-trust a single hr number - confirm the cross is seed-robust, not val-draw luck. HYPOTHESIS: hr stays ~0.20 at seed=123 => the DC-off breast prior's baseline-clearing is REAL and reproducible, not a favourable-draw artefact. If hr collapses, the cross was seed-fragile (would qualify the finding).", "comparison_image": "runs/breast-ct-claude-agentic-fastdiff-flow-pixel-unconstrained-search-20260703-01/iterations/iter-0017/comparison.png"}
