{"ts": "2026-07-07T18:19:57Z", "run_id": "breast-ct-claude-agentic-param-efficient-search-20260703-01", "iter": 30, "agent": "param_efficient-claude-agentic", "model": "claude-opus-4-8-1m", "change_class": "architecture", "status": "keep", "kept": true, "val_score": 0.9830815196037292, "headroom": 0.5522595087210291, "params_M": 0.000195, "train_n": 200, "rationale": "param_efficient-claude-agentic: reg_type=bilateral, bilateral_on_top=False, proj_filter_on=False, n_iter=30, learnable_alpha=True, alpha_init=0.1, foe_n_filters=24, foe_kernel=7, foe_n_bumps=31, n_bf=1, bf_multiscale=True, bf_sigmas=[0.8, 1.6, 3.2], bf_kernel=7, bf_sigma_r=0.02, bf_gain_init=0.0, epochs=16, cosine_lr=True, lr=0.005, max_train_s=1080, batch_size=4, train_n=200, val_n=200, display_min=0.0, display_max=0.05, seed=42, rationale=iter-30 param_efficient breast -- TUNE post-filter range sigma_r 0.02->0.03. SIX-BOX: (1) PRIOR: 3-scale post-filter = CHAMPION 0.6201 @ 195p; 5-scale (iter-29) 0.617 marginally lower -> 3 scales is the scale optimum. sigma_r (range/edge-preservation width) untuned; it is the highest-leverage post-filter knob (controls streak-removal vs detail-preservation). (2) FAILURE MODE: sigma_r=0.02 may be too tight -- leaving streak-noise the wider gate would remove. (3) ONE KNOB: post_bf_sigma_r 0.02->0.03 (wider range gate). Note: sigma_r is a learnable INIT (log_sr trains), so this shifts the starting point; g_i zero-init still => identity at init => no regression. 195 params (unchanged). All else byte-for-byte iter-28. (4) HYPOTHESIS: a slightly wider range gate removes more residual streak-noise at the output while the tight-enough kernel still preserves fibroglandular edges -> hr climbs past 0.6201. OR it over-smooths (hr drops) -> 0.02 was optimal. Cheap 1-knob probe of the peak post-filter. (5) BUDGET: identical to iter-28 (3 output bilaterals); train_n=200, max_train_s=1080, --time=00:30:00, 200-val -> 20-min. (6) SERIAL; iter-31: LOCK champion (best of iter-28 vs iter-30), then SEED REPLICATES for mean+-std + check if post-filter reduces seed variance vs LPD-only 0.459+-0.029., dc_mode=filtered, per_step_alpha=True, lpd_on=True, lpd_width=4, lpd_kernel=3, anisotropic_on_top=False, post_bilateral=True, post_n_bf=3, post_bf_kernel=7, post_bf_sigma_r=0.03", "advice_for_others": "param_efficient-claude-agentic: reg_type=bilateral, bilateral_on_top=False, proj_filter_on=False, n_iter=30, learnable_alpha=True, alpha_init=0.1, foe_n_filters=24, foe_kernel=7, foe_n_bumps=31, n_bf=1, bf_multiscale=True, bf_sigmas=[0.8, 1.6, 3.2], bf_kernel=7, bf_sigma_r=0.02, bf_gain_init=0.0, epochs=16, cosine_lr=True, lr=0.005, max_train_s=1080, batch_size=4, train_n=200, val_n=200, display_min=0.0, display_max=0.05, seed=42, rationale=iter-30 param_efficient breast -- TUNE post-filter range sigma_r 0.02->0.03. SIX-BOX: (1) PRIOR: 3-scale post-filter = CHAMPION 0.6201 @ 195p; 5-scale (iter-29) 0.617 marginally lower -> 3 scales is the scale optimum. sigma_r (range/edge-preservation width) untuned; it is the highest-leverage post-filter knob (controls streak-removal vs detail-preservation). (2) FAILURE MODE: sigma_r=0.02 may be too tight -- leaving streak-noise the wider gate would remove. (3) ONE KNOB: post_bf_sigma_r 0.02->0.03 (wider range gate). Note: sigma_r is a learnable INIT (log_sr trains), so this shifts the starting point; g_i zero-init still => identity at init => no regression. 195 params (unchanged). All else byte-for-byte iter-28. (4) HYPOTHESIS: a slightly wider range gate removes more residual streak-noise at the output while the tight-enough kernel still preserves fibroglandular edges -> hr climbs past 0.6201. OR it over-smooths (hr drops) -> 0.02 was optimal. Cheap 1-knob probe of the peak post-filter. (5) BUDGET: identical to iter-28 (3 output bilaterals); train_n=200, max_train_s=1080, --time=00:30:00, 200-val -> 20-min. (6) SERIAL; iter-31: LOCK champion (best of iter-28 vs iter-30), then SEED REPLICATES for mean+-std + check if post-filter reduces seed variance vs LPD-only 0.459+-0.029., dc_mode=filtered, per_step_alpha=True, lpd_on=True, lpd_width=4, lpd_kernel=3, anisotropic_on_top=False, post_bilateral=True, post_n_bf=3, post_bf_kernel=7, post_bf_sigma_r=0.03", "comparison_image": "runs/breast-ct-claude-agentic-param-efficient-search-20260703-01/iterations/iter-0030/comparison.png"}
{"ts": "2026-07-07T17:01:19Z", "run_id": "breast-ct-claude-agentic-param-efficient-search-20260703-01", "iter": 29, "agent": "param_efficient-claude-agentic", "model": "claude-opus-4-8-1m", "change_class": "architecture", "status": "keep", "kept": true, "val_score": 0.990505576133728, "headroom": 0.6169889339571224, "params_M": 0.000203, "train_n": 200, "rationale": "param_efficient-claude-agentic: reg_type=bilateral, bilateral_on_top=False, proj_filter_on=False, n_iter=30, learnable_alpha=True, alpha_init=0.1, foe_n_filters=24, foe_kernel=7, foe_n_bumps=31, n_bf=1, bf_multiscale=True, bf_sigmas=[0.8, 1.6, 3.2], bf_kernel=7, bf_sigma_r=0.02, bf_gain_init=0.0, epochs=16, cosine_lr=True, lr=0.005, max_train_s=1080, batch_size=4, train_n=200, val_n=200, display_min=0.0, display_max=0.05, seed=42, rationale=iter-29 param_efficient breast -- TUNE post-filter: n_bf 3->5 scales. SIX-BOX: (1) PRIOR: iter-28 BREAKTHROUGH -- multi-scale bilateral POST-filter (3 scales, output denoiser) jumped hr 0.5047->0.6201 @ 195p, PSNR 44.73, full 16ep. VN-tier hr (~0.62) at ~46x fewer params than VN 9k. The +0.12 jump suggests more post-filter headroom. (2) FAILURE MODE: 3 scales may under-cover the streak-noise spectrum the output carries. (3) ONE KNOB: post_n_bf 3->5 (more edge-preserving scales in the output bilateral bank). g_i zero-init => identity at init => starts == the 0.6201 champion byte-for-byte (worst case 0.6201, no regression). +8 params (2 more filters x 4) -> 203 total. All else byte-for-byte iter-28. (4) HYPOTHESIS: more output-denoiser scales clean residual streak-noise across more spatial bandwidths -> hr climbs past 0.6201 toward 0.68. OR it saturates at ~0.62 (3 scales already cover it) -> peak found. (5) BUDGET: 5 bilaterals applied ONCE at output (cheap); iter-28 finished 16ep in 1120s -> ~16ep; train_n=200, max_train_s=1080, --time=00:30:00, 200-val -> 20-min comparable. (6) SERIAL; iter-30: tune sigma_r or a 2nd post-pass if 5 helps; then SEED REPLICATES of the peak post-filter champion for mean+-std., dc_mode=filtered, per_step_alpha=True, lpd_on=True, lpd_width=4, lpd_kernel=3, anisotropic_on_top=False, post_bilateral=True, post_n_bf=5, post_bf_kernel=7, post_bf_sigma_r=0.02", "advice_for_others": "param_efficient-claude-agentic: reg_type=bilateral, bilateral_on_top=False, proj_filter_on=False, n_iter=30, learnable_alpha=True, alpha_init=0.1, foe_n_filters=24, foe_kernel=7, foe_n_bumps=31, n_bf=1, bf_multiscale=True, bf_sigmas=[0.8, 1.6, 3.2], bf_kernel=7, bf_sigma_r=0.02, bf_gain_init=0.0, epochs=16, cosine_lr=True, lr=0.005, max_train_s=1080, batch_size=4, train_n=200, val_n=200, display_min=0.0, display_max=0.05, seed=42, rationale=iter-29 param_efficient breast -- TUNE post-filter: n_bf 3->5 scales. SIX-BOX: (1) PRIOR: iter-28 BREAKTHROUGH -- multi-scale bilateral POST-filter (3 scales, output denoiser) jumped hr 0.5047->0.6201 @ 195p, PSNR 44.73, full 16ep. VN-tier hr (~0.62) at ~46x fewer params than VN 9k. The +0.12 jump suggests more post-filter headroom. (2) FAILURE MODE: 3 scales may under-cover the streak-noise spectrum the output carries. (3) ONE KNOB: post_n_bf 3->5 (more edge-preserving scales in the output bilateral bank). g_i zero-init => identity at init => starts == the 0.6201 champion byte-for-byte (worst case 0.6201, no regression). +8 params (2 more filters x 4) -> 203 total. All else byte-for-byte iter-28. (4) HYPOTHESIS: more output-denoiser scales clean residual streak-noise across more spatial bandwidths -> hr climbs past 0.6201 toward 0.68. OR it saturates at ~0.62 (3 scales already cover it) -> peak found. (5) BUDGET: 5 bilaterals applied ONCE at output (cheap); iter-28 finished 16ep in 1120s -> ~16ep; train_n=200, max_train_s=1080, --time=00:30:00, 200-val -> 20-min comparable. (6) SERIAL; iter-30: tune sigma_r or a 2nd post-pass if 5 helps; then SEED REPLICATES of the peak post-filter champion for mean+-std., dc_mode=filtered, per_step_alpha=True, lpd_on=True, lpd_width=4, lpd_kernel=3, anisotropic_on_top=False, post_bilateral=True, post_n_bf=5, post_bf_kernel=7, post_bf_sigma_r=0.02", "comparison_image": "runs/breast-ct-claude-agentic-param-efficient-search-20260703-01/iterations/iter-0029/comparison.png"}
{"ts": "2026-07-07T16:24:48Z", "run_id": "breast-ct-claude-agentic-param-efficient-search-20260703-01", "iter": 28, "agent": "param_efficient-claude-agentic", "model": "claude-opus-4-8-1m", "change_class": "architecture", "status": "keep", "kept": true, "val_score": 0.9906948804855347, "headroom": 0.6200783043564111, "params_M": 0.000195, "train_n": 200, "rationale": "param_efficient-claude-agentic: reg_type=bilateral, bilateral_on_top=False, proj_filter_on=False, n_iter=30, learnable_alpha=True, alpha_init=0.1, foe_n_filters=24, foe_kernel=7, foe_n_bumps=31, n_bf=1, bf_multiscale=True, bf_sigmas=[0.8, 1.6, 3.2], bf_kernel=7, bf_sigma_r=0.02, bf_gain_init=0.0, epochs=16, cosine_lr=True, lr=0.005, max_train_s=1080, batch_size=4, train_n=200, val_n=200, display_min=0.0, display_max=0.05, seed=42, rationale=iter-28 param_efficient breast -- MULTI-SCALE BILATERAL POST-FILTER (output denoiser, highest remaining upside). SIX-BOX: (1) PRIOR: champion LPD-combine W=4 filtered-DC K=30 = 0.4590+-0.0294 (best 0.5047) @ 183p. In-loop prox FAILED (iters13-14/24, hr 0.0) -- but that was INSIDE the DC step. fastdiff finding: an edge-preserving denoiser helps at the OUTPUT, not in-loop. UNTESTED here. (2) FAILURE MODE: the data-consistent recon still carries residual streak-noise the DC+LPD leaves; a light output bilateral could clean it WITHOUT disturbing the DC (it is post-hoc, not in the consistency loop). (3) ONE KNOB: post_bilateral=True -- a 3-scale edge-preserving bilateral bank on the FINAL x: x_out = x + Sum_i g_i*(BF_i(x)-x), g_i ZERO-INIT => identity at init => pipeline == the 0.5047 champion BYTE-FOR-BYTE. +12 params (3 filters x (3 sigma + 1 gain)) -> 195 total. sigma_r=0.02 tight range kernel (edge-preserving, cannot over-smooth fibroglandular detail). All else byte-for-byte iter-15. (4) HYPOTHESIS: a light multi-scale edge-preserving denoiser on the OUTPUT removes residual streak-noise the unroll leaves -> hr climbs past 0.5047, because the denoiser role (output) is productive where the in-loop prox role was not. (5) BUDGET: 3 bilaterals applied ONCE at output (cheap vs K=30 unroll); iter-15 finished 16ep in 1020s -> ~14-16ep; train_n=200, max_train_s=1080, --time=00:30:00, 200-val -> 20-min. (6) SERIAL; iter-29: if post-BF helps, tune scales/sigma_r; else record + continue menu (learned per-step DC schedule, 2-step LPD, grad-clip variance reduction)., dc_mode=filtered, per_step_alpha=True, lpd_on=True, lpd_width=4, lpd_kernel=3, anisotropic_on_top=False, post_bilateral=True, post_n_bf=3, post_bf_kernel=7, post_bf_sigma_r=0.02", "advice_for_others": "param_efficient-claude-agentic: reg_type=bilateral, bilateral_on_top=False, proj_filter_on=False, n_iter=30, learnable_alpha=True, alpha_init=0.1, foe_n_filters=24, foe_kernel=7, foe_n_bumps=31, n_bf=1, bf_multiscale=True, bf_sigmas=[0.8, 1.6, 3.2], bf_kernel=7, bf_sigma_r=0.02, bf_gain_init=0.0, epochs=16, cosine_lr=True, lr=0.005, max_train_s=1080, batch_size=4, train_n=200, val_n=200, display_min=0.0, display_max=0.05, seed=42, rationale=iter-28 param_efficient breast -- MULTI-SCALE BILATERAL POST-FILTER (output denoiser, highest remaining upside). SIX-BOX: (1) PRIOR: champion LPD-combine W=4 filtered-DC K=30 = 0.4590+-0.0294 (best 0.5047) @ 183p. In-loop prox FAILED (iters13-14/24, hr 0.0) -- but that was INSIDE the DC step. fastdiff finding: an edge-preserving denoiser helps at the OUTPUT, not in-loop. UNTESTED here. (2) FAILURE MODE: the data-consistent recon still carries residual streak-noise the DC+LPD leaves; a light output bilateral could clean it WITHOUT disturbing the DC (it is post-hoc, not in the consistency loop). (3) ONE KNOB: post_bilateral=True -- a 3-scale edge-preserving bilateral bank on the FINAL x: x_out = x + Sum_i g_i*(BF_i(x)-x), g_i ZERO-INIT => identity at init => pipeline == the 0.5047 champion BYTE-FOR-BYTE. +12 params (3 filters x (3 sigma + 1 gain)) -> 195 total. sigma_r=0.02 tight range kernel (edge-preserving, cannot over-smooth fibroglandular detail). All else byte-for-byte iter-15. (4) HYPOTHESIS: a light multi-scale edge-preserving denoiser on the OUTPUT removes residual streak-noise the unroll leaves -> hr climbs past 0.5047, because the denoiser role (output) is productive where the in-loop prox role was not. (5) BUDGET: 3 bilaterals applied ONCE at output (cheap vs K=30 unroll); iter-15 finished 16ep in 1020s -> ~14-16ep; train_n=200, max_train_s=1080, --time=00:30:00, 200-val -> 20-min. (6) SERIAL; iter-29: if post-BF helps, tune scales/sigma_r; else record + continue menu (learned per-step DC schedule, 2-step LPD, grad-clip variance reduction)., dc_mode=filtered, per_step_alpha=True, lpd_on=True, lpd_width=4, lpd_kernel=3, anisotropic_on_top=False, post_bilateral=True, post_n_bf=3, post_bf_kernel=7, post_bf_sigma_r=0.02", "comparison_image": "runs/breast-ct-claude-agentic-param-efficient-search-20260703-01/iterations/iter-0028/comparison.png"}
{"ts": "2026-07-07T15:46:45Z", "run_id": "breast-ct-claude-agentic-param-efficient-search-20260703-01", "iter": 27, "agent": "param_efficient-claude-agentic", "model": "claude-opus-4-8-1m", "change_class": "architecture", "status": "discard", "kept": false, "val_score": 0.8458541035652161, "headroom": 0.0, "params_M": 1.4e-05, "train_n": 200, "rationale": "param_efficient-claude-agentic: reg_type=bilateral, bilateral_on_top=False, proj_filter_on=False, n_iter=30, learnable_alpha=True, alpha_init=0.1, foe_n_filters=24, foe_kernel=7, foe_n_bumps=31, n_bf=3, bf_multiscale=True, bf_sigmas=[0.8, 1.6, 3.2], bf_kernel=7, bf_sigma_r=0.02, bf_gain_init=0.0, epochs=16, cosine_lr=True, lr=0.005, max_train_s=1080, batch_size=4, train_n=200, val_n=200, display_min=0.0, display_max=0.05, seed=42, rationale=iter-27 param_efficient breast -- DIAGNOSTIC: CG-DC WITHOUT LPD-combine (isolate the mismatch). SIX-BOX: (1) PRIOR: CG-DC + LPD-combine gave 0.2362 (n_cg5) / 0.2427 (n_cg2, 5ep) -- far below filtered-DC+LPD 0.5047 AND below filtered-DC+bilateral 0.4345 (iter-11). iter-26 reached 5 epochs (not just starved), so the pattern = INTEGRATION MISMATCH: the CG least-squares solution doesn't compose with the LPD-combine, which learned to route the SINGLE filtered-gradient correction. (2) FAILURE MODE (to isolate): is CG-DC bad vs filtered-DC in general, or only bad WITH the LPD-combine? (3) ONE KNOB: lpd_on True->False on the CG-DC config (raw CG-DC prox-grad unroll + 3-scale bilateral gate, the iter-11 structure but with dc_mode=cg instead of filtered). n_cg=2, K=30, seed42, ~15 params. (4) HYPOTHESIS: if raw CG-DC + bilateral reaches ~0.4345 (filtered-DC+bilateral's level), the problem is specifically CG-DC-vs-LPD-combine (CG doesn't compose with the learned router) -> filtered-gradient is the right DC for the LPD-combine. If raw CG-DC + bilateral ALSO underperforms filtered-DC+bilateral, then CG-DC is just worse per-projector-call under the wall regardless of the combiner. Either way isolates the finding. (5) BUDGET: n_cg=2 x K=30 + bilateral, train_n=200, max_train_s=1080, --time=00:30:00, 200-val -> 20-min comparable. (6) SERIAL; iter-28: CONCLUDE CG-DC, then continue menu (multi-scale bilateral POST-filter, learned per-step DC schedule, 2-step LPD)., dc_mode=cg, per_step_alpha=False, cg_n=2, cg_lam_init=0.01, lpd_on=False", "advice_for_others": "param_efficient-claude-agentic: reg_type=bilateral, bilateral_on_top=False, proj_filter_on=False, n_iter=30, learnable_alpha=True, alpha_init=0.1, foe_n_filters=24, foe_kernel=7, foe_n_bumps=31, n_bf=3, bf_multiscale=True, bf_sigmas=[0.8, 1.6, 3.2], bf_kernel=7, bf_sigma_r=0.02, bf_gain_init=0.0, epochs=16, cosine_lr=True, lr=0.005, max_train_s=1080, batch_size=4, train_n=200, val_n=200, display_min=0.0, display_max=0.05, seed=42, rationale=iter-27 param_efficient breast -- DIAGNOSTIC: CG-DC WITHOUT LPD-combine (isolate the mismatch). SIX-BOX: (1) PRIOR: CG-DC + LPD-combine gave 0.2362 (n_cg5) / 0.2427 (n_cg2, 5ep) -- far below filtered-DC+LPD 0.5047 AND below filtered-DC+bilateral 0.4345 (iter-11). iter-26 reached 5 epochs (not just starved), so the pattern = INTEGRATION MISMATCH: the CG least-squares solution doesn't compose with the LPD-combine, which learned to route the SINGLE filtered-gradient correction. (2) FAILURE MODE (to isolate): is CG-DC bad vs filtered-DC in general, or only bad WITH the LPD-combine? (3) ONE KNOB: lpd_on True->False on the CG-DC config (raw CG-DC prox-grad unroll + 3-scale bilateral gate, the iter-11 structure but with dc_mode=cg instead of filtered). n_cg=2, K=30, seed42, ~15 params. (4) HYPOTHESIS: if raw CG-DC + bilateral reaches ~0.4345 (filtered-DC+bilateral's level), the problem is specifically CG-DC-vs-LPD-combine (CG doesn't compose with the learned router) -> filtered-gradient is the right DC for the LPD-combine. If raw CG-DC + bilateral ALSO underperforms filtered-DC+bilateral, then CG-DC is just worse per-projector-call under the wall regardless of the combiner. Either way isolates the finding. (5) BUDGET: n_cg=2 x K=30 + bilateral, train_n=200, max_train_s=1080, --time=00:30:00, 200-val -> 20-min comparable. (6) SERIAL; iter-28: CONCLUDE CG-DC, then continue menu (multi-scale bilateral POST-filter, learned per-step DC schedule, 2-step LPD)., dc_mode=cg, per_step_alpha=False, cg_n=2, cg_lam_init=0.01, lpd_on=False", "comparison_image": "runs/breast-ct-claude-agentic-param-efficient-search-20260703-01/iterations/iter-0027/comparison.png"}
