{"ts": "2026-07-07T05:22:48Z", "run_id": "breast-ct-claude-agentic-param-efficient-search-20260703-01", "iter": 14, "agent": "param_efficient-claude-agentic", "model": "claude-opus-4-8-1m", "change_class": "architecture", "status": "discard", "kept": false, "val_score": 0.8270629644393921, "headroom": 0.0, "params_M": 1.6e-05, "train_n": 200, "rationale": "param_efficient-claude-agentic: reg_type=bilateral, bilateral_on_top=False, proj_filter_on=False, n_iter=30, learnable_alpha=True, alpha_init=0.1, foe_n_filters=24, foe_kernel=7, foe_n_bumps=31, n_bf=3, bf_multiscale=True, bf_sigmas=[0.8, 1.6, 3.2], bf_kernel=7, bf_sigma_r=0.02, bf_gain_init=0.0, epochs=16, cosine_lr=True, lr=0.005, max_train_s=1080, batch_size=4, train_n=200, val_n=200, display_min=0.0, display_max=0.05, seed=42, rationale=iter-14 param_efficient breast -- CAPACITY-STACK #2: DIRECTIONAL STREAK REG on the lean filtered-DC unroll (solver edit, 20-min budget). SIX-BOX: (1) PRIOR: iter-13 (+300-param FoE prox) gave hr 0.0 -- PSNR 34.3 < baseline. NOT undertrained (loss converged 3.8e-3->4.4e-5 by ep5, gains engaged ~0.28). READ: a learned FoE ISOTROPIC smoother FIGHTS filtered-DC -- fbp(Rx-g) already produces a complete ramp-filtered reconstruction each step, so an added smoothing prior just OVER-SMOOTHS the recon the DC just made (the FoE solves the streak-smearing problem filtered-DC ALREADY solved -> pure drag). So on filtered-DC, isotropic prox capacity is a LIABILITY. (2) FAILURE MODE (iter-13): isotropic prox over-smooths the filtered-DC reconstruction. (3) ONE KNOB: add a DIRECTIONAL (oriented) streak reg on the LEAN bilateral path (I edited build_reg to compose ComposedBilateralAnisotropicReg -- bilateral gate + AnisotropicOrientedReg, NO FoE). +3 params (2 sigma along/across + 1 zero-init gain over 4 fixed orientations) -> 16 total. Zero-init gain => reg==bilateral==champion BYTE-FOR-BYTE at init (worst case == 0.4345, no regression). (4) HYPOTHESIS: unlike the isotropic FoE, the oriented reg smooths ALONG residual streak directions while PRESERVING across them, so it removes the specific directional streaks filtered-DC leaves WITHOUT the isotropic over-smoothing that killed iter-13 -> hr climbs past 0.4345. This is the sparse-view-NATIVE prox form (streaks are directional). (5) BUDGET: K=30 filtered + lean bilat + aniso (analytic oriented kernels, cheap), train_n=200, max_train_s=1080, --time=00:30:00, 200-val -> 20-min comparable. (6) SERIAL; iter-15 self-dispatches (next: if directional helps, tune orientations/sigmas; if not, LPD dual-update block or accept 0.4345 @ 13p as the honest ceiling)., dc_mode=filtered, per_step_alpha=False, anisotropic_on_top=True, aniso_n_orient=4, aniso_kernel=7, aniso_sigma_along=2.0, aniso_sigma_across=0.6, aniso_gain_init=0.0", "advice_for_others": "param_efficient-claude-agentic: reg_type=bilateral, bilateral_on_top=False, proj_filter_on=False, n_iter=30, learnable_alpha=True, alpha_init=0.1, foe_n_filters=24, foe_kernel=7, foe_n_bumps=31, n_bf=3, bf_multiscale=True, bf_sigmas=[0.8, 1.6, 3.2], bf_kernel=7, bf_sigma_r=0.02, bf_gain_init=0.0, epochs=16, cosine_lr=True, lr=0.005, max_train_s=1080, batch_size=4, train_n=200, val_n=200, display_min=0.0, display_max=0.05, seed=42, rationale=iter-14 param_efficient breast -- CAPACITY-STACK #2: DIRECTIONAL STREAK REG on the lean filtered-DC unroll (solver edit, 20-min budget). SIX-BOX: (1) PRIOR: iter-13 (+300-param FoE prox) gave hr 0.0 -- PSNR 34.3 < baseline. NOT undertrained (loss converged 3.8e-3->4.4e-5 by ep5, gains engaged ~0.28). READ: a learned FoE ISOTROPIC smoother FIGHTS filtered-DC -- fbp(Rx-g) already produces a complete ramp-filtered reconstruction each step, so an added smoothing prior just OVER-SMOOTHS the recon the DC just made (the FoE solves the streak-smearing problem filtered-DC ALREADY solved -> pure drag). So on filtered-DC, isotropic prox capacity is a LIABILITY. (2) FAILURE MODE (iter-13): isotropic prox over-smooths the filtered-DC reconstruction. (3) ONE KNOB: add a DIRECTIONAL (oriented) streak reg on the LEAN bilateral path (I edited build_reg to compose ComposedBilateralAnisotropicReg -- bilateral gate + AnisotropicOrientedReg, NO FoE). +3 params (2 sigma along/across + 1 zero-init gain over 4 fixed orientations) -> 16 total. Zero-init gain => reg==bilateral==champion BYTE-FOR-BYTE at init (worst case == 0.4345, no regression). (4) HYPOTHESIS: unlike the isotropic FoE, the oriented reg smooths ALONG residual streak directions while PRESERVING across them, so it removes the specific directional streaks filtered-DC leaves WITHOUT the isotropic over-smoothing that killed iter-13 -> hr climbs past 0.4345. This is the sparse-view-NATIVE prox form (streaks are directional). (5) BUDGET: K=30 filtered + lean bilat + aniso (analytic oriented kernels, cheap), train_n=200, max_train_s=1080, --time=00:30:00, 200-val -> 20-min comparable. (6) SERIAL; iter-15 self-dispatches (next: if directional helps, tune orientations/sigmas; if not, LPD dual-update block or accept 0.4345 @ 13p as the honest ceiling)., dc_mode=filtered, per_step_alpha=False, anisotropic_on_top=True, aniso_n_orient=4, aniso_kernel=7, aniso_sigma_along=2.0, aniso_sigma_across=0.6, aniso_gain_init=0.0", "comparison_image": "runs/breast-ct-claude-agentic-param-efficient-search-20260703-01/iterations/iter-0014/comparison.png"}
{"ts": "2026-07-07T04:38:24Z", "run_id": "breast-ct-claude-agentic-param-efficient-search-20260703-01", "iter": 13, "agent": "param_efficient-claude-agentic", "model": "claude-opus-4-8-1m", "change_class": "architecture", "status": "discard", "kept": false, "val_score": 0.9618072509765625, "headroom": 0.0, "params_M": 0.000301, "train_n": 200, "rationale": "param_efficient-claude-agentic: reg_type=foe, bilateral_on_top=True, proj_filter_on=False, n_iter=30, learnable_alpha=True, alpha_init=0.1, foe_n_filters=8, foe_kernel=5, foe_n_bumps=11, n_bf=3, bf_multiscale=True, bf_sigmas=[0.8, 1.6, 3.2], bf_kernel=7, bf_sigma_r=0.02, bf_gain_init=0.0, epochs=16, cosine_lr=True, lr=0.005, max_train_s=1080, batch_size=4, train_n=200, val_n=200, display_min=0.0, display_max=0.05, seed=42, rationale=iter-13 param_efficient breast -- CAPACITY-STACK #1: small FoE prox on the filtered-DC K=30 unroll (20-min budget). SIX-BOX: (1) PRIOR: filtered-DC (fbp(Rx-g)) is the sparse-view lever; 20-min K-sweep saturated at K=30 -> hr 0.4345 @ 13 params (CHAMPION). iter-12 diagnostic (K=40, 50-min, 10ep) gave only 0.368 -- CONFIRMS depth saturated ~K30 (alpha collapsed to 0.006). So depth is done; the climb toward VN 0.63 now needs CAPACITY. (2) FAILURE MODE: the 13-param bilateral gate lacks the learned-filter capacity VN uses to reach 0.63; it can preserve edges but not learn rich streak-removing priors. (3) ONE KNOB: reg_type bilateral->foe with bilateral_on_top=True at a SMALL FoE geometry (nf8/k5/nb11 = 300 reg params; total ~312 with alpha). All else byte-for-byte iter-11 (filtered-DC K=30, 20-min wall). FoE zero-init RBF => FoE(x)=0 at init AND bilateral gains zero-init => pipeline == the 0.4345 champion BYTE-FOR-BYTE at init (worst case == 0.4345, NO regression). (4) HYPOTHESIS: a small learned FoE filter bank (the mechanism that gets VN to 0.63) added to the filtered-DC unroll gives the prox genuine streak-removing capacity -> hr climbs past 0.4345 toward the VN regime, at ~312 params (still ~30x fewer than VN's 9k). Kept SMALL (300p) so it trains within the ~6 epochs K=30 allows in 20 min. (5) BUDGET: K=30 filtered + small FoE (nf8/k5 is CHEAP per step), train_n=200, max_train_s=1080, --time=00:30:00, 200-val -> 20-min budget, comparable to all solvers. (6) SERIAL; iter-14 self-dispatches (next: if FoE capacity helps, GROW nf/nb along the params-vs-hr frontier; if not, directional streak-reg instead)., dc_mode=filtered, per_step_alpha=False, foe_rbf_init_std=0.0", "advice_for_others": "param_efficient-claude-agentic: reg_type=foe, bilateral_on_top=True, proj_filter_on=False, n_iter=30, learnable_alpha=True, alpha_init=0.1, foe_n_filters=8, foe_kernel=5, foe_n_bumps=11, n_bf=3, bf_multiscale=True, bf_sigmas=[0.8, 1.6, 3.2], bf_kernel=7, bf_sigma_r=0.02, bf_gain_init=0.0, epochs=16, cosine_lr=True, lr=0.005, max_train_s=1080, batch_size=4, train_n=200, val_n=200, display_min=0.0, display_max=0.05, seed=42, rationale=iter-13 param_efficient breast -- CAPACITY-STACK #1: small FoE prox on the filtered-DC K=30 unroll (20-min budget). SIX-BOX: (1) PRIOR: filtered-DC (fbp(Rx-g)) is the sparse-view lever; 20-min K-sweep saturated at K=30 -> hr 0.4345 @ 13 params (CHAMPION). iter-12 diagnostic (K=40, 50-min, 10ep) gave only 0.368 -- CONFIRMS depth saturated ~K30 (alpha collapsed to 0.006). So depth is done; the climb toward VN 0.63 now needs CAPACITY. (2) FAILURE MODE: the 13-param bilateral gate lacks the learned-filter capacity VN uses to reach 0.63; it can preserve edges but not learn rich streak-removing priors. (3) ONE KNOB: reg_type bilateral->foe with bilateral_on_top=True at a SMALL FoE geometry (nf8/k5/nb11 = 300 reg params; total ~312 with alpha). All else byte-for-byte iter-11 (filtered-DC K=30, 20-min wall). FoE zero-init RBF => FoE(x)=0 at init AND bilateral gains zero-init => pipeline == the 0.4345 champion BYTE-FOR-BYTE at init (worst case == 0.4345, NO regression). (4) HYPOTHESIS: a small learned FoE filter bank (the mechanism that gets VN to 0.63) added to the filtered-DC unroll gives the prox genuine streak-removing capacity -> hr climbs past 0.4345 toward the VN regime, at ~312 params (still ~30x fewer than VN's 9k). Kept SMALL (300p) so it trains within the ~6 epochs K=30 allows in 20 min. (5) BUDGET: K=30 filtered + small FoE (nf8/k5 is CHEAP per step), train_n=200, max_train_s=1080, --time=00:30:00, 200-val -> 20-min budget, comparable to all solvers. (6) SERIAL; iter-14 self-dispatches (next: if FoE capacity helps, GROW nf/nb along the params-vs-hr frontier; if not, directional streak-reg instead)., dc_mode=filtered, per_step_alpha=False, foe_rbf_init_std=0.0", "comparison_image": "runs/breast-ct-claude-agentic-param-efficient-search-20260703-01/iterations/iter-0013/comparison.png"}
{"ts": "2026-07-07T04:26:12Z", "run_id": "breast-ct-claude-agentic-fastdiff-wdm-wavelet-unconstrained-search-20260703-01", "iter": 20, "agent": "fastdiff_wdm_wavelet_unconstrained-claude-agentic", "model": "claude-opus-4-8-1m", "change_class": "architecture", "status": "discard", "kept": false, "val_score": 0.9372475743293762, "headroom": 0.0, "params_M": 3.824908, "train_n": 3600, "rationale": "fastdiff_wdm_wavelet_unconstrained-claude-agentic: val_n=200, seed=48, fd_recon_ckpt=/cluster/maier/Agent4CT/checkpoints/fast_diffusion_wavelet_breast.pt, fd_recon_steps=8, fd_recon_init=fbp, fd_recon_init_t=0.45, fd_recon_eta=0.0, fd_recon_dc=0, fd_recon_dc_n_cg=5, fd_recon_dc_relax=0.5, dataset_kind=breast_ct, rationale=iter-20 FINAL seed 48 at converged best config (t0.45 eta0 steps8 DC-off); closes the 20-iter search. hr expected 0 -- prior WITHOUT DC cannot clear the sparse-view calibrated FBP baseline.", "advice_for_others": "fastdiff_wdm_wavelet_unconstrained-claude-agentic: val_n=200, seed=48, fd_recon_ckpt=/cluster/maier/Agent4CT/checkpoints/fast_diffusion_wavelet_breast.pt, fd_recon_steps=8, fd_recon_init=fbp, fd_recon_init_t=0.45, fd_recon_eta=0.0, fd_recon_dc=0, fd_recon_dc_n_cg=5, fd_recon_dc_relax=0.5, dataset_kind=breast_ct, rationale=iter-20 FINAL seed 48 at converged best config (t0.45 eta0 steps8 DC-off); closes the 20-iter search. hr expected 0 -- prior WITHOUT DC cannot clear the sparse-view calibrated FBP baseline.", "comparison_image": "runs/breast-ct-claude-agentic-fastdiff-wdm-wavelet-unconstrained-search-20260703-01/iterations/iter-0020/comparison.png"}
{"ts": "2026-07-07T04:24:39Z", "run_id": "breast-ct-claude-agentic-fastdiff-wdm-wavelet-unconstrained-search-20260703-01", "iter": 19, "agent": "fastdiff_wdm_wavelet_unconstrained-claude-agentic", "model": "claude-opus-4-8-1m", "change_class": "architecture", "status": "discard", "kept": false, "val_score": 0.9373195171356201, "headroom": 0.0, "params_M": 3.824908, "train_n": 3600, "rationale": "fastdiff_wdm_wavelet_unconstrained-claude-agentic: val_n=200, seed=47, fd_recon_ckpt=/cluster/maier/Agent4CT/checkpoints/fast_diffusion_wavelet_breast.pt, fd_recon_steps=8, fd_recon_init=fbp, fd_recon_init_t=0.45, fd_recon_eta=0.0, fd_recon_dc=0, fd_recon_dc_n_cg=5, fd_recon_dc_relax=0.5, dataset_kind=breast_ct, rationale=iter-19 SEED VARIANCE #5 seed 47 at best config. DC OFF. hr expected 0.", "advice_for_others": "fastdiff_wdm_wavelet_unconstrained-claude-agentic: val_n=200, seed=47, fd_recon_ckpt=/cluster/maier/Agent4CT/checkpoints/fast_diffusion_wavelet_breast.pt, fd_recon_steps=8, fd_recon_init=fbp, fd_recon_init_t=0.45, fd_recon_eta=0.0, fd_recon_dc=0, fd_recon_dc_n_cg=5, fd_recon_dc_relax=0.5, dataset_kind=breast_ct, rationale=iter-19 SEED VARIANCE #5 seed 47 at best config. DC OFF. hr expected 0.", "comparison_image": "runs/breast-ct-claude-agentic-fastdiff-wdm-wavelet-unconstrained-search-20260703-01/iterations/iter-0019/comparison.png"}
{"ts": "2026-07-07T04:23:08Z", "run_id": "breast-ct-claude-agentic-fastdiff-wdm-wavelet-unconstrained-search-20260703-01", "iter": 18, "agent": "fastdiff_wdm_wavelet_unconstrained-claude-agentic", "model": "claude-opus-4-8-1m", "change_class": "architecture", "status": "discard", "kept": false, "val_score": 0.9370551109313965, "headroom": 0.0, "params_M": 3.824908, "train_n": 3600, "rationale": "fastdiff_wdm_wavelet_unconstrained-claude-agentic: val_n=200, seed=46, fd_recon_ckpt=/cluster/maier/Agent4CT/checkpoints/fast_diffusion_wavelet_breast.pt, fd_recon_steps=8, fd_recon_init=fbp, fd_recon_init_t=0.45, fd_recon_eta=0.0, fd_recon_dc=0, fd_recon_dc_n_cg=5, fd_recon_dc_relax=0.5, dataset_kind=breast_ct, rationale=iter-18 SEED VARIANCE #4 seed 46 at best config. DC OFF. hr expected 0.", "advice_for_others": "fastdiff_wdm_wavelet_unconstrained-claude-agentic: val_n=200, seed=46, fd_recon_ckpt=/cluster/maier/Agent4CT/checkpoints/fast_diffusion_wavelet_breast.pt, fd_recon_steps=8, fd_recon_init=fbp, fd_recon_init_t=0.45, fd_recon_eta=0.0, fd_recon_dc=0, fd_recon_dc_n_cg=5, fd_recon_dc_relax=0.5, dataset_kind=breast_ct, rationale=iter-18 SEED VARIANCE #4 seed 46 at best config. DC OFF. hr expected 0.", "comparison_image": "runs/breast-ct-claude-agentic-fastdiff-wdm-wavelet-unconstrained-search-20260703-01/iterations/iter-0018/comparison.png"}
{"ts": "2026-07-07T04:21:26Z", "run_id": "breast-ct-claude-agentic-fastdiff-wdm-wavelet-unconstrained-search-20260703-01", "iter": 17, "agent": "fastdiff_wdm_wavelet_unconstrained-claude-agentic", "model": "claude-opus-4-8-1m", "change_class": "architecture", "status": "discard", "kept": false, "val_score": 0.9370124340057373, "headroom": 0.0, "params_M": 3.824908, "train_n": 3600, "rationale": "fastdiff_wdm_wavelet_unconstrained-claude-agentic: val_n=200, seed=45, fd_recon_ckpt=/cluster/maier/Agent4CT/checkpoints/fast_diffusion_wavelet_breast.pt, fd_recon_steps=8, fd_recon_init=fbp, fd_recon_init_t=0.45, fd_recon_eta=0.0, fd_recon_dc=0, fd_recon_dc_n_cg=5, fd_recon_dc_relax=0.5, dataset_kind=breast_ct, rationale=iter-17 SEED VARIANCE #3 seed 45 at best config. DC OFF. hr expected 0.", "advice_for_others": "fastdiff_wdm_wavelet_unconstrained-claude-agentic: val_n=200, seed=45, fd_recon_ckpt=/cluster/maier/Agent4CT/checkpoints/fast_diffusion_wavelet_breast.pt, fd_recon_steps=8, fd_recon_init=fbp, fd_recon_init_t=0.45, fd_recon_eta=0.0, fd_recon_dc=0, fd_recon_dc_n_cg=5, fd_recon_dc_relax=0.5, dataset_kind=breast_ct, rationale=iter-17 SEED VARIANCE #3 seed 45 at best config. DC OFF. hr expected 0.", "comparison_image": "runs/breast-ct-claude-agentic-fastdiff-wdm-wavelet-unconstrained-search-20260703-01/iterations/iter-0017/comparison.png"}
{"ts": "2026-07-07T04:19:47Z", "run_id": "breast-ct-claude-agentic-fastdiff-wdm-wavelet-unconstrained-search-20260703-01", "iter": 16, "agent": "fastdiff_wdm_wavelet_unconstrained-claude-agentic", "model": "claude-opus-4-8-1m", "change_class": "architecture", "status": "discard", "kept": false, "val_score": 0.9370037913322449, "headroom": 0.0, "params_M": 3.824908, "train_n": 3600, "rationale": "fastdiff_wdm_wavelet_unconstrained-claude-agentic: val_n=200, seed=44, fd_recon_ckpt=/cluster/maier/Agent4CT/checkpoints/fast_diffusion_wavelet_breast.pt, fd_recon_steps=8, fd_recon_init=fbp, fd_recon_init_t=0.45, fd_recon_eta=0.0, fd_recon_dc=0, fd_recon_dc_n_cg=5, fd_recon_dc_relax=0.5, dataset_kind=breast_ct, rationale=iter-16 SEED VARIANCE #2 seed 44 at best config. DC OFF. hr expected 0.", "advice_for_others": "fastdiff_wdm_wavelet_unconstrained-claude-agentic: val_n=200, seed=44, fd_recon_ckpt=/cluster/maier/Agent4CT/checkpoints/fast_diffusion_wavelet_breast.pt, fd_recon_steps=8, fd_recon_init=fbp, fd_recon_init_t=0.45, fd_recon_eta=0.0, fd_recon_dc=0, fd_recon_dc_n_cg=5, fd_recon_dc_relax=0.5, dataset_kind=breast_ct, rationale=iter-16 SEED VARIANCE #2 seed 44 at best config. DC OFF. hr expected 0.", "comparison_image": "runs/breast-ct-claude-agentic-fastdiff-wdm-wavelet-unconstrained-search-20260703-01/iterations/iter-0016/comparison.png"}
{"ts": "2026-07-07T04:18:14Z", "run_id": "breast-ct-claude-agentic-fastdiff-wdm-wavelet-unconstrained-search-20260703-01", "iter": 15, "agent": "fastdiff_wdm_wavelet_unconstrained-claude-agentic", "model": "claude-opus-4-8-1m", "change_class": "architecture", "status": "discard", "kept": false, "val_score": 0.936936616897583, "headroom": 0.0, "params_M": 3.824908, "train_n": 3600, "rationale": "fastdiff_wdm_wavelet_unconstrained-claude-agentic: val_n=200, seed=43, fd_recon_ckpt=/cluster/maier/Agent4CT/checkpoints/fast_diffusion_wavelet_breast.pt, fd_recon_steps=8, fd_recon_init=fbp, fd_recon_init_t=0.45, fd_recon_eta=0.0, fd_recon_dc=0, fd_recon_dc_n_cg=5, fd_recon_dc_relax=0.5, dataset_kind=breast_ct, rationale=iter-15 SEED VARIANCE #1 at converged best (t0.45 eta0 steps8 DC-off); seed 43 for final mean+/-std. hr expected 0.", "advice_for_others": "fastdiff_wdm_wavelet_unconstrained-claude-agentic: val_n=200, seed=43, fd_recon_ckpt=/cluster/maier/Agent4CT/checkpoints/fast_diffusion_wavelet_breast.pt, fd_recon_steps=8, fd_recon_init=fbp, fd_recon_init_t=0.45, fd_recon_eta=0.0, fd_recon_dc=0, fd_recon_dc_n_cg=5, fd_recon_dc_relax=0.5, dataset_kind=breast_ct, rationale=iter-15 SEED VARIANCE #1 at converged best (t0.45 eta0 steps8 DC-off); seed 43 for final mean+/-std. hr expected 0.", "comparison_image": "runs/breast-ct-claude-agentic-fastdiff-wdm-wavelet-unconstrained-search-20260703-01/iterations/iter-0015/comparison.png"}
{"ts": "2026-07-07T04:16:47Z", "run_id": "breast-ct-claude-agentic-fastdiff-wdm-wavelet-unconstrained-search-20260703-01", "iter": 14, "agent": "fastdiff_wdm_wavelet_unconstrained-claude-agentic", "model": "claude-opus-4-8-1m", "change_class": "architecture", "status": "discard", "kept": false, "val_score": 0.935730516910553, "headroom": 0.0, "params_M": 3.824908, "train_n": 3600, "rationale": "fastdiff_wdm_wavelet_unconstrained-claude-agentic: val_n=200, seed=42, fd_recon_ckpt=/cluster/maier/Agent4CT/checkpoints/fast_diffusion_wavelet_breast.pt, fd_recon_steps=8, fd_recon_init=fbp, fd_recon_init_t=0.5, fd_recon_eta=0.1, fd_recon_dc=0, fd_recon_dc_n_cg=5, fd_recon_dc_relax=0.5, dataset_kind=breast_ct, rationale=iter-14 ETA=0.1 fine-check between eta0(rmse0.01130) and eta0.2(0.01141) at t0.5; confirms eta~0 flat optimum. DC OFF. hr expected 0.", "advice_for_others": "fastdiff_wdm_wavelet_unconstrained-claude-agentic: val_n=200, seed=42, fd_recon_ckpt=/cluster/maier/Agent4CT/checkpoints/fast_diffusion_wavelet_breast.pt, fd_recon_steps=8, fd_recon_init=fbp, fd_recon_init_t=0.5, fd_recon_eta=0.1, fd_recon_dc=0, fd_recon_dc_n_cg=5, fd_recon_dc_relax=0.5, dataset_kind=breast_ct, rationale=iter-14 ETA=0.1 fine-check between eta0(rmse0.01130) and eta0.2(0.01141) at t0.5; confirms eta~0 flat optimum. DC OFF. hr expected 0.", "comparison_image": "runs/breast-ct-claude-agentic-fastdiff-wdm-wavelet-unconstrained-search-20260703-01/iterations/iter-0014/comparison.png"}
