{"ts": "2026-07-06T04:29:04Z", "run_id": "breast-ct-claude-agentic-dual-domain-n2i-search-20260703-01", "iter": 12, "agent": "dual_domain_n2i-claude-agentic", "model": "claude-opus-4-8-1m", "change_class": "architecture", "status": "discard", "kept": false, "val_score": 0.9436529278755188, "headroom": 0.0, "params_M": 0.465762, "train_n": 400, "rationale": "dual_domain_n2i-claude-agentic: warm_start=True, pretrain_epochs=3, pretrain_steps=0, n_iter=50, grad_clip=1.0, outer_wall_s=1400, per_scene_s=None, batch_size=1, lr=0.0003, optimizer=adam, unet_c=16, train_n=400, val_n=200, seed=314, rationale=iter-12 SIX-BOX. (1) PRIOR: iter-11 hr=0.0, grad_clip OFF gave rmse=0.00635, ssim=0.942 -- no better than clipped; removing the grad-norm damp did not sharpen. Iters 1-11 all hr=0. (2) FAILURE MODE: plain-UNet N2I regresses to the over-smoothed FBP mean; no edge-preserving structural guard (bilateral sibling range kernel hr~0.21 is what this solver lacks). (3) ONE KNOB: relative to iter-6 best reference (lr=3e-4, n_iter=50, c=16, grad_clip=1.0), seed 42 -> 314. (4) HYPOTHESIS: VARIANCE CHECK -- re-running the best config under a different RNG seed (warm-start init + train permutation) tests whether hr=0 is robust to seed or a one-off. If rmse lands ~0.0062-0.0064 again (hr=0), the ceiling is seed-independent and structural; a large swing would signal seed sensitivity. The breast VAL SPLIT is fixed (staged h5, seed-20260703), so seed only perturbs training RNG, not the val cases. Per the ceiling, expect hr=0 again. (5) BUDGET: identical to iter-6 (n_iter=50 fast); ~12 min << 30-min wall. (6) Loop continues; iter-13 self-dispatched. Reserved levers: lr=1e-4 very gentle, n_iter=400 high, pretrain_steps cap, batch_size=2 warm-start, pretrain_epochs=1 minimal warm-start.", "advice_for_others": "dual_domain_n2i-claude-agentic: warm_start=True, pretrain_epochs=3, pretrain_steps=0, n_iter=50, grad_clip=1.0, outer_wall_s=1400, per_scene_s=None, batch_size=1, lr=0.0003, optimizer=adam, unet_c=16, train_n=400, val_n=200, seed=314, rationale=iter-12 SIX-BOX. (1) PRIOR: iter-11 hr=0.0, grad_clip OFF gave rmse=0.00635, ssim=0.942 -- no better than clipped; removing the grad-norm damp did not sharpen. Iters 1-11 all hr=0. (2) FAILURE MODE: plain-UNet N2I regresses to the over-smoothed FBP mean; no edge-preserving structural guard (bilateral sibling range kernel hr~0.21 is what this solver lacks). (3) ONE KNOB: relative to iter-6 best reference (lr=3e-4, n_iter=50, c=16, grad_clip=1.0), seed 42 -> 314. (4) HYPOTHESIS: VARIANCE CHECK -- re-running the best config under a different RNG seed (warm-start init + train permutation) tests whether hr=0 is robust to seed or a one-off. If rmse lands ~0.0062-0.0064 again (hr=0), the ceiling is seed-independent and structural; a large swing would signal seed sensitivity. The breast VAL SPLIT is fixed (staged h5, seed-20260703), so seed only perturbs training RNG, not the val cases. Per the ceiling, expect hr=0 again. (5) BUDGET: identical to iter-6 (n_iter=50 fast); ~12 min << 30-min wall. (6) Loop continues; iter-13 self-dispatched. Reserved levers: lr=1e-4 very gentle, n_iter=400 high, pretrain_steps cap, batch_size=2 warm-start, pretrain_epochs=1 minimal warm-start.", "comparison_image": "runs/breast-ct-claude-agentic-dual-domain-n2i-search-20260703-01/iterations/iter-0012/comparison.png"}
{"ts": "2026-07-06T04:25:46Z", "run_id": "breast-ct-claude-agentic-naf-search-20260703-01", "iter": 10, "agent": "naf-claude-agentic", "model": "claude-opus-4-8-1m", "change_class": "architecture", "status": "discard", "kept": false, "val_score": 0.5064835548400879, "headroom": 0.0, "params_M": 0.037633, "train_n": 0, "rationale": "naf-claude-agentic: val_n=12, naf_n_freqs=8, naf_hidden=128, naf_layers=4, naf_n_iter=8000, naf_lr=0.01, naf_tv_weight=0.0001, naf_n_clip=0.08, naf_outer_wall_s=800, naf_per_scene_s=60.0, naf_encoding=fourier, seed=42, rationale=iter-10 breast-ct-claude-agentic-naf-search-20260703-01 (redone breast split train3600/val200/test200 seed20260703; val_n=12 CONSTANT for iters 2-20 per coordinator budget intervention 2026-07-05 -- first-12 of the 200-case breast val split, deterministic). SIX-BOX: (1) prior result: all iters so far hr=0 (iter-1 val_n=20 ssim0.355 PSNR6.26 in 970s, NOT a timeout -- a genuine converged fit). (2) failure mode: NAF per-scene INR recon is far below the 128-view breast LD-FBP baseline. (3) ONE knob changed: naf_n_clip 0.05->0.08. (4) hypothesis: KNOB: raise sigmoid-head out_scale 0.05->0.08 (wider mu range for bone/dense tissue in breast, mu can exceed 0.05). HYPOTHESIS: if the head saturates dense-tissue mu at the 0.05 cap, widening it recovers HU contrast -> better RMSE. Expect hr=0 but a real head-range test. (5) wall: val_n=12 x per_scene 60.0s = ~720s < 20min. (6) serial, no user return.", "advice_for_others": "naf-claude-agentic: val_n=12, naf_n_freqs=8, naf_hidden=128, naf_layers=4, naf_n_iter=8000, naf_lr=0.01, naf_tv_weight=0.0001, naf_n_clip=0.08, naf_outer_wall_s=800, naf_per_scene_s=60.0, naf_encoding=fourier, seed=42, rationale=iter-10 breast-ct-claude-agentic-naf-search-20260703-01 (redone breast split train3600/val200/test200 seed20260703; val_n=12 CONSTANT for iters 2-20 per coordinator budget intervention 2026-07-05 -- first-12 of the 200-case breast val split, deterministic). SIX-BOX: (1) prior result: all iters so far hr=0 (iter-1 val_n=20 ssim0.355 PSNR6.26 in 970s, NOT a timeout -- a genuine converged fit). (2) failure mode: NAF per-scene INR recon is far below the 128-view breast LD-FBP baseline. (3) ONE knob changed: naf_n_clip 0.05->0.08. (4) hypothesis: KNOB: raise sigmoid-head out_scale 0.05->0.08 (wider mu range for bone/dense tissue in breast, mu can exceed 0.05). HYPOTHESIS: if the head saturates dense-tissue mu at the 0.05 cap, widening it recovers HU contrast -> better RMSE. Expect hr=0 but a real head-range test. (5) wall: val_n=12 x per_scene 60.0s = ~720s < 20min. (6) serial, no user return.", "comparison_image": "runs/breast-ct-claude-agentic-naf-search-20260703-01/iterations/iter-0010/comparison.png"}
{"ts": "2026-07-06T03:31:52Z", "run_id": "breast-ct-claude-agentic-naf-search-20260703-01", "iter": 9, "agent": "naf-claude-agentic", "model": "claude-opus-4-8-1m", "change_class": "architecture", "status": "discard", "kept": false, "val_score": 0.35450929403305054, "headroom": 0.0, "params_M": 0.037633, "train_n": 0, "rationale": "naf-claude-agentic: val_n=12, naf_n_freqs=8, naf_hidden=128, naf_layers=4, naf_n_iter=8000, naf_lr=0.01, naf_tv_weight=0.0001, naf_n_clip=0.05, naf_outer_wall_s=1150, naf_per_scene_s=90.0, naf_encoding=fourier, seed=42, rationale=iter-9 breast-ct-claude-agentic-naf-search-20260703-01 (redone breast split train3600/val200/test200 seed20260703; val_n=12 CONSTANT for iters 2-20 per coordinator budget intervention 2026-07-05 -- first-12 of the 200-case breast val split, deterministic). SIX-BOX: (1) prior result: all iters so far hr=0 (iter-1 val_n=20 ssim0.355 PSNR6.26 in 970s, NOT a timeout -- a genuine converged fit). (2) failure mode: NAF per-scene INR recon is far below the 128-view breast LD-FBP baseline. (3) ONE knob changed: per_scene 60->90 (deeper fit, in-budget). (4) hypothesis: iters 7-8 (TV sweep) hr=0. KNOB: raise per-scene fit budget 60->90s (12*90=1080s ~18min, in-budget) so each scene runs MORE Adam steps -> lower data-fit loss. HYPOTHESIS: if the hr=0 were step-starvation the deeper fit would lift it; it will not (loss floor is basis-limited). This isolates convergence from the basis ceiling for the fourier path. (5) wall: val_n=12 x per_scene 90.0s = ~1080s < 20min. (6) serial, no user return.", "advice_for_others": "naf-claude-agentic: val_n=12, naf_n_freqs=8, naf_hidden=128, naf_layers=4, naf_n_iter=8000, naf_lr=0.01, naf_tv_weight=0.0001, naf_n_clip=0.05, naf_outer_wall_s=1150, naf_per_scene_s=90.0, naf_encoding=fourier, seed=42, rationale=iter-9 breast-ct-claude-agentic-naf-search-20260703-01 (redone breast split train3600/val200/test200 seed20260703; val_n=12 CONSTANT for iters 2-20 per coordinator budget intervention 2026-07-05 -- first-12 of the 200-case breast val split, deterministic). SIX-BOX: (1) prior result: all iters so far hr=0 (iter-1 val_n=20 ssim0.355 PSNR6.26 in 970s, NOT a timeout -- a genuine converged fit). (2) failure mode: NAF per-scene INR recon is far below the 128-view breast LD-FBP baseline. (3) ONE knob changed: per_scene 60->90 (deeper fit, in-budget). (4) hypothesis: iters 7-8 (TV sweep) hr=0. KNOB: raise per-scene fit budget 60->90s (12*90=1080s ~18min, in-budget) so each scene runs MORE Adam steps -> lower data-fit loss. HYPOTHESIS: if the hr=0 were step-starvation the deeper fit would lift it; it will not (loss floor is basis-limited). This isolates convergence from the basis ceiling for the fourier path. (5) wall: val_n=12 x per_scene 90.0s = ~1080s < 20min. (6) serial, no user return.", "comparison_image": "runs/breast-ct-claude-agentic-naf-search-20260703-01/iterations/iter-0009/comparison.png"}
{"ts": "2026-07-06T03:29:59Z", "run_id": "breast-ct-claude-agentic-dual-domain-n2i-search-20260703-01", "iter": 11, "agent": "dual_domain_n2i-claude-agentic", "model": "claude-opus-4-8-1m", "change_class": "architecture", "status": "discard", "kept": false, "val_score": 0.9421713948249817, "headroom": 0.0, "params_M": 0.465762, "train_n": 400, "rationale": "dual_domain_n2i-claude-agentic: warm_start=True, pretrain_epochs=3, pretrain_steps=0, n_iter=50, grad_clip=0.0, outer_wall_s=1400, per_scene_s=None, batch_size=1, lr=0.0003, optimizer=adam, unet_c=16, train_n=400, val_n=200, seed=42, rationale=iter-11 SIX-BOX. (1) PRIOR: iter-10 hr=0.0, n_iter=100 gave rmse=0.00627 -- with 50/100/200-step fits at 0.00628/0.00627/0.00633, inner-step count is MONOTONE-FLAT and NOT a lever. Iters 1-10 all hr=0, rmse 0.00627-0.00657, all far above baseline 0.00521. (2) FAILURE MODE: plain-UNet N2I regresses to the over-smoothed FBP mean; no edge-preserving structural guard (the bilateral sibling's tight range kernel, hr~0.21, is exactly what this solver lacks). (3) ONE KNOB: relative to iter-6 best reference (lr=3e-4, n_iter=50, c=16), grad_clip 1.0 -> 0.0 (OFF). grad_clip has been pinned at 1.0 all run; breast's 128-view FBP adjoint is far milder than Mayo's 2304-view, so clipping may be needlessly damping the per-image updates. (4) HYPOTHESIS: removing grad-norm clipping lets full-magnitude gradients through, which on the well-conditioned 128-view breast geometry may drive the per-image fit to a sharper solution the clipped runs couldn't reach, lowering rmse. If hr rises, clipping was over-damping. Per the ceiling, more likely the unclipped fit reaches the same over-smoothed FBP-consistent solution (hr=0), since the over-smoothing is set by the TARGET not the step magnitude; grad_clip<=0 still skips nonfinite-grad steps so it stays stable. (5) BUDGET: identical to iter-6 (n_iter=50 fast); ~12 min << 30-min wall. (6) Loop continues; iter-12 self-dispatched. Reserved levers: seed variance check (314), lr=1e-4 very gentle, pretrain_steps cap, n_iter=400 high, batch_size up for warm-start.", "advice_for_others": "dual_domain_n2i-claude-agentic: warm_start=True, pretrain_epochs=3, pretrain_steps=0, n_iter=50, grad_clip=0.0, outer_wall_s=1400, per_scene_s=None, batch_size=1, lr=0.0003, optimizer=adam, unet_c=16, train_n=400, val_n=200, seed=42, rationale=iter-11 SIX-BOX. (1) PRIOR: iter-10 hr=0.0, n_iter=100 gave rmse=0.00627 -- with 50/100/200-step fits at 0.00628/0.00627/0.00633, inner-step count is MONOTONE-FLAT and NOT a lever. Iters 1-10 all hr=0, rmse 0.00627-0.00657, all far above baseline 0.00521. (2) FAILURE MODE: plain-UNet N2I regresses to the over-smoothed FBP mean; no edge-preserving structural guard (the bilateral sibling's tight range kernel, hr~0.21, is exactly what this solver lacks). (3) ONE KNOB: relative to iter-6 best reference (lr=3e-4, n_iter=50, c=16), grad_clip 1.0 -> 0.0 (OFF). grad_clip has been pinned at 1.0 all run; breast's 128-view FBP adjoint is far milder than Mayo's 2304-view, so clipping may be needlessly damping the per-image updates. (4) HYPOTHESIS: removing grad-norm clipping lets full-magnitude gradients through, which on the well-conditioned 128-view breast geometry may drive the per-image fit to a sharper solution the clipped runs couldn't reach, lowering rmse. If hr rises, clipping was over-damping. Per the ceiling, more likely the unclipped fit reaches the same over-smoothed FBP-consistent solution (hr=0), since the over-smoothing is set by the TARGET not the step magnitude; grad_clip<=0 still skips nonfinite-grad steps so it stays stable. (5) BUDGET: identical to iter-6 (n_iter=50 fast); ~12 min << 30-min wall. (6) Loop continues; iter-12 self-dispatched. Reserved levers: seed variance check (314), lr=1e-4 very gentle, pretrain_steps cap, n_iter=400 high, batch_size up for warm-start.", "comparison_image": "runs/breast-ct-claude-agentic-dual-domain-n2i-search-20260703-01/iterations/iter-0011/comparison.png"}
{"ts": "2026-07-06T02:39:18Z", "run_id": "breast-ct-claude-agentic-dual-domain-n2i-search-20260703-01", "iter": 10, "agent": "dual_domain_n2i-claude-agentic", "model": "claude-opus-4-8-1m", "change_class": "architecture", "status": "discard", "kept": false, "val_score": 0.9419757127761841, "headroom": 0.0, "params_M": 0.465762, "train_n": 400, "rationale": "dual_domain_n2i-claude-agentic: warm_start=True, pretrain_epochs=3, pretrain_steps=0, n_iter=100, grad_clip=1.0, outer_wall_s=1400, per_scene_s=None, batch_size=1, lr=0.0003, optimizer=adam, unet_c=16, train_n=400, val_n=200, seed=42, rationale=iter-10 SIX-BOX (HALFWAY). (1) PRIOR: iter-9 hr=0.0, unet_c=8 (down) gave rmse=0.00629, ssim=0.945 (highest ssim) -- no clear from iter-3's c=32 (rmse 0.00654). With c=8, c=16, c=32 ALL at hr=0, capacity is CONCLUSIVELY not the lever. Iters 1-9 all hr=0. (2) FAILURE MODE: plain-UNet N2I regresses to the over-smoothed FBP mean; no edge-preserving structural guard (unlike the bilateral sibling's range kernel, hr~0.21). (3) ONE KNOB: relative to iter-6 best reference (lr=3e-4, c=16, ep=3), n_iter 50 -> 100. Completes the inner-step sweep (iter-2/5 used 200, iter-6 used 50; this fills 100). (4) HYPOTHESIS: 100 inner steps is a middle ground -- enough to refine past the warm init but maybe not so many that it collapses fully to the smooth mean; if there is a sweet spot in inner-step count, rmse dips here. Per the ceiling, more likely rmse sits between the 50-step (0.00628) and 200-step (0.00633) values, still far above baseline 0.00521 (hr=0), confirming inner-step count is monotone-flat and not a lever. (5) BUDGET: 100 steps/scene, moderate; pretrain ep=3 + 200*100-step fits + figure ~= 16 min < 30-min wall. (6) Loop continues; iter-11 self-dispatched. Reserved levers: grad_clip off (2.0/none), seed variance check (314), lr=1e-4 very gentle, pretrain_steps cap, n_iter=400 high.", "advice_for_others": "dual_domain_n2i-claude-agentic: warm_start=True, pretrain_epochs=3, pretrain_steps=0, n_iter=100, grad_clip=1.0, outer_wall_s=1400, per_scene_s=None, batch_size=1, lr=0.0003, optimizer=adam, unet_c=16, train_n=400, val_n=200, seed=42, rationale=iter-10 SIX-BOX (HALFWAY). (1) PRIOR: iter-9 hr=0.0, unet_c=8 (down) gave rmse=0.00629, ssim=0.945 (highest ssim) -- no clear from iter-3's c=32 (rmse 0.00654). With c=8, c=16, c=32 ALL at hr=0, capacity is CONCLUSIVELY not the lever. Iters 1-9 all hr=0. (2) FAILURE MODE: plain-UNet N2I regresses to the over-smoothed FBP mean; no edge-preserving structural guard (unlike the bilateral sibling's range kernel, hr~0.21). (3) ONE KNOB: relative to iter-6 best reference (lr=3e-4, c=16, ep=3), n_iter 50 -> 100. Completes the inner-step sweep (iter-2/5 used 200, iter-6 used 50; this fills 100). (4) HYPOTHESIS: 100 inner steps is a middle ground -- enough to refine past the warm init but maybe not so many that it collapses fully to the smooth mean; if there is a sweet spot in inner-step count, rmse dips here. Per the ceiling, more likely rmse sits between the 50-step (0.00628) and 200-step (0.00633) values, still far above baseline 0.00521 (hr=0), confirming inner-step count is monotone-flat and not a lever. (5) BUDGET: 100 steps/scene, moderate; pretrain ep=3 + 200*100-step fits + figure ~= 16 min < 30-min wall. (6) Loop continues; iter-11 self-dispatched. Reserved levers: grad_clip off (2.0/none), seed variance check (314), lr=1e-4 very gentle, pretrain_steps cap, n_iter=400 high.", "comparison_image": "runs/breast-ct-claude-agentic-dual-domain-n2i-search-20260703-01/iterations/iter-0010/comparison.png"}
{"ts": "2026-07-06T02:25:24Z", "run_id": "breast-ct-claude-agentic-naf-search-20260703-01", "iter": 8, "agent": "naf-claude-agentic", "model": "claude-opus-4-8-1m", "change_class": "architecture", "status": "discard", "kept": false, "val_score": 0.35450929403305054, "headroom": 0.0, "params_M": 0.037633, "train_n": 0, "rationale": "naf-claude-agentic: val_n=12, naf_n_freqs=8, naf_hidden=128, naf_layers=4, naf_n_iter=8000, naf_lr=0.01, naf_tv_weight=0.001, naf_n_clip=0.05, naf_outer_wall_s=800, naf_per_scene_s=60.0, naf_encoding=fourier, seed=42, rationale=iter-8 breast-ct-claude-agentic-naf-search-20260703-01 (redone breast split train3600/val200/test200 seed20260703; val_n=12 CONSTANT for iters 2-20 per coordinator budget intervention 2026-07-05 -- first-12 of the 200-case breast val split, deterministic). SIX-BOX: (1) prior result: all iters so far hr=0 (iter-1 val_n=20 ssim0.355 PSNR6.26 in 970s, NOT a timeout -- a genuine converged fit). (2) failure mode: NAF per-scene INR recon is far below the 128-view breast LD-FBP baseline. (3) ONE knob changed: naf_tv_weight 1e-4->1e-3. (4) hypothesis: iter-7 (tv=0) hr=0. KNOB: raise TV 1e-4->1e-3 (stronger denoising). HYPOTHESIS: opposite bet -- the raw NAF recon is noisy (ssim0.35, PSNR6.26 very low), maybe heavy TV cleans it toward baseline. Expect hr=0; TV cannot manufacture the missing structure. (5) wall: val_n=12 x per_scene 60.0s = ~720s < 20min. (6) serial, no user return.", "advice_for_others": "naf-claude-agentic: val_n=12, naf_n_freqs=8, naf_hidden=128, naf_layers=4, naf_n_iter=8000, naf_lr=0.01, naf_tv_weight=0.001, naf_n_clip=0.05, naf_outer_wall_s=800, naf_per_scene_s=60.0, naf_encoding=fourier, seed=42, rationale=iter-8 breast-ct-claude-agentic-naf-search-20260703-01 (redone breast split train3600/val200/test200 seed20260703; val_n=12 CONSTANT for iters 2-20 per coordinator budget intervention 2026-07-05 -- first-12 of the 200-case breast val split, deterministic). SIX-BOX: (1) prior result: all iters so far hr=0 (iter-1 val_n=20 ssim0.355 PSNR6.26 in 970s, NOT a timeout -- a genuine converged fit). (2) failure mode: NAF per-scene INR recon is far below the 128-view breast LD-FBP baseline. (3) ONE knob changed: naf_tv_weight 1e-4->1e-3. (4) hypothesis: iter-7 (tv=0) hr=0. KNOB: raise TV 1e-4->1e-3 (stronger denoising). HYPOTHESIS: opposite bet -- the raw NAF recon is noisy (ssim0.35, PSNR6.26 very low), maybe heavy TV cleans it toward baseline. Expect hr=0; TV cannot manufacture the missing structure. (5) wall: val_n=12 x per_scene 60.0s = ~720s < 20min. (6) serial, no user return.", "comparison_image": "runs/breast-ct-claude-agentic-naf-search-20260703-01/iterations/iter-0008/comparison.png"}
