{"ts": "2026-07-06T20:47:05Z", "run_id": "breast-ct-claude-agentic-fastdiff-flow-pixel-unconstrained-search-20260703-01", "iter": 9, "agent": "fastdiff_flow_pixel_unconstrained-claude-agentic", "model": "claude-opus-4-8-1m", "change_class": "architecture", "status": "discard", "kept": false, "val_score": 0.7844355702400208, "headroom": 0.0, "params_M": 3.822787, "train_n": 3600, "rationale": "fastdiff_flow_pixel_unconstrained-claude-agentic: image_size=512, pixel_spacing=0.3516, n_angles=128, n_det=1024, det_spacing=0.35754, sod=500.0, sdd=1000.0, display_min=0.0, display_max=0.5, train_n=400, val_n=200, noise_i0=100000.0, noise_sigma_e=10.0, seed=42, fd_recon_ckpt=/cluster/maier/Agent4CT/checkpoints/fast_diffusion_pixel_breast.pt, fd_recon_steps=8, fd_recon_init=fbp, fd_recon_init_t=0.3, fd_recon_eta=0.1, fd_recon_dc=0, fd_recon_dc_n_cg=5, fd_recon_dc_relax=0.5, rationale=iter-9: DC-off breast-prior. Back to steps=8 (iter-8 steps=16 gave NO PSNR gain, 28.3 vs 28.5, 2x slower => NFE saturated at 8). Fine-tune the DOMINANT lever init_t. ONE KNOB init_t 0.4->0.3 (eta=0.1, steps=8). PRIOR coarse init_t sweep: 0.7->19.0, 0.4->24.6(eta1.0)/best-region, 0.2->24.2 - optimum bracketed near 0.3-0.4. HYPOTHESIS: init_t=0.3 (between the 0.2 and 0.4 coarse points, at the now-tuned low eta=0.1) may edge past the 0.4/eta0.1 PSNR (~28.5) by injecting slightly less noise while retaining enough flow-time for the prior to denoise. Fine-grid refinement of the init_t peak.", "advice_for_others": "fastdiff_flow_pixel_unconstrained-claude-agentic: image_size=512, pixel_spacing=0.3516, n_angles=128, n_det=1024, det_spacing=0.35754, sod=500.0, sdd=1000.0, display_min=0.0, display_max=0.5, train_n=400, val_n=200, noise_i0=100000.0, noise_sigma_e=10.0, seed=42, fd_recon_ckpt=/cluster/maier/Agent4CT/checkpoints/fast_diffusion_pixel_breast.pt, fd_recon_steps=8, fd_recon_init=fbp, fd_recon_init_t=0.3, fd_recon_eta=0.1, fd_recon_dc=0, fd_recon_dc_n_cg=5, fd_recon_dc_relax=0.5, rationale=iter-9: DC-off breast-prior. Back to steps=8 (iter-8 steps=16 gave NO PSNR gain, 28.3 vs 28.5, 2x slower => NFE saturated at 8). Fine-tune the DOMINANT lever init_t. ONE KNOB init_t 0.4->0.3 (eta=0.1, steps=8). PRIOR coarse init_t sweep: 0.7->19.0, 0.4->24.6(eta1.0)/best-region, 0.2->24.2 - optimum bracketed near 0.3-0.4. HYPOTHESIS: init_t=0.3 (between the 0.2 and 0.4 coarse points, at the now-tuned low eta=0.1) may edge past the 0.4/eta0.1 PSNR (~28.5) by injecting slightly less noise while retaining enough flow-time for the prior to denoise. Fine-grid refinement of the init_t peak.", "comparison_image": "runs/breast-ct-claude-agentic-fastdiff-flow-pixel-unconstrained-search-20260703-01/iterations/iter-0009/comparison.png"}
{"ts": "2026-07-06T20:43:51Z", "run_id": "breast-ct-claude-agentic-fastdiff-flow-pixel-unconstrained-search-20260703-01", "iter": 8, "agent": "fastdiff_flow_pixel_unconstrained-claude-agentic", "model": "claude-opus-4-8-1m", "change_class": "architecture", "status": "discard", "kept": false, "val_score": 0.8298014402389526, "headroom": 0.0, "params_M": 3.822787, "train_n": 3600, "rationale": "fastdiff_flow_pixel_unconstrained-claude-agentic: image_size=512, pixel_spacing=0.3516, n_angles=128, n_det=1024, det_spacing=0.35754, sod=500.0, sdd=1000.0, display_min=0.0, display_max=0.5, train_n=400, val_n=200, noise_i0=100000.0, noise_sigma_e=10.0, seed=42, fd_recon_ckpt=/cluster/maier/Agent4CT/checkpoints/fast_diffusion_pixel_breast.pt, fd_recon_steps=16, fd_recon_init=fbp, fd_recon_init_t=0.4, fd_recon_eta=0.1, fd_recon_dc=0, fd_recon_dc_n_cg=5, fd_recon_dc_relax=0.5, rationale=iter-8: DC-off breast-prior. Switch lever to STEPS (NFE). Hold near-best init_t=0.4, eta=0.1 (eta plateaued: iter-6 eta0.2 PSNR28.1, iter-7 eta0.05 PSNR28.5 - diminishing, so eta~0.1 is the practical floor). ONE KNOB steps 8->16. PRIOR: eta sweep found lower=better but flattening; init_t optimum ~0.4. HYPOTHESIS: doubling Euler steps 8->16 gives finer flow-ODE integration -> the prior denoises the FBP-init more accurately -> PSNR edges up. NOTE eta=0.1 is a small config move vs iter-7's 0.05 but the PRIMARY knob is steps; eta 0.05->0.1 is within the plateaued flat region (rounding to a stable midpoint), so steps remains the interpretable single lever. Best PSNR so far 28.5 is still 7.8dB under the 128-view FBP baseline (36.3) - hr=0 firmly, as expected for DC-off.", "advice_for_others": "fastdiff_flow_pixel_unconstrained-claude-agentic: image_size=512, pixel_spacing=0.3516, n_angles=128, n_det=1024, det_spacing=0.35754, sod=500.0, sdd=1000.0, display_min=0.0, display_max=0.5, train_n=400, val_n=200, noise_i0=100000.0, noise_sigma_e=10.0, seed=42, fd_recon_ckpt=/cluster/maier/Agent4CT/checkpoints/fast_diffusion_pixel_breast.pt, fd_recon_steps=16, fd_recon_init=fbp, fd_recon_init_t=0.4, fd_recon_eta=0.1, fd_recon_dc=0, fd_recon_dc_n_cg=5, fd_recon_dc_relax=0.5, rationale=iter-8: DC-off breast-prior. Switch lever to STEPS (NFE). Hold near-best init_t=0.4, eta=0.1 (eta plateaued: iter-6 eta0.2 PSNR28.1, iter-7 eta0.05 PSNR28.5 - diminishing, so eta~0.1 is the practical floor). ONE KNOB steps 8->16. PRIOR: eta sweep found lower=better but flattening; init_t optimum ~0.4. HYPOTHESIS: doubling Euler steps 8->16 gives finer flow-ODE integration -> the prior denoises the FBP-init more accurately -> PSNR edges up. NOTE eta=0.1 is a small config move vs iter-7's 0.05 but the PRIMARY knob is steps; eta 0.05->0.1 is within the plateaued flat region (rounding to a stable midpoint), so steps remains the interpretable single lever. Best PSNR so far 28.5 is still 7.8dB under the 128-view FBP baseline (36.3) - hr=0 firmly, as expected for DC-off.", "comparison_image": "runs/breast-ct-claude-agentic-fastdiff-flow-pixel-unconstrained-search-20260703-01/iterations/iter-0008/comparison.png"}
{"ts": "2026-07-06T20:43:24Z", "run_id": "breast-ct-claude-agentic-fastdiff-wdm-wavelet-constrained-search-20260703-01", "iter": 4, "agent": "fastdiff_wdm_wavelet_constrained-claude-agentic", "model": "claude-opus-4-8-1m", "change_class": "architecture", "status": "discard", "kept": false, "val_score": 0.46055829524993896, "headroom": 0.0, "params_M": 3.824908, "train_n": 3600, "rationale": "fastdiff_wdm_wavelet_constrained-claude-agentic: val_n=200, seed=42, fd_recon_ckpt=/cluster/maier/Agent4CT/checkpoints/fast_diffusion_wavelet_breast.pt, fd_recon_steps=8, fd_recon_init=fbp, fd_recon_init_t=0.2, fd_recon_eta=1.0, fd_recon_dc=1, fd_recon_dc_n_cg=5, fd_recon_dc_relax=1.0, dataset_kind=breast_ct, rationale=iter-4 INIT_T lever (continue lowering), breast-native wavelet CONSTRAINED, val=200. SIX-BOX: (1) PRIOR: init_t sweep at relax1.0: iter-2 init_t0.7 PSNR 16.5/RMSE 5.12e-2; iter-3 init_t0.4 PSNR 19.4/RMSE 3.66e-2 -- MONOTONIC improvement as init_t drops (prior over-injection is the failure). All hr=0, baseline PSNR 36.3/RMSE 5.21e-3. (2) FAILURE MODE: at init_t=0.4 the FBP embed still carries enough flow-time noise that the 8-step wavelet prior degrades detail relative to the strong 128-view FBP. (3) ONE KNOB: fd_recon_init_t 0.4 -> 0.2 (embed FBP even closer to clean; minimal prior drift), relax1.0 fixed. (4) HYPOTHESIS: init_t=0.2 continues the RMSE-down trend (archived Mayo-prior best SSIM was at init_t0.2) toward the FBP floor; the prior becomes a very light streak-denoiser. FALSIFIER: if PSNR still <<36, the wavelet flow prior fundamentally cannot improve on the 128-view breast FBP even as a light denoiser -> pivot to dc_n_cg (stronger DC) and steps, then conclude the prior is FBP-bounded here. (5) BUDGET: ~90s/iter. (6) Loop continues; iter-5 on landing.", "advice_for_others": "fastdiff_wdm_wavelet_constrained-claude-agentic: val_n=200, seed=42, fd_recon_ckpt=/cluster/maier/Agent4CT/checkpoints/fast_diffusion_wavelet_breast.pt, fd_recon_steps=8, fd_recon_init=fbp, fd_recon_init_t=0.2, fd_recon_eta=1.0, fd_recon_dc=1, fd_recon_dc_n_cg=5, fd_recon_dc_relax=1.0, dataset_kind=breast_ct, rationale=iter-4 INIT_T lever (continue lowering), breast-native wavelet CONSTRAINED, val=200. SIX-BOX: (1) PRIOR: init_t sweep at relax1.0: iter-2 init_t0.7 PSNR 16.5/RMSE 5.12e-2; iter-3 init_t0.4 PSNR 19.4/RMSE 3.66e-2 -- MONOTONIC improvement as init_t drops (prior over-injection is the failure). All hr=0, baseline PSNR 36.3/RMSE 5.21e-3. (2) FAILURE MODE: at init_t=0.4 the FBP embed still carries enough flow-time noise that the 8-step wavelet prior degrades detail relative to the strong 128-view FBP. (3) ONE KNOB: fd_recon_init_t 0.4 -> 0.2 (embed FBP even closer to clean; minimal prior drift), relax1.0 fixed. (4) HYPOTHESIS: init_t=0.2 continues the RMSE-down trend (archived Mayo-prior best SSIM was at init_t0.2) toward the FBP floor; the prior becomes a very light streak-denoiser. FALSIFIER: if PSNR still <<36, the wavelet flow prior fundamentally cannot improve on the 128-view breast FBP even as a light denoiser -> pivot to dc_n_cg (stronger DC) and steps, then conclude the prior is FBP-bounded here. (5) BUDGET: ~90s/iter. (6) Loop continues; iter-5 on landing.", "comparison_image": "runs/breast-ct-claude-agentic-fastdiff-wdm-wavelet-constrained-search-20260703-01/iterations/iter-0004/comparison.png"}
{"ts": "2026-07-06T20:43:09Z", "run_id": "breast-ct-claude-agentic-fastdiff-flow-pixel-constrained-search-20260703-01", "iter": 2, "agent": "fastdiff_flow_pixel_constrained-claude-agentic", "model": "claude-opus-4-8-1m", "change_class": "architecture", "status": "discard", "kept": false, "val_score": 0.4536875784397125, "headroom": 0.0, "params_M": 3.822787, "train_n": 400, "rationale": "fastdiff_flow_pixel_constrained-claude-agentic: image_size=512, pixel_spacing=0.3516, n_angles=128, n_det=1024, det_spacing=0.35754, sod=500.0, sdd=1000.0, display_min=0.0, display_max=0.5, train_n=400, val_n=200, noise_i0=100000.0, noise_sigma_e=10.0, seed=42, dataset_kind=breast_ct, fd_recon_ckpt=/cluster/maier/Agent4CT/checkpoints/fast_diffusion_pixel_breast.pt, fd_recon_steps=8, fd_recon_init=fbp, fd_recon_init_t=0.3, fd_recon_eta=1.0, fd_recon_dc=1, fd_recon_dc_n_cg=5, fd_recon_dc_relax=0.5, rationale=iter-2 EXPLORATORY single knob fd_recon_init_t 0.7->0.3 from iter-1 base. SIX-BOX (breast-native prior): (1)PRIOR iter-1 hr=0 (breast prior fast_diffusion_pixel_breast.pt out_scale0.5, DC on, init_t0.7): matched-scale breast prior still did not clear the strong 128-view breast FBP baseline. (2)FAILURE: even a matched prior repaints when embedded high on the flow schedule, pulling RMSE above the FBP it started from. (3)ONE KNOB: init_t 0.7->0.3. (4)HYPOTHESIS: low init_t preserves the strong FBP while the breast prior lightly denoises + DC re-anchors, dropping RMSE toward baseline and lifting hr>0. (5)BUDGET: fast. (6)Serial.", "advice_for_others": "fastdiff_flow_pixel_constrained-claude-agentic: image_size=512, pixel_spacing=0.3516, n_angles=128, n_det=1024, det_spacing=0.35754, sod=500.0, sdd=1000.0, display_min=0.0, display_max=0.5, train_n=400, val_n=200, noise_i0=100000.0, noise_sigma_e=10.0, seed=42, dataset_kind=breast_ct, fd_recon_ckpt=/cluster/maier/Agent4CT/checkpoints/fast_diffusion_pixel_breast.pt, fd_recon_steps=8, fd_recon_init=fbp, fd_recon_init_t=0.3, fd_recon_eta=1.0, fd_recon_dc=1, fd_recon_dc_n_cg=5, fd_recon_dc_relax=0.5, rationale=iter-2 EXPLORATORY single knob fd_recon_init_t 0.7->0.3 from iter-1 base. SIX-BOX (breast-native prior): (1)PRIOR iter-1 hr=0 (breast prior fast_diffusion_pixel_breast.pt out_scale0.5, DC on, init_t0.7): matched-scale breast prior still did not clear the strong 128-view breast FBP baseline. (2)FAILURE: even a matched prior repaints when embedded high on the flow schedule, pulling RMSE above the FBP it started from. (3)ONE KNOB: init_t 0.7->0.3. (4)HYPOTHESIS: low init_t preserves the strong FBP while the breast prior lightly denoises + DC re-anchors, dropping RMSE toward baseline and lifting hr>0. (5)BUDGET: fast. (6)Serial.", "comparison_image": "runs/breast-ct-claude-agentic-fastdiff-flow-pixel-constrained-search-20260703-01/iterations/iter-0002/comparison.png"}
{"ts": "2026-07-06T20:40:04Z", "run_id": "breast-ct-claude-agentic-fastdiff-wdm-wavelet-constrained-search-20260703-01", "iter": 3, "agent": "fastdiff_wdm_wavelet_constrained-claude-agentic", "model": "claude-opus-4-8-1m", "change_class": "architecture", "status": "discard", "kept": false, "val_score": 0.40248602628707886, "headroom": 0.0, "params_M": 3.824908, "train_n": 3600, "rationale": "fastdiff_wdm_wavelet_constrained-claude-agentic: val_n=200, seed=42, fd_recon_ckpt=/cluster/maier/Agent4CT/checkpoints/fast_diffusion_wavelet_breast.pt, fd_recon_steps=8, fd_recon_init=fbp, fd_recon_init_t=0.4, fd_recon_eta=1.0, fd_recon_dc=1, fd_recon_dc_n_cg=5, fd_recon_dc_relax=1.0, dataset_kind=breast_ct, rationale=iter-3 INIT_T lever, breast-native wavelet CONSTRAINED, val=200. SIX-BOX: (1) PRIOR: iter-1 (init_t0.7/relax0.5) SSIM 0.326/PSNR 17.1/RMSE 4.75e-2; iter-2 (init_t0.7/relax1.0) SSIM 0.354/PSNR 16.5/RMSE 5.12e-2 -- full DC did NOT rescue, both ~9x worse than baseline (PSNR 36.3/RMSE 5.21e-3), hr=0. (2) FAILURE MODE: init_t=0.7 embeds the FBP at high flow-time where most FBP structure is replaced by noise; 8 Euler steps of the 512^2 wavelet prior cannot rebuild breast detail from that, and even full CG DC can't fix a trajectory that started from mostly-noise. The dominant lever is init_t, not dc_relax (the archived Mayo-prior curve's big SSIM gains 0.82->0.91 came from lowering init_t 0.7->0.2). (3) ONE KNOB: fd_recon_init_t 0.7 -> 0.4 (embed FBP closer to clean, far less prior drift), keeping dc_relax=1.0 from iter-2. (4) HYPOTHESIS: at init_t=0.4 the FBP is embedded near-clean so the wavelet prior only lightly denoises the sparse-view streaks while full CG DC pins the measured rays -> RMSE drops sharply toward the sparse-FBP floor and may clear hr>0 (this is the archived best region). FALSIFIER: if still PSNR<<36, even light prior injection + DC can't beat the strong 128-view FBP baseline here -> iter-4 pushes init_t lower (0.2) and/or raises dc_n_cg. (5) BUDGET: ~90s/iter, init_t is free. (6) Loop continues; iter-4 self-dispatched on landing.", "advice_for_others": "fastdiff_wdm_wavelet_constrained-claude-agentic: val_n=200, seed=42, fd_recon_ckpt=/cluster/maier/Agent4CT/checkpoints/fast_diffusion_wavelet_breast.pt, fd_recon_steps=8, fd_recon_init=fbp, fd_recon_init_t=0.4, fd_recon_eta=1.0, fd_recon_dc=1, fd_recon_dc_n_cg=5, fd_recon_dc_relax=1.0, dataset_kind=breast_ct, rationale=iter-3 INIT_T lever, breast-native wavelet CONSTRAINED, val=200. SIX-BOX: (1) PRIOR: iter-1 (init_t0.7/relax0.5) SSIM 0.326/PSNR 17.1/RMSE 4.75e-2; iter-2 (init_t0.7/relax1.0) SSIM 0.354/PSNR 16.5/RMSE 5.12e-2 -- full DC did NOT rescue, both ~9x worse than baseline (PSNR 36.3/RMSE 5.21e-3), hr=0. (2) FAILURE MODE: init_t=0.7 embeds the FBP at high flow-time where most FBP structure is replaced by noise; 8 Euler steps of the 512^2 wavelet prior cannot rebuild breast detail from that, and even full CG DC can't fix a trajectory that started from mostly-noise. The dominant lever is init_t, not dc_relax (the archived Mayo-prior curve's big SSIM gains 0.82->0.91 came from lowering init_t 0.7->0.2). (3) ONE KNOB: fd_recon_init_t 0.7 -> 0.4 (embed FBP closer to clean, far less prior drift), keeping dc_relax=1.0 from iter-2. (4) HYPOTHESIS: at init_t=0.4 the FBP is embedded near-clean so the wavelet prior only lightly denoises the sparse-view streaks while full CG DC pins the measured rays -> RMSE drops sharply toward the sparse-FBP floor and may clear hr>0 (this is the archived best region). FALSIFIER: if still PSNR<<36, even light prior injection + DC can't beat the strong 128-view FBP baseline here -> iter-4 pushes init_t lower (0.2) and/or raises dc_n_cg. (5) BUDGET: ~90s/iter, init_t is free. (6) Loop continues; iter-4 self-dispatched on landing.", "comparison_image": "runs/breast-ct-claude-agentic-fastdiff-wdm-wavelet-constrained-search-20260703-01/iterations/iter-0003/comparison.png"}
{"ts": "2026-07-06T20:38:54Z", "run_id": "breast-ct-claude-agentic-fastdiff-flow-pixel-unconstrained-search-20260703-01", "iter": 7, "agent": "fastdiff_flow_pixel_unconstrained-claude-agentic", "model": "claude-opus-4-8-1m", "change_class": "architecture", "status": "discard", "kept": false, "val_score": 0.8220860362052917, "headroom": 0.0, "params_M": 3.822787, "train_n": 3600, "rationale": "fastdiff_flow_pixel_unconstrained-claude-agentic: image_size=512, pixel_spacing=0.3516, n_angles=128, n_det=1024, det_spacing=0.35754, sod=500.0, sdd=1000.0, display_min=0.0, display_max=0.5, train_n=400, val_n=200, noise_i0=100000.0, noise_sigma_e=10.0, seed=42, fd_recon_ckpt=/cluster/maier/Agent4CT/checkpoints/fast_diffusion_pixel_breast.pt, fd_recon_steps=8, fd_recon_init=fbp, fd_recon_init_t=0.4, fd_recon_eta=0.05, fd_recon_dc=0, fd_recon_dc_n_cg=5, fd_recon_dc_relax=0.5, rationale=iter-7: DC-off breast-prior. Fix init_t=0.4. ONE KNOB eta 0.2->0.05. MONOTONIC eta trend (init_t0.4): eta1.0 PSNR24.6, eta0.5 PSNR27.0, eta0.2 PSNR28.1 (best) - lower eta = better because less overshooting measurement pull, recon converges to the prior-denoised FBP init. HYPOTHESIS: eta=0.05 (near-zero guidance) approaches pure prior-denoise of the FBP init -> PSNR edges further toward baseline, locating the eta floor. Since removing measurement guidance ENTIRELY would make it pure unconditional generation from FBP-noised init, a tiny eta is the DC-free sweet spot: it keeps a whisper of sinogram consistency without the overshoot instability. Then switch lever to steps.", "advice_for_others": "fastdiff_flow_pixel_unconstrained-claude-agentic: image_size=512, pixel_spacing=0.3516, n_angles=128, n_det=1024, det_spacing=0.35754, sod=500.0, sdd=1000.0, display_min=0.0, display_max=0.5, train_n=400, val_n=200, noise_i0=100000.0, noise_sigma_e=10.0, seed=42, fd_recon_ckpt=/cluster/maier/Agent4CT/checkpoints/fast_diffusion_pixel_breast.pt, fd_recon_steps=8, fd_recon_init=fbp, fd_recon_init_t=0.4, fd_recon_eta=0.05, fd_recon_dc=0, fd_recon_dc_n_cg=5, fd_recon_dc_relax=0.5, rationale=iter-7: DC-off breast-prior. Fix init_t=0.4. ONE KNOB eta 0.2->0.05. MONOTONIC eta trend (init_t0.4): eta1.0 PSNR24.6, eta0.5 PSNR27.0, eta0.2 PSNR28.1 (best) - lower eta = better because less overshooting measurement pull, recon converges to the prior-denoised FBP init. HYPOTHESIS: eta=0.05 (near-zero guidance) approaches pure prior-denoise of the FBP init -> PSNR edges further toward baseline, locating the eta floor. Since removing measurement guidance ENTIRELY would make it pure unconditional generation from FBP-noised init, a tiny eta is the DC-free sweet spot: it keeps a whisper of sinogram consistency without the overshoot instability. Then switch lever to steps.", "comparison_image": "runs/breast-ct-claude-agentic-fastdiff-flow-pixel-unconstrained-search-20260703-01/iterations/iter-0007/comparison.png"}
{"ts": "2026-07-06T20:34:50Z", "run_id": "breast-ct-claude-agentic-fastdiff-flow-pixel-unconstrained-search-20260703-01", "iter": 6, "agent": "fastdiff_flow_pixel_unconstrained-claude-agentic", "model": "claude-opus-4-8-1m", "change_class": "architecture", "status": "discard", "kept": false, "val_score": 0.7967538237571716, "headroom": 0.0, "params_M": 3.822787, "train_n": 3600, "rationale": "fastdiff_flow_pixel_unconstrained-claude-agentic: image_size=512, pixel_spacing=0.3516, n_angles=128, n_det=1024, det_spacing=0.35754, sod=500.0, sdd=1000.0, display_min=0.0, display_max=0.5, train_n=400, val_n=200, noise_i0=100000.0, noise_sigma_e=10.0, seed=42, fd_recon_ckpt=/cluster/maier/Agent4CT/checkpoints/fast_diffusion_pixel_breast.pt, fd_recon_steps=8, fd_recon_init=fbp, fd_recon_init_t=0.4, fd_recon_eta=0.2, fd_recon_dc=0, fd_recon_dc_n_cg=5, fd_recon_dc_relax=0.5, rationale=iter-6: DC-off breast-prior. Fix init_t=0.4. ONE KNOB eta 0.5->0.2. TREND (eta at init_t0.4): eta3.0 PSNR12.8 (diverged) > eta1.0 PSNR24.6 > eta0.5 PSNR27.0 (BEST) - monotonic: LOWER eta = more stable = better, because the soft DPS step overshoots when large and there is no hard DC to re-anchor. HYPOTHESIS: eta=0.2 continues the gain (even gentler guidance, FBP-init+prior dominate) -> PSNR edges higher toward the FBP baseline (36.3). Tests whether eta->0 (near pure prior-denoise of the FBP init, minimal measurement pull) is optimal for the DC-free variant.", "advice_for_others": "fastdiff_flow_pixel_unconstrained-claude-agentic: image_size=512, pixel_spacing=0.3516, n_angles=128, n_det=1024, det_spacing=0.35754, sod=500.0, sdd=1000.0, display_min=0.0, display_max=0.5, train_n=400, val_n=200, noise_i0=100000.0, noise_sigma_e=10.0, seed=42, fd_recon_ckpt=/cluster/maier/Agent4CT/checkpoints/fast_diffusion_pixel_breast.pt, fd_recon_steps=8, fd_recon_init=fbp, fd_recon_init_t=0.4, fd_recon_eta=0.2, fd_recon_dc=0, fd_recon_dc_n_cg=5, fd_recon_dc_relax=0.5, rationale=iter-6: DC-off breast-prior. Fix init_t=0.4. ONE KNOB eta 0.5->0.2. TREND (eta at init_t0.4): eta3.0 PSNR12.8 (diverged) > eta1.0 PSNR24.6 > eta0.5 PSNR27.0 (BEST) - monotonic: LOWER eta = more stable = better, because the soft DPS step overshoots when large and there is no hard DC to re-anchor. HYPOTHESIS: eta=0.2 continues the gain (even gentler guidance, FBP-init+prior dominate) -> PSNR edges higher toward the FBP baseline (36.3). Tests whether eta->0 (near pure prior-denoise of the FBP init, minimal measurement pull) is optimal for the DC-free variant.", "comparison_image": "runs/breast-ct-claude-agentic-fastdiff-flow-pixel-unconstrained-search-20260703-01/iterations/iter-0006/comparison.png"}
