{"ts": "2026-07-06T20:15:51Z", "run_id": "breast-ct-claude-agentic-fastdiff-flow-pixel-unconstrained-search-20260703-01", "iter": 2, "agent": "fastdiff_flow_pixel_unconstrained-claude-agentic", "model": "claude-opus-4-8-1m", "change_class": "architecture", "status": "discard", "kept": false, "val_score": 0.5904179811477661, "headroom": 0.0, "params_M": 3.822787, "train_n": 3600, "rationale": "fastdiff_flow_pixel_unconstrained-claude-agentic: image_size=512, pixel_spacing=0.3516, n_angles=128, n_det=1024, det_spacing=0.35754, sod=500.0, sdd=1000.0, display_min=0.0, display_max=0.5, train_n=400, val_n=200, noise_i0=100000.0, noise_sigma_e=10.0, seed=42, fd_recon_ckpt=/cluster/maier/Agent4CT/checkpoints/fast_diffusion_pixel_breast.pt, fd_recon_steps=8, fd_recon_init=fbp, fd_recon_init_t=0.4, fd_recon_eta=1.0, fd_recon_dc=0, fd_recon_dc_n_cg=5, fd_recon_dc_relax=0.5, rationale=iter-2: DC-off breast-prior. ONE KNOB init_t 0.7->0.4. PRIOR iter-1: hr=0, PSNR 19.0 vs sparse-FBP baseline PSNR 36.3 (RMSE 3.8e-2 vs 5.2e-3) - the DC-free sampler drifted far from measurement. FAILURE MODE: init_t=0.7 injects 70% noise into the FBP embedding; with NO hard DC anchor and only soft DPS guidance the generative prior hallucinates plausible breast texture and loses fidelity. HYPOTHESIS: lowering init_t to 0.4 injects less noise so the DC-free sampler stays anchored near the measured FBP -> PSNR/RMSE improve toward baseline. init_t is the dominant fidelity lever when DC is off.", "advice_for_others": "fastdiff_flow_pixel_unconstrained-claude-agentic: image_size=512, pixel_spacing=0.3516, n_angles=128, n_det=1024, det_spacing=0.35754, sod=500.0, sdd=1000.0, display_min=0.0, display_max=0.5, train_n=400, val_n=200, noise_i0=100000.0, noise_sigma_e=10.0, seed=42, fd_recon_ckpt=/cluster/maier/Agent4CT/checkpoints/fast_diffusion_pixel_breast.pt, fd_recon_steps=8, fd_recon_init=fbp, fd_recon_init_t=0.4, fd_recon_eta=1.0, fd_recon_dc=0, fd_recon_dc_n_cg=5, fd_recon_dc_relax=0.5, rationale=iter-2: DC-off breast-prior. ONE KNOB init_t 0.7->0.4. PRIOR iter-1: hr=0, PSNR 19.0 vs sparse-FBP baseline PSNR 36.3 (RMSE 3.8e-2 vs 5.2e-3) - the DC-free sampler drifted far from measurement. FAILURE MODE: init_t=0.7 injects 70% noise into the FBP embedding; with NO hard DC anchor and only soft DPS guidance the generative prior hallucinates plausible breast texture and loses fidelity. HYPOTHESIS: lowering init_t to 0.4 injects less noise so the DC-free sampler stays anchored near the measured FBP -> PSNR/RMSE improve toward baseline. init_t is the dominant fidelity lever when DC is off.", "comparison_image": "runs/breast-ct-claude-agentic-fastdiff-flow-pixel-unconstrained-search-20260703-01/iterations/iter-0002/comparison.png"}
{"ts": "2026-07-06T20:05:26Z", "run_id": "breast-ct-claude-agentic-fastdiff-flow-pixel-unconstrained-search-20260703-01", "iter": 1, "agent": "fastdiff_flow_pixel_unconstrained-claude-agentic", "model": "claude-opus-4-8-1m", "change_class": "architecture", "status": "discard", "kept": false, "val_score": 0.6896629333496094, "headroom": 0.0, "params_M": 3.822787, "train_n": 3600, "rationale": "fastdiff_flow_pixel_unconstrained-claude-agentic: image_size=512, pixel_spacing=0.3516, n_angles=128, n_det=1024, det_spacing=0.35754, sod=500.0, sdd=1000.0, display_min=0.0, display_max=0.5, train_n=400, val_n=200, noise_i0=100000.0, noise_sigma_e=10.0, seed=42, fd_recon_ckpt=/cluster/maier/Agent4CT/checkpoints/fast_diffusion_pixel_breast.pt, fd_recon_steps=8, fd_recon_init=fbp, fd_recon_init_t=0.7, fd_recon_eta=1.0, fd_recon_dc=0, fd_recon_dc_n_cg=5, fd_recon_dc_relax=0.5, rationale=iter-1 RE-RUN fastdiff_flow_pixel_unconstrained with the BREAST-NATIVE prior (fast_diffusion_pixel_breast.pt, out_scale=0.5, n_train=3600) and DC-PROJECTION OFF (fd_recon_dc=0) = genuine UNCONSTRAINED variant (pure DPS-guided generative sampling from the prior, NO hard CG data-consistency projection). This is the FAIR test: the campaign's 4 fastdiff solvers all scored hr=0 using the OUT-OF-DOMAIN Mayo prior (out_scale 0.05 vs breast 0.5). SIX-BOX: (1) PRIOR: same-slug Mayo-prior run (hr=0 all 20 iters, val_ssim plateaued ~0.895, DC ON) + constrained-sibling breast-prior run (contrast). (2) FAILURE MODE observed in the Mayo-prior run: out_scale mismatch pinned recon intensity 10x too low -> RMSE never beat sparse FBP baseline (hr=0). Breast prior fixes the intensity scale. (3) ONE KNOB vs constrained sibling: fd_recon_dc 1->0 (DC projection OFF); vs Mayo-prior run: ckpt swapped to breast-native. (4) HYPOTHESIS: the breast-native prior alone (DC off) may partially clear the 128-view sparse FBP baseline via the learned prior filling the null space, but is EXPECTED to UNDERPERFORM the DC-on constrained sibling because without the CG projection there is no hard sinogram fidelity anchor - that gap IS the finding (how much the breast prior contributes vs the DC step). (5) BUDGET: 200 slices x 8-step Euler (no CG since DC off) at 512^2, single shared breast PYRO-NN projector; fits the HARD 20-min budget (30-min sbatch wall). (6) Loop continues; iter-2 self-dispatched on landing, tuning sampler knobs (steps, init_t, eta). out_scale auto-reads from ckpt (0.5); pixel domain auto-detected.", "advice_for_others": "fastdiff_flow_pixel_unconstrained-claude-agentic: image_size=512, pixel_spacing=0.3516, n_angles=128, n_det=1024, det_spacing=0.35754, sod=500.0, sdd=1000.0, display_min=0.0, display_max=0.5, train_n=400, val_n=200, noise_i0=100000.0, noise_sigma_e=10.0, seed=42, fd_recon_ckpt=/cluster/maier/Agent4CT/checkpoints/fast_diffusion_pixel_breast.pt, fd_recon_steps=8, fd_recon_init=fbp, fd_recon_init_t=0.7, fd_recon_eta=1.0, fd_recon_dc=0, fd_recon_dc_n_cg=5, fd_recon_dc_relax=0.5, rationale=iter-1 RE-RUN fastdiff_flow_pixel_unconstrained with the BREAST-NATIVE prior (fast_diffusion_pixel_breast.pt, out_scale=0.5, n_train=3600) and DC-PROJECTION OFF (fd_recon_dc=0) = genuine UNCONSTRAINED variant (pure DPS-guided generative sampling from the prior, NO hard CG data-consistency projection). This is the FAIR test: the campaign's 4 fastdiff solvers all scored hr=0 using the OUT-OF-DOMAIN Mayo prior (out_scale 0.05 vs breast 0.5). SIX-BOX: (1) PRIOR: same-slug Mayo-prior run (hr=0 all 20 iters, val_ssim plateaued ~0.895, DC ON) + constrained-sibling breast-prior run (contrast). (2) FAILURE MODE observed in the Mayo-prior run: out_scale mismatch pinned recon intensity 10x too low -> RMSE never beat sparse FBP baseline (hr=0). Breast prior fixes the intensity scale. (3) ONE KNOB vs constrained sibling: fd_recon_dc 1->0 (DC projection OFF); vs Mayo-prior run: ckpt swapped to breast-native. (4) HYPOTHESIS: the breast-native prior alone (DC off) may partially clear the 128-view sparse FBP baseline via the learned prior filling the null space, but is EXPECTED to UNDERPERFORM the DC-on constrained sibling because without the CG projection there is no hard sinogram fidelity anchor - that gap IS the finding (how much the breast prior contributes vs the DC step). (5) BUDGET: 200 slices x 8-step Euler (no CG since DC off) at 512^2, single shared breast PYRO-NN projector; fits the HARD 20-min budget (30-min sbatch wall). (6) Loop continues; iter-2 self-dispatched on landing, tuning sampler knobs (steps, init_t, eta). out_scale auto-reads from ckpt (0.5); pixel domain auto-detected.", "comparison_image": "runs/breast-ct-claude-agentic-fastdiff-flow-pixel-unconstrained-search-20260703-01/iterations/iter-0001/comparison.png"}
{"ts": "2026-07-06T19:50:15Z", "run_id": "breast-ct-claude-agentic-param-efficient-search-20260703-01", "iter": 8, "agent": "param_efficient-claude-agentic", "model": "claude-opus-4-8-1m", "change_class": "architecture", "status": "keep", "kept": true, "val_score": 0.9849401712417603, "headroom": 0.18147174360480633, "params_M": 0.001938, "train_n": 200, "rationale": "param_efficient-claude-agentic: reg_type=foe, bilateral_on_top=True, proj_filter_on=True, n_iter=5, learnable_alpha=True, alpha_init=0.1, foe_n_filters=24, foe_kernel=7, foe_n_bumps=31, n_bf=3, bf_multiscale=True, bf_sigmas=[0.8, 1.6, 3.2], bf_kernel=7, bf_sigma_r=0.02, bf_gain_init=0.0, epochs=16, cosine_lr=True, lr=0.005, max_train_s=1080, batch_size=4, train_n=200, val_n=200, display_min=0.0, display_max=0.05, seed=42, rationale=iter-8 param_efficient breast -- PROJECTION-DOMAIN FILTER ON (sparse-view-native lever). SIX-BOX: (1) PRIOR: 7 iters prove the config-only GD-unroll caps at image-domain ~0.26. iter-7 per_step_alpha gave IDENTICAL 0.1897 to iter-2 -- the 5 per-step alphas COLLAPSED to one shared value; the loss landscape has no incentive to differentiate them, so config-only per-step-alpha CANNOT express a genuine VN. Combined with iter-6 (deeper DC WORSE = streak re-injection), verdict: the image-domain DC gradient R^T(Rx-g) is corrupting on 128-view sparse and no image-side knob escapes ~0.26. (2) FAILURE MODE: image-domain-only ceiling; the DC gradient re-injects streaks; no config knob learns to combine it. (3) ONE KNOB: proj_filter_on False->True (Manduca sinogram bilateral, +5 params: 3 sigma + log_N0 + 1 zero-init gain). It denoises the LOG-SINOGRAM on the Anscombe sqrt-count (noise-adaptive) BEFORE the FBP init, then recomputes x0 from the FILTERED sino, so it removes streak-CAUSING projection inconsistencies at the SOURCE rather than fighting them in image space. On dense Mayo this was null (FBP already averages proj noise); on 128-view SPARSE it is the native lever. All else byte-for-byte iter-2 (FoE+bilateral K5). (4) HYPOTHESIS: cleaning the sinogram before back-projection reduces the coherent streaks the FBP init injects, so the FoE+DC unroll starts from a cleaner image and hr exceeds 0.264, because sparse-view streaks are a PROJECTION-domain defect and this is the one lever VN/LPD lack. Zero-init gain => at init pipeline==iter-2 byte-for-byte (worst case == 0.190, no regression). (5) BUDGET: +1 sinogram bilateral per forward (cheap vs the K=5 image unroll); train_n=200, 1080s backstop + 200-val -> <20min. (6) SERIAL; iter-9 self-dispatches (next: if proj-filter helps, TUNE its sigma_r/gain or make it multi-scale; if not, directional streak reg +3p)., proj_n_bf=1, proj_multiscale=False, proj_kernel=5, proj_sigma_x=0.83, proj_sigma_y=0.83, proj_sigma_r=1.5, proj_gain_init=0.0, proj_N0=100000.0, per_step_alpha=False", "advice_for_others": "param_efficient-claude-agentic: reg_type=foe, bilateral_on_top=True, proj_filter_on=True, n_iter=5, learnable_alpha=True, alpha_init=0.1, foe_n_filters=24, foe_kernel=7, foe_n_bumps=31, n_bf=3, bf_multiscale=True, bf_sigmas=[0.8, 1.6, 3.2], bf_kernel=7, bf_sigma_r=0.02, bf_gain_init=0.0, epochs=16, cosine_lr=True, lr=0.005, max_train_s=1080, batch_size=4, train_n=200, val_n=200, display_min=0.0, display_max=0.05, seed=42, rationale=iter-8 param_efficient breast -- PROJECTION-DOMAIN FILTER ON (sparse-view-native lever). SIX-BOX: (1) PRIOR: 7 iters prove the config-only GD-unroll caps at image-domain ~0.26. iter-7 per_step_alpha gave IDENTICAL 0.1897 to iter-2 -- the 5 per-step alphas COLLAPSED to one shared value; the loss landscape has no incentive to differentiate them, so config-only per-step-alpha CANNOT express a genuine VN. Combined with iter-6 (deeper DC WORSE = streak re-injection), verdict: the image-domain DC gradient R^T(Rx-g) is corrupting on 128-view sparse and no image-side knob escapes ~0.26. (2) FAILURE MODE: image-domain-only ceiling; the DC gradient re-injects streaks; no config knob learns to combine it. (3) ONE KNOB: proj_filter_on False->True (Manduca sinogram bilateral, +5 params: 3 sigma + log_N0 + 1 zero-init gain). It denoises the LOG-SINOGRAM on the Anscombe sqrt-count (noise-adaptive) BEFORE the FBP init, then recomputes x0 from the FILTERED sino, so it removes streak-CAUSING projection inconsistencies at the SOURCE rather than fighting them in image space. On dense Mayo this was null (FBP already averages proj noise); on 128-view SPARSE it is the native lever. All else byte-for-byte iter-2 (FoE+bilateral K5). (4) HYPOTHESIS: cleaning the sinogram before back-projection reduces the coherent streaks the FBP init injects, so the FoE+DC unroll starts from a cleaner image and hr exceeds 0.264, because sparse-view streaks are a PROJECTION-domain defect and this is the one lever VN/LPD lack. Zero-init gain => at init pipeline==iter-2 byte-for-byte (worst case == 0.190, no regression). (5) BUDGET: +1 sinogram bilateral per forward (cheap vs the K=5 image unroll); train_n=200, 1080s backstop + 200-val -> <20min. (6) SERIAL; iter-9 self-dispatches (next: if proj-filter helps, TUNE its sigma_r/gain or make it multi-scale; if not, directional streak reg +3p)., proj_n_bf=1, proj_multiscale=False, proj_kernel=5, proj_sigma_x=0.83, proj_sigma_y=0.83, proj_sigma_r=1.5, proj_gain_init=0.0, proj_N0=100000.0, per_step_alpha=False", "comparison_image": "runs/breast-ct-claude-agentic-param-efficient-search-20260703-01/iterations/iter-0008/comparison.png"}
{"ts": "2026-07-06T18:12:13Z", "run_id": "breast-ct-claude-agentic-param-efficient-search-20260703-01", "iter": 7, "agent": "param_efficient-claude-agentic", "model": "claude-opus-4-8-1m", "change_class": "architecture", "status": "keep", "kept": true, "val_score": 0.9853033423423767, "headroom": 0.18967538458502098, "params_M": 0.001937, "train_n": 200, "rationale": "param_efficient-claude-agentic: reg_type=foe, bilateral_on_top=True, proj_filter_on=False, n_iter=5, learnable_alpha=True, alpha_init=0.1, foe_n_filters=24, foe_kernel=7, foe_n_bumps=31, n_bf=3, bf_multiscale=True, bf_sigmas=[0.8, 1.6, 3.2], bf_kernel=7, bf_sigma_r=0.02, bf_gain_init=0.0, epochs=16, cosine_lr=True, lr=0.005, max_train_s=1080, batch_size=4, train_n=200, val_n=200, display_min=0.0, display_max=0.05, seed=42, rationale=iter-7 param_efficient breast -- LEARNED PER-STEP DC WEIGHT (step toward VN). SIX-BOX: (1) PRIOR: 6 iters map the plain tied-GD unroll. KEY new finding iter-6: deep DC (K20) on the lean prox gave hr 0.0 -- DEEPER DC made it WORSE (0.066->0.0), not better. So the problem is NOT under-consistency: on 128-view sparse data the DC gradient R^T(Rx-g) itself is CORRUPTING -- with only 128 views R^T R is a STREAKY operator, so back-projecting the residual RE-INJECTS coherent streaks; iterating it 20x AMPLIFIES exactly what we want removed. This is why LPD (primal-dual) + VN (learned per-step gradient weighting) win and a plain repeated R^T(Rx-g) GD unroll caps ~image-domain. Best point stays iter-1 0.264 (FoE capacity as image cleanup). (2) FAILURE MODE: raw tied DC gradient amplifies streaks over steps; a SINGLE shared scalar alpha can't attenuate the harmful later steps. (3) ONE KNOB: per_step_alpha False->True on the FoE+bilateral K5 arch (iter-2 base, the fully-trained 0.190 config). +4 params (5 per-step alphas vs 1) -> ~1937 total. This is the MINIMAL move from plain-GD toward VN: each step learns its OWN DC weight, so the net can DOWN-WEIGHT the streak-amplifying later steps. (4) HYPOTHESIS: learned per-step alphas let the unroll learn to apply DC strongly early (coarse consistency) then softly late (avoid streak re-injection), rescuing the fully-trained FoE from the over-regularize/corrupt regime -> hr exceeds 0.264, because per-step DC weighting is VN's core trick and it directly targets the iter-6 corruption finding. (5) BUDGET: K=5 FoE+bilateral, train_n=200, 1080s backstop + 200-val -> <20min (same cost as iter-2). (6) SERIAL; iter-8 self-dispatches (next: if per-step helps, sweep K deeper WITH per-step alphas; if not, projection-domain filter +5p)., per_step_alpha=True", "advice_for_others": "param_efficient-claude-agentic: reg_type=foe, bilateral_on_top=True, proj_filter_on=False, n_iter=5, learnable_alpha=True, alpha_init=0.1, foe_n_filters=24, foe_kernel=7, foe_n_bumps=31, n_bf=3, bf_multiscale=True, bf_sigmas=[0.8, 1.6, 3.2], bf_kernel=7, bf_sigma_r=0.02, bf_gain_init=0.0, epochs=16, cosine_lr=True, lr=0.005, max_train_s=1080, batch_size=4, train_n=200, val_n=200, display_min=0.0, display_max=0.05, seed=42, rationale=iter-7 param_efficient breast -- LEARNED PER-STEP DC WEIGHT (step toward VN). SIX-BOX: (1) PRIOR: 6 iters map the plain tied-GD unroll. KEY new finding iter-6: deep DC (K20) on the lean prox gave hr 0.0 -- DEEPER DC made it WORSE (0.066->0.0), not better. So the problem is NOT under-consistency: on 128-view sparse data the DC gradient R^T(Rx-g) itself is CORRUPTING -- with only 128 views R^T R is a STREAKY operator, so back-projecting the residual RE-INJECTS coherent streaks; iterating it 20x AMPLIFIES exactly what we want removed. This is why LPD (primal-dual) + VN (learned per-step gradient weighting) win and a plain repeated R^T(Rx-g) GD unroll caps ~image-domain. Best point stays iter-1 0.264 (FoE capacity as image cleanup). (2) FAILURE MODE: raw tied DC gradient amplifies streaks over steps; a SINGLE shared scalar alpha can't attenuate the harmful later steps. (3) ONE KNOB: per_step_alpha False->True on the FoE+bilateral K5 arch (iter-2 base, the fully-trained 0.190 config). +4 params (5 per-step alphas vs 1) -> ~1937 total. This is the MINIMAL move from plain-GD toward VN: each step learns its OWN DC weight, so the net can DOWN-WEIGHT the streak-amplifying later steps. (4) HYPOTHESIS: learned per-step alphas let the unroll learn to apply DC strongly early (coarse consistency) then softly late (avoid streak re-injection), rescuing the fully-trained FoE from the over-regularize/corrupt regime -> hr exceeds 0.264, because per-step DC weighting is VN's core trick and it directly targets the iter-6 corruption finding. (5) BUDGET: K=5 FoE+bilateral, train_n=200, 1080s backstop + 200-val -> <20min (same cost as iter-2). (6) SERIAL; iter-8 self-dispatches (next: if per-step helps, sweep K deeper WITH per-step alphas; if not, projection-domain filter +5p)., per_step_alpha=True", "comparison_image": "runs/breast-ct-claude-agentic-param-efficient-search-20260703-01/iterations/iter-0007/comparison.png"}
