{"ts": "2026-07-06T01:27:53Z", "run_id": "breast-ct-claude-agentic-dual-domain-n2i-search-20260703-01", "iter": 9, "agent": "dual_domain_n2i-claude-agentic", "model": "claude-opus-4-8-1m", "change_class": "architecture", "status": "discard", "kept": false, "val_score": 0.9451594352722168, "headroom": 0.0, "params_M": 0.117298, "train_n": 400, "rationale": "dual_domain_n2i-claude-agentic: warm_start=True, pretrain_epochs=3, pretrain_steps=0, n_iter=50, grad_clip=1.0, outer_wall_s=1400, per_scene_s=None, batch_size=1, lr=0.0003, optimizer=adam, unet_c=8, train_n=400, val_n=200, seed=42, rationale=iter-9 SIX-BOX. (1) PRIOR: iter-8 hr=0.0, stronger warm-start pretrain_epochs=10 gave rmse=0.00637, ssim=0.938 -- no better than ep=3; the amortised warm-start is ALSO over-smoothed, so entrenching it doesn't help. Best remains iter-6 (lr=3e-4, n_iter=50, c=16, ep=3, rmse=0.00628). Iters 1-8 all hr=0. (2) FAILURE MODE: plain-UNet N2I regresses to the over-smoothed FBP mean regardless of budget/capacity-up/warm-start strength/lr. (3) ONE KNOB: relative to iter-6 best reference, unet_c 16 -> 8 (both denoisers; ~0.12M params). iter-3 already tested c=32 (up); this tests c=8 (DOWN) to complete the capacity sweep. (4) HYPOTHESIS: a smaller-capacity denoiser has LESS ability to regress toward the smooth low-frequency mean, so it may leave more high-frequency structure intact and lower rmse; if hr rises, the denoiser was over-parameterized for the blur. Per the ceiling, more likely c=8 is simply a weaker denoiser that still cannot beat the FBP target and may even raise rmse (hr=0). Together with iter-3 (c=32) this brackets capacity: if BOTH c=8 and c=32 give hr=0, capacity is conclusively NOT the lever. (5) BUDGET: c=8 fast; pretrain ep=3 + 200*50-step fits + figure ~= 12 min << 30-min wall. (6) Loop continues; iter-10 self-dispatched. Reserved levers: n_iter=100 mid, grad_clip off, seed variance check, pretrain_steps cap, lr=1e-4 very gentle.", "advice_for_others": "dual_domain_n2i-claude-agentic: warm_start=True, pretrain_epochs=3, pretrain_steps=0, n_iter=50, grad_clip=1.0, outer_wall_s=1400, per_scene_s=None, batch_size=1, lr=0.0003, optimizer=adam, unet_c=8, train_n=400, val_n=200, seed=42, rationale=iter-9 SIX-BOX. (1) PRIOR: iter-8 hr=0.0, stronger warm-start pretrain_epochs=10 gave rmse=0.00637, ssim=0.938 -- no better than ep=3; the amortised warm-start is ALSO over-smoothed, so entrenching it doesn't help. Best remains iter-6 (lr=3e-4, n_iter=50, c=16, ep=3, rmse=0.00628). Iters 1-8 all hr=0. (2) FAILURE MODE: plain-UNet N2I regresses to the over-smoothed FBP mean regardless of budget/capacity-up/warm-start strength/lr. (3) ONE KNOB: relative to iter-6 best reference, unet_c 16 -> 8 (both denoisers; ~0.12M params). iter-3 already tested c=32 (up); this tests c=8 (DOWN) to complete the capacity sweep. (4) HYPOTHESIS: a smaller-capacity denoiser has LESS ability to regress toward the smooth low-frequency mean, so it may leave more high-frequency structure intact and lower rmse; if hr rises, the denoiser was over-parameterized for the blur. Per the ceiling, more likely c=8 is simply a weaker denoiser that still cannot beat the FBP target and may even raise rmse (hr=0). Together with iter-3 (c=32) this brackets capacity: if BOTH c=8 and c=32 give hr=0, capacity is conclusively NOT the lever. (5) BUDGET: c=8 fast; pretrain ep=3 + 200*50-step fits + figure ~= 12 min << 30-min wall. (6) Loop continues; iter-10 self-dispatched. Reserved levers: n_iter=100 mid, grad_clip off, seed variance check, pretrain_steps cap, lr=1e-4 very gentle.", "comparison_image": "runs/breast-ct-claude-agentic-dual-domain-n2i-search-20260703-01/iterations/iter-0009/comparison.png"}
{"ts": "2026-07-06T01:25:38Z", "run_id": "breast-ct-claude-agentic-naf-search-20260703-01", "iter": 7, "agent": "naf-claude-agentic", "model": "claude-opus-4-8-1m", "change_class": "architecture", "status": "discard", "kept": false, "val_score": 0.35450929403305054, "headroom": 0.0, "params_M": 0.037633, "train_n": 0, "rationale": "naf-claude-agentic: val_n=12, naf_n_freqs=8, naf_hidden=128, naf_layers=4, naf_n_iter=8000, naf_lr=0.01, naf_tv_weight=0.0, naf_n_clip=0.05, naf_outer_wall_s=800, naf_per_scene_s=60.0, naf_encoding=fourier, seed=42, rationale=iter-7 breast-ct-claude-agentic-naf-search-20260703-01 (redone breast split train3600/val200/test200 seed20260703; val_n=12 CONSTANT for iters 2-20 per coordinator budget intervention 2026-07-05 -- first-12 of the 200-case breast val split, deterministic). SIX-BOX: (1) prior result: all iters so far hr=0 (iter-1 val_n=20 ssim0.355 PSNR6.26 in 970s, NOT a timeout -- a genuine converged fit). (2) failure mode: NAF per-scene INR recon is far below the 128-view breast LD-FBP baseline. (3) ONE knob changed: naf_tv_weight 1e-4->0. (4) hypothesis: iters 5-6 (lr sweep) hr=0. KNOB: drop TV prior 1e-4->0 (pure data fit, no smoothing). HYPOTHESIS: TV may be over-smoothing already-blurry NAF output; removing it lets the field sharpen. Expect hr=0 -- NAF's problem is under-resolution, not over-smoothing. (5) wall: val_n=12 x per_scene 60.0s = ~720s < 20min. (6) serial, no user return.", "advice_for_others": "naf-claude-agentic: val_n=12, naf_n_freqs=8, naf_hidden=128, naf_layers=4, naf_n_iter=8000, naf_lr=0.01, naf_tv_weight=0.0, naf_n_clip=0.05, naf_outer_wall_s=800, naf_per_scene_s=60.0, naf_encoding=fourier, seed=42, rationale=iter-7 breast-ct-claude-agentic-naf-search-20260703-01 (redone breast split train3600/val200/test200 seed20260703; val_n=12 CONSTANT for iters 2-20 per coordinator budget intervention 2026-07-05 -- first-12 of the 200-case breast val split, deterministic). SIX-BOX: (1) prior result: all iters so far hr=0 (iter-1 val_n=20 ssim0.355 PSNR6.26 in 970s, NOT a timeout -- a genuine converged fit). (2) failure mode: NAF per-scene INR recon is far below the 128-view breast LD-FBP baseline. (3) ONE knob changed: naf_tv_weight 1e-4->0. (4) hypothesis: iters 5-6 (lr sweep) hr=0. KNOB: drop TV prior 1e-4->0 (pure data fit, no smoothing). HYPOTHESIS: TV may be over-smoothing already-blurry NAF output; removing it lets the field sharpen. Expect hr=0 -- NAF's problem is under-resolution, not over-smoothing. (5) wall: val_n=12 x per_scene 60.0s = ~720s < 20min. (6) serial, no user return.", "comparison_image": "runs/breast-ct-claude-agentic-naf-search-20260703-01/iterations/iter-0007/comparison.png"}
{"ts": "2026-07-06T01:21:32Z", "run_id": "breast-ct-claude-agentic-dual-domain-bilateral-n2i-search-20260703-01", "iter": 20, "agent": "dual_domain_bilateral_n2i-claude-agentic", "model": "claude-opus-4-8-1m", "change_class": "architecture", "status": "keep", "kept": true, "val_score": 0.9591338634490967, "headroom": 0.20344853568888321, "params_M": 6e-06, "train_n": 400, "rationale": "dual_domain_bilateral_n2i-claude-agentic: warm_start=True, pretrain_epochs=2, train_n=400, n_iter=60, val_n=200, batch_size=1, grad_clip=1.0, lr=0.003, proj_n_bf=1, img_n_bf=1, img_sr=0.0003, outer_wall_s=1300, seed=42, rationale=iter-20 (FINAL) dual_domain_bilateral_n2i, ONE-KNOB: image BF range sigma img_sr 0.0002->0.0003, on the fully-tuned CHAMPION base (warm_start=True, pretrain_epochs=2, lr=3e-3, n_iter=60; iter-15 hr=0.2056 = campaign best). pretrain_epochs CONFIRMED at 2 (iter-19 pretrain=1 -> 0.1769 under-seed; iter-18 pretrain=5 -> 0.0403 warm-start over-smooths; clean bell curve peaked at 2). RATIONALE for revisiting img_sr: it was tuned back at iter-5/7 under the OLD regime (lr=5e-3, n_iter=30); the whole optimum has since moved (gentle lr=3e-3, n_iter=60), so the ideal edge-preserving range sigma may have shifted. 0.0003 sits between the iter-5 value (5e-4, hr0.1257) and iter-7 (2e-4, hr0.1261) -- re-locating the range optimum under the FINAL lr/n_iter. HYPOTHESIS: if hr>0.2056, the range optimum shifted up to ~3e-4 under gentle lr and this is the new champion; if <=, 2e-4 remains optimal and 0.2056 (iter-15) is the confirmed campaign ceiling. SECONDARY: outer_wall_s raised 1000->1300 so the FINAL iter scores a CLEAN val_n=200 (iters 15/16/19 trimmed to 196-197 at n_iter=60 under a 900-1000s wall) -- gives an unambiguous full-200 endpoint. Still fits the 1800s sbatch wall. ONE knob: img_sr 0.0002->0.0003 (wall raised only to preserve val_n=200, not a second lever).", "advice_for_others": "dual_domain_bilateral_n2i-claude-agentic: warm_start=True, pretrain_epochs=2, train_n=400, n_iter=60, val_n=200, batch_size=1, grad_clip=1.0, lr=0.003, proj_n_bf=1, img_n_bf=1, img_sr=0.0003, outer_wall_s=1300, seed=42, rationale=iter-20 (FINAL) dual_domain_bilateral_n2i, ONE-KNOB: image BF range sigma img_sr 0.0002->0.0003, on the fully-tuned CHAMPION base (warm_start=True, pretrain_epochs=2, lr=3e-3, n_iter=60; iter-15 hr=0.2056 = campaign best). pretrain_epochs CONFIRMED at 2 (iter-19 pretrain=1 -> 0.1769 under-seed; iter-18 pretrain=5 -> 0.0403 warm-start over-smooths; clean bell curve peaked at 2). RATIONALE for revisiting img_sr: it was tuned back at iter-5/7 under the OLD regime (lr=5e-3, n_iter=30); the whole optimum has since moved (gentle lr=3e-3, n_iter=60), so the ideal edge-preserving range sigma may have shifted. 0.0003 sits between the iter-5 value (5e-4, hr0.1257) and iter-7 (2e-4, hr0.1261) -- re-locating the range optimum under the FINAL lr/n_iter. HYPOTHESIS: if hr>0.2056, the range optimum shifted up to ~3e-4 under gentle lr and this is the new champion; if <=, 2e-4 remains optimal and 0.2056 (iter-15) is the confirmed campaign ceiling. SECONDARY: outer_wall_s raised 1000->1300 so the FINAL iter scores a CLEAN val_n=200 (iters 15/16/19 trimmed to 196-197 at n_iter=60 under a 900-1000s wall) -- gives an unambiguous full-200 endpoint. Still fits the 1800s sbatch wall. ONE knob: img_sr 0.0002->0.0003 (wall raised only to preserve val_n=200, not a second lever).", "comparison_image": "runs/breast-ct-claude-agentic-dual-domain-bilateral-n2i-search-20260703-01/iterations/iter-0020/comparison.png"}
{"ts": "2026-07-06T00:54:03Z", "run_id": "breast-ct-claude-agentic-dual-domain-bilateral-n2i-search-20260703-01", "iter": 19, "agent": "dual_domain_bilateral_n2i-claude-agentic", "model": "claude-opus-4-8-1m", "change_class": "architecture", "status": "keep", "kept": true, "val_score": 0.9520886540412903, "headroom": 0.17688781489739858, "params_M": 6e-06, "train_n": 400, "rationale": "dual_domain_bilateral_n2i-claude-agentic: warm_start=True, pretrain_epochs=1, train_n=400, n_iter=60, val_n=200, batch_size=1, grad_clip=1.0, lr=0.003, proj_n_bf=1, img_n_bf=1, img_sr=0.0002, outer_wall_s=1000, seed=42, rationale=iter-19 dual_domain_bilateral_n2i, ONE-KNOB: pretrain_epochs 2->1 (SHORTER warm-start), on CHAMPION base (img_sr=0.0002, lr=3e-3, n_iter=60; iter-15 hr=0.2056). warm-start DEPTH now shows a NON-MONOTONE sweet spot: 0 epochs (warm_start=False, iter-17) -> hr=0.0025 CRASH (no seed); 2 epochs (iter-15) -> 0.2056 PEAK; 5 epochs (iter-18) -> 0.0403 CRASH. The 5-epoch collapse = the AMORTISED warm-start ITSELF over-smooths (the N2I-over-smoothing bias operates in the warm-start pre-pass too, using the WIDE default sigmas), seeding a blurred init the tight per-scene img_sr cannot recover. So the warm-start must be SHORT: enough to seed, not enough to over-smooth. HYPOTHESIS: 1 epoch is even less over-smoothed than 2 while still providing the essential non-crash seed -> hr >= 0.2056 (possibly higher if 2 epochs already began mild over-smoothing). If hr < 0.2056, 2 epochs is the sweet spot (1 under-seeds). This MAPS the warm-start sweet spot precisely for the paper. WALL: pretrain 2->1 SAVES warm steps, ~950-1000s, val_n~196-200. ONE knob: pretrain_epochs 2->1.", "advice_for_others": "dual_domain_bilateral_n2i-claude-agentic: warm_start=True, pretrain_epochs=1, train_n=400, n_iter=60, val_n=200, batch_size=1, grad_clip=1.0, lr=0.003, proj_n_bf=1, img_n_bf=1, img_sr=0.0002, outer_wall_s=1000, seed=42, rationale=iter-19 dual_domain_bilateral_n2i, ONE-KNOB: pretrain_epochs 2->1 (SHORTER warm-start), on CHAMPION base (img_sr=0.0002, lr=3e-3, n_iter=60; iter-15 hr=0.2056). warm-start DEPTH now shows a NON-MONOTONE sweet spot: 0 epochs (warm_start=False, iter-17) -> hr=0.0025 CRASH (no seed); 2 epochs (iter-15) -> 0.2056 PEAK; 5 epochs (iter-18) -> 0.0403 CRASH. The 5-epoch collapse = the AMORTISED warm-start ITSELF over-smooths (the N2I-over-smoothing bias operates in the warm-start pre-pass too, using the WIDE default sigmas), seeding a blurred init the tight per-scene img_sr cannot recover. So the warm-start must be SHORT: enough to seed, not enough to over-smooth. HYPOTHESIS: 1 epoch is even less over-smoothed than 2 while still providing the essential non-crash seed -> hr >= 0.2056 (possibly higher if 2 epochs already began mild over-smoothing). If hr < 0.2056, 2 epochs is the sweet spot (1 under-seeds). This MAPS the warm-start sweet spot precisely for the paper. WALL: pretrain 2->1 SAVES warm steps, ~950-1000s, val_n~196-200. ONE knob: pretrain_epochs 2->1.", "comparison_image": "runs/breast-ct-claude-agentic-dual-domain-bilateral-n2i-search-20260703-01/iterations/iter-0019/comparison.png"}
{"ts": "2026-07-06T00:34:16Z", "run_id": "breast-ct-claude-agentic-dual-domain-n2i-search-20260703-01", "iter": 8, "agent": "dual_domain_n2i-claude-agentic", "model": "claude-opus-4-8-1m", "change_class": "architecture", "status": "discard", "kept": false, "val_score": 0.9379792809486389, "headroom": 0.0, "params_M": 0.465762, "train_n": 400, "rationale": "dual_domain_n2i-claude-agentic: warm_start=True, pretrain_epochs=10, pretrain_steps=0, n_iter=50, grad_clip=1.0, outer_wall_s=1400, per_scene_s=None, batch_size=1, lr=0.0003, optimizer=adam, unet_c=16, train_n=400, val_n=200, seed=42, rationale=iter-8 SIX-BOX. (1) PRIOR: iter-7 hr=0.0, aggressive lr=3e-3 (n_iter=50) gave rmse=0.00657 (WORST of the run), ssim=0.931 -- the big step destabilized/over-smoothed. Best config remains iter-6: lr=3e-4, n_iter=50, rmse=0.00628. (2) FAILURE MODE: plain-UNet N2I regresses to the over-smoothed FBP mean; large lr worsens it. (3) ONE KNOB: relative to the BEST reference config (iter-6: warm_start=True, lr=3e-4, n_iter=50, pretrain_epochs=3), change ONLY pretrain_epochs 3 -> 10 (revert lr to iter-6's 3e-4). A stronger amortised warm-start = a better generic init for the 50-step per-image fits. (4) HYPOTHESIS: 10 warm-start epochs on the 400-scene train split give the denoisers a stronger, more detail-aware initialization, so the short 50-step per-image fit starts from a sharper point and lands at lower rmse. If hr rises, the warm-start init quality was the lever. Per the documented ceiling, more likely the amortised N2I warm-start ALSO converges to an over-smoothed mean (same GT-free FBP target), so a stronger warm-start just entrenches the blur (hr=0). (5) BUDGET: pretrain ep=10 (~430s) + 200*50-step fast fits (~400s) + figure ~= 15 min < 30-min wall. (6) Loop continues; iter-9 self-dispatched. Reserved levers: unet_c=8 (smaller), n_iter=100 mid, grad_clip off, seed variance check, pretrain_steps cap.", "advice_for_others": "dual_domain_n2i-claude-agentic: warm_start=True, pretrain_epochs=10, pretrain_steps=0, n_iter=50, grad_clip=1.0, outer_wall_s=1400, per_scene_s=None, batch_size=1, lr=0.0003, optimizer=adam, unet_c=16, train_n=400, val_n=200, seed=42, rationale=iter-8 SIX-BOX. (1) PRIOR: iter-7 hr=0.0, aggressive lr=3e-3 (n_iter=50) gave rmse=0.00657 (WORST of the run), ssim=0.931 -- the big step destabilized/over-smoothed. Best config remains iter-6: lr=3e-4, n_iter=50, rmse=0.00628. (2) FAILURE MODE: plain-UNet N2I regresses to the over-smoothed FBP mean; large lr worsens it. (3) ONE KNOB: relative to the BEST reference config (iter-6: warm_start=True, lr=3e-4, n_iter=50, pretrain_epochs=3), change ONLY pretrain_epochs 3 -> 10 (revert lr to iter-6's 3e-4). A stronger amortised warm-start = a better generic init for the 50-step per-image fits. (4) HYPOTHESIS: 10 warm-start epochs on the 400-scene train split give the denoisers a stronger, more detail-aware initialization, so the short 50-step per-image fit starts from a sharper point and lands at lower rmse. If hr rises, the warm-start init quality was the lever. Per the documented ceiling, more likely the amortised N2I warm-start ALSO converges to an over-smoothed mean (same GT-free FBP target), so a stronger warm-start just entrenches the blur (hr=0). (5) BUDGET: pretrain ep=10 (~430s) + 200*50-step fast fits (~400s) + figure ~= 15 min < 30-min wall. (6) Loop continues; iter-9 self-dispatched. Reserved levers: unet_c=8 (smaller), n_iter=100 mid, grad_clip off, seed variance check, pretrain_steps cap.", "comparison_image": "runs/breast-ct-claude-agentic-dual-domain-n2i-search-20260703-01/iterations/iter-0008/comparison.png"}
{"ts": "2026-07-06T00:31:06Z", "run_id": "breast-ct-claude-agentic-dual-domain-bilateral-n2i-search-20260703-01", "iter": 18, "agent": "dual_domain_bilateral_n2i-claude-agentic", "model": "claude-opus-4-8-1m", "change_class": "architecture", "status": "keep", "kept": true, "val_score": 0.9595800638198853, "headroom": 0.040300288948978524, "params_M": 6e-06, "train_n": 400, "rationale": "dual_domain_bilateral_n2i-claude-agentic: warm_start=True, pretrain_epochs=5, train_n=400, n_iter=60, val_n=200, batch_size=1, grad_clip=1.0, lr=0.003, proj_n_bf=1, img_n_bf=1, img_sr=0.0002, outer_wall_s=1000, seed=42, rationale=iter-18 dual_domain_bilateral_n2i, ONE-KNOB: pretrain_epochs 2->5 (richer warm-start init), on CHAMPION base (warm_start=True, img_sr=0.0002, lr=3e-3, n_iter=60; iter-15 hr=0.2056). warm_start REVERTED to True (iter-17 warm_start=False CRASHED to hr=0.0025, SSIM0.908 -> the warm-start pre-pass is ESSENTIAL: without a generic BF-sigma seed the 60-step per-scene fit from raw CONFIG init does not converge). HYPOTHESIS: since the warm-start init is CRITICAL, a BETTER init should help -- 5 warm-start epochs (vs 2) on the 400 train scenes give the generic BF sigmas more time to settle near the breast-optimal edge-preserving values, so each per-scene fit STARTS closer to its optimum and converges better in 60 steps -> hr above 0.2056. If FLAT/DROP, 2 warm-start epochs already saturate the generic init (the tiny 6-param BF learns its generic sigmas fast) and warm-start DEPTH is neutral -> 2 epochs is the efficient choice. WALL: pretrain 2->5 adds ~3x400=1200 warm steps ~ +90s; n_iter60 per-scene unchanged; outer_wall_s=1000, expect val_n~196-200 (report it). ONE knob: pretrain_epochs 2->5.", "advice_for_others": "dual_domain_bilateral_n2i-claude-agentic: warm_start=True, pretrain_epochs=5, train_n=400, n_iter=60, val_n=200, batch_size=1, grad_clip=1.0, lr=0.003, proj_n_bf=1, img_n_bf=1, img_sr=0.0002, outer_wall_s=1000, seed=42, rationale=iter-18 dual_domain_bilateral_n2i, ONE-KNOB: pretrain_epochs 2->5 (richer warm-start init), on CHAMPION base (warm_start=True, img_sr=0.0002, lr=3e-3, n_iter=60; iter-15 hr=0.2056). warm_start REVERTED to True (iter-17 warm_start=False CRASHED to hr=0.0025, SSIM0.908 -> the warm-start pre-pass is ESSENTIAL: without a generic BF-sigma seed the 60-step per-scene fit from raw CONFIG init does not converge). HYPOTHESIS: since the warm-start init is CRITICAL, a BETTER init should help -- 5 warm-start epochs (vs 2) on the 400 train scenes give the generic BF sigmas more time to settle near the breast-optimal edge-preserving values, so each per-scene fit STARTS closer to its optimum and converges better in 60 steps -> hr above 0.2056. If FLAT/DROP, 2 warm-start epochs already saturate the generic init (the tiny 6-param BF learns its generic sigmas fast) and warm-start DEPTH is neutral -> 2 epochs is the efficient choice. WALL: pretrain 2->5 adds ~3x400=1200 warm steps ~ +90s; n_iter60 per-scene unchanged; outer_wall_s=1000, expect val_n~196-200 (report it). ONE knob: pretrain_epochs 2->5.", "comparison_image": "runs/breast-ct-claude-agentic-dual-domain-bilateral-n2i-search-20260703-01/iterations/iter-0018/comparison.png"}
