{"ts": "2026-07-06T21:50:31Z", "run_id": "breast-ct-claude-agentic-fastdiff-wdm-wavelet-constrained-search-20260703-01", "iter": 13, "agent": "fastdiff_wdm_wavelet_constrained-claude-agentic", "model": "claude-opus-4-8-1m", "change_class": "architecture", "status": "keep", "kept": true, "val_score": 0.8817664980888367, "headroom": 0.07683779070655294, "params_M": 3.824908, "train_n": 3600, "rationale": "fastdiff_wdm_wavelet_constrained-claude-agentic: val_n=200, seed=42, fd_recon_ckpt=/cluster/maier/Agent4CT/checkpoints/fast_diffusion_wavelet_breast.pt, fd_recon_steps=8, fd_recon_init=fbp, fd_recon_init_t=0.005, fd_recon_eta=1.0, fd_recon_dc=1, fd_recon_dc_n_cg=18, fd_recon_dc_relax=1.0, dataset_kind=breast_ct, rationale=iter-13 n_cg fine-localize (18), breast-native wavelet CONSTRAINED, val=200. SIX-BOX: (1) PRIOR: n_cg@init_t0.005: 5->hr0, 15->0.0695, 20->0.0760(BEST), 25->0.043. Interior peak in 18-22. (2) FAILURE MODE: <15 under-converged, >~22 over-converged (LSQ noise re-enters). (3) ONE KNOB: n_cg 20 -> 18 (bracket the peak from below). (4) HYPOTHESIS: n_cg=18 ~ 0.072-0.076 (near the peak); if <0.0760, peak is at/above 20 -> confirm 20 optimal; if >, try 19. (5) BUDGET ~3min. (6) iter-14 on landing.", "advice_for_others": "fastdiff_wdm_wavelet_constrained-claude-agentic: val_n=200, seed=42, fd_recon_ckpt=/cluster/maier/Agent4CT/checkpoints/fast_diffusion_wavelet_breast.pt, fd_recon_steps=8, fd_recon_init=fbp, fd_recon_init_t=0.005, fd_recon_eta=1.0, fd_recon_dc=1, fd_recon_dc_n_cg=18, fd_recon_dc_relax=1.0, dataset_kind=breast_ct, rationale=iter-13 n_cg fine-localize (18), breast-native wavelet CONSTRAINED, val=200. SIX-BOX: (1) PRIOR: n_cg@init_t0.005: 5->hr0, 15->0.0695, 20->0.0760(BEST), 25->0.043. Interior peak in 18-22. (2) FAILURE MODE: <15 under-converged, >~22 over-converged (LSQ noise re-enters). (3) ONE KNOB: n_cg 20 -> 18 (bracket the peak from below). (4) HYPOTHESIS: n_cg=18 ~ 0.072-0.076 (near the peak); if <0.0760, peak is at/above 20 -> confirm 20 optimal; if >, try 19. (5) BUDGET ~3min. (6) iter-14 on landing.", "comparison_image": "runs/breast-ct-claude-agentic-fastdiff-wdm-wavelet-constrained-search-20260703-01/iterations/iter-0013/comparison.png"}
{"ts": "2026-07-06T21:48:35Z", "run_id": "breast-ct-claude-agentic-fastdiff-flow-pixel-constrained-search-20260703-01", "iter": 10, "agent": "fastdiff_flow_pixel_constrained-claude-agentic", "model": "claude-opus-4-8-1m", "change_class": "architecture", "status": "keep", "kept": true, "val_score": 0.9529603123664856, "headroom": 0.35306988852689625, "params_M": 3.822787, "train_n": 400, "rationale": "fastdiff_flow_pixel_constrained-claude-agentic: image_size=512, pixel_spacing=0.3516, n_angles=128, n_det=1024, det_spacing=0.35754, sod=500.0, sdd=1000.0, display_min=0.0, display_max=0.5, train_n=400, val_n=200, noise_i0=100000.0, noise_sigma_e=10.0, seed=42, dataset_kind=breast_ct, fd_recon_ckpt=/cluster/maier/Agent4CT/checkpoints/fast_diffusion_pixel_breast.pt, fd_recon_steps=8, fd_recon_init=fbp, fd_recon_init_t=0.02, fd_recon_eta=1.0, fd_recon_dc=1, fd_recon_dc_n_cg=30, fd_recon_dc_relax=1.0, rationale=iter-10 EXPLORATORY single knob init_t 0.05->0.02 at the peak (n_cg30,relax1.0). SIX-BOX: (1)PRIOR: at the peak (init_t0.05,n_cg30,relax1.0) hr=0.0557 (best). iter-9 tempered DC (relax0.75) got WORSE (rmse0.004924->0.005969), i.e. reducing the DC lets the prior's perturbation back in -> the gain is DC-dominated, prior slightly HURTS. (2)FAILURE: init_t0.05 still embeds a little prior-noise; at init_t->0 the recon is FBP + pure CG-DC, minimizing prior perturbation. (3)ONE KNOB: init_t 0.05->0.02 (relax1.0/n_cg30/steps8/eta1.0 held). (4)HYPOTHESIS: less prior at init_t0.02 should let the deep CG DC dominate even more cleanly, lowering rmse below 0.004924 and lifting hr above 0.0557. If it plateaus, hr~0.056 is the DC-limit for this config. (5)BUDGET: n_cg30 ~5.5min, inside 20-min. (6)Serial.", "advice_for_others": "fastdiff_flow_pixel_constrained-claude-agentic: image_size=512, pixel_spacing=0.3516, n_angles=128, n_det=1024, det_spacing=0.35754, sod=500.0, sdd=1000.0, display_min=0.0, display_max=0.5, train_n=400, val_n=200, noise_i0=100000.0, noise_sigma_e=10.0, seed=42, dataset_kind=breast_ct, fd_recon_ckpt=/cluster/maier/Agent4CT/checkpoints/fast_diffusion_pixel_breast.pt, fd_recon_steps=8, fd_recon_init=fbp, fd_recon_init_t=0.02, fd_recon_eta=1.0, fd_recon_dc=1, fd_recon_dc_n_cg=30, fd_recon_dc_relax=1.0, rationale=iter-10 EXPLORATORY single knob init_t 0.05->0.02 at the peak (n_cg30,relax1.0). SIX-BOX: (1)PRIOR: at the peak (init_t0.05,n_cg30,relax1.0) hr=0.0557 (best). iter-9 tempered DC (relax0.75) got WORSE (rmse0.004924->0.005969), i.e. reducing the DC lets the prior's perturbation back in -> the gain is DC-dominated, prior slightly HURTS. (2)FAILURE: init_t0.05 still embeds a little prior-noise; at init_t->0 the recon is FBP + pure CG-DC, minimizing prior perturbation. (3)ONE KNOB: init_t 0.05->0.02 (relax1.0/n_cg30/steps8/eta1.0 held). (4)HYPOTHESIS: less prior at init_t0.02 should let the deep CG DC dominate even more cleanly, lowering rmse below 0.004924 and lifting hr above 0.0557. If it plateaus, hr~0.056 is the DC-limit for this config. (5)BUDGET: n_cg30 ~5.5min, inside 20-min. (6)Serial.", "comparison_image": "runs/breast-ct-claude-agentic-fastdiff-flow-pixel-constrained-search-20260703-01/iterations/iter-0010/comparison.png"}
{"ts": "2026-07-06T21:46:42Z", "run_id": "breast-ct-claude-agentic-fastdiff-wdm-wavelet-constrained-search-20260703-01", "iter": 12, "agent": "fastdiff_wdm_wavelet_constrained-claude-agentic", "model": "claude-opus-4-8-1m", "change_class": "architecture", "status": "keep", "kept": true, "val_score": 0.8799880743026733, "headroom": 0.07596930017702919, "params_M": 3.824908, "train_n": 3600, "rationale": "fastdiff_wdm_wavelet_constrained-claude-agentic: val_n=200, seed=42, fd_recon_ckpt=/cluster/maier/Agent4CT/checkpoints/fast_diffusion_wavelet_breast.pt, fd_recon_steps=8, fd_recon_init=fbp, fd_recon_init_t=0.005, fd_recon_eta=1.0, fd_recon_dc=1, fd_recon_dc_n_cg=20, fd_recon_dc_relax=1.0, dataset_kind=breast_ct, rationale=iter-12 n_cg localize (15 vs 20 vs 25), breast-native wavelet CONSTRAINED, val=200. SIX-BOX: (1) PRIOR: at init_t0.005 the n_cg optimum is interior: n_cg5->hr0(RMSE5.94e-3), n_cg15->hr0.0695(4.85e-3 BEST), n_cg25->hr0.043(4.99e-3). Adding prior (init_t0.02,iter-11) hurt (hr0.012). So minimal-prior + n_cg~15 is the ridge. (2) FAILURE MODE: n_cg25 over-converged (LSQ noise); n_cg5 under-converged. (3) ONE KNOB: fd_recon_dc_n_cg 15 -> 20 (sample between the 15-peak and 25-decline to see if the optimum is >15). (4) HYPOTHESIS: n_cg=20 lands between hr0.0695 and hr0.043 (a smooth interior peak near 15-18); if it beats 0.0695 the true optimum is ~18-20, else 15 is optimal. (5) BUDGET ~3min. (6) iter-13 on landing.", "advice_for_others": "fastdiff_wdm_wavelet_constrained-claude-agentic: val_n=200, seed=42, fd_recon_ckpt=/cluster/maier/Agent4CT/checkpoints/fast_diffusion_wavelet_breast.pt, fd_recon_steps=8, fd_recon_init=fbp, fd_recon_init_t=0.005, fd_recon_eta=1.0, fd_recon_dc=1, fd_recon_dc_n_cg=20, fd_recon_dc_relax=1.0, dataset_kind=breast_ct, rationale=iter-12 n_cg localize (15 vs 20 vs 25), breast-native wavelet CONSTRAINED, val=200. SIX-BOX: (1) PRIOR: at init_t0.005 the n_cg optimum is interior: n_cg5->hr0(RMSE5.94e-3), n_cg15->hr0.0695(4.85e-3 BEST), n_cg25->hr0.043(4.99e-3). Adding prior (init_t0.02,iter-11) hurt (hr0.012). So minimal-prior + n_cg~15 is the ridge. (2) FAILURE MODE: n_cg25 over-converged (LSQ noise); n_cg5 under-converged. (3) ONE KNOB: fd_recon_dc_n_cg 15 -> 20 (sample between the 15-peak and 25-decline to see if the optimum is >15). (4) HYPOTHESIS: n_cg=20 lands between hr0.0695 and hr0.043 (a smooth interior peak near 15-18); if it beats 0.0695 the true optimum is ~18-20, else 15 is optimal. (5) BUDGET ~3min. (6) iter-13 on landing.", "comparison_image": "runs/breast-ct-claude-agentic-fastdiff-wdm-wavelet-constrained-search-20260703-01/iterations/iter-0012/comparison.png"}
{"ts": "2026-07-06T21:42:18Z", "run_id": "breast-ct-claude-agentic-fastdiff-flow-pixel-constrained-search-20260703-01", "iter": 9, "agent": "fastdiff_flow_pixel_constrained-claude-agentic", "model": "claude-opus-4-8-1m", "change_class": "architecture", "status": "discard", "kept": false, "val_score": 0.8709304332733154, "headroom": 0.0, "params_M": 3.822787, "train_n": 400, "rationale": "fastdiff_flow_pixel_constrained-claude-agentic: image_size=512, pixel_spacing=0.3516, n_angles=128, n_det=1024, det_spacing=0.35754, sod=500.0, sdd=1000.0, display_min=0.0, display_max=0.5, train_n=400, val_n=200, noise_i0=100000.0, noise_sigma_e=10.0, seed=42, dataset_kind=breast_ct, fd_recon_ckpt=/cluster/maier/Agent4CT/checkpoints/fast_diffusion_pixel_breast.pt, fd_recon_steps=8, fd_recon_init=fbp, fd_recon_init_t=0.05, fd_recon_eta=1.0, fd_recon_dc=1, fd_recon_dc_n_cg=30, fd_recon_dc_relax=0.75, rationale=iter-9 EXPLORATORY single knob dc_relax 1.0->0.75 at the peak base (init_t0.05, n_cg30, the hr=0.0557 winner). SIX-BOX: (1)PRIOR: n_cg curve fully mapped as an inverted-U (rmse): 5=0.00669, 20=0.005327, 30=0.004924(PEAK,hr0.0557), 40=0.005385, 60=0.00992 -> DC CG semi-converges, argmax n_cg30. All the >0 mass is at n_cg30. (2)FAILURE / next lever: at relax1.0 the CG projection is FULLY applied each step; the semi-convergence (noise re-amplification past the peak) suggests the projection is slightly too aggressive. A partial blend (relax<1) mixes the CG solution with the prior's clean estimate, acting as implicit regularization. (3)ONE KNOB: dc_relax 1.0->0.75 (n_cg30/init_t0.05/steps8/eta1.0 held). (4)HYPOTHESIS: a 0.75 blend tempers the noise-amplifying part of the deep CG while keeping most of the data-consistency gain, possibly lifting hr above 0.0557. (5)BUDGET: n_cg30 ~ iter-5 (~5.5min), inside 20-min. (6)Serial.", "advice_for_others": "fastdiff_flow_pixel_constrained-claude-agentic: image_size=512, pixel_spacing=0.3516, n_angles=128, n_det=1024, det_spacing=0.35754, sod=500.0, sdd=1000.0, display_min=0.0, display_max=0.5, train_n=400, val_n=200, noise_i0=100000.0, noise_sigma_e=10.0, seed=42, dataset_kind=breast_ct, fd_recon_ckpt=/cluster/maier/Agent4CT/checkpoints/fast_diffusion_pixel_breast.pt, fd_recon_steps=8, fd_recon_init=fbp, fd_recon_init_t=0.05, fd_recon_eta=1.0, fd_recon_dc=1, fd_recon_dc_n_cg=30, fd_recon_dc_relax=0.75, rationale=iter-9 EXPLORATORY single knob dc_relax 1.0->0.75 at the peak base (init_t0.05, n_cg30, the hr=0.0557 winner). SIX-BOX: (1)PRIOR: n_cg curve fully mapped as an inverted-U (rmse): 5=0.00669, 20=0.005327, 30=0.004924(PEAK,hr0.0557), 40=0.005385, 60=0.00992 -> DC CG semi-converges, argmax n_cg30. All the >0 mass is at n_cg30. (2)FAILURE / next lever: at relax1.0 the CG projection is FULLY applied each step; the semi-convergence (noise re-amplification past the peak) suggests the projection is slightly too aggressive. A partial blend (relax<1) mixes the CG solution with the prior's clean estimate, acting as implicit regularization. (3)ONE KNOB: dc_relax 1.0->0.75 (n_cg30/init_t0.05/steps8/eta1.0 held). (4)HYPOTHESIS: a 0.75 blend tempers the noise-amplifying part of the deep CG while keeping most of the data-consistency gain, possibly lifting hr above 0.0557. (5)BUDGET: n_cg30 ~ iter-5 (~5.5min), inside 20-min. (6)Serial.", "comparison_image": "runs/breast-ct-claude-agentic-fastdiff-flow-pixel-constrained-search-20260703-01/iterations/iter-0009/comparison.png"}
{"ts": "2026-07-06T21:41:52Z", "run_id": "breast-ct-claude-agentic-fastdiff-wdm-wavelet-constrained-search-20260703-01", "iter": 11, "agent": "fastdiff_wdm_wavelet_constrained-claude-agentic", "model": "claude-opus-4-8-1m", "change_class": "architecture", "status": "keep", "kept": true, "val_score": 0.8808329701423645, "headroom": 0.011863268066009569, "params_M": 3.824908, "train_n": 3600, "rationale": "fastdiff_wdm_wavelet_constrained-claude-agentic: val_n=200, seed=42, fd_recon_ckpt=/cluster/maier/Agent4CT/checkpoints/fast_diffusion_wavelet_breast.pt, fd_recon_steps=8, fd_recon_init=fbp, fd_recon_init_t=0.02, fd_recon_eta=1.0, fd_recon_dc=1, fd_recon_dc_n_cg=15, fd_recon_dc_relax=1.0, dataset_kind=breast_ct, rationale=iter-11 PRIOR+DC SYNERGY: add prior back (init_t up) at the winning n_cg=15, breast-native wavelet CONSTRAINED, val=200. SIX-BOX: (1) PRIOR: n_cg sweep at init_t0.005: n_cg5->RMSE5.94e-3(hr0), n_cg15->4.85e-3(hr0.0695 BEST), n_cg25->4.99e-3(hr0.043). Interior n_cg optimum ~15; over-converged CG amplifies 128-view LSQ noise. (2) FAILURE MODE: at n_cg25 the CG solves the unregularized LSQ too exactly -> sparse-system noise re-enters. FIX per iter-10 falsifier: let the wavelet prior regularize that noise by embedding the FBP at a slightly higher flow-time. (3) ONE KNOB: fd_recon_init_t 0.005 -> 0.02 (re-introduce light wavelet-prior denoising), n_cg=15 fixed. (4) HYPOTHESIS: init_t=0.02 gives the wavelet prior enough influence to suppress the CG-DC LSQ streak-noise while DC still pins the data -> RMSE drops below iter-9 4.85e-3, hr>0.0695 (genuine prior+DC synergy, the whole point of the constrained wavelet variant). FALSIFIER: if RMSE rises (>4.85e-3), the prior at 0.02 injects more error than it removes -> the optimum is minimal-prior (init_t~0.005) and hr~0.07 is the ceiling; sweep init_t between 0.005-0.02 to localize. (5) BUDGET ~2min. (6) iter-12 on landing.", "advice_for_others": "fastdiff_wdm_wavelet_constrained-claude-agentic: val_n=200, seed=42, fd_recon_ckpt=/cluster/maier/Agent4CT/checkpoints/fast_diffusion_wavelet_breast.pt, fd_recon_steps=8, fd_recon_init=fbp, fd_recon_init_t=0.02, fd_recon_eta=1.0, fd_recon_dc=1, fd_recon_dc_n_cg=15, fd_recon_dc_relax=1.0, dataset_kind=breast_ct, rationale=iter-11 PRIOR+DC SYNERGY: add prior back (init_t up) at the winning n_cg=15, breast-native wavelet CONSTRAINED, val=200. SIX-BOX: (1) PRIOR: n_cg sweep at init_t0.005: n_cg5->RMSE5.94e-3(hr0), n_cg15->4.85e-3(hr0.0695 BEST), n_cg25->4.99e-3(hr0.043). Interior n_cg optimum ~15; over-converged CG amplifies 128-view LSQ noise. (2) FAILURE MODE: at n_cg25 the CG solves the unregularized LSQ too exactly -> sparse-system noise re-enters. FIX per iter-10 falsifier: let the wavelet prior regularize that noise by embedding the FBP at a slightly higher flow-time. (3) ONE KNOB: fd_recon_init_t 0.005 -> 0.02 (re-introduce light wavelet-prior denoising), n_cg=15 fixed. (4) HYPOTHESIS: init_t=0.02 gives the wavelet prior enough influence to suppress the CG-DC LSQ streak-noise while DC still pins the data -> RMSE drops below iter-9 4.85e-3, hr>0.0695 (genuine prior+DC synergy, the whole point of the constrained wavelet variant). FALSIFIER: if RMSE rises (>4.85e-3), the prior at 0.02 injects more error than it removes -> the optimum is minimal-prior (init_t~0.005) and hr~0.07 is the ceiling; sweep init_t between 0.005-0.02 to localize. (5) BUDGET ~2min. (6) iter-12 on landing.", "comparison_image": "runs/breast-ct-claude-agentic-fastdiff-wdm-wavelet-constrained-search-20260703-01/iterations/iter-0011/comparison.png"}
{"ts": "2026-07-06T21:38:05Z", "run_id": "breast-ct-claude-agentic-fastdiff-wdm-wavelet-constrained-search-20260703-01", "iter": 10, "agent": "fastdiff_wdm_wavelet_constrained-claude-agentic", "model": "claude-opus-4-8-1m", "change_class": "architecture", "status": "keep", "kept": true, "val_score": 0.8707011342048645, "headroom": 0.04315661165988505, "params_M": 3.824908, "train_n": 3600, "rationale": "fastdiff_wdm_wavelet_constrained-claude-agentic: val_n=200, seed=42, fd_recon_ckpt=/cluster/maier/Agent4CT/checkpoints/fast_diffusion_wavelet_breast.pt, fd_recon_steps=8, fd_recon_init=fbp, fd_recon_init_t=0.005, fd_recon_eta=1.0, fd_recon_dc=1, fd_recon_dc_n_cg=25, fd_recon_dc_relax=1.0, dataset_kind=breast_ct, rationale=iter-10 DC-STRENGTH (n_cg up further), breast-native wavelet CONSTRAINED, val=200. SIX-BOX: (1) PRIOR: BREAKTHROUGH iter-9 (init_t0.005/n_cg15) hr=0.0695 (PSNR 36.95/RMSE 4.85e-3) CLEARED baseline 36.32/5.21e-3 -- more CG iters crossed it (iter-8 n_cg5 was RMSE 5.94e-3, hr=0). Direction confirmed: low init_t (prior-light) + strong CG-DC. (2) FAILURE MODE at iter-8: under-converged CG (n_cg5) left the recon just below the FBP; n_cg15 converged enough to beat it. (3) ONE KNOB: fd_recon_dc_n_cg 15 -> 25 (drive CG closer to the exact 128-view LSQ solution). (4) HYPOTHESIS: more CG iters lower RMSE further (the LSQ solution beats the regularized FBP) -> hr rises above 0.0695. FALSIFIER: if hr plateaus/drops, the CG has converged and 128-view LSQ noise amplification caps the gain -> pivot to raising init_t slightly so the wavelet prior can regularize the LSQ noise (prior+DC synergy). (5) BUDGET: n_cg25 ~4x CG cost of base, still well inside 20min. (6) iter-11 on landing.", "advice_for_others": "fastdiff_wdm_wavelet_constrained-claude-agentic: val_n=200, seed=42, fd_recon_ckpt=/cluster/maier/Agent4CT/checkpoints/fast_diffusion_wavelet_breast.pt, fd_recon_steps=8, fd_recon_init=fbp, fd_recon_init_t=0.005, fd_recon_eta=1.0, fd_recon_dc=1, fd_recon_dc_n_cg=25, fd_recon_dc_relax=1.0, dataset_kind=breast_ct, rationale=iter-10 DC-STRENGTH (n_cg up further), breast-native wavelet CONSTRAINED, val=200. SIX-BOX: (1) PRIOR: BREAKTHROUGH iter-9 (init_t0.005/n_cg15) hr=0.0695 (PSNR 36.95/RMSE 4.85e-3) CLEARED baseline 36.32/5.21e-3 -- more CG iters crossed it (iter-8 n_cg5 was RMSE 5.94e-3, hr=0). Direction confirmed: low init_t (prior-light) + strong CG-DC. (2) FAILURE MODE at iter-8: under-converged CG (n_cg5) left the recon just below the FBP; n_cg15 converged enough to beat it. (3) ONE KNOB: fd_recon_dc_n_cg 15 -> 25 (drive CG closer to the exact 128-view LSQ solution). (4) HYPOTHESIS: more CG iters lower RMSE further (the LSQ solution beats the regularized FBP) -> hr rises above 0.0695. FALSIFIER: if hr plateaus/drops, the CG has converged and 128-view LSQ noise amplification caps the gain -> pivot to raising init_t slightly so the wavelet prior can regularize the LSQ noise (prior+DC synergy). (5) BUDGET: n_cg25 ~4x CG cost of base, still well inside 20min. (6) iter-11 on landing.", "comparison_image": "runs/breast-ct-claude-agentic-fastdiff-wdm-wavelet-constrained-search-20260703-01/iterations/iter-0010/comparison.png"}
{"ts": "2026-07-06T21:36:42Z", "run_id": "breast-ct-claude-agentic-fastdiff-flow-pixel-unconstrained-search-20260703-01", "iter": 20, "agent": "fastdiff_flow_pixel_unconstrained-claude-agentic", "model": "claude-opus-4-8-1m", "change_class": "architecture", "status": "discard", "kept": false, "val_score": 0.3557876646518707, "headroom": 0.0, "params_M": 3.822787, "train_n": 3600, "rationale": "fastdiff_flow_pixel_unconstrained-claude-agentic: image_size=512, pixel_spacing=0.3516, n_angles=128, n_det=1024, det_spacing=0.35754, sod=500.0, sdd=1000.0, display_min=0.0, display_max=0.5, train_n=400, val_n=200, noise_i0=100000.0, noise_sigma_e=10.0, seed=42, fd_recon_ckpt=/cluster/maier/Agent4CT/checkpoints/fast_diffusion_pixel_breast.pt, fd_recon_steps=16, fd_recon_init=noise, fd_recon_init_t=0.7, fd_recon_eta=1.0, fd_recon_dc=0, fd_recon_dc_n_cg=5, fd_recon_dc_relax=0.5, rationale=iter-20 (FINAL): DC-off breast-prior. Architecturally-DISTINCT family for STOP-protocol edge coverage. ONE KNOB init fbp->noise (pure unconditional generation from the prior, ZERO FBP anchor; init_t ignored when init=noise so t starts at 1.0; eta back to 1.0 and steps=16 since full-trajectory generation needs guidance+NFE). PRIOR: the FBP-anchored regime peaks at hr0.271 (init_t0.02) - the entire gain came from lightly denoising the FBP init. HYPOTHESIS: with NO FBP init, the DC-off sampler must reconstruct ENTIRELY from the prior + soft DPS on 128-view sparse data -> hr~0 (cannot match FBP), quantifying that the FBP INIT (not the generative prior per se) is what carries the DC-off variant. This is the honest lower bound: the breast prior as a pure generator (no measurement warm-start) does NOT reconstruct sparse-view breast CT. Completes 20 iters + >=3 distinct families (init_t sweep, eta sweep, NFE, seed-robustness, noise-init).", "advice_for_others": "fastdiff_flow_pixel_unconstrained-claude-agentic: image_size=512, pixel_spacing=0.3516, n_angles=128, n_det=1024, det_spacing=0.35754, sod=500.0, sdd=1000.0, display_min=0.0, display_max=0.5, train_n=400, val_n=200, noise_i0=100000.0, noise_sigma_e=10.0, seed=42, fd_recon_ckpt=/cluster/maier/Agent4CT/checkpoints/fast_diffusion_pixel_breast.pt, fd_recon_steps=16, fd_recon_init=noise, fd_recon_init_t=0.7, fd_recon_eta=1.0, fd_recon_dc=0, fd_recon_dc_n_cg=5, fd_recon_dc_relax=0.5, rationale=iter-20 (FINAL): DC-off breast-prior. Architecturally-DISTINCT family for STOP-protocol edge coverage. ONE KNOB init fbp->noise (pure unconditional generation from the prior, ZERO FBP anchor; init_t ignored when init=noise so t starts at 1.0; eta back to 1.0 and steps=16 since full-trajectory generation needs guidance+NFE). PRIOR: the FBP-anchored regime peaks at hr0.271 (init_t0.02) - the entire gain came from lightly denoising the FBP init. HYPOTHESIS: with NO FBP init, the DC-off sampler must reconstruct ENTIRELY from the prior + soft DPS on 128-view sparse data -> hr~0 (cannot match FBP), quantifying that the FBP INIT (not the generative prior per se) is what carries the DC-off variant. This is the honest lower bound: the breast prior as a pure generator (no measurement warm-start) does NOT reconstruct sparse-view breast CT. Completes 20 iters + >=3 distinct families (init_t sweep, eta sweep, NFE, seed-robustness, noise-init).", "comparison_image": "runs/breast-ct-claude-agentic-fastdiff-flow-pixel-unconstrained-search-20260703-01/iterations/iter-0020/comparison.png"}
