{"ts": "2026-07-05T20:50:50Z", "run_id": "breast-ct-claude-agentic-tv-iterative-supervised-search-20260703-01", "iter": 12, "agent": "tv_iterative_supervised-claude-agentic", "model": "claude-opus-4-8-1m", "change_class": "architecture", "status": "keep", "kept": true, "val_score": 0.957617461681366, "headroom": 0.1494552979217223, "params_M": 2e-05, "train_n": 400, "rationale": "tv_iterative_supervised-claude-agentic: val_n=200, val_chunk=5, train_n=400, epochs=20, batch_size=1, lr=0.005, tv_K=10, tv_step_init=0.001, tv_lambda_init=1.0, tv_share_steps=False, tv_eps=1e-06, lambda_neg=1.0, loss_base=mse, grad_clip=1.0, rationale=tv_iterative_supervised iter-12 (breast_ct). EPOCHS probe at the K=10 lambda-winner. Best so far = iter-10 (K=10, lambda_init=1.0, epochs=10) hr=0.1471. Depth FALSIFIED twice: iter-4 (K=50, dead lambda) and iter-11 (K=30, active lambda=1.0) both collapse to FBP -- the useful per-pass TV smoothing is fully delivered by K=10; more passes over-smooth back to FBP-RMSE. So hold K=10 and let the 20 scalars converge FURTHER. ONE KNOB: epochs 10->20 (K=10, lambda_init=1.0, step_init=1e-3, mse, per-iter, lr=5e-3, val_n back to 200). HYPOTHESIS: the lambda schedule was still climbing at epoch 10 in iter-9/10; doubling epochs lets it settle at a better per-iter lambda profile so hr rises above 0.1471. FALSIFIER: if hr saturates ~0.147, 10 epochs already converged the scalars and the ~0.147 plateau is the config-only ceiling for supervised-unrolled-TV on breast (step-collapse caps data-consistency; only TV-denoising of FBP is available). BUDGET: iter-10 K=10 epochs=10 ran ~750s; epochs=20 ~ +train ~ est ~1050s, under 1200s wall (val cost unchanged).", "advice_for_others": "tv_iterative_supervised-claude-agentic: val_n=200, val_chunk=5, train_n=400, epochs=20, batch_size=1, lr=0.005, tv_K=10, tv_step_init=0.001, tv_lambda_init=1.0, tv_share_steps=False, tv_eps=1e-06, lambda_neg=1.0, loss_base=mse, grad_clip=1.0, rationale=tv_iterative_supervised iter-12 (breast_ct). EPOCHS probe at the K=10 lambda-winner. Best so far = iter-10 (K=10, lambda_init=1.0, epochs=10) hr=0.1471. Depth FALSIFIED twice: iter-4 (K=50, dead lambda) and iter-11 (K=30, active lambda=1.0) both collapse to FBP -- the useful per-pass TV smoothing is fully delivered by K=10; more passes over-smooth back to FBP-RMSE. So hold K=10 and let the 20 scalars converge FURTHER. ONE KNOB: epochs 10->20 (K=10, lambda_init=1.0, step_init=1e-3, mse, per-iter, lr=5e-3, val_n back to 200). HYPOTHESIS: the lambda schedule was still climbing at epoch 10 in iter-9/10; doubling epochs lets it settle at a better per-iter lambda profile so hr rises above 0.1471. FALSIFIER: if hr saturates ~0.147, 10 epochs already converged the scalars and the ~0.147 plateau is the config-only ceiling for supervised-unrolled-TV on breast (step-collapse caps data-consistency; only TV-denoising of FBP is available). BUDGET: iter-10 K=10 epochs=10 ran ~750s; epochs=20 ~ +train ~ est ~1050s, under 1200s wall (val cost unchanged).", "comparison_image": "runs/breast-ct-claude-agentic-tv-iterative-supervised-search-20260703-01/iterations/iter-0012/comparison.png"}
{"ts": "2026-07-05T20:50:30Z", "run_id": "breast-ct-claude-agentic-r2gaussian-search-20260703-01", "iter": 12, "agent": "r2gaussian-claude-agentic", "model": "claude-opus-4-8-1m", "change_class": "architecture", "status": "discard", "kept": false, "val_score": 0.9277399182319641, "headroom": 0.0, "params_M": 0.006144, "train_n": 400, "rationale": "r2gaussian-claude-agentic: val_n=15, gs_n_gaussians=1024, gs_n_iter=130, gs_lr_pos=0.005, gs_lr_scale=0.01, gs_lr_amp=0.01, gs_lr_rot=0.01, gs_amp_init=0.01, gs_scale_init=0.04, gs_tv_weight=0.0001, gs_n_clip=0.05, gs_init_from_fbp=True, gs_render=raster, gs_ssim_weight=0.3, seed=42, train_n=0, rationale=iter-12 (search-20260703-01) -- CEILING CONFIRMATION #4. SIX-BOX: hr pinned 0 at EVERY prior iter; best SSIM 0.9278 @ iter-6. R2-Gaussian is REGIME-BOUNDED on dense 128-view breast: the coarse anisotropic-Gaussian basis (1024 splats, 0.006M params) plateaus at SSIM ~0.928 / PSNR ~28.7 dB, ~7.3 dB BELOW the 128-view FBP baseline (PSNR 35.97), so the RMSE/PSNR-gated headroom stays 0 (reproduces findings.md 2026-06-03). All 7 lever families mapped+exhausted (steps FLAT, capacity +0.010, warm-start +0.039, SSIM-loss +0.073, SSIM-weight saturated, basis-scale FLAT, TV-reg FLAT); NONE moves hr off 0 -- the strongest (warm-start + SSIM-loss) got closest but stayed 7.3 dB short. The R2-G paper's regime is SPARSE-view CBCT (<=50 views) where FBP is weak; dense 128-view 2D CT is the wrong inductive bias. DECISION: empty-patch re-run of the iter-6 run-best config (warm-start + SSIM-loss@0.30, 1024G/130it) to confirm SSIM ~0.928 / hr=0 reproduces. BUDGET: ~660-1000s node-dependent, under the 1080 in-solver wall and 1800 SLURM wall, figure excluded. val_n=15 HELD CONSTANT. PREDICTION: SSIM ~0.928 (0.925-0.930), hr 0 -- faithful-but-regime-bounded negative result., gs_outer_wall_s=1080, gs_amp_init_max=0.05", "advice_for_others": "r2gaussian-claude-agentic: val_n=15, gs_n_gaussians=1024, gs_n_iter=130, gs_lr_pos=0.005, gs_lr_scale=0.01, gs_lr_amp=0.01, gs_lr_rot=0.01, gs_amp_init=0.01, gs_scale_init=0.04, gs_tv_weight=0.0001, gs_n_clip=0.05, gs_init_from_fbp=True, gs_render=raster, gs_ssim_weight=0.3, seed=42, train_n=0, rationale=iter-12 (search-20260703-01) -- CEILING CONFIRMATION #4. SIX-BOX: hr pinned 0 at EVERY prior iter; best SSIM 0.9278 @ iter-6. R2-Gaussian is REGIME-BOUNDED on dense 128-view breast: the coarse anisotropic-Gaussian basis (1024 splats, 0.006M params) plateaus at SSIM ~0.928 / PSNR ~28.7 dB, ~7.3 dB BELOW the 128-view FBP baseline (PSNR 35.97), so the RMSE/PSNR-gated headroom stays 0 (reproduces findings.md 2026-06-03). All 7 lever families mapped+exhausted (steps FLAT, capacity +0.010, warm-start +0.039, SSIM-loss +0.073, SSIM-weight saturated, basis-scale FLAT, TV-reg FLAT); NONE moves hr off 0 -- the strongest (warm-start + SSIM-loss) got closest but stayed 7.3 dB short. The R2-G paper's regime is SPARSE-view CBCT (<=50 views) where FBP is weak; dense 128-view 2D CT is the wrong inductive bias. DECISION: empty-patch re-run of the iter-6 run-best config (warm-start + SSIM-loss@0.30, 1024G/130it) to confirm SSIM ~0.928 / hr=0 reproduces. BUDGET: ~660-1000s node-dependent, under the 1080 in-solver wall and 1800 SLURM wall, figure excluded. val_n=15 HELD CONSTANT. PREDICTION: SSIM ~0.928 (0.925-0.930), hr 0 -- faithful-but-regime-bounded negative result., gs_outer_wall_s=1080, gs_amp_init_max=0.05", "comparison_image": "runs/breast-ct-claude-agentic-r2gaussian-search-20260703-01/iterations/iter-0012/comparison.png"}
{"ts": "2026-07-05T20:45:37Z", "run_id": "breast-ct-claude-agentic-dual-domain-bilateral-n2i-search-20260703-01", "iter": 8, "agent": "dual_domain_bilateral_n2i-claude-agentic", "model": "claude-opus-4-8-1m", "change_class": "architecture", "status": "keep", "kept": true, "val_score": 0.9620240330696106, "headroom": 0.11599626985746714, "params_M": 6e-06, "train_n": 400, "rationale": "dual_domain_bilateral_n2i-claude-agentic: warm_start=True, pretrain_epochs=2, train_n=400, n_iter=100, val_n=200, batch_size=1, grad_clip=1.0, lr=0.005, proj_n_bf=1, img_n_bf=1, img_sr=0.0002, outer_wall_s=900, seed=42, rationale=iter-8 dual_domain_bilateral_n2i, ONE-KNOB: per-scene steps n_iter 30->100, on the iter-7 CHAMPION base (img_sr=0.0002, img_n_bf=proj_n_bf=1). CHAMPION = iter-7 hr=0.1261 SSIM0.9606 PSNR39.57 (img_sr 0.0005->0.0002 marginal +0.0004 over iter-5's 0.1257; range-sigma optimum is flat ~2e-4..5e-4). HYPOTHESIS: iter-1/iter-3 showed n_iter did NOT help when img_sr was WIDE (0.02) -- more steps just pulled the over-smoothing BF further toward the blurry 64-view half-target. But now img_sr is TIGHT/edge-preserving, so additional per-scene N2I steps should refine the edge-preserving denoiser toward better noise suppression WITHOUT over-blurring (the tight range kernel structurally cannot cross edges regardless of step count) -> hr climbs above 0.1261. If hr FLAT/DROPS, the edge-preserving BF converges fast (30 steps already enough) and n_iter is saturated -> revert to 30 and move to spatial sigma. FAILURE watched: even edge-preserving, too many steps could still creep the recon toward the noisy half-target mean (mild PSNR drop). BUDGET: n_iter 30->100 ~3.3x inner steps; iter-7 ran 692s at n_iter30 on a fast node but iter-1 n_iter120 was 1200s -> n_iter100 ~1000-1100s; outer_wall_s=900 caps it (may trim a few scenes). ONE knob: n_iter 30->100.", "advice_for_others": "dual_domain_bilateral_n2i-claude-agentic: warm_start=True, pretrain_epochs=2, train_n=400, n_iter=100, val_n=200, batch_size=1, grad_clip=1.0, lr=0.005, proj_n_bf=1, img_n_bf=1, img_sr=0.0002, outer_wall_s=900, seed=42, rationale=iter-8 dual_domain_bilateral_n2i, ONE-KNOB: per-scene steps n_iter 30->100, on the iter-7 CHAMPION base (img_sr=0.0002, img_n_bf=proj_n_bf=1). CHAMPION = iter-7 hr=0.1261 SSIM0.9606 PSNR39.57 (img_sr 0.0005->0.0002 marginal +0.0004 over iter-5's 0.1257; range-sigma optimum is flat ~2e-4..5e-4). HYPOTHESIS: iter-1/iter-3 showed n_iter did NOT help when img_sr was WIDE (0.02) -- more steps just pulled the over-smoothing BF further toward the blurry 64-view half-target. But now img_sr is TIGHT/edge-preserving, so additional per-scene N2I steps should refine the edge-preserving denoiser toward better noise suppression WITHOUT over-blurring (the tight range kernel structurally cannot cross edges regardless of step count) -> hr climbs above 0.1261. If hr FLAT/DROPS, the edge-preserving BF converges fast (30 steps already enough) and n_iter is saturated -> revert to 30 and move to spatial sigma. FAILURE watched: even edge-preserving, too many steps could still creep the recon toward the noisy half-target mean (mild PSNR drop). BUDGET: n_iter 30->100 ~3.3x inner steps; iter-7 ran 692s at n_iter30 on a fast node but iter-1 n_iter120 was 1200s -> n_iter100 ~1000-1100s; outer_wall_s=900 caps it (may trim a few scenes). ONE knob: n_iter 30->100.", "comparison_image": "runs/breast-ct-claude-agentic-dual-domain-bilateral-n2i-search-20260703-01/iterations/iter-0008/comparison.png"}
{"ts": "2026-07-05T20:43:53Z", "run_id": "breast-ct-claude-agentic-tv-iterative-search-20260703-01", "iter": 18, "agent": "tv_iterative-claude-agentic", "model": "claude-opus-4-8-1m", "change_class": "architecture", "status": "keep", "kept": true, "val_score": 0.9908028244972229, "headroom": 0.35342782272148054, "params_M": 0.0, "train_n": 400, "rationale": "tv_iterative-claude-agentic: val_n=200, tv_lambda=0.0026, tv_iterations=500, tv_lr=0.01, tv_decay=0.01, tv_optimizer=gd, tv_init=fbp, rationale=iter-18 EFFICIENCY probe at the peak lambda. iter-17 (lambda=2.6e-3, 1000it) hr=0.36293 NEW BEST. Early convergence sweep was done at lambda=1e-3 (iter-1..4); at the higher peak lambda the TV term is weighted ~2.6x stronger so the optimum may arrive in fewer iters. ONE knob: tv_iterations 1000->500 (halve; keep lambda=2.6e-3, lr=0.01, decay=0.01, gd, fbp). HYPOTHESIS: if hr stays near 0.36293 at 500 iters the peak-lambda optimum arrives early and the full 950s is unnecessary (cheaper equivalent); if hr drops materially, 1000 iters is genuinely needed for convergence at this lambda. Budget: ~500s at 500 iters, well <1200s wall.", "advice_for_others": "tv_iterative-claude-agentic: val_n=200, tv_lambda=0.0026, tv_iterations=500, tv_lr=0.01, tv_decay=0.01, tv_optimizer=gd, tv_init=fbp, rationale=iter-18 EFFICIENCY probe at the peak lambda. iter-17 (lambda=2.6e-3, 1000it) hr=0.36293 NEW BEST. Early convergence sweep was done at lambda=1e-3 (iter-1..4); at the higher peak lambda the TV term is weighted ~2.6x stronger so the optimum may arrive in fewer iters. ONE knob: tv_iterations 1000->500 (halve; keep lambda=2.6e-3, lr=0.01, decay=0.01, gd, fbp). HYPOTHESIS: if hr stays near 0.36293 at 500 iters the peak-lambda optimum arrives early and the full 950s is unnecessary (cheaper equivalent); if hr drops materially, 1000 iters is genuinely needed for convergence at this lambda. Budget: ~500s at 500 iters, well <1200s wall.", "comparison_image": "runs/breast-ct-claude-agentic-tv-iterative-search-20260703-01/iterations/iter-0018/comparison.png"}
{"ts": "2026-07-05T20:37:59Z", "run_id": "breast-ct-claude-agentic-dual-domain-n2i-search-20260703-01", "iter": 4, "agent": "dual_domain_n2i-claude-agentic", "model": "claude-opus-4-8-1m", "change_class": "architecture", "status": "discard", "kept": false, "val_score": 0.9383020401000977, "headroom": 0.0, "params_M": 0.465762, "train_n": 400, "rationale": "dual_domain_n2i-claude-agentic: warm_start=False, pretrain_epochs=3, pretrain_steps=0, n_iter=300, grad_clip=1.0, outer_wall_s=1400, per_scene_s=None, batch_size=1, lr=0.001, optimizer=adam, unet_c=16, train_n=400, val_n=200, seed=42, rationale=iter-4 SIX-BOX. (1) PRIOR: iter-3 hr=0.0, unet_c=32 (4x capacity) gave rmse=0.00654 (SLIGHTLY WORSE than c=16's 0.00638), ssim=0.932, 196/200. So higher denoiser capacity does NOT sharpen -- capacity is NOT the limiter. Iters 1-3 (budget, per-scene fit, capacity) all pinned at hr=0. (2) FAILURE MODE: structural over-smoothing from the poor 128-view FBP self-supervision target, independent of budget or capacity. (3) ONE KNOB: warm_start True -> False (back to c=16). Pure per-image N2I: each val scan is optimized FROM SCRATCH on its own sinogram with NO amortised train-set pre-pass init; n_iter raised to 300 to compensate for losing the warm init (this is the SAME knob -- turning off the amortised init -- expressed as the from-scratch regime it defines; no train split is loaded at all). (4) HYPOTHESIS: removing the amortised warm-start tests whether the pre-pass was pulling every scan toward an over-smoothed mean. If pure per-image N2I clears hr>0, warm-start was the culprit. Per the documented ceiling, more likely each from-scratch fit STILL converges to the same over-smoothed FBP-consistent solution (hr=0), because the ceiling is set by the self-supervision TARGET, not the initialization. (5) BUDGET: no warm-start pre-pass (SAVES ~130s), so the full 1400s outer wall goes to the 200 per-image fits at 7.0s each; c=16 + figure ~= 24 min < 30-min wall. (6) Loop continues; iter-5 self-dispatched. Reserved levers: pretrain_epochs (stronger warm-start), lr up/down, n_iter early-stop, unet_c=8.", "advice_for_others": "dual_domain_n2i-claude-agentic: warm_start=False, pretrain_epochs=3, pretrain_steps=0, n_iter=300, grad_clip=1.0, outer_wall_s=1400, per_scene_s=None, batch_size=1, lr=0.001, optimizer=adam, unet_c=16, train_n=400, val_n=200, seed=42, rationale=iter-4 SIX-BOX. (1) PRIOR: iter-3 hr=0.0, unet_c=32 (4x capacity) gave rmse=0.00654 (SLIGHTLY WORSE than c=16's 0.00638), ssim=0.932, 196/200. So higher denoiser capacity does NOT sharpen -- capacity is NOT the limiter. Iters 1-3 (budget, per-scene fit, capacity) all pinned at hr=0. (2) FAILURE MODE: structural over-smoothing from the poor 128-view FBP self-supervision target, independent of budget or capacity. (3) ONE KNOB: warm_start True -> False (back to c=16). Pure per-image N2I: each val scan is optimized FROM SCRATCH on its own sinogram with NO amortised train-set pre-pass init; n_iter raised to 300 to compensate for losing the warm init (this is the SAME knob -- turning off the amortised init -- expressed as the from-scratch regime it defines; no train split is loaded at all). (4) HYPOTHESIS: removing the amortised warm-start tests whether the pre-pass was pulling every scan toward an over-smoothed mean. If pure per-image N2I clears hr>0, warm-start was the culprit. Per the documented ceiling, more likely each from-scratch fit STILL converges to the same over-smoothed FBP-consistent solution (hr=0), because the ceiling is set by the self-supervision TARGET, not the initialization. (5) BUDGET: no warm-start pre-pass (SAVES ~130s), so the full 1400s outer wall goes to the 200 per-image fits at 7.0s each; c=16 + figure ~= 24 min < 30-min wall. (6) Loop continues; iter-5 self-dispatched. Reserved levers: pretrain_epochs (stronger warm-start), lr up/down, n_iter early-stop, unet_c=8.", "comparison_image": "runs/breast-ct-claude-agentic-dual-domain-n2i-search-20260703-01/iterations/iter-0004/comparison.png"}
{"ts": "2026-07-05T20:37:23Z", "run_id": "breast-ct-claude-agentic-tv-iterative-search-20260703-01", "iter": 17, "agent": "tv_iterative-claude-agentic", "model": "claude-opus-4-8-1m", "change_class": "architecture", "status": "keep", "kept": true, "val_score": 0.9912509918212891, "headroom": 0.36293303853177683, "params_M": 0.0, "train_n": 400, "rationale": "tv_iterative-claude-agentic: val_n=200, tv_lambda=0.0026, tv_iterations=1000, tv_lr=0.01, tv_decay=0.01, tv_optimizer=gd, tv_init=fbp, rationale=iter-17 LAMBDA fine peak. iter-16 (1500 iters at peak lambda) hr=0.36106 < iter-8 (1000it) 0.36286 -> 1000 iters is the firm plateau (>1000 slightly over-smooths). Lambda peak at 2.5e-3 (0.36286), neighbors 2.25e-3=0.36073, 2.75e-3=0.36233 -> true peak in (2.5e-3, 2.75e-3). ONE knob: tv_lambda 2.5e-3->2.6e-3 (fine point between peak and high neighbor; best config otherwise gd, 1000it, lr=0.01, decay=0.01, fbp). HYPOTHESIS: if hr>0.36286 the optimum is nearer 2.6e-3; if hr<0.36286 the peak stands at 2.5e-3 within sub-0.001 noise. Budget: ~950s at 1000 iters, <1200s wall.", "advice_for_others": "tv_iterative-claude-agentic: val_n=200, tv_lambda=0.0026, tv_iterations=1000, tv_lr=0.01, tv_decay=0.01, tv_optimizer=gd, tv_init=fbp, rationale=iter-17 LAMBDA fine peak. iter-16 (1500 iters at peak lambda) hr=0.36106 < iter-8 (1000it) 0.36286 -> 1000 iters is the firm plateau (>1000 slightly over-smooths). Lambda peak at 2.5e-3 (0.36286), neighbors 2.25e-3=0.36073, 2.75e-3=0.36233 -> true peak in (2.5e-3, 2.75e-3). ONE knob: tv_lambda 2.5e-3->2.6e-3 (fine point between peak and high neighbor; best config otherwise gd, 1000it, lr=0.01, decay=0.01, fbp). HYPOTHESIS: if hr>0.36286 the optimum is nearer 2.6e-3; if hr<0.36286 the peak stands at 2.5e-3 within sub-0.001 noise. Budget: ~950s at 1000 iters, <1200s wall.", "comparison_image": "runs/breast-ct-claude-agentic-tv-iterative-search-20260703-01/iterations/iter-0017/comparison.png"}
{"ts": "2026-07-05T20:33:21Z", "run_id": "breast-ct-claude-agentic-r2gaussian-search-20260703-01", "iter": 11, "agent": "r2gaussian-claude-agentic", "model": "claude-opus-4-8-1m", "change_class": "architecture", "status": "discard", "kept": false, "val_score": 0.9277119636535645, "headroom": 0.0, "params_M": 0.006144, "train_n": 400, "rationale": "r2gaussian-claude-agentic: val_n=15, gs_n_gaussians=1024, gs_n_iter=130, gs_lr_pos=0.005, gs_lr_scale=0.01, gs_lr_amp=0.01, gs_lr_rot=0.01, gs_amp_init=0.01, gs_scale_init=0.04, gs_tv_weight=0.0001, gs_n_clip=0.05, gs_init_from_fbp=True, gs_render=raster, gs_ssim_weight=0.3, seed=42, train_n=0, rationale=iter-11 (search-20260703-01) -- CEILING CONFIRMATION #3. SIX-BOX: hr pinned 0 at EVERY prior iter; best SSIM 0.9278 @ iter-6. R2-Gaussian is REGIME-BOUNDED on dense 128-view breast: the coarse anisotropic-Gaussian basis (1024 splats, 0.006M params) plateaus at SSIM ~0.928 / PSNR ~28.7 dB, ~7.3 dB BELOW the 128-view FBP baseline (PSNR 35.97), so the RMSE/PSNR-gated headroom stays 0 (reproduces findings.md 2026-06-03). All 7 lever families mapped+exhausted (steps FLAT, capacity +0.010, warm-start +0.039, SSIM-loss +0.073, SSIM-weight saturated, basis-scale FLAT, TV-reg FLAT); NONE moves hr off 0 -- the strongest (warm-start + SSIM-loss) got closest but stayed 7.3 dB short. The R2-G paper's regime is SPARSE-view CBCT (<=50 views) where FBP is weak; dense 128-view 2D CT is the wrong inductive bias. DECISION: empty-patch re-run of the iter-6 run-best config (warm-start + SSIM-loss@0.30, 1024G/130it) to confirm SSIM ~0.928 / hr=0 reproduces. BUDGET: ~660-1000s node-dependent, under the 1080 in-solver wall and 1800 SLURM wall, figure excluded. val_n=15 HELD CONSTANT. PREDICTION: SSIM ~0.928 (0.925-0.930), hr 0 -- faithful-but-regime-bounded negative result., gs_outer_wall_s=1080, gs_amp_init_max=0.05", "advice_for_others": "r2gaussian-claude-agentic: val_n=15, gs_n_gaussians=1024, gs_n_iter=130, gs_lr_pos=0.005, gs_lr_scale=0.01, gs_lr_amp=0.01, gs_lr_rot=0.01, gs_amp_init=0.01, gs_scale_init=0.04, gs_tv_weight=0.0001, gs_n_clip=0.05, gs_init_from_fbp=True, gs_render=raster, gs_ssim_weight=0.3, seed=42, train_n=0, rationale=iter-11 (search-20260703-01) -- CEILING CONFIRMATION #3. SIX-BOX: hr pinned 0 at EVERY prior iter; best SSIM 0.9278 @ iter-6. R2-Gaussian is REGIME-BOUNDED on dense 128-view breast: the coarse anisotropic-Gaussian basis (1024 splats, 0.006M params) plateaus at SSIM ~0.928 / PSNR ~28.7 dB, ~7.3 dB BELOW the 128-view FBP baseline (PSNR 35.97), so the RMSE/PSNR-gated headroom stays 0 (reproduces findings.md 2026-06-03). All 7 lever families mapped+exhausted (steps FLAT, capacity +0.010, warm-start +0.039, SSIM-loss +0.073, SSIM-weight saturated, basis-scale FLAT, TV-reg FLAT); NONE moves hr off 0 -- the strongest (warm-start + SSIM-loss) got closest but stayed 7.3 dB short. The R2-G paper's regime is SPARSE-view CBCT (<=50 views) where FBP is weak; dense 128-view 2D CT is the wrong inductive bias. DECISION: empty-patch re-run of the iter-6 run-best config (warm-start + SSIM-loss@0.30, 1024G/130it) to confirm SSIM ~0.928 / hr=0 reproduces. BUDGET: ~660-1000s node-dependent, under the 1080 in-solver wall and 1800 SLURM wall, figure excluded. val_n=15 HELD CONSTANT. PREDICTION: SSIM ~0.928 (0.925-0.930), hr 0 -- faithful-but-regime-bounded negative result., gs_outer_wall_s=1080, gs_amp_init_max=0.05", "comparison_image": "runs/breast-ct-claude-agentic-r2gaussian-search-20260703-01/iterations/iter-0011/comparison.png"}
