{"ts": "2026-07-06T22:33:25Z", "run_id": "breast-ct-claude-agentic-fastdiff-flow-pixel-constrained-search-20260703-01", "iter": 18, "agent": "fastdiff_flow_pixel_constrained-claude-agentic", "model": "claude-opus-4-8-1m", "change_class": "architecture", "status": "keep", "kept": true, "val_score": 0.9778556823730469, "headroom": 0.5164004501326134, "params_M": 3.822787, "train_n": 400, "rationale": "fastdiff_flow_pixel_constrained-claude-agentic: image_size=512, pixel_spacing=0.3516, n_angles=128, n_det=1024, det_spacing=0.35754, sod=500.0, sdd=1000.0, display_min=0.0, display_max=0.5, train_n=400, val_n=200, noise_i0=100000.0, noise_sigma_e=10.0, seed=42, dataset_kind=breast_ct, fd_recon_ckpt=/cluster/maier/Agent4CT/checkpoints/fast_diffusion_pixel_breast.pt, fd_recon_steps=8, fd_recon_init=fbp, fd_recon_init_t=0.01, fd_recon_eta=1.0, fd_recon_dc=1, fd_recon_dc_n_cg=20, fd_recon_dc_relax=1.0, rationale=iter-18 CHAMPION CONFIRMATION toward the HARD iter-20 stop. Locks the best config found: init_t0.01, n_cg20, relax1.0, steps8, eta1.0 (iter-15, hr=0.5164, rmse0.002522, psnr42.63, ssim0.978 - HALF the FBP baseline rmse0.00521). SEARCH SUMMARY: the breast-native prior + few-step flow with a deep-but-not-over-converged CG data-consistency step (DC-ON constrained variant) CLEARS the strong 128-view breast FBP baseline by a wide margin. Two levers dominate: init_t (optimum ~0.01: near-FBP embed so the prior lightly denoises without repainting; higher init_t catastrophically repaints, lower loses the prior's denoise) and dc_n_cg (SEMI-CONVERGENCE peak at ~20: enough CG to beat the analytic Hann FBP on sparse data, but not so many that CG re-amplifies measurement noise). dc_relax=1.0 (full projection) best; eta/steps near-neutral. This confirms the FAIR TEST: prior-mismatch (Mayo out_scale0.05 vs breast0.5) WAS the cause of the old hr=0; a matched breast-native prior lifts pixel-DC-on to hr~0.52. Confirmation run reproduces the champion (deterministic seed=42).", "advice_for_others": "fastdiff_flow_pixel_constrained-claude-agentic: image_size=512, pixel_spacing=0.3516, n_angles=128, n_det=1024, det_spacing=0.35754, sod=500.0, sdd=1000.0, display_min=0.0, display_max=0.5, train_n=400, val_n=200, noise_i0=100000.0, noise_sigma_e=10.0, seed=42, dataset_kind=breast_ct, fd_recon_ckpt=/cluster/maier/Agent4CT/checkpoints/fast_diffusion_pixel_breast.pt, fd_recon_steps=8, fd_recon_init=fbp, fd_recon_init_t=0.01, fd_recon_eta=1.0, fd_recon_dc=1, fd_recon_dc_n_cg=20, fd_recon_dc_relax=1.0, rationale=iter-18 CHAMPION CONFIRMATION toward the HARD iter-20 stop. Locks the best config found: init_t0.01, n_cg20, relax1.0, steps8, eta1.0 (iter-15, hr=0.5164, rmse0.002522, psnr42.63, ssim0.978 - HALF the FBP baseline rmse0.00521). SEARCH SUMMARY: the breast-native prior + few-step flow with a deep-but-not-over-converged CG data-consistency step (DC-ON constrained variant) CLEARS the strong 128-view breast FBP baseline by a wide margin. Two levers dominate: init_t (optimum ~0.01: near-FBP embed so the prior lightly denoises without repainting; higher init_t catastrophically repaints, lower loses the prior's denoise) and dc_n_cg (SEMI-CONVERGENCE peak at ~20: enough CG to beat the analytic Hann FBP on sparse data, but not so many that CG re-amplifies measurement noise). dc_relax=1.0 (full projection) best; eta/steps near-neutral. This confirms the FAIR TEST: prior-mismatch (Mayo out_scale0.05 vs breast0.5) WAS the cause of the old hr=0; a matched breast-native prior lifts pixel-DC-on to hr~0.52. Confirmation run reproduces the champion (deterministic seed=42).", "comparison_image": "runs/breast-ct-claude-agentic-fastdiff-flow-pixel-constrained-search-20260703-01/iterations/iter-0018/comparison.png"}
{"ts": "2026-07-06T22:28:31Z", "run_id": "breast-ct-claude-agentic-fastdiff-flow-pixel-constrained-search-20260703-01", "iter": 17, "agent": "fastdiff_flow_pixel_constrained-claude-agentic", "model": "claude-opus-4-8-1m", "change_class": "architecture", "status": "keep", "kept": true, "val_score": 0.9774112701416016, "headroom": 0.5108074604274189, "params_M": 3.822787, "train_n": 400, "rationale": "fastdiff_flow_pixel_constrained-claude-agentic: image_size=512, pixel_spacing=0.3516, n_angles=128, n_det=1024, det_spacing=0.35754, sod=500.0, sdd=1000.0, display_min=0.0, display_max=0.5, train_n=400, val_n=200, noise_i0=100000.0, noise_sigma_e=10.0, seed=42, dataset_kind=breast_ct, fd_recon_ckpt=/cluster/maier/Agent4CT/checkpoints/fast_diffusion_pixel_breast.pt, fd_recon_steps=8, fd_recon_init=fbp, fd_recon_init_t=0.01, fd_recon_eta=1.0, fd_recon_dc=1, fd_recon_dc_n_cg=18, fd_recon_dc_relax=1.0, rationale=iter-17 EXPLORATORY dc_n_cg 20->18 fine near the argmax at init_t0.01. SIX-BOX: (1)PRIOR: n_cg argmax at init_t0.01 is ~20: n_cg15 hr0.4938, n_cg20 hr0.5164 (BEST), n_cg25 hr0.5018. Clean inverted-U peaking at 20. (2)FAILURE: 20 may not be the exact argmax; 18 probes the immediate left of the peak. (3)ONE KNOB: dc_n_cg 20->18. (4)HYPOTHESIS: n_cg18 lands between 15(0.494) and 20(0.516); if >0.516 the true peak is 18, else 20 stands. Final argmax refinement. (5)BUDGET: 18 CG ~4min. (6)Serial.", "advice_for_others": "fastdiff_flow_pixel_constrained-claude-agentic: image_size=512, pixel_spacing=0.3516, n_angles=128, n_det=1024, det_spacing=0.35754, sod=500.0, sdd=1000.0, display_min=0.0, display_max=0.5, train_n=400, val_n=200, noise_i0=100000.0, noise_sigma_e=10.0, seed=42, dataset_kind=breast_ct, fd_recon_ckpt=/cluster/maier/Agent4CT/checkpoints/fast_diffusion_pixel_breast.pt, fd_recon_steps=8, fd_recon_init=fbp, fd_recon_init_t=0.01, fd_recon_eta=1.0, fd_recon_dc=1, fd_recon_dc_n_cg=18, fd_recon_dc_relax=1.0, rationale=iter-17 EXPLORATORY dc_n_cg 20->18 fine near the argmax at init_t0.01. SIX-BOX: (1)PRIOR: n_cg argmax at init_t0.01 is ~20: n_cg15 hr0.4938, n_cg20 hr0.5164 (BEST), n_cg25 hr0.5018. Clean inverted-U peaking at 20. (2)FAILURE: 20 may not be the exact argmax; 18 probes the immediate left of the peak. (3)ONE KNOB: dc_n_cg 20->18. (4)HYPOTHESIS: n_cg18 lands between 15(0.494) and 20(0.516); if >0.516 the true peak is 18, else 20 stands. Final argmax refinement. (5)BUDGET: 18 CG ~4min. (6)Serial.", "comparison_image": "runs/breast-ct-claude-agentic-fastdiff-flow-pixel-constrained-search-20260703-01/iterations/iter-0017/comparison.png"}
{"ts": "2026-07-06T22:23:18Z", "run_id": "breast-ct-claude-agentic-fastdiff-flow-pixel-constrained-search-20260703-01", "iter": 16, "agent": "fastdiff_flow_pixel_constrained-claude-agentic", "model": "claude-opus-4-8-1m", "change_class": "architecture", "status": "keep", "kept": true, "val_score": 0.9758946299552917, "headroom": 0.4938259030582387, "params_M": 3.822787, "train_n": 400, "rationale": "fastdiff_flow_pixel_constrained-claude-agentic: image_size=512, pixel_spacing=0.3516, n_angles=128, n_det=1024, det_spacing=0.35754, sod=500.0, sdd=1000.0, display_min=0.0, display_max=0.5, train_n=400, val_n=200, noise_i0=100000.0, noise_sigma_e=10.0, seed=42, dataset_kind=breast_ct, fd_recon_ckpt=/cluster/maier/Agent4CT/checkpoints/fast_diffusion_pixel_breast.pt, fd_recon_steps=8, fd_recon_init=fbp, fd_recon_init_t=0.01, fd_recon_eta=1.0, fd_recon_dc=1, fd_recon_dc_n_cg=15, fd_recon_dc_relax=1.0, rationale=iter-16 dc_n_cg 20->15 at init_t0.01, continuing DOWN the n_cg axis if iter-15 (n_cg20) still climbing. Maps the argmax further left.", "advice_for_others": "fastdiff_flow_pixel_constrained-claude-agentic: image_size=512, pixel_spacing=0.3516, n_angles=128, n_det=1024, det_spacing=0.35754, sod=500.0, sdd=1000.0, display_min=0.0, display_max=0.5, train_n=400, val_n=200, noise_i0=100000.0, noise_sigma_e=10.0, seed=42, dataset_kind=breast_ct, fd_recon_ckpt=/cluster/maier/Agent4CT/checkpoints/fast_diffusion_pixel_breast.pt, fd_recon_steps=8, fd_recon_init=fbp, fd_recon_init_t=0.01, fd_recon_eta=1.0, fd_recon_dc=1, fd_recon_dc_n_cg=15, fd_recon_dc_relax=1.0, rationale=iter-16 dc_n_cg 20->15 at init_t0.01, continuing DOWN the n_cg axis if iter-15 (n_cg20) still climbing. Maps the argmax further left.", "comparison_image": "runs/breast-ct-claude-agentic-fastdiff-flow-pixel-constrained-search-20260703-01/iterations/iter-0016/comparison.png"}
{"ts": "2026-07-06T22:18:48Z", "run_id": "breast-ct-claude-agentic-fastdiff-flow-pixel-constrained-search-20260703-01", "iter": 15, "agent": "fastdiff_flow_pixel_constrained-claude-agentic", "model": "claude-opus-4-8-1m", "change_class": "architecture", "status": "keep", "kept": true, "val_score": 0.9778562188148499, "headroom": 0.5163877241788388, "params_M": 3.822787, "train_n": 400, "rationale": "fastdiff_flow_pixel_constrained-claude-agentic: image_size=512, pixel_spacing=0.3516, n_angles=128, n_det=1024, det_spacing=0.35754, sod=500.0, sdd=1000.0, display_min=0.0, display_max=0.5, train_n=400, val_n=200, noise_i0=100000.0, noise_sigma_e=10.0, seed=42, dataset_kind=breast_ct, fd_recon_ckpt=/cluster/maier/Agent4CT/checkpoints/fast_diffusion_pixel_breast.pt, fd_recon_steps=8, fd_recon_init=fbp, fd_recon_init_t=0.01, fd_recon_eta=1.0, fd_recon_dc=1, fd_recon_dc_n_cg=20, fd_recon_dc_relax=1.0, rationale=iter-15 EXPLORATORY dc_n_cg 25->20 at init_t0.01, continuing DOWN the n_cg axis. SIX-BOX: (1)PRIOR: BIG JUMP - at init_t0.01 the n_cg semi-convergence peak is LOWER than the init_t0.05 peak: n_cg30 hr0.3605 -> n_cg25 hr0.5018 (rmse0.003335->0.002598, psnr40.2->42.4, ssim0.950->0.974). Fewer CG iters = less measurement-noise amplification at low init_t. (Earlier n_cg20 at init_t0.05 was hr0 because high init_t injected prior-noise; at init_t0.01 that's gone.) (2)FAILURE: n_cg25 may not be the argmax; the peak could be lower. (3)ONE KNOB: dc_n_cg 25->20. (4)HYPOTHESIS: n_cg20 continues the climb (peak still left) OR drops (peak was 25). Brackets the true argmax at the winning init_t. (5)BUDGET: 20 CG faster than 25, ~4min. (6)Serial.", "advice_for_others": "fastdiff_flow_pixel_constrained-claude-agentic: image_size=512, pixel_spacing=0.3516, n_angles=128, n_det=1024, det_spacing=0.35754, sod=500.0, sdd=1000.0, display_min=0.0, display_max=0.5, train_n=400, val_n=200, noise_i0=100000.0, noise_sigma_e=10.0, seed=42, dataset_kind=breast_ct, fd_recon_ckpt=/cluster/maier/Agent4CT/checkpoints/fast_diffusion_pixel_breast.pt, fd_recon_steps=8, fd_recon_init=fbp, fd_recon_init_t=0.01, fd_recon_eta=1.0, fd_recon_dc=1, fd_recon_dc_n_cg=20, fd_recon_dc_relax=1.0, rationale=iter-15 EXPLORATORY dc_n_cg 25->20 at init_t0.01, continuing DOWN the n_cg axis. SIX-BOX: (1)PRIOR: BIG JUMP - at init_t0.01 the n_cg semi-convergence peak is LOWER than the init_t0.05 peak: n_cg30 hr0.3605 -> n_cg25 hr0.5018 (rmse0.003335->0.002598, psnr40.2->42.4, ssim0.950->0.974). Fewer CG iters = less measurement-noise amplification at low init_t. (Earlier n_cg20 at init_t0.05 was hr0 because high init_t injected prior-noise; at init_t0.01 that's gone.) (2)FAILURE: n_cg25 may not be the argmax; the peak could be lower. (3)ONE KNOB: dc_n_cg 25->20. (4)HYPOTHESIS: n_cg20 continues the climb (peak still left) OR drops (peak was 25). Brackets the true argmax at the winning init_t. (5)BUDGET: 20 CG faster than 25, ~4min. (6)Serial.", "comparison_image": "runs/breast-ct-claude-agentic-fastdiff-flow-pixel-constrained-search-20260703-01/iterations/iter-0015/comparison.png"}
{"ts": "2026-07-06T22:15:18Z", "run_id": "breast-ct-claude-agentic-fastdiff-wdm-wavelet-constrained-search-20260703-01", "iter": 20, "agent": "fastdiff_wdm_wavelet_constrained-claude-agentic", "model": "claude-opus-4-8-1m", "change_class": "architecture", "status": "keep", "kept": true, "val_score": 0.9293705821037292, "headroom": 0.27669639419700076, "params_M": 3.824908, "train_n": 3600, "rationale": "fastdiff_wdm_wavelet_constrained-claude-agentic: val_n=200, seed=42, fd_recon_ckpt=/cluster/maier/Agent4CT/checkpoints/fast_diffusion_wavelet_breast.pt, fd_recon_steps=5, fd_recon_init=fbp, fd_recon_init_t=0.005, fd_recon_eta=1.0, fd_recon_dc=1, fd_recon_dc_n_cg=22, fd_recon_dc_relax=0.9, dataset_kind=breast_ct, rationale=iter-20 FINAL: dc_relax nudge at the optimum, breast-native wavelet CONSTRAINED, val=200. SIX-BOX: (1) PRIOR: BEST iter-19 steps5/n_cg22/init_t0.005/relax1.0 hr0.2684 (PSNR39.04/RMSE3.81e-3); n_cg plateau 18-22 ~0.266-0.268. All other levers characterized: init_t must be ~0 (prior net-harmful, monotone), steps=5 is a sharp peak, dc_relax=1.0 has been fixed since iter-2. (2) FAILURE MODE: dc_relax=1.0 fully replaces the warm-start each step; a slight blend-back (0.9) might retain useful FBP structure the CG-LSQ drops. (3) ONE KNOB: fd_recon_dc_relax 1.0 -> 0.9 (retain 10% warm-start FBP). (4) HYPOTHESIS: 0.9 blends a little regularized-FBP structure into the CG-LSQ solution -> could edge above 0.2684; if it drops, relax=1.0 (full DC) is confirmed optimal and iter-19 is the champion. (5) BUDGET ~2.5min. (6) FINAL iter -- loop concludes at 20 per protocol.", "advice_for_others": "fastdiff_wdm_wavelet_constrained-claude-agentic: val_n=200, seed=42, fd_recon_ckpt=/cluster/maier/Agent4CT/checkpoints/fast_diffusion_wavelet_breast.pt, fd_recon_steps=5, fd_recon_init=fbp, fd_recon_init_t=0.005, fd_recon_eta=1.0, fd_recon_dc=1, fd_recon_dc_n_cg=22, fd_recon_dc_relax=0.9, dataset_kind=breast_ct, rationale=iter-20 FINAL: dc_relax nudge at the optimum, breast-native wavelet CONSTRAINED, val=200. SIX-BOX: (1) PRIOR: BEST iter-19 steps5/n_cg22/init_t0.005/relax1.0 hr0.2684 (PSNR39.04/RMSE3.81e-3); n_cg plateau 18-22 ~0.266-0.268. All other levers characterized: init_t must be ~0 (prior net-harmful, monotone), steps=5 is a sharp peak, dc_relax=1.0 has been fixed since iter-2. (2) FAILURE MODE: dc_relax=1.0 fully replaces the warm-start each step; a slight blend-back (0.9) might retain useful FBP structure the CG-LSQ drops. (3) ONE KNOB: fd_recon_dc_relax 1.0 -> 0.9 (retain 10% warm-start FBP). (4) HYPOTHESIS: 0.9 blends a little regularized-FBP structure into the CG-LSQ solution -> could edge above 0.2684; if it drops, relax=1.0 (full DC) is confirmed optimal and iter-19 is the champion. (5) BUDGET ~2.5min. (6) FINAL iter -- loop concludes at 20 per protocol.", "comparison_image": "runs/breast-ct-claude-agentic-fastdiff-wdm-wavelet-constrained-search-20260703-01/iterations/iter-0020/comparison.png"}
{"ts": "2026-07-06T22:13:44Z", "run_id": "breast-ct-claude-agentic-fastdiff-flow-pixel-constrained-search-20260703-01", "iter": 14, "agent": "fastdiff_flow_pixel_constrained-claude-agentic", "model": "claude-opus-4-8-1m", "change_class": "architecture", "status": "keep", "kept": true, "val_score": 0.9741517901420593, "headroom": 0.5018463796090391, "params_M": 3.822787, "train_n": 400, "rationale": "fastdiff_flow_pixel_constrained-claude-agentic: image_size=512, pixel_spacing=0.3516, n_angles=128, n_det=1024, det_spacing=0.35754, sod=500.0, sdd=1000.0, display_min=0.0, display_max=0.5, train_n=400, val_n=200, noise_i0=100000.0, noise_sigma_e=10.0, seed=42, dataset_kind=breast_ct, fd_recon_ckpt=/cluster/maier/Agent4CT/checkpoints/fast_diffusion_pixel_breast.pt, fd_recon_steps=8, fd_recon_init=fbp, fd_recon_init_t=0.01, fd_recon_eta=1.0, fd_recon_dc=1, fd_recon_dc_n_cg=25, fd_recon_dc_relax=1.0, rationale=iter-14 dc_n_cg 30->25 at init_t0.01 (fine-map the argmax LEFT at the winning low init_t; n_cg45 crashed so peak<=30).", "advice_for_others": "fastdiff_flow_pixel_constrained-claude-agentic: image_size=512, pixel_spacing=0.3516, n_angles=128, n_det=1024, det_spacing=0.35754, sod=500.0, sdd=1000.0, display_min=0.0, display_max=0.5, train_n=400, val_n=200, noise_i0=100000.0, noise_sigma_e=10.0, seed=42, dataset_kind=breast_ct, fd_recon_ckpt=/cluster/maier/Agent4CT/checkpoints/fast_diffusion_pixel_breast.pt, fd_recon_steps=8, fd_recon_init=fbp, fd_recon_init_t=0.01, fd_recon_eta=1.0, fd_recon_dc=1, fd_recon_dc_n_cg=25, fd_recon_dc_relax=1.0, rationale=iter-14 dc_n_cg 30->25 at init_t0.01 (fine-map the argmax LEFT at the winning low init_t; n_cg45 crashed so peak<=30).", "comparison_image": "runs/breast-ct-claude-agentic-fastdiff-flow-pixel-constrained-search-20260703-01/iterations/iter-0014/comparison.png"}
{"ts": "2026-07-06T22:12:10Z", "run_id": "breast-ct-claude-agentic-fastdiff-wdm-wavelet-constrained-search-20260703-01", "iter": 19, "agent": "fastdiff_wdm_wavelet_constrained-claude-agentic", "model": "claude-opus-4-8-1m", "change_class": "architecture", "status": "keep", "kept": true, "val_score": 0.9271124005317688, "headroom": 0.2684305523269339, "params_M": 3.824908, "train_n": 3600, "rationale": "fastdiff_wdm_wavelet_constrained-claude-agentic: val_n=200, seed=42, fd_recon_ckpt=/cluster/maier/Agent4CT/checkpoints/fast_diffusion_wavelet_breast.pt, fd_recon_steps=5, fd_recon_init=fbp, fd_recon_init_t=0.005, fd_recon_eta=1.0, fd_recon_dc=1, fd_recon_dc_n_cg=22, fd_recon_dc_relax=1.0, dataset_kind=breast_ct, rationale=iter-19 re-optimize n_cg AT the steps=5 peak, breast-native wavelet CONSTRAINED, val=200. SIX-BOX: (1) PRIOR: BEST is iter-17 steps5/n_cg18/init_t0.005/relax1.0 hr0.2658 (PSNR39.0/RMSE3.83e-3). n_cg was tuned at steps=8 (opt~18-20); the steps<->n_cg schedules interact, so the n_cg optimum may shift at steps=5. (2) FAILURE MODE: n_cg18 may be slightly under/over-converged at the steps=5 schedule. (3) ONE KNOB: fd_recon_dc_n_cg 18 -> 22 (test if a stronger CG solve helps more at the sharper steps=5 schedule). (4) HYPOTHESIS: at steps=5 fewer DC applications occur, so each may want more CG iters -> n_cg22 could beat 0.2658; if it drops, 18 remains optimal and I lock steps5/n_cg18. (5) BUDGET ~2.5min. (6) iter-20 (final): the better of a dc_relax0.9 nudge or n_cg16 at steps5.", "advice_for_others": "fastdiff_wdm_wavelet_constrained-claude-agentic: val_n=200, seed=42, fd_recon_ckpt=/cluster/maier/Agent4CT/checkpoints/fast_diffusion_wavelet_breast.pt, fd_recon_steps=5, fd_recon_init=fbp, fd_recon_init_t=0.005, fd_recon_eta=1.0, fd_recon_dc=1, fd_recon_dc_n_cg=22, fd_recon_dc_relax=1.0, dataset_kind=breast_ct, rationale=iter-19 re-optimize n_cg AT the steps=5 peak, breast-native wavelet CONSTRAINED, val=200. SIX-BOX: (1) PRIOR: BEST is iter-17 steps5/n_cg18/init_t0.005/relax1.0 hr0.2658 (PSNR39.0/RMSE3.83e-3). n_cg was tuned at steps=8 (opt~18-20); the steps<->n_cg schedules interact, so the n_cg optimum may shift at steps=5. (2) FAILURE MODE: n_cg18 may be slightly under/over-converged at the steps=5 schedule. (3) ONE KNOB: fd_recon_dc_n_cg 18 -> 22 (test if a stronger CG solve helps more at the sharper steps=5 schedule). (4) HYPOTHESIS: at steps=5 fewer DC applications occur, so each may want more CG iters -> n_cg22 could beat 0.2658; if it drops, 18 remains optimal and I lock steps5/n_cg18. (5) BUDGET ~2.5min. (6) iter-20 (final): the better of a dc_relax0.9 nudge or n_cg16 at steps5.", "comparison_image": "runs/breast-ct-claude-agentic-fastdiff-wdm-wavelet-constrained-search-20260703-01/iterations/iter-0019/comparison.png"}
{"ts": "2026-07-06T22:08:46Z", "run_id": "breast-ct-claude-agentic-fastdiff-wdm-wavelet-constrained-search-20260703-01", "iter": 18, "agent": "fastdiff_wdm_wavelet_constrained-claude-agentic", "model": "claude-opus-4-8-1m", "change_class": "architecture", "status": "keep", "kept": true, "val_score": 0.8885961771011353, "headroom": 0.10327991141664516, "params_M": 3.824908, "train_n": 3600, "rationale": "fastdiff_wdm_wavelet_constrained-claude-agentic: val_n=200, seed=42, fd_recon_ckpt=/cluster/maier/Agent4CT/checkpoints/fast_diffusion_wavelet_breast.pt, fd_recon_steps=6, fd_recon_init=fbp, fd_recon_init_t=0.005, fd_recon_eta=1.0, fd_recon_dc=1, fd_recon_dc_n_cg=18, fd_recon_dc_relax=1.0, dataset_kind=breast_ct, rationale=iter-18 NFE bracket (steps=6), breast-native wavelet CONSTRAINED, val=200. SIX-BOX: (1) PRIOR: steps@n_cg18/init_t0.005: 2->0.002, 4->0.130, 5->0.2658(BEST), 8->0.0768, 16->0. Non-monotone/sharp: steps=5 nearly 2x steps4. (2) FAILURE MODE: the interleaved DC re-embed schedule is sharply sensitive to step count; 5 hits a sweet spot, 8 falls off. (3) ONE KNOB: fd_recon_steps 5 -> 6. (4) HYPOTHESIS: steps=6 lands between 0.266(5) and 0.077(8); if >0.266 peak is 6, else steps=5 optimal. (5) BUDGET ~2min. (6) iter-19 on landing (steps=7 or refine around 5).", "advice_for_others": "fastdiff_wdm_wavelet_constrained-claude-agentic: val_n=200, seed=42, fd_recon_ckpt=/cluster/maier/Agent4CT/checkpoints/fast_diffusion_wavelet_breast.pt, fd_recon_steps=6, fd_recon_init=fbp, fd_recon_init_t=0.005, fd_recon_eta=1.0, fd_recon_dc=1, fd_recon_dc_n_cg=18, fd_recon_dc_relax=1.0, dataset_kind=breast_ct, rationale=iter-18 NFE bracket (steps=6), breast-native wavelet CONSTRAINED, val=200. SIX-BOX: (1) PRIOR: steps@n_cg18/init_t0.005: 2->0.002, 4->0.130, 5->0.2658(BEST), 8->0.0768, 16->0. Non-monotone/sharp: steps=5 nearly 2x steps4. (2) FAILURE MODE: the interleaved DC re-embed schedule is sharply sensitive to step count; 5 hits a sweet spot, 8 falls off. (3) ONE KNOB: fd_recon_steps 5 -> 6. (4) HYPOTHESIS: steps=6 lands between 0.266(5) and 0.077(8); if >0.266 peak is 6, else steps=5 optimal. (5) BUDGET ~2min. (6) iter-19 on landing (steps=7 or refine around 5).", "comparison_image": "runs/breast-ct-claude-agentic-fastdiff-wdm-wavelet-constrained-search-20260703-01/iterations/iter-0018/comparison.png"}
