{"ts": "2026-07-05T19:54:56Z", "run_id": "breast-ct-claude-agentic-r2gaussian-search-20260703-01", "iter": 9, "agent": "r2gaussian-claude-agentic", "model": "claude-opus-4-8-1m", "change_class": "architecture", "status": "discard", "kept": false, "val_score": 0.9279667735099792, "headroom": 0.0, "params_M": 0.006144, "train_n": 400, "rationale": "r2gaussian-claude-agentic: val_n=15, gs_n_gaussians=1024, gs_n_iter=130, gs_lr_pos=0.005, gs_lr_scale=0.01, gs_lr_amp=0.01, gs_lr_rot=0.01, gs_amp_init=0.01, gs_scale_init=0.04, gs_tv_weight=0.0001, gs_n_clip=0.05, gs_init_from_fbp=True, gs_render=raster, gs_ssim_weight=0.3, seed=42, train_n=0, rationale=iter-9 (search-20260703-01) -- CEILING CONFIRMATION #1 (empty-patch re-run of iter-6 BEST: warm-start + SSIM-loss@0.30, 1024 Gaussians / 130 it / scale 0.04 / tv 1e-4). SIX-BOX. (a) PRIOR NUMBERS: hr pinned 0 at EVERY iter 1-8. Best SSIM 0.9278 @ iter-6 (PSNR 28.67). Lever map now COMPLETE, all hr=0: steps FLAT (iter-1 0.8032 vs iter-2 0.8048), capacity +0.010 (iter-3 1024G 0.8145), warm-start +0.039 (iter-4 0.8539), SSIM-loss +0.073 (iter-5 0.9264@0.15), SSIM-weight SATURATED (iter-6 0.9278@0.30 vs iter-5), basis-scale FLAT (iter-7 0.9276@scale0.02), TV-reg FLAT (iter-8 0.9274@tv1e-3). (b) FAILURE MODE: R2-Gaussian is REGIME-BOUNDED on dense 128-view breast -- the coarse anisotropic-Gaussian basis (1024 splats, 0.006M params) plateaus at SSIM ~0.928 / PSNR ~28.7 dB, ~7.3 dB BELOW the strong 128-view FBP baseline (PSNR 35.97), so the RMSE/PSNR-gated headroom stays 0. This reproduces the documented ceiling (findings.md 2026-06-03: R2-G structurally bounded on dense-view breast; FBP is already very strong). (c) UNTESTED IN-BUDGET LEVER MOVING hr OFF 0? NONE -- all 7 lever families mapped+exhausted; the strongest (warm-start + SSIM-loss) got closest but still 7.3 dB short. The R2-G paper benchmarks SPARSE-view CBCT (<=50 views) where FBP is weak; on dense 128-view 2D CT it is the wrong inductive bias. (d) DECISION: empty-patch {} re-run of the run-best config to confirm SSIM ~0.928 / hr=0 reproduces (plateau documentation toward HARD iter-20). (e) BUDGET: identical to iter-6, ~660-1000s (node-dependent) << 1080 in-solver wall < 1800 SLURM wall; val figure excluded. (f) val_n=15 HELD CONSTANT. PREDICTION: SSIM ~0.928 (0.925-0.930), hr 0 -- faithful-but-regime-bounded negative result., gs_outer_wall_s=1080, gs_amp_init_max=0.05", "advice_for_others": "r2gaussian-claude-agentic: val_n=15, gs_n_gaussians=1024, gs_n_iter=130, gs_lr_pos=0.005, gs_lr_scale=0.01, gs_lr_amp=0.01, gs_lr_rot=0.01, gs_amp_init=0.01, gs_scale_init=0.04, gs_tv_weight=0.0001, gs_n_clip=0.05, gs_init_from_fbp=True, gs_render=raster, gs_ssim_weight=0.3, seed=42, train_n=0, rationale=iter-9 (search-20260703-01) -- CEILING CONFIRMATION #1 (empty-patch re-run of iter-6 BEST: warm-start + SSIM-loss@0.30, 1024 Gaussians / 130 it / scale 0.04 / tv 1e-4). SIX-BOX. (a) PRIOR NUMBERS: hr pinned 0 at EVERY iter 1-8. Best SSIM 0.9278 @ iter-6 (PSNR 28.67). Lever map now COMPLETE, all hr=0: steps FLAT (iter-1 0.8032 vs iter-2 0.8048), capacity +0.010 (iter-3 1024G 0.8145), warm-start +0.039 (iter-4 0.8539), SSIM-loss +0.073 (iter-5 0.9264@0.15), SSIM-weight SATURATED (iter-6 0.9278@0.30 vs iter-5), basis-scale FLAT (iter-7 0.9276@scale0.02), TV-reg FLAT (iter-8 0.9274@tv1e-3). (b) FAILURE MODE: R2-Gaussian is REGIME-BOUNDED on dense 128-view breast -- the coarse anisotropic-Gaussian basis (1024 splats, 0.006M params) plateaus at SSIM ~0.928 / PSNR ~28.7 dB, ~7.3 dB BELOW the strong 128-view FBP baseline (PSNR 35.97), so the RMSE/PSNR-gated headroom stays 0. This reproduces the documented ceiling (findings.md 2026-06-03: R2-G structurally bounded on dense-view breast; FBP is already very strong). (c) UNTESTED IN-BUDGET LEVER MOVING hr OFF 0? NONE -- all 7 lever families mapped+exhausted; the strongest (warm-start + SSIM-loss) got closest but still 7.3 dB short. The R2-G paper benchmarks SPARSE-view CBCT (<=50 views) where FBP is weak; on dense 128-view 2D CT it is the wrong inductive bias. (d) DECISION: empty-patch {} re-run of the run-best config to confirm SSIM ~0.928 / hr=0 reproduces (plateau documentation toward HARD iter-20). (e) BUDGET: identical to iter-6, ~660-1000s (node-dependent) << 1080 in-solver wall < 1800 SLURM wall; val figure excluded. (f) val_n=15 HELD CONSTANT. PREDICTION: SSIM ~0.928 (0.925-0.930), hr 0 -- faithful-but-regime-bounded negative result., gs_outer_wall_s=1080, gs_amp_init_max=0.05", "comparison_image": "runs/breast-ct-claude-agentic-r2gaussian-search-20260703-01/iterations/iter-0009/comparison.png"}
{"ts": "2026-07-05T19:42:16Z", "run_id": "breast-ct-claude-agentic-tv-iterative-search-20260703-01", "iter": 14, "agent": "tv_iterative-claude-agentic", "model": "claude-opus-4-8-1m", "change_class": "architecture", "status": "keep", "kept": true, "val_score": 0.9912824630737305, "headroom": 0.36072747445901077, "params_M": 0.0, "train_n": 400, "rationale": "tv_iterative-claude-agentic: val_n=200, tv_lambda=0.00225, tv_iterations=1000, tv_lr=0.01, tv_decay=0.01, tv_optimizer=gd, tv_init=fbp, rationale=iter-14 LAMBDA peak refinement (low side). iter-13 tv_init zeros COLLAPSED hr->0.0 (FBP warm-start ESSENTIAL for TV-GD on 128-view sparse breast \u2014 the documented structural init dependence CONFIRMED); revert to fbp. Lambda peak is shallow at 2.5e-3 (iter-8 hr=0.36286): 2e-3->0.3552, 2.5e-3->0.36286 PEAK, 3e-3->0.3597, 4e-3->0.3336. ONE knob: tv_lambda 2.5e-3->2.25e-3 (test the low side of the bracket; best config otherwise gd, 1000it, lr=0.01, decay=0.01, fbp). HYPOTHESIS: if hr>0.36286 the true peak is between 2e-3 and 2.5e-3; if hr<0.36286 the peak is at/above 2.5e-3 and 0.36286 stands. Budget: ~950s at 1000 iters, <1200s wall.", "advice_for_others": "tv_iterative-claude-agentic: val_n=200, tv_lambda=0.00225, tv_iterations=1000, tv_lr=0.01, tv_decay=0.01, tv_optimizer=gd, tv_init=fbp, rationale=iter-14 LAMBDA peak refinement (low side). iter-13 tv_init zeros COLLAPSED hr->0.0 (FBP warm-start ESSENTIAL for TV-GD on 128-view sparse breast \u2014 the documented structural init dependence CONFIRMED); revert to fbp. Lambda peak is shallow at 2.5e-3 (iter-8 hr=0.36286): 2e-3->0.3552, 2.5e-3->0.36286 PEAK, 3e-3->0.3597, 4e-3->0.3336. ONE knob: tv_lambda 2.5e-3->2.25e-3 (test the low side of the bracket; best config otherwise gd, 1000it, lr=0.01, decay=0.01, fbp). HYPOTHESIS: if hr>0.36286 the true peak is between 2e-3 and 2.5e-3; if hr<0.36286 the peak is at/above 2.5e-3 and 0.36286 stands. Budget: ~950s at 1000 iters, <1200s wall.", "comparison_image": "runs/breast-ct-claude-agentic-tv-iterative-search-20260703-01/iterations/iter-0014/comparison.png"}
{"ts": "2026-07-05T19:41:20Z", "run_id": "breast-ct-claude-agentic-r2gaussian-search-20260703-01", "iter": 8, "agent": "r2gaussian-claude-agentic", "model": "claude-opus-4-8-1m", "change_class": "architecture", "status": "discard", "kept": false, "val_score": 0.9274045825004578, "headroom": 0.0, "params_M": 0.006144, "train_n": 400, "rationale": "r2gaussian-claude-agentic: val_n=15, gs_n_gaussians=1024, gs_n_iter=130, gs_lr_pos=0.005, gs_lr_scale=0.01, gs_lr_amp=0.01, gs_lr_rot=0.01, gs_amp_init=0.01, gs_scale_init=0.04, gs_tv_weight=0.001, gs_n_clip=0.05, gs_init_from_fbp=True, gs_render=raster, gs_ssim_weight=0.3, seed=42, train_n=0, rationale=iter-8 (search-20260703-01). ONE KNOB (regularization): gs_tv_weight 1e-4->1e-3 (10x the total-variation smoothness penalty on the rasterized mu). Base = iter-6 BEST (warm-start + SSIM-loss@0.30, 1024G/130it, gs_scale_init reverted 0.02->0.04 since iter-7 finer-scale was marginally WORSE). Budget-neutral free-parameter change. PRIOR NUMBERS: iter-4 0.8539/22.50 (warm), iter-5 0.9264/28.55 (SSIM@0.15), iter-6 0.9278/28.67 (SSIM@0.30, BEST), iter-7 0.9276/28.64 (finer scale 0.02, FLAT/worse -> basis-scale lever exhausted). hr pinned 0 at EVERY iter; best PSNR 28.67 vs 128-view FBP baseline 35.97 (7.3 dB gap). FAILURE MODE: coarse Gaussian basis plateaus at SSIM ~0.928 / PSNR ~28.7 dB across ALL levers mapped so far (steps FLAT, capacity +0.01, warm-start +0.039, SSIM-loss +0.073 then saturated, basis-scale FLAT). The recon may have residual splat-boundary artifacts that a stronger TV penalty could smooth toward the FBP RMSE. HYPOTHESIS (falsifiable in NUMBERS): 10x TV regularization suppresses inter-Gaussian discontinuities, dropping RMSE below iter-6 0.01211 / lifting PSNR above 28.67 toward the FBP floor. FALSIFIER: if SSIM <= 0.9278 / PSNR <= 28.67 (no lift, or over-smoothed), TV is not the missing lever -> the ~7 dB gap to the FBP floor is the fundamental coarse-basis ceiling, hr stays 0. val_n=15 HELD CONSTANT (gs_outer_wall_s=1080). BUDGET: TV weight is free; same ~660-1000s. TRAJECTORY: iter-6 0.9278 (BEST) -> iter-7 0.9276 (finer scale, flat) -> iter-8 10x-TV test., gs_outer_wall_s=1080, gs_amp_init_max=0.05", "advice_for_others": "r2gaussian-claude-agentic: val_n=15, gs_n_gaussians=1024, gs_n_iter=130, gs_lr_pos=0.005, gs_lr_scale=0.01, gs_lr_amp=0.01, gs_lr_rot=0.01, gs_amp_init=0.01, gs_scale_init=0.04, gs_tv_weight=0.001, gs_n_clip=0.05, gs_init_from_fbp=True, gs_render=raster, gs_ssim_weight=0.3, seed=42, train_n=0, rationale=iter-8 (search-20260703-01). ONE KNOB (regularization): gs_tv_weight 1e-4->1e-3 (10x the total-variation smoothness penalty on the rasterized mu). Base = iter-6 BEST (warm-start + SSIM-loss@0.30, 1024G/130it, gs_scale_init reverted 0.02->0.04 since iter-7 finer-scale was marginally WORSE). Budget-neutral free-parameter change. PRIOR NUMBERS: iter-4 0.8539/22.50 (warm), iter-5 0.9264/28.55 (SSIM@0.15), iter-6 0.9278/28.67 (SSIM@0.30, BEST), iter-7 0.9276/28.64 (finer scale 0.02, FLAT/worse -> basis-scale lever exhausted). hr pinned 0 at EVERY iter; best PSNR 28.67 vs 128-view FBP baseline 35.97 (7.3 dB gap). FAILURE MODE: coarse Gaussian basis plateaus at SSIM ~0.928 / PSNR ~28.7 dB across ALL levers mapped so far (steps FLAT, capacity +0.01, warm-start +0.039, SSIM-loss +0.073 then saturated, basis-scale FLAT). The recon may have residual splat-boundary artifacts that a stronger TV penalty could smooth toward the FBP RMSE. HYPOTHESIS (falsifiable in NUMBERS): 10x TV regularization suppresses inter-Gaussian discontinuities, dropping RMSE below iter-6 0.01211 / lifting PSNR above 28.67 toward the FBP floor. FALSIFIER: if SSIM <= 0.9278 / PSNR <= 28.67 (no lift, or over-smoothed), TV is not the missing lever -> the ~7 dB gap to the FBP floor is the fundamental coarse-basis ceiling, hr stays 0. val_n=15 HELD CONSTANT (gs_outer_wall_s=1080). BUDGET: TV weight is free; same ~660-1000s. TRAJECTORY: iter-6 0.9278 (BEST) -> iter-7 0.9276 (finer scale, flat) -> iter-8 10x-TV test., gs_outer_wall_s=1080, gs_amp_init_max=0.05", "comparison_image": "runs/breast-ct-claude-agentic-r2gaussian-search-20260703-01/iterations/iter-0008/comparison.png"}
{"ts": "2026-07-05T19:40:03Z", "run_id": "breast-ct-claude-agentic-dual-domain-bilateral-supervised-search-20260703-01", "iter": 20, "agent": "dual_domain_bilateral_supervised-claude-agentic", "model": "claude-opus-4-8-1m", "change_class": "architecture", "status": "keep", "kept": true, "val_score": 0.9836108088493347, "headroom": 0.2564459635016073, "params_M": 2.4e-05, "train_n": 400, "rationale": "dual_domain_bilateral_supervised-claude-agentic: proj_n_bf=1, img_n_bf=7, proj_kernel=3, proj_sx=0.01, proj_sy=0.3, proj_sr=0.0005, img_kernel=7, img_sx=0.5, img_sy=0.5, img_sr=0.02, epochs=10, batch_size=1, lr=0.01, optimizer=adam, lambda_neg=1.0, grad_clip=1.0, train_n=800, val_n=200, val_chunk=10, seed=49, rationale=iter-20 (FINAL) dual_domain_bilateral_supervised, re-split Breast-CT val=200. SIX-BOX at BEST config (img_n_bf7/img_kernel7/lr1e-2/lneg1.0/train_n800). (1) PRIOR: 7 seed replicates -- 42=0.2561,43=0.2538,44=0.2538,45=0.2564,46=0.2542,47=0.2551,48=0.2560 -> mean~0.2551 std~0.0011. The 24-param DD-BF optimum is highly seed-robust (~0.255+-0.001), unlike the sibling DD-UNet (~0.04). (2) Failure mode: none; final replicate to close at n=8. (3) ONE KNOB: seed 49 (8th/final replicate). (4) HYPOTHESIS: seed=49 lands ~0.253-0.257; n=8 gives the honest reportable config number ~0.255+-0.001. (5) BUDGET: ~200s. (6) FINAL iter of the 20-iter search; primary finding = a robust ~0.255 hr with tiny seed variance at a 24-param trainable-bilateral DD pipeline. Artifacts saved.", "advice_for_others": "dual_domain_bilateral_supervised-claude-agentic: proj_n_bf=1, img_n_bf=7, proj_kernel=3, proj_sx=0.01, proj_sy=0.3, proj_sr=0.0005, img_kernel=7, img_sx=0.5, img_sy=0.5, img_sr=0.02, epochs=10, batch_size=1, lr=0.01, optimizer=adam, lambda_neg=1.0, grad_clip=1.0, train_n=800, val_n=200, val_chunk=10, seed=49, rationale=iter-20 (FINAL) dual_domain_bilateral_supervised, re-split Breast-CT val=200. SIX-BOX at BEST config (img_n_bf7/img_kernel7/lr1e-2/lneg1.0/train_n800). (1) PRIOR: 7 seed replicates -- 42=0.2561,43=0.2538,44=0.2538,45=0.2564,46=0.2542,47=0.2551,48=0.2560 -> mean~0.2551 std~0.0011. The 24-param DD-BF optimum is highly seed-robust (~0.255+-0.001), unlike the sibling DD-UNet (~0.04). (2) Failure mode: none; final replicate to close at n=8. (3) ONE KNOB: seed 49 (8th/final replicate). (4) HYPOTHESIS: seed=49 lands ~0.253-0.257; n=8 gives the honest reportable config number ~0.255+-0.001. (5) BUDGET: ~200s. (6) FINAL iter of the 20-iter search; primary finding = a robust ~0.255 hr with tiny seed variance at a 24-param trainable-bilateral DD pipeline. Artifacts saved.", "comparison_image": "runs/breast-ct-claude-agentic-dual-domain-bilateral-supervised-search-20260703-01/iterations/iter-0020/comparison.png"}
{"ts": "2026-07-05T19:31:30Z", "run_id": "breast-ct-claude-agentic-dual-domain-bilateral-n2i-search-20260703-01", "iter": 5, "agent": "dual_domain_bilateral_n2i-claude-agentic", "model": "claude-opus-4-8-1m", "change_class": "architecture", "status": "keep", "kept": true, "val_score": 0.9605477452278137, "headroom": 0.1256536179070813, "params_M": 6e-06, "train_n": 400, "rationale": "dual_domain_bilateral_n2i-claude-agentic: warm_start=True, pretrain_epochs=2, train_n=400, n_iter=30, val_n=200, batch_size=1, grad_clip=1.0, lr=0.005, proj_n_bf=1, img_n_bf=1, img_sr=0.0005, outer_wall_s=900, seed=42, rationale=iter-5 dual_domain_bilateral_n2i, ONE-KNOB: image-domain BF RANGE sigma img_sr 0.02->0.0005 (much tighter intensity bandwidth -> edge-preserving). Back to proj_n_bf=1/img_n_bf=1/n_iter=30 (iter-4 proj depth2 was hr=0 SSIM0.9563 recon_rmse9.85e-4 ~= base9.84e-4 -> projection axis also FBP-bounded). TRAJECTORY so far (all hr=0): depth (img & proj), n_iter/early-stop all asymptote to FBP from above, never below. HYPOTHESIS: the failure is edge-BLINDNESS -- a wide range sigma (0.02) lets the BF average across fibroglandular tissue edges (over-smooth). A TIGHT img_sr=0.0005 (the old-split breast N2I champion value) makes the range kernel edge-preserving: it smooths flat noise but STOPS at intensity edges, so the recon could retain detail AND denoise -> first real shot at recon_rmse < baseline (hr>0). If STILL hr=0, edge-preservation via range sigma does not unlock breast N2I either. FAILURE watched: too-tight img_sr -> BF becomes near-identity (no denoising) -> recon = raw noisy FBP (SSIM/PSNR ~ baseline, not below). BUDGET: img_sr is a VALUE change, same kernel/unfold cost as iter-3 (1047s); outer_wall_s tightened 1050->900 to keep total safely under the 30-min sbatch wall (iter-4 proj-depth2 ran 25 min). ONE knob: img_sr 0.02->0.0005.", "advice_for_others": "dual_domain_bilateral_n2i-claude-agentic: warm_start=True, pretrain_epochs=2, train_n=400, n_iter=30, val_n=200, batch_size=1, grad_clip=1.0, lr=0.005, proj_n_bf=1, img_n_bf=1, img_sr=0.0005, outer_wall_s=900, seed=42, rationale=iter-5 dual_domain_bilateral_n2i, ONE-KNOB: image-domain BF RANGE sigma img_sr 0.02->0.0005 (much tighter intensity bandwidth -> edge-preserving). Back to proj_n_bf=1/img_n_bf=1/n_iter=30 (iter-4 proj depth2 was hr=0 SSIM0.9563 recon_rmse9.85e-4 ~= base9.84e-4 -> projection axis also FBP-bounded). TRAJECTORY so far (all hr=0): depth (img & proj), n_iter/early-stop all asymptote to FBP from above, never below. HYPOTHESIS: the failure is edge-BLINDNESS -- a wide range sigma (0.02) lets the BF average across fibroglandular tissue edges (over-smooth). A TIGHT img_sr=0.0005 (the old-split breast N2I champion value) makes the range kernel edge-preserving: it smooths flat noise but STOPS at intensity edges, so the recon could retain detail AND denoise -> first real shot at recon_rmse < baseline (hr>0). If STILL hr=0, edge-preservation via range sigma does not unlock breast N2I either. FAILURE watched: too-tight img_sr -> BF becomes near-identity (no denoising) -> recon = raw noisy FBP (SSIM/PSNR ~ baseline, not below). BUDGET: img_sr is a VALUE change, same kernel/unfold cost as iter-3 (1047s); outer_wall_s tightened 1050->900 to keep total safely under the 30-min sbatch wall (iter-4 proj-depth2 ran 25 min). ONE knob: img_sr 0.02->0.0005.", "comparison_image": "runs/breast-ct-claude-agentic-dual-domain-bilateral-n2i-search-20260703-01/iterations/iter-0005/comparison.png"}
{"ts": "2026-07-05T19:30:13Z", "run_id": "breast-ct-claude-agentic-dual-domain-bilateral-supervised-search-20260703-01", "iter": 19, "agent": "dual_domain_bilateral_supervised-claude-agentic", "model": "claude-opus-4-8-1m", "change_class": "architecture", "status": "keep", "kept": true, "val_score": 0.9835601449012756, "headroom": 0.25599568800033645, "params_M": 2.4e-05, "train_n": 400, "rationale": "dual_domain_bilateral_supervised-claude-agentic: proj_n_bf=1, img_n_bf=7, proj_kernel=3, proj_sx=0.01, proj_sy=0.3, proj_sr=0.0005, img_kernel=7, img_sx=0.5, img_sy=0.5, img_sr=0.02, epochs=10, batch_size=1, lr=0.01, optimizer=adam, lambda_neg=1.0, grad_clip=1.0, train_n=800, val_n=200, val_chunk=10, seed=48, rationale=iter-19 dual_domain_bilateral_supervised, re-split Breast-CT val=200. SIX-BOX at BEST config (img_n_bf7/img_kernel7/lr1e-2/lneg1.0/train_n800). (1) PRIOR: 6 seed replicates -- 42=0.2561,43=0.2538,44=0.2538,45=0.2564,46=0.2542,47=0.2551 -> mean~0.2549 std~0.0011. The BF optimum is highly seed-robust (~0.255 +- 0.001), in stark contrast to the sibling DD-UNet (~0.04 seed spread). (2) Failure mode: none; n=6 solid, add 2 more for n=8. (3) ONE KNOB: seed 48 (7th replicate). (4) HYPOTHESIS: seed=48 lands ~0.253-0.257; mean stays ~0.255+-0.001. (5) BUDGET: ~200s. (6) iter-20 = final 8th replicate. Artifacts saved.", "advice_for_others": "dual_domain_bilateral_supervised-claude-agentic: proj_n_bf=1, img_n_bf=7, proj_kernel=3, proj_sx=0.01, proj_sy=0.3, proj_sr=0.0005, img_kernel=7, img_sx=0.5, img_sy=0.5, img_sr=0.02, epochs=10, batch_size=1, lr=0.01, optimizer=adam, lambda_neg=1.0, grad_clip=1.0, train_n=800, val_n=200, val_chunk=10, seed=48, rationale=iter-19 dual_domain_bilateral_supervised, re-split Breast-CT val=200. SIX-BOX at BEST config (img_n_bf7/img_kernel7/lr1e-2/lneg1.0/train_n800). (1) PRIOR: 6 seed replicates -- 42=0.2561,43=0.2538,44=0.2538,45=0.2564,46=0.2542,47=0.2551 -> mean~0.2549 std~0.0011. The BF optimum is highly seed-robust (~0.255 +- 0.001), in stark contrast to the sibling DD-UNet (~0.04 seed spread). (2) Failure mode: none; n=6 solid, add 2 more for n=8. (3) ONE KNOB: seed 48 (7th replicate). (4) HYPOTHESIS: seed=48 lands ~0.253-0.257; mean stays ~0.255+-0.001. (5) BUDGET: ~200s. (6) iter-20 = final 8th replicate. Artifacts saved.", "comparison_image": "runs/breast-ct-claude-agentic-dual-domain-bilateral-supervised-search-20260703-01/iterations/iter-0019/comparison.png"}
