{"ts": "2026-07-06T20:57:02Z", "run_id": "breast-ct-claude-agentic-fastdiff-flow-pixel-unconstrained-search-20260703-01", "iter": 12, "agent": "fastdiff_flow_pixel_unconstrained-claude-agentic", "model": "claude-opus-4-8-1m", "change_class": "architecture", "status": "discard", "kept": false, "val_score": 0.8241379261016846, "headroom": 0.0, "params_M": 3.822787, "train_n": 3600, "rationale": "fastdiff_flow_pixel_unconstrained-claude-agentic: image_size=512, pixel_spacing=0.3516, n_angles=128, n_det=1024, det_spacing=0.35754, sod=500.0, sdd=1000.0, display_min=0.0, display_max=0.5, train_n=400, val_n=200, noise_i0=100000.0, noise_sigma_e=10.0, seed=42, fd_recon_ckpt=/cluster/maier/Agent4CT/checkpoints/fast_diffusion_pixel_breast.pt, fd_recon_steps=8, fd_recon_init=fbp, fd_recon_init_t=0.1, fd_recon_eta=0.1, fd_recon_dc=0, fd_recon_dc_n_cg=5, fd_recon_dc_relax=0.5, rationale=iter-12: DC-off breast-prior. Fine init_t sweep at low eta=0.1. ONE KNOB init_t 0.2->0.1. PRIOR (low-eta init_t): 0.3->28.98, 0.25->29.20, 0.2->29.58 - monotonically rising as init_t drops (at gentle eta the recon -> light prior-denoise of the FBP init). HYPOTHESIS: init_t=0.1 approaches pure minimal-noise prior-denoise of the FBP -> PSNR near its ceiling; if it saturates/turns, ~0.1-0.2 is the floor. Tests the extreme low-init_t end: as init_t->0 the sampler reduces to FBP passed through ~0 flow-time (identity-ish), so PSNR should approach but not exceed the FBP baseline (the prior can only lightly denoise, never add the missing sparse-view null-space info the DC step would).", "advice_for_others": "fastdiff_flow_pixel_unconstrained-claude-agentic: image_size=512, pixel_spacing=0.3516, n_angles=128, n_det=1024, det_spacing=0.35754, sod=500.0, sdd=1000.0, display_min=0.0, display_max=0.5, train_n=400, val_n=200, noise_i0=100000.0, noise_sigma_e=10.0, seed=42, fd_recon_ckpt=/cluster/maier/Agent4CT/checkpoints/fast_diffusion_pixel_breast.pt, fd_recon_steps=8, fd_recon_init=fbp, fd_recon_init_t=0.1, fd_recon_eta=0.1, fd_recon_dc=0, fd_recon_dc_n_cg=5, fd_recon_dc_relax=0.5, rationale=iter-12: DC-off breast-prior. Fine init_t sweep at low eta=0.1. ONE KNOB init_t 0.2->0.1. PRIOR (low-eta init_t): 0.3->28.98, 0.25->29.20, 0.2->29.58 - monotonically rising as init_t drops (at gentle eta the recon -> light prior-denoise of the FBP init). HYPOTHESIS: init_t=0.1 approaches pure minimal-noise prior-denoise of the FBP -> PSNR near its ceiling; if it saturates/turns, ~0.1-0.2 is the floor. Tests the extreme low-init_t end: as init_t->0 the sampler reduces to FBP passed through ~0 flow-time (identity-ish), so PSNR should approach but not exceed the FBP baseline (the prior can only lightly denoise, never add the missing sparse-view null-space info the DC step would).", "comparison_image": "runs/breast-ct-claude-agentic-fastdiff-flow-pixel-unconstrained-search-20260703-01/iterations/iter-0012/comparison.png"}
{"ts": "2026-07-06T20:54:51Z", "run_id": "breast-ct-claude-agentic-fastdiff-wdm-wavelet-constrained-search-20260703-01", "iter": 6, "agent": "fastdiff_wdm_wavelet_constrained-claude-agentic", "model": "claude-opus-4-8-1m", "change_class": "architecture", "status": "discard", "kept": false, "val_score": 0.6474815011024475, "headroom": 0.0, "params_M": 3.824908, "train_n": 3600, "rationale": "fastdiff_wdm_wavelet_constrained-claude-agentic: val_n=200, seed=42, fd_recon_ckpt=/cluster/maier/Agent4CT/checkpoints/fast_diffusion_wavelet_breast.pt, fd_recon_steps=8, fd_recon_init=fbp, fd_recon_init_t=0.05, fd_recon_eta=1.0, fd_recon_dc=1, fd_recon_dc_n_cg=5, fd_recon_dc_relax=1.0, dataset_kind=breast_ct, rationale=iter-6 INIT_T limit probe, breast-native wavelet CONSTRAINED, val=200. SIX-BOX: (1) PRIOR: init_t@relax1.0: 0.7->PSNR16.5, 0.4->19.4, 0.2->22.0, 0.1->25.2 (RMSE 1.88e-2). MONOTONIC toward baseline PSNR36.3/RMSE5.21e-3 as init_t->0. hr=0 throughout. (2) FAILURE MODE: the wavelet prior injects net-harmful structure; the recon improves as prior influence shrinks. (3) ONE KNOB: fd_recon_init_t 0.1 -> 0.05 (near prior-off; recon ~ light-denoised FBP + full CG-DC). (4) HYPOTHESIS: continues the trend; establishes the init_t->0 asymptote (does DC-anchored near-FBP clear the baseline, or is even the CG-DC-projected FBP below the plain Hann FBP baseline?). This localizes whether ANY init_t can clear hr>0. FALSIFIER: if PSNR plateaus below 36 as init_t->0, the DC-on wavelet recon is structurally FBP-bounded on sparse breast (the CG-DC/prior chain never beats the plain FBP baseline) -> spend remaining iters confirming via steps/n_cg then conclude. (5) BUDGET ~90s. (6) iter-7 on landing.", "advice_for_others": "fastdiff_wdm_wavelet_constrained-claude-agentic: val_n=200, seed=42, fd_recon_ckpt=/cluster/maier/Agent4CT/checkpoints/fast_diffusion_wavelet_breast.pt, fd_recon_steps=8, fd_recon_init=fbp, fd_recon_init_t=0.05, fd_recon_eta=1.0, fd_recon_dc=1, fd_recon_dc_n_cg=5, fd_recon_dc_relax=1.0, dataset_kind=breast_ct, rationale=iter-6 INIT_T limit probe, breast-native wavelet CONSTRAINED, val=200. SIX-BOX: (1) PRIOR: init_t@relax1.0: 0.7->PSNR16.5, 0.4->19.4, 0.2->22.0, 0.1->25.2 (RMSE 1.88e-2). MONOTONIC toward baseline PSNR36.3/RMSE5.21e-3 as init_t->0. hr=0 throughout. (2) FAILURE MODE: the wavelet prior injects net-harmful structure; the recon improves as prior influence shrinks. (3) ONE KNOB: fd_recon_init_t 0.1 -> 0.05 (near prior-off; recon ~ light-denoised FBP + full CG-DC). (4) HYPOTHESIS: continues the trend; establishes the init_t->0 asymptote (does DC-anchored near-FBP clear the baseline, or is even the CG-DC-projected FBP below the plain Hann FBP baseline?). This localizes whether ANY init_t can clear hr>0. FALSIFIER: if PSNR plateaus below 36 as init_t->0, the DC-on wavelet recon is structurally FBP-bounded on sparse breast (the CG-DC/prior chain never beats the plain FBP baseline) -> spend remaining iters confirming via steps/n_cg then conclude. (5) BUDGET ~90s. (6) iter-7 on landing.", "comparison_image": "runs/breast-ct-claude-agentic-fastdiff-wdm-wavelet-constrained-search-20260703-01/iterations/iter-0006/comparison.png"}
{"ts": "2026-07-06T20:53:50Z", "run_id": "breast-ct-claude-agentic-fastdiff-flow-pixel-unconstrained-search-20260703-01", "iter": 11, "agent": "fastdiff_flow_pixel_unconstrained-claude-agentic", "model": "claude-opus-4-8-1m", "change_class": "architecture", "status": "discard", "kept": false, "val_score": 0.7665520906448364, "headroom": 0.0, "params_M": 3.822787, "train_n": 3600, "rationale": "fastdiff_flow_pixel_unconstrained-claude-agentic: image_size=512, pixel_spacing=0.3516, n_angles=128, n_det=1024, det_spacing=0.35754, sod=500.0, sdd=1000.0, display_min=0.0, display_max=0.5, train_n=400, val_n=200, noise_i0=100000.0, noise_sigma_e=10.0, seed=42, fd_recon_ckpt=/cluster/maier/Agent4CT/checkpoints/fast_diffusion_pixel_breast.pt, fd_recon_steps=8, fd_recon_init=fbp, fd_recon_init_t=0.2, fd_recon_eta=0.1, fd_recon_dc=0, fd_recon_dc_n_cg=5, fd_recon_dc_relax=0.5, rationale=iter-11: DC-off breast-prior. Fine init_t sweep at low eta=0.1, steps=8. ONE KNOB init_t 0.25->0.2. PRIOR: iter-10 init_t0.25 PSNR29.20 (best) > iter-9 init_t0.3 PSNR28.98 - init_t peak still descending at low eta. HYPOTHESIS: init_t=0.2 continues toward the peak (at eta=0.1 the low-init_t degradation seen at eta=1.0/iter-3 does NOT apply since guidance is gentle); if PSNR turns down, peak is ~0.25. Completes the init_t fine-grid at the tuned operating point.", "advice_for_others": "fastdiff_flow_pixel_unconstrained-claude-agentic: image_size=512, pixel_spacing=0.3516, n_angles=128, n_det=1024, det_spacing=0.35754, sod=500.0, sdd=1000.0, display_min=0.0, display_max=0.5, train_n=400, val_n=200, noise_i0=100000.0, noise_sigma_e=10.0, seed=42, fd_recon_ckpt=/cluster/maier/Agent4CT/checkpoints/fast_diffusion_pixel_breast.pt, fd_recon_steps=8, fd_recon_init=fbp, fd_recon_init_t=0.2, fd_recon_eta=0.1, fd_recon_dc=0, fd_recon_dc_n_cg=5, fd_recon_dc_relax=0.5, rationale=iter-11: DC-off breast-prior. Fine init_t sweep at low eta=0.1, steps=8. ONE KNOB init_t 0.25->0.2. PRIOR: iter-10 init_t0.25 PSNR29.20 (best) > iter-9 init_t0.3 PSNR28.98 - init_t peak still descending at low eta. HYPOTHESIS: init_t=0.2 continues toward the peak (at eta=0.1 the low-init_t degradation seen at eta=1.0/iter-3 does NOT apply since guidance is gentle); if PSNR turns down, peak is ~0.25. Completes the init_t fine-grid at the tuned operating point.", "comparison_image": "runs/breast-ct-claude-agentic-fastdiff-flow-pixel-unconstrained-search-20260703-01/iterations/iter-0011/comparison.png"}
{"ts": "2026-07-06T20:53:04Z", "run_id": "breast-ct-claude-agentic-fastdiff-flow-pixel-constrained-search-20260703-01", "iter": 4, "agent": "fastdiff_flow_pixel_constrained-claude-agentic", "model": "claude-opus-4-8-1m", "change_class": "architecture", "status": "discard", "kept": false, "val_score": 0.9152635931968689, "headroom": 0.0, "params_M": 3.822787, "train_n": 400, "rationale": "fastdiff_flow_pixel_constrained-claude-agentic: image_size=512, pixel_spacing=0.3516, n_angles=128, n_det=1024, det_spacing=0.35754, sod=500.0, sdd=1000.0, display_min=0.0, display_max=0.5, train_n=400, val_n=200, noise_i0=100000.0, noise_sigma_e=10.0, seed=42, dataset_kind=breast_ct, fd_recon_ckpt=/cluster/maier/Agent4CT/checkpoints/fast_diffusion_pixel_breast.pt, fd_recon_steps=8, fd_recon_init=fbp, fd_recon_init_t=0.05, fd_recon_eta=1.0, fd_recon_dc=1, fd_recon_dc_n_cg=5, fd_recon_dc_relax=0.5, rationale=iter-4 EXPLORATORY single knob fd_recon_init_t 0.15->0.05 from iter-3 base. SIX-BOX: (1)PRIOR: init_t axis strongly MONOTONIC: 0.7 rmse0.0428/ssim0.427 -> 0.3 rmse0.0264/ssim0.454 -> 0.15 rmse0.0144/ssim0.676. Recon approaches the 128-view breast FBP (rmse0.00521,ssim0.920) as init_t->0. All hr=0. (2)FAILURE: recon still 2.8x FBP rmse at init_t0.15; the breast prior perturbs the near-oracle FBP rather than improving it. (3)ONE KNOB: init_t 0.15->0.05 (embed almost AT the FBP). (4)HYPOTHESIS: at init_t~0 the recon converges TO the FBP so rmse->0.00521 and hr->0 from below (equal to baseline, cannot exceed). This maps the init_t asymptote: if rmse bottoms at the FBP floor, it PROVES the sparse-view breast FBP is already near-oracle (128 views is not very sparse at this geometry) and a prior has no noise headroom to exploit -> regime-bound ceiling, distinct from the Mayo prior-mismatch cause. (5)BUDGET: minimal steps, fast. (6)Serial.", "advice_for_others": "fastdiff_flow_pixel_constrained-claude-agentic: image_size=512, pixel_spacing=0.3516, n_angles=128, n_det=1024, det_spacing=0.35754, sod=500.0, sdd=1000.0, display_min=0.0, display_max=0.5, train_n=400, val_n=200, noise_i0=100000.0, noise_sigma_e=10.0, seed=42, dataset_kind=breast_ct, fd_recon_ckpt=/cluster/maier/Agent4CT/checkpoints/fast_diffusion_pixel_breast.pt, fd_recon_steps=8, fd_recon_init=fbp, fd_recon_init_t=0.05, fd_recon_eta=1.0, fd_recon_dc=1, fd_recon_dc_n_cg=5, fd_recon_dc_relax=0.5, rationale=iter-4 EXPLORATORY single knob fd_recon_init_t 0.15->0.05 from iter-3 base. SIX-BOX: (1)PRIOR: init_t axis strongly MONOTONIC: 0.7 rmse0.0428/ssim0.427 -> 0.3 rmse0.0264/ssim0.454 -> 0.15 rmse0.0144/ssim0.676. Recon approaches the 128-view breast FBP (rmse0.00521,ssim0.920) as init_t->0. All hr=0. (2)FAILURE: recon still 2.8x FBP rmse at init_t0.15; the breast prior perturbs the near-oracle FBP rather than improving it. (3)ONE KNOB: init_t 0.15->0.05 (embed almost AT the FBP). (4)HYPOTHESIS: at init_t~0 the recon converges TO the FBP so rmse->0.00521 and hr->0 from below (equal to baseline, cannot exceed). This maps the init_t asymptote: if rmse bottoms at the FBP floor, it PROVES the sparse-view breast FBP is already near-oracle (128 views is not very sparse at this geometry) and a prior has no noise headroom to exploit -> regime-bound ceiling, distinct from the Mayo prior-mismatch cause. (5)BUDGET: minimal steps, fast. (6)Serial.", "comparison_image": "runs/breast-ct-claude-agentic-fastdiff-flow-pixel-constrained-search-20260703-01/iterations/iter-0004/comparison.png"}
{"ts": "2026-07-06T20:52:27Z", "run_id": "breast-ct-claude-agentic-fastdiff-wdm-wavelet-constrained-search-20260703-01", "iter": 5, "agent": "fastdiff_wdm_wavelet_constrained-claude-agentic", "model": "claude-opus-4-8-1m", "change_class": "architecture", "status": "discard", "kept": false, "val_score": 0.5276275277137756, "headroom": 0.0, "params_M": 3.824908, "train_n": 3600, "rationale": "fastdiff_wdm_wavelet_constrained-claude-agentic: val_n=200, seed=42, fd_recon_ckpt=/cluster/maier/Agent4CT/checkpoints/fast_diffusion_wavelet_breast.pt, fd_recon_steps=8, fd_recon_init=fbp, fd_recon_init_t=0.1, fd_recon_eta=1.0, fd_recon_dc=1, fd_recon_dc_n_cg=5, fd_recon_dc_relax=1.0, dataset_kind=breast_ct, rationale=iter-5 INIT_T lever (push lower), breast-native wavelet CONSTRAINED, val=200. SIX-BOX: (1) PRIOR: init_t sweep at relax1.0: 0.7->PSNR16.5, 0.4->19.4, 0.2->22.0, RMSE 5.12e-2->3.66e-2->2.70e-2. STRICTLY MONOTONIC: every init_t drop helps. baseline PSNR36.3/RMSE5.21e-3, hr=0 so far. (2) FAILURE MODE: even at init_t=0.2 the wavelet-prior embed still degrades the strong 128-view breast FBP; the prior is not yet a near-identity light denoiser. (3) ONE KNOB: fd_recon_init_t 0.2 -> 0.1 (FBP embedded very close to clean; prior barely perturbs it). (4) HYPOTHESIS: init_t=0.1 continues the RMSE-down trend toward the FBP floor; at very low init_t the recon approaches (light-denoised FBP -> CG-DC), which should approach or clear the baseline. FALSIFIER: if PSNR still <<36 even at init_t=0.1, the 8-step wavelet prior CANNOT match the 128-view breast FBP (it always injects net-harmful structure), meaning this DC-on wavelet variant is FBP-bounded here regardless of init_t -> pivot iters to steps/n_cg and then conclude. (5) BUDGET: ~90s/iter. (6) Loop continues; iter-6 on landing.", "advice_for_others": "fastdiff_wdm_wavelet_constrained-claude-agentic: val_n=200, seed=42, fd_recon_ckpt=/cluster/maier/Agent4CT/checkpoints/fast_diffusion_wavelet_breast.pt, fd_recon_steps=8, fd_recon_init=fbp, fd_recon_init_t=0.1, fd_recon_eta=1.0, fd_recon_dc=1, fd_recon_dc_n_cg=5, fd_recon_dc_relax=1.0, dataset_kind=breast_ct, rationale=iter-5 INIT_T lever (push lower), breast-native wavelet CONSTRAINED, val=200. SIX-BOX: (1) PRIOR: init_t sweep at relax1.0: 0.7->PSNR16.5, 0.4->19.4, 0.2->22.0, RMSE 5.12e-2->3.66e-2->2.70e-2. STRICTLY MONOTONIC: every init_t drop helps. baseline PSNR36.3/RMSE5.21e-3, hr=0 so far. (2) FAILURE MODE: even at init_t=0.2 the wavelet-prior embed still degrades the strong 128-view breast FBP; the prior is not yet a near-identity light denoiser. (3) ONE KNOB: fd_recon_init_t 0.2 -> 0.1 (FBP embedded very close to clean; prior barely perturbs it). (4) HYPOTHESIS: init_t=0.1 continues the RMSE-down trend toward the FBP floor; at very low init_t the recon approaches (light-denoised FBP -> CG-DC), which should approach or clear the baseline. FALSIFIER: if PSNR still <<36 even at init_t=0.1, the 8-step wavelet prior CANNOT match the 128-view breast FBP (it always injects net-harmful structure), meaning this DC-on wavelet variant is FBP-bounded here regardless of init_t -> pivot iters to steps/n_cg and then conclude. (5) BUDGET: ~90s/iter. (6) Loop continues; iter-6 on landing.", "comparison_image": "runs/breast-ct-claude-agentic-fastdiff-wdm-wavelet-constrained-search-20260703-01/iterations/iter-0005/comparison.png"}
{"ts": "2026-07-06T20:50:01Z", "run_id": "breast-ct-claude-agentic-fastdiff-flow-pixel-unconstrained-search-20260703-01", "iter": 10, "agent": "fastdiff_flow_pixel_unconstrained-claude-agentic", "model": "claude-opus-4-8-1m", "change_class": "architecture", "status": "discard", "kept": false, "val_score": 0.7704774141311646, "headroom": 0.0, "params_M": 3.822787, "train_n": 3600, "rationale": "fastdiff_flow_pixel_unconstrained-claude-agentic: image_size=512, pixel_spacing=0.3516, n_angles=128, n_det=1024, det_spacing=0.35754, sod=500.0, sdd=1000.0, display_min=0.0, display_max=0.5, train_n=400, val_n=200, noise_i0=100000.0, noise_sigma_e=10.0, seed=42, fd_recon_ckpt=/cluster/maier/Agent4CT/checkpoints/fast_diffusion_pixel_breast.pt, fd_recon_steps=8, fd_recon_init=fbp, fd_recon_init_t=0.25, fd_recon_eta=0.1, fd_recon_dc=0, fd_recon_dc_n_cg=5, fd_recon_dc_relax=0.5, rationale=iter-10: DC-off breast-prior. Fine init_t sweep at low eta=0.1, steps=8. ONE KNOB init_t 0.3->0.25. PRIOR: iter-9 init_t0.3 PSNR28.98 (best) > iter-7 init_t0.4 PSNR28.51 - the init_t peak at low eta is BELOW 0.4. HYPOTHESIS: init_t=0.25 edges the PSNR up further toward its peak (less injected noise, prior still has enough flow-time to denoise); if it turns DOWN, the peak is ~0.3 and I stop lowering. Brackets the init_t optimum at the tuned low-eta operating point.", "advice_for_others": "fastdiff_flow_pixel_unconstrained-claude-agentic: image_size=512, pixel_spacing=0.3516, n_angles=128, n_det=1024, det_spacing=0.35754, sod=500.0, sdd=1000.0, display_min=0.0, display_max=0.5, train_n=400, val_n=200, noise_i0=100000.0, noise_sigma_e=10.0, seed=42, fd_recon_ckpt=/cluster/maier/Agent4CT/checkpoints/fast_diffusion_pixel_breast.pt, fd_recon_steps=8, fd_recon_init=fbp, fd_recon_init_t=0.25, fd_recon_eta=0.1, fd_recon_dc=0, fd_recon_dc_n_cg=5, fd_recon_dc_relax=0.5, rationale=iter-10: DC-off breast-prior. Fine init_t sweep at low eta=0.1, steps=8. ONE KNOB init_t 0.3->0.25. PRIOR: iter-9 init_t0.3 PSNR28.98 (best) > iter-7 init_t0.4 PSNR28.51 - the init_t peak at low eta is BELOW 0.4. HYPOTHESIS: init_t=0.25 edges the PSNR up further toward its peak (less injected noise, prior still has enough flow-time to denoise); if it turns DOWN, the peak is ~0.3 and I stop lowering. Brackets the init_t optimum at the tuned low-eta operating point.", "comparison_image": "runs/breast-ct-claude-agentic-fastdiff-flow-pixel-unconstrained-search-20260703-01/iterations/iter-0010/comparison.png"}
{"ts": "2026-07-06T20:48:07Z", "run_id": "breast-ct-claude-agentic-fastdiff-flow-pixel-constrained-search-20260703-01", "iter": 3, "agent": "fastdiff_flow_pixel_constrained-claude-agentic", "model": "claude-opus-4-8-1m", "change_class": "architecture", "status": "discard", "kept": false, "val_score": 0.6764799952507019, "headroom": 0.0, "params_M": 3.822787, "train_n": 400, "rationale": "fastdiff_flow_pixel_constrained-claude-agentic: image_size=512, pixel_spacing=0.3516, n_angles=128, n_det=1024, det_spacing=0.35754, sod=500.0, sdd=1000.0, display_min=0.0, display_max=0.5, train_n=400, val_n=200, noise_i0=100000.0, noise_sigma_e=10.0, seed=42, dataset_kind=breast_ct, fd_recon_ckpt=/cluster/maier/Agent4CT/checkpoints/fast_diffusion_pixel_breast.pt, fd_recon_steps=8, fd_recon_init=fbp, fd_recon_init_t=0.15, fd_recon_eta=1.0, fd_recon_dc=1, fd_recon_dc_n_cg=5, fd_recon_dc_relax=0.5, rationale=iter-3 EXPLORATORY single knob fd_recon_init_t 0.3->0.15 from iter-2 base. SIX-BOX: (1)PRIOR: init_t axis is MONOTONIC so far: 0.7 (iter-1 rmse0.0428 psnr18.0 ssim0.427) -> 0.3 (iter-2 rmse0.0264 psnr22.2 ssim0.454). Lower init_t preserves the strong 128-view breast FBP; the breast prior at high init_t repaints/darkens (pred mean 0.036 vs truth 0.126). All hr=0 (FBP baseline rmse~0.00521 very strong). (2)FAILURE: even init_t0.3 lets the prior perturb the FBP enough to leave rmse 5x baseline. (3)ONE KNOB: init_t 0.3->0.15 (embed even closer to FBP; steps/DC/eta held). (4)HYPOTHESIS: pushing init_t toward 0 keeps the recon almost at the FBP while the prior only lightly denoises + DC re-anchors, dropping rmse further toward baseline; maps whether the init_t axis reaches hr>0 or asymptotes above the FBP floor. (5)BUDGET: fewer effective steps, fast. (6)Serial.", "advice_for_others": "fastdiff_flow_pixel_constrained-claude-agentic: image_size=512, pixel_spacing=0.3516, n_angles=128, n_det=1024, det_spacing=0.35754, sod=500.0, sdd=1000.0, display_min=0.0, display_max=0.5, train_n=400, val_n=200, noise_i0=100000.0, noise_sigma_e=10.0, seed=42, dataset_kind=breast_ct, fd_recon_ckpt=/cluster/maier/Agent4CT/checkpoints/fast_diffusion_pixel_breast.pt, fd_recon_steps=8, fd_recon_init=fbp, fd_recon_init_t=0.15, fd_recon_eta=1.0, fd_recon_dc=1, fd_recon_dc_n_cg=5, fd_recon_dc_relax=0.5, rationale=iter-3 EXPLORATORY single knob fd_recon_init_t 0.3->0.15 from iter-2 base. SIX-BOX: (1)PRIOR: init_t axis is MONOTONIC so far: 0.7 (iter-1 rmse0.0428 psnr18.0 ssim0.427) -> 0.3 (iter-2 rmse0.0264 psnr22.2 ssim0.454). Lower init_t preserves the strong 128-view breast FBP; the breast prior at high init_t repaints/darkens (pred mean 0.036 vs truth 0.126). All hr=0 (FBP baseline rmse~0.00521 very strong). (2)FAILURE: even init_t0.3 lets the prior perturb the FBP enough to leave rmse 5x baseline. (3)ONE KNOB: init_t 0.3->0.15 (embed even closer to FBP; steps/DC/eta held). (4)HYPOTHESIS: pushing init_t toward 0 keeps the recon almost at the FBP while the prior only lightly denoises + DC re-anchors, dropping rmse further toward baseline; maps whether the init_t axis reaches hr>0 or asymptotes above the FBP floor. (5)BUDGET: fewer effective steps, fast. (6)Serial.", "comparison_image": "runs/breast-ct-claude-agentic-fastdiff-flow-pixel-constrained-search-20260703-01/iterations/iter-0003/comparison.png"}
