{"ts": "2026-07-07T08:43:59Z", "run_id": "breast-ct-claude-agentic-param-efficient-search-20260703-01", "iter": 18, "agent": "param_efficient-claude-agentic", "model": "claude-opus-4-8-1m", "change_class": "architecture", "status": "keep", "kept": true, "val_score": 0.9725671410560608, "headroom": 0.45434624364226983, "params_M": 0.000183, "train_n": 200, "rationale": "param_efficient-claude-agentic: reg_type=bilateral, bilateral_on_top=False, proj_filter_on=False, n_iter=30, learnable_alpha=True, alpha_init=0.1, foe_n_filters=24, foe_kernel=7, foe_n_bumps=31, n_bf=1, bf_multiscale=True, bf_sigmas=[0.8, 1.6, 3.2], bf_kernel=7, bf_sigma_r=0.02, bf_gain_init=0.0, epochs=16, cosine_lr=True, lr=0.005, max_train_s=1080, batch_size=4, train_n=200, val_n=200, display_min=0.0, display_max=0.05, seed=43, rationale=iter-18 param_efficient breast -- SEED REPLICATE 1/4 of the CHAMPION (LPD-combine W=4, filtered-DC K=30, 183 params). SIX-BOX: (1) PRIOR: architecture search COMPLETE; champion = iter-15 (seed 42) hr 0.5047 @ 183p. Adjoint/config capped ~0.26; filtered-DC broke it (0.4345 @ 13p); prox capacity fought it (0.0); LPD learned-combination WON (0.5047); W=8 and sinogram-dual both regressed -> W=4 primal-only is the optimum. (2) FAILURE MODE: single-seed hr is noise-confounded (breast seed variance is large, ~+-0.05 per the DL-tier solvers) -- need mean+-std. (3) ONE KNOB: seed 42 -> 43 (replicate 1/4). ALL else byte-for-byte the champion. (4) HYPOTHESIS: hr lands near 0.5047 +- seed noise; the 5-seed (42-46) mean+-std is the REPORTED headline number @ 183 params. (5) BUDGET: identical to iter-15 (16ep in ~1020s), max_train_s=1080, --time=00:30:00, 200-val -> 20-min comparable. (6) SERIAL; next replicate self-dispatches; recon_raw.npz (pred/truth/baseline) saved to the iter dir for test-scorability., dc_mode=filtered, per_step_alpha=True, lpd_on=True, lpd_width=4, lpd_kernel=3, anisotropic_on_top=False", "advice_for_others": "param_efficient-claude-agentic: reg_type=bilateral, bilateral_on_top=False, proj_filter_on=False, n_iter=30, learnable_alpha=True, alpha_init=0.1, foe_n_filters=24, foe_kernel=7, foe_n_bumps=31, n_bf=1, bf_multiscale=True, bf_sigmas=[0.8, 1.6, 3.2], bf_kernel=7, bf_sigma_r=0.02, bf_gain_init=0.0, epochs=16, cosine_lr=True, lr=0.005, max_train_s=1080, batch_size=4, train_n=200, val_n=200, display_min=0.0, display_max=0.05, seed=43, rationale=iter-18 param_efficient breast -- SEED REPLICATE 1/4 of the CHAMPION (LPD-combine W=4, filtered-DC K=30, 183 params). SIX-BOX: (1) PRIOR: architecture search COMPLETE; champion = iter-15 (seed 42) hr 0.5047 @ 183p. Adjoint/config capped ~0.26; filtered-DC broke it (0.4345 @ 13p); prox capacity fought it (0.0); LPD learned-combination WON (0.5047); W=8 and sinogram-dual both regressed -> W=4 primal-only is the optimum. (2) FAILURE MODE: single-seed hr is noise-confounded (breast seed variance is large, ~+-0.05 per the DL-tier solvers) -- need mean+-std. (3) ONE KNOB: seed 42 -> 43 (replicate 1/4). ALL else byte-for-byte the champion. (4) HYPOTHESIS: hr lands near 0.5047 +- seed noise; the 5-seed (42-46) mean+-std is the REPORTED headline number @ 183 params. (5) BUDGET: identical to iter-15 (16ep in ~1020s), max_train_s=1080, --time=00:30:00, 200-val -> 20-min comparable. (6) SERIAL; next replicate self-dispatches; recon_raw.npz (pred/truth/baseline) saved to the iter dir for test-scorability., dc_mode=filtered, per_step_alpha=True, lpd_on=True, lpd_width=4, lpd_kernel=3, anisotropic_on_top=False", "comparison_image": "runs/breast-ct-claude-agentic-param-efficient-search-20260703-01/iterations/iter-0018/comparison.png"}
{"ts": "2026-07-07T07:19:01Z", "run_id": "breast-ct-claude-agentic-param-efficient-search-20260703-01", "iter": 17, "agent": "param_efficient-claude-agentic", "model": "claude-opus-4-8-1m", "change_class": "architecture", "status": "keep", "kept": true, "val_score": 0.9670956134796143, "headroom": 0.35234504499138164, "params_M": 0.000296, "train_n": 200, "rationale": "param_efficient-claude-agentic: reg_type=bilateral, bilateral_on_top=False, proj_filter_on=False, n_iter=30, learnable_alpha=True, alpha_init=0.1, foe_n_filters=24, foe_kernel=7, foe_n_bumps=31, n_bf=1, bf_multiscale=True, bf_sigmas=[0.8, 1.6, 3.2], bf_kernel=7, bf_sigma_r=0.02, bf_gain_init=0.0, epochs=16, cosine_lr=True, lr=0.005, max_train_s=1080, batch_size=4, train_n=200, val_n=200, display_min=0.0, display_max=0.05, seed=42, rationale=iter-17 param_efficient breast -- ADD SINOGRAM-SPACE DUAL term (true primal-dual, last distinct lever). SIX-BOX: (1) PRIOR: LPD learned-combination W=4 = 0.5047 @ 183p CHAMPION; W=8 (iter-16) REGRESSED to 0.4754 -> conv width saturated at W=4. The image-space LPD-combine learns the PRIMAL update but has NO dual half -- it back-projects the RAW residual (Rx-g). LPD's 0.68 uses BOTH a primal AND a learned DUAL operating in measurement space. (2) FAILURE MODE: pure image-space combination can't learn to precondition/route the residual in SINOGRAM space where sparse-view inconsistency lives. (3) ONE KNOB (architectural): lpd_dual=True -- I added a minimal DualUpdate block: a tied 2-layer 3x3 conv f(resid,h_dual)->h_dual (2->Wd=4->1, 113 params) with a persistent SINOGRAM-space dual memory h, applied to resid=Rx-g BEFORE the filtered back-projection (dc=fbp(h) uses the LEARNED dual residual). Final layer zero-init => h==resid at init => dc==fbp(resid)==iter-15 BYTE-FOR-BYTE (worst case == 0.5047, no regression). Total ~= 149(primal) + 113(dual) + 30(alpha) + 4(unused) ~= 296 params. (4) HYPOTHESIS: a learned dual that preconditions the residual in measurement space (the true primal-dual structure) lets the unroll route sparse-view inconsistency where it lives -> hr climbs past 0.5047 toward VN 0.63 / LPD 0.68, at ~296 params. (5) BUDGET: +1 tiny sinogram conv/step (sinogram is A*D ~ 128*736, similar cost to the image conv); iter-15 finished 16ep in 1020s -> expect ~14-16ep in the 1080s wall; train_n=200, --time=00:30:00, 200-val -> 20-min comparable. (6) SERIAL; iter-18: if dual helps, tune Wd / grow; if not, 0.5047 @ 183p is the honest champion -> begin final report + seed replicates for mean+-std., dc_mode=filtered, per_step_alpha=True, lpd_on=True, lpd_width=4, lpd_kernel=3, anisotropic_on_top=False, lpd_dual=True, lpd_dual_width=4", "advice_for_others": "param_efficient-claude-agentic: reg_type=bilateral, bilateral_on_top=False, proj_filter_on=False, n_iter=30, learnable_alpha=True, alpha_init=0.1, foe_n_filters=24, foe_kernel=7, foe_n_bumps=31, n_bf=1, bf_multiscale=True, bf_sigmas=[0.8, 1.6, 3.2], bf_kernel=7, bf_sigma_r=0.02, bf_gain_init=0.0, epochs=16, cosine_lr=True, lr=0.005, max_train_s=1080, batch_size=4, train_n=200, val_n=200, display_min=0.0, display_max=0.05, seed=42, rationale=iter-17 param_efficient breast -- ADD SINOGRAM-SPACE DUAL term (true primal-dual, last distinct lever). SIX-BOX: (1) PRIOR: LPD learned-combination W=4 = 0.5047 @ 183p CHAMPION; W=8 (iter-16) REGRESSED to 0.4754 -> conv width saturated at W=4. The image-space LPD-combine learns the PRIMAL update but has NO dual half -- it back-projects the RAW residual (Rx-g). LPD's 0.68 uses BOTH a primal AND a learned DUAL operating in measurement space. (2) FAILURE MODE: pure image-space combination can't learn to precondition/route the residual in SINOGRAM space where sparse-view inconsistency lives. (3) ONE KNOB (architectural): lpd_dual=True -- I added a minimal DualUpdate block: a tied 2-layer 3x3 conv f(resid,h_dual)->h_dual (2->Wd=4->1, 113 params) with a persistent SINOGRAM-space dual memory h, applied to resid=Rx-g BEFORE the filtered back-projection (dc=fbp(h) uses the LEARNED dual residual). Final layer zero-init => h==resid at init => dc==fbp(resid)==iter-15 BYTE-FOR-BYTE (worst case == 0.5047, no regression). Total ~= 149(primal) + 113(dual) + 30(alpha) + 4(unused) ~= 296 params. (4) HYPOTHESIS: a learned dual that preconditions the residual in measurement space (the true primal-dual structure) lets the unroll route sparse-view inconsistency where it lives -> hr climbs past 0.5047 toward VN 0.63 / LPD 0.68, at ~296 params. (5) BUDGET: +1 tiny sinogram conv/step (sinogram is A*D ~ 128*736, similar cost to the image conv); iter-15 finished 16ep in 1020s -> expect ~14-16ep in the 1080s wall; train_n=200, --time=00:30:00, 200-val -> 20-min comparable. (6) SERIAL; iter-18: if dual helps, tune Wd / grow; if not, 0.5047 @ 183p is the honest champion -> begin final report + seed replicates for mean+-std., dc_mode=filtered, per_step_alpha=True, lpd_on=True, lpd_width=4, lpd_kernel=3, anisotropic_on_top=False, lpd_dual=True, lpd_dual_width=4", "comparison_image": "runs/breast-ct-claude-agentic-param-efficient-search-20260703-01/iterations/iter-0017/comparison.png"}
{"ts": "2026-07-07T06:39:00Z", "run_id": "breast-ct-claude-agentic-param-efficient-search-20260703-01", "iter": 16, "agent": "param_efficient-claude-agentic", "model": "claude-opus-4-8-1m", "change_class": "architecture", "status": "keep", "kept": true, "val_score": 0.9734260439872742, "headroom": 0.47542953219661843, "params_M": 0.000331, "train_n": 200, "rationale": "param_efficient-claude-agentic: reg_type=bilateral, bilateral_on_top=False, proj_filter_on=False, n_iter=30, learnable_alpha=True, alpha_init=0.1, foe_n_filters=24, foe_kernel=7, foe_n_bumps=31, n_bf=1, bf_multiscale=True, bf_sigmas=[0.8, 1.6, 3.2], bf_kernel=7, bf_sigma_r=0.02, bf_gain_init=0.0, epochs=16, cosine_lr=True, lr=0.005, max_train_s=1080, batch_size=4, train_n=200, val_n=200, display_min=0.0, display_max=0.05, seed=42, rationale=iter-16 param_efficient breast -- GROW the LPD combination block (W 4->8). SIX-BOX: (1) PRIOR: iter-15 BREAKTHROUGH -- LPDCombine (tied conv g(x,fbp_dc,mem)->update, W=4, 183 params) hit hr 0.5047 (PSNR 42.43), beating filtered-DC's 0.4345. Ran FULL 16 epochs, loss converged 6.6e-6, per-step alpha ~0.099. Confirms: LEARNING to combine/accumulate the DC correction is the capacity that HELPS DC (unlike a prox, which fought it in iters 13-14). This is the winning direction. (2) FAILURE MODE: none at iter-15; W=4 (4 hidden channels) may bottleneck the learned-combination operator's capacity. (3) ONE KNOB: lpd_width 4 -> 8 (double the conv hidden channels). W=8 conv = 3*8*9+8 + 8*9+1 = 297 params + 30 per-step alpha + 4 unused bilat = ~331 total. All else byte-for-byte iter-15. (4) HYPOTHESIS: more channels in the learned-combination operator give it richer capacity to ROUTE/ATTENUATE the filtered-DC correction per-pixel and ACCUMULATE across the 30 steps -> hr climbs past 0.5047 toward VN 0.63, at ~331 params (still ~27x fewer than VN's 9k, ~750x fewer than LPD's 0.25M). (5) BUDGET: W=8 conv is still tiny (1 conv/step); iter-15 W=4 finished 16ep in 1020s, W=8 ~similar -> fits 16ep in the 1080s wall; train_n=200, --time=00:30:00, 200-val -> 20-min comparable. (6) SERIAL; iter-17: if W=8 helps, keep growing W or add a sinogram-space dual term; map the LPD params-vs-hr frontier., dc_mode=filtered, per_step_alpha=True, lpd_on=True, lpd_width=8, lpd_kernel=3, anisotropic_on_top=False", "advice_for_others": "param_efficient-claude-agentic: reg_type=bilateral, bilateral_on_top=False, proj_filter_on=False, n_iter=30, learnable_alpha=True, alpha_init=0.1, foe_n_filters=24, foe_kernel=7, foe_n_bumps=31, n_bf=1, bf_multiscale=True, bf_sigmas=[0.8, 1.6, 3.2], bf_kernel=7, bf_sigma_r=0.02, bf_gain_init=0.0, epochs=16, cosine_lr=True, lr=0.005, max_train_s=1080, batch_size=4, train_n=200, val_n=200, display_min=0.0, display_max=0.05, seed=42, rationale=iter-16 param_efficient breast -- GROW the LPD combination block (W 4->8). SIX-BOX: (1) PRIOR: iter-15 BREAKTHROUGH -- LPDCombine (tied conv g(x,fbp_dc,mem)->update, W=4, 183 params) hit hr 0.5047 (PSNR 42.43), beating filtered-DC's 0.4345. Ran FULL 16 epochs, loss converged 6.6e-6, per-step alpha ~0.099. Confirms: LEARNING to combine/accumulate the DC correction is the capacity that HELPS DC (unlike a prox, which fought it in iters 13-14). This is the winning direction. (2) FAILURE MODE: none at iter-15; W=4 (4 hidden channels) may bottleneck the learned-combination operator's capacity. (3) ONE KNOB: lpd_width 4 -> 8 (double the conv hidden channels). W=8 conv = 3*8*9+8 + 8*9+1 = 297 params + 30 per-step alpha + 4 unused bilat = ~331 total. All else byte-for-byte iter-15. (4) HYPOTHESIS: more channels in the learned-combination operator give it richer capacity to ROUTE/ATTENUATE the filtered-DC correction per-pixel and ACCUMULATE across the 30 steps -> hr climbs past 0.5047 toward VN 0.63, at ~331 params (still ~27x fewer than VN's 9k, ~750x fewer than LPD's 0.25M). (5) BUDGET: W=8 conv is still tiny (1 conv/step); iter-15 W=4 finished 16ep in 1020s, W=8 ~similar -> fits 16ep in the 1080s wall; train_n=200, --time=00:30:00, 200-val -> 20-min comparable. (6) SERIAL; iter-17: if W=8 helps, keep growing W or add a sinogram-space dual term; map the LPD params-vs-hr frontier., dc_mode=filtered, per_step_alpha=True, lpd_on=True, lpd_width=8, lpd_kernel=3, anisotropic_on_top=False", "comparison_image": "runs/breast-ct-claude-agentic-param-efficient-search-20260703-01/iterations/iter-0016/comparison.png"}
{"ts": "2026-07-07T06:01:23Z", "run_id": "breast-ct-claude-agentic-param-efficient-search-20260703-01", "iter": 15, "agent": "param_efficient-claude-agentic", "model": "claude-opus-4-8-1m", "change_class": "architecture", "status": "keep", "kept": true, "val_score": 0.9726505875587463, "headroom": 0.5046771229056541, "params_M": 0.000183, "train_n": 200, "rationale": "param_efficient-claude-agentic: reg_type=bilateral, bilateral_on_top=False, proj_filter_on=False, n_iter=30, learnable_alpha=True, alpha_init=0.1, foe_n_filters=24, foe_kernel=7, foe_n_bumps=31, n_bf=1, bf_multiscale=True, bf_sigmas=[0.8, 1.6, 3.2], bf_kernel=7, bf_sigma_r=0.02, bf_gain_init=0.0, epochs=16, cosine_lr=True, lr=0.005, max_train_s=1080, batch_size=4, train_n=200, val_n=200, display_min=0.0, display_max=0.05, seed=42, rationale=iter-15 param_efficient breast -- LPD-STYLE LEARNED DUAL/COMBINATION block (last distinct arch lever, solver edit, 20-min budget). SIX-BOX: (1) PRIOR: filtered-DC K=30 = 20-min CHAMPION 0.4345 @ 13p. Added PROX capacity does NOT help it: iter-13 (isotropic FoE +300p) hr 0.0, iter-14 (directional aniso +3p) hr 0.0 -- both FIGHT the filtered gradient because fbp(Rx-g) already does the reconstruction, leaving nothing for a prox to add. So the remaining lever is not a better PROX but a better way to COMBINE the DC correction across steps -- LPD's mechanism (0.68 on breast). (2) FAILURE MODE: the fixed x<-x-alpha*fbp(resid) update applies the SAME correction rule every step; it cannot learn to weight/route the correction using image context or cross-step memory. (3) ONE KNOB (architectural): lpd_on=True -- I added a minimal LPDCombine block: a weight-tied 2-layer 3x3 conv g(x, fbp_dc, mem)->update (3->W=4->1, 149 params) with a 1-ch primal MEMORY carried across the 30 steps; final layer ZERO-INIT => update==0 at init => x stays at the FBP init (safe seed, already clears baseline). per_step_alpha=True (the K alphas now scale the LEARNED update per step -- a real role, not the collapsed scalars of iter-7). Total ~= 149 (conv) + 30 (per-step alpha) + 12 (bilateral, UNUSED in LPD path) ~= 190 trainable. (4) HYPOTHESIS: a tiny learned operator that COMBINES the filtered-DC correction with image context + cross-step memory (LPD's mechanism) breaks past 0.4345 toward the LPD/VN regime, because it learns HOW to apply consistency (route/attenuate per-pixel + accumulate) rather than a fixed step -- the capacity that helps DC, unlike a prox smoother. (5) BUDGET: K=30 filtered + 1 tiny conv/step + 1 fbp/step, train_n=200, max_train_s=1080, --time=00:30:00, 200-val -> 20-min comparable. (6) SERIAL; iter-16: if LPD beats 0.4345, grow W / tune; if not, 0.4345 @ 13p is the honest comparable champion -> CONSOLIDATE the final report (Pareto + filtered-vs-adjoint-DC + capacity-doesnt-help-filtered-DC findings)., dc_mode=filtered, per_step_alpha=True, lpd_on=True, lpd_width=4, lpd_kernel=3, anisotropic_on_top=False", "advice_for_others": "param_efficient-claude-agentic: reg_type=bilateral, bilateral_on_top=False, proj_filter_on=False, n_iter=30, learnable_alpha=True, alpha_init=0.1, foe_n_filters=24, foe_kernel=7, foe_n_bumps=31, n_bf=1, bf_multiscale=True, bf_sigmas=[0.8, 1.6, 3.2], bf_kernel=7, bf_sigma_r=0.02, bf_gain_init=0.0, epochs=16, cosine_lr=True, lr=0.005, max_train_s=1080, batch_size=4, train_n=200, val_n=200, display_min=0.0, display_max=0.05, seed=42, rationale=iter-15 param_efficient breast -- LPD-STYLE LEARNED DUAL/COMBINATION block (last distinct arch lever, solver edit, 20-min budget). SIX-BOX: (1) PRIOR: filtered-DC K=30 = 20-min CHAMPION 0.4345 @ 13p. Added PROX capacity does NOT help it: iter-13 (isotropic FoE +300p) hr 0.0, iter-14 (directional aniso +3p) hr 0.0 -- both FIGHT the filtered gradient because fbp(Rx-g) already does the reconstruction, leaving nothing for a prox to add. So the remaining lever is not a better PROX but a better way to COMBINE the DC correction across steps -- LPD's mechanism (0.68 on breast). (2) FAILURE MODE: the fixed x<-x-alpha*fbp(resid) update applies the SAME correction rule every step; it cannot learn to weight/route the correction using image context or cross-step memory. (3) ONE KNOB (architectural): lpd_on=True -- I added a minimal LPDCombine block: a weight-tied 2-layer 3x3 conv g(x, fbp_dc, mem)->update (3->W=4->1, 149 params) with a 1-ch primal MEMORY carried across the 30 steps; final layer ZERO-INIT => update==0 at init => x stays at the FBP init (safe seed, already clears baseline). per_step_alpha=True (the K alphas now scale the LEARNED update per step -- a real role, not the collapsed scalars of iter-7). Total ~= 149 (conv) + 30 (per-step alpha) + 12 (bilateral, UNUSED in LPD path) ~= 190 trainable. (4) HYPOTHESIS: a tiny learned operator that COMBINES the filtered-DC correction with image context + cross-step memory (LPD's mechanism) breaks past 0.4345 toward the LPD/VN regime, because it learns HOW to apply consistency (route/attenuate per-pixel + accumulate) rather than a fixed step -- the capacity that helps DC, unlike a prox smoother. (5) BUDGET: K=30 filtered + 1 tiny conv/step + 1 fbp/step, train_n=200, max_train_s=1080, --time=00:30:00, 200-val -> 20-min comparable. (6) SERIAL; iter-16: if LPD beats 0.4345, grow W / tune; if not, 0.4345 @ 13p is the honest comparable champion -> CONSOLIDATE the final report (Pareto + filtered-vs-adjoint-DC + capacity-doesnt-help-filtered-DC findings)., dc_mode=filtered, per_step_alpha=True, lpd_on=True, lpd_width=4, lpd_kernel=3, anisotropic_on_top=False", "comparison_image": "runs/breast-ct-claude-agentic-param-efficient-search-20260703-01/iterations/iter-0015/comparison.png"}
