{"ts": "2026-07-07T04:14:33Z", "run_id": "breast-ct-claude-agentic-fastdiff-wdm-wavelet-unconstrained-search-20260703-01", "iter": 13, "agent": "fastdiff_wdm_wavelet_unconstrained-claude-agentic", "model": "claude-opus-4-8-1m", "change_class": "architecture", "status": "discard", "kept": false, "val_score": 0.9251366853713989, "headroom": 0.0, "params_M": 3.824908, "train_n": 3600, "rationale": "fastdiff_wdm_wavelet_unconstrained-claude-agentic: val_n=200, seed=42, fd_recon_ckpt=/cluster/maier/Agent4CT/checkpoints/fast_diffusion_wavelet_breast.pt, fd_recon_steps=4, fd_recon_init=fbp, fd_recon_init_t=0.45, fd_recon_eta=0.0, fd_recon_dc=0, fd_recon_dc_n_cg=5, fd_recon_dc_relax=0.5, dataset_kind=breast_ct, rationale=iter-13 STEPS=4 efficiency, breast-native wdm-wavelet UNCONSTRAINED (DC OFF). SIX-BOX: (1) PRIOR: init_t optimum at eta=0 is a FLAT minimum ~t0.45-0.5 (t0.45 rmse0.01128, t0.5 0.01130, t0.6 0.01160). steps 8=16. Best t0.45 eta0 steps8. All hr=0; DC-off floor ~0.0113. (2) Failure mode: prior ceiling, not NFE. (3) ONE KNOB: fd_recon_steps 8->4 at t0.45 eta0. (4) HYPOTHESIS: 4 steps ~= 8 steps rmse (since 16=8) -> confirms even 4 NFE suffices for the DC-off prior-denoise; if slightly worse, 8 is the min. Documents the NFE floor. (5) BUDGET: <5min. (6) Loop continues -- iters 14-20 = eta fine + seed variance at best config for mean+/-std.", "advice_for_others": "fastdiff_wdm_wavelet_unconstrained-claude-agentic: val_n=200, seed=42, fd_recon_ckpt=/cluster/maier/Agent4CT/checkpoints/fast_diffusion_wavelet_breast.pt, fd_recon_steps=4, fd_recon_init=fbp, fd_recon_init_t=0.45, fd_recon_eta=0.0, fd_recon_dc=0, fd_recon_dc_n_cg=5, fd_recon_dc_relax=0.5, dataset_kind=breast_ct, rationale=iter-13 STEPS=4 efficiency, breast-native wdm-wavelet UNCONSTRAINED (DC OFF). SIX-BOX: (1) PRIOR: init_t optimum at eta=0 is a FLAT minimum ~t0.45-0.5 (t0.45 rmse0.01128, t0.5 0.01130, t0.6 0.01160). steps 8=16. Best t0.45 eta0 steps8. All hr=0; DC-off floor ~0.0113. (2) Failure mode: prior ceiling, not NFE. (3) ONE KNOB: fd_recon_steps 8->4 at t0.45 eta0. (4) HYPOTHESIS: 4 steps ~= 8 steps rmse (since 16=8) -> confirms even 4 NFE suffices for the DC-off prior-denoise; if slightly worse, 8 is the min. Documents the NFE floor. (5) BUDGET: <5min. (6) Loop continues -- iters 14-20 = eta fine + seed variance at best config for mean+/-std.", "comparison_image": "runs/breast-ct-claude-agentic-fastdiff-wdm-wavelet-unconstrained-search-20260703-01/iterations/iter-0013/comparison.png"}
{"ts": "2026-07-07T03:55:17Z", "run_id": "breast-ct-claude-agentic-param-efficient-search-20260703-01", "iter": 12, "agent": "param_efficient-claude-agentic", "model": "claude-opus-4-8-1m", "change_class": "architecture", "status": "keep", "kept": true, "val_score": 0.9689271450042725, "headroom": 0.36780078282923223, "params_M": 1.3e-05, "train_n": 200, "rationale": "param_efficient-claude-agentic: reg_type=bilateral, bilateral_on_top=False, proj_filter_on=False, n_iter=40, learnable_alpha=True, alpha_init=0.1, foe_n_filters=24, foe_kernel=7, foe_n_bumps=31, n_bf=3, bf_multiscale=True, bf_sigmas=[0.8, 1.6, 3.2], bf_kernel=7, bf_sigma_r=0.02, bf_gain_init=0.0, epochs=16, cosine_lr=True, lr=0.005, max_train_s=2400, batch_size=4, train_n=200, val_n=200, display_min=0.0, display_max=0.05, seed=42, rationale=iter-12 param_efficient breast -- DEEP-K FRONTIER PROBE (decouple depth from undertraining). SIX-BOX: (1) PRIOR: filtered-DC depth is STILL climbing, NOT saturated: K10 0.3352(16ep) -> K20 0.3774(9ep) -> K30 0.4345(6ep), 13 params throughout. But the 1080s wall now cuts K30 at only 6 epochs, so the epochs-vs-wall confound is SEVERE -- each deeper K trains LESS, muddying whether hr would be even higher if trained fully. (2) FAILURE MODE: undertraining masks the true deep-K hr. (3) ONE KNOB (intent = depth at FULL training): n_iter 30->40 AND max_train_s 1080->2400 so the run reaches all 16 epochs -- this DECOUPLES depth from the wall confound. Coordinator explicitly authorized a higher --time for the deep-K frontier probes (this is the finale, not a routine search iter). sbatch --time raised to 00:50:00 to match. Still 13 params. (4) HYPOTHESIS: at K=40 trained to FULL 16 epochs, hr climbs clearly past K30's 0.4345 -- and this run also tells me the TRUE achievable hr of the filtered-DC compact when NOT undertrained, so I can then re-baseline the K-sweep. If K=40-fully-trained only matches K30-undertrained, depth has saturated ~K30 and the next lever is STACKING capacity. (5) BUDGET: DELIBERATE EXCEPTION -- K=40 x 16 epochs, max_train_s=2400 (~40min train) + 200-val, sbatch --time=00:50:00. Justified: frontier finale, decouples the depth signal. (6) SERIAL; iter-13 self-dispatches (next: re-fix the epochs-normalised best-K, then STACK FoE capacity + directional streak-reg on the filtered-DC unroll toward VN 0.63)., dc_mode=filtered, per_step_alpha=False", "advice_for_others": "param_efficient-claude-agentic: reg_type=bilateral, bilateral_on_top=False, proj_filter_on=False, n_iter=40, learnable_alpha=True, alpha_init=0.1, foe_n_filters=24, foe_kernel=7, foe_n_bumps=31, n_bf=3, bf_multiscale=True, bf_sigmas=[0.8, 1.6, 3.2], bf_kernel=7, bf_sigma_r=0.02, bf_gain_init=0.0, epochs=16, cosine_lr=True, lr=0.005, max_train_s=2400, batch_size=4, train_n=200, val_n=200, display_min=0.0, display_max=0.05, seed=42, rationale=iter-12 param_efficient breast -- DEEP-K FRONTIER PROBE (decouple depth from undertraining). SIX-BOX: (1) PRIOR: filtered-DC depth is STILL climbing, NOT saturated: K10 0.3352(16ep) -> K20 0.3774(9ep) -> K30 0.4345(6ep), 13 params throughout. But the 1080s wall now cuts K30 at only 6 epochs, so the epochs-vs-wall confound is SEVERE -- each deeper K trains LESS, muddying whether hr would be even higher if trained fully. (2) FAILURE MODE: undertraining masks the true deep-K hr. (3) ONE KNOB (intent = depth at FULL training): n_iter 30->40 AND max_train_s 1080->2400 so the run reaches all 16 epochs -- this DECOUPLES depth from the wall confound. Coordinator explicitly authorized a higher --time for the deep-K frontier probes (this is the finale, not a routine search iter). sbatch --time raised to 00:50:00 to match. Still 13 params. (4) HYPOTHESIS: at K=40 trained to FULL 16 epochs, hr climbs clearly past K30's 0.4345 -- and this run also tells me the TRUE achievable hr of the filtered-DC compact when NOT undertrained, so I can then re-baseline the K-sweep. If K=40-fully-trained only matches K30-undertrained, depth has saturated ~K30 and the next lever is STACKING capacity. (5) BUDGET: DELIBERATE EXCEPTION -- K=40 x 16 epochs, max_train_s=2400 (~40min train) + 200-val, sbatch --time=00:50:00. Justified: frontier finale, decouples the depth signal. (6) SERIAL; iter-13 self-dispatches (next: re-fix the epochs-normalised best-K, then STACK FoE capacity + directional streak-reg on the filtered-DC unroll toward VN 0.63)., dc_mode=filtered, per_step_alpha=False", "comparison_image": "runs/breast-ct-claude-agentic-param-efficient-search-20260703-01/iterations/iter-0012/comparison.png"}
{"ts": "2026-07-07T03:11:37Z", "run_id": "breast-ct-claude-agentic-fastdiff-wdm-wavelet-unconstrained-search-20260703-01", "iter": 12, "agent": "fastdiff_wdm_wavelet_unconstrained-claude-agentic", "model": "claude-opus-4-8-1m", "change_class": "architecture", "status": "discard", "kept": false, "val_score": 0.937083899974823, "headroom": 0.0, "params_M": 3.824908, "train_n": 3600, "rationale": "fastdiff_wdm_wavelet_unconstrained-claude-agentic: val_n=200, seed=42, fd_recon_ckpt=/cluster/maier/Agent4CT/checkpoints/fast_diffusion_wavelet_breast.pt, fd_recon_steps=8, fd_recon_init=fbp, fd_recon_init_t=0.45, fd_recon_eta=0.0, fd_recon_dc=0, fd_recon_dc_n_cg=5, fd_recon_dc_relax=0.5, dataset_kind=breast_ct, rationale=iter-12 INIT_T 0.45 bracket at eta=0, breast-native wdm-wavelet UNCONSTRAINED (DC OFF). SIX-BOX: (1) PRIOR: at eta=0 init_t: 0.5 rmse0.01130 (BEST), 0.6 rmse0.01160 (worse). Bracket the low side. All hr=0. (2) Failure mode: prior-denoise plateau ~0.0113. (3) ONE KNOB: fd_recon_init_t 0.5->0.45 at eta=0.0 steps=8. (4) HYPOTHESIS: t=0.45 rmse >= t=0.5 (confirming 0.5 optimum) or marginally < (refining it). Pins the eta=0 init_t optimum for the final seed-variance config. (5) BUDGET: <5min. (6) Loop continues.", "advice_for_others": "fastdiff_wdm_wavelet_unconstrained-claude-agentic: val_n=200, seed=42, fd_recon_ckpt=/cluster/maier/Agent4CT/checkpoints/fast_diffusion_wavelet_breast.pt, fd_recon_steps=8, fd_recon_init=fbp, fd_recon_init_t=0.45, fd_recon_eta=0.0, fd_recon_dc=0, fd_recon_dc_n_cg=5, fd_recon_dc_relax=0.5, dataset_kind=breast_ct, rationale=iter-12 INIT_T 0.45 bracket at eta=0, breast-native wdm-wavelet UNCONSTRAINED (DC OFF). SIX-BOX: (1) PRIOR: at eta=0 init_t: 0.5 rmse0.01130 (BEST), 0.6 rmse0.01160 (worse). Bracket the low side. All hr=0. (2) Failure mode: prior-denoise plateau ~0.0113. (3) ONE KNOB: fd_recon_init_t 0.5->0.45 at eta=0.0 steps=8. (4) HYPOTHESIS: t=0.45 rmse >= t=0.5 (confirming 0.5 optimum) or marginally < (refining it). Pins the eta=0 init_t optimum for the final seed-variance config. (5) BUDGET: <5min. (6) Loop continues.", "comparison_image": "runs/breast-ct-claude-agentic-fastdiff-wdm-wavelet-unconstrained-search-20260703-01/iterations/iter-0012/comparison.png"}
{"ts": "2026-07-07T02:51:27Z", "run_id": "breast-ct-claude-agentic-param-efficient-search-20260703-01", "iter": 11, "agent": "param_efficient-claude-agentic", "model": "claude-opus-4-8-1m", "change_class": "architecture", "status": "keep", "kept": true, "val_score": 0.9730863571166992, "headroom": 0.43447393005762225, "params_M": 1.3e-05, "train_n": 200, "rationale": "param_efficient-claude-agentic: reg_type=bilateral, bilateral_on_top=False, proj_filter_on=False, n_iter=30, learnable_alpha=True, alpha_init=0.1, foe_n_filters=24, foe_kernel=7, foe_n_bumps=31, n_bf=3, bf_multiscale=True, bf_sigmas=[0.8, 1.6, 3.2], bf_kernel=7, bf_sigma_r=0.02, bf_gain_init=0.0, epochs=16, cosine_lr=True, lr=0.005, max_train_s=1080, batch_size=4, train_n=200, val_n=200, display_min=0.0, display_max=0.05, seed=42, rationale=iter-11 param_efficient breast -- FILTERED-DC DEPTH SWEEP to saturation. SIX-BOX: (1) PRIOR: filtered-DC depth is MONOTONIC: K10 hr 0.3352 (16 epochs) -> K20 hr 0.3774 (only 9 epochs, wall-cut). So depth climbed +0.042 DESPITE fewer epochs -- depth's benefit OUTWEIGHS the undertraining cost. 13 params throughout. (2) FAILURE MODE: none yet; find where filtered-DC depth saturates vs the epochs-vs-wall tradeoff (K20 already down to 9 epochs; K30 will be ~6). (3) ONE KNOB: n_iter 20 -> 30. Still 13 params (weight-tied). All else byte-for-byte iter-10. (4) HYPOTHESIS: if filtered depth still dominates, K=30 climbs past 0.377 even at ~6 epochs -> keep pushing; if it FLATTENS or DROPS, K~20-30 is the practical saturation under the 1080s wall and the next lever is STACKING capacity (FoE / streak-reg) on the best-K filtered-DC unroll, NOT more depth. Either outcome maps the frontier. (5) BUDGET: K=30 filtered (1 fbp/step), train_n=200, 1080s backstop + 200-val -> <20min (backstop guarantees). (6) SERIAL; iter-12 self-dispatches (next: if saturated, re-fix best-K and STACK FoE capacity on the filtered-DC unroll -- reg_type foe + bilateral_on_top -- to climb toward VN 0.63 at minimal added params)., dc_mode=filtered, per_step_alpha=False", "advice_for_others": "param_efficient-claude-agentic: reg_type=bilateral, bilateral_on_top=False, proj_filter_on=False, n_iter=30, learnable_alpha=True, alpha_init=0.1, foe_n_filters=24, foe_kernel=7, foe_n_bumps=31, n_bf=3, bf_multiscale=True, bf_sigmas=[0.8, 1.6, 3.2], bf_kernel=7, bf_sigma_r=0.02, bf_gain_init=0.0, epochs=16, cosine_lr=True, lr=0.005, max_train_s=1080, batch_size=4, train_n=200, val_n=200, display_min=0.0, display_max=0.05, seed=42, rationale=iter-11 param_efficient breast -- FILTERED-DC DEPTH SWEEP to saturation. SIX-BOX: (1) PRIOR: filtered-DC depth is MONOTONIC: K10 hr 0.3352 (16 epochs) -> K20 hr 0.3774 (only 9 epochs, wall-cut). So depth climbed +0.042 DESPITE fewer epochs -- depth's benefit OUTWEIGHS the undertraining cost. 13 params throughout. (2) FAILURE MODE: none yet; find where filtered-DC depth saturates vs the epochs-vs-wall tradeoff (K20 already down to 9 epochs; K30 will be ~6). (3) ONE KNOB: n_iter 20 -> 30. Still 13 params (weight-tied). All else byte-for-byte iter-10. (4) HYPOTHESIS: if filtered depth still dominates, K=30 climbs past 0.377 even at ~6 epochs -> keep pushing; if it FLATTENS or DROPS, K~20-30 is the practical saturation under the 1080s wall and the next lever is STACKING capacity (FoE / streak-reg) on the best-K filtered-DC unroll, NOT more depth. Either outcome maps the frontier. (5) BUDGET: K=30 filtered (1 fbp/step), train_n=200, 1080s backstop + 200-val -> <20min (backstop guarantees). (6) SERIAL; iter-12 self-dispatches (next: if saturated, re-fix best-K and STACK FoE capacity on the filtered-DC unroll -- reg_type foe + bilateral_on_top -- to climb toward VN 0.63 at minimal added params)., dc_mode=filtered, per_step_alpha=False", "comparison_image": "runs/breast-ct-claude-agentic-param-efficient-search-20260703-01/iterations/iter-0011/comparison.png"}
{"ts": "2026-07-07T02:31:58Z", "run_id": "breast-ct-claude-agentic-fastdiff-wdm-wavelet-unconstrained-search-20260703-01", "iter": 11, "agent": "fastdiff_wdm_wavelet_unconstrained-claude-agentic", "model": "claude-opus-4-8-1m", "change_class": "architecture", "status": "discard", "kept": false, "val_score": 0.9376330375671387, "headroom": 0.0, "params_M": 3.824908, "train_n": 3600, "rationale": "fastdiff_wdm_wavelet_unconstrained-claude-agentic: val_n=200, seed=42, fd_recon_ckpt=/cluster/maier/Agent4CT/checkpoints/fast_diffusion_wavelet_breast.pt, fd_recon_steps=8, fd_recon_init=fbp, fd_recon_init_t=0.6, fd_recon_eta=0.0, fd_recon_dc=0, fd_recon_dc_n_cg=5, fd_recon_dc_relax=0.5, dataset_kind=breast_ct, rationale=iter-11 INIT_T fine 0.6, breast-native wdm-wavelet UNCONSTRAINED (DC OFF). SIX-BOX: (1) PRIOR: init=noise (iter-10) rmse0.04186 (unconditional prior draws wrong breast) confirms FBP warm-start is essential; best remains fbp t=0.5 eta=0.0 steps=8 rmse0.01130. All hr=0. (2) Failure mode: fbp-init recons plateau ~0.0113; init_t minimum bracketed by t=0.4(0.01429) and t=0.5(0.01360@eta1) but eta now 0 -- re-probe the init_t minimum at eta=0. (3) ONE KNOB: fd_recon_init_t 0.5->0.6 at eta=0.0 steps=8. (4) HYPOTHESIS: at eta=0 the optimal init_t may shift (no DPS to fight prior drift); t=0.6 lets the prior denoise slightly more. If rmse rises vs t=0.5, 0.5 is the eta=0 optimum. (5) BUDGET: <5min. (6) Loop continues.", "advice_for_others": "fastdiff_wdm_wavelet_unconstrained-claude-agentic: val_n=200, seed=42, fd_recon_ckpt=/cluster/maier/Agent4CT/checkpoints/fast_diffusion_wavelet_breast.pt, fd_recon_steps=8, fd_recon_init=fbp, fd_recon_init_t=0.6, fd_recon_eta=0.0, fd_recon_dc=0, fd_recon_dc_n_cg=5, fd_recon_dc_relax=0.5, dataset_kind=breast_ct, rationale=iter-11 INIT_T fine 0.6, breast-native wdm-wavelet UNCONSTRAINED (DC OFF). SIX-BOX: (1) PRIOR: init=noise (iter-10) rmse0.04186 (unconditional prior draws wrong breast) confirms FBP warm-start is essential; best remains fbp t=0.5 eta=0.0 steps=8 rmse0.01130. All hr=0. (2) Failure mode: fbp-init recons plateau ~0.0113; init_t minimum bracketed by t=0.4(0.01429) and t=0.5(0.01360@eta1) but eta now 0 -- re-probe the init_t minimum at eta=0. (3) ONE KNOB: fd_recon_init_t 0.5->0.6 at eta=0.0 steps=8. (4) HYPOTHESIS: at eta=0 the optimal init_t may shift (no DPS to fight prior drift); t=0.6 lets the prior denoise slightly more. If rmse rises vs t=0.5, 0.5 is the eta=0 optimum. (5) BUDGET: <5min. (6) Loop continues.", "comparison_image": "runs/breast-ct-claude-agentic-fastdiff-wdm-wavelet-unconstrained-search-20260703-01/iterations/iter-0011/comparison.png"}
{"ts": "2026-07-07T02:11:33Z", "run_id": "breast-ct-claude-agentic-param-efficient-search-20260703-01", "iter": 10, "agent": "param_efficient-claude-agentic", "model": "claude-opus-4-8-1m", "change_class": "architecture", "status": "keep", "kept": true, "val_score": 0.9710058569908142, "headroom": 0.37736087652440187, "params_M": 1.3e-05, "train_n": 200, "rationale": "param_efficient-claude-agentic: reg_type=bilateral, bilateral_on_top=False, proj_filter_on=False, n_iter=20, learnable_alpha=True, alpha_init=0.1, foe_n_filters=24, foe_kernel=7, foe_n_bumps=31, n_bf=3, bf_multiscale=True, bf_sigmas=[0.8, 1.6, 3.2], bf_kernel=7, bf_sigma_r=0.02, bf_gain_init=0.0, epochs=16, cosine_lr=True, lr=0.005, max_train_s=1080, batch_size=4, train_n=200, val_n=200, display_min=0.0, display_max=0.05, seed=42, rationale=iter-10 param_efficient breast -- FILTERED-DC DEPTH SWEEP. SIX-BOX: (1) PRIOR: iter-9 BREAKTHROUGH -- dc_mode=filtered (fbp(Rx-g)) at K=10 on the 13-param bilateral prox gave hr 0.3352 (PSNR 39.87), SHATTERING the ~0.26 image-domain ceiling that 8 adjoint iters couldn't pass. Confirms the raw-adjoint streak-smearing WAS the architectural ceiling. iter-6 (ADJOINT K=20) gave hr 0.0 -- depth HURT. (2) FAILURE MODE addressed: none at iter-9; goal is to find where filtered-DC depth saturates. (3) ONE KNOB: n_iter 10 -> 20 (double the filtered-DC depth). Still 13 params (weight-tied). All else byte-for-byte iter-9. (4) HYPOTHESIS: because the ramp-filtered correction reconstructs the residual properly (no streak smearing), MORE filtered-DC steps drive Rx->g further and REMOVE more streaks -> hr climbs past 0.335 (the OPPOSITE of iter-6's adjoint K=20 collapse). This directly tests whether filtered depth is monotonic. Risk: K=20 halves epochs in the 1080s wall (iter-9 K10 finished 16ep in 990s; K20 ~ 8-9ep), so undertraining could cap the gain -- if hr>0.335 but epochs<10, iter-11 will re-run best-K at higher train budget. (5) BUDGET: K=20 filtered (1 fbp/step), train_n=200, 1080s backstop + 200-val -> <20min. (6) SERIAL; iter-11 self-dispatches (next: if depth helps, push K further or add FoE capacity on the filtered-DC unroll to trace params-vs-hr toward VN 0.63)., dc_mode=filtered, per_step_alpha=False", "advice_for_others": "param_efficient-claude-agentic: reg_type=bilateral, bilateral_on_top=False, proj_filter_on=False, n_iter=20, learnable_alpha=True, alpha_init=0.1, foe_n_filters=24, foe_kernel=7, foe_n_bumps=31, n_bf=3, bf_multiscale=True, bf_sigmas=[0.8, 1.6, 3.2], bf_kernel=7, bf_sigma_r=0.02, bf_gain_init=0.0, epochs=16, cosine_lr=True, lr=0.005, max_train_s=1080, batch_size=4, train_n=200, val_n=200, display_min=0.0, display_max=0.05, seed=42, rationale=iter-10 param_efficient breast -- FILTERED-DC DEPTH SWEEP. SIX-BOX: (1) PRIOR: iter-9 BREAKTHROUGH -- dc_mode=filtered (fbp(Rx-g)) at K=10 on the 13-param bilateral prox gave hr 0.3352 (PSNR 39.87), SHATTERING the ~0.26 image-domain ceiling that 8 adjoint iters couldn't pass. Confirms the raw-adjoint streak-smearing WAS the architectural ceiling. iter-6 (ADJOINT K=20) gave hr 0.0 -- depth HURT. (2) FAILURE MODE addressed: none at iter-9; goal is to find where filtered-DC depth saturates. (3) ONE KNOB: n_iter 10 -> 20 (double the filtered-DC depth). Still 13 params (weight-tied). All else byte-for-byte iter-9. (4) HYPOTHESIS: because the ramp-filtered correction reconstructs the residual properly (no streak smearing), MORE filtered-DC steps drive Rx->g further and REMOVE more streaks -> hr climbs past 0.335 (the OPPOSITE of iter-6's adjoint K=20 collapse). This directly tests whether filtered depth is monotonic. Risk: K=20 halves epochs in the 1080s wall (iter-9 K10 finished 16ep in 990s; K20 ~ 8-9ep), so undertraining could cap the gain -- if hr>0.335 but epochs<10, iter-11 will re-run best-K at higher train budget. (5) BUDGET: K=20 filtered (1 fbp/step), train_n=200, 1080s backstop + 200-val -> <20min. (6) SERIAL; iter-11 self-dispatches (next: if depth helps, push K further or add FoE capacity on the filtered-DC unroll to trace params-vs-hr toward VN 0.63)., dc_mode=filtered, per_step_alpha=False", "comparison_image": "runs/breast-ct-claude-agentic-param-efficient-search-20260703-01/iterations/iter-0010/comparison.png"}
