{"ts": "2026-07-06T14:46:04Z", "run_id": "breast-ct-claude-agentic-param-efficient-search-20260703-01", "iter": 1, "agent": "param_efficient-claude-agentic", "model": "claude-opus-4-8-1m", "change_class": "architecture", "status": "keep", "kept": true, "val_score": 0.987461507320404, "headroom": 0.263540794362072, "params_M": 0.001933, "train_n": 800, "rationale": "param_efficient-claude-agentic: reg_type=foe, bilateral_on_top=True, proj_filter_on=False, n_iter=5, learnable_alpha=True, alpha_init=0.1, foe_n_filters=24, foe_kernel=7, foe_n_bumps=31, n_bf=3, bf_multiscale=True, bf_sigmas=[0.8, 1.6, 3.2], bf_kernel=7, bf_sigma_r=0.02, bf_gain_init=0.0, epochs=16, cosine_lr=True, lr=0.005, max_train_s=1080, batch_size=4, train_n=800, val_n=200, display_min=0.0, display_max=0.05, seed=42, rationale=iter-1 ONBOARDING of param_efficient (FoE unrolled prox-gradient + DC, K=5, + multi-RF PARALLEL bilateral bank, zero-init gains) on the re-split Breast-CT (train 3600/val 200/test 200, seed 20260703; 128-view SPARSE). 1,932 reg params. SIX-BOX: (1) PRIOR: none (first iter); cross-solver evidence: DL tier (ItNet/DD-UNet) plateaus val hr ~0.88 at 0.23-0.47M params; the FoE param-efficient recombination targets that hr at ~1.9k params (~200x fewer). (2) FAILURE MODE: N/A onboarding; goal = does the Mayo-evolved FoE+bilateral seed RUN on breast 128-view 512^2 and clear the sparse-view FBP baseline (hr>0). (3) ONE KNOB: N/A baseline seed = Mayo iter-25/27 champion arch (FoE nf24/k7 + M=3 bilateral bank ON TOP), proj-filter OFF (turned on later as the sparse-view lever). (4) HYPOTHESIS: FoE+bilateral (1,932 params, K=5 DC unroll, FBP warm-start) clears breast FBP (hr>0) and lands hr ~0.4-0.6 in one 18-min run, because unrolled data-consistency is the strong-performer trait on breast and the FBP init leaves large sparse-view headroom -- but 200x fewer params than the DL tier means it will START well below 0.88 and the projection-domain + anisotropic streak levers (dormant here) are the sparse-view-specific gains to add next. (5) BUDGET: train_n=800 x FoE K=5 unroll at 512^2, bs=4, hard max_train_s=1080 backstop + 200-slice val pass; breast uses ONE shared PYRO-NN projector (no per-sample-ps) -> well inside 20 min. (6) Loop continues STRICT SERIAL; iter-2 self-dispatched on landing. AGENT4CT_SAVE_RECON -> dashboard iter dir so recon_raw.npz (pred/truth/baseline) lands where rescore reads it.", "advice_for_others": "param_efficient-claude-agentic: reg_type=foe, bilateral_on_top=True, proj_filter_on=False, n_iter=5, learnable_alpha=True, alpha_init=0.1, foe_n_filters=24, foe_kernel=7, foe_n_bumps=31, n_bf=3, bf_multiscale=True, bf_sigmas=[0.8, 1.6, 3.2], bf_kernel=7, bf_sigma_r=0.02, bf_gain_init=0.0, epochs=16, cosine_lr=True, lr=0.005, max_train_s=1080, batch_size=4, train_n=800, val_n=200, display_min=0.0, display_max=0.05, seed=42, rationale=iter-1 ONBOARDING of param_efficient (FoE unrolled prox-gradient + DC, K=5, + multi-RF PARALLEL bilateral bank, zero-init gains) on the re-split Breast-CT (train 3600/val 200/test 200, seed 20260703; 128-view SPARSE). 1,932 reg params. SIX-BOX: (1) PRIOR: none (first iter); cross-solver evidence: DL tier (ItNet/DD-UNet) plateaus val hr ~0.88 at 0.23-0.47M params; the FoE param-efficient recombination targets that hr at ~1.9k params (~200x fewer). (2) FAILURE MODE: N/A onboarding; goal = does the Mayo-evolved FoE+bilateral seed RUN on breast 128-view 512^2 and clear the sparse-view FBP baseline (hr>0). (3) ONE KNOB: N/A baseline seed = Mayo iter-25/27 champion arch (FoE nf24/k7 + M=3 bilateral bank ON TOP), proj-filter OFF (turned on later as the sparse-view lever). (4) HYPOTHESIS: FoE+bilateral (1,932 params, K=5 DC unroll, FBP warm-start) clears breast FBP (hr>0) and lands hr ~0.4-0.6 in one 18-min run, because unrolled data-consistency is the strong-performer trait on breast and the FBP init leaves large sparse-view headroom -- but 200x fewer params than the DL tier means it will START well below 0.88 and the projection-domain + anisotropic streak levers (dormant here) are the sparse-view-specific gains to add next. (5) BUDGET: train_n=800 x FoE K=5 unroll at 512^2, bs=4, hard max_train_s=1080 backstop + 200-slice val pass; breast uses ONE shared PYRO-NN projector (no per-sample-ps) -> well inside 20 min. (6) Loop continues STRICT SERIAL; iter-2 self-dispatched on landing. AGENT4CT_SAVE_RECON -> dashboard iter dir so recon_raw.npz (pred/truth/baseline) lands where rescore reads it.", "comparison_image": "runs/breast-ct-claude-agentic-param-efficient-search-20260703-01/iterations/iter-0001/comparison.png"}
{"ts": "2026-07-06T13:31:59Z", "run_id": "breast-ct-claude-agentic-naf-search-20260703-01", "iter": 20, "agent": "naf-claude-agentic", "model": "claude-opus-4-8-1m", "change_class": "architecture", "status": "discard", "kept": false, "val_score": 0.8272830843925476, "headroom": 0.0, "params_M": 67.129729, "train_n": 0, "rationale": "naf-claude-agentic: val_n=12, naf_n_freqs=8, naf_hidden=128, naf_layers=3, naf_n_iter=8000, naf_lr=0.01, naf_tv_weight=0.0001, naf_n_clip=0.05, naf_outer_wall_s=1150, naf_per_scene_s=90.0, naf_encoding=hash, seed=42, naf_hash_log2_size=21, rationale=iter-20 breast-ct-claude-agentic-naf-search-20260703-01 (redone breast split train3600/val200/test200 seed20260703; val_n=12 CONSTANT for iters 2-20 per coordinator budget intervention 2026-07-05 -- first-12 of the 200-case breast val split, deterministic). SIX-BOX: (1) prior result: all iters so far hr=0 (iter-1 val_n=20 ssim0.355 PSNR6.26 in 970s, NOT a timeout -- a genuine converged fit). (2) failure mode: NAF per-scene INR recon is far below the 128-view breast LD-FBP baseline. (3) ONE knob changed: best-so-far config, per_scene 60->90 (deepest fit). (4) hypothesis: FINAL iter: combine the strongest hash knobs (wide MLP + big table) with the DEEPEST per-scene fit that still fits <20min (12*90=1080s ~18min). HYPOTHESIS: the most-converged, highest-capacity NAF possible in budget. If THIS is still hr=0, the hr=0 plateau is a robust structural verdict for the paper: NAF's per-scene INR basis (even Instant-NGP hash) cannot beat 128-view FBP on dense 512^2 breast soft-tissue. (5) wall: val_n=12 x per_scene 90.0s = ~1080s < 20min. (6) serial, no user return.", "advice_for_others": "naf-claude-agentic: val_n=12, naf_n_freqs=8, naf_hidden=128, naf_layers=3, naf_n_iter=8000, naf_lr=0.01, naf_tv_weight=0.0001, naf_n_clip=0.05, naf_outer_wall_s=1150, naf_per_scene_s=90.0, naf_encoding=hash, seed=42, naf_hash_log2_size=21, rationale=iter-20 breast-ct-claude-agentic-naf-search-20260703-01 (redone breast split train3600/val200/test200 seed20260703; val_n=12 CONSTANT for iters 2-20 per coordinator budget intervention 2026-07-05 -- first-12 of the 200-case breast val split, deterministic). SIX-BOX: (1) prior result: all iters so far hr=0 (iter-1 val_n=20 ssim0.355 PSNR6.26 in 970s, NOT a timeout -- a genuine converged fit). (2) failure mode: NAF per-scene INR recon is far below the 128-view breast LD-FBP baseline. (3) ONE knob changed: best-so-far config, per_scene 60->90 (deepest fit). (4) hypothesis: FINAL iter: combine the strongest hash knobs (wide MLP + big table) with the DEEPEST per-scene fit that still fits <20min (12*90=1080s ~18min). HYPOTHESIS: the most-converged, highest-capacity NAF possible in budget. If THIS is still hr=0, the hr=0 plateau is a robust structural verdict for the paper: NAF's per-scene INR basis (even Instant-NGP hash) cannot beat 128-view FBP on dense 512^2 breast soft-tissue. (5) wall: val_n=12 x per_scene 90.0s = ~1080s < 20min. (6) serial, no user return.", "comparison_image": "runs/breast-ct-claude-agentic-naf-search-20260703-01/iterations/iter-0020/comparison.png"}
{"ts": "2026-07-06T13:10:04Z", "run_id": "breast-ct-claude-agentic-naf-search-20260703-01", "iter": 19, "agent": "naf-claude-agentic", "model": "claude-opus-4-8-1m", "change_class": "architecture", "status": "discard", "kept": false, "val_score": 0.8365227580070496, "headroom": 0.0, "params_M": 33.562817, "train_n": 0, "rationale": "naf-claude-agentic: val_n=12, naf_n_freqs=8, naf_hidden=64, naf_layers=3, naf_n_iter=8000, naf_lr=0.01, naf_tv_weight=0.0001, naf_n_clip=0.05, naf_outer_wall_s=800, naf_per_scene_s=60.0, naf_encoding=hash, seed=42, naf_hash_feat_dim=4, rationale=iter-19 breast-ct-claude-agentic-naf-search-20260703-01 (redone breast split train3600/val200/test200 seed20260703; val_n=12 CONSTANT for iters 2-20 per coordinator budget intervention 2026-07-05 -- first-12 of the 200-case breast val split, deterministic). SIX-BOX: (1) prior result: all iters so far hr=0 (iter-1 val_n=20 ssim0.355 PSNR6.26 in 970s, NOT a timeout -- a genuine converged fit). (2) failure mode: NAF per-scene INR recon is far below the 128-view breast LD-FBP baseline. (3) ONE knob changed: hash feat_dim 2->4. (4) hypothesis: KNOB: more features per hash level 2->4 (richer per-level embedding). HYPOTHESIS: wider per-level features carry more local structure. Final hash-capacity axis. (5) wall: val_n=12 x per_scene 60.0s = ~720s < 20min. (6) serial, no user return.", "advice_for_others": "naf-claude-agentic: val_n=12, naf_n_freqs=8, naf_hidden=64, naf_layers=3, naf_n_iter=8000, naf_lr=0.01, naf_tv_weight=0.0001, naf_n_clip=0.05, naf_outer_wall_s=800, naf_per_scene_s=60.0, naf_encoding=hash, seed=42, naf_hash_feat_dim=4, rationale=iter-19 breast-ct-claude-agentic-naf-search-20260703-01 (redone breast split train3600/val200/test200 seed20260703; val_n=12 CONSTANT for iters 2-20 per coordinator budget intervention 2026-07-05 -- first-12 of the 200-case breast val split, deterministic). SIX-BOX: (1) prior result: all iters so far hr=0 (iter-1 val_n=20 ssim0.355 PSNR6.26 in 970s, NOT a timeout -- a genuine converged fit). (2) failure mode: NAF per-scene INR recon is far below the 128-view breast LD-FBP baseline. (3) ONE knob changed: hash feat_dim 2->4. (4) hypothesis: KNOB: more features per hash level 2->4 (richer per-level embedding). HYPOTHESIS: wider per-level features carry more local structure. Final hash-capacity axis. (5) wall: val_n=12 x per_scene 60.0s = ~720s < 20min. (6) serial, no user return.", "comparison_image": "runs/breast-ct-claude-agentic-naf-search-20260703-01/iterations/iter-0019/comparison.png"}
{"ts": "2026-07-06T12:39:33Z", "run_id": "breast-ct-claude-agentic-dual-domain-n2i-search-20260703-01", "iter": 20, "agent": "dual_domain_n2i-claude-agentic", "model": "claude-opus-4-8-1m", "change_class": "architecture", "status": "discard", "kept": false, "val_score": 0.9428812861442566, "headroom": 0.0, "params_M": 0.465762, "train_n": 400, "rationale": "dual_domain_n2i-claude-agentic: warm_start=True, pretrain_epochs=3, pretrain_steps=0, n_iter=100, grad_clip=1.0, outer_wall_s=1400, per_scene_s=None, batch_size=1, lr=0.0003, optimizer=adam, unet_c=16, train_n=400, val_n=200, seed=42, rationale=iter-20 SIX-BOX (FINAL). (1) PRIOR: iter-19 hr=0.0, n_iter=25 extreme early-stop gave rmse=0.00633 -- freezing near the warm-start init did NOT beat baseline; the init is itself over-smoothed. The full inner-step sweep (25/50/100/200/400 -> 0.00633/0.00628/0.00627/0.00633/0.00623) is FLAT within ~3%, all hr=0. Iters 1-19 ALL hr=0. (2) FAILURE MODE: plain-UNet N2I converges to the over-smoothed FBP-consistent plateau on dense 128-view breast; it has NO edge-preserving structural guard, unlike the bilateral sibling (dual_domain_bilateral_n2i) whose tight range kernel reached hr~0.21. This is the DOCUMENTED structural ceiling (docs/findings.md: N2I over-smooths dense breast at 128 views because the FBP self-supervision target is itself a poor supervision signal). (3) ONE KNOB: relative to iter-19 (n_iter=25), n_iter 25 -> 100 -- returns to the best-rmse inner-step count (iter-10, rmse=0.00627) as a CONFIRMATORY closing replicate of the best-found config at full val_n=200. (4) HYPOTHESIS: this reproduces iter-10's ~0.00627 rmse at hr=0, confirming the best config the search found still cannot beat the sparse-FBP baseline -- a clean final datapoint that the ceiling is genuine and config-robust, not a missed lever. (5) BUDGET: n_iter=100 + pretrain ep=3 + figure ~= 16 min < 30-min wall. (6) FINAL iter -- loop ends here (20 valid six-box iters). Ceiling documented across 20 genuinely different levers: budget, per-scene fit, capacity (up/down), warm-start (off/1/3/10 ep/steps-cap/batch), lr (1e-4..3e-3), grad_clip, seed, inner-steps (25..400). Every one hr=0.", "advice_for_others": "dual_domain_n2i-claude-agentic: warm_start=True, pretrain_epochs=3, pretrain_steps=0, n_iter=100, grad_clip=1.0, outer_wall_s=1400, per_scene_s=None, batch_size=1, lr=0.0003, optimizer=adam, unet_c=16, train_n=400, val_n=200, seed=42, rationale=iter-20 SIX-BOX (FINAL). (1) PRIOR: iter-19 hr=0.0, n_iter=25 extreme early-stop gave rmse=0.00633 -- freezing near the warm-start init did NOT beat baseline; the init is itself over-smoothed. The full inner-step sweep (25/50/100/200/400 -> 0.00633/0.00628/0.00627/0.00633/0.00623) is FLAT within ~3%, all hr=0. Iters 1-19 ALL hr=0. (2) FAILURE MODE: plain-UNet N2I converges to the over-smoothed FBP-consistent plateau on dense 128-view breast; it has NO edge-preserving structural guard, unlike the bilateral sibling (dual_domain_bilateral_n2i) whose tight range kernel reached hr~0.21. This is the DOCUMENTED structural ceiling (docs/findings.md: N2I over-smooths dense breast at 128 views because the FBP self-supervision target is itself a poor supervision signal). (3) ONE KNOB: relative to iter-19 (n_iter=25), n_iter 25 -> 100 -- returns to the best-rmse inner-step count (iter-10, rmse=0.00627) as a CONFIRMATORY closing replicate of the best-found config at full val_n=200. (4) HYPOTHESIS: this reproduces iter-10's ~0.00627 rmse at hr=0, confirming the best config the search found still cannot beat the sparse-FBP baseline -- a clean final datapoint that the ceiling is genuine and config-robust, not a missed lever. (5) BUDGET: n_iter=100 + pretrain ep=3 + figure ~= 16 min < 30-min wall. (6) FINAL iter -- loop ends here (20 valid six-box iters). Ceiling documented across 20 genuinely different levers: budget, per-scene fit, capacity (up/down), warm-start (off/1/3/10 ep/steps-cap/batch), lr (1e-4..3e-3), grad_clip, seed, inner-steps (25..400). Every one hr=0.", "comparison_image": "runs/breast-ct-claude-agentic-dual-domain-n2i-search-20260703-01/iterations/iter-0020/comparison.png"}
{"ts": "2026-07-06T12:25:51Z", "run_id": "breast-ct-claude-agentic-naf-search-20260703-01", "iter": 18, "agent": "naf-claude-agentic", "model": "claude-opus-4-8-1m", "change_class": "architecture", "status": "discard", "kept": false, "val_score": 0.829532265663147, "headroom": 0.0, "params_M": 16.783553, "train_n": 0, "rationale": "naf-claude-agentic: val_n=12, naf_n_freqs=8, naf_hidden=64, naf_layers=3, naf_n_iter=8000, naf_lr=0.01, naf_tv_weight=0.0001, naf_n_clip=0.05, naf_outer_wall_s=800, naf_per_scene_s=60.0, naf_encoding=hash, seed=42, naf_hash_base_res=32, rationale=iter-18 breast-ct-claude-agentic-naf-search-20260703-01 (redone breast split train3600/val200/test200 seed20260703; val_n=12 CONSTANT for iters 2-20 per coordinator budget intervention 2026-07-05 -- first-12 of the 200-case breast val split, deterministic). SIX-BOX: (1) prior result: all iters so far hr=0 (iter-1 val_n=20 ssim0.355 PSNR6.26 in 970s, NOT a timeout -- a genuine converged fit). (2) failure mode: NAF per-scene INR recon is far below the 128-view breast LD-FBP baseline. (3) ONE knob changed: hash base_res 16->32. (4) hypothesis: KNOB: coarser-level start 16->32 (skip the too-coarse levels). HYPOTHESIS: for a single 512px scene the very coarse levels waste capacity; starting finer concentrates the pyramid on useful scales. (5) wall: val_n=12 x per_scene 60.0s = ~720s < 20min. (6) serial, no user return.", "advice_for_others": "naf-claude-agentic: val_n=12, naf_n_freqs=8, naf_hidden=64, naf_layers=3, naf_n_iter=8000, naf_lr=0.01, naf_tv_weight=0.0001, naf_n_clip=0.05, naf_outer_wall_s=800, naf_per_scene_s=60.0, naf_encoding=hash, seed=42, naf_hash_base_res=32, rationale=iter-18 breast-ct-claude-agentic-naf-search-20260703-01 (redone breast split train3600/val200/test200 seed20260703; val_n=12 CONSTANT for iters 2-20 per coordinator budget intervention 2026-07-05 -- first-12 of the 200-case breast val split, deterministic). SIX-BOX: (1) prior result: all iters so far hr=0 (iter-1 val_n=20 ssim0.355 PSNR6.26 in 970s, NOT a timeout -- a genuine converged fit). (2) failure mode: NAF per-scene INR recon is far below the 128-view breast LD-FBP baseline. (3) ONE knob changed: hash base_res 16->32. (4) hypothesis: KNOB: coarser-level start 16->32 (skip the too-coarse levels). HYPOTHESIS: for a single 512px scene the very coarse levels waste capacity; starting finer concentrates the pyramid on useful scales. (5) wall: val_n=12 x per_scene 60.0s = ~720s < 20min. (6) serial, no user return.", "comparison_image": "runs/breast-ct-claude-agentic-naf-search-20260703-01/iterations/iter-0018/comparison.png"}
{"ts": "2026-07-06T11:30:56Z", "run_id": "breast-ct-claude-agentic-naf-search-20260703-01", "iter": 17, "agent": "naf-claude-agentic", "model": "claude-opus-4-8-1m", "change_class": "architecture", "status": "discard", "kept": false, "val_score": 0.8292853832244873, "headroom": 0.0, "params_M": 16.783553, "train_n": 0, "rationale": "naf-claude-agentic: val_n=12, naf_n_freqs=8, naf_hidden=64, naf_layers=3, naf_n_iter=8000, naf_lr=0.01, naf_tv_weight=0.0, naf_n_clip=0.05, naf_outer_wall_s=800, naf_per_scene_s=60.0, naf_encoding=hash, seed=42, rationale=iter-17 breast-ct-claude-agentic-naf-search-20260703-01 (redone breast split train3600/val200/test200 seed20260703; val_n=12 CONSTANT for iters 2-20 per coordinator budget intervention 2026-07-05 -- first-12 of the 200-case breast val split, deterministic). SIX-BOX: (1) prior result: all iters so far hr=0 (iter-1 val_n=20 ssim0.355 PSNR6.26 in 970s, NOT a timeout -- a genuine converged fit). (2) failure mode: NAF per-scene INR recon is far below the 128-view breast LD-FBP baseline. (3) ONE knob changed: hash + tv 1e-4->0. (4) hypothesis: KNOB: drop TV on the hash path (hash can be noisy; TV may fight its detail). HYPOTHESIS: pure data-fit lets the hash grid sharpen fully. (5) wall: val_n=12 x per_scene 60.0s = ~720s < 20min. (6) serial, no user return.", "advice_for_others": "naf-claude-agentic: val_n=12, naf_n_freqs=8, naf_hidden=64, naf_layers=3, naf_n_iter=8000, naf_lr=0.01, naf_tv_weight=0.0, naf_n_clip=0.05, naf_outer_wall_s=800, naf_per_scene_s=60.0, naf_encoding=hash, seed=42, rationale=iter-17 breast-ct-claude-agentic-naf-search-20260703-01 (redone breast split train3600/val200/test200 seed20260703; val_n=12 CONSTANT for iters 2-20 per coordinator budget intervention 2026-07-05 -- first-12 of the 200-case breast val split, deterministic). SIX-BOX: (1) prior result: all iters so far hr=0 (iter-1 val_n=20 ssim0.355 PSNR6.26 in 970s, NOT a timeout -- a genuine converged fit). (2) failure mode: NAF per-scene INR recon is far below the 128-view breast LD-FBP baseline. (3) ONE knob changed: hash + tv 1e-4->0. (4) hypothesis: KNOB: drop TV on the hash path (hash can be noisy; TV may fight its detail). HYPOTHESIS: pure data-fit lets the hash grid sharpen fully. (5) wall: val_n=12 x per_scene 60.0s = ~720s < 20min. (6) serial, no user return.", "comparison_image": "runs/breast-ct-claude-agentic-naf-search-20260703-01/iterations/iter-0017/comparison.png"}
