{"ts": "2026-07-06T09:51:09Z", "run_id": "breast-ct-claude-agentic-naf-search-20260703-01", "iter": 14, "agent": "naf-claude-agentic", "model": "claude-opus-4-8-1m", "change_class": "architecture", "status": "discard", "kept": false, "val_score": 0.8340286612510681, "headroom": 0.0, "params_M": 20.978369, "train_n": 0, "rationale": "naf-claude-agentic: val_n=12, naf_n_freqs=8, naf_hidden=64, naf_layers=3, naf_n_iter=8000, naf_lr=0.01, naf_tv_weight=0.0001, naf_n_clip=0.05, naf_outer_wall_s=800, naf_per_scene_s=60.0, naf_encoding=hash, seed=42, naf_hash_levels=20, rationale=iter-14 breast-ct-claude-agentic-naf-search-20260703-01 (redone breast split train3600/val200/test200 seed20260703; val_n=12 CONSTANT for iters 2-20 per coordinator budget intervention 2026-07-05 -- first-12 of the 200-case breast val split, deterministic). SIX-BOX: (1) prior result: all iters so far hr=0 (iter-1 val_n=20 ssim0.355 PSNR6.26 in 970s, NOT a timeout -- a genuine converged fit). (2) failure mode: NAF per-scene INR recon is far below the 128-view breast LD-FBP baseline. (3) ONE knob changed: hash levels 16->20. (4) hypothesis: KNOB: more hash resolution levels 16->20 (denser multi-scale pyramid). HYPOTHESIS: extra levels bridge coarse-to-fine detail. Tests level count. (5) wall: val_n=12 x per_scene 60.0s = ~720s < 20min. (6) serial, no user return.", "advice_for_others": "naf-claude-agentic: val_n=12, naf_n_freqs=8, naf_hidden=64, naf_layers=3, naf_n_iter=8000, naf_lr=0.01, naf_tv_weight=0.0001, naf_n_clip=0.05, naf_outer_wall_s=800, naf_per_scene_s=60.0, naf_encoding=hash, seed=42, naf_hash_levels=20, rationale=iter-14 breast-ct-claude-agentic-naf-search-20260703-01 (redone breast split train3600/val200/test200 seed20260703; val_n=12 CONSTANT for iters 2-20 per coordinator budget intervention 2026-07-05 -- first-12 of the 200-case breast val split, deterministic). SIX-BOX: (1) prior result: all iters so far hr=0 (iter-1 val_n=20 ssim0.355 PSNR6.26 in 970s, NOT a timeout -- a genuine converged fit). (2) failure mode: NAF per-scene INR recon is far below the 128-view breast LD-FBP baseline. (3) ONE knob changed: hash levels 16->20. (4) hypothesis: KNOB: more hash resolution levels 16->20 (denser multi-scale pyramid). HYPOTHESIS: extra levels bridge coarse-to-fine detail. Tests level count. (5) wall: val_n=12 x per_scene 60.0s = ~720s < 20min. (6) serial, no user return.", "comparison_image": "runs/breast-ct-claude-agentic-naf-search-20260703-01/iterations/iter-0014/comparison.png"}
{"ts": "2026-07-06T08:33:48Z", "run_id": "breast-ct-claude-agentic-dual-domain-n2i-search-20260703-01", "iter": 15, "agent": "dual_domain_n2i-claude-agentic", "model": "claude-opus-4-8-1m", "change_class": "architecture", "status": "discard", "kept": false, "val_score": 0.9419400691986084, "headroom": 0.0, "params_M": 0.465762, "train_n": 400, "rationale": "dual_domain_n2i-claude-agentic: warm_start=True, pretrain_epochs=1, pretrain_steps=0, n_iter=50, grad_clip=1.0, outer_wall_s=1400, per_scene_s=None, batch_size=1, lr=0.0003, optimizer=adam, unet_c=16, train_n=400, val_n=200, seed=42, rationale=iter-15 SIX-BOX. (1) PRIOR: iter-14 hr=0.0, n_iter=400 (high) gave rmse=0.00623 (marginally LOWEST of run) -- many inner steps did NOT over-smooth further; the per-image plateau is flat across 50-400 steps, all hr=0. Iters 1-14 all hr=0. (2) FAILURE MODE: plain-UNet N2I sits at the over-smoothed FBP-consistent plateau; no edge-preserving structural guard (bilateral sibling range kernel hr~0.21). (3) ONE KNOB: relative to iter-6 best reference (n_iter=50, lr=3e-4, c=16, pretrain_epochs=3), pretrain_epochs 3 -> 1 (minimal warm-start). iter-8 tested ep=10 (up), iter-4 tested warm_start off; this fills ep=1 (minimal-but-present init) to bracket warm-start strength: off / 1 / 3 / 10. (4) HYPOTHESIS: a 1-epoch warm-start gives a barely-adapted init that is LESS collapsed toward the smooth mean than the ep=3/10 inits, so the 50-step per-image fit may retain slightly more detail; if rmse dips below 0.00628, minimal warm-start is mildly preferable. Per the ceiling, expect hr=0 -- warm-start strength (off/1/3/10) has shown no monotone effect, all pinned at the plateau. (5) BUDGET: ep=1 warm-start (~150s) + 200*50-step fast fits + figure ~= 11 min << 30-min wall. (6) Loop continues; iter-16 self-dispatched. Reserved levers: pretrain_steps hard cap, batch_size=2 warm-start, warm_start off + n_iter=400, per_scene_s explicit=10, optimizer variation.", "advice_for_others": "dual_domain_n2i-claude-agentic: warm_start=True, pretrain_epochs=1, pretrain_steps=0, n_iter=50, grad_clip=1.0, outer_wall_s=1400, per_scene_s=None, batch_size=1, lr=0.0003, optimizer=adam, unet_c=16, train_n=400, val_n=200, seed=42, rationale=iter-15 SIX-BOX. (1) PRIOR: iter-14 hr=0.0, n_iter=400 (high) gave rmse=0.00623 (marginally LOWEST of run) -- many inner steps did NOT over-smooth further; the per-image plateau is flat across 50-400 steps, all hr=0. Iters 1-14 all hr=0. (2) FAILURE MODE: plain-UNet N2I sits at the over-smoothed FBP-consistent plateau; no edge-preserving structural guard (bilateral sibling range kernel hr~0.21). (3) ONE KNOB: relative to iter-6 best reference (n_iter=50, lr=3e-4, c=16, pretrain_epochs=3), pretrain_epochs 3 -> 1 (minimal warm-start). iter-8 tested ep=10 (up), iter-4 tested warm_start off; this fills ep=1 (minimal-but-present init) to bracket warm-start strength: off / 1 / 3 / 10. (4) HYPOTHESIS: a 1-epoch warm-start gives a barely-adapted init that is LESS collapsed toward the smooth mean than the ep=3/10 inits, so the 50-step per-image fit may retain slightly more detail; if rmse dips below 0.00628, minimal warm-start is mildly preferable. Per the ceiling, expect hr=0 -- warm-start strength (off/1/3/10) has shown no monotone effect, all pinned at the plateau. (5) BUDGET: ep=1 warm-start (~150s) + 200*50-step fast fits + figure ~= 11 min << 30-min wall. (6) Loop continues; iter-16 self-dispatched. Reserved levers: pretrain_steps hard cap, batch_size=2 warm-start, warm_start off + n_iter=400, per_scene_s explicit=10, optimizer variation.", "comparison_image": "runs/breast-ct-claude-agentic-dual-domain-n2i-search-20260703-01/iterations/iter-0015/comparison.png"}
{"ts": "2026-07-06T08:30:15Z", "run_id": "breast-ct-claude-agentic-naf-search-20260703-01", "iter": 13, "agent": "naf-claude-agentic", "model": "claude-opus-4-8-1m", "change_class": "architecture", "status": "discard", "kept": false, "val_score": 0.8291264772415161, "headroom": 0.0, "params_M": 16.783553, "train_n": 0, "rationale": "naf-claude-agentic: val_n=12, naf_n_freqs=8, naf_hidden=64, naf_layers=3, naf_n_iter=8000, naf_lr=0.01, naf_tv_weight=0.0001, naf_n_clip=0.05, naf_outer_wall_s=800, naf_per_scene_s=60.0, naf_encoding=hash, seed=42, naf_hash_max_res=1024, rationale=iter-13 breast-ct-claude-agentic-naf-search-20260703-01 (redone breast split train3600/val200/test200 seed20260703; val_n=12 CONSTANT for iters 2-20 per coordinator budget intervention 2026-07-05 -- first-12 of the 200-case breast val split, deterministic). SIX-BOX: (1) prior result: all iters so far hr=0 (iter-1 val_n=20 ssim0.355 PSNR6.26 in 970s, NOT a timeout -- a genuine converged fit). (2) failure mode: NAF per-scene INR recon is far below the 128-view breast LD-FBP baseline. (3) ONE knob changed: hash max_res 512->1024. (4) hypothesis: KNOB: raise finest hash grid res 512->1024 (sub-pixel features). HYPOTHESIS: finer top level resolves edges below one pixel. Tests the hash resolution axis. (5) wall: val_n=12 x per_scene 60.0s = ~720s < 20min. (6) serial, no user return.", "advice_for_others": "naf-claude-agentic: val_n=12, naf_n_freqs=8, naf_hidden=64, naf_layers=3, naf_n_iter=8000, naf_lr=0.01, naf_tv_weight=0.0001, naf_n_clip=0.05, naf_outer_wall_s=800, naf_per_scene_s=60.0, naf_encoding=hash, seed=42, naf_hash_max_res=1024, rationale=iter-13 breast-ct-claude-agentic-naf-search-20260703-01 (redone breast split train3600/val200/test200 seed20260703; val_n=12 CONSTANT for iters 2-20 per coordinator budget intervention 2026-07-05 -- first-12 of the 200-case breast val split, deterministic). SIX-BOX: (1) prior result: all iters so far hr=0 (iter-1 val_n=20 ssim0.355 PSNR6.26 in 970s, NOT a timeout -- a genuine converged fit). (2) failure mode: NAF per-scene INR recon is far below the 128-view breast LD-FBP baseline. (3) ONE knob changed: hash max_res 512->1024. (4) hypothesis: KNOB: raise finest hash grid res 512->1024 (sub-pixel features). HYPOTHESIS: finer top level resolves edges below one pixel. Tests the hash resolution axis. (5) wall: val_n=12 x per_scene 60.0s = ~720s < 20min. (6) serial, no user return.", "comparison_image": "runs/breast-ct-claude-agentic-naf-search-20260703-01/iterations/iter-0013/comparison.png"}
{"ts": "2026-07-06T07:17:43Z", "run_id": "breast-ct-claude-agentic-dual-domain-n2i-search-20260703-01", "iter": 14, "agent": "dual_domain_n2i-claude-agentic", "model": "claude-opus-4-8-1m", "change_class": "architecture", "status": "discard", "kept": false, "val_score": 0.9432809352874756, "headroom": 0.0, "params_M": 0.465762, "train_n": 400, "rationale": "dual_domain_n2i-claude-agentic: warm_start=True, pretrain_epochs=3, pretrain_steps=0, n_iter=400, grad_clip=1.0, outer_wall_s=1400, per_scene_s=None, batch_size=1, lr=0.0003, optimizer=adam, unet_c=16, train_n=400, val_n=200, seed=42, rationale=iter-14 SIX-BOX. (1) PRIOR: iter-13 hr=0.0, very-gentle lr=1e-4 gave rmse=0.00637 -- gentle steps neither escape nor worsen the over-smoothed basin. lr sweep (1e-4/3e-4/1e-3/3e-3 -> 0.00637/0.00628/0.00633/0.00657) shows lr is not a lever. Iters 1-13 all hr=0. (2) FAILURE MODE: plain-UNet N2I regresses to the over-smoothed FBP mean; no edge-preserving structural guard (bilateral sibling range kernel hr~0.21). (3) ONE KNOB: relative to iter-6 best reference (lr=3e-4, c=16), n_iter 50 -> 400 (8x). Completes the inner-step sweep at the HIGH end (iter-6=50, iter-10=100, iter-2/5=200, now 400). (4) HYPOTHESIS: the classic N2I pathology is that MANY inner steps over-smooth MORE (the denoiser regresses ever closer to the low-frequency FBP-consistent mean). If rmse RISES above the 50-step 0.00628, that directly demonstrates the over-smoothing mechanism -- the more we optimize the N2I self-sup loss, the further from the truth we get. This is the strongest single-lever evidence for WHY the ceiling exists. (5) BUDGET: n_iter=400 is per-scene-wall-capped at 7.0s (per_scene = outer_wall/200); on 512^2 c=16 that fits maybe ~90-120 of the 400 steps/scene, so all 200 scans still complete inside 1400s + figure ~= 25 min < 30-min wall. (6) Loop continues; iter-15 self-dispatched. Reserved levers: pretrain_epochs=1 minimal, pretrain_steps cap, batch_size=2 warm-start, warm_start off + n_iter high, per_scene_s explicit.", "advice_for_others": "dual_domain_n2i-claude-agentic: warm_start=True, pretrain_epochs=3, pretrain_steps=0, n_iter=400, grad_clip=1.0, outer_wall_s=1400, per_scene_s=None, batch_size=1, lr=0.0003, optimizer=adam, unet_c=16, train_n=400, val_n=200, seed=42, rationale=iter-14 SIX-BOX. (1) PRIOR: iter-13 hr=0.0, very-gentle lr=1e-4 gave rmse=0.00637 -- gentle steps neither escape nor worsen the over-smoothed basin. lr sweep (1e-4/3e-4/1e-3/3e-3 -> 0.00637/0.00628/0.00633/0.00657) shows lr is not a lever. Iters 1-13 all hr=0. (2) FAILURE MODE: plain-UNet N2I regresses to the over-smoothed FBP mean; no edge-preserving structural guard (bilateral sibling range kernel hr~0.21). (3) ONE KNOB: relative to iter-6 best reference (lr=3e-4, c=16), n_iter 50 -> 400 (8x). Completes the inner-step sweep at the HIGH end (iter-6=50, iter-10=100, iter-2/5=200, now 400). (4) HYPOTHESIS: the classic N2I pathology is that MANY inner steps over-smooth MORE (the denoiser regresses ever closer to the low-frequency FBP-consistent mean). If rmse RISES above the 50-step 0.00628, that directly demonstrates the over-smoothing mechanism -- the more we optimize the N2I self-sup loss, the further from the truth we get. This is the strongest single-lever evidence for WHY the ceiling exists. (5) BUDGET: n_iter=400 is per-scene-wall-capped at 7.0s (per_scene = outer_wall/200); on 512^2 c=16 that fits maybe ~90-120 of the 400 steps/scene, so all 200 scans still complete inside 1400s + figure ~= 25 min < 30-min wall. (6) Loop continues; iter-15 self-dispatched. Reserved levers: pretrain_epochs=1 minimal, pretrain_steps cap, batch_size=2 warm-start, warm_start off + n_iter high, per_scene_s explicit.", "comparison_image": "runs/breast-ct-claude-agentic-dual-domain-n2i-search-20260703-01/iterations/iter-0014/comparison.png"}
{"ts": "2026-07-06T07:04:31Z", "run_id": "breast-ct-claude-agentic-naf-search-20260703-01", "iter": 12, "agent": "naf-claude-agentic", "model": "claude-opus-4-8-1m", "change_class": "architecture", "status": "discard", "kept": false, "val_score": 0.8350316882133484, "headroom": 0.0, "params_M": 67.115201, "train_n": 0, "rationale": "naf-claude-agentic: val_n=12, naf_n_freqs=8, naf_hidden=64, naf_layers=3, naf_n_iter=8000, naf_lr=0.01, naf_tv_weight=0.0001, naf_n_clip=0.05, naf_outer_wall_s=800, naf_per_scene_s=60.0, naf_encoding=hash, seed=42, naf_hash_log2_size=21, rationale=iter-12 breast-ct-claude-agentic-naf-search-20260703-01 (redone breast split train3600/val200/test200 seed20260703; val_n=12 CONSTANT for iters 2-20 per coordinator budget intervention 2026-07-05 -- first-12 of the 200-case breast val split, deterministic). SIX-BOX: (1) prior result: all iters so far hr=0 (iter-1 val_n=20 ssim0.355 PSNR6.26 in 970s, NOT a timeout -- a genuine converged fit). (2) failure mode: NAF per-scene INR recon is far below the 128-view breast LD-FBP baseline. (3) ONE knob changed: hash log2_size 19->21 (bigger table). (4) hypothesis: iter-11 (hash default) result informs this. KNOB: bigger hashmap 2^19->2^21 (fewer collisions at fine levels). HYPOTHESIS: hash collisions at 512px cap detail; a larger table sharpens the fit. Tests hash capacity. (5) wall: val_n=12 x per_scene 60.0s = ~720s < 20min. (6) serial, no user return.", "advice_for_others": "naf-claude-agentic: val_n=12, naf_n_freqs=8, naf_hidden=64, naf_layers=3, naf_n_iter=8000, naf_lr=0.01, naf_tv_weight=0.0001, naf_n_clip=0.05, naf_outer_wall_s=800, naf_per_scene_s=60.0, naf_encoding=hash, seed=42, naf_hash_log2_size=21, rationale=iter-12 breast-ct-claude-agentic-naf-search-20260703-01 (redone breast split train3600/val200/test200 seed20260703; val_n=12 CONSTANT for iters 2-20 per coordinator budget intervention 2026-07-05 -- first-12 of the 200-case breast val split, deterministic). SIX-BOX: (1) prior result: all iters so far hr=0 (iter-1 val_n=20 ssim0.355 PSNR6.26 in 970s, NOT a timeout -- a genuine converged fit). (2) failure mode: NAF per-scene INR recon is far below the 128-view breast LD-FBP baseline. (3) ONE knob changed: hash log2_size 19->21 (bigger table). (4) hypothesis: iter-11 (hash default) result informs this. KNOB: bigger hashmap 2^19->2^21 (fewer collisions at fine levels). HYPOTHESIS: hash collisions at 512px cap detail; a larger table sharpens the fit. Tests hash capacity. (5) wall: val_n=12 x per_scene 60.0s = ~720s < 20min. (6) serial, no user return.", "comparison_image": "runs/breast-ct-claude-agentic-naf-search-20260703-01/iterations/iter-0012/comparison.png"}
{"ts": "2026-07-06T05:49:39Z", "run_id": "breast-ct-claude-agentic-dual-domain-n2i-search-20260703-01", "iter": 13, "agent": "dual_domain_n2i-claude-agentic", "model": "claude-opus-4-8-1m", "change_class": "architecture", "status": "discard", "kept": false, "val_score": 0.9404169917106628, "headroom": 0.0, "params_M": 0.465762, "train_n": 400, "rationale": "dual_domain_n2i-claude-agentic: warm_start=True, pretrain_epochs=3, pretrain_steps=0, n_iter=50, grad_clip=1.0, outer_wall_s=1400, per_scene_s=None, batch_size=1, lr=0.0001, optimizer=adam, unet_c=16, train_n=400, val_n=200, seed=42, rationale=iter-13 SIX-BOX. (1) PRIOR: iter-12 hr=0.0, seed 42->314 variance check gave rmse=0.00629 (vs seed-42 ~0.00628) -- the ceiling is SEED-INDEPENDENT, confirming it is structural not a one-off RNG artifact. Iters 1-12 all hr=0. (2) FAILURE MODE: plain-UNet N2I regresses to the over-smoothed FBP mean; no edge-preserving structural guard (bilateral sibling range kernel hr~0.21). (3) ONE KNOB: relative to iter-6 best reference (n_iter=50, c=16, seed=42), lr 3e-4 -> 1e-4. Extends the lr sweep to its gentle end (iter-7=3e-3 up, iter-5/6=3e-4, now 1e-4). (4) HYPOTHESIS: a very gentle step size with the warm-started init may barely move off the (already over-smoothed) init in 50 steps, so rmse ~= the warm-start's own rmse; tests whether even minimal per-image adjustment can help. Per the ceiling, expect rmse ~0.0063 (hr=0) -- gentle steps neither escape nor worsen the over-smoothed basin. If unexpectedly lower, gentle-lr early-stop would be a lever worth a follow-up. (5) BUDGET: identical to iter-6 (n_iter=50 fast); ~12 min << 30-min wall. (6) Loop continues; iter-14 self-dispatched. Reserved levers: n_iter=400 high, pretrain_epochs=1 minimal, pretrain_steps cap, batch_size=2 warm-start, warm_start off + high n_iter.", "advice_for_others": "dual_domain_n2i-claude-agentic: warm_start=True, pretrain_epochs=3, pretrain_steps=0, n_iter=50, grad_clip=1.0, outer_wall_s=1400, per_scene_s=None, batch_size=1, lr=0.0001, optimizer=adam, unet_c=16, train_n=400, val_n=200, seed=42, rationale=iter-13 SIX-BOX. (1) PRIOR: iter-12 hr=0.0, seed 42->314 variance check gave rmse=0.00629 (vs seed-42 ~0.00628) -- the ceiling is SEED-INDEPENDENT, confirming it is structural not a one-off RNG artifact. Iters 1-12 all hr=0. (2) FAILURE MODE: plain-UNet N2I regresses to the over-smoothed FBP mean; no edge-preserving structural guard (bilateral sibling range kernel hr~0.21). (3) ONE KNOB: relative to iter-6 best reference (n_iter=50, c=16, seed=42), lr 3e-4 -> 1e-4. Extends the lr sweep to its gentle end (iter-7=3e-3 up, iter-5/6=3e-4, now 1e-4). (4) HYPOTHESIS: a very gentle step size with the warm-started init may barely move off the (already over-smoothed) init in 50 steps, so rmse ~= the warm-start's own rmse; tests whether even minimal per-image adjustment can help. Per the ceiling, expect rmse ~0.0063 (hr=0) -- gentle steps neither escape nor worsen the over-smoothed basin. If unexpectedly lower, gentle-lr early-stop would be a lever worth a follow-up. (5) BUDGET: identical to iter-6 (n_iter=50 fast); ~12 min << 30-min wall. (6) Loop continues; iter-14 self-dispatched. Reserved levers: n_iter=400 high, pretrain_epochs=1 minimal, pretrain_steps cap, batch_size=2 warm-start, warm_start off + high n_iter.", "comparison_image": "runs/breast-ct-claude-agentic-dual-domain-n2i-search-20260703-01/iterations/iter-0013/comparison.png"}
{"ts": "2026-07-06T05:46:46Z", "run_id": "breast-ct-claude-agentic-naf-search-20260703-01", "iter": 11, "agent": "naf-claude-agentic", "model": "claude-opus-4-8-1m", "change_class": "architecture", "status": "discard", "kept": false, "val_score": 0.8308674693107605, "headroom": 0.0, "params_M": 16.783553, "train_n": 0, "rationale": "naf-claude-agentic: val_n=12, naf_n_freqs=8, naf_hidden=64, naf_layers=3, naf_n_iter=8000, naf_lr=0.01, naf_tv_weight=0.0001, naf_n_clip=0.05, naf_outer_wall_s=800, naf_per_scene_s=60.0, naf_encoding=hash, seed=42, rationale=iter-11 breast-ct-claude-agentic-naf-search-20260703-01 (redone breast split train3600/val200/test200 seed20260703; val_n=12 CONSTANT for iters 2-20 per coordinator budget intervention 2026-07-05 -- first-12 of the 200-case breast val split, deterministic). SIX-BOX: (1) prior result: all iters so far hr=0 (iter-1 val_n=20 ssim0.355 PSNR6.26 in 970s, NOT a timeout -- a genuine converged fit). (2) failure mode: NAF per-scene INR recon is far below the 128-view breast LD-FBP baseline. (3) ONE knob changed: encoding fourier->hash (Instant-NGP). (4) hypothesis: iters 2-10 (fourier variants) all hr=0. KNOB: swap the encoder to the paper's Instant-NGP multi-res HASH grid + small MLP (the NAF headline contribution, chest_50.yaml). HYPOTHESIS: the hash grid represents fine local detail far better than global sin/cos posenc -- this is the single most likely change to escape the basis ceiling. If ANY config beats FBP it is this one. (5) wall: val_n=12 x per_scene 60.0s = ~720s < 20min. (6) serial, no user return.", "advice_for_others": "naf-claude-agentic: val_n=12, naf_n_freqs=8, naf_hidden=64, naf_layers=3, naf_n_iter=8000, naf_lr=0.01, naf_tv_weight=0.0001, naf_n_clip=0.05, naf_outer_wall_s=800, naf_per_scene_s=60.0, naf_encoding=hash, seed=42, rationale=iter-11 breast-ct-claude-agentic-naf-search-20260703-01 (redone breast split train3600/val200/test200 seed20260703; val_n=12 CONSTANT for iters 2-20 per coordinator budget intervention 2026-07-05 -- first-12 of the 200-case breast val split, deterministic). SIX-BOX: (1) prior result: all iters so far hr=0 (iter-1 val_n=20 ssim0.355 PSNR6.26 in 970s, NOT a timeout -- a genuine converged fit). (2) failure mode: NAF per-scene INR recon is far below the 128-view breast LD-FBP baseline. (3) ONE knob changed: encoding fourier->hash (Instant-NGP). (4) hypothesis: iters 2-10 (fourier variants) all hr=0. KNOB: swap the encoder to the paper's Instant-NGP multi-res HASH grid + small MLP (the NAF headline contribution, chest_50.yaml). HYPOTHESIS: the hash grid represents fine local detail far better than global sin/cos posenc -- this is the single most likely change to escape the basis ceiling. If ANY config beats FBP it is this one. (5) wall: val_n=12 x per_scene 60.0s = ~720s < 20min. (6) serial, no user return.", "comparison_image": "runs/breast-ct-claude-agentic-naf-search-20260703-01/iterations/iter-0011/comparison.png"}
