{"ts": "2026-07-08T09:06:03Z", "run_id": "breast-ct-claude-agentic-param-efficient-search-20260703-01", "iter": 36, "agent": "param_efficient-claude-agentic", "model": "claude-opus-4-8-1m", "change_class": "architecture", "status": "discard", "kept": false, "val_score": 0.9696151614189148, "headroom": 0.0, "params_M": 0.000195, "train_n": 200, "rationale": "param_efficient-claude-agentic: reg_type=bilateral, bilateral_on_top=False, proj_filter_on=False, n_iter=30, learnable_alpha=True, alpha_init=0.1, foe_n_filters=24, foe_kernel=7, foe_n_bumps=31, n_bf=1, bf_multiscale=True, bf_sigmas=[0.8, 1.6, 3.2], bf_kernel=7, bf_sigma_r=0.02, bf_gain_init=0.0, epochs=16, cosine_lr=True, lr=0.002, max_train_s=1080, batch_size=4, train_n=200, val_n=200, display_min=0.0, display_max=0.05, seed=45, rationale=iter-36 param_efficient breast -- LOWER LR stabilizer on seed 45. SIX-BOX: (1) PRIOR: champion seed-fragile (4-good 0.571+-0.031, seed45=0.0 collapse). grad_clip 1->0.1 (iter-35) did NOT recover seed45 (still 0.0). The collapse looks like an early LARGE-LR step entering a bad basin (loss converges there). (2) FAILURE MODE: peak LR 5e-3 sends seed45 into a bad basin in the first epochs. (3) ONE KNOB: peak lr 5e-3->2e-3 (gentler start) on the EXACT failing seed 45. All else byte-for-byte the champion (grad_clip back to 1.0). (4) HYPOTHESIS: a gentler LR keeps seed45 in the good basin -> recovers to ~0.55+, showing the fragility is an LR-schedule artifact fixable without arch change. If it recovers, re-run other seeds at lr=2e-3 for a stabilized mean+-std. If NOT, this is intrinsic VN-family seed-fragility -> report honestly (single-best 0.6201, 4-good 0.571+-0.031, 1/5 collapse). (5) BUDGET: identical to champion (16ep ~1120s); note lower LR may need the full 16ep to reach the good regime -- it fits (post-filter champion completes 16ep in budget). --time=00:30:00, 200-val -> 20-min. (6) SERIAL; iter-37: CONCLUDE the seed story (recovered or honest fragility) -> FINAL REPORT., dc_mode=filtered, per_step_alpha=True, lpd_on=True, lpd_width=4, lpd_kernel=3, anisotropic_on_top=False, post_bilateral=True, post_n_bf=3, post_bf_kernel=7, post_bf_sigma_r=0.02, grad_clip=1.0", "advice_for_others": "param_efficient-claude-agentic: reg_type=bilateral, bilateral_on_top=False, proj_filter_on=False, n_iter=30, learnable_alpha=True, alpha_init=0.1, foe_n_filters=24, foe_kernel=7, foe_n_bumps=31, n_bf=1, bf_multiscale=True, bf_sigmas=[0.8, 1.6, 3.2], bf_kernel=7, bf_sigma_r=0.02, bf_gain_init=0.0, epochs=16, cosine_lr=True, lr=0.002, max_train_s=1080, batch_size=4, train_n=200, val_n=200, display_min=0.0, display_max=0.05, seed=45, rationale=iter-36 param_efficient breast -- LOWER LR stabilizer on seed 45. SIX-BOX: (1) PRIOR: champion seed-fragile (4-good 0.571+-0.031, seed45=0.0 collapse). grad_clip 1->0.1 (iter-35) did NOT recover seed45 (still 0.0). The collapse looks like an early LARGE-LR step entering a bad basin (loss converges there). (2) FAILURE MODE: peak LR 5e-3 sends seed45 into a bad basin in the first epochs. (3) ONE KNOB: peak lr 5e-3->2e-3 (gentler start) on the EXACT failing seed 45. All else byte-for-byte the champion (grad_clip back to 1.0). (4) HYPOTHESIS: a gentler LR keeps seed45 in the good basin -> recovers to ~0.55+, showing the fragility is an LR-schedule artifact fixable without arch change. If it recovers, re-run other seeds at lr=2e-3 for a stabilized mean+-std. If NOT, this is intrinsic VN-family seed-fragility -> report honestly (single-best 0.6201, 4-good 0.571+-0.031, 1/5 collapse). (5) BUDGET: identical to champion (16ep ~1120s); note lower LR may need the full 16ep to reach the good regime -- it fits (post-filter champion completes 16ep in budget). --time=00:30:00, 200-val -> 20-min. (6) SERIAL; iter-37: CONCLUDE the seed story (recovered or honest fragility) -> FINAL REPORT., dc_mode=filtered, per_step_alpha=True, lpd_on=True, lpd_width=4, lpd_kernel=3, anisotropic_on_top=False, post_bilateral=True, post_n_bf=3, post_bf_kernel=7, post_bf_sigma_r=0.02, grad_clip=1.0", "comparison_image": "runs/breast-ct-claude-agentic-param-efficient-search-20260703-01/iterations/iter-0036/comparison.png"}
{"ts": "2026-07-08T07:57:29Z", "run_id": "breast-ct-claude-agentic-param-efficient-search-20260703-01", "iter": 35, "agent": "param_efficient-claude-agentic", "model": "claude-opus-4-8-1m", "change_class": "architecture", "status": "discard", "kept": false, "val_score": 0.96610426902771, "headroom": 0.0, "params_M": 0.000195, "train_n": 200, "rationale": "param_efficient-claude-agentic: reg_type=bilateral, bilateral_on_top=False, proj_filter_on=False, n_iter=30, learnable_alpha=True, alpha_init=0.1, foe_n_filters=24, foe_kernel=7, foe_n_bumps=31, n_bf=1, bf_multiscale=True, bf_sigmas=[0.8, 1.6, 3.2], bf_kernel=7, bf_sigma_r=0.02, bf_gain_init=0.0, epochs=16, cosine_lr=True, lr=0.005, max_train_s=1080, batch_size=4, train_n=200, val_n=200, display_min=0.0, display_max=0.05, seed=45, rationale=iter-35 param_efficient breast -- GRAD-CLIP FIX on the FAILING seed 45. SIX-BOX: (1) PRIOR: champion (filtered-DC K30 + LPD W4 + 3-scale post-BF, 195p) is SEED-FRAGILE: seeds 42/43/44/46 = 0.6201/0.5586/0.5593/0.5469 (4-good mean 0.571+-0.031) but seed45 COLLAPSED to hr 0.0 (converged, PSNR 35.5<baseline -- a bad basin). Default grad_clip=1.0 did not prevent it. (2) FAILURE MODE: on some seeds the LPD+post-filter optimization enters a bad basin early and converges there. (3) ONE KNOB: grad_clip 1.0->0.1 (10x tighter) on the EXACT failing seed 45. All else byte-for-byte the champion. (4) HYPOTHESIS: a tighter grad-clip damps the early large-gradient step that sends seed45 into the bad basin -> seed45 recovers to the ~0.55-0.62 good-seed regime, directly PROVING grad-clip is the fragility fix. If seed45 recovers, re-run 2-3 more seeds with grad_clip=0.1 for a grad-clipped mean+-std (likely tighter). If it does NOT recover, report the raw fragility honestly. (5) BUDGET: identical to the champion (16ep ~1120s), max_train_s=1080, --time=00:30:00, 200-val -> 20-min. (6) SERIAL; iter-36+: if fix works, grad-clipped replicates; else final report with the honest raw seed story., dc_mode=filtered, per_step_alpha=True, lpd_on=True, lpd_width=4, lpd_kernel=3, anisotropic_on_top=False, post_bilateral=True, post_n_bf=3, post_bf_kernel=7, post_bf_sigma_r=0.02, grad_clip=0.1", "advice_for_others": "param_efficient-claude-agentic: reg_type=bilateral, bilateral_on_top=False, proj_filter_on=False, n_iter=30, learnable_alpha=True, alpha_init=0.1, foe_n_filters=24, foe_kernel=7, foe_n_bumps=31, n_bf=1, bf_multiscale=True, bf_sigmas=[0.8, 1.6, 3.2], bf_kernel=7, bf_sigma_r=0.02, bf_gain_init=0.0, epochs=16, cosine_lr=True, lr=0.005, max_train_s=1080, batch_size=4, train_n=200, val_n=200, display_min=0.0, display_max=0.05, seed=45, rationale=iter-35 param_efficient breast -- GRAD-CLIP FIX on the FAILING seed 45. SIX-BOX: (1) PRIOR: champion (filtered-DC K30 + LPD W4 + 3-scale post-BF, 195p) is SEED-FRAGILE: seeds 42/43/44/46 = 0.6201/0.5586/0.5593/0.5469 (4-good mean 0.571+-0.031) but seed45 COLLAPSED to hr 0.0 (converged, PSNR 35.5<baseline -- a bad basin). Default grad_clip=1.0 did not prevent it. (2) FAILURE MODE: on some seeds the LPD+post-filter optimization enters a bad basin early and converges there. (3) ONE KNOB: grad_clip 1.0->0.1 (10x tighter) on the EXACT failing seed 45. All else byte-for-byte the champion. (4) HYPOTHESIS: a tighter grad-clip damps the early large-gradient step that sends seed45 into the bad basin -> seed45 recovers to the ~0.55-0.62 good-seed regime, directly PROVING grad-clip is the fragility fix. If seed45 recovers, re-run 2-3 more seeds with grad_clip=0.1 for a grad-clipped mean+-std (likely tighter). If it does NOT recover, report the raw fragility honestly. (5) BUDGET: identical to the champion (16ep ~1120s), max_train_s=1080, --time=00:30:00, 200-val -> 20-min. (6) SERIAL; iter-36+: if fix works, grad-clipped replicates; else final report with the honest raw seed story., dc_mode=filtered, per_step_alpha=True, lpd_on=True, lpd_width=4, lpd_kernel=3, anisotropic_on_top=False, post_bilateral=True, post_n_bf=3, post_bf_kernel=7, post_bf_sigma_r=0.02, grad_clip=0.1", "comparison_image": "runs/breast-ct-claude-agentic-param-efficient-search-20260703-01/iterations/iter-0035/comparison.png"}
{"ts": "2026-07-07T20:32:30Z", "run_id": "breast-ct-claude-agentic-param-efficient-search-20260703-01", "iter": 34, "agent": "param_efficient-claude-agentic", "model": "claude-opus-4-8-1m", "change_class": "architecture", "status": "keep", "kept": true, "val_score": 0.9897221326828003, "headroom": 0.5468701789286962, "params_M": 0.000195, "train_n": 200, "rationale": "param_efficient-claude-agentic: reg_type=bilateral, bilateral_on_top=False, proj_filter_on=False, n_iter=30, learnable_alpha=True, alpha_init=0.1, foe_n_filters=24, foe_kernel=7, foe_n_bumps=31, n_bf=1, bf_multiscale=True, bf_sigmas=[0.8, 1.6, 3.2], bf_kernel=7, bf_sigma_r=0.02, bf_gain_init=0.0, epochs=16, cosine_lr=True, lr=0.005, max_train_s=1080, batch_size=4, train_n=200, val_n=200, display_min=0.0, display_max=0.05, seed=46, rationale=iter-34 SEED REPLICATE 4/4 of the LOCKED CHAMPION (filtered-DC K30 + LPD-combine W4 + 3-scale bilateral POST-filter sigma_r=0.02, 195 params, seed42=0.6201). Post-filter fully tuned (3 scales optimal, sigma_r=0.02 optimal). ONE KNOB: seed 42->46; all else byte-for-byte the champion. HYPOTHESIS: hr near 0.6201 +- seed noise; 5-seed (42-46) mean+-std is the reported headline @ 195p, and check if the post-filter tightens the spread vs LPD-only 0.459+-0.029. BUDGET: identical to iter-28 (16ep ~1120s), max_train_s=1080, --time=00:30:00 -> 20-min comparable. SERIAL; recon saved., dc_mode=filtered, per_step_alpha=True, lpd_on=True, lpd_width=4, lpd_kernel=3, anisotropic_on_top=False, post_bilateral=True, post_n_bf=3, post_bf_kernel=7, post_bf_sigma_r=0.02", "advice_for_others": "param_efficient-claude-agentic: reg_type=bilateral, bilateral_on_top=False, proj_filter_on=False, n_iter=30, learnable_alpha=True, alpha_init=0.1, foe_n_filters=24, foe_kernel=7, foe_n_bumps=31, n_bf=1, bf_multiscale=True, bf_sigmas=[0.8, 1.6, 3.2], bf_kernel=7, bf_sigma_r=0.02, bf_gain_init=0.0, epochs=16, cosine_lr=True, lr=0.005, max_train_s=1080, batch_size=4, train_n=200, val_n=200, display_min=0.0, display_max=0.05, seed=46, rationale=iter-34 SEED REPLICATE 4/4 of the LOCKED CHAMPION (filtered-DC K30 + LPD-combine W4 + 3-scale bilateral POST-filter sigma_r=0.02, 195 params, seed42=0.6201). Post-filter fully tuned (3 scales optimal, sigma_r=0.02 optimal). ONE KNOB: seed 42->46; all else byte-for-byte the champion. HYPOTHESIS: hr near 0.6201 +- seed noise; 5-seed (42-46) mean+-std is the reported headline @ 195p, and check if the post-filter tightens the spread vs LPD-only 0.459+-0.029. BUDGET: identical to iter-28 (16ep ~1120s), max_train_s=1080, --time=00:30:00 -> 20-min comparable. SERIAL; recon saved., dc_mode=filtered, per_step_alpha=True, lpd_on=True, lpd_width=4, lpd_kernel=3, anisotropic_on_top=False, post_bilateral=True, post_n_bf=3, post_bf_kernel=7, post_bf_sigma_r=0.02", "comparison_image": "runs/breast-ct-claude-agentic-param-efficient-search-20260703-01/iterations/iter-0034/comparison.png"}
{"ts": "2026-07-07T20:12:15Z", "run_id": "breast-ct-claude-agentic-param-efficient-search-20260703-01", "iter": 33, "agent": "param_efficient-claude-agentic", "model": "claude-opus-4-8-1m", "change_class": "architecture", "status": "discard", "kept": false, "val_score": 0.969373881816864, "headroom": 0.0, "params_M": 0.000195, "train_n": 200, "rationale": "param_efficient-claude-agentic: reg_type=bilateral, bilateral_on_top=False, proj_filter_on=False, n_iter=30, learnable_alpha=True, alpha_init=0.1, foe_n_filters=24, foe_kernel=7, foe_n_bumps=31, n_bf=1, bf_multiscale=True, bf_sigmas=[0.8, 1.6, 3.2], bf_kernel=7, bf_sigma_r=0.02, bf_gain_init=0.0, epochs=16, cosine_lr=True, lr=0.005, max_train_s=1080, batch_size=4, train_n=200, val_n=200, display_min=0.0, display_max=0.05, seed=45, rationale=iter-33 SEED REPLICATE 3/4 of the LOCKED CHAMPION (filtered-DC K30 + LPD-combine W4 + 3-scale bilateral POST-filter sigma_r=0.02, 195 params, seed42=0.6201). Post-filter fully tuned (3 scales optimal, sigma_r=0.02 optimal). ONE KNOB: seed 42->45; all else byte-for-byte the champion. HYPOTHESIS: hr near 0.6201 +- seed noise; 5-seed (42-46) mean+-std is the reported headline @ 195p, and check if the post-filter tightens the spread vs LPD-only 0.459+-0.029. BUDGET: identical to iter-28 (16ep ~1120s), max_train_s=1080, --time=00:30:00 -> 20-min comparable. SERIAL; recon saved., dc_mode=filtered, per_step_alpha=True, lpd_on=True, lpd_width=4, lpd_kernel=3, anisotropic_on_top=False, post_bilateral=True, post_n_bf=3, post_bf_kernel=7, post_bf_sigma_r=0.02", "advice_for_others": "param_efficient-claude-agentic: reg_type=bilateral, bilateral_on_top=False, proj_filter_on=False, n_iter=30, learnable_alpha=True, alpha_init=0.1, foe_n_filters=24, foe_kernel=7, foe_n_bumps=31, n_bf=1, bf_multiscale=True, bf_sigmas=[0.8, 1.6, 3.2], bf_kernel=7, bf_sigma_r=0.02, bf_gain_init=0.0, epochs=16, cosine_lr=True, lr=0.005, max_train_s=1080, batch_size=4, train_n=200, val_n=200, display_min=0.0, display_max=0.05, seed=45, rationale=iter-33 SEED REPLICATE 3/4 of the LOCKED CHAMPION (filtered-DC K30 + LPD-combine W4 + 3-scale bilateral POST-filter sigma_r=0.02, 195 params, seed42=0.6201). Post-filter fully tuned (3 scales optimal, sigma_r=0.02 optimal). ONE KNOB: seed 42->45; all else byte-for-byte the champion. HYPOTHESIS: hr near 0.6201 +- seed noise; 5-seed (42-46) mean+-std is the reported headline @ 195p, and check if the post-filter tightens the spread vs LPD-only 0.459+-0.029. BUDGET: identical to iter-28 (16ep ~1120s), max_train_s=1080, --time=00:30:00 -> 20-min comparable. SERIAL; recon saved., dc_mode=filtered, per_step_alpha=True, lpd_on=True, lpd_width=4, lpd_kernel=3, anisotropic_on_top=False, post_bilateral=True, post_n_bf=3, post_bf_kernel=7, post_bf_sigma_r=0.02", "comparison_image": "runs/breast-ct-claude-agentic-param-efficient-search-20260703-01/iterations/iter-0033/comparison.png"}
{"ts": "2026-07-07T19:52:43Z", "run_id": "breast-ct-claude-agentic-param-efficient-search-20260703-01", "iter": 32, "agent": "param_efficient-claude-agentic", "model": "claude-opus-4-8-1m", "change_class": "architecture", "status": "keep", "kept": true, "val_score": 0.9908439517021179, "headroom": 0.5592915582095396, "params_M": 0.000195, "train_n": 200, "rationale": "param_efficient-claude-agentic: reg_type=bilateral, bilateral_on_top=False, proj_filter_on=False, n_iter=30, learnable_alpha=True, alpha_init=0.1, foe_n_filters=24, foe_kernel=7, foe_n_bumps=31, n_bf=1, bf_multiscale=True, bf_sigmas=[0.8, 1.6, 3.2], bf_kernel=7, bf_sigma_r=0.02, bf_gain_init=0.0, epochs=16, cosine_lr=True, lr=0.005, max_train_s=1080, batch_size=4, train_n=200, val_n=200, display_min=0.0, display_max=0.05, seed=44, rationale=iter-32 SEED REPLICATE 2/4 of the LOCKED CHAMPION (filtered-DC K30 + LPD-combine W4 + 3-scale bilateral POST-filter sigma_r=0.02, 195 params, seed42=0.6201). Post-filter fully tuned (3 scales optimal, sigma_r=0.02 optimal). ONE KNOB: seed 42->44; all else byte-for-byte the champion. HYPOTHESIS: hr near 0.6201 +- seed noise; 5-seed (42-46) mean+-std is the reported headline @ 195p, and check if the post-filter tightens the spread vs LPD-only 0.459+-0.029. BUDGET: identical to iter-28 (16ep ~1120s), max_train_s=1080, --time=00:30:00 -> 20-min comparable. SERIAL; recon saved., dc_mode=filtered, per_step_alpha=True, lpd_on=True, lpd_width=4, lpd_kernel=3, anisotropic_on_top=False, post_bilateral=True, post_n_bf=3, post_bf_kernel=7, post_bf_sigma_r=0.02", "advice_for_others": "param_efficient-claude-agentic: reg_type=bilateral, bilateral_on_top=False, proj_filter_on=False, n_iter=30, learnable_alpha=True, alpha_init=0.1, foe_n_filters=24, foe_kernel=7, foe_n_bumps=31, n_bf=1, bf_multiscale=True, bf_sigmas=[0.8, 1.6, 3.2], bf_kernel=7, bf_sigma_r=0.02, bf_gain_init=0.0, epochs=16, cosine_lr=True, lr=0.005, max_train_s=1080, batch_size=4, train_n=200, val_n=200, display_min=0.0, display_max=0.05, seed=44, rationale=iter-32 SEED REPLICATE 2/4 of the LOCKED CHAMPION (filtered-DC K30 + LPD-combine W4 + 3-scale bilateral POST-filter sigma_r=0.02, 195 params, seed42=0.6201). Post-filter fully tuned (3 scales optimal, sigma_r=0.02 optimal). ONE KNOB: seed 42->44; all else byte-for-byte the champion. HYPOTHESIS: hr near 0.6201 +- seed noise; 5-seed (42-46) mean+-std is the reported headline @ 195p, and check if the post-filter tightens the spread vs LPD-only 0.459+-0.029. BUDGET: identical to iter-28 (16ep ~1120s), max_train_s=1080, --time=00:30:00 -> 20-min comparable. SERIAL; recon saved., dc_mode=filtered, per_step_alpha=True, lpd_on=True, lpd_width=4, lpd_kernel=3, anisotropic_on_top=False, post_bilateral=True, post_n_bf=3, post_bf_kernel=7, post_bf_sigma_r=0.02", "comparison_image": "runs/breast-ct-claude-agentic-param-efficient-search-20260703-01/iterations/iter-0032/comparison.png"}
{"ts": "2026-07-07T19:26:52Z", "run_id": "breast-ct-claude-agentic-param-efficient-search-20260703-01", "iter": 31, "agent": "param_efficient-claude-agentic", "model": "claude-opus-4-8-1m", "change_class": "architecture", "status": "keep", "kept": true, "val_score": 0.9895534515380859, "headroom": 0.5586011417279202, "params_M": 0.000195, "train_n": 200, "rationale": "param_efficient-claude-agentic: reg_type=bilateral, bilateral_on_top=False, proj_filter_on=False, n_iter=30, learnable_alpha=True, alpha_init=0.1, foe_n_filters=24, foe_kernel=7, foe_n_bumps=31, n_bf=1, bf_multiscale=True, bf_sigmas=[0.8, 1.6, 3.2], bf_kernel=7, bf_sigma_r=0.02, bf_gain_init=0.0, epochs=16, cosine_lr=True, lr=0.005, max_train_s=1080, batch_size=4, train_n=200, val_n=200, display_min=0.0, display_max=0.05, seed=43, rationale=iter-31 SEED REPLICATE 1/4 of the LOCKED CHAMPION (filtered-DC K30 + LPD-combine W4 + 3-scale bilateral POST-filter sigma_r=0.02, 195 params, seed42=0.6201). Post-filter fully tuned (3 scales optimal, sigma_r=0.02 optimal). ONE KNOB: seed 42->43; all else byte-for-byte the champion. HYPOTHESIS: hr near 0.6201 +- seed noise; 5-seed (42-46) mean+-std is the reported headline @ 195p, and check if the post-filter tightens the spread vs LPD-only 0.459+-0.029. BUDGET: identical to iter-28 (16ep ~1120s), max_train_s=1080, --time=00:30:00 -> 20-min comparable. SERIAL; recon saved., dc_mode=filtered, per_step_alpha=True, lpd_on=True, lpd_width=4, lpd_kernel=3, anisotropic_on_top=False, post_bilateral=True, post_n_bf=3, post_bf_kernel=7, post_bf_sigma_r=0.02", "advice_for_others": "param_efficient-claude-agentic: reg_type=bilateral, bilateral_on_top=False, proj_filter_on=False, n_iter=30, learnable_alpha=True, alpha_init=0.1, foe_n_filters=24, foe_kernel=7, foe_n_bumps=31, n_bf=1, bf_multiscale=True, bf_sigmas=[0.8, 1.6, 3.2], bf_kernel=7, bf_sigma_r=0.02, bf_gain_init=0.0, epochs=16, cosine_lr=True, lr=0.005, max_train_s=1080, batch_size=4, train_n=200, val_n=200, display_min=0.0, display_max=0.05, seed=43, rationale=iter-31 SEED REPLICATE 1/4 of the LOCKED CHAMPION (filtered-DC K30 + LPD-combine W4 + 3-scale bilateral POST-filter sigma_r=0.02, 195 params, seed42=0.6201). Post-filter fully tuned (3 scales optimal, sigma_r=0.02 optimal). ONE KNOB: seed 42->43; all else byte-for-byte the champion. HYPOTHESIS: hr near 0.6201 +- seed noise; 5-seed (42-46) mean+-std is the reported headline @ 195p, and check if the post-filter tightens the spread vs LPD-only 0.459+-0.029. BUDGET: identical to iter-28 (16ep ~1120s), max_train_s=1080, --time=00:30:00 -> 20-min comparable. SERIAL; recon saved., dc_mode=filtered, per_step_alpha=True, lpd_on=True, lpd_width=4, lpd_kernel=3, anisotropic_on_top=False, post_bilateral=True, post_n_bf=3, post_bf_kernel=7, post_bf_sigma_r=0.02", "comparison_image": "runs/breast-ct-claude-agentic-param-efficient-search-20260703-01/iterations/iter-0031/comparison.png"}
