{"ts": "2026-07-05T22:34:24Z", "run_id": "breast-ct-claude-agentic-r2gaussian-search-20260703-01", "iter": 19, "agent": "r2gaussian-claude-agentic", "model": "claude-opus-4-8-1m", "change_class": "architecture", "status": "discard", "kept": false, "val_score": 0.9278493523597717, "headroom": 0.0, "params_M": 0.006144, "train_n": 400, "rationale": "r2gaussian-claude-agentic: val_n=15, gs_n_gaussians=1024, gs_n_iter=130, gs_lr_pos=0.005, gs_lr_scale=0.01, gs_lr_amp=0.01, gs_lr_rot=0.01, gs_amp_init=0.01, gs_scale_init=0.04, gs_tv_weight=0.0001, gs_n_clip=0.05, gs_init_from_fbp=True, gs_render=raster, gs_ssim_weight=0.3, seed=42, train_n=0, rationale=iter-19 (search-20260703-01) -- CEILING CONFIRMATION #11. SIX-BOX: hr pinned 0 at EVERY prior iter; best SSIM 0.9278 @ iter-6. R2-Gaussian is REGIME-BOUNDED on dense 128-view breast: the coarse anisotropic-Gaussian basis (1024 splats, 0.006M params) plateaus at SSIM ~0.928 / PSNR ~28.7 dB, ~7.3 dB BELOW the 128-view FBP baseline (PSNR 35.97), so the RMSE/PSNR-gated headroom stays 0 (reproduces findings.md 2026-06-03). All 7 lever families mapped+exhausted (steps FLAT, capacity +0.010, warm-start +0.039, SSIM-loss +0.073, SSIM-weight saturated, basis-scale FLAT, TV-reg FLAT); NONE moves hr off 0 -- the strongest (warm-start + SSIM-loss) got closest but stayed 7.3 dB short. The R2-G paper's regime is SPARSE-view CBCT (<=50 views) where FBP is weak; dense 128-view 2D CT is the wrong inductive bias. DECISION: empty-patch re-run of the iter-6 run-best config (warm-start + SSIM-loss@0.30, 1024G/130it) to confirm SSIM ~0.928 / hr=0 reproduces. BUDGET: ~660-1000s node-dependent, under the 1080 in-solver wall and 1800 SLURM wall, figure excluded. val_n=15 HELD CONSTANT. PREDICTION: SSIM ~0.928 (0.925-0.930), hr 0 -- faithful-but-regime-bounded negative result., gs_outer_wall_s=1080, gs_amp_init_max=0.05", "advice_for_others": "r2gaussian-claude-agentic: val_n=15, gs_n_gaussians=1024, gs_n_iter=130, gs_lr_pos=0.005, gs_lr_scale=0.01, gs_lr_amp=0.01, gs_lr_rot=0.01, gs_amp_init=0.01, gs_scale_init=0.04, gs_tv_weight=0.0001, gs_n_clip=0.05, gs_init_from_fbp=True, gs_render=raster, gs_ssim_weight=0.3, seed=42, train_n=0, rationale=iter-19 (search-20260703-01) -- CEILING CONFIRMATION #11. SIX-BOX: hr pinned 0 at EVERY prior iter; best SSIM 0.9278 @ iter-6. R2-Gaussian is REGIME-BOUNDED on dense 128-view breast: the coarse anisotropic-Gaussian basis (1024 splats, 0.006M params) plateaus at SSIM ~0.928 / PSNR ~28.7 dB, ~7.3 dB BELOW the 128-view FBP baseline (PSNR 35.97), so the RMSE/PSNR-gated headroom stays 0 (reproduces findings.md 2026-06-03). All 7 lever families mapped+exhausted (steps FLAT, capacity +0.010, warm-start +0.039, SSIM-loss +0.073, SSIM-weight saturated, basis-scale FLAT, TV-reg FLAT); NONE moves hr off 0 -- the strongest (warm-start + SSIM-loss) got closest but stayed 7.3 dB short. The R2-G paper's regime is SPARSE-view CBCT (<=50 views) where FBP is weak; dense 128-view 2D CT is the wrong inductive bias. DECISION: empty-patch re-run of the iter-6 run-best config (warm-start + SSIM-loss@0.30, 1024G/130it) to confirm SSIM ~0.928 / hr=0 reproduces. BUDGET: ~660-1000s node-dependent, under the 1080 in-solver wall and 1800 SLURM wall, figure excluded. val_n=15 HELD CONSTANT. PREDICTION: SSIM ~0.928 (0.925-0.930), hr 0 -- faithful-but-regime-bounded negative result., gs_outer_wall_s=1080, gs_amp_init_max=0.05", "comparison_image": "runs/breast-ct-claude-agentic-r2gaussian-search-20260703-01/iterations/iter-0019/comparison.png"}
{"ts": "2026-07-05T22:25:32Z", "run_id": "breast-ct-claude-agentic-naf-search-20260703-01", "iter": 4, "agent": "naf-claude-agentic", "model": "claude-opus-4-8-1m", "change_class": "architecture", "status": "discard", "kept": false, "val_score": 0.35450929403305054, "headroom": 0.0, "params_M": 0.070657, "train_n": 0, "rationale": "naf-claude-agentic: val_n=12, naf_n_freqs=8, naf_hidden=128, naf_layers=6, naf_n_iter=8000, naf_lr=0.01, naf_tv_weight=0.0001, naf_n_clip=0.05, naf_outer_wall_s=800, naf_per_scene_s=60.0, naf_encoding=fourier, seed=42, rationale=iter-4 breast-ct-claude-agentic-naf-search-20260703-01 (redone breast split train3600/val200/test200 seed20260703; val_n=12 CONSTANT for iters 2-20 per coordinator budget intervention 2026-07-05 -- first-12 of the 200-case breast val split, deterministic). SIX-BOX: (1) prior result: all iters so far hr=0 (iter-1 val_n=20 ssim0.355 PSNR6.26 in 970s, NOT a timeout -- a genuine converged fit). (2) failure mode: NAF per-scene INR recon is far below the 128-view breast LD-FBP baseline. (3) ONE knob changed: naf_layers 4->6. (4) hypothesis: iter-3 (hidden=256) hr=0. KNOB: deepen MLP 4->6 layers (more nonlinear capacity). HYPOTHESIS: depth over width may better compose posenc features into sharp edges. Expect hr=0 (capacity is not the limiter; the basis is). (5) wall: val_n=12 x per_scene 60.0s = ~720s < 20min. (6) serial, no user return.", "advice_for_others": "naf-claude-agentic: val_n=12, naf_n_freqs=8, naf_hidden=128, naf_layers=6, naf_n_iter=8000, naf_lr=0.01, naf_tv_weight=0.0001, naf_n_clip=0.05, naf_outer_wall_s=800, naf_per_scene_s=60.0, naf_encoding=fourier, seed=42, rationale=iter-4 breast-ct-claude-agentic-naf-search-20260703-01 (redone breast split train3600/val200/test200 seed20260703; val_n=12 CONSTANT for iters 2-20 per coordinator budget intervention 2026-07-05 -- first-12 of the 200-case breast val split, deterministic). SIX-BOX: (1) prior result: all iters so far hr=0 (iter-1 val_n=20 ssim0.355 PSNR6.26 in 970s, NOT a timeout -- a genuine converged fit). (2) failure mode: NAF per-scene INR recon is far below the 128-view breast LD-FBP baseline. (3) ONE knob changed: naf_layers 4->6. (4) hypothesis: iter-3 (hidden=256) hr=0. KNOB: deepen MLP 4->6 layers (more nonlinear capacity). HYPOTHESIS: depth over width may better compose posenc features into sharp edges. Expect hr=0 (capacity is not the limiter; the basis is). (5) wall: val_n=12 x per_scene 60.0s = ~720s < 20min. (6) serial, no user return.", "comparison_image": "runs/breast-ct-claude-agentic-naf-search-20260703-01/iterations/iter-0004/comparison.png"}
{"ts": "2026-07-05T22:20:41Z", "run_id": "breast-ct-claude-agentic-tv-iterative-supervised-search-20260703-01", "iter": 16, "agent": "tv_iterative_supervised-claude-agentic", "model": "claude-opus-4-8-1m", "change_class": "architecture", "status": "keep", "kept": true, "val_score": 0.957617461681366, "headroom": 0.1494552979217223, "params_M": 2e-05, "train_n": 400, "rationale": "tv_iterative_supervised-claude-agentic: val_n=200, val_chunk=5, train_n=400, epochs=20, batch_size=1, lr=0.005, tv_K=10, tv_step_init=0.001, tv_lambda_init=1.0, tv_share_steps=False, tv_eps=1e-06, lambda_neg=1.0, loss_base=mse, grad_clip=10.0, rationale=tv_iterative_supervised iter-16 (breast_ct). GRAD_CLIP loosen. The 20 log-scalars are trained under grad_clip=1.0 which may throttle the lambda schedule's growth (lambda climbs to ~3400 -- large log-space moves that clipping could slow). ONE KNOB vs iter-12 (hr=0.1495): grad_clip 1.0->10.0. HYPOTHESIS: looser clipping lets the lambda schedule reach its operating point faster/further within the epoch budget so hr rises above 0.1495. FALSIFIER: hr ~0.15 -> clipping wasn't the limiter, ceiling confirmed. BUDGET: iter-12 under wall.", "advice_for_others": "tv_iterative_supervised-claude-agentic: val_n=200, val_chunk=5, train_n=400, epochs=20, batch_size=1, lr=0.005, tv_K=10, tv_step_init=0.001, tv_lambda_init=1.0, tv_share_steps=False, tv_eps=1e-06, lambda_neg=1.0, loss_base=mse, grad_clip=10.0, rationale=tv_iterative_supervised iter-16 (breast_ct). GRAD_CLIP loosen. The 20 log-scalars are trained under grad_clip=1.0 which may throttle the lambda schedule's growth (lambda climbs to ~3400 -- large log-space moves that clipping could slow). ONE KNOB vs iter-12 (hr=0.1495): grad_clip 1.0->10.0. HYPOTHESIS: looser clipping lets the lambda schedule reach its operating point faster/further within the epoch budget so hr rises above 0.1495. FALSIFIER: hr ~0.15 -> clipping wasn't the limiter, ceiling confirmed. BUDGET: iter-12 under wall.", "comparison_image": "runs/breast-ct-claude-agentic-tv-iterative-supervised-search-20260703-01/iterations/iter-0016/comparison.png"}
{"ts": "2026-07-05T22:19:57Z", "run_id": "breast-ct-claude-agentic-dual-domain-bilateral-n2i-search-20260703-01", "iter": 12, "agent": "dual_domain_bilateral_n2i-claude-agentic", "model": "claude-opus-4-8-1m", "change_class": "architecture", "status": "keep", "kept": true, "val_score": 0.9299665689468384, "headroom": 0.08949938767956633, "params_M": 6e-06, "train_n": 400, "rationale": "dual_domain_bilateral_n2i-claude-agentic: warm_start=True, pretrain_epochs=2, train_n=400, n_iter=30, val_n=200, batch_size=1, grad_clip=1.0, lr=0.001, proj_n_bf=1, img_n_bf=1, img_sr=0.0002, outer_wall_s=900, seed=42, rationale=iter-12 dual_domain_bilateral_n2i, ONE-KNOB: per-scene Adam lr 0.002->0.001 (continue down the lr axis), on the iter-11 NEW CHAMPION base (img_sr=0.0002, n_iter=30, img_kernel=7). BREAKTHROUGH#2 PRIOR: iter-11 (lr 5e-3->2e-3) hr 0.126->0.1835 (+0.057!), PSNR 39.57->40.16, recon_rmse 8.60e-4->8.04e-4 -- CONFIRMED lr=5e-3 was OVERSHOOTING each 30-step per-scene fit toward the noisy 64-view half-target; a gentler lr settles at the edge-preserving denoised-but-sharp optimum. (SSIM dipped 0.9606->0.9537 but hr is RMSE-based and RMSE clearly improved -> real gain.) HYPOTHESIS: the lr axis is monotone-improving so far; lr=1e-3 damps the drift-toward-noise even more, converging tighter to the edge-preserving optimum -> hr climbs above 0.1835. RISK: too-low lr -> the 30-step fit UNDER-converges from the warm-start init (barely denoises) -> recon ~ warm-start-generic, hr regresses. This iter locates the lr optimum: if hr>0.1835 keep lowering (5e-4); if hr<0.1835 the optimum is ~2e-3 and I bracket (1.5e-3). BUDGET: same steps, ~940s, val_n=200. ONE knob: lr 0.002->0.001.", "advice_for_others": "dual_domain_bilateral_n2i-claude-agentic: warm_start=True, pretrain_epochs=2, train_n=400, n_iter=30, val_n=200, batch_size=1, grad_clip=1.0, lr=0.001, proj_n_bf=1, img_n_bf=1, img_sr=0.0002, outer_wall_s=900, seed=42, rationale=iter-12 dual_domain_bilateral_n2i, ONE-KNOB: per-scene Adam lr 0.002->0.001 (continue down the lr axis), on the iter-11 NEW CHAMPION base (img_sr=0.0002, n_iter=30, img_kernel=7). BREAKTHROUGH#2 PRIOR: iter-11 (lr 5e-3->2e-3) hr 0.126->0.1835 (+0.057!), PSNR 39.57->40.16, recon_rmse 8.60e-4->8.04e-4 -- CONFIRMED lr=5e-3 was OVERSHOOTING each 30-step per-scene fit toward the noisy 64-view half-target; a gentler lr settles at the edge-preserving denoised-but-sharp optimum. (SSIM dipped 0.9606->0.9537 but hr is RMSE-based and RMSE clearly improved -> real gain.) HYPOTHESIS: the lr axis is monotone-improving so far; lr=1e-3 damps the drift-toward-noise even more, converging tighter to the edge-preserving optimum -> hr climbs above 0.1835. RISK: too-low lr -> the 30-step fit UNDER-converges from the warm-start init (barely denoises) -> recon ~ warm-start-generic, hr regresses. This iter locates the lr optimum: if hr>0.1835 keep lowering (5e-4); if hr<0.1835 the optimum is ~2e-3 and I bracket (1.5e-3). BUDGET: same steps, ~940s, val_n=200. ONE knob: lr 0.002->0.001.", "comparison_image": "runs/breast-ct-claude-agentic-dual-domain-bilateral-n2i-search-20260703-01/iterations/iter-0012/comparison.png"}
{"ts": "2026-07-05T22:17:27Z", "run_id": "breast-ct-claude-agentic-r2gaussian-search-20260703-01", "iter": 18, "agent": "r2gaussian-claude-agentic", "model": "claude-opus-4-8-1m", "change_class": "architecture", "status": "discard", "kept": false, "val_score": 0.9277002215385437, "headroom": 0.0, "params_M": 0.006144, "train_n": 400, "rationale": "r2gaussian-claude-agentic: val_n=15, gs_n_gaussians=1024, gs_n_iter=130, gs_lr_pos=0.005, gs_lr_scale=0.01, gs_lr_amp=0.01, gs_lr_rot=0.01, gs_amp_init=0.01, gs_scale_init=0.04, gs_tv_weight=0.0001, gs_n_clip=0.05, gs_init_from_fbp=True, gs_render=raster, gs_ssim_weight=0.3, seed=42, train_n=0, rationale=iter-18 (search-20260703-01) -- CEILING CONFIRMATION #10. SIX-BOX: hr pinned 0 at EVERY prior iter; best SSIM 0.9278 @ iter-6. R2-Gaussian is REGIME-BOUNDED on dense 128-view breast: the coarse anisotropic-Gaussian basis (1024 splats, 0.006M params) plateaus at SSIM ~0.928 / PSNR ~28.7 dB, ~7.3 dB BELOW the 128-view FBP baseline (PSNR 35.97), so the RMSE/PSNR-gated headroom stays 0 (reproduces findings.md 2026-06-03). All 7 lever families mapped+exhausted (steps FLAT, capacity +0.010, warm-start +0.039, SSIM-loss +0.073, SSIM-weight saturated, basis-scale FLAT, TV-reg FLAT); NONE moves hr off 0 -- the strongest (warm-start + SSIM-loss) got closest but stayed 7.3 dB short. The R2-G paper's regime is SPARSE-view CBCT (<=50 views) where FBP is weak; dense 128-view 2D CT is the wrong inductive bias. DECISION: empty-patch re-run of the iter-6 run-best config (warm-start + SSIM-loss@0.30, 1024G/130it) to confirm SSIM ~0.928 / hr=0 reproduces. BUDGET: ~660-1000s node-dependent, under the 1080 in-solver wall and 1800 SLURM wall, figure excluded. val_n=15 HELD CONSTANT. PREDICTION: SSIM ~0.928 (0.925-0.930), hr 0 -- faithful-but-regime-bounded negative result., gs_outer_wall_s=1080, gs_amp_init_max=0.05", "advice_for_others": "r2gaussian-claude-agentic: val_n=15, gs_n_gaussians=1024, gs_n_iter=130, gs_lr_pos=0.005, gs_lr_scale=0.01, gs_lr_amp=0.01, gs_lr_rot=0.01, gs_amp_init=0.01, gs_scale_init=0.04, gs_tv_weight=0.0001, gs_n_clip=0.05, gs_init_from_fbp=True, gs_render=raster, gs_ssim_weight=0.3, seed=42, train_n=0, rationale=iter-18 (search-20260703-01) -- CEILING CONFIRMATION #10. SIX-BOX: hr pinned 0 at EVERY prior iter; best SSIM 0.9278 @ iter-6. R2-Gaussian is REGIME-BOUNDED on dense 128-view breast: the coarse anisotropic-Gaussian basis (1024 splats, 0.006M params) plateaus at SSIM ~0.928 / PSNR ~28.7 dB, ~7.3 dB BELOW the 128-view FBP baseline (PSNR 35.97), so the RMSE/PSNR-gated headroom stays 0 (reproduces findings.md 2026-06-03). All 7 lever families mapped+exhausted (steps FLAT, capacity +0.010, warm-start +0.039, SSIM-loss +0.073, SSIM-weight saturated, basis-scale FLAT, TV-reg FLAT); NONE moves hr off 0 -- the strongest (warm-start + SSIM-loss) got closest but stayed 7.3 dB short. The R2-G paper's regime is SPARSE-view CBCT (<=50 views) where FBP is weak; dense 128-view 2D CT is the wrong inductive bias. DECISION: empty-patch re-run of the iter-6 run-best config (warm-start + SSIM-loss@0.30, 1024G/130it) to confirm SSIM ~0.928 / hr=0 reproduces. BUDGET: ~660-1000s node-dependent, under the 1080 in-solver wall and 1800 SLURM wall, figure excluded. val_n=15 HELD CONSTANT. PREDICTION: SSIM ~0.928 (0.925-0.930), hr 0 -- faithful-but-regime-bounded negative result., gs_outer_wall_s=1080, gs_amp_init_max=0.05", "comparison_image": "runs/breast-ct-claude-agentic-r2gaussian-search-20260703-01/iterations/iter-0018/comparison.png"}
{"ts": "2026-07-05T22:08:17Z", "run_id": "breast-ct-claude-agentic-tv-iterative-supervised-search-20260703-01", "iter": 15, "agent": "tv_iterative_supervised-claude-agentic", "model": "claude-opus-4-8-1m", "change_class": "architecture", "status": "discard", "kept": false, "val_score": 0.9199217557907104, "headroom": 0.0, "params_M": 2e-05, "train_n": 400, "rationale": "tv_iterative_supervised-claude-agentic: val_n=200, val_chunk=5, train_n=400, epochs=20, batch_size=1, lr=0.005, tv_K=10, tv_step_init=0.003, tv_lambda_init=1.0, tv_share_steps=False, tv_eps=1e-06, lambda_neg=1.0, loss_base=mse, grad_clip=1.0, rationale=tv_iterative_supervised iter-15 (breast_ct). STEP x active-lambda interaction. With lambda now ACTIVE (the productive lever), re-test a larger step to see if ANY data-consistency update survives alongside the TV denoising. Earlier step probes (iters 2/3) were at DEAD lambda=1e-3 where step->0; now lambda=1.0 carries denoising and a larger step MIGHT add data-consistency instead of collapsing. ONE KNOB vs iter-12 (K=10, lambda=1.0, epochs=20, step=1e-3, hr=0.1495): tv_step_init 1e-3->3e-3. HYPOTHESIS: at 3e-3 the per-iter data-gradient update is large enough to refine data-consistency (not just TV-smooth) so hr rises above 0.1495; iter-1 showed 1e-2 diverges, so 3e-3 is the untested middle. FALSIFIER: if step still collapses to ~0 (hr~0.15) OR diverges (hr drops), data-consistency is structurally unavailable and TV-denoising ~0.15 is the ceiling. BUDGET: iter-12 epochs=20 under wall.", "advice_for_others": "tv_iterative_supervised-claude-agentic: val_n=200, val_chunk=5, train_n=400, epochs=20, batch_size=1, lr=0.005, tv_K=10, tv_step_init=0.003, tv_lambda_init=1.0, tv_share_steps=False, tv_eps=1e-06, lambda_neg=1.0, loss_base=mse, grad_clip=1.0, rationale=tv_iterative_supervised iter-15 (breast_ct). STEP x active-lambda interaction. With lambda now ACTIVE (the productive lever), re-test a larger step to see if ANY data-consistency update survives alongside the TV denoising. Earlier step probes (iters 2/3) were at DEAD lambda=1e-3 where step->0; now lambda=1.0 carries denoising and a larger step MIGHT add data-consistency instead of collapsing. ONE KNOB vs iter-12 (K=10, lambda=1.0, epochs=20, step=1e-3, hr=0.1495): tv_step_init 1e-3->3e-3. HYPOTHESIS: at 3e-3 the per-iter data-gradient update is large enough to refine data-consistency (not just TV-smooth) so hr rises above 0.1495; iter-1 showed 1e-2 diverges, so 3e-3 is the untested middle. FALSIFIER: if step still collapses to ~0 (hr~0.15) OR diverges (hr drops), data-consistency is structurally unavailable and TV-denoising ~0.15 is the ceiling. BUDGET: iter-12 epochs=20 under wall.", "comparison_image": "runs/breast-ct-claude-agentic-tv-iterative-supervised-search-20260703-01/iterations/iter-0015/comparison.png"}
{"ts": "2026-07-05T22:00:26Z", "run_id": "breast-ct-claude-agentic-r2gaussian-search-20260703-01", "iter": 17, "agent": "r2gaussian-claude-agentic", "model": "claude-opus-4-8-1m", "change_class": "architecture", "status": "discard", "kept": false, "val_score": 0.9277157783508301, "headroom": 0.0, "params_M": 0.006144, "train_n": 400, "rationale": "r2gaussian-claude-agentic: val_n=15, gs_n_gaussians=1024, gs_n_iter=130, gs_lr_pos=0.005, gs_lr_scale=0.01, gs_lr_amp=0.01, gs_lr_rot=0.01, gs_amp_init=0.01, gs_scale_init=0.04, gs_tv_weight=0.0001, gs_n_clip=0.05, gs_init_from_fbp=True, gs_render=raster, gs_ssim_weight=0.3, seed=42, train_n=0, rationale=iter-17 (search-20260703-01) -- CEILING CONFIRMATION #9. SIX-BOX: hr pinned 0 at EVERY prior iter; best SSIM 0.9278 @ iter-6. R2-Gaussian is REGIME-BOUNDED on dense 128-view breast: the coarse anisotropic-Gaussian basis (1024 splats, 0.006M params) plateaus at SSIM ~0.928 / PSNR ~28.7 dB, ~7.3 dB BELOW the 128-view FBP baseline (PSNR 35.97), so the RMSE/PSNR-gated headroom stays 0 (reproduces findings.md 2026-06-03). All 7 lever families mapped+exhausted (steps FLAT, capacity +0.010, warm-start +0.039, SSIM-loss +0.073, SSIM-weight saturated, basis-scale FLAT, TV-reg FLAT); NONE moves hr off 0 -- the strongest (warm-start + SSIM-loss) got closest but stayed 7.3 dB short. The R2-G paper's regime is SPARSE-view CBCT (<=50 views) where FBP is weak; dense 128-view 2D CT is the wrong inductive bias. DECISION: empty-patch re-run of the iter-6 run-best config (warm-start + SSIM-loss@0.30, 1024G/130it) to confirm SSIM ~0.928 / hr=0 reproduces. BUDGET: ~660-1000s node-dependent, under the 1080 in-solver wall and 1800 SLURM wall, figure excluded. val_n=15 HELD CONSTANT. PREDICTION: SSIM ~0.928 (0.925-0.930), hr 0 -- faithful-but-regime-bounded negative result., gs_outer_wall_s=1080, gs_amp_init_max=0.05", "advice_for_others": "r2gaussian-claude-agentic: val_n=15, gs_n_gaussians=1024, gs_n_iter=130, gs_lr_pos=0.005, gs_lr_scale=0.01, gs_lr_amp=0.01, gs_lr_rot=0.01, gs_amp_init=0.01, gs_scale_init=0.04, gs_tv_weight=0.0001, gs_n_clip=0.05, gs_init_from_fbp=True, gs_render=raster, gs_ssim_weight=0.3, seed=42, train_n=0, rationale=iter-17 (search-20260703-01) -- CEILING CONFIRMATION #9. SIX-BOX: hr pinned 0 at EVERY prior iter; best SSIM 0.9278 @ iter-6. R2-Gaussian is REGIME-BOUNDED on dense 128-view breast: the coarse anisotropic-Gaussian basis (1024 splats, 0.006M params) plateaus at SSIM ~0.928 / PSNR ~28.7 dB, ~7.3 dB BELOW the 128-view FBP baseline (PSNR 35.97), so the RMSE/PSNR-gated headroom stays 0 (reproduces findings.md 2026-06-03). All 7 lever families mapped+exhausted (steps FLAT, capacity +0.010, warm-start +0.039, SSIM-loss +0.073, SSIM-weight saturated, basis-scale FLAT, TV-reg FLAT); NONE moves hr off 0 -- the strongest (warm-start + SSIM-loss) got closest but stayed 7.3 dB short. The R2-G paper's regime is SPARSE-view CBCT (<=50 views) where FBP is weak; dense 128-view 2D CT is the wrong inductive bias. DECISION: empty-patch re-run of the iter-6 run-best config (warm-start + SSIM-loss@0.30, 1024G/130it) to confirm SSIM ~0.928 / hr=0 reproduces. BUDGET: ~660-1000s node-dependent, under the 1080 in-solver wall and 1800 SLURM wall, figure excluded. val_n=15 HELD CONSTANT. PREDICTION: SSIM ~0.928 (0.925-0.930), hr 0 -- faithful-but-regime-bounded negative result., gs_outer_wall_s=1080, gs_amp_init_max=0.05", "comparison_image": "runs/breast-ct-claude-agentic-r2gaussian-search-20260703-01/iterations/iter-0017/comparison.png"}
