{"ts": "2026-07-07T10:50:45Z", "run_id": "breast-ct-claude-agentic-param-efficient-search-20260703-01", "iter": 24, "agent": "param_efficient-claude-agentic", "model": "claude-opus-4-8-1m", "change_class": "architecture", "status": "keep", "kept": true, "val_score": 0.9600307941436768, "headroom": 0.24343088498783083, "params_M": 0.000187, "train_n": 200, "rationale": "param_efficient-claude-agentic: reg_type=bilateral, bilateral_on_top=False, proj_filter_on=False, n_iter=30, learnable_alpha=True, alpha_init=0.1, foe_n_filters=24, foe_kernel=7, foe_n_bumps=31, n_bf=1, bf_multiscale=True, bf_sigmas=[0.8, 1.6, 3.2], bf_kernel=7, bf_sigma_r=0.02, bf_gain_init=0.0, epochs=16, cosine_lr=True, lr=0.005, max_train_s=1080, batch_size=4, train_n=200, val_n=200, display_min=0.0, display_max=0.05, seed=42, rationale=iter-24 param_efficient breast -- WU-COMBINATION #2 (LAST): BAND-SELECTIVE PROX on x between DC steps (frequency-selective regularizer, solver edit). SIX-BOX: (1) PRIOR: champion LPD-combine W=4 filtered-DC K=30 = 0.5047 @ 183p. Wu combos so far: init NULL (iter-22, 0.4768), band-weighted DC REGRESSED (iter-23, 0.3202 -- reshaping the ramp breaks the projector inverse). Prox capacity also fought filtered-DC (iters13-14, hr 0.0) BUT those were ISOTROPIC (FoE/bilateral); a FREQUENCY-SELECTIVE prox is a genuinely distinct test. (2) FAILURE MODE (to test): can a per-band spectral gain on the ITERATE (not the DC filter) suppress streak-band energy in x without breaking the DC inverse? (3) ONE KNOB (architectural): band_prox=True -- I added a BandProx: decompose x into 4 radial 2D-freq bands, add Sum_b g_b*band_b(x) AFTER each DC step, g_b ZERO-INIT => x_out==x at init => pipeline == the 0.5047 champion BYTE-FOR-BYTE. +4 params -> 187 total. All else byte-for-byte iter-15 (LPD W=4, filtered-DC K=30, seed42). (4) HYPOTHESIS: a frequency-selective gain on the reconstruction can boost/suppress specific spectral bands (e.g. attenuate the streak band, boost detail band) WITHOUT touching the DC filter's projector inverse -> hr climbs past 0.5047. OR (likely, given iters13-14) any prox between DC steps fights the filtered-DC -> null/regress, completing the Wu exploration. (5) BUDGET: band prox = 1 fft2/ifft2 per step (moderate at 512^2); iter-15 finished 16ep in 1020s -> expect ~10-14ep; train_n=200, max_train_s=1080, --time=00:30:00, 200-val -> 20-min comparable. (6) SERIAL; iter-25: Wu exploration COMPLETE after this -> finish champion seed replicates 45/46 -> mean+-std -> FINAL REPORT., dc_mode=filtered, per_step_alpha=True, lpd_on=True, lpd_width=4, lpd_kernel=3, anisotropic_on_top=False, band_prox=True, band_prox_n_bands=4", "advice_for_others": "param_efficient-claude-agentic: reg_type=bilateral, bilateral_on_top=False, proj_filter_on=False, n_iter=30, learnable_alpha=True, alpha_init=0.1, foe_n_filters=24, foe_kernel=7, foe_n_bumps=31, n_bf=1, bf_multiscale=True, bf_sigmas=[0.8, 1.6, 3.2], bf_kernel=7, bf_sigma_r=0.02, bf_gain_init=0.0, epochs=16, cosine_lr=True, lr=0.005, max_train_s=1080, batch_size=4, train_n=200, val_n=200, display_min=0.0, display_max=0.05, seed=42, rationale=iter-24 param_efficient breast -- WU-COMBINATION #2 (LAST): BAND-SELECTIVE PROX on x between DC steps (frequency-selective regularizer, solver edit). SIX-BOX: (1) PRIOR: champion LPD-combine W=4 filtered-DC K=30 = 0.5047 @ 183p. Wu combos so far: init NULL (iter-22, 0.4768), band-weighted DC REGRESSED (iter-23, 0.3202 -- reshaping the ramp breaks the projector inverse). Prox capacity also fought filtered-DC (iters13-14, hr 0.0) BUT those were ISOTROPIC (FoE/bilateral); a FREQUENCY-SELECTIVE prox is a genuinely distinct test. (2) FAILURE MODE (to test): can a per-band spectral gain on the ITERATE (not the DC filter) suppress streak-band energy in x without breaking the DC inverse? (3) ONE KNOB (architectural): band_prox=True -- I added a BandProx: decompose x into 4 radial 2D-freq bands, add Sum_b g_b*band_b(x) AFTER each DC step, g_b ZERO-INIT => x_out==x at init => pipeline == the 0.5047 champion BYTE-FOR-BYTE. +4 params -> 187 total. All else byte-for-byte iter-15 (LPD W=4, filtered-DC K=30, seed42). (4) HYPOTHESIS: a frequency-selective gain on the reconstruction can boost/suppress specific spectral bands (e.g. attenuate the streak band, boost detail band) WITHOUT touching the DC filter's projector inverse -> hr climbs past 0.5047. OR (likely, given iters13-14) any prox between DC steps fights the filtered-DC -> null/regress, completing the Wu exploration. (5) BUDGET: band prox = 1 fft2/ifft2 per step (moderate at 512^2); iter-15 finished 16ep in 1020s -> expect ~10-14ep; train_n=200, max_train_s=1080, --time=00:30:00, 200-val -> 20-min comparable. (6) SERIAL; iter-25: Wu exploration COMPLETE after this -> finish champion seed replicates 45/46 -> mean+-std -> FINAL REPORT., dc_mode=filtered, per_step_alpha=True, lpd_on=True, lpd_width=4, lpd_kernel=3, anisotropic_on_top=False, band_prox=True, band_prox_n_bands=4", "comparison_image": "runs/breast-ct-claude-agentic-param-efficient-search-20260703-01/iterations/iter-0024/comparison.png"}
{"ts": "2026-07-07T10:10:52Z", "run_id": "breast-ct-claude-agentic-param-efficient-search-20260703-01", "iter": 23, "agent": "param_efficient-claude-agentic", "model": "claude-opus-4-8-1m", "change_class": "architecture", "status": "keep", "kept": true, "val_score": 0.9677989482879639, "headroom": 0.32016780576604487, "params_M": 0.000189, "train_n": 200, "rationale": "param_efficient-claude-agentic: reg_type=bilateral, bilateral_on_top=False, proj_filter_on=False, n_iter=30, learnable_alpha=True, alpha_init=0.1, foe_n_filters=24, foe_kernel=7, foe_n_bumps=31, n_bf=1, bf_multiscale=True, bf_sigmas=[0.8, 1.6, 3.2], bf_kernel=7, bf_sigma_r=0.02, bf_gain_init=0.0, epochs=16, cosine_lr=True, lr=0.005, max_train_s=1080, batch_size=4, train_n=200, val_n=200, display_min=0.0, display_max=0.05, seed=42, rationale=iter-23 param_efficient breast -- WU-COMBINATION #1: BAND-WEIGHTED filtered-DC (frequency-selective DC, solver edit). SIX-BOX: (1) PRIOR: champion = LPD-combine W=4 filtered-DC K=30 = 0.5047 @ 183p (seed42). The filtered-DC applies a UNIFORM ramp/Hann filter fbp(Rx-g) EVERY step; but sparse-view streaks have a characteristic spectral signature a learned per-band weighting could target. Wu-init (iter-22) was a null for INITIALIZATION, but Wu's distinctive value is FREQUENCY-BAND SELECTIVITY, which the uniform ramp lacks. (2) FAILURE MODE: uniform ramp-filtered DC cannot down-weight streak-frequency components while preserving detail-frequency. (3) ONE KNOB (architectural): dc_mode 'filtered'->'band' -- I added a BandWeightedDC module: it reweights the residual spectrum by Sum_i s_i*tri_i(f) (tri_i = triangular partition-of-unity band windows, Sum tri_i=1) BEFORE the projector's fbp. s_i init 1.0 => reweight == identity => dc == fbp(resid) == the 0.5047 champion BYTE-FOR-BYTE at init (no regression). +6 band-scale params -> 189 total. All else byte-for-byte iter-15 (LPD W=4, K=30, seed42). (4) HYPOTHESIS: a learned per-band DC filter lets each of the K=30 DC corrections down-weight the streak-frequency band while preserving fibroglandular detail frequencies -> hr climbs past 0.5047, because frequency-selectivity is a lever uniform filtered-DC lacks. OR the s_i train back toward 1.0 (uniform ramp already captures the useful spectrum) -> clean null. (5) BUDGET: band reweight = 1 FFT/iFFT per step (cheap); iter-15 finished 16ep in 1020s -> expect ~14-16ep; train_n=200, max_train_s=1080, --time=00:30:00, 200-val -> 20-min comparable. (6) SERIAL; iter-24: if band-DC helps, tune n_bands; else try Wu band-selective PROX (#2) or report the null; then finish champion seed replicates., dc_mode=band, per_step_alpha=True, lpd_on=True, lpd_width=4, lpd_kernel=3, anisotropic_on_top=False, band_dc_n_bands=6", "advice_for_others": "param_efficient-claude-agentic: reg_type=bilateral, bilateral_on_top=False, proj_filter_on=False, n_iter=30, learnable_alpha=True, alpha_init=0.1, foe_n_filters=24, foe_kernel=7, foe_n_bumps=31, n_bf=1, bf_multiscale=True, bf_sigmas=[0.8, 1.6, 3.2], bf_kernel=7, bf_sigma_r=0.02, bf_gain_init=0.0, epochs=16, cosine_lr=True, lr=0.005, max_train_s=1080, batch_size=4, train_n=200, val_n=200, display_min=0.0, display_max=0.05, seed=42, rationale=iter-23 param_efficient breast -- WU-COMBINATION #1: BAND-WEIGHTED filtered-DC (frequency-selective DC, solver edit). SIX-BOX: (1) PRIOR: champion = LPD-combine W=4 filtered-DC K=30 = 0.5047 @ 183p (seed42). The filtered-DC applies a UNIFORM ramp/Hann filter fbp(Rx-g) EVERY step; but sparse-view streaks have a characteristic spectral signature a learned per-band weighting could target. Wu-init (iter-22) was a null for INITIALIZATION, but Wu's distinctive value is FREQUENCY-BAND SELECTIVITY, which the uniform ramp lacks. (2) FAILURE MODE: uniform ramp-filtered DC cannot down-weight streak-frequency components while preserving detail-frequency. (3) ONE KNOB (architectural): dc_mode 'filtered'->'band' -- I added a BandWeightedDC module: it reweights the residual spectrum by Sum_i s_i*tri_i(f) (tri_i = triangular partition-of-unity band windows, Sum tri_i=1) BEFORE the projector's fbp. s_i init 1.0 => reweight == identity => dc == fbp(resid) == the 0.5047 champion BYTE-FOR-BYTE at init (no regression). +6 band-scale params -> 189 total. All else byte-for-byte iter-15 (LPD W=4, K=30, seed42). (4) HYPOTHESIS: a learned per-band DC filter lets each of the K=30 DC corrections down-weight the streak-frequency band while preserving fibroglandular detail frequencies -> hr climbs past 0.5047, because frequency-selectivity is a lever uniform filtered-DC lacks. OR the s_i train back toward 1.0 (uniform ramp already captures the useful spectrum) -> clean null. (5) BUDGET: band reweight = 1 FFT/iFFT per step (cheap); iter-15 finished 16ep in 1020s -> expect ~14-16ep; train_n=200, max_train_s=1080, --time=00:30:00, 200-val -> 20-min comparable. (6) SERIAL; iter-24: if band-DC helps, tune n_bands; else try Wu band-selective PROX (#2) or report the null; then finish champion seed replicates., dc_mode=band, per_step_alpha=True, lpd_on=True, lpd_width=4, lpd_kernel=3, anisotropic_on_top=False, band_dc_n_bands=6", "comparison_image": "runs/breast-ct-claude-agentic-param-efficient-search-20260703-01/iterations/iter-0023/comparison.png"}
{"ts": "2026-07-07T09:50:20Z", "run_id": "breast-ct-claude-agentic-param-efficient-search-20260703-01", "iter": 19, "agent": "param_efficient-claude-agentic", "model": "claude-opus-4-8-1m", "change_class": "architecture", "status": "keep", "kept": true, "val_score": 0.9755021929740906, "headroom": 0.4626517369051498, "params_M": 0.000183, "train_n": 200, "rationale": "param_efficient-claude-agentic: reg_type=bilateral, bilateral_on_top=False, proj_filter_on=False, n_iter=30, learnable_alpha=True, alpha_init=0.1, foe_n_filters=24, foe_kernel=7, foe_n_bumps=31, n_bf=1, bf_multiscale=True, bf_sigmas=[0.8, 1.6, 3.2], bf_kernel=7, bf_sigma_r=0.02, bf_gain_init=0.0, epochs=16, cosine_lr=True, lr=0.005, max_train_s=1080, batch_size=4, train_n=200, val_n=200, display_min=0.0, display_max=0.05, seed=44, rationale=iter-19 param_efficient breast -- SEED REPLICATE 2/4 of the CHAMPION (LPD-combine W=4, filtered-DC K=30, 183 params). SIX-BOX: (1) PRIOR: architecture search COMPLETE; champion = iter-15 (seed 42) hr 0.5047 @ 183p. Adjoint/config capped ~0.26; filtered-DC broke it (0.4345 @ 13p); prox capacity fought it (0.0); LPD learned-combination WON (0.5047); W=8 and sinogram-dual both regressed -> W=4 primal-only is the optimum. (2) FAILURE MODE: single-seed hr is noise-confounded (breast seed variance is large, ~+-0.05 per the DL-tier solvers) -- need mean+-std. (3) ONE KNOB: seed 42 -> 44 (replicate 2/4). ALL else byte-for-byte the champion. (4) HYPOTHESIS: hr lands near 0.5047 +- seed noise; the 5-seed (42-46) mean+-std is the REPORTED headline number @ 183 params. (5) BUDGET: identical to iter-15 (16ep in ~1020s), max_train_s=1080, --time=00:30:00, 200-val -> 20-min comparable. (6) SERIAL; next replicate self-dispatches; recon_raw.npz (pred/truth/baseline) saved to the iter dir for test-scorability., dc_mode=filtered, per_step_alpha=True, lpd_on=True, lpd_width=4, lpd_kernel=3, anisotropic_on_top=False", "advice_for_others": "param_efficient-claude-agentic: reg_type=bilateral, bilateral_on_top=False, proj_filter_on=False, n_iter=30, learnable_alpha=True, alpha_init=0.1, foe_n_filters=24, foe_kernel=7, foe_n_bumps=31, n_bf=1, bf_multiscale=True, bf_sigmas=[0.8, 1.6, 3.2], bf_kernel=7, bf_sigma_r=0.02, bf_gain_init=0.0, epochs=16, cosine_lr=True, lr=0.005, max_train_s=1080, batch_size=4, train_n=200, val_n=200, display_min=0.0, display_max=0.05, seed=44, rationale=iter-19 param_efficient breast -- SEED REPLICATE 2/4 of the CHAMPION (LPD-combine W=4, filtered-DC K=30, 183 params). SIX-BOX: (1) PRIOR: architecture search COMPLETE; champion = iter-15 (seed 42) hr 0.5047 @ 183p. Adjoint/config capped ~0.26; filtered-DC broke it (0.4345 @ 13p); prox capacity fought it (0.0); LPD learned-combination WON (0.5047); W=8 and sinogram-dual both regressed -> W=4 primal-only is the optimum. (2) FAILURE MODE: single-seed hr is noise-confounded (breast seed variance is large, ~+-0.05 per the DL-tier solvers) -- need mean+-std. (3) ONE KNOB: seed 42 -> 44 (replicate 2/4). ALL else byte-for-byte the champion. (4) HYPOTHESIS: hr lands near 0.5047 +- seed noise; the 5-seed (42-46) mean+-std is the REPORTED headline number @ 183 params. (5) BUDGET: identical to iter-15 (16ep in ~1020s), max_train_s=1080, --time=00:30:00, 200-val -> 20-min comparable. (6) SERIAL; next replicate self-dispatches; recon_raw.npz (pred/truth/baseline) saved to the iter dir for test-scorability., dc_mode=filtered, per_step_alpha=True, lpd_on=True, lpd_width=4, lpd_kernel=3, anisotropic_on_top=False", "comparison_image": "runs/breast-ct-claude-agentic-param-efficient-search-20260703-01/iterations/iter-0019/comparison.png"}
{"ts": "2026-07-07T09:06:49Z", "run_id": "breast-ct-claude-agentic-param-efficient-search-20260703-01", "iter": 22, "agent": "param_efficient-claude-agentic", "model": "claude-opus-4-8-1m", "change_class": "architecture", "status": "keep", "kept": true, "val_score": 0.9689329266548157, "headroom": 0.4767673648318401, "params_M": 0.00019, "train_n": 200, "rationale": "param_efficient-claude-agentic: reg_type=bilateral, bilateral_on_top=False, proj_filter_on=False, n_iter=30, learnable_alpha=True, alpha_init=0.1, foe_n_filters=24, foe_kernel=7, foe_n_bumps=31, n_bf=1, bf_multiscale=True, bf_sigmas=[0.8, 1.6, 3.2], bf_kernel=7, bf_sigma_r=0.02, bf_gain_init=0.0, epochs=16, cosine_lr=True, lr=0.005, max_train_s=1080, batch_size=4, train_n=200, val_n=200, display_min=0.0, display_max=0.05, seed=42, rationale=iter-22 param_efficient breast -- WU-2015 LEARNED DE-ALIASED INITIALIZER, end-to-end (solver edit). SIX-BOX: (1) PRIOR: architecture search reached champion LPD-combine W=4 = 0.5047 @ 183p (seed42). But the unroll STILL initializes x0 from the raw Hann FBP -- the STREAKY starting point (the sparse-view problem itself). Wu-2015-trainable STANDALONE reaches hr 0.31 -> it produces a DE-ALIASED x0 that already beats raw FBP. (2) FAILURE MODE: raw-FBP x0 injects coherent streaks the K=30 unroll must then undo; a cleaner init could let the unroll climb higher. (3) ONE KNOB (architectural): wu_init_on=True -- I added a WuInit front-end (Wu aliasing-free band-decomposition FBP: 4 band scales + sigmoid slope + offset + 1 gain = 7 params) as a RESIDUAL on the plain FBP: x0 = fbp + gain*(wu_aliasfree - fbp), gain ZERO-INIT => x0 == plain FBP == the 0.5047 champion BYTE-FOR-BYTE at init (no regression). Trained END-TO-END with the DC+LPD unroll (init + LPD block + per-step alpha co-adapt). Total ~= 183 + 7 = 190 params. seed 42 to compare directly vs iter-15's 0.5047. (4) HYPOTHESIS: a learned de-streaked band-decomposition init feeds the DC+LPD unroll a cleaner starting image, so end-to-end training lifts hr past 0.5047 (the init and unroll co-adapt) -- OR the gain trains toward 0 (raw FBP already optimal for this unroll), a clean null. Either way maps the init lever. (5) BUDGET: WuInit = n_bands extra back-projections at x0 ONCE per forward (cheap vs K=30 unroll); iter-15 finished 16ep in 1020s -> expect ~14-16ep; train_n=200, max_train_s=1080, --time=00:30:00, 200-val -> 20-min comparable. (6) SERIAL; iter-23: if Wu-init helps, tune n_bands/gain; then resume seed replicates of whichever config is champion for mean+-std., dc_mode=filtered, per_step_alpha=True, lpd_on=True, lpd_width=4, lpd_kernel=3, anisotropic_on_top=False, wu_init_on=True, wu_n_bands=4, wu_sigmoid_slope=10.0, wu_sigmoid_offset=1.0, wu_gain_init=0.0", "advice_for_others": "param_efficient-claude-agentic: reg_type=bilateral, bilateral_on_top=False, proj_filter_on=False, n_iter=30, learnable_alpha=True, alpha_init=0.1, foe_n_filters=24, foe_kernel=7, foe_n_bumps=31, n_bf=1, bf_multiscale=True, bf_sigmas=[0.8, 1.6, 3.2], bf_kernel=7, bf_sigma_r=0.02, bf_gain_init=0.0, epochs=16, cosine_lr=True, lr=0.005, max_train_s=1080, batch_size=4, train_n=200, val_n=200, display_min=0.0, display_max=0.05, seed=42, rationale=iter-22 param_efficient breast -- WU-2015 LEARNED DE-ALIASED INITIALIZER, end-to-end (solver edit). SIX-BOX: (1) PRIOR: architecture search reached champion LPD-combine W=4 = 0.5047 @ 183p (seed42). But the unroll STILL initializes x0 from the raw Hann FBP -- the STREAKY starting point (the sparse-view problem itself). Wu-2015-trainable STANDALONE reaches hr 0.31 -> it produces a DE-ALIASED x0 that already beats raw FBP. (2) FAILURE MODE: raw-FBP x0 injects coherent streaks the K=30 unroll must then undo; a cleaner init could let the unroll climb higher. (3) ONE KNOB (architectural): wu_init_on=True -- I added a WuInit front-end (Wu aliasing-free band-decomposition FBP: 4 band scales + sigmoid slope + offset + 1 gain = 7 params) as a RESIDUAL on the plain FBP: x0 = fbp + gain*(wu_aliasfree - fbp), gain ZERO-INIT => x0 == plain FBP == the 0.5047 champion BYTE-FOR-BYTE at init (no regression). Trained END-TO-END with the DC+LPD unroll (init + LPD block + per-step alpha co-adapt). Total ~= 183 + 7 = 190 params. seed 42 to compare directly vs iter-15's 0.5047. (4) HYPOTHESIS: a learned de-streaked band-decomposition init feeds the DC+LPD unroll a cleaner starting image, so end-to-end training lifts hr past 0.5047 (the init and unroll co-adapt) -- OR the gain trains toward 0 (raw FBP already optimal for this unroll), a clean null. Either way maps the init lever. (5) BUDGET: WuInit = n_bands extra back-projections at x0 ONCE per forward (cheap vs K=30 unroll); iter-15 finished 16ep in 1020s -> expect ~14-16ep; train_n=200, max_train_s=1080, --time=00:30:00, 200-val -> 20-min comparable. (6) SERIAL; iter-23: if Wu-init helps, tune n_bands/gain; then resume seed replicates of whichever config is champion for mean+-std., dc_mode=filtered, per_step_alpha=True, lpd_on=True, lpd_width=4, lpd_kernel=3, anisotropic_on_top=False, wu_init_on=True, wu_n_bands=4, wu_sigmoid_slope=10.0, wu_sigmoid_offset=1.0, wu_gain_init=0.0", "comparison_image": "runs/breast-ct-claude-agentic-param-efficient-search-20260703-01/iterations/iter-0022/comparison.png"}
