{"ts": "2026-07-07T01:23:20Z", "run_id": "breast-ct-claude-agentic-fastdiff-wdm-wavelet-unconstrained-search-20260703-01", "iter": 3, "agent": "fastdiff_wdm_wavelet_unconstrained-claude-agentic", "model": "claude-opus-4-8-1m", "change_class": "architecture", "status": "discard", "kept": false, "val_score": 0.5664541721343994, "headroom": 0.0, "params_M": 3.824908, "train_n": 3600, "rationale": "fastdiff_wdm_wavelet_unconstrained-claude-agentic: val_n=200, seed=42, fd_recon_ckpt=/cluster/maier/Agent4CT/checkpoints/fast_diffusion_wavelet_breast.pt, fd_recon_steps=8, fd_recon_init=fbp, fd_recon_init_t=0.2, fd_recon_eta=1.0, fd_recon_dc=0, fd_recon_dc_n_cg=5, fd_recon_dc_relax=0.5, dataset_kind=breast_ct, rationale=iter-3 INIT_T lever continued, breast-native wdm-wavelet UNCONSTRAINED (DC OFF). SIX-BOX: (1) PRIOR: iter-1 t=0.7 rmse=0.02248; iter-2 t=0.4 rmse=0.01429 (big drop) -- lowering init_t monotonically improves calibrated RMSE by retaining more of the strong 128-view FBP. Both hr=0. (2) Failure mode: with DC-projection OFF the prior term still perturbs the FBP away from the data manifold; less embedding (lower t) = less prior drift. (3) ONE KNOB: fd_recon_init_t 0.4->0.2. (4) HYPOTHESIS: t=0.2 retains still more FBP -> RMSE drops further toward the calibrated FBP floor; tests whether prior-alone can asymptotically REACH but not BEAT baseline (hr->0 from above). If rmse plateaus above baseline, confirms prior-without-DC is net-neutral-to-harmful on sparse breast. (5) BUDGET: <5min. (6) Loop continues.", "advice_for_others": "fastdiff_wdm_wavelet_unconstrained-claude-agentic: val_n=200, seed=42, fd_recon_ckpt=/cluster/maier/Agent4CT/checkpoints/fast_diffusion_wavelet_breast.pt, fd_recon_steps=8, fd_recon_init=fbp, fd_recon_init_t=0.2, fd_recon_eta=1.0, fd_recon_dc=0, fd_recon_dc_n_cg=5, fd_recon_dc_relax=0.5, dataset_kind=breast_ct, rationale=iter-3 INIT_T lever continued, breast-native wdm-wavelet UNCONSTRAINED (DC OFF). SIX-BOX: (1) PRIOR: iter-1 t=0.7 rmse=0.02248; iter-2 t=0.4 rmse=0.01429 (big drop) -- lowering init_t monotonically improves calibrated RMSE by retaining more of the strong 128-view FBP. Both hr=0. (2) Failure mode: with DC-projection OFF the prior term still perturbs the FBP away from the data manifold; less embedding (lower t) = less prior drift. (3) ONE KNOB: fd_recon_init_t 0.4->0.2. (4) HYPOTHESIS: t=0.2 retains still more FBP -> RMSE drops further toward the calibrated FBP floor; tests whether prior-alone can asymptotically REACH but not BEAT baseline (hr->0 from above). If rmse plateaus above baseline, confirms prior-without-DC is net-neutral-to-harmful on sparse breast. (5) BUDGET: <5min. (6) Loop continues.", "comparison_image": "runs/breast-ct-claude-agentic-fastdiff-wdm-wavelet-unconstrained-search-20260703-01/iterations/iter-0003/comparison.png"}
{"ts": "2026-07-07T01:21:05Z", "run_id": "breast-ct-claude-agentic-fastdiff-wdm-wavelet-unconstrained-search-20260703-01", "iter": 2, "agent": "fastdiff_wdm_wavelet_unconstrained-claude-agentic", "model": "claude-opus-4-8-1m", "change_class": "architecture", "status": "discard", "kept": false, "val_score": 0.7125030159950256, "headroom": 0.0, "params_M": 3.824908, "train_n": 3600, "rationale": "fastdiff_wdm_wavelet_unconstrained-claude-agentic: val_n=200, seed=42, fd_recon_ckpt=/cluster/maier/Agent4CT/checkpoints/fast_diffusion_wavelet_breast.pt, fd_recon_steps=8, fd_recon_init=fbp, fd_recon_init_t=0.4, fd_recon_eta=1.0, fd_recon_dc=0, fd_recon_dc_n_cg=5, fd_recon_dc_relax=0.5, dataset_kind=breast_ct, rationale=iter-2 INIT_T lever, breast-native wdm-wavelet UNCONSTRAINED (DC OFF, fd_recon_dc=0). SIX-BOX: (1) PRIOR: iter-1 (init_t=0.7) hr=0.0, calibrated masked rmse=0.02248, psnr=23.63, ssim=0.856 -- prior regenerates too much at high embed time, drifts above the calibrated FBP floor. (2) Failure mode: at init_t=0.7 the FBP warm-start is embedded deep in noise so the few-step flow reconstructs mostly from the prior; with the hard CG DC projection OFF only DPS soft-guidance enforces the sinogram -> under-constrained, RMSE too high. (3) ONE KNOB: fd_recon_init_t 0.7->0.4 (retain more FBP structure), all else identical. (4) HYPOTHESIS: lower init_t keeps more of the strong 128-view FBP so calibrated RMSE drops toward the floor; the DC-on sibling found t=0.4 best, so this is the fair single-knob comparison. If hr still 0, prior-alone (no DC) is structurally below the calibrated FBP baseline -- the intended finding. (5) BUDGET: iter-1 ran <5min. (6) Loop continues.", "advice_for_others": "fastdiff_wdm_wavelet_unconstrained-claude-agentic: val_n=200, seed=42, fd_recon_ckpt=/cluster/maier/Agent4CT/checkpoints/fast_diffusion_wavelet_breast.pt, fd_recon_steps=8, fd_recon_init=fbp, fd_recon_init_t=0.4, fd_recon_eta=1.0, fd_recon_dc=0, fd_recon_dc_n_cg=5, fd_recon_dc_relax=0.5, dataset_kind=breast_ct, rationale=iter-2 INIT_T lever, breast-native wdm-wavelet UNCONSTRAINED (DC OFF, fd_recon_dc=0). SIX-BOX: (1) PRIOR: iter-1 (init_t=0.7) hr=0.0, calibrated masked rmse=0.02248, psnr=23.63, ssim=0.856 -- prior regenerates too much at high embed time, drifts above the calibrated FBP floor. (2) Failure mode: at init_t=0.7 the FBP warm-start is embedded deep in noise so the few-step flow reconstructs mostly from the prior; with the hard CG DC projection OFF only DPS soft-guidance enforces the sinogram -> under-constrained, RMSE too high. (3) ONE KNOB: fd_recon_init_t 0.7->0.4 (retain more FBP structure), all else identical. (4) HYPOTHESIS: lower init_t keeps more of the strong 128-view FBP so calibrated RMSE drops toward the floor; the DC-on sibling found t=0.4 best, so this is the fair single-knob comparison. If hr still 0, prior-alone (no DC) is structurally below the calibrated FBP baseline -- the intended finding. (5) BUDGET: iter-1 ran <5min. (6) Loop continues.", "comparison_image": "runs/breast-ct-claude-agentic-fastdiff-wdm-wavelet-unconstrained-search-20260703-01/iterations/iter-0002/comparison.png"}
{"ts": "2026-07-07T01:17:50Z", "run_id": "breast-ct-claude-agentic-fastdiff-wdm-wavelet-unconstrained-search-20260703-01", "iter": 1, "agent": "fastdiff_wdm_wavelet_unconstrained-claude-agentic", "model": "claude-opus-4-8-1m", "change_class": "architecture", "status": "discard", "kept": false, "val_score": 0.8563522100448608, "headroom": 0.0, "params_M": 3.824908, "train_n": 3600, "rationale": "fastdiff_wdm_wavelet_unconstrained-claude-agentic: val_n=200, seed=42, fd_recon_ckpt=/cluster/maier/Agent4CT/checkpoints/fast_diffusion_wavelet_breast.pt, fd_recon_steps=8, fd_recon_init=fbp, fd_recon_init_t=0.7, fd_recon_eta=1.0, fd_recon_dc=0, fd_recon_dc_n_cg=5, fd_recon_dc_relax=0.5, dataset_kind=breast_ct", "advice_for_others": "fastdiff_wdm_wavelet_unconstrained-claude-agentic: val_n=200, seed=42, fd_recon_ckpt=/cluster/maier/Agent4CT/checkpoints/fast_diffusion_wavelet_breast.pt, fd_recon_steps=8, fd_recon_init=fbp, fd_recon_init_t=0.7, fd_recon_eta=1.0, fd_recon_dc=0, fd_recon_dc_n_cg=5, fd_recon_dc_relax=0.5, dataset_kind=breast_ct", "comparison_image": "runs/breast-ct-claude-agentic-fastdiff-wdm-wavelet-unconstrained-search-20260703-01/iterations/iter-0001/comparison.png"}
{"ts": "2026-07-07T01:03:34Z", "run_id": "breast-ct-claude-agentic-param-efficient-search-20260703-01", "iter": 9, "agent": "param_efficient-claude-agentic", "model": "claude-opus-4-8-1m", "change_class": "architecture", "status": "keep", "kept": true, "val_score": 0.9710379838943481, "headroom": 0.3352416310332519, "params_M": 1.3e-05, "train_n": 200, "rationale": "param_efficient-claude-agentic: reg_type=bilateral, bilateral_on_top=False, proj_filter_on=False, n_iter=10, learnable_alpha=True, alpha_init=0.1, foe_n_filters=24, foe_kernel=7, foe_n_bumps=31, n_bf=3, bf_multiscale=True, bf_sigmas=[0.8, 1.6, 3.2], bf_kernel=7, bf_sigma_r=0.02, bf_gain_init=0.0, epochs=16, cosine_lr=True, lr=0.005, max_train_s=1080, batch_size=4, train_n=200, val_n=200, display_min=0.0, display_max=0.05, seed=42, rationale=iter-9 param_efficient breast -- ARCHITECTURAL CHANGE: FILTERED-GRADIENT DC (I edited the solver, per coordinator: everything is changeable). SIX-BOX: (1) PRIOR: 8 iters prove the ADJOINT GD-unroll caps at image-domain ~0.26 on sparse-view; the diagnosis (iter-6) is that R^T(Rx-g) back-projects a STREAKY residual -> re-injects coherent streaks -> deeper adjoint DC LOWERED hr. That is an ARCHITECTURAL ceiling, not a config one. (2) FAILURE MODE: the raw adjoint DC operator smears sparse-view streaks. (3) ONE KNOB (architectural): dc_mode 'adjoint'->'filtered' -- I added a config-gated branch in ParamEfficientUnrolled._grad so the DC direction is fbp(Rx-g) (ramp/Hann-filtered residual back-projection = a PROPER reconstruction correction, the SART/FBP-gradient trick) instead of R^T(Rx-g)/dc_norm. ZERO extra params; touches only my solver, not the projector/metrics. Applied on the LEAN prox (bilateral 3-scale, 13 params) at K=10 depth -- because a filtered gradient should make DEPTH help (the exact lever the adjoint poisoned in iter-6). (4) HYPOTHESIS: because the ramp-filtered residual correction does NOT smear streaks, 10 filtered-DC steps drive Rx->g while actually REMOVING the coherent streaks (each step reconstructs the residual properly) -> hr breaks past 0.264 toward the VN/LPD regime, at ~13-22 params. This is the minimal architectural fix my own evidence points to. (5) BUDGET: filtered DC = 1 extra fbp per step vs adjoint's back_project (similar cost); K=10 bilateral, train_n=200, 1080s backstop + 200-val -> <20min. (6) SERIAL; iter-10 self-dispatches (next: if filtered-DC helps, sweep K / add the FoE or proj-filter on top; if not, LPD dual)., dc_mode=filtered, per_step_alpha=False", "advice_for_others": "param_efficient-claude-agentic: reg_type=bilateral, bilateral_on_top=False, proj_filter_on=False, n_iter=10, learnable_alpha=True, alpha_init=0.1, foe_n_filters=24, foe_kernel=7, foe_n_bumps=31, n_bf=3, bf_multiscale=True, bf_sigmas=[0.8, 1.6, 3.2], bf_kernel=7, bf_sigma_r=0.02, bf_gain_init=0.0, epochs=16, cosine_lr=True, lr=0.005, max_train_s=1080, batch_size=4, train_n=200, val_n=200, display_min=0.0, display_max=0.05, seed=42, rationale=iter-9 param_efficient breast -- ARCHITECTURAL CHANGE: FILTERED-GRADIENT DC (I edited the solver, per coordinator: everything is changeable). SIX-BOX: (1) PRIOR: 8 iters prove the ADJOINT GD-unroll caps at image-domain ~0.26 on sparse-view; the diagnosis (iter-6) is that R^T(Rx-g) back-projects a STREAKY residual -> re-injects coherent streaks -> deeper adjoint DC LOWERED hr. That is an ARCHITECTURAL ceiling, not a config one. (2) FAILURE MODE: the raw adjoint DC operator smears sparse-view streaks. (3) ONE KNOB (architectural): dc_mode 'adjoint'->'filtered' -- I added a config-gated branch in ParamEfficientUnrolled._grad so the DC direction is fbp(Rx-g) (ramp/Hann-filtered residual back-projection = a PROPER reconstruction correction, the SART/FBP-gradient trick) instead of R^T(Rx-g)/dc_norm. ZERO extra params; touches only my solver, not the projector/metrics. Applied on the LEAN prox (bilateral 3-scale, 13 params) at K=10 depth -- because a filtered gradient should make DEPTH help (the exact lever the adjoint poisoned in iter-6). (4) HYPOTHESIS: because the ramp-filtered residual correction does NOT smear streaks, 10 filtered-DC steps drive Rx->g while actually REMOVING the coherent streaks (each step reconstructs the residual properly) -> hr breaks past 0.264 toward the VN/LPD regime, at ~13-22 params. This is the minimal architectural fix my own evidence points to. (5) BUDGET: filtered DC = 1 extra fbp per step vs adjoint's back_project (similar cost); K=10 bilateral, train_n=200, 1080s backstop + 200-val -> <20min. (6) SERIAL; iter-10 self-dispatches (next: if filtered-DC helps, sweep K / add the FoE or proj-filter on top; if not, LPD dual)., dc_mode=filtered, per_step_alpha=False", "comparison_image": "runs/breast-ct-claude-agentic-param-efficient-search-20260703-01/iterations/iter-0009/comparison.png"}
{"ts": "2026-07-06T22:38:33Z", "run_id": "breast-ct-claude-agentic-fastdiff-flow-pixel-constrained-search-20260703-01", "iter": 20, "agent": "fastdiff_flow_pixel_constrained-claude-agentic", "model": "claude-opus-4-8-1m", "change_class": "architecture", "status": "keep", "kept": true, "val_score": 0.9778558611869812, "headroom": 0.516400405480144, "params_M": 3.822787, "train_n": 400, "rationale": "fastdiff_flow_pixel_constrained-claude-agentic: image_size=512, pixel_spacing=0.3516, n_angles=128, n_det=1024, det_spacing=0.35754, sod=500.0, sdd=1000.0, display_min=0.0, display_max=0.5, train_n=400, val_n=200, noise_i0=100000.0, noise_sigma_e=10.0, seed=42, dataset_kind=breast_ct, fd_recon_ckpt=/cluster/maier/Agent4CT/checkpoints/fast_diffusion_pixel_breast.pt, fd_recon_steps=8, fd_recon_init=fbp, fd_recon_init_t=0.01, fd_recon_eta=1.0, fd_recon_dc=1, fd_recon_dc_n_cg=20, fd_recon_dc_relax=1.0, rationale=iter-20 CHAMPION CONFIRMATION toward the HARD iter-20 stop. Locks the best config found: init_t0.01, n_cg20, relax1.0, steps8, eta1.0 (iter-15, hr=0.5164, rmse0.002522, psnr42.63, ssim0.978 - HALF the FBP baseline rmse0.00521). SEARCH SUMMARY: the breast-native prior + few-step flow with a deep-but-not-over-converged CG data-consistency step (DC-ON constrained variant) CLEARS the strong 128-view breast FBP baseline by a wide margin. Two levers dominate: init_t (optimum ~0.01: near-FBP embed so the prior lightly denoises without repainting; higher init_t catastrophically repaints, lower loses the prior's denoise) and dc_n_cg (SEMI-CONVERGENCE peak at ~20: enough CG to beat the analytic Hann FBP on sparse data, but not so many that CG re-amplifies measurement noise). dc_relax=1.0 (full projection) best; eta/steps near-neutral. This confirms the FAIR TEST: prior-mismatch (Mayo out_scale0.05 vs breast0.5) WAS the cause of the old hr=0; a matched breast-native prior lifts pixel-DC-on to hr~0.52. Confirmation run reproduces the champion (deterministic seed=42).", "advice_for_others": "fastdiff_flow_pixel_constrained-claude-agentic: image_size=512, pixel_spacing=0.3516, n_angles=128, n_det=1024, det_spacing=0.35754, sod=500.0, sdd=1000.0, display_min=0.0, display_max=0.5, train_n=400, val_n=200, noise_i0=100000.0, noise_sigma_e=10.0, seed=42, dataset_kind=breast_ct, fd_recon_ckpt=/cluster/maier/Agent4CT/checkpoints/fast_diffusion_pixel_breast.pt, fd_recon_steps=8, fd_recon_init=fbp, fd_recon_init_t=0.01, fd_recon_eta=1.0, fd_recon_dc=1, fd_recon_dc_n_cg=20, fd_recon_dc_relax=1.0, rationale=iter-20 CHAMPION CONFIRMATION toward the HARD iter-20 stop. Locks the best config found: init_t0.01, n_cg20, relax1.0, steps8, eta1.0 (iter-15, hr=0.5164, rmse0.002522, psnr42.63, ssim0.978 - HALF the FBP baseline rmse0.00521). SEARCH SUMMARY: the breast-native prior + few-step flow with a deep-but-not-over-converged CG data-consistency step (DC-ON constrained variant) CLEARS the strong 128-view breast FBP baseline by a wide margin. Two levers dominate: init_t (optimum ~0.01: near-FBP embed so the prior lightly denoises without repainting; higher init_t catastrophically repaints, lower loses the prior's denoise) and dc_n_cg (SEMI-CONVERGENCE peak at ~20: enough CG to beat the analytic Hann FBP on sparse data, but not so many that CG re-amplifies measurement noise). dc_relax=1.0 (full projection) best; eta/steps near-neutral. This confirms the FAIR TEST: prior-mismatch (Mayo out_scale0.05 vs breast0.5) WAS the cause of the old hr=0; a matched breast-native prior lifts pixel-DC-on to hr~0.52. Confirmation run reproduces the champion (deterministic seed=42).", "comparison_image": "runs/breast-ct-claude-agentic-fastdiff-flow-pixel-constrained-search-20260703-01/iterations/iter-0020/comparison.png"}
{"ts": "2026-07-06T22:38:29Z", "run_id": "breast-ct-claude-agentic-fastdiff-flow-pixel-constrained-search-20260703-01", "iter": 19, "agent": "fastdiff_flow_pixel_constrained-claude-agentic", "model": "claude-opus-4-8-1m", "change_class": "architecture", "status": "keep", "kept": true, "val_score": 0.9778560996055603, "headroom": 0.5163998249980419, "params_M": 3.822787, "train_n": 400, "rationale": "fastdiff_flow_pixel_constrained-claude-agentic: image_size=512, pixel_spacing=0.3516, n_angles=128, n_det=1024, det_spacing=0.35754, sod=500.0, sdd=1000.0, display_min=0.0, display_max=0.5, train_n=400, val_n=200, noise_i0=100000.0, noise_sigma_e=10.0, seed=42, dataset_kind=breast_ct, fd_recon_ckpt=/cluster/maier/Agent4CT/checkpoints/fast_diffusion_pixel_breast.pt, fd_recon_steps=8, fd_recon_init=fbp, fd_recon_init_t=0.01, fd_recon_eta=1.0, fd_recon_dc=1, fd_recon_dc_n_cg=20, fd_recon_dc_relax=1.0, rationale=iter-19 CHAMPION CONFIRMATION toward the HARD iter-20 stop. Locks the best config found: init_t0.01, n_cg20, relax1.0, steps8, eta1.0 (iter-15, hr=0.5164, rmse0.002522, psnr42.63, ssim0.978 - HALF the FBP baseline rmse0.00521). SEARCH SUMMARY: the breast-native prior + few-step flow with a deep-but-not-over-converged CG data-consistency step (DC-ON constrained variant) CLEARS the strong 128-view breast FBP baseline by a wide margin. Two levers dominate: init_t (optimum ~0.01: near-FBP embed so the prior lightly denoises without repainting; higher init_t catastrophically repaints, lower loses the prior's denoise) and dc_n_cg (SEMI-CONVERGENCE peak at ~20: enough CG to beat the analytic Hann FBP on sparse data, but not so many that CG re-amplifies measurement noise). dc_relax=1.0 (full projection) best; eta/steps near-neutral. This confirms the FAIR TEST: prior-mismatch (Mayo out_scale0.05 vs breast0.5) WAS the cause of the old hr=0; a matched breast-native prior lifts pixel-DC-on to hr~0.52. Confirmation run reproduces the champion (deterministic seed=42).", "advice_for_others": "fastdiff_flow_pixel_constrained-claude-agentic: image_size=512, pixel_spacing=0.3516, n_angles=128, n_det=1024, det_spacing=0.35754, sod=500.0, sdd=1000.0, display_min=0.0, display_max=0.5, train_n=400, val_n=200, noise_i0=100000.0, noise_sigma_e=10.0, seed=42, dataset_kind=breast_ct, fd_recon_ckpt=/cluster/maier/Agent4CT/checkpoints/fast_diffusion_pixel_breast.pt, fd_recon_steps=8, fd_recon_init=fbp, fd_recon_init_t=0.01, fd_recon_eta=1.0, fd_recon_dc=1, fd_recon_dc_n_cg=20, fd_recon_dc_relax=1.0, rationale=iter-19 CHAMPION CONFIRMATION toward the HARD iter-20 stop. Locks the best config found: init_t0.01, n_cg20, relax1.0, steps8, eta1.0 (iter-15, hr=0.5164, rmse0.002522, psnr42.63, ssim0.978 - HALF the FBP baseline rmse0.00521). SEARCH SUMMARY: the breast-native prior + few-step flow with a deep-but-not-over-converged CG data-consistency step (DC-ON constrained variant) CLEARS the strong 128-view breast FBP baseline by a wide margin. Two levers dominate: init_t (optimum ~0.01: near-FBP embed so the prior lightly denoises without repainting; higher init_t catastrophically repaints, lower loses the prior's denoise) and dc_n_cg (SEMI-CONVERGENCE peak at ~20: enough CG to beat the analytic Hann FBP on sparse data, but not so many that CG re-amplifies measurement noise). dc_relax=1.0 (full projection) best; eta/steps near-neutral. This confirms the FAIR TEST: prior-mismatch (Mayo out_scale0.05 vs breast0.5) WAS the cause of the old hr=0; a matched breast-native prior lifts pixel-DC-on to hr~0.52. Confirmation run reproduces the champion (deterministic seed=42).", "comparison_image": "runs/breast-ct-claude-agentic-fastdiff-flow-pixel-constrained-search-20260703-01/iterations/iter-0019/comparison.png"}
