{"ts": "2026-07-06T20:30:21Z", "run_id": "breast-ct-claude-agentic-fastdiff-wdm-wavelet-constrained-search-20260703-01", "iter": 2, "agent": "fastdiff_wdm_wavelet_constrained-claude-agentic", "model": "claude-opus-4-8-1m", "change_class": "architecture", "status": "discard", "kept": false, "val_score": 0.3539787232875824, "headroom": 0.0, "params_M": 3.824908, "train_n": 3600, "rationale": "fastdiff_wdm_wavelet_constrained-claude-agentic: val_n=200, seed=42, fd_recon_ckpt=/cluster/maier/Agent4CT/checkpoints/fast_diffusion_wavelet_breast.pt, fd_recon_steps=8, fd_recon_init=fbp, fd_recon_init_t=0.7, fd_recon_eta=1.0, fd_recon_dc=1, fd_recon_dc_n_cg=5, fd_recon_dc_relax=1.0, dataset_kind=breast_ct, rationale=iter-2 DC-STRENGTH lever, breast-native wavelet CONSTRAINED, val=200. SIX-BOX: (1) PRIOR: iter-1 (breast prior, init_t0.7/dc_relax0.5) scored SSIM 0.326 / PSNR 17.1 / RMSE 4.75e-2 vs 128-view sparse-FBP baseline PSNR 36.3 / RMSE 5.21e-3 -> ~9x worse, hr=0, FAR below floor and much worse than the archived Mayo-prior iter-1 (SSIM 0.72). (2) FAILURE MODE: with the CORRECTLY-scaled breast prior (out_scale 0.5), embedding the FBP at init_t=0.7 injects a large amount of prior structure that the half-strength CG DC (relax=0.5) only half-corrects back onto the measured sparse sinogram -> the strong prior at high flow-time dominates and corrupts HU. The prior is now impactful (unlike the mis-scaled Mayo prior), so weak DC is decisively wrong. (3) ONE KNOB: fd_recon_dc_relax 0.5 -> 1.0 (full CG-projected-image blend), all else identical to iter-1. (4) HYPOTHESIS: at dc_relax=1.0 the recon leans fully on the CG solve of min||Ax-y||^2 onto the measured sinogram each step, so RMSE drops sharply toward the sparse-FBP floor (the archived Mayo-prior curve gained SSIM 0.72->0.82 on exactly this knob at iter-2, and dc_relax=1.0 was best throughout). FALSIFIER: if RMSE stays >>baseline, the high init_t is the dominant problem -> iter-3 lowers init_t to 0.4 (the archived best region). (5) BUDGET: iter-1 ran ~90s for 200 slices; dc_relax is free. (6) Loop continues; iter-3 self-dispatched on landing.", "advice_for_others": "fastdiff_wdm_wavelet_constrained-claude-agentic: val_n=200, seed=42, fd_recon_ckpt=/cluster/maier/Agent4CT/checkpoints/fast_diffusion_wavelet_breast.pt, fd_recon_steps=8, fd_recon_init=fbp, fd_recon_init_t=0.7, fd_recon_eta=1.0, fd_recon_dc=1, fd_recon_dc_n_cg=5, fd_recon_dc_relax=1.0, dataset_kind=breast_ct, rationale=iter-2 DC-STRENGTH lever, breast-native wavelet CONSTRAINED, val=200. SIX-BOX: (1) PRIOR: iter-1 (breast prior, init_t0.7/dc_relax0.5) scored SSIM 0.326 / PSNR 17.1 / RMSE 4.75e-2 vs 128-view sparse-FBP baseline PSNR 36.3 / RMSE 5.21e-3 -> ~9x worse, hr=0, FAR below floor and much worse than the archived Mayo-prior iter-1 (SSIM 0.72). (2) FAILURE MODE: with the CORRECTLY-scaled breast prior (out_scale 0.5), embedding the FBP at init_t=0.7 injects a large amount of prior structure that the half-strength CG DC (relax=0.5) only half-corrects back onto the measured sparse sinogram -> the strong prior at high flow-time dominates and corrupts HU. The prior is now impactful (unlike the mis-scaled Mayo prior), so weak DC is decisively wrong. (3) ONE KNOB: fd_recon_dc_relax 0.5 -> 1.0 (full CG-projected-image blend), all else identical to iter-1. (4) HYPOTHESIS: at dc_relax=1.0 the recon leans fully on the CG solve of min||Ax-y||^2 onto the measured sinogram each step, so RMSE drops sharply toward the sparse-FBP floor (the archived Mayo-prior curve gained SSIM 0.72->0.82 on exactly this knob at iter-2, and dc_relax=1.0 was best throughout). FALSIFIER: if RMSE stays >>baseline, the high init_t is the dominant problem -> iter-3 lowers init_t to 0.4 (the archived best region). (5) BUDGET: iter-1 ran ~90s for 200 slices; dc_relax is free. (6) Loop continues; iter-3 self-dispatched on landing.", "comparison_image": "runs/breast-ct-claude-agentic-fastdiff-wdm-wavelet-constrained-search-20260703-01/iterations/iter-0002/comparison.png"}
{"ts": "2026-07-06T20:28:31Z", "run_id": "breast-ct-claude-agentic-fastdiff-flow-pixel-unconstrained-search-20260703-01", "iter": 5, "agent": "fastdiff_flow_pixel_unconstrained-claude-agentic", "model": "claude-opus-4-8-1m", "change_class": "architecture", "status": "discard", "kept": false, "val_score": 0.7217198014259338, "headroom": 0.0, "params_M": 3.822787, "train_n": 3600, "rationale": "fastdiff_flow_pixel_unconstrained-claude-agentic: image_size=512, pixel_spacing=0.3516, n_angles=128, n_det=1024, det_spacing=0.35754, sod=500.0, sdd=1000.0, display_min=0.0, display_max=0.5, train_n=400, val_n=200, noise_i0=100000.0, noise_sigma_e=10.0, seed=42, fd_recon_ckpt=/cluster/maier/Agent4CT/checkpoints/fast_diffusion_pixel_breast.pt, fd_recon_steps=8, fd_recon_init=fbp, fd_recon_init_t=0.4, fd_recon_eta=0.5, fd_recon_dc=0, fd_recon_dc_n_cg=5, fd_recon_dc_relax=0.5, rationale=iter-5: DC-off breast-prior. Fix init_t=0.4 (best). ONE KNOB eta 1.0->0.5. FAILURE MODE at iter-4: eta=3.0 DESTABILIZED the sampler (PSNR crashed 24.6->12.8, RMSE 2.0e-2->7.9e-2) - the adaptive DPS step (eta/||r||)*grad OVERSHOOTS at large eta with no hard-DC to re-anchor => divergence. So cranking soft guidance does NOT substitute for the hard CG DC projection. HYPOTHESIS: a GENTLER eta=0.5 is more stable and may edge past the eta=1.0 result (PSNR24.6) by taking smaller, non-overshooting fidelity steps. Brackets the eta optimum around 1.0 (1.0 vs 0.5 vs the failed 3.0).", "advice_for_others": "fastdiff_flow_pixel_unconstrained-claude-agentic: image_size=512, pixel_spacing=0.3516, n_angles=128, n_det=1024, det_spacing=0.35754, sod=500.0, sdd=1000.0, display_min=0.0, display_max=0.5, train_n=400, val_n=200, noise_i0=100000.0, noise_sigma_e=10.0, seed=42, fd_recon_ckpt=/cluster/maier/Agent4CT/checkpoints/fast_diffusion_pixel_breast.pt, fd_recon_steps=8, fd_recon_init=fbp, fd_recon_init_t=0.4, fd_recon_eta=0.5, fd_recon_dc=0, fd_recon_dc_n_cg=5, fd_recon_dc_relax=0.5, rationale=iter-5: DC-off breast-prior. Fix init_t=0.4 (best). ONE KNOB eta 1.0->0.5. FAILURE MODE at iter-4: eta=3.0 DESTABILIZED the sampler (PSNR crashed 24.6->12.8, RMSE 2.0e-2->7.9e-2) - the adaptive DPS step (eta/||r||)*grad OVERSHOOTS at large eta with no hard-DC to re-anchor => divergence. So cranking soft guidance does NOT substitute for the hard CG DC projection. HYPOTHESIS: a GENTLER eta=0.5 is more stable and may edge past the eta=1.0 result (PSNR24.6) by taking smaller, non-overshooting fidelity steps. Brackets the eta optimum around 1.0 (1.0 vs 0.5 vs the failed 3.0).", "comparison_image": "runs/breast-ct-claude-agentic-fastdiff-flow-pixel-unconstrained-search-20260703-01/iterations/iter-0005/comparison.png"}
{"ts": "2026-07-06T20:22:26Z", "run_id": "breast-ct-claude-agentic-fastdiff-flow-pixel-unconstrained-search-20260703-01", "iter": 4, "agent": "fastdiff_flow_pixel_unconstrained-claude-agentic", "model": "claude-opus-4-8-1m", "change_class": "architecture", "status": "discard", "kept": false, "val_score": 0.4060579538345337, "headroom": 0.0, "params_M": 3.822787, "train_n": 3600, "rationale": "fastdiff_flow_pixel_unconstrained-claude-agentic: image_size=512, pixel_spacing=0.3516, n_angles=128, n_det=1024, det_spacing=0.35754, sod=500.0, sdd=1000.0, display_min=0.0, display_max=0.5, train_n=400, val_n=200, noise_i0=100000.0, noise_sigma_e=10.0, seed=42, fd_recon_ckpt=/cluster/maier/Agent4CT/checkpoints/fast_diffusion_pixel_breast.pt, fd_recon_steps=8, fd_recon_init=fbp, fd_recon_init_t=0.4, fd_recon_eta=3.0, fd_recon_dc=0, fd_recon_dc_n_cg=5, fd_recon_dc_relax=0.5, rationale=iter-4: DC-off breast-prior. Fix init_t=0.4 (iter-2 sweet spot: PSNR24.6, best so far). ONE KNOB eta 1.0->3.0 (DPS guidance scale). TREND: init_t sweep plateaued - iter-2 init_t0.4 PSNR24.6 > iter-3 init_t0.2 PSNR24.2, so ~0.4 is the init_t optimum. FAILURE MODE: with DC off, the ONLY data-fidelity term is the soft DPS gradient (eta/||r||)*grad; at eta=1.0 it under-corrects, leaving the recon 11.7dB below the FBP baseline. HYPOTHESIS: raising eta to 3.0 strengthens the sinogram-consistency pull each Euler step -> PSNR/RMSE improve toward baseline. This directly tests whether cranking the SOFT guidance can substitute for the absent HARD CG DC projection (the constrained sibling's anchor). Expect partial recovery but NOT reaching baseline - that residual gap = the value of the DC step.", "advice_for_others": "fastdiff_flow_pixel_unconstrained-claude-agentic: image_size=512, pixel_spacing=0.3516, n_angles=128, n_det=1024, det_spacing=0.35754, sod=500.0, sdd=1000.0, display_min=0.0, display_max=0.5, train_n=400, val_n=200, noise_i0=100000.0, noise_sigma_e=10.0, seed=42, fd_recon_ckpt=/cluster/maier/Agent4CT/checkpoints/fast_diffusion_pixel_breast.pt, fd_recon_steps=8, fd_recon_init=fbp, fd_recon_init_t=0.4, fd_recon_eta=3.0, fd_recon_dc=0, fd_recon_dc_n_cg=5, fd_recon_dc_relax=0.5, rationale=iter-4: DC-off breast-prior. Fix init_t=0.4 (iter-2 sweet spot: PSNR24.6, best so far). ONE KNOB eta 1.0->3.0 (DPS guidance scale). TREND: init_t sweep plateaued - iter-2 init_t0.4 PSNR24.6 > iter-3 init_t0.2 PSNR24.2, so ~0.4 is the init_t optimum. FAILURE MODE: with DC off, the ONLY data-fidelity term is the soft DPS gradient (eta/||r||)*grad; at eta=1.0 it under-corrects, leaving the recon 11.7dB below the FBP baseline. HYPOTHESIS: raising eta to 3.0 strengthens the sinogram-consistency pull each Euler step -> PSNR/RMSE improve toward baseline. This directly tests whether cranking the SOFT guidance can substitute for the absent HARD CG DC projection (the constrained sibling's anchor). Expect partial recovery but NOT reaching baseline - that residual gap = the value of the DC step.", "comparison_image": "runs/breast-ct-claude-agentic-fastdiff-flow-pixel-unconstrained-search-20260703-01/iterations/iter-0004/comparison.png"}
{"ts": "2026-07-06T20:21:22Z", "run_id": "breast-ct-claude-agentic-fastdiff-flow-pixel-constrained-search-20260703-01", "iter": 1, "agent": "fastdiff_flow_pixel_constrained-claude-agentic", "model": "claude-opus-4-8-1m", "change_class": "architecture", "status": "discard", "kept": false, "val_score": 0.42688921093940735, "headroom": 0.0, "params_M": 3.822787, "train_n": 400, "rationale": "fastdiff_flow_pixel_constrained-claude-agentic: image_size=512, pixel_spacing=0.3516, n_angles=128, n_det=1024, det_spacing=0.35754, sod=500.0, sdd=1000.0, display_min=0.0, display_max=0.5, train_n=400, val_n=200, noise_i0=100000.0, noise_sigma_e=10.0, seed=42, dataset_kind=breast_ct, fd_recon_ckpt=/cluster/maier/Agent4CT/checkpoints/fast_diffusion_pixel_breast.pt, fd_recon_steps=8, fd_recon_init=fbp, fd_recon_init_t=0.7, fd_recon_eta=1.0, fd_recon_dc=1, fd_recon_dc_n_cg=5, fd_recon_dc_relax=0.5, rationale=iter-1 BREAST-NATIVE PRIOR SANITY (corrected re-run overwriting the hr=0 Mayo-prior run). fastdiff_flow_pixel_constrained, DC ON (fd_recon_dc=1). Prior swapped: Mayo fast_diffusion_pixel_constrained.pt (out_scale 0.05) -> breast-native fast_diffusion_pixel_breast.pt (out_scale 0.5, n_train 3600, val-loss 0.0047, pixel/ch64). dataset_kind=breast_ct (128-view 512^2 breast geometry+FOV). Canonical fast_recon constrained defaults steps8/init_t0.7/eta1.0/dc1/n_cg5/relax0.5. GOAL: does the breast-native prior lift pixel-DC-on above the 128-view FBP baseline (hr>0)? The old run scored hr=0 because the Mayo prior (out_scale 0.05, ~10x mu mismatch) degraded the strong breast FBP; a matched-scale breast prior should denoise rather than repaint. If hr>0 here, prior-mismatch was the cause; if still 0, architectural/regime ceiling.", "advice_for_others": "fastdiff_flow_pixel_constrained-claude-agentic: image_size=512, pixel_spacing=0.3516, n_angles=128, n_det=1024, det_spacing=0.35754, sod=500.0, sdd=1000.0, display_min=0.0, display_max=0.5, train_n=400, val_n=200, noise_i0=100000.0, noise_sigma_e=10.0, seed=42, dataset_kind=breast_ct, fd_recon_ckpt=/cluster/maier/Agent4CT/checkpoints/fast_diffusion_pixel_breast.pt, fd_recon_steps=8, fd_recon_init=fbp, fd_recon_init_t=0.7, fd_recon_eta=1.0, fd_recon_dc=1, fd_recon_dc_n_cg=5, fd_recon_dc_relax=0.5, rationale=iter-1 BREAST-NATIVE PRIOR SANITY (corrected re-run overwriting the hr=0 Mayo-prior run). fastdiff_flow_pixel_constrained, DC ON (fd_recon_dc=1). Prior swapped: Mayo fast_diffusion_pixel_constrained.pt (out_scale 0.05) -> breast-native fast_diffusion_pixel_breast.pt (out_scale 0.5, n_train 3600, val-loss 0.0047, pixel/ch64). dataset_kind=breast_ct (128-view 512^2 breast geometry+FOV). Canonical fast_recon constrained defaults steps8/init_t0.7/eta1.0/dc1/n_cg5/relax0.5. GOAL: does the breast-native prior lift pixel-DC-on above the 128-view FBP baseline (hr>0)? The old run scored hr=0 because the Mayo prior (out_scale 0.05, ~10x mu mismatch) degraded the strong breast FBP; a matched-scale breast prior should denoise rather than repaint. If hr>0 here, prior-mismatch was the cause; if still 0, architectural/regime ceiling.", "comparison_image": "runs/breast-ct-claude-agentic-fastdiff-flow-pixel-constrained-search-20260703-01/iterations/iter-0001/comparison.png"}
{"ts": "2026-07-06T20:20:13Z", "run_id": "breast-ct-claude-agentic-fastdiff-wdm-wavelet-constrained-search-20260703-01", "iter": 1, "agent": "fastdiff_wdm_wavelet_constrained-claude-agentic", "model": "claude-opus-4-8-1m", "change_class": "architecture", "status": "discard", "kept": false, "val_score": 0.3259071409702301, "headroom": 0.0, "params_M": 3.824908, "train_n": 3600, "rationale": "fastdiff_wdm_wavelet_constrained-claude-agentic: val_n=200, seed=42, fd_recon_ckpt=/cluster/maier/Agent4CT/checkpoints/fast_diffusion_wavelet_breast.pt, fd_recon_steps=8, fd_recon_init=fbp, fd_recon_init_t=0.7, fd_recon_eta=1.0, fd_recon_dc=1, fd_recon_dc_n_cg=5, fd_recon_dc_relax=0.5, dataset_kind=breast_ct, rationale=iter-1 ONBOARDING/FEASIBILITY fastdiff_wdm_wavelet_CONSTRAINED (per-image few-step DC-CONSTRAINED Haar-wavelet flow recon, solver_fast_recon.py) on re-split Breast-CT (train 3600/val 200/test 200, seed 20260703), val_n=200. RE-RUN with the BREAST-NATIVE wavelet prior fast_diffusion_wavelet_breast.pt (out_scale=0.5, n_train=3600, val_flow_loss 0.0031) -- the FAIR test replacing the earlier Mayo-prior fallback (out_scale 0.05, 10x mu mismatch, all 20 iters hr=0). DC ON (constrained): fd_recon_dc=1 enables the hard CG data-consistency projection each Euler step (dc_relax=0.5, n_cg=5) -- this is what makes constrained genuine (a real min||Ax-y||^2 CG solve onto the measured 128-view sinogram), vs the unconstrained sibling which sets dc=0. SIX-BOX: (1) PRIOR: none for the breast-native prior yet; nearest = the archived Mayo-prior wdm-constrained curve (all hr=0, out_scale mismatch). (2) FAILURE MODE: N/A onboarding; goal = does the breast-native DC-constrained wavelet recon clear the 128-view sparse-FBP baseline (breast baseline_PSNR ~36.3) with hr>0, confirming the recon is no longer FBP-bounded? (3) ONE KNOB: N/A baseline -- canonical fast_recon constrained defaults (8-step Euler, FBP init t=0.7, eta=1.0, DC on CG=5 relax=0.5). (4) HYPOTHESIS: with a breast-native prior (out_scale matched at 0.5) the wavelet flow now injects CORRECTLY-scaled structure and DPS+hard-CG DC anchors it to the measured sparse sinogram, so hr should clear 0 (unlike the Mayo-prior run). FALSIFIER: if hr=0 still, the sparse-view wavelet prior is over-smoothing/mis-aligned -> iters raise dc_relax toward 1.0 and lower init_t (less prior drift). (5) BUDGET: 200 slices x 8-step Euler + 5-iter CG, breast single shared PYRO-NN projector, 512^2 -- well inside HARD 20-min (30-min sbatch wall). val = ALL 200 fixed seed-20260703 val cases. (6) Loop continues; iter-2 self-dispatched on landing. Reserved levers iters 2-20: fd_recon_dc_relax, fd_recon_init_t, fd_recon_steps, fd_recon_eta, fd_recon_dc_n_cg.", "advice_for_others": "fastdiff_wdm_wavelet_constrained-claude-agentic: val_n=200, seed=42, fd_recon_ckpt=/cluster/maier/Agent4CT/checkpoints/fast_diffusion_wavelet_breast.pt, fd_recon_steps=8, fd_recon_init=fbp, fd_recon_init_t=0.7, fd_recon_eta=1.0, fd_recon_dc=1, fd_recon_dc_n_cg=5, fd_recon_dc_relax=0.5, dataset_kind=breast_ct, rationale=iter-1 ONBOARDING/FEASIBILITY fastdiff_wdm_wavelet_CONSTRAINED (per-image few-step DC-CONSTRAINED Haar-wavelet flow recon, solver_fast_recon.py) on re-split Breast-CT (train 3600/val 200/test 200, seed 20260703), val_n=200. RE-RUN with the BREAST-NATIVE wavelet prior fast_diffusion_wavelet_breast.pt (out_scale=0.5, n_train=3600, val_flow_loss 0.0031) -- the FAIR test replacing the earlier Mayo-prior fallback (out_scale 0.05, 10x mu mismatch, all 20 iters hr=0). DC ON (constrained): fd_recon_dc=1 enables the hard CG data-consistency projection each Euler step (dc_relax=0.5, n_cg=5) -- this is what makes constrained genuine (a real min||Ax-y||^2 CG solve onto the measured 128-view sinogram), vs the unconstrained sibling which sets dc=0. SIX-BOX: (1) PRIOR: none for the breast-native prior yet; nearest = the archived Mayo-prior wdm-constrained curve (all hr=0, out_scale mismatch). (2) FAILURE MODE: N/A onboarding; goal = does the breast-native DC-constrained wavelet recon clear the 128-view sparse-FBP baseline (breast baseline_PSNR ~36.3) with hr>0, confirming the recon is no longer FBP-bounded? (3) ONE KNOB: N/A baseline -- canonical fast_recon constrained defaults (8-step Euler, FBP init t=0.7, eta=1.0, DC on CG=5 relax=0.5). (4) HYPOTHESIS: with a breast-native prior (out_scale matched at 0.5) the wavelet flow now injects CORRECTLY-scaled structure and DPS+hard-CG DC anchors it to the measured sparse sinogram, so hr should clear 0 (unlike the Mayo-prior run). FALSIFIER: if hr=0 still, the sparse-view wavelet prior is over-smoothing/mis-aligned -> iters raise dc_relax toward 1.0 and lower init_t (less prior drift). (5) BUDGET: 200 slices x 8-step Euler + 5-iter CG, breast single shared PYRO-NN projector, 512^2 -- well inside HARD 20-min (30-min sbatch wall). val = ALL 200 fixed seed-20260703 val cases. (6) Loop continues; iter-2 self-dispatched on landing. Reserved levers iters 2-20: fd_recon_dc_relax, fd_recon_init_t, fd_recon_steps, fd_recon_eta, fd_recon_dc_n_cg.", "comparison_image": "runs/breast-ct-claude-agentic-fastdiff-wdm-wavelet-constrained-search-20260703-01/iterations/iter-0001/comparison.png"}
{"ts": "2026-07-06T20:19:46Z", "run_id": "breast-ct-claude-agentic-fastdiff-flow-pixel-unconstrained-search-20260703-01", "iter": 3, "agent": "fastdiff_flow_pixel_unconstrained-claude-agentic", "model": "claude-opus-4-8-1m", "change_class": "architecture", "status": "discard", "kept": false, "val_score": 0.572429358959198, "headroom": 0.0, "params_M": 3.822787, "train_n": 3600, "rationale": "fastdiff_flow_pixel_unconstrained-claude-agentic: image_size=512, pixel_spacing=0.3516, n_angles=128, n_det=1024, det_spacing=0.35754, sod=500.0, sdd=1000.0, display_min=0.0, display_max=0.5, train_n=400, val_n=200, noise_i0=100000.0, noise_sigma_e=10.0, seed=42, fd_recon_ckpt=/cluster/maier/Agent4CT/checkpoints/fast_diffusion_pixel_breast.pt, fd_recon_steps=8, fd_recon_init=fbp, fd_recon_init_t=0.2, fd_recon_eta=1.0, fd_recon_dc=0, fd_recon_dc_n_cg=5, fd_recon_dc_relax=0.5, rationale=iter-3: DC-off breast-prior. ONE KNOB init_t 0.4->0.2. TREND: iter-1 (init_t0.7) PSNR19.0/RMSE3.8e-2; iter-2 (init_t0.4) PSNR24.6/RMSE2.0e-2 - monotonic fidelity gain as init_t drops (less injected noise, sampler stays nearer the measured FBP). Both hr=0 (sparse-FBP baseline PSNR36.3/RMSE5.2e-3 is a very strong bar for a DC-free prior sampler). HYPOTHESIS: init_t=0.2 pushes PSNR further toward the FBP baseline because the DC-free sampler reduces to a light prior-denoise of the FBP init; tests whether the breast prior ALONE can approach (not just trail) the baseline. If PSNR keeps rising monotonically, the prior contributes fidelity only insofar as it preserves the FBP - the DC step (absent here) is what would let it EXCEED baseline.", "advice_for_others": "fastdiff_flow_pixel_unconstrained-claude-agentic: image_size=512, pixel_spacing=0.3516, n_angles=128, n_det=1024, det_spacing=0.35754, sod=500.0, sdd=1000.0, display_min=0.0, display_max=0.5, train_n=400, val_n=200, noise_i0=100000.0, noise_sigma_e=10.0, seed=42, fd_recon_ckpt=/cluster/maier/Agent4CT/checkpoints/fast_diffusion_pixel_breast.pt, fd_recon_steps=8, fd_recon_init=fbp, fd_recon_init_t=0.2, fd_recon_eta=1.0, fd_recon_dc=0, fd_recon_dc_n_cg=5, fd_recon_dc_relax=0.5, rationale=iter-3: DC-off breast-prior. ONE KNOB init_t 0.4->0.2. TREND: iter-1 (init_t0.7) PSNR19.0/RMSE3.8e-2; iter-2 (init_t0.4) PSNR24.6/RMSE2.0e-2 - monotonic fidelity gain as init_t drops (less injected noise, sampler stays nearer the measured FBP). Both hr=0 (sparse-FBP baseline PSNR36.3/RMSE5.2e-3 is a very strong bar for a DC-free prior sampler). HYPOTHESIS: init_t=0.2 pushes PSNR further toward the FBP baseline because the DC-free sampler reduces to a light prior-denoise of the FBP init; tests whether the breast prior ALONE can approach (not just trail) the baseline. If PSNR keeps rising monotonically, the prior contributes fidelity only insofar as it preserves the FBP - the DC step (absent here) is what would let it EXCEED baseline.", "comparison_image": "runs/breast-ct-claude-agentic-fastdiff-flow-pixel-unconstrained-search-20260703-01/iterations/iter-0003/comparison.png"}
