{"ts": "2026-07-05T21:56:37Z", "run_id": "breast-ct-claude-agentic-dual-domain-bilateral-n2i-search-20260703-01", "iter": 11, "agent": "dual_domain_bilateral_n2i-claude-agentic", "model": "claude-opus-4-8-1m", "change_class": "architecture", "status": "keep", "kept": true, "val_score": 0.9536712169647217, "headroom": 0.18347694148989335, "params_M": 6e-06, "train_n": 400, "rationale": "dual_domain_bilateral_n2i-claude-agentic: warm_start=True, pretrain_epochs=2, train_n=400, n_iter=30, val_n=200, batch_size=1, grad_clip=1.0, lr=0.002, proj_n_bf=1, img_n_bf=1, img_sr=0.0002, outer_wall_s=900, seed=42, rationale=iter-11 dual_domain_bilateral_n2i, ONE-KNOB: per-scene Adam lr 0.005->0.002 (gentler optimization), on iter-7 CHAMPION base (img_sr=0.0002, img_kernel=7 default, n_iter=30). img_kernel REVERTED to 7 (iter-10 kernel 7->5 gave hr=0.1260 = TIED with iter-7 0.1261 on a clean val_n=200 -> kernel is NEUTRAL; the tight range sigma, not window size, sets edge-preservation). PLATEAU: iters 5,7,10 all cluster at hr~0.126 (img_sr-driven ceiling). HYPOTHESIS: the N2I self-sup target is the noisy 64-view half-FBP, so each Adam step pulls the BF PARTLY toward that noise floor; at lr=5e-3 the 30-step fit may OVERSHOOT the sweet spot (denoised but sharp) toward the noisy target. A gentler lr=2e-3 lets the fit settle MORE PRECISELY at the edge-preserving optimum before drifting toward noise -> hr could edge above 0.126. If FLAT/DROP, the 30-step fit is already well-damped and lr is neutral -> the ~0.126 plateau is the genuine edge-preserving N2I ceiling on dense breast. BUDGET: same step count, ~700-950s, val_n=200 expected. ONE knob: lr 0.005->0.002.", "advice_for_others": "dual_domain_bilateral_n2i-claude-agentic: warm_start=True, pretrain_epochs=2, train_n=400, n_iter=30, val_n=200, batch_size=1, grad_clip=1.0, lr=0.002, proj_n_bf=1, img_n_bf=1, img_sr=0.0002, outer_wall_s=900, seed=42, rationale=iter-11 dual_domain_bilateral_n2i, ONE-KNOB: per-scene Adam lr 0.005->0.002 (gentler optimization), on iter-7 CHAMPION base (img_sr=0.0002, img_kernel=7 default, n_iter=30). img_kernel REVERTED to 7 (iter-10 kernel 7->5 gave hr=0.1260 = TIED with iter-7 0.1261 on a clean val_n=200 -> kernel is NEUTRAL; the tight range sigma, not window size, sets edge-preservation). PLATEAU: iters 5,7,10 all cluster at hr~0.126 (img_sr-driven ceiling). HYPOTHESIS: the N2I self-sup target is the noisy 64-view half-FBP, so each Adam step pulls the BF PARTLY toward that noise floor; at lr=5e-3 the 30-step fit may OVERSHOOT the sweet spot (denoised but sharp) toward the noisy target. A gentler lr=2e-3 lets the fit settle MORE PRECISELY at the edge-preserving optimum before drifting toward noise -> hr could edge above 0.126. If FLAT/DROP, the 30-step fit is already well-damped and lr is neutral -> the ~0.126 plateau is the genuine edge-preserving N2I ceiling on dense breast. BUDGET: same step count, ~700-950s, val_n=200 expected. ONE knob: lr 0.005->0.002.", "comparison_image": "runs/breast-ct-claude-agentic-dual-domain-bilateral-n2i-search-20260703-01/iterations/iter-0011/comparison.png"}
{"ts": "2026-07-05T21:55:44Z", "run_id": "breast-ct-claude-agentic-tv-iterative-supervised-search-20260703-01", "iter": 14, "agent": "tv_iterative_supervised-claude-agentic", "model": "claude-opus-4-8-1m", "change_class": "architecture", "status": "keep", "kept": true, "val_score": 0.9203903079032898, "headroom": 0.001545332660450427, "params_M": 2e-05, "train_n": 400, "rationale": "tv_iterative_supervised-claude-agentic: val_n=200, val_chunk=5, train_n=400, epochs=20, batch_size=1, lr=0.005, tv_K=10, tv_step_init=0.001, tv_lambda_init=5.0, tv_share_steps=False, tv_eps=1e-06, lambda_neg=1.0, loss_base=mse, grad_clip=1.0, rationale=tv_iterative_supervised iter-14 (breast_ct). LAMBDA-INIT high edge (close the lambda box). Best = iter-12 (K=10, lambda_init=1.0, epochs=20) hr=0.1495. Lambda axis: 0.05->0.1195, 0.2->0.1462, 1.0->0.1471 (epochs10) / 0.1495 (epochs20). The learned lambda schedule front-loads to very high values (iter-12 lambda[1]~3400). ONE KNOB vs iter-12: tv_lambda_init 1.0->5.0 (epochs=20 kept). HYPOTHESIS: initialising lambda higher (5.0) starts the schedule closer to its front-loaded operating point so hr edges above 0.1495. FALSIFIER: hr <= 0.15 -> the lambda-denoising plateau (~0.15) is fully mapped and is the config-only ceiling; the step-collapse (data-consistency off) caps supervised-unrolled-TV here. BUDGET: iter-12 epochs=20 ran under wall (~1050s).", "advice_for_others": "tv_iterative_supervised-claude-agentic: val_n=200, val_chunk=5, train_n=400, epochs=20, batch_size=1, lr=0.005, tv_K=10, tv_step_init=0.001, tv_lambda_init=5.0, tv_share_steps=False, tv_eps=1e-06, lambda_neg=1.0, loss_base=mse, grad_clip=1.0, rationale=tv_iterative_supervised iter-14 (breast_ct). LAMBDA-INIT high edge (close the lambda box). Best = iter-12 (K=10, lambda_init=1.0, epochs=20) hr=0.1495. Lambda axis: 0.05->0.1195, 0.2->0.1462, 1.0->0.1471 (epochs10) / 0.1495 (epochs20). The learned lambda schedule front-loads to very high values (iter-12 lambda[1]~3400). ONE KNOB vs iter-12: tv_lambda_init 1.0->5.0 (epochs=20 kept). HYPOTHESIS: initialising lambda higher (5.0) starts the schedule closer to its front-loaded operating point so hr edges above 0.1495. FALSIFIER: hr <= 0.15 -> the lambda-denoising plateau (~0.15) is fully mapped and is the config-only ceiling; the step-collapse (data-consistency off) caps supervised-unrolled-TV here. BUDGET: iter-12 epochs=20 ran under wall (~1050s).", "comparison_image": "runs/breast-ct-claude-agentic-tv-iterative-supervised-search-20260703-01/iterations/iter-0014/comparison.png"}
{"ts": "2026-07-05T21:45:27Z", "run_id": "breast-ct-claude-agentic-dual-domain-n2i-search-20260703-01", "iter": 5, "agent": "dual_domain_n2i-claude-agentic", "model": "claude-opus-4-8-1m", "change_class": "architecture", "status": "discard", "kept": false, "val_score": 0.9414029717445374, "headroom": 0.0, "params_M": 0.465762, "train_n": 400, "rationale": "dual_domain_n2i-claude-agentic: warm_start=True, pretrain_epochs=3, pretrain_steps=0, n_iter=200, grad_clip=1.0, outer_wall_s=1400, per_scene_s=None, batch_size=1, lr=0.0003, optimizer=adam, unet_c=16, train_n=400, val_n=200, seed=42, rationale=iter-5 SIX-BOX. (1) PRIOR: iter-4 hr=0.0, warm_start OFF (pure per-image from scratch, n_iter=300) gave rmse=0.00651, ssim=0.938, 197/200 -- no better than warm-started iters. So the amortised warm-start is NOT what pulls scans to over-smooth; from-scratch fits reach the same FBP-consistent plateau. Iters 1-4 (budget, per-scene fit, capacity, warm-start on/off) ALL pinned at hr=0. (2) FAILURE MODE: structural over-smoothing set by the 128-view FBP self-supervision target, independent of budget/capacity/init. (3) ONE KNOB: lr 1e-3 -> 3e-4 (back to warm_start=True, c=16, n_iter=200 -- identical to iter-2 except lr). (4) HYPOTHESIS: a gentler per-image step size may let the N2I fit settle into a sharper local optimum instead of over-shooting into an over-smoothed mean; if hr rises, the over-smoothing was partly an optimization/step-size artifact. Per the documented ceiling, more likely lr just changes convergence speed and the SAME over-smoothed solution is reached (hr=0), since the target itself is the limiter. (5) BUDGET: identical compute profile to iter-2 (warm-start ep=3 + 200*7.0s + figure ~= 26 min < 30-min wall). (6) Loop continues; iter-6 self-dispatched. Reserved levers: lr up (3e-3), n_iter early-stop (50), pretrain_epochs up (10), unet_c=8, grad_clip variation.", "advice_for_others": "dual_domain_n2i-claude-agentic: warm_start=True, pretrain_epochs=3, pretrain_steps=0, n_iter=200, grad_clip=1.0, outer_wall_s=1400, per_scene_s=None, batch_size=1, lr=0.0003, optimizer=adam, unet_c=16, train_n=400, val_n=200, seed=42, rationale=iter-5 SIX-BOX. (1) PRIOR: iter-4 hr=0.0, warm_start OFF (pure per-image from scratch, n_iter=300) gave rmse=0.00651, ssim=0.938, 197/200 -- no better than warm-started iters. So the amortised warm-start is NOT what pulls scans to over-smooth; from-scratch fits reach the same FBP-consistent plateau. Iters 1-4 (budget, per-scene fit, capacity, warm-start on/off) ALL pinned at hr=0. (2) FAILURE MODE: structural over-smoothing set by the 128-view FBP self-supervision target, independent of budget/capacity/init. (3) ONE KNOB: lr 1e-3 -> 3e-4 (back to warm_start=True, c=16, n_iter=200 -- identical to iter-2 except lr). (4) HYPOTHESIS: a gentler per-image step size may let the N2I fit settle into a sharper local optimum instead of over-shooting into an over-smoothed mean; if hr rises, the over-smoothing was partly an optimization/step-size artifact. Per the documented ceiling, more likely lr just changes convergence speed and the SAME over-smoothed solution is reached (hr=0), since the target itself is the limiter. (5) BUDGET: identical compute profile to iter-2 (warm-start ep=3 + 200*7.0s + figure ~= 26 min < 30-min wall). (6) Loop continues; iter-6 self-dispatched. Reserved levers: lr up (3e-3), n_iter early-stop (50), pretrain_epochs up (10), unet_c=8, grad_clip variation.", "comparison_image": "runs/breast-ct-claude-agentic-dual-domain-n2i-search-20260703-01/iterations/iter-0005/comparison.png"}
{"ts": "2026-07-05T21:43:26Z", "run_id": "breast-ct-claude-agentic-r2gaussian-search-20260703-01", "iter": 16, "agent": "r2gaussian-claude-agentic", "model": "claude-opus-4-8-1m", "change_class": "architecture", "status": "discard", "kept": false, "val_score": 0.9275661110877991, "headroom": 0.0, "params_M": 0.006144, "train_n": 400, "rationale": "r2gaussian-claude-agentic: val_n=15, gs_n_gaussians=1024, gs_n_iter=130, gs_lr_pos=0.005, gs_lr_scale=0.01, gs_lr_amp=0.01, gs_lr_rot=0.01, gs_amp_init=0.01, gs_scale_init=0.04, gs_tv_weight=0.0001, gs_n_clip=0.05, gs_init_from_fbp=True, gs_render=raster, gs_ssim_weight=0.3, seed=42, train_n=0, rationale=iter-16 (search-20260703-01) -- CEILING CONFIRMATION #8. SIX-BOX: hr pinned 0 at EVERY prior iter; best SSIM 0.9278 @ iter-6. R2-Gaussian is REGIME-BOUNDED on dense 128-view breast: the coarse anisotropic-Gaussian basis (1024 splats, 0.006M params) plateaus at SSIM ~0.928 / PSNR ~28.7 dB, ~7.3 dB BELOW the 128-view FBP baseline (PSNR 35.97), so the RMSE/PSNR-gated headroom stays 0 (reproduces findings.md 2026-06-03). All 7 lever families mapped+exhausted (steps FLAT, capacity +0.010, warm-start +0.039, SSIM-loss +0.073, SSIM-weight saturated, basis-scale FLAT, TV-reg FLAT); NONE moves hr off 0 -- the strongest (warm-start + SSIM-loss) got closest but stayed 7.3 dB short. The R2-G paper's regime is SPARSE-view CBCT (<=50 views) where FBP is weak; dense 128-view 2D CT is the wrong inductive bias. DECISION: empty-patch re-run of the iter-6 run-best config (warm-start + SSIM-loss@0.30, 1024G/130it) to confirm SSIM ~0.928 / hr=0 reproduces. BUDGET: ~660-1000s node-dependent, under the 1080 in-solver wall and 1800 SLURM wall, figure excluded. val_n=15 HELD CONSTANT. PREDICTION: SSIM ~0.928 (0.925-0.930), hr 0 -- faithful-but-regime-bounded negative result., gs_outer_wall_s=1080, gs_amp_init_max=0.05", "advice_for_others": "r2gaussian-claude-agentic: val_n=15, gs_n_gaussians=1024, gs_n_iter=130, gs_lr_pos=0.005, gs_lr_scale=0.01, gs_lr_amp=0.01, gs_lr_rot=0.01, gs_amp_init=0.01, gs_scale_init=0.04, gs_tv_weight=0.0001, gs_n_clip=0.05, gs_init_from_fbp=True, gs_render=raster, gs_ssim_weight=0.3, seed=42, train_n=0, rationale=iter-16 (search-20260703-01) -- CEILING CONFIRMATION #8. SIX-BOX: hr pinned 0 at EVERY prior iter; best SSIM 0.9278 @ iter-6. R2-Gaussian is REGIME-BOUNDED on dense 128-view breast: the coarse anisotropic-Gaussian basis (1024 splats, 0.006M params) plateaus at SSIM ~0.928 / PSNR ~28.7 dB, ~7.3 dB BELOW the 128-view FBP baseline (PSNR 35.97), so the RMSE/PSNR-gated headroom stays 0 (reproduces findings.md 2026-06-03). All 7 lever families mapped+exhausted (steps FLAT, capacity +0.010, warm-start +0.039, SSIM-loss +0.073, SSIM-weight saturated, basis-scale FLAT, TV-reg FLAT); NONE moves hr off 0 -- the strongest (warm-start + SSIM-loss) got closest but stayed 7.3 dB short. The R2-G paper's regime is SPARSE-view CBCT (<=50 views) where FBP is weak; dense 128-view 2D CT is the wrong inductive bias. DECISION: empty-patch re-run of the iter-6 run-best config (warm-start + SSIM-loss@0.30, 1024G/130it) to confirm SSIM ~0.928 / hr=0 reproduces. BUDGET: ~660-1000s node-dependent, under the 1080 in-solver wall and 1800 SLURM wall, figure excluded. val_n=15 HELD CONSTANT. PREDICTION: SSIM ~0.928 (0.925-0.930), hr 0 -- faithful-but-regime-bounded negative result., gs_outer_wall_s=1080, gs_amp_init_max=0.05", "comparison_image": "runs/breast-ct-claude-agentic-r2gaussian-search-20260703-01/iterations/iter-0016/comparison.png"}
{"ts": "2026-07-05T21:42:53Z", "run_id": "breast-ct-claude-agentic-tv-iterative-supervised-search-20260703-01", "iter": 13, "agent": "tv_iterative_supervised-claude-agentic", "model": "claude-opus-4-8-1m", "change_class": "architecture", "status": "keep", "kept": true, "val_score": 0.9575591683387756, "headroom": 0.14919166974247755, "params_M": 2e-05, "train_n": 400, "rationale": "tv_iterative_supervised-claude-agentic: val_n=200, val_chunk=5, train_n=800, epochs=10, batch_size=1, lr=0.005, tv_K=10, tv_step_init=0.001, tv_lambda_init=1.0, tv_share_steps=False, tv_eps=1e-06, lambda_neg=1.0, loss_base=mse, grad_clip=1.0, rationale=tv_iterative_supervised iter-13 RE-DISPATCH (breast_ct). The prior iter-13 (train_n=1200) was CANCELLED at the 30-min wall (reached only epoch 7/10 at 22:23) -- train_n=1200 is too slow. Same TRAIN_N hypothesis, budget-fitted. Best = iter-12 (K=10, lambda=1.0, epochs=20) hr=0.1495; the lambda-denoising plateau ~0.15 across all explored axes. ONE KNOB vs the iter-10 base (K=10, epochs=10, lambda=1.0, train_n=400): train_n 400->800 (2x, was 3x). HYPOTHESIS: more training phantoms give the 20 step/lambda scalars a less-noisy gradient of the optimal per-iter TV schedule so hr rises above 0.1495. FALSIFIER: hr ~0.15 -> the 20-scalar schedule is data-saturated at train_n=400 and ~0.15 is the config-only ceiling. BUDGET: train_n=800 epochs=10 ~ 2x the iter-10 train (~750s) minus fixed val/load -> est ~1050-1150s, under 1200s wall.", "advice_for_others": "tv_iterative_supervised-claude-agentic: val_n=200, val_chunk=5, train_n=800, epochs=10, batch_size=1, lr=0.005, tv_K=10, tv_step_init=0.001, tv_lambda_init=1.0, tv_share_steps=False, tv_eps=1e-06, lambda_neg=1.0, loss_base=mse, grad_clip=1.0, rationale=tv_iterative_supervised iter-13 RE-DISPATCH (breast_ct). The prior iter-13 (train_n=1200) was CANCELLED at the 30-min wall (reached only epoch 7/10 at 22:23) -- train_n=1200 is too slow. Same TRAIN_N hypothesis, budget-fitted. Best = iter-12 (K=10, lambda=1.0, epochs=20) hr=0.1495; the lambda-denoising plateau ~0.15 across all explored axes. ONE KNOB vs the iter-10 base (K=10, epochs=10, lambda=1.0, train_n=400): train_n 400->800 (2x, was 3x). HYPOTHESIS: more training phantoms give the 20 step/lambda scalars a less-noisy gradient of the optimal per-iter TV schedule so hr rises above 0.1495. FALSIFIER: hr ~0.15 -> the 20-scalar schedule is data-saturated at train_n=400 and ~0.15 is the config-only ceiling. BUDGET: train_n=800 epochs=10 ~ 2x the iter-10 train (~750s) minus fixed val/load -> est ~1050-1150s, under 1200s wall.", "comparison_image": "runs/breast-ct-claude-agentic-tv-iterative-supervised-search-20260703-01/iterations/iter-0013/comparison.png"}
{"ts": "2026-07-05T21:33:59Z", "run_id": "breast-ct-claude-agentic-dual-domain-bilateral-n2i-search-20260703-01", "iter": 10, "agent": "dual_domain_bilateral_n2i-claude-agentic", "model": "claude-opus-4-8-1m", "change_class": "architecture", "status": "keep", "kept": true, "val_score": 0.9606124758720398, "headroom": 0.12600588106777144, "params_M": 6e-06, "train_n": 400, "rationale": "dual_domain_bilateral_n2i-claude-agentic: warm_start=True, pretrain_epochs=2, train_n=400, n_iter=30, val_n=200, batch_size=1, grad_clip=1.0, lr=0.005, proj_n_bf=1, img_n_bf=1, img_sr=0.0002, img_kernel=5, outer_wall_s=900, seed=42, rationale=iter-10 dual_domain_bilateral_n2i, ONE-KNOB: image BF KERNEL img_kernel 7->5 (tighter spatial window), on iter-7 CHAMPION base (img_sr=0.0002, img_sx=img_sy=1.5 default, n_iter=30). Spatial sigma REVERTED to default 1.5 (iter-9 widen 1.5->2.5 gave hr=0.1140 < champ 0.1261 -> widening blurs fibroglandular detail; spatial axis does NOT want to widen). CHAMPION = iter-7 hr=0.1261 SSIM0.9606 (val_n=200). HYPOTHESIS: iter-9 showed breast fine structure is DAMAGED by a wider spatial support -> the recon wants the SHARPEST possible spatial averaging. A 5x5 kernel (vs 7x7) confines the BF to immediate neighbours, denoising flat noise while preserving the finest fibroglandular edges better than 7x7 -> hr could edge above 0.1261. If FLAT/DROP, 7x7 is already fine (the tight range sigma, not the window, sets edge-preservation) and kernel is neutral. SECONDARY BENEFIT: 5x5 unfold is FASTER than 7x7 -> keeps the per-image loop under outer_wall_s=900 so val_n stays a clean 200 (iters 8/9 trimmed to 193 under heavier configs, confounding hr). BUDGET: smaller kernel -> ~700-900s, no wall trim expected. ONE knob: img_kernel 7->5.", "advice_for_others": "dual_domain_bilateral_n2i-claude-agentic: warm_start=True, pretrain_epochs=2, train_n=400, n_iter=30, val_n=200, batch_size=1, grad_clip=1.0, lr=0.005, proj_n_bf=1, img_n_bf=1, img_sr=0.0002, img_kernel=5, outer_wall_s=900, seed=42, rationale=iter-10 dual_domain_bilateral_n2i, ONE-KNOB: image BF KERNEL img_kernel 7->5 (tighter spatial window), on iter-7 CHAMPION base (img_sr=0.0002, img_sx=img_sy=1.5 default, n_iter=30). Spatial sigma REVERTED to default 1.5 (iter-9 widen 1.5->2.5 gave hr=0.1140 < champ 0.1261 -> widening blurs fibroglandular detail; spatial axis does NOT want to widen). CHAMPION = iter-7 hr=0.1261 SSIM0.9606 (val_n=200). HYPOTHESIS: iter-9 showed breast fine structure is DAMAGED by a wider spatial support -> the recon wants the SHARPEST possible spatial averaging. A 5x5 kernel (vs 7x7) confines the BF to immediate neighbours, denoising flat noise while preserving the finest fibroglandular edges better than 7x7 -> hr could edge above 0.1261. If FLAT/DROP, 7x7 is already fine (the tight range sigma, not the window, sets edge-preservation) and kernel is neutral. SECONDARY BENEFIT: 5x5 unfold is FASTER than 7x7 -> keeps the per-image loop under outer_wall_s=900 so val_n stays a clean 200 (iters 8/9 trimmed to 193 under heavier configs, confounding hr). BUDGET: smaller kernel -> ~700-900s, no wall trim expected. ONE knob: img_kernel 7->5.", "comparison_image": "runs/breast-ct-claude-agentic-dual-domain-bilateral-n2i-search-20260703-01/iterations/iter-0010/comparison.png"}
