{"ts": "2026-07-05T20:30:20Z", "run_id": "breast-ct-claude-agentic-naf-search-20260703-01", "iter": 2, "agent": "naf-claude-agentic", "model": "claude-opus-4-8-1m", "change_class": "architecture", "status": "discard", "kept": false, "val_score": 0.7526856660842896, "headroom": 0.0, "params_M": 0.039681, "train_n": 0, "rationale": "naf-claude-agentic: val_n=12, naf_n_freqs=12, naf_hidden=128, naf_layers=4, naf_n_iter=8000, naf_lr=0.01, naf_tv_weight=0.0001, naf_n_clip=0.05, naf_outer_wall_s=800, naf_per_scene_s=60.0, naf_encoding=fourier, seed=42, rationale=iter-2 breast-ct-claude-agentic-naf-search-20260703-01 (redone breast split train3600/val200/test200 seed20260703; val_n=12 CONSTANT for iters 2-20 per coordinator budget intervention 2026-07-05 -- first-12 of the 200-case breast val split, deterministic). SIX-BOX: (1) prior result: all iters so far hr=0 (iter-1 val_n=20 ssim0.355 PSNR6.26 in 970s, NOT a timeout -- a genuine converged fit). (2) failure mode: NAF per-scene INR recon is far below the 128-view breast LD-FBP baseline. (3) ONE knob changed: naf_n_freqs 8->12. (4) hypothesis: Prior iters hr=0 (iter-1 ssim0.355). KNOB: raise Fourier posenc bands 8->12 (finer spatial frequencies). HYPOTHESIS: the coordinate-MLP basis may be too coarse for dense soft-tissue detail; more high-freq bands could let the field represent fine breast structure -> clear FBP. Expect still hr=0 (findings.md: sin/cos posenc structurally too coarse at 512^2/128-views) but tests the capacity axis first. (5) wall: val_n=12 x per_scene 60.0s = ~720s < 20min. (6) serial, no user return.", "advice_for_others": "naf-claude-agentic: val_n=12, naf_n_freqs=12, naf_hidden=128, naf_layers=4, naf_n_iter=8000, naf_lr=0.01, naf_tv_weight=0.0001, naf_n_clip=0.05, naf_outer_wall_s=800, naf_per_scene_s=60.0, naf_encoding=fourier, seed=42, rationale=iter-2 breast-ct-claude-agentic-naf-search-20260703-01 (redone breast split train3600/val200/test200 seed20260703; val_n=12 CONSTANT for iters 2-20 per coordinator budget intervention 2026-07-05 -- first-12 of the 200-case breast val split, deterministic). SIX-BOX: (1) prior result: all iters so far hr=0 (iter-1 val_n=20 ssim0.355 PSNR6.26 in 970s, NOT a timeout -- a genuine converged fit). (2) failure mode: NAF per-scene INR recon is far below the 128-view breast LD-FBP baseline. (3) ONE knob changed: naf_n_freqs 8->12. (4) hypothesis: Prior iters hr=0 (iter-1 ssim0.355). KNOB: raise Fourier posenc bands 8->12 (finer spatial frequencies). HYPOTHESIS: the coordinate-MLP basis may be too coarse for dense soft-tissue detail; more high-freq bands could let the field represent fine breast structure -> clear FBP. Expect still hr=0 (findings.md: sin/cos posenc structurally too coarse at 512^2/128-views) but tests the capacity axis first. (5) wall: val_n=12 x per_scene 60.0s = ~720s < 20min. (6) serial, no user return.", "comparison_image": "runs/breast-ct-claude-agentic-naf-search-20260703-01/iterations/iter-0002/comparison.png"}
{"ts": "2026-07-05T20:28:17Z", "run_id": "breast-ct-claude-agentic-tv-iterative-supervised-search-20260703-01", "iter": 11, "agent": "tv_iterative_supervised-claude-agentic", "model": "claude-opus-4-8-1m", "change_class": "architecture", "status": "discard", "kept": false, "val_score": 0.919886589050293, "headroom": 0.0, "params_M": 6e-05, "train_n": 400, "rationale": "tv_iterative_supervised-claude-agentic: val_n=100, val_chunk=5, train_n=400, epochs=8, batch_size=1, lr=0.005, tv_K=30, tv_step_init=0.001, tv_lambda_init=1.0, tv_share_steps=False, tv_eps=1e-06, lambda_neg=1.0, loss_base=mse, grad_clip=1.0, rationale=tv_iterative_supervised iter-11 RE-DISPATCH (breast_ct). The prior iter-11 (K=30, val_n=200, epochs=10) was CANCELLED at the 30-min TIME LIMIT (job 772264 reached only epoch 7) -- K=30 val over 200 slices + train blew the wall. Same hypothesis, budget-fitted. DEPTH x strong-lambda: lambda axis plateaued (0.05->hr0.1195, 0.2->0.1462, 1.0->0.1471) with step->0 so only TV smoothing acts; more K = more TV-denoising passes now that lambda is the ACTIVE lever. ONE KNOB vs the iter-10 winner (K=10 lambda=1.0 hr=0.1471): tv_K 10->30. BUDGET CUT to fit the 20-min wall (NOT extra knobs, just sizing): val_n 200->100 (halves the K=30 val pass) and epochs 10->8; the prior run showed lambda already at ~1.0 by epoch 6 so 8 epochs suffices. HYPOTHESIS: 30 TV passes denoise further than 10 so hr rises above 0.1471. NOTE val_n=100 vs 200 slightly changes the val set (evenly-spaced subset) so hr is ~comparable but not identical; the winner will be re-confirmed at val_n=200 if it leads. FALSIFIER: hr saturates ~0.147 -> per-pass TV converged by K=10, depth redundant. BUDGET: K=30 x100 slices x epochs8 -> est ~750-900s, under 1200s wall.", "advice_for_others": "tv_iterative_supervised-claude-agentic: val_n=100, val_chunk=5, train_n=400, epochs=8, batch_size=1, lr=0.005, tv_K=30, tv_step_init=0.001, tv_lambda_init=1.0, tv_share_steps=False, tv_eps=1e-06, lambda_neg=1.0, loss_base=mse, grad_clip=1.0, rationale=tv_iterative_supervised iter-11 RE-DISPATCH (breast_ct). The prior iter-11 (K=30, val_n=200, epochs=10) was CANCELLED at the 30-min TIME LIMIT (job 772264 reached only epoch 7) -- K=30 val over 200 slices + train blew the wall. Same hypothesis, budget-fitted. DEPTH x strong-lambda: lambda axis plateaued (0.05->hr0.1195, 0.2->0.1462, 1.0->0.1471) with step->0 so only TV smoothing acts; more K = more TV-denoising passes now that lambda is the ACTIVE lever. ONE KNOB vs the iter-10 winner (K=10 lambda=1.0 hr=0.1471): tv_K 10->30. BUDGET CUT to fit the 20-min wall (NOT extra knobs, just sizing): val_n 200->100 (halves the K=30 val pass) and epochs 10->8; the prior run showed lambda already at ~1.0 by epoch 6 so 8 epochs suffices. HYPOTHESIS: 30 TV passes denoise further than 10 so hr rises above 0.1471. NOTE val_n=100 vs 200 slightly changes the val set (evenly-spaced subset) so hr is ~comparable but not identical; the winner will be re-confirmed at val_n=200 if it leads. FALSIFIER: hr saturates ~0.147 -> per-pass TV converged by K=10, depth redundant. BUDGET: K=30 x100 slices x epochs8 -> est ~750-900s, under 1200s wall.", "comparison_image": "runs/breast-ct-claude-agentic-tv-iterative-supervised-search-20260703-01/iterations/iter-0011/comparison.png"}
{"ts": "2026-07-05T20:23:37Z", "run_id": "breast-ct-claude-agentic-tv-iterative-search-20260703-01", "iter": 16, "agent": "tv_iterative-claude-agentic", "model": "claude-opus-4-8-1m", "change_class": "architecture", "status": "keep", "kept": true, "val_score": 0.990943968296051, "headroom": 0.36106196610716823, "params_M": 0.0, "train_n": 400, "rationale": "tv_iterative-claude-agentic: val_n=200, tv_lambda=0.0025, tv_iterations=1500, tv_lr=0.01, tv_decay=0.01, tv_optimizer=gd, tv_init=fbp, rationale=iter-16 DEEP-CONVERGENCE at the peak lambda. Lambda peak fully mapped at 2.5e-3 (iter-8 hr=0.36286): 2e-3=0.3552, 2.25e-3=0.3607, 2.5e-3=0.36286 PEAK, 2.75e-3=0.36233, 3e-3=0.3597, 4e-3=0.3336. iter-8->12 (1000->1200 iters) was flat (0.36286->0.36274) but decay shrinks late steps ~11x, so residual TV descent is very slow; a bigger iteration jump may still extract a little. ONE knob: tv_iterations 1000->1500 (keep gd, lambda=2.5e-3, lr=0.01, decay=0.01, fbp). HYPOTHESIS: if hr rises past 0.36286 the peak-lambda optimum was still marginally convergence-limited; if flat, 0.36286 is the firm plain-TV plateau on breast. Budget: iter-8 ~950s at 1000 -> ~1400s at 1500 (watch; <1800s job wall).", "advice_for_others": "tv_iterative-claude-agentic: val_n=200, tv_lambda=0.0025, tv_iterations=1500, tv_lr=0.01, tv_decay=0.01, tv_optimizer=gd, tv_init=fbp, rationale=iter-16 DEEP-CONVERGENCE at the peak lambda. Lambda peak fully mapped at 2.5e-3 (iter-8 hr=0.36286): 2e-3=0.3552, 2.25e-3=0.3607, 2.5e-3=0.36286 PEAK, 2.75e-3=0.36233, 3e-3=0.3597, 4e-3=0.3336. iter-8->12 (1000->1200 iters) was flat (0.36286->0.36274) but decay shrinks late steps ~11x, so residual TV descent is very slow; a bigger iteration jump may still extract a little. ONE knob: tv_iterations 1000->1500 (keep gd, lambda=2.5e-3, lr=0.01, decay=0.01, fbp). HYPOTHESIS: if hr rises past 0.36286 the peak-lambda optimum was still marginally convergence-limited; if flat, 0.36286 is the firm plain-TV plateau on breast. Budget: iter-8 ~950s at 1000 -> ~1400s at 1500 (watch; <1800s job wall).", "comparison_image": "runs/breast-ct-claude-agentic-tv-iterative-search-20260703-01/iterations/iter-0016/comparison.png"}
{"ts": "2026-07-05T20:15:59Z", "run_id": "breast-ct-claude-agentic-dual-domain-bilateral-n2i-search-20260703-01", "iter": 7, "agent": "dual_domain_bilateral_n2i-claude-agentic", "model": "claude-opus-4-8-1m", "change_class": "architecture", "status": "keep", "kept": true, "val_score": 0.960568368434906, "headroom": 0.12607235920622262, "params_M": 6e-06, "train_n": 400, "rationale": "dual_domain_bilateral_n2i-claude-agentic: warm_start=True, pretrain_epochs=2, train_n=400, n_iter=30, val_n=200, batch_size=1, grad_clip=1.0, lr=0.005, proj_n_bf=1, img_n_bf=1, img_sr=0.0002, outer_wall_s=900, seed=42, rationale=iter-7 dual_domain_bilateral_n2i, ONE-KNOB: image BF range sigma img_sr 0.0005->0.0002 (even tighter edge-preservation). proj_sr REVERTED to default 0.02 (iter-6 tightened proj_sr->0.0005 and hr DROPPED 0.1257->0.1003 = edge-hard projection filtering causes view inconsistency, findings.md confirmed; proj domain stays gentle). CHAMPION = iter-5 (img_sr=0.0005) hr=0.1257 SSIM0.9605 PSNR39.57. HYPOTHESIS: the image-domain range sigma is the live lever; 0.02->0.0005 gained +0.126 hr by making the BF stop at intensity edges. A yet-tighter 0.0002 preserves MORE fibroglandular edge detail -> hr climbs further, UNLESS the kernel becomes near-identity (range so tight the BF barely averages -> no denoising -> recon regresses toward the raw noisy FBP, hr back toward 0). This iter locates which side of the sweet spot 0.0005 is on: if hr>0.1257 keep tightening (0.0001); if hr<0.1257 the optimum is at/above 0.0005 (next: 0.001). BUDGET: value change, ~1000s. ONE knob: img_sr 0.0005->0.0002.", "advice_for_others": "dual_domain_bilateral_n2i-claude-agentic: warm_start=True, pretrain_epochs=2, train_n=400, n_iter=30, val_n=200, batch_size=1, grad_clip=1.0, lr=0.005, proj_n_bf=1, img_n_bf=1, img_sr=0.0002, outer_wall_s=900, seed=42, rationale=iter-7 dual_domain_bilateral_n2i, ONE-KNOB: image BF range sigma img_sr 0.0005->0.0002 (even tighter edge-preservation). proj_sr REVERTED to default 0.02 (iter-6 tightened proj_sr->0.0005 and hr DROPPED 0.1257->0.1003 = edge-hard projection filtering causes view inconsistency, findings.md confirmed; proj domain stays gentle). CHAMPION = iter-5 (img_sr=0.0005) hr=0.1257 SSIM0.9605 PSNR39.57. HYPOTHESIS: the image-domain range sigma is the live lever; 0.02->0.0005 gained +0.126 hr by making the BF stop at intensity edges. A yet-tighter 0.0002 preserves MORE fibroglandular edge detail -> hr climbs further, UNLESS the kernel becomes near-identity (range so tight the BF barely averages -> no denoising -> recon regresses toward the raw noisy FBP, hr back toward 0). This iter locates which side of the sweet spot 0.0005 is on: if hr>0.1257 keep tightening (0.0001); if hr<0.1257 the optimum is at/above 0.0005 (next: 0.001). BUDGET: value change, ~1000s. ONE knob: img_sr 0.0005->0.0002.", "comparison_image": "runs/breast-ct-claude-agentic-dual-domain-bilateral-n2i-search-20260703-01/iterations/iter-0007/comparison.png"}
{"ts": "2026-07-05T20:13:59Z", "run_id": "breast-ct-claude-agentic-r2gaussian-search-20260703-01", "iter": 10, "agent": "r2gaussian-claude-agentic", "model": "claude-opus-4-8-1m", "change_class": "architecture", "status": "discard", "kept": false, "val_score": 0.9278508424758911, "headroom": 0.0, "params_M": 0.006144, "train_n": 400, "rationale": "r2gaussian-claude-agentic: val_n=15, gs_n_gaussians=1024, gs_n_iter=130, gs_lr_pos=0.005, gs_lr_scale=0.01, gs_lr_amp=0.01, gs_lr_rot=0.01, gs_amp_init=0.01, gs_scale_init=0.04, gs_tv_weight=0.0001, gs_n_clip=0.05, gs_init_from_fbp=True, gs_render=raster, gs_ssim_weight=0.3, seed=42, train_n=0, rationale=iter-10 (search-20260703-01) -- CEILING CONFIRMATION #2. SIX-BOX: hr pinned 0 at EVERY prior iter; best SSIM 0.9278 @ iter-6. R2-Gaussian is REGIME-BOUNDED on dense 128-view breast: the coarse anisotropic-Gaussian basis (1024 splats, 0.006M params) plateaus at SSIM ~0.928 / PSNR ~28.7 dB, ~7.3 dB BELOW the 128-view FBP baseline (PSNR 35.97), so the RMSE/PSNR-gated headroom stays 0 (reproduces findings.md 2026-06-03). All 7 lever families mapped+exhausted (steps FLAT, capacity +0.010, warm-start +0.039, SSIM-loss +0.073, SSIM-weight saturated, basis-scale FLAT, TV-reg FLAT); NONE moves hr off 0 -- the strongest (warm-start + SSIM-loss) got closest but stayed 7.3 dB short. The R2-G paper's regime is SPARSE-view CBCT (<=50 views) where FBP is weak; dense 128-view 2D CT is the wrong inductive bias. DECISION: empty-patch re-run of the iter-6 run-best config (warm-start + SSIM-loss@0.30, 1024G/130it) to confirm SSIM ~0.928 / hr=0 reproduces. BUDGET: ~660-1000s node-dependent, under the 1080 in-solver wall and 1800 SLURM wall, figure excluded. val_n=15 HELD CONSTANT. PREDICTION: SSIM ~0.928 (0.925-0.930), hr 0 -- faithful-but-regime-bounded negative result., gs_outer_wall_s=1080, gs_amp_init_max=0.05", "advice_for_others": "r2gaussian-claude-agentic: val_n=15, gs_n_gaussians=1024, gs_n_iter=130, gs_lr_pos=0.005, gs_lr_scale=0.01, gs_lr_amp=0.01, gs_lr_rot=0.01, gs_amp_init=0.01, gs_scale_init=0.04, gs_tv_weight=0.0001, gs_n_clip=0.05, gs_init_from_fbp=True, gs_render=raster, gs_ssim_weight=0.3, seed=42, train_n=0, rationale=iter-10 (search-20260703-01) -- CEILING CONFIRMATION #2. SIX-BOX: hr pinned 0 at EVERY prior iter; best SSIM 0.9278 @ iter-6. R2-Gaussian is REGIME-BOUNDED on dense 128-view breast: the coarse anisotropic-Gaussian basis (1024 splats, 0.006M params) plateaus at SSIM ~0.928 / PSNR ~28.7 dB, ~7.3 dB BELOW the 128-view FBP baseline (PSNR 35.97), so the RMSE/PSNR-gated headroom stays 0 (reproduces findings.md 2026-06-03). All 7 lever families mapped+exhausted (steps FLAT, capacity +0.010, warm-start +0.039, SSIM-loss +0.073, SSIM-weight saturated, basis-scale FLAT, TV-reg FLAT); NONE moves hr off 0 -- the strongest (warm-start + SSIM-loss) got closest but stayed 7.3 dB short. The R2-G paper's regime is SPARSE-view CBCT (<=50 views) where FBP is weak; dense 128-view 2D CT is the wrong inductive bias. DECISION: empty-patch re-run of the iter-6 run-best config (warm-start + SSIM-loss@0.30, 1024G/130it) to confirm SSIM ~0.928 / hr=0 reproduces. BUDGET: ~660-1000s node-dependent, under the 1080 in-solver wall and 1800 SLURM wall, figure excluded. val_n=15 HELD CONSTANT. PREDICTION: SSIM ~0.928 (0.925-0.930), hr 0 -- faithful-but-regime-bounded negative result., gs_outer_wall_s=1080, gs_amp_init_max=0.05", "comparison_image": "runs/breast-ct-claude-agentic-r2gaussian-search-20260703-01/iterations/iter-0010/comparison.png"}
{"ts": "2026-07-05T19:59:31Z", "run_id": "breast-ct-claude-agentic-tv-iterative-search-20260703-01", "iter": 15, "agent": "tv_iterative-claude-agentic", "model": "claude-opus-4-8-1m", "change_class": "architecture", "status": "keep", "kept": true, "val_score": 0.9911164045333862, "headroom": 0.3623297390179261, "params_M": 0.0, "train_n": 400, "rationale": "tv_iterative-claude-agentic: val_n=200, tv_lambda=0.00275, tv_iterations=1000, tv_lr=0.01, tv_decay=0.01, tv_optimizer=gd, tv_init=fbp, rationale=iter-15 LAMBDA peak bracket (high side). Peak at lambda=2.5e-3 (iter-8 hr=0.36286 best); neighbors 2.25e-3->0.36073 (iter-14) and 3e-3->0.3597 (iter-7) both lower. ONE knob: tv_lambda 2.5e-3->2.75e-3 to bracket the high side (best config otherwise gd, 1000it, lr=0.01, decay=0.01, fbp). HYPOTHESIS: if hr>0.36286 the true optimum is just above 2.5e-3 (between 2.5 and 3e-3); if hr<0.36286, lambda=2.5e-3 is the confirmed plain-TV optimum on breast. Budget: ~950s at 1000 iters, <1200s wall.", "advice_for_others": "tv_iterative-claude-agentic: val_n=200, tv_lambda=0.00275, tv_iterations=1000, tv_lr=0.01, tv_decay=0.01, tv_optimizer=gd, tv_init=fbp, rationale=iter-15 LAMBDA peak bracket (high side). Peak at lambda=2.5e-3 (iter-8 hr=0.36286 best); neighbors 2.25e-3->0.36073 (iter-14) and 3e-3->0.3597 (iter-7) both lower. ONE knob: tv_lambda 2.5e-3->2.75e-3 to bracket the high side (best config otherwise gd, 1000it, lr=0.01, decay=0.01, fbp). HYPOTHESIS: if hr>0.36286 the true optimum is just above 2.5e-3 (between 2.5 and 3e-3); if hr<0.36286, lambda=2.5e-3 is the confirmed plain-TV optimum on breast. Budget: ~950s at 1000 iters, <1200s wall.", "comparison_image": "runs/breast-ct-claude-agentic-tv-iterative-search-20260703-01/iterations/iter-0015/comparison.png"}
{"ts": "2026-07-05T19:57:40Z", "run_id": "breast-ct-claude-agentic-dual-domain-bilateral-n2i-search-20260703-01", "iter": 6, "agent": "dual_domain_bilateral_n2i-claude-agentic", "model": "claude-opus-4-8-1m", "change_class": "architecture", "status": "keep", "kept": true, "val_score": 0.9584285020828247, "headroom": 0.10028215356520953, "params_M": 6e-06, "train_n": 400, "rationale": "dual_domain_bilateral_n2i-claude-agentic: warm_start=True, pretrain_epochs=2, train_n=400, n_iter=30, val_n=200, batch_size=1, grad_clip=1.0, lr=0.005, proj_n_bf=1, img_n_bf=1, img_sr=0.0005, proj_sr=0.0005, outer_wall_s=900, seed=42, rationale=iter-6 dual_domain_bilateral_n2i, ONE-KNOB: projection-domain BF RANGE sigma proj_sr 0.02->0.0005 (edge-preserving), keeping the iter-5 WINNER img_sr=0.0005. BREAKTHROUGH PRIOR: iter-5 (img_sr 0.02->0.0005) hr=0.1257, SSIM0.9605, PSNR39.57, recon_rmse8.61e-4 < baseline9.84e-4 -- the FIRST recon to BEAT the 128-view FBP. Root cause: a TIGHT range sigma makes the image BF EDGE-PRESERVING (smooths flat noise, stops at fibroglandular edges) instead of over-smoothing. Iters 1-4 (wide sr=0.02, depth, n_iter) all floored at hr=0 = confirmed the wide-range BF was the over-smoothing culprit, not the N2I loss per se. HYPOTHESIS: the SAME edge-preserving fix in the PROJECTION domain (proj_sr 0.02->0.0005) suppresses sparse-view streak noise in the sinogram before FBP WITHOUT the view-inconsistency that a strong-but-wide proj filter causes (findings.md: keep proj filtering gentle/soft -- a tight RANGE sigma is soft-edged in intensity, exactly the recommended lever) -> hr climbs above 0.1257. If hr drops vs iter-5, proj-domain edge-preservation induces view inconsistency and the image domain alone is the safe lever. BUDGET: value change only, ~1020s like iter-5. ONE knob: proj_sr 0.02->0.0005.", "advice_for_others": "dual_domain_bilateral_n2i-claude-agentic: warm_start=True, pretrain_epochs=2, train_n=400, n_iter=30, val_n=200, batch_size=1, grad_clip=1.0, lr=0.005, proj_n_bf=1, img_n_bf=1, img_sr=0.0005, proj_sr=0.0005, outer_wall_s=900, seed=42, rationale=iter-6 dual_domain_bilateral_n2i, ONE-KNOB: projection-domain BF RANGE sigma proj_sr 0.02->0.0005 (edge-preserving), keeping the iter-5 WINNER img_sr=0.0005. BREAKTHROUGH PRIOR: iter-5 (img_sr 0.02->0.0005) hr=0.1257, SSIM0.9605, PSNR39.57, recon_rmse8.61e-4 < baseline9.84e-4 -- the FIRST recon to BEAT the 128-view FBP. Root cause: a TIGHT range sigma makes the image BF EDGE-PRESERVING (smooths flat noise, stops at fibroglandular edges) instead of over-smoothing. Iters 1-4 (wide sr=0.02, depth, n_iter) all floored at hr=0 = confirmed the wide-range BF was the over-smoothing culprit, not the N2I loss per se. HYPOTHESIS: the SAME edge-preserving fix in the PROJECTION domain (proj_sr 0.02->0.0005) suppresses sparse-view streak noise in the sinogram before FBP WITHOUT the view-inconsistency that a strong-but-wide proj filter causes (findings.md: keep proj filtering gentle/soft -- a tight RANGE sigma is soft-edged in intensity, exactly the recommended lever) -> hr climbs above 0.1257. If hr drops vs iter-5, proj-domain edge-preservation induces view inconsistency and the image domain alone is the safe lever. BUDGET: value change only, ~1020s like iter-5. ONE knob: proj_sr 0.02->0.0005.", "comparison_image": "runs/breast-ct-claude-agentic-dual-domain-bilateral-n2i-search-20260703-01/iterations/iter-0006/comparison.png"}
