{"ts": "2026-07-05T21:31:52Z", "run_id": "breast-ct-claude-agentic-r2gaussian-search-20260703-01", "iter": 15, "agent": "r2gaussian-claude-agentic", "model": "claude-opus-4-8-1m", "change_class": "architecture", "status": "discard", "kept": false, "val_score": 0.9276220798492432, "headroom": 0.0, "params_M": 0.006144, "train_n": 400, "rationale": "r2gaussian-claude-agentic: val_n=15, gs_n_gaussians=1024, gs_n_iter=130, gs_lr_pos=0.005, gs_lr_scale=0.01, gs_lr_amp=0.01, gs_lr_rot=0.01, gs_amp_init=0.01, gs_scale_init=0.04, gs_tv_weight=0.0001, gs_n_clip=0.05, gs_init_from_fbp=True, gs_render=raster, gs_ssim_weight=0.3, seed=42, train_n=0, rationale=iter-15 (search-20260703-01) -- CEILING CONFIRMATION #7. SIX-BOX: hr pinned 0 at EVERY prior iter; best SSIM 0.9278 @ iter-6. R2-Gaussian is REGIME-BOUNDED on dense 128-view breast: the coarse anisotropic-Gaussian basis (1024 splats, 0.006M params) plateaus at SSIM ~0.928 / PSNR ~28.7 dB, ~7.3 dB BELOW the 128-view FBP baseline (PSNR 35.97), so the RMSE/PSNR-gated headroom stays 0 (reproduces findings.md 2026-06-03). All 7 lever families mapped+exhausted (steps FLAT, capacity +0.010, warm-start +0.039, SSIM-loss +0.073, SSIM-weight saturated, basis-scale FLAT, TV-reg FLAT); NONE moves hr off 0 -- the strongest (warm-start + SSIM-loss) got closest but stayed 7.3 dB short. The R2-G paper's regime is SPARSE-view CBCT (<=50 views) where FBP is weak; dense 128-view 2D CT is the wrong inductive bias. DECISION: empty-patch re-run of the iter-6 run-best config (warm-start + SSIM-loss@0.30, 1024G/130it) to confirm SSIM ~0.928 / hr=0 reproduces. BUDGET: ~660-1000s node-dependent, under the 1080 in-solver wall and 1800 SLURM wall, figure excluded. val_n=15 HELD CONSTANT. PREDICTION: SSIM ~0.928 (0.925-0.930), hr 0 -- faithful-but-regime-bounded negative result., gs_outer_wall_s=1080, gs_amp_init_max=0.05", "advice_for_others": "r2gaussian-claude-agentic: val_n=15, gs_n_gaussians=1024, gs_n_iter=130, gs_lr_pos=0.005, gs_lr_scale=0.01, gs_lr_amp=0.01, gs_lr_rot=0.01, gs_amp_init=0.01, gs_scale_init=0.04, gs_tv_weight=0.0001, gs_n_clip=0.05, gs_init_from_fbp=True, gs_render=raster, gs_ssim_weight=0.3, seed=42, train_n=0, rationale=iter-15 (search-20260703-01) -- CEILING CONFIRMATION #7. SIX-BOX: hr pinned 0 at EVERY prior iter; best SSIM 0.9278 @ iter-6. R2-Gaussian is REGIME-BOUNDED on dense 128-view breast: the coarse anisotropic-Gaussian basis (1024 splats, 0.006M params) plateaus at SSIM ~0.928 / PSNR ~28.7 dB, ~7.3 dB BELOW the 128-view FBP baseline (PSNR 35.97), so the RMSE/PSNR-gated headroom stays 0 (reproduces findings.md 2026-06-03). All 7 lever families mapped+exhausted (steps FLAT, capacity +0.010, warm-start +0.039, SSIM-loss +0.073, SSIM-weight saturated, basis-scale FLAT, TV-reg FLAT); NONE moves hr off 0 -- the strongest (warm-start + SSIM-loss) got closest but stayed 7.3 dB short. The R2-G paper's regime is SPARSE-view CBCT (<=50 views) where FBP is weak; dense 128-view 2D CT is the wrong inductive bias. DECISION: empty-patch re-run of the iter-6 run-best config (warm-start + SSIM-loss@0.30, 1024G/130it) to confirm SSIM ~0.928 / hr=0 reproduces. BUDGET: ~660-1000s node-dependent, under the 1080 in-solver wall and 1800 SLURM wall, figure excluded. val_n=15 HELD CONSTANT. PREDICTION: SSIM ~0.928 (0.925-0.930), hr 0 -- faithful-but-regime-bounded negative result., gs_outer_wall_s=1080, gs_amp_init_max=0.05", "comparison_image": "runs/breast-ct-claude-agentic-r2gaussian-search-20260703-01/iterations/iter-0015/comparison.png"}
{"ts": "2026-07-05T21:30:42Z", "run_id": "breast-ct-claude-agentic-naf-search-20260703-01", "iter": 3, "agent": "naf-claude-agentic", "model": "claude-opus-4-8-1m", "change_class": "architecture", "status": "discard", "kept": false, "val_score": 0.35450929403305054, "headroom": 0.0, "params_M": 0.140801, "train_n": 0, "rationale": "naf-claude-agentic: val_n=12, naf_n_freqs=8, naf_hidden=256, naf_layers=4, naf_n_iter=8000, naf_lr=0.01, naf_tv_weight=0.0001, naf_n_clip=0.05, naf_outer_wall_s=800, naf_per_scene_s=60.0, naf_encoding=fourier, seed=42, rationale=iter-3 breast-ct-claude-agentic-naf-search-20260703-01 (redone breast split train3600/val200/test200 seed20260703; val_n=12 CONSTANT for iters 2-20 per coordinator budget intervention 2026-07-05 -- first-12 of the 200-case breast val split, deterministic). SIX-BOX: (1) prior result: all iters so far hr=0 (iter-1 val_n=20 ssim0.355 PSNR6.26 in 970s, NOT a timeout -- a genuine converged fit). (2) failure mode: NAF per-scene INR recon is far below the 128-view breast LD-FBP baseline. (3) ONE knob changed: naf_hidden 128->256. (4) hypothesis: iter-2 (freqs=12) hr=0. KNOB: widen MLP hidden 128->256 (more model capacity per scene). HYPOTHESIS: if the bottleneck is MLP width not encoding, a wider net fits finer detail. Fewer steps/scene at 60s wall (bigger fwd), but per-scene fit still hundreds of steps. Expect hr=0 if the ceiling is the encoding basis, not width. (5) wall: val_n=12 x per_scene 60.0s = ~720s < 20min. (6) serial, no user return.", "advice_for_others": "naf-claude-agentic: val_n=12, naf_n_freqs=8, naf_hidden=256, naf_layers=4, naf_n_iter=8000, naf_lr=0.01, naf_tv_weight=0.0001, naf_n_clip=0.05, naf_outer_wall_s=800, naf_per_scene_s=60.0, naf_encoding=fourier, seed=42, rationale=iter-3 breast-ct-claude-agentic-naf-search-20260703-01 (redone breast split train3600/val200/test200 seed20260703; val_n=12 CONSTANT for iters 2-20 per coordinator budget intervention 2026-07-05 -- first-12 of the 200-case breast val split, deterministic). SIX-BOX: (1) prior result: all iters so far hr=0 (iter-1 val_n=20 ssim0.355 PSNR6.26 in 970s, NOT a timeout -- a genuine converged fit). (2) failure mode: NAF per-scene INR recon is far below the 128-view breast LD-FBP baseline. (3) ONE knob changed: naf_hidden 128->256. (4) hypothesis: iter-2 (freqs=12) hr=0. KNOB: widen MLP hidden 128->256 (more model capacity per scene). HYPOTHESIS: if the bottleneck is MLP width not encoding, a wider net fits finer detail. Fewer steps/scene at 60s wall (bigger fwd), but per-scene fit still hundreds of steps. Expect hr=0 if the ceiling is the encoding basis, not width. (5) wall: val_n=12 x per_scene 60.0s = ~720s < 20min. (6) serial, no user return.", "comparison_image": "runs/breast-ct-claude-agentic-naf-search-20260703-01/iterations/iter-0003/comparison.png"}
{"ts": "2026-07-05T21:20:36Z", "run_id": "breast-ct-claude-agentic-r2gaussian-search-20260703-01", "iter": 14, "agent": "r2gaussian-claude-agentic", "model": "claude-opus-4-8-1m", "change_class": "architecture", "status": "discard", "kept": false, "val_score": 0.9272757768630981, "headroom": 0.0, "params_M": 0.006144, "train_n": 400, "rationale": "r2gaussian-claude-agentic: val_n=15, gs_n_gaussians=1024, gs_n_iter=130, gs_lr_pos=0.005, gs_lr_scale=0.01, gs_lr_amp=0.01, gs_lr_rot=0.01, gs_amp_init=0.01, gs_scale_init=0.04, gs_tv_weight=0.0001, gs_n_clip=0.05, gs_init_from_fbp=True, gs_render=raster, gs_ssim_weight=0.3, seed=42, train_n=0, rationale=iter-14 (search-20260703-01) -- CEILING CONFIRMATION #6. SIX-BOX: hr pinned 0 at EVERY prior iter; best SSIM 0.9278 @ iter-6. R2-Gaussian is REGIME-BOUNDED on dense 128-view breast: the coarse anisotropic-Gaussian basis (1024 splats, 0.006M params) plateaus at SSIM ~0.928 / PSNR ~28.7 dB, ~7.3 dB BELOW the 128-view FBP baseline (PSNR 35.97), so the RMSE/PSNR-gated headroom stays 0 (reproduces findings.md 2026-06-03). All 7 lever families mapped+exhausted (steps FLAT, capacity +0.010, warm-start +0.039, SSIM-loss +0.073, SSIM-weight saturated, basis-scale FLAT, TV-reg FLAT); NONE moves hr off 0 -- the strongest (warm-start + SSIM-loss) got closest but stayed 7.3 dB short. The R2-G paper's regime is SPARSE-view CBCT (<=50 views) where FBP is weak; dense 128-view 2D CT is the wrong inductive bias. DECISION: empty-patch re-run of the iter-6 run-best config (warm-start + SSIM-loss@0.30, 1024G/130it) to confirm SSIM ~0.928 / hr=0 reproduces. BUDGET: ~660-1000s node-dependent, under the 1080 in-solver wall and 1800 SLURM wall, figure excluded. val_n=15 HELD CONSTANT. PREDICTION: SSIM ~0.928 (0.925-0.930), hr 0 -- faithful-but-regime-bounded negative result., gs_outer_wall_s=1080, gs_amp_init_max=0.05", "advice_for_others": "r2gaussian-claude-agentic: val_n=15, gs_n_gaussians=1024, gs_n_iter=130, gs_lr_pos=0.005, gs_lr_scale=0.01, gs_lr_amp=0.01, gs_lr_rot=0.01, gs_amp_init=0.01, gs_scale_init=0.04, gs_tv_weight=0.0001, gs_n_clip=0.05, gs_init_from_fbp=True, gs_render=raster, gs_ssim_weight=0.3, seed=42, train_n=0, rationale=iter-14 (search-20260703-01) -- CEILING CONFIRMATION #6. SIX-BOX: hr pinned 0 at EVERY prior iter; best SSIM 0.9278 @ iter-6. R2-Gaussian is REGIME-BOUNDED on dense 128-view breast: the coarse anisotropic-Gaussian basis (1024 splats, 0.006M params) plateaus at SSIM ~0.928 / PSNR ~28.7 dB, ~7.3 dB BELOW the 128-view FBP baseline (PSNR 35.97), so the RMSE/PSNR-gated headroom stays 0 (reproduces findings.md 2026-06-03). All 7 lever families mapped+exhausted (steps FLAT, capacity +0.010, warm-start +0.039, SSIM-loss +0.073, SSIM-weight saturated, basis-scale FLAT, TV-reg FLAT); NONE moves hr off 0 -- the strongest (warm-start + SSIM-loss) got closest but stayed 7.3 dB short. The R2-G paper's regime is SPARSE-view CBCT (<=50 views) where FBP is weak; dense 128-view 2D CT is the wrong inductive bias. DECISION: empty-patch re-run of the iter-6 run-best config (warm-start + SSIM-loss@0.30, 1024G/130it) to confirm SSIM ~0.928 / hr=0 reproduces. BUDGET: ~660-1000s node-dependent, under the 1080 in-solver wall and 1800 SLURM wall, figure excluded. val_n=15 HELD CONSTANT. PREDICTION: SSIM ~0.928 (0.925-0.930), hr 0 -- faithful-but-regime-bounded negative result., gs_outer_wall_s=1080, gs_amp_init_max=0.05", "comparison_image": "runs/breast-ct-claude-agentic-r2gaussian-search-20260703-01/iterations/iter-0014/comparison.png"}
{"ts": "2026-07-05T21:10:21Z", "run_id": "breast-ct-claude-agentic-dual-domain-bilateral-n2i-search-20260703-01", "iter": 9, "agent": "dual_domain_bilateral_n2i-claude-agentic", "model": "claude-opus-4-8-1m", "change_class": "architecture", "status": "keep", "kept": true, "val_score": 0.9619981646537781, "headroom": 0.11402760380948807, "params_M": 6e-06, "train_n": 400, "rationale": "dual_domain_bilateral_n2i-claude-agentic: warm_start=True, pretrain_epochs=2, train_n=400, n_iter=30, val_n=200, batch_size=1, grad_clip=1.0, lr=0.005, proj_n_bf=1, img_n_bf=1, img_sr=0.0002, img_sx=2.5, img_sy=2.5, outer_wall_s=900, seed=42, rationale=iter-9 dual_domain_bilateral_n2i, ONE-KNOB: image BF SPATIAL sigma img_sx=img_sy 1.5->2.5 (isotropic widen), on iter-7 CHAMPION base (img_sr=0.0002, n_iter=30). n_iter REVERTED to 30 (iter-8 n_iter=100 gave hr=0.1160 on a wall-trimmed val_n=193/harder-baseline subset; SSIM/PSNR were actually higher 0.9620/39.72 but n_iter did not clearly help and it trims the val set -> keep 30 for a clean 200-scene comparison). CHAMPION = iter-7 hr=0.1261 (img_sr=0.0002). HYPOTHESIS: with the range kernel now EDGE-PRESERVING (tight img_sr), a WIDER spatial sigma lets each output pixel average over MORE same-tissue neighbours -> stronger flat-region noise suppression, while the tight range kernel still BLOCKS averaging across fibroglandular edges -> cleaner denoise WITHOUT new blur -> hr climbs above 0.1261. This is the direction that lifted the DEMO bilateral monotonically (1.5->2.5->3.5); the question is whether it transfers to breast NOW that range-edge-preservation is on (on the OLD-split breast it barely moved because range was not this tight). If hr FLAT/DROPS, breast's fine fibroglandular structure sits inside the widened window and even edge-guarded spatial widening blurs it -> spatial axis capped at 1.5. BUDGET: spatial-sigma cost is independent of VALUE (same 7x7 kernel unfold); ~700-1000s like iter-7. ONE knob: img_sx/img_sy 1.5->2.5.", "advice_for_others": "dual_domain_bilateral_n2i-claude-agentic: warm_start=True, pretrain_epochs=2, train_n=400, n_iter=30, val_n=200, batch_size=1, grad_clip=1.0, lr=0.005, proj_n_bf=1, img_n_bf=1, img_sr=0.0002, img_sx=2.5, img_sy=2.5, outer_wall_s=900, seed=42, rationale=iter-9 dual_domain_bilateral_n2i, ONE-KNOB: image BF SPATIAL sigma img_sx=img_sy 1.5->2.5 (isotropic widen), on iter-7 CHAMPION base (img_sr=0.0002, n_iter=30). n_iter REVERTED to 30 (iter-8 n_iter=100 gave hr=0.1160 on a wall-trimmed val_n=193/harder-baseline subset; SSIM/PSNR were actually higher 0.9620/39.72 but n_iter did not clearly help and it trims the val set -> keep 30 for a clean 200-scene comparison). CHAMPION = iter-7 hr=0.1261 (img_sr=0.0002). HYPOTHESIS: with the range kernel now EDGE-PRESERVING (tight img_sr), a WIDER spatial sigma lets each output pixel average over MORE same-tissue neighbours -> stronger flat-region noise suppression, while the tight range kernel still BLOCKS averaging across fibroglandular edges -> cleaner denoise WITHOUT new blur -> hr climbs above 0.1261. This is the direction that lifted the DEMO bilateral monotonically (1.5->2.5->3.5); the question is whether it transfers to breast NOW that range-edge-preservation is on (on the OLD-split breast it barely moved because range was not this tight). If hr FLAT/DROPS, breast's fine fibroglandular structure sits inside the widened window and even edge-guarded spatial widening blurs it -> spatial axis capped at 1.5. BUDGET: spatial-sigma cost is independent of VALUE (same 7x7 kernel unfold); ~700-1000s like iter-7. ONE knob: img_sx/img_sy 1.5->2.5.", "comparison_image": "runs/breast-ct-claude-agentic-dual-domain-bilateral-n2i-search-20260703-01/iterations/iter-0009/comparison.png"}
{"ts": "2026-07-05T21:08:09Z", "run_id": "breast-ct-claude-agentic-tv-iterative-search-20260703-01", "iter": 20, "agent": "tv_iterative-claude-agentic", "model": "claude-opus-4-8-1m", "change_class": "architecture", "status": "keep", "kept": true, "val_score": 0.9912509918212891, "headroom": 0.36293303853177683, "params_M": 0.0, "train_n": 400, "rationale": "tv_iterative-claude-agentic: val_n=200, tv_lambda=0.0026, tv_iterations=1000, tv_lr=0.01, tv_decay=0.01, tv_optimizer=gd, tv_init=fbp, rationale=iter-20 FINAL best-config confirmation. Full lever map complete: lambda peak 2.6e-3 (iter-17 hr=0.36293 best; 2.5e-3=0.36286, 2.75e-3=0.36233, 3e-3=0.3597, 2.25e-3=0.36073, 2e-3=0.3552, 4e-3=0.3336); iterations plateau at 1000 (500->0.3534, 1200->0.36274, 1500->0.36106); optimizer must be GD (adam->0.0); lr=0.01 optimal (0.02->0.29146); decay=0.01 optimal (0.005->0.33779, 0.001->0.16989); init MUST be fbp (zeros->0.0, the documented structural collapse). ONE knob: none changed - replicate the exact best config (lambda=2.6e-3, 1000it, gd, lr=0.01, decay=0.01, fbp) as a deterministic confirmation and to write the clean final recon_raw.npz (pred+truth+baseline) + comparison.png for the report. HYPOTHESIS: hr reproduces ~0.36293 (deterministic solver, same seed). Budget: ~950s at 1000 iters, <1200s wall.", "advice_for_others": "tv_iterative-claude-agentic: val_n=200, tv_lambda=0.0026, tv_iterations=1000, tv_lr=0.01, tv_decay=0.01, tv_optimizer=gd, tv_init=fbp, rationale=iter-20 FINAL best-config confirmation. Full lever map complete: lambda peak 2.6e-3 (iter-17 hr=0.36293 best; 2.5e-3=0.36286, 2.75e-3=0.36233, 3e-3=0.3597, 2.25e-3=0.36073, 2e-3=0.3552, 4e-3=0.3336); iterations plateau at 1000 (500->0.3534, 1200->0.36274, 1500->0.36106); optimizer must be GD (adam->0.0); lr=0.01 optimal (0.02->0.29146); decay=0.01 optimal (0.005->0.33779, 0.001->0.16989); init MUST be fbp (zeros->0.0, the documented structural collapse). ONE knob: none changed - replicate the exact best config (lambda=2.6e-3, 1000it, gd, lr=0.01, decay=0.01, fbp) as a deterministic confirmation and to write the clean final recon_raw.npz (pred+truth+baseline) + comparison.png for the report. HYPOTHESIS: hr reproduces ~0.36293 (deterministic solver, same seed). Budget: ~950s at 1000 iters, <1200s wall.", "comparison_image": "runs/breast-ct-claude-agentic-tv-iterative-search-20260703-01/iterations/iter-0020/comparison.png"}
{"ts": "2026-07-05T21:07:06Z", "run_id": "breast-ct-claude-agentic-r2gaussian-search-20260703-01", "iter": 13, "agent": "r2gaussian-claude-agentic", "model": "claude-opus-4-8-1m", "change_class": "architecture", "status": "discard", "kept": false, "val_score": 0.927880585193634, "headroom": 0.0, "params_M": 0.006144, "train_n": 400, "rationale": "r2gaussian-claude-agentic: val_n=15, gs_n_gaussians=1024, gs_n_iter=130, gs_lr_pos=0.005, gs_lr_scale=0.01, gs_lr_amp=0.01, gs_lr_rot=0.01, gs_amp_init=0.01, gs_scale_init=0.04, gs_tv_weight=0.0001, gs_n_clip=0.05, gs_init_from_fbp=True, gs_render=raster, gs_ssim_weight=0.3, seed=42, train_n=0, rationale=iter-13 (search-20260703-01) -- CEILING CONFIRMATION #5. SIX-BOX: hr pinned 0 at EVERY prior iter; best SSIM 0.9278 @ iter-6. R2-Gaussian is REGIME-BOUNDED on dense 128-view breast: the coarse anisotropic-Gaussian basis (1024 splats, 0.006M params) plateaus at SSIM ~0.928 / PSNR ~28.7 dB, ~7.3 dB BELOW the 128-view FBP baseline (PSNR 35.97), so the RMSE/PSNR-gated headroom stays 0 (reproduces findings.md 2026-06-03). All 7 lever families mapped+exhausted (steps FLAT, capacity +0.010, warm-start +0.039, SSIM-loss +0.073, SSIM-weight saturated, basis-scale FLAT, TV-reg FLAT); NONE moves hr off 0 -- the strongest (warm-start + SSIM-loss) got closest but stayed 7.3 dB short. The R2-G paper's regime is SPARSE-view CBCT (<=50 views) where FBP is weak; dense 128-view 2D CT is the wrong inductive bias. DECISION: empty-patch re-run of the iter-6 run-best config (warm-start + SSIM-loss@0.30, 1024G/130it) to confirm SSIM ~0.928 / hr=0 reproduces. BUDGET: ~660-1000s node-dependent, under the 1080 in-solver wall and 1800 SLURM wall, figure excluded. val_n=15 HELD CONSTANT. PREDICTION: SSIM ~0.928 (0.925-0.930), hr 0 -- faithful-but-regime-bounded negative result., gs_outer_wall_s=1080, gs_amp_init_max=0.05", "advice_for_others": "r2gaussian-claude-agentic: val_n=15, gs_n_gaussians=1024, gs_n_iter=130, gs_lr_pos=0.005, gs_lr_scale=0.01, gs_lr_amp=0.01, gs_lr_rot=0.01, gs_amp_init=0.01, gs_scale_init=0.04, gs_tv_weight=0.0001, gs_n_clip=0.05, gs_init_from_fbp=True, gs_render=raster, gs_ssim_weight=0.3, seed=42, train_n=0, rationale=iter-13 (search-20260703-01) -- CEILING CONFIRMATION #5. SIX-BOX: hr pinned 0 at EVERY prior iter; best SSIM 0.9278 @ iter-6. R2-Gaussian is REGIME-BOUNDED on dense 128-view breast: the coarse anisotropic-Gaussian basis (1024 splats, 0.006M params) plateaus at SSIM ~0.928 / PSNR ~28.7 dB, ~7.3 dB BELOW the 128-view FBP baseline (PSNR 35.97), so the RMSE/PSNR-gated headroom stays 0 (reproduces findings.md 2026-06-03). All 7 lever families mapped+exhausted (steps FLAT, capacity +0.010, warm-start +0.039, SSIM-loss +0.073, SSIM-weight saturated, basis-scale FLAT, TV-reg FLAT); NONE moves hr off 0 -- the strongest (warm-start + SSIM-loss) got closest but stayed 7.3 dB short. The R2-G paper's regime is SPARSE-view CBCT (<=50 views) where FBP is weak; dense 128-view 2D CT is the wrong inductive bias. DECISION: empty-patch re-run of the iter-6 run-best config (warm-start + SSIM-loss@0.30, 1024G/130it) to confirm SSIM ~0.928 / hr=0 reproduces. BUDGET: ~660-1000s node-dependent, under the 1080 in-solver wall and 1800 SLURM wall, figure excluded. val_n=15 HELD CONSTANT. PREDICTION: SSIM ~0.928 (0.925-0.930), hr 0 -- faithful-but-regime-bounded negative result., gs_outer_wall_s=1080, gs_amp_init_max=0.05", "comparison_image": "runs/breast-ct-claude-agentic-r2gaussian-search-20260703-01/iterations/iter-0013/comparison.png"}
{"ts": "2026-07-05T20:55:45Z", "run_id": "breast-ct-claude-agentic-tv-iterative-search-20260703-01", "iter": 19, "agent": "tv_iterative-claude-agentic", "model": "claude-opus-4-8-1m", "change_class": "architecture", "status": "keep", "kept": true, "val_score": 0.9889213442802429, "headroom": 0.33778833997211366, "params_M": 0.0, "train_n": 400, "rationale": "tv_iterative-claude-agentic: val_n=200, tv_lambda=0.0026, tv_iterations=1000, tv_lr=0.01, tv_decay=0.005, tv_optimizer=gd, tv_init=fbp, rationale=iter-19 DECAY intermediate at the peak config. iter-18 (500it) hr=0.35343 < iter-17 (1000it) 0.36293 -> 1000 iters genuinely needed. Decay was probed once (iter-11 decay 0.01->0.001 CRASHED hr->0.16989, too-large late steps oscillate) but never at an intermediate value. ONE knob: tv_decay 0.01->0.005 (mild; step at iter1000 = 0.01/6 ~= 0.00167 vs 0.0009 at decay=0.01 and 0.005 at decay=0.001). Keep lambda=2.6e-3, 1000it, lr=0.01, gd, fbp. HYPOTHESIS: a mildly larger late step converges TV slightly further without the oscillation that decay=0.001 caused, so hr edges past 0.36293; if it still over-steps (hr drops) decay=0.01 is the firm optimal schedule. Budget: ~950s at 1000 iters, <1200s wall.", "advice_for_others": "tv_iterative-claude-agentic: val_n=200, tv_lambda=0.0026, tv_iterations=1000, tv_lr=0.01, tv_decay=0.005, tv_optimizer=gd, tv_init=fbp, rationale=iter-19 DECAY intermediate at the peak config. iter-18 (500it) hr=0.35343 < iter-17 (1000it) 0.36293 -> 1000 iters genuinely needed. Decay was probed once (iter-11 decay 0.01->0.001 CRASHED hr->0.16989, too-large late steps oscillate) but never at an intermediate value. ONE knob: tv_decay 0.01->0.005 (mild; step at iter1000 = 0.01/6 ~= 0.00167 vs 0.0009 at decay=0.01 and 0.005 at decay=0.001). Keep lambda=2.6e-3, 1000it, lr=0.01, gd, fbp. HYPOTHESIS: a mildly larger late step converges TV slightly further without the oscillation that decay=0.001 caused, so hr edges past 0.36293; if it still over-steps (hr drops) decay=0.01 is the firm optimal schedule. Budget: ~950s at 1000 iters, <1200s wall.", "comparison_image": "runs/breast-ct-claude-agentic-tv-iterative-search-20260703-01/iterations/iter-0019/comparison.png"}
