{"ts": "2026-05-21T01:57:06Z", "run_id": "demo-intensity-calibrated-tpe-naf-search-20260521-01", "iter": 2, "agent": "naf-search-tpe-calibrated", "model": "random-search", "change_class": "architecture", "status": "keep", "kept": true, "val_score": null, "headroom": 0.3645769803352854, "params_M": 0.037633, "train_n": 0, "rationale": "naf-search-tpe-calibrated: naf_n_freqs=8, naf_hidden=128, naf_layers=4, naf_n_iter=2817, naf_lr=0.0085079, naf_tv_weight=0.00072454, naf_outer_wall_s=2400", "advice_for_others": "naf-search-tpe-calibrated: naf_n_freqs=8, naf_hidden=128, naf_layers=4, naf_n_iter=2817, naf_lr=0.0085079, naf_tv_weight=0.00072454, naf_outer_wall_s=2400 -> hr=0.3646", "comparison_image": "runs/demo-intensity-calibrated-tpe-naf-search-20260521-01/iterations/iter-0002/comparison.png"}
{"ts": "2026-05-21T01:53:37Z", "run_id": "demo-intensity-calibrated-tpe-diff-recon-dcstep-unconstrained-search-20260521-01", "iter": 9, "agent": "diff-recon-dcstep-unconstrained-search-tpe-calibrated", "model": "random-search", "change_class": "architecture", "status": "keep", "kept": true, "val_score": null, "headroom": 0.4136425460074509, "params_M": 0.958051, "train_n": 2000, "rationale": "diff-recon-dcstep-unconstrained-search-tpe-calibrated: recon_ckpt=/cluster/maier/Agent4CT/checkpoints/ddpm_unconstrained_final.pt, recon_mode=dps, recon_sample_steps=200, recon_eta=3.1627, recon_init=fbp, recon_eta_clamp=True, recon_dcstep_every=4, recon_dcstep_n_cg=10, recon_dcstep_warmup=10, recon_dcstep_relax=1", "advice_for_others": "diff-recon-dcstep-unconstrained-search-tpe-calibrated: recon_ckpt=/cluster/maier/Agent4CT/checkpoints/ddpm_unconstrained_final.pt, recon_mode=dps, recon_sample_steps=200, recon_eta=3.1627, recon_init=fbp, recon_eta_clamp=True, recon_dcstep_every=4, recon_dcstep_n_cg=10, recon_dcstep_warmup=10, recon_dcstep_relax=1 -> hr=0.4136", "comparison_image": "runs/demo-intensity-calibrated-tpe-diff-recon-dcstep-unconstrained-search-20260521-01/iterations/iter-0009/comparison.png"}
{"ts": "2026-05-21T01:50:20Z", "run_id": "demo-intensity-calibrated-tpe-diff-recon-dcstep-unconstrained-search-20260521-01", "iter": 8, "agent": "diff-recon-dcstep-unconstrained-search-tpe-calibrated", "model": "random-search", "change_class": "architecture", "status": "keep", "kept": true, "val_score": null, "headroom": 0.4471432546870311, "params_M": 0.958051, "train_n": 2000, "rationale": "diff-recon-dcstep-unconstrained-search-tpe-calibrated: recon_ckpt=/cluster/maier/Agent4CT/checkpoints/ddpm_unconstrained_final.pt, recon_mode=dps, recon_sample_steps=200, recon_eta=3.2268, recon_init=fbp, recon_eta_clamp=True, recon_dcstep_every=4, recon_dcstep_n_cg=20, recon_dcstep_warmup=10, recon_dcstep_relax=1", "advice_for_others": "diff-recon-dcstep-unconstrained-search-tpe-calibrated: recon_ckpt=/cluster/maier/Agent4CT/checkpoints/ddpm_unconstrained_final.pt, recon_mode=dps, recon_sample_steps=200, recon_eta=3.2268, recon_init=fbp, recon_eta_clamp=True, recon_dcstep_every=4, recon_dcstep_n_cg=20, recon_dcstep_warmup=10, recon_dcstep_relax=1 -> hr=0.4471", "comparison_image": "runs/demo-intensity-calibrated-tpe-diff-recon-dcstep-unconstrained-search-20260521-01/iterations/iter-0008/comparison.png"}
{"ts": "2026-05-21T01:49:38Z", "run_id": "demo-intensity-calibrated-tpe-diff-recon-dcstep-constrained-search-20260521-01", "iter": 6, "agent": "diff-recon-dcstep-constrained-search-tpe-calibrated", "model": "random-search", "change_class": "architecture", "status": "keep", "kept": true, "val_score": null, "headroom": 0.42605178672165134, "params_M": 0.958051, "train_n": 200, "rationale": "diff-recon-dcstep-constrained-search-tpe-calibrated: recon_ckpt=/cluster/maier/Agent4CT/checkpoints/ddpm_constrained_final.pt, recon_mode=dps, recon_sample_steps=800, recon_eta=3.466, recon_init=noise, recon_eta_clamp=True, recon_dcstep_every=3, recon_dcstep_n_cg=15, recon_dcstep_warmup=10, recon_dcstep_relax=0.95", "advice_for_others": "diff-recon-dcstep-constrained-search-tpe-calibrated: recon_ckpt=/cluster/maier/Agent4CT/checkpoints/ddpm_constrained_final.pt, recon_mode=dps, recon_sample_steps=800, recon_eta=3.466, recon_init=noise, recon_eta_clamp=True, recon_dcstep_every=3, recon_dcstep_n_cg=15, recon_dcstep_warmup=10, recon_dcstep_relax=0.95 -> hr=0.4261", "comparison_image": "runs/demo-intensity-calibrated-tpe-diff-recon-dcstep-constrained-search-20260521-01/iterations/iter-0006/comparison.png"}
{"ts": "2026-05-21T01:46:18Z", "run_id": "demo-intensity-calibrated-tpe-diff-recon-dcstep-unconstrained-search-20260521-01", "iter": 7, "agent": "diff-recon-dcstep-unconstrained-search-tpe-calibrated", "model": "random-search", "change_class": "architecture", "status": "keep", "kept": true, "val_score": null, "headroom": 0.3797310334964975, "params_M": 0.958051, "train_n": 2000, "rationale": "diff-recon-dcstep-unconstrained-search-tpe-calibrated: recon_ckpt=/cluster/maier/Agent4CT/checkpoints/ddpm_unconstrained_final.pt, recon_mode=dps, recon_sample_steps=200, recon_eta=59.819, recon_init=fbp, recon_eta_clamp=True, recon_dcstep_every=5, recon_dcstep_n_cg=10, recon_dcstep_warmup=25, recon_dcstep_relax=0.85", "advice_for_others": "diff-recon-dcstep-unconstrained-search-tpe-calibrated: recon_ckpt=/cluster/maier/Agent4CT/checkpoints/ddpm_unconstrained_final.pt, recon_mode=dps, recon_sample_steps=200, recon_eta=59.819, recon_init=fbp, recon_eta_clamp=True, recon_dcstep_every=5, recon_dcstep_n_cg=10, recon_dcstep_warmup=25, recon_dcstep_relax=0.85 -> hr=0.3797", "comparison_image": "runs/demo-intensity-calibrated-tpe-diff-recon-dcstep-unconstrained-search-20260521-01/iterations/iter-0007/comparison.png"}
{"ts": "2026-05-21T01:43:18Z", "run_id": "demo-intensity-calibrated-tpe-diff-recon-dcstep-unconstrained-search-20260521-01", "iter": 6, "agent": "diff-recon-dcstep-unconstrained-search-tpe-calibrated", "model": "random-search", "change_class": "architecture", "status": "keep", "kept": true, "val_score": null, "headroom": 0.43576966074478907, "params_M": 0.958051, "train_n": 2000, "rationale": "diff-recon-dcstep-unconstrained-search-tpe-calibrated: recon_ckpt=/cluster/maier/Agent4CT/checkpoints/ddpm_unconstrained_final.pt, recon_mode=dps, recon_sample_steps=200, recon_eta=6.982, recon_init=fbp, recon_eta_clamp=True, recon_dcstep_every=3, recon_dcstep_n_cg=15, recon_dcstep_warmup=25, recon_dcstep_relax=0.85", "advice_for_others": "diff-recon-dcstep-unconstrained-search-tpe-calibrated: recon_ckpt=/cluster/maier/Agent4CT/checkpoints/ddpm_unconstrained_final.pt, recon_mode=dps, recon_sample_steps=200, recon_eta=6.982, recon_init=fbp, recon_eta_clamp=True, recon_dcstep_every=3, recon_dcstep_n_cg=15, recon_dcstep_warmup=25, recon_dcstep_relax=0.85 -> hr=0.4358", "comparison_image": "runs/demo-intensity-calibrated-tpe-diff-recon-dcstep-unconstrained-search-20260521-01/iterations/iter-0006/comparison.png"}
{"ts": "2026-05-21T01:39:24Z", "run_id": "demo-intensity-calibrated-tpe-diff-recon-dcstep-unconstrained-search-20260521-01", "iter": 5, "agent": "diff-recon-dcstep-unconstrained-search-tpe-calibrated", "model": "random-search", "change_class": "architecture", "status": "keep", "kept": true, "val_score": null, "headroom": 0.41679022293756707, "params_M": 0.958051, "train_n": 2000, "rationale": "diff-recon-dcstep-unconstrained-search-tpe-calibrated: recon_ckpt=/cluster/maier/Agent4CT/checkpoints/ddpm_unconstrained_final.pt, recon_mode=dps, recon_sample_steps=800, recon_eta=24.952, recon_init=noise, recon_eta_clamp=False, recon_dcstep_every=5, recon_dcstep_n_cg=25, recon_dcstep_warmup=40, recon_dcstep_relax=0.85", "advice_for_others": "diff-recon-dcstep-unconstrained-search-tpe-calibrated: recon_ckpt=/cluster/maier/Agent4CT/checkpoints/ddpm_unconstrained_final.pt, recon_mode=dps, recon_sample_steps=800, recon_eta=24.952, recon_init=noise, recon_eta_clamp=False, recon_dcstep_every=5, recon_dcstep_n_cg=25, recon_dcstep_warmup=40, recon_dcstep_relax=0.85 -> hr=0.4168", "comparison_image": "runs/demo-intensity-calibrated-tpe-diff-recon-dcstep-unconstrained-search-20260521-01/iterations/iter-0005/comparison.png"}
{"ts": "2026-05-21T01:35:33Z", "run_id": "demo-intensity-calibrated-tpe-diff-recon-dcstep-constrained-search-20260521-01", "iter": 5, "agent": "diff-recon-dcstep-constrained-search-tpe-calibrated", "model": "random-search", "change_class": "architecture", "status": "keep", "kept": true, "val_score": null, "headroom": 0.4135972114842188, "params_M": 0.958051, "train_n": 200, "rationale": "diff-recon-dcstep-constrained-search-tpe-calibrated: recon_ckpt=/cluster/maier/Agent4CT/checkpoints/ddpm_constrained_final.pt, recon_mode=dps, recon_sample_steps=800, recon_eta=24.952, recon_init=noise, recon_eta_clamp=False, recon_dcstep_every=5, recon_dcstep_n_cg=25, recon_dcstep_warmup=40, recon_dcstep_relax=0.85", "advice_for_others": "diff-recon-dcstep-constrained-search-tpe-calibrated: recon_ckpt=/cluster/maier/Agent4CT/checkpoints/ddpm_constrained_final.pt, recon_mode=dps, recon_sample_steps=800, recon_eta=24.952, recon_init=noise, recon_eta_clamp=False, recon_dcstep_every=5, recon_dcstep_n_cg=25, recon_dcstep_warmup=40, recon_dcstep_relax=0.85 -> hr=0.4136", "comparison_image": "runs/demo-intensity-calibrated-tpe-diff-recon-dcstep-constrained-search-20260521-01/iterations/iter-0005/comparison.png"}
{"ts": "2026-05-21T01:30:39Z", "run_id": "demo-intensity-calibrated-tpe-naf-search-20260521-01", "iter": 1, "agent": "naf-search-tpe-calibrated", "model": "random-search", "change_class": "architecture", "status": "keep", "kept": true, "val_score": null, "headroom": 0.14361758161008664, "params_M": 0.142849, "train_n": 0, "rationale": "naf-search-tpe-calibrated: naf_n_freqs=10, naf_hidden=256, naf_layers=4, naf_n_iter=2143, naf_lr=0.0012229, naf_tv_weight=1.26e-05, naf_outer_wall_s=2400", "advice_for_others": "naf-search-tpe-calibrated: naf_n_freqs=10, naf_hidden=256, naf_layers=4, naf_n_iter=2143, naf_lr=0.0012229, naf_tv_weight=1.26e-05, naf_outer_wall_s=2400 -> hr=0.1436", "comparison_image": "runs/demo-intensity-calibrated-tpe-naf-search-20260521-01/iterations/iter-0001/comparison.png"}
{"ts": "2026-05-21T01:23:22Z", "run_id": "demo-intensity-calibrated-tpe-diff-recon-dcstep-unconstrained-search-20260521-01", "iter": 4, "agent": "diff-recon-dcstep-unconstrained-search-tpe-calibrated", "model": "random-search", "change_class": "architecture", "status": "keep", "kept": true, "val_score": null, "headroom": 0.44598879279020365, "params_M": 0.958051, "train_n": 2000, "rationale": "diff-recon-dcstep-unconstrained-search-tpe-calibrated: recon_ckpt=/cluster/maier/Agent4CT/checkpoints/ddpm_unconstrained_final.pt, recon_mode=dps, recon_sample_steps=200, recon_eta=8.6163, recon_init=fbp, recon_eta_clamp=True, recon_dcstep_every=3, recon_dcstep_n_cg=20, recon_dcstep_warmup=25, recon_dcstep_relax=0.85", "advice_for_others": "diff-recon-dcstep-unconstrained-search-tpe-calibrated: recon_ckpt=/cluster/maier/Agent4CT/checkpoints/ddpm_unconstrained_final.pt, recon_mode=dps, recon_sample_steps=200, recon_eta=8.6163, recon_init=fbp, recon_eta_clamp=True, recon_dcstep_every=3, recon_dcstep_n_cg=20, recon_dcstep_warmup=25, recon_dcstep_relax=0.85 -> hr=0.4460", "comparison_image": "runs/demo-intensity-calibrated-tpe-diff-recon-dcstep-unconstrained-search-20260521-01/iterations/iter-0004/comparison.png"}
{"ts": "2026-05-21T01:21:45Z", "run_id": "demo-intensity-calibrated-tpe-diff-recon-dcstep-constrained-search-20260521-01", "iter": 4, "agent": "diff-recon-dcstep-constrained-search-tpe-calibrated", "model": "random-search", "change_class": "architecture", "status": "keep", "kept": true, "val_score": null, "headroom": 0.4324588225021494, "params_M": 0.958051, "train_n": 200, "rationale": "diff-recon-dcstep-constrained-search-tpe-calibrated: recon_ckpt=/cluster/maier/Agent4CT/checkpoints/ddpm_constrained_final.pt, recon_mode=dps, recon_sample_steps=200, recon_eta=8.6163, recon_init=fbp, recon_eta_clamp=True, recon_dcstep_every=3, recon_dcstep_n_cg=20, recon_dcstep_warmup=25, recon_dcstep_relax=0.85", "advice_for_others": "diff-recon-dcstep-constrained-search-tpe-calibrated: recon_ckpt=/cluster/maier/Agent4CT/checkpoints/ddpm_constrained_final.pt, recon_mode=dps, recon_sample_steps=200, recon_eta=8.6163, recon_init=fbp, recon_eta_clamp=True, recon_dcstep_every=3, recon_dcstep_n_cg=20, recon_dcstep_warmup=25, recon_dcstep_relax=0.85 -> hr=0.4325", "comparison_image": "runs/demo-intensity-calibrated-tpe-diff-recon-dcstep-constrained-search-20260521-01/iterations/iter-0004/comparison.png"}
{"ts": "2026-05-21T01:18:54Z", "run_id": "demo-intensity-calibrated-tpe-diff-recon-dcstep-unconstrained-search-20260521-01", "iter": 3, "agent": "diff-recon-dcstep-unconstrained-search-tpe-calibrated", "model": "random-search", "change_class": "architecture", "status": "keep", "kept": true, "val_score": null, "headroom": 0.4401038130502236, "params_M": 0.958051, "train_n": 2000, "rationale": "diff-recon-dcstep-unconstrained-search-tpe-calibrated: recon_ckpt=/cluster/maier/Agent4CT/checkpoints/ddpm_unconstrained_final.pt, recon_mode=dps, recon_sample_steps=500, recon_eta=10.7, recon_init=noise, recon_eta_clamp=False, recon_dcstep_every=4, recon_dcstep_n_cg=25, recon_dcstep_warmup=40, recon_dcstep_relax=0.95", "advice_for_others": "diff-recon-dcstep-unconstrained-search-tpe-calibrated: recon_ckpt=/cluster/maier/Agent4CT/checkpoints/ddpm_unconstrained_final.pt, recon_mode=dps, recon_sample_steps=500, recon_eta=10.7, recon_init=noise, recon_eta_clamp=False, recon_dcstep_every=4, recon_dcstep_n_cg=25, recon_dcstep_warmup=40, recon_dcstep_relax=0.95 -> hr=0.4401", "comparison_image": "runs/demo-intensity-calibrated-tpe-diff-recon-dcstep-unconstrained-search-20260521-01/iterations/iter-0003/comparison.png"}
{"ts": "2026-05-21T01:17:51Z", "run_id": "demo-intensity-calibrated-tpe-diff-recon-dcstep-constrained-search-20260521-01", "iter": 3, "agent": "diff-recon-dcstep-constrained-search-tpe-calibrated", "model": "random-search", "change_class": "architecture", "status": "keep", "kept": true, "val_score": null, "headroom": 0.433628496172649, "params_M": 0.958051, "train_n": 200, "rationale": "diff-recon-dcstep-constrained-search-tpe-calibrated: recon_ckpt=/cluster/maier/Agent4CT/checkpoints/ddpm_constrained_final.pt, recon_mode=dps, recon_sample_steps=500, recon_eta=10.7, recon_init=noise, recon_eta_clamp=False, recon_dcstep_every=4, recon_dcstep_n_cg=25, recon_dcstep_warmup=40, recon_dcstep_relax=0.95", "advice_for_others": "diff-recon-dcstep-constrained-search-tpe-calibrated: recon_ckpt=/cluster/maier/Agent4CT/checkpoints/ddpm_constrained_final.pt, recon_mode=dps, recon_sample_steps=500, recon_eta=10.7, recon_init=noise, recon_eta_clamp=False, recon_dcstep_every=4, recon_dcstep_n_cg=25, recon_dcstep_warmup=40, recon_dcstep_relax=0.95 -> hr=0.4336", "comparison_image": "runs/demo-intensity-calibrated-tpe-diff-recon-dcstep-constrained-search-20260521-01/iterations/iter-0003/comparison.png"}
{"ts": "2026-05-21T01:14:17Z", "run_id": "demo-intensity-calibrated-tpe-hammernik-vn-search-20260520-01", "iter": 20, "agent": "hammernik-vn-search-tpe-calibrated", "model": "random-search", "change_class": "architecture", "status": "keep", "kept": true, "val_score": null, "headroom": 0.3553997410406654, "params_M": 0.003843, "train_n": 200, "rationale": "hammernik-vn-search-tpe-calibrated: epochs=15, lr=0.00022976, batch_size=2, vn_T=3, vn_n_filters=16, vn_kernel=7, vn_lambda_init=0.00050247, vn_init=fbp", "advice_for_others": "hammernik-vn-search-tpe-calibrated: epochs=15, lr=0.00022976, batch_size=2, vn_T=3, vn_n_filters=16, vn_kernel=7, vn_lambda_init=0.00050247, vn_init=fbp -> hr=0.3554", "comparison_image": "runs/demo-intensity-calibrated-tpe-hammernik-vn-search-20260520-01/iterations/iter-0020/comparison.png"}
{"ts": "2026-05-21T01:08:25Z", "run_id": "demo-intensity-calibrated-tpe-diff-recon-dcstep-constrained-search-20260521-01", "iter": 2, "agent": "diff-recon-dcstep-constrained-search-tpe-calibrated", "model": "random-search", "change_class": "architecture", "status": "keep", "kept": true, "val_score": null, "headroom": 0.4343991400964822, "params_M": 0.958051, "train_n": 200, "rationale": "diff-recon-dcstep-constrained-search-tpe-calibrated: recon_ckpt=/cluster/maier/Agent4CT/checkpoints/ddpm_constrained_final.pt, recon_mode=dps, recon_sample_steps=800, recon_eta=4.2755, recon_init=noise, recon_eta_clamp=True, recon_dcstep_every=3, recon_dcstep_n_cg=20, recon_dcstep_warmup=10, recon_dcstep_relax=0.95", "advice_for_others": "diff-recon-dcstep-constrained-search-tpe-calibrated: recon_ckpt=/cluster/maier/Agent4CT/checkpoints/ddpm_constrained_final.pt, recon_mode=dps, recon_sample_steps=800, recon_eta=4.2755, recon_init=noise, recon_eta_clamp=True, recon_dcstep_every=3, recon_dcstep_n_cg=20, recon_dcstep_warmup=10, recon_dcstep_relax=0.95 -> hr=0.4344", "comparison_image": "runs/demo-intensity-calibrated-tpe-diff-recon-dcstep-constrained-search-20260521-01/iterations/iter-0002/comparison.png"}
{"ts": "2026-05-21T01:06:54Z", "run_id": "demo-intensity-calibrated-tpe-diff-recon-dcstep-unconstrained-search-20260521-01", "iter": 2, "agent": "diff-recon-dcstep-unconstrained-search-tpe-calibrated", "model": "random-search", "change_class": "architecture", "status": "keep", "kept": true, "val_score": null, "headroom": 0.4440005194348027, "params_M": 0.958051, "train_n": 2000, "rationale": "diff-recon-dcstep-unconstrained-search-tpe-calibrated: recon_ckpt=/cluster/maier/Agent4CT/checkpoints/ddpm_unconstrained_final.pt, recon_mode=dps, recon_sample_steps=800, recon_eta=4.2755, recon_init=noise, recon_eta_clamp=True, recon_dcstep_every=3, recon_dcstep_n_cg=20, recon_dcstep_warmup=10, recon_dcstep_relax=0.95", "advice_for_others": "diff-recon-dcstep-unconstrained-search-tpe-calibrated: recon_ckpt=/cluster/maier/Agent4CT/checkpoints/ddpm_unconstrained_final.pt, recon_mode=dps, recon_sample_steps=800, recon_eta=4.2755, recon_init=noise, recon_eta_clamp=True, recon_dcstep_every=3, recon_dcstep_n_cg=20, recon_dcstep_warmup=10, recon_dcstep_relax=0.95 -> hr=0.4440", "comparison_image": "runs/demo-intensity-calibrated-tpe-diff-recon-dcstep-unconstrained-search-20260521-01/iterations/iter-0002/comparison.png"}
{"ts": "2026-05-21T01:05:11Z", "run_id": "demo-intensity-calibrated-tpe-hammernik-vn-search-20260520-01", "iter": 19, "agent": "hammernik-vn-search-tpe-calibrated", "model": "random-search", "change_class": "architecture", "status": "keep", "kept": true, "val_score": null, "headroom": 0.3200887989415556, "params_M": 0.034055, "train_n": 200, "rationale": "hammernik-vn-search-tpe-calibrated: epochs=13, lr=0.00015666, batch_size=2, vn_T=7, vn_n_filters=32, vn_kernel=11, vn_lambda_init=0.0034084, vn_init=fbp", "advice_for_others": "hammernik-vn-search-tpe-calibrated: epochs=13, lr=0.00015666, batch_size=2, vn_T=7, vn_n_filters=32, vn_kernel=11, vn_lambda_init=0.0034084, vn_init=fbp -> hr=0.3201", "comparison_image": "runs/demo-intensity-calibrated-tpe-hammernik-vn-search-20260520-01/iterations/iter-0019/comparison.png"}
{"ts": "2026-05-21T00:55:44Z", "run_id": "demo-intensity-calibrated-tpe-hammernik-vn-search-20260520-01", "iter": 18, "agent": "hammernik-vn-search-tpe-calibrated", "model": "random-search", "change_class": "architecture", "status": "keep", "kept": true, "val_score": null, "headroom": 0.35374679845714674, "params_M": 0.005379, "train_n": 200, "rationale": "hammernik-vn-search-tpe-calibrated: epochs=10, lr=0.0001051, batch_size=2, vn_T=3, vn_n_filters=16, vn_kernel=9, vn_lambda_init=0.0015399, vn_init=fbp", "advice_for_others": "hammernik-vn-search-tpe-calibrated: epochs=10, lr=0.0001051, batch_size=2, vn_T=3, vn_n_filters=16, vn_kernel=9, vn_lambda_init=0.0015399, vn_init=fbp -> hr=0.3537", "comparison_image": "runs/demo-intensity-calibrated-tpe-hammernik-vn-search-20260520-01/iterations/iter-0018/comparison.png"}
{"ts": "2026-05-21T00:52:24Z", "run_id": "demo-intensity-calibrated-tpe-diff-recon-dcstep-constrained-search-20260521-01", "iter": 1, "agent": "diff-recon-dcstep-constrained-search-tpe-calibrated", "model": "random-search", "change_class": "architecture", "status": "keep", "kept": true, "val_score": null, "headroom": 0.42420278274046375, "params_M": 0.958051, "train_n": 200, "rationale": "diff-recon-dcstep-constrained-search-tpe-calibrated: recon_ckpt=/cluster/maier/Agent4CT/checkpoints/ddpm_constrained_final.pt, recon_mode=dps, recon_sample_steps=500, recon_eta=30, recon_init=fbp, recon_eta_clamp=False, recon_dcstep_every=3, recon_dcstep_n_cg=20, recon_dcstep_warmup=25, recon_dcstep_relax=1", "advice_for_others": "diff-recon-dcstep-constrained-search-tpe-calibrated: recon_ckpt=/cluster/maier/Agent4CT/checkpoints/ddpm_constrained_final.pt, recon_mode=dps, recon_sample_steps=500, recon_eta=30, recon_init=fbp, recon_eta_clamp=False, recon_dcstep_every=3, recon_dcstep_n_cg=20, recon_dcstep_warmup=25, recon_dcstep_relax=1 -> hr=0.4242", "comparison_image": "runs/demo-intensity-calibrated-tpe-diff-recon-dcstep-constrained-search-20260521-01/iterations/iter-0001/comparison.png"}
