{"ts": "2026-06-19T15:23:35Z", "run_id": "demo-dl-claude-agentic-dual-domain-n2i-search-20260618-01", "iter": 20, "agent": "dual_domain_n2i-claude-agentic-breast-ct", "model": "claude-opus-4.7-1m", "change_class": "architecture", "status": "keep", "kept": true, "val_score": 0.5331937074661255, "headroom": 0.215468005498624, "params_M": 0.465762, "train_n": 400, "rationale": "dual_domain_n2i-claude-agentic: train_n=200, val_n=24, batch_size=1, grad_clip=0.3, seed=42, warm_start=True, pretrain_epochs=6, n_iter=75, outer_wall_s=1700, lr=0.0001, unet_c=16, rationale=iter-20 (FINAL): ONE knob -> n_iter 150 -> 75 (HALVE per-scan Adam steps once more), at the iter-19 recorded config on the val_n=24 basis (val_n=24/ep6/lr1e-4/warm_start=True/unet_c16/seed42/grad_clip0.3). DIAGNOSIS (numbers, not pixels): the per-scan n_iter-down sweep has been MONOTONICALLY IMPROVING: iter-17 n_iter600 0.45784 (hr 0.0005) -> iter-18 n_iter300 0.49506 (hr 0.03613) -> iter-19 n_iter150 0.51694 (hr 0.09101, PSNR 14.271), the RUN-BEST, finally beating the old iter-5 val_n=6 peak 0.50811 and clearing the noise floor. Headroom climbed 0.0005 -> 0.0361 -> 0.0910 in lockstep. CONFIRMS the campaign-state insight that fewer per-scan steps reduce per-image U-Net overfit (raising n_iter HURTS: demo 0.4785->0.4293 @n_iter1200); fewer steps keep each per-scan fit nearer the good warm-start init (less single-scan U-Net overfit). FAILURE MODE being cured = the 0.466 M-param U-Net OVERFITS each single noisy 128-view sparse-phantom scan in the no-early-stop _fit_one_scene loop. LEVER CHOICE (box-3, exactly ONE knob): continue the confirmed n_iter-down trend 150->75 -- the clean FINAL test of whether the monotone improvement continues toward a smaller-n_iter optimum, or plateaus/reverses as the fit becomes under-resolved (too few steps to refine off the warm-start init). This is the decisive last datapoint on the n_iter axis for the iter-20 writeup. KEPT FIXED (settled, do NOT touch): warm_start=True (LOAD-BEARING-POSITIVE, iter-8 off -0.0595), lr=1e-4 (iter-3/iter-9 bracket as per-scan optimum), val_n=24 (stable comparison basis, same as iter-13..19), grad_clip=0.3, unet_c=16, seed=42 (peak basin), pretrain_epochs=6 (budget-fit init, same as iter-18/19). HYPOTHESIS: n_iter=75 lifts the val_n=24 seed42 mean above iter-19 0.51694 (trend continues toward a smaller-n_iter optimum) OR plateaus/dips (n_iter has an optimum near 100-150 and 75 is under-resolved). FALSIFIER: delta vs 0.51694 < +0.005 or negative => n_iter optimum is near 150 and the warm-start init quality is the binding ceiling; either branch is the decisive final n_iter-axis datapoint. WALL: iter-19 ran warm6x200=1200 + per-image 24x150=3600 = 4800 steps in 402.7 s (~0.084 s/step). New budget = warm 1200 + per-image 24x75=1800 = 3000 steps ~= 252 s (~4.2 min), and even on a slow node (~0.11 s/step) ~330 s (~5.5 min) -- well under the 15-min target, the outer_wall_s=1700 guard, and the 00:30:00 (1800 s) sbatch wall. All recon-affecting knobs IDENTICAL to the iter-19 recorded config EXCEPT n_iter 150->75.", "advice_for_others": "dual_domain_n2i-claude-agentic: train_n=200, val_n=24, batch_size=1, grad_clip=0.3, seed=42, warm_start=True, pretrain_epochs=6, n_iter=75, outer_wall_s=1700, lr=0.0001, unet_c=16, rationale=iter-20 (FINAL): ONE knob -> n_iter 150 -> 75 (HALVE per-scan Adam steps once more), at the iter-19 recorded config on the val_n=24 basis (val_n=24/ep6/lr1e-4/warm_start=True/unet_c16/seed42/grad_clip0.3). DIAGNOSIS (numbers, not pixels): the per-scan n_iter-down sweep has been MONOTONICALLY IMPROVING: iter-17 n_iter600 0.45784 (hr 0.0005) -> iter-18 n_iter300 0.49506 (hr 0.03613) -> iter-19 n_iter150 0.51694 (hr 0.09101, PSNR 14.271), the RUN-BEST, finally beating the old iter-5 val_n=6 peak 0.50811 and clearing the noise floor. Headroom climbed 0.0005 -> 0.0361 -> 0.0910 in lockstep. CONFIRMS the campaign-state insight that fewer per-scan steps reduce per-image U-Net overfit (raising n_iter HURTS: demo 0.4785->0.4293 @n_iter1200); fewer steps keep each per-scan fit nearer the good warm-start init (less single-scan U-Net overfit). FAILURE MODE being cured = the 0.466 M-param U-Net OVERFITS each single noisy 128-view sparse-phantom scan in the no-early-stop _fit_one_scene loop. LEVER CHOICE (box-3, exactly ONE knob): continue the confirmed n_iter-down trend 150->75 -- the clean FINAL test of whether the monotone improvement continues toward a smaller-n_iter optimum, or plateaus/reverses as the fit becomes under-resolved (too few steps to refine off the warm-start init). This is the decisive last datapoint on the n_iter axis for the iter-20 writeup. KEPT FIXED (settled, do NOT touch): warm_start=True (LOAD-BEARING-POSITIVE, iter-8 off -0.0595), lr=1e-4 (iter-3/iter-9 bracket as per-scan optimum), val_n=24 (stable comparison basis, same as iter-13..19), grad_clip=0.3, unet_c=16, seed=42 (peak basin), pretrain_epochs=6 (budget-fit init, same as iter-18/19). HYPOTHESIS: n_iter=75 lifts the val_n=24 seed42 mean above iter-19 0.51694 (trend continues toward a smaller-n_iter optimum) OR plateaus/dips (n_iter has an optimum near 100-150 and 75 is under-resolved). FALSIFIER: delta vs 0.51694 < +0.005 or negative => n_iter optimum is near 150 and the warm-start init quality is the binding ceiling; either branch is the decisive final n_iter-axis datapoint. WALL: iter-19 ran warm6x200=1200 + per-image 24x150=3600 = 4800 steps in 402.7 s (~0.084 s/step). New budget = warm 1200 + per-image 24x75=1800 = 3000 steps ~= 252 s (~4.2 min), and even on a slow node (~0.11 s/step) ~330 s (~5.5 min) -- well under the 15-min target, the outer_wall_s=1700 guard, and the 00:30:00 (1800 s) sbatch wall. All recon-affecting knobs IDENTICAL to the iter-19 recorded config EXCEPT n_iter 150->75.", "comparison_image": "runs/demo-dl-claude-agentic-dual-domain-n2i-search-20260618-01/iterations/iter-0020/comparison.png"}
{"ts": "2026-06-19T14:58:25Z", "run_id": "demo-dl-claude-agentic-dual-domain-n2i-search-20260618-01", "iter": 19, "agent": "dual_domain_n2i-claude-agentic-breast-ct", "model": "claude-opus-4.7-1m", "change_class": "architecture", "status": "keep", "kept": true, "val_score": 0.5169427394866943, "headroom": 0.09101147262585563, "params_M": 0.465762, "train_n": 400, "rationale": "dual_domain_n2i-claude-agentic: train_n=200, val_n=24, batch_size=1, grad_clip=0.3, seed=42, warm_start=True, pretrain_epochs=6, n_iter=150, outer_wall_s=1700, lr=0.0001, unet_c=16, rationale=iter-19: ONE knob -> n_iter 300 -> 150 (HALVE per-scan Adam steps again), at the iter-18 recorded config on the val_n=24 basis (val_n=24/ep6/lr1e-4/warm_start=True/unet_c16/seed42/grad_clip0.3). DIAGNOSIS (numbers, not pixels): iter-18 n_iter 600->300 LIFTED the val_n=24 seed42 mean 0.443-0.462 (iter-13/14/17) -> 0.49506 (hr 0.03613, PSNR 13.762), the best val_n=24 read so far and approaching the all-time val_n=6 peak iter-5 0.50811. This CONFIRMS the campaign-state insight that fewer per-scan steps reduce per-image U-Net overfit (raising n_iter HURTS: demo 0.4785->0.4293 @n_iter1200). FAILURE MODE = the 0.466 M-param U-Net OVERFITS each single noisy 128-view sparse-phantom scan in the no-early-stop _fit_one_scene loop; structurally FBP-bounded so hr stays ~0. LEVER CHOICE: continue the confirmed n_iter-down trend 300->150 to map its slope -- if SSIM rises again, anchoring nearer the warm-start init keeps helping; if it is flat/down, n_iter has hit a floor and the warm-start init quality is the binding ceiling (finalizes the iter-20 structural-ceiling writeup). This is the least-exhausted productive axis and also shrinks the wall. KEPT FIXED (settled, do NOT touch): warm_start=True (LOAD-BEARING-POSITIVE, iter-8 off -0.0595), lr=1e-4 (iter-3/iter-9 bracket as per-scan optimum), val_n=24 (the stable comparison basis, same as iter-13..18), grad_clip=0.3, unet_c=16, seed=42 (peak basin), pretrain_epochs=6 (iter-18 budget-fit init). HYPOTHESIS: 300->150 keeps each per-scan fit even closer to the good warm-start init, lifting the val_n=24 seed42 mean above iter-18 0.49506 toward/past the iter-5 0.50811 peak. FALSIFIER: if SSIM is flat-or-down vs 0.495 (delta < +0.005 or negative), n_iter has hit its floor and the warm-start init is the binding ceiling -> finalize the structural-ceiling documentation for iter-20. hr expected ~0 either way (structurally FBP-bounded on dense 128-view phantoms). WALL: iter-18 ran 8400 steps in 712 s (~0.085 s/step). New budget = warm 6x200=1200 + per-image 24x150=3600 = 4800 steps ~= 408 s (~6.8 min), and even on a slow node (~0.11 s/step) ~530 s (~8.8 min) -- well under the 15-min target, the outer_wall_s=1700 guard, and the 00:30:00 (1800 s) sbatch wall. All recon-affecting knobs IDENTICAL to the iter-18 recorded config EXCEPT n_iter 300->150.", "advice_for_others": "dual_domain_n2i-claude-agentic: train_n=200, val_n=24, batch_size=1, grad_clip=0.3, seed=42, warm_start=True, pretrain_epochs=6, n_iter=150, outer_wall_s=1700, lr=0.0001, unet_c=16, rationale=iter-19: ONE knob -> n_iter 300 -> 150 (HALVE per-scan Adam steps again), at the iter-18 recorded config on the val_n=24 basis (val_n=24/ep6/lr1e-4/warm_start=True/unet_c16/seed42/grad_clip0.3). DIAGNOSIS (numbers, not pixels): iter-18 n_iter 600->300 LIFTED the val_n=24 seed42 mean 0.443-0.462 (iter-13/14/17) -> 0.49506 (hr 0.03613, PSNR 13.762), the best val_n=24 read so far and approaching the all-time val_n=6 peak iter-5 0.50811. This CONFIRMS the campaign-state insight that fewer per-scan steps reduce per-image U-Net overfit (raising n_iter HURTS: demo 0.4785->0.4293 @n_iter1200). FAILURE MODE = the 0.466 M-param U-Net OVERFITS each single noisy 128-view sparse-phantom scan in the no-early-stop _fit_one_scene loop; structurally FBP-bounded so hr stays ~0. LEVER CHOICE: continue the confirmed n_iter-down trend 300->150 to map its slope -- if SSIM rises again, anchoring nearer the warm-start init keeps helping; if it is flat/down, n_iter has hit a floor and the warm-start init quality is the binding ceiling (finalizes the iter-20 structural-ceiling writeup). This is the least-exhausted productive axis and also shrinks the wall. KEPT FIXED (settled, do NOT touch): warm_start=True (LOAD-BEARING-POSITIVE, iter-8 off -0.0595), lr=1e-4 (iter-3/iter-9 bracket as per-scan optimum), val_n=24 (the stable comparison basis, same as iter-13..18), grad_clip=0.3, unet_c=16, seed=42 (peak basin), pretrain_epochs=6 (iter-18 budget-fit init). HYPOTHESIS: 300->150 keeps each per-scan fit even closer to the good warm-start init, lifting the val_n=24 seed42 mean above iter-18 0.49506 toward/past the iter-5 0.50811 peak. FALSIFIER: if SSIM is flat-or-down vs 0.495 (delta < +0.005 or negative), n_iter has hit its floor and the warm-start init is the binding ceiling -> finalize the structural-ceiling documentation for iter-20. hr expected ~0 either way (structurally FBP-bounded on dense 128-view phantoms). WALL: iter-18 ran 8400 steps in 712 s (~0.085 s/step). New budget = warm 6x200=1200 + per-image 24x150=3600 = 4800 steps ~= 408 s (~6.8 min), and even on a slow node (~0.11 s/step) ~530 s (~8.8 min) -- well under the 15-min target, the outer_wall_s=1700 guard, and the 00:30:00 (1800 s) sbatch wall. All recon-affecting knobs IDENTICAL to the iter-18 recorded config EXCEPT n_iter 300->150.", "comparison_image": "runs/demo-dl-claude-agentic-dual-domain-n2i-search-20260618-01/iterations/iter-0019/comparison.png"}
{"ts": "2026-06-19T14:44:55Z", "run_id": "demo-dl-claude-agentic-dual-domain-n2i-search-20260618-01", "iter": 18, "agent": "dual_domain_n2i-claude-agentic-breast-ct", "model": "claude-opus-4.7-1m", "change_class": "architecture", "status": "keep", "kept": true, "val_score": 0.49506473541259766, "headroom": 0.03613387759275688, "params_M": 0.465762, "train_n": 400, "rationale": "dual_domain_n2i-claude-agentic: train_n=200, val_n=24, batch_size=1, grad_clip=0.3, seed=42, warm_start=True, pretrain_epochs=6, n_iter=300, outer_wall_s=1700, lr=0.0001, unet_c=16, rationale=iter-18 (REDISPATCH after job 765177 TIMED OUT at 28:45 without recording): HYPOTHESIS KNOB = n_iter 600 -> 300 (HALVE per-scan Adam steps), at the iter-17 recorded config on the val_n=24 basis (val_n=24/ep/lr1e-4/warm_start=True/unet_c16/seed42/grad_clip0.3). This is BOTH the wall fix AND a clean less-per-scan-overfit probe. PREVIOUS RECORDED RESULT (iter-17, grad_clip 1.0->0.3): val_ssim 0.45779, hr 0.0005, PSNR 13.45 -- in the 0.43-0.47 band, FLAT vs the iter-13 seed42/val_n24 baseline 0.4616 (inside the documented val_n=24 4-seed noise floor std 0.0143); best ever is still iter-5 0.50811 (hr0). FAILURE MODE = the 0.466 M-param U-Net OVERFITS each single noisy 128-view sparse-phantom scan in the no-early-stop _fit_one_scene loop (the 6-param bilateral twin physically CANNOT overfit, hr+0.33; this U-Net stays hr~0 at 0.43-0.51 SSIM); the per-image fit is FBP-bounded AND has a large init-driven stochastic noise floor (well-documented). LEVER CHOICE: campaign-state says raising n_iter HURTS (per-scan overfit: demo 0.4785->0.4293 @n_iter1200) and that fewer steps anchored nearer the warm-start init can help -- so LOWERING n_iter 600->300 is a clean less-overfit probe that has NOT been tried, and it ALSO directly fixes the wall (halves the dominant per-image cost). KEPT FIXED (settled, do NOT touch): warm_start=True (LOAD-BEARING-POSITIVE, iter-8 off -0.0595), lr=1e-4 (iter-3/iter-9 bracket as per-scan optimum), val_n=24 (the stable comparison basis -- NOT reduced, same metric basis as iter-13..17), grad_clip=0.3 (iter-17 recorded value), unet_c=16, seed=42 (peak basin). HYPOTHESIS: if per-scan U-Net overfitting (not the FBP bound) holds SSIM below the iter-5 0.508 peak, halving n_iter keeps each per-scan fit anchored nearer the good warm-start init, lifting the val_n=24 seed42 mean above the iter-13/iter-17 ~0.46 reads toward 0.508. FALSIFIER: if SSIM stays in the 0.43-0.47 band (within noise of iter-17 0.4578), the floor is the FBP bound itself, FINALIZING the structural ceiling for the iter-20 writeup. hr expected ~0 either way (structurally FBP-bounded on dense 128-view phantoms). BUDGET CUT (NOT the hypothesis): pretrain_epochs 12 -> 6 PURELY to guarantee the wall. The PRIOR iter-18 attempt (job 765177) ran the full 16800-step budget (warm 12x200=2400 + per-image 24x600=14400) and was KILLED at 28:45 by the sbatch wall WITHOUT recording. ep6 is a documented strong warm-start init (iter-4 ep6 0.4957, near the ep12 0.5081 peak), so this budget cut costs little init quality while halving the pre-pass cost. WALL: new step budget = warm 6x200=1200 + per-image 24x300=7200 = 8400 steps (vs the 16800 that timed out); at the iter-17 effective rate ~0.088 s/step this is ~740 s ~= 12.4 min, and even on a slow node (~0.10-0.11 s/step) ~840-925 s ~= 14-15.5 min, with outer_wall_s=1700 as a hard internal guard that aborts cleanly under the 00:30:00 (1800 s) sbatch wall so the iter RECORDS even on a pathological node. All recon-affecting knobs IDENTICAL to the iter-17 recorded config EXCEPT n_iter 600->300 (hypothesis) and pretrain_epochs 12->6 (budget cut).", "advice_for_others": "dual_domain_n2i-claude-agentic: train_n=200, val_n=24, batch_size=1, grad_clip=0.3, seed=42, warm_start=True, pretrain_epochs=6, n_iter=300, outer_wall_s=1700, lr=0.0001, unet_c=16, rationale=iter-18 (REDISPATCH after job 765177 TIMED OUT at 28:45 without recording): HYPOTHESIS KNOB = n_iter 600 -> 300 (HALVE per-scan Adam steps), at the iter-17 recorded config on the val_n=24 basis (val_n=24/ep/lr1e-4/warm_start=True/unet_c16/seed42/grad_clip0.3). This is BOTH the wall fix AND a clean less-per-scan-overfit probe. PREVIOUS RECORDED RESULT (iter-17, grad_clip 1.0->0.3): val_ssim 0.45779, hr 0.0005, PSNR 13.45 -- in the 0.43-0.47 band, FLAT vs the iter-13 seed42/val_n24 baseline 0.4616 (inside the documented val_n=24 4-seed noise floor std 0.0143); best ever is still iter-5 0.50811 (hr0). FAILURE MODE = the 0.466 M-param U-Net OVERFITS each single noisy 128-view sparse-phantom scan in the no-early-stop _fit_one_scene loop (the 6-param bilateral twin physically CANNOT overfit, hr+0.33; this U-Net stays hr~0 at 0.43-0.51 SSIM); the per-image fit is FBP-bounded AND has a large init-driven stochastic noise floor (well-documented). LEVER CHOICE: campaign-state says raising n_iter HURTS (per-scan overfit: demo 0.4785->0.4293 @n_iter1200) and that fewer steps anchored nearer the warm-start init can help -- so LOWERING n_iter 600->300 is a clean less-overfit probe that has NOT been tried, and it ALSO directly fixes the wall (halves the dominant per-image cost). KEPT FIXED (settled, do NOT touch): warm_start=True (LOAD-BEARING-POSITIVE, iter-8 off -0.0595), lr=1e-4 (iter-3/iter-9 bracket as per-scan optimum), val_n=24 (the stable comparison basis -- NOT reduced, same metric basis as iter-13..17), grad_clip=0.3 (iter-17 recorded value), unet_c=16, seed=42 (peak basin). HYPOTHESIS: if per-scan U-Net overfitting (not the FBP bound) holds SSIM below the iter-5 0.508 peak, halving n_iter keeps each per-scan fit anchored nearer the good warm-start init, lifting the val_n=24 seed42 mean above the iter-13/iter-17 ~0.46 reads toward 0.508. FALSIFIER: if SSIM stays in the 0.43-0.47 band (within noise of iter-17 0.4578), the floor is the FBP bound itself, FINALIZING the structural ceiling for the iter-20 writeup. hr expected ~0 either way (structurally FBP-bounded on dense 128-view phantoms). BUDGET CUT (NOT the hypothesis): pretrain_epochs 12 -> 6 PURELY to guarantee the wall. The PRIOR iter-18 attempt (job 765177) ran the full 16800-step budget (warm 12x200=2400 + per-image 24x600=14400) and was KILLED at 28:45 by the sbatch wall WITHOUT recording. ep6 is a documented strong warm-start init (iter-4 ep6 0.4957, near the ep12 0.5081 peak), so this budget cut costs little init quality while halving the pre-pass cost. WALL: new step budget = warm 6x200=1200 + per-image 24x300=7200 = 8400 steps (vs the 16800 that timed out); at the iter-17 effective rate ~0.088 s/step this is ~740 s ~= 12.4 min, and even on a slow node (~0.10-0.11 s/step) ~840-925 s ~= 14-15.5 min, with outer_wall_s=1700 as a hard internal guard that aborts cleanly under the 00:30:00 (1800 s) sbatch wall so the iter RECORDS even on a pathological node. All recon-affecting knobs IDENTICAL to the iter-17 recorded config EXCEPT n_iter 600->300 (hypothesis) and pretrain_epochs 12->6 (budget cut).", "comparison_image": "runs/demo-dl-claude-agentic-dual-domain-n2i-search-20260618-01/iterations/iter-0018/comparison.png"}
