{"ts": "2026-06-19T13:39:56Z", "run_id": "demo-dl-claude-agentic-dual-domain-n2i-search-20260618-01", "iter": 17, "agent": "dual_domain_n2i-claude-agentic-breast-ct", "model": "claude-opus-4.7-1m", "change_class": "architecture", "status": "keep", "kept": true, "val_score": 0.4577917456626892, "headroom": 0.0004998032828907872, "params_M": 0.465762, "train_n": 400, "rationale": "dual_domain_n2i-claude-agentic: train_n=200, val_n=24, batch_size=1, grad_clip=0.3, seed=42, warm_start=True, pretrain_epochs=12, n_iter=600, outer_wall_s=1700, lr=0.0001, unet_c=16, rationale=iter-17: ONE knob -> grad_clip 1.0 -> 0.3 (TIGHTER per-step gradient-norm cap), at the iter-5 PEAK family config on the val_n=24 basis (val_n=24/ep12/lr1e-4/warm_start=True/n_iter600/unet_c16/seed42). FIRST ceiling-RAISER attempt since iter-5 (0.50811 hr0, the run best); iters 6-16 never beat it (iters 13-16 were val_n=24 noise-floor reads: seed42=0.4616 / seed123=0.4431 / seed7=0.4257 / seed2024=0.4379, 4-seed mean 0.4421 std 0.0143, hr 0 throughout). DIAGNOSIS (numbers, not pixels): iter-16 (seed7->2024) SSIM 0.43794 PSNR 13.95 hr0; best ever = iter-5 0.50811 (seed42/ep12/lr1e-4/val_n6). FAILURE MODE = the 0.466 M-param U-Net OVERFITS each single noisy 128-view sparse-phantom scan in the no-early-stop _fit_one_scene loop (the 6-param bilateral twin physically CANNOT overfit, which is why the twin clears baseline at hr+0.33 while this U-Net stays hr~0 at 0.43-0.51 SSIM); the per-image fit is FBP-bounded AND has a large init-driven stochastic noise floor (now well-documented). EXHAUSTED / FORBIDDEN recon axes (do NOT retry, per handoff): n_iter (iter-2 1200 steps 0.4785->0.4293, per-scan overfit), warm_start (iter-8 off -0.0595, load-bearing-positive), pretrain_epochs (ep12 peak, ep18 worse 0.5016), lr (iter-3 1e-3->1e-4 + iter-9 1e-4->2e-4 bracket 1e-4 as the per-scan optimum), unet_c (design-doc warned-against; mayo n2i c16->c32 flat 0.9508). val_n is a noise-floor-READ axis (6->12->24), not a recon lever. LEVER CHOICE (the one genuinely-untried ALLOWED knob value): grad_clip 1.0 -> 0.3. grad_clip is applied as clip_grad_norm_(params, gc) in BOTH the warm-start pre-pass (solver lines 263-264) and the per-scan Adam loop (lines 137-138). LOWERING it tightens the per-step gradient-norm cap, which ANCHORS each per-scan fit more tightly near the good warm-start init across all 600 steps -- directly attacking the named per-scan-overfitting failure mode. Lowering can NEVER trigger the 2304/128-view FBP-adjoint overflow the guard exists to prevent (it only REDUCES gradient magnitude), so it is both SAFE and on-mandate; prior iters deliberately declined RAISING grad_clip, but LOWERING it has never been tried. Reset to the seed42 PEAK basin (the good basin, not the iter-16 seed2024 basin) so the grad_clip contrast is clean against the iter-13 seed42/val_n24 read (0.4616). HYPOTHESIS: if per-scan U-Net overfitting (not the FBP bound) is what holds SSIM below the iter-5 0.508 peak, the tighter clip keeps Adam pinned near the warm-start init, lifting the val_n=24 seed42 mean above the iter-13 0.4616 read toward/past iter-5 0.508 -- and possibly nudging hr off 0. FALSIFIER: if SSIM stays in the 0.43-0.47 band the floor is the FBP bound itself (not optimization), FINALIZING the structural ceiling for the iter-20 writeup. hr expected ~0 either way (structurally FBP-bounded on dense 128-view phantoms). WALL: step budget UNCHANGED vs iter-13/14/15/16 (warm 12x200=2400 + per-image 24x600=14400 = 16800 steps); those ran 1400-1651 s. grad_clip changes neither step count nor per-step cost, so wall is identical, under the outer_wall_s=1700 guard and the 00:30:00 (1800 s) sbatch wall. All recon-affecting knobs IDENTICAL to the iter-13 seed42/val_n24 config (train_n=200, val_n=24, batch_size=1, seed=42, warm_start=True, pretrain_epochs=12, n_iter=600, lr=1e-4, unet_c=16, outer_wall_s=1700); ONLY grad_clip 1.0 -> 0.3 changed.", "advice_for_others": "dual_domain_n2i-claude-agentic: train_n=200, val_n=24, batch_size=1, grad_clip=0.3, seed=42, warm_start=True, pretrain_epochs=12, n_iter=600, outer_wall_s=1700, lr=0.0001, unet_c=16, rationale=iter-17: ONE knob -> grad_clip 1.0 -> 0.3 (TIGHTER per-step gradient-norm cap), at the iter-5 PEAK family config on the val_n=24 basis (val_n=24/ep12/lr1e-4/warm_start=True/n_iter600/unet_c16/seed42). FIRST ceiling-RAISER attempt since iter-5 (0.50811 hr0, the run best); iters 6-16 never beat it (iters 13-16 were val_n=24 noise-floor reads: seed42=0.4616 / seed123=0.4431 / seed7=0.4257 / seed2024=0.4379, 4-seed mean 0.4421 std 0.0143, hr 0 throughout). DIAGNOSIS (numbers, not pixels): iter-16 (seed7->2024) SSIM 0.43794 PSNR 13.95 hr0; best ever = iter-5 0.50811 (seed42/ep12/lr1e-4/val_n6). FAILURE MODE = the 0.466 M-param U-Net OVERFITS each single noisy 128-view sparse-phantom scan in the no-early-stop _fit_one_scene loop (the 6-param bilateral twin physically CANNOT overfit, which is why the twin clears baseline at hr+0.33 while this U-Net stays hr~0 at 0.43-0.51 SSIM); the per-image fit is FBP-bounded AND has a large init-driven stochastic noise floor (now well-documented). EXHAUSTED / FORBIDDEN recon axes (do NOT retry, per handoff): n_iter (iter-2 1200 steps 0.4785->0.4293, per-scan overfit), warm_start (iter-8 off -0.0595, load-bearing-positive), pretrain_epochs (ep12 peak, ep18 worse 0.5016), lr (iter-3 1e-3->1e-4 + iter-9 1e-4->2e-4 bracket 1e-4 as the per-scan optimum), unet_c (design-doc warned-against; mayo n2i c16->c32 flat 0.9508). val_n is a noise-floor-READ axis (6->12->24), not a recon lever. LEVER CHOICE (the one genuinely-untried ALLOWED knob value): grad_clip 1.0 -> 0.3. grad_clip is applied as clip_grad_norm_(params, gc) in BOTH the warm-start pre-pass (solver lines 263-264) and the per-scan Adam loop (lines 137-138). LOWERING it tightens the per-step gradient-norm cap, which ANCHORS each per-scan fit more tightly near the good warm-start init across all 600 steps -- directly attacking the named per-scan-overfitting failure mode. Lowering can NEVER trigger the 2304/128-view FBP-adjoint overflow the guard exists to prevent (it only REDUCES gradient magnitude), so it is both SAFE and on-mandate; prior iters deliberately declined RAISING grad_clip, but LOWERING it has never been tried. Reset to the seed42 PEAK basin (the good basin, not the iter-16 seed2024 basin) so the grad_clip contrast is clean against the iter-13 seed42/val_n24 read (0.4616). HYPOTHESIS: if per-scan U-Net overfitting (not the FBP bound) is what holds SSIM below the iter-5 0.508 peak, the tighter clip keeps Adam pinned near the warm-start init, lifting the val_n=24 seed42 mean above the iter-13 0.4616 read toward/past iter-5 0.508 -- and possibly nudging hr off 0. FALSIFIER: if SSIM stays in the 0.43-0.47 band the floor is the FBP bound itself (not optimization), FINALIZING the structural ceiling for the iter-20 writeup. hr expected ~0 either way (structurally FBP-bounded on dense 128-view phantoms). WALL: step budget UNCHANGED vs iter-13/14/15/16 (warm 12x200=2400 + per-image 24x600=14400 = 16800 steps); those ran 1400-1651 s. grad_clip changes neither step count nor per-step cost, so wall is identical, under the outer_wall_s=1700 guard and the 00:30:00 (1800 s) sbatch wall. All recon-affecting knobs IDENTICAL to the iter-13 seed42/val_n24 config (train_n=200, val_n=24, batch_size=1, seed=42, warm_start=True, pretrain_epochs=12, n_iter=600, lr=1e-4, unet_c=16, outer_wall_s=1700); ONLY grad_clip 1.0 -> 0.3 changed.", "comparison_image": "runs/demo-dl-claude-agentic-dual-domain-n2i-search-20260618-01/iterations/iter-0017/comparison.png"}
{"ts": "2026-06-19T13:03:11Z", "run_id": "demo-dl-claude-agentic-dual-domain-bilateral-n2i-search-20260618-01", "iter": 20, "agent": "dual_domain_bilateral_n2i-claude-agentic-breast-ct", "model": "claude-opus-4.7-1m", "change_class": "architecture", "status": "keep", "kept": true, "val_score": 0.8456467390060425, "headroom": 0.32340273106400275, "params_M": 2.4e-05, "train_n": 400, "rationale": "dual_domain_bilateral_n2i-claude-agentic: train_n=200, val_n=6, batch_size=1, grad_clip=1.0, seed=42, warm_start=True, pretrain_epochs=3, n_iter=400, outer_wall_s=1200, lr=0.0023, proj_n_bf=1, img_n_bf=7, proj_kernel=7, img_kernel=13, proj_sx=1.0, proj_sy=2.0, proj_sr=0.02, img_sx=5.5, img_sy=5.5, img_sr=0.02, rationale=iter-20: HARD-STOP FINAL iter of the demo_dl dual_domain_bilateral_n2i spatial-smoothing thread (search-20260618-01). ONE knob changed vs the iter-19 WIN base (image-domain bilateral WINDOW SIZE img_kernel 11->13); all 18 other fields held IDENTICAL to demo_dl_dual_domain_bilateral_n2i_iter_19.json (img_sx/img_sy=5.5, img_n_bf=7, img_sr=0.02 LOOSE demo-correct, proj_n_bf=1, proj_kernel=7, proj_sx/sy=1.0/2.0, proj_sr=0.02, lr=2.3e-3, warm_start=True, pretrain_epochs=3, n_iter=400, train_n=200, val_n=6, grad_clip=1.0, seed=42 -> identical seed=42 val split, directly comparable to iter-19 SSIM 0.8446 / hr 0.3219 / PSNR 20.04). SIX-BOX: (1) iter-18 img_kernel 9->11 (sigma=4.5 held) -> SSIM 0.8368->0.8401 (+0.0033, BELOW the 0.005 threshold); iter-19 img_sx/img_sy 4.5->5.5 (kernel=11 held) -> SSIM 0.8401->0.8446 (+0.0045, also below 0.005 but POSITIVE and the larger of the two last rungs), hr stayed pinned 0.3256->0.3219, PSNR flat 20.09->20.04. Full ladder: SSIM 0.7796(iter6)->0.7940(s2.5)->0.8035(s3.5)->0.8246(k7)->0.8284(k9)->0.8368(s4.5)->0.8401(k11)->0.8446(s5.5). Sigma rungs +0.0144,+0.0095,+0.0084,+0.0045; kernel rungs +0.0211,+0.0038,+0.0033 -- decelerating toward the ~0.85 SSIM / ~0.32 hr substrate bound; hr is PINNED (the 64-view half-of-128 FBP noise-floor ceiling) so SSIM is the only live surface. (2) BINDING CONSTRAINT = the WINDOW (kernel), not the sigma: a Gaussian of spatial sigma s needs ~+/-2s support; at iter-19 sigma=5.5 requests ~+/-11px but kernel=11 gives only a +/-5px window (half-window 5 < sigma 5.5), so the sigma=5.5 Gaussian is window-TRUNCATED -- the +0.0045 iter-19 lift was the sigma reaching the +/-5px window edge, and it cannot reach the +/-11px it requests. So the window is again binding. (3) ONE knob: img_kernel 11->13 -- the next rung of the proven alternating sigma<->kernel ladder, raising the binding constraint (the window) so the +/-6px window admits more of the sigma=5.5 Gaussian. This is EXACTLY the iter-19 pre-registered next step ('iter-20 would widen the kernel one final notch (11->13)'). Chose img_kernel over (a) pushing img_sx/img_sy 5.5->6.5 NOW (sigma is window-truncated at kernel=11 -- widening it further requests support the +/-5px window cannot deliver, the iter-14 saturation regime; widen the window first), (b) proj_sr/proj_kernel/proj_n_bf (whole proj domain confirmed flat at iter-11/12 -- symmetry trap, wasted), (c) img_sr (exhausted + substrate-confirmed WRONG-direction -- tightening to 0.0005 collapsed hr 0.3335->0.1998 at iter-4 -- FORBIDDEN, stays LOOSE 0.02), (d) img_n_bf/n_iter/pretrain_epochs/seed/val_n (all DEAD FLAT / variance-only, exhausted), (e) grad_clip (mandatory overflow guard at 1.0, not a quality lever). (4) HYPOTHESIS: img_kernel 11->13 yields a SUB-THRESHOLD SSIM gain (<0.005) at ~0.845-0.85 while hr stays pinned ~0.32 and PSNR flat ~20.0 -- CONFIRMING the image-domain spatial-denoising ladder has reached the ~0.85 SSIM / ~0.32 hr substrate bound (the 6-param bilateral cannot extract more than the 64-view FBP noise floor allows on this synthetic phantom substrate). OR it squeezes one last small lift past 0.8446 -- either outcome CLOSES the spatial-smoothing investigation, which is the purpose of this FINAL data point. (5) WALL: iter-18/19 ran ~1045-1058 s at img_kernel=11; a 13-px image-BF window is modestly slower per step (the image-domain conv is a small fraction of the 128-view FBP+proj per-step cost) -- n_iter=400/val_n=6 held at iter-19 values, so wall stays under the 1800 s sbatch wall and the 1200 s outer_wall_s internal guard (under the 15-min budget). (6) This is iter-20, the HARD STOP -- NO further iters after this one. Held fixed at iter-19 values: img_sx=5.5/img_sy=5.5, img_n_bf=7, img_sr=0.02 (LOOSE, demo-correct), proj_n_bf=1, proj_kernel=7, proj_sr=0.02, proj_sx=1.0/proj_sy=2.0, lr=2.3e-3, warm_start=True, pretrain_epochs=3, n_iter=400, train_n=200, val_n=6, grad_clip=1.0, seed=42. PER-IMAGE bilateral N2I, AGENT4CT_DATASET=phantoms; warm_start STAYS ON; do NOT revert to amortized; do NOT tighten img_sr.", "advice_for_others": "dual_domain_bilateral_n2i-claude-agentic: train_n=200, val_n=6, batch_size=1, grad_clip=1.0, seed=42, warm_start=True, pretrain_epochs=3, n_iter=400, outer_wall_s=1200, lr=0.0023, proj_n_bf=1, img_n_bf=7, proj_kernel=7, img_kernel=13, proj_sx=1.0, proj_sy=2.0, proj_sr=0.02, img_sx=5.5, img_sy=5.5, img_sr=0.02, rationale=iter-20: HARD-STOP FINAL iter of the demo_dl dual_domain_bilateral_n2i spatial-smoothing thread (search-20260618-01). ONE knob changed vs the iter-19 WIN base (image-domain bilateral WINDOW SIZE img_kernel 11->13); all 18 other fields held IDENTICAL to demo_dl_dual_domain_bilateral_n2i_iter_19.json (img_sx/img_sy=5.5, img_n_bf=7, img_sr=0.02 LOOSE demo-correct, proj_n_bf=1, proj_kernel=7, proj_sx/sy=1.0/2.0, proj_sr=0.02, lr=2.3e-3, warm_start=True, pretrain_epochs=3, n_iter=400, train_n=200, val_n=6, grad_clip=1.0, seed=42 -> identical seed=42 val split, directly comparable to iter-19 SSIM 0.8446 / hr 0.3219 / PSNR 20.04). SIX-BOX: (1) iter-18 img_kernel 9->11 (sigma=4.5 held) -> SSIM 0.8368->0.8401 (+0.0033, BELOW the 0.005 threshold); iter-19 img_sx/img_sy 4.5->5.5 (kernel=11 held) -> SSIM 0.8401->0.8446 (+0.0045, also below 0.005 but POSITIVE and the larger of the two last rungs), hr stayed pinned 0.3256->0.3219, PSNR flat 20.09->20.04. Full ladder: SSIM 0.7796(iter6)->0.7940(s2.5)->0.8035(s3.5)->0.8246(k7)->0.8284(k9)->0.8368(s4.5)->0.8401(k11)->0.8446(s5.5). Sigma rungs +0.0144,+0.0095,+0.0084,+0.0045; kernel rungs +0.0211,+0.0038,+0.0033 -- decelerating toward the ~0.85 SSIM / ~0.32 hr substrate bound; hr is PINNED (the 64-view half-of-128 FBP noise-floor ceiling) so SSIM is the only live surface. (2) BINDING CONSTRAINT = the WINDOW (kernel), not the sigma: a Gaussian of spatial sigma s needs ~+/-2s support; at iter-19 sigma=5.5 requests ~+/-11px but kernel=11 gives only a +/-5px window (half-window 5 < sigma 5.5), so the sigma=5.5 Gaussian is window-TRUNCATED -- the +0.0045 iter-19 lift was the sigma reaching the +/-5px window edge, and it cannot reach the +/-11px it requests. So the window is again binding. (3) ONE knob: img_kernel 11->13 -- the next rung of the proven alternating sigma<->kernel ladder, raising the binding constraint (the window) so the +/-6px window admits more of the sigma=5.5 Gaussian. This is EXACTLY the iter-19 pre-registered next step ('iter-20 would widen the kernel one final notch (11->13)'). Chose img_kernel over (a) pushing img_sx/img_sy 5.5->6.5 NOW (sigma is window-truncated at kernel=11 -- widening it further requests support the +/-5px window cannot deliver, the iter-14 saturation regime; widen the window first), (b) proj_sr/proj_kernel/proj_n_bf (whole proj domain confirmed flat at iter-11/12 -- symmetry trap, wasted), (c) img_sr (exhausted + substrate-confirmed WRONG-direction -- tightening to 0.0005 collapsed hr 0.3335->0.1998 at iter-4 -- FORBIDDEN, stays LOOSE 0.02), (d) img_n_bf/n_iter/pretrain_epochs/seed/val_n (all DEAD FLAT / variance-only, exhausted), (e) grad_clip (mandatory overflow guard at 1.0, not a quality lever). (4) HYPOTHESIS: img_kernel 11->13 yields a SUB-THRESHOLD SSIM gain (<0.005) at ~0.845-0.85 while hr stays pinned ~0.32 and PSNR flat ~20.0 -- CONFIRMING the image-domain spatial-denoising ladder has reached the ~0.85 SSIM / ~0.32 hr substrate bound (the 6-param bilateral cannot extract more than the 64-view FBP noise floor allows on this synthetic phantom substrate). OR it squeezes one last small lift past 0.8446 -- either outcome CLOSES the spatial-smoothing investigation, which is the purpose of this FINAL data point. (5) WALL: iter-18/19 ran ~1045-1058 s at img_kernel=11; a 13-px image-BF window is modestly slower per step (the image-domain conv is a small fraction of the 128-view FBP+proj per-step cost) -- n_iter=400/val_n=6 held at iter-19 values, so wall stays under the 1800 s sbatch wall and the 1200 s outer_wall_s internal guard (under the 15-min budget). (6) This is iter-20, the HARD STOP -- NO further iters after this one. Held fixed at iter-19 values: img_sx=5.5/img_sy=5.5, img_n_bf=7, img_sr=0.02 (LOOSE, demo-correct), proj_n_bf=1, proj_kernel=7, proj_sr=0.02, proj_sx=1.0/proj_sy=2.0, lr=2.3e-3, warm_start=True, pretrain_epochs=3, n_iter=400, train_n=200, val_n=6, grad_clip=1.0, seed=42. PER-IMAGE bilateral N2I, AGENT4CT_DATASET=phantoms; warm_start STAYS ON; do NOT revert to amortized; do NOT tighten img_sr.", "comparison_image": "runs/demo-dl-claude-agentic-dual-domain-bilateral-n2i-search-20260618-01/iterations/iter-0020/comparison.png"}
