{"ts": "2026-06-19T01:58:05Z", "run_id": "demo-dl-claude-agentic-dual-domain-bilateral-n2i-search-20260618-01", "iter": 8, "agent": "dual_domain_bilateral_n2i-claude-agentic-breast-ct", "model": "claude-opus-4.7-1m", "change_class": "architecture", "status": "keep", "kept": true, "val_score": 0.7710667848587036, "headroom": 0.4222017744019556, "params_M": 2.4e-05, "train_n": 400, "rationale": "dual_domain_bilateral_n2i-claude-agentic: train_n=200, val_n=6, batch_size=1, grad_clip=1.0, seed=123, warm_start=True, pretrain_epochs=3, n_iter=400, outer_wall_s=1200, lr=0.0023, proj_n_bf=1, img_n_bf=7, proj_kernel=7, img_kernel=5, proj_sx=1.0, proj_sy=2.0, proj_sr=0.02, img_sx=1.5, img_sy=1.5, img_sr=0.02, rationale=iter-8: CEILING-CONFIRMATION (seed-invariance) probe. ONE knob changed vs the iter-6 hr-best base (seed 42->123); all 18 other fields held IDENTICAL to demo_dl_dual_domain_bilateral_n2i_iter_06.json (img_n_bf=7, img_sr=0.02 LOOSE demo-correct, n_iter=400). seed is the FIRST not-yet-tried axis -- it was pinned at 42 across iters 1-7, so this is a genuinely new probe (not a re-touch of an exhausted lever). Read iters 5-7 BY HEADROOM (the campaign primary, PSNR/noise-sensitive on demo): iter-5 img_sr->0.02 revert hr 0.3320; iter-6 img_n_bf=7 hr 0.3330 (depth DEAD FLAT vs iter-3 n_bf=5 0.3335); iter-7 n_iter 400->800 hr 0.3346 (per-scan Adam budget DEAD FLAT). BOTH capacity axes are now exhausted: image-domain DEPTH (img_n_bf, hr slope collapsed to ~0 by n_bf=5) AND per-scan OPTIMIZER budget (n_iter, flat at 800 -- and the 6-param bilateral physically CANNOT overfit one scan, so more steps cannot lift hr). img_sr is exhausted+substrate-confirmed wrong-direction (demo wants LOOSE 0.02; tightening to 0.0005 collapsed hr 0.3335->0.1998 at iter-4). proj_n_bf is in the symmetry trap (near-identity proj sigmas -> wasted params). FAILURE MODE being documented: the 6-param bilateral is at its ~hr 0.33 STRUCTURAL ceiling on demo phantoms -- it cannot extract more than the 64-view (half of 128) FBP noise floor allows on this synthetic substrate. The open question this probe closes: is hr~0.333 a STABLE structural bound or an artifact of the single seed=42 val split? Re-running the identical iter-6 config under a fresh seed (123 -> different 6-scene val draw AND different warm-start/per-scan init noise) tests invariance. HYPOTHESIS: hr lands ~0.333 again (within +/-0.01) -> CONFIRMS the ~hr 0.33 ceiling is seed-stable and structural, not a lucky split. If hr instead swings widely, the ceiling is split-sensitive and val_n should be raised next to tighten the estimate. Chose seed over (a) img_n_bf/n_iter (both DEAD FLAT, exhausted), (b) img_sr (exhausted, wrong-direction), (c) proj_n_bf (symmetry trap), (d) lr/grad_clip/warm_start (also untried, but seed-invariance is the canonical first ceiling-confirmation probe and was explicitly named as the next step in the iter-6/iter-7 rationales). Held fixed at iter-6 values: img_n_bf=7, img_sr=0.02 (LOOSE, demo-correct), n_iter=400, proj_n_bf=1, kernels (proj_k=7/img_k=5), proj sigmas (1.0/2.0/0.02), img spatial sigmas (img_sx=1.5/img_sy=1.5), lr=2.3e-3, warm_start=True, pretrain_epochs=3, train_n=200, val_n=6, grad_clip=1.0. Wall: iter-6 ran ~828 s at n_iter=400; seed is a pure init/split change with ZERO added compute, so wall ~unchanged, comfortably under the 1800 s sbatch wall and the 1200 s outer_wall_s internal guard (well under the 15-min budget). This iter DOCUMENTS the ~hr 0.33 ceiling toward iter-20. PER-IMAGE bilateral N2I, AGENT4CT_DATASET=phantoms; do NOT revert to amortized.", "advice_for_others": "dual_domain_bilateral_n2i-claude-agentic: train_n=200, val_n=6, batch_size=1, grad_clip=1.0, seed=123, warm_start=True, pretrain_epochs=3, n_iter=400, outer_wall_s=1200, lr=0.0023, proj_n_bf=1, img_n_bf=7, proj_kernel=7, img_kernel=5, proj_sx=1.0, proj_sy=2.0, proj_sr=0.02, img_sx=1.5, img_sy=1.5, img_sr=0.02, rationale=iter-8: CEILING-CONFIRMATION (seed-invariance) probe. ONE knob changed vs the iter-6 hr-best base (seed 42->123); all 18 other fields held IDENTICAL to demo_dl_dual_domain_bilateral_n2i_iter_06.json (img_n_bf=7, img_sr=0.02 LOOSE demo-correct, n_iter=400). seed is the FIRST not-yet-tried axis -- it was pinned at 42 across iters 1-7, so this is a genuinely new probe (not a re-touch of an exhausted lever). Read iters 5-7 BY HEADROOM (the campaign primary, PSNR/noise-sensitive on demo): iter-5 img_sr->0.02 revert hr 0.3320; iter-6 img_n_bf=7 hr 0.3330 (depth DEAD FLAT vs iter-3 n_bf=5 0.3335); iter-7 n_iter 400->800 hr 0.3346 (per-scan Adam budget DEAD FLAT). BOTH capacity axes are now exhausted: image-domain DEPTH (img_n_bf, hr slope collapsed to ~0 by n_bf=5) AND per-scan OPTIMIZER budget (n_iter, flat at 800 -- and the 6-param bilateral physically CANNOT overfit one scan, so more steps cannot lift hr). img_sr is exhausted+substrate-confirmed wrong-direction (demo wants LOOSE 0.02; tightening to 0.0005 collapsed hr 0.3335->0.1998 at iter-4). proj_n_bf is in the symmetry trap (near-identity proj sigmas -> wasted params). FAILURE MODE being documented: the 6-param bilateral is at its ~hr 0.33 STRUCTURAL ceiling on demo phantoms -- it cannot extract more than the 64-view (half of 128) FBP noise floor allows on this synthetic substrate. The open question this probe closes: is hr~0.333 a STABLE structural bound or an artifact of the single seed=42 val split? Re-running the identical iter-6 config under a fresh seed (123 -> different 6-scene val draw AND different warm-start/per-scan init noise) tests invariance. HYPOTHESIS: hr lands ~0.333 again (within +/-0.01) -> CONFIRMS the ~hr 0.33 ceiling is seed-stable and structural, not a lucky split. If hr instead swings widely, the ceiling is split-sensitive and val_n should be raised next to tighten the estimate. Chose seed over (a) img_n_bf/n_iter (both DEAD FLAT, exhausted), (b) img_sr (exhausted, wrong-direction), (c) proj_n_bf (symmetry trap), (d) lr/grad_clip/warm_start (also untried, but seed-invariance is the canonical first ceiling-confirmation probe and was explicitly named as the next step in the iter-6/iter-7 rationales). Held fixed at iter-6 values: img_n_bf=7, img_sr=0.02 (LOOSE, demo-correct), n_iter=400, proj_n_bf=1, kernels (proj_k=7/img_k=5), proj sigmas (1.0/2.0/0.02), img spatial sigmas (img_sx=1.5/img_sy=1.5), lr=2.3e-3, warm_start=True, pretrain_epochs=3, train_n=200, val_n=6, grad_clip=1.0. Wall: iter-6 ran ~828 s at n_iter=400; seed is a pure init/split change with ZERO added compute, so wall ~unchanged, comfortably under the 1800 s sbatch wall and the 1200 s outer_wall_s internal guard (well under the 15-min budget). This iter DOCUMENTS the ~hr 0.33 ceiling toward iter-20. PER-IMAGE bilateral N2I, AGENT4CT_DATASET=phantoms; do NOT revert to amortized.", "comparison_image": "runs/demo-dl-claude-agentic-dual-domain-bilateral-n2i-search-20260618-01/iterations/iter-0008/comparison.png"}
{"ts": "2026-06-19T01:42:14Z", "run_id": "demo-dl-claude-agentic-dual-domain-n2i-search-20260618-01", "iter": 7, "agent": "dual_domain_n2i-claude-agentic-breast-ct", "model": "claude-opus-4.7-1m", "change_class": "architecture", "status": "keep", "kept": true, "val_score": 0.4203295409679413, "headroom": 0.005154204855172151, "params_M": 0.465762, "train_n": 400, "rationale": "dual_domain_n2i-claude-agentic: train_n=200, val_n=6, batch_size=1, grad_clip=1.0, seed=123, warm_start=True, pretrain_epochs=12, n_iter=600, outer_wall_s=1200, lr=0.0001, unet_c=16, rationale=iter-7: ONE knob -> seed 42 -> 123 (per-image N2I noise-floor read). CEILING-CONFIRMATION PROBE. KEEP lr=1e-4 (per-scan overfit anchor, iter-3 winner) and RESET pretrain_epochs 18 -> 12 (the PEAK, not ep18). DIAGNOSIS (numbers, not pixels): the init lever (warm-start pretrain_epochs) climbed then SATURATED AND TURNED OVER -- iter-3 ep3 0.4880; iter-4 ep6 0.4957 (+0.0077); iter-5 ep12 0.5081 (+0.0124, PSNR 16.376, the PEAK); iter-6 ep18 0.5016 (-0.0065, PSNR 16.29 -- DID NOT beat ep12). The iter-5/iter-6 falsifier FIRED: more init budget past ep12 no longer helps (over-converges the amortized warm-start pre-pass / the per-scan lr=1e-4 fit cannot exploit a noisier init), so the init axis is EXHAUSTED. n_iter is RULED OUT (iter-2 1200 steps REGRESSED 0.4785->0.4293, per-scan U-Net overfits one noisy scan) and unet_c is the explicitly-warned-against axis (solver design doc: capacity is NOT the lever for this loss; mayo n2i c16->c32 flat 0.9508). FAILURE MODE = per-image U-Net N2I has converged to its structural ceiling (~0.51 SSIM, hr~0) on this 128-view synthetic-phantom substrate; the 0.5081<->0.5016 swing between the two best inits is within noise, not a real lever. LEVER CHOICE (a NOT-yet-tried axis): of seed / grad_clip / unet_c-retest, pick SEED. seed=42 was FIXED across all 6 prior iters, so the per-image noise floor is unmeasured; flipping seed 42->123 at the PEAK config (ep12, lr1e-4, n_iter600) re-randomizes the warm-start init + the angular-subset split + Adam init, giving a clean read of how much of the 0.5081<->0.5016 swing is stochastic. grad_clip=1.0 is LOAD-BEARING (the 128-view FBP adjoint guard -- mandatory per campaign-state, do NOT touch) and unet_c is warned-against, so seed is the safest, most-informative ceiling-doc probe. HYPOTHESIS: at seed=123/ep12/lr1e-4 the SSIM lands within ~+/-0.01 of the 0.5081 ep12 peak (i.e. inside the 0.5016<->0.5081 band), confirming ~0.51 is the per-image U-Net N2I ceiling on demo and that the ep18 dip was noise, not a real init turn-over. hr stays 0 (structurally FBP-bounded on dense-view phantoms -- the U-Net overfits one scan where the bilateral twin's 6 params cannot, which is why the twin clears baseline at hr+0.33). FALSIFIER: if SSIM jumps >0.52 or drops <0.49 the per-image fit is seed-sensitive (large noise floor) and the ~0.51 ceiling claim needs a seed average before being called converged. Toward iter-20 this DOCUMENTS the ~0.51 per-image U-Net N2I ceiling on the synthetic 128-view substrate -- the structurally-hardest run (synthetic substrate, U-Net overfits, hr stays 0). WALL: warm 12x200=2400 + per-image 6x600=3600 = 6000 steps @ ~0.083 s/step ~= 500 s (iter-5 was 463 s at the same 6000-step budget), under the 15-min target, the outer_wall_s=1200 guard, and the 00:30:00 (1800 s) sbatch wall. All other knobs IDENTICAL to the iter-5 PEAK config (train_n=200, val_n=6, batch_size=1, grad_clip=1.0, warm_start=True, pretrain_epochs=12, n_iter=600, lr=1e-4, unet_c=16); ONLY seed 42->123 changed.", "advice_for_others": "dual_domain_n2i-claude-agentic: train_n=200, val_n=6, batch_size=1, grad_clip=1.0, seed=123, warm_start=True, pretrain_epochs=12, n_iter=600, outer_wall_s=1200, lr=0.0001, unet_c=16, rationale=iter-7: ONE knob -> seed 42 -> 123 (per-image N2I noise-floor read). CEILING-CONFIRMATION PROBE. KEEP lr=1e-4 (per-scan overfit anchor, iter-3 winner) and RESET pretrain_epochs 18 -> 12 (the PEAK, not ep18). DIAGNOSIS (numbers, not pixels): the init lever (warm-start pretrain_epochs) climbed then SATURATED AND TURNED OVER -- iter-3 ep3 0.4880; iter-4 ep6 0.4957 (+0.0077); iter-5 ep12 0.5081 (+0.0124, PSNR 16.376, the PEAK); iter-6 ep18 0.5016 (-0.0065, PSNR 16.29 -- DID NOT beat ep12). The iter-5/iter-6 falsifier FIRED: more init budget past ep12 no longer helps (over-converges the amortized warm-start pre-pass / the per-scan lr=1e-4 fit cannot exploit a noisier init), so the init axis is EXHAUSTED. n_iter is RULED OUT (iter-2 1200 steps REGRESSED 0.4785->0.4293, per-scan U-Net overfits one noisy scan) and unet_c is the explicitly-warned-against axis (solver design doc: capacity is NOT the lever for this loss; mayo n2i c16->c32 flat 0.9508). FAILURE MODE = per-image U-Net N2I has converged to its structural ceiling (~0.51 SSIM, hr~0) on this 128-view synthetic-phantom substrate; the 0.5081<->0.5016 swing between the two best inits is within noise, not a real lever. LEVER CHOICE (a NOT-yet-tried axis): of seed / grad_clip / unet_c-retest, pick SEED. seed=42 was FIXED across all 6 prior iters, so the per-image noise floor is unmeasured; flipping seed 42->123 at the PEAK config (ep12, lr1e-4, n_iter600) re-randomizes the warm-start init + the angular-subset split + Adam init, giving a clean read of how much of the 0.5081<->0.5016 swing is stochastic. grad_clip=1.0 is LOAD-BEARING (the 128-view FBP adjoint guard -- mandatory per campaign-state, do NOT touch) and unet_c is warned-against, so seed is the safest, most-informative ceiling-doc probe. HYPOTHESIS: at seed=123/ep12/lr1e-4 the SSIM lands within ~+/-0.01 of the 0.5081 ep12 peak (i.e. inside the 0.5016<->0.5081 band), confirming ~0.51 is the per-image U-Net N2I ceiling on demo and that the ep18 dip was noise, not a real init turn-over. hr stays 0 (structurally FBP-bounded on dense-view phantoms -- the U-Net overfits one scan where the bilateral twin's 6 params cannot, which is why the twin clears baseline at hr+0.33). FALSIFIER: if SSIM jumps >0.52 or drops <0.49 the per-image fit is seed-sensitive (large noise floor) and the ~0.51 ceiling claim needs a seed average before being called converged. Toward iter-20 this DOCUMENTS the ~0.51 per-image U-Net N2I ceiling on the synthetic 128-view substrate -- the structurally-hardest run (synthetic substrate, U-Net overfits, hr stays 0). WALL: warm 12x200=2400 + per-image 6x600=3600 = 6000 steps @ ~0.083 s/step ~= 500 s (iter-5 was 463 s at the same 6000-step budget), under the 15-min target, the outer_wall_s=1200 guard, and the 00:30:00 (1800 s) sbatch wall. All other knobs IDENTICAL to the iter-5 PEAK config (train_n=200, val_n=6, batch_size=1, grad_clip=1.0, warm_start=True, pretrain_epochs=12, n_iter=600, lr=1e-4, unet_c=16); ONLY seed 42->123 changed.", "comparison_image": "runs/demo-dl-claude-agentic-dual-domain-n2i-search-20260618-01/iterations/iter-0007/comparison.png"}
{"ts": "2026-06-19T01:21:16Z", "run_id": "demo-dl-claude-agentic-dual-domain-bilateral-n2i-search-20260618-01", "iter": 7, "agent": "dual_domain_bilateral_n2i-claude-agentic-breast-ct", "model": "claude-opus-4.7-1m", "change_class": "architecture", "status": "keep", "kept": true, "val_score": 0.7775341868400574, "headroom": 0.33464379729215277, "params_M": 2.4e-05, "train_n": 400, "rationale": "dual_domain_bilateral_n2i-claude-agentic: train_n=200, val_n=6, batch_size=1, grad_clip=1.0, seed=42, warm_start=True, pretrain_epochs=3, n_iter=800, outer_wall_s=1200, lr=0.0023, proj_n_bf=1, img_n_bf=7, proj_kernel=7, img_kernel=5, proj_sx=1.0, proj_sy=2.0, proj_sr=0.02, img_sx=1.5, img_sy=1.5, img_sr=0.02, rationale=iter-7: ONE knob changed vs iter-6 (n_iter 400->800, the per-scan Adam fit budget); all 18 other fields held IDENTICAL to demo_dl_dual_domain_bilateral_n2i_iter_06.json (img_n_bf=7, img_sr=0.02 LOOSE demo-correct). CEILING-DOC PROBE, not another smoothing knob. Trajectory by HEADROOM (the campaign primary metric, PSNR/noise-sensitive on demo): iter-1 img_n_bf=1 hr 0.2763 (PSNR 19.47); iter-2 n_bf=3 hr 0.3276 (+0.051); iter-3 n_bf=5 hr 0.3335 (+0.006, depth HR-BEST); iter-4 img_sr->0.0005 hr 0.1998 REGRESSED; iter-5 img_sr->0.02 revert hr 0.3320 recovered; iter-6 n_bf=7 hr 0.3330 (+0.000 vs n_bf=5, SSIM +0.009 0.7705->0.7796 but hr DEAD FLAT). FAILURE MODE: the image-domain DEPTH lever (img_n_bf) has hit its HEADROOM ceiling -- depth still lifts the SSIM structural term but its hr slope collapsed to zero by n_bf=5 (slope +0.051 -> +0.006 -> 0.000). img_sr is exhausted and substrate-confirmed wrong-direction (demo wants LOOSE 0.02; tightening collapses hr). proj_n_bf is in the symmetry trap (near-identity proj sigmas -> wasted params). So all the SMOOTHING/CAPACITY axes are exhausted on hr. The remaining open question for the ceiling claim is OPTIMIZATION budget: is hr ~0.333 the half-view FBP noise-floor bound (structural), or is the per-scan Adam fit simply stopping short at n_iter=400? Per the per-image N2I knob insights (mayo_campaign_state.md): U-Net N2I OVERFITS each scan as n_iter rises (no early-stop -> demo-n2i 0.4785->0.4293 @n_iter1200), but the 6-param BILATERAL physically CANNOT overfit one scan -- so doubling its per-scan budget is the clean diagnostic the U-Net could not give: more steps either (a) lift hr -> the plateau was under-optimization, the lever is n_iter (and lr), not depth; or (b) leave hr flat at ~0.333 -> CONFIRMS the structural half-view FBP ceiling, after which iter-8+ should stop tuning and document the ceiling with a seed/pretrain_epochs invariance probe toward iter-20. Chose n_iter over (a) img_n_bf 7->9 (depth lever's hr slope is already zero -- a 4th depth step re-confirms iter-6 with near-zero EV on hr), (b) lr (would confound the budget question -- vary n_iter first at the proven lr=2.3e-3, then lr if n_iter moves hr), (c) img_kernel/img_sx/img_sy (less-informed smoothing guesses, no hr evidence). Held fixed at iter-6 values: img_n_bf=7, img_sr=0.02, proj_n_bf=1, kernels (proj_k=7/img_k=5), proj sigmas (1.0/2.0/0.02), img spatial sigmas (img_sx=1.5/img_sy=1.5), lr=2.3e-3, warm_start=True, pretrain_epochs=3, train_n=200, val_n=6, grad_clip=1.0, seed=42 (-> identical val split, directly comparable to iter-1..6). Wall: iter-6 ran ~260 s; doubling the per-scan fit roughly doubles the per-image loop to ~450-520 s, still well under the 1800 s sbatch wall and the 1200 s outer_wall_s internal guard (under the 15-min budget). Hypothesis: hr stays ~0.333 even at n_iter=800 -- the 6-param bilateral cannot overfit and has already converged on the half-view FBP noise floor, so more fit budget yields no hr -> CONFIRMS demo bilateral N2I is at its structural ~hr 0.33 ceiling toward iter-20. If instead hr rises meaningfully (>+0.005), the plateau was optimizer-budget-limited and n_iter (then lr) becomes the live lever. PER-IMAGE bilateral N2I, AGENT4CT_DATASET=phantoms; do NOT revert to amortized.", "advice_for_others": "dual_domain_bilateral_n2i-claude-agentic: train_n=200, val_n=6, batch_size=1, grad_clip=1.0, seed=42, warm_start=True, pretrain_epochs=3, n_iter=800, outer_wall_s=1200, lr=0.0023, proj_n_bf=1, img_n_bf=7, proj_kernel=7, img_kernel=5, proj_sx=1.0, proj_sy=2.0, proj_sr=0.02, img_sx=1.5, img_sy=1.5, img_sr=0.02, rationale=iter-7: ONE knob changed vs iter-6 (n_iter 400->800, the per-scan Adam fit budget); all 18 other fields held IDENTICAL to demo_dl_dual_domain_bilateral_n2i_iter_06.json (img_n_bf=7, img_sr=0.02 LOOSE demo-correct). CEILING-DOC PROBE, not another smoothing knob. Trajectory by HEADROOM (the campaign primary metric, PSNR/noise-sensitive on demo): iter-1 img_n_bf=1 hr 0.2763 (PSNR 19.47); iter-2 n_bf=3 hr 0.3276 (+0.051); iter-3 n_bf=5 hr 0.3335 (+0.006, depth HR-BEST); iter-4 img_sr->0.0005 hr 0.1998 REGRESSED; iter-5 img_sr->0.02 revert hr 0.3320 recovered; iter-6 n_bf=7 hr 0.3330 (+0.000 vs n_bf=5, SSIM +0.009 0.7705->0.7796 but hr DEAD FLAT). FAILURE MODE: the image-domain DEPTH lever (img_n_bf) has hit its HEADROOM ceiling -- depth still lifts the SSIM structural term but its hr slope collapsed to zero by n_bf=5 (slope +0.051 -> +0.006 -> 0.000). img_sr is exhausted and substrate-confirmed wrong-direction (demo wants LOOSE 0.02; tightening collapses hr). proj_n_bf is in the symmetry trap (near-identity proj sigmas -> wasted params). So all the SMOOTHING/CAPACITY axes are exhausted on hr. The remaining open question for the ceiling claim is OPTIMIZATION budget: is hr ~0.333 the half-view FBP noise-floor bound (structural), or is the per-scan Adam fit simply stopping short at n_iter=400? Per the per-image N2I knob insights (mayo_campaign_state.md): U-Net N2I OVERFITS each scan as n_iter rises (no early-stop -> demo-n2i 0.4785->0.4293 @n_iter1200), but the 6-param BILATERAL physically CANNOT overfit one scan -- so doubling its per-scan budget is the clean diagnostic the U-Net could not give: more steps either (a) lift hr -> the plateau was under-optimization, the lever is n_iter (and lr), not depth; or (b) leave hr flat at ~0.333 -> CONFIRMS the structural half-view FBP ceiling, after which iter-8+ should stop tuning and document the ceiling with a seed/pretrain_epochs invariance probe toward iter-20. Chose n_iter over (a) img_n_bf 7->9 (depth lever's hr slope is already zero -- a 4th depth step re-confirms iter-6 with near-zero EV on hr), (b) lr (would confound the budget question -- vary n_iter first at the proven lr=2.3e-3, then lr if n_iter moves hr), (c) img_kernel/img_sx/img_sy (less-informed smoothing guesses, no hr evidence). Held fixed at iter-6 values: img_n_bf=7, img_sr=0.02, proj_n_bf=1, kernels (proj_k=7/img_k=5), proj sigmas (1.0/2.0/0.02), img spatial sigmas (img_sx=1.5/img_sy=1.5), lr=2.3e-3, warm_start=True, pretrain_epochs=3, train_n=200, val_n=6, grad_clip=1.0, seed=42 (-> identical val split, directly comparable to iter-1..6). Wall: iter-6 ran ~260 s; doubling the per-scan fit roughly doubles the per-image loop to ~450-520 s, still well under the 1800 s sbatch wall and the 1200 s outer_wall_s internal guard (under the 15-min budget). Hypothesis: hr stays ~0.333 even at n_iter=800 -- the 6-param bilateral cannot overfit and has already converged on the half-view FBP noise floor, so more fit budget yields no hr -> CONFIRMS demo bilateral N2I is at its structural ~hr 0.33 ceiling toward iter-20. If instead hr rises meaningfully (>+0.005), the plateau was optimizer-budget-limited and n_iter (then lr) becomes the live lever. PER-IMAGE bilateral N2I, AGENT4CT_DATASET=phantoms; do NOT revert to amortized.", "comparison_image": "runs/demo-dl-claude-agentic-dual-domain-bilateral-n2i-search-20260618-01/iterations/iter-0007/comparison.png"}
