{"ts": "2026-05-21T00:45:12Z", "run_id": "demo-intensity-calibrated-tpe-ram-zeroshot-search-20260521-01", "iter": 4, "agent": "ram-zeroshot-search-tpe-calibrated", "model": "random-search", "change_class": "architecture", "status": "keep", "kept": true, "val_score": null, "headroom": 0.460181191156094, "params_M": 35.618953, "train_n": 0, "rationale": "ram-zeroshot-search-tpe-calibrated: ram_ckpt_path=/cluster/maier/Agent4CT/checkpoints/ram.pth.tar, ram_input_norm=adjoint_max, ram_clamp_output=True, ram_finetune=False, ram_finetune_epochs=0, ram_finetune_lr=0.0001, ram_disable_multiscale=False, ram_disable_cudnn=False, ram_use_deepinv_tomo=False, ram_sigma=0.085366, ram_factor=0.4834, ram_post_fbp_blend=0.041834", "advice_for_others": "ram-zeroshot-search-tpe-calibrated: ram_ckpt_path=/cluster/maier/Agent4CT/checkpoints/ram.pth.tar, ram_input_norm=adjoint_max, ram_clamp_output=True, ram_finetune=False, ram_finetune_epochs=0, ram_finetune_lr=0.0001, ram_disable_multiscale=False, ram_disable_cudnn=False, ram_use_deepinv_tomo=False, ram_sigma=0.085366, ram_factor=0.4834, ram_post_fbp_blend=0.041834 -> hr=0.4602", "comparison_image": "runs/demo-intensity-calibrated-tpe-ram-zeroshot-search-20260521-01/iterations/iter-0004/comparison.png"}
{"ts": "2026-05-21T00:44:49Z", "run_id": "demo-intensity-calibrated-tpe-ram-zeroshot-search-20260521-01", "iter": 3, "agent": "ram-zeroshot-search-tpe-calibrated", "model": "random-search", "change_class": "architecture", "status": "keep", "kept": true, "val_score": null, "headroom": 0.4158297249593279, "params_M": 35.618953, "train_n": 0, "rationale": "ram-zeroshot-search-tpe-calibrated: ram_ckpt_path=/cluster/maier/Agent4CT/checkpoints/ram.pth.tar, ram_input_norm=adjoint_max, ram_clamp_output=True, ram_finetune=False, ram_finetune_epochs=0, ram_finetune_lr=0.0001, ram_disable_multiscale=False, ram_disable_cudnn=False, ram_use_deepinv_tomo=False, ram_sigma=0.22102, ram_factor=0.73269, ram_post_fbp_blend=0.0057979", "advice_for_others": "ram-zeroshot-search-tpe-calibrated: ram_ckpt_path=/cluster/maier/Agent4CT/checkpoints/ram.pth.tar, ram_input_norm=adjoint_max, ram_clamp_output=True, ram_finetune=False, ram_finetune_epochs=0, ram_finetune_lr=0.0001, ram_disable_multiscale=False, ram_disable_cudnn=False, ram_use_deepinv_tomo=False, ram_sigma=0.22102, ram_factor=0.73269, ram_post_fbp_blend=0.0057979 -> hr=0.4158", "comparison_image": "runs/demo-intensity-calibrated-tpe-ram-zeroshot-search-20260521-01/iterations/iter-0003/comparison.png"}
{"ts": "2026-05-21T00:44:29Z", "run_id": "demo-intensity-calibrated-tpe-diff-recon-dcstep-unconstrained-search-20260521-01", "iter": 1, "agent": "diff-recon-dcstep-unconstrained-search-tpe-calibrated", "model": "random-search", "change_class": "architecture", "status": "keep", "kept": true, "val_score": null, "headroom": 0.4329614126289004, "params_M": 0.958051, "train_n": 2000, "rationale": "diff-recon-dcstep-unconstrained-search-tpe-calibrated: recon_ckpt=/cluster/maier/Agent4CT/checkpoints/ddpm_unconstrained_final.pt, recon_mode=dps, recon_sample_steps=500, recon_eta=30, recon_init=fbp, recon_eta_clamp=False, recon_dcstep_every=3, recon_dcstep_n_cg=20, recon_dcstep_warmup=25, recon_dcstep_relax=1", "advice_for_others": "diff-recon-dcstep-unconstrained-search-tpe-calibrated: recon_ckpt=/cluster/maier/Agent4CT/checkpoints/ddpm_unconstrained_final.pt, recon_mode=dps, recon_sample_steps=500, recon_eta=30, recon_init=fbp, recon_eta_clamp=False, recon_dcstep_every=3, recon_dcstep_n_cg=20, recon_dcstep_warmup=25, recon_dcstep_relax=1 -> hr=0.4330", "comparison_image": "runs/demo-intensity-calibrated-tpe-diff-recon-dcstep-unconstrained-search-20260521-01/iterations/iter-0001/comparison.png"}
{"ts": "2026-05-21T00:44:26Z", "run_id": "demo-intensity-calibrated-tpe-ram-zeroshot-search-20260521-01", "iter": 2, "agent": "ram-zeroshot-search-tpe-calibrated", "model": "random-search", "change_class": "architecture", "status": "keep", "kept": true, "val_score": null, "headroom": 0.42538884429438695, "params_M": 35.618953, "train_n": 0, "rationale": "ram-zeroshot-search-tpe-calibrated: ram_ckpt_path=/cluster/maier/Agent4CT/checkpoints/ram.pth.tar, ram_input_norm=adjoint_max, ram_clamp_output=True, ram_finetune=False, ram_finetune_epochs=0, ram_finetune_lr=0.0001, ram_disable_multiscale=False, ram_disable_cudnn=False, ram_use_deepinv_tomo=False, ram_sigma=0.21102, ram_factor=0.35913, ram_post_fbp_blend=0.078208", "advice_for_others": "ram-zeroshot-search-tpe-calibrated: ram_ckpt_path=/cluster/maier/Agent4CT/checkpoints/ram.pth.tar, ram_input_norm=adjoint_max, ram_clamp_output=True, ram_finetune=False, ram_finetune_epochs=0, ram_finetune_lr=0.0001, ram_disable_multiscale=False, ram_disable_cudnn=False, ram_use_deepinv_tomo=False, ram_sigma=0.21102, ram_factor=0.35913, ram_post_fbp_blend=0.078208 -> hr=0.4254", "comparison_image": "runs/demo-intensity-calibrated-tpe-ram-zeroshot-search-20260521-01/iterations/iter-0002/comparison.png"}
{"ts": "2026-05-21T00:44:04Z", "run_id": "demo-intensity-calibrated-tpe-ram-zeroshot-search-20260521-01", "iter": 1, "agent": "ram-zeroshot-search-tpe-calibrated", "model": "random-search", "change_class": "architecture", "status": "keep", "kept": true, "val_score": null, "headroom": 0.4570421764316597, "params_M": 35.618953, "train_n": 0, "rationale": "ram-zeroshot-search-tpe-calibrated: ram_ckpt_path=/cluster/maier/Agent4CT/checkpoints/ram.pth.tar, ram_input_norm=adjoint_max, ram_clamp_output=True, ram_finetune=False, ram_finetune_epochs=0, ram_finetune_lr=0.0001, ram_disable_multiscale=False, ram_disable_cudnn=False, ram_use_deepinv_tomo=False, ram_sigma=0.1, ram_factor=0.5, ram_post_fbp_blend=0", "advice_for_others": "ram-zeroshot-search-tpe-calibrated: ram_ckpt_path=/cluster/maier/Agent4CT/checkpoints/ram.pth.tar, ram_input_norm=adjoint_max, ram_clamp_output=True, ram_finetune=False, ram_finetune_epochs=0, ram_finetune_lr=0.0001, ram_disable_multiscale=False, ram_disable_cudnn=False, ram_use_deepinv_tomo=False, ram_sigma=0.1, ram_factor=0.5, ram_post_fbp_blend=0 -> hr=0.4570", "comparison_image": "runs/demo-intensity-calibrated-tpe-ram-zeroshot-search-20260521-01/iterations/iter-0001/comparison.png"}
{"ts": "2026-05-21T00:43:36Z", "run_id": "demo-intensity-calibrated-tpe-tv-search-20260520-01", "iter": 20, "agent": "tv-search-tpe-calibrated", "model": "random-search", "change_class": "architecture", "status": "keep", "kept": true, "val_score": null, "headroom": 0.25117973202789445, "params_M": 0.0, "train_n": 0, "rationale": "tv-search-tpe-calibrated: tv_lambda=0.0011535, tv_iterations=236, tv_lr=0.098767, tv_clip_max=0.042819, tv_decay=0.038225", "advice_for_others": "tv-search-tpe-calibrated: tv_lambda=0.0011535, tv_iterations=236, tv_lr=0.098767, tv_clip_max=0.042819, tv_decay=0.038225 -> hr=0.2512", "comparison_image": "runs/demo-intensity-calibrated-tpe-tv-search-20260520-01/iterations/iter-0020/comparison.png"}
{"ts": "2026-05-21T00:41:28Z", "run_id": "demo-intensity-calibrated-tpe-tv-search-20260520-01", "iter": 19, "agent": "tv-search-tpe-calibrated", "model": "random-search", "change_class": "architecture", "status": "keep", "kept": true, "val_score": null, "headroom": 0.13938098878534322, "params_M": 0.0, "train_n": 0, "rationale": "tv-search-tpe-calibrated: tv_lambda=0.0053521, tv_iterations=374, tv_lr=0.0051535, tv_clip_max=0.052224, tv_decay=0.014318", "advice_for_others": "tv-search-tpe-calibrated: tv_lambda=0.0053521, tv_iterations=374, tv_lr=0.0051535, tv_clip_max=0.052224, tv_decay=0.014318 -> hr=0.1394", "comparison_image": "runs/demo-intensity-calibrated-tpe-tv-search-20260520-01/iterations/iter-0019/comparison.png"}
{"ts": "2026-05-21T00:39:06Z", "run_id": "demo-intensity-calibrated-tpe-hammernik-vn-search-20260520-01", "iter": 16, "agent": "hammernik-vn-search-tpe-calibrated", "model": "random-search", "change_class": "architecture", "status": "keep", "kept": true, "val_score": null, "headroom": 0.3553612608980724, "params_M": 0.003843, "train_n": 200, "rationale": "hammernik-vn-search-tpe-calibrated: epochs=14, lr=0.00023296, batch_size=2, vn_T=3, vn_n_filters=16, vn_kernel=7, vn_lambda_init=0.00057933, vn_init=fbp", "advice_for_others": "hammernik-vn-search-tpe-calibrated: epochs=14, lr=0.00023296, batch_size=2, vn_T=3, vn_n_filters=16, vn_kernel=7, vn_lambda_init=0.00057933, vn_init=fbp -> hr=0.3554", "comparison_image": "runs/demo-intensity-calibrated-tpe-hammernik-vn-search-20260520-01/iterations/iter-0016/comparison.png"}
{"ts": "2026-05-21T00:38:27Z", "run_id": "demo-intensity-calibrated-tpe-tv-search-20260520-01", "iter": 18, "agent": "tv-search-tpe-calibrated", "model": "random-search", "change_class": "architecture", "status": "keep", "kept": true, "val_score": null, "headroom": 0.0528003673250278, "params_M": 0.0, "train_n": 0, "rationale": "tv-search-tpe-calibrated: tv_lambda=0.00049702, tv_iterations=284, tv_lr=0.027393, tv_clip_max=0.073504, tv_decay=0.022217", "advice_for_others": "tv-search-tpe-calibrated: tv_lambda=0.00049702, tv_iterations=284, tv_lr=0.027393, tv_clip_max=0.073504, tv_decay=0.022217 -> hr=0.0528", "comparison_image": "runs/demo-intensity-calibrated-tpe-tv-search-20260520-01/iterations/iter-0018/comparison.png"}
{"ts": "2026-05-21T00:35:57Z", "run_id": "demo-intensity-calibrated-tpe-tv-search-20260520-01", "iter": 17, "agent": "tv-search-tpe-calibrated", "model": "random-search", "change_class": "architecture", "status": "keep", "kept": true, "val_score": null, "headroom": 0.3280609525458673, "params_M": 0.0, "train_n": 0, "rationale": "tv-search-tpe-calibrated: tv_lambda=0.0022993, tv_iterations=426, tv_lr=0.057085, tv_clip_max=0.065446, tv_decay=0.030962", "advice_for_others": "tv-search-tpe-calibrated: tv_lambda=0.0022993, tv_iterations=426, tv_lr=0.057085, tv_clip_max=0.065446, tv_decay=0.030962 -> hr=0.3281", "comparison_image": "runs/demo-intensity-calibrated-tpe-tv-search-20260520-01/iterations/iter-0017/comparison.png"}
{"ts": "2026-05-21T00:32:24Z", "run_id": "demo-intensity-calibrated-tpe-tv-search-20260520-01", "iter": 16, "agent": "tv-search-tpe-calibrated", "model": "random-search", "change_class": "architecture", "status": "keep", "kept": true, "val_score": null, "headroom": 0.08821873315554307, "params_M": 0.0, "train_n": 0, "rationale": "tv-search-tpe-calibrated: tv_lambda=0.0035838, tv_iterations=349, tv_lr=0.0094037, tv_clip_max=0.058147, tv_decay=0.041016", "advice_for_others": "tv-search-tpe-calibrated: tv_lambda=0.0035838, tv_iterations=349, tv_lr=0.0094037, tv_clip_max=0.058147, tv_decay=0.041016 -> hr=0.0882", "comparison_image": "runs/demo-intensity-calibrated-tpe-tv-search-20260520-01/iterations/iter-0016/comparison.png"}
{"ts": "2026-05-21T00:30:20Z", "run_id": "demo-intensity-calibrated-tpe-hammernik-vn-search-20260520-01", "iter": 15, "agent": "hammernik-vn-search-tpe-calibrated", "model": "random-search", "change_class": "architecture", "status": "keep", "kept": true, "val_score": null, "headroom": 0.3611509691233933, "params_M": 0.005379, "train_n": 200, "rationale": "hammernik-vn-search-tpe-calibrated: epochs=14, lr=0.0002188, batch_size=2, vn_T=3, vn_n_filters=16, vn_kernel=9, vn_lambda_init=0.00071951, vn_init=fbp", "advice_for_others": "hammernik-vn-search-tpe-calibrated: epochs=14, lr=0.0002188, batch_size=2, vn_T=3, vn_n_filters=16, vn_kernel=9, vn_lambda_init=0.00071951, vn_init=fbp -> hr=0.3612", "comparison_image": "runs/demo-intensity-calibrated-tpe-hammernik-vn-search-20260520-01/iterations/iter-0015/comparison.png"}
{"ts": "2026-05-21T00:29:24Z", "run_id": "demo-intensity-calibrated-tpe-tv-search-20260520-01", "iter": 15, "agent": "tv-search-tpe-calibrated", "model": "random-search", "change_class": "architecture", "status": "keep", "kept": true, "val_score": null, "headroom": 0.061608211421928405, "params_M": 0.0, "train_n": 0, "rationale": "tv-search-tpe-calibrated: tv_lambda=0.00086869, tv_iterations=261, tv_lr=0.021931, tv_clip_max=0.070437, tv_decay=0.027973", "advice_for_others": "tv-search-tpe-calibrated: tv_lambda=0.00086869, tv_iterations=261, tv_lr=0.021931, tv_clip_max=0.070437, tv_decay=0.027973 -> hr=0.0616", "comparison_image": "runs/demo-intensity-calibrated-tpe-tv-search-20260520-01/iterations/iter-0015/comparison.png"}
{"ts": "2026-05-21T00:27:05Z", "run_id": "demo-intensity-calibrated-tpe-tv-search-20260520-01", "iter": 14, "agent": "tv-search-tpe-calibrated", "model": "random-search", "change_class": "architecture", "status": "keep", "kept": true, "val_score": null, "headroom": 0.3102864335551654, "params_M": 0.0, "train_n": 0, "rationale": "tv-search-tpe-calibrated: tv_lambda=0.0032409, tv_iterations=322, tv_lr=0.038424, tv_clip_max=0.067499, tv_decay=0.027821", "advice_for_others": "tv-search-tpe-calibrated: tv_lambda=0.0032409, tv_iterations=322, tv_lr=0.038424, tv_clip_max=0.067499, tv_decay=0.027821 -> hr=0.3103", "comparison_image": "runs/demo-intensity-calibrated-tpe-tv-search-20260520-01/iterations/iter-0014/comparison.png"}
{"ts": "2026-05-21T00:24:20Z", "run_id": "demo-intensity-calibrated-tpe-tv-search-20260520-01", "iter": 13, "agent": "tv-search-tpe-calibrated", "model": "random-search", "change_class": "architecture", "status": "keep", "kept": true, "val_score": null, "headroom": 0.4055776465644999, "params_M": 0.0, "train_n": 0, "rationale": "tv-search-tpe-calibrated: tv_lambda=0.0035562, tv_iterations=382, tv_lr=0.099389, tv_clip_max=0.068964, tv_decay=0.0306", "advice_for_others": "tv-search-tpe-calibrated: tv_lambda=0.0035562, tv_iterations=382, tv_lr=0.099389, tv_clip_max=0.068964, tv_decay=0.0306 -> hr=0.4056", "comparison_image": "runs/demo-intensity-calibrated-tpe-tv-search-20260520-01/iterations/iter-0013/comparison.png"}
{"ts": "2026-05-21T00:20:15Z", "run_id": "demo-intensity-calibrated-tpe-tv-search-20260520-01", "iter": 12, "agent": "tv-search-tpe-calibrated", "model": "random-search", "change_class": "architecture", "status": "keep", "kept": true, "val_score": null, "headroom": 0.40448762637946045, "params_M": 0.0, "train_n": 0, "rationale": "tv-search-tpe-calibrated: tv_lambda=0.0048005, tv_iterations=405, tv_lr=0.07745, tv_clip_max=0.079842, tv_decay=0.034544", "advice_for_others": "tv-search-tpe-calibrated: tv_lambda=0.0048005, tv_iterations=405, tv_lr=0.07745, tv_clip_max=0.079842, tv_decay=0.034544 -> hr=0.4045", "comparison_image": "runs/demo-intensity-calibrated-tpe-tv-search-20260520-01/iterations/iter-0012/comparison.png"}
{"ts": "2026-05-21T00:20:01Z", "run_id": "demo-intensity-calibrated-tpe-hammernik-vn-search-20260520-01", "iter": 14, "agent": "hammernik-vn-search-tpe-calibrated", "model": "random-search", "change_class": "architecture", "status": "keep", "kept": true, "val_score": null, "headroom": 0.3586374341841754, "params_M": 0.005379, "train_n": 200, "rationale": "hammernik-vn-search-tpe-calibrated: epochs=17, lr=0.00014637, batch_size=2, vn_T=3, vn_n_filters=16, vn_kernel=9, vn_lambda_init=0.00088103, vn_init=fbp", "advice_for_others": "hammernik-vn-search-tpe-calibrated: epochs=17, lr=0.00014637, batch_size=2, vn_T=3, vn_n_filters=16, vn_kernel=9, vn_lambda_init=0.00088103, vn_init=fbp -> hr=0.3586", "comparison_image": "runs/demo-intensity-calibrated-tpe-hammernik-vn-search-20260520-01/iterations/iter-0014/comparison.png"}
{"ts": "2026-05-21T00:17:28Z", "run_id": "demo-intensity-calibrated-tpe-wu-search-20260521-01", "iter": 20, "agent": "wu-search-tpe-calibrated", "model": "random-search", "change_class": "architecture", "status": "keep", "kept": true, "val_score": null, "headroom": 0.17884778628449471, "params_M": 0.0, "train_n": 0, "rationale": "wu-search-tpe-calibrated: wu_n_bands=12, wu_n_outer=3, wu_motion_range=3, wu_motion_window=1, wu_soft_thresh=0.0012192", "advice_for_others": "wu-search-tpe-calibrated: wu_n_bands=12, wu_n_outer=3, wu_motion_range=3, wu_motion_window=1, wu_soft_thresh=0.0012192 -> hr=0.1788", "comparison_image": "runs/demo-intensity-calibrated-tpe-wu-search-20260521-01/iterations/iter-0020/comparison.png"}
{"ts": "2026-05-21T00:17:12Z", "run_id": "demo-intensity-calibrated-tpe-wu-search-20260521-01", "iter": 19, "agent": "wu-search-tpe-calibrated", "model": "random-search", "change_class": "architecture", "status": "keep", "kept": true, "val_score": null, "headroom": 0.22686599380529826, "params_M": 0.0, "train_n": 0, "rationale": "wu-search-tpe-calibrated: wu_n_bands=12, wu_n_outer=1, wu_motion_range=3, wu_motion_window=1, wu_soft_thresh=0.0011892", "advice_for_others": "wu-search-tpe-calibrated: wu_n_bands=12, wu_n_outer=1, wu_motion_range=3, wu_motion_window=1, wu_soft_thresh=0.0011892 -> hr=0.2269", "comparison_image": "runs/demo-intensity-calibrated-tpe-wu-search-20260521-01/iterations/iter-0019/comparison.png"}
{"ts": "2026-05-21T00:17:08Z", "run_id": "demo-intensity-calibrated-tpe-tv-search-20260520-01", "iter": 11, "agent": "tv-search-tpe-calibrated", "model": "random-search", "change_class": "architecture", "status": "keep", "kept": true, "val_score": null, "headroom": 0.40250424559229503, "params_M": 0.0, "train_n": 0, "rationale": "tv-search-tpe-calibrated: tv_lambda=0.0048465, tv_iterations=418, tv_lr=0.092505, tv_clip_max=0.079239, tv_decay=0.03401", "advice_for_others": "tv-search-tpe-calibrated: tv_lambda=0.0048465, tv_iterations=418, tv_lr=0.092505, tv_clip_max=0.079239, tv_decay=0.03401 -> hr=0.4025", "comparison_image": "runs/demo-intensity-calibrated-tpe-tv-search-20260520-01/iterations/iter-0011/comparison.png"}
{"ts": "2026-05-21T00:16:59Z", "run_id": "demo-intensity-calibrated-tpe-wu-search-20260521-01", "iter": 18, "agent": "wu-search-tpe-calibrated", "model": "random-search", "change_class": "architecture", "status": "keep", "kept": true, "val_score": null, "headroom": 0.22950579171239938, "params_M": 0.0, "train_n": 0, "rationale": "wu-search-tpe-calibrated: wu_n_bands=8, wu_n_outer=1, wu_motion_range=3, wu_motion_window=1, wu_soft_thresh=0.0011716", "advice_for_others": "wu-search-tpe-calibrated: wu_n_bands=8, wu_n_outer=1, wu_motion_range=3, wu_motion_window=1, wu_soft_thresh=0.0011716 -> hr=0.2295", "comparison_image": "runs/demo-intensity-calibrated-tpe-wu-search-20260521-01/iterations/iter-0018/comparison.png"}
{"ts": "2026-05-21T00:16:45Z", "run_id": "demo-intensity-calibrated-tpe-wu-search-20260521-01", "iter": 17, "agent": "wu-search-tpe-calibrated", "model": "random-search", "change_class": "architecture", "status": "keep", "kept": true, "val_score": null, "headroom": 0.18775258230316283, "params_M": 0.0, "train_n": 0, "rationale": "wu-search-tpe-calibrated: wu_n_bands=8, wu_n_outer=3, wu_motion_range=3, wu_motion_window=1, wu_soft_thresh=0.0018512", "advice_for_others": "wu-search-tpe-calibrated: wu_n_bands=8, wu_n_outer=3, wu_motion_range=3, wu_motion_window=1, wu_soft_thresh=0.0018512 -> hr=0.1878", "comparison_image": "runs/demo-intensity-calibrated-tpe-wu-search-20260521-01/iterations/iter-0017/comparison.png"}
{"ts": "2026-05-21T00:16:30Z", "run_id": "demo-intensity-calibrated-tpe-wu-search-20260521-01", "iter": 16, "agent": "wu-search-tpe-calibrated", "model": "random-search", "change_class": "architecture", "status": "keep", "kept": true, "val_score": null, "headroom": 0.22157737920767584, "params_M": 0.0, "train_n": 0, "rationale": "wu-search-tpe-calibrated: wu_n_bands=8, wu_n_outer=1, wu_motion_range=3, wu_motion_window=2, wu_soft_thresh=0.0019782", "advice_for_others": "wu-search-tpe-calibrated: wu_n_bands=8, wu_n_outer=1, wu_motion_range=3, wu_motion_window=2, wu_soft_thresh=0.0019782 -> hr=0.2216", "comparison_image": "runs/demo-intensity-calibrated-tpe-wu-search-20260521-01/iterations/iter-0016/comparison.png"}
{"ts": "2026-05-21T00:16:16Z", "run_id": "demo-intensity-calibrated-tpe-wu-search-20260521-01", "iter": 15, "agent": "wu-search-tpe-calibrated", "model": "random-search", "change_class": "architecture", "status": "keep", "kept": true, "val_score": null, "headroom": 0.22013327156468776, "params_M": 0.0, "train_n": 0, "rationale": "wu-search-tpe-calibrated: wu_n_bands=6, wu_n_outer=1, wu_motion_range=3, wu_motion_window=1, wu_soft_thresh=0.0032546", "advice_for_others": "wu-search-tpe-calibrated: wu_n_bands=6, wu_n_outer=1, wu_motion_range=3, wu_motion_window=1, wu_soft_thresh=0.0032546 -> hr=0.2201", "comparison_image": "runs/demo-intensity-calibrated-tpe-wu-search-20260521-01/iterations/iter-0015/comparison.png"}
{"ts": "2026-05-21T00:16:02Z", "run_id": "demo-intensity-calibrated-tpe-wu-search-20260521-01", "iter": 14, "agent": "wu-search-tpe-calibrated", "model": "random-search", "change_class": "architecture", "status": "keep", "kept": true, "val_score": null, "headroom": 0.20666958073579844, "params_M": 0.0, "train_n": 0, "rationale": "wu-search-tpe-calibrated: wu_n_bands=8, wu_n_outer=1, wu_motion_range=3, wu_motion_window=2, wu_soft_thresh=0.0045375", "advice_for_others": "wu-search-tpe-calibrated: wu_n_bands=8, wu_n_outer=1, wu_motion_range=3, wu_motion_window=2, wu_soft_thresh=0.0045375 -> hr=0.2067", "comparison_image": "runs/demo-intensity-calibrated-tpe-wu-search-20260521-01/iterations/iter-0014/comparison.png"}
{"ts": "2026-05-21T00:15:49Z", "run_id": "demo-intensity-calibrated-tpe-wu-search-20260521-01", "iter": 13, "agent": "wu-search-tpe-calibrated", "model": "random-search", "change_class": "architecture", "status": "keep", "kept": true, "val_score": null, "headroom": 0.22517046252229522, "params_M": 0.0, "train_n": 0, "rationale": "wu-search-tpe-calibrated: wu_n_bands=8, wu_n_outer=1, wu_motion_range=3, wu_motion_window=1, wu_soft_thresh=0.0023948", "advice_for_others": "wu-search-tpe-calibrated: wu_n_bands=8, wu_n_outer=1, wu_motion_range=3, wu_motion_window=1, wu_soft_thresh=0.0023948 -> hr=0.2252", "comparison_image": "runs/demo-intensity-calibrated-tpe-wu-search-20260521-01/iterations/iter-0013/comparison.png"}
