{"ts": "2026-05-27T06:46:59Z", "run_id": "demo-intensity-calibrated-tpe-lpd-search-20260527-01", "iter": 6, "agent": "lpd-search-tpe-calibrated", "model": "random-search", "change_class": "architecture", "status": "discard", "kept": false, "val_score": null, "headroom": 0.0, "params_M": 0.414416, "train_n": 400, "rationale": "lpd-search-tpe-calibrated: lpd_iters=8, lpd_hidden=48, lpd_n_primal=5, lpd_n_dual=5, lpd_share_weights=False, epochs=19, lr=0.00097048, lr_schedule=cosine, batch_size=1, grad_clip=0.5, lambda_neg=1, loss_base=mse, val_n=20, val_chunk=4", "advice_for_others": "lpd-search-tpe-calibrated: lpd_iters=8, lpd_hidden=48, lpd_n_primal=5, lpd_n_dual=5, lpd_share_weights=False, epochs=19, lr=0.00097048, lr_schedule=cosine, batch_size=1, grad_clip=0.5, lambda_neg=1, loss_base=mse, val_n=20, val_chunk=4 -> hr=0.0000", "comparison_image": "runs/demo-intensity-calibrated-tpe-lpd-search-20260527-01/iterations/iter-0006/comparison.png"}
{"ts": "2026-05-27T06:24:51Z", "run_id": "demo-intensity-calibrated-tpe-lpd-search-20260527-01", "iter": 5, "agent": "lpd-search-tpe-calibrated", "model": "random-search", "change_class": "architecture", "status": "keep", "kept": true, "val_score": null, "headroom": 0.4936587100209665, "params_M": 0.202576, "train_n": 400, "rationale": "lpd-search-tpe-calibrated: lpd_iters=8, lpd_hidden=32, lpd_n_primal=5, lpd_n_dual=5, lpd_share_weights=False, epochs=17, lr=0.00063086, lr_schedule=cosine, batch_size=1, grad_clip=0.5, lambda_neg=1, loss_base=mse, val_n=20, val_chunk=4", "advice_for_others": "lpd-search-tpe-calibrated: lpd_iters=8, lpd_hidden=32, lpd_n_primal=5, lpd_n_dual=5, lpd_share_weights=False, epochs=17, lr=0.00063086, lr_schedule=cosine, batch_size=1, grad_clip=0.5, lambda_neg=1, loss_base=mse, val_n=20, val_chunk=4 -> hr=0.4937", "comparison_image": "runs/demo-intensity-calibrated-tpe-lpd-search-20260527-01/iterations/iter-0005/comparison.png"}
{"ts": "2026-05-27T06:08:03Z", "run_id": "demo-intensity-calibrated-tpe-lpd-search-20260527-01", "iter": 4, "agent": "lpd-search-tpe-calibrated", "model": "random-search", "change_class": "architecture", "status": "discard", "kept": false, "val_score": null, "headroom": 0.0, "params_M": 1.492304, "train_n": 400, "rationale": "lpd-search-tpe-calibrated: lpd_iters=8, lpd_hidden=96, lpd_n_primal=5, lpd_n_dual=5, lpd_share_weights=False, epochs=24, lr=0.00038198, lr_schedule=cosine, batch_size=1, grad_clip=1, lambda_neg=1, loss_base=mse, val_n=20, val_chunk=4", "advice_for_others": "lpd-search-tpe-calibrated: lpd_iters=8, lpd_hidden=96, lpd_n_primal=5, lpd_n_dual=5, lpd_share_weights=False, epochs=24, lr=0.00038198, lr_schedule=cosine, batch_size=1, grad_clip=1, lambda_neg=1, loss_base=mse, val_n=20, val_chunk=4 -> hr=0.0000", "comparison_image": "runs/demo-intensity-calibrated-tpe-lpd-search-20260527-01/iterations/iter-0004/comparison.png"}
{"ts": "2026-05-27T05:21:25Z", "run_id": "demo-intensity-calibrated-tpe-lpd-search-20260527-01", "iter": 3, "agent": "lpd-search-tpe-calibrated", "model": "random-search", "change_class": "architecture", "status": "discard", "kept": false, "val_score": null, "headroom": 0.0, "params_M": 0.87498, "train_n": 400, "rationale": "lpd-search-tpe-calibrated: lpd_iters=10, lpd_hidden=64, lpd_n_primal=5, lpd_n_dual=5, lpd_share_weights=False, epochs=17, lr=0.00022821, lr_schedule=cosine, batch_size=1, grad_clip=0.3, lambda_neg=1, loss_base=mse, val_n=20, val_chunk=4", "advice_for_others": "lpd-search-tpe-calibrated: lpd_iters=10, lpd_hidden=64, lpd_n_primal=5, lpd_n_dual=5, lpd_share_weights=False, epochs=17, lr=0.00022821, lr_schedule=cosine, batch_size=1, grad_clip=0.3, lambda_neg=1, loss_base=mse, val_n=20, val_chunk=4 -> hr=0.0000", "comparison_image": "runs/demo-intensity-calibrated-tpe-lpd-search-20260527-01/iterations/iter-0003/comparison.png"}
{"ts": "2026-05-27T04:54:05Z", "run_id": "demo-intensity-calibrated-tpe-lpd-search-20260527-01", "iter": 2, "agent": "lpd-search-tpe-calibrated", "model": "random-search", "change_class": "architecture", "status": "discard", "kept": false, "val_score": null, "headroom": 0.0, "params_M": 0.202576, "train_n": 400, "rationale": "lpd-search-tpe-calibrated: lpd_iters=8, lpd_hidden=32, lpd_n_primal=5, lpd_n_dual=5, lpd_share_weights=False, epochs=15, lr=0.00076, lr_schedule=cosine, batch_size=1, grad_clip=0.3, lambda_neg=1, loss_base=mse, val_n=20, val_chunk=4", "advice_for_others": "lpd-search-tpe-calibrated: lpd_iters=8, lpd_hidden=32, lpd_n_primal=5, lpd_n_dual=5, lpd_share_weights=False, epochs=15, lr=0.00076, lr_schedule=cosine, batch_size=1, grad_clip=0.3, lambda_neg=1, loss_base=mse, val_n=20, val_chunk=4 -> hr=0.0000", "comparison_image": "runs/demo-intensity-calibrated-tpe-lpd-search-20260527-01/iterations/iter-0002/comparison.png"}
{"ts": "2026-05-27T04:39:17Z", "run_id": "demo-intensity-calibrated-tpe-lpd-search-20260527-01", "iter": 1, "agent": "lpd-search-tpe-calibrated", "model": "random-search", "change_class": "architecture", "status": "discard", "kept": false, "val_score": null, "headroom": 0.0, "params_M": 0.87498, "train_n": 400, "rationale": "lpd-search-tpe-calibrated: lpd_iters=10, lpd_hidden=64, lpd_n_primal=5, lpd_n_dual=5, lpd_share_weights=False, epochs=20, lr=0.0005, lr_schedule=cosine, batch_size=1, grad_clip=1, lambda_neg=1, loss_base=mse, val_n=20, val_chunk=4", "advice_for_others": "lpd-search-tpe-calibrated: lpd_iters=10, lpd_hidden=64, lpd_n_primal=5, lpd_n_dual=5, lpd_share_weights=False, epochs=20, lr=0.0005, lr_schedule=cosine, batch_size=1, grad_clip=1, lambda_neg=1, loss_base=mse, val_n=20, val_chunk=4 -> hr=0.0000", "comparison_image": "runs/demo-intensity-calibrated-tpe-lpd-search-20260527-01/iterations/iter-0001/comparison.png"}
{"ts": "2026-05-21T18:21:59Z", "run_id": "demo-intensity-calibrated-tpe-r2gaussian-search-20260521-01", "iter": 18, "agent": "r2gaussian-search-tpe-calibrated", "model": "random-search", "change_class": "architecture", "status": "discard", "kept": false, "val_score": null, "headroom": 0.0, "params_M": 0.003072, "train_n": 0, "rationale": "r2gaussian-search-tpe-calibrated: gs_n_gaussians=512, gs_n_iter=580, gs_lr_pos=0.0081003, gs_lr_scale=0.044808, gs_lr_amp=0.033053, gs_amp_init=0.0062901, gs_scale_init=0.078733, gs_tv_weight=4.866e-05", "advice_for_others": "r2gaussian-search-tpe-calibrated: gs_n_gaussians=512, gs_n_iter=580, gs_lr_pos=0.0081003, gs_lr_scale=0.044808, gs_lr_amp=0.033053, gs_amp_init=0.0062901, gs_scale_init=0.078733, gs_tv_weight=4.866e-05 -> hr=0.0000", "comparison_image": "runs/demo-intensity-calibrated-tpe-r2gaussian-search-20260521-01/iterations/iter-0018/comparison.png"}
{"ts": "2026-05-21T18:11:33Z", "run_id": "demo-intensity-calibrated-tpe-r2gaussian-search-20260521-01", "iter": 17, "agent": "r2gaussian-search-tpe-calibrated", "model": "random-search", "change_class": "architecture", "status": "keep", "kept": true, "val_score": null, "headroom": 0.25355548920434456, "params_M": 0.003072, "train_n": 0, "rationale": "r2gaussian-search-tpe-calibrated: gs_n_gaussians=512, gs_n_iter=558, gs_lr_pos=0.0070186, gs_lr_scale=0.049594, gs_lr_amp=0.022164, gs_amp_init=0.0068648, gs_scale_init=0.099817, gs_tv_weight=3.4136e-05", "advice_for_others": "r2gaussian-search-tpe-calibrated: gs_n_gaussians=512, gs_n_iter=558, gs_lr_pos=0.0070186, gs_lr_scale=0.049594, gs_lr_amp=0.022164, gs_amp_init=0.0068648, gs_scale_init=0.099817, gs_tv_weight=3.4136e-05 -> hr=0.2536", "comparison_image": "runs/demo-intensity-calibrated-tpe-r2gaussian-search-20260521-01/iterations/iter-0017/comparison.png"}
{"ts": "2026-05-21T17:59:01Z", "run_id": "demo-intensity-calibrated-tpe-r2gaussian-search-20260521-01", "iter": 16, "agent": "r2gaussian-search-tpe-calibrated", "model": "random-search", "change_class": "architecture", "status": "discard", "kept": false, "val_score": null, "headroom": 0.0, "params_M": 0.006144, "train_n": 0, "rationale": "r2gaussian-search-tpe-calibrated: gs_n_gaussians=1024, gs_n_iter=407, gs_lr_pos=0.0029144, gs_lr_scale=0.031944, gs_lr_amp=0.048425, gs_amp_init=0.012122, gs_scale_init=0.053819, gs_tv_weight=0.00014502", "advice_for_others": "r2gaussian-search-tpe-calibrated: gs_n_gaussians=1024, gs_n_iter=407, gs_lr_pos=0.0029144, gs_lr_scale=0.031944, gs_lr_amp=0.048425, gs_amp_init=0.012122, gs_scale_init=0.053819, gs_tv_weight=0.00014502 -> hr=0.0000", "comparison_image": "runs/demo-intensity-calibrated-tpe-r2gaussian-search-20260521-01/iterations/iter-0016/comparison.png"}
{"ts": "2026-05-21T17:48:31Z", "run_id": "demo-intensity-calibrated-tpe-r2gaussian-search-20260521-01", "iter": 15, "agent": "r2gaussian-search-tpe-calibrated", "model": "random-search", "change_class": "architecture", "status": "keep", "kept": true, "val_score": null, "headroom": 0.04566790082312322, "params_M": 0.003072, "train_n": 0, "rationale": "r2gaussian-search-tpe-calibrated: gs_n_gaussians=512, gs_n_iter=664, gs_lr_pos=0.005964, gs_lr_scale=0.032461, gs_lr_amp=0.026268, gs_amp_init=0.020563, gs_scale_init=0.035668, gs_tv_weight=5.7234e-05", "advice_for_others": "r2gaussian-search-tpe-calibrated: gs_n_gaussians=512, gs_n_iter=664, gs_lr_pos=0.005964, gs_lr_scale=0.032461, gs_lr_amp=0.026268, gs_amp_init=0.020563, gs_scale_init=0.035668, gs_tv_weight=5.7234e-05 -> hr=0.0457", "comparison_image": "runs/demo-intensity-calibrated-tpe-r2gaussian-search-20260521-01/iterations/iter-0015/comparison.png"}
{"ts": "2026-05-21T17:36:39Z", "run_id": "demo-intensity-calibrated-tpe-r2gaussian-search-20260521-01", "iter": 14, "agent": "r2gaussian-search-tpe-calibrated", "model": "random-search", "change_class": "architecture", "status": "keep", "kept": true, "val_score": null, "headroom": 0.29993611712687185, "params_M": 0.003072, "train_n": 0, "rationale": "r2gaussian-search-tpe-calibrated: gs_n_gaussians=512, gs_n_iter=544, gs_lr_pos=0.0025137, gs_lr_scale=0.030826, gs_lr_amp=0.023035, gs_amp_init=0.010724, gs_scale_init=0.032927, gs_tv_weight=1.96e-05", "advice_for_others": "r2gaussian-search-tpe-calibrated: gs_n_gaussians=512, gs_n_iter=544, gs_lr_pos=0.0025137, gs_lr_scale=0.030826, gs_lr_amp=0.023035, gs_amp_init=0.010724, gs_scale_init=0.032927, gs_tv_weight=1.96e-05 -> hr=0.2999", "comparison_image": "runs/demo-intensity-calibrated-tpe-r2gaussian-search-20260521-01/iterations/iter-0014/comparison.png"}
{"ts": "2026-05-21T17:24:28Z", "run_id": "demo-intensity-calibrated-tpe-r2gaussian-search-20260521-01", "iter": 13, "agent": "r2gaussian-search-tpe-calibrated", "model": "random-search", "change_class": "architecture", "status": "keep", "kept": true, "val_score": null, "headroom": 0.21271381109549248, "params_M": 0.003072, "train_n": 0, "rationale": "r2gaussian-search-tpe-calibrated: gs_n_gaussians=512, gs_n_iter=417, gs_lr_pos=0.0020426, gs_lr_scale=0.025864, gs_lr_amp=0.014787, gs_amp_init=0.0051616, gs_scale_init=0.031649, gs_tv_weight=2.8365e-05", "advice_for_others": "r2gaussian-search-tpe-calibrated: gs_n_gaussians=512, gs_n_iter=417, gs_lr_pos=0.0020426, gs_lr_scale=0.025864, gs_lr_amp=0.014787, gs_amp_init=0.0051616, gs_scale_init=0.031649, gs_tv_weight=2.8365e-05 -> hr=0.2127", "comparison_image": "runs/demo-intensity-calibrated-tpe-r2gaussian-search-20260521-01/iterations/iter-0013/comparison.png"}
{"ts": "2026-05-21T17:13:14Z", "run_id": "demo-intensity-calibrated-tpe-r2gaussian-search-20260521-01", "iter": 12, "agent": "r2gaussian-search-tpe-calibrated", "model": "random-search", "change_class": "architecture", "status": "keep", "kept": true, "val_score": null, "headroom": 0.25224067012174145, "params_M": 0.003072, "train_n": 0, "rationale": "r2gaussian-search-tpe-calibrated: gs_n_gaussians=512, gs_n_iter=457, gs_lr_pos=0.002054, gs_lr_scale=0.026009, gs_lr_amp=0.018884, gs_amp_init=0.0088996, gs_scale_init=0.023473, gs_tv_weight=2.6177e-05", "advice_for_others": "r2gaussian-search-tpe-calibrated: gs_n_gaussians=512, gs_n_iter=457, gs_lr_pos=0.002054, gs_lr_scale=0.026009, gs_lr_amp=0.018884, gs_amp_init=0.0088996, gs_scale_init=0.023473, gs_tv_weight=2.6177e-05 -> hr=0.2522", "comparison_image": "runs/demo-intensity-calibrated-tpe-r2gaussian-search-20260521-01/iterations/iter-0012/comparison.png"}
{"ts": "2026-05-21T17:02:59Z", "run_id": "demo-intensity-calibrated-tpe-r2gaussian-search-20260521-01", "iter": 11, "agent": "r2gaussian-search-tpe-calibrated", "model": "random-search", "change_class": "architecture", "status": "keep", "kept": true, "val_score": null, "headroom": 0.19674596468698036, "params_M": 0.003072, "train_n": 0, "rationale": "r2gaussian-search-tpe-calibrated: gs_n_gaussians=512, gs_n_iter=457, gs_lr_pos=0.0020941, gs_lr_scale=0.011847, gs_lr_amp=0.0050126, gs_amp_init=0.0093534, gs_scale_init=0.058073, gs_tv_weight=0.00096376", "advice_for_others": "r2gaussian-search-tpe-calibrated: gs_n_gaussians=512, gs_n_iter=457, gs_lr_pos=0.0020941, gs_lr_scale=0.011847, gs_lr_amp=0.0050126, gs_amp_init=0.0093534, gs_scale_init=0.058073, gs_tv_weight=0.00096376 -> hr=0.1967", "comparison_image": "runs/demo-intensity-calibrated-tpe-r2gaussian-search-20260521-01/iterations/iter-0011/comparison.png"}
{"ts": "2026-05-21T16:52:44Z", "run_id": "demo-intensity-calibrated-tpe-r2gaussian-search-20260521-01", "iter": 10, "agent": "r2gaussian-search-tpe-calibrated", "model": "random-search", "change_class": "architecture", "status": "discard", "kept": false, "val_score": null, "headroom": 0.0, "params_M": 0.003072, "train_n": 0, "rationale": "r2gaussian-search-tpe-calibrated: gs_n_gaussians=512, gs_n_iter=649, gs_lr_pos=0.0077671, gs_lr_scale=0.043813, gs_lr_amp=0.026914, gs_amp_init=0.025484, gs_scale_init=0.067176, gs_tv_weight=5.5324e-05", "advice_for_others": "r2gaussian-search-tpe-calibrated: gs_n_gaussians=512, gs_n_iter=649, gs_lr_pos=0.0077671, gs_lr_scale=0.043813, gs_lr_amp=0.026914, gs_amp_init=0.025484, gs_scale_init=0.067176, gs_tv_weight=5.5324e-05 -> hr=0.0000", "comparison_image": "runs/demo-intensity-calibrated-tpe-r2gaussian-search-20260521-01/iterations/iter-0010/comparison.png"}
{"ts": "2026-05-21T16:41:09Z", "run_id": "demo-intensity-calibrated-tpe-r2gaussian-search-20260521-01", "iter": 9, "agent": "r2gaussian-search-tpe-calibrated", "model": "random-search", "change_class": "architecture", "status": "discard", "kept": false, "val_score": null, "headroom": 0.0, "params_M": 0.006144, "train_n": 0, "rationale": "r2gaussian-search-tpe-calibrated: gs_n_gaussians=1024, gs_n_iter=497, gs_lr_pos=0.0012901, gs_lr_scale=0.011071, gs_lr_amp=0.012717, gs_amp_init=0.014674, gs_scale_init=0.039936, gs_tv_weight=1.1122e-05", "advice_for_others": "r2gaussian-search-tpe-calibrated: gs_n_gaussians=1024, gs_n_iter=497, gs_lr_pos=0.0012901, gs_lr_scale=0.011071, gs_lr_amp=0.012717, gs_amp_init=0.014674, gs_scale_init=0.039936, gs_tv_weight=1.1122e-05 -> hr=0.0000", "comparison_image": "runs/demo-intensity-calibrated-tpe-r2gaussian-search-20260521-01/iterations/iter-0009/comparison.png"}
{"ts": "2026-05-21T16:28:23Z", "run_id": "demo-intensity-calibrated-tpe-r2gaussian-search-20260521-01", "iter": 8, "agent": "r2gaussian-search-tpe-calibrated", "model": "random-search", "change_class": "architecture", "status": "discard", "kept": false, "val_score": null, "headroom": 0.0, "params_M": 0.003072, "train_n": 0, "rationale": "r2gaussian-search-tpe-calibrated: gs_n_gaussians=512, gs_n_iter=737, gs_lr_pos=0.013372, gs_lr_scale=0.0093582, gs_lr_amp=0.032546, gs_amp_init=0.0053163, gs_scale_init=0.045372, gs_tv_weight=0.00011586", "advice_for_others": "r2gaussian-search-tpe-calibrated: gs_n_gaussians=512, gs_n_iter=737, gs_lr_pos=0.013372, gs_lr_scale=0.0093582, gs_lr_amp=0.032546, gs_amp_init=0.0053163, gs_scale_init=0.045372, gs_tv_weight=0.00011586 -> hr=0.0000", "comparison_image": "runs/demo-intensity-calibrated-tpe-r2gaussian-search-20260521-01/iterations/iter-0008/comparison.png"}
{"ts": "2026-05-21T16:15:11Z", "run_id": "demo-intensity-calibrated-tpe-r2gaussian-search-20260521-01", "iter": 7, "agent": "r2gaussian-search-tpe-calibrated", "model": "random-search", "change_class": "architecture", "status": "discard", "kept": false, "val_score": null, "headroom": 0.0, "params_M": 0.006144, "train_n": 0, "rationale": "r2gaussian-search-tpe-calibrated: gs_n_gaussians=1024, gs_n_iter=590, gs_lr_pos=0.0011124, gs_lr_scale=0.007045, gs_lr_amp=0.011848, gs_amp_init=0.012969, gs_scale_init=0.045541, gs_tv_weight=0.00026108", "advice_for_others": "r2gaussian-search-tpe-calibrated: gs_n_gaussians=1024, gs_n_iter=590, gs_lr_pos=0.0011124, gs_lr_scale=0.007045, gs_lr_amp=0.011848, gs_amp_init=0.012969, gs_scale_init=0.045541, gs_tv_weight=0.00026108 -> hr=0.0000", "comparison_image": "runs/demo-intensity-calibrated-tpe-r2gaussian-search-20260521-01/iterations/iter-0007/comparison.png"}
{"ts": "2026-05-21T16:05:02Z", "run_id": "demo-intensity-calibrated-tpe-r2gaussian-search-20260521-01", "iter": 6, "agent": "r2gaussian-search-tpe-calibrated", "model": "random-search", "change_class": "architecture", "status": "discard", "kept": false, "val_score": null, "headroom": 0.0, "params_M": 0.003072, "train_n": 0, "rationale": "r2gaussian-search-tpe-calibrated: gs_n_gaussians=512, gs_n_iter=757, gs_lr_pos=0.017465, gs_lr_scale=0.0051669, gs_lr_amp=0.018889, gs_amp_init=0.015864, gs_scale_init=0.021211, gs_tv_weight=0.00053968", "advice_for_others": "r2gaussian-search-tpe-calibrated: gs_n_gaussians=512, gs_n_iter=757, gs_lr_pos=0.017465, gs_lr_scale=0.0051669, gs_lr_amp=0.018889, gs_amp_init=0.015864, gs_scale_init=0.021211, gs_tv_weight=0.00053968 -> hr=0.0000", "comparison_image": "runs/demo-intensity-calibrated-tpe-r2gaussian-search-20260521-01/iterations/iter-0006/comparison.png"}
{"ts": "2026-05-21T15:54:49Z", "run_id": "demo-intensity-calibrated-tpe-r2gaussian-search-20260521-01", "iter": 5, "agent": "r2gaussian-search-tpe-calibrated", "model": "random-search", "change_class": "architecture", "status": "keep", "kept": true, "val_score": null, "headroom": 0.2516511756356481, "params_M": 0.003072, "train_n": 0, "rationale": "r2gaussian-search-tpe-calibrated: gs_n_gaussians=512, gs_n_iter=524, gs_lr_pos=0.0017168, gs_lr_scale=0.01125, gs_lr_amp=0.01552, gs_amp_init=0.0095308, gs_scale_init=0.023802, gs_tv_weight=1.8218e-05", "advice_for_others": "r2gaussian-search-tpe-calibrated: gs_n_gaussians=512, gs_n_iter=524, gs_lr_pos=0.0017168, gs_lr_scale=0.01125, gs_lr_amp=0.01552, gs_amp_init=0.0095308, gs_scale_init=0.023802, gs_tv_weight=1.8218e-05 -> hr=0.2517", "comparison_image": "runs/demo-intensity-calibrated-tpe-r2gaussian-search-20260521-01/iterations/iter-0005/comparison.png"}
{"ts": "2026-05-21T15:42:52Z", "run_id": "demo-intensity-calibrated-tpe-r2gaussian-search-20260521-01", "iter": 2, "agent": "r2gaussian-search-tpe-calibrated", "model": "random-search", "change_class": "architecture", "status": "keep", "kept": true, "val_score": null, "headroom": 0.2504189314284423, "params_M": 0.003072, "train_n": 0, "rationale": "r2gaussian-search-tpe-calibrated: gs_n_gaussians=512, gs_n_iter=483, gs_lr_pos=0.0018713, gs_lr_scale=0.02335, gs_lr_amp=0.018997, gs_amp_init=0.0084685, gs_scale_init=0.02656, gs_tv_weight=2.5913e-05", "advice_for_others": "r2gaussian-search-tpe-calibrated: gs_n_gaussians=512, gs_n_iter=483, gs_lr_pos=0.0018713, gs_lr_scale=0.02335, gs_lr_amp=0.018997, gs_amp_init=0.0084685, gs_scale_init=0.02656, gs_tv_weight=2.5913e-05 -> hr=0.2504", "comparison_image": "runs/demo-intensity-calibrated-tpe-r2gaussian-search-20260521-01/iterations/iter-0002/comparison.png"}
{"ts": "2026-05-21T13:09:40Z", "run_id": "demo-intensity-calibrated-tpe-naf-search-20260521-01", "iter": 20, "agent": "naf-search-tpe-calibrated", "model": "random-search", "change_class": "architecture", "status": "keep", "kept": true, "val_score": null, "headroom": 0.40948131332963955, "params_M": 0.270337, "train_n": 0, "rationale": "naf-search-tpe-calibrated: naf_n_freqs=6, naf_hidden=256, naf_layers=6, naf_n_iter=2294, naf_lr=0.0010378, naf_tv_weight=2.208e-05, naf_outer_wall_s=2400", "advice_for_others": "naf-search-tpe-calibrated: naf_n_freqs=6, naf_hidden=256, naf_layers=6, naf_n_iter=2294, naf_lr=0.0010378, naf_tv_weight=2.208e-05, naf_outer_wall_s=2400 -> hr=0.4095", "comparison_image": "runs/demo-intensity-calibrated-tpe-naf-search-20260521-01/iterations/iter-0020/comparison.png"}
{"ts": "2026-05-21T12:29:25Z", "run_id": "demo-intensity-calibrated-tpe-naf-search-20260521-01", "iter": 19, "agent": "naf-search-tpe-calibrated", "model": "random-search", "change_class": "architecture", "status": "keep", "kept": true, "val_score": null, "headroom": 0.4159581668712634, "params_M": 0.270337, "train_n": 0, "rationale": "naf-search-tpe-calibrated: naf_n_freqs=6, naf_hidden=256, naf_layers=6, naf_n_iter=2216, naf_lr=0.0019539, naf_tv_weight=2.9596e-05, naf_outer_wall_s=2400", "advice_for_others": "naf-search-tpe-calibrated: naf_n_freqs=6, naf_hidden=256, naf_layers=6, naf_n_iter=2216, naf_lr=0.0019539, naf_tv_weight=2.9596e-05, naf_outer_wall_s=2400 -> hr=0.4160", "comparison_image": "runs/demo-intensity-calibrated-tpe-naf-search-20260521-01/iterations/iter-0019/comparison.png"}
{"ts": "2026-05-21T11:47:09Z", "run_id": "demo-intensity-calibrated-tpe-naf-search-20260521-01", "iter": 18, "agent": "naf-search-tpe-calibrated", "model": "random-search", "change_class": "architecture", "status": "keep", "kept": true, "val_score": null, "headroom": 0.3985016444136519, "params_M": 0.270337, "train_n": 0, "rationale": "naf-search-tpe-calibrated: naf_n_freqs=6, naf_hidden=256, naf_layers=6, naf_n_iter=1827, naf_lr=0.0016722, naf_tv_weight=3.1514e-06, naf_outer_wall_s=2400", "advice_for_others": "naf-search-tpe-calibrated: naf_n_freqs=6, naf_hidden=256, naf_layers=6, naf_n_iter=1827, naf_lr=0.0016722, naf_tv_weight=3.1514e-06, naf_outer_wall_s=2400 -> hr=0.3985", "comparison_image": "runs/demo-intensity-calibrated-tpe-naf-search-20260521-01/iterations/iter-0018/comparison.png"}
