{"ts": "2026-05-21T02:58:47Z", "run_id": "demo-intensity-calibrated-tpe-diff-recon-dcstep-unconstrained-search-20260521-01", "iter": 19, "agent": "diff-recon-dcstep-unconstrained-search-tpe-calibrated", "model": "random-search", "change_class": "architecture", "status": "keep", "kept": true, "val_score": null, "headroom": 0.4467788166855797, "params_M": 0.958051, "train_n": 2000, "rationale": "diff-recon-dcstep-unconstrained-search-tpe-calibrated: recon_ckpt=/cluster/maier/Agent4CT/checkpoints/ddpm_unconstrained_final.pt, recon_mode=dps, recon_sample_steps=500, recon_eta=6.2684, recon_init=noise, recon_eta_clamp=False, recon_dcstep_every=5, recon_dcstep_n_cg=25, recon_dcstep_warmup=40, recon_dcstep_relax=0.95", "advice_for_others": "diff-recon-dcstep-unconstrained-search-tpe-calibrated: recon_ckpt=/cluster/maier/Agent4CT/checkpoints/ddpm_unconstrained_final.pt, recon_mode=dps, recon_sample_steps=500, recon_eta=6.2684, recon_init=noise, recon_eta_clamp=False, recon_dcstep_every=5, recon_dcstep_n_cg=25, recon_dcstep_warmup=40, recon_dcstep_relax=0.95 -> hr=0.4468", "comparison_image": "runs/demo-intensity-calibrated-tpe-diff-recon-dcstep-unconstrained-search-20260521-01/iterations/iter-0019/comparison.png"}
{"ts": "2026-05-21T02:51:22Z", "run_id": "demo-intensity-calibrated-tpe-diff-recon-dcstep-constrained-search-20260521-01", "iter": 13, "agent": "diff-recon-dcstep-constrained-search-tpe-calibrated", "model": "random-search", "change_class": "architecture", "status": "keep", "kept": true, "val_score": null, "headroom": 0.4322051210564981, "params_M": 0.958051, "train_n": 200, "rationale": "diff-recon-dcstep-constrained-search-tpe-calibrated: recon_ckpt=/cluster/maier/Agent4CT/checkpoints/ddpm_constrained_final.pt, recon_mode=dps, recon_sample_steps=500, recon_eta=11.864, recon_init=noise, recon_eta_clamp=False, recon_dcstep_every=4, recon_dcstep_n_cg=25, recon_dcstep_warmup=40, recon_dcstep_relax=0.95", "advice_for_others": "diff-recon-dcstep-constrained-search-tpe-calibrated: recon_ckpt=/cluster/maier/Agent4CT/checkpoints/ddpm_constrained_final.pt, recon_mode=dps, recon_sample_steps=500, recon_eta=11.864, recon_init=noise, recon_eta_clamp=False, recon_dcstep_every=4, recon_dcstep_n_cg=25, recon_dcstep_warmup=40, recon_dcstep_relax=0.95 -> hr=0.4322", "comparison_image": "runs/demo-intensity-calibrated-tpe-diff-recon-dcstep-constrained-search-20260521-01/iterations/iter-0013/comparison.png"}
{"ts": "2026-05-21T02:48:56Z", "run_id": "demo-intensity-calibrated-tpe-diff-recon-dcstep-unconstrained-search-20260521-01", "iter": 18, "agent": "diff-recon-dcstep-unconstrained-search-tpe-calibrated", "model": "random-search", "change_class": "architecture", "status": "keep", "kept": true, "val_score": null, "headroom": 0.4512619928076671, "params_M": 0.958051, "train_n": 2000, "rationale": "diff-recon-dcstep-unconstrained-search-tpe-calibrated: recon_ckpt=/cluster/maier/Agent4CT/checkpoints/ddpm_unconstrained_final.pt, recon_mode=dps, recon_sample_steps=200, recon_eta=6.1199, recon_init=fbp, recon_eta_clamp=True, recon_dcstep_every=5, recon_dcstep_n_cg=25, recon_dcstep_warmup=10, recon_dcstep_relax=0.95", "advice_for_others": "diff-recon-dcstep-unconstrained-search-tpe-calibrated: recon_ckpt=/cluster/maier/Agent4CT/checkpoints/ddpm_unconstrained_final.pt, recon_mode=dps, recon_sample_steps=200, recon_eta=6.1199, recon_init=fbp, recon_eta_clamp=True, recon_dcstep_every=5, recon_dcstep_n_cg=25, recon_dcstep_warmup=10, recon_dcstep_relax=0.95 -> hr=0.4513", "comparison_image": "runs/demo-intensity-calibrated-tpe-diff-recon-dcstep-unconstrained-search-20260521-01/iterations/iter-0018/comparison.png"}
{"ts": "2026-05-21T02:44:51Z", "run_id": "demo-intensity-calibrated-tpe-diff-recon-dcstep-unconstrained-search-20260521-01", "iter": 17, "agent": "diff-recon-dcstep-unconstrained-search-tpe-calibrated", "model": "random-search", "change_class": "architecture", "status": "keep", "kept": true, "val_score": null, "headroom": 0.45298393121046876, "params_M": 0.958051, "train_n": 2000, "rationale": "diff-recon-dcstep-unconstrained-search-tpe-calibrated: recon_ckpt=/cluster/maier/Agent4CT/checkpoints/ddpm_unconstrained_final.pt, recon_mode=dps, recon_sample_steps=200, recon_eta=4.1083, recon_init=fbp, recon_eta_clamp=True, recon_dcstep_every=4, recon_dcstep_n_cg=25, recon_dcstep_warmup=10, recon_dcstep_relax=1", "advice_for_others": "diff-recon-dcstep-unconstrained-search-tpe-calibrated: recon_ckpt=/cluster/maier/Agent4CT/checkpoints/ddpm_unconstrained_final.pt, recon_mode=dps, recon_sample_steps=200, recon_eta=4.1083, recon_init=fbp, recon_eta_clamp=True, recon_dcstep_every=4, recon_dcstep_n_cg=25, recon_dcstep_warmup=10, recon_dcstep_relax=1 -> hr=0.4530", "comparison_image": "runs/demo-intensity-calibrated-tpe-diff-recon-dcstep-unconstrained-search-20260521-01/iterations/iter-0017/comparison.png"}
{"ts": "2026-05-21T02:42:01Z", "run_id": "demo-intensity-calibrated-tpe-diff-recon-dcstep-constrained-search-20260521-01", "iter": 12, "agent": "diff-recon-dcstep-constrained-search-tpe-calibrated", "model": "random-search", "change_class": "architecture", "status": "keep", "kept": true, "val_score": null, "headroom": 0.43259633006076803, "params_M": 0.958051, "train_n": 200, "rationale": "diff-recon-dcstep-constrained-search-tpe-calibrated: recon_ckpt=/cluster/maier/Agent4CT/checkpoints/ddpm_constrained_final.pt, recon_mode=dps, recon_sample_steps=500, recon_eta=11.547, recon_init=noise, recon_eta_clamp=False, recon_dcstep_every=4, recon_dcstep_n_cg=25, recon_dcstep_warmup=40, recon_dcstep_relax=0.95", "advice_for_others": "diff-recon-dcstep-constrained-search-tpe-calibrated: recon_ckpt=/cluster/maier/Agent4CT/checkpoints/ddpm_constrained_final.pt, recon_mode=dps, recon_sample_steps=500, recon_eta=11.547, recon_init=noise, recon_eta_clamp=False, recon_dcstep_every=4, recon_dcstep_n_cg=25, recon_dcstep_warmup=40, recon_dcstep_relax=0.95 -> hr=0.4326", "comparison_image": "runs/demo-intensity-calibrated-tpe-diff-recon-dcstep-constrained-search-20260521-01/iterations/iter-0012/comparison.png"}
{"ts": "2026-05-21T02:40:24Z", "run_id": "demo-intensity-calibrated-tpe-diff-recon-dcstep-unconstrained-search-20260521-01", "iter": 16, "agent": "diff-recon-dcstep-unconstrained-search-tpe-calibrated", "model": "random-search", "change_class": "architecture", "status": "keep", "kept": true, "val_score": null, "headroom": 0.43366025182446744, "params_M": 0.958051, "train_n": 2000, "rationale": "diff-recon-dcstep-unconstrained-search-tpe-calibrated: recon_ckpt=/cluster/maier/Agent4CT/checkpoints/ddpm_unconstrained_final.pt, recon_mode=dps, recon_sample_steps=800, recon_eta=15.089, recon_init=fbp, recon_eta_clamp=True, recon_dcstep_every=4, recon_dcstep_n_cg=20, recon_dcstep_warmup=10, recon_dcstep_relax=1", "advice_for_others": "diff-recon-dcstep-unconstrained-search-tpe-calibrated: recon_ckpt=/cluster/maier/Agent4CT/checkpoints/ddpm_unconstrained_final.pt, recon_mode=dps, recon_sample_steps=800, recon_eta=15.089, recon_init=fbp, recon_eta_clamp=True, recon_dcstep_every=4, recon_dcstep_n_cg=20, recon_dcstep_warmup=10, recon_dcstep_relax=1 -> hr=0.4337", "comparison_image": "runs/demo-intensity-calibrated-tpe-diff-recon-dcstep-unconstrained-search-20260521-01/iterations/iter-0016/comparison.png"}
{"ts": "2026-05-21T02:37:36Z", "run_id": "demo-intensity-calibrated-tpe-naf-search-20260521-01", "iter": 3, "agent": "naf-search-tpe-calibrated", "model": "random-search", "change_class": "architecture", "status": "keep", "kept": true, "val_score": null, "headroom": 0.4091858274553706, "params_M": 0.270337, "train_n": 0, "rationale": "naf-search-tpe-calibrated: naf_n_freqs=6, naf_hidden=256, naf_layers=6, naf_n_iter=2014, naf_lr=0.0042423, naf_tv_weight=3.9864e-06, naf_outer_wall_s=2400", "advice_for_others": "naf-search-tpe-calibrated: naf_n_freqs=6, naf_hidden=256, naf_layers=6, naf_n_iter=2014, naf_lr=0.0042423, naf_tv_weight=3.9864e-06, naf_outer_wall_s=2400 -> hr=0.4092", "comparison_image": "runs/demo-intensity-calibrated-tpe-naf-search-20260521-01/iterations/iter-0003/comparison.png"}
{"ts": "2026-05-21T02:32:41Z", "run_id": "demo-intensity-calibrated-tpe-diff-recon-dcstep-constrained-search-20260521-01", "iter": 11, "agent": "diff-recon-dcstep-constrained-search-tpe-calibrated", "model": "random-search", "change_class": "architecture", "status": "keep", "kept": true, "val_score": null, "headroom": 0.4263671517131208, "params_M": 0.958051, "train_n": 200, "rationale": "diff-recon-dcstep-constrained-search-tpe-calibrated: recon_ckpt=/cluster/maier/Agent4CT/checkpoints/ddpm_constrained_final.pt, recon_mode=dps, recon_sample_steps=200, recon_eta=18.368, recon_init=fbp, recon_eta_clamp=False, recon_dcstep_every=4, recon_dcstep_n_cg=20, recon_dcstep_warmup=25, recon_dcstep_relax=0.85", "advice_for_others": "diff-recon-dcstep-constrained-search-tpe-calibrated: recon_ckpt=/cluster/maier/Agent4CT/checkpoints/ddpm_constrained_final.pt, recon_mode=dps, recon_sample_steps=200, recon_eta=18.368, recon_init=fbp, recon_eta_clamp=False, recon_dcstep_every=4, recon_dcstep_n_cg=20, recon_dcstep_warmup=25, recon_dcstep_relax=0.85 -> hr=0.4264", "comparison_image": "runs/demo-intensity-calibrated-tpe-diff-recon-dcstep-constrained-search-20260521-01/iterations/iter-0011/comparison.png"}
{"ts": "2026-05-21T02:29:19Z", "run_id": "demo-intensity-calibrated-tpe-diff-recon-dcstep-constrained-search-20260521-01", "iter": 10, "agent": "diff-recon-dcstep-constrained-search-tpe-calibrated", "model": "random-search", "change_class": "architecture", "status": "keep", "kept": true, "val_score": null, "headroom": 0.426201884816106, "params_M": 0.958051, "train_n": 200, "rationale": "diff-recon-dcstep-constrained-search-tpe-calibrated: recon_ckpt=/cluster/maier/Agent4CT/checkpoints/ddpm_constrained_final.pt, recon_mode=dps, recon_sample_steps=800, recon_eta=5.1862, recon_init=noise, recon_eta_clamp=True, recon_dcstep_every=3, recon_dcstep_n_cg=15, recon_dcstep_warmup=10, recon_dcstep_relax=0.95", "advice_for_others": "diff-recon-dcstep-constrained-search-tpe-calibrated: recon_ckpt=/cluster/maier/Agent4CT/checkpoints/ddpm_constrained_final.pt, recon_mode=dps, recon_sample_steps=800, recon_eta=5.1862, recon_init=noise, recon_eta_clamp=True, recon_dcstep_every=3, recon_dcstep_n_cg=15, recon_dcstep_warmup=10, recon_dcstep_relax=0.95 -> hr=0.4262", "comparison_image": "runs/demo-intensity-calibrated-tpe-diff-recon-dcstep-constrained-search-20260521-01/iterations/iter-0010/comparison.png"}
{"ts": "2026-05-21T02:24:04Z", "run_id": "demo-intensity-calibrated-tpe-diff-recon-dcstep-unconstrained-search-20260521-01", "iter": 15, "agent": "diff-recon-dcstep-unconstrained-search-tpe-calibrated", "model": "random-search", "change_class": "architecture", "status": "keep", "kept": true, "val_score": null, "headroom": 0.44692788347334467, "params_M": 0.958051, "train_n": 2000, "rationale": "diff-recon-dcstep-unconstrained-search-tpe-calibrated: recon_ckpt=/cluster/maier/Agent4CT/checkpoints/ddpm_unconstrained_final.pt, recon_mode=dps, recon_sample_steps=200, recon_eta=4.9866, recon_init=fbp, recon_eta_clamp=True, recon_dcstep_every=4, recon_dcstep_n_cg=20, recon_dcstep_warmup=10, recon_dcstep_relax=1", "advice_for_others": "diff-recon-dcstep-unconstrained-search-tpe-calibrated: recon_ckpt=/cluster/maier/Agent4CT/checkpoints/ddpm_unconstrained_final.pt, recon_mode=dps, recon_sample_steps=200, recon_eta=4.9866, recon_init=fbp, recon_eta_clamp=True, recon_dcstep_every=4, recon_dcstep_n_cg=20, recon_dcstep_warmup=10, recon_dcstep_relax=1 -> hr=0.4469", "comparison_image": "runs/demo-intensity-calibrated-tpe-diff-recon-dcstep-unconstrained-search-20260521-01/iterations/iter-0015/comparison.png"}
{"ts": "2026-05-21T02:20:04Z", "run_id": "demo-intensity-calibrated-tpe-diff-recon-dcstep-unconstrained-search-20260521-01", "iter": 14, "agent": "diff-recon-dcstep-unconstrained-search-tpe-calibrated", "model": "random-search", "change_class": "architecture", "status": "keep", "kept": true, "val_score": null, "headroom": 0.4471972693749009, "params_M": 0.958051, "train_n": 2000, "rationale": "diff-recon-dcstep-unconstrained-search-tpe-calibrated: recon_ckpt=/cluster/maier/Agent4CT/checkpoints/ddpm_unconstrained_final.pt, recon_mode=dps, recon_sample_steps=200, recon_eta=3.5358, recon_init=fbp, recon_eta_clamp=True, recon_dcstep_every=4, recon_dcstep_n_cg=20, recon_dcstep_warmup=10, recon_dcstep_relax=1", "advice_for_others": "diff-recon-dcstep-unconstrained-search-tpe-calibrated: recon_ckpt=/cluster/maier/Agent4CT/checkpoints/ddpm_unconstrained_final.pt, recon_mode=dps, recon_sample_steps=200, recon_eta=3.5358, recon_init=fbp, recon_eta_clamp=True, recon_dcstep_every=4, recon_dcstep_n_cg=20, recon_dcstep_warmup=10, recon_dcstep_relax=1 -> hr=0.4472", "comparison_image": "runs/demo-intensity-calibrated-tpe-diff-recon-dcstep-unconstrained-search-20260521-01/iterations/iter-0014/comparison.png"}
{"ts": "2026-05-21T02:16:04Z", "run_id": "demo-intensity-calibrated-tpe-diff-recon-dcstep-unconstrained-search-20260521-01", "iter": 13, "agent": "diff-recon-dcstep-unconstrained-search-tpe-calibrated", "model": "random-search", "change_class": "architecture", "status": "keep", "kept": true, "val_score": null, "headroom": 0.4466931752592276, "params_M": 0.958051, "train_n": 2000, "rationale": "diff-recon-dcstep-unconstrained-search-tpe-calibrated: recon_ckpt=/cluster/maier/Agent4CT/checkpoints/ddpm_unconstrained_final.pt, recon_mode=dps, recon_sample_steps=200, recon_eta=3.0007, recon_init=fbp, recon_eta_clamp=True, recon_dcstep_every=3, recon_dcstep_n_cg=20, recon_dcstep_warmup=25, recon_dcstep_relax=1", "advice_for_others": "diff-recon-dcstep-unconstrained-search-tpe-calibrated: recon_ckpt=/cluster/maier/Agent4CT/checkpoints/ddpm_unconstrained_final.pt, recon_mode=dps, recon_sample_steps=200, recon_eta=3.0007, recon_init=fbp, recon_eta_clamp=True, recon_dcstep_every=3, recon_dcstep_n_cg=20, recon_dcstep_warmup=25, recon_dcstep_relax=1 -> hr=0.4467", "comparison_image": "runs/demo-intensity-calibrated-tpe-diff-recon-dcstep-unconstrained-search-20260521-01/iterations/iter-0013/comparison.png"}
{"ts": "2026-05-21T02:15:27Z", "run_id": "demo-intensity-calibrated-tpe-diff-recon-dcstep-constrained-search-20260521-01", "iter": 9, "agent": "diff-recon-dcstep-constrained-search-tpe-calibrated", "model": "random-search", "change_class": "architecture", "status": "keep", "kept": true, "val_score": null, "headroom": 0.392444079973021, "params_M": 0.958051, "train_n": 200, "rationale": "diff-recon-dcstep-constrained-search-tpe-calibrated: recon_ckpt=/cluster/maier/Agent4CT/checkpoints/ddpm_constrained_final.pt, recon_mode=dps, recon_sample_steps=800, recon_eta=54.142, recon_init=fbp, recon_eta_clamp=True, recon_dcstep_every=3, recon_dcstep_n_cg=10, recon_dcstep_warmup=10, recon_dcstep_relax=0.95", "advice_for_others": "diff-recon-dcstep-constrained-search-tpe-calibrated: recon_ckpt=/cluster/maier/Agent4CT/checkpoints/ddpm_constrained_final.pt, recon_mode=dps, recon_sample_steps=800, recon_eta=54.142, recon_init=fbp, recon_eta_clamp=True, recon_dcstep_every=3, recon_dcstep_n_cg=10, recon_dcstep_warmup=10, recon_dcstep_relax=0.95 -> hr=0.3924", "comparison_image": "runs/demo-intensity-calibrated-tpe-diff-recon-dcstep-constrained-search-20260521-01/iterations/iter-0009/comparison.png"}
{"ts": "2026-05-21T02:11:40Z", "run_id": "demo-intensity-calibrated-tpe-diff-recon-dcstep-unconstrained-search-20260521-01", "iter": 12, "agent": "diff-recon-dcstep-unconstrained-search-tpe-calibrated", "model": "random-search", "change_class": "architecture", "status": "keep", "kept": true, "val_score": null, "headroom": 0.4459951095436777, "params_M": 0.958051, "train_n": 2000, "rationale": "diff-recon-dcstep-unconstrained-search-tpe-calibrated: recon_ckpt=/cluster/maier/Agent4CT/checkpoints/ddpm_unconstrained_final.pt, recon_mode=dps, recon_sample_steps=200, recon_eta=8.5014, recon_init=fbp, recon_eta_clamp=True, recon_dcstep_every=3, recon_dcstep_n_cg=20, recon_dcstep_warmup=25, recon_dcstep_relax=0.85", "advice_for_others": "diff-recon-dcstep-unconstrained-search-tpe-calibrated: recon_ckpt=/cluster/maier/Agent4CT/checkpoints/ddpm_unconstrained_final.pt, recon_mode=dps, recon_sample_steps=200, recon_eta=8.5014, recon_init=fbp, recon_eta_clamp=True, recon_dcstep_every=3, recon_dcstep_n_cg=20, recon_dcstep_warmup=25, recon_dcstep_relax=0.85 -> hr=0.4460", "comparison_image": "runs/demo-intensity-calibrated-tpe-diff-recon-dcstep-unconstrained-search-20260521-01/iterations/iter-0012/comparison.png"}
{"ts": "2026-05-21T02:07:14Z", "run_id": "demo-intensity-calibrated-tpe-diff-recon-dcstep-unconstrained-search-20260521-01", "iter": 11, "agent": "diff-recon-dcstep-unconstrained-search-tpe-calibrated", "model": "random-search", "change_class": "architecture", "status": "keep", "kept": true, "val_score": null, "headroom": 0.43443747032844715, "params_M": 0.958051, "train_n": 2000, "rationale": "diff-recon-dcstep-unconstrained-search-tpe-calibrated: recon_ckpt=/cluster/maier/Agent4CT/checkpoints/ddpm_unconstrained_final.pt, recon_mode=dps, recon_sample_steps=500, recon_eta=18.368, recon_init=noise, recon_eta_clamp=False, recon_dcstep_every=4, recon_dcstep_n_cg=20, recon_dcstep_warmup=10, recon_dcstep_relax=1", "advice_for_others": "diff-recon-dcstep-unconstrained-search-tpe-calibrated: recon_ckpt=/cluster/maier/Agent4CT/checkpoints/ddpm_unconstrained_final.pt, recon_mode=dps, recon_sample_steps=500, recon_eta=18.368, recon_init=noise, recon_eta_clamp=False, recon_dcstep_every=4, recon_dcstep_n_cg=20, recon_dcstep_warmup=10, recon_dcstep_relax=1 -> hr=0.4344", "comparison_image": "runs/demo-intensity-calibrated-tpe-diff-recon-dcstep-unconstrained-search-20260521-01/iterations/iter-0011/comparison.png"}
{"ts": "2026-05-21T02:03:42Z", "run_id": "demo-intensity-calibrated-tpe-diff-recon-dcstep-constrained-search-20260521-01", "iter": 8, "agent": "diff-recon-dcstep-constrained-search-tpe-calibrated", "model": "random-search", "change_class": "architecture", "status": "keep", "kept": true, "val_score": null, "headroom": 0.4310872705471529, "params_M": 0.958051, "train_n": 200, "rationale": "diff-recon-dcstep-constrained-search-tpe-calibrated: recon_ckpt=/cluster/maier/Agent4CT/checkpoints/ddpm_constrained_final.pt, recon_mode=dps, recon_sample_steps=200, recon_eta=6.4292, recon_init=noise, recon_eta_clamp=True, recon_dcstep_every=5, recon_dcstep_n_cg=20, recon_dcstep_warmup=10, recon_dcstep_relax=1", "advice_for_others": "diff-recon-dcstep-constrained-search-tpe-calibrated: recon_ckpt=/cluster/maier/Agent4CT/checkpoints/ddpm_constrained_final.pt, recon_mode=dps, recon_sample_steps=200, recon_eta=6.4292, recon_init=noise, recon_eta_clamp=True, recon_dcstep_every=5, recon_dcstep_n_cg=20, recon_dcstep_warmup=10, recon_dcstep_relax=1 -> hr=0.4311", "comparison_image": "runs/demo-intensity-calibrated-tpe-diff-recon-dcstep-constrained-search-20260521-01/iterations/iter-0008/comparison.png"}
{"ts": "2026-05-21T02:00:34Z", "run_id": "demo-intensity-calibrated-tpe-diff-recon-dcstep-constrained-search-20260521-01", "iter": 7, "agent": "diff-recon-dcstep-constrained-search-tpe-calibrated", "model": "random-search", "change_class": "architecture", "status": "keep", "kept": true, "val_score": null, "headroom": 0.4081100153286551, "params_M": 0.958051, "train_n": 200, "rationale": "diff-recon-dcstep-constrained-search-tpe-calibrated: recon_ckpt=/cluster/maier/Agent4CT/checkpoints/ddpm_constrained_final.pt, recon_mode=dps, recon_sample_steps=800, recon_eta=3.5516, recon_init=noise, recon_eta_clamp=True, recon_dcstep_every=4, recon_dcstep_n_cg=10, recon_dcstep_warmup=10, recon_dcstep_relax=0.95", "advice_for_others": "diff-recon-dcstep-constrained-search-tpe-calibrated: recon_ckpt=/cluster/maier/Agent4CT/checkpoints/ddpm_constrained_final.pt, recon_mode=dps, recon_sample_steps=800, recon_eta=3.5516, recon_init=noise, recon_eta_clamp=True, recon_dcstep_every=4, recon_dcstep_n_cg=10, recon_dcstep_warmup=10, recon_dcstep_relax=0.95 -> hr=0.4081", "comparison_image": "runs/demo-intensity-calibrated-tpe-diff-recon-dcstep-constrained-search-20260521-01/iterations/iter-0007/comparison.png"}
{"ts": "2026-05-21T01:57:13Z", "run_id": "demo-intensity-calibrated-tpe-diff-recon-dcstep-unconstrained-search-20260521-01", "iter": 10, "agent": "diff-recon-dcstep-unconstrained-search-tpe-calibrated", "model": "random-search", "change_class": "architecture", "status": "keep", "kept": true, "val_score": null, "headroom": 0.4354215517659237, "params_M": 0.958051, "train_n": 2000, "rationale": "diff-recon-dcstep-unconstrained-search-tpe-calibrated: recon_ckpt=/cluster/maier/Agent4CT/checkpoints/ddpm_unconstrained_final.pt, recon_mode=dps, recon_sample_steps=200, recon_eta=5.2577, recon_init=fbp, recon_eta_clamp=True, recon_dcstep_every=4, recon_dcstep_n_cg=15, recon_dcstep_warmup=10, recon_dcstep_relax=1", "advice_for_others": "diff-recon-dcstep-unconstrained-search-tpe-calibrated: recon_ckpt=/cluster/maier/Agent4CT/checkpoints/ddpm_unconstrained_final.pt, recon_mode=dps, recon_sample_steps=200, recon_eta=5.2577, recon_init=fbp, recon_eta_clamp=True, recon_dcstep_every=4, recon_dcstep_n_cg=15, recon_dcstep_warmup=10, recon_dcstep_relax=1 -> hr=0.4354", "comparison_image": "runs/demo-intensity-calibrated-tpe-diff-recon-dcstep-unconstrained-search-20260521-01/iterations/iter-0010/comparison.png"}
