{"ts": "2026-06-19T09:30:32Z", "run_id": "demo-dl-claude-agentic-dual-domain-bilateral-n2i-search-20260618-01", "iter": 19, "agent": "dual_domain_bilateral_n2i-claude-agentic-breast-ct", "model": "claude-opus-4.7-1m", "change_class": "architecture", "status": "keep", "kept": true, "val_score": 0.8446478843688965, "headroom": 0.32186587844805725, "params_M": 2.4e-05, "train_n": 400, "rationale": "dual_domain_bilateral_n2i-claude-agentic: train_n=200, val_n=6, batch_size=1, grad_clip=1.0, seed=42, warm_start=True, pretrain_epochs=3, n_iter=400, outer_wall_s=1200, lr=0.0023, proj_n_bf=1, img_n_bf=7, proj_kernel=7, img_kernel=11, proj_sx=1.0, proj_sy=2.0, proj_sr=0.02, img_sx=5.5, img_sy=5.5, img_sr=0.02, rationale=iter-19: ONE knob changed vs the iter-18 WIN base (image-domain SPATIAL bilateral sigma img_sx/img_sy 4.5->5.5, BOTH x and y together = the isotropic image-domain spatial-extent sigma); all 18 other fields held IDENTICAL to demo_dl_dual_domain_bilateral_n2i_iter_18.json (img_kernel=11, img_n_bf=7, img_sr=0.02 LOOSE demo-correct, proj_n_bf=1, proj_kernel=7, proj_sx/sy=1.0/2.0, proj_sr=0.02, lr=2.3e-3, warm_start=True, pretrain_epochs=3, n_iter=400, train_n=200, val_n=6, grad_clip=1.0, seed=42 -> identical seed=42 val split, directly comparable to iter-18 SSIM 0.8401 / hr 0.3256 / PSNR 20.09). DECISIVE SATURATION TEST of the alternating sigma<->kernel ladder. Read iter-17->18 BY SSIM (the surface the spatial-smoothing thread moves; hr stays pinned ~0.325-0.333 at the 64-view-FBP noise-floor ceiling, an SSIM-only lever): iter-17 RE-LIBERATED sigma img_sx/img_sy 3.5->4.5 at kernel=9 -> SSIM 0.8284->0.8368 (+0.0084, ABOVE the 0.005 'meaningful' threshold); iter-18 widened kernel 9->11 -> SSIM 0.8368->0.8401 (+0.0033, BELOW the 0.005 threshold), hr flat 0.3251->0.3256, PSNR flat 20.08->20.09. The whole ladder trajectory: img_n_bf depth saturated SSIM/hr early; the image SPATIAL thread then climbed via alternating sigma<->kernel rungs -- SSIM 0.7796(iter6) ->0.7940(s2.5) ->0.8035(s3.5) ->0.8246(k7) ->0.8284(k9) ->0.8368(s4.5) ->0.8401(k11). The rung gains are decelerating: the sigma rungs gave +0.0144, +0.0095, +0.0084; the kernel rungs gave +0.0211, +0.0038, +0.0033. The LAST kernel rung (iter-18, +0.0033) fell BELOW the agent's own 0.005 meaningful-gain threshold -- the WINDOW lever is now exhausted. FAILURE-MODE / COUPLING DIAGNOSIS being tested: under the pre-registered ladder logic the next rung is the SIGMA (kernel just gave a sub-threshold step), but the coupling math warns this rung is near or past its substrate bound. A Gaussian of spatial sigma s needs ~+/-2s of support to be well-represented; at kernel=11 the window is +/-5px, while sigma=5.5 requests ~+/-11px (2*sigma) -- so sigma=5.5 is AGAIN window-truncated (half-window 5 < sigma 5.5), the same over-request regime that flattened iter-14. So this rung tests EXACTLY whether ANY residual sigma headroom remains inside the kernel=11 window: at kernel=9 the sigma re-lib 3.5->4.5 still paid +0.0084 because the window (then +/-4) had just been widened ahead of the sigma; here the window is only +/-5px for a requested +/-11px Gaussian, so the marginal extra averaging the window can actually deliver is small. HYPOTHESIS (img-spatial-4, ceiling-doc): widening img_sx/img_sy 4.5->5.5 at kernel=11 yields a SUB-THRESHOLD SSIM gain (<0.005) or regresses, while hr stays pinned ~0.325-0.333 and PSNR flat ~20.1 -- CONFIRMING the image-domain spatial-denoising ladder has reached the ~0.84 SSIM / ~0.33 hr substrate bound: the 6-param bilateral cannot extract more than the 64-view (half of 128) FBP noise floor allows on this synthetic phantom substrate. If instead SSIM rises meaningfully (>0.005), the sigma still has headroom even inside the +/-5px window and iter-20 would widen the kernel one final notch (11->13) to confirm the ladder is genuinely climbing rather than at its bound -- either way iter-19 cleanly resolves box-(4): does the climb continue past 0.8401 or has image-domain spatial denoising hit the ~0.84 SSIM substrate bound? Chose img_sx/img_sy 4.5->5.5 (the pre-registered ladder continuation -- the SIGMA rung, since the kernel just delivered a sub-threshold +0.0033) over (a) pushing img_kernel 11->13 NOW (the kernel rung just fell below the 0.005 threshold at iter-18 -- the window is no longer the binding lever, and widening it further with the unchanged sigma=4.5 it already mostly contains is the lowest-EV move), (b) proj_sr/proj_kernel/proj_n_bf (whole proj domain confirmed flat at iter-11/12 -- symmetry trap, wasted), (c) img_sr (exhausted + substrate-confirmed WRONG-direction -- tightening to 0.0005 collapsed hr 0.3335->0.1998 at iter-4 -- FORBIDDEN, stays LOOSE 0.02), (d) img_n_bf/n_iter/pretrain_epochs/seed/val_n (all DEAD FLAT / variance-only, exhausted), (e) grad_clip (mandatory overflow guard at 1.0, not a quality lever). Held fixed at iter-18 values: img_kernel=11, img_n_bf=7, img_sr=0.02 (LOOSE, demo-correct), proj_n_bf=1, proj_kernel=7, proj_sr=0.02, proj_sx=1.0/proj_sy=2.0, lr=2.3e-3, warm_start=True, pretrain_epochs=3, n_iter=400, train_n=200, val_n=6, grad_clip=1.0, seed=42. Wall: iter-18 ran 1045 s at img_kernel=11; img_sx/img_sy are pure init sigma values inside the fixed img_kernel=11 window -> ZERO added compute, wall ~unchanged, comfortably under the 1800 s sbatch wall and the 1200 s outer_wall_s internal guard (under the 15-min budget). PER-IMAGE bilateral N2I, AGENT4CT_DATASET=phantoms; warm_start STAYS ON; do NOT revert to amortized; do NOT tighten img_sr.", "advice_for_others": "dual_domain_bilateral_n2i-claude-agentic: train_n=200, val_n=6, batch_size=1, grad_clip=1.0, seed=42, warm_start=True, pretrain_epochs=3, n_iter=400, outer_wall_s=1200, lr=0.0023, proj_n_bf=1, img_n_bf=7, proj_kernel=7, img_kernel=11, proj_sx=1.0, proj_sy=2.0, proj_sr=0.02, img_sx=5.5, img_sy=5.5, img_sr=0.02, rationale=iter-19: ONE knob changed vs the iter-18 WIN base (image-domain SPATIAL bilateral sigma img_sx/img_sy 4.5->5.5, BOTH x and y together = the isotropic image-domain spatial-extent sigma); all 18 other fields held IDENTICAL to demo_dl_dual_domain_bilateral_n2i_iter_18.json (img_kernel=11, img_n_bf=7, img_sr=0.02 LOOSE demo-correct, proj_n_bf=1, proj_kernel=7, proj_sx/sy=1.0/2.0, proj_sr=0.02, lr=2.3e-3, warm_start=True, pretrain_epochs=3, n_iter=400, train_n=200, val_n=6, grad_clip=1.0, seed=42 -> identical seed=42 val split, directly comparable to iter-18 SSIM 0.8401 / hr 0.3256 / PSNR 20.09). DECISIVE SATURATION TEST of the alternating sigma<->kernel ladder. Read iter-17->18 BY SSIM (the surface the spatial-smoothing thread moves; hr stays pinned ~0.325-0.333 at the 64-view-FBP noise-floor ceiling, an SSIM-only lever): iter-17 RE-LIBERATED sigma img_sx/img_sy 3.5->4.5 at kernel=9 -> SSIM 0.8284->0.8368 (+0.0084, ABOVE the 0.005 'meaningful' threshold); iter-18 widened kernel 9->11 -> SSIM 0.8368->0.8401 (+0.0033, BELOW the 0.005 threshold), hr flat 0.3251->0.3256, PSNR flat 20.08->20.09. The whole ladder trajectory: img_n_bf depth saturated SSIM/hr early; the image SPATIAL thread then climbed via alternating sigma<->kernel rungs -- SSIM 0.7796(iter6) ->0.7940(s2.5) ->0.8035(s3.5) ->0.8246(k7) ->0.8284(k9) ->0.8368(s4.5) ->0.8401(k11). The rung gains are decelerating: the sigma rungs gave +0.0144, +0.0095, +0.0084; the kernel rungs gave +0.0211, +0.0038, +0.0033. The LAST kernel rung (iter-18, +0.0033) fell BELOW the agent's own 0.005 meaningful-gain threshold -- the WINDOW lever is now exhausted. FAILURE-MODE / COUPLING DIAGNOSIS being tested: under the pre-registered ladder logic the next rung is the SIGMA (kernel just gave a sub-threshold step), but the coupling math warns this rung is near or past its substrate bound. A Gaussian of spatial sigma s needs ~+/-2s of support to be well-represented; at kernel=11 the window is +/-5px, while sigma=5.5 requests ~+/-11px (2*sigma) -- so sigma=5.5 is AGAIN window-truncated (half-window 5 < sigma 5.5), the same over-request regime that flattened iter-14. So this rung tests EXACTLY whether ANY residual sigma headroom remains inside the kernel=11 window: at kernel=9 the sigma re-lib 3.5->4.5 still paid +0.0084 because the window (then +/-4) had just been widened ahead of the sigma; here the window is only +/-5px for a requested +/-11px Gaussian, so the marginal extra averaging the window can actually deliver is small. HYPOTHESIS (img-spatial-4, ceiling-doc): widening img_sx/img_sy 4.5->5.5 at kernel=11 yields a SUB-THRESHOLD SSIM gain (<0.005) or regresses, while hr stays pinned ~0.325-0.333 and PSNR flat ~20.1 -- CONFIRMING the image-domain spatial-denoising ladder has reached the ~0.84 SSIM / ~0.33 hr substrate bound: the 6-param bilateral cannot extract more than the 64-view (half of 128) FBP noise floor allows on this synthetic phantom substrate. If instead SSIM rises meaningfully (>0.005), the sigma still has headroom even inside the +/-5px window and iter-20 would widen the kernel one final notch (11->13) to confirm the ladder is genuinely climbing rather than at its bound -- either way iter-19 cleanly resolves box-(4): does the climb continue past 0.8401 or has image-domain spatial denoising hit the ~0.84 SSIM substrate bound? Chose img_sx/img_sy 4.5->5.5 (the pre-registered ladder continuation -- the SIGMA rung, since the kernel just delivered a sub-threshold +0.0033) over (a) pushing img_kernel 11->13 NOW (the kernel rung just fell below the 0.005 threshold at iter-18 -- the window is no longer the binding lever, and widening it further with the unchanged sigma=4.5 it already mostly contains is the lowest-EV move), (b) proj_sr/proj_kernel/proj_n_bf (whole proj domain confirmed flat at iter-11/12 -- symmetry trap, wasted), (c) img_sr (exhausted + substrate-confirmed WRONG-direction -- tightening to 0.0005 collapsed hr 0.3335->0.1998 at iter-4 -- FORBIDDEN, stays LOOSE 0.02), (d) img_n_bf/n_iter/pretrain_epochs/seed/val_n (all DEAD FLAT / variance-only, exhausted), (e) grad_clip (mandatory overflow guard at 1.0, not a quality lever). Held fixed at iter-18 values: img_kernel=11, img_n_bf=7, img_sr=0.02 (LOOSE, demo-correct), proj_n_bf=1, proj_kernel=7, proj_sr=0.02, proj_sx=1.0/proj_sy=2.0, lr=2.3e-3, warm_start=True, pretrain_epochs=3, n_iter=400, train_n=200, val_n=6, grad_clip=1.0, seed=42. Wall: iter-18 ran 1045 s at img_kernel=11; img_sx/img_sy are pure init sigma values inside the fixed img_kernel=11 window -> ZERO added compute, wall ~unchanged, comfortably under the 1800 s sbatch wall and the 1200 s outer_wall_s internal guard (under the 15-min budget). PER-IMAGE bilateral N2I, AGENT4CT_DATASET=phantoms; warm_start STAYS ON; do NOT revert to amortized; do NOT tighten img_sr.", "comparison_image": "runs/demo-dl-claude-agentic-dual-domain-bilateral-n2i-search-20260618-01/iterations/iter-0019/comparison.png"}
