{"ts": "2026-05-21T00:51:23Z", "run_id": "demo-intensity-calibrated-tpe-ram-zeroshot-search-20260521-01", "iter": 20, "agent": "ram-zeroshot-search-tpe-calibrated", "model": "random-search", "change_class": "architecture", "status": "keep", "kept": true, "val_score": null, "headroom": 0.4628365402708974, "params_M": 35.618953, "train_n": 0, "rationale": "ram-zeroshot-search-tpe-calibrated: ram_ckpt_path=/cluster/maier/Agent4CT/checkpoints/ram.pth.tar, ram_input_norm=adjoint_max, ram_clamp_output=True, ram_finetune=False, ram_finetune_epochs=0, ram_finetune_lr=0.0001, ram_disable_multiscale=False, ram_disable_cudnn=False, ram_use_deepinv_tomo=False, ram_sigma=0.10452, ram_factor=0.47137, ram_post_fbp_blend=0.10677", "advice_for_others": "ram-zeroshot-search-tpe-calibrated: ram_ckpt_path=/cluster/maier/Agent4CT/checkpoints/ram.pth.tar, ram_input_norm=adjoint_max, ram_clamp_output=True, ram_finetune=False, ram_finetune_epochs=0, ram_finetune_lr=0.0001, ram_disable_multiscale=False, ram_disable_cudnn=False, ram_use_deepinv_tomo=False, ram_sigma=0.10452, ram_factor=0.47137, ram_post_fbp_blend=0.10677 -> hr=0.4628", "comparison_image": "runs/demo-intensity-calibrated-tpe-ram-zeroshot-search-20260521-01/iterations/iter-0020/comparison.png"}
{"ts": "2026-05-21T00:50:59Z", "run_id": "demo-intensity-calibrated-tpe-ram-zeroshot-search-20260521-01", "iter": 19, "agent": "ram-zeroshot-search-tpe-calibrated", "model": "random-search", "change_class": "architecture", "status": "keep", "kept": true, "val_score": null, "headroom": 0.4606843614900784, "params_M": 35.618953, "train_n": 0, "rationale": "ram-zeroshot-search-tpe-calibrated: ram_ckpt_path=/cluster/maier/Agent4CT/checkpoints/ram.pth.tar, ram_input_norm=adjoint_max, ram_clamp_output=True, ram_finetune=False, ram_finetune_epochs=0, ram_finetune_lr=0.0001, ram_disable_multiscale=False, ram_disable_cudnn=False, ram_use_deepinv_tomo=False, ram_sigma=0.1008, ram_factor=0.39514, ram_post_fbp_blend=0.086324", "advice_for_others": "ram-zeroshot-search-tpe-calibrated: ram_ckpt_path=/cluster/maier/Agent4CT/checkpoints/ram.pth.tar, ram_input_norm=adjoint_max, ram_clamp_output=True, ram_finetune=False, ram_finetune_epochs=0, ram_finetune_lr=0.0001, ram_disable_multiscale=False, ram_disable_cudnn=False, ram_use_deepinv_tomo=False, ram_sigma=0.1008, ram_factor=0.39514, ram_post_fbp_blend=0.086324 -> hr=0.4607", "comparison_image": "runs/demo-intensity-calibrated-tpe-ram-zeroshot-search-20260521-01/iterations/iter-0019/comparison.png"}
{"ts": "2026-05-21T00:50:36Z", "run_id": "demo-intensity-calibrated-tpe-ram-zeroshot-search-20260521-01", "iter": 18, "agent": "ram-zeroshot-search-tpe-calibrated", "model": "random-search", "change_class": "architecture", "status": "keep", "kept": true, "val_score": null, "headroom": 0.45746041099461554, "params_M": 35.618953, "train_n": 0, "rationale": "ram-zeroshot-search-tpe-calibrated: ram_ckpt_path=/cluster/maier/Agent4CT/checkpoints/ram.pth.tar, ram_input_norm=adjoint_max, ram_clamp_output=True, ram_finetune=False, ram_finetune_epochs=0, ram_finetune_lr=0.0001, ram_disable_multiscale=False, ram_disable_cudnn=False, ram_use_deepinv_tomo=False, ram_sigma=0.06981, ram_factor=0.30919, ram_post_fbp_blend=0.16388", "advice_for_others": "ram-zeroshot-search-tpe-calibrated: ram_ckpt_path=/cluster/maier/Agent4CT/checkpoints/ram.pth.tar, ram_input_norm=adjoint_max, ram_clamp_output=True, ram_finetune=False, ram_finetune_epochs=0, ram_finetune_lr=0.0001, ram_disable_multiscale=False, ram_disable_cudnn=False, ram_use_deepinv_tomo=False, ram_sigma=0.06981, ram_factor=0.30919, ram_post_fbp_blend=0.16388 -> hr=0.4575", "comparison_image": "runs/demo-intensity-calibrated-tpe-ram-zeroshot-search-20260521-01/iterations/iter-0018/comparison.png"}
{"ts": "2026-05-21T00:50:13Z", "run_id": "demo-intensity-calibrated-tpe-ram-zeroshot-search-20260521-01", "iter": 17, "agent": "ram-zeroshot-search-tpe-calibrated", "model": "random-search", "change_class": "architecture", "status": "keep", "kept": true, "val_score": null, "headroom": 0.45200067776769026, "params_M": 35.618953, "train_n": 0, "rationale": "ram-zeroshot-search-tpe-calibrated: ram_ckpt_path=/cluster/maier/Agent4CT/checkpoints/ram.pth.tar, ram_input_norm=adjoint_max, ram_clamp_output=True, ram_finetune=False, ram_finetune_epochs=0, ram_finetune_lr=0.0001, ram_disable_multiscale=False, ram_disable_cudnn=False, ram_use_deepinv_tomo=False, ram_sigma=0.050391, ram_factor=0.39719, ram_post_fbp_blend=0.11163", "advice_for_others": "ram-zeroshot-search-tpe-calibrated: ram_ckpt_path=/cluster/maier/Agent4CT/checkpoints/ram.pth.tar, ram_input_norm=adjoint_max, ram_clamp_output=True, ram_finetune=False, ram_finetune_epochs=0, ram_finetune_lr=0.0001, ram_disable_multiscale=False, ram_disable_cudnn=False, ram_use_deepinv_tomo=False, ram_sigma=0.050391, ram_factor=0.39719, ram_post_fbp_blend=0.11163 -> hr=0.4520", "comparison_image": "runs/demo-intensity-calibrated-tpe-ram-zeroshot-search-20260521-01/iterations/iter-0017/comparison.png"}
{"ts": "2026-05-21T00:49:50Z", "run_id": "demo-intensity-calibrated-tpe-ram-zeroshot-search-20260521-01", "iter": 16, "agent": "ram-zeroshot-search-tpe-calibrated", "model": "random-search", "change_class": "architecture", "status": "keep", "kept": true, "val_score": null, "headroom": 0.46477399523603546, "params_M": 35.618953, "train_n": 0, "rationale": "ram-zeroshot-search-tpe-calibrated: ram_ckpt_path=/cluster/maier/Agent4CT/checkpoints/ram.pth.tar, ram_input_norm=adjoint_max, ram_clamp_output=True, ram_finetune=False, ram_finetune_epochs=0, ram_finetune_lr=0.0001, ram_disable_multiscale=False, ram_disable_cudnn=False, ram_use_deepinv_tomo=False, ram_sigma=0.075062, ram_factor=0.42335, ram_post_fbp_blend=0.10573", "advice_for_others": "ram-zeroshot-search-tpe-calibrated: ram_ckpt_path=/cluster/maier/Agent4CT/checkpoints/ram.pth.tar, ram_input_norm=adjoint_max, ram_clamp_output=True, ram_finetune=False, ram_finetune_epochs=0, ram_finetune_lr=0.0001, ram_disable_multiscale=False, ram_disable_cudnn=False, ram_use_deepinv_tomo=False, ram_sigma=0.075062, ram_factor=0.42335, ram_post_fbp_blend=0.10573 -> hr=0.4648", "comparison_image": "runs/demo-intensity-calibrated-tpe-ram-zeroshot-search-20260521-01/iterations/iter-0016/comparison.png"}
{"ts": "2026-05-21T00:49:27Z", "run_id": "demo-intensity-calibrated-tpe-ram-zeroshot-search-20260521-01", "iter": 15, "agent": "ram-zeroshot-search-tpe-calibrated", "model": "random-search", "change_class": "architecture", "status": "keep", "kept": true, "val_score": null, "headroom": 0.4634475450941494, "params_M": 35.618953, "train_n": 0, "rationale": "ram-zeroshot-search-tpe-calibrated: ram_ckpt_path=/cluster/maier/Agent4CT/checkpoints/ram.pth.tar, ram_input_norm=adjoint_max, ram_clamp_output=True, ram_finetune=False, ram_finetune_epochs=0, ram_finetune_lr=0.0001, ram_disable_multiscale=False, ram_disable_cudnn=False, ram_use_deepinv_tomo=False, ram_sigma=0.10125, ram_factor=0.43053, ram_post_fbp_blend=0.11731", "advice_for_others": "ram-zeroshot-search-tpe-calibrated: ram_ckpt_path=/cluster/maier/Agent4CT/checkpoints/ram.pth.tar, ram_input_norm=adjoint_max, ram_clamp_output=True, ram_finetune=False, ram_finetune_epochs=0, ram_finetune_lr=0.0001, ram_disable_multiscale=False, ram_disable_cudnn=False, ram_use_deepinv_tomo=False, ram_sigma=0.10125, ram_factor=0.43053, ram_post_fbp_blend=0.11731 -> hr=0.4634", "comparison_image": "runs/demo-intensity-calibrated-tpe-ram-zeroshot-search-20260521-01/iterations/iter-0015/comparison.png"}
{"ts": "2026-05-21T00:49:04Z", "run_id": "demo-intensity-calibrated-tpe-ram-zeroshot-search-20260521-01", "iter": 14, "agent": "ram-zeroshot-search-tpe-calibrated", "model": "random-search", "change_class": "architecture", "status": "keep", "kept": true, "val_score": null, "headroom": 0.42402390024716863, "params_M": 35.618953, "train_n": 0, "rationale": "ram-zeroshot-search-tpe-calibrated: ram_ckpt_path=/cluster/maier/Agent4CT/checkpoints/ram.pth.tar, ram_input_norm=adjoint_max, ram_clamp_output=True, ram_finetune=False, ram_finetune_epochs=0, ram_finetune_lr=0.0001, ram_disable_multiscale=True, ram_disable_cudnn=False, ram_use_deepinv_tomo=False, ram_sigma=0.29831, ram_factor=0.60926, ram_post_fbp_blend=0.050022", "advice_for_others": "ram-zeroshot-search-tpe-calibrated: ram_ckpt_path=/cluster/maier/Agent4CT/checkpoints/ram.pth.tar, ram_input_norm=adjoint_max, ram_clamp_output=True, ram_finetune=False, ram_finetune_epochs=0, ram_finetune_lr=0.0001, ram_disable_multiscale=True, ram_disable_cudnn=False, ram_use_deepinv_tomo=False, ram_sigma=0.29831, ram_factor=0.60926, ram_post_fbp_blend=0.050022 -> hr=0.4240", "comparison_image": "runs/demo-intensity-calibrated-tpe-ram-zeroshot-search-20260521-01/iterations/iter-0014/comparison.png"}
{"ts": "2026-05-21T00:48:42Z", "run_id": "demo-intensity-calibrated-tpe-ram-zeroshot-search-20260521-01", "iter": 13, "agent": "ram-zeroshot-search-tpe-calibrated", "model": "random-search", "change_class": "architecture", "status": "keep", "kept": true, "val_score": null, "headroom": 0.45270834697375184, "params_M": 35.618953, "train_n": 0, "rationale": "ram-zeroshot-search-tpe-calibrated: ram_ckpt_path=/cluster/maier/Agent4CT/checkpoints/ram.pth.tar, ram_input_norm=adjoint_max, ram_clamp_output=True, ram_finetune=False, ram_finetune_epochs=0, ram_finetune_lr=0.0001, ram_disable_multiscale=True, ram_disable_cudnn=False, ram_use_deepinv_tomo=False, ram_sigma=0.16845, ram_factor=0.53005, ram_post_fbp_blend=0.13819", "advice_for_others": "ram-zeroshot-search-tpe-calibrated: ram_ckpt_path=/cluster/maier/Agent4CT/checkpoints/ram.pth.tar, ram_input_norm=adjoint_max, ram_clamp_output=True, ram_finetune=False, ram_finetune_epochs=0, ram_finetune_lr=0.0001, ram_disable_multiscale=True, ram_disable_cudnn=False, ram_use_deepinv_tomo=False, ram_sigma=0.16845, ram_factor=0.53005, ram_post_fbp_blend=0.13819 -> hr=0.4527", "comparison_image": "runs/demo-intensity-calibrated-tpe-ram-zeroshot-search-20260521-01/iterations/iter-0013/comparison.png"}
{"ts": "2026-05-21T00:48:18Z", "run_id": "demo-intensity-calibrated-tpe-ram-zeroshot-search-20260521-01", "iter": 12, "agent": "ram-zeroshot-search-tpe-calibrated", "model": "random-search", "change_class": "architecture", "status": "keep", "kept": true, "val_score": null, "headroom": 0.4564673455685524, "params_M": 35.618953, "train_n": 0, "rationale": "ram-zeroshot-search-tpe-calibrated: ram_ckpt_path=/cluster/maier/Agent4CT/checkpoints/ram.pth.tar, ram_input_norm=adjoint_max, ram_clamp_output=True, ram_finetune=False, ram_finetune_epochs=0, ram_finetune_lr=0.0001, ram_disable_multiscale=True, ram_disable_cudnn=False, ram_use_deepinv_tomo=False, ram_sigma=0.13433, ram_factor=0.55093, ram_post_fbp_blend=0.13688", "advice_for_others": "ram-zeroshot-search-tpe-calibrated: ram_ckpt_path=/cluster/maier/Agent4CT/checkpoints/ram.pth.tar, ram_input_norm=adjoint_max, ram_clamp_output=True, ram_finetune=False, ram_finetune_epochs=0, ram_finetune_lr=0.0001, ram_disable_multiscale=True, ram_disable_cudnn=False, ram_use_deepinv_tomo=False, ram_sigma=0.13433, ram_factor=0.55093, ram_post_fbp_blend=0.13688 -> hr=0.4565", "comparison_image": "runs/demo-intensity-calibrated-tpe-ram-zeroshot-search-20260521-01/iterations/iter-0012/comparison.png"}
{"ts": "2026-05-21T00:48:13Z", "run_id": "demo-intensity-calibrated-tpe-hammernik-vn-search-20260520-01", "iter": 17, "agent": "hammernik-vn-search-tpe-calibrated", "model": "random-search", "change_class": "architecture", "status": "keep", "kept": true, "val_score": null, "headroom": 0.35817457017730825, "params_M": 0.005379, "train_n": 200, "rationale": "hammernik-vn-search-tpe-calibrated: epochs=14, lr=0.00014028, batch_size=2, vn_T=3, vn_n_filters=16, vn_kernel=9, vn_lambda_init=0.00010831, vn_init=fbp", "advice_for_others": "hammernik-vn-search-tpe-calibrated: epochs=14, lr=0.00014028, batch_size=2, vn_T=3, vn_n_filters=16, vn_kernel=9, vn_lambda_init=0.00010831, vn_init=fbp -> hr=0.3582", "comparison_image": "runs/demo-intensity-calibrated-tpe-hammernik-vn-search-20260520-01/iterations/iter-0017/comparison.png"}
{"ts": "2026-05-21T00:47:55Z", "run_id": "demo-intensity-calibrated-tpe-ram-zeroshot-search-20260521-01", "iter": 11, "agent": "ram-zeroshot-search-tpe-calibrated", "model": "random-search", "change_class": "architecture", "status": "keep", "kept": true, "val_score": null, "headroom": 0.4546757464165869, "params_M": 35.618953, "train_n": 0, "rationale": "ram-zeroshot-search-tpe-calibrated: ram_ckpt_path=/cluster/maier/Agent4CT/checkpoints/ram.pth.tar, ram_input_norm=adjoint_max, ram_clamp_output=True, ram_finetune=False, ram_finetune_epochs=0, ram_finetune_lr=0.0001, ram_disable_multiscale=True, ram_disable_cudnn=False, ram_use_deepinv_tomo=False, ram_sigma=0.16088, ram_factor=0.42769, ram_post_fbp_blend=0.19813", "advice_for_others": "ram-zeroshot-search-tpe-calibrated: ram_ckpt_path=/cluster/maier/Agent4CT/checkpoints/ram.pth.tar, ram_input_norm=adjoint_max, ram_clamp_output=True, ram_finetune=False, ram_finetune_epochs=0, ram_finetune_lr=0.0001, ram_disable_multiscale=True, ram_disable_cudnn=False, ram_use_deepinv_tomo=False, ram_sigma=0.16088, ram_factor=0.42769, ram_post_fbp_blend=0.19813 -> hr=0.4547", "comparison_image": "runs/demo-intensity-calibrated-tpe-ram-zeroshot-search-20260521-01/iterations/iter-0011/comparison.png"}
{"ts": "2026-05-21T00:47:32Z", "run_id": "demo-intensity-calibrated-tpe-ram-zeroshot-search-20260521-01", "iter": 10, "agent": "ram-zeroshot-search-tpe-calibrated", "model": "random-search", "change_class": "architecture", "status": "keep", "kept": true, "val_score": null, "headroom": 0.3914395826985706, "params_M": 35.618953, "train_n": 0, "rationale": "ram-zeroshot-search-tpe-calibrated: ram_ckpt_path=/cluster/maier/Agent4CT/checkpoints/ram.pth.tar, ram_input_norm=adjoint_max, ram_clamp_output=True, ram_finetune=False, ram_finetune_epochs=0, ram_finetune_lr=0.0001, ram_disable_multiscale=False, ram_disable_cudnn=False, ram_use_deepinv_tomo=False, ram_sigma=0.088705, ram_factor=0.79603, ram_post_fbp_blend=0.12548", "advice_for_others": "ram-zeroshot-search-tpe-calibrated: ram_ckpt_path=/cluster/maier/Agent4CT/checkpoints/ram.pth.tar, ram_input_norm=adjoint_max, ram_clamp_output=True, ram_finetune=False, ram_finetune_epochs=0, ram_finetune_lr=0.0001, ram_disable_multiscale=False, ram_disable_cudnn=False, ram_use_deepinv_tomo=False, ram_sigma=0.088705, ram_factor=0.79603, ram_post_fbp_blend=0.12548 -> hr=0.3914", "comparison_image": "runs/demo-intensity-calibrated-tpe-ram-zeroshot-search-20260521-01/iterations/iter-0010/comparison.png"}
{"ts": "2026-05-21T00:47:08Z", "run_id": "demo-intensity-calibrated-tpe-ram-zeroshot-search-20260521-01", "iter": 9, "agent": "ram-zeroshot-search-tpe-calibrated", "model": "random-search", "change_class": "architecture", "status": "keep", "kept": true, "val_score": null, "headroom": 0.4519182337896408, "params_M": 35.618953, "train_n": 0, "rationale": "ram-zeroshot-search-tpe-calibrated: ram_ckpt_path=/cluster/maier/Agent4CT/checkpoints/ram.pth.tar, ram_input_norm=adjoint_max, ram_clamp_output=True, ram_finetune=False, ram_finetune_epochs=0, ram_finetune_lr=0.0001, ram_disable_multiscale=True, ram_disable_cudnn=False, ram_use_deepinv_tomo=False, ram_sigma=0.059832, ram_factor=0.44252, ram_post_fbp_blend=0.054446", "advice_for_others": "ram-zeroshot-search-tpe-calibrated: ram_ckpt_path=/cluster/maier/Agent4CT/checkpoints/ram.pth.tar, ram_input_norm=adjoint_max, ram_clamp_output=True, ram_finetune=False, ram_finetune_epochs=0, ram_finetune_lr=0.0001, ram_disable_multiscale=True, ram_disable_cudnn=False, ram_use_deepinv_tomo=False, ram_sigma=0.059832, ram_factor=0.44252, ram_post_fbp_blend=0.054446 -> hr=0.4519", "comparison_image": "runs/demo-intensity-calibrated-tpe-ram-zeroshot-search-20260521-01/iterations/iter-0009/comparison.png"}
{"ts": "2026-05-21T00:46:45Z", "run_id": "demo-intensity-calibrated-tpe-ram-zeroshot-search-20260521-01", "iter": 8, "agent": "ram-zeroshot-search-tpe-calibrated", "model": "random-search", "change_class": "architecture", "status": "keep", "kept": true, "val_score": null, "headroom": 0.44825925060958705, "params_M": 35.618953, "train_n": 0, "rationale": "ram-zeroshot-search-tpe-calibrated: ram_ckpt_path=/cluster/maier/Agent4CT/checkpoints/ram.pth.tar, ram_input_norm=adjoint_max, ram_clamp_output=True, ram_finetune=False, ram_finetune_epochs=0, ram_finetune_lr=0.0001, ram_disable_multiscale=False, ram_disable_cudnn=False, ram_use_deepinv_tomo=False, ram_sigma=0.12734, ram_factor=0.63056, ram_post_fbp_blend=0.092712", "advice_for_others": "ram-zeroshot-search-tpe-calibrated: ram_ckpt_path=/cluster/maier/Agent4CT/checkpoints/ram.pth.tar, ram_input_norm=adjoint_max, ram_clamp_output=True, ram_finetune=False, ram_finetune_epochs=0, ram_finetune_lr=0.0001, ram_disable_multiscale=False, ram_disable_cudnn=False, ram_use_deepinv_tomo=False, ram_sigma=0.12734, ram_factor=0.63056, ram_post_fbp_blend=0.092712 -> hr=0.4483", "comparison_image": "runs/demo-intensity-calibrated-tpe-ram-zeroshot-search-20260521-01/iterations/iter-0008/comparison.png"}
{"ts": "2026-05-21T00:46:22Z", "run_id": "demo-intensity-calibrated-tpe-ram-zeroshot-search-20260521-01", "iter": 7, "agent": "ram-zeroshot-search-tpe-calibrated", "model": "random-search", "change_class": "architecture", "status": "keep", "kept": true, "val_score": null, "headroom": 0.4585500978415402, "params_M": 35.618953, "train_n": 0, "rationale": "ram-zeroshot-search-tpe-calibrated: ram_ckpt_path=/cluster/maier/Agent4CT/checkpoints/ram.pth.tar, ram_input_norm=adjoint_max, ram_clamp_output=True, ram_finetune=False, ram_finetune_epochs=0, ram_finetune_lr=0.0001, ram_disable_multiscale=True, ram_disable_cudnn=False, ram_use_deepinv_tomo=False, ram_sigma=0.1349, ram_factor=0.51392, ram_post_fbp_blend=0.14276", "advice_for_others": "ram-zeroshot-search-tpe-calibrated: ram_ckpt_path=/cluster/maier/Agent4CT/checkpoints/ram.pth.tar, ram_input_norm=adjoint_max, ram_clamp_output=True, ram_finetune=False, ram_finetune_epochs=0, ram_finetune_lr=0.0001, ram_disable_multiscale=True, ram_disable_cudnn=False, ram_use_deepinv_tomo=False, ram_sigma=0.1349, ram_factor=0.51392, ram_post_fbp_blend=0.14276 -> hr=0.4586", "comparison_image": "runs/demo-intensity-calibrated-tpe-ram-zeroshot-search-20260521-01/iterations/iter-0007/comparison.png"}
{"ts": "2026-05-21T00:45:58Z", "run_id": "demo-intensity-calibrated-tpe-ram-zeroshot-search-20260521-01", "iter": 6, "agent": "ram-zeroshot-search-tpe-calibrated", "model": "random-search", "change_class": "architecture", "status": "keep", "kept": true, "val_score": null, "headroom": 0.3996615543667126, "params_M": 35.618953, "train_n": 0, "rationale": "ram-zeroshot-search-tpe-calibrated: ram_ckpt_path=/cluster/maier/Agent4CT/checkpoints/ram.pth.tar, ram_input_norm=adjoint_max, ram_clamp_output=True, ram_finetune=False, ram_finetune_epochs=0, ram_finetune_lr=0.0001, ram_disable_multiscale=True, ram_disable_cudnn=False, ram_use_deepinv_tomo=False, ram_sigma=0.056943, ram_factor=0.61706, ram_post_fbp_blend=0.17442", "advice_for_others": "ram-zeroshot-search-tpe-calibrated: ram_ckpt_path=/cluster/maier/Agent4CT/checkpoints/ram.pth.tar, ram_input_norm=adjoint_max, ram_clamp_output=True, ram_finetune=False, ram_finetune_epochs=0, ram_finetune_lr=0.0001, ram_disable_multiscale=True, ram_disable_cudnn=False, ram_use_deepinv_tomo=False, ram_sigma=0.056943, ram_factor=0.61706, ram_post_fbp_blend=0.17442 -> hr=0.3997", "comparison_image": "runs/demo-intensity-calibrated-tpe-ram-zeroshot-search-20260521-01/iterations/iter-0006/comparison.png"}
{"ts": "2026-05-21T00:45:35Z", "run_id": "demo-intensity-calibrated-tpe-ram-zeroshot-search-20260521-01", "iter": 5, "agent": "ram-zeroshot-search-tpe-calibrated", "model": "random-search", "change_class": "architecture", "status": "keep", "kept": true, "val_score": null, "headroom": 0.4581226264597825, "params_M": 35.618953, "train_n": 0, "rationale": "ram-zeroshot-search-tpe-calibrated: ram_ckpt_path=/cluster/maier/Agent4CT/checkpoints/ram.pth.tar, ram_input_norm=adjoint_max, ram_clamp_output=True, ram_finetune=False, ram_finetune_epochs=0, ram_finetune_lr=0.0001, ram_disable_multiscale=False, ram_disable_cudnn=False, ram_use_deepinv_tomo=False, ram_sigma=0.075342, ram_factor=0.341, ram_post_fbp_blend=0.041351", "advice_for_others": "ram-zeroshot-search-tpe-calibrated: ram_ckpt_path=/cluster/maier/Agent4CT/checkpoints/ram.pth.tar, ram_input_norm=adjoint_max, ram_clamp_output=True, ram_finetune=False, ram_finetune_epochs=0, ram_finetune_lr=0.0001, ram_disable_multiscale=False, ram_disable_cudnn=False, ram_use_deepinv_tomo=False, ram_sigma=0.075342, ram_factor=0.341, ram_post_fbp_blend=0.041351 -> hr=0.4581", "comparison_image": "runs/demo-intensity-calibrated-tpe-ram-zeroshot-search-20260521-01/iterations/iter-0005/comparison.png"}
