{"ts": "2026-06-19T08:45:01Z", "run_id": "demo-dl-claude-agentic-dual-domain-bilateral-n2i-search-20260618-01", "iter": 17, "agent": "dual_domain_bilateral_n2i-claude-agentic-breast-ct", "model": "claude-opus-4.7-1m", "change_class": "architecture", "status": "keep", "kept": true, "val_score": 0.8367506861686707, "headroom": 0.3251101683791423, "params_M": 2.4e-05, "train_n": 400, "rationale": "dual_domain_bilateral_n2i-claude-agentic: train_n=200, val_n=6, batch_size=1, grad_clip=1.0, seed=42, warm_start=True, pretrain_epochs=3, n_iter=400, outer_wall_s=1200, lr=0.0023, proj_n_bf=1, img_n_bf=7, proj_kernel=7, img_kernel=9, proj_sx=1.0, proj_sy=2.0, proj_sr=0.02, img_sx=4.5, img_sy=4.5, img_sr=0.02, rationale=iter-17: ONE knob changed vs the iter-16 base (image-domain SPATIAL bilateral sigma img_sx/img_sy 3.5->4.5, BOTH x and y together = the isotropic image-domain spatial-extent sigma); all 18 other fields held IDENTICAL to demo_dl_dual_domain_bilateral_n2i_iter_16.json (img_kernel=9, img_n_bf=7, img_sr=0.02 LOOSE demo-correct, proj_n_bf=1, proj_kernel=7, proj_sx/sy=1.0/2.0, proj_sr=0.02, lr=2.3e-3, warm_start=True, pretrain_epochs=3, n_iter=400, train_n=200, val_n=6, grad_clip=1.0, seed=42 -> identical seed=42 val split, directly comparable to iter-16 SSIM 0.8284 / hr 0.3283 / PSNR 20.12). THE PRE-REGISTERED iter-17 STEP: RE-LIBERATE THE NOW-UNLOCKED SIGMA. Read iter-15->16 BY SSIM (the surface the spatial-smoothing thread moves; hr stays pinned ~0.328-0.332 at the 64-view-FBP noise-floor ceiling): the kernel-widening thread is now in clear diminishing returns -- iter-15 img_kernel 5->7 gave SSIM 0.8035->0.8246 (+0.0211), but iter-16 img_kernel 7->9 gave only 0.8246->0.8284 (+0.0038, the gains shrank ~5x). FAILURE MODE / COUPLING DIAGNOSIS: across iter-13/14/15/16 the spatial-smoothing thread alternated tuning the continuous spatial SIGMA (img_sx/img_sy) and the discrete WINDOW (img_kernel), always raising whichever was the binding constraint. The sigma was last raised to 3.5 at iter-14 (inside a kernel=5 window) where it became WINDOW-CAPPED; iter-15/16 then widened the window 5->7->9. At kernel=9 the window is now +/-4px, so it can finally represent a Gaussian of sigma up to ~4 (since ~2*sigma=8px=full window) -- meaning the sigma=3.5 is no longer the binding constraint and there is fresh sigma headroom the window now admits. The kernel thread saturating (+0.0038) is the signal that the WINDOW is no longer the limiter; the live lever flips back to the SIGMA. HYPOTHESIS (img-spatial-3, sigma re-liberation): widening img_sx/img_sy 3.5->4.5 now that kernel=9 (+/-4px) admits a wider Gaussian lets each of the 7 image BFs average over the larger neighborhood the wider window permits, smoothing the broad post-FBP noise floor more (the demo-relevant axis since the spatial thread is the SSIM lever) while the unchanged LOOSE img_sr=0.02 keeps it edge-preserving -> may lift SSIM past iter-16 0.8284 on the SAME seed=42 split. Expect hr to stay pinned ~0.328-0.332 (this whole spatial thread is an SSIM-only structural-similarity lever bounded by the 64-view-FBP noise floor -- hr flat across iter-13/14/15/16). NOTE the coupling caution: at kernel=9 the +/-4px half-window is itself only marginally larger than sigma=4.5, so sigma=4.5 is again near the new window edge -- this iter tests whether the re-liberated sigma still has headroom inside the kernel=9 window or whether the spatial-smoothing thread has SATURATED (SSIM gain <0.005). If SSIM rises meaningfully, the sigma still has headroom and the alternating sigma<->kernel ladder continues (iter-18 would widen kernel 9->11); if SSIM SATURATES or regresses (gain <0.005), the image-domain spatial denoising is exhausted at the ~0.83 SSIM / ~0.33 hr substrate ceiling -- the 6-param bilateral cannot extract more than the 64-view (half of 128) FBP noise floor allows on this synthetic phantom substrate -- a clean ceiling-doc result toward iter-20. Chose img_sx/img_sy 3.5->4.5 (the EXPLICITLY pre-registered iter-16 next step -- 'iter-17 would then RE-LIBERATE the sigma img_sx/img_sy 3.5->4.5, now that kernel=9 admits a wider sigma') over (a) pushing img_kernel 9->11 (the kernel thread just saturated at +0.0038, and at kernel=9 the window already exceeds the current sigma=3.5, so the window is no longer the binding constraint -- widening it further with an unchanged sigma would be a wasted move; re-liberate the sigma the larger window now admits FIRST), (b) proj_sr/proj_kernel/proj_n_bf (whole proj domain confirmed flat at iter-11/12 -- symmetry trap, wasted), (c) img_sr (exhausted + substrate-confirmed WRONG-direction -- tightening to 0.0005 collapsed hr 0.3335->0.1998 at iter-4 -- FORBIDDEN, stays LOOSE 0.02), (d) img_n_bf/n_iter/pretrain_epochs/seed/val_n (all DEAD FLAT / variance-only, exhausted), (e) grad_clip (mandatory overflow guard at 1.0, not a quality lever). Held fixed at iter-16 values: img_kernel=9, img_n_bf=7, img_sr=0.02 (LOOSE, demo-correct), proj_n_bf=1, proj_kernel=7, proj_sr=0.02, proj_sx=1.0/proj_sy=2.0, lr=2.3e-3, warm_start=True, pretrain_epochs=3, n_iter=400, train_n=200, val_n=6, grad_clip=1.0, seed=42. Wall: iter-16 ran 762 s at img_kernel=9; img_sx/img_sy are pure init sigma values inside the fixed img_kernel=9 window -> ZERO added compute, wall ~unchanged, comfortably under the 1800 s sbatch wall and the 1200 s outer_wall_s internal guard (under the 15-min budget). PER-IMAGE bilateral N2I, AGENT4CT_DATASET=phantoms; warm_start STAYS ON; do NOT revert to amortized; do NOT tighten img_sr.", "advice_for_others": "dual_domain_bilateral_n2i-claude-agentic: train_n=200, val_n=6, batch_size=1, grad_clip=1.0, seed=42, warm_start=True, pretrain_epochs=3, n_iter=400, outer_wall_s=1200, lr=0.0023, proj_n_bf=1, img_n_bf=7, proj_kernel=7, img_kernel=9, proj_sx=1.0, proj_sy=2.0, proj_sr=0.02, img_sx=4.5, img_sy=4.5, img_sr=0.02, rationale=iter-17: ONE knob changed vs the iter-16 base (image-domain SPATIAL bilateral sigma img_sx/img_sy 3.5->4.5, BOTH x and y together = the isotropic image-domain spatial-extent sigma); all 18 other fields held IDENTICAL to demo_dl_dual_domain_bilateral_n2i_iter_16.json (img_kernel=9, img_n_bf=7, img_sr=0.02 LOOSE demo-correct, proj_n_bf=1, proj_kernel=7, proj_sx/sy=1.0/2.0, proj_sr=0.02, lr=2.3e-3, warm_start=True, pretrain_epochs=3, n_iter=400, train_n=200, val_n=6, grad_clip=1.0, seed=42 -> identical seed=42 val split, directly comparable to iter-16 SSIM 0.8284 / hr 0.3283 / PSNR 20.12). THE PRE-REGISTERED iter-17 STEP: RE-LIBERATE THE NOW-UNLOCKED SIGMA. Read iter-15->16 BY SSIM (the surface the spatial-smoothing thread moves; hr stays pinned ~0.328-0.332 at the 64-view-FBP noise-floor ceiling): the kernel-widening thread is now in clear diminishing returns -- iter-15 img_kernel 5->7 gave SSIM 0.8035->0.8246 (+0.0211), but iter-16 img_kernel 7->9 gave only 0.8246->0.8284 (+0.0038, the gains shrank ~5x). FAILURE MODE / COUPLING DIAGNOSIS: across iter-13/14/15/16 the spatial-smoothing thread alternated tuning the continuous spatial SIGMA (img_sx/img_sy) and the discrete WINDOW (img_kernel), always raising whichever was the binding constraint. The sigma was last raised to 3.5 at iter-14 (inside a kernel=5 window) where it became WINDOW-CAPPED; iter-15/16 then widened the window 5->7->9. At kernel=9 the window is now +/-4px, so it can finally represent a Gaussian of sigma up to ~4 (since ~2*sigma=8px=full window) -- meaning the sigma=3.5 is no longer the binding constraint and there is fresh sigma headroom the window now admits. The kernel thread saturating (+0.0038) is the signal that the WINDOW is no longer the limiter; the live lever flips back to the SIGMA. HYPOTHESIS (img-spatial-3, sigma re-liberation): widening img_sx/img_sy 3.5->4.5 now that kernel=9 (+/-4px) admits a wider Gaussian lets each of the 7 image BFs average over the larger neighborhood the wider window permits, smoothing the broad post-FBP noise floor more (the demo-relevant axis since the spatial thread is the SSIM lever) while the unchanged LOOSE img_sr=0.02 keeps it edge-preserving -> may lift SSIM past iter-16 0.8284 on the SAME seed=42 split. Expect hr to stay pinned ~0.328-0.332 (this whole spatial thread is an SSIM-only structural-similarity lever bounded by the 64-view-FBP noise floor -- hr flat across iter-13/14/15/16). NOTE the coupling caution: at kernel=9 the +/-4px half-window is itself only marginally larger than sigma=4.5, so sigma=4.5 is again near the new window edge -- this iter tests whether the re-liberated sigma still has headroom inside the kernel=9 window or whether the spatial-smoothing thread has SATURATED (SSIM gain <0.005). If SSIM rises meaningfully, the sigma still has headroom and the alternating sigma<->kernel ladder continues (iter-18 would widen kernel 9->11); if SSIM SATURATES or regresses (gain <0.005), the image-domain spatial denoising is exhausted at the ~0.83 SSIM / ~0.33 hr substrate ceiling -- the 6-param bilateral cannot extract more than the 64-view (half of 128) FBP noise floor allows on this synthetic phantom substrate -- a clean ceiling-doc result toward iter-20. Chose img_sx/img_sy 3.5->4.5 (the EXPLICITLY pre-registered iter-16 next step -- 'iter-17 would then RE-LIBERATE the sigma img_sx/img_sy 3.5->4.5, now that kernel=9 admits a wider sigma') over (a) pushing img_kernel 9->11 (the kernel thread just saturated at +0.0038, and at kernel=9 the window already exceeds the current sigma=3.5, so the window is no longer the binding constraint -- widening it further with an unchanged sigma would be a wasted move; re-liberate the sigma the larger window now admits FIRST), (b) proj_sr/proj_kernel/proj_n_bf (whole proj domain confirmed flat at iter-11/12 -- symmetry trap, wasted), (c) img_sr (exhausted + substrate-confirmed WRONG-direction -- tightening to 0.0005 collapsed hr 0.3335->0.1998 at iter-4 -- FORBIDDEN, stays LOOSE 0.02), (d) img_n_bf/n_iter/pretrain_epochs/seed/val_n (all DEAD FLAT / variance-only, exhausted), (e) grad_clip (mandatory overflow guard at 1.0, not a quality lever). Held fixed at iter-16 values: img_kernel=9, img_n_bf=7, img_sr=0.02 (LOOSE, demo-correct), proj_n_bf=1, proj_kernel=7, proj_sr=0.02, proj_sx=1.0/proj_sy=2.0, lr=2.3e-3, warm_start=True, pretrain_epochs=3, n_iter=400, train_n=200, val_n=6, grad_clip=1.0, seed=42. Wall: iter-16 ran 762 s at img_kernel=9; img_sx/img_sy are pure init sigma values inside the fixed img_kernel=9 window -> ZERO added compute, wall ~unchanged, comfortably under the 1800 s sbatch wall and the 1200 s outer_wall_s internal guard (under the 15-min budget). PER-IMAGE bilateral N2I, AGENT4CT_DATASET=phantoms; warm_start STAYS ON; do NOT revert to amortized; do NOT tighten img_sr.", "comparison_image": "runs/demo-dl-claude-agentic-dual-domain-bilateral-n2i-search-20260618-01/iterations/iter-0017/comparison.png"}
{"ts": "2026-06-19T08:25:59Z", "run_id": "demo-dl-claude-agentic-dual-domain-bilateral-n2i-search-20260618-01", "iter": 16, "agent": "dual_domain_bilateral_n2i-claude-agentic-breast-ct", "model": "claude-opus-4.7-1m", "change_class": "architecture", "status": "keep", "kept": true, "val_score": 0.8284408450126648, "headroom": 0.3282705881688668, "params_M": 2.4e-05, "train_n": 400, "rationale": "dual_domain_bilateral_n2i-claude-agentic: train_n=200, val_n=6, batch_size=1, grad_clip=1.0, seed=42, warm_start=True, pretrain_epochs=3, n_iter=400, outer_wall_s=1200, lr=0.0023, proj_n_bf=1, img_n_bf=7, proj_kernel=7, img_kernel=9, proj_sx=1.0, proj_sy=2.0, proj_sr=0.02, img_sx=3.5, img_sy=3.5, img_sr=0.02, rationale=iter-16: ONE knob changed vs the iter-15 WIN base (image-domain bilateral WINDOW SIZE img_kernel 7->9); all 18 other fields held IDENTICAL to demo_dl_dual_domain_bilateral_n2i_iter_15.json (img_sx/img_sy=3.5, img_n_bf=7, img_sr=0.02 LOOSE demo-correct, proj_n_bf=1, proj_kernel=7, proj_sx/sy=1.0/2.0, proj_sr=0.02, lr=2.3e-3, warm_start=True, pretrain_epochs=3, n_iter=400, train_n=200, val_n=6, grad_clip=1.0, seed=42 -> identical seed=42 val split, directly comparable to iter-15 SSIM 0.8246 / hr 0.3323 / PSNR 20.17). KEEP UNLOCKING THE BINDING CONSTRAINT (the kernel, NOT the sigma). Read iter-14->15 BY SSIM (the surface the spatial-smoothing thread moves; hr stays pinned ~0.332 at the 64-view-FBP noise-floor ceiling): iter-15 widened img_kernel 5->7 and LIFTED SSIM 0.8035->0.8246 (+0.0211 -- the largest single-iter lift since iter-2, BIGGER than any sigma step), while hr stayed FLAT 0.3320->0.3323 and PSNR flat 20.17->20.17. So the kernel WINDOW, not the sigma, is the live lever right now -- the WIN was a kernel change. SIGMA/KERNEL COUPLING READ: img_sx=3.5 is the requested Gaussian spatial sigma; a Gaussian needs roughly +/-2*sigma=+/-7px of support to be well-represented, but img_kernel=7 gives only a +/-3px window -- the half-window (3) is STILL SMALLER than sigma (3.5), so the kernel=7 window STILL TRUNCATES the img_sx=3.5 Gaussian. The +0.0211 lift at iter-15 came purely from letting the EXISTING sigma=3.5 reach a bit farther (5px->7px window); since the window remains the binding constraint (3 < 3.5), widening it ONE more notch should keep paying off. FAILURE MODE this iter addresses: at kernel=7 the img_sx=3.5 spatial weight is still clipped at the +/-3px window edge -- the BF cannot yet average over the full +/-4px neighborhood the sigma=3.5 requests. The unlock is to widen the WINDOW again, not the sigma. HYPOTHESIS (img-kernel-2): widening img_kernel 7->9 enlarges the per-BF window from +/-3px to +/-4px so the img_sx=3.5 spatial Gaussian can finally average over (most of) the neighborhood it requests -> lifts SSIM past iter-15 0.8246 on the SAME seed=42 split. Expect hr to stay pinned ~0.332 (this is an SSIM-only structural-similarity lever bounded by the 64-view-FBP noise floor -- hr has been flat ~0.332 across the entire spatial-smoothing thread iter-13/14/15). If SSIM SATURATES or regresses here, the kernel window has finally caught up to the sigma=3.5 support and the image-domain spatial denoising is exhausted at the ~0.82-0.83 SSIM / ~0.33 hr substrate ceiling -- a clean ceiling-doc result, and iter-17 would then RE-LIBERATE the sigma (img_sx/img_sy 3.5->4.5, now that kernel=9 admits a wider sigma) to test whether the larger window unlocks more sigma headroom. Chose img_kernel 7->9 (continue the just-proven WINNING lever -- the kernel, which delivered +0.0211) over (a) pushing img_sx/img_sy 3.5->4.5 NOW (the sigma is still window-truncated at kernel=7, so widening sigma further inside a window that only reaches +/-3px requests support the window cannot deliver -- that is the exact saturation regime iter-14 hit; widen the window FIRST, then re-liberate sigma at iter-17 if the kernel saturates), (b) proj_sr/proj_kernel/proj_n_bf (whole proj domain confirmed flat at iter-11/12 -- symmetry trap, wasted), (c) img_sr (exhausted + substrate-confirmed WRONG-direction -- tightening to 0.0005 collapsed hr 0.3335->0.1998 at iter-4 -- FORBIDDEN, stays LOOSE 0.02), (d) img_n_bf/n_iter/pretrain_epochs/seed/val_n (all DEAD FLAT / variance-only, exhausted), (e) grad_clip (mandatory overflow guard at 1.0, not a quality lever). Held fixed at iter-15 values: img_sx=3.5/img_sy=3.5, img_n_bf=7, img_sr=0.02 (LOOSE, demo-correct), proj_n_bf=1, proj_kernel=7, proj_sr=0.02, proj_sx=1.0/proj_sy=2.0, lr=2.3e-3, warm_start=True, pretrain_epochs=3, n_iter=400, train_n=200, val_n=6, grad_clip=1.0, seed=42. Wall: iter-15 ran 515 s at img_kernel=7; a 9-px image-BF window is modestly slower per step than a 7-px window (the image-domain conv is a small fraction of the 128-view FBP+proj per-step cost) -- n_iter/val_n kept at iter-15 values, so wall stays comfortably under the 1800 s sbatch wall and the 1200 s outer_wall_s internal guard (under the 15-min budget). PER-IMAGE bilateral N2I, AGENT4CT_DATASET=phantoms; warm_start STAYS ON; do NOT revert to amortized; do NOT tighten img_sr.", "advice_for_others": "dual_domain_bilateral_n2i-claude-agentic: train_n=200, val_n=6, batch_size=1, grad_clip=1.0, seed=42, warm_start=True, pretrain_epochs=3, n_iter=400, outer_wall_s=1200, lr=0.0023, proj_n_bf=1, img_n_bf=7, proj_kernel=7, img_kernel=9, proj_sx=1.0, proj_sy=2.0, proj_sr=0.02, img_sx=3.5, img_sy=3.5, img_sr=0.02, rationale=iter-16: ONE knob changed vs the iter-15 WIN base (image-domain bilateral WINDOW SIZE img_kernel 7->9); all 18 other fields held IDENTICAL to demo_dl_dual_domain_bilateral_n2i_iter_15.json (img_sx/img_sy=3.5, img_n_bf=7, img_sr=0.02 LOOSE demo-correct, proj_n_bf=1, proj_kernel=7, proj_sx/sy=1.0/2.0, proj_sr=0.02, lr=2.3e-3, warm_start=True, pretrain_epochs=3, n_iter=400, train_n=200, val_n=6, grad_clip=1.0, seed=42 -> identical seed=42 val split, directly comparable to iter-15 SSIM 0.8246 / hr 0.3323 / PSNR 20.17). KEEP UNLOCKING THE BINDING CONSTRAINT (the kernel, NOT the sigma). Read iter-14->15 BY SSIM (the surface the spatial-smoothing thread moves; hr stays pinned ~0.332 at the 64-view-FBP noise-floor ceiling): iter-15 widened img_kernel 5->7 and LIFTED SSIM 0.8035->0.8246 (+0.0211 -- the largest single-iter lift since iter-2, BIGGER than any sigma step), while hr stayed FLAT 0.3320->0.3323 and PSNR flat 20.17->20.17. So the kernel WINDOW, not the sigma, is the live lever right now -- the WIN was a kernel change. SIGMA/KERNEL COUPLING READ: img_sx=3.5 is the requested Gaussian spatial sigma; a Gaussian needs roughly +/-2*sigma=+/-7px of support to be well-represented, but img_kernel=7 gives only a +/-3px window -- the half-window (3) is STILL SMALLER than sigma (3.5), so the kernel=7 window STILL TRUNCATES the img_sx=3.5 Gaussian. The +0.0211 lift at iter-15 came purely from letting the EXISTING sigma=3.5 reach a bit farther (5px->7px window); since the window remains the binding constraint (3 < 3.5), widening it ONE more notch should keep paying off. FAILURE MODE this iter addresses: at kernel=7 the img_sx=3.5 spatial weight is still clipped at the +/-3px window edge -- the BF cannot yet average over the full +/-4px neighborhood the sigma=3.5 requests. The unlock is to widen the WINDOW again, not the sigma. HYPOTHESIS (img-kernel-2): widening img_kernel 7->9 enlarges the per-BF window from +/-3px to +/-4px so the img_sx=3.5 spatial Gaussian can finally average over (most of) the neighborhood it requests -> lifts SSIM past iter-15 0.8246 on the SAME seed=42 split. Expect hr to stay pinned ~0.332 (this is an SSIM-only structural-similarity lever bounded by the 64-view-FBP noise floor -- hr has been flat ~0.332 across the entire spatial-smoothing thread iter-13/14/15). If SSIM SATURATES or regresses here, the kernel window has finally caught up to the sigma=3.5 support and the image-domain spatial denoising is exhausted at the ~0.82-0.83 SSIM / ~0.33 hr substrate ceiling -- a clean ceiling-doc result, and iter-17 would then RE-LIBERATE the sigma (img_sx/img_sy 3.5->4.5, now that kernel=9 admits a wider sigma) to test whether the larger window unlocks more sigma headroom. Chose img_kernel 7->9 (continue the just-proven WINNING lever -- the kernel, which delivered +0.0211) over (a) pushing img_sx/img_sy 3.5->4.5 NOW (the sigma is still window-truncated at kernel=7, so widening sigma further inside a window that only reaches +/-3px requests support the window cannot deliver -- that is the exact saturation regime iter-14 hit; widen the window FIRST, then re-liberate sigma at iter-17 if the kernel saturates), (b) proj_sr/proj_kernel/proj_n_bf (whole proj domain confirmed flat at iter-11/12 -- symmetry trap, wasted), (c) img_sr (exhausted + substrate-confirmed WRONG-direction -- tightening to 0.0005 collapsed hr 0.3335->0.1998 at iter-4 -- FORBIDDEN, stays LOOSE 0.02), (d) img_n_bf/n_iter/pretrain_epochs/seed/val_n (all DEAD FLAT / variance-only, exhausted), (e) grad_clip (mandatory overflow guard at 1.0, not a quality lever). Held fixed at iter-15 values: img_sx=3.5/img_sy=3.5, img_n_bf=7, img_sr=0.02 (LOOSE, demo-correct), proj_n_bf=1, proj_kernel=7, proj_sr=0.02, proj_sx=1.0/proj_sy=2.0, lr=2.3e-3, warm_start=True, pretrain_epochs=3, n_iter=400, train_n=200, val_n=6, grad_clip=1.0, seed=42. Wall: iter-15 ran 515 s at img_kernel=7; a 9-px image-BF window is modestly slower per step than a 7-px window (the image-domain conv is a small fraction of the 128-view FBP+proj per-step cost) -- n_iter/val_n kept at iter-15 values, so wall stays comfortably under the 1800 s sbatch wall and the 1200 s outer_wall_s internal guard (under the 15-min budget). PER-IMAGE bilateral N2I, AGENT4CT_DATASET=phantoms; warm_start STAYS ON; do NOT revert to amortized; do NOT tighten img_sr.", "comparison_image": "runs/demo-dl-claude-agentic-dual-domain-bilateral-n2i-search-20260618-01/iterations/iter-0016/comparison.png"}
