{"ts": "2026-06-19T04:40:13Z", "run_id": "demo-dl-claude-agentic-dual-domain-n2i-search-20260618-01", "iter": 9, "agent": "dual_domain_n2i-claude-agentic-breast-ct", "model": "claude-opus-4.7-1m", "change_class": "architecture", "status": "discard", "kept": false, "val_score": 0.46973705291748047, "headroom": 0.0, "params_M": 0.465762, "train_n": 400, "rationale": "dual_domain_n2i-claude-agentic: train_n=200, val_n=6, batch_size=1, grad_clip=1.0, seed=42, warm_start=True, pretrain_epochs=12, n_iter=600, outer_wall_s=1200, lr=0.0002, unet_c=16, rationale=iter-9: ONE knob -> per-scan lr 1e-4 -> 2e-4 (2x), at the warm_start=True/ep12/seed42 PEAK base (iter-5 config, SSIM 0.5081 -- NOT the iter-7 seed123 basin, NOT iter-8 warm_start=off). KEEP warm_start=True (LOAD-BEARING-POSITIVE, settled), pretrain_epochs=12 (the init-budget PEAK), seed=42 (the good basin), grad_clip=1.0 (LOAD-BEARING 128-view FBP-adjoint guard, mandatory -- do NOT touch), n_iter=600, val_n=6 (UNCHANGED so SSIM stays iter-to-iter comparable). DIAGNOSIS (numbers, not pixels): the load-bearing-positive warm_start fact is now re-confirmed on demo -- iter-8 warm_start OFF (seed42/ep12) dropped SSIM 0.5081 -> 0.4486 (-0.0595, hr0, PSNR 16.38->16.29), so without the amortized pre-pass each per-scan lr-anchored fit lands in a worse basin. FAILURE MODE = per-image U-Net N2I caps ~0.51 SSIM (hr~0) on this 128-view synthetic-phantom substrate: it is FBP-bounded AND has a large init-driven stochastic noise floor (a seed flip 42->123 alone swung 0.5081->0.4203, -0.088, iter-5 vs iter-7), so single-seed reads are intrinsically noisy here and the U-Net (0.466 M params) overfits one noisy scan where the 6-param bilateral twin physically cannot (twin clears baseline at hr+0.33). LEVER CHOICE: of the genuinely-untried-at-PEAK knobs (pretrain_epochs is EXHAUSTED -- ep12 peak, ep18 worse; grad_clip is LOAD-BEARING/forbidden; val_n change would break iter-to-iter SSIM comparability), do the mild lr RE-CONFIRM the handoff lists: 1e-4 -> 2e-4. lr=1e-4 was picked at iter-3 as the per-scan OVERFIT ANCHOR (1e-3 -> 1e-4 lifted 0.4785 -> 0.4880 by keeping Adam pinned near the warm-start init), but 1e-4 vs 2e-4 was never compared at the converged ep12 PEAK -- only 1e-3 vs 1e-4 at the under-trained ep3 init. So whether 1e-4 is the true per-scan step optimum AT THE PEAK init is untested. HYPOTHESIS: at the ep12/seed42 peak init, a 2x larger per-scan step (2e-4) lets the lr-anchored fit refine slightly further off a now-good warm-start init without descending into the single-scan noise-fitting minimum that killed n_iter (iter-2 1200 steps regressed). If SSIM rises >0.51 then 1e-4 was slightly under-stepping at the converged init (the anchor optimum shifts up once the init is good); if it falls toward ~0.48-0.49 then 1e-4 is confirmed optimal (2e-4 starts to overfit the single scan) and the per-scan anchor axis is settled. Either way DOCUMENTS the per-scan step optimum at the peak init toward the iter-20 ceiling. hr stays ~0 (structurally FBP-bounded on dense-view phantoms). NOTE on the noise floor: any single-iter delta < ~0.01 here is within the demo-n2i seed noise floor and should be read as 'flat', not signal. WALL: warm 12x200=2400 + per-image 6x600=3600 = 6000 steps @ ~0.083 s/step ~= 500 s (iter-5 was 463 s at this exact 6000-step budget), under the 15-min target, the outer_wall_s=1200 guard, and the 00:30:00 (1800 s) sbatch wall -- no need to drop val_n/n_iter. All other knobs IDENTICAL to the iter-5 PEAK config (train_n=200, val_n=6, batch_size=1, grad_clip=1.0, seed=42, warm_start=True, pretrain_epochs=12, n_iter=600, unet_c=16); ONLY per-scan lr 1e-4 -> 2e-4 changed.", "advice_for_others": "dual_domain_n2i-claude-agentic: train_n=200, val_n=6, batch_size=1, grad_clip=1.0, seed=42, warm_start=True, pretrain_epochs=12, n_iter=600, outer_wall_s=1200, lr=0.0002, unet_c=16, rationale=iter-9: ONE knob -> per-scan lr 1e-4 -> 2e-4 (2x), at the warm_start=True/ep12/seed42 PEAK base (iter-5 config, SSIM 0.5081 -- NOT the iter-7 seed123 basin, NOT iter-8 warm_start=off). KEEP warm_start=True (LOAD-BEARING-POSITIVE, settled), pretrain_epochs=12 (the init-budget PEAK), seed=42 (the good basin), grad_clip=1.0 (LOAD-BEARING 128-view FBP-adjoint guard, mandatory -- do NOT touch), n_iter=600, val_n=6 (UNCHANGED so SSIM stays iter-to-iter comparable). DIAGNOSIS (numbers, not pixels): the load-bearing-positive warm_start fact is now re-confirmed on demo -- iter-8 warm_start OFF (seed42/ep12) dropped SSIM 0.5081 -> 0.4486 (-0.0595, hr0, PSNR 16.38->16.29), so without the amortized pre-pass each per-scan lr-anchored fit lands in a worse basin. FAILURE MODE = per-image U-Net N2I caps ~0.51 SSIM (hr~0) on this 128-view synthetic-phantom substrate: it is FBP-bounded AND has a large init-driven stochastic noise floor (a seed flip 42->123 alone swung 0.5081->0.4203, -0.088, iter-5 vs iter-7), so single-seed reads are intrinsically noisy here and the U-Net (0.466 M params) overfits one noisy scan where the 6-param bilateral twin physically cannot (twin clears baseline at hr+0.33). LEVER CHOICE: of the genuinely-untried-at-PEAK knobs (pretrain_epochs is EXHAUSTED -- ep12 peak, ep18 worse; grad_clip is LOAD-BEARING/forbidden; val_n change would break iter-to-iter SSIM comparability), do the mild lr RE-CONFIRM the handoff lists: 1e-4 -> 2e-4. lr=1e-4 was picked at iter-3 as the per-scan OVERFIT ANCHOR (1e-3 -> 1e-4 lifted 0.4785 -> 0.4880 by keeping Adam pinned near the warm-start init), but 1e-4 vs 2e-4 was never compared at the converged ep12 PEAK -- only 1e-3 vs 1e-4 at the under-trained ep3 init. So whether 1e-4 is the true per-scan step optimum AT THE PEAK init is untested. HYPOTHESIS: at the ep12/seed42 peak init, a 2x larger per-scan step (2e-4) lets the lr-anchored fit refine slightly further off a now-good warm-start init without descending into the single-scan noise-fitting minimum that killed n_iter (iter-2 1200 steps regressed). If SSIM rises >0.51 then 1e-4 was slightly under-stepping at the converged init (the anchor optimum shifts up once the init is good); if it falls toward ~0.48-0.49 then 1e-4 is confirmed optimal (2e-4 starts to overfit the single scan) and the per-scan anchor axis is settled. Either way DOCUMENTS the per-scan step optimum at the peak init toward the iter-20 ceiling. hr stays ~0 (structurally FBP-bounded on dense-view phantoms). NOTE on the noise floor: any single-iter delta < ~0.01 here is within the demo-n2i seed noise floor and should be read as 'flat', not signal. WALL: warm 12x200=2400 + per-image 6x600=3600 = 6000 steps @ ~0.083 s/step ~= 500 s (iter-5 was 463 s at this exact 6000-step budget), under the 15-min target, the outer_wall_s=1200 guard, and the 00:30:00 (1800 s) sbatch wall -- no need to drop val_n/n_iter. All other knobs IDENTICAL to the iter-5 PEAK config (train_n=200, val_n=6, batch_size=1, grad_clip=1.0, seed=42, warm_start=True, pretrain_epochs=12, n_iter=600, unet_c=16); ONLY per-scan lr 1e-4 -> 2e-4 changed.", "comparison_image": "runs/demo-dl-claude-agentic-dual-domain-n2i-search-20260618-01/iterations/iter-0009/comparison.png"}
{"ts": "2026-06-19T03:41:53Z", "run_id": "demo-dl-claude-agentic-dual-domain-bilateral-n2i-search-20260618-01", "iter": 9, "agent": "dual_domain_bilateral_n2i-claude-agentic-breast-ct", "model": "claude-opus-4.7-1m", "change_class": "architecture", "status": "keep", "kept": true, "val_score": 0.7728770971298218, "headroom": 0.40991011825067647, "params_M": 2.4e-05, "train_n": 400, "rationale": "dual_domain_bilateral_n2i-claude-agentic: train_n=200, val_n=12, batch_size=1, grad_clip=1.0, seed=123, warm_start=True, pretrain_epochs=3, n_iter=400, outer_wall_s=1200, lr=0.0023, proj_n_bf=1, img_n_bf=7, proj_kernel=7, img_kernel=5, proj_sx=1.0, proj_sy=2.0, proj_sr=0.02, img_sx=1.5, img_sy=1.5, img_sr=0.02, rationale=iter-9: VARIANCE-CHECK probe. ONE knob changed vs the iter-8 hr-0.4222 PEAK/champion config (val_n 6->12); all 18 other fields held IDENTICAL to demo_dl_dual_domain_bilateral_n2i_iter_08.json (seed=123, img_n_bf=7, img_sr=0.02 LOOSE demo-correct, n_iter=400, pretrain_epochs=3, lr=2.3e-3, grad_clip=1.0, warm_start=True). val_n is a genuinely NEW axis -- pinned at 6 across iters 1-8. Read iters 6->8 BY HEADROOM (campaign primary, PSNR/noise-sensitive on demo): iter-6 img_n_bf=7 seed=42 hr 0.3330 (PSNR 20.18); iter-7 n_iter 400->800 seed=42 hr 0.3346 (PSNR 20.19, per-scan Adam budget DEAD FLAT); iter-8 seed 42->123 hr 0.4222 BUT PSNR DROPPED to 17.81 and SSIM dipped 0.7796->0.7711. FAILURE MODE at hr~0.42: the headroom estimate is HIGH-VARIANCE across the tiny val_n=6 draw. A pure seed change (iter-8) swung hr +0.089 (0.333->0.422) while PSNR fell -2.4 dB and SSIM fell -0.0085 -- hr and PSNR moved in OPPOSITE directions, which a genuine reconstruction improvement cannot do. The hr jump is therefore an EASIER 6-scene val draw (weaker LD-FBP baseline inflating the headroom fraction (metric-baseline)/(oracle-baseline)), NOT a real lift. iter-8 pre-registered exactly this next step: If hr instead swings widely, the ceiling is split-sensitive and val_n should be raised next to tighten the estimate. HYPOTHESIS (the variance hypothesis): doubling val_n 6->12 tightens the hr estimate; if hr 0.4222 was a lucky-split artifact it regresses toward the ~0.36-0.39 midpoint of the two single-split readings (0.333 & 0.422), and PSNR recovers toward ~19 dB as the larger draw re-includes harder scenes. If instead hr stays ~0.42 at val_n=12, the lift is real and seed-123s draw was representative -- either way the campaigns reported demo-bilateral number is de-noised. Chose val_n over (a) img_n_bf/n_iter (both DEAD FLAT, exhausted at seed=42), (b) img_sr (exhausted + substrate-confirmed WRONG-direction: tightening to 0.0005 collapsed hr 0.3335->0.1998 at iter-4 -- do NOT repeat), (c) proj_n_bf (symmetry trap, wasted params), (d) lr/grad_clip/warm_start/pretrain_epochs (untried but not yet motivated -- the iter-8 PSNR-vs-hr divergence makes VARIANCE the named open question, and val_n is its direct test). Held fixed at iter-8 PEAK values: seed=123, img_n_bf=7, img_sr=0.02 (LOOSE, demo-correct), n_iter=400, proj_n_bf=1, kernels (proj_k=7/img_k=5), proj sigmas (1.0/2.0/0.02), img spatial sigmas (img_sx=1.5/img_sy=1.5), lr=2.3e-3, warm_start=True, pretrain_epochs=3, train_n=200, grad_clip=1.0. Wall: iter-8 ran 345 s at val_n=6/n_iter=400; doubling val_n roughly doubles the per-scene fit portion -> est ~600-700 s, well under the 1200 s outer_wall_s internal guard and the 1800 s sbatch wall (under the 15-min budget). This iter DOCUMENTS whether the hr~0.42 champion is a real lift or a val-split artifact, toward iter-20. PER-IMAGE bilateral N2I, AGENT4CT_DATASET=phantoms; do NOT revert to amortized.", "advice_for_others": "dual_domain_bilateral_n2i-claude-agentic: train_n=200, val_n=12, batch_size=1, grad_clip=1.0, seed=123, warm_start=True, pretrain_epochs=3, n_iter=400, outer_wall_s=1200, lr=0.0023, proj_n_bf=1, img_n_bf=7, proj_kernel=7, img_kernel=5, proj_sx=1.0, proj_sy=2.0, proj_sr=0.02, img_sx=1.5, img_sy=1.5, img_sr=0.02, rationale=iter-9: VARIANCE-CHECK probe. ONE knob changed vs the iter-8 hr-0.4222 PEAK/champion config (val_n 6->12); all 18 other fields held IDENTICAL to demo_dl_dual_domain_bilateral_n2i_iter_08.json (seed=123, img_n_bf=7, img_sr=0.02 LOOSE demo-correct, n_iter=400, pretrain_epochs=3, lr=2.3e-3, grad_clip=1.0, warm_start=True). val_n is a genuinely NEW axis -- pinned at 6 across iters 1-8. Read iters 6->8 BY HEADROOM (campaign primary, PSNR/noise-sensitive on demo): iter-6 img_n_bf=7 seed=42 hr 0.3330 (PSNR 20.18); iter-7 n_iter 400->800 seed=42 hr 0.3346 (PSNR 20.19, per-scan Adam budget DEAD FLAT); iter-8 seed 42->123 hr 0.4222 BUT PSNR DROPPED to 17.81 and SSIM dipped 0.7796->0.7711. FAILURE MODE at hr~0.42: the headroom estimate is HIGH-VARIANCE across the tiny val_n=6 draw. A pure seed change (iter-8) swung hr +0.089 (0.333->0.422) while PSNR fell -2.4 dB and SSIM fell -0.0085 -- hr and PSNR moved in OPPOSITE directions, which a genuine reconstruction improvement cannot do. The hr jump is therefore an EASIER 6-scene val draw (weaker LD-FBP baseline inflating the headroom fraction (metric-baseline)/(oracle-baseline)), NOT a real lift. iter-8 pre-registered exactly this next step: If hr instead swings widely, the ceiling is split-sensitive and val_n should be raised next to tighten the estimate. HYPOTHESIS (the variance hypothesis): doubling val_n 6->12 tightens the hr estimate; if hr 0.4222 was a lucky-split artifact it regresses toward the ~0.36-0.39 midpoint of the two single-split readings (0.333 & 0.422), and PSNR recovers toward ~19 dB as the larger draw re-includes harder scenes. If instead hr stays ~0.42 at val_n=12, the lift is real and seed-123s draw was representative -- either way the campaigns reported demo-bilateral number is de-noised. Chose val_n over (a) img_n_bf/n_iter (both DEAD FLAT, exhausted at seed=42), (b) img_sr (exhausted + substrate-confirmed WRONG-direction: tightening to 0.0005 collapsed hr 0.3335->0.1998 at iter-4 -- do NOT repeat), (c) proj_n_bf (symmetry trap, wasted params), (d) lr/grad_clip/warm_start/pretrain_epochs (untried but not yet motivated -- the iter-8 PSNR-vs-hr divergence makes VARIANCE the named open question, and val_n is its direct test). Held fixed at iter-8 PEAK values: seed=123, img_n_bf=7, img_sr=0.02 (LOOSE, demo-correct), n_iter=400, proj_n_bf=1, kernels (proj_k=7/img_k=5), proj sigmas (1.0/2.0/0.02), img spatial sigmas (img_sx=1.5/img_sy=1.5), lr=2.3e-3, warm_start=True, pretrain_epochs=3, train_n=200, grad_clip=1.0. Wall: iter-8 ran 345 s at val_n=6/n_iter=400; doubling val_n roughly doubles the per-scene fit portion -> est ~600-700 s, well under the 1200 s outer_wall_s internal guard and the 1800 s sbatch wall (under the 15-min budget). This iter DOCUMENTS whether the hr~0.42 champion is a real lift or a val-split artifact, toward iter-20. PER-IMAGE bilateral N2I, AGENT4CT_DATASET=phantoms; do NOT revert to amortized.", "comparison_image": "runs/demo-dl-claude-agentic-dual-domain-bilateral-n2i-search-20260618-01/iterations/iter-0009/comparison.png"}
{"ts": "2026-06-19T03:17:42Z", "run_id": "demo-dl-claude-agentic-dual-domain-n2i-search-20260618-01", "iter": 8, "agent": "dual_domain_n2i-claude-agentic-breast-ct", "model": "claude-opus-4.7-1m", "change_class": "architecture", "status": "discard", "kept": false, "val_score": 0.4486235976219177, "headroom": 0.0, "params_M": 0.465762, "train_n": 400, "rationale": "dual_domain_n2i-claude-agentic: train_n=200, val_n=6, batch_size=1, grad_clip=1.0, seed=42, warm_start=False, pretrain_epochs=12, n_iter=600, outer_wall_s=1200, lr=0.0001, unet_c=16, rationale=iter-8: ONE knob -> warm_start true -> false (per-image fit starts from a FIXED fresh U-Net init, NO amortized GT-free pre-pass). Seed RESET 123 -> 42 (the baseline seed of iters 1-6) so the warm_start ON/OFF contrast is clean against the ep12/seed42 PEAK (0.5081), not confounded by the seed-123 basin. KEEP lr=1e-4 (per-scan overfit anchor, iter-3 winner), pretrain_epochs=12 (the peak init budget -- inert when warm_start=False but left at peak for a clean toggle-back if needed). DIAGNOSIS (numbers, not pixels): the iter-7 seed probe's FALSIFIER FIRED. Trend ep12/lr1e-4: seed42 SSIM 0.5081 PSNR 16.376 (iter-5 PEAK); seed42/ep18 0.5016 PSNR 16.29 (iter-6); seed123/ep12 0.4203 PSNR 13.085 (iter-7). Flipping ONLY the seed dropped SSIM 0.5081 -> 0.4203 (-0.088) and PSNR 16.38 -> 13.09 dB (-3.3 dB) -- far outside the iter-7 falsifier band (predicted +/-0.01, threshold <0.49). So ~0.51 is NOT a cleanly-converged structural ceiling; the per-image fit has a LARGE stochastic noise floor. FAILURE MODE = the per-scan U-Net N2I operating point is FRAGILE to initialization: the amortized warm-start pre-pass lands in variable basins (seed42 good, seed123 bad), and the lr=1e-4 per-scan fit is anchored to whatever basin it inherits, so init variance -> output variance. n_iter is RULED OUT (iter-2 1200 steps REGRESSED 0.4785->0.4293), pretrain_epochs is EXHAUSTED/turned-over (ep12 peak, ep18 worse), unet_c is the explicitly-warned-against axis, grad_clip=1.0 is LOAD-BEARING (128-view FBP adjoint guard, mandatory -- do NOT touch). LEVER CHOICE (the one untried per-image knob with real headroom): warm_start ON->OFF. This directly tests whether the amortized init is HELPING or is the SOURCE of the seed-fragility: with warm_start=False the per-scan fit starts from a deterministic fresh U-Net (no pre-pass basin lottery), isolating the per-scan N2I objective's own variance. WARM-START-FRAGILITY HYPOTHESIS: the 0.5081->0.4203 seed swing is driven by the warm-start pre-pass landing in variable basins. (a) If warm_start=False SSIM stabilizes near/above ~0.48 with much smaller seed sensitivity, the warm-start was net-fragility (possibly near-neutral on mean) and the per-scan fit alone is the real, more-robust operating point -- a cleaner basis to then re-probe. (b) If SSIM COLLAPSES well below 0.42, the warm-start init was load-bearing POSITIVE and the seed swing is intrinsic to the per-scan N2I objective on this 128-view synthetic substrate -- which CONFIRMS (with the bilateral twin's hr+0.33 at 6 params that physically cannot overfit) that an over-parameterized U-Net is the wrong tool here, documenting the structural ceiling for iter-20. Either branch is informative toward the iter-20 mandate. hr expected ~0 (structurally FBP-bounded on dense-view phantoms). WALL: warm_start=False ELIMINATES the 12x200=2400-step pre-pass, leaving ONLY per-image 6x600=3600 steps @ ~0.083 s/step ~= 300 s (iter-7 was 544 s WITH the pre-pass), comfortably under the 15-min target, the outer_wall_s=1200 guard, and the 00:30:00 (1800 s) sbatch wall -- no need to drop val_n/n_iter. All other knobs IDENTICAL to the iter-5 PEAK config (train_n=200, val_n=6, batch_size=1, grad_clip=1.0, pretrain_epochs=12, n_iter=600, lr=1e-4, unet_c=16); ONLY warm_start true->false (and seed reset 123->42 to anchor the ON/OFF comparison).", "advice_for_others": "dual_domain_n2i-claude-agentic: train_n=200, val_n=6, batch_size=1, grad_clip=1.0, seed=42, warm_start=False, pretrain_epochs=12, n_iter=600, outer_wall_s=1200, lr=0.0001, unet_c=16, rationale=iter-8: ONE knob -> warm_start true -> false (per-image fit starts from a FIXED fresh U-Net init, NO amortized GT-free pre-pass). Seed RESET 123 -> 42 (the baseline seed of iters 1-6) so the warm_start ON/OFF contrast is clean against the ep12/seed42 PEAK (0.5081), not confounded by the seed-123 basin. KEEP lr=1e-4 (per-scan overfit anchor, iter-3 winner), pretrain_epochs=12 (the peak init budget -- inert when warm_start=False but left at peak for a clean toggle-back if needed). DIAGNOSIS (numbers, not pixels): the iter-7 seed probe's FALSIFIER FIRED. Trend ep12/lr1e-4: seed42 SSIM 0.5081 PSNR 16.376 (iter-5 PEAK); seed42/ep18 0.5016 PSNR 16.29 (iter-6); seed123/ep12 0.4203 PSNR 13.085 (iter-7). Flipping ONLY the seed dropped SSIM 0.5081 -> 0.4203 (-0.088) and PSNR 16.38 -> 13.09 dB (-3.3 dB) -- far outside the iter-7 falsifier band (predicted +/-0.01, threshold <0.49). So ~0.51 is NOT a cleanly-converged structural ceiling; the per-image fit has a LARGE stochastic noise floor. FAILURE MODE = the per-scan U-Net N2I operating point is FRAGILE to initialization: the amortized warm-start pre-pass lands in variable basins (seed42 good, seed123 bad), and the lr=1e-4 per-scan fit is anchored to whatever basin it inherits, so init variance -> output variance. n_iter is RULED OUT (iter-2 1200 steps REGRESSED 0.4785->0.4293), pretrain_epochs is EXHAUSTED/turned-over (ep12 peak, ep18 worse), unet_c is the explicitly-warned-against axis, grad_clip=1.0 is LOAD-BEARING (128-view FBP adjoint guard, mandatory -- do NOT touch). LEVER CHOICE (the one untried per-image knob with real headroom): warm_start ON->OFF. This directly tests whether the amortized init is HELPING or is the SOURCE of the seed-fragility: with warm_start=False the per-scan fit starts from a deterministic fresh U-Net (no pre-pass basin lottery), isolating the per-scan N2I objective's own variance. WARM-START-FRAGILITY HYPOTHESIS: the 0.5081->0.4203 seed swing is driven by the warm-start pre-pass landing in variable basins. (a) If warm_start=False SSIM stabilizes near/above ~0.48 with much smaller seed sensitivity, the warm-start was net-fragility (possibly near-neutral on mean) and the per-scan fit alone is the real, more-robust operating point -- a cleaner basis to then re-probe. (b) If SSIM COLLAPSES well below 0.42, the warm-start init was load-bearing POSITIVE and the seed swing is intrinsic to the per-scan N2I objective on this 128-view synthetic substrate -- which CONFIRMS (with the bilateral twin's hr+0.33 at 6 params that physically cannot overfit) that an over-parameterized U-Net is the wrong tool here, documenting the structural ceiling for iter-20. Either branch is informative toward the iter-20 mandate. hr expected ~0 (structurally FBP-bounded on dense-view phantoms). WALL: warm_start=False ELIMINATES the 12x200=2400-step pre-pass, leaving ONLY per-image 6x600=3600 steps @ ~0.083 s/step ~= 300 s (iter-7 was 544 s WITH the pre-pass), comfortably under the 15-min target, the outer_wall_s=1200 guard, and the 00:30:00 (1800 s) sbatch wall -- no need to drop val_n/n_iter. All other knobs IDENTICAL to the iter-5 PEAK config (train_n=200, val_n=6, batch_size=1, grad_clip=1.0, pretrain_epochs=12, n_iter=600, lr=1e-4, unet_c=16); ONLY warm_start true->false (and seed reset 123->42 to anchor the ON/OFF comparison).", "comparison_image": "runs/demo-dl-claude-agentic-dual-domain-n2i-search-20260618-01/iterations/iter-0008/comparison.png"}
