{"ts": "2026-06-18T23:56:14Z", "run_id": "demo-dl-claude-agentic-dual-domain-bilateral-n2i-search-20260618-01", "iter": 5, "agent": "dual_domain_bilateral_n2i-claude-agentic-breast-ct", "model": "claude-opus-4.7-1m", "change_class": "architecture", "status": "keep", "kept": true, "val_score": 0.7704027891159058, "headroom": 0.3319717229471054, "params_M": 1.8e-05, "train_n": 400, "rationale": "dual_domain_bilateral_n2i-claude-agentic: train_n=200, val_n=6, batch_size=1, grad_clip=1.0, seed=42, warm_start=True, pretrain_epochs=3, n_iter=400, outer_wall_s=1200, lr=0.0023, proj_n_bf=1, img_n_bf=5, proj_kernel=7, img_kernel=5, proj_sx=1.0, proj_sy=2.0, proj_sr=0.02, img_sx=1.5, img_sy=1.5, img_sr=0.02, rationale=iter-5: ONE knob changed vs iter-4 (img_sr 0.0005->0.02, the image-domain BILATERAL RANGE sigma); all 18 other fields held IDENTICAL to demo_dl_dual_domain_bilateral_n2i_iter_04.json -> this exactly RESTORES the iter-3 config (img_n_bf=5, img_sr=0.02), the hr-best of the whole run. UNDOING THE iter-4 REGRESSION. Trajectory: iter-1 img_n_bf=1 val 0.6657/hr+0.2763/PSNR 19.47; iter-2 img_n_bf=3 val 0.7465/hr+0.3276/PSNR 20.10; iter-3 img_n_bf=5 val 0.7705/hr+0.3335/PSNR 20.18 (HR-BEST); iter-4 tightened img_sr 0.02->0.0005 -> SSIM ticked up to 0.7709 but hr COLLAPSED 0.3335->0.1998 and PSNR fell 20.18->18.60. Failure mode: tight img_sr is the WRONG lever for demo's substrate. The mayo_campaign_state.md 'tighten img_sr->0.0005 for edge preservation' insight is BREAST-specific (tight=good on dense fibroglandular breast); on demo's sparse ellipse phantoms the tight range sigma OVER-SHARPENS - it forces the 5-deep image cascade to act only across hard intensity jumps and stop smoothing the broad noise floor, so noise/PSNR worsens (20.18->18.60 dB) even though the SSIM structural term inches up. headroom is the campaign's primary structurally-bounded score and it is PSNR/noise-sensitive here, so the over-sharpen is net-negative. The img_sr lever is SUBSTRATE-SPECIFIC and OPPOSITE between breast (tight=good) and demo (loose=good). Reverting img_sr 0.0005->0.02 restores the iter-3 hr-0.3335 regime, where the loose range sigma lets the deep cascade do its proven coarse-to-fine NOISE smoothing (the demo lever that earned hr 0.276->0.328->0.335 via img_n_bf 1->3->5 at img_sr=0.02). Chose the clean SINGLE-numeric-knob revert (img_sr only) over also pushing img_n_bf 5->7 in the same iter, to first cleanly RECOVER hr 0.3335 and re-confirm the loose-img_sr regime before iter-6 pushes the proven depth lever further. Held fixed at the iter-3/iter-4 values: img_n_bf=5, proj_n_bf=1, kernels (proj_k=7/img_k=5), proj sigmas (1.0/2.0/0.02), img spatial sigmas (img_sx=1.5/img_sy=1.5), lr=2.3e-3, warm_start=True, pretrain_epochs=3, n_iter=400, train_n=200, val_n=6, grad_clip=1.0, seed=42 (-> identical val split, directly comparable to iter-1/2/3/4). Wall: iter-4 ran 264 s; img_sr is an init value, zero added compute, so wall ~unchanged, comfortably under the 1800 s sbatch wall and the 1200 s outer_wall_s guard. Hypothesis: reverting the image-domain range sigma to the looser 0.02 undoes the iter-4 over-sharpen and recovers val_score/hr to ~iter-3 (SSIM ~0.7705, hr ~0.3335, PSNR ~20.18), confirming that on demo's substrate loose img_sr is correct (opposite to breast). If hr does NOT recover to ~0.3335, it would mean the iter-4 regression was NOT purely the img_sr lever (re-examine seed/split determinism) - but per the identical-split protocol it should land back on iter-3.", "advice_for_others": "dual_domain_bilateral_n2i-claude-agentic: train_n=200, val_n=6, batch_size=1, grad_clip=1.0, seed=42, warm_start=True, pretrain_epochs=3, n_iter=400, outer_wall_s=1200, lr=0.0023, proj_n_bf=1, img_n_bf=5, proj_kernel=7, img_kernel=5, proj_sx=1.0, proj_sy=2.0, proj_sr=0.02, img_sx=1.5, img_sy=1.5, img_sr=0.02, rationale=iter-5: ONE knob changed vs iter-4 (img_sr 0.0005->0.02, the image-domain BILATERAL RANGE sigma); all 18 other fields held IDENTICAL to demo_dl_dual_domain_bilateral_n2i_iter_04.json -> this exactly RESTORES the iter-3 config (img_n_bf=5, img_sr=0.02), the hr-best of the whole run. UNDOING THE iter-4 REGRESSION. Trajectory: iter-1 img_n_bf=1 val 0.6657/hr+0.2763/PSNR 19.47; iter-2 img_n_bf=3 val 0.7465/hr+0.3276/PSNR 20.10; iter-3 img_n_bf=5 val 0.7705/hr+0.3335/PSNR 20.18 (HR-BEST); iter-4 tightened img_sr 0.02->0.0005 -> SSIM ticked up to 0.7709 but hr COLLAPSED 0.3335->0.1998 and PSNR fell 20.18->18.60. Failure mode: tight img_sr is the WRONG lever for demo's substrate. The mayo_campaign_state.md 'tighten img_sr->0.0005 for edge preservation' insight is BREAST-specific (tight=good on dense fibroglandular breast); on demo's sparse ellipse phantoms the tight range sigma OVER-SHARPENS - it forces the 5-deep image cascade to act only across hard intensity jumps and stop smoothing the broad noise floor, so noise/PSNR worsens (20.18->18.60 dB) even though the SSIM structural term inches up. headroom is the campaign's primary structurally-bounded score and it is PSNR/noise-sensitive here, so the over-sharpen is net-negative. The img_sr lever is SUBSTRATE-SPECIFIC and OPPOSITE between breast (tight=good) and demo (loose=good). Reverting img_sr 0.0005->0.02 restores the iter-3 hr-0.3335 regime, where the loose range sigma lets the deep cascade do its proven coarse-to-fine NOISE smoothing (the demo lever that earned hr 0.276->0.328->0.335 via img_n_bf 1->3->5 at img_sr=0.02). Chose the clean SINGLE-numeric-knob revert (img_sr only) over also pushing img_n_bf 5->7 in the same iter, to first cleanly RECOVER hr 0.3335 and re-confirm the loose-img_sr regime before iter-6 pushes the proven depth lever further. Held fixed at the iter-3/iter-4 values: img_n_bf=5, proj_n_bf=1, kernels (proj_k=7/img_k=5), proj sigmas (1.0/2.0/0.02), img spatial sigmas (img_sx=1.5/img_sy=1.5), lr=2.3e-3, warm_start=True, pretrain_epochs=3, n_iter=400, train_n=200, val_n=6, grad_clip=1.0, seed=42 (-> identical val split, directly comparable to iter-1/2/3/4). Wall: iter-4 ran 264 s; img_sr is an init value, zero added compute, so wall ~unchanged, comfortably under the 1800 s sbatch wall and the 1200 s outer_wall_s guard. Hypothesis: reverting the image-domain range sigma to the looser 0.02 undoes the iter-4 over-sharpen and recovers val_score/hr to ~iter-3 (SSIM ~0.7705, hr ~0.3335, PSNR ~20.18), confirming that on demo's substrate loose img_sr is correct (opposite to breast). If hr does NOT recover to ~0.3335, it would mean the iter-4 regression was NOT purely the img_sr lever (re-examine seed/split determinism) - but per the identical-split protocol it should land back on iter-3.", "comparison_image": "runs/demo-dl-claude-agentic-dual-domain-bilateral-n2i-search-20260618-01/iterations/iter-0005/comparison.png"}
{"ts": "2026-06-18T23:16:54Z", "run_id": "demo-dl-claude-agentic-dual-domain-bilateral-n2i-search-20260618-01", "iter": 4, "agent": "dual_domain_bilateral_n2i-claude-agentic-breast-ct", "model": "claude-opus-4.7-1m", "change_class": "architecture", "status": "keep", "kept": true, "val_score": 0.7709215879440308, "headroom": 0.19977734444166495, "params_M": 1.8e-05, "train_n": 400, "rationale": "dual_domain_bilateral_n2i-claude-agentic: train_n=200, val_n=6, batch_size=1, grad_clip=1.0, seed=42, warm_start=True, pretrain_epochs=3, n_iter=400, outer_wall_s=1200, lr=0.0023, proj_n_bf=1, img_n_bf=5, proj_kernel=7, img_kernel=5, proj_sx=1.0, proj_sy=2.0, proj_sr=0.02, img_sx=1.5, img_sy=1.5, img_sr=0.0005, rationale=iter-4: ONE knob changed vs iter-3 (img_sr 0.02->0.0005, the image-domain BILATERAL RANGE sigma); all 18 other fields held IDENTICAL to demo_dl_dual_domain_bilateral_n2i_iter_03.json (img_n_bf=5 deep cascade kept). PIVOT from DEPTH to RANGE-SIGMA TUNING, because depth is now in clear diminishing returns and PSNR has SATURATED. Trajectory: iter-1 img_n_bf=1 val 0.6657/hr+0.2763/PSNR 19.47; iter-2 img_n_bf=3 val 0.7465/hr+0.3276/PSNR 20.10 (+0.081 SSIM, +0.63 dB); iter-3 img_n_bf=5 val 0.7705/hr+0.3335/PSNR 20.18 (+0.024 SSIM, only +0.08 dB). The SSIM deltas are halving each depth step (+0.081 -> +0.024) and PSNR has flatlined (20.10 -> 20.18) -> img_n_bf depth has hit its structural ceiling; one more notch (5->7) would buy <0.012 SSIM at best. The higher-EV move is to make the deep 5-layer cascade we ALREADY have actually edge-preserving. Per docs/runs/mayo_campaign_state.md 'N2I PER-IMAGE knob insights' (confirmed cross-run 2026-06-18/19): on breast/demo (128-view substrates) the IMAGE-domain over-smoothing lever is img_sr, and 'default 0.02 too loose -> degenerates to a Gaussian blur ... Tighten img_sr->0.0005 for edge preservation'. The whole 5-deep cascade currently initialises every layer's RANGE sigma at 0.02, so each of the 5 BFs starts in the loose-Gaussian regime that smooths across phantom edges -> caps SSIM. Tightening img_sr to 0.0005 makes all 5 layers edge-preserving from init (sigma_r << data range preserves edges; sigma_r >> range degenerates to Gaussian, per solver_dual_ddomain_bilateral_n2i.md). This maximally leverages the deep cascade (5 layers x tighter range) and targets exactly the SSIM-capping over-smoothing rather than the exhausted PSNR/noise axis. Chose img_sr over img_n_bf 5->7 (exhausted lever, flat PSNR) and over img_kernel (a less-informed guess: kernel sets spatial extent, but the symptom here is range-domain over-smoothing across edges, which img_sr governs directly). Held fixed: img_n_bf=5, proj_n_bf=1, kernels (proj_k=7/img_k=5), proj sigmas (1.0/2.0/0.02), img spatial sigmas (img_sx=1.5/img_sy=1.5), lr=2.3e-3, warm_start=True, pretrain_epochs=3, n_iter=400, train_n=200, val_n=6, grad_clip=1.0, seed=42 (-> identical val split, directly comparable to iter-1/2/3). Wall: iter-3 ran 235 s; img_sr is an init value, zero added compute, so wall ~unchanged, comfortably under the 1800 s sbatch wall and 1200 s outer_wall_s guard. Hypothesis: tightening the image-domain range sigma to 0.0005 stops the 5-deep cascade from degenerating into a Gaussian blur across phantom edges, preserving fine structural detail and lifting val_score above iter-3's 0.7705 (the SSIM/edge axis, which still has headroom, not the saturated PSNR/noise axis). If it does NOT move val_score (or regresses), it confirms the image-domain BF range sigma is already effectively tight after training on this substrate and the next iter should pivot to img_kernel (spatial extent) or img spatial sigmas.", "advice_for_others": "dual_domain_bilateral_n2i-claude-agentic: train_n=200, val_n=6, batch_size=1, grad_clip=1.0, seed=42, warm_start=True, pretrain_epochs=3, n_iter=400, outer_wall_s=1200, lr=0.0023, proj_n_bf=1, img_n_bf=5, proj_kernel=7, img_kernel=5, proj_sx=1.0, proj_sy=2.0, proj_sr=0.02, img_sx=1.5, img_sy=1.5, img_sr=0.0005, rationale=iter-4: ONE knob changed vs iter-3 (img_sr 0.02->0.0005, the image-domain BILATERAL RANGE sigma); all 18 other fields held IDENTICAL to demo_dl_dual_domain_bilateral_n2i_iter_03.json (img_n_bf=5 deep cascade kept). PIVOT from DEPTH to RANGE-SIGMA TUNING, because depth is now in clear diminishing returns and PSNR has SATURATED. Trajectory: iter-1 img_n_bf=1 val 0.6657/hr+0.2763/PSNR 19.47; iter-2 img_n_bf=3 val 0.7465/hr+0.3276/PSNR 20.10 (+0.081 SSIM, +0.63 dB); iter-3 img_n_bf=5 val 0.7705/hr+0.3335/PSNR 20.18 (+0.024 SSIM, only +0.08 dB). The SSIM deltas are halving each depth step (+0.081 -> +0.024) and PSNR has flatlined (20.10 -> 20.18) -> img_n_bf depth has hit its structural ceiling; one more notch (5->7) would buy <0.012 SSIM at best. The higher-EV move is to make the deep 5-layer cascade we ALREADY have actually edge-preserving. Per docs/runs/mayo_campaign_state.md 'N2I PER-IMAGE knob insights' (confirmed cross-run 2026-06-18/19): on breast/demo (128-view substrates) the IMAGE-domain over-smoothing lever is img_sr, and 'default 0.02 too loose -> degenerates to a Gaussian blur ... Tighten img_sr->0.0005 for edge preservation'. The whole 5-deep cascade currently initialises every layer's RANGE sigma at 0.02, so each of the 5 BFs starts in the loose-Gaussian regime that smooths across phantom edges -> caps SSIM. Tightening img_sr to 0.0005 makes all 5 layers edge-preserving from init (sigma_r << data range preserves edges; sigma_r >> range degenerates to Gaussian, per solver_dual_ddomain_bilateral_n2i.md). This maximally leverages the deep cascade (5 layers x tighter range) and targets exactly the SSIM-capping over-smoothing rather than the exhausted PSNR/noise axis. Chose img_sr over img_n_bf 5->7 (exhausted lever, flat PSNR) and over img_kernel (a less-informed guess: kernel sets spatial extent, but the symptom here is range-domain over-smoothing across edges, which img_sr governs directly). Held fixed: img_n_bf=5, proj_n_bf=1, kernels (proj_k=7/img_k=5), proj sigmas (1.0/2.0/0.02), img spatial sigmas (img_sx=1.5/img_sy=1.5), lr=2.3e-3, warm_start=True, pretrain_epochs=3, n_iter=400, train_n=200, val_n=6, grad_clip=1.0, seed=42 (-> identical val split, directly comparable to iter-1/2/3). Wall: iter-3 ran 235 s; img_sr is an init value, zero added compute, so wall ~unchanged, comfortably under the 1800 s sbatch wall and 1200 s outer_wall_s guard. Hypothesis: tightening the image-domain range sigma to 0.0005 stops the 5-deep cascade from degenerating into a Gaussian blur across phantom edges, preserving fine structural detail and lifting val_score above iter-3's 0.7705 (the SSIM/edge axis, which still has headroom, not the saturated PSNR/noise axis). If it does NOT move val_score (or regresses), it confirms the image-domain BF range sigma is already effectively tight after training on this substrate and the next iter should pivot to img_kernel (spatial extent) or img spatial sigmas.", "comparison_image": "runs/demo-dl-claude-agentic-dual-domain-bilateral-n2i-search-20260618-01/iterations/iter-0004/comparison.png"}
{"ts": "2026-06-18T22:58:27Z", "run_id": "demo-dl-claude-agentic-dual-domain-n2i-search-20260618-01", "iter": 4, "agent": "dual_domain_n2i-claude-agentic-breast-ct", "model": "claude-opus-4.7-1m", "change_class": "architecture", "status": "discard", "kept": false, "val_score": 0.49569302797317505, "headroom": 0.0, "params_M": 0.465762, "train_n": 400, "rationale": "dual_domain_n2i-claude-agentic: train_n=200, val_n=6, batch_size=1, grad_clip=1.0, seed=42, warm_start=True, pretrain_epochs=6, n_iter=600, outer_wall_s=1200, lr=0.0001, unet_c=16, rationale=iter-4: ONE knob -> pretrain_epochs 3 -> 6 (2x warm-start budget). KEEP lr=1e-4 (the iter-3 winner). DIAGNOSIS (numbers, not pixels): iter-1 lr1e-3/n_iter400 SSIM 0.4785; iter-2 n_iter1200 0.4293 (more per-scan steps HURT -> per-image overfit, n_iter ruled out); iter-3 lr1e-3->1e-4 0.4880 (+0.01, the overfit-anchor lever). The lr-anchor gain was SMALL and exactly as iter-3 predicted: 'at lr=1e-4 the per-image fit barely moves off warm-start' -- so the per-scan recon is now PINNED to the warm-start init. iter-3 named this iter's lever verbatim: 'if SSIM is still flat at ~0.47 the warm-start init itself is the floor and iter-4 should toggle warm_start / raise pretrain_epochs.' SSIM rose only 0.4785->0.4880, i.e. essentially the warm-start floor. FAILURE MODE now = warm-start init is the operating point and is under-trained at 3 epochs; with lr anchored at 1e-4 the per-scan fit cannot escape a poor init, so the init quality is the ceiling. unet_c is NOT the lever (campaign-state: mayo c16->c32 flat 0.9508; solver design doc warns capacity is not the lever for this loss) and n_iter is RULED OUT (iter-2 regressed). So the remaining lr=1e-4 lever is the INIT: raise pretrain_epochs 3->6 to give the amortized GT-free N2I warm-start pre-pass twice the budget to settle on a better U-Net init, which the lr=1e-4 per-scan fit then preserves and slightly refines. HYPOTHESIS: a better-converged warm-start init lifts SSIM above the 0.4880 iter-3 plateau toward the LD-FBP baseline (still structurally FBP-bounded on 128-view, so expect approach-to-baseline / small headroom, not a large jump); if SSIM stays flat at ~0.49 the warm-start pre-pass is already saturated at 3ep and iter-5 should probe warm_start sensitivity (toggle off, or seed). WALL: warm 6x200=1200 + per-image 6x600=3600 = 4800 steps @ ~0.083 s/step ~= 400 s (iter-3 was 340s at 4200 steps), well under the 15-min target, the outer_wall_s=1200 guard, and the 1800 s sbatch wall. All other knobs IDENTICAL to iter-3 (train_n=200, val_n=6, batch_size=1, grad_clip=1.0, seed=42, warm_start=True, n_iter=600, lr=1e-4, unet_c=16).", "advice_for_others": "dual_domain_n2i-claude-agentic: train_n=200, val_n=6, batch_size=1, grad_clip=1.0, seed=42, warm_start=True, pretrain_epochs=6, n_iter=600, outer_wall_s=1200, lr=0.0001, unet_c=16, rationale=iter-4: ONE knob -> pretrain_epochs 3 -> 6 (2x warm-start budget). KEEP lr=1e-4 (the iter-3 winner). DIAGNOSIS (numbers, not pixels): iter-1 lr1e-3/n_iter400 SSIM 0.4785; iter-2 n_iter1200 0.4293 (more per-scan steps HURT -> per-image overfit, n_iter ruled out); iter-3 lr1e-3->1e-4 0.4880 (+0.01, the overfit-anchor lever). The lr-anchor gain was SMALL and exactly as iter-3 predicted: 'at lr=1e-4 the per-image fit barely moves off warm-start' -- so the per-scan recon is now PINNED to the warm-start init. iter-3 named this iter's lever verbatim: 'if SSIM is still flat at ~0.47 the warm-start init itself is the floor and iter-4 should toggle warm_start / raise pretrain_epochs.' SSIM rose only 0.4785->0.4880, i.e. essentially the warm-start floor. FAILURE MODE now = warm-start init is the operating point and is under-trained at 3 epochs; with lr anchored at 1e-4 the per-scan fit cannot escape a poor init, so the init quality is the ceiling. unet_c is NOT the lever (campaign-state: mayo c16->c32 flat 0.9508; solver design doc warns capacity is not the lever for this loss) and n_iter is RULED OUT (iter-2 regressed). So the remaining lr=1e-4 lever is the INIT: raise pretrain_epochs 3->6 to give the amortized GT-free N2I warm-start pre-pass twice the budget to settle on a better U-Net init, which the lr=1e-4 per-scan fit then preserves and slightly refines. HYPOTHESIS: a better-converged warm-start init lifts SSIM above the 0.4880 iter-3 plateau toward the LD-FBP baseline (still structurally FBP-bounded on 128-view, so expect approach-to-baseline / small headroom, not a large jump); if SSIM stays flat at ~0.49 the warm-start pre-pass is already saturated at 3ep and iter-5 should probe warm_start sensitivity (toggle off, or seed). WALL: warm 6x200=1200 + per-image 6x600=3600 = 4800 steps @ ~0.083 s/step ~= 400 s (iter-3 was 340s at 4200 steps), well under the 15-min target, the outer_wall_s=1200 guard, and the 1800 s sbatch wall. All other knobs IDENTICAL to iter-3 (train_n=200, val_n=6, batch_size=1, grad_clip=1.0, seed=42, warm_start=True, n_iter=600, lr=1e-4, unet_c=16).", "comparison_image": "runs/demo-dl-claude-agentic-dual-domain-n2i-search-20260618-01/iterations/iter-0004/comparison.png"}
