{"ts": "2026-06-18T21:58:41Z", "run_id": "demo-dl-claude-agentic-dual-domain-n2i-search-20260618-01", "iter": 3, "agent": "dual_domain_n2i-claude-agentic-breast-ct", "model": "claude-opus-4.7-1m", "change_class": "architecture", "status": "discard", "kept": false, "val_score": 0.48798996210098267, "headroom": 0.0, "params_M": 0.465762, "train_n": 400, "rationale": "dual_domain_n2i-claude-agentic: train_n=200, val_n=6, batch_size=1, grad_clip=1.0, seed=42, warm_start=True, pretrain_epochs=3, n_iter=600, outer_wall_s=1200, lr=0.0001, unet_c=16, rationale=iter-3: ONE knob -> per-scan lr 1e-3 -> 1e-4 (10x lower). DIAGNOSIS (numbers, not pixels): the plateau is NOT under-convergence. iter-1 (n_iter=400) PSNR 16.13/SSIM 0.4785; iter-2 (n_iter=1200, 3x steps) PSNR 15.99/SSIM 0.4293 -> tripling per-scan steps made it STRICTLY WORSE. A fit approaching its FBP-bounded optimum would rise or plateau; it DEGRADES, the signature of the 0.466 M-param U-Net OVERFITTING each single noisy scan's split-view N2I objective. The per-image loop has no early-stop/best-iter pick (solver _fit_one_scene takes the FINAL predict after a fixed n_iter), so extra Adam steps at lr=1e-3 walk the recon away from the decent warm-start init toward a noise-fitting minimum BELOW the 16.67 dB LD-FBP baseline (hr=0). FAILURE MODE = per-image overfitting of an over-parameterized denoiser to one noisy scan. PROOF the warm-start+per-image plumbing is fine: the BILATERAL twin (identical pipeline, identical warm_start/n_iter=400/seed=42 -> SAME 6 val scenes) hit PSNR 19.47/SSIM 0.6657 hr+0.2763 at its iter-1 and climbed to 0.7465 -- its 6-12-param BF physically CANNOT overfit a single scan, which is exactly why it clears baseline while the U-Net dives under. So the lever is NOT n_iter (saturated/counterproductive) and NOT unet_c (the solver design doc explicitly warns 'don't waste iters on U-Net width: capacity is not the lever for this loss on this dataset'; the BF gained from capacity because BF capacity is structurally constrained, the U-Net's is not). The lever is the per-scan STEP SIZE: drop lr 10x to 1e-4 so Adam stays anchored near the warm-start init (the good operating point the BF twin proves exists) instead of descending into the single-scan noise-fitting minimum. n_iter trimmed 1200 -> 600 (less overshoot needed at low lr; keeps wall short). HYPOTHESIS: at lr=1e-4 the per-image fit barely moves off warm-start, so SSIM/PSNR rise toward and above the 16.67 dB LD-FBP baseline (target: break the 0.4785 plateau, ideally approach the BF twin's ~0.66 / the historical demo_dl N2I hr 0.3811); if SSIM is still flat at ~0.47 the warm-start init itself is the floor and iter-4 should toggle warm_start / raise pretrain_epochs. WALL: warm 3x200=600 + per-image 6x600=3600 = 4200 steps @ ~0.083 s/step ~= 350 s (iter-1 was 250s at 3000 steps), well under the 15-min target, the outer_wall_s=1200 guard, and the 1800 s sbatch wall. All other knobs IDENTICAL to iter-2 (train_n=200, val_n=6, batch_size=1, grad_clip=1.0, seed=42, warm_start=True, pretrain_epochs=3, unet_c=16).", "advice_for_others": "dual_domain_n2i-claude-agentic: train_n=200, val_n=6, batch_size=1, grad_clip=1.0, seed=42, warm_start=True, pretrain_epochs=3, n_iter=600, outer_wall_s=1200, lr=0.0001, unet_c=16, rationale=iter-3: ONE knob -> per-scan lr 1e-3 -> 1e-4 (10x lower). DIAGNOSIS (numbers, not pixels): the plateau is NOT under-convergence. iter-1 (n_iter=400) PSNR 16.13/SSIM 0.4785; iter-2 (n_iter=1200, 3x steps) PSNR 15.99/SSIM 0.4293 -> tripling per-scan steps made it STRICTLY WORSE. A fit approaching its FBP-bounded optimum would rise or plateau; it DEGRADES, the signature of the 0.466 M-param U-Net OVERFITTING each single noisy scan's split-view N2I objective. The per-image loop has no early-stop/best-iter pick (solver _fit_one_scene takes the FINAL predict after a fixed n_iter), so extra Adam steps at lr=1e-3 walk the recon away from the decent warm-start init toward a noise-fitting minimum BELOW the 16.67 dB LD-FBP baseline (hr=0). FAILURE MODE = per-image overfitting of an over-parameterized denoiser to one noisy scan. PROOF the warm-start+per-image plumbing is fine: the BILATERAL twin (identical pipeline, identical warm_start/n_iter=400/seed=42 -> SAME 6 val scenes) hit PSNR 19.47/SSIM 0.6657 hr+0.2763 at its iter-1 and climbed to 0.7465 -- its 6-12-param BF physically CANNOT overfit a single scan, which is exactly why it clears baseline while the U-Net dives under. So the lever is NOT n_iter (saturated/counterproductive) and NOT unet_c (the solver design doc explicitly warns 'don't waste iters on U-Net width: capacity is not the lever for this loss on this dataset'; the BF gained from capacity because BF capacity is structurally constrained, the U-Net's is not). The lever is the per-scan STEP SIZE: drop lr 10x to 1e-4 so Adam stays anchored near the warm-start init (the good operating point the BF twin proves exists) instead of descending into the single-scan noise-fitting minimum. n_iter trimmed 1200 -> 600 (less overshoot needed at low lr; keeps wall short). HYPOTHESIS: at lr=1e-4 the per-image fit barely moves off warm-start, so SSIM/PSNR rise toward and above the 16.67 dB LD-FBP baseline (target: break the 0.4785 plateau, ideally approach the BF twin's ~0.66 / the historical demo_dl N2I hr 0.3811); if SSIM is still flat at ~0.47 the warm-start init itself is the floor and iter-4 should toggle warm_start / raise pretrain_epochs. WALL: warm 3x200=600 + per-image 6x600=3600 = 4200 steps @ ~0.083 s/step ~= 350 s (iter-1 was 250s at 3000 steps), well under the 15-min target, the outer_wall_s=1200 guard, and the 1800 s sbatch wall. All other knobs IDENTICAL to iter-2 (train_n=200, val_n=6, batch_size=1, grad_clip=1.0, seed=42, warm_start=True, pretrain_epochs=3, unet_c=16).", "comparison_image": "runs/demo-dl-claude-agentic-dual-domain-n2i-search-20260618-01/iterations/iter-0003/comparison.png"}
{"ts": "2026-06-18T21:56:04Z", "run_id": "demo-dl-claude-agentic-dual-domain-bilateral-n2i-search-20260618-01", "iter": 3, "agent": "dual_domain_bilateral_n2i-claude-agentic-breast-ct", "model": "claude-opus-4.7-1m", "change_class": "architecture", "status": "keep", "kept": true, "val_score": 0.7704606056213379, "headroom": 0.33353079847985845, "params_M": 1.8e-05, "train_n": 400, "rationale": "dual_domain_bilateral_n2i-claude-agentic: train_n=200, val_n=6, batch_size=1, grad_clip=1.0, seed=42, warm_start=True, pretrain_epochs=3, n_iter=400, outer_wall_s=1200, lr=0.0023, proj_n_bf=1, img_n_bf=5, proj_kernel=7, img_kernel=5, proj_sx=1.0, proj_sy=2.0, proj_sr=0.02, img_sx=1.5, img_sy=1.5, img_sr=0.02, rationale=iter-3: ONE knob changed vs iter-2 (img_n_bf 3->5); all 18 other fields held IDENTICAL to demo_dl_dual_domain_bilateral_n2i_iter_02.json. Trajectory: iter-1 img_n_bf=1 -> val 0.6657 / hr +0.2763; iter-2 img_n_bf=3 -> val 0.7465 / hr +0.3276 (+0.081 SSIM, +0.63 dB PSNR). The image-domain capacity lever is the WORKING lever (proj side is in the symmetry trap per the design doc: proj sigmas near-identity -> stacked proj BFs stay locked-symmetric, so proj_n_bf stays 1). Keep exploiting the proven lever one notch further: deepen the image-domain bilateral cascade 3->5. Per solver_dual_ddomain_bilateral_n2i.md, the image-domain stack readily differentiates into a multi-scale cascade (BF1 mild + tight sigma_r, BF2 wider, BF3 widest); two MORE BFs give the cascade two additional scales (coarse-to-fine edge-preserving), growing the image denoiser from 9 to 15 trainable scalars (total network 12->18, still ultra-low, far too few to memorise 6 val scenes). Chose DEPTH over kernel/sigma because depth is the proven lever here (+0.08 with one notch 1->3) whereas a kernel/sigma tweak would be a less-informed guess. Held fixed: proj_n_bf=1, kernels (proj_k=7/img_k=5), all six sigma inits (proj 1.0/2.0/0.02, img 1.5/1.5/0.02), lr=2.3e-3, warm_start=True, pretrain_epochs=3, n_iter=400, train_n=200, val_n=6, grad_clip=1.0, seed=42 (-> identical val split, directly comparable to iter-1/iter-2). Wall: iter-2 ran 175 s; two more image-domain BFs add only a small fraction of the 128-view FBP+proj per-step cost, so comfortably under the 1800 s sbatch wall and the 1200 s outer_wall_s internal guard. Hypothesis: a 5-deep image-domain cascade adds coarse+fine scales beyond the 3-deep cascade, lifting val_score above iter-2 0.7465. If it does NOT move val_score (or regresses), the image-domain BF depth has hit its structural ceiling on this dense phantom substrate and iter-4 should pivot from DEPTH to img kernel (img_k 5->7) or img sigma tuning.", "advice_for_others": "dual_domain_bilateral_n2i-claude-agentic: train_n=200, val_n=6, batch_size=1, grad_clip=1.0, seed=42, warm_start=True, pretrain_epochs=3, n_iter=400, outer_wall_s=1200, lr=0.0023, proj_n_bf=1, img_n_bf=5, proj_kernel=7, img_kernel=5, proj_sx=1.0, proj_sy=2.0, proj_sr=0.02, img_sx=1.5, img_sy=1.5, img_sr=0.02, rationale=iter-3: ONE knob changed vs iter-2 (img_n_bf 3->5); all 18 other fields held IDENTICAL to demo_dl_dual_domain_bilateral_n2i_iter_02.json. Trajectory: iter-1 img_n_bf=1 -> val 0.6657 / hr +0.2763; iter-2 img_n_bf=3 -> val 0.7465 / hr +0.3276 (+0.081 SSIM, +0.63 dB PSNR). The image-domain capacity lever is the WORKING lever (proj side is in the symmetry trap per the design doc: proj sigmas near-identity -> stacked proj BFs stay locked-symmetric, so proj_n_bf stays 1). Keep exploiting the proven lever one notch further: deepen the image-domain bilateral cascade 3->5. Per solver_dual_ddomain_bilateral_n2i.md, the image-domain stack readily differentiates into a multi-scale cascade (BF1 mild + tight sigma_r, BF2 wider, BF3 widest); two MORE BFs give the cascade two additional scales (coarse-to-fine edge-preserving), growing the image denoiser from 9 to 15 trainable scalars (total network 12->18, still ultra-low, far too few to memorise 6 val scenes). Chose DEPTH over kernel/sigma because depth is the proven lever here (+0.08 with one notch 1->3) whereas a kernel/sigma tweak would be a less-informed guess. Held fixed: proj_n_bf=1, kernels (proj_k=7/img_k=5), all six sigma inits (proj 1.0/2.0/0.02, img 1.5/1.5/0.02), lr=2.3e-3, warm_start=True, pretrain_epochs=3, n_iter=400, train_n=200, val_n=6, grad_clip=1.0, seed=42 (-> identical val split, directly comparable to iter-1/iter-2). Wall: iter-2 ran 175 s; two more image-domain BFs add only a small fraction of the 128-view FBP+proj per-step cost, so comfortably under the 1800 s sbatch wall and the 1200 s outer_wall_s internal guard. Hypothesis: a 5-deep image-domain cascade adds coarse+fine scales beyond the 3-deep cascade, lifting val_score above iter-2 0.7465. If it does NOT move val_score (or regresses), the image-domain BF depth has hit its structural ceiling on this dense phantom substrate and iter-4 should pivot from DEPTH to img kernel (img_k 5->7) or img sigma tuning.", "comparison_image": "runs/demo-dl-claude-agentic-dual-domain-bilateral-n2i-search-20260618-01/iterations/iter-0003/comparison.png"}
{"ts": "2026-06-18T21:45:52Z", "run_id": "demo-dl-claude-agentic-dual-domain-n2i-search-20260618-01", "iter": 2, "agent": "dual_domain_n2i-claude-agentic-breast-ct", "model": "claude-opus-4.7-1m", "change_class": "architecture", "status": "discard", "kept": false, "val_score": 0.4293029308319092, "headroom": 0.0, "params_M": 0.465762, "train_n": 400, "rationale": "dual_domain_n2i-claude-agentic: train_n=200, val_n=6, batch_size=1, grad_clip=1.0, seed=42, warm_start=True, pretrain_epochs=3, n_iter=1200, outer_wall_s=1200, lr=0.001, unet_c=16, rationale=iter-2: ONE knob -> n_iter 400->1200 (per-scan Adam steps, 3x). Failure mode from iter-1: val_score 0.4785, headroom 0.0, PSNR 16.13 < LD-FBP baseline 16.67 (under baseline). Hypothesis: the per-scan self-supervised U-Net N2I fit UNDER-CONVERGES at 400 steps on each val scene's own 128-view measurements; the per-image objective had not settled, so the recon was still far from its FBP-bounded optimum. iter-1 used only 250s wall (3000 total steps in 249.97s ~= 0.083 s/step), leaving huge headroom under the 1200s outer_wall_s and 1800s sbatch wall. Tripling per-scan steps lets each scan's own-measurement fit converge. New step budget: warm 3x200=600 + per-image 6x1200=7200 = 7800 steps @ ~0.083 s/step ~= 650s, still under outer_wall_s=1200 and the 00:30:00 sbatch wall. All other knobs UNCHANGED from iter-1 (warm_start=True, pretrain_epochs=3, train_n=200, val_n=6, grad_clip=1.0, lr=1e-3, unet_c=16, seed=42). Expectation: SSIM rises toward/above the LD-FBP baseline as the per-scan fit converges; N2I remains structurally FBP-bounded on this dense-view 128-angle phantom substrate (solver_plan.md), so a small positive headroom or a clean approach-to-baseline is the success signal, not a large jump.", "advice_for_others": "dual_domain_n2i-claude-agentic: train_n=200, val_n=6, batch_size=1, grad_clip=1.0, seed=42, warm_start=True, pretrain_epochs=3, n_iter=1200, outer_wall_s=1200, lr=0.001, unet_c=16, rationale=iter-2: ONE knob -> n_iter 400->1200 (per-scan Adam steps, 3x). Failure mode from iter-1: val_score 0.4785, headroom 0.0, PSNR 16.13 < LD-FBP baseline 16.67 (under baseline). Hypothesis: the per-scan self-supervised U-Net N2I fit UNDER-CONVERGES at 400 steps on each val scene's own 128-view measurements; the per-image objective had not settled, so the recon was still far from its FBP-bounded optimum. iter-1 used only 250s wall (3000 total steps in 249.97s ~= 0.083 s/step), leaving huge headroom under the 1200s outer_wall_s and 1800s sbatch wall. Tripling per-scan steps lets each scan's own-measurement fit converge. New step budget: warm 3x200=600 + per-image 6x1200=7200 = 7800 steps @ ~0.083 s/step ~= 650s, still under outer_wall_s=1200 and the 00:30:00 sbatch wall. All other knobs UNCHANGED from iter-1 (warm_start=True, pretrain_epochs=3, train_n=200, val_n=6, grad_clip=1.0, lr=1e-3, unet_c=16, seed=42). Expectation: SSIM rises toward/above the LD-FBP baseline as the per-scan fit converges; N2I remains structurally FBP-bounded on this dense-view 128-angle phantom substrate (solver_plan.md), so a small positive headroom or a clean approach-to-baseline is the success signal, not a large jump.", "comparison_image": "runs/demo-dl-claude-agentic-dual-domain-n2i-search-20260618-01/iterations/iter-0002/comparison.png"}
{"ts": "2026-06-18T21:38:35Z", "run_id": "demo-dl-claude-agentic-dual-domain-bilateral-n2i-search-20260618-01", "iter": 2, "agent": "dual_domain_bilateral_n2i-claude-agentic-breast-ct", "model": "claude-opus-4.7-1m", "change_class": "architecture", "status": "keep", "kept": true, "val_score": 0.7465083003044128, "headroom": 0.3275571662549659, "params_M": 1.2e-05, "train_n": 400, "rationale": "dual_domain_bilateral_n2i-claude-agentic: train_n=200, val_n=6, batch_size=1, grad_clip=1.0, seed=42, warm_start=True, pretrain_epochs=3, n_iter=400, outer_wall_s=1200, lr=0.0023, proj_n_bf=1, img_n_bf=3, proj_kernel=7, img_kernel=5, proj_sx=1.0, proj_sy=2.0, proj_sr=0.02, img_sx=1.5, img_sy=1.5, img_sr=0.02, rationale=iter-2: ONE knob changed vs iter-1 (img_n_bf 1->3); all 18 other fields held IDENTICAL to demo_dl_dual_domain_bilateral_n2i_iter_01.json (job that scored val_score 0.6657, hr +0.2763, PSNR 19.47 vs LD-FBP 16.67 baseline -- the best of the 4 demo_dl N2I runs and ALREADY above baseline). The lever here is to push HIGHER, not just clear baseline. Design-doc hint (solver_dual_ddomain_bilateral_n2i.md 'Hints for the next autoresearch agent'): the projection-domain stack is in the symmetry trap on phantoms (proj sigmas near-identity -> stacked proj BFs stay locked-symmetric, proj_n_bf increase = wasted params), so spend the parameter budget on the IMAGE side. The image-domain stack 'readily differentiates into a multi-scale cascade (BF1 mild + tight sigma_r, BF2 wider, BF3 widest)'. img_n_bf 1->3 grows the image denoiser from 3 to 9 trainable scalars (total network 6->12 params, still ultra-low) for a genuine multi-scale image-domain cascade. Held fixed: proj_n_bf=1 (no point stacking the near-identity proj filter), kernels (proj_k=7/img_k=5), all six sigma inits (proj 1.0/2.0/0.02, img 1.5/1.5/0.02), lr=2.3e-3, warm_start=True, pretrain_epochs=3, n_iter=400, train_n=200, val_n=6, grad_clip=1.0, seed=42 (-> identical val split, directly comparable to iter-1). Wall: iter-1 ran 126 s; adding 2 image-domain BFs per FBP roughly 2-3x the per-step image cost but image-domain is a tiny fraction of the 128-view FBP+proj cost, so well under the 1800 s sbatch wall and the 1200 s outer_wall_s internal guard. Hypothesis: a 3-deep image-domain bilateral cascade gives the denoiser multi-scale capacity (coarse smoothing + edge-preserving fine pass) that a single image BF cannot, lifting val_score above iter-1's 0.6657 without the proj-stack symmetry waste -- and without enough parameters to memorise (12 scalars). If it does NOT move val_score, that confirms the image-domain BF is also near its structural ceiling on this dense phantom substrate and the next iter should pivot to img kernel/sigma tuning instead of depth.", "advice_for_others": "dual_domain_bilateral_n2i-claude-agentic: train_n=200, val_n=6, batch_size=1, grad_clip=1.0, seed=42, warm_start=True, pretrain_epochs=3, n_iter=400, outer_wall_s=1200, lr=0.0023, proj_n_bf=1, img_n_bf=3, proj_kernel=7, img_kernel=5, proj_sx=1.0, proj_sy=2.0, proj_sr=0.02, img_sx=1.5, img_sy=1.5, img_sr=0.02, rationale=iter-2: ONE knob changed vs iter-1 (img_n_bf 1->3); all 18 other fields held IDENTICAL to demo_dl_dual_domain_bilateral_n2i_iter_01.json (job that scored val_score 0.6657, hr +0.2763, PSNR 19.47 vs LD-FBP 16.67 baseline -- the best of the 4 demo_dl N2I runs and ALREADY above baseline). The lever here is to push HIGHER, not just clear baseline. Design-doc hint (solver_dual_ddomain_bilateral_n2i.md 'Hints for the next autoresearch agent'): the projection-domain stack is in the symmetry trap on phantoms (proj sigmas near-identity -> stacked proj BFs stay locked-symmetric, proj_n_bf increase = wasted params), so spend the parameter budget on the IMAGE side. The image-domain stack 'readily differentiates into a multi-scale cascade (BF1 mild + tight sigma_r, BF2 wider, BF3 widest)'. img_n_bf 1->3 grows the image denoiser from 3 to 9 trainable scalars (total network 6->12 params, still ultra-low) for a genuine multi-scale image-domain cascade. Held fixed: proj_n_bf=1 (no point stacking the near-identity proj filter), kernels (proj_k=7/img_k=5), all six sigma inits (proj 1.0/2.0/0.02, img 1.5/1.5/0.02), lr=2.3e-3, warm_start=True, pretrain_epochs=3, n_iter=400, train_n=200, val_n=6, grad_clip=1.0, seed=42 (-> identical val split, directly comparable to iter-1). Wall: iter-1 ran 126 s; adding 2 image-domain BFs per FBP roughly 2-3x the per-step image cost but image-domain is a tiny fraction of the 128-view FBP+proj cost, so well under the 1800 s sbatch wall and the 1200 s outer_wall_s internal guard. Hypothesis: a 3-deep image-domain bilateral cascade gives the denoiser multi-scale capacity (coarse smoothing + edge-preserving fine pass) that a single image BF cannot, lifting val_score above iter-1's 0.6657 without the proj-stack symmetry waste -- and without enough parameters to memorise (12 scalars). If it does NOT move val_score, that confirms the image-domain BF is also near its structural ceiling on this dense phantom substrate and the next iter should pivot to img kernel/sigma tuning instead of depth.", "comparison_image": "runs/demo-dl-claude-agentic-dual-domain-bilateral-n2i-search-20260618-01/iterations/iter-0002/comparison.png"}
