{"ts": "2026-05-21T00:15:35Z", "run_id": "demo-intensity-calibrated-tpe-wu-search-20260521-01", "iter": 12, "agent": "wu-search-tpe-calibrated", "model": "random-search", "change_class": "architecture", "status": "keep", "kept": true, "val_score": null, "headroom": 0.22046476195973352, "params_M": 0.0, "train_n": 0, "rationale": "wu-search-tpe-calibrated: wu_n_bands=8, wu_n_outer=1, wu_motion_range=3, wu_motion_window=2, wu_soft_thresh=0.0022511", "advice_for_others": "wu-search-tpe-calibrated: wu_n_bands=8, wu_n_outer=1, wu_motion_range=3, wu_motion_window=2, wu_soft_thresh=0.0022511 -> hr=0.2205", "comparison_image": "runs/demo-intensity-calibrated-tpe-wu-search-20260521-01/iterations/iter-0012/comparison.png"}
{"ts": "2026-05-21T00:15:21Z", "run_id": "demo-intensity-calibrated-tpe-wu-search-20260521-01", "iter": 11, "agent": "wu-search-tpe-calibrated", "model": "random-search", "change_class": "architecture", "status": "keep", "kept": true, "val_score": null, "headroom": 0.2154538256827495, "params_M": 0.0, "train_n": 0, "rationale": "wu-search-tpe-calibrated: wu_n_bands=12, wu_n_outer=1, wu_motion_range=8, wu_motion_window=1, wu_soft_thresh=0.0025579", "advice_for_others": "wu-search-tpe-calibrated: wu_n_bands=12, wu_n_outer=1, wu_motion_range=8, wu_motion_window=1, wu_soft_thresh=0.0025579 -> hr=0.2155", "comparison_image": "runs/demo-intensity-calibrated-tpe-wu-search-20260521-01/iterations/iter-0011/comparison.png"}
{"ts": "2026-05-21T00:15:06Z", "run_id": "demo-intensity-calibrated-tpe-wu-search-20260521-01", "iter": 10, "agent": "wu-search-tpe-calibrated", "model": "random-search", "change_class": "architecture", "status": "keep", "kept": true, "val_score": null, "headroom": 0.1655772477338553, "params_M": 0.0, "train_n": 0, "rationale": "wu-search-tpe-calibrated: wu_n_bands=8, wu_n_outer=3, wu_motion_range=8, wu_motion_window=1, wu_soft_thresh=0.00050877", "advice_for_others": "wu-search-tpe-calibrated: wu_n_bands=8, wu_n_outer=3, wu_motion_range=8, wu_motion_window=1, wu_soft_thresh=0.00050877 -> hr=0.1656", "comparison_image": "runs/demo-intensity-calibrated-tpe-wu-search-20260521-01/iterations/iter-0010/comparison.png"}
{"ts": "2026-05-21T00:14:52Z", "run_id": "demo-intensity-calibrated-tpe-wu-search-20260521-01", "iter": 9, "agent": "wu-search-tpe-calibrated", "model": "random-search", "change_class": "architecture", "status": "keep", "kept": true, "val_score": null, "headroom": 0.22029811488386863, "params_M": 0.0, "train_n": 0, "rationale": "wu-search-tpe-calibrated: wu_n_bands=8, wu_n_outer=1, wu_motion_range=8, wu_motion_window=1, wu_soft_thresh=0.0023594", "advice_for_others": "wu-search-tpe-calibrated: wu_n_bands=8, wu_n_outer=1, wu_motion_range=8, wu_motion_window=1, wu_soft_thresh=0.0023594 -> hr=0.2203", "comparison_image": "runs/demo-intensity-calibrated-tpe-wu-search-20260521-01/iterations/iter-0009/comparison.png"}
{"ts": "2026-05-21T00:14:38Z", "run_id": "demo-intensity-calibrated-tpe-wu-search-20260521-01", "iter": 8, "agent": "wu-search-tpe-calibrated", "model": "random-search", "change_class": "architecture", "status": "keep", "kept": true, "val_score": null, "headroom": 0.21934633260692038, "params_M": 0.0, "train_n": 0, "rationale": "wu-search-tpe-calibrated: wu_n_bands=8, wu_n_outer=1, wu_motion_range=12, wu_motion_window=2, wu_soft_thresh=0.0017468", "advice_for_others": "wu-search-tpe-calibrated: wu_n_bands=8, wu_n_outer=1, wu_motion_range=12, wu_motion_window=2, wu_soft_thresh=0.0017468 -> hr=0.2193", "comparison_image": "runs/demo-intensity-calibrated-tpe-wu-search-20260521-01/iterations/iter-0008/comparison.png"}
{"ts": "2026-05-21T00:14:32Z", "run_id": "demo-intensity-calibrated-tpe-tv-search-20260520-01", "iter": 10, "agent": "tv-search-tpe-calibrated", "model": "random-search", "change_class": "architecture", "status": "keep", "kept": true, "val_score": null, "headroom": 0.20802164668354783, "params_M": 0.0, "train_n": 0, "rationale": "tv-search-tpe-calibrated: tv_lambda=0.003763, tv_iterations=397, tv_lr=0.017772, tv_clip_max=0.049605, tv_decay=0.03522", "advice_for_others": "tv-search-tpe-calibrated: tv_lambda=0.003763, tv_iterations=397, tv_lr=0.017772, tv_clip_max=0.049605, tv_decay=0.03522 -> hr=0.2080", "comparison_image": "runs/demo-intensity-calibrated-tpe-tv-search-20260520-01/iterations/iter-0010/comparison.png"}
{"ts": "2026-05-21T00:14:25Z", "run_id": "demo-intensity-calibrated-tpe-wu-search-20260521-01", "iter": 7, "agent": "wu-search-tpe-calibrated", "model": "random-search", "change_class": "architecture", "status": "keep", "kept": true, "val_score": null, "headroom": 0.1774406055491773, "params_M": 0.0, "train_n": 0, "rationale": "wu-search-tpe-calibrated: wu_n_bands=4, wu_n_outer=3, wu_motion_range=3, wu_motion_window=1, wu_soft_thresh=0.0027308", "advice_for_others": "wu-search-tpe-calibrated: wu_n_bands=4, wu_n_outer=3, wu_motion_range=3, wu_motion_window=1, wu_soft_thresh=0.0027308 -> hr=0.1774", "comparison_image": "runs/demo-intensity-calibrated-tpe-wu-search-20260521-01/iterations/iter-0007/comparison.png"}
{"ts": "2026-05-21T00:14:11Z", "run_id": "demo-intensity-calibrated-tpe-wu-search-20260521-01", "iter": 6, "agent": "wu-search-tpe-calibrated", "model": "random-search", "change_class": "architecture", "status": "keep", "kept": true, "val_score": null, "headroom": 0.19448906237019836, "params_M": 0.0, "train_n": 0, "rationale": "wu-search-tpe-calibrated: wu_n_bands=4, wu_n_outer=1, wu_motion_range=8, wu_motion_window=2, wu_soft_thresh=0.0039556", "advice_for_others": "wu-search-tpe-calibrated: wu_n_bands=4, wu_n_outer=1, wu_motion_range=8, wu_motion_window=2, wu_soft_thresh=0.0039556 -> hr=0.1945", "comparison_image": "runs/demo-intensity-calibrated-tpe-wu-search-20260521-01/iterations/iter-0006/comparison.png"}
{"ts": "2026-05-21T00:13:58Z", "run_id": "demo-intensity-calibrated-tpe-wu-search-20260521-01", "iter": 5, "agent": "wu-search-tpe-calibrated", "model": "random-search", "change_class": "architecture", "status": "keep", "kept": true, "val_score": null, "headroom": 0.17981394851056298, "params_M": 0.0, "train_n": 0, "rationale": "wu-search-tpe-calibrated: wu_n_bands=4, wu_n_outer=2, wu_motion_range=5, wu_motion_window=4, wu_soft_thresh=0.0014634", "advice_for_others": "wu-search-tpe-calibrated: wu_n_bands=4, wu_n_outer=2, wu_motion_range=5, wu_motion_window=4, wu_soft_thresh=0.0014634 -> hr=0.1798", "comparison_image": "runs/demo-intensity-calibrated-tpe-wu-search-20260521-01/iterations/iter-0005/comparison.png"}
{"ts": "2026-05-21T00:13:43Z", "run_id": "demo-intensity-calibrated-tpe-wu-search-20260521-01", "iter": 4, "agent": "wu-search-tpe-calibrated", "model": "random-search", "change_class": "architecture", "status": "keep", "kept": true, "val_score": null, "headroom": 0.19024407132735344, "params_M": 0.0, "train_n": 0, "rationale": "wu-search-tpe-calibrated: wu_n_bands=6, wu_n_outer=2, wu_motion_range=12, wu_motion_window=4, wu_soft_thresh=0.00093529", "advice_for_others": "wu-search-tpe-calibrated: wu_n_bands=6, wu_n_outer=2, wu_motion_range=12, wu_motion_window=4, wu_soft_thresh=0.00093529 -> hr=0.1902", "comparison_image": "runs/demo-intensity-calibrated-tpe-wu-search-20260521-01/iterations/iter-0004/comparison.png"}
{"ts": "2026-05-21T00:13:29Z", "run_id": "demo-intensity-calibrated-tpe-wu-search-20260521-01", "iter": 3, "agent": "wu-search-tpe-calibrated", "model": "random-search", "change_class": "architecture", "status": "keep", "kept": true, "val_score": null, "headroom": 0.19080904800427856, "params_M": 0.0, "train_n": 0, "rationale": "wu-search-tpe-calibrated: wu_n_bands=12, wu_n_outer=2, wu_motion_range=12, wu_motion_window=2, wu_soft_thresh=0.00075748", "advice_for_others": "wu-search-tpe-calibrated: wu_n_bands=12, wu_n_outer=2, wu_motion_range=12, wu_motion_window=2, wu_soft_thresh=0.00075748 -> hr=0.1908", "comparison_image": "runs/demo-intensity-calibrated-tpe-wu-search-20260521-01/iterations/iter-0003/comparison.png"}
{"ts": "2026-05-21T00:13:14Z", "run_id": "demo-intensity-calibrated-tpe-wu-search-20260521-01", "iter": 2, "agent": "wu-search-tpe-calibrated", "model": "random-search", "change_class": "architecture", "status": "keep", "kept": true, "val_score": null, "headroom": 0.20818598895920537, "params_M": 0.0, "train_n": 0, "rationale": "wu-search-tpe-calibrated: wu_n_bands=4, wu_n_outer=1, wu_motion_range=12, wu_motion_window=2, wu_soft_thresh=0.0012618", "advice_for_others": "wu-search-tpe-calibrated: wu_n_bands=4, wu_n_outer=1, wu_motion_range=12, wu_motion_window=2, wu_soft_thresh=0.0012618 -> hr=0.2082", "comparison_image": "runs/demo-intensity-calibrated-tpe-wu-search-20260521-01/iterations/iter-0002/comparison.png"}
{"ts": "2026-05-21T00:13:00Z", "run_id": "demo-intensity-calibrated-tpe-wu-search-20260521-01", "iter": 1, "agent": "wu-search-tpe-calibrated", "model": "random-search", "change_class": "architecture", "status": "keep", "kept": true, "val_score": null, "headroom": 0.18939109483320915, "params_M": 0.0, "train_n": 0, "rationale": "wu-search-tpe-calibrated: wu_n_bands=8, wu_n_outer=2, wu_motion_range=5, wu_motion_window=4, wu_soft_thresh=0.00080936", "advice_for_others": "wu-search-tpe-calibrated: wu_n_bands=8, wu_n_outer=2, wu_motion_range=5, wu_motion_window=4, wu_soft_thresh=0.00080936 -> hr=0.1894", "comparison_image": "runs/demo-intensity-calibrated-tpe-wu-search-20260521-01/iterations/iter-0001/comparison.png"}
{"ts": "2026-05-21T00:11:42Z", "run_id": "demo-intensity-calibrated-tpe-tv-search-20260520-01", "iter": 9, "agent": "tv-search-tpe-calibrated", "model": "random-search", "change_class": "architecture", "status": "keep", "kept": true, "val_score": null, "headroom": 0.01011797270174597, "params_M": 0.0, "train_n": 0, "rationale": "tv-search-tpe-calibrated: tv_lambda=0.00039197, tv_iterations=367, tv_lr=0.018583, tv_clip_max=0.060483, tv_decay=0.037054", "advice_for_others": "tv-search-tpe-calibrated: tv_lambda=0.00039197, tv_iterations=367, tv_lr=0.018583, tv_clip_max=0.060483, tv_decay=0.037054 -> hr=0.0101", "comparison_image": "runs/demo-intensity-calibrated-tpe-tv-search-20260520-01/iterations/iter-0009/comparison.png"}
{"ts": "2026-05-21T00:11:25Z", "run_id": "demo-intensity-calibrated-tpe-hammernik-vn-search-20260520-01", "iter": 13, "agent": "hammernik-vn-search-tpe-calibrated", "model": "random-search", "change_class": "architecture", "status": "keep", "kept": true, "val_score": null, "headroom": 0.3603489487555732, "params_M": 0.005379, "train_n": 200, "rationale": "hammernik-vn-search-tpe-calibrated: epochs=16, lr=0.00018692, batch_size=2, vn_T=3, vn_n_filters=16, vn_kernel=9, vn_lambda_init=0.00098518, vn_init=fbp", "advice_for_others": "hammernik-vn-search-tpe-calibrated: epochs=16, lr=0.00018692, batch_size=2, vn_T=3, vn_n_filters=16, vn_kernel=9, vn_lambda_init=0.00098518, vn_init=fbp -> hr=0.3603", "comparison_image": "runs/demo-intensity-calibrated-tpe-hammernik-vn-search-20260520-01/iterations/iter-0013/comparison.png"}
{"ts": "2026-05-21T00:08:37Z", "run_id": "demo-intensity-calibrated-tpe-tv-search-20260520-01", "iter": 8, "agent": "tv-search-tpe-calibrated", "model": "random-search", "change_class": "architecture", "status": "keep", "kept": true, "val_score": null, "headroom": 0.012833127554758295, "params_M": 0.0, "train_n": 0, "rationale": "tv-search-tpe-calibrated: tv_lambda=0.007283, tv_iterations=489, tv_lr=0.0010175, tv_clip_max=0.064412, tv_decay=0.046138", "advice_for_others": "tv-search-tpe-calibrated: tv_lambda=0.007283, tv_iterations=489, tv_lr=0.0010175, tv_clip_max=0.064412, tv_decay=0.046138 -> hr=0.0128", "comparison_image": "runs/demo-intensity-calibrated-tpe-tv-search-20260520-01/iterations/iter-0008/comparison.png"}
{"ts": "2026-05-21T00:04:21Z", "run_id": "demo-intensity-calibrated-tpe-tv-search-20260520-01", "iter": 7, "agent": "tv-search-tpe-calibrated", "model": "random-search", "change_class": "architecture", "status": "keep", "kept": true, "val_score": null, "headroom": 0.3894891891342098, "params_M": 0.0, "train_n": 0, "rationale": "tv-search-tpe-calibrated: tv_lambda=0.0093631, tv_iterations=500, tv_lr=0.080872, tv_clip_max=0.076596, tv_decay=0.04995", "advice_for_others": "tv-search-tpe-calibrated: tv_lambda=0.0093631, tv_iterations=500, tv_lr=0.080872, tv_clip_max=0.076596, tv_decay=0.04995 -> hr=0.3895", "comparison_image": "runs/demo-intensity-calibrated-tpe-tv-search-20260520-01/iterations/iter-0007/comparison.png"}
{"ts": "2026-05-21T00:02:47Z", "run_id": "demo-intensity-calibrated-tpe-hammernik-vn-search-20260520-01", "iter": 12, "agent": "hammernik-vn-search-tpe-calibrated", "model": "random-search", "change_class": "architecture", "status": "keep", "kept": true, "val_score": null, "headroom": 0.36074266875621863, "params_M": 0.005379, "train_n": 200, "rationale": "hammernik-vn-search-tpe-calibrated: epochs=17, lr=0.00020124, batch_size=2, vn_T=3, vn_n_filters=16, vn_kernel=9, vn_lambda_init=0.00081999, vn_init=fbp", "advice_for_others": "hammernik-vn-search-tpe-calibrated: epochs=17, lr=0.00020124, batch_size=2, vn_T=3, vn_n_filters=16, vn_kernel=9, vn_lambda_init=0.00081999, vn_init=fbp -> hr=0.3607", "comparison_image": "runs/demo-intensity-calibrated-tpe-hammernik-vn-search-20260520-01/iterations/iter-0012/comparison.png"}
{"ts": "2026-05-20T23:59:46Z", "run_id": "demo-intensity-calibrated-tpe-tv-search-20260520-01", "iter": 6, "agent": "tv-search-tpe-calibrated", "model": "random-search", "change_class": "architecture", "status": "keep", "kept": true, "val_score": null, "headroom": 0.39678187761651196, "params_M": 0.0, "train_n": 0, "rationale": "tv-search-tpe-calibrated: tv_lambda=0.007661, tv_iterations=462, tv_lr=0.081192, tv_clip_max=0.079381, tv_decay=0.044912", "advice_for_others": "tv-search-tpe-calibrated: tv_lambda=0.007661, tv_iterations=462, tv_lr=0.081192, tv_clip_max=0.079381, tv_decay=0.044912 -> hr=0.3968", "comparison_image": "runs/demo-intensity-calibrated-tpe-tv-search-20260520-01/iterations/iter-0006/comparison.png"}
{"ts": "2026-05-20T23:55:53Z", "run_id": "demo-intensity-calibrated-tpe-tv-search-20260520-01", "iter": 5, "agent": "tv-search-tpe-calibrated", "model": "random-search", "change_class": "architecture", "status": "discard", "kept": false, "val_score": null, "headroom": 0.0, "params_M": 0.0, "train_n": 0, "rationale": "tv-search-tpe-calibrated: tv_lambda=0.0001565, tv_iterations=101, tv_lr=0.0087078, tv_clip_max=0.035484, tv_decay=0.021225", "advice_for_others": "tv-search-tpe-calibrated: tv_lambda=0.0001565, tv_iterations=101, tv_lr=0.0087078, tv_clip_max=0.035484, tv_decay=0.021225 -> hr=0.0000", "comparison_image": "runs/demo-intensity-calibrated-tpe-tv-search-20260520-01/iterations/iter-0005/comparison.png"}
