{"ts": "2026-05-21T11:04:31Z", "run_id": "demo-intensity-calibrated-tpe-naf-search-20260521-01", "iter": 17, "agent": "naf-search-tpe-calibrated", "model": "random-search", "change_class": "architecture", "status": "keep", "kept": true, "val_score": null, "headroom": 0.4091220977589193, "params_M": 0.270337, "train_n": 0, "rationale": "naf-search-tpe-calibrated: naf_n_freqs=6, naf_hidden=256, naf_layers=6, naf_n_iter=1877, naf_lr=0.0021273, naf_tv_weight=0.00019951, naf_outer_wall_s=2400", "advice_for_others": "naf-search-tpe-calibrated: naf_n_freqs=6, naf_hidden=256, naf_layers=6, naf_n_iter=1877, naf_lr=0.0021273, naf_tv_weight=0.00019951, naf_outer_wall_s=2400 -> hr=0.4091", "comparison_image": "runs/demo-intensity-calibrated-tpe-naf-search-20260521-01/iterations/iter-0017/comparison.png"}
{"ts": "2026-05-21T10:23:36Z", "run_id": "demo-intensity-calibrated-tpe-naf-search-20260521-01", "iter": 16, "agent": "naf-search-tpe-calibrated", "model": "random-search", "change_class": "architecture", "status": "keep", "kept": true, "val_score": null, "headroom": 0.40660241033343114, "params_M": 0.270337, "train_n": 0, "rationale": "naf-search-tpe-calibrated: naf_n_freqs=6, naf_hidden=256, naf_layers=6, naf_n_iter=1907, naf_lr=0.0023878, naf_tv_weight=0.00020746, naf_outer_wall_s=2400", "advice_for_others": "naf-search-tpe-calibrated: naf_n_freqs=6, naf_hidden=256, naf_layers=6, naf_n_iter=1907, naf_lr=0.0023878, naf_tv_weight=0.00020746, naf_outer_wall_s=2400 -> hr=0.4066", "comparison_image": "runs/demo-intensity-calibrated-tpe-naf-search-20260521-01/iterations/iter-0016/comparison.png"}
{"ts": "2026-05-21T09:41:44Z", "run_id": "demo-intensity-calibrated-tpe-naf-search-20260521-01", "iter": 15, "agent": "naf-search-tpe-calibrated", "model": "random-search", "change_class": "architecture", "status": "keep", "kept": true, "val_score": null, "headroom": 0.3052610069070292, "params_M": 0.118081, "train_n": 0, "rationale": "naf-search-tpe-calibrated: naf_n_freqs=8, naf_hidden=192, naf_layers=5, naf_n_iter=3721, naf_lr=0.0041812, naf_tv_weight=2.6178e-05, naf_outer_wall_s=2400", "advice_for_others": "naf-search-tpe-calibrated: naf_n_freqs=8, naf_hidden=192, naf_layers=5, naf_n_iter=3721, naf_lr=0.0041812, naf_tv_weight=2.6178e-05, naf_outer_wall_s=2400 -> hr=0.3053", "comparison_image": "runs/demo-intensity-calibrated-tpe-naf-search-20260521-01/iterations/iter-0015/comparison.png"}
{"ts": "2026-05-21T08:59:33Z", "run_id": "demo-intensity-calibrated-tpe-naf-search-20260521-01", "iter": 14, "agent": "naf-search-tpe-calibrated", "model": "random-search", "change_class": "architecture", "status": "keep", "kept": true, "val_score": null, "headroom": 0.08701169235189687, "params_M": 0.040705, "train_n": 0, "rationale": "naf-search-tpe-calibrated: naf_n_freqs=14, naf_hidden=128, naf_layers=4, naf_n_iter=2614, naf_lr=0.0067775, naf_tv_weight=0.0002724, naf_outer_wall_s=2400", "advice_for_others": "naf-search-tpe-calibrated: naf_n_freqs=14, naf_hidden=128, naf_layers=4, naf_n_iter=2614, naf_lr=0.0067775, naf_tv_weight=0.0002724, naf_outer_wall_s=2400 -> hr=0.0870", "comparison_image": "runs/demo-intensity-calibrated-tpe-naf-search-20260521-01/iterations/iter-0014/comparison.png"}
{"ts": "2026-05-21T08:34:46Z", "run_id": "demo-intensity-calibrated-tpe-naf-search-20260521-01", "iter": 13, "agent": "naf-search-tpe-calibrated", "model": "random-search", "change_class": "architecture", "status": "keep", "kept": true, "val_score": null, "headroom": 0.36118268571633805, "params_M": 0.037633, "train_n": 0, "rationale": "naf-search-tpe-calibrated: naf_n_freqs=8, naf_hidden=128, naf_layers=4, naf_n_iter=3163, naf_lr=0.0053055, naf_tv_weight=0.00094613, naf_outer_wall_s=2400", "advice_for_others": "naf-search-tpe-calibrated: naf_n_freqs=8, naf_hidden=128, naf_layers=4, naf_n_iter=3163, naf_lr=0.0053055, naf_tv_weight=0.00094613, naf_outer_wall_s=2400 -> hr=0.3612", "comparison_image": "runs/demo-intensity-calibrated-tpe-naf-search-20260521-01/iterations/iter-0013/comparison.png"}
{"ts": "2026-05-21T08:04:49Z", "run_id": "demo-intensity-calibrated-tpe-naf-search-20260521-01", "iter": 12, "agent": "naf-search-tpe-calibrated", "model": "random-search", "change_class": "architecture", "status": "keep", "kept": true, "val_score": null, "headroom": 0.37626374717890365, "params_M": 0.037633, "train_n": 0, "rationale": "naf-search-tpe-calibrated: naf_n_freqs=8, naf_hidden=128, naf_layers=4, naf_n_iter=2966, naf_lr=0.0088771, naf_tv_weight=0.00079734, naf_outer_wall_s=2400", "advice_for_others": "naf-search-tpe-calibrated: naf_n_freqs=8, naf_hidden=128, naf_layers=4, naf_n_iter=2966, naf_lr=0.0088771, naf_tv_weight=0.00079734, naf_outer_wall_s=2400 -> hr=0.3763", "comparison_image": "runs/demo-intensity-calibrated-tpe-naf-search-20260521-01/iterations/iter-0012/comparison.png"}
{"ts": "2026-05-21T07:37:16Z", "run_id": "demo-intensity-calibrated-tpe-naf-search-20260521-01", "iter": 11, "agent": "naf-search-tpe-calibrated", "model": "random-search", "change_class": "architecture", "status": "discard", "kept": false, "val_score": null, "headroom": 0.0, "params_M": 0.272385, "train_n": 0, "rationale": "naf-search-tpe-calibrated: naf_n_freqs=8, naf_hidden=256, naf_layers=6, naf_n_iter=2495, naf_lr=0.0099994, naf_tv_weight=4.0215e-05, naf_outer_wall_s=2400", "advice_for_others": "naf-search-tpe-calibrated: naf_n_freqs=8, naf_hidden=256, naf_layers=6, naf_n_iter=2495, naf_lr=0.0099994, naf_tv_weight=4.0215e-05, naf_outer_wall_s=2400 -> hr=0.0000", "comparison_image": "runs/demo-intensity-calibrated-tpe-naf-search-20260521-01/iterations/iter-0011/comparison.png"}
{"ts": "2026-05-21T06:54:38Z", "run_id": "demo-intensity-calibrated-tpe-naf-search-20260521-01", "iter": 10, "agent": "naf-search-tpe-calibrated", "model": "random-search", "change_class": "architecture", "status": "keep", "kept": true, "val_score": null, "headroom": 0.337871330546877, "params_M": 0.276481, "train_n": 0, "rationale": "naf-search-tpe-calibrated: naf_n_freqs=12, naf_hidden=256, naf_layers=6, naf_n_iter=1512, naf_lr=0.0016843, naf_tv_weight=1.224e-06, naf_outer_wall_s=2400", "advice_for_others": "naf-search-tpe-calibrated: naf_n_freqs=12, naf_hidden=256, naf_layers=6, naf_n_iter=1512, naf_lr=0.0016843, naf_tv_weight=1.224e-06, naf_outer_wall_s=2400 -> hr=0.3379", "comparison_image": "runs/demo-intensity-calibrated-tpe-naf-search-20260521-01/iterations/iter-0010/comparison.png"}
{"ts": "2026-05-21T06:13:44Z", "run_id": "demo-intensity-calibrated-tpe-naf-search-20260521-01", "iter": 9, "agent": "naf-search-tpe-calibrated", "model": "random-search", "change_class": "architecture", "status": "keep", "kept": true, "val_score": null, "headroom": 0.31225015711228776, "params_M": 0.116545, "train_n": 0, "rationale": "naf-search-tpe-calibrated: naf_n_freqs=6, naf_hidden=192, naf_layers=5, naf_n_iter=3424, naf_lr=0.0044097, naf_tv_weight=5.3102e-06, naf_outer_wall_s=2400", "advice_for_others": "naf-search-tpe-calibrated: naf_n_freqs=6, naf_hidden=192, naf_layers=5, naf_n_iter=3424, naf_lr=0.0044097, naf_tv_weight=5.3102e-06, naf_outer_wall_s=2400 -> hr=0.3123", "comparison_image": "runs/demo-intensity-calibrated-tpe-naf-search-20260521-01/iterations/iter-0009/comparison.png"}
{"ts": "2026-05-21T05:32:36Z", "run_id": "demo-intensity-calibrated-tpe-naf-search-20260521-01", "iter": 8, "agent": "naf-search-tpe-calibrated", "model": "random-search", "change_class": "architecture", "status": "keep", "kept": true, "val_score": null, "headroom": 0.3226523737254553, "params_M": 0.278529, "train_n": 0, "rationale": "naf-search-tpe-calibrated: naf_n_freqs=14, naf_hidden=256, naf_layers=6, naf_n_iter=2343, naf_lr=0.00056395, naf_tv_weight=9.6376e-06, naf_outer_wall_s=2400", "advice_for_others": "naf-search-tpe-calibrated: naf_n_freqs=14, naf_hidden=256, naf_layers=6, naf_n_iter=2343, naf_lr=0.00056395, naf_tv_weight=9.6376e-06, naf_outer_wall_s=2400 -> hr=0.3227", "comparison_image": "runs/demo-intensity-calibrated-tpe-naf-search-20260521-01/iterations/iter-0008/comparison.png"}
{"ts": "2026-05-21T04:49:41Z", "run_id": "demo-intensity-calibrated-tpe-naf-search-20260521-01", "iter": 7, "agent": "naf-search-tpe-calibrated", "model": "random-search", "change_class": "architecture", "status": "keep", "kept": true, "val_score": null, "headroom": 0.28390520327695823, "params_M": 0.158209, "train_n": 0, "rationale": "naf-search-tpe-calibrated: naf_n_freqs=12, naf_hidden=192, naf_layers=6, naf_n_iter=1980, naf_lr=0.00292, naf_tv_weight=1.895e-06, naf_outer_wall_s=2400", "advice_for_others": "naf-search-tpe-calibrated: naf_n_freqs=12, naf_hidden=192, naf_layers=6, naf_n_iter=1980, naf_lr=0.00292, naf_tv_weight=1.895e-06, naf_outer_wall_s=2400 -> hr=0.2839", "comparison_image": "runs/demo-intensity-calibrated-tpe-naf-search-20260521-01/iterations/iter-0007/comparison.png"}
{"ts": "2026-05-21T04:08:54Z", "run_id": "demo-intensity-calibrated-tpe-naf-search-20260521-01", "iter": 6, "agent": "naf-search-tpe-calibrated", "model": "random-search", "change_class": "architecture", "status": "keep", "kept": true, "val_score": null, "headroom": 0.35557307017571993, "params_M": 0.270337, "train_n": 0, "rationale": "naf-search-tpe-calibrated: naf_n_freqs=6, naf_hidden=256, naf_layers=6, naf_n_iter=3863, naf_lr=0.0032032, naf_tv_weight=1.641e-06, naf_outer_wall_s=2400", "advice_for_others": "naf-search-tpe-calibrated: naf_n_freqs=6, naf_hidden=256, naf_layers=6, naf_n_iter=3863, naf_lr=0.0032032, naf_tv_weight=1.641e-06, naf_outer_wall_s=2400 -> hr=0.3556", "comparison_image": "runs/demo-intensity-calibrated-tpe-naf-search-20260521-01/iterations/iter-0006/comparison.png"}
{"ts": "2026-05-21T03:49:49Z", "run_id": "demo-intensity-calibrated-tpe-diff-recon-dcstep-constrained-search-20260521-01", "iter": 20, "agent": "diff-recon-dcstep-constrained-search-tpe-calibrated", "model": "random-search", "change_class": "architecture", "status": "keep", "kept": true, "val_score": null, "headroom": 0.4237673994329876, "params_M": 0.958051, "train_n": 200, "rationale": "diff-recon-dcstep-constrained-search-tpe-calibrated: recon_ckpt=/cluster/maier/Agent4CT/checkpoints/ddpm_constrained_final.pt, recon_mode=dps, recon_sample_steps=500, recon_eta=3.0753, recon_init=noise, recon_eta_clamp=True, recon_dcstep_every=5, recon_dcstep_n_cg=15, recon_dcstep_warmup=40, recon_dcstep_relax=1", "advice_for_others": "diff-recon-dcstep-constrained-search-tpe-calibrated: recon_ckpt=/cluster/maier/Agent4CT/checkpoints/ddpm_constrained_final.pt, recon_mode=dps, recon_sample_steps=500, recon_eta=3.0753, recon_init=noise, recon_eta_clamp=True, recon_dcstep_every=5, recon_dcstep_n_cg=15, recon_dcstep_warmup=40, recon_dcstep_relax=1 -> hr=0.4238", "comparison_image": "runs/demo-intensity-calibrated-tpe-diff-recon-dcstep-constrained-search-20260521-01/iterations/iter-0020/comparison.png"}
{"ts": "2026-05-21T03:42:53Z", "run_id": "demo-intensity-calibrated-tpe-diff-recon-dcstep-constrained-search-20260521-01", "iter": 19, "agent": "diff-recon-dcstep-constrained-search-tpe-calibrated", "model": "random-search", "change_class": "architecture", "status": "keep", "kept": true, "val_score": null, "headroom": 0.4294724161556256, "params_M": 0.958051, "train_n": 200, "rationale": "diff-recon-dcstep-constrained-search-tpe-calibrated: recon_ckpt=/cluster/maier/Agent4CT/checkpoints/ddpm_constrained_final.pt, recon_mode=dps, recon_sample_steps=500, recon_eta=16.611, recon_init=fbp, recon_eta_clamp=False, recon_dcstep_every=5, recon_dcstep_n_cg=25, recon_dcstep_warmup=40, recon_dcstep_relax=0.85", "advice_for_others": "diff-recon-dcstep-constrained-search-tpe-calibrated: recon_ckpt=/cluster/maier/Agent4CT/checkpoints/ddpm_constrained_final.pt, recon_mode=dps, recon_sample_steps=500, recon_eta=16.611, recon_init=fbp, recon_eta_clamp=False, recon_dcstep_every=5, recon_dcstep_n_cg=25, recon_dcstep_warmup=40, recon_dcstep_relax=0.85 -> hr=0.4295", "comparison_image": "runs/demo-intensity-calibrated-tpe-diff-recon-dcstep-constrained-search-20260521-01/iterations/iter-0019/comparison.png"}
{"ts": "2026-05-21T03:34:27Z", "run_id": "demo-intensity-calibrated-tpe-diff-recon-dcstep-constrained-search-20260521-01", "iter": 18, "agent": "diff-recon-dcstep-constrained-search-tpe-calibrated", "model": "random-search", "change_class": "architecture", "status": "keep", "kept": true, "val_score": null, "headroom": 0.4417714789384829, "params_M": 0.958051, "train_n": 200, "rationale": "diff-recon-dcstep-constrained-search-tpe-calibrated: recon_ckpt=/cluster/maier/Agent4CT/checkpoints/ddpm_constrained_final.pt, recon_mode=dps, recon_sample_steps=500, recon_eta=4.9763, recon_init=noise, recon_eta_clamp=False, recon_dcstep_every=5, recon_dcstep_n_cg=25, recon_dcstep_warmup=40, recon_dcstep_relax=0.95", "advice_for_others": "diff-recon-dcstep-constrained-search-tpe-calibrated: recon_ckpt=/cluster/maier/Agent4CT/checkpoints/ddpm_constrained_final.pt, recon_mode=dps, recon_sample_steps=500, recon_eta=4.9763, recon_init=noise, recon_eta_clamp=False, recon_dcstep_every=5, recon_dcstep_n_cg=25, recon_dcstep_warmup=40, recon_dcstep_relax=0.95 -> hr=0.4418", "comparison_image": "runs/demo-intensity-calibrated-tpe-diff-recon-dcstep-constrained-search-20260521-01/iterations/iter-0018/comparison.png"}
{"ts": "2026-05-21T03:26:00Z", "run_id": "demo-intensity-calibrated-tpe-diff-recon-dcstep-constrained-search-20260521-01", "iter": 17, "agent": "diff-recon-dcstep-constrained-search-tpe-calibrated", "model": "random-search", "change_class": "architecture", "status": "keep", "kept": true, "val_score": null, "headroom": 0.43955713456249046, "params_M": 0.958051, "train_n": 200, "rationale": "diff-recon-dcstep-constrained-search-tpe-calibrated: recon_ckpt=/cluster/maier/Agent4CT/checkpoints/ddpm_constrained_final.pt, recon_mode=dps, recon_sample_steps=500, recon_eta=6.7524, recon_init=noise, recon_eta_clamp=True, recon_dcstep_every=5, recon_dcstep_n_cg=25, recon_dcstep_warmup=40, recon_dcstep_relax=0.95", "advice_for_others": "diff-recon-dcstep-constrained-search-tpe-calibrated: recon_ckpt=/cluster/maier/Agent4CT/checkpoints/ddpm_constrained_final.pt, recon_mode=dps, recon_sample_steps=500, recon_eta=6.7524, recon_init=noise, recon_eta_clamp=True, recon_dcstep_every=5, recon_dcstep_n_cg=25, recon_dcstep_warmup=40, recon_dcstep_relax=0.95 -> hr=0.4396", "comparison_image": "runs/demo-intensity-calibrated-tpe-diff-recon-dcstep-constrained-search-20260521-01/iterations/iter-0017/comparison.png"}
{"ts": "2026-05-21T03:24:34Z", "run_id": "demo-intensity-calibrated-tpe-naf-search-20260521-01", "iter": 5, "agent": "naf-search-tpe-calibrated", "model": "random-search", "change_class": "architecture", "status": "keep", "kept": true, "val_score": null, "headroom": 0.2659624687859967, "params_M": 0.055169, "train_n": 0, "rationale": "naf-search-tpe-calibrated: naf_n_freqs=10, naf_hidden=128, naf_layers=5, naf_n_iter=1578, naf_lr=0.0061558, naf_tv_weight=0.00010021, naf_outer_wall_s=2400", "advice_for_others": "naf-search-tpe-calibrated: naf_n_freqs=10, naf_hidden=128, naf_layers=5, naf_n_iter=1578, naf_lr=0.0061558, naf_tv_weight=0.00010021, naf_outer_wall_s=2400 -> hr=0.2660", "comparison_image": "runs/demo-intensity-calibrated-tpe-naf-search-20260521-01/iterations/iter-0005/comparison.png"}
{"ts": "2026-05-21T03:17:33Z", "run_id": "demo-intensity-calibrated-tpe-diff-recon-dcstep-constrained-search-20260521-01", "iter": 16, "agent": "diff-recon-dcstep-constrained-search-tpe-calibrated", "model": "random-search", "change_class": "architecture", "status": "keep", "kept": true, "val_score": null, "headroom": 0.4394264594106907, "params_M": 0.958051, "train_n": 200, "rationale": "diff-recon-dcstep-constrained-search-tpe-calibrated: recon_ckpt=/cluster/maier/Agent4CT/checkpoints/ddpm_constrained_final.pt, recon_mode=dps, recon_sample_steps=500, recon_eta=6.7447, recon_init=noise, recon_eta_clamp=False, recon_dcstep_every=5, recon_dcstep_n_cg=25, recon_dcstep_warmup=40, recon_dcstep_relax=1", "advice_for_others": "diff-recon-dcstep-constrained-search-tpe-calibrated: recon_ckpt=/cluster/maier/Agent4CT/checkpoints/ddpm_constrained_final.pt, recon_mode=dps, recon_sample_steps=500, recon_eta=6.7447, recon_init=noise, recon_eta_clamp=False, recon_dcstep_every=5, recon_dcstep_n_cg=25, recon_dcstep_warmup=40, recon_dcstep_relax=1 -> hr=0.4394", "comparison_image": "runs/demo-intensity-calibrated-tpe-diff-recon-dcstep-constrained-search-20260521-01/iterations/iter-0016/comparison.png"}
{"ts": "2026-05-21T03:14:50Z", "run_id": "demo-intensity-calibrated-tpe-diff-recon-dcstep-unconstrained-search-20260521-01", "iter": 20, "agent": "diff-recon-dcstep-unconstrained-search-tpe-calibrated", "model": "random-search", "change_class": "architecture", "status": "keep", "kept": true, "val_score": null, "headroom": 0.43138218128927774, "params_M": 0.958051, "train_n": 2000, "rationale": "diff-recon-dcstep-unconstrained-search-tpe-calibrated: recon_ckpt=/cluster/maier/Agent4CT/checkpoints/ddpm_unconstrained_final.pt, recon_mode=dps, recon_sample_steps=800, recon_eta=12.141, recon_init=fbp, recon_eta_clamp=True, recon_dcstep_every=5, recon_dcstep_n_cg=25, recon_dcstep_warmup=10, recon_dcstep_relax=0.95", "advice_for_others": "diff-recon-dcstep-unconstrained-search-tpe-calibrated: recon_ckpt=/cluster/maier/Agent4CT/checkpoints/ddpm_unconstrained_final.pt, recon_mode=dps, recon_sample_steps=800, recon_eta=12.141, recon_init=fbp, recon_eta_clamp=True, recon_dcstep_every=5, recon_dcstep_n_cg=25, recon_dcstep_warmup=10, recon_dcstep_relax=0.95 -> hr=0.4314", "comparison_image": "runs/demo-intensity-calibrated-tpe-diff-recon-dcstep-unconstrained-search-20260521-01/iterations/iter-0020/comparison.png"}
{"ts": "2026-05-21T03:09:06Z", "run_id": "demo-intensity-calibrated-tpe-diff-recon-dcstep-constrained-search-20260521-01", "iter": 15, "agent": "diff-recon-dcstep-constrained-search-tpe-calibrated", "model": "random-search", "change_class": "architecture", "status": "keep", "kept": true, "val_score": null, "headroom": 0.4412675996783698, "params_M": 0.958051, "train_n": 200, "rationale": "diff-recon-dcstep-constrained-search-tpe-calibrated: recon_ckpt=/cluster/maier/Agent4CT/checkpoints/ddpm_constrained_final.pt, recon_mode=dps, recon_sample_steps=500, recon_eta=5.4374, recon_init=noise, recon_eta_clamp=True, recon_dcstep_every=5, recon_dcstep_n_cg=25, recon_dcstep_warmup=40, recon_dcstep_relax=0.95", "advice_for_others": "diff-recon-dcstep-constrained-search-tpe-calibrated: recon_ckpt=/cluster/maier/Agent4CT/checkpoints/ddpm_constrained_final.pt, recon_mode=dps, recon_sample_steps=500, recon_eta=5.4374, recon_init=noise, recon_eta_clamp=True, recon_dcstep_every=5, recon_dcstep_n_cg=25, recon_dcstep_warmup=40, recon_dcstep_relax=0.95 -> hr=0.4413", "comparison_image": "runs/demo-intensity-calibrated-tpe-diff-recon-dcstep-constrained-search-20260521-01/iterations/iter-0015/comparison.png"}
{"ts": "2026-05-21T03:05:59Z", "run_id": "demo-intensity-calibrated-tpe-naf-search-20260521-01", "iter": 4, "agent": "naf-search-tpe-calibrated", "model": "random-search", "change_class": "architecture", "status": "keep", "kept": true, "val_score": null, "headroom": 0.34720699221168627, "params_M": 0.036609, "train_n": 0, "rationale": "naf-search-tpe-calibrated: naf_n_freqs=6, naf_hidden=128, naf_layers=4, naf_n_iter=3065, naf_lr=0.00091275, naf_tv_weight=9.1519e-05, naf_outer_wall_s=2400", "advice_for_others": "naf-search-tpe-calibrated: naf_n_freqs=6, naf_hidden=128, naf_layers=4, naf_n_iter=3065, naf_lr=0.00091275, naf_tv_weight=9.1519e-05, naf_outer_wall_s=2400 -> hr=0.3472", "comparison_image": "runs/demo-intensity-calibrated-tpe-naf-search-20260521-01/iterations/iter-0004/comparison.png"}
{"ts": "2026-05-21T03:00:41Z", "run_id": "demo-intensity-calibrated-tpe-diff-recon-dcstep-constrained-search-20260521-01", "iter": 14, "agent": "diff-recon-dcstep-constrained-search-tpe-calibrated", "model": "random-search", "change_class": "architecture", "status": "keep", "kept": true, "val_score": null, "headroom": 0.43964402215109266, "params_M": 0.958051, "train_n": 200, "rationale": "diff-recon-dcstep-constrained-search-tpe-calibrated: recon_ckpt=/cluster/maier/Agent4CT/checkpoints/ddpm_constrained_final.pt, recon_mode=dps, recon_sample_steps=500, recon_eta=5.9125, recon_init=noise, recon_eta_clamp=False, recon_dcstep_every=4, recon_dcstep_n_cg=25, recon_dcstep_warmup=40, recon_dcstep_relax=0.95", "advice_for_others": "diff-recon-dcstep-constrained-search-tpe-calibrated: recon_ckpt=/cluster/maier/Agent4CT/checkpoints/ddpm_constrained_final.pt, recon_mode=dps, recon_sample_steps=500, recon_eta=5.9125, recon_init=noise, recon_eta_clamp=False, recon_dcstep_every=4, recon_dcstep_n_cg=25, recon_dcstep_warmup=40, recon_dcstep_relax=0.95 -> hr=0.4396", "comparison_image": "runs/demo-intensity-calibrated-tpe-diff-recon-dcstep-constrained-search-20260521-01/iterations/iter-0014/comparison.png"}
