{"ts": "2026-06-19T08:21:38Z", "run_id": "demo-dl-claude-agentic-dual-domain-n2i-search-20260618-01", "iter": 13, "agent": "dual_domain_n2i-claude-agentic-breast-ct", "model": "claude-opus-4.7-1m", "change_class": "architecture", "status": "keep", "kept": true, "val_score": 0.46159252524375916, "headroom": 0.0010528348712636193, "params_M": 0.465762, "train_n": 400, "rationale": "dual_domain_n2i-claude-agentic: train_n=200, val_n=24, batch_size=1, grad_clip=1.0, seed=42, warm_start=True, pretrain_epochs=12, n_iter=600, outer_wall_s=1700, lr=0.0001, unet_c=16, rationale=iter-13: ONE knob -> val_n 12 -> 24 (2x val scenes), at the seed42/ep12/lr1e-4/warm_start=True/n_iter600/grad_clip1.0 PEAK base (iter-10, SSIM 0.4724). A WIDER-BASIS CEILING-CONFIRMATION read (the handoff's explicit candidate: 'a LARGER val_n for a tighter ceiling estimate'). This is a CONFIRMATION move, NOT a ceiling-raiser -- no ceiling-raiser remains for the over-parameterized U-Net on this 128-view synthetic substrate. DIAGNOSIS (numbers, not pixels): the 3 val_n=12 seed reads landed seed42=0.4724 (iter-10), seed123=0.4484 (iter-11), seed7=0.4305 (iter-12) -> 3-seed mean 0.4504, std 0.0173. seed7 fell just BELOW the predicted [0.44,0.48] band, so the per-scan stochastic floor is slightly WIDER than the iter-10/11 pair suggested (std ~0.017 not ~0.012). The ceiling estimate's BASIS is still only 12 scenes per read; whether the ~0.47 seed42 mean is representative of a wider scene set is the one remaining un-pinned-down quantity in the ceiling documentation. FAILURE MODE = the 0.466 M-param U-Net OVERFITS each single noisy 128-view sparse-phantom scan (the 6-param bilateral twin physically cannot, which is why the twin clears baseline at hr+0.33 while this U-Net stays hr~0 at ~0.45-0.51 SSIM); the per-image fit has an init-driven stochastic noise floor that a wider val basis shrinks but does not eliminate. EXHAUSTED axes (do NOT retry, per handoff): n_iter (iter-2 1200 steps 0.4785->0.4293, per-scan overfit), warm_start (iter-8 off -0.0595, load-bearing-positive), lr (iter-3 1e-3->1e-4 + iter-9 1e-4->2e-4 bracket 1e-4 as optimal), pretrain_epochs (ep12 peak, ep18 worse 0.5016), unet_c (design-doc warned-against; mayo n2i c16->c32 flat). grad_clip=1.0 is LOAD-BEARING (the 128/2304-view FBP-adjoint overflow guard, mandatory) and seed is EXHAUSTED (3 reads at val_n=12). LEVER CHOICE (the genuinely-untried confirmation knob, exactly the handoff's named candidate): val_n 12 -> 24 at the seed42 PEAK config. Doubling the val scenes averages the per-scan SSIM over 2x as many independent draws, shrinking the standard error of the ceiling estimate by ~sqrt(2) and directly testing whether the 12-scene seed42 mean (0.4724) is representative of a wider scene set. HYPOTHESIS: at val_n=24 the seed42 mean lands near the seed42/val_n=12 family (~0.46-0.48), with a TIGHTER read than the 12-scene number -- a more-trustworthy ~0.46-0.47 finalized ceiling for the per-image U-Net N2I on this synthetic 128-view substrate. hr stays ~0 (structurally FBP-bounded on dense 128-view phantoms). FALSIFIER: if the val_n=24 seed42 mean lands FAR from 0.4724 (e.g. <0.43 or >0.50), the 12-scene val set was itself unrepresentative and the ceiling claim needs the wider 24-scene basis going forward. NOTE: val_n changes absolute-SSIM comparability vs the 12-scene history -- that is the POINT (a cleaner, less-noisy basis), recorded here so future iters read this number against THIS iter. outer_wall_s raised 1200 -> 1700 is a BUDGET-ACCOMMODATION for the doubled scene loop (a time-guard, not a research knob -- it does not change recon quality, only prevents the 24-scene loop from being truncated mid-pass), NOT a second hypothesis knob. WALL: warm 12x200=2400 + per-image 24x600=14400 = 16800 steps @ ~0.083 s/step ~= 1394 s, under the raised outer_wall_s=1700 guard (per_scene_s = 1700/24 ~= 71 s, ample for 600 steps @ ~0.083 s/step ~= 50 s) and under the 00:30:00 (1800 s) sbatch wall. All recon-affecting knobs IDENTICAL to the iter-10 seed42 PEAK config (train_n=200, batch_size=1, grad_clip=1.0, seed=42, warm_start=True, pretrain_epochs=12, n_iter=600, lr=1e-4, unet_c=16); ONLY val_n 12 -> 24 changed (+ outer_wall_s budget accommodation).", "advice_for_others": "dual_domain_n2i-claude-agentic: train_n=200, val_n=24, batch_size=1, grad_clip=1.0, seed=42, warm_start=True, pretrain_epochs=12, n_iter=600, outer_wall_s=1700, lr=0.0001, unet_c=16, rationale=iter-13: ONE knob -> val_n 12 -> 24 (2x val scenes), at the seed42/ep12/lr1e-4/warm_start=True/n_iter600/grad_clip1.0 PEAK base (iter-10, SSIM 0.4724). A WIDER-BASIS CEILING-CONFIRMATION read (the handoff's explicit candidate: 'a LARGER val_n for a tighter ceiling estimate'). This is a CONFIRMATION move, NOT a ceiling-raiser -- no ceiling-raiser remains for the over-parameterized U-Net on this 128-view synthetic substrate. DIAGNOSIS (numbers, not pixels): the 3 val_n=12 seed reads landed seed42=0.4724 (iter-10), seed123=0.4484 (iter-11), seed7=0.4305 (iter-12) -> 3-seed mean 0.4504, std 0.0173. seed7 fell just BELOW the predicted [0.44,0.48] band, so the per-scan stochastic floor is slightly WIDER than the iter-10/11 pair suggested (std ~0.017 not ~0.012). The ceiling estimate's BASIS is still only 12 scenes per read; whether the ~0.47 seed42 mean is representative of a wider scene set is the one remaining un-pinned-down quantity in the ceiling documentation. FAILURE MODE = the 0.466 M-param U-Net OVERFITS each single noisy 128-view sparse-phantom scan (the 6-param bilateral twin physically cannot, which is why the twin clears baseline at hr+0.33 while this U-Net stays hr~0 at ~0.45-0.51 SSIM); the per-image fit has an init-driven stochastic noise floor that a wider val basis shrinks but does not eliminate. EXHAUSTED axes (do NOT retry, per handoff): n_iter (iter-2 1200 steps 0.4785->0.4293, per-scan overfit), warm_start (iter-8 off -0.0595, load-bearing-positive), lr (iter-3 1e-3->1e-4 + iter-9 1e-4->2e-4 bracket 1e-4 as optimal), pretrain_epochs (ep12 peak, ep18 worse 0.5016), unet_c (design-doc warned-against; mayo n2i c16->c32 flat). grad_clip=1.0 is LOAD-BEARING (the 128/2304-view FBP-adjoint overflow guard, mandatory) and seed is EXHAUSTED (3 reads at val_n=12). LEVER CHOICE (the genuinely-untried confirmation knob, exactly the handoff's named candidate): val_n 12 -> 24 at the seed42 PEAK config. Doubling the val scenes averages the per-scan SSIM over 2x as many independent draws, shrinking the standard error of the ceiling estimate by ~sqrt(2) and directly testing whether the 12-scene seed42 mean (0.4724) is representative of a wider scene set. HYPOTHESIS: at val_n=24 the seed42 mean lands near the seed42/val_n=12 family (~0.46-0.48), with a TIGHTER read than the 12-scene number -- a more-trustworthy ~0.46-0.47 finalized ceiling for the per-image U-Net N2I on this synthetic 128-view substrate. hr stays ~0 (structurally FBP-bounded on dense 128-view phantoms). FALSIFIER: if the val_n=24 seed42 mean lands FAR from 0.4724 (e.g. <0.43 or >0.50), the 12-scene val set was itself unrepresentative and the ceiling claim needs the wider 24-scene basis going forward. NOTE: val_n changes absolute-SSIM comparability vs the 12-scene history -- that is the POINT (a cleaner, less-noisy basis), recorded here so future iters read this number against THIS iter. outer_wall_s raised 1200 -> 1700 is a BUDGET-ACCOMMODATION for the doubled scene loop (a time-guard, not a research knob -- it does not change recon quality, only prevents the 24-scene loop from being truncated mid-pass), NOT a second hypothesis knob. WALL: warm 12x200=2400 + per-image 24x600=14400 = 16800 steps @ ~0.083 s/step ~= 1394 s, under the raised outer_wall_s=1700 guard (per_scene_s = 1700/24 ~= 71 s, ample for 600 steps @ ~0.083 s/step ~= 50 s) and under the 00:30:00 (1800 s) sbatch wall. All recon-affecting knobs IDENTICAL to the iter-10 seed42 PEAK config (train_n=200, batch_size=1, grad_clip=1.0, seed=42, warm_start=True, pretrain_epochs=12, n_iter=600, lr=1e-4, unet_c=16); ONLY val_n 12 -> 24 changed (+ outer_wall_s budget accommodation).", "comparison_image": "runs/demo-dl-claude-agentic-dual-domain-n2i-search-20260618-01/iterations/iter-0013/comparison.png"}
{"ts": "2026-06-19T08:02:42Z", "run_id": "demo-dl-claude-agentic-dual-domain-bilateral-n2i-search-20260618-01", "iter": 15, "agent": "dual_domain_bilateral_n2i-claude-agentic-breast-ct", "model": "claude-opus-4.7-1m", "change_class": "architecture", "status": "keep", "kept": true, "val_score": 0.824582040309906, "headroom": 0.3322648243488343, "params_M": 2.4e-05, "train_n": 400, "rationale": "dual_domain_bilateral_n2i-claude-agentic: train_n=200, val_n=6, batch_size=1, grad_clip=1.0, seed=42, warm_start=True, pretrain_epochs=3, n_iter=400, outer_wall_s=1200, lr=0.0023, proj_n_bf=1, img_n_bf=7, proj_kernel=7, img_kernel=7, proj_sx=1.0, proj_sy=2.0, proj_sr=0.02, img_sx=3.5, img_sy=3.5, img_sr=0.02, rationale=iter-15: ONE knob changed vs the iter-14 base (image-domain bilateral WINDOW SIZE img_kernel 5->7); all 18 other fields held IDENTICAL to demo_dl_dual_domain_bilateral_n2i_iter_14.json (img_sx/img_sy=3.5, img_n_bf=7, img_sr=0.02 LOOSE demo-correct, proj_n_bf=1, proj_kernel=7, proj_sx/sy=1.0/2.0, proj_sr=0.02, lr=2.3e-3, warm_start=True, pretrain_epochs=3, n_iter=400, train_n=200, val_n=6, grad_clip=1.0, seed=42 -> identical seed=42 val split, directly comparable to iter-14 SSIM 0.8035 / hr 0.3320 / PSNR 20.17). UNLOCK THE BINDING CONSTRAINT. Read iter-13->14 BY SSIM (the surface the spatial lever moves; hr stays pinned at the ~0.332 64-view-FBP noise-floor ceiling): the image-domain SPATIAL sigma img_sx/img_sy is monotone-climbing -- 1.5->2.5->3.5 gave SSIM 0.7796->0.7940->0.8035 (+0.0144 then +0.0095, still climbing but the gain is shrinking). FAILURE MODE (pre-registered in iter-14): img_kernel is pinned at 5, so the discrete bilateral WINDOW is only +/-2 px. At img_sx=3.5 the Gaussian spatial weight is near-FLAT across that tiny 5-px window -- the sigma is requesting a wider averaging support than the window can physically reach, so the kernel=5 window (NOT the sigma) is now the BINDING CONSTRAINT and further sigma widening will saturate. The unlock is to widen the WINDOW itself. img_sx/img_sy (continuous spatial sigma) and img_kernel (discrete window SIZE) are distinct axes; sigma was tuned first (the finer lever inside the fixed window), and now that it has reached the window edge, img_kernel is the live follow-on. HYPOTHESIS (img-kernel): widening img_kernel 5->7 enlarges the per-BF window from +/-2 px to +/-3 px so the img_sx=3.5 spatial Gaussian can actually average over the larger neighborhood it is requesting -> lifts SSIM past iter-14 0.8035 on the SAME seed=42 split (watch whether hr finally moves off ~0.332 too, or stays pinned at the 64-view-FBP noise-floor ceiling -- if SSIM rises but hr stays flat, the kernel/sigma axis is an SSIM-only structural-similarity lever bounded by the same FBP hr ceiling; if SSIM ALSO saturates, the image-domain spatial denoising is fully exhausted and the ~0.80 SSIM / ~0.33 hr ceiling is the substrate bound). Chose img_kernel 5->7 (the pre-registered iter-15 step -- the window-size follow-on once the spatial sigma reached the window edge) over (a) pushing img_sx/img_sy 3.5->4.5 (sigma is now window-capped -- further widening inside the same 5-px window cannot reach the wider support, the diagnosis this iter directly tests), (b) proj_sr/proj_kernel/proj_n_bf (whole proj domain confirmed flat at iter-11/12 -- symmetry trap, wasted), (c) img_sr (exhausted + substrate-confirmed WRONG-direction -- tightening to 0.0005 collapsed hr 0.3335->0.1998 at iter-4 -- FORBIDDEN, stays LOOSE 0.02), (d) img_n_bf/n_iter/pretrain_epochs/seed/val_n (all DEAD FLAT / variance-only, exhausted), (e) grad_clip (mandatory overflow guard at 1.0, not a quality lever). Held fixed at iter-14 values: img_sx=3.5/img_sy=3.5, img_n_bf=7, img_sr=0.02 (LOOSE, demo-correct), proj_n_bf=1, proj_kernel=7, proj_sr=0.02, proj_sx=1.0/proj_sy=2.0, lr=2.3e-3, warm_start=True, pretrain_epochs=3, n_iter=400, train_n=200, val_n=6, grad_clip=1.0, seed=42. Wall: iter-14 ran 331 s; a 7-px image-BF window is modestly slower per step than a 5-px window (the image-domain conv is a small fraction of the 128-view FBP+proj per-step cost) -- n_iter/val_n kept at iter-14 values, so wall stays comfortably under the 1800 s sbatch wall and the 1200 s outer_wall_s internal guard (under the 15-min budget). PER-IMAGE bilateral N2I, AGENT4CT_DATASET=phantoms; warm_start STAYS ON; do NOT revert to amortized; do NOT tighten img_sr.", "advice_for_others": "dual_domain_bilateral_n2i-claude-agentic: train_n=200, val_n=6, batch_size=1, grad_clip=1.0, seed=42, warm_start=True, pretrain_epochs=3, n_iter=400, outer_wall_s=1200, lr=0.0023, proj_n_bf=1, img_n_bf=7, proj_kernel=7, img_kernel=7, proj_sx=1.0, proj_sy=2.0, proj_sr=0.02, img_sx=3.5, img_sy=3.5, img_sr=0.02, rationale=iter-15: ONE knob changed vs the iter-14 base (image-domain bilateral WINDOW SIZE img_kernel 5->7); all 18 other fields held IDENTICAL to demo_dl_dual_domain_bilateral_n2i_iter_14.json (img_sx/img_sy=3.5, img_n_bf=7, img_sr=0.02 LOOSE demo-correct, proj_n_bf=1, proj_kernel=7, proj_sx/sy=1.0/2.0, proj_sr=0.02, lr=2.3e-3, warm_start=True, pretrain_epochs=3, n_iter=400, train_n=200, val_n=6, grad_clip=1.0, seed=42 -> identical seed=42 val split, directly comparable to iter-14 SSIM 0.8035 / hr 0.3320 / PSNR 20.17). UNLOCK THE BINDING CONSTRAINT. Read iter-13->14 BY SSIM (the surface the spatial lever moves; hr stays pinned at the ~0.332 64-view-FBP noise-floor ceiling): the image-domain SPATIAL sigma img_sx/img_sy is monotone-climbing -- 1.5->2.5->3.5 gave SSIM 0.7796->0.7940->0.8035 (+0.0144 then +0.0095, still climbing but the gain is shrinking). FAILURE MODE (pre-registered in iter-14): img_kernel is pinned at 5, so the discrete bilateral WINDOW is only +/-2 px. At img_sx=3.5 the Gaussian spatial weight is near-FLAT across that tiny 5-px window -- the sigma is requesting a wider averaging support than the window can physically reach, so the kernel=5 window (NOT the sigma) is now the BINDING CONSTRAINT and further sigma widening will saturate. The unlock is to widen the WINDOW itself. img_sx/img_sy (continuous spatial sigma) and img_kernel (discrete window SIZE) are distinct axes; sigma was tuned first (the finer lever inside the fixed window), and now that it has reached the window edge, img_kernel is the live follow-on. HYPOTHESIS (img-kernel): widening img_kernel 5->7 enlarges the per-BF window from +/-2 px to +/-3 px so the img_sx=3.5 spatial Gaussian can actually average over the larger neighborhood it is requesting -> lifts SSIM past iter-14 0.8035 on the SAME seed=42 split (watch whether hr finally moves off ~0.332 too, or stays pinned at the 64-view-FBP noise-floor ceiling -- if SSIM rises but hr stays flat, the kernel/sigma axis is an SSIM-only structural-similarity lever bounded by the same FBP hr ceiling; if SSIM ALSO saturates, the image-domain spatial denoising is fully exhausted and the ~0.80 SSIM / ~0.33 hr ceiling is the substrate bound). Chose img_kernel 5->7 (the pre-registered iter-15 step -- the window-size follow-on once the spatial sigma reached the window edge) over (a) pushing img_sx/img_sy 3.5->4.5 (sigma is now window-capped -- further widening inside the same 5-px window cannot reach the wider support, the diagnosis this iter directly tests), (b) proj_sr/proj_kernel/proj_n_bf (whole proj domain confirmed flat at iter-11/12 -- symmetry trap, wasted), (c) img_sr (exhausted + substrate-confirmed WRONG-direction -- tightening to 0.0005 collapsed hr 0.3335->0.1998 at iter-4 -- FORBIDDEN, stays LOOSE 0.02), (d) img_n_bf/n_iter/pretrain_epochs/seed/val_n (all DEAD FLAT / variance-only, exhausted), (e) grad_clip (mandatory overflow guard at 1.0, not a quality lever). Held fixed at iter-14 values: img_sx=3.5/img_sy=3.5, img_n_bf=7, img_sr=0.02 (LOOSE, demo-correct), proj_n_bf=1, proj_kernel=7, proj_sr=0.02, proj_sx=1.0/proj_sy=2.0, lr=2.3e-3, warm_start=True, pretrain_epochs=3, n_iter=400, train_n=200, val_n=6, grad_clip=1.0, seed=42. Wall: iter-14 ran 331 s; a 7-px image-BF window is modestly slower per step than a 5-px window (the image-domain conv is a small fraction of the 128-view FBP+proj per-step cost) -- n_iter/val_n kept at iter-14 values, so wall stays comfortably under the 1800 s sbatch wall and the 1200 s outer_wall_s internal guard (under the 15-min budget). PER-IMAGE bilateral N2I, AGENT4CT_DATASET=phantoms; warm_start STAYS ON; do NOT revert to amortized; do NOT tighten img_sr.", "comparison_image": "runs/demo-dl-claude-agentic-dual-domain-bilateral-n2i-search-20260618-01/iterations/iter-0015/comparison.png"}
