{"ts": "2026-06-19T09:10:01Z", "run_id": "demo-dl-claude-agentic-dual-domain-bilateral-n2i-search-20260618-01", "iter": 18, "agent": "dual_domain_bilateral_n2i-claude-agentic-breast-ct", "model": "claude-opus-4.7-1m", "change_class": "architecture", "status": "keep", "kept": true, "val_score": 0.8401064276695251, "headroom": 0.3255910576919355, "params_M": 2.4e-05, "train_n": 400, "rationale": "dual_domain_bilateral_n2i-claude-agentic: train_n=200, val_n=6, batch_size=1, grad_clip=1.0, seed=42, warm_start=True, pretrain_epochs=3, n_iter=400, outer_wall_s=1200, lr=0.0023, proj_n_bf=1, img_n_bf=7, proj_kernel=7, img_kernel=11, proj_sx=1.0, proj_sy=2.0, proj_sr=0.02, img_sx=4.5, img_sy=4.5, img_sr=0.02, rationale=iter-18: ONE knob changed vs the iter-17 WIN base (image-domain bilateral WINDOW SIZE img_kernel 9->11); all 18 other fields held IDENTICAL to demo_dl_dual_domain_bilateral_n2i_iter_17.json (img_sx/img_sy=4.5, img_n_bf=7, img_sr=0.02 LOOSE demo-correct, proj_n_bf=1, proj_kernel=7, proj_sx/sy=1.0/2.0, proj_sr=0.02, lr=2.3e-3, warm_start=True, pretrain_epochs=3, n_iter=400, train_n=200, val_n=6, grad_clip=1.0, seed=42 -> identical seed=42 val split, directly comparable to iter-17 SSIM 0.8368 / hr 0.3251 / PSNR 20.08). THE PRE-REGISTERED iter-18 STEP: WIDEN THE WINDOW that the re-liberated sigma now requests. Read iter-16->17 BY SSIM (the surface the spatial-smoothing thread moves; hr stays pinned ~0.325-0.332 at the 64-view-FBP noise-floor ceiling, an SSIM-only lever): iter-16 img_kernel 7->9 gave SSIM 0.8246->0.8284 (+0.0038, kernel thread saturating at the then-sigma=3.5); iter-17 RE-LIBERATED the sigma img_sx/img_sy 3.5->4.5 at kernel=9 and LIFTED SSIM 0.8284->0.8368 (+0.0084, STILL CLIMBING -- bigger than the saturating iter-16 kernel step), while hr stayed pinned (0.3283->0.3251) and PSNR flat (20.12->20.08). So sigma re-liberation is the live thread and it is NOT yet saturated. SIGMA/KERNEL COUPLING READ (the binding constraint flipped back to the WINDOW): a Gaussian of spatial sigma s needs ~+/-2s of support to be well-represented; at img_sx=4.5 that is ~+/-9px requested, but img_kernel=9 gives only a +/-4px window (half-window 4 < sigma 4.5). So the sigma=4.5 Gaussian is AGAIN truncated by the window -- the +0.0084 lift at iter-17 was the sigma reaching the +/-4px window edge, and the WINDOW is once more the binding constraint (2*sigma~9px > 4px half-window). FAILURE MODE this iter addresses: at kernel=9 the img_sx=4.5 spatial weight is clipped at the +/-4px window edge -- the BF cannot average over the full ~+/-5px (kernel=11) / ~+/-9px (2*sigma) neighborhood the sigma=4.5 requests. The unlock is to widen the WINDOW, not push the sigma further (pushing sigma 4.5->5.5 now would request even MORE support from a window that already truncates it -- the exact iter-14 saturation regime). This is the alternating sigma<->kernel ladder explicitly pre-registered in iter-17's rationale: 'If SSIM rises meaningfully, the sigma still has headroom and the alternating sigma<->kernel ladder continues (iter-18 would widen kernel 9->11)'. SSIM rose +0.0084 (meaningfully), so the ladder continues to the kernel. HYPOTHESIS (img-kernel-3): widening img_kernel 9->11 enlarges each per-BF window from +/-4px to +/-5px so the img_sx=4.5 spatial Gaussian can average over (more of) the neighborhood it requests -> lifts SSIM past iter-17 0.8368 on the SAME seed=42 split. Expect hr to stay pinned ~0.325-0.332 (this whole spatial thread is an SSIM-only structural-similarity lever bounded by the 64-view-FBP noise floor -- hr flat across iter-13..17). DIAGNOSTIC: if SSIM rises meaningfully (gain >0.005) the climb continues and iter-19 would RE-LIBERATE the sigma again (4.5->5.5 now that kernel=11 admits it) -- the ladder is not yet at its substrate bound; if SSIM SATURATES or regresses (gain <0.005) the image-domain spatial denoising is exhausted at the ~0.84 SSIM / ~0.33 hr substrate bound -- the 6-param bilateral cannot extract more than the 64-view (half of 128) FBP noise floor allows on this synthetic phantom substrate -- a clean ceiling-doc result toward iter-20. Chose img_kernel 9->11 (the EXPLICITLY pre-registered iter-18 next step -- continue the alternating ladder by raising the binding constraint, which is now the WINDOW since 2*sigma=9px > the kernel=9 +/-4px half-window) over (a) pushing img_sx/img_sy 4.5->5.5 NOW (the sigma is window-truncated at kernel=9, so widening it further requests support the +/-4px window cannot deliver -- the iter-14 saturation regime; widen the window FIRST, re-liberate sigma at iter-19 if the kernel saturates), (b) proj_sr/proj_kernel/proj_n_bf (whole proj domain confirmed flat at iter-11/12 -- symmetry trap, wasted), (c) img_sr (exhausted + substrate-confirmed WRONG-direction -- tightening to 0.0005 collapsed hr 0.3335->0.1998 at iter-4 -- FORBIDDEN, stays LOOSE 0.02), (d) img_n_bf/n_iter/pretrain_epochs/seed/val_n (all DEAD FLAT / variance-only, exhausted), (e) grad_clip (mandatory overflow guard at 1.0, not a quality lever). Held fixed at iter-17 values: img_sx=4.5/img_sy=4.5, img_n_bf=7, img_sr=0.02 (LOOSE, demo-correct), proj_n_bf=1, proj_kernel=7, proj_sr=0.02, proj_sx=1.0/proj_sy=2.0, lr=2.3e-3, warm_start=True, pretrain_epochs=3, n_iter=400, train_n=200, val_n=6, grad_clip=1.0, seed=42. Wall: iter-16/17 ran ~762-764 s at img_kernel=9; an 11-px image-BF window is modestly slower per step than a 9-px window (the image-domain conv is a small fraction of the 128-view FBP+proj per-step cost) -- n_iter=400/val_n=6 kept at iter-17 values, so wall stays comfortably under the 1800 s sbatch wall and the 1200 s outer_wall_s internal guard (under the 15-min budget). PER-IMAGE bilateral N2I, AGENT4CT_DATASET=phantoms; warm_start STAYS ON; do NOT revert to amortized; do NOT tighten img_sr.", "advice_for_others": "dual_domain_bilateral_n2i-claude-agentic: train_n=200, val_n=6, batch_size=1, grad_clip=1.0, seed=42, warm_start=True, pretrain_epochs=3, n_iter=400, outer_wall_s=1200, lr=0.0023, proj_n_bf=1, img_n_bf=7, proj_kernel=7, img_kernel=11, proj_sx=1.0, proj_sy=2.0, proj_sr=0.02, img_sx=4.5, img_sy=4.5, img_sr=0.02, rationale=iter-18: ONE knob changed vs the iter-17 WIN base (image-domain bilateral WINDOW SIZE img_kernel 9->11); all 18 other fields held IDENTICAL to demo_dl_dual_domain_bilateral_n2i_iter_17.json (img_sx/img_sy=4.5, img_n_bf=7, img_sr=0.02 LOOSE demo-correct, proj_n_bf=1, proj_kernel=7, proj_sx/sy=1.0/2.0, proj_sr=0.02, lr=2.3e-3, warm_start=True, pretrain_epochs=3, n_iter=400, train_n=200, val_n=6, grad_clip=1.0, seed=42 -> identical seed=42 val split, directly comparable to iter-17 SSIM 0.8368 / hr 0.3251 / PSNR 20.08). THE PRE-REGISTERED iter-18 STEP: WIDEN THE WINDOW that the re-liberated sigma now requests. Read iter-16->17 BY SSIM (the surface the spatial-smoothing thread moves; hr stays pinned ~0.325-0.332 at the 64-view-FBP noise-floor ceiling, an SSIM-only lever): iter-16 img_kernel 7->9 gave SSIM 0.8246->0.8284 (+0.0038, kernel thread saturating at the then-sigma=3.5); iter-17 RE-LIBERATED the sigma img_sx/img_sy 3.5->4.5 at kernel=9 and LIFTED SSIM 0.8284->0.8368 (+0.0084, STILL CLIMBING -- bigger than the saturating iter-16 kernel step), while hr stayed pinned (0.3283->0.3251) and PSNR flat (20.12->20.08). So sigma re-liberation is the live thread and it is NOT yet saturated. SIGMA/KERNEL COUPLING READ (the binding constraint flipped back to the WINDOW): a Gaussian of spatial sigma s needs ~+/-2s of support to be well-represented; at img_sx=4.5 that is ~+/-9px requested, but img_kernel=9 gives only a +/-4px window (half-window 4 < sigma 4.5). So the sigma=4.5 Gaussian is AGAIN truncated by the window -- the +0.0084 lift at iter-17 was the sigma reaching the +/-4px window edge, and the WINDOW is once more the binding constraint (2*sigma~9px > 4px half-window). FAILURE MODE this iter addresses: at kernel=9 the img_sx=4.5 spatial weight is clipped at the +/-4px window edge -- the BF cannot average over the full ~+/-5px (kernel=11) / ~+/-9px (2*sigma) neighborhood the sigma=4.5 requests. The unlock is to widen the WINDOW, not push the sigma further (pushing sigma 4.5->5.5 now would request even MORE support from a window that already truncates it -- the exact iter-14 saturation regime). This is the alternating sigma<->kernel ladder explicitly pre-registered in iter-17's rationale: 'If SSIM rises meaningfully, the sigma still has headroom and the alternating sigma<->kernel ladder continues (iter-18 would widen kernel 9->11)'. SSIM rose +0.0084 (meaningfully), so the ladder continues to the kernel. HYPOTHESIS (img-kernel-3): widening img_kernel 9->11 enlarges each per-BF window from +/-4px to +/-5px so the img_sx=4.5 spatial Gaussian can average over (more of) the neighborhood it requests -> lifts SSIM past iter-17 0.8368 on the SAME seed=42 split. Expect hr to stay pinned ~0.325-0.332 (this whole spatial thread is an SSIM-only structural-similarity lever bounded by the 64-view-FBP noise floor -- hr flat across iter-13..17). DIAGNOSTIC: if SSIM rises meaningfully (gain >0.005) the climb continues and iter-19 would RE-LIBERATE the sigma again (4.5->5.5 now that kernel=11 admits it) -- the ladder is not yet at its substrate bound; if SSIM SATURATES or regresses (gain <0.005) the image-domain spatial denoising is exhausted at the ~0.84 SSIM / ~0.33 hr substrate bound -- the 6-param bilateral cannot extract more than the 64-view (half of 128) FBP noise floor allows on this synthetic phantom substrate -- a clean ceiling-doc result toward iter-20. Chose img_kernel 9->11 (the EXPLICITLY pre-registered iter-18 next step -- continue the alternating ladder by raising the binding constraint, which is now the WINDOW since 2*sigma=9px > the kernel=9 +/-4px half-window) over (a) pushing img_sx/img_sy 4.5->5.5 NOW (the sigma is window-truncated at kernel=9, so widening it further requests support the +/-4px window cannot deliver -- the iter-14 saturation regime; widen the window FIRST, re-liberate sigma at iter-19 if the kernel saturates), (b) proj_sr/proj_kernel/proj_n_bf (whole proj domain confirmed flat at iter-11/12 -- symmetry trap, wasted), (c) img_sr (exhausted + substrate-confirmed WRONG-direction -- tightening to 0.0005 collapsed hr 0.3335->0.1998 at iter-4 -- FORBIDDEN, stays LOOSE 0.02), (d) img_n_bf/n_iter/pretrain_epochs/seed/val_n (all DEAD FLAT / variance-only, exhausted), (e) grad_clip (mandatory overflow guard at 1.0, not a quality lever). Held fixed at iter-17 values: img_sx=4.5/img_sy=4.5, img_n_bf=7, img_sr=0.02 (LOOSE, demo-correct), proj_n_bf=1, proj_kernel=7, proj_sr=0.02, proj_sx=1.0/proj_sy=2.0, lr=2.3e-3, warm_start=True, pretrain_epochs=3, n_iter=400, train_n=200, val_n=6, grad_clip=1.0, seed=42. Wall: iter-16/17 ran ~762-764 s at img_kernel=9; an 11-px image-BF window is modestly slower per step than a 9-px window (the image-domain conv is a small fraction of the 128-view FBP+proj per-step cost) -- n_iter=400/val_n=6 kept at iter-17 values, so wall stays comfortably under the 1800 s sbatch wall and the 1200 s outer_wall_s internal guard (under the 15-min budget). PER-IMAGE bilateral N2I, AGENT4CT_DATASET=phantoms; warm_start STAYS ON; do NOT revert to amortized; do NOT tighten img_sr.", "comparison_image": "runs/demo-dl-claude-agentic-dual-domain-bilateral-n2i-search-20260618-01/iterations/iter-0018/comparison.png"}
{"ts": "2026-06-19T08:57:59Z", "run_id": "demo-dl-claude-agentic-dual-domain-n2i-search-20260618-01", "iter": 14, "agent": "dual_domain_n2i-claude-agentic-breast-ct", "model": "claude-opus-4.7-1m", "change_class": "architecture", "status": "discard", "kept": false, "val_score": 0.4430510997772217, "headroom": 0.0, "params_M": 0.465762, "train_n": 400, "rationale": "dual_domain_n2i-claude-agentic: train_n=200, val_n=24, batch_size=1, grad_clip=1.0, seed=123, warm_start=True, pretrain_epochs=12, n_iter=600, outer_wall_s=1700, lr=0.0001, unet_c=16, rationale=iter-14: ONE confirmation knob -> seed 42 -> 123, at the iter-13 val_n=24 PEAK basis (val_n=24/ep12/lr1e-4/warm_start=True/n_iter600/grad_clip1.0). A SECOND-SEED variance read on the NEW wider 24-scene basis (the variance of the wider-basis ceiling estimate is the one quantity iter-13 left un-pinned). This is a CONFIRMATION move, NOT a ceiling-raiser -- no ceiling-raiser remains for the over-parameterized U-Net on this 128-view synthetic substrate. DIAGNOSIS (numbers, not pixels): iter-13 val_n 12->24 (seed42) gave SSIM 0.4616, PSNR 13.45, hr 0.0011 -- landing squarely in the predicted [0.46,0.48] family, so the seed42 ceiling read is now on a 24-scene basis. But the wider basis has been read at ONLY ONE seed (42). At val_n=12 the seed spread was seed42=0.4724 / seed123=0.4484 / seed7=0.4305 (3-seed mean 0.4504, std 0.0173); whether doubling to 24 scenes shrinks that spread (the ~sqrt(2) averaging argument) is untested -- the wider-basis variance is the last un-pinned quantity in the ceiling documentation. FAILURE MODE = the 0.466 M-param U-Net OVERFITS each single noisy 128-view sparse-phantom scan (the 6-param bilateral twin physically cannot, which is why the twin clears baseline at hr+0.33 while this U-Net stays hr~0 at ~0.45-0.51 SSIM); the per-image fit has an init-driven stochastic noise floor that a wider val basis shrinks but does not eliminate. EXHAUSTED / FORBIDDEN axes (do NOT retry): n_iter (iter-2 1200 steps 0.4785->0.4293, per-scan overfit), warm_start (iter-8 off -0.0595, load-bearing-positive), lr (iter-3 1e-3->1e-4 + iter-9 1e-4->2e-4 bracket 1e-4 as optimal), pretrain_epochs (ep12 peak, ep18 worse 0.5016), unet_c (design-doc warned-against; mayo n2i c16->c32 flat), grad_clip=1.0 (LOAD-BEARING 128/2304-view FBP-adjoint overflow guard, mandatory). The ONLY genuinely-untried confirmation knob is seed AT the new val_n=24 basis. LEVER CHOICE: seed 42 -> 123 at the val_n=24 PEAK config, pairing the second seed with the wider basis to measure how much of the val_n=12 seed spread (std 0.0173) survives the doubling to 24 scenes. HYPOTHESIS: at val_n=24 the seed42 (0.4616) and seed123 reads land CLOSE (|delta| < ~0.02, tighter than the val_n=12 seed42-vs-seed123 delta of 0.024), because averaging over 24 independent per-scan draws cancels most per-scan init stochasticity -> a trustworthy ~0.46 finalized wider-basis ceiling for the per-image U-Net N2I on this synthetic 128-view substrate. hr stays ~0 (structurally FBP-bounded on dense 128-view phantoms). FALSIFIER: if the two val_n=24 seed reads STILL swing wide (|delta| > ~0.04), the stochastic floor is INTRINSIC to the per-scan N2I objective (not just init-set sampling that wider averaging would cancel) and that wide floor IS the documented ceiling finding -- the over-parameterized U-Net is structurally the wrong tool here vs the bilateral twin (hr+0.33). Either branch advances the iter-20 CEILING-DOCUMENTATION mandate. WALL: warm 12x200=2400 + per-image 24x600=14400 = 16800 steps @ ~0.083 s/step ~= 1394 s; iter-13 ran this exact budget in 1651 s, under the outer_wall_s=1700 guard (per_scene_s = 1700/24 ~= 71 s, ample for 600 steps @ ~0.083 s/step ~= 50 s) and under the 00:30:00 (1800 s) sbatch wall. All recon-affecting knobs IDENTICAL to the iter-13 seed42 config (train_n=200, val_n=24, batch_size=1, grad_clip=1.0, warm_start=True, pretrain_epochs=12, n_iter=600, lr=1e-4, unet_c=16, outer_wall_s=1700); ONLY seed 42 -> 123 changed.", "advice_for_others": "dual_domain_n2i-claude-agentic: train_n=200, val_n=24, batch_size=1, grad_clip=1.0, seed=123, warm_start=True, pretrain_epochs=12, n_iter=600, outer_wall_s=1700, lr=0.0001, unet_c=16, rationale=iter-14: ONE confirmation knob -> seed 42 -> 123, at the iter-13 val_n=24 PEAK basis (val_n=24/ep12/lr1e-4/warm_start=True/n_iter600/grad_clip1.0). A SECOND-SEED variance read on the NEW wider 24-scene basis (the variance of the wider-basis ceiling estimate is the one quantity iter-13 left un-pinned). This is a CONFIRMATION move, NOT a ceiling-raiser -- no ceiling-raiser remains for the over-parameterized U-Net on this 128-view synthetic substrate. DIAGNOSIS (numbers, not pixels): iter-13 val_n 12->24 (seed42) gave SSIM 0.4616, PSNR 13.45, hr 0.0011 -- landing squarely in the predicted [0.46,0.48] family, so the seed42 ceiling read is now on a 24-scene basis. But the wider basis has been read at ONLY ONE seed (42). At val_n=12 the seed spread was seed42=0.4724 / seed123=0.4484 / seed7=0.4305 (3-seed mean 0.4504, std 0.0173); whether doubling to 24 scenes shrinks that spread (the ~sqrt(2) averaging argument) is untested -- the wider-basis variance is the last un-pinned quantity in the ceiling documentation. FAILURE MODE = the 0.466 M-param U-Net OVERFITS each single noisy 128-view sparse-phantom scan (the 6-param bilateral twin physically cannot, which is why the twin clears baseline at hr+0.33 while this U-Net stays hr~0 at ~0.45-0.51 SSIM); the per-image fit has an init-driven stochastic noise floor that a wider val basis shrinks but does not eliminate. EXHAUSTED / FORBIDDEN axes (do NOT retry): n_iter (iter-2 1200 steps 0.4785->0.4293, per-scan overfit), warm_start (iter-8 off -0.0595, load-bearing-positive), lr (iter-3 1e-3->1e-4 + iter-9 1e-4->2e-4 bracket 1e-4 as optimal), pretrain_epochs (ep12 peak, ep18 worse 0.5016), unet_c (design-doc warned-against; mayo n2i c16->c32 flat), grad_clip=1.0 (LOAD-BEARING 128/2304-view FBP-adjoint overflow guard, mandatory). The ONLY genuinely-untried confirmation knob is seed AT the new val_n=24 basis. LEVER CHOICE: seed 42 -> 123 at the val_n=24 PEAK config, pairing the second seed with the wider basis to measure how much of the val_n=12 seed spread (std 0.0173) survives the doubling to 24 scenes. HYPOTHESIS: at val_n=24 the seed42 (0.4616) and seed123 reads land CLOSE (|delta| < ~0.02, tighter than the val_n=12 seed42-vs-seed123 delta of 0.024), because averaging over 24 independent per-scan draws cancels most per-scan init stochasticity -> a trustworthy ~0.46 finalized wider-basis ceiling for the per-image U-Net N2I on this synthetic 128-view substrate. hr stays ~0 (structurally FBP-bounded on dense 128-view phantoms). FALSIFIER: if the two val_n=24 seed reads STILL swing wide (|delta| > ~0.04), the stochastic floor is INTRINSIC to the per-scan N2I objective (not just init-set sampling that wider averaging would cancel) and that wide floor IS the documented ceiling finding -- the over-parameterized U-Net is structurally the wrong tool here vs the bilateral twin (hr+0.33). Either branch advances the iter-20 CEILING-DOCUMENTATION mandate. WALL: warm 12x200=2400 + per-image 24x600=14400 = 16800 steps @ ~0.083 s/step ~= 1394 s; iter-13 ran this exact budget in 1651 s, under the outer_wall_s=1700 guard (per_scene_s = 1700/24 ~= 71 s, ample for 600 steps @ ~0.083 s/step ~= 50 s) and under the 00:30:00 (1800 s) sbatch wall. All recon-affecting knobs IDENTICAL to the iter-13 seed42 config (train_n=200, val_n=24, batch_size=1, grad_clip=1.0, warm_start=True, pretrain_epochs=12, n_iter=600, lr=1e-4, unet_c=16, outer_wall_s=1700); ONLY seed 42 -> 123 changed.", "comparison_image": "runs/demo-dl-claude-agentic-dual-domain-n2i-search-20260618-01/iterations/iter-0014/comparison.png"}
