{"ts": "2026-06-19T00:46:13Z", "run_id": "demo-dl-claude-agentic-dual-domain-bilateral-n2i-search-20260618-01", "iter": 6, "agent": "dual_domain_bilateral_n2i-claude-agentic-breast-ct", "model": "claude-opus-4.7-1m", "change_class": "architecture", "status": "keep", "kept": true, "val_score": 0.7795711755752563, "headroom": 0.3329530416661406, "params_M": 2.4e-05, "train_n": 400, "rationale": "dual_domain_bilateral_n2i-claude-agentic: train_n=200, val_n=6, batch_size=1, grad_clip=1.0, seed=42, warm_start=True, pretrain_epochs=3, n_iter=400, outer_wall_s=1200, lr=0.0023, proj_n_bf=1, img_n_bf=7, proj_kernel=7, img_kernel=5, proj_sx=1.0, proj_sy=2.0, proj_sr=0.02, img_sx=1.5, img_sy=1.5, img_sr=0.02, rationale=iter-6: ONE knob changed vs the hr-best base iter-3/iter-5 (img_n_bf 5->7, the image-domain bilateral cascade DEPTH); all 18 other fields held IDENTICAL to demo_dl_dual_domain_bilateral_n2i_iter_05.json (which restored iter-3, img_n_bf=5/img_sr=0.02, hr 0.3320~0.3335 = run-best). Base chosen by HEADROOM, not raw SSIM: hr is the campaign primary metric and is PSNR/noise-sensitive on demo. Trajectory by HEADROOM: iter-1 img_n_bf=1 hr 0.2763 (PSNR 19.47); iter-2 img_n_bf=3 hr 0.3276 (PSNR 20.10, +0.051); iter-3 img_n_bf=5 hr 0.3335 (PSNR 20.18, +0.007 HR-BEST); iter-4 img_sr->0.0005 hr 0.1998 REGRESSED (wrong-direction range-sigma lever, over-sharpen, PSNR 18.60); iter-5 img_sr->0.02 revert hr 0.3320 RECOVERED to ~iter-3. The img_sr range-sigma lever is EXHAUSTED and substrate-confirmed: demo wants LOOSE img_sr=0.02 (opposite to breast), tightening HURTS hr. The proj-domain stack is in the symmetry trap (proj sigmas near-identity per the design doc -> proj_n_bf stays 1, wasted params). That leaves image-domain DEPTH (img_n_bf) as the only proven hr lever on demo, the same lever that earned the whole arc hr 0.276->0.328->0.335. PROBE/HYPOTHESIS: push the proven depth lever one notch further, 5->7, growing the image denoiser from 15 to 21 trainable scalars (total network 16->22 params, still ultra-low, far too few to memorise 6 val scenes). Two more BFs add two coarse-to-fine scales to the multi-scale cascade for additional noise-floor smoothing -- the demo-relevant axis since hr here is PSNR/noise-sensitive. This DOUBLES as the ceiling-doc probe: depth gains are sharply diminishing (1->3 gave +0.051 hr, 3->5 gave only +0.007 hr, PSNR flat 20.10->20.18), so expect <=+0.003 hr. If hr flattens (or regresses), it CONFIRMS demo bilateral N2I is at its structural ceiling (~hr 0.33) -- the 21-scalar image cascade cannot extract more than the half-view FBP noise floor allows on this 128-view synthetic phantom substrate -- and the next iter should stop chasing depth and instead document the ceiling (seed/n_iter/pretrain_epochs invariance probe) rather than tune another smoothing knob. Chose img_n_bf 5->7 over (a) img_sr (exhausted, wrong-direction, hr 0.3335->0.1998), (b) proj_n_bf (symmetry trap, wasted params), (c) img_kernel/img_sx/img_sy (less-informed guesses with no headroom evidence) -- depth is the ONLY lever with a demonstrated positive hr slope on demo. Held fixed at iter-3/iter-5 values: img_sr=0.02 (LOOSE, demo-correct), proj_n_bf=1, kernels (proj_k=7/img_k=5), proj sigmas (1.0/2.0/0.02), img spatial sigmas (img_sx=1.5/img_sy=1.5), lr=2.3e-3, warm_start=True, pretrain_epochs=3, n_iter=400, train_n=200, val_n=6, grad_clip=1.0, seed=42 (-> identical val split, directly comparable to iter-1/2/3/4/5). Wall: iter-5 ran 249 s; two more image-domain BFs add only a small fraction of the 128-view FBP+proj per-step cost, so comfortably under the 1800 s sbatch wall and the 1200 s outer_wall_s internal guard (well under the 15-min budget). PER-IMAGE bilateral N2I, AGENT4CT_DATASET=phantoms; do NOT revert to amortized.", "advice_for_others": "dual_domain_bilateral_n2i-claude-agentic: train_n=200, val_n=6, batch_size=1, grad_clip=1.0, seed=42, warm_start=True, pretrain_epochs=3, n_iter=400, outer_wall_s=1200, lr=0.0023, proj_n_bf=1, img_n_bf=7, proj_kernel=7, img_kernel=5, proj_sx=1.0, proj_sy=2.0, proj_sr=0.02, img_sx=1.5, img_sy=1.5, img_sr=0.02, rationale=iter-6: ONE knob changed vs the hr-best base iter-3/iter-5 (img_n_bf 5->7, the image-domain bilateral cascade DEPTH); all 18 other fields held IDENTICAL to demo_dl_dual_domain_bilateral_n2i_iter_05.json (which restored iter-3, img_n_bf=5/img_sr=0.02, hr 0.3320~0.3335 = run-best). Base chosen by HEADROOM, not raw SSIM: hr is the campaign primary metric and is PSNR/noise-sensitive on demo. Trajectory by HEADROOM: iter-1 img_n_bf=1 hr 0.2763 (PSNR 19.47); iter-2 img_n_bf=3 hr 0.3276 (PSNR 20.10, +0.051); iter-3 img_n_bf=5 hr 0.3335 (PSNR 20.18, +0.007 HR-BEST); iter-4 img_sr->0.0005 hr 0.1998 REGRESSED (wrong-direction range-sigma lever, over-sharpen, PSNR 18.60); iter-5 img_sr->0.02 revert hr 0.3320 RECOVERED to ~iter-3. The img_sr range-sigma lever is EXHAUSTED and substrate-confirmed: demo wants LOOSE img_sr=0.02 (opposite to breast), tightening HURTS hr. The proj-domain stack is in the symmetry trap (proj sigmas near-identity per the design doc -> proj_n_bf stays 1, wasted params). That leaves image-domain DEPTH (img_n_bf) as the only proven hr lever on demo, the same lever that earned the whole arc hr 0.276->0.328->0.335. PROBE/HYPOTHESIS: push the proven depth lever one notch further, 5->7, growing the image denoiser from 15 to 21 trainable scalars (total network 16->22 params, still ultra-low, far too few to memorise 6 val scenes). Two more BFs add two coarse-to-fine scales to the multi-scale cascade for additional noise-floor smoothing -- the demo-relevant axis since hr here is PSNR/noise-sensitive. This DOUBLES as the ceiling-doc probe: depth gains are sharply diminishing (1->3 gave +0.051 hr, 3->5 gave only +0.007 hr, PSNR flat 20.10->20.18), so expect <=+0.003 hr. If hr flattens (or regresses), it CONFIRMS demo bilateral N2I is at its structural ceiling (~hr 0.33) -- the 21-scalar image cascade cannot extract more than the half-view FBP noise floor allows on this 128-view synthetic phantom substrate -- and the next iter should stop chasing depth and instead document the ceiling (seed/n_iter/pretrain_epochs invariance probe) rather than tune another smoothing knob. Chose img_n_bf 5->7 over (a) img_sr (exhausted, wrong-direction, hr 0.3335->0.1998), (b) proj_n_bf (symmetry trap, wasted params), (c) img_kernel/img_sx/img_sy (less-informed guesses with no headroom evidence) -- depth is the ONLY lever with a demonstrated positive hr slope on demo. Held fixed at iter-3/iter-5 values: img_sr=0.02 (LOOSE, demo-correct), proj_n_bf=1, kernels (proj_k=7/img_k=5), proj sigmas (1.0/2.0/0.02), img spatial sigmas (img_sx=1.5/img_sy=1.5), lr=2.3e-3, warm_start=True, pretrain_epochs=3, n_iter=400, train_n=200, val_n=6, grad_clip=1.0, seed=42 (-> identical val split, directly comparable to iter-1/2/3/4/5). Wall: iter-5 ran 249 s; two more image-domain BFs add only a small fraction of the 128-view FBP+proj per-step cost, so comfortably under the 1800 s sbatch wall and the 1200 s outer_wall_s internal guard (well under the 15-min budget). PER-IMAGE bilateral N2I, AGENT4CT_DATASET=phantoms; do NOT revert to amortized.", "comparison_image": "runs/demo-dl-claude-agentic-dual-domain-bilateral-n2i-search-20260618-01/iterations/iter-0006/comparison.png"}
{"ts": "2026-06-19T00:40:59Z", "run_id": "demo-dl-claude-agentic-dual-domain-n2i-search-20260618-01", "iter": 6, "agent": "dual_domain_n2i-claude-agentic-breast-ct", "model": "claude-opus-4.7-1m", "change_class": "architecture", "status": "discard", "kept": false, "val_score": 0.5016471147537231, "headroom": 0.0, "params_M": 0.465762, "train_n": 400, "rationale": "dual_domain_n2i-claude-agentic: train_n=200, val_n=6, batch_size=1, grad_clip=1.0, seed=42, warm_start=True, pretrain_epochs=18, n_iter=600, outer_wall_s=1200, lr=0.0001, unet_c=16, rationale=iter-6: ONE knob -> pretrain_epochs 12 -> 18 (1.5x warm-start budget). KEEP lr=1e-4 (per-scan overfit anchor, iter-3 winner). DIAGNOSIS (numbers, not pixels): iter-3 ep3/lr1e-4 SSIM 0.4880 (PSNR 16.28); iter-4 ep6 0.4957 (+0.0077, PSNR 16.29); iter-5 ep12 0.5081 (+0.0124, PSNR 16.376). The init lever (warm-start pretrain_epochs) is the dominant confirmed lever and is NOT saturating on demo: the gain ACCELERATED 6->12 (+0.0124) vs 3->6 (+0.0077), and PSNR rose monotonically 16.28->16.29->16.376 with NO turn-over. This DIVERGES from the breast n2i sibling, which SATURATED flat (0.9596) at ep12 -- demo (synthetic phantoms, lower-quality init at fixed epochs) still has slope on the init budget where breast does not. n_iter is RULED OUT (iter-2 1200 steps REGRESSED 0.4785->0.4293, per-scan U-Net overfits one noisy scan) and unet_c is the explicitly-warned-against axis (solver design doc: capacity is NOT the lever for this loss; mayo n2i c16->c32 flat 0.9508). So the only lever with demonstrated positive slope is the init budget. LEVER CHOICE: push pretrain_epochs once more (12->18) rather than pivot to the per-scan-anchor axis (seed/grad_clip/lr-sweep) because the iter-5 falsifier (flat at ~0.495 => init saturated => pivot) did NOT fire -- SSIM CLIMBED to 0.5081 with an accelerating slope, so the init lever is still the highest-expected-value move. Chose +6 (12->18, 1.5x) not +12 (12->24, 2x) to keep wall comfortably under 15 min without dropping val_n/n_iter (preserve the val-set + per-scan-budget consistency for clean iter-to-iter SSIM comparison). HYPOTHESIS: more warm-start budget converges the amortized GT-free N2I U-Net init further, lifting SSIM above the 0.5081 iter-5 plateau toward the per-image U-Net N2I ceiling on this 128-view synthetic substrate (~0.51, structurally FBP-bounded so still hr~0 -- the demo n2i ceiling is approach-to-baseline, not headroom). FALSIFIER: if SSIM flattens at ~0.508 (delta < +0.005, i.e. < half the iter-5 gain) the init lever has finally saturated on demo too -- declare the per-image U-Net N2I converged to its ceiling (~0.51) on this synthetic substrate and stop chasing init; iter-7 would then read the noise floor (seed) or accept the U-Net ceiling and lean on the bilateral twin (which clears baseline at hr+0.33 because its 6 params cannot overfit one scan). WALL: warm 18x200=3600 + per-image 6x600=3600 = 7200 steps @ ~0.083 s/step ~= 600 s (iter-5 was 463s at 6000 steps), under the 15-min target, the outer_wall_s=1200 guard, and the 00:30:00 (1800 s) sbatch wall -- no need to drop val_n/n_iter. All other knobs IDENTICAL to iter-5 (train_n=200, val_n=6, batch_size=1, grad_clip=1.0, seed=42, warm_start=True, n_iter=600, lr=1e-4, unet_c=16).", "advice_for_others": "dual_domain_n2i-claude-agentic: train_n=200, val_n=6, batch_size=1, grad_clip=1.0, seed=42, warm_start=True, pretrain_epochs=18, n_iter=600, outer_wall_s=1200, lr=0.0001, unet_c=16, rationale=iter-6: ONE knob -> pretrain_epochs 12 -> 18 (1.5x warm-start budget). KEEP lr=1e-4 (per-scan overfit anchor, iter-3 winner). DIAGNOSIS (numbers, not pixels): iter-3 ep3/lr1e-4 SSIM 0.4880 (PSNR 16.28); iter-4 ep6 0.4957 (+0.0077, PSNR 16.29); iter-5 ep12 0.5081 (+0.0124, PSNR 16.376). The init lever (warm-start pretrain_epochs) is the dominant confirmed lever and is NOT saturating on demo: the gain ACCELERATED 6->12 (+0.0124) vs 3->6 (+0.0077), and PSNR rose monotonically 16.28->16.29->16.376 with NO turn-over. This DIVERGES from the breast n2i sibling, which SATURATED flat (0.9596) at ep12 -- demo (synthetic phantoms, lower-quality init at fixed epochs) still has slope on the init budget where breast does not. n_iter is RULED OUT (iter-2 1200 steps REGRESSED 0.4785->0.4293, per-scan U-Net overfits one noisy scan) and unet_c is the explicitly-warned-against axis (solver design doc: capacity is NOT the lever for this loss; mayo n2i c16->c32 flat 0.9508). So the only lever with demonstrated positive slope is the init budget. LEVER CHOICE: push pretrain_epochs once more (12->18) rather than pivot to the per-scan-anchor axis (seed/grad_clip/lr-sweep) because the iter-5 falsifier (flat at ~0.495 => init saturated => pivot) did NOT fire -- SSIM CLIMBED to 0.5081 with an accelerating slope, so the init lever is still the highest-expected-value move. Chose +6 (12->18, 1.5x) not +12 (12->24, 2x) to keep wall comfortably under 15 min without dropping val_n/n_iter (preserve the val-set + per-scan-budget consistency for clean iter-to-iter SSIM comparison). HYPOTHESIS: more warm-start budget converges the amortized GT-free N2I U-Net init further, lifting SSIM above the 0.5081 iter-5 plateau toward the per-image U-Net N2I ceiling on this 128-view synthetic substrate (~0.51, structurally FBP-bounded so still hr~0 -- the demo n2i ceiling is approach-to-baseline, not headroom). FALSIFIER: if SSIM flattens at ~0.508 (delta < +0.005, i.e. < half the iter-5 gain) the init lever has finally saturated on demo too -- declare the per-image U-Net N2I converged to its ceiling (~0.51) on this synthetic substrate and stop chasing init; iter-7 would then read the noise floor (seed) or accept the U-Net ceiling and lean on the bilateral twin (which clears baseline at hr+0.33 because its 6 params cannot overfit one scan). WALL: warm 18x200=3600 + per-image 6x600=3600 = 7200 steps @ ~0.083 s/step ~= 600 s (iter-5 was 463s at 6000 steps), under the 15-min target, the outer_wall_s=1200 guard, and the 00:30:00 (1800 s) sbatch wall -- no need to drop val_n/n_iter. All other knobs IDENTICAL to iter-5 (train_n=200, val_n=6, batch_size=1, grad_clip=1.0, seed=42, warm_start=True, n_iter=600, lr=1e-4, unet_c=16).", "comparison_image": "runs/demo-dl-claude-agentic-dual-domain-n2i-search-20260618-01/iterations/iter-0006/comparison.png"}
{"ts": "2026-06-18T23:59:32Z", "run_id": "demo-dl-claude-agentic-dual-domain-n2i-search-20260618-01", "iter": 5, "agent": "dual_domain_n2i-claude-agentic-breast-ct", "model": "claude-opus-4.7-1m", "change_class": "architecture", "status": "discard", "kept": false, "val_score": 0.5081148743629456, "headroom": 0.0, "params_M": 0.465762, "train_n": 400, "rationale": "dual_domain_n2i-claude-agentic: train_n=200, val_n=6, batch_size=1, grad_clip=1.0, seed=42, warm_start=True, pretrain_epochs=12, n_iter=600, outer_wall_s=1200, lr=0.0001, unet_c=16, rationale=iter-5: ONE knob -> pretrain_epochs 6 -> 12 (2x warm-start budget again). KEEP lr=1e-4 (the per-scan overfit anchor, iter-3 winner). DIAGNOSIS (numbers, not pixels): iter-1 lr1e-3/n_iter400 SSIM 0.4785; iter-2 n_iter1200 0.4293 (more per-scan steps HURT -> per-image U-Net overfits each single noisy scan; n_iter RULED OUT); iter-3 lr1e-3->1e-4 0.4880 (+0.0095, the overfit-anchor lever -> per-scan fit pinned near the warm-start init); iter-4 pretrain_epochs 3->6 0.4957 (+0.0077, the BIGGEST gain, PSNR 16.13->16.29). The two confirmed levers on this dataset are (a) per-scan lr-down anchor and (b) warm-start init quality; n_iter is counterproductive and unet_c is explicitly warned against (solver design doc: capacity is NOT the lever for this loss; mayo n2i sibling c16->c32 flat 0.9508). With lr anchored at 1e-4 the per-scan fit barely moves off the warm-start init, so the warm-start init quality IS the operating point / binding constraint. iter-4 moved init quality MONOTONICALLY up (3ep 0.4880 -> 6ep 0.4957) with NO saturation/turn-over signal -- the lever still has slope. FAILURE MODE = warm-start init still under-converged at 6 epochs; the lr=1e-4 per-scan fit preserves but cannot improve a mediocre init, so a better-converged amortized GT-free N2I pre-pass directly raises the ceiling. LEVER CHOICE: of the two candidates, push pretrain_epochs (the lever that just gave the largest gain and is still climbing) rather than unet_c -- capacity is the warned-against axis and the mayo n2i sibling is already running the c16->c32 capacity probe, so keep the demo probe on the orthogonal init-budget lever instead of duplicating it. HYPOTHESIS: doubling the warm-start budget 6->12 epochs converges the amortized N2I init further, lifting SSIM above the 0.4957 iter-4 plateau toward the LD-FBP baseline (still structurally FBP-bounded on 128-view phantoms, so expect approach-to-baseline / small headroom, not a large jump). FALSIFIER: if SSIM is flat at ~0.495 the warm-start pre-pass has saturated by ~6ep and the init lever is exhausted -> iter-6 should pivot to the per-scan-anchor axis (warm_start sensitivity / seed / lr sweep around 1e-4) or accept the U-Net N2I ceiling and lean on the bilateral twin. WALL: warm 12x200=2400 + per-image 6x600=3600 = 6000 steps @ ~0.083 s/step ~= 500 s (iter-4 was 370s at 4800 steps), well under the 15-min target, the outer_wall_s=1200 guard, and the 00:30:00 (1800 s) sbatch wall. All other knobs IDENTICAL to iter-4 (train_n=200, val_n=6, batch_size=1, grad_clip=1.0, seed=42, warm_start=True, n_iter=600, lr=1e-4, unet_c=16).", "advice_for_others": "dual_domain_n2i-claude-agentic: train_n=200, val_n=6, batch_size=1, grad_clip=1.0, seed=42, warm_start=True, pretrain_epochs=12, n_iter=600, outer_wall_s=1200, lr=0.0001, unet_c=16, rationale=iter-5: ONE knob -> pretrain_epochs 6 -> 12 (2x warm-start budget again). KEEP lr=1e-4 (the per-scan overfit anchor, iter-3 winner). DIAGNOSIS (numbers, not pixels): iter-1 lr1e-3/n_iter400 SSIM 0.4785; iter-2 n_iter1200 0.4293 (more per-scan steps HURT -> per-image U-Net overfits each single noisy scan; n_iter RULED OUT); iter-3 lr1e-3->1e-4 0.4880 (+0.0095, the overfit-anchor lever -> per-scan fit pinned near the warm-start init); iter-4 pretrain_epochs 3->6 0.4957 (+0.0077, the BIGGEST gain, PSNR 16.13->16.29). The two confirmed levers on this dataset are (a) per-scan lr-down anchor and (b) warm-start init quality; n_iter is counterproductive and unet_c is explicitly warned against (solver design doc: capacity is NOT the lever for this loss; mayo n2i sibling c16->c32 flat 0.9508). With lr anchored at 1e-4 the per-scan fit barely moves off the warm-start init, so the warm-start init quality IS the operating point / binding constraint. iter-4 moved init quality MONOTONICALLY up (3ep 0.4880 -> 6ep 0.4957) with NO saturation/turn-over signal -- the lever still has slope. FAILURE MODE = warm-start init still under-converged at 6 epochs; the lr=1e-4 per-scan fit preserves but cannot improve a mediocre init, so a better-converged amortized GT-free N2I pre-pass directly raises the ceiling. LEVER CHOICE: of the two candidates, push pretrain_epochs (the lever that just gave the largest gain and is still climbing) rather than unet_c -- capacity is the warned-against axis and the mayo n2i sibling is already running the c16->c32 capacity probe, so keep the demo probe on the orthogonal init-budget lever instead of duplicating it. HYPOTHESIS: doubling the warm-start budget 6->12 epochs converges the amortized N2I init further, lifting SSIM above the 0.4957 iter-4 plateau toward the LD-FBP baseline (still structurally FBP-bounded on 128-view phantoms, so expect approach-to-baseline / small headroom, not a large jump). FALSIFIER: if SSIM is flat at ~0.495 the warm-start pre-pass has saturated by ~6ep and the init lever is exhausted -> iter-6 should pivot to the per-scan-anchor axis (warm_start sensitivity / seed / lr sweep around 1e-4) or accept the U-Net N2I ceiling and lean on the bilateral twin. WALL: warm 12x200=2400 + per-image 6x600=3600 = 6000 steps @ ~0.083 s/step ~= 500 s (iter-4 was 370s at 4800 steps), well under the 15-min target, the outer_wall_s=1200 guard, and the 00:30:00 (1800 s) sbatch wall. All other knobs IDENTICAL to iter-4 (train_n=200, val_n=6, batch_size=1, grad_clip=1.0, seed=42, warm_start=True, n_iter=600, lr=1e-4, unet_c=16).", "comparison_image": "runs/demo-dl-claude-agentic-dual-domain-n2i-search-20260618-01/iterations/iter-0005/comparison.png"}
