{"ts": "2026-06-18T20:25:50Z", "run_id": "demo-dl-claude-agentic-dual-domain-bilateral-n2i-search-20260618-01", "iter": 1, "agent": "dual_domain_bilateral_n2i-claude-agentic-breast-ct", "model": "claude-opus-4.7-1m", "change_class": "architecture", "status": "keep", "kept": true, "val_score": 0.6657189130783081, "headroom": 0.27625428843195377, "params_M": 6e-06, "train_n": 400, "rationale": "dual_domain_bilateral_n2i-claude-agentic: train_n=200, val_n=6, batch_size=1, grad_clip=1.0, seed=42, warm_start=True, pretrain_epochs=3, n_iter=400, outer_wall_s=1200, lr=0.0023, proj_n_bf=1, img_n_bf=1, proj_kernel=7, img_kernel=5, proj_sx=1.0, proj_sy=2.0, proj_sr=0.02, img_sx=1.5, img_sy=1.5, img_sr=0.02, rationale=iter-1 feasibility, per-image N2I rewrite (commit 1f4c3394) for the BILATERAL dual-domain solver on demo_dl (phantoms, 128-view synthetic, 512^2). Twin of demo_dl_dual_domain_n2i_iter_01 (job 764702): shared training knobs MATCH that combo (train_n=200, val_n=6, n_iter=400, pretrain_epochs=3, outer_wall_s=1200, grad_clip=1.0, seed=42) so both N2I variants are scored by evaluate_calibrated on the SAME 6 val scenes (seed=42 -> identical split). The ONE intended difference is the architecture: BilateralFilterStack denoisers (6 trainable params at proj_n_bf=img_n_bf=1) instead of the U-Net. Bilateral knobs seed from the historical demo_dl DD-BF-N2I winner (leaderboard rank-16: proj_k=7, img_k=5, lr=2.3e-3, SSIM 0.7605) plus Wagner-2022 abdomen sigma defaults (proj_sx/sy/sr=1.0/2.0/0.02, img=1.5/1.5/0.02). lr=2.3e-3 (BFs want higher lr than U-Nets; Wagner used 5e-3, historical demo_dl DD-BF used 2.3e-3 -> keep the proven demo_dl value). Sizing: bilateral is ~2x faster per step than the U-Net N2I (Mayo smoke: bilateral ~0.12 s/step vs dual ~0.245 s/step at 2304 views; demo_dl is 128-view = 18x fewer angles so per-step is far cheaper). Steps = warm 3x200=600 + per-image 6x400=2400 = 3000 total; even at the conservative U-Net rate this is ~360-735 s wall, well under the generic claude_agentic_one_iter.sbatch 00:30:00 (1800 s) wall. outer_wall_s=1200 is a hard internal guard on the per-image loop. Hypothesis: per-image N2I trains stably for the BF stack on demo_dl (finite val_score, comparison.png produced) and yields a usable per-scene recon; expect hr near baseline since N2I is structurally bounded by FBP on this dense-/sparse-view phantom substrate and the 6-param BF has minimal capacity (solver_plan.md). This iter-1 establishes the per-image BF baseline; iter-2+ will tune one knob at a time (likely img_n_bf or img kernel/sigma first, per the solver design doc hints).", "advice_for_others": "dual_domain_bilateral_n2i-claude-agentic: train_n=200, val_n=6, batch_size=1, grad_clip=1.0, seed=42, warm_start=True, pretrain_epochs=3, n_iter=400, outer_wall_s=1200, lr=0.0023, proj_n_bf=1, img_n_bf=1, proj_kernel=7, img_kernel=5, proj_sx=1.0, proj_sy=2.0, proj_sr=0.02, img_sx=1.5, img_sy=1.5, img_sr=0.02, rationale=iter-1 feasibility, per-image N2I rewrite (commit 1f4c3394) for the BILATERAL dual-domain solver on demo_dl (phantoms, 128-view synthetic, 512^2). Twin of demo_dl_dual_domain_n2i_iter_01 (job 764702): shared training knobs MATCH that combo (train_n=200, val_n=6, n_iter=400, pretrain_epochs=3, outer_wall_s=1200, grad_clip=1.0, seed=42) so both N2I variants are scored by evaluate_calibrated on the SAME 6 val scenes (seed=42 -> identical split). The ONE intended difference is the architecture: BilateralFilterStack denoisers (6 trainable params at proj_n_bf=img_n_bf=1) instead of the U-Net. Bilateral knobs seed from the historical demo_dl DD-BF-N2I winner (leaderboard rank-16: proj_k=7, img_k=5, lr=2.3e-3, SSIM 0.7605) plus Wagner-2022 abdomen sigma defaults (proj_sx/sy/sr=1.0/2.0/0.02, img=1.5/1.5/0.02). lr=2.3e-3 (BFs want higher lr than U-Nets; Wagner used 5e-3, historical demo_dl DD-BF used 2.3e-3 -> keep the proven demo_dl value). Sizing: bilateral is ~2x faster per step than the U-Net N2I (Mayo smoke: bilateral ~0.12 s/step vs dual ~0.245 s/step at 2304 views; demo_dl is 128-view = 18x fewer angles so per-step is far cheaper). Steps = warm 3x200=600 + per-image 6x400=2400 = 3000 total; even at the conservative U-Net rate this is ~360-735 s wall, well under the generic claude_agentic_one_iter.sbatch 00:30:00 (1800 s) wall. outer_wall_s=1200 is a hard internal guard on the per-image loop. Hypothesis: per-image N2I trains stably for the BF stack on demo_dl (finite val_score, comparison.png produced) and yields a usable per-scene recon; expect hr near baseline since N2I is structurally bounded by FBP on this dense-/sparse-view phantom substrate and the 6-param BF has minimal capacity (solver_plan.md). This iter-1 establishes the per-image BF baseline; iter-2+ will tune one knob at a time (likely img_n_bf or img kernel/sigma first, per the solver design doc hints).", "comparison_image": "runs/demo-dl-claude-agentic-dual-domain-bilateral-n2i-search-20260618-01/iterations/iter-0001/comparison.png"}
{"ts": "2026-06-18T20:22:55Z", "run_id": "demo-dl-claude-agentic-dual-domain-n2i-search-20260618-01", "iter": 1, "agent": "dual_domain_n2i-claude-agentic-breast-ct", "model": "claude-opus-4.7-1m", "change_class": "architecture", "status": "discard", "kept": false, "val_score": 0.47852545976638794, "headroom": 0.0, "params_M": 0.465762, "train_n": 400, "rationale": "dual_domain_n2i-claude-agentic: train_n=200, val_n=6, batch_size=1, grad_clip=1.0, seed=42, warm_start=True, pretrain_epochs=3, n_iter=400, outer_wall_s=1200, lr=0.001, unet_c=16, rationale=iter-1 feasibility, per-image N2I rewrite (commit 1f4c3394) on demo_dl (phantoms, 128-view synthetic, 512^2). Short warm-start pre-pass (3 ep x 200 train synthetic phantoms, GT-free N2I self-sup loss) then per-scene Adam (n_iter=400) on each of 6 val scans, scored by evaluate_calibrated on the SAME val scenes as every other method. grad_clip=1.0 (cheap insurance; demo 128-view adjoint is mild). Sizing vs smoke timing: Mayo 2304-view smoke was ~0.245 s/step; demo_dl is 128-view (18x fewer angles) so per-step is faster, conservatively ~0.12-0.25 s/step. Steps = warm 3x200=600 + per-image 6x400=2400 = 3000 total -> ~360-735 s wall, well under the generic claude_agentic_one_iter.sbatch 00:30:00 (1800 s) wall. outer_wall_s=1200 is a hard internal guard on the per-image loop so even worst-case steps finish under sbatch wall. Hypothesis: per-image N2I trains stably on demo_dl (finite val_score, comparison.png) and produces a usable per-scene recon; expect hr near baseline since N2I is structurally bounded by FBP on this dense-view substrate (solver_plan.md).", "advice_for_others": "dual_domain_n2i-claude-agentic: train_n=200, val_n=6, batch_size=1, grad_clip=1.0, seed=42, warm_start=True, pretrain_epochs=3, n_iter=400, outer_wall_s=1200, lr=0.001, unet_c=16, rationale=iter-1 feasibility, per-image N2I rewrite (commit 1f4c3394) on demo_dl (phantoms, 128-view synthetic, 512^2). Short warm-start pre-pass (3 ep x 200 train synthetic phantoms, GT-free N2I self-sup loss) then per-scene Adam (n_iter=400) on each of 6 val scans, scored by evaluate_calibrated on the SAME val scenes as every other method. grad_clip=1.0 (cheap insurance; demo 128-view adjoint is mild). Sizing vs smoke timing: Mayo 2304-view smoke was ~0.245 s/step; demo_dl is 128-view (18x fewer angles) so per-step is faster, conservatively ~0.12-0.25 s/step. Steps = warm 3x200=600 + per-image 6x400=2400 = 3000 total -> ~360-735 s wall, well under the generic claude_agentic_one_iter.sbatch 00:30:00 (1800 s) wall. outer_wall_s=1200 is a hard internal guard on the per-image loop so even worst-case steps finish under sbatch wall. Hypothesis: per-image N2I trains stably on demo_dl (finite val_score, comparison.png) and produces a usable per-scene recon; expect hr near baseline since N2I is structurally bounded by FBP on this dense-view substrate (solver_plan.md).", "comparison_image": "runs/demo-dl-claude-agentic-dual-domain-n2i-search-20260618-01/iterations/iter-0001/comparison.png"}
{"ts": "2026-05-27T13:06:22Z", "run_id": "demo-intensity-calibrated-tpe-lpd-search-20260527-01", "iter": 20, "agent": "lpd-search-tpe-calibrated", "model": "random-search", "change_class": "architecture", "status": "discard", "kept": false, "val_score": null, "headroom": 0.0, "params_M": 1.492304, "train_n": 400, "rationale": "lpd-search-tpe-calibrated: lpd_iters=8, lpd_hidden=96, lpd_n_primal=5, lpd_n_dual=5, lpd_share_weights=False, epochs=16, lr=0.00077593, lr_schedule=cosine, batch_size=1, grad_clip=1, lambda_neg=1, loss_base=mse, val_n=20, val_chunk=4", "advice_for_others": "lpd-search-tpe-calibrated: lpd_iters=8, lpd_hidden=96, lpd_n_primal=5, lpd_n_dual=5, lpd_share_weights=False, epochs=16, lr=0.00077593, lr_schedule=cosine, batch_size=1, grad_clip=1, lambda_neg=1, loss_base=mse, val_n=20, val_chunk=4 -> hr=0.0000", "comparison_image": "runs/demo-intensity-calibrated-tpe-lpd-search-20260527-01/iterations/iter-0020/comparison.png"}
{"ts": "2026-05-27T12:37:48Z", "run_id": "demo-intensity-calibrated-tpe-lpd-search-20260527-01", "iter": 19, "agent": "lpd-search-tpe-calibrated", "model": "random-search", "change_class": "architecture", "status": "discard", "kept": false, "val_score": null, "headroom": 0.0, "params_M": 0.25322, "train_n": 400, "rationale": "lpd-search-tpe-calibrated: lpd_iters=10, lpd_hidden=32, lpd_n_primal=5, lpd_n_dual=5, lpd_share_weights=False, epochs=18, lr=0.00020046, lr_schedule=cosine, batch_size=1, grad_clip=0.3, lambda_neg=1, loss_base=mse, val_n=20, val_chunk=4", "advice_for_others": "lpd-search-tpe-calibrated: lpd_iters=10, lpd_hidden=32, lpd_n_primal=5, lpd_n_dual=5, lpd_share_weights=False, epochs=18, lr=0.00020046, lr_schedule=cosine, batch_size=1, grad_clip=0.3, lambda_neg=1, loss_base=mse, val_n=20, val_chunk=4 -> hr=0.0000", "comparison_image": "runs/demo-intensity-calibrated-tpe-lpd-search-20260527-01/iterations/iter-0019/comparison.png"}
{"ts": "2026-05-27T12:15:58Z", "run_id": "demo-intensity-calibrated-tpe-lpd-search-20260527-01", "iter": 18, "agent": "lpd-search-tpe-calibrated", "model": "random-search", "change_class": "architecture", "status": "keep", "kept": true, "val_score": null, "headroom": 0.4920983859706538, "params_M": 0.414416, "train_n": 400, "rationale": "lpd-search-tpe-calibrated: lpd_iters=8, lpd_hidden=48, lpd_n_primal=5, lpd_n_dual=5, lpd_share_weights=False, epochs=19, lr=0.00046341, lr_schedule=cosine, batch_size=1, grad_clip=0.5, lambda_neg=1, loss_base=mse, val_n=20, val_chunk=4", "advice_for_others": "lpd-search-tpe-calibrated: lpd_iters=8, lpd_hidden=48, lpd_n_primal=5, lpd_n_dual=5, lpd_share_weights=False, epochs=19, lr=0.00046341, lr_schedule=cosine, batch_size=1, grad_clip=0.5, lambda_neg=1, loss_base=mse, val_n=20, val_chunk=4 -> hr=0.4921", "comparison_image": "runs/demo-intensity-calibrated-tpe-lpd-search-20260527-01/iterations/iter-0018/comparison.png"}
{"ts": "2026-05-27T11:53:43Z", "run_id": "demo-intensity-calibrated-tpe-lpd-search-20260527-01", "iter": 17, "agent": "lpd-search-tpe-calibrated", "model": "random-search", "change_class": "architecture", "status": "discard", "kept": false, "val_score": null, "headroom": 0.0, "params_M": 0.699984, "train_n": 400, "rationale": "lpd-search-tpe-calibrated: lpd_iters=8, lpd_hidden=64, lpd_n_primal=5, lpd_n_dual=5, lpd_share_weights=False, epochs=22, lr=0.00035509, lr_schedule=cosine, batch_size=1, grad_clip=0.5, lambda_neg=1, loss_base=mse, val_n=20, val_chunk=4", "advice_for_others": "lpd-search-tpe-calibrated: lpd_iters=8, lpd_hidden=64, lpd_n_primal=5, lpd_n_dual=5, lpd_share_weights=False, epochs=22, lr=0.00035509, lr_schedule=cosine, batch_size=1, grad_clip=0.5, lambda_neg=1, loss_base=mse, val_n=20, val_chunk=4 -> hr=0.0000", "comparison_image": "runs/demo-intensity-calibrated-tpe-lpd-search-20260527-01/iterations/iter-0017/comparison.png"}
{"ts": "2026-05-27T11:25:29Z", "run_id": "demo-intensity-calibrated-tpe-lpd-search-20260527-01", "iter": 16, "agent": "lpd-search-tpe-calibrated", "model": "random-search", "change_class": "architecture", "status": "discard", "kept": false, "val_score": null, "headroom": 0.0, "params_M": 1.492304, "train_n": 400, "rationale": "lpd-search-tpe-calibrated: lpd_iters=8, lpd_hidden=96, lpd_n_primal=5, lpd_n_dual=5, lpd_share_weights=False, epochs=16, lr=0.00091447, lr_schedule=cosine, batch_size=1, grad_clip=1, lambda_neg=1, loss_base=mse, val_n=20, val_chunk=4", "advice_for_others": "lpd-search-tpe-calibrated: lpd_iters=8, lpd_hidden=96, lpd_n_primal=5, lpd_n_dual=5, lpd_share_weights=False, epochs=16, lr=0.00091447, lr_schedule=cosine, batch_size=1, grad_clip=1, lambda_neg=1, loss_base=mse, val_n=20, val_chunk=4 -> hr=0.0000", "comparison_image": "runs/demo-intensity-calibrated-tpe-lpd-search-20260527-01/iterations/iter-0016/comparison.png"}
{"ts": "2026-05-27T10:56:59Z", "run_id": "demo-intensity-calibrated-tpe-lpd-search-20260527-01", "iter": 15, "agent": "lpd-search-tpe-calibrated", "model": "random-search", "change_class": "architecture", "status": "keep", "kept": true, "val_score": null, "headroom": 0.48671483613739897, "params_M": 0.202576, "train_n": 400, "rationale": "lpd-search-tpe-calibrated: lpd_iters=8, lpd_hidden=32, lpd_n_primal=5, lpd_n_dual=5, lpd_share_weights=False, epochs=19, lr=0.0002638, lr_schedule=cosine, batch_size=1, grad_clip=0.5, lambda_neg=1, loss_base=mse, val_n=20, val_chunk=4", "advice_for_others": "lpd-search-tpe-calibrated: lpd_iters=8, lpd_hidden=32, lpd_n_primal=5, lpd_n_dual=5, lpd_share_weights=False, epochs=19, lr=0.0002638, lr_schedule=cosine, batch_size=1, grad_clip=0.5, lambda_neg=1, loss_base=mse, val_n=20, val_chunk=4 -> hr=0.4867", "comparison_image": "runs/demo-intensity-calibrated-tpe-lpd-search-20260527-01/iterations/iter-0015/comparison.png"}
{"ts": "2026-05-27T10:38:25Z", "run_id": "demo-intensity-calibrated-tpe-lpd-search-20260527-01", "iter": 14, "agent": "lpd-search-tpe-calibrated", "model": "random-search", "change_class": "architecture", "status": "discard", "kept": false, "val_score": null, "headroom": 0.0, "params_M": 1.492304, "train_n": 400, "rationale": "lpd-search-tpe-calibrated: lpd_iters=8, lpd_hidden=96, lpd_n_primal=5, lpd_n_dual=5, lpd_share_weights=False, epochs=17, lr=0.00042218, lr_schedule=cosine, batch_size=1, grad_clip=0.5, lambda_neg=1, loss_base=mse, val_n=20, val_chunk=4", "advice_for_others": "lpd-search-tpe-calibrated: lpd_iters=8, lpd_hidden=96, lpd_n_primal=5, lpd_n_dual=5, lpd_share_weights=False, epochs=17, lr=0.00042218, lr_schedule=cosine, batch_size=1, grad_clip=0.5, lambda_neg=1, loss_base=mse, val_n=20, val_chunk=4 -> hr=0.0000", "comparison_image": "runs/demo-intensity-calibrated-tpe-lpd-search-20260527-01/iterations/iter-0014/comparison.png"}
{"ts": "2026-05-27T10:07:27Z", "run_id": "demo-intensity-calibrated-tpe-lpd-search-20260527-01", "iter": 13, "agent": "lpd-search-tpe-calibrated", "model": "random-search", "change_class": "architecture", "status": "keep", "kept": true, "val_score": null, "headroom": 0.491934923860346, "params_M": 0.202576, "train_n": 400, "rationale": "lpd-search-tpe-calibrated: lpd_iters=8, lpd_hidden=32, lpd_n_primal=5, lpd_n_dual=5, lpd_share_weights=False, epochs=17, lr=0.00060493, lr_schedule=cosine, batch_size=1, grad_clip=0.5, lambda_neg=1, loss_base=mse, val_n=20, val_chunk=4", "advice_for_others": "lpd-search-tpe-calibrated: lpd_iters=8, lpd_hidden=32, lpd_n_primal=5, lpd_n_dual=5, lpd_share_weights=False, epochs=17, lr=0.00060493, lr_schedule=cosine, batch_size=1, grad_clip=0.5, lambda_neg=1, loss_base=mse, val_n=20, val_chunk=4 -> hr=0.4919", "comparison_image": "runs/demo-intensity-calibrated-tpe-lpd-search-20260527-01/iterations/iter-0013/comparison.png"}
{"ts": "2026-05-27T09:50:41Z", "run_id": "demo-intensity-calibrated-tpe-lpd-search-20260527-01", "iter": 12, "agent": "lpd-search-tpe-calibrated", "model": "random-search", "change_class": "architecture", "status": "discard", "kept": false, "val_score": null, "headroom": 0.0, "params_M": 1.492304, "train_n": 400, "rationale": "lpd-search-tpe-calibrated: lpd_iters=8, lpd_hidden=96, lpd_n_primal=5, lpd_n_dual=5, lpd_share_weights=False, epochs=18, lr=0.00030069, lr_schedule=cosine, batch_size=1, grad_clip=0.5, lambda_neg=1, loss_base=mse, val_n=20, val_chunk=4", "advice_for_others": "lpd-search-tpe-calibrated: lpd_iters=8, lpd_hidden=96, lpd_n_primal=5, lpd_n_dual=5, lpd_share_weights=False, epochs=18, lr=0.00030069, lr_schedule=cosine, batch_size=1, grad_clip=0.5, lambda_neg=1, loss_base=mse, val_n=20, val_chunk=4 -> hr=0.0000", "comparison_image": "runs/demo-intensity-calibrated-tpe-lpd-search-20260527-01/iterations/iter-0012/comparison.png"}
{"ts": "2026-05-27T09:18:03Z", "run_id": "demo-intensity-calibrated-tpe-lpd-search-20260527-01", "iter": 11, "agent": "lpd-search-tpe-calibrated", "model": "random-search", "change_class": "architecture", "status": "discard", "kept": false, "val_score": null, "headroom": 0.0, "params_M": 1.86538, "train_n": 400, "rationale": "lpd-search-tpe-calibrated: lpd_iters=10, lpd_hidden=96, lpd_n_primal=5, lpd_n_dual=5, lpd_share_weights=False, epochs=22, lr=0.00021869, lr_schedule=cosine, batch_size=1, grad_clip=0.3, lambda_neg=1, loss_base=mse, val_n=20, val_chunk=4", "advice_for_others": "lpd-search-tpe-calibrated: lpd_iters=10, lpd_hidden=96, lpd_n_primal=5, lpd_n_dual=5, lpd_share_weights=False, epochs=22, lr=0.00021869, lr_schedule=cosine, batch_size=1, grad_clip=0.3, lambda_neg=1, loss_base=mse, val_n=20, val_chunk=4 -> hr=0.0000", "comparison_image": "runs/demo-intensity-calibrated-tpe-lpd-search-20260527-01/iterations/iter-0011/comparison.png"}
{"ts": "2026-05-27T08:28:11Z", "run_id": "demo-intensity-calibrated-tpe-lpd-search-20260527-01", "iter": 10, "agent": "lpd-search-tpe-calibrated", "model": "random-search", "change_class": "architecture", "status": "keep", "kept": true, "val_score": null, "headroom": 0.4947240928024762, "params_M": 1.492304, "train_n": 400, "rationale": "lpd-search-tpe-calibrated: lpd_iters=8, lpd_hidden=96, lpd_n_primal=5, lpd_n_dual=5, lpd_share_weights=False, epochs=18, lr=0.00025973, lr_schedule=cosine, batch_size=1, grad_clip=0.5, lambda_neg=1, loss_base=mse, val_n=20, val_chunk=4", "advice_for_others": "lpd-search-tpe-calibrated: lpd_iters=8, lpd_hidden=96, lpd_n_primal=5, lpd_n_dual=5, lpd_share_weights=False, epochs=18, lr=0.00025973, lr_schedule=cosine, batch_size=1, grad_clip=0.5, lambda_neg=1, loss_base=mse, val_n=20, val_chunk=4 -> hr=0.4947", "comparison_image": "runs/demo-intensity-calibrated-tpe-lpd-search-20260527-01/iterations/iter-0010/comparison.png"}
{"ts": "2026-05-27T07:55:22Z", "run_id": "demo-intensity-calibrated-tpe-lpd-search-20260527-01", "iter": 9, "agent": "lpd-search-tpe-calibrated", "model": "random-search", "change_class": "architecture", "status": "discard", "kept": false, "val_score": null, "headroom": 0.0, "params_M": 0.51802, "train_n": 400, "rationale": "lpd-search-tpe-calibrated: lpd_iters=10, lpd_hidden=48, lpd_n_primal=5, lpd_n_dual=5, lpd_share_weights=False, epochs=21, lr=0.00069008, lr_schedule=cosine, batch_size=1, grad_clip=0.5, lambda_neg=1, loss_base=mse, val_n=20, val_chunk=4", "advice_for_others": "lpd-search-tpe-calibrated: lpd_iters=10, lpd_hidden=48, lpd_n_primal=5, lpd_n_dual=5, lpd_share_weights=False, epochs=21, lr=0.00069008, lr_schedule=cosine, batch_size=1, grad_clip=0.5, lambda_neg=1, loss_base=mse, val_n=20, val_chunk=4 -> hr=0.0000", "comparison_image": "runs/demo-intensity-calibrated-tpe-lpd-search-20260527-01/iterations/iter-0009/comparison.png"}
{"ts": "2026-05-27T07:24:55Z", "run_id": "demo-intensity-calibrated-tpe-lpd-search-20260527-01", "iter": 8, "agent": "lpd-search-tpe-calibrated", "model": "random-search", "change_class": "architecture", "status": "keep", "kept": true, "val_score": null, "headroom": 0.4864527553248943, "params_M": 0.202576, "train_n": 400, "rationale": "lpd-search-tpe-calibrated: lpd_iters=8, lpd_hidden=32, lpd_n_primal=5, lpd_n_dual=5, lpd_share_weights=False, epochs=15, lr=0.0003228, lr_schedule=cosine, batch_size=1, grad_clip=0.5, lambda_neg=1, loss_base=mse, val_n=20, val_chunk=4", "advice_for_others": "lpd-search-tpe-calibrated: lpd_iters=8, lpd_hidden=32, lpd_n_primal=5, lpd_n_dual=5, lpd_share_weights=False, epochs=15, lr=0.0003228, lr_schedule=cosine, batch_size=1, grad_clip=0.5, lambda_neg=1, loss_base=mse, val_n=20, val_chunk=4 -> hr=0.4865", "comparison_image": "runs/demo-intensity-calibrated-tpe-lpd-search-20260527-01/iterations/iter-0008/comparison.png"}
{"ts": "2026-05-27T07:10:09Z", "run_id": "demo-intensity-calibrated-tpe-lpd-search-20260527-01", "iter": 7, "agent": "lpd-search-tpe-calibrated", "model": "random-search", "change_class": "architecture", "status": "keep", "kept": true, "val_score": null, "headroom": 0.493326887093575, "params_M": 0.202576, "train_n": 400, "rationale": "lpd-search-tpe-calibrated: lpd_iters=8, lpd_hidden=32, lpd_n_primal=5, lpd_n_dual=5, lpd_share_weights=False, epochs=24, lr=0.00054754, lr_schedule=cosine, batch_size=1, grad_clip=0.5, lambda_neg=1, loss_base=mse, val_n=20, val_chunk=4", "advice_for_others": "lpd-search-tpe-calibrated: lpd_iters=8, lpd_hidden=32, lpd_n_primal=5, lpd_n_dual=5, lpd_share_weights=False, epochs=24, lr=0.00054754, lr_schedule=cosine, batch_size=1, grad_clip=0.5, lambda_neg=1, loss_base=mse, val_n=20, val_chunk=4 -> hr=0.4933", "comparison_image": "runs/demo-intensity-calibrated-tpe-lpd-search-20260527-01/iterations/iter-0007/comparison.png"}
