{"ts": "2026-06-19T07:28:21Z", "run_id": "demo-dl-claude-agentic-dual-domain-n2i-search-20260618-01", "iter": 12, "agent": "dual_domain_n2i-claude-agentic-breast-ct", "model": "claude-opus-4.7-1m", "change_class": "architecture", "status": "discard", "kept": false, "val_score": 0.43054088950157166, "headroom": 0.0, "params_M": 0.465762, "train_n": 400, "rationale": "dual_domain_n2i-claude-agentic: train_n=200, val_n=12, batch_size=1, grad_clip=1.0, seed=7, warm_start=True, pretrain_epochs=12, n_iter=600, outer_wall_s=1200, lr=0.0001, unet_c=16, rationale=iter-12: ONE knob -> seed 123 -> 7, at the iter-10 val_n=12 PEAK basis (val_n=12/ep12/lr1e-4/warm_start True/n_iter600/grad_clip1.0). A THIRD-SEED AVERAGED CEILING-FINALIZATION READ (the handoff's explicit box-3 candidate: 'a third-seed/averaged read to finalize the ~0.46-0.51 ceiling estimate'). Everything else IDENTICAL to iter-10/iter-11. DIAGNOSIS (numbers, not pixels): at the val_n=12 basis the two seed reads landed seed42=0.4724 (iter-10) and seed123=0.4484 (iter-11) -> |delta|=0.024 at val_n=12, MUCH tighter than the |delta|=0.088 seed42-vs-seed123 swing at val_n=6 (iter-5 0.5081 vs iter-7 0.4203). So doubling the val scenes did cancel most per-scan init stochasticity (iter-11 hypothesis confirmed), BUT a 2-sample mean (0.4604) has an unconstrained standard error -- 'is ~0.46 the converged ceiling?' is still not finalizable from only two draws. FAILURE MODE = the 0.466 M-param U-Net OVERFITS each single noisy 128-view sparse-phantom scan (the 6-param bilateral twin physically cannot, which is why the twin clears baseline at hr+0.33 while this U-Net stays hr~0 at ~0.46-0.51 SSIM); the per-image fit has an init-driven stochastic noise floor that the wider val basis shrinks but does not eliminate. EXHAUSTED axes (do NOT retry, per handoff): n_iter (iter-2 1200 steps 0.4785->0.4293, per-scan overfit), warm_start (iter-8 off -0.0595, load-bearing-positive), lr (iter-3 1e-3->1e-4 + iter-9 1e-4->2e-4 bracket 1e-4 as optimal), pretrain_epochs (ep12 peak, ep18 worse 0.5016), unet_c (design-doc warned-against; mayo n2i c16->c32 flat). grad_clip=1.0 is LOAD-BEARING (the 128/2304-view FBP-adjoint overflow guard, mandatory) -- sweeping its VALUE is the OTHER untried candidate but LOW-VALUE/RISKY (raising it invites the adjoint overflow the guard prevents; lowering it on the twins only confirmed ceilings), so it is deliberately NOT chosen. LEVER CHOICE (box-3, genuinely untried, highest expected value toward the iter-20 CEILING-DOC mandate): SEED 123 -> 7, a THIRD independent draw at the val_n=12 peak basis. This converts the 2-sample 'ceiling estimate' into a 3-seed mean +/- std, finalizing the documented per-image U-Net N2I ceiling on this synthetic 128-view substrate exactly as the handoff requested. HYPOTHESIS: the third seed lands inside the [0.44, 0.48] band, yielding a 3-seed mean ~0.46 +/- ~0.012 -- a trustworthy, finalized ceiling read (hr~0, structurally FBP-bounded on dense 128-view phantoms). FALSIFIER: if seed=7 lands FAR outside [0.44, 0.48] (e.g. <0.42 or >0.50), the per-scan noise floor is WIDER than the iter-10/11 pair suggested and the ceiling-doc finding is 'wide intrinsic stochastic floor' rather than a tight ~0.46 -- which itself confirms the U-Net is the wrong tool here vs the bilateral twin (hr+0.33). Either branch FINALIZES the ceiling documentation. WALL: warm 12x200=2400 + per-image 12x600=7200 = 9600 steps @ ~0.083 s/step ~= 800 s (iter-10/iter-11 ran ~914 s at this exact budget), under the outer_wall_s=1200 guard and the 00:30:00 (1800 s) sbatch wall, and under the ~15-min target. All knobs IDENTICAL to iter-10/iter-11 (train_n=200, val_n=12, batch_size=1, grad_clip=1.0, warm_start=True, pretrain_epochs=12, n_iter=600, lr=1e-4, unet_c=16, outer_wall_s=1200); ONLY seed 123 -> 7 changed.", "advice_for_others": "dual_domain_n2i-claude-agentic: train_n=200, val_n=12, batch_size=1, grad_clip=1.0, seed=7, warm_start=True, pretrain_epochs=12, n_iter=600, outer_wall_s=1200, lr=0.0001, unet_c=16, rationale=iter-12: ONE knob -> seed 123 -> 7, at the iter-10 val_n=12 PEAK basis (val_n=12/ep12/lr1e-4/warm_start True/n_iter600/grad_clip1.0). A THIRD-SEED AVERAGED CEILING-FINALIZATION READ (the handoff's explicit box-3 candidate: 'a third-seed/averaged read to finalize the ~0.46-0.51 ceiling estimate'). Everything else IDENTICAL to iter-10/iter-11. DIAGNOSIS (numbers, not pixels): at the val_n=12 basis the two seed reads landed seed42=0.4724 (iter-10) and seed123=0.4484 (iter-11) -> |delta|=0.024 at val_n=12, MUCH tighter than the |delta|=0.088 seed42-vs-seed123 swing at val_n=6 (iter-5 0.5081 vs iter-7 0.4203). So doubling the val scenes did cancel most per-scan init stochasticity (iter-11 hypothesis confirmed), BUT a 2-sample mean (0.4604) has an unconstrained standard error -- 'is ~0.46 the converged ceiling?' is still not finalizable from only two draws. FAILURE MODE = the 0.466 M-param U-Net OVERFITS each single noisy 128-view sparse-phantom scan (the 6-param bilateral twin physically cannot, which is why the twin clears baseline at hr+0.33 while this U-Net stays hr~0 at ~0.46-0.51 SSIM); the per-image fit has an init-driven stochastic noise floor that the wider val basis shrinks but does not eliminate. EXHAUSTED axes (do NOT retry, per handoff): n_iter (iter-2 1200 steps 0.4785->0.4293, per-scan overfit), warm_start (iter-8 off -0.0595, load-bearing-positive), lr (iter-3 1e-3->1e-4 + iter-9 1e-4->2e-4 bracket 1e-4 as optimal), pretrain_epochs (ep12 peak, ep18 worse 0.5016), unet_c (design-doc warned-against; mayo n2i c16->c32 flat). grad_clip=1.0 is LOAD-BEARING (the 128/2304-view FBP-adjoint overflow guard, mandatory) -- sweeping its VALUE is the OTHER untried candidate but LOW-VALUE/RISKY (raising it invites the adjoint overflow the guard prevents; lowering it on the twins only confirmed ceilings), so it is deliberately NOT chosen. LEVER CHOICE (box-3, genuinely untried, highest expected value toward the iter-20 CEILING-DOC mandate): SEED 123 -> 7, a THIRD independent draw at the val_n=12 peak basis. This converts the 2-sample 'ceiling estimate' into a 3-seed mean +/- std, finalizing the documented per-image U-Net N2I ceiling on this synthetic 128-view substrate exactly as the handoff requested. HYPOTHESIS: the third seed lands inside the [0.44, 0.48] band, yielding a 3-seed mean ~0.46 +/- ~0.012 -- a trustworthy, finalized ceiling read (hr~0, structurally FBP-bounded on dense 128-view phantoms). FALSIFIER: if seed=7 lands FAR outside [0.44, 0.48] (e.g. <0.42 or >0.50), the per-scan noise floor is WIDER than the iter-10/11 pair suggested and the ceiling-doc finding is 'wide intrinsic stochastic floor' rather than a tight ~0.46 -- which itself confirms the U-Net is the wrong tool here vs the bilateral twin (hr+0.33). Either branch FINALIZES the ceiling documentation. WALL: warm 12x200=2400 + per-image 12x600=7200 = 9600 steps @ ~0.083 s/step ~= 800 s (iter-10/iter-11 ran ~914 s at this exact budget), under the outer_wall_s=1200 guard and the 00:30:00 (1800 s) sbatch wall, and under the ~15-min target. All knobs IDENTICAL to iter-10/iter-11 (train_n=200, val_n=12, batch_size=1, grad_clip=1.0, warm_start=True, pretrain_epochs=12, n_iter=600, lr=1e-4, unet_c=16, outer_wall_s=1200); ONLY seed 123 -> 7 changed.", "comparison_image": "runs/demo-dl-claude-agentic-dual-domain-n2i-search-20260618-01/iterations/iter-0012/comparison.png"}
{"ts": "2026-06-19T07:18:39Z", "run_id": "demo-dl-claude-agentic-dual-domain-bilateral-n2i-search-20260618-01", "iter": 14, "agent": "dual_domain_bilateral_n2i-claude-agentic-breast-ct", "model": "claude-opus-4.7-1m", "change_class": "architecture", "status": "keep", "kept": true, "val_score": 0.8034788966178894, "headroom": 0.3320191140179044, "params_M": 2.4e-05, "train_n": 400, "rationale": "dual_domain_bilateral_n2i-claude-agentic: train_n=200, val_n=6, batch_size=1, grad_clip=1.0, seed=42, warm_start=True, pretrain_epochs=3, n_iter=400, outer_wall_s=1200, lr=0.0023, proj_n_bf=1, img_n_bf=7, proj_kernel=7, img_kernel=5, proj_sx=1.0, proj_sy=2.0, proj_sr=0.02, img_sx=3.5, img_sy=3.5, img_sr=0.02, rationale=iter-14: ONE knob changed vs the iter-13 WIN base (image-domain SPATIAL bilateral sigma img_sx/img_sy 2.5->3.5, BOTH x and y together = the isotropic image-domain spatial-extent sigma); all 18 other fields held IDENTICAL to demo_dl_dual_domain_bilateral_n2i_iter_13.json (img_n_bf=7, img_sr=0.02 LOOSE demo-correct, proj_n_bf=1, proj_kernel=7, img_kernel=5, proj_sx/sy=1.0/2.0, proj_sr=0.02, lr=2.3e-3, warm_start=True, pretrain_epochs=3, n_iter=400, train_n=200, val_n=6, grad_clip=1.0, seed=42 -> identical seed=42 val split, directly comparable to iter-13). PUSH THE SAME WINNING LEVER FURTHER. Read iter-13 BY SSIM/HEADROOM (campaign primary; SSIM is the surface the spatial lever moved): iter-13 widened img_sx/img_sy 1.5->2.5 and LIFTED SSIM 0.7796->0.7940 (+0.0144, the run best), while hr stayed FLAT at 0.3332 (~iter-6 0.3330) -- the image-domain SPATIAL sigma is the FIRST lever in the whole run to break the SSIM plateau (img_n_bf depth had saturated SSIM growth and hr; proj domain fully inert at iter-11/12). FAILURE MODE iter-13 addressed and this iter re-probes: the 7-deep image bilateral cascade was UNDER-SMOOTHING the broad post-FBP noise floor at the default spatial sigma 1.5 -- widening the spatial neighborhood (sigma 1.5->2.5) let each of the 7 image BFs average over a larger support and smooth that broad noise floor, lifting the structural-similarity term while the LOOSE img_sr=0.02 kept it edge-preserving (no blur across phantom edges). The open question: does the image-domain spatial sigma KEEP lifting SSIM past 0.7940 as it widens further (3.5), or does it SATURATE / regress? HYPOTHESIS (img-spatial-2): widening img_sx/img_sy 2.5->3.5 enlarges the averaging support further, smoothing the residual noise floor more -> may lift SSIM above iter-13 0.7940 on the SAME seed=42 split (note whether hr moves too -- iter-13 SSIM rose but hr stayed 0.333, so the spatial lever may be an SSIM-only axis bounded by the same 64-view-FBP hr ceiling). KEY DIAGNOSTIC / RISK: img_kernel is held at 5, so the discrete bilateral WINDOW is +/-2 px. At sigma 2.5 the Gaussian spatial weight is already near-flat across that 5-px window (iter-13 noted 2.5 is near the window edge); at sigma 3.5 the spatial weight is even FLATTER -> the kernel=5 window, not the sigma, may now be the binding constraint, in which case SSIM saturates (or moves only marginally) because the BF can't actually reach the wider support the sigma requests. If SSIM SATURATES or regresses here, that pinpoints img_kernel (window SIZE) as the iter-15 lever -- widen img_kernel 5->7/9 to let the larger spatial sigma act over a genuinely larger window (the pre-registered next step from iter-13's rationale: 'img_kernel is the iter-14 candidate if img_sx/sy moves hr' -- img_sx/sy DID move SSIM, so kernel is now the live follow-on once sigma saturates). If SSIM KEEPS rising, the spatial sigma still has headroom inside the kernel=5 window and iter-15 pushes sigma further (4.5) before touching the kernel. Chose img_sx/img_sy 2.5->3.5 (the SAME winning lever, one notch further -- the steer's explicit instruction) over (a) img_kernel (the natural follow-on, but only AFTER confirming whether sigma alone saturates inside the current window -- changing kernel now would confound the sigma-saturation question), (b) proj_sr/proj_kernel/proj_n_bf (whole proj domain confirmed flat at iter-11/12 -- symmetry trap, wasted), (c) img_sr (exhausted + substrate-confirmed WRONG-direction -- tightening collapsed hr 0.3335->0.1998 at iter-4 -- FORBIDDEN, do NOT tighten; stays LOOSE 0.02), (d) img_n_bf/n_iter/pretrain_epochs/seed/val_n (all DEAD FLAT / variance-only, exhausted), (e) grad_clip (mandatory overflow guard at 1.0, not a quality lever). Held fixed at iter-13 values: img_n_bf=7, img_sr=0.02 (LOOSE, demo-correct), proj_n_bf=1, proj_kernel=7, proj_sr=0.02, img_kernel=5, proj_sx=1.0/proj_sy=2.0, lr=2.3e-3, warm_start=True, pretrain_epochs=3, n_iter=400, train_n=200, val_n=6, grad_clip=1.0, seed=42. Wall: iter-13 ran well under budget; img_sx/img_sy are pure init sigma values inside the fixed img_kernel=5 window -> ZERO added compute, wall ~unchanged, comfortably under the 1800 s sbatch wall and the 1200 s outer_wall_s internal guard (under the 15-min budget). PER-IMAGE bilateral N2I, AGENT4CT_DATASET=phantoms; warm_start STAYS ON; do NOT revert to amortized; do NOT tighten img_sr.", "advice_for_others": "dual_domain_bilateral_n2i-claude-agentic: train_n=200, val_n=6, batch_size=1, grad_clip=1.0, seed=42, warm_start=True, pretrain_epochs=3, n_iter=400, outer_wall_s=1200, lr=0.0023, proj_n_bf=1, img_n_bf=7, proj_kernel=7, img_kernel=5, proj_sx=1.0, proj_sy=2.0, proj_sr=0.02, img_sx=3.5, img_sy=3.5, img_sr=0.02, rationale=iter-14: ONE knob changed vs the iter-13 WIN base (image-domain SPATIAL bilateral sigma img_sx/img_sy 2.5->3.5, BOTH x and y together = the isotropic image-domain spatial-extent sigma); all 18 other fields held IDENTICAL to demo_dl_dual_domain_bilateral_n2i_iter_13.json (img_n_bf=7, img_sr=0.02 LOOSE demo-correct, proj_n_bf=1, proj_kernel=7, img_kernel=5, proj_sx/sy=1.0/2.0, proj_sr=0.02, lr=2.3e-3, warm_start=True, pretrain_epochs=3, n_iter=400, train_n=200, val_n=6, grad_clip=1.0, seed=42 -> identical seed=42 val split, directly comparable to iter-13). PUSH THE SAME WINNING LEVER FURTHER. Read iter-13 BY SSIM/HEADROOM (campaign primary; SSIM is the surface the spatial lever moved): iter-13 widened img_sx/img_sy 1.5->2.5 and LIFTED SSIM 0.7796->0.7940 (+0.0144, the run best), while hr stayed FLAT at 0.3332 (~iter-6 0.3330) -- the image-domain SPATIAL sigma is the FIRST lever in the whole run to break the SSIM plateau (img_n_bf depth had saturated SSIM growth and hr; proj domain fully inert at iter-11/12). FAILURE MODE iter-13 addressed and this iter re-probes: the 7-deep image bilateral cascade was UNDER-SMOOTHING the broad post-FBP noise floor at the default spatial sigma 1.5 -- widening the spatial neighborhood (sigma 1.5->2.5) let each of the 7 image BFs average over a larger support and smooth that broad noise floor, lifting the structural-similarity term while the LOOSE img_sr=0.02 kept it edge-preserving (no blur across phantom edges). The open question: does the image-domain spatial sigma KEEP lifting SSIM past 0.7940 as it widens further (3.5), or does it SATURATE / regress? HYPOTHESIS (img-spatial-2): widening img_sx/img_sy 2.5->3.5 enlarges the averaging support further, smoothing the residual noise floor more -> may lift SSIM above iter-13 0.7940 on the SAME seed=42 split (note whether hr moves too -- iter-13 SSIM rose but hr stayed 0.333, so the spatial lever may be an SSIM-only axis bounded by the same 64-view-FBP hr ceiling). KEY DIAGNOSTIC / RISK: img_kernel is held at 5, so the discrete bilateral WINDOW is +/-2 px. At sigma 2.5 the Gaussian spatial weight is already near-flat across that 5-px window (iter-13 noted 2.5 is near the window edge); at sigma 3.5 the spatial weight is even FLATTER -> the kernel=5 window, not the sigma, may now be the binding constraint, in which case SSIM saturates (or moves only marginally) because the BF can't actually reach the wider support the sigma requests. If SSIM SATURATES or regresses here, that pinpoints img_kernel (window SIZE) as the iter-15 lever -- widen img_kernel 5->7/9 to let the larger spatial sigma act over a genuinely larger window (the pre-registered next step from iter-13's rationale: 'img_kernel is the iter-14 candidate if img_sx/sy moves hr' -- img_sx/sy DID move SSIM, so kernel is now the live follow-on once sigma saturates). If SSIM KEEPS rising, the spatial sigma still has headroom inside the kernel=5 window and iter-15 pushes sigma further (4.5) before touching the kernel. Chose img_sx/img_sy 2.5->3.5 (the SAME winning lever, one notch further -- the steer's explicit instruction) over (a) img_kernel (the natural follow-on, but only AFTER confirming whether sigma alone saturates inside the current window -- changing kernel now would confound the sigma-saturation question), (b) proj_sr/proj_kernel/proj_n_bf (whole proj domain confirmed flat at iter-11/12 -- symmetry trap, wasted), (c) img_sr (exhausted + substrate-confirmed WRONG-direction -- tightening collapsed hr 0.3335->0.1998 at iter-4 -- FORBIDDEN, do NOT tighten; stays LOOSE 0.02), (d) img_n_bf/n_iter/pretrain_epochs/seed/val_n (all DEAD FLAT / variance-only, exhausted), (e) grad_clip (mandatory overflow guard at 1.0, not a quality lever). Held fixed at iter-13 values: img_n_bf=7, img_sr=0.02 (LOOSE, demo-correct), proj_n_bf=1, proj_kernel=7, proj_sr=0.02, img_kernel=5, proj_sx=1.0/proj_sy=2.0, lr=2.3e-3, warm_start=True, pretrain_epochs=3, n_iter=400, train_n=200, val_n=6, grad_clip=1.0, seed=42. Wall: iter-13 ran well under budget; img_sx/img_sy are pure init sigma values inside the fixed img_kernel=5 window -> ZERO added compute, wall ~unchanged, comfortably under the 1800 s sbatch wall and the 1200 s outer_wall_s internal guard (under the 15-min budget). PER-IMAGE bilateral N2I, AGENT4CT_DATASET=phantoms; warm_start STAYS ON; do NOT revert to amortized; do NOT tighten img_sr.", "comparison_image": "runs/demo-dl-claude-agentic-dual-domain-bilateral-n2i-search-20260618-01/iterations/iter-0014/comparison.png"}
