{"ts": "2026-06-19T06:37:31Z", "run_id": "demo-dl-claude-agentic-dual-domain-bilateral-n2i-search-20260618-01", "iter": 12, "agent": "dual_domain_bilateral_n2i-claude-agentic-breast-ct", "model": "claude-opus-4.7-1m", "change_class": "architecture", "status": "keep", "kept": true, "val_score": 0.7795776128768921, "headroom": 0.3329632558058978, "params_M": 2.4e-05, "train_n": 400, "rationale": "dual_domain_bilateral_n2i-claude-agentic: train_n=200, val_n=6, batch_size=1, grad_clip=1.0, seed=42, warm_start=True, pretrain_epochs=3, n_iter=400, outer_wall_s=1200, lr=0.0023, proj_n_bf=1, img_n_bf=7, proj_kernel=9, img_kernel=5, proj_sx=1.0, proj_sy=2.0, proj_sr=0.02, img_sx=1.5, img_sy=1.5, img_sr=0.02, rationale=iter-12: ONE knob changed vs the iter-6 hr-0.4222 PEAK base (proj_kernel 7->9, the PROJECTION-domain bilateral SPATIAL kernel size); all 18 other fields held IDENTICAL to demo_dl_dual_domain_bilateral_n2i_iter_06.json (img_n_bf=7, img_sr=0.02 LOOSE demo-correct, proj_n_bf=1, img_k=5, proj_sx/sy=1.0/2.0, proj_sr=0.02, img_sx/sy=1.5/1.5, lr=2.3e-3, warm_start=True, pretrain_epochs=3, n_iter=400, train_n=200, val_n=6, grad_clip=1.0, seed=42 -> identical seed=42 val split, directly comparable to iter-6 hr 0.3330 / PSNR 20.18 / SSIM 0.7796). BASED ON iter-6 (NOT iter-11): iter-11 proj_sr 0.02->0.05 (LOOSEN proj RANGE sigma) was DEAD FLAT -- hr 0.3330->0.33285 (-0.00015), PSNR 20.18->20.181 (identical to 3 dp), SSIM 0.7796->0.7790. So loosening the proj RANGE did NOT help; the proj-range axis is in the symmetry trap (do NOT push proj_sr further, do NOT stack proj_n_bf -- both wasted-param moves on the near-identity proj filter). Per the steer, since proj_sr was flat I base on the iter-6 hr-peak config, not the iter-11 config. FAILURE MODE at hr~0.42 (seed-123 regime) / hr~0.333 (seed-42 regime): the 6-param bilateral sits at its structural noise-floor ceiling on the 64-view (half of 128) FBP; EVERY image-side lever (img_n_bf depth saturated, n_iter flat, pretrain_epochs flat) and the proj RANGE sigma (iter-11 flat) are exhausted, and img_sr tightening is substrate-confirmed WRONG-direction (collapsed hr 0.3335->0.1998 at iter-4 -- forbidden). The ONE proj-domain axis NEVER probed at the peak is the proj SPATIAL kernel SIZE (proj_kernel). proj_sr (range) governs how much the proj BF acts across intensity jumps; proj_kernel (spatial extent) governs the neighborhood over which it averages -- a DISTINCT, orthogonal lever. The iter-11 flat-range result tested only the range axis, not the spatial-extent axis. HYPOTHESIS (proj-spatial): widening proj_kernel 7->9 enlarges the sinogram-domain averaging neighborhood, giving the single proj BF a larger spatial support to smooth correlated 64-view sinogram streak-noise BEFORE the FBP adjoint -- a denoising axis orthogonal to both the exhausted image-domain levers AND the inert proj range sigma -> may lift hr/PSNR above iter-6 ~0.333 / PSNR 20.18 on the SAME seed=42 split. If hr/PSNR stay FLAT, it CLOSES the proj-domain ceiling question: the proj stack is structurally inert on this 128-view phantom substrate on BOTH its axes (range AND spatial extent), confirming the ~hr 0.33 ceiling is image-domain-FBP-bounded -- a clean ceiling-doc result toward iter-20. Chose proj_kernel (spatial) over (a) proj_sr-further / proj_n_bf (symmetry trap -- range axis just confirmed flat at iter-11, stacking is wasted), (b) grad_clip (mandatory 2304-view-adjoint overflow guard at 1.0 -- a stability guard, not a quality lever; perturbing it risks instability with no quality-improvement story), (c) img_sr (exhausted + WRONG-direction -- forbidden), (d) img_n_bf/n_iter/pretrain_epochs (all DEAD FLAT, exhausted). proj_kernel is the last UNTOUCHED proj-domain axis and the prompt's named candidate set. Held fixed at iter-6 PEAK values: img_n_bf=7, img_sr=0.02 (LOOSE, demo-correct), proj_n_bf=1, proj_sr=0.02, img_kernel=5, proj_sx=1.0/proj_sy=2.0, img_sx=1.5/img_sy=1.5, lr=2.3e-3, warm_start=True, pretrain_epochs=3, n_iter=400, train_n=200, val_n=6, grad_clip=1.0, seed=42. Wall: iter-6 ran 828 s, iter-11 ran 330 s; a slightly larger proj kernel (7->9) adds a small per-step sinogram-conv cost only, comfortably under the 1800 s sbatch wall and the 1200 s outer_wall_s internal guard (under the 15-min budget). PER-IMAGE bilateral N2I, AGENT4CT_DATASET=phantoms; warm_start STAYS ON; do NOT revert to amortized; do NOT tighten img_sr.", "advice_for_others": "dual_domain_bilateral_n2i-claude-agentic: train_n=200, val_n=6, batch_size=1, grad_clip=1.0, seed=42, warm_start=True, pretrain_epochs=3, n_iter=400, outer_wall_s=1200, lr=0.0023, proj_n_bf=1, img_n_bf=7, proj_kernel=9, img_kernel=5, proj_sx=1.0, proj_sy=2.0, proj_sr=0.02, img_sx=1.5, img_sy=1.5, img_sr=0.02, rationale=iter-12: ONE knob changed vs the iter-6 hr-0.4222 PEAK base (proj_kernel 7->9, the PROJECTION-domain bilateral SPATIAL kernel size); all 18 other fields held IDENTICAL to demo_dl_dual_domain_bilateral_n2i_iter_06.json (img_n_bf=7, img_sr=0.02 LOOSE demo-correct, proj_n_bf=1, img_k=5, proj_sx/sy=1.0/2.0, proj_sr=0.02, img_sx/sy=1.5/1.5, lr=2.3e-3, warm_start=True, pretrain_epochs=3, n_iter=400, train_n=200, val_n=6, grad_clip=1.0, seed=42 -> identical seed=42 val split, directly comparable to iter-6 hr 0.3330 / PSNR 20.18 / SSIM 0.7796). BASED ON iter-6 (NOT iter-11): iter-11 proj_sr 0.02->0.05 (LOOSEN proj RANGE sigma) was DEAD FLAT -- hr 0.3330->0.33285 (-0.00015), PSNR 20.18->20.181 (identical to 3 dp), SSIM 0.7796->0.7790. So loosening the proj RANGE did NOT help; the proj-range axis is in the symmetry trap (do NOT push proj_sr further, do NOT stack proj_n_bf -- both wasted-param moves on the near-identity proj filter). Per the steer, since proj_sr was flat I base on the iter-6 hr-peak config, not the iter-11 config. FAILURE MODE at hr~0.42 (seed-123 regime) / hr~0.333 (seed-42 regime): the 6-param bilateral sits at its structural noise-floor ceiling on the 64-view (half of 128) FBP; EVERY image-side lever (img_n_bf depth saturated, n_iter flat, pretrain_epochs flat) and the proj RANGE sigma (iter-11 flat) are exhausted, and img_sr tightening is substrate-confirmed WRONG-direction (collapsed hr 0.3335->0.1998 at iter-4 -- forbidden). The ONE proj-domain axis NEVER probed at the peak is the proj SPATIAL kernel SIZE (proj_kernel). proj_sr (range) governs how much the proj BF acts across intensity jumps; proj_kernel (spatial extent) governs the neighborhood over which it averages -- a DISTINCT, orthogonal lever. The iter-11 flat-range result tested only the range axis, not the spatial-extent axis. HYPOTHESIS (proj-spatial): widening proj_kernel 7->9 enlarges the sinogram-domain averaging neighborhood, giving the single proj BF a larger spatial support to smooth correlated 64-view sinogram streak-noise BEFORE the FBP adjoint -- a denoising axis orthogonal to both the exhausted image-domain levers AND the inert proj range sigma -> may lift hr/PSNR above iter-6 ~0.333 / PSNR 20.18 on the SAME seed=42 split. If hr/PSNR stay FLAT, it CLOSES the proj-domain ceiling question: the proj stack is structurally inert on this 128-view phantom substrate on BOTH its axes (range AND spatial extent), confirming the ~hr 0.33 ceiling is image-domain-FBP-bounded -- a clean ceiling-doc result toward iter-20. Chose proj_kernel (spatial) over (a) proj_sr-further / proj_n_bf (symmetry trap -- range axis just confirmed flat at iter-11, stacking is wasted), (b) grad_clip (mandatory 2304-view-adjoint overflow guard at 1.0 -- a stability guard, not a quality lever; perturbing it risks instability with no quality-improvement story), (c) img_sr (exhausted + WRONG-direction -- forbidden), (d) img_n_bf/n_iter/pretrain_epochs (all DEAD FLAT, exhausted). proj_kernel is the last UNTOUCHED proj-domain axis and the prompt's named candidate set. Held fixed at iter-6 PEAK values: img_n_bf=7, img_sr=0.02 (LOOSE, demo-correct), proj_n_bf=1, proj_sr=0.02, img_kernel=5, proj_sx=1.0/proj_sy=2.0, img_sx=1.5/img_sy=1.5, lr=2.3e-3, warm_start=True, pretrain_epochs=3, n_iter=400, train_n=200, val_n=6, grad_clip=1.0, seed=42. Wall: iter-6 ran 828 s, iter-11 ran 330 s; a slightly larger proj kernel (7->9) adds a small per-step sinogram-conv cost only, comfortably under the 1800 s sbatch wall and the 1200 s outer_wall_s internal guard (under the 15-min budget). PER-IMAGE bilateral N2I, AGENT4CT_DATASET=phantoms; warm_start STAYS ON; do NOT revert to amortized; do NOT tighten img_sr.", "comparison_image": "runs/demo-dl-claude-agentic-dual-domain-bilateral-n2i-search-20260618-01/iterations/iter-0012/comparison.png"}
{"ts": "2026-06-19T06:36:35Z", "run_id": "demo-dl-claude-agentic-dual-domain-n2i-search-20260618-01", "iter": 10, "agent": "dual_domain_n2i-claude-agentic-breast-ct", "model": "claude-opus-4.7-1m", "change_class": "architecture", "status": "keep", "kept": true, "val_score": 0.4724256992340088, "headroom": 0.003803311876650728, "params_M": 0.465762, "train_n": 400, "rationale": "dual_domain_n2i-claude-agentic: train_n=200, val_n=12, batch_size=1, grad_clip=1.0, seed=42, warm_start=True, pretrain_epochs=12, n_iter=600, outer_wall_s=1200, lr=0.0001, unet_c=16, rationale=iter-10: ONE knob -> val_n 6 -> 12 (2x val scenes) at the iter-5 PEAK base (seed42/ep12/lr1e-4/warm_start True/n_iter600/grad_clip1.0, SSIM 0.5081). NOT the iter-9 lr2e-4 (dead: 0.4697 confirms 1e-4 optimal), NOT iter-8 warm_start=off (dead: 0.4486), NOT the iter-7 seed123 basin. lr RESET 2e-4 -> 1e-4 (the per-scan overfit-anchor optimum). DIAGNOSIS (numbers, not pixels): iter-8 warm_start OFF dropped 0.5081->0.4486 (-0.0595, load-bearing-positive, settled); iter-9 lr 1e-4->2e-4 dropped 0.5081->0.4697 (-0.0384 vs the ep12 peak), so 1e-4 is confirmed the per-scan step optimum at the converged init. BOTH iter-8 and iter-9 came back NEGATIVE, closing warm_start and lr as levers. FAILURE MODE = the 0.466 M-param U-Net OVERFITS each single noisy 128-view sparse-phantom scan (the 6-param bilateral twin physically cannot, which is why the twin clears baseline at hr+0.33 while this U-Net stays hr0 at ~0.51 SSIM); AND the per-image fit has a LARGE init-driven STOCHASTIC NOISE FLOOR -- a seed flip 42->123 alone swung SSIM 0.5081->0.4203 (-0.088) at the SAME ep12/lr1e-4 config (iter-5 vs iter-7). That noise floor is the real obstacle to *documenting* the ceiling: every single-val read is contaminated by per-scan stochasticity, so 'is 0.51 the converged ceiling or just one lucky/unlucky draw?' is unanswerable at val_n=6. EXHAUSTED axes (do NOT retry): n_iter (iter-2 1200 steps 0.4785->0.4293, U-Net overfits one scan), warm_start (iter-8 off -0.06), lr (iter-3 1e-3->1e-4 + iter-9 1e-4->2e-4 both bracket 1e-4 as optimal), pretrain_epochs (ep12 peak, ep18 worse 0.5016), unet_c (mayo n2i c16->c32 flat 0.9508, design-doc warned-against). grad_clip=1.0 is LOAD-BEARING (the 2304/128-view FBP-adjoint overflow guard, mandatory -- do NOT touch). LEVER CHOICE (the one genuinely-untried knob with real value -- box-3 candidate): val_n 6 -> 12, a CLEANER NOISE-FLOOR READ. Doubling the number of val scenes averages the per-scan SSIM over 2x as many independent draws, shrinking the standard error of the ceiling estimate by ~sqrt(2) and directly attacking the documented stochastic-noise-floor obstacle. This is a CEILING-DOCUMENTATION move (toward the iter-20 mandate of *documenting* why this ceiling holds), not a ceiling-raising move: I do NOT expect hr to move off ~0 (structurally FBP-bounded on dense 128-view phantoms). HYPOTHESIS: at val_n=12 the mean SSIM lands near ~0.50-0.51 (the ep12/lr1e-4 peak family) with a TIGHTER read than the noisy val_n=6 single-seed numbers, giving a more-trustworthy ~0.51 ceiling estimate for the U-Net N2I on this synthetic 128-view substrate. FALSIFIER: if the val_n=12 mean lands FAR from 0.51 (e.g. <0.46 or >0.55), the val_n=6 set was itself unrepresentative and the ceiling claim needs the wider val set as its basis going forward. NOTE: val_n changes the absolute SSIM's comparability to iters 1-9 (different/larger scene set) -- that is the POINT (a cleaner, less-noisy basis), and it is recorded here so future iters read val_n=12 numbers against THIS iter, not the val_n=6 history. WALL: warm 12x200=2400 (unchanged) + per-image 12x600=7200 = 9600 steps @ ~0.083 s/step ~= 800 s, under the outer_wall_s=1200 guard and the 00:30:00 (1800 s) sbatch wall (per_scene_s = 1200/12 = 100 s each, ample for 600 steps @ ~0.083 s/step ~= 50 s). All other knobs IDENTICAL to the iter-5 PEAK config (train_n=200, batch_size=1, grad_clip=1.0, seed=42, warm_start=True, pretrain_epochs=12, n_iter=600, lr=1e-4, unet_c=16); ONLY val_n 6 -> 12 changed.", "advice_for_others": "dual_domain_n2i-claude-agentic: train_n=200, val_n=12, batch_size=1, grad_clip=1.0, seed=42, warm_start=True, pretrain_epochs=12, n_iter=600, outer_wall_s=1200, lr=0.0001, unet_c=16, rationale=iter-10: ONE knob -> val_n 6 -> 12 (2x val scenes) at the iter-5 PEAK base (seed42/ep12/lr1e-4/warm_start True/n_iter600/grad_clip1.0, SSIM 0.5081). NOT the iter-9 lr2e-4 (dead: 0.4697 confirms 1e-4 optimal), NOT iter-8 warm_start=off (dead: 0.4486), NOT the iter-7 seed123 basin. lr RESET 2e-4 -> 1e-4 (the per-scan overfit-anchor optimum). DIAGNOSIS (numbers, not pixels): iter-8 warm_start OFF dropped 0.5081->0.4486 (-0.0595, load-bearing-positive, settled); iter-9 lr 1e-4->2e-4 dropped 0.5081->0.4697 (-0.0384 vs the ep12 peak), so 1e-4 is confirmed the per-scan step optimum at the converged init. BOTH iter-8 and iter-9 came back NEGATIVE, closing warm_start and lr as levers. FAILURE MODE = the 0.466 M-param U-Net OVERFITS each single noisy 128-view sparse-phantom scan (the 6-param bilateral twin physically cannot, which is why the twin clears baseline at hr+0.33 while this U-Net stays hr0 at ~0.51 SSIM); AND the per-image fit has a LARGE init-driven STOCHASTIC NOISE FLOOR -- a seed flip 42->123 alone swung SSIM 0.5081->0.4203 (-0.088) at the SAME ep12/lr1e-4 config (iter-5 vs iter-7). That noise floor is the real obstacle to *documenting* the ceiling: every single-val read is contaminated by per-scan stochasticity, so 'is 0.51 the converged ceiling or just one lucky/unlucky draw?' is unanswerable at val_n=6. EXHAUSTED axes (do NOT retry): n_iter (iter-2 1200 steps 0.4785->0.4293, U-Net overfits one scan), warm_start (iter-8 off -0.06), lr (iter-3 1e-3->1e-4 + iter-9 1e-4->2e-4 both bracket 1e-4 as optimal), pretrain_epochs (ep12 peak, ep18 worse 0.5016), unet_c (mayo n2i c16->c32 flat 0.9508, design-doc warned-against). grad_clip=1.0 is LOAD-BEARING (the 2304/128-view FBP-adjoint overflow guard, mandatory -- do NOT touch). LEVER CHOICE (the one genuinely-untried knob with real value -- box-3 candidate): val_n 6 -> 12, a CLEANER NOISE-FLOOR READ. Doubling the number of val scenes averages the per-scan SSIM over 2x as many independent draws, shrinking the standard error of the ceiling estimate by ~sqrt(2) and directly attacking the documented stochastic-noise-floor obstacle. This is a CEILING-DOCUMENTATION move (toward the iter-20 mandate of *documenting* why this ceiling holds), not a ceiling-raising move: I do NOT expect hr to move off ~0 (structurally FBP-bounded on dense 128-view phantoms). HYPOTHESIS: at val_n=12 the mean SSIM lands near ~0.50-0.51 (the ep12/lr1e-4 peak family) with a TIGHTER read than the noisy val_n=6 single-seed numbers, giving a more-trustworthy ~0.51 ceiling estimate for the U-Net N2I on this synthetic 128-view substrate. FALSIFIER: if the val_n=12 mean lands FAR from 0.51 (e.g. <0.46 or >0.55), the val_n=6 set was itself unrepresentative and the ceiling claim needs the wider val set as its basis going forward. NOTE: val_n changes the absolute SSIM's comparability to iters 1-9 (different/larger scene set) -- that is the POINT (a cleaner, less-noisy basis), and it is recorded here so future iters read val_n=12 numbers against THIS iter, not the val_n=6 history. WALL: warm 12x200=2400 (unchanged) + per-image 12x600=7200 = 9600 steps @ ~0.083 s/step ~= 800 s, under the outer_wall_s=1200 guard and the 00:30:00 (1800 s) sbatch wall (per_scene_s = 1200/12 = 100 s each, ample for 600 steps @ ~0.083 s/step ~= 50 s). All other knobs IDENTICAL to the iter-5 PEAK config (train_n=200, batch_size=1, grad_clip=1.0, seed=42, warm_start=True, pretrain_epochs=12, n_iter=600, lr=1e-4, unet_c=16); ONLY val_n 6 -> 12 changed.", "comparison_image": "runs/demo-dl-claude-agentic-dual-domain-n2i-search-20260618-01/iterations/iter-0010/comparison.png"}
