{"ts": "2026-06-21T13:54:33Z", "run_id": "mayo-ldct-claude-agentic-dual-domain-n2i-search-20260619-01", "iter": 9, "agent": "dual_domain_n2i-claude-agentic", "model": "claude-opus-4-8-1m", "change_class": "architecture", "status": "keep", "kept": true, "val_score": 0.9150254130363464, "headroom": 0.15041261798988292, "params_M": 0.465762, "train_n": 400, "rationale": "dual_domain_n2i-claude-agentic: warm_start=True, pretrain_epochs=4, n_iter=18, grad_clip=1.0, unet_c=16, lr=0.0003, batch_size=1, train_n=200, val_n=214, outer_wall_s=1080, per_scene_s=None, seed=123, rationale=dual_domain_n2i iter-9 (search-20260619-01, PER-IMAGE Noise2Inverse: warm-start pre-pass + per-scan Adam fit; NEVER amortized). SIX-BOX (NUMBERS, from iter-1..8). (1) TRAJECTORY all four scalar levers MAPPED, bracketed interior optima, all vs iter-4 BEST (hr 0.19761, SSIM 0.9277, PSNR 35.99, RMSE 7.934e-4): lr {1e-3 hr0/drift, 3e-4 hr0.1976 BEST, 1.5e-4 hr0.1207 iter-6} opt=3e-4; n_iter {15 hr0.1506, 18 hr0.1976 BEST, 20 hr0.1595 iter-5} opt=18; pretrain_epochs {1 hr0, 4 hr0.1976 BEST, 6 hr0.1870 iter-7} opt=4; unet_c {16 hr0.1976 BEST, 24 hr0.1236 iter-8} opt=16. warm_start=True settled-positive (cross-substrate, do NOT test off). (2) LIMITER: every scalar tuning knob is spent/wrong-signed at its bracketed optimum. The half-view info bound (the even/odd angular split discards half the 2304 Mayo views) is the leading hypothesis for the hr~0.20 cap. The even/odd split is hard-wired in geometry.py::split_angles (NOT a cfg knob -- cannot be the lever without editing a forbidden shared module). NO genuinely-untried TUNING lever remains. (3) ONE KNOB: seed 42 -> 123 (lr=3e-4, n_iter=18, pretrain_epochs=4, unet_c=16, grad_clip=1.0, warm_start=True, val_n=214, outer_wall_s=1080 ALL HELD at iter-4 BEST -> iter-4 is the clean isolated comparison, BASE_ITER=4). seed has been HELD at 42 for ALL 8 corrected-campaign iters and is the one cfg field never varied. This is the brief-sanctioned CLEAN CONFIRMATION (seed noise-floor read), NOT a tuning lever -- a seed flip cannot systematically beat the joint optimum; it reads the init-driven noise floor (campaign-state note: N2I has a large init-driven floor -- demo-n2i seed flip alone swung 0.5081->0.4203) to test whether hr 0.1976 is a robust ceiling or a lucky seed. (4) HYPOTHESIS: at the iter-4 joint optimum a seed flip 42->123 reseeds the warm-start U-Net init + per-scan Adam; expect hr WITHIN the seed noise band of 0.1976 (the warm-start anchors the basin, so the Mayo 2304-view floor should be far tighter than the demo synthetic floor). NUMERIC FALSIFIER: if hr <= 0.19761 (within noise, no systematic gain), hr 0.1976 @iter-4 is CONFIRMED as the per-image U-Net N2I half-view ceiling on dense 2304-view Mayo -- document it (NAF/ram structural-negative class) toward iter-20, no further per-image tuning. (If hr somehow > 0.1976 by > seed-noise, the iter-4 read was seed-lucky-low and the ceiling is slightly higher -- still a ceiling, just re-anchored.) (5) BUDGET (HARD 20-min compute, val=ALL 214): seed changes NO per-step cost; config == iter-4 (measured elapsed 1235.5s). Fit loop 214x18x0.2557=985s + overhead ~267s (warm-start 4ep + setup/score) = ~1252s figure-inclusive, well under the 1800s/30-min SLURM hard wall. Per-scene 4.60s < per_scene_s=1080/214=5.05s -> NO truncation, outer_wall_s stays 1080. grad_clip=1.0 mandatory (2304-view FBP adjoint overflows otherwise). val_n=214 NOT reduced (protocol). 321px detector-geometry FOV default (no fov=False). staged_canonical / v3 mayo_ldct_fitted / per-sample-ps half-angle projector swap / bg_target=truth hard-wired. PER-IMAGE structure UNCHANGED (warm-start pre-pass + per-scan fit; NEVER amortized). (6) no control return.", "advice_for_others": "dual_domain_n2i-claude-agentic: warm_start=True, pretrain_epochs=4, n_iter=18, grad_clip=1.0, unet_c=16, lr=0.0003, batch_size=1, train_n=200, val_n=214, outer_wall_s=1080, per_scene_s=None, seed=123, rationale=dual_domain_n2i iter-9 (search-20260619-01, PER-IMAGE Noise2Inverse: warm-start pre-pass + per-scan Adam fit; NEVER amortized). SIX-BOX (NUMBERS, from iter-1..8). (1) TRAJECTORY all four scalar levers MAPPED, bracketed interior optima, all vs iter-4 BEST (hr 0.19761, SSIM 0.9277, PSNR 35.99, RMSE 7.934e-4): lr {1e-3 hr0/drift, 3e-4 hr0.1976 BEST, 1.5e-4 hr0.1207 iter-6} opt=3e-4; n_iter {15 hr0.1506, 18 hr0.1976 BEST, 20 hr0.1595 iter-5} opt=18; pretrain_epochs {1 hr0, 4 hr0.1976 BEST, 6 hr0.1870 iter-7} opt=4; unet_c {16 hr0.1976 BEST, 24 hr0.1236 iter-8} opt=16. warm_start=True settled-positive (cross-substrate, do NOT test off). (2) LIMITER: every scalar tuning knob is spent/wrong-signed at its bracketed optimum. The half-view info bound (the even/odd angular split discards half the 2304 Mayo views) is the leading hypothesis for the hr~0.20 cap. The even/odd split is hard-wired in geometry.py::split_angles (NOT a cfg knob -- cannot be the lever without editing a forbidden shared module). NO genuinely-untried TUNING lever remains. (3) ONE KNOB: seed 42 -> 123 (lr=3e-4, n_iter=18, pretrain_epochs=4, unet_c=16, grad_clip=1.0, warm_start=True, val_n=214, outer_wall_s=1080 ALL HELD at iter-4 BEST -> iter-4 is the clean isolated comparison, BASE_ITER=4). seed has been HELD at 42 for ALL 8 corrected-campaign iters and is the one cfg field never varied. This is the brief-sanctioned CLEAN CONFIRMATION (seed noise-floor read), NOT a tuning lever -- a seed flip cannot systematically beat the joint optimum; it reads the init-driven noise floor (campaign-state note: N2I has a large init-driven floor -- demo-n2i seed flip alone swung 0.5081->0.4203) to test whether hr 0.1976 is a robust ceiling or a lucky seed. (4) HYPOTHESIS: at the iter-4 joint optimum a seed flip 42->123 reseeds the warm-start U-Net init + per-scan Adam; expect hr WITHIN the seed noise band of 0.1976 (the warm-start anchors the basin, so the Mayo 2304-view floor should be far tighter than the demo synthetic floor). NUMERIC FALSIFIER: if hr <= 0.19761 (within noise, no systematic gain), hr 0.1976 @iter-4 is CONFIRMED as the per-image U-Net N2I half-view ceiling on dense 2304-view Mayo -- document it (NAF/ram structural-negative class) toward iter-20, no further per-image tuning. (If hr somehow > 0.1976 by > seed-noise, the iter-4 read was seed-lucky-low and the ceiling is slightly higher -- still a ceiling, just re-anchored.) (5) BUDGET (HARD 20-min compute, val=ALL 214): seed changes NO per-step cost; config == iter-4 (measured elapsed 1235.5s). Fit loop 214x18x0.2557=985s + overhead ~267s (warm-start 4ep + setup/score) = ~1252s figure-inclusive, well under the 1800s/30-min SLURM hard wall. Per-scene 4.60s < per_scene_s=1080/214=5.05s -> NO truncation, outer_wall_s stays 1080. grad_clip=1.0 mandatory (2304-view FBP adjoint overflows otherwise). val_n=214 NOT reduced (protocol). 321px detector-geometry FOV default (no fov=False). staged_canonical / v3 mayo_ldct_fitted / per-sample-ps half-angle projector swap / bg_target=truth hard-wired. PER-IMAGE structure UNCHANGED (warm-start pre-pass + per-scan fit; NEVER amortized). (6) no control return.", "comparison_image": "runs/mayo-ldct-claude-agentic-dual-domain-n2i-search-20260619-01/iterations/iter-0009/comparison.png"}
{"ts": "2026-06-21T13:52:47Z", "run_id": "mayo-ldct-claude-agentic-hammernik-vn-search-20260619-01", "iter": 9, "agent": "hammernik_vn-claude-agentic", "model": "claude-opus-4-8-1m", "change_class": "architecture", "status": "discard", "kept": false, "val_score": 0.79317706823349, "headroom": 0.0, "params_M": 0.007298, "train_n": 400, "rationale": "hammernik_vn-claude-agentic: vn_T=2, vn_n_filters=24, vn_kernel=11, vn_n_bumps=31, vn_x_range=1.0, vn_lambda_init=0.0023, vn_init=fbp, vn_dc_norm=True, vn_checkpoint=True, vn_normalize_filters=False, epochs=6, batch_size=2, lr=0.0005, grad_clip=1.0, train_n=480, val_n=214, max_train_s=1000, seed=42, rationale=hammernik_vn iter-9 (search-20260619-01, corrected 214-slice/321px-FOV metric). ONE KNOB (CAPACITY re-probe at the now-WORKING shallow depth): vn_n_filters 16 -> 24. BASE = iter-7 (the BREAKOUT + run-BEST: vn_T=2, vn_n_filters=16, vn_lambda_init=0.0023, vn_normalize_filters=False, train_n=480, lr=5e-4, batch_size=2, vn_checkpoint=true, grad_clip=1.0, vn_dc_norm=true, vn_init=fbp). DEPTH IS NOW SETTLED: iter-7 vn_T 5->2 BROKE OUT to SSIM 0.86068 hr 0.154039 (#8 on board); iter-8 vn_T 2->1 REGRESSED to SSIM 0.84581 hr 0.11827 (a single DC step under-powers) -> vn_T=2 IS the unroll-depth optimum (T=8 crashed to 0.667, T=1 under-powers, T=2 wins). KEEP vn_T=2. TRAJECTORY (NUMBERS): iter-1 SSIM 0.80528 (vn_T=5,N_k=16,lam=0.0023,hr0); iter-2 SSIM 0.79195 (N_k 16->24 capacity^ REGRESSED -0.0133, hr0); iter-3 SSIM 0.76820 (lam^ REGRESSED, hr0); iter-4 SSIM 0.73363 (normalize_filters T REGRESSED, hr0); iter-5 SSIM 0.80886 (train_n 200->480 +0.0036, hr0); iter-6 SSIM 0.66729 (vn_T 5->8 REGRESSED -0.142, hr0); iter-7 SSIM 0.86068 hr 0.154039 PSNR 35.53 elapsed 971.2s (vn_T 5->2 BREAKOUT) <- BEST, current N_k=16, train_n=480; iter-8 SSIM 0.84581 hr 0.11827 elapsed 452.3s (vn_T 2->1 REGRESSED). LIMITER / KEY INSIGHT: capacity (vn_n_filters^) AND data (train_n^) were BOTH falsified at the OLD noisy OVER-UNROLLED vn_T=5 regime and have NEVER been tested at the now-working shallow vn_T=2 depth -- the iter-8 falsifier explicitly flagged this as the next move. CHOICE OF KNOB (capacity over data, from NUMBERS): at vn_T=5 vn_n_filters 16->24 REGRESSED -0.0133 (iter-2) while train_n 200->480 gave only +0.0036 (iter-5, near-saturated at 480/579). At vn_T=5 the learned regulariser was a BLUNT over-smoother re-injected 5x via the in-loop projector DC step, so MORE filters made the smoother WORSE; at the clean vn_T=2 denoiser-dominant regime the recon is no longer smoother-bound, so a richer 24-filter bank has headroom to express an EDGE-PRESERVING regulariser instead of collapsing to smoothing. train_n is already near data-saturation (480/579, +0.0036 at full) so capacity is the higher-value re-probe. KEEP train_n=480. MECHANISM: vn_n_filters 16->24 (the solver default capacity) gives the learned filter bank K_i more degrees of freedom; at the working shallow depth where the denoiser shows through, the extra filters can preserve structure/contrast rather than the DC-smoothing they collapsed to at vn_T=5. HYPOTHESIS: with 24 filters at the working vn_T=2 depth, val_ssim rises above the iter-7 BEST 0.86068 and hr clears 0.154039 (the capacity lever falsified-at-vn_T=5 now helps at the shallow depth). FALSIFIER (numeric): if val_ssim <= 0.86068 / hr <= 0.154039 at vn_T=2 with 24 filters, capacity does NOT transfer to the shallow regime either -- 16 filters is the optimum at all depths -- and iter-10 should re-probe the LAST untested data lever (train_n 480->579, full pool) at vn_T=2. BUDGET (HARD 20-min/1200s train+score; sbatch --time=00:30:00): vn_n_filters 16->24 = ~1.4x per-step RBF/conv cost; iter-7 ran 971.2s total at N_k=16/vn_T=2/train_n=480, so max_train_s=1000 still BINDS the train wall (fewer epochs fit but still past the ep3 convergence point -> fair converged comparison; cf. iter-2 ran N_k=24 fine at 1351s). val_n=214 kept. Total ~= 1000 (train wall) + ~160 (score 214 + figure) ~= 1160s, under the 1800s SLURM kill (>600s margin). MEMORY-SAFE: vn_T=2 x N_k=24 with batch_size=2 + vn_checkpoint=true stays within the 16 GB RTX5000 (iter-2/3/4 all ran N_k=24 at vn_T=5 with no OOM; vn_T=2 is a LIGHTER footprint -- fewer unrolled steps -> less activation memory; far from the hammernik_2017 bs=4 OOM at 72s). grad_clip=1.0 + vn_dc_norm=true retained (VN-family NaN-skip stability; the 2304-view Mayo FBP adjoint overflows the backward otherwise).", "advice_for_others": "hammernik_vn-claude-agentic: vn_T=2, vn_n_filters=24, vn_kernel=11, vn_n_bumps=31, vn_x_range=1.0, vn_lambda_init=0.0023, vn_init=fbp, vn_dc_norm=True, vn_checkpoint=True, vn_normalize_filters=False, epochs=6, batch_size=2, lr=0.0005, grad_clip=1.0, train_n=480, val_n=214, max_train_s=1000, seed=42, rationale=hammernik_vn iter-9 (search-20260619-01, corrected 214-slice/321px-FOV metric). ONE KNOB (CAPACITY re-probe at the now-WORKING shallow depth): vn_n_filters 16 -> 24. BASE = iter-7 (the BREAKOUT + run-BEST: vn_T=2, vn_n_filters=16, vn_lambda_init=0.0023, vn_normalize_filters=False, train_n=480, lr=5e-4, batch_size=2, vn_checkpoint=true, grad_clip=1.0, vn_dc_norm=true, vn_init=fbp). DEPTH IS NOW SETTLED: iter-7 vn_T 5->2 BROKE OUT to SSIM 0.86068 hr 0.154039 (#8 on board); iter-8 vn_T 2->1 REGRESSED to SSIM 0.84581 hr 0.11827 (a single DC step under-powers) -> vn_T=2 IS the unroll-depth optimum (T=8 crashed to 0.667, T=1 under-powers, T=2 wins). KEEP vn_T=2. TRAJECTORY (NUMBERS): iter-1 SSIM 0.80528 (vn_T=5,N_k=16,lam=0.0023,hr0); iter-2 SSIM 0.79195 (N_k 16->24 capacity^ REGRESSED -0.0133, hr0); iter-3 SSIM 0.76820 (lam^ REGRESSED, hr0); iter-4 SSIM 0.73363 (normalize_filters T REGRESSED, hr0); iter-5 SSIM 0.80886 (train_n 200->480 +0.0036, hr0); iter-6 SSIM 0.66729 (vn_T 5->8 REGRESSED -0.142, hr0); iter-7 SSIM 0.86068 hr 0.154039 PSNR 35.53 elapsed 971.2s (vn_T 5->2 BREAKOUT) <- BEST, current N_k=16, train_n=480; iter-8 SSIM 0.84581 hr 0.11827 elapsed 452.3s (vn_T 2->1 REGRESSED). LIMITER / KEY INSIGHT: capacity (vn_n_filters^) AND data (train_n^) were BOTH falsified at the OLD noisy OVER-UNROLLED vn_T=5 regime and have NEVER been tested at the now-working shallow vn_T=2 depth -- the iter-8 falsifier explicitly flagged this as the next move. CHOICE OF KNOB (capacity over data, from NUMBERS): at vn_T=5 vn_n_filters 16->24 REGRESSED -0.0133 (iter-2) while train_n 200->480 gave only +0.0036 (iter-5, near-saturated at 480/579). At vn_T=5 the learned regulariser was a BLUNT over-smoother re-injected 5x via the in-loop projector DC step, so MORE filters made the smoother WORSE; at the clean vn_T=2 denoiser-dominant regime the recon is no longer smoother-bound, so a richer 24-filter bank has headroom to express an EDGE-PRESERVING regulariser instead of collapsing to smoothing. train_n is already near data-saturation (480/579, +0.0036 at full) so capacity is the higher-value re-probe. KEEP train_n=480. MECHANISM: vn_n_filters 16->24 (the solver default capacity) gives the learned filter bank K_i more degrees of freedom; at the working shallow depth where the denoiser shows through, the extra filters can preserve structure/contrast rather than the DC-smoothing they collapsed to at vn_T=5. HYPOTHESIS: with 24 filters at the working vn_T=2 depth, val_ssim rises above the iter-7 BEST 0.86068 and hr clears 0.154039 (the capacity lever falsified-at-vn_T=5 now helps at the shallow depth). FALSIFIER (numeric): if val_ssim <= 0.86068 / hr <= 0.154039 at vn_T=2 with 24 filters, capacity does NOT transfer to the shallow regime either -- 16 filters is the optimum at all depths -- and iter-10 should re-probe the LAST untested data lever (train_n 480->579, full pool) at vn_T=2. BUDGET (HARD 20-min/1200s train+score; sbatch --time=00:30:00): vn_n_filters 16->24 = ~1.4x per-step RBF/conv cost; iter-7 ran 971.2s total at N_k=16/vn_T=2/train_n=480, so max_train_s=1000 still BINDS the train wall (fewer epochs fit but still past the ep3 convergence point -> fair converged comparison; cf. iter-2 ran N_k=24 fine at 1351s). val_n=214 kept. Total ~= 1000 (train wall) + ~160 (score 214 + figure) ~= 1160s, under the 1800s SLURM kill (>600s margin). MEMORY-SAFE: vn_T=2 x N_k=24 with batch_size=2 + vn_checkpoint=true stays within the 16 GB RTX5000 (iter-2/3/4 all ran N_k=24 at vn_T=5 with no OOM; vn_T=2 is a LIGHTER footprint -- fewer unrolled steps -> less activation memory; far from the hammernik_2017 bs=4 OOM at 72s). grad_clip=1.0 + vn_dc_norm=true retained (VN-family NaN-skip stability; the 2304-view Mayo FBP adjoint overflows the backward otherwise).", "comparison_image": "runs/mayo-ldct-claude-agentic-hammernik-vn-search-20260619-01/iterations/iter-0009/comparison.png"}
