{"ts": "2026-06-20T00:45:57Z", "run_id": "mayo-ldct-claude-agentic-dual-domain-n2i-search-20260619-01", "iter": 3, "agent": "dual_domain_n2i-claude-agentic", "model": "claude-opus-4-8-1m", "change_class": "architecture", "status": "keep", "kept": true, "val_score": 0.9184581637382507, "headroom": 0.15056939033747796, "params_M": 0.465762, "train_n": 400, "rationale": "dual_domain_n2i-claude-agentic: warm_start=True, pretrain_epochs=4, n_iter=15, grad_clip=1.0, unet_c=16, lr=0.0003, batch_size=1, train_n=200, val_n=214, outer_wall_s=1080, per_scene_s=None, seed=42, rationale=dual_domain_n2i iter-3 (search-20260619-01, PER-IMAGE Noise2Inverse: warm-start pre-pass + per-scan Adam fit; NEVER amortized). SIX-BOX (NUMBERS). (1) TRAJECTORY: iter-1 (pretrain_epochs=1, n_iter=15, lr=1e-3) SSIM 0.8622, hr 0, PSNR 33.07, RMSE 1.11e-3, elapsed 972.0s (16.2 min), per-scan 0.264 s/step (214x15 in 846.9s). iter-2 (pretrain_epochs 1->4, lr=1e-3) SSIM 0.8681 (+0.0059), hr 0, PSNR 32.43 (DOWN 0.64), RMSE 1.195e-3 (UP), elapsed 1112.3s (18.5 min). (2) LIMITER (iter-2 falsifier TRIGGERED on the RMSE axis): deepening the warm-start RAISED SSIM but LOWERED PSNR and RAISED RMSE -> the recon moved FURTHER below the 34.08 FBP baseline on the headroom-relevant (RMSE) metric. The SSIM rise is the bilateral-class smoothing artifact (SSIM rewards the smoother deeper denoiser; the calibrated RMSE-sensitive headroom metric does not). So warm-start DEPTH is NOT the binding constraint and is wrong-signed for headroom. The campaign-wide N2I finding fits: the per-scan U-Net fit DRIFTS AWAY from the FBP-consistent solution; the SETTLED lever (confirmed on all 3 datasets) is per-scan lr-DOWN to anchor near the (FBP-quality) warm-start init. mayo-n2i specifically: lr 1e-3->3e-4 gave 0.9508->0.9541 in the discarded run. (3) ONE KNOB: lr 1e-3 -> 3e-4 (pretrain_epochs=4, n_iter=15, grad_clip=1.0, unet_c=16, val_n=214, seed=42 ALL HELD at iter-2 values -> iter-2 is the clean comparison point, lr isolated). Why lr-down and not pretrain_epochs/n_iter: pretrain_epochs-up was JUST FALSIFIED (PSNR fell); n_iter is budget-HARD-CAPPED (846.9s fit leaves no room to raise from 15); lr-down is the ONE settled, correctly-signed, in-budget, free (no per-step cost change) lever per the cross-substrate N2I knob insight. (4) HYPOTHESIS: lr 1e-3->3e-4 lifts PSNR above iter-2's 32.43 (ideally above the 34.08 FBP baseline -> hr>0) because the smaller per-scan step anchors the 15-step fit nearer the FBP-consistent warm-start init instead of drifting off it. FALSIFIER: if PSNR <= 32.43 (no RMSE gain), per-image U-Net N2I is structurally FBP-bounded on dense 2304-view Mayo (half-view info loss > the per-image denoising gain) -> iter-3 is the structural-floor datapoint (NAF/ram class) and further per-image tuning is futile; document the ceiling. (5) BUDGET (HARD 20-min, val=ALL 214): lr does NOT change per-step cost, so iter-3 timing == iter-2: warm-start 4 ep x ~50s = 200s + fit loop 214x15x0.264 = 846.9s + setup/score/figure ~75s = 1121.9s = 18.7 min < 1200s (20-min hard wall, ~78s margin). 214*15 per-scan steps confirmed in-budget (measured at iter-1/iter-2). outer_wall_s=1080 in-solver backstop UNCHANGED. n_iter NOT raised (budget-capped). val_n=214 NOT reduced (protocol). PER-IMAGE structure UNCHANGED. (6) no control return.", "advice_for_others": "dual_domain_n2i-claude-agentic: warm_start=True, pretrain_epochs=4, n_iter=15, grad_clip=1.0, unet_c=16, lr=0.0003, batch_size=1, train_n=200, val_n=214, outer_wall_s=1080, per_scene_s=None, seed=42, rationale=dual_domain_n2i iter-3 (search-20260619-01, PER-IMAGE Noise2Inverse: warm-start pre-pass + per-scan Adam fit; NEVER amortized). SIX-BOX (NUMBERS). (1) TRAJECTORY: iter-1 (pretrain_epochs=1, n_iter=15, lr=1e-3) SSIM 0.8622, hr 0, PSNR 33.07, RMSE 1.11e-3, elapsed 972.0s (16.2 min), per-scan 0.264 s/step (214x15 in 846.9s). iter-2 (pretrain_epochs 1->4, lr=1e-3) SSIM 0.8681 (+0.0059), hr 0, PSNR 32.43 (DOWN 0.64), RMSE 1.195e-3 (UP), elapsed 1112.3s (18.5 min). (2) LIMITER (iter-2 falsifier TRIGGERED on the RMSE axis): deepening the warm-start RAISED SSIM but LOWERED PSNR and RAISED RMSE -> the recon moved FURTHER below the 34.08 FBP baseline on the headroom-relevant (RMSE) metric. The SSIM rise is the bilateral-class smoothing artifact (SSIM rewards the smoother deeper denoiser; the calibrated RMSE-sensitive headroom metric does not). So warm-start DEPTH is NOT the binding constraint and is wrong-signed for headroom. The campaign-wide N2I finding fits: the per-scan U-Net fit DRIFTS AWAY from the FBP-consistent solution; the SETTLED lever (confirmed on all 3 datasets) is per-scan lr-DOWN to anchor near the (FBP-quality) warm-start init. mayo-n2i specifically: lr 1e-3->3e-4 gave 0.9508->0.9541 in the discarded run. (3) ONE KNOB: lr 1e-3 -> 3e-4 (pretrain_epochs=4, n_iter=15, grad_clip=1.0, unet_c=16, val_n=214, seed=42 ALL HELD at iter-2 values -> iter-2 is the clean comparison point, lr isolated). Why lr-down and not pretrain_epochs/n_iter: pretrain_epochs-up was JUST FALSIFIED (PSNR fell); n_iter is budget-HARD-CAPPED (846.9s fit leaves no room to raise from 15); lr-down is the ONE settled, correctly-signed, in-budget, free (no per-step cost change) lever per the cross-substrate N2I knob insight. (4) HYPOTHESIS: lr 1e-3->3e-4 lifts PSNR above iter-2's 32.43 (ideally above the 34.08 FBP baseline -> hr>0) because the smaller per-scan step anchors the 15-step fit nearer the FBP-consistent warm-start init instead of drifting off it. FALSIFIER: if PSNR <= 32.43 (no RMSE gain), per-image U-Net N2I is structurally FBP-bounded on dense 2304-view Mayo (half-view info loss > the per-image denoising gain) -> iter-3 is the structural-floor datapoint (NAF/ram class) and further per-image tuning is futile; document the ceiling. (5) BUDGET (HARD 20-min, val=ALL 214): lr does NOT change per-step cost, so iter-3 timing == iter-2: warm-start 4 ep x ~50s = 200s + fit loop 214x15x0.264 = 846.9s + setup/score/figure ~75s = 1121.9s = 18.7 min < 1200s (20-min hard wall, ~78s margin). 214*15 per-scan steps confirmed in-budget (measured at iter-1/iter-2). outer_wall_s=1080 in-solver backstop UNCHANGED. n_iter NOT raised (budget-capped). val_n=214 NOT reduced (protocol). PER-IMAGE structure UNCHANGED. (6) no control return.", "comparison_image": "runs/mayo-ldct-claude-agentic-dual-domain-n2i-search-20260619-01/iterations/iter-0003/comparison.png"}
{"ts": "2026-06-20T00:44:20Z", "run_id": "mayo-ldct-claude-agentic-ram-search-20260619-01", "iter": 3, "agent": "ram_zeroshot-claude-agentic", "model": "claude-opus-4-8-1m", "change_class": "architecture", "status": "discard", "kept": false, "val_score": 0.8967949151992798, "headroom": 0.0, "params_M": 35.618953, "train_n": 400, "rationale": "ram_zeroshot-claude-agentic: ram_ckpt_path=/cluster/maier/Agent4CT/checkpoints/ram.pth.tar, ram_input_norm=adjoint_max, ram_clamp_output=True, ram_finetune=False, ram_finetune_epochs=0, ram_finetune_lr=0.0001, ram_disable_multiscale=True, ram_disable_cudnn=False, ram_use_deepinv_tomo=False, ram_sigma=0.005, ram_factor=0.2, ram_post_fbp_blend=0.3, val_n=214, rationale=iter-3 (search-20260619-01, corrected protocol): ONE knob ram_factor 0.55->0.2 (all else at the iter-1 point: ram_post_fbp_blend BACK to 0.3, ram_sigma=0.005, adjoint_max norm, multiscale disabled, finetune OFF). Trajectory: iter-1 SSIM 0.8611 hr 0.0 (blend 0.3, factor 0.55); iter-2 SSIM 0.8644 hr EXACTLY 0.0 (blend 0.3->0.5) -- the FBP/RAM blend coefficient is EXHAUSTED: raising the FBP fraction lifted raw SSIM marginally (+0.003) but did NOT move calibrated headroom off 0.0, so on the RMSE-sensitive metric RAM is at/below the LD-FBP floor (baseline 0.8078, oracle HD-FBP 0.9331) regardless of blend. Failure mode: RAM is a pretrained zero-shot deepinv recon that never saw real LDCT helical-rebinned fan data; its denoiser adds no recoverable signal over FBP on dense (2304-view) rebinned Mayo -> FBP-bounded. ONE knob NOT yet probed = ram_factor (physics.factor, solver_ram.py L348), the operator-gain used in RAM's prox_l2 data-consistency realign step (L20: 0 = skip prox_l2). It is the most DIAGNOSTIC remaining RAM hyperparameter: blend mixes FBP vs RAM linearly AFTER inference, whereas ram_factor changes RAM's INTERNAL DC step -- the actual mechanism by which RAM is supposed to add signal over its FBP init. Lower it 0.55->0.2 (toward the skip-prox_l2 limit) to isolate whether weakening RAM's DC realign moves the metric at all. Hypothesis: RAM is structurally FBP-bounded on dense Mayo -- the prox_l2 strength does not matter because RAM's prior carries no LDCT-specific signal. Falsifier: if hr at ram_factor=0.2 != 0.0 (rises OR drops), RAM's internal DC step DOES matter and RAM is not purely FBP-bounded; if hr stays flat at 0.0 across both the post-hoc blend (iter-2) AND the internal prox_l2 gain (iter-3), RAM is CONFIRMED structurally FBP-bounded on dense Mayo -> FILE NEGATIVE RESULT, STOP iterating this solver. Budget: only a scalar physics.factor changes -> zero added compute vs iter-2 (which ran 1100.9 s = 18.3 min for 214 single forward passes + one op-norm power iter), inside the HARD 20-min train+score budget; sbatch --time=00:30:00 backstop wall. val_n stays 214 (score ALL L277 slices @ 321px detector-geometry FOV). HARD-WIRED: staged_canonical, v3 mayo_ldct_fitted, per-sample-ps, bg_target=truth, 321px FOV default.", "advice_for_others": "ram_zeroshot-claude-agentic: ram_ckpt_path=/cluster/maier/Agent4CT/checkpoints/ram.pth.tar, ram_input_norm=adjoint_max, ram_clamp_output=True, ram_finetune=False, ram_finetune_epochs=0, ram_finetune_lr=0.0001, ram_disable_multiscale=True, ram_disable_cudnn=False, ram_use_deepinv_tomo=False, ram_sigma=0.005, ram_factor=0.2, ram_post_fbp_blend=0.3, val_n=214, rationale=iter-3 (search-20260619-01, corrected protocol): ONE knob ram_factor 0.55->0.2 (all else at the iter-1 point: ram_post_fbp_blend BACK to 0.3, ram_sigma=0.005, adjoint_max norm, multiscale disabled, finetune OFF). Trajectory: iter-1 SSIM 0.8611 hr 0.0 (blend 0.3, factor 0.55); iter-2 SSIM 0.8644 hr EXACTLY 0.0 (blend 0.3->0.5) -- the FBP/RAM blend coefficient is EXHAUSTED: raising the FBP fraction lifted raw SSIM marginally (+0.003) but did NOT move calibrated headroom off 0.0, so on the RMSE-sensitive metric RAM is at/below the LD-FBP floor (baseline 0.8078, oracle HD-FBP 0.9331) regardless of blend. Failure mode: RAM is a pretrained zero-shot deepinv recon that never saw real LDCT helical-rebinned fan data; its denoiser adds no recoverable signal over FBP on dense (2304-view) rebinned Mayo -> FBP-bounded. ONE knob NOT yet probed = ram_factor (physics.factor, solver_ram.py L348), the operator-gain used in RAM's prox_l2 data-consistency realign step (L20: 0 = skip prox_l2). It is the most DIAGNOSTIC remaining RAM hyperparameter: blend mixes FBP vs RAM linearly AFTER inference, whereas ram_factor changes RAM's INTERNAL DC step -- the actual mechanism by which RAM is supposed to add signal over its FBP init. Lower it 0.55->0.2 (toward the skip-prox_l2 limit) to isolate whether weakening RAM's DC realign moves the metric at all. Hypothesis: RAM is structurally FBP-bounded on dense Mayo -- the prox_l2 strength does not matter because RAM's prior carries no LDCT-specific signal. Falsifier: if hr at ram_factor=0.2 != 0.0 (rises OR drops), RAM's internal DC step DOES matter and RAM is not purely FBP-bounded; if hr stays flat at 0.0 across both the post-hoc blend (iter-2) AND the internal prox_l2 gain (iter-3), RAM is CONFIRMED structurally FBP-bounded on dense Mayo -> FILE NEGATIVE RESULT, STOP iterating this solver. Budget: only a scalar physics.factor changes -> zero added compute vs iter-2 (which ran 1100.9 s = 18.3 min for 214 single forward passes + one op-norm power iter), inside the HARD 20-min train+score budget; sbatch --time=00:30:00 backstop wall. val_n stays 214 (score ALL L277 slices @ 321px detector-geometry FOV). HARD-WIRED: staged_canonical, v3 mayo_ldct_fitted, per-sample-ps, bg_target=truth, 321px FOV default.", "comparison_image": "runs/mayo-ldct-claude-agentic-ram-search-20260619-01/iterations/iter-0003/comparison.png"}
{"ts": "2026-06-20T00:16:29Z", "run_id": "mayo-ldct-claude-agentic-tv-iterative-search-20260619-01", "iter": 3, "agent": "tv_iterative-claude-agentic", "model": "claude-opus-4-8-1m", "change_class": "architecture", "status": "keep", "kept": true, "val_score": 0.9199839234352112, "headroom": 0.1366356077274462, "params_M": 0.0, "train_n": 400, "rationale": "tv_iterative-claude-agentic: val_n=214, train_n=0, tv_lambda=0.003, tv_iterations=120, tv_lr=0.01, tv_clip_max=0.08, tv_decay=0.01, tv_optimizer=gd, tv_init=fbp, rationale=tv_iterative iter-3 (search-20260619-01, corrected 214-slice/321px-FOV metric). ONE KNOB: tv_lambda 0.001->0.003 (all else held IDENTICAL to iter-2: tv_iterations=120, tv_lr=0.01, tv_clip_max=0.08, tv_decay=0.01, gd, fbp-init, val_n=214). NUMBERS: iter-1 SSIM 0.922979 hr 0.132941 RMSE 8.573e-4 (clip 0.05); iter-2 SSIM 0.923844 hr 0.205364 RMSE 7.857e-4 (clip 0.05->0.08) elapsed 928s. Trajectory: the clip bump moved hr +0.072 (0.133->0.205) and dropped RMSE 8.3% by un-truncating high-mu bone -- the clamp WAS the binding constraint (iter-2 falsifier 'hr<=0.133' NOT triggered). iter-2 clip_max=0.08 is now at the TOP of the solver search bound [0.03,0.08] so clip is exhausted as a lever. tv_lambda has been FROZEN at the solver default 0.001 for BOTH prior iters -- never probed -- and is the highest-value untouched knob (the classical data-vs-smoothness balance). FAILURE MODE: Mayo is real LOW-DOSE CT where the dominant error is photon/electronic noise, not under-sampling (2304 views is dense). At lambda=0.001 the data term dominates: SSIM barely moves between iters (recon is data-fit-dominated, leaving the LDCT noise floor in), and the iter-1->2 headroom gain came PURELY from un-truncating bone (clip), NOT from denoising. The regularizer is currently too WEAK to suppress LDCT noise. HYPOTHESIS: raising tv_lambda 0.001->0.003 strengthens the TV denoiser, suppressing residual LDCT noise so val_rmse drops below 7.857e-4 and hr rises above 0.205364; the RMSE-sensitive calibrated-headroom metric credits the lower noise floor. 3x is a bounded probe inside [0.0001,0.01] -- large enough to move the needle, small enough not to over-smooth in one shot. FALSIFIER: if hr <= 0.205 (no gain or regression) either side of lambda=0.003, TV is AT its regularization ceiling on Mayo (lambda=0.001 was already near-optimal) -- the lever is exhausted and the next probe would be tv_lr/tv_iterations for finer convergence, or accept ~0.92 SSIM / ~0.20 hr as the structural TV ceiling on real Mayo LDCT. BUDGET: tv_lambda is a ZERO marginal-compute knob -- identical iteration count (120) -> identical ~928s wall, ~272s margin under the 1200s hard 20-min budget preserved. tv_iterations deliberately NOT raised: iter-2 used 928/1200s, and lambda is the higher-value probe per the mandate. val = ALL 214 L277 slices unchanged.", "advice_for_others": "tv_iterative-claude-agentic: val_n=214, train_n=0, tv_lambda=0.003, tv_iterations=120, tv_lr=0.01, tv_clip_max=0.08, tv_decay=0.01, tv_optimizer=gd, tv_init=fbp, rationale=tv_iterative iter-3 (search-20260619-01, corrected 214-slice/321px-FOV metric). ONE KNOB: tv_lambda 0.001->0.003 (all else held IDENTICAL to iter-2: tv_iterations=120, tv_lr=0.01, tv_clip_max=0.08, tv_decay=0.01, gd, fbp-init, val_n=214). NUMBERS: iter-1 SSIM 0.922979 hr 0.132941 RMSE 8.573e-4 (clip 0.05); iter-2 SSIM 0.923844 hr 0.205364 RMSE 7.857e-4 (clip 0.05->0.08) elapsed 928s. Trajectory: the clip bump moved hr +0.072 (0.133->0.205) and dropped RMSE 8.3% by un-truncating high-mu bone -- the clamp WAS the binding constraint (iter-2 falsifier 'hr<=0.133' NOT triggered). iter-2 clip_max=0.08 is now at the TOP of the solver search bound [0.03,0.08] so clip is exhausted as a lever. tv_lambda has been FROZEN at the solver default 0.001 for BOTH prior iters -- never probed -- and is the highest-value untouched knob (the classical data-vs-smoothness balance). FAILURE MODE: Mayo is real LOW-DOSE CT where the dominant error is photon/electronic noise, not under-sampling (2304 views is dense). At lambda=0.001 the data term dominates: SSIM barely moves between iters (recon is data-fit-dominated, leaving the LDCT noise floor in), and the iter-1->2 headroom gain came PURELY from un-truncating bone (clip), NOT from denoising. The regularizer is currently too WEAK to suppress LDCT noise. HYPOTHESIS: raising tv_lambda 0.001->0.003 strengthens the TV denoiser, suppressing residual LDCT noise so val_rmse drops below 7.857e-4 and hr rises above 0.205364; the RMSE-sensitive calibrated-headroom metric credits the lower noise floor. 3x is a bounded probe inside [0.0001,0.01] -- large enough to move the needle, small enough not to over-smooth in one shot. FALSIFIER: if hr <= 0.205 (no gain or regression) either side of lambda=0.003, TV is AT its regularization ceiling on Mayo (lambda=0.001 was already near-optimal) -- the lever is exhausted and the next probe would be tv_lr/tv_iterations for finer convergence, or accept ~0.92 SSIM / ~0.20 hr as the structural TV ceiling on real Mayo LDCT. BUDGET: tv_lambda is a ZERO marginal-compute knob -- identical iteration count (120) -> identical ~928s wall, ~272s margin under the 1200s hard 20-min budget preserved. tv_iterations deliberately NOT raised: iter-2 used 928/1200s, and lambda is the higher-value probe per the mandate. val = ALL 214 L277 slices unchanged.", "comparison_image": "runs/mayo-ldct-claude-agentic-tv-iterative-search-20260619-01/iterations/iter-0003/comparison.png"}
