{"ts": "2026-06-20T19:44:48Z", "run_id": "mayo-ldct-claude-agentic-itnet-search-20260619-01", "iter": 6, "agent": "itnet-claude-agentic", "model": "claude-opus-4-8-1m", "change_class": "architecture", "status": "keep", "kept": true, "val_score": 0.9332138299942017, "headroom": 0.3752140975723305, "params_M": 0.232881, "train_n": 400, "rationale": "itnet-claude-agentic: pretrain_epochs=200, pretrain_lr=0.0001, itnet_k=1, itnet_alpha=0.005, unet_c=16, finetune_epochs=0, finetune_lr=0.0001, train_n=200, val_n=214, grad_clip=1.0, seed=42, rationale=ITER-6 (search-20260619-01, corrected 214-slice/321px-FOV metric) for itnet = ItNet v1 (pretrain-denoiser-then-FIXED-DC, solver_itnet.py). SIX-BOX (NUMBERS, not CT pixels). (1) PRIOR (val=ALL 214 L277, 321px FOV; hr=metric of record): iter-1 ep8/train_n200 -> SSIM 0.4413 / hr 0.000; iter-2 ep48 -> 0.5927 / hr 0.000; iter-3 ep160 -> 0.6430 / hr 0.000; iter-4 ep220 -> 0.7022 / hr 0.000 (1156.9s, BEST SSIM); iter-5 ep140/train_n300 -> 0.6932 / hr 0.000 (1193.7s). HEADROOM PINNED at 0.000 across ALL 5 iters. iter-5 train_n 200->300 data probe did NOT lift SSIM (0.6932<0.7022, epochs dropped 220->140) and hr stayed 0 -> DATA-COVERAGE is NOT the missing lever. Levers tested: pretrain_epochs (iters 1-4), train_n (iter-5). UNTESTED axis: itnet_k (held =3 every iter). (2) LIMITER = pretrain-then-FIXED-DC ceiling (structural, CONFIRMED from solver_itnet.py read this turn): ItNet.forward lines 76-90 run k DC steps where self.alpha is a PLAIN FLOAT (line 73) and self.projector is FIXED analytic PYRO-NN (line 74) -> ZERO trainable params in the DC unroll; finetune_itnet() (line 114) is DEFINED but NEVER called; main() runs itnet.eval()+torch.no_grad() = pure INFERENCE. The ONLY trainable component is the standalone SmallUNet denoiser (params_M 0.2329) pretrained FBP->truth that NEVER sees the DC steps. The fixed UNTRAINED DC operator drags the recon below the ~0.81 LD-FBP floor regardless of denoiser quality. (3) ONE KNOB: itnet_k 3 -> 1 (fewer FIXED-DC steps). Rationale: itnets OWN documented champion insight is k=1 wins on noisy LDCT (fewer DC steps); since the DC operator here is UNTRAINED and floor-pulling, k=1 passes the well-trained denoiser output through the LEAST harmful fixed-DC correction. This is the clean diagnostic of whether the fixed-DC STEP-COUNT (vs the trainable-param absence) is the floor-puller. Reverts to the iter-4 BEST config (train_n=200) NOT the iter-5 regressed data-trade. pretrain_epochs 220->200 is the budget backstop (NOT a 2nd hypothesis-knob) to hold the HARD 20-min wall conservatively. All else identical to iter-4 (itnet_alpha=0.005, unet_c=16, pretrain_lr=1e-4, train_n=200, val_n=214, grad_clip=1.0, seed=42). (4) HYPOTHESIS: k=3->1 keeps the recon closer to the well-trained denoiser, SSIM rises modestly above 0.7022 (predict ~0.72-0.78) but hr STAYS 0.000 -- a single fixed-DC step still cannot credit above the ~0.81 floor (denoiser is FBP->truth, FBP-information-capped; the untrained DC adds no params). FALSIFIER (operative): if hr > 0 at k=1, the fixed-DC STEP-COUNT was the floor-puller and itnet_k is the live lever toward 20 (implausible given zero DC params, but the clean discriminator). PREDICTED iter-6 hr = 0.000, SSIM ~0.74. (5) BUDGET (HARD 20-min = 1200s train+score): pretrain epochs cost is UNCHANGED by k (DC steps run only at eval, not in pretrain_denoiser); k=3->1 makes the 214-slice val pass CHEAPER (1 DC step/slice vs 3). iter-4 fit: per_epoch(200)=4.21s, fixed=185s. ep200 at train_n=200 -> pred = 185 + 200*4.21 = 1027s = 17.1 min, inside 1200s with ~170s margin (sized DELIBERATELY conservative: doc warns the v2 sibling overran at 1237s; real wall will be BELOW 1027s since val DC is now cheaper; the 30-min sbatch wall is the only hard fence). grad_clip=1.0 retained (mandatory: the 2304-view Mayo FBP adjoint inside the DC step overflows otherwise). v1 has NO max_train_s backstop. val stays ALL 214 L277 slices, 321px detector-geometry FOV (default; NO fov= override). (6) Loop continues -- no control returned. HARD-WIRED (unchanged): staged_canonical data, v3 mayo_ldct_fitted geometry, per-sample-ps (each val slice swaps itnet.projector to its own ps; chunk=1 FORCED), bg_target=truth, val=ALL 214 L277 slices under the 321px detector-geometry FOV (evaluate_calibrated default for AGENT4CT_DATASET=mayo_ldct_2d; NO fov= override).", "advice_for_others": "itnet-claude-agentic: pretrain_epochs=200, pretrain_lr=0.0001, itnet_k=1, itnet_alpha=0.005, unet_c=16, finetune_epochs=0, finetune_lr=0.0001, train_n=200, val_n=214, grad_clip=1.0, seed=42, rationale=ITER-6 (search-20260619-01, corrected 214-slice/321px-FOV metric) for itnet = ItNet v1 (pretrain-denoiser-then-FIXED-DC, solver_itnet.py). SIX-BOX (NUMBERS, not CT pixels). (1) PRIOR (val=ALL 214 L277, 321px FOV; hr=metric of record): iter-1 ep8/train_n200 -> SSIM 0.4413 / hr 0.000; iter-2 ep48 -> 0.5927 / hr 0.000; iter-3 ep160 -> 0.6430 / hr 0.000; iter-4 ep220 -> 0.7022 / hr 0.000 (1156.9s, BEST SSIM); iter-5 ep140/train_n300 -> 0.6932 / hr 0.000 (1193.7s). HEADROOM PINNED at 0.000 across ALL 5 iters. iter-5 train_n 200->300 data probe did NOT lift SSIM (0.6932<0.7022, epochs dropped 220->140) and hr stayed 0 -> DATA-COVERAGE is NOT the missing lever. Levers tested: pretrain_epochs (iters 1-4), train_n (iter-5). UNTESTED axis: itnet_k (held =3 every iter). (2) LIMITER = pretrain-then-FIXED-DC ceiling (structural, CONFIRMED from solver_itnet.py read this turn): ItNet.forward lines 76-90 run k DC steps where self.alpha is a PLAIN FLOAT (line 73) and self.projector is FIXED analytic PYRO-NN (line 74) -> ZERO trainable params in the DC unroll; finetune_itnet() (line 114) is DEFINED but NEVER called; main() runs itnet.eval()+torch.no_grad() = pure INFERENCE. The ONLY trainable component is the standalone SmallUNet denoiser (params_M 0.2329) pretrained FBP->truth that NEVER sees the DC steps. The fixed UNTRAINED DC operator drags the recon below the ~0.81 LD-FBP floor regardless of denoiser quality. (3) ONE KNOB: itnet_k 3 -> 1 (fewer FIXED-DC steps). Rationale: itnets OWN documented champion insight is k=1 wins on noisy LDCT (fewer DC steps); since the DC operator here is UNTRAINED and floor-pulling, k=1 passes the well-trained denoiser output through the LEAST harmful fixed-DC correction. This is the clean diagnostic of whether the fixed-DC STEP-COUNT (vs the trainable-param absence) is the floor-puller. Reverts to the iter-4 BEST config (train_n=200) NOT the iter-5 regressed data-trade. pretrain_epochs 220->200 is the budget backstop (NOT a 2nd hypothesis-knob) to hold the HARD 20-min wall conservatively. All else identical to iter-4 (itnet_alpha=0.005, unet_c=16, pretrain_lr=1e-4, train_n=200, val_n=214, grad_clip=1.0, seed=42). (4) HYPOTHESIS: k=3->1 keeps the recon closer to the well-trained denoiser, SSIM rises modestly above 0.7022 (predict ~0.72-0.78) but hr STAYS 0.000 -- a single fixed-DC step still cannot credit above the ~0.81 floor (denoiser is FBP->truth, FBP-information-capped; the untrained DC adds no params). FALSIFIER (operative): if hr > 0 at k=1, the fixed-DC STEP-COUNT was the floor-puller and itnet_k is the live lever toward 20 (implausible given zero DC params, but the clean discriminator). PREDICTED iter-6 hr = 0.000, SSIM ~0.74. (5) BUDGET (HARD 20-min = 1200s train+score): pretrain epochs cost is UNCHANGED by k (DC steps run only at eval, not in pretrain_denoiser); k=3->1 makes the 214-slice val pass CHEAPER (1 DC step/slice vs 3). iter-4 fit: per_epoch(200)=4.21s, fixed=185s. ep200 at train_n=200 -> pred = 185 + 200*4.21 = 1027s = 17.1 min, inside 1200s with ~170s margin (sized DELIBERATELY conservative: doc warns the v2 sibling overran at 1237s; real wall will be BELOW 1027s since val DC is now cheaper; the 30-min sbatch wall is the only hard fence). grad_clip=1.0 retained (mandatory: the 2304-view Mayo FBP adjoint inside the DC step overflows otherwise). v1 has NO max_train_s backstop. val stays ALL 214 L277 slices, 321px detector-geometry FOV (default; NO fov= override). (6) Loop continues -- no control returned. HARD-WIRED (unchanged): staged_canonical data, v3 mayo_ldct_fitted geometry, per-sample-ps (each val slice swaps itnet.projector to its own ps; chunk=1 FORCED), bg_target=truth, val=ALL 214 L277 slices under the 321px detector-geometry FOV (evaluate_calibrated default for AGENT4CT_DATASET=mayo_ldct_2d; NO fov= override).", "comparison_image": "runs/mayo-ldct-claude-agentic-itnet-search-20260619-01/iterations/iter-0006/comparison.png"}
{"ts": "2026-06-20T19:19:54Z", "run_id": "mayo-ldct-claude-agentic-dual-domain-bilateral-n2i-search-20260619-01", "iter": 6, "agent": "dual_domain_bilateral_n2i-claude-agentic", "model": "claude-opus-4-8-1m", "change_class": "architecture", "status": "discard", "kept": false, "val_score": 0.924765944480896, "headroom": 0.0, "params_M": 6e-06, "train_n": 400, "rationale": "dual_domain_bilateral_n2i-claude-agentic: warm_start=True, pretrain_epochs=1, pretrain_steps=20, n_iter=30, grad_clip=1.0, lr=0.005, proj_n_bf=1, img_n_bf=1, proj_kernel=7, proj_sx=1.0, proj_sy=2.0, proj_sr=0.02, img_kernel=7, img_sx=1.5, img_sy=1.5, img_sr=0.02, batch_size=1, train_n=200, val_n=214, outer_wall_s=1050, per_scene_s=None, seed=42, rationale=iter-6: proj_kernel 5->7 (proj-domain bilateral spatial footprint) off iter-1; last untried lever-side proj knob; PER-IMAGE", "advice_for_others": "dual_domain_bilateral_n2i-claude-agentic: warm_start=True, pretrain_epochs=1, pretrain_steps=20, n_iter=30, grad_clip=1.0, lr=0.005, proj_n_bf=1, img_n_bf=1, proj_kernel=7, proj_sx=1.0, proj_sy=2.0, proj_sr=0.02, img_kernel=7, img_sx=1.5, img_sy=1.5, img_sr=0.02, batch_size=1, train_n=200, val_n=214, outer_wall_s=1050, per_scene_s=None, seed=42, rationale=iter-6: proj_kernel 5->7 (proj-domain bilateral spatial footprint) off iter-1; last untried lever-side proj knob; PER-IMAGE", "comparison_image": "runs/mayo-ldct-claude-agentic-dual-domain-bilateral-n2i-search-20260619-01/iterations/iter-0006/comparison.png"}
{"ts": "2026-06-20T19:17:20Z", "run_id": "mayo-ldct-claude-agentic-itnet-v2-search-20260619-01", "iter": 6, "agent": "itnet_v2-claude-agentic", "model": "claude-opus-4-8-1m", "change_class": "architecture", "status": "discard", "kept": false, "val_score": 0.6307175159454346, "headroom": 0.0, "params_M": 0.232882, "train_n": 400, "rationale": "itnet_v2-claude-agentic: itnet_k=3, unet_c=16, itnet_alpha_init=0.0037, residual_learning=False, pretrain_lr=0.0001, pretrain_epochs=144, pretrain_patience=144, batch_size=1, val_chunk=1, train_n=200, val_n=214, grad_clip=1.0, max_train_s=900, seed=42, rationale=ITER-6 (search-20260619-01, corrected 214-slice/321px-FOV metric). CEILING-DOCUMENTATION iter. ONE KNOB vs iter-5: train_n 400->200 (the iter-5 falsifier-prescribed revert), with pretrain_epochs traded 120->144 + pretrain_patience tracked 120->144 (early-stop stays disabled) to RESTORE budget headroom after iter-4 (1237s) and iter-5 (1411s) BOTH overran the 1200s budget; this lands exactly on the iter-3 tn200/ep144 point (actual 744.1s) so it doubles as a tn200 reproducibility/ceiling confirmation. max_train_s 1100->900 (15-min HARD backstop) -- deliberately conservative to GUARANTEE the 214-slice per-sample val + figure finish inside the 30-min wall, ending the two-iter overrun streak. SIX-BOX (NUMBERS, hr=metric of record): (1) PRIOR NUMBERS / TRAJECTORY: iter-1 SSIM 0.4554/hr 0.0 @ep12/tn200 in 170.2s; iter-2 0.5888/hr 0.0 @ep48 in 345.2s; iter-3 0.6230/hr 0.0 @ep144 in 744.1s; iter-4 0.7039/hr 0.0 @ep240/tn200 in 1236.9s (OVER budget); iter-5 0.7294/hr 0.0 @ep120/tn400 in 1410.6s (OVER budget; val_psnr 26.87, val_rmse 2.267e-3). Best hr=0.0 throughout; LD-FBP floor SSIM ~0.81 sits ABOVE every iter (max SSIM 0.7294 < 0.81), so hr is pinned at 0 by construction. iter-5 result: train_n 200->400 at EQUAL grad-steps (48000) lifted SSIM +0.0255 (0.7039->0.7294) -- the denoiser DID improve with coverage (mirroring uswin/itnet_v3) BUT hr stayed 0.0: the data-coverage lever lifts the denoiser SSIM, NOT hr. (2) LIMITER (CONFIRMED, structural, NUMERIC): the DC stage in solver_itnet_v2.py carries NO trainable params -- pretrain_denoiser optimizes ONLY denoiser.parameters() on (fbp,truth) residual pairs, then ItNetV2 runs itnet.eval() with the k=3 DC operator FIXED (log_alpha never optimized). BINDING KNOB: BOTH in-budget learnable levers are now MAPPED and BOTH saturate below the 0.81 FBP floor -- pretrain_epochs (iter-1->4: 0.4554->0.7039 with sharply diminishing +0.133/+0.034/+0.081 increments, then budget-pinned at 1237s) and data-coverage train_n (iter-5: +0.0255, hr still 0). Neither learnable lever can clear the floor because the un-trained DC coupling caps the family far below end-to-end itnet_v3 (0.91); the DC log_alpha is the only weight that could fix it and it is structurally frozen (solver edits forbidden). (3) ONE UNTRIED KNOB vs CONFIRM CEILING: the two learnable levers are exhausted; itnet_alpha_init/itnet_k shift a FIXED (non-trainable) operator -> near-zero diagnostic value, and pretrain_lr-up is sibling-unstable above 1e-4. So iter-6 CONFIRMS the ceiling by executing the iter-5 falsifier (revert tn400->200) at the budget-safe ep144 point, documenting v2 as a pretrain-then-FIXED-DC structural cap (hr 0; prefer end-to-end v3) toward the iter-20 ceiling record. (4) HYPOTHESIS + NUMERIC FALSIFIER: reverting train_n 400->200 at ep144 reproduces iter-3 (val_ssim ~0.62, hr 0.000) -- confirming the data-coverage SSIM lift was real (0.7294>0.6230) but irrelevant to hr, and that the untrained-DC structural cap, not data/epochs, is the binding limiter. FALSIFIER: if hr CLEARS 0 (val_ssim jumps past the 0.81 LD-FBP floor) at tn200/ep144 -- which it cannot, since iter-3 already ran this exact point at SSIM 0.6230/hr 0 -- the structural-cap verdict is wrong; ANY hr>0 reopens the search. Expectation: SSIM ~0.62, hr 0.000. (5) BUDGET: HARD 20-min (1200s) train+score. tn200 per-epoch = 4.155s/epoch (iter-2->3 slope), fixed 214-slice per-sample val+figure = 145.8s; ep144 -> 144*4.155 + 145.8 = 744s (iter-3 ACTUAL was 744.1s), comfortably UNDER 1200s and well within the 30-min sbatch wall -- ending the iter-4/iter-5 overrun streak. max_train_s=900 (15-min HARD backstop) leaves ample room for the 214-slice per-sample val + figure. val_n=214 KEPT (NOT reduced -- ALL L277 slices), grad_clip=1.0 KEPT. (6) Loop continues -- no control returned. HARD-WIRED (unchanged): staged_canonical data, v3 mayo_ldct_fitted geometry, per-sample-ps (each slice swaps itnet.projector to its own ps; batch_size=1 + val_chunk=1 FORCED), bg_target=truth, val=ALL 214 L277 slices under the 321px detector-geometry FOV (evaluate_calibrated default for AGENT4CT_DATASET=mayo_ldct_2d; NO fov= override). residual_learning=False KEPT (the CONFIG default True double-applies the residual and collapses eval to ~0.34).", "advice_for_others": "itnet_v2-claude-agentic: itnet_k=3, unet_c=16, itnet_alpha_init=0.0037, residual_learning=False, pretrain_lr=0.0001, pretrain_epochs=144, pretrain_patience=144, batch_size=1, val_chunk=1, train_n=200, val_n=214, grad_clip=1.0, max_train_s=900, seed=42, rationale=ITER-6 (search-20260619-01, corrected 214-slice/321px-FOV metric). CEILING-DOCUMENTATION iter. ONE KNOB vs iter-5: train_n 400->200 (the iter-5 falsifier-prescribed revert), with pretrain_epochs traded 120->144 + pretrain_patience tracked 120->144 (early-stop stays disabled) to RESTORE budget headroom after iter-4 (1237s) and iter-5 (1411s) BOTH overran the 1200s budget; this lands exactly on the iter-3 tn200/ep144 point (actual 744.1s) so it doubles as a tn200 reproducibility/ceiling confirmation. max_train_s 1100->900 (15-min HARD backstop) -- deliberately conservative to GUARANTEE the 214-slice per-sample val + figure finish inside the 30-min wall, ending the two-iter overrun streak. SIX-BOX (NUMBERS, hr=metric of record): (1) PRIOR NUMBERS / TRAJECTORY: iter-1 SSIM 0.4554/hr 0.0 @ep12/tn200 in 170.2s; iter-2 0.5888/hr 0.0 @ep48 in 345.2s; iter-3 0.6230/hr 0.0 @ep144 in 744.1s; iter-4 0.7039/hr 0.0 @ep240/tn200 in 1236.9s (OVER budget); iter-5 0.7294/hr 0.0 @ep120/tn400 in 1410.6s (OVER budget; val_psnr 26.87, val_rmse 2.267e-3). Best hr=0.0 throughout; LD-FBP floor SSIM ~0.81 sits ABOVE every iter (max SSIM 0.7294 < 0.81), so hr is pinned at 0 by construction. iter-5 result: train_n 200->400 at EQUAL grad-steps (48000) lifted SSIM +0.0255 (0.7039->0.7294) -- the denoiser DID improve with coverage (mirroring uswin/itnet_v3) BUT hr stayed 0.0: the data-coverage lever lifts the denoiser SSIM, NOT hr. (2) LIMITER (CONFIRMED, structural, NUMERIC): the DC stage in solver_itnet_v2.py carries NO trainable params -- pretrain_denoiser optimizes ONLY denoiser.parameters() on (fbp,truth) residual pairs, then ItNetV2 runs itnet.eval() with the k=3 DC operator FIXED (log_alpha never optimized). BINDING KNOB: BOTH in-budget learnable levers are now MAPPED and BOTH saturate below the 0.81 FBP floor -- pretrain_epochs (iter-1->4: 0.4554->0.7039 with sharply diminishing +0.133/+0.034/+0.081 increments, then budget-pinned at 1237s) and data-coverage train_n (iter-5: +0.0255, hr still 0). Neither learnable lever can clear the floor because the un-trained DC coupling caps the family far below end-to-end itnet_v3 (0.91); the DC log_alpha is the only weight that could fix it and it is structurally frozen (solver edits forbidden). (3) ONE UNTRIED KNOB vs CONFIRM CEILING: the two learnable levers are exhausted; itnet_alpha_init/itnet_k shift a FIXED (non-trainable) operator -> near-zero diagnostic value, and pretrain_lr-up is sibling-unstable above 1e-4. So iter-6 CONFIRMS the ceiling by executing the iter-5 falsifier (revert tn400->200) at the budget-safe ep144 point, documenting v2 as a pretrain-then-FIXED-DC structural cap (hr 0; prefer end-to-end v3) toward the iter-20 ceiling record. (4) HYPOTHESIS + NUMERIC FALSIFIER: reverting train_n 400->200 at ep144 reproduces iter-3 (val_ssim ~0.62, hr 0.000) -- confirming the data-coverage SSIM lift was real (0.7294>0.6230) but irrelevant to hr, and that the untrained-DC structural cap, not data/epochs, is the binding limiter. FALSIFIER: if hr CLEARS 0 (val_ssim jumps past the 0.81 LD-FBP floor) at tn200/ep144 -- which it cannot, since iter-3 already ran this exact point at SSIM 0.6230/hr 0 -- the structural-cap verdict is wrong; ANY hr>0 reopens the search. Expectation: SSIM ~0.62, hr 0.000. (5) BUDGET: HARD 20-min (1200s) train+score. tn200 per-epoch = 4.155s/epoch (iter-2->3 slope), fixed 214-slice per-sample val+figure = 145.8s; ep144 -> 144*4.155 + 145.8 = 744s (iter-3 ACTUAL was 744.1s), comfortably UNDER 1200s and well within the 30-min sbatch wall -- ending the iter-4/iter-5 overrun streak. max_train_s=900 (15-min HARD backstop) leaves ample room for the 214-slice per-sample val + figure. val_n=214 KEPT (NOT reduced -- ALL L277 slices), grad_clip=1.0 KEPT. (6) Loop continues -- no control returned. HARD-WIRED (unchanged): staged_canonical data, v3 mayo_ldct_fitted geometry, per-sample-ps (each slice swaps itnet.projector to its own ps; batch_size=1 + val_chunk=1 FORCED), bg_target=truth, val=ALL 214 L277 slices under the 321px detector-geometry FOV (evaluate_calibrated default for AGENT4CT_DATASET=mayo_ldct_2d; NO fov= override). residual_learning=False KEPT (the CONFIG default True double-applies the residual and collapses eval to ~0.34).", "comparison_image": "runs/mayo-ldct-claude-agentic-itnet-v2-search-20260619-01/iterations/iter-0006/comparison.png"}
