{"ts": "2026-06-19T20:53:01Z", "run_id": "mayo-ldct-claude-agentic-diff-recon-dcstep-constrained-mayo-v4-search-20260619-01", "iter": 2, "agent": "diffusion_recon_dcstep_constrained_mayo_v4-claude-agentic", "model": "claude-opus-4-8-1m", "change_class": "architecture", "status": "discard", "kept": false, "val_score": 0.23662516474723816, "headroom": 0.0, "params_M": 8.594211, "train_n": 400, "rationale": "diffusion_recon_dcstep_constrained_mayo_v4-claude-agentic: recon_ckpt=/cluster/maier/Agent4CT/checkpoints/ddpm_mayo_constrained_v4.pt, recon_mode=dps, recon_sample_steps=25, recon_eta=1.0, recon_init=fbp, recon_eta_clamp=False, recon_dcstep_every=5, recon_dcstep_n_cg=3, recon_dcstep_warmup=5, recon_dcstep_relax=1.0, val_n=214, train_n=0, rationale=iter-2 search-20260619-01 CONSTRAINED diff-recon. ONE KNOB: recon_eta 30.0->1.0 (DPS guidance gain). iter-1 (eta=30) = SSIM 0.3937 / hr 0.0 / PSNR 14.31 / RMSE 0.00963 \u2014 FAR BELOW the ~0.81 LD-FBP floor, i.e. the recon is corrupted relative to its own FBP init, not merely prior-dominated drift. Failure mode: the DPS step is adaptively normalized in-solver (step = (eta/||resid||)*grad, Chung 2023 eq.12), so eta is a dimensionless gain whose literature/demo/breast default is 1.0; eta=30 (a discarded-614 boundary-metric hint) is a 30x overshoot that, with recon_eta_clamp=false (no per-step displacement cap), blows the FBP-initialized iterate off-manifold every reverse step, and the relax=1.0 hard-DC then re-noises a corrupted x0. HYPOTHESIS: lowering eta 30->1 lets the DPS correction be a gentle pull, recovering SSIM from 0.39 toward/above the ~0.81 LD-FBP floor (hr>0). FALSIFIER: if SSIM stays ~0.39-0.5 (still <<FBP) at eta=1, the DPS step size was NOT the issue \u2014 the Mayo v4 DDPM prior is mismatched to rebinned Mayo under the 25-step low-T budget (mirrors the breast-DDPM hr=0 structural verdict: globally faithful but not conditionally faithful under DPS/DC) -> iter-3 redirects to the prior, not the DC weight. BUDGET: eta is free (no per-slice cost change); iter-1 ran 214 slices in 1018.96 s = 4.76 s/slice = 17.0 min < 20-min wall (1800s in-solver backstop never hit). val=ALL 214 L277, 321px geometry FOV default.", "advice_for_others": "diffusion_recon_dcstep_constrained_mayo_v4-claude-agentic: recon_ckpt=/cluster/maier/Agent4CT/checkpoints/ddpm_mayo_constrained_v4.pt, recon_mode=dps, recon_sample_steps=25, recon_eta=1.0, recon_init=fbp, recon_eta_clamp=False, recon_dcstep_every=5, recon_dcstep_n_cg=3, recon_dcstep_warmup=5, recon_dcstep_relax=1.0, val_n=214, train_n=0, rationale=iter-2 search-20260619-01 CONSTRAINED diff-recon. ONE KNOB: recon_eta 30.0->1.0 (DPS guidance gain). iter-1 (eta=30) = SSIM 0.3937 / hr 0.0 / PSNR 14.31 / RMSE 0.00963 \u2014 FAR BELOW the ~0.81 LD-FBP floor, i.e. the recon is corrupted relative to its own FBP init, not merely prior-dominated drift. Failure mode: the DPS step is adaptively normalized in-solver (step = (eta/||resid||)*grad, Chung 2023 eq.12), so eta is a dimensionless gain whose literature/demo/breast default is 1.0; eta=30 (a discarded-614 boundary-metric hint) is a 30x overshoot that, with recon_eta_clamp=false (no per-step displacement cap), blows the FBP-initialized iterate off-manifold every reverse step, and the relax=1.0 hard-DC then re-noises a corrupted x0. HYPOTHESIS: lowering eta 30->1 lets the DPS correction be a gentle pull, recovering SSIM from 0.39 toward/above the ~0.81 LD-FBP floor (hr>0). FALSIFIER: if SSIM stays ~0.39-0.5 (still <<FBP) at eta=1, the DPS step size was NOT the issue \u2014 the Mayo v4 DDPM prior is mismatched to rebinned Mayo under the 25-step low-T budget (mirrors the breast-DDPM hr=0 structural verdict: globally faithful but not conditionally faithful under DPS/DC) -> iter-3 redirects to the prior, not the DC weight. BUDGET: eta is free (no per-slice cost change); iter-1 ran 214 slices in 1018.96 s = 4.76 s/slice = 17.0 min < 20-min wall (1800s in-solver backstop never hit). val=ALL 214 L277, 321px geometry FOV default.", "comparison_image": "runs/mayo-ldct-claude-agentic-diff-recon-dcstep-constrained-mayo-v4-search-20260619-01/iterations/iter-0002/comparison.png"}
{"ts": "2026-06-19T20:40:10Z", "run_id": "mayo-ldct-claude-agentic-dual-domain-bilateral-n2i-search-20260619-01", "iter": 2, "agent": "dual_domain_bilateral_n2i-claude-agentic-breast-ct", "model": "claude-opus-4.7-1m", "change_class": "architecture", "status": "discard", "kept": false, "val_score": 0.9247332215309143, "headroom": 0.0, "params_M": 6e-06, "train_n": 400, "rationale": "dual_domain_bilateral_n2i-claude-agentic: warm_start=True, pretrain_epochs=1, pretrain_steps=20, n_iter=30, grad_clip=1.0, lr=0.005, proj_n_bf=1, img_n_bf=1, proj_kernel=5, proj_sx=1.0, proj_sy=2.0, proj_sr=0.0005, img_kernel=7, img_sx=1.5, img_sy=1.5, img_sr=0.02, batch_size=1, train_n=200, val_n=214, outer_wall_s=1050, per_scene_s=None, seed=42, rationale=iter-2 (search-20260619-01, corrected 214-slice/321px-FOV metric). ONE KNOB: proj_sr 0.02 -> 0.0005 (projection-domain bilateral range sigma, 40x tighter). PER-IMAGE preserved (warm-start pre-pass + independent per-scan fit on each L277 slice OWN half-angle measurements, GT-free; NEVER amortized). SIX-BOX. (1) iter-1 = SSIM 0.9248 (HIGHEST raw SSIM of any Mayo inference solver) but headroom=0.0 -- below the LD-FBP baseline on the calibrated RMSE-sensitive metric; elapsed 940.4s = 15.67 min; per-scan 940.4/214 = 4.39 s/scene at n_iter=30 (~0.131 s/(iter*scene) on the 2304-view FBP adjoint). (2) FAILURE MODE: high SSIM + hr~0 = the projection-domain bilateral OVER-SMOOTHS across attenuation edges (range sigma proj_sr=0.02 too loose for the 2304-view dense Mayo sinogram), washing out fine structure so RMSE rises even as global SSIM stays high -- same signature as dual_domain_bilateral_supervised (raw SSIM 0.919 highest yet hr only 0.028). (3) ONE KNOB justified: campaign-state lever insight (line 145) -- on Mayo (2304-view) the IMAGE-domain sigma is INERT and proj_sr-DOWN is the documented over-smoothing lever; tightening the projection range kernel preserves attenuation edges -> lower RMSE -> lift hr off the floor. Step 0.02->0.0005 matches the established breast sibling step (breast iter-08 proj_sr 0.02->0.0005). proj_sr is a sigma INIT, not a compute knob: kernel/n_iter/214-scans/FBP-adjoint cost all UNCHANGED, so the 20-min budget is identical to iter-1 (~940s = 15.7 min, ~260s slack inside 1200s) -- zero budget risk. (4) HYPOTHESIS: tightening proj_sr sharpens the projection-domain edge preservation -> RMSE drops -> hr rises above 0. FALSIFIER (NUMBERS): if hr stays ~0 with proj_sr=0.0005, the 6-param bilateral CAPACITY CEILING (not range-sigma tuning) is the limit on dense-view Mayo -- half-view N2I info loss < full-view LD-FBP and no sigma setting recovers it; that retires proj_sr as a lever and the next probe is img_n_bf depth. (5) HARD 20-min budget; val=ALL 214 L277 slices (NOT reduced); PER-IMAGE preserved; in-solver outer_wall_s=1050 (17.5 min) backstop guarantees a recorded result. (6) Do NOT return control mid-campaign.", "advice_for_others": "dual_domain_bilateral_n2i-claude-agentic: warm_start=True, pretrain_epochs=1, pretrain_steps=20, n_iter=30, grad_clip=1.0, lr=0.005, proj_n_bf=1, img_n_bf=1, proj_kernel=5, proj_sx=1.0, proj_sy=2.0, proj_sr=0.0005, img_kernel=7, img_sx=1.5, img_sy=1.5, img_sr=0.02, batch_size=1, train_n=200, val_n=214, outer_wall_s=1050, per_scene_s=None, seed=42, rationale=iter-2 (search-20260619-01, corrected 214-slice/321px-FOV metric). ONE KNOB: proj_sr 0.02 -> 0.0005 (projection-domain bilateral range sigma, 40x tighter). PER-IMAGE preserved (warm-start pre-pass + independent per-scan fit on each L277 slice OWN half-angle measurements, GT-free; NEVER amortized). SIX-BOX. (1) iter-1 = SSIM 0.9248 (HIGHEST raw SSIM of any Mayo inference solver) but headroom=0.0 -- below the LD-FBP baseline on the calibrated RMSE-sensitive metric; elapsed 940.4s = 15.67 min; per-scan 940.4/214 = 4.39 s/scene at n_iter=30 (~0.131 s/(iter*scene) on the 2304-view FBP adjoint). (2) FAILURE MODE: high SSIM + hr~0 = the projection-domain bilateral OVER-SMOOTHS across attenuation edges (range sigma proj_sr=0.02 too loose for the 2304-view dense Mayo sinogram), washing out fine structure so RMSE rises even as global SSIM stays high -- same signature as dual_domain_bilateral_supervised (raw SSIM 0.919 highest yet hr only 0.028). (3) ONE KNOB justified: campaign-state lever insight (line 145) -- on Mayo (2304-view) the IMAGE-domain sigma is INERT and proj_sr-DOWN is the documented over-smoothing lever; tightening the projection range kernel preserves attenuation edges -> lower RMSE -> lift hr off the floor. Step 0.02->0.0005 matches the established breast sibling step (breast iter-08 proj_sr 0.02->0.0005). proj_sr is a sigma INIT, not a compute knob: kernel/n_iter/214-scans/FBP-adjoint cost all UNCHANGED, so the 20-min budget is identical to iter-1 (~940s = 15.7 min, ~260s slack inside 1200s) -- zero budget risk. (4) HYPOTHESIS: tightening proj_sr sharpens the projection-domain edge preservation -> RMSE drops -> hr rises above 0. FALSIFIER (NUMBERS): if hr stays ~0 with proj_sr=0.0005, the 6-param bilateral CAPACITY CEILING (not range-sigma tuning) is the limit on dense-view Mayo -- half-view N2I info loss < full-view LD-FBP and no sigma setting recovers it; that retires proj_sr as a lever and the next probe is img_n_bf depth. (5) HARD 20-min budget; val=ALL 214 L277 slices (NOT reduced); PER-IMAGE preserved; in-solver outer_wall_s=1050 (17.5 min) backstop guarantees a recorded result. (6) Do NOT return control mid-campaign.", "comparison_image": "runs/mayo-ldct-claude-agentic-dual-domain-bilateral-n2i-search-20260619-01/iterations/iter-0002/comparison.png"}
{"ts": "2026-06-19T19:59:28Z", "run_id": "mayo-ldct-claude-agentic-dual-domain-n2i-search-20260619-01", "iter": 2, "agent": "dual_domain_n2i-claude-agentic-breast-ct", "model": "claude-opus-4.7-1m", "change_class": "architecture", "status": "discard", "kept": false, "val_score": 0.8680964112281799, "headroom": 0.0, "params_M": 0.465762, "train_n": 400, "rationale": "dual_domain_n2i-claude-agentic: warm_start=True, pretrain_epochs=4, n_iter=15, grad_clip=1.0, unet_c=16, lr=0.001, batch_size=1, train_n=200, val_n=214, outer_wall_s=1080, per_scene_s=None, seed=42, rationale=dual_domain_n2i iter-2 (search-20260619-01, PER-IMAGE Noise2Inverse: warm-start pre-pass + per-scan Adam fit; NEVER amortized). SIX-BOX (NUMBERS). (1) iter-1: SSIM 0.8622, hr 0.0, PSNR 33.07 vs baseline_PSNR 34.08 (recon is BELOW the LD-FBP baseline), RMSE 1.11e-3, elapsed 971.99s (16.2 min). Measured from the [fit] log: per-scan fit loop = 214 scenes x 15 steps in 846.9s -> 0.264 s/per-scan-step = 3.96 s/scene; fixed overhead (1 warm-start epoch ~50s + dataset setup + scoring + figure ~75s) = 125.1s. (2) FAILURE MODE: hr=0, recon PSNR 33.07 < FBP 34.08 -> the per-scan fit is INIT-DOMINATED. At only 15 per-scan Adam steps the per-image recon has barely left the warm-start U-Net init, so the result is essentially the (1-epoch, under-trained) warm-start applied per scan -- below baseline. This is starvation of the INIT, not over-fit (the over-fit / lr-down regime is at n_iter 600-1200, far above here). (3) ONE KNOB: pretrain_epochs 1->4 (n_iter=15, lr=1e-3, grad_clip=1.0, unet_c=16, val_n=214, seed=42 ALL HELD). Why pretrain_epochs and not n_iter: the 214-scene budget HARD-CAPS n_iter -- at 0.264 s/step, a 19-min (1140s) total leaves 1015s of fit time -> 1015/(214*0.264) = 17.9 steps, so n_iter can only go 15->17 (+13%, too marginal to test). lr-down is wrong-signed (that lever is for the OVER-fit high-n_iter regime; here we are UNDER baseline). warm_start is LOAD-BEARING-POSITIVE (confirmed cross-substrate) and the init is the anchor the 15-step fit refines, so DEEPENING the warm-start is the highest-leverage in-budget move. (4) HYPOTHESIS: pretrain_epochs 1->4 lifts SSIM above 0.8622 and ideally hr above 0 (PSNR above the 34.08 FBP baseline), because a deeper warm-start gives a better U-Net init that the fixed 15 per-scan steps refine from -- the recon stops being dominated by an under-trained 1-epoch init. FALSIFIER: if SSIM <= 0.8622 (no gain or regression), the warm-start init is NOT the binding constraint and per-image N2I is structurally FBP-bounded on dense 2304-view Mayo (half-view info loss > the per-image denoising gain) -> iter-3 documents the structural floor (NAF/ram class) rather than tuning further. (5) BUDGET (HARD 20-min, val=ALL 214): warm-start 4 epochs x ~50s = 200s (+150s vs iter-1) + fit loop UNCHANGED 846.9s + fixed setup/score/figure ~75s = 1121.9s = 18.7 min < 1200s/20-min hard wall (~78s margin). The fit loop is unchanged so its outer_wall_s=1080 in-solver backstop is unchanged; the warm-start is outside that wall and outside the budgeted [fit] timer. n_iter NOT raised (budget-capped). val_n=214 NOT reduced (protocol). PER-IMAGE structure unchanged. (6) no control return.", "advice_for_others": "dual_domain_n2i-claude-agentic: warm_start=True, pretrain_epochs=4, n_iter=15, grad_clip=1.0, unet_c=16, lr=0.001, batch_size=1, train_n=200, val_n=214, outer_wall_s=1080, per_scene_s=None, seed=42, rationale=dual_domain_n2i iter-2 (search-20260619-01, PER-IMAGE Noise2Inverse: warm-start pre-pass + per-scan Adam fit; NEVER amortized). SIX-BOX (NUMBERS). (1) iter-1: SSIM 0.8622, hr 0.0, PSNR 33.07 vs baseline_PSNR 34.08 (recon is BELOW the LD-FBP baseline), RMSE 1.11e-3, elapsed 971.99s (16.2 min). Measured from the [fit] log: per-scan fit loop = 214 scenes x 15 steps in 846.9s -> 0.264 s/per-scan-step = 3.96 s/scene; fixed overhead (1 warm-start epoch ~50s + dataset setup + scoring + figure ~75s) = 125.1s. (2) FAILURE MODE: hr=0, recon PSNR 33.07 < FBP 34.08 -> the per-scan fit is INIT-DOMINATED. At only 15 per-scan Adam steps the per-image recon has barely left the warm-start U-Net init, so the result is essentially the (1-epoch, under-trained) warm-start applied per scan -- below baseline. This is starvation of the INIT, not over-fit (the over-fit / lr-down regime is at n_iter 600-1200, far above here). (3) ONE KNOB: pretrain_epochs 1->4 (n_iter=15, lr=1e-3, grad_clip=1.0, unet_c=16, val_n=214, seed=42 ALL HELD). Why pretrain_epochs and not n_iter: the 214-scene budget HARD-CAPS n_iter -- at 0.264 s/step, a 19-min (1140s) total leaves 1015s of fit time -> 1015/(214*0.264) = 17.9 steps, so n_iter can only go 15->17 (+13%, too marginal to test). lr-down is wrong-signed (that lever is for the OVER-fit high-n_iter regime; here we are UNDER baseline). warm_start is LOAD-BEARING-POSITIVE (confirmed cross-substrate) and the init is the anchor the 15-step fit refines, so DEEPENING the warm-start is the highest-leverage in-budget move. (4) HYPOTHESIS: pretrain_epochs 1->4 lifts SSIM above 0.8622 and ideally hr above 0 (PSNR above the 34.08 FBP baseline), because a deeper warm-start gives a better U-Net init that the fixed 15 per-scan steps refine from -- the recon stops being dominated by an under-trained 1-epoch init. FALSIFIER: if SSIM <= 0.8622 (no gain or regression), the warm-start init is NOT the binding constraint and per-image N2I is structurally FBP-bounded on dense 2304-view Mayo (half-view info loss > the per-image denoising gain) -> iter-3 documents the structural floor (NAF/ram class) rather than tuning further. (5) BUDGET (HARD 20-min, val=ALL 214): warm-start 4 epochs x ~50s = 200s (+150s vs iter-1) + fit loop UNCHANGED 846.9s + fixed setup/score/figure ~75s = 1121.9s = 18.7 min < 1200s/20-min hard wall (~78s margin). The fit loop is unchanged so its outer_wall_s=1080 in-solver backstop is unchanged; the warm-start is outside that wall and outside the budgeted [fit] timer. n_iter NOT raised (budget-capped). val_n=214 NOT reduced (protocol). PER-IMAGE structure unchanged. (6) no control return.", "comparison_image": "runs/mayo-ldct-claude-agentic-dual-domain-n2i-search-20260619-01/iterations/iter-0002/comparison.png"}
{"ts": "2026-06-19T19:58:16Z", "run_id": "mayo-ldct-claude-agentic-ram-search-20260619-01", "iter": 2, "agent": "ram_zeroshot-claude-agentic-breast-ct", "model": "claude-opus-4.7-1m", "change_class": "architecture", "status": "discard", "kept": false, "val_score": 0.8643978238105774, "headroom": 0.0, "params_M": 35.618953, "train_n": 400, "rationale": "ram_zeroshot-claude-agentic: ram_ckpt_path=/cluster/maier/Agent4CT/checkpoints/ram.pth.tar, ram_input_norm=adjoint_max, ram_clamp_output=True, ram_finetune=False, ram_finetune_epochs=0, ram_finetune_lr=0.0001, ram_disable_multiscale=True, ram_disable_cudnn=False, ram_use_deepinv_tomo=False, ram_sigma=0.005, ram_factor=0.55, ram_post_fbp_blend=0.5, val_n=214, rationale=iter-2 (search-20260619-01, corrected protocol): ONE knob ram_post_fbp_blend 0.3->0.5. iter-1 SSIM 0.8611 but calibrated headroom EXACTLY 0.0 (RAM at/below LD-FBP baseline 0.8078; oracle HD-FBP 0.9331). Failure mode: RAM is a pretrained zero-shot recon that never saw real LDCT helical-rebinned fan data; it adds no signal over FBP under the RMSE-sensitive calibrated metric -> FBP-bounded. Cleanest single-knob probe of whether RAM is net-positive vs FBP: raise the FBP fraction in the linear blend from 0.30 to 0.50 (all other knobs fixed at the iter-1 point: ram_factor=0.55, ram_sigma=0.005, adjoint_max norm, multiscale disabled, finetune OFF). Hypothesis: RAM adds no recoverable signal over FBP on dense rebinned Mayo. Falsifier: if hr at blend=0.5 != 0.0 (rises or drops), the RAM/FBP mix matters and RAM is not purely FBP-bounded; if hr stays flat at 0.0, RAM is structurally FBP-bounded on dense Mayo (confirmed). Budget: only a scalar blend coefficient changes -> zero added compute vs iter-1 (18.6 min for 214 single forward passes + one op-norm power iter), inside the HARD 20-min train+score budget; sbatch --time=00:30:00 backstop. val_n stays 214 (score ALL L277 slices @ 321px detector-geometry FOV).", "advice_for_others": "ram_zeroshot-claude-agentic: ram_ckpt_path=/cluster/maier/Agent4CT/checkpoints/ram.pth.tar, ram_input_norm=adjoint_max, ram_clamp_output=True, ram_finetune=False, ram_finetune_epochs=0, ram_finetune_lr=0.0001, ram_disable_multiscale=True, ram_disable_cudnn=False, ram_use_deepinv_tomo=False, ram_sigma=0.005, ram_factor=0.55, ram_post_fbp_blend=0.5, val_n=214, rationale=iter-2 (search-20260619-01, corrected protocol): ONE knob ram_post_fbp_blend 0.3->0.5. iter-1 SSIM 0.8611 but calibrated headroom EXACTLY 0.0 (RAM at/below LD-FBP baseline 0.8078; oracle HD-FBP 0.9331). Failure mode: RAM is a pretrained zero-shot recon that never saw real LDCT helical-rebinned fan data; it adds no signal over FBP under the RMSE-sensitive calibrated metric -> FBP-bounded. Cleanest single-knob probe of whether RAM is net-positive vs FBP: raise the FBP fraction in the linear blend from 0.30 to 0.50 (all other knobs fixed at the iter-1 point: ram_factor=0.55, ram_sigma=0.005, adjoint_max norm, multiscale disabled, finetune OFF). Hypothesis: RAM adds no recoverable signal over FBP on dense rebinned Mayo. Falsifier: if hr at blend=0.5 != 0.0 (rises or drops), the RAM/FBP mix matters and RAM is not purely FBP-bounded; if hr stays flat at 0.0, RAM is structurally FBP-bounded on dense Mayo (confirmed). Budget: only a scalar blend coefficient changes -> zero added compute vs iter-1 (18.6 min for 214 single forward passes + one op-norm power iter), inside the HARD 20-min train+score budget; sbatch --time=00:30:00 backstop. val_n stays 214 (score ALL L277 slices @ 321px detector-geometry FOV).", "comparison_image": "runs/mayo-ldct-claude-agentic-ram-search-20260619-01/iterations/iter-0002/comparison.png"}
