{"ts": "2026-06-19T16:43:14Z", "run_id": "mayo-ldct-claude-agentic-itnet-v3-search-20260619-01", "iter": 2, "agent": "itnet_v3-claude-agentic-breast-ct", "model": "claude-opus-4.7-1m", "change_class": "architecture", "status": "keep", "kept": true, "val_score": 0.9085336327552795, "headroom": 0.3100535522094304, "params_M": 3.698994, "train_n": 400, "rationale": "itnet_v3-claude-agentic: itnet_k=3, unet_c=16, alpha_init=0.0037, lr=0.0001, epochs=14, batch_size=1, val_chunk=1, train_n=200, val_n=214, grad_clip=1.0, max_train_s=900, seed=42, rationale=iter-2 (search-20260619-01, corrected protocol). ONE KNOB: epochs 8 -> 14 (all else = iter-1 exactly: itnet_k=3, unet_c=16, alpha_init=0.0037, lr=1e-4, train_n=200, val_n=214, grad_clip=1.0, seed=42). SIX-BOX: (1) iter-1 = val_ssim 0.895903 / hr 0.268409 / PSNR 36.79 / RMSE 0.000723 at 8 epochs; FULL JOB elapsed 737.85s = 12.30 min (sacct 12:18), well under the 20-min train+score budget AND the 30-min sbatch wall; the train phase did NOT hit max_train_s=900 (all 8 epochs printed). (2) OPPORTUNITY = UNDER-TRAINED at the budget: 8 epochs converged in 12.3 min leaving ~7.7 min of unused compute; itnet-family knob insights name EPOCHS as the dominant lever (discarded boundary-slice run hinted ep40 peak -- behavior hint only, not a validated number). (3) ONE KNOB: epochs 8->14 (~1.75x more training). (4) HYPOTHESIS: if itnet_v3 trains 14 epochs instead of 8 (all else fixed), hr rises above 0.268 because the iter-1 net is under-trained (converged in 12.3/20 min) and epochs is the itnet lever. FALSIFIER: hr <= 0.268 at 14 epochs => itnet_v3 is NOT epochs-limited at lr=1e-4/c=16 (already converged OR lr too low to use the extra steps) and iter-3 must pivot the lever (lr or unet_c). (5) BUDGET (HARD 20-min train+score): iter-1 train ~65 s/epoch (738s total - ~240s fixed val/figure/startup) / 8 = ~62-68 s/ep; 14 epochs ~= 910s train, fenced by the unchanged max_train_s=900 backstop (checks between epochs => completes the epoch in progress, so ~14 epochs land ~900s) + ~240s 214-slice per-sample val + figure ~= 19 min, inside 20-min and well inside the 30-min sbatch wall. val stays ALL 214 L277 slices, 321px detector-geometry FOV (default; no fov= override). (6) do NOT return control mid-campaign.", "advice_for_others": "itnet_v3-claude-agentic: itnet_k=3, unet_c=16, alpha_init=0.0037, lr=0.0001, epochs=14, batch_size=1, val_chunk=1, train_n=200, val_n=214, grad_clip=1.0, max_train_s=900, seed=42, rationale=iter-2 (search-20260619-01, corrected protocol). ONE KNOB: epochs 8 -> 14 (all else = iter-1 exactly: itnet_k=3, unet_c=16, alpha_init=0.0037, lr=1e-4, train_n=200, val_n=214, grad_clip=1.0, seed=42). SIX-BOX: (1) iter-1 = val_ssim 0.895903 / hr 0.268409 / PSNR 36.79 / RMSE 0.000723 at 8 epochs; FULL JOB elapsed 737.85s = 12.30 min (sacct 12:18), well under the 20-min train+score budget AND the 30-min sbatch wall; the train phase did NOT hit max_train_s=900 (all 8 epochs printed). (2) OPPORTUNITY = UNDER-TRAINED at the budget: 8 epochs converged in 12.3 min leaving ~7.7 min of unused compute; itnet-family knob insights name EPOCHS as the dominant lever (discarded boundary-slice run hinted ep40 peak -- behavior hint only, not a validated number). (3) ONE KNOB: epochs 8->14 (~1.75x more training). (4) HYPOTHESIS: if itnet_v3 trains 14 epochs instead of 8 (all else fixed), hr rises above 0.268 because the iter-1 net is under-trained (converged in 12.3/20 min) and epochs is the itnet lever. FALSIFIER: hr <= 0.268 at 14 epochs => itnet_v3 is NOT epochs-limited at lr=1e-4/c=16 (already converged OR lr too low to use the extra steps) and iter-3 must pivot the lever (lr or unet_c). (5) BUDGET (HARD 20-min train+score): iter-1 train ~65 s/epoch (738s total - ~240s fixed val/figure/startup) / 8 = ~62-68 s/ep; 14 epochs ~= 910s train, fenced by the unchanged max_train_s=900 backstop (checks between epochs => completes the epoch in progress, so ~14 epochs land ~900s) + ~240s 214-slice per-sample val + figure ~= 19 min, inside 20-min and well inside the 30-min sbatch wall. val stays ALL 214 L277 slices, 321px detector-geometry FOV (default; no fov= override). (6) do NOT return control mid-campaign.", "comparison_image": "runs/mayo-ldct-claude-agentic-itnet-v3-search-20260619-01/iterations/iter-0002/comparison.png"}
{"ts": "2026-06-19T16:26:22Z", "run_id": "mayo-ldct-claude-agentic-diff-recon-dcstep-unconstrained-mayo-v4-search-20260619-01", "iter": 1, "agent": "diffusion_recon_dcstep_unconstrained_mayo_v4-claude-agentic-breast-ct", "model": "claude-opus-4.7-1m", "change_class": "architecture", "status": "discard", "kept": false, "val_score": 0.3688327968120575, "headroom": 0.0, "params_M": 8.594211, "train_n": 400, "rationale": "diffusion_recon_dcstep_unconstrained_mayo_v4-claude-agentic: recon_ckpt=/cluster/maier/Agent4CT/checkpoints/ddpm_mayo_unconstrained_v4.pt, recon_mode=dps, recon_sample_steps=25, recon_eta=30.0, recon_init=fbp, recon_eta_clamp=False, recon_dcstep_every=0, recon_dcstep_n_cg=3, recon_dcstep_warmup=5, recon_dcstep_relax=1.0, val_n=214, train_n=0, rationale=iter-1 search-20260619-01 UNCONSTRAINED diff-recon vs reused Mayo DDPM v4 ckpt (ddpm_mayo_unconstrained_v4.pt, ch=96, sees all 10 Wagner patients). CORRECTED metric: val=ALL 214 L277 slices + 321px detector-geometry FOV (default). SOFT DATA-CONSISTENCY ONLY: recon_dcstep_every=0 turns OFF the hard CG projection so data consistency is enforced ONLY by the per-step DPS adaptive-weight gradient (eta=30/||resid||, soft). This is the sole knob distinguishing this from the constrained sibling (which used recon_dcstep_every=5 hard-DC and scored SSIM 0.394 / hr 0 in 1019s). Budget: T=25 DPS steps with NO extra CG iters = strictly fewer proj-equivalents/slice than the constrained run, so it fits the 20-min wall with more headroom (constrained 214 slices ran 17 min). recon_dcstep_n_cg/warmup/relax are INERT here (gated on every>0). HYPOTHESIS: unconstrained soft-DC diffusion-recon lands at/below the ~0.84 LD-FBP floor on real rebinned Mayo, likely near the constrained 0.394 but possibly DIFFERENT because soft DC enforces measurements more weakly than the constrained hard CG projection (weaker fidelity -> prior dominates more, could drift further from anatomy).", "advice_for_others": "diffusion_recon_dcstep_unconstrained_mayo_v4-claude-agentic: recon_ckpt=/cluster/maier/Agent4CT/checkpoints/ddpm_mayo_unconstrained_v4.pt, recon_mode=dps, recon_sample_steps=25, recon_eta=30.0, recon_init=fbp, recon_eta_clamp=False, recon_dcstep_every=0, recon_dcstep_n_cg=3, recon_dcstep_warmup=5, recon_dcstep_relax=1.0, val_n=214, train_n=0, rationale=iter-1 search-20260619-01 UNCONSTRAINED diff-recon vs reused Mayo DDPM v4 ckpt (ddpm_mayo_unconstrained_v4.pt, ch=96, sees all 10 Wagner patients). CORRECTED metric: val=ALL 214 L277 slices + 321px detector-geometry FOV (default). SOFT DATA-CONSISTENCY ONLY: recon_dcstep_every=0 turns OFF the hard CG projection so data consistency is enforced ONLY by the per-step DPS adaptive-weight gradient (eta=30/||resid||, soft). This is the sole knob distinguishing this from the constrained sibling (which used recon_dcstep_every=5 hard-DC and scored SSIM 0.394 / hr 0 in 1019s). Budget: T=25 DPS steps with NO extra CG iters = strictly fewer proj-equivalents/slice than the constrained run, so it fits the 20-min wall with more headroom (constrained 214 slices ran 17 min). recon_dcstep_n_cg/warmup/relax are INERT here (gated on every>0). HYPOTHESIS: unconstrained soft-DC diffusion-recon lands at/below the ~0.84 LD-FBP floor on real rebinned Mayo, likely near the constrained 0.394 but possibly DIFFERENT because soft DC enforces measurements more weakly than the constrained hard CG projection (weaker fidelity -> prior dominates more, could drift further from anatomy).", "comparison_image": "runs/mayo-ldct-claude-agentic-diff-recon-dcstep-unconstrained-mayo-v4-search-20260619-01/iterations/iter-0001/comparison.png"}
{"ts": "2026-06-19T15:49:08Z", "run_id": "mayo-ldct-claude-agentic-dual-domain-n2i-search-20260619-01", "iter": 1, "agent": "dual_domain_n2i-claude-agentic-breast-ct", "model": "claude-opus-4.7-1m", "change_class": "architecture", "status": "discard", "kept": false, "val_score": 0.8621627688407898, "headroom": 0.0, "params_M": 0.465762, "train_n": 400, "rationale": "dual_domain_n2i-claude-agentic: warm_start=True, pretrain_epochs=1, n_iter=15, grad_clip=1.0, unet_c=16, lr=0.001, batch_size=1, train_n=200, val_n=214, outer_wall_s=1080, per_scene_s=None, seed=42, rationale=iter-1 baseline + feasibility for PER-IMAGE Noise2Inverse (warm-start pre-pass on train split + per-scan Adam fit on each L277 val scans own measurements; commit 1f4c3394 per-image rewrite -- NEVER amortized) under the CORRECTED Mayo metric (search-20260619-01: val=ALL 214 L277 slices, 321px detector-geometry FOV). FAILURE MODE being managed: 214 independent per-scan Adam fits, each backpropping the 2304-view FBP adjoint, blow the 20-min wall at a naive n_iter (the discarded search-20260614-01 per-image iter-1 ran val_n=6 in 13.5 min @ n_iter=400 -> ~0.24 s/per-scan-step measured directly; 214 scenes is ~36x that scene count). MINIMAL-COST CONFIG: pretrain_epochs=1 (short warm-start; warm_start=True LOAD-BEARING-POSITIVE per knob insights, do NOT disable), n_iter=15 per-scan steps (tiny), grad_clip=1.0 (mandatory -- 2304-view adjoint overflows otherwise), unet_c=16, lr=1e-3. BUDGET MATH (0.25 s/per-scan-step measured on Mayo 2304-view/512/c16): warm 200x1=50s + 214 scenes x 15 x 0.25 = 802s + ~60s overhead = ~912s (~15 min), 16.6 min even at +10% per-step -- inside the 20-min budget. outer_wall_s=1080 in-solver backstop on the per-image loop so even if timing drifts it stops cleanly and RECORDS (no SLURM timeout). HYPOTHESIS: per-image N2I is FBP-bounded on dense rebinned 2304-view Mayo (half-view info loss < full-view LD-FBP) AND budget-starved at 214 slices (only 15 per-scan steps each); expect hr~0 near the LD-FBP baseline -- this iter-1 establishes the datapoint under the corrected metric (analogous to the NAF/structural-negative class). val=ALL 214 L277 (protocol; do NOT reduce below 214).", "advice_for_others": "dual_domain_n2i-claude-agentic: warm_start=True, pretrain_epochs=1, n_iter=15, grad_clip=1.0, unet_c=16, lr=0.001, batch_size=1, train_n=200, val_n=214, outer_wall_s=1080, per_scene_s=None, seed=42, rationale=iter-1 baseline + feasibility for PER-IMAGE Noise2Inverse (warm-start pre-pass on train split + per-scan Adam fit on each L277 val scans own measurements; commit 1f4c3394 per-image rewrite -- NEVER amortized) under the CORRECTED Mayo metric (search-20260619-01: val=ALL 214 L277 slices, 321px detector-geometry FOV). FAILURE MODE being managed: 214 independent per-scan Adam fits, each backpropping the 2304-view FBP adjoint, blow the 20-min wall at a naive n_iter (the discarded search-20260614-01 per-image iter-1 ran val_n=6 in 13.5 min @ n_iter=400 -> ~0.24 s/per-scan-step measured directly; 214 scenes is ~36x that scene count). MINIMAL-COST CONFIG: pretrain_epochs=1 (short warm-start; warm_start=True LOAD-BEARING-POSITIVE per knob insights, do NOT disable), n_iter=15 per-scan steps (tiny), grad_clip=1.0 (mandatory -- 2304-view adjoint overflows otherwise), unet_c=16, lr=1e-3. BUDGET MATH (0.25 s/per-scan-step measured on Mayo 2304-view/512/c16): warm 200x1=50s + 214 scenes x 15 x 0.25 = 802s + ~60s overhead = ~912s (~15 min), 16.6 min even at +10% per-step -- inside the 20-min budget. outer_wall_s=1080 in-solver backstop on the per-image loop so even if timing drifts it stops cleanly and RECORDS (no SLURM timeout). HYPOTHESIS: per-image N2I is FBP-bounded on dense rebinned 2304-view Mayo (half-view info loss < full-view LD-FBP) AND budget-starved at 214 slices (only 15 per-scan steps each); expect hr~0 near the LD-FBP baseline -- this iter-1 establishes the datapoint under the corrected metric (analogous to the NAF/structural-negative class). val=ALL 214 L277 (protocol; do NOT reduce below 214).", "comparison_image": "runs/mayo-ldct-claude-agentic-dual-domain-n2i-search-20260619-01/iterations/iter-0001/comparison.png"}
{"ts": "2026-06-19T15:48:03Z", "run_id": "mayo-ldct-claude-agentic-dual-domain-bilateral-n2i-search-20260619-01", "iter": 1, "agent": "dual_domain_bilateral_n2i-claude-agentic-breast-ct", "model": "claude-opus-4.7-1m", "change_class": "architecture", "status": "discard", "kept": false, "val_score": 0.9247666001319885, "headroom": 0.0, "params_M": 6e-06, "train_n": 400, "rationale": "dual_domain_bilateral_n2i-claude-agentic: warm_start=True, pretrain_epochs=1, pretrain_steps=20, n_iter=30, grad_clip=1.0, lr=0.005, proj_n_bf=1, img_n_bf=1, proj_kernel=5, proj_sx=1.0, proj_sy=2.0, proj_sr=0.02, img_kernel=7, img_sx=1.5, img_sy=1.5, img_sr=0.02, batch_size=1, train_n=200, val_n=214, outer_wall_s=1050, per_scene_s=None, seed=42, rationale=ITER-1 feasibility (search-20260619-01, corrected protocol). SOLVER: dual_domain_bilateral_n2i = PER-IMAGE Noise2Inverse with a trainable bilateral-filter stack (6 params: proj_n_bf=img_n_bf=1, 3 sigma each), self-supervised, warm-start pre-pass + per-scan fit. STAYS PER-IMAGE (warm-start amortized pre-pass on the 4 train patients to capture a generic BF-sigma init, then an INDEPENDENT per-scan Adam fit on EACH val slice OWN half-angle measurements, GT-free; NEVER revert to amortized train-then-forward). HARD-WIRED path (baked into solver/loader/evaluate_calibrated, NOT cfg keys): staged_canonical data, v3 mayo_ldct_fitted geometry (sod 595.362 / sdd 1086.803 / det_spacing 1.285044 / ps 0.700857), per-sample-ps half-angle projector swap (pipe.R_half per slice), bg_target=truth, val=ALL 214 L277 slices, metric=321px detector-geometry FOV (evaluate_calibrated default for AGENT4CT_DATASET=mayo_ldct_2d; no fov= override). SIX-BOX: (1) iter-1 baseline -- does per-image bilateral N2I run on Mayo at all under the corrected 214-slice/321px-FOV metric and record a finite val_score+comparison.png within the 20-min budget. (2) FAILURE MODE: 214 INDEPENDENT per-scan fits (each backprops the 2304-view FBP adjoint) blow the 20-min wall -- the breast/demo bilateral N2I runs fit only 16-24 scenes in ~4-23 min; 214 is ~9-13x worse, and the U-Net DD-C run timed out at 24 scenes/25 min. (3) MINIMAL-COST per-image bilateral config: per-scan n_iter=30 (cheap), warm-start short (pretrain_steps=20 cap, 1 ep), mid bilateral depth proj_n_bf=img_n_bf=1 at Wagner abdomen sigma defaults (kernel 5/7), grad_clip=1.0 MANDATORY (the 2304-view FBP adjoint overflows otherwise), in-solver outer_wall_s=1050 so it RECORDS even if not all 214 finish. (4) HYPOTHESIS: per-image bilateral N2I is FBP-bounded + budget-starved at 214 slices -> expect hr near 0 (at/below LD-FBP), because half-view N2I info loss < full-view FBP and the warm-start fixes the structural ceiling; the 6-param bilateral physically CANNOT overfit a scan so it may edge out the U-Net N2I on a clean read. (5) BUDGET MATH (HARD 20-min = 1200s train+score): anchored on Mayo bilateral N2I smoke 764666 (n_iter=40, val_n=2, per-image loop elapsed 10.3s => ~5.15 s/scene => ~0.129 s/(iter*scene) on the 2304-view adjoint; ~2x cheaper than the U-Net N2I 9.8 s/scene). At n_iter=30: 214*30*0.129 ~= 828s (13.8 min) + ~100s fixed startup (build 4 per-ps projectors + 214-slice LD-FBP baseline + score-214 + figure) ~= 16 min, fits inside 20-min with margin. n_iter=40 would be ~18.4 min + fixed ~= 20 min (too tight, risks the wall); n_iter=20 ~= 11 min (safe but gives the BF sigmas fewer steps to settle from warm-start). Chose n_iter=30 as the sane mid-cost; bilateral cannot overfit so more steps do not hurt. outer_wall_s=1050 (17.5 min) in-solver backstop guarantees a recorded result even if some slices run long; val stays ALL 214 (do NOT reduce val_n). (6) Do NOT return control mid-campaign.", "advice_for_others": "dual_domain_bilateral_n2i-claude-agentic: warm_start=True, pretrain_epochs=1, pretrain_steps=20, n_iter=30, grad_clip=1.0, lr=0.005, proj_n_bf=1, img_n_bf=1, proj_kernel=5, proj_sx=1.0, proj_sy=2.0, proj_sr=0.02, img_kernel=7, img_sx=1.5, img_sy=1.5, img_sr=0.02, batch_size=1, train_n=200, val_n=214, outer_wall_s=1050, per_scene_s=None, seed=42, rationale=ITER-1 feasibility (search-20260619-01, corrected protocol). SOLVER: dual_domain_bilateral_n2i = PER-IMAGE Noise2Inverse with a trainable bilateral-filter stack (6 params: proj_n_bf=img_n_bf=1, 3 sigma each), self-supervised, warm-start pre-pass + per-scan fit. STAYS PER-IMAGE (warm-start amortized pre-pass on the 4 train patients to capture a generic BF-sigma init, then an INDEPENDENT per-scan Adam fit on EACH val slice OWN half-angle measurements, GT-free; NEVER revert to amortized train-then-forward). HARD-WIRED path (baked into solver/loader/evaluate_calibrated, NOT cfg keys): staged_canonical data, v3 mayo_ldct_fitted geometry (sod 595.362 / sdd 1086.803 / det_spacing 1.285044 / ps 0.700857), per-sample-ps half-angle projector swap (pipe.R_half per slice), bg_target=truth, val=ALL 214 L277 slices, metric=321px detector-geometry FOV (evaluate_calibrated default for AGENT4CT_DATASET=mayo_ldct_2d; no fov= override). SIX-BOX: (1) iter-1 baseline -- does per-image bilateral N2I run on Mayo at all under the corrected 214-slice/321px-FOV metric and record a finite val_score+comparison.png within the 20-min budget. (2) FAILURE MODE: 214 INDEPENDENT per-scan fits (each backprops the 2304-view FBP adjoint) blow the 20-min wall -- the breast/demo bilateral N2I runs fit only 16-24 scenes in ~4-23 min; 214 is ~9-13x worse, and the U-Net DD-C run timed out at 24 scenes/25 min. (3) MINIMAL-COST per-image bilateral config: per-scan n_iter=30 (cheap), warm-start short (pretrain_steps=20 cap, 1 ep), mid bilateral depth proj_n_bf=img_n_bf=1 at Wagner abdomen sigma defaults (kernel 5/7), grad_clip=1.0 MANDATORY (the 2304-view FBP adjoint overflows otherwise), in-solver outer_wall_s=1050 so it RECORDS even if not all 214 finish. (4) HYPOTHESIS: per-image bilateral N2I is FBP-bounded + budget-starved at 214 slices -> expect hr near 0 (at/below LD-FBP), because half-view N2I info loss < full-view FBP and the warm-start fixes the structural ceiling; the 6-param bilateral physically CANNOT overfit a scan so it may edge out the U-Net N2I on a clean read. (5) BUDGET MATH (HARD 20-min = 1200s train+score): anchored on Mayo bilateral N2I smoke 764666 (n_iter=40, val_n=2, per-image loop elapsed 10.3s => ~5.15 s/scene => ~0.129 s/(iter*scene) on the 2304-view adjoint; ~2x cheaper than the U-Net N2I 9.8 s/scene). At n_iter=30: 214*30*0.129 ~= 828s (13.8 min) + ~100s fixed startup (build 4 per-ps projectors + 214-slice LD-FBP baseline + score-214 + figure) ~= 16 min, fits inside 20-min with margin. n_iter=40 would be ~18.4 min + fixed ~= 20 min (too tight, risks the wall); n_iter=20 ~= 11 min (safe but gives the BF sigmas fewer steps to settle from warm-start). Chose n_iter=30 as the sane mid-cost; bilateral cannot overfit so more steps do not hurt. outer_wall_s=1050 (17.5 min) in-solver backstop guarantees a recorded result even if some slices run long; val stays ALL 214 (do NOT reduce val_n). (6) Do NOT return control mid-campaign.", "comparison_image": "runs/mayo-ldct-claude-agentic-dual-domain-bilateral-n2i-search-20260619-01/iterations/iter-0001/comparison.png"}
