{"ts": "2026-06-20T06:45:32Z", "run_id": "mayo-ldct-claude-agentic-uswin-search-20260619-01", "iter": 5, "agent": "uswin-claude-agentic", "model": "claude-opus-4-8-1m", "change_class": "architecture", "status": "keep", "kept": true, "val_score": 0.9216899275779724, "headroom": 0.3828721588912174, "params_M": 3.954049, "train_n": 400, "rationale": "uswin-claude-agentic: train_n=480, val_n=214, epochs=26, batch_size=4, lr=0.0005, uswin_c=24, swin_window=8, swin_heads=4, grad_clip=1.0, max_train_s=980, seed=42, rationale=ITER-5 (search-20260619-01, corrected protocol). START FROM iter-3 BEST (c24/ep64), NOT iter-4's c32. ONE KNOB: TRAINING DATA train_n 200 -> 480 (2.4x), with epochs TRADED DOWN 64 -> 26 to fit the HARD 20-min (1200s) train+score wall. uswin_c reverts 32 -> 24 (iter-3 best), all else identical to iter-3 (val_n=214, bs=4, lr=5e-4, swin_window=8, swin_heads=4, grad_clip=1.0, seed=42). SIX-BOX (NUMBERS). (1) iter-3 BEST: SSIM 0.924443 / hr 0.353196 / PSNR 37.86 in elapsed_s=1085.87, train_n=200, c24, ep64 (#2 on the Mayo board). iter-4 (c32/ep34) REGRESSED to hr 0.272533 (SSIM 0.892773) in 760.76s -> the capacity-for-epochs trade FAILED: ep34 under-trained the 6.9M-param c32 net more than the added capacity helped (iter-4's own falsifier (b): revert to c24 and treat 0.3532 as ceiling UNLESS an untried lever exists). (2) LIMITER: epochs are WALL-LOCKED (iter-3 ep64 used 1085.87s = 90.5pct of 1200s; ep72 would bust) AND show diminishing returns (+0.149 hr over ep10->40 but only +0.031 over ep40->64); capacity REGRESSED (iter-4). The ONE untried lever is DATA-COVERAGE: iter-3 trained on a FIXED stratified subset of train_n=200 / 579-slice pool = 34.5pct coverage. CRUCIAL MECHANISM CHECK: solver_uswin.py does NOT use RotatingSubsetDataset -- build_dataset calls load_val_split once for a FIXED train_n set, and the epoch loop does perm=torch.randperm(cfg['train_n']) over the SAME samples every epoch (no set_epoch rotation). So train_n IS a live lever (NOT inert): raising it loads strictly more DISTINCT slices the model sees every epoch. load_val_split round-robins across the 3 Mayo ps-groups (patients: 0.66192->154, 0.73979->98, 0.77873->327; pool=579), so train_n=480 spans all 3 patients (82.9pct coverage) -> better generalisation to held-out val patient L277. uswin is data-coverage-limited at train_n=200. (3) ONE KNOB: train_n 200->480 (epochs 64->26 is a forced budget-trade, not a second free knob; c reverts to iter-3's 24). BUDGET-TRADE MATH (worst-case-sized): iter-3 exact calibration (validated to the second): per_epoch_200 = (1085.87-737.72)/(64-40) = 14.51 s/epoch at train_n=200 -> per_sample_epoch = 14.51/200 = 0.07255 s; fixed (data load + 214-slice per-sample val + figure I/O, train_n-independent since val is fixed at 214) = 157.3s. At train_n=480 per_epoch = 480*0.07255 = 34.82 s/epoch. WORST CASE (+10pct/sample variance, +5pct fixed): ep26 worst elapsed = 165.2 + 26*480*0.07981 = 1161s = 19.4 min (39s margin inside 1200s); ep28 worst = 1238s BUSTS -> ep26 is the LARGEST epoch count guaranteed to fit even the worst case. REALISTIC: ep26 = 157.3 + 26*34.82 = 1063s = 17.7 min (comfortable). Train-only worst = 26*480*0.07981 = 996s; max_train_s=980 set as the HARD train-only backstop so even at hot per-sample cost train halts <=980s leaving >=220s for the worst-case 214-slice val+figure inside the 1200s budget. (4) HYPOTHESIS: more training data (200->480 distinct slices spanning all 3 train patients) lifts hr above the iter-3 0.353196, because uswin's hr flattened with epochs (training-basin at 200 samples) AND regressed with capacity (iter-4) -- the remaining slack is GENERALISATION to the unseen val patient, which broader patient coverage addresses. Predicted iter-5 hr ~0.37-0.40. FALSIFIER (NUMBERS): if hr <= 0.353196 at train_n=480/ep26, uswin is at its budget-constrained ceiling (~0.35) on this val set and ALL three levers (epochs, capacity, data) are exhausted -> iter-6 reverts to the iter-3 c24/ep64/train_n=200 config and accepts 0.3532 as the uswin Mayo ceiling. (5) HARD 20-min train+score budget; val_n=214 = ALL L277 slices (NOT reduced); grad_clip=1.0 retained (mandatory; the 2304-view Mayo FBP adjoint amplifies gradients). HARD-WIRED (unchanged): staged_canonical v3 mayo_ldct_fitted geometry, per-sample-ps FBP, bg_target=truth, metric=321px detector-geometry FOV (evaluate_calibrated default for AGENT4CT_DATASET=mayo_ldct_2d; no fov= override). (6) no control return.", "advice_for_others": "uswin-claude-agentic: train_n=480, val_n=214, epochs=26, batch_size=4, lr=0.0005, uswin_c=24, swin_window=8, swin_heads=4, grad_clip=1.0, max_train_s=980, seed=42, rationale=ITER-5 (search-20260619-01, corrected protocol). START FROM iter-3 BEST (c24/ep64), NOT iter-4's c32. ONE KNOB: TRAINING DATA train_n 200 -> 480 (2.4x), with epochs TRADED DOWN 64 -> 26 to fit the HARD 20-min (1200s) train+score wall. uswin_c reverts 32 -> 24 (iter-3 best), all else identical to iter-3 (val_n=214, bs=4, lr=5e-4, swin_window=8, swin_heads=4, grad_clip=1.0, seed=42). SIX-BOX (NUMBERS). (1) iter-3 BEST: SSIM 0.924443 / hr 0.353196 / PSNR 37.86 in elapsed_s=1085.87, train_n=200, c24, ep64 (#2 on the Mayo board). iter-4 (c32/ep34) REGRESSED to hr 0.272533 (SSIM 0.892773) in 760.76s -> the capacity-for-epochs trade FAILED: ep34 under-trained the 6.9M-param c32 net more than the added capacity helped (iter-4's own falsifier (b): revert to c24 and treat 0.3532 as ceiling UNLESS an untried lever exists). (2) LIMITER: epochs are WALL-LOCKED (iter-3 ep64 used 1085.87s = 90.5pct of 1200s; ep72 would bust) AND show diminishing returns (+0.149 hr over ep10->40 but only +0.031 over ep40->64); capacity REGRESSED (iter-4). The ONE untried lever is DATA-COVERAGE: iter-3 trained on a FIXED stratified subset of train_n=200 / 579-slice pool = 34.5pct coverage. CRUCIAL MECHANISM CHECK: solver_uswin.py does NOT use RotatingSubsetDataset -- build_dataset calls load_val_split once for a FIXED train_n set, and the epoch loop does perm=torch.randperm(cfg['train_n']) over the SAME samples every epoch (no set_epoch rotation). So train_n IS a live lever (NOT inert): raising it loads strictly more DISTINCT slices the model sees every epoch. load_val_split round-robins across the 3 Mayo ps-groups (patients: 0.66192->154, 0.73979->98, 0.77873->327; pool=579), so train_n=480 spans all 3 patients (82.9pct coverage) -> better generalisation to held-out val patient L277. uswin is data-coverage-limited at train_n=200. (3) ONE KNOB: train_n 200->480 (epochs 64->26 is a forced budget-trade, not a second free knob; c reverts to iter-3's 24). BUDGET-TRADE MATH (worst-case-sized): iter-3 exact calibration (validated to the second): per_epoch_200 = (1085.87-737.72)/(64-40) = 14.51 s/epoch at train_n=200 -> per_sample_epoch = 14.51/200 = 0.07255 s; fixed (data load + 214-slice per-sample val + figure I/O, train_n-independent since val is fixed at 214) = 157.3s. At train_n=480 per_epoch = 480*0.07255 = 34.82 s/epoch. WORST CASE (+10pct/sample variance, +5pct fixed): ep26 worst elapsed = 165.2 + 26*480*0.07981 = 1161s = 19.4 min (39s margin inside 1200s); ep28 worst = 1238s BUSTS -> ep26 is the LARGEST epoch count guaranteed to fit even the worst case. REALISTIC: ep26 = 157.3 + 26*34.82 = 1063s = 17.7 min (comfortable). Train-only worst = 26*480*0.07981 = 996s; max_train_s=980 set as the HARD train-only backstop so even at hot per-sample cost train halts <=980s leaving >=220s for the worst-case 214-slice val+figure inside the 1200s budget. (4) HYPOTHESIS: more training data (200->480 distinct slices spanning all 3 train patients) lifts hr above the iter-3 0.353196, because uswin's hr flattened with epochs (training-basin at 200 samples) AND regressed with capacity (iter-4) -- the remaining slack is GENERALISATION to the unseen val patient, which broader patient coverage addresses. Predicted iter-5 hr ~0.37-0.40. FALSIFIER (NUMBERS): if hr <= 0.353196 at train_n=480/ep26, uswin is at its budget-constrained ceiling (~0.35) on this val set and ALL three levers (epochs, capacity, data) are exhausted -> iter-6 reverts to the iter-3 c24/ep64/train_n=200 config and accepts 0.3532 as the uswin Mayo ceiling. (5) HARD 20-min train+score budget; val_n=214 = ALL L277 slices (NOT reduced); grad_clip=1.0 retained (mandatory; the 2304-view Mayo FBP adjoint amplifies gradients). HARD-WIRED (unchanged): staged_canonical v3 mayo_ldct_fitted geometry, per-sample-ps FBP, bg_target=truth, metric=321px detector-geometry FOV (evaluate_calibrated default for AGENT4CT_DATASET=mayo_ldct_2d; no fov= override). (6) no control return.", "comparison_image": "runs/mayo-ldct-claude-agentic-uswin-search-20260619-01/iterations/iter-0005/comparison.png"}
{"ts": "2026-06-20T06:42:53Z", "run_id": "mayo-ldct-claude-agentic-itnet-v3-search-20260619-01", "iter": 5, "agent": "itnet_v3-claude-agentic", "model": "claude-opus-4-8-1m", "change_class": "architecture", "status": "keep", "kept": true, "val_score": 0.9157627820968628, "headroom": 0.3288419203723635, "params_M": 3.698994, "train_n": 400, "rationale": "itnet_v3-claude-agentic: itnet_k=3, unet_c=16, alpha_init=0.0037, lr=0.0001, epochs=9, batch_size=1, val_chunk=1, train_n=400, val_n=214, grad_clip=1.0, max_train_s=720, seed=42, rationale=iter-5 (search-20260619-01, corrected protocol). START FROM iter-3 BEST (c16/ep18, hr 0.3123), NOT iter-4's regressed c24. ONE KNOB: train_n 200 -> 400 (TRAINING DATA = the one untried lever), with epochs traded DOWN 18 -> 9 to (a) hold total gradient steps at PARITY with iter-3 best (400*9 = 3600 = 200*18) so any hr change isolates DATA COVERAGE, not extra optimization, and (b) fit the HARD 20-min train+score wall. All else = iter-3 best exactly (itnet_k=3, unet_c=16, alpha_init=0.0037, lr=1e-4, val_n=214, grad_clip=1.0, seed=42). SIX-BOX (NUMBERS): (1) iter-3 BEST = SSIM 0.904773 / hr 0.312282 / PSNR 37.33 / RMSE 0.000680 at c16/ep18/train_n=200, elapsed 1072.94s = 17.88 min, params 3.699M. iter-4 (c24/ep9, capacity-up) REGRESSED to SSIM 0.899304 / hr 0.295576 -> capacity is NOT the lever; revert to c16. (2) LIMITER: epochs PLATEAUED (iter-2 ep14 hr 0.3101 -> iter-3 ep18 hr 0.3123, +0.0022, SSIM even dropped) AND capacity-for-epochs REGRESSED (iter-4). The remaining limiter is DATA COVERAGE: the itnet_v3 solver loads a FIXED stratified train subset ONCE via build_dataset -> load_val_split(split='train', n=train_n) (solver_itnet_v3.py lines 198-199) and merely RESHUFFLES that same subset every epoch (torch.randperm(train_n), line 235). It does NOT use RotatingSubsetDataset, so train_n=200 means the net has only ever seen 200 of the 579 available train slices -> data-coverage-limited. train_n IS load-bearing here (NOT inert): the full pool is 579 slices across 3 ps-groups/patients (154 @0.66192, 98 @0.73979, 327 @0.77873); train_n=200 used only 35pct of it. (3) ONE KNOB: train_n 200 -> 400 (2x distinct slices = 69pct of the 579-slice pool; the stratified round-robin spans all 3 train patients more densely). epochs traded 18 -> 9 to fund it at grad-step parity (3600). (4) HYPOTHESIS: doubling distinct training slices (200 -> 400) lifts hr above the 0.3123 iter-3 best, because itnet_v3 is data-coverage-limited (epochs + capacity both exhausted) and a denser, more representative train set generalises better to the held-out L277 val patient. FALSIFIER (NUMBERS): if hr <= 0.3123 at train_n=400 (all else iter-3-best, grad steps held at 3600), itnet_v3 is at its budget-constrained ceiling (~0.31) on this 214-slice / 321px-FOV Mayo val set with ALL three levers (epochs, capacity, data) exhausted -> iter-6 would have to change the metric basis or accept the ceiling. (5) BUDGET (HARD 20-min = 1200s train+score): from the three c16/train_n=200 points (8,737.85),(14,1010.07),(18,1072.94) a least-squares fit gives per-epoch 34.45 s/epoch (covering 200 samples) + fixed 481.0 s (data load + per-sample-ps projector cache + 214-slice per-sample val + figure + startup). Per-epoch scales LINEARLY with train_n (bs=1 -> train_n steps/epoch), so train_n=400 -> per-epoch 68.9 s. At epochs=9: 481.0 + 9*68.9 = 1101 s = 18.35 min < 1200 s with ~99 s headroom. epochs=10 -> 1170 s = 19.5 min (tight); epochs=9 is the safe largest count at train_n=400 that also holds grad-step parity. Train alone at 9 ep = 9*68.9 = 620 s < max_train_s=720 backstop, so the backstop does not truncate (checks between epochs; only fences runaway slowdown) and a finite recon + 214-slice val + figure always land inside the 30-min sbatch wall. val stays ALL 214 L277 slices, 321px detector-geometry FOV (evaluate_calibrated default for AGENT4CT_DATASET=mayo_ldct_2d; no fov= override). grad_clip=1.0 retained (mandatory: the 2304-view Mayo FBP adjoint inside dc_step overflows otherwise). HARD-WIRED (unchanged): staged_canonical v3 mayo_ldct_fitted geometry, per-sample-ps FBP init + per-sample itnet.projector swap for the k=3 DC steps, bg_target=truth. (6) do NOT return control mid-campaign. Predicted iter-5 hr: >0.3123 (target 0.32-0.34) if data-coverage-limited hypothesis holds; <=0.3123 falsifies -> budget-constrained ceiling, all levers exhausted.", "advice_for_others": "itnet_v3-claude-agentic: itnet_k=3, unet_c=16, alpha_init=0.0037, lr=0.0001, epochs=9, batch_size=1, val_chunk=1, train_n=400, val_n=214, grad_clip=1.0, max_train_s=720, seed=42, rationale=iter-5 (search-20260619-01, corrected protocol). START FROM iter-3 BEST (c16/ep18, hr 0.3123), NOT iter-4's regressed c24. ONE KNOB: train_n 200 -> 400 (TRAINING DATA = the one untried lever), with epochs traded DOWN 18 -> 9 to (a) hold total gradient steps at PARITY with iter-3 best (400*9 = 3600 = 200*18) so any hr change isolates DATA COVERAGE, not extra optimization, and (b) fit the HARD 20-min train+score wall. All else = iter-3 best exactly (itnet_k=3, unet_c=16, alpha_init=0.0037, lr=1e-4, val_n=214, grad_clip=1.0, seed=42). SIX-BOX (NUMBERS): (1) iter-3 BEST = SSIM 0.904773 / hr 0.312282 / PSNR 37.33 / RMSE 0.000680 at c16/ep18/train_n=200, elapsed 1072.94s = 17.88 min, params 3.699M. iter-4 (c24/ep9, capacity-up) REGRESSED to SSIM 0.899304 / hr 0.295576 -> capacity is NOT the lever; revert to c16. (2) LIMITER: epochs PLATEAUED (iter-2 ep14 hr 0.3101 -> iter-3 ep18 hr 0.3123, +0.0022, SSIM even dropped) AND capacity-for-epochs REGRESSED (iter-4). The remaining limiter is DATA COVERAGE: the itnet_v3 solver loads a FIXED stratified train subset ONCE via build_dataset -> load_val_split(split='train', n=train_n) (solver_itnet_v3.py lines 198-199) and merely RESHUFFLES that same subset every epoch (torch.randperm(train_n), line 235). It does NOT use RotatingSubsetDataset, so train_n=200 means the net has only ever seen 200 of the 579 available train slices -> data-coverage-limited. train_n IS load-bearing here (NOT inert): the full pool is 579 slices across 3 ps-groups/patients (154 @0.66192, 98 @0.73979, 327 @0.77873); train_n=200 used only 35pct of it. (3) ONE KNOB: train_n 200 -> 400 (2x distinct slices = 69pct of the 579-slice pool; the stratified round-robin spans all 3 train patients more densely). epochs traded 18 -> 9 to fund it at grad-step parity (3600). (4) HYPOTHESIS: doubling distinct training slices (200 -> 400) lifts hr above the 0.3123 iter-3 best, because itnet_v3 is data-coverage-limited (epochs + capacity both exhausted) and a denser, more representative train set generalises better to the held-out L277 val patient. FALSIFIER (NUMBERS): if hr <= 0.3123 at train_n=400 (all else iter-3-best, grad steps held at 3600), itnet_v3 is at its budget-constrained ceiling (~0.31) on this 214-slice / 321px-FOV Mayo val set with ALL three levers (epochs, capacity, data) exhausted -> iter-6 would have to change the metric basis or accept the ceiling. (5) BUDGET (HARD 20-min = 1200s train+score): from the three c16/train_n=200 points (8,737.85),(14,1010.07),(18,1072.94) a least-squares fit gives per-epoch 34.45 s/epoch (covering 200 samples) + fixed 481.0 s (data load + per-sample-ps projector cache + 214-slice per-sample val + figure + startup). Per-epoch scales LINEARLY with train_n (bs=1 -> train_n steps/epoch), so train_n=400 -> per-epoch 68.9 s. At epochs=9: 481.0 + 9*68.9 = 1101 s = 18.35 min < 1200 s with ~99 s headroom. epochs=10 -> 1170 s = 19.5 min (tight); epochs=9 is the safe largest count at train_n=400 that also holds grad-step parity. Train alone at 9 ep = 9*68.9 = 620 s < max_train_s=720 backstop, so the backstop does not truncate (checks between epochs; only fences runaway slowdown) and a finite recon + 214-slice val + figure always land inside the 30-min sbatch wall. val stays ALL 214 L277 slices, 321px detector-geometry FOV (evaluate_calibrated default for AGENT4CT_DATASET=mayo_ldct_2d; no fov= override). grad_clip=1.0 retained (mandatory: the 2304-view Mayo FBP adjoint inside dc_step overflows otherwise). HARD-WIRED (unchanged): staged_canonical v3 mayo_ldct_fitted geometry, per-sample-ps FBP init + per-sample itnet.projector swap for the k=3 DC steps, bg_target=truth. (6) do NOT return control mid-campaign. Predicted iter-5 hr: >0.3123 (target 0.32-0.34) if data-coverage-limited hypothesis holds; <=0.3123 falsifies -> budget-constrained ceiling, all levers exhausted.", "comparison_image": "runs/mayo-ldct-claude-agentic-itnet-v3-search-20260619-01/iterations/iter-0005/comparison.png"}
