{"ts": "2026-06-20T03:25:31Z", "run_id": "mayo-ldct-claude-agentic-learned-primal-dual-search-20260619-01", "iter": 4, "agent": "learned_primal_dual-claude-agentic", "model": "claude-opus-4-8-1m", "change_class": "architecture", "status": "discard", "kept": false, "val_score": 0.8980332016944885, "headroom": 0.0, "params_M": 0.155406, "train_n": 400, "rationale": "learned_primal_dual-claude-agentic: lpd_iters=3, lpd_hidden=48, lpd_n_primal=5, lpd_n_dual=5, lpd_share_weights=False, lr=0.0007, lr_schedule=cosine, epochs=10, batch_size=1, val_chunk=1, train_n=200, val_n=214, grad_clip=1.0, seed=42, rationale=iter-4 search-20260619-01: ONE knob = lr 5e-4 -> 7e-4 (everything else held at iter-2's BUDGET-COMPLIANT point: lpd_iters=3, hidden=48, n_primal=5, n_dual=5, cosine, epochs=10, train_n=200, batch=1, val_chunk=1, val_n=214, grad_clip=1.0, seed=42). LIMITER = now WALL-LIMITED on epochs, NOT capacity. SSIM is still climbing on epochs (iter-1 iters5/ep6 0.84271 @1149.5s; iter-2 iters3/ep10 0.863635 @1079.3s=17.99min; iter-3 iters3/ep11 0.885115 @1213.6s=20.23min) BUT iter-3 OVERSHOT the HARD 1200s/20-min budget: true marginal epoch cost = 1213.6-1079.3 = 134.3 s/epoch (higher than iter-3's 107.9s estimate), so ep12 would land ~1348s=22.5min, well over the wall. Epochs cannot go up. Per the no-trade-epochs-for-capacity rule, lpd_hidden^ and lpd_iters^ are also OFF (both add per-sample projector fwd+adj cost and blow the wall; iter-1 at iters=5 already hit 19.16min). The remaining wall-NEUTRAL lever is lr: at the budget-capped epoch count, a higher lr lets the cosine schedule traverse more of the loss landscape per epoch, extracting more training progress WITHOUT buying epochs or capacity. lr 7e-4 (NOT 6e-4: the prior run flagged lr~6e-4 as an ANOMALOUS COLLAPSE point; 7e-4 was a stable trained 0.9638 point) is the safe lr-up step. Epochs set back to 10 (iter-2's count, ran 1079.3s=18.0min, safely inside 1200s) to RESTORE the budget margin iter-3 broke. BUDGET MATH vs 1200s: iter-2 ran 1079.3s at ep10 -> iter-4 at the same ep10 + lr-only change is compute-identical (lr does not change FLOPs) => ~1079s=18.0min, well inside the 20-min wall. HYP: at the budget-capped ep10, lr 7e-4 extracts more SSIM per epoch than 5e-4 (faster cosine traversal), lifting SSIM toward clearing the LD-FBP floor (hr>0); predict ~0.87-0.89. FALSIFIER: SSIM <= 0.885115 (iter-3) OR flat/down with hr still 0.000 => LPD has hit its budget-constrained ceiling on 2304-view Mayo (~0.885 SSIM, hr 0); neither epochs (wall-capped) nor lr is the lever -> projector-in-loop LPD is structurally FBP-bounded at this capacity/budget (documented ceiling), and iter-5 would need a deeper wall, not more of this budget.", "advice_for_others": "learned_primal_dual-claude-agentic: lpd_iters=3, lpd_hidden=48, lpd_n_primal=5, lpd_n_dual=5, lpd_share_weights=False, lr=0.0007, lr_schedule=cosine, epochs=10, batch_size=1, val_chunk=1, train_n=200, val_n=214, grad_clip=1.0, seed=42, rationale=iter-4 search-20260619-01: ONE knob = lr 5e-4 -> 7e-4 (everything else held at iter-2's BUDGET-COMPLIANT point: lpd_iters=3, hidden=48, n_primal=5, n_dual=5, cosine, epochs=10, train_n=200, batch=1, val_chunk=1, val_n=214, grad_clip=1.0, seed=42). LIMITER = now WALL-LIMITED on epochs, NOT capacity. SSIM is still climbing on epochs (iter-1 iters5/ep6 0.84271 @1149.5s; iter-2 iters3/ep10 0.863635 @1079.3s=17.99min; iter-3 iters3/ep11 0.885115 @1213.6s=20.23min) BUT iter-3 OVERSHOT the HARD 1200s/20-min budget: true marginal epoch cost = 1213.6-1079.3 = 134.3 s/epoch (higher than iter-3's 107.9s estimate), so ep12 would land ~1348s=22.5min, well over the wall. Epochs cannot go up. Per the no-trade-epochs-for-capacity rule, lpd_hidden^ and lpd_iters^ are also OFF (both add per-sample projector fwd+adj cost and blow the wall; iter-1 at iters=5 already hit 19.16min). The remaining wall-NEUTRAL lever is lr: at the budget-capped epoch count, a higher lr lets the cosine schedule traverse more of the loss landscape per epoch, extracting more training progress WITHOUT buying epochs or capacity. lr 7e-4 (NOT 6e-4: the prior run flagged lr~6e-4 as an ANOMALOUS COLLAPSE point; 7e-4 was a stable trained 0.9638 point) is the safe lr-up step. Epochs set back to 10 (iter-2's count, ran 1079.3s=18.0min, safely inside 1200s) to RESTORE the budget margin iter-3 broke. BUDGET MATH vs 1200s: iter-2 ran 1079.3s at ep10 -> iter-4 at the same ep10 + lr-only change is compute-identical (lr does not change FLOPs) => ~1079s=18.0min, well inside the 20-min wall. HYP: at the budget-capped ep10, lr 7e-4 extracts more SSIM per epoch than 5e-4 (faster cosine traversal), lifting SSIM toward clearing the LD-FBP floor (hr>0); predict ~0.87-0.89. FALSIFIER: SSIM <= 0.885115 (iter-3) OR flat/down with hr still 0.000 => LPD has hit its budget-constrained ceiling on 2304-view Mayo (~0.885 SSIM, hr 0); neither epochs (wall-capped) nor lr is the lever -> projector-in-loop LPD is structurally FBP-bounded at this capacity/budget (documented ceiling), and iter-5 would need a deeper wall, not more of this budget.", "comparison_image": "runs/mayo-ldct-claude-agentic-learned-primal-dual-search-20260619-01/iterations/iter-0004/comparison.png"}
{"ts": "2026-06-20T03:07:09Z", "run_id": "mayo-ldct-claude-agentic-itnet-v3-search-20260619-01", "iter": 4, "agent": "itnet_v3-claude-agentic", "model": "claude-opus-4-8-1m", "change_class": "architecture", "status": "keep", "kept": true, "val_score": 0.8993039131164551, "headroom": 0.2955762764289155, "params_M": 8.317706, "train_n": 400, "rationale": "itnet_v3-claude-agentic: itnet_k=3, unet_c=24, alpha_init=0.0037, lr=0.0001, epochs=9, batch_size=1, val_chunk=1, train_n=200, val_n=214, grad_clip=1.0, max_train_s=780, seed=42, rationale=iter-4 (search-20260619-01, corrected protocol). ONE KNOB: unet_c 16 -> 24 (CAPACITY), with epochs traded DOWN 18 -> 9 to fund the bigger net inside the HARD 20-min train+score wall. All else = iter-3 exactly (itnet_k=3, alpha_init=0.0037, lr=1e-4, train_n=200, val_n=214, grad_clip=1.0, seed=42); max_train_s lowered 900 -> 780 as a tighter train backstop for the slower c=24 net. SIX-BOX (NUMBERS): (1) iter-1 ep8 -> SSIM 0.895903 / hr 0.268409, elapsed 737.85s=12.30min; iter-2 ep14 -> SSIM 0.908534 / hr 0.310054, elapsed 1010.07s=16.83min; iter-3 ep18 -> SSIM 0.904773 / hr 0.312282, elapsed 1072.94s=17.88min. The epochs lever has PLATEAUED: iter-2 ep14 -> iter-3 ep18 gave hr +0.0022 only (0.310054 -> 0.312282) AND SSIM DROPPED (0.908534 -> 0.904773). iter-3's own falsifier (hr <= 0.310 at ep18 => capacity-limited) effectively FIRED -> itnet_v3 is CAPACITY-limited at unet_c=16, not training-convergence-limited. unet_c=16 is the current capacity; epochs=18 is the current count. (2) LIMITER NOW = model CAPACITY at c=16 (epochs plateaued AND iter-3 used 17.88/20 min so epochs cannot be raised further inside the wall anyway). (3) ONE KNOB: unet_c 16 -> 24 (params 3.70M -> ~8.3M, ~2.25x conv FLOPs). epochs traded DOWN 18 -> 9 to keep train+score inside 1200s. itnet_v3 is the END-TO-END unrolled variant (unlike v1/v2's pretrain-denoiser-then-DC), so added denoiser capacity is trained against the full recon objective and should genuinely lift the ceiling. (4) HYPOTHESIS: more denoiser capacity (c=24) lifts hr above 0.3123 even at only 9 epochs, because the c=16 net had saturated its representational headroom (ep14->18 flat). FALSIFIER (NUMBERS): if hr <= 0.3123 at c=24/ep9, itnet_v3 has hit its representational ceiling on this 214-slice val set (added capacity does not help OR 9 epochs is too few to train the bigger net) -> iter-5 must either give the bigger net more epochs (trade train_n down to buy them) or pivot to lr/itnet_k. (5) BUDGET (HARD 20-min = 1200s train+score), CAPACITY-vs-EPOCHS trade math: measured c=16 timing over 3 points (8,737.85),(14,1010.07),(18,1072.94) gives full-span per-epoch (1072.94-737.85)/(18-8)=33.5 s/epoch and fixed cost (data load + per-sample-ps projector cache + 214-slice per-sample val + figure + startup) 737.85-8*33.5=469.8 s. Raising c 16->24 scales the UNet conv FLOPs by (24/16)^2=2.25x, but the k=3 DC steps run the 2304-view projector fwd+adj which is FLAT in c, so per-epoch does NOT fully 2.25x. Conservative split (UNet ~half of per-epoch train, half is projector/data; only ~25pct of fixed is the c-scaling val UNet-forward): per-epoch@c24 ~= 52-60 s, fixed@c24 ~= 631 s. At epochs=9: 631 + 9*~56 = ~1135s = 18.9 min < 1200s even pessimistically (unet_share=0.6 case = 19.57 min, still OK); epochs=10 risks the wall in the pessimistic case (20.6 min), epochs=8 wastes headroom. So epochs=9 is the largest count that the c=24 timing safely permits inside 20 min. max_train_s=780 fences the train phase (9*~56=~504s expected, well under 780) so a finite recon + 214-slice val + figure always land inside the 30-min sbatch wall. val stays ALL 214 L277 slices, 321px detector-geometry FOV (evaluate_calibrated default for AGENT4CT_DATASET=mayo_ldct_2d; no fov= override). grad_clip=1.0 retained (mandatory: the 2304-view Mayo FBP adjoint inside dc_step overflows otherwise). HARD-WIRED (unchanged): staged_canonical v3 mayo_ldct_fitted geometry, per-sample-ps FBP init + per-sample itnet.projector swap for the k=3 DC steps, bg_target=truth. (6) do NOT return control mid-campaign. Predicted iter-4 hr: 0.32-0.35 if capacity-limited hypothesis holds; <=0.3123 falsifies.", "advice_for_others": "itnet_v3-claude-agentic: itnet_k=3, unet_c=24, alpha_init=0.0037, lr=0.0001, epochs=9, batch_size=1, val_chunk=1, train_n=200, val_n=214, grad_clip=1.0, max_train_s=780, seed=42, rationale=iter-4 (search-20260619-01, corrected protocol). ONE KNOB: unet_c 16 -> 24 (CAPACITY), with epochs traded DOWN 18 -> 9 to fund the bigger net inside the HARD 20-min train+score wall. All else = iter-3 exactly (itnet_k=3, alpha_init=0.0037, lr=1e-4, train_n=200, val_n=214, grad_clip=1.0, seed=42); max_train_s lowered 900 -> 780 as a tighter train backstop for the slower c=24 net. SIX-BOX (NUMBERS): (1) iter-1 ep8 -> SSIM 0.895903 / hr 0.268409, elapsed 737.85s=12.30min; iter-2 ep14 -> SSIM 0.908534 / hr 0.310054, elapsed 1010.07s=16.83min; iter-3 ep18 -> SSIM 0.904773 / hr 0.312282, elapsed 1072.94s=17.88min. The epochs lever has PLATEAUED: iter-2 ep14 -> iter-3 ep18 gave hr +0.0022 only (0.310054 -> 0.312282) AND SSIM DROPPED (0.908534 -> 0.904773). iter-3's own falsifier (hr <= 0.310 at ep18 => capacity-limited) effectively FIRED -> itnet_v3 is CAPACITY-limited at unet_c=16, not training-convergence-limited. unet_c=16 is the current capacity; epochs=18 is the current count. (2) LIMITER NOW = model CAPACITY at c=16 (epochs plateaued AND iter-3 used 17.88/20 min so epochs cannot be raised further inside the wall anyway). (3) ONE KNOB: unet_c 16 -> 24 (params 3.70M -> ~8.3M, ~2.25x conv FLOPs). epochs traded DOWN 18 -> 9 to keep train+score inside 1200s. itnet_v3 is the END-TO-END unrolled variant (unlike v1/v2's pretrain-denoiser-then-DC), so added denoiser capacity is trained against the full recon objective and should genuinely lift the ceiling. (4) HYPOTHESIS: more denoiser capacity (c=24) lifts hr above 0.3123 even at only 9 epochs, because the c=16 net had saturated its representational headroom (ep14->18 flat). FALSIFIER (NUMBERS): if hr <= 0.3123 at c=24/ep9, itnet_v3 has hit its representational ceiling on this 214-slice val set (added capacity does not help OR 9 epochs is too few to train the bigger net) -> iter-5 must either give the bigger net more epochs (trade train_n down to buy them) or pivot to lr/itnet_k. (5) BUDGET (HARD 20-min = 1200s train+score), CAPACITY-vs-EPOCHS trade math: measured c=16 timing over 3 points (8,737.85),(14,1010.07),(18,1072.94) gives full-span per-epoch (1072.94-737.85)/(18-8)=33.5 s/epoch and fixed cost (data load + per-sample-ps projector cache + 214-slice per-sample val + figure + startup) 737.85-8*33.5=469.8 s. Raising c 16->24 scales the UNet conv FLOPs by (24/16)^2=2.25x, but the k=3 DC steps run the 2304-view projector fwd+adj which is FLAT in c, so per-epoch does NOT fully 2.25x. Conservative split (UNet ~half of per-epoch train, half is projector/data; only ~25pct of fixed is the c-scaling val UNet-forward): per-epoch@c24 ~= 52-60 s, fixed@c24 ~= 631 s. At epochs=9: 631 + 9*~56 = ~1135s = 18.9 min < 1200s even pessimistically (unet_share=0.6 case = 19.57 min, still OK); epochs=10 risks the wall in the pessimistic case (20.6 min), epochs=8 wastes headroom. So epochs=9 is the largest count that the c=24 timing safely permits inside 20 min. max_train_s=780 fences the train phase (9*~56=~504s expected, well under 780) so a finite recon + 214-slice val + figure always land inside the 30-min sbatch wall. val stays ALL 214 L277 slices, 321px detector-geometry FOV (evaluate_calibrated default for AGENT4CT_DATASET=mayo_ldct_2d; no fov= override). grad_clip=1.0 retained (mandatory: the 2304-view Mayo FBP adjoint inside dc_step overflows otherwise). HARD-WIRED (unchanged): staged_canonical v3 mayo_ldct_fitted geometry, per-sample-ps FBP init + per-sample itnet.projector swap for the k=3 DC steps, bg_target=truth. (6) do NOT return control mid-campaign. Predicted iter-4 hr: 0.32-0.35 if capacity-limited hypothesis holds; <=0.3123 falsifies.", "comparison_image": "runs/mayo-ldct-claude-agentic-itnet-v3-search-20260619-01/iterations/iter-0004/comparison.png"}
