{"ts": "2026-06-20T21:11:42Z", "run_id": "mayo-ldct-claude-agentic-itnet-v2-search-20260619-01", "iter": 7, "agent": "itnet_v2-claude-agentic", "model": "claude-opus-4-8-1m", "change_class": "architecture", "status": "keep", "kept": true, "val_score": 0.9413688778877258, "headroom": 0.4187275784047181, "params_M": 0.232882, "train_n": 400, "rationale": "itnet_v2-claude-agentic: itnet_k=1, unet_c=16, itnet_alpha_init=0.0037, residual_learning=False, pretrain_lr=0.0001, pretrain_epochs=120, pretrain_patience=120, batch_size=1, val_chunk=1, train_n=400, val_n=214, grad_clip=1.0, max_train_s=1100, seed=42, rationale=ITER-7 (search-20260619-01, corrected 214-slice/321px-FOV metric). THE V1 BREAKOUT KNOB, never tried on v2. ONE KNOB: itnet_k 3->1 (base=iter-5, the best SSIM 0.7294 @train_n=400/pretrain_epochs=120). All else identical to iter-5 (unet_c=16, alpha_init=0.0037, residual_learning=False KEPT, pretrain_lr=1e-4, pretrain_epochs=120, train_n=400, val_n=214, batch_size=1, val_chunk=1, grad_clip=1.0, seed=42); only max_train_s 1100 (18.3-min HARD backstop, safe because k=1 CUTS the per-sample DC cost to a third so this runs FASTER than iter-5 1410s). SIX-BOX (NUMBERS, hr=metric of record): (1) TRAJECTORY: iter-1 SSIM 0.4554/hr0 @ep12/tn200/k3 170s; iter-2 0.5888 @ep48 345s; iter-3 0.6230 @ep144 744s; iter-4 0.7039 @ep240 1237s; iter-5 0.7294/hr0 @ep120/tn400/k3 1411s (val_psnr 26.87); iter-6 0.6307 @ep144/tn200/k3 (tn revert). MAPPED KNOBS: pretrain_epochs (1->4, diminishing) and train_n coverage (5: +0.0255) -- BOTH at itnet_k=3 the WHOLE time. itnet_k has NEVER been moved off 3. (2) LIMITER: iter-3..6 declared a structural cap but did so while leaving the SINGLE highest-value family-proven lever UNPROBED. The k=3 DC re-projects through the noisy 2304-view adjoint 3x per sample, pulling the denoised image BACK toward the noisy LD-FBP -- OVER-APPLIED fixed DC DEGRADES the recon. The limiter is OVER-APPLIED DC steps, not under-training. (3) ONE KNOB: itnet_k 3->1. The v1 SIBLING under THIS campaign+metric proved it: itnet_k 3->1 unlocked hr 0->0.3752 (now #3 board, SSIM 0.9377 @k1/ep125/tn300); the trained denoiser + a SINGLE DC step is the sweet spot, the over-applied 3-step fixed-DC was degrading it. itnet_v2 already has a well-converged denoiser (SSIM 0.7294 SURVIVES under k=3 corruption) -- unwrapping 2 of the 3 corrupting DC steps should let that denoiser show through. (4) HYPOTHESIS: if itnet_k 3->1, val_ssim jumps PAST the 0.81 LD-FBP floor and hr CLEARS 0 (toward the v1 0.93/hr0.37 band), because a single trained-denoiser+1-DC pass on the per-sample-ps FBP is the family sweet spot and removes the over-applied-DC degradation. NUMERIC FALSIFIER: if val_ssim stays <=~0.75 (no jump past 0.81 floor) and hr=0 at k=1, then v2 (pretrain-then-FIXED-DC, log_alpha never trained) genuinely caps below the floor regardless of DC depth -- DISTINCT from v1 whose DC was effectively trainable end-to-end -- and the structural-cap verdict stands; iter-8 would document the ceiling. (5) BUDGET: HARD 20-min (1200s). k=1 cuts the per-sample val DC ops 3->1 (line 94 for _ in range(k)) while pretrain (no DC) is unchanged; iter-5 1411s was dominated by k=3 val + ep120/tn400 pretrain, so k=1 lands WELL under 1200s. max_train_s=1100 backstop leaves room for the 214-slice per-sample val + figure inside the 30-min wall. val_n=214 KEPT, grad_clip=1.0 KEPT. (6) Loop continues -- no control returned. HARD-WIRED (unchanged): staged_canonical data, v3 mayo_ldct_fitted geometry, per-sample-ps (itnet.projector swap, bs=1+val_chunk=1 FORCED), bg_target=truth, val=ALL 214 L277 slices under the 321px geometry FOV (no fov= override). residual_learning=False KEPT.", "advice_for_others": "itnet_v2-claude-agentic: itnet_k=1, unet_c=16, itnet_alpha_init=0.0037, residual_learning=False, pretrain_lr=0.0001, pretrain_epochs=120, pretrain_patience=120, batch_size=1, val_chunk=1, train_n=400, val_n=214, grad_clip=1.0, max_train_s=1100, seed=42, rationale=ITER-7 (search-20260619-01, corrected 214-slice/321px-FOV metric). THE V1 BREAKOUT KNOB, never tried on v2. ONE KNOB: itnet_k 3->1 (base=iter-5, the best SSIM 0.7294 @train_n=400/pretrain_epochs=120). All else identical to iter-5 (unet_c=16, alpha_init=0.0037, residual_learning=False KEPT, pretrain_lr=1e-4, pretrain_epochs=120, train_n=400, val_n=214, batch_size=1, val_chunk=1, grad_clip=1.0, seed=42); only max_train_s 1100 (18.3-min HARD backstop, safe because k=1 CUTS the per-sample DC cost to a third so this runs FASTER than iter-5 1410s). SIX-BOX (NUMBERS, hr=metric of record): (1) TRAJECTORY: iter-1 SSIM 0.4554/hr0 @ep12/tn200/k3 170s; iter-2 0.5888 @ep48 345s; iter-3 0.6230 @ep144 744s; iter-4 0.7039 @ep240 1237s; iter-5 0.7294/hr0 @ep120/tn400/k3 1411s (val_psnr 26.87); iter-6 0.6307 @ep144/tn200/k3 (tn revert). MAPPED KNOBS: pretrain_epochs (1->4, diminishing) and train_n coverage (5: +0.0255) -- BOTH at itnet_k=3 the WHOLE time. itnet_k has NEVER been moved off 3. (2) LIMITER: iter-3..6 declared a structural cap but did so while leaving the SINGLE highest-value family-proven lever UNPROBED. The k=3 DC re-projects through the noisy 2304-view adjoint 3x per sample, pulling the denoised image BACK toward the noisy LD-FBP -- OVER-APPLIED fixed DC DEGRADES the recon. The limiter is OVER-APPLIED DC steps, not under-training. (3) ONE KNOB: itnet_k 3->1. The v1 SIBLING under THIS campaign+metric proved it: itnet_k 3->1 unlocked hr 0->0.3752 (now #3 board, SSIM 0.9377 @k1/ep125/tn300); the trained denoiser + a SINGLE DC step is the sweet spot, the over-applied 3-step fixed-DC was degrading it. itnet_v2 already has a well-converged denoiser (SSIM 0.7294 SURVIVES under k=3 corruption) -- unwrapping 2 of the 3 corrupting DC steps should let that denoiser show through. (4) HYPOTHESIS: if itnet_k 3->1, val_ssim jumps PAST the 0.81 LD-FBP floor and hr CLEARS 0 (toward the v1 0.93/hr0.37 band), because a single trained-denoiser+1-DC pass on the per-sample-ps FBP is the family sweet spot and removes the over-applied-DC degradation. NUMERIC FALSIFIER: if val_ssim stays <=~0.75 (no jump past 0.81 floor) and hr=0 at k=1, then v2 (pretrain-then-FIXED-DC, log_alpha never trained) genuinely caps below the floor regardless of DC depth -- DISTINCT from v1 whose DC was effectively trainable end-to-end -- and the structural-cap verdict stands; iter-8 would document the ceiling. (5) BUDGET: HARD 20-min (1200s). k=1 cuts the per-sample val DC ops 3->1 (line 94 for _ in range(k)) while pretrain (no DC) is unchanged; iter-5 1411s was dominated by k=3 val + ep120/tn400 pretrain, so k=1 lands WELL under 1200s. max_train_s=1100 backstop leaves room for the 214-slice per-sample val + figure inside the 30-min wall. val_n=214 KEPT, grad_clip=1.0 KEPT. (6) Loop continues -- no control returned. HARD-WIRED (unchanged): staged_canonical data, v3 mayo_ldct_fitted geometry, per-sample-ps (itnet.projector swap, bs=1+val_chunk=1 FORCED), bg_target=truth, val=ALL 214 L277 slices under the 321px geometry FOV (no fov= override). residual_learning=False KEPT.", "comparison_image": "runs/mayo-ldct-claude-agentic-itnet-v2-search-20260619-01/iterations/iter-0007/comparison.png"}
{"ts": "2026-06-20T20:59:53Z", "run_id": "mayo-ldct-claude-agentic-tv-iterative-search-20260619-01", "iter": 7, "agent": "tv_iterative-claude-agentic", "model": "claude-opus-4-8-1m", "change_class": "architecture", "status": "keep", "kept": true, "val_score": 0.9272352457046509, "headroom": 0.20822046371882852, "params_M": 0.0, "train_n": 400, "rationale": "tv_iterative-claude-agentic: val_n=214, train_n=0, tv_lambda=0.001, tv_iterations=120, tv_lr=0.013, tv_clip_max=0.08, tv_decay=0.01, tv_optimizer=gd, tv_init=fbp, rationale=tv_iterative iter-7 (search-20260619-01, corrected 214-slice/321px-FOV metric). BASE = iter-4 BEST family (clip 0.08, lambda 0.001) but at the BUDGET-PROVEN tv_iterations=120 (iter-4 at 160 measured 1227.4s, OVER the 1200s HARD wall; only 120 is reproducible under budget). ONE KNOB: tv_lr 0.01->0.013 (fine grid; all else IDENTICAL to the 120-iter BEST iter-2: tv_lambda=0.001, tv_iterations=120, tv_clip_max=0.08, tv_decay/init/optimizer INERT). SOLVER FACT (read from tv_reconstruction): the ONLY four live knobs are tv_lambda/tv_iterations/tv_lr/tv_clip_max; GD step schedule is step=lr/(1+0.01*it) with decay hard-coded. LEVER MAP (all four live knobs): clip exhausted at top of bound [0.03,0.08] (iter-2); lambda BRACKETED at optimum 0.001 -- up@0.003 regressed (iter-3, 0.1366), down@0.0005 regressed (iter-6, 0.1582); iters-UP@160 lowered RMSE 7.857e-4->7.825e-4 (CONVERGENCE helps) for hr 0.205->0.2085 BUT breached the wall (iter-4, 1227s); lr-UP@0.02 (2x) OVERSHOT (iter-5, 0.1873, RMSE up to 8.036e-4). KEY EVIDENCE: iter-4 proves the data term is mildly UNDER-converged at 120 iters (more steps -> lower RMSE -> higher hr), but buying that convergence via iters breaches budget AND via a 2x lr step overshoots. The UNTRIED lever is the FINE lr grid between the proven-good 0.01 and the overshooting 0.02. HYPOTHESIS: a modest +30 pct step (0.01->0.013), well below iter-5 2x overshoot, counteracts the step-decay enough to converge the data term further within the budget-safe 120 steps -- reaching iter-4-like lower residual (RMSE below 7.857e-4) WITHOUT GD overshoot, so hr rises above iter-4 BEST 0.208547 at ZERO extra compute. PREDICTED iter-7 hr ~0.210. FALSIFIER: if hr<=0.208547 (no gain or regression) then EITHER (a) if hr drops, 0.013 already overshoots and the lr step-size lever is exhausted on BOTH sides of 0.01 (overshoot above, no benefit below since lr-down only slows convergence which iter-4 showed hurts), OR (b) if hr is merely flat, 120-iter convergence at lr~0.01 is already at the TV regularization ceiling and iter-4 +0.003 was within noise -- ~0.21 hr / ~0.924 SSIM is the STRUCTURAL classical-TV ceiling on real Mayo LDCT and ALL FOUR live levers (clip, lambda both ways, iters, lr both ways) are exhausted; STOP convergence-knob tuning. BUDGET: tv_lr is a ZERO marginal-compute knob at the budget-proven tv_iterations=120 -> cost model 31.8+120*7.47=928s (77 pct of 1200s, ~272s margin; +10 pct GPU-contention variance ~1018s, still under the wall). DELIBERATELY keeps tv_iterations=120 (NOT iter-4 160 which breached the HARD wall, six-box rule 5). val = ALL 214 L277 slices unchanged. sbatch --time=00:30:00 SLURM safety net.", "advice_for_others": "tv_iterative-claude-agentic: val_n=214, train_n=0, tv_lambda=0.001, tv_iterations=120, tv_lr=0.013, tv_clip_max=0.08, tv_decay=0.01, tv_optimizer=gd, tv_init=fbp, rationale=tv_iterative iter-7 (search-20260619-01, corrected 214-slice/321px-FOV metric). BASE = iter-4 BEST family (clip 0.08, lambda 0.001) but at the BUDGET-PROVEN tv_iterations=120 (iter-4 at 160 measured 1227.4s, OVER the 1200s HARD wall; only 120 is reproducible under budget). ONE KNOB: tv_lr 0.01->0.013 (fine grid; all else IDENTICAL to the 120-iter BEST iter-2: tv_lambda=0.001, tv_iterations=120, tv_clip_max=0.08, tv_decay/init/optimizer INERT). SOLVER FACT (read from tv_reconstruction): the ONLY four live knobs are tv_lambda/tv_iterations/tv_lr/tv_clip_max; GD step schedule is step=lr/(1+0.01*it) with decay hard-coded. LEVER MAP (all four live knobs): clip exhausted at top of bound [0.03,0.08] (iter-2); lambda BRACKETED at optimum 0.001 -- up@0.003 regressed (iter-3, 0.1366), down@0.0005 regressed (iter-6, 0.1582); iters-UP@160 lowered RMSE 7.857e-4->7.825e-4 (CONVERGENCE helps) for hr 0.205->0.2085 BUT breached the wall (iter-4, 1227s); lr-UP@0.02 (2x) OVERSHOT (iter-5, 0.1873, RMSE up to 8.036e-4). KEY EVIDENCE: iter-4 proves the data term is mildly UNDER-converged at 120 iters (more steps -> lower RMSE -> higher hr), but buying that convergence via iters breaches budget AND via a 2x lr step overshoots. The UNTRIED lever is the FINE lr grid between the proven-good 0.01 and the overshooting 0.02. HYPOTHESIS: a modest +30 pct step (0.01->0.013), well below iter-5 2x overshoot, counteracts the step-decay enough to converge the data term further within the budget-safe 120 steps -- reaching iter-4-like lower residual (RMSE below 7.857e-4) WITHOUT GD overshoot, so hr rises above iter-4 BEST 0.208547 at ZERO extra compute. PREDICTED iter-7 hr ~0.210. FALSIFIER: if hr<=0.208547 (no gain or regression) then EITHER (a) if hr drops, 0.013 already overshoots and the lr step-size lever is exhausted on BOTH sides of 0.01 (overshoot above, no benefit below since lr-down only slows convergence which iter-4 showed hurts), OR (b) if hr is merely flat, 120-iter convergence at lr~0.01 is already at the TV regularization ceiling and iter-4 +0.003 was within noise -- ~0.21 hr / ~0.924 SSIM is the STRUCTURAL classical-TV ceiling on real Mayo LDCT and ALL FOUR live levers (clip, lambda both ways, iters, lr both ways) are exhausted; STOP convergence-knob tuning. BUDGET: tv_lr is a ZERO marginal-compute knob at the budget-proven tv_iterations=120 -> cost model 31.8+120*7.47=928s (77 pct of 1200s, ~272s margin; +10 pct GPU-contention variance ~1018s, still under the wall). DELIBERATELY keeps tv_iterations=120 (NOT iter-4 160 which breached the HARD wall, six-box rule 5). val = ALL 214 L277 slices unchanged. sbatch --time=00:30:00 SLURM safety net.", "comparison_image": "runs/mayo-ldct-claude-agentic-tv-iterative-search-20260619-01/iterations/iter-0007/comparison.png"}
{"ts": "2026-06-20T20:44:00Z", "run_id": "mayo-ldct-claude-agentic-tv-iterative-supervised-search-20260619-01", "iter": 6, "agent": "tv_iterative_supervised-claude-agentic", "model": "claude-opus-4-8-1m", "change_class": "architecture", "status": "discard", "kept": false, "val_score": 0.8185387253761292, "headroom": 0.0, "params_M": 2e-06, "train_n": 400, "rationale": "tv_iterative_supervised-claude-agentic: val_n=214, val_chunk=5, train_n=40, epochs=8, batch_size=1, lr=0.005, tv_K=30, tv_step_init=1e-05, tv_lambda_init=0.001, tv_share_steps=True, tv_clip_max=0.05, tv_eps=1e-06, lambda_neg=1.0, loss_base=mse, grad_clip=1.0, rationale=tv_iterative_supervised iter-6 (search-20260619-01, corrected 214-slice/321px-FOV metric). BASE_ITER=5 (the stable shared-step config). TRAJECTORY (SSIM/hr): iter-1 K=10 0.2855/0.0; iter-2 K=30 0.2855/0.0 (depth FALSIFIED, byte-identical); iter-3 step=1e-8 0.8137/0.0 (LD-FBP PASSTHROUGH); iter-4 step=1e-5 share=F 0.6949/0.0 (per-step RUNAWAY into clamp); iter-5 step=1e-5 share=T 0.6074/0.0 (per-step runaway FIXED but LAMBDA RUNAWAY). BEST hr=0.0 all iters; best SSIM iter-3 0.8137 (pure passthrough). LIMITER (DECISIVE, from iter-5 SLURM log 765433): with tv_share_steps=True the step CONVERGED stable (~3.8e-4, no runaway) and loss flattened at 3.9e-5 (trained, stable) -- BUT the single shared LAMBDA EXPLODED monotonically 0.00123 (ep1) -> 0.119 (ep3) -> 1.328 (ep4) -> 2.527 (ep8), still climbing at the last epoch. At lambda~2.5 with step~3.8e-4 the TV term dominates the data term by orders of magnitude -> the K=30 unroll OVER-SMOOTHS -> SSIM 0.6074 / PSNR 26.84, FAR BELOW the 0.8137 FBP passthrough. The supervised-L2 loss TOLERATES the over-smoothing (3.9e-5 is a fine loss) while SSIM/PSNR collapse. The limiter is NO LONGER step scale (1e-5 is the active basin), NOR depth (falsified), NOR the per-step runaway (share=True killed it) -- it is the UNBOUNDED LAMBDA RUNAWAY under an outer lr that is 10x too aggressive for a 2-scalar log-parametrised optimizer over 8 epochs (lr=5e-2 was RAISED in iter-3/4 to UN-STICK frozen gradients in the share=False regime; it was NEVER LOWERED in the now-stable share=True 2-scalar regime, where it demonstrably over-drives log-lambda by 3 orders of magnitude). ONE KNOB CHANGED (from BASE_ITER=5): lr 0.05 -> 0.005 (10x DOWN). This is a GENUINELY-UNTRIED lever in the share=True regime -- lr-down on the stable 2-scalar config has never been run; it directly counters the observed lambda runaway. All else IDENTICAL to iter-5 (tv_share_steps=True, tv_step_init=1e-5 the confirmed active basin, tv_K=30, train_n=40, epochs=8, bs=1, tv_lambda_init=1e-3, tv_clip_max=0.05, tv_eps=1e-6, val_n=214 ALL L277, val_chunk=5, grad_clip=1.0). HYPOTHESIS: at lr=5e-3 the log-lambda optimizer no longer overshoots -- lambda settles in a moderate band (O(0.01-0.1)) where the K=30 GD balances data-consistency against TV instead of being TV-dominated, so the trained-stable TV recovers ABOVE the 0.8137 FBP passthrough and toward the classical non-trained tv_iterative band (SSIM 0.92 / hr 0.205). NUMERIC FALSIFIER (decisive): if SSIM stays <= 0.8137 with hr=0 -- this RETIRES THE LAST UNMAPPED LEVER and CONFIRMS the structural ceiling: supervised-unrolled-TV is FBP-BOUNDED on real Mayo 2304-view LDCT under the config-only contract -> file the NEGATIVE RESULT and STOP at iter-6. If hr>0, supervised-TV is repaired and iter-7 raises train_n (capacity tiny -- 2 scalars). BUDGET: IDENTICAL compute to iter-5 (~974s, ~226s margin under the 1200s wall). PREDICTED iter-6: SSIM ~0.80-0.88, hr most-likely 0.0 (structurally weak single-global-TV prior on a near-complete inverse); small chance hr 0.0-0.05.", "advice_for_others": "tv_iterative_supervised-claude-agentic: val_n=214, val_chunk=5, train_n=40, epochs=8, batch_size=1, lr=0.005, tv_K=30, tv_step_init=1e-05, tv_lambda_init=0.001, tv_share_steps=True, tv_clip_max=0.05, tv_eps=1e-06, lambda_neg=1.0, loss_base=mse, grad_clip=1.0, rationale=tv_iterative_supervised iter-6 (search-20260619-01, corrected 214-slice/321px-FOV metric). BASE_ITER=5 (the stable shared-step config). TRAJECTORY (SSIM/hr): iter-1 K=10 0.2855/0.0; iter-2 K=30 0.2855/0.0 (depth FALSIFIED, byte-identical); iter-3 step=1e-8 0.8137/0.0 (LD-FBP PASSTHROUGH); iter-4 step=1e-5 share=F 0.6949/0.0 (per-step RUNAWAY into clamp); iter-5 step=1e-5 share=T 0.6074/0.0 (per-step runaway FIXED but LAMBDA RUNAWAY). BEST hr=0.0 all iters; best SSIM iter-3 0.8137 (pure passthrough). LIMITER (DECISIVE, from iter-5 SLURM log 765433): with tv_share_steps=True the step CONVERGED stable (~3.8e-4, no runaway) and loss flattened at 3.9e-5 (trained, stable) -- BUT the single shared LAMBDA EXPLODED monotonically 0.00123 (ep1) -> 0.119 (ep3) -> 1.328 (ep4) -> 2.527 (ep8), still climbing at the last epoch. At lambda~2.5 with step~3.8e-4 the TV term dominates the data term by orders of magnitude -> the K=30 unroll OVER-SMOOTHS -> SSIM 0.6074 / PSNR 26.84, FAR BELOW the 0.8137 FBP passthrough. The supervised-L2 loss TOLERATES the over-smoothing (3.9e-5 is a fine loss) while SSIM/PSNR collapse. The limiter is NO LONGER step scale (1e-5 is the active basin), NOR depth (falsified), NOR the per-step runaway (share=True killed it) -- it is the UNBOUNDED LAMBDA RUNAWAY under an outer lr that is 10x too aggressive for a 2-scalar log-parametrised optimizer over 8 epochs (lr=5e-2 was RAISED in iter-3/4 to UN-STICK frozen gradients in the share=False regime; it was NEVER LOWERED in the now-stable share=True 2-scalar regime, where it demonstrably over-drives log-lambda by 3 orders of magnitude). ONE KNOB CHANGED (from BASE_ITER=5): lr 0.05 -> 0.005 (10x DOWN). This is a GENUINELY-UNTRIED lever in the share=True regime -- lr-down on the stable 2-scalar config has never been run; it directly counters the observed lambda runaway. All else IDENTICAL to iter-5 (tv_share_steps=True, tv_step_init=1e-5 the confirmed active basin, tv_K=30, train_n=40, epochs=8, bs=1, tv_lambda_init=1e-3, tv_clip_max=0.05, tv_eps=1e-6, val_n=214 ALL L277, val_chunk=5, grad_clip=1.0). HYPOTHESIS: at lr=5e-3 the log-lambda optimizer no longer overshoots -- lambda settles in a moderate band (O(0.01-0.1)) where the K=30 GD balances data-consistency against TV instead of being TV-dominated, so the trained-stable TV recovers ABOVE the 0.8137 FBP passthrough and toward the classical non-trained tv_iterative band (SSIM 0.92 / hr 0.205). NUMERIC FALSIFIER (decisive): if SSIM stays <= 0.8137 with hr=0 -- this RETIRES THE LAST UNMAPPED LEVER and CONFIRMS the structural ceiling: supervised-unrolled-TV is FBP-BOUNDED on real Mayo 2304-view LDCT under the config-only contract -> file the NEGATIVE RESULT and STOP at iter-6. If hr>0, supervised-TV is repaired and iter-7 raises train_n (capacity tiny -- 2 scalars). BUDGET: IDENTICAL compute to iter-5 (~974s, ~226s margin under the 1200s wall). PREDICTED iter-6: SSIM ~0.80-0.88, hr most-likely 0.0 (structurally weak single-global-TV prior on a near-complete inverse); small chance hr 0.0-0.05.", "comparison_image": "runs/mayo-ldct-claude-agentic-tv-iterative-supervised-search-20260619-01/iterations/iter-0006/comparison.png"}
