{"ts": "2026-06-20T01:39:45Z", "run_id": "mayo-ldct-claude-agentic-naf-search-20260619-01", "iter": 3, "agent": "naf-claude-agentic", "model": "claude-opus-4-8-1m", "change_class": "architecture", "status": "discard", "kept": false, "val_score": 0.5452292561531067, "headroom": 0.0, "params_M": 0.006465, "train_n": 400, "rationale": "naf-claude-agentic: val_n=214, naf_n_freqs=8, naf_hidden=64, naf_layers=3, naf_n_iter=3000, naf_lr=0.01, naf_tv_weight=0.0001, naf_n_clip=0.05, naf_outer_wall_s=1080, naf_per_scene_s=5.0, seed=42, rationale=ITER-3 (search-20260619-01, naf). SIX-BOX. (1) NUMBERS trajectory: iter-1 naf_hidden=128 -> SSIM 0.4729, hr 0.0, PSNR 18.55, baseline_PSNR 34.08, elapsed 1097s, median ~91 Adam steps/scene (5.0s per-scene wall), 18-min outer wall (1080s) hit EXACTLY at scene 214 (1082.5s). iter-2 naf_hidden=128->64 (cheaper hiddenxhidden matmuls -> more steps/scene) -> SSIM 0.4943, hr 0.0, PSNR 18.62, elapsed 1100s: +0.0215 SSIM, CONFIRMING the budget-starvation diagnosis (cheaper step -> more per-scene optimization -> higher SSIM). Still FAR below the LD-FBP floor (~0.81 cal). (2) FAILURE MODE: budget-starved per-scene INR fit. A NeRF-style coordinate-MLP wants hundreds-to-thousands of Adam steps to leave its water-mu init; ~91 steps/scene at hidden=128 (more at hidden=64) leaves the INR barely off init. iter-2's +0.0215 proves we are still on the starvation slope, NOT yet at the structural floor. (3) ONE KNOB: naf_layers 4->3 (naf_hidden=64, naf_n_freqs=8, naf_lr=1e-2, naf_per_scene_s=5.0, naf_outer_wall_s=1080, val_n=214 ALL UNCHANGED). The hidden-width lever was spent in iter-2; the next leanness step is MLP DEPTH. NAF.__init__ builds [Linear(in,h),ReLU] + (layers-2) x [Linear(h,h),ReLU] + Linear(h,1); at layers=4 that is TWO hiddenxhidden blocks, at layers=3 it is ONE -> removing one full 64x64 Linear+ReLU cuts the per-step MLP matmul cost ~1/3 (over 512^2=262144 coords each step) on top of the fixed 2304-view fan-beam forward+backward. 214-SCENE 20-MIN BUDGET MATH (measured): train_n=0, the ENTIRE budget is the per-scene fit loop; total = 214 x per_scene_s = 214 x 5.0s = 1070s ~= the 1080s/18-min outer wall, hit exactly at scene 214 (verified both iters). I CANNOT raise per_scene_s (214 x wall already fills the 20-min compute budget). So to buy MORE Adam steps per scene at FIXED 214x1080s total I make each step CHEAPER again: layers 4->3 drops one 64x64 block -> more steps fit in each 5.0s scene within the SAME wall. (4) HYPOTHESIS: if I shrink naf_layers 4->3, I expect SSIM to rise above 0.4943 because the shallower MLP buys more Adam steps per scene, letting the INR move further off its water-mu init within the same per-scene wall (same mechanism that gave iter-2 +0.0215). FALSIFIER: if SSIM stalls at ~0.49 (or drops) despite the extra steps, NAF is STRUCTURALLY FBP-bounded on dense rebinned Mayo (wrong inductive bias for dense-view CT) AND/OR has lost too much MLP capacity to represent the slice -> document the per-scene-INR ceiling on dense Mayo as a NEGATIVE result (SSIM ~0.5 vs LD-FBP ~0.81). (5) HARD 20-min budget: 214-scene pass, naf_outer_wall_s=1080 (18 min, in-solver outer wall = governor) + naf_per_scene_s=5.0 (in-solver per-scene wall; naf_n_iter=3000 stays a high cap so the WALL governs, not the iter count), val_n=214 (ALL L277 slices, NOT reduced), 321px detector-geometry FOV default (no fov= override). (6) no control return; the loop dispatches the next iter.", "advice_for_others": "naf-claude-agentic: val_n=214, naf_n_freqs=8, naf_hidden=64, naf_layers=3, naf_n_iter=3000, naf_lr=0.01, naf_tv_weight=0.0001, naf_n_clip=0.05, naf_outer_wall_s=1080, naf_per_scene_s=5.0, seed=42, rationale=ITER-3 (search-20260619-01, naf). SIX-BOX. (1) NUMBERS trajectory: iter-1 naf_hidden=128 -> SSIM 0.4729, hr 0.0, PSNR 18.55, baseline_PSNR 34.08, elapsed 1097s, median ~91 Adam steps/scene (5.0s per-scene wall), 18-min outer wall (1080s) hit EXACTLY at scene 214 (1082.5s). iter-2 naf_hidden=128->64 (cheaper hiddenxhidden matmuls -> more steps/scene) -> SSIM 0.4943, hr 0.0, PSNR 18.62, elapsed 1100s: +0.0215 SSIM, CONFIRMING the budget-starvation diagnosis (cheaper step -> more per-scene optimization -> higher SSIM). Still FAR below the LD-FBP floor (~0.81 cal). (2) FAILURE MODE: budget-starved per-scene INR fit. A NeRF-style coordinate-MLP wants hundreds-to-thousands of Adam steps to leave its water-mu init; ~91 steps/scene at hidden=128 (more at hidden=64) leaves the INR barely off init. iter-2's +0.0215 proves we are still on the starvation slope, NOT yet at the structural floor. (3) ONE KNOB: naf_layers 4->3 (naf_hidden=64, naf_n_freqs=8, naf_lr=1e-2, naf_per_scene_s=5.0, naf_outer_wall_s=1080, val_n=214 ALL UNCHANGED). The hidden-width lever was spent in iter-2; the next leanness step is MLP DEPTH. NAF.__init__ builds [Linear(in,h),ReLU] + (layers-2) x [Linear(h,h),ReLU] + Linear(h,1); at layers=4 that is TWO hiddenxhidden blocks, at layers=3 it is ONE -> removing one full 64x64 Linear+ReLU cuts the per-step MLP matmul cost ~1/3 (over 512^2=262144 coords each step) on top of the fixed 2304-view fan-beam forward+backward. 214-SCENE 20-MIN BUDGET MATH (measured): train_n=0, the ENTIRE budget is the per-scene fit loop; total = 214 x per_scene_s = 214 x 5.0s = 1070s ~= the 1080s/18-min outer wall, hit exactly at scene 214 (verified both iters). I CANNOT raise per_scene_s (214 x wall already fills the 20-min compute budget). So to buy MORE Adam steps per scene at FIXED 214x1080s total I make each step CHEAPER again: layers 4->3 drops one 64x64 block -> more steps fit in each 5.0s scene within the SAME wall. (4) HYPOTHESIS: if I shrink naf_layers 4->3, I expect SSIM to rise above 0.4943 because the shallower MLP buys more Adam steps per scene, letting the INR move further off its water-mu init within the same per-scene wall (same mechanism that gave iter-2 +0.0215). FALSIFIER: if SSIM stalls at ~0.49 (or drops) despite the extra steps, NAF is STRUCTURALLY FBP-bounded on dense rebinned Mayo (wrong inductive bias for dense-view CT) AND/OR has lost too much MLP capacity to represent the slice -> document the per-scene-INR ceiling on dense Mayo as a NEGATIVE result (SSIM ~0.5 vs LD-FBP ~0.81). (5) HARD 20-min budget: 214-scene pass, naf_outer_wall_s=1080 (18 min, in-solver outer wall = governor) + naf_per_scene_s=5.0 (in-solver per-scene wall; naf_n_iter=3000 stays a high cap so the WALL governs, not the iter count), val_n=214 (ALL L277 slices, NOT reduced), 321px detector-geometry FOV default (no fov= override). (6) no control return; the loop dispatches the next iter.", "comparison_image": "runs/mayo-ldct-claude-agentic-naf-search-20260619-01/iterations/iter-0003/comparison.png"}
{"ts": "2026-06-20T01:29:00Z", "run_id": "mayo-ldct-claude-agentic-itnet-search-20260619-01", "iter": 3, "agent": "itnet-claude-agentic", "model": "claude-opus-4-8-1m", "change_class": "architecture", "status": "discard", "kept": false, "val_score": 0.6430301666259766, "headroom": 0.0, "params_M": 0.232881, "train_n": 400, "rationale": "itnet-claude-agentic: pretrain_epochs=160, pretrain_lr=0.0001, itnet_k=3, itnet_alpha=0.005, unet_c=16, finetune_epochs=0, finetune_lr=0.0001, train_n=200, val_n=214, grad_clip=1.0, seed=42, rationale=ITER-3 (search-20260619-01, corrected 214-slice/321px-FOV metric) for itnet = ItNet v1 (pretrain-denoiser-then-FIXED-DC, solver_itnet.py). SIX-BOX (NUMBERS). (1) PRIOR RESULTS: iter-1 ep8 -> SSIM 0.4413 / hr 0.000 / PSNR 20.44 / RMSE 0.004756, elapsed 191.1s; iter-2 ep48 -> SSIM 0.5927 / hr 0.000 / PSNR 24.77 / RMSE 0.002886, elapsed 387.4s. The pretrain_epochs lever moves SSIM (0.4413->0.5927, +0.151 over 8->48 ep) but hr stays PINNED at 0.000 -- v1 is still BELOW the ~0.81 LD-FBP floor after a 6x pretrain increase. CONTRAST: the lever-twin itnet_v2 (same pretrain-then-DC family) climbed ep48 0.5888 -> ep144 0.6230 (3x epochs for only +0.034 SSIM, hr still 0.000 -- severe diminishing returns), while the END-TO-END-trained sibling itnet_v3 sits at 0.905 / hr 0.312 at iter-3. v1 (0.44->0.59) and v2 (0.59->0.62) trace the SAME under-0.81 curve; v3 (0.91) is on a different curve entirely. (2) LIMITER = the pretrain-then-FIXED-DC CEILING (structural, confirmed by reading solver_itnet.py): finetune_itnet() is DEFINED (lines 114-135) but NEVER called in main(); the k=3 ItNet DC unroll (forward, lines 76-90) has ZERO trainable parameters of its own (self.alpha is a plain float, self.projector is fixed analytic PYRO-NN); itnet.eval()+torch.no_grad() (lines 208-209) run the unroll as pure INFERENCE. The ONLY trainable component is the standalone SmallUNet denoiser (params_M=0.2329, exactly the UNet), pretrained as an FBP->truth denoiser that NEVER sees the DC steps during training. So pretrain_epochs is the sole lever and the fixed untrained DC post-processor caps v1 far below the end-to-end v3. (3) ONE KNOB: pretrain_epochs 48 -> 160 (3.3x), mirroring v2's 48->144 ceiling-probe escalation. All else identical to iter-2 (k=3, itnet_alpha=0.005, unet_c=16, pretrain_lr=1e-4, train_n=200, val_n=214, grad_clip=1.0, seed=42). (4) HYPOTHESIS + FALSIFIER: a final hard push of the only trainable component. FALSIFIER (the operative one): if SSIM stays well below the ~0.81 LD-FBP floor and far below v3's 0.91 (predicted ~0.63-0.66, tracking v2's flattening 0.62 at comparable epochs), itnet v1 is STRUCTURALLY pretrain-then-fixed-DC-capped -- NOT under-trained -- and the campaign should document this ceiling and direct future Mayo recon to itnet_v3 (end-to-end unrolled, 0.91) rather than spend more iters on v1's epochs lever. The counter-hypothesis (v1 suddenly clears 0.81 at 160 ep) is implausible given the +0.151 then +0.034-class diminishing slope already measured. (5) BUDGET (HARD 20-min = 1200s train+score): from the two measured points the per-epoch pretrain cost is (387.4-191.1)/(48-8) = 4.91 s/epoch and the fixed cost (data load + 214-slice per-sample val + figure + startup) is 191.1 - 8*4.91 = 151.8 s. pretrain_epochs=160 predicts 151.8 + 160*4.91 = 937 s = 15.6 min, comfortably inside the 1200s budget with margin for val-pass variance; pretrain_epochs=200 would predict 1134s (18.9 min, too tight), so 160 is a safe decisive push. val stays ALL 214 L277 slices, 321px detector-geometry FOV (default; no fov= override). grad_clip=1.0 retained (mandatory: the 2304-view Mayo FBP adjoint inside the DC step overflows otherwise). v1 has NO max_train_s backstop (not in the solver), so the 30-min sbatch wall is the only hard fence -- 15.6 min predicted leaves ample headroom. (6) Loop continues -- no control returned. HARD-WIRED (unchanged): staged_canonical data, v3 mayo_ldct_fitted geometry, per-sample-ps (each val slice swaps itnet.projector to its own ps; chunk=1 FORCED), bg_target=truth, val=ALL 214 L277 slices under the 321px detector-geometry FOV (evaluate_calibrated default for AGENT4CT_DATASET=mayo_ldct_2d; NO fov= override).", "advice_for_others": "itnet-claude-agentic: pretrain_epochs=160, pretrain_lr=0.0001, itnet_k=3, itnet_alpha=0.005, unet_c=16, finetune_epochs=0, finetune_lr=0.0001, train_n=200, val_n=214, grad_clip=1.0, seed=42, rationale=ITER-3 (search-20260619-01, corrected 214-slice/321px-FOV metric) for itnet = ItNet v1 (pretrain-denoiser-then-FIXED-DC, solver_itnet.py). SIX-BOX (NUMBERS). (1) PRIOR RESULTS: iter-1 ep8 -> SSIM 0.4413 / hr 0.000 / PSNR 20.44 / RMSE 0.004756, elapsed 191.1s; iter-2 ep48 -> SSIM 0.5927 / hr 0.000 / PSNR 24.77 / RMSE 0.002886, elapsed 387.4s. The pretrain_epochs lever moves SSIM (0.4413->0.5927, +0.151 over 8->48 ep) but hr stays PINNED at 0.000 -- v1 is still BELOW the ~0.81 LD-FBP floor after a 6x pretrain increase. CONTRAST: the lever-twin itnet_v2 (same pretrain-then-DC family) climbed ep48 0.5888 -> ep144 0.6230 (3x epochs for only +0.034 SSIM, hr still 0.000 -- severe diminishing returns), while the END-TO-END-trained sibling itnet_v3 sits at 0.905 / hr 0.312 at iter-3. v1 (0.44->0.59) and v2 (0.59->0.62) trace the SAME under-0.81 curve; v3 (0.91) is on a different curve entirely. (2) LIMITER = the pretrain-then-FIXED-DC CEILING (structural, confirmed by reading solver_itnet.py): finetune_itnet() is DEFINED (lines 114-135) but NEVER called in main(); the k=3 ItNet DC unroll (forward, lines 76-90) has ZERO trainable parameters of its own (self.alpha is a plain float, self.projector is fixed analytic PYRO-NN); itnet.eval()+torch.no_grad() (lines 208-209) run the unroll as pure INFERENCE. The ONLY trainable component is the standalone SmallUNet denoiser (params_M=0.2329, exactly the UNet), pretrained as an FBP->truth denoiser that NEVER sees the DC steps during training. So pretrain_epochs is the sole lever and the fixed untrained DC post-processor caps v1 far below the end-to-end v3. (3) ONE KNOB: pretrain_epochs 48 -> 160 (3.3x), mirroring v2's 48->144 ceiling-probe escalation. All else identical to iter-2 (k=3, itnet_alpha=0.005, unet_c=16, pretrain_lr=1e-4, train_n=200, val_n=214, grad_clip=1.0, seed=42). (4) HYPOTHESIS + FALSIFIER: a final hard push of the only trainable component. FALSIFIER (the operative one): if SSIM stays well below the ~0.81 LD-FBP floor and far below v3's 0.91 (predicted ~0.63-0.66, tracking v2's flattening 0.62 at comparable epochs), itnet v1 is STRUCTURALLY pretrain-then-fixed-DC-capped -- NOT under-trained -- and the campaign should document this ceiling and direct future Mayo recon to itnet_v3 (end-to-end unrolled, 0.91) rather than spend more iters on v1's epochs lever. The counter-hypothesis (v1 suddenly clears 0.81 at 160 ep) is implausible given the +0.151 then +0.034-class diminishing slope already measured. (5) BUDGET (HARD 20-min = 1200s train+score): from the two measured points the per-epoch pretrain cost is (387.4-191.1)/(48-8) = 4.91 s/epoch and the fixed cost (data load + 214-slice per-sample val + figure + startup) is 191.1 - 8*4.91 = 151.8 s. pretrain_epochs=160 predicts 151.8 + 160*4.91 = 937 s = 15.6 min, comfortably inside the 1200s budget with margin for val-pass variance; pretrain_epochs=200 would predict 1134s (18.9 min, too tight), so 160 is a safe decisive push. val stays ALL 214 L277 slices, 321px detector-geometry FOV (default; no fov= override). grad_clip=1.0 retained (mandatory: the 2304-view Mayo FBP adjoint inside the DC step overflows otherwise). v1 has NO max_train_s backstop (not in the solver), so the 30-min sbatch wall is the only hard fence -- 15.6 min predicted leaves ample headroom. (6) Loop continues -- no control returned. HARD-WIRED (unchanged): staged_canonical data, v3 mayo_ldct_fitted geometry, per-sample-ps (each val slice swaps itnet.projector to its own ps; chunk=1 FORCED), bg_target=truth, val=ALL 214 L277 slices under the 321px detector-geometry FOV (evaluate_calibrated default for AGENT4CT_DATASET=mayo_ldct_2d; NO fov= override).", "comparison_image": "runs/mayo-ldct-claude-agentic-itnet-search-20260619-01/iterations/iter-0003/comparison.png"}
{"ts": "2026-06-20T01:21:30Z", "run_id": "mayo-ldct-claude-agentic-dual-domain-bilateral-n2i-search-20260619-01", "iter": 3, "agent": "dual_domain_bilateral_n2i-claude-agentic", "model": "claude-opus-4-8-1m", "change_class": "architecture", "status": "discard", "kept": false, "val_score": 0.921416699886322, "headroom": 0.0, "params_M": 6e-06, "train_n": 400, "rationale": "dual_domain_bilateral_n2i-claude-agentic: warm_start=True, pretrain_epochs=1, pretrain_steps=20, n_iter=30, grad_clip=1.0, lr=0.0003, proj_n_bf=1, img_n_bf=1, proj_kernel=5, proj_sx=1.0, proj_sy=2.0, proj_sr=0.0005, img_kernel=7, img_sx=1.5, img_sy=1.5, img_sr=0.02, batch_size=1, train_n=200, val_n=214, outer_wall_s=1050, per_scene_s=None, seed=42, rationale=iter-3 (search-20260619-01, corrected 214-slice/321px-FOV metric). ONE KNOB: per-scan lr 0.005 -> 0.0003 (16.7x lower; mirrors the SIBLING dual_domain_n2i win). PER-IMAGE preserved (warm-start amortized pre-pass on 4 train patients -> generic BF-sigma init, then INDEPENDENT per-scan Adam fit on EACH L277 slice OWN half-angle measurements, GT-free; NEVER amortized). SIX-BOX (NUMBERS). (1) iter-1: SSIM 0.92477 / PSNR 34.033 / RMSE 9.938e-4 / hr 0 / lr 5e-3 / elapsed 940.4s. iter-2 (proj_sr 0.02->0.0005): SSIM 0.92473 / PSNR 34.017 / RMSE 9.956e-4 / hr 0 / lr 5e-3 / elapsed 924.1s. proj_sr tightening was INERT (SSIM/PSNR/RMSE flat to <0.05%) -> the bilateral range-sigma is NOT the lever; the falsifier from iter-2 fired, so retire proj_sr and switch to the per-scan lr. (2) FAILURE MODE = DRIFT-OFF-INIT: high SSIM (0.9248, highest raw of any Mayo inference solver) yet hr 0 (at/below the FBP floor on the RMSE-sensitive calibrated metric) is the SAME signature the SIBLING dual_domain_n2i had at lr 1e-3 (iter-1 0.862/hr0, iter-2 0.868/hr0). The too-high per-scan lr makes the n_iter=30 fit DRIFT OFF the FBP-quality warm-start init -- it raises SSIM via smoothing but keeps PSNR below the FBP floor, so hr=0. Here lr=5e-3 is 5x the sibling's pre-win 1e-3 -> drift is even more aggressive. (3) ONE KNOB = per-scan lr DOWN, mirroring the sibling: the sibling cleared baseline at iter-3 by lr 1e-3->3e-4 (0.8681/hr0 -> 0.9185/hr 0.1506 KEEP). I land at the SAME proven anchor value lr=3e-4 (a 16.7x drop from my current 5e-3, appropriate since I start much higher). lr is a sigma/Adam-step knob: kernel/n_iter/214-scans/ FBP-adjoint cost ALL UNCHANGED -> 20-min budget identical to iter-2 (~924s = 15.4 min, ~276s slack inside 1200s) -- ZERO budget risk. (4) HYPOTHESIS: lr down ANCHORS the per-scan fit near the FBP warm-start init -> PSNR clears the FBP floor -> hr rises above 0 (predict ~0.1+, like the sibling's 0.1506). FALSIFIER (NUMBERS): if PSNR is still below the LD-FBP floor with lr=3e-4, the 6-param bilateral variant is STRUCTURALLY CAPPED on dense-view Mayo (unlike the U-Net N2I, whose extra capacity let lr-anchoring clear the floor) -- half-view N2I info loss < full-view FBP and no per-scan lr recovers it; that retires lr as a lever and the next probe is img_n_bf depth. (5) HARD 20-min budget; val=ALL 214 L277 slices (NOT reduced); PER-IMAGE preserved; in-solver outer_wall_s=1050 (17.5 min) backstop guarantees a recorded result. (6) Do NOT return control mid-campaign.", "advice_for_others": "dual_domain_bilateral_n2i-claude-agentic: warm_start=True, pretrain_epochs=1, pretrain_steps=20, n_iter=30, grad_clip=1.0, lr=0.0003, proj_n_bf=1, img_n_bf=1, proj_kernel=5, proj_sx=1.0, proj_sy=2.0, proj_sr=0.0005, img_kernel=7, img_sx=1.5, img_sy=1.5, img_sr=0.02, batch_size=1, train_n=200, val_n=214, outer_wall_s=1050, per_scene_s=None, seed=42, rationale=iter-3 (search-20260619-01, corrected 214-slice/321px-FOV metric). ONE KNOB: per-scan lr 0.005 -> 0.0003 (16.7x lower; mirrors the SIBLING dual_domain_n2i win). PER-IMAGE preserved (warm-start amortized pre-pass on 4 train patients -> generic BF-sigma init, then INDEPENDENT per-scan Adam fit on EACH L277 slice OWN half-angle measurements, GT-free; NEVER amortized). SIX-BOX (NUMBERS). (1) iter-1: SSIM 0.92477 / PSNR 34.033 / RMSE 9.938e-4 / hr 0 / lr 5e-3 / elapsed 940.4s. iter-2 (proj_sr 0.02->0.0005): SSIM 0.92473 / PSNR 34.017 / RMSE 9.956e-4 / hr 0 / lr 5e-3 / elapsed 924.1s. proj_sr tightening was INERT (SSIM/PSNR/RMSE flat to <0.05%) -> the bilateral range-sigma is NOT the lever; the falsifier from iter-2 fired, so retire proj_sr and switch to the per-scan lr. (2) FAILURE MODE = DRIFT-OFF-INIT: high SSIM (0.9248, highest raw of any Mayo inference solver) yet hr 0 (at/below the FBP floor on the RMSE-sensitive calibrated metric) is the SAME signature the SIBLING dual_domain_n2i had at lr 1e-3 (iter-1 0.862/hr0, iter-2 0.868/hr0). The too-high per-scan lr makes the n_iter=30 fit DRIFT OFF the FBP-quality warm-start init -- it raises SSIM via smoothing but keeps PSNR below the FBP floor, so hr=0. Here lr=5e-3 is 5x the sibling's pre-win 1e-3 -> drift is even more aggressive. (3) ONE KNOB = per-scan lr DOWN, mirroring the sibling: the sibling cleared baseline at iter-3 by lr 1e-3->3e-4 (0.8681/hr0 -> 0.9185/hr 0.1506 KEEP). I land at the SAME proven anchor value lr=3e-4 (a 16.7x drop from my current 5e-3, appropriate since I start much higher). lr is a sigma/Adam-step knob: kernel/n_iter/214-scans/ FBP-adjoint cost ALL UNCHANGED -> 20-min budget identical to iter-2 (~924s = 15.4 min, ~276s slack inside 1200s) -- ZERO budget risk. (4) HYPOTHESIS: lr down ANCHORS the per-scan fit near the FBP warm-start init -> PSNR clears the FBP floor -> hr rises above 0 (predict ~0.1+, like the sibling's 0.1506). FALSIFIER (NUMBERS): if PSNR is still below the LD-FBP floor with lr=3e-4, the 6-param bilateral variant is STRUCTURALLY CAPPED on dense-view Mayo (unlike the U-Net N2I, whose extra capacity let lr-anchoring clear the floor) -- half-view N2I info loss < full-view FBP and no per-scan lr recovers it; that retires lr as a lever and the next probe is img_n_bf depth. (5) HARD 20-min budget; val=ALL 214 L277 slices (NOT reduced); PER-IMAGE preserved; in-solver outer_wall_s=1050 (17.5 min) backstop guarantees a recorded result. (6) Do NOT return control mid-campaign.", "comparison_image": "runs/mayo-ldct-claude-agentic-dual-domain-bilateral-n2i-search-20260619-01/iterations/iter-0003/comparison.png"}
