{"ts": "2026-06-20T08:59:25Z", "run_id": "mayo-ldct-claude-agentic-dual-domain-bilateral-n2i-search-20260619-01", "iter": 5, "agent": "dual_domain_bilateral_n2i-claude-agentic", "model": "claude-opus-4-8-1m", "change_class": "architecture", "status": "discard", "kept": false, "val_score": 0.9246808886528015, "headroom": 0.0, "params_M": 9e-06, "train_n": 400, "rationale": "dual_domain_bilateral_n2i-claude-agentic: warm_start=True, pretrain_epochs=1, pretrain_steps=20, n_iter=30, grad_clip=1.0, lr=0.005, proj_n_bf=2, img_n_bf=1, proj_kernel=5, proj_sx=1.0, proj_sy=2.0, proj_sr=0.02, img_kernel=7, img_sx=1.5, img_sy=1.5, img_sr=0.02, batch_size=1, train_n=200, val_n=214, outer_wall_s=1050, per_scene_s=None, seed=42, rationale=iter-5 (search-20260619-01, corrected 214-slice/321px-FOV metric). ONE KNOB: proj_n_bf 1 -> 2 (projection-domain trainable-bilateral DEPTH; params 6 -> 9 via 3*(proj_n_bf+img_n_bf)=3*(2+1)). BASED OFF iter-1 (the best-PSNR config: lr 5e-3, img_n_bf 1, proj_sr 0.02 -- the untouched warm-start-anchored baseline; img_n_bf and lr REVERTED to their iter-1 values so this is genuinely ONE knob vs iter-1). PER-IMAGE preserved (warm-start amortized pre-pass on 4 train patients -> generic BF-sigma init, then INDEPENDENT per-scan Adam fit on EACH L277 slice OWN half-angle measurements, GT-free; NEVER amortized). SIX-BOX (NUMBERS). (1) TRAJECTORY: iter-1 lr5e-3 proj_sr0.02 img_n_bf1 -> SSIM 0.92477 / PSNR 34.033 / RMSE 9.938e-4 / hr 0 / 940.4s (HIGHEST raw SSIM+PSNR of the run); iter-2 proj_sr0.02->0.0005 -> SSIM 0.92473 / PSNR 34.017 / hr 0 / 924.1s (proj_sr INERT, falsifier fired); iter-3 lr5e-3->3e-4 -> SSIM 0.92142 / PSNR 33.650 / hr 0 / 863.4s (lr DOWN made it WORSE, falsifier fired); iter-4 img_n_bf1->2 -> SSIM 0.89748 / PSNR 31.498 / RMSE 1.331e-3 / hr 0 / 972.6s (IMAGE-domain depth REGRESSED hard, falsifier fired). Best hr 0.0 throughout. (2) LIMITER = 6-param trainable-bilateral CAPACITY CEILING on dense-view 2304-view Mayo: highest raw SSIM of any Mayo inference solver yet PSNR sits BELOW the LD-FBP floor -> hr 0. Three confirmed-dead levers (proj_sr inert, per-scan lr-down regressed, image-domain img_n_bf-up regressed). The sibling U-Net dual_domain_n2i CLEARED the floor (iter-4 hr 0.198) because it has a REAL denoiser; the few-param bilateral cannot. (3) ONE KNOB = proj_n_bf 1->2: image-domain depth (iter-4) regressed and image-domain sigma is inert (iter-2), so the remaining untested per-image axis is the PROJECTION domain -- which iter-2 established is Mayo bilateral lever-SIDE (proj, not image). proj_n_bf adds DOF on the lever-side rather than the regressing image-side. Modest +1 step (matches the supervised-sibling instability caution at big jumps). (4) HYPOTHESIS: adding ONE projection-domain bilateral layer denoises the dense 2304-view sinogram BEFORE backprojection without the image-domain over-smoothing that regressed iter-4 -> RMSE drops -> PSNR clears the LD-FBP floor -> hr rises above 0 (predict hr ~0.0-0.05, edging toward the U-Net sibling). FALSIFIER (NUMBERS): if hr stays 0 (PSNR <= iter-1 34.03 with no RMSE drop) at proj_n_bf=2, then proj-domain depth is ALSO exhausted and the trainable-bilateral N2I is STRUCTURALLY CAPPED on dense-view Mayo regardless of which domain gets capacity -- every per-image knob (proj_sr, lr, img_n_bf, proj_n_bf) retired, structural-ceiling verdict filed: only the U-Net N2I real-denoiser capacity clears the FBP floor here (half-view N2I info loss < full-view LD-FBP). (5) BUDGET (HARD 20-min = 1200s): proj_n_bf 1->2 adds ONE proj-domain BF fwd+bwd per Adam step; dominant cost is the 2304-view FBP adjoint (FLAT in proj_n_bf). iter-1 base 940.4s; +1 proj-BF layer adds <~10% -> expect ~1000s = ~16.7 min, inside 1200s with ~200s slack. n_iter=30, val=ALL 214, grad_clip=1.0 MANDATORY, lr/img_n_bf reverted to iter-1. in-solver outer_wall_s=1050 (17.5 min) backstop guarantees a recorded result. (6) HARD 20-min budget; val=ALL 214 L277 slices (NOT reduced); PER-IMAGE preserved (warm_start True, grad_clip 1.0, img_sr 0.02 NOT tightened). Do NOT return control mid-campaign. PREDICTED iter-5: hr ~0.0-0.05 if proj-domain capacity helps; hr<=0 falsifies (bilateral structurally capped on Mayo regardless of domain, only U-Net N2I works).", "advice_for_others": "dual_domain_bilateral_n2i-claude-agentic: warm_start=True, pretrain_epochs=1, pretrain_steps=20, n_iter=30, grad_clip=1.0, lr=0.005, proj_n_bf=2, img_n_bf=1, proj_kernel=5, proj_sx=1.0, proj_sy=2.0, proj_sr=0.02, img_kernel=7, img_sx=1.5, img_sy=1.5, img_sr=0.02, batch_size=1, train_n=200, val_n=214, outer_wall_s=1050, per_scene_s=None, seed=42, rationale=iter-5 (search-20260619-01, corrected 214-slice/321px-FOV metric). ONE KNOB: proj_n_bf 1 -> 2 (projection-domain trainable-bilateral DEPTH; params 6 -> 9 via 3*(proj_n_bf+img_n_bf)=3*(2+1)). BASED OFF iter-1 (the best-PSNR config: lr 5e-3, img_n_bf 1, proj_sr 0.02 -- the untouched warm-start-anchored baseline; img_n_bf and lr REVERTED to their iter-1 values so this is genuinely ONE knob vs iter-1). PER-IMAGE preserved (warm-start amortized pre-pass on 4 train patients -> generic BF-sigma init, then INDEPENDENT per-scan Adam fit on EACH L277 slice OWN half-angle measurements, GT-free; NEVER amortized). SIX-BOX (NUMBERS). (1) TRAJECTORY: iter-1 lr5e-3 proj_sr0.02 img_n_bf1 -> SSIM 0.92477 / PSNR 34.033 / RMSE 9.938e-4 / hr 0 / 940.4s (HIGHEST raw SSIM+PSNR of the run); iter-2 proj_sr0.02->0.0005 -> SSIM 0.92473 / PSNR 34.017 / hr 0 / 924.1s (proj_sr INERT, falsifier fired); iter-3 lr5e-3->3e-4 -> SSIM 0.92142 / PSNR 33.650 / hr 0 / 863.4s (lr DOWN made it WORSE, falsifier fired); iter-4 img_n_bf1->2 -> SSIM 0.89748 / PSNR 31.498 / RMSE 1.331e-3 / hr 0 / 972.6s (IMAGE-domain depth REGRESSED hard, falsifier fired). Best hr 0.0 throughout. (2) LIMITER = 6-param trainable-bilateral CAPACITY CEILING on dense-view 2304-view Mayo: highest raw SSIM of any Mayo inference solver yet PSNR sits BELOW the LD-FBP floor -> hr 0. Three confirmed-dead levers (proj_sr inert, per-scan lr-down regressed, image-domain img_n_bf-up regressed). The sibling U-Net dual_domain_n2i CLEARED the floor (iter-4 hr 0.198) because it has a REAL denoiser; the few-param bilateral cannot. (3) ONE KNOB = proj_n_bf 1->2: image-domain depth (iter-4) regressed and image-domain sigma is inert (iter-2), so the remaining untested per-image axis is the PROJECTION domain -- which iter-2 established is Mayo bilateral lever-SIDE (proj, not image). proj_n_bf adds DOF on the lever-side rather than the regressing image-side. Modest +1 step (matches the supervised-sibling instability caution at big jumps). (4) HYPOTHESIS: adding ONE projection-domain bilateral layer denoises the dense 2304-view sinogram BEFORE backprojection without the image-domain over-smoothing that regressed iter-4 -> RMSE drops -> PSNR clears the LD-FBP floor -> hr rises above 0 (predict hr ~0.0-0.05, edging toward the U-Net sibling). FALSIFIER (NUMBERS): if hr stays 0 (PSNR <= iter-1 34.03 with no RMSE drop) at proj_n_bf=2, then proj-domain depth is ALSO exhausted and the trainable-bilateral N2I is STRUCTURALLY CAPPED on dense-view Mayo regardless of which domain gets capacity -- every per-image knob (proj_sr, lr, img_n_bf, proj_n_bf) retired, structural-ceiling verdict filed: only the U-Net N2I real-denoiser capacity clears the FBP floor here (half-view N2I info loss < full-view LD-FBP). (5) BUDGET (HARD 20-min = 1200s): proj_n_bf 1->2 adds ONE proj-domain BF fwd+bwd per Adam step; dominant cost is the 2304-view FBP adjoint (FLAT in proj_n_bf). iter-1 base 940.4s; +1 proj-BF layer adds <~10% -> expect ~1000s = ~16.7 min, inside 1200s with ~200s slack. n_iter=30, val=ALL 214, grad_clip=1.0 MANDATORY, lr/img_n_bf reverted to iter-1. in-solver outer_wall_s=1050 (17.5 min) backstop guarantees a recorded result. (6) HARD 20-min budget; val=ALL 214 L277 slices (NOT reduced); PER-IMAGE preserved (warm_start True, grad_clip 1.0, img_sr 0.02 NOT tightened). Do NOT return control mid-campaign. PREDICTED iter-5: hr ~0.0-0.05 if proj-domain capacity helps; hr<=0 falsifies (bilateral structurally capped on Mayo regardless of domain, only U-Net N2I works).", "comparison_image": "runs/mayo-ldct-claude-agentic-dual-domain-bilateral-n2i-search-20260619-01/iterations/iter-0005/comparison.png"}
{"ts": "2026-06-20T08:30:53Z", "run_id": "mayo-ldct-claude-agentic-dual-domain-bilateral-supervised-search-20260619-01", "iter": 5, "agent": "dual_domain_bilateral_supervised-claude-agentic", "model": "claude-opus-4-8-1m", "change_class": "architecture", "status": "keep", "kept": true, "val_score": 0.9178164005279541, "headroom": 0.009801126947688865, "params_M": 1.2e-05, "train_n": 400, "rationale": "dual_domain_bilateral_supervised-claude-agentic: proj_n_bf=1, img_n_bf=3, proj_kernel=3, proj_sx=0.01, proj_sy=0.3, proj_sr=0.0005, img_kernel=5, img_sx=0.5, img_sy=0.5, img_sr=0.02, lr=0.005, epochs=12, batch_size=1, val_chunk=1, train_n=480, val_n=214, grad_clip=1.0, lambda_neg=1.0, seed=42, rationale=ITER-5 (search-20260619-01, corrected 214-slice/321px-FOV metric). BASE = iter-2 BEST (proj_n_bf=1, img_n_bf=3, 12 params, hr 0.028237) -- NOT iter-4 flat proj_n_bf=2 NOR iter-3 regressed img_n_bf=6. ONE KNOB: train_n 200->480 (DATA-COVERAGE lever -- the only untried axis). epochs traded 24->12 to hold the HARD 20-min wall AND keep grad-steps near parity (480*12=5760 vs iter-2 200*24=4800) so this isolates DATA COVERAGE from extra optimization. MECHANISM VERIFIED (REQUIRED before train_n lever): solver_dual_ddomain_bilateral_supervised.py build_dataset calls load_val_split(split=train, n=train_n) then torch.randperm(train_noisy.shape[0]) per epoch -- a FIXED stratified subset reshuffled each epoch, NOT RotatingSubsetDataset. At train_n=200 the net sees only ~35%% of the 579-slice train pool (same fixed-subset mechanism CONFIRMED-POSITIVE for uswin +0.030 and dual_domain_supervised +0.034). So train_n IS load-bearing here. (The iter-1 rationale claim that the loader rotates the ps-pool was WRONG -- the code is a fixed subset.) SIX-BOX (NUMBERS, hr=metric of record): (1) iter-1 hr 0.027984 SSIM 0.91918 254.3s ep8 12p; iter-2 hr 0.028237 SSIM 0.91916 449.6s ep24 12p = BEST; iter-3 hr 0.0 SSIM 0.90569 574.3s img_n_bf=6 21p = REGRESSED (image-domain capacity DESTABILIZED); iter-4 hr 0.028237 SSIM 0.91916 520.7s proj_n_bf=2 15p = FLAT. (2) LIMITER: every IN-ARCHITECTURE knob exhausted+flat -- epochs inert (8->24), image-domain capacity HURTS (img_n_bf 3->6 -> hr 0), projection-domain capacity flat (proj_n_bf 1->2). The 12-param bilateral is pinned at hr~0.028 by every scalar/capacity move. The ONE untouched axis is DATA COVERAGE (train_n frozen 200 = 35%% of pool). (3) ONE KNOB = train_n 200->480 (epochs 24->12 is the budget-trade to hold the wall, kept near grad-step parity -- not a second hypothesis). (4) HYPOTHESIS: train_n 200->480 (83%% vs 35%% of the 579-slice pool) lifts hr above 0.028237, mirroring the fixed-subset trainers uswin (+0.030) and dual_domain_supervised (+0.034 -> Mayo champion), because more anatomy variety lets the supervised-MSE gradient drive the BF sigmas toward a better RMSE-optimum. This is the SINGLE MOST INFORMATIVE remaining experiment -- it definitively answers data-limited vs structural-ceiling for this solver. NUMERIC FALSIFIER: if hr stays <=0.030 (flat) at train_n=480, the 12-param bilateral has TOO LITTLE CAPACITY to exploit more data (exactly like wu_2015 hr 0.0508->0.0411 and hammernik_vn hr 0 which BOTH FAILED this lever) -> FILE THE STRUCTURAL-CEILING VERDICT: dd_bilat_sup is capacity-limited NOT data-limited, hr~0.028 is the few-param-bilateral structural ceiling on real 2304-view Mayo LDCT. (5) BUDGET: HARD 1200s train+score. Measured: iter-1 254.3s ep8/tn200, iter-2 449.6s ep24/tn200 -> 16 extra epochs = 195.3s -> ~12.2s/epoch@tn200, fixed cost (214-slice val + fig setup) ~157s. Per-epoch ~ train_n, so tn480 -> ~29.3s/epoch. ep12@tn480 -> est ~157 + 12*29.3 = ~509s << 1200s (max-epoch ceiling at this train_n ~35; ep12 leaves wide margin). val_n=214 KEPT, grad_clip=1.0 KEPT, all sigmas/kernels/lr/lambda_neg/seed identical to iter-2. 30-min sbatch wall = SLURM net. (6) Loop continues -- no control returned. HARD-WIRED (unchanged): staged_canonical data, v3 mayo_ldct_fitted geometry, per-sample-ps (mayo_per_sample_setup/_fbp, per-sample pipe.R_full swap), bg_target=truth, val=ALL 214 L277 slices under the 321px detector-geometry FOV (evaluate_calibrated default for AGENT4CT_DATASET=mayo_ldct_2d; NO fov= override).", "advice_for_others": "dual_domain_bilateral_supervised-claude-agentic: proj_n_bf=1, img_n_bf=3, proj_kernel=3, proj_sx=0.01, proj_sy=0.3, proj_sr=0.0005, img_kernel=5, img_sx=0.5, img_sy=0.5, img_sr=0.02, lr=0.005, epochs=12, batch_size=1, val_chunk=1, train_n=480, val_n=214, grad_clip=1.0, lambda_neg=1.0, seed=42, rationale=ITER-5 (search-20260619-01, corrected 214-slice/321px-FOV metric). BASE = iter-2 BEST (proj_n_bf=1, img_n_bf=3, 12 params, hr 0.028237) -- NOT iter-4 flat proj_n_bf=2 NOR iter-3 regressed img_n_bf=6. ONE KNOB: train_n 200->480 (DATA-COVERAGE lever -- the only untried axis). epochs traded 24->12 to hold the HARD 20-min wall AND keep grad-steps near parity (480*12=5760 vs iter-2 200*24=4800) so this isolates DATA COVERAGE from extra optimization. MECHANISM VERIFIED (REQUIRED before train_n lever): solver_dual_ddomain_bilateral_supervised.py build_dataset calls load_val_split(split=train, n=train_n) then torch.randperm(train_noisy.shape[0]) per epoch -- a FIXED stratified subset reshuffled each epoch, NOT RotatingSubsetDataset. At train_n=200 the net sees only ~35%% of the 579-slice train pool (same fixed-subset mechanism CONFIRMED-POSITIVE for uswin +0.030 and dual_domain_supervised +0.034). So train_n IS load-bearing here. (The iter-1 rationale claim that the loader rotates the ps-pool was WRONG -- the code is a fixed subset.) SIX-BOX (NUMBERS, hr=metric of record): (1) iter-1 hr 0.027984 SSIM 0.91918 254.3s ep8 12p; iter-2 hr 0.028237 SSIM 0.91916 449.6s ep24 12p = BEST; iter-3 hr 0.0 SSIM 0.90569 574.3s img_n_bf=6 21p = REGRESSED (image-domain capacity DESTABILIZED); iter-4 hr 0.028237 SSIM 0.91916 520.7s proj_n_bf=2 15p = FLAT. (2) LIMITER: every IN-ARCHITECTURE knob exhausted+flat -- epochs inert (8->24), image-domain capacity HURTS (img_n_bf 3->6 -> hr 0), projection-domain capacity flat (proj_n_bf 1->2). The 12-param bilateral is pinned at hr~0.028 by every scalar/capacity move. The ONE untouched axis is DATA COVERAGE (train_n frozen 200 = 35%% of pool). (3) ONE KNOB = train_n 200->480 (epochs 24->12 is the budget-trade to hold the wall, kept near grad-step parity -- not a second hypothesis). (4) HYPOTHESIS: train_n 200->480 (83%% vs 35%% of the 579-slice pool) lifts hr above 0.028237, mirroring the fixed-subset trainers uswin (+0.030) and dual_domain_supervised (+0.034 -> Mayo champion), because more anatomy variety lets the supervised-MSE gradient drive the BF sigmas toward a better RMSE-optimum. This is the SINGLE MOST INFORMATIVE remaining experiment -- it definitively answers data-limited vs structural-ceiling for this solver. NUMERIC FALSIFIER: if hr stays <=0.030 (flat) at train_n=480, the 12-param bilateral has TOO LITTLE CAPACITY to exploit more data (exactly like wu_2015 hr 0.0508->0.0411 and hammernik_vn hr 0 which BOTH FAILED this lever) -> FILE THE STRUCTURAL-CEILING VERDICT: dd_bilat_sup is capacity-limited NOT data-limited, hr~0.028 is the few-param-bilateral structural ceiling on real 2304-view Mayo LDCT. (5) BUDGET: HARD 1200s train+score. Measured: iter-1 254.3s ep8/tn200, iter-2 449.6s ep24/tn200 -> 16 extra epochs = 195.3s -> ~12.2s/epoch@tn200, fixed cost (214-slice val + fig setup) ~157s. Per-epoch ~ train_n, so tn480 -> ~29.3s/epoch. ep12@tn480 -> est ~157 + 12*29.3 = ~509s << 1200s (max-epoch ceiling at this train_n ~35; ep12 leaves wide margin). val_n=214 KEPT, grad_clip=1.0 KEPT, all sigmas/kernels/lr/lambda_neg/seed identical to iter-2. 30-min sbatch wall = SLURM net. (6) Loop continues -- no control returned. HARD-WIRED (unchanged): staged_canonical data, v3 mayo_ldct_fitted geometry, per-sample-ps (mayo_per_sample_setup/_fbp, per-sample pipe.R_full swap), bg_target=truth, val=ALL 214 L277 slices under the 321px detector-geometry FOV (evaluate_calibrated default for AGENT4CT_DATASET=mayo_ldct_2d; NO fov= override).", "comparison_image": "runs/mayo-ldct-claude-agentic-dual-domain-bilateral-supervised-search-20260619-01/iterations/iter-0005/comparison.png"}
