{"ts": "2026-06-20T12:04:07Z", "run_id": "mayo-ldct-claude-agentic-learned-primal-dual-search-20260619-01", "iter": 6, "agent": "learned_primal_dual-claude-agentic", "model": "claude-opus-4-8-1m", "change_class": "architecture", "status": "discard", "kept": false, "val_score": 0.8313018083572388, "headroom": 0.0, "params_M": 0.25901, "train_n": 400, "rationale": "learned_primal_dual-claude-agentic: lpd_iters=5, lpd_hidden=48, lpd_n_primal=5, lpd_n_dual=5, lpd_share_weights=False, lr=0.0007, lr_schedule=cosine, epochs=6, batch_size=1, val_chunk=1, train_n=200, val_n=214, grad_clip=1.0, seed=42, rationale=iter-6 search-20260619-01: ONE knob = lpd_iters 3 -> 5 (UNROLL DEPTH), the LPD-DEFINING lever and the only remaining axis that directly tests the structural hypothesis. BASE_ITER=4 (best-SSIM config: lr=7e-4 cosine, lpd_hidden=48, n_primal=5, n_dual=5, batch=1, val_chunk=1, val_n=214, grad_clip=1.0, seed=42). PRIOR ARC (ALL hr=0): SSIM 0.84271(it1 iters5/ep6/lr5e-4) -> 0.863635(it2) -> 0.885115(it3) -> 0.898033(it4 BEST, iters3/ep10/lr7e-4) -> 0.88446(it5 train_n300/ep7, epochs-cut-confounded but LOWEST RMSE 1.139e-3 yet STILL hr0). hr pinned at the LD-FBP floor the ENTIRE arc. LIMITER (STRUCTURAL CEILING, named): LPD is a projector-in-loop unrolled primal-dual net; its learned proximal updates only add value where the FBP adjoint leaves RESIDUAL STRUCTURE to recover (sparse/limited-view, ill-posed inverse). On DENSE 2304-view Mayo the LD-FBP is NEAR-COMPLETE (2304 views >> Nyquist; well-conditioned operator), so there is NO ill-posedness headroom for the unrolled updates to exploit -> LPD sharpens structure (rising SSIM) but cannot push RMSE below the already-near-optimal LD-FBP -> hr=0 regardless of capacity/epochs/lr/data. SAME mechanism makes LPD the breast/demo CHAMPION (128-view SPARSE -> FBP incomplete -> huge headroom) yet hr=0 on dense Mayo. iter-5 already FALSIFIED the data lever (train_n 200->300 fell to 0.88446). REMAINING UNTRIED AXIS = unroll DEPTH itself: lpd_iters 3->5 doubles-ish the learned primal-dual correction steps. If Mayo had ANY FBP-incompleteness headroom, deeper unrolling (the thing that makes LPD an unrolled net, not a U-Net) is exactly where it would surface. BUDGET MATH vs 1200s: iters=5 raises per-sample projector fwd+adj cost ~5/3x vs iters=3, so epochs traded 10->6 AND train_n 300->200 to hold the wall. EMPIRICALLY CONFIRMED FIT: iter-1 ran iters5/ep6/tn200 = 1149.5s = 19.2min < 1200s; iter-6 is compute-identical (only lr 5e-4->7e-4 changes, lr does not change FLOPs) -> ~1150s, +50s margin. ep7 at iters5 would be ~1340s (OVER the wall) so ep6 is the budget-fit point; lpd_hidden^ stays OFF. HYP: deeper unroll at the TUNED lr 7e-4 (iter-1 was iters5 but at UNTUNED lr 5e-4 / first-feasibility ep6, scored 0.84271) extracts more FBP-residual correction; predict SSIM ~0.86-0.90, and IF any Mayo FBP-incompleteness exists, hr lifts >0 for the first time on LPD Mayo. FALSIFIER: hr stays 0.000 (and SSIM <= 0.898 since ep6 under-trains vs iter-4 ep10) => deeper unrolling does NOT help => DEFINITIVE structural ceiling: dense 2304-view LD-FBP is near-complete, LPD has no ill-posedness to exploit, FBP-bounded regardless of unroll depth. The path now DOCUMENTS the ceiling toward iter-20.", "advice_for_others": "learned_primal_dual-claude-agentic: lpd_iters=5, lpd_hidden=48, lpd_n_primal=5, lpd_n_dual=5, lpd_share_weights=False, lr=0.0007, lr_schedule=cosine, epochs=6, batch_size=1, val_chunk=1, train_n=200, val_n=214, grad_clip=1.0, seed=42, rationale=iter-6 search-20260619-01: ONE knob = lpd_iters 3 -> 5 (UNROLL DEPTH), the LPD-DEFINING lever and the only remaining axis that directly tests the structural hypothesis. BASE_ITER=4 (best-SSIM config: lr=7e-4 cosine, lpd_hidden=48, n_primal=5, n_dual=5, batch=1, val_chunk=1, val_n=214, grad_clip=1.0, seed=42). PRIOR ARC (ALL hr=0): SSIM 0.84271(it1 iters5/ep6/lr5e-4) -> 0.863635(it2) -> 0.885115(it3) -> 0.898033(it4 BEST, iters3/ep10/lr7e-4) -> 0.88446(it5 train_n300/ep7, epochs-cut-confounded but LOWEST RMSE 1.139e-3 yet STILL hr0). hr pinned at the LD-FBP floor the ENTIRE arc. LIMITER (STRUCTURAL CEILING, named): LPD is a projector-in-loop unrolled primal-dual net; its learned proximal updates only add value where the FBP adjoint leaves RESIDUAL STRUCTURE to recover (sparse/limited-view, ill-posed inverse). On DENSE 2304-view Mayo the LD-FBP is NEAR-COMPLETE (2304 views >> Nyquist; well-conditioned operator), so there is NO ill-posedness headroom for the unrolled updates to exploit -> LPD sharpens structure (rising SSIM) but cannot push RMSE below the already-near-optimal LD-FBP -> hr=0 regardless of capacity/epochs/lr/data. SAME mechanism makes LPD the breast/demo CHAMPION (128-view SPARSE -> FBP incomplete -> huge headroom) yet hr=0 on dense Mayo. iter-5 already FALSIFIED the data lever (train_n 200->300 fell to 0.88446). REMAINING UNTRIED AXIS = unroll DEPTH itself: lpd_iters 3->5 doubles-ish the learned primal-dual correction steps. If Mayo had ANY FBP-incompleteness headroom, deeper unrolling (the thing that makes LPD an unrolled net, not a U-Net) is exactly where it would surface. BUDGET MATH vs 1200s: iters=5 raises per-sample projector fwd+adj cost ~5/3x vs iters=3, so epochs traded 10->6 AND train_n 300->200 to hold the wall. EMPIRICALLY CONFIRMED FIT: iter-1 ran iters5/ep6/tn200 = 1149.5s = 19.2min < 1200s; iter-6 is compute-identical (only lr 5e-4->7e-4 changes, lr does not change FLOPs) -> ~1150s, +50s margin. ep7 at iters5 would be ~1340s (OVER the wall) so ep6 is the budget-fit point; lpd_hidden^ stays OFF. HYP: deeper unroll at the TUNED lr 7e-4 (iter-1 was iters5 but at UNTUNED lr 5e-4 / first-feasibility ep6, scored 0.84271) extracts more FBP-residual correction; predict SSIM ~0.86-0.90, and IF any Mayo FBP-incompleteness exists, hr lifts >0 for the first time on LPD Mayo. FALSIFIER: hr stays 0.000 (and SSIM <= 0.898 since ep6 under-trains vs iter-4 ep10) => deeper unrolling does NOT help => DEFINITIVE structural ceiling: dense 2304-view LD-FBP is near-complete, LPD has no ill-posedness to exploit, FBP-bounded regardless of unroll depth. The path now DOCUMENTS the ceiling toward iter-20.", "comparison_image": "runs/mayo-ldct-claude-agentic-learned-primal-dual-search-20260619-01/iterations/iter-0006/comparison.png"}
{"ts": "2026-06-20T12:01:12Z", "run_id": "mayo-ldct-claude-agentic-uswin-search-20260619-01", "iter": 6, "agent": "uswin-claude-agentic", "model": "claude-opus-4-8-1m", "change_class": "architecture", "status": "keep", "kept": true, "val_score": 0.9387279748916626, "headroom": 0.40977483534782566, "params_M": 3.954049, "train_n": 400, "rationale": "uswin-claude-agentic: train_n=579, val_n=214, epochs=21, batch_size=4, lr=0.0005, uswin_c=24, swin_window=8, swin_heads=4, grad_clip=1.0, max_train_s=970, seed=42, rationale=ITER-6 (search-20260619-01, corrected protocol). START FROM iter-5 BEST (tn480/ep26/c24, hr 0.3829, #2 on the Mayo board). ONE KNOB: TRAINING DATA train_n 480 -> 579 (FULL 579-slice pool, 100pct coverage), with epochs TRADED DOWN 26 -> 21 to fit the HARD 20-min (1200s) train+score wall. uswin_c stays 24 (iter-3/5 best), all else identical to iter-5 (val_n=214, bs=4, lr=5e-4, swin_window=8, swin_heads=4, grad_clip=1.0, seed=42). SIX-BOX (NUMBERS). (1) TRAJECTORY iter-1 ep10/tn200 -> hr 0.173021 in 328.96s; iter-2 ep40/tn200 -> 0.322063 in 737.72s; iter-3 ep64/tn200 -> 0.353196 in 1085.87s; iter-4 c32/ep34/tn200 REGRESSED -> 0.272533 in 760.76s (capacity-for-epochs trade FAILED); iter-5 tn480/ep26/c24 -> 0.382872 / SSIM 0.921690 / PSNR 38.27 in 1154.72s (CURRENT BEST, #2 on the Mayo board). best hr = 0.382872 @iter-5. (2) LIMITER: the DATA-COVERAGE lever just delivered uswin biggest single jump (+0.0297, 0.3532->0.3829) DESPITE trading epochs 64->26 -- coverage DOMINATED the epoch loss, so the binding constraint is the LAST 17pct of the train pool, NOT epochs. iter-5 trained on 480/579 = 82.9pct coverage; the remaining 99 distinct slices (480->579) are data the net has NEVER seen. The champion dual_domain_supervised went all the way to train_n=579 (full pool) to hit 0.3994 -- the proven path. Epoch-starvation at ep26 is the WEAKER hypothesis (the data jump worked despite fewer epochs). solver_uswin.py does NOT use RotatingSubsetDataset -- build_dataset calls load_val_split once for a FIXED train_n set and reshuffles the SAME samples every epoch via torch.randperm, so train_n IS load-bearing: tn579 loads strictly MORE distinct slices (the full 154+98+327 = 579 pool spanning all 3 ps-groups / 4 train patients). (3) ONE KNOB: train_n 480->579 (epochs 26->21 is a forced budget-trade, not a second free knob; c stays iter-5 24). BUDGET-TRADE MATH (worst-case-sized): iter-5 exact calibration: per_sample_epoch = (1154.72-157)/(26*480) = 0.07995 s/sample-epoch (matches iter-5 worst-case 0.07981 estimate -> calibration exact); fixed (data load + 214-slice per-sample val + figure I/O, train_n-independent since val fixed at 214) = 157s. At tn579 per_epoch = 579*0.07995 = 46.3 s/epoch. ep21 = 157 + 21*46.3 = 1129s = 18.8 min (71s margin inside 1200s); ep22 = 1175s = 19.6 min (only 25s margin -> too tight given iter-5 already ran hot to 1154.72s), so ep21 is the LARGEST epoch count guaranteed to fit. Train-only = 21*46.3 = 972s; max_train_s=970 set as the HARD train-only backstop so even at hot per-sample cost train halts <=970s leaving >=230s for the worst-case 214-slice val+figure inside the 1200s budget. (4) HYPOTHESIS: the final 17pct of the train pool (480->579 distinct slices, completing the full pool exactly as the champion did) lifts hr above the iter-5 0.382872, because uswin hr rose monotonically with coverage (200->480 gained +0.0297) and the champion proved 480->579 is worth ~0.015-0.02 headroom. Predicted iter-6 hr ~0.39-0.40. FALSIFIER (NUMBERS): if hr <= 0.382872 at tn579/ep21, uswin is at its budget-constrained ceiling (~0.383) -- the last data slug could not overcome the ep26->21 trade -- and it stays #2 behind dual_domain_supervised (0.3994). (5) HARD 20-min train+score budget; val_n=214 = ALL L277 slices (NOT reduced); grad_clip=1.0 retained (mandatory; the 2304-view Mayo FBP adjoint amplifies gradients). HARD-WIRED (unchanged): staged_canonical v3 mayo_ldct_fitted geometry, per-sample-ps FBP, bg_target=truth, metric=321px detector-geometry FOV (evaluate_calibrated default for AGENT4CT_DATASET=mayo_ldct_2d; no fov= override). (6) no control return.", "advice_for_others": "uswin-claude-agentic: train_n=579, val_n=214, epochs=21, batch_size=4, lr=0.0005, uswin_c=24, swin_window=8, swin_heads=4, grad_clip=1.0, max_train_s=970, seed=42, rationale=ITER-6 (search-20260619-01, corrected protocol). START FROM iter-5 BEST (tn480/ep26/c24, hr 0.3829, #2 on the Mayo board). ONE KNOB: TRAINING DATA train_n 480 -> 579 (FULL 579-slice pool, 100pct coverage), with epochs TRADED DOWN 26 -> 21 to fit the HARD 20-min (1200s) train+score wall. uswin_c stays 24 (iter-3/5 best), all else identical to iter-5 (val_n=214, bs=4, lr=5e-4, swin_window=8, swin_heads=4, grad_clip=1.0, seed=42). SIX-BOX (NUMBERS). (1) TRAJECTORY iter-1 ep10/tn200 -> hr 0.173021 in 328.96s; iter-2 ep40/tn200 -> 0.322063 in 737.72s; iter-3 ep64/tn200 -> 0.353196 in 1085.87s; iter-4 c32/ep34/tn200 REGRESSED -> 0.272533 in 760.76s (capacity-for-epochs trade FAILED); iter-5 tn480/ep26/c24 -> 0.382872 / SSIM 0.921690 / PSNR 38.27 in 1154.72s (CURRENT BEST, #2 on the Mayo board). best hr = 0.382872 @iter-5. (2) LIMITER: the DATA-COVERAGE lever just delivered uswin biggest single jump (+0.0297, 0.3532->0.3829) DESPITE trading epochs 64->26 -- coverage DOMINATED the epoch loss, so the binding constraint is the LAST 17pct of the train pool, NOT epochs. iter-5 trained on 480/579 = 82.9pct coverage; the remaining 99 distinct slices (480->579) are data the net has NEVER seen. The champion dual_domain_supervised went all the way to train_n=579 (full pool) to hit 0.3994 -- the proven path. Epoch-starvation at ep26 is the WEAKER hypothesis (the data jump worked despite fewer epochs). solver_uswin.py does NOT use RotatingSubsetDataset -- build_dataset calls load_val_split once for a FIXED train_n set and reshuffles the SAME samples every epoch via torch.randperm, so train_n IS load-bearing: tn579 loads strictly MORE distinct slices (the full 154+98+327 = 579 pool spanning all 3 ps-groups / 4 train patients). (3) ONE KNOB: train_n 480->579 (epochs 26->21 is a forced budget-trade, not a second free knob; c stays iter-5 24). BUDGET-TRADE MATH (worst-case-sized): iter-5 exact calibration: per_sample_epoch = (1154.72-157)/(26*480) = 0.07995 s/sample-epoch (matches iter-5 worst-case 0.07981 estimate -> calibration exact); fixed (data load + 214-slice per-sample val + figure I/O, train_n-independent since val fixed at 214) = 157s. At tn579 per_epoch = 579*0.07995 = 46.3 s/epoch. ep21 = 157 + 21*46.3 = 1129s = 18.8 min (71s margin inside 1200s); ep22 = 1175s = 19.6 min (only 25s margin -> too tight given iter-5 already ran hot to 1154.72s), so ep21 is the LARGEST epoch count guaranteed to fit. Train-only = 21*46.3 = 972s; max_train_s=970 set as the HARD train-only backstop so even at hot per-sample cost train halts <=970s leaving >=230s for the worst-case 214-slice val+figure inside the 1200s budget. (4) HYPOTHESIS: the final 17pct of the train pool (480->579 distinct slices, completing the full pool exactly as the champion did) lifts hr above the iter-5 0.382872, because uswin hr rose monotonically with coverage (200->480 gained +0.0297) and the champion proved 480->579 is worth ~0.015-0.02 headroom. Predicted iter-6 hr ~0.39-0.40. FALSIFIER (NUMBERS): if hr <= 0.382872 at tn579/ep21, uswin is at its budget-constrained ceiling (~0.383) -- the last data slug could not overcome the ep26->21 trade -- and it stays #2 behind dual_domain_supervised (0.3994). (5) HARD 20-min train+score budget; val_n=214 = ALL L277 slices (NOT reduced); grad_clip=1.0 retained (mandatory; the 2304-view Mayo FBP adjoint amplifies gradients). HARD-WIRED (unchanged): staged_canonical v3 mayo_ldct_fitted geometry, per-sample-ps FBP, bg_target=truth, metric=321px detector-geometry FOV (evaluate_calibrated default for AGENT4CT_DATASET=mayo_ldct_2d; no fov= override). (6) no control return.", "comparison_image": "runs/mayo-ldct-claude-agentic-uswin-search-20260619-01/iterations/iter-0006/comparison.png"}
{"ts": "2026-06-20T11:45:28Z", "run_id": "mayo-ldct-claude-agentic-dual-domain-supervised-search-20260619-01", "iter": 6, "agent": "dual_domain_supervised-claude-agentic", "model": "claude-opus-4-8-1m", "change_class": "architecture", "status": "keep", "kept": true, "val_score": 0.9326096177101135, "headroom": 0.4157936454392316, "params_M": 0.465762, "train_n": 400, "rationale": "dual_domain_supervised-claude-agentic: unet_c=16, lr=0.0001, epochs=10, batch_size=1, val_chunk=1, train_n=579, val_n=214, grad_clip=1.0, lambda_neg=1.0, seed=42, rationale=ITER-6 (search-20260619-01, corrected protocol). BASE_ITER=5 (the CHAMPION: unet_c=16/lr=1e-4/epochs=9/train_n=579/lambda_neg=1.0/grad_clip=1.0/seed=42, hr 0.39940). ONE KNOB: epochs 9 -> 10 at the FULL train pool train_n=579 (everything else identical). SIX-BOX (NUMBERS). (1) iter-5 champion: SSIM 0.923056 / hr 0.399405 at ep9/train_n=579/c16/lr1e-4, elapsed_s=1082.13s (18.0 min, ~118s headroom UNSPENT inside the 1200s wall). (2) LIMITER: data coverage is MAXED (train_n=579 = the ENTIRE Wagner train pool; cannot rise). Capacity REGRESSED (iter-4 c24/ep10 -> hr 0.29856, BELOW iter-3, trading epochs to fund conv-compute under-trained the bigger net). No lr-schedule is wired (FORBIDDEN to edit the shared solver). The epochs lever was NEVER converged: at train_n=200 hr rose monotonically ep8 0.276 -> ep20 0.339 -> ep27 0.3654 (still climbing at the wall), then the data lever lifted ep9/579 to 0.3994. So at ep9 on the full 579-slice pool the net sees all the anatomy but for very few passes -> it is UNDER-TRAINED (epoch-starved on the larger pool), NOT capacity- or lr-limited. The ONLY within-budget lever left is recovering epochs, and iter-5 left ~118s of the 1200s budget UNSPENT, so +1 epoch now fits. (3) ONE KNOB: epochs 9 -> 10 at train_n=579. BUDGET-TRADE MATH from the MEASURED iter-5 full-pool point: fixed (data load + 214-slice per-sample val + figure I/O) ~125s -> measured per-epoch on 579 slices = (1082.13-125)/9 = 106.3 s/epoch (LOWER than iter-5 prediction of 114.5, i.e. the full-pool run was faster than estimated). epochs=10 predicts 125 + 10*106.3 = 1188s = 19.8 min (~12s margin inside the 1200s budget; sbatch wall 30 min). epochs=11 -> 125 + 11*106.3 = 1294s = 21.6 min BUSTS the 20-min wall, so 11 is NOT chosen; 10 is the largest epoch count the measured full-pool timing permits. (4) HYPOTHESIS: +1 epoch (9->10) on the full 579-slice pool lifts hr ABOVE the iter-5 champion 0.399405, because the epochs lever never plateaued (monotone at train_n=200 up to the wall) and at ep9 the full pool is epoch-starved -> one more pass over the larger, more-diverse anatomy = more effective gradient steps on unseen slices. FALSIFIER (in NUMBERS): if hr <= 0.399405 at epochs=10/train_n=579, then ALL within-budget levers are EXHAUSTED -- data coverage (MAXED at the full pool), epochs (wall-locked at ~10), AND capacity (regressed iter-4) -- and 0.399405 is dual_domain_supervised DEFINITIVE BUDGET-CONSTRAINED Mayo CEILING and the campaigns Mayo CHAMPION score; file the champion-ceiling verdict. PREDICTED iter-6 hr ~0.402-0.405 (modest; the epochs slope has flattened near convergence -- a single extra epoch is a small sub-linear nudge, NOT another data-lever-sized +0.034 jump). (5) HARD 20-min train+score budget; val=ALL 214 L277 slices; grad_clip=1.0 (mandatory; the 2304-view Mayo FBP adjoint amplifies gradients ~18x -> lr kept conservative at 1e-4 + nonfinite-grad-skip). (6) no control return. HARD-WIRED (unchanged): staged_canonical v3 mayo_ldct_fitted geometry, per-sample-ps FBP + per-sample pipe.R_full swap, bg_target=truth, metric=321px detector-geometry FOV (evaluate_calibrated default for AGENT4CT_DATASET=mayo_ldct_2d; no fov= override).", "advice_for_others": "dual_domain_supervised-claude-agentic: unet_c=16, lr=0.0001, epochs=10, batch_size=1, val_chunk=1, train_n=579, val_n=214, grad_clip=1.0, lambda_neg=1.0, seed=42, rationale=ITER-6 (search-20260619-01, corrected protocol). BASE_ITER=5 (the CHAMPION: unet_c=16/lr=1e-4/epochs=9/train_n=579/lambda_neg=1.0/grad_clip=1.0/seed=42, hr 0.39940). ONE KNOB: epochs 9 -> 10 at the FULL train pool train_n=579 (everything else identical). SIX-BOX (NUMBERS). (1) iter-5 champion: SSIM 0.923056 / hr 0.399405 at ep9/train_n=579/c16/lr1e-4, elapsed_s=1082.13s (18.0 min, ~118s headroom UNSPENT inside the 1200s wall). (2) LIMITER: data coverage is MAXED (train_n=579 = the ENTIRE Wagner train pool; cannot rise). Capacity REGRESSED (iter-4 c24/ep10 -> hr 0.29856, BELOW iter-3, trading epochs to fund conv-compute under-trained the bigger net). No lr-schedule is wired (FORBIDDEN to edit the shared solver). The epochs lever was NEVER converged: at train_n=200 hr rose monotonically ep8 0.276 -> ep20 0.339 -> ep27 0.3654 (still climbing at the wall), then the data lever lifted ep9/579 to 0.3994. So at ep9 on the full 579-slice pool the net sees all the anatomy but for very few passes -> it is UNDER-TRAINED (epoch-starved on the larger pool), NOT capacity- or lr-limited. The ONLY within-budget lever left is recovering epochs, and iter-5 left ~118s of the 1200s budget UNSPENT, so +1 epoch now fits. (3) ONE KNOB: epochs 9 -> 10 at train_n=579. BUDGET-TRADE MATH from the MEASURED iter-5 full-pool point: fixed (data load + 214-slice per-sample val + figure I/O) ~125s -> measured per-epoch on 579 slices = (1082.13-125)/9 = 106.3 s/epoch (LOWER than iter-5 prediction of 114.5, i.e. the full-pool run was faster than estimated). epochs=10 predicts 125 + 10*106.3 = 1188s = 19.8 min (~12s margin inside the 1200s budget; sbatch wall 30 min). epochs=11 -> 125 + 11*106.3 = 1294s = 21.6 min BUSTS the 20-min wall, so 11 is NOT chosen; 10 is the largest epoch count the measured full-pool timing permits. (4) HYPOTHESIS: +1 epoch (9->10) on the full 579-slice pool lifts hr ABOVE the iter-5 champion 0.399405, because the epochs lever never plateaued (monotone at train_n=200 up to the wall) and at ep9 the full pool is epoch-starved -> one more pass over the larger, more-diverse anatomy = more effective gradient steps on unseen slices. FALSIFIER (in NUMBERS): if hr <= 0.399405 at epochs=10/train_n=579, then ALL within-budget levers are EXHAUSTED -- data coverage (MAXED at the full pool), epochs (wall-locked at ~10), AND capacity (regressed iter-4) -- and 0.399405 is dual_domain_supervised DEFINITIVE BUDGET-CONSTRAINED Mayo CEILING and the campaigns Mayo CHAMPION score; file the champion-ceiling verdict. PREDICTED iter-6 hr ~0.402-0.405 (modest; the epochs slope has flattened near convergence -- a single extra epoch is a small sub-linear nudge, NOT another data-lever-sized +0.034 jump). (5) HARD 20-min train+score budget; val=ALL 214 L277 slices; grad_clip=1.0 (mandatory; the 2304-view Mayo FBP adjoint amplifies gradients ~18x -> lr kept conservative at 1e-4 + nonfinite-grad-skip). (6) no control return. HARD-WIRED (unchanged): staged_canonical v3 mayo_ldct_fitted geometry, per-sample-ps FBP + per-sample pipe.R_full swap, bg_target=truth, metric=321px detector-geometry FOV (evaluate_calibrated default for AGENT4CT_DATASET=mayo_ldct_2d; no fov= override).", "comparison_image": "runs/mayo-ldct-claude-agentic-dual-domain-supervised-search-20260619-01/iterations/iter-0006/comparison.png"}
