{"ts": "2026-06-20T09:29:59Z", "run_id": "mayo-ldct-claude-agentic-itnet-search-20260619-01", "iter": 5, "agent": "itnet-claude-agentic", "model": "claude-opus-4-8-1m", "change_class": "architecture", "status": "discard", "kept": false, "val_score": 0.6932240128517151, "headroom": 0.0, "params_M": 0.232881, "train_n": 400, "rationale": "itnet-claude-agentic: pretrain_epochs=140, pretrain_lr=0.0001, itnet_k=3, itnet_alpha=0.005, unet_c=16, finetune_epochs=0, finetune_lr=0.0001, train_n=300, val_n=214, grad_clip=1.0, seed=42, rationale=ITER-5 (search-20260619-01, corrected 214-slice/321px-FOV metric) for itnet = ItNet v1 (pretrain-denoiser-then-FIXED-DC, solver_itnet.py). SIX-BOX (NUMBERS, not CT pixels). (1) PRIOR (val=ALL 214 L277, 321px FOV): iter-1 ep8/train_n200 -> SSIM 0.4413 / hr 0.000; iter-2 ep48 -> 0.5927 / hr 0.000; iter-3 ep160 -> 0.6430 / hr 0.000; iter-4 ep220 -> 0.7022 / hr 0.000, elapsed 1156.9s, params_M 0.2329, train_n=200. HEADROOM (metric of record) PINNED at 0.000 across ALL 4 iters; the pretrain_epochs lever moves SSIM (0.44->0.70, diminishing +0.151->+0.050->+0.059) but never clears the ~0.81 LD-FBP floor. ALL 4 iters held train_n=200 -> train_n is the ONLY untried axis. (2) LIMITER = pretrain-then-FIXED-DC ceiling (structural, CONFIRMED from solver_itnet.py): main() lines 207-216 run itnet.eval()+torch.no_grad() = pure INFERENCE; finetune_itnet() (line 114) is DEFINED but NEVER called; the k=3 DC unroll (forward, lines 76-90) has ZERO trainable params (self.alpha is a plain float line 73, self.projector is fixed analytic PYRO-NN line 74). The ONLY trainable component is the standalone SmallUNet denoiser (params_M 0.2329) pretrained FBP->truth (lines 197-200) that NEVER sees the DC steps. v1 is the STRUCTURAL TWIN of itnet_v2 (same pretrain-then-fixed-DC); the doc records v2 just tested train_n 200->400 and its denoiser SSIM climbed (0.7039->0.7294) but the untrained-DC capped hr at 0. (3) ONE KNOB: train_n 200 -> 300 (+50% data coverage; the FIXED-stratified subset via load_val_split n=train_n + randperm only ever sees 35% of the 579-slice pool at n=200). pretrain_epochs 220 -> 140 is NOT a second hypothesis-knob, it is the budget backstop to hold the HARD 20-min wall at near GRAD-STEP PARITY (200x220=44000 vs 300x140=42000, only -4.5% optimization) so the change isolates DATA COVERAGE, per the campaign train_n-lever protocol. All else identical to iter-4 (itnet_k=3, itnet_alpha=0.005, unet_c=16, pretrain_lr=1e-4, val_n=214, grad_clip=1.0, seed=42). (4) HYPOTHESIS: more data coverage lifts SSIM modestly (~0.70->~0.72) but hr STAYS 0.000 because the fixed untrained DC operator caps the recon below the LD-FBP floor regardless of denoiser quality (exact itnet_v2 train_n 200->400 signature). FALSIFIER (operative): if hr > 0 at train_n=300 (v1 clears the ~0.81 FBP floor), v1 is DATA-LIMITED not structurally capped, and train_n is the live lever toward 20; implausible given v2 twin but the clean discriminator. PREDICTED iter-5 hr = 0.000 (SSIM ~0.71-0.72). (5) BUDGET (HARD 20-min = 1200s train+score): per-epoch cost scales with train_n; from the conservative iter2->4 fit per_epoch(200)=4.474 s, fixed=172.7 s, so at train_n=300 per_epoch=6.71 s -> pred = 172.7 + 140*6.71 = 1112 s = 18.5 min, inside 1200s with ~88s margin (sized DELIBERATELY conservative: the doc warns itnet_v2 iter-4 OVERRAN at 1237s; the 30-min sbatch wall is the only hard fence and 18.5 min leaves ample headroom; ep150 would predict 1179s, too tight, so 140 is the safe decisive probe). grad_clip=1.0 retained (mandatory: the 2304-view Mayo FBP adjoint inside the DC step overflows otherwise). v1 has NO max_train_s backstop. (6) Loop continues -- no control returned. HARD-WIRED (unchanged): staged_canonical data, v3 mayo_ldct_fitted geometry, per-sample-ps (each val slice swaps itnet.projector to its own ps; chunk=1 FORCED), bg_target=truth, val=ALL 214 L277 slices under the 321px detector-geometry FOV (evaluate_calibrated default for AGENT4CT_DATASET=mayo_ldct_2d; NO fov= override).", "advice_for_others": "itnet-claude-agentic: pretrain_epochs=140, pretrain_lr=0.0001, itnet_k=3, itnet_alpha=0.005, unet_c=16, finetune_epochs=0, finetune_lr=0.0001, train_n=300, val_n=214, grad_clip=1.0, seed=42, rationale=ITER-5 (search-20260619-01, corrected 214-slice/321px-FOV metric) for itnet = ItNet v1 (pretrain-denoiser-then-FIXED-DC, solver_itnet.py). SIX-BOX (NUMBERS, not CT pixels). (1) PRIOR (val=ALL 214 L277, 321px FOV): iter-1 ep8/train_n200 -> SSIM 0.4413 / hr 0.000; iter-2 ep48 -> 0.5927 / hr 0.000; iter-3 ep160 -> 0.6430 / hr 0.000; iter-4 ep220 -> 0.7022 / hr 0.000, elapsed 1156.9s, params_M 0.2329, train_n=200. HEADROOM (metric of record) PINNED at 0.000 across ALL 4 iters; the pretrain_epochs lever moves SSIM (0.44->0.70, diminishing +0.151->+0.050->+0.059) but never clears the ~0.81 LD-FBP floor. ALL 4 iters held train_n=200 -> train_n is the ONLY untried axis. (2) LIMITER = pretrain-then-FIXED-DC ceiling (structural, CONFIRMED from solver_itnet.py): main() lines 207-216 run itnet.eval()+torch.no_grad() = pure INFERENCE; finetune_itnet() (line 114) is DEFINED but NEVER called; the k=3 DC unroll (forward, lines 76-90) has ZERO trainable params (self.alpha is a plain float line 73, self.projector is fixed analytic PYRO-NN line 74). The ONLY trainable component is the standalone SmallUNet denoiser (params_M 0.2329) pretrained FBP->truth (lines 197-200) that NEVER sees the DC steps. v1 is the STRUCTURAL TWIN of itnet_v2 (same pretrain-then-fixed-DC); the doc records v2 just tested train_n 200->400 and its denoiser SSIM climbed (0.7039->0.7294) but the untrained-DC capped hr at 0. (3) ONE KNOB: train_n 200 -> 300 (+50% data coverage; the FIXED-stratified subset via load_val_split n=train_n + randperm only ever sees 35% of the 579-slice pool at n=200). pretrain_epochs 220 -> 140 is NOT a second hypothesis-knob, it is the budget backstop to hold the HARD 20-min wall at near GRAD-STEP PARITY (200x220=44000 vs 300x140=42000, only -4.5% optimization) so the change isolates DATA COVERAGE, per the campaign train_n-lever protocol. All else identical to iter-4 (itnet_k=3, itnet_alpha=0.005, unet_c=16, pretrain_lr=1e-4, val_n=214, grad_clip=1.0, seed=42). (4) HYPOTHESIS: more data coverage lifts SSIM modestly (~0.70->~0.72) but hr STAYS 0.000 because the fixed untrained DC operator caps the recon below the LD-FBP floor regardless of denoiser quality (exact itnet_v2 train_n 200->400 signature). FALSIFIER (operative): if hr > 0 at train_n=300 (v1 clears the ~0.81 FBP floor), v1 is DATA-LIMITED not structurally capped, and train_n is the live lever toward 20; implausible given v2 twin but the clean discriminator. PREDICTED iter-5 hr = 0.000 (SSIM ~0.71-0.72). (5) BUDGET (HARD 20-min = 1200s train+score): per-epoch cost scales with train_n; from the conservative iter2->4 fit per_epoch(200)=4.474 s, fixed=172.7 s, so at train_n=300 per_epoch=6.71 s -> pred = 172.7 + 140*6.71 = 1112 s = 18.5 min, inside 1200s with ~88s margin (sized DELIBERATELY conservative: the doc warns itnet_v2 iter-4 OVERRAN at 1237s; the 30-min sbatch wall is the only hard fence and 18.5 min leaves ample headroom; ep150 would predict 1179s, too tight, so 140 is the safe decisive probe). grad_clip=1.0 retained (mandatory: the 2304-view Mayo FBP adjoint inside the DC step overflows otherwise). v1 has NO max_train_s backstop. (6) Loop continues -- no control returned. HARD-WIRED (unchanged): staged_canonical data, v3 mayo_ldct_fitted geometry, per-sample-ps (each val slice swaps itnet.projector to its own ps; chunk=1 FORCED), bg_target=truth, val=ALL 214 L277 slices under the 321px detector-geometry FOV (evaluate_calibrated default for AGENT4CT_DATASET=mayo_ldct_2d; NO fov= override).", "comparison_image": "runs/mayo-ldct-claude-agentic-itnet-search-20260619-01/iterations/iter-0005/comparison.png"}
{"ts": "2026-06-20T09:29:12Z", "run_id": "mayo-ldct-claude-agentic-hammernik-2017-search-20260619-01", "iter": 6, "agent": "hammernik_2017-claude-agentic", "model": "claude-opus-4-8-1m", "change_class": "architecture", "status": "discard", "kept": false, "val_score": 0.7882852554321289, "headroom": 0.0, "params_M": 0.012165, "train_n": 400, "rationale": "hammernik_2017-claude-agentic: vn_T=5, vn_n_filters=16, vn_kernel=11, vn_n_bumps=31, vn_x_range=2.0, vn_lambda_init=0.0023, epochs=19, batch_size=2, lr=0.0003, grad_clip=1.0, train_n=200, val_n=214, max_train_s=1100, seed=42, rationale=hammernik_2017 iter-6 (search-20260619-01, corrected 214-slice/321px-FOV metric). ONE KNOB: lr 5e-4 -> 3e-4 (0.6x). BASE_ITER=5 (the NEW BEST + FIRST above-baseline point: SSIM 0.8114, hr 0.0319, ep19/bs2/lr5e-4). All else held at iter-5 (vn_T=5, vn_n_filters=16, vn_kernel=11, vn_n_bumps=31, vn_x_range=2.0, vn_lambda_init=0.0023, epochs=19, batch_size=2, grad_clip=1.0, train_n=200, val_n=214, max_train_s=1100, seed=42). TRAJECTORY (corrected metric): iter-1 OOM(bs4); iter-2 0.8012 hr0; iter-3 0.7932 hr0 (lambda 0.0023->0.05 REGRESSED); iter-4 0.7828 hr0 (n_filters 16->4 REGRESSED); iter-5 0.8114 hr0.0319 KEEP (epochs 14->19, FIRST above the 0.84-ish LD-FBP floor -- under-training diagnosis CONFIRMED, the epochs lever WORKS). LIMITER (box2): the VN is still under-trained toward its proven ep38 convergence basin (the discarded boundary-slice sweep climbed SSIM 0.876->0.9484 over ep8->38), BUT ep19 is WALL-PINNED: iter-5 train was 1071.6s at 56.4s/epoch, elapsed 1166.5s; ONE more epoch = 1128s train + ~95s score(214) = ~1223s > the HARD 1200s budget, so epochs CANNOT go up. The solver uses a PLAIN Adam with NO lr scheduler and consumes no lr_decay/cosine/weight_decay knob (verified by grep) and I may NOT edit the shared solver file -- so an lr-decay schedule is unavailable as a cfg knob. The decisive EVIDENCE for the lever: the iter-5 loss curve CONVERGED numerically by ep11 (~8e-7) yet SSIM is still far below the proven 0.9484 -- loss-convergence != SSIM-convergence for this VN -- AND there is an ep18 INSTABILITY BLIP (loss spiked 8.2e-7 -> 2.5e-6 then recovered to 7.9e-7 at ep19), direct evidence the late-training trajectory is BOUNCING near its basin at lr=5e-4 rather than settling. The budget cannot buy more epochs, so the lever must improve convergence QUALITY within the fixed 19 epochs. ONE KNOB CHOICE (box3): lr 5e-4->3e-4 shrinks every late-training step, damping the ep18-style bounce so the net settles into a better basin instead of overshooting it -- the finer-convergence/stable-late-training lever the protocol prescribes, and exactly the iter-5 pre-registered falsifier path (iter-5: if val_ssim<=0.84 at 19 epochs, iter-6 must lower lr). It is BUDGET-NEUTRAL (lr is a scalar -- identical per-step compute), unlike batch_size which carries an unsized wall-cost risk. lr is held DOWN not up because the campaign record says lr5e-4 optimal and 8e-4 WORSE for the VN family (5e-4 vs 3e-4 is untested). HYPOTHESIS (box4): if lr->3e-4, the late steps shrink and the ep18 instability is damped so the net settles into a better basin -> predict val_ssim rises above 0.8114 (hr > 0.0319), targeting ~0.82-0.83 / hr ~0.04-0.06. FALSIFIER: if val_ssim <= 0.8114 (hr <= 0.0319), lower lr starves the under-trained net of progress more than it stabilizes it -> the bs=2/19-epoch budget is convergence-bounded and iter-7 must trade gradient STEPS (batch_size 2->1 doubles optimizer steps/epoch at ~the same per-epoch wall, attacking the proven step-count limiter directly) -- the only remaining within-budget step-count lever once lr is shown not to help. BUDGET (box5, HARD 1200s train+score; sbatch --time=00:30:00): lr is a scalar, ZERO change to per-step compute, so cost == iter-5: 56.4s/epoch x 19 = 1071.6s train + ~95s score(214)+figure = ~1166s predicted elapsed < 1200s; max_train_s=1100 backstop trips before the figure, well under the 1800s SLURM kill. MEMORY-SAFE: identical footprint to iter-5 -- batch_size=2 KEPT (the OOM-safe value; bs=4 OOMed the 16GB RTX5000 in the _rho_prime RBF-bump loop at iter-1), N_k=16, 31-bump RBF across 5 unrolled steps within 16 GB. grad_clip=1.0 retained (VN-family NaN-skip stability).", "advice_for_others": "hammernik_2017-claude-agentic: vn_T=5, vn_n_filters=16, vn_kernel=11, vn_n_bumps=31, vn_x_range=2.0, vn_lambda_init=0.0023, epochs=19, batch_size=2, lr=0.0003, grad_clip=1.0, train_n=200, val_n=214, max_train_s=1100, seed=42, rationale=hammernik_2017 iter-6 (search-20260619-01, corrected 214-slice/321px-FOV metric). ONE KNOB: lr 5e-4 -> 3e-4 (0.6x). BASE_ITER=5 (the NEW BEST + FIRST above-baseline point: SSIM 0.8114, hr 0.0319, ep19/bs2/lr5e-4). All else held at iter-5 (vn_T=5, vn_n_filters=16, vn_kernel=11, vn_n_bumps=31, vn_x_range=2.0, vn_lambda_init=0.0023, epochs=19, batch_size=2, grad_clip=1.0, train_n=200, val_n=214, max_train_s=1100, seed=42). TRAJECTORY (corrected metric): iter-1 OOM(bs4); iter-2 0.8012 hr0; iter-3 0.7932 hr0 (lambda 0.0023->0.05 REGRESSED); iter-4 0.7828 hr0 (n_filters 16->4 REGRESSED); iter-5 0.8114 hr0.0319 KEEP (epochs 14->19, FIRST above the 0.84-ish LD-FBP floor -- under-training diagnosis CONFIRMED, the epochs lever WORKS). LIMITER (box2): the VN is still under-trained toward its proven ep38 convergence basin (the discarded boundary-slice sweep climbed SSIM 0.876->0.9484 over ep8->38), BUT ep19 is WALL-PINNED: iter-5 train was 1071.6s at 56.4s/epoch, elapsed 1166.5s; ONE more epoch = 1128s train + ~95s score(214) = ~1223s > the HARD 1200s budget, so epochs CANNOT go up. The solver uses a PLAIN Adam with NO lr scheduler and consumes no lr_decay/cosine/weight_decay knob (verified by grep) and I may NOT edit the shared solver file -- so an lr-decay schedule is unavailable as a cfg knob. The decisive EVIDENCE for the lever: the iter-5 loss curve CONVERGED numerically by ep11 (~8e-7) yet SSIM is still far below the proven 0.9484 -- loss-convergence != SSIM-convergence for this VN -- AND there is an ep18 INSTABILITY BLIP (loss spiked 8.2e-7 -> 2.5e-6 then recovered to 7.9e-7 at ep19), direct evidence the late-training trajectory is BOUNCING near its basin at lr=5e-4 rather than settling. The budget cannot buy more epochs, so the lever must improve convergence QUALITY within the fixed 19 epochs. ONE KNOB CHOICE (box3): lr 5e-4->3e-4 shrinks every late-training step, damping the ep18-style bounce so the net settles into a better basin instead of overshooting it -- the finer-convergence/stable-late-training lever the protocol prescribes, and exactly the iter-5 pre-registered falsifier path (iter-5: if val_ssim<=0.84 at 19 epochs, iter-6 must lower lr). It is BUDGET-NEUTRAL (lr is a scalar -- identical per-step compute), unlike batch_size which carries an unsized wall-cost risk. lr is held DOWN not up because the campaign record says lr5e-4 optimal and 8e-4 WORSE for the VN family (5e-4 vs 3e-4 is untested). HYPOTHESIS (box4): if lr->3e-4, the late steps shrink and the ep18 instability is damped so the net settles into a better basin -> predict val_ssim rises above 0.8114 (hr > 0.0319), targeting ~0.82-0.83 / hr ~0.04-0.06. FALSIFIER: if val_ssim <= 0.8114 (hr <= 0.0319), lower lr starves the under-trained net of progress more than it stabilizes it -> the bs=2/19-epoch budget is convergence-bounded and iter-7 must trade gradient STEPS (batch_size 2->1 doubles optimizer steps/epoch at ~the same per-epoch wall, attacking the proven step-count limiter directly) -- the only remaining within-budget step-count lever once lr is shown not to help. BUDGET (box5, HARD 1200s train+score; sbatch --time=00:30:00): lr is a scalar, ZERO change to per-step compute, so cost == iter-5: 56.4s/epoch x 19 = 1071.6s train + ~95s score(214)+figure = ~1166s predicted elapsed < 1200s; max_train_s=1100 backstop trips before the figure, well under the 1800s SLURM kill. MEMORY-SAFE: identical footprint to iter-5 -- batch_size=2 KEPT (the OOM-safe value; bs=4 OOMed the 16GB RTX5000 in the _rho_prime RBF-bump loop at iter-1), N_k=16, 31-bump RBF across 5 unrolled steps within 16 GB. grad_clip=1.0 retained (VN-family NaN-skip stability).", "comparison_image": "runs/mayo-ldct-claude-agentic-hammernik-2017-search-20260619-01/iterations/iter-0006/comparison.png"}
