{"ts": "2026-06-20T02:31:04Z", "run_id": "mayo-ldct-claude-agentic-tv-iterative-supervised-search-20260619-01", "iter": 4, "agent": "tv_iterative_supervised-claude-agentic", "model": "claude-opus-4-8-1m", "change_class": "architecture", "status": "discard", "kept": false, "val_score": 0.6948933601379395, "headroom": 0.0, "params_M": 6e-05, "train_n": 400, "rationale": "tv_iterative_supervised-claude-agentic: val_n=214, val_chunk=5, train_n=40, epochs=8, batch_size=1, lr=0.05, tv_K=30, tv_step_init=1e-05, tv_lambda_init=0.001, tv_share_steps=False, tv_clip_max=0.05, tv_eps=1e-06, lambda_neg=1.0, loss_base=mse, grad_clip=1.0, rationale=tv_iterative_supervised iter-4 (search-20260619-01, corrected 214-slice/321px-FOV metric). RE-DIAGNOSIS from the iter-3 SLURM LOG (job 765340), which contradicts the iter-3 observation narrative: the 0.2855->0.8137 jump was NOT training un-freezing -- it is the LD-FBP PASSTHROUGH. Log facts: loss=0.000064 IDENTICAL across all 8 epochs (did NOT decrease); lambda[k]=0.001 STILL PINNED at init for all 8 epochs (zero gradient); step[k] crept only 1.06e-8->1.76e-8. At tv_step_init=1e-8 the unrolled update f = f - step*(data_grad + lam*tv_grad) is scaled to ~zero, so the K=30 unroll is a near-identity map on fbp_init: pred ~= clamp(LD-FBP). That is why SSIM=0.8137 ~= the LD-FBP floor (~0.81), recon PSNR 33.60 is JUST BELOW baseline_PSNR 34.08, and hr=0.0 (the recon does not beat its own FBP). The freeze did not get fixed -- it MOVED: iter-1/2 (step=1e-2) froze via SATURATED-CLAMP (overshoot clamps the whole image, clamp derivative 0); iter-3 (step=1e-8) freezes via VANISHING-STEP (data+TV terms scaled to nothing, lam has no effect on the output so d loss/d lam ~= 0). FAILURE MODE (named): the limiter is the STEP SCALE, not depth (tv_K falsified iter-1->2) and not epochs/lr (lr=5e-2 already; scalars still don't move because the gradient to lambda is ~0 at both step extremes). The working step lives BETWEEN the two known-frozen regimes 1e-8 and 1e-2. ONE KNOB: tv_step_init 1e-8 -> 1e-5 (the geometric midpoint sqrt(1e-8*1e-2)=1e-5 of the two frozen endpoints). At ~1e-5 the data-consistency term back_project(Rf-sino) actually moves the image OFF the FBP init across K=30 steps (so the recon depends on lambda -> non-zero gradient reaches log_lambda -> the 30 TV scalars can finally train), while staying INSIDE the [0,0.05] clamp basin (no whole-image saturation -> the clamp derivative is not 0 -> gradient also reaches log_step). Everything else IDENTICAL to iter-3 (lr=5e-2, K=30, train_n=40, epochs=8, bs=1, tv_lambda_init=0.001, tv_clip_max=0.05, tv_eps=1e-6, val_n=214 ALL L277, val_chunk=5, grad_clip=1.0; tv_step_init STAYS finite/non-tiny -- do NOT revert toward 1e-8). HYPOTHESIS: with the step in the active basin, training un-freezes for REAL this time -- loss DECREASES across epochs, lambda[k] DEPARTS from 0.001 and step[k] adapts, and SSIM rises ABOVE the 0.8137 FBP passthrough toward the classical TV band (SSIM 0.85-0.92, the non-trained tv_iterative sibling hits 0.92 / hr 0.205); clearing hr>0 means the trained TV recon finally beats its own LD-FBP. FALSIFIER (decisive): if SSIM stays ~0.81 with lambda STILL pinned (passthrough persists, the active basin is even narrower than 1e-5) OR collapses back toward ~0.286 (1e-5 already over-saturates the clamp), then the supervised-TV harness has NO step value that both trains the scalars AND beats FBP under Mayo's 2304-view unnormalized-adjoint scale within the config-only contract (the shared solver's raw back_project step is FORBIDDEN to edit) -> file a NEGATIVE RESULT (supervised-TV-unrolled is FBP-bounded on real Mayo LDCT) and STOP iterating this solver; iter-5 would only bracket the step further (e.g. 3e-6 / 3e-5) before declaring the negative. BUDGET (HARD 20-min train+score = 1200s wall): IDENTICAL compute to iter-3 (same K=30, train_n=40, epochs=8, bs=1, val_n=214, val_chunk=5 -- only the init VALUE of a scalar changes, not any loop size) -> ~918s measured iter-3, ~282s margin under the 1200s wall; sbatch --time=00:30:00 carries figure/IO headroom. Predicted trajectory: iter-1 0.2855 -> iter-2 0.2855 -> iter-3 0.8137 (FBP passthrough, hr 0) -> iter-4 either >0.84 with lambda departing init and hr>0 (training un-froze for real) OR ~0.81 with lambda still pinned (passthrough -> bracket once at iter-5 then NEGATIVE RESULT + STOP).", "advice_for_others": "tv_iterative_supervised-claude-agentic: val_n=214, val_chunk=5, train_n=40, epochs=8, batch_size=1, lr=0.05, tv_K=30, tv_step_init=1e-05, tv_lambda_init=0.001, tv_share_steps=False, tv_clip_max=0.05, tv_eps=1e-06, lambda_neg=1.0, loss_base=mse, grad_clip=1.0, rationale=tv_iterative_supervised iter-4 (search-20260619-01, corrected 214-slice/321px-FOV metric). RE-DIAGNOSIS from the iter-3 SLURM LOG (job 765340), which contradicts the iter-3 observation narrative: the 0.2855->0.8137 jump was NOT training un-freezing -- it is the LD-FBP PASSTHROUGH. Log facts: loss=0.000064 IDENTICAL across all 8 epochs (did NOT decrease); lambda[k]=0.001 STILL PINNED at init for all 8 epochs (zero gradient); step[k] crept only 1.06e-8->1.76e-8. At tv_step_init=1e-8 the unrolled update f = f - step*(data_grad + lam*tv_grad) is scaled to ~zero, so the K=30 unroll is a near-identity map on fbp_init: pred ~= clamp(LD-FBP). That is why SSIM=0.8137 ~= the LD-FBP floor (~0.81), recon PSNR 33.60 is JUST BELOW baseline_PSNR 34.08, and hr=0.0 (the recon does not beat its own FBP). The freeze did not get fixed -- it MOVED: iter-1/2 (step=1e-2) froze via SATURATED-CLAMP (overshoot clamps the whole image, clamp derivative 0); iter-3 (step=1e-8) freezes via VANISHING-STEP (data+TV terms scaled to nothing, lam has no effect on the output so d loss/d lam ~= 0). FAILURE MODE (named): the limiter is the STEP SCALE, not depth (tv_K falsified iter-1->2) and not epochs/lr (lr=5e-2 already; scalars still don't move because the gradient to lambda is ~0 at both step extremes). The working step lives BETWEEN the two known-frozen regimes 1e-8 and 1e-2. ONE KNOB: tv_step_init 1e-8 -> 1e-5 (the geometric midpoint sqrt(1e-8*1e-2)=1e-5 of the two frozen endpoints). At ~1e-5 the data-consistency term back_project(Rf-sino) actually moves the image OFF the FBP init across K=30 steps (so the recon depends on lambda -> non-zero gradient reaches log_lambda -> the 30 TV scalars can finally train), while staying INSIDE the [0,0.05] clamp basin (no whole-image saturation -> the clamp derivative is not 0 -> gradient also reaches log_step). Everything else IDENTICAL to iter-3 (lr=5e-2, K=30, train_n=40, epochs=8, bs=1, tv_lambda_init=0.001, tv_clip_max=0.05, tv_eps=1e-6, val_n=214 ALL L277, val_chunk=5, grad_clip=1.0; tv_step_init STAYS finite/non-tiny -- do NOT revert toward 1e-8). HYPOTHESIS: with the step in the active basin, training un-freezes for REAL this time -- loss DECREASES across epochs, lambda[k] DEPARTS from 0.001 and step[k] adapts, and SSIM rises ABOVE the 0.8137 FBP passthrough toward the classical TV band (SSIM 0.85-0.92, the non-trained tv_iterative sibling hits 0.92 / hr 0.205); clearing hr>0 means the trained TV recon finally beats its own LD-FBP. FALSIFIER (decisive): if SSIM stays ~0.81 with lambda STILL pinned (passthrough persists, the active basin is even narrower than 1e-5) OR collapses back toward ~0.286 (1e-5 already over-saturates the clamp), then the supervised-TV harness has NO step value that both trains the scalars AND beats FBP under Mayo's 2304-view unnormalized-adjoint scale within the config-only contract (the shared solver's raw back_project step is FORBIDDEN to edit) -> file a NEGATIVE RESULT (supervised-TV-unrolled is FBP-bounded on real Mayo LDCT) and STOP iterating this solver; iter-5 would only bracket the step further (e.g. 3e-6 / 3e-5) before declaring the negative. BUDGET (HARD 20-min train+score = 1200s wall): IDENTICAL compute to iter-3 (same K=30, train_n=40, epochs=8, bs=1, val_n=214, val_chunk=5 -- only the init VALUE of a scalar changes, not any loop size) -> ~918s measured iter-3, ~282s margin under the 1200s wall; sbatch --time=00:30:00 carries figure/IO headroom. Predicted trajectory: iter-1 0.2855 -> iter-2 0.2855 -> iter-3 0.8137 (FBP passthrough, hr 0) -> iter-4 either >0.84 with lambda departing init and hr>0 (training un-froze for real) OR ~0.81 with lambda still pinned (passthrough -> bracket once at iter-5 then NEGATIVE RESULT + STOP).", "comparison_image": "runs/mayo-ldct-claude-agentic-tv-iterative-supervised-search-20260619-01/iterations/iter-0004/comparison.png"}
{"ts": "2026-06-20T02:15:46Z", "run_id": "mayo-ldct-claude-agentic-diff-recon-dcstep-constrained-mayo-v4-search-20260619-01", "iter": 3, "agent": "diffusion_recon_dcstep_constrained_mayo_v4-claude-agentic", "model": "claude-opus-4-8-1m", "change_class": "architecture", "status": "discard", "kept": false, "val_score": 0.23767133057117462, "headroom": 0.0, "params_M": 8.594211, "train_n": 400, "rationale": "diffusion_recon_dcstep_constrained_mayo_v4-claude-agentic: recon_ckpt=/cluster/maier/Agent4CT/checkpoints/ddpm_mayo_constrained_v4.pt, recon_mode=dps, recon_sample_steps=25, recon_eta=1.0, recon_init=fbp, recon_eta_clamp=False, recon_dcstep_every=5, recon_dcstep_n_cg=3, recon_dcstep_warmup=5, recon_dcstep_relax=0.3, val_n=214, train_n=0, rationale=iter-3 search-20260619-01 CONSTRAINED diff-recon. ONE KNOB: recon_dcstep_relax 1.0->0.3 (the constrained-specific hard-CG blend; eta held at iter-2's 1.0). TRAJECTORY: iter-1 eta=30 SSIM 0.3937/hr0; iter-2 eta 30->1 REGRESSED to SSIM 0.2366/hr0 -> eta is the WRONG lever (gentling the DPS gain did not help; the corruption is elsewhere). FAILURE MODE (numbers): both prior iters ran recon_dcstep_relax=1.0 = FULL hard projection. In dc_step_cg() the return is relax*x_cg + (1-relax)*x0_mu; relax=1.0 discards the diffusion x0 estimate ENTIRELY and substitutes n_cg=3 Gauss-Newton least-squares fit to the NOISY 2304-view LD sinogram, which is then re-noised back to t_next every 5 reverse steps (warmup 5). That least-squares fit overfits measurement noise and overwrites the prior's structure -> hard-CG DC re-noises a corrupted x0, exactly the constrained variant's failure. The SOLVER DEFAULT is relax=0.5; relax=1.0 was an untested aggressive choice carried from iter-1. ONE KNOB: relax 1.0->0.3 blends 30% CG-projected + 70% diffusion x0, a GENTLE pull to data consistency that preserves prior structure instead of overwriting it. HYPOTHESIS: softening the hard-DC blend lifts SSIM back toward / above the ~0.81 LD-FBP floor (hr>0); predicted iter-3 SSIM 0.4-0.7 range (recovery from 0.2366). FALSIFIER: if SSIM stays well below FBP (~0.3 vs 0.81) even at relax=0.3, the Mayo v4 DDPM prior is STRUCTURALLY MISMATCHED to rebinned Mayo under the 25-step low-T DPS/DC budget (mirrors the breast-DDPM hr=0 verdict: globally faithful but not conditionally faithful) -> NEGATIVE RESULT, STOP diffusion on Mayo. BUDGET: relax is a blend scalar inside dc_step_cg -> ZERO compute change (same n_cg=3, n_steps=25, DC cadence every5). iter-2 ran ALL 214 L277 slices in 1033.8 s = 4.83 s/slice = 17.2 min < 20-min wall (1800s in-solver backstop never hit); iter-1 1018.96 s. iter-3 lands ~17 min, inside budget. val=ALL 214 L277, 321px detector-geometry FOV default.", "advice_for_others": "diffusion_recon_dcstep_constrained_mayo_v4-claude-agentic: recon_ckpt=/cluster/maier/Agent4CT/checkpoints/ddpm_mayo_constrained_v4.pt, recon_mode=dps, recon_sample_steps=25, recon_eta=1.0, recon_init=fbp, recon_eta_clamp=False, recon_dcstep_every=5, recon_dcstep_n_cg=3, recon_dcstep_warmup=5, recon_dcstep_relax=0.3, val_n=214, train_n=0, rationale=iter-3 search-20260619-01 CONSTRAINED diff-recon. ONE KNOB: recon_dcstep_relax 1.0->0.3 (the constrained-specific hard-CG blend; eta held at iter-2's 1.0). TRAJECTORY: iter-1 eta=30 SSIM 0.3937/hr0; iter-2 eta 30->1 REGRESSED to SSIM 0.2366/hr0 -> eta is the WRONG lever (gentling the DPS gain did not help; the corruption is elsewhere). FAILURE MODE (numbers): both prior iters ran recon_dcstep_relax=1.0 = FULL hard projection. In dc_step_cg() the return is relax*x_cg + (1-relax)*x0_mu; relax=1.0 discards the diffusion x0 estimate ENTIRELY and substitutes n_cg=3 Gauss-Newton least-squares fit to the NOISY 2304-view LD sinogram, which is then re-noised back to t_next every 5 reverse steps (warmup 5). That least-squares fit overfits measurement noise and overwrites the prior's structure -> hard-CG DC re-noises a corrupted x0, exactly the constrained variant's failure. The SOLVER DEFAULT is relax=0.5; relax=1.0 was an untested aggressive choice carried from iter-1. ONE KNOB: relax 1.0->0.3 blends 30% CG-projected + 70% diffusion x0, a GENTLE pull to data consistency that preserves prior structure instead of overwriting it. HYPOTHESIS: softening the hard-DC blend lifts SSIM back toward / above the ~0.81 LD-FBP floor (hr>0); predicted iter-3 SSIM 0.4-0.7 range (recovery from 0.2366). FALSIFIER: if SSIM stays well below FBP (~0.3 vs 0.81) even at relax=0.3, the Mayo v4 DDPM prior is STRUCTURALLY MISMATCHED to rebinned Mayo under the 25-step low-T DPS/DC budget (mirrors the breast-DDPM hr=0 verdict: globally faithful but not conditionally faithful) -> NEGATIVE RESULT, STOP diffusion on Mayo. BUDGET: relax is a blend scalar inside dc_step_cg -> ZERO compute change (same n_cg=3, n_steps=25, DC cadence every5). iter-2 ran ALL 214 L277 slices in 1033.8 s = 4.83 s/slice = 17.2 min < 20-min wall (1800s in-solver backstop never hit); iter-1 1018.96 s. iter-3 lands ~17 min, inside budget. val=ALL 214 L277, 321px detector-geometry FOV default.", "comparison_image": "runs/mayo-ldct-claude-agentic-diff-recon-dcstep-constrained-mayo-v4-search-20260619-01/iterations/iter-0003/comparison.png"}
{"ts": "2026-06-20T01:58:11Z", "run_id": "mayo-ldct-claude-agentic-diff-recon-dcstep-unconstrained-mayo-v4-search-20260619-01", "iter": 3, "agent": "diffusion_recon_dcstep_unconstrained_mayo_v4-claude-agentic", "model": "claude-opus-4-8-1m", "change_class": "architecture", "status": "discard", "kept": false, "val_score": 0.3868979811668396, "headroom": 0.0, "params_M": 8.594211, "train_n": 400, "rationale": "diffusion_recon_dcstep_unconstrained_mayo_v4-claude-agentic: recon_ckpt=/cluster/maier/Agent4CT/checkpoints/ddpm_mayo_unconstrained_v4.pt, recon_mode=dps, recon_sample_steps=32, recon_eta=5.0, recon_init=fbp, recon_eta_clamp=False, recon_dcstep_every=0, recon_dcstep_n_cg=3, recon_dcstep_warmup=5, recon_dcstep_relax=1.0, val_n=214, train_n=0, rationale=iter-3 search-20260619-01 UNCONSTRAINED diff-recon vs reused Mayo DDPM v4 ckpt (ddpm_mayo_unconstrained_v4.pt). ONE KNOB: recon_sample_steps (n_steps) 25 -> 32 (LONGER DDIM reverse trajectory). All else IDENTICAL to iter-2 (recon_eta=5.0, recon_init=fbp, recon_dcstep_every=0 so the hard-CG projection stays OFF -> pure soft DPS; recon_eta_clamp=false; val_n=214). TRAJECTORY iter-1 (n_steps=25, eta=30): SSIM 0.3688, hr=0.0, PSNR 10.55, 868.65s/214 = 4.06 s/slice. iter-2 (n_steps=25, eta=5): SSIM 0.3960, hr=0.0, PSNR 11.25, 868.33s/214 = 4.06 s/slice. The eta 30->5 correction gave a SLIGHT lift (+0.027) but the recon is STILL FAR below the LD-FBP floor 0.8078 (and the constrained sibling REGRESSED on its eta fix eta30->1: 0.39->0.24), so the DPS guidance-gain lever is now EXHAUSTED. FAILURE MODE: the recon is dominated by a Mayo v4 DDPM prior that is MISMATCHED to the rebinned-Mayo distribution under the short 25-step low-T reverse budget -- per findings the prior is globally faithful (plausible CT texture) but NOT conditionally faithful to the input sino under DPS/DC (exactly the breast-DDPM hr=0 structural verdict, where 4x-16x capacity + 2.5x training all stayed in the 0.3-0.5 SSIM band). ONE KNOB JUSTIFICATION: n_steps is the highest-value untried lever -- a longer DDIM reverse trajectory gives the soft-DPS prior more steps to settle from the FBP init toward the measurement manifold; the 25-step low-T budget may simply be too short to converge. BUDGET MATH (HARD 20-min = 1200s wall, val=ALL 214 L277 slices): per-step cost dominates (each of the n_steps reverse iterations does one DDPM-net forward + one projector forward + one autograd backward; dcstep_every=0 so NO extra CG cost), so per-slice cost is ~linear in n_steps with a small fixed FBP-init+IO offset. iter-2 = 4.06 s/slice at 25 steps. At 32 steps (worst-case fully-linear): 4.06*(32/25) = 5.20 s/slice -> 214*5.20 = 1112s = 18.5 min < 1200s wall (~88s headroom, MORE in practice because the fixed offset does not scale). Doubling to 50 steps (8.1 s/slice -> ~29 min) would BLOW the wall, so n_steps=32 (+28% trajectory) is the LARGEST step count that fits with margin -- the right budget-feasible probe, not a naive 2x. HYPOTHESIS: if I extend the DDIM trajectory 25 -> 32 steps, SSIM rises meaningfully above the iter-2 0.3960 because the longer reverse path lets the FBP-initialized iterate relax further onto the sino-consistent mode. FALSIFIER: if SSIM stays well below the FBP floor (~0.4 vs 0.81) even with the longer trajectory, then the Mayo v4 DDPM prior is STRUCTURALLY mismatched (not a step-budget issue) -> file a negative result and STOP iterating diffusion-recon on Mayo (the lever is the prior CLASS, not any sampler hyperparameter, mirroring the breast-DDPM decision).", "advice_for_others": "diffusion_recon_dcstep_unconstrained_mayo_v4-claude-agentic: recon_ckpt=/cluster/maier/Agent4CT/checkpoints/ddpm_mayo_unconstrained_v4.pt, recon_mode=dps, recon_sample_steps=32, recon_eta=5.0, recon_init=fbp, recon_eta_clamp=False, recon_dcstep_every=0, recon_dcstep_n_cg=3, recon_dcstep_warmup=5, recon_dcstep_relax=1.0, val_n=214, train_n=0, rationale=iter-3 search-20260619-01 UNCONSTRAINED diff-recon vs reused Mayo DDPM v4 ckpt (ddpm_mayo_unconstrained_v4.pt). ONE KNOB: recon_sample_steps (n_steps) 25 -> 32 (LONGER DDIM reverse trajectory). All else IDENTICAL to iter-2 (recon_eta=5.0, recon_init=fbp, recon_dcstep_every=0 so the hard-CG projection stays OFF -> pure soft DPS; recon_eta_clamp=false; val_n=214). TRAJECTORY iter-1 (n_steps=25, eta=30): SSIM 0.3688, hr=0.0, PSNR 10.55, 868.65s/214 = 4.06 s/slice. iter-2 (n_steps=25, eta=5): SSIM 0.3960, hr=0.0, PSNR 11.25, 868.33s/214 = 4.06 s/slice. The eta 30->5 correction gave a SLIGHT lift (+0.027) but the recon is STILL FAR below the LD-FBP floor 0.8078 (and the constrained sibling REGRESSED on its eta fix eta30->1: 0.39->0.24), so the DPS guidance-gain lever is now EXHAUSTED. FAILURE MODE: the recon is dominated by a Mayo v4 DDPM prior that is MISMATCHED to the rebinned-Mayo distribution under the short 25-step low-T reverse budget -- per findings the prior is globally faithful (plausible CT texture) but NOT conditionally faithful to the input sino under DPS/DC (exactly the breast-DDPM hr=0 structural verdict, where 4x-16x capacity + 2.5x training all stayed in the 0.3-0.5 SSIM band). ONE KNOB JUSTIFICATION: n_steps is the highest-value untried lever -- a longer DDIM reverse trajectory gives the soft-DPS prior more steps to settle from the FBP init toward the measurement manifold; the 25-step low-T budget may simply be too short to converge. BUDGET MATH (HARD 20-min = 1200s wall, val=ALL 214 L277 slices): per-step cost dominates (each of the n_steps reverse iterations does one DDPM-net forward + one projector forward + one autograd backward; dcstep_every=0 so NO extra CG cost), so per-slice cost is ~linear in n_steps with a small fixed FBP-init+IO offset. iter-2 = 4.06 s/slice at 25 steps. At 32 steps (worst-case fully-linear): 4.06*(32/25) = 5.20 s/slice -> 214*5.20 = 1112s = 18.5 min < 1200s wall (~88s headroom, MORE in practice because the fixed offset does not scale). Doubling to 50 steps (8.1 s/slice -> ~29 min) would BLOW the wall, so n_steps=32 (+28% trajectory) is the LARGEST step count that fits with margin -- the right budget-feasible probe, not a naive 2x. HYPOTHESIS: if I extend the DDIM trajectory 25 -> 32 steps, SSIM rises meaningfully above the iter-2 0.3960 because the longer reverse path lets the FBP-initialized iterate relax further onto the sino-consistent mode. FALSIFIER: if SSIM stays well below the FBP floor (~0.4 vs 0.81) even with the longer trajectory, then the Mayo v4 DDPM prior is STRUCTURALLY mismatched (not a step-budget issue) -> file a negative result and STOP iterating diffusion-recon on Mayo (the lever is the prior CLASS, not any sampler hyperparameter, mirroring the breast-DDPM decision).", "comparison_image": "runs/mayo-ldct-claude-agentic-diff-recon-dcstep-unconstrained-mayo-v4-search-20260619-01/iterations/iter-0003/comparison.png"}
