{"ts": "2026-06-19T15:32:39Z", "run_id": "mayo-ldct-claude-agentic-r2gaussian-search-20260619-01", "iter": 1, "agent": "r2gaussian-claude-agentic-breast-ct", "model": "claude-opus-4.7-1m", "change_class": "architecture", "status": "discard", "kept": false, "val_score": 0.738335132598877, "headroom": 0.0, "params_M": 0.003072, "train_n": 400, "rationale": "r2gaussian-claude-agentic: val_n=214, gs_n_gaussians=512, gs_n_iter=150, gs_lr_pos=0.005, gs_lr_scale=0.01, gs_lr_amp=0.01, gs_lr_rot=0.01, gs_amp_init=0.01, gs_scale_init=0.04, gs_tv_weight=0.0001, gs_n_clip=0.05, gs_init_from_fbp=False, gs_outer_wall_s=1080, rationale=iter-1 baseline (search-20260619-01, corrected 214-slice/321px-FOV metric). HYPOTHESIS: R2-Gaussian is structurally FBP-bounded on dense rebinned Mayo (2304-view) AND budget-starved at 214 per-scene fits, so expect hr~0. Per-scene cost = 214 x (512 Gaussians x 150 Adam steps x one 2304-view forward proj); the 20-min budget allows only ~5.6s/scene, so gs_n_iter is held LOW (150 vs 600 default) and gs_n_gaussians MODEST (512 vs 1024 default) to maximise the number of the 214 scenes that finish. gs_outer_wall_s=1080 is the HARD in-solver wall (18 min) so the per-scene loop self-truncates before the 30-min SLURM kill, scoring whatever completed; val_n stays 214 (NOT reduced) per mandate. If <214 scenes finish, that documents R2-Gaussian budget-starvation on the 214-slice protocol (a real finding). LRs at solver defaults (one-knob discipline starts iter-2).", "advice_for_others": "r2gaussian-claude-agentic: val_n=214, gs_n_gaussians=512, gs_n_iter=150, gs_lr_pos=0.005, gs_lr_scale=0.01, gs_lr_amp=0.01, gs_lr_rot=0.01, gs_amp_init=0.01, gs_scale_init=0.04, gs_tv_weight=0.0001, gs_n_clip=0.05, gs_init_from_fbp=False, gs_outer_wall_s=1080, rationale=iter-1 baseline (search-20260619-01, corrected 214-slice/321px-FOV metric). HYPOTHESIS: R2-Gaussian is structurally FBP-bounded on dense rebinned Mayo (2304-view) AND budget-starved at 214 per-scene fits, so expect hr~0. Per-scene cost = 214 x (512 Gaussians x 150 Adam steps x one 2304-view forward proj); the 20-min budget allows only ~5.6s/scene, so gs_n_iter is held LOW (150 vs 600 default) and gs_n_gaussians MODEST (512 vs 1024 default) to maximise the number of the 214 scenes that finish. gs_outer_wall_s=1080 is the HARD in-solver wall (18 min) so the per-scene loop self-truncates before the 30-min SLURM kill, scoring whatever completed; val_n stays 214 (NOT reduced) per mandate. If <214 scenes finish, that documents R2-Gaussian budget-starvation on the 214-slice protocol (a real finding). LRs at solver defaults (one-knob discipline starts iter-2).", "comparison_image": "runs/mayo-ldct-claude-agentic-r2gaussian-search-20260619-01/iterations/iter-0001/comparison.png"}
{"ts": "2026-06-19T15:32:22Z", "run_id": "mayo-ldct-claude-agentic-diff-recon-dcstep-constrained-mayo-v4-search-20260619-01", "iter": 1, "agent": "diffusion_recon_dcstep_constrained_mayo_v4-claude-agentic-breast-ct", "model": "claude-opus-4.7-1m", "change_class": "architecture", "status": "discard", "kept": false, "val_score": 0.3936541676521301, "headroom": 0.0, "params_M": 8.594211, "train_n": 400, "rationale": "diffusion_recon_dcstep_constrained_mayo_v4-claude-agentic: recon_ckpt=/cluster/maier/Agent4CT/checkpoints/ddpm_mayo_constrained_v4.pt, recon_mode=dps, recon_sample_steps=25, recon_eta=30.0, recon_init=fbp, recon_eta_clamp=False, recon_dcstep_every=5, recon_dcstep_n_cg=3, recon_dcstep_warmup=5, recon_dcstep_relax=1.0, val_n=214, train_n=0, rationale=iter-1 search-20260619-01 CONSTRAINED diff-recon vs reused Mayo DDPM v4 ckpt (ch=96, n_train=50 honest train-split prior, val_eps=0.00713). CORRECTED metric: val=ALL 214 L277 slices + 321px detector-geometry FOV (default). Budget-sized DDIM: recon_sample_steps=25 + hard-DC every5/n_cg3/warmup5/relax1.0 = ~37 proj-equivalents/slice. Discarded-614 timing was 82 s/slice at T=200+DC(every3,n_cg10,warmup25); 37/780 of that ~= 4 s/slice x214 ~= 14-17 min < 20-min wall. HYPOTHESIS: budget-sized constrained hard-DC diffusion-recon lands at/below the ~0.84 LD-FBP floor on real rebinned Mayo (diffusion prior trained on a different distribution + low-T budget). In-solver 1800s wall is the backstop.", "advice_for_others": "diffusion_recon_dcstep_constrained_mayo_v4-claude-agentic: recon_ckpt=/cluster/maier/Agent4CT/checkpoints/ddpm_mayo_constrained_v4.pt, recon_mode=dps, recon_sample_steps=25, recon_eta=30.0, recon_init=fbp, recon_eta_clamp=False, recon_dcstep_every=5, recon_dcstep_n_cg=3, recon_dcstep_warmup=5, recon_dcstep_relax=1.0, val_n=214, train_n=0, rationale=iter-1 search-20260619-01 CONSTRAINED diff-recon vs reused Mayo DDPM v4 ckpt (ch=96, n_train=50 honest train-split prior, val_eps=0.00713). CORRECTED metric: val=ALL 214 L277 slices + 321px detector-geometry FOV (default). Budget-sized DDIM: recon_sample_steps=25 + hard-DC every5/n_cg3/warmup5/relax1.0 = ~37 proj-equivalents/slice. Discarded-614 timing was 82 s/slice at T=200+DC(every3,n_cg10,warmup25); 37/780 of that ~= 4 s/slice x214 ~= 14-17 min < 20-min wall. HYPOTHESIS: budget-sized constrained hard-DC diffusion-recon lands at/below the ~0.84 LD-FBP floor on real rebinned Mayo (diffusion prior trained on a different distribution + low-T budget). In-solver 1800s wall is the backstop.", "comparison_image": "runs/mayo-ldct-claude-agentic-diff-recon-dcstep-constrained-mayo-v4-search-20260619-01/iterations/iter-0001/comparison.png"}
{"ts": "2026-06-19T14:51:13Z", "run_id": "mayo-ldct-claude-agentic-hammernik-vn-search-20260619-01", "iter": 1, "agent": "hammernik_vn-claude-agentic-breast-ct", "model": "claude-opus-4.7-1m", "change_class": "architecture", "status": "discard", "kept": false, "val_score": 0.805282473564148, "headroom": 0.0, "params_M": 0.012165, "train_n": 400, "rationale": "hammernik_vn-claude-agentic: vn_T=5, vn_n_filters=16, vn_kernel=11, vn_n_bumps=31, vn_x_range=1.0, vn_lambda_init=0.0023, vn_init=fbp, vn_dc_norm=True, vn_checkpoint=True, vn_normalize_filters=False, epochs=14, batch_size=2, lr=0.0005, grad_clip=1.0, train_n=200, val_n=214, max_train_s=1000, seed=42, rationale=FRESH search-20260619-01 iter-1 FEASIBILITY (corrected protocol: val=ALL 214 L277 slices + 321px detector-geometry FOV; HARD 20-min train+score budget; staged_canonical v3 mayo_ldct_fitted geometry, per-sample-ps FBP init + per-step model.projector swap, bg_target=truth, no fov= override). Hammernik-VN = MRI variational net ported to CT: T untied unrolled steps, each = learned filter-bank + per-filter RBF activation (the _rho_prime bump loop) PLUS an in-loop PYRO-NN projector data-consistency step (architectural twin of LPD/ItNet but tiny interpretable regulariser). CRITICAL LESSON from the SIBLING hammernik_2017 iter-1: it did NOT diverge to 0.0 -- it CUDA-OOM'd in _rho_prime at 72s with batch_size=4 (16GB RTX5000; the (B,F,H,W)=(4,16,512,512) x 31-bump RBF tensors + 5-step autograd blew the card). So the dominant iter-1 risk here is MEMORY, not divergence. MITIGATION: batch_size=2 (NOT 4), vn_n_filters=16 (below the 24 default -> fewer RBF tensors), vn_checkpoint=true (gradient-checkpoints each unrolled step -- hammernik_vn HAS this knob, cuts activation memory ~T-fold; this is the key difference that lets the projector-in-loop VN fit where the 2017 batch=4 did not). STABILITY against the documented VN family divergence/NaN->0.0 trap: grad_clip=1.0 (MANDATORY -- the 2304-view Mayo FBP adjoint overflows the backward; clip_and_step also SKIPS nonfinite-gradient batches so a poisoned step can't collapse the recon to a constant), vn_dc_norm=true (power-iter normalizes R^T(Rx-g) so softplus(lambda_t) stays O(1) regardless of geometry -- the safeguard the projector-less 2017 lacked), lr=5e-4 (the documented hammernik_vn optimum from the discarded run; 8e-4 was worse, brief caps lr<=5e-4), vn_lambda_init=2.3e-3 (loose VN-port working-corner hint). CAPACITY conservative per brief: vn_T=5, vn_kernel=11, vn_n_bumps=31, vn_x_range=1.0 (FBP recon is ~O(1) so the RBF grid [-1,1] covers it). BUDGET: reference -- LPD (projector-in-loop, T=7, ep30, train200, score214) ran 1150s/19.2min right at the edge; hammernik_vn at T=5/N_k=16/checkpointed should be comparable-or-cheaper per step. max_train_s=1000 (16.7min in-solver wall) is the BINDING constraint (epochs=14 is just an upper bound the wall trips first), leaving ~3min for score(214)+figure under the 30min SLURM kill. HYPOTHESIS: if I run a budget-sized, MEMORY-SAFE (batch=2, checkpointed), STABLE (grad_clip=1.0, dc_norm) Hammernik-VN, I expect (a) it AVOIDS the hammernik_2017 OOM and produces a FINITE val_ssim within 20min, and (b) the projector DC step lands it near or above the ~0.84 LD-FBP SSIM floor -- because a learned-regulariser + true-projector-DC unroll is a sound Mayo recon family (sibling LPD/ItNet/DD-sup all run finite here). This onboarding iter establishes the corrected-metric VN baseline that iter-2+ tunes one knob at a time (epochs/wall first to confirm convergence, then vn_T or vn_lambda_init).", "advice_for_others": "hammernik_vn-claude-agentic: vn_T=5, vn_n_filters=16, vn_kernel=11, vn_n_bumps=31, vn_x_range=1.0, vn_lambda_init=0.0023, vn_init=fbp, vn_dc_norm=True, vn_checkpoint=True, vn_normalize_filters=False, epochs=14, batch_size=2, lr=0.0005, grad_clip=1.0, train_n=200, val_n=214, max_train_s=1000, seed=42, rationale=FRESH search-20260619-01 iter-1 FEASIBILITY (corrected protocol: val=ALL 214 L277 slices + 321px detector-geometry FOV; HARD 20-min train+score budget; staged_canonical v3 mayo_ldct_fitted geometry, per-sample-ps FBP init + per-step model.projector swap, bg_target=truth, no fov= override). Hammernik-VN = MRI variational net ported to CT: T untied unrolled steps, each = learned filter-bank + per-filter RBF activation (the _rho_prime bump loop) PLUS an in-loop PYRO-NN projector data-consistency step (architectural twin of LPD/ItNet but tiny interpretable regulariser). CRITICAL LESSON from the SIBLING hammernik_2017 iter-1: it did NOT diverge to 0.0 -- it CUDA-OOM'd in _rho_prime at 72s with batch_size=4 (16GB RTX5000; the (B,F,H,W)=(4,16,512,512) x 31-bump RBF tensors + 5-step autograd blew the card). So the dominant iter-1 risk here is MEMORY, not divergence. MITIGATION: batch_size=2 (NOT 4), vn_n_filters=16 (below the 24 default -> fewer RBF tensors), vn_checkpoint=true (gradient-checkpoints each unrolled step -- hammernik_vn HAS this knob, cuts activation memory ~T-fold; this is the key difference that lets the projector-in-loop VN fit where the 2017 batch=4 did not). STABILITY against the documented VN family divergence/NaN->0.0 trap: grad_clip=1.0 (MANDATORY -- the 2304-view Mayo FBP adjoint overflows the backward; clip_and_step also SKIPS nonfinite-gradient batches so a poisoned step can't collapse the recon to a constant), vn_dc_norm=true (power-iter normalizes R^T(Rx-g) so softplus(lambda_t) stays O(1) regardless of geometry -- the safeguard the projector-less 2017 lacked), lr=5e-4 (the documented hammernik_vn optimum from the discarded run; 8e-4 was worse, brief caps lr<=5e-4), vn_lambda_init=2.3e-3 (loose VN-port working-corner hint). CAPACITY conservative per brief: vn_T=5, vn_kernel=11, vn_n_bumps=31, vn_x_range=1.0 (FBP recon is ~O(1) so the RBF grid [-1,1] covers it). BUDGET: reference -- LPD (projector-in-loop, T=7, ep30, train200, score214) ran 1150s/19.2min right at the edge; hammernik_vn at T=5/N_k=16/checkpointed should be comparable-or-cheaper per step. max_train_s=1000 (16.7min in-solver wall) is the BINDING constraint (epochs=14 is just an upper bound the wall trips first), leaving ~3min for score(214)+figure under the 30min SLURM kill. HYPOTHESIS: if I run a budget-sized, MEMORY-SAFE (batch=2, checkpointed), STABLE (grad_clip=1.0, dc_norm) Hammernik-VN, I expect (a) it AVOIDS the hammernik_2017 OOM and produces a FINITE val_ssim within 20min, and (b) the projector DC step lands it near or above the ~0.84 LD-FBP SSIM floor -- because a learned-regulariser + true-projector-DC unroll is a sound Mayo recon family (sibling LPD/ItNet/DD-sup all run finite here). This onboarding iter establishes the corrected-metric VN baseline that iter-2+ tunes one knob at a time (epochs/wall first to confirm convergence, then vn_T or vn_lambda_init).", "comparison_image": "runs/mayo-ldct-claude-agentic-hammernik-vn-search-20260619-01/iterations/iter-0001/comparison.png"}
{"ts": "2026-06-19T14:50:10Z", "run_id": "mayo-ldct-claude-agentic-tv-iterative-supervised-search-20260619-01", "iter": 1, "agent": "tv_iterative_supervised-claude-agentic-breast-ct", "model": "claude-opus-4.7-1m", "change_class": "architecture", "status": "discard", "kept": false, "val_score": 0.2855411767959595, "headroom": 0.0, "params_M": 2e-05, "train_n": 400, "rationale": "tv_iterative_supervised-claude-agentic: val_n=214, val_chunk=5, train_n=40, epochs=8, batch_size=1, lr=0.005, tv_K=10, tv_step_init=0.01, tv_lambda_init=0.001, tv_share_steps=False, tv_clip_max=0.05, tv_eps=1e-06, lambda_neg=1.0, loss_base=mse, grad_clip=1.0, rationale=tv_iterative_supervised iter-1 (search-20260619-01, corrected 214-slice/321px-FOV metric): feasibility baseline, NO prior iter. Unrolled K=10 TV-GD with per-iter learnable step+lambda (20 trainable scalars), supervised-L2 vs clean truth, init from LD-FBP. SEEDED from the sibling classical tv_iterative iter-1 corner (SSIM 0.92298 / hr 0.133): tv_step_init=0.01 (=classical tv_lr), tv_lambda_init=0.001 (=classical tv_lambda), tv_clip_max=0.05. ADDS a SHORT supervised training phase (train_n=40, epochs=8, bs=1) on top of the 214-slice val pass. BUDGET (HARD 20 min train+score): classical tv_iterative ran 120 GD-iters x 214 slices in 918s (~0.036 s/slice-iter, dominated by the 2304-view 512px projector pair). This variant: val = K=10 unrolled x 214 slices, val_chunk=5 -> ~80-120s. Train = 40 samples x 8 epochs x K=10 x (fwd+bwd, ~2-3x a val slice-iter) ~ 256-380s. + 214-slice FBP precompute + load ~120s. Total ~7-10 min, ~2x margin under the 1200s wall. bs=1 holds only one K-step autograd graph at a time (memory-safe on 16 GB; no OOM risk vs the hammernik bs=4 OOM). FAILURE MODES TO AVOID: (a) 214-slice TV recon x training blows the wall -> kept K, train_n, epochs conservative; (b) under-training the 20 scalars -> epochs=8 gives the learnable step/lambda schedule room to depart from the seed while still fitting. HYPOTHESIS: a LEARNED per-iter lambda schedule lands at or slightly ABOVE the classical fixed-lambda tv_iterative hr 0.133, because the supervised end-to-end fit can adapt the data-vs-TV balance per unrolled step rather than holding one fixed lambda. If it under-performs the classical baseline, the K=10 unrolled depth (vs classical 120 iters) is the limiter and iter-2 raises tv_K.", "advice_for_others": "tv_iterative_supervised-claude-agentic: val_n=214, val_chunk=5, train_n=40, epochs=8, batch_size=1, lr=0.005, tv_K=10, tv_step_init=0.01, tv_lambda_init=0.001, tv_share_steps=False, tv_clip_max=0.05, tv_eps=1e-06, lambda_neg=1.0, loss_base=mse, grad_clip=1.0, rationale=tv_iterative_supervised iter-1 (search-20260619-01, corrected 214-slice/321px-FOV metric): feasibility baseline, NO prior iter. Unrolled K=10 TV-GD with per-iter learnable step+lambda (20 trainable scalars), supervised-L2 vs clean truth, init from LD-FBP. SEEDED from the sibling classical tv_iterative iter-1 corner (SSIM 0.92298 / hr 0.133): tv_step_init=0.01 (=classical tv_lr), tv_lambda_init=0.001 (=classical tv_lambda), tv_clip_max=0.05. ADDS a SHORT supervised training phase (train_n=40, epochs=8, bs=1) on top of the 214-slice val pass. BUDGET (HARD 20 min train+score): classical tv_iterative ran 120 GD-iters x 214 slices in 918s (~0.036 s/slice-iter, dominated by the 2304-view 512px projector pair). This variant: val = K=10 unrolled x 214 slices, val_chunk=5 -> ~80-120s. Train = 40 samples x 8 epochs x K=10 x (fwd+bwd, ~2-3x a val slice-iter) ~ 256-380s. + 214-slice FBP precompute + load ~120s. Total ~7-10 min, ~2x margin under the 1200s wall. bs=1 holds only one K-step autograd graph at a time (memory-safe on 16 GB; no OOM risk vs the hammernik bs=4 OOM). FAILURE MODES TO AVOID: (a) 214-slice TV recon x training blows the wall -> kept K, train_n, epochs conservative; (b) under-training the 20 scalars -> epochs=8 gives the learnable step/lambda schedule room to depart from the seed while still fitting. HYPOTHESIS: a LEARNED per-iter lambda schedule lands at or slightly ABOVE the classical fixed-lambda tv_iterative hr 0.133, because the supervised end-to-end fit can adapt the data-vs-TV balance per unrolled step rather than holding one fixed lambda. If it under-performs the classical baseline, the K=10 unrolled depth (vs classical 120 iters) is the limiter and iter-2 raises tv_K.", "comparison_image": "runs/mayo-ldct-claude-agentic-tv-iterative-supervised-search-20260619-01/iterations/iter-0001/comparison.png"}
