{"ts": "2026-06-21T15:12:18Z", "run_id": "mayo-ldct-claude-agentic-naf-search-20260619-01", "iter": 9, "agent": "naf-claude-agentic", "model": "claude-opus-4-8-1m", "change_class": "architecture", "status": "discard", "kept": false, "val_score": 0.6802563071250916, "headroom": 0.0, "params_M": 50.335841, "train_n": 400, "rationale": "naf-claude-agentic: val_n=214, naf_encoding=hash, naf_hash_levels=24, naf_hash_feat_dim=4, naf_hash_log2_size=19, naf_hash_base_res=16, naf_hash_max_res=512, naf_n_freqs=8, naf_hidden=32, naf_layers=3, naf_n_iter=3000, naf_lr=0.02, naf_tv_weight=0.0001, naf_n_clip=0.05, naf_outer_wall_s=1080, naf_per_scene_s=5.0, seed=42, rationale=ITER-9 (search-20260619-01, naf). SIX-BOX (NUMBERS, not CT pixels). (1) TRAJECTORY + mapped hash params (all hr=0): iter-1 fourier hidden=128 layers=4 lr=1e-2 -> SSIM 0.4729. iter-2 hidden 128->64 -> 0.4943. iter-3 layers 4->3 -> 0.5452. iter-4 lr 1e-2->2e-2 -> 0.5629 = BEST FOURIER. iter-5 lr 2e-2->4e-2 -> 0.3592 REGRESSED. iter-6 audit-fix (A) naf_encoding fourier->hash (Instant-NGP 16-level multi-res hash grid: levels=16 feat_dim=2 log2_size=19 base_res=16 max_res=512 -> 32-dim feature -> SMALL MLP hidden=32 layers=3 lr=2e-2) -> SSIM 0.6715 (PSNR 23.35, params 16.78M) = NEW BEST, hr 0. iter-7 naf_hidden 32->64 (MLP width) -> SSIM 0.6346 FLAT/REGRESSED = MLP-width axis EXHAUSTED. iter-8 naf_hash_feat_dim 2->4 (per-level features, 16x4=64-dim feature) -> SSIM 0.6951 (PSNR 23.37, RMSE 0.003392, params 33.56M, elapsed 1098.4s) = NEW BEST (+0.0236, hr 0) -> richer HASH-FEATURE capacity (not MLP width) is the live SSIM lever. MAPPED hash params so far: feat_dim (2->4, lift) + MLP-width (32<->64, exhausted) probed; hash_levels=16, log2_size=19, base_res=16, max_res=512 still UNTRIED. (2) LIMITER: NAF is REGIME-BOUNDED on DENSE 2304-view Mayo (LD-FBP near-complete -> hr stays 0; audit says the hash fix makes the impl FAITHFUL, real payoff is the 128-view SPARSE benchmarks). For SSIM within budget the binding limiter is HASH CAPACITY: iter-8 proved doubling per-level features lifts SSIM, so the multi-res hash grid is still capacity-bound, not decoder-bound. (3) ONE KNOB: naf_hash_levels 16->24 (from iter-8 BEST cfg: naf_encoding=hash, naf_hash_feat_dim=4, naf_hidden=32, naf_layers=3, naf_lr=2e-2, naf_hash_log2_size=19, naf_hash_base_res=16, naf_hash_max_res=512 ALL UNCHANGED; step count / wall UNTOUCHED = the deferred B-fix). hash_levels 16->24 adds 8 more geometric resolution levels between base_res=16 and max_res=512, concatenating 8 more per-level 4-dim features -> input feature 16x4=64-dim -> 24x4=96-dim. This is the natural next hash-capacity axis after feat_dim (iter-8 lifted along the feature axis; levels lifts along the resolution axis), the most direct test of whether richer hash capacity KEEPS lifting SSIM. (4) HYPOTHESIS: if naf_hash_levels 16->24, SSIM rises above 0.6951 because more multi-res levels give the hash grid finer resolution coverage and a richer feature for the INR within the same per-scene step budget. NUMERIC FALSIFIER: if SSIM <= 0.6951, hash capacity is EXHAUSTED in-budget on dense Mayo -- the hash-NAF ceiling here is ~0.70 SSIM (well below LD-FBP ~0.81 cal floor, hr 0), a STRUCTURAL NEGATIVE on dense 2304-view Mayo (regime-bounded; real payoff is the SPARSE benchmarks), document toward iter-20. (5) SIZE to HARD 1200s budget: 214-scene pass, naf_outer_wall_s=1080 (18-min in-solver outer wall = governor) + naf_per_scene_s=5.0 (in-solver per-scene wall; naf_n_iter=3000 stays a HIGH CAP so the WALL governs). STEP COUNT KEPT at iter-6/8 value (per_scene_s 5.0, n_iter cap 3000 UNCHANGED -- raising it is the DEFERRED B-fix; NOT touched). 214x5.0s=1070s ~= 1080s outer wall (measured elapsed 1098.4s at iter-8 feat_dim=4, inside the 30-min sbatch kill). hash_levels 16->24 adds 8 small per-level hash-table gathers/step + grows the MLP input 64->96-dim (one extra Linear(96,32) row block); per-step cost stays DOMINATED by the fixed 2304-view fan-beam forward+backward, so step count per 5.0s scene stays comparable -- ~free on the wall, fits the HARD 1200s budget. val_n=214 (ALL L277 slices), staged_canonical v3 mayo_ldct_fitted geometry, per-sample-ps (inlined single-val-ps probe -> L277 native ps ~0.73979), bg_target=truth, 321px detector-geometry FOV default (no fov= override), naf_encoding=hash kept. (6) no control return; the loop dispatches the next iter.", "advice_for_others": "naf-claude-agentic: val_n=214, naf_encoding=hash, naf_hash_levels=24, naf_hash_feat_dim=4, naf_hash_log2_size=19, naf_hash_base_res=16, naf_hash_max_res=512, naf_n_freqs=8, naf_hidden=32, naf_layers=3, naf_n_iter=3000, naf_lr=0.02, naf_tv_weight=0.0001, naf_n_clip=0.05, naf_outer_wall_s=1080, naf_per_scene_s=5.0, seed=42, rationale=ITER-9 (search-20260619-01, naf). SIX-BOX (NUMBERS, not CT pixels). (1) TRAJECTORY + mapped hash params (all hr=0): iter-1 fourier hidden=128 layers=4 lr=1e-2 -> SSIM 0.4729. iter-2 hidden 128->64 -> 0.4943. iter-3 layers 4->3 -> 0.5452. iter-4 lr 1e-2->2e-2 -> 0.5629 = BEST FOURIER. iter-5 lr 2e-2->4e-2 -> 0.3592 REGRESSED. iter-6 audit-fix (A) naf_encoding fourier->hash (Instant-NGP 16-level multi-res hash grid: levels=16 feat_dim=2 log2_size=19 base_res=16 max_res=512 -> 32-dim feature -> SMALL MLP hidden=32 layers=3 lr=2e-2) -> SSIM 0.6715 (PSNR 23.35, params 16.78M) = NEW BEST, hr 0. iter-7 naf_hidden 32->64 (MLP width) -> SSIM 0.6346 FLAT/REGRESSED = MLP-width axis EXHAUSTED. iter-8 naf_hash_feat_dim 2->4 (per-level features, 16x4=64-dim feature) -> SSIM 0.6951 (PSNR 23.37, RMSE 0.003392, params 33.56M, elapsed 1098.4s) = NEW BEST (+0.0236, hr 0) -> richer HASH-FEATURE capacity (not MLP width) is the live SSIM lever. MAPPED hash params so far: feat_dim (2->4, lift) + MLP-width (32<->64, exhausted) probed; hash_levels=16, log2_size=19, base_res=16, max_res=512 still UNTRIED. (2) LIMITER: NAF is REGIME-BOUNDED on DENSE 2304-view Mayo (LD-FBP near-complete -> hr stays 0; audit says the hash fix makes the impl FAITHFUL, real payoff is the 128-view SPARSE benchmarks). For SSIM within budget the binding limiter is HASH CAPACITY: iter-8 proved doubling per-level features lifts SSIM, so the multi-res hash grid is still capacity-bound, not decoder-bound. (3) ONE KNOB: naf_hash_levels 16->24 (from iter-8 BEST cfg: naf_encoding=hash, naf_hash_feat_dim=4, naf_hidden=32, naf_layers=3, naf_lr=2e-2, naf_hash_log2_size=19, naf_hash_base_res=16, naf_hash_max_res=512 ALL UNCHANGED; step count / wall UNTOUCHED = the deferred B-fix). hash_levels 16->24 adds 8 more geometric resolution levels between base_res=16 and max_res=512, concatenating 8 more per-level 4-dim features -> input feature 16x4=64-dim -> 24x4=96-dim. This is the natural next hash-capacity axis after feat_dim (iter-8 lifted along the feature axis; levels lifts along the resolution axis), the most direct test of whether richer hash capacity KEEPS lifting SSIM. (4) HYPOTHESIS: if naf_hash_levels 16->24, SSIM rises above 0.6951 because more multi-res levels give the hash grid finer resolution coverage and a richer feature for the INR within the same per-scene step budget. NUMERIC FALSIFIER: if SSIM <= 0.6951, hash capacity is EXHAUSTED in-budget on dense Mayo -- the hash-NAF ceiling here is ~0.70 SSIM (well below LD-FBP ~0.81 cal floor, hr 0), a STRUCTURAL NEGATIVE on dense 2304-view Mayo (regime-bounded; real payoff is the SPARSE benchmarks), document toward iter-20. (5) SIZE to HARD 1200s budget: 214-scene pass, naf_outer_wall_s=1080 (18-min in-solver outer wall = governor) + naf_per_scene_s=5.0 (in-solver per-scene wall; naf_n_iter=3000 stays a HIGH CAP so the WALL governs). STEP COUNT KEPT at iter-6/8 value (per_scene_s 5.0, n_iter cap 3000 UNCHANGED -- raising it is the DEFERRED B-fix; NOT touched). 214x5.0s=1070s ~= 1080s outer wall (measured elapsed 1098.4s at iter-8 feat_dim=4, inside the 30-min sbatch kill). hash_levels 16->24 adds 8 small per-level hash-table gathers/step + grows the MLP input 64->96-dim (one extra Linear(96,32) row block); per-step cost stays DOMINATED by the fixed 2304-view fan-beam forward+backward, so step count per 5.0s scene stays comparable -- ~free on the wall, fits the HARD 1200s budget. val_n=214 (ALL L277 slices), staged_canonical v3 mayo_ldct_fitted geometry, per-sample-ps (inlined single-val-ps probe -> L277 native ps ~0.73979), bg_target=truth, 321px detector-geometry FOV default (no fov= override), naf_encoding=hash kept. (6) no control return; the loop dispatches the next iter.", "comparison_image": "runs/mayo-ldct-claude-agentic-naf-search-20260619-01/iterations/iter-0009/comparison.png"}
{"ts": "2026-06-21T15:12:17Z", "run_id": "mayo-ldct-claude-agentic-r2gaussian-search-20260619-01", "iter": 9, "agent": "r2gaussian-claude-agentic", "model": "claude-opus-4-8-1m", "change_class": "architecture", "status": "discard", "kept": false, "val_score": 0.7614022493362427, "headroom": 0.0, "params_M": 0.003072, "train_n": 400, "rationale": "r2gaussian-claude-agentic: val_n=214, gs_n_gaussians=512, gs_n_iter=150, gs_lr_pos=0.005, gs_lr_scale=0.01, gs_lr_amp=0.01, gs_lr_rot=0.01, gs_amp_init=0.01, gs_scale_init=0.04, gs_tv_weight=0.0001, gs_n_clip=0.05, gs_render=raster, gs_init_from_fbp=True, gs_amp_init_max=0.05, gs_ssim_weight=0.4, gs_outer_wall_s=1080, rationale=iter-9 (search-20260619-01) \u2014 AUTHORIZED audit-fix (b) SSIM-weight continuation, push-or-saturate. ONE KNOB: gs_ssim_weight 0.25->0.4 (BASE_ITER=8 BEST: gs_init_from_fbp=True, gs_render=raster, gs_n_iter=150, 512 Gaussians, gs_amp_init_max=0.05 \u2014 the config that set run-best SSIM 0.7696). LIMITER: r2gaussian is REGIME-BOUNDED on dense 2304-view Mayo \u2014 LD-FBP (~0.808) is near-complete, the inverse is not ill-posed enough for a Gaussian-splat prior to add value, so hr>0 is implausible regardless. The live SSIM lever is the audit-fix (b) SSIM-weight pull toward FBP structure, now with DIMINISHING returns: iter-6 SSIM@0.10 0.7519 -> iter-7 @0.15 0.7641 (+0.0122) -> iter-8 @0.25 0.7696 (+0.0055). HYPOTHESIS (falsifiable in NUMBERS): a stronger SSIM pull (0.25->0.4) nudges the ~26 completed scenes further AT/ABOVE their FBP init, so the 214-avg SSIM rises modestly above iter-8 0.7696 toward the 0.808 LD-FBP floor. PREDICTION: SSIM in (0.770, 0.79), hr 0 (regime-bounded \u2014 even matching FBP yields hr=0). NUMERIC FALSIFIER: if SSIM <= 0.7696 (no lift over iter-8 best), the SSIM-weight lever is SATURATED on dense Mayo \u2014 fix VALIDATED AS FAITHFUL-BUT-REGIME-BOUNDED (its real payoff is the 128-view SPARSE benchmarks). BUDGET: gs_init_from_fbp adds ~0 per-step cost (init only); the SSIM term is one cheap conv-SSIM per step vs the dominating 2304-view projection, so per-step stays ~0.282 s and coverage ~26/214 (same as iter-8, elapsed_s 1125.3 < 1800 SLURM wall). gs_outer_wall_s=1080 self-truncates before the 30-min kill, val figure excluded. val_n=214 per mandate; staged_canonical / v3 mayo_ldct_fitted geom / per-sample-ps (single-val-ps probe) / bg_target=truth / 321px-FOV-default / gs_render=raster all hard-wired. gs_render stays raster (the splat path is the DEFERRED (a) fix and raises NotImplementedError); gs_n_iter held at 150 (the under-budget gs_n_iter-up lever is DEFERRED post-TPE). TRAJECTORY: iter-7 0.7641 (SSIM@0.15) -> iter-8 0.7696 (SSIM@0.25, BEST) -> iter-9 = SSIM weight 0.25->0.4, the push-or-saturate test of the authorized audit-fix (b).", "advice_for_others": "r2gaussian-claude-agentic: val_n=214, gs_n_gaussians=512, gs_n_iter=150, gs_lr_pos=0.005, gs_lr_scale=0.01, gs_lr_amp=0.01, gs_lr_rot=0.01, gs_amp_init=0.01, gs_scale_init=0.04, gs_tv_weight=0.0001, gs_n_clip=0.05, gs_render=raster, gs_init_from_fbp=True, gs_amp_init_max=0.05, gs_ssim_weight=0.4, gs_outer_wall_s=1080, rationale=iter-9 (search-20260619-01) \u2014 AUTHORIZED audit-fix (b) SSIM-weight continuation, push-or-saturate. ONE KNOB: gs_ssim_weight 0.25->0.4 (BASE_ITER=8 BEST: gs_init_from_fbp=True, gs_render=raster, gs_n_iter=150, 512 Gaussians, gs_amp_init_max=0.05 \u2014 the config that set run-best SSIM 0.7696). LIMITER: r2gaussian is REGIME-BOUNDED on dense 2304-view Mayo \u2014 LD-FBP (~0.808) is near-complete, the inverse is not ill-posed enough for a Gaussian-splat prior to add value, so hr>0 is implausible regardless. The live SSIM lever is the audit-fix (b) SSIM-weight pull toward FBP structure, now with DIMINISHING returns: iter-6 SSIM@0.10 0.7519 -> iter-7 @0.15 0.7641 (+0.0122) -> iter-8 @0.25 0.7696 (+0.0055). HYPOTHESIS (falsifiable in NUMBERS): a stronger SSIM pull (0.25->0.4) nudges the ~26 completed scenes further AT/ABOVE their FBP init, so the 214-avg SSIM rises modestly above iter-8 0.7696 toward the 0.808 LD-FBP floor. PREDICTION: SSIM in (0.770, 0.79), hr 0 (regime-bounded \u2014 even matching FBP yields hr=0). NUMERIC FALSIFIER: if SSIM <= 0.7696 (no lift over iter-8 best), the SSIM-weight lever is SATURATED on dense Mayo \u2014 fix VALIDATED AS FAITHFUL-BUT-REGIME-BOUNDED (its real payoff is the 128-view SPARSE benchmarks). BUDGET: gs_init_from_fbp adds ~0 per-step cost (init only); the SSIM term is one cheap conv-SSIM per step vs the dominating 2304-view projection, so per-step stays ~0.282 s and coverage ~26/214 (same as iter-8, elapsed_s 1125.3 < 1800 SLURM wall). gs_outer_wall_s=1080 self-truncates before the 30-min kill, val figure excluded. val_n=214 per mandate; staged_canonical / v3 mayo_ldct_fitted geom / per-sample-ps (single-val-ps probe) / bg_target=truth / 321px-FOV-default / gs_render=raster all hard-wired. gs_render stays raster (the splat path is the DEFERRED (a) fix and raises NotImplementedError); gs_n_iter held at 150 (the under-budget gs_n_iter-up lever is DEFERRED post-TPE). TRAJECTORY: iter-7 0.7641 (SSIM@0.15) -> iter-8 0.7696 (SSIM@0.25, BEST) -> iter-9 = SSIM weight 0.25->0.4, the push-or-saturate test of the authorized audit-fix (b).", "comparison_image": "runs/mayo-ldct-claude-agentic-r2gaussian-search-20260619-01/iterations/iter-0009/comparison.png"}
{"ts": "2026-06-21T14:46:29Z", "run_id": "mayo-ldct-claude-agentic-learned-primal-dual-search-20260619-01", "iter": 9, "agent": "learned_primal_dual-claude-agentic", "model": "claude-opus-4-8-1m", "change_class": "architecture", "status": "discard", "kept": false, "val_score": 0.8355562686920166, "headroom": 0.0, "params_M": 0.155406, "train_n": 400, "rationale": "learned_primal_dual-claude-agentic: lpd_iters=3, lpd_hidden=48, lpd_n_primal=5, lpd_n_dual=5, lpd_share_weights=False, lr=0.0007, lr_schedule=cosine, epochs=10, batch_size=1, val_chunk=1, train_n=200, val_n=214, grad_clip=1.0, seed=7, rationale=iter-9 search-20260619-01: ONE knob = seed 42 -> 7 (CLEAN CEILING-CONFIRMATION, 2nd independent seed, wall-neutral). BASE_ITER=4 (BEST SSIM 0.898033, hr0: lpd_iters=3, lpd_hidden=48, n_primal=5, n_dual=5, lr=7e-4 cosine, epochs=10, train_n=200, batch=1, val_chunk=1, val_n=214, grad_clip=1.0). HONESTLY a confirmation iter, NOT an untried lever: every genuinely-LPD axis is exhausted across iters 1-8 (ALL hr=0). ARC: 0.84271(it1 iters5/ep6/lr5e-4) -> 0.863635(it2 iters3/ep10) -> 0.885115(it3 ep11 OVER-wall 1213.6s) -> 0.898033(it4 BEST lr7e-4) -> 0.88446(it5 tn300/ep7) -> 0.831302(it6 iters5 deeper-unroll WORSE) -> 0.866666(it7 tn400/ep5 grad-step-parity FELL) -> 0.879511(it8 seed123). LIMITER = FBP-BOUND on DENSE 2304-view Mayo, NOT budget-starved: four independent axes each pushed, all hr=0 -> epochs (SSIM 0.843->0.898 yet hr0), unroll depth (lpd_iters=5 strictly HURT SSIM BOTH tries it1/it6 -- the LPD-defining lever is net-NEGATIVE on dense Mayo), data coverage at grad-step parity (it7 tn400 vs it4 tn200, identical 2000 steps -> SSIM FELL 0.898->0.867), seed (it8 seed123 -> 0.8795, within basin). KNOB-SPACE SCAN: lpd_n_primal/n_dual fixed at 5 (Adler default), lr_schedule has ONLY cosine (no warmup/onecycle alt exists), lr 7e-4 is peak (6e-4 anomalous-collapse, lower regressed), grad_clip retained. lpd_hidden^ is the one capacity knob never pushed UP but adds per-sample cost forcing an epoch cut below the it6/it7 under-train floor AND capacity was never the limiter (the limiter is structural FBP-completeness). Mechanism: LPD learned proximal updates only add value where the FBP adjoint leaves residual ill-posedness (128-view SPARSE -> champion hr0.9062 breast / 0.4947 demo); at 2304 views >> Nyquist the LD-FBP is near-complete so the unrolled correction has no headroom -- sharpens structure (rising SSIM) but cannot push RMSE below the near-optimal LD-FBP floor (hr0). The remaining wall-NEUTRAL read is a 2nd independent seed to complete the campaign-standard noise-floor (3-point seed spread vs init lottery) and definitively document the FBP-bound ceiling toward iter-20. BUDGET MATH vs 1200s: it4 ran ep10*tn200=2000 grad-steps in 1100.7s=18.35min; it8 (same steps, seed123) ran 1099.1s; seed changes ZERO FLOPs -> iter-9 COMPUTE-IDENTICAL ~1100s=18.3min, +100s margin under the 1200s wall. lpd_iters^/lpd_hidden^/epochs^ stay OFF (it1 iters5 hit 1149.5s=19.2min, it3 ep11 hit 1213.6s=20.2min OVER). HYP: seed 7 lands within +/-0.015 SSIM of the 0.879-0.898 basin (it4 seed42 0.898, it8 seed123 0.8795) with hr still 0.000 -> a 3-point seed spread confirms ~0.88-0.90/hr0 is a STABLE basin, not an init artifact, definitively documenting the FBP-bound ceiling toward iter-20. NUMERIC FALSIFIER: SSIM > 0.913 (it4 + 0.015) OR hr > 0.000 -> the basin was init-sensitive (a seed lottery like demo-n2i 0.508->0.420), LPD has unexploited init headroom on Mayo worth a seed sweep rather than a closed ceiling.", "advice_for_others": "learned_primal_dual-claude-agentic: lpd_iters=3, lpd_hidden=48, lpd_n_primal=5, lpd_n_dual=5, lpd_share_weights=False, lr=0.0007, lr_schedule=cosine, epochs=10, batch_size=1, val_chunk=1, train_n=200, val_n=214, grad_clip=1.0, seed=7, rationale=iter-9 search-20260619-01: ONE knob = seed 42 -> 7 (CLEAN CEILING-CONFIRMATION, 2nd independent seed, wall-neutral). BASE_ITER=4 (BEST SSIM 0.898033, hr0: lpd_iters=3, lpd_hidden=48, n_primal=5, n_dual=5, lr=7e-4 cosine, epochs=10, train_n=200, batch=1, val_chunk=1, val_n=214, grad_clip=1.0). HONESTLY a confirmation iter, NOT an untried lever: every genuinely-LPD axis is exhausted across iters 1-8 (ALL hr=0). ARC: 0.84271(it1 iters5/ep6/lr5e-4) -> 0.863635(it2 iters3/ep10) -> 0.885115(it3 ep11 OVER-wall 1213.6s) -> 0.898033(it4 BEST lr7e-4) -> 0.88446(it5 tn300/ep7) -> 0.831302(it6 iters5 deeper-unroll WORSE) -> 0.866666(it7 tn400/ep5 grad-step-parity FELL) -> 0.879511(it8 seed123). LIMITER = FBP-BOUND on DENSE 2304-view Mayo, NOT budget-starved: four independent axes each pushed, all hr=0 -> epochs (SSIM 0.843->0.898 yet hr0), unroll depth (lpd_iters=5 strictly HURT SSIM BOTH tries it1/it6 -- the LPD-defining lever is net-NEGATIVE on dense Mayo), data coverage at grad-step parity (it7 tn400 vs it4 tn200, identical 2000 steps -> SSIM FELL 0.898->0.867), seed (it8 seed123 -> 0.8795, within basin). KNOB-SPACE SCAN: lpd_n_primal/n_dual fixed at 5 (Adler default), lr_schedule has ONLY cosine (no warmup/onecycle alt exists), lr 7e-4 is peak (6e-4 anomalous-collapse, lower regressed), grad_clip retained. lpd_hidden^ is the one capacity knob never pushed UP but adds per-sample cost forcing an epoch cut below the it6/it7 under-train floor AND capacity was never the limiter (the limiter is structural FBP-completeness). Mechanism: LPD learned proximal updates only add value where the FBP adjoint leaves residual ill-posedness (128-view SPARSE -> champion hr0.9062 breast / 0.4947 demo); at 2304 views >> Nyquist the LD-FBP is near-complete so the unrolled correction has no headroom -- sharpens structure (rising SSIM) but cannot push RMSE below the near-optimal LD-FBP floor (hr0). The remaining wall-NEUTRAL read is a 2nd independent seed to complete the campaign-standard noise-floor (3-point seed spread vs init lottery) and definitively document the FBP-bound ceiling toward iter-20. BUDGET MATH vs 1200s: it4 ran ep10*tn200=2000 grad-steps in 1100.7s=18.35min; it8 (same steps, seed123) ran 1099.1s; seed changes ZERO FLOPs -> iter-9 COMPUTE-IDENTICAL ~1100s=18.3min, +100s margin under the 1200s wall. lpd_iters^/lpd_hidden^/epochs^ stay OFF (it1 iters5 hit 1149.5s=19.2min, it3 ep11 hit 1213.6s=20.2min OVER). HYP: seed 7 lands within +/-0.015 SSIM of the 0.879-0.898 basin (it4 seed42 0.898, it8 seed123 0.8795) with hr still 0.000 -> a 3-point seed spread confirms ~0.88-0.90/hr0 is a STABLE basin, not an init artifact, definitively documenting the FBP-bound ceiling toward iter-20. NUMERIC FALSIFIER: SSIM > 0.913 (it4 + 0.015) OR hr > 0.000 -> the basin was init-sensitive (a seed lottery like demo-n2i 0.508->0.420), LPD has unexploited init headroom on Mayo worth a seed sweep rather than a closed ceiling.", "comparison_image": "runs/mayo-ldct-claude-agentic-learned-primal-dual-search-20260619-01/iterations/iter-0009/comparison.png"}
