{"ts": "2026-06-21T12:35:51Z", "run_id": "mayo-ldct-claude-agentic-tv-iterative-supervised-search-20260619-01", "iter": 8, "agent": "tv_iterative_supervised-claude-agentic", "model": "claude-opus-4-8-1m", "change_class": "architecture", "status": "discard", "kept": false, "val_score": 0.8185644745826721, "headroom": 0.0, "params_M": 2e-06, "train_n": 400, "rationale": "tv_iterative_supervised-claude-agentic: val_n=214, val_chunk=5, train_n=160, epochs=8, batch_size=1, lr=0.005, tv_K=8, tv_step_init=1e-05, tv_lambda_init=0.001, tv_share_steps=True, tv_clip_max=0.05, tv_eps=1e-06, lambda_neg=1.0, loss_base=mse, grad_clip=1.0, rationale=tv_iterative_supervised iter-8 (search-20260619-01, corrected 214-slice/321px-FOV metric). BASE_ITER=7 (BEST SSIM 0.8192 / hr 0.0, the stable share=True step=1e-5 lr=5e-3 K=8 config). TRAJECTORY (SSIM/hr): iter-1 K=10 0.2855/0; iter-2 K=30 0.2855/0 (depth FALSIFIED at frozen-step, byte-identical); iter-3 step=1e-8 0.8137/0 (LD-FBP PASSTHROUGH); iter-4 step=1e-5 share=F 0.6949/0 (per-step RUNAWAY into clamp); iter-5 step=1e-5 share=T 0.6074/0 (per-step fixed but LAMBDA runaway); iter-6 lr 5e-2->5e-3 0.8185/0 (lambda runaway tamed -> recovered to FBP floor); iter-7 tv_K 30->8 0.8192/0 (depth-DOWN did NOT break out -> sits EXACTLY at the FBP passthrough floor). BEST SSIM 0.8192; hr=0.0 EVERY iter. MAPPED+FALSIFIED KNOBS: tv_step_init bracketed {1e-2 saturate, 1e-8 passthrough, 1e-5 active-basin}; tv_share_steps {F runaway, T stable}; tv_lr {5e-2 over-drives lambda, 5e-3 stable}; tv_K {10/30 inert at frozen-step, 8 flat at stable regime -- the itnet/hammernik_vn depth-DOWN breakout analog FAILED here}. HELD CONSTANT ALL 7 ITERS, NEVER PROBED: train_n=40, epochs=8, tv_lambda_init=1e-3, seed. LIMITER: iter-7 sits EXACTLY at the LD-FBP passthrough floor (0.8192 ~= 0.8137/0.8185 ~0.81); the trained 2-scalar global-TV (share=True) is a near-identity map on fbp_init. The unrolled-DEPTH lever is now exhausted. The campaign-state note flags train_n DATA-COVERAGE as the strongest GENUINELY-UNTRIED axis: this solver IS an amortized supervised trainer (load_val_split(split=train, n=train_n) at solver lines 74/188), and train_n=40 sees only ~7%% of the ~579-slice Wagner train pool. ONE KNOB CHANGED (from BASE_ITER=7): train_n 40 -> 160 (4x data coverage, ~28%% of the train pool). All else IDENTICAL to iter-7 (tv_share_steps=True, tv_step_init=1e-5, tv_lr=5e-3, tv_lambda_init=1e-3, tv_K=8, epochs=8, bs=1, tv_clip_max=0.05, tv_eps=1e-6, val_n=214 ALL L277, val_chunk=5, grad_clip=1.0). HYPOTHESIS: with 4x more anatomy in the supervised fit, the 2 shared scalars settle on a step/lambda balance generalizing across more tissue/noise, so the trained-stable TV could finally EXCEED its own LD-FBP passthrough (SSIM > 0.8192, hr > 0) -- this is the strongest untried lever and a clean falsifier, NOT a repeat. NUMERIC FALSIFIER (decisive): if SSIM stays <= 0.8192 with hr=0.0 at train_n=160, the data-coverage lever is EXHAUSTED too -- with only 2 trainable scalars CAPACITY (not data) is the binding constraint, and supervised-unrolled-TV is CONFIRMED FBP-BOUNDED on real Mayo 2304-view LDCT under the config-only contract (the shared solvers raw unnormalized-adjoint back_project step is FORBIDDEN to edit) -> the LAST unmapped lever is RETIRED -> file the NEGATIVE RESULT. BUDGET (HARD 20-min train+score = 1200s): iter-7 (K=8, train_n=40, epochs=8) ran in 260.7s. Fixed overhead (data load + 214-slice FBP precompute + val pass) ~= 150s; train phase at train_n=40 ~= 110s scales ~linearly -> train_n=160 (4x) ~= 440s train + ~150s overhead ~= 590s, >2x margin under the 1200s wall; K=8 keeps per-step cost low. PREDICTED iter-8: SSIM ~0.81-0.84, hr most-likely 0.0 (a single global-TV weight over a near-complete 2304-view inverse is a structurally weak image-domain prior regardless of data coverage); small chance hr 0.0-0.05 if more data lets the 2 scalars generalize past the passthrough. This iter is a GENUINELY-UNTRIED lever (train_n never probed); if it falsifies, it RETIRES THE LAST LEVER and documents the supervised-TV FBP-ceiling.", "advice_for_others": "tv_iterative_supervised-claude-agentic: val_n=214, val_chunk=5, train_n=160, epochs=8, batch_size=1, lr=0.005, tv_K=8, tv_step_init=1e-05, tv_lambda_init=0.001, tv_share_steps=True, tv_clip_max=0.05, tv_eps=1e-06, lambda_neg=1.0, loss_base=mse, grad_clip=1.0, rationale=tv_iterative_supervised iter-8 (search-20260619-01, corrected 214-slice/321px-FOV metric). BASE_ITER=7 (BEST SSIM 0.8192 / hr 0.0, the stable share=True step=1e-5 lr=5e-3 K=8 config). TRAJECTORY (SSIM/hr): iter-1 K=10 0.2855/0; iter-2 K=30 0.2855/0 (depth FALSIFIED at frozen-step, byte-identical); iter-3 step=1e-8 0.8137/0 (LD-FBP PASSTHROUGH); iter-4 step=1e-5 share=F 0.6949/0 (per-step RUNAWAY into clamp); iter-5 step=1e-5 share=T 0.6074/0 (per-step fixed but LAMBDA runaway); iter-6 lr 5e-2->5e-3 0.8185/0 (lambda runaway tamed -> recovered to FBP floor); iter-7 tv_K 30->8 0.8192/0 (depth-DOWN did NOT break out -> sits EXACTLY at the FBP passthrough floor). BEST SSIM 0.8192; hr=0.0 EVERY iter. MAPPED+FALSIFIED KNOBS: tv_step_init bracketed {1e-2 saturate, 1e-8 passthrough, 1e-5 active-basin}; tv_share_steps {F runaway, T stable}; tv_lr {5e-2 over-drives lambda, 5e-3 stable}; tv_K {10/30 inert at frozen-step, 8 flat at stable regime -- the itnet/hammernik_vn depth-DOWN breakout analog FAILED here}. HELD CONSTANT ALL 7 ITERS, NEVER PROBED: train_n=40, epochs=8, tv_lambda_init=1e-3, seed. LIMITER: iter-7 sits EXACTLY at the LD-FBP passthrough floor (0.8192 ~= 0.8137/0.8185 ~0.81); the trained 2-scalar global-TV (share=True) is a near-identity map on fbp_init. The unrolled-DEPTH lever is now exhausted. The campaign-state note flags train_n DATA-COVERAGE as the strongest GENUINELY-UNTRIED axis: this solver IS an amortized supervised trainer (load_val_split(split=train, n=train_n) at solver lines 74/188), and train_n=40 sees only ~7%% of the ~579-slice Wagner train pool. ONE KNOB CHANGED (from BASE_ITER=7): train_n 40 -> 160 (4x data coverage, ~28%% of the train pool). All else IDENTICAL to iter-7 (tv_share_steps=True, tv_step_init=1e-5, tv_lr=5e-3, tv_lambda_init=1e-3, tv_K=8, epochs=8, bs=1, tv_clip_max=0.05, tv_eps=1e-6, val_n=214 ALL L277, val_chunk=5, grad_clip=1.0). HYPOTHESIS: with 4x more anatomy in the supervised fit, the 2 shared scalars settle on a step/lambda balance generalizing across more tissue/noise, so the trained-stable TV could finally EXCEED its own LD-FBP passthrough (SSIM > 0.8192, hr > 0) -- this is the strongest untried lever and a clean falsifier, NOT a repeat. NUMERIC FALSIFIER (decisive): if SSIM stays <= 0.8192 with hr=0.0 at train_n=160, the data-coverage lever is EXHAUSTED too -- with only 2 trainable scalars CAPACITY (not data) is the binding constraint, and supervised-unrolled-TV is CONFIRMED FBP-BOUNDED on real Mayo 2304-view LDCT under the config-only contract (the shared solvers raw unnormalized-adjoint back_project step is FORBIDDEN to edit) -> the LAST unmapped lever is RETIRED -> file the NEGATIVE RESULT. BUDGET (HARD 20-min train+score = 1200s): iter-7 (K=8, train_n=40, epochs=8) ran in 260.7s. Fixed overhead (data load + 214-slice FBP precompute + val pass) ~= 150s; train phase at train_n=40 ~= 110s scales ~linearly -> train_n=160 (4x) ~= 440s train + ~150s overhead ~= 590s, >2x margin under the 1200s wall; K=8 keeps per-step cost low. PREDICTED iter-8: SSIM ~0.81-0.84, hr most-likely 0.0 (a single global-TV weight over a near-complete 2304-view inverse is a structurally weak image-domain prior regardless of data coverage); small chance hr 0.0-0.05 if more data lets the 2 scalars generalize past the passthrough. This iter is a GENUINELY-UNTRIED lever (train_n never probed); if it falsifies, it RETIRES THE LAST LEVER and documents the supervised-TV FBP-ceiling.", "comparison_image": "runs/mayo-ldct-claude-agentic-tv-iterative-supervised-search-20260619-01/iterations/iter-0008/comparison.png"}
{"ts": "2026-06-21T12:32:59Z", "run_id": "mayo-ldct-claude-agentic-r2gaussian-search-20260619-01", "iter": 8, "agent": "r2gaussian-claude-agentic", "model": "claude-opus-4-8-1m", "change_class": "architecture", "status": "discard", "kept": false, "val_score": 0.7695540189743042, "headroom": 0.0, "params_M": 0.003072, "train_n": 400, "rationale": "r2gaussian-claude-agentic: val_n=214, gs_n_gaussians=512, gs_n_iter=150, gs_lr_pos=0.005, gs_lr_scale=0.01, gs_lr_amp=0.01, gs_lr_rot=0.01, gs_amp_init=0.01, gs_scale_init=0.04, gs_tv_weight=0.0001, gs_n_clip=0.05, gs_render=raster, gs_init_from_fbp=True, gs_amp_init_max=0.05, gs_ssim_weight=0.25, gs_outer_wall_s=1080, rationale=iter-8 (search-20260619-01) \u2014 AUTHORIZED audit-fix (b) SSIM-weight continuation. ONE KNOB: gs_ssim_weight 0.15->0.25 (BASE_ITER=7 BEST: gs_init_from_fbp=True, gs_render=raster, gs_n_iter=150, 512 Gaussians, gs_amp_init_max=0.05 \u2014 the config that set run-best SSIM 0.7641). LIMITER: r2gaussian is REGIME-BOUNDED on dense 2304-view Mayo \u2014 LD-FBP (~0.808) is near-complete, the inverse is not ill-posed enough for a Gaussian-splat prior to add value, so hr>0 is implausible regardless. The live SSIM lever is the audit-fix (b) SSIM-weight pull toward FBP structure: trajectory is monotone-climbing \u2014 iter-1 0.7383 (cold/L2) -> iter-6 0.7519 (warm FBP-init + SSIM@0.10, +0.0136) -> iter-7 0.7641 (SSIM@0.15, +0.0122, run-best). HYPOTHESIS (falsifiable in NUMBERS): a stronger SSIM pull (0.15->0.25) nudges the ~26 completed scenes further AT/ABOVE their FBP init, so the 214-avg SSIM rises modestly above iter-7 0.7641 toward the 0.808 LD-FBP floor. PREDICTION: SSIM in (0.764, 0.81), hr 0 (regime-bounded \u2014 even matching FBP yields hr=0). NUMERIC FALSIFIER: if SSIM <= 0.7641 (no lift over iter-7 best), the SSIM-weight lever is SATURATED on dense Mayo \u2014 fix VALIDATED AS FAITHFUL-BUT-REGIME-BOUNDED (its real payoff is the 128-view SPARSE benchmarks). BUDGET: gs_init_from_fbp adds ~0 per-step cost (init only); the SSIM term is one cheap conv-SSIM per step vs the dominating 2304-view projection, so per-step stays ~0.282 s and coverage ~26/214 (same as iter-7, elapsed_s 1125.6 < 1800 SLURM wall). gs_outer_wall_s=1080 self-truncates before the 30-min kill, val figure excluded. val_n=214 per mandate; staged_canonical / v3 mayo_ldct_fitted geom / per-sample-ps (single-val-ps probe) / bg_target=truth / 321px-FOV-default / gs_render=raster all hard-wired. gs_render stays raster (the splat path is the DEFERRED (a) fix and raises NotImplementedError); gs_n_iter held at 150 (the under-budget gs_n_iter-up lever is DEFERRED post-TPE). TRAJECTORY: iter-6 0.7519 (SSIM@0.10) -> iter-7 0.7641 (SSIM@0.15, BEST) -> iter-8 = SSIM weight 0.15->0.25, the does-EVEN-MORE-SSIM-help saturation test of the authorized audit-fix (b).", "advice_for_others": "r2gaussian-claude-agentic: val_n=214, gs_n_gaussians=512, gs_n_iter=150, gs_lr_pos=0.005, gs_lr_scale=0.01, gs_lr_amp=0.01, gs_lr_rot=0.01, gs_amp_init=0.01, gs_scale_init=0.04, gs_tv_weight=0.0001, gs_n_clip=0.05, gs_render=raster, gs_init_from_fbp=True, gs_amp_init_max=0.05, gs_ssim_weight=0.25, gs_outer_wall_s=1080, rationale=iter-8 (search-20260619-01) \u2014 AUTHORIZED audit-fix (b) SSIM-weight continuation. ONE KNOB: gs_ssim_weight 0.15->0.25 (BASE_ITER=7 BEST: gs_init_from_fbp=True, gs_render=raster, gs_n_iter=150, 512 Gaussians, gs_amp_init_max=0.05 \u2014 the config that set run-best SSIM 0.7641). LIMITER: r2gaussian is REGIME-BOUNDED on dense 2304-view Mayo \u2014 LD-FBP (~0.808) is near-complete, the inverse is not ill-posed enough for a Gaussian-splat prior to add value, so hr>0 is implausible regardless. The live SSIM lever is the audit-fix (b) SSIM-weight pull toward FBP structure: trajectory is monotone-climbing \u2014 iter-1 0.7383 (cold/L2) -> iter-6 0.7519 (warm FBP-init + SSIM@0.10, +0.0136) -> iter-7 0.7641 (SSIM@0.15, +0.0122, run-best). HYPOTHESIS (falsifiable in NUMBERS): a stronger SSIM pull (0.15->0.25) nudges the ~26 completed scenes further AT/ABOVE their FBP init, so the 214-avg SSIM rises modestly above iter-7 0.7641 toward the 0.808 LD-FBP floor. PREDICTION: SSIM in (0.764, 0.81), hr 0 (regime-bounded \u2014 even matching FBP yields hr=0). NUMERIC FALSIFIER: if SSIM <= 0.7641 (no lift over iter-7 best), the SSIM-weight lever is SATURATED on dense Mayo \u2014 fix VALIDATED AS FAITHFUL-BUT-REGIME-BOUNDED (its real payoff is the 128-view SPARSE benchmarks). BUDGET: gs_init_from_fbp adds ~0 per-step cost (init only); the SSIM term is one cheap conv-SSIM per step vs the dominating 2304-view projection, so per-step stays ~0.282 s and coverage ~26/214 (same as iter-7, elapsed_s 1125.6 < 1800 SLURM wall). gs_outer_wall_s=1080 self-truncates before the 30-min kill, val figure excluded. val_n=214 per mandate; staged_canonical / v3 mayo_ldct_fitted geom / per-sample-ps (single-val-ps probe) / bg_target=truth / 321px-FOV-default / gs_render=raster all hard-wired. gs_render stays raster (the splat path is the DEFERRED (a) fix and raises NotImplementedError); gs_n_iter held at 150 (the under-budget gs_n_iter-up lever is DEFERRED post-TPE). TRAJECTORY: iter-6 0.7519 (SSIM@0.10) -> iter-7 0.7641 (SSIM@0.15, BEST) -> iter-8 = SSIM weight 0.15->0.25, the does-EVEN-MORE-SSIM-help saturation test of the authorized audit-fix (b).", "comparison_image": "runs/mayo-ldct-claude-agentic-r2gaussian-search-20260619-01/iterations/iter-0008/comparison.png"}
{"ts": "2026-06-21T12:32:38Z", "run_id": "mayo-ldct-claude-agentic-naf-search-20260619-01", "iter": 8, "agent": "naf-claude-agentic", "model": "claude-opus-4-8-1m", "change_class": "architecture", "status": "discard", "kept": false, "val_score": 0.6950908303260803, "headroom": 0.0, "params_M": 33.557601, "train_n": 400, "rationale": "naf-claude-agentic: val_n=214, naf_encoding=hash, naf_hash_levels=16, naf_hash_feat_dim=4, naf_hash_log2_size=19, naf_hash_base_res=16, naf_hash_max_res=512, naf_n_freqs=8, naf_hidden=32, naf_layers=3, naf_n_iter=3000, naf_lr=0.02, naf_tv_weight=0.0001, naf_n_clip=0.05, naf_outer_wall_s=1080, naf_per_scene_s=5.0, seed=42, rationale=ITER-8 (search-20260619-01, naf). SIX-BOX (NUMBERS, not CT pixels). (1) TRAJECTORY + mapped hash params (all hr=0): iter-1 fourier hidden=128 layers=4 lr=1e-2 -> SSIM 0.4729. iter-2 hidden 128->64 -> 0.4943 (+0.0215). iter-3 layers 4->3 -> 0.5452 (+0.0509). iter-4 lr 1e-2->2e-2 -> 0.5629 = BEST FOURIER. iter-5 lr 2e-2->4e-2 -> 0.3592 REGRESSED. iter-6 audit-fix (A) naf_encoding fourier->hash (Instant-NGP 16-level multi-res hash grid: levels=16 feat_dim=2 log2_size=19 base_res=16 max_res=512 -> 32-dim feature -> SMALL MLP hidden=32 layers=3 lr=2e-2) -> SSIM 0.6715 (PSNR 23.35, RMSE 0.003399, params 16.78M, elapsed 1101s) = NEW BEST, hr 0. iter-7 naf_hidden 32->64 (MLP width) -> SSIM 0.6346 (PSNR 22.90, elapsed 1099s) FLAT/REGRESSED = MLP-width axis EXHAUSTED. MAPPED hash params so far: only MLP-width (hidden 32<->64) probed; the actual HASH-TABLE-CAPACITY knobs (feat_dim=2, hash_levels=16, log2_size=19, base_res=16, max_res=512) are ALL UNTRIED. (2) LIMITER: NAF is REGIME-BOUNDED on DENSE 2304-view Mayo (LD-FBP near-complete -> hr stays 0; audit says the fix makes the impl FAITHFUL, real payoff is the 128-view SPARSE benchmarks). For SSIM within budget the binding limiter is HASH-FEATURE capacity: iter-6/7 showed the 32-dim concatenated hash feature decoded by the small MLP saturates at ~0.67 SSIM, and widening the MLP (iter-7) did NOT help -> the bottleneck is the hash FEATURE richness, not the decoder width. (3) ONE KNOB: naf_hash_feat_dim 2->4 (per-level features; from iter-6 BEST cfg: naf_encoding=hash, naf_hidden=32, naf_layers=3, naf_lr=2e-2, naf_hash_levels=16, naf_hash_log2_size=19, naf_hash_base_res=16, naf_hash_max_res=512 ALL UNCHANGED; step count / wall UNTOUCHED = the deferred B-fix). feat_dim 2->4 DOUBLES the concatenated hash feature 16x2=32-dim -> 16x4=64-dim, adding representational capacity at EVERY existing resolution level (denser features per cell) -- the most direct test of whether richer hash capacity (not MLP width, which is exhausted) lifts SSIM. Preferred over hash_levels (16->24, which adds finer resolutions less likely to bind on already-near-complete dense Mayo). (4) HYPOTHESIS: if naf_hash_feat_dim 2->4, SSIM rises above 0.6715 because a richer per-level hash feature gives the INR more capacity to represent the slice within the same per-scene step budget. NUMERIC FALSIFIER: if SSIM <= 0.6715, hash CAPACITY is EXHAUSTED in-budget on dense Mayo -- the hash-NAF ceiling here is ~0.67 SSIM (well below LD-FBP ~0.81 cal floor, hr 0), a STRUCTURAL NEGATIVE on dense 2304-view Mayo (regime-bounded; real payoff is the SPARSE benchmarks), document toward iter-20. (5) SIZE to HARD 1200s budget: 214-scene pass, naf_outer_wall_s=1080 (18-min in-solver outer wall = governor) + naf_per_scene_s=5.0 (in-solver per-scene wall; naf_n_iter=3000 stays a HIGH CAP so the WALL governs). STEP COUNT KEPT at iter-6 value (per_scene_s 5.0, n_iter cap 3000 UNCHANGED -- raising it is the DEFERRED B-fix; NOT touched). 214x5.0s=1070s ~= 1080s outer wall (measured elapsed 1099-1101s across the hash iters, inside the 30-min sbatch kill). feat_dim 2->4 doubles the input width to the small MLP (in 32->64) plus a slightly bigger per-level gather; per-step cost stays DOMINATED by the fixed 2304-view fan-beam forward+backward, so step count per 5.0s scene stays comparable -- ~free on the wall. val_n=214 (ALL L277 slices), staged_canonical v3 mayo_ldct_fitted geometry, per-sample-ps (inlined single-val-ps probe -> L277 native ps ~0.73979), bg_target=truth, 321px detector-geometry FOV default (no fov= override), naf_encoding=hash kept. (6) no control return; the loop dispatches the next iter.", "advice_for_others": "naf-claude-agentic: val_n=214, naf_encoding=hash, naf_hash_levels=16, naf_hash_feat_dim=4, naf_hash_log2_size=19, naf_hash_base_res=16, naf_hash_max_res=512, naf_n_freqs=8, naf_hidden=32, naf_layers=3, naf_n_iter=3000, naf_lr=0.02, naf_tv_weight=0.0001, naf_n_clip=0.05, naf_outer_wall_s=1080, naf_per_scene_s=5.0, seed=42, rationale=ITER-8 (search-20260619-01, naf). SIX-BOX (NUMBERS, not CT pixels). (1) TRAJECTORY + mapped hash params (all hr=0): iter-1 fourier hidden=128 layers=4 lr=1e-2 -> SSIM 0.4729. iter-2 hidden 128->64 -> 0.4943 (+0.0215). iter-3 layers 4->3 -> 0.5452 (+0.0509). iter-4 lr 1e-2->2e-2 -> 0.5629 = BEST FOURIER. iter-5 lr 2e-2->4e-2 -> 0.3592 REGRESSED. iter-6 audit-fix (A) naf_encoding fourier->hash (Instant-NGP 16-level multi-res hash grid: levels=16 feat_dim=2 log2_size=19 base_res=16 max_res=512 -> 32-dim feature -> SMALL MLP hidden=32 layers=3 lr=2e-2) -> SSIM 0.6715 (PSNR 23.35, RMSE 0.003399, params 16.78M, elapsed 1101s) = NEW BEST, hr 0. iter-7 naf_hidden 32->64 (MLP width) -> SSIM 0.6346 (PSNR 22.90, elapsed 1099s) FLAT/REGRESSED = MLP-width axis EXHAUSTED. MAPPED hash params so far: only MLP-width (hidden 32<->64) probed; the actual HASH-TABLE-CAPACITY knobs (feat_dim=2, hash_levels=16, log2_size=19, base_res=16, max_res=512) are ALL UNTRIED. (2) LIMITER: NAF is REGIME-BOUNDED on DENSE 2304-view Mayo (LD-FBP near-complete -> hr stays 0; audit says the fix makes the impl FAITHFUL, real payoff is the 128-view SPARSE benchmarks). For SSIM within budget the binding limiter is HASH-FEATURE capacity: iter-6/7 showed the 32-dim concatenated hash feature decoded by the small MLP saturates at ~0.67 SSIM, and widening the MLP (iter-7) did NOT help -> the bottleneck is the hash FEATURE richness, not the decoder width. (3) ONE KNOB: naf_hash_feat_dim 2->4 (per-level features; from iter-6 BEST cfg: naf_encoding=hash, naf_hidden=32, naf_layers=3, naf_lr=2e-2, naf_hash_levels=16, naf_hash_log2_size=19, naf_hash_base_res=16, naf_hash_max_res=512 ALL UNCHANGED; step count / wall UNTOUCHED = the deferred B-fix). feat_dim 2->4 DOUBLES the concatenated hash feature 16x2=32-dim -> 16x4=64-dim, adding representational capacity at EVERY existing resolution level (denser features per cell) -- the most direct test of whether richer hash capacity (not MLP width, which is exhausted) lifts SSIM. Preferred over hash_levels (16->24, which adds finer resolutions less likely to bind on already-near-complete dense Mayo). (4) HYPOTHESIS: if naf_hash_feat_dim 2->4, SSIM rises above 0.6715 because a richer per-level hash feature gives the INR more capacity to represent the slice within the same per-scene step budget. NUMERIC FALSIFIER: if SSIM <= 0.6715, hash CAPACITY is EXHAUSTED in-budget on dense Mayo -- the hash-NAF ceiling here is ~0.67 SSIM (well below LD-FBP ~0.81 cal floor, hr 0), a STRUCTURAL NEGATIVE on dense 2304-view Mayo (regime-bounded; real payoff is the SPARSE benchmarks), document toward iter-20. (5) SIZE to HARD 1200s budget: 214-scene pass, naf_outer_wall_s=1080 (18-min in-solver outer wall = governor) + naf_per_scene_s=5.0 (in-solver per-scene wall; naf_n_iter=3000 stays a HIGH CAP so the WALL governs). STEP COUNT KEPT at iter-6 value (per_scene_s 5.0, n_iter cap 3000 UNCHANGED -- raising it is the DEFERRED B-fix; NOT touched). 214x5.0s=1070s ~= 1080s outer wall (measured elapsed 1099-1101s across the hash iters, inside the 30-min sbatch kill). feat_dim 2->4 doubles the input width to the small MLP (in 32->64) plus a slightly bigger per-level gather; per-step cost stays DOMINATED by the fixed 2304-view fan-beam forward+backward, so step count per 5.0s scene stays comparable -- ~free on the wall. val_n=214 (ALL L277 slices), staged_canonical v3 mayo_ldct_fitted geometry, per-sample-ps (inlined single-val-ps probe -> L277 native ps ~0.73979), bg_target=truth, 321px detector-geometry FOV default (no fov= override), naf_encoding=hash kept. (6) no control return; the loop dispatches the next iter.", "comparison_image": "runs/mayo-ldct-claude-agentic-naf-search-20260619-01/iterations/iter-0008/comparison.png"}
