{"ts": "2026-06-20T05:14:01Z", "run_id": "mayo-ldct-claude-agentic-itnet-v2-search-20260619-01", "iter": 4, "agent": "itnet_v2-claude-agentic", "model": "claude-opus-4-8-1m", "change_class": "architecture", "status": "discard", "kept": false, "val_score": 0.7039393782615662, "headroom": 0.0, "params_M": 0.232882, "train_n": 400, "rationale": "itnet_v2-claude-agentic: itnet_k=3, unet_c=16, itnet_alpha_init=0.0037, residual_learning=False, pretrain_lr=0.0001, pretrain_epochs=240, pretrain_patience=240, batch_size=1, val_chunk=1, train_n=200, val_n=214, grad_clip=1.0, max_train_s=1150, seed=42, rationale=ITER-4 (search-20260619-01, corrected 214-slice/321px-FOV metric). CONFIRMATION iter. ONE KNOB: pretrain_epochs 144->240 (1.67x); pretrain_patience tracked 144->240 so early-stop never fires before the full run (same disable-early-stop intent as iter-1/2/3 where patience==epochs). All else identical to iter-3 (k=3, unet_c=16, alpha_init=0.0037, residual_learning=False, pretrain_lr=1e-4, batch_size=1, val_chunk=1, train_n=200, val_n=214, grad_clip=1.0, seed=42); only max_train_s 1100->1150 (19.2-min HARD backstop) to admit the longer pretrain inside the 20-min train+score budget while leaving the figure outside. SIX-BOX (NUMBERS): (1) TRAJECTORY: iter-1 SSIM 0.4554 / hr 0.000 @pretrain_epochs=12 in elapsed_s=170.2; iter-2 SSIM 0.5888 / hr 0.000 @ep48 in 345.2s; iter-3 SSIM 0.6230 / hr 0.000 @ep144 in 744.1s (val_psnr 24.51, val_rmse 0.002976). Epoch->SSIM gain is sharply DIMINISHING: 12->48 (4x) gave +0.133, 48->144 (3x) gave only +0.034. hr=0 throughout (LD-FBP floor ~0.81, far above; end-to-end v3 sibling reaches 0.91). (2) LIMITER (CONFIRMED, structural): the DC stage in solver_itnet_v2.py has NO trainable params -- pretrain_denoiser trains ONLY the SmallUNet on (fbp,truth) residual pairs, then ItNetV2 runs itnet.eval() with the k=3 DC operator FIXED (log_alpha never optimized). More pretraining only sharpens the denoiser; it cannot fix the un-trained DC coupling, so v2 caps far below end-to-end v3 (0.91). iter-3's +0.034 over 3x epochs is the asymptote signature. (3) ONE KNOB: pretrain_epochs 144->240 (1.67x) -- the largest epoch bump the 20-min budget admits, to CONFIRM the asymptote. Chosen over a DC-stage knob (itnet_k/itnet_alpha_init carry no trainable weight -- changing them shifts a fixed operator, near-zero diagnostic value) and over lr-up (v3 unstable above 1e-4; mirror the safe sibling move). With a pretrain-then-FIXED-DC architecture, pretrain_epochs is the ONLY learnable lever; pushing it as far as the budget allows is the cleanest confirmation of the pretrain-fixed-DC ceiling. (4) HYPOTHESIS + FALSIFIER: if pretrain_epochs 144->240, val_ssim lands ~0.63 (asymptoting, NOT the ~0.91 v3 band) with hr still 0.000, then itnet_v2's pretrain-then-FIXED-DC scheme is STRUCTURALLY CAPPED on Mayo regardless of epochs -- the un-trained DC operator, not under-training, is the limiter -- and the campaign documents v2 as a budget/architecture ceiling and prefers end-to-end v3. The +0.034/3x-epochs diminishing return predicts SSIM ~0.63-0.66 and hr 0. CONVERSELY (falsifier) if hr finally CLEARS 0 (val_ssim jumps past the 0.81 FBP floor), the cap was pretrain-epochs after all and iter-5 keeps climbing. (5) BUDGET: HARD 20-min train+score. Per-epoch slope from iter-2->iter-3 = (744.1-345.2)/(144-48) = 4.155 s/epoch; fixed (214-slice per-sample val + figure) = 345.2 - 48*4.155 = 145.8s. 240 ep -> 240*4.155 + 145.8 = 1143s, UNDER the 1200s (20-min) train+score budget and well within the 30-min sbatch wall. max_train_s=1150 is the HARD backstop so train always leaves room for the 214-slice per-sample val + figure inside the wall (if pretrain hits the clamp it stops gracefully and val still runs). val_n=214 KEPT (NOT reduced), grad_clip=1.0 KEPT. (6) Loop continues -- no control returned. HARD-WIRED (unchanged): staged_canonical data, v3 mayo_ldct_fitted geometry, per-sample-ps (each slice swaps itnet.projector to its own ps; batch_size=1 + val_chunk=1 FORCED), bg_target=truth, val=ALL 214 L277 slices under the 321px detector-geometry FOV (evaluate_calibrated default for AGENT4CT_DATASET=mayo_ldct_2d; NO fov= override). residual_learning=False KEPT (the CONFIG default True double-applies the residual and collapses eval to ~0.34).", "advice_for_others": "itnet_v2-claude-agentic: itnet_k=3, unet_c=16, itnet_alpha_init=0.0037, residual_learning=False, pretrain_lr=0.0001, pretrain_epochs=240, pretrain_patience=240, batch_size=1, val_chunk=1, train_n=200, val_n=214, grad_clip=1.0, max_train_s=1150, seed=42, rationale=ITER-4 (search-20260619-01, corrected 214-slice/321px-FOV metric). CONFIRMATION iter. ONE KNOB: pretrain_epochs 144->240 (1.67x); pretrain_patience tracked 144->240 so early-stop never fires before the full run (same disable-early-stop intent as iter-1/2/3 where patience==epochs). All else identical to iter-3 (k=3, unet_c=16, alpha_init=0.0037, residual_learning=False, pretrain_lr=1e-4, batch_size=1, val_chunk=1, train_n=200, val_n=214, grad_clip=1.0, seed=42); only max_train_s 1100->1150 (19.2-min HARD backstop) to admit the longer pretrain inside the 20-min train+score budget while leaving the figure outside. SIX-BOX (NUMBERS): (1) TRAJECTORY: iter-1 SSIM 0.4554 / hr 0.000 @pretrain_epochs=12 in elapsed_s=170.2; iter-2 SSIM 0.5888 / hr 0.000 @ep48 in 345.2s; iter-3 SSIM 0.6230 / hr 0.000 @ep144 in 744.1s (val_psnr 24.51, val_rmse 0.002976). Epoch->SSIM gain is sharply DIMINISHING: 12->48 (4x) gave +0.133, 48->144 (3x) gave only +0.034. hr=0 throughout (LD-FBP floor ~0.81, far above; end-to-end v3 sibling reaches 0.91). (2) LIMITER (CONFIRMED, structural): the DC stage in solver_itnet_v2.py has NO trainable params -- pretrain_denoiser trains ONLY the SmallUNet on (fbp,truth) residual pairs, then ItNetV2 runs itnet.eval() with the k=3 DC operator FIXED (log_alpha never optimized). More pretraining only sharpens the denoiser; it cannot fix the un-trained DC coupling, so v2 caps far below end-to-end v3 (0.91). iter-3's +0.034 over 3x epochs is the asymptote signature. (3) ONE KNOB: pretrain_epochs 144->240 (1.67x) -- the largest epoch bump the 20-min budget admits, to CONFIRM the asymptote. Chosen over a DC-stage knob (itnet_k/itnet_alpha_init carry no trainable weight -- changing them shifts a fixed operator, near-zero diagnostic value) and over lr-up (v3 unstable above 1e-4; mirror the safe sibling move). With a pretrain-then-FIXED-DC architecture, pretrain_epochs is the ONLY learnable lever; pushing it as far as the budget allows is the cleanest confirmation of the pretrain-fixed-DC ceiling. (4) HYPOTHESIS + FALSIFIER: if pretrain_epochs 144->240, val_ssim lands ~0.63 (asymptoting, NOT the ~0.91 v3 band) with hr still 0.000, then itnet_v2's pretrain-then-FIXED-DC scheme is STRUCTURALLY CAPPED on Mayo regardless of epochs -- the un-trained DC operator, not under-training, is the limiter -- and the campaign documents v2 as a budget/architecture ceiling and prefers end-to-end v3. The +0.034/3x-epochs diminishing return predicts SSIM ~0.63-0.66 and hr 0. CONVERSELY (falsifier) if hr finally CLEARS 0 (val_ssim jumps past the 0.81 FBP floor), the cap was pretrain-epochs after all and iter-5 keeps climbing. (5) BUDGET: HARD 20-min train+score. Per-epoch slope from iter-2->iter-3 = (744.1-345.2)/(144-48) = 4.155 s/epoch; fixed (214-slice per-sample val + figure) = 345.2 - 48*4.155 = 145.8s. 240 ep -> 240*4.155 + 145.8 = 1143s, UNDER the 1200s (20-min) train+score budget and well within the 30-min sbatch wall. max_train_s=1150 is the HARD backstop so train always leaves room for the 214-slice per-sample val + figure inside the wall (if pretrain hits the clamp it stops gracefully and val still runs). val_n=214 KEPT (NOT reduced), grad_clip=1.0 KEPT. (6) Loop continues -- no control returned. HARD-WIRED (unchanged): staged_canonical data, v3 mayo_ldct_fitted geometry, per-sample-ps (each slice swaps itnet.projector to its own ps; batch_size=1 + val_chunk=1 FORCED), bg_target=truth, val=ALL 214 L277 slices under the 321px detector-geometry FOV (evaluate_calibrated default for AGENT4CT_DATASET=mayo_ldct_2d; NO fov= override). residual_learning=False KEPT (the CONFIG default True double-applies the residual and collapses eval to ~0.34).", "comparison_image": "runs/mayo-ldct-claude-agentic-itnet-v2-search-20260619-01/iterations/iter-0004/comparison.png"}
{"ts": "2026-06-20T05:02:00Z", "run_id": "mayo-ldct-claude-agentic-itnet-search-20260619-01", "iter": 4, "agent": "itnet-claude-agentic", "model": "claude-opus-4-8-1m", "change_class": "architecture", "status": "discard", "kept": false, "val_score": 0.7021881937980652, "headroom": 0.0, "params_M": 0.232881, "train_n": 400, "rationale": "itnet-claude-agentic: pretrain_epochs=220, pretrain_lr=0.0001, itnet_k=3, itnet_alpha=0.005, unet_c=16, finetune_epochs=0, finetune_lr=0.0001, train_n=200, val_n=214, grad_clip=1.0, seed=42, rationale=ITER-4 (search-20260619-01, corrected 214-slice/321px-FOV metric) for itnet = ItNet v1 (pretrain-denoiser-then-FIXED-DC, solver_itnet.py). This is a CONFIRMATION iter -- the solver is well-characterized; the goal is to confirm the asymptote of the only trainable lever, not to find a breakthrough. SIX-BOX (NUMBERS, not CT pixels). (1) PRIOR RESULTS (val=ALL 214 L277 slices, 321px detector-geometry FOV): iter-1 ep8 -> SSIM 0.4413 / hr 0.000, elapsed 191.1s; iter-2 ep48 -> SSIM 0.5927 / hr 0.000, elapsed 387.4s; iter-3 ep160 -> SSIM 0.6430 / hr 0.000, PSNR 24.67, RMSE 0.002922, elapsed 858.9s, params_M 0.2329. The pretrain_epochs lever is in clear diminishing returns: SSIM deltas are +0.151 (8->48), then +0.050 (48->160); hr has stayed PINNED at 0.000 across ALL three iters -- v1 remains BELOW the ~0.81 LD-FBP floor (and far below the END-TO-END sibling itnet_v3's ~0.91 / hr ~0.31). v1 (0.44->0.59->0.64) and its lever-twin itnet_v2 (0.59->0.62) trace the SAME under-0.81 curve; v3 is on a different curve entirely. (2) LIMITER = the pretrain-then-FIXED-DC CEILING (structural, confirmed by reading solver_itnet.py): finetune_itnet() is DEFINED (lines 114-135) but NEVER called in main(); the k=3 ItNet DC unroll (forward, lines 76-90) has ZERO trainable params (self.alpha is a plain float, self.projector is fixed analytic PYRO-NN); itnet.eval()+torch.no_grad() (lines 208-209) run the unroll as pure INFERENCE. The ONLY trainable component is the standalone SmallUNet denoiser (params_M=0.2329), pretrained as an FBP->truth denoiser that NEVER sees the DC steps. pretrain_epochs is the sole lever and the fixed untrained DC post-processor caps v1 far below v3. (3) ONE KNOB: pretrain_epochs 160 -> 220 (1.375x). All else identical to iter-3 (k=3, itnet_alpha=0.005, unet_c=16, pretrain_lr=1e-4, train_n=200, val_n=214, grad_clip=1.0, seed=42). (4) HYPOTHESIS + FALSIFIER: a final confirmation push of the only trainable component to nail the asymptote. HYPOTHESIS: SSIM lands ~0.65 (asymptoting -- the diminishing +0.151 -> +0.050 slope predicts roughly +0.01-class for 160->220), hr STAYS 0.000. FALSIFIER (the operative one): if hr is STILL 0.000 (SSIM ~0.65, well below the ~0.81 LD-FBP floor and far below v3's 0.91), the pretrain-then-FIXED-DC architecture is STRUCTURALLY capped -- NOT under-trained -- and the campaign should FILE THE STRUCTURAL VERDICT for itnet v1 (epochs lever exhausted; future Mayo recon goes to the end-to-end itnet_v3, ~0.91) rather than spend more iters on v1's epochs. The counter-hypothesis (v1 suddenly clears 0.81 at 220 ep) is implausible given the measured +0.151 -> +0.050 slope. (5) BUDGET (HARD 20-min = 1200s train+score): from the two latest measured points the per-epoch pretrain cost is (858.9-387.4)/(160-48) = 4.21 s/epoch and the fixed cost (data load + 214-slice per-sample val + figure + startup) is 858.9 - 160*4.21 = 185.3 s (this exactly reproduces iter-3: 185.3 + 160*4.21 = 858.9). pretrain_epochs=220 predicts 185.3 + 220*4.21 = 1111 s = 18.5 min, inside the 1200s budget with ~1.5 min margin; ep240 would predict 1196s (too tight), so 220 is the largest safe confirmation push. The sbatch wall is 30 min, so the 18.5-min prediction leaves ample fence headroom. val stays ALL 214 L277 slices, 321px detector-geometry FOV (default; NO fov= override). grad_clip=1.0 retained (mandatory: the 2304-view Mayo FBP adjoint inside the DC step overflows otherwise). v1 has NO max_train_s backstop, so the 30-min sbatch wall is the only hard fence. (6) Loop continues -- no control returned. HARD-WIRED (unchanged): staged_canonical data, v3 mayo_ldct_fitted geometry, per-sample-ps (each val slice swaps itnet.projector to its own ps; chunk=1 FORCED), bg_target=truth, val=ALL 214 L277 slices under the 321px detector-geometry FOV (evaluate_calibrated default for AGENT4CT_DATASET=mayo_ldct_2d; NO fov= override).", "advice_for_others": "itnet-claude-agentic: pretrain_epochs=220, pretrain_lr=0.0001, itnet_k=3, itnet_alpha=0.005, unet_c=16, finetune_epochs=0, finetune_lr=0.0001, train_n=200, val_n=214, grad_clip=1.0, seed=42, rationale=ITER-4 (search-20260619-01, corrected 214-slice/321px-FOV metric) for itnet = ItNet v1 (pretrain-denoiser-then-FIXED-DC, solver_itnet.py). This is a CONFIRMATION iter -- the solver is well-characterized; the goal is to confirm the asymptote of the only trainable lever, not to find a breakthrough. SIX-BOX (NUMBERS, not CT pixels). (1) PRIOR RESULTS (val=ALL 214 L277 slices, 321px detector-geometry FOV): iter-1 ep8 -> SSIM 0.4413 / hr 0.000, elapsed 191.1s; iter-2 ep48 -> SSIM 0.5927 / hr 0.000, elapsed 387.4s; iter-3 ep160 -> SSIM 0.6430 / hr 0.000, PSNR 24.67, RMSE 0.002922, elapsed 858.9s, params_M 0.2329. The pretrain_epochs lever is in clear diminishing returns: SSIM deltas are +0.151 (8->48), then +0.050 (48->160); hr has stayed PINNED at 0.000 across ALL three iters -- v1 remains BELOW the ~0.81 LD-FBP floor (and far below the END-TO-END sibling itnet_v3's ~0.91 / hr ~0.31). v1 (0.44->0.59->0.64) and its lever-twin itnet_v2 (0.59->0.62) trace the SAME under-0.81 curve; v3 is on a different curve entirely. (2) LIMITER = the pretrain-then-FIXED-DC CEILING (structural, confirmed by reading solver_itnet.py): finetune_itnet() is DEFINED (lines 114-135) but NEVER called in main(); the k=3 ItNet DC unroll (forward, lines 76-90) has ZERO trainable params (self.alpha is a plain float, self.projector is fixed analytic PYRO-NN); itnet.eval()+torch.no_grad() (lines 208-209) run the unroll as pure INFERENCE. The ONLY trainable component is the standalone SmallUNet denoiser (params_M=0.2329), pretrained as an FBP->truth denoiser that NEVER sees the DC steps. pretrain_epochs is the sole lever and the fixed untrained DC post-processor caps v1 far below v3. (3) ONE KNOB: pretrain_epochs 160 -> 220 (1.375x). All else identical to iter-3 (k=3, itnet_alpha=0.005, unet_c=16, pretrain_lr=1e-4, train_n=200, val_n=214, grad_clip=1.0, seed=42). (4) HYPOTHESIS + FALSIFIER: a final confirmation push of the only trainable component to nail the asymptote. HYPOTHESIS: SSIM lands ~0.65 (asymptoting -- the diminishing +0.151 -> +0.050 slope predicts roughly +0.01-class for 160->220), hr STAYS 0.000. FALSIFIER (the operative one): if hr is STILL 0.000 (SSIM ~0.65, well below the ~0.81 LD-FBP floor and far below v3's 0.91), the pretrain-then-FIXED-DC architecture is STRUCTURALLY capped -- NOT under-trained -- and the campaign should FILE THE STRUCTURAL VERDICT for itnet v1 (epochs lever exhausted; future Mayo recon goes to the end-to-end itnet_v3, ~0.91) rather than spend more iters on v1's epochs. The counter-hypothesis (v1 suddenly clears 0.81 at 220 ep) is implausible given the measured +0.151 -> +0.050 slope. (5) BUDGET (HARD 20-min = 1200s train+score): from the two latest measured points the per-epoch pretrain cost is (858.9-387.4)/(160-48) = 4.21 s/epoch and the fixed cost (data load + 214-slice per-sample val + figure + startup) is 858.9 - 160*4.21 = 185.3 s (this exactly reproduces iter-3: 185.3 + 160*4.21 = 858.9). pretrain_epochs=220 predicts 185.3 + 220*4.21 = 1111 s = 18.5 min, inside the 1200s budget with ~1.5 min margin; ep240 would predict 1196s (too tight), so 220 is the largest safe confirmation push. The sbatch wall is 30 min, so the 18.5-min prediction leaves ample fence headroom. val stays ALL 214 L277 slices, 321px detector-geometry FOV (default; NO fov= override). grad_clip=1.0 retained (mandatory: the 2304-view Mayo FBP adjoint inside the DC step overflows otherwise). v1 has NO max_train_s backstop, so the 30-min sbatch wall is the only hard fence. (6) Loop continues -- no control returned. HARD-WIRED (unchanged): staged_canonical data, v3 mayo_ldct_fitted geometry, per-sample-ps (each val slice swaps itnet.projector to its own ps; chunk=1 FORCED), bg_target=truth, val=ALL 214 L277 slices under the 321px detector-geometry FOV (evaluate_calibrated default for AGENT4CT_DATASET=mayo_ldct_2d; NO fov= override).", "comparison_image": "runs/mayo-ldct-claude-agentic-itnet-search-20260619-01/iterations/iter-0004/comparison.png"}
