{"ts": "2026-06-20T07:42:05Z", "run_id": "mayo-ldct-claude-agentic-hammernik-vn-search-20260619-01", "iter": 5, "agent": "hammernik_vn-claude-agentic", "model": "claude-opus-4-8-1m", "change_class": "architecture", "status": "discard", "kept": false, "val_score": 0.8088628649711609, "headroom": 0.0, "params_M": 0.012165, "train_n": 400, "rationale": "hammernik_vn-claude-agentic: vn_T=5, vn_n_filters=16, vn_kernel=11, vn_n_bumps=31, vn_x_range=1.0, vn_lambda_init=0.0023, vn_init=fbp, vn_dc_norm=True, vn_checkpoint=True, vn_normalize_filters=False, epochs=6, batch_size=2, lr=0.0005, grad_clip=1.0, train_n=480, val_n=214, max_train_s=1000, seed=42, rationale=hammernik_vn iter-5 (search-20260619-01, corrected 214-slice/321px-FOV metric). ONE KNOB (DATA-COVERAGE lever): train_n 200 -> 480 (~35% -> ~83% of the 579-slice train pool). BASE = iter-1 BEST config (vn_n_filters=16, vn_lambda_init=0.0023, vn_normalize_filters=False; NOT the regressed iter-2/3/4). TRAJECTORY (NUMBERS, all hr=0, ALL BELOW the ~0.84 LD-FBP floor, baseline_PSNR 34.08): iter-1 SSIM 0.80528 PSNR 32.40 RMSE 1.199e-3 (N_k=16, lam=0.0023, elapsed 1295.7s) <- BEST; iter-2 SSIM 0.79195 (N_k 16->24 capacity UP -> REGRESSED -0.0133, 1351.7s); iter-3 SSIM 0.768197 PSNR 32.07 (vn_lambda_init 0.0023->0.05 DC UP -> REGRESSED -0.0238, 1159.6s); iter-4 SSIM 0.73363 PSNR 23.80 RMSE 3.228e-3 (vn_normalize_filters F->T -> REGRESSED -0.0346, 1339.8s). LIMITER / FAILURE MODE: every STRUCTURAL knob tried (capacity^, DC-weight^, filter-constraint) made it WORSE; loss flat by ep3 so it is NOT under-training; the learned VN regulariser term Sum_i K_i^T rho'_i(K_i u) collapses to a BLUNT SMOOTHER that drags the recon monotonically below its own FBP init. iter-4's terminal falsifier ('SSIM<=0.84 with the regulariser constrained -> structurally FBP-bounded') FIRED. BUT one axis is UNTESTED and shared by ALL 4 iters: every iter trained on the SAME 200/579 (35%) stratified subset. MECHANISM CONFIRMED (this turn): hammernik_vn build_dataset calls load_val_split(split='train', n=train_n) = a FIXED stratified subset chosen ONCE (round-robin across ps-groups, sel=sorted(picks)), then the train loop reshuffles ONLY that subset via torch.randperm(train_n) per epoch -- it does NOT use RotatingSubsetDataset. So train_n=200 = the net only ever sees 35% of the 579-slice train pool -> train_n IS a LIVE data-coverage lever (same mechanism as uswin train_n 200->480 hr 0.3532->0.3829 and itnet_v3 200->400 hr 0.3123->0.3288). This is the strongest untried axis AND the cleanest single-knob test of whether the regulariser degradation is data-coverage-starved (200 slices too few for the 16-filter bank to learn an edge-preserving rather than smoothing regulariser) vs a true structural ceiling. HYPOTHESIS: if the degradation is data-starved, train_n 200->480 lifts val_ssim above the iter-1 0.80528 and toward/over the ~0.84 FBP floor (hr>0). FALSIFIER (terminal): if val_ssim stays <=0.81 (still <FBP, hr=0) even at 2.4x the training data, hammernik_vn is CONFIRMED structurally FBP-bounded on rebinned 2304-view Mayo LDCT with the data-coverage lever EXHAUSTED -> file the negative result and drive remaining iters to document the ceiling. GRAD-STEP PARITY (isolate DATA COVERAGE from extra optimization): iter-1 was max_train_s=1000-bound and ran ~7 epochs at 200 slices = ~1400 grad-slices. At train_n=480, max_train_s=1000 (kept) caps ~2.9 epochs (480x2.9 ~= 1392 grad-slices) -> near-identical optimization budget, so the comparison isolates COVERAGE not extra steps. BUDGET (HARD 20-min train+score; sbatch --time=00:30:00): iter-1 trained ~7 ep / 1000s at 200 slices => ~143 s/ep => ~0.715 s/slice/ep; at 480 slices ~343 s/ep, so max_train_s=1000 trips at ~2.9 ep (epochs=6 is just an upper bound the wall trips first). Total ~= 1000 (train wall) + ~160 (score 214 + figure) ~= 1160s, under the 1800s SLURM kill, ~640s margin. MEMORY-SAFE: identical per-step footprint to iter-1 (batch_size=2 + vn_checkpoint=true keep N_k=16 within the 16 GB RTX5000; cf. hammernik_2017 bs=4 OOM at 72s). grad_clip=1.0 retained (VN-family NaN-skip stability; the 2304-view Mayo FBP adjoint overflows the backward otherwise).", "advice_for_others": "hammernik_vn-claude-agentic: vn_T=5, vn_n_filters=16, vn_kernel=11, vn_n_bumps=31, vn_x_range=1.0, vn_lambda_init=0.0023, vn_init=fbp, vn_dc_norm=True, vn_checkpoint=True, vn_normalize_filters=False, epochs=6, batch_size=2, lr=0.0005, grad_clip=1.0, train_n=480, val_n=214, max_train_s=1000, seed=42, rationale=hammernik_vn iter-5 (search-20260619-01, corrected 214-slice/321px-FOV metric). ONE KNOB (DATA-COVERAGE lever): train_n 200 -> 480 (~35% -> ~83% of the 579-slice train pool). BASE = iter-1 BEST config (vn_n_filters=16, vn_lambda_init=0.0023, vn_normalize_filters=False; NOT the regressed iter-2/3/4). TRAJECTORY (NUMBERS, all hr=0, ALL BELOW the ~0.84 LD-FBP floor, baseline_PSNR 34.08): iter-1 SSIM 0.80528 PSNR 32.40 RMSE 1.199e-3 (N_k=16, lam=0.0023, elapsed 1295.7s) <- BEST; iter-2 SSIM 0.79195 (N_k 16->24 capacity UP -> REGRESSED -0.0133, 1351.7s); iter-3 SSIM 0.768197 PSNR 32.07 (vn_lambda_init 0.0023->0.05 DC UP -> REGRESSED -0.0238, 1159.6s); iter-4 SSIM 0.73363 PSNR 23.80 RMSE 3.228e-3 (vn_normalize_filters F->T -> REGRESSED -0.0346, 1339.8s). LIMITER / FAILURE MODE: every STRUCTURAL knob tried (capacity^, DC-weight^, filter-constraint) made it WORSE; loss flat by ep3 so it is NOT under-training; the learned VN regulariser term Sum_i K_i^T rho'_i(K_i u) collapses to a BLUNT SMOOTHER that drags the recon monotonically below its own FBP init. iter-4's terminal falsifier ('SSIM<=0.84 with the regulariser constrained -> structurally FBP-bounded') FIRED. BUT one axis is UNTESTED and shared by ALL 4 iters: every iter trained on the SAME 200/579 (35%) stratified subset. MECHANISM CONFIRMED (this turn): hammernik_vn build_dataset calls load_val_split(split='train', n=train_n) = a FIXED stratified subset chosen ONCE (round-robin across ps-groups, sel=sorted(picks)), then the train loop reshuffles ONLY that subset via torch.randperm(train_n) per epoch -- it does NOT use RotatingSubsetDataset. So train_n=200 = the net only ever sees 35% of the 579-slice train pool -> train_n IS a LIVE data-coverage lever (same mechanism as uswin train_n 200->480 hr 0.3532->0.3829 and itnet_v3 200->400 hr 0.3123->0.3288). This is the strongest untried axis AND the cleanest single-knob test of whether the regulariser degradation is data-coverage-starved (200 slices too few for the 16-filter bank to learn an edge-preserving rather than smoothing regulariser) vs a true structural ceiling. HYPOTHESIS: if the degradation is data-starved, train_n 200->480 lifts val_ssim above the iter-1 0.80528 and toward/over the ~0.84 FBP floor (hr>0). FALSIFIER (terminal): if val_ssim stays <=0.81 (still <FBP, hr=0) even at 2.4x the training data, hammernik_vn is CONFIRMED structurally FBP-bounded on rebinned 2304-view Mayo LDCT with the data-coverage lever EXHAUSTED -> file the negative result and drive remaining iters to document the ceiling. GRAD-STEP PARITY (isolate DATA COVERAGE from extra optimization): iter-1 was max_train_s=1000-bound and ran ~7 epochs at 200 slices = ~1400 grad-slices. At train_n=480, max_train_s=1000 (kept) caps ~2.9 epochs (480x2.9 ~= 1392 grad-slices) -> near-identical optimization budget, so the comparison isolates COVERAGE not extra steps. BUDGET (HARD 20-min train+score; sbatch --time=00:30:00): iter-1 trained ~7 ep / 1000s at 200 slices => ~143 s/ep => ~0.715 s/slice/ep; at 480 slices ~343 s/ep, so max_train_s=1000 trips at ~2.9 ep (epochs=6 is just an upper bound the wall trips first). Total ~= 1000 (train wall) + ~160 (score 214 + figure) ~= 1160s, under the 1800s SLURM kill, ~640s margin. MEMORY-SAFE: identical per-step footprint to iter-1 (batch_size=2 + vn_checkpoint=true keep N_k=16 within the 16 GB RTX5000; cf. hammernik_2017 bs=4 OOM at 72s). grad_clip=1.0 retained (VN-family NaN-skip stability; the 2304-view Mayo FBP adjoint overflows the backward otherwise).", "comparison_image": "runs/mayo-ldct-claude-agentic-hammernik-vn-search-20260619-01/iterations/iter-0005/comparison.png"}
{"ts": "2026-06-20T07:31:00Z", "run_id": "mayo-ldct-claude-agentic-wu-2015-trainable-search-20260619-01", "iter": 5, "agent": "wu_2015_trainable-claude-agentic", "model": "claude-opus-4-8-1m", "change_class": "architecture", "status": "keep", "kept": true, "val_score": 0.8384009599685669, "headroom": 0.04107818165741162, "params_M": 8e-06, "train_n": 400, "rationale": "wu_2015_trainable-claude-agentic: wu_n_bands=4, wu_n_outer=1, lr=0.01, epochs=3, batch_size=1, val_chunk=1, train_n=480, val_n=214, grad_clip=1.0, lambda_neg=1.0, weight_decay=0.0, loss_base=mse, seed=42, rationale=wu_2015_trainable iter-5 (search-20260619-01, corrected 214-slice/321px-FOV metric). DATA-COVERAGE LEVER. SIX-BOX (NUMBERS). (1) PRIOR: BEST = iter-1 SSIM 0.8370 / hr 0.0508 / PSNR 34.53 / RMSE 9.39e-4 / 335s / 8 params (wu_n_bands=4, wu_n_outer=1, ep6, lr0.01, train_n=200). Trajectory iter->hr: 1->0.0508(BEST), 2(ep18)->0.0337, 3(n_bands6)->0.0, 4(n_outer2)->0.0 (SSIM collapsed to 0.6459, 536.8s). Base copied = iter-1 (highest hr). (2) LIMITER/failure mode: every per-iter capacity/epoch knob is FALSIFIED -- epochs INERT (iter-2 ep6==ep18, 0.837 vs 0.839 within noise, hr FELL), frequency bands REGRESSED (iter-3 n_bands 4->6 dropped to 0.827/hr0), outer residual depth COLLAPSED (iter-4 n_outer 1->2 dropped to 0.646/hr0). The net only ever saw train_n=200 = 35% of the 579-slice train pool (3 ps-groups: 154@0.66192 / 98@0.73979 / 327@0.77873). The UNTRIED axis is DATA COVERAGE -- campaign_state CONFIRMED (2026-06-20) this is the strongest lever for the end-to-end trainers (uswin train_n 200->480 hr 0.3532->0.3829 NEW champion; itnet_v3 200->400 hr 0.3123->0.3288). (3) ONE KNOB: train_n 200 -> 480 (35% -> 83% train-pool coverage). I REVERT to the iter-1 BEST config (wu_n_bands=4, wu_n_outer=1, lr0.01) -- NOT the regressed iter-3/4 -- and change ONLY train_n, mirroring the confirmed uswin/itnet_v3 recipe (revert-to-best, then raise coverage). MECHANISM VERIFIED for THIS solver: build_dataset() (solver line 241) calls load_val_split(kind, \"train\", cfg[train_n], ...) which loads a FIXED stratified subset ONCE; the train loop reshuffles that SAME fixed array each epoch via torch.randperm(train_noisy.shape[0]) (line 316). It does NOT use RotatingSubsetDataset, so train_n IS load-bearing data coverage, not inert. (4) HYPOTHESIS: if wu_2015_trainable hr-0.05 ceiling is data-coverage-limited (only 35% of the train pool seen), raising train_n 200->480 lifts hr measurably above the iter-1 best 0.0508 (SSIM > 0.842, >+0.005 over the +-0.001 noise band). NUMERIC FALSIFIER (terminal): if hr <= 0.051 (at/below iter-1 best) at train_n=480, the ceiling is the FBP-family architecture itself (band-reweighted FBP + soft-thresholded residual, NO image-domain learned CNN denoiser), not data coverage -- file the terminal verdict (epochs, bands, outer-depth AND data all exhausted; caps hr~0.05 on real-helical Mayo, far below dual-domain U-Net families hr~0.27). (5) BUDGET (HARD 1200s/20-min train+score): iter-1 335s at train_n=200/ep6/n_outer=1 = 1200 train-slice-passes + a fixed 214-slice val pass. To hold the wall AND keep grad-step parity (train_n x epochs ~ 200x6=1200), I trade epochs 6->3: 480x3=1440 train-slice-passes (+20% vs iter-1). Worst-case linear scaling ~335x1.2 ~= 400s train+score, well under 1200s and the 1800s SLURM kill; val FIGURE outside budget. ep3 is safe AND a non-regression on the optimization axis because iter-2 PROVED epochs inert (ep6==ep18) -- this isolates train_n as the SOLE meaningful change. n_outer held at 1 (MANDATORY hint; also keeps the dominant 2x-dense residual pass single). Note line-98 comment (train_n=2000 band_scale runaway to 53x) was a BREAST-dataset, PRE-CLAMP regime; the band_scale 0.1-3.0 hard clamps now in place prevent that runaway, and 480 is a modest raise. val = ALL 214 L277 slices (do NOT reduce); grad_clip=1.0 (MANDATORY Mayo guard -- the 2304-view FBP adjoint overflows otherwise); bs=1 + val_chunk=1 forced by per-sample-ps; staged_canonical v3 mayo_ldct_fitted; per-sample-ps FBP + per-sample model.proj/model.dense_proj swap; bg_target=truth; 321px detector-geometry FOV default (NO fov override). (6) no control return.", "advice_for_others": "wu_2015_trainable-claude-agentic: wu_n_bands=4, wu_n_outer=1, lr=0.01, epochs=3, batch_size=1, val_chunk=1, train_n=480, val_n=214, grad_clip=1.0, lambda_neg=1.0, weight_decay=0.0, loss_base=mse, seed=42, rationale=wu_2015_trainable iter-5 (search-20260619-01, corrected 214-slice/321px-FOV metric). DATA-COVERAGE LEVER. SIX-BOX (NUMBERS). (1) PRIOR: BEST = iter-1 SSIM 0.8370 / hr 0.0508 / PSNR 34.53 / RMSE 9.39e-4 / 335s / 8 params (wu_n_bands=4, wu_n_outer=1, ep6, lr0.01, train_n=200). Trajectory iter->hr: 1->0.0508(BEST), 2(ep18)->0.0337, 3(n_bands6)->0.0, 4(n_outer2)->0.0 (SSIM collapsed to 0.6459, 536.8s). Base copied = iter-1 (highest hr). (2) LIMITER/failure mode: every per-iter capacity/epoch knob is FALSIFIED -- epochs INERT (iter-2 ep6==ep18, 0.837 vs 0.839 within noise, hr FELL), frequency bands REGRESSED (iter-3 n_bands 4->6 dropped to 0.827/hr0), outer residual depth COLLAPSED (iter-4 n_outer 1->2 dropped to 0.646/hr0). The net only ever saw train_n=200 = 35% of the 579-slice train pool (3 ps-groups: 154@0.66192 / 98@0.73979 / 327@0.77873). The UNTRIED axis is DATA COVERAGE -- campaign_state CONFIRMED (2026-06-20) this is the strongest lever for the end-to-end trainers (uswin train_n 200->480 hr 0.3532->0.3829 NEW champion; itnet_v3 200->400 hr 0.3123->0.3288). (3) ONE KNOB: train_n 200 -> 480 (35% -> 83% train-pool coverage). I REVERT to the iter-1 BEST config (wu_n_bands=4, wu_n_outer=1, lr0.01) -- NOT the regressed iter-3/4 -- and change ONLY train_n, mirroring the confirmed uswin/itnet_v3 recipe (revert-to-best, then raise coverage). MECHANISM VERIFIED for THIS solver: build_dataset() (solver line 241) calls load_val_split(kind, \"train\", cfg[train_n], ...) which loads a FIXED stratified subset ONCE; the train loop reshuffles that SAME fixed array each epoch via torch.randperm(train_noisy.shape[0]) (line 316). It does NOT use RotatingSubsetDataset, so train_n IS load-bearing data coverage, not inert. (4) HYPOTHESIS: if wu_2015_trainable hr-0.05 ceiling is data-coverage-limited (only 35% of the train pool seen), raising train_n 200->480 lifts hr measurably above the iter-1 best 0.0508 (SSIM > 0.842, >+0.005 over the +-0.001 noise band). NUMERIC FALSIFIER (terminal): if hr <= 0.051 (at/below iter-1 best) at train_n=480, the ceiling is the FBP-family architecture itself (band-reweighted FBP + soft-thresholded residual, NO image-domain learned CNN denoiser), not data coverage -- file the terminal verdict (epochs, bands, outer-depth AND data all exhausted; caps hr~0.05 on real-helical Mayo, far below dual-domain U-Net families hr~0.27). (5) BUDGET (HARD 1200s/20-min train+score): iter-1 335s at train_n=200/ep6/n_outer=1 = 1200 train-slice-passes + a fixed 214-slice val pass. To hold the wall AND keep grad-step parity (train_n x epochs ~ 200x6=1200), I trade epochs 6->3: 480x3=1440 train-slice-passes (+20% vs iter-1). Worst-case linear scaling ~335x1.2 ~= 400s train+score, well under 1200s and the 1800s SLURM kill; val FIGURE outside budget. ep3 is safe AND a non-regression on the optimization axis because iter-2 PROVED epochs inert (ep6==ep18) -- this isolates train_n as the SOLE meaningful change. n_outer held at 1 (MANDATORY hint; also keeps the dominant 2x-dense residual pass single). Note line-98 comment (train_n=2000 band_scale runaway to 53x) was a BREAST-dataset, PRE-CLAMP regime; the band_scale 0.1-3.0 hard clamps now in place prevent that runaway, and 480 is a modest raise. val = ALL 214 L277 slices (do NOT reduce); grad_clip=1.0 (MANDATORY Mayo guard -- the 2304-view FBP adjoint overflows otherwise); bs=1 + val_chunk=1 forced by per-sample-ps; staged_canonical v3 mayo_ldct_fitted; per-sample-ps FBP + per-sample model.proj/model.dense_proj swap; bg_target=truth; 321px detector-geometry FOV default (NO fov override). (6) no control return.", "comparison_image": "runs/mayo-ldct-claude-agentic-wu-2015-trainable-search-20260619-01/iterations/iter-0005/comparison.png"}
