{"ts": "2026-06-19T21:33:07Z", "run_id": "mayo-ldct-claude-agentic-uswin-search-20260619-01", "iter": 3, "agent": "uswin-claude-agentic", "model": "claude-opus-4-8-1m", "change_class": "architecture", "status": "keep", "kept": true, "val_score": 0.9244434237480164, "headroom": 0.3531956774396291, "params_M": 3.954049, "train_n": 400, "rationale": "uswin-claude-agentic: train_n=200, val_n=214, epochs=64, batch_size=4, lr=0.0005, uswin_c=24, swin_window=8, swin_heads=4, grad_clip=1.0, max_train_s=1000, seed=42, rationale=ITER-3 (search-20260619-01, corrected protocol). ONE KNOB: epochs 40 -> 64 (1.6x); everything else identical to iter-2 (train_n=200, val_n=214, bs=4, lr=5e-4, uswin_c=24, swin_window=8, swin_heads=4, grad_clip=1.0, max_train_s=1000, seed=42). SIX-BOX (NUMBERS): (1) TRAJECTORY iter-1 ep10 -> SSIM 0.885910 / hr 0.173021 in 328.96s; iter-2 ep40 -> SSIM 0.914097 / hr 0.322063 in 737.72s. epochs-up lever CONFIRMED (hr +0.149 for +30 epochs, monotone, near-linear). iter-2 used 737.72s = 61pct of the HARD 20-min (1200s) train+score wall -> clear epoch headroom. (2) LIMITER: still UNDER-TRAINED, not capacity/optimization-limited (hr rose monotonically with epochs, no sign of a convergence basin yet; uswin is historically epochs-sensitive, ep10->40 prior run 0.173->0.322). The new ceiling is the 20-min wall, not the optimizer. (3) ONE KNOB = epochs 40 -> 64, justified by timing: from the two measured (epochs, elapsed_s) points the per-epoch cost is (737.72-328.96)/(40-10)=13.63 s/epoch and the fixed cost (data load + 214-slice per-sample val + figure I/O) is 328.96-10*13.63=192.7s. Max epochs that fit the 1200s wall: (1200-192.7)/13.63=73.9 -> 64 predicts 192.7 + 64*13.63 = 1065s = 17.7 min (~135s margin inside the 1200s budget; sbatch wall is 30 min). ep72 would be 1174s = 19.6 min (only 26s margin -> too tight given timing variance), so 64 is chosen as the safe-aggressive count. Train-only = 64*13.63 = 872s < max_train_s=1000 backstop, so the backstop does NOT truncate training. (4) HYPOTHESIS: uswin is still epochs-limited at ep40; +60pct more gradient steps (40->64) lifts hr above the iter-2 0.322063 toward/past dual_domain_supervised (predicted iter-3 hr ~0.37-0.41, extrapolating the iter1->iter2 +0.149/30-epoch slope sub-linearly as convergence approaches). FALSIFIER (NUMBERS): if hr plateaus at or below 0.322 (or drops) at ep64, uswin has reached its training-convergence basin at uswin_c=24 -> it is CAPACITY-limited, not training-limited, and iter-4 must raise uswin_c (24->32) or add an lr-schedule rather than epochs (which cannot fit the wall much beyond 72 anyway). (5) HARD 20-min train+score budget; val_n=214 = ALL L277 slices (NOT reduced); grad_clip=1.0 retained (mandatory; the 2304-view Mayo FBP adjoint amplifies gradients). HARD-WIRED (unchanged): staged_canonical v3 mayo_ldct_fitted geometry, per-sample-ps FBP, bg_target=truth, metric=321px detector-geometry FOV (evaluate_calibrated default for AGENT4CT_DATASET=mayo_ldct_2d; no fov= override). (6) no control return.", "advice_for_others": "uswin-claude-agentic: train_n=200, val_n=214, epochs=64, batch_size=4, lr=0.0005, uswin_c=24, swin_window=8, swin_heads=4, grad_clip=1.0, max_train_s=1000, seed=42, rationale=ITER-3 (search-20260619-01, corrected protocol). ONE KNOB: epochs 40 -> 64 (1.6x); everything else identical to iter-2 (train_n=200, val_n=214, bs=4, lr=5e-4, uswin_c=24, swin_window=8, swin_heads=4, grad_clip=1.0, max_train_s=1000, seed=42). SIX-BOX (NUMBERS): (1) TRAJECTORY iter-1 ep10 -> SSIM 0.885910 / hr 0.173021 in 328.96s; iter-2 ep40 -> SSIM 0.914097 / hr 0.322063 in 737.72s. epochs-up lever CONFIRMED (hr +0.149 for +30 epochs, monotone, near-linear). iter-2 used 737.72s = 61pct of the HARD 20-min (1200s) train+score wall -> clear epoch headroom. (2) LIMITER: still UNDER-TRAINED, not capacity/optimization-limited (hr rose monotonically with epochs, no sign of a convergence basin yet; uswin is historically epochs-sensitive, ep10->40 prior run 0.173->0.322). The new ceiling is the 20-min wall, not the optimizer. (3) ONE KNOB = epochs 40 -> 64, justified by timing: from the two measured (epochs, elapsed_s) points the per-epoch cost is (737.72-328.96)/(40-10)=13.63 s/epoch and the fixed cost (data load + 214-slice per-sample val + figure I/O) is 328.96-10*13.63=192.7s. Max epochs that fit the 1200s wall: (1200-192.7)/13.63=73.9 -> 64 predicts 192.7 + 64*13.63 = 1065s = 17.7 min (~135s margin inside the 1200s budget; sbatch wall is 30 min). ep72 would be 1174s = 19.6 min (only 26s margin -> too tight given timing variance), so 64 is chosen as the safe-aggressive count. Train-only = 64*13.63 = 872s < max_train_s=1000 backstop, so the backstop does NOT truncate training. (4) HYPOTHESIS: uswin is still epochs-limited at ep40; +60pct more gradient steps (40->64) lifts hr above the iter-2 0.322063 toward/past dual_domain_supervised (predicted iter-3 hr ~0.37-0.41, extrapolating the iter1->iter2 +0.149/30-epoch slope sub-linearly as convergence approaches). FALSIFIER (NUMBERS): if hr plateaus at or below 0.322 (or drops) at ep64, uswin has reached its training-convergence basin at uswin_c=24 -> it is CAPACITY-limited, not training-limited, and iter-4 must raise uswin_c (24->32) or add an lr-schedule rather than epochs (which cannot fit the wall much beyond 72 anyway). (5) HARD 20-min train+score budget; val_n=214 = ALL L277 slices (NOT reduced); grad_clip=1.0 retained (mandatory; the 2304-view Mayo FBP adjoint amplifies gradients). HARD-WIRED (unchanged): staged_canonical v3 mayo_ldct_fitted geometry, per-sample-ps FBP, bg_target=truth, metric=321px detector-geometry FOV (evaluate_calibrated default for AGENT4CT_DATASET=mayo_ldct_2d; no fov= override). (6) no control return.", "comparison_image": "runs/mayo-ldct-claude-agentic-uswin-search-20260619-01/iterations/iter-0003/comparison.png"}
{"ts": "2026-06-19T21:15:32Z", "run_id": "mayo-ldct-claude-agentic-dual-domain-supervised-search-20260619-01", "iter": 3, "agent": "dual_domain_supervised-claude-agentic", "model": "claude-opus-4-8-1m", "change_class": "architecture", "status": "keep", "kept": true, "val_score": 0.9181913733482361, "headroom": 0.3653571024466965, "params_M": 0.465762, "train_n": 400, "rationale": "dual_domain_supervised-claude-agentic: unet_c=16, lr=0.0001, epochs=27, batch_size=1, val_chunk=1, train_n=200, val_n=214, grad_clip=1.0, lambda_neg=1.0, seed=42, rationale=ITER-3 (search-20260619-01, corrected protocol). ONE KNOB: epochs 20 -> 27 (everything else identical to iter-2: unet_c=16, lr=1e-4, batch_size=1, val_chunk=1, train_n=200, val_n=214, grad_clip=1.0, lambda_neg=1.0, seed=42). TRAJECTORY: iter-1 ep8 -> SSIM 0.887976 / hr 0.275953 in 418.58s; iter-2 ep20 -> SSIM 0.909762 / hr 0.338985 in 893.06s. The epochs-up lever is CONFIRMED (hr +0.063, monotone) -> the supervised DD-UNet is STILL UNDER-TRAINED, not capacity-limited. LIMITER NOW: the 20-min wall, NOT convergence. From the two measured (epochs, elapsed_s) points the per-epoch cost is (893.06-418.58)/(20-8)=39.5 s/epoch and the fixed cost (data load + 214-slice per-sample val + figure I/O) is 418.58-8*39.5=102.6 s. Max epochs that fit the HARD 20-min (1200s) train+score wall: (1200-102.6)/39.5 = 27.8 -> epochs=27 predicts 102.6 + 27*39.5 = 1169 s = 19.5 min (~31 s margin inside the 1200 s budget; sbatch wall is 30 min). epochs=32 would be 102.6 + 32*39.5 = 1366 s = 22.8 min -> BUSTS the 20-min wall, so 32 is NOT chosen; 27 is the largest epoch count the measured timing permits. HYPOTHESIS: epochs is still the lever; +35pct more gradient steps (20->27) lifts hr above the iter-2 0.338985 (predicted iter-3 hr ~0.36-0.38, extrapolating the iter1->iter2 +0.063/12-epoch slope, sub-linearly as convergence approaches). FALSIFIER (in NUMBERS): if hr plateaus at or below 0.339 (or drops) at epochs=27, the solver has reached its TRAINING-convergence basin at unet_c=16 -> it is CAPACITY-limited, not training-limited, and iter-4 must raise unet_c (16->24) rather than epochs (which cannot fit the wall anyway). grad_clip=1.0 retained (mandatory; the 2304-view Mayo FBP adjoint amplifies gradients ~18x -> lr kept conservative + nonfinite-grad-skip). val_n=214 = ALL L277 slices (NOT reduced). HARD-WIRED (unchanged): staged_canonical v3 mayo_ldct_fitted geometry, per-sample-ps FBP + per-sample pipe.R_full swap, bg_target=truth, metric=321px detector-geometry FOV (evaluate_calibrated default for AGENT4CT_DATASET=mayo_ldct_2d; no fov= override).", "advice_for_others": "dual_domain_supervised-claude-agentic: unet_c=16, lr=0.0001, epochs=27, batch_size=1, val_chunk=1, train_n=200, val_n=214, grad_clip=1.0, lambda_neg=1.0, seed=42, rationale=ITER-3 (search-20260619-01, corrected protocol). ONE KNOB: epochs 20 -> 27 (everything else identical to iter-2: unet_c=16, lr=1e-4, batch_size=1, val_chunk=1, train_n=200, val_n=214, grad_clip=1.0, lambda_neg=1.0, seed=42). TRAJECTORY: iter-1 ep8 -> SSIM 0.887976 / hr 0.275953 in 418.58s; iter-2 ep20 -> SSIM 0.909762 / hr 0.338985 in 893.06s. The epochs-up lever is CONFIRMED (hr +0.063, monotone) -> the supervised DD-UNet is STILL UNDER-TRAINED, not capacity-limited. LIMITER NOW: the 20-min wall, NOT convergence. From the two measured (epochs, elapsed_s) points the per-epoch cost is (893.06-418.58)/(20-8)=39.5 s/epoch and the fixed cost (data load + 214-slice per-sample val + figure I/O) is 418.58-8*39.5=102.6 s. Max epochs that fit the HARD 20-min (1200s) train+score wall: (1200-102.6)/39.5 = 27.8 -> epochs=27 predicts 102.6 + 27*39.5 = 1169 s = 19.5 min (~31 s margin inside the 1200 s budget; sbatch wall is 30 min). epochs=32 would be 102.6 + 32*39.5 = 1366 s = 22.8 min -> BUSTS the 20-min wall, so 32 is NOT chosen; 27 is the largest epoch count the measured timing permits. HYPOTHESIS: epochs is still the lever; +35pct more gradient steps (20->27) lifts hr above the iter-2 0.338985 (predicted iter-3 hr ~0.36-0.38, extrapolating the iter1->iter2 +0.063/12-epoch slope, sub-linearly as convergence approaches). FALSIFIER (in NUMBERS): if hr plateaus at or below 0.339 (or drops) at epochs=27, the solver has reached its TRAINING-convergence basin at unet_c=16 -> it is CAPACITY-limited, not training-limited, and iter-4 must raise unet_c (16->24) rather than epochs (which cannot fit the wall anyway). grad_clip=1.0 retained (mandatory; the 2304-view Mayo FBP adjoint amplifies gradients ~18x -> lr kept conservative + nonfinite-grad-skip). val_n=214 = ALL L277 slices (NOT reduced). HARD-WIRED (unchanged): staged_canonical v3 mayo_ldct_fitted geometry, per-sample-ps FBP + per-sample pipe.R_full swap, bg_target=truth, metric=321px detector-geometry FOV (evaluate_calibrated default for AGENT4CT_DATASET=mayo_ldct_2d; no fov= override).", "comparison_image": "runs/mayo-ldct-claude-agentic-dual-domain-supervised-search-20260619-01/iterations/iter-0003/comparison.png"}
{"ts": "2026-06-19T21:12:07Z", "run_id": "mayo-ldct-claude-agentic-r2gaussian-search-20260619-01", "iter": 2, "agent": "r2gaussian-claude-agentic", "model": "claude-opus-4-8-1m", "change_class": "architecture", "status": "discard", "kept": false, "val_score": 0.7369808554649353, "headroom": 0.0, "params_M": 0.003072, "train_n": 400, "rationale": "r2gaussian-claude-agentic: val_n=214, gs_n_gaussians=512, gs_n_iter=400, gs_lr_pos=0.005, gs_lr_scale=0.01, gs_lr_amp=0.01, gs_lr_rot=0.01, gs_amp_init=0.01, gs_scale_init=0.04, gs_tv_weight=0.0001, gs_n_clip=0.05, gs_init_from_fbp=False, gs_outer_wall_s=1080, rationale=iter-2 (search-20260619-01). ONE KNOB: gs_n_iter 150->400 (per-scene Adam steps; all other knobs held at iter-1). FAILURE MODE iter-1: SSIM 0.7383 < LD-FBP baseline 0.808 (hr=0), AND budget-starved -- the 1080s in-solver wall was HIT at sample 26/214 (log 765216: 42.4 s/scene = 282.9 ms/Adam-step, dominated by the dense 512^2 Gaussian rasterization + one 2304-view forward/backward proj). So iter-1 was BOTH under-fit per-scene AND covered only 12% of the 214 slices. HYPOTHESIS (falsifiable in NUMBERS): the 0.7383 is per-scene UNDER-FIT, not a structural ceiling -- 2.67x more Adam steps will lift per-scene SSIM materially above 0.738 (the discarded 20260614 run reached SSIM 0.89-0.92 at gs_n_iter=6000 on val_n=20). FALSIFIER: if the ~9 scenes that finish at gs_n_iter=400 score <=0.76 SSIM (no material lift over 0.738), under-fit is REFUTED and 0.738 is a per-scene structural ceiling. BUDGET MATH: 282.9 ms/step x 400 steps = 113.2 s/scene; 1080s outer wall / 113.2 = ~9/214 scenes finish (well within the 20-min train+score budget; SLURM --time=00:30:00 has headroom, figure excluded). val_n stays 214 (NOT reduced); the per-scene loop self-truncates at the 1080s wall and scores whatever completed -- exactly as iter-1. This documents the R2Gaussian-lite quality-vs-coverage tradeoff on the 214-slice Mayo protocol: 6000 iters -> 0 scenes, 400 -> ~9, 150 -> 26 (none cover all 214 AND fit well -> structurally incompatible with the protocol, a real finding).", "advice_for_others": "r2gaussian-claude-agentic: val_n=214, gs_n_gaussians=512, gs_n_iter=400, gs_lr_pos=0.005, gs_lr_scale=0.01, gs_lr_amp=0.01, gs_lr_rot=0.01, gs_amp_init=0.01, gs_scale_init=0.04, gs_tv_weight=0.0001, gs_n_clip=0.05, gs_init_from_fbp=False, gs_outer_wall_s=1080, rationale=iter-2 (search-20260619-01). ONE KNOB: gs_n_iter 150->400 (per-scene Adam steps; all other knobs held at iter-1). FAILURE MODE iter-1: SSIM 0.7383 < LD-FBP baseline 0.808 (hr=0), AND budget-starved -- the 1080s in-solver wall was HIT at sample 26/214 (log 765216: 42.4 s/scene = 282.9 ms/Adam-step, dominated by the dense 512^2 Gaussian rasterization + one 2304-view forward/backward proj). So iter-1 was BOTH under-fit per-scene AND covered only 12% of the 214 slices. HYPOTHESIS (falsifiable in NUMBERS): the 0.7383 is per-scene UNDER-FIT, not a structural ceiling -- 2.67x more Adam steps will lift per-scene SSIM materially above 0.738 (the discarded 20260614 run reached SSIM 0.89-0.92 at gs_n_iter=6000 on val_n=20). FALSIFIER: if the ~9 scenes that finish at gs_n_iter=400 score <=0.76 SSIM (no material lift over 0.738), under-fit is REFUTED and 0.738 is a per-scene structural ceiling. BUDGET MATH: 282.9 ms/step x 400 steps = 113.2 s/scene; 1080s outer wall / 113.2 = ~9/214 scenes finish (well within the 20-min train+score budget; SLURM --time=00:30:00 has headroom, figure excluded). val_n stays 214 (NOT reduced); the per-scene loop self-truncates at the 1080s wall and scores whatever completed -- exactly as iter-1. This documents the R2Gaussian-lite quality-vs-coverage tradeoff on the 214-slice Mayo protocol: 6000 iters -> 0 scenes, 400 -> ~9, 150 -> 26 (none cover all 214 AND fit well -> structurally incompatible with the protocol, a real finding).", "comparison_image": "runs/mayo-ldct-claude-agentic-r2gaussian-search-20260619-01/iterations/iter-0002/comparison.png"}
{"ts": "2026-06-19T20:54:46Z", "run_id": "mayo-ldct-claude-agentic-diff-recon-dcstep-unconstrained-mayo-v4-search-20260619-01", "iter": 2, "agent": "diffusion_recon_dcstep_unconstrained_mayo_v4-claude-agentic", "model": "claude-opus-4-8-1m", "change_class": "architecture", "status": "discard", "kept": false, "val_score": 0.39601171016693115, "headroom": 0.0, "params_M": 8.594211, "train_n": 400, "rationale": "diffusion_recon_dcstep_unconstrained_mayo_v4-claude-agentic: recon_ckpt=/cluster/maier/Agent4CT/checkpoints/ddpm_mayo_unconstrained_v4.pt, recon_mode=dps, recon_sample_steps=25, recon_eta=5.0, recon_init=fbp, recon_eta_clamp=False, recon_dcstep_every=0, recon_dcstep_n_cg=3, recon_dcstep_warmup=5, recon_dcstep_relax=1.0, val_n=214, train_n=0, rationale=iter-2 search-20260619-01 UNCONSTRAINED diff-recon vs reused Mayo DDPM v4 ckpt (ddpm_mayo_unconstrained_v4.pt). ONE KNOB: recon_eta 30.0 -> 5.0 (DPS soft-guidance gain DOWN). All else IDENTICAL to iter-1 (n_steps=25, init=fbp, recon_dcstep_every=0 so the hard-CG projection stays OFF -> pure soft DPS; recon_eta_clamp=false). iter-1 NUMBERS (eta=30): SSIM 0.3688, hr=0.0, PSNR 10.55, RMSE 0.01485, 868.65 s / 214 slices = 4.06 s/slice -- FAR BELOW the LD-FBP floor 0.8078 AND below its own FBP init, and below the constrained sibling's 0.3937. FAILURE MODE (shared with the constrained sibling's iter-2 diagnosis): eta is a dimensionless gain in the adaptively-normalized DPS step (step = (eta/||resid||)*grad, Chung 2023 eq.12); the literature/demo/breast default is 1.0, so eta=30 (a leftover discarded-614 boundary-metric hint) is a ~30x overshoot that, with recon_eta_clamp=false (no per-step displacement cap), blows the FBP-initialized iterate OFF-MANIFOLD every reverse step -> the recon is corrupted, not merely prior-dominated drift. DISTINCT FROM THE CONSTRAINED SIBLING (which is running eta 30->1.0 WITH hard-CG every=5): this unconstrained variant has recon_dcstep_every=0, i.e. NO hard-CG fidelity backstop, so the soft DPS gradient is its ONLY data-consistency mechanism -> it needs MORE guidance than the constrained sibling. I pick eta=5.0 (a clearly different magnitude than the sibling's 1.0) so the pair BRACKETS the soft-guidance response: constrained = gentle-soft (eta=1) + hard-CG; unconstrained = moderate-soft (eta=5) + no-CG. BUDGET: eta is a free scalar multiplier on the existing per-step gradient -- no extra forward/backward or projection calls -> per-slice cost stays ~4.06 s; 214 slices * 4.06 s = 869 s = 14.5 min < 20-min (1200 s) wall (~330 s headroom); n_steps unchanged so no budget risk. val=ALL 214 L277 slices, 321px detector-geometry FOV (default). HYPOTHESIS: if I lower eta 30 -> 5, SSIM rises above the iter-1 0.3688 because the gentler-but-still-substantial soft DPS gradient keeps the FBP-initialized iterate on-manifold while still pulling toward the measurements (less off-manifold corruption). FALSIFIER: if SSIM stays ~0.37-0.5 (still << the 0.8078 LD-FBP floor) at eta=5 -- and the constrained sibling likewise fails to clear FBP at eta=1 -- then the DPS step size was NOT the issue: the Mayo v4 DDPM prior is mismatched to the rebinned-Mayo distribution under the 25-step low-T budget (mirrors the breast-DDPM hr=0 structural verdict: globally faithful but not conditionally faithful under DPS). iter-3 would then redirect to n_steps (longer DDIM trajectory) or accept an architectural prior-mismatch ceiling, not the guidance gain.", "advice_for_others": "diffusion_recon_dcstep_unconstrained_mayo_v4-claude-agentic: recon_ckpt=/cluster/maier/Agent4CT/checkpoints/ddpm_mayo_unconstrained_v4.pt, recon_mode=dps, recon_sample_steps=25, recon_eta=5.0, recon_init=fbp, recon_eta_clamp=False, recon_dcstep_every=0, recon_dcstep_n_cg=3, recon_dcstep_warmup=5, recon_dcstep_relax=1.0, val_n=214, train_n=0, rationale=iter-2 search-20260619-01 UNCONSTRAINED diff-recon vs reused Mayo DDPM v4 ckpt (ddpm_mayo_unconstrained_v4.pt). ONE KNOB: recon_eta 30.0 -> 5.0 (DPS soft-guidance gain DOWN). All else IDENTICAL to iter-1 (n_steps=25, init=fbp, recon_dcstep_every=0 so the hard-CG projection stays OFF -> pure soft DPS; recon_eta_clamp=false). iter-1 NUMBERS (eta=30): SSIM 0.3688, hr=0.0, PSNR 10.55, RMSE 0.01485, 868.65 s / 214 slices = 4.06 s/slice -- FAR BELOW the LD-FBP floor 0.8078 AND below its own FBP init, and below the constrained sibling's 0.3937. FAILURE MODE (shared with the constrained sibling's iter-2 diagnosis): eta is a dimensionless gain in the adaptively-normalized DPS step (step = (eta/||resid||)*grad, Chung 2023 eq.12); the literature/demo/breast default is 1.0, so eta=30 (a leftover discarded-614 boundary-metric hint) is a ~30x overshoot that, with recon_eta_clamp=false (no per-step displacement cap), blows the FBP-initialized iterate OFF-MANIFOLD every reverse step -> the recon is corrupted, not merely prior-dominated drift. DISTINCT FROM THE CONSTRAINED SIBLING (which is running eta 30->1.0 WITH hard-CG every=5): this unconstrained variant has recon_dcstep_every=0, i.e. NO hard-CG fidelity backstop, so the soft DPS gradient is its ONLY data-consistency mechanism -> it needs MORE guidance than the constrained sibling. I pick eta=5.0 (a clearly different magnitude than the sibling's 1.0) so the pair BRACKETS the soft-guidance response: constrained = gentle-soft (eta=1) + hard-CG; unconstrained = moderate-soft (eta=5) + no-CG. BUDGET: eta is a free scalar multiplier on the existing per-step gradient -- no extra forward/backward or projection calls -> per-slice cost stays ~4.06 s; 214 slices * 4.06 s = 869 s = 14.5 min < 20-min (1200 s) wall (~330 s headroom); n_steps unchanged so no budget risk. val=ALL 214 L277 slices, 321px detector-geometry FOV (default). HYPOTHESIS: if I lower eta 30 -> 5, SSIM rises above the iter-1 0.3688 because the gentler-but-still-substantial soft DPS gradient keeps the FBP-initialized iterate on-manifold while still pulling toward the measurements (less off-manifold corruption). FALSIFIER: if SSIM stays ~0.37-0.5 (still << the 0.8078 LD-FBP floor) at eta=5 -- and the constrained sibling likewise fails to clear FBP at eta=1 -- then the DPS step size was NOT the issue: the Mayo v4 DDPM prior is mismatched to the rebinned-Mayo distribution under the 25-step low-T budget (mirrors the breast-DDPM hr=0 structural verdict: globally faithful but not conditionally faithful under DPS). iter-3 would then redirect to n_steps (longer DDIM trajectory) or accept an architectural prior-mismatch ceiling, not the guidance gain.", "comparison_image": "runs/mayo-ldct-claude-agentic-diff-recon-dcstep-unconstrained-mayo-v4-search-20260619-01/iterations/iter-0002/comparison.png"}
