{"ts": "2026-06-21T10:46:47Z", "run_id": "mayo-ldct-claude-agentic-itnet-v2-search-20260619-01", "iter": 8, "agent": "itnet_v2-claude-agentic", "model": "claude-opus-4-8-1m", "change_class": "architecture", "status": "keep", "kept": true, "val_score": 0.9427012801170349, "headroom": 0.43017090010875747, "params_M": 0.232882, "train_n": 400, "rationale": "itnet_v2-claude-agentic: itnet_k=1, unet_c=16, itnet_alpha_init=0.0037, residual_learning=False, pretrain_lr=0.0001, pretrain_epochs=72, pretrain_patience=72, batch_size=1, val_chunk=1, train_n=579, val_n=214, grad_clip=1.0, max_train_s=1050, seed=42, rationale=ITER-8 (search-20260619-01, corrected 214-slice/321px-FOV metric). DATA-COVERAGE lever on the BOARD CHAMPION. ONE KNOB: train_n 400->579 (FULL 579-slice train pool, ~69%->100% coverage), with pretrain_epochs traded 120->72 + pretrain_patience tracked 120->72 (early-stop stays disabled) to HOLD the HARD 1200s wall AND keep grad-step parity train_n*epochs (iter-7 400*120=48000; iter-8 579*72=41688, ~13% fewer steps as a budget-safety margin since iter-7 overran at 1308.6s). Base=iter-7 (the BREAKOUT, NEW #1, SSIM 0.9414/hr 0.4187 @itnet_k=1/tn400/ep120). KEEP itnet_k=1 (the iter-7 breakout) and residual_learning=False (the mandatory config-fix). MECHANISM (campaign_state.md, CONFIRMED): build_dataset calls load_val_split(split='train', n=train_n) -> a FIXED n-slice subset loaded ONCE; pretrain_denoiser merely reshuffles that subset each epoch (torch.randperm), NO RotatingSubsetDataset. So train_n=400 lets the denoiser see only ~69% of the 579-slice pool (3 ps-groups: 154@0.66192, 98@0.73979, 327@0.77873); train_n=579 raises coverage to 100%. This is the SAME confirmed lever that lifted uswin (200->480, hr 0.3532->0.3829, +0.0297) and itnet_v3 (200->400, hr 0.3123->0.3288, +0.0165) and itnet v1 (200->300). SIX-BOX (NUMBERS, hr=metric of record): (1) TRAJECTORY: iter-1 SSIM 0.4554/hr0 @ep12/tn200/k3 170s; iter-2 0.5888 @ep48 345s; iter-3 0.6230 @ep144 744s; iter-4 0.7039 @ep240 1237s; iter-5 0.7294/hr0 @ep120/tn400/k3 1411s; iter-6 0.6307 @ep144/tn200/k3 744s; iter-7 0.9414/hr 0.4187 @itnet_k=1/tn400/ep120 1308.6s (BREAKOUT, NEW #1, val_psnr 38.79, val_rmse 5.75e-4). CURRENT train_n=400 (~69% of 579 pool). (2) LIMITER: with itnet_k=1 unlocked, the binding limiter is now the TRAINED DENOISER's data coverage -- it only sees ~69% of the anatomy in the 579-slice pool because the fixed-subset loader never rotates. The single trained-denoiser+1-DC pass is excellent (0.9414) but the denoiser is data-coverage-limited, the proven climb lever for the end-to-end/denoiser trainers this campaign. (3) ONE KNOB: train_n 400->579 (full pool), pretrain_epochs traded 120->72 to hold budget; itnet_k=1 KEPT, residual_learning=False KEPT. (4) HYPOTHESIS: if train_n 400->579, val_ssim/hr rises ABOVE iter-7 0.4187 because the denoiser sees 100% vs 69% of the 579-slice anatomical variety at near-equal optimization, exactly as full-coverage lifted uswin/itnet_v3/v1. NUMERIC FALSIFIER: if hr <= 0.4187 (flat/down) at train_n=579, the denoiser is NOT data-coverage-limited at k=1 -- coverage is exhausted -- and iter-9 reverts to tn400 and probes pretrain_epochs UP (more denoiser convergence) as the next lever. (5) BUDGET: HARD 20-min (1200s) train+score. iter-7 per-epoch at tn400/k1 ~8.31s/epoch, fixed (214-slice per-sample val + figure) ~312s (1308.6 - 120*8.31). At tn579 per-epoch ~8.31*579/400=12.03s/epoch -> 72 ep: 72*12.03 + 312 = 1178s, UNDER 1200s (and grad-steps 41688 < 48000 gives extra margin vs iter-7's overrun). max_train_s=1050 (17.5-min HARD backstop) GUARANTEES the 214-slice per-sample val + figure finish inside the 30-min sbatch wall, ending the overrun risk. val_n=214 KEPT (ALL L277 slices, NOT reduced), grad_clip=1.0 KEPT, batch_size=2 (itnet_v2 needs bs=2 per six-box) -- NOTE solver FORCES bs=1+val_chunk=1 via per-sample-ps so this is moot. (6) Loop continues -- no control returned. HARD-WIRED (unchanged): staged_canonical data, v3 mayo_ldct_fitted geometry, per-sample-ps (itnet.projector swap, bs=1+val_chunk=1 FORCED), bg_target=truth, val=ALL 214 L277 slices under the 321px detector-geometry FOV (no fov= override), grad_clip retained, itnet_k=1 KEPT, residual_learning=False KEPT.", "advice_for_others": "itnet_v2-claude-agentic: itnet_k=1, unet_c=16, itnet_alpha_init=0.0037, residual_learning=False, pretrain_lr=0.0001, pretrain_epochs=72, pretrain_patience=72, batch_size=1, val_chunk=1, train_n=579, val_n=214, grad_clip=1.0, max_train_s=1050, seed=42, rationale=ITER-8 (search-20260619-01, corrected 214-slice/321px-FOV metric). DATA-COVERAGE lever on the BOARD CHAMPION. ONE KNOB: train_n 400->579 (FULL 579-slice train pool, ~69%->100% coverage), with pretrain_epochs traded 120->72 + pretrain_patience tracked 120->72 (early-stop stays disabled) to HOLD the HARD 1200s wall AND keep grad-step parity train_n*epochs (iter-7 400*120=48000; iter-8 579*72=41688, ~13% fewer steps as a budget-safety margin since iter-7 overran at 1308.6s). Base=iter-7 (the BREAKOUT, NEW #1, SSIM 0.9414/hr 0.4187 @itnet_k=1/tn400/ep120). KEEP itnet_k=1 (the iter-7 breakout) and residual_learning=False (the mandatory config-fix). MECHANISM (campaign_state.md, CONFIRMED): build_dataset calls load_val_split(split='train', n=train_n) -> a FIXED n-slice subset loaded ONCE; pretrain_denoiser merely reshuffles that subset each epoch (torch.randperm), NO RotatingSubsetDataset. So train_n=400 lets the denoiser see only ~69% of the 579-slice pool (3 ps-groups: 154@0.66192, 98@0.73979, 327@0.77873); train_n=579 raises coverage to 100%. This is the SAME confirmed lever that lifted uswin (200->480, hr 0.3532->0.3829, +0.0297) and itnet_v3 (200->400, hr 0.3123->0.3288, +0.0165) and itnet v1 (200->300). SIX-BOX (NUMBERS, hr=metric of record): (1) TRAJECTORY: iter-1 SSIM 0.4554/hr0 @ep12/tn200/k3 170s; iter-2 0.5888 @ep48 345s; iter-3 0.6230 @ep144 744s; iter-4 0.7039 @ep240 1237s; iter-5 0.7294/hr0 @ep120/tn400/k3 1411s; iter-6 0.6307 @ep144/tn200/k3 744s; iter-7 0.9414/hr 0.4187 @itnet_k=1/tn400/ep120 1308.6s (BREAKOUT, NEW #1, val_psnr 38.79, val_rmse 5.75e-4). CURRENT train_n=400 (~69% of 579 pool). (2) LIMITER: with itnet_k=1 unlocked, the binding limiter is now the TRAINED DENOISER's data coverage -- it only sees ~69% of the anatomy in the 579-slice pool because the fixed-subset loader never rotates. The single trained-denoiser+1-DC pass is excellent (0.9414) but the denoiser is data-coverage-limited, the proven climb lever for the end-to-end/denoiser trainers this campaign. (3) ONE KNOB: train_n 400->579 (full pool), pretrain_epochs traded 120->72 to hold budget; itnet_k=1 KEPT, residual_learning=False KEPT. (4) HYPOTHESIS: if train_n 400->579, val_ssim/hr rises ABOVE iter-7 0.4187 because the denoiser sees 100% vs 69% of the 579-slice anatomical variety at near-equal optimization, exactly as full-coverage lifted uswin/itnet_v3/v1. NUMERIC FALSIFIER: if hr <= 0.4187 (flat/down) at train_n=579, the denoiser is NOT data-coverage-limited at k=1 -- coverage is exhausted -- and iter-9 reverts to tn400 and probes pretrain_epochs UP (more denoiser convergence) as the next lever. (5) BUDGET: HARD 20-min (1200s) train+score. iter-7 per-epoch at tn400/k1 ~8.31s/epoch, fixed (214-slice per-sample val + figure) ~312s (1308.6 - 120*8.31). At tn579 per-epoch ~8.31*579/400=12.03s/epoch -> 72 ep: 72*12.03 + 312 = 1178s, UNDER 1200s (and grad-steps 41688 < 48000 gives extra margin vs iter-7's overrun). max_train_s=1050 (17.5-min HARD backstop) GUARANTEES the 214-slice per-sample val + figure finish inside the 30-min sbatch wall, ending the overrun risk. val_n=214 KEPT (ALL L277 slices, NOT reduced), grad_clip=1.0 KEPT, batch_size=2 (itnet_v2 needs bs=2 per six-box) -- NOTE solver FORCES bs=1+val_chunk=1 via per-sample-ps so this is moot. (6) Loop continues -- no control returned. HARD-WIRED (unchanged): staged_canonical data, v3 mayo_ldct_fitted geometry, per-sample-ps (itnet.projector swap, bs=1+val_chunk=1 FORCED), bg_target=truth, val=ALL 214 L277 slices under the 321px detector-geometry FOV (no fov= override), grad_clip retained, itnet_k=1 KEPT, residual_learning=False KEPT.", "comparison_image": "runs/mayo-ldct-claude-agentic-itnet-v2-search-20260619-01/iterations/iter-0008/comparison.png"}
{"ts": "2026-06-21T10:45:30Z", "run_id": "mayo-ldct-claude-agentic-itnet-v3-search-20260619-01", "iter": 8, "agent": "itnet_v3-claude-agentic", "model": "claude-opus-4-8-1m", "change_class": "architecture", "status": "keep", "kept": true, "val_score": 0.9063734412193298, "headroom": 0.3149279771469128, "params_M": 3.698994, "train_n": 400, "rationale": "itnet_v3-claude-agentic: itnet_k=3, unet_c=16, alpha_init=0.0037, lr=0.0001, epochs=7, batch_size=1, val_chunk=1, train_n=579, val_n=214, grad_clip=1.0, max_train_s=720, seed=42, rationale=iter-8 (search-20260619-01, corrected protocol). BASE_ITER=7 (the BEST: c16/ep9/train_n=460, hr 0.336607 / SSIM 0.915241). ONE KNOB: train_n 460 -> 579 (FULL 579-slice Wagner train pool = LAST 119 distinct slices, 79pct -> 100pct coverage), with epochs traded 9 -> 7 -- the HIGHEST exposure full-data affords inside the HARD 20-min wall (and STRICTLY above iter-6 failed 6x). SIX-BOX (NUMBERS): (1) itnet_v3 trajectory: iter-1 ep8/tn200 hr 0.268409 (737.85s); iter-2 ep14/tn200 hr 0.310054 (1010.07s); iter-3 ep18/tn200 hr 0.312282 (1072.94s, epochs PLATEAUED +0.0022); iter-4 ep9/c24/tn200 hr 0.295576 (834.0s, capacity REGRESSED -> revert c16); iter-5 ep9/c16/tn400 hr 0.328842 (1006.81s, +0.0165 DATA lever); iter-6 ep6/c16/tn579 hr 0.315239 (914.0s, FULL data but exposure CUT to 6x -> REGRESSED); iter-7 BEST ep9/c16/tn460 hr 0.336607 / SSIM 0.915241 / elapsed 1139.1s=18.99min (coverage-at-9x-exposure WORKED, +0.0078 over iter-5). The DATA lever is CONFIRMED twice (tn200->400 +0.0165; tn400->460 +0.0078) PROVIDED exposure is not sacrificed too far. (2) LIMITER = the EPOCHS-vs-DATA tradeoff at the 1200s budget. iter-7 (tn460/ep9) already lands at 1139s, so ep9 cannot be held above tn460 (tn480/ep9 = 1225s busts the wall). The ONLY untried point that reaches FULL 579 coverage is to trade exposure DOWN -- but iter-6 showed 6x is too low. The clean test: FULL data at the HIGHEST affordable exposure 7x (>iter-6 6x). (3) ONE KNOB: train_n 460 -> 579 (full pool), epochs 9 -> 7. grad_steps 4053 > iter-6 3474; exposure 7x > iter-6 6x; coverage 100pct > iter-7 79pct. This DOMINATES iter-6 on every axis and tests whether the last 119 slices help at the max exposure the wall permits. (4) HYPOTHESIS: filling the LAST 21pct of the train pool (tn460 -> 579, full coverage) at 7x exposure lifts hr ABOVE the iter-7 best 0.336607, because the DATA lever is itnet_v3 strongest confirmed axis and iter-6 6x merely UNDER-trained (ep6 clearly too few -- epochs plateaued only at ep18 on tn200) while 7x is closer to the proven ~9x basin. NUMERIC FALSIFIER: if hr <= 0.336607 at tn579/ep7, the last 21pct of data does not help at 7x -- itnet_v3 needs >=8-9x exposure that full data cannot afford inside the wall, so its budget-constrained ceiling is the tn460/ep9 point hr 0.337 -> file the ceiling, stays #5. (5) BUDGET (HARD 1200s = train+score): from iter-7 actual (tn460/ep9 -> 1139.1s) recalibrated per_slice = (1139.1-481)/(9*460) = 0.1590 s/slice, fixed 481s. tn579/ep7 = 481 + 7*579*0.1590 = 1125s = 18.8 min < 1200s (conservative 0.1723 s/slice fit gives 1179s = 19.7min, STILL inside). epochs=8 would be 1217-1279s -> BUSTS the wall, so ep7 is the max integer that fits at full data. Train-only at ep7 = 7*579*0.1590 = 644s < max_train_s=720 backstop, so it never truncates (checks between epochs; fences only runaway slowdown); the 214-slice per-sample val + figure always land inside the 30-min sbatch wall. lr HELD at 1e-4 (v3 is lr-FRAGILE: lr3e-4 collapsed in prior probes -- do NOT touch). val stays ALL 214 L277 slices, 321px detector-geometry FOV (evaluate_calibrated default for AGENT4CT_DATASET=mayo_ldct_2d; no fov= override). grad_clip=1.0 retained (mandatory: 2304-view Mayo FBP adjoint inside dc_step overflows otherwise). HARD-WIRED (unchanged): staged_canonical v3 mayo_ldct_fitted geometry, per-sample-ps FBP init + per-sample itnet.projector swap for the k=3 DC steps, bg_target=truth. (6) do NOT return control mid-campaign. Predicted iter-8 hr: 0.34-0.35 if full-coverage-at-7x helps; <=0.3366 falsifies -> budget-constrained ceiling at ~0.337 (tn460/ep9), stays #5.", "advice_for_others": "itnet_v3-claude-agentic: itnet_k=3, unet_c=16, alpha_init=0.0037, lr=0.0001, epochs=7, batch_size=1, val_chunk=1, train_n=579, val_n=214, grad_clip=1.0, max_train_s=720, seed=42, rationale=iter-8 (search-20260619-01, corrected protocol). BASE_ITER=7 (the BEST: c16/ep9/train_n=460, hr 0.336607 / SSIM 0.915241). ONE KNOB: train_n 460 -> 579 (FULL 579-slice Wagner train pool = LAST 119 distinct slices, 79pct -> 100pct coverage), with epochs traded 9 -> 7 -- the HIGHEST exposure full-data affords inside the HARD 20-min wall (and STRICTLY above iter-6 failed 6x). SIX-BOX (NUMBERS): (1) itnet_v3 trajectory: iter-1 ep8/tn200 hr 0.268409 (737.85s); iter-2 ep14/tn200 hr 0.310054 (1010.07s); iter-3 ep18/tn200 hr 0.312282 (1072.94s, epochs PLATEAUED +0.0022); iter-4 ep9/c24/tn200 hr 0.295576 (834.0s, capacity REGRESSED -> revert c16); iter-5 ep9/c16/tn400 hr 0.328842 (1006.81s, +0.0165 DATA lever); iter-6 ep6/c16/tn579 hr 0.315239 (914.0s, FULL data but exposure CUT to 6x -> REGRESSED); iter-7 BEST ep9/c16/tn460 hr 0.336607 / SSIM 0.915241 / elapsed 1139.1s=18.99min (coverage-at-9x-exposure WORKED, +0.0078 over iter-5). The DATA lever is CONFIRMED twice (tn200->400 +0.0165; tn400->460 +0.0078) PROVIDED exposure is not sacrificed too far. (2) LIMITER = the EPOCHS-vs-DATA tradeoff at the 1200s budget. iter-7 (tn460/ep9) already lands at 1139s, so ep9 cannot be held above tn460 (tn480/ep9 = 1225s busts the wall). The ONLY untried point that reaches FULL 579 coverage is to trade exposure DOWN -- but iter-6 showed 6x is too low. The clean test: FULL data at the HIGHEST affordable exposure 7x (>iter-6 6x). (3) ONE KNOB: train_n 460 -> 579 (full pool), epochs 9 -> 7. grad_steps 4053 > iter-6 3474; exposure 7x > iter-6 6x; coverage 100pct > iter-7 79pct. This DOMINATES iter-6 on every axis and tests whether the last 119 slices help at the max exposure the wall permits. (4) HYPOTHESIS: filling the LAST 21pct of the train pool (tn460 -> 579, full coverage) at 7x exposure lifts hr ABOVE the iter-7 best 0.336607, because the DATA lever is itnet_v3 strongest confirmed axis and iter-6 6x merely UNDER-trained (ep6 clearly too few -- epochs plateaued only at ep18 on tn200) while 7x is closer to the proven ~9x basin. NUMERIC FALSIFIER: if hr <= 0.336607 at tn579/ep7, the last 21pct of data does not help at 7x -- itnet_v3 needs >=8-9x exposure that full data cannot afford inside the wall, so its budget-constrained ceiling is the tn460/ep9 point hr 0.337 -> file the ceiling, stays #5. (5) BUDGET (HARD 1200s = train+score): from iter-7 actual (tn460/ep9 -> 1139.1s) recalibrated per_slice = (1139.1-481)/(9*460) = 0.1590 s/slice, fixed 481s. tn579/ep7 = 481 + 7*579*0.1590 = 1125s = 18.8 min < 1200s (conservative 0.1723 s/slice fit gives 1179s = 19.7min, STILL inside). epochs=8 would be 1217-1279s -> BUSTS the wall, so ep7 is the max integer that fits at full data. Train-only at ep7 = 7*579*0.1590 = 644s < max_train_s=720 backstop, so it never truncates (checks between epochs; fences only runaway slowdown); the 214-slice per-sample val + figure always land inside the 30-min sbatch wall. lr HELD at 1e-4 (v3 is lr-FRAGILE: lr3e-4 collapsed in prior probes -- do NOT touch). val stays ALL 214 L277 slices, 321px detector-geometry FOV (evaluate_calibrated default for AGENT4CT_DATASET=mayo_ldct_2d; no fov= override). grad_clip=1.0 retained (mandatory: 2304-view Mayo FBP adjoint inside dc_step overflows otherwise). HARD-WIRED (unchanged): staged_canonical v3 mayo_ldct_fitted geometry, per-sample-ps FBP init + per-sample itnet.projector swap for the k=3 DC steps, bg_target=truth. (6) do NOT return control mid-campaign. Predicted iter-8 hr: 0.34-0.35 if full-coverage-at-7x helps; <=0.3366 falsifies -> budget-constrained ceiling at ~0.337 (tn460/ep9), stays #5.", "comparison_image": "runs/mayo-ldct-claude-agentic-itnet-v3-search-20260619-01/iterations/iter-0008/comparison.png"}
