{"ts": "2026-06-20T00:14:24Z", "run_id": "mayo-ldct-claude-agentic-wu-2015-trainable-search-20260619-01", "iter": 3, "agent": "wu_2015_trainable-claude-agentic", "model": "claude-opus-4-8-1m", "change_class": "architecture", "status": "discard", "kept": false, "val_score": 0.827303409576416, "headroom": 0.0, "params_M": 1e-05, "train_n": 400, "rationale": "wu_2015_trainable-claude-agentic: wu_n_bands=6, wu_n_outer=1, lr=0.01, epochs=6, batch_size=1, val_chunk=1, train_n=200, val_n=214, grad_clip=1.0, lambda_neg=1.0, weight_decay=0.0, loss_base=mse, seed=42, rationale=wu_2015_trainable iter-3 (search-20260619-01, corrected 214-slice/321px-FOV metric). SIX-BOX (NUMBERS). (1) PRIOR: iter-1 = SSIM 0.8370 / hr 0.0508, 8 params (wu_n_bands=4, wu_n_outer=1, ep6, lr0.01), elapsed 335s. iter-2 = SSIM 0.8390 / hr 0.0337, 8 params (SAME but ep18), elapsed 866.6s. iter-1->iter-2 (epochs 6->18) was FLAT: val_ssim +0.0020 (within the +-0.001 noise band the iter-2 falsifier set), and hr actually FELL 0.0508->0.0337. Per-epoch train cost = (866.6-335)/(18-6) = 44.3 s/ep at n_bands=4. SLURM log confirms training converged (loss=0.00000 by ep1; band_scale already saturating to clamp by ep18) -- epochs is INERT, the falsifier for under-training FIRED. (2) FAILURE MODE: few-param tuned-FBP ceiling. Wu-trainable is a band-reweighted aliasing-free FBP + ONE soft-thresholded dense residual pass with NO image-domain CNN denoiser; it sits hr~0.04 just above the LD-FBP floor and epochs cannot move it. The OPEN question iter-2's falsifier handed to iter-3: is hr capacity-limited (too few frequency bands to separate signal from noise) or is the whole FBP-family structurally ceilinged regardless of capacity? (3) ONE KNOB: CAPACITY via wu_n_bands 4->6 (+2 frequency bands in the band-weighted aliasing-free FBP, line 198 band-loop). This is the iter-2 falsifier's prescribed lever ('iter-3 must add capacity, wu_n_bands up'). I deliberately pick wu_n_bands over wu_n_outer because (a) n_bands enriches the FBP frequency partition -- the exact structurally-FBP part the ceiling hypothesis is about; (b) it is BUDGET-SAFE: the band-loop (FFT-filter + back_project) scales LINEARLY with n_bands while the heavy dense-projector residual pass stays a single fixed pass at n_outer=1, vs wu_n_outer++ which DOUBLES that dominant cost; (c) wu_n_outer=1 is the campaign 'mandatory' hint, leave it. NEW PARAM COUNT: wu_n_bands+2+2*wu_n_outer = 6+2+2*1 = 10 trainable scalars (was 8). epochs held at the iter-1 anchor 6 (NOT a second knob -- iter-2 PROVED ep6 vs ep18 is a non-difference, 0.837 vs 0.839; reverting to ep6 restores the proven-equivalent baseline epoch budget so the wider 6-band bank fits the HARD 20-min wall with margin, isolating n_bands as the sole meaningful change). All else identical to iter-1/2: lr0.01, bs=1, val_chunk=1, train_n=200, val_n=214(ALL L277), grad_clip=1.0, lambda_neg=1.0, weight_decay=0.0, loss_base=mse, seed=42. (4) HYPOTHESIS: if iter-3 SSIM rises measurably above 0.839 (>+0.005 over the noise band) with hr>0.05, Wu-trainable was frequency-band-capacity-limited and more bands buy real headroom. FALSIFIER: if SSIM REGRESSES or stays FLAT (<=0.840, within noise of iter-1/2) at 6 bands, Wu-trainable is STRUCTURALLY FBP-ceilinged on Mayo regardless of capacity -- exactly matching the few-param-bilateral pattern THIS tick (dual_domain_bilateral_supervised img_n_bf 3->6: 0.9192->0.9057 REGRESSED; hammernik filters-up also regressed), i.e. capacity bumps DESTABILISE these few-param FBP-family denoisers rather than help. A regression would be the strong confirmation that the lever is the FBP family itself, not its band count. (5) HARD 20-min (1200s) train+score budget, sized via the ep6 anchor: worst-case (whole per-sample cost scaling with n_bands, which over-counts since the residual pass is fixed) ~1.5x the iter-1 per-epoch -> ~66 s/ep x 6 = ~396s train + ~120s for the 1.5x-wider 214-slice val pass ~= 520s, with the val FIGURE outside the budget and well under the 1800s SLURM kill. val = ALL 214 L277 slices (do NOT reduce); grad_clip=1.0; bs=1 + val_chunk=1 forced by per-sample-ps; staged_canonical v3 mayo_ldct_fitted; per-sample-ps FBP + per-sample model.proj/model.dense_proj swap; bg_target=truth; 321px detector-geometry FOV default (NO fov override). (6) no control return.", "advice_for_others": "wu_2015_trainable-claude-agentic: wu_n_bands=6, wu_n_outer=1, lr=0.01, epochs=6, batch_size=1, val_chunk=1, train_n=200, val_n=214, grad_clip=1.0, lambda_neg=1.0, weight_decay=0.0, loss_base=mse, seed=42, rationale=wu_2015_trainable iter-3 (search-20260619-01, corrected 214-slice/321px-FOV metric). SIX-BOX (NUMBERS). (1) PRIOR: iter-1 = SSIM 0.8370 / hr 0.0508, 8 params (wu_n_bands=4, wu_n_outer=1, ep6, lr0.01), elapsed 335s. iter-2 = SSIM 0.8390 / hr 0.0337, 8 params (SAME but ep18), elapsed 866.6s. iter-1->iter-2 (epochs 6->18) was FLAT: val_ssim +0.0020 (within the +-0.001 noise band the iter-2 falsifier set), and hr actually FELL 0.0508->0.0337. Per-epoch train cost = (866.6-335)/(18-6) = 44.3 s/ep at n_bands=4. SLURM log confirms training converged (loss=0.00000 by ep1; band_scale already saturating to clamp by ep18) -- epochs is INERT, the falsifier for under-training FIRED. (2) FAILURE MODE: few-param tuned-FBP ceiling. Wu-trainable is a band-reweighted aliasing-free FBP + ONE soft-thresholded dense residual pass with NO image-domain CNN denoiser; it sits hr~0.04 just above the LD-FBP floor and epochs cannot move it. The OPEN question iter-2's falsifier handed to iter-3: is hr capacity-limited (too few frequency bands to separate signal from noise) or is the whole FBP-family structurally ceilinged regardless of capacity? (3) ONE KNOB: CAPACITY via wu_n_bands 4->6 (+2 frequency bands in the band-weighted aliasing-free FBP, line 198 band-loop). This is the iter-2 falsifier's prescribed lever ('iter-3 must add capacity, wu_n_bands up'). I deliberately pick wu_n_bands over wu_n_outer because (a) n_bands enriches the FBP frequency partition -- the exact structurally-FBP part the ceiling hypothesis is about; (b) it is BUDGET-SAFE: the band-loop (FFT-filter + back_project) scales LINEARLY with n_bands while the heavy dense-projector residual pass stays a single fixed pass at n_outer=1, vs wu_n_outer++ which DOUBLES that dominant cost; (c) wu_n_outer=1 is the campaign 'mandatory' hint, leave it. NEW PARAM COUNT: wu_n_bands+2+2*wu_n_outer = 6+2+2*1 = 10 trainable scalars (was 8). epochs held at the iter-1 anchor 6 (NOT a second knob -- iter-2 PROVED ep6 vs ep18 is a non-difference, 0.837 vs 0.839; reverting to ep6 restores the proven-equivalent baseline epoch budget so the wider 6-band bank fits the HARD 20-min wall with margin, isolating n_bands as the sole meaningful change). All else identical to iter-1/2: lr0.01, bs=1, val_chunk=1, train_n=200, val_n=214(ALL L277), grad_clip=1.0, lambda_neg=1.0, weight_decay=0.0, loss_base=mse, seed=42. (4) HYPOTHESIS: if iter-3 SSIM rises measurably above 0.839 (>+0.005 over the noise band) with hr>0.05, Wu-trainable was frequency-band-capacity-limited and more bands buy real headroom. FALSIFIER: if SSIM REGRESSES or stays FLAT (<=0.840, within noise of iter-1/2) at 6 bands, Wu-trainable is STRUCTURALLY FBP-ceilinged on Mayo regardless of capacity -- exactly matching the few-param-bilateral pattern THIS tick (dual_domain_bilateral_supervised img_n_bf 3->6: 0.9192->0.9057 REGRESSED; hammernik filters-up also regressed), i.e. capacity bumps DESTABILISE these few-param FBP-family denoisers rather than help. A regression would be the strong confirmation that the lever is the FBP family itself, not its band count. (5) HARD 20-min (1200s) train+score budget, sized via the ep6 anchor: worst-case (whole per-sample cost scaling with n_bands, which over-counts since the residual pass is fixed) ~1.5x the iter-1 per-epoch -> ~66 s/ep x 6 = ~396s train + ~120s for the 1.5x-wider 214-slice val pass ~= 520s, with the val FIGURE outside the budget and well under the 1800s SLURM kill. val = ALL 214 L277 slices (do NOT reduce); grad_clip=1.0; bs=1 + val_chunk=1 forced by per-sample-ps; staged_canonical v3 mayo_ldct_fitted; per-sample-ps FBP + per-sample model.proj/model.dense_proj swap; bg_target=truth; 321px detector-geometry FOV default (NO fov override). (6) no control return.", "comparison_image": "runs/mayo-ldct-claude-agentic-wu-2015-trainable-search-20260619-01/iterations/iter-0003/comparison.png"}
{"ts": "2026-06-19T23:52:02Z", "run_id": "mayo-ldct-claude-agentic-hammernik-2017-search-20260619-01", "iter": 3, "agent": "hammernik_2017-claude-agentic", "model": "claude-opus-4-8-1m", "change_class": "architecture", "status": "discard", "kept": false, "val_score": 0.7931734919548035, "headroom": 0.0, "params_M": 0.012165, "train_n": 400, "rationale": "hammernik_2017-claude-agentic: vn_T=5, vn_n_filters=16, vn_kernel=11, vn_n_bumps=31, vn_x_range=2.0, vn_lambda_init=0.05, epochs=14, batch_size=2, lr=0.0005, grad_clip=1.0, train_n=200, val_n=214, max_train_s=1000, seed=42, rationale=hammernik_2017 iter-3 (search-20260619-01, corrected 214-slice/321px-FOV metric). ONE KNOB: vn_lambda_init 0.0023 -> 0.05 (~22x DC-weight init). All else held at iter-2 (vn_T=5, vn_n_filters=16, vn_kernel=11, vn_n_bumps=31, vn_x_range=2.0, epochs=14, batch_size=2, lr=5e-4, grad_clip=1.0, train_n=200, val_n=214, max_train_s=1000, seed=42). PRIOR (NUMBERS, corrected metric): iter-1 OOM at batch_size=4 (no recon, hr=0, elapsed 72s); iter-2 = FIRST valid datapoint, val_ssim=0.80123 hr=0 (PSNR 33.91, RMSE 0.00101, baseline_PSNR 34.08 so LD-FBP floor SSIM ~0.84; iter-2 is BELOW the FBP floor), elapsed 887s (train 789.7s, ~5 min budget headroom under the 30-min SLURM kill). iter-1->iter-2 = the first finite point; this is hammernik_2017's first real number under the corrected metric and it sits below baseline. DIAGNOSIS from iter-2 SLURM log 765262: training CONVERGED (loss 2.5e-4 ep1 -> 8.7e-7 ep14, flat by ep5) so epochs-up is INERT (NOT under-training); and CRITICALLY lambda_t stayed pinned at ['0.0023','0.00231','0.00232','0.00232','0.00233'] across ALL 14 epochs -- Adam never grew the learnable DC weight from its init. This solver is PURE IMAGE-DOMAIN: the unrolled update is y <- y - K^T*rho'(K*y) - lam*(y - y_NN) (solver line 141), so lam pulls the recon toward the FBP init y_NN. With lam ~0.0023 the learned-regulariser gradient K^T*rho' dominates the FBP-anchor term, so the VN over-smooths the FBP init DOWN below the ~0.84 baseline (val_ssim 0.80 < FBP). LIMITER = DC weight too small (NOT capacity, NOT epochs). Since lambda_t never moves from init, the init vn_lambda_init IS the lever. vn_lambda_init 0.0023 -> 0.05 makes the FBP-anchor term ~22x stronger so the recon stays pinned near the FBP init instead of being smoothed below it. lr held (campaign record: lr5e-4 optimal, 8e-4 worse for the VN family). HYPOTHESIS: with the DC anchor ~22x stronger, val_ssim clears the ~0.84 FBP floor and hr>0 (predict val_ssim > 0.84). FALSIFIER: if val_ssim stays <=0.84 (still <FBP) the shared-filter-bank regulariser is structurally degrading even under a strong FBP anchor, and iter-4 must attack the regulariser itself (drop vn_n_filters or shrink x_range / tighten the RBF activation) rather than the DC weight. BUDGET (HARD 20-min train+score; sbatch --time=00:30:00): the lambda VALUE does not change per-step compute (same image-domain conv + RBF-bump loop), so cost ~= iter-2: train ~790s + ~100s score(214)+figure ~= 890s, well under the 1800s SLURM kill. MEMORY-SAFE: identical footprint to iter-2 -- batch_size=2 (KEPT, do NOT raise: bs=4 OOMed the 16GB card in the _rho_prime RBF-bump loop at iter-1) + N_k=16 + 31-bump activation across 5 unrolled steps stays within 16 GB. grad_clip=1.0 retained (VN-family NaN-skip stability).", "advice_for_others": "hammernik_2017-claude-agentic: vn_T=5, vn_n_filters=16, vn_kernel=11, vn_n_bumps=31, vn_x_range=2.0, vn_lambda_init=0.05, epochs=14, batch_size=2, lr=0.0005, grad_clip=1.0, train_n=200, val_n=214, max_train_s=1000, seed=42, rationale=hammernik_2017 iter-3 (search-20260619-01, corrected 214-slice/321px-FOV metric). ONE KNOB: vn_lambda_init 0.0023 -> 0.05 (~22x DC-weight init). All else held at iter-2 (vn_T=5, vn_n_filters=16, vn_kernel=11, vn_n_bumps=31, vn_x_range=2.0, epochs=14, batch_size=2, lr=5e-4, grad_clip=1.0, train_n=200, val_n=214, max_train_s=1000, seed=42). PRIOR (NUMBERS, corrected metric): iter-1 OOM at batch_size=4 (no recon, hr=0, elapsed 72s); iter-2 = FIRST valid datapoint, val_ssim=0.80123 hr=0 (PSNR 33.91, RMSE 0.00101, baseline_PSNR 34.08 so LD-FBP floor SSIM ~0.84; iter-2 is BELOW the FBP floor), elapsed 887s (train 789.7s, ~5 min budget headroom under the 30-min SLURM kill). iter-1->iter-2 = the first finite point; this is hammernik_2017's first real number under the corrected metric and it sits below baseline. DIAGNOSIS from iter-2 SLURM log 765262: training CONVERGED (loss 2.5e-4 ep1 -> 8.7e-7 ep14, flat by ep5) so epochs-up is INERT (NOT under-training); and CRITICALLY lambda_t stayed pinned at ['0.0023','0.00231','0.00232','0.00232','0.00233'] across ALL 14 epochs -- Adam never grew the learnable DC weight from its init. This solver is PURE IMAGE-DOMAIN: the unrolled update is y <- y - K^T*rho'(K*y) - lam*(y - y_NN) (solver line 141), so lam pulls the recon toward the FBP init y_NN. With lam ~0.0023 the learned-regulariser gradient K^T*rho' dominates the FBP-anchor term, so the VN over-smooths the FBP init DOWN below the ~0.84 baseline (val_ssim 0.80 < FBP). LIMITER = DC weight too small (NOT capacity, NOT epochs). Since lambda_t never moves from init, the init vn_lambda_init IS the lever. vn_lambda_init 0.0023 -> 0.05 makes the FBP-anchor term ~22x stronger so the recon stays pinned near the FBP init instead of being smoothed below it. lr held (campaign record: lr5e-4 optimal, 8e-4 worse for the VN family). HYPOTHESIS: with the DC anchor ~22x stronger, val_ssim clears the ~0.84 FBP floor and hr>0 (predict val_ssim > 0.84). FALSIFIER: if val_ssim stays <=0.84 (still <FBP) the shared-filter-bank regulariser is structurally degrading even under a strong FBP anchor, and iter-4 must attack the regulariser itself (drop vn_n_filters or shrink x_range / tighten the RBF activation) rather than the DC weight. BUDGET (HARD 20-min train+score; sbatch --time=00:30:00): the lambda VALUE does not change per-step compute (same image-domain conv + RBF-bump loop), so cost ~= iter-2: train ~790s + ~100s score(214)+figure ~= 890s, well under the 1800s SLURM kill. MEMORY-SAFE: identical footprint to iter-2 -- batch_size=2 (KEPT, do NOT raise: bs=4 OOMed the 16GB card in the _rho_prime RBF-bump loop at iter-1) + N_k=16 + 31-bump activation across 5 unrolled steps stays within 16 GB. grad_clip=1.0 retained (VN-family NaN-skip stability).", "comparison_image": "runs/mayo-ldct-claude-agentic-hammernik-2017-search-20260619-01/iterations/iter-0003/comparison.png"}
{"ts": "2026-06-19T23:37:05Z", "run_id": "mayo-ldct-claude-agentic-dual-domain-bilateral-supervised-search-20260619-01", "iter": 3, "agent": "dual_domain_bilateral_supervised-claude-agentic", "model": "claude-opus-4-8-1m", "change_class": "architecture", "status": "discard", "kept": false, "val_score": 0.9056902527809143, "headroom": 0.0, "params_M": 2.1e-05, "train_n": 400, "rationale": "dual_domain_bilateral_supervised-claude-agentic: proj_n_bf=1, img_n_bf=6, proj_kernel=3, proj_sx=0.01, proj_sy=0.3, proj_sr=0.0005, img_kernel=5, img_sx=0.5, img_sy=0.5, img_sr=0.02, lr=0.005, epochs=24, batch_size=1, val_chunk=1, train_n=200, val_n=214, grad_clip=1.0, lambda_neg=1.0, seed=42, rationale=ITER-3 (search-20260619-01, corrected 214-slice/321px-FOV metric). ONE KNOB: img_n_bf 3->6 (image-domain bilateral DEPTH; 12->21 trainable params, formula 3*(proj_n_bf+img_n_bf)). All else identical to iter-2 (epochs KEPT at 24 -- proven inert, see below). SIX-BOX (NUMBERS): (1) iter-1 = SSIM 0.919181 / hr 0.027984 in 254.3s @ ep8; iter-2 = SSIM 0.919155 / hr 0.028237 in 449.6s @ ep24 -- params_M 1.2e-05 (=12 params, proj_n_bf=1 img_n_bf=3). FLAT: ep8->24 moved SSIM 0.91918->0.91916 (-0.00003) and hr 0.02798->0.02824 (+0.0003, noise). (2) FAILURE MODE: NOT under-training -- the 3x-epoch iter-2 falsified the under-training hypothesis. The 12-param trainable bilateral is at a CAPACITY CEILING on the 2304-view Mayo FBP: only 4 scalar-sigma filters (1 proj + 3 img), too few DOF to push the calibrated RMSE-sensitive headroom past ~0.028 no matter how long they train. epochs is INERT (proven), so the lever is CAPACITY. (3) ONE KNOB = img_n_bf 3->6 (NOT epochs -- proven flat; NOT proj_n_bf -- image-domain is where the FBP-residual noise lives and where added depth has the most leverage; NOT img_sr -- a sigma re-tune is a within-capacity move that the inert epochs already explored via MSE). img_n_bf 3->6 DOUBLES image-domain bilateral depth: 4->7 BFs, params 12->21. (4) HYPOTHESIS: more image-domain bilateral filters (21 vs 12 params) lift hr/SSIM above the 0.9192 ceiling, because added filter DOF let the cascade approximate a richer (less purely-smoothing) image-domain denoiser that the RMSE-driven supervised-MSE loss can exploit. FALSIFIER: if hr stays <=~0.029 (flat) at img_n_bf=6, the dual-domain trainable-bilateral architecture is STRUCTURALLY capped on Mayo regardless of filter count -> iter-4 attacks the OTHER domain (proj_n_bf up) or the kernel size (img_kernel 5->7), not more img depth. (5) BUDGET: HARD 20-min (1200s) train+score. iter-2 @ ep24 ran in 449.6s; per-step cost is dominated by the SHARED 2304-view FBP adjoint, NOT the BF params, so adding 3 image-domain BFs (4->7 total) costs only a few extra cheap bilateral passes per step -> est ~480-540s, comfortably <1200s (30-min sbatch wall). val_n=214 KEPT (do NOT reduce), grad_clip=1.0 KEPT, epochs=24 KEPT. (6) Loop continues -- no control returned. HARD-WIRED (unchanged): staged_canonical data, v3 mayo_ldct_fitted geometry, per-sample-ps (mayo_per_sample_setup/_fbp, per-sample pipe.R_full swap), bg_target=truth, val=ALL 214 L277 slices under the 321px detector-geometry FOV (evaluate_calibrated default for AGENT4CT_DATASET=mayo_ldct_2d; NO fov= override).", "advice_for_others": "dual_domain_bilateral_supervised-claude-agentic: proj_n_bf=1, img_n_bf=6, proj_kernel=3, proj_sx=0.01, proj_sy=0.3, proj_sr=0.0005, img_kernel=5, img_sx=0.5, img_sy=0.5, img_sr=0.02, lr=0.005, epochs=24, batch_size=1, val_chunk=1, train_n=200, val_n=214, grad_clip=1.0, lambda_neg=1.0, seed=42, rationale=ITER-3 (search-20260619-01, corrected 214-slice/321px-FOV metric). ONE KNOB: img_n_bf 3->6 (image-domain bilateral DEPTH; 12->21 trainable params, formula 3*(proj_n_bf+img_n_bf)). All else identical to iter-2 (epochs KEPT at 24 -- proven inert, see below). SIX-BOX (NUMBERS): (1) iter-1 = SSIM 0.919181 / hr 0.027984 in 254.3s @ ep8; iter-2 = SSIM 0.919155 / hr 0.028237 in 449.6s @ ep24 -- params_M 1.2e-05 (=12 params, proj_n_bf=1 img_n_bf=3). FLAT: ep8->24 moved SSIM 0.91918->0.91916 (-0.00003) and hr 0.02798->0.02824 (+0.0003, noise). (2) FAILURE MODE: NOT under-training -- the 3x-epoch iter-2 falsified the under-training hypothesis. The 12-param trainable bilateral is at a CAPACITY CEILING on the 2304-view Mayo FBP: only 4 scalar-sigma filters (1 proj + 3 img), too few DOF to push the calibrated RMSE-sensitive headroom past ~0.028 no matter how long they train. epochs is INERT (proven), so the lever is CAPACITY. (3) ONE KNOB = img_n_bf 3->6 (NOT epochs -- proven flat; NOT proj_n_bf -- image-domain is where the FBP-residual noise lives and where added depth has the most leverage; NOT img_sr -- a sigma re-tune is a within-capacity move that the inert epochs already explored via MSE). img_n_bf 3->6 DOUBLES image-domain bilateral depth: 4->7 BFs, params 12->21. (4) HYPOTHESIS: more image-domain bilateral filters (21 vs 12 params) lift hr/SSIM above the 0.9192 ceiling, because added filter DOF let the cascade approximate a richer (less purely-smoothing) image-domain denoiser that the RMSE-driven supervised-MSE loss can exploit. FALSIFIER: if hr stays <=~0.029 (flat) at img_n_bf=6, the dual-domain trainable-bilateral architecture is STRUCTURALLY capped on Mayo regardless of filter count -> iter-4 attacks the OTHER domain (proj_n_bf up) or the kernel size (img_kernel 5->7), not more img depth. (5) BUDGET: HARD 20-min (1200s) train+score. iter-2 @ ep24 ran in 449.6s; per-step cost is dominated by the SHARED 2304-view FBP adjoint, NOT the BF params, so adding 3 image-domain BFs (4->7 total) costs only a few extra cheap bilateral passes per step -> est ~480-540s, comfortably <1200s (30-min sbatch wall). val_n=214 KEPT (do NOT reduce), grad_clip=1.0 KEPT, epochs=24 KEPT. (6) Loop continues -- no control returned. HARD-WIRED (unchanged): staged_canonical data, v3 mayo_ldct_fitted geometry, per-sample-ps (mayo_per_sample_setup/_fbp, per-sample pipe.R_full swap), bg_target=truth, val=ALL 214 L277 slices under the 321px detector-geometry FOV (evaluate_calibrated default for AGENT4CT_DATASET=mayo_ldct_2d; NO fov= override).", "comparison_image": "runs/mayo-ldct-claude-agentic-dual-domain-bilateral-supervised-search-20260619-01/iterations/iter-0003/comparison.png"}
