{"ts": "2026-06-20T04:13:02Z", "run_id": "mayo-ldct-claude-agentic-wu-2015-trainable-search-20260619-01", "iter": 4, "agent": "wu_2015_trainable-claude-agentic", "model": "claude-opus-4-8-1m", "change_class": "architecture", "status": "discard", "kept": false, "val_score": 0.6458955407142639, "headroom": 0.0, "params_M": 1e-05, "train_n": 400, "rationale": "wu_2015_trainable-claude-agentic: wu_n_bands=4, wu_n_outer=2, lr=0.01, epochs=6, batch_size=1, val_chunk=1, train_n=200, val_n=214, grad_clip=1.0, lambda_neg=1.0, weight_decay=0.0, loss_base=mse, seed=42, rationale=wu_2015_trainable iter-4 (search-20260619-01, corrected 214-slice/321px-FOV metric). CONFIRMATION / TERMINAL-LEVER iter. SIX-BOX (NUMBERS). (1) PRIOR TRAJECTORY: iter-1 = SSIM 0.8370 / hr 0.0508, 8 params (wu_n_bands=4, wu_n_outer=1, ep6, lr0.01), elapsed 335s -- this is the BEST config. iter-2 = SSIM 0.8390 / hr 0.0337, 8 params (SAME but ep18), elapsed 866.6s -- epochs INERT (val_ssim +0.0020 within noise, hr FELL); the under-training falsifier FIRED. iter-3 = SSIM 0.8273 / hr 0.0, 10 params (wu_n_bands 4->6, ep6), elapsed 358s -- frequency-band capacity++ REGRESSED below the iter-1/2 baseline; the iter-3 falsifier FIRED (capacity bumps DESTABILISE these few-param FBP-family denoisers, matching dd_bilateral img_n_bf 3->6 0.9192->0.9057 and hammernik filters-up that same tick). (2) FAILURE MODE: few-param tuned-FBP ceiling (~hr 0.05). Wu-trainable is a band-reweighted aliasing-free FBP + soft-thresholded dense-residual pass(es) with NO image-domain CNN denoiser; epochs are inert and frequency-band count++ destabilises -- it sits hr~0.04-0.05 just above the LD-FBP floor and neither lever has moved it up. (3) ONE KNOB: wu_n_outer 1->2 (the SINGLE untried capacity lever). I revert wu_n_bands 6->4 to RESTORE the iter-1 BEST config (NOT iter-3's regressed 6 bands), and change ONLY wu_n_outer. This adds a SECOND outer soft-thresholded dense-residual denoising pass (solver forward() loop `for it in range(self.n_outer)`, lines 214-237: each pass = forward_project residual -> feature-preserving interp -> dense FBP -> per-outer soft-threshold -> per-outer learnable blend). It is the LAST structural capacity Wu offers that is orthogonal to the already-falsified epochs/n_bands levers, and it adds image-domain residual-correction depth rather than FBP frequency partitioning. NEW PARAM COUNT: wu_n_bands+2+2*wu_n_outer = 4+2+2*2 = 10 trainable scalars (was 8 at iter-1; iter-3's 6-band/1-outer was also 10) -- the +2 over iter-1 are the per-outer log_soft_thresh + residual_blend for the new second pass. BUDGET JUSTIFICATION: campaign_state flagged wu_n_outer=1 as a 'mandatory' HINT precisely because the 2x-dense-projector residual pass is the DOMINANT per-slice cost and n_outer=2 DOUBLES it. This is the ONE modest n_outer test the budget allows: sized at the iter-1 ep6 anchor (335s at n_outer=1). The doubled residual pass roughly doubles per-sample train+val cost vs iter-1 -> worst-case ~2x335 = ~670s for the dense pass + the band-FBP (unchanged at 4 bands) -> well under the 1200s 20-min budget and the 1800s SLURM kill, with the val FIGURE outside the budget. ep6 is correct: iter-2 PROVED ep6==ep18 (0.837 vs 0.839), so ep6 isolates wu_n_outer as the sole meaningful change AND keeps the doubled-residual run inside the wall. (4) HYPOTHESIS: if a second outer residual-denoising pass buys real image-domain headroom, iter-4 hr rises measurably above the iter-1 best 0.0508 (SSIM > 0.842, >+0.005 over the noise band). FALSIFIER (terminal): if hr <= 0.051 (at/below the iter-1 best) OR SSIM REGRESSES/stays FLAT, then epochs (inert), frequency bands (regressed), AND outer residual depth (this iter) have ALL failed to lift hr -- Wu-trainable is STRUCTURALLY FBP-ceilinged on Mayo regardless of its capacity knobs. File that verdict: the few-param tuned-FBP family caps at hr~0.05 on real-helical Mayo, far below the dual-domain U-Net families (hr~0.27), because it lacks an image-domain learned denoiser. (5) HARD 20-min (1200s) train+score budget, sized via the ep6 anchor with the n_outer=2 doubling accounted for above; val = ALL 214 L277 slices (do NOT reduce); grad_clip=1.0 (MANDATORY Mayo guard -- the 2304-view FBP adjoint overflows otherwise); bs=1 + val_chunk=1 forced by per-sample-ps; staged_canonical v3 mayo_ldct_fitted; per-sample-ps FBP + per-sample model.proj/model.dense_proj swap; bg_target=truth; 321px detector-geometry FOV default (NO fov override). (6) no control return.", "advice_for_others": "wu_2015_trainable-claude-agentic: wu_n_bands=4, wu_n_outer=2, lr=0.01, epochs=6, batch_size=1, val_chunk=1, train_n=200, val_n=214, grad_clip=1.0, lambda_neg=1.0, weight_decay=0.0, loss_base=mse, seed=42, rationale=wu_2015_trainable iter-4 (search-20260619-01, corrected 214-slice/321px-FOV metric). CONFIRMATION / TERMINAL-LEVER iter. SIX-BOX (NUMBERS). (1) PRIOR TRAJECTORY: iter-1 = SSIM 0.8370 / hr 0.0508, 8 params (wu_n_bands=4, wu_n_outer=1, ep6, lr0.01), elapsed 335s -- this is the BEST config. iter-2 = SSIM 0.8390 / hr 0.0337, 8 params (SAME but ep18), elapsed 866.6s -- epochs INERT (val_ssim +0.0020 within noise, hr FELL); the under-training falsifier FIRED. iter-3 = SSIM 0.8273 / hr 0.0, 10 params (wu_n_bands 4->6, ep6), elapsed 358s -- frequency-band capacity++ REGRESSED below the iter-1/2 baseline; the iter-3 falsifier FIRED (capacity bumps DESTABILISE these few-param FBP-family denoisers, matching dd_bilateral img_n_bf 3->6 0.9192->0.9057 and hammernik filters-up that same tick). (2) FAILURE MODE: few-param tuned-FBP ceiling (~hr 0.05). Wu-trainable is a band-reweighted aliasing-free FBP + soft-thresholded dense-residual pass(es) with NO image-domain CNN denoiser; epochs are inert and frequency-band count++ destabilises -- it sits hr~0.04-0.05 just above the LD-FBP floor and neither lever has moved it up. (3) ONE KNOB: wu_n_outer 1->2 (the SINGLE untried capacity lever). I revert wu_n_bands 6->4 to RESTORE the iter-1 BEST config (NOT iter-3's regressed 6 bands), and change ONLY wu_n_outer. This adds a SECOND outer soft-thresholded dense-residual denoising pass (solver forward() loop `for it in range(self.n_outer)`, lines 214-237: each pass = forward_project residual -> feature-preserving interp -> dense FBP -> per-outer soft-threshold -> per-outer learnable blend). It is the LAST structural capacity Wu offers that is orthogonal to the already-falsified epochs/n_bands levers, and it adds image-domain residual-correction depth rather than FBP frequency partitioning. NEW PARAM COUNT: wu_n_bands+2+2*wu_n_outer = 4+2+2*2 = 10 trainable scalars (was 8 at iter-1; iter-3's 6-band/1-outer was also 10) -- the +2 over iter-1 are the per-outer log_soft_thresh + residual_blend for the new second pass. BUDGET JUSTIFICATION: campaign_state flagged wu_n_outer=1 as a 'mandatory' HINT precisely because the 2x-dense-projector residual pass is the DOMINANT per-slice cost and n_outer=2 DOUBLES it. This is the ONE modest n_outer test the budget allows: sized at the iter-1 ep6 anchor (335s at n_outer=1). The doubled residual pass roughly doubles per-sample train+val cost vs iter-1 -> worst-case ~2x335 = ~670s for the dense pass + the band-FBP (unchanged at 4 bands) -> well under the 1200s 20-min budget and the 1800s SLURM kill, with the val FIGURE outside the budget. ep6 is correct: iter-2 PROVED ep6==ep18 (0.837 vs 0.839), so ep6 isolates wu_n_outer as the sole meaningful change AND keeps the doubled-residual run inside the wall. (4) HYPOTHESIS: if a second outer residual-denoising pass buys real image-domain headroom, iter-4 hr rises measurably above the iter-1 best 0.0508 (SSIM > 0.842, >+0.005 over the noise band). FALSIFIER (terminal): if hr <= 0.051 (at/below the iter-1 best) OR SSIM REGRESSES/stays FLAT, then epochs (inert), frequency bands (regressed), AND outer residual depth (this iter) have ALL failed to lift hr -- Wu-trainable is STRUCTURALLY FBP-ceilinged on Mayo regardless of its capacity knobs. File that verdict: the few-param tuned-FBP family caps at hr~0.05 on real-helical Mayo, far below the dual-domain U-Net families (hr~0.27), because it lacks an image-domain learned denoiser. (5) HARD 20-min (1200s) train+score budget, sized via the ep6 anchor with the n_outer=2 doubling accounted for above; val = ALL 214 L277 slices (do NOT reduce); grad_clip=1.0 (MANDATORY Mayo guard -- the 2304-view FBP adjoint overflows otherwise); bs=1 + val_chunk=1 forced by per-sample-ps; staged_canonical v3 mayo_ldct_fitted; per-sample-ps FBP + per-sample model.proj/model.dense_proj swap; bg_target=truth; 321px detector-geometry FOV default (NO fov override). (6) no control return.", "comparison_image": "runs/mayo-ldct-claude-agentic-wu-2015-trainable-search-20260619-01/iterations/iter-0004/comparison.png"}
{"ts": "2026-06-20T04:09:35Z", "run_id": "mayo-ldct-claude-agentic-hammernik-2017-search-20260619-01", "iter": 4, "agent": "hammernik_2017-claude-agentic", "model": "claude-opus-4-8-1m", "change_class": "architecture", "status": "discard", "kept": false, "val_score": 0.7828162312507629, "headroom": 0.0, "params_M": 0.003045, "train_n": 400, "rationale": "hammernik_2017-claude-agentic: vn_T=5, vn_n_filters=4, vn_kernel=11, vn_n_bumps=31, vn_x_range=2.0, vn_lambda_init=0.05, epochs=14, batch_size=2, lr=0.0005, grad_clip=1.0, train_n=200, val_n=214, max_train_s=1000, seed=42, rationale=hammernik_2017 iter-4 (search-20260619-01, corrected 214-slice/321px-FOV metric). TERMINAL regularizer-attack iter. NOTE: the prompt's nominal lever vn_normalize_filters does NOT exist in solver_hammernik_2017.py (verified: this solver is a PURE IMAGE-DOMAIN VN that consumes only vn_T/vn_n_filters/vn_kernel/vn_n_bumps/vn_x_range/vn_*_init_std/vn_lambda_init/epochs/batch_size/lr/grad_clip/train_n/val_n/seed/max_train_s; vn_normalize_filters belongs to the SIBLING projector-in-loop hammernik_vn solver, which is testing exactly that knob in parallel job 765379 iter-4). Per the prompt's explicit fallback and iter-3's own pre-registered falsifier, iter-4 attacks the REGULARIZER ITSELF via the leanest config that avoids the DC-smoothing collapse: ONE KNOB vn_n_filters 16 -> 4 (shrink the analysis-filter bank 4x). All else held at iter-3 (vn_T=5, vn_kernel=11, vn_n_bumps=31, vn_x_range=2.0, vn_lambda_init=0.05, epochs=14, batch_size=2, lr=5e-4, grad_clip=1.0, train_n=200, val_n=214, max_train_s=1000, seed=42). TRAJECTORY (NUMBERS, corrected metric, all hr=0, all BELOW the ~0.84 LD-FBP floor): iter-1 OOM at batch_size=4 (no recon, elapsed 72s); iter-2 SSIM 0.80123 (FIRST valid datapoint, PSNR 33.91, RMSE 0.00101, baseline_PSNR 34.08, elapsed 887s); iter-3 SSIM 0.793173 (vn_lambda_init 0.0023->0.05, DC-weight ~22x UP -> REGRESSED -0.008, PSNR 33.92, RMSE 0.001007, elapsed 895.8s). BOTH levers tried so far regressed: capacity-as-it-was AND DC-weight-up. FAILURE MODE (well-characterized, confirmed cross-sibling): the learned VN regularizer term Sum_i K_i^T rho'_i(K_i y) (solver line 141) is a BLUNT SMOOTHER that degrades the FBP init y_NN below baseline, and at iter-3 lambda_t stayed pinned at init across all 14 epochs (Adam never grew the DC weight), so the lambda-anchor cannot save it. The sibling hammernik_vn shows the SAME signature: iter-1 0.8053 -> iter-2 0.7920 (filters UP regressed) -> iter-3 0.7682 (lambda UP regressed), monotone below FBP. ONE KNOB CHOICE: vn_n_filters 16 -> 4 is the most-diagnostic remaining regularizer attack in THIS solver. Shrinking the analysis-filter bank 4x structurally minimizes the degrees of freedom of the smoothing term Sum_i K_i^T rho'_i(K_i y) -- the leanest learned-regularizer that still leaves a learned term at all. If the iter-1/2/3 degradation is the over-parameterized 16-filter bank collapsing into a low-pass smoother of the FBP init, a 4-filter bank has far less capacity to over-smooth -> the recon should stop sinking below the FBP init. (x_range/kernel held; n_filters is the single cleanest capacity-of-the-regularizer knob.) HYPOTHESIS: with the filter bank shrunk 16->4, the regularizer stops smoothing the FBP init below baseline; val_ssim clears the ~0.84 FBP floor (hr > 0); predict val_ssim > 0.84. FALSIFIER (the terminal one): if val_ssim still <= 0.84 (below FBP) with the leanest regularizer, then hammernik_2017 (and the whole VN family -- the sibling hammernik_vn is exhausting capacity + DC weight + filter-normalization in parallel) is STRUCTURALLY FBP-BOUNDED on real 2304-view rebinned Mayo LDCT regardless of regularizer config -> FILE THE NEGATIVE RESULT: the Hammernik learned-regularizer family does not beat LD-FBP on Mayo. BUDGET (HARD 20-min train+score; sbatch --time=00:30:00): FEWER filters means CHEAPER per-step compute (conv over 4 instead of 16 channels + 4-channel RBF-bump loop), so wall <= iter-3 (895.8s) -- well under the 1800s SLURM kill, >900s margin. MEMORY-SAFE and strictly LIGHTER than iter-3: batch_size=2 KEPT (do NOT raise: bs=4 OOMed the 16GB RTX5000 in the _rho_prime RBF-bump loop at iter-1), and N_k 16->4 further shrinks the (B,F,H,W) activation tensors held across 5 unrolled steps. grad_clip=1.0 retained (VN-family NaN-skip stability).", "advice_for_others": "hammernik_2017-claude-agentic: vn_T=5, vn_n_filters=4, vn_kernel=11, vn_n_bumps=31, vn_x_range=2.0, vn_lambda_init=0.05, epochs=14, batch_size=2, lr=0.0005, grad_clip=1.0, train_n=200, val_n=214, max_train_s=1000, seed=42, rationale=hammernik_2017 iter-4 (search-20260619-01, corrected 214-slice/321px-FOV metric). TERMINAL regularizer-attack iter. NOTE: the prompt's nominal lever vn_normalize_filters does NOT exist in solver_hammernik_2017.py (verified: this solver is a PURE IMAGE-DOMAIN VN that consumes only vn_T/vn_n_filters/vn_kernel/vn_n_bumps/vn_x_range/vn_*_init_std/vn_lambda_init/epochs/batch_size/lr/grad_clip/train_n/val_n/seed/max_train_s; vn_normalize_filters belongs to the SIBLING projector-in-loop hammernik_vn solver, which is testing exactly that knob in parallel job 765379 iter-4). Per the prompt's explicit fallback and iter-3's own pre-registered falsifier, iter-4 attacks the REGULARIZER ITSELF via the leanest config that avoids the DC-smoothing collapse: ONE KNOB vn_n_filters 16 -> 4 (shrink the analysis-filter bank 4x). All else held at iter-3 (vn_T=5, vn_kernel=11, vn_n_bumps=31, vn_x_range=2.0, vn_lambda_init=0.05, epochs=14, batch_size=2, lr=5e-4, grad_clip=1.0, train_n=200, val_n=214, max_train_s=1000, seed=42). TRAJECTORY (NUMBERS, corrected metric, all hr=0, all BELOW the ~0.84 LD-FBP floor): iter-1 OOM at batch_size=4 (no recon, elapsed 72s); iter-2 SSIM 0.80123 (FIRST valid datapoint, PSNR 33.91, RMSE 0.00101, baseline_PSNR 34.08, elapsed 887s); iter-3 SSIM 0.793173 (vn_lambda_init 0.0023->0.05, DC-weight ~22x UP -> REGRESSED -0.008, PSNR 33.92, RMSE 0.001007, elapsed 895.8s). BOTH levers tried so far regressed: capacity-as-it-was AND DC-weight-up. FAILURE MODE (well-characterized, confirmed cross-sibling): the learned VN regularizer term Sum_i K_i^T rho'_i(K_i y) (solver line 141) is a BLUNT SMOOTHER that degrades the FBP init y_NN below baseline, and at iter-3 lambda_t stayed pinned at init across all 14 epochs (Adam never grew the DC weight), so the lambda-anchor cannot save it. The sibling hammernik_vn shows the SAME signature: iter-1 0.8053 -> iter-2 0.7920 (filters UP regressed) -> iter-3 0.7682 (lambda UP regressed), monotone below FBP. ONE KNOB CHOICE: vn_n_filters 16 -> 4 is the most-diagnostic remaining regularizer attack in THIS solver. Shrinking the analysis-filter bank 4x structurally minimizes the degrees of freedom of the smoothing term Sum_i K_i^T rho'_i(K_i y) -- the leanest learned-regularizer that still leaves a learned term at all. If the iter-1/2/3 degradation is the over-parameterized 16-filter bank collapsing into a low-pass smoother of the FBP init, a 4-filter bank has far less capacity to over-smooth -> the recon should stop sinking below the FBP init. (x_range/kernel held; n_filters is the single cleanest capacity-of-the-regularizer knob.) HYPOTHESIS: with the filter bank shrunk 16->4, the regularizer stops smoothing the FBP init below baseline; val_ssim clears the ~0.84 FBP floor (hr > 0); predict val_ssim > 0.84. FALSIFIER (the terminal one): if val_ssim still <= 0.84 (below FBP) with the leanest regularizer, then hammernik_2017 (and the whole VN family -- the sibling hammernik_vn is exhausting capacity + DC weight + filter-normalization in parallel) is STRUCTURALLY FBP-BOUNDED on real 2304-view rebinned Mayo LDCT regardless of regularizer config -> FILE THE NEGATIVE RESULT: the Hammernik learned-regularizer family does not beat LD-FBP on Mayo. BUDGET (HARD 20-min train+score; sbatch --time=00:30:00): FEWER filters means CHEAPER per-step compute (conv over 4 instead of 16 channels + 4-channel RBF-bump loop), so wall <= iter-3 (895.8s) -- well under the 1800s SLURM kill, >900s margin. MEMORY-SAFE and strictly LIGHTER than iter-3: batch_size=2 KEPT (do NOT raise: bs=4 OOMed the 16GB RTX5000 in the _rho_prime RBF-bump loop at iter-1), and N_k 16->4 further shrinks the (B,F,H,W) activation tensors held across 5 unrolled steps. grad_clip=1.0 retained (VN-family NaN-skip stability).", "comparison_image": "runs/mayo-ldct-claude-agentic-hammernik-2017-search-20260619-01/iterations/iter-0004/comparison.png"}
