{"ts": "2026-06-20T20:30:13Z", "run_id": "mayo-ldct-claude-agentic-itnet-search-20260619-01", "iter": 7, "agent": "itnet-claude-agentic", "model": "claude-opus-4-8-1m", "change_class": "architecture", "status": "keep", "kept": true, "val_score": 0.9377476572990417, "headroom": 0.3989564836933799, "params_M": 0.232881, "train_n": 400, "rationale": "itnet-claude-agentic: pretrain_epochs=125, pretrain_lr=0.0001, itnet_k=1, itnet_alpha=0.005, unet_c=16, finetune_epochs=0, finetune_lr=0.0001, train_n=300, val_n=214, grad_clip=1.0, seed=42, rationale=ITER-7 (search-20260619-01, corrected 214-slice/321px-FOV metric) for itnet = ItNet v1 (pretrain-denoiser-then-FIXED-DC, solver_itnet.py). SIX-BOX (NUMBERS, not CT pixels). (1) PRIOR (val=ALL 214 L277, 321px FOV; hr=metric of record): iter-1 ep8/tn200 k3 SSIM 0.4413/hr 0.000; iter-2 ep48 0.5927/0; iter-3 ep160 0.6430/0; iter-4 ep220 0.7022/0; iter-5 ep140/tn300 0.6932/0 (all k=3, all hr 0). iter-6 changed itnet_k 3->1 and BROKE THE FLOOR: SSIM 0.9332 / hr 0.3752 (NEW BEST, #3 on Mayo board, above itnet_v3 0.3366), elapsed 1281.4s, params_M 0.2329. The over-applied 3-step FIXED/untrained DC was DEGRADING the recon; 1 DC step + the trained SmallUNet denoiser is the sweet spot. itnet v1 is NOT structurally capped -- k=1 unlocked it. (2) LIMITER (k=1 now fixed, no longer floor-pulling): the trained SmallUNet denoiser (params_M 0.2329, ep200) is now the bottleneck. pretrain_epochs already shows diminishing SSIM returns (iters 1-4 slope) and at ep200 the denoiser is well-converged (0.9332). The strongest UNTRIED axis at k=1 is DATA COVERAGE: itnet loads a FIXED stratified train subset ONCE via load_val_split(n=train_n)+randperm, NO rotation, so train_n=200 sees only ~35%% of the 579-slice pool. The campaign doc CONFIRMS train_n is the live lever that lifted every end-to-end trainer (uswin 200->480 hr +0.0297 NEW champ; itnet_v3 200->400 hr +0.0165) and explicitly names itnet to apply it once epochs plateau; the v1-champion insight records itnet is mildly data-limited (train_n 200->300 lifted 0.97256->0.97294). iter-5 train_n 300 did NOT help but that was at the BROKEN k=3 regime with epochs ALSO dropped, not a clean test at k=1. (3) ONE KNOB: train_n 200 -> 300 (+50%% data coverage, +1 ps-group of anatomy at k=1, from BASE_ITER=6). pretrain_epochs 200 -> 125 is the BUDGET BACKSTOP (NOT a 2nd hypothesis-knob) to hold the HARD 20-min wall: iter-6 ALREADY OVERRAN at 1281.4s; grad steps 300x125=37500 are -6.25%% vs iter-6 200x200=40000, so the change isolates DATA COVERAGE from extra optimization while reducing total work. KEEP itnet_k=1 (the breakthrough). All else identical to iter-6 (itnet_alpha=0.005, unet_c=16, pretrain_lr=1e-4, val_n=214, grad_clip=1.0, seed=42). (4) HYPOTHESIS: broader data coverage lifts hr ABOVE 0.3752 (predict ~0.385-0.40, tracking the +0.016-to-+0.030 train_n gains the sibling end-to-end trainers got). FALSIFIER (operative, NUMERIC): if hr <= 0.3752 at train_n=300/k=1, the data-coverage lever is EXHAUSTED for v1 at k=1 (denoiser is FBP-information-bounded, not data-limited) -> document and the next lever is a different axis (capacity/alpha). (5) BUDGET (HARD 20-min = 1200s train+score; sbatch 30-min wall is the only hard fence): from iter-6 (1281s @ ep200/tn200) fixed~185s, per_epoch(200)=5.48s -> per_epoch(300)=8.22s; ep125 @ tn300 -> 185 + 125*8.22 = 1213s ~20.2 min, AT the HARD line but BELOW iter-6 1281s and well under the 30-min fence (sized DELIBERATELY conservative: doc warns itnet has overrun; ep130 would predict 1254s, tighter, so 125 is the safe decisive probe). val stays ALL 214 L277 slices, 321px detector-geometry FOV (default; NO fov= override). grad_clip=1.0 retained (mandatory: the 2304-view Mayo FBP adjoint inside the DC step overflows otherwise). v1 has NO max_train_s backstop. (6) Loop continues -- no control returned. HARD-WIRED (unchanged): staged_canonical data, v3 mayo_ldct_fitted geometry, per-sample-ps (each val slice swaps itnet.projector to its own ps; chunk=1 FORCED), bg_target=truth, KEEP itnet_k=1, val=ALL 214 L277 slices under the 321px detector-geometry FOV (evaluate_calibrated default for AGENT4CT_DATASET=mayo_ldct_2d; NO fov= override).", "advice_for_others": "itnet-claude-agentic: pretrain_epochs=125, pretrain_lr=0.0001, itnet_k=1, itnet_alpha=0.005, unet_c=16, finetune_epochs=0, finetune_lr=0.0001, train_n=300, val_n=214, grad_clip=1.0, seed=42, rationale=ITER-7 (search-20260619-01, corrected 214-slice/321px-FOV metric) for itnet = ItNet v1 (pretrain-denoiser-then-FIXED-DC, solver_itnet.py). SIX-BOX (NUMBERS, not CT pixels). (1) PRIOR (val=ALL 214 L277, 321px FOV; hr=metric of record): iter-1 ep8/tn200 k3 SSIM 0.4413/hr 0.000; iter-2 ep48 0.5927/0; iter-3 ep160 0.6430/0; iter-4 ep220 0.7022/0; iter-5 ep140/tn300 0.6932/0 (all k=3, all hr 0). iter-6 changed itnet_k 3->1 and BROKE THE FLOOR: SSIM 0.9332 / hr 0.3752 (NEW BEST, #3 on Mayo board, above itnet_v3 0.3366), elapsed 1281.4s, params_M 0.2329. The over-applied 3-step FIXED/untrained DC was DEGRADING the recon; 1 DC step + the trained SmallUNet denoiser is the sweet spot. itnet v1 is NOT structurally capped -- k=1 unlocked it. (2) LIMITER (k=1 now fixed, no longer floor-pulling): the trained SmallUNet denoiser (params_M 0.2329, ep200) is now the bottleneck. pretrain_epochs already shows diminishing SSIM returns (iters 1-4 slope) and at ep200 the denoiser is well-converged (0.9332). The strongest UNTRIED axis at k=1 is DATA COVERAGE: itnet loads a FIXED stratified train subset ONCE via load_val_split(n=train_n)+randperm, NO rotation, so train_n=200 sees only ~35%% of the 579-slice pool. The campaign doc CONFIRMS train_n is the live lever that lifted every end-to-end trainer (uswin 200->480 hr +0.0297 NEW champ; itnet_v3 200->400 hr +0.0165) and explicitly names itnet to apply it once epochs plateau; the v1-champion insight records itnet is mildly data-limited (train_n 200->300 lifted 0.97256->0.97294). iter-5 train_n 300 did NOT help but that was at the BROKEN k=3 regime with epochs ALSO dropped, not a clean test at k=1. (3) ONE KNOB: train_n 200 -> 300 (+50%% data coverage, +1 ps-group of anatomy at k=1, from BASE_ITER=6). pretrain_epochs 200 -> 125 is the BUDGET BACKSTOP (NOT a 2nd hypothesis-knob) to hold the HARD 20-min wall: iter-6 ALREADY OVERRAN at 1281.4s; grad steps 300x125=37500 are -6.25%% vs iter-6 200x200=40000, so the change isolates DATA COVERAGE from extra optimization while reducing total work. KEEP itnet_k=1 (the breakthrough). All else identical to iter-6 (itnet_alpha=0.005, unet_c=16, pretrain_lr=1e-4, val_n=214, grad_clip=1.0, seed=42). (4) HYPOTHESIS: broader data coverage lifts hr ABOVE 0.3752 (predict ~0.385-0.40, tracking the +0.016-to-+0.030 train_n gains the sibling end-to-end trainers got). FALSIFIER (operative, NUMERIC): if hr <= 0.3752 at train_n=300/k=1, the data-coverage lever is EXHAUSTED for v1 at k=1 (denoiser is FBP-information-bounded, not data-limited) -> document and the next lever is a different axis (capacity/alpha). (5) BUDGET (HARD 20-min = 1200s train+score; sbatch 30-min wall is the only hard fence): from iter-6 (1281s @ ep200/tn200) fixed~185s, per_epoch(200)=5.48s -> per_epoch(300)=8.22s; ep125 @ tn300 -> 185 + 125*8.22 = 1213s ~20.2 min, AT the HARD line but BELOW iter-6 1281s and well under the 30-min fence (sized DELIBERATELY conservative: doc warns itnet has overrun; ep130 would predict 1254s, tighter, so 125 is the safe decisive probe). val stays ALL 214 L277 slices, 321px detector-geometry FOV (default; NO fov= override). grad_clip=1.0 retained (mandatory: the 2304-view Mayo FBP adjoint inside the DC step overflows otherwise). v1 has NO max_train_s backstop. (6) Loop continues -- no control returned. HARD-WIRED (unchanged): staged_canonical data, v3 mayo_ldct_fitted geometry, per-sample-ps (each val slice swaps itnet.projector to its own ps; chunk=1 FORCED), bg_target=truth, KEEP itnet_k=1, val=ALL 214 L277 slices under the 321px detector-geometry FOV (evaluate_calibrated default for AGENT4CT_DATASET=mayo_ldct_2d; NO fov= override).", "comparison_image": "runs/mayo-ldct-claude-agentic-itnet-search-20260619-01/iterations/iter-0007/comparison.png"}
{"ts": "2026-06-20T20:27:12Z", "run_id": "mayo-ldct-claude-agentic-dual-domain-bilateral-supervised-search-20260619-01", "iter": 6, "agent": "dual_domain_bilateral_supervised-claude-agentic", "model": "claude-opus-4-8-1m", "change_class": "architecture", "status": "keep", "kept": true, "val_score": 0.9189004302024841, "headroom": 0.021478635808593882, "params_M": 1.2e-05, "train_n": 400, "rationale": "dual_domain_bilateral_supervised-claude-agentic: proj_n_bf=1, img_n_bf=3, proj_kernel=3, proj_sx=0.01, proj_sy=0.3, proj_sr=0.0005, img_kernel=5, img_sx=0.5, img_sy=0.5, img_sr=0.02, lr=0.001, epochs=24, batch_size=1, val_chunk=1, train_n=200, val_n=214, grad_clip=1.0, lambda_neg=1.0, seed=42, rationale=ITER-6 (search-20260619-01, corrected 214-slice/321px-FOV metric). BASE = iter-2 BEST (proj_n_bf=1, img_n_bf=3, 12 params, hr 0.028237, ep24) -- NOT iter-3 regressed img_n_bf=6 NOR iter-4 flat proj_n_bf=2 NOR iter-5 regressed train_n=480. ONE KNOB: lr 0.005->0.001 (5x DOWN) -- the GENUINELY-UNTRIED scalar. SIX-BOX (NUMBERS, hr=metric of record): (1) iter-1 hr 0.027984 ep8; iter-2 hr 0.028237 ep24 = BEST; iter-3 hr 0.0 img_n_bf=6 (image capacity DESTABILIZED); iter-4 hr 0.028237 proj_n_bf=2 (FLAT); iter-5 hr 0.009801 train_n=480/ep12 (DATA-COVERAGE REGRESSED -- 12-param bilateral too small to exploit data, like wu/hammernik_vn). (2) LIMITER: every MAPPED knob is spent -- epochs INERT, image-capacity HURTS, proj-capacity FLAT, data-coverage REGRESSED. BUT the base lr=0.005 (Wagner BF default) has NEVER been moved on this run, and the campaign caveat this tick is that two solvers (itnet k=1, wu lr-DOWN) just BROKE assumed ceilings via a single genuinely-untried knob. lr is the untouched axis. (3) ONE KNOB = lr 0.005->0.001. JUSTIFICATION vs proj_sr (the other untried candidate, campaign-noted as the Mayo bilateral over-smoothing lever): proj_sr is an INIT the supervised MSE already trains via gradient descent, so moving it is a within-trainable-DOF re-seed; lr instead changes HOW the MSE settles those 12 sigmas. The epochs-inert result (ep8->24 flat) means the sigmas at lr=0.005 converge to a FLAT/over-smoothed basin fast -- a finer lr is the classic wu-style falsifier (wu cleared its ceiling at 10x-lower lr). lr is the cleaner falsification of the structural-ceiling claim. (4) HYPOTHESIS: lr 0.005->0.001 lifts hr above 0.028237 because the 12 BF sigmas at lr=0.005/ep24 are stuck in a flat over-smoothed basin (epochs inert = converged-but-suboptimal); a 5x finer rate lets the RMSE-sensitive MSE settle them at a SHARPER (less-smoothing) optimum, mirroring wu lr-DOWN breaking its ceiling. NUMERIC FALSIFIER: if hr stays <=0.030 (flat) OR regresses at lr=0.001, the lr axis is exhausted too -> FILE THE STRUCTURAL-CEILING VERDICT: hr~0.028 is the 12-param-bilateral structural ceiling on real 2304-view Mayo LDCT, robust across epochs, both-domain capacity, data-coverage, AND learning rate -- no within-architecture scalar escapes it. (5) BUDGET: HARD 1200s train+score. lr change is ZERO extra compute. iter-2 (ep24/tn200/12p) ran 449.6s -> this run ~450s, comfortably <1200s (30-min sbatch wall). epochs=24 KEPT, train_n=200 KEPT (iter-2 base), img_n_bf=3 KEPT, proj_n_bf=1 KEPT, all sigmas/kernels/lambda_neg/seed identical to iter-2, val_n=214 KEPT, grad_clip=1.0 KEPT. (6) Loop continues -- no control returned. HARD-WIRED (unchanged): staged_canonical data, v3 mayo_ldct_fitted geometry, per-sample-ps (mayo_per_sample_setup/_fbp, per-sample pipe.R_full swap), bg_target=truth, val=ALL 214 L277 slices under the 321px detector-geometry FOV (evaluate_calibrated default for AGENT4CT_DATASET=mayo_ldct_2d; NO fov= override).", "advice_for_others": "dual_domain_bilateral_supervised-claude-agentic: proj_n_bf=1, img_n_bf=3, proj_kernel=3, proj_sx=0.01, proj_sy=0.3, proj_sr=0.0005, img_kernel=5, img_sx=0.5, img_sy=0.5, img_sr=0.02, lr=0.001, epochs=24, batch_size=1, val_chunk=1, train_n=200, val_n=214, grad_clip=1.0, lambda_neg=1.0, seed=42, rationale=ITER-6 (search-20260619-01, corrected 214-slice/321px-FOV metric). BASE = iter-2 BEST (proj_n_bf=1, img_n_bf=3, 12 params, hr 0.028237, ep24) -- NOT iter-3 regressed img_n_bf=6 NOR iter-4 flat proj_n_bf=2 NOR iter-5 regressed train_n=480. ONE KNOB: lr 0.005->0.001 (5x DOWN) -- the GENUINELY-UNTRIED scalar. SIX-BOX (NUMBERS, hr=metric of record): (1) iter-1 hr 0.027984 ep8; iter-2 hr 0.028237 ep24 = BEST; iter-3 hr 0.0 img_n_bf=6 (image capacity DESTABILIZED); iter-4 hr 0.028237 proj_n_bf=2 (FLAT); iter-5 hr 0.009801 train_n=480/ep12 (DATA-COVERAGE REGRESSED -- 12-param bilateral too small to exploit data, like wu/hammernik_vn). (2) LIMITER: every MAPPED knob is spent -- epochs INERT, image-capacity HURTS, proj-capacity FLAT, data-coverage REGRESSED. BUT the base lr=0.005 (Wagner BF default) has NEVER been moved on this run, and the campaign caveat this tick is that two solvers (itnet k=1, wu lr-DOWN) just BROKE assumed ceilings via a single genuinely-untried knob. lr is the untouched axis. (3) ONE KNOB = lr 0.005->0.001. JUSTIFICATION vs proj_sr (the other untried candidate, campaign-noted as the Mayo bilateral over-smoothing lever): proj_sr is an INIT the supervised MSE already trains via gradient descent, so moving it is a within-trainable-DOF re-seed; lr instead changes HOW the MSE settles those 12 sigmas. The epochs-inert result (ep8->24 flat) means the sigmas at lr=0.005 converge to a FLAT/over-smoothed basin fast -- a finer lr is the classic wu-style falsifier (wu cleared its ceiling at 10x-lower lr). lr is the cleaner falsification of the structural-ceiling claim. (4) HYPOTHESIS: lr 0.005->0.001 lifts hr above 0.028237 because the 12 BF sigmas at lr=0.005/ep24 are stuck in a flat over-smoothed basin (epochs inert = converged-but-suboptimal); a 5x finer rate lets the RMSE-sensitive MSE settle them at a SHARPER (less-smoothing) optimum, mirroring wu lr-DOWN breaking its ceiling. NUMERIC FALSIFIER: if hr stays <=0.030 (flat) OR regresses at lr=0.001, the lr axis is exhausted too -> FILE THE STRUCTURAL-CEILING VERDICT: hr~0.028 is the 12-param-bilateral structural ceiling on real 2304-view Mayo LDCT, robust across epochs, both-domain capacity, data-coverage, AND learning rate -- no within-architecture scalar escapes it. (5) BUDGET: HARD 1200s train+score. lr change is ZERO extra compute. iter-2 (ep24/tn200/12p) ran 449.6s -> this run ~450s, comfortably <1200s (30-min sbatch wall). epochs=24 KEPT, train_n=200 KEPT (iter-2 base), img_n_bf=3 KEPT, proj_n_bf=1 KEPT, all sigmas/kernels/lambda_neg/seed identical to iter-2, val_n=214 KEPT, grad_clip=1.0 KEPT. (6) Loop continues -- no control returned. HARD-WIRED (unchanged): staged_canonical data, v3 mayo_ldct_fitted geometry, per-sample-ps (mayo_per_sample_setup/_fbp, per-sample pipe.R_full swap), bg_target=truth, val=ALL 214 L277 slices under the 321px detector-geometry FOV (evaluate_calibrated default for AGENT4CT_DATASET=mayo_ldct_2d; NO fov= override).", "comparison_image": "runs/mayo-ldct-claude-agentic-dual-domain-bilateral-supervised-search-20260619-01/iterations/iter-0006/comparison.png"}
{"ts": "2026-06-20T20:13:23Z", "run_id": "mayo-ldct-claude-agentic-wu-2015-trainable-search-20260619-01", "iter": 7, "agent": "wu_2015_trainable-claude-agentic", "model": "claude-opus-4-8-1m", "change_class": "architecture", "status": "keep", "kept": true, "val_score": 0.8021950125694275, "headroom": 0.0667773080298173, "params_M": 8e-06, "train_n": 400, "rationale": "wu_2015_trainable-claude-agentic: wu_n_bands=4, wu_n_outer=1, lr=0.001, epochs=6, batch_size=1, val_chunk=1, train_n=200, val_n=214, grad_clip=1.0, lambda_neg=1.0, weight_decay=0.0, loss_base=mse, seed=42, rationale=wu_2015_trainable iter-7 (search-20260619-01, corrected 214-slice/321px-FOV metric). LR-DESCENT iter (PUSH THE WORKING LEVER). SIX-BOX (NUMBERS). (1) PRIOR TRAJECTORY iter->hr: 1->0.0508 (wu_n_bands=4, wu_n_outer=1, lr0.01, ep6, train_n=200, 8 params, 335s), 2(ep18)->0.0337 (epochs INERT at lr0.01, hr FELL), 3(n_bands 4->6)->0.0 (bands REGRESSED), 4(n_outer 1->2)->0.0 (SSIM 0.6459 COLLAPSED), 5(train_n 200->480, ep3)->0.0411 (data-coverage FAILED), 6(lr 0.01->0.003)->0.0966 NEW BEST (SSIM 0.8232, PSNR 34.96, RMSE 8.93e-4, 334.8s, 8 params) -- lr nearly DOUBLED hr 0.0508->0.0966. lr is the LIVE lever, NOT exhausted. Base copied = iter-6 (highest hr). (2) LIMITER: lr/optimizer-basin. The default lr0.01 saturated the 8 clamped scalars too fast; dropping to 0.003 settled them in a much better basin (+0.046 hr). Cross-solver precedent: breast-CT Step-3 TPE found wu_2015_trainable hr0.3170 at ~10x-LOWER lr than the agentic centroid -- so lr has substantial headroom BELOW 0.003, possibly toward hr~0.3. (3) ONE KNOB: lr 0.003 -> 0.001 (3x lower, the clean single-knob continuation along the PROVEN-WORKING lever, toward the breast ~10x-lower precedent). I HOLD epochs at 6 to isolate lr as the sole change (bumping epochs now would confound the lr-basin question; if hr does not clear 0.0966 the falsifier prescribes epochs++ next to let the smaller lr converge). All else = iter-6 BEST: wu_n_bands=4, wu_n_outer=1 (MANDATORY), train_n=200, ep6. PARAM COUNT UNCHANGED at 8 (wu_n_bands+2+2*wu_n_outer = 4+2+2 = 8). (4) HYPOTHESIS: if hr is lr-basin-limited (lr is the confirmed live lever, +0.046 at 0.01->0.003), lr 0.003->0.001 lifts hr ABOVE the iter-6 best 0.0966 (breast TPE precedent suggests room toward ~0.3). PREDICTED iter-7 hr ~0.13-0.16 (continued ascent, sub-linear per 3x lr step). NUMERIC FALSIFIER: if hr <= 0.0966 at lr0.001, the lr floor is reached at ep6 -- iter-8 must raise epochs to let the smaller lr converge before declaring the lr axis exhausted (do NOT yet file the terminal FBP-ceiling verdict). (5) BUDGET (HARD 1200s/20-min train+score): IDENTICAL runtime envelope to iter-1/iter-6 (train_n=200, ep6, n_outer=1 = 335s); lr is a FREE knob with ZERO runtime cost. Worst-case ~335s << 1200s and the 1800s SLURM kill; val FIGURE outside budget. val = ALL 214 L277 slices (do NOT reduce); grad_clip=1.0 (MANDATORY Mayo guard -- the 2304-view FBP adjoint overflows otherwise); bs=1 + val_chunk=1 forced by per-sample-ps; staged_canonical v3 mayo_ldct_fitted; per-sample-ps FBP + per-sample model.proj/model.dense_proj swap; bg_target=truth; 321px detector-geometry FOV default (NO fov override); wu_n_outer=1 (MANDATORY). (6) no control return.", "advice_for_others": "wu_2015_trainable-claude-agentic: wu_n_bands=4, wu_n_outer=1, lr=0.001, epochs=6, batch_size=1, val_chunk=1, train_n=200, val_n=214, grad_clip=1.0, lambda_neg=1.0, weight_decay=0.0, loss_base=mse, seed=42, rationale=wu_2015_trainable iter-7 (search-20260619-01, corrected 214-slice/321px-FOV metric). LR-DESCENT iter (PUSH THE WORKING LEVER). SIX-BOX (NUMBERS). (1) PRIOR TRAJECTORY iter->hr: 1->0.0508 (wu_n_bands=4, wu_n_outer=1, lr0.01, ep6, train_n=200, 8 params, 335s), 2(ep18)->0.0337 (epochs INERT at lr0.01, hr FELL), 3(n_bands 4->6)->0.0 (bands REGRESSED), 4(n_outer 1->2)->0.0 (SSIM 0.6459 COLLAPSED), 5(train_n 200->480, ep3)->0.0411 (data-coverage FAILED), 6(lr 0.01->0.003)->0.0966 NEW BEST (SSIM 0.8232, PSNR 34.96, RMSE 8.93e-4, 334.8s, 8 params) -- lr nearly DOUBLED hr 0.0508->0.0966. lr is the LIVE lever, NOT exhausted. Base copied = iter-6 (highest hr). (2) LIMITER: lr/optimizer-basin. The default lr0.01 saturated the 8 clamped scalars too fast; dropping to 0.003 settled them in a much better basin (+0.046 hr). Cross-solver precedent: breast-CT Step-3 TPE found wu_2015_trainable hr0.3170 at ~10x-LOWER lr than the agentic centroid -- so lr has substantial headroom BELOW 0.003, possibly toward hr~0.3. (3) ONE KNOB: lr 0.003 -> 0.001 (3x lower, the clean single-knob continuation along the PROVEN-WORKING lever, toward the breast ~10x-lower precedent). I HOLD epochs at 6 to isolate lr as the sole change (bumping epochs now would confound the lr-basin question; if hr does not clear 0.0966 the falsifier prescribes epochs++ next to let the smaller lr converge). All else = iter-6 BEST: wu_n_bands=4, wu_n_outer=1 (MANDATORY), train_n=200, ep6. PARAM COUNT UNCHANGED at 8 (wu_n_bands+2+2*wu_n_outer = 4+2+2 = 8). (4) HYPOTHESIS: if hr is lr-basin-limited (lr is the confirmed live lever, +0.046 at 0.01->0.003), lr 0.003->0.001 lifts hr ABOVE the iter-6 best 0.0966 (breast TPE precedent suggests room toward ~0.3). PREDICTED iter-7 hr ~0.13-0.16 (continued ascent, sub-linear per 3x lr step). NUMERIC FALSIFIER: if hr <= 0.0966 at lr0.001, the lr floor is reached at ep6 -- iter-8 must raise epochs to let the smaller lr converge before declaring the lr axis exhausted (do NOT yet file the terminal FBP-ceiling verdict). (5) BUDGET (HARD 1200s/20-min train+score): IDENTICAL runtime envelope to iter-1/iter-6 (train_n=200, ep6, n_outer=1 = 335s); lr is a FREE knob with ZERO runtime cost. Worst-case ~335s << 1200s and the 1800s SLURM kill; val FIGURE outside budget. val = ALL 214 L277 slices (do NOT reduce); grad_clip=1.0 (MANDATORY Mayo guard -- the 2304-view FBP adjoint overflows otherwise); bs=1 + val_chunk=1 forced by per-sample-ps; staged_canonical v3 mayo_ldct_fitted; per-sample-ps FBP + per-sample model.proj/model.dense_proj swap; bg_target=truth; 321px detector-geometry FOV default (NO fov override); wu_n_outer=1 (MANDATORY). (6) no control return.", "comparison_image": "runs/mayo-ldct-claude-agentic-wu-2015-trainable-search-20260619-01/iterations/iter-0007/comparison.png"}
