{"ts": "2026-06-19T13:50:10Z", "run_id": "mayo-ldct-claude-agentic-dual-domain-bilateral-supervised-search-20260619-01", "iter": 1, "agent": "dual_domain_bilateral_supervised-claude-agentic-breast-ct", "model": "claude-opus-4.7-1m", "change_class": "architecture", "status": "keep", "kept": true, "val_score": 0.9191814661026001, "headroom": 0.027984070092722302, "params_M": 1.2e-05, "train_n": 400, "rationale": "dual_domain_bilateral_supervised-claude-agentic: proj_n_bf=1, img_n_bf=3, proj_kernel=3, proj_sx=0.01, proj_sy=0.3, proj_sr=0.0005, img_kernel=5, img_sx=0.5, img_sy=0.5, img_sr=0.02, lr=0.005, epochs=8, batch_size=1, val_chunk=1, train_n=200, val_n=214, grad_clip=1.0, lambda_neg=1.0, seed=42, rationale=ITER-1 feasibility (search-20260619-01, corrected protocol). dual_domain_bilateral_supervised = the SUPERVISED dual-domain stack with the image-domain U-Net SWAPPED for a trainable BILATERAL FILTER (Wagner 2022): proj_dn(BF stack) -> FBP(full 2304 views) -> img_dn(BF stack), MSE-vs-truth + lambda_neg negativity penalty. NOT the per-image N2I bilateral variant. SHARES the sibling dual_domain_supervised Mayo path exactly: staged_canonical v3 mayo_ldct_fitted geometry, per-sample-ps (mayo_per_sample_setup/_fbp, per-sample pipe.R_full swap), bg_target=truth, val=ALL 214 L277 slices under the 321px detector-geometry FOV (evaluate_calibrated default for AGENT4CT_DATASET=mayo_ldct_2d; no fov= override). GOAL: does the bilateral variant RUN on Mayo under the corrected path and produce a FINITE val_score + comparison.png within the HARD 20-min train+score budget, establishing where the bilateral-supervised baseline lands vs the dual_domain_supervised U-Net (which scored SSIM 0.8880 / hr 0.2759 at c=16/lr=1e-4/ep=8 on the SAME 214-slice 321px-FOV metric, search-20260619-01 iter-1). CONFIG: started from that sibling iter-1 cfg and changed ONLY the image module (U-Net -> bilateral). proj_dn = 1 BF (kernel 3, sx=0.01 along-detector tiny to avoid radial blur, sy=0.3 along-angle, sr=0.0005), img_dn = 3 chained BFs (kernel 5, sx=sy=0.5, sr=0.02) = a SANE MID bilateral depth/kernel (solver default is img_n_bf=1; the discarded boundary-slice TPE hinted img_n_bf=7 which is heavy/over-parameterised for a baseline -- mid=3 establishes the corrected-metric baseline, defer depth as the iter-2 knob). ~24 trainable params total (3 per BF). lr=5e-3 = Wagner BF lr (BF learns scalar sigmas; the U-Net 1e-4 would barely move them in 8 epochs), grad_clip=1.0 kept as a safety on the 2304-view FBP adjoint (the tiny BF params are far less prone to the gradient explosion that forced lr=1e-4 on the U-Net). epochs=8, lambda_neg=1.0, train_n=200 (loader rotates the 4 Wagner train patients ps-pool -> ~400 effective slices/epoch), val_n=214 = ALL L277 slices, batch_size=1 + val_chunk=1 FORCED by per-sample-ps. SIZING: the sibling U-Net (0.47M params) ran 8 epochs + 214-slice per-sample val + figure in 419s (~7 min); the BF has ~24 params and per-step cost is dominated by the SHARED FBP adjoint (identical to the U-Net path), not the filter, so this run is comparable-or-cheaper -> comfortably inside the 20-min budget (30-min sbatch wall). HYPOTHESIS: the bilateral-supervised variant trains stably (no NaN, grad-clip holds) and produces a finite val_ssim, but UNDER-PERFORMS the dual_domain_supervised U-Net (SSIM 0.8880 / hr 0.2759) -- expect LOWER hr than 0.2759 -- because the BF has ~24 params vs the U-Net 0.47M, far less capacity to denoise the 2304-view Mayo FBP; the value here is interpretability/few-params, not peak SSIM. This onboarding iter establishes WHERE the bilateral baseline lands under the corrected 214-slice 321px-FOV metric; iter-2+ tunes ONE knob (img_n_bf depth first, then the Mayo-specific proj_sr over-smoothing lever).", "advice_for_others": "dual_domain_bilateral_supervised-claude-agentic: proj_n_bf=1, img_n_bf=3, proj_kernel=3, proj_sx=0.01, proj_sy=0.3, proj_sr=0.0005, img_kernel=5, img_sx=0.5, img_sy=0.5, img_sr=0.02, lr=0.005, epochs=8, batch_size=1, val_chunk=1, train_n=200, val_n=214, grad_clip=1.0, lambda_neg=1.0, seed=42, rationale=ITER-1 feasibility (search-20260619-01, corrected protocol). dual_domain_bilateral_supervised = the SUPERVISED dual-domain stack with the image-domain U-Net SWAPPED for a trainable BILATERAL FILTER (Wagner 2022): proj_dn(BF stack) -> FBP(full 2304 views) -> img_dn(BF stack), MSE-vs-truth + lambda_neg negativity penalty. NOT the per-image N2I bilateral variant. SHARES the sibling dual_domain_supervised Mayo path exactly: staged_canonical v3 mayo_ldct_fitted geometry, per-sample-ps (mayo_per_sample_setup/_fbp, per-sample pipe.R_full swap), bg_target=truth, val=ALL 214 L277 slices under the 321px detector-geometry FOV (evaluate_calibrated default for AGENT4CT_DATASET=mayo_ldct_2d; no fov= override). GOAL: does the bilateral variant RUN on Mayo under the corrected path and produce a FINITE val_score + comparison.png within the HARD 20-min train+score budget, establishing where the bilateral-supervised baseline lands vs the dual_domain_supervised U-Net (which scored SSIM 0.8880 / hr 0.2759 at c=16/lr=1e-4/ep=8 on the SAME 214-slice 321px-FOV metric, search-20260619-01 iter-1). CONFIG: started from that sibling iter-1 cfg and changed ONLY the image module (U-Net -> bilateral). proj_dn = 1 BF (kernel 3, sx=0.01 along-detector tiny to avoid radial blur, sy=0.3 along-angle, sr=0.0005), img_dn = 3 chained BFs (kernel 5, sx=sy=0.5, sr=0.02) = a SANE MID bilateral depth/kernel (solver default is img_n_bf=1; the discarded boundary-slice TPE hinted img_n_bf=7 which is heavy/over-parameterised for a baseline -- mid=3 establishes the corrected-metric baseline, defer depth as the iter-2 knob). ~24 trainable params total (3 per BF). lr=5e-3 = Wagner BF lr (BF learns scalar sigmas; the U-Net 1e-4 would barely move them in 8 epochs), grad_clip=1.0 kept as a safety on the 2304-view FBP adjoint (the tiny BF params are far less prone to the gradient explosion that forced lr=1e-4 on the U-Net). epochs=8, lambda_neg=1.0, train_n=200 (loader rotates the 4 Wagner train patients ps-pool -> ~400 effective slices/epoch), val_n=214 = ALL L277 slices, batch_size=1 + val_chunk=1 FORCED by per-sample-ps. SIZING: the sibling U-Net (0.47M params) ran 8 epochs + 214-slice per-sample val + figure in 419s (~7 min); the BF has ~24 params and per-step cost is dominated by the SHARED FBP adjoint (identical to the U-Net path), not the filter, so this run is comparable-or-cheaper -> comfortably inside the 20-min budget (30-min sbatch wall). HYPOTHESIS: the bilateral-supervised variant trains stably (no NaN, grad-clip holds) and produces a finite val_ssim, but UNDER-PERFORMS the dual_domain_supervised U-Net (SSIM 0.8880 / hr 0.2759) -- expect LOWER hr than 0.2759 -- because the BF has ~24 params vs the U-Net 0.47M, far less capacity to denoise the 2304-view Mayo FBP; the value here is interpretability/few-params, not peak SSIM. This onboarding iter establishes WHERE the bilateral baseline lands under the corrected 214-slice 321px-FOV metric; iter-2+ tunes ONE knob (img_n_bf depth first, then the Mayo-specific proj_sr over-smoothing lever).", "comparison_image": "runs/mayo-ldct-claude-agentic-dual-domain-bilateral-supervised-search-20260619-01/iterations/iter-0001/comparison.png"}
{"ts": "2026-06-19T13:48:33Z", "run_id": "mayo-ldct-claude-agentic-itnet-v2-search-20260619-01", "iter": 1, "agent": "itnet_v2-claude-agentic-breast-ct", "model": "claude-opus-4.7-1m", "change_class": "architecture", "status": "discard", "kept": false, "val_score": 0.4554155170917511, "headroom": 0.0, "params_M": 0.232882, "train_n": 400, "rationale": "itnet_v2-claude-agentic: itnet_k=3, unet_c=16, itnet_alpha_init=0.0037, residual_learning=False, pretrain_lr=0.0001, pretrain_epochs=12, pretrain_patience=12, batch_size=1, val_chunk=1, train_n=200, val_n=214, grad_clip=1.0, max_train_s=900, seed=42, rationale=ITER-1 feasibility (search-20260619-01, corrected protocol). itnet_v2 onboarding. CONFIG: residual_learning=False (MANDATORY: the CONFIG default True double-applies the residual -- SmallUNet.forward already returns x-body(x), then ItNetV2.forward re-adds denoiser(x) -> ~2x at eval which the k DC steps cannot recover, stuck ~0.34; False matches the working v1/v3 recipe). Shared ItNet architecture seeded from itnet_v3 iter-1 (0.896 SSIM / hr0.268 under the SAME corrected metric): itnet_k=3 DC steps, unet_c=16 SmallUNet denoiser, itnet_alpha_init=0.0037 (TV-lambda, learnable), grad_clip=1.0 (mandatory: 2304-view Mayo FBP adjoint inside dc_step overflows otherwise), seed=42. TRAINING uses v2 pretrain knobs (v2 pre-trains the denoiser then applies k=3 DC at eval; it is NOT end-to-end like v3): pretrain_lr=1e-4 (v3 unstable above; mirror), pretrain_epochs=12, pretrain_patience=12 (disable the 1pct early-stop so the full budget converges -- AVOID the v1 0.441 under-training trap). batch_size=1 + val_chunk=1 are FORCED by per-sample-ps (each slice swaps itnet.projector to its own ps). train_n=200 -> 200 steps/epoch. val_n=214 (ALL L277 slices -- do NOT reduce). max_train_s=900 (15 min) HARD backstop so train leaves room for the 214-slice per-sample val + figure inside the 30-min wall. HYPOTHESIS: itnet_v2 with residual_learning=False at k=3/c=16/lr=1e-4 for 12 pretrain epochs on 200 stratified Mayo train slices produces a finite val_ssim that CLEARS the LD-FBP baseline (hr>0) and lands in the ~0.88-0.90 SSIM band like its siblings, because a pretrained denoiser + k=3 DC-step refinement of the per-sample-ps FBP is a strong Mayo recon family and the residual_learning=False fix removes the double-residual collapse. This onboarding iter establishes the corrected-metric baseline that iter-2+ will improve by tuning ONE knob (pretrain_epochs first).", "advice_for_others": "itnet_v2-claude-agentic: itnet_k=3, unet_c=16, itnet_alpha_init=0.0037, residual_learning=False, pretrain_lr=0.0001, pretrain_epochs=12, pretrain_patience=12, batch_size=1, val_chunk=1, train_n=200, val_n=214, grad_clip=1.0, max_train_s=900, seed=42, rationale=ITER-1 feasibility (search-20260619-01, corrected protocol). itnet_v2 onboarding. CONFIG: residual_learning=False (MANDATORY: the CONFIG default True double-applies the residual -- SmallUNet.forward already returns x-body(x), then ItNetV2.forward re-adds denoiser(x) -> ~2x at eval which the k DC steps cannot recover, stuck ~0.34; False matches the working v1/v3 recipe). Shared ItNet architecture seeded from itnet_v3 iter-1 (0.896 SSIM / hr0.268 under the SAME corrected metric): itnet_k=3 DC steps, unet_c=16 SmallUNet denoiser, itnet_alpha_init=0.0037 (TV-lambda, learnable), grad_clip=1.0 (mandatory: 2304-view Mayo FBP adjoint inside dc_step overflows otherwise), seed=42. TRAINING uses v2 pretrain knobs (v2 pre-trains the denoiser then applies k=3 DC at eval; it is NOT end-to-end like v3): pretrain_lr=1e-4 (v3 unstable above; mirror), pretrain_epochs=12, pretrain_patience=12 (disable the 1pct early-stop so the full budget converges -- AVOID the v1 0.441 under-training trap). batch_size=1 + val_chunk=1 are FORCED by per-sample-ps (each slice swaps itnet.projector to its own ps). train_n=200 -> 200 steps/epoch. val_n=214 (ALL L277 slices -- do NOT reduce). max_train_s=900 (15 min) HARD backstop so train leaves room for the 214-slice per-sample val + figure inside the 30-min wall. HYPOTHESIS: itnet_v2 with residual_learning=False at k=3/c=16/lr=1e-4 for 12 pretrain epochs on 200 stratified Mayo train slices produces a finite val_ssim that CLEARS the LD-FBP baseline (hr>0) and lands in the ~0.88-0.90 SSIM band like its siblings, because a pretrained denoiser + k=3 DC-step refinement of the per-sample-ps FBP is a strong Mayo recon family and the residual_learning=False fix removes the double-residual collapse. This onboarding iter establishes the corrected-metric baseline that iter-2+ will improve by tuning ONE knob (pretrain_epochs first).", "comparison_image": "runs/mayo-ldct-claude-agentic-itnet-v2-search-20260619-01/iterations/iter-0001/comparison.png"}
{"ts": "2026-06-19T13:46:50Z", "run_id": "mayo-ldct-claude-agentic-hammernik-2017-search-20260619-01", "iter": 1, "agent": "hammernik_2017-claude-agentic-breast-ct", "model": "claude-opus-4.7-1m", "change_class": "architecture", "status": "discard", "kept": false, "val_score": null, "headroom": 0.0, "params_M": null, "train_n": 400, "rationale": "hammernik_2017-claude-agentic: vn_T=5, vn_n_filters=16, vn_kernel=11, vn_n_bumps=31, vn_x_range=2.0, vn_lambda_init=0.0023, epochs=40, batch_size=4, lr=0.0005, grad_clip=1.0, train_n=200, val_n=214, max_train_s=1080, seed=42, rationale=FRESH search-20260619-01 iter-1 FEASIBILITY under the corrected protocol (val=ALL 214 L277 slices + 321px detector-geometry FOV; HARD 20-min train+score budget). Hammernik-2017 here is an IMAGE-DOMAIN variational net that denoises the FBP -- NO projector inside the unrolled loop, so each forward is far cheaper than LPD (which ran the PYRO-NN projector in-loop and still did train200+score214 in 1149s/19.2min). That cheapness is spent on CONVERGENCE not capacity, to dodge the LPD trap (under-trained heavy unrolled net -> hr=0 @ SSIM 0.843). Capacity modest: vn_T=5, vn_n_filters=16 (below the 24 default for a cheaper RBF activation loop), vn_kernel=11, vn_n_bumps=31; vn_lambda_init=2.3e-3 = the documented VN-port working corner (LOOSE hint, not validated). Training favors convergence: epochs=40, train_n=200, batch=4, lr=5e-4, grad_clip=1.0; max_train_s=1080 (18min) in-solver wall trips before the 30min SLURM kill, leaving headroom for score(214)+figure. Hyp: a budget-sized, ACTUALLY-CONVERGED Hammernik-2017 lands near or above the ~0.84 LD-FBP-ish SSIM floor within 20 min on Mayo; if even at 40 epochs it stays stuck at hr=0 with lambda_t barely budging (the documented 2026-06-08 failure signature), that is the iter-1 feasibility finding -- a shared-filter-bank structural ceiling, not a config knob away.", "advice_for_others": "hammernik_2017-claude-agentic: vn_T=5, vn_n_filters=16, vn_kernel=11, vn_n_bumps=31, vn_x_range=2.0, vn_lambda_init=0.0023, epochs=40, batch_size=4, lr=0.0005, grad_clip=1.0, train_n=200, val_n=214, max_train_s=1080, seed=42, rationale=FRESH search-20260619-01 iter-1 FEASIBILITY under the corrected protocol (val=ALL 214 L277 slices + 321px detector-geometry FOV; HARD 20-min train+score budget). Hammernik-2017 here is an IMAGE-DOMAIN variational net that denoises the FBP -- NO projector inside the unrolled loop, so each forward is far cheaper than LPD (which ran the PYRO-NN projector in-loop and still did train200+score214 in 1149s/19.2min). That cheapness is spent on CONVERGENCE not capacity, to dodge the LPD trap (under-trained heavy unrolled net -> hr=0 @ SSIM 0.843). Capacity modest: vn_T=5, vn_n_filters=16 (below the 24 default for a cheaper RBF activation loop), vn_kernel=11, vn_n_bumps=31; vn_lambda_init=2.3e-3 = the documented VN-port working corner (LOOSE hint, not validated). Training favors convergence: epochs=40, train_n=200, batch=4, lr=5e-4, grad_clip=1.0; max_train_s=1080 (18min) in-solver wall trips before the 30min SLURM kill, leaving headroom for score(214)+figure. Hyp: a budget-sized, ACTUALLY-CONVERGED Hammernik-2017 lands near or above the ~0.84 LD-FBP-ish SSIM floor within 20 min on Mayo; if even at 40 epochs it stays stuck at hr=0 with lambda_t barely budging (the documented 2026-06-08 failure signature), that is the iter-1 feasibility finding -- a shared-filter-bank structural ceiling, not a config knob away.", "comparison_image": null}
{"ts": "2026-06-19T13:10:11Z", "run_id": "mayo-ldct-claude-agentic-dual-domain-supervised-search-20260619-01", "iter": 1, "agent": "dual_domain_supervised-claude-agentic-breast-ct", "model": "claude-opus-4.7-1m", "change_class": "architecture", "status": "keep", "kept": true, "val_score": 0.8879755139350891, "headroom": 0.2759531823491409, "params_M": 0.465762, "train_n": 400, "rationale": "dual_domain_supervised-claude-agentic: unet_c=16, lr=0.0001, epochs=8, batch_size=1, val_chunk=1, train_n=200, val_n=214, grad_clip=1.0, lambda_neg=1.0, seed=42, rationale=ITER-1 feasibility (search-20260619-01, corrected protocol). GOAL: does dual_domain_supervised run on Mayo under the corrected path (staged_canonical v3 mayo_ldct_fitted geometry, per-sample-ps FBP + per-sample pipe.R_full swap, bg_target=truth) and produce a FINITE val_score + comparison.png within the HARD 20-min train+score budget, scoring ALL 214 L277 slices under the 321px detector-geometry FOV (evaluate_calibrated default for AGENT4CT_DATASET=mayo_ldct_2d; no fov= override)? This is the SUPERVISED dual-domain U-Net (proj_dn -> FBP(full views) -> img_dn, MSE-vs-truth + lambda_neg negativity penalty), NOT the per-image N2I variant. CONFIG: two SmallUNet denoisers (proj + img) at c=16 (~1.0M params total), lr=1e-4 (the 2304-view Mayo FBP adjoint amplifies gradients ~18x vs demo's 128 views -> lr=5e-4 NaNs ep1 / lr=1e-4 NaNs ep2 standalone, so grad_clip=1.0 + nonfinite-grad-skip is MANDATORY and lr is kept conservative), epochs=8, lambda_neg=1.0 (validated-stable standalone default; the discarded boundary-slice run hinted lambda_neg=0.1 as best -- treat as behavior hint only, defer the knob to iter-2+). batch_size=1 + val_chunk=1 are FORCED by the per-sample-ps path (each train step swaps pipe.R_full to its slice ps; each val slice does likewise). train_n=200 stratified across the 4 Wagner train patients' ps-groups (loader rotates the full pool -> ~400 effective slices/epoch). val_n=214 = ALL L277 slices. SIZING: itnet_v3 (heavier -- k=3 unrolled DC steps) iter-1 trained 8 epochs + scored all 214 slices in 738s (~12.3 min) under this same sbatch wall; DD-UNet has no unrolled DC loop so it is CHEAPER per step -> 8 epochs + 214-slice per-sample val + figure fits comfortably inside the 20-min budget (30-min sbatch wall). HYPOTHESIS: dual_domain_supervised at c=16/lr=1e-4/ep=8 on ~200-400 stratified Mayo train slices trains stably (no NaN, grad-clip+skip holds) and produces a finite val_ssim that CLEARS the LD-FBP baseline (hr>0), because a supervised dual-domain (sinogram + image U-Net) denoiser of the full-view FBP is a strong Mayo recon family (loose hint from the discarded boundary-slice run: ~0.96 SSIM with epochs as the lever -- NOT a validated number under the corrected 214-slice 321px-FOV metric). This onboarding iter establishes the corrected-metric baseline that iter-2+ will improve by tuning ONE knob (epochs first, then lambda_neg).", "advice_for_others": "dual_domain_supervised-claude-agentic: unet_c=16, lr=0.0001, epochs=8, batch_size=1, val_chunk=1, train_n=200, val_n=214, grad_clip=1.0, lambda_neg=1.0, seed=42, rationale=ITER-1 feasibility (search-20260619-01, corrected protocol). GOAL: does dual_domain_supervised run on Mayo under the corrected path (staged_canonical v3 mayo_ldct_fitted geometry, per-sample-ps FBP + per-sample pipe.R_full swap, bg_target=truth) and produce a FINITE val_score + comparison.png within the HARD 20-min train+score budget, scoring ALL 214 L277 slices under the 321px detector-geometry FOV (evaluate_calibrated default for AGENT4CT_DATASET=mayo_ldct_2d; no fov= override)? This is the SUPERVISED dual-domain U-Net (proj_dn -> FBP(full views) -> img_dn, MSE-vs-truth + lambda_neg negativity penalty), NOT the per-image N2I variant. CONFIG: two SmallUNet denoisers (proj + img) at c=16 (~1.0M params total), lr=1e-4 (the 2304-view Mayo FBP adjoint amplifies gradients ~18x vs demo's 128 views -> lr=5e-4 NaNs ep1 / lr=1e-4 NaNs ep2 standalone, so grad_clip=1.0 + nonfinite-grad-skip is MANDATORY and lr is kept conservative), epochs=8, lambda_neg=1.0 (validated-stable standalone default; the discarded boundary-slice run hinted lambda_neg=0.1 as best -- treat as behavior hint only, defer the knob to iter-2+). batch_size=1 + val_chunk=1 are FORCED by the per-sample-ps path (each train step swaps pipe.R_full to its slice ps; each val slice does likewise). train_n=200 stratified across the 4 Wagner train patients' ps-groups (loader rotates the full pool -> ~400 effective slices/epoch). val_n=214 = ALL L277 slices. SIZING: itnet_v3 (heavier -- k=3 unrolled DC steps) iter-1 trained 8 epochs + scored all 214 slices in 738s (~12.3 min) under this same sbatch wall; DD-UNet has no unrolled DC loop so it is CHEAPER per step -> 8 epochs + 214-slice per-sample val + figure fits comfortably inside the 20-min budget (30-min sbatch wall). HYPOTHESIS: dual_domain_supervised at c=16/lr=1e-4/ep=8 on ~200-400 stratified Mayo train slices trains stably (no NaN, grad-clip+skip holds) and produces a finite val_ssim that CLEARS the LD-FBP baseline (hr>0), because a supervised dual-domain (sinogram + image U-Net) denoiser of the full-view FBP is a strong Mayo recon family (loose hint from the discarded boundary-slice run: ~0.96 SSIM with epochs as the lever -- NOT a validated number under the corrected 214-slice 321px-FOV metric). This onboarding iter establishes the corrected-metric baseline that iter-2+ will improve by tuning ONE knob (epochs first, then lambda_neg).", "comparison_image": "runs/mayo-ldct-claude-agentic-dual-domain-supervised-search-20260619-01/iterations/iter-0001/comparison.png"}
