{"ts": "2026-06-21T11:29:15Z", "run_id": "mayo-ldct-claude-agentic-tv-iterative-search-20260619-01", "iter": 8, "agent": "tv_iterative-claude-agentic", "model": "claude-opus-4-8-1m", "change_class": "architecture", "status": "keep", "kept": true, "val_score": 0.9256114959716797, "headroom": 0.20781201965288254, "params_M": 0.0, "train_n": 400, "rationale": "tv_iterative-claude-agentic: val_n=214, train_n=0, tv_lambda=0.001, tv_iterations=140, tv_lr=0.01, tv_clip_max=0.08, tv_decay=0.01, tv_optimizer=gd, tv_init=fbp, rationale=tv_iterative iter-8 (search-20260619-01, corrected 214-slice/321px-FOV metric). BASE_ITER=4 (the BEST, hr 0.208547: clip 0.08, lambda 0.001, lr 0.01). ONE KNOB: tv_iterations 160->140. The four live knobs in tv_reconstruction are tv_lambda/tv_iterations/tv_lr/tv_clip_max; GD step schedule is step=lr/(1+0.01*it) hard-coded. LEVER MAP at the budget-safe 120 iters: clip exhausted at top-of-bound [0.03,0.08] (iter-2 0.05->0.08 lifted hr 0.133->0.205, the lever); lambda BRACKETED at optimum 0.001 -- up@0.003 regressed (iter-3 0.1366), down@0.0005 regressed (iter-6 0.1582); lr BRACKETED -- up-2x@0.02 OVERSHOT (iter-5 0.1873), up-1.3x@0.013 FLAT (iter-7 0.2082); iters-UP@160 gave the PEAK hr 0.2085 + lowest RMSE 7.825e-4 (CONVERGENCE helps) BUT measured 1227.4s, breaching the HARD 1200s wall (metric-invalid). KEY EVIDENCE: iter-4 proves the data term is mildly UNDER-converged at 120 iters (more steps -> lower RMSE -> higher hr), but buying that convergence via 160 iters breaches budget, via 2x lr overshoots, via 1.3x lr lands flat at 0.2082. The GENUINELY-UNTRIED band is tv_iterations between the budget-proven 120 and the over-budget 160 -- none probed. iter-4 showed the 120->160 ramp is monotone in RMSE/hr. HYPOTHESIS: 140 iters (~2/3 through that proven ramp) converges the data term further than the 120-iter base toward iter-4 lower residual (RMSE toward 7.825e-4), lifting hr toward/above the 160-iter peak 0.208547 -- at a WALL-SAFE cost. PREDICTED iter-8 hr ~0.2085. FALSIFIER: if hr<=0.208547 (no gain), the convergence gain saturates by 140 iters and cannot be bought within the HARD 1200s budget -- 0.2085 hr / ~0.927 SSIM is the STRUCTURAL classical-TV FBP-ceiling on dense (2304-view) real Mayo LDCT, and ALL FOUR live levers are exhausted (clip top-of-bound, lambda bracketed, lr bracketed, iters budget-capped); STOP tuning tv_iterative. BUDGET: cost model from real iter-2 (928s@120) + iter-4 (1227s@160) pairs gives c_step=7.48 s/TV-iter, overhead=30s; n=140 -> T=30+140*7.48=1077s = 90 pct of the 1200s wall (~123s margin); at +10 pct GPU-contention variance (c_step 8.23) -> 1182s, STILL under the wall. n=150 REJECTED (~1152s nominal but ~1267s @+10 pct variance, breaches); n=160 REJECTED (iter-4 already measured 1227s, over). val = ALL 214 L277 slices unchanged. sbatch --time=00:30:00 SLURM safety net above the 20-min metric-validity budget.", "advice_for_others": "tv_iterative-claude-agentic: val_n=214, train_n=0, tv_lambda=0.001, tv_iterations=140, tv_lr=0.01, tv_clip_max=0.08, tv_decay=0.01, tv_optimizer=gd, tv_init=fbp, rationale=tv_iterative iter-8 (search-20260619-01, corrected 214-slice/321px-FOV metric). BASE_ITER=4 (the BEST, hr 0.208547: clip 0.08, lambda 0.001, lr 0.01). ONE KNOB: tv_iterations 160->140. The four live knobs in tv_reconstruction are tv_lambda/tv_iterations/tv_lr/tv_clip_max; GD step schedule is step=lr/(1+0.01*it) hard-coded. LEVER MAP at the budget-safe 120 iters: clip exhausted at top-of-bound [0.03,0.08] (iter-2 0.05->0.08 lifted hr 0.133->0.205, the lever); lambda BRACKETED at optimum 0.001 -- up@0.003 regressed (iter-3 0.1366), down@0.0005 regressed (iter-6 0.1582); lr BRACKETED -- up-2x@0.02 OVERSHOT (iter-5 0.1873), up-1.3x@0.013 FLAT (iter-7 0.2082); iters-UP@160 gave the PEAK hr 0.2085 + lowest RMSE 7.825e-4 (CONVERGENCE helps) BUT measured 1227.4s, breaching the HARD 1200s wall (metric-invalid). KEY EVIDENCE: iter-4 proves the data term is mildly UNDER-converged at 120 iters (more steps -> lower RMSE -> higher hr), but buying that convergence via 160 iters breaches budget, via 2x lr overshoots, via 1.3x lr lands flat at 0.2082. The GENUINELY-UNTRIED band is tv_iterations between the budget-proven 120 and the over-budget 160 -- none probed. iter-4 showed the 120->160 ramp is monotone in RMSE/hr. HYPOTHESIS: 140 iters (~2/3 through that proven ramp) converges the data term further than the 120-iter base toward iter-4 lower residual (RMSE toward 7.825e-4), lifting hr toward/above the 160-iter peak 0.208547 -- at a WALL-SAFE cost. PREDICTED iter-8 hr ~0.2085. FALSIFIER: if hr<=0.208547 (no gain), the convergence gain saturates by 140 iters and cannot be bought within the HARD 1200s budget -- 0.2085 hr / ~0.927 SSIM is the STRUCTURAL classical-TV FBP-ceiling on dense (2304-view) real Mayo LDCT, and ALL FOUR live levers are exhausted (clip top-of-bound, lambda bracketed, lr bracketed, iters budget-capped); STOP tuning tv_iterative. BUDGET: cost model from real iter-2 (928s@120) + iter-4 (1227s@160) pairs gives c_step=7.48 s/TV-iter, overhead=30s; n=140 -> T=30+140*7.48=1077s = 90 pct of the 1200s wall (~123s margin); at +10 pct GPU-contention variance (c_step 8.23) -> 1182s, STILL under the wall. n=150 REJECTED (~1152s nominal but ~1267s @+10 pct variance, breaches); n=160 REJECTED (iter-4 already measured 1227s, over). val = ALL 214 L277 slices unchanged. sbatch --time=00:30:00 SLURM safety net above the 20-min metric-validity budget.", "comparison_image": "runs/mayo-ldct-claude-agentic-tv-iterative-search-20260619-01/iterations/iter-0008/comparison.png"}
{"ts": "2026-06-21T11:28:18Z", "run_id": "mayo-ldct-claude-agentic-dual-domain-n2i-search-20260619-01", "iter": 8, "agent": "dual_domain_n2i-claude-agentic", "model": "claude-opus-4-8-1m", "change_class": "architecture", "status": "keep", "kept": true, "val_score": 0.9136832356452942, "headroom": 0.12360321642217631, "params_M": 1.045394, "train_n": 400, "rationale": "dual_domain_n2i-claude-agentic: warm_start=True, pretrain_epochs=4, n_iter=18, grad_clip=1.0, unet_c=24, lr=0.0003, batch_size=1, train_n=200, val_n=214, outer_wall_s=1300, per_scene_s=None, seed=42, rationale=dual_domain_n2i iter-8 (search-20260619-01, PER-IMAGE Noise2Inverse: warm-start pre-pass + per-scan Adam fit; NEVER amortized). SIX-BOX (NUMBERS, from iter-1..7 observations). (1) TRAJECTORY both per-scan levers + warm-start depth now MAPPED with bracketed interior optima: lr {1e-3 hr0 (drift), 3e-4 hr0.1976 BEST, 1.5e-4 hr0.1207 iter-6 REGRESSED} optimum 3e-4; n_iter {15 hr0.1506, 18 hr0.1976 BEST, 20 hr0.1595 iter-5 REGRESSED} optimum 18; pretrain_epochs {1 hr0, 4 hr0.1976 BEST, 6 hr0.1870 iter-7 REGRESSED} optimum 4. iter-4 (pe4,n18,lr3e-4,unet_c16) hr 0.1976 SSIM 0.9277 PSNR 35.99 RMSE 7.934e-4 elapsed 1235.5s is the joint optimum + run best (BASE_ITER=4). (2) LIMITER: all three scalar levers (lr, n_iter, pretrain_epochs) are spent/wrong-signed at their bracketed optima. The half-view info bound is the leading hypothesis, BUT one genuinely-untried single knob remains: per-scan U-Net CAPACITY at the now-anchored lr. unet_c has been HELD at 16 for ALL 7 corrected-campaign iters; the only c16->c32 datapoint (campaign-state note: flat at 0.9508) is from the DISCARDED boundary-slice run AND was at lr=1e-3 -- the DRIFT regime where the per-scan fit leaves the init, so capacity could not carry through (same confound that made iter-2 pretrain_epochs-up misread). Capacity has NEVER been tested at the anchored lr=3e-4/n_iter=18 optimum where the fit refines NEAR the FBP-consistent init. (3) ONE KNOB: unet_c 16 -> 24 (lr=3e-4, n_iter=18, pretrain_epochs=4, grad_clip=1.0, warm_start=True, val_n=214, seed=42 ALL HELD at iter-4 BEST; the 2-subset even/odd angular split is hard-wired in geometry.py::split_angles and is NOT a cfg knob, so it cannot be the lever without editing a shared module -- forbidden). outer_wall_s 1080 -> 1300 is a FORCED anti-truncation consequence of the larger net (not a tuning knob): the per-scene fit time rises with capacity, and at outer_wall_s=1080 per_scene_s=5.05s with only 0.45s margin over the c16 4.60s/scene would silently truncate; 1300 gives per_scene_s=6.07s, comfortably above the expected ~5.5s/scene at c24, so ALL 214 scenes complete 18 steps with NO truncation. (4) HYPOTHESIS: unet_c 16->24 at the anchored lr=3e-4/n_iter=18 optimum lifts hr above 0.1976 (PSNR above 35.99) because a higher-capacity per-scan denoiser carries a richer FBP-consistent prior through the 18-step refine (lr anchors it near the init; this is the refine regime, not drift). NUMERIC FALSIFIER: if hr <= 0.1976 (no PSNR gain over 35.99), per-scan capacity is NOT the binding constraint at the anchored lr and per-image U-Net N2I ceilings at hr~0.20 on dense 2304-view Mayo -- the half-view info-loss bound (the even/odd split discards half the 2304 views) -> hr 0.1976 @iter-4 is the per-image N2I half-view ceiling; document it (NAF/ram structural-negative class), no further per-image tuning. (5) BUDGET (HARD 20-min compute, val=ALL 214): unet_c adds U-Net forward/backward per step; the per-step wall is dominated by the c-INDEPENDENT 2304-view FBP forward+adjoint, so the c16->c24 increase is a fraction of each step. Conservative +20% on the c16 fit loop: 985s -> ~1182s; + overhead ~267s (warm-start 4ep + setup/score) = ~1449s compute; + figure ~27s = ~1476s = 24.6 min figure-inclusive, 324s (5.4 min) under the 1800s/30-min SLURM hard wall. Fit loop ~1182s < outer_wall_s=1300 backstop; per-scene ~5.5s < per_scene_s=1300/214=6.07s -> NO truncation. grad_clip=1.0 mandatory (2304-view FBP adjoint overflows otherwise). val_n=214 NOT reduced (protocol). 321px detector-geometry FOV default (no fov=False). staged_canonical / v3 mayo_ldct_fitted / per-sample-ps half-angle projector swap / bg_target=truth hard-wired. PER-IMAGE structure UNCHANGED (warm-start pre-pass + per-scan fit; NEVER amortized). (6) no control return.", "advice_for_others": "dual_domain_n2i-claude-agentic: warm_start=True, pretrain_epochs=4, n_iter=18, grad_clip=1.0, unet_c=24, lr=0.0003, batch_size=1, train_n=200, val_n=214, outer_wall_s=1300, per_scene_s=None, seed=42, rationale=dual_domain_n2i iter-8 (search-20260619-01, PER-IMAGE Noise2Inverse: warm-start pre-pass + per-scan Adam fit; NEVER amortized). SIX-BOX (NUMBERS, from iter-1..7 observations). (1) TRAJECTORY both per-scan levers + warm-start depth now MAPPED with bracketed interior optima: lr {1e-3 hr0 (drift), 3e-4 hr0.1976 BEST, 1.5e-4 hr0.1207 iter-6 REGRESSED} optimum 3e-4; n_iter {15 hr0.1506, 18 hr0.1976 BEST, 20 hr0.1595 iter-5 REGRESSED} optimum 18; pretrain_epochs {1 hr0, 4 hr0.1976 BEST, 6 hr0.1870 iter-7 REGRESSED} optimum 4. iter-4 (pe4,n18,lr3e-4,unet_c16) hr 0.1976 SSIM 0.9277 PSNR 35.99 RMSE 7.934e-4 elapsed 1235.5s is the joint optimum + run best (BASE_ITER=4). (2) LIMITER: all three scalar levers (lr, n_iter, pretrain_epochs) are spent/wrong-signed at their bracketed optima. The half-view info bound is the leading hypothesis, BUT one genuinely-untried single knob remains: per-scan U-Net CAPACITY at the now-anchored lr. unet_c has been HELD at 16 for ALL 7 corrected-campaign iters; the only c16->c32 datapoint (campaign-state note: flat at 0.9508) is from the DISCARDED boundary-slice run AND was at lr=1e-3 -- the DRIFT regime where the per-scan fit leaves the init, so capacity could not carry through (same confound that made iter-2 pretrain_epochs-up misread). Capacity has NEVER been tested at the anchored lr=3e-4/n_iter=18 optimum where the fit refines NEAR the FBP-consistent init. (3) ONE KNOB: unet_c 16 -> 24 (lr=3e-4, n_iter=18, pretrain_epochs=4, grad_clip=1.0, warm_start=True, val_n=214, seed=42 ALL HELD at iter-4 BEST; the 2-subset even/odd angular split is hard-wired in geometry.py::split_angles and is NOT a cfg knob, so it cannot be the lever without editing a shared module -- forbidden). outer_wall_s 1080 -> 1300 is a FORCED anti-truncation consequence of the larger net (not a tuning knob): the per-scene fit time rises with capacity, and at outer_wall_s=1080 per_scene_s=5.05s with only 0.45s margin over the c16 4.60s/scene would silently truncate; 1300 gives per_scene_s=6.07s, comfortably above the expected ~5.5s/scene at c24, so ALL 214 scenes complete 18 steps with NO truncation. (4) HYPOTHESIS: unet_c 16->24 at the anchored lr=3e-4/n_iter=18 optimum lifts hr above 0.1976 (PSNR above 35.99) because a higher-capacity per-scan denoiser carries a richer FBP-consistent prior through the 18-step refine (lr anchors it near the init; this is the refine regime, not drift). NUMERIC FALSIFIER: if hr <= 0.1976 (no PSNR gain over 35.99), per-scan capacity is NOT the binding constraint at the anchored lr and per-image U-Net N2I ceilings at hr~0.20 on dense 2304-view Mayo -- the half-view info-loss bound (the even/odd split discards half the 2304 views) -> hr 0.1976 @iter-4 is the per-image N2I half-view ceiling; document it (NAF/ram structural-negative class), no further per-image tuning. (5) BUDGET (HARD 20-min compute, val=ALL 214): unet_c adds U-Net forward/backward per step; the per-step wall is dominated by the c-INDEPENDENT 2304-view FBP forward+adjoint, so the c16->c24 increase is a fraction of each step. Conservative +20% on the c16 fit loop: 985s -> ~1182s; + overhead ~267s (warm-start 4ep + setup/score) = ~1449s compute; + figure ~27s = ~1476s = 24.6 min figure-inclusive, 324s (5.4 min) under the 1800s/30-min SLURM hard wall. Fit loop ~1182s < outer_wall_s=1300 backstop; per-scene ~5.5s < per_scene_s=1300/214=6.07s -> NO truncation. grad_clip=1.0 mandatory (2304-view FBP adjoint overflows otherwise). val_n=214 NOT reduced (protocol). 321px detector-geometry FOV default (no fov=False). staged_canonical / v3 mayo_ldct_fitted / per-sample-ps half-angle projector swap / bg_target=truth hard-wired. PER-IMAGE structure UNCHANGED (warm-start pre-pass + per-scan fit; NEVER amortized). (6) no control return.", "comparison_image": "runs/mayo-ldct-claude-agentic-dual-domain-n2i-search-20260619-01/iterations/iter-0008/comparison.png"}
{"ts": "2026-06-21T11:22:47Z", "run_id": "mayo-ldct-claude-agentic-wu-2015-trainable-search-20260619-01", "iter": 8, "agent": "wu_2015_trainable-claude-agentic", "model": "claude-opus-4-8-1m", "change_class": "architecture", "status": "keep", "kept": true, "val_score": 0.8274640440940857, "headroom": 0.08620919047422249, "params_M": 8e-06, "train_n": 400, "rationale": "wu_2015_trainable-claude-agentic: wu_n_bands=4, wu_n_outer=1, lr=0.001, epochs=18, batch_size=1, val_chunk=1, train_n=200, val_n=214, grad_clip=1.0, lambda_neg=1.0, weight_decay=0.0, loss_base=mse, seed=42, rationale=wu_2015_trainable iter-8 (search-20260619-01, corrected 214-slice/321px-FOV metric). LR-CONVERGENCE iter (framing A: give the gentle lr more steps). SIX-BOX (NUMBERS). (1) TRAJECTORY iter->hr: 1->0.0508 (lr0.01,ep6,8params,335s), 2(ep18@lr0.01)->0.0337 (epochs INERT AT lr0.01, hr FELL), 3(n_bands6)->0.0, 4(n_outer2)->0.0 (SSIM 0.6459 COLLAPSED), 5(train_n480,ep3)->0.0411 (data FAILED), 6(lr 0.01->0.003,ep6)->0.0966 NEW BEST (SSIM 0.8232, 334.8s), 7(lr 0.003->0.001,ep6)->0.0668 REGRESSED (SSIM 0.8022, 350.4s). THE lr/EPOCHS INTERACTION: lr0.01->0.003 nearly DOUBLED hr (0.0508->0.0966), but the further drop lr0.003->0.001 at the SAME ep6 REGRESSED to 0.0668 -- at ep6 the smaller lr0.001 UNDER-CONVERGED, it did not reach the basin lr0.003 found in 6 steps. Base copied = iter-7 (lr0.001). (2) LIMITER: the lr0.001 basin is UNDER-CONVERGED at ep6 -- iter-7 fired its own falsifier (hr 0.0668 <= 0.0966 at lr0.001/ep6 => RAISE EPOCHS to let the smaller lr converge BEFORE declaring the lr axis exhausted; do NOT yet file the FBP-ceiling verdict). Note iter-2 proved ep INERT at lr0.01 -- but that is the FAST lr that saturates the clamped scalars by ep1; at the 10x-gentler lr0.001 epochs are NOT presumed inert, they are the missing convergence budget. (3) ONE KNOB: epochs 6 -> 18 (3x) AT lr0.001 (iter-7 base, UNCHANGED). Sole change. PARAM COUNT UNCHANGED at 8 (wu_n_bands=4 + 2 + 2*wu_n_outer=1). wu_n_outer=1 (MANDATORY), grad_clip=1.0, wu_n_bands=4 all held. (4) HYPOTHESIS: if iter-7 was lr0.001-UNDER-CONVERGENCE-limited at ep6, giving it 18 epochs lets lr0.001 settle into a basin that lifts hr ABOVE the iter-6 best 0.0966 (breast-CT TPE precedent: wu hr0.317 at ~10x-lower lr suggests gentler-lr headroom IF converged). PREDICTED iter-8 hr ~0.10-0.13. NUMERIC FALSIFIER (terminal): if hr <= 0.0966 (at/below iter-6 best) EVEN at ep18, then lr0.001 cannot beat lr0.003 even GIVEN 3x the steps -- the lr AND epochs axes are BOTH exhausted; file the FBP-family ceiling verdict (epochs inert, bands regressed, outer-depth collapsed, data failed, lr-floor+epochs exhausted => Wu-trainable caps hr~0.10 on real-helical Mayo, no image-domain learned CNN denoiser, far below dual-domain U-Net families hr~0.27). (5) BUDGET (HARD 1200s/20-min train+score): iter-7 ep6=350.4s. Worst-case PESSIMISTIC (treat ALL 350s as scaling with epochs, over-counts since the 214-slice val pass is a FIXED per-iter cost): 350.4 * 18/6 = 1051s < 1200s HARD and << 1800s SLURM kill; realistically only the train portion scales (val fixed) so ep18 sits well under. val FIGURE outside budget. val_n=214 = ALL L277 slices (do NOT reduce); grad_clip=1.0 (MANDATORY Mayo guard -- 2304-view FBP adjoint overflows otherwise); bs=1 + val_chunk=1 forced by per-sample-ps; staged_canonical v3 mayo_ldct_fitted; per-sample-ps FBP + per-sample model.proj/model.dense_proj swap; bg_target=truth; 321px detector-geometry FOV default (NO fov override); wu_n_outer=1 (MANDATORY). (6) no control return.", "advice_for_others": "wu_2015_trainable-claude-agentic: wu_n_bands=4, wu_n_outer=1, lr=0.001, epochs=18, batch_size=1, val_chunk=1, train_n=200, val_n=214, grad_clip=1.0, lambda_neg=1.0, weight_decay=0.0, loss_base=mse, seed=42, rationale=wu_2015_trainable iter-8 (search-20260619-01, corrected 214-slice/321px-FOV metric). LR-CONVERGENCE iter (framing A: give the gentle lr more steps). SIX-BOX (NUMBERS). (1) TRAJECTORY iter->hr: 1->0.0508 (lr0.01,ep6,8params,335s), 2(ep18@lr0.01)->0.0337 (epochs INERT AT lr0.01, hr FELL), 3(n_bands6)->0.0, 4(n_outer2)->0.0 (SSIM 0.6459 COLLAPSED), 5(train_n480,ep3)->0.0411 (data FAILED), 6(lr 0.01->0.003,ep6)->0.0966 NEW BEST (SSIM 0.8232, 334.8s), 7(lr 0.003->0.001,ep6)->0.0668 REGRESSED (SSIM 0.8022, 350.4s). THE lr/EPOCHS INTERACTION: lr0.01->0.003 nearly DOUBLED hr (0.0508->0.0966), but the further drop lr0.003->0.001 at the SAME ep6 REGRESSED to 0.0668 -- at ep6 the smaller lr0.001 UNDER-CONVERGED, it did not reach the basin lr0.003 found in 6 steps. Base copied = iter-7 (lr0.001). (2) LIMITER: the lr0.001 basin is UNDER-CONVERGED at ep6 -- iter-7 fired its own falsifier (hr 0.0668 <= 0.0966 at lr0.001/ep6 => RAISE EPOCHS to let the smaller lr converge BEFORE declaring the lr axis exhausted; do NOT yet file the FBP-ceiling verdict). Note iter-2 proved ep INERT at lr0.01 -- but that is the FAST lr that saturates the clamped scalars by ep1; at the 10x-gentler lr0.001 epochs are NOT presumed inert, they are the missing convergence budget. (3) ONE KNOB: epochs 6 -> 18 (3x) AT lr0.001 (iter-7 base, UNCHANGED). Sole change. PARAM COUNT UNCHANGED at 8 (wu_n_bands=4 + 2 + 2*wu_n_outer=1). wu_n_outer=1 (MANDATORY), grad_clip=1.0, wu_n_bands=4 all held. (4) HYPOTHESIS: if iter-7 was lr0.001-UNDER-CONVERGENCE-limited at ep6, giving it 18 epochs lets lr0.001 settle into a basin that lifts hr ABOVE the iter-6 best 0.0966 (breast-CT TPE precedent: wu hr0.317 at ~10x-lower lr suggests gentler-lr headroom IF converged). PREDICTED iter-8 hr ~0.10-0.13. NUMERIC FALSIFIER (terminal): if hr <= 0.0966 (at/below iter-6 best) EVEN at ep18, then lr0.001 cannot beat lr0.003 even GIVEN 3x the steps -- the lr AND epochs axes are BOTH exhausted; file the FBP-family ceiling verdict (epochs inert, bands regressed, outer-depth collapsed, data failed, lr-floor+epochs exhausted => Wu-trainable caps hr~0.10 on real-helical Mayo, no image-domain learned CNN denoiser, far below dual-domain U-Net families hr~0.27). (5) BUDGET (HARD 1200s/20-min train+score): iter-7 ep6=350.4s. Worst-case PESSIMISTIC (treat ALL 350s as scaling with epochs, over-counts since the 214-slice val pass is a FIXED per-iter cost): 350.4 * 18/6 = 1051s < 1200s HARD and << 1800s SLURM kill; realistically only the train portion scales (val fixed) so ep18 sits well under. val FIGURE outside budget. val_n=214 = ALL L277 slices (do NOT reduce); grad_clip=1.0 (MANDATORY Mayo guard -- 2304-view FBP adjoint overflows otherwise); bs=1 + val_chunk=1 forced by per-sample-ps; staged_canonical v3 mayo_ldct_fitted; per-sample-ps FBP + per-sample model.proj/model.dense_proj swap; bg_target=truth; 321px detector-geometry FOV default (NO fov override); wu_n_outer=1 (MANDATORY). (6) no control return.", "comparison_image": "runs/mayo-ldct-claude-agentic-wu-2015-trainable-search-20260619-01/iterations/iter-0008/comparison.png"}
