{"ts": "2026-06-20T03:28:17Z", "run_id": "mayo-ldct-claude-agentic-dual-domain-bilateral-n2i-search-20260619-01", "iter": 4, "agent": "dual_domain_bilateral_n2i-claude-agentic", "model": "claude-opus-4-8-1m", "change_class": "architecture", "status": "discard", "kept": false, "val_score": 0.8974753618240356, "headroom": 0.0, "params_M": 9e-06, "train_n": 400, "rationale": "dual_domain_bilateral_n2i-claude-agentic: warm_start=True, pretrain_epochs=1, pretrain_steps=20, n_iter=30, grad_clip=1.0, lr=0.0003, proj_n_bf=1, img_n_bf=2, proj_kernel=5, proj_sx=1.0, proj_sy=2.0, proj_sr=0.0005, img_kernel=7, img_sx=1.5, img_sy=1.5, img_sr=0.02, batch_size=1, train_n=200, val_n=214, outer_wall_s=1050, per_scene_s=None, seed=42, rationale=iter-4 (search-20260619-01, corrected 214-slice/321px-FOV metric). ONE KNOB: img_n_bf 1 -> 2 (image-domain trainable-bilateral DEPTH; params 6 -> 9 via 3*(proj_n_bf+img_n_bf)=3*(1+2)). proj_n_bf=1 UNCHANGED. PER-IMAGE preserved (warm-start amortized pre-pass on 4 train patients -> generic BF-sigma init, then INDEPENDENT per-scan Adam fit on EACH L277 slice OWN half-angle measurements, GT-free; NEVER amortized). SIX-BOX (NUMBERS). (1) TRAJECTORY: iter-1 lr5e-3 -> SSIM 0.92477 / PSNR 34.033 / RMSE 9.938e-4 / hr 0 / elapsed 940.4s; iter-2 proj_sr0.02->0.0005 -> SSIM 0.92473 / PSNR 34.017 / RMSE 9.956e-4 / hr 0 / elapsed 924.1s (proj_sr INERT, flat <0.05%); iter-3 lr5e-3->3e-4 -> SSIM 0.92142 / PSNR 33.650 / RMSE 1.0386e-3 / hr 0 / elapsed 863.4s. current proj_n_bf=1 img_n_bf=1 (6 params). The lr-anchoring that CLEARED baseline for the U-Net sibling dual_domain_n2i (iter-3 lr1e-3->3e-4: 0.8681/hr0 -> 0.9185/hr 0.1506 KEEP, now hr 0.198) did NOT clear baseline here -- iter-3's own falsifier FIRED: PSNR stayed BELOW the LD-FBP floor (33.65 < FBP) even at the anchored lr=3e-4, and SSIM actually DROPPED (0.9248->0.9214). (2) FAILURE MODE = 6-PARAM BILATERAL CAPACITY CEILING. The trainable-bilateral stack has the HIGHEST raw SSIM of any Mayo inference solver (0.92) yet cannot push PSNR above the FBP-PSNR floor -> hr 0. High-SSIM/hr0 is the over-smoothing signature: with only 3 image-domain DOF the BF cannot denoise without washing out fine structure, so RMSE stays high. The U-Net sibling cleared baseline because it has REAL capacity (a full denoiser); the lr lever is exhausted here (iter-3 falsifier), and proj_sr is exhausted (iter-2 falsifier). The remaining axis is image-domain CAPACITY. (3) ONE KNOB = img_n_bf 1 -> 2 (MODEST +1 step, NOT a big jump). Justified: campaign-state confirms img_n_bf-UP is the working CAPACITY lever for the bilateral N2I on the demo substrate (demo-bilat img_n_bf 1->3->5 = hr 0.28->0.33->0.33 / 0.67->0.75->0.77). On Mayo the image-domain sigma is inert (proven iter-2) but image-domain DEPTH adds genuine DOF. Param count 6 -> 9 (image-domain BF chain 1->2 layers in series; proj-domain unchanged). DELIBERATELY MODEST: the SUPERVISED bilateral sibling dual_domain_bilateral_supervised REGRESSED when img_n_bf was raised 3->6, so a big jump destabilizes -- a +1 step (1->2) probes whether ANY added image-domain capacity helps without the large-jump instability. (4) HYPOTHESIS: doubling the image-domain bilateral DOF (img_n_bf 1->2) lets the per-scan fit denoise without over-smoothing -> RMSE drops -> PSNR clears the LD-FBP floor -> hr rises above 0 (predict hr ~0.05-0.15, edging toward the U-Net sibling's 0.15). FALSIFIER (NUMBERS): if hr is STILL 0 (or regresses like the supervised sibling at 3->6) with img_n_bf=2, the trainable-bilateral architecture is STRUCTURALLY CAPPED on dense-view Mayo regardless of capacity -- only the U-Net N2I variant (real denoiser capacity) can clear the FBP floor here; that retires capacity as a lever and files the structural-ceiling verdict. (5) BUDGET (HARD 20-min = 1200s train+score): img_n_bf 1->2 adds ONE extra image-domain BF forward+backward per Adam step. The dominant per-step cost is the 2304-view FBP adjoint (FLAT in img_n_bf); the BF layers are cheap relative to it. iter-3 elapsed 863.4s = 14.4 min at img_n_bf=1; the extra BF layer adds <~10% to the per-step image-domain work (a small fraction of total) -> expect ~900-950s = ~15-16 min, comfortably inside 1200s with ~250s slack. n_iter=30, val=ALL 214, FBP-adjoint cost ALL UNCHANGED. in-solver outer_wall_s=1050 (17.5 min) backstop guarantees a recorded result even if a few slices run long. (6) HARD 20-min budget; val=ALL 214 L277 slices (NOT reduced); PER-IMAGE preserved; lr stays at the anchored 3e-4. Do NOT return control mid-campaign. PREDICTED iter-4: hr 0.05-0.15 if capacity hypothesis holds; hr<=0 falsifies (bilateral structurally capped on Mayo, only U-Net N2I works).", "advice_for_others": "dual_domain_bilateral_n2i-claude-agentic: warm_start=True, pretrain_epochs=1, pretrain_steps=20, n_iter=30, grad_clip=1.0, lr=0.0003, proj_n_bf=1, img_n_bf=2, proj_kernel=5, proj_sx=1.0, proj_sy=2.0, proj_sr=0.0005, img_kernel=7, img_sx=1.5, img_sy=1.5, img_sr=0.02, batch_size=1, train_n=200, val_n=214, outer_wall_s=1050, per_scene_s=None, seed=42, rationale=iter-4 (search-20260619-01, corrected 214-slice/321px-FOV metric). ONE KNOB: img_n_bf 1 -> 2 (image-domain trainable-bilateral DEPTH; params 6 -> 9 via 3*(proj_n_bf+img_n_bf)=3*(1+2)). proj_n_bf=1 UNCHANGED. PER-IMAGE preserved (warm-start amortized pre-pass on 4 train patients -> generic BF-sigma init, then INDEPENDENT per-scan Adam fit on EACH L277 slice OWN half-angle measurements, GT-free; NEVER amortized). SIX-BOX (NUMBERS). (1) TRAJECTORY: iter-1 lr5e-3 -> SSIM 0.92477 / PSNR 34.033 / RMSE 9.938e-4 / hr 0 / elapsed 940.4s; iter-2 proj_sr0.02->0.0005 -> SSIM 0.92473 / PSNR 34.017 / RMSE 9.956e-4 / hr 0 / elapsed 924.1s (proj_sr INERT, flat <0.05%); iter-3 lr5e-3->3e-4 -> SSIM 0.92142 / PSNR 33.650 / RMSE 1.0386e-3 / hr 0 / elapsed 863.4s. current proj_n_bf=1 img_n_bf=1 (6 params). The lr-anchoring that CLEARED baseline for the U-Net sibling dual_domain_n2i (iter-3 lr1e-3->3e-4: 0.8681/hr0 -> 0.9185/hr 0.1506 KEEP, now hr 0.198) did NOT clear baseline here -- iter-3's own falsifier FIRED: PSNR stayed BELOW the LD-FBP floor (33.65 < FBP) even at the anchored lr=3e-4, and SSIM actually DROPPED (0.9248->0.9214). (2) FAILURE MODE = 6-PARAM BILATERAL CAPACITY CEILING. The trainable-bilateral stack has the HIGHEST raw SSIM of any Mayo inference solver (0.92) yet cannot push PSNR above the FBP-PSNR floor -> hr 0. High-SSIM/hr0 is the over-smoothing signature: with only 3 image-domain DOF the BF cannot denoise without washing out fine structure, so RMSE stays high. The U-Net sibling cleared baseline because it has REAL capacity (a full denoiser); the lr lever is exhausted here (iter-3 falsifier), and proj_sr is exhausted (iter-2 falsifier). The remaining axis is image-domain CAPACITY. (3) ONE KNOB = img_n_bf 1 -> 2 (MODEST +1 step, NOT a big jump). Justified: campaign-state confirms img_n_bf-UP is the working CAPACITY lever for the bilateral N2I on the demo substrate (demo-bilat img_n_bf 1->3->5 = hr 0.28->0.33->0.33 / 0.67->0.75->0.77). On Mayo the image-domain sigma is inert (proven iter-2) but image-domain DEPTH adds genuine DOF. Param count 6 -> 9 (image-domain BF chain 1->2 layers in series; proj-domain unchanged). DELIBERATELY MODEST: the SUPERVISED bilateral sibling dual_domain_bilateral_supervised REGRESSED when img_n_bf was raised 3->6, so a big jump destabilizes -- a +1 step (1->2) probes whether ANY added image-domain capacity helps without the large-jump instability. (4) HYPOTHESIS: doubling the image-domain bilateral DOF (img_n_bf 1->2) lets the per-scan fit denoise without over-smoothing -> RMSE drops -> PSNR clears the LD-FBP floor -> hr rises above 0 (predict hr ~0.05-0.15, edging toward the U-Net sibling's 0.15). FALSIFIER (NUMBERS): if hr is STILL 0 (or regresses like the supervised sibling at 3->6) with img_n_bf=2, the trainable-bilateral architecture is STRUCTURALLY CAPPED on dense-view Mayo regardless of capacity -- only the U-Net N2I variant (real denoiser capacity) can clear the FBP floor here; that retires capacity as a lever and files the structural-ceiling verdict. (5) BUDGET (HARD 20-min = 1200s train+score): img_n_bf 1->2 adds ONE extra image-domain BF forward+backward per Adam step. The dominant per-step cost is the 2304-view FBP adjoint (FLAT in img_n_bf); the BF layers are cheap relative to it. iter-3 elapsed 863.4s = 14.4 min at img_n_bf=1; the extra BF layer adds <~10% to the per-step image-domain work (a small fraction of total) -> expect ~900-950s = ~15-16 min, comfortably inside 1200s with ~250s slack. n_iter=30, val=ALL 214, FBP-adjoint cost ALL UNCHANGED. in-solver outer_wall_s=1050 (17.5 min) backstop guarantees a recorded result even if a few slices run long. (6) HARD 20-min budget; val=ALL 214 L277 slices (NOT reduced); PER-IMAGE preserved; lr stays at the anchored 3e-4. Do NOT return control mid-campaign. PREDICTED iter-4: hr 0.05-0.15 if capacity hypothesis holds; hr<=0 falsifies (bilateral structurally capped on Mayo, only U-Net N2I works).", "comparison_image": "runs/mayo-ldct-claude-agentic-dual-domain-bilateral-n2i-search-20260619-01/iterations/iter-0004/comparison.png"}
{"ts": "2026-06-20T03:28:15Z", "run_id": "mayo-ldct-claude-agentic-dual-domain-n2i-search-20260619-01", "iter": 5, "agent": "dual_domain_n2i-claude-agentic", "model": "claude-opus-4-8-1m", "change_class": "architecture", "status": "keep", "kept": true, "val_score": 0.9168821573257446, "headroom": 0.15949228601163257, "params_M": 0.465762, "train_n": 400, "rationale": "dual_domain_n2i-claude-agentic: warm_start=True, pretrain_epochs=4, n_iter=20, grad_clip=1.0, unet_c=16, lr=0.0003, batch_size=1, train_n=200, val_n=214, outer_wall_s=1150, per_scene_s=None, seed=42, rationale=dual_domain_n2i iter-5 (search-20260619-01, PER-IMAGE Noise2Inverse: warm-start pre-pass + per-scan Adam fit; NEVER amortized). SIX-BOX (NUMBERS, measured from job 765337 / iter-4 observation). (1) TRAJECTORY (MONOTONE on the same lever): iter-3 (lr 1e-3->3e-4, n_iter=15) SSIM 0.9185, hr 0.1506, PSNR 35.50; iter-4 (n_iter 15->18) SSIM 0.9277, hr 0.19761, PSNR 35.99, RMSE 7.934e-4, elapsed 1235.5s; iter-4 fit loop 214 scenes x 18 steps measured 0.2557 s/per-scan-step (4.60 s/scene; ALL 214 completed inner_iters=18, NO per-scene-wall truncation since per_scene_s=1080/214=5.05s > 4.60s); fixed overhead (warm-start 4ep + setup + score + figure) ~267s. hr is MONOTONICALLY IMPROVING with more per-scan steps at the anchored lr=3e-4 (0.1506->0.19761), and last_loss across scenes still oscillates rather than sitting on a flat converged floor -> the per-scan fit has NOT converged at 18 steps. (2) OPPORTUNITY: this is the best per-image solver and the only N2I that cleared baseline; it is STILL CLIMBING on the n_iter lever. With lr correctly anchored at 3e-4 the per-scan fit refines (not overfits) with more steps; the overfit/lr-down regime is far above at n_iter 600-1200. (3) ONE KNOB: n_iter 18 -> 20 (+ outer_wall_s 1080 -> 1150 as a FORCED structural consequence, NOT a second tuning knob: see below). pretrain_epochs=4, lr=3e-4, grad_clip=1.0, unet_c=16, val_n=214, seed=42 ALL HELD at iter-4 -> iter-4 is the clean isolated comparison. lr is settled (do not touch); pretrain_epochs-up was falsified at iter-2 (PSNR fell); n_iter+ is the one in-budget, correctly-signed, monotone-confirmed lever. (4) HYPOTHESIS: n_iter 18->20 at anchored lr=3e-4 lifts hr above iter-4's 0.19761 (PSNR above 35.99), continuing the monotone climb, because 2 more per-scan steps further refine the FBP-consistent fit without drifting. FALSIFIER: if hr <= 0.19761 (no PSNR gain), the per-scan fit has converged at lr=3e-4 -> that is the per-image U-Net N2I ceiling on dense 2304-view Mayo (half-view info loss bounds hr near 0.20), and further per-scan-step tuning is futile -> document the ceiling (NAF/ram structural-negative class). (5) BUDGET MATH (HARD 20-min compute = 1200s for train+score; figure OUTSIDE the budget but inside the 30-min=1800s SLURM hard wall) AND PER-SCENE-TRUNCATION MATH: at the measured 0.2557 s/step, n_iter=20 -> per-scene fit time = 20 x 0.2557 = 5.11s/scene. The current outer_wall_s=1080 gives per_scene_s = 1080/214 = 5.05s < 5.11s -> EVERY scene would be SILENTLY TRUNCATED at floor(5.05/0.2557)=19 steps, producing a non-deterministic incomplete fit instead of a clean n_iter=20. Therefore outer_wall_s MUST be raised 1080->1150 so per_scene_s = 1150/214 = 5.37s > 5.11s -> ALL 214 scenes complete the full 20 steps with NO truncation (margin 0.26s/scene). This is a FORCED structural consequence of the n_iter knob (keeps the experiment clean), not an independent tuning lever. Fit loop = 214 x 20 x 0.2557 = 1093.4s; + non-figure overhead (warm-start 4ep ~200s + setup/score ~40s) ~240s = ~1333s compute; + figure ~27s = ~1360s elapsed = 22.7 min, 440s (7.3 min) under the 1800s SLURM hard-kill. n_iter=22 was rejected: fit 214x22x0.2557=1204s alone -> compute ~1444s, pushing into the figure-inclusive zone with thinner SLURM margin AND requiring outer_wall_s 1250; n_iter=20 is the conservative, monotone-confirmed +2 step that stays in budget with comfortable truncation margin. val_n=214 NOT reduced (protocol). 321px detector-geometry FOV default (no fov=False). staged_canonical / v3 mayo_ldct_fitted / per-sample-ps / bg_target=truth hard-wired. PER-IMAGE structure UNCHANGED (warm-start pre-pass + per-scan fit; NEVER amortized). (6) no control return.", "advice_for_others": "dual_domain_n2i-claude-agentic: warm_start=True, pretrain_epochs=4, n_iter=20, grad_clip=1.0, unet_c=16, lr=0.0003, batch_size=1, train_n=200, val_n=214, outer_wall_s=1150, per_scene_s=None, seed=42, rationale=dual_domain_n2i iter-5 (search-20260619-01, PER-IMAGE Noise2Inverse: warm-start pre-pass + per-scan Adam fit; NEVER amortized). SIX-BOX (NUMBERS, measured from job 765337 / iter-4 observation). (1) TRAJECTORY (MONOTONE on the same lever): iter-3 (lr 1e-3->3e-4, n_iter=15) SSIM 0.9185, hr 0.1506, PSNR 35.50; iter-4 (n_iter 15->18) SSIM 0.9277, hr 0.19761, PSNR 35.99, RMSE 7.934e-4, elapsed 1235.5s; iter-4 fit loop 214 scenes x 18 steps measured 0.2557 s/per-scan-step (4.60 s/scene; ALL 214 completed inner_iters=18, NO per-scene-wall truncation since per_scene_s=1080/214=5.05s > 4.60s); fixed overhead (warm-start 4ep + setup + score + figure) ~267s. hr is MONOTONICALLY IMPROVING with more per-scan steps at the anchored lr=3e-4 (0.1506->0.19761), and last_loss across scenes still oscillates rather than sitting on a flat converged floor -> the per-scan fit has NOT converged at 18 steps. (2) OPPORTUNITY: this is the best per-image solver and the only N2I that cleared baseline; it is STILL CLIMBING on the n_iter lever. With lr correctly anchored at 3e-4 the per-scan fit refines (not overfits) with more steps; the overfit/lr-down regime is far above at n_iter 600-1200. (3) ONE KNOB: n_iter 18 -> 20 (+ outer_wall_s 1080 -> 1150 as a FORCED structural consequence, NOT a second tuning knob: see below). pretrain_epochs=4, lr=3e-4, grad_clip=1.0, unet_c=16, val_n=214, seed=42 ALL HELD at iter-4 -> iter-4 is the clean isolated comparison. lr is settled (do not touch); pretrain_epochs-up was falsified at iter-2 (PSNR fell); n_iter+ is the one in-budget, correctly-signed, monotone-confirmed lever. (4) HYPOTHESIS: n_iter 18->20 at anchored lr=3e-4 lifts hr above iter-4's 0.19761 (PSNR above 35.99), continuing the monotone climb, because 2 more per-scan steps further refine the FBP-consistent fit without drifting. FALSIFIER: if hr <= 0.19761 (no PSNR gain), the per-scan fit has converged at lr=3e-4 -> that is the per-image U-Net N2I ceiling on dense 2304-view Mayo (half-view info loss bounds hr near 0.20), and further per-scan-step tuning is futile -> document the ceiling (NAF/ram structural-negative class). (5) BUDGET MATH (HARD 20-min compute = 1200s for train+score; figure OUTSIDE the budget but inside the 30-min=1800s SLURM hard wall) AND PER-SCENE-TRUNCATION MATH: at the measured 0.2557 s/step, n_iter=20 -> per-scene fit time = 20 x 0.2557 = 5.11s/scene. The current outer_wall_s=1080 gives per_scene_s = 1080/214 = 5.05s < 5.11s -> EVERY scene would be SILENTLY TRUNCATED at floor(5.05/0.2557)=19 steps, producing a non-deterministic incomplete fit instead of a clean n_iter=20. Therefore outer_wall_s MUST be raised 1080->1150 so per_scene_s = 1150/214 = 5.37s > 5.11s -> ALL 214 scenes complete the full 20 steps with NO truncation (margin 0.26s/scene). This is a FORCED structural consequence of the n_iter knob (keeps the experiment clean), not an independent tuning lever. Fit loop = 214 x 20 x 0.2557 = 1093.4s; + non-figure overhead (warm-start 4ep ~200s + setup/score ~40s) ~240s = ~1333s compute; + figure ~27s = ~1360s elapsed = 22.7 min, 440s (7.3 min) under the 1800s SLURM hard-kill. n_iter=22 was rejected: fit 214x22x0.2557=1204s alone -> compute ~1444s, pushing into the figure-inclusive zone with thinner SLURM margin AND requiring outer_wall_s 1250; n_iter=20 is the conservative, monotone-confirmed +2 step that stays in budget with comfortable truncation margin. val_n=214 NOT reduced (protocol). 321px detector-geometry FOV default (no fov=False). staged_canonical / v3 mayo_ldct_fitted / per-sample-ps / bg_target=truth hard-wired. PER-IMAGE structure UNCHANGED (warm-start pre-pass + per-scan fit; NEVER amortized). (6) no control return.", "comparison_image": "runs/mayo-ldct-claude-agentic-dual-domain-n2i-search-20260619-01/iterations/iter-0005/comparison.png"}
