{"ts": "2026-06-20T06:00:16Z", "run_id": "mayo-ldct-claude-agentic-diff-recon-dcstep-constrained-mayo-v4-search-20260619-01", "iter": 4, "agent": "diffusion_recon_dcstep_constrained_mayo_v4-claude-agentic", "model": "claude-opus-4-8-1m", "change_class": "architecture", "status": "discard", "kept": false, "val_score": 0.4784381091594696, "headroom": 0.0, "params_M": 8.594211, "train_n": 400, "rationale": "diffusion_recon_dcstep_constrained_mayo_v4-claude-agentic: recon_ckpt=/cluster/maier/Agent4CT/checkpoints/ddpm_mayo_constrained_v4.pt, recon_mode=dps, recon_sample_steps=28, recon_eta=30.0, recon_init=fbp, recon_eta_clamp=False, recon_dcstep_every=5, recon_dcstep_n_cg=3, recon_dcstep_warmup=5, recon_dcstep_relax=1.0, val_n=214, train_n=0, rationale=iter-4 search-20260619-01 CONSTRAINED diff-recon \u2014 CONFIRMATION iter (last untried lever). BASE = iter-1 BEST config (eta=30.0, relax=1.0, every5/n_cg3/warmup5), NOT iter-2/3: the eta+relax levers are EXHAUSTED and both REGRESSED from iter-1. TRAJECTORY (val=ALL 214 L277, 321px geometry FOV): iter-1 eta=30/relax=1.0/T=25 SSIM 0.3937 (BEST) / hr 0; iter-2 eta 30->1 -> 0.2366 (regressed); iter-3 relax 1.0->0.3 -> 0.2377 (flat). All hr 0, all stuck in the 0.24-0.39 band, FAR below the ~0.81 LD-FBP floor. ONE KNOB: recon_sample_steps 25->28 (the DDIM reverse-step count T = the last untried lever, restarted from the iter-1 best config). FAILURE MODE (numbers): the recon sits 0.39 vs the 0.81 FBP floor and eta (DPS gain) + relax (hard-DC blend) both FAILED to move it off that band -> the corruption is NOT a step-size or DC-weight issue; the remaining hypothesis is that the 25-step low-T DDIM schedule is too coarse to let the constrained hard-DC trajectory converge. The unconstrained sibling's n_steps lever was ALSO flat (T 25->32: 0.396->0.387, hr 0), which is the strong prior that T-up won't help on the constrained side either. HYPOTHESIS: if a finer 28-step schedule meaningfully helped, SSIM would clear the ~0.81 FBP floor (hr>0); I predict it stays ~0.3-0.4 / hr 0 (cf. unconstrained T-up flat). FALSIFIER: if SSIM clears the FBP floor (hr>0) -> the Mayo v4 prior is NOT structurally mismatched, just T-budget-limited -> keep climbing T. If SSIM stays ~0.3-0.4 / hr 0 -> the eta, relax, AND T levers are all exhausted: FILE THE DIFFUSION-PRIOR-MISMATCH VERDICT (Mayo v4 DDPM globally faithful but not conditionally faithful under DPS/DC, mirroring the breast-DDPM hr=0 structural verdict); the constrained best stays iter-1 (SSIM 0.394, hr 0). BUDGET: cost is linear in n_steps (sample_guided loops `for k in range(n_steps)`, one UNet+DPS-grad eval/step + DC-CG on k in {5,10,15,20,25}). iter-1 ran 214 slices in 1018.96 s at T=25 = 40.8 s/step -> T=28 ~= 40.8*28 + ~5 DC events ~= 1163 s ~= 19.4 min < 20-min wall (1800 s in-solver backstop + 30-min --time as further backstops). T=30 was REJECTED as too tight (~21 min, would blow the hard 20-min budget). val=ALL 214 L277, 321px detector-geometry FOV default.", "advice_for_others": "diffusion_recon_dcstep_constrained_mayo_v4-claude-agentic: recon_ckpt=/cluster/maier/Agent4CT/checkpoints/ddpm_mayo_constrained_v4.pt, recon_mode=dps, recon_sample_steps=28, recon_eta=30.0, recon_init=fbp, recon_eta_clamp=False, recon_dcstep_every=5, recon_dcstep_n_cg=3, recon_dcstep_warmup=5, recon_dcstep_relax=1.0, val_n=214, train_n=0, rationale=iter-4 search-20260619-01 CONSTRAINED diff-recon \u2014 CONFIRMATION iter (last untried lever). BASE = iter-1 BEST config (eta=30.0, relax=1.0, every5/n_cg3/warmup5), NOT iter-2/3: the eta+relax levers are EXHAUSTED and both REGRESSED from iter-1. TRAJECTORY (val=ALL 214 L277, 321px geometry FOV): iter-1 eta=30/relax=1.0/T=25 SSIM 0.3937 (BEST) / hr 0; iter-2 eta 30->1 -> 0.2366 (regressed); iter-3 relax 1.0->0.3 -> 0.2377 (flat). All hr 0, all stuck in the 0.24-0.39 band, FAR below the ~0.81 LD-FBP floor. ONE KNOB: recon_sample_steps 25->28 (the DDIM reverse-step count T = the last untried lever, restarted from the iter-1 best config). FAILURE MODE (numbers): the recon sits 0.39 vs the 0.81 FBP floor and eta (DPS gain) + relax (hard-DC blend) both FAILED to move it off that band -> the corruption is NOT a step-size or DC-weight issue; the remaining hypothesis is that the 25-step low-T DDIM schedule is too coarse to let the constrained hard-DC trajectory converge. The unconstrained sibling's n_steps lever was ALSO flat (T 25->32: 0.396->0.387, hr 0), which is the strong prior that T-up won't help on the constrained side either. HYPOTHESIS: if a finer 28-step schedule meaningfully helped, SSIM would clear the ~0.81 FBP floor (hr>0); I predict it stays ~0.3-0.4 / hr 0 (cf. unconstrained T-up flat). FALSIFIER: if SSIM clears the FBP floor (hr>0) -> the Mayo v4 prior is NOT structurally mismatched, just T-budget-limited -> keep climbing T. If SSIM stays ~0.3-0.4 / hr 0 -> the eta, relax, AND T levers are all exhausted: FILE THE DIFFUSION-PRIOR-MISMATCH VERDICT (Mayo v4 DDPM globally faithful but not conditionally faithful under DPS/DC, mirroring the breast-DDPM hr=0 structural verdict); the constrained best stays iter-1 (SSIM 0.394, hr 0). BUDGET: cost is linear in n_steps (sample_guided loops `for k in range(n_steps)`, one UNet+DPS-grad eval/step + DC-CG on k in {5,10,15,20,25}). iter-1 ran 214 slices in 1018.96 s at T=25 = 40.8 s/step -> T=28 ~= 40.8*28 + ~5 DC events ~= 1163 s ~= 19.4 min < 20-min wall (1800 s in-solver backstop + 30-min --time as further backstops). T=30 was REJECTED as too tight (~21 min, would blow the hard 20-min budget). val=ALL 214 L277, 321px detector-geometry FOV default.", "comparison_image": "runs/mayo-ldct-claude-agentic-diff-recon-dcstep-constrained-mayo-v4-search-20260619-01/iterations/iter-0004/comparison.png"}
{"ts": "2026-06-20T05:32:38Z", "run_id": "mayo-ldct-claude-agentic-r2gaussian-search-20260619-01", "iter": 4, "agent": "r2gaussian-claude-agentic", "model": "claude-opus-4-8-1m", "change_class": "architecture", "status": "discard", "kept": false, "val_score": 0.7273580431938171, "headroom": 0.0, "params_M": 0.003072, "train_n": 400, "rationale": "r2gaussian-claude-agentic: val_n=214, gs_n_gaussians=512, gs_n_iter=100, gs_lr_pos=0.005, gs_lr_scale=0.01, gs_lr_amp=0.01, gs_lr_rot=0.01, gs_amp_init=0.01, gs_scale_init=0.04, gs_tv_weight=0.0001, gs_n_clip=0.05, gs_init_from_fbp=False, gs_outer_wall_s=1080, rationale=iter-4 TERMINAL CONFIRMATION (search-20260619-01). ONE KNOB: gs_n_iter 60->100 (the only unmapped interior point between iter-3's 60 and iter-1's 150). FAILURE MODE (now structurally established across 3 iters): R2-Gaussian is a PER-SCENE Gaussian-splatting fit (no training, no amortization) and is BUDGET-INCOMPATIBLE with the 214-slice Mayo protocol at the hard 20-min wall. The exact [fit] outer-wall scene counts from the SLURM logs: iter-1 n_iter=150 -> sample 26 (12% coverage), SSIM 0.738335; iter-2 n_iter=400 -> sample 10 (4.7%), SSIM 0.736981; iter-3 n_iter=60 -> sample 64 (30%), SSIM 0.680981. BOTH levers are now REFUTED in NUMBERS: (a) iter-2 QUALITY lever -- 2.67x more Adam steps (150->400) moved the 214-avg by -0.0001 (FLAT); (b) iter-3 COVERAGE lever -- 2.5x more completed scenes (26->64) DROPPED the 214-avg by -0.057 (0.7383->0.6810). The iter-3 drop is the decisive signal: a partially-converged 60-step Gaussian recon scores BELOW the LD-FBP init it replaces, so adding fit-scenes is net-DESTRUCTIVE -- per-scene Gaussian splatting needs far more than 60-150 Adam steps to even match FBP on dense 2304-view Mayo (the discarded 20260614 run needed ~6000 iters/scene to reach SSIM 0.89-0.92, which at 0.282 s/step is 28 min/scene -> 0 of 214 scenes fit in 20 min). The 214-avg is a mixture: completed scenes are scored at their (under-fit, sub-FBP) Gaussian recon, the rest at their ~0.808 FBP-init; the peak of the mixture sits where FEW scenes are touched and most keep their good FBP init -- i.e. near iter-1's n_iter=150 / 26 scenes (0.7383). HYPOTHESIS (falsifiable in NUMBERS): the (coverage, SSIM) curve is smooth and monotone over [60,150]; n_iter=100 -> per-scene 0.282*100 = 28.2 s -> 1080/28.2 = ~38/214 scenes -> predicted SSIM in (0.681, 0.738), strictly BELOW iter-1's 0.738. PREDICTION: SSIM <= 0.74, hr 0. FALSIFIER: if n_iter=100 BEATS 0.738335 (iter-1 best), an interior quality-vs-coverage optimum exists and 150 is NOT the peak -> re-map. If n_iter=100 lands in (0.681, 0.738) as predicted, NO gs_n_iter beats 0.7383 -> file the STRUCTURAL budget-incompatibility verdict: R2-Gaussian cannot simultaneously cover all 214 slices AND fit any scene above its FBP init within the 20-min wall; best stays iter-1 (n_iter=150, SSIM 0.7383, hr=0, BELOW the 0.808 LD-FBP baseline). BUDGET MATH: 38 scenes * 28.2 s = 1072s ~ the 1080s outer wall (self-truncates and scores whatever completed, exactly as iter-1/2/3); SLURM --time=00:30:00 has headroom, val figure excluded. val_n stays 214 (NOT reduced) per mandate; gs_n_gaussians held at 512 (<=1024 cap). TRAJECTORY: iter-2 0.7370 (10/214) -> iter-1 0.7383 (26/214, BEST) -> iter-4 predicted ~0.71-0.73 (38/214) -> iter-3 0.6810 (64/214). Monotone-decreasing in coverage -> R2-Gaussian is STRUCTURALLY budget-incompatible with the 214-slice Mayo protocol (documented NEGATIVE RESULT).", "advice_for_others": "r2gaussian-claude-agentic: val_n=214, gs_n_gaussians=512, gs_n_iter=100, gs_lr_pos=0.005, gs_lr_scale=0.01, gs_lr_amp=0.01, gs_lr_rot=0.01, gs_amp_init=0.01, gs_scale_init=0.04, gs_tv_weight=0.0001, gs_n_clip=0.05, gs_init_from_fbp=False, gs_outer_wall_s=1080, rationale=iter-4 TERMINAL CONFIRMATION (search-20260619-01). ONE KNOB: gs_n_iter 60->100 (the only unmapped interior point between iter-3's 60 and iter-1's 150). FAILURE MODE (now structurally established across 3 iters): R2-Gaussian is a PER-SCENE Gaussian-splatting fit (no training, no amortization) and is BUDGET-INCOMPATIBLE with the 214-slice Mayo protocol at the hard 20-min wall. The exact [fit] outer-wall scene counts from the SLURM logs: iter-1 n_iter=150 -> sample 26 (12% coverage), SSIM 0.738335; iter-2 n_iter=400 -> sample 10 (4.7%), SSIM 0.736981; iter-3 n_iter=60 -> sample 64 (30%), SSIM 0.680981. BOTH levers are now REFUTED in NUMBERS: (a) iter-2 QUALITY lever -- 2.67x more Adam steps (150->400) moved the 214-avg by -0.0001 (FLAT); (b) iter-3 COVERAGE lever -- 2.5x more completed scenes (26->64) DROPPED the 214-avg by -0.057 (0.7383->0.6810). The iter-3 drop is the decisive signal: a partially-converged 60-step Gaussian recon scores BELOW the LD-FBP init it replaces, so adding fit-scenes is net-DESTRUCTIVE -- per-scene Gaussian splatting needs far more than 60-150 Adam steps to even match FBP on dense 2304-view Mayo (the discarded 20260614 run needed ~6000 iters/scene to reach SSIM 0.89-0.92, which at 0.282 s/step is 28 min/scene -> 0 of 214 scenes fit in 20 min). The 214-avg is a mixture: completed scenes are scored at their (under-fit, sub-FBP) Gaussian recon, the rest at their ~0.808 FBP-init; the peak of the mixture sits where FEW scenes are touched and most keep their good FBP init -- i.e. near iter-1's n_iter=150 / 26 scenes (0.7383). HYPOTHESIS (falsifiable in NUMBERS): the (coverage, SSIM) curve is smooth and monotone over [60,150]; n_iter=100 -> per-scene 0.282*100 = 28.2 s -> 1080/28.2 = ~38/214 scenes -> predicted SSIM in (0.681, 0.738), strictly BELOW iter-1's 0.738. PREDICTION: SSIM <= 0.74, hr 0. FALSIFIER: if n_iter=100 BEATS 0.738335 (iter-1 best), an interior quality-vs-coverage optimum exists and 150 is NOT the peak -> re-map. If n_iter=100 lands in (0.681, 0.738) as predicted, NO gs_n_iter beats 0.7383 -> file the STRUCTURAL budget-incompatibility verdict: R2-Gaussian cannot simultaneously cover all 214 slices AND fit any scene above its FBP init within the 20-min wall; best stays iter-1 (n_iter=150, SSIM 0.7383, hr=0, BELOW the 0.808 LD-FBP baseline). BUDGET MATH: 38 scenes * 28.2 s = 1072s ~ the 1080s outer wall (self-truncates and scores whatever completed, exactly as iter-1/2/3); SLURM --time=00:30:00 has headroom, val figure excluded. val_n stays 214 (NOT reduced) per mandate; gs_n_gaussians held at 512 (<=1024 cap). TRAJECTORY: iter-2 0.7370 (10/214) -> iter-1 0.7383 (26/214, BEST) -> iter-4 predicted ~0.71-0.73 (38/214) -> iter-3 0.6810 (64/214). Monotone-decreasing in coverage -> R2-Gaussian is STRUCTURALLY budget-incompatible with the 214-slice Mayo protocol (documented NEGATIVE RESULT).", "comparison_image": "runs/mayo-ldct-claude-agentic-r2gaussian-search-20260619-01/iterations/iter-0004/comparison.png"}
{"ts": "2026-06-20T05:18:17Z", "run_id": "mayo-ldct-claude-agentic-ram-search-20260619-01", "iter": 4, "agent": "ram_zeroshot-claude-agentic", "model": "claude-opus-4-8-1m", "change_class": "architecture", "status": "discard", "kept": false, "val_score": 0.9024628400802612, "headroom": 0.0, "params_M": 35.618953, "train_n": 400, "rationale": "ram_zeroshot-claude-agentic: ram_ckpt_path=/cluster/maier/Agent4CT/checkpoints/ram.pth.tar, ram_input_norm=adjoint_max, ram_clamp_output=True, ram_finetune=False, ram_finetune_epochs=0, ram_finetune_lr=0.0001, ram_disable_multiscale=True, ram_disable_cudnn=False, ram_use_deepinv_tomo=False, ram_sigma=0.02, ram_factor=0.55, ram_post_fbp_blend=0.3, val_n=214, rationale=iter-4 (search-20260619-01, corrected protocol) CONFIRMATION iter. ONE knob = the LAST untried RAM hyperparameter: ram_sigma 0.005->0.02 (4x). All other knobs RETURN to the iter-1 point (ram_factor 0.2->0.55, ram_post_fbp_blend 0.3, adjoint_max norm, multiscale disabled, finetune OFF) so the ONLY change vs iter-1 is the denoiser noise-conditioning, isolating ram_sigma cleanly. cfg_full audit: across iters 1-3 ram_sigma sat at its CONFIG DEFAULT 5e-3 and was NEVER moved, whereas ram_input_norm was already set off-default to adjoint_max at iter-1 -> ram_sigma is the one remaining knob still at default. SEMANTICS (solver_ram.py L15/L327/L346): ram_sigma is the Gaussian noise-level conditioning passed to physics.noise_model (dinv.physics.GaussianNoise(sigma=ram_sigma)) -- it tells the pretrained RAM denoiser HOW NOISY to treat the input, i.e. the prior STRENGTH, which is the core mechanism by which RAM is supposed to add recoverable signal beyond its FBP init. Raising it 4x (0.005->0.02) makes RAM denoise MORE aggressively -- the most aggressive single-knob test of whether the RAM prior carries ANY LDCT-specific recoverable signal at ANY strength. Trajectory under the corrected 214-slice/321px-FOV metric: iter-1 SSIM 0.8611 hr 0.0 (blend0.3/factor0.55/sigma0.005); iter-2 SSIM 0.8644 hr EXACTLY 0.0 (blend0.3->0.5 -- post-hoc linear FBP/RAM mix EXHAUSTED); iter-3 SSIM 0.8968 hr 0.0 (factor0.55->0.2 -- internal prox_l2 DC gain EXHAUSTED; weakening the DC realign RAISED raw SSIM +0.033 but kept calibrated headroom pinned at 0.0). SSIM rose 0.861->0.864->0.897 yet PSNR stayed below the LD-FBP floor on the RMSE-sensitive calibrated metric throughout (baseline LD-FBP 0.8078, oracle HD-FBP 0.9331). SIX-BOX (NUMBERS, not CT pixels): (1) prev result: hr 0.0 on all of post-hoc blend AND internal prox_l2 gain; (2) FBP-bound named: RAM is a pretrained zero-shot deepinv recon that never saw real LDCT helical-rebinned 2304-view fan data; its denoiser prior adds no recoverable signal over FBP on dense Mayo -> the calibrated headroom is pinned at the LD-FBP floor (hr=0) regardless of which inference knob moves; (3) ONE knob: ram_sigma 0.005->0.02 (the last untried hyperparameter, the denoiser prior strength); (4) hypothesis: hr stays EXACTLY 0.0 -- the noise-conditioning does not matter because the RAM prior carries no LDCT-specific signal; predict hr 0; (5) falsifier: if hr at ram_sigma=0.02 != 0.0 (rises OR drops), RAM's denoiser strength DOES move the metric and RAM is NOT purely FBP-bounded; (6) verdict trigger: if hr stays 0.0 across the post-hoc blend (iter-2), the internal prox_l2 gain (iter-3), AND now the denoiser noise-conditioning (iter-4), RAM is CONFIRMED structurally FBP-bounded on dense Mayo across ALL three inference levers -> FILE FBP-BOUND NEGATIVE RESULT, STOP iterating this solver. Budget: only a scalar GaussianNoise sigma changes -> zero added compute vs iter-3 (iter-2 ran 1100.9 s = 18.3 min for 214 single forward passes + one op-norm power iter), inside the HARD 20-min train+score budget; sbatch --time=00:30:00 backstop wall. val_n stays 214 (score ALL L277 slices @ 321px detector-geometry FOV). HARD-WIRED: staged_canonical, v3 mayo_ldct_fitted, per-sample-ps, bg_target=truth, 321px FOV default.", "advice_for_others": "ram_zeroshot-claude-agentic: ram_ckpt_path=/cluster/maier/Agent4CT/checkpoints/ram.pth.tar, ram_input_norm=adjoint_max, ram_clamp_output=True, ram_finetune=False, ram_finetune_epochs=0, ram_finetune_lr=0.0001, ram_disable_multiscale=True, ram_disable_cudnn=False, ram_use_deepinv_tomo=False, ram_sigma=0.02, ram_factor=0.55, ram_post_fbp_blend=0.3, val_n=214, rationale=iter-4 (search-20260619-01, corrected protocol) CONFIRMATION iter. ONE knob = the LAST untried RAM hyperparameter: ram_sigma 0.005->0.02 (4x). All other knobs RETURN to the iter-1 point (ram_factor 0.2->0.55, ram_post_fbp_blend 0.3, adjoint_max norm, multiscale disabled, finetune OFF) so the ONLY change vs iter-1 is the denoiser noise-conditioning, isolating ram_sigma cleanly. cfg_full audit: across iters 1-3 ram_sigma sat at its CONFIG DEFAULT 5e-3 and was NEVER moved, whereas ram_input_norm was already set off-default to adjoint_max at iter-1 -> ram_sigma is the one remaining knob still at default. SEMANTICS (solver_ram.py L15/L327/L346): ram_sigma is the Gaussian noise-level conditioning passed to physics.noise_model (dinv.physics.GaussianNoise(sigma=ram_sigma)) -- it tells the pretrained RAM denoiser HOW NOISY to treat the input, i.e. the prior STRENGTH, which is the core mechanism by which RAM is supposed to add recoverable signal beyond its FBP init. Raising it 4x (0.005->0.02) makes RAM denoise MORE aggressively -- the most aggressive single-knob test of whether the RAM prior carries ANY LDCT-specific recoverable signal at ANY strength. Trajectory under the corrected 214-slice/321px-FOV metric: iter-1 SSIM 0.8611 hr 0.0 (blend0.3/factor0.55/sigma0.005); iter-2 SSIM 0.8644 hr EXACTLY 0.0 (blend0.3->0.5 -- post-hoc linear FBP/RAM mix EXHAUSTED); iter-3 SSIM 0.8968 hr 0.0 (factor0.55->0.2 -- internal prox_l2 DC gain EXHAUSTED; weakening the DC realign RAISED raw SSIM +0.033 but kept calibrated headroom pinned at 0.0). SSIM rose 0.861->0.864->0.897 yet PSNR stayed below the LD-FBP floor on the RMSE-sensitive calibrated metric throughout (baseline LD-FBP 0.8078, oracle HD-FBP 0.9331). SIX-BOX (NUMBERS, not CT pixels): (1) prev result: hr 0.0 on all of post-hoc blend AND internal prox_l2 gain; (2) FBP-bound named: RAM is a pretrained zero-shot deepinv recon that never saw real LDCT helical-rebinned 2304-view fan data; its denoiser prior adds no recoverable signal over FBP on dense Mayo -> the calibrated headroom is pinned at the LD-FBP floor (hr=0) regardless of which inference knob moves; (3) ONE knob: ram_sigma 0.005->0.02 (the last untried hyperparameter, the denoiser prior strength); (4) hypothesis: hr stays EXACTLY 0.0 -- the noise-conditioning does not matter because the RAM prior carries no LDCT-specific signal; predict hr 0; (5) falsifier: if hr at ram_sigma=0.02 != 0.0 (rises OR drops), RAM's denoiser strength DOES move the metric and RAM is NOT purely FBP-bounded; (6) verdict trigger: if hr stays 0.0 across the post-hoc blend (iter-2), the internal prox_l2 gain (iter-3), AND now the denoiser noise-conditioning (iter-4), RAM is CONFIRMED structurally FBP-bounded on dense Mayo across ALL three inference levers -> FILE FBP-BOUND NEGATIVE RESULT, STOP iterating this solver. Budget: only a scalar GaussianNoise sigma changes -> zero added compute vs iter-3 (iter-2 ran 1100.9 s = 18.3 min for 214 single forward passes + one op-norm power iter), inside the HARD 20-min train+score budget; sbatch --time=00:30:00 backstop wall. val_n stays 214 (score ALL L277 slices @ 321px detector-geometry FOV). HARD-WIRED: staged_canonical, v3 mayo_ldct_fitted, per-sample-ps, bg_target=truth, 321px FOV default.", "comparison_image": "runs/mayo-ldct-claude-agentic-ram-search-20260619-01/iterations/iter-0004/comparison.png"}
