{"ts": "2026-06-20T02:57:24Z", "run_id": "mayo-ldct-claude-agentic-uswin-search-20260619-01", "iter": 4, "agent": "uswin-claude-agentic", "model": "claude-opus-4-8-1m", "change_class": "architecture", "status": "keep", "kept": true, "val_score": 0.8927730321884155, "headroom": 0.2725325074497772, "params_M": 7.024897, "train_n": 400, "rationale": "uswin-claude-agentic: train_n=200, val_n=214, epochs=34, batch_size=4, lr=0.0005, uswin_c=32, swin_window=8, swin_heads=4, grad_clip=1.0, max_train_s=900, seed=42, rationale=ITER-4 (search-20260619-01, corrected protocol). ONE KNOB: CAPACITY uswin_c 24 -> 32 (every encoder level widens c, 2c, 4c, 8c; the WindowMSA at each level runs MHA on the wider dim with heads HELD at 4 -> head_dim = 32/4 = 8 valid, 24/4=6 before; uswin_c=32 is in the sanctioned TPE search space [16,24,32]; params ~3.95M -> ~6.9M, a (32/24)^2 = 1.778x conv+attention compute bump), with epochs TRADED DOWN 64 -> 34 to fit the HARD 20-min (1200s) train+score wall. This is the same capacity-for-epochs trade the champion dual_domain_supervised just ran (c16->24, ep27->10). SIX-BOX (NUMBERS). (1) TRAJECTORY iter-1 ep10 c24 -> SSIM 0.885910 / hr 0.173021 in 328.96s; iter-2 ep40 c24 -> SSIM 0.914097 / hr 0.322063 in 737.72s; iter-3 ep64 c24 -> SSIM 0.924443 / hr 0.353196 in 1085.87s (CURRENT, #2 on the Mayo board). current config uswin_c=24 epochs=64. (2) LIMITER: the epochs lever is now BOTH wall-locked AND showing diminishing returns. WALL: iter-3 ep64 used 1085.87s = 90.5pct of the 1200s budget; the iter-3 note computed ep72 -> 1174s = 19.6 min (only 26s margin), so epochs cannot meaningfully rise. DIMINISHING RETURNS: hr gained +0.149 over ep10->40 (+30 ep) but only +0.031 over ep40->64 (+24 ep) -> the per-epoch hr slope is flattening, the c24 net is approaching its training-convergence basin. iter-3's OWN falsifier named this exact pivot: 'if hr plateaus ... iter-4 must raise uswin_c (24->32)'. The new lever is CAPACITY, not epochs. (3) ONE KNOB: uswin_c 24->32, epochs 64->34; ALL else held (train_n=200, val_n=214, bs=4, lr=5e-4, swin_window=8, swin_heads=4, grad_clip=1.0, seed=42). BUDGET-TRADE MATH (worst-case-sized, mirroring the champion's method): from the two measured c24 (epochs, elapsed_s) points (40,737.72),(64,1085.87): per_epoch_c24 = (1085.87-737.72)/(64-40) = 14.51 s/epoch; fixed_c24 (data load + 214-slice per-sample val + figure I/O) = 737.72 - 40*14.51 = 157.3s (predicts ep64 = 157.3 + 64*14.51 = 1086.0s vs actual 1085.87 -> calibration exact). A c24->c32 widening multiplies the U-Net+attention compute by (32/24)^2 = 1.778x; the per-sample 2304-view FBP adjoint is c-INDEPENDENT. WORST CASE (pessimistically assume EVERYTHING incl. the FBP adjoint scales 1.778x): per_epoch_worst = 14.51*1.778 = 25.80 s/epoch; fixed_worst = 157.3*1.778 = 279.7s. Largest epoch count fitting 1200s: (1200-279.7)/25.80 = 35.7 -> ep34 worst-case = 279.7 + 34*25.80 = 1156.9s = 19.3 min (43s margin inside the 1200s budget; sbatch wall is 30 min). ep36 worst-case = 1208.5s BUSTS the budget, so ep34 is the LARGEST epoch count guaranteed to fit even the worst case; epochs is sized to the worst-case bound, not the optimistic one (a wall-bust wastes the whole QOS slot). REALISTIC (FBP adjoint ~30pct of per-epoch, c-independent): per_epoch_real = 14.51*(0.30+0.70*1.778) = 22.42 s/epoch -> ep34 real ~ 243 + 34*22.42 = 1005s = 16.7 min, comfortable headroom. Train-only worst = 34*25.80 = 877s < max_train_s=900 backstop (set to 900 so train always halts leaving >=300s for the worst-case val+figure inside the 1200s budget; iter-3 used 1000 but the bigger net's fixed-cost grew, so 900 is the safe backstop). (4) HYPOTHESIS: 1.778x more representational capacity lifts hr above the iter-3 0.353196 toward/past the champion dual_domain_supervised's 0.365, even at the reduced ep34, because uswin's hr is flattening at c24 (training-basin) yet remains a strong Mayo image-domain denoiser and c32 is its top sanctioned capacity. Predicted iter-4 hr ~0.36-0.38. FALSIFIER (NUMBERS): if hr <= 0.353196 at uswin_c=32/ep34, uswin has hit its representational ceiling on this val set (~0.355) AND/OR ep34 under-trained the bigger net more than the added capacity helped -> iter-5 either (a) keeps c32 and recovers epochs toward the wall if the measured c32 per-epoch is cheaper than the 25.80s worst case (i.e. ep34 left budget headroom), or (b) reverts to c24/ep64 and accepts 0.3532 as the uswin ceiling. (5) HARD 20-min train+score budget; val_n=214 = ALL L277 slices (NOT reduced); grad_clip=1.0 retained (mandatory; the 2304-view Mayo FBP adjoint amplifies gradients). HARD-WIRED (unchanged): staged_canonical v3 mayo_ldct_fitted geometry, per-sample-ps FBP, bg_target=truth, metric=321px detector-geometry FOV (evaluate_calibrated default for AGENT4CT_DATASET=mayo_ldct_2d; no fov= override). (6) no control return.", "advice_for_others": "uswin-claude-agentic: train_n=200, val_n=214, epochs=34, batch_size=4, lr=0.0005, uswin_c=32, swin_window=8, swin_heads=4, grad_clip=1.0, max_train_s=900, seed=42, rationale=ITER-4 (search-20260619-01, corrected protocol). ONE KNOB: CAPACITY uswin_c 24 -> 32 (every encoder level widens c, 2c, 4c, 8c; the WindowMSA at each level runs MHA on the wider dim with heads HELD at 4 -> head_dim = 32/4 = 8 valid, 24/4=6 before; uswin_c=32 is in the sanctioned TPE search space [16,24,32]; params ~3.95M -> ~6.9M, a (32/24)^2 = 1.778x conv+attention compute bump), with epochs TRADED DOWN 64 -> 34 to fit the HARD 20-min (1200s) train+score wall. This is the same capacity-for-epochs trade the champion dual_domain_supervised just ran (c16->24, ep27->10). SIX-BOX (NUMBERS). (1) TRAJECTORY iter-1 ep10 c24 -> SSIM 0.885910 / hr 0.173021 in 328.96s; iter-2 ep40 c24 -> SSIM 0.914097 / hr 0.322063 in 737.72s; iter-3 ep64 c24 -> SSIM 0.924443 / hr 0.353196 in 1085.87s (CURRENT, #2 on the Mayo board). current config uswin_c=24 epochs=64. (2) LIMITER: the epochs lever is now BOTH wall-locked AND showing diminishing returns. WALL: iter-3 ep64 used 1085.87s = 90.5pct of the 1200s budget; the iter-3 note computed ep72 -> 1174s = 19.6 min (only 26s margin), so epochs cannot meaningfully rise. DIMINISHING RETURNS: hr gained +0.149 over ep10->40 (+30 ep) but only +0.031 over ep40->64 (+24 ep) -> the per-epoch hr slope is flattening, the c24 net is approaching its training-convergence basin. iter-3's OWN falsifier named this exact pivot: 'if hr plateaus ... iter-4 must raise uswin_c (24->32)'. The new lever is CAPACITY, not epochs. (3) ONE KNOB: uswin_c 24->32, epochs 64->34; ALL else held (train_n=200, val_n=214, bs=4, lr=5e-4, swin_window=8, swin_heads=4, grad_clip=1.0, seed=42). BUDGET-TRADE MATH (worst-case-sized, mirroring the champion's method): from the two measured c24 (epochs, elapsed_s) points (40,737.72),(64,1085.87): per_epoch_c24 = (1085.87-737.72)/(64-40) = 14.51 s/epoch; fixed_c24 (data load + 214-slice per-sample val + figure I/O) = 737.72 - 40*14.51 = 157.3s (predicts ep64 = 157.3 + 64*14.51 = 1086.0s vs actual 1085.87 -> calibration exact). A c24->c32 widening multiplies the U-Net+attention compute by (32/24)^2 = 1.778x; the per-sample 2304-view FBP adjoint is c-INDEPENDENT. WORST CASE (pessimistically assume EVERYTHING incl. the FBP adjoint scales 1.778x): per_epoch_worst = 14.51*1.778 = 25.80 s/epoch; fixed_worst = 157.3*1.778 = 279.7s. Largest epoch count fitting 1200s: (1200-279.7)/25.80 = 35.7 -> ep34 worst-case = 279.7 + 34*25.80 = 1156.9s = 19.3 min (43s margin inside the 1200s budget; sbatch wall is 30 min). ep36 worst-case = 1208.5s BUSTS the budget, so ep34 is the LARGEST epoch count guaranteed to fit even the worst case; epochs is sized to the worst-case bound, not the optimistic one (a wall-bust wastes the whole QOS slot). REALISTIC (FBP adjoint ~30pct of per-epoch, c-independent): per_epoch_real = 14.51*(0.30+0.70*1.778) = 22.42 s/epoch -> ep34 real ~ 243 + 34*22.42 = 1005s = 16.7 min, comfortable headroom. Train-only worst = 34*25.80 = 877s < max_train_s=900 backstop (set to 900 so train always halts leaving >=300s for the worst-case val+figure inside the 1200s budget; iter-3 used 1000 but the bigger net's fixed-cost grew, so 900 is the safe backstop). (4) HYPOTHESIS: 1.778x more representational capacity lifts hr above the iter-3 0.353196 toward/past the champion dual_domain_supervised's 0.365, even at the reduced ep34, because uswin's hr is flattening at c24 (training-basin) yet remains a strong Mayo image-domain denoiser and c32 is its top sanctioned capacity. Predicted iter-4 hr ~0.36-0.38. FALSIFIER (NUMBERS): if hr <= 0.353196 at uswin_c=32/ep34, uswin has hit its representational ceiling on this val set (~0.355) AND/OR ep34 under-trained the bigger net more than the added capacity helped -> iter-5 either (a) keeps c32 and recovers epochs toward the wall if the measured c32 per-epoch is cheaper than the 25.80s worst case (i.e. ep34 left budget headroom), or (b) reverts to c24/ep64 and accepts 0.3532 as the uswin ceiling. (5) HARD 20-min train+score budget; val_n=214 = ALL L277 slices (NOT reduced); grad_clip=1.0 retained (mandatory; the 2304-view Mayo FBP adjoint amplifies gradients). HARD-WIRED (unchanged): staged_canonical v3 mayo_ldct_fitted geometry, per-sample-ps FBP, bg_target=truth, metric=321px detector-geometry FOV (evaluate_calibrated default for AGENT4CT_DATASET=mayo_ldct_2d; no fov= override). (6) no control return.", "comparison_image": "runs/mayo-ldct-claude-agentic-uswin-search-20260619-01/iterations/iter-0004/comparison.png"}
{"ts": "2026-06-20T02:54:50Z", "run_id": "mayo-ldct-claude-agentic-dual-domain-n2i-search-20260619-01", "iter": 4, "agent": "dual_domain_n2i-claude-agentic", "model": "claude-opus-4-8-1m", "change_class": "architecture", "status": "keep", "kept": true, "val_score": 0.9277111291885376, "headroom": 0.19761010181430883, "params_M": 0.465762, "train_n": 400, "rationale": "dual_domain_n2i-claude-agentic: warm_start=True, pretrain_epochs=4, n_iter=18, grad_clip=1.0, unet_c=16, lr=0.0003, batch_size=1, train_n=200, val_n=214, outer_wall_s=1080, per_scene_s=None, seed=42, rationale=dual_domain_n2i iter-4 (search-20260619-01, PER-IMAGE Noise2Inverse: warm-start pre-pass + per-scan Adam fit; NEVER amortized). SIX-BOX (NUMBERS, measured from job 765337). (1) iter-3 KEEP (#5 on the Mayo board, the only N2I that CLEARED baseline): SSIM 0.9185, hr 0.1506, PSNR 35.50 vs baseline_PSNR 34.08, RMSE 8.399e-4, elapsed 1088.0s (18.1 min); fit loop 214 scenes x 15 steps = 820.7s -> 0.2557 s/per-scan-step (3.836 s/scene; ALL 214 completed inner_iters=15, NO per-scene-wall truncation since per_scene_s=1080/214=5.05s > 3.836s); fixed overhead (warm-start 4ep + setup + score + figure) = 1088.0 - 820.7 = 267.3s. TRAJECTORY: iter-1 (pe1,n15,lr1e-3) 0.8622/hr0 PSNR33.07; iter-2 (pe1->4,lr1e-3) 0.8681/hr0 PSNR32.43 (warm-start DEPTH falsified on RMSE); iter-3 (lr1e-3->3e-4) 0.9185/hr0.1506 PSNR35.50 (lr-down ANCHORED the 15-step fit near the FBP-quality warm-start init -> cleared the FBP floor). (2) OPPORTUNITY: with lr now correctly anchored at 3e-4 the per-scan fit no longer drifts off the FBP-consistent init, so MORE per-scan steps should REFINE it rather than overfit. The iter-3 fit was only 15 steps and last_loss still oscillates across scenes (3.6e-6..1.2e-5, not a flat converged floor) -> 15 may be too few to fully exploit the now-stable lr. (3) ONE KNOB: n_iter 15 -> 18 (pretrain_epochs=4, lr=3e-4, grad_clip=1.0, unet_c=16, val_n=214, seed=42, outer_wall_s=1080 ALL HELD at iter-3 -> iter-3 is the clean isolated comparison). Why n_iter=18 and NOT 25/30: the 214-scene budget HARD-CAPS n_iter at the measured 0.2557 s/step. 214-SCAN 20-MIN BUDGET MATH (HARD 20-min = 1200s compute; figure outside budget but inside the 30-min SLURM wall): fit loop = 214 x 18 x 0.2557 = 985s; + overhead 267.3s = 1252s = 20.9 min elapsed (figure-inclusive), 8.8 min under the 30-min SLURM hard-kill. n_iter=25 -> 214x25x0.2557=1368s fit -> 1635s = 27.3 min (BLOWS the 20-min budget AND risks the 30-min wall) AND at outer_wall_s=1080 the per-scene wall (5.05s) would TRUNCATE every scene at floor(5.05/0.2557)=19 steps -> a silent, non-deterministic, incomplete fit, NOT a clean n_iter=25. n_iter=18 needs 18x0.2557=4.60s/scene < the 5.05s per-scene wall -> ALL 214 scenes complete 18 steps with NO truncation, so outer_wall_s stays 1080 (no second knob; structure preserved). lr is settled (do not touch); pretrain_epochs-up was falsified at iter-2; n_iter+3 is the one in-budget, correctly-signed lever left. (4) HYPOTHESIS: n_iter 15->18 at the anchored lr=3e-4 lifts hr above iter-3's 0.1506 (PSNR above 35.50) because 3 more per-scan steps refine the FBP-consistent fit without drifting (lr is the anchor; this is the refine regime, NOT the overfit regime at n_iter 600-1200 with high lr). FALSIFIER: if hr <= 0.1506 (no PSNR gain), 15 steps already converged the per-scan fit at lr=3e-4 -> that is the per-image U-Net N2I ceiling on dense 2304-view Mayo (half-view info loss bounds hr near 0.15), and further per-scan-step tuning is futile -> iter-5 documents the ceiling (NAF/ram structural-negative class). (5) BUDGET (HARD 20-min, val=ALL 214): total 1252s = 20.9 min elapsed figure-inclusive; fit loop 985s < outer_wall_s=1080 backstop; per-scene 4.60s < per_scene_s 5.05s wall (no truncation). val_n=214 NOT reduced (protocol). 321px detector-geometry FOV default (no fov=False). staged_canonical / v3 mayo_ldct_fitted / per-sample-ps / bg_target=truth hard-wired. PER-IMAGE structure UNCHANGED (warm-start pre-pass + per-scan fit; NEVER amortized). (6) no control return.", "advice_for_others": "dual_domain_n2i-claude-agentic: warm_start=True, pretrain_epochs=4, n_iter=18, grad_clip=1.0, unet_c=16, lr=0.0003, batch_size=1, train_n=200, val_n=214, outer_wall_s=1080, per_scene_s=None, seed=42, rationale=dual_domain_n2i iter-4 (search-20260619-01, PER-IMAGE Noise2Inverse: warm-start pre-pass + per-scan Adam fit; NEVER amortized). SIX-BOX (NUMBERS, measured from job 765337). (1) iter-3 KEEP (#5 on the Mayo board, the only N2I that CLEARED baseline): SSIM 0.9185, hr 0.1506, PSNR 35.50 vs baseline_PSNR 34.08, RMSE 8.399e-4, elapsed 1088.0s (18.1 min); fit loop 214 scenes x 15 steps = 820.7s -> 0.2557 s/per-scan-step (3.836 s/scene; ALL 214 completed inner_iters=15, NO per-scene-wall truncation since per_scene_s=1080/214=5.05s > 3.836s); fixed overhead (warm-start 4ep + setup + score + figure) = 1088.0 - 820.7 = 267.3s. TRAJECTORY: iter-1 (pe1,n15,lr1e-3) 0.8622/hr0 PSNR33.07; iter-2 (pe1->4,lr1e-3) 0.8681/hr0 PSNR32.43 (warm-start DEPTH falsified on RMSE); iter-3 (lr1e-3->3e-4) 0.9185/hr0.1506 PSNR35.50 (lr-down ANCHORED the 15-step fit near the FBP-quality warm-start init -> cleared the FBP floor). (2) OPPORTUNITY: with lr now correctly anchored at 3e-4 the per-scan fit no longer drifts off the FBP-consistent init, so MORE per-scan steps should REFINE it rather than overfit. The iter-3 fit was only 15 steps and last_loss still oscillates across scenes (3.6e-6..1.2e-5, not a flat converged floor) -> 15 may be too few to fully exploit the now-stable lr. (3) ONE KNOB: n_iter 15 -> 18 (pretrain_epochs=4, lr=3e-4, grad_clip=1.0, unet_c=16, val_n=214, seed=42, outer_wall_s=1080 ALL HELD at iter-3 -> iter-3 is the clean isolated comparison). Why n_iter=18 and NOT 25/30: the 214-scene budget HARD-CAPS n_iter at the measured 0.2557 s/step. 214-SCAN 20-MIN BUDGET MATH (HARD 20-min = 1200s compute; figure outside budget but inside the 30-min SLURM wall): fit loop = 214 x 18 x 0.2557 = 985s; + overhead 267.3s = 1252s = 20.9 min elapsed (figure-inclusive), 8.8 min under the 30-min SLURM hard-kill. n_iter=25 -> 214x25x0.2557=1368s fit -> 1635s = 27.3 min (BLOWS the 20-min budget AND risks the 30-min wall) AND at outer_wall_s=1080 the per-scene wall (5.05s) would TRUNCATE every scene at floor(5.05/0.2557)=19 steps -> a silent, non-deterministic, incomplete fit, NOT a clean n_iter=25. n_iter=18 needs 18x0.2557=4.60s/scene < the 5.05s per-scene wall -> ALL 214 scenes complete 18 steps with NO truncation, so outer_wall_s stays 1080 (no second knob; structure preserved). lr is settled (do not touch); pretrain_epochs-up was falsified at iter-2; n_iter+3 is the one in-budget, correctly-signed lever left. (4) HYPOTHESIS: n_iter 15->18 at the anchored lr=3e-4 lifts hr above iter-3's 0.1506 (PSNR above 35.50) because 3 more per-scan steps refine the FBP-consistent fit without drifting (lr is the anchor; this is the refine regime, NOT the overfit regime at n_iter 600-1200 with high lr). FALSIFIER: if hr <= 0.1506 (no PSNR gain), 15 steps already converged the per-scan fit at lr=3e-4 -> that is the per-image U-Net N2I ceiling on dense 2304-view Mayo (half-view info loss bounds hr near 0.15), and further per-scan-step tuning is futile -> iter-5 documents the ceiling (NAF/ram structural-negative class). (5) BUDGET (HARD 20-min, val=ALL 214): total 1252s = 20.9 min elapsed figure-inclusive; fit loop 985s < outer_wall_s=1080 backstop; per-scene 4.60s < per_scene_s 5.05s wall (no truncation). val_n=214 NOT reduced (protocol). 321px detector-geometry FOV default (no fov=False). staged_canonical / v3 mayo_ldct_fitted / per-sample-ps / bg_target=truth hard-wired. PER-IMAGE structure UNCHANGED (warm-start pre-pass + per-scan fit; NEVER amortized). (6) no control return.", "comparison_image": "runs/mayo-ldct-claude-agentic-dual-domain-n2i-search-20260619-01/iterations/iter-0004/comparison.png"}
