{"ts": "2026-06-19T18:35:21Z", "run_id": "mayo-ldct-claude-agentic-wu-2015-trainable-search-20260619-01", "iter": 2, "agent": "wu_2015_trainable-claude-agentic-breast-ct", "model": "claude-opus-4.7-1m", "change_class": "architecture", "status": "keep", "kept": true, "val_score": 0.838996410369873, "headroom": 0.03372512879999279, "params_M": 8e-06, "train_n": 400, "rationale": "wu_2015_trainable-claude-agentic: wu_n_bands=4, wu_n_outer=1, lr=0.01, epochs=18, batch_size=1, val_chunk=1, train_n=200, val_n=214, grad_clip=1.0, lambda_neg=1.0, weight_decay=0.0, loss_base=mse, seed=42, rationale=ITER-2 (search-20260619-01, corrected 214-slice/321px-FOV metric). SIX-BOX. (1) iter-1 = SSIM 0.837 / hr 0.0508, 8 trainable params (wu_n_bands=4, wu_n_outer=1, ep=6, lr=0.01), elapsed 335s of the 1200s budget (only 28% used). (2) Tuned-FBP family sits just above the LD-FBP baseline (hr 0.05); candidate causes are under-training (only 6 epochs, 865s of budget unused) vs a structural FBP-family ceiling. (3) ONE KNOB: epochs 6 -> 18 (proven budget-safe lever; 335s/6ep leaves huge headroom). Param count UNCHANGED at 8 (formula wu_n_bands+2+2*wu_n_outer = 4+2+2*1 = 8) -- I deliberately do NOT touch wu_n_bands / wu_n_outer (changing a capacity knob would confound the under-training question, and wu_n_outer=1 is the mandatory hint). The 214-slice chunk=1 dense-projector VAL pass is a fixed per-iter cost; only the train portion scales with epochs, so even pessimistically attributing all 335s to training, 18 epochs ~1005s < 1200s, with the val figure outside the budget. (4) HYPOTHESIS: if iter-1 hr is under-training-limited (8 clamped scalars not yet settled at 6 epochs), epochs 6->18 lifts val_ssim/hr measurably above 0.837/0.0508. FALSIFIER: if val_ssim is flat (<=0.001 SSIM, within noise) at 18 epochs, the solver is at its structural FBP-family ceiling -- then iter-3 must add capacity (wu_n_bands up), not train longer. (5) HARD 20-min budget sized via epochs; val = ALL 214 L277 slices (unchanged); grad_clip=1.0; bs=1 + val_chunk=1 forced by per-sample-ps; staged_canonical v3 mayo_ldct_fitted; bg_target=truth; 321px detector-geometry FOV default (no fov override). (6) no control return.", "advice_for_others": "wu_2015_trainable-claude-agentic: wu_n_bands=4, wu_n_outer=1, lr=0.01, epochs=18, batch_size=1, val_chunk=1, train_n=200, val_n=214, grad_clip=1.0, lambda_neg=1.0, weight_decay=0.0, loss_base=mse, seed=42, rationale=ITER-2 (search-20260619-01, corrected 214-slice/321px-FOV metric). SIX-BOX. (1) iter-1 = SSIM 0.837 / hr 0.0508, 8 trainable params (wu_n_bands=4, wu_n_outer=1, ep=6, lr=0.01), elapsed 335s of the 1200s budget (only 28% used). (2) Tuned-FBP family sits just above the LD-FBP baseline (hr 0.05); candidate causes are under-training (only 6 epochs, 865s of budget unused) vs a structural FBP-family ceiling. (3) ONE KNOB: epochs 6 -> 18 (proven budget-safe lever; 335s/6ep leaves huge headroom). Param count UNCHANGED at 8 (formula wu_n_bands+2+2*wu_n_outer = 4+2+2*1 = 8) -- I deliberately do NOT touch wu_n_bands / wu_n_outer (changing a capacity knob would confound the under-training question, and wu_n_outer=1 is the mandatory hint). The 214-slice chunk=1 dense-projector VAL pass is a fixed per-iter cost; only the train portion scales with epochs, so even pessimistically attributing all 335s to training, 18 epochs ~1005s < 1200s, with the val figure outside the budget. (4) HYPOTHESIS: if iter-1 hr is under-training-limited (8 clamped scalars not yet settled at 6 epochs), epochs 6->18 lifts val_ssim/hr measurably above 0.837/0.0508. FALSIFIER: if val_ssim is flat (<=0.001 SSIM, within noise) at 18 epochs, the solver is at its structural FBP-family ceiling -- then iter-3 must add capacity (wu_n_bands up), not train longer. (5) HARD 20-min budget sized via epochs; val = ALL 214 L277 slices (unchanged); grad_clip=1.0; bs=1 + val_chunk=1 forced by per-sample-ps; staged_canonical v3 mayo_ldct_fitted; bg_target=truth; 321px detector-geometry FOV default (no fov override). (6) no control return.", "comparison_image": "runs/mayo-ldct-claude-agentic-wu-2015-trainable-search-20260619-01/iterations/iter-0002/comparison.png"}
{"ts": "2026-06-19T18:30:40Z", "run_id": "mayo-ldct-claude-agentic-itnet-v2-search-20260619-01", "iter": 2, "agent": "itnet_v2-claude-agentic-breast-ct", "model": "claude-opus-4.7-1m", "change_class": "architecture", "status": "discard", "kept": false, "val_score": 0.5888043642044067, "headroom": 0.0, "params_M": 0.232882, "train_n": 400, "rationale": "itnet_v2-claude-agentic: itnet_k=3, unet_c=16, itnet_alpha_init=0.0037, residual_learning=False, pretrain_lr=0.0001, pretrain_epochs=48, pretrain_patience=48, batch_size=1, val_chunk=1, train_n=200, val_n=214, grad_clip=1.0, max_train_s=960, seed=42, rationale=ITER-2 (search-20260619-01, corrected 214-slice/321px-FOV metric). ONE KNOB: pretrain_epochs 12->48 (4x); pretrain_patience tracked 12->48 so the early-stop never fires before the full 48 epochs (same disable-early-stop intent as iter-1, where patience==epochs). All else identical to iter-1 (k=3, unet_c=16, alpha_init=0.0037, residual_learning=False, pretrain_lr=1e-4, batch_size=1, val_chunk=1, train_n=200, val_n=214, grad_clip=1.0, seed=42); only max_train_s 900->960 to admit the longer pretrain inside the wall. SIX-BOX (NUMBERS): (1) iter-1 = SSIM 0.4554 / hr 0.000 (val_psnr 21.24, val_rmse 0.00434) in elapsed_s=170.2 -- only ~14% of the 1200s (20-min) train+score budget used; pretrain_epochs=12. (2) FAILURE MODE: the pretrain-denoiser-then-data-consistency path UNDER-CONVERGES in the budget (same as v1, which was stuck at 0.441). The k=3 DC steps refine a denoiser that has not yet learned the Mayo image statistics; SSIM 0.455 is far below the end-to-end itnet_v3 sibling (0.896). With only 12 pretrain epochs at lr=1e-4 the denoiser is under-trained, and 170s/1200s proves the budget was almost entirely idle. (3) ONE KNOB: pretrain_epochs 12->48, mirroring the SIBLING itnet (v1) iter-2 which raised pretrain_epochs 8->48 and jumped SSIM 0.441->0.593 (+0.15) under THIS campaign and metric -- the strongest just-proven signal that pretraining was the v1/v2 bottleneck. Chosen over lr-up (v3 is unstable above 1e-4; mirror the safe v1 move) and over architecture knobs (k/unet_c) which would change the model not the convergence. (4) HYPOTHESIS: if pretrain_epochs 12->48, val_ssim rises substantially above 0.4554 (toward v1 iter-2's ~0.59, possibly the ~0.88-0.90 sibling band) because more pretraining lets the denoiser converge before the k=3 DC refinement, exactly as it did for v1. FALSIFIER: if val_ssim stays flat (<=~0.47) at 48 epochs, the pretrain-DC architecture is CAPPED in this budget regardless of pretraining (not an under-training problem), and iter-3 must move toward end-to-end unrolled training (the v3 recipe) or accept the pretrain-DC path is budget-limited. (5) BUDGET: HARD 20-min train+score. iter-1 ran 12 epochs + 214-slice per-sample val + figure in 170s; the per-epoch pretrain cost over 200 stratified slices is the variable part and the 214-slice per-sample val + figure are roughly fixed. 4x the epochs is roughly 4x the small pretrain base plus the single fixed val/figure pass: est well under 600s, far below 1200s; max_train_s=960 is a 16-min HARD backstop so train always leaves room for the 214-slice per-sample val + figure inside the 30-min sbatch wall. val_n=214 KEPT (NOT reduced), grad_clip=1.0 KEPT. (6) Loop continues -- no control returned. HARD-WIRED (unchanged from iter-1): staged_canonical data, v3 mayo_ldct_fitted geometry, per-sample-ps (each slice swaps itnet.projector to its own ps; batch_size=1 + val_chunk=1 FORCED), bg_target=truth, val=ALL 214 L277 slices under the 321px detector-geometry FOV (evaluate_calibrated default for AGENT4CT_DATASET=mayo_ldct_2d; NO fov= override). residual_learning=False KEPT (the CONFIG default True double-applies the residual and collapses eval to ~0.34).", "advice_for_others": "itnet_v2-claude-agentic: itnet_k=3, unet_c=16, itnet_alpha_init=0.0037, residual_learning=False, pretrain_lr=0.0001, pretrain_epochs=48, pretrain_patience=48, batch_size=1, val_chunk=1, train_n=200, val_n=214, grad_clip=1.0, max_train_s=960, seed=42, rationale=ITER-2 (search-20260619-01, corrected 214-slice/321px-FOV metric). ONE KNOB: pretrain_epochs 12->48 (4x); pretrain_patience tracked 12->48 so the early-stop never fires before the full 48 epochs (same disable-early-stop intent as iter-1, where patience==epochs). All else identical to iter-1 (k=3, unet_c=16, alpha_init=0.0037, residual_learning=False, pretrain_lr=1e-4, batch_size=1, val_chunk=1, train_n=200, val_n=214, grad_clip=1.0, seed=42); only max_train_s 900->960 to admit the longer pretrain inside the wall. SIX-BOX (NUMBERS): (1) iter-1 = SSIM 0.4554 / hr 0.000 (val_psnr 21.24, val_rmse 0.00434) in elapsed_s=170.2 -- only ~14% of the 1200s (20-min) train+score budget used; pretrain_epochs=12. (2) FAILURE MODE: the pretrain-denoiser-then-data-consistency path UNDER-CONVERGES in the budget (same as v1, which was stuck at 0.441). The k=3 DC steps refine a denoiser that has not yet learned the Mayo image statistics; SSIM 0.455 is far below the end-to-end itnet_v3 sibling (0.896). With only 12 pretrain epochs at lr=1e-4 the denoiser is under-trained, and 170s/1200s proves the budget was almost entirely idle. (3) ONE KNOB: pretrain_epochs 12->48, mirroring the SIBLING itnet (v1) iter-2 which raised pretrain_epochs 8->48 and jumped SSIM 0.441->0.593 (+0.15) under THIS campaign and metric -- the strongest just-proven signal that pretraining was the v1/v2 bottleneck. Chosen over lr-up (v3 is unstable above 1e-4; mirror the safe v1 move) and over architecture knobs (k/unet_c) which would change the model not the convergence. (4) HYPOTHESIS: if pretrain_epochs 12->48, val_ssim rises substantially above 0.4554 (toward v1 iter-2's ~0.59, possibly the ~0.88-0.90 sibling band) because more pretraining lets the denoiser converge before the k=3 DC refinement, exactly as it did for v1. FALSIFIER: if val_ssim stays flat (<=~0.47) at 48 epochs, the pretrain-DC architecture is CAPPED in this budget regardless of pretraining (not an under-training problem), and iter-3 must move toward end-to-end unrolled training (the v3 recipe) or accept the pretrain-DC path is budget-limited. (5) BUDGET: HARD 20-min train+score. iter-1 ran 12 epochs + 214-slice per-sample val + figure in 170s; the per-epoch pretrain cost over 200 stratified slices is the variable part and the 214-slice per-sample val + figure are roughly fixed. 4x the epochs is roughly 4x the small pretrain base plus the single fixed val/figure pass: est well under 600s, far below 1200s; max_train_s=960 is a 16-min HARD backstop so train always leaves room for the 214-slice per-sample val + figure inside the 30-min sbatch wall. val_n=214 KEPT (NOT reduced), grad_clip=1.0 KEPT. (6) Loop continues -- no control returned. HARD-WIRED (unchanged from iter-1): staged_canonical data, v3 mayo_ldct_fitted geometry, per-sample-ps (each slice swaps itnet.projector to its own ps; batch_size=1 + val_chunk=1 FORCED), bg_target=truth, val=ALL 214 L277 slices under the 321px detector-geometry FOV (evaluate_calibrated default for AGENT4CT_DATASET=mayo_ldct_2d; NO fov= override). residual_learning=False KEPT (the CONFIG default True double-applies the residual and collapses eval to ~0.34).", "comparison_image": "runs/mayo-ldct-claude-agentic-itnet-v2-search-20260619-01/iterations/iter-0002/comparison.png"}
{"ts": "2026-06-19T18:06:55Z", "run_id": "mayo-ldct-claude-agentic-dual-domain-bilateral-supervised-search-20260619-01", "iter": 2, "agent": "dual_domain_bilateral_supervised-claude-agentic-breast-ct", "model": "claude-opus-4.7-1m", "change_class": "architecture", "status": "keep", "kept": true, "val_score": 0.9191550016403198, "headroom": 0.02823715470493071, "params_M": 1.2e-05, "train_n": 400, "rationale": "dual_domain_bilateral_supervised-claude-agentic: proj_n_bf=1, img_n_bf=3, proj_kernel=3, proj_sx=0.01, proj_sy=0.3, proj_sr=0.0005, img_kernel=5, img_sx=0.5, img_sy=0.5, img_sr=0.02, lr=0.005, epochs=24, batch_size=1, val_chunk=1, train_n=200, val_n=214, grad_clip=1.0, lambda_neg=1.0, seed=42, rationale=ITER-2 (search-20260619-01, corrected 214-slice/321px-FOV metric). ONE KNOB: epochs 8->24 (3x). All else identical to iter-1 (proj_n_bf=1, img_n_bf=3 -> 12 trainable params unchanged; 3*(proj_n_bf+img_n_bf)). SIX-BOX: (1) iter-1 = SSIM 0.919 / hr 0.0279 in elapsed 254s -- only ~21% of the 1200s (20-min) budget used; 12-param bilateral, lr=5e-3. (2) FAILURE MODE: high SSIM but near-zero hr because the calibrated RMSE-sensitive headroom metric does not credit the bilateral's smoothing (campaign note: SSIM rewards the BF blur, headroom does not). Critically, with only 12 params at lr=5e-3 and 8 epochs the supervised-MSE loss -- which IS RMSE-sensitive, unlike SSIM -- has had little chance to drive the scalar sigmas to their RMSE-optimal (less-smoothing) values: the run is UNDER-TRAINED (254s/1200s). (3) ONE KNOB: epochs 8->24. JUSTIFICATION vs the other candidate (img_n_bf up): adding image-domain bilateral DEPTH at the current loose img_sr=0.02 would smooth MORE, which keeps SSIM high but does NOT lift the RMSE-driven hr (more blur is the wrong direction for headroom); whereas more epochs lets the MSE objective itself pull the sigmas toward the RMSE optimum AND uses the idle ~950s budget. epochs is the cleaner lever for the hr deficit. (4) HYPOTHESIS: if epochs 8->24, then hr rises above 0.0279 (toward the dual_domain_supervised U-Net sibling's 0.276) because the 12 BF sigmas are under-trained at 8 epochs and the supervised-MSE gradient -- being RMSE-sensitive -- will sharpen them. FALSIFIER: if hr stays <=~0.03 (flat) at 24 epochs, the 12-param bilateral is at its CAPACITY ceiling on the 2304-view Mayo FBP (not an under-training problem), and iter-3 must instead add capacity (img_n_bf up) or attack the proj-domain over-smoothing (proj_sr) -- epochs is then exhausted. (5) BUDGET: HARD 20-min train+score. iter-1 ran 8 epochs + 214-slice per-sample val + figure in 254s; per-step cost is dominated by the SHARED 2304-view FBP adjoint, not the 12 BF params, so 24 epochs ~= 3x train ~= 8 epochs*3 plus the single fixed val pass: est ~600-760s << 1200s. Comfortably inside the 30-min sbatch wall. val_n=214 KEPT (NOT reduced), grad_clip=1.0 KEPT. (6) Loop continues -- no control returned. HARD-WIRED (unchanged from iter-1): staged_canonical data, v3 mayo_ldct_fitted geometry, per-sample-ps (mayo_per_sample_setup/_fbp, per-sample pipe.R_full swap), bg_target=truth, val=ALL 214 L277 slices under the 321px detector-geometry FOV (evaluate_calibrated default for AGENT4CT_DATASET=mayo_ldct_2d; NO fov= override).", "advice_for_others": "dual_domain_bilateral_supervised-claude-agentic: proj_n_bf=1, img_n_bf=3, proj_kernel=3, proj_sx=0.01, proj_sy=0.3, proj_sr=0.0005, img_kernel=5, img_sx=0.5, img_sy=0.5, img_sr=0.02, lr=0.005, epochs=24, batch_size=1, val_chunk=1, train_n=200, val_n=214, grad_clip=1.0, lambda_neg=1.0, seed=42, rationale=ITER-2 (search-20260619-01, corrected 214-slice/321px-FOV metric). ONE KNOB: epochs 8->24 (3x). All else identical to iter-1 (proj_n_bf=1, img_n_bf=3 -> 12 trainable params unchanged; 3*(proj_n_bf+img_n_bf)). SIX-BOX: (1) iter-1 = SSIM 0.919 / hr 0.0279 in elapsed 254s -- only ~21% of the 1200s (20-min) budget used; 12-param bilateral, lr=5e-3. (2) FAILURE MODE: high SSIM but near-zero hr because the calibrated RMSE-sensitive headroom metric does not credit the bilateral's smoothing (campaign note: SSIM rewards the BF blur, headroom does not). Critically, with only 12 params at lr=5e-3 and 8 epochs the supervised-MSE loss -- which IS RMSE-sensitive, unlike SSIM -- has had little chance to drive the scalar sigmas to their RMSE-optimal (less-smoothing) values: the run is UNDER-TRAINED (254s/1200s). (3) ONE KNOB: epochs 8->24. JUSTIFICATION vs the other candidate (img_n_bf up): adding image-domain bilateral DEPTH at the current loose img_sr=0.02 would smooth MORE, which keeps SSIM high but does NOT lift the RMSE-driven hr (more blur is the wrong direction for headroom); whereas more epochs lets the MSE objective itself pull the sigmas toward the RMSE optimum AND uses the idle ~950s budget. epochs is the cleaner lever for the hr deficit. (4) HYPOTHESIS: if epochs 8->24, then hr rises above 0.0279 (toward the dual_domain_supervised U-Net sibling's 0.276) because the 12 BF sigmas are under-trained at 8 epochs and the supervised-MSE gradient -- being RMSE-sensitive -- will sharpen them. FALSIFIER: if hr stays <=~0.03 (flat) at 24 epochs, the 12-param bilateral is at its CAPACITY ceiling on the 2304-view Mayo FBP (not an under-training problem), and iter-3 must instead add capacity (img_n_bf up) or attack the proj-domain over-smoothing (proj_sr) -- epochs is then exhausted. (5) BUDGET: HARD 20-min train+score. iter-1 ran 8 epochs + 214-slice per-sample val + figure in 254s; per-step cost is dominated by the SHARED 2304-view FBP adjoint, not the 12 BF params, so 24 epochs ~= 3x train ~= 8 epochs*3 plus the single fixed val pass: est ~600-760s << 1200s. Comfortably inside the 30-min sbatch wall. val_n=214 KEPT (NOT reduced), grad_clip=1.0 KEPT. (6) Loop continues -- no control returned. HARD-WIRED (unchanged from iter-1): staged_canonical data, v3 mayo_ldct_fitted geometry, per-sample-ps (mayo_per_sample_setup/_fbp, per-sample pipe.R_full swap), bg_target=truth, val=ALL 214 L277 slices under the 321px detector-geometry FOV (evaluate_calibrated default for AGENT4CT_DATASET=mayo_ldct_2d; NO fov= override).", "comparison_image": "runs/mayo-ldct-claude-agentic-dual-domain-bilateral-supervised-search-20260619-01/iterations/iter-0002/comparison.png"}
