{"ts": "2026-06-21T14:40:59Z", "run_id": "mayo-ldct-claude-agentic-dual-domain-bilateral-supervised-search-20260619-01", "iter": 9, "agent": "dual_domain_bilateral_supervised-claude-agentic", "model": "claude-opus-4-8-1m", "change_class": "architecture", "status": "keep", "kept": true, "val_score": 0.9189398884773254, "headroom": 0.025002687441857963, "params_M": 1.2e-05, "train_n": 400, "rationale": "dual_domain_bilateral_supervised-claude-agentic: proj_n_bf=1, img_n_bf=3, proj_kernel=3, proj_sx=0.01, proj_sy=0.3, proj_sr=0.0005, img_kernel=5, img_sx=0.5, img_sy=0.5, img_sr=0.02, lr=0.005, epochs=24, batch_size=1, val_chunk=1, train_n=200, val_n=214, grad_clip=1.0, lambda_neg=1.0, seed=123, rationale=ITER-9 (search-20260619-01, corrected 214-slice/321px-FOV metric). BASE_ITER=2 BEST (proj_n_bf=1, img_n_bf=3, 12 params, hr 0.028237, ep24, seed=42). ONE KNOB: seed 42->123 -- the campaign-precedented SEED noise-floor read, the LAST genuinely-untried axis. SIX-BOX (NUMBERS, hr=metric of record): (1) TRAJECTORY: iter-1 hr 0.027984 ep8 seed42; iter-2 hr 0.028237 ep24 seed42 = BEST (epochs INERT); iter-3 hr 0.0 img_n_bf=6 (image capacity DESTABILIZED); iter-4 hr 0.028237 proj_n_bf=2 (proj-DEPTH FLAT); iter-5 hr 0.009801 train_n=480 (DATA REGRESSED -- 12-param too small to exploit data); iter-6 hr 0.021479 lr=0.001 (lr-DOWN REGRESSED); iter-7 hr 0.028192 img_sr=0.005 (image range-sigma FLAT/INERT); iter-8 hr 0.028237 proj_sr=0.0001 (proj range-sigma FLAT -- the doc-named Mayo lever inert). MAPPED+spent: epochs, img_n_bf, proj_n_bf, train_n, lr, img_sr, proj_sr. seed=42 has NEVER been varied across all 8 iters. (2) LIMITER: 12-param trainable-bilateral pinned at hr~0.028 by every scalar AND capacity AND data move on the 2304-view Mayo FBP. The ONE untouched axis is the RANDOM SEED (init + train-shuffle). (3) ONE KNOB = seed 42->123. JUSTIFICATION: this is the campaign-precedented honest noise-floor read -- TWO ceiling-confirmed sibling solvers SURPRISED on a seed read this campaign (dual_domain_supervised seed 42->123 lifted hr +0.006 -> Mayo champion; hammernik_2017 last-untried lever gave +0.0017). With every cfg scalar mapped & falsified, a clean seed read either DOCUMENTS the seed-stability of the 0.0282 ceiling OR reveals seed-sensitivity (informative either way) -- the highest-value remaining single shot toward iter-20. (4) HYPOTHESIS: if the hr~0.028 ceiling is a genuine 12-param structural floor (not a single-init artifact), seed 42->123 lands hr WITHIN NOISE of 0.028237 (stable ceiling confirmed). NUMERIC FALSIFIER: hr WITHIN +-0.002 of 0.028237 => stable, seed-robust structural ceiling (file the verdict); hr > 0.031 => SEED-SENSITIVE like dual_domain_supervised (the 0.0282 read was init-lucky/unlucky -> iter-10+ sweeps more seeds to map the noise floor). (5) BUDGET: HARD 1200s train+score. seed is a ZERO-extra-compute change. iter-2 (ep24/tn200/12p) ran 449.6s -> this run ~450s, comfortably <1200s (val_n=214; fast solver ~450s). epochs=24 KEPT, train_n=200 KEPT (iter-2 base), img_n_bf=3 KEPT, proj_n_bf=1 KEPT, all sigmas/kernels/lr/lambda_neg identical to iter-2 BASE, val_n=214 KEPT, grad_clip=1.0 KEPT. (6) Loop continues -- no control returned. HARD-WIRED (unchanged): staged_canonical data, v3 mayo_ldct_fitted geometry, per-sample-ps (mayo_per_sample_setup/_fbp, per-sample pipe.R_full swap), bg_target=truth, val=ALL 214 L277 slices under the 321px detector-geometry FOV (evaluate_calibrated default for AGENT4CT_DATASET=mayo_ldct_2d; NO fov= override).", "advice_for_others": "dual_domain_bilateral_supervised-claude-agentic: proj_n_bf=1, img_n_bf=3, proj_kernel=3, proj_sx=0.01, proj_sy=0.3, proj_sr=0.0005, img_kernel=5, img_sx=0.5, img_sy=0.5, img_sr=0.02, lr=0.005, epochs=24, batch_size=1, val_chunk=1, train_n=200, val_n=214, grad_clip=1.0, lambda_neg=1.0, seed=123, rationale=ITER-9 (search-20260619-01, corrected 214-slice/321px-FOV metric). BASE_ITER=2 BEST (proj_n_bf=1, img_n_bf=3, 12 params, hr 0.028237, ep24, seed=42). ONE KNOB: seed 42->123 -- the campaign-precedented SEED noise-floor read, the LAST genuinely-untried axis. SIX-BOX (NUMBERS, hr=metric of record): (1) TRAJECTORY: iter-1 hr 0.027984 ep8 seed42; iter-2 hr 0.028237 ep24 seed42 = BEST (epochs INERT); iter-3 hr 0.0 img_n_bf=6 (image capacity DESTABILIZED); iter-4 hr 0.028237 proj_n_bf=2 (proj-DEPTH FLAT); iter-5 hr 0.009801 train_n=480 (DATA REGRESSED -- 12-param too small to exploit data); iter-6 hr 0.021479 lr=0.001 (lr-DOWN REGRESSED); iter-7 hr 0.028192 img_sr=0.005 (image range-sigma FLAT/INERT); iter-8 hr 0.028237 proj_sr=0.0001 (proj range-sigma FLAT -- the doc-named Mayo lever inert). MAPPED+spent: epochs, img_n_bf, proj_n_bf, train_n, lr, img_sr, proj_sr. seed=42 has NEVER been varied across all 8 iters. (2) LIMITER: 12-param trainable-bilateral pinned at hr~0.028 by every scalar AND capacity AND data move on the 2304-view Mayo FBP. The ONE untouched axis is the RANDOM SEED (init + train-shuffle). (3) ONE KNOB = seed 42->123. JUSTIFICATION: this is the campaign-precedented honest noise-floor read -- TWO ceiling-confirmed sibling solvers SURPRISED on a seed read this campaign (dual_domain_supervised seed 42->123 lifted hr +0.006 -> Mayo champion; hammernik_2017 last-untried lever gave +0.0017). With every cfg scalar mapped & falsified, a clean seed read either DOCUMENTS the seed-stability of the 0.0282 ceiling OR reveals seed-sensitivity (informative either way) -- the highest-value remaining single shot toward iter-20. (4) HYPOTHESIS: if the hr~0.028 ceiling is a genuine 12-param structural floor (not a single-init artifact), seed 42->123 lands hr WITHIN NOISE of 0.028237 (stable ceiling confirmed). NUMERIC FALSIFIER: hr WITHIN +-0.002 of 0.028237 => stable, seed-robust structural ceiling (file the verdict); hr > 0.031 => SEED-SENSITIVE like dual_domain_supervised (the 0.0282 read was init-lucky/unlucky -> iter-10+ sweeps more seeds to map the noise floor). (5) BUDGET: HARD 1200s train+score. seed is a ZERO-extra-compute change. iter-2 (ep24/tn200/12p) ran 449.6s -> this run ~450s, comfortably <1200s (val_n=214; fast solver ~450s). epochs=24 KEPT, train_n=200 KEPT (iter-2 base), img_n_bf=3 KEPT, proj_n_bf=1 KEPT, all sigmas/kernels/lr/lambda_neg identical to iter-2 BASE, val_n=214 KEPT, grad_clip=1.0 KEPT. (6) Loop continues -- no control returned. HARD-WIRED (unchanged): staged_canonical data, v3 mayo_ldct_fitted geometry, per-sample-ps (mayo_per_sample_setup/_fbp, per-sample pipe.R_full swap), bg_target=truth, val=ALL 214 L277 slices under the 321px detector-geometry FOV (evaluate_calibrated default for AGENT4CT_DATASET=mayo_ldct_2d; NO fov= override).", "comparison_image": "runs/mayo-ldct-claude-agentic-dual-domain-bilateral-supervised-search-20260619-01/iterations/iter-0009/comparison.png"}
{"ts": "2026-06-21T14:33:40Z", "run_id": "mayo-ldct-claude-agentic-tv-iterative-search-20260619-01", "iter": 9, "agent": "tv_iterative-claude-agentic", "model": "claude-opus-4-8-1m", "change_class": "architecture", "status": "keep", "kept": true, "val_score": 0.9238427877426147, "headroom": 0.2053882591110755, "params_M": 0.0, "train_n": 400, "rationale": "tv_iterative-claude-agentic: val_n=214, train_n=0, tv_lambda=0.001, tv_iterations=120, tv_lr=0.01, tv_clip_max=0.1, tv_decay=0.01, tv_optimizer=gd, tv_init=fbp, rationale=tv_iterative iter-9 (search-20260619-01, corrected 214-slice/321px-FOV metric). BASE_ITER=4 (the BEST, hr 0.208547: clip 0.08, lambda 0.001, lr 0.01, but 160 iters @1227s breached the HARD 1200s wall). ONE LIVE KNOB: tv_clip_max 0.08->0.10 (PUSH PAST the top of the solver search bound [0.03,0.08]); tv_iterations reverted 160->120 (the budget-proven count: iter-2/3/5/7 @120 landed 910-972s; iter-4 @160 was OVER the wall). The four live knobs in tv_reconstruction are tv_lambda/tv_iterations/tv_lr/tv_clip_max; the clamp is a hard upper f.clamp_(0.0, clip_max) applied EVERY GD step, truncating every voxel mu>clip_max. LEVER MAP (all four live knobs): clip was THE lever (iter-1 0.05->iter-2 0.08 lifted hr 0.133->0.205, +0.072, by un-truncating high-mu bone) but has only been probed UP TO the search-box ceiling 0.08, NEVER beyond it; lambda BRACKETED at optimum 0.001 (up@0.003 iter-3 0.1366, down@0.0005 iter-6 0.1582 both regress); lr BRACKETED (up-2x@0.02 iter-5 0.1873 overshoot, up-1.3x@0.013 iter-7 0.2082 flat); iters 120(918s)/140(1064s)/160(1227s, OVER WALL) -- 160 gave the peak 0.2085 but is wall-illegal, the budget-safe band <=140 caps at ~0.208 within noise. GENUINELY UNTRIED: the clip lever ABOVE its bound. FAILURE MODE: at clip_max=0.08 the hard clamp may STILL truncate the highest-mu bone/contrast voxels (real Mayo LDCT mu exceeds 0.08), a direct uncredited RMSE penalty on the RMSE-sensitive headroom metric. HYPOTHESIS: raising tv_clip_max 0.08->0.10 lets the remaining mu in [0.08,0.10] bone voxels through, dropping val_rmse below iter-4 7.825e-4 so hr rises above the BEST 0.208547 at ZERO extra compute -- exactly the mechanism that drove the iter-1->2 jump, extended one step further. PREDICTED iter-9 hr ~0.211 (if the clamp is still binding) -- modest, since most of the bone was already recovered at 0.08. FALSIFIER: if hr<=0.208547 (no gain), the 0.08 clamp already passes ALL real Mayo attenuation (no voxels live in [0.08,0.10]), the clip lever is FULLY exhausted, and ALL FOUR live levers are spent (clip un-binding above 0.08, lambda bracketed, lr bracketed, iters budget-capped) -- 0.2085 hr / ~0.927 SSIM is the STRUCTURAL classical-TV FBP-ceiling on dense (2304-view) real Mayo LDCT; STOP tuning tv_iterative toward iter-20. BUDGET: tv_clip_max is a ZERO marginal-compute knob at the budget-proven tv_iterations=120 -> cost model 31.8+120*7.47=928s (77 pct of the 1200s wall, ~272s margin; +10 pct GPU-contention variance ~1018s, still under). val = ALL 214 L277 slices unchanged. sbatch --time=00:30:00 SLURM safety net above the 20-min metric-validity budget.", "advice_for_others": "tv_iterative-claude-agentic: val_n=214, train_n=0, tv_lambda=0.001, tv_iterations=120, tv_lr=0.01, tv_clip_max=0.1, tv_decay=0.01, tv_optimizer=gd, tv_init=fbp, rationale=tv_iterative iter-9 (search-20260619-01, corrected 214-slice/321px-FOV metric). BASE_ITER=4 (the BEST, hr 0.208547: clip 0.08, lambda 0.001, lr 0.01, but 160 iters @1227s breached the HARD 1200s wall). ONE LIVE KNOB: tv_clip_max 0.08->0.10 (PUSH PAST the top of the solver search bound [0.03,0.08]); tv_iterations reverted 160->120 (the budget-proven count: iter-2/3/5/7 @120 landed 910-972s; iter-4 @160 was OVER the wall). The four live knobs in tv_reconstruction are tv_lambda/tv_iterations/tv_lr/tv_clip_max; the clamp is a hard upper f.clamp_(0.0, clip_max) applied EVERY GD step, truncating every voxel mu>clip_max. LEVER MAP (all four live knobs): clip was THE lever (iter-1 0.05->iter-2 0.08 lifted hr 0.133->0.205, +0.072, by un-truncating high-mu bone) but has only been probed UP TO the search-box ceiling 0.08, NEVER beyond it; lambda BRACKETED at optimum 0.001 (up@0.003 iter-3 0.1366, down@0.0005 iter-6 0.1582 both regress); lr BRACKETED (up-2x@0.02 iter-5 0.1873 overshoot, up-1.3x@0.013 iter-7 0.2082 flat); iters 120(918s)/140(1064s)/160(1227s, OVER WALL) -- 160 gave the peak 0.2085 but is wall-illegal, the budget-safe band <=140 caps at ~0.208 within noise. GENUINELY UNTRIED: the clip lever ABOVE its bound. FAILURE MODE: at clip_max=0.08 the hard clamp may STILL truncate the highest-mu bone/contrast voxels (real Mayo LDCT mu exceeds 0.08), a direct uncredited RMSE penalty on the RMSE-sensitive headroom metric. HYPOTHESIS: raising tv_clip_max 0.08->0.10 lets the remaining mu in [0.08,0.10] bone voxels through, dropping val_rmse below iter-4 7.825e-4 so hr rises above the BEST 0.208547 at ZERO extra compute -- exactly the mechanism that drove the iter-1->2 jump, extended one step further. PREDICTED iter-9 hr ~0.211 (if the clamp is still binding) -- modest, since most of the bone was already recovered at 0.08. FALSIFIER: if hr<=0.208547 (no gain), the 0.08 clamp already passes ALL real Mayo attenuation (no voxels live in [0.08,0.10]), the clip lever is FULLY exhausted, and ALL FOUR live levers are spent (clip un-binding above 0.08, lambda bracketed, lr bracketed, iters budget-capped) -- 0.2085 hr / ~0.927 SSIM is the STRUCTURAL classical-TV FBP-ceiling on dense (2304-view) real Mayo LDCT; STOP tuning tv_iterative toward iter-20. BUDGET: tv_clip_max is a ZERO marginal-compute knob at the budget-proven tv_iterations=120 -> cost model 31.8+120*7.47=928s (77 pct of the 1200s wall, ~272s margin; +10 pct GPU-contention variance ~1018s, still under). val = ALL 214 L277 slices unchanged. sbatch --time=00:30:00 SLURM safety net above the 20-min metric-validity budget.", "comparison_image": "runs/mayo-ldct-claude-agentic-tv-iterative-search-20260619-01/iterations/iter-0009/comparison.png"}
{"ts": "2026-06-21T14:29:57Z", "run_id": "mayo-ldct-claude-agentic-hammernik-2017-search-20260619-01", "iter": 9, "agent": "hammernik_2017-claude-agentic", "model": "claude-opus-4-8-1m", "change_class": "architecture", "status": "keep", "kept": true, "val_score": 0.8181400299072266, "headroom": 0.03920615616692258, "params_M": 0.012165, "train_n": 400, "rationale": "hammernik_2017-claude-agentic: vn_T=5, vn_n_filters=16, vn_kernel=11, vn_n_bumps=31, vn_x_range=2.0, vn_lambda_init=0.0023, epochs=4, batch_size=1, lr=0.0005, grad_clip=1.0, train_n=480, val_n=214, max_train_s=1050, seed=42, rationale=hammernik_2017 iter-9 (search-20260619-01, corrected 214-slice/321px-FOV metric). ONE KNOB: train_n 200 -> 480 (DATA-COVERAGE, GENUINELY UNTRIED -- train_n held at 200 every iter 1-8). BASE_ITER=7 (the BEST: SSIM 0.8170, hr 0.0375, vn_T5/ep10/bs1/lr5e-4/lambda0.0023/n_filters16) -- reverting AWAY from iter-8 (vn_T 5->2 depth-down REGRESSED to hr 0.0, the iter-8 falsifier TRIGGERED: depth is NOT this solvers breakout axis unlike its sibling hammernik_vn). epochs traded 10 -> 4 purely to hold the HARD 1200s wall + near grad-step parity (480x4=1920 ~= iter-7 200x10=2000), isolating DATA COVERAGE from extra optimization; max_train_s 1050 kept. TRAJECTORY (corrected metric): iter-1 OOM(bs4); iter-2 0.8012 hr0; iter-3 0.7932 hr0 (lambda 0.0023->0.05 UP REGRESSED); iter-4 0.7828 hr0 (n_filters 16->4 DOWN REGRESSED); iter-5 0.8114 hr0.0319 KEEP (epochs 14->19 UP, FIRST above the ~0.84 LD-FBP floor); iter-6 0.7883 hr0 DISCARD (lr 5e-4->3e-4 DOWN REGRESSED); iter-7 0.8170 hr0.0375 KEEP (batch_size 2->1 DOWN, NEW BEST); iter-8 0.7935 hr0 DISCARD (vn_T 5->2 depth-down REGRESSED -- NOT the breakout axis). best hr=0.0375 @iter-7. MAPPED KNOBS: epochs(UP works), batch_size(DOWN works), lr(DOWN fails), vn_lambda_init(UP fails), vn_n_filters(DOWN fails), vn_T(DOWN fails -- no depth breakout). NEVER MAPPED (until now): train_n (held 200 every iter 1-8). CURRENT train_n=200. LIMITER (box2): possible DATA-COVERAGE limit. The solver loads a FIXED stratified train subset ONCE via load_val_split(split=train, n=train_n) + reshuffles via torch.randperm each epoch (NO RotatingSubset -- verified live in campaign state), so train_n=200 means the VN only ever sees ~35 pct of the 579-slice train pool (3 ps-groups: 154 @0.66192, 98 @0.73979, 327 @0.77873). This is the ONLY genuinely-untried lever: epochs are wall-pinned, lr-down/lambda-up/n_filters-down/vn_T-down all REGRESSED. The proven trainer-lever (uswin train_n 200->480 lifted hr +0.0297; itnet_v3 200->400 lifted +0.0165) is unmapped here. ONE KNOB CHOICE (box3): train_n 200->480 at the iter-7 BEST config (vn_T=5 RESTORED, ep traded to 4, bs1/lr5e-4/lambda0.0023/n_filters16/kernel11/n_bumps31/x_range2.0/grad_clip1.0/val_n214/seed42 held). HYPOTHESIS (box4): exposing the VN to 480 vs 200 train slices (2.4x coverage, full 3-ps stratification vs partial) lets the shared filter bank fit a less FBP-degrading regularizer -> SSIM clears further above the floor; predict SSIM ~0.82-0.84, hr ~0.05-0.09 (sibling-trainer-scale lift). NUMERIC FALSIFIER: if hr <= 0.0375 (<= iter-7 best), train_n/data-coverage does NOT lift this VN (consistent with the old-metric train_n 200->300 FLAT probe on the tiny 0.018M VN) -> the Hammernik-2017 image-domain learned-regularizer family is STRUCTURALLY FBP-BOUNDED on Mayo at hr~0.037, all single knobs (epochs/bs/lr/lambda/n_filters/vn_T/train_n) mapped, and the budget-bounded ceiling is DOCUMENTED as a negative result. BUDGET (box5, HARD 1200s train+score; sbatch --time=00:30:00): at bs=1, cost ~= train_n x epochs grad steps; iter-7 = 200x10=2000 steps in ~580s train (~0.29s/step). iter-9 = 480x4=1920 steps ~= 557s train + ~95s score(214)+figure ~= 652s predicted elapsed < 1200s (near iter-7s 679.4s); max_train_s=1050 backstop trips before the figure, well under the 1800s SLURM kill. MEMORY-SAFE: identical per-step footprint to iter-7 -- batch_size=1 KEPT (OOM-safe minimum; bs=4 OOMed the 16GB RTX5000 at iter-1), vn_T=5 RESTORED, N_k=16, 31-bump RBF across 5 unrolled steps within 16 GB; train_n only changes WHICH/HOW-MANY slices stream through, NOT the activation tensor size. grad_clip=1.0 retained (VN-family NaN-skip stability).", "advice_for_others": "hammernik_2017-claude-agentic: vn_T=5, vn_n_filters=16, vn_kernel=11, vn_n_bumps=31, vn_x_range=2.0, vn_lambda_init=0.0023, epochs=4, batch_size=1, lr=0.0005, grad_clip=1.0, train_n=480, val_n=214, max_train_s=1050, seed=42, rationale=hammernik_2017 iter-9 (search-20260619-01, corrected 214-slice/321px-FOV metric). ONE KNOB: train_n 200 -> 480 (DATA-COVERAGE, GENUINELY UNTRIED -- train_n held at 200 every iter 1-8). BASE_ITER=7 (the BEST: SSIM 0.8170, hr 0.0375, vn_T5/ep10/bs1/lr5e-4/lambda0.0023/n_filters16) -- reverting AWAY from iter-8 (vn_T 5->2 depth-down REGRESSED to hr 0.0, the iter-8 falsifier TRIGGERED: depth is NOT this solvers breakout axis unlike its sibling hammernik_vn). epochs traded 10 -> 4 purely to hold the HARD 1200s wall + near grad-step parity (480x4=1920 ~= iter-7 200x10=2000), isolating DATA COVERAGE from extra optimization; max_train_s 1050 kept. TRAJECTORY (corrected metric): iter-1 OOM(bs4); iter-2 0.8012 hr0; iter-3 0.7932 hr0 (lambda 0.0023->0.05 UP REGRESSED); iter-4 0.7828 hr0 (n_filters 16->4 DOWN REGRESSED); iter-5 0.8114 hr0.0319 KEEP (epochs 14->19 UP, FIRST above the ~0.84 LD-FBP floor); iter-6 0.7883 hr0 DISCARD (lr 5e-4->3e-4 DOWN REGRESSED); iter-7 0.8170 hr0.0375 KEEP (batch_size 2->1 DOWN, NEW BEST); iter-8 0.7935 hr0 DISCARD (vn_T 5->2 depth-down REGRESSED -- NOT the breakout axis). best hr=0.0375 @iter-7. MAPPED KNOBS: epochs(UP works), batch_size(DOWN works), lr(DOWN fails), vn_lambda_init(UP fails), vn_n_filters(DOWN fails), vn_T(DOWN fails -- no depth breakout). NEVER MAPPED (until now): train_n (held 200 every iter 1-8). CURRENT train_n=200. LIMITER (box2): possible DATA-COVERAGE limit. The solver loads a FIXED stratified train subset ONCE via load_val_split(split=train, n=train_n) + reshuffles via torch.randperm each epoch (NO RotatingSubset -- verified live in campaign state), so train_n=200 means the VN only ever sees ~35 pct of the 579-slice train pool (3 ps-groups: 154 @0.66192, 98 @0.73979, 327 @0.77873). This is the ONLY genuinely-untried lever: epochs are wall-pinned, lr-down/lambda-up/n_filters-down/vn_T-down all REGRESSED. The proven trainer-lever (uswin train_n 200->480 lifted hr +0.0297; itnet_v3 200->400 lifted +0.0165) is unmapped here. ONE KNOB CHOICE (box3): train_n 200->480 at the iter-7 BEST config (vn_T=5 RESTORED, ep traded to 4, bs1/lr5e-4/lambda0.0023/n_filters16/kernel11/n_bumps31/x_range2.0/grad_clip1.0/val_n214/seed42 held). HYPOTHESIS (box4): exposing the VN to 480 vs 200 train slices (2.4x coverage, full 3-ps stratification vs partial) lets the shared filter bank fit a less FBP-degrading regularizer -> SSIM clears further above the floor; predict SSIM ~0.82-0.84, hr ~0.05-0.09 (sibling-trainer-scale lift). NUMERIC FALSIFIER: if hr <= 0.0375 (<= iter-7 best), train_n/data-coverage does NOT lift this VN (consistent with the old-metric train_n 200->300 FLAT probe on the tiny 0.018M VN) -> the Hammernik-2017 image-domain learned-regularizer family is STRUCTURALLY FBP-BOUNDED on Mayo at hr~0.037, all single knobs (epochs/bs/lr/lambda/n_filters/vn_T/train_n) mapped, and the budget-bounded ceiling is DOCUMENTED as a negative result. BUDGET (box5, HARD 1200s train+score; sbatch --time=00:30:00): at bs=1, cost ~= train_n x epochs grad steps; iter-7 = 200x10=2000 steps in ~580s train (~0.29s/step). iter-9 = 480x4=1920 steps ~= 557s train + ~95s score(214)+figure ~= 652s predicted elapsed < 1200s (near iter-7s 679.4s); max_train_s=1050 backstop trips before the figure, well under the 1800s SLURM kill. MEMORY-SAFE: identical per-step footprint to iter-7 -- batch_size=1 KEPT (OOM-safe minimum; bs=4 OOMed the 16GB RTX5000 at iter-1), vn_T=5 RESTORED, N_k=16, 31-bump RBF across 5 unrolled steps within 16 GB; train_n only changes WHICH/HOW-MANY slices stream through, NOT the activation tensor size. grad_clip=1.0 retained (VN-family NaN-skip stability).", "comparison_image": "runs/mayo-ldct-claude-agentic-hammernik-2017-search-20260619-01/iterations/iter-0009/comparison.png"}
