{"ts": "2026-06-19T17:59:51Z", "run_id": "mayo-ldct-claude-agentic-itnet-search-20260619-01", "iter": 2, "agent": "itnet-claude-agentic-breast-ct", "model": "claude-opus-4.7-1m", "change_class": "architecture", "status": "discard", "kept": false, "val_score": 0.5927114486694336, "headroom": 0.0, "params_M": 0.232881, "train_n": 400, "rationale": "itnet-claude-agentic: pretrain_epochs=48, pretrain_lr=0.0001, itnet_k=3, itnet_alpha=0.005, unet_c=16, finetune_epochs=0, finetune_lr=0.0001, train_n=200, val_n=214, grad_clip=1.0, seed=42, rationale=ITER-2 (search-20260619-01, corrected protocol) for itnet = ItNet v1 (pretrain-denoiser-then-DC, solver_itnet.py). SIX-BOX. (1) PRIOR RESULT: iter-1 SSIM 0.4413 / hr 0.000, elapsed_s=191 of the HARD 1200s (20-min) budget -> ~1009s UNUSED. NOT budget-limited. (2) FAILURE MODE: the pretrain-denoiser-then-DC path UNDER-CONVERGES -- v1 0.441 sits far below the sibling itnet_v3 END-TO-END recipe (0.896, hr 0.268) at the same ep8/k=3/c=16 seed. v1 only trained the SmallUNet denoiser for 8 epochs (200 steps/epoch = 1600 UNet steps) then ran a pure-inference k=3 DC unroll; finetune_itnet() is NOT called so pretrain_epochs is the ONLY training lever. (3) ONE KNOB: pretrain_epochs 8 -> 48 (6x). Justification by the unused-budget NUMBERS: 8 epochs cost ~191s total wall (incl. the ~one-time 214-slice per-sample val pass + figure); scaling pretrain 6x should land ~700-900s, comfortably inside 1200s given ~1009s headroom. grad_clip=1.0 and val_n=214 UNCHANGED. (4) HYPOTHESIS: more pretraining lifts v1 toward the v3 band (hr>0, SSIM climbing toward ~0.9) because a better-converged FBP denoiser feeds the DC unroll a cleaner init. FALSIFIER: if val stays flat ~0.44, the pretrain-then-DC ARCHITECTURE is structurally capped (not epochs-limited) -> note for iter-3 that v1 must move to END-TO-END training like v3 (call finetune_itnet / unroll the denoiser through the DC steps). (5) BUDGET: HARD 20-min, val_n=214 (NOT reduced), grad_clip=1.0. (6) No control return. HARD-WIRED: staged_canonical, v3 mayo_ldct_fitted geometry, per-sample-ps (val chunk=1, itnet.projector swap per slice), bg_target=truth, 321px detector-geometry FOV (evaluate_calibrated default for AGENT4CT_DATASET=mayo_ldct_2d; NO fov= override).", "advice_for_others": "itnet-claude-agentic: pretrain_epochs=48, pretrain_lr=0.0001, itnet_k=3, itnet_alpha=0.005, unet_c=16, finetune_epochs=0, finetune_lr=0.0001, train_n=200, val_n=214, grad_clip=1.0, seed=42, rationale=ITER-2 (search-20260619-01, corrected protocol) for itnet = ItNet v1 (pretrain-denoiser-then-DC, solver_itnet.py). SIX-BOX. (1) PRIOR RESULT: iter-1 SSIM 0.4413 / hr 0.000, elapsed_s=191 of the HARD 1200s (20-min) budget -> ~1009s UNUSED. NOT budget-limited. (2) FAILURE MODE: the pretrain-denoiser-then-DC path UNDER-CONVERGES -- v1 0.441 sits far below the sibling itnet_v3 END-TO-END recipe (0.896, hr 0.268) at the same ep8/k=3/c=16 seed. v1 only trained the SmallUNet denoiser for 8 epochs (200 steps/epoch = 1600 UNet steps) then ran a pure-inference k=3 DC unroll; finetune_itnet() is NOT called so pretrain_epochs is the ONLY training lever. (3) ONE KNOB: pretrain_epochs 8 -> 48 (6x). Justification by the unused-budget NUMBERS: 8 epochs cost ~191s total wall (incl. the ~one-time 214-slice per-sample val pass + figure); scaling pretrain 6x should land ~700-900s, comfortably inside 1200s given ~1009s headroom. grad_clip=1.0 and val_n=214 UNCHANGED. (4) HYPOTHESIS: more pretraining lifts v1 toward the v3 band (hr>0, SSIM climbing toward ~0.9) because a better-converged FBP denoiser feeds the DC unroll a cleaner init. FALSIFIER: if val stays flat ~0.44, the pretrain-then-DC ARCHITECTURE is structurally capped (not epochs-limited) -> note for iter-3 that v1 must move to END-TO-END training like v3 (call finetune_itnet / unroll the denoiser through the DC steps). (5) BUDGET: HARD 20-min, val_n=214 (NOT reduced), grad_clip=1.0. (6) No control return. HARD-WIRED: staged_canonical, v3 mayo_ldct_fitted geometry, per-sample-ps (val chunk=1, itnet.projector swap per slice), bg_target=truth, 321px detector-geometry FOV (evaluate_calibrated default for AGENT4CT_DATASET=mayo_ldct_2d; NO fov= override).", "comparison_image": "runs/mayo-ldct-claude-agentic-itnet-search-20260619-01/iterations/iter-0002/comparison.png"}
{"ts": "2026-06-19T17:59:13Z", "run_id": "mayo-ldct-claude-agentic-uswin-search-20260619-01", "iter": 2, "agent": "uswin-claude-agentic-breast-ct", "model": "claude-opus-4.7-1m", "change_class": "architecture", "status": "keep", "kept": true, "val_score": 0.9140965342521667, "headroom": 0.3220626790327846, "params_M": 3.954049, "train_n": 400, "rationale": "uswin-claude-agentic: train_n=200, val_n=214, epochs=40, batch_size=4, lr=0.0005, uswin_c=24, swin_window=8, swin_heads=4, grad_clip=1.0, max_train_s=1000, seed=42, rationale=iter-2 (search-20260619-01, corrected protocol). ONE KNOB: epochs 10->40 (4x). SIX-BOX: (1) iter-1 SSIM 0.8859 / hr 0.173 / PSNR 35.73, full iter elapsed 328.96s (~5.5 min) vs HARD 20-min train+score budget -> uswin used only ~1/4 of budget. (2) UNDER-TRAINED: 10 epochs in 5.5 min; proven campaign lever (epochs+ lifted dual_domain_supervised 0.276->0.339, itnet_v3 0.268->0.310 in this same 20-min budget); discarded-run hint ~0.97 SSIM with epochs the lever. (3) Change EXACTLY ONE knob: epochs 10->40; ALL else fixed (train_n=200, bs=4, lr=5e-4, uswin_c=24, window=8, heads=4, grad_clip=1.0, seed=42). max_train_s=1000 (16.7 min) is the HARD train backstop so even if 40 epochs do not finish, train stops at the cap and ALWAYS leaves >=3 min for the 214-slice val score + figure inside the 30-min wall -> train+score stays <=20 min. (4) HYPOTHESIS: uswin is epochs-limited at ep10; 4x epochs lifts hr above 0.173 toward/past dual_domain_supervised. FALSIFIER: hr <= 0.173 at ep40 -> uswin is NOT epochs-limited in budget, iter-3 pivots to lr or uswin_c. (5) HARD 20-min budget, val=ALL 214 L277 slices (val_n NOT reduced), grad_clip=1.0, metric=321px detector-geometry FOV (default, no fov=False), staged_canonical v3, per-sample-ps, bg_target=truth. (6) no control return.", "advice_for_others": "uswin-claude-agentic: train_n=200, val_n=214, epochs=40, batch_size=4, lr=0.0005, uswin_c=24, swin_window=8, swin_heads=4, grad_clip=1.0, max_train_s=1000, seed=42, rationale=iter-2 (search-20260619-01, corrected protocol). ONE KNOB: epochs 10->40 (4x). SIX-BOX: (1) iter-1 SSIM 0.8859 / hr 0.173 / PSNR 35.73, full iter elapsed 328.96s (~5.5 min) vs HARD 20-min train+score budget -> uswin used only ~1/4 of budget. (2) UNDER-TRAINED: 10 epochs in 5.5 min; proven campaign lever (epochs+ lifted dual_domain_supervised 0.276->0.339, itnet_v3 0.268->0.310 in this same 20-min budget); discarded-run hint ~0.97 SSIM with epochs the lever. (3) Change EXACTLY ONE knob: epochs 10->40; ALL else fixed (train_n=200, bs=4, lr=5e-4, uswin_c=24, window=8, heads=4, grad_clip=1.0, seed=42). max_train_s=1000 (16.7 min) is the HARD train backstop so even if 40 epochs do not finish, train stops at the cap and ALWAYS leaves >=3 min for the 214-slice val score + figure inside the 30-min wall -> train+score stays <=20 min. (4) HYPOTHESIS: uswin is epochs-limited at ep10; 4x epochs lifts hr above 0.173 toward/past dual_domain_supervised. FALSIFIER: hr <= 0.173 at ep40 -> uswin is NOT epochs-limited in budget, iter-3 pivots to lr or uswin_c. (5) HARD 20-min budget, val=ALL 214 L277 slices (val_n NOT reduced), grad_clip=1.0, metric=321px detector-geometry FOV (default, no fov=False), staged_canonical v3, per-sample-ps, bg_target=truth. (6) no control return.", "comparison_image": "runs/mayo-ldct-claude-agentic-uswin-search-20260619-01/iterations/iter-0002/comparison.png"}
{"ts": "2026-06-19T17:52:54Z", "run_id": "mayo-ldct-claude-agentic-learned-primal-dual-search-20260619-01", "iter": 2, "agent": "learned_primal_dual-claude-agentic-breast-ct", "model": "claude-opus-4.7-1m", "change_class": "architecture", "status": "discard", "kept": false, "val_score": 0.8636346459388733, "headroom": 0.0, "params_M": 0.155406, "train_n": 400, "rationale": "learned_primal_dual-claude-agentic: lpd_iters=3, lpd_hidden=48, lpd_n_primal=5, lpd_n_dual=5, lpd_share_weights=False, lr=0.0005, lr_schedule=cosine, epochs=10, batch_size=1, val_chunk=1, train_n=200, val_n=214, grad_clip=1.0, seed=42, rationale=iter-2 search-20260619-01: SINGLE coupled knob = trade unroll depth for epochs. iter-1 (lpd_iters=5, epochs=6) scored SSIM 0.84271 / hr 0.000 in 1149.5s = 19.2min, i.e. AT the 20-min wall with hr stuck at the LD-FBP floor (budget-limited unrolled net, under-trained). No headroom to raise epochs alone. LPD per-step cost is dominated by the projector forward+adjoint calls inside each unrolled iteration, so cut lpd_iters 5->3 (~40% fewer projector calls/sample) and REINVEST the freed budget into epochs 6->10. Everything else held EXACTLY at iter-1 (hidden=48, n_primal=5, n_dual=5, lr=5e-4 cosine, train_n=200, batch=1, val_chunk=1, val_n=214, grad_clip=1.0, seed=42). HYP: a shallower-but-better-trained LPD clears the LD-FBP floor (hr>0) within 20 min. FALSIFIER: hr stays 0.000 (still at FBP floor) OR times out -> budget-bound projector-in-loop LPD cannot beat FBP on Mayo at this budget (documented ceiling) and the iters<->epochs trade is not the lever for iter-3.", "advice_for_others": "learned_primal_dual-claude-agentic: lpd_iters=3, lpd_hidden=48, lpd_n_primal=5, lpd_n_dual=5, lpd_share_weights=False, lr=0.0005, lr_schedule=cosine, epochs=10, batch_size=1, val_chunk=1, train_n=200, val_n=214, grad_clip=1.0, seed=42, rationale=iter-2 search-20260619-01: SINGLE coupled knob = trade unroll depth for epochs. iter-1 (lpd_iters=5, epochs=6) scored SSIM 0.84271 / hr 0.000 in 1149.5s = 19.2min, i.e. AT the 20-min wall with hr stuck at the LD-FBP floor (budget-limited unrolled net, under-trained). No headroom to raise epochs alone. LPD per-step cost is dominated by the projector forward+adjoint calls inside each unrolled iteration, so cut lpd_iters 5->3 (~40% fewer projector calls/sample) and REINVEST the freed budget into epochs 6->10. Everything else held EXACTLY at iter-1 (hidden=48, n_primal=5, n_dual=5, lr=5e-4 cosine, train_n=200, batch=1, val_chunk=1, val_n=214, grad_clip=1.0, seed=42). HYP: a shallower-but-better-trained LPD clears the LD-FBP floor (hr>0) within 20 min. FALSIFIER: hr stays 0.000 (still at FBP floor) OR times out -> budget-bound projector-in-loop LPD cannot beat FBP on Mayo at this budget (documented ceiling) and the iters<->epochs trade is not the lever for iter-3.", "comparison_image": "runs/mayo-ldct-claude-agentic-learned-primal-dual-search-20260619-01/iterations/iter-0002/comparison.png"}
{"ts": "2026-06-19T16:58:11Z", "run_id": "mayo-ldct-claude-agentic-hammernik-2017-search-20260619-01", "iter": 2, "agent": "hammernik_2017-claude-agentic-breast-ct", "model": "claude-opus-4.7-1m", "change_class": "architecture", "status": "discard", "kept": false, "val_score": 0.8012295961380005, "headroom": 0.0, "params_M": 0.012165, "train_n": 400, "rationale": "hammernik_2017-claude-agentic: vn_T=5, vn_n_filters=16, vn_kernel=11, vn_n_bumps=31, vn_x_range=2.0, vn_lambda_init=0.0023, epochs=14, batch_size=2, lr=0.0005, grad_clip=1.0, train_n=200, val_n=214, max_train_s=1000, seed=42, rationale=search-20260619-01 iter-2 OOM RESCUE of hammernik_2017. iter-1 (batch_size=4) was NOT a real recon: it CUDA-OOMed in the _rho_prime RBF-bump loop at elapsed_s=72.5 on a 16GB RTX5000 (val_score blank in results.tsv), recorded as 0.0. The (B,F,H,W)=(4,16,512,512) x 31-bump RBF activation tensors held across 5 unrolled steps for autograd blew the card. SINGLE COHERENT memory-safety change for this rescue: batch_size 4->2, which halves every per-batch activation tensor in the bump loop -- the direct cause. NOTE: this hammernik_2017 solver is a PURE IMAGE-DOMAIN denoiser of the FBP (no projector in the unrolled loop) and does NOT read vn_checkpoint or vn_dc_norm (verified by grep over every cfg[...]/cfg.get(...) in the solver: only vn_T/vn_n_filters/vn_kernel/vn_n_bumps/vn_x_range/vn_*_init_std/vn_lambda_init/epochs/batch_size/lr/grad_clip/train_n/val_n/seed/max_train_s are consumed). Those two knobs belong to the SIBLING projector-in-loop hammernik_vn solver; passing them here would be silently ignored, so they are intentionally omitted -- the operative fix this solver honors is the batch halving (+ grad_clip=1.0 already present for VN-family NaN-skip stability). Budget: HARD 20-min train+score; val=ALL 214 L277 slices (321px detector-geometry FOV default, no fov= override; staged_canonical v3 mayo_ldct_fitted geometry, per-sample-ps, bg_target=truth). batch=2 ~doubles steps/epoch, so epochs 40->14 (mirrors the sibling hammernik_vn iter-1 that scored 0.805 in 1296s); max_train_s=1000 (16.7min in-solver wall) is the binding constraint and leaves ~3min for score(214)+figure under the 30min SLURM kill. capacity kept modest (vn_T=5, vn_n_filters=16). HYPOTHESIS: with batch halved the activation footprint drops ~2x, the OOM is avoided, hammernik_2017 produces its FIRST FINITE recon landing near/above the ~0.84 LD-FBP floor (sibling hammernik_vn hit 0.805) -- the first valid datapoint for this solver under the corrected metric.", "advice_for_others": "hammernik_2017-claude-agentic: vn_T=5, vn_n_filters=16, vn_kernel=11, vn_n_bumps=31, vn_x_range=2.0, vn_lambda_init=0.0023, epochs=14, batch_size=2, lr=0.0005, grad_clip=1.0, train_n=200, val_n=214, max_train_s=1000, seed=42, rationale=search-20260619-01 iter-2 OOM RESCUE of hammernik_2017. iter-1 (batch_size=4) was NOT a real recon: it CUDA-OOMed in the _rho_prime RBF-bump loop at elapsed_s=72.5 on a 16GB RTX5000 (val_score blank in results.tsv), recorded as 0.0. The (B,F,H,W)=(4,16,512,512) x 31-bump RBF activation tensors held across 5 unrolled steps for autograd blew the card. SINGLE COHERENT memory-safety change for this rescue: batch_size 4->2, which halves every per-batch activation tensor in the bump loop -- the direct cause. NOTE: this hammernik_2017 solver is a PURE IMAGE-DOMAIN denoiser of the FBP (no projector in the unrolled loop) and does NOT read vn_checkpoint or vn_dc_norm (verified by grep over every cfg[...]/cfg.get(...) in the solver: only vn_T/vn_n_filters/vn_kernel/vn_n_bumps/vn_x_range/vn_*_init_std/vn_lambda_init/epochs/batch_size/lr/grad_clip/train_n/val_n/seed/max_train_s are consumed). Those two knobs belong to the SIBLING projector-in-loop hammernik_vn solver; passing them here would be silently ignored, so they are intentionally omitted -- the operative fix this solver honors is the batch halving (+ grad_clip=1.0 already present for VN-family NaN-skip stability). Budget: HARD 20-min train+score; val=ALL 214 L277 slices (321px detector-geometry FOV default, no fov= override; staged_canonical v3 mayo_ldct_fitted geometry, per-sample-ps, bg_target=truth). batch=2 ~doubles steps/epoch, so epochs 40->14 (mirrors the sibling hammernik_vn iter-1 that scored 0.805 in 1296s); max_train_s=1000 (16.7min in-solver wall) is the binding constraint and leaves ~3min for score(214)+figure under the 30min SLURM kill. capacity kept modest (vn_T=5, vn_n_filters=16). HYPOTHESIS: with batch halved the activation footprint drops ~2x, the OOM is avoided, hammernik_2017 produces its FIRST FINITE recon landing near/above the ~0.84 LD-FBP floor (sibling hammernik_vn hit 0.805) -- the first valid datapoint for this solver under the corrected metric.", "comparison_image": "runs/mayo-ldct-claude-agentic-hammernik-2017-search-20260619-01/iterations/iter-0002/comparison.png"}
{"ts": "2026-06-19T16:49:47Z", "run_id": "mayo-ldct-claude-agentic-dual-domain-supervised-search-20260619-01", "iter": 2, "agent": "dual_domain_supervised-claude-agentic-breast-ct", "model": "claude-opus-4.7-1m", "change_class": "architecture", "status": "keep", "kept": true, "val_score": 0.9097616076469421, "headroom": 0.3389846144100809, "params_M": 0.465762, "train_n": 400, "rationale": "dual_domain_supervised-claude-agentic: unet_c=16, lr=0.0001, epochs=20, batch_size=1, val_chunk=1, train_n=200, val_n=214, grad_clip=1.0, lambda_neg=1.0, seed=42, rationale=ITER-2 (search-20260619-01, corrected protocol). ONE KNOB: epochs 8 -> 20 (everything else identical to iter-1: unet_c=16, lr=1e-4, batch_size=1, val_chunk=1, train_n=200, val_n=214, grad_clip=1.0, lambda_neg=1.0, seed=42). FAILURE MODE OBSERVED: iter-1 (SSIM 0.887976 / hr 0.275953, the campaign headroom LEADER) used only elapsed_s=418.58s (~7.0 min) of the HARD 20-min train+score budget -- i.e. ~35%% utilised, ~13 min of headroom UNSPENT. DD-UNet has no unrolled DC loop so it is cheap per step; at 8 epochs the supervised dual-domain U-Net is almost certainly UNDER-TRAINED at this budget (mirrors itnet_v3, which at iter-1 used only 12.3/20 min and whose lever was epochs-up; the discarded boundary-slice run also hinted epochs as the dominant lever for this solver). HYPOTHESIS: if I raise epochs 8->20 (everything else fixed), I expect val_ssim and headroom to RISE above the iter-1 baseline (hr>0.276), because the model is under-converged at 8 epochs and 2.5x more gradient steps will reduce the train MSE further without overfitting the L277 val (214-slice metric averages out per-slice noise). FALSIFIER: if hr does NOT exceed 0.276 (or DROPS) at epochs=20, the solver was already near its 8-epoch convergence basin -> epochs is NOT the lever and iter-3 should move to lambda_neg (1.0->0.1, discarded-run hint) or lr. BUDGET CHECK vs iter-1 measured time: iter-1 = 418.58s for 8 epochs + 214-slice per-sample val + figure. Decompose ~140s fixed (data load + per-sample 214-slice val + figure I/O) + ~278s for 8 epochs (~35s/epoch). At epochs=20: ~140 + 20*35 = ~840s (~14 min) train+score; pessimistic (150s fixed + 40s/epoch) = ~950s (~15.8 min). BOTH inside the 20-min (1200s) train+score budget and the 30-min sbatch wall. grad_clip=1.0 retained (mandatory; the 2304-view Mayo FBP adjoint amplifies gradients ~18x -> lr is kept conservative + nonfinite-grad-skip). val_n=214 = ALL L277 slices (NOT reduced). HARD-WIRED (unchanged): staged_canonical v3 mayo_ldct_fitted geometry, per-sample-ps FBP + per-sample pipe.R_full swap, bg_target=truth, metric=321px detector-geometry FOV (evaluate_calibrated default for AGENT4CT_DATASET=mayo_ldct_2d; no fov= override).", "advice_for_others": "dual_domain_supervised-claude-agentic: unet_c=16, lr=0.0001, epochs=20, batch_size=1, val_chunk=1, train_n=200, val_n=214, grad_clip=1.0, lambda_neg=1.0, seed=42, rationale=ITER-2 (search-20260619-01, corrected protocol). ONE KNOB: epochs 8 -> 20 (everything else identical to iter-1: unet_c=16, lr=1e-4, batch_size=1, val_chunk=1, train_n=200, val_n=214, grad_clip=1.0, lambda_neg=1.0, seed=42). FAILURE MODE OBSERVED: iter-1 (SSIM 0.887976 / hr 0.275953, the campaign headroom LEADER) used only elapsed_s=418.58s (~7.0 min) of the HARD 20-min train+score budget -- i.e. ~35%% utilised, ~13 min of headroom UNSPENT. DD-UNet has no unrolled DC loop so it is cheap per step; at 8 epochs the supervised dual-domain U-Net is almost certainly UNDER-TRAINED at this budget (mirrors itnet_v3, which at iter-1 used only 12.3/20 min and whose lever was epochs-up; the discarded boundary-slice run also hinted epochs as the dominant lever for this solver). HYPOTHESIS: if I raise epochs 8->20 (everything else fixed), I expect val_ssim and headroom to RISE above the iter-1 baseline (hr>0.276), because the model is under-converged at 8 epochs and 2.5x more gradient steps will reduce the train MSE further without overfitting the L277 val (214-slice metric averages out per-slice noise). FALSIFIER: if hr does NOT exceed 0.276 (or DROPS) at epochs=20, the solver was already near its 8-epoch convergence basin -> epochs is NOT the lever and iter-3 should move to lambda_neg (1.0->0.1, discarded-run hint) or lr. BUDGET CHECK vs iter-1 measured time: iter-1 = 418.58s for 8 epochs + 214-slice per-sample val + figure. Decompose ~140s fixed (data load + per-sample 214-slice val + figure I/O) + ~278s for 8 epochs (~35s/epoch). At epochs=20: ~140 + 20*35 = ~840s (~14 min) train+score; pessimistic (150s fixed + 40s/epoch) = ~950s (~15.8 min). BOTH inside the 20-min (1200s) train+score budget and the 30-min sbatch wall. grad_clip=1.0 retained (mandatory; the 2304-view Mayo FBP adjoint amplifies gradients ~18x -> lr is kept conservative + nonfinite-grad-skip). val_n=214 = ALL L277 slices (NOT reduced). HARD-WIRED (unchanged): staged_canonical v3 mayo_ldct_fitted geometry, per-sample-ps FBP + per-sample pipe.R_full swap, bg_target=truth, metric=321px detector-geometry FOV (evaluate_calibrated default for AGENT4CT_DATASET=mayo_ldct_2d; no fov= override).", "comparison_image": "runs/mayo-ldct-claude-agentic-dual-domain-supervised-search-20260619-01/iterations/iter-0002/comparison.png"}
