{"ts": "2026-06-20T07:03:35Z", "run_id": "mayo-ldct-claude-agentic-dual-domain-supervised-search-20260619-01", "iter": 5, "agent": "dual_domain_supervised-claude-agentic", "model": "claude-opus-4-8-1m", "change_class": "architecture", "status": "keep", "kept": true, "val_score": 0.9230557680130005, "headroom": 0.39940507749310716, "params_M": 0.465762, "train_n": 400, "rationale": "dual_domain_supervised-claude-agentic: unet_c=16, lr=0.0001, epochs=9, batch_size=1, val_chunk=1, train_n=579, val_n=214, grad_clip=1.0, lambda_neg=1.0, seed=42, rationale=ITER-5 (search-20260619-01, corrected protocol). START FROM iter-3 BEST (c16/ep27/lr1e-4), NOT iter-4's regressed c24. ONE KNOB (training-data coverage): train_n 200 -> 579 (the FULL Wagner train pool), with epochs TRADED DOWN 27 -> 9 as the forced budget-coupling to fit the HARD 20-min (1200s) train+score wall. SIX-BOX (NUMBERS). (1) iter-3 best: SSIM 0.918191 / hr 0.365357 at unet_c=16/epochs=27/lr=1e-4/train_n=200, elapsed_s=1151.40s (19.2 min, near the wall). (2) LIMITER: epochs AND capacity are both EXHAUSTED. The epochs lever was monotone (ep8 hr0.276 -> ep20 0.339 -> ep27 0.3654) but is WALL-LOCKED (iter-3 ep27 used 1151.4/1200s; ep32 -> 1366s busts). The capacity lever REGRESSED (iter-4 c24/ep10 -> hr 0.298560, BELOW iter-3, because trading 27->10 epochs to fund 2.25x conv-compute under-trained the bigger net). No lr-schedule is wired (FORBIDDEN to edit the shared solver). Is the champion DATA-COVERAGE-limited? iter-3 trained on only train_n=200 of the 579-slice train pool (CONFIRMED: solver_dual_ddomain_supervised.py build_dataset -> load_val_split(kind='mayo_ldct_2d', split='train', n=train_n) slices n_eff=min(train_n,n_truth) DISTINCT stratified slices ONCE and trains the SAME fixed set every epoch via torch.randperm reshuffle -- NO RotatingSubsetDataset rotation in this path, so train_n is a GENUINE live lever, NOT inert; 379 of the 579 train slices were UNUSED at train_n=200). The val FIGURE's harness metadata field train_n=400 is a cosmetic TRAIN_N-env default in claude_agentic_one_iter.py:185/263 and does NOT override the solver's cfg train_n -- the solver uses cfg['train_n'] from this JSON. (3) ONE KNOB: training data train_n 200->579 (use the ENTIRE Wagner train set; stratified round-robin spans all 3 ps-groups 0.66192:154 + 0.73979:98 + 0.77873:327 = 579). BUDGET-TRADE MATH: from the 3 measured c16/train_n=200 points (ep8 418.58s, ep20 893.06s, ep27 1151.4s) the per-epoch cost is (893.06-418.58)/(20-8)=39.54 s/epoch and fixed (data load + 214-slice per-sample val + figure I/O)=102.3s -> per_slice=39.54/200=0.1977 s/slice/epoch (per-epoch cost scales LINEARLY in train_n: the train loop iterates train_noisy.shape[0]). At train_n=579: per_epoch=579*0.1977=114.5s and fixed ~125s (val=214 is train_n-independent; +~23s extra data-load for 379 more slices). epochs=9 predicts 125 + 9*114.5 = 1155s = 19.3 min (~45s margin inside the 1200s budget; sbatch wall 30 min). epochs=10 -> 1270s = 21.2 min BUSTS the 20-min wall, so 10 is NOT chosen; 9 is the largest epoch count the full-pool timing permits. (Model calibration: it predicts iter-3 ep27 at 1170s vs actual 1151.4s, within 1.6%.) (4) HYPOTHESIS: 2.9x more distinct training slices (200->579, the full pool) lifts hr ABOVE the iter-3 champion 0.365357 even at the reduced ep9, because at train_n=200 the supervised DD-UNet sees only ~35% of the Wagner train anatomy and is data-coverage-limited on the held-out L277 val patient (better train-set diversity -> better generalisation under the 214-slice/321px-FOV metric). FALSIFIER (in NUMBERS): if hr <= 0.365357 at train_n=579/ep9, the DD-UNet is at its BUDGET-CONSTRAINED CEILING on this val set (~0.37) and ALL THREE levers -- epochs (wall-locked), capacity (regressed iter-4), AND data coverage (this iter) -- are EXHAUSTED -> file the CHAMPION-CEILING verdict for dual_domain_supervised. (5) HARD 20-min train+score budget; val=ALL 214 L277 slices; grad_clip=1.0 (mandatory; the 2304-view Mayo FBP adjoint amplifies gradients ~18x -> lr kept conservative at 1e-4 + nonfinite-grad-skip). (6) no control return. HARD-WIRED (unchanged): staged_canonical v3 mayo_ldct_fitted geometry, per-sample-ps FBP + per-sample pipe.R_full swap, bg_target=truth, metric=321px detector-geometry FOV (evaluate_calibrated default for AGENT4CT_DATASET=mayo_ldct_2d; no fov= override).", "advice_for_others": "dual_domain_supervised-claude-agentic: unet_c=16, lr=0.0001, epochs=9, batch_size=1, val_chunk=1, train_n=579, val_n=214, grad_clip=1.0, lambda_neg=1.0, seed=42, rationale=ITER-5 (search-20260619-01, corrected protocol). START FROM iter-3 BEST (c16/ep27/lr1e-4), NOT iter-4's regressed c24. ONE KNOB (training-data coverage): train_n 200 -> 579 (the FULL Wagner train pool), with epochs TRADED DOWN 27 -> 9 as the forced budget-coupling to fit the HARD 20-min (1200s) train+score wall. SIX-BOX (NUMBERS). (1) iter-3 best: SSIM 0.918191 / hr 0.365357 at unet_c=16/epochs=27/lr=1e-4/train_n=200, elapsed_s=1151.40s (19.2 min, near the wall). (2) LIMITER: epochs AND capacity are both EXHAUSTED. The epochs lever was monotone (ep8 hr0.276 -> ep20 0.339 -> ep27 0.3654) but is WALL-LOCKED (iter-3 ep27 used 1151.4/1200s; ep32 -> 1366s busts). The capacity lever REGRESSED (iter-4 c24/ep10 -> hr 0.298560, BELOW iter-3, because trading 27->10 epochs to fund 2.25x conv-compute under-trained the bigger net). No lr-schedule is wired (FORBIDDEN to edit the shared solver). Is the champion DATA-COVERAGE-limited? iter-3 trained on only train_n=200 of the 579-slice train pool (CONFIRMED: solver_dual_ddomain_supervised.py build_dataset -> load_val_split(kind='mayo_ldct_2d', split='train', n=train_n) slices n_eff=min(train_n,n_truth) DISTINCT stratified slices ONCE and trains the SAME fixed set every epoch via torch.randperm reshuffle -- NO RotatingSubsetDataset rotation in this path, so train_n is a GENUINE live lever, NOT inert; 379 of the 579 train slices were UNUSED at train_n=200). The val FIGURE's harness metadata field train_n=400 is a cosmetic TRAIN_N-env default in claude_agentic_one_iter.py:185/263 and does NOT override the solver's cfg train_n -- the solver uses cfg['train_n'] from this JSON. (3) ONE KNOB: training data train_n 200->579 (use the ENTIRE Wagner train set; stratified round-robin spans all 3 ps-groups 0.66192:154 + 0.73979:98 + 0.77873:327 = 579). BUDGET-TRADE MATH: from the 3 measured c16/train_n=200 points (ep8 418.58s, ep20 893.06s, ep27 1151.4s) the per-epoch cost is (893.06-418.58)/(20-8)=39.54 s/epoch and fixed (data load + 214-slice per-sample val + figure I/O)=102.3s -> per_slice=39.54/200=0.1977 s/slice/epoch (per-epoch cost scales LINEARLY in train_n: the train loop iterates train_noisy.shape[0]). At train_n=579: per_epoch=579*0.1977=114.5s and fixed ~125s (val=214 is train_n-independent; +~23s extra data-load for 379 more slices). epochs=9 predicts 125 + 9*114.5 = 1155s = 19.3 min (~45s margin inside the 1200s budget; sbatch wall 30 min). epochs=10 -> 1270s = 21.2 min BUSTS the 20-min wall, so 10 is NOT chosen; 9 is the largest epoch count the full-pool timing permits. (Model calibration: it predicts iter-3 ep27 at 1170s vs actual 1151.4s, within 1.6%.) (4) HYPOTHESIS: 2.9x more distinct training slices (200->579, the full pool) lifts hr ABOVE the iter-3 champion 0.365357 even at the reduced ep9, because at train_n=200 the supervised DD-UNet sees only ~35% of the Wagner train anatomy and is data-coverage-limited on the held-out L277 val patient (better train-set diversity -> better generalisation under the 214-slice/321px-FOV metric). FALSIFIER (in NUMBERS): if hr <= 0.365357 at train_n=579/ep9, the DD-UNet is at its BUDGET-CONSTRAINED CEILING on this val set (~0.37) and ALL THREE levers -- epochs (wall-locked), capacity (regressed iter-4), AND data coverage (this iter) -- are EXHAUSTED -> file the CHAMPION-CEILING verdict for dual_domain_supervised. (5) HARD 20-min train+score budget; val=ALL 214 L277 slices; grad_clip=1.0 (mandatory; the 2304-view Mayo FBP adjoint amplifies gradients ~18x -> lr kept conservative at 1e-4 + nonfinite-grad-skip). (6) no control return. HARD-WIRED (unchanged): staged_canonical v3 mayo_ldct_fitted geometry, per-sample-ps FBP + per-sample pipe.R_full swap, bg_target=truth, metric=321px detector-geometry FOV (evaluate_calibrated default for AGENT4CT_DATASET=mayo_ldct_2d; no fov= override).", "comparison_image": "runs/mayo-ldct-claude-agentic-dual-domain-supervised-search-20260619-01/iterations/iter-0005/comparison.png"}
{"ts": "2026-06-20T07:02:15Z", "run_id": "mayo-ldct-claude-agentic-learned-primal-dual-search-20260619-01", "iter": 5, "agent": "learned_primal_dual-claude-agentic", "model": "claude-opus-4-8-1m", "change_class": "architecture", "status": "discard", "kept": false, "val_score": 0.8844601511955261, "headroom": 0.0, "params_M": 0.155406, "train_n": 400, "rationale": "learned_primal_dual-claude-agentic: lpd_iters=3, lpd_hidden=48, lpd_n_primal=5, lpd_n_dual=5, lpd_share_weights=False, lr=0.0007, lr_schedule=cosine, epochs=7, batch_size=1, val_chunk=1, train_n=300, val_n=214, grad_clip=1.0, seed=42, rationale=iter-5 search-20260619-01: ONE knob = train_n 200 -> 300 (the ONLY untried lever on LPD's Mayo arc). Everything physics/capacity held at iter-4's budget-compliant best-SSIM point (lpd_iters=3, hidden=48, n_primal=5, n_dual=5, lr=7e-4 cosine, batch=1, val_chunk=1, val_n=214, grad_clip=1.0, seed=42); epochs traded 10 -> 7 PURELY to hold the HARD 20-min wall (see budget math). WHY DATA IS NOT INERT: the LPD solver loads a FIXED train_n subset ONCE via build_dataset->load_val_split (solver L81), then torch.randperm reshuffles that SAME fixed tensor each epoch (solver L257). There is NO per-epoch RotatingSubsetDataset rotation in this solver path, so train_n=200 has only ever shown the net 200 distinct slices out of the 579-slice train pool (3 patients: ps-groups 154/98/327). At Mayo train_n the loader stratifies round-robin across the 3 ps-groups, so 200->300 adds ~100 genuinely-new distinct slices spanning all 3 train patients (group-2 caps at 98) => +50% effective training set, still patient-balanced. LIMITER REFRAME: the SSIM 0.843->0.864->0.885->0.898 arc was driven by epochs (under-training), then lr (iter-4), with hr pinned at the LD-FBP floor (0.000) the WHOLE way; epochs is now wall-capped and lr is spent, but the net has NEVER seen more than 200/579 slices. Data-coverage is the unexamined axis. BUDGET MATH vs 1200s/20-min wall: total job time scales with total gradient steps = epochs*train_n (batch=1) + a small fixed ~95s (cuda init + the fixed 214-slice val pass). iter-4 = 2000 steps (ep10*tn200) ran 1100.7s=18.35min => conservative 0.503 s/step. iter-5 = 2100 steps (ep7*tn300) -> model 1151s=19.18min, +49s margin under the 1200s wall (ep8*tn300=2400 steps=21.7min OVERshoots; ep7 is the budget-fit epoch count for tn300). lpd_hidden^/lpd_iters^ stay OFF (add per-sample projector fwd+adj cost, blow the wall). HYP: +50% distinct (still patient-balanced) training data lets the LPD generalise to the held-out val patient L277 better than 200 slices did, lifting SSIM (predict ~0.90-0.92) and, if the extra coverage adds real high-frequency structure the 200-slice net was missing, pushing RMSE down enough to clear the LD-FBP floor (hr>0) for the first time on LPD's Mayo arc. FALSIFIER: SSIM plateaus at/below 0.898 (iter-4) AND hr still 0.000 => more data is NOT the lever; LPD is at its budget-constrained ceiling on 2304-view Mayo (~0.90 SSIM, hr 0) -- a projector-in-loop unrolled net that sharpens structure (rising SSIM) but cannot beat FBP on PSNR/RMSE within the 20-min budget at this capacity. The epochs-down-to-7 confound is bounded: if SSIM DROPS below iter-2's 0.864 (ep10/tn200) the cut went too far and tn300 needs a deeper wall, not this budget.", "advice_for_others": "learned_primal_dual-claude-agentic: lpd_iters=3, lpd_hidden=48, lpd_n_primal=5, lpd_n_dual=5, lpd_share_weights=False, lr=0.0007, lr_schedule=cosine, epochs=7, batch_size=1, val_chunk=1, train_n=300, val_n=214, grad_clip=1.0, seed=42, rationale=iter-5 search-20260619-01: ONE knob = train_n 200 -> 300 (the ONLY untried lever on LPD's Mayo arc). Everything physics/capacity held at iter-4's budget-compliant best-SSIM point (lpd_iters=3, hidden=48, n_primal=5, n_dual=5, lr=7e-4 cosine, batch=1, val_chunk=1, val_n=214, grad_clip=1.0, seed=42); epochs traded 10 -> 7 PURELY to hold the HARD 20-min wall (see budget math). WHY DATA IS NOT INERT: the LPD solver loads a FIXED train_n subset ONCE via build_dataset->load_val_split (solver L81), then torch.randperm reshuffles that SAME fixed tensor each epoch (solver L257). There is NO per-epoch RotatingSubsetDataset rotation in this solver path, so train_n=200 has only ever shown the net 200 distinct slices out of the 579-slice train pool (3 patients: ps-groups 154/98/327). At Mayo train_n the loader stratifies round-robin across the 3 ps-groups, so 200->300 adds ~100 genuinely-new distinct slices spanning all 3 train patients (group-2 caps at 98) => +50% effective training set, still patient-balanced. LIMITER REFRAME: the SSIM 0.843->0.864->0.885->0.898 arc was driven by epochs (under-training), then lr (iter-4), with hr pinned at the LD-FBP floor (0.000) the WHOLE way; epochs is now wall-capped and lr is spent, but the net has NEVER seen more than 200/579 slices. Data-coverage is the unexamined axis. BUDGET MATH vs 1200s/20-min wall: total job time scales with total gradient steps = epochs*train_n (batch=1) + a small fixed ~95s (cuda init + the fixed 214-slice val pass). iter-4 = 2000 steps (ep10*tn200) ran 1100.7s=18.35min => conservative 0.503 s/step. iter-5 = 2100 steps (ep7*tn300) -> model 1151s=19.18min, +49s margin under the 1200s wall (ep8*tn300=2400 steps=21.7min OVERshoots; ep7 is the budget-fit epoch count for tn300). lpd_hidden^/lpd_iters^ stay OFF (add per-sample projector fwd+adj cost, blow the wall). HYP: +50% distinct (still patient-balanced) training data lets the LPD generalise to the held-out val patient L277 better than 200 slices did, lifting SSIM (predict ~0.90-0.92) and, if the extra coverage adds real high-frequency structure the 200-slice net was missing, pushing RMSE down enough to clear the LD-FBP floor (hr>0) for the first time on LPD's Mayo arc. FALSIFIER: SSIM plateaus at/below 0.898 (iter-4) AND hr still 0.000 => more data is NOT the lever; LPD is at its budget-constrained ceiling on 2304-view Mayo (~0.90 SSIM, hr 0) -- a projector-in-loop unrolled net that sharpens structure (rising SSIM) but cannot beat FBP on PSNR/RMSE within the 20-min budget at this capacity. The epochs-down-to-7 confound is bounded: if SSIM DROPS below iter-2's 0.864 (ep10/tn200) the cut went too far and tn300 needs a deeper wall, not this budget.", "comparison_image": "runs/mayo-ldct-claude-agentic-learned-primal-dual-search-20260619-01/iterations/iter-0005/comparison.png"}
