{"ts": "2026-06-20T11:25:56Z", "run_id": "mayo-ldct-claude-agentic-diff-recon-dcstep-unconstrained-mayo-v4-search-20260619-01", "iter": 5, "agent": "diffusion_recon_dcstep_unconstrained_mayo_v4-claude-agentic", "model": "claude-opus-4-8-1m", "change_class": "architecture", "status": "discard", "kept": false, "val_score": 0.37089279294013977, "headroom": 0.0, "params_M": 8.594211, "train_n": 400, "rationale": "diffusion_recon_dcstep_unconstrained_mayo_v4-claude-agentic: recon_ckpt=/cluster/maier/Agent4CT/checkpoints/ddpm_mayo_unconstrained_v4.pt, recon_mode=dps, recon_sample_steps=40, recon_eta=5.0, recon_init=fbp, recon_eta_clamp=False, recon_dcstep_every=0, recon_dcstep_n_cg=3, recon_dcstep_warmup=5, recon_dcstep_relax=1.0, val_n=120, train_n=0, rationale=iter-5 search-20260619-01 UNCONSTRAINED diff-recon vs reused Mayo DDPM v4 ckpt (ddpm_mayo_unconstrained_v4.pt, NO retrain). ONE HYPOTHESIS KNOB: recon_sample_steps (T, the DDIM reverse-step count) 25->40; val_n 214->120 evenly-spaced is the BUDGET-SIZING mechanism (box 5), NOT a hypothesis variable. BASE = iter-2 BEST non-collapsed config (eta=5.0, recon_init=fbp, recon_dcstep_every=0 = PURE SOFT DPS with NO hard-CG, recon_eta_clamp=false). Did NOT base off iter-3 (T=32 at eta=5/every=0 was slightly DOWN 0.396->0.387) or iter-4 (hard-DC every=5 COLLAPSED to 0.0553 -- do NOT switch to hard-DC). TRAJECTORY (val=214 L277, 321px FOV, LD-FBP floor 0.8078): iter-1 T=25/eta=30/every=0 SSIM 0.3688/hr0/PSNR10.55; iter-2 eta30->5 SSIM 0.3960/hr0/PSNR11.25 (BEST); iter-3 T25->32 SSIM 0.3869/hr0 (slightly DOWN at eta=5/every=0); iter-4 every0->5 hard-DC SSIM 0.0553 (COLLAPSE). KEY SIGNAL the unconstrained iter-3/4 authors OVER-WEIGHTED: the unconstrained T-probe stopped at T=32 (only +7 steps) and read flat, prematurely filing prior-mismatch. The CONSTRAINED SIBLING REFUTED that: at its working point T28->T40 lifted SSIM 0.478->0.665 MONOTONICALLY (+0.187, PSNR +5.8dB), and earlier T25->28 lifted 0.394->0.478. T is the STRONGEST live lever once the rest of the config sits at a working point; the 25-step low-T DDIM schedule is too COARSE for the FBP-initialized iterate to relax onto the sino-consistent mode. eta is EXHAUSTED (30->5 only +0.027) and I do NOT move it off the iter-2 working point; I do NOT switch to hard-DC (collapsed). FAILURE MODE (numbers): the recon sits 0.396 vs the 0.81 FBP floor; the coarse 25-step reverse schedule + pure-soft DPS cannot pull the FBP init onto the measurement manifold in so few steps. HYPOTHESIS: if the constrained-siblings T-climb mechanism transfers to the unconstrained soft-DPS path, T 25->40 (+15-step, 1.6x finer reverse schedule) lifts SSIM meaningfully above iter-2 0.3960 -- predicted 0.50-0.60 (a monotone continuation toward the floor). FALSIFIER: if SSIM stays <=0.42 (flat vs iter-2 0.396) at T=40, T has SATURATED on the soft-DPS unconstrained path -> the eta AND T levers are both exhausted -> FILE THE DIFFUSION-PRIOR-MISMATCH VERDICT for the unconstrained variant (Mayo v4 DDPM globally faithful but not conditionally faithful under soft DPS, mirroring the breast-DDPM hr=0 structural verdict); unconstrained best stays iter-2 (SSIM 0.396, hr 0). BUDGET (HARD 20-min=1200s wall): per-step-per-slice constant ~0.162 s (iter-2 868.33/214/25=0.1623; iter-3 1103.8/214/32=0.1612 -- clean linear in TxVAL_N). T=40 x val_n=120 = 40*120*0.162 = 778s = 13.0 min < 1200s wall (~420s headroom). T=40 x val_n=214 would be 1387s=23.1min (BLOWS the wall) -> val_n=120 is the budget mechanism that unlocks the T test, evenly-spaced across the 214-slice L277 volume (protocol-sanctioned when val_n<214; matches the constrained iter-5 basis for comparability). val=120 evenly-spaced L277, 321px detector-geometry FOV default (no fov=False).", "advice_for_others": "diffusion_recon_dcstep_unconstrained_mayo_v4-claude-agentic: recon_ckpt=/cluster/maier/Agent4CT/checkpoints/ddpm_mayo_unconstrained_v4.pt, recon_mode=dps, recon_sample_steps=40, recon_eta=5.0, recon_init=fbp, recon_eta_clamp=False, recon_dcstep_every=0, recon_dcstep_n_cg=3, recon_dcstep_warmup=5, recon_dcstep_relax=1.0, val_n=120, train_n=0, rationale=iter-5 search-20260619-01 UNCONSTRAINED diff-recon vs reused Mayo DDPM v4 ckpt (ddpm_mayo_unconstrained_v4.pt, NO retrain). ONE HYPOTHESIS KNOB: recon_sample_steps (T, the DDIM reverse-step count) 25->40; val_n 214->120 evenly-spaced is the BUDGET-SIZING mechanism (box 5), NOT a hypothesis variable. BASE = iter-2 BEST non-collapsed config (eta=5.0, recon_init=fbp, recon_dcstep_every=0 = PURE SOFT DPS with NO hard-CG, recon_eta_clamp=false). Did NOT base off iter-3 (T=32 at eta=5/every=0 was slightly DOWN 0.396->0.387) or iter-4 (hard-DC every=5 COLLAPSED to 0.0553 -- do NOT switch to hard-DC). TRAJECTORY (val=214 L277, 321px FOV, LD-FBP floor 0.8078): iter-1 T=25/eta=30/every=0 SSIM 0.3688/hr0/PSNR10.55; iter-2 eta30->5 SSIM 0.3960/hr0/PSNR11.25 (BEST); iter-3 T25->32 SSIM 0.3869/hr0 (slightly DOWN at eta=5/every=0); iter-4 every0->5 hard-DC SSIM 0.0553 (COLLAPSE). KEY SIGNAL the unconstrained iter-3/4 authors OVER-WEIGHTED: the unconstrained T-probe stopped at T=32 (only +7 steps) and read flat, prematurely filing prior-mismatch. The CONSTRAINED SIBLING REFUTED that: at its working point T28->T40 lifted SSIM 0.478->0.665 MONOTONICALLY (+0.187, PSNR +5.8dB), and earlier T25->28 lifted 0.394->0.478. T is the STRONGEST live lever once the rest of the config sits at a working point; the 25-step low-T DDIM schedule is too COARSE for the FBP-initialized iterate to relax onto the sino-consistent mode. eta is EXHAUSTED (30->5 only +0.027) and I do NOT move it off the iter-2 working point; I do NOT switch to hard-DC (collapsed). FAILURE MODE (numbers): the recon sits 0.396 vs the 0.81 FBP floor; the coarse 25-step reverse schedule + pure-soft DPS cannot pull the FBP init onto the measurement manifold in so few steps. HYPOTHESIS: if the constrained-siblings T-climb mechanism transfers to the unconstrained soft-DPS path, T 25->40 (+15-step, 1.6x finer reverse schedule) lifts SSIM meaningfully above iter-2 0.3960 -- predicted 0.50-0.60 (a monotone continuation toward the floor). FALSIFIER: if SSIM stays <=0.42 (flat vs iter-2 0.396) at T=40, T has SATURATED on the soft-DPS unconstrained path -> the eta AND T levers are both exhausted -> FILE THE DIFFUSION-PRIOR-MISMATCH VERDICT for the unconstrained variant (Mayo v4 DDPM globally faithful but not conditionally faithful under soft DPS, mirroring the breast-DDPM hr=0 structural verdict); unconstrained best stays iter-2 (SSIM 0.396, hr 0). BUDGET (HARD 20-min=1200s wall): per-step-per-slice constant ~0.162 s (iter-2 868.33/214/25=0.1623; iter-3 1103.8/214/32=0.1612 -- clean linear in TxVAL_N). T=40 x val_n=120 = 40*120*0.162 = 778s = 13.0 min < 1200s wall (~420s headroom). T=40 x val_n=214 would be 1387s=23.1min (BLOWS the wall) -> val_n=120 is the budget mechanism that unlocks the T test, evenly-spaced across the 214-slice L277 volume (protocol-sanctioned when val_n<214; matches the constrained iter-5 basis for comparability). val=120 evenly-spaced L277, 321px detector-geometry FOV default (no fov=False).", "comparison_image": "runs/mayo-ldct-claude-agentic-diff-recon-dcstep-unconstrained-mayo-v4-search-20260619-01/iterations/iter-0005/comparison.png"}
{"ts": "2026-06-20T10:59:52Z", "run_id": "mayo-ldct-claude-agentic-r2gaussian-search-20260619-01", "iter": 5, "agent": "r2gaussian-claude-agentic", "model": "claude-opus-4-8-1m", "change_class": "architecture", "status": "discard", "kept": false, "val_score": 0.7307050824165344, "headroom": 0.0, "params_M": 0.001536, "train_n": 400, "rationale": "r2gaussian-claude-agentic: val_n=214, gs_n_gaussians=256, gs_n_iter=150, gs_lr_pos=0.005, gs_lr_scale=0.01, gs_lr_amp=0.01, gs_lr_rot=0.01, gs_amp_init=0.01, gs_scale_init=0.04, gs_tv_weight=0.0001, gs_n_clip=0.05, gs_init_from_fbp=False, gs_outer_wall_s=1080, rationale=iter-5 (search-20260619-01). ONE KNOB: gs_n_gaussians 512->256 (per-scene Gaussian COUNT, from iter-1 BEST base: n_iter=150 / all other knobs held). FAILURE MODE established iters 1-4: r2gaussian is a PER-SCENE Gaussian-splatting fit (no training/amortization) and is BUDGET-INCOMPATIBLE with the 214-slice Mayo protocol at the hard 20-min wall. The gs_n_iter axis is fully mapped and its optimum is iter-1 (n_iter=150, 26/214 scenes, SSIM 0.7383, BEST). BOTH gs_n_iter levers REFUTED in numbers: QUALITY (iter-2 150->400 steps = -0.0001 FLAT) and COVERAGE-via-fewer-steps (iter-3 26->64 scenes = -0.057 DESTRUCTIVE, because a 60-step per-scene Gaussian recon scores BELOW the 0.808 LD-FBP init it replaces). gs_n_iter cannot decouple coverage from quality (cutting steps cuts quality). gs_n_gaussians is the UNTRIED axis that attacks the binding limiter (per-scene step COST = 0.282 s/step at 512 Gaussians, dominated by the dense rasterization + one 2304-view forward/back-proj) WITHOUT touching the 150-step per-scene budget that produced the BEST result. HYPOTHESIS (falsifiable in NUMBERS): halving the Gaussian count halves the per-step rasterization cost (~0.282->~0.16 s/step) so at n_iter=150 per-scene ~24 s -> 1080s wall / 24 = ~45/214 scenes (~1.7x iter-1 coverage) at the SAME 150-step quality. If a 256-Gaussian / 150-step per-scene recon is AT/ABOVE its FBP init, ~doubled coverage LIFTS the 214-avg above iter-1 best 0.7383; if it is BELOW FBP (like iter-3 60-step recons), more coverage HURTS toward iter-3 0.681. FALSIFIER: if SSIM <= 0.7383 (no lift over iter-1 best), the coverage-at-fixed-150-step-quality axis is exhausted -> r2gaussian is STRUCTURALLY budget-incompatible with the 214-slice Mayo protocol (documented NEGATIVE RESULT, hr 0): no (gs_n_iter, gs_n_gaussians) both covers all 214 AND fits any scene above its FBP init in 20 min. PREDICTION: SSIM ~0.68-0.73, hr 0 (the 150-step per-scene Gaussian recon is itself sub-FBP, so doubling coverage of sub-FBP recons most likely DROPS the avg toward 0.681 -- the structural ceiling). BUDGET MATH: ~24 s/scene x 45 scenes = ~1080s ~ the gs_outer_wall_s=1080 in-solver wall (self-truncates, scores whatever completed, exactly as iters 1-4); SLURM --time=00:30:00 default has headroom (~1100-1140s observed elapsed_s, val figure excluded). val_n stays 214 (NOT reduced) per mandate; gs_n_gaussians 256 well within the <=1024 cap. TRAJECTORY: iter-2 0.7370 (10/214) -> iter-1 0.7383 (26/214, BEST, 512 Gaussians) -> iter-3 0.6810 (64/214) | iter-5 = ~45/214 at 256 Gaussians, the coverage-at-fixed-quality test of the structural-ceiling verdict.", "advice_for_others": "r2gaussian-claude-agentic: val_n=214, gs_n_gaussians=256, gs_n_iter=150, gs_lr_pos=0.005, gs_lr_scale=0.01, gs_lr_amp=0.01, gs_lr_rot=0.01, gs_amp_init=0.01, gs_scale_init=0.04, gs_tv_weight=0.0001, gs_n_clip=0.05, gs_init_from_fbp=False, gs_outer_wall_s=1080, rationale=iter-5 (search-20260619-01). ONE KNOB: gs_n_gaussians 512->256 (per-scene Gaussian COUNT, from iter-1 BEST base: n_iter=150 / all other knobs held). FAILURE MODE established iters 1-4: r2gaussian is a PER-SCENE Gaussian-splatting fit (no training/amortization) and is BUDGET-INCOMPATIBLE with the 214-slice Mayo protocol at the hard 20-min wall. The gs_n_iter axis is fully mapped and its optimum is iter-1 (n_iter=150, 26/214 scenes, SSIM 0.7383, BEST). BOTH gs_n_iter levers REFUTED in numbers: QUALITY (iter-2 150->400 steps = -0.0001 FLAT) and COVERAGE-via-fewer-steps (iter-3 26->64 scenes = -0.057 DESTRUCTIVE, because a 60-step per-scene Gaussian recon scores BELOW the 0.808 LD-FBP init it replaces). gs_n_iter cannot decouple coverage from quality (cutting steps cuts quality). gs_n_gaussians is the UNTRIED axis that attacks the binding limiter (per-scene step COST = 0.282 s/step at 512 Gaussians, dominated by the dense rasterization + one 2304-view forward/back-proj) WITHOUT touching the 150-step per-scene budget that produced the BEST result. HYPOTHESIS (falsifiable in NUMBERS): halving the Gaussian count halves the per-step rasterization cost (~0.282->~0.16 s/step) so at n_iter=150 per-scene ~24 s -> 1080s wall / 24 = ~45/214 scenes (~1.7x iter-1 coverage) at the SAME 150-step quality. If a 256-Gaussian / 150-step per-scene recon is AT/ABOVE its FBP init, ~doubled coverage LIFTS the 214-avg above iter-1 best 0.7383; if it is BELOW FBP (like iter-3 60-step recons), more coverage HURTS toward iter-3 0.681. FALSIFIER: if SSIM <= 0.7383 (no lift over iter-1 best), the coverage-at-fixed-150-step-quality axis is exhausted -> r2gaussian is STRUCTURALLY budget-incompatible with the 214-slice Mayo protocol (documented NEGATIVE RESULT, hr 0): no (gs_n_iter, gs_n_gaussians) both covers all 214 AND fits any scene above its FBP init in 20 min. PREDICTION: SSIM ~0.68-0.73, hr 0 (the 150-step per-scene Gaussian recon is itself sub-FBP, so doubling coverage of sub-FBP recons most likely DROPS the avg toward 0.681 -- the structural ceiling). BUDGET MATH: ~24 s/scene x 45 scenes = ~1080s ~ the gs_outer_wall_s=1080 in-solver wall (self-truncates, scores whatever completed, exactly as iters 1-4); SLURM --time=00:30:00 default has headroom (~1100-1140s observed elapsed_s, val figure excluded). val_n stays 214 (NOT reduced) per mandate; gs_n_gaussians 256 well within the <=1024 cap. TRAJECTORY: iter-2 0.7370 (10/214) -> iter-1 0.7383 (26/214, BEST, 512 Gaussians) -> iter-3 0.6810 (64/214) | iter-5 = ~45/214 at 256 Gaussians, the coverage-at-fixed-quality test of the structural-ceiling verdict.", "comparison_image": "runs/mayo-ldct-claude-agentic-r2gaussian-search-20260619-01/iterations/iter-0005/comparison.png"}
{"ts": "2026-06-20T10:50:42Z", "run_id": "mayo-ldct-claude-agentic-diff-recon-dcstep-constrained-mayo-v4-search-20260619-01", "iter": 5, "agent": "diffusion_recon_dcstep_constrained_mayo_v4-claude-agentic", "model": "claude-opus-4-8-1m", "change_class": "architecture", "status": "discard", "kept": false, "val_score": 0.6647486686706543, "headroom": 0.0, "params_M": 8.594211, "train_n": 400, "rationale": "diffusion_recon_dcstep_constrained_mayo_v4-claude-agentic: recon_ckpt=/cluster/maier/Agent4CT/checkpoints/ddpm_mayo_constrained_v4.pt, recon_mode=dps, recon_sample_steps=40, recon_eta=30.0, recon_init=fbp, recon_eta_clamp=False, recon_dcstep_every=5, recon_dcstep_n_cg=3, recon_dcstep_warmup=5, recon_dcstep_relax=1.0, val_n=120, train_n=0, rationale=iter-5 search-20260619-01 CONSTRAINED diff-recon. ONE HYPOTHESIS KNOB: recon_sample_steps 28->40 (the DDIM reverse-step count T); val_n 214->120 is the BUDGET-SIZING mechanism (box 5), NOT a hypothesis variable. BASE = iter-4 BEST (eta=30.0, relax=1.0, every5/n_cg3/warmup5, T=28). TRAJECTORY (val=214 L277, 321px FOV, LD-FBP floor ~0.81): iter-1 T=25 SSIM 0.3937/hr0/PSNR14.31; iter-2 eta30->1 -> 0.2366 (REGRESSED, wrong lever); iter-3 relax1.0->0.3 -> 0.2377 (flat, wrong lever); iter-4 T25->28 -> 0.4784/PSNR16.89 (BEST). KEY SIGNAL the iter-4 author under-weighted: T25->T28 MOVED SSIM +0.085 (0.394->0.478) and PSNR +2.6dB (14.3->16.9) MONOTONICALLY -> T is the ONLY live lever and the 25-28 step DDIM schedule is too COARSE for the constrained hard-DC trajectory to converge; eta+relax are exhausted (both regressed when moved off iter-1s working point). The recon sits 0.48 vs the 0.81 FBP floor i.e. the coarse reverse schedule + every-5 hard-DC re-noising is destroying the FBP init faster than it refines it; MORE reverse steps = finer schedule = less per-step corruption. iter-4 was budget-pinned at T=28 (1162.5s=19.4min at val_n=214, the 20-min wall) so it could not push T further; I unlock the T test by sizing val_n to 120 evenly-spaced (protocol-sanctioned: metric evenly-spaces across the 214-slice volume when val_n<214). HYPOTHESIS: if the T25->T28 climb (+0.085 SSIM / +2.6 dB per +3 steps) continues, T=40 lifts SSIM to ~0.55-0.65 (a clear monotone continuation toward the floor). FALSIFIER: if SSIM stays <=0.50 (flat vs iter-4 0.478) at T=40, T has SATURATED -> the eta, relax AND T levers are ALL exhausted -> FILE THE DIFFUSION-PRIOR-MISMATCH VERDICT (Mayo v4 DDPM globally faithful but not conditionally faithful under DPS/DC, mirroring the breast-DDPM hr=0 structural verdict); constrained best stays iter-4 (SSIM 0.478, hr 0). BUDGET: cost linear in T x val_n. Per-slice-per-step constant = 0.193 s (iter-1 1019s/214/25=0.1904; iter-4 1162.5s/214/28=0.194). T=40 x val_n=120 = 40*120*0.193 = 926 s = 15.4 min < 20-min HARD wall (1800s in-solver backstop + 30-min --time further backstops). T=40 at full val_n=214 would be 1652s=27.5min (BLOWS the wall) -> val_n=120 is the budget mechanism that lets T climb. val=120 evenly-spaced L277, 321px detector-geometry FOV default (no fov=False).", "advice_for_others": "diffusion_recon_dcstep_constrained_mayo_v4-claude-agentic: recon_ckpt=/cluster/maier/Agent4CT/checkpoints/ddpm_mayo_constrained_v4.pt, recon_mode=dps, recon_sample_steps=40, recon_eta=30.0, recon_init=fbp, recon_eta_clamp=False, recon_dcstep_every=5, recon_dcstep_n_cg=3, recon_dcstep_warmup=5, recon_dcstep_relax=1.0, val_n=120, train_n=0, rationale=iter-5 search-20260619-01 CONSTRAINED diff-recon. ONE HYPOTHESIS KNOB: recon_sample_steps 28->40 (the DDIM reverse-step count T); val_n 214->120 is the BUDGET-SIZING mechanism (box 5), NOT a hypothesis variable. BASE = iter-4 BEST (eta=30.0, relax=1.0, every5/n_cg3/warmup5, T=28). TRAJECTORY (val=214 L277, 321px FOV, LD-FBP floor ~0.81): iter-1 T=25 SSIM 0.3937/hr0/PSNR14.31; iter-2 eta30->1 -> 0.2366 (REGRESSED, wrong lever); iter-3 relax1.0->0.3 -> 0.2377 (flat, wrong lever); iter-4 T25->28 -> 0.4784/PSNR16.89 (BEST). KEY SIGNAL the iter-4 author under-weighted: T25->T28 MOVED SSIM +0.085 (0.394->0.478) and PSNR +2.6dB (14.3->16.9) MONOTONICALLY -> T is the ONLY live lever and the 25-28 step DDIM schedule is too COARSE for the constrained hard-DC trajectory to converge; eta+relax are exhausted (both regressed when moved off iter-1s working point). The recon sits 0.48 vs the 0.81 FBP floor i.e. the coarse reverse schedule + every-5 hard-DC re-noising is destroying the FBP init faster than it refines it; MORE reverse steps = finer schedule = less per-step corruption. iter-4 was budget-pinned at T=28 (1162.5s=19.4min at val_n=214, the 20-min wall) so it could not push T further; I unlock the T test by sizing val_n to 120 evenly-spaced (protocol-sanctioned: metric evenly-spaces across the 214-slice volume when val_n<214). HYPOTHESIS: if the T25->T28 climb (+0.085 SSIM / +2.6 dB per +3 steps) continues, T=40 lifts SSIM to ~0.55-0.65 (a clear monotone continuation toward the floor). FALSIFIER: if SSIM stays <=0.50 (flat vs iter-4 0.478) at T=40, T has SATURATED -> the eta, relax AND T levers are ALL exhausted -> FILE THE DIFFUSION-PRIOR-MISMATCH VERDICT (Mayo v4 DDPM globally faithful but not conditionally faithful under DPS/DC, mirroring the breast-DDPM hr=0 structural verdict); constrained best stays iter-4 (SSIM 0.478, hr 0). BUDGET: cost linear in T x val_n. Per-slice-per-step constant = 0.193 s (iter-1 1019s/214/25=0.1904; iter-4 1162.5s/214/28=0.194). T=40 x val_n=120 = 40*120*0.193 = 926 s = 15.4 min < 20-min HARD wall (1800s in-solver backstop + 30-min --time further backstops). T=40 at full val_n=214 would be 1652s=27.5min (BLOWS the wall) -> val_n=120 is the budget mechanism that lets T climb. val=120 evenly-spaced L277, 321px detector-geometry FOV default (no fov=False).", "comparison_image": "runs/mayo-ldct-claude-agentic-diff-recon-dcstep-constrained-mayo-v4-search-20260619-01/iterations/iter-0005/comparison.png"}
