{"ts": "2026-06-21T17:26:38Z", "run_id": "mayo-ldct-claude-agentic-hammernik-vn-search-20260619-01", "iter": 10, "agent": "hammernik_vn-claude-agentic", "model": "claude-opus-4-8-1m", "change_class": "architecture", "status": "keep", "kept": true, "val_score": 0.8658958673477173, "headroom": 0.1832240165581741, "params_M": 0.004866, "train_n": 400, "rationale": "hammernik_vn-claude-agentic: vn_T=2, vn_n_filters=16, vn_kernel=11, vn_n_bumps=31, vn_x_range=1.0, vn_lambda_init=0.0023, vn_init=fbp, vn_dc_norm=True, vn_checkpoint=True, vn_normalize_filters=False, epochs=6, batch_size=2, lr=0.0005, grad_clip=1.0, train_n=579, val_n=214, max_train_s=1000, seed=42, rationale=hammernik_vn iter-10 (search-20260619-01, corrected 214-slice/321px-FOV metric). ONE KNOB (LAST untested DATA-COVERAGE lever at the working shallow depth): train_n 480 -> 579 (full train pool). BASE = iter-7 (BREAKOUT + run-BEST: vn_T=2, vn_n_filters=16, vn_lambda_init=0.0023, vn_normalize_filters=False, train_n=480, lr=5e-4, batch_size=2, vn_checkpoint=true, grad_clip=1.0, vn_dc_norm=true, vn_init=fbp). DEPTH SETTLED: iter-7 vn_T 5->2 BROKE OUT SSIM 0.86068 hr 0.154039 (#8); iter-8 vn_T 2->1 REGRESSED SSIM 0.84581 hr 0.11827 (single DC step under-powers); iter-6 vn_T 5->8 CRASHED SSIM 0.66729. vn_T=2 IS the depth optimum. KEEP vn_T=2. CAPACITY EXHAUSTED: iter-9 vn_n_filters 16->24 at vn_T=2 REGRESSED HARD SSIM 0.86068->0.79317 hr 0.154->0 -- capacity does NOT transfer to the shallow regime, 16 filters is the optimum at all depths. KEEP N_k=16. TRAJECTORY: iter-1 0.80528 (T=5,N16,hr0); iter-2 0.79195 (N 16->24 REGRESSED hr0); iter-3 0.76820 (lam^ hr0); iter-4 0.73363 (normalize T hr0); iter-5 0.80886 (train_n 200->480 +0.0036 hr0); iter-6 0.66729 (T 5->8 REGRESSED hr0); iter-7 0.86068 hr 0.154039 PSNR 35.53 elapsed 971.2s (T 5->2 BREAKOUT) <- BEST, current N16/train_n480; iter-8 0.84581 hr 0.11827 (T 2->1 REGRESSED); iter-9 0.79317 hr 0 elapsed 1143.7s (N 16->24 at T=2 REGRESSED). LIMITER / KEY INSIGHT: iter-9 falsifier explicitly flagged the next move -- train_n 480->579 (full pool) at vn_T=2 is the LAST untested data lever, never tried at the working shallow depth. WHY train_n over seed (from NUMBERS): train_n is the one structural data-coverage axis untested at vn_T=2 (mechanism-confirmed iter-5: hammernik_vn build_dataset = FIXED stratified subset of train_n/579, never full pool unless train_n=579), whereas a seed read is only campaign-precedent +-0.003-0.006 noise. At vn_T=5 train_n 200->480 gave +0.0036 (near-saturation) BUT that was the noisy over-unrolled regime; at the clean vn_T=2 denoiser-dominant depth the full 579-slice pool may give the 16-filter bank the final coverage to lift above the breakout. MECHANISM: train_n 480->579 = the net sees 100 percent of the 579-slice train pool (vs 83 percent) -> max data coverage for the learned regulariser/denoiser at the working shallow depth. HYPOTHESIS: with the full train pool at vn_T=2, val_ssim rises above the iter-7 BEST 0.86068 and hr clears 0.154039. FALSIFIER (terminal): if val_ssim <= 0.86068 / hr <= 0.154039 at train_n=579, the data-coverage lever is EXHAUSTED at the shallow depth (480 was already near-saturation), ALL levers (depth, capacity, DC-weight, filter-constraint, data-coverage) tested -> vn_T=2/N_k=16/train_n=480 is the FINAL hammernik_vn config; file the ceiling and drive remaining iters to DOCUMENT it toward iter-20. BUDGET (HARD 20-min/1200s train+score; sbatch --time=00:30:00): train_n 480->579 = +20.6 percent per-epoch; iter-7 ran 971.2s total at train_n=480/vn_T=2/N16, so max_train_s=1000 still BINDS the train wall (trips fewer epochs but past the ep3 convergence point -> fair converged comparison). val_n=214 kept. Total ~= 1000 (train wall) + ~160 (score 214 + figure) ~= 1160s, under the 1800s SLURM kill (>600s margin). MEMORY-SAFE: train_n changes ONLY the dataset size, NOT the per-step footprint -- identical to iter-7 (vn_T=2 x N_k=16, batch_size=2 + vn_checkpoint=true within the 16 GB RTX5000; far from the hammernik_2017 bs=4 OOM at 72s). grad_clip=1.0 + vn_dc_norm=true retained (VN-family NaN-skip stability; the 2304-view Mayo FBP adjoint overflows the backward otherwise).", "advice_for_others": "hammernik_vn-claude-agentic: vn_T=2, vn_n_filters=16, vn_kernel=11, vn_n_bumps=31, vn_x_range=1.0, vn_lambda_init=0.0023, vn_init=fbp, vn_dc_norm=True, vn_checkpoint=True, vn_normalize_filters=False, epochs=6, batch_size=2, lr=0.0005, grad_clip=1.0, train_n=579, val_n=214, max_train_s=1000, seed=42, rationale=hammernik_vn iter-10 (search-20260619-01, corrected 214-slice/321px-FOV metric). ONE KNOB (LAST untested DATA-COVERAGE lever at the working shallow depth): train_n 480 -> 579 (full train pool). BASE = iter-7 (BREAKOUT + run-BEST: vn_T=2, vn_n_filters=16, vn_lambda_init=0.0023, vn_normalize_filters=False, train_n=480, lr=5e-4, batch_size=2, vn_checkpoint=true, grad_clip=1.0, vn_dc_norm=true, vn_init=fbp). DEPTH SETTLED: iter-7 vn_T 5->2 BROKE OUT SSIM 0.86068 hr 0.154039 (#8); iter-8 vn_T 2->1 REGRESSED SSIM 0.84581 hr 0.11827 (single DC step under-powers); iter-6 vn_T 5->8 CRASHED SSIM 0.66729. vn_T=2 IS the depth optimum. KEEP vn_T=2. CAPACITY EXHAUSTED: iter-9 vn_n_filters 16->24 at vn_T=2 REGRESSED HARD SSIM 0.86068->0.79317 hr 0.154->0 -- capacity does NOT transfer to the shallow regime, 16 filters is the optimum at all depths. KEEP N_k=16. TRAJECTORY: iter-1 0.80528 (T=5,N16,hr0); iter-2 0.79195 (N 16->24 REGRESSED hr0); iter-3 0.76820 (lam^ hr0); iter-4 0.73363 (normalize T hr0); iter-5 0.80886 (train_n 200->480 +0.0036 hr0); iter-6 0.66729 (T 5->8 REGRESSED hr0); iter-7 0.86068 hr 0.154039 PSNR 35.53 elapsed 971.2s (T 5->2 BREAKOUT) <- BEST, current N16/train_n480; iter-8 0.84581 hr 0.11827 (T 2->1 REGRESSED); iter-9 0.79317 hr 0 elapsed 1143.7s (N 16->24 at T=2 REGRESSED). LIMITER / KEY INSIGHT: iter-9 falsifier explicitly flagged the next move -- train_n 480->579 (full pool) at vn_T=2 is the LAST untested data lever, never tried at the working shallow depth. WHY train_n over seed (from NUMBERS): train_n is the one structural data-coverage axis untested at vn_T=2 (mechanism-confirmed iter-5: hammernik_vn build_dataset = FIXED stratified subset of train_n/579, never full pool unless train_n=579), whereas a seed read is only campaign-precedent +-0.003-0.006 noise. At vn_T=5 train_n 200->480 gave +0.0036 (near-saturation) BUT that was the noisy over-unrolled regime; at the clean vn_T=2 denoiser-dominant depth the full 579-slice pool may give the 16-filter bank the final coverage to lift above the breakout. MECHANISM: train_n 480->579 = the net sees 100 percent of the 579-slice train pool (vs 83 percent) -> max data coverage for the learned regulariser/denoiser at the working shallow depth. HYPOTHESIS: with the full train pool at vn_T=2, val_ssim rises above the iter-7 BEST 0.86068 and hr clears 0.154039. FALSIFIER (terminal): if val_ssim <= 0.86068 / hr <= 0.154039 at train_n=579, the data-coverage lever is EXHAUSTED at the shallow depth (480 was already near-saturation), ALL levers (depth, capacity, DC-weight, filter-constraint, data-coverage) tested -> vn_T=2/N_k=16/train_n=480 is the FINAL hammernik_vn config; file the ceiling and drive remaining iters to DOCUMENT it toward iter-20. BUDGET (HARD 20-min/1200s train+score; sbatch --time=00:30:00): train_n 480->579 = +20.6 percent per-epoch; iter-7 ran 971.2s total at train_n=480/vn_T=2/N16, so max_train_s=1000 still BINDS the train wall (trips fewer epochs but past the ep3 convergence point -> fair converged comparison). val_n=214 kept. Total ~= 1000 (train wall) + ~160 (score 214 + figure) ~= 1160s, under the 1800s SLURM kill (>600s margin). MEMORY-SAFE: train_n changes ONLY the dataset size, NOT the per-step footprint -- identical to iter-7 (vn_T=2 x N_k=16, batch_size=2 + vn_checkpoint=true within the 16 GB RTX5000; far from the hammernik_2017 bs=4 OOM at 72s). grad_clip=1.0 + vn_dc_norm=true retained (VN-family NaN-skip stability; the 2304-view Mayo FBP adjoint overflows the backward otherwise).", "comparison_image": "runs/mayo-ldct-claude-agentic-hammernik-vn-search-20260619-01/iterations/iter-0010/comparison.png"}
{"ts": "2026-06-21T17:25:38Z", "run_id": "mayo-ldct-claude-agentic-tv-iterative-search-20260619-01", "iter": 10, "agent": "tv_iterative-claude-agentic", "model": "claude-opus-4-8-1m", "change_class": "architecture", "status": "keep", "kept": true, "val_score": 0.9256114959716797, "headroom": 0.20781201965288254, "params_M": 0.0, "train_n": 400, "rationale": "tv_iterative-claude-agentic: val_n=214, train_n=0, tv_lambda=0.001, tv_iterations=140, tv_lr=0.01, tv_clip_max=0.08, tv_decay=0.01, tv_optimizer=gd, tv_init=fbp, rationale=tv_iterative iter-10 (search-20260619-01, corrected 214-slice/321px-FOV metric). CLEAN DOCUMENTATION ITER toward iter-20: confirm the classical-TV FBP-ceiling. BASE_ITER=4 (the BEST family: clip 0.08, lambda 0.001, lr 0.01). ONE KNOB vs iter-4: tv_iterations 160->140 -- because iter-4 measured 1227.4s at 160 iters, OVER the 1200s HARD wall (metric-invalid by budget); 140 iters is the budget-PROVEN wall-safe count that already reproduced the ceiling at iter-8 (1063.7s, ~136s margin). The solver is DETERMINISTIC: NO training, NO seed axis, recon fully determined by (tv_lambda, tv_iterations, tv_lr, tv_clip_max); given an identical config the result is bit-identical. LEVER MAP -- all four live knobs in tv_reconstruction() MAPPED + EXHAUSTED: (1) tv_clip_max was THE lever (iter-1 0.05->iter-2 0.08 lifted hr 0.133->0.205 by un-truncating high-mu bone) but pushing to 0.10 in iter-9 went FLAT (0.2054) -- the 0.08 clamp already passes all real Mayo attenuation, lever un-binds above 0.08. (2) tv_lambda BRACKETED at optimum 0.001 -- up@0.003 (iter-3, 0.1366) and down@0.0005 (iter-6, 0.1582) BOTH regress. (3) tv_lr BRACKETED at 0.01 -- up-2x@0.02 (iter-5, 0.1873) overshoots, up-1.3x@0.013 (iter-7, 0.2082) flat. (4) tv_iterations: 120@918s(hr0.2054)/140@1064s(hr0.2078)/160@1227s(hr0.2085, OVER WALL) -- the +0.003 hr from 120->160 is within noise AND the 160 count is budget-illegal; the budget-safe band caps at ~0.208. There is GENUINELY no untried in-budget lever left that changes the deterministic result. HYPOTHESIS: hr ~= 0.208 (reproduce iter-8 0.2078 @140 iters within run-to-run noise), documenting ~0.208 hr / ~0.926 SSIM as the STRUCTURAL classical-TV FBP-ceiling on dense (2304-view) real Mayo LDCT. NUMERIC FALSIFIER: this solver is deterministic, so if hr deviates materially from the prior 140-iter result (|hr - 0.2078| >> run-noise, say > 0.005), that signals NON-DETERMINISM in the pipeline (GPU-nondeterministic reduction, FOV-mask/load drift) rather than a real recon change, and must be investigated -- NOT treated as a tuning gain. BUDGET: tv_iterations=140 is wall-safe (iter-8 measured 1063.7s, 89pct of 1200s, ~136s margin; cost model 30 + 140*7.48 = 1077s; at +10pct GPU-contention variance ~1182s, STILL under the HARD wall). val = ALL 214 L277 slices unchanged. sbatch --time=00:30:00 SLURM safety net above the 20-min metric-validity budget.", "advice_for_others": "tv_iterative-claude-agentic: val_n=214, train_n=0, tv_lambda=0.001, tv_iterations=140, tv_lr=0.01, tv_clip_max=0.08, tv_decay=0.01, tv_optimizer=gd, tv_init=fbp, rationale=tv_iterative iter-10 (search-20260619-01, corrected 214-slice/321px-FOV metric). CLEAN DOCUMENTATION ITER toward iter-20: confirm the classical-TV FBP-ceiling. BASE_ITER=4 (the BEST family: clip 0.08, lambda 0.001, lr 0.01). ONE KNOB vs iter-4: tv_iterations 160->140 -- because iter-4 measured 1227.4s at 160 iters, OVER the 1200s HARD wall (metric-invalid by budget); 140 iters is the budget-PROVEN wall-safe count that already reproduced the ceiling at iter-8 (1063.7s, ~136s margin). The solver is DETERMINISTIC: NO training, NO seed axis, recon fully determined by (tv_lambda, tv_iterations, tv_lr, tv_clip_max); given an identical config the result is bit-identical. LEVER MAP -- all four live knobs in tv_reconstruction() MAPPED + EXHAUSTED: (1) tv_clip_max was THE lever (iter-1 0.05->iter-2 0.08 lifted hr 0.133->0.205 by un-truncating high-mu bone) but pushing to 0.10 in iter-9 went FLAT (0.2054) -- the 0.08 clamp already passes all real Mayo attenuation, lever un-binds above 0.08. (2) tv_lambda BRACKETED at optimum 0.001 -- up@0.003 (iter-3, 0.1366) and down@0.0005 (iter-6, 0.1582) BOTH regress. (3) tv_lr BRACKETED at 0.01 -- up-2x@0.02 (iter-5, 0.1873) overshoots, up-1.3x@0.013 (iter-7, 0.2082) flat. (4) tv_iterations: 120@918s(hr0.2054)/140@1064s(hr0.2078)/160@1227s(hr0.2085, OVER WALL) -- the +0.003 hr from 120->160 is within noise AND the 160 count is budget-illegal; the budget-safe band caps at ~0.208. There is GENUINELY no untried in-budget lever left that changes the deterministic result. HYPOTHESIS: hr ~= 0.208 (reproduce iter-8 0.2078 @140 iters within run-to-run noise), documenting ~0.208 hr / ~0.926 SSIM as the STRUCTURAL classical-TV FBP-ceiling on dense (2304-view) real Mayo LDCT. NUMERIC FALSIFIER: this solver is deterministic, so if hr deviates materially from the prior 140-iter result (|hr - 0.2078| >> run-noise, say > 0.005), that signals NON-DETERMINISM in the pipeline (GPU-nondeterministic reduction, FOV-mask/load drift) rather than a real recon change, and must be investigated -- NOT treated as a tuning gain. BUDGET: tv_iterations=140 is wall-safe (iter-8 measured 1063.7s, 89pct of 1200s, ~136s margin; cost model 30 + 140*7.48 = 1077s; at +10pct GPU-contention variance ~1182s, STILL under the HARD wall). val = ALL 214 L277 slices unchanged. sbatch --time=00:30:00 SLURM safety net above the 20-min metric-validity budget.", "comparison_image": "runs/mayo-ldct-claude-agentic-tv-iterative-search-20260619-01/iterations/iter-0010/comparison.png"}
{"ts": "2026-06-21T17:15:40Z", "run_id": "mayo-ldct-claude-agentic-wu-2015-trainable-search-20260619-01", "iter": 10, "agent": "wu_2015_trainable-claude-agentic", "model": "claude-opus-4-8-1m", "change_class": "architecture", "status": "keep", "kept": true, "val_score": 0.8229125738143921, "headroom": 0.0966342866716895, "params_M": 8e-06, "train_n": 400, "rationale": "wu_2015_trainable-claude-agentic: wu_n_bands=4, wu_n_outer=1, lr=0.003, epochs=6, batch_size=1, val_chunk=1, train_n=200, val_n=214, grad_clip=1.0, lambda_neg=1.0, weight_decay=0.0, loss_base=mse, seed=123, rationale=wu_2015_trainable iter-10 (search-20260619-01, corrected 214-slice/321px-FOV metric). SEED NOISE-FLOOR READ at the lr-0.003 best (genuinely-untried axis). SIX-BOX (NUMBERS). (1) TRAJECTORY iter->hr: 1(lr0.01,ep6,seed42,8params,335s)->0.0508, 2(ep18@lr0.01)->0.0337 (epochs INERT, FELL), 3(n_bands4->6)->0.0 (bands REGRESSED), 4(n_outer1->2)->0.0 (SSIM 0.6459 COLLAPSED), 5(train_n200->480,ep3)->0.0411 (data-coverage FAILED), 6(lr0.01->0.003,ep6)->0.0966 BEST (SSIM 0.8232, PSNR 34.96, RMSE 8.93e-4, 334.8s, 8 params), 7(lr0.001,ep6)->0.0668 (UNDER-CONVERGED), 8(lr0.001,ep18)->0.0862 (lr0.001 cannot match 0.003 even at 3x steps), 9(lr0.002,ep6)->0.0952 (shallow high-side shoulder, just below the 0.003 apex). Base copied = iter-6 (highest hr 0.0966). seed=42 has been STATIC across ALL 9 iters -- CONFIRMED unvaried in iter-1 rationale + iter-6/iter-9 cfg_full. (2) LIMITER: 8-param FBP-family ceiling ~hr0.097. The lr axis is now FULLY MAPPED (single-peak basin: 0.01->0.0508, 0.003->0.0966 PEAK, 0.002->0.0952, 0.001->0.0668/0.0862 -- both shoulders lower). FIVE config axes falsified: lr (peak found), epochs (inert), bands (regressed), outer-depth (collapsed), data-coverage (failed). The ONE genuinely-untried in-budget axis is SEED -- the live noise axis. The campaign just found the top-5 leaders are SEED-SENSITIVE (+-0.003-0.006); a clean seed read at the lr0.003 best characterizes whether 0.0966 is a stable apex or seed-lucky. (3) ONE KNOB: seed 42 -> 123 (the campaign-standard seed-noise probe). I REVERT to the iter-6 BEST config (wu_n_bands=4, wu_n_outer=1, lr0.003, ep6, train_n=200) -- NOT the regressed/failed iters -- and change ONLY seed. PARAM COUNT UNCHANGED at 8 (wu_n_bands+2+2*wu_n_outer = 4+2+2 = 8). (4) HYPOTHESIS: if the lr0.003 best 0.0966 is a STABLE apex, seed42->123 lands within the campaign noise band (|dhr| <= ~0.006) of 0.0966, i.e. hr in [0.090, 0.103]. PREDICTED iter-10 hr ~0.094-0.100 (centered on the iter-6 best, within seed noise). NUMERIC FALSIFIER: if hr is WITHIN noise of 0.0966 (|dhr|<=0.006) => 0.0966 is STABLE, the lr0.003 apex is real and not seed-lucky -- file the terminal 8-param FBP-family ceiling verdict (caps hr~0.097 on real-helical Mayo, far below the dual-domain U-Net families hr~0.27). If hr > 0.10 (above the noise band) => the apex was SEED-SENSITIVE / seed42 was unlucky, and a seed sweep is the live lever to push the ceiling. (5) BUDGET (HARD 1200s/20-min train+score): IDENTICAL envelope to iter-6 (train_n=200, ep6, n_outer=1 = 334.8s); seed is a FREE knob with ZERO runtime cost. Worst-case ~335s << 1200s and the 1800s SLURM kill; val FIGURE outside budget. val = ALL 214 L277 slices (do NOT reduce); grad_clip=1.0 (MANDATORY Mayo guard -- 2304-view FBP adjoint overflows otherwise); bs=1 + val_chunk=1 forced by per-sample-ps; staged_canonical v3 mayo_ldct_fitted; per-sample-ps FBP + per-sample model.proj/model.dense_proj swap; bg_target=truth; 321px detector-geometry FOV default (NO fov override); wu_n_outer=1 (MANDATORY). (6) no control return.", "advice_for_others": "wu_2015_trainable-claude-agentic: wu_n_bands=4, wu_n_outer=1, lr=0.003, epochs=6, batch_size=1, val_chunk=1, train_n=200, val_n=214, grad_clip=1.0, lambda_neg=1.0, weight_decay=0.0, loss_base=mse, seed=123, rationale=wu_2015_trainable iter-10 (search-20260619-01, corrected 214-slice/321px-FOV metric). SEED NOISE-FLOOR READ at the lr-0.003 best (genuinely-untried axis). SIX-BOX (NUMBERS). (1) TRAJECTORY iter->hr: 1(lr0.01,ep6,seed42,8params,335s)->0.0508, 2(ep18@lr0.01)->0.0337 (epochs INERT, FELL), 3(n_bands4->6)->0.0 (bands REGRESSED), 4(n_outer1->2)->0.0 (SSIM 0.6459 COLLAPSED), 5(train_n200->480,ep3)->0.0411 (data-coverage FAILED), 6(lr0.01->0.003,ep6)->0.0966 BEST (SSIM 0.8232, PSNR 34.96, RMSE 8.93e-4, 334.8s, 8 params), 7(lr0.001,ep6)->0.0668 (UNDER-CONVERGED), 8(lr0.001,ep18)->0.0862 (lr0.001 cannot match 0.003 even at 3x steps), 9(lr0.002,ep6)->0.0952 (shallow high-side shoulder, just below the 0.003 apex). Base copied = iter-6 (highest hr 0.0966). seed=42 has been STATIC across ALL 9 iters -- CONFIRMED unvaried in iter-1 rationale + iter-6/iter-9 cfg_full. (2) LIMITER: 8-param FBP-family ceiling ~hr0.097. The lr axis is now FULLY MAPPED (single-peak basin: 0.01->0.0508, 0.003->0.0966 PEAK, 0.002->0.0952, 0.001->0.0668/0.0862 -- both shoulders lower). FIVE config axes falsified: lr (peak found), epochs (inert), bands (regressed), outer-depth (collapsed), data-coverage (failed). The ONE genuinely-untried in-budget axis is SEED -- the live noise axis. The campaign just found the top-5 leaders are SEED-SENSITIVE (+-0.003-0.006); a clean seed read at the lr0.003 best characterizes whether 0.0966 is a stable apex or seed-lucky. (3) ONE KNOB: seed 42 -> 123 (the campaign-standard seed-noise probe). I REVERT to the iter-6 BEST config (wu_n_bands=4, wu_n_outer=1, lr0.003, ep6, train_n=200) -- NOT the regressed/failed iters -- and change ONLY seed. PARAM COUNT UNCHANGED at 8 (wu_n_bands+2+2*wu_n_outer = 4+2+2 = 8). (4) HYPOTHESIS: if the lr0.003 best 0.0966 is a STABLE apex, seed42->123 lands within the campaign noise band (|dhr| <= ~0.006) of 0.0966, i.e. hr in [0.090, 0.103]. PREDICTED iter-10 hr ~0.094-0.100 (centered on the iter-6 best, within seed noise). NUMERIC FALSIFIER: if hr is WITHIN noise of 0.0966 (|dhr|<=0.006) => 0.0966 is STABLE, the lr0.003 apex is real and not seed-lucky -- file the terminal 8-param FBP-family ceiling verdict (caps hr~0.097 on real-helical Mayo, far below the dual-domain U-Net families hr~0.27). If hr > 0.10 (above the noise band) => the apex was SEED-SENSITIVE / seed42 was unlucky, and a seed sweep is the live lever to push the ceiling. (5) BUDGET (HARD 1200s/20-min train+score): IDENTICAL envelope to iter-6 (train_n=200, ep6, n_outer=1 = 334.8s); seed is a FREE knob with ZERO runtime cost. Worst-case ~335s << 1200s and the 1800s SLURM kill; val FIGURE outside budget. val = ALL 214 L277 slices (do NOT reduce); grad_clip=1.0 (MANDATORY Mayo guard -- 2304-view FBP adjoint overflows otherwise); bs=1 + val_chunk=1 forced by per-sample-ps; staged_canonical v3 mayo_ldct_fitted; per-sample-ps FBP + per-sample model.proj/model.dense_proj swap; bg_target=truth; 321px detector-geometry FOV default (NO fov override); wu_n_outer=1 (MANDATORY). (6) no control return.", "comparison_image": "runs/mayo-ldct-claude-agentic-wu-2015-trainable-search-20260619-01/iterations/iter-0010/comparison.png"}
