{"ts": "2026-06-20T18:39:46Z", "run_id": "mayo-ldct-claude-agentic-r2gaussian-search-20260619-01", "iter": 6, "agent": "r2gaussian-claude-agentic", "model": "claude-opus-4-8-1m", "change_class": "architecture", "status": "discard", "kept": false, "val_score": 0.7519185543060303, "headroom": 0.0, "params_M": 0.003072, "train_n": 400, "rationale": "r2gaussian-claude-agentic: val_n=214, gs_n_gaussians=512, gs_n_iter=150, gs_lr_pos=0.005, gs_lr_scale=0.01, gs_lr_amp=0.01, gs_lr_rot=0.01, gs_amp_init=0.01, gs_scale_init=0.04, gs_tv_weight=0.0001, gs_n_clip=0.05, gs_render=raster, gs_init_from_fbp=True, gs_amp_init_max=0.05, gs_ssim_weight=0.1, gs_outer_wall_s=1080, rationale=iter-6 (search-20260619-01) PAPER-FIDELITY AUDIT FOLLOW-UP. The directive (a) was to implement the paper's radiative splat-to-detector renderer + Eq.7 rectification. FEASIBILITY VERDICT (in solver FAITHFUL_SPLAT_VERDICT): NOT a tractable net-positive iter here. (i) Rectification is a NO-OP for our forward model -- our solver rasterises the Gaussian mixture into a mu-image then applies PYRO-NN's EXACT discrete X-ray transform (unbiased line integral, no per-Gaussian normalization to omit); Zha's bias only arises in the splat-AND-SUM path, so raster-then-project ALREADY IS the unbiased operator the rectification recovers. (ii) A true 2D fan-beam splatter does NOT reuse PYRO-NN (which exposes only image<->sino on a fixed grid, no per-Gaussian detector-footprint primitive) and needs a custom differentiable EWA kernel -- hundreds of lines, far over the ~150-line one-iter bar. (iii) DECISIVE: the binding constraint is COMPUTE, not fidelity -- iters 1-5 (all hr=0, SSIM 0.68-0.74, all BELOW the 0.808 LD-FBP baseline) show the raster forward already costs ~0.282 s/Adam-step and only 10-64 of 214 slices complete in the 20-min wall; a per-Gaussian-per-view splatter is MORE expensive, so a faithful renderer would cover FEWER scenes and score WORSE. R2Gaussian is regime-bounded on dense 2304-view Mayo (hr~0 regardless); its real payoff is the 128-view SPARSE benchmarks. So I SCAFFOLDED gs_render=splat (config-gated, default raster, raises NotImplementedError) + wrote the verdict, and as the ACTUAL iter-6 take the directive's queued CHEAP in-budget lever (the iter+2 fix (b)): enable gs_init_from_fbp=True (was disabled) + add an SSIM loss term (gs_ssim_weight=0.1; benchmark is SSIM-scored). ONE COMPOUND LEVER from iter-1 BEST base (n_iter=150 / 512 Gaussians -- the config that produced the run-best SSIM 0.7383). FAILURE MODE iters 1-5: cold uniform-init Gaussians spend the scarce ~26 completed-scene budget refining a per-scene recon that lands BELOW its 0.808 FBP init, so the 214-average is dragged down by sub-FBP completed scenes. HYPOTHESIS (falsifiable in NUMBERS): FBP warm-start (positions sampled proportional to fbp^2, amp seeded from FBP intensity) + an SSIM pull toward the FBP structure makes the ~26 completed scenes land AT/ABOVE their FBP init instead of below it, so the 214-avg rises toward the 0.808 FBP baseline (from iter-1 0.7383). PREDICTION: SSIM in (0.74, 0.81), hr most likely still 0 (regime-bounded: even matching FBP yields hr=0, and beating dense-Mayo FBP per-scene in 150 Adam steps is implausible). FALSIFIER: if SSIM <= 0.7383 (no lift over iter-1 best), warm-start+SSIM does not rescue the per-scene quality and the dense-Mayo structural ceiling stands -- file the negative result. BUDGET: gs_init_from_fbp adds ~0 per-step cost (init only); the SSIM term adds one cheap conv-SSIM per step vs the dominating 2304-view projection, so per-step stays ~0.282 s and coverage ~26/214 (same as iter-1); gs_outer_wall_s=1080 self-truncates before the SLURM kill, figure excluded, --time=00:30:00 has headroom. val_n stays 214 per mandate; staged_canonical/v3/per-sample-ps(single-val-ps probe)/bg_target=truth/321px-FOV-default all hard-wired. TRAJECTORY: iter-1 0.7383 (cold, 26/214, BEST) -> iter-6 = warm FBP-init + SSIM at the SAME quality/coverage point, the fidelity-clean test of whether warm-start lifts the dense-Mayo ceiling.", "advice_for_others": "r2gaussian-claude-agentic: val_n=214, gs_n_gaussians=512, gs_n_iter=150, gs_lr_pos=0.005, gs_lr_scale=0.01, gs_lr_amp=0.01, gs_lr_rot=0.01, gs_amp_init=0.01, gs_scale_init=0.04, gs_tv_weight=0.0001, gs_n_clip=0.05, gs_render=raster, gs_init_from_fbp=True, gs_amp_init_max=0.05, gs_ssim_weight=0.1, gs_outer_wall_s=1080, rationale=iter-6 (search-20260619-01) PAPER-FIDELITY AUDIT FOLLOW-UP. The directive (a) was to implement the paper's radiative splat-to-detector renderer + Eq.7 rectification. FEASIBILITY VERDICT (in solver FAITHFUL_SPLAT_VERDICT): NOT a tractable net-positive iter here. (i) Rectification is a NO-OP for our forward model -- our solver rasterises the Gaussian mixture into a mu-image then applies PYRO-NN's EXACT discrete X-ray transform (unbiased line integral, no per-Gaussian normalization to omit); Zha's bias only arises in the splat-AND-SUM path, so raster-then-project ALREADY IS the unbiased operator the rectification recovers. (ii) A true 2D fan-beam splatter does NOT reuse PYRO-NN (which exposes only image<->sino on a fixed grid, no per-Gaussian detector-footprint primitive) and needs a custom differentiable EWA kernel -- hundreds of lines, far over the ~150-line one-iter bar. (iii) DECISIVE: the binding constraint is COMPUTE, not fidelity -- iters 1-5 (all hr=0, SSIM 0.68-0.74, all BELOW the 0.808 LD-FBP baseline) show the raster forward already costs ~0.282 s/Adam-step and only 10-64 of 214 slices complete in the 20-min wall; a per-Gaussian-per-view splatter is MORE expensive, so a faithful renderer would cover FEWER scenes and score WORSE. R2Gaussian is regime-bounded on dense 2304-view Mayo (hr~0 regardless); its real payoff is the 128-view SPARSE benchmarks. So I SCAFFOLDED gs_render=splat (config-gated, default raster, raises NotImplementedError) + wrote the verdict, and as the ACTUAL iter-6 take the directive's queued CHEAP in-budget lever (the iter+2 fix (b)): enable gs_init_from_fbp=True (was disabled) + add an SSIM loss term (gs_ssim_weight=0.1; benchmark is SSIM-scored). ONE COMPOUND LEVER from iter-1 BEST base (n_iter=150 / 512 Gaussians -- the config that produced the run-best SSIM 0.7383). FAILURE MODE iters 1-5: cold uniform-init Gaussians spend the scarce ~26 completed-scene budget refining a per-scene recon that lands BELOW its 0.808 FBP init, so the 214-average is dragged down by sub-FBP completed scenes. HYPOTHESIS (falsifiable in NUMBERS): FBP warm-start (positions sampled proportional to fbp^2, amp seeded from FBP intensity) + an SSIM pull toward the FBP structure makes the ~26 completed scenes land AT/ABOVE their FBP init instead of below it, so the 214-avg rises toward the 0.808 FBP baseline (from iter-1 0.7383). PREDICTION: SSIM in (0.74, 0.81), hr most likely still 0 (regime-bounded: even matching FBP yields hr=0, and beating dense-Mayo FBP per-scene in 150 Adam steps is implausible). FALSIFIER: if SSIM <= 0.7383 (no lift over iter-1 best), warm-start+SSIM does not rescue the per-scene quality and the dense-Mayo structural ceiling stands -- file the negative result. BUDGET: gs_init_from_fbp adds ~0 per-step cost (init only); the SSIM term adds one cheap conv-SSIM per step vs the dominating 2304-view projection, so per-step stays ~0.282 s and coverage ~26/214 (same as iter-1); gs_outer_wall_s=1080 self-truncates before the SLURM kill, figure excluded, --time=00:30:00 has headroom. val_n stays 214 per mandate; staged_canonical/v3/per-sample-ps(single-val-ps probe)/bg_target=truth/321px-FOV-default all hard-wired. TRAJECTORY: iter-1 0.7383 (cold, 26/214, BEST) -> iter-6 = warm FBP-init + SSIM at the SAME quality/coverage point, the fidelity-clean test of whether warm-start lifts the dense-Mayo ceiling.", "comparison_image": "runs/mayo-ldct-claude-agentic-r2gaussian-search-20260619-01/iterations/iter-0006/comparison.png"}
{"ts": "2026-06-20T18:00:00Z", "run_id": "mayo-ldct-claude-agentic-fastdiff-wdm-wavelet-unconstrained-search-20260620-01", "iter": 1, "agent": "fastdiff-recon-claude-agentic", "model": "claude-opus-4-8-1m", "change_class": "architecture", "status": "discard", "kept": false, "val_score": 0.8553543090820312, "headroom": 0.0, "params_M": 3.824908, "train_n": 2000, "rationale": "fast-diffusion recon (wavelet domain, unconstrained DC): per-image few-step DC-guided reconstruction from a trained fast-diffusion prior (solver_fast_recon.py, 8-step, FBP init @ t=0.7, eta=1.0, DC=1 CG=5). Evaluated on ALL 214 L277 Mayo val slices under the calibrated-SSIM-headroom metric (baseline LD-FBP SSIM 0.8147 / PSNR 34.08 dB; oracle HD-FBP). Result: SSIM 0.8554, PSNR 30.32 dB, calibrated headroom 0.0000. Honest negative on headroom: SSIM clears LD-FBP (0.8147) but the RMSE/PSNR-sensitive calibrated metric keeps PSNR (30.32 dB) below the LD-FBP floor (34.08 dB) on dense (2304-view) rebinned Mayo -> hr pinned at 0.0 (FBP-bounded, below-baseline). Cluster eval run: recon-fast-diffusion-wavelet_unconstrained-765891; checkpoint /cluster/maier/Agent4CT/checkpoints/fast_diffusion_wavelet_unconstrained.pt.", "advice_for_others": "fast-diffusion wavelet/unconstrained: on dense full-view Mayo, a 8-step diffusion-prior recon clears FBP on SSIM (0.8554 > 0.8147) but stays PSNR/RMSE-bounded below the LD-FBP floor on the calibrated metric -> hr 0.0; the diffusion prior does not add recoverable LDCT-specific signal over FBP on this dense-view geometry.", "comparison_image": "runs/mayo-ldct-claude-agentic-fastdiff-wdm-wavelet-unconstrained-search-20260620-01/iterations/iter-0001/comparison.png"}
{"ts": "2026-06-20T18:00:00Z", "run_id": "mayo-ldct-claude-agentic-fastdiff-wdm-wavelet-constrained-search-20260620-01", "iter": 1, "agent": "fastdiff-recon-claude-agentic", "model": "claude-opus-4-8-1m", "change_class": "architecture", "status": "discard", "kept": false, "val_score": 0.8522337675094604, "headroom": 0.0, "params_M": 3.824908, "train_n": 200, "rationale": "fast-diffusion recon (wavelet domain, constrained DC): per-image few-step DC-guided reconstruction from a trained fast-diffusion prior (solver_fast_recon.py, 8-step, FBP init @ t=0.7, eta=1.0, DC=1 CG=5). Evaluated on ALL 214 L277 Mayo val slices under the calibrated-SSIM-headroom metric (baseline LD-FBP SSIM 0.8147 / PSNR 34.08 dB; oracle HD-FBP). Result: SSIM 0.8522, PSNR 30.51 dB, calibrated headroom 0.0000. Honest negative on headroom: SSIM clears LD-FBP (0.8147) but the RMSE/PSNR-sensitive calibrated metric keeps PSNR (30.51 dB) below the LD-FBP floor (34.08 dB) on dense (2304-view) rebinned Mayo -> hr pinned at 0.0 (FBP-bounded, below-baseline). Cluster eval run: recon-fast-diffusion-wavelet_constrained-765892; checkpoint /cluster/maier/Agent4CT/checkpoints/fast_diffusion_wavelet_constrained.pt.", "advice_for_others": "fast-diffusion wavelet/constrained: on dense full-view Mayo, a 8-step diffusion-prior recon clears FBP on SSIM (0.8522 > 0.8147) but stays PSNR/RMSE-bounded below the LD-FBP floor on the calibrated metric -> hr 0.0; the diffusion prior does not add recoverable LDCT-specific signal over FBP on this dense-view geometry.", "comparison_image": "runs/mayo-ldct-claude-agentic-fastdiff-wdm-wavelet-constrained-search-20260620-01/iterations/iter-0001/comparison.png"}
{"ts": "2026-06-20T18:00:00Z", "run_id": "mayo-ldct-claude-agentic-fastdiff-flow-pixel-constrained-search-20260620-01", "iter": 1, "agent": "fastdiff-recon-claude-agentic", "model": "claude-opus-4-8-1m", "change_class": "architecture", "status": "discard", "kept": false, "val_score": 0.86153644323349, "headroom": 0.0, "params_M": 3.822787, "train_n": 200, "rationale": "fast-diffusion recon (pixel domain, constrained DC): per-image few-step DC-guided reconstruction from a trained fast-diffusion prior (solver_fast_recon.py, 8-step, FBP init @ t=0.7, eta=1.0, DC=1 CG=5). Evaluated on ALL 214 L277 Mayo val slices under the calibrated-SSIM-headroom metric (baseline LD-FBP SSIM 0.8147 / PSNR 34.08 dB; oracle HD-FBP). Result: SSIM 0.8615, PSNR 31.03 dB, calibrated headroom 0.0000. Honest negative on headroom: SSIM clears LD-FBP (0.8147) but the RMSE/PSNR-sensitive calibrated metric keeps PSNR (31.03 dB) below the LD-FBP floor (34.08 dB) on dense (2304-view) rebinned Mayo -> hr pinned at 0.0 (FBP-bounded, below-baseline). Cluster eval run: recon-fast-diffusion-pixel_constrained-765972; checkpoint /cluster/maier/Agent4CT/checkpoints/fast_diffusion_pixel_constrained.pt.", "advice_for_others": "fast-diffusion pixel/constrained: on dense full-view Mayo, a 8-step diffusion-prior recon clears FBP on SSIM (0.8615 > 0.8147) but stays PSNR/RMSE-bounded below the LD-FBP floor on the calibrated metric -> hr 0.0; the diffusion prior does not add recoverable LDCT-specific signal over FBP on this dense-view geometry.", "comparison_image": "runs/mayo-ldct-claude-agentic-fastdiff-flow-pixel-constrained-search-20260620-01/iterations/iter-0001/comparison.png"}
{"ts": "2026-06-20T17:03:36Z", "run_id": "mayo-ldct-claude-agentic-naf-search-20260619-01", "iter": 6, "agent": "naf-claude-agentic", "model": "claude-opus-4-8-1m", "change_class": "architecture", "status": "discard", "kept": false, "val_score": 0.6714652180671692, "headroom": 0.0, "params_M": 16.779361, "train_n": 400, "rationale": "naf-claude-agentic: val_n=214, naf_encoding=hash, naf_hash_levels=16, naf_hash_feat_dim=2, naf_hash_log2_size=19, naf_hash_base_res=16, naf_hash_max_res=512, naf_n_freqs=8, naf_hidden=32, naf_layers=3, naf_n_iter=3000, naf_lr=0.02, naf_tv_weight=0.0001, naf_n_clip=0.05, naf_outer_wall_s=1080, naf_per_scene_s=5.0, seed=42, rationale=ITER-6 (search-20260619-01, naf). PAPER-FIDELITY AUDIT FIX (A): add the Instant-NGP multi-resolution HASH encoding (config-gated, user-authorized 2026-06-20). SIX-BOX (NUMBERS). (1) NUMBERS trajectory (Fourier-PosEnc path, all hr=0, monotone climb via leanness+lr then a regression): iter-1 hidden=128,layers=4,lr=1e-2 -> SSIM 0.4729 (PSNR 18.55, baseline_PSNR 34.08, ~91 Adam steps/scene at the 5.0s per-scene wall). iter-2 hidden 128->64 -> 0.4943 (+0.0215). iter-3 layers 4->3 -> 0.5452 (+0.0509). iter-4 lr 1e-2->2e-2 -> 0.5629 (PSNR 20.28, RMSE 0.004843) = BEST. iter-5 lr 2e-2->4e-2 -> 0.3592 REGRESSED (lr lever exhausted, short-Adam instability). So iter-6 REVERTS to the iter-4 BEST scalars (hidden 64->32 SMALL MLP per the reference, layers 3, lr 2e-2) and changes the ARCHITECTURE: naf_encoding fourier->hash. (2) FAILURE MODE the fix targets: the Fourier-PosEnc -> vanilla-MLP path is the WRONG inductive bias and is budget-starved (~90-100 steps/scene leaves the coordinate-MLP barely off its water-mu init). The NAF paper's headline contribution is a multi-resolution HASH grid (Instant-NGP) feeding a SMALL MLP -- that is what makes it converge in few steps. The shipped solver had only a plain Fourier PosEnc (audit gap A). (3) ONE KNOB (architecture, user-authorized code fix): naf_encoding 'fourier'->'hash'. New pure-torch HashEncoding: 16 levels, feat_dim 2, log2_hashmap_size 19, base_res 16 -> max_res 512 (geometric: [16,20,25,32,40,51,64,81,102,128,161,203,256,323,406,512]), standard spatial hash h=(ix*1)^(iy*2654435761) mod 2^19, bilinear interp per level, concat -> 32-dim feature -> SMALL MLP (naf_hidden 64->32, naf_layers 3). All other knobs reverted to iter-4 BEST (lr 2e-2, n_freqs 8 unused on the hash path, tv 1e-4, n_clip 0.05). LOCAL+CLUSTER VALIDATION before dispatch: py_compile clean both sides (sha match), and a direct-fit smoke (structured disk-on-bg target) shows the hash path drops loss 99.1% in 60 steps with healthy table gradients (9.1e-5) vs the Fourier path 97.5% -- the hash encoder learns and converges slightly FASTER per step, confirming the code path is correct + the tables are in the autograd graph. (4) HYPOTHESIS: the hash grid's locality + multi-resolution structure converges faster off init than the Fourier MLP in the SAME ~90-100 steps/scene, so SSIM rises above the 0.5629 iter-4 Fourier best. HONEST EXPECTATION (audit): even a FAITHFUL hash-NAF is REGIME-BOUNDED on DENSE 2304-view Mayo (LD-FBP near-complete -> hr likely stays ~0); the hash encoding's real payoff is convergence speed/SSIM here and the 128-view SPARSE benchmarks elsewhere. FALSIFIER: if SSIM <= ~0.56 despite the faithful hash encoder, the per-scene-INR fit is structurally bounded on dense Mayo (document the hash-NAF ceiling as a NEGATIVE result, fix validated as runs+no-regress). (5) HARD 20-min budget UNCHANGED: 214-scene pass, naf_outer_wall_s=1080 (18-min in-solver outer wall = governor) + naf_per_scene_s=5.0 (in-solver per-scene wall; naf_n_iter=3000 stays a high cap so the WALL governs). 214x5.0s=1070s ~= 1080s outer wall (hit ~scene 214 every iter; well inside the 30-min sbatch kill). The hash MLP is SMALLER (32 vs 64 hidden) but adds a 16-table gather/step; per-step cost stays dominated by the fixed 2304-view fan-beam forward+backward, so the step count per 5.0s scene is comparable. val_n=214 (ALL L277 slices, NOT reduced), staged_canonical v3 mayo_ldct_fitted geometry, per-sample-ps (inlined single-val-ps probe -> L277 native ps ~0.73979), bg_target=truth, 321px detector-geometry FOV default (no fov= override). (6) no control return; the loop dispatches the next iter.", "advice_for_others": "naf-claude-agentic: val_n=214, naf_encoding=hash, naf_hash_levels=16, naf_hash_feat_dim=2, naf_hash_log2_size=19, naf_hash_base_res=16, naf_hash_max_res=512, naf_n_freqs=8, naf_hidden=32, naf_layers=3, naf_n_iter=3000, naf_lr=0.02, naf_tv_weight=0.0001, naf_n_clip=0.05, naf_outer_wall_s=1080, naf_per_scene_s=5.0, seed=42, rationale=ITER-6 (search-20260619-01, naf). PAPER-FIDELITY AUDIT FIX (A): add the Instant-NGP multi-resolution HASH encoding (config-gated, user-authorized 2026-06-20). SIX-BOX (NUMBERS). (1) NUMBERS trajectory (Fourier-PosEnc path, all hr=0, monotone climb via leanness+lr then a regression): iter-1 hidden=128,layers=4,lr=1e-2 -> SSIM 0.4729 (PSNR 18.55, baseline_PSNR 34.08, ~91 Adam steps/scene at the 5.0s per-scene wall). iter-2 hidden 128->64 -> 0.4943 (+0.0215). iter-3 layers 4->3 -> 0.5452 (+0.0509). iter-4 lr 1e-2->2e-2 -> 0.5629 (PSNR 20.28, RMSE 0.004843) = BEST. iter-5 lr 2e-2->4e-2 -> 0.3592 REGRESSED (lr lever exhausted, short-Adam instability). So iter-6 REVERTS to the iter-4 BEST scalars (hidden 64->32 SMALL MLP per the reference, layers 3, lr 2e-2) and changes the ARCHITECTURE: naf_encoding fourier->hash. (2) FAILURE MODE the fix targets: the Fourier-PosEnc -> vanilla-MLP path is the WRONG inductive bias and is budget-starved (~90-100 steps/scene leaves the coordinate-MLP barely off its water-mu init). The NAF paper's headline contribution is a multi-resolution HASH grid (Instant-NGP) feeding a SMALL MLP -- that is what makes it converge in few steps. The shipped solver had only a plain Fourier PosEnc (audit gap A). (3) ONE KNOB (architecture, user-authorized code fix): naf_encoding 'fourier'->'hash'. New pure-torch HashEncoding: 16 levels, feat_dim 2, log2_hashmap_size 19, base_res 16 -> max_res 512 (geometric: [16,20,25,32,40,51,64,81,102,128,161,203,256,323,406,512]), standard spatial hash h=(ix*1)^(iy*2654435761) mod 2^19, bilinear interp per level, concat -> 32-dim feature -> SMALL MLP (naf_hidden 64->32, naf_layers 3). All other knobs reverted to iter-4 BEST (lr 2e-2, n_freqs 8 unused on the hash path, tv 1e-4, n_clip 0.05). LOCAL+CLUSTER VALIDATION before dispatch: py_compile clean both sides (sha match), and a direct-fit smoke (structured disk-on-bg target) shows the hash path drops loss 99.1% in 60 steps with healthy table gradients (9.1e-5) vs the Fourier path 97.5% -- the hash encoder learns and converges slightly FASTER per step, confirming the code path is correct + the tables are in the autograd graph. (4) HYPOTHESIS: the hash grid's locality + multi-resolution structure converges faster off init than the Fourier MLP in the SAME ~90-100 steps/scene, so SSIM rises above the 0.5629 iter-4 Fourier best. HONEST EXPECTATION (audit): even a FAITHFUL hash-NAF is REGIME-BOUNDED on DENSE 2304-view Mayo (LD-FBP near-complete -> hr likely stays ~0); the hash encoding's real payoff is convergence speed/SSIM here and the 128-view SPARSE benchmarks elsewhere. FALSIFIER: if SSIM <= ~0.56 despite the faithful hash encoder, the per-scene-INR fit is structurally bounded on dense Mayo (document the hash-NAF ceiling as a NEGATIVE result, fix validated as runs+no-regress). (5) HARD 20-min budget UNCHANGED: 214-scene pass, naf_outer_wall_s=1080 (18-min in-solver outer wall = governor) + naf_per_scene_s=5.0 (in-solver per-scene wall; naf_n_iter=3000 stays a high cap so the WALL governs). 214x5.0s=1070s ~= 1080s outer wall (hit ~scene 214 every iter; well inside the 30-min sbatch kill). The hash MLP is SMALLER (32 vs 64 hidden) but adds a 16-table gather/step; per-step cost stays dominated by the fixed 2304-view fan-beam forward+backward, so the step count per 5.0s scene is comparable. val_n=214 (ALL L277 slices, NOT reduced), staged_canonical v3 mayo_ldct_fitted geometry, per-sample-ps (inlined single-val-ps probe -> L277 native ps ~0.73979), bg_target=truth, 321px detector-geometry FOV default (no fov= override). (6) no control return; the loop dispatches the next iter.", "comparison_image": "runs/mayo-ldct-claude-agentic-naf-search-20260619-01/iterations/iter-0006/comparison.png"}
