{"ts": "2026-06-20T08:20:26Z", "run_id": "mayo-ldct-claude-agentic-hammernik-2017-search-20260619-01", "iter": 5, "agent": "hammernik_2017-claude-agentic", "model": "claude-opus-4-8-1m", "change_class": "architecture", "status": "keep", "kept": true, "val_score": 0.8114137649536133, "headroom": 0.03185840166146903, "params_M": 0.012165, "train_n": 400, "rationale": "hammernik_2017-claude-agentic: vn_T=5, vn_n_filters=16, vn_kernel=11, vn_n_bumps=31, vn_x_range=2.0, vn_lambda_init=0.0023, epochs=19, batch_size=2, lr=0.0005, grad_clip=1.0, train_n=200, val_n=214, max_train_s=1100, seed=42, rationale=hammernik_2017 iter-5 (search-20260619-01, corrected 214-slice/321px-FOV metric). ONE KNOB: epochs 14 -> 19 (max that fits the HARD 1200s train+score budget at OOM-safe batch_size=2). BASE_ITER=2 (the BEST valid config, SSIM 0.8012, vn_lambda_init=0.0023) -- reverting AWAY from iter-3 (lambda 0.05, regressed to 0.7932) and iter-4 (n_filters 4, regressed to 0.7828); both single-knob moves regressed, so iter-5 restarts from the best point and changes a different axis. TRAJECTORY (corrected metric, all hr=0, all BELOW the ~0.84 LD-FBP floor): iter-1 OOM (bs=4, no recon); iter-2 SSIM 0.8012 (FIRST valid, ep14/bs2/lambda0.0023, train_time 789.7s); iter-3 0.7932 (lambda 0.0023->0.05 REGRESSED); iter-4 0.7828 (n_filters 16->4 REGRESSED). LIMITER = UNDER-TRAINING, not capacity/lambda/data. EVIDENCE: the corrected-metric runs use bs=2/ep14 = 1400 grad steps; the (now-discarded boundary-slice-metric) sibling sweep CONVERGED only at bs=1/ep38 = 7600 steps (SSIM 8->38 epochs climbed 0.876->0.9484). bs=2/ep14 is ~5x under-trained on gradient steps, and the corrected runs finished ep14 in only 789.7s train -- ~400s of the 1200s budget left UNSPENT. iter-3 claimed epochs-up was INERT because the LOSS converged (8.7e-7 by ep5), but loss-convergence != SSIM-convergence for this VN (the old sweep kept lifting SSIM to ep38 long after loss was tiny). DATA-COVERAGE lever DEFERRED: mechanism verified live (solver loads a FIXED train_n subset via load_val_split + torch.randperm, NO RotatingSubset, so train_n IS a coverage lever), BUT (a) the old-metric train_n 200->300 probe was FLAT (0.9484->0.9478 = the tiny 0.018M VN was NOT data-limited), and (b) per the campaign rule data-coverage applies only AFTER the epoch/capacity levers plateau -- they have NOT (corrected runs are stuck at ep14, far below the proven ep38 convergence point). So epochs FIRST. BUDGET: train_time 56.4s/epoch (789.7s/14); 19 epochs = ~1072s train + ~90s score(214) = ~1162s < 1200s budget; max_train_s=1100 backstop trips before the figure, well under the 1800s SLURM kill. MEMORY-SAFE: identical footprint to iter-2 (bs=2, N_k=16, 31-bump RBF across 5 unrolled steps within 16 GB -- do NOT raise bs, bs=4 OOMed iter-1). grad_clip=1.0 retained (VN-family NaN-skip). HYPOTHESIS: with ~36 percent more gradient steps (1400->1900) the under-trained VN climbs toward its proven convergence basin; predict val_ssim 0.80 -> ~0.86 (clears the 0.84 FBP floor, hr > 0). FALSIFIER: if val_ssim stays <= 0.84 (still below FBP) at 19 epochs, the bs=2 optimization basin is genuinely worse than the bs=1 ep38 path and the budget cannot reach convergence with bs=2 -- iter-6 must then lower lr to extend the effective training (or document the budget-bounded ceiling). lr=5e-4 held (campaign record: lr5e-4 optimal for VN family, 8e-4 worse).", "advice_for_others": "hammernik_2017-claude-agentic: vn_T=5, vn_n_filters=16, vn_kernel=11, vn_n_bumps=31, vn_x_range=2.0, vn_lambda_init=0.0023, epochs=19, batch_size=2, lr=0.0005, grad_clip=1.0, train_n=200, val_n=214, max_train_s=1100, seed=42, rationale=hammernik_2017 iter-5 (search-20260619-01, corrected 214-slice/321px-FOV metric). ONE KNOB: epochs 14 -> 19 (max that fits the HARD 1200s train+score budget at OOM-safe batch_size=2). BASE_ITER=2 (the BEST valid config, SSIM 0.8012, vn_lambda_init=0.0023) -- reverting AWAY from iter-3 (lambda 0.05, regressed to 0.7932) and iter-4 (n_filters 4, regressed to 0.7828); both single-knob moves regressed, so iter-5 restarts from the best point and changes a different axis. TRAJECTORY (corrected metric, all hr=0, all BELOW the ~0.84 LD-FBP floor): iter-1 OOM (bs=4, no recon); iter-2 SSIM 0.8012 (FIRST valid, ep14/bs2/lambda0.0023, train_time 789.7s); iter-3 0.7932 (lambda 0.0023->0.05 REGRESSED); iter-4 0.7828 (n_filters 16->4 REGRESSED). LIMITER = UNDER-TRAINING, not capacity/lambda/data. EVIDENCE: the corrected-metric runs use bs=2/ep14 = 1400 grad steps; the (now-discarded boundary-slice-metric) sibling sweep CONVERGED only at bs=1/ep38 = 7600 steps (SSIM 8->38 epochs climbed 0.876->0.9484). bs=2/ep14 is ~5x under-trained on gradient steps, and the corrected runs finished ep14 in only 789.7s train -- ~400s of the 1200s budget left UNSPENT. iter-3 claimed epochs-up was INERT because the LOSS converged (8.7e-7 by ep5), but loss-convergence != SSIM-convergence for this VN (the old sweep kept lifting SSIM to ep38 long after loss was tiny). DATA-COVERAGE lever DEFERRED: mechanism verified live (solver loads a FIXED train_n subset via load_val_split + torch.randperm, NO RotatingSubset, so train_n IS a coverage lever), BUT (a) the old-metric train_n 200->300 probe was FLAT (0.9484->0.9478 = the tiny 0.018M VN was NOT data-limited), and (b) per the campaign rule data-coverage applies only AFTER the epoch/capacity levers plateau -- they have NOT (corrected runs are stuck at ep14, far below the proven ep38 convergence point). So epochs FIRST. BUDGET: train_time 56.4s/epoch (789.7s/14); 19 epochs = ~1072s train + ~90s score(214) = ~1162s < 1200s budget; max_train_s=1100 backstop trips before the figure, well under the 1800s SLURM kill. MEMORY-SAFE: identical footprint to iter-2 (bs=2, N_k=16, 31-bump RBF across 5 unrolled steps within 16 GB -- do NOT raise bs, bs=4 OOMed iter-1). grad_clip=1.0 retained (VN-family NaN-skip). HYPOTHESIS: with ~36 percent more gradient steps (1400->1900) the under-trained VN climbs toward its proven convergence basin; predict val_ssim 0.80 -> ~0.86 (clears the 0.84 FBP floor, hr > 0). FALSIFIER: if val_ssim stays <= 0.84 (still below FBP) at 19 epochs, the bs=2 optimization basin is genuinely worse than the bs=1 ep38 path and the budget cannot reach convergence with bs=2 -- iter-6 must then lower lr to extend the effective training (or document the budget-bounded ceiling). lr=5e-4 held (campaign record: lr5e-4 optimal for VN family, 8e-4 worse).", "comparison_image": "runs/mayo-ldct-claude-agentic-hammernik-2017-search-20260619-01/iterations/iter-0005/comparison.png"}
{"ts": "2026-06-20T08:19:45Z", "run_id": "mayo-ldct-claude-agentic-itnet-v2-search-20260619-01", "iter": 5, "agent": "itnet_v2-claude-agentic", "model": "claude-opus-4-8-1m", "change_class": "architecture", "status": "discard", "kept": false, "val_score": 0.7294201254844666, "headroom": 0.0, "params_M": 0.232882, "train_n": 400, "rationale": "itnet_v2-claude-agentic: itnet_k=3, unet_c=16, itnet_alpha_init=0.0037, residual_learning=False, pretrain_lr=0.0001, pretrain_epochs=120, pretrain_patience=120, batch_size=1, val_chunk=1, train_n=400, val_n=214, grad_clip=1.0, max_train_s=1100, seed=42, rationale=ITER-5 (search-20260619-01, corrected 214-slice/321px-FOV metric). DATA-COVERAGE lever. ONE KNOB: train_n 200->400 (2x), with pretrain_epochs traded 240->120 (pretrain_patience tracked 240->120, early-stop stays disabled) to HOLD the 20-min wall AND keep grad-step parity train_n*epochs=48000 (iter-4 200*240=48000; iter-5 400*120=48000) so this isolates DATA COVERAGE from extra optimization. MECHANISM VERIFIED in solver_itnet_v2.py: build_dataset calls load_val_split(kind,\"train\",n=train_n) -> a FIXED n-slice subset loaded ONCE; pretrain_denoiser merely reshuffles that subset each epoch (perm=torch.randperm(n)); NO RotatingSubsetDataset / set_epoch. So train_n=200 lets the denoiser see only ~35% of the 579-slice train pool; train_n=400 raises coverage to ~70%. This is the SAME confirmed lever that lifted uswin (200->480, hr 0.3532->0.3829) and itnet_v3 (200->400, hr 0.3123->0.3288) -- itnet_v2 is a fixed-subset trainer so it qualifies. SIX-BOX (NUMBERS): (1) TRAJECTORY (hr=metric of record): iter-1 SSIM 0.4554/hr 0.0 @ep12/tn200 in 170.2s; iter-2 0.5888/hr 0.0 @ep48 in 345.2s; iter-3 0.6230/hr 0.0 @ep144 in 744.1s; iter-4 0.7039/hr 0.0 @ep240 in 1236.9s (val_psnr 25.44, val_rmse 2.672e-3). Best hr=0.0 throughout (LD-FBP floor SSIM ~0.81, above iter-4 0.70). (2) LIMITER: the pretrain_epochs lever is NOT exhausted (iter-3->4 144->240 gave +0.081 SSIM, re-accelerating) BUT it is BUDGET-PINNED: iter-4 ran 1236.9s, OVER the 1200s budget (max_train_s=1150 backstop fired). I cannot raise epochs further. The denoiser is still under-converged AND budget-capped; the separate untrained-DC structural cap (log_alpha never optimized -- itnet.eval() runs the k=3 DC as a FIXED operator, the only optimizer is over denoiser.parameters() in pretrain) is NOT editable (solver edits forbidden). So the only learnable, in-budget lever left is the denoisers DATA COVERAGE. (3) ONE KNOB: train_n 200->400, epochs 240->120 (grad-steps held=48000). (4) HYPOTHESIS: val_ssim rises above iter-4 0.7039 because the denoiser sees 2x the anatomical variety (70% vs 35% of the 579-slice pool) at EQUAL optimization, as the coverage lever lifted uswin/itnet_v3. FALSIFIER: if val_ssim <= ~0.70 (flat/down) at train_n=400, itnet_v2s denoiser is NOT data-coverage-limited; the limiter is the untrained-DC structural cap + per-epoch optimization, and iter-6 reverts to train_n=200 and documents the architecture ceiling (hr stays 0; prefer v3). (5) BUDGET: HARD 20-min train+score. Per-epoch ~4.155s/epoch at tn200 (iter-2->3 slope) scales with slices -> ~8.31s/epoch at tn400; fixed (214-slice per-sample val + figure) ~145.8s. 120 ep: 120*8.31 + 145.8 = 1143s, UNDER 1200s and within the 30-min sbatch wall. max_train_s=1100 (18.3-min HARD backstop) leaves room for the 214-slice per-sample val. val_n=214 KEPT (NOT reduced), grad_clip=1.0 KEPT. (6) Loop continues -- no control returned. HARD-WIRED (unchanged): staged_canonical data, v3 mayo_ldct_fitted geometry, per-sample-ps (each slice swaps itnet.projector to its own ps; batch_size=1 + val_chunk=1 FORCED), bg_target=truth, val=ALL 214 L277 slices under the 321px detector-geometry FOV (evaluate_calibrated default for AGENT4CT_DATASET=mayo_ldct_2d; NO fov= override). residual_learning=False KEPT (the CONFIG default True double-applies the residual and collapses eval to ~0.34).", "advice_for_others": "itnet_v2-claude-agentic: itnet_k=3, unet_c=16, itnet_alpha_init=0.0037, residual_learning=False, pretrain_lr=0.0001, pretrain_epochs=120, pretrain_patience=120, batch_size=1, val_chunk=1, train_n=400, val_n=214, grad_clip=1.0, max_train_s=1100, seed=42, rationale=ITER-5 (search-20260619-01, corrected 214-slice/321px-FOV metric). DATA-COVERAGE lever. ONE KNOB: train_n 200->400 (2x), with pretrain_epochs traded 240->120 (pretrain_patience tracked 240->120, early-stop stays disabled) to HOLD the 20-min wall AND keep grad-step parity train_n*epochs=48000 (iter-4 200*240=48000; iter-5 400*120=48000) so this isolates DATA COVERAGE from extra optimization. MECHANISM VERIFIED in solver_itnet_v2.py: build_dataset calls load_val_split(kind,\"train\",n=train_n) -> a FIXED n-slice subset loaded ONCE; pretrain_denoiser merely reshuffles that subset each epoch (perm=torch.randperm(n)); NO RotatingSubsetDataset / set_epoch. So train_n=200 lets the denoiser see only ~35% of the 579-slice train pool; train_n=400 raises coverage to ~70%. This is the SAME confirmed lever that lifted uswin (200->480, hr 0.3532->0.3829) and itnet_v3 (200->400, hr 0.3123->0.3288) -- itnet_v2 is a fixed-subset trainer so it qualifies. SIX-BOX (NUMBERS): (1) TRAJECTORY (hr=metric of record): iter-1 SSIM 0.4554/hr 0.0 @ep12/tn200 in 170.2s; iter-2 0.5888/hr 0.0 @ep48 in 345.2s; iter-3 0.6230/hr 0.0 @ep144 in 744.1s; iter-4 0.7039/hr 0.0 @ep240 in 1236.9s (val_psnr 25.44, val_rmse 2.672e-3). Best hr=0.0 throughout (LD-FBP floor SSIM ~0.81, above iter-4 0.70). (2) LIMITER: the pretrain_epochs lever is NOT exhausted (iter-3->4 144->240 gave +0.081 SSIM, re-accelerating) BUT it is BUDGET-PINNED: iter-4 ran 1236.9s, OVER the 1200s budget (max_train_s=1150 backstop fired). I cannot raise epochs further. The denoiser is still under-converged AND budget-capped; the separate untrained-DC structural cap (log_alpha never optimized -- itnet.eval() runs the k=3 DC as a FIXED operator, the only optimizer is over denoiser.parameters() in pretrain) is NOT editable (solver edits forbidden). So the only learnable, in-budget lever left is the denoisers DATA COVERAGE. (3) ONE KNOB: train_n 200->400, epochs 240->120 (grad-steps held=48000). (4) HYPOTHESIS: val_ssim rises above iter-4 0.7039 because the denoiser sees 2x the anatomical variety (70% vs 35% of the 579-slice pool) at EQUAL optimization, as the coverage lever lifted uswin/itnet_v3. FALSIFIER: if val_ssim <= ~0.70 (flat/down) at train_n=400, itnet_v2s denoiser is NOT data-coverage-limited; the limiter is the untrained-DC structural cap + per-epoch optimization, and iter-6 reverts to train_n=200 and documents the architecture ceiling (hr stays 0; prefer v3). (5) BUDGET: HARD 20-min train+score. Per-epoch ~4.155s/epoch at tn200 (iter-2->3 slope) scales with slices -> ~8.31s/epoch at tn400; fixed (214-slice per-sample val + figure) ~145.8s. 120 ep: 120*8.31 + 145.8 = 1143s, UNDER 1200s and within the 30-min sbatch wall. max_train_s=1100 (18.3-min HARD backstop) leaves room for the 214-slice per-sample val. val_n=214 KEPT (NOT reduced), grad_clip=1.0 KEPT. (6) Loop continues -- no control returned. HARD-WIRED (unchanged): staged_canonical data, v3 mayo_ldct_fitted geometry, per-sample-ps (each slice swaps itnet.projector to its own ps; batch_size=1 + val_chunk=1 FORCED), bg_target=truth, val=ALL 214 L277 slices under the 321px detector-geometry FOV (evaluate_calibrated default for AGENT4CT_DATASET=mayo_ldct_2d; NO fov= override). residual_learning=False KEPT (the CONFIG default True double-applies the residual and collapses eval to ~0.34).", "comparison_image": "runs/mayo-ldct-claude-agentic-itnet-v2-search-20260619-01/iterations/iter-0005/comparison.png"}
