{"ts": "2026-06-20T21:31:22Z", "run_id": "mayo-ldct-claude-agentic-dual-domain-n2i-search-20260619-01", "iter": 7, "agent": "dual_domain_n2i-claude-agentic", "model": "claude-opus-4-8-1m", "change_class": "architecture", "status": "keep", "kept": true, "val_score": 0.9209831953048706, "headroom": 0.18699120367606725, "params_M": 0.465762, "train_n": 400, "rationale": "dual_domain_n2i-claude-agentic: warm_start=True, pretrain_epochs=6, n_iter=18, grad_clip=1.0, unet_c=16, lr=0.0003, batch_size=1, train_n=200, val_n=214, outer_wall_s=1080, per_scene_s=None, seed=42, rationale=dual_domain_n2i iter-7 (search-20260619-01, PER-IMAGE Noise2Inverse: warm-start pre-pass + per-scan Adam fit; NEVER amortized). SIX-BOX (NUMBERS, from iter-3/4/5/6 observations). (1) TRAJECTORY both primary levers now MAPPED with interior optima bracketed on BOTH sides: lr {1e-3 hr0->FBP-drift, 3e-4 hr0.1976 BEST, 1.5e-4 hr0.1207 iter-6 REGRESSED} optimum=3e-4; n_iter {15 hr0.1506, 18 hr0.19761 BEST, 20 hr0.15949 iter-5 REGRESSED} optimum=18. iter-4 (pe4,n18,lr3e-4) hr 0.19761 SSIM 0.9277 PSNR 35.99 elapsed 1235.5s is the joint optimum + run best. (2) LIMITER: per-scan lr-DOWN (the brief lever) was ALREADY tested at iter-6 (3e-4->1.5e-4) and FALSIFIED, costing -0.0769 hr -> lr is exhausted/wrong-signed below 3e-4. n_iter-up falsified at iter-5 (overfit). Both confirmed levers are spent at their optima. Next genuinely-untried allowed lever = pretrain_epochs of the warm-start (brief-sanctioned). pretrain_epochs-UP was tested ONCE at iter-2 (1->4) and appeared to lower PSNR, but that was at lr=1e-3 where the per-scan fit DRIFTS OFF the init (the init quality could not carry through); it has NEVER been tested at the anchored lr=3e-4 where the fit stays near the init. (3) ONE KNOB: pretrain_epochs 4 -> 6 (lr=3e-4, n_iter=18, grad_clip=1.0, unet_c=16, warm_start=True, val_n=214, seed=42, outer_wall_s=1080 ALL HELD at iter-4 BEST -> iter-4 is the clean isolated comparison, BASE_ITER=4). NOT touched: lr (mapped, optimum 3e-4), n_iter (mapped, optimum 18), warm_start=True (load-bearing-positive), grad_clip=1.0 (2304-view adjoint overflow guard), the 2-subset angular split (hard-wired structure). (4) HYPOTHESIS: pe 4->6 at the anchored lr=3e-4/n_iter=18 optimum lifts hr above 0.19761 (PSNR above 35.99) because a deeper warm-start gives a better FBP-consistent U-Net init that the now-anchored 18-step per-scan fit refines and carries through (unlike iter-2 lr=1e-3 where drift erased the init advantage). NUMERIC FALSIFIER: if hr <= 0.19761 (no PSNR gain over 35.99), warm-start depth is not the binding constraint at the anchored lr and per-image U-Net N2I ceilings at hr~0.20 on dense 2304-view Mayo (half-view info loss bound) -> document the ceiling (NAF/ram structural-negative class), no further per-image tuning. (5) BUDGET (HARD 20-min compute, val=ALL 214): pretrain_epochs adds warm-start time only; per-step fit cost UNCHANGED (n_iter=18 == iter-4). iter-4 warm-start 4ep ~200s; pe 4->6 adds ~2x50=100s -> warm ~300s + fit loop 985s + setup/score ~40s = ~1325s compute; + figure ~27s = ~1352s = 22.5 min figure-inclusive, well under the 1800s/30-min SLURM hard wall. Fit loop 985s < outer_wall_s=1080 backstop; per-scene 4.60s < per_scene_s=1080/214=5.05s -> NO truncation, outer_wall_s stays 1080. grad_clip=1.0 mandatory. val_n=214 NOT reduced (protocol). 321px detector-geometry FOV default (no fov=False). staged_canonical / v3 mayo_ldct_fitted / per-sample-ps half-angle projector swap / bg_target=truth hard-wired. PER-IMAGE structure UNCHANGED (warm-start pre-pass + per-scan fit; NEVER amortized). (6) no control return.", "advice_for_others": "dual_domain_n2i-claude-agentic: warm_start=True, pretrain_epochs=6, n_iter=18, grad_clip=1.0, unet_c=16, lr=0.0003, batch_size=1, train_n=200, val_n=214, outer_wall_s=1080, per_scene_s=None, seed=42, rationale=dual_domain_n2i iter-7 (search-20260619-01, PER-IMAGE Noise2Inverse: warm-start pre-pass + per-scan Adam fit; NEVER amortized). SIX-BOX (NUMBERS, from iter-3/4/5/6 observations). (1) TRAJECTORY both primary levers now MAPPED with interior optima bracketed on BOTH sides: lr {1e-3 hr0->FBP-drift, 3e-4 hr0.1976 BEST, 1.5e-4 hr0.1207 iter-6 REGRESSED} optimum=3e-4; n_iter {15 hr0.1506, 18 hr0.19761 BEST, 20 hr0.15949 iter-5 REGRESSED} optimum=18. iter-4 (pe4,n18,lr3e-4) hr 0.19761 SSIM 0.9277 PSNR 35.99 elapsed 1235.5s is the joint optimum + run best. (2) LIMITER: per-scan lr-DOWN (the brief lever) was ALREADY tested at iter-6 (3e-4->1.5e-4) and FALSIFIED, costing -0.0769 hr -> lr is exhausted/wrong-signed below 3e-4. n_iter-up falsified at iter-5 (overfit). Both confirmed levers are spent at their optima. Next genuinely-untried allowed lever = pretrain_epochs of the warm-start (brief-sanctioned). pretrain_epochs-UP was tested ONCE at iter-2 (1->4) and appeared to lower PSNR, but that was at lr=1e-3 where the per-scan fit DRIFTS OFF the init (the init quality could not carry through); it has NEVER been tested at the anchored lr=3e-4 where the fit stays near the init. (3) ONE KNOB: pretrain_epochs 4 -> 6 (lr=3e-4, n_iter=18, grad_clip=1.0, unet_c=16, warm_start=True, val_n=214, seed=42, outer_wall_s=1080 ALL HELD at iter-4 BEST -> iter-4 is the clean isolated comparison, BASE_ITER=4). NOT touched: lr (mapped, optimum 3e-4), n_iter (mapped, optimum 18), warm_start=True (load-bearing-positive), grad_clip=1.0 (2304-view adjoint overflow guard), the 2-subset angular split (hard-wired structure). (4) HYPOTHESIS: pe 4->6 at the anchored lr=3e-4/n_iter=18 optimum lifts hr above 0.19761 (PSNR above 35.99) because a deeper warm-start gives a better FBP-consistent U-Net init that the now-anchored 18-step per-scan fit refines and carries through (unlike iter-2 lr=1e-3 where drift erased the init advantage). NUMERIC FALSIFIER: if hr <= 0.19761 (no PSNR gain over 35.99), warm-start depth is not the binding constraint at the anchored lr and per-image U-Net N2I ceilings at hr~0.20 on dense 2304-view Mayo (half-view info loss bound) -> document the ceiling (NAF/ram structural-negative class), no further per-image tuning. (5) BUDGET (HARD 20-min compute, val=ALL 214): pretrain_epochs adds warm-start time only; per-step fit cost UNCHANGED (n_iter=18 == iter-4). iter-4 warm-start 4ep ~200s; pe 4->6 adds ~2x50=100s -> warm ~300s + fit loop 985s + setup/score ~40s = ~1325s compute; + figure ~27s = ~1352s = 22.5 min figure-inclusive, well under the 1800s/30-min SLURM hard wall. Fit loop 985s < outer_wall_s=1080 backstop; per-scene 4.60s < per_scene_s=1080/214=5.05s -> NO truncation, outer_wall_s stays 1080. grad_clip=1.0 mandatory. val_n=214 NOT reduced (protocol). 321px detector-geometry FOV default (no fov=False). staged_canonical / v3 mayo_ldct_fitted / per-sample-ps half-angle projector swap / bg_target=truth hard-wired. PER-IMAGE structure UNCHANGED (warm-start pre-pass + per-scan fit; NEVER amortized). (6) no control return.", "comparison_image": "runs/mayo-ldct-claude-agentic-dual-domain-n2i-search-20260619-01/iterations/iter-0007/comparison.png"}
{"ts": "2026-06-20T21:30:28Z", "run_id": "mayo-ldct-claude-agentic-r2gaussian-search-20260619-01", "iter": 7, "agent": "r2gaussian-claude-agentic", "model": "claude-opus-4-8-1m", "change_class": "architecture", "status": "discard", "kept": false, "val_score": 0.7641072869300842, "headroom": 0.0, "params_M": 0.003072, "train_n": 400, "rationale": "r2gaussian-claude-agentic: val_n=214, gs_n_gaussians=512, gs_n_iter=150, gs_lr_pos=0.005, gs_lr_scale=0.01, gs_lr_amp=0.01, gs_lr_rot=0.01, gs_amp_init=0.01, gs_scale_init=0.04, gs_tv_weight=0.0001, gs_n_clip=0.05, gs_render=raster, gs_init_from_fbp=True, gs_amp_init_max=0.05, gs_ssim_weight=0.15, gs_outer_wall_s=1080, rationale=iter-7 (search-20260619-01) \u2014 AUTHORIZED audit-fix (b) validation, in-budget continuation. ONE KNOB: gs_ssim_weight 0.1->0.15 (from iter-6 BEST base: gs_init_from_fbp=True, gs_render=raster, n_iter=150, 512 Gaussians, gs_amp_init_max=0.05 \u2014 the config that set the run-best SSIM 0.7519). LIMITER: r2gaussian is REGIME-BOUNDED on dense 2304-view Mayo \u2014 LD-FBP (~0.808) is near-complete, the inverse is not ill-posed enough for a Gaussian-splat prior to add value, so hr>0 is implausible regardless. Secondary (now FIXED) limiter was cold uniform random-init + pure-L2 loss; iters 1-5 (cold init, L2-only) all landed BELOW the 0.808 FBP init (SSIM 0.68-0.74, hr=0). iter-6 enabled the audit-fix (b) \u2014 FBP warm-start (gs_init_from_fbp=True: positions sampled prop to fbp^2, amp seeded from FBP intensity) + SSIM loss term (gs_ssim_weight=0.1; the benchmark is SSIM-scored but the loss was pure L2) \u2014 and lifted SSIM 0.7383->0.7519 (NEW run-best, +0.0136), hr still 0. The real payoff of this fix is on the 128-view SPARSE benchmarks, NOT dense Mayo; this iter validates the authorized fix runs without regressing and measures whether MORE SSIM weight lifts SSIM further toward the LD-FBP floor. HYPOTHESIS (falsifiable in NUMBERS): a slightly stronger SSIM pull (0.1->0.15) toward FBP structure nudges the ~26 completed scenes further AT/ABOVE their FBP init, so the 214-avg SSIM rises modestly above iter-6 0.7519 toward the 0.808 LD-FBP floor. PREDICTION: SSIM in (0.75, 0.78), hr 0 (regime-bounded). NUMERIC FALSIFIER: if SSIM <= 0.7519 (no lift over iter-6 best), the FBP-init+SSIM-loss fix is exhausted as an SSIM lever on dense Mayo \u2014 fix VALIDATED AS FAITHFUL-BUT-REGIME-BOUNDED (its payoff is the sparse benchmarks). BUDGET: gs_init_from_fbp adds ~0 per-step cost (init only); the SSIM term is one cheap conv-SSIM per step vs the dominating 2304-view projection, so per-step stays ~0.282 s and coverage ~26/214 (same as iter-6, elapsed_s 1131 < 1800 SLURM wall). gs_outer_wall_s=1080 self-truncates before the 30-min kill, val figure excluded. val_n=214 per mandate; staged_canonical / v3 mayo_ldct_fitted geom / per-sample-ps (single-val-ps probe) / bg_target=truth / 321px-FOV-default / gs_render=raster all hard-wired. gs_render stays raster (the splat path is the DEFERRED (a) fix and raises NotImplementedError). TRAJECTORY: iter-1 0.7383 (cold/L2) -> iter-6 0.7519 (warm FBP-init + SSIM@0.1, BEST) -> iter-7 = SSIM weight 0.1->0.15, the does-MORE-SSIM-help test of the authorized audit-fix (b).", "advice_for_others": "r2gaussian-claude-agentic: val_n=214, gs_n_gaussians=512, gs_n_iter=150, gs_lr_pos=0.005, gs_lr_scale=0.01, gs_lr_amp=0.01, gs_lr_rot=0.01, gs_amp_init=0.01, gs_scale_init=0.04, gs_tv_weight=0.0001, gs_n_clip=0.05, gs_render=raster, gs_init_from_fbp=True, gs_amp_init_max=0.05, gs_ssim_weight=0.15, gs_outer_wall_s=1080, rationale=iter-7 (search-20260619-01) \u2014 AUTHORIZED audit-fix (b) validation, in-budget continuation. ONE KNOB: gs_ssim_weight 0.1->0.15 (from iter-6 BEST base: gs_init_from_fbp=True, gs_render=raster, n_iter=150, 512 Gaussians, gs_amp_init_max=0.05 \u2014 the config that set the run-best SSIM 0.7519). LIMITER: r2gaussian is REGIME-BOUNDED on dense 2304-view Mayo \u2014 LD-FBP (~0.808) is near-complete, the inverse is not ill-posed enough for a Gaussian-splat prior to add value, so hr>0 is implausible regardless. Secondary (now FIXED) limiter was cold uniform random-init + pure-L2 loss; iters 1-5 (cold init, L2-only) all landed BELOW the 0.808 FBP init (SSIM 0.68-0.74, hr=0). iter-6 enabled the audit-fix (b) \u2014 FBP warm-start (gs_init_from_fbp=True: positions sampled prop to fbp^2, amp seeded from FBP intensity) + SSIM loss term (gs_ssim_weight=0.1; the benchmark is SSIM-scored but the loss was pure L2) \u2014 and lifted SSIM 0.7383->0.7519 (NEW run-best, +0.0136), hr still 0. The real payoff of this fix is on the 128-view SPARSE benchmarks, NOT dense Mayo; this iter validates the authorized fix runs without regressing and measures whether MORE SSIM weight lifts SSIM further toward the LD-FBP floor. HYPOTHESIS (falsifiable in NUMBERS): a slightly stronger SSIM pull (0.1->0.15) toward FBP structure nudges the ~26 completed scenes further AT/ABOVE their FBP init, so the 214-avg SSIM rises modestly above iter-6 0.7519 toward the 0.808 LD-FBP floor. PREDICTION: SSIM in (0.75, 0.78), hr 0 (regime-bounded). NUMERIC FALSIFIER: if SSIM <= 0.7519 (no lift over iter-6 best), the FBP-init+SSIM-loss fix is exhausted as an SSIM lever on dense Mayo \u2014 fix VALIDATED AS FAITHFUL-BUT-REGIME-BOUNDED (its payoff is the sparse benchmarks). BUDGET: gs_init_from_fbp adds ~0 per-step cost (init only); the SSIM term is one cheap conv-SSIM per step vs the dominating 2304-view projection, so per-step stays ~0.282 s and coverage ~26/214 (same as iter-6, elapsed_s 1131 < 1800 SLURM wall). gs_outer_wall_s=1080 self-truncates before the 30-min kill, val figure excluded. val_n=214 per mandate; staged_canonical / v3 mayo_ldct_fitted geom / per-sample-ps (single-val-ps probe) / bg_target=truth / 321px-FOV-default / gs_render=raster all hard-wired. gs_render stays raster (the splat path is the DEFERRED (a) fix and raises NotImplementedError). TRAJECTORY: iter-1 0.7383 (cold/L2) -> iter-6 0.7519 (warm FBP-init + SSIM@0.1, BEST) -> iter-7 = SSIM weight 0.1->0.15, the does-MORE-SSIM-help test of the authorized audit-fix (b).", "comparison_image": "runs/mayo-ldct-claude-agentic-r2gaussian-search-20260619-01/iterations/iter-0007/comparison.png"}
{"ts": "2026-06-20T21:18:43Z", "run_id": "mayo-ldct-claude-agentic-learned-primal-dual-search-20260619-01", "iter": 7, "agent": "learned_primal_dual-claude-agentic", "model": "claude-opus-4-8-1m", "change_class": "architecture", "status": "discard", "kept": false, "val_score": 0.866666316986084, "headroom": 0.0, "params_M": 0.155406, "train_n": 400, "rationale": "learned_primal_dual-claude-agentic: lpd_iters=3, lpd_hidden=48, lpd_n_primal=5, lpd_n_dual=5, lpd_share_weights=False, lr=0.0007, lr_schedule=cosine, epochs=5, batch_size=1, val_chunk=1, train_n=400, val_n=214, grad_clip=1.0, seed=42, rationale=iter-7 search-20260619-01: ONE knob = train_n 200 -> 400 (DATA COVERAGE), the campaign-confirmed lever for end-to-end trainers (uswin +0.0297, itnet_v3 +0.0165). BASE_ITER=4 (BEST SSIM 0.898033, hr0: lpd_iters=3, hidden=48, n_primal=5, n_dual=5, lr=7e-4 cosine, batch=1, val_chunk=1, val_n=214, grad_clip=1.0, seed=42). epochs traded 10 -> 5 PURELY to hold GRAD-STEP PARITY with iter-4 (ep10*tn200 = ep5*tn400 = 2000 steps) AND the HARD 1200s wall. This is the clean data-coverage test iter-5 was NOT: iter-5 raised tn 200->300 but cut ep 10->7 -> 2100 steps (broke parity) yet STILL produced the LOWEST RMSE on the whole arc (1.139e-3 vs iter-4 1.416e-3) -> more data drove RMSE DOWN even under-trained, so the data lever was NOT cleanly falsified (the prior iter-6 mis-read iter-5 as falsifying it). At grad-step parity vs iter-4, ANY SSIM/RMSE move is attributable to DATA COVERAGE alone, isolating it from extra optimization. WHY DATA IS NOT INERT: LPD loads a FIXED train_n subset ONCE (build_dataset->load_val_split) then torch.randperm reshuffles that SAME tensor each epoch (no RotatingSubsetDataset), so tn200 only ever showed the net 200/579 distinct slices (35%); tn400 = 69% of the 579-slice patient-balanced pool (groups 154/98/327; group-2 caps 98), adding ~200 genuinely-new slices spanning all 3 train patients -> the campaign DATA-COVERAGE lever, the strongest untried-clean axis. BUDGET MATH vs 1200s: total ~ fixed_overhead + per_step*(epochs*train_n), batch=1. iter-4 = ep10*tn200 = 2000 steps ran 1100.7s = 18.35min. iter-7 = ep5*tn400 = 2000 steps -> COMPUTE-IDENTICAL grad-step count -> ~1100s = 18.3min, +100s margin under the 1200s wall (ep6*tn400 = 2400 steps would be ~1325s, OVER -> ep5 is the budget-fit epoch count for tn400). lpd_hidden^/lpd_iters^ stay OFF (add per-sample projector fwd+adj cost, blow the wall; iter-6 deeper-unroll fell to 0.831). HYP: 69%-vs-35% patient-balanced data coverage at matched optimization lets LPD generalise to held-out L277 better, lifting SSIM toward/above iter-4 0.898 AND pushing RMSE below iter-5 1.139e-3 toward clearing the LD-FBP floor (hr>0 for the first time on LPD Mayo); predict SSIM ~0.90-0.92, hr 0 -> possibly slightly >0. NUMERIC FALSIFIER: SSIM <= 0.898 (iter-4) AND RMSE >= 1.139e-3 (iter-5) with hr still 0.000 => data coverage is NOT the lever even at grad-step parity; LPD is FBP-bounded on dense 2304-view Mayo (LD-FBP near-complete at 2304>>Nyquist, no ill-posedness headroom for the unrolled updates), the SAME mechanism that makes it the 128-view-SPARSE breast/demo CHAMPION yet hr0 on dense Mayo -> documented structural ceiling toward iter-20. ep5 under-train confound bounded: if SSIM DROPS below iter-2 0.864 (ep10/tn200) the epoch cut dominated and tn400 needs a deeper wall, not this budget.", "advice_for_others": "learned_primal_dual-claude-agentic: lpd_iters=3, lpd_hidden=48, lpd_n_primal=5, lpd_n_dual=5, lpd_share_weights=False, lr=0.0007, lr_schedule=cosine, epochs=5, batch_size=1, val_chunk=1, train_n=400, val_n=214, grad_clip=1.0, seed=42, rationale=iter-7 search-20260619-01: ONE knob = train_n 200 -> 400 (DATA COVERAGE), the campaign-confirmed lever for end-to-end trainers (uswin +0.0297, itnet_v3 +0.0165). BASE_ITER=4 (BEST SSIM 0.898033, hr0: lpd_iters=3, hidden=48, n_primal=5, n_dual=5, lr=7e-4 cosine, batch=1, val_chunk=1, val_n=214, grad_clip=1.0, seed=42). epochs traded 10 -> 5 PURELY to hold GRAD-STEP PARITY with iter-4 (ep10*tn200 = ep5*tn400 = 2000 steps) AND the HARD 1200s wall. This is the clean data-coverage test iter-5 was NOT: iter-5 raised tn 200->300 but cut ep 10->7 -> 2100 steps (broke parity) yet STILL produced the LOWEST RMSE on the whole arc (1.139e-3 vs iter-4 1.416e-3) -> more data drove RMSE DOWN even under-trained, so the data lever was NOT cleanly falsified (the prior iter-6 mis-read iter-5 as falsifying it). At grad-step parity vs iter-4, ANY SSIM/RMSE move is attributable to DATA COVERAGE alone, isolating it from extra optimization. WHY DATA IS NOT INERT: LPD loads a FIXED train_n subset ONCE (build_dataset->load_val_split) then torch.randperm reshuffles that SAME tensor each epoch (no RotatingSubsetDataset), so tn200 only ever showed the net 200/579 distinct slices (35%); tn400 = 69% of the 579-slice patient-balanced pool (groups 154/98/327; group-2 caps 98), adding ~200 genuinely-new slices spanning all 3 train patients -> the campaign DATA-COVERAGE lever, the strongest untried-clean axis. BUDGET MATH vs 1200s: total ~ fixed_overhead + per_step*(epochs*train_n), batch=1. iter-4 = ep10*tn200 = 2000 steps ran 1100.7s = 18.35min. iter-7 = ep5*tn400 = 2000 steps -> COMPUTE-IDENTICAL grad-step count -> ~1100s = 18.3min, +100s margin under the 1200s wall (ep6*tn400 = 2400 steps would be ~1325s, OVER -> ep5 is the budget-fit epoch count for tn400). lpd_hidden^/lpd_iters^ stay OFF (add per-sample projector fwd+adj cost, blow the wall; iter-6 deeper-unroll fell to 0.831). HYP: 69%-vs-35% patient-balanced data coverage at matched optimization lets LPD generalise to held-out L277 better, lifting SSIM toward/above iter-4 0.898 AND pushing RMSE below iter-5 1.139e-3 toward clearing the LD-FBP floor (hr>0 for the first time on LPD Mayo); predict SSIM ~0.90-0.92, hr 0 -> possibly slightly >0. NUMERIC FALSIFIER: SSIM <= 0.898 (iter-4) AND RMSE >= 1.139e-3 (iter-5) with hr still 0.000 => data coverage is NOT the lever even at grad-step parity; LPD is FBP-bounded on dense 2304-view Mayo (LD-FBP near-complete at 2304>>Nyquist, no ill-posedness headroom for the unrolled updates), the SAME mechanism that makes it the 128-view-SPARSE breast/demo CHAMPION yet hr0 on dense Mayo -> documented structural ceiling toward iter-20. ep5 under-train confound bounded: if SSIM DROPS below iter-2 0.864 (ep10/tn200) the epoch cut dominated and tn400 needs a deeper wall, not this budget.", "comparison_image": "runs/mayo-ldct-claude-agentic-learned-primal-dual-search-20260619-01/iterations/iter-0007/comparison.png"}
