{"ts": "2026-06-21T10:44:13Z", "run_id": "mayo-ldct-claude-agentic-itnet-search-20260619-01", "iter": 8, "agent": "itnet-claude-agentic", "model": "claude-opus-4-8-1m", "change_class": "architecture", "status": "keep", "kept": true, "val_score": 0.9408048987388611, "headroom": 0.41433465591972507, "params_M": 0.232881, "train_n": 400, "rationale": "itnet-claude-agentic: pretrain_epochs=80, pretrain_lr=0.0001, itnet_k=1, itnet_alpha=0.005, unet_c=16, finetune_epochs=0, finetune_lr=0.0001, train_n=480, val_n=214, grad_clip=1.0, seed=42, rationale=ITER-8 (search-20260619-01, corrected 214-slice/321px-FOV metric) for itnet = ItNet v1 (pretrain-denoiser-then-FIXED-DC k=1, solver_itnet.py). SIX-BOX (NUMBERS, not CT pixels). (1) TRAJECTORY (val=ALL 214 L277, 321px FOV; hr=metric of record): iter-1 ep8/tn200 k3 SSIM 0.4413/hr 0.000; iter-2 ep48 0.5927/0; iter-3 ep160 0.6430/0; iter-4 ep220 0.7022/0; iter-5 ep140/tn300 0.6932/0 (all k=3, all hr 0). iter-6 itnet_k 3->1 BROKE THE FLOOR: SSIM 0.9332/hr 0.3752 (1281.4s, tn200 ep200). iter-7 train_n 200->300 (ep125, BUDGET BACKSTOP) LIFTED hr 0.3752 -> 0.3989 (SSIM 0.9377, elapsed 1008.9s, #4 on the Mayo board). CURRENT train_n=300 = only ~52%% of the 579-slice train pool. The DATA-COVERAGE lever is WORKING and NOT yet exhausted. (2) LIMITER (k=1 fixed, the breakthrough; pretrain_epochs plateaued in diminishing-returns iters 1-4): the trained SmallUNet denoiser (params_M 0.2329) is now data-coverage-bounded. itnet loads a FIXED stratified train subset ONCE via load_val_split(n=train_n)+randperm, NO rotation; tn300 still misses ~48%% of the 579-slice pool. Campaign doc confirms train_n is the live lever lifting every trainer (uswin 200->480 hr +0.0297 champ; itnet_v3 200->400 +0.0165) and the itnet v1 data probe iter-6->7 just confirmed it on THIS solver (+0.0237). (3) ONE KNOB: train_n 300 -> 480 (+60%% data coverage, ~83%% of the 579-slice pool, +anatomy ps-groups at k=1, from BASE_ITER=7). pretrain_epochs 125 -> 80 is the BUDGET BACKSTOP (NOT a 2nd hypothesis-knob) to hold the HARD 20-min wall at GRAD-STEP PARITY: grad steps 480x80=38400 vs iter-7 300x125=37500 (+2.4%%), so the change ISOLATES DATA COVERAGE from extra optimization. KEEP itnet_k=1 (the breakthrough). All else identical to iter-7 (itnet_alpha=0.005, unet_c=16, pretrain_lr=1e-4, val_n=214, grad_clip=1.0, seed=42). (4) HYPOTHESIS: broader data coverage (52%%->83%% of the pool) lifts hr ABOVE 0.3989 toward the leaders (itnet_v2 0.4187, dd_sup 0.4158, uswin 0.4150), predict ~0.405-0.415, tracking the +0.0237 tn200->300 v1 gain and the +0.016-to-+0.030 sibling-trainer train_n gains. FALSIFIER (operative, NUMERIC): if hr <= 0.3989 at train_n=480/k=1, the data-coverage lever SATURATES for v1 (denoiser is FBP-information-bounded, not data-limited) -> document the saturation and the next lever is a different axis (capacity unet_c / alpha). (5) BUDGET (HARD 20-min = 1200s train+score; sbatch 30-min wall is the only hard fence): iter-7 ACTUAL 1008.9s @ tn300/ep125 (37500 grad steps) came in WELL under the conservative 1213s estimate. Decompose: fixed (data load + 214-slice per-sample val + figure + startup) ~185s; pretrain ~824s over 37500 grad steps = 0.0220 s/grad-step. iter-8 38400 grad steps -> 0.0220*38400 = 845s + 185s fixed = ~1030s = 17.2 min, INSIDE the 1200s HARD wall with ~170s margin and BELOW iter-6 (1281s). val stays ALL 214 L277 slices, 321px detector-geometry FOV (default; NO fov= override). grad_clip=1.0 retained (mandatory: the 2304-view Mayo FBP adjoint inside the DC step overflows otherwise). v1 has NO max_train_s backstop. (6) Loop continues -- no control returned. HARD-WIRED (unchanged): staged_canonical data, v3 mayo_ldct_fitted geometry, per-sample-ps (each val slice swaps itnet.projector to its own ps; chunk=1 FORCED), bg_target=truth, KEEP itnet_k=1, val=ALL 214 L277 slices under the 321px detector-geometry FOV (evaluate_calibrated default for AGENT4CT_DATASET=mayo_ldct_2d; NO fov= override).", "advice_for_others": "itnet-claude-agentic: pretrain_epochs=80, pretrain_lr=0.0001, itnet_k=1, itnet_alpha=0.005, unet_c=16, finetune_epochs=0, finetune_lr=0.0001, train_n=480, val_n=214, grad_clip=1.0, seed=42, rationale=ITER-8 (search-20260619-01, corrected 214-slice/321px-FOV metric) for itnet = ItNet v1 (pretrain-denoiser-then-FIXED-DC k=1, solver_itnet.py). SIX-BOX (NUMBERS, not CT pixels). (1) TRAJECTORY (val=ALL 214 L277, 321px FOV; hr=metric of record): iter-1 ep8/tn200 k3 SSIM 0.4413/hr 0.000; iter-2 ep48 0.5927/0; iter-3 ep160 0.6430/0; iter-4 ep220 0.7022/0; iter-5 ep140/tn300 0.6932/0 (all k=3, all hr 0). iter-6 itnet_k 3->1 BROKE THE FLOOR: SSIM 0.9332/hr 0.3752 (1281.4s, tn200 ep200). iter-7 train_n 200->300 (ep125, BUDGET BACKSTOP) LIFTED hr 0.3752 -> 0.3989 (SSIM 0.9377, elapsed 1008.9s, #4 on the Mayo board). CURRENT train_n=300 = only ~52%% of the 579-slice train pool. The DATA-COVERAGE lever is WORKING and NOT yet exhausted. (2) LIMITER (k=1 fixed, the breakthrough; pretrain_epochs plateaued in diminishing-returns iters 1-4): the trained SmallUNet denoiser (params_M 0.2329) is now data-coverage-bounded. itnet loads a FIXED stratified train subset ONCE via load_val_split(n=train_n)+randperm, NO rotation; tn300 still misses ~48%% of the 579-slice pool. Campaign doc confirms train_n is the live lever lifting every trainer (uswin 200->480 hr +0.0297 champ; itnet_v3 200->400 +0.0165) and the itnet v1 data probe iter-6->7 just confirmed it on THIS solver (+0.0237). (3) ONE KNOB: train_n 300 -> 480 (+60%% data coverage, ~83%% of the 579-slice pool, +anatomy ps-groups at k=1, from BASE_ITER=7). pretrain_epochs 125 -> 80 is the BUDGET BACKSTOP (NOT a 2nd hypothesis-knob) to hold the HARD 20-min wall at GRAD-STEP PARITY: grad steps 480x80=38400 vs iter-7 300x125=37500 (+2.4%%), so the change ISOLATES DATA COVERAGE from extra optimization. KEEP itnet_k=1 (the breakthrough). All else identical to iter-7 (itnet_alpha=0.005, unet_c=16, pretrain_lr=1e-4, val_n=214, grad_clip=1.0, seed=42). (4) HYPOTHESIS: broader data coverage (52%%->83%% of the pool) lifts hr ABOVE 0.3989 toward the leaders (itnet_v2 0.4187, dd_sup 0.4158, uswin 0.4150), predict ~0.405-0.415, tracking the +0.0237 tn200->300 v1 gain and the +0.016-to-+0.030 sibling-trainer train_n gains. FALSIFIER (operative, NUMERIC): if hr <= 0.3989 at train_n=480/k=1, the data-coverage lever SATURATES for v1 (denoiser is FBP-information-bounded, not data-limited) -> document the saturation and the next lever is a different axis (capacity unet_c / alpha). (5) BUDGET (HARD 20-min = 1200s train+score; sbatch 30-min wall is the only hard fence): iter-7 ACTUAL 1008.9s @ tn300/ep125 (37500 grad steps) came in WELL under the conservative 1213s estimate. Decompose: fixed (data load + 214-slice per-sample val + figure + startup) ~185s; pretrain ~824s over 37500 grad steps = 0.0220 s/grad-step. iter-8 38400 grad steps -> 0.0220*38400 = 845s + 185s fixed = ~1030s = 17.2 min, INSIDE the 1200s HARD wall with ~170s margin and BELOW iter-6 (1281s). val stays ALL 214 L277 slices, 321px detector-geometry FOV (default; NO fov= override). grad_clip=1.0 retained (mandatory: the 2304-view Mayo FBP adjoint inside the DC step overflows otherwise). v1 has NO max_train_s backstop. (6) Loop continues -- no control returned. HARD-WIRED (unchanged): staged_canonical data, v3 mayo_ldct_fitted geometry, per-sample-ps (each val slice swaps itnet.projector to its own ps; chunk=1 FORCED), bg_target=truth, KEEP itnet_k=1, val=ALL 214 L277 slices under the 321px detector-geometry FOV (evaluate_calibrated default for AGENT4CT_DATASET=mayo_ldct_2d; NO fov= override).", "comparison_image": "runs/mayo-ldct-claude-agentic-itnet-search-20260619-01/iterations/iter-0008/comparison.png"}
{"ts": "2026-06-21T08:43:21Z", "run_id": "mayo-ldct-claude-agentic-dual-domain-supervised-search-20260619-01", "iter": 8, "agent": "dual_domain_supervised-claude-agentic", "model": "claude-opus-4-8-1m", "change_class": "architecture", "status": "keep", "kept": true, "val_score": 0.9312200546264648, "headroom": 0.4140163427077663, "params_M": 0.465762, "train_n": 400, "rationale": "dual_domain_supervised-claude-agentic: unet_c=16, lr=0.0001, epochs=10, batch_size=1, val_chunk=1, train_n=579, val_n=214, grad_clip=1.0, lambda_neg=0.1, seed=42, rationale=ITER-8 (search-20260619-01). BASE_ITER=6 (CHAMPION: unet_c=16/lr=1e-4/epochs=10/train_n=579/lambda_neg=1.0/grad_clip=1.0/seed=42, hr 0.415794, #2 on the Mayo board behind itnet_v2 0.4187). ONE KNOB (loss weighting): lambda_neg 1.0 -> 0.1. SIX-BOX (NUMBERS). (1) TRAJECTORY: ep8/n200 hr0.276 -> ep20 0.339 -> ep27 0.3654 -> ep9/n579 0.3994 -> ep10/n579 0.4158 (iter-6 CHAMPION) -> iter-7 lr1.5e-4 REGRESSED to 0.4133. CURRENT train_n=579 (the ENTIRE Wagner pool, maxed since iter-5). (2) LIMITER: ALL compute-coupled levers EXHAUSTED -- epochs WALL-PINNED at 10 (ep10 used 1172/1200s; ep11=1262s BUSTS the 20-min wall), data coverage MAXED (train_n=579 = full pool, cannot rise), capacity REGRESSED (iter-4 c24/ep10 -> 0.29856, under-trained the bigger net), lr REGRESSED (iter-7 1.5e-4 -> 0.4133). The ONE within-budget lever NEVER tried in this campaign is lambda_neg, pinned at 1.0 across all 7 iters. The campaign-state notes record lambda_neg=0.1 as BEST from the prior TPE (behavior hint). lambda_neg is a CONFIRMED live cfg knob: solver_dual_ddomain_supervised.py:167 loss = supervised_recon_loss(pred, truth, lambda_neg=cfg[lambda_neg], base=mse), scaling the negativity-penalty term. (3) ONE KNOB: lambda_neg 1.0 -> 0.1. This RE-WEIGHTS the loss toward the MSE-vs-truth recon term (the negativity penalty at 1.0 over-constrains, stealing gradient budget from the data-fidelity term) at ZERO extra compute -- a loss-weight change does not alter per-epoch cost, so the pinned ep10 wall stays SAFE (no epoch trade needed; this is why lambda_neg is chosen over capacity, which would need epochs to fund). (4) HYPOTHESIS: lambda_neg 1.0->0.1 lifts hr ABOVE 0.415794 (toward/past itnet_v2 0.4187), because down-weighting the over-strong negativity penalty 10x frees gradient budget for the recon MSE term, and the prior TPE found 0.1 optimal. FALSIFIER (NUMBERS): if hr <= 0.415794 at lambda_neg=0.1, then the prior-TPE 0.1-best hint does NOT transfer under the corrected 214-slice/321px-FOV metric and ALL FIVE within-budget levers are EXHAUSTED -- epochs (wall-locked), data (maxed), capacity (regressed), lr (regressed), lambda_neg (this iter) -- so 0.415794 is dual_domain_supervised DEFINITIVE budget-constrained Mayo CEILING; file the champion-ceiling verdict. PREDICTED iter-8 hr ~0.418-0.422. (5) BUDGET: loss-weight change does NOT alter per-epoch cost -> ep10/train_n=579 stays ~1172s (19.5 min), inside the 1200s train+score wall and the 30-min sbatch wall; no epoch trade. (6) no control return. HARD-WIRED (unchanged): staged_canonical v3 mayo_ldct_fitted geometry, per-sample-ps FBP + per-sample pipe.R_full swap, bg_target=truth, val=ALL 214 L277 slices, metric=321px detector-geometry FOV default, grad_clip=1.0 retained.", "advice_for_others": "dual_domain_supervised-claude-agentic: unet_c=16, lr=0.0001, epochs=10, batch_size=1, val_chunk=1, train_n=579, val_n=214, grad_clip=1.0, lambda_neg=0.1, seed=42, rationale=ITER-8 (search-20260619-01). BASE_ITER=6 (CHAMPION: unet_c=16/lr=1e-4/epochs=10/train_n=579/lambda_neg=1.0/grad_clip=1.0/seed=42, hr 0.415794, #2 on the Mayo board behind itnet_v2 0.4187). ONE KNOB (loss weighting): lambda_neg 1.0 -> 0.1. SIX-BOX (NUMBERS). (1) TRAJECTORY: ep8/n200 hr0.276 -> ep20 0.339 -> ep27 0.3654 -> ep9/n579 0.3994 -> ep10/n579 0.4158 (iter-6 CHAMPION) -> iter-7 lr1.5e-4 REGRESSED to 0.4133. CURRENT train_n=579 (the ENTIRE Wagner pool, maxed since iter-5). (2) LIMITER: ALL compute-coupled levers EXHAUSTED -- epochs WALL-PINNED at 10 (ep10 used 1172/1200s; ep11=1262s BUSTS the 20-min wall), data coverage MAXED (train_n=579 = full pool, cannot rise), capacity REGRESSED (iter-4 c24/ep10 -> 0.29856, under-trained the bigger net), lr REGRESSED (iter-7 1.5e-4 -> 0.4133). The ONE within-budget lever NEVER tried in this campaign is lambda_neg, pinned at 1.0 across all 7 iters. The campaign-state notes record lambda_neg=0.1 as BEST from the prior TPE (behavior hint). lambda_neg is a CONFIRMED live cfg knob: solver_dual_ddomain_supervised.py:167 loss = supervised_recon_loss(pred, truth, lambda_neg=cfg[lambda_neg], base=mse), scaling the negativity-penalty term. (3) ONE KNOB: lambda_neg 1.0 -> 0.1. This RE-WEIGHTS the loss toward the MSE-vs-truth recon term (the negativity penalty at 1.0 over-constrains, stealing gradient budget from the data-fidelity term) at ZERO extra compute -- a loss-weight change does not alter per-epoch cost, so the pinned ep10 wall stays SAFE (no epoch trade needed; this is why lambda_neg is chosen over capacity, which would need epochs to fund). (4) HYPOTHESIS: lambda_neg 1.0->0.1 lifts hr ABOVE 0.415794 (toward/past itnet_v2 0.4187), because down-weighting the over-strong negativity penalty 10x frees gradient budget for the recon MSE term, and the prior TPE found 0.1 optimal. FALSIFIER (NUMBERS): if hr <= 0.415794 at lambda_neg=0.1, then the prior-TPE 0.1-best hint does NOT transfer under the corrected 214-slice/321px-FOV metric and ALL FIVE within-budget levers are EXHAUSTED -- epochs (wall-locked), data (maxed), capacity (regressed), lr (regressed), lambda_neg (this iter) -- so 0.415794 is dual_domain_supervised DEFINITIVE budget-constrained Mayo CEILING; file the champion-ceiling verdict. PREDICTED iter-8 hr ~0.418-0.422. (5) BUDGET: loss-weight change does NOT alter per-epoch cost -> ep10/train_n=579 stays ~1172s (19.5 min), inside the 1200s train+score wall and the 30-min sbatch wall; no epoch trade. (6) no control return. HARD-WIRED (unchanged): staged_canonical v3 mayo_ldct_fitted geometry, per-sample-ps FBP + per-sample pipe.R_full swap, bg_target=truth, val=ALL 214 L277 slices, metric=321px detector-geometry FOV default, grad_clip=1.0 retained.", "comparison_image": "runs/mayo-ldct-claude-agentic-dual-domain-supervised-search-20260619-01/iterations/iter-0008/comparison.png"}
{"ts": "2026-06-21T08:35:11Z", "run_id": "mayo-ldct-claude-agentic-ram-search-20260619-01", "iter": 7, "agent": "ram_zeroshot-claude-agentic", "model": "claude-opus-4-8-1m", "change_class": "architecture", "status": "discard", "kept": false, "val_score": 0.9070974588394165, "headroom": 0.0, "params_M": 35.618953, "train_n": 400, "rationale": "ram_zeroshot-claude-agentic: ram_ckpt_path=/cluster/maier/Agent4CT/checkpoints/ram.pth.tar, ram_input_norm=fbp_max, ram_clamp_output=True, ram_finetune=False, ram_finetune_epochs=0, ram_finetune_lr=0.0001, ram_disable_multiscale=True, ram_disable_cudnn=False, ram_use_deepinv_tomo=False, ram_sigma=0.005, ram_factor=0.55, ram_post_fbp_blend=0.3, val_n=214, rationale=iter-7 (search-20260619-01) PATH B \u2014 RETIRE the finetune lever + CONFIRM the FBP-bound ceiling. BASE_ITER=5 (best inference config, SSIM 0.9071 hr 0.0: input_norm=fbp_max, factor=0.55, blend=0.3, sigma=0.005, multiscale off). The prior iter-7 (job 766130) set ram_finetune=True and TIMED OUT: ram.finetune runs PER-SLICE inside the per-slice loop (solver_ram.py L224-243, called at L417 inside for i in range(val_n)) on each slices own y_norm at 35.6M params, ~80s/slice x 214 = ~4.7h, hit the 30-min SLURM wall after ~22 slices, wrote NO row. The solver has NO amortize-once / finetune-subset / train-split knob \u2014 finetune is structurally per-sinogram, so PATH A (amortize-then-frozen) is NOT supportable via cfg flags alone (would require hoisting finetune out of the per-slice loop = editing the solver, forbidden). So PATH B: revert ram_finetune=False (pin off), ram_use_deepinv_tomo=False (revert the iter-6 regression probe back to the best inference path), all five inference-scalar levers already mapped at hr 0.0 (blend i2, prox_l2 factor i3, sigma i4, input_norm i5, deepinv-tomo DC path i6), best SSIM 0.9071 @ iter-5. SIX-BOX (NUMBERS not CT pixels): (1) trajectory SSIM 0.861->0.864->0.897->0.902->0.907 (iters 1-5) hr pinned 0.0 throughout; iter-6 deepinv-tomo + iter-7-prev finetune both regressions/timeouts. (2) LIMITER: budget-infeasible per-slice finetune (~80s/slice x214 = 4.7h, 14x over the HARD 1200s budget) + foreign-prior FBP-ceiling: RAM is a frozen zero-shot deepinv denoiser that never saw real LDCT helical-rebinned 2304-view fan data; on dense full-view Mayo LD-FBP is near-complete inversion, the foreign prior only redistributes/smooths -> RMSE stays above the LD-FBP floor (baseline SSIM 0.8078, oracle HD-FBP 0.9331; RAM PSNR ~31-33dB below LD-FBP floor) -> hr pinned 0. (3) ONE knob: ram_finetune True->False (retire the finetune lever; co-revert deepinv_tomo True->False to the best inference path). (4) hypothesis: hr stays EXACTLY 0.0 at SSIM ~0.9071 -- with finetune budget-infeasible AND all five inference levers exhausted, RAM is CONFIRMED structurally FBP-bounded on dense 2304-view Mayo. (5) NUMERIC falsifier: if this clean revert lands hr != 0.0 OR SSIM != ~0.907, the prior iter-5 read was not stable; otherwise the ceiling is confirmed and the finetune lever is retired as budget-infeasible (not as a negative architectural result). (6) no control return. BUDGET ARITHMETIC proving <=1200s: this is INFERENCE-ONLY (ram_finetune=False), identical compute profile to iter-5 (985.9s = 16.4 min, well under the HARD 1200s = 20-min budget). Per-slice cost = ~4.6s/slice x 214 single forward passes + one op-norm power iter = ~985s; ram_use_deepinv_tomo=False avoids the extra deepinv-tomo physics evals so this is at or slightly UNDER iter-5s 985.9s. ZERO finetune cost added (finetune off). sbatch --time=00:30:00 backstop. HARD-WIRED: staged_canonical, v3 mayo_ldct_fitted, per-sample-ps (single-val-ps probe, val-only solver), bg_target=truth, val=ALL 214 L277 slices, 321px FOV DEFAULT (no fov=False).", "advice_for_others": "ram_zeroshot-claude-agentic: ram_ckpt_path=/cluster/maier/Agent4CT/checkpoints/ram.pth.tar, ram_input_norm=fbp_max, ram_clamp_output=True, ram_finetune=False, ram_finetune_epochs=0, ram_finetune_lr=0.0001, ram_disable_multiscale=True, ram_disable_cudnn=False, ram_use_deepinv_tomo=False, ram_sigma=0.005, ram_factor=0.55, ram_post_fbp_blend=0.3, val_n=214, rationale=iter-7 (search-20260619-01) PATH B \u2014 RETIRE the finetune lever + CONFIRM the FBP-bound ceiling. BASE_ITER=5 (best inference config, SSIM 0.9071 hr 0.0: input_norm=fbp_max, factor=0.55, blend=0.3, sigma=0.005, multiscale off). The prior iter-7 (job 766130) set ram_finetune=True and TIMED OUT: ram.finetune runs PER-SLICE inside the per-slice loop (solver_ram.py L224-243, called at L417 inside for i in range(val_n)) on each slices own y_norm at 35.6M params, ~80s/slice x 214 = ~4.7h, hit the 30-min SLURM wall after ~22 slices, wrote NO row. The solver has NO amortize-once / finetune-subset / train-split knob \u2014 finetune is structurally per-sinogram, so PATH A (amortize-then-frozen) is NOT supportable via cfg flags alone (would require hoisting finetune out of the per-slice loop = editing the solver, forbidden). So PATH B: revert ram_finetune=False (pin off), ram_use_deepinv_tomo=False (revert the iter-6 regression probe back to the best inference path), all five inference-scalar levers already mapped at hr 0.0 (blend i2, prox_l2 factor i3, sigma i4, input_norm i5, deepinv-tomo DC path i6), best SSIM 0.9071 @ iter-5. SIX-BOX (NUMBERS not CT pixels): (1) trajectory SSIM 0.861->0.864->0.897->0.902->0.907 (iters 1-5) hr pinned 0.0 throughout; iter-6 deepinv-tomo + iter-7-prev finetune both regressions/timeouts. (2) LIMITER: budget-infeasible per-slice finetune (~80s/slice x214 = 4.7h, 14x over the HARD 1200s budget) + foreign-prior FBP-ceiling: RAM is a frozen zero-shot deepinv denoiser that never saw real LDCT helical-rebinned 2304-view fan data; on dense full-view Mayo LD-FBP is near-complete inversion, the foreign prior only redistributes/smooths -> RMSE stays above the LD-FBP floor (baseline SSIM 0.8078, oracle HD-FBP 0.9331; RAM PSNR ~31-33dB below LD-FBP floor) -> hr pinned 0. (3) ONE knob: ram_finetune True->False (retire the finetune lever; co-revert deepinv_tomo True->False to the best inference path). (4) hypothesis: hr stays EXACTLY 0.0 at SSIM ~0.9071 -- with finetune budget-infeasible AND all five inference levers exhausted, RAM is CONFIRMED structurally FBP-bounded on dense 2304-view Mayo. (5) NUMERIC falsifier: if this clean revert lands hr != 0.0 OR SSIM != ~0.907, the prior iter-5 read was not stable; otherwise the ceiling is confirmed and the finetune lever is retired as budget-infeasible (not as a negative architectural result). (6) no control return. BUDGET ARITHMETIC proving <=1200s: this is INFERENCE-ONLY (ram_finetune=False), identical compute profile to iter-5 (985.9s = 16.4 min, well under the HARD 1200s = 20-min budget). Per-slice cost = ~4.6s/slice x 214 single forward passes + one op-norm power iter = ~985s; ram_use_deepinv_tomo=False avoids the extra deepinv-tomo physics evals so this is at or slightly UNDER iter-5s 985.9s. ZERO finetune cost added (finetune off). sbatch --time=00:30:00 backstop. HARD-WIRED: staged_canonical, v3 mayo_ldct_fitted, per-sample-ps (single-val-ps probe, val-only solver), bg_target=truth, val=ALL 214 L277 slices, 321px FOV DEFAULT (no fov=False).", "comparison_image": "runs/mayo-ldct-claude-agentic-ram-search-20260619-01/iterations/iter-0007/comparison.png"}
