{"ts": "2026-06-21T19:51:22Z", "run_id": "mayo-ldct-claude-agentic-uswin-search-20260619-01", "iter": 11, "agent": "uswin-claude-agentic", "model": "claude-opus-4-8-1m", "change_class": "architecture", "status": "keep", "kept": true, "val_score": 0.9394814968109131, "headroom": 0.4192524096021679, "params_M": 3.954049, "train_n": 400, "rationale": "uswin-claude-agentic: train_n=579, val_n=214, epochs=22, batch_size=4, lr=0.0005, uswin_c=24, swin_window=8, swin_heads=4, grad_clip=1.0, max_train_s=960, seed=123, rationale=iter-11 clean empty-patch confirmation: #4 hr 0.4208, all levers (data, epochs, capacity, lr, seed) exhausted. Documents ceiling toward iter-20.", "advice_for_others": "uswin-claude-agentic: train_n=579, val_n=214, epochs=22, batch_size=4, lr=0.0005, uswin_c=24, swin_window=8, swin_heads=4, grad_clip=1.0, max_train_s=960, seed=123, rationale=iter-11 clean empty-patch confirmation: #4 hr 0.4208, all levers (data, epochs, capacity, lr, seed) exhausted. Documents ceiling toward iter-20.", "comparison_image": "runs/mayo-ldct-claude-agentic-uswin-search-20260619-01/iterations/iter-0011/comparison.png"}
{"ts": "2026-06-21T19:48:21Z", "run_id": "mayo-ldct-claude-agentic-itnet-v3-search-20260619-01", "iter": 11, "agent": "itnet_v3-claude-agentic", "model": "claude-opus-4-8-1m", "change_class": "architecture", "status": "keep", "kept": true, "val_score": 0.9297524094581604, "headroom": 0.36168581549937495, "params_M": 3.698994, "train_n": 400, "rationale": "itnet_v3-claude-agentic: itnet_k=2, unet_c=16, alpha_init=0.0037, lr=0.0001, epochs=9, batch_size=1, val_chunk=1, train_n=460, val_n=214, grad_clip=1.0, max_train_s=720, seed=123, rationale=iter-11 clean empty-patch confirmation: #5 hr 0.3623, itnet_k=2 breakout + data + seed exhausted, lr-fragile. Documents ceiling toward iter-20.", "advice_for_others": "itnet_v3-claude-agentic: itnet_k=2, unet_c=16, alpha_init=0.0037, lr=0.0001, epochs=9, batch_size=1, val_chunk=1, train_n=460, val_n=214, grad_clip=1.0, max_train_s=720, seed=123, rationale=iter-11 clean empty-patch confirmation: #5 hr 0.3623, itnet_k=2 breakout + data + seed exhausted, lr-fragile. Documents ceiling toward iter-20.", "comparison_image": "runs/mayo-ldct-claude-agentic-itnet-v3-search-20260619-01/iterations/iter-0011/comparison.png"}
{"ts": "2026-06-21T19:34:11Z", "run_id": "mayo-ldct-claude-agentic-dual-domain-supervised-search-20260619-01", "iter": 11, "agent": "dual_domain_supervised-claude-agentic", "model": "claude-opus-4-8-1m", "change_class": "architecture", "status": "keep", "kept": true, "val_score": 0.9327565431594849, "headroom": 0.4167421093115945, "params_M": 0.465762, "train_n": 400, "rationale": "dual_domain_supervised-claude-agentic: unet_c=16, lr=0.0001, epochs=10, batch_size=1, val_chunk=1, train_n=579, val_n=214, grad_clip=1.0, lambda_neg=1.0, seed=123, rationale=iter-11 clean empty-patch confirmation: #3 hr 0.4217, all levers + 3 seeds exhausted (per-init floor ~0.419 +-0.003). Documents ceiling toward iter-20.", "advice_for_others": "dual_domain_supervised-claude-agentic: unet_c=16, lr=0.0001, epochs=10, batch_size=1, val_chunk=1, train_n=579, val_n=214, grad_clip=1.0, lambda_neg=1.0, seed=123, rationale=iter-11 clean empty-patch confirmation: #3 hr 0.4217, all levers + 3 seeds exhausted (per-init floor ~0.419 +-0.003). Documents ceiling toward iter-20.", "comparison_image": "runs/mayo-ldct-claude-agentic-dual-domain-supervised-search-20260619-01/iterations/iter-0011/comparison.png"}
{"ts": "2026-06-21T19:32:28Z", "run_id": "mayo-ldct-claude-agentic-diff-recon-dcstep-constrained-mayo-v4-search-20260619-01", "iter": 10, "agent": "diffusion_recon_dcstep_constrained_mayo_v4-claude-agentic", "model": "claude-opus-4-8-1m", "change_class": "architecture", "status": "discard", "kept": false, "val_score": 0.8533483147621155, "headroom": 0.0, "params_M": 8.594211, "train_n": 400, "rationale": "diffusion_recon_dcstep_constrained_mayo_v4-claude-agentic: recon_ckpt=/cluster/maier/Agent4CT/checkpoints/ddpm_mayo_constrained_v4.pt, recon_mode=dps, recon_sample_steps=80, recon_eta=30.0, recon_init=fbp, recon_eta_clamp=False, recon_dcstep_every=5, recon_dcstep_n_cg=3, recon_dcstep_warmup=5, recon_dcstep_relax=1.0, recon_dc_solver=cg, val_n=70, train_n=0, rationale=iter-10 clean empty-patch confirmation: NFE at val_n floor + eta inert on CG-DC path; only deferred v5 EMA prior remains. Documents SSIM 0.8533 hr0 faithful-but-regime-bounded toward iter-20.", "advice_for_others": "diffusion_recon_dcstep_constrained_mayo_v4-claude-agentic: recon_ckpt=/cluster/maier/Agent4CT/checkpoints/ddpm_mayo_constrained_v4.pt, recon_mode=dps, recon_sample_steps=80, recon_eta=30.0, recon_init=fbp, recon_eta_clamp=False, recon_dcstep_every=5, recon_dcstep_n_cg=3, recon_dcstep_warmup=5, recon_dcstep_relax=1.0, recon_dc_solver=cg, val_n=70, train_n=0, rationale=iter-10 clean empty-patch confirmation: NFE at val_n floor + eta inert on CG-DC path; only deferred v5 EMA prior remains. Documents SSIM 0.8533 hr0 faithful-but-regime-bounded toward iter-20.", "comparison_image": "runs/mayo-ldct-claude-agentic-diff-recon-dcstep-constrained-mayo-v4-search-20260619-01/iterations/iter-0010/comparison.png"}
{"ts": "2026-06-21T19:30:30Z", "run_id": "mayo-ldct-claude-agentic-itnet-v2-search-20260619-01", "iter": 11, "agent": "itnet_v2-claude-agentic", "model": "claude-opus-4-8-1m", "change_class": "architecture", "status": "keep", "kept": true, "val_score": 0.9436903595924377, "headroom": 0.43185300911657987, "params_M": 0.232882, "train_n": 400, "rationale": "itnet_v2-claude-agentic: itnet_k=1, unet_c=16, itnet_alpha_init=0.0037, residual_learning=False, pretrain_lr=0.0001, pretrain_epochs=72, pretrain_patience=72, batch_size=1, val_chunk=1, train_n=579, val_n=214, grad_clip=1.0, max_train_s=1050, seed=42, rationale=iter-11 clean empty-patch confirmation: #2 hr 0.4302, all levers (k=1, train_n=579, capacity, epochs, seed) exhausted. Documents ceiling toward iter-20.", "advice_for_others": "itnet_v2-claude-agentic: itnet_k=1, unet_c=16, itnet_alpha_init=0.0037, residual_learning=False, pretrain_lr=0.0001, pretrain_epochs=72, pretrain_patience=72, batch_size=1, val_chunk=1, train_n=579, val_n=214, grad_clip=1.0, max_train_s=1050, seed=42, rationale=iter-11 clean empty-patch confirmation: #2 hr 0.4302, all levers (k=1, train_n=579, capacity, epochs, seed) exhausted. Documents ceiling toward iter-20.", "comparison_image": "runs/mayo-ldct-claude-agentic-itnet-v2-search-20260619-01/iterations/iter-0011/comparison.png"}
{"ts": "2026-06-21T19:29:07Z", "run_id": "mayo-ldct-claude-agentic-itnet-search-20260619-01", "iter": 11, "agent": "itnet-claude-agentic", "model": "claude-opus-4-8-1m", "change_class": "architecture", "status": "keep", "kept": true, "val_score": 0.9448974132537842, "headroom": 0.4363067449080188, "params_M": 0.232881, "train_n": 400, "rationale": "itnet-claude-agentic: pretrain_epochs=66, pretrain_lr=0.0001, itnet_k=1, itnet_alpha=0.005, unet_c=16, finetune_epochs=0, finetune_lr=0.0001, train_n=579, val_n=214, grad_clip=1.0, seed=42, rationale=iter-11 clean empty-patch confirmation: champion hr 0.4344, all levers (k=1, train_n=579, epochs) exhausted. Documents budget-constrained ceiling toward iter-20.", "advice_for_others": "itnet-claude-agentic: pretrain_epochs=66, pretrain_lr=0.0001, itnet_k=1, itnet_alpha=0.005, unet_c=16, finetune_epochs=0, finetune_lr=0.0001, train_n=579, val_n=214, grad_clip=1.0, seed=42, rationale=iter-11 clean empty-patch confirmation: champion hr 0.4344, all levers (k=1, train_n=579, epochs) exhausted. Documents budget-constrained ceiling toward iter-20.", "comparison_image": "runs/mayo-ldct-claude-agentic-itnet-search-20260619-01/iterations/iter-0011/comparison.png"}
{"ts": "2026-06-21T19:06:43Z", "run_id": "mayo-ldct-claude-agentic-ram-search-20260619-01", "iter": 10, "agent": "ram_zeroshot-claude-agentic", "model": "claude-opus-4-8-1m", "change_class": "architecture", "status": "discard", "kept": false, "val_score": 0.9070974588394165, "headroom": 0.0, "params_M": 35.618953, "train_n": 400, "rationale": "ram_zeroshot-claude-agentic: ram_ckpt_path=/cluster/maier/Agent4CT/checkpoints/ram.pth.tar, ram_input_norm=fbp_max, ram_clamp_output=True, ram_finetune=False, ram_finetune_epochs=0, ram_finetune_lr=0.0001, ram_disable_multiscale=True, ram_disable_cudnn=False, ram_use_deepinv_tomo=False, ram_sigma=0.005, ram_factor=0.55, ram_post_fbp_blend=0.3, val_n=214, rationale=iter-10 clean empty-patch confirmation: RAM deterministic + fully ceiling-confirmed (all 5 inference levers mapped, finetune budget-infeasible, no seed effect). Documents FBP-bound 0.9071 hr0 toward iter-20.", "advice_for_others": "ram_zeroshot-claude-agentic: ram_ckpt_path=/cluster/maier/Agent4CT/checkpoints/ram.pth.tar, ram_input_norm=fbp_max, ram_clamp_output=True, ram_finetune=False, ram_finetune_epochs=0, ram_finetune_lr=0.0001, ram_disable_multiscale=True, ram_disable_cudnn=False, ram_use_deepinv_tomo=False, ram_sigma=0.005, ram_factor=0.55, ram_post_fbp_blend=0.3, val_n=214, rationale=iter-10 clean empty-patch confirmation: RAM deterministic + fully ceiling-confirmed (all 5 inference levers mapped, finetune budget-infeasible, no seed effect). Documents FBP-bound 0.9071 hr0 toward iter-20.", "comparison_image": "runs/mayo-ldct-claude-agentic-ram-search-20260619-01/iterations/iter-0010/comparison.png"}
{"ts": "2026-06-21T18:59:46Z", "run_id": "mayo-ldct-claude-agentic-diff-recon-dcstep-unconstrained-mayo-v4-search-20260619-01", "iter": 10, "agent": "diffusion_recon_dcstep_unconstrained_mayo_v4-claude-agentic", "model": "claude-opus-4-8-1m", "change_class": "architecture", "status": "discard", "kept": false, "val_score": 0.8784139752388, "headroom": 0.0, "params_M": 8.594211, "train_n": 400, "rationale": "diffusion_recon_dcstep_unconstrained_mayo_v4-claude-agentic: recon_ckpt=/cluster/maier/Agent4CT/checkpoints/ddpm_mayo_unconstrained_v4.pt, recon_mode=dps, recon_sample_steps=72, recon_eta=5.0, recon_init=fbp, recon_eta_clamp=False, recon_dcstep_every=5, recon_dcstep_n_cg=3, recon_dcstep_warmup=5, recon_dcstep_relax=1.0, recon_dc_solver=cg, val_n=72, train_n=0, rationale=iter-10 clean empty-patch confirmation: NFE at val_n floor + eta inert on CG-DC path; only the deferred v5 EMA prior remains. Documents SSIM 0.8784 hr0 faithful-but-regime-bounded toward iter-20.", "advice_for_others": "diffusion_recon_dcstep_unconstrained_mayo_v4-claude-agentic: recon_ckpt=/cluster/maier/Agent4CT/checkpoints/ddpm_mayo_unconstrained_v4.pt, recon_mode=dps, recon_sample_steps=72, recon_eta=5.0, recon_init=fbp, recon_eta_clamp=False, recon_dcstep_every=5, recon_dcstep_n_cg=3, recon_dcstep_warmup=5, recon_dcstep_relax=1.0, recon_dc_solver=cg, val_n=72, train_n=0, rationale=iter-10 clean empty-patch confirmation: NFE at val_n floor + eta inert on CG-DC path; only the deferred v5 EMA prior remains. Documents SSIM 0.8784 hr0 faithful-but-regime-bounded toward iter-20.", "comparison_image": "runs/mayo-ldct-claude-agentic-diff-recon-dcstep-unconstrained-mayo-v4-search-20260619-01/iterations/iter-0010/comparison.png"}
{"ts": "2026-06-21T18:56:33Z", "run_id": "mayo-ldct-claude-agentic-dual-domain-bilateral-n2i-search-20260619-01", "iter": 10, "agent": "dual_domain_bilateral_n2i-claude-agentic", "model": "claude-opus-4-8-1m", "change_class": "architecture", "status": "discard", "kept": false, "val_score": 0.9254710674285889, "headroom": 0.0, "params_M": 1.2e-05, "train_n": 400, "rationale": "dual_domain_bilateral_n2i-claude-agentic: warm_start=True, pretrain_epochs=1, pretrain_steps=20, n_iter=30, grad_clip=1.0, lr=0.005, proj_n_bf=3, img_n_bf=1, proj_kernel=5, proj_sx=1.0, proj_sy=2.0, proj_sr=0.02, img_kernel=7, img_sx=1.5, img_sy=1.5, img_sr=0.02, batch_size=1, train_n=200, val_n=214, outer_wall_s=1050, per_scene_s=None, seed=42, rationale=iter-10 clean empty-patch confirmation: 6-param bilateral N2I, all proj-domain shape knobs + seed mapped. Documents hr0/SSIM~0.9253 half-view ceiling toward iter-20.", "advice_for_others": "dual_domain_bilateral_n2i-claude-agentic: warm_start=True, pretrain_epochs=1, pretrain_steps=20, n_iter=30, grad_clip=1.0, lr=0.005, proj_n_bf=3, img_n_bf=1, proj_kernel=5, proj_sx=1.0, proj_sy=2.0, proj_sr=0.02, img_kernel=7, img_sx=1.5, img_sy=1.5, img_sr=0.02, batch_size=1, train_n=200, val_n=214, outer_wall_s=1050, per_scene_s=None, seed=42, rationale=iter-10 clean empty-patch confirmation: 6-param bilateral N2I, all proj-domain shape knobs + seed mapped. Documents hr0/SSIM~0.9253 half-view ceiling toward iter-20.", "comparison_image": "runs/mayo-ldct-claude-agentic-dual-domain-bilateral-n2i-search-20260619-01/iterations/iter-0010/comparison.png"}
{"ts": "2026-06-21T18:21:20Z", "run_id": "mayo-ldct-claude-agentic-learned-primal-dual-search-20260619-01", "iter": 10, "agent": "learned_primal_dual-claude-agentic", "model": "claude-opus-4-8-1m", "change_class": "architecture", "status": "discard", "kept": false, "val_score": 0.8791189789772034, "headroom": 0.0, "params_M": 0.155406, "train_n": 400, "rationale": "learned_primal_dual-claude-agentic: lpd_iters=3, lpd_hidden=48, lpd_n_primal=5, lpd_n_dual=5, lpd_share_weights=False, lr=0.0007, lr_schedule=cosine, epochs=10, batch_size=1, val_chunk=1, train_n=200, val_n=214, grad_clip=1.0, seed=42, rationale=iter-10 search-20260619-01: CLEAN DOCUMENTATION RE-DISPATCH of the iter-4 BEST config (PATCH={} -> exact iter-4: lpd_iters=3, lpd_hidden=48, n_primal=5, n_dual=5, lr=7e-4 cosine, epochs=10, train_n=200, batch=1, val_chunk=1, val_n=214, grad_clip=1.0, seed=42). BASE_ITER=4 (BEST SSIM 0.898033, hr0). HONESTLY a confirmation iter, NOT an untried lever: every genuinely-LPD axis is exhausted across iters 1-9 (ALL hr=0). ARC: 0.84271(it1 iters5/ep6/lr5e-4) -> 0.863635(it2 iters3/ep10) -> 0.885115(it3 ep11 OVER-wall) -> 0.898033(it4 BEST lr7e-4) -> 0.88446(it5 tn300/ep7) -> 0.831302(it6 iters5 deeper-unroll WORSE) -> 0.866666(it7 tn400/ep5 grad-step-parity FELL) -> 0.879511(it8 seed123) -> 0.835556(it9 seed7). LIMITER = FBP-BOUND on DENSE 2304-view Mayo, NOT budget-starved: every axis pushed, all hr=0 -> epochs (SSIM 0.843->0.898 yet hr0, wall-capped), unroll depth (lpd_iters=5 strictly HURT SSIM BOTH tries it1/it6 -- the LPD-defining lever is net-NEGATIVE on dense Mayo), data coverage at grad-step parity (it7 tn400 vs it4 tn200, identical 2000 steps -> SSIM FELL 0.898->0.867), 2 seeds (it8 seed123 0.8795, it9 seed7 0.8356, basin spread). KNOB-SPACE EXHAUSTED: lpd_n_primal/n_dual fixed at 5 (Adler default), lr_schedule cosine-only (no warmup/onecycle exists), lr 7e-4 is peak (6e-4 anomalous-collapse, lower regressed), grad_clip retained; lpd_hidden^ adds per-sample projector cost forcing an epoch cut below the it6/it7 under-train floor AND capacity was never the limiter (structural FBP-completeness is). Mechanism: LPD learned proximal updates only add value where the FBP adjoint leaves residual ill-posedness (128-view SPARSE -> champion hr0.9062 breast / 0.4947 demo); at 2304 views >> Nyquist the LD-FBP is near-complete so the unrolled correction has no headroom -- sharpens structure (rising SSIM) but cannot push RMSE below the near-optimal LD-FBP floor (hr0). There is NO untried in-budget lever left. This re-dispatch of the iter-4 best documents LPD as FBP-bounded on dense Mayo toward iter-20 (best-of-best reproducibility anchor). BUDGET MATH vs 1200s: it4 ran ep10*tn200=2000 grad-steps in 1100.7s=18.35min; it8 (same steps) ran 1099.1s, it9 1077.7s -> PATCH={} is COMPUTE-IDENTICAL (zero FLOP change) -> ~1100s=18.3min, +100s margin under the 1200s wall. lpd_iters^/lpd_hidden^/epochs^ stay OFF (it1 iters5 hit 1149.5s=19.2min, it3 ep11 hit 1213.6s=20.2min OVER). HYP: SSIM ~0.898 (the seed-42 basin center, it4 0.898 reproduced) with hr still 0.000 -> definitively documents the FBP-bound ceiling. NUMERIC FALSIFIER: SSIM > 0.913 (it4 + 0.015) OR hr > 0.000 -> unexpected init/run-to-run headroom worth a seed sweep rather than a closed ceiling.", "advice_for_others": "learned_primal_dual-claude-agentic: lpd_iters=3, lpd_hidden=48, lpd_n_primal=5, lpd_n_dual=5, lpd_share_weights=False, lr=0.0007, lr_schedule=cosine, epochs=10, batch_size=1, val_chunk=1, train_n=200, val_n=214, grad_clip=1.0, seed=42, rationale=iter-10 search-20260619-01: CLEAN DOCUMENTATION RE-DISPATCH of the iter-4 BEST config (PATCH={} -> exact iter-4: lpd_iters=3, lpd_hidden=48, n_primal=5, n_dual=5, lr=7e-4 cosine, epochs=10, train_n=200, batch=1, val_chunk=1, val_n=214, grad_clip=1.0, seed=42). BASE_ITER=4 (BEST SSIM 0.898033, hr0). HONESTLY a confirmation iter, NOT an untried lever: every genuinely-LPD axis is exhausted across iters 1-9 (ALL hr=0). ARC: 0.84271(it1 iters5/ep6/lr5e-4) -> 0.863635(it2 iters3/ep10) -> 0.885115(it3 ep11 OVER-wall) -> 0.898033(it4 BEST lr7e-4) -> 0.88446(it5 tn300/ep7) -> 0.831302(it6 iters5 deeper-unroll WORSE) -> 0.866666(it7 tn400/ep5 grad-step-parity FELL) -> 0.879511(it8 seed123) -> 0.835556(it9 seed7). LIMITER = FBP-BOUND on DENSE 2304-view Mayo, NOT budget-starved: every axis pushed, all hr=0 -> epochs (SSIM 0.843->0.898 yet hr0, wall-capped), unroll depth (lpd_iters=5 strictly HURT SSIM BOTH tries it1/it6 -- the LPD-defining lever is net-NEGATIVE on dense Mayo), data coverage at grad-step parity (it7 tn400 vs it4 tn200, identical 2000 steps -> SSIM FELL 0.898->0.867), 2 seeds (it8 seed123 0.8795, it9 seed7 0.8356, basin spread). KNOB-SPACE EXHAUSTED: lpd_n_primal/n_dual fixed at 5 (Adler default), lr_schedule cosine-only (no warmup/onecycle exists), lr 7e-4 is peak (6e-4 anomalous-collapse, lower regressed), grad_clip retained; lpd_hidden^ adds per-sample projector cost forcing an epoch cut below the it6/it7 under-train floor AND capacity was never the limiter (structural FBP-completeness is). Mechanism: LPD learned proximal updates only add value where the FBP adjoint leaves residual ill-posedness (128-view SPARSE -> champion hr0.9062 breast / 0.4947 demo); at 2304 views >> Nyquist the LD-FBP is near-complete so the unrolled correction has no headroom -- sharpens structure (rising SSIM) but cannot push RMSE below the near-optimal LD-FBP floor (hr0). There is NO untried in-budget lever left. This re-dispatch of the iter-4 best documents LPD as FBP-bounded on dense Mayo toward iter-20 (best-of-best reproducibility anchor). BUDGET MATH vs 1200s: it4 ran ep10*tn200=2000 grad-steps in 1100.7s=18.35min; it8 (same steps) ran 1099.1s, it9 1077.7s -> PATCH={} is COMPUTE-IDENTICAL (zero FLOP change) -> ~1100s=18.3min, +100s margin under the 1200s wall. lpd_iters^/lpd_hidden^/epochs^ stay OFF (it1 iters5 hit 1149.5s=19.2min, it3 ep11 hit 1213.6s=20.2min OVER). HYP: SSIM ~0.898 (the seed-42 basin center, it4 0.898 reproduced) with hr still 0.000 -> definitively documents the FBP-bound ceiling. NUMERIC FALSIFIER: SSIM > 0.913 (it4 + 0.015) OR hr > 0.000 -> unexpected init/run-to-run headroom worth a seed sweep rather than a closed ceiling.", "comparison_image": "runs/mayo-ldct-claude-agentic-learned-primal-dual-search-20260619-01/iterations/iter-0010/comparison.png"}
