{"ts": "2026-06-21T17:45:51Z", "run_id": "mayo-ldct-claude-agentic-tv-iterative-supervised-search-20260619-01", "iter": 10, "agent": "tv_iterative_supervised-claude-agentic", "model": "claude-opus-4-8-1m", "change_class": "architecture", "status": "discard", "kept": false, "val_score": 0.8192296624183655, "headroom": 0.0, "params_M": 2e-06, "train_n": 400, "rationale": "tv_iterative_supervised-claude-agentic: val_n=214, val_chunk=5, train_n=40, epochs=8, batch_size=1, lr=0.005, tv_K=8, tv_step_init=1e-05, tv_lambda_init=0.001, tv_share_steps=True, tv_clip_max=0.05, tv_eps=1e-06, lambda_neg=1.0, loss_base=mse, grad_clip=1.0, rationale=tv_iterative_supervised iter-10 (search-20260619-01, corrected 214-slice/321px-FOV metric). BASE_ITER=7 (BEST SSIM 0.8192 / hr 0.0, the stable share=True step=1e-5 lr=5e-3 K=8 config). CLEAN CONFIRMATION re-dispatch (empty patch {}): every in-budget lever is mapped+falsified, no untried single knob remains. TRAJECTORY (SSIM/hr): iter-1 K=10 0.2855/0; iter-2 K=30 0.2855/0 (depth inert at frozen-step); iter-3 step=1e-8 0.8137/0 (LD-FBP PASSTHROUGH); iter-4 step=1e-5 share=F 0.6949/0 (per-step RUNAWAY); iter-5 share=T 0.6074/0 (LAMBDA runaway); iter-6 lr 5e-2->5e-3 0.8185/0 (recovered to FBP floor); iter-7 tv_K 30->8 0.8192/0 (BEST; depth-DOWN did NOT break out -> sits at FBP passthrough floor); iter-8 train_n 40->160 0.8186/0 (CAPACITY-bound not data-bound); iter-9 seed default->123 0.8192/0 (delta -4.4e-6 -> SEED-ROBUST). BEST SSIM 0.8192 (iter-7); hr=0.0 EVERY iter. MAPPED+FALSIFIED: tv_step_init {1e-2 saturate, 1e-8 passthrough, 1e-5 active}; tv_share_steps {F runaway, T stable}; tv_lr {5e-2 over-drives, 5e-3 stable}; tv_K {10/30 inert at frozen-step, 8 flat at stable regime}; train_n {40 base, 160 flat}; seed {default, 123 within noise}. LIMITER: capacity-bound supervised-TV at the LD-FBP passthrough floor -- only 2 trainable scalars (share=True) settle into a near-identity map on fbp_init; SSIM pinned ~0.8192 across depth, data-coverage AND seed axes. NO untried in-budget single lever remains. HYPOTHESIS: re-dispatching iter-7 reproduces SSIM ~0.8192 (within +-0.001 of 0.81923), documenting the supervised-unrolled-TV FBP-ceiling deterministically toward iter-20. NUMERIC FALSIFIER: if SSIM outside [0.8182, 0.8202] with hr=0.0, reproducibility itself is a finding; if SSIM in band with hr=0.0, the supervised-TV FBP-ceiling is CONFIRMED reproducible on real Mayo 2304-view LDCT under the config-only contract (the shared solvers raw unnormalized-adjoint back_project step is FORBIDDEN to edit) -> documentation iter. BUDGET (HARD 20-min train+score = 1200s): IDENTICAL compute to iter-7 (empty patch -> same K=8, train_n=40, epochs=8, bs=1, val_n=214, val_chunk=5) -> ~260.7s measured iter-7 / 259.6s iter-9, vast >900s margin under the 1200s wall; sbatch --time=00:30:00 carries figure/IO headroom. PREDICTED iter-10: SSIM ~0.8192 +-0.001, hr 0.0. This is a CLEAN DOCUMENTATION iter: re-confirms the supervised-TV FBP-ceiling toward the iter-20 hard stop.", "advice_for_others": "tv_iterative_supervised-claude-agentic: val_n=214, val_chunk=5, train_n=40, epochs=8, batch_size=1, lr=0.005, tv_K=8, tv_step_init=1e-05, tv_lambda_init=0.001, tv_share_steps=True, tv_clip_max=0.05, tv_eps=1e-06, lambda_neg=1.0, loss_base=mse, grad_clip=1.0, rationale=tv_iterative_supervised iter-10 (search-20260619-01, corrected 214-slice/321px-FOV metric). BASE_ITER=7 (BEST SSIM 0.8192 / hr 0.0, the stable share=True step=1e-5 lr=5e-3 K=8 config). CLEAN CONFIRMATION re-dispatch (empty patch {}): every in-budget lever is mapped+falsified, no untried single knob remains. TRAJECTORY (SSIM/hr): iter-1 K=10 0.2855/0; iter-2 K=30 0.2855/0 (depth inert at frozen-step); iter-3 step=1e-8 0.8137/0 (LD-FBP PASSTHROUGH); iter-4 step=1e-5 share=F 0.6949/0 (per-step RUNAWAY); iter-5 share=T 0.6074/0 (LAMBDA runaway); iter-6 lr 5e-2->5e-3 0.8185/0 (recovered to FBP floor); iter-7 tv_K 30->8 0.8192/0 (BEST; depth-DOWN did NOT break out -> sits at FBP passthrough floor); iter-8 train_n 40->160 0.8186/0 (CAPACITY-bound not data-bound); iter-9 seed default->123 0.8192/0 (delta -4.4e-6 -> SEED-ROBUST). BEST SSIM 0.8192 (iter-7); hr=0.0 EVERY iter. MAPPED+FALSIFIED: tv_step_init {1e-2 saturate, 1e-8 passthrough, 1e-5 active}; tv_share_steps {F runaway, T stable}; tv_lr {5e-2 over-drives, 5e-3 stable}; tv_K {10/30 inert at frozen-step, 8 flat at stable regime}; train_n {40 base, 160 flat}; seed {default, 123 within noise}. LIMITER: capacity-bound supervised-TV at the LD-FBP passthrough floor -- only 2 trainable scalars (share=True) settle into a near-identity map on fbp_init; SSIM pinned ~0.8192 across depth, data-coverage AND seed axes. NO untried in-budget single lever remains. HYPOTHESIS: re-dispatching iter-7 reproduces SSIM ~0.8192 (within +-0.001 of 0.81923), documenting the supervised-unrolled-TV FBP-ceiling deterministically toward iter-20. NUMERIC FALSIFIER: if SSIM outside [0.8182, 0.8202] with hr=0.0, reproducibility itself is a finding; if SSIM in band with hr=0.0, the supervised-TV FBP-ceiling is CONFIRMED reproducible on real Mayo 2304-view LDCT under the config-only contract (the shared solvers raw unnormalized-adjoint back_project step is FORBIDDEN to edit) -> documentation iter. BUDGET (HARD 20-min train+score = 1200s): IDENTICAL compute to iter-7 (empty patch -> same K=8, train_n=40, epochs=8, bs=1, val_n=214, val_chunk=5) -> ~260.7s measured iter-7 / 259.6s iter-9, vast >900s margin under the 1200s wall; sbatch --time=00:30:00 carries figure/IO headroom. PREDICTED iter-10: SSIM ~0.8192 +-0.001, hr 0.0. This is a CLEAN DOCUMENTATION iter: re-confirms the supervised-TV FBP-ceiling toward the iter-20 hard stop.", "comparison_image": "runs/mayo-ldct-claude-agentic-tv-iterative-supervised-search-20260619-01/iterations/iter-0010/comparison.png"}
{"ts": "2026-06-21T17:45:31Z", "run_id": "mayo-ldct-claude-agentic-hammernik-2017-search-20260619-01", "iter": 10, "agent": "hammernik_2017-claude-agentic", "model": "claude-opus-4-8-1m", "change_class": "architecture", "status": "keep", "kept": true, "val_score": 0.8215878009796143, "headroom": 0.07027027599821833, "params_M": 0.012165, "train_n": 400, "rationale": "hammernik_2017-claude-agentic: vn_T=5, vn_n_filters=16, vn_kernel=11, vn_n_bumps=31, vn_x_range=2.0, vn_lambda_init=0.0023, epochs=4, batch_size=1, lr=0.0005, grad_clip=1.0, train_n=579, val_n=214, max_train_s=1050, seed=42, rationale=hammernik_2017 iter-10 (search-20260619-01, corrected 214-slice/321px-FOV metric). ONE KNOB: train_n 480 -> 579 (FULL TRAIN POOL, the last data-coverage step). BASE_ITER=9 (the BEST + above-baseline point: SSIM 0.8181, hr 0.0392, train_n480/vn_T5/ep4/bs1/lr5e-4/lambda0.0023/n_filters16). epochs held at 4 (NOT a second hypothesis knob -- 579x4=2316 grad steps stays in budget and gives MORE full-pool exposure, the headroom is safety margin). all else held at iter-9 (vn_T=5, vn_n_filters=16, vn_kernel=11, vn_n_bumps=31, vn_x_range=2.0, vn_lambda_init=0.0023, batch_size=1, lr=5e-4, grad_clip=1.0, val_n=214, max_train_s=1050, seed=42). TRAJECTORY (corrected metric): iter-1 OOM(bs4); iter-2 0.8012 hr0; iter-3 0.7932 hr0 (lambda UP REGRESSED); iter-4 0.7828 hr0 (n_filters DOWN REGRESSED); iter-5 0.8114 hr0.0319 KEEP (epochs UP, first above ~0.84 LD-FBP floor); iter-6 0.7883 hr0 DISCARD (lr DOWN REGRESSED); iter-7 0.8170 hr0.0375 KEEP (bs 2->1 DOWN); iter-8 0.7935 hr0 DISCARD (vn_T 5->2 depth-down REGRESSED -- no depth breakout); iter-9 0.8181 hr0.0392 KEEP (train_n 200->480 data-coverage UP, NEW BEST, +0.0017). best hr=0.0392 @iter-9, current train_n=480. LIMITER (box2): data-coverage still climbing at train_n<579. iter-9 lifted hr 0.0375->0.0392 going 200->480 (small but POSITIVE -- data-coverage is a LIVE lever, not exhausted). CRUCIAL PRECEDENT this tick: the sibling hammernik_vn took train_n 480->579 (full pool) and lifted +0.029 (the data lever COMPOUNDS at the full pool). At train_n=480 the VN still misses ~17 pct of the 579-slice train pool. epochs(UP works), bs(DOWN works), train_n(UP works @iter-9); lr/lambda/n_filters/vn_T all REGRESSED. The full-pool data step is the last untried coverage increment. ONE KNOB CHOICE (box3): train_n 480->579 at the iter-9 BEST config (vn_T=5/bs1/lr5e-4/lambda0.0023/n_filters16 held; epochs=4 held). HYPOTHESIS (box4): exposing the VN to the FULL 579-slice pool (vs 480, +20 pct coverage, complete 3-ps stratification) lets the shared filter bank fit a less FBP-degrading regularizer -> hr > 0.0392, possibly compounding like the sibling hammernik_vn (+0.029 at the full-pool step); predict SSIM ~0.82-0.85, hr ~0.05-0.10. NUMERIC FALSIFIER: if hr <= 0.0392 (<= iter-9 best), data-coverage is EXHAUSTED at 480 for this tiny 0.018M VN -> the Hammernik-2017 image-domain learned-regularizer family is FBP-bounded at hr~0.039 on Mayo, ALL single knobs (epochs/bs/lr/lambda/n_filters/vn_T/train_n) mapped, budget-bounded ceiling DOCUMENTED as a negative result. BUDGET (box5, HARD 1200s train+score; sbatch --time=00:30:00): at bs=1, cost ~= train_n x epochs grad steps; iter-9 = 480x4=1920 steps in ~635s train (~0.33s/step), elapsed 729.8s. iter-10 = 579x4=2316 steps ~= 764s train + ~95s score(214)+figure ~= 859s predicted elapsed < 1200s; max_train_s=1050 backstop trips before the figure, well under the 1800s SLURM kill. MEMORY-SAFE: identical per-step footprint to iter-9 -- batch_size=1 KEPT (OOM-safe minimum; bs=4 OOMed the 16GB RTX5000 at iter-1), vn_T=5, N_k=16, 31-bump RBF across 5 unrolled steps within 16 GB; train_n only changes HOW MANY slices stream through, NOT the activation tensor size. grad_clip=1.0 retained (VN-family NaN-skip stability).", "advice_for_others": "hammernik_2017-claude-agentic: vn_T=5, vn_n_filters=16, vn_kernel=11, vn_n_bumps=31, vn_x_range=2.0, vn_lambda_init=0.0023, epochs=4, batch_size=1, lr=0.0005, grad_clip=1.0, train_n=579, val_n=214, max_train_s=1050, seed=42, rationale=hammernik_2017 iter-10 (search-20260619-01, corrected 214-slice/321px-FOV metric). ONE KNOB: train_n 480 -> 579 (FULL TRAIN POOL, the last data-coverage step). BASE_ITER=9 (the BEST + above-baseline point: SSIM 0.8181, hr 0.0392, train_n480/vn_T5/ep4/bs1/lr5e-4/lambda0.0023/n_filters16). epochs held at 4 (NOT a second hypothesis knob -- 579x4=2316 grad steps stays in budget and gives MORE full-pool exposure, the headroom is safety margin). all else held at iter-9 (vn_T=5, vn_n_filters=16, vn_kernel=11, vn_n_bumps=31, vn_x_range=2.0, vn_lambda_init=0.0023, batch_size=1, lr=5e-4, grad_clip=1.0, val_n=214, max_train_s=1050, seed=42). TRAJECTORY (corrected metric): iter-1 OOM(bs4); iter-2 0.8012 hr0; iter-3 0.7932 hr0 (lambda UP REGRESSED); iter-4 0.7828 hr0 (n_filters DOWN REGRESSED); iter-5 0.8114 hr0.0319 KEEP (epochs UP, first above ~0.84 LD-FBP floor); iter-6 0.7883 hr0 DISCARD (lr DOWN REGRESSED); iter-7 0.8170 hr0.0375 KEEP (bs 2->1 DOWN); iter-8 0.7935 hr0 DISCARD (vn_T 5->2 depth-down REGRESSED -- no depth breakout); iter-9 0.8181 hr0.0392 KEEP (train_n 200->480 data-coverage UP, NEW BEST, +0.0017). best hr=0.0392 @iter-9, current train_n=480. LIMITER (box2): data-coverage still climbing at train_n<579. iter-9 lifted hr 0.0375->0.0392 going 200->480 (small but POSITIVE -- data-coverage is a LIVE lever, not exhausted). CRUCIAL PRECEDENT this tick: the sibling hammernik_vn took train_n 480->579 (full pool) and lifted +0.029 (the data lever COMPOUNDS at the full pool). At train_n=480 the VN still misses ~17 pct of the 579-slice train pool. epochs(UP works), bs(DOWN works), train_n(UP works @iter-9); lr/lambda/n_filters/vn_T all REGRESSED. The full-pool data step is the last untried coverage increment. ONE KNOB CHOICE (box3): train_n 480->579 at the iter-9 BEST config (vn_T=5/bs1/lr5e-4/lambda0.0023/n_filters16 held; epochs=4 held). HYPOTHESIS (box4): exposing the VN to the FULL 579-slice pool (vs 480, +20 pct coverage, complete 3-ps stratification) lets the shared filter bank fit a less FBP-degrading regularizer -> hr > 0.0392, possibly compounding like the sibling hammernik_vn (+0.029 at the full-pool step); predict SSIM ~0.82-0.85, hr ~0.05-0.10. NUMERIC FALSIFIER: if hr <= 0.0392 (<= iter-9 best), data-coverage is EXHAUSTED at 480 for this tiny 0.018M VN -> the Hammernik-2017 image-domain learned-regularizer family is FBP-bounded at hr~0.039 on Mayo, ALL single knobs (epochs/bs/lr/lambda/n_filters/vn_T/train_n) mapped, budget-bounded ceiling DOCUMENTED as a negative result. BUDGET (box5, HARD 1200s train+score; sbatch --time=00:30:00): at bs=1, cost ~= train_n x epochs grad steps; iter-9 = 480x4=1920 steps in ~635s train (~0.33s/step), elapsed 729.8s. iter-10 = 579x4=2316 steps ~= 764s train + ~95s score(214)+figure ~= 859s predicted elapsed < 1200s; max_train_s=1050 backstop trips before the figure, well under the 1800s SLURM kill. MEMORY-SAFE: identical per-step footprint to iter-9 -- batch_size=1 KEPT (OOM-safe minimum; bs=4 OOMed the 16GB RTX5000 at iter-1), vn_T=5, N_k=16, 31-bump RBF across 5 unrolled steps within 16 GB; train_n only changes HOW MANY slices stream through, NOT the activation tensor size. grad_clip=1.0 retained (VN-family NaN-skip stability).", "comparison_image": "runs/mayo-ldct-claude-agentic-hammernik-2017-search-20260619-01/iterations/iter-0010/comparison.png"}
{"ts": "2026-06-21T17:41:33Z", "run_id": "mayo-ldct-claude-agentic-dual-domain-bilateral-supervised-search-20260619-01", "iter": 10, "agent": "dual_domain_bilateral_supervised-claude-agentic", "model": "claude-opus-4-8-1m", "change_class": "architecture", "status": "keep", "kept": true, "val_score": 0.9191550016403198, "headroom": 0.02823715470493071, "params_M": 1.2e-05, "train_n": 400, "rationale": "dual_domain_bilateral_supervised-claude-agentic: proj_n_bf=1, img_n_bf=3, proj_kernel=3, proj_sx=0.01, proj_sy=0.3, proj_sr=0.0005, img_kernel=5, img_sx=0.5, img_sy=0.5, img_sr=0.02, lr=0.005, epochs=24, batch_size=1, val_chunk=1, train_n=200, val_n=214, grad_clip=1.0, lambda_neg=1.0, seed=42, rationale=ITER-10 (search-20260619-01, corrected 214-slice/321px-FOV metric). CLEAN CONFIRMATION re-dispatch of the iter-2 BEST config verbatim (proj_n_bf=1, img_n_bf=3, 12 params, hr 0.028237, ep24, seed=42; PATCH={}). SIX-BOX (NUMBERS, hr=metric of record): (1) TRAJECTORY: iter-1 hr 0.027984 ep8; iter-2 hr 0.028237 ep24 = BEST; iter-3 hr 0.0 img_n_bf=6 (image capacity DESTABILIZED); iter-4 hr 0.028237 proj_n_bf=2 (proj-DEPTH FLAT); iter-5 hr 0.009801 train_n=480 (DATA REGRESSED); iter-6 hr 0.021479 lr=0.001 (lr-DOWN REGRESSED); iter-7 hr 0.028192 img_sr=0.005 (image range-sigma FLAT); iter-8 hr 0.028237 proj_sr=0.0001 (proj range-sigma FLAT, doc-named Mayo lever inert); iter-9 hr 0.025003 seed=123 (SEED READ -- within noise, seed-stable). MAPPED+spent: epochs, img_n_bf, proj_n_bf, train_n, lr, img_sr, proj_sr, AND seed. (2) LIMITER: 12-param trainable-bilateral structural floor (4 scalar-sigma BFs) on the 2304-view Mayo FBP -- every cfg lever falsified, seed-stability confirmed iter-9. No untried in-budget headroom-aligned knob remains. (3) ONE KNOB: NONE -- clean confirmation; re-run iter-2 best verbatim to document hr 0.0282 as the 12-param structural ceiling toward iter-20. (4) HYPOTHESIS: verbatim iter-2 re-dispatch lands hr WITHIN noise of 0.028237 (predict ~0.0282), confirming the ceiling is a reproducible structural floor not a stochastic artifact. NUMERIC FALSIFIER: hr WITHIN +-0.002 of 0.028237 => confirmed reproducible ceiling (file verdict); hr > 0.031 => run stochastically wider -> iter-11+ maps noise floor. (5) BUDGET: HARD 1200s train+score. Identical config to iter-2 (449.6s) / iter-9 (444.8s); val_n=214; ~450s << 1200s (30-min sbatch wall). (6) Loop continues -- no control returned. HARD-WIRED (unchanged): staged_canonical data, v3 mayo_ldct_fitted geometry, per-sample-ps, bg_target=truth, val=ALL 214 L277 slices under 321px detector-geometry FOV (no fov= override), grad_clip=1.0.", "advice_for_others": "dual_domain_bilateral_supervised-claude-agentic: proj_n_bf=1, img_n_bf=3, proj_kernel=3, proj_sx=0.01, proj_sy=0.3, proj_sr=0.0005, img_kernel=5, img_sx=0.5, img_sy=0.5, img_sr=0.02, lr=0.005, epochs=24, batch_size=1, val_chunk=1, train_n=200, val_n=214, grad_clip=1.0, lambda_neg=1.0, seed=42, rationale=ITER-10 (search-20260619-01, corrected 214-slice/321px-FOV metric). CLEAN CONFIRMATION re-dispatch of the iter-2 BEST config verbatim (proj_n_bf=1, img_n_bf=3, 12 params, hr 0.028237, ep24, seed=42; PATCH={}). SIX-BOX (NUMBERS, hr=metric of record): (1) TRAJECTORY: iter-1 hr 0.027984 ep8; iter-2 hr 0.028237 ep24 = BEST; iter-3 hr 0.0 img_n_bf=6 (image capacity DESTABILIZED); iter-4 hr 0.028237 proj_n_bf=2 (proj-DEPTH FLAT); iter-5 hr 0.009801 train_n=480 (DATA REGRESSED); iter-6 hr 0.021479 lr=0.001 (lr-DOWN REGRESSED); iter-7 hr 0.028192 img_sr=0.005 (image range-sigma FLAT); iter-8 hr 0.028237 proj_sr=0.0001 (proj range-sigma FLAT, doc-named Mayo lever inert); iter-9 hr 0.025003 seed=123 (SEED READ -- within noise, seed-stable). MAPPED+spent: epochs, img_n_bf, proj_n_bf, train_n, lr, img_sr, proj_sr, AND seed. (2) LIMITER: 12-param trainable-bilateral structural floor (4 scalar-sigma BFs) on the 2304-view Mayo FBP -- every cfg lever falsified, seed-stability confirmed iter-9. No untried in-budget headroom-aligned knob remains. (3) ONE KNOB: NONE -- clean confirmation; re-run iter-2 best verbatim to document hr 0.0282 as the 12-param structural ceiling toward iter-20. (4) HYPOTHESIS: verbatim iter-2 re-dispatch lands hr WITHIN noise of 0.028237 (predict ~0.0282), confirming the ceiling is a reproducible structural floor not a stochastic artifact. NUMERIC FALSIFIER: hr WITHIN +-0.002 of 0.028237 => confirmed reproducible ceiling (file verdict); hr > 0.031 => run stochastically wider -> iter-11+ maps noise floor. (5) BUDGET: HARD 1200s train+score. Identical config to iter-2 (449.6s) / iter-9 (444.8s); val_n=214; ~450s << 1200s (30-min sbatch wall). (6) Loop continues -- no control returned. HARD-WIRED (unchanged): staged_canonical data, v3 mayo_ldct_fitted geometry, per-sample-ps, bg_target=truth, val=ALL 214 L277 slices under 321px detector-geometry FOV (no fov= override), grad_clip=1.0.", "comparison_image": "runs/mayo-ldct-claude-agentic-dual-domain-bilateral-supervised-search-20260619-01/iterations/iter-0010/comparison.png"}
