{"ts": "2026-06-21T08:32:31Z", "run_id": "mayo-ldct-claude-agentic-tv-iterative-supervised-search-20260619-01", "iter": 7, "agent": "tv_iterative_supervised-claude-agentic", "model": "claude-opus-4-8-1m", "change_class": "architecture", "status": "discard", "kept": false, "val_score": 0.8192296624183655, "headroom": 0.0, "params_M": 2e-06, "train_n": 400, "rationale": "tv_iterative_supervised-claude-agentic: val_n=214, val_chunk=5, train_n=40, epochs=8, batch_size=1, lr=0.005, tv_K=8, tv_step_init=1e-05, tv_lambda_init=0.001, tv_share_steps=True, tv_clip_max=0.05, tv_eps=1e-06, lambda_neg=1.0, loss_base=mse, grad_clip=1.0, rationale=tv_iterative_supervised iter-7 (search-20260619-01, corrected 214-slice/321px-FOV metric). BASE_ITER=6 (the stable share=True, lr=5e-3 config that produced the BEST SSIM 0.8185 / hr 0.0). TRAJECTORY (SSIM/hr): iter-1 K=10 0.2855/0; iter-2 K=30 0.2855/0 (depth FALSIFIED at the frozen-step regime, byte-identical); iter-3 step=1e-8 0.8137/0 (LD-FBP PASSTHROUGH); iter-4 step=1e-5 share=F 0.6949/0 (per-step RUNAWAY into clamp); iter-5 step=1e-5 share=T 0.6074/0 (per-step runaway fixed but LAMBDA runaway); iter-6 lr 5e-2->5e-3 0.8185/0 (lambda runaway tamed -> SSIM recovered to the FBP passthrough floor but did NOT exceed it). BEST SSIM 0.8185 (iter-6); hr=0.0 EVERY iter. MAPPED KNOBS: tv_step_init bracketed {1e-2 saturate, 1e-8 passthrough, 1e-5 active-basin}; tv_share_steps {F runaway, T stable}; tv_lr {5e-2 over-drives, 5e-3 stable}; tv_K raised 10->30 ONLY at the FROZEN-step regime (iter-1/2, where it was provably inert). HELD CONSTANT ALL CAMPAIGN: tv_lambda_init=1e-3, epochs=8, train_n=40, AND tv_K has NEVER been probed DOWN, and NEVER re-probed at the now-stable (share=T, step=1e-5, lr=5e-3) regime. LIMITER: iter-6 sits EXACTLY at the LD-FBP passthrough floor (0.8185 ~= the 0.8137/~0.81 floor) -> the trained K=30 GD with the settled small-lambda is a near-identity map on fbp_init that neither helps NOR hurts. The question the campaign has NOT answered: is supervised-TV FBP-bounded along the DEPTH axis at the stable regime? This campaign overturned FOUR assumed ceilings via a single untried lever, and TWICE that lever was unroll-DEPTH-DOWN (itnet itnet_k 3->1, hammernik_vn vn_T 5->2). The TV analog (tv_K DOWN) has NEVER been run at a regime where training is stable. ONE KNOB CHANGED (from BASE_ITER=6): tv_K 30 -> 8 (depth-DOWN, the genuinely-untried structural lever). All else IDENTICAL to iter-6 (tv_share_steps=True, tv_step_init=1e-5, tv_lr=5e-3, tv_lambda_init=1e-3, train_n=40, epochs=8, bs=1, tv_clip_max=0.05, tv_eps=1e-6, val_n=214 ALL L277, val_chunk=5, grad_clip=1.0). HYPOTHESIS: with FEWER unrolled GD steps the cumulative TV smoothing is reduced, so the supervised optimizer can fit a SHARPER trained step/lambda that applies a few targeted data-consistency corrections while staying closer to the sharp FBP init -- if supervised-TV has ANY headroom above its own FBP, a shallow unroll is structurally where it would surface (mirroring the itnet/hammernik_vn depth-DOWN breakouts), lifting SSIM ABOVE 0.8185 and clearing hr>0. NUMERIC FALSIFIER (decisive): if SSIM stays <= 0.8185 with hr=0.0 at K=8, depth-DOWN is exhausted at the stable regime -> the LAST structural lever is retired and supervised-unrolled-TV is CONFIRMED FBP-bounded on real Mayo 2304-view LDCT under the config-only contract (the shared solvers raw unnormalized-adjoint back_project step is FORBIDDEN to edit) -> file the NEGATIVE RESULT and STOP at iter-7. BUDGET (HARD 20-min train+score = 1200s): tv_K 30->8 STRICTLY LOWERS compute (fewer unroll steps per train+val pass; fixed overhead = data load + 214-slice FBP precompute dominates) -> WELL under iter-6 measured 911.5s, comfortable margin under the 1200s wall; sbatch --time=00:30:00 carries figure/IO headroom. PREDICTED iter-7: SSIM ~0.80-0.86, hr most-likely 0.0 (a single global TV weight over a near-complete inverse is a structurally weak image-domain prior on real LDCT noise, regardless of depth); small chance hr 0.0-0.05 if shallow depth lets a sharper trained step beat the passthrough.", "advice_for_others": "tv_iterative_supervised-claude-agentic: val_n=214, val_chunk=5, train_n=40, epochs=8, batch_size=1, lr=0.005, tv_K=8, tv_step_init=1e-05, tv_lambda_init=0.001, tv_share_steps=True, tv_clip_max=0.05, tv_eps=1e-06, lambda_neg=1.0, loss_base=mse, grad_clip=1.0, rationale=tv_iterative_supervised iter-7 (search-20260619-01, corrected 214-slice/321px-FOV metric). BASE_ITER=6 (the stable share=True, lr=5e-3 config that produced the BEST SSIM 0.8185 / hr 0.0). TRAJECTORY (SSIM/hr): iter-1 K=10 0.2855/0; iter-2 K=30 0.2855/0 (depth FALSIFIED at the frozen-step regime, byte-identical); iter-3 step=1e-8 0.8137/0 (LD-FBP PASSTHROUGH); iter-4 step=1e-5 share=F 0.6949/0 (per-step RUNAWAY into clamp); iter-5 step=1e-5 share=T 0.6074/0 (per-step runaway fixed but LAMBDA runaway); iter-6 lr 5e-2->5e-3 0.8185/0 (lambda runaway tamed -> SSIM recovered to the FBP passthrough floor but did NOT exceed it). BEST SSIM 0.8185 (iter-6); hr=0.0 EVERY iter. MAPPED KNOBS: tv_step_init bracketed {1e-2 saturate, 1e-8 passthrough, 1e-5 active-basin}; tv_share_steps {F runaway, T stable}; tv_lr {5e-2 over-drives, 5e-3 stable}; tv_K raised 10->30 ONLY at the FROZEN-step regime (iter-1/2, where it was provably inert). HELD CONSTANT ALL CAMPAIGN: tv_lambda_init=1e-3, epochs=8, train_n=40, AND tv_K has NEVER been probed DOWN, and NEVER re-probed at the now-stable (share=T, step=1e-5, lr=5e-3) regime. LIMITER: iter-6 sits EXACTLY at the LD-FBP passthrough floor (0.8185 ~= the 0.8137/~0.81 floor) -> the trained K=30 GD with the settled small-lambda is a near-identity map on fbp_init that neither helps NOR hurts. The question the campaign has NOT answered: is supervised-TV FBP-bounded along the DEPTH axis at the stable regime? This campaign overturned FOUR assumed ceilings via a single untried lever, and TWICE that lever was unroll-DEPTH-DOWN (itnet itnet_k 3->1, hammernik_vn vn_T 5->2). The TV analog (tv_K DOWN) has NEVER been run at a regime where training is stable. ONE KNOB CHANGED (from BASE_ITER=6): tv_K 30 -> 8 (depth-DOWN, the genuinely-untried structural lever). All else IDENTICAL to iter-6 (tv_share_steps=True, tv_step_init=1e-5, tv_lr=5e-3, tv_lambda_init=1e-3, train_n=40, epochs=8, bs=1, tv_clip_max=0.05, tv_eps=1e-6, val_n=214 ALL L277, val_chunk=5, grad_clip=1.0). HYPOTHESIS: with FEWER unrolled GD steps the cumulative TV smoothing is reduced, so the supervised optimizer can fit a SHARPER trained step/lambda that applies a few targeted data-consistency corrections while staying closer to the sharp FBP init -- if supervised-TV has ANY headroom above its own FBP, a shallow unroll is structurally where it would surface (mirroring the itnet/hammernik_vn depth-DOWN breakouts), lifting SSIM ABOVE 0.8185 and clearing hr>0. NUMERIC FALSIFIER (decisive): if SSIM stays <= 0.8185 with hr=0.0 at K=8, depth-DOWN is exhausted at the stable regime -> the LAST structural lever is retired and supervised-unrolled-TV is CONFIRMED FBP-bounded on real Mayo 2304-view LDCT under the config-only contract (the shared solvers raw unnormalized-adjoint back_project step is FORBIDDEN to edit) -> file the NEGATIVE RESULT and STOP at iter-7. BUDGET (HARD 20-min train+score = 1200s): tv_K 30->8 STRICTLY LOWERS compute (fewer unroll steps per train+val pass; fixed overhead = data load + 214-slice FBP precompute dominates) -> WELL under iter-6 measured 911.5s, comfortable margin under the 1200s wall; sbatch --time=00:30:00 carries figure/IO headroom. PREDICTED iter-7: SSIM ~0.80-0.86, hr most-likely 0.0 (a single global TV weight over a near-complete inverse is a structurally weak image-domain prior on real LDCT noise, regardless of depth); small chance hr 0.0-0.05 if shallow depth lets a sharper trained step beat the passthrough.", "comparison_image": "runs/mayo-ldct-claude-agentic-tv-iterative-supervised-search-20260619-01/iterations/iter-0007/comparison.png"}
{"ts": "2026-06-21T08:26:48Z", "run_id": "mayo-ldct-claude-agentic-dual-domain-bilateral-supervised-search-20260619-01", "iter": 7, "agent": "dual_domain_bilateral_supervised-claude-agentic", "model": "claude-opus-4-8-1m", "change_class": "architecture", "status": "keep", "kept": true, "val_score": 0.9191522002220154, "headroom": 0.028191647748606607, "params_M": 1.2e-05, "train_n": 400, "rationale": "dual_domain_bilateral_supervised-claude-agentic: proj_n_bf=1, img_n_bf=3, proj_kernel=3, proj_sx=0.01, proj_sy=0.3, proj_sr=0.0005, img_kernel=5, img_sx=0.5, img_sy=0.5, img_sr=0.005, lr=0.005, epochs=24, batch_size=1, val_chunk=1, train_n=200, val_n=214, grad_clip=1.0, lambda_neg=1.0, seed=42, rationale=iter-7 img_sr 0.02->0.005 (image-domain range-sigma init DOWN = edge-preserving, the genuinely-untried headroom-aligned knob; BASE_ITER=2 best hr 0.0282)", "advice_for_others": "dual_domain_bilateral_supervised-claude-agentic: proj_n_bf=1, img_n_bf=3, proj_kernel=3, proj_sx=0.01, proj_sy=0.3, proj_sr=0.0005, img_kernel=5, img_sx=0.5, img_sy=0.5, img_sr=0.005, lr=0.005, epochs=24, batch_size=1, val_chunk=1, train_n=200, val_n=214, grad_clip=1.0, lambda_neg=1.0, seed=42, rationale=iter-7 img_sr 0.02->0.005 (image-domain range-sigma init DOWN = edge-preserving, the genuinely-untried headroom-aligned knob; BASE_ITER=2 best hr 0.0282)", "comparison_image": "runs/mayo-ldct-claude-agentic-dual-domain-bilateral-supervised-search-20260619-01/iterations/iter-0007/comparison.png"}
{"ts": "2026-06-20T23:49:00Z", "run_id": "mayo-ldct-claude-agentic-fastdiff-flow-pixel-unconstrained-search-20260620-01", "iter": 1, "agent": "fastdiff-recon-claude-agentic", "model": "claude-opus-4-8-1m", "change_class": "architecture", "status": "discard", "kept": false, "val_score": 0.8744699358940125, "headroom": 0.0, "params_M": 3.822787, "train_n": 200, "rationale": "fast-diffusion recon (pixel domain, unconstrained prior): per-image few-step DC-guided reconstruction from a trained fast-diffusion prior (solver_fast_recon.py, 8-step, FBP init @ t=0.7, eta=1.0, DC=1 CG=5). The 'unconstrained' prior was trained on the larger Mayo train slice pool (vs the 50-slice constrained prior); 'unconstrained' is a misnomer inherited from the demo-dl phantom regime and means MORE train slices, NOT GT leakage (train split only; no val/test). Evaluated on ALL 214 L277 Mayo val slices under the calibrated-SSIM-headroom metric (baseline LD-FBP SSIM 0.8147 / PSNR 34.08 dB; oracle HD-FBP). Result: SSIM 0.8745, PSNR 31.20 dB, calibrated headroom 0.0000. Honest negative on headroom: SSIM clears LD-FBP (0.8147) but the RMSE/PSNR-sensitive calibrated metric keeps PSNR (31.20 dB) below the LD-FBP floor (34.08 dB) on dense (2304-view) rebinned Mayo -> hr pinned at 0.0 (FBP-bounded, below-baseline). Cluster eval run: recon-fast-diffusion-pixel_unconstrained-766045; checkpoint /cluster/maier/Agent4CT/checkpoints/fast_diffusion_pixel_unconstrained.pt (final_val_flow_loss 0.0162).", "advice_for_others": "fast-diffusion pixel/unconstrained: on dense full-view Mayo, an 8-step diffusion-prior recon clears FBP on SSIM (0.8745 > 0.8147) but stays PSNR/RMSE-bounded below the LD-FBP floor on the calibrated metric -> hr 0.0; the larger 'unconstrained' train pool lifts SSIM ~0.013 over the constrained prior (0.8615) but does NOT clear the FBP headroom floor on this dense-view geometry.", "comparison_image": "runs/mayo-ldct-claude-agentic-fastdiff-flow-pixel-unconstrained-search-20260620-01/iterations/iter-0001/comparison.png"}
{"ts": "2026-06-20T22:35:46Z", "run_id": "mayo-ldct-claude-agentic-diff-recon-dcstep-unconstrained-mayo-v4-search-20260619-01", "iter": 7, "agent": "diffusion_recon_dcstep_unconstrained_mayo_v4-claude-agentic", "model": "claude-opus-4-8-1m", "change_class": "architecture", "status": "discard", "kept": false, "val_score": 0.8711403608322144, "headroom": 0.0, "params_M": 8.594211, "train_n": 400, "rationale": "diffusion_recon_dcstep_unconstrained_mayo_v4-claude-agentic: recon_ckpt=/cluster/maier/Agent4CT/checkpoints/ddpm_mayo_unconstrained_v4.pt, recon_mode=dps, recon_sample_steps=56, recon_eta=5.0, recon_init=fbp, recon_eta_clamp=False, recon_dcstep_every=5, recon_dcstep_n_cg=3, recon_dcstep_warmup=5, recon_dcstep_relax=1.0, recon_dc_solver=cg, val_n=96, train_n=0, rationale=iter-7 search-20260619-01 UNCONSTRAINED diff-recon -- AUTHORIZED audit-fix (B) part (i): RAISE THE NFE KNOB. ONE KNOB: recon_sample_steps (T, DDIM reverse-step count = NFE) 40->56 (+40% finer DDIM grid); val_n 120->96 evenly-spaced is the BUDGET-SIZING co-move (box 5, the single authorized (B) val_n exception to hold the HARD 1200s wall), NOT a hypothesis variable. BASE = iter-6 (the A-fix CG-DC working point, BEST SSIM 0.8241): recon_dc_solver=cg, recon_dcstep_every=5, recon_dcstep_n_cg=3, recon_dcstep_warmup=5, recon_dcstep_relax=1.0, recon_eta=5.0, recon_init=fbp, recon_eta_clamp=false ALL UNCHANGED. The (A) DC-step CG fix already landed iter-6 (the unconstrained variant got the biggest A-fix gain: soft-DPS best 0.3960 -> CG-DC 0.8241). The (B) v5 DDPM retrain (part ii: full train pool + EMA + DPS-recon selection) is NOT ready -- this iter changes ONLY the NFE knob, reusing ddpm_mayo_unconstrained_v4.pt (200 train slices, NO retrain; \"unconstrained\"=200-slice misnomer from the demo-dl phantom regime, NOT a leakage variant). TRAJECTORY (val L277, 321px detector-geometry FOV, LD-FBP floor 0.8078): iter-1 T25/eta30/every0 SSIM 0.3688/hr0; iter-2 eta30->5 SSIM 0.3960/hr0 (best soft); iter-3 T25->32 SSIM 0.3869/hr0; iter-4 every0->5 LEGACY hard-DC SSIM 0.0553 (collapse); iter-5 T->40 soft SSIM 0.3709/hr0; iter-6 recon_dc_solver=cg CG-DC SSIM 0.8241/hr0/PSNR27.15 (BEST, the A-fix). LIMITER: regime-bounded on DENSE 2304-view rebinned Mayo -- LD-FBP is near-complete so hr>0 is unlikely from a finer DDIM grid; the coarse T=40 grid is the remaining soft lever and the v4-prior payoff is the 128-view SPARSE benchmarks (not this dense-Mayo iter). HYPOTHESIS: a finer DDIM reverse schedule (T 40->56, +40% NFE) lets the CG-DC iterate relax more completely onto the sino-consistent mode, lifting SSIM modestly above iter-6 BEST 0.8241 -- predicted 0.83-0.85, hr STAYS 0 (regime-bound). NUMERIC FALSIFIER: if SSIM <= 0.8241 (flat-or-down vs iter-6) at T=56, the NFE lever does NOT help on dense Mayo -- T has saturated on the CG-DC path; file it, unconstrained best stays iter-6 (SSIM 0.8241, hr 0), and the NFE lift (if any) is reserved for the SPARSE benchmarks where the prior matters. BUDGET (HARD 20-min=1200s wall, val=evenly-spaced L277): iter-6 ran 961.6s at T=40/val_n=120 = 8.013 s/slice = 0.2003 s/slice/step (CG-DC cost grows ~linearly with T since both DDIM steps and the every-5 CG triggers scale with T). At T=56: 56*0.2003 = 11.22 s/slice; val_n=96 -> 96*11.22 = 1077s = 18.0 min < 1200s (~2 min headroom). val_n=120 at T=56 would be 1346s=22.4min (BLOWS the wall), so val_n=96 is the budget mechanism that unlocks the +40% NFE probe, evenly-spaced across the 214-slice L277 volume (protocol-sanctioned when val_n<214). HARD-WIRED: staged_canonical data, v3 mayo_ldct_fitted geometry, per-sample-ps single-val-ps probe, bg_target=truth, 321px detector-geometry FOV default (no fov=False), recon_dc_solver=cg. reuse ddpm_mayo_unconstrained_v4.pt (NO retrain).", "advice_for_others": "diffusion_recon_dcstep_unconstrained_mayo_v4-claude-agentic: recon_ckpt=/cluster/maier/Agent4CT/checkpoints/ddpm_mayo_unconstrained_v4.pt, recon_mode=dps, recon_sample_steps=56, recon_eta=5.0, recon_init=fbp, recon_eta_clamp=False, recon_dcstep_every=5, recon_dcstep_n_cg=3, recon_dcstep_warmup=5, recon_dcstep_relax=1.0, recon_dc_solver=cg, val_n=96, train_n=0, rationale=iter-7 search-20260619-01 UNCONSTRAINED diff-recon -- AUTHORIZED audit-fix (B) part (i): RAISE THE NFE KNOB. ONE KNOB: recon_sample_steps (T, DDIM reverse-step count = NFE) 40->56 (+40% finer DDIM grid); val_n 120->96 evenly-spaced is the BUDGET-SIZING co-move (box 5, the single authorized (B) val_n exception to hold the HARD 1200s wall), NOT a hypothesis variable. BASE = iter-6 (the A-fix CG-DC working point, BEST SSIM 0.8241): recon_dc_solver=cg, recon_dcstep_every=5, recon_dcstep_n_cg=3, recon_dcstep_warmup=5, recon_dcstep_relax=1.0, recon_eta=5.0, recon_init=fbp, recon_eta_clamp=false ALL UNCHANGED. The (A) DC-step CG fix already landed iter-6 (the unconstrained variant got the biggest A-fix gain: soft-DPS best 0.3960 -> CG-DC 0.8241). The (B) v5 DDPM retrain (part ii: full train pool + EMA + DPS-recon selection) is NOT ready -- this iter changes ONLY the NFE knob, reusing ddpm_mayo_unconstrained_v4.pt (200 train slices, NO retrain; \"unconstrained\"=200-slice misnomer from the demo-dl phantom regime, NOT a leakage variant). TRAJECTORY (val L277, 321px detector-geometry FOV, LD-FBP floor 0.8078): iter-1 T25/eta30/every0 SSIM 0.3688/hr0; iter-2 eta30->5 SSIM 0.3960/hr0 (best soft); iter-3 T25->32 SSIM 0.3869/hr0; iter-4 every0->5 LEGACY hard-DC SSIM 0.0553 (collapse); iter-5 T->40 soft SSIM 0.3709/hr0; iter-6 recon_dc_solver=cg CG-DC SSIM 0.8241/hr0/PSNR27.15 (BEST, the A-fix). LIMITER: regime-bounded on DENSE 2304-view rebinned Mayo -- LD-FBP is near-complete so hr>0 is unlikely from a finer DDIM grid; the coarse T=40 grid is the remaining soft lever and the v4-prior payoff is the 128-view SPARSE benchmarks (not this dense-Mayo iter). HYPOTHESIS: a finer DDIM reverse schedule (T 40->56, +40% NFE) lets the CG-DC iterate relax more completely onto the sino-consistent mode, lifting SSIM modestly above iter-6 BEST 0.8241 -- predicted 0.83-0.85, hr STAYS 0 (regime-bound). NUMERIC FALSIFIER: if SSIM <= 0.8241 (flat-or-down vs iter-6) at T=56, the NFE lever does NOT help on dense Mayo -- T has saturated on the CG-DC path; file it, unconstrained best stays iter-6 (SSIM 0.8241, hr 0), and the NFE lift (if any) is reserved for the SPARSE benchmarks where the prior matters. BUDGET (HARD 20-min=1200s wall, val=evenly-spaced L277): iter-6 ran 961.6s at T=40/val_n=120 = 8.013 s/slice = 0.2003 s/slice/step (CG-DC cost grows ~linearly with T since both DDIM steps and the every-5 CG triggers scale with T). At T=56: 56*0.2003 = 11.22 s/slice; val_n=96 -> 96*11.22 = 1077s = 18.0 min < 1200s (~2 min headroom). val_n=120 at T=56 would be 1346s=22.4min (BLOWS the wall), so val_n=96 is the budget mechanism that unlocks the +40% NFE probe, evenly-spaced across the 214-slice L277 volume (protocol-sanctioned when val_n<214). HARD-WIRED: staged_canonical data, v3 mayo_ldct_fitted geometry, per-sample-ps single-val-ps probe, bg_target=truth, 321px detector-geometry FOV default (no fov=False), recon_dc_solver=cg. reuse ddpm_mayo_unconstrained_v4.pt (NO retrain).", "comparison_image": "runs/mayo-ldct-claude-agentic-diff-recon-dcstep-unconstrained-mayo-v4-search-20260619-01/iterations/iter-0007/comparison.png"}
