{"ts": "2026-06-20T12:58:24Z", "run_id": "mayo-ldct-claude-agentic-dual-domain-supervised-search-20260619-01", "iter": 7, "agent": "dual_domain_supervised-claude-agentic", "model": "claude-opus-4-8-1m", "change_class": "architecture", "status": "keep", "kept": true, "val_score": 0.9326830506324768, "headroom": 0.4133153707427595, "params_M": 0.465762, "train_n": 400, "rationale": "dual_domain_supervised-claude-agentic: unet_c=16, lr=0.00015, epochs=10, batch_size=1, val_chunk=1, train_n=579, val_n=214, grad_clip=1.0, lambda_neg=1.0, seed=42, rationale=ITER-7 (search-20260619-01, corrected protocol). BASE_ITER=6 (the CHAMPION: unet_c=16/lr=1e-4/epochs=10/train_n=579/lambda_neg=1.0/grad_clip=1.0/seed=42, hr 0.415794, the campaign Mayo champion). ONE KNOB (optimization): lr 1e-4 -> 1.5e-4 (everything else identical: unet_c=16, epochs=10, batch_size=1, val_chunk=1, train_n=579, val_n=214, grad_clip=1.0, lambda_neg=1.0, seed=42). SIX-BOX (NUMBERS). (1) iter-6 champion: SSIM 0.93261 / hr 0.415794 at ep10/train_n=579/c16/lr1e-4, elapsed_s=1172.0s (19.5 min, only ~28s headroom inside the 1200s wall). Measured per-epoch on the full 579-slice pool from iter-5 (ep9, 1082.1s) + iter-6 (ep10, 1172.0s): (1172.0-1082.1)/(10-9)=89.9 s/epoch marginal, fixed=1172.0-10*89.9=273s (data load + 214-slice per-sample val + figure). (2) LIMITER: epochs are WALL-PINNED at 10 (ep10 used 1172/1200s; ep11=273+11*89.9=1262s=21.0min BUSTS the 20-min wall). Data coverage MAXED (train_n=579 = entire Wagner pool, cannot rise). Capacity bump is UNFUNDABLE: the wall is pinned at ep10 with zero spare epochs to trade, and iter-4 already showed c24 REGRESSED to 0.29856 precisely because trading epochs to fund 2.25x conv-compute under-trained the bigger net -- with no epochs to spare now, c24 would under-train even worse. So the only within-budget lever left is OPTIMIZATION. lr has NEVER been tuned in this campaign (fixed at 1e-4 across all 6 iters); no lr-schedule is wired (FORBIDDEN to edit the shared solver), so a constant-lr change is the only optimization lever. The hr trajectory is still CLIMBING (ep8/n200 0.276 -> ep20 0.339 -> ep27 0.3654 -> ep9/n579 0.3994 -> ep10/n579 0.4158, +0.0164 on the last epoch step) -> the net is EPOCH-STARVED on the full pool (only 10 passes), NOT at a convergence plateau. (3) ONE KNOB: lr 1e-4 -> 1.5e-4. This makes each of the 10 epochs do more effective work (directly attacks the epoch-starvation limiter) at ZERO extra compute -- an lr change does not alter per-epoch cost, so the pinned wall stays safe (no epoch trade needed; this is precisely why lr is chosen over capacity). 1.5e-4 is a 50pct bump, well under the 5e-4 that NaN-ed standalone; grad_clip=1.0 + nonfinite-grad-skip remain the NaN guard. (4) HYPOTHESIS: lr 1e-4->1.5e-4 lifts hr ABOVE 0.415794, because the full-pool net is epoch-starved at 10 passes and a 50pct larger stable step lets each pass converge further (the epochs slope was still positive at the wall). FALSIFIER (in NUMBERS): if hr <= 0.415794 at lr=1.5e-4 (plateau, drop, or NaN-skip instability), then 1e-4 was already the optimal stable step at this budget and dual_domain_supervised is at its DEFINITIVE BUDGET-CONSTRAINED Mayo CEILING (0.4158, the campaign Mayo CHAMPION) -- all four within-budget levers exhausted: epochs (wall-locked at 10), data (maxed at 579), capacity (regressed iter-4, unfundable now), and lr (this iter). PREDICTED iter-7 hr ~0.420-0.425. (5) BUDGET: lr change does NOT alter per-epoch cost -> ep10/train_n=579 stays ~1172s (19.5 min), inside the 1200s train+score wall and the 30-min sbatch wall; no epoch trade. (6) no control return. HARD-WIRED (unchanged): staged_canonical v3 mayo_ldct_fitted geometry, per-sample-ps FBP + per-sample pipe.R_full swap, bg_target=truth, metric=321px detector-geometry FOV (evaluate_calibrated default for AGENT4CT_DATASET=mayo_ldct_2d; no fov= override).", "advice_for_others": "dual_domain_supervised-claude-agentic: unet_c=16, lr=0.00015, epochs=10, batch_size=1, val_chunk=1, train_n=579, val_n=214, grad_clip=1.0, lambda_neg=1.0, seed=42, rationale=ITER-7 (search-20260619-01, corrected protocol). BASE_ITER=6 (the CHAMPION: unet_c=16/lr=1e-4/epochs=10/train_n=579/lambda_neg=1.0/grad_clip=1.0/seed=42, hr 0.415794, the campaign Mayo champion). ONE KNOB (optimization): lr 1e-4 -> 1.5e-4 (everything else identical: unet_c=16, epochs=10, batch_size=1, val_chunk=1, train_n=579, val_n=214, grad_clip=1.0, lambda_neg=1.0, seed=42). SIX-BOX (NUMBERS). (1) iter-6 champion: SSIM 0.93261 / hr 0.415794 at ep10/train_n=579/c16/lr1e-4, elapsed_s=1172.0s (19.5 min, only ~28s headroom inside the 1200s wall). Measured per-epoch on the full 579-slice pool from iter-5 (ep9, 1082.1s) + iter-6 (ep10, 1172.0s): (1172.0-1082.1)/(10-9)=89.9 s/epoch marginal, fixed=1172.0-10*89.9=273s (data load + 214-slice per-sample val + figure). (2) LIMITER: epochs are WALL-PINNED at 10 (ep10 used 1172/1200s; ep11=273+11*89.9=1262s=21.0min BUSTS the 20-min wall). Data coverage MAXED (train_n=579 = entire Wagner pool, cannot rise). Capacity bump is UNFUNDABLE: the wall is pinned at ep10 with zero spare epochs to trade, and iter-4 already showed c24 REGRESSED to 0.29856 precisely because trading epochs to fund 2.25x conv-compute under-trained the bigger net -- with no epochs to spare now, c24 would under-train even worse. So the only within-budget lever left is OPTIMIZATION. lr has NEVER been tuned in this campaign (fixed at 1e-4 across all 6 iters); no lr-schedule is wired (FORBIDDEN to edit the shared solver), so a constant-lr change is the only optimization lever. The hr trajectory is still CLIMBING (ep8/n200 0.276 -> ep20 0.339 -> ep27 0.3654 -> ep9/n579 0.3994 -> ep10/n579 0.4158, +0.0164 on the last epoch step) -> the net is EPOCH-STARVED on the full pool (only 10 passes), NOT at a convergence plateau. (3) ONE KNOB: lr 1e-4 -> 1.5e-4. This makes each of the 10 epochs do more effective work (directly attacks the epoch-starvation limiter) at ZERO extra compute -- an lr change does not alter per-epoch cost, so the pinned wall stays safe (no epoch trade needed; this is precisely why lr is chosen over capacity). 1.5e-4 is a 50pct bump, well under the 5e-4 that NaN-ed standalone; grad_clip=1.0 + nonfinite-grad-skip remain the NaN guard. (4) HYPOTHESIS: lr 1e-4->1.5e-4 lifts hr ABOVE 0.415794, because the full-pool net is epoch-starved at 10 passes and a 50pct larger stable step lets each pass converge further (the epochs slope was still positive at the wall). FALSIFIER (in NUMBERS): if hr <= 0.415794 at lr=1.5e-4 (plateau, drop, or NaN-skip instability), then 1e-4 was already the optimal stable step at this budget and dual_domain_supervised is at its DEFINITIVE BUDGET-CONSTRAINED Mayo CEILING (0.4158, the campaign Mayo CHAMPION) -- all four within-budget levers exhausted: epochs (wall-locked at 10), data (maxed at 579), capacity (regressed iter-4, unfundable now), and lr (this iter). PREDICTED iter-7 hr ~0.420-0.425. (5) BUDGET: lr change does NOT alter per-epoch cost -> ep10/train_n=579 stays ~1172s (19.5 min), inside the 1200s train+score wall and the 30-min sbatch wall; no epoch trade. (6) no control return. HARD-WIRED (unchanged): staged_canonical v3 mayo_ldct_fitted geometry, per-sample-ps FBP + per-sample pipe.R_full swap, bg_target=truth, metric=321px detector-geometry FOV (evaluate_calibrated default for AGENT4CT_DATASET=mayo_ldct_2d; no fov= override).", "comparison_image": "runs/mayo-ldct-claude-agentic-dual-domain-supervised-search-20260619-01/iterations/iter-0007/comparison.png"}
{"ts": "2026-06-20T12:16:27Z", "run_id": "mayo-ldct-claude-agentic-itnet-v3-search-20260619-01", "iter": 6, "agent": "itnet_v3-claude-agentic", "model": "claude-opus-4-8-1m", "change_class": "architecture", "status": "keep", "kept": true, "val_score": 0.9064780473709106, "headroom": 0.3152389904072749, "params_M": 3.698994, "train_n": 400, "rationale": "itnet_v3-claude-agentic: itnet_k=3, unet_c=16, alpha_init=0.0037, lr=0.0001, epochs=6, batch_size=1, val_chunk=1, train_n=579, val_n=214, grad_clip=1.0, max_train_s=660, seed=42, rationale=iter-6 (search-20260619-01, corrected protocol). BASE_ITER=5 (the BEST: c16/ep9/train_n=400, hr 0.328842). ONE KNOB: train_n 400 -> 579 (THE LAST DATA = full 579-slice Wagner train pool; itnet_v3 used the LEAST data of the 3 climbers -- champion dual_domain_supervised went to 579/full at hr 0.3994, uswin to 480). epochs traded DOWN 9 -> 6 to (a) hold total gradient steps near PARITY with iter-5 (579*6=3474 ~= 400*9=3600) so any hr change isolates DATA COVERAGE not extra optimization, and (b) fit the HARD 20-min train+score wall. All else = iter-5 exactly (itnet_k=3, unet_c=16, alpha_init=0.0037, lr=1e-4, val_n=214, batch_size=1, val_chunk=1, grad_clip=1.0, seed=42). SIX-BOX (NUMBERS): (1) itnet_v3 trajectory: iter-1 ep8/tn200 hr 0.268409 (737.85s); iter-2 ep14/tn200 hr 0.310054 (1010.07s); iter-3 ep18/tn200 hr 0.312282 (1072.94s, epochs PLATEAUED +0.0022); iter-4 ep9/c24/tn200 hr 0.295576 (834.0s, capacity REGRESSED -> revert c16); iter-5 BEST ep9/c16/tn400 hr 0.328842 / SSIM 0.915763 / PSNR 37.54 / RMSE 0.000664 (1006.81s=16.78min, params 3.699M, ~193s of the 1200s budget UNSPENT). The DATA lever delivered the largest single gain (tn200->400 = +0.0165). (2) LIMITER = DATA COVERAGE: itnet_v3 loads a FIXED stratified subset ONCE (load_val_split split=train n=train_n) and merely reshuffles it (torch.randperm) every epoch -- NO RotatingSubsetDataset -- so train_n=400 means the net has only EVER seen 400 of the 579-slice pool (69%). The full pool is 579 slices across 3 ps-groups (154@0.66192, 98@0.73979, 327@0.77873). epochs plateaued (iter-3), capacity regressed (iter-4); the ONE untried within-budget lever is the LAST 30% of data: train_n 400 -> 579 (full). Validated feasible: dual_domain_supervised reached the full pool at c16 within the same 20-min wall (measured 106.3 s/epoch). (3) ONE KNOB: train_n 400 -> 579 (full pool); epochs traded 9 -> 6 to hold grad-step parity (~3474 vs 3600) AND fit the wall. (4) HYPOTHESIS: filling the last 30% of the train pool (400 -> 579, full coverage) lifts hr ABOVE the iter-5 best 0.328842, because itnet_v3 is the END-TO-END unrolled variant (real learnable denoiser trained against the recon objective, so it genuinely benefits from data coverage) and DATA was its strongest confirmed lever (+0.0165 at 200->400) while it used the LEAST data of the 3 climbers. FALSIFIER (NUMBERS): if hr <= 0.328842 at train_n=579/ep6 (grad steps held ~3500), itnet_v3 is at its budget-constrained ceiling (~0.329) with ALL three levers (epochs, capacity, data) exhausted -> it stays #3 on the Mayo board; file the ceiling verdict. (5) BUDGET (HARD 20-min = 1200s train+score): from iter-5's tn400 point per-epoch 68.9s @ tn400 = 0.1723 s/slice, fixed 481s (data load + per-sample-ps projector cache + 214-slice per-sample val + figure + startup). Per-epoch scales LINEARLY with train_n (bs=1 -> train_n steps/epoch), so tn579 -> per-epoch 99.7s. At epochs=6: 481 + 6*99.7 = 1079s = 18.0 min < 1200s with ~121s headroom (conservative 106.3 s/epoch cross-check from dual_domain_supervised tn579: 481 + 6*106.3 = 1119s = 18.7 min, still inside). epochs=7 -> 19.6 min (tight AND breaks parity), so epochs=6 is the parity-preserving choice. Train alone at ep6 = 6*99.7 = 598s < max_train_s=660 backstop, so the backstop does not truncate (checks between epochs; only fences runaway slowdown) and a finite recon + 214-slice val + figure always land inside the 30-min sbatch wall. val stays ALL 214 L277 slices, 321px detector-geometry FOV (evaluate_calibrated default for AGENT4CT_DATASET=mayo_ldct_2d; no fov= override). grad_clip=1.0 retained (mandatory: the 2304-view Mayo FBP adjoint inside dc_step overflows otherwise). HARD-WIRED (unchanged): staged_canonical v3 mayo_ldct_fitted geometry, per-sample-ps FBP init + per-sample itnet.projector swap for the k=3 DC steps, bg_target=truth. (6) do NOT return control mid-campaign. Predicted iter-6 hr: 0.33-0.34 if data-coverage-limited hypothesis holds; <=0.3288 falsifies -> budget-constrained ceiling, all levers exhausted, stays #3.", "advice_for_others": "itnet_v3-claude-agentic: itnet_k=3, unet_c=16, alpha_init=0.0037, lr=0.0001, epochs=6, batch_size=1, val_chunk=1, train_n=579, val_n=214, grad_clip=1.0, max_train_s=660, seed=42, rationale=iter-6 (search-20260619-01, corrected protocol). BASE_ITER=5 (the BEST: c16/ep9/train_n=400, hr 0.328842). ONE KNOB: train_n 400 -> 579 (THE LAST DATA = full 579-slice Wagner train pool; itnet_v3 used the LEAST data of the 3 climbers -- champion dual_domain_supervised went to 579/full at hr 0.3994, uswin to 480). epochs traded DOWN 9 -> 6 to (a) hold total gradient steps near PARITY with iter-5 (579*6=3474 ~= 400*9=3600) so any hr change isolates DATA COVERAGE not extra optimization, and (b) fit the HARD 20-min train+score wall. All else = iter-5 exactly (itnet_k=3, unet_c=16, alpha_init=0.0037, lr=1e-4, val_n=214, batch_size=1, val_chunk=1, grad_clip=1.0, seed=42). SIX-BOX (NUMBERS): (1) itnet_v3 trajectory: iter-1 ep8/tn200 hr 0.268409 (737.85s); iter-2 ep14/tn200 hr 0.310054 (1010.07s); iter-3 ep18/tn200 hr 0.312282 (1072.94s, epochs PLATEAUED +0.0022); iter-4 ep9/c24/tn200 hr 0.295576 (834.0s, capacity REGRESSED -> revert c16); iter-5 BEST ep9/c16/tn400 hr 0.328842 / SSIM 0.915763 / PSNR 37.54 / RMSE 0.000664 (1006.81s=16.78min, params 3.699M, ~193s of the 1200s budget UNSPENT). The DATA lever delivered the largest single gain (tn200->400 = +0.0165). (2) LIMITER = DATA COVERAGE: itnet_v3 loads a FIXED stratified subset ONCE (load_val_split split=train n=train_n) and merely reshuffles it (torch.randperm) every epoch -- NO RotatingSubsetDataset -- so train_n=400 means the net has only EVER seen 400 of the 579-slice pool (69%). The full pool is 579 slices across 3 ps-groups (154@0.66192, 98@0.73979, 327@0.77873). epochs plateaued (iter-3), capacity regressed (iter-4); the ONE untried within-budget lever is the LAST 30% of data: train_n 400 -> 579 (full). Validated feasible: dual_domain_supervised reached the full pool at c16 within the same 20-min wall (measured 106.3 s/epoch). (3) ONE KNOB: train_n 400 -> 579 (full pool); epochs traded 9 -> 6 to hold grad-step parity (~3474 vs 3600) AND fit the wall. (4) HYPOTHESIS: filling the last 30% of the train pool (400 -> 579, full coverage) lifts hr ABOVE the iter-5 best 0.328842, because itnet_v3 is the END-TO-END unrolled variant (real learnable denoiser trained against the recon objective, so it genuinely benefits from data coverage) and DATA was its strongest confirmed lever (+0.0165 at 200->400) while it used the LEAST data of the 3 climbers. FALSIFIER (NUMBERS): if hr <= 0.328842 at train_n=579/ep6 (grad steps held ~3500), itnet_v3 is at its budget-constrained ceiling (~0.329) with ALL three levers (epochs, capacity, data) exhausted -> it stays #3 on the Mayo board; file the ceiling verdict. (5) BUDGET (HARD 20-min = 1200s train+score): from iter-5's tn400 point per-epoch 68.9s @ tn400 = 0.1723 s/slice, fixed 481s (data load + per-sample-ps projector cache + 214-slice per-sample val + figure + startup). Per-epoch scales LINEARLY with train_n (bs=1 -> train_n steps/epoch), so tn579 -> per-epoch 99.7s. At epochs=6: 481 + 6*99.7 = 1079s = 18.0 min < 1200s with ~121s headroom (conservative 106.3 s/epoch cross-check from dual_domain_supervised tn579: 481 + 6*106.3 = 1119s = 18.7 min, still inside). epochs=7 -> 19.6 min (tight AND breaks parity), so epochs=6 is the parity-preserving choice. Train alone at ep6 = 6*99.7 = 598s < max_train_s=660 backstop, so the backstop does not truncate (checks between epochs; only fences runaway slowdown) and a finite recon + 214-slice val + figure always land inside the 30-min sbatch wall. val stays ALL 214 L277 slices, 321px detector-geometry FOV (evaluate_calibrated default for AGENT4CT_DATASET=mayo_ldct_2d; no fov= override). grad_clip=1.0 retained (mandatory: the 2304-view Mayo FBP adjoint inside dc_step overflows otherwise). HARD-WIRED (unchanged): staged_canonical v3 mayo_ldct_fitted geometry, per-sample-ps FBP init + per-sample itnet.projector swap for the k=3 DC steps, bg_target=truth. (6) do NOT return control mid-campaign. Predicted iter-6 hr: 0.33-0.34 if data-coverage-limited hypothesis holds; <=0.3288 falsifies -> budget-constrained ceiling, all levers exhausted, stays #3.", "comparison_image": "runs/mayo-ldct-claude-agentic-itnet-v3-search-20260619-01/iterations/iter-0006/comparison.png"}
