{"ts": "2026-06-21T15:14:57Z", "run_id": "mayo-ldct-claude-agentic-dual-domain-bilateral-n2i-search-20260619-01", "iter": 9, "agent": "dual_domain_bilateral_n2i-claude-agentic", "model": "claude-opus-4-8-1m", "change_class": "architecture", "status": "discard", "kept": false, "val_score": 0.9247283935546875, "headroom": 0.0, "params_M": 6e-06, "train_n": 400, "rationale": "dual_domain_bilateral_n2i-claude-agentic: warm_start=True, pretrain_epochs=1, pretrain_steps=20, n_iter=30, grad_clip=1.0, lr=0.005, proj_n_bf=1, img_n_bf=1, proj_kernel=5, proj_sx=1.0, proj_sy=2.0, proj_sr=0.02, img_kernel=7, img_sx=1.5, img_sy=1.5, img_sr=0.02, batch_size=1, train_n=200, val_n=214, outer_wall_s=1050, per_scene_s=None, seed=123, rationale=iter-9 (search-20260619-01, corrected 214-slice/321px-FOV metric). ONE KNOB: seed 42 -> 123 (per-image N2I init/noise-floor read; GENUINELY UNTRIED -- every iter 1-8 ran seed=42). OFF iter-1 base (best-PSNR config: lr 5e-3, proj_n_bf 1, img_n_bf 1, proj_sr 0.02, proj_kernel 5, proj_sy 2.0 -- the untouched warm-start-anchored baseline; proj_sy REVERTED from iter-8 s 0.5 to 2.0 so this is genuinely ONE knob vs iter-1). PER-IMAGE preserved (warm-start amortized pre-pass on 4 train patients -> generic BF-sigma init, then INDEPENDENT per-scan Adam fit on EACH L277 slice OWN half-angle measurements, GT-free; NEVER amortized; warm_start=True, grad_clip=1.0 MANDATORY). SIX-BOX (NUMBERS). (1) TRAJECTORY: iter-1 lr5e-3 seed42 -> SSIM 0.92477 / PSNR 34.033 / RMSE 9.938e-4 / hr 0 / 940.4s (HIGHEST raw SSIM); iter-2 proj_sr0.02->0.0005 -> SSIM 0.92473 / hr 0 (proj_sr range INERT, RETIRED); iter-3 lr5e-3->3e-4 -> SSIM 0.92142 / hr 0 (lr-down REGRESSED); iter-4 img_n_bf1->2 -> SSIM 0.89748 / hr 0 (image-domain depth REGRESSED hard); iter-5 proj_n_bf1->2 -> SSIM 0.92468 / hr 0 (proj-depth +1 mild regress); iter-6 proj_kernel5->7 -> SSIM 0.924766 / hr 0 (proj footprint flat); iter-7 proj_n_bf1->3 -> SSIM 0.925289 / PSNR 34.097 / hr 0 / 1129.1s (marginal best, proj-depth saturated); iter-8 proj_sy2.0->0.5 -> SSIM 0.924657 / PSNR 34.022 / hr 0 / 892.8s (proj spatial-sigma FLAT, falsifier fired). Best hr 0.0 throughout, best SSIM 0.9253 (iter-7). All ran seed=42. (2) LIMITER = 6-param trainable-bilateral CAPACITY CEILING on dense-view 2304-view Mayo: HIGHEST raw SSIM of any Mayo inference solver (0.925) yet PSNR sits BELOW the LD-FBP floor -> hr 0 (over-smoothing signature). Confirmed-dead proj/image shape+depth+lr knobs: proj_sr range (inert iter-2), per-scan lr-down (regressed iter-3), img_n_bf depth (regressed iter-4), proj_n_bf depth (flat-marginal iters 5/7), proj_kernel footprint (flat iter-6), proj_sy spatial-sigma (flat iter-8). (3) ONE KNOB = seed 42->123: the per-image N2I INIT/noise-floor axis is GENUINELY UNTRIED on this solver -- all 8 prior iters fixed seed=42 (campaign-state line 181 lists seed-equivalent init as a tunable, and line 205-206 documents a per-image N2I noise floor large enough that a SEED FLIP ALONE swung demo-n2i 0.5081->0.4203). Campaign precedent: two ceiling-confirmed solvers were SURPRISED on a seed read. A seed flip is the last single-knob init probe before the iter-20 ceiling-confirmation; it tests whether the hr-0 / SSIM-0.925 read is seed-robust (a true ceiling) or seed-fragile (an init artifact). seed is a pure init knob: n_iter=30, proj_n_bf=1, 214-scans, 2304-view FBP-adjoint cost ALL UNCHANGED. (4) HYPOTHESIS: a different init seed reseeds the warm-start pre-pass + per-scan Adam noise; if the bilateral ceiling is TRUE the read is seed-robust -> SSIM ~0.925 +/-0.001, hr 0 (confirms ceiling); if there is hidden init variance it could swing like demo-n2i. NUMERIC FALSIFIER: if SSIM stays within 0.924-0.926 and hr stays 0 at seed=123, the hr-0 / SSIM-0.925 read is SEED-ROBUST -> the 6-param bilateral N2I CEILING is CONFIRMED on dense Mayo (every shape/depth/lr/init knob mapped-and-dead); structural-ceiling verdict FILED toward iter-20: only the U-Net N2I real-denoiser capacity clears the FBP floor here (half-view N2I info loss < full-view LD-FBP). If SSIM swings >0.926 or hr>0, seed is a live init lever and the ceiling read was an artifact. (5) BUDGET (HARD 20-min = 1200s train+score): seed is a pure init knob -- n_iter=30, proj_n_bf=1 (CHEAP 1-proj-layer config, NOT iter-7 s proj_n_bf=3), 214-scans, 2304-view FBP-adjoint ALL UNCHANGED. iter-1 at this exact config ran 940.4s = 15.7 min; iter-8 (same 1-proj-layer cost) ran 892.8s = 14.9 min. Expect ~900-940s = ~15-16 min, ~260s slack inside 1200s -- ZERO budget risk. val=ALL 214 L277 slices, grad_clip=1.0 MANDATORY. in-solver outer_wall_s=1050 (17.5 min) backstop GUARANTEES a recorded result even if some slices run long. (6) HARD 20-min budget; val=ALL 214 L277 slices (NOT reduced); PER-IMAGE preserved (warm_start True, grad_clip 1.0, img_sr 0.02 NOT tightened, lr/img_n_bf/proj_sr/proj_kernel/proj_n_bf/proj_sy all at iter-1 values). Do NOT return control mid-campaign. PREDICTED iter-9: SSIM ~0.925 +/-0.001 / hr 0 if ceiling is seed-robust (confirms 6-param bilateral N2I ceiling); SSIM swing >0.926 or hr>0 falsifies (seed is a live init lever).", "advice_for_others": "dual_domain_bilateral_n2i-claude-agentic: warm_start=True, pretrain_epochs=1, pretrain_steps=20, n_iter=30, grad_clip=1.0, lr=0.005, proj_n_bf=1, img_n_bf=1, proj_kernel=5, proj_sx=1.0, proj_sy=2.0, proj_sr=0.02, img_kernel=7, img_sx=1.5, img_sy=1.5, img_sr=0.02, batch_size=1, train_n=200, val_n=214, outer_wall_s=1050, per_scene_s=None, seed=123, rationale=iter-9 (search-20260619-01, corrected 214-slice/321px-FOV metric). ONE KNOB: seed 42 -> 123 (per-image N2I init/noise-floor read; GENUINELY UNTRIED -- every iter 1-8 ran seed=42). OFF iter-1 base (best-PSNR config: lr 5e-3, proj_n_bf 1, img_n_bf 1, proj_sr 0.02, proj_kernel 5, proj_sy 2.0 -- the untouched warm-start-anchored baseline; proj_sy REVERTED from iter-8 s 0.5 to 2.0 so this is genuinely ONE knob vs iter-1). PER-IMAGE preserved (warm-start amortized pre-pass on 4 train patients -> generic BF-sigma init, then INDEPENDENT per-scan Adam fit on EACH L277 slice OWN half-angle measurements, GT-free; NEVER amortized; warm_start=True, grad_clip=1.0 MANDATORY). SIX-BOX (NUMBERS). (1) TRAJECTORY: iter-1 lr5e-3 seed42 -> SSIM 0.92477 / PSNR 34.033 / RMSE 9.938e-4 / hr 0 / 940.4s (HIGHEST raw SSIM); iter-2 proj_sr0.02->0.0005 -> SSIM 0.92473 / hr 0 (proj_sr range INERT, RETIRED); iter-3 lr5e-3->3e-4 -> SSIM 0.92142 / hr 0 (lr-down REGRESSED); iter-4 img_n_bf1->2 -> SSIM 0.89748 / hr 0 (image-domain depth REGRESSED hard); iter-5 proj_n_bf1->2 -> SSIM 0.92468 / hr 0 (proj-depth +1 mild regress); iter-6 proj_kernel5->7 -> SSIM 0.924766 / hr 0 (proj footprint flat); iter-7 proj_n_bf1->3 -> SSIM 0.925289 / PSNR 34.097 / hr 0 / 1129.1s (marginal best, proj-depth saturated); iter-8 proj_sy2.0->0.5 -> SSIM 0.924657 / PSNR 34.022 / hr 0 / 892.8s (proj spatial-sigma FLAT, falsifier fired). Best hr 0.0 throughout, best SSIM 0.9253 (iter-7). All ran seed=42. (2) LIMITER = 6-param trainable-bilateral CAPACITY CEILING on dense-view 2304-view Mayo: HIGHEST raw SSIM of any Mayo inference solver (0.925) yet PSNR sits BELOW the LD-FBP floor -> hr 0 (over-smoothing signature). Confirmed-dead proj/image shape+depth+lr knobs: proj_sr range (inert iter-2), per-scan lr-down (regressed iter-3), img_n_bf depth (regressed iter-4), proj_n_bf depth (flat-marginal iters 5/7), proj_kernel footprint (flat iter-6), proj_sy spatial-sigma (flat iter-8). (3) ONE KNOB = seed 42->123: the per-image N2I INIT/noise-floor axis is GENUINELY UNTRIED on this solver -- all 8 prior iters fixed seed=42 (campaign-state line 181 lists seed-equivalent init as a tunable, and line 205-206 documents a per-image N2I noise floor large enough that a SEED FLIP ALONE swung demo-n2i 0.5081->0.4203). Campaign precedent: two ceiling-confirmed solvers were SURPRISED on a seed read. A seed flip is the last single-knob init probe before the iter-20 ceiling-confirmation; it tests whether the hr-0 / SSIM-0.925 read is seed-robust (a true ceiling) or seed-fragile (an init artifact). seed is a pure init knob: n_iter=30, proj_n_bf=1, 214-scans, 2304-view FBP-adjoint cost ALL UNCHANGED. (4) HYPOTHESIS: a different init seed reseeds the warm-start pre-pass + per-scan Adam noise; if the bilateral ceiling is TRUE the read is seed-robust -> SSIM ~0.925 +/-0.001, hr 0 (confirms ceiling); if there is hidden init variance it could swing like demo-n2i. NUMERIC FALSIFIER: if SSIM stays within 0.924-0.926 and hr stays 0 at seed=123, the hr-0 / SSIM-0.925 read is SEED-ROBUST -> the 6-param bilateral N2I CEILING is CONFIRMED on dense Mayo (every shape/depth/lr/init knob mapped-and-dead); structural-ceiling verdict FILED toward iter-20: only the U-Net N2I real-denoiser capacity clears the FBP floor here (half-view N2I info loss < full-view LD-FBP). If SSIM swings >0.926 or hr>0, seed is a live init lever and the ceiling read was an artifact. (5) BUDGET (HARD 20-min = 1200s train+score): seed is a pure init knob -- n_iter=30, proj_n_bf=1 (CHEAP 1-proj-layer config, NOT iter-7 s proj_n_bf=3), 214-scans, 2304-view FBP-adjoint ALL UNCHANGED. iter-1 at this exact config ran 940.4s = 15.7 min; iter-8 (same 1-proj-layer cost) ran 892.8s = 14.9 min. Expect ~900-940s = ~15-16 min, ~260s slack inside 1200s -- ZERO budget risk. val=ALL 214 L277 slices, grad_clip=1.0 MANDATORY. in-solver outer_wall_s=1050 (17.5 min) backstop GUARANTEES a recorded result even if some slices run long. (6) HARD 20-min budget; val=ALL 214 L277 slices (NOT reduced); PER-IMAGE preserved (warm_start True, grad_clip 1.0, img_sr 0.02 NOT tightened, lr/img_n_bf/proj_sr/proj_kernel/proj_n_bf/proj_sy all at iter-1 values). Do NOT return control mid-campaign. PREDICTED iter-9: SSIM ~0.925 +/-0.001 / hr 0 if ceiling is seed-robust (confirms 6-param bilateral N2I ceiling); SSIM swing >0.926 or hr>0 falsifies (seed is a live init lever).", "comparison_image": "runs/mayo-ldct-claude-agentic-dual-domain-bilateral-n2i-search-20260619-01/iterations/iter-0009/comparison.png"}
{"ts": "2026-06-21T15:14:35Z", "run_id": "mayo-ldct-claude-agentic-tv-iterative-supervised-search-20260619-01", "iter": 9, "agent": "tv_iterative_supervised-claude-agentic", "model": "claude-opus-4-8-1m", "change_class": "architecture", "status": "discard", "kept": false, "val_score": 0.8192252516746521, "headroom": 0.0, "params_M": 2e-06, "train_n": 400, "rationale": "tv_iterative_supervised-claude-agentic: val_n=214, val_chunk=5, train_n=40, epochs=8, batch_size=1, lr=0.005, tv_K=8, tv_step_init=1e-05, tv_lambda_init=0.001, tv_share_steps=True, tv_clip_max=0.05, tv_eps=1e-06, lambda_neg=1.0, loss_base=mse, grad_clip=1.0, rationale=tv_iterative_supervised iter-9 (search-20260619-01, corrected 214-slice/321px-FOV metric). BASE_ITER=7 (BEST SSIM 0.8192 / hr 0.0, the stable share=True step=1e-5 lr=5e-3 K=8 config). TRAJECTORY (SSIM/hr): iter-1 K=10 0.2855/0; iter-2 K=30 0.2855/0 (depth FALSIFIED at frozen-step, byte-identical); iter-3 step=1e-8 0.8137/0 (LD-FBP PASSTHROUGH); iter-4 step=1e-5 share=F 0.6949/0 (per-step RUNAWAY into clamp); iter-5 step=1e-5 share=T 0.6074/0 (per-step fixed, LAMBDA runaway); iter-6 lr 5e-2->5e-3 0.8185/0 (lambda runaway tamed -> recovered to FBP floor); iter-7 tv_K 30->8 0.8192/0 (depth-DOWN did NOT break out -> sits EXACTLY at the FBP passthrough floor); iter-8 train_n 40->160 0.8186/0 (4x data coverage did NOT beat 0.8192 -> CAPACITY-bound not data-bound). BEST SSIM 0.8192 (iter-7); hr=0.0 EVERY iter. MAPPED+FALSIFIED KNOBS: tv_step_init {1e-2 saturate, 1e-8 passthrough, 1e-5 active-basin}; tv_share_steps {F runaway, T stable}; tv_lr {5e-2 over-drives lambda, 5e-3 stable}; tv_K {10/30 inert at frozen-step, 8 flat at stable regime -- depth-DOWN breakout analog FAILED}; train_n {40 base, 160 flat -> capacity-bound}. HELD CONSTANT ALL 8 ITERS, NEVER PROBED: seed (no seed key has EVER appeared in any cfg -> the harness fixed-default seed has been used every iter), tv_lambda_init=1e-3, epochs=8. LIMITER: capacity-bound supervised-TV at the LD-FBP passthrough floor -- 2 trainable scalars (share=True) settle into a near-identity map on fbp_init; SSIM pinned ~0.8192 across depth AND data-coverage axes. ONE KNOB CHANGED (from BASE_ITER=7): seed default->123 (the GENUINELY-UNTRIED single lever; this campaign saw TWO ceiling-confirmed solvers SURPRISE on a seed change, so a seed noise-floor read is the correct probe before declaring the supervised-TV FBP-ceiling). seed governs the data-order shuffle of the rotating train subset + any stochastic Adam-path noise over the 8-epoch 2-scalar fit. All else IDENTICAL to iter-7 (tv_share_steps=True, tv_step_init=1e-5, tv_lr=5e-3, tv_lambda_init=1e-3, tv_K=8, train_n=40, epochs=8, bs=1, tv_clip_max=0.05, tv_eps=1e-6, val_n=214 ALL L277, val_chunk=5, grad_clip=1.0). HYPOTHESIS: a seed change reads the noise floor of the 2-scalar supervised fit. Most-likely SSIM lands within +-0.003 of 0.8192 (the trained step/lambda converge to the same FBP-passthrough basin regardless of data-order), CONFIRMING the supervised-TV FBP-ceiling is seed-robust -> documents the ceiling cleanly toward iter-20. SURPRISE branch: if SSIM > 0.8222 (clears the noise band), seed-sensitivity is real and iter-10 would multi-seed to characterize it (mirroring the two ceiling-confirmed solvers that broke out on seed this campaign). NUMERIC FALSIFIER (decisive): if SSIM in [0.8162, 0.8222] with hr=0.0, the seed lever is exhausted -- supervised-unrolled-TV is CONFIRMED FBP-bounded AND seed-robust on real Mayo 2304-view LDCT under the config-only contract (the shared solvers raw unnormalized-adjoint back_project step is FORBIDDEN to edit) -> the LAST genuinely-untried single lever is RETIRED, file the supervised-TV FBP-ceiling negative result. BUDGET (HARD 20-min train+score = 1200s): IDENTICAL compute to iter-7 (seed changes ONLY the RNG state, not any loop size: same K=8, train_n=40, epochs=8, bs=1, val_n=214, val_chunk=5) -> ~260.7s measured iter-7, vast >900s margin under the 1200s wall; sbatch --time=00:30:00 carries figure/IO headroom. PREDICTED iter-9: SSIM ~0.817-0.821 (most-likely 0.8192 +-0.003), hr 0.0 (a single global-TV weight over a near-complete 2304-view inverse is a structurally weak image-domain prior; a data-order reshuffle of a 2-scalar fit cannot manufacture headroom); small chance SSIM > 0.8222 if the fit is seed-sensitive. This iter is a GENUINELY-UNTRIED lever (seed NEVER probed in 8 iters); if it falsifies, it RETIRES THE LAST single lever and documents the supervised-TV FBP-ceiling., seed=123", "advice_for_others": "tv_iterative_supervised-claude-agentic: val_n=214, val_chunk=5, train_n=40, epochs=8, batch_size=1, lr=0.005, tv_K=8, tv_step_init=1e-05, tv_lambda_init=0.001, tv_share_steps=True, tv_clip_max=0.05, tv_eps=1e-06, lambda_neg=1.0, loss_base=mse, grad_clip=1.0, rationale=tv_iterative_supervised iter-9 (search-20260619-01, corrected 214-slice/321px-FOV metric). BASE_ITER=7 (BEST SSIM 0.8192 / hr 0.0, the stable share=True step=1e-5 lr=5e-3 K=8 config). TRAJECTORY (SSIM/hr): iter-1 K=10 0.2855/0; iter-2 K=30 0.2855/0 (depth FALSIFIED at frozen-step, byte-identical); iter-3 step=1e-8 0.8137/0 (LD-FBP PASSTHROUGH); iter-4 step=1e-5 share=F 0.6949/0 (per-step RUNAWAY into clamp); iter-5 step=1e-5 share=T 0.6074/0 (per-step fixed, LAMBDA runaway); iter-6 lr 5e-2->5e-3 0.8185/0 (lambda runaway tamed -> recovered to FBP floor); iter-7 tv_K 30->8 0.8192/0 (depth-DOWN did NOT break out -> sits EXACTLY at the FBP passthrough floor); iter-8 train_n 40->160 0.8186/0 (4x data coverage did NOT beat 0.8192 -> CAPACITY-bound not data-bound). BEST SSIM 0.8192 (iter-7); hr=0.0 EVERY iter. MAPPED+FALSIFIED KNOBS: tv_step_init {1e-2 saturate, 1e-8 passthrough, 1e-5 active-basin}; tv_share_steps {F runaway, T stable}; tv_lr {5e-2 over-drives lambda, 5e-3 stable}; tv_K {10/30 inert at frozen-step, 8 flat at stable regime -- depth-DOWN breakout analog FAILED}; train_n {40 base, 160 flat -> capacity-bound}. HELD CONSTANT ALL 8 ITERS, NEVER PROBED: seed (no seed key has EVER appeared in any cfg -> the harness fixed-default seed has been used every iter), tv_lambda_init=1e-3, epochs=8. LIMITER: capacity-bound supervised-TV at the LD-FBP passthrough floor -- 2 trainable scalars (share=True) settle into a near-identity map on fbp_init; SSIM pinned ~0.8192 across depth AND data-coverage axes. ONE KNOB CHANGED (from BASE_ITER=7): seed default->123 (the GENUINELY-UNTRIED single lever; this campaign saw TWO ceiling-confirmed solvers SURPRISE on a seed change, so a seed noise-floor read is the correct probe before declaring the supervised-TV FBP-ceiling). seed governs the data-order shuffle of the rotating train subset + any stochastic Adam-path noise over the 8-epoch 2-scalar fit. All else IDENTICAL to iter-7 (tv_share_steps=True, tv_step_init=1e-5, tv_lr=5e-3, tv_lambda_init=1e-3, tv_K=8, train_n=40, epochs=8, bs=1, tv_clip_max=0.05, tv_eps=1e-6, val_n=214 ALL L277, val_chunk=5, grad_clip=1.0). HYPOTHESIS: a seed change reads the noise floor of the 2-scalar supervised fit. Most-likely SSIM lands within +-0.003 of 0.8192 (the trained step/lambda converge to the same FBP-passthrough basin regardless of data-order), CONFIRMING the supervised-TV FBP-ceiling is seed-robust -> documents the ceiling cleanly toward iter-20. SURPRISE branch: if SSIM > 0.8222 (clears the noise band), seed-sensitivity is real and iter-10 would multi-seed to characterize it (mirroring the two ceiling-confirmed solvers that broke out on seed this campaign). NUMERIC FALSIFIER (decisive): if SSIM in [0.8162, 0.8222] with hr=0.0, the seed lever is exhausted -- supervised-unrolled-TV is CONFIRMED FBP-bounded AND seed-robust on real Mayo 2304-view LDCT under the config-only contract (the shared solvers raw unnormalized-adjoint back_project step is FORBIDDEN to edit) -> the LAST genuinely-untried single lever is RETIRED, file the supervised-TV FBP-ceiling negative result. BUDGET (HARD 20-min train+score = 1200s): IDENTICAL compute to iter-7 (seed changes ONLY the RNG state, not any loop size: same K=8, train_n=40, epochs=8, bs=1, val_n=214, val_chunk=5) -> ~260.7s measured iter-7, vast >900s margin under the 1200s wall; sbatch --time=00:30:00 carries figure/IO headroom. PREDICTED iter-9: SSIM ~0.817-0.821 (most-likely 0.8192 +-0.003), hr 0.0 (a single global-TV weight over a near-complete 2304-view inverse is a structurally weak image-domain prior; a data-order reshuffle of a 2-scalar fit cannot manufacture headroom); small chance SSIM > 0.8222 if the fit is seed-sensitive. This iter is a GENUINELY-UNTRIED lever (seed NEVER probed in 8 iters); if it falsifies, it RETIRES THE LAST single lever and documents the supervised-TV FBP-ceiling., seed=123", "comparison_image": "runs/mayo-ldct-claude-agentic-tv-iterative-supervised-search-20260619-01/iterations/iter-0009/comparison.png"}
