{"ts": "2026-06-19T14:43:36Z", "run_id": "mayo-ldct-claude-agentic-naf-search-20260619-01", "iter": 1, "agent": "naf-claude-agentic-breast-ct", "model": "claude-opus-4.7-1m", "change_class": "architecture", "status": "discard", "kept": false, "val_score": 0.4728808104991913, "headroom": 0.0, "params_M": 0.037633, "train_n": 400, "rationale": "naf-claude-agentic: val_n=214, naf_n_freqs=8, naf_hidden=128, naf_layers=4, naf_n_iter=3000, naf_lr=0.01, naf_tv_weight=0.0001, naf_n_clip=0.05, naf_outer_wall_s=1080, naf_per_scene_s=5.0, seed=42, rationale=ITER-1 feasibility (search-20260619-01, corrected protocol). GOAL: does naf (Neural Attenuation Field, per-scene self-supervised INR -- one coordinate-MLP optimized PER L277 slice against its OWN sinogram, no training set) run on Mayo under the corrected path (staged_canonical v3 mayo_ldct_fitted geometry, inlined single-val-ps probe -> reconstructs at L277 native ps ~0.73979, bg_target=truth) and produce a FINITE val_score + comparison.png within the HARD 20-min budget, scoring ALL 214 L277 slices under the 321px detector-geometry FOV (evaluate_calibrated default for AGENT4CT_DATASET=mayo_ldct_2d; no fov= override)? BUDGET REASONING (the load-bearing decision): NAF has NO training (train_n=0); the ENTIRE budget is the per-scene fit loop, total = val_n x per_scene. val=ALL 214 L277 slices is MANDATORY (protocol; do NOT reduce). 18-min outer wall (naf_outer_wall_s=1080, inside the 20-min compute budget, leaving headroom for the figure+IO before the 30-min sbatch kill) / 214 scenes = naf_per_scene_s=5.0 s/scene. Mayo is 512x512 images at 2304 views x 736 channels, so each Adam step = a 512^2 MLP forward + a 2304-view fan-beam forward-project + backward = EXPENSIVE; 5 s/scene buys only a handful of steps (a NeRF-style fit wants hundreds-to-thousands). naf_n_iter=3000 is a HIGH CAP so the PER-SCENE WALL (t_limit in fit_one_scene), NOT the iter count, is the governor -- each scene runs as many steps as fit in 5 s. To squeeze the most out of the tiny budget: leaner MLP than default (hidden 192->128, layers 5->4, n_freqs 10->8 => cheaper steps => a few more fit per scene) and naf_lr 5e-3->1e-2 (with only a handful of steps, a higher lr converges faster from the water-mu init). naf_n_clip=0.05 (sigmoid head out_scale), naf_tv_weight=1e-4 defaults. HYPOTHESIS: NAF is STRUCTURALLY FBP-bounded on dense rebinned Mayo (wrong inductive bias for dense-view CT -- solver_plan.md flags NAF/R2G hr~0 on dense-view; the discarded boundary-slice run hinted naf 0.911 < LD-FBP ~0.81-cal baseline, a behavior hint only) AND it is BUDGET-STARVED on the 214-slice protocol (5 s/scene = far too few per-scene Adam steps for a NeRF-style convergence). Expect val_ssim that does NOT clear the LD-FBP baseline (hr near 0). This iter ESTABLISHES that datapoint under the corrected metric -- a real finding (do NOT reduce val_n below 214 to make NAF look better). iter-2+ will tune ONE knob (per-scene step budget vs MLP capacity vs lr) but NAF cannot escape its structural ceiling on this dense substrate within a 20-min/214-scene budget.", "advice_for_others": "naf-claude-agentic: val_n=214, naf_n_freqs=8, naf_hidden=128, naf_layers=4, naf_n_iter=3000, naf_lr=0.01, naf_tv_weight=0.0001, naf_n_clip=0.05, naf_outer_wall_s=1080, naf_per_scene_s=5.0, seed=42, rationale=ITER-1 feasibility (search-20260619-01, corrected protocol). GOAL: does naf (Neural Attenuation Field, per-scene self-supervised INR -- one coordinate-MLP optimized PER L277 slice against its OWN sinogram, no training set) run on Mayo under the corrected path (staged_canonical v3 mayo_ldct_fitted geometry, inlined single-val-ps probe -> reconstructs at L277 native ps ~0.73979, bg_target=truth) and produce a FINITE val_score + comparison.png within the HARD 20-min budget, scoring ALL 214 L277 slices under the 321px detector-geometry FOV (evaluate_calibrated default for AGENT4CT_DATASET=mayo_ldct_2d; no fov= override)? BUDGET REASONING (the load-bearing decision): NAF has NO training (train_n=0); the ENTIRE budget is the per-scene fit loop, total = val_n x per_scene. val=ALL 214 L277 slices is MANDATORY (protocol; do NOT reduce). 18-min outer wall (naf_outer_wall_s=1080, inside the 20-min compute budget, leaving headroom for the figure+IO before the 30-min sbatch kill) / 214 scenes = naf_per_scene_s=5.0 s/scene. Mayo is 512x512 images at 2304 views x 736 channels, so each Adam step = a 512^2 MLP forward + a 2304-view fan-beam forward-project + backward = EXPENSIVE; 5 s/scene buys only a handful of steps (a NeRF-style fit wants hundreds-to-thousands). naf_n_iter=3000 is a HIGH CAP so the PER-SCENE WALL (t_limit in fit_one_scene), NOT the iter count, is the governor -- each scene runs as many steps as fit in 5 s. To squeeze the most out of the tiny budget: leaner MLP than default (hidden 192->128, layers 5->4, n_freqs 10->8 => cheaper steps => a few more fit per scene) and naf_lr 5e-3->1e-2 (with only a handful of steps, a higher lr converges faster from the water-mu init). naf_n_clip=0.05 (sigmoid head out_scale), naf_tv_weight=1e-4 defaults. HYPOTHESIS: NAF is STRUCTURALLY FBP-bounded on dense rebinned Mayo (wrong inductive bias for dense-view CT -- solver_plan.md flags NAF/R2G hr~0 on dense-view; the discarded boundary-slice run hinted naf 0.911 < LD-FBP ~0.81-cal baseline, a behavior hint only) AND it is BUDGET-STARVED on the 214-slice protocol (5 s/scene = far too few per-scene Adam steps for a NeRF-style convergence). Expect val_ssim that does NOT clear the LD-FBP baseline (hr near 0). This iter ESTABLISHES that datapoint under the corrected metric -- a real finding (do NOT reduce val_n below 214 to make NAF look better). iter-2+ will tune ONE knob (per-scene step budget vs MLP capacity vs lr) but NAF cannot escape its structural ceiling on this dense substrate within a 20-min/214-scene budget.", "comparison_image": "runs/mayo-ldct-claude-agentic-naf-search-20260619-01/iterations/iter-0001/comparison.png"}
{"ts": "2026-06-19T14:25:15Z", "run_id": "mayo-ldct-claude-agentic-ram-search-20260619-01", "iter": 1, "agent": "ram_zeroshot-claude-agentic-breast-ct", "model": "claude-opus-4.7-1m", "change_class": "architecture", "status": "discard", "kept": false, "val_score": 0.8611049652099609, "headroom": 0.0, "params_M": 35.618953, "train_n": 400, "rationale": "ram_zeroshot-claude-agentic: ram_ckpt_path=/cluster/maier/Agent4CT/checkpoints/ram.pth.tar, ram_input_norm=adjoint_max, ram_clamp_output=True, ram_finetune=False, ram_finetune_epochs=0, ram_finetune_lr=0.0001, ram_disable_multiscale=True, ram_disable_cudnn=False, ram_use_deepinv_tomo=False, ram_sigma=0.005, ram_factor=0.55, ram_post_fbp_blend=0.3, val_n=214, rationale=iter-1 baseline (search-20260619-01, corrected protocol): zero-shot RAM single forward pass per slice, finetune OFF. Seeded from the discarded 0614 Mayo RAM iter-1 behavior point (adjoint_max norm, multiscale disabled, sigma=5e-3, factor=0.55, fbp_blend=0.30) which on breast-CT cleared baseline at hr=0.187. ONLY change vs that point is val_n 20->214 (corrected protocol: score ALL 214 L277 slices @ 321px detector-geometry FOV). Hypothesis: zero-shot RAM (pretrained, unknown training distribution, never seen real LDCT helical-rebinned fan data) lands NEAR or just BELOW the LD-FBP baseline (hr ~0 to slightly positive); RAM is structurally FBP-bounded on Mayo per the discarded-run hint (0.9393 < LD-FBP). Budget: finetune OFF => cost = 214 single forward passes (~3.2s/slice on breast-CT 512^2; multiscale disabled cuts per-slice physics evals) + one-time op-norm power iter, comfortably inside the HARD 20-min train+score budget; sbatch --time=00:30:00 is the backstop wall (no in-solver wall knob in solver_ram.py).", "advice_for_others": "ram_zeroshot-claude-agentic: ram_ckpt_path=/cluster/maier/Agent4CT/checkpoints/ram.pth.tar, ram_input_norm=adjoint_max, ram_clamp_output=True, ram_finetune=False, ram_finetune_epochs=0, ram_finetune_lr=0.0001, ram_disable_multiscale=True, ram_disable_cudnn=False, ram_use_deepinv_tomo=False, ram_sigma=0.005, ram_factor=0.55, ram_post_fbp_blend=0.3, val_n=214, rationale=iter-1 baseline (search-20260619-01, corrected protocol): zero-shot RAM single forward pass per slice, finetune OFF. Seeded from the discarded 0614 Mayo RAM iter-1 behavior point (adjoint_max norm, multiscale disabled, sigma=5e-3, factor=0.55, fbp_blend=0.30) which on breast-CT cleared baseline at hr=0.187. ONLY change vs that point is val_n 20->214 (corrected protocol: score ALL 214 L277 slices @ 321px detector-geometry FOV). Hypothesis: zero-shot RAM (pretrained, unknown training distribution, never seen real LDCT helical-rebinned fan data) lands NEAR or just BELOW the LD-FBP baseline (hr ~0 to slightly positive); RAM is structurally FBP-bounded on Mayo per the discarded-run hint (0.9393 < LD-FBP). Budget: finetune OFF => cost = 214 single forward passes (~3.2s/slice on breast-CT 512^2; multiscale disabled cuts per-slice physics evals) + one-time op-norm power iter, comfortably inside the HARD 20-min train+score budget; sbatch --time=00:30:00 is the backstop wall (no in-solver wall knob in solver_ram.py).", "comparison_image": "runs/mayo-ldct-claude-agentic-ram-search-20260619-01/iterations/iter-0001/comparison.png"}
{"ts": "2026-06-19T14:13:30Z", "run_id": "mayo-ldct-claude-agentic-wu-2015-trainable-search-20260619-01", "iter": 1, "agent": "wu_2015_trainable-claude-agentic-breast-ct", "model": "claude-opus-4.7-1m", "change_class": "architecture", "status": "keep", "kept": true, "val_score": 0.8370307087898254, "headroom": 0.05080024541966299, "params_M": 8e-06, "train_n": 400, "rationale": "wu_2015_trainable-claude-agentic: wu_n_bands=4, wu_n_outer=1, lr=0.01, epochs=6, batch_size=1, val_chunk=1, train_n=200, val_n=214, grad_clip=1.0, lambda_neg=1.0, weight_decay=0.0, loss_base=mse, seed=42, rationale=ITER-1 feasibility (search-20260619-01, corrected protocol) for wu_2015_trainable = end-to-end TRAINABLE Wu 2015 reconstruction (solver_wu_2015_trainable.py). GOAL: does Wu-trainable run on Mayo under the corrected path (staged_canonical v3 mayo_ldct_fitted geometry, per-sample-ps FBP + per-sample model.proj/model.dense_proj swap, bg_target=truth) and produce a FINITE val_score + comparison.png within the HARD 20-min train+score budget, scoring ALL 214 L277 slices under the 321px detector-geometry FOV (evaluate_calibrated default for AGENT4CT_DATASET=mayo_ldct_2d; NO fov= override)? ARCHITECTURE NOTE: this solver trains ONLY a handful of nn.Parameter scalars (per-band log-scale x4, sigmoid slope+offset x2, per-outer soft-threshold + residual-blend) wrapped around a band-weighted aliasing-free FBP + a soft-thresholded dense-residual pass; with wu_n_outer=1 that is 4+2+1+1 = 8 trainable scalars (n_bands=4). All scalars are HARD-CLAMPED inside the solver (band_scale 0.1-3.0, blend -0.5-2.0, soft_thresh 1e-5-0.05) so the optimizer cannot run away. CONFIG: wu_n_outer=1 (the discarded boundary-slice run flagged n_outer=1 as mandatory -- behavior hint only; it also HALVES the costly 2x-dense-projector residual pass per sample, the dominant per-slice cost), wu_n_bands=4 (default), lr=1e-2 (solver default; aggressive lr is fine for ~8 scalars and converges fast), epochs=6 (8 clamped scalars settle in very few epochs at lr=1e-2 -- this is NOT a deep net that under-trains; the real risk here is the opposite structural FBP ceiling, not under-convergence), train_n=200 stratified across the 4 Wagner train patients ps-groups, val_n=214 = ALL L277 slices, batch_size=1 + val_chunk=1 FORCED by per-sample-ps (each train step + each val slice swaps model.proj AND model.dense_proj to its slice ps), grad_clip=1.0 (MANDATORY Mayo guard: the 2304-view FBP adjoint overflows otherwise), lambda_neg=1.0, weight_decay=0.0 (defer to iter-2+; the discarded run hinted weight_decay tuning around its run-best iter-11, treat as loose behavior hint only), loss_base=mse, seed=42. BUDGET REASONING: the solver has NO in-code max_train_s wall hook (cannot add one -- must not edit the solver .py), so the budget is enforced by SIZING: with wu_n_outer=1 the per-sample cost is 1 band-weighted sparse-FBP (4-band backproject) + 1 forward_project + 1 dense-FBP + 1 back_project -- heavier than DD-UNet (iter-1 418s @ep8) but LIGHTER than the unrolled k=3 itnet_v3 (iter-1 738s @ep8) because there is no per-step unrolled DC loop; at only 6 epochs over 200 train slices the dominant cost is the 214-slice val pass at chunk=1 with the dense projector. This sizes train+score comfortably under the 20-min budget (30-min SLURM wall) with room for the figure. HYPOTHESIS: if I fit Wu-trainable at n_outer=1 / lr=1e-2 / ep=6 on 200 stratified Mayo train slices, I expect a finite val_ssim that lands in/near the LD-FBP baseline band (~0.84-0.89 SSIM, hr near 0), because Wu-trainable is a tuned-FBP family (band-reweighting + ONE soft-thresholded residual pass, NO image-domain CNN denoiser) and can only recover the small headroom that band weighting + a single residual correction buys over plain FBP -- it is structurally close to FBP, unlike the dual-domain U-Net families that landed hr~0.27. The discarded boundary-slice run hinted ~0.9135 SSIM at run-best iter-11 (loose behavior hint, NOT a validated number under the corrected 214-slice 321px-FOV metric). This onboarding iter establishes the corrected-metric Wu-trainable baseline that iter-2+ will improve by tuning ONE knob (epochs/weight_decay first, then band/sigmoid knobs).", "advice_for_others": "wu_2015_trainable-claude-agentic: wu_n_bands=4, wu_n_outer=1, lr=0.01, epochs=6, batch_size=1, val_chunk=1, train_n=200, val_n=214, grad_clip=1.0, lambda_neg=1.0, weight_decay=0.0, loss_base=mse, seed=42, rationale=ITER-1 feasibility (search-20260619-01, corrected protocol) for wu_2015_trainable = end-to-end TRAINABLE Wu 2015 reconstruction (solver_wu_2015_trainable.py). GOAL: does Wu-trainable run on Mayo under the corrected path (staged_canonical v3 mayo_ldct_fitted geometry, per-sample-ps FBP + per-sample model.proj/model.dense_proj swap, bg_target=truth) and produce a FINITE val_score + comparison.png within the HARD 20-min train+score budget, scoring ALL 214 L277 slices under the 321px detector-geometry FOV (evaluate_calibrated default for AGENT4CT_DATASET=mayo_ldct_2d; NO fov= override)? ARCHITECTURE NOTE: this solver trains ONLY a handful of nn.Parameter scalars (per-band log-scale x4, sigmoid slope+offset x2, per-outer soft-threshold + residual-blend) wrapped around a band-weighted aliasing-free FBP + a soft-thresholded dense-residual pass; with wu_n_outer=1 that is 4+2+1+1 = 8 trainable scalars (n_bands=4). All scalars are HARD-CLAMPED inside the solver (band_scale 0.1-3.0, blend -0.5-2.0, soft_thresh 1e-5-0.05) so the optimizer cannot run away. CONFIG: wu_n_outer=1 (the discarded boundary-slice run flagged n_outer=1 as mandatory -- behavior hint only; it also HALVES the costly 2x-dense-projector residual pass per sample, the dominant per-slice cost), wu_n_bands=4 (default), lr=1e-2 (solver default; aggressive lr is fine for ~8 scalars and converges fast), epochs=6 (8 clamped scalars settle in very few epochs at lr=1e-2 -- this is NOT a deep net that under-trains; the real risk here is the opposite structural FBP ceiling, not under-convergence), train_n=200 stratified across the 4 Wagner train patients ps-groups, val_n=214 = ALL L277 slices, batch_size=1 + val_chunk=1 FORCED by per-sample-ps (each train step + each val slice swaps model.proj AND model.dense_proj to its slice ps), grad_clip=1.0 (MANDATORY Mayo guard: the 2304-view FBP adjoint overflows otherwise), lambda_neg=1.0, weight_decay=0.0 (defer to iter-2+; the discarded run hinted weight_decay tuning around its run-best iter-11, treat as loose behavior hint only), loss_base=mse, seed=42. BUDGET REASONING: the solver has NO in-code max_train_s wall hook (cannot add one -- must not edit the solver .py), so the budget is enforced by SIZING: with wu_n_outer=1 the per-sample cost is 1 band-weighted sparse-FBP (4-band backproject) + 1 forward_project + 1 dense-FBP + 1 back_project -- heavier than DD-UNet (iter-1 418s @ep8) but LIGHTER than the unrolled k=3 itnet_v3 (iter-1 738s @ep8) because there is no per-step unrolled DC loop; at only 6 epochs over 200 train slices the dominant cost is the 214-slice val pass at chunk=1 with the dense projector. This sizes train+score comfortably under the 20-min budget (30-min SLURM wall) with room for the figure. HYPOTHESIS: if I fit Wu-trainable at n_outer=1 / lr=1e-2 / ep=6 on 200 stratified Mayo train slices, I expect a finite val_ssim that lands in/near the LD-FBP baseline band (~0.84-0.89 SSIM, hr near 0), because Wu-trainable is a tuned-FBP family (band-reweighting + ONE soft-thresholded residual pass, NO image-domain CNN denoiser) and can only recover the small headroom that band weighting + a single residual correction buys over plain FBP -- it is structurally close to FBP, unlike the dual-domain U-Net families that landed hr~0.27. The discarded boundary-slice run hinted ~0.9135 SSIM at run-best iter-11 (loose behavior hint, NOT a validated number under the corrected 214-slice 321px-FOV metric). This onboarding iter establishes the corrected-metric Wu-trainable baseline that iter-2+ will improve by tuning ONE knob (epochs/weight_decay first, then band/sigmoid knobs).", "comparison_image": "runs/mayo-ldct-claude-agentic-wu-2015-trainable-search-20260619-01/iterations/iter-0001/comparison.png"}
{"ts": "2026-06-19T14:02:18Z", "run_id": "mayo-ldct-claude-agentic-tv-iterative-search-20260619-01", "iter": 1, "agent": "tv_iterative-claude-agentic-breast-ct", "model": "claude-opus-4.7-1m", "change_class": "architecture", "status": "keep", "kept": true, "val_score": 0.922979474067688, "headroom": 0.13294083141974522, "params_M": 0.0, "train_n": 400, "rationale": "tv_iterative-claude-agentic: val_n=214, train_n=0, tv_lambda=0.001, tv_iterations=120, tv_lr=0.01, tv_clip_max=0.05, tv_decay=0.01, tv_optimizer=gd, tv_init=fbp, rationale=tv_iterative iter-1 (search-20260619-01, corrected protocol): feasibility baseline, NO prior iter. Classical TV-regularized iterative recon (non-trainable) on FBP init over ALL 214 L277 val slices with the 321px detector-geometry FOV. Config = solver defaults (tv_lambda=0.001, tv_lr=0.01, tv_clip_max=0.05, tv_decay=0.01, gd, fbp-init), conservative tv_iterations=120 sized to fit the HARD 20-min train+score budget across 214 slices (the val recon batches all 214 slices through the 2304-view Mayo geometry in a single autograd graph PER iteration, no chunking; old run timing at val_n=5 gives ~0.018 s/slice-iter -> ~3.9 s/iter at val_n=214 -> 120 iters ~8-9 min incl 214-slice load+FBP+score, ~2x margin). FAILURE MODE TO AVOID: n_iter too high -> 214-slice val pass blows the 20-min wall / OOM. HYPOTHESIS: TV-iterative is structurally bounded by FBP on this real LDCT data, so iter-1 lands near the LD-FBP baseline (hr ~0 to slightly positive); establish the clean datapoint under the corrected 214-slice/321px-FOV metric.", "advice_for_others": "tv_iterative-claude-agentic: val_n=214, train_n=0, tv_lambda=0.001, tv_iterations=120, tv_lr=0.01, tv_clip_max=0.05, tv_decay=0.01, tv_optimizer=gd, tv_init=fbp, rationale=tv_iterative iter-1 (search-20260619-01, corrected protocol): feasibility baseline, NO prior iter. Classical TV-regularized iterative recon (non-trainable) on FBP init over ALL 214 L277 val slices with the 321px detector-geometry FOV. Config = solver defaults (tv_lambda=0.001, tv_lr=0.01, tv_clip_max=0.05, tv_decay=0.01, gd, fbp-init), conservative tv_iterations=120 sized to fit the HARD 20-min train+score budget across 214 slices (the val recon batches all 214 slices through the 2304-view Mayo geometry in a single autograd graph PER iteration, no chunking; old run timing at val_n=5 gives ~0.018 s/slice-iter -> ~3.9 s/iter at val_n=214 -> 120 iters ~8-9 min incl 214-slice load+FBP+score, ~2x margin). FAILURE MODE TO AVOID: n_iter too high -> 214-slice val pass blows the 20-min wall / OOM. HYPOTHESIS: TV-iterative is structurally bounded by FBP on this real LDCT data, so iter-1 lands near the LD-FBP baseline (hr ~0 to slightly positive); establish the clean datapoint under the corrected 214-slice/321px-FOV metric.", "comparison_image": "runs/mayo-ldct-claude-agentic-tv-iterative-search-20260619-01/iterations/iter-0001/comparison.png"}
