{"ts": "2026-06-20T02:43:31Z", "run_id": "mayo-ldct-claude-agentic-dual-domain-supervised-search-20260619-01", "iter": 4, "agent": "dual_domain_supervised-claude-agentic", "model": "claude-opus-4-8-1m", "change_class": "architecture", "status": "keep", "kept": true, "val_score": 0.9019123911857605, "headroom": 0.29856036712633993, "params_M": 1.045394, "train_n": 400, "rationale": "dual_domain_supervised-claude-agentic: unet_c=24, lr=0.0001, epochs=10, batch_size=1, val_chunk=1, train_n=200, val_n=214, grad_clip=1.0, lambda_neg=1.0, seed=42, rationale=ITER-4 (search-20260619-01, corrected protocol). ONE KNOB: CAPACITY unet_c 16 -> 24 (the two SmallUNet denoisers proj_dn+img_dn both widen; params ~0.466M -> ~1.05M, a (24/16)^2=2.25x conv-compute bump), with epochs TRADED DOWN 27 -> 10 to fit the HARD 20-min (1200s) train+score wall. SIX-BOX. (1) NUMBERS: iter-2 ep20/c16 SSIM 0.909762 hr 0.338985; iter-3 ep27/c16 SSIM 0.918191 hr 0.365357 (CHAMPION) in elapsed_s=1151.4; current config unet_c=16 epochs=27 lr=1e-4. (2) LIMITER: the epochs lever WORKS (monotone hr ep8 0.276 -> ep20 0.339 -> ep27 0.3654) but is now WALL-LOCKED: iter-3 ep27 used 1151.4s of the 1200s budget; the iter-3 note computed ep32 -> 1366s BUSTS the wall, so epochs cannot rise. The other budget-free lever, an lr-schedule, is NOT WIRED in solver_dual_ddomain_supervised.py (opt=torch.optim.Adam(lr=cfg['lr']) at line 151, no scheduler/weight_decay) and adding one would require editing a SHARED solver (FORBIDDEN). So the only legitimate single-knob iter-4 lever is CAPACITY (unet_c, wired at line 141 -> both denoisers). Is the champion capacity-limited? iter-3's own falsifier said 'if hr <= 0.339 at ep27 -> capacity-limited'; hr ROSE to 0.3654 instead, so it is still PARTLY training-limited, NOT cleanly capacity-limited -> trading epochs down is a genuine gamble, which is exactly what this iter tests. (3) ONE KNOB: unet_c 16->24, epochs 27->10. BUDGET-TRADE MATH: from the two measured c16 points per_epoch=(893.06-418.58)/(20-8)=39.5s/epoch, fixed (data load + 214-slice per-sample val + figure I/O)=418.58-8*39.5=102.6s (iter-3 ep27 predicted 1169s vs actual 1151.4s, calibration good). A c16->c24 widening multiplies the U-Net portion of compute by (24/16)^2=2.25x; the per-sample 2304-view FBP adjoint is c-INDEPENDENT, so the REALISTIC per-epoch at c24 (assuming ~30pct of per-epoch is the c-independent FBP adjoint) is 39.5*(0.30+0.70*2.25)=74.1s and realistic fixed (val ~half c-scaling) ~166s -> ep10 realistic = 166+10*74.1=908s (~15.1 min, comfortably inside 1200s). The WORST-CASE upper bound (pessimistically assume EVERYTHING incl. the FBP adjoint scales 2.25x): per_epoch_worst=39.5*2.25=89.0s, fixed_worst=102.6*2.25=230.9s -> ep10 worst = 230.9+10*89.0=1120s < 1200s -> FITS even the worst case. ep12 worst=1298s BUSTS, so without a measured c24 timing point ep10 is the LARGEST epoch count guaranteed to fit; epochs is sized to the worst-case bound, not the optimistic one (a wall-bust wastes the whole QOS slot). (4) HYPOTHESIS: 2.25x more representational capacity lifts hr above the iter-3 champion 0.365357 even at the reduced ep10, because the DD-UNet is a strong recon family and the discarded boundary-slice run loosely hinted c=24 was its best capacity (TPE: c=24, ep=18, hr 0.836 under that bad metric -- behavior hint only). FALSIFIER (in NUMBERS): if hr <= 0.365 at unet_c=24/ep10, the DD-UNet has hit its representational ceiling on this val set (~0.37) AND/OR ep10 under-trained the bigger net more than the capacity helped -> document the champion ceiling; iter-5 would then either (a) keep c24 and recover epochs toward the wall if c24 per-epoch is measured to be cheaper than the worst case (i.e. ep10 left budget headroom), or (b) revert to c16/ep27 and accept 0.3654 as the DD-UNet ceiling. (5) HARD 20-min train+score budget; val=ALL 214 L277 slices; grad_clip=1.0 (mandatory; the 2304-view Mayo FBP adjoint amplifies gradients ~18x -> lr kept conservative at 1e-4 + nonfinite-grad-skip). (6) no control return. HARD-WIRED (unchanged): staged_canonical v3 mayo_ldct_fitted geometry, per-sample-ps FBP + per-sample pipe.R_full swap, bg_target=truth, metric=321px detector-geometry FOV (evaluate_calibrated default for AGENT4CT_DATASET=mayo_ldct_2d; no fov= override).", "advice_for_others": "dual_domain_supervised-claude-agentic: unet_c=24, lr=0.0001, epochs=10, batch_size=1, val_chunk=1, train_n=200, val_n=214, grad_clip=1.0, lambda_neg=1.0, seed=42, rationale=ITER-4 (search-20260619-01, corrected protocol). ONE KNOB: CAPACITY unet_c 16 -> 24 (the two SmallUNet denoisers proj_dn+img_dn both widen; params ~0.466M -> ~1.05M, a (24/16)^2=2.25x conv-compute bump), with epochs TRADED DOWN 27 -> 10 to fit the HARD 20-min (1200s) train+score wall. SIX-BOX. (1) NUMBERS: iter-2 ep20/c16 SSIM 0.909762 hr 0.338985; iter-3 ep27/c16 SSIM 0.918191 hr 0.365357 (CHAMPION) in elapsed_s=1151.4; current config unet_c=16 epochs=27 lr=1e-4. (2) LIMITER: the epochs lever WORKS (monotone hr ep8 0.276 -> ep20 0.339 -> ep27 0.3654) but is now WALL-LOCKED: iter-3 ep27 used 1151.4s of the 1200s budget; the iter-3 note computed ep32 -> 1366s BUSTS the wall, so epochs cannot rise. The other budget-free lever, an lr-schedule, is NOT WIRED in solver_dual_ddomain_supervised.py (opt=torch.optim.Adam(lr=cfg['lr']) at line 151, no scheduler/weight_decay) and adding one would require editing a SHARED solver (FORBIDDEN). So the only legitimate single-knob iter-4 lever is CAPACITY (unet_c, wired at line 141 -> both denoisers). Is the champion capacity-limited? iter-3's own falsifier said 'if hr <= 0.339 at ep27 -> capacity-limited'; hr ROSE to 0.3654 instead, so it is still PARTLY training-limited, NOT cleanly capacity-limited -> trading epochs down is a genuine gamble, which is exactly what this iter tests. (3) ONE KNOB: unet_c 16->24, epochs 27->10. BUDGET-TRADE MATH: from the two measured c16 points per_epoch=(893.06-418.58)/(20-8)=39.5s/epoch, fixed (data load + 214-slice per-sample val + figure I/O)=418.58-8*39.5=102.6s (iter-3 ep27 predicted 1169s vs actual 1151.4s, calibration good). A c16->c24 widening multiplies the U-Net portion of compute by (24/16)^2=2.25x; the per-sample 2304-view FBP adjoint is c-INDEPENDENT, so the REALISTIC per-epoch at c24 (assuming ~30pct of per-epoch is the c-independent FBP adjoint) is 39.5*(0.30+0.70*2.25)=74.1s and realistic fixed (val ~half c-scaling) ~166s -> ep10 realistic = 166+10*74.1=908s (~15.1 min, comfortably inside 1200s). The WORST-CASE upper bound (pessimistically assume EVERYTHING incl. the FBP adjoint scales 2.25x): per_epoch_worst=39.5*2.25=89.0s, fixed_worst=102.6*2.25=230.9s -> ep10 worst = 230.9+10*89.0=1120s < 1200s -> FITS even the worst case. ep12 worst=1298s BUSTS, so without a measured c24 timing point ep10 is the LARGEST epoch count guaranteed to fit; epochs is sized to the worst-case bound, not the optimistic one (a wall-bust wastes the whole QOS slot). (4) HYPOTHESIS: 2.25x more representational capacity lifts hr above the iter-3 champion 0.365357 even at the reduced ep10, because the DD-UNet is a strong recon family and the discarded boundary-slice run loosely hinted c=24 was its best capacity (TPE: c=24, ep=18, hr 0.836 under that bad metric -- behavior hint only). FALSIFIER (in NUMBERS): if hr <= 0.365 at unet_c=24/ep10, the DD-UNet has hit its representational ceiling on this val set (~0.37) AND/OR ep10 under-trained the bigger net more than the capacity helped -> document the champion ceiling; iter-5 would then either (a) keep c24 and recover epochs toward the wall if c24 per-epoch is measured to be cheaper than the worst case (i.e. ep10 left budget headroom), or (b) revert to c16/ep27 and accept 0.3654 as the DD-UNet ceiling. (5) HARD 20-min train+score budget; val=ALL 214 L277 slices; grad_clip=1.0 (mandatory; the 2304-view Mayo FBP adjoint amplifies gradients ~18x -> lr kept conservative at 1e-4 + nonfinite-grad-skip). (6) no control return. HARD-WIRED (unchanged): staged_canonical v3 mayo_ldct_fitted geometry, per-sample-ps FBP + per-sample pipe.R_full swap, bg_target=truth, metric=321px detector-geometry FOV (evaluate_calibrated default for AGENT4CT_DATASET=mayo_ldct_2d; no fov= override).", "comparison_image": "runs/mayo-ldct-claude-agentic-dual-domain-supervised-search-20260619-01/iterations/iter-0004/comparison.png"}
{"ts": "2026-06-20T02:32:56Z", "run_id": "mayo-ldct-claude-agentic-r2gaussian-search-20260619-01", "iter": 3, "agent": "r2gaussian-claude-agentic", "model": "claude-opus-4-8-1m", "change_class": "architecture", "status": "discard", "kept": false, "val_score": 0.6809813976287842, "headroom": 0.0, "params_M": 0.003072, "train_n": 400, "rationale": "r2gaussian-claude-agentic: val_n=214, gs_n_gaussians=512, gs_n_iter=60, gs_lr_pos=0.005, gs_lr_scale=0.01, gs_lr_amp=0.01, gs_lr_rot=0.01, gs_amp_init=0.01, gs_scale_init=0.04, gs_tv_weight=0.0001, gs_n_clip=0.05, gs_init_from_fbp=False, gs_outer_wall_s=1080, rationale=iter-3 (search-20260619-01). ONE KNOB: gs_n_iter 400->60 (per-scene Adam steps DOWN to MAXIMIZE completed-scene COVERAGE; all other knobs held at iter-2). FAILURE MODE (the core, structural problem): R2-Gaussian is a PER-SCENE Gaussian-splatting fit (no training) and is BUDGET-INCOMPATIBLE with the 214-slice Mayo protocol at a hard 20-min wall. Measured per-scene step cost is a clean linear function of gs_n_iter: iter-1 (n_iter=150) = 42.45 s/scene -> outer-wall hit at sample 26/214 (12% coverage), SSIM 0.738335, hr=0; iter-2 (n_iter=400) = 113.0 s/scene -> outer-wall hit at sample 10/214 (4.7% coverage), SSIM 0.736981, hr=0. Linear fit: 0.2822 s/Adam-step (offset ~0). iter-2 FALSIFIER FIRED: the hypothesis 'more Adam steps lifts per-scene SSIM materially above 0.738' is REFUTED -- 2.67x more steps (150->400) moved the average-over-214 SSIM by -0.0001 (0.7383 -> 0.7370, FLAT). So per-scene quality is NOT the lever; the average is dominated by the ~95% of scenes that NEVER complete (scored at/near their FBP init). DIAGNOSTIC QUESTION for iter-3: does COVERAGE win? At gs_n_iter=60 -> per-scene = 0.2822*60 = 16.9 s -> 1080s outer wall / 16.9 = ~64/214 scenes complete (30% coverage, ~2.5x iter-1's 26, ~6.4x iter-2's 10). HYPOTHESIS (falsifiable in NUMBERS): if the average-over-214 SSIM goes UP at 64-scene coverage (vs 0.738 @ 26 scenes and 0.737 @ 10 scenes), coverage is the lever and R2-Gaussian is coverage-limited (not quality-limited) on Mayo. FALSIFIER: if average-over-214 SSIM stays ~0.74 or WORSE even at 2.5x coverage, then BOTH levers (per-scene quality AND coverage) are exhausted within the 20-min budget -> R2-Gaussian is STRUCTURALLY budget-incompatible with the 214-slice Mayo protocol -> file the quality-vs-coverage tradeoff as a documented NEGATIVE RESULT (no gs_n_iter both covers all 214 AND fits per-scene: covering all 214 in 1080s needs n_iter<=18 steps, which is a non-recon). BUDGET MATH: 64 scenes * 16.9 s = 1082s ~ the 1080s outer wall (self-truncates and scores whatever completed, exactly as iter-1/iter-2); SLURM --time=00:30:00 has headroom, val figure excluded. val_n stays 214 (NOT reduced) per mandate; gs_n_gaussians held at 512 (<=1024 cap). TRAJECTORY: iter-1 0.7383 (26/214) -> iter-2 0.7370 (10/214) -> iter-3 predicted ~0.74-0.76 if coverage helps (64/214), or ~0.74 (structural negative) if it does not.", "advice_for_others": "r2gaussian-claude-agentic: val_n=214, gs_n_gaussians=512, gs_n_iter=60, gs_lr_pos=0.005, gs_lr_scale=0.01, gs_lr_amp=0.01, gs_lr_rot=0.01, gs_amp_init=0.01, gs_scale_init=0.04, gs_tv_weight=0.0001, gs_n_clip=0.05, gs_init_from_fbp=False, gs_outer_wall_s=1080, rationale=iter-3 (search-20260619-01). ONE KNOB: gs_n_iter 400->60 (per-scene Adam steps DOWN to MAXIMIZE completed-scene COVERAGE; all other knobs held at iter-2). FAILURE MODE (the core, structural problem): R2-Gaussian is a PER-SCENE Gaussian-splatting fit (no training) and is BUDGET-INCOMPATIBLE with the 214-slice Mayo protocol at a hard 20-min wall. Measured per-scene step cost is a clean linear function of gs_n_iter: iter-1 (n_iter=150) = 42.45 s/scene -> outer-wall hit at sample 26/214 (12% coverage), SSIM 0.738335, hr=0; iter-2 (n_iter=400) = 113.0 s/scene -> outer-wall hit at sample 10/214 (4.7% coverage), SSIM 0.736981, hr=0. Linear fit: 0.2822 s/Adam-step (offset ~0). iter-2 FALSIFIER FIRED: the hypothesis 'more Adam steps lifts per-scene SSIM materially above 0.738' is REFUTED -- 2.67x more steps (150->400) moved the average-over-214 SSIM by -0.0001 (0.7383 -> 0.7370, FLAT). So per-scene quality is NOT the lever; the average is dominated by the ~95% of scenes that NEVER complete (scored at/near their FBP init). DIAGNOSTIC QUESTION for iter-3: does COVERAGE win? At gs_n_iter=60 -> per-scene = 0.2822*60 = 16.9 s -> 1080s outer wall / 16.9 = ~64/214 scenes complete (30% coverage, ~2.5x iter-1's 26, ~6.4x iter-2's 10). HYPOTHESIS (falsifiable in NUMBERS): if the average-over-214 SSIM goes UP at 64-scene coverage (vs 0.738 @ 26 scenes and 0.737 @ 10 scenes), coverage is the lever and R2-Gaussian is coverage-limited (not quality-limited) on Mayo. FALSIFIER: if average-over-214 SSIM stays ~0.74 or WORSE even at 2.5x coverage, then BOTH levers (per-scene quality AND coverage) are exhausted within the 20-min budget -> R2-Gaussian is STRUCTURALLY budget-incompatible with the 214-slice Mayo protocol -> file the quality-vs-coverage tradeoff as a documented NEGATIVE RESULT (no gs_n_iter both covers all 214 AND fits per-scene: covering all 214 in 1080s needs n_iter<=18 steps, which is a non-recon). BUDGET MATH: 64 scenes * 16.9 s = 1082s ~ the 1080s outer wall (self-truncates and scores whatever completed, exactly as iter-1/iter-2); SLURM --time=00:30:00 has headroom, val figure excluded. val_n stays 214 (NOT reduced) per mandate; gs_n_gaussians held at 512 (<=1024 cap). TRAJECTORY: iter-1 0.7383 (26/214) -> iter-2 0.7370 (10/214) -> iter-3 predicted ~0.74-0.76 if coverage helps (64/214), or ~0.74 (structural negative) if it does not.", "comparison_image": "runs/mayo-ldct-claude-agentic-r2gaussian-search-20260619-01/iterations/iter-0003/comparison.png"}
