{"ts": "2026-06-20T13:50:16Z", "run_id": "mayo-ldct-claude-agentic-tv-iterative-search-20260619-01", "iter": 6, "agent": "tv_iterative-claude-agentic", "model": "claude-opus-4-8-1m", "change_class": "architecture", "status": "keep", "kept": true, "val_score": 0.8998650908470154, "headroom": 0.15816281176238844, "params_M": 0.0, "train_n": 400, "rationale": "tv_iterative-claude-agentic: val_n=214, train_n=0, tv_lambda=0.0005, tv_iterations=120, tv_lr=0.01, tv_clip_max=0.08, tv_decay=0.01, tv_optimizer=gd, tv_init=fbp, rationale=tv_iterative iter-6 (search-20260619-01, corrected 214-slice/321px-FOV metric). BASE = iter-4 BEST family (clip 0.08), with tv_iterations reverted 160->120 (the budget-proven count -- iter-4 at 160 measured 1227.4s, OVER the 1200s HARD wall; iter-2/3/5 at 120 landed 918-972s). ONE LIVE KNOB: tv_lambda 0.001->0.0005 (HALVE). The solver (solver_tv_iterative.py) reads ONLY tv_lambda/tv_iterations/tv_lr/tv_clip_max in tv_reconstruction(); tv_decay/tv_init/tv_optimizer are INERT (step decay is hard-coded 0.01). TRAJECTORY (NUMBERS, 120 iters unless noted): iter-1 SSIM 0.922979 hr 0.132941 RMSE 8.573e-4 (clip 0.05); iter-2 SSIM 0.923844 hr 0.205364 RMSE 7.857e-4 (clip 0.08) = BEST-at-120, #4 on Mayo; iter-3 SSIM 0.919984 hr 0.136636 RMSE 8.536e-4 (lambda 0.001->0.003) REGRESSED over-smoothed; iter-4 SSIM 0.926664 hr 0.208547 RMSE 7.825e-4 (iters 120->160, 1227.4s OVER WALL); iter-5 SSIM 0.926072 hr 0.187286 RMSE 8.036e-4 (lr 0.01->0.02, 971.8s) REGRESSED -- GD OVERSHOOT at the larger step (falsifier-branch a). LEVER MAP: clip exhausted (at top of bound [0.03,0.08]); lambda-UP regressed (iter-3); iters-UP plateaued +0.003hr AND breached wall (iter-4); lr-UP regressed via overshoot (iter-5). The ONLY untried direction on the only unexhausted lever is lambda-DOWN. FAILURE MODE: at lambda=0.001 the data term dominates but the TV penalty still lightly over-smooths real anatomy edges/bone; the RMSE-sensitive headroom metric penalizes that residual smoothing. HYPOTHESIS: halving tv_lambda 0.001->0.0005 weakens the TV penalty so the data term recovers finer edge/bone detail, dropping val_rmse below iter-2 7.857e-4 (the apples-to-apples 120-iter reference) so hr rises above iter-4 BEST 0.208547 at ZERO extra compute. FALSIFIER: if hr<=0.208547 (no gain either side), lambda=0.001 was already at the TV regularization optimum (both lambda-UP@0.003 and lambda-DOWN@0.0005 regress), confirming ~0.21 hr is the STRUCTURAL classical-TV ceiling on real Mayo LDCT and this lever is EXHAUSTED. BUDGET: zero-marginal-compute knob at the budget-proven tv_iterations=120 -> ~928s wall (77% of 1200s, ~272s margin; +10% variance ~1018s still under). val = ALL 214 L277 slices unchanged. sbatch --time=00:30:00 SLURM safety net.", "advice_for_others": "tv_iterative-claude-agentic: val_n=214, train_n=0, tv_lambda=0.0005, tv_iterations=120, tv_lr=0.01, tv_clip_max=0.08, tv_decay=0.01, tv_optimizer=gd, tv_init=fbp, rationale=tv_iterative iter-6 (search-20260619-01, corrected 214-slice/321px-FOV metric). BASE = iter-4 BEST family (clip 0.08), with tv_iterations reverted 160->120 (the budget-proven count -- iter-4 at 160 measured 1227.4s, OVER the 1200s HARD wall; iter-2/3/5 at 120 landed 918-972s). ONE LIVE KNOB: tv_lambda 0.001->0.0005 (HALVE). The solver (solver_tv_iterative.py) reads ONLY tv_lambda/tv_iterations/tv_lr/tv_clip_max in tv_reconstruction(); tv_decay/tv_init/tv_optimizer are INERT (step decay is hard-coded 0.01). TRAJECTORY (NUMBERS, 120 iters unless noted): iter-1 SSIM 0.922979 hr 0.132941 RMSE 8.573e-4 (clip 0.05); iter-2 SSIM 0.923844 hr 0.205364 RMSE 7.857e-4 (clip 0.08) = BEST-at-120, #4 on Mayo; iter-3 SSIM 0.919984 hr 0.136636 RMSE 8.536e-4 (lambda 0.001->0.003) REGRESSED over-smoothed; iter-4 SSIM 0.926664 hr 0.208547 RMSE 7.825e-4 (iters 120->160, 1227.4s OVER WALL); iter-5 SSIM 0.926072 hr 0.187286 RMSE 8.036e-4 (lr 0.01->0.02, 971.8s) REGRESSED -- GD OVERSHOOT at the larger step (falsifier-branch a). LEVER MAP: clip exhausted (at top of bound [0.03,0.08]); lambda-UP regressed (iter-3); iters-UP plateaued +0.003hr AND breached wall (iter-4); lr-UP regressed via overshoot (iter-5). The ONLY untried direction on the only unexhausted lever is lambda-DOWN. FAILURE MODE: at lambda=0.001 the data term dominates but the TV penalty still lightly over-smooths real anatomy edges/bone; the RMSE-sensitive headroom metric penalizes that residual smoothing. HYPOTHESIS: halving tv_lambda 0.001->0.0005 weakens the TV penalty so the data term recovers finer edge/bone detail, dropping val_rmse below iter-2 7.857e-4 (the apples-to-apples 120-iter reference) so hr rises above iter-4 BEST 0.208547 at ZERO extra compute. FALSIFIER: if hr<=0.208547 (no gain either side), lambda=0.001 was already at the TV regularization optimum (both lambda-UP@0.003 and lambda-DOWN@0.0005 regress), confirming ~0.21 hr is the STRUCTURAL classical-TV ceiling on real Mayo LDCT and this lever is EXHAUSTED. BUDGET: zero-marginal-compute knob at the budget-proven tv_iterations=120 -> ~928s wall (77% of 1200s, ~272s margin; +10% variance ~1018s still under). val = ALL 214 L277 slices unchanged. sbatch --time=00:30:00 SLURM safety net.", "comparison_image": "runs/mayo-ldct-claude-agentic-tv-iterative-search-20260619-01/iterations/iter-0006/comparison.png"}
{"ts": "2026-06-20T13:17:24Z", "run_id": "mayo-ldct-claude-agentic-itnet-v3-search-20260619-01", "iter": 7, "agent": "itnet_v3-claude-agentic", "model": "claude-opus-4-8-1m", "change_class": "architecture", "status": "keep", "kept": true, "val_score": 0.9152405261993408, "headroom": 0.33660659630690737, "params_M": 3.698994, "train_n": 400, "rationale": "itnet_v3-claude-agentic: itnet_k=3, unet_c=16, alpha_init=0.0037, lr=0.0001, epochs=9, batch_size=1, val_chunk=1, train_n=460, val_n=214, grad_clip=1.0, max_train_s=820, seed=42, rationale=iter-7 (search-20260619-01, corrected protocol). BASE_ITER=5 (the BEST: c16/ep9/train_n=400, hr 0.328842). ONE KNOB: train_n 400 -> 460 (MIDDLE coverage) at FIXED epochs=9 -- i.e. raise data coverage while HOLDING per-slice exposure at the proven 9x level. This is the clean single-knob test iter-6 could NOT run: iter-6 funded FULL data (tn579) by CUTTING epochs to 6 (parity), so it lost on BOTH axes vs iter-5 (grad_steps 3474<3600 AND exposure 6x<9x) and REGRESSED to hr 0.315239. iter-7 instead adds coverage at constant exposure. SIX-BOX (NUMBERS): (1) itnet_v3 trajectory: iter-1 ep8/tn200 hr 0.268409 (737.85s); iter-2 ep14/tn200 hr 0.310054 (1010.07s); iter-3 ep18/tn200 hr 0.312282 (1072.94s, epochs PLATEAUED); iter-4 ep9/c24/tn200 hr 0.295576 (834.0s, capacity REGRESSED -> revert c16); iter-5 BEST ep9/c16/tn400 hr 0.328842 / SSIM 0.915763 / PSNR 37.54 / RMSE 0.000664 (1006.81s=16.78min, 193s budget UNSPENT); iter-6 ep6/c16/tn579 hr 0.315239 / SSIM 0.906478 (914.0s=15.2min, 286s budget UNSPENT). PER-EPOCH COST scales LINEARLY with train_n (bs=1, 0.1723 s/slice): tn400->68.9s/ep, tn460->79.3s/ep, tn579->99.7s/ep. So at the 1200s wall full data (tn579) can only buy ep6-7 (<=7x exposure) while tn400 buys ep9-10 (9-10x). (2) LIMITER: the EPOCHS-vs-DATA tradeoff at the budget. iter-6 proved FULL data UNDER-TRAINS in-budget: tn579 only affords ep6 = 6x exposure, worse than tn400/ep9 = 9x. The per-epoch cost of the last 30% of data is too high to keep exposure at 9x. itnet_v3 needs ~9x exposure to converge in-budget (epochs plateaued only at ep18 on tn200; ep6 is clearly under-trained). So coverage is only worth raising IF exposure stays >=9x. (3) ONE KNOB: train_n 400 -> 460, epochs HELD at 9 (NOT cut). This is the LARGEST train_n that still affords ep9 inside the wall: 481 fixed + 9*460*0.1723 = 1194s = 19.9 min < 1200s (and the model OVER-predicts by 95-165s -- iter-6 landed 165s under -- so real elapsed ~1060s/17.7min). It beats iter-5 on coverage (69%->79%) AND grad_steps (3600->4140) at IDENTICAL 9x exposure; it beats iter-6 on exposure (6x->9x) and grad_steps (3474->4140). tn480+ would force ep8 (8x exposure, below the proven 9x) so 460 is the sweet spot: max coverage at >=9x exposure. (4) HYPOTHESIS: adding 60 distinct training slices (400->460, 69%->79% coverage) WHILE HOLDING exposure at 9x lifts hr above the iter-5 best 0.328842, because iter-6 showed the data lever works ONLY when exposure is not sacrificed -- and here it is not. NUMERIC FALSIFIER: if hr <= 0.3288 at tn460/ep9, itnet_v3 is at its budget-constrained ceiling (~0.329, the tn400/ep9 point) -- it cannot afford enough epochs on more data, and even coverage-at-constant-exposure does not help -> file the ceiling, stays #3. (5) BUDGET (HARD 1200s = train+score): fixed 481s, per_slice 0.1723s; epochs=(1200-481)/(460*0.1723)=9.07 -> ep9 is the max integer that fits. total=481+9*460*0.1723=1194s conservative (real ~1060s). Train-only=9*460*0.1723=713s < max_train_s=820 backstop, so it never truncates (checks between epochs; fences only runaway slowdown); the 214-slice per-sample val + figure always land inside the 30-min sbatch wall. val stays ALL 214 L277 slices, 321px detector-geometry FOV (evaluate_calibrated default for AGENT4CT_DATASET=mayo_ldct_2d; no fov= override). grad_clip=1.0 retained (mandatory: 2304-view Mayo FBP adjoint inside dc_step overflows otherwise). HARD-WIRED (unchanged): staged_canonical v3 mayo_ldct_fitted geometry, per-sample-ps FBP init + per-sample itnet.projector swap for the k=3 DC steps, bg_target=truth. (6) do NOT return control mid-campaign. Predicted iter-7 hr: 0.33-0.34 if coverage-at-9x-exposure helps; <=0.3288 falsifies -> budget-constrained ceiling at ~0.329, stays #3.", "advice_for_others": "itnet_v3-claude-agentic: itnet_k=3, unet_c=16, alpha_init=0.0037, lr=0.0001, epochs=9, batch_size=1, val_chunk=1, train_n=460, val_n=214, grad_clip=1.0, max_train_s=820, seed=42, rationale=iter-7 (search-20260619-01, corrected protocol). BASE_ITER=5 (the BEST: c16/ep9/train_n=400, hr 0.328842). ONE KNOB: train_n 400 -> 460 (MIDDLE coverage) at FIXED epochs=9 -- i.e. raise data coverage while HOLDING per-slice exposure at the proven 9x level. This is the clean single-knob test iter-6 could NOT run: iter-6 funded FULL data (tn579) by CUTTING epochs to 6 (parity), so it lost on BOTH axes vs iter-5 (grad_steps 3474<3600 AND exposure 6x<9x) and REGRESSED to hr 0.315239. iter-7 instead adds coverage at constant exposure. SIX-BOX (NUMBERS): (1) itnet_v3 trajectory: iter-1 ep8/tn200 hr 0.268409 (737.85s); iter-2 ep14/tn200 hr 0.310054 (1010.07s); iter-3 ep18/tn200 hr 0.312282 (1072.94s, epochs PLATEAUED); iter-4 ep9/c24/tn200 hr 0.295576 (834.0s, capacity REGRESSED -> revert c16); iter-5 BEST ep9/c16/tn400 hr 0.328842 / SSIM 0.915763 / PSNR 37.54 / RMSE 0.000664 (1006.81s=16.78min, 193s budget UNSPENT); iter-6 ep6/c16/tn579 hr 0.315239 / SSIM 0.906478 (914.0s=15.2min, 286s budget UNSPENT). PER-EPOCH COST scales LINEARLY with train_n (bs=1, 0.1723 s/slice): tn400->68.9s/ep, tn460->79.3s/ep, tn579->99.7s/ep. So at the 1200s wall full data (tn579) can only buy ep6-7 (<=7x exposure) while tn400 buys ep9-10 (9-10x). (2) LIMITER: the EPOCHS-vs-DATA tradeoff at the budget. iter-6 proved FULL data UNDER-TRAINS in-budget: tn579 only affords ep6 = 6x exposure, worse than tn400/ep9 = 9x. The per-epoch cost of the last 30% of data is too high to keep exposure at 9x. itnet_v3 needs ~9x exposure to converge in-budget (epochs plateaued only at ep18 on tn200; ep6 is clearly under-trained). So coverage is only worth raising IF exposure stays >=9x. (3) ONE KNOB: train_n 400 -> 460, epochs HELD at 9 (NOT cut). This is the LARGEST train_n that still affords ep9 inside the wall: 481 fixed + 9*460*0.1723 = 1194s = 19.9 min < 1200s (and the model OVER-predicts by 95-165s -- iter-6 landed 165s under -- so real elapsed ~1060s/17.7min). It beats iter-5 on coverage (69%->79%) AND grad_steps (3600->4140) at IDENTICAL 9x exposure; it beats iter-6 on exposure (6x->9x) and grad_steps (3474->4140). tn480+ would force ep8 (8x exposure, below the proven 9x) so 460 is the sweet spot: max coverage at >=9x exposure. (4) HYPOTHESIS: adding 60 distinct training slices (400->460, 69%->79% coverage) WHILE HOLDING exposure at 9x lifts hr above the iter-5 best 0.328842, because iter-6 showed the data lever works ONLY when exposure is not sacrificed -- and here it is not. NUMERIC FALSIFIER: if hr <= 0.3288 at tn460/ep9, itnet_v3 is at its budget-constrained ceiling (~0.329, the tn400/ep9 point) -- it cannot afford enough epochs on more data, and even coverage-at-constant-exposure does not help -> file the ceiling, stays #3. (5) BUDGET (HARD 1200s = train+score): fixed 481s, per_slice 0.1723s; epochs=(1200-481)/(460*0.1723)=9.07 -> ep9 is the max integer that fits. total=481+9*460*0.1723=1194s conservative (real ~1060s). Train-only=9*460*0.1723=713s < max_train_s=820 backstop, so it never truncates (checks between epochs; fences only runaway slowdown); the 214-slice per-sample val + figure always land inside the 30-min sbatch wall. val stays ALL 214 L277 slices, 321px detector-geometry FOV (evaluate_calibrated default for AGENT4CT_DATASET=mayo_ldct_2d; no fov= override). grad_clip=1.0 retained (mandatory: 2304-view Mayo FBP adjoint inside dc_step overflows otherwise). HARD-WIRED (unchanged): staged_canonical v3 mayo_ldct_fitted geometry, per-sample-ps FBP init + per-sample itnet.projector swap for the k=3 DC steps, bg_target=truth. (6) do NOT return control mid-campaign. Predicted iter-7 hr: 0.33-0.34 if coverage-at-9x-exposure helps; <=0.3288 falsifies -> budget-constrained ceiling at ~0.329, stays #3.", "comparison_image": "runs/mayo-ldct-claude-agentic-itnet-v3-search-20260619-01/iterations/iter-0007/comparison.png"}
{"ts": "2026-06-20T13:12:38Z", "run_id": "mayo-ldct-claude-agentic-uswin-search-20260619-01", "iter": 7, "agent": "uswin-claude-agentic", "model": "claude-opus-4-8-1m", "change_class": "architecture", "status": "keep", "kept": true, "val_score": 0.9379975199699402, "headroom": 0.4149526203706091, "params_M": 3.954049, "train_n": 400, "rationale": "uswin-claude-agentic: train_n=579, val_n=214, epochs=22, batch_size=4, lr=0.0005, uswin_c=24, swin_window=8, swin_heads=4, grad_clip=1.0, max_train_s=960, seed=42, rationale=ITER-7 epochs 21->22 on full tn579 pool; from iter-6 best hr 0.409775; chase champion 0.4158", "advice_for_others": "uswin-claude-agentic: train_n=579, val_n=214, epochs=22, batch_size=4, lr=0.0005, uswin_c=24, swin_window=8, swin_heads=4, grad_clip=1.0, max_train_s=960, seed=42, rationale=ITER-7 epochs 21->22 on full tn579 pool; from iter-6 best hr 0.409775; chase champion 0.4158", "comparison_image": "runs/mayo-ldct-claude-agentic-uswin-search-20260619-01/iterations/iter-0007/comparison.png"}
