{"ts": "2026-06-19T19:28:16Z", "run_id": "mayo-ldct-claude-agentic-naf-search-20260619-01", "iter": 2, "agent": "naf-claude-agentic-breast-ct", "model": "claude-opus-4.7-1m", "change_class": "architecture", "status": "discard", "kept": false, "val_score": 0.49432283639907837, "headroom": 0.0, "params_M": 0.010625, "train_n": 400, "rationale": "naf-claude-agentic: val_n=214, naf_n_freqs=8, naf_hidden=64, naf_layers=4, naf_n_iter=3000, naf_lr=0.01, naf_tv_weight=0.0001, naf_n_clip=0.05, naf_outer_wall_s=1080, naf_per_scene_s=5.0, seed=42, rationale=ITER-2 (search-20260619-01, naf). SIX-BOX. (1) iter-1 NUMBERS: SSIM 0.4729, hr 0.0, PSNR 18.55, baseline_PSNR 34.08; elapsed 1097s; naf_per_scene_s=5.0, naf_hidden=128, naf_layers=4, naf_n_freqs=8, naf_lr=1e-2; SLURM [fit] log shows each scene fit only ~85-97 Adam steps (median 91) before the 5.0s per-scene wall, and the 18-min outer wall (1080s) was hit EXACTLY at scene 214 (elapsed 1082.5s). (2) FAILURE MODE: budget-starved per-scene INR fit. A NeRF-style coordinate-MLP wants hundreds-to-thousands of Adam steps to leave its water-mu init; ~91 steps/scene leaves the MLP barely moved -> SSIM 0.4729 well below the LD-FBP baseline. This is starvation, NOT (yet) the structural floor. (3) ONE KNOB: naf_hidden 128->64 (naf_layers=4, naf_n_freqs=8, naf_lr=1e-2, naf_per_scene_s=5.0, naf_outer_wall_s=1080, val_n=214 ALL UNCHANGED). 214-SCENE 20-MIN BUDGET MATH (measured): the entire budget is the per-scene fit loop (train_n=0); total = 214 x per_scene_s = 214 x 5.0s = 1070s ~= the 1080s/18-min outer wall, hit exactly at scene 214. I CANNOT raise per_scene_s (214 x wall is already full inside the 20-min compute budget). So to buy MORE Adam steps per scene at FIXED total budget I make each step CHEAPER: per-step cost ~0.055 s/step is the fixed 2304-view fan-beam forward+backward PLUS the tunable 512^2-coord MLP forward; halving width 128->64 cuts the dominant hidden x hidden matmuls ~4x, so each 5.0s scene should fit meaningfully more steps -> more useful optimization per scene within the SAME 214 x 1080s/18-min wall. (4) HYPOTHESIS: if I shrink naf_hidden 128->64, I expect SSIM to rise above 0.4729 because the cheaper MLP buys more Adam steps per scene, letting the INR move further off its water-mu init within the same per-scene wall. FALSIFIER: if SSIM stays ~0.47 despite more steps, NAF is STRUCTURALLY FBP-bounded on dense rebinned Mayo (wrong inductive bias for dense-view CT), not merely starved. (5) HARD 20-min budget: 214-scene pass, naf_outer_wall_s=1080 (18 min) + naf_per_scene_s=5.0 (in-solver per-scene wall = the governor; naf_n_iter=3000 stays a high cap), val_n=214 (ALL L277 slices, NOT reduced), 321px detector-geometry FOV default (no fov= override). (6) no control return; the loop dispatches the next iter.", "advice_for_others": "naf-claude-agentic: val_n=214, naf_n_freqs=8, naf_hidden=64, naf_layers=4, naf_n_iter=3000, naf_lr=0.01, naf_tv_weight=0.0001, naf_n_clip=0.05, naf_outer_wall_s=1080, naf_per_scene_s=5.0, seed=42, rationale=ITER-2 (search-20260619-01, naf). SIX-BOX. (1) iter-1 NUMBERS: SSIM 0.4729, hr 0.0, PSNR 18.55, baseline_PSNR 34.08; elapsed 1097s; naf_per_scene_s=5.0, naf_hidden=128, naf_layers=4, naf_n_freqs=8, naf_lr=1e-2; SLURM [fit] log shows each scene fit only ~85-97 Adam steps (median 91) before the 5.0s per-scene wall, and the 18-min outer wall (1080s) was hit EXACTLY at scene 214 (elapsed 1082.5s). (2) FAILURE MODE: budget-starved per-scene INR fit. A NeRF-style coordinate-MLP wants hundreds-to-thousands of Adam steps to leave its water-mu init; ~91 steps/scene leaves the MLP barely moved -> SSIM 0.4729 well below the LD-FBP baseline. This is starvation, NOT (yet) the structural floor. (3) ONE KNOB: naf_hidden 128->64 (naf_layers=4, naf_n_freqs=8, naf_lr=1e-2, naf_per_scene_s=5.0, naf_outer_wall_s=1080, val_n=214 ALL UNCHANGED). 214-SCENE 20-MIN BUDGET MATH (measured): the entire budget is the per-scene fit loop (train_n=0); total = 214 x per_scene_s = 214 x 5.0s = 1070s ~= the 1080s/18-min outer wall, hit exactly at scene 214. I CANNOT raise per_scene_s (214 x wall is already full inside the 20-min compute budget). So to buy MORE Adam steps per scene at FIXED total budget I make each step CHEAPER: per-step cost ~0.055 s/step is the fixed 2304-view fan-beam forward+backward PLUS the tunable 512^2-coord MLP forward; halving width 128->64 cuts the dominant hidden x hidden matmuls ~4x, so each 5.0s scene should fit meaningfully more steps -> more useful optimization per scene within the SAME 214 x 1080s/18-min wall. (4) HYPOTHESIS: if I shrink naf_hidden 128->64, I expect SSIM to rise above 0.4729 because the cheaper MLP buys more Adam steps per scene, letting the INR move further off its water-mu init within the same per-scene wall. FALSIFIER: if SSIM stays ~0.47 despite more steps, NAF is STRUCTURALLY FBP-bounded on dense rebinned Mayo (wrong inductive bias for dense-view CT), not merely starved. (5) HARD 20-min budget: 214-scene pass, naf_outer_wall_s=1080 (18 min) + naf_per_scene_s=5.0 (in-solver per-scene wall = the governor; naf_n_iter=3000 stays a high cap), val_n=214 (ALL L277 slices, NOT reduced), 321px detector-geometry FOV default (no fov= override). (6) no control return; the loop dispatches the next iter.", "comparison_image": "runs/mayo-ldct-claude-agentic-naf-search-20260619-01/iterations/iter-0002/comparison.png"}
{"ts": "2026-06-19T19:19:24Z", "run_id": "mayo-ldct-claude-agentic-tv-iterative-search-20260619-01", "iter": 2, "agent": "tv_iterative-claude-agentic-breast-ct", "model": "claude-opus-4.7-1m", "change_class": "architecture", "status": "keep", "kept": true, "val_score": 0.923843502998352, "headroom": 0.20536406330376733, "params_M": 0.0, "train_n": 400, "rationale": "tv_iterative-claude-agentic: val_n=214, train_n=0, tv_lambda=0.001, tv_iterations=120, tv_lr=0.01, tv_clip_max=0.08, tv_decay=0.01, tv_optimizer=gd, tv_init=fbp, rationale=tv_iterative iter-2 (search-20260619-01, corrected 214-slice/321px-FOV metric). ONE KNOB: tv_clip_max 0.05->0.08 (all else held IDENTICAL to iter-1: tv_lambda=0.001, tv_iterations=120, tv_lr=0.01, tv_decay=0.01, gd, fbp-init, val_n=214). iter-1 NUMBERS: SSIM 0.922979, hr 0.132941, PSNR 35.32, RMSE 8.57e-4, elapsed 918s (15.3 of 20 min) -- already the best inference solver on Mayo, cleared baseline. FAILURE MODE: the hard upper clamp f.clamp_(0.0, clip_max) at 0.05 truncates every voxel above mu=0.05, i.e. it caps bone / high-attenuation structures; real Mayo LDCT attenuation exceeds 0.05, so bone detail is flattened. The headroom metric is RMSE-sensitive, so the truncated bone is a direct uncredited RMSE penalty. HYPOTHESIS: raising tv_clip_max 0.05->0.08 lets high-mu bone voxels through, so val_ssim and hr rise above iter-1 (0.923 / 0.133), because the 0.05 clamp was the binding upper constraint on bone and the RMSE-sensitive headroom was penalizing its truncation. FALSIFIER: if hr <= 0.133 (no gain or regression), the clamp is NOT the binding constraint at this lambda, and iter-3 must instead tune tv_lambda (the data-vs-smoothness balance). BUDGET: tv_clip_max is a ZERO marginal-compute knob -- identical iteration count (120) -> identical ~918s wall, ~282s margin under the 1200s 20-min budget preserved. tv_iterations deliberately NOT raised: iter-1 used 918/1200s, so more iters would risk the wall (the failure mode iter-1 flagged). val = ALL 214 L277 slices unchanged.", "advice_for_others": "tv_iterative-claude-agentic: val_n=214, train_n=0, tv_lambda=0.001, tv_iterations=120, tv_lr=0.01, tv_clip_max=0.08, tv_decay=0.01, tv_optimizer=gd, tv_init=fbp, rationale=tv_iterative iter-2 (search-20260619-01, corrected 214-slice/321px-FOV metric). ONE KNOB: tv_clip_max 0.05->0.08 (all else held IDENTICAL to iter-1: tv_lambda=0.001, tv_iterations=120, tv_lr=0.01, tv_decay=0.01, gd, fbp-init, val_n=214). iter-1 NUMBERS: SSIM 0.922979, hr 0.132941, PSNR 35.32, RMSE 8.57e-4, elapsed 918s (15.3 of 20 min) -- already the best inference solver on Mayo, cleared baseline. FAILURE MODE: the hard upper clamp f.clamp_(0.0, clip_max) at 0.05 truncates every voxel above mu=0.05, i.e. it caps bone / high-attenuation structures; real Mayo LDCT attenuation exceeds 0.05, so bone detail is flattened. The headroom metric is RMSE-sensitive, so the truncated bone is a direct uncredited RMSE penalty. HYPOTHESIS: raising tv_clip_max 0.05->0.08 lets high-mu bone voxels through, so val_ssim and hr rise above iter-1 (0.923 / 0.133), because the 0.05 clamp was the binding upper constraint on bone and the RMSE-sensitive headroom was penalizing its truncation. FALSIFIER: if hr <= 0.133 (no gain or regression), the clamp is NOT the binding constraint at this lambda, and iter-3 must instead tune tv_lambda (the data-vs-smoothness balance). BUDGET: tv_clip_max is a ZERO marginal-compute knob -- identical iteration count (120) -> identical ~918s wall, ~282s margin under the 1200s 20-min budget preserved. tv_iterations deliberately NOT raised: iter-1 used 918/1200s, so more iters would risk the wall (the failure mode iter-1 flagged). val = ALL 214 L277 slices unchanged.", "comparison_image": "runs/mayo-ldct-claude-agentic-tv-iterative-search-20260619-01/iterations/iter-0002/comparison.png"}
{"ts": "2026-06-19T19:09:41Z", "run_id": "mayo-ldct-claude-agentic-tv-iterative-supervised-search-20260619-01", "iter": 2, "agent": "tv_iterative_supervised-claude-agentic-breast-ct", "model": "claude-opus-4.7-1m", "change_class": "architecture", "status": "discard", "kept": false, "val_score": 0.2855411767959595, "headroom": 0.0, "params_M": 6e-05, "train_n": 400, "rationale": "tv_iterative_supervised-claude-agentic: val_n=214, val_chunk=5, train_n=40, epochs=8, batch_size=1, lr=0.005, tv_K=30, tv_step_init=0.01, tv_lambda_init=0.001, tv_share_steps=False, tv_clip_max=0.05, tv_eps=1e-06, lambda_neg=1.0, loss_base=mse, grad_clip=1.0, rationale=tv_iterative_supervised iter-2 (search-20260619-01, corrected 214-slice/321px-FOV metric). PRIOR: iter-1 SSIM 0.2855 / hr 0.0, elapsed 321.5s \u2014 FAR below the classical (non-trained) tv_iterative sibling (SSIM 0.92298 / hr 0.133). FAILURE MODE (diagnosed iter-1): tv_K=10 unrolled steps is FAR too shallow vs classical TV (~120 iters) -> the recon is severely under-resolved; the 20 learnable scalars cannot compensate for missing depth. ONE KNOB CHANGED: tv_K 10 -> 30 (3x deeper unroll). All else identical to iter-1 (train_n=40, epochs=8, bs=1, lr=5e-3, val_n=214 ALL L277 slices, val_chunk=5, grad_clip=1.0, tv_step_init=0.01, tv_lambda_init=0.001, tv_clip_max=0.05). BUDGET (HARD 20-min train+score; sbatch --time=00:30:00 with 10-min figure/IO headroom): iter-1 ran K=10 in 321.5s. Worst-case PURE-linear-in-K (assume all 321.5s is K-bound, fixed overhead=0): 32.15 s/K -> K=30 ~= 964s, ~20% under the 1200s wall. In reality a large slice of 321.5s is FIXED overhead (data load + 214-slice FBP precompute + per-ps probe ~60-120s), so the true K=30 cost is well under 964s. bs=1 holds only ONE K-step autograd graph at a time -> deeper K raises activation memory linearly but stays memory-safe on 16 GB (no OOM; cf. the hammernik bs=4 OOM). HYPOTHESIS: deeper unroll lifts SSIM toward the classical 0.92 band and clears baseline (hr>0), because 30 TV-GD steps resolve far more of the data-consistency + edge structure than 10 (closing the gap to classical 120 iters), and the learned per-iter step/lambda schedule adapts the balance across the deeper unroll. FALSIFIER: if SSIM/hr stay low at K=30, the limiter is NOT depth but the supervised-TV TRAINING (e.g. broken target/loss/optimisation), and iter-3 must check the training path (loss curve, learned step/lambda trajectory) rather than deepening further.", "advice_for_others": "tv_iterative_supervised-claude-agentic: val_n=214, val_chunk=5, train_n=40, epochs=8, batch_size=1, lr=0.005, tv_K=30, tv_step_init=0.01, tv_lambda_init=0.001, tv_share_steps=False, tv_clip_max=0.05, tv_eps=1e-06, lambda_neg=1.0, loss_base=mse, grad_clip=1.0, rationale=tv_iterative_supervised iter-2 (search-20260619-01, corrected 214-slice/321px-FOV metric). PRIOR: iter-1 SSIM 0.2855 / hr 0.0, elapsed 321.5s \u2014 FAR below the classical (non-trained) tv_iterative sibling (SSIM 0.92298 / hr 0.133). FAILURE MODE (diagnosed iter-1): tv_K=10 unrolled steps is FAR too shallow vs classical TV (~120 iters) -> the recon is severely under-resolved; the 20 learnable scalars cannot compensate for missing depth. ONE KNOB CHANGED: tv_K 10 -> 30 (3x deeper unroll). All else identical to iter-1 (train_n=40, epochs=8, bs=1, lr=5e-3, val_n=214 ALL L277 slices, val_chunk=5, grad_clip=1.0, tv_step_init=0.01, tv_lambda_init=0.001, tv_clip_max=0.05). BUDGET (HARD 20-min train+score; sbatch --time=00:30:00 with 10-min figure/IO headroom): iter-1 ran K=10 in 321.5s. Worst-case PURE-linear-in-K (assume all 321.5s is K-bound, fixed overhead=0): 32.15 s/K -> K=30 ~= 964s, ~20% under the 1200s wall. In reality a large slice of 321.5s is FIXED overhead (data load + 214-slice FBP precompute + per-ps probe ~60-120s), so the true K=30 cost is well under 964s. bs=1 holds only ONE K-step autograd graph at a time -> deeper K raises activation memory linearly but stays memory-safe on 16 GB (no OOM; cf. the hammernik bs=4 OOM). HYPOTHESIS: deeper unroll lifts SSIM toward the classical 0.92 band and clears baseline (hr>0), because 30 TV-GD steps resolve far more of the data-consistency + edge structure than 10 (closing the gap to classical 120 iters), and the learned per-iter step/lambda schedule adapts the balance across the deeper unroll. FALSIFIER: if SSIM/hr stay low at K=30, the limiter is NOT depth but the supervised-TV TRAINING (e.g. broken target/loss/optimisation), and iter-3 must check the training path (loss curve, learned step/lambda trajectory) rather than deepening further.", "comparison_image": "runs/mayo-ldct-claude-agentic-tv-iterative-supervised-search-20260619-01/iterations/iter-0002/comparison.png"}
{"ts": "2026-06-19T18:53:26Z", "run_id": "mayo-ldct-claude-agentic-hammernik-vn-search-20260619-01", "iter": 2, "agent": "hammernik_vn-claude-agentic-breast-ct", "model": "claude-opus-4.7-1m", "change_class": "architecture", "status": "discard", "kept": false, "val_score": 0.7919500470161438, "headroom": 0.0, "params_M": 0.018245, "train_n": 400, "rationale": "hammernik_vn-claude-agentic: vn_T=5, vn_n_filters=24, vn_kernel=11, vn_n_bumps=31, vn_x_range=1.0, vn_lambda_init=0.0023, vn_init=fbp, vn_dc_norm=True, vn_checkpoint=True, vn_normalize_filters=False, epochs=10, batch_size=2, lr=0.0005, grad_clip=1.0, train_n=200, val_n=214, max_train_s=1000, seed=42, rationale=hammernik_vn iter-2 (search-20260619-01). ONE KNOB: vn_n_filters 16->24 (all else held: vn_T=5, vn_kernel=11, vn_n_bumps=31, lr=5e-4, batch_size=2, vn_checkpoint=true, grad_clip=1.0, vn_dc_norm=true, vn_lambda_init=2.3e-3, max_train_s=1000, train_n=200, val_n=214, seed=42). DIAGNOSIS from iter-1 SLURM log (765196): training CONVERGED by epoch 3 (loss 5.2e-6 ep3 -> 1.6e-6 ep7, asymptotically flat; wall tripped at ep7/14 in 1000s), and the VN settled at SSIM 0.805 BELOW its own FBP init (baseline SSIM ~0.84, baseline_PSNR 34.08). This is a CONVERGED-BUT-BAD basin, NOT under-training -- so epochs-up is INERT here (the proven epochs lever applied to genuinely under-trained trainers; this one has flat loss). lambda_t never moved from init (0.0023 across all 5 steps), so the tiny-DC + 16-filter regulariser converged to a BLUNT SMOOTHER that degrades the FBP init below baseline. Per the brief conditional (epochs-up if budget allows, ELSE vn_n_filters or lr): training is converged AND near the wall -> capacity knob. vn_n_filters 16->24 (the solver default capacity) gives the learned filter bank enough degrees of freedom to learn an EDGE-PRESERVING regulariser instead of the smoothing it collapsed to with 16 filters. NOT touching lr (campaign has lr5e-4-optimal / 8e-4-worse on record). HYPOTHESIS: with 24 filters the regulariser can preserve structure rather than smooth, lifting val_ssim ABOVE the iter-1 0.805 and ideally to/above the ~0.84 FBP floor (hr>0). FALSIFIER: if val_ssim stays <=0.81 (still <FBP), the VN family is structurally smoothing-bound at this DC weight regardless of filter count, and iter-3 must instead raise the DC weight (vn_lambda_init) so data-consistency dominates the regulariser. BUDGET: 24 filters ~1.3x the per-step RBF/conv cost; iter-1 did 7 ep in 1000s (143 s/ep) so expect ~5 ep in the 1000s wall -- still >3 (convergence point), so the converged-comparison is fair. Memory safe: vn_checkpoint=true + batch_size=2 keep N_k=24 (the solver memory-fitted default) within the card. max_train_s=1000 unchanged; total ~1300s under the 1800s SLURM kill.", "advice_for_others": "hammernik_vn-claude-agentic: vn_T=5, vn_n_filters=24, vn_kernel=11, vn_n_bumps=31, vn_x_range=1.0, vn_lambda_init=0.0023, vn_init=fbp, vn_dc_norm=True, vn_checkpoint=True, vn_normalize_filters=False, epochs=10, batch_size=2, lr=0.0005, grad_clip=1.0, train_n=200, val_n=214, max_train_s=1000, seed=42, rationale=hammernik_vn iter-2 (search-20260619-01). ONE KNOB: vn_n_filters 16->24 (all else held: vn_T=5, vn_kernel=11, vn_n_bumps=31, lr=5e-4, batch_size=2, vn_checkpoint=true, grad_clip=1.0, vn_dc_norm=true, vn_lambda_init=2.3e-3, max_train_s=1000, train_n=200, val_n=214, seed=42). DIAGNOSIS from iter-1 SLURM log (765196): training CONVERGED by epoch 3 (loss 5.2e-6 ep3 -> 1.6e-6 ep7, asymptotically flat; wall tripped at ep7/14 in 1000s), and the VN settled at SSIM 0.805 BELOW its own FBP init (baseline SSIM ~0.84, baseline_PSNR 34.08). This is a CONVERGED-BUT-BAD basin, NOT under-training -- so epochs-up is INERT here (the proven epochs lever applied to genuinely under-trained trainers; this one has flat loss). lambda_t never moved from init (0.0023 across all 5 steps), so the tiny-DC + 16-filter regulariser converged to a BLUNT SMOOTHER that degrades the FBP init below baseline. Per the brief conditional (epochs-up if budget allows, ELSE vn_n_filters or lr): training is converged AND near the wall -> capacity knob. vn_n_filters 16->24 (the solver default capacity) gives the learned filter bank enough degrees of freedom to learn an EDGE-PRESERVING regulariser instead of the smoothing it collapsed to with 16 filters. NOT touching lr (campaign has lr5e-4-optimal / 8e-4-worse on record). HYPOTHESIS: with 24 filters the regulariser can preserve structure rather than smooth, lifting val_ssim ABOVE the iter-1 0.805 and ideally to/above the ~0.84 FBP floor (hr>0). FALSIFIER: if val_ssim stays <=0.81 (still <FBP), the VN family is structurally smoothing-bound at this DC weight regardless of filter count, and iter-3 must instead raise the DC weight (vn_lambda_init) so data-consistency dominates the regulariser. BUDGET: 24 filters ~1.3x the per-step RBF/conv cost; iter-1 did 7 ep in 1000s (143 s/ep) so expect ~5 ep in the 1000s wall -- still >3 (convergence point), so the converged-comparison is fair. Memory safe: vn_checkpoint=true + batch_size=2 keep N_k=24 (the solver memory-fitted default) within the card. max_train_s=1000 unchanged; total ~1300s under the 1800s SLURM kill.", "comparison_image": "runs/mayo-ldct-claude-agentic-hammernik-vn-search-20260619-01/iterations/iter-0002/comparison.png"}
