{"ts": "2026-06-21T15:54:27Z", "run_id": "mayo-ldct-claude-agentic-diff-recon-dcstep-unconstrained-mayo-v4-search-20260619-01", "iter": 9, "agent": "diffusion_recon_dcstep_unconstrained_mayo_v4-claude-agentic", "model": "claude-opus-4-8-1m", "change_class": "architecture", "status": "discard", "kept": false, "val_score": 0.8769752383232117, "headroom": 0.0, "params_M": 8.594211, "train_n": 400, "rationale": "diffusion_recon_dcstep_unconstrained_mayo_v4-claude-agentic: recon_ckpt=/cluster/maier/Agent4CT/checkpoints/ddpm_mayo_unconstrained_v4.pt, recon_mode=dps, recon_sample_steps=72, recon_eta=2.0, recon_init=fbp, recon_eta_clamp=False, recon_dcstep_every=5, recon_dcstep_n_cg=3, recon_dcstep_warmup=5, recon_dcstep_relax=1.0, recon_dc_solver=cg, val_n=72, train_n=0, rationale=iter-9 search-20260619-01 UNCONSTRAINED diff-recon -- TUNE THE DPS GUIDANCE GAIN at the CG-DC working point (untried axis; NFE is now at its val_n budget floor). ONE KNOB: recon_eta (DPS soft-guidance gain, the adaptive-weight scalar zeta_t=eta/||resid|| in Chung 2023 eq.12) 5.0 -> 2.0. BASE = iter-8 (BEST SSIM 0.8784): recon_sample_steps=72, recon_dc_solver=cg, recon_dcstep_every=5, recon_dcstep_n_cg=3, recon_dcstep_warmup=5, recon_dcstep_relax=1.0, recon_init=fbp, recon_eta_clamp=false, val_n=72 ALL UNCHANGED. reuse ddpm_mayo_unconstrained_v4.pt (200 train slices, NO retrain). WHY eta IS THE RIGHT KNOB NOW: the NFE lever (recon_sample_steps) was the SSIM climber across iters 6-8 (CG-DC 0.8241 @T40 -> 0.8711 @T56 -> 0.8784 @T72) but is at DIMINISHING returns (+0.047 then +0.0073) AND at its budget floor -- T=72 already needs val_n=72, and the next NFE step T->90 would push val_n below the ~60 representative-metric floor. eta has NEVER been tuned WITH hard-CG active: iters 1-2 moved eta (30->5) on the PURE-SOFT path (recon_dcstep_every=0) BEFORE the CG-DC A-fix existed, where the soft DPS gradient was the ONLY data-fidelity term. Since iter-6 the CG projection (n_cg=3 Gauss-Newton solve of AtA x = At y every 5 steps, relax=1.0 full hard projection) is the DOMINANT fidelity backstop, so the eta=5 soft gradient -- a leftover sized for the no-CG regime -- is likely OVER-DRIVING and double-counting the measurements, fighting the CG projection and leaving residual texture that costs SSIM. eta is a free scalar on the existing per-step gradient: ZERO extra forward/backward/projector calls, so val_n stays 72 (no NFE trade). TRAJECTORY (val L277, 321px detector-geometry FOV, LD-FBP floor 0.8078): iter-1 T25/eta30/every0 0.3688; iter-2 eta30->5 0.3960 (best soft); iter-3 T25->32 0.3869; iter-4 every0->5 LEGACY hard-DC 0.0553 (collapse); iter-5 T->40 soft 0.3709; iter-6 recon_dc_solver=cg CG-DC 0.8241/PSNR27.15 (A-fix); iter-7 T40->56 0.8711/PSNR29.82; iter-8 T56->72 0.8784/PSNR30.59 (BEST). LIMITER: hr regime-bounded at 0 on DENSE 2304-view rebinned Mayo (LD-FBP near-complete); NFE at the val_n budget floor; the eta/guidance gain is the last untried in-budget SSIM axis at the CG-DC working point. HYPOTHESIS: with hard-CG now owning data fidelity, the eta=5 soft DPS gradient is too aggressive and double-counts the measurements; lowering eta 5->2 lets the CG projection dominate and the soft term only nudge, reducing residual texture and lifting SSIM modestly above iter-8 0.8784 -- predicted 0.878-0.885, hr STAYS 0 (regime-bound). NUMERIC FALSIFIER: if SSIM <= 0.8784 (flat-or-down vs iter-8) at eta=2, the eta/guidance lever is EXHAUSTED on the CG-DC path (eta inert once hard-CG is active) AND NFE is at its budget floor -> both in-budget SSIM levers are spent; file it, unconstrained best stays iter-8 (SSIM 0.8784, hr 0), and the only remaining lever is the DEFERRED v5 EMA DDPM prior retrain (full train pool + EMA + DPS-recon selection). BUDGET (HARD 20-min=1200s wall, val=72 evenly-spaced L277): eta adds ZERO compute -- iter-8 ran 1051.6s at T=72/val_n=72 = 14.605 s/slice; iter-9 same T=72/val_n=72 -> 72*14.605 = 1052s = 17.5 min < 1200s (~148s headroom). val_n=72 held above the ~60 floor. HARD-WIRED: staged_canonical data, v3 mayo_ldct_fitted geometry, per-sample-ps single-val-ps probe, bg_target=truth, 321px detector-geometry FOV default (no fov=False), recon_dc_solver=cg. reuse ddpm_mayo_unconstrained_v4.pt (NO retrain).", "advice_for_others": "diffusion_recon_dcstep_unconstrained_mayo_v4-claude-agentic: recon_ckpt=/cluster/maier/Agent4CT/checkpoints/ddpm_mayo_unconstrained_v4.pt, recon_mode=dps, recon_sample_steps=72, recon_eta=2.0, recon_init=fbp, recon_eta_clamp=False, recon_dcstep_every=5, recon_dcstep_n_cg=3, recon_dcstep_warmup=5, recon_dcstep_relax=1.0, recon_dc_solver=cg, val_n=72, train_n=0, rationale=iter-9 search-20260619-01 UNCONSTRAINED diff-recon -- TUNE THE DPS GUIDANCE GAIN at the CG-DC working point (untried axis; NFE is now at its val_n budget floor). ONE KNOB: recon_eta (DPS soft-guidance gain, the adaptive-weight scalar zeta_t=eta/||resid|| in Chung 2023 eq.12) 5.0 -> 2.0. BASE = iter-8 (BEST SSIM 0.8784): recon_sample_steps=72, recon_dc_solver=cg, recon_dcstep_every=5, recon_dcstep_n_cg=3, recon_dcstep_warmup=5, recon_dcstep_relax=1.0, recon_init=fbp, recon_eta_clamp=false, val_n=72 ALL UNCHANGED. reuse ddpm_mayo_unconstrained_v4.pt (200 train slices, NO retrain). WHY eta IS THE RIGHT KNOB NOW: the NFE lever (recon_sample_steps) was the SSIM climber across iters 6-8 (CG-DC 0.8241 @T40 -> 0.8711 @T56 -> 0.8784 @T72) but is at DIMINISHING returns (+0.047 then +0.0073) AND at its budget floor -- T=72 already needs val_n=72, and the next NFE step T->90 would push val_n below the ~60 representative-metric floor. eta has NEVER been tuned WITH hard-CG active: iters 1-2 moved eta (30->5) on the PURE-SOFT path (recon_dcstep_every=0) BEFORE the CG-DC A-fix existed, where the soft DPS gradient was the ONLY data-fidelity term. Since iter-6 the CG projection (n_cg=3 Gauss-Newton solve of AtA x = At y every 5 steps, relax=1.0 full hard projection) is the DOMINANT fidelity backstop, so the eta=5 soft gradient -- a leftover sized for the no-CG regime -- is likely OVER-DRIVING and double-counting the measurements, fighting the CG projection and leaving residual texture that costs SSIM. eta is a free scalar on the existing per-step gradient: ZERO extra forward/backward/projector calls, so val_n stays 72 (no NFE trade). TRAJECTORY (val L277, 321px detector-geometry FOV, LD-FBP floor 0.8078): iter-1 T25/eta30/every0 0.3688; iter-2 eta30->5 0.3960 (best soft); iter-3 T25->32 0.3869; iter-4 every0->5 LEGACY hard-DC 0.0553 (collapse); iter-5 T->40 soft 0.3709; iter-6 recon_dc_solver=cg CG-DC 0.8241/PSNR27.15 (A-fix); iter-7 T40->56 0.8711/PSNR29.82; iter-8 T56->72 0.8784/PSNR30.59 (BEST). LIMITER: hr regime-bounded at 0 on DENSE 2304-view rebinned Mayo (LD-FBP near-complete); NFE at the val_n budget floor; the eta/guidance gain is the last untried in-budget SSIM axis at the CG-DC working point. HYPOTHESIS: with hard-CG now owning data fidelity, the eta=5 soft DPS gradient is too aggressive and double-counts the measurements; lowering eta 5->2 lets the CG projection dominate and the soft term only nudge, reducing residual texture and lifting SSIM modestly above iter-8 0.8784 -- predicted 0.878-0.885, hr STAYS 0 (regime-bound). NUMERIC FALSIFIER: if SSIM <= 0.8784 (flat-or-down vs iter-8) at eta=2, the eta/guidance lever is EXHAUSTED on the CG-DC path (eta inert once hard-CG is active) AND NFE is at its budget floor -> both in-budget SSIM levers are spent; file it, unconstrained best stays iter-8 (SSIM 0.8784, hr 0), and the only remaining lever is the DEFERRED v5 EMA DDPM prior retrain (full train pool + EMA + DPS-recon selection). BUDGET (HARD 20-min=1200s wall, val=72 evenly-spaced L277): eta adds ZERO compute -- iter-8 ran 1051.6s at T=72/val_n=72 = 14.605 s/slice; iter-9 same T=72/val_n=72 -> 72*14.605 = 1052s = 17.5 min < 1200s (~148s headroom). val_n=72 held above the ~60 floor. HARD-WIRED: staged_canonical data, v3 mayo_ldct_fitted geometry, per-sample-ps single-val-ps probe, bg_target=truth, 321px detector-geometry FOV default (no fov=False), recon_dc_solver=cg. reuse ddpm_mayo_unconstrained_v4.pt (NO retrain).", "comparison_image": "runs/mayo-ldct-claude-agentic-diff-recon-dcstep-unconstrained-mayo-v4-search-20260619-01/iterations/iter-0009/comparison.png"}
{"ts": "2026-06-21T15:51:07Z", "run_id": "mayo-ldct-claude-agentic-ram-search-20260619-01", "iter": 9, "agent": "ram_zeroshot-claude-agentic", "model": "claude-opus-4-8-1m", "change_class": "architecture", "status": "discard", "kept": false, "val_score": 0.9070974588394165, "headroom": 0.0, "params_M": 35.618953, "train_n": 400, "rationale": "ram_zeroshot-claude-agentic: ram_ckpt_path=/cluster/maier/Agent4CT/checkpoints/ram.pth.tar, ram_input_norm=fbp_max, ram_clamp_output=True, ram_finetune=False, ram_finetune_epochs=0, ram_finetune_lr=0.0001, ram_disable_multiscale=True, ram_disable_cudnn=False, ram_use_deepinv_tomo=False, ram_sigma=0.005, ram_factor=0.55, ram_post_fbp_blend=0.3, val_n=214, rationale=iter-9 (search-20260619-01) CLEAN CEILING CONFIRMATION toward the iter-20 mandate. BASE_ITER=5 = the BEST inference config (SSIM 0.9070974588394165 hr 0.0: ram_input_norm=fbp_max, ram_factor=0.55, ram_post_fbp_blend=0.3, ram_sigma=0.005, multiscale OFF, finetune OFF, deepinv_tomo OFF); empty patch {} -> bit-identical re-run of the best point. SIX-BOX (NUMBERS not CT pixels): (1) TRAJECTORY + MAPPED LEVERS + DETERMINISM: SSIM 0.8611->0.8644->0.8968->0.9024->0.9071 (iters 1-5), hr pinned EXACTLY 0.0 throughout; ALL FIVE inference levers swept & exhausted at hr 0.0 -- post-hoc linear blend ram_post_fbp_blend [i2 0.3->0.5], internal prox_l2 DC gain ram_factor [i3 0.55->0.2], denoiser noise-conditioning ram_sigma [i4 0.005->0.02], input-amplitude norm ram_input_norm [i5 adjoint_max->fbp_max], deepinv-tomo DC physics path ram_use_deepinv_tomo [i6 False->True regression]; per-slice self-supervised ram_finetune is BUDGET-INFEASIBLE (~80s/slice x214 = ~4.7h, 14x over the 1200s HARD budget, TIMED OUT at the iter-7 first attempt, solver has NO amortize-once/finetune-subset/train-split mode -> structurally per-sinogram, hoisting it out of the per-slice loop would require editing the FORBIDDEN solver). The solver is DETERMINISTIC: a single zero-shot forward pass with frozen weights and no sampling -> iter-5, iter-7, AND iter-8 all reproduced val_score 0.9070974588394165 BIT-IDENTICALLY, so a seed read does NOTHING. (2) LIMITER: foreign-prior FBP-ceiling on dense Mayo. RAM is a frozen pretrained zero-shot deepinv foundation-model denoiser that never saw real LDCT helical-rebinned 2304-view fan data; on dense full-view Mayo LD-FBP is already a near-complete inversion, so a foreign-prior denoiser can only redistribute/smooth signal, not add LDCT-specific recoverable structure -> RMSE stays above the LD-FBP floor (~31-33dB PSNR below the floor) -> calibrated headroom pinned at 0.0 (baseline LD-FBP SSIM 0.8078, oracle HD-FBP SSIM 0.9331; best RAM SSIM 0.9071 is below the LD-FBP floor on the RMSE-sensitive metric). (3) ONE KNOB: NONE genuinely-untried in-budget exists -- empty patch {} on BASE_ITER=5. Audited: ram_disable_multiscale True->False re-enables per-scale physics evals across 214 slices, pushing the already-985s path over the 1200s wall WITHOUT being a quality lever; ram_clamp_output True->False is degenerate on an RMSE-sensitive metric (unclamping can only let pixels drift = neutral-or-worse, non-diagnostic); no seed lever (deterministic, proven bit-identical); ram_finetune budget-infeasible. So the honest call is the empty-patch CONFIRMATION re-running the best inference point. (4) HYPOTHESIS: hr stays EXACTLY 0.0 at SSIM 0.9070974588394165 (bit-identical determinism). NUMERIC FALSIFIER: if this re-run lands hr != 0.0 OR SSIM != 0.9070974588394165, the iter-5/7/8 reads were NOT stable (non-determinism in the zero-shot path) and the ceiling read must be re-audited; otherwise the FBP-bound ceiling is confirmed for the 4th time and the finetune lever is retired as budget-infeasible (NOT a negative architectural result). (5) SIZE/BUDGET <=1200s: INFERENCE-ONLY (ram_finetune=False), IDENTICAL compute profile to iter-5/7/8 (985.9s/989.8s/970.4s = 16-16.4 min, ~4.6s/slice x 214 single forward passes + one op-norm power iter), comfortably under the HARD 1200s=20-min budget; ram_use_deepinv_tomo=False avoids extra deepinv-tomo physics evals; ZERO finetune cost (finetune OFF). sbatch --time=00:30:00 backstop wall (no in-solver wall knob in solver_ram.py). val=ALL 214 L277 slices. (6) no control return. HARD-WIRED: staged_canonical, v3 mayo_ldct_fitted geom, per-sample-ps (single-val-ps probe, val-only solver), bg_target=truth, val=ALL 214 L277, 321px FOV DEFAULT (no fov=False). NEVER edit ddssl_ldct/ or the solver file.", "advice_for_others": "ram_zeroshot-claude-agentic: ram_ckpt_path=/cluster/maier/Agent4CT/checkpoints/ram.pth.tar, ram_input_norm=fbp_max, ram_clamp_output=True, ram_finetune=False, ram_finetune_epochs=0, ram_finetune_lr=0.0001, ram_disable_multiscale=True, ram_disable_cudnn=False, ram_use_deepinv_tomo=False, ram_sigma=0.005, ram_factor=0.55, ram_post_fbp_blend=0.3, val_n=214, rationale=iter-9 (search-20260619-01) CLEAN CEILING CONFIRMATION toward the iter-20 mandate. BASE_ITER=5 = the BEST inference config (SSIM 0.9070974588394165 hr 0.0: ram_input_norm=fbp_max, ram_factor=0.55, ram_post_fbp_blend=0.3, ram_sigma=0.005, multiscale OFF, finetune OFF, deepinv_tomo OFF); empty patch {} -> bit-identical re-run of the best point. SIX-BOX (NUMBERS not CT pixels): (1) TRAJECTORY + MAPPED LEVERS + DETERMINISM: SSIM 0.8611->0.8644->0.8968->0.9024->0.9071 (iters 1-5), hr pinned EXACTLY 0.0 throughout; ALL FIVE inference levers swept & exhausted at hr 0.0 -- post-hoc linear blend ram_post_fbp_blend [i2 0.3->0.5], internal prox_l2 DC gain ram_factor [i3 0.55->0.2], denoiser noise-conditioning ram_sigma [i4 0.005->0.02], input-amplitude norm ram_input_norm [i5 adjoint_max->fbp_max], deepinv-tomo DC physics path ram_use_deepinv_tomo [i6 False->True regression]; per-slice self-supervised ram_finetune is BUDGET-INFEASIBLE (~80s/slice x214 = ~4.7h, 14x over the 1200s HARD budget, TIMED OUT at the iter-7 first attempt, solver has NO amortize-once/finetune-subset/train-split mode -> structurally per-sinogram, hoisting it out of the per-slice loop would require editing the FORBIDDEN solver). The solver is DETERMINISTIC: a single zero-shot forward pass with frozen weights and no sampling -> iter-5, iter-7, AND iter-8 all reproduced val_score 0.9070974588394165 BIT-IDENTICALLY, so a seed read does NOTHING. (2) LIMITER: foreign-prior FBP-ceiling on dense Mayo. RAM is a frozen pretrained zero-shot deepinv foundation-model denoiser that never saw real LDCT helical-rebinned 2304-view fan data; on dense full-view Mayo LD-FBP is already a near-complete inversion, so a foreign-prior denoiser can only redistribute/smooth signal, not add LDCT-specific recoverable structure -> RMSE stays above the LD-FBP floor (~31-33dB PSNR below the floor) -> calibrated headroom pinned at 0.0 (baseline LD-FBP SSIM 0.8078, oracle HD-FBP SSIM 0.9331; best RAM SSIM 0.9071 is below the LD-FBP floor on the RMSE-sensitive metric). (3) ONE KNOB: NONE genuinely-untried in-budget exists -- empty patch {} on BASE_ITER=5. Audited: ram_disable_multiscale True->False re-enables per-scale physics evals across 214 slices, pushing the already-985s path over the 1200s wall WITHOUT being a quality lever; ram_clamp_output True->False is degenerate on an RMSE-sensitive metric (unclamping can only let pixels drift = neutral-or-worse, non-diagnostic); no seed lever (deterministic, proven bit-identical); ram_finetune budget-infeasible. So the honest call is the empty-patch CONFIRMATION re-running the best inference point. (4) HYPOTHESIS: hr stays EXACTLY 0.0 at SSIM 0.9070974588394165 (bit-identical determinism). NUMERIC FALSIFIER: if this re-run lands hr != 0.0 OR SSIM != 0.9070974588394165, the iter-5/7/8 reads were NOT stable (non-determinism in the zero-shot path) and the ceiling read must be re-audited; otherwise the FBP-bound ceiling is confirmed for the 4th time and the finetune lever is retired as budget-infeasible (NOT a negative architectural result). (5) SIZE/BUDGET <=1200s: INFERENCE-ONLY (ram_finetune=False), IDENTICAL compute profile to iter-5/7/8 (985.9s/989.8s/970.4s = 16-16.4 min, ~4.6s/slice x 214 single forward passes + one op-norm power iter), comfortably under the HARD 1200s=20-min budget; ram_use_deepinv_tomo=False avoids extra deepinv-tomo physics evals; ZERO finetune cost (finetune OFF). sbatch --time=00:30:00 backstop wall (no in-solver wall knob in solver_ram.py). val=ALL 214 L277 slices. (6) no control return. HARD-WIRED: staged_canonical, v3 mayo_ldct_fitted geom, per-sample-ps (single-val-ps probe, val-only solver), bg_target=truth, val=ALL 214 L277, 321px FOV DEFAULT (no fov=False). NEVER edit ddssl_ldct/ or the solver file.", "comparison_image": "runs/mayo-ldct-claude-agentic-ram-search-20260619-01/iterations/iter-0009/comparison.png"}
