{"ts": "2026-06-21T14:04:06Z", "run_id": "mayo-ldct-claude-agentic-itnet-v3-search-20260619-01", "iter": 9, "agent": "itnet_v3-claude-agentic", "model": "claude-opus-4-8-1m", "change_class": "architecture", "status": "keep", "kept": true, "val_score": 0.9218540191650391, "headroom": 0.36081211726029994, "params_M": 3.698994, "train_n": 400, "rationale": "itnet_v3-claude-agentic: itnet_k=2, unet_c=16, alpha_init=0.0037, lr=0.0001, epochs=9, batch_size=1, val_chunk=1, train_n=460, val_n=214, grad_clip=1.0, max_train_s=720, seed=42, rationale=iter-9 (search-20260619-01, corrected protocol). BASE_ITER=7 (the BEST: itnet_k=3/unet_c=16/alpha_init=0.0037/lr=1e-4/epochs=9/train_n=460/grad_clip=1.0/seed=42, hr 0.336607 / SSIM 0.915241). ONE KNOB: itnet_k 3 to 2 (number of unrolled denoise+DC steps). GENUINELY-UNTRIED architectural knob -- itnet_k pinned at 3 for all 8 iters; data-coverage (train_n 200->460->579), epochs (8->18, plateaued), capacity (unet_c 16->24, regressed) are exhausted, lr is OFF-LIMITS (v3 lr-FRAGILE: lr3e-4 historically COLLAPSED it). SIX-BOX (NUMBERS). (1) TRAJECTORY: iter-1 ep8/tn200/k3 hr 0.268409; iter-2 ep14 0.310054; iter-3 ep18 0.312282 (epochs PLATEAUED +0.0022, SSIM dropped); iter-4 c24/ep9 0.295576 (capacity REGRESSED -> revert c16); iter-5 ep9/tn400 0.328842 (+0.0165 DATA lever); iter-6 ep6/tn579 0.315239 (full data but exposure cut to 6x -> REGRESSED); iter-7 BEST ep9/tn460 hr 0.336607 / SSIM 0.915241 / elapsed 1139.1s (coverage-at-9x-exposure, +0.0078); iter-8 ep7/tn579 0.314928 (full data at 7x still under-trains -> data-coverage EXHAUSTED in-budget; v3 needs >=8-9x exposure full data cannot afford). MAPPED: epochs (plateaued), unet_c (regressed), train_n (best 460), lr (off-limits/fragile), grad_clip (mandatory=1.0). UNTRIED: itnet_k (always 3), alpha_init (always 0.0037), seed (always 42). (2) LIMITER: data-coverage EXHAUSTED in-budget (iter-8 falsifier fired -- full data under-trains at the affordable 7x); the architectural DC-step count itnet_k is the most load-bearing untried knob, and CROSS-SOLVER evidence is strong: itnet v1 (the current Mayo #1 at hr 0.434) won at itnet_k=1 -- fewer DC steps win on noisy LDCT (campaign-state note). v3 has never moved off k=3. (3) ONE KNOB: itnet_k 3 to 2 (single clean step down from the proven k=3 basin -- NOT a 3->1 jump; v3 is fragile and a 2-step architectural change risks collapse like the lr/capacity moves). All else = iter-7 best EXACTLY (unet_c=16, alpha_init=0.0037, lr=1e-4, epochs=9, train_n=460, grad_clip=1.0, seed=42); epochs HELD at 9 (NOT traded up) to keep a clean single-knob read -- the ~220s freed by the cheaper k=2 stack is left under-wall on purpose so the falsifier isolates the k-effect, not extra optimization (if k=2 wins, iter-10 banks the freed budget as epochs). (4) HYPOTHESIS: cutting the unrolled DC count 3 to 2 lifts hr above the iter-7 best 0.336607, because on noisy dense-view LDCT each 2304-view FBP-adjoint DC step re-injects measurement noise (the LD sinogram is the noise source), so fewer DC steps = less noise re-injection = cleaner recon -- the mechanism that made itnet v1 champion at k=1. NUMERIC FALSIFIER: if hr <= 0.336607 at k=2/ep9/tn460, the v1 fewer-DC-steps-win result does NOT transfer to the v3 end-to-end variant (v3 learned-alpha already balances DC re-injection, or k=3 is needed for the end-to-end gradient path) -> itnet_k lever exhausted for v3, iter-10 tries alpha_init or seed (the last two untried knobs); 0.3366 stands as v3 budget-constrained ceiling. (5) BUDGET (HARD 1200s = train+score): forward() runs k iterations of denoise+dc_step, dc_step is a full 2304-view forward-project + FBP, so per-slice train cost scales ~ with k. From iter-7 (k3/tn460/ep9 -> 1139.1s): fixed 481s + 9*460*per_slice => per_slice_k3 = 0.1590 s/slice; per-k unit = 0.0530 s. At k=2: per_slice = 0.1060 s -> ep9/tn460 = 481 + 9*460*0.1060 = 920s = 15.3 min < 1200s with ~280s headroom. Train-only at ep9 = 439s; max_train_s=720 safe backstop (never truncates -- checks between epochs, fences only runaway slowdown); the 214-slice per-sample val + figure always land inside the 30-min sbatch wall. val=ALL 214 L277 slices, 321px detector-geometry FOV (evaluate_calibrated default for AGENT4CT_DATASET=mayo_ldct_2d; no fov= override). lr HELD at 1e-4 (v3 lr-FRAGILE -- do NOT touch). grad_clip=1.0 retained (mandatory: 2304-view Mayo FBP adjoint inside dc_step overflows otherwise). HARD-WIRED (unchanged): staged_canonical v3 mayo_ldct_fitted geometry, per-sample-ps FBP init + per-sample itnet.projector swap for the k DC steps, bg_target=truth. (6) do NOT return control mid-campaign. Predicted iter-9 hr: 0.34-0.35 if fewer-DC-steps-win transfers from v1; <=0.3366 falsifies -> itnet_k lever exhausted for v3, iter-10 tries alpha_init/seed.", "advice_for_others": "itnet_v3-claude-agentic: itnet_k=2, unet_c=16, alpha_init=0.0037, lr=0.0001, epochs=9, batch_size=1, val_chunk=1, train_n=460, val_n=214, grad_clip=1.0, max_train_s=720, seed=42, rationale=iter-9 (search-20260619-01, corrected protocol). BASE_ITER=7 (the BEST: itnet_k=3/unet_c=16/alpha_init=0.0037/lr=1e-4/epochs=9/train_n=460/grad_clip=1.0/seed=42, hr 0.336607 / SSIM 0.915241). ONE KNOB: itnet_k 3 to 2 (number of unrolled denoise+DC steps). GENUINELY-UNTRIED architectural knob -- itnet_k pinned at 3 for all 8 iters; data-coverage (train_n 200->460->579), epochs (8->18, plateaued), capacity (unet_c 16->24, regressed) are exhausted, lr is OFF-LIMITS (v3 lr-FRAGILE: lr3e-4 historically COLLAPSED it). SIX-BOX (NUMBERS). (1) TRAJECTORY: iter-1 ep8/tn200/k3 hr 0.268409; iter-2 ep14 0.310054; iter-3 ep18 0.312282 (epochs PLATEAUED +0.0022, SSIM dropped); iter-4 c24/ep9 0.295576 (capacity REGRESSED -> revert c16); iter-5 ep9/tn400 0.328842 (+0.0165 DATA lever); iter-6 ep6/tn579 0.315239 (full data but exposure cut to 6x -> REGRESSED); iter-7 BEST ep9/tn460 hr 0.336607 / SSIM 0.915241 / elapsed 1139.1s (coverage-at-9x-exposure, +0.0078); iter-8 ep7/tn579 0.314928 (full data at 7x still under-trains -> data-coverage EXHAUSTED in-budget; v3 needs >=8-9x exposure full data cannot afford). MAPPED: epochs (plateaued), unet_c (regressed), train_n (best 460), lr (off-limits/fragile), grad_clip (mandatory=1.0). UNTRIED: itnet_k (always 3), alpha_init (always 0.0037), seed (always 42). (2) LIMITER: data-coverage EXHAUSTED in-budget (iter-8 falsifier fired -- full data under-trains at the affordable 7x); the architectural DC-step count itnet_k is the most load-bearing untried knob, and CROSS-SOLVER evidence is strong: itnet v1 (the current Mayo #1 at hr 0.434) won at itnet_k=1 -- fewer DC steps win on noisy LDCT (campaign-state note). v3 has never moved off k=3. (3) ONE KNOB: itnet_k 3 to 2 (single clean step down from the proven k=3 basin -- NOT a 3->1 jump; v3 is fragile and a 2-step architectural change risks collapse like the lr/capacity moves). All else = iter-7 best EXACTLY (unet_c=16, alpha_init=0.0037, lr=1e-4, epochs=9, train_n=460, grad_clip=1.0, seed=42); epochs HELD at 9 (NOT traded up) to keep a clean single-knob read -- the ~220s freed by the cheaper k=2 stack is left under-wall on purpose so the falsifier isolates the k-effect, not extra optimization (if k=2 wins, iter-10 banks the freed budget as epochs). (4) HYPOTHESIS: cutting the unrolled DC count 3 to 2 lifts hr above the iter-7 best 0.336607, because on noisy dense-view LDCT each 2304-view FBP-adjoint DC step re-injects measurement noise (the LD sinogram is the noise source), so fewer DC steps = less noise re-injection = cleaner recon -- the mechanism that made itnet v1 champion at k=1. NUMERIC FALSIFIER: if hr <= 0.336607 at k=2/ep9/tn460, the v1 fewer-DC-steps-win result does NOT transfer to the v3 end-to-end variant (v3 learned-alpha already balances DC re-injection, or k=3 is needed for the end-to-end gradient path) -> itnet_k lever exhausted for v3, iter-10 tries alpha_init or seed (the last two untried knobs); 0.3366 stands as v3 budget-constrained ceiling. (5) BUDGET (HARD 1200s = train+score): forward() runs k iterations of denoise+dc_step, dc_step is a full 2304-view forward-project + FBP, so per-slice train cost scales ~ with k. From iter-7 (k3/tn460/ep9 -> 1139.1s): fixed 481s + 9*460*per_slice => per_slice_k3 = 0.1590 s/slice; per-k unit = 0.0530 s. At k=2: per_slice = 0.1060 s -> ep9/tn460 = 481 + 9*460*0.1060 = 920s = 15.3 min < 1200s with ~280s headroom. Train-only at ep9 = 439s; max_train_s=720 safe backstop (never truncates -- checks between epochs, fences only runaway slowdown); the 214-slice per-sample val + figure always land inside the 30-min sbatch wall. val=ALL 214 L277 slices, 321px detector-geometry FOV (evaluate_calibrated default for AGENT4CT_DATASET=mayo_ldct_2d; no fov= override). lr HELD at 1e-4 (v3 lr-FRAGILE -- do NOT touch). grad_clip=1.0 retained (mandatory: 2304-view Mayo FBP adjoint inside dc_step overflows otherwise). HARD-WIRED (unchanged): staged_canonical v3 mayo_ldct_fitted geometry, per-sample-ps FBP init + per-sample itnet.projector swap for the k DC steps, bg_target=truth. (6) do NOT return control mid-campaign. Predicted iter-9 hr: 0.34-0.35 if fewer-DC-steps-win transfers from v1; <=0.3366 falsifies -> itnet_k lever exhausted for v3, iter-10 tries alpha_init/seed.", "comparison_image": "runs/mayo-ldct-claude-agentic-itnet-v3-search-20260619-01/iterations/iter-0009/comparison.png"}
{"ts": "2026-06-21T14:01:58Z", "run_id": "mayo-ldct-claude-agentic-wu-2015-trainable-search-20260619-01", "iter": 9, "agent": "wu_2015_trainable-claude-agentic", "model": "claude-opus-4-8-1m", "change_class": "architecture", "status": "keep", "kept": true, "val_score": 0.8160176277160645, "headroom": 0.09516316981324013, "params_M": 8e-06, "train_n": 400, "rationale": "wu_2015_trainable-claude-agentic: wu_n_bands=4, wu_n_outer=1, lr=0.002, epochs=6, batch_size=1, val_chunk=1, train_n=200, val_n=214, grad_clip=1.0, lambda_neg=1.0, weight_decay=0.0, loss_base=mse, seed=42, rationale=wu_2015_trainable iter-9 (search-20260619-01, corrected 214-slice/321px-FOV metric). LR-BASIN BISECTION iter (genuinely-untried single knob). SIX-BOX (NUMBERS). (1) TRAJECTORY iter->hr: 1(lr0.01,ep6,8params,335s)->0.0508, 2(ep18@lr0.01)->0.0337 (epochs INERT at the fast lr, hr FELL), 3(n_bands4->6)->0.0 (bands REGRESSED), 4(n_outer1->2)->0.0 (SSIM 0.6459 COLLAPSED), 5(train_n200->480,ep3)->0.0411 (data-coverage FAILED), 6(lr0.01->0.003,ep6)->0.0966 NEW BEST (SSIM 0.8232, PSNR 34.96, RMSE 8.93e-4, 334.8s, 8 params), 7(lr0.003->0.001,ep6)->0.0668 REGRESSED (SSIM 0.8022, lr0.001 UNDER-CONVERGED at ep6), 8(lr0.001,ep18)->0.0862 (SSIM 0.8275, 889s -- ep18 did NOT recover: lr0.001 cannot match lr0.003 EVEN given 3x the steps). Base copied = iter-6 (highest hr 0.0966). (2) LIMITER: the lr axis is a SINGLE-PEAK BASIN centered near lr0.003. hr vs lr now mapped at THREE points: lr0.01->0.0508, lr0.003->0.0966 (PEAK), lr0.001->0.0668(ep6)/0.0862(ep18). Both shoulders are LOWER than the 0.003 peak. iter-7/8 proved lr0.001 is genuinely worse (not just under-converged -- it stays below 0.0966 even at ep18). The 3.3x lr step from 0.003 to 0.001 OVERSHOT the peak; the interval (0.002, 0.003) between the mapped 0.003-best and the 0.001-shoulder has NEVER been sampled and is exactly where a finer optimum could sit on the high side of the peak. This is the campaign-flagged genuinely-untried in-budget knob -- it REFINES the ONLY lever that ever produced an above-noise gain (the lr basin, +0.046 hr at 0.01->0.003), unlike a blind weight_decay/seed probe. (3) ONE KNOB: lr 0.003 -> 0.002 (1.5x lower, bisecting the documented 0.003<->0.001 lr peak). I REVERT to the iter-6 BEST config (wu_n_bands=4, wu_n_outer=1, ep6, train_n=200) -- NOT the regressed iter-3/4 nor the failed iter-5/7/8 -- and change ONLY lr. ep6 held (iter-8 showed lr near the peak settles in 6 steps; the ep-budget question is closed). PARAM COUNT UNCHANGED at 8 (wu_n_bands+2+2*wu_n_outer = 4+2+2 = 8). (4) HYPOTHESIS: if the lr peak is finer than the 3.3x sampling resolved, lr0.002 (between the 0.003 peak and the 0.001 shoulder) lands AT or ABOVE the iter-6 best 0.0966 (a slightly-gentler step than the proven-best 0.003 may settle the 8 clamped scalars a touch better, or confirm 0.003 is already the apex). PREDICTED iter-9 hr ~0.095-0.105 (at/just-above the peak; the basin is shallow on the high side). NUMERIC FALSIFIER (terminal): if hr <= 0.0966 (at/below iter-6 best) at lr0.002, then the lr axis is FULLY MAPPED -- lr0.003 is the apex, both neighbors (0.01, 0.002, 0.001) are lower -- and with epochs inert/converged, bands regressed, outer-depth collapsed, and data-coverage failed, ALL in-budget single knobs are exhausted. File the terminal FBP-family ceiling verdict: wu_2015_trainable caps hr~0.097 on real-helical Mayo (band-reweighted FBP + soft-thresholded dense residual, NO image-domain learned CNN denoiser), far below the dual-domain U-Net families hr~0.27. (5) BUDGET (HARD 1200s/20-min train+score): IDENTICAL runtime envelope to iter-1/iter-6 (train_n=200, ep6, n_outer=1 = 335s in iter-6); lr is a FREE knob with ZERO runtime cost. Worst-case ~335s << 1200s and the 1800s SLURM kill; val FIGURE outside budget. val = ALL 214 L277 slices (do NOT reduce); grad_clip=1.0 (MANDATORY Mayo guard -- the 2304-view FBP adjoint overflows otherwise); bs=1 + val_chunk=1 forced by per-sample-ps; staged_canonical v3 mayo_ldct_fitted; per-sample-ps FBP + per-sample model.proj/model.dense_proj swap; bg_target=truth; 321px detector-geometry FOV default (NO fov override); wu_n_outer=1 (MANDATORY). (6) no control return.", "advice_for_others": "wu_2015_trainable-claude-agentic: wu_n_bands=4, wu_n_outer=1, lr=0.002, epochs=6, batch_size=1, val_chunk=1, train_n=200, val_n=214, grad_clip=1.0, lambda_neg=1.0, weight_decay=0.0, loss_base=mse, seed=42, rationale=wu_2015_trainable iter-9 (search-20260619-01, corrected 214-slice/321px-FOV metric). LR-BASIN BISECTION iter (genuinely-untried single knob). SIX-BOX (NUMBERS). (1) TRAJECTORY iter->hr: 1(lr0.01,ep6,8params,335s)->0.0508, 2(ep18@lr0.01)->0.0337 (epochs INERT at the fast lr, hr FELL), 3(n_bands4->6)->0.0 (bands REGRESSED), 4(n_outer1->2)->0.0 (SSIM 0.6459 COLLAPSED), 5(train_n200->480,ep3)->0.0411 (data-coverage FAILED), 6(lr0.01->0.003,ep6)->0.0966 NEW BEST (SSIM 0.8232, PSNR 34.96, RMSE 8.93e-4, 334.8s, 8 params), 7(lr0.003->0.001,ep6)->0.0668 REGRESSED (SSIM 0.8022, lr0.001 UNDER-CONVERGED at ep6), 8(lr0.001,ep18)->0.0862 (SSIM 0.8275, 889s -- ep18 did NOT recover: lr0.001 cannot match lr0.003 EVEN given 3x the steps). Base copied = iter-6 (highest hr 0.0966). (2) LIMITER: the lr axis is a SINGLE-PEAK BASIN centered near lr0.003. hr vs lr now mapped at THREE points: lr0.01->0.0508, lr0.003->0.0966 (PEAK), lr0.001->0.0668(ep6)/0.0862(ep18). Both shoulders are LOWER than the 0.003 peak. iter-7/8 proved lr0.001 is genuinely worse (not just under-converged -- it stays below 0.0966 even at ep18). The 3.3x lr step from 0.003 to 0.001 OVERSHOT the peak; the interval (0.002, 0.003) between the mapped 0.003-best and the 0.001-shoulder has NEVER been sampled and is exactly where a finer optimum could sit on the high side of the peak. This is the campaign-flagged genuinely-untried in-budget knob -- it REFINES the ONLY lever that ever produced an above-noise gain (the lr basin, +0.046 hr at 0.01->0.003), unlike a blind weight_decay/seed probe. (3) ONE KNOB: lr 0.003 -> 0.002 (1.5x lower, bisecting the documented 0.003<->0.001 lr peak). I REVERT to the iter-6 BEST config (wu_n_bands=4, wu_n_outer=1, ep6, train_n=200) -- NOT the regressed iter-3/4 nor the failed iter-5/7/8 -- and change ONLY lr. ep6 held (iter-8 showed lr near the peak settles in 6 steps; the ep-budget question is closed). PARAM COUNT UNCHANGED at 8 (wu_n_bands+2+2*wu_n_outer = 4+2+2 = 8). (4) HYPOTHESIS: if the lr peak is finer than the 3.3x sampling resolved, lr0.002 (between the 0.003 peak and the 0.001 shoulder) lands AT or ABOVE the iter-6 best 0.0966 (a slightly-gentler step than the proven-best 0.003 may settle the 8 clamped scalars a touch better, or confirm 0.003 is already the apex). PREDICTED iter-9 hr ~0.095-0.105 (at/just-above the peak; the basin is shallow on the high side). NUMERIC FALSIFIER (terminal): if hr <= 0.0966 (at/below iter-6 best) at lr0.002, then the lr axis is FULLY MAPPED -- lr0.003 is the apex, both neighbors (0.01, 0.002, 0.001) are lower -- and with epochs inert/converged, bands regressed, outer-depth collapsed, and data-coverage failed, ALL in-budget single knobs are exhausted. File the terminal FBP-family ceiling verdict: wu_2015_trainable caps hr~0.097 on real-helical Mayo (band-reweighted FBP + soft-thresholded dense residual, NO image-domain learned CNN denoiser), far below the dual-domain U-Net families hr~0.27. (5) BUDGET (HARD 1200s/20-min train+score): IDENTICAL runtime envelope to iter-1/iter-6 (train_n=200, ep6, n_outer=1 = 335s in iter-6); lr is a FREE knob with ZERO runtime cost. Worst-case ~335s << 1200s and the 1800s SLURM kill; val FIGURE outside budget. val = ALL 214 L277 slices (do NOT reduce); grad_clip=1.0 (MANDATORY Mayo guard -- the 2304-view FBP adjoint overflows otherwise); bs=1 + val_chunk=1 forced by per-sample-ps; staged_canonical v3 mayo_ldct_fitted; per-sample-ps FBP + per-sample model.proj/model.dense_proj swap; bg_target=truth; 321px detector-geometry FOV default (NO fov override); wu_n_outer=1 (MANDATORY). (6) no control return.", "comparison_image": "runs/mayo-ldct-claude-agentic-wu-2015-trainable-search-20260619-01/iterations/iter-0009/comparison.png"}
