{"ts": "2026-06-21T16:31:15Z", "run_id": "mayo-ldct-claude-agentic-uswin-search-20260619-01", "iter": 10, "agent": "uswin-claude-agentic", "model": "claude-opus-4-8-1m", "change_class": "architecture", "status": "keep", "kept": true, "val_score": 0.938247799873352, "headroom": 0.4207717414635014, "params_M": 3.954049, "train_n": 400, "rationale": "uswin-claude-agentic: train_n=579, val_n=214, epochs=22, batch_size=4, lr=0.0005, uswin_c=24, swin_window=8, swin_heads=4, grad_clip=1.0, max_train_s=960, seed=123, rationale=ITER-10 (search-20260619-01, corrected protocol). SEED NOISE-FLOOR READ. uswin #4 at hr 0.4150 @iter-7 (SSIM 0.9380). ONE KNOB: seed 42 -> 123; BASE_ITER=7; everything else IDENTICAL (train_n=579, val_n=214, epochs=22, bs=4, lr=5e-4, uswin_c=24, swin_window=8, swin_heads=4, grad_clip=1.0, max_train_s=960). SIX-BOX (NUMBERS). (1) TRAJECTORY iter-1 ep10/tn200 -> hr 0.1730; iter-2 ep40 -> 0.3221; iter-3 ep64 -> 0.3532; iter-4 c32/ep34 -> 0.2725 (capacity REGRESSED); iter-5 tn480/ep26 -> 0.3829; iter-6 tn579/ep21 -> 0.4098; iter-7 tn579/ep22 -> 0.414953 / SSIM 0.937998 / PSNR 38.734 in 1034.3s (BEST, #4 board); iter-8 ep23 -> 0.3999964 (epochs OVERSHOT); iter-9 lr 3e-4 -> 0.4102 (lr FLAT). best hr = 0.414953 @iter-7. CURRENT seed=42, STATIC across ALL 9 iters; swin_window=8 + swin_heads=4 also STATIC across ALL 9 iters. (2) LIMITER: every COMPUTE lever exhausted -- data MAXED (tn579 = full 579-slice pool, 100pct coverage), epochs PEAKED (ep22 best; ep23 OVERSHOT to 0.3999964), capacity REGRESSED (c32 -> 0.2725 @iter-4), lr FLAT (3e-4 -> 0.4102 @iter-9 did not beat 0.4150). The genuinely-untried in-budget axes are seed, swin_window, swin_heads -- all held static every iter. (3) ONE KNOB = seed 42->123, chosen over window/heads because seed is a FREE axis (zero compute cost, no budget-trade, keeps ep22/tn579 intact) and campaign precedent says a seed read is informative (dual_domain_supervised was seed-sensitive, +0.006); window/heads alter head_dim/capacity and are riskier capacity probes after c32 already regressed -- deferred unless this read shows instability. (4) HYPOTHESIS: uswin 0.4150 is a STABLE optimizer basin, not a lucky seed. Predicted iter-10 hr ~0.412-0.417 (within noise of 0.4150). NUMERIC FALSIFIER: hr within noise of 0.4150 (0.412-0.418) -> STABLE, ceiling confirmed ~0.415, uswin stays #4; hr > 0.418 -> SEED-SENSITIVE, iter-11+ runs a seed sweep. (5) BUDGET: ep22/tn579 measured 1034.3s (iter-7), 1028.1s (iter-9) -> ~166s margin inside the 1200s wall; seed change is compute-neutral (no per-epoch cost delta). val_n=214 = ALL L277 slices (NOT reduced); grad_clip=1.0 retained; max_train_s=960 backstop. HARD-WIRED (unchanged): staged_canonical v3 mayo_ldct_fitted geometry, per-sample-ps FBP, bg_target=truth, metric=321px detector-geometry FOV (no fov= override). (6) no control return.", "advice_for_others": "uswin-claude-agentic: train_n=579, val_n=214, epochs=22, batch_size=4, lr=0.0005, uswin_c=24, swin_window=8, swin_heads=4, grad_clip=1.0, max_train_s=960, seed=123, rationale=ITER-10 (search-20260619-01, corrected protocol). SEED NOISE-FLOOR READ. uswin #4 at hr 0.4150 @iter-7 (SSIM 0.9380). ONE KNOB: seed 42 -> 123; BASE_ITER=7; everything else IDENTICAL (train_n=579, val_n=214, epochs=22, bs=4, lr=5e-4, uswin_c=24, swin_window=8, swin_heads=4, grad_clip=1.0, max_train_s=960). SIX-BOX (NUMBERS). (1) TRAJECTORY iter-1 ep10/tn200 -> hr 0.1730; iter-2 ep40 -> 0.3221; iter-3 ep64 -> 0.3532; iter-4 c32/ep34 -> 0.2725 (capacity REGRESSED); iter-5 tn480/ep26 -> 0.3829; iter-6 tn579/ep21 -> 0.4098; iter-7 tn579/ep22 -> 0.414953 / SSIM 0.937998 / PSNR 38.734 in 1034.3s (BEST, #4 board); iter-8 ep23 -> 0.3999964 (epochs OVERSHOT); iter-9 lr 3e-4 -> 0.4102 (lr FLAT). best hr = 0.414953 @iter-7. CURRENT seed=42, STATIC across ALL 9 iters; swin_window=8 + swin_heads=4 also STATIC across ALL 9 iters. (2) LIMITER: every COMPUTE lever exhausted -- data MAXED (tn579 = full 579-slice pool, 100pct coverage), epochs PEAKED (ep22 best; ep23 OVERSHOT to 0.3999964), capacity REGRESSED (c32 -> 0.2725 @iter-4), lr FLAT (3e-4 -> 0.4102 @iter-9 did not beat 0.4150). The genuinely-untried in-budget axes are seed, swin_window, swin_heads -- all held static every iter. (3) ONE KNOB = seed 42->123, chosen over window/heads because seed is a FREE axis (zero compute cost, no budget-trade, keeps ep22/tn579 intact) and campaign precedent says a seed read is informative (dual_domain_supervised was seed-sensitive, +0.006); window/heads alter head_dim/capacity and are riskier capacity probes after c32 already regressed -- deferred unless this read shows instability. (4) HYPOTHESIS: uswin 0.4150 is a STABLE optimizer basin, not a lucky seed. Predicted iter-10 hr ~0.412-0.417 (within noise of 0.4150). NUMERIC FALSIFIER: hr within noise of 0.4150 (0.412-0.418) -> STABLE, ceiling confirmed ~0.415, uswin stays #4; hr > 0.418 -> SEED-SENSITIVE, iter-11+ runs a seed sweep. (5) BUDGET: ep22/tn579 measured 1034.3s (iter-7), 1028.1s (iter-9) -> ~166s margin inside the 1200s wall; seed change is compute-neutral (no per-epoch cost delta). val_n=214 = ALL L277 slices (NOT reduced); grad_clip=1.0 retained; max_train_s=960 backstop. HARD-WIRED (unchanged): staged_canonical v3 mayo_ldct_fitted geometry, per-sample-ps FBP, bg_target=truth, metric=321px detector-geometry FOV (no fov= override). (6) no control return.", "comparison_image": "runs/mayo-ldct-claude-agentic-uswin-search-20260619-01/iterations/iter-0010/comparison.png"}
{"ts": "2026-06-21T16:12:37Z", "run_id": "mayo-ldct-claude-agentic-itnet-search-20260619-01", "iter": 10, "agent": "itnet-claude-agentic", "model": "claude-opus-4-8-1m", "change_class": "architecture", "status": "keep", "kept": true, "val_score": 0.9458368420600891, "headroom": 0.4340768451775636, "params_M": 0.232881, "train_n": 400, "rationale": "itnet-claude-agentic: pretrain_epochs=80, pretrain_lr=0.0001, itnet_k=1, itnet_alpha=0.005, unet_c=16, finetune_epochs=0, finetune_lr=0.0001, train_n=579, val_n=214, grad_clip=1.0, seed=42, rationale=ITER-10 (search-20260619-01, corrected 214-slice/321px-FOV metric) for itnet = ItNet v1 (pretrain-denoiser-then-FIXED-DC k=1, solver_itnet.py). BOARD CHAMPION hr 0.4344 @iter-9. SIX-BOX (NUMBERS, not CT pixels). (1) TRAJECTORY (val=ALL 214 L277, 321px FOV; hr=metric of record): iter-6 itnet_k 3->1 BROKE THE FLOOR SSIM 0.9332/hr 0.3752 (tn200 ep200); iter-7 train_n 200->300 hr 0.3990 (ep125); iter-8 train_n 300->480 hr 0.4143 (ep80); iter-9 train_n 480->579 FULL POOL hr 0.4344 (SSIM 0.9447, ep66, 38214 grad steps, elapsed 980.4s). train_n is now MAXED at the full 579-slice train pool -> the data-coverage lever is EXHAUSTED (iters 6-9 deliberately held epochs at grad-step-parity to ISOLATE data coverage). (2) LIMITER: with data maxed, the remaining axis is DENOISER CONVERGENCE. itnet v1 main() trains ONLY the SmallUNet denoiser (params_M 0.2329) via pretrain_epochs on FBP->truth pairs, then a pure-inference k=1 DC unroll. iters 6-9 ran epochs in diminishing-returns / parity (ep200->125->80->66), so MORE convergence at the FULL 579 pool is UNTESTED on v1. (3) ONE KNOB: pretrain_epochs 66 -> 80 (+14 epochs = +8120 grad steps on the full pool), from BASE_ITER=9. KEEP itnet_k=1 (the breakthrough) and train_n=579 (MAXED). All else identical to iter-9 (itnet_alpha=0.005, unet_c=16, pretrain_lr=1e-4, val_n=214, grad_clip=1.0, seed=42). (4) HYPOTHESIS: more denoiser convergence on the full pool lifts hr ABOVE 0.4344 (the prior PURGED campaign found itnet v1 epochs DOMINANT with an ep104 peak), predict ~0.436-0.440. FALSIFIER (operative, NUMERIC): if hr <= 0.4344 at ep80/tn579/k=1, denoiser convergence SATURATES at the full pool -> 0.4344 is the v1 budget-constrained CEILING; document it toward iter-20 (next axis would be capacity unet_c or alpha, both flat on sibling itnet_v2 at full pool). Honest read: likely near-ceiling -- sibling itnet_v2 tried ep-up at full pool and it was flat/budget-capped. (5) BUDGET (HARD 20-min = 1200s train+score; sbatch 30-min wall is the only hard fence): iter-9 ACTUAL 980.4s @ ep66/tn579 (38214 grad steps). Marginal pretrain cost ~0.0208 s/grad-step + fixed ~185s (data load + 214-slice per-sample val + figure + startup). iter-10 ep80/tn579 = 46320 grad steps -> 0.0208*46320 = 963s + 185s fixed = ~1148s = 19.1 min, INSIDE the 1200s HARD wall with ~52s margin (and the marginal-cost model is conservative vs iter-9 blended 0.02565 s/gs). val stays ALL 214 L277 slices, 321px detector-geometry FOV (default; NO fov= override). grad_clip=1.0 retained (mandatory: the 2304-view Mayo FBP adjoint inside the DC step overflows otherwise). v1 has NO max_train_s backstop. (6) Loop continues -- no control returned. HARD-WIRED (unchanged): staged_canonical data, v3 mayo_ldct_fitted geometry, per-sample-ps (each val slice swaps itnet.projector to its own ps; chunk=1 FORCED), bg_target=truth, KEEP itnet_k=1, train_n=579, val=ALL 214 L277 slices under the 321px detector-geometry FOV (evaluate_calibrated default for AGENT4CT_DATASET=mayo_ldct_2d; NO fov= override).", "advice_for_others": "itnet-claude-agentic: pretrain_epochs=80, pretrain_lr=0.0001, itnet_k=1, itnet_alpha=0.005, unet_c=16, finetune_epochs=0, finetune_lr=0.0001, train_n=579, val_n=214, grad_clip=1.0, seed=42, rationale=ITER-10 (search-20260619-01, corrected 214-slice/321px-FOV metric) for itnet = ItNet v1 (pretrain-denoiser-then-FIXED-DC k=1, solver_itnet.py). BOARD CHAMPION hr 0.4344 @iter-9. SIX-BOX (NUMBERS, not CT pixels). (1) TRAJECTORY (val=ALL 214 L277, 321px FOV; hr=metric of record): iter-6 itnet_k 3->1 BROKE THE FLOOR SSIM 0.9332/hr 0.3752 (tn200 ep200); iter-7 train_n 200->300 hr 0.3990 (ep125); iter-8 train_n 300->480 hr 0.4143 (ep80); iter-9 train_n 480->579 FULL POOL hr 0.4344 (SSIM 0.9447, ep66, 38214 grad steps, elapsed 980.4s). train_n is now MAXED at the full 579-slice train pool -> the data-coverage lever is EXHAUSTED (iters 6-9 deliberately held epochs at grad-step-parity to ISOLATE data coverage). (2) LIMITER: with data maxed, the remaining axis is DENOISER CONVERGENCE. itnet v1 main() trains ONLY the SmallUNet denoiser (params_M 0.2329) via pretrain_epochs on FBP->truth pairs, then a pure-inference k=1 DC unroll. iters 6-9 ran epochs in diminishing-returns / parity (ep200->125->80->66), so MORE convergence at the FULL 579 pool is UNTESTED on v1. (3) ONE KNOB: pretrain_epochs 66 -> 80 (+14 epochs = +8120 grad steps on the full pool), from BASE_ITER=9. KEEP itnet_k=1 (the breakthrough) and train_n=579 (MAXED). All else identical to iter-9 (itnet_alpha=0.005, unet_c=16, pretrain_lr=1e-4, val_n=214, grad_clip=1.0, seed=42). (4) HYPOTHESIS: more denoiser convergence on the full pool lifts hr ABOVE 0.4344 (the prior PURGED campaign found itnet v1 epochs DOMINANT with an ep104 peak), predict ~0.436-0.440. FALSIFIER (operative, NUMERIC): if hr <= 0.4344 at ep80/tn579/k=1, denoiser convergence SATURATES at the full pool -> 0.4344 is the v1 budget-constrained CEILING; document it toward iter-20 (next axis would be capacity unet_c or alpha, both flat on sibling itnet_v2 at full pool). Honest read: likely near-ceiling -- sibling itnet_v2 tried ep-up at full pool and it was flat/budget-capped. (5) BUDGET (HARD 20-min = 1200s train+score; sbatch 30-min wall is the only hard fence): iter-9 ACTUAL 980.4s @ ep66/tn579 (38214 grad steps). Marginal pretrain cost ~0.0208 s/grad-step + fixed ~185s (data load + 214-slice per-sample val + figure + startup). iter-10 ep80/tn579 = 46320 grad steps -> 0.0208*46320 = 963s + 185s fixed = ~1148s = 19.1 min, INSIDE the 1200s HARD wall with ~52s margin (and the marginal-cost model is conservative vs iter-9 blended 0.02565 s/gs). val stays ALL 214 L277 slices, 321px detector-geometry FOV (default; NO fov= override). grad_clip=1.0 retained (mandatory: the 2304-view Mayo FBP adjoint inside the DC step overflows otherwise). v1 has NO max_train_s backstop. (6) Loop continues -- no control returned. HARD-WIRED (unchanged): staged_canonical data, v3 mayo_ldct_fitted geometry, per-sample-ps (each val slice swaps itnet.projector to its own ps; chunk=1 FORCED), bg_target=truth, KEEP itnet_k=1, train_n=579, val=ALL 214 L277 slices under the 321px detector-geometry FOV (evaluate_calibrated default for AGENT4CT_DATASET=mayo_ldct_2d; NO fov= override).", "comparison_image": "runs/mayo-ldct-claude-agentic-itnet-search-20260619-01/iterations/iter-0010/comparison.png"}
{"ts": "2026-06-21T15:54:37Z", "run_id": "mayo-ldct-claude-agentic-diff-recon-dcstep-constrained-mayo-v4-search-20260619-01", "iter": 9, "agent": "diffusion_recon_dcstep_constrained_mayo_v4-claude-agentic", "model": "claude-opus-4-8-1m", "change_class": "architecture", "status": "discard", "kept": false, "val_score": 0.838770866394043, "headroom": 0.0, "params_M": 8.594211, "train_n": 400, "rationale": "diffusion_recon_dcstep_constrained_mayo_v4-claude-agentic: recon_ckpt=/cluster/maier/Agent4CT/checkpoints/ddpm_mayo_constrained_v4.pt, recon_mode=dps, recon_sample_steps=80, recon_eta=1.0, recon_init=fbp, recon_eta_clamp=False, recon_dcstep_every=5, recon_dcstep_n_cg=3, recon_dcstep_warmup=5, recon_dcstep_relax=1.0, recon_dc_solver=cg, val_n=70, train_n=0, rationale=iter-9 search-20260619-01 CONSTRAINED diff-recon \u2014 UNTRIED AXIS at the iter-8 best: recon_eta 30.0->1.0 (DPS/guidance gain). ONE KNOB: recon_eta only; val_n held at 70 (>=~60 representative), recon_sample_steps held at iter-8 T=80, recon_dc_solver=cg held (landed A-fix), relax=1.0/every5/n_cg3/warmup5 held. BASE = iter-8 BEST (recon_dc_solver=cg, T=80, eta=30, relax=1.0, every5/n_cg3/warmup5, val_n=70, SSIM 0.8533/hr0 \u2014 run-best). TRAJECTORY (val=L277, 321px geometry FOV, LD-FBP floor ~0.81): iter-1 T=25 legacy eta=30 SSIM 0.3937/hr0; iter-2 eta30->1 ON THE LEGACY DC PATH (T=25) 0.2366 (regressed); iter-3 relax1.0->0.3 0.2377 (flat); iter-4 T25->28 0.4784; iter-5 T28->40 (val214->120) 0.6647; iter-6 DC legacy->cg A-fix 0.7873; iter-7 T40->60 (val120->90) 0.8396; iter-8 T60->80 (val90->70) 0.8533 (BEST). KEY SIGNAL: the NFE lever is DECELERATING (NFE deltas +0.085 / +0.186 / +0.052 / +0.0138 for steps 25->28->40->60->80) AND has hit its budget floor \u2014 a further NFE rung (T=100) would force val_n<60 (no longer representative), so NFE is EXHAUSTED at the val_n floor. eta was ONLY EVER tested at iter-2 under the BROKEN legacy DC path on a coarse T=25 schedule, where it regressed; it has NEVER been retested on the corrected CG-DC path at high-NFE. eta is the LAST UNTRIED AXIS at the iter-8 best. FAILURE-MODE FRAMING (numbers): the recon sits SSIM 0.8533 just past the ~0.81 FBP floor; with the deterministic CG-DC re-embed now correct (iter-6 A-fix), eta=30 may be over-driving the per-step DPS correction relative to the now-anchoring CG-DC term. eta=1.0 is the literature/demo/breast DPS default (Chung 2023 adaptive-norm gain). HYPOTHESIS: at the iter-8 best (T=80, CG-DC), dropping the DPS gain eta 30->1 lets the corrected CG-DC term anchor the iterate while the score model refines structure -> SSIM moves vs 0.8533 (untried interaction; eta x corrected-DC was never measured). NUMERIC FALSIFIER: if SSIM <= 0.8533 (flat/below iter-8) at eta=1.0, the eta axis is EXHAUSTED on the corrected path too -> the {eta, relax, NFE} lever set is FULLY EXPLORED and the constrained-v4 result is FAITHFUL-BUT-REGIME-BOUNDED (LD-FBP near-complete at 2304 views; payoff awaits the 128-view SPARSE benchmarks + planned EMA v5 prior); constrained best stays iter-8 (SSIM 0.8533, hr 0). hr expected ~0 regardless (regime-bounded on dense Mayo). PREDICTED iter-9: SSIM ~0.83-0.86, hr 0. BUDGET: eta is a FREE scalar (no per-slice cost change vs iter-8). Per-slice-per-step from the CG path = 0.1957 s (iter-8 1095.8s/80/70). T=80 x val_n=70 x 0.1957 = 1096 s = 18.3 min < the HARD 1200s/20-min wall (1800s in-solver backstop + 30-min --time further backstops). val_n=70 held (>=~60, representative), no NFE change so no budget pressure. val=70 evenly-spaced L277, 321px detector-geometry FOV default (no fov=False). staged_canonical data, v3 mayo_ldct_fitted geometry, per-sample-ps single-val-ps probe, bg_target=truth, reuse ddpm_mayo_constrained_v4.pt (NO retrain), recon_dc_solver=cg (landed A-fix), 321px FOV.", "advice_for_others": "diffusion_recon_dcstep_constrained_mayo_v4-claude-agentic: recon_ckpt=/cluster/maier/Agent4CT/checkpoints/ddpm_mayo_constrained_v4.pt, recon_mode=dps, recon_sample_steps=80, recon_eta=1.0, recon_init=fbp, recon_eta_clamp=False, recon_dcstep_every=5, recon_dcstep_n_cg=3, recon_dcstep_warmup=5, recon_dcstep_relax=1.0, recon_dc_solver=cg, val_n=70, train_n=0, rationale=iter-9 search-20260619-01 CONSTRAINED diff-recon \u2014 UNTRIED AXIS at the iter-8 best: recon_eta 30.0->1.0 (DPS/guidance gain). ONE KNOB: recon_eta only; val_n held at 70 (>=~60 representative), recon_sample_steps held at iter-8 T=80, recon_dc_solver=cg held (landed A-fix), relax=1.0/every5/n_cg3/warmup5 held. BASE = iter-8 BEST (recon_dc_solver=cg, T=80, eta=30, relax=1.0, every5/n_cg3/warmup5, val_n=70, SSIM 0.8533/hr0 \u2014 run-best). TRAJECTORY (val=L277, 321px geometry FOV, LD-FBP floor ~0.81): iter-1 T=25 legacy eta=30 SSIM 0.3937/hr0; iter-2 eta30->1 ON THE LEGACY DC PATH (T=25) 0.2366 (regressed); iter-3 relax1.0->0.3 0.2377 (flat); iter-4 T25->28 0.4784; iter-5 T28->40 (val214->120) 0.6647; iter-6 DC legacy->cg A-fix 0.7873; iter-7 T40->60 (val120->90) 0.8396; iter-8 T60->80 (val90->70) 0.8533 (BEST). KEY SIGNAL: the NFE lever is DECELERATING (NFE deltas +0.085 / +0.186 / +0.052 / +0.0138 for steps 25->28->40->60->80) AND has hit its budget floor \u2014 a further NFE rung (T=100) would force val_n<60 (no longer representative), so NFE is EXHAUSTED at the val_n floor. eta was ONLY EVER tested at iter-2 under the BROKEN legacy DC path on a coarse T=25 schedule, where it regressed; it has NEVER been retested on the corrected CG-DC path at high-NFE. eta is the LAST UNTRIED AXIS at the iter-8 best. FAILURE-MODE FRAMING (numbers): the recon sits SSIM 0.8533 just past the ~0.81 FBP floor; with the deterministic CG-DC re-embed now correct (iter-6 A-fix), eta=30 may be over-driving the per-step DPS correction relative to the now-anchoring CG-DC term. eta=1.0 is the literature/demo/breast DPS default (Chung 2023 adaptive-norm gain). HYPOTHESIS: at the iter-8 best (T=80, CG-DC), dropping the DPS gain eta 30->1 lets the corrected CG-DC term anchor the iterate while the score model refines structure -> SSIM moves vs 0.8533 (untried interaction; eta x corrected-DC was never measured). NUMERIC FALSIFIER: if SSIM <= 0.8533 (flat/below iter-8) at eta=1.0, the eta axis is EXHAUSTED on the corrected path too -> the {eta, relax, NFE} lever set is FULLY EXPLORED and the constrained-v4 result is FAITHFUL-BUT-REGIME-BOUNDED (LD-FBP near-complete at 2304 views; payoff awaits the 128-view SPARSE benchmarks + planned EMA v5 prior); constrained best stays iter-8 (SSIM 0.8533, hr 0). hr expected ~0 regardless (regime-bounded on dense Mayo). PREDICTED iter-9: SSIM ~0.83-0.86, hr 0. BUDGET: eta is a FREE scalar (no per-slice cost change vs iter-8). Per-slice-per-step from the CG path = 0.1957 s (iter-8 1095.8s/80/70). T=80 x val_n=70 x 0.1957 = 1096 s = 18.3 min < the HARD 1200s/20-min wall (1800s in-solver backstop + 30-min --time further backstops). val_n=70 held (>=~60, representative), no NFE change so no budget pressure. val=70 evenly-spaced L277, 321px detector-geometry FOV default (no fov=False). staged_canonical data, v3 mayo_ldct_fitted geometry, per-sample-ps single-val-ps probe, bg_target=truth, reuse ddpm_mayo_constrained_v4.pt (NO retrain), recon_dc_solver=cg (landed A-fix), 321px FOV.", "comparison_image": "runs/mayo-ldct-claude-agentic-diff-recon-dcstep-constrained-mayo-v4-search-20260619-01/iterations/iter-0009/comparison.png"}
