{"ts": "2026-06-20T16:49:03Z", "run_id": "mayo-ldct-claude-agentic-diff-recon-dcstep-constrained-mayo-v4-search-20260619-01", "iter": 6, "agent": "diffusion_recon_dcstep_constrained_mayo_v4-claude-agentic", "model": "claude-opus-4-8-1m", "change_class": "architecture", "status": "discard", "kept": false, "val_score": 0.7872974276542664, "headroom": 0.0, "params_M": 8.594211, "train_n": 400, "rationale": "diffusion_recon_dcstep_constrained_mayo_v4-claude-agentic: recon_ckpt=/cluster/maier/Agent4CT/checkpoints/ddpm_mayo_constrained_v4.pt, recon_mode=dps, recon_sample_steps=40, recon_eta=30.0, recon_init=fbp, recon_eta_clamp=False, recon_dcstep_every=5, recon_dcstep_n_cg=3, recon_dcstep_warmup=5, recon_dcstep_relax=1.0, recon_dc_solver=cg, val_n=120, train_n=0, rationale=iter-6 search-20260619-01 CONSTRAINED diff-recon \u2014 AUDIT CODE-FIX VALIDATION (user-directed 2026-06-20). ONE KNOB: recon_dc_solver legacy->cg (NEW config-gated correct DC path in solver_diffusion_recon.py; legacy path byte-for-byte preserved + reproducible for all prior cfgs). The audit found the legacy DC-step is (1) a MISLABELED steepest-descent dressed as CG (dc_step_cg lines ~83-100) and (2) a re-injection that recomputes x0 from a STALE eps via x0_from_eps(x,eps,ab_next) then re-noises with a FRESH randn mid-schedule (lines ~162-174) \u2014 this collapsed unconstrained iter-4 to SSIM 0.055 and kept the constrained variant stuck 0.24-0.66 << the ~0.81 LD-FBP floor at hr=0. THE FIX (ported from the corrected solver_fast_recon.cg_data_consistency): recon_dc_solver=cg swaps in a GENUINE Fletcher-Reeves CG solve of AtA x = At y (residual + conjugate direction + FR beta), forms x0 from the CURRENT step's eps (x0_hat at t_now, not a stale eps re-eval'd at the wrong alpha_bar), CG-projects it, then re-embeds at t_next DETERMINISTICALLY as sqrt(ab_next)*x0_proj_norm + sqrt(1-ab_next)*eps_pred reusing the SAME eps (eps-prediction => the level-t noise direction IS eps_pred) \u2014 NO fresh randn, NO stale eps. BASE = iter-5 BEST (T=40, eta=30, relax=1.0, every5/n_cg3/warmup5, val_n=120, SSIM 0.6647/hr0 \u2014 the run-best constrained config). Hard DC stays ON (recon_dcstep_every=5) now that it is CORRECT. HONEST EXPECTATION: the corrected CG-DC should STOP the legacy re-noise corruption and likely RAISE SSIM above iter-5's 0.6647 (the deterministic same-eps re-embed no longer overwrites the trajectory with fresh noise + a least-squares fit to the noisy 2304-view LD sinogram). But on DENSE rebinned Mayo (LD-FBP near-complete at 2304 views) the v4 DDPM prior is regime-bounded, so hr may STILL be ~0 \u2014 the real payoff is the 128-view SPARSE benchmarks + the planned EMA v5 prior. This iter VALIDATES the fix RUNS and is NON-REGRESSIVE/non-corrupting under the corrected metric. FALSIFIER: if SSIM drops below iter-5's 0.6647 the corrected re-embed is mis-scaling x0 vs eps; if it clears the ~0.81 FBP floor (hr>0) the legacy bug was the whole story. BUDGET: recon_dc_solver=cg is roughly cost-neutral vs legacy (the DPS forward+grad per step is unchanged; the CG inner loop does forward+back per n_cg, comparable to legacy dc_step_cg's forward+back+forward; the deterministic re-embed drops the randn). iter-5 ran T=40 x val_n=120 in 988.0 s = 16.5 min < the HARD 1200s/20-min budget (1800s in-solver backstop + 30-min --time). val_n=120 held at iter-5's value (no reduction needed \u2014 988s leaves ~3.5 min headroom for the CG path's marginal delta). val=120 evenly-spaced L277, 321px detector-geometry FOV default (no fov=False). staged_canonical data, v3 mayo_ldct_fitted geometry, per-sample-ps single-val-ps probe, bg_target=truth, reuse ddpm_mayo_constrained_v4.pt (NO retrain), 321px FOV.", "advice_for_others": "diffusion_recon_dcstep_constrained_mayo_v4-claude-agentic: recon_ckpt=/cluster/maier/Agent4CT/checkpoints/ddpm_mayo_constrained_v4.pt, recon_mode=dps, recon_sample_steps=40, recon_eta=30.0, recon_init=fbp, recon_eta_clamp=False, recon_dcstep_every=5, recon_dcstep_n_cg=3, recon_dcstep_warmup=5, recon_dcstep_relax=1.0, recon_dc_solver=cg, val_n=120, train_n=0, rationale=iter-6 search-20260619-01 CONSTRAINED diff-recon \u2014 AUDIT CODE-FIX VALIDATION (user-directed 2026-06-20). ONE KNOB: recon_dc_solver legacy->cg (NEW config-gated correct DC path in solver_diffusion_recon.py; legacy path byte-for-byte preserved + reproducible for all prior cfgs). The audit found the legacy DC-step is (1) a MISLABELED steepest-descent dressed as CG (dc_step_cg lines ~83-100) and (2) a re-injection that recomputes x0 from a STALE eps via x0_from_eps(x,eps,ab_next) then re-noises with a FRESH randn mid-schedule (lines ~162-174) \u2014 this collapsed unconstrained iter-4 to SSIM 0.055 and kept the constrained variant stuck 0.24-0.66 << the ~0.81 LD-FBP floor at hr=0. THE FIX (ported from the corrected solver_fast_recon.cg_data_consistency): recon_dc_solver=cg swaps in a GENUINE Fletcher-Reeves CG solve of AtA x = At y (residual + conjugate direction + FR beta), forms x0 from the CURRENT step's eps (x0_hat at t_now, not a stale eps re-eval'd at the wrong alpha_bar), CG-projects it, then re-embeds at t_next DETERMINISTICALLY as sqrt(ab_next)*x0_proj_norm + sqrt(1-ab_next)*eps_pred reusing the SAME eps (eps-prediction => the level-t noise direction IS eps_pred) \u2014 NO fresh randn, NO stale eps. BASE = iter-5 BEST (T=40, eta=30, relax=1.0, every5/n_cg3/warmup5, val_n=120, SSIM 0.6647/hr0 \u2014 the run-best constrained config). Hard DC stays ON (recon_dcstep_every=5) now that it is CORRECT. HONEST EXPECTATION: the corrected CG-DC should STOP the legacy re-noise corruption and likely RAISE SSIM above iter-5's 0.6647 (the deterministic same-eps re-embed no longer overwrites the trajectory with fresh noise + a least-squares fit to the noisy 2304-view LD sinogram). But on DENSE rebinned Mayo (LD-FBP near-complete at 2304 views) the v4 DDPM prior is regime-bounded, so hr may STILL be ~0 \u2014 the real payoff is the 128-view SPARSE benchmarks + the planned EMA v5 prior. This iter VALIDATES the fix RUNS and is NON-REGRESSIVE/non-corrupting under the corrected metric. FALSIFIER: if SSIM drops below iter-5's 0.6647 the corrected re-embed is mis-scaling x0 vs eps; if it clears the ~0.81 FBP floor (hr>0) the legacy bug was the whole story. BUDGET: recon_dc_solver=cg is roughly cost-neutral vs legacy (the DPS forward+grad per step is unchanged; the CG inner loop does forward+back per n_cg, comparable to legacy dc_step_cg's forward+back+forward; the deterministic re-embed drops the randn). iter-5 ran T=40 x val_n=120 in 988.0 s = 16.5 min < the HARD 1200s/20-min budget (1800s in-solver backstop + 30-min --time). val_n=120 held at iter-5's value (no reduction needed \u2014 988s leaves ~3.5 min headroom for the CG path's marginal delta). val=120 evenly-spaced L277, 321px detector-geometry FOV default (no fov=False). staged_canonical data, v3 mayo_ldct_fitted geometry, per-sample-ps single-val-ps probe, bg_target=truth, reuse ddpm_mayo_constrained_v4.pt (NO retrain), 321px FOV.", "comparison_image": "runs/mayo-ldct-claude-agentic-diff-recon-dcstep-constrained-mayo-v4-search-20260619-01/iterations/iter-0006/comparison.png"}
{"ts": "2026-06-20T14:31:37Z", "run_id": "mayo-ldct-claude-agentic-dual-domain-n2i-search-20260619-01", "iter": 6, "agent": "dual_domain_n2i-claude-agentic", "model": "claude-opus-4-8-1m", "change_class": "architecture", "status": "keep", "kept": true, "val_score": 0.9217326045036316, "headroom": 0.12071723908295184, "params_M": 0.465762, "train_n": 400, "rationale": "dual_domain_n2i-claude-agentic: warm_start=True, pretrain_epochs=4, n_iter=18, grad_clip=1.0, unet_c=16, lr=0.00015, batch_size=1, train_n=200, val_n=214, outer_wall_s=1080, per_scene_s=None, seed=42, rationale=dual_domain_n2i iter-6 (search-20260619-01, PER-IMAGE Noise2Inverse: warm-start pre-pass + per-scan Adam fit; NEVER amortized). SIX-BOX (NUMBERS, measured from iter-3/4/5 observations). (1) n_iter TRAJECTORY at anchored lr=3e-4, pretrain_epochs=4: iter-3 (n_iter=15) SSIM 0.9185, hr 0.1506, PSNR 35.50; iter-4 (n_iter=18) SSIM 0.9277, hr 0.19761 (BEST), PSNR 35.99, RMSE 7.934e-4, elapsed 1235.5s; iter-5 (n_iter=20, outer_wall 1150) SSIM 0.9169, hr 0.15949, PSNR 35.59, RMSE 8.310e-4 -- REGRESSED below iter-4. (2) LIMITER: hr is NOT monotone in n_iter -- it rose 15->18 then FELL 18->20. iter-5 falsifier TRIGGERED: n_iter past 18 OVERFITS each per-scan U-Net fit (PSNR fell 35.99->35.59, RMSE rose), exactly the confirmed campaign-wide insight that the per-scan U-Net N2I OVERFITS each scan and raising n_iter HURTS. n_iter is now MAPPED with an interior peak at 18. The confirmed correctly-signed lever for the overfit regime is per-scan lr-DOWN (anchor nearer the FBP-quality warm-start init): mayo-n2i 1e-3->3e-4 gave 0.9508->0.9541; lr has NEVER been pushed below 3e-4 in this campaign. (3) ONE KNOB: REVERT to iter-4 BEST (n_iter=18, the mapped peak) then drop per-scan lr 3e-4 -> 1.5e-4 (pretrain_epochs=4, n_iter=18, grad_clip=1.0, unet_c=16, val_n=214, seed=42, outer_wall_s=1080, warm_start=True ALL HELD at iter-4 -> iter-4 is the clean isolated comparison). n_iter NOT raised (at its mapped peak 18); warm_start stays True (settled-positive); unet_c stays 16 (settled-flat). lr-down is the one confirmed, correctly-signed, in-budget, untried-at-this-floor lever. (4) HYPOTHESIS: lr 3e-4->1.5e-4 at the n_iter=18 peak anchors each per-scan fit nearer the FBP-consistent warm-start init, reducing per-step overfit drift, lifting hr above iter-4 0.19761 (PSNR above 35.99). FALSIFIER: if hr <= 0.19761 (no PSNR gain over 35.99), lr=3e-4 is already at/below the per-scan lr floor and per-image U-Net N2I ceilings at hr~0.20 on dense 2304-view Mayo (half-view info loss bound) -> document the ceiling (NAF/ram structural-negative class), no further per-scan tuning. (5) BUDGET (HARD 20-min, val=ALL 214): lr does NOT change per-step cost; n_iter=18 == iter-4 (elapsed 1235.5s measured). Fit loop 214x18x0.2557=985s + overhead ~267s = ~1252s figure-inclusive, well under the 1800s/30-min SLURM wall. Per-scene 4.60s < per_scene_s=1080/214=5.05s -> NO truncation, outer_wall_s stays 1080 (iter-4 value, NOT iter-5 1150). grad_clip=1.0 mandatory (2304-view FBP adjoint overflows otherwise). val_n=214 NOT reduced (protocol). 321px detector-geometry FOV default (no fov=False). staged_canonical / v3 mayo_ldct_fitted / per-sample-ps / bg_target=truth hard-wired. PER-IMAGE structure UNCHANGED (warm-start pre-pass + per-scan fit; NEVER amortized). (6) no control return.", "advice_for_others": "dual_domain_n2i-claude-agentic: warm_start=True, pretrain_epochs=4, n_iter=18, grad_clip=1.0, unet_c=16, lr=0.00015, batch_size=1, train_n=200, val_n=214, outer_wall_s=1080, per_scene_s=None, seed=42, rationale=dual_domain_n2i iter-6 (search-20260619-01, PER-IMAGE Noise2Inverse: warm-start pre-pass + per-scan Adam fit; NEVER amortized). SIX-BOX (NUMBERS, measured from iter-3/4/5 observations). (1) n_iter TRAJECTORY at anchored lr=3e-4, pretrain_epochs=4: iter-3 (n_iter=15) SSIM 0.9185, hr 0.1506, PSNR 35.50; iter-4 (n_iter=18) SSIM 0.9277, hr 0.19761 (BEST), PSNR 35.99, RMSE 7.934e-4, elapsed 1235.5s; iter-5 (n_iter=20, outer_wall 1150) SSIM 0.9169, hr 0.15949, PSNR 35.59, RMSE 8.310e-4 -- REGRESSED below iter-4. (2) LIMITER: hr is NOT monotone in n_iter -- it rose 15->18 then FELL 18->20. iter-5 falsifier TRIGGERED: n_iter past 18 OVERFITS each per-scan U-Net fit (PSNR fell 35.99->35.59, RMSE rose), exactly the confirmed campaign-wide insight that the per-scan U-Net N2I OVERFITS each scan and raising n_iter HURTS. n_iter is now MAPPED with an interior peak at 18. The confirmed correctly-signed lever for the overfit regime is per-scan lr-DOWN (anchor nearer the FBP-quality warm-start init): mayo-n2i 1e-3->3e-4 gave 0.9508->0.9541; lr has NEVER been pushed below 3e-4 in this campaign. (3) ONE KNOB: REVERT to iter-4 BEST (n_iter=18, the mapped peak) then drop per-scan lr 3e-4 -> 1.5e-4 (pretrain_epochs=4, n_iter=18, grad_clip=1.0, unet_c=16, val_n=214, seed=42, outer_wall_s=1080, warm_start=True ALL HELD at iter-4 -> iter-4 is the clean isolated comparison). n_iter NOT raised (at its mapped peak 18); warm_start stays True (settled-positive); unet_c stays 16 (settled-flat). lr-down is the one confirmed, correctly-signed, in-budget, untried-at-this-floor lever. (4) HYPOTHESIS: lr 3e-4->1.5e-4 at the n_iter=18 peak anchors each per-scan fit nearer the FBP-consistent warm-start init, reducing per-step overfit drift, lifting hr above iter-4 0.19761 (PSNR above 35.99). FALSIFIER: if hr <= 0.19761 (no PSNR gain over 35.99), lr=3e-4 is already at/below the per-scan lr floor and per-image U-Net N2I ceilings at hr~0.20 on dense 2304-view Mayo (half-view info loss bound) -> document the ceiling (NAF/ram structural-negative class), no further per-scan tuning. (5) BUDGET (HARD 20-min, val=ALL 214): lr does NOT change per-step cost; n_iter=18 == iter-4 (elapsed 1235.5s measured). Fit loop 214x18x0.2557=985s + overhead ~267s = ~1252s figure-inclusive, well under the 1800s/30-min SLURM wall. Per-scene 4.60s < per_scene_s=1080/214=5.05s -> NO truncation, outer_wall_s stays 1080 (iter-4 value, NOT iter-5 1150). grad_clip=1.0 mandatory (2304-view FBP adjoint overflows otherwise). val_n=214 NOT reduced (protocol). 321px detector-geometry FOV default (no fov=False). staged_canonical / v3 mayo_ldct_fitted / per-sample-ps / bg_target=truth hard-wired. PER-IMAGE structure UNCHANGED (warm-start pre-pass + per-scan fit; NEVER amortized). (6) no control return.", "comparison_image": "runs/mayo-ldct-claude-agentic-dual-domain-n2i-search-20260619-01/iterations/iter-0006/comparison.png"}
{"ts": "2026-06-20T14:11:34Z", "run_id": "mayo-ldct-claude-agentic-uswin-search-20260619-01", "iter": 8, "agent": "uswin-claude-agentic", "model": "claude-opus-4-8-1m", "change_class": "architecture", "status": "keep", "kept": true, "val_score": 0.924580454826355, "headroom": 0.399964583460641, "params_M": 3.954049, "train_n": 400, "rationale": "uswin-claude-agentic: train_n=579, val_n=214, epochs=23, batch_size=4, lr=0.0005, uswin_c=24, swin_window=8, swin_heads=4, grad_clip=1.0, max_train_s=960, seed=42, rationale=ITER-8 (search-20260619-01, corrected protocol). RACE FINALE: uswin #2 at hr 0.4150 @iter-7, only 0.0008 behind champion dual_domain_supervised (0.4158). ONE KNOB: epochs 22 -> 23 on the FULL tn579 pool; BASE_ITER=7; everything else identical (train_n=579, val_n=214, bs=4, lr=5e-4, uswin_c=24, swin_window=8, swin_heads=4, grad_clip=1.0, seed=42). SIX-BOX (NUMBERS). (1) TRAJECTORY iter-6 ep21/tn579 -> SSIM 0.938728 / hr 0.409775 / PSNR 38.657 in 1029.5s; iter-7 ep22/tn579 -> SSIM 0.937998 / hr 0.414953 / PSNR 38.734 in 1034.3s (CURRENT BEST, #2 on the Mayo board). best hr = 0.414953 @iter-7. The epochs lever is STILL giving: +0.005178 hr on the single epoch ep21->22. (2) LIMITER: epochs NOT plateaued (last epoch added +0.0052) AND budget has room -- iter-7 used 1034.3s of the 1200s train+score wall = 166s headroom. Not wall-locked, not converged. The obvious move is one more epoch. (3) ONE KNOB = epochs 22->23; all else held. (4) HYPOTHESIS: one more epoch on the full pool lifts hr above 0.414953 toward/past dd_supervised 0.4158, because the epochs-on-full-data lever has not plateaued (+0.0052 on the last epoch). Predicted iter-8 hr ~0.418-0.420 (extrapolating the +0.0052/epoch slope sub-linearly as convergence nears). NUMERIC FALSIFIER: if hr <= 0.414953 at ep23/tn579, uswin has plateaued at ~0.415 and stays #2 behind dual_domain_supervised (0.4158). (5) BUDGET MATH: per-epoch at tn579 from the iter-5/iter-6 calibration = 0.07995 s/sample-epoch * 579 = 46.3 s/epoch, fixed ~157s. Anchored on the MEASURED iter-7 ep22 elapsed = 1034.3s, adding ONE epoch = 1034.3 + 46.3 = 1080.6s = 18.0 min (119s margin inside the 1200s wall). ep24 (1126.9s) would also likely fit but on a worst-case node the conservative model busts, so ep23 is the largest epoch count that fits with safe margin under node-speed variance. max_train_s=960 backstop so train halts <=960s leaving >=240s for the 214-slice val + figure inside the 1200s wall. HARD 20-min train+score budget; val_n=214 = ALL L277 slices (NOT reduced); grad_clip=1.0 retained (mandatory; the 2304-view Mayo FBP adjoint amplifies gradients). HARD-WIRED (unchanged): staged_canonical v3 mayo_ldct_fitted geometry, per-sample-ps FBP, bg_target=truth, metric=321px detector-geometry FOV (evaluate_calibrated default for AGENT4CT_DATASET=mayo_ldct_2d; no fov= override). (6) no control return.", "advice_for_others": "uswin-claude-agentic: train_n=579, val_n=214, epochs=23, batch_size=4, lr=0.0005, uswin_c=24, swin_window=8, swin_heads=4, grad_clip=1.0, max_train_s=960, seed=42, rationale=ITER-8 (search-20260619-01, corrected protocol). RACE FINALE: uswin #2 at hr 0.4150 @iter-7, only 0.0008 behind champion dual_domain_supervised (0.4158). ONE KNOB: epochs 22 -> 23 on the FULL tn579 pool; BASE_ITER=7; everything else identical (train_n=579, val_n=214, bs=4, lr=5e-4, uswin_c=24, swin_window=8, swin_heads=4, grad_clip=1.0, seed=42). SIX-BOX (NUMBERS). (1) TRAJECTORY iter-6 ep21/tn579 -> SSIM 0.938728 / hr 0.409775 / PSNR 38.657 in 1029.5s; iter-7 ep22/tn579 -> SSIM 0.937998 / hr 0.414953 / PSNR 38.734 in 1034.3s (CURRENT BEST, #2 on the Mayo board). best hr = 0.414953 @iter-7. The epochs lever is STILL giving: +0.005178 hr on the single epoch ep21->22. (2) LIMITER: epochs NOT plateaued (last epoch added +0.0052) AND budget has room -- iter-7 used 1034.3s of the 1200s train+score wall = 166s headroom. Not wall-locked, not converged. The obvious move is one more epoch. (3) ONE KNOB = epochs 22->23; all else held. (4) HYPOTHESIS: one more epoch on the full pool lifts hr above 0.414953 toward/past dd_supervised 0.4158, because the epochs-on-full-data lever has not plateaued (+0.0052 on the last epoch). Predicted iter-8 hr ~0.418-0.420 (extrapolating the +0.0052/epoch slope sub-linearly as convergence nears). NUMERIC FALSIFIER: if hr <= 0.414953 at ep23/tn579, uswin has plateaued at ~0.415 and stays #2 behind dual_domain_supervised (0.4158). (5) BUDGET MATH: per-epoch at tn579 from the iter-5/iter-6 calibration = 0.07995 s/sample-epoch * 579 = 46.3 s/epoch, fixed ~157s. Anchored on the MEASURED iter-7 ep22 elapsed = 1034.3s, adding ONE epoch = 1034.3 + 46.3 = 1080.6s = 18.0 min (119s margin inside the 1200s wall). ep24 (1126.9s) would also likely fit but on a worst-case node the conservative model busts, so ep23 is the largest epoch count that fits with safe margin under node-speed variance. max_train_s=960 backstop so train halts <=960s leaving >=240s for the 214-slice val + figure inside the 1200s wall. HARD 20-min train+score budget; val_n=214 = ALL L277 slices (NOT reduced); grad_clip=1.0 retained (mandatory; the 2304-view Mayo FBP adjoint amplifies gradients). HARD-WIRED (unchanged): staged_canonical v3 mayo_ldct_fitted geometry, per-sample-ps FBP, bg_target=truth, metric=321px detector-geometry FOV (evaluate_calibrated default for AGENT4CT_DATASET=mayo_ldct_2d; no fov= override). (6) no control return.", "comparison_image": "runs/mayo-ldct-claude-agentic-uswin-search-20260619-01/iterations/iter-0008/comparison.png"}
