{"ts": "2026-06-20T01:01:15Z", "run_id": "mayo-ldct-claude-agentic-tv-iterative-supervised-search-20260619-01", "iter": 3, "agent": "tv_iterative_supervised-claude-agentic", "model": "claude-opus-4-8-1m", "change_class": "architecture", "status": "discard", "kept": false, "val_score": 0.8137280941009521, "headroom": 0.0, "params_M": 6e-05, "train_n": 400, "rationale": "tv_iterative_supervised-claude-agentic: val_n=214, val_chunk=5, train_n=40, epochs=8, batch_size=1, lr=0.05, tv_K=30, tv_step_init=1e-08, tv_lambda_init=0.001, tv_share_steps=False, tv_clip_max=0.05, tv_eps=1e-06, lambda_neg=1.0, loss_base=mse, grad_clip=1.0, rationale=tv_iterative_supervised iter-3 (search-20260619-01, corrected 214-slice/321px-FOV metric). TRAINING-DIAGNOSIS iter, NOT a hyperparameter tune. PRIOR: iter-1 (K=10) SSIM 0.285541 hr 0.0 PSNR 1.87 elapsed 321.5s; iter-2 (K=30) SSIM 0.285541 hr 0.0 PSNR 1.87 elapsed 946s -- BYTE-IDENTICAL to every digit, comparison.png identical (289606 B). iter-2 deepened the unroll 10->30 and the result did NOT change AT ALL -> depth is FALSIFIED as the limiter. SLURM TRAINING LOG (jobs 765204 iter-1 / 765283 iter-2) shows the smoking gun: loss=0.001739 IDENTICAL across all 8 epochs, and the learnable step[k]=0.01, lambda[k]=0.001 PINNED at init for all 8 epochs -- the 20/60 scalars receive ZERO gradient and never move. FAILURE MODE (named): the supervised TV TRAINING is structurally frozen by a SATURATED-CLAMP gradient kill. Mechanism: data_grad = back_project(Rf - sino) is the RAW unfiltered adjoint of a 2304-view Mayo sinogram (sum-scaled, NO 1/N normalization). The classical tv_iterative sibling (SSIM 0.92) computes its gradient via AUTOGRAD on 0.5*mean(residual^2) -- a mean over 2304*736~1.7e6 elements -> per-element gradient ~1.7e6x SMALLER. tv_step_init=0.01 was inherited from the classical sibling's tv_lr but the supervised path's gradient is ~1.7e6x bigger, so f - 0.01*data_grad overshoots massively -> clamp(0,0.05) saturates the WHOLE image at K=1 -> the saturated clamp has derivative 0 everywhere -> no gradient reaches log_step/log_lambda -> scalars frozen, recon a near-constant clamped blob (PSNR 1.87, RMSE 0.0403) regardless of K. baseline LD-FBP PSNR=34.08 (Wagner-grade) confirms the data/projector are fine -- only the unrolled step scale is wrong. ONE CHANGE (un-stick training): tv_step_init 0.01 -> 1e-8 (operator-norm-matched: 0.01 / (2304*736) ~ 6e-9, rounded to 1e-8) so the unrolled iteration stays INSIDE the [0,0.05] clamp basin where the clamp is NOT saturated and gradients flow to the scalars. PAIRED ENABLER (not an independent knob -- with frozen gradients lr is inert): outer lr 5e-3 -> 5e-2 so the now-NONZERO scalar gradients move meaningfully across 8 epochs over the log-parametrised step/lambda. All else IDENTICAL to iter-2 (K=30, train_n=40, epochs=8, bs=1, tv_lambda_init=0.001, tv_clip_max=0.05, val_n=214 ALL L277, grad_clip=1.0). HYPOTHESIS: with the step un-saturated, training un-freezes -- loss DECREASES across epochs, step[k]/lambda[k] DEPART from init, and SSIM rises from 0.2855 toward (and ideally above) the LD-FBP floor (~0.81) / the classical TV ceiling (SSIM 0.92, hr 0.205); even landing near the FBP baseline clears the 0.2855 collapse and proves the harness is repairable. FALSIFIER (decisive): if SSIM stays ~0.286 (clamp still saturates) OR the scalars still don't move, the supervised-TV harness is STRUCTURALLY BROKEN on Mayo's 2304-view scale via the shared solver's unnormalized-adjoint step (which is FORBIDDEN to edit per the no-shared-module rule) -> file a NEGATIVE RESULT (supervised-TV-unrolled is not viable on real Mayo LDCT under the config-only contract) and STOP iterating this solver. BUDGET (HARD 20-min train+score): identical compute to iter-2 (K=30, same train/val sizes) -> ~946s, ~250s margin under the 1200s wall; sbatch --time=00:30:00 carries figure/IO headroom. Predicted iter trajectory: iter-1 0.2855 -> iter-2 0.2855 -> iter-3 either >0.81 (training un-froze, harness repaired) OR ~0.286 (structural -> negative result + STOP).", "advice_for_others": "tv_iterative_supervised-claude-agentic: val_n=214, val_chunk=5, train_n=40, epochs=8, batch_size=1, lr=0.05, tv_K=30, tv_step_init=1e-08, tv_lambda_init=0.001, tv_share_steps=False, tv_clip_max=0.05, tv_eps=1e-06, lambda_neg=1.0, loss_base=mse, grad_clip=1.0, rationale=tv_iterative_supervised iter-3 (search-20260619-01, corrected 214-slice/321px-FOV metric). TRAINING-DIAGNOSIS iter, NOT a hyperparameter tune. PRIOR: iter-1 (K=10) SSIM 0.285541 hr 0.0 PSNR 1.87 elapsed 321.5s; iter-2 (K=30) SSIM 0.285541 hr 0.0 PSNR 1.87 elapsed 946s -- BYTE-IDENTICAL to every digit, comparison.png identical (289606 B). iter-2 deepened the unroll 10->30 and the result did NOT change AT ALL -> depth is FALSIFIED as the limiter. SLURM TRAINING LOG (jobs 765204 iter-1 / 765283 iter-2) shows the smoking gun: loss=0.001739 IDENTICAL across all 8 epochs, and the learnable step[k]=0.01, lambda[k]=0.001 PINNED at init for all 8 epochs -- the 20/60 scalars receive ZERO gradient and never move. FAILURE MODE (named): the supervised TV TRAINING is structurally frozen by a SATURATED-CLAMP gradient kill. Mechanism: data_grad = back_project(Rf - sino) is the RAW unfiltered adjoint of a 2304-view Mayo sinogram (sum-scaled, NO 1/N normalization). The classical tv_iterative sibling (SSIM 0.92) computes its gradient via AUTOGRAD on 0.5*mean(residual^2) -- a mean over 2304*736~1.7e6 elements -> per-element gradient ~1.7e6x SMALLER. tv_step_init=0.01 was inherited from the classical sibling's tv_lr but the supervised path's gradient is ~1.7e6x bigger, so f - 0.01*data_grad overshoots massively -> clamp(0,0.05) saturates the WHOLE image at K=1 -> the saturated clamp has derivative 0 everywhere -> no gradient reaches log_step/log_lambda -> scalars frozen, recon a near-constant clamped blob (PSNR 1.87, RMSE 0.0403) regardless of K. baseline LD-FBP PSNR=34.08 (Wagner-grade) confirms the data/projector are fine -- only the unrolled step scale is wrong. ONE CHANGE (un-stick training): tv_step_init 0.01 -> 1e-8 (operator-norm-matched: 0.01 / (2304*736) ~ 6e-9, rounded to 1e-8) so the unrolled iteration stays INSIDE the [0,0.05] clamp basin where the clamp is NOT saturated and gradients flow to the scalars. PAIRED ENABLER (not an independent knob -- with frozen gradients lr is inert): outer lr 5e-3 -> 5e-2 so the now-NONZERO scalar gradients move meaningfully across 8 epochs over the log-parametrised step/lambda. All else IDENTICAL to iter-2 (K=30, train_n=40, epochs=8, bs=1, tv_lambda_init=0.001, tv_clip_max=0.05, val_n=214 ALL L277, grad_clip=1.0). HYPOTHESIS: with the step un-saturated, training un-freezes -- loss DECREASES across epochs, step[k]/lambda[k] DEPART from init, and SSIM rises from 0.2855 toward (and ideally above) the LD-FBP floor (~0.81) / the classical TV ceiling (SSIM 0.92, hr 0.205); even landing near the FBP baseline clears the 0.2855 collapse and proves the harness is repairable. FALSIFIER (decisive): if SSIM stays ~0.286 (clamp still saturates) OR the scalars still don't move, the supervised-TV harness is STRUCTURALLY BROKEN on Mayo's 2304-view scale via the shared solver's unnormalized-adjoint step (which is FORBIDDEN to edit per the no-shared-module rule) -> file a NEGATIVE RESULT (supervised-TV-unrolled is not viable on real Mayo LDCT under the config-only contract) and STOP iterating this solver. BUDGET (HARD 20-min train+score): identical compute to iter-2 (K=30, same train/val sizes) -> ~946s, ~250s margin under the 1200s wall; sbatch --time=00:30:00 carries figure/IO headroom. Predicted iter trajectory: iter-1 0.2855 -> iter-2 0.2855 -> iter-3 either >0.81 (training un-froze, harness repaired) OR ~0.286 (structural -> negative result + STOP).", "comparison_image": "runs/mayo-ldct-claude-agentic-tv-iterative-supervised-search-20260619-01/iterations/iter-0003/comparison.png"}
{"ts": "2026-06-20T00:56:46Z", "run_id": "mayo-ldct-claude-agentic-itnet-v2-search-20260619-01", "iter": 3, "agent": "itnet_v2-claude-agentic", "model": "claude-opus-4-8-1m", "change_class": "architecture", "status": "discard", "kept": false, "val_score": 0.623026967048645, "headroom": 0.0, "params_M": 0.232882, "train_n": 400, "rationale": "itnet_v2-claude-agentic: itnet_k=3, unet_c=16, itnet_alpha_init=0.0037, residual_learning=False, pretrain_lr=0.0001, pretrain_epochs=144, pretrain_patience=144, batch_size=1, val_chunk=1, train_n=200, val_n=214, grad_clip=1.0, max_train_s=1100, seed=42, rationale=ITER-3 (search-20260619-01, corrected 214-slice/321px-FOV metric). ONE KNOB: pretrain_epochs 48->144 (3x); pretrain_patience tracked 48->144 so early-stop never fires before the full run (same disable-early-stop intent as iter-1/iter-2 where patience==epochs). All else identical to iter-2 (k=3, unet_c=16, alpha_init=0.0037, residual_learning=False, pretrain_lr=1e-4, batch_size=1, val_chunk=1, train_n=200, val_n=214, grad_clip=1.0, seed=42); only max_train_s 960->1100 (18.3-min HARD backstop) to admit the longer pretrain inside the 20-min train+score budget while leaving the figure outside. SIX-BOX (NUMBERS): (1) iter-1 = SSIM 0.4554 / hr 0.000 @pretrain_epochs=12 in elapsed_s=170.2; iter-2 = SSIM 0.5888 / hr 0.000 @pretrain_epochs=48 in elapsed_s=345.2. Trajectory: 4x epochs (12->48) lifted SSIM +0.133, still hr=0 (FBP floor ~0.81, far above). v3 SIBLING (same ItNet family, END-TO-END unrolled, no pretrain-DC) reaches SSIM 0.91 -- the contrast that frames v2's limiter. Budget: iter-2 used only 345s of the 1200s (20-min) budget (~29%) -- large headroom remains; the variable (pretrain) part was ~233s, fixed (214-slice per-sample val + figure) ~112s. (2) LIMITER: pretrain-DC UNDER-CONVERGENCE -- and structurally deeper: reading solver_itnet_v2.py, the DC stage is NOT trained at all. pretrain_denoiser trains ONLY the SmallUNet on (fbp, truth) residual pairs; ItNetV2 is then built and itnet.eval() runs with NO fine-tune of the unrolled net -- log_alpha (the DC step size) is never optimized, so the k=3 DC refinement is a FIXED, untrained operator wrapped around a pretrained denoiser. That is why v2 caps far below the end-to-end v3 (0.91): more pretraining only sharpens the denoiser, it cannot fix the un-trained DC coupling. (3) ONE KNOB: pretrain_epochs 48->144 (3x) -- the most diagnostic single knob to MAP the pretrain-epochs response curve and definitively decide whether the cap is epochs or architecture. Chosen over a DC-stage knob (itnet_k / itnet_alpha_init) because the DC stage carries no trainable weight (changing k/alpha shifts a fixed operator, not a learnable one -- low diagnostic value), and over lr-up (v3 unstable above 1e-4; mirror the safe sibling move). With a fixed-DC architecture, pretrain_epochs is the ONLY lever that can lift the denoiser, so pushing it 3x is the cleanest test of the ceiling. (4) HYPOTHESIS + FALSIFIER: if pretrain_epochs 48->144 lands val_ssim still ~0.59-0.65 (NOT the ~0.91 v3 band), then itnet_v2's pretrain-then-FIXED-DC scheme is STRUCTURALLY CAPPED on Mayo regardless of epochs -- the un-trained DC operator, not under-training, is the limiter -- and the campaign should treat v2 as a documented budget/architecture ceiling and use v3 instead. CONVERSELY if SSIM jumps substantially toward the sibling band, the cap was pretrain-epochs and iter-4 keeps climbing. The diminishing 12->48 (+0.133) vs the still-large gap to 0.81/0.91 predicts the former (structural cap). (5) BUDGET: HARD 20-min train+score. Per-epoch ~4.86s over 200 stratified slices (from iter-1->iter-2 slope) -> 144 ep ~700s pretrain + ~112s fixed val+figure ~812s, comfortably under 1200s and the 30-min sbatch wall; max_train_s=1100 is the HARD backstop so train always leaves room for the 214-slice per-sample val + figure inside the wall. val_n=214 KEPT (NOT reduced), grad_clip=1.0 KEPT. (6) Loop continues -- no control returned. HARD-WIRED (unchanged): staged_canonical data, v3 mayo_ldct_fitted geometry, per-sample-ps (each slice swaps itnet.projector to its own ps; batch_size=1 + val_chunk=1 FORCED), bg_target=truth, val=ALL 214 L277 slices under the 321px detector-geometry FOV (evaluate_calibrated default for AGENT4CT_DATASET=mayo_ldct_2d; NO fov= override). residual_learning=False KEPT (the CONFIG default True double-applies the residual and collapses eval to ~0.34).", "advice_for_others": "itnet_v2-claude-agentic: itnet_k=3, unet_c=16, itnet_alpha_init=0.0037, residual_learning=False, pretrain_lr=0.0001, pretrain_epochs=144, pretrain_patience=144, batch_size=1, val_chunk=1, train_n=200, val_n=214, grad_clip=1.0, max_train_s=1100, seed=42, rationale=ITER-3 (search-20260619-01, corrected 214-slice/321px-FOV metric). ONE KNOB: pretrain_epochs 48->144 (3x); pretrain_patience tracked 48->144 so early-stop never fires before the full run (same disable-early-stop intent as iter-1/iter-2 where patience==epochs). All else identical to iter-2 (k=3, unet_c=16, alpha_init=0.0037, residual_learning=False, pretrain_lr=1e-4, batch_size=1, val_chunk=1, train_n=200, val_n=214, grad_clip=1.0, seed=42); only max_train_s 960->1100 (18.3-min HARD backstop) to admit the longer pretrain inside the 20-min train+score budget while leaving the figure outside. SIX-BOX (NUMBERS): (1) iter-1 = SSIM 0.4554 / hr 0.000 @pretrain_epochs=12 in elapsed_s=170.2; iter-2 = SSIM 0.5888 / hr 0.000 @pretrain_epochs=48 in elapsed_s=345.2. Trajectory: 4x epochs (12->48) lifted SSIM +0.133, still hr=0 (FBP floor ~0.81, far above). v3 SIBLING (same ItNet family, END-TO-END unrolled, no pretrain-DC) reaches SSIM 0.91 -- the contrast that frames v2's limiter. Budget: iter-2 used only 345s of the 1200s (20-min) budget (~29%) -- large headroom remains; the variable (pretrain) part was ~233s, fixed (214-slice per-sample val + figure) ~112s. (2) LIMITER: pretrain-DC UNDER-CONVERGENCE -- and structurally deeper: reading solver_itnet_v2.py, the DC stage is NOT trained at all. pretrain_denoiser trains ONLY the SmallUNet on (fbp, truth) residual pairs; ItNetV2 is then built and itnet.eval() runs with NO fine-tune of the unrolled net -- log_alpha (the DC step size) is never optimized, so the k=3 DC refinement is a FIXED, untrained operator wrapped around a pretrained denoiser. That is why v2 caps far below the end-to-end v3 (0.91): more pretraining only sharpens the denoiser, it cannot fix the un-trained DC coupling. (3) ONE KNOB: pretrain_epochs 48->144 (3x) -- the most diagnostic single knob to MAP the pretrain-epochs response curve and definitively decide whether the cap is epochs or architecture. Chosen over a DC-stage knob (itnet_k / itnet_alpha_init) because the DC stage carries no trainable weight (changing k/alpha shifts a fixed operator, not a learnable one -- low diagnostic value), and over lr-up (v3 unstable above 1e-4; mirror the safe sibling move). With a fixed-DC architecture, pretrain_epochs is the ONLY lever that can lift the denoiser, so pushing it 3x is the cleanest test of the ceiling. (4) HYPOTHESIS + FALSIFIER: if pretrain_epochs 48->144 lands val_ssim still ~0.59-0.65 (NOT the ~0.91 v3 band), then itnet_v2's pretrain-then-FIXED-DC scheme is STRUCTURALLY CAPPED on Mayo regardless of epochs -- the un-trained DC operator, not under-training, is the limiter -- and the campaign should treat v2 as a documented budget/architecture ceiling and use v3 instead. CONVERSELY if SSIM jumps substantially toward the sibling band, the cap was pretrain-epochs and iter-4 keeps climbing. The diminishing 12->48 (+0.133) vs the still-large gap to 0.81/0.91 predicts the former (structural cap). (5) BUDGET: HARD 20-min train+score. Per-epoch ~4.86s over 200 stratified slices (from iter-1->iter-2 slope) -> 144 ep ~700s pretrain + ~112s fixed val+figure ~812s, comfortably under 1200s and the 30-min sbatch wall; max_train_s=1100 is the HARD backstop so train always leaves room for the 214-slice per-sample val + figure inside the wall. val_n=214 KEPT (NOT reduced), grad_clip=1.0 KEPT. (6) Loop continues -- no control returned. HARD-WIRED (unchanged): staged_canonical data, v3 mayo_ldct_fitted geometry, per-sample-ps (each slice swaps itnet.projector to its own ps; batch_size=1 + val_chunk=1 FORCED), bg_target=truth, val=ALL 214 L277 slices under the 321px detector-geometry FOV (evaluate_calibrated default for AGENT4CT_DATASET=mayo_ldct_2d; NO fov= override). residual_learning=False KEPT (the CONFIG default True double-applies the residual and collapses eval to ~0.34).", "comparison_image": "runs/mayo-ldct-claude-agentic-itnet-v2-search-20260619-01/iterations/iter-0003/comparison.png"}
