{"ts": "2026-06-20T19:52:04Z", "run_id": "mayo-ldct-claude-agentic-hammernik-vn-search-20260619-01", "iter": 6, "agent": "hammernik_vn-claude-agentic", "model": "claude-opus-4-8-1m", "change_class": "architecture", "status": "discard", "kept": false, "val_score": 0.6672873497009277, "headroom": 0.0, "params_M": 0.019464, "train_n": 400, "rationale": "hammernik_vn-claude-agentic: vn_T=8, vn_n_filters=16, vn_kernel=11, vn_n_bumps=31, vn_x_range=1.0, vn_lambda_init=0.0023, vn_init=fbp, vn_dc_norm=True, vn_checkpoint=True, vn_normalize_filters=False, epochs=14, batch_size=2, lr=0.0005, grad_clip=1.0, train_n=200, val_n=214, max_train_s=1000, seed=42, rationale=hammernik_vn iter-6 (search-20260619-01, corrected 214-slice/321px-FOV metric). ONE KNOB (UNROLLED DEPTH, the last untested architectural axis): vn_T 5 -> 8. BASE = iter-1 BEST config (vn_n_filters=16, vn_lambda_init=0.0023, vn_normalize_filters=False, train_n=200; NOT the regressed iter-2/3/4 and NOT iter-5 train_n=480). TRAJECTORY (NUMBERS, all hr=0, ALL <= the ~0.84 LD-FBP floor, baseline_PSNR 34.08): iter-1 SSIM 0.80528 (N_k=16, lam=0.0023, vn_T=5, 1295.7s) <- prior BEST-structural; iter-2 SSIM 0.79195 (N_k 16->24 capacity^ REGRESSED -0.0133); iter-3 SSIM 0.768197 (vn_lambda_init 0.0023->0.05 DC^ REGRESSED -0.0238); iter-4 SSIM 0.73363 (vn_normalize_filters F->T REGRESSED -0.0346); iter-5 SSIM 0.80886 PSNR 32.45 RMSE 1.192e-3 (train_n 200->480 data-coverage -> +0.0036 vs iter-1, but still <0.84, hr 0) <- run-BEST. LIMITER = REGULARISER-DEGRADATION, not under-training: loss flat by ep3 EVERY iter (vs the SIBLING hammernik_2017 which WAS under-trained -- epochs^ cleared ITS floor to hr 0.0375 at iter-7; hammernik_vn has NO such epoch headroom, loss is already converged). The learned VN regulariser term Sum_i K_i^T rho_prime_i(K_i u) acts as a BLUNT SMOOTHER dragging the FBP init below baseline. Capacity (filters), DC-weight (lambda), filter-constraint, AND data-coverage (train_n) are now ALL exhausted -- each either regressed or barely moved. The ONE architectural axis untouched across all 5 iters is the UNROLLED DEPTH vn_T (held =5 every iter). MECHANISM: each unrolled step t applies u <- u - K^T rho_prime - lam*R^T(Ru-g)/dc_norm, i.e. an in-loop PYRO-NN projector data-consistency step. More steps (T 5->8) means the true-projector DC term re-anchors the recon to the MEASURED sinogram 8 times instead of 5 -- the only mechanism in this architecture that can COUNTERACT the per-step regulariser smoothing (the DC pull, applied more often, fights the blunt-smoother regulariser). HYPOTHESIS: with vn_T 5->8 the extra projector-DC re-anchoring lifts val_ssim above the run-best 0.80886 toward the ~0.84 FBP floor (hr>0). FALSIFIER (terminal): if val_ssim stays <= 0.81 (still <FBP, hr=0) even at deeper unrolling, hammernik_vn is CONFIRMED structurally FBP-bounded on rebinned 2304-view Mayo LDCT with ALL architectural axes exhausted (capacity, DC-weight, filter-constraint, data-coverage, AND depth) -> file the NEGATIVE RESULT and drive the remaining iters to DOCUMENT the ceiling toward iter-20, not chase it. BUDGET (HARD 20-min train+score; sbatch --time=00:30:00): vn_T 5->8 = 1.6x per-step DC+RBF cost. iter-1 ran ~7 ep/1000s at train_n=200,vn_T=5 (~143 s/ep) => at vn_T=8 ~229 s/ep => max_train_s=1000 trips at ~4.4 ep (>3, past the ep3 convergence point -> the converged comparison is fair). train_n REVERTED 480->200 (iter-5 coverage gain was a marginal +0.0036; at train_n=480+vn_T=8 the per-ep ~550s gives <2 ep -> would NOT converge). val_n=214 kept. Total ~= 1000 (train wall) + ~165 (score 214 + figure) ~= 1165s, under the 1800s SLURM kill (~635s margin). MEMORY-SAFE: vn_T=8 x N_k=16 but vn_checkpoint=true gradient-checkpoints each of the 8 unrolled steps (activation memory ~constant in T, NOT 8x) + batch_size=2 keep it within the 16 GB RTX5000 (cf. hammernik_2017 bs=4 OOM at 72s). grad_clip=1.0 + vn_dc_norm=true retained (VN-family NaN-skip stability; the 2304-view Mayo FBP adjoint overflows the backward, and a deeper unroll makes the clip MORE load-bearing).", "advice_for_others": "hammernik_vn-claude-agentic: vn_T=8, vn_n_filters=16, vn_kernel=11, vn_n_bumps=31, vn_x_range=1.0, vn_lambda_init=0.0023, vn_init=fbp, vn_dc_norm=True, vn_checkpoint=True, vn_normalize_filters=False, epochs=14, batch_size=2, lr=0.0005, grad_clip=1.0, train_n=200, val_n=214, max_train_s=1000, seed=42, rationale=hammernik_vn iter-6 (search-20260619-01, corrected 214-slice/321px-FOV metric). ONE KNOB (UNROLLED DEPTH, the last untested architectural axis): vn_T 5 -> 8. BASE = iter-1 BEST config (vn_n_filters=16, vn_lambda_init=0.0023, vn_normalize_filters=False, train_n=200; NOT the regressed iter-2/3/4 and NOT iter-5 train_n=480). TRAJECTORY (NUMBERS, all hr=0, ALL <= the ~0.84 LD-FBP floor, baseline_PSNR 34.08): iter-1 SSIM 0.80528 (N_k=16, lam=0.0023, vn_T=5, 1295.7s) <- prior BEST-structural; iter-2 SSIM 0.79195 (N_k 16->24 capacity^ REGRESSED -0.0133); iter-3 SSIM 0.768197 (vn_lambda_init 0.0023->0.05 DC^ REGRESSED -0.0238); iter-4 SSIM 0.73363 (vn_normalize_filters F->T REGRESSED -0.0346); iter-5 SSIM 0.80886 PSNR 32.45 RMSE 1.192e-3 (train_n 200->480 data-coverage -> +0.0036 vs iter-1, but still <0.84, hr 0) <- run-BEST. LIMITER = REGULARISER-DEGRADATION, not under-training: loss flat by ep3 EVERY iter (vs the SIBLING hammernik_2017 which WAS under-trained -- epochs^ cleared ITS floor to hr 0.0375 at iter-7; hammernik_vn has NO such epoch headroom, loss is already converged). The learned VN regulariser term Sum_i K_i^T rho_prime_i(K_i u) acts as a BLUNT SMOOTHER dragging the FBP init below baseline. Capacity (filters), DC-weight (lambda), filter-constraint, AND data-coverage (train_n) are now ALL exhausted -- each either regressed or barely moved. The ONE architectural axis untouched across all 5 iters is the UNROLLED DEPTH vn_T (held =5 every iter). MECHANISM: each unrolled step t applies u <- u - K^T rho_prime - lam*R^T(Ru-g)/dc_norm, i.e. an in-loop PYRO-NN projector data-consistency step. More steps (T 5->8) means the true-projector DC term re-anchors the recon to the MEASURED sinogram 8 times instead of 5 -- the only mechanism in this architecture that can COUNTERACT the per-step regulariser smoothing (the DC pull, applied more often, fights the blunt-smoother regulariser). HYPOTHESIS: with vn_T 5->8 the extra projector-DC re-anchoring lifts val_ssim above the run-best 0.80886 toward the ~0.84 FBP floor (hr>0). FALSIFIER (terminal): if val_ssim stays <= 0.81 (still <FBP, hr=0) even at deeper unrolling, hammernik_vn is CONFIRMED structurally FBP-bounded on rebinned 2304-view Mayo LDCT with ALL architectural axes exhausted (capacity, DC-weight, filter-constraint, data-coverage, AND depth) -> file the NEGATIVE RESULT and drive the remaining iters to DOCUMENT the ceiling toward iter-20, not chase it. BUDGET (HARD 20-min train+score; sbatch --time=00:30:00): vn_T 5->8 = 1.6x per-step DC+RBF cost. iter-1 ran ~7 ep/1000s at train_n=200,vn_T=5 (~143 s/ep) => at vn_T=8 ~229 s/ep => max_train_s=1000 trips at ~4.4 ep (>3, past the ep3 convergence point -> the converged comparison is fair). train_n REVERTED 480->200 (iter-5 coverage gain was a marginal +0.0036; at train_n=480+vn_T=8 the per-ep ~550s gives <2 ep -> would NOT converge). val_n=214 kept. Total ~= 1000 (train wall) + ~165 (score 214 + figure) ~= 1165s, under the 1800s SLURM kill (~635s margin). MEMORY-SAFE: vn_T=8 x N_k=16 but vn_checkpoint=true gradient-checkpoints each of the 8 unrolled steps (activation memory ~constant in T, NOT 8x) + batch_size=2 keep it within the 16 GB RTX5000 (cf. hammernik_2017 bs=4 OOM at 72s). grad_clip=1.0 + vn_dc_norm=true retained (VN-family NaN-skip stability; the 2304-view Mayo FBP adjoint overflows the backward, and a deeper unroll makes the clip MORE load-bearing).", "comparison_image": "runs/mayo-ldct-claude-agentic-hammernik-vn-search-20260619-01/iterations/iter-0006/comparison.png"}
{"ts": "2026-06-20T19:50:16Z", "run_id": "mayo-ldct-claude-agentic-wu-2015-trainable-search-20260619-01", "iter": 6, "agent": "wu_2015_trainable-claude-agentic", "model": "claude-opus-4-8-1m", "change_class": "architecture", "status": "keep", "kept": true, "val_score": 0.8232346177101135, "headroom": 0.09657953703471489, "params_M": 8e-06, "train_n": 400, "rationale": "wu_2015_trainable-claude-agentic: wu_n_bands=4, wu_n_outer=1, lr=0.003, epochs=6, batch_size=1, val_chunk=1, train_n=200, val_n=214, grad_clip=1.0, lambda_neg=1.0, weight_decay=0.0, loss_base=mse, seed=42, rationale=wu_2015_trainable iter-6 (search-20260619-01, corrected 214-slice/321px-FOV metric). OPTIMIZER-BASIN / TERMINAL-LEVER iter. SIX-BOX (NUMBERS). (1) PRIOR TRAJECTORY iter->hr: 1->0.0508 (BEST: wu_n_bands=4, wu_n_outer=1, lr0.01, ep6, train_n=200, SSIM 0.8370, 335s, 8 params), 2(ep18)->0.0337 (epochs INERT, hr FELL), 3(n_bands 4->6)->0.0 (SSIM 0.8273, bands REGRESSED), 4(n_outer 1->2)->0.0 (SSIM 0.6459 COLLAPSED), 5(train_n 200->480, ep3)->0.0411 (SSIM 0.8384, data-coverage FAILED: hr 0.0411 <= 0.051 falsifier, did NOT clear iter-1 best). Base copied = iter-1 (highest hr). (2) LIMITER: few-param tuned-FBP ceiling ~hr0.05. Wu-trainable = band-reweighted aliasing-free FBP + soft-thresholded dense residual, NO image-domain learned CNN denoiser; sits just above LD-FBP floor, far below dual-domain U-Net families (hr~0.27). FOUR axes falsified: epochs inert, bands regressed, outer-depth collapsed, data-coverage failed. (3) ONE KNOB: optimizer lr 0.01 -> 0.003 (3.3x lower). The default lr=0.01 was NEVER probed and the SLURM log shows it saturates band_scale to its 0.1-3.0 clamp + drives loss to 0 by ep1 -- the 8 clamped scalars may be slamming into a poor basin. I REVERT to the iter-1 BEST config (wu_n_bands=4, wu_n_outer=1, ep6, train_n=200) -- NOT the regressed iter-3/4 nor the failed iter-5 -- and change ONLY lr. This is the SOLE optimization-axis lever left orthogonal to the falsified capacity/data axes; cross-solver precedent that lr is load-bearing for few-param FBP-family denoisers: breast-CT Step-3 TPE found wu_2015_trainable hr0.3170 at 10x-LOWER lr than the agentic centroid (solver_plan.md Step-2 STOP note). PARAM COUNT UNCHANGED at 8 (wu_n_bands+2+2*wu_n_outer = 4+2+2 = 8). (4) HYPOTHESIS: if the hr-0.05 ceiling is an lr/optimization-basin artifact (default lr0.01 saturates the clamped scalars too fast), a gentler lr0.003 settles them in a better basin and lifts hr above the iter-1 best 0.0508 (SSIM > 0.842, >+0.005 over the +-0.001 noise band). TERMINAL FALSIFIER: if hr <= 0.051 at lr0.003, then epochs+bands+outer-depth+data-coverage AND optimizer-lr are ALL exhausted -- Wu-trainable is STRUCTURALLY FBP-ceilinged on Mayo (no image-domain learned denoiser), caps hr~0.05 on real-helical Mayo far below the dual-domain U-Net families hr~0.27. File the terminal verdict. (5) BUDGET (HARD 1200s/20-min train+score): IDENTICAL runtime envelope to iter-1 (train_n=200, ep6, n_outer=1 = 335s in iter-1); lr is a free knob with ZERO runtime cost. Worst-case ~335s << 1200s and the 1800s SLURM kill; val FIGURE outside budget. val = ALL 214 L277 slices (do NOT reduce); grad_clip=1.0 (MANDATORY Mayo guard -- the 2304-view FBP adjoint overflows otherwise); bs=1 + val_chunk=1 forced by per-sample-ps; staged_canonical v3 mayo_ldct_fitted; per-sample-ps FBP + per-sample model.proj/model.dense_proj swap; bg_target=truth; 321px detector-geometry FOV default (NO fov override); wu_n_outer=1 (MANDATORY). (6) no control return.", "advice_for_others": "wu_2015_trainable-claude-agentic: wu_n_bands=4, wu_n_outer=1, lr=0.003, epochs=6, batch_size=1, val_chunk=1, train_n=200, val_n=214, grad_clip=1.0, lambda_neg=1.0, weight_decay=0.0, loss_base=mse, seed=42, rationale=wu_2015_trainable iter-6 (search-20260619-01, corrected 214-slice/321px-FOV metric). OPTIMIZER-BASIN / TERMINAL-LEVER iter. SIX-BOX (NUMBERS). (1) PRIOR TRAJECTORY iter->hr: 1->0.0508 (BEST: wu_n_bands=4, wu_n_outer=1, lr0.01, ep6, train_n=200, SSIM 0.8370, 335s, 8 params), 2(ep18)->0.0337 (epochs INERT, hr FELL), 3(n_bands 4->6)->0.0 (SSIM 0.8273, bands REGRESSED), 4(n_outer 1->2)->0.0 (SSIM 0.6459 COLLAPSED), 5(train_n 200->480, ep3)->0.0411 (SSIM 0.8384, data-coverage FAILED: hr 0.0411 <= 0.051 falsifier, did NOT clear iter-1 best). Base copied = iter-1 (highest hr). (2) LIMITER: few-param tuned-FBP ceiling ~hr0.05. Wu-trainable = band-reweighted aliasing-free FBP + soft-thresholded dense residual, NO image-domain learned CNN denoiser; sits just above LD-FBP floor, far below dual-domain U-Net families (hr~0.27). FOUR axes falsified: epochs inert, bands regressed, outer-depth collapsed, data-coverage failed. (3) ONE KNOB: optimizer lr 0.01 -> 0.003 (3.3x lower). The default lr=0.01 was NEVER probed and the SLURM log shows it saturates band_scale to its 0.1-3.0 clamp + drives loss to 0 by ep1 -- the 8 clamped scalars may be slamming into a poor basin. I REVERT to the iter-1 BEST config (wu_n_bands=4, wu_n_outer=1, ep6, train_n=200) -- NOT the regressed iter-3/4 nor the failed iter-5 -- and change ONLY lr. This is the SOLE optimization-axis lever left orthogonal to the falsified capacity/data axes; cross-solver precedent that lr is load-bearing for few-param FBP-family denoisers: breast-CT Step-3 TPE found wu_2015_trainable hr0.3170 at 10x-LOWER lr than the agentic centroid (solver_plan.md Step-2 STOP note). PARAM COUNT UNCHANGED at 8 (wu_n_bands+2+2*wu_n_outer = 4+2+2 = 8). (4) HYPOTHESIS: if the hr-0.05 ceiling is an lr/optimization-basin artifact (default lr0.01 saturates the clamped scalars too fast), a gentler lr0.003 settles them in a better basin and lifts hr above the iter-1 best 0.0508 (SSIM > 0.842, >+0.005 over the +-0.001 noise band). TERMINAL FALSIFIER: if hr <= 0.051 at lr0.003, then epochs+bands+outer-depth+data-coverage AND optimizer-lr are ALL exhausted -- Wu-trainable is STRUCTURALLY FBP-ceilinged on Mayo (no image-domain learned denoiser), caps hr~0.05 on real-helical Mayo far below the dual-domain U-Net families hr~0.27. File the terminal verdict. (5) BUDGET (HARD 1200s/20-min train+score): IDENTICAL runtime envelope to iter-1 (train_n=200, ep6, n_outer=1 = 335s in iter-1); lr is a free knob with ZERO runtime cost. Worst-case ~335s << 1200s and the 1800s SLURM kill; val FIGURE outside budget. val = ALL 214 L277 slices (do NOT reduce); grad_clip=1.0 (MANDATORY Mayo guard -- the 2304-view FBP adjoint overflows otherwise); bs=1 + val_chunk=1 forced by per-sample-ps; staged_canonical v3 mayo_ldct_fitted; per-sample-ps FBP + per-sample model.proj/model.dense_proj swap; bg_target=truth; 321px detector-geometry FOV default (NO fov override); wu_n_outer=1 (MANDATORY). (6) no control return.", "comparison_image": "runs/mayo-ldct-claude-agentic-wu-2015-trainable-search-20260619-01/iterations/iter-0006/comparison.png"}
