{"ts": "2026-06-20T06:07:03Z", "run_id": "mayo-ldct-claude-agentic-diff-recon-dcstep-unconstrained-mayo-v4-search-20260619-01", "iter": 4, "agent": "diffusion_recon_dcstep_unconstrained_mayo_v4-claude-agentic", "model": "claude-opus-4-8-1m", "change_class": "architecture", "status": "discard", "kept": false, "val_score": 0.05530863255262375, "headroom": 0.0, "params_M": 8.594211, "train_n": 400, "rationale": "diffusion_recon_dcstep_unconstrained_mayo_v4-claude-agentic: recon_ckpt=/cluster/maier/Agent4CT/checkpoints/ddpm_mayo_unconstrained_v4.pt, recon_mode=dps, recon_sample_steps=25, recon_eta=5.0, recon_init=fbp, recon_eta_clamp=False, recon_dcstep_every=5, recon_dcstep_n_cg=2, recon_dcstep_warmup=5, recon_dcstep_relax=1.0, val_n=214, train_n=0, rationale=iter-4 search-20260619-01 CONFIRMATION iter UNCONSTRAINED diff-recon vs reused Mayo DDPM v4 ckpt (ddpm_mayo_unconstrained_v4.pt). ONE KNOB: recon_dcstep_every 0 -> 5 (turn ON the hard-CG data-consistency projection inside the otherwise-soft DPS reverse path -- the LAST UNTRIED lever). recon_dcstep_n_cg 3 -> 2 and recon_sample_steps 32 -> 25 are BUDGET-FORCED, not free choices: enabling hard-DC adds n_cg*(2 fwd + 1 back) projector calls per triggered step, so I must shrink the base trajectory to keep the 20-min wall (see BUDGET below); n_steps=25 is exactly the iter-2 base where eta=5 was already well-behaved, so the soft sub-path is held at its settled point and the every:0->5 flip is the only mechanistic change. recon_eta=5.0, recon_init=fbp, recon_eta_clamp=false, recon_dcstep_relax=1.0 (FULL hard projection), recon_dcstep_warmup=5 all UNCHANGED. TRAJECTORY (corrected 214-slice / 321px-FOV metric): iter-1 (n_steps=25, eta=30, every=0) SSIM 0.3688 hr=0 PSNR 10.55 868.65s; iter-2 (25, eta=5, every=0) SSIM 0.3960 hr=0 PSNR 11.25 868.33s -- BEST SO FAR; iter-3 (32, eta=5, every=0) SSIM 0.3869 hr=0 PSNR 11.08 1103.8s -- longer DDIM trajectory did NOT help (slightly DOWN). All three sit in the 0.37-0.40 band, FAR below the LD-FBP floor 0.8078 and even below the FBP init. The two soft levers -- DPS guidance gain (eta 30->5) and trajectory length (n_steps 25->32) -- are now EXHAUSTED and FLAT, and the constrained sibling (eta 30->1 + hard-CG every=5) REGRESSED 0.39->0.24, so neither soft guidance nor capacity is the issue. FAILURE MODE (the hypothesis under final test): the recon is dominated by a Mayo v4 DDPM PRIOR that is STRUCTURALLY MISMATCHED to the rebinned-Mayo distribution -- globally faithful (plausible CT texture) but NOT conditionally faithful to the input sino under DPS, exactly the breast-DDPM hr=0 structural verdict (4x-16x capacity + 2.5x training all stayed in 0.3-0.5 SSIM). recon_dcstep_every is the LAST untried mechanism that could falsify this: a Resample-style FULL hard-CG projection (relax=1.0) onto the measurement manifold is a STRONGER fidelity backstop than the soft DPS gradient -- it directly minimizes ||A x_mu - y||^2 by n_cg Gauss-Newton steps every 5 reverse steps, re-noising back to t_next. If the prior were merely under-guided, hard-DC would pull the recon decisively toward the sino and clear (or approach) the FBP floor; if the prior is structurally mismatched, the re-noise step injects the mismatched prior right back and the recon stays in the 0.37-0.42 band regardless. BUDGET MATH (HARD 20-min = 1200s wall, val=ALL 214 L277 slices): calibrated linear cost from the two measured points (iter-2 25-step every=0 = 4.058 s/slice; iter-3 32-step every=0 = 5.158 s/slice) gives per-step a=0.1572 s/step/slice + fixed offset b=0.127 s/slice, so one projector call ~ a/3 = 0.0524 s/call/slice. At n_steps=25, warmup=5, every=5 the DC-step triggers at k=5,10,15,20 (4 triggers, t_next>0), each adding n_cg=2 * (2 fwd + 1 back) = 6 projector calls = 6*0.0524 = 0.314 s/slice/trigger -> +1.26 s/slice total. Per-slice = 4.06 + 1.26 = 5.32 s -> 214 * 5.32 = 1137 s = 19.0 min < 1200 s wall (~63 s headroom, MORE in practice since the fixed offset b does not scale with DC). n_cg=3 (1272s=21.2min) or n_steps=28 (1306s) or every=4 (1205s) all BLOW the wall, so n_steps=25 / every=5 / n_cg=2 is the LARGEST hard-DC dose that fits -- the right budget-feasible probe. SIX-BOX PREDICTION: SSIM <= 0.42, hr = 0 (the structural-prior-mismatch hypothesis). FALSIFIER: if SSIM CLEARS the 0.8078 LD-FBP floor (or moves decisively toward it, say >0.6), the Mayo v4 DDPM prior was NOT structurally mismatched -- it was fidelity-starved, and hard-DC is the fix; redirect future iters to tuning the hard-DC dose (relax/n_cg/every). If SSIM STAYS in the 0.37-0.42 band (FBP floor uncleared even with full hard-CG fidelity), FILE THE DIFFUSION-PRIOR-MISMATCH VERDICT: the lever is the prior CLASS, not any sampler/fidelity hyperparameter (mirrors the breast-DDPM hr=0 decision), STOP iterating diffusion-recon on Mayo, and the BEST run stays iter-2 (SSIM 0.396, hr 0). val=ALL 214 L277 slices, 321px detector-geometry FOV (default -- not passing fov=False).", "advice_for_others": "diffusion_recon_dcstep_unconstrained_mayo_v4-claude-agentic: recon_ckpt=/cluster/maier/Agent4CT/checkpoints/ddpm_mayo_unconstrained_v4.pt, recon_mode=dps, recon_sample_steps=25, recon_eta=5.0, recon_init=fbp, recon_eta_clamp=False, recon_dcstep_every=5, recon_dcstep_n_cg=2, recon_dcstep_warmup=5, recon_dcstep_relax=1.0, val_n=214, train_n=0, rationale=iter-4 search-20260619-01 CONFIRMATION iter UNCONSTRAINED diff-recon vs reused Mayo DDPM v4 ckpt (ddpm_mayo_unconstrained_v4.pt). ONE KNOB: recon_dcstep_every 0 -> 5 (turn ON the hard-CG data-consistency projection inside the otherwise-soft DPS reverse path -- the LAST UNTRIED lever). recon_dcstep_n_cg 3 -> 2 and recon_sample_steps 32 -> 25 are BUDGET-FORCED, not free choices: enabling hard-DC adds n_cg*(2 fwd + 1 back) projector calls per triggered step, so I must shrink the base trajectory to keep the 20-min wall (see BUDGET below); n_steps=25 is exactly the iter-2 base where eta=5 was already well-behaved, so the soft sub-path is held at its settled point and the every:0->5 flip is the only mechanistic change. recon_eta=5.0, recon_init=fbp, recon_eta_clamp=false, recon_dcstep_relax=1.0 (FULL hard projection), recon_dcstep_warmup=5 all UNCHANGED. TRAJECTORY (corrected 214-slice / 321px-FOV metric): iter-1 (n_steps=25, eta=30, every=0) SSIM 0.3688 hr=0 PSNR 10.55 868.65s; iter-2 (25, eta=5, every=0) SSIM 0.3960 hr=0 PSNR 11.25 868.33s -- BEST SO FAR; iter-3 (32, eta=5, every=0) SSIM 0.3869 hr=0 PSNR 11.08 1103.8s -- longer DDIM trajectory did NOT help (slightly DOWN). All three sit in the 0.37-0.40 band, FAR below the LD-FBP floor 0.8078 and even below the FBP init. The two soft levers -- DPS guidance gain (eta 30->5) and trajectory length (n_steps 25->32) -- are now EXHAUSTED and FLAT, and the constrained sibling (eta 30->1 + hard-CG every=5) REGRESSED 0.39->0.24, so neither soft guidance nor capacity is the issue. FAILURE MODE (the hypothesis under final test): the recon is dominated by a Mayo v4 DDPM PRIOR that is STRUCTURALLY MISMATCHED to the rebinned-Mayo distribution -- globally faithful (plausible CT texture) but NOT conditionally faithful to the input sino under DPS, exactly the breast-DDPM hr=0 structural verdict (4x-16x capacity + 2.5x training all stayed in 0.3-0.5 SSIM). recon_dcstep_every is the LAST untried mechanism that could falsify this: a Resample-style FULL hard-CG projection (relax=1.0) onto the measurement manifold is a STRONGER fidelity backstop than the soft DPS gradient -- it directly minimizes ||A x_mu - y||^2 by n_cg Gauss-Newton steps every 5 reverse steps, re-noising back to t_next. If the prior were merely under-guided, hard-DC would pull the recon decisively toward the sino and clear (or approach) the FBP floor; if the prior is structurally mismatched, the re-noise step injects the mismatched prior right back and the recon stays in the 0.37-0.42 band regardless. BUDGET MATH (HARD 20-min = 1200s wall, val=ALL 214 L277 slices): calibrated linear cost from the two measured points (iter-2 25-step every=0 = 4.058 s/slice; iter-3 32-step every=0 = 5.158 s/slice) gives per-step a=0.1572 s/step/slice + fixed offset b=0.127 s/slice, so one projector call ~ a/3 = 0.0524 s/call/slice. At n_steps=25, warmup=5, every=5 the DC-step triggers at k=5,10,15,20 (4 triggers, t_next>0), each adding n_cg=2 * (2 fwd + 1 back) = 6 projector calls = 6*0.0524 = 0.314 s/slice/trigger -> +1.26 s/slice total. Per-slice = 4.06 + 1.26 = 5.32 s -> 214 * 5.32 = 1137 s = 19.0 min < 1200 s wall (~63 s headroom, MORE in practice since the fixed offset b does not scale with DC). n_cg=3 (1272s=21.2min) or n_steps=28 (1306s) or every=4 (1205s) all BLOW the wall, so n_steps=25 / every=5 / n_cg=2 is the LARGEST hard-DC dose that fits -- the right budget-feasible probe. SIX-BOX PREDICTION: SSIM <= 0.42, hr = 0 (the structural-prior-mismatch hypothesis). FALSIFIER: if SSIM CLEARS the 0.8078 LD-FBP floor (or moves decisively toward it, say >0.6), the Mayo v4 DDPM prior was NOT structurally mismatched -- it was fidelity-starved, and hard-DC is the fix; redirect future iters to tuning the hard-DC dose (relax/n_cg/every). If SSIM STAYS in the 0.37-0.42 band (FBP floor uncleared even with full hard-CG fidelity), FILE THE DIFFUSION-PRIOR-MISMATCH VERDICT: the lever is the prior CLASS, not any sampler/fidelity hyperparameter (mirrors the breast-DDPM hr=0 decision), STOP iterating diffusion-recon on Mayo, and the BEST run stays iter-2 (SSIM 0.396, hr 0). val=ALL 214 L277 slices, 321px detector-geometry FOV (default -- not passing fov=False).", "comparison_image": "runs/mayo-ldct-claude-agentic-diff-recon-dcstep-unconstrained-mayo-v4-search-20260619-01/iterations/iter-0004/comparison.png"}
{"ts": "2026-06-20T06:06:10Z", "run_id": "mayo-ldct-claude-agentic-tv-iterative-search-20260619-01", "iter": 5, "agent": "tv_iterative-claude-agentic", "model": "claude-opus-4-8-1m", "change_class": "architecture", "status": "keep", "kept": true, "val_score": 0.92607182264328, "headroom": 0.18728585091591432, "params_M": 0.0, "train_n": 400, "rationale": "tv_iterative-claude-agentic: val_n=214, train_n=0, tv_lambda=0.001, tv_iterations=120, tv_lr=0.02, tv_clip_max=0.08, tv_decay=0.01, tv_optimizer=gd, tv_init=fbp, rationale=tv_iterative iter-5 (search-20260619-01, corrected 214-slice/321px-FOV metric). BASE = the BEST config family (clip 0.08, lambda 0.001) at the BUDGET-PROVEN tv_iterations=120 (NOT iter-4's 160 -- see BUDGET below). ONE KNOB: tv_lr 0.01->0.02 (all else IDENTICAL to the iter-2 BEST: tv_lambda=0.001, tv_iterations=120, tv_clip_max=0.08, tv_decay=0.01, gd, fbp-init, val_n=214). TRAJECTORY (NUMBERS): iter-1 SSIM 0.922979 hr 0.132941 RMSE 8.573e-4 (clip 0.05, 120 iters, 918s); iter-2 SSIM 0.923844 hr 0.205364 RMSE 7.857e-4 (clip 0.05->0.08, 120 iters, 928.5s) = the BEST, #4 overall on Mayo; iter-3 SSIM 0.919984 hr 0.136636 RMSE 8.536e-4 (lambda 0.001->0.003, 120 iters, 923.9s) REGRESSED (lambda-up exhausted); iter-4 SSIM 0.926664 hr 0.208547 RMSE 7.825e-4 (tv_iterations 120->160, 1227.4s). KEY RECONCILIATION OF THE PLANNED 160->200 KNOB: iter-4's measured elapsed_s was 1227.4s -- already OVER the 1200s HARD 20-min budget at 160 iters -- and 160 iters lifted hr only +0.0031 over the 120-iter iter-2 (0.205364->0.208547), within noise. So tv_iterations 160->200 is INFEASIBLE (cost model fit on the real iter-2/iter-4 pair: c_step=7.47 s/TV-iter, overhead=31.8s => n=200 lands ~1526s = ~25 min, a ~27% overshoot of the wall -> the 214-slice val pass would be killed / the metric invalidated) AND wrong-headed (the iterations lever is already flattening AND budget-capped). FAILURE MODE OBSERVED: the iterations lever has plateaued (120->160 gave +0.003 hr for +33% compute that blew the wall) -- the recon is NOT meaningfully iterations-limited at the cost the budget allows. iter-4's OWN falsifier named the next probe: 'tv_lr (finer convergence per step)'. HYPOTHESIS: doubling the step size (tv_lr 0.01->0.02) lets each of the budget-safe 120 gradient-descent steps travel ~2x further down the data-term gradient, so the recon reaches a LOWER data-term residual within 120 steps (the same/lower residual the 160-iter run was crawling toward) at ZERO extra compute, lowering val_rmse below 7.825e-4 so hr rises above iter-4's 0.208547 -- the RMSE-sensitive calibrated-headroom metric credits the lower residual. Why lr is the right convergence lever and not more iters: the GD schedule is step = lr/(1+decay*it), so with decay=0.01 the per-step distance shrinks ~2.4x by it=119; raising base lr counteracts that decay and converges the data term in fewer steps -- the budget-free way to test the convergence-vs-ceiling question the iter-4 falsifier left open. FALSIFIER: if hr <= 0.208547 (no gain, or a regression from GD overshoot/oscillation at the larger step), then (a) if hr drops sharply the step is too big and GD overshoots the TV-regularized minimum, and (b) if hr is merely flat then TV is at its REGULARIZATION CEILING on real Mayo LDCT (~0.924 SSIM / ~0.21 hr): 120 iters at lr=0.01 was already converged, the +0.003 from 160 iters was just residual noise, and BOTH the iterations lever (plateaued + budget-capped) AND the step-size lever are exhausted -- accept ~0.21 hr as the structural classical-TV ceiling on this real LDCT substrate and STOP tuning convergence knobs. BUDGET: tv_lr is a ZERO marginal-compute knob -- tv_iterations stays at the budget-proven 120 -> identical ~928s wall (cost model: 31.8 + 120*7.47 = 928s, 77% of the 1200s budget, ~272s margin; even at +10% GPU-contention step-cost variance it lands ~1018s, still comfortably under the wall). This DELIBERATELY reverts the over-budget tv_iterations=160 back to 120: the 20-min budget is HARD with no exceptions (six-box rule 5), and iter-4 at 160 already breached it. val = ALL 214 L277 slices unchanged (do NOT reduce). sbatch --time=00:30:00 gives a SLURM-level safety net above the 20-min metric-validity budget.", "advice_for_others": "tv_iterative-claude-agentic: val_n=214, train_n=0, tv_lambda=0.001, tv_iterations=120, tv_lr=0.02, tv_clip_max=0.08, tv_decay=0.01, tv_optimizer=gd, tv_init=fbp, rationale=tv_iterative iter-5 (search-20260619-01, corrected 214-slice/321px-FOV metric). BASE = the BEST config family (clip 0.08, lambda 0.001) at the BUDGET-PROVEN tv_iterations=120 (NOT iter-4's 160 -- see BUDGET below). ONE KNOB: tv_lr 0.01->0.02 (all else IDENTICAL to the iter-2 BEST: tv_lambda=0.001, tv_iterations=120, tv_clip_max=0.08, tv_decay=0.01, gd, fbp-init, val_n=214). TRAJECTORY (NUMBERS): iter-1 SSIM 0.922979 hr 0.132941 RMSE 8.573e-4 (clip 0.05, 120 iters, 918s); iter-2 SSIM 0.923844 hr 0.205364 RMSE 7.857e-4 (clip 0.05->0.08, 120 iters, 928.5s) = the BEST, #4 overall on Mayo; iter-3 SSIM 0.919984 hr 0.136636 RMSE 8.536e-4 (lambda 0.001->0.003, 120 iters, 923.9s) REGRESSED (lambda-up exhausted); iter-4 SSIM 0.926664 hr 0.208547 RMSE 7.825e-4 (tv_iterations 120->160, 1227.4s). KEY RECONCILIATION OF THE PLANNED 160->200 KNOB: iter-4's measured elapsed_s was 1227.4s -- already OVER the 1200s HARD 20-min budget at 160 iters -- and 160 iters lifted hr only +0.0031 over the 120-iter iter-2 (0.205364->0.208547), within noise. So tv_iterations 160->200 is INFEASIBLE (cost model fit on the real iter-2/iter-4 pair: c_step=7.47 s/TV-iter, overhead=31.8s => n=200 lands ~1526s = ~25 min, a ~27% overshoot of the wall -> the 214-slice val pass would be killed / the metric invalidated) AND wrong-headed (the iterations lever is already flattening AND budget-capped). FAILURE MODE OBSERVED: the iterations lever has plateaued (120->160 gave +0.003 hr for +33% compute that blew the wall) -- the recon is NOT meaningfully iterations-limited at the cost the budget allows. iter-4's OWN falsifier named the next probe: 'tv_lr (finer convergence per step)'. HYPOTHESIS: doubling the step size (tv_lr 0.01->0.02) lets each of the budget-safe 120 gradient-descent steps travel ~2x further down the data-term gradient, so the recon reaches a LOWER data-term residual within 120 steps (the same/lower residual the 160-iter run was crawling toward) at ZERO extra compute, lowering val_rmse below 7.825e-4 so hr rises above iter-4's 0.208547 -- the RMSE-sensitive calibrated-headroom metric credits the lower residual. Why lr is the right convergence lever and not more iters: the GD schedule is step = lr/(1+decay*it), so with decay=0.01 the per-step distance shrinks ~2.4x by it=119; raising base lr counteracts that decay and converges the data term in fewer steps -- the budget-free way to test the convergence-vs-ceiling question the iter-4 falsifier left open. FALSIFIER: if hr <= 0.208547 (no gain, or a regression from GD overshoot/oscillation at the larger step), then (a) if hr drops sharply the step is too big and GD overshoots the TV-regularized minimum, and (b) if hr is merely flat then TV is at its REGULARIZATION CEILING on real Mayo LDCT (~0.924 SSIM / ~0.21 hr): 120 iters at lr=0.01 was already converged, the +0.003 from 160 iters was just residual noise, and BOTH the iterations lever (plateaued + budget-capped) AND the step-size lever are exhausted -- accept ~0.21 hr as the structural classical-TV ceiling on this real LDCT substrate and STOP tuning convergence knobs. BUDGET: tv_lr is a ZERO marginal-compute knob -- tv_iterations stays at the budget-proven 120 -> identical ~928s wall (cost model: 31.8 + 120*7.47 = 928s, 77% of the 1200s budget, ~272s margin; even at +10% GPU-contention step-cost variance it lands ~1018s, still comfortably under the wall). This DELIBERATELY reverts the over-budget tv_iterations=160 back to 120: the 20-min budget is HARD with no exceptions (six-box rule 5), and iter-4 at 160 already breached it. val = ALL 214 L277 slices unchanged (do NOT reduce). sbatch --time=00:30:00 gives a SLURM-level safety net above the 20-min metric-validity budget.", "comparison_image": "runs/mayo-ldct-claude-agentic-tv-iterative-search-20260619-01/iterations/iter-0005/comparison.png"}
