{"ts": "2026-06-21T18:17:39Z", "run_id": "mayo-ldct-claude-agentic-naf-search-20260619-01", "iter": 10, "agent": "naf-claude-agentic", "model": "claude-opus-4-8-1m", "change_class": "architecture", "status": "discard", "kept": false, "val_score": 0.6956678032875061, "headroom": 0.0, "params_M": 33.557601, "train_n": 400, "rationale": "naf-claude-agentic: val_n=214, naf_encoding=hash, naf_hash_levels=16, naf_hash_feat_dim=4, naf_hash_log2_size=19, naf_hash_base_res=16, naf_hash_max_res=512, naf_n_freqs=8, naf_hidden=32, naf_layers=3, naf_n_iter=3000, naf_lr=0.02, naf_tv_weight=0.0001, naf_n_clip=0.05, naf_outer_wall_s=1080, naf_per_scene_s=5.0, seed=42, rationale=ITER-10 (search-20260619-01, naf). SIX-BOX (NUMBERS, not CT pixels). (1) SSIM TRAJECTORY + hash params (all hr=0): iter-1 fourier hidden=128 layers=4 lr=1e-2 -> 0.4729. iter-2 hidden 128->64 -> 0.4943. iter-3 layers 4->3 -> 0.5452. iter-4 lr 1e-2->2e-2 -> 0.5629 = BEST FOURIER. iter-5 lr 2e-2->4e-2 -> 0.3592 REGRESSED. iter-6 audit-fix encoding fourier->hash (Instant-NGP 16-level grid, feat_dim=2, log2=19, base=16, max=512 -> 32-dim feat -> MLP hidden=32 layers=3 lr=2e-2) -> 0.6715 NEW BEST. iter-7 hidden 32->64 -> 0.6346 FLAT = MLP-WIDTH EXHAUSTED. iter-8 hash_feat_dim 2->4 (16x4=64-dim feat) -> 0.6951 NEW BEST (+0.0236, params 33.56M, elapsed 1098.4s). iter-9 hash_levels 16->24 -> 0.6803 FLAT/REGRESSED = HASH CAPACITY SATURATED. MAPPED: MLP-width (exhausted), feat_dim (2->4 lift), hash_levels (16->24 saturated). (2) LIMITER: NAF is REGIME-BOUNDED on DENSE 2304-view Mayo (LD-FBP near-complete -> hr stays 0; the audit hash-fix makes the impl FAITHFUL, real payoff is the 128-view SPARSE benchmarks). For SSIM within budget the binding limiter is HASH CAPACITY, now SATURATED: feat_dim lifted (iter-8) then levels did NOT (iter-9). (3) ONE KNOB: NONE -- there is no untried in-budget hash/MLP lever left (width exhausted, feat_dim lifted, levels saturated; the more-steps/wall B-lever is DEFERRED post-TPE). This is the HONEST CLEAN CONFIRMATION: re-dispatch the iter-8 BEST cfg (naf_encoding=hash, hash_feat_dim=4, hash_levels=16, hidden=32, layers=3, lr=2e-2, log2=19, base=16, max=512; step count / wall UNCHANGED) to document the regime-bounded hash-NAF ceiling toward iter-20. (4) HYPOTHESIS: re-running the iter-8 BEST cfg reproduces SSIM ~= 0.6951 (deterministic seed=42, per-scene wall-governed). NUMERIC FALSIFIER: if SSIM differs materially from 0.6951 (e.g. |dSSIM| > ~0.01), there is per-scene wall/scheduling DRIFT (step-count nondeterminism under the 5.0s wall) -- flag and investigate; otherwise the ~0.70 hash-NAF ceiling (well below LD-FBP ~0.81 cal floor, hr 0) is CONFIRMED, a STRUCTURAL NEGATIVE on dense 2304-view Mayo, regime-bounded (payoff = 128-view SPARSE benchmarks). (5) SIZE to HARD 1200s budget: 214-scene pass, naf_outer_wall_s=1080 (18-min in-solver outer wall = governor) + naf_per_scene_s=5.0 (per-scene wall; n_iter cap 3000 UNCHANGED so WALL governs). STEP COUNT / WALL UNTOUCHED (deferred B-fix NOT touched). 214x5.0s=1070s ~= 1080s outer wall (measured elapsed 1098.4s at iter-8, inside the 30-min sbatch kill). val_n=214 (ALL L277 slices), staged_canonical v3 mayo_ldct_fitted geometry, per-sample-ps probe (L277 native ps ~0.73979), bg_target=truth, 321px detector-geometry FOV default (no fov= override), naf_encoding=hash kept. (6) no control return; the loop dispatches the next iter.", "advice_for_others": "naf-claude-agentic: val_n=214, naf_encoding=hash, naf_hash_levels=16, naf_hash_feat_dim=4, naf_hash_log2_size=19, naf_hash_base_res=16, naf_hash_max_res=512, naf_n_freqs=8, naf_hidden=32, naf_layers=3, naf_n_iter=3000, naf_lr=0.02, naf_tv_weight=0.0001, naf_n_clip=0.05, naf_outer_wall_s=1080, naf_per_scene_s=5.0, seed=42, rationale=ITER-10 (search-20260619-01, naf). SIX-BOX (NUMBERS, not CT pixels). (1) SSIM TRAJECTORY + hash params (all hr=0): iter-1 fourier hidden=128 layers=4 lr=1e-2 -> 0.4729. iter-2 hidden 128->64 -> 0.4943. iter-3 layers 4->3 -> 0.5452. iter-4 lr 1e-2->2e-2 -> 0.5629 = BEST FOURIER. iter-5 lr 2e-2->4e-2 -> 0.3592 REGRESSED. iter-6 audit-fix encoding fourier->hash (Instant-NGP 16-level grid, feat_dim=2, log2=19, base=16, max=512 -> 32-dim feat -> MLP hidden=32 layers=3 lr=2e-2) -> 0.6715 NEW BEST. iter-7 hidden 32->64 -> 0.6346 FLAT = MLP-WIDTH EXHAUSTED. iter-8 hash_feat_dim 2->4 (16x4=64-dim feat) -> 0.6951 NEW BEST (+0.0236, params 33.56M, elapsed 1098.4s). iter-9 hash_levels 16->24 -> 0.6803 FLAT/REGRESSED = HASH CAPACITY SATURATED. MAPPED: MLP-width (exhausted), feat_dim (2->4 lift), hash_levels (16->24 saturated). (2) LIMITER: NAF is REGIME-BOUNDED on DENSE 2304-view Mayo (LD-FBP near-complete -> hr stays 0; the audit hash-fix makes the impl FAITHFUL, real payoff is the 128-view SPARSE benchmarks). For SSIM within budget the binding limiter is HASH CAPACITY, now SATURATED: feat_dim lifted (iter-8) then levels did NOT (iter-9). (3) ONE KNOB: NONE -- there is no untried in-budget hash/MLP lever left (width exhausted, feat_dim lifted, levels saturated; the more-steps/wall B-lever is DEFERRED post-TPE). This is the HONEST CLEAN CONFIRMATION: re-dispatch the iter-8 BEST cfg (naf_encoding=hash, hash_feat_dim=4, hash_levels=16, hidden=32, layers=3, lr=2e-2, log2=19, base=16, max=512; step count / wall UNCHANGED) to document the regime-bounded hash-NAF ceiling toward iter-20. (4) HYPOTHESIS: re-running the iter-8 BEST cfg reproduces SSIM ~= 0.6951 (deterministic seed=42, per-scene wall-governed). NUMERIC FALSIFIER: if SSIM differs materially from 0.6951 (e.g. |dSSIM| > ~0.01), there is per-scene wall/scheduling DRIFT (step-count nondeterminism under the 5.0s wall) -- flag and investigate; otherwise the ~0.70 hash-NAF ceiling (well below LD-FBP ~0.81 cal floor, hr 0) is CONFIRMED, a STRUCTURAL NEGATIVE on dense 2304-view Mayo, regime-bounded (payoff = 128-view SPARSE benchmarks). (5) SIZE to HARD 1200s budget: 214-scene pass, naf_outer_wall_s=1080 (18-min in-solver outer wall = governor) + naf_per_scene_s=5.0 (per-scene wall; n_iter cap 3000 UNCHANGED so WALL governs). STEP COUNT / WALL UNTOUCHED (deferred B-fix NOT touched). 214x5.0s=1070s ~= 1080s outer wall (measured elapsed 1098.4s at iter-8, inside the 30-min sbatch kill). val_n=214 (ALL L277 slices), staged_canonical v3 mayo_ldct_fitted geometry, per-sample-ps probe (L277 native ps ~0.73979), bg_target=truth, 321px detector-geometry FOV default (no fov= override), naf_encoding=hash kept. (6) no control return; the loop dispatches the next iter.", "comparison_image": "runs/mayo-ldct-claude-agentic-naf-search-20260619-01/iterations/iter-0010/comparison.png"}
{"ts": "2026-06-21T18:14:48Z", "run_id": "mayo-ldct-claude-agentic-r2gaussian-search-20260619-01", "iter": 10, "agent": "r2gaussian-claude-agentic", "model": "claude-opus-4-8-1m", "change_class": "architecture", "status": "discard", "kept": false, "val_score": 0.7696720957756042, "headroom": 0.0, "params_M": 0.003072, "train_n": 400, "rationale": "r2gaussian-claude-agentic: val_n=214, gs_n_gaussians=512, gs_n_iter=150, gs_lr_pos=0.005, gs_lr_scale=0.01, gs_lr_amp=0.01, gs_lr_rot=0.01, gs_amp_init=0.01, gs_scale_init=0.04, gs_tv_weight=0.0001, gs_n_clip=0.05, gs_render=raster, gs_init_from_fbp=True, gs_amp_init_max=0.05, gs_ssim_weight=0.25, gs_outer_wall_s=1080, rationale=iter-10 (search-20260619-01) \u2014 CLEAN CONFIRMATION toward iter-20. Re-dispatch BASE_ITER=8 BEST config verbatim (PATCH_JSON={}): gs_init_from_fbp=True, gs_render=raster, gs_n_iter=150, 512 Gaussians, gs_amp_init_max=0.05, gs_ssim_weight=0.25 \u2014 the config that set run-best SSIM 0.7696. LIMITER: r2gaussian is REGIME-BOUNDED on dense 2304-view Mayo \u2014 LD-FBP (~0.808) is near-complete, the inverse is not ill-posed enough for a 2D Gaussian-splat prior to add value, so hr>0 is implausible regardless. The audit-fix (b) SSIM-weight lever is now SATURATED: iter-6 @0.10 0.7519 -> iter-7 @0.15 0.7641 (+0.0122) -> iter-8 @0.25 0.7696 (+0.0055, BEST) -> iter-9 @0.40 0.7614 (-0.0082, OVER-WEIGHTED, falsifier FIRED). There is NO untried in-budget lever: gs_n_iter-up is DEFERRED post-TPE, gs_render=splat is the DEFERRED (a) fix (NotImplementedError), and the SSIM-weight axis is mapped+saturated at 0.25. So iter-10 is the HONEST documentation iter: re-run the iter-8 best to confirm SSIM 0.7696 / hr 0 as a FAITHFUL-BUT-REGIME-BOUNDED negative result (the real payoff of the warm-FBP-init + SSIM-loss fix is the 128-view SPARSE benchmarks, not dense Mayo). HYPOTHESIS (falsifiable in NUMBERS): the iter-8 config reproduces SSIM ~= 0.7696 within ~26-scene coverage noise. NUMERIC FALSIFIER: SSIM differs from 0.7696 by more than the ~26-scene coverage-mixture noise band (roughly +/-0.005) => non-determinism / drift in the per-scene fit pipeline that warrants investigation. PREDICTION: SSIM ~0.769 (in 0.765-0.775), hr 0. BUDGET: identical to iter-8 \u2014 per-step ~0.282 s, coverage ~26/214, gs_outer_wall_s=1080 self-truncates before the 30-min SLURM kill; elapsed_s ~1125 (iter-8 1125.3) < 1200s HARD < 1800s SLURM wall, val figure excluded. val_n=214 (ALL L277) per mandate; staged_canonical / v3 mayo_ldct_fitted geom / per-sample-ps (single-val-ps probe) / bg_target=truth / 321px-FOV-default / gs_render=raster all hard-wired (NO fov=False). gs_init_from_fbp=True and gs_render=raster keep the splat scaffold untouched. TRAJECTORY: iter-8 0.7696 (SSIM@0.25, BEST) -> iter-9 0.7614 (SSIM@0.40, saturated) -> iter-10 = clean confirmation re-run of iter-8 best, documenting SSIM 0.7696 / hr 0 as faithful-but-regime-bounded toward iter-20.", "advice_for_others": "r2gaussian-claude-agentic: val_n=214, gs_n_gaussians=512, gs_n_iter=150, gs_lr_pos=0.005, gs_lr_scale=0.01, gs_lr_amp=0.01, gs_lr_rot=0.01, gs_amp_init=0.01, gs_scale_init=0.04, gs_tv_weight=0.0001, gs_n_clip=0.05, gs_render=raster, gs_init_from_fbp=True, gs_amp_init_max=0.05, gs_ssim_weight=0.25, gs_outer_wall_s=1080, rationale=iter-10 (search-20260619-01) \u2014 CLEAN CONFIRMATION toward iter-20. Re-dispatch BASE_ITER=8 BEST config verbatim (PATCH_JSON={}): gs_init_from_fbp=True, gs_render=raster, gs_n_iter=150, 512 Gaussians, gs_amp_init_max=0.05, gs_ssim_weight=0.25 \u2014 the config that set run-best SSIM 0.7696. LIMITER: r2gaussian is REGIME-BOUNDED on dense 2304-view Mayo \u2014 LD-FBP (~0.808) is near-complete, the inverse is not ill-posed enough for a 2D Gaussian-splat prior to add value, so hr>0 is implausible regardless. The audit-fix (b) SSIM-weight lever is now SATURATED: iter-6 @0.10 0.7519 -> iter-7 @0.15 0.7641 (+0.0122) -> iter-8 @0.25 0.7696 (+0.0055, BEST) -> iter-9 @0.40 0.7614 (-0.0082, OVER-WEIGHTED, falsifier FIRED). There is NO untried in-budget lever: gs_n_iter-up is DEFERRED post-TPE, gs_render=splat is the DEFERRED (a) fix (NotImplementedError), and the SSIM-weight axis is mapped+saturated at 0.25. So iter-10 is the HONEST documentation iter: re-run the iter-8 best to confirm SSIM 0.7696 / hr 0 as a FAITHFUL-BUT-REGIME-BOUNDED negative result (the real payoff of the warm-FBP-init + SSIM-loss fix is the 128-view SPARSE benchmarks, not dense Mayo). HYPOTHESIS (falsifiable in NUMBERS): the iter-8 config reproduces SSIM ~= 0.7696 within ~26-scene coverage noise. NUMERIC FALSIFIER: SSIM differs from 0.7696 by more than the ~26-scene coverage-mixture noise band (roughly +/-0.005) => non-determinism / drift in the per-scene fit pipeline that warrants investigation. PREDICTION: SSIM ~0.769 (in 0.765-0.775), hr 0. BUDGET: identical to iter-8 \u2014 per-step ~0.282 s, coverage ~26/214, gs_outer_wall_s=1080 self-truncates before the 30-min SLURM kill; elapsed_s ~1125 (iter-8 1125.3) < 1200s HARD < 1800s SLURM wall, val figure excluded. val_n=214 (ALL L277) per mandate; staged_canonical / v3 mayo_ldct_fitted geom / per-sample-ps (single-val-ps probe) / bg_target=truth / 321px-FOV-default / gs_render=raster all hard-wired (NO fov=False). gs_init_from_fbp=True and gs_render=raster keep the splat scaffold untouched. TRAJECTORY: iter-8 0.7696 (SSIM@0.25, BEST) -> iter-9 0.7614 (SSIM@0.40, saturated) -> iter-10 = clean confirmation re-run of iter-8 best, documenting SSIM 0.7696 / hr 0 as faithful-but-regime-bounded toward iter-20.", "comparison_image": "runs/mayo-ldct-claude-agentic-r2gaussian-search-20260619-01/iterations/iter-0010/comparison.png"}
{"ts": "2026-06-21T17:59:21Z", "run_id": "mayo-ldct-claude-agentic-dual-domain-n2i-search-20260619-01", "iter": 10, "agent": "dual_domain_n2i-claude-agentic", "model": "claude-opus-4-8-1m", "change_class": "architecture", "status": "keep", "kept": true, "val_score": 0.9219107031822205, "headroom": 0.17901924443852602, "params_M": 0.465762, "train_n": 400, "rationale": "dual_domain_n2i-claude-agentic: warm_start=True, pretrain_epochs=4, n_iter=18, grad_clip=1.0, unet_c=16, lr=0.0003, batch_size=1, train_n=200, val_n=214, outer_wall_s=1080, per_scene_s=None, seed=42, rationale=dual_domain_n2i iter-10 (search-20260619-01, PER-IMAGE Noise2Inverse: warm-start pre-pass + per-scan Adam fit; NEVER amortized). SIX-BOX (NUMBERS, from iter-1..9). (1) TRAJECTORY: all four scalar levers MAPPED + bracketed at interior optima + a SEED read, all vs iter-4 BEST (hr 0.19761, SSIM 0.9277, PSNR 35.99, RMSE 7.934e-4): lr {1e-3 hr0/drift, 3e-4 hr0.1976 BEST, 1.5e-4 hr0.1207 iter-6} opt=3e-4; n_iter {15 hr0.1506 iter-3, 18 hr0.1976 BEST, 20 hr0.1595 iter-5} opt=18; pretrain_epochs {1 hr0, 4 hr0.1976 BEST, 6 hr0.1870 iter-7} opt=4; unet_c {16 hr0.1976 BEST, 24 hr0.1236 iter-8} opt=16; SEED {42 hr0.1976 BEST, 123 hr0.1504 iter-9} -> seed-flip came in BELOW best, within init-noise band, seed-stable. warm_start=True settled-positive cross-substrate (do NOT test off). (2) LIMITER: every scalar tuning knob is spent/wrong-signed at its bracketed optimum AND the seed is read. The half-view info bound (the even/odd angular split discards half the 2304 Mayo views) is the hr~0.20 cap. That split is hard-wired in geometry.py::split_angles (NOT a cfg knob; cannot be the lever without editing a FORBIDDEN shared module). There is NO genuinely-untried in-budget tuning lever left. (3) ONE KNOB: NONE -- empty patch, re-dispatch the iter-4 BEST config verbatim (lr=3e-4, n_iter=18, pretrain_epochs=4, unet_c=16, grad_clip=1.0, warm_start=True, seed=42, val_n=214, outer_wall_s=1080; BASE_ITER=4). This is the brief-sanctioned HONEST CLEAN DOCUMENTATION iter (re-run of the joint optimum), NOT a tuning lever. (4) HYPOTHESIS: a verbatim re-run of the iter-4 joint optimum reproduces hr ~ 0.1976 (within the seed-9 init-noise band 0.1504..0.1976). NUMERIC FALSIFIER: if hr DIFFERS from the prior runs beyond the seed-noise band (i.e. hr NOT in ~[0.15,0.20]), something in the substrate/staging changed (non-determinism, staging drift) and the run is suspect; otherwise hr 0.1976 @iter-4 is CONFIRMED as the per-image U-Net N2I half-view ceiling on dense 2304-view Mayo -- document it (NAF/ram structural-negative class) toward iter-20, no further per-image tuning. (5) BUDGET (HARD 20-min compute, val=ALL 214): config == iter-4 (measured elapsed 1235.5s, figure-inclusive). Fit loop 214x18x0.2557=985s + overhead ~267s = ~1252s, well under the 1800s/30-min SLURM hard wall. Per-scene 4.60s < per_scene_s=1080/214=5.05s -> NO truncation, outer_wall_s stays 1080. grad_clip=1.0 mandatory (2304-view FBP adjoint overflows otherwise). val_n=214 NOT reduced (protocol). 321px detector-geometry FOV default (no fov=False). staged_canonical / v3 mayo_ldct_fitted / per-sample-ps half-angle projector swap / bg_target=truth hard-wired. PER-IMAGE structure UNCHANGED (warm-start pre-pass + per-scan fit; NEVER amortized). (6) no control return.", "advice_for_others": "dual_domain_n2i-claude-agentic: warm_start=True, pretrain_epochs=4, n_iter=18, grad_clip=1.0, unet_c=16, lr=0.0003, batch_size=1, train_n=200, val_n=214, outer_wall_s=1080, per_scene_s=None, seed=42, rationale=dual_domain_n2i iter-10 (search-20260619-01, PER-IMAGE Noise2Inverse: warm-start pre-pass + per-scan Adam fit; NEVER amortized). SIX-BOX (NUMBERS, from iter-1..9). (1) TRAJECTORY: all four scalar levers MAPPED + bracketed at interior optima + a SEED read, all vs iter-4 BEST (hr 0.19761, SSIM 0.9277, PSNR 35.99, RMSE 7.934e-4): lr {1e-3 hr0/drift, 3e-4 hr0.1976 BEST, 1.5e-4 hr0.1207 iter-6} opt=3e-4; n_iter {15 hr0.1506 iter-3, 18 hr0.1976 BEST, 20 hr0.1595 iter-5} opt=18; pretrain_epochs {1 hr0, 4 hr0.1976 BEST, 6 hr0.1870 iter-7} opt=4; unet_c {16 hr0.1976 BEST, 24 hr0.1236 iter-8} opt=16; SEED {42 hr0.1976 BEST, 123 hr0.1504 iter-9} -> seed-flip came in BELOW best, within init-noise band, seed-stable. warm_start=True settled-positive cross-substrate (do NOT test off). (2) LIMITER: every scalar tuning knob is spent/wrong-signed at its bracketed optimum AND the seed is read. The half-view info bound (the even/odd angular split discards half the 2304 Mayo views) is the hr~0.20 cap. That split is hard-wired in geometry.py::split_angles (NOT a cfg knob; cannot be the lever without editing a FORBIDDEN shared module). There is NO genuinely-untried in-budget tuning lever left. (3) ONE KNOB: NONE -- empty patch, re-dispatch the iter-4 BEST config verbatim (lr=3e-4, n_iter=18, pretrain_epochs=4, unet_c=16, grad_clip=1.0, warm_start=True, seed=42, val_n=214, outer_wall_s=1080; BASE_ITER=4). This is the brief-sanctioned HONEST CLEAN DOCUMENTATION iter (re-run of the joint optimum), NOT a tuning lever. (4) HYPOTHESIS: a verbatim re-run of the iter-4 joint optimum reproduces hr ~ 0.1976 (within the seed-9 init-noise band 0.1504..0.1976). NUMERIC FALSIFIER: if hr DIFFERS from the prior runs beyond the seed-noise band (i.e. hr NOT in ~[0.15,0.20]), something in the substrate/staging changed (non-determinism, staging drift) and the run is suspect; otherwise hr 0.1976 @iter-4 is CONFIRMED as the per-image U-Net N2I half-view ceiling on dense 2304-view Mayo -- document it (NAF/ram structural-negative class) toward iter-20, no further per-image tuning. (5) BUDGET (HARD 20-min compute, val=ALL 214): config == iter-4 (measured elapsed 1235.5s, figure-inclusive). Fit loop 214x18x0.2557=985s + overhead ~267s = ~1252s, well under the 1800s/30-min SLURM hard wall. Per-scene 4.60s < per_scene_s=1080/214=5.05s -> NO truncation, outer_wall_s stays 1080. grad_clip=1.0 mandatory (2304-view FBP adjoint overflows otherwise). val_n=214 NOT reduced (protocol). 321px detector-geometry FOV default (no fov=False). staged_canonical / v3 mayo_ldct_fitted / per-sample-ps half-angle projector swap / bg_target=truth hard-wired. PER-IMAGE structure UNCHANGED (warm-start pre-pass + per-scan fit; NEVER amortized). (6) no control return.", "comparison_image": "runs/mayo-ldct-claude-agentic-dual-domain-n2i-search-20260619-01/iterations/iter-0010/comparison.png"}
