{"ts": "2026-06-20T19:02:33Z", "run_id": "mayo-ldct-claude-agentic-diff-recon-dcstep-unconstrained-mayo-v4-search-20260619-01", "iter": 6, "agent": "diffusion_recon_dcstep_unconstrained_mayo_v4-claude-agentic", "model": "claude-opus-4-8-1m", "change_class": "architecture", "status": "discard", "kept": false, "val_score": 0.8241006731987, "headroom": 0.0, "params_M": 8.594211, "train_n": 400, "rationale": "diffusion_recon_dcstep_unconstrained_mayo_v4-claude-agentic: recon_ckpt=/cluster/maier/Agent4CT/checkpoints/ddpm_mayo_unconstrained_v4.pt, recon_mode=dps, recon_sample_steps=40, recon_eta=5.0, recon_init=fbp, recon_eta_clamp=False, recon_dcstep_every=5, recon_dcstep_n_cg=3, recon_dcstep_warmup=5, recon_dcstep_relax=1.0, recon_dc_solver=cg, val_n=120, train_n=0, rationale=iter-6 search-20260619-01 UNCONSTRAINED diff-recon -- AUDIT CODE-FIX VALIDATION (user-directed 2026-06-20), reuse ddpm_mayo_unconstrained_v4.pt (NO retrain). ONE KNOB: turn ON the CORRECTED hard-DC -- recon_dc_solver legacy->cg + recon_dcstep_every 0->5 (the mechanistic flip; the OTHER dcstep knobs n_cg=3/warmup=5/relax=1.0 are the VALIDATED constrained-iter-6 defaults, not free choices). BASE = the iter-2 BEST non-collapsed soft-DPS working point: recon_eta=5.0, recon_init=fbp, recon_eta_clamp=false. T 25->40 mirrors the validated constrained-iter-6 reverse schedule (so the unconstrained CG-DC test sits at the SAME T as the working constrained recipe), with val_n=120 as the BUDGET-SIZING mechanism (box 5), NOT a hypothesis variable. The legacy hard-DC path is the bug that COLLAPSED unconstrained iter-4 to SSIM 0.0553 (it is a MISLABELED steepest-descent dressed as CG, plus a re-injection that recomputes x0 from a STALE eps and re-noises with a FRESH randn mid-schedule). recon_dc_solver=cg swaps in a GENUINE Fletcher-Reeves CG solve of AtA x = At y, forms x0 from the CURRENT step eps, CG-projects it, then re-embeds at t_next DETERMINISTICALLY reusing the SAME eps_pred (NO fresh randn, NO stale eps). This is the EXACT fix that lifted the CONSTRAINED sibling iter-5->iter-6 SSIM 0.6647->0.7873 (no collapse, big lift) at this same T=40/val_n=120 working point. TRAJECTORY (val L277, 321px FOV, LD-FBP floor 0.8078): iter-1 T25/eta30/every0 SSIM 0.3688/hr0; iter-2 eta30->5 SSIM 0.3960/hr0 (BEST soft); iter-3 T25->32 SSIM 0.3869/hr0; iter-4 every0->5 LEGACY hard-DC SSIM 0.0553 (COLLAPSE -- the legacy-bug signature); iter-5 T->40 soft SSIM 0.3709/hr0 (T saturated on the PURE-SOFT path). The pure-soft levers (eta, T) are EXHAUSTED on the unconstrained variant; the corrected hard-DC is the last untried mechanism. FAILURE MODE under test: was iter-4's collapse the legacy DC bug (re-noise corruption) -- which the CG path fixes -- or a structural prior-mismatch the CG path also cannot rescue on the soft/unconstrained prior? HYPOTHESIS: if the corrected CG-DC transfers from the constrained sibling (0.6647->0.7873) to the unconstrained soft-DPS prior, SSIM rises well above iter-2 BEST 0.3960 -- predicted 0.55-0.75 -- and does NOT collapse like the legacy iter-4 (0.0553). hr probably STAYS 0 (regime-bounded dense rebinned Mayo: LD-FBP near-complete at 2304 views; the v4 prior payoff is the 128-view SPARSE benchmarks + the planned EMA v5). FALSIFIER: if SSIM still COLLAPSES (<<0.39) at recon_dc_solver=cg, there is a RESIDUAL issue in the cg path on the soft/unconstrained prior (e.g. the eta=5 soft gradient + CG re-embed interact differently than the constrained eta=30 + hard-CG path) -> file it and the unconstrained best stays iter-2 (SSIM 0.396, hr 0). BUDGET (HARD 20-min = 1200s wall, val=120 evenly-spaced L277): the VALIDATED constrained iter-6 with the IDENTICAL recon_dc_solver=cg, T=40, every5/n_cg3/warmup5/relax1.0, val_n=120 ran in 963.5 s = 16.1 min < the 1200s/20-min budget (~4 min headroom; the deterministic re-embed drops the legacy randn so the CG path is roughly cost-neutral). val_n=120 held at the constrained iter-6 value for direct sibling comparability. val=120 evenly-spaced L277, 321px detector-geometry FOV default (no fov=False). staged_canonical data, v3 mayo_ldct_fitted geometry, per-sample-ps single-val-ps probe, bg_target=truth, reuse ddpm_mayo_unconstrained_v4.pt (NO retrain), 321px FOV.", "advice_for_others": "diffusion_recon_dcstep_unconstrained_mayo_v4-claude-agentic: recon_ckpt=/cluster/maier/Agent4CT/checkpoints/ddpm_mayo_unconstrained_v4.pt, recon_mode=dps, recon_sample_steps=40, recon_eta=5.0, recon_init=fbp, recon_eta_clamp=False, recon_dcstep_every=5, recon_dcstep_n_cg=3, recon_dcstep_warmup=5, recon_dcstep_relax=1.0, recon_dc_solver=cg, val_n=120, train_n=0, rationale=iter-6 search-20260619-01 UNCONSTRAINED diff-recon -- AUDIT CODE-FIX VALIDATION (user-directed 2026-06-20), reuse ddpm_mayo_unconstrained_v4.pt (NO retrain). ONE KNOB: turn ON the CORRECTED hard-DC -- recon_dc_solver legacy->cg + recon_dcstep_every 0->5 (the mechanistic flip; the OTHER dcstep knobs n_cg=3/warmup=5/relax=1.0 are the VALIDATED constrained-iter-6 defaults, not free choices). BASE = the iter-2 BEST non-collapsed soft-DPS working point: recon_eta=5.0, recon_init=fbp, recon_eta_clamp=false. T 25->40 mirrors the validated constrained-iter-6 reverse schedule (so the unconstrained CG-DC test sits at the SAME T as the working constrained recipe), with val_n=120 as the BUDGET-SIZING mechanism (box 5), NOT a hypothesis variable. The legacy hard-DC path is the bug that COLLAPSED unconstrained iter-4 to SSIM 0.0553 (it is a MISLABELED steepest-descent dressed as CG, plus a re-injection that recomputes x0 from a STALE eps and re-noises with a FRESH randn mid-schedule). recon_dc_solver=cg swaps in a GENUINE Fletcher-Reeves CG solve of AtA x = At y, forms x0 from the CURRENT step eps, CG-projects it, then re-embeds at t_next DETERMINISTICALLY reusing the SAME eps_pred (NO fresh randn, NO stale eps). This is the EXACT fix that lifted the CONSTRAINED sibling iter-5->iter-6 SSIM 0.6647->0.7873 (no collapse, big lift) at this same T=40/val_n=120 working point. TRAJECTORY (val L277, 321px FOV, LD-FBP floor 0.8078): iter-1 T25/eta30/every0 SSIM 0.3688/hr0; iter-2 eta30->5 SSIM 0.3960/hr0 (BEST soft); iter-3 T25->32 SSIM 0.3869/hr0; iter-4 every0->5 LEGACY hard-DC SSIM 0.0553 (COLLAPSE -- the legacy-bug signature); iter-5 T->40 soft SSIM 0.3709/hr0 (T saturated on the PURE-SOFT path). The pure-soft levers (eta, T) are EXHAUSTED on the unconstrained variant; the corrected hard-DC is the last untried mechanism. FAILURE MODE under test: was iter-4's collapse the legacy DC bug (re-noise corruption) -- which the CG path fixes -- or a structural prior-mismatch the CG path also cannot rescue on the soft/unconstrained prior? HYPOTHESIS: if the corrected CG-DC transfers from the constrained sibling (0.6647->0.7873) to the unconstrained soft-DPS prior, SSIM rises well above iter-2 BEST 0.3960 -- predicted 0.55-0.75 -- and does NOT collapse like the legacy iter-4 (0.0553). hr probably STAYS 0 (regime-bounded dense rebinned Mayo: LD-FBP near-complete at 2304 views; the v4 prior payoff is the 128-view SPARSE benchmarks + the planned EMA v5). FALSIFIER: if SSIM still COLLAPSES (<<0.39) at recon_dc_solver=cg, there is a RESIDUAL issue in the cg path on the soft/unconstrained prior (e.g. the eta=5 soft gradient + CG re-embed interact differently than the constrained eta=30 + hard-CG path) -> file it and the unconstrained best stays iter-2 (SSIM 0.396, hr 0). BUDGET (HARD 20-min = 1200s wall, val=120 evenly-spaced L277): the VALIDATED constrained iter-6 with the IDENTICAL recon_dc_solver=cg, T=40, every5/n_cg3/warmup5/relax1.0, val_n=120 ran in 963.5 s = 16.1 min < the 1200s/20-min budget (~4 min headroom; the deterministic re-embed drops the legacy randn so the CG path is roughly cost-neutral). val_n=120 held at the constrained iter-6 value for direct sibling comparability. val=120 evenly-spaced L277, 321px detector-geometry FOV default (no fov=False). staged_canonical data, v3 mayo_ldct_fitted geometry, per-sample-ps single-val-ps probe, bg_target=truth, reuse ddpm_mayo_unconstrained_v4.pt (NO retrain), 321px FOV.", "comparison_image": "runs/mayo-ldct-claude-agentic-diff-recon-dcstep-unconstrained-mayo-v4-search-20260619-01/iterations/iter-0006/comparison.png"}
{"ts": "2026-06-20T18:46:30Z", "run_id": "mayo-ldct-claude-agentic-ram-search-20260619-01", "iter": 6, "agent": "ram_zeroshot-claude-agentic", "model": "claude-opus-4-8-1m", "change_class": "architecture", "status": "discard", "kept": false, "val_score": null, "headroom": 0.0, "params_M": null, "train_n": 400, "rationale": "ram_zeroshot-claude-agentic: ram_ckpt_path=/cluster/maier/Agent4CT/checkpoints/ram.pth.tar, ram_input_norm=adjoint_max, ram_clamp_output=True, ram_finetune=False, ram_finetune_epochs=0, ram_finetune_lr=0.0001, ram_disable_multiscale=True, ram_disable_cudnn=False, ram_use_deepinv_tomo=True, ram_sigma=0.005, ram_factor=0.55, ram_post_fbp_blend=0.3, val_n=214, rationale=iter-6 (search-20260619-01, corrected protocol): ONE knob ram_use_deepinv_tomo False->True (BASE_ITER=1; all other knobs RETURN to the iter-1 canonical point: ram_input_norm=adjoint_max, ram_factor=0.55, ram_post_fbp_blend=0.3, ram_sigma=0.005, multiscale disabled, finetune OFF). cfg_full audit iters 1-5: the four INFERENCE-SCALAR levers are now all swept and all EXHAUSTED at hr 0.0 -- post-hoc linear blend ram_post_fbp_blend [iter-2], internal prox_l2 DC gain ram_factor [iter-3], denoiser noise-conditioning ram_sigma [iter-4], input-amplitude norm ram_input_norm [iter-5]. ram_use_deepinv_tomo is the LAST untried cfg flag, pinned False since iter-1. SEMANTICS (solver_ram.py): it routes RAMs reconstruction through the deepinv TOMOGRAPHY physics operator (a faithful multi-eval fan-beam data-consistency path) instead of the lightweight prox_l2 path -- the one remaining STRUCTURAL change to whether the frozen foreign prior gets to leverage measurement consistency against the actual v3 fan geometry. Trajectory under corrected 214-slice/321px-FOV metric: iter-1 SSIM 0.8611 hr 0.0; iter-2 0.8644 hr 0.0 (blend EXHAUSTED); iter-3 0.8968 hr 0.0 PSNR31.58 (prox_l2 gain EXHAUSTED); iter-4 0.9024 hr 0.0 PSNR31.22 (sigma EXHAUSTED); iter-5 0.9071 hr 0.0 PSNR32.80 (input-norm EXHAUSTED). SSIM climbed 0.861->0.907 yet calibrated headroom stayed pinned at EXACTLY 0.0 throughout (baseline LD-FBP SSIM0.8078, oracle HD-FBP 0.9331; RMSE-sensitive metric keeps RAMs ~31-33dB PSNR below the LD-FBP floor). SIX-BOX (NUMBERS not CT pixels): (1) prev: hr 0.0 on all four inference scalars; best SSIM iter-5 0.9071, best hr 0.0. (2) LIMITER: RAM is a frozen pretrained zero-shot deepinv denoiser that never saw real LDCT helical-rebinned 2304-view fan data; on dense full-view Mayo LD-FBP is already a near-complete inversion, so a foreign-prior denoiser can only redistribute/smooth signal, not add LDCT-specific recoverable structure -> its RMSE stays above the LD-FBP floor -> hr pinned at 0 regardless of inference lever. (3) ONE knob: ram_use_deepinv_tomo False->True (the last untried structural lever, the DC physics path). (4) hypothesis: hr stays EXACTLY 0.0 -- routing through the deepinv-tomo physics DC does not move the calibrated metric because the foreign prior carries no LDCT-specific recoverable signal at any DC formulation; predict hr 0. (5) falsifier: if hr at ram_use_deepinv_tomo=True != 0.0 (rises OR drops off the 0.0 floor), RAMs DC physics path DOES move the calibrated metric and RAM is not purely FBP-bounded; if hr stays 0.0 across blend(i2)+prox_l2(i3)+sigma(i4)+input-norm(i5)+tomo-physics(i6), RAM is CONFIRMED structurally FBP-bounded on dense Mayo across ALL FIVE levers -> documented path to iter-20 as a structural negative. (6) verdict: this iter DOCUMENTS the ceiling. Budget: a boolean physics-path flag; the deepinv-tomo path adds a few physics evals per slice, but iters 3-5 ran 934.6-985.9s = 15.6-16.4 min for 214 single forward passes + one op-norm power iter, comfortable headroom under the HARD 1200s budget; sbatch --time=00:30:00 backstop wall (no in-solver wall knob in solver_ram.py). val_n stays 214 (score ALL L277 slices @ 321px detector-geometry FOV). HARD-WIRED: staged_canonical, v3 mayo_ldct_fitted, per-sample-ps (single-val-ps probe, val-only solver), bg_target=truth, 321px FOV DEFAULT (no fov=False).", "advice_for_others": "ram_zeroshot-claude-agentic: ram_ckpt_path=/cluster/maier/Agent4CT/checkpoints/ram.pth.tar, ram_input_norm=adjoint_max, ram_clamp_output=True, ram_finetune=False, ram_finetune_epochs=0, ram_finetune_lr=0.0001, ram_disable_multiscale=True, ram_disable_cudnn=False, ram_use_deepinv_tomo=True, ram_sigma=0.005, ram_factor=0.55, ram_post_fbp_blend=0.3, val_n=214, rationale=iter-6 (search-20260619-01, corrected protocol): ONE knob ram_use_deepinv_tomo False->True (BASE_ITER=1; all other knobs RETURN to the iter-1 canonical point: ram_input_norm=adjoint_max, ram_factor=0.55, ram_post_fbp_blend=0.3, ram_sigma=0.005, multiscale disabled, finetune OFF). cfg_full audit iters 1-5: the four INFERENCE-SCALAR levers are now all swept and all EXHAUSTED at hr 0.0 -- post-hoc linear blend ram_post_fbp_blend [iter-2], internal prox_l2 DC gain ram_factor [iter-3], denoiser noise-conditioning ram_sigma [iter-4], input-amplitude norm ram_input_norm [iter-5]. ram_use_deepinv_tomo is the LAST untried cfg flag, pinned False since iter-1. SEMANTICS (solver_ram.py): it routes RAMs reconstruction through the deepinv TOMOGRAPHY physics operator (a faithful multi-eval fan-beam data-consistency path) instead of the lightweight prox_l2 path -- the one remaining STRUCTURAL change to whether the frozen foreign prior gets to leverage measurement consistency against the actual v3 fan geometry. Trajectory under corrected 214-slice/321px-FOV metric: iter-1 SSIM 0.8611 hr 0.0; iter-2 0.8644 hr 0.0 (blend EXHAUSTED); iter-3 0.8968 hr 0.0 PSNR31.58 (prox_l2 gain EXHAUSTED); iter-4 0.9024 hr 0.0 PSNR31.22 (sigma EXHAUSTED); iter-5 0.9071 hr 0.0 PSNR32.80 (input-norm EXHAUSTED). SSIM climbed 0.861->0.907 yet calibrated headroom stayed pinned at EXACTLY 0.0 throughout (baseline LD-FBP SSIM0.8078, oracle HD-FBP 0.9331; RMSE-sensitive metric keeps RAMs ~31-33dB PSNR below the LD-FBP floor). SIX-BOX (NUMBERS not CT pixels): (1) prev: hr 0.0 on all four inference scalars; best SSIM iter-5 0.9071, best hr 0.0. (2) LIMITER: RAM is a frozen pretrained zero-shot deepinv denoiser that never saw real LDCT helical-rebinned 2304-view fan data; on dense full-view Mayo LD-FBP is already a near-complete inversion, so a foreign-prior denoiser can only redistribute/smooth signal, not add LDCT-specific recoverable structure -> its RMSE stays above the LD-FBP floor -> hr pinned at 0 regardless of inference lever. (3) ONE knob: ram_use_deepinv_tomo False->True (the last untried structural lever, the DC physics path). (4) hypothesis: hr stays EXACTLY 0.0 -- routing through the deepinv-tomo physics DC does not move the calibrated metric because the foreign prior carries no LDCT-specific recoverable signal at any DC formulation; predict hr 0. (5) falsifier: if hr at ram_use_deepinv_tomo=True != 0.0 (rises OR drops off the 0.0 floor), RAMs DC physics path DOES move the calibrated metric and RAM is not purely FBP-bounded; if hr stays 0.0 across blend(i2)+prox_l2(i3)+sigma(i4)+input-norm(i5)+tomo-physics(i6), RAM is CONFIRMED structurally FBP-bounded on dense Mayo across ALL FIVE levers -> documented path to iter-20 as a structural negative. (6) verdict: this iter DOCUMENTS the ceiling. Budget: a boolean physics-path flag; the deepinv-tomo path adds a few physics evals per slice, but iters 3-5 ran 934.6-985.9s = 15.6-16.4 min for 214 single forward passes + one op-norm power iter, comfortable headroom under the HARD 1200s budget; sbatch --time=00:30:00 backstop wall (no in-solver wall knob in solver_ram.py). val_n stays 214 (score ALL L277 slices @ 321px detector-geometry FOV). HARD-WIRED: staged_canonical, v3 mayo_ldct_fitted, per-sample-ps (single-val-ps probe, val-only solver), bg_target=truth, 321px FOV DEFAULT (no fov=False).", "comparison_image": null}
