{"ts": "2026-06-19T13:08:07Z", "run_id": "mayo-ldct-claude-agentic-itnet-search-20260619-01", "iter": 1, "agent": "itnet-claude-agentic-breast-ct", "model": "claude-opus-4.7-1m", "change_class": "architecture", "status": "discard", "kept": false, "val_score": 0.4413047134876251, "headroom": 0.0, "params_M": 0.232881, "train_n": 400, "rationale": "itnet-claude-agentic: pretrain_epochs=8, pretrain_lr=0.0001, itnet_k=3, itnet_alpha=0.005, unet_c=16, finetune_epochs=0, finetune_lr=0.0001, train_n=200, val_n=214, grad_clip=1.0, seed=42, rationale=ITER-1 feasibility (search-20260619-01, corrected protocol) for itnet = ItNet v1 (the ORIGINAL Genzel-Hauptmann-Schaller recipe, solver_itnet.py). GOAL: does ItNet v1 run on Mayo under the corrected path (staged_canonical v3 mayo_ldct_fitted geometry, per-sample-ps FBP init + per-sample itnet.projector swap for the k DC steps, bg_target=truth) and produce a FINITE val_score + comparison.png within the HARD 20-min train+score budget, scoring ALL 214 L277 slices under the 321px detector-geometry FOV (evaluate_calibrated default for AGENT4CT_DATASET=mayo_ldct_2d; NO fov= override)? ARCHITECTURE NOTE: v1 main() runs ONLY pretrain_denoiser (SmallUNet on FBP->truth pairs) then a pure-inference ItNet DC unroll at eval; finetune_itnet() is defined but NOT called, so the only TRAINING knobs are pretrain_epochs/pretrain_lr (finetune_* kept inert at 0). v1 has NO max_train_s backstop -> sized conservatively below v3 iter-1s 738s wall. CONFIG: modest capacity that fits 24GB at lr~1e-4 (per brief): SmallUNet c=16, k=3 inference DC steps (Mayo 2304-angle wants >demo-DL k=2; matches v3 iter-1s stable k=3), itnet_alpha=5e-3 DC step size, pretrain_lr=1e-4 (v-series is lr-sensitive; high lr collapsed v3), grad_clip=1.0 (mandatory: the 2304-view Mayo FBP adjoint in the DC step overflows otherwise), pretrain_epochs=8 on train_n=200 (200 UNet-only steps/epoch, cheaper than v3 per epoch). per-sample-ps forces val chunk=1 (each slice swaps itnet.projector to its own ps). Reference timings (same val path, same dataset): uswin iter-1 329s, itnet_v3 iter-1 (k=3, per-ps, 214-slice val, ep8) 738s -> v1 (UNet-only train, shallower SmallUNet) lands UNDER 738s, well inside the 20-min budget. HYPOTHESIS: if I run ItNet v1 at k=3/c=16/pretrain_lr=1e-4 for 8 epochs on 200 stratified Mayo train slices, I expect a finite val_ssim that CLEARS the LD-FBP baseline (hr>0), because an FBP-denoiser + DC unroll is a sound Mayo recon family and the sibling v-variants just landed in range under this exact corrected metric (itnet_v3 hr=0.268, uswin hr=0.173). v1 should be in that range. This onboarding iter establishes the corrected-metric v1 baseline that iter-2+ will improve by tuning ONE knob (pretrain_epochs first -- epochs were the lever for the whole v-family).", "advice_for_others": "itnet-claude-agentic: pretrain_epochs=8, pretrain_lr=0.0001, itnet_k=3, itnet_alpha=0.005, unet_c=16, finetune_epochs=0, finetune_lr=0.0001, train_n=200, val_n=214, grad_clip=1.0, seed=42, rationale=ITER-1 feasibility (search-20260619-01, corrected protocol) for itnet = ItNet v1 (the ORIGINAL Genzel-Hauptmann-Schaller recipe, solver_itnet.py). GOAL: does ItNet v1 run on Mayo under the corrected path (staged_canonical v3 mayo_ldct_fitted geometry, per-sample-ps FBP init + per-sample itnet.projector swap for the k DC steps, bg_target=truth) and produce a FINITE val_score + comparison.png within the HARD 20-min train+score budget, scoring ALL 214 L277 slices under the 321px detector-geometry FOV (evaluate_calibrated default for AGENT4CT_DATASET=mayo_ldct_2d; NO fov= override)? ARCHITECTURE NOTE: v1 main() runs ONLY pretrain_denoiser (SmallUNet on FBP->truth pairs) then a pure-inference ItNet DC unroll at eval; finetune_itnet() is defined but NOT called, so the only TRAINING knobs are pretrain_epochs/pretrain_lr (finetune_* kept inert at 0). v1 has NO max_train_s backstop -> sized conservatively below v3 iter-1s 738s wall. CONFIG: modest capacity that fits 24GB at lr~1e-4 (per brief): SmallUNet c=16, k=3 inference DC steps (Mayo 2304-angle wants >demo-DL k=2; matches v3 iter-1s stable k=3), itnet_alpha=5e-3 DC step size, pretrain_lr=1e-4 (v-series is lr-sensitive; high lr collapsed v3), grad_clip=1.0 (mandatory: the 2304-view Mayo FBP adjoint in the DC step overflows otherwise), pretrain_epochs=8 on train_n=200 (200 UNet-only steps/epoch, cheaper than v3 per epoch). per-sample-ps forces val chunk=1 (each slice swaps itnet.projector to its own ps). Reference timings (same val path, same dataset): uswin iter-1 329s, itnet_v3 iter-1 (k=3, per-ps, 214-slice val, ep8) 738s -> v1 (UNet-only train, shallower SmallUNet) lands UNDER 738s, well inside the 20-min budget. HYPOTHESIS: if I run ItNet v1 at k=3/c=16/pretrain_lr=1e-4 for 8 epochs on 200 stratified Mayo train slices, I expect a finite val_ssim that CLEARS the LD-FBP baseline (hr>0), because an FBP-denoiser + DC unroll is a sound Mayo recon family and the sibling v-variants just landed in range under this exact corrected metric (itnet_v3 hr=0.268, uswin hr=0.173). v1 should be in that range. This onboarding iter establishes the corrected-metric v1 baseline that iter-2+ will improve by tuning ONE knob (pretrain_epochs first -- epochs were the lever for the whole v-family).", "comparison_image": "runs/mayo-ldct-claude-agentic-itnet-search-20260619-01/iterations/iter-0001/comparison.png"}
{"ts": "2026-06-19T12:58:03Z", "run_id": "mayo-ldct-claude-agentic-learned-primal-dual-search-20260619-01", "iter": 1, "agent": "learned_primal_dual-claude-agentic-breast-ct", "model": "claude-opus-4.7-1m", "change_class": "architecture", "status": "discard", "kept": false, "val_score": 0.8427104949951172, "headroom": 0.0, "params_M": 0.25901, "train_n": 400, "rationale": "learned_primal_dual-claude-agentic: lpd_iters=5, lpd_hidden=48, lpd_n_primal=5, lpd_n_dual=5, lpd_share_weights=False, lr=0.0005, lr_schedule=cosine, epochs=6, batch_size=1, val_chunk=1, train_n=200, val_n=214, grad_clip=1.0, seed=42, rationale=FRESH search-20260619-01 iter-1 FEASIBILITY under the corrected protocol (val=ALL 214 L277 slices + 321px detector-geometry FOV; HARD 20-min train+score budget; the old 5h LPD TIME_OVERRIDE is GONE). BUDGET-SIZED DOWN to fit ~20min train+score on a 24GB Q6000/Q5000: lpd_iters=5 (small unroll vs Adler I=10), hidden=48, epochs=6, train_n=200, batch=1; val_n=214 at val_chunk=1 (Mayo per-sample-ps swaps model.R per slice -> chunk must be 1). lr=5e-4 is a stable trained point well clear of the prior-run anomalous collapse at lr~6e-4. Hyp: a budget-sized LPD CLEARS the LD-FBP baseline (hr>0) within 20 min on Mayo; if it cannot fit train+score(214) in 20 min even this small, THAT timing wall is the key iter-1 feasibility finding for LPD under the no-override budget.", "advice_for_others": "learned_primal_dual-claude-agentic: lpd_iters=5, lpd_hidden=48, lpd_n_primal=5, lpd_n_dual=5, lpd_share_weights=False, lr=0.0005, lr_schedule=cosine, epochs=6, batch_size=1, val_chunk=1, train_n=200, val_n=214, grad_clip=1.0, seed=42, rationale=FRESH search-20260619-01 iter-1 FEASIBILITY under the corrected protocol (val=ALL 214 L277 slices + 321px detector-geometry FOV; HARD 20-min train+score budget; the old 5h LPD TIME_OVERRIDE is GONE). BUDGET-SIZED DOWN to fit ~20min train+score on a 24GB Q6000/Q5000: lpd_iters=5 (small unroll vs Adler I=10), hidden=48, epochs=6, train_n=200, batch=1; val_n=214 at val_chunk=1 (Mayo per-sample-ps swaps model.R per slice -> chunk must be 1). lr=5e-4 is a stable trained point well clear of the prior-run anomalous collapse at lr~6e-4. Hyp: a budget-sized LPD CLEARS the LD-FBP baseline (hr>0) within 20 min on Mayo; if it cannot fit train+score(214) in 20 min even this small, THAT timing wall is the key iter-1 feasibility finding for LPD under the no-override budget.", "comparison_image": "runs/mayo-ldct-claude-agentic-learned-primal-dual-search-20260619-01/iterations/iter-0001/comparison.png"}
{"ts": "2026-06-19T12:39:49Z", "run_id": "mayo-ldct-claude-agentic-itnet-v3-search-20260619-01", "iter": 1, "agent": "itnet_v3-claude-agentic-breast-ct", "model": "claude-opus-4.7-1m", "change_class": "architecture", "status": "keep", "kept": true, "val_score": 0.8959029316902161, "headroom": 0.2684093888209719, "params_M": 3.698994, "train_n": 400, "rationale": "itnet_v3-claude-agentic: itnet_k=3, unet_c=16, alpha_init=0.0037, lr=0.0001, epochs=8, batch_size=1, val_chunk=1, train_n=200, val_n=214, grad_clip=1.0, max_train_s=900, seed=42, rationale=ITER-1 feasibility (search-20260619-01, corrected protocol). GOAL: does itnet_v3 run on Mayo under the corrected path (staged_canonical v3, per-sample-ps FBP init + per-sample itnet.projector for the k=3 DC steps, bg_target=truth) and produce a FINITE val_score + comparison.png within the HARD 20-min train+score budget, scoring ALL 214 L277 slices under the 321px detector-geometry FOV (evaluate_calibrated default for AGENT4CT_DATASET=mayo_ldct_2d; no fov= override)? CONFIG: seed itnet_v3 at its stable architecture defaults that fit 24GB -- k=3 unrolled DC steps, 5-level UNet5 c=16 (~2.5M params), alpha_init=0.0037 (TV-lambda), lr=1e-4 (v3 is unstable at higher lr -- 3e-4 collapsed in prior probes), grad_clip=1.0 (mandatory: the 2304-view Mayo FBP adjoint inside dc_step overflows otherwise). batch_size=1 + val_chunk=1 are FORCED by the per-sample-ps path (each slice swaps itnet.projector to its own ps). train_n=200 -> 200 steps/epoch; epochs=8 target. max_train_s=900 (15 min) is a HARD backstop so train always leaves room for the 214-slice per-sample val pass + figure inside the 30-min sbatch wall (20-min budget + headroom). HYPOTHESIS: itnet_v3 at k=3/c=16/lr=1e-4 for ~8 epochs on 200 stratified Mayo train slices produces a finite val_ssim that CLEARS the LD-FBP baseline (hr>0), because an end-to-end unrolled DC-step denoiser of the FBP is a strong Mayo recon family (loose hint from the discarded boundary-slice run: ~0.96-0.97 SSIM, ep40 peak, with epochs as the lever -- treat as behavior hint only, not a validated number under the corrected metric). This onboarding iter establishes the corrected-metric baseline that iter-2+ will improve by tuning ONE knob (epochs first).", "advice_for_others": "itnet_v3-claude-agentic: itnet_k=3, unet_c=16, alpha_init=0.0037, lr=0.0001, epochs=8, batch_size=1, val_chunk=1, train_n=200, val_n=214, grad_clip=1.0, max_train_s=900, seed=42, rationale=ITER-1 feasibility (search-20260619-01, corrected protocol). GOAL: does itnet_v3 run on Mayo under the corrected path (staged_canonical v3, per-sample-ps FBP init + per-sample itnet.projector for the k=3 DC steps, bg_target=truth) and produce a FINITE val_score + comparison.png within the HARD 20-min train+score budget, scoring ALL 214 L277 slices under the 321px detector-geometry FOV (evaluate_calibrated default for AGENT4CT_DATASET=mayo_ldct_2d; no fov= override)? CONFIG: seed itnet_v3 at its stable architecture defaults that fit 24GB -- k=3 unrolled DC steps, 5-level UNet5 c=16 (~2.5M params), alpha_init=0.0037 (TV-lambda), lr=1e-4 (v3 is unstable at higher lr -- 3e-4 collapsed in prior probes), grad_clip=1.0 (mandatory: the 2304-view Mayo FBP adjoint inside dc_step overflows otherwise). batch_size=1 + val_chunk=1 are FORCED by the per-sample-ps path (each slice swaps itnet.projector to its own ps). train_n=200 -> 200 steps/epoch; epochs=8 target. max_train_s=900 (15 min) is a HARD backstop so train always leaves room for the 214-slice per-sample val pass + figure inside the 30-min sbatch wall (20-min budget + headroom). HYPOTHESIS: itnet_v3 at k=3/c=16/lr=1e-4 for ~8 epochs on 200 stratified Mayo train slices produces a finite val_ssim that CLEARS the LD-FBP baseline (hr>0), because an end-to-end unrolled DC-step denoiser of the FBP is a strong Mayo recon family (loose hint from the discarded boundary-slice run: ~0.96-0.97 SSIM, ep40 peak, with epochs as the lever -- treat as behavior hint only, not a validated number under the corrected metric). This onboarding iter establishes the corrected-metric baseline that iter-2+ will improve by tuning ONE knob (epochs first).", "comparison_image": "runs/mayo-ldct-claude-agentic-itnet-v3-search-20260619-01/iterations/iter-0001/comparison.png"}
{"ts": "2026-06-19T12:15:30Z", "run_id": "mayo-ldct-claude-agentic-uswin-search-20260619-01", "iter": 1, "agent": "uswin-claude-agentic-breast-ct", "model": "claude-opus-4.7-1m", "change_class": "architecture", "status": "keep", "kept": true, "val_score": 0.8859097957611084, "headroom": 0.17302103904920718, "params_M": 3.954049, "train_n": 400, "rationale": "uswin-claude-agentic: train_n=200, val_n=214, epochs=10, batch_size=4, lr=0.0005, uswin_c=24, swin_window=8, swin_heads=4, grad_clip=1.0, max_train_s=1000, seed=42, rationale=ITER-1 feasibility (search-20260619-01, corrected protocol). GOAL: does uswin run on Mayo under the corrected path (staged_canonical v3, per-sample-ps FBP, bg_target=truth) and produce a FINITE val_score + comparison.png within the HARD 20-min train+score budget, scoring ALL 214 L277 slices under the 321px detector-geometry FOV (evaluate_calibrated default for AGENT4CT_DATASET=mayo_ldct_2d)? CONFIG: seed uswin at its architecture defaults (c=24, window=8, heads=4, lr=5e-4) with the CONFIG-default epochs=10 on train_n=200 (50 steps/epoch at bs=4) and val_n=214. grad_clip=1.0 guards the 2304-view FBP-domain gradient scale; max_train_s=1000 (~16.7 min) is a hard backstop so train ALWAYS leaves room for the 214-slice val pass + figure inside the 30-min sbatch wall (20-min budget + headroom). HYPOTHESIS: if I run uswin at its default capacity for 10 epochs on 200 stratified Mayo train slices, I expect a finite val_ssim that CLEARS the LD-FBP baseline (hr>0), because uswin was historically a strong Mayo image-domain FBP-denoiser (loose hint from the discarded boundary-slice run: ~0.97 SSIM with epochs as the lever) \u2014 this onboarding iter establishes the corrected-metric baseline that iter-2+ will improve by tuning ONE knob (epochs first).", "advice_for_others": "uswin-claude-agentic: train_n=200, val_n=214, epochs=10, batch_size=4, lr=0.0005, uswin_c=24, swin_window=8, swin_heads=4, grad_clip=1.0, max_train_s=1000, seed=42, rationale=ITER-1 feasibility (search-20260619-01, corrected protocol). GOAL: does uswin run on Mayo under the corrected path (staged_canonical v3, per-sample-ps FBP, bg_target=truth) and produce a FINITE val_score + comparison.png within the HARD 20-min train+score budget, scoring ALL 214 L277 slices under the 321px detector-geometry FOV (evaluate_calibrated default for AGENT4CT_DATASET=mayo_ldct_2d)? CONFIG: seed uswin at its architecture defaults (c=24, window=8, heads=4, lr=5e-4) with the CONFIG-default epochs=10 on train_n=200 (50 steps/epoch at bs=4) and val_n=214. grad_clip=1.0 guards the 2304-view FBP-domain gradient scale; max_train_s=1000 (~16.7 min) is a hard backstop so train ALWAYS leaves room for the 214-slice val pass + figure inside the 30-min sbatch wall (20-min budget + headroom). HYPOTHESIS: if I run uswin at its default capacity for 10 epochs on 200 stratified Mayo train slices, I expect a finite val_ssim that CLEARS the LD-FBP baseline (hr>0), because uswin was historically a strong Mayo image-domain FBP-denoiser (loose hint from the discarded boundary-slice run: ~0.97 SSIM with epochs as the lever) \u2014 this onboarding iter establishes the corrected-metric baseline that iter-2+ will improve by tuning ONE knob (epochs first).", "comparison_image": "runs/mayo-ldct-claude-agentic-uswin-search-20260619-01/iterations/iter-0001/comparison.png"}
