{"ts": "2026-06-20T10:17:23Z", "run_id": "mayo-ldct-claude-agentic-ram-search-20260619-01", "iter": 5, "agent": "ram_zeroshot-claude-agentic", "model": "claude-opus-4-8-1m", "change_class": "architecture", "status": "discard", "kept": false, "val_score": 0.9070974588394165, "headroom": 0.0, "params_M": 35.618953, "train_n": 400, "rationale": "ram_zeroshot-claude-agentic: ram_ckpt_path=/cluster/maier/Agent4CT/checkpoints/ram.pth.tar, ram_input_norm=fbp_max, ram_clamp_output=True, ram_finetune=False, ram_finetune_epochs=0, ram_finetune_lr=0.0001, ram_disable_multiscale=True, ram_disable_cudnn=False, ram_use_deepinv_tomo=False, ram_sigma=0.005, ram_factor=0.55, ram_post_fbp_blend=0.3, val_n=214, rationale=iter-5 (search-20260619-01, corrected protocol): ONE knob ram_input_norm adjoint_max->fbp_max (all other knobs RETURN to the iter-1 point: ram_factor 0.55, ram_post_fbp_blend 0.3, ram_sigma 0.005, multiscale disabled, finetune OFF). cfg_full audit iters 1-4: ram_input_norm was pinned at adjoint_max since iter-1 and NEVER moved -> it is the one remaining STRUCTURAL inference lever not yet probed (the three already-swept levers are post-hoc linear blend ram_post_fbp_blend [iter-2], internal prox_l2 DC gain ram_factor [iter-3], denoiser noise-conditioning ram_sigma [iter-4]). SEMANTICS (solver_ram.py L360-393): ram_input_norm sets the amplitude scale at which RAMs pretrained denoiser sees its input image; fbp_max normalizes by the FBP-init max (denom=x_init.max) instead of the adjoint-image max -> a DIFFERENT input-distribution amplitude, the last untried structural knob controlling whether the input lands in RAMs training-distribution range. Trajectory under corrected 214-slice/321px-FOV metric: iter-1 SSIM 0.8611 hr 0.0 (blend0.3/factor0.55/sigma0.005/adjoint_max); iter-2 0.8644 hr 0.0 (blend0.3->0.5, post-hoc linear FBP/RAM mix EXHAUSTED); iter-3 0.8968 hr 0.0 PSNR31.58 (factor0.55->0.2, internal prox_l2 DC gain EXHAUSTED); iter-4 0.9024 hr 0.0 PSNR31.22 (sigma0.005->0.02, denoiser noise-conditioning EXHAUSTED). SSIM climbed 0.861->0.902 yet calibrated headroom stayed pinned at EXACTLY 0.0 throughout (baseline LD-FBP SSIM0.8078, oracle HD-FBP 0.9331; RMSE-sensitive metric keeps RAMs ~31dB PSNR below the LD-FBP floor). SIX-BOX (NUMBERS not CT pixels): (1) prev: hr 0.0 on all of post-hoc blend AND internal prox_l2 gain AND denoiser sigma; best SSIM iter-4 0.9024, best hr 0.0. (2) LIMITER: RAM is a frozen pretrained zero-shot deepinv denoiser that never saw real LDCT helical-rebinned 2304-view fan data; on dense full-view Mayo LD-FBP is already a near-complete inversion, so a foreign-prior denoiser can only redistribute/smooth signal, not add LDCT-specific recoverable structure -> its RMSE stays above the LD-FBP floor -> hr pinned at 0. (3) ONE knob: ram_input_norm adjoint_max->fbp_max (the last untried structural lever, the input amplitude scale). (4) hypothesis: hr stays EXACTLY 0.0 -- input-norm scale does not matter because the foreign prior carries no LDCT-specific signal at any input amplitude; predict hr 0. (5) falsifier: if hr at fbp_max != 0.0 (rises OR drops off the 0.0 floor), RAMs input scale DOES move the calibrated metric and RAM is not purely FBP-bounded; if hr stays 0.0 across blend(iter-2)+prox_l2(iter-3)+sigma(iter-4)+input-norm(iter-5), RAM is CONFIRMED structurally FBP-bounded on dense Mayo across ALL FOUR inference levers -> on the documented path to iter-20 as a structural negative. (6) verdict: this iter DOCUMENTS the ceiling. Budget: only the input-norm scale-mode changes -> zero added compute vs iter-4 (iters 3-4 ran 934.6s/976.2s = 15.6-16.3 min for 214 single forward passes + one op-norm power iter), comfortably inside the HARD 20-min (1200s) train+score budget; sbatch --time=00:30:00 backstop wall (no in-solver wall knob in solver_ram.py). val_n stays 214 (score ALL L277 slices @ 321px detector-geometry FOV). HARD-WIRED: staged_canonical, v3 mayo_ldct_fitted, per-sample-ps (single-val-ps probe, val-only solver), bg_target=truth, 321px FOV DEFAULT (no fov=False).", "advice_for_others": "ram_zeroshot-claude-agentic: ram_ckpt_path=/cluster/maier/Agent4CT/checkpoints/ram.pth.tar, ram_input_norm=fbp_max, ram_clamp_output=True, ram_finetune=False, ram_finetune_epochs=0, ram_finetune_lr=0.0001, ram_disable_multiscale=True, ram_disable_cudnn=False, ram_use_deepinv_tomo=False, ram_sigma=0.005, ram_factor=0.55, ram_post_fbp_blend=0.3, val_n=214, rationale=iter-5 (search-20260619-01, corrected protocol): ONE knob ram_input_norm adjoint_max->fbp_max (all other knobs RETURN to the iter-1 point: ram_factor 0.55, ram_post_fbp_blend 0.3, ram_sigma 0.005, multiscale disabled, finetune OFF). cfg_full audit iters 1-4: ram_input_norm was pinned at adjoint_max since iter-1 and NEVER moved -> it is the one remaining STRUCTURAL inference lever not yet probed (the three already-swept levers are post-hoc linear blend ram_post_fbp_blend [iter-2], internal prox_l2 DC gain ram_factor [iter-3], denoiser noise-conditioning ram_sigma [iter-4]). SEMANTICS (solver_ram.py L360-393): ram_input_norm sets the amplitude scale at which RAMs pretrained denoiser sees its input image; fbp_max normalizes by the FBP-init max (denom=x_init.max) instead of the adjoint-image max -> a DIFFERENT input-distribution amplitude, the last untried structural knob controlling whether the input lands in RAMs training-distribution range. Trajectory under corrected 214-slice/321px-FOV metric: iter-1 SSIM 0.8611 hr 0.0 (blend0.3/factor0.55/sigma0.005/adjoint_max); iter-2 0.8644 hr 0.0 (blend0.3->0.5, post-hoc linear FBP/RAM mix EXHAUSTED); iter-3 0.8968 hr 0.0 PSNR31.58 (factor0.55->0.2, internal prox_l2 DC gain EXHAUSTED); iter-4 0.9024 hr 0.0 PSNR31.22 (sigma0.005->0.02, denoiser noise-conditioning EXHAUSTED). SSIM climbed 0.861->0.902 yet calibrated headroom stayed pinned at EXACTLY 0.0 throughout (baseline LD-FBP SSIM0.8078, oracle HD-FBP 0.9331; RMSE-sensitive metric keeps RAMs ~31dB PSNR below the LD-FBP floor). SIX-BOX (NUMBERS not CT pixels): (1) prev: hr 0.0 on all of post-hoc blend AND internal prox_l2 gain AND denoiser sigma; best SSIM iter-4 0.9024, best hr 0.0. (2) LIMITER: RAM is a frozen pretrained zero-shot deepinv denoiser that never saw real LDCT helical-rebinned 2304-view fan data; on dense full-view Mayo LD-FBP is already a near-complete inversion, so a foreign-prior denoiser can only redistribute/smooth signal, not add LDCT-specific recoverable structure -> its RMSE stays above the LD-FBP floor -> hr pinned at 0. (3) ONE knob: ram_input_norm adjoint_max->fbp_max (the last untried structural lever, the input amplitude scale). (4) hypothesis: hr stays EXACTLY 0.0 -- input-norm scale does not matter because the foreign prior carries no LDCT-specific signal at any input amplitude; predict hr 0. (5) falsifier: if hr at fbp_max != 0.0 (rises OR drops off the 0.0 floor), RAMs input scale DOES move the calibrated metric and RAM is not purely FBP-bounded; if hr stays 0.0 across blend(iter-2)+prox_l2(iter-3)+sigma(iter-4)+input-norm(iter-5), RAM is CONFIRMED structurally FBP-bounded on dense Mayo across ALL FOUR inference levers -> on the documented path to iter-20 as a structural negative. (6) verdict: this iter DOCUMENTS the ceiling. Budget: only the input-norm scale-mode changes -> zero added compute vs iter-4 (iters 3-4 ran 934.6s/976.2s = 15.6-16.3 min for 214 single forward passes + one op-norm power iter), comfortably inside the HARD 20-min (1200s) train+score budget; sbatch --time=00:30:00 backstop wall (no in-solver wall knob in solver_ram.py). val_n stays 214 (score ALL L277 slices @ 321px detector-geometry FOV). HARD-WIRED: staged_canonical, v3 mayo_ldct_fitted, per-sample-ps (single-val-ps probe, val-only solver), bg_target=truth, 321px FOV DEFAULT (no fov=False).", "comparison_image": "runs/mayo-ldct-claude-agentic-ram-search-20260619-01/iterations/iter-0005/comparison.png"}
{"ts": "2026-06-20T10:12:16Z", "run_id": "mayo-ldct-claude-agentic-hammernik-2017-search-20260619-01", "iter": 7, "agent": "hammernik_2017-claude-agentic", "model": "claude-opus-4-8-1m", "change_class": "architecture", "status": "keep", "kept": true, "val_score": 0.8169611692428589, "headroom": 0.03745864194761772, "params_M": 0.012165, "train_n": 400, "rationale": "hammernik_2017-claude-agentic: vn_T=5, vn_n_filters=16, vn_kernel=11, vn_n_bumps=31, vn_x_range=2.0, vn_lambda_init=0.0023, epochs=10, batch_size=1, lr=0.0005, grad_clip=1.0, train_n=200, val_n=214, max_train_s=1050, seed=42, rationale=hammernik_2017 iter-7 (search-20260619-01, corrected 214-slice/321px-FOV metric). ONE KNOB: batch_size 2 -> 1. BASE_ITER=5 (the BEST + only above-baseline point: SSIM 0.8114, hr 0.0319, ep19/bs2/lr5e-4/lambda0.0023/n_filters16) -- reverting AWAY from iter-6 (lr 3e-4 REGRESSED to 0.7883/hr0). epochs traded 19->10 purely to fit the HARD 1200s budget at bs=1 (NOT a second hypothesis knob); max_train_s 1100->1050 backstop. TRAJECTORY (corrected metric): iter-1 OOM(bs4); iter-2 0.8012 hr0; iter-3 0.7932 hr0 (lambda 0.0023->0.05 REGRESSED); iter-4 0.7828 hr0 (n_filters 16->4 REGRESSED); iter-5 0.8114 hr0.0319 KEEP (epochs 14->19, FIRST above the ~0.84 LD-FBP floor, under-training diagnosis CONFIRMED); iter-6 0.7883 hr0 DISCARD (lr 5e-4->3e-4 REGRESSED -- lower lr starved the under-trained net, iter-6 falsifier TRIGGERED). best hr = 0.0319 @iter-5. LIMITER (box2): under-convergence at the wall-pinned epoch budget. iter-5 confirmed the epochs lever works but ep19 is WALL-PINNED (one more epoch overruns 1200s at 56.4s/epoch bs=2); iter-6 proved lr-down does not help (it starves, not stabilizes). The ONLY remaining within-budget step-count lever is batch_size DOWN: bs=1 doubles batches/epoch (train_n=200 -> 200 batches/epoch vs 100 at bs=2), i.e. doubles optimizer steps per epoch -- the iter-6 PRE-REGISTERED falsifier path (iter-6: if hr<=0.0319, iter-7 must trade gradient STEPS via batch_size 2->1). ONE KNOB CHOICE (box3): batch_size 2->1, base = iter-5 BEST (lr=5e-4 RESTORED, lambda=0.0023, n_filters=16, vn_T=5, kernel=11, n_bumps=31, x_range=2.0, grad_clip=1.0, train_n=200, val_n=214, seed=42 all held). HYPOTHESIS (box4): bs=1 gives 2x optimizer steps/epoch; even with epochs traded 19->10 the step count rises 1900 (bs2 x ep19) -> 2000 (bs1 x ep10 x 200/epoch), and each step on a smaller batch is a noisier/finer descent that the under-trained VN benefits from -> predict val_ssim rises above 0.8114 (hr > 0.0319), targeting ~0.82-0.83 / hr ~0.04-0.06. FALSIFIER (terminal): if hr <= 0.0319 at bs=1, hammernik_2017s 20-min budget is genuinely convergence-bounded -- doubling steps via bs-down cannot reach the proven ep38/bs1 (7600-step) convergence basin within 1200s -> its ceiling is ~0.032 and the budget-bounded ceiling is DOCUMENTED (no within-budget step-count lever remains: epochs wall-pinned, lr-down failed, bs already at the minimum). BUDGET (box5, HARD 1200s train+score; sbatch --time=00:30:00): bs=1 doubles batches/epoch AND loses within-batch parallelism + adds per-sample projector swaps, so per-epoch wall rises from 56.4s (bs2) to ~95-105s (bs1, ~1.7-1.9x). At ~105s/epoch x 10 epochs = ~1050s train + ~95s score(214)+figure = ~1145s predicted elapsed < 1200s; max_train_s=1050 backstop trips before the figure, well under the 1800s SLURM kill. If per-epoch lands lighter (~95s) the max_train_s wall stops training at ~ep11, still in-budget. MEMORY-SAFE (SAFER than bs=2): batch_size=1 HALVES the (B,F,H,W)=(1,16,512,512) x 31-bump RBF activation tensors held across 5 unrolled steps vs bs=2 -- strictly less than the iter-5 footprint that already fit 16 GB (bs=4 was the OOM, bs=1 is the safest point). N_k=16, grad_clip=1.0 retained (VN-family NaN-skip stability).", "advice_for_others": "hammernik_2017-claude-agentic: vn_T=5, vn_n_filters=16, vn_kernel=11, vn_n_bumps=31, vn_x_range=2.0, vn_lambda_init=0.0023, epochs=10, batch_size=1, lr=0.0005, grad_clip=1.0, train_n=200, val_n=214, max_train_s=1050, seed=42, rationale=hammernik_2017 iter-7 (search-20260619-01, corrected 214-slice/321px-FOV metric). ONE KNOB: batch_size 2 -> 1. BASE_ITER=5 (the BEST + only above-baseline point: SSIM 0.8114, hr 0.0319, ep19/bs2/lr5e-4/lambda0.0023/n_filters16) -- reverting AWAY from iter-6 (lr 3e-4 REGRESSED to 0.7883/hr0). epochs traded 19->10 purely to fit the HARD 1200s budget at bs=1 (NOT a second hypothesis knob); max_train_s 1100->1050 backstop. TRAJECTORY (corrected metric): iter-1 OOM(bs4); iter-2 0.8012 hr0; iter-3 0.7932 hr0 (lambda 0.0023->0.05 REGRESSED); iter-4 0.7828 hr0 (n_filters 16->4 REGRESSED); iter-5 0.8114 hr0.0319 KEEP (epochs 14->19, FIRST above the ~0.84 LD-FBP floor, under-training diagnosis CONFIRMED); iter-6 0.7883 hr0 DISCARD (lr 5e-4->3e-4 REGRESSED -- lower lr starved the under-trained net, iter-6 falsifier TRIGGERED). best hr = 0.0319 @iter-5. LIMITER (box2): under-convergence at the wall-pinned epoch budget. iter-5 confirmed the epochs lever works but ep19 is WALL-PINNED (one more epoch overruns 1200s at 56.4s/epoch bs=2); iter-6 proved lr-down does not help (it starves, not stabilizes). The ONLY remaining within-budget step-count lever is batch_size DOWN: bs=1 doubles batches/epoch (train_n=200 -> 200 batches/epoch vs 100 at bs=2), i.e. doubles optimizer steps per epoch -- the iter-6 PRE-REGISTERED falsifier path (iter-6: if hr<=0.0319, iter-7 must trade gradient STEPS via batch_size 2->1). ONE KNOB CHOICE (box3): batch_size 2->1, base = iter-5 BEST (lr=5e-4 RESTORED, lambda=0.0023, n_filters=16, vn_T=5, kernel=11, n_bumps=31, x_range=2.0, grad_clip=1.0, train_n=200, val_n=214, seed=42 all held). HYPOTHESIS (box4): bs=1 gives 2x optimizer steps/epoch; even with epochs traded 19->10 the step count rises 1900 (bs2 x ep19) -> 2000 (bs1 x ep10 x 200/epoch), and each step on a smaller batch is a noisier/finer descent that the under-trained VN benefits from -> predict val_ssim rises above 0.8114 (hr > 0.0319), targeting ~0.82-0.83 / hr ~0.04-0.06. FALSIFIER (terminal): if hr <= 0.0319 at bs=1, hammernik_2017s 20-min budget is genuinely convergence-bounded -- doubling steps via bs-down cannot reach the proven ep38/bs1 (7600-step) convergence basin within 1200s -> its ceiling is ~0.032 and the budget-bounded ceiling is DOCUMENTED (no within-budget step-count lever remains: epochs wall-pinned, lr-down failed, bs already at the minimum). BUDGET (box5, HARD 1200s train+score; sbatch --time=00:30:00): bs=1 doubles batches/epoch AND loses within-batch parallelism + adds per-sample projector swaps, so per-epoch wall rises from 56.4s (bs2) to ~95-105s (bs1, ~1.7-1.9x). At ~105s/epoch x 10 epochs = ~1050s train + ~95s score(214)+figure = ~1145s predicted elapsed < 1200s; max_train_s=1050 backstop trips before the figure, well under the 1800s SLURM kill. If per-epoch lands lighter (~95s) the max_train_s wall stops training at ~ep11, still in-budget. MEMORY-SAFE (SAFER than bs=2): batch_size=1 HALVES the (B,F,H,W)=(1,16,512,512) x 31-bump RBF activation tensors held across 5 unrolled steps vs bs=2 -- strictly less than the iter-5 footprint that already fit 16 GB (bs=4 was the OOM, bs=1 is the safest point). N_k=16, grad_clip=1.0 retained (VN-family NaN-skip stability).", "comparison_image": "runs/mayo-ldct-claude-agentic-hammernik-2017-search-20260619-01/iterations/iter-0007/comparison.png"}
