{"ts": "2026-06-21T13:09:51Z", "run_id": "mayo-ldct-claude-agentic-itnet-v2-search-20260619-01", "iter": 9, "agent": "itnet_v2-claude-agentic", "model": "claude-opus-4-8-1m", "change_class": "architecture", "status": "keep", "kept": true, "val_score": 0.9446306824684143, "headroom": 0.4201258723589334, "params_M": 0.522698, "train_n": 400, "rationale": "itnet_v2-claude-agentic: itnet_k=1, unet_c=24, itnet_alpha_init=0.0037, residual_learning=False, pretrain_lr=0.0001, pretrain_epochs=40, pretrain_patience=40, batch_size=1, val_chunk=1, train_n=579, val_n=214, grad_clip=1.0, max_train_s=1050, seed=42, rationale=ITER-9 (search-20260619-01, corrected 214-slice/321px-FOV metric). DATA LEVER MAXED -> push the CAPACITY lever. ONE KNOB: unet_c 16->24 (denoiser SmallUNet width +50%), funded by trading pretrain_epochs 72->40 (pretrain_patience tracked 72->40, early-stop disabled) to HOLD the HARD 1200s train+score wall. Base=iter-8 (BOARD CHAMPION, NEW #1, SSIM 0.9427/hr 0.4302 @itnet_k=1/train_n=579/ep72). KEEP itnet_k=1 (iter-7 breakout), residual_learning=False (mandatory config-fix), train_n=579 (FULL 579-slice pool, MAXED at iter-8 -> data coverage exhausted). SIX-BOX (NUMBERS, hr=metric of record): (1) TRAJECTORY: iter-1 SSIM 0.4554/hr0 @ep12/tn200/k3; iter-7 0.9414/hr 0.4187 @k1/tn400/ep120 (k=3->1 BREAKOUT); iter-8 0.9427/hr 0.4302 @tn579/ep72 (train_n 400->579 full pool, +0.0115 hr, BEST). CURRENT pretrain_epochs=72, unet_c=16, train_n=579. (2) LIMITER: both DATA levers are exhausted -- itnet_k=1 (iter-7) and train_n=579 full pool (iter-8). The PRIMARY remaining lever pretrain_epochs UP is BUDGET-PINNED: iter-8 ran 1219.7s @ep72/tn579 (max_train_s=1050 backstop fired); at tn579 per-epoch ~12.6s and fixed val+figure ~312s, so pretrain budget = 1200-312 = 888s caps epochs at ~70 -- ep72 is already AT the wall, cannot raise. So the binding in-budget lever is DENOISER CAPACITY (unet_c), the explicit fallback once pretrain_epochs is budget-capped. (3) ONE KNOB: unet_c 16->24, pretrain_epochs traded 72->40 to hold the 1200s wall. (4) HYPOTHESIS: a wider denoiser (c24 vs c16) on the full 579-slice pool lifts val_ssim/hr ABOVE iter-8 0.4302 because the data is now maxed and the c16 SmallUNet may underfit the full anatomical variety; more capacity captures it. NUMERIC FALSIFIER: if hr <= 0.4302 (flat/down) at unet_c=24/ep40, the c16 denoiser was NOT capacity-limited (the ep40 cut traded away more convergence than the width added, OR the family is saturated at the 0.43 ceiling) -- iter-10 reverts unet_c->16 and documents the champion ceiling. (5) BUDGET: HARD 20-min (1200s) train+score. c24 SmallUNet body conv FLOPs ~2.25x c16 but per-epoch rises ~1.8x (not all cost is conv); ep40 at tn579: 40 * ~12.6 * 1.8 ~ 907s pretrain + 312s fixed val+figure ... trim toward ep40 = ~888s pretrain target. max_train_s=1050 (17.5-min HARD backstop) GUARANTEES the 214-slice per-sample val + figure finish inside the 30-min (1800s) sbatch wall. val_n=214 KEPT (ALL L277 slices), grad_clip=1.0 KEPT. (6) Loop continues -- no control returned. HARD-WIRED (unchanged): staged_canonical data, v3 mayo_ldct_fitted geometry, per-sample-ps (itnet.projector swap, bs=1+val_chunk=1 FORCED), bg_target=truth, val=ALL 214 L277 slices under the 321px detector-geometry FOV (no fov= override), grad_clip retained, itnet_k=1 KEPT, residual_learning=False KEPT, train_n=579 KEPT (data MAXED).", "advice_for_others": "itnet_v2-claude-agentic: itnet_k=1, unet_c=24, itnet_alpha_init=0.0037, residual_learning=False, pretrain_lr=0.0001, pretrain_epochs=40, pretrain_patience=40, batch_size=1, val_chunk=1, train_n=579, val_n=214, grad_clip=1.0, max_train_s=1050, seed=42, rationale=ITER-9 (search-20260619-01, corrected 214-slice/321px-FOV metric). DATA LEVER MAXED -> push the CAPACITY lever. ONE KNOB: unet_c 16->24 (denoiser SmallUNet width +50%), funded by trading pretrain_epochs 72->40 (pretrain_patience tracked 72->40, early-stop disabled) to HOLD the HARD 1200s train+score wall. Base=iter-8 (BOARD CHAMPION, NEW #1, SSIM 0.9427/hr 0.4302 @itnet_k=1/train_n=579/ep72). KEEP itnet_k=1 (iter-7 breakout), residual_learning=False (mandatory config-fix), train_n=579 (FULL 579-slice pool, MAXED at iter-8 -> data coverage exhausted). SIX-BOX (NUMBERS, hr=metric of record): (1) TRAJECTORY: iter-1 SSIM 0.4554/hr0 @ep12/tn200/k3; iter-7 0.9414/hr 0.4187 @k1/tn400/ep120 (k=3->1 BREAKOUT); iter-8 0.9427/hr 0.4302 @tn579/ep72 (train_n 400->579 full pool, +0.0115 hr, BEST). CURRENT pretrain_epochs=72, unet_c=16, train_n=579. (2) LIMITER: both DATA levers are exhausted -- itnet_k=1 (iter-7) and train_n=579 full pool (iter-8). The PRIMARY remaining lever pretrain_epochs UP is BUDGET-PINNED: iter-8 ran 1219.7s @ep72/tn579 (max_train_s=1050 backstop fired); at tn579 per-epoch ~12.6s and fixed val+figure ~312s, so pretrain budget = 1200-312 = 888s caps epochs at ~70 -- ep72 is already AT the wall, cannot raise. So the binding in-budget lever is DENOISER CAPACITY (unet_c), the explicit fallback once pretrain_epochs is budget-capped. (3) ONE KNOB: unet_c 16->24, pretrain_epochs traded 72->40 to hold the 1200s wall. (4) HYPOTHESIS: a wider denoiser (c24 vs c16) on the full 579-slice pool lifts val_ssim/hr ABOVE iter-8 0.4302 because the data is now maxed and the c16 SmallUNet may underfit the full anatomical variety; more capacity captures it. NUMERIC FALSIFIER: if hr <= 0.4302 (flat/down) at unet_c=24/ep40, the c16 denoiser was NOT capacity-limited (the ep40 cut traded away more convergence than the width added, OR the family is saturated at the 0.43 ceiling) -- iter-10 reverts unet_c->16 and documents the champion ceiling. (5) BUDGET: HARD 20-min (1200s) train+score. c24 SmallUNet body conv FLOPs ~2.25x c16 but per-epoch rises ~1.8x (not all cost is conv); ep40 at tn579: 40 * ~12.6 * 1.8 ~ 907s pretrain + 312s fixed val+figure ... trim toward ep40 = ~888s pretrain target. max_train_s=1050 (17.5-min HARD backstop) GUARANTEES the 214-slice per-sample val + figure finish inside the 30-min (1800s) sbatch wall. val_n=214 KEPT (ALL L277 slices), grad_clip=1.0 KEPT. (6) Loop continues -- no control returned. HARD-WIRED (unchanged): staged_canonical data, v3 mayo_ldct_fitted geometry, per-sample-ps (itnet.projector swap, bs=1+val_chunk=1 FORCED), bg_target=truth, val=ALL 214 L277 slices under the 321px detector-geometry FOV (no fov= override), grad_clip retained, itnet_k=1 KEPT, residual_learning=False KEPT, train_n=579 KEPT (data MAXED).", "comparison_image": "runs/mayo-ldct-claude-agentic-itnet-v2-search-20260619-01/iterations/iter-0009/comparison.png"}
{"ts": "2026-06-21T12:56:17Z", "run_id": "mayo-ldct-claude-agentic-ram-search-20260619-01", "iter": 8, "agent": "ram_zeroshot-claude-agentic", "model": "claude-opus-4-8-1m", "change_class": "architecture", "status": "discard", "kept": false, "val_score": 0.9070974588394165, "headroom": 0.0, "params_M": 35.618953, "train_n": 400, "rationale": "ram_zeroshot-claude-agentic: ram_ckpt_path=/cluster/maier/Agent4CT/checkpoints/ram.pth.tar, ram_input_norm=fbp_max, ram_clamp_output=True, ram_finetune=False, ram_finetune_epochs=0, ram_finetune_lr=0.0001, ram_disable_multiscale=True, ram_disable_cudnn=False, ram_use_deepinv_tomo=False, ram_sigma=0.005, ram_factor=0.55, ram_post_fbp_blend=0.3, val_n=214, rationale=iter-8 (search-20260619-01) CLEAN CEILING CONFIRMATION + finetune-retirement, toward the iter-20 mandate. BASE_ITER=5 = the BEST inference config (SSIM 0.9071 hr 0.0: ram_input_norm=fbp_max, ram_factor=0.55, ram_post_fbp_blend=0.3, ram_sigma=0.005, multiscale OFF, finetune OFF, deepinv_tomo OFF), empty patch {} -> bit-identical re-run of the best point. RAM is the LAST maxiter-7 solver (other 18 at iter-8). SIX-BOX (NUMBERS not CT pixels): (1) TRAJECTORY + MAPPED LEVERS: SSIM 0.8611->0.8644->0.8968->0.9024->0.9071 (iters 1-5), hr pinned EXACTLY 0.0 throughout; ALL FIVE inference levers swept & exhausted at hr 0.0 -- post-hoc linear blend ram_post_fbp_blend [i2 0.3->0.5], internal prox_l2 DC gain ram_factor [i3 0.55->0.2], denoiser noise-conditioning ram_sigma [i4 0.005->0.02], input-amplitude norm ram_input_norm [i5 adjoint_max->fbp_max], deepinv-tomo DC physics path ram_use_deepinv_tomo [i6 False->True, regression]; the per-slice self-supervised ram_finetune lever is BUDGET-INFEASIBLE (~80s/slice x214 = ~4.7h, 14x over the 1200s HARD budget, TIMED OUT at the prior iter-7 first attempt, solver has NO amortize-once/finetune-subset/train-split mode -> structurally per-sinogram, hoisting it out of the per-slice loop would require editing the FORBIDDEN solver). iter-7 already reverted to the best inference config (SSIM 0.9071, deterministic re-read identical to iter-5: val_score 0.9070974588394165 both). (2) LIMITER: foreign-prior FBP-ceiling on dense Mayo. RAM is a frozen pretrained zero-shot deepinv foundation-model denoiser that never saw real LDCT helical-rebinned 2304-view fan data; on dense full-view Mayo LD-FBP is already a near-complete inversion, so a foreign-prior denoiser can only redistribute/smooth signal, not add LDCT-specific recoverable structure -> its RMSE stays above the LD-FBP floor (~31-33dB PSNR below the floor) -> calibrated headroom pinned at 0.0 (baseline LD-FBP SSIM 0.8078, oracle HD-FBP SSIM 0.9331; best RAM SSIM 0.9071 is below the LD-FBP floor on the RMSE-sensitive metric). (3) ONE KNOB: NONE genuinely-untried in-budget exists -- audited: ram_disable_multiscale True->False would re-enable per-scale physics evals across 214 slices (iter-1 noted multiscale-disabled CUTS per-slice physics evals), pushing the already-985s inference path over the 1200s wall WITHOUT being an inference-quality lever (changes runtime, not whether the foreign prior carries LDCT signal); ram_clamp_output True->False is degenerate on an RMSE-sensitive metric (unclamping can only let pixels drift out of range = neutral-or-worse, non-diagnostic); there is no seed lever (zero-shot single-forward-pass denoiser is deterministic, frozen weights/no sampling -> iter-5 & iter-7 reproduced SSIM 0.9070974588394165 BIT-IDENTICALLY); ram_finetune is budget-infeasible. => iter-8 runs the CLEAN CONFIRMATION: re-run the best inference point (empty patch on BASE_ITER=5) to document RAM as FBP-bounded on dense 2304-view Mayo. (4) HYPOTHESIS: hr stays EXACTLY 0.0 at SSIM 0.9071 (bit-identical determinism). NUMERIC FALSIFIER: if this re-run lands hr != 0.0 OR SSIM != 0.9070974588394165, the iter-5/iter-7 reads were NOT stable (non-determinism in the zero-shot path) and the ceiling read must be re-audited; otherwise the FBP-bound ceiling is confirmed for the 3rd time and the finetune lever is retired as budget-infeasible (NOT a negative architectural result). (5) SIZE/BUDGET <=1200s: INFERENCE-ONLY (ram_finetune=False), IDENTICAL compute profile to iter-5/iter-7 (985.9s/989.8s = 16.4 min, ~4.6s/slice x 214 single forward passes + one op-norm power iter), comfortably under the HARD 1200s=20-min budget; ram_use_deepinv_tomo=False avoids extra deepinv-tomo physics evals; ZERO finetune cost (finetune OFF, NOT enabled). sbatch --time=00:30:00 backstop wall (no in-solver wall knob in solver_ram.py). val=ALL 214 L277 slices. (6) no control return. HARD-WIRED: staged_canonical, v3 mayo_ldct_fitted geom, per-sample-ps (single-val-ps probe, val-only solver), bg_target=truth, val=ALL 214 L277, 321px FOV DEFAULT (no fov=False). NEVER edit ddssl_ldct/ or the solver file.", "advice_for_others": "ram_zeroshot-claude-agentic: ram_ckpt_path=/cluster/maier/Agent4CT/checkpoints/ram.pth.tar, ram_input_norm=fbp_max, ram_clamp_output=True, ram_finetune=False, ram_finetune_epochs=0, ram_finetune_lr=0.0001, ram_disable_multiscale=True, ram_disable_cudnn=False, ram_use_deepinv_tomo=False, ram_sigma=0.005, ram_factor=0.55, ram_post_fbp_blend=0.3, val_n=214, rationale=iter-8 (search-20260619-01) CLEAN CEILING CONFIRMATION + finetune-retirement, toward the iter-20 mandate. BASE_ITER=5 = the BEST inference config (SSIM 0.9071 hr 0.0: ram_input_norm=fbp_max, ram_factor=0.55, ram_post_fbp_blend=0.3, ram_sigma=0.005, multiscale OFF, finetune OFF, deepinv_tomo OFF), empty patch {} -> bit-identical re-run of the best point. RAM is the LAST maxiter-7 solver (other 18 at iter-8). SIX-BOX (NUMBERS not CT pixels): (1) TRAJECTORY + MAPPED LEVERS: SSIM 0.8611->0.8644->0.8968->0.9024->0.9071 (iters 1-5), hr pinned EXACTLY 0.0 throughout; ALL FIVE inference levers swept & exhausted at hr 0.0 -- post-hoc linear blend ram_post_fbp_blend [i2 0.3->0.5], internal prox_l2 DC gain ram_factor [i3 0.55->0.2], denoiser noise-conditioning ram_sigma [i4 0.005->0.02], input-amplitude norm ram_input_norm [i5 adjoint_max->fbp_max], deepinv-tomo DC physics path ram_use_deepinv_tomo [i6 False->True, regression]; the per-slice self-supervised ram_finetune lever is BUDGET-INFEASIBLE (~80s/slice x214 = ~4.7h, 14x over the 1200s HARD budget, TIMED OUT at the prior iter-7 first attempt, solver has NO amortize-once/finetune-subset/train-split mode -> structurally per-sinogram, hoisting it out of the per-slice loop would require editing the FORBIDDEN solver). iter-7 already reverted to the best inference config (SSIM 0.9071, deterministic re-read identical to iter-5: val_score 0.9070974588394165 both). (2) LIMITER: foreign-prior FBP-ceiling on dense Mayo. RAM is a frozen pretrained zero-shot deepinv foundation-model denoiser that never saw real LDCT helical-rebinned 2304-view fan data; on dense full-view Mayo LD-FBP is already a near-complete inversion, so a foreign-prior denoiser can only redistribute/smooth signal, not add LDCT-specific recoverable structure -> its RMSE stays above the LD-FBP floor (~31-33dB PSNR below the floor) -> calibrated headroom pinned at 0.0 (baseline LD-FBP SSIM 0.8078, oracle HD-FBP SSIM 0.9331; best RAM SSIM 0.9071 is below the LD-FBP floor on the RMSE-sensitive metric). (3) ONE KNOB: NONE genuinely-untried in-budget exists -- audited: ram_disable_multiscale True->False would re-enable per-scale physics evals across 214 slices (iter-1 noted multiscale-disabled CUTS per-slice physics evals), pushing the already-985s inference path over the 1200s wall WITHOUT being an inference-quality lever (changes runtime, not whether the foreign prior carries LDCT signal); ram_clamp_output True->False is degenerate on an RMSE-sensitive metric (unclamping can only let pixels drift out of range = neutral-or-worse, non-diagnostic); there is no seed lever (zero-shot single-forward-pass denoiser is deterministic, frozen weights/no sampling -> iter-5 & iter-7 reproduced SSIM 0.9070974588394165 BIT-IDENTICALLY); ram_finetune is budget-infeasible. => iter-8 runs the CLEAN CONFIRMATION: re-run the best inference point (empty patch on BASE_ITER=5) to document RAM as FBP-bounded on dense 2304-view Mayo. (4) HYPOTHESIS: hr stays EXACTLY 0.0 at SSIM 0.9071 (bit-identical determinism). NUMERIC FALSIFIER: if this re-run lands hr != 0.0 OR SSIM != 0.9070974588394165, the iter-5/iter-7 reads were NOT stable (non-determinism in the zero-shot path) and the ceiling read must be re-audited; otherwise the FBP-bound ceiling is confirmed for the 3rd time and the finetune lever is retired as budget-infeasible (NOT a negative architectural result). (5) SIZE/BUDGET <=1200s: INFERENCE-ONLY (ram_finetune=False), IDENTICAL compute profile to iter-5/iter-7 (985.9s/989.8s = 16.4 min, ~4.6s/slice x 214 single forward passes + one op-norm power iter), comfortably under the HARD 1200s=20-min budget; ram_use_deepinv_tomo=False avoids extra deepinv-tomo physics evals; ZERO finetune cost (finetune OFF, NOT enabled). sbatch --time=00:30:00 backstop wall (no in-solver wall knob in solver_ram.py). val=ALL 214 L277 slices. (6) no control return. HARD-WIRED: staged_canonical, v3 mayo_ldct_fitted geom, per-sample-ps (single-val-ps probe, val-only solver), bg_target=truth, val=ALL 214 L277, 321px FOV DEFAULT (no fov=False). NEVER edit ddssl_ldct/ or the solver file.", "comparison_image": "runs/mayo-ldct-claude-agentic-ram-search-20260619-01/iterations/iter-0008/comparison.png"}
