{"ts": "2026-06-20T04:06:25Z", "run_id": "mayo-ldct-claude-agentic-hammernik-vn-search-20260619-01", "iter": 4, "agent": "hammernik_vn-claude-agentic", "model": "claude-opus-4-8-1m", "change_class": "architecture", "status": "discard", "kept": false, "val_score": 0.7336302995681763, "headroom": 0.0, "params_M": 0.018245, "train_n": 400, "rationale": "hammernik_vn-claude-agentic: vn_T=5, vn_n_filters=24, vn_kernel=11, vn_n_bumps=31, vn_x_range=1.0, vn_lambda_init=0.05, vn_init=fbp, vn_dc_norm=True, vn_checkpoint=True, vn_normalize_filters=True, epochs=10, batch_size=2, lr=0.0005, grad_clip=1.0, train_n=200, val_n=214, max_train_s=1000, seed=42, rationale=hammernik_vn iter-4 (search-20260619-01, corrected 214-slice/321px-FOV metric). LAST-LEVER / confirmation iter. ONE KNOB on the REGULARIZER (not capacity, not lambda): vn_normalize_filters False -> True (constrain each learned filter K_i to zero-mean + unit-norm, the paper-faithful constraint, solver _effective_weight lines 119-128). All else held at iter-3 (vn_T=5, vn_n_filters=24, vn_kernel=11, vn_n_bumps=31, vn_lambda_init=0.05, lr=5e-4, batch_size=2, vn_checkpoint=true, grad_clip=1.0, vn_dc_norm=true, vn_init=fbp, max_train_s=1000, train_n=200, val_n=214, seed=42). TRAJECTORY (NUMBERS, all hr=0, all BELOW the ~0.84 LD-FBP floor): iter-1 SSIM 0.80528 (vn_n_filters=16, elapsed 1295.7s); iter-2 SSIM 0.79195 (vn_n_filters=24, capacity UP -> REGRESSED -0.0133, elapsed 1351.7s); iter-3 SSIM 0.768197 (vn_lambda_init 0.0023->0.05, DC-weight ~22x UP -> REGRESSED -0.0238, elapsed 1159.6s, val_psnr 32.07, val_rmse 1.246e-3). BOTH structural levers already attacked the wrong thing: capacity-UP regressed AND DC-weight-UP regressed, so the recon sits monotonically BELOW its own FBP init (baseline SSIM ~0.84, baseline_PSNR 34.08). FAILURE MODE (well-characterized): the learned VN regulariser term Sum_i K_i^T rho'_i(K_i u) is a BLUNT SMOOTHER that degrades the FBP init below baseline, and it does so REGARDLESS of capacity (filters^ hurt) or DC weight (lambda^ hurt). This FIRES iter-3's own pre-registered falsifier: 'if SSIM stays <=0.84 under strong DC, the VN regulariser is structurally degrading -> iter-4 attacks the regulariser itself: vn_normalize_filters=True OR vn_init=backproj'. CHOICE OF KNOB (most diagnostic remaining): vn_normalize_filters=True is the SHARPEST test of the smoothing diagnosis, and is preferred over vn_init=backproj (which changes only the init, not the regularizer mechanism, and the baseline is pinned to FBP either way). MECHANISM: zero-mean filters have NO DC response -- conv with a zero-mean kernel annihilates any uniform/low-frequency level component -- so a zero-mean-unit-norm-constrained K_i CANNOT apply a uniform smoothing or level shift to the image; the regulariser term can only act on local CONTRAST (edges/texture). Unit-norm caps each filter's gain so no single filter can dominate and over-smooth. If the iter-1/2/3 degradation was the unconstrained filters collapsing to a DC/low-pass smoother, this constraint removes that failure path -> the recon should stop sinking below the FBP init and hr should rise toward / above 0. HYPOTHESIS: with zero-mean unit-norm filters the regulariser stops smoothing the FBP init below baseline; val_ssim clears the ~0.84 FBP floor (hr > 0). FALSIFIER (the terminal one): if val_ssim still <= 0.84 (below FBP) with the regulariser CONSTRAINED, then hammernik_vn is STRUCTURALLY FBP-BOUNDED on rebinned Mayo regardless of regulariser config (capacity, DC weight, AND filter constraint all exhausted) -> file the NEGATIVE RESULT: the Hammernik-VN learned-regulariser family does not beat LD-FBP on real 2304-view Mayo LDCT, and drive the remaining iters to document the ceiling, not chase it. BUDGET (HARD 20-min train+score; sbatch --time=00:30:00): the zero-mean/unit-norm normalization is a cheap per-step reshape (filter tensor is (24,1,11,11)); per-step forward/back-project DC cost is IDENTICAL to iter-3, so wall ~= iter-3 (1159.6s) -- well under the 1800s SLURM kill, ~640s margin. MEMORY-SAFE: identical footprint to iter-3 -- batch_size=2 + vn_checkpoint=true keep N_k=24 within the 16 GB RTX5000 (no OOM; cf. the hammernik_2017 bs=4 OOM at 72s). grad_clip=1.0 retained (VN-family NaN-skip stability; the 2304-view Mayo FBP adjoint overflows the backward otherwise).", "advice_for_others": "hammernik_vn-claude-agentic: vn_T=5, vn_n_filters=24, vn_kernel=11, vn_n_bumps=31, vn_x_range=1.0, vn_lambda_init=0.05, vn_init=fbp, vn_dc_norm=True, vn_checkpoint=True, vn_normalize_filters=True, epochs=10, batch_size=2, lr=0.0005, grad_clip=1.0, train_n=200, val_n=214, max_train_s=1000, seed=42, rationale=hammernik_vn iter-4 (search-20260619-01, corrected 214-slice/321px-FOV metric). LAST-LEVER / confirmation iter. ONE KNOB on the REGULARIZER (not capacity, not lambda): vn_normalize_filters False -> True (constrain each learned filter K_i to zero-mean + unit-norm, the paper-faithful constraint, solver _effective_weight lines 119-128). All else held at iter-3 (vn_T=5, vn_n_filters=24, vn_kernel=11, vn_n_bumps=31, vn_lambda_init=0.05, lr=5e-4, batch_size=2, vn_checkpoint=true, grad_clip=1.0, vn_dc_norm=true, vn_init=fbp, max_train_s=1000, train_n=200, val_n=214, seed=42). TRAJECTORY (NUMBERS, all hr=0, all BELOW the ~0.84 LD-FBP floor): iter-1 SSIM 0.80528 (vn_n_filters=16, elapsed 1295.7s); iter-2 SSIM 0.79195 (vn_n_filters=24, capacity UP -> REGRESSED -0.0133, elapsed 1351.7s); iter-3 SSIM 0.768197 (vn_lambda_init 0.0023->0.05, DC-weight ~22x UP -> REGRESSED -0.0238, elapsed 1159.6s, val_psnr 32.07, val_rmse 1.246e-3). BOTH structural levers already attacked the wrong thing: capacity-UP regressed AND DC-weight-UP regressed, so the recon sits monotonically BELOW its own FBP init (baseline SSIM ~0.84, baseline_PSNR 34.08). FAILURE MODE (well-characterized): the learned VN regulariser term Sum_i K_i^T rho'_i(K_i u) is a BLUNT SMOOTHER that degrades the FBP init below baseline, and it does so REGARDLESS of capacity (filters^ hurt) or DC weight (lambda^ hurt). This FIRES iter-3's own pre-registered falsifier: 'if SSIM stays <=0.84 under strong DC, the VN regulariser is structurally degrading -> iter-4 attacks the regulariser itself: vn_normalize_filters=True OR vn_init=backproj'. CHOICE OF KNOB (most diagnostic remaining): vn_normalize_filters=True is the SHARPEST test of the smoothing diagnosis, and is preferred over vn_init=backproj (which changes only the init, not the regularizer mechanism, and the baseline is pinned to FBP either way). MECHANISM: zero-mean filters have NO DC response -- conv with a zero-mean kernel annihilates any uniform/low-frequency level component -- so a zero-mean-unit-norm-constrained K_i CANNOT apply a uniform smoothing or level shift to the image; the regulariser term can only act on local CONTRAST (edges/texture). Unit-norm caps each filter's gain so no single filter can dominate and over-smooth. If the iter-1/2/3 degradation was the unconstrained filters collapsing to a DC/low-pass smoother, this constraint removes that failure path -> the recon should stop sinking below the FBP init and hr should rise toward / above 0. HYPOTHESIS: with zero-mean unit-norm filters the regulariser stops smoothing the FBP init below baseline; val_ssim clears the ~0.84 FBP floor (hr > 0). FALSIFIER (the terminal one): if val_ssim still <= 0.84 (below FBP) with the regulariser CONSTRAINED, then hammernik_vn is STRUCTURALLY FBP-BOUNDED on rebinned Mayo regardless of regulariser config (capacity, DC weight, AND filter constraint all exhausted) -> file the NEGATIVE RESULT: the Hammernik-VN learned-regulariser family does not beat LD-FBP on real 2304-view Mayo LDCT, and drive the remaining iters to document the ceiling, not chase it. BUDGET (HARD 20-min train+score; sbatch --time=00:30:00): the zero-mean/unit-norm normalization is a cheap per-step reshape (filter tensor is (24,1,11,11)); per-step forward/back-project DC cost is IDENTICAL to iter-3, so wall ~= iter-3 (1159.6s) -- well under the 1800s SLURM kill, ~640s margin. MEMORY-SAFE: identical footprint to iter-3 -- batch_size=2 + vn_checkpoint=true keep N_k=24 within the 16 GB RTX5000 (no OOM; cf. the hammernik_2017 bs=4 OOM at 72s). grad_clip=1.0 retained (VN-family NaN-skip stability; the 2304-view Mayo FBP adjoint overflows the backward otherwise).", "comparison_image": "runs/mayo-ldct-claude-agentic-hammernik-vn-search-20260619-01/iterations/iter-0004/comparison.png"}
{"ts": "2026-06-20T04:04:15Z", "run_id": "mayo-ldct-claude-agentic-naf-search-20260619-01", "iter": 4, "agent": "naf-claude-agentic", "model": "claude-opus-4-8-1m", "change_class": "architecture", "status": "discard", "kept": false, "val_score": 0.5629324913024902, "headroom": 0.0, "params_M": 0.006465, "train_n": 400, "rationale": "naf-claude-agentic: val_n=214, naf_n_freqs=8, naf_hidden=64, naf_layers=3, naf_n_iter=3000, naf_lr=0.02, naf_tv_weight=0.0001, naf_n_clip=0.05, naf_outer_wall_s=1080, naf_per_scene_s=5.0, seed=42, rationale=ITER-4 (search-20260619-01, naf). SIX-BOX. (1) NUMBERS trajectory (monotone climb via leanness, all hr=0): iter-1 naf_hidden=128,layers=4 -> SSIM 0.4729 (PSNR 18.55, baseline_PSNR 34.08, elapsed 1097s, median ~91 Adam steps/scene at the 5.0s per-scene wall, 18-min outer wall 1080s hit EXACTLY at scene 214). iter-2 naf_hidden 128->64 -> SSIM 0.4943 (+0.0215; PSNR 18.62, elapsed 1100s). iter-3 naf_layers 4->3 -> SSIM 0.5452 (+0.0509; PSNR 19.238, RMSE 0.005459, hr 0.005, elapsed 1094.6s, params 0.006465M). Each leanness step (cheaper MLP -> more Adam steps/scene in the FIXED 214x5.0s/18-min wall) lifts SSIM, but STILL FAR below the LD-FBP cal floor (~0.81). (2) FAILURE MODE: budget-starved per-scene INR fit + weak inductive bias for dense 2304-view CT -- climbing but bounded; ~90-100 Adam steps/scene leaves the NeRF-style coordinate-MLP barely off its water-mu init (a NeRF wants hundreds-to-thousands of steps). (3) ONE KNOB: naf_lr 1e-2->2e-2 (naf_hidden=64, naf_layers=3, naf_n_freqs=8, naf_per_scene_s=5.0, naf_outer_wall_s=1080, val_n=214 ALL UNCHANGED). The two LEANNESS levers are now nearly spent: naf_hidden hit 64 (iter-2) and naf_layers hit 3 (iter-3) -- one block left; layers 3->2 would zero the range(layers-2) hidden loop, collapsing to a single Linear(in,64)->Linear(64,1) perceptron (capacity cliff, triggers the lost-capacity falsifier), and naf_n_freqs->6 trades positional-encoding bandwidth (representational power) for a small first-layer saving. naf_lr is the ORTHOGONAL lever that directly attacks the diagnosed too-few-steps-off-init failure WITHOUT further shrinking the fixed model: with only ~90-100 Adam steps from the water-mu init, a 2x lr lets the INR travel further per step (init-anchored Adam, the same regime where iter-1's per-scene rationale already used lr 5e-3->1e-2). Model held fixed so the SSIM delta isolates lr cleanly. 2x (not 5x) is a measured step to avoid destabilizing the short Adam fit. (4) HYPOTHESIS: if naf_lr 1e-2->2e-2, SSIM rises above 0.5452 because each of the ~90-100 per-scene steps moves the INR further off init within the same per-scene wall. FALSIFIER: if SSIM stalls at ~0.54 (or drops from lr-induced instability) despite the higher lr, NAF is STRUCTURALLY FBP-bounded on dense rebinned Mayo (wrong inductive bias for dense-view CT) and the per-scene-INR fit has hit its ceiling far below FBP (~0.55 vs ~0.81 cal) -> document the per-scene-INR ceiling on dense Mayo as a NEGATIVE result. (5) HARD 20-min budget: 214-scene pass, naf_outer_wall_s=1080 (18 min, in-solver outer wall = governor) + naf_per_scene_s=5.0 (in-solver per-scene wall; naf_n_iter=3000 stays a high cap so the WALL governs, not the iter count). 214 x 5.0s = 1070s ~= the 1080s/18-min outer wall (hit exactly at scene 214 every iter). val_n=214 (ALL L277 slices, NOT reduced), 321px detector-geometry FOV default (no fov= override). (6) no control return; the loop dispatches the next iter.", "advice_for_others": "naf-claude-agentic: val_n=214, naf_n_freqs=8, naf_hidden=64, naf_layers=3, naf_n_iter=3000, naf_lr=0.02, naf_tv_weight=0.0001, naf_n_clip=0.05, naf_outer_wall_s=1080, naf_per_scene_s=5.0, seed=42, rationale=ITER-4 (search-20260619-01, naf). SIX-BOX. (1) NUMBERS trajectory (monotone climb via leanness, all hr=0): iter-1 naf_hidden=128,layers=4 -> SSIM 0.4729 (PSNR 18.55, baseline_PSNR 34.08, elapsed 1097s, median ~91 Adam steps/scene at the 5.0s per-scene wall, 18-min outer wall 1080s hit EXACTLY at scene 214). iter-2 naf_hidden 128->64 -> SSIM 0.4943 (+0.0215; PSNR 18.62, elapsed 1100s). iter-3 naf_layers 4->3 -> SSIM 0.5452 (+0.0509; PSNR 19.238, RMSE 0.005459, hr 0.005, elapsed 1094.6s, params 0.006465M). Each leanness step (cheaper MLP -> more Adam steps/scene in the FIXED 214x5.0s/18-min wall) lifts SSIM, but STILL FAR below the LD-FBP cal floor (~0.81). (2) FAILURE MODE: budget-starved per-scene INR fit + weak inductive bias for dense 2304-view CT -- climbing but bounded; ~90-100 Adam steps/scene leaves the NeRF-style coordinate-MLP barely off its water-mu init (a NeRF wants hundreds-to-thousands of steps). (3) ONE KNOB: naf_lr 1e-2->2e-2 (naf_hidden=64, naf_layers=3, naf_n_freqs=8, naf_per_scene_s=5.0, naf_outer_wall_s=1080, val_n=214 ALL UNCHANGED). The two LEANNESS levers are now nearly spent: naf_hidden hit 64 (iter-2) and naf_layers hit 3 (iter-3) -- one block left; layers 3->2 would zero the range(layers-2) hidden loop, collapsing to a single Linear(in,64)->Linear(64,1) perceptron (capacity cliff, triggers the lost-capacity falsifier), and naf_n_freqs->6 trades positional-encoding bandwidth (representational power) for a small first-layer saving. naf_lr is the ORTHOGONAL lever that directly attacks the diagnosed too-few-steps-off-init failure WITHOUT further shrinking the fixed model: with only ~90-100 Adam steps from the water-mu init, a 2x lr lets the INR travel further per step (init-anchored Adam, the same regime where iter-1's per-scene rationale already used lr 5e-3->1e-2). Model held fixed so the SSIM delta isolates lr cleanly. 2x (not 5x) is a measured step to avoid destabilizing the short Adam fit. (4) HYPOTHESIS: if naf_lr 1e-2->2e-2, SSIM rises above 0.5452 because each of the ~90-100 per-scene steps moves the INR further off init within the same per-scene wall. FALSIFIER: if SSIM stalls at ~0.54 (or drops from lr-induced instability) despite the higher lr, NAF is STRUCTURALLY FBP-bounded on dense rebinned Mayo (wrong inductive bias for dense-view CT) and the per-scene-INR fit has hit its ceiling far below FBP (~0.55 vs ~0.81 cal) -> document the per-scene-INR ceiling on dense Mayo as a NEGATIVE result. (5) HARD 20-min budget: 214-scene pass, naf_outer_wall_s=1080 (18 min, in-solver outer wall = governor) + naf_per_scene_s=5.0 (in-solver per-scene wall; naf_n_iter=3000 stays a high cap so the WALL governs, not the iter count). 214 x 5.0s = 1070s ~= the 1080s/18-min outer wall (hit exactly at scene 214 every iter). val_n=214 (ALL L277 slices, NOT reduced), 321px detector-geometry FOV default (no fov= override). (6) no control return; the loop dispatches the next iter.", "comparison_image": "runs/mayo-ldct-claude-agentic-naf-search-20260619-01/iterations/iter-0004/comparison.png"}
