{"ts": "2026-06-19T22:32:04Z", "run_id": "mayo-ldct-claude-agentic-hammernik-vn-search-20260619-01", "iter": 3, "agent": "hammernik_vn-claude-agentic", "model": "claude-opus-4-8-1m", "change_class": "architecture", "status": "discard", "kept": false, "val_score": 0.7681970000267029, "headroom": 0.0, "params_M": 0.018245, "train_n": 400, "rationale": "hammernik_vn-claude-agentic: vn_T=5, vn_n_filters=24, vn_kernel=11, vn_n_bumps=31, vn_x_range=1.0, vn_lambda_init=0.05, vn_init=fbp, vn_dc_norm=True, vn_checkpoint=True, vn_normalize_filters=False, epochs=10, batch_size=2, lr=0.0005, grad_clip=1.0, train_n=200, val_n=214, max_train_s=1000, seed=42, rationale=hammernik_vn iter-3 (search-20260619-01, corrected 214-slice/321px-FOV metric). ONE KNOB: vn_lambda_init 0.0023 -> 0.05 (~22x DC-weight init). All else held at iter-2 (vn_T=5, vn_n_filters=24, vn_kernel=11, vn_n_bumps=31, lr=5e-4, batch_size=2, vn_checkpoint=true, grad_clip=1.0, vn_dc_norm=true, vn_init=fbp, max_train_s=1000, train_n=200, val_n=214, seed=42). PRIOR (NUMBERS): iter-1 SSIM 0.80528 (vn_n_filters=16, hr=0, elapsed 1295.7s); iter-2 SSIM 0.79195 (vn_n_filters=24, hr=0, elapsed 1351.7s, train 1191.6s). The iter-2 filter bump 16->24 did NOT help -- it REGRESSED -0.0133 (0.80528->0.79195). Both sit BELOW the LD-FBP floor (baseline SSIM ~0.84, baseline_PSNR=34.08), so hr=0. This FIRES iter-2's own pre-registered falsifier ('if val_ssim stays <=0.81 still <FBP, the VN is smoothing-bound regardless of filter count, iter-3 must raise the DC weight vn_lambda_init'). DIAGNOSIS from iter-2 SLURM log 765279: dc_norm power-iter ~= 1.47e+03; training CONVERGED (loss 4.9e-4 ep1 -> 1.3e-6 ep6, flat by ep3) -- NOT under-training, so epochs-up is INERT; and CRITICALLY lambda_t stayed pinned at ['0.0023','0.00231','0.00231','0.00231','0.00231'] across ALL epochs -- Adam never grew the learnable DC weight from its init. The update is u <- u - KT_rho - lam * R^T(Ru-g)/dc_norm (solver lines 141-156): with lam ~= 0.0023 the data-consistency pull is negligible vs the learned regulariser gradient KT_rho, so the VN converges to a blunt smoother that degrades the FBP init below baseline. LIMITER = DC weight too small (NOT capacity: filters^ regressed; NOT epochs: loss flat). Since lambda_t never moves from init, the init vn_lambda_init IS the lever. vn_lambda_init 0.0023 -> 0.05 makes data-consistency dominate the regulariser from step 1 so the recon stays anchored to the measured sinogram instead of over-smoothing. lr held (campaign has lr5e-4-optimal / 8e-4-worse on record). HYPOTHESIS: with the DC init ~22x stronger, val_ssim clears the FBP floor (val_ssim > 0.84, hr>0). FALSIFIER: if val_ssim stays <=0.84 (still <FBP), the VN regulariser is structurally degrading even under strong DC, and iter-4 must attack the regulariser itself (vn_normalize_filters=True to constrain filters zero-mean/unit-norm, or vn_init=backproj). BUDGET (HARD 20-min train+score; sbatch --time=00:30:00): the lambda VALUE does not change per-step compute (same forward/back-project DC step), so cost ~= iter-2: train 1191.6s (max_train_s=1000 binds, ~6 epochs) + ~160s score(214)+figure = ~1352s, under the 1800s SLURM kill. MEMORY-SAFE: identical footprint to iter-2 -- batch_size=2 + vn_checkpoint=true keep N_k=24 within the 16 GB card (no OOM; cf. the hammernik_2017 bs=4 OOM). grad_clip=1.0 retained (VN-family NaN-skip stability; the 2304-view Mayo FBP adjoint overflows the backward otherwise -- and a stronger DC step makes the clip MORE load-bearing).", "advice_for_others": "hammernik_vn-claude-agentic: vn_T=5, vn_n_filters=24, vn_kernel=11, vn_n_bumps=31, vn_x_range=1.0, vn_lambda_init=0.05, vn_init=fbp, vn_dc_norm=True, vn_checkpoint=True, vn_normalize_filters=False, epochs=10, batch_size=2, lr=0.0005, grad_clip=1.0, train_n=200, val_n=214, max_train_s=1000, seed=42, rationale=hammernik_vn iter-3 (search-20260619-01, corrected 214-slice/321px-FOV metric). ONE KNOB: vn_lambda_init 0.0023 -> 0.05 (~22x DC-weight init). All else held at iter-2 (vn_T=5, vn_n_filters=24, vn_kernel=11, vn_n_bumps=31, lr=5e-4, batch_size=2, vn_checkpoint=true, grad_clip=1.0, vn_dc_norm=true, vn_init=fbp, max_train_s=1000, train_n=200, val_n=214, seed=42). PRIOR (NUMBERS): iter-1 SSIM 0.80528 (vn_n_filters=16, hr=0, elapsed 1295.7s); iter-2 SSIM 0.79195 (vn_n_filters=24, hr=0, elapsed 1351.7s, train 1191.6s). The iter-2 filter bump 16->24 did NOT help -- it REGRESSED -0.0133 (0.80528->0.79195). Both sit BELOW the LD-FBP floor (baseline SSIM ~0.84, baseline_PSNR=34.08), so hr=0. This FIRES iter-2's own pre-registered falsifier ('if val_ssim stays <=0.81 still <FBP, the VN is smoothing-bound regardless of filter count, iter-3 must raise the DC weight vn_lambda_init'). DIAGNOSIS from iter-2 SLURM log 765279: dc_norm power-iter ~= 1.47e+03; training CONVERGED (loss 4.9e-4 ep1 -> 1.3e-6 ep6, flat by ep3) -- NOT under-training, so epochs-up is INERT; and CRITICALLY lambda_t stayed pinned at ['0.0023','0.00231','0.00231','0.00231','0.00231'] across ALL epochs -- Adam never grew the learnable DC weight from its init. The update is u <- u - KT_rho - lam * R^T(Ru-g)/dc_norm (solver lines 141-156): with lam ~= 0.0023 the data-consistency pull is negligible vs the learned regulariser gradient KT_rho, so the VN converges to a blunt smoother that degrades the FBP init below baseline. LIMITER = DC weight too small (NOT capacity: filters^ regressed; NOT epochs: loss flat). Since lambda_t never moves from init, the init vn_lambda_init IS the lever. vn_lambda_init 0.0023 -> 0.05 makes data-consistency dominate the regulariser from step 1 so the recon stays anchored to the measured sinogram instead of over-smoothing. lr held (campaign has lr5e-4-optimal / 8e-4-worse on record). HYPOTHESIS: with the DC init ~22x stronger, val_ssim clears the FBP floor (val_ssim > 0.84, hr>0). FALSIFIER: if val_ssim stays <=0.84 (still <FBP), the VN regulariser is structurally degrading even under strong DC, and iter-4 must attack the regulariser itself (vn_normalize_filters=True to constrain filters zero-mean/unit-norm, or vn_init=backproj). BUDGET (HARD 20-min train+score; sbatch --time=00:30:00): the lambda VALUE does not change per-step compute (same forward/back-project DC step), so cost ~= iter-2: train 1191.6s (max_train_s=1000 binds, ~6 epochs) + ~160s score(214)+figure = ~1352s, under the 1800s SLURM kill. MEMORY-SAFE: identical footprint to iter-2 -- batch_size=2 + vn_checkpoint=true keep N_k=24 within the 16 GB card (no OOM; cf. the hammernik_2017 bs=4 OOM). grad_clip=1.0 retained (VN-family NaN-skip stability; the 2304-view Mayo FBP adjoint overflows the backward otherwise -- and a stronger DC step makes the clip MORE load-bearing).", "comparison_image": "runs/mayo-ldct-claude-agentic-hammernik-vn-search-20260619-01/iterations/iter-0003/comparison.png"}
{"ts": "2026-06-19T22:12:44Z", "run_id": "mayo-ldct-claude-agentic-learned-primal-dual-search-20260619-01", "iter": 3, "agent": "learned_primal_dual-claude-agentic", "model": "claude-opus-4-8-1m", "change_class": "architecture", "status": "discard", "kept": false, "val_score": 0.885114848613739, "headroom": 0.0, "params_M": 0.155406, "train_n": 400, "rationale": "learned_primal_dual-claude-agentic: lpd_iters=3, lpd_hidden=48, lpd_n_primal=5, lpd_n_dual=5, lpd_share_weights=False, lr=0.0005, lr_schedule=cosine, epochs=11, batch_size=1, val_chunk=1, train_n=200, val_n=214, grad_clip=1.0, seed=42, rationale=iter-3 search-20260619-01: ONE knob = epochs 10->11 (everything else held EXACTLY at iter-2: lpd_iters=3, hidden=48, n_primal=5, n_dual=5, lr=5e-4 cosine, train_n=200, batch=1, val_chunk=1, val_n=214, grad_clip=1.0, seed=42). LIMITER = under-trained, NOT capacity-limited: iter-1 (iters5/ep6) SSIM 0.84271 hr0.000 in 1149.5s=19.16min; iter-2 (iters3/ep10) SSIM 0.863635 hr0.000 in 1079.3s=17.99min. The +0.021 SSIM from +4 epochs (with the depth cut) proves the net is still climbing the training curve, so epochs is the lever; hr still pinned at the LD-FBP floor (0.000) but RMSE flat (0.001721->0.001781). BUDGET MATH vs 20-min wall (1200s): iter-2 ran 1079.3s at 10 epochs => marginal epoch cost <=107.9s/epoch (over-attributing ALL of iter-2 incl. the fixed 214-slice val pass to epochs). epochs 10->11 worst-case = 1079.3 + 107.9 = 1187s = 19.8min < 1200s, fits with margin (true marginal cost is lower since val overhead is non-trivially folded into that bound). Could NOT safely push to 12 (worst-case 1295s=21.6min > 20-min budget). lpd_hidden^ or lpd_iters^ both ADD per-sample projector cost and would blow the wall (iter-1 at iters=5 already hit 19.16min). HYP: one more epoch lifts SSIM monotonically (predict ~0.866-0.870) and, if the climb is steep enough, clears the LD-FBP floor (hr>0). FALSIFIER: SSIM flat/down vs 0.863635 OR hr still 0.000 => epochs is saturating in this 20-min budget and a budget-bound projector-in-loop LPD cannot clear FBP on 2304-view Mayo at this capacity (documented ceiling); next iter would need capacity (hidden^) traded against a deeper budget, not more epochs.", "advice_for_others": "learned_primal_dual-claude-agentic: lpd_iters=3, lpd_hidden=48, lpd_n_primal=5, lpd_n_dual=5, lpd_share_weights=False, lr=0.0005, lr_schedule=cosine, epochs=11, batch_size=1, val_chunk=1, train_n=200, val_n=214, grad_clip=1.0, seed=42, rationale=iter-3 search-20260619-01: ONE knob = epochs 10->11 (everything else held EXACTLY at iter-2: lpd_iters=3, hidden=48, n_primal=5, n_dual=5, lr=5e-4 cosine, train_n=200, batch=1, val_chunk=1, val_n=214, grad_clip=1.0, seed=42). LIMITER = under-trained, NOT capacity-limited: iter-1 (iters5/ep6) SSIM 0.84271 hr0.000 in 1149.5s=19.16min; iter-2 (iters3/ep10) SSIM 0.863635 hr0.000 in 1079.3s=17.99min. The +0.021 SSIM from +4 epochs (with the depth cut) proves the net is still climbing the training curve, so epochs is the lever; hr still pinned at the LD-FBP floor (0.000) but RMSE flat (0.001721->0.001781). BUDGET MATH vs 20-min wall (1200s): iter-2 ran 1079.3s at 10 epochs => marginal epoch cost <=107.9s/epoch (over-attributing ALL of iter-2 incl. the fixed 214-slice val pass to epochs). epochs 10->11 worst-case = 1079.3 + 107.9 = 1187s = 19.8min < 1200s, fits with margin (true marginal cost is lower since val overhead is non-trivially folded into that bound). Could NOT safely push to 12 (worst-case 1295s=21.6min > 20-min budget). lpd_hidden^ or lpd_iters^ both ADD per-sample projector cost and would blow the wall (iter-1 at iters=5 already hit 19.16min). HYP: one more epoch lifts SSIM monotonically (predict ~0.866-0.870) and, if the climb is steep enough, clears the LD-FBP floor (hr>0). FALSIFIER: SSIM flat/down vs 0.863635 OR hr still 0.000 => epochs is saturating in this 20-min budget and a budget-bound projector-in-loop LPD cannot clear FBP on 2304-view Mayo at this capacity (documented ceiling); next iter would need capacity (hidden^) traded against a deeper budget, not more epochs.", "comparison_image": "runs/mayo-ldct-claude-agentic-learned-primal-dual-search-20260619-01/iterations/iter-0003/comparison.png"}
{"ts": "2026-06-19T21:33:28Z", "run_id": "mayo-ldct-claude-agentic-itnet-v3-search-20260619-01", "iter": 3, "agent": "itnet_v3-claude-agentic", "model": "claude-opus-4-8-1m", "change_class": "architecture", "status": "keep", "kept": true, "val_score": 0.9047728180885315, "headroom": 0.31228215678718296, "params_M": 3.698994, "train_n": 400, "rationale": "itnet_v3-claude-agentic: itnet_k=3, unet_c=16, alpha_init=0.0037, lr=0.0001, epochs=18, batch_size=1, val_chunk=1, train_n=200, val_n=214, grad_clip=1.0, max_train_s=900, seed=42, rationale=iter-3 (search-20260619-01, corrected protocol). ONE KNOB: epochs 14 -> 18 (all else = iter-2 exactly: itnet_k=3, unet_c=16, alpha_init=0.0037, lr=1e-4, train_n=200, val_n=214, grad_clip=1.0, max_train_s=900, seed=42). SIX-BOX (NUMBERS): (1) iter-1 ep8 -> SSIM 0.895903 / hr 0.268409 / PSNR 36.79 / RMSE 0.000723, elapsed 737.85s = 12.30 min; iter-2 ep14 -> SSIM 0.908534 / hr 0.310054 / PSNR 37.30 / RMSE 0.000682, elapsed 1010.07s = 16.83 min. The epochs-up lever is CONFIRMED (hr +0.0416, monotone over 8->14 ep) -> itnet_v3 is STILL UNDER-TRAINED, not capacity-limited (iter-2 falsifier hr<=0.268 did NOT trigger). (2) LIMITER NOW = the 20-min train+score wall, NOT convergence: iter-2 used 16.83/20 min. (3) ONE KNOB: epochs 14 -> 18 (~29pct more gradient steps). (4) HYPOTHESIS: if itnet_v3 trains 18 epochs (all else fixed), hr rises above 0.310 (predicted iter-3 hr ~0.33-0.34, extrapolating the +0.0416/6-epoch slope sub-linearly as convergence nears). FALSIFIER (NUMBERS): if hr <= 0.310 (or drops) at ep18, itnet_v3 has reached its training-convergence basin at unet_c=16/lr=1e-4 -> it is CAPACITY-limited, and iter-4 must raise unet_c (16->24) or lr rather than epochs (which cannot fit the wall anyway). (5) BUDGET (HARD 20-min train+score): from the two measured (epochs, elapsed_s) points the per-epoch cost is (1010.07-737.85)/(14-8) = 45.37 s/epoch and the fixed cost (data load + 214-slice per-sample val + figure I/O + startup) is 737.85 - 8*45.37 = 374.9 s. epochs=18 predicts 374.9 + 18*45.37 = 1191.5 s = 19.86 min (~8.5 s inside the 1200 s budget); epochs=20 would be 374.9 + 20*45.37 = 1282 s = 21.4 min -> BUSTS the 20-min wall, so 18 is the largest epoch count the measured timing permits. Train alone at 18 ep = 18*45.37 = 817 s < the unchanged max_train_s=900 backstop, so the backstop does not truncate (it checks between epochs and would only fence runaway slowdown). val stays ALL 214 L277 slices, 321px detector-geometry FOV (default; no fov= override). grad_clip=1.0 retained (mandatory: the 2304-view Mayo FBP adjoint inside dc_step overflows otherwise). HARD-WIRED (unchanged): staged_canonical v3 mayo_ldct_fitted geometry, per-sample-ps FBP init + per-sample itnet.projector swap for the k=3 DC steps, bg_target=truth, metric=321px detector-geometry FOV (evaluate_calibrated default for AGENT4CT_DATASET=mayo_ldct_2d). (6) do NOT return control mid-campaign.", "advice_for_others": "itnet_v3-claude-agentic: itnet_k=3, unet_c=16, alpha_init=0.0037, lr=0.0001, epochs=18, batch_size=1, val_chunk=1, train_n=200, val_n=214, grad_clip=1.0, max_train_s=900, seed=42, rationale=iter-3 (search-20260619-01, corrected protocol). ONE KNOB: epochs 14 -> 18 (all else = iter-2 exactly: itnet_k=3, unet_c=16, alpha_init=0.0037, lr=1e-4, train_n=200, val_n=214, grad_clip=1.0, max_train_s=900, seed=42). SIX-BOX (NUMBERS): (1) iter-1 ep8 -> SSIM 0.895903 / hr 0.268409 / PSNR 36.79 / RMSE 0.000723, elapsed 737.85s = 12.30 min; iter-2 ep14 -> SSIM 0.908534 / hr 0.310054 / PSNR 37.30 / RMSE 0.000682, elapsed 1010.07s = 16.83 min. The epochs-up lever is CONFIRMED (hr +0.0416, monotone over 8->14 ep) -> itnet_v3 is STILL UNDER-TRAINED, not capacity-limited (iter-2 falsifier hr<=0.268 did NOT trigger). (2) LIMITER NOW = the 20-min train+score wall, NOT convergence: iter-2 used 16.83/20 min. (3) ONE KNOB: epochs 14 -> 18 (~29pct more gradient steps). (4) HYPOTHESIS: if itnet_v3 trains 18 epochs (all else fixed), hr rises above 0.310 (predicted iter-3 hr ~0.33-0.34, extrapolating the +0.0416/6-epoch slope sub-linearly as convergence nears). FALSIFIER (NUMBERS): if hr <= 0.310 (or drops) at ep18, itnet_v3 has reached its training-convergence basin at unet_c=16/lr=1e-4 -> it is CAPACITY-limited, and iter-4 must raise unet_c (16->24) or lr rather than epochs (which cannot fit the wall anyway). (5) BUDGET (HARD 20-min train+score): from the two measured (epochs, elapsed_s) points the per-epoch cost is (1010.07-737.85)/(14-8) = 45.37 s/epoch and the fixed cost (data load + 214-slice per-sample val + figure I/O + startup) is 737.85 - 8*45.37 = 374.9 s. epochs=18 predicts 374.9 + 18*45.37 = 1191.5 s = 19.86 min (~8.5 s inside the 1200 s budget); epochs=20 would be 374.9 + 20*45.37 = 1282 s = 21.4 min -> BUSTS the 20-min wall, so 18 is the largest epoch count the measured timing permits. Train alone at 18 ep = 18*45.37 = 817 s < the unchanged max_train_s=900 backstop, so the backstop does not truncate (it checks between epochs and would only fence runaway slowdown). val stays ALL 214 L277 slices, 321px detector-geometry FOV (default; no fov= override). grad_clip=1.0 retained (mandatory: the 2304-view Mayo FBP adjoint inside dc_step overflows otherwise). HARD-WIRED (unchanged): staged_canonical v3 mayo_ldct_fitted geometry, per-sample-ps FBP init + per-sample itnet.projector swap for the k=3 DC steps, bg_target=truth, metric=321px detector-geometry FOV (evaluate_calibrated default for AGENT4CT_DATASET=mayo_ldct_2d). (6) do NOT return control mid-campaign.", "comparison_image": "runs/mayo-ldct-claude-agentic-itnet-v3-search-20260619-01/iterations/iter-0003/comparison.png"}
