{"ts": "2026-06-20T10:33:37Z", "run_id": "mayo-ldct-claude-agentic-tv-iterative-supervised-search-20260619-01", "iter": 5, "agent": "tv_iterative_supervised-claude-agentic", "model": "claude-opus-4-8-1m", "change_class": "architecture", "status": "discard", "kept": false, "val_score": 0.6074378490447998, "headroom": 0.0, "params_M": 2e-06, "train_n": 400, "rationale": "tv_iterative_supervised-claude-agentic: val_n=214, val_chunk=5, train_n=40, epochs=8, batch_size=1, lr=0.05, tv_K=30, tv_step_init=1e-05, tv_lambda_init=0.001, tv_share_steps=True, tv_clip_max=0.05, tv_eps=1e-06, lambda_neg=1.0, loss_base=mse, grad_clip=1.0, rationale=tv_iterative_supervised iter-5 (search-20260619-01, corrected 214-slice/321px-FOV metric). PRIOR TRAJECTORY (SSIM/hr): iter-1 K=10 0.2855/0.0; iter-2 K=30 0.2855/0.0 (byte-identical: depth FALSIFIED); iter-3 step=1e-8 0.8137/0.0 (LD-FBP PASSTHROUGH: loss flat 6.4e-5, lambda PINNED, step crept 1.06e-8->1.76e-8 -> near-identity on fbp_init, recon PSNR 33.60 just BELOW baseline 34.08); iter-4 step=1e-5 0.6949/0.0 PSNR 21.83. BEST hr = 0.0 across all 4; best SSIM = iter-3 0.8137 (but that is pure FBP passthrough, not a trained recon). BASE_ITER=4 (the ONLY iter where training actually un-froze). LIMITER (from iter-4 SLURM log 765355, the decisive evidence): at step_init=1e-5 the 60 free scalars FINALLY trained for real -- loss DROPPED 5.2e-5->2.8e-5 (first real decrease in the campaign), lambda[k] DEPARTED init (0.001->0.00111..0.00239), step[k] adapted. BUT SSIM got WORSE (0.8137->0.6949) and PSNR collapsed to 21.83. Root cause: with tv_share_steps=False the 30 INDEPENDENT per-iter log_step scalars are free to RUNAWAY -- step[1] exploded 6.3e-5->0.031 (epoch5-8), driving that single unrolled iterate back into the SATURATED-CLAMP regime that iter-1/2 proved kills the recon. The supervised-L2 loss decreased while SSIM/PSNR worsened = a degenerate per-step-instability basin (one runaway step the masked-L2 tolerates but the recon does not). The limiter is NO LONGER step scale (1e-5 IS the active training basin) NOR depth NOR epochs/lr -- it is the UNCONSTRAINED PER-STEP DEGREE OF FREEDOM letting individual steps diverge into the clamp. ONE KNOB CHANGED (from BASE_ITER=4): tv_share_steps False -> True (60 free scalars -> 2 shared scalars: ONE step + ONE lambda applied uniformly across all K=30 unrolled iterations). All else IDENTICAL to iter-4 (tv_step_init=1e-5 KEPT -- it is the confirmed active basin; tv_K=30, train_n=40, epochs=8, bs=1, lr=5e-2, tv_lambda_init=1e-3, tv_clip_max=0.05, tv_eps=1e-6, val_n=214 ALL L277, val_chunk=5, grad_clip=1.0). HYPOTHESIS: a SHARED step/lambda cannot have a single runaway iterate -- it forces a uniform, stable K=30 GD that stays inside the [0,0.05] clamp basin while still TRAINING (the iter-4 log proved the scalars receive real gradient at step=1e-5). I expect SSIM to RECOVER above the 0.6949 iter-4 collapse and the trained-stable TV to finally exceed its own LD-FBP passthrough (SSIM > 0.8137, hr > 0) because the one trainable step now optimizes the data-vs-TV balance globally without any step being allowed to blow into clamp saturation. NUMERIC FALSIFIER (decisive): if SSIM stays <= 0.8137 with hr=0 (the shared step ALSO converges to either the passthrough floor (step->0) or the clamp ceiling (step->over-large), i.e. there is NO single shared step value in [0,0.05]-clamp-basin that both trains AND beats FBP), then the supervised-unrolled-TV harness is STRUCTURALLY FBP-BOUNDED on real Mayo 2304-view LDCT under the config-only contract (the shared solvers raw unnormalized-adjoint back_project step is FORBIDDEN to edit) -> file the NEGATIVE RESULT and STOP iterating this solver at iter-5. BUDGET (HARD 20-min train+score=1200s): IDENTICAL compute to iter-4 (tv_share_steps changes ONLY the scalar COUNT 60->2, not any loop size: same K=30, train_n=40, epochs=8, bs=1, val_n=214, val_chunk=5) -> ~918s measured iter-4, ~282s margin under the 1200s wall; sbatch --time=00:30:00 carries figure/IO headroom. PREDICTED iter-5: SSIM ~0.81-0.86, hr most-likely 0.0 (predicted ceiling MECHANISM if hr stays 0: the supervised-L2 + unnormalized 2304-view adjoint step has no shared scalar that both escapes the FBP-passthrough basin AND stays out of clamp saturation -- the trained-stable TV recovers toward the FBP floor but cannot strictly EXCEED its own LD-FBP because the only image-domain prior is a single global TV weight, structurally weaker than the LDCT noise it must remove). If hr>0, supervised-TV is repaired and iter-6 raises train_n (capacity is tiny -- 2 scalars -- so data lever is weak, weigh carefully).", "advice_for_others": "tv_iterative_supervised-claude-agentic: val_n=214, val_chunk=5, train_n=40, epochs=8, batch_size=1, lr=0.05, tv_K=30, tv_step_init=1e-05, tv_lambda_init=0.001, tv_share_steps=True, tv_clip_max=0.05, tv_eps=1e-06, lambda_neg=1.0, loss_base=mse, grad_clip=1.0, rationale=tv_iterative_supervised iter-5 (search-20260619-01, corrected 214-slice/321px-FOV metric). PRIOR TRAJECTORY (SSIM/hr): iter-1 K=10 0.2855/0.0; iter-2 K=30 0.2855/0.0 (byte-identical: depth FALSIFIED); iter-3 step=1e-8 0.8137/0.0 (LD-FBP PASSTHROUGH: loss flat 6.4e-5, lambda PINNED, step crept 1.06e-8->1.76e-8 -> near-identity on fbp_init, recon PSNR 33.60 just BELOW baseline 34.08); iter-4 step=1e-5 0.6949/0.0 PSNR 21.83. BEST hr = 0.0 across all 4; best SSIM = iter-3 0.8137 (but that is pure FBP passthrough, not a trained recon). BASE_ITER=4 (the ONLY iter where training actually un-froze). LIMITER (from iter-4 SLURM log 765355, the decisive evidence): at step_init=1e-5 the 60 free scalars FINALLY trained for real -- loss DROPPED 5.2e-5->2.8e-5 (first real decrease in the campaign), lambda[k] DEPARTED init (0.001->0.00111..0.00239), step[k] adapted. BUT SSIM got WORSE (0.8137->0.6949) and PSNR collapsed to 21.83. Root cause: with tv_share_steps=False the 30 INDEPENDENT per-iter log_step scalars are free to RUNAWAY -- step[1] exploded 6.3e-5->0.031 (epoch5-8), driving that single unrolled iterate back into the SATURATED-CLAMP regime that iter-1/2 proved kills the recon. The supervised-L2 loss decreased while SSIM/PSNR worsened = a degenerate per-step-instability basin (one runaway step the masked-L2 tolerates but the recon does not). The limiter is NO LONGER step scale (1e-5 IS the active training basin) NOR depth NOR epochs/lr -- it is the UNCONSTRAINED PER-STEP DEGREE OF FREEDOM letting individual steps diverge into the clamp. ONE KNOB CHANGED (from BASE_ITER=4): tv_share_steps False -> True (60 free scalars -> 2 shared scalars: ONE step + ONE lambda applied uniformly across all K=30 unrolled iterations). All else IDENTICAL to iter-4 (tv_step_init=1e-5 KEPT -- it is the confirmed active basin; tv_K=30, train_n=40, epochs=8, bs=1, lr=5e-2, tv_lambda_init=1e-3, tv_clip_max=0.05, tv_eps=1e-6, val_n=214 ALL L277, val_chunk=5, grad_clip=1.0). HYPOTHESIS: a SHARED step/lambda cannot have a single runaway iterate -- it forces a uniform, stable K=30 GD that stays inside the [0,0.05] clamp basin while still TRAINING (the iter-4 log proved the scalars receive real gradient at step=1e-5). I expect SSIM to RECOVER above the 0.6949 iter-4 collapse and the trained-stable TV to finally exceed its own LD-FBP passthrough (SSIM > 0.8137, hr > 0) because the one trainable step now optimizes the data-vs-TV balance globally without any step being allowed to blow into clamp saturation. NUMERIC FALSIFIER (decisive): if SSIM stays <= 0.8137 with hr=0 (the shared step ALSO converges to either the passthrough floor (step->0) or the clamp ceiling (step->over-large), i.e. there is NO single shared step value in [0,0.05]-clamp-basin that both trains AND beats FBP), then the supervised-unrolled-TV harness is STRUCTURALLY FBP-BOUNDED on real Mayo 2304-view LDCT under the config-only contract (the shared solvers raw unnormalized-adjoint back_project step is FORBIDDEN to edit) -> file the NEGATIVE RESULT and STOP iterating this solver at iter-5. BUDGET (HARD 20-min train+score=1200s): IDENTICAL compute to iter-4 (tv_share_steps changes ONLY the scalar COUNT 60->2, not any loop size: same K=30, train_n=40, epochs=8, bs=1, val_n=214, val_chunk=5) -> ~918s measured iter-4, ~282s margin under the 1200s wall; sbatch --time=00:30:00 carries figure/IO headroom. PREDICTED iter-5: SSIM ~0.81-0.86, hr most-likely 0.0 (predicted ceiling MECHANISM if hr stays 0: the supervised-L2 + unnormalized 2304-view adjoint step has no shared scalar that both escapes the FBP-passthrough basin AND stays out of clamp saturation -- the trained-stable TV recovers toward the FBP floor but cannot strictly EXCEED its own LD-FBP because the only image-domain prior is a single global TV weight, structurally weaker than the LDCT noise it must remove). If hr>0, supervised-TV is repaired and iter-6 raises train_n (capacity is tiny -- 2 scalars -- so data lever is weak, weigh carefully).", "comparison_image": "runs/mayo-ldct-claude-agentic-tv-iterative-supervised-search-20260619-01/iterations/iter-0005/comparison.png"}
{"ts": "2026-06-20T10:30:34Z", "run_id": "mayo-ldct-claude-agentic-naf-search-20260619-01", "iter": 5, "agent": "naf-claude-agentic", "model": "claude-opus-4-8-1m", "change_class": "architecture", "status": "discard", "kept": false, "val_score": 0.35916921496391296, "headroom": 0.0, "params_M": 0.006465, "train_n": 400, "rationale": "naf-claude-agentic: val_n=214, naf_n_freqs=8, naf_hidden=64, naf_layers=3, naf_n_iter=3000, naf_lr=0.04, naf_tv_weight=0.0001, naf_n_clip=0.05, naf_outer_wall_s=1080, naf_per_scene_s=5.0, seed=42, rationale=ITER-5 (search-20260619-01, naf). SIX-BOX. (1) NUMBERS trajectory (monotone climb via leanness+lr, all hr=0): iter-1 hidden=128,layers=4,lr=1e-2 -> SSIM 0.4729 (PSNR 18.55, baseline_PSNR 34.08, elapsed 1097s, median ~91 Adam steps/scene at the 5.0s per-scene wall, 18-min outer wall 1080s hit EXACTLY at scene 214). iter-2 hidden 128->64 -> SSIM 0.4943 (+0.0215, PSNR 18.62). iter-3 layers 4->3 -> SSIM 0.5452 (+0.0509, PSNR 19.238, RMSE 0.005459). iter-4 lr 1e-2->2e-2 -> SSIM 0.5629 (+0.0177, PSNR 20.276, RMSE 0.004843, elapsed 1095.5s, params 0.006465M) = BEST. Still FAR below the LD-FBP cal floor (~0.81). (2) FAILURE MODE / LIMITER: budget-starved per-scene INR fit. The per-scene 5.0s t_limit (solver fit_one_scene break) governs, naf_n_iter=3000 is just a high cap; only ~90-100 Adam steps/scene leave the NeRF-style coordinate-MLP barely off its init_mu=0.005 water-mu init (a NeRF wants hundreds-to-thousands). Total budget 214x5.0s=1070s~=1080s outer wall is FULL inside the 20-min compute budget and CANNOT be raised. (3) ONE KNOB: naf_lr 2e-2->4e-2 (naf_hidden=64, naf_layers=3, naf_n_freqs=8, naf_per_scene_s=5.0, naf_outer_wall_s=1080, val_n=214 ALL UNCHANGED). The two LEANNESS levers are spent: hidden hit 64 (iter-2), layers hit 3 (iter-3) -- layers 3->2 zeros the range(layers-2) hidden loop -> single Linear(in,64)->Linear(64,1) perceptron capacity-cliff; n_freqs->6 trades positional-encoding bandwidth. lr is the ORTHOGONAL lever attacking the diagnosed too-few-steps-off-init failure WITHOUT shrinking the fixed model: in the ~90-100-step init-anchored Adam regime a higher lr travels further off init per step. iter-4 already PROVED this axis (1e-2->2e-2 gave +0.0177, PSNR up, RMSE down, NO instability), so continue it with another measured 2x step. Model held fixed so the SSIM delta isolates lr cleanly. (4) HYPOTHESIS: if naf_lr 2e-2->4e-2, SSIM rises above 0.5629 because each of the ~90-100 per-scene steps moves the INR further off its water-mu init within the same per-scene wall (same mechanism that gave iter-4 +0.0177). FALSIFIER: if SSIM stalls at ~0.56 or DROPS (lr-induced instability in the short Adam fit), the lr lever is exhausted -> NAF has hit the practical per-scene-INR ceiling in a 5s/214-scene budget (~0.56 vs LD-FBP ~0.81), a STRUCTURAL NEGATIVE on dense 2304-view Mayo (wrong inductive bias for dense-view CT) to document toward iter-20. (5) HARD 20-min budget: 214-scene pass, naf_outer_wall_s=1080 (18 min, in-solver outer wall = governor) + naf_per_scene_s=5.0 (in-solver per-scene wall; naf_n_iter=3000 stays a high cap so the WALL governs). 214x5.0s=1070s~=1080s outer wall (hit exactly at scene 214 every iter; measured elapsed 1094.6-1100s, well inside the 30-min sbatch kill). lr change is cost-free. val_n=214 (ALL L277 slices, NOT reduced), 321px detector-geometry FOV default (no fov= override). (6) no control return; the loop dispatches the next iter.", "advice_for_others": "naf-claude-agentic: val_n=214, naf_n_freqs=8, naf_hidden=64, naf_layers=3, naf_n_iter=3000, naf_lr=0.04, naf_tv_weight=0.0001, naf_n_clip=0.05, naf_outer_wall_s=1080, naf_per_scene_s=5.0, seed=42, rationale=ITER-5 (search-20260619-01, naf). SIX-BOX. (1) NUMBERS trajectory (monotone climb via leanness+lr, all hr=0): iter-1 hidden=128,layers=4,lr=1e-2 -> SSIM 0.4729 (PSNR 18.55, baseline_PSNR 34.08, elapsed 1097s, median ~91 Adam steps/scene at the 5.0s per-scene wall, 18-min outer wall 1080s hit EXACTLY at scene 214). iter-2 hidden 128->64 -> SSIM 0.4943 (+0.0215, PSNR 18.62). iter-3 layers 4->3 -> SSIM 0.5452 (+0.0509, PSNR 19.238, RMSE 0.005459). iter-4 lr 1e-2->2e-2 -> SSIM 0.5629 (+0.0177, PSNR 20.276, RMSE 0.004843, elapsed 1095.5s, params 0.006465M) = BEST. Still FAR below the LD-FBP cal floor (~0.81). (2) FAILURE MODE / LIMITER: budget-starved per-scene INR fit. The per-scene 5.0s t_limit (solver fit_one_scene break) governs, naf_n_iter=3000 is just a high cap; only ~90-100 Adam steps/scene leave the NeRF-style coordinate-MLP barely off its init_mu=0.005 water-mu init (a NeRF wants hundreds-to-thousands). Total budget 214x5.0s=1070s~=1080s outer wall is FULL inside the 20-min compute budget and CANNOT be raised. (3) ONE KNOB: naf_lr 2e-2->4e-2 (naf_hidden=64, naf_layers=3, naf_n_freqs=8, naf_per_scene_s=5.0, naf_outer_wall_s=1080, val_n=214 ALL UNCHANGED). The two LEANNESS levers are spent: hidden hit 64 (iter-2), layers hit 3 (iter-3) -- layers 3->2 zeros the range(layers-2) hidden loop -> single Linear(in,64)->Linear(64,1) perceptron capacity-cliff; n_freqs->6 trades positional-encoding bandwidth. lr is the ORTHOGONAL lever attacking the diagnosed too-few-steps-off-init failure WITHOUT shrinking the fixed model: in the ~90-100-step init-anchored Adam regime a higher lr travels further off init per step. iter-4 already PROVED this axis (1e-2->2e-2 gave +0.0177, PSNR up, RMSE down, NO instability), so continue it with another measured 2x step. Model held fixed so the SSIM delta isolates lr cleanly. (4) HYPOTHESIS: if naf_lr 2e-2->4e-2, SSIM rises above 0.5629 because each of the ~90-100 per-scene steps moves the INR further off its water-mu init within the same per-scene wall (same mechanism that gave iter-4 +0.0177). FALSIFIER: if SSIM stalls at ~0.56 or DROPS (lr-induced instability in the short Adam fit), the lr lever is exhausted -> NAF has hit the practical per-scene-INR ceiling in a 5s/214-scene budget (~0.56 vs LD-FBP ~0.81), a STRUCTURAL NEGATIVE on dense 2304-view Mayo (wrong inductive bias for dense-view CT) to document toward iter-20. (5) HARD 20-min budget: 214-scene pass, naf_outer_wall_s=1080 (18 min, in-solver outer wall = governor) + naf_per_scene_s=5.0 (in-solver per-scene wall; naf_n_iter=3000 stays a high cap so the WALL governs). 214x5.0s=1070s~=1080s outer wall (hit exactly at scene 214 every iter; measured elapsed 1094.6-1100s, well inside the 30-min sbatch kill). lr change is cost-free. val_n=214 (ALL L277 slices, NOT reduced), 321px detector-geometry FOV default (no fov= override). (6) no control return; the loop dispatches the next iter.", "comparison_image": "runs/mayo-ldct-claude-agentic-naf-search-20260619-01/iterations/iter-0005/comparison.png"}
