{"ts": "2026-06-21T11:57:32Z", "run_id": "mayo-ldct-claude-agentic-learned-primal-dual-search-20260619-01", "iter": 8, "agent": "learned_primal_dual-claude-agentic", "model": "claude-opus-4-8-1m", "change_class": "architecture", "status": "discard", "kept": false, "val_score": 0.879511296749115, "headroom": 0.0, "params_M": 0.155406, "train_n": 400, "rationale": "learned_primal_dual-claude-agentic: lpd_iters=3, lpd_hidden=48, lpd_n_primal=5, lpd_n_dual=5, lpd_share_weights=False, lr=0.0007, lr_schedule=cosine, epochs=10, batch_size=1, val_chunk=1, train_n=200, val_n=214, grad_clip=1.0, seed=123, rationale=iter-8 search-20260619-01: ONE knob = seed 42 -> 123 (CLEAN CEILING-CONFIRMATION, wall-neutral). BASE_ITER=4 (BEST SSIM 0.898033, hr0: lpd_iters=3, lpd_hidden=48, n_primal=5, n_dual=5, lr=7e-4 cosine, epochs=10, train_n=200, batch=1, val_chunk=1, val_n=214, grad_clip=1.0). This is HONESTLY a confirmation iter, not an untried lever: the full LPD arc (ALL hr=0) has exhausted every genuinely-LPD axis. SSIM 0.84271(it1 iters5/ep6) -> 0.863635(it2 iters3/ep10) -> 0.885115(it3 ep11, OVER-wall) -> 0.898033(it4 BEST, lr7e-4) -> 0.88446(it5 tn300/ep7, lowest RMSE 1.139e-3 but hr0) -> 0.831302(it6 iters5 deeper-unroll, WORSE) -> 0.866666(it7 tn400/ep5 grad-step-parity, FELL below it4). LIMITER = FBP-BOUND on DENSE 2304-view Mayo, NOT budget-starved training: three independent axes each pushed, all kept hr=0 -> epochs (SSIM climbed 0.843->0.898 yet hr stayed 0), unroll depth (lpd_iters=5 strictly HURT SSIM in BOTH tries it1/it6 -- the LPD-defining lever is net-negative on dense Mayo), data coverage at grad-step parity (it7 tn400 vs it4 tn200, identical 2000 steps -> SSIM FELL 0.898->0.867). Mechanism: LPD learned proximal updates only add value where the FBP adjoint leaves residual ill-posedness (128-view SPARSE -> champion hr0.9062 breast / 0.4947 demo); at 2304 views >> Nyquist the LD-FBP is near-complete so the unrolled correction has no headroom -- it sharpens structure (rising SSIM) but cannot push RMSE below the near-optimal LD-FBP floor (hr0). The remaining wall-NEUTRAL untried read is seed: a seed flip at the it4 best config gives the campaign-standard NOISE-FLOOR read to close the ceiling (stable basin vs init lottery). BUDGET MATH vs 1200s: it4 ran ep10*tn200=2000 grad-steps in 1100.7s=18.35min; seed changes ZERO FLOPs -> COMPUTE-IDENTICAL ~1100s=18.3min, +100s margin under the 1200s wall. lpd_iters^/lpd_hidden^/epochs^ stay OFF (it1 iters5 hit 19.2min, it3 ep11 hit 20.2min OVER -- all near/over the wall). HYP: seed 123 lands within +/-0.01 SSIM of 0.898 with hr still 0.000 -> ~0.89 SSIM / hr0 is a STABLE basin, not an init artifact, definitively documenting the FBP-bound ceiling toward iter-20. NUMERIC FALSIFIER: SSIM > 0.91 (it4 + 0.012) OR hr > 0.000 -> the ~0.89/hr0 was init-sensitive (a seed lottery like demo-n2i 0.508->0.420), LPD has unexploited init headroom on Mayo worth a seed sweep rather than a closed ceiling.", "advice_for_others": "learned_primal_dual-claude-agentic: lpd_iters=3, lpd_hidden=48, lpd_n_primal=5, lpd_n_dual=5, lpd_share_weights=False, lr=0.0007, lr_schedule=cosine, epochs=10, batch_size=1, val_chunk=1, train_n=200, val_n=214, grad_clip=1.0, seed=123, rationale=iter-8 search-20260619-01: ONE knob = seed 42 -> 123 (CLEAN CEILING-CONFIRMATION, wall-neutral). BASE_ITER=4 (BEST SSIM 0.898033, hr0: lpd_iters=3, lpd_hidden=48, n_primal=5, n_dual=5, lr=7e-4 cosine, epochs=10, train_n=200, batch=1, val_chunk=1, val_n=214, grad_clip=1.0). This is HONESTLY a confirmation iter, not an untried lever: the full LPD arc (ALL hr=0) has exhausted every genuinely-LPD axis. SSIM 0.84271(it1 iters5/ep6) -> 0.863635(it2 iters3/ep10) -> 0.885115(it3 ep11, OVER-wall) -> 0.898033(it4 BEST, lr7e-4) -> 0.88446(it5 tn300/ep7, lowest RMSE 1.139e-3 but hr0) -> 0.831302(it6 iters5 deeper-unroll, WORSE) -> 0.866666(it7 tn400/ep5 grad-step-parity, FELL below it4). LIMITER = FBP-BOUND on DENSE 2304-view Mayo, NOT budget-starved training: three independent axes each pushed, all kept hr=0 -> epochs (SSIM climbed 0.843->0.898 yet hr stayed 0), unroll depth (lpd_iters=5 strictly HURT SSIM in BOTH tries it1/it6 -- the LPD-defining lever is net-negative on dense Mayo), data coverage at grad-step parity (it7 tn400 vs it4 tn200, identical 2000 steps -> SSIM FELL 0.898->0.867). Mechanism: LPD learned proximal updates only add value where the FBP adjoint leaves residual ill-posedness (128-view SPARSE -> champion hr0.9062 breast / 0.4947 demo); at 2304 views >> Nyquist the LD-FBP is near-complete so the unrolled correction has no headroom -- it sharpens structure (rising SSIM) but cannot push RMSE below the near-optimal LD-FBP floor (hr0). The remaining wall-NEUTRAL untried read is seed: a seed flip at the it4 best config gives the campaign-standard NOISE-FLOOR read to close the ceiling (stable basin vs init lottery). BUDGET MATH vs 1200s: it4 ran ep10*tn200=2000 grad-steps in 1100.7s=18.35min; seed changes ZERO FLOPs -> COMPUTE-IDENTICAL ~1100s=18.3min, +100s margin under the 1200s wall. lpd_iters^/lpd_hidden^/epochs^ stay OFF (it1 iters5 hit 19.2min, it3 ep11 hit 20.2min OVER -- all near/over the wall). HYP: seed 123 lands within +/-0.01 SSIM of 0.898 with hr still 0.000 -> ~0.89 SSIM / hr0 is a STABLE basin, not an init artifact, definitively documenting the FBP-bound ceiling toward iter-20. NUMERIC FALSIFIER: SSIM > 0.91 (it4 + 0.012) OR hr > 0.000 -> the ~0.89/hr0 was init-sensitive (a seed lottery like demo-n2i 0.508->0.420), LPD has unexploited init headroom on Mayo worth a seed sweep rather than a closed ceiling.", "comparison_image": "runs/mayo-ldct-claude-agentic-learned-primal-dual-search-20260619-01/iterations/iter-0008/comparison.png"}
{"ts": "2026-06-21T11:55:35Z", "run_id": "mayo-ldct-claude-agentic-diff-recon-dcstep-unconstrained-mayo-v4-search-20260619-01", "iter": 8, "agent": "diffusion_recon_dcstep_unconstrained_mayo_v4-claude-agentic", "model": "claude-opus-4-8-1m", "change_class": "architecture", "status": "discard", "kept": false, "val_score": 0.8784140348434448, "headroom": 0.0, "params_M": 8.594211, "train_n": 400, "rationale": "diffusion_recon_dcstep_unconstrained_mayo_v4-claude-agentic: recon_ckpt=/cluster/maier/Agent4CT/checkpoints/ddpm_mayo_unconstrained_v4.pt, recon_mode=dps, recon_sample_steps=72, recon_eta=5.0, recon_init=fbp, recon_eta_clamp=False, recon_dcstep_every=5, recon_dcstep_n_cg=3, recon_dcstep_warmup=5, recon_dcstep_relax=1.0, recon_dc_solver=cg, val_n=72, train_n=0, rationale=iter-8 search-20260619-01 UNCONSTRAINED diff-recon -- AUTHORIZED audit-fix (B) part (i): PUSH THE NFE KNOB ONE MORE STEP. ONE KNOB: recon_sample_steps (T, DDIM reverse-step count = NFE) 56->72 (+29% finer DDIM grid); val_n 96->72 evenly-spaced is the BUDGET-SIZING co-move (box 5, the single authorized (B) val_n exception to hold the HARD 1200s wall, guarded ABOVE the ~60 floor), NOT a hypothesis variable. BASE = iter-7 (BEST SSIM 0.8711): recon_dc_solver=cg, recon_dcstep_every=5, recon_dcstep_n_cg=3, recon_dcstep_warmup=5, recon_dcstep_relax=1.0, recon_eta=5.0, recon_init=fbp, recon_eta_clamp=false ALL UNCHANGED. reuse ddpm_mayo_unconstrained_v4.pt (200 train slices, NO retrain; unconstrained=200-slice misnomer from the demo-dl phantom regime, NOT a leakage variant). The (A) DC-step CG fix landed iter-6 (biggest A-fix gain on this variant: soft-DPS best 0.3960 -> CG-DC 0.8241); the (B) v5 EMA DDPM retrain (part ii) is NOT ready -- this iter changes ONLY the NFE knob. TRAJECTORY (val L277, 321px detector-geometry FOV, LD-FBP floor 0.8078): iter-1 T25/eta30/every0 SSIM 0.3688/hr0; iter-2 eta30->5 0.3960 (best soft); iter-3 T25->32 0.3869; iter-4 every0->5 LEGACY hard-DC 0.0553 (collapse); iter-5 T->40 soft 0.3709; iter-6 recon_dc_solver=cg CG-DC 0.8241/PSNR27.15 (A-fix); iter-7 T40->56 0.8711/PSNR29.82 (BEST, NFE +0.047). NFE is the STRONGEST SSIM climber of any solver in the campaign (0.8241->0.8711 on +40% NFE) and monotone on the CG-DC path. LIMITER: regime-bounded on DENSE 2304-view rebinned Mayo -- LD-FBP near-complete so hr>0 is unlikely from a finer grid; the v4-prior payoff is the 128-view SPARSE benchmarks. For SSIM the limiter is the coarseness of the T=56 DDIM reverse schedule (the remaining soft lever). HYPOTHESIS: a finer DDIM reverse schedule (T 56->72, +29% NFE) lets the CG-DC iterate relax further onto the sino-consistent mode, lifting SSIM modestly above iter-7 BEST 0.8711 -- predicted 0.875-0.885, hr STAYS 0 (regime-bound). NUMERIC FALSIFIER: if SSIM <= 0.8711 (flat-or-down vs iter-7) at T=72, the NFE lever has SATURATED on the CG-DC path; file it, unconstrained best stays iter-7 (SSIM 0.8711, hr 0), and any further NFE payoff is reserved for the SPARSE benchmarks. BUDGET (HARD 20-min=1200s wall, val=evenly-spaced L277): iter-7 ran 1078.7s at T=56/val_n=96 = 11.236 s/slice = 0.20064 s/slice/step (CG-DC cost ~linear in T since both DDIM steps and every-5 CG triggers scale with T). At T=72: 72*0.20064 = 14.446 s/slice; val_n=72 -> 72*14.446 = 1040s = 17.3 min < 1200s (~160s headroom). val_n=96 at T=72 would be 1387s=23.1min (BLOWS the wall); val_n=80 = 1156s=19.3min (too tight, 44s headroom), so val_n=72 is the budget mechanism that unlocks the +29% NFE probe while staying comfortably ABOVE the ~60 val_n floor (72 slices = a representative metric), evenly-spaced across the 214-slice L277 volume (protocol-sanctioned when val_n<214). If the next NFE step (T->~90) would push val_n below ~60, hold T and confirm saturation. HARD-WIRED: staged_canonical data, v3 mayo_ldct_fitted geometry, per-sample-ps single-val-ps probe, bg_target=truth, 321px detector-geometry FOV default (no fov=False), recon_dc_solver=cg. reuse ddpm_mayo_unconstrained_v4.pt (NO retrain).", "advice_for_others": "diffusion_recon_dcstep_unconstrained_mayo_v4-claude-agentic: recon_ckpt=/cluster/maier/Agent4CT/checkpoints/ddpm_mayo_unconstrained_v4.pt, recon_mode=dps, recon_sample_steps=72, recon_eta=5.0, recon_init=fbp, recon_eta_clamp=False, recon_dcstep_every=5, recon_dcstep_n_cg=3, recon_dcstep_warmup=5, recon_dcstep_relax=1.0, recon_dc_solver=cg, val_n=72, train_n=0, rationale=iter-8 search-20260619-01 UNCONSTRAINED diff-recon -- AUTHORIZED audit-fix (B) part (i): PUSH THE NFE KNOB ONE MORE STEP. ONE KNOB: recon_sample_steps (T, DDIM reverse-step count = NFE) 56->72 (+29% finer DDIM grid); val_n 96->72 evenly-spaced is the BUDGET-SIZING co-move (box 5, the single authorized (B) val_n exception to hold the HARD 1200s wall, guarded ABOVE the ~60 floor), NOT a hypothesis variable. BASE = iter-7 (BEST SSIM 0.8711): recon_dc_solver=cg, recon_dcstep_every=5, recon_dcstep_n_cg=3, recon_dcstep_warmup=5, recon_dcstep_relax=1.0, recon_eta=5.0, recon_init=fbp, recon_eta_clamp=false ALL UNCHANGED. reuse ddpm_mayo_unconstrained_v4.pt (200 train slices, NO retrain; unconstrained=200-slice misnomer from the demo-dl phantom regime, NOT a leakage variant). The (A) DC-step CG fix landed iter-6 (biggest A-fix gain on this variant: soft-DPS best 0.3960 -> CG-DC 0.8241); the (B) v5 EMA DDPM retrain (part ii) is NOT ready -- this iter changes ONLY the NFE knob. TRAJECTORY (val L277, 321px detector-geometry FOV, LD-FBP floor 0.8078): iter-1 T25/eta30/every0 SSIM 0.3688/hr0; iter-2 eta30->5 0.3960 (best soft); iter-3 T25->32 0.3869; iter-4 every0->5 LEGACY hard-DC 0.0553 (collapse); iter-5 T->40 soft 0.3709; iter-6 recon_dc_solver=cg CG-DC 0.8241/PSNR27.15 (A-fix); iter-7 T40->56 0.8711/PSNR29.82 (BEST, NFE +0.047). NFE is the STRONGEST SSIM climber of any solver in the campaign (0.8241->0.8711 on +40% NFE) and monotone on the CG-DC path. LIMITER: regime-bounded on DENSE 2304-view rebinned Mayo -- LD-FBP near-complete so hr>0 is unlikely from a finer grid; the v4-prior payoff is the 128-view SPARSE benchmarks. For SSIM the limiter is the coarseness of the T=56 DDIM reverse schedule (the remaining soft lever). HYPOTHESIS: a finer DDIM reverse schedule (T 56->72, +29% NFE) lets the CG-DC iterate relax further onto the sino-consistent mode, lifting SSIM modestly above iter-7 BEST 0.8711 -- predicted 0.875-0.885, hr STAYS 0 (regime-bound). NUMERIC FALSIFIER: if SSIM <= 0.8711 (flat-or-down vs iter-7) at T=72, the NFE lever has SATURATED on the CG-DC path; file it, unconstrained best stays iter-7 (SSIM 0.8711, hr 0), and any further NFE payoff is reserved for the SPARSE benchmarks. BUDGET (HARD 20-min=1200s wall, val=evenly-spaced L277): iter-7 ran 1078.7s at T=56/val_n=96 = 11.236 s/slice = 0.20064 s/slice/step (CG-DC cost ~linear in T since both DDIM steps and every-5 CG triggers scale with T). At T=72: 72*0.20064 = 14.446 s/slice; val_n=72 -> 72*14.446 = 1040s = 17.3 min < 1200s (~160s headroom). val_n=96 at T=72 would be 1387s=23.1min (BLOWS the wall); val_n=80 = 1156s=19.3min (too tight, 44s headroom), so val_n=72 is the budget mechanism that unlocks the +29% NFE probe while staying comfortably ABOVE the ~60 val_n floor (72 slices = a representative metric), evenly-spaced across the 214-slice L277 volume (protocol-sanctioned when val_n<214). If the next NFE step (T->~90) would push val_n below ~60, hold T and confirm saturation. HARD-WIRED: staged_canonical data, v3 mayo_ldct_fitted geometry, per-sample-ps single-val-ps probe, bg_target=truth, 321px detector-geometry FOV default (no fov=False), recon_dc_solver=cg. reuse ddpm_mayo_unconstrained_v4.pt (NO retrain).", "comparison_image": "runs/mayo-ldct-claude-agentic-diff-recon-dcstep-unconstrained-mayo-v4-search-20260619-01/iterations/iter-0008/comparison.png"}
{"ts": "2026-06-21T11:52:45Z", "run_id": "mayo-ldct-claude-agentic-diff-recon-dcstep-constrained-mayo-v4-search-20260619-01", "iter": 8, "agent": "diffusion_recon_dcstep_constrained_mayo_v4-claude-agentic", "model": "claude-opus-4-8-1m", "change_class": "architecture", "status": "discard", "kept": false, "val_score": 0.8533481955528259, "headroom": 0.0, "params_M": 8.594211, "train_n": 400, "rationale": "diffusion_recon_dcstep_constrained_mayo_v4-claude-agentic: recon_ckpt=/cluster/maier/Agent4CT/checkpoints/ddpm_mayo_constrained_v4.pt, recon_mode=dps, recon_sample_steps=80, recon_eta=30.0, recon_init=fbp, recon_eta_clamp=False, recon_dcstep_every=5, recon_dcstep_n_cg=3, recon_dcstep_warmup=5, recon_dcstep_relax=1.0, recon_dc_solver=cg, val_n=70, train_n=0, rationale=iter-8 search-20260619-01 CONSTRAINED diff-recon \u2014 AUTHORIZED B-fix part (i) continued: push NFE one more step. ONE HYPOTHESIS KNOB: recon_sample_steps 60->80 (DDIM reverse-step count T); val_n 90->70 is the BUDGET-SIZING co-move (the authorized val_n exception per the B directive \u2014 metric evenly-spaces across the 214-slice L277 volume when val_n<214, 70>=~60 stays representative), NOT a second hypothesis. BASE = iter-7 BEST (recon_dc_solver=cg landed A-fix, T=60, eta=30, relax=1.0, every5/n_cg3/warmup5, val_n=90, SSIM 0.8396/hr0 \u2014 run-best). recon_dc_solver=cg HELD. TRAJECTORY (val=L277, 321px geometry FOV, LD-FBP floor ~0.81): iter-1 T=25 legacy 0.3937/hr0; iter-2 eta30->1 0.2366 (regressed, wrong lever); iter-3 relax1.0->0.3 0.2377 (flat, wrong lever); iter-4 T25->28 0.4784; iter-5 T28->40 (val214->120) 0.6647; iter-6 DC legacy->cg A-fix 0.7873; iter-7 T40->60 (val120->90) 0.8396 (BEST). KEY SIGNAL: NFE T is the ONLY live SSIM lever and it is STILL CLIMBING monotonically \u2014 T 25->28->40->60 lifted SSIM 0.394->0.478->0.665->0.840 on the corrected CG-DC path (iter-7 +0.052 over iter-6). The recon now sits 0.840, just past the ~0.81 FBP floor; a finer reverse grid (T=80) is the untested continuation of the one proven lever. FRAMING (per audit): this is REGIME-BOUNDED on DENSE 2304-view Mayo (LD-FBP near-complete at 2304 views) \u2014 a finer DDIM grid will NOT clear hr>0 here; the value of this iter is documenting the NFE->SSIM curve + validating the landed B-fix. The REAL PAYOFF is the 128-view SPARSE benchmarks + the planned EMA v5 prior. HYPOTHESIS: if the proven monotone T-lever continues, T=80 lifts SSIM above iter-7 0.8396. NUMERIC FALSIFIER: if SSIM <= 0.8396 (flat/below iter-7) at T=80, the NFE lever has SATURATED on dense Mayo -> B-fix part (i) validated FAITHFUL-BUT-REGIME-BOUNDED (finer grid does not help where LD-FBP is already near-complete; payoff awaits the sparse benchmarks + EMA v5 prior); constrained best stays iter-7 (SSIM 0.8396, hr 0). hr expected ~0 regardless (regime-bounded). BUDGET: cost linear in T x val_n; per-slice-per-step constant from the CG path = 0.2077 s (iter-7 1121.6s/90/60; iter-6 963.5s/120/40=0.2007, use the conservative iter-7 value). T=80 x val_n=70 = 80*70*0.2077 = 1163 s = 19.4 min < the HARD 1200s/20-min wall (1800s in-solver backstop + 30-min --time as further backstops). T=80 at val_n=90 would be 1495s=24.9min (BLOWS the wall); val_n=72 = 1196s=19.9min (too tight, no CG-variance headroom); val_n=70 gives ~37s headroom for the CG inner-loop variance and stays >=~60 (representative). A further NFE step (T=100) would force val_n<60 (too few slices) \u2014 so T=80 is the last representative NFE rung; if it saturates, the lever is exhausted. val=70 evenly-spaced L277, 321px detector-geometry FOV default (no fov=False). staged_canonical data, v3 mayo_ldct_fitted geometry, per-sample-ps single-val-ps probe, bg_target=truth, reuse ddpm_mayo_constrained_v4.pt (NO retrain), recon_dc_solver=cg (landed A-fix), 321px FOV.", "advice_for_others": "diffusion_recon_dcstep_constrained_mayo_v4-claude-agentic: recon_ckpt=/cluster/maier/Agent4CT/checkpoints/ddpm_mayo_constrained_v4.pt, recon_mode=dps, recon_sample_steps=80, recon_eta=30.0, recon_init=fbp, recon_eta_clamp=False, recon_dcstep_every=5, recon_dcstep_n_cg=3, recon_dcstep_warmup=5, recon_dcstep_relax=1.0, recon_dc_solver=cg, val_n=70, train_n=0, rationale=iter-8 search-20260619-01 CONSTRAINED diff-recon \u2014 AUTHORIZED B-fix part (i) continued: push NFE one more step. ONE HYPOTHESIS KNOB: recon_sample_steps 60->80 (DDIM reverse-step count T); val_n 90->70 is the BUDGET-SIZING co-move (the authorized val_n exception per the B directive \u2014 metric evenly-spaces across the 214-slice L277 volume when val_n<214, 70>=~60 stays representative), NOT a second hypothesis. BASE = iter-7 BEST (recon_dc_solver=cg landed A-fix, T=60, eta=30, relax=1.0, every5/n_cg3/warmup5, val_n=90, SSIM 0.8396/hr0 \u2014 run-best). recon_dc_solver=cg HELD. TRAJECTORY (val=L277, 321px geometry FOV, LD-FBP floor ~0.81): iter-1 T=25 legacy 0.3937/hr0; iter-2 eta30->1 0.2366 (regressed, wrong lever); iter-3 relax1.0->0.3 0.2377 (flat, wrong lever); iter-4 T25->28 0.4784; iter-5 T28->40 (val214->120) 0.6647; iter-6 DC legacy->cg A-fix 0.7873; iter-7 T40->60 (val120->90) 0.8396 (BEST). KEY SIGNAL: NFE T is the ONLY live SSIM lever and it is STILL CLIMBING monotonically \u2014 T 25->28->40->60 lifted SSIM 0.394->0.478->0.665->0.840 on the corrected CG-DC path (iter-7 +0.052 over iter-6). The recon now sits 0.840, just past the ~0.81 FBP floor; a finer reverse grid (T=80) is the untested continuation of the one proven lever. FRAMING (per audit): this is REGIME-BOUNDED on DENSE 2304-view Mayo (LD-FBP near-complete at 2304 views) \u2014 a finer DDIM grid will NOT clear hr>0 here; the value of this iter is documenting the NFE->SSIM curve + validating the landed B-fix. The REAL PAYOFF is the 128-view SPARSE benchmarks + the planned EMA v5 prior. HYPOTHESIS: if the proven monotone T-lever continues, T=80 lifts SSIM above iter-7 0.8396. NUMERIC FALSIFIER: if SSIM <= 0.8396 (flat/below iter-7) at T=80, the NFE lever has SATURATED on dense Mayo -> B-fix part (i) validated FAITHFUL-BUT-REGIME-BOUNDED (finer grid does not help where LD-FBP is already near-complete; payoff awaits the sparse benchmarks + EMA v5 prior); constrained best stays iter-7 (SSIM 0.8396, hr 0). hr expected ~0 regardless (regime-bounded). BUDGET: cost linear in T x val_n; per-slice-per-step constant from the CG path = 0.2077 s (iter-7 1121.6s/90/60; iter-6 963.5s/120/40=0.2007, use the conservative iter-7 value). T=80 x val_n=70 = 80*70*0.2077 = 1163 s = 19.4 min < the HARD 1200s/20-min wall (1800s in-solver backstop + 30-min --time as further backstops). T=80 at val_n=90 would be 1495s=24.9min (BLOWS the wall); val_n=72 = 1196s=19.9min (too tight, no CG-variance headroom); val_n=70 gives ~37s headroom for the CG inner-loop variance and stays >=~60 (representative). A further NFE step (T=100) would force val_n<60 (too few slices) \u2014 so T=80 is the last representative NFE rung; if it saturates, the lever is exhausted. val=70 evenly-spaced L277, 321px detector-geometry FOV default (no fov=False). staged_canonical data, v3 mayo_ldct_fitted geometry, per-sample-ps single-val-ps probe, bg_target=truth, reuse ddpm_mayo_constrained_v4.pt (NO retrain), recon_dc_solver=cg (landed A-fix), 321px FOV.", "comparison_image": "runs/mayo-ldct-claude-agentic-diff-recon-dcstep-constrained-mayo-v4-search-20260619-01/iterations/iter-0008/comparison.png"}
