{"ts": "2026-06-21T13:33:13Z", "run_id": "mayo-ldct-claude-agentic-dual-domain-supervised-search-20260619-01", "iter": 9, "agent": "dual_domain_supervised-claude-agentic", "model": "claude-opus-4-8-1m", "change_class": "architecture", "status": "keep", "kept": true, "val_score": 0.932457447052002, "headroom": 0.421712493290226, "params_M": 0.465762, "train_n": 400, "rationale": "dual_domain_supervised-claude-agentic: unet_c=16, lr=0.0001, epochs=10, batch_size=1, val_chunk=1, train_n=579, val_n=214, grad_clip=1.0, lambda_neg=1.0, seed=123, rationale=ITER-9 (search-20260619-01). BASE_ITER=6 (CHAMPION: unet_c=16/lr=1e-4/epochs=10/train_n=579/lambda_neg=1.0/grad_clip=1.0/seed=42, hr 0.415794, #2 on the Mayo board behind itnet_v2 0.4187). ONE KNOB (init+noise-realization): seed 42 -> 123. CONFIRMATION READ, not a lift attempt. SIX-BOX (NUMBERS). (1) TRAJECTORY: ep8/n200 hr0.276 -> ep20 0.339 -> ep27 0.3654 -> ep9/n579 0.3994 -> ep10/n579 0.4158 (iter-6 CHAMPION+BEST) -> iter-7 lr1.5e-4 REGRESSED 0.4133 -> iter-8 lambda_neg0.1 0.4140 (did NOT beat 0.4158). CURRENT BEST = iter-6 hr 0.415794 / SSIM 0.93261. (2) LIMITER: ALL FIVE lift levers are now MAPPED and EXHAUSTED -- epochs WALL-PINNED at 10 (ep10 used 1172/1200s; ep11=1262s BUSTS the 20-min wall), data coverage MAXED (train_n=579 = the ENTIRE Wagner pool, cannot rise), capacity REGRESSED (iter-4 c24/ep10 -> 0.29856, trading epochs to fund 2.25x conv-compute under-trained the bigger net), lr REGRESSED (iter-7 1.5e-4 -> 0.4133), lambda_neg flat (iter-8 0.1 -> 0.4140, the prior-TPE 0.1-best hint did NOT transfer under the corrected 214-slice/321px-FOV metric). I enumerated EVERY cfg knob the solver actually reads (solver_dual_ddomain_supervised.py): seed, train_n, epochs, unet_c, lr, lambda_neg, grad_clip, batch_size, val_chunk -- plus loss base hard-coded base=mse at line 168 (NOT a cfg knob; changing it would edit the shared solver = FORBIDDEN). There is NO weight_decay, NO augmentation flag, NO unet-depth knob, NO lr-schedule wired. batch_size/val_chunk are FORCED to 1 by the per-sample-ps path. So the ONLY genuinely-untried in-budget single knob is SEED, fixed at 42 across all 8 iters. With every LIFT lever mapped, the honest iter-9 is the clean noise-floor CONFIRMATION that documents 0.4158 as the budget-constrained ceiling. (3) ONE KNOB: seed 42 -> 123. seed drives BOTH torch.manual_seed (U-Net init) AND the LDCT noise realization (line 112 train uses seed, line 114 val uses seed+1000), so it is the genuine init+noise-floor read. ZERO extra compute -- a seed change does not alter per-epoch cost, so the pinned ep10 wall stays SAFE (no epoch trade). (4) HYPOTHESIS: a fresh seed leaves hr within the per-init noise band of 0.4158 (|delta| <~ 0.003-0.005, same band the lr/lambda_neg micro-regressions sit in: 0.4158/0.4140/0.4133 span only 0.0025). FALSIFIER (NUMBERS): if hr > 0.418794 (0.4158 + 0.003) at seed=123, the iter-6 read was seed-lucky-LOW and dd_sup actually clears itnet_v2 0.4187 -> the podium re-shuffles and the ceiling is NOT yet documented (re-read with a 3rd seed). If hr <= 0.418794 (the expected case, incl. any drop), then dd_sup is CONFIRMED at its DEFINITIVE budget-constrained Mayo CEILING 0.4158 with ALL knobs mapped -- file the champion-ceiling verdict toward iter-20. PREDICTED iter-9 hr ~0.413-0.417 (near 0.4158, most likely just under). (5) BUDGET: seed change does NOT alter per-epoch cost -> ep10/train_n=579 stays ~1172s (19.5 min), inside the 1200s train+score wall and the 30-min sbatch wall; no epoch trade. val=ALL 214 L277 slices. (6) no control return. HARD-WIRED (unchanged): staged_canonical v3 mayo_ldct_fitted geometry, per-sample-ps FBP + per-sample pipe.R_full swap, bg_target=truth, metric=321px detector-geometry FOV default, grad_clip=1.0 retained.", "advice_for_others": "dual_domain_supervised-claude-agentic: unet_c=16, lr=0.0001, epochs=10, batch_size=1, val_chunk=1, train_n=579, val_n=214, grad_clip=1.0, lambda_neg=1.0, seed=123, rationale=ITER-9 (search-20260619-01). BASE_ITER=6 (CHAMPION: unet_c=16/lr=1e-4/epochs=10/train_n=579/lambda_neg=1.0/grad_clip=1.0/seed=42, hr 0.415794, #2 on the Mayo board behind itnet_v2 0.4187). ONE KNOB (init+noise-realization): seed 42 -> 123. CONFIRMATION READ, not a lift attempt. SIX-BOX (NUMBERS). (1) TRAJECTORY: ep8/n200 hr0.276 -> ep20 0.339 -> ep27 0.3654 -> ep9/n579 0.3994 -> ep10/n579 0.4158 (iter-6 CHAMPION+BEST) -> iter-7 lr1.5e-4 REGRESSED 0.4133 -> iter-8 lambda_neg0.1 0.4140 (did NOT beat 0.4158). CURRENT BEST = iter-6 hr 0.415794 / SSIM 0.93261. (2) LIMITER: ALL FIVE lift levers are now MAPPED and EXHAUSTED -- epochs WALL-PINNED at 10 (ep10 used 1172/1200s; ep11=1262s BUSTS the 20-min wall), data coverage MAXED (train_n=579 = the ENTIRE Wagner pool, cannot rise), capacity REGRESSED (iter-4 c24/ep10 -> 0.29856, trading epochs to fund 2.25x conv-compute under-trained the bigger net), lr REGRESSED (iter-7 1.5e-4 -> 0.4133), lambda_neg flat (iter-8 0.1 -> 0.4140, the prior-TPE 0.1-best hint did NOT transfer under the corrected 214-slice/321px-FOV metric). I enumerated EVERY cfg knob the solver actually reads (solver_dual_ddomain_supervised.py): seed, train_n, epochs, unet_c, lr, lambda_neg, grad_clip, batch_size, val_chunk -- plus loss base hard-coded base=mse at line 168 (NOT a cfg knob; changing it would edit the shared solver = FORBIDDEN). There is NO weight_decay, NO augmentation flag, NO unet-depth knob, NO lr-schedule wired. batch_size/val_chunk are FORCED to 1 by the per-sample-ps path. So the ONLY genuinely-untried in-budget single knob is SEED, fixed at 42 across all 8 iters. With every LIFT lever mapped, the honest iter-9 is the clean noise-floor CONFIRMATION that documents 0.4158 as the budget-constrained ceiling. (3) ONE KNOB: seed 42 -> 123. seed drives BOTH torch.manual_seed (U-Net init) AND the LDCT noise realization (line 112 train uses seed, line 114 val uses seed+1000), so it is the genuine init+noise-floor read. ZERO extra compute -- a seed change does not alter per-epoch cost, so the pinned ep10 wall stays SAFE (no epoch trade). (4) HYPOTHESIS: a fresh seed leaves hr within the per-init noise band of 0.4158 (|delta| <~ 0.003-0.005, same band the lr/lambda_neg micro-regressions sit in: 0.4158/0.4140/0.4133 span only 0.0025). FALSIFIER (NUMBERS): if hr > 0.418794 (0.4158 + 0.003) at seed=123, the iter-6 read was seed-lucky-LOW and dd_sup actually clears itnet_v2 0.4187 -> the podium re-shuffles and the ceiling is NOT yet documented (re-read with a 3rd seed). If hr <= 0.418794 (the expected case, incl. any drop), then dd_sup is CONFIRMED at its DEFINITIVE budget-constrained Mayo CEILING 0.4158 with ALL knobs mapped -- file the champion-ceiling verdict toward iter-20. PREDICTED iter-9 hr ~0.413-0.417 (near 0.4158, most likely just under). (5) BUDGET: seed change does NOT alter per-epoch cost -> ep10/train_n=579 stays ~1172s (19.5 min), inside the 1200s train+score wall and the 30-min sbatch wall; no epoch trade. val=ALL 214 L277 slices. (6) no control return. HARD-WIRED (unchanged): staged_canonical v3 mayo_ldct_fitted geometry, per-sample-ps FBP + per-sample pipe.R_full swap, bg_target=truth, metric=321px detector-geometry FOV default, grad_clip=1.0 retained.", "comparison_image": "runs/mayo-ldct-claude-agentic-dual-domain-supervised-search-20260619-01/iterations/iter-0009/comparison.png"}
{"ts": "2026-06-21T13:21:43Z", "run_id": "mayo-ldct-claude-agentic-itnet-search-20260619-01", "iter": 9, "agent": "itnet-claude-agentic", "model": "claude-opus-4-8-1m", "change_class": "architecture", "status": "keep", "kept": true, "val_score": 0.9447472095489502, "headroom": 0.43439574709529627, "params_M": 0.232881, "train_n": 400, "rationale": "itnet-claude-agentic: pretrain_epochs=66, pretrain_lr=0.0001, itnet_k=1, itnet_alpha=0.005, unet_c=16, finetune_epochs=0, finetune_lr=0.0001, train_n=579, val_n=214, grad_clip=1.0, seed=42, rationale=ITER-9 (search-20260619-01, corrected 214-slice/321px-FOV metric) for itnet = ItNet v1 (pretrain-denoiser-then-FIXED-DC k=1, solver_itnet.py). SIX-BOX (NUMBERS, not CT pixels). (1) TRAJECTORY (val=ALL 214 L277, 321px FOV; hr=metric of record): iter-1 ep8/tn200 k3 SSIM 0.4413/hr 0.000; iter-2 ep48 0.5927/0; iter-3 ep160 0.6430/0; iter-4 ep220 0.7022/0; iter-5 ep140/tn300 0.6932/0 (all k=3, all hr 0). iter-6 itnet_k 3->1 BROKE THE FLOOR: SSIM 0.9332/hr 0.3752 (tn200 ep200). iter-7 train_n 200->300 LIFTED hr 0.3752->0.3989 (SSIM 0.9377). iter-8 train_n 300->480 (ep80, GRAD-STEP-PARITY BACKSTOP) LIFTED hr 0.3989->0.4143 (SSIM 0.9408, elapsed 1162.1s, #4 on the Mayo board). CURRENT train_n=480 = ~83%% of the 579-slice train pool. The DATA-COVERAGE lever is STILL CLIMBING (+0.0237 then +0.0154) and NOT yet exhausted. (2) LIMITER (k=1 fixed=the breakthrough; pretrain_epochs plateaued in diminishing-returns iters 1-4): the trained SmallUNet denoiser (params_M 0.2329) is data-coverage-bounded. itnet loads a FIXED stratified train subset ONCE via load_val_split(n=train_n)+randperm, NO rotation; tn480 still misses ~17%% of the 579-slice pool (3 ps-groups: 154 @0.66192, 98 @0.73979, 327 @0.77873). Campaign doc confirms train_n is the live lever; the v1 data probes iters 6->7->8 confirmed it ON THIS SOLVER (+0.0237, +0.0154). itnet_v2 took the SAME 400->579 full-pool step to the champion spot (hr 0.4187->0.4302). (3) ONE KNOB: train_n 480 -> 579 (FULL 579-slice pool, +17%% data coverage, from BASE_ITER=8). This is the LAST data-coverage step (100%% pool). pretrain_epochs 80 -> 66 is the BUDGET BACKSTOP (NOT a 2nd hypothesis-knob) at GRAD-STEP PARITY: grad steps 579x66=38214 vs iter-8 480x80=38400 (-0.5%%), so the change ISOLATES DATA COVERAGE from extra optimization. KEEP itnet_k=1 (the breakthrough). All else identical to iter-8 (itnet_alpha=0.005, unet_c=16, pretrain_lr=1e-4, val_n=214, grad_clip=1.0, seed=42). (4) HYPOTHESIS: full-pool coverage (83%%->100%%) lifts hr ABOVE 0.4143 toward/past the 0.42 leaders (itnet_v2 0.4302, dd_sup, uswin), predict ~0.418-0.425, tracking the v1 train_n gains and the itnet_v2 400->579 full-pool +0.0115 step. FALSIFIER (operative, NUMERIC): if hr <= 0.4143 at train_n=579/k=1, the data-coverage lever SATURATES for v1 (denoiser is FBP-information-bounded, not data-limited) -> document saturation; the next lever is a different axis (capacity unet_c / alpha / pretrain_epochs back up at full pool). (5) BUDGET (HARD 20-min = 1200s train+score; sbatch 30-min wall is the only hard fence): iter-8 ACTUAL 1162.1s @ tn480/ep80 (38400 grad steps). Decompose: fixed (data load + 214-slice per-sample val + figure + startup) ~185s; pretrain ~977s over 38400 grad steps = 0.02545 s/grad-step. iter-9 38214 grad steps -> 0.02545*38214 = 973s + 185s fixed = ~1158s = 19.3 min, INSIDE the 1200s HARD wall with ~42s margin and BELOW iter-8 1162.1s (ep67 would predict 1172s, tighter, so ep66 is the safe parity probe). val stays ALL 214 L277 slices, 321px detector-geometry FOV (default; NO fov= override). grad_clip=1.0 retained (mandatory: the 2304-view Mayo FBP adjoint inside the DC step overflows otherwise). v1 has NO max_train_s backstop. (6) Loop continues -- no control returned. HARD-WIRED (unchanged): staged_canonical data, v3 mayo_ldct_fitted geometry, per-sample-ps (each val slice swaps itnet.projector to its own ps; chunk=1 FORCED), bg_target=truth, KEEP itnet_k=1, val=ALL 214 L277 slices under the 321px detector-geometry FOV (evaluate_calibrated default for AGENT4CT_DATASET=mayo_ldct_2d; NO fov= override).", "advice_for_others": "itnet-claude-agentic: pretrain_epochs=66, pretrain_lr=0.0001, itnet_k=1, itnet_alpha=0.005, unet_c=16, finetune_epochs=0, finetune_lr=0.0001, train_n=579, val_n=214, grad_clip=1.0, seed=42, rationale=ITER-9 (search-20260619-01, corrected 214-slice/321px-FOV metric) for itnet = ItNet v1 (pretrain-denoiser-then-FIXED-DC k=1, solver_itnet.py). SIX-BOX (NUMBERS, not CT pixels). (1) TRAJECTORY (val=ALL 214 L277, 321px FOV; hr=metric of record): iter-1 ep8/tn200 k3 SSIM 0.4413/hr 0.000; iter-2 ep48 0.5927/0; iter-3 ep160 0.6430/0; iter-4 ep220 0.7022/0; iter-5 ep140/tn300 0.6932/0 (all k=3, all hr 0). iter-6 itnet_k 3->1 BROKE THE FLOOR: SSIM 0.9332/hr 0.3752 (tn200 ep200). iter-7 train_n 200->300 LIFTED hr 0.3752->0.3989 (SSIM 0.9377). iter-8 train_n 300->480 (ep80, GRAD-STEP-PARITY BACKSTOP) LIFTED hr 0.3989->0.4143 (SSIM 0.9408, elapsed 1162.1s, #4 on the Mayo board). CURRENT train_n=480 = ~83%% of the 579-slice train pool. The DATA-COVERAGE lever is STILL CLIMBING (+0.0237 then +0.0154) and NOT yet exhausted. (2) LIMITER (k=1 fixed=the breakthrough; pretrain_epochs plateaued in diminishing-returns iters 1-4): the trained SmallUNet denoiser (params_M 0.2329) is data-coverage-bounded. itnet loads a FIXED stratified train subset ONCE via load_val_split(n=train_n)+randperm, NO rotation; tn480 still misses ~17%% of the 579-slice pool (3 ps-groups: 154 @0.66192, 98 @0.73979, 327 @0.77873). Campaign doc confirms train_n is the live lever; the v1 data probes iters 6->7->8 confirmed it ON THIS SOLVER (+0.0237, +0.0154). itnet_v2 took the SAME 400->579 full-pool step to the champion spot (hr 0.4187->0.4302). (3) ONE KNOB: train_n 480 -> 579 (FULL 579-slice pool, +17%% data coverage, from BASE_ITER=8). This is the LAST data-coverage step (100%% pool). pretrain_epochs 80 -> 66 is the BUDGET BACKSTOP (NOT a 2nd hypothesis-knob) at GRAD-STEP PARITY: grad steps 579x66=38214 vs iter-8 480x80=38400 (-0.5%%), so the change ISOLATES DATA COVERAGE from extra optimization. KEEP itnet_k=1 (the breakthrough). All else identical to iter-8 (itnet_alpha=0.005, unet_c=16, pretrain_lr=1e-4, val_n=214, grad_clip=1.0, seed=42). (4) HYPOTHESIS: full-pool coverage (83%%->100%%) lifts hr ABOVE 0.4143 toward/past the 0.42 leaders (itnet_v2 0.4302, dd_sup, uswin), predict ~0.418-0.425, tracking the v1 train_n gains and the itnet_v2 400->579 full-pool +0.0115 step. FALSIFIER (operative, NUMERIC): if hr <= 0.4143 at train_n=579/k=1, the data-coverage lever SATURATES for v1 (denoiser is FBP-information-bounded, not data-limited) -> document saturation; the next lever is a different axis (capacity unet_c / alpha / pretrain_epochs back up at full pool). (5) BUDGET (HARD 20-min = 1200s train+score; sbatch 30-min wall is the only hard fence): iter-8 ACTUAL 1162.1s @ tn480/ep80 (38400 grad steps). Decompose: fixed (data load + 214-slice per-sample val + figure + startup) ~185s; pretrain ~977s over 38400 grad steps = 0.02545 s/grad-step. iter-9 38214 grad steps -> 0.02545*38214 = 973s + 185s fixed = ~1158s = 19.3 min, INSIDE the 1200s HARD wall with ~42s margin and BELOW iter-8 1162.1s (ep67 would predict 1172s, tighter, so ep66 is the safe parity probe). val stays ALL 214 L277 slices, 321px detector-geometry FOV (default; NO fov= override). grad_clip=1.0 retained (mandatory: the 2304-view Mayo FBP adjoint inside the DC step overflows otherwise). v1 has NO max_train_s backstop. (6) Loop continues -- no control returned. HARD-WIRED (unchanged): staged_canonical data, v3 mayo_ldct_fitted geometry, per-sample-ps (each val slice swaps itnet.projector to its own ps; chunk=1 FORCED), bg_target=truth, KEEP itnet_k=1, val=ALL 214 L277 slices under the 321px detector-geometry FOV (evaluate_calibrated default for AGENT4CT_DATASET=mayo_ldct_2d; NO fov= override).", "comparison_image": "runs/mayo-ldct-claude-agentic-itnet-search-20260619-01/iterations/iter-0009/comparison.png"}
{"ts": "2026-06-21T13:13:26Z", "run_id": "mayo-ldct-claude-agentic-uswin-search-20260619-01", "iter": 9, "agent": "uswin-claude-agentic", "model": "claude-opus-4-8-1m", "change_class": "architecture", "status": "keep", "kept": true, "val_score": 0.9356609582901001, "headroom": 0.4101875180953437, "params_M": 3.954049, "train_n": 400, "rationale": "uswin-claude-agentic: train_n=579, val_n=214, epochs=22, batch_size=4, lr=0.0003, uswin_c=24, swin_window=8, swin_heads=4, grad_clip=1.0, max_train_s=960, seed=42, rationale=iter-9 lr 5e-4->3e-4 from iter-7 best; untried optimization-quality lever at the full-pool/ep22 basin (epochs plateaued+overshot, data maxed, capacity regressed)", "advice_for_others": "uswin-claude-agentic: train_n=579, val_n=214, epochs=22, batch_size=4, lr=0.0003, uswin_c=24, swin_window=8, swin_heads=4, grad_clip=1.0, max_train_s=960, seed=42, rationale=iter-9 lr 5e-4->3e-4 from iter-7 best; untried optimization-quality lever at the full-pool/ep22 basin (epochs plateaued+overshot, data maxed, capacity regressed)", "comparison_image": "runs/mayo-ldct-claude-agentic-uswin-search-20260619-01/iterations/iter-0009/comparison.png"}
